[80857 ms] UsbSnoop - FilterDispatchAny(f76d7fd2) : IRP_MJ_INTERNAL_DEVICE_CONTROL
[80857 ms] UsbSnoop - FdoHookDispatchInternalIoctl(f76d81ea) : fdo=861c0730, Irp=85abbaf0, IRQL=0
[80858 ms]  >>>  URB 5 going down  >>> 
-- URB_FUNCTION_RESET_PIPE:
  PipeHandle = 866db8ec [endpoint 0x00000002]
[80858 ms] UsbSnoop - MyInternalIOCTLCompletion(f76d8126) : fido=85e673d0, Irp=85abbaf0, Context=86a80f80, IRQL=0
[80858 ms]  <<<  URB 5 coming back  <<< 
-- URB_FUNCTION_RESET_PIPE:
[80858 ms] UsbSnoop - FilterDispatchAny(f76d7fd2) : IRP_MJ_INTERNAL_DEVICE_CONTROL
[80858 ms] UsbSnoop - FdoHookDispatchInternalIoctl(f76d81ea) : fdo=861c0730, Irp=85abbaf0, IRQL=0
[80859 ms]  >>>  URB 6 going down  >>> 
-- URB_FUNCTION_RESET_PIPE:
  PipeHandle = 866db8cc [endpoint 0x00000081]
[80859 ms] UsbSnoop - MyInternalIOCTLCompletion(f76d8126) : fido=85e673d0, Irp=85abbaf0, Context=86a80f80, IRQL=0
[80859 ms]  <<<  URB 6 coming back  <<< 
-- URB_FUNCTION_RESET_PIPE:
[80862 ms] UsbSnoop - FilterDispatchAny(f76d7fd2) : IRP_MJ_INTERNAL_DEVICE_CONTROL
[80862 ms] UsbSnoop - FdoHookDispatchInternalIoctl(f76d81ea) : fdo=861c0730, Irp=85a15cd8, IRQL=0
[81027 ms] UsbSnoop - FilterDispatchAny(f76d7fd2) : IRP_MJ_INTERNAL_DEVICE_CONTROL
[81027 ms] UsbSnoop - FdoHookDispatchInternalIoctl(f76d81ea) : fdo=861c0730, Irp=8670c7a0, IRQL=0
[81027 ms]  >>>  URB 7 going down  >>> 
-- URB_FUNCTION_BULK_OR_INTERRUPT_TRANSFER:
  PipeHandle           = 866db8cc [endpoint 0x00000081]
  TransferFlags        = 00000003 (USBD_TRANSFER_DIRECTION_IN, USBD_SHORT_TRANSFER_OK)
  TransferBufferLength = 00000200
  TransferBuffer       = 00000000
  TransferBufferMDL    = 8615e710
  UrbLink              = 00000000
[81051 ms] UsbSnoop - MyInternalIOCTLCompletion(f76d8126) : fido=85e673d0, Irp=8670c7a0, Context=86a80f80, IRQL=2
[81051 ms]  <<<  URB 7 coming back  <<< 
-- URB_FUNCTION_BULK_OR_INTERRUPT_TRANSFER:
  PipeHandle           = 866db8cc [endpoint 0x00000081]
  TransferFlags        = 00000003 (USBD_TRANSFER_DIRECTION_IN, USBD_SHORT_TRANSFER_OK)
  TransferBufferLength = 00000010
  TransferBuffer       = 00000000
  TransferBufferMDL    = 8615e710
    00000000: 54 fd 00 00 40 03 00 00 40 03 00 00 00 22 01 fa
  UrbLink              = 00000000
[81051 ms] UsbSnoop - FilterDispatchAny(f76d7fd2) : IRP_MJ_INTERNAL_DEVICE_CONTROL
[81051 ms] UsbSnoop - FdoHookDispatchInternalIoctl(f76d81ea) : fdo=861c0730, Irp=8670c7a0, IRQL=0
[81052 ms]  >>>  URB 8 going down  >>> 
-- URB_FUNCTION_BULK_OR_INTERRUPT_TRANSFER:
  PipeHandle           = 866db8ec [endpoint 0x00000002]
  TransferFlags        = 00000002 (USBD_TRANSFER_DIRECTION_OUT, USBD_SHORT_TRANSFER_OK)
  TransferBufferLength = 00000014
  TransferBuffer       = 00000000
  TransferBufferMDL    = 85a4de68
    00000000: 54 fd 64 00 40 03 64 01 40 03 13 43 04 00 01 fb
    00000010: 64 01 ff 00
  UrbLink              = 00000000
[81052 ms] UsbSnoop - MyInternalIOCTLCompletion(f76d8126) : fido=85e673d0, Irp=8670c7a0, Context=86a80f80, IRQL=2
[81052 ms]  <<<  URB 8 coming back  <<< 
-- URB_FUNCTION_BULK_OR_INTERRUPT_TRANSFER:
  PipeHandle           = 866db8ec [endpoint 0x00000002]
  TransferFlags        = 00000002 (USBD_TRANSFER_DIRECTION_OUT, USBD_SHORT_TRANSFER_OK)
  TransferBufferLength = 00000014
  TransferBuffer       = 00000000
  TransferBufferMDL    = 85a4de68
  UrbLink              = 00000000
[81052 ms] UsbSnoop - FilterDispatchAny(f76d7fd2) : IRP_MJ_INTERNAL_DEVICE_CONTROL
[81052 ms] UsbSnoop - FdoHookDispatchInternalIoctl(f76d81ea) : fdo=861c0730, Irp=8670c7a0, IRQL=0
[81052 ms]  >>>  URB 9 going down  >>> 
-- URB_FUNCTION_BULK_OR_INTERRUPT_TRANSFER:
  PipeHandle           = 866db8cc [endpoint 0x00000081]
  TransferFlags        = 00000003 (USBD_TRANSFER_DIRECTION_IN, USBD_SHORT_TRANSFER_OK)
  TransferBufferLength = 00000200
  TransferBuffer       = 00000000
  TransferBufferMDL    = 85e5c788
  UrbLink              = 00000000
[95278 ms] UsbSnoop - FilterDispatchAny(f76d7fd2) : IRP_MJ_INTERNAL_DEVICE_CONTROL
[95278 ms] UsbSnoop - FdoHookDispatchInternalIoctl(f76d81ea) : fdo=861c0730, Irp=8581cbc8, IRQL=0
[95278 ms]  >>>  URB 10 going down  >>> 
-- URB_FUNCTION_BULK_OR_INTERRUPT_TRANSFER:
  PipeHandle           = 866db8ec [endpoint 0x00000002]
  TransferFlags        = 00000002 (USBD_TRANSFER_DIRECTION_OUT, USBD_SHORT_TRANSFER_OK)
  TransferBufferLength = 00000011
  TransferBuffer       = 00000000
  TransferBufferMDL    = 86abce70
    00000000: 54 fd 64 00 80 03 64 01 40 20 01 00 01 00 01 00
    00000010: 01
  UrbLink              = 00000000
[95278 ms] UsbSnoop - MyInternalIOCTLCompletion(f76d8126) : fido=85e673d0, Irp=8581cbc8, Context=85b8ca40, IRQL=2
[95278 ms]  <<<  URB 10 coming back  <<< 
-- URB_FUNCTION_BULK_OR_INTERRUPT_TRANSFER:
  PipeHandle           = 866db8ec [endpoint 0x00000002]
  TransferFlags        = 00000002 (USBD_TRANSFER_DIRECTION_OUT, USBD_SHORT_TRANSFER_OK)
  TransferBufferLength = 00000011
  TransferBuffer       = 00000000
  TransferBufferMDL    = 86abce70
  UrbLink              = 00000000
[95279 ms] UsbSnoop - MyInternalIOCTLCompletion(f76d8126) : fido=85e673d0, Irp=8670c7a0, Context=86a80f80, IRQL=2
[95279 ms]  <<<  URB 9 coming back  <<< 
-- URB_FUNCTION_BULK_OR_INTERRUPT_TRANSFER:
  PipeHandle           = 866db8cc [endpoint 0x00000081]
  TransferFlags        = 00000003 (USBD_TRANSFER_DIRECTION_IN, USBD_SHORT_TRANSFER_OK)
  TransferBufferLength = 00000012
  TransferBuffer       = 00000000
  TransferBufferMDL    = 85e5c788
    00000000: 54 fd 64 01 00 ff 64 00 80 03 20 40 02 0a 01 09
    00000010: 40 20
  UrbLink              = 00000000
[95280 ms] UsbSnoop - FilterDispatchAny(f76d7fd2) : IRP_MJ_INTERNAL_DEVICE_CONTROL
[95280 ms] UsbSnoop - FdoHookDispatchInternalIoctl(f76d81ea) : fdo=861c0730, Irp=8670c7a0, IRQL=0
[95280 ms]  >>>  URB 11 going down  >>> 
-- URB_FUNCTION_BULK_OR_INTERRUPT_TRANSFER:
  PipeHandle           = 866db8cc [endpoint 0x00000081]
  TransferFlags        = 00000003 (USBD_TRANSFER_DIRECTION_IN, USBD_SHORT_TRANSFER_OK)
  TransferBufferLength = 00000200
  TransferBuffer       = 00000000
  TransferBufferMDL    = 86a0d728
  UrbLink              = 00000000
[95295 ms] UsbSnoop - MyInternalIOCTLCompletion(f76d8126) : fido=85e673d0, Irp=8670c7a0, Context=86a80f80, IRQL=2
[95295 ms]  <<<  URB 11 coming back  <<< 
-- URB_FUNCTION_BULK_OR_INTERRUPT_TRANSFER:
  PipeHandle           = 866db8cc [endpoint 0x00000081]
  TransferFlags        = 00000003 (USBD_TRANSFER_DIRECTION_IN, USBD_SHORT_TRANSFER_OK)
  TransferBufferLength = 0000007f
  TransferBuffer       = 00000000
  TransferBufferMDL    = 86a0d728
    00000000: 54 fd 64 01 40 20 64 00 80 03 ea d8 6f 00 01 2f
    00000010: 01 00 00 00 00 01 65 42 00 00 00 00 00 01 be 00
    00000020: 00 00 00 00 00 01 4f a7 94 00 00 00 00 01 83 5f
    00000030: 2c 7f 00 00 5a 01 01 24 25 01 01 22 d4 01 01 23
    00000040: 15 00 00 00 00 00 02 00 00 00 00 01 40 00 f0 04
    00000050: 00 1e 30 30 30 30 34 42 43 31 42 31 30 45 35 37
    00000060: 30 46 00 30 45 30 30 30 30 30 34 42 43 31 42 31
    00000070: 30 45 35 37 30 46 43 42 32 38 30 34 46 31 00
  UrbLink              = 00000000
[95296 ms] UsbSnoop - FilterDispatchAny(f76d7fd2) : IRP_MJ_INTERNAL_DEVICE_CONTROL
[95296 ms] UsbSnoop - FdoHookDispatchInternalIoctl(f76d81ea) : fdo=861c0730, Irp=8670c7a0, IRQL=0
[95296 ms]  >>>  URB 12 going down  >>> 
-- URB_FUNCTION_BULK_OR_INTERRUPT_TRANSFER:
  PipeHandle           = 866db8ec [endpoint 0x00000002]
  TransferFlags        = 00000002 (USBD_TRANSFER_DIRECTION_OUT, USBD_SHORT_TRANSFER_OK)
  TransferBufferLength = 00000012
  TransferBuffer       = 00000000
  TransferBufferMDL    = 85e5c788
    00000000: 54 fd 64 00 00 ff 64 01 40 20 03 80 02 0a 01 09
    00000010: 80 03
  UrbLink              = 00000000
[95296 ms] UsbSnoop - MyInternalIOCTLCompletion(f76d8126) : fido=85e673d0, Irp=8670c7a0, Context=86a80f80, IRQL=2
[95296 ms]  <<<  URB 12 coming back  <<< 
-- URB_FUNCTION_BULK_OR_INTERRUPT_TRANSFER:
  PipeHandle           = 866db8ec [endpoint 0x00000002]
  TransferFlags        = 00000002 (USBD_TRANSFER_DIRECTION_OUT, USBD_SHORT_TRANSFER_OK)
  TransferBufferLength = 00000012
  TransferBuffer       = 00000000
  TransferBufferMDL    = 85e5c788
  UrbLink              = 00000000
[95297 ms] UsbSnoop - FilterDispatchAny(f76d7fd2) : IRP_MJ_INTERNAL_DEVICE_CONTROL
[95297 ms] UsbSnoop - FdoHookDispatchInternalIoctl(f76d81ea) : fdo=861c0730, Irp=8670c7a0, IRQL=0
[95297 ms]  >>>  URB 13 going down  >>> 
-- URB_FUNCTION_BULK_OR_INTERRUPT_TRANSFER:
  PipeHandle           = 866db8cc [endpoint 0x00000081]
  TransferFlags        = 00000003 (USBD_TRANSFER_DIRECTION_IN, USBD_SHORT_TRANSFER_OK)
  TransferBufferLength = 00000200
  TransferBuffer       = 00000000
  TransferBufferMDL    = 86a0d728
  UrbLink              = 00000000
[95297 ms] UsbSnoop - FilterDispatchAny(f76d7fd2) : IRP_MJ_INTERNAL_DEVICE_CONTROL
[95297 ms] UsbSnoop - FdoHookDispatchInternalIoctl(f76d81ea) : fdo=861c0730, Irp=859f1cd0, IRQL=0
[95297 ms]  >>>  URB 14 going down  >>> 
-- URB_FUNCTION_BULK_OR_INTERRUPT_TRANSFER:
  PipeHandle           = 866db8ec [endpoint 0x00000002]
  TransferFlags        = 00000002 (USBD_TRANSFER_DIRECTION_OUT, USBD_SHORT_TRANSFER_OK)
  TransferBufferLength = 00000011
  TransferBuffer       = 00000000
  TransferBufferMDL    = 86abce70
    00000000: 54 fd 64 00 80 03 64 01 40 20 02 00 01 00 02 02
    00000010: 02
  UrbLink              = 00000000
[95297 ms] UsbSnoop - MyInternalIOCTLCompletion(f76d8126) : fido=85e673d0, Irp=859f1cd0, Context=85b8ca40, IRQL=2
[95297 ms]  <<<  URB 14 coming back  <<< 
-- URB_FUNCTION_BULK_OR_INTERRUPT_TRANSFER:
  PipeHandle           = 866db8ec [endpoint 0x00000002]
  TransferFlags        = 00000002 (USBD_TRANSFER_DIRECTION_OUT, USBD_SHORT_TRANSFER_OK)
  TransferBufferLength = 00000011
  TransferBuffer       = 00000000
  TransferBufferMDL    = 86abce70
  UrbLink              = 00000000
[95299 ms] UsbSnoop - MyInternalIOCTLCompletion(f76d8126) : fido=85e673d0, Irp=8670c7a0, Context=86a80f80, IRQL=2
[95299 ms]  <<<  URB 13 coming back  <<< 
-- URB_FUNCTION_BULK_OR_INTERRUPT_TRANSFER:
  PipeHandle           = 866db8cc [endpoint 0x00000081]
  TransferFlags        = 00000003 (USBD_TRANSFER_DIRECTION_IN, USBD_SHORT_TRANSFER_OK)
  TransferBufferLength = 00000012
  TransferBuffer       = 00000000
  TransferBufferMDL    = 86a0d728
    00000000: 54 fd 64 01 00 ff 64 00 80 03 20 40 02 0a 02 0a
    00000010: 40 20
  UrbLink              = 00000000
[95300 ms] UsbSnoop - FilterDispatchAny(f76d7fd2) : IRP_MJ_INTERNAL_DEVICE_CONTROL
[95300 ms] UsbSnoop - FdoHookDispatchInternalIoctl(f76d81ea) : fdo=861c0730, Irp=8581cbc8, IRQL=0
[95300 ms]  >>>  URB 15 going down  >>> 
-- URB_FUNCTION_BULK_OR_INTERRUPT_TRANSFER:
  PipeHandle           = 866db8cc [endpoint 0x00000081]
  TransferFlags        = 00000003 (USBD_TRANSFER_DIRECTION_IN, USBD_SHORT_TRANSFER_OK)
  TransferBufferLength = 00000200
  TransferBuffer       = 00000000
  TransferBufferMDL    = 86abce70
  UrbLink              = 00000000
[95303 ms] UsbSnoop - MyInternalIOCTLCompletion(f76d8126) : fido=85e673d0, Irp=8581cbc8, Context=86a80f80, IRQL=2
[95303 ms]  <<<  URB 15 coming back  <<< 
-- URB_FUNCTION_BULK_OR_INTERRUPT_TRANSFER:
  PipeHandle           = 866db8cc [endpoint 0x00000081]
  TransferFlags        = 00000003 (USBD_TRANSFER_DIRECTION_IN, USBD_SHORT_TRANSFER_OK)
  TransferBufferLength = 0000001b
  TransferBuffer       = 00000000
  TransferBufferMDL    = 86abce70
    00000000: 54 fd 64 01 40 20 64 00 80 03 38 5a 0b 00 02 9c
    00000010: 02 54 49 2d 4e 73 70 69 72 65 00
  UrbLink              = 00000000
[95304 ms] UsbSnoop - FilterDispatchAny(f76d7fd2) : IRP_MJ_INTERNAL_DEVICE_CONTROL
[95304 ms] UsbSnoop - FdoHookDispatchInternalIoctl(f76d81ea) : fdo=861c0730, Irp=8581cbc8, IRQL=0
[95304 ms]  >>>  URB 16 going down  >>> 
-- URB_FUNCTION_BULK_OR_INTERRUPT_TRANSFER:
  PipeHandle           = 866db8ec [endpoint 0x00000002]
  TransferFlags        = 00000002 (USBD_TRANSFER_DIRECTION_OUT, USBD_SHORT_TRANSFER_OK)
  TransferBufferLength = 00000012
  TransferBuffer       = 00000000
  TransferBufferMDL    = 85e5c788
    00000000: 54 fd 64 00 00 ff 64 01 40 20 03 80 02 0a 02 0a
    00000010: 80 03
  UrbLink              = 00000000
[95304 ms] UsbSnoop - MyInternalIOCTLCompletion(f76d8126) : fido=85e673d0, Irp=8581cbc8, Context=86a80f80, IRQL=2
[95304 ms]  <<<  URB 16 coming back  <<< 
-- URB_FUNCTION_BULK_OR_INTERRUPT_TRANSFER:
  PipeHandle           = 866db8ec [endpoint 0x00000002]
  TransferFlags        = 00000002 (USBD_TRANSFER_DIRECTION_OUT, USBD_SHORT_TRANSFER_OK)
  TransferBufferLength = 00000012
  TransferBuffer       = 00000000
  TransferBufferMDL    = 85e5c788
  UrbLink              = 00000000
[95305 ms] UsbSnoop - FilterDispatchAny(f76d7fd2) : IRP_MJ_INTERNAL_DEVICE_CONTROL
[95305 ms] UsbSnoop - FdoHookDispatchInternalIoctl(f76d81ea) : fdo=861c0730, Irp=8581bbc8, IRQL=0
[95305 ms]  >>>  URB 17 going down  >>> 
-- URB_FUNCTION_BULK_OR_INTERRUPT_TRANSFER:
  PipeHandle           = 866db8cc [endpoint 0x00000081]
  TransferFlags        = 00000003 (USBD_TRANSFER_DIRECTION_IN, USBD_SHORT_TRANSFER_OK)
  TransferBufferLength = 00000200
  TransferBuffer       = 00000000
  TransferBufferMDL    = 86abce70
  UrbLink              = 00000000
[95305 ms] UsbSnoop - FilterDispatchAny(f76d7fd2) : IRP_MJ_INTERNAL_DEVICE_CONTROL
[95305 ms] UsbSnoop - FdoHookDispatchInternalIoctl(f76d81ea) : fdo=861c0730, Irp=8581cbc8, IRQL=0
[95305 ms]  >>>  URB 18 going down  >>> 
-- URB_FUNCTION_BULK_OR_INTERRUPT_TRANSFER:
  PipeHandle           = 866db8ec [endpoint 0x00000002]
  TransferFlags        = 00000002 (USBD_TRANSFER_DIRECTION_OUT, USBD_SHORT_TRANSFER_OK)
  TransferBufferLength = 00000011
  TransferBuffer       = 00000000
  TransferBufferMDL    = 86544868
    00000000: 54 fd 64 00 80 03 64 01 40 20 03 00 01 00 03 04
    00000010: 03
  UrbLink              = 00000000
[95305 ms] UsbSnoop - MyInternalIOCTLCompletion(f76d8126) : fido=85e673d0, Irp=8581cbc8, Context=85b8ca40, IRQL=2
[95305 ms]  <<<  URB 18 coming back  <<< 
-- URB_FUNCTION_BULK_OR_INTERRUPT_TRANSFER:
  PipeHandle           = 866db8ec [endpoint 0x00000002]
  TransferFlags        = 00000002 (USBD_TRANSFER_DIRECTION_OUT, USBD_SHORT_TRANSFER_OK)
  TransferBufferLength = 00000011
  TransferBuffer       = 00000000
  TransferBufferMDL    = 86544868
  UrbLink              = 00000000
[95306 ms] UsbSnoop - MyInternalIOCTLCompletion(f76d8126) : fido=85e673d0, Irp=8581bbc8, Context=86a80f80, IRQL=2
[95306 ms]  <<<  URB 17 coming back  <<< 
-- URB_FUNCTION_BULK_OR_INTERRUPT_TRANSFER:
  PipeHandle           = 866db8cc [endpoint 0x00000081]
  TransferFlags        = 00000003 (USBD_TRANSFER_DIRECTION_IN, USBD_SHORT_TRANSFER_OK)
  TransferBufferLength = 00000012
  TransferBuffer       = 00000000
  TransferBufferMDL    = 86abce70
    00000000: 54 fd 64 01 00 ff 64 00 80 03 20 40 02 0a 03 0b
    00000010: 40 20
  UrbLink              = 00000000
[95307 ms] UsbSnoop - FilterDispatchAny(f76d7fd2) : IRP_MJ_INTERNAL_DEVICE_CONTROL
[95307 ms] UsbSnoop - FdoHookDispatchInternalIoctl(f76d81ea) : fdo=861c0730, Irp=8581bbc8, IRQL=0
[95307 ms]  >>>  URB 19 going down  >>> 
-- URB_FUNCTION_BULK_OR_INTERRUPT_TRANSFER:
  PipeHandle           = 866db8cc [endpoint 0x00000081]
  TransferFlags        = 00000003 (USBD_TRANSFER_DIRECTION_IN, USBD_SHORT_TRANSFER_OK)
  TransferBufferLength = 00000200
  TransferBuffer       = 00000000
  TransferBufferMDL    = 86a0d728
  UrbLink              = 00000000
[95310 ms] UsbSnoop - MyInternalIOCTLCompletion(f76d8126) : fido=85e673d0, Irp=8581bbc8, Context=86a80f80, IRQL=2
[95310 ms]  <<<  URB 19 coming back  <<< 
-- URB_FUNCTION_BULK_OR_INTERRUPT_TRANSFER:
  PipeHandle           = 866db8cc [endpoint 0x00000081]
  TransferFlags        = 00000003 (USBD_TRANSFER_DIRECTION_IN, USBD_SHORT_TRANSFER_OK)
  TransferBufferLength = 0000001b
  TransferBuffer       = 00000000
  TransferBufferMDL    = 86a0d728
    00000000: 54 fd 64 01 40 20 64 00 80 03 96 7f 0b 00 03 20
    00000010: 03 2e 74 6e 73 00 2e 74 6e 6f 00
  UrbLink              = 00000000
[95311 ms] UsbSnoop - FilterDispatchAny(f76d7fd2) : IRP_MJ_INTERNAL_DEVICE_CONTROL
[95311 ms] UsbSnoop - FdoHookDispatchInternalIoctl(f76d81ea) : fdo=861c0730, Irp=8581bbc8, IRQL=0
[95311 ms]  >>>  URB 20 going down  >>> 
-- URB_FUNCTION_BULK_OR_INTERRUPT_TRANSFER:
  PipeHandle           = 866db8ec [endpoint 0x00000002]
  TransferFlags        = 00000002 (USBD_TRANSFER_DIRECTION_OUT, USBD_SHORT_TRANSFER_OK)
  TransferBufferLength = 00000012
  TransferBuffer       = 00000000
  TransferBufferMDL    = 86a0d728
    00000000: 54 fd 64 00 00 ff 64 01 40 20 03 80 02 0a 03 0b
    00000010: 80 03
  UrbLink              = 00000000
[95311 ms] UsbSnoop - MyInternalIOCTLCompletion(f76d8126) : fido=85e673d0, Irp=8581bbc8, Context=86a80f80, IRQL=2
[95311 ms]  <<<  URB 20 coming back  <<< 
-- URB_FUNCTION_BULK_OR_INTERRUPT_TRANSFER:
  PipeHandle           = 866db8ec [endpoint 0x00000002]
  TransferFlags        = 00000002 (USBD_TRANSFER_DIRECTION_OUT, USBD_SHORT_TRANSFER_OK)
  TransferBufferLength = 00000012
  TransferBuffer       = 00000000
  TransferBufferMDL    = 86a0d728
  UrbLink              = 00000000
[95312 ms] UsbSnoop - FilterDispatchAny(f76d7fd2) : IRP_MJ_INTERNAL_DEVICE_CONTROL
[95312 ms] UsbSnoop - FdoHookDispatchInternalIoctl(f76d81ea) : fdo=861c0730, Irp=8581bbc8, IRQL=0
[95312 ms]  >>>  URB 21 going down  >>> 
-- URB_FUNCTION_BULK_OR_INTERRUPT_TRANSFER:
  PipeHandle           = 866db8cc [endpoint 0x00000081]
  TransferFlags        = 00000003 (USBD_TRANSFER_DIRECTION_IN, USBD_SHORT_TRANSFER_OK)
  TransferBufferLength = 00000200
  TransferBuffer       = 00000000
  TransferBufferMDL    = 86544868
  UrbLink              = 00000000
[95312 ms] UsbSnoop - FilterDispatchAny(f76d7fd2) : IRP_MJ_INTERNAL_DEVICE_CONTROL
[95312 ms] UsbSnoop - FdoHookDispatchInternalIoctl(f76d81ea) : fdo=861c0730, Irp=8581cbc8, IRQL=0
[95312 ms]  >>>  URB 22 going down  >>> 
-- URB_FUNCTION_BULK_OR_INTERRUPT_TRANSFER:
  PipeHandle           = 866db8ec [endpoint 0x00000002]
  TransferFlags        = 00000002 (USBD_TRANSFER_DIRECTION_OUT, USBD_SHORT_TRANSFER_OK)
  TransferBufferLength = 00000012
  TransferBuffer       = 00000000
  TransferBufferMDL    = 86a0d728
    00000000: 54 fd 64 00 40 de 64 01 40 20 03 80 02 00 04 21
    00000010: 80 03
  UrbLink              = 00000000
[95312 ms] UsbSnoop - MyInternalIOCTLCompletion(f76d8126) : fido=85e673d0, Irp=8581cbc8, Context=85b8ca40, IRQL=2
[95312 ms]  <<<  URB 22 coming back  <<< 
-- URB_FUNCTION_BULK_OR_INTERRUPT_TRANSFER:
  PipeHandle           = 866db8ec [endpoint 0x00000002]
  TransferFlags        = 00000002 (USBD_TRANSFER_DIRECTION_OUT, USBD_SHORT_TRANSFER_OK)
  TransferBufferLength = 00000012
  TransferBuffer       = 00000000
  TransferBufferMDL    = 86a0d728
  UrbLink              = 00000000
[95314 ms] UsbSnoop - MyInternalIOCTLCompletion(f76d8126) : fido=85e673d0, Irp=8581bbc8, Context=86a80f80, IRQL=2
[95314 ms]  <<<  URB 21 coming back  <<< 
-- URB_FUNCTION_BULK_OR_INTERRUPT_TRANSFER:
  PipeHandle           = 866db8cc [endpoint 0x00000081]
  TransferFlags        = 00000003 (USBD_TRANSFER_DIRECTION_IN, USBD_SHORT_TRANSFER_OK)
  TransferBufferLength = 00000012
  TransferBuffer       = 00000000
  TransferBufferMDL    = 86544868
    00000000: 54 fd 64 01 00 ff 64 00 80 03 20 40 02 0a 04 0c
    00000010: 40 20
  UrbLink              = 00000000
[95315 ms] UsbSnoop - FilterDispatchAny(f76d7fd2) : IRP_MJ_INTERNAL_DEVICE_CONTROL
[95315 ms] UsbSnoop - FdoHookDispatchInternalIoctl(f76d81ea) : fdo=861c0730, Irp=865c0698, IRQL=0
[95315 ms]  >>>  URB 23 going down  >>> 
-- URB_FUNCTION_BULK_OR_INTERRUPT_TRANSFER:
  PipeHandle           = 866db8cc [endpoint 0x00000081]
  TransferFlags        = 00000003 (USBD_TRANSFER_DIRECTION_IN, USBD_SHORT_TRANSFER_OK)
  TransferBufferLength = 00000200
  TransferBuffer       = 00000000
  TransferBufferMDL    = 86a0d728
  UrbLink              = 00000000
[95389 ms] UsbSnoop - FilterDispatchAny(f76d7fd2) : IRP_MJ_INTERNAL_DEVICE_CONTROL
[95389 ms] UsbSnoop - FdoHookDispatchInternalIoctl(f76d81ea) : fdo=861c0730, Irp=85825bc8, IRQL=0
[95390 ms]  >>>  URB 24 going down  >>> 
-- URB_FUNCTION_BULK_OR_INTERRUPT_TRANSFER:
  PipeHandle           = 866db8ec [endpoint 0x00000002]
  TransferFlags        = 00000002 (USBD_TRANSFER_DIRECTION_OUT, USBD_SHORT_TRANSFER_OK)
  TransferBufferLength = 00000012
  TransferBuffer       = 00000000
  TransferBufferMDL    = 86abce70
    00000000: 54 fd 64 00 40 de 64 01 40 20 02 80 02 00 05 21
    00000010: 80 02
  UrbLink              = 00000000
[95390 ms] UsbSnoop - MyInternalIOCTLCompletion(f76d8126) : fido=85e673d0, Irp=85825bc8, Context=85b8ca40, IRQL=2
[95390 ms]  <<<  URB 24 coming back  <<< 
-- URB_FUNCTION_BULK_OR_INTERRUPT_TRANSFER:
  PipeHandle           = 866db8ec [endpoint 0x00000002]
  TransferFlags        = 00000002 (USBD_TRANSFER_DIRECTION_OUT, USBD_SHORT_TRANSFER_OK)
  TransferBufferLength = 00000012
  TransferBuffer       = 00000000
  TransferBufferMDL    = 86abce70
  UrbLink              = 00000000
[95391 ms] UsbSnoop - MyInternalIOCTLCompletion(f76d8126) : fido=85e673d0, Irp=865c0698, Context=86a80f80, IRQL=2
[95391 ms]  <<<  URB 23 coming back  <<< 
-- URB_FUNCTION_BULK_OR_INTERRUPT_TRANSFER:
  PipeHandle           = 866db8cc [endpoint 0x00000081]
  TransferFlags        = 00000003 (USBD_TRANSFER_DIRECTION_IN, USBD_SHORT_TRANSFER_OK)
  TransferBufferLength = 00000012
  TransferBuffer       = 00000000
  TransferBufferMDL    = 86a0d728
    00000000: 54 fd 64 01 00 ff 64 00 80 02 20 40 02 0a 05 0c
    00000010: 40 20
  UrbLink              = 00000000
[95392 ms] UsbSnoop - FilterDispatchAny(f76d7fd2) : IRP_MJ_INTERNAL_DEVICE_CONTROL
[95392 ms] UsbSnoop - FdoHookDispatchInternalIoctl(f76d81ea) : fdo=861c0730, Irp=8592b7f8, IRQL=0
[95392 ms]  >>>  URB 25 going down  >>> 
-- URB_FUNCTION_BULK_OR_INTERRUPT_TRANSFER:
  PipeHandle           = 866db8cc [endpoint 0x00000081]
  TransferFlags        = 00000003 (USBD_TRANSFER_DIRECTION_IN, USBD_SHORT_TRANSFER_OK)
  TransferBufferLength = 00000200
  TransferBuffer       = 00000000
  TransferBufferMDL    = 86abce70
  UrbLink              = 00000000
[98702 ms] UsbSnoop - FilterDispatchAny(f76d7fd2) : IRP_MJ_INTERNAL_DEVICE_CONTROL
[98702 ms] UsbSnoop - FdoHookDispatchInternalIoctl(f76d81ea) : fdo=861c0730, Irp=859852f0, IRQL=0
[98702 ms]  >>>  URB 26 going down  >>> 
-- URB_FUNCTION_BULK_OR_INTERRUPT_TRANSFER:
  PipeHandle           = 866db8ec [endpoint 0x00000002]
  TransferFlags        = 00000002 (USBD_TRANSFER_DIRECTION_OUT, USBD_SHORT_TRANSFER_OK)
  TransferBufferLength = 0000001b
  TransferBuffer       = 00000000
  TransferBufferMDL    = 85a309b8
    00000000: 54 fd 64 00 80 04 64 01 40 60 0c f1 0b 00 06 4c
    00000010: 20 01 2f 00 00 00 00 00 00 00 00
  UrbLink              = 00000000
[98702 ms] UsbSnoop - MyInternalIOCTLCompletion(f76d8126) : fido=85e673d0, Irp=859852f0, Context=85b8ca40, IRQL=2
[98702 ms]  <<<  URB 26 coming back  <<< 
-- URB_FUNCTION_BULK_OR_INTERRUPT_TRANSFER:
  PipeHandle           = 866db8ec [endpoint 0x00000002]
  TransferFlags        = 00000002 (USBD_TRANSFER_DIRECTION_OUT, USBD_SHORT_TRANSFER_OK)
  TransferBufferLength = 0000001b
  TransferBuffer       = 00000000
  TransferBufferMDL    = 85a309b8
  UrbLink              = 00000000
[98704 ms] UsbSnoop - MyInternalIOCTLCompletion(f76d8126) : fido=85e673d0, Irp=8592b7f8, Context=86a80f80, IRQL=2
[98704 ms]  <<<  URB 25 coming back  <<< 
-- URB_FUNCTION_BULK_OR_INTERRUPT_TRANSFER:
  PipeHandle           = 866db8cc [endpoint 0x00000081]
  TransferFlags        = 00000003 (USBD_TRANSFER_DIRECTION_IN, USBD_SHORT_TRANSFER_OK)
  TransferBufferLength = 00000012
  TransferBuffer       = 00000000
  TransferBufferMDL    = 86abce70
    00000000: 54 fd 64 01 00 ff 64 00 80 04 60 40 02 0a 06 4f
    00000010: 40 60
  UrbLink              = 00000000
[98704 ms] UsbSnoop - FilterDispatchAny(f76d7fd2) : IRP_MJ_INTERNAL_DEVICE_CONTROL
[98704 ms] UsbSnoop - FdoHookDispatchInternalIoctl(f76d81ea) : fdo=861c0730, Irp=859852f0, IRQL=0
[98704 ms]  >>>  URB 27 going down  >>> 
-- URB_FUNCTION_BULK_OR_INTERRUPT_TRANSFER:
  PipeHandle           = 866db8cc [endpoint 0x00000081]
  TransferFlags        = 00000003 (USBD_TRANSFER_DIRECTION_IN, USBD_SHORT_TRANSFER_OK)
  TransferBufferLength = 00000200
  TransferBuffer       = 00000000
  TransferBufferMDL    = 86af2890
  UrbLink              = 00000000
[98719 ms] UsbSnoop - MyInternalIOCTLCompletion(f76d8126) : fido=85e673d0, Irp=859852f0, Context=86a80f80, IRQL=2
[98719 ms]  <<<  URB 27 coming back  <<< 
-- URB_FUNCTION_BULK_OR_INTERRUPT_TRANSFER:
  PipeHandle           = 866db8cc [endpoint 0x00000081]
  TransferFlags        = 00000003 (USBD_TRANSFER_DIRECTION_IN, USBD_SHORT_TRANSFER_OK)
  TransferBufferLength = 0000001b
  TransferBuffer       = 00000000
  TransferBufferMDL    = 86af2890
    00000000: 54 fd 64 01 40 60 64 00 80 04 f7 38 0b 00 04 7c
    00000010: 20 00 00 00 00 00 00 00 00 01 00
  UrbLink              = 00000000
[98719 ms] UsbSnoop - FilterDispatchAny(f76d7fd2) : IRP_MJ_INTERNAL_DEVICE_CONTROL
[98719 ms] UsbSnoop - FdoHookDispatchInternalIoctl(f76d81ea) : fdo=861c0730, Irp=859852f0, IRQL=0
[98719 ms]  >>>  URB 28 going down  >>> 
-- URB_FUNCTION_BULK_OR_INTERRUPT_TRANSFER:
  PipeHandle           = 866db8ec [endpoint 0x00000002]
  TransferFlags        = 00000002 (USBD_TRANSFER_DIRECTION_OUT, USBD_SHORT_TRANSFER_OK)
  TransferBufferLength = 00000012
  TransferBuffer       = 00000000
  TransferBufferMDL    = 86af2890
    00000000: 54 fd 64 00 00 ff 64 01 40 60 04 80 02 0a 04 4d
    00000010: 80 04
  UrbLink              = 00000000
[98720 ms] UsbSnoop - MyInternalIOCTLCompletion(f76d8126) : fido=85e673d0, Irp=859852f0, Context=86a80f80, IRQL=2
[98720 ms]  <<<  URB 28 coming back  <<< 
-- URB_FUNCTION_BULK_OR_INTERRUPT_TRANSFER:
  PipeHandle           = 866db8ec [endpoint 0x00000002]
  TransferFlags        = 00000002 (USBD_TRANSFER_DIRECTION_OUT, USBD_SHORT_TRANSFER_OK)
  TransferBufferLength = 00000012
  TransferBuffer       = 00000000
  TransferBufferMDL    = 86af2890
  UrbLink              = 00000000
[98720 ms] UsbSnoop - FilterDispatchAny(f76d7fd2) : IRP_MJ_INTERNAL_DEVICE_CONTROL
[98720 ms] UsbSnoop - FdoHookDispatchInternalIoctl(f76d81ea) : fdo=861c0730, Irp=859852f0, IRQL=0
[98720 ms]  >>>  URB 29 going down  >>> 
-- URB_FUNCTION_BULK_OR_INTERRUPT_TRANSFER:
  PipeHandle           = 866db8cc [endpoint 0x00000081]
  TransferFlags        = 00000003 (USBD_TRANSFER_DIRECTION_IN, USBD_SHORT_TRANSFER_OK)
  TransferBufferLength = 00000200
  TransferBuffer       = 00000000
  TransferBufferMDL    = 86af2890
  UrbLink              = 00000000
[98723 ms] UsbSnoop - FilterDispatchAny(f76d7fd2) : IRP_MJ_INTERNAL_DEVICE_CONTROL
[98723 ms] UsbSnoop - FdoHookDispatchInternalIoctl(f76d81ea) : fdo=861c0730, Irp=85afbe70, IRQL=0
[98723 ms]  >>>  URB 30 going down  >>> 
-- URB_FUNCTION_BULK_OR_INTERRUPT_TRANSFER:
  PipeHandle           = 866db8ec [endpoint 0x00000002]
  TransferFlags        = 00000002 (USBD_TRANSFER_DIRECTION_OUT, USBD_SHORT_TRANSFER_OK)
  TransferBufferLength = 00000012
  TransferBuffer       = 00000000
  TransferBufferMDL    = 85a4de68
    00000000: 54 fd 64 00 40 de 64 01 40 60 04 80 02 00 07 65
    00000010: 80 04
  UrbLink              = 00000000
[98724 ms] UsbSnoop - MyInternalIOCTLCompletion(f76d8126) : fido=85e673d0, Irp=85afbe70, Context=85b8ca40, IRQL=2
[98724 ms]  <<<  URB 30 coming back  <<< 
-- URB_FUNCTION_BULK_OR_INTERRUPT_TRANSFER:
  PipeHandle           = 866db8ec [endpoint 0x00000002]
  TransferFlags        = 00000002 (USBD_TRANSFER_DIRECTION_OUT, USBD_SHORT_TRANSFER_OK)
  TransferBufferLength = 00000012
  TransferBuffer       = 00000000
  TransferBufferMDL    = 85a4de68
  UrbLink              = 00000000
[98725 ms] UsbSnoop - MyInternalIOCTLCompletion(f76d8126) : fido=85e673d0, Irp=859852f0, Context=86a80f80, IRQL=2
[98725 ms]  <<<  URB 29 coming back  <<< 
-- URB_FUNCTION_BULK_OR_INTERRUPT_TRANSFER:
  PipeHandle           = 866db8cc [endpoint 0x00000081]
  TransferFlags        = 00000003 (USBD_TRANSFER_DIRECTION_IN, USBD_SHORT_TRANSFER_OK)
  TransferBufferLength = 00000012
  TransferBuffer       = 00000000
  TransferBufferMDL    = 86af2890
    00000000: 54 fd 64 01 00 ff 64 00 80 04 60 40 02 0a 07 50
    00000010: 40 60
  UrbLink              = 00000000
[98725 ms] UsbSnoop - FilterDispatchAny(f76d7fd2) : IRP_MJ_INTERNAL_DEVICE_CONTROL
[98725 ms] UsbSnoop - FdoHookDispatchInternalIoctl(f76d81ea) : fdo=861c0730, Irp=859852f0, IRQL=0
[98725 ms]  >>>  URB 31 going down  >>> 
-- URB_FUNCTION_BULK_OR_INTERRUPT_TRANSFER:
  PipeHandle           = 866db8cc [endpoint 0x00000081]
  TransferFlags        = 00000003 (USBD_TRANSFER_DIRECTION_IN, USBD_SHORT_TRANSFER_OK)
  TransferBufferLength = 00000200
  TransferBuffer       = 00000000
  TransferBufferMDL    = 86a0d728
  UrbLink              = 00000000
[98728 ms] UsbSnoop - FilterDispatchAny(f76d7fd2) : IRP_MJ_INTERNAL_DEVICE_CONTROL
[98728 ms] UsbSnoop - FdoHookDispatchInternalIoctl(f76d81ea) : fdo=861c0730, Irp=85afbe70, IRQL=0
[98728 ms]  >>>  URB 32 going down  >>> 
-- URB_FUNCTION_BULK_OR_INTERRUPT_TRANSFER:
  PipeHandle           = 866db8ec [endpoint 0x00000002]
  TransferFlags        = 00000002 (USBD_TRANSFER_DIRECTION_OUT, USBD_SHORT_TRANSFER_OK)
  TransferBufferLength = 0000001a
  TransferBuffer       = 00000000
  TransferBufferMDL    = 85a4de68
    00000000: 54 fd 64 00 80 05 64 01 40 60 c0 aa 0a 00 08 bb
    00000010: 0d 2f 00 00 00 00 00 00 00 00
  UrbLink              = 00000000
[98729 ms] UsbSnoop - MyInternalIOCTLCompletion(f76d8126) : fido=85e673d0, Irp=85afbe70, Context=85b8ca40, IRQL=2
[98729 ms]  <<<  URB 32 coming back  <<< 
-- URB_FUNCTION_BULK_OR_INTERRUPT_TRANSFER:
  PipeHandle           = 866db8ec [endpoint 0x00000002]
  TransferFlags        = 00000002 (USBD_TRANSFER_DIRECTION_OUT, USBD_SHORT_TRANSFER_OK)
  TransferBufferLength = 0000001a
  TransferBuffer       = 00000000
  TransferBufferMDL    = 85a4de68
  UrbLink              = 00000000
[98730 ms] UsbSnoop - MyInternalIOCTLCompletion(f76d8126) : fido=85e673d0, Irp=859852f0, Context=86a80f80, IRQL=2
[98730 ms]  <<<  URB 31 coming back  <<< 
-- URB_FUNCTION_BULK_OR_INTERRUPT_TRANSFER:
  PipeHandle           = 866db8cc [endpoint 0x00000081]
  TransferFlags        = 00000003 (USBD_TRANSFER_DIRECTION_IN, USBD_SHORT_TRANSFER_OK)
  TransferBufferLength = 00000012
  TransferBuffer       = 00000000
  TransferBufferMDL    = 86a0d728
    00000000: 54 fd 64 01 00 ff 64 00 80 05 60 40 02 0a 08 52
    00000010: 40 60
  UrbLink              = 00000000
[98730 ms] UsbSnoop - FilterDispatchAny(f76d7fd2) : IRP_MJ_INTERNAL_DEVICE_CONTROL
[98730 ms] UsbSnoop - FdoHookDispatchInternalIoctl(f76d81ea) : fdo=861c0730, Irp=859852f0, IRQL=0
[98730 ms]  >>>  URB 33 going down  >>> 
-- URB_FUNCTION_BULK_OR_INTERRUPT_TRANSFER:
  PipeHandle           = 866db8cc [endpoint 0x00000081]
  TransferFlags        = 00000003 (USBD_TRANSFER_DIRECTION_IN, USBD_SHORT_TRANSFER_OK)
  TransferBufferLength = 00000200
  TransferBuffer       = 00000000
  TransferBufferMDL    = 86af2890
  UrbLink              = 00000000
[98747 ms] UsbSnoop - MyInternalIOCTLCompletion(f76d8126) : fido=85e673d0, Irp=859852f0, Context=86a80f80, IRQL=2
[98747 ms]  <<<  URB 33 coming back  <<< 
-- URB_FUNCTION_BULK_OR_INTERRUPT_TRANSFER:
  PipeHandle           = 866db8cc [endpoint 0x00000081]
  TransferFlags        = 00000003 (USBD_TRANSFER_DIRECTION_IN, USBD_SHORT_TRANSFER_OK)
  TransferBufferLength = 00000012
  TransferBuffer       = 00000000
  TransferBufferMDL    = 86af2890
    00000000: 54 fd 64 01 40 60 64 00 80 05 00 ff 02 00 05 45
    00000010: ff 00
  UrbLink              = 00000000
[98747 ms] UsbSnoop - FilterDispatchAny(f76d7fd2) : IRP_MJ_INTERNAL_DEVICE_CONTROL
[98747 ms] UsbSnoop - FdoHookDispatchInternalIoctl(f76d81ea) : fdo=861c0730, Irp=859852f0, IRQL=0
[98747 ms]  >>>  URB 34 going down  >>> 
-- URB_FUNCTION_BULK_OR_INTERRUPT_TRANSFER:
  PipeHandle           = 866db8ec [endpoint 0x00000002]
  TransferFlags        = 00000002 (USBD_TRANSFER_DIRECTION_OUT, USBD_SHORT_TRANSFER_OK)
  TransferBufferLength = 00000012
  TransferBuffer       = 00000000
  TransferBufferMDL    = 85a309b8
    00000000: 54 fd 64 00 00 ff 64 01 40 60 05 80 02 0a 05 4f
    00000010: 80 05
  UrbLink              = 00000000
[98748 ms] UsbSnoop - MyInternalIOCTLCompletion(f76d8126) : fido=85e673d0, Irp=859852f0, Context=86a80f80, IRQL=2
[98748 ms]  <<<  URB 34 coming back  <<< 
-- URB_FUNCTION_BULK_OR_INTERRUPT_TRANSFER:
  PipeHandle           = 866db8ec [endpoint 0x00000002]
  TransferFlags        = 00000002 (USBD_TRANSFER_DIRECTION_OUT, USBD_SHORT_TRANSFER_OK)
  TransferBufferLength = 00000012
  TransferBuffer       = 00000000
  TransferBufferMDL    = 85a309b8
  UrbLink              = 00000000
[98748 ms] UsbSnoop - FilterDispatchAny(f76d7fd2) : IRP_MJ_INTERNAL_DEVICE_CONTROL
[98748 ms] UsbSnoop - FdoHookDispatchInternalIoctl(f76d81ea) : fdo=861c0730, Irp=859852f0, IRQL=0
[98748 ms]  >>>  URB 35 going down  >>> 
-- URB_FUNCTION_BULK_OR_INTERRUPT_TRANSFER:
  PipeHandle           = 866db8cc [endpoint 0x00000081]
  TransferFlags        = 00000003 (USBD_TRANSFER_DIRECTION_IN, USBD_SHORT_TRANSFER_OK)
  TransferBufferLength = 00000200
  TransferBuffer       = 00000000
  TransferBufferMDL    = 85a309b8
  UrbLink              = 00000000
[98748 ms] UsbSnoop - FilterDispatchAny(f76d7fd2) : IRP_MJ_INTERNAL_DEVICE_CONTROL
[98748 ms] UsbSnoop - FdoHookDispatchInternalIoctl(f76d81ea) : fdo=861c0730, Irp=8592b7f8, IRQL=0
[98748 ms]  >>>  URB 36 going down  >>> 
-- URB_FUNCTION_BULK_OR_INTERRUPT_TRANSFER:
  PipeHandle           = 866db8ec [endpoint 0x00000002]
  TransferFlags        = 00000002 (USBD_TRANSFER_DIRECTION_OUT, USBD_SHORT_TRANSFER_OK)
  TransferBufferLength = 00000011
  TransferBuffer       = 00000000
  TransferBufferMDL    = 85ae5cb0
    00000000: 54 fd 64 00 80 05 64 01 40 60 0e 00 01 00 09 57
    00000010: 0e
  UrbLink              = 00000000
[98749 ms] UsbSnoop - MyInternalIOCTLCompletion(f76d8126) : fido=85e673d0, Irp=8592b7f8, Context=85b8ca40, IRQL=2
[98749 ms]  <<<  URB 36 coming back  <<< 
-- URB_FUNCTION_BULK_OR_INTERRUPT_TRANSFER:
  PipeHandle           = 866db8ec [endpoint 0x00000002]
  TransferFlags        = 00000002 (USBD_TRANSFER_DIRECTION_OUT, USBD_SHORT_TRANSFER_OK)
  TransferBufferLength = 00000011
  TransferBuffer       = 00000000
  TransferBufferMDL    = 85ae5cb0
  UrbLink              = 00000000
[98751 ms] UsbSnoop - MyInternalIOCTLCompletion(f76d8126) : fido=85e673d0, Irp=859852f0, Context=86a80f80, IRQL=2
[98751 ms]  <<<  URB 35 coming back  <<< 
-- URB_FUNCTION_BULK_OR_INTERRUPT_TRANSFER:
  PipeHandle           = 866db8cc [endpoint 0x00000081]
  TransferFlags        = 00000003 (USBD_TRANSFER_DIRECTION_IN, USBD_SHORT_TRANSFER_OK)
  TransferBufferLength = 00000012
  TransferBuffer       = 00000000
  TransferBufferMDL    = 85a309b8
    00000000: 54 fd 64 01 00 ff 64 00 80 05 60 40 02 0a 09 53
    00000010: 40 60
  UrbLink              = 00000000
[98751 ms] UsbSnoop - FilterDispatchAny(f76d7fd2) : IRP_MJ_INTERNAL_DEVICE_CONTROL
[98751 ms] UsbSnoop - FdoHookDispatchInternalIoctl(f76d81ea) : fdo=861c0730, Irp=859852f0, IRQL=0
[98751 ms]  >>>  URB 37 going down  >>> 
-- URB_FUNCTION_BULK_OR_INTERRUPT_TRANSFER:
  PipeHandle           = 866db8cc [endpoint 0x00000081]
  TransferFlags        = 00000003 (USBD_TRANSFER_DIRECTION_IN, USBD_SHORT_TRANSFER_OK)
  TransferBufferLength = 00000200
  TransferBuffer       = 00000000
  TransferBufferMDL    = 86af2890
  UrbLink              = 00000000
[98759 ms] UsbSnoop - MyInternalIOCTLCompletion(f76d8126) : fido=85e673d0, Irp=859852f0, Context=86a80f80, IRQL=2
[98759 ms]  <<<  URB 37 coming back  <<< 
-- URB_FUNCTION_BULK_OR_INTERRUPT_TRANSFER:
  PipeHandle           = 866db8cc [endpoint 0x00000081]
  TransferFlags        = 00000003 (USBD_TRANSFER_DIRECTION_IN, USBD_SHORT_TRANSFER_OK)
  TransferBufferLength = 00000026
  TransferBuffer       = 00000000
  TransferBufferMDL    = 86af2890
    00000000: 54 fd 64 01 40 60 64 00 80 05 11 54 16 00 06 c0
    00000010: 10 00 13 45 78 61 6d 70 6c 65 73 00 00 00 00 00
    00000020: 00 00 00 0b 01 00
  UrbLink              = 00000000
[98759 ms] UsbSnoop - FilterDispatchAny(f76d7fd2) : IRP_MJ_INTERNAL_DEVICE_CONTROL
[98759 ms] UsbSnoop - FdoHookDispatchInternalIoctl(f76d81ea) : fdo=861c0730, Irp=859852f0, IRQL=0
[98759 ms]  >>>  URB 38 going down  >>> 
-- URB_FUNCTION_BULK_OR_INTERRUPT_TRANSFER:
  PipeHandle           = 866db8ec [endpoint 0x00000002]
  TransferFlags        = 00000002 (USBD_TRANSFER_DIRECTION_OUT, USBD_SHORT_TRANSFER_OK)
  TransferBufferLength = 00000012
  TransferBuffer       = 00000000
  TransferBufferMDL    = 85ae5cb0
    00000000: 54 fd 64 00 00 ff 64 01 40 60 05 80 02 0a 06 50
    00000010: 80 05
  UrbLink              = 00000000
[98760 ms] UsbSnoop - MyInternalIOCTLCompletion(f76d8126) : fido=85e673d0, Irp=859852f0, Context=86a80f80, IRQL=2
[98760 ms]  <<<  URB 38 coming back  <<< 
-- URB_FUNCTION_BULK_OR_INTERRUPT_TRANSFER:
  PipeHandle           = 866db8ec [endpoint 0x00000002]
  TransferFlags        = 00000002 (USBD_TRANSFER_DIRECTION_OUT, USBD_SHORT_TRANSFER_OK)
  TransferBufferLength = 00000012
  TransferBuffer       = 00000000
  TransferBufferMDL    = 85ae5cb0
  UrbLink              = 00000000
[98761 ms] UsbSnoop - FilterDispatchAny(f76d7fd2) : IRP_MJ_INTERNAL_DEVICE_CONTROL
[98761 ms] UsbSnoop - FdoHookDispatchInternalIoctl(f76d81ea) : fdo=861c0730, Irp=859e1e70, IRQL=0
[98761 ms]  >>>  URB 39 going down  >>> 
-- URB_FUNCTION_BULK_OR_INTERRUPT_TRANSFER:
  PipeHandle           = 866db8cc [endpoint 0x00000081]
  TransferFlags        = 00000003 (USBD_TRANSFER_DIRECTION_IN, USBD_SHORT_TRANSFER_OK)
  TransferBufferLength = 00000200
  TransferBuffer       = 00000000
  TransferBufferMDL    = 85b0ba48
  UrbLink              = 00000000
[98762 ms] UsbSnoop - FilterDispatchAny(f76d7fd2) : IRP_MJ_INTERNAL_DEVICE_CONTROL
[98762 ms] UsbSnoop - FdoHookDispatchInternalIoctl(f76d81ea) : fdo=861c0730, Irp=859d5e70, IRQL=0
[98762 ms]  >>>  URB 40 going down  >>> 
-- URB_FUNCTION_BULK_OR_INTERRUPT_TRANSFER:
  PipeHandle           = 866db8ec [endpoint 0x00000002]
  TransferFlags        = 00000002 (USBD_TRANSFER_DIRECTION_OUT, USBD_SHORT_TRANSFER_OK)
  TransferBufferLength = 00000011
  TransferBuffer       = 00000000
  TransferBufferMDL    = 86544868
    00000000: 54 fd 64 00 80 05 64 01 40 60 0e 00 01 00 0a 58
    00000010: 0e
  UrbLink              = 00000000
[98763 ms] UsbSnoop - MyInternalIOCTLCompletion(f76d8126) : fido=85e673d0, Irp=859d5e70, Context=85b8ca40, IRQL=2
[98763 ms]  <<<  URB 40 coming back  <<< 
-- URB_FUNCTION_BULK_OR_INTERRUPT_TRANSFER:
  PipeHandle           = 866db8ec [endpoint 0x00000002]
  TransferFlags        = 00000002 (USBD_TRANSFER_DIRECTION_OUT, USBD_SHORT_TRANSFER_OK)
  TransferBufferLength = 00000011
  TransferBuffer       = 00000000
  TransferBufferMDL    = 86544868
  UrbLink              = 00000000
[98764 ms] UsbSnoop - MyInternalIOCTLCompletion(f76d8126) : fido=85e673d0, Irp=859e1e70, Context=86a80f80, IRQL=2
[98764 ms]  <<<  URB 39 coming back  <<< 
-- URB_FUNCTION_BULK_OR_INTERRUPT_TRANSFER:
  PipeHandle           = 866db8cc [endpoint 0x00000081]
  TransferFlags        = 00000003 (USBD_TRANSFER_DIRECTION_IN, USBD_SHORT_TRANSFER_OK)
  TransferBufferLength = 00000012
  TransferBuffer       = 00000000
  TransferBufferMDL    = 85b0ba48
    00000000: 54 fd 64 01 00 ff 64 00 80 05 60 40 02 0a 0a 54
    00000010: 40 60
  UrbLink              = 00000000
[98764 ms] UsbSnoop - FilterDispatchAny(f76d7fd2) : IRP_MJ_INTERNAL_DEVICE_CONTROL
[98764 ms] UsbSnoop - FdoHookDispatchInternalIoctl(f76d81ea) : fdo=861c0730, Irp=859852f0, IRQL=0
[98764 ms]  >>>  URB 41 going down  >>> 
-- URB_FUNCTION_BULK_OR_INTERRUPT_TRANSFER:
  PipeHandle           = 866db8cc [endpoint 0x00000081]
  TransferFlags        = 00000003 (USBD_TRANSFER_DIRECTION_IN, USBD_SHORT_TRANSFER_OK)
  TransferBufferLength = 00000200
  TransferBuffer       = 00000000
  TransferBufferMDL    = 86abce70
  UrbLink              = 00000000
[98768 ms] UsbSnoop - MyInternalIOCTLCompletion(f76d8126) : fido=85e673d0, Irp=859852f0, Context=86a80f80, IRQL=2
[98768 ms]  <<<  URB 41 coming back  <<< 
-- URB_FUNCTION_BULK_OR_INTERRUPT_TRANSFER:
  PipeHandle           = 866db8cc [endpoint 0x00000081]
  TransferFlags        = 00000003 (USBD_TRANSFER_DIRECTION_IN, USBD_SHORT_TRANSFER_OK)
  TransferBufferLength = 00000026
  TransferBuffer       = 00000000
  TransferBufferMDL    = 86abce70
    00000000: 54 fd 64 01 40 60 64 00 80 05 d1 9b 16 00 07 c8
    00000010: 10 00 13 45 78 65 6d 70 6c 65 73 00 00 00 00 00
    00000020: 00 00 00 14 01 00
  UrbLink              = 00000000
[98768 ms] UsbSnoop - FilterDispatchAny(f76d7fd2) : IRP_MJ_INTERNAL_DEVICE_CONTROL
[98768 ms] UsbSnoop - FdoHookDispatchInternalIoctl(f76d81ea) : fdo=861c0730, Irp=859852f0, IRQL=0
[98768 ms]  >>>  URB 42 going down  >>> 
-- URB_FUNCTION_BULK_OR_INTERRUPT_TRANSFER:
  PipeHandle           = 866db8ec [endpoint 0x00000002]
  TransferFlags        = 00000002 (USBD_TRANSFER_DIRECTION_OUT, USBD_SHORT_TRANSFER_OK)
  TransferBufferLength = 00000012
  TransferBuffer       = 00000000
  TransferBufferMDL    = 86af2890
    00000000: 54 fd 64 00 00 ff 64 01 40 60 05 80 02 0a 07 51
    00000010: 80 05
  UrbLink              = 00000000
[98769 ms] UsbSnoop - MyInternalIOCTLCompletion(f76d8126) : fido=85e673d0, Irp=859852f0, Context=86a80f80, IRQL=2
[98769 ms]  <<<  URB 42 coming back  <<< 
-- URB_FUNCTION_BULK_OR_INTERRUPT_TRANSFER:
  PipeHandle           = 866db8ec [endpoint 0x00000002]
  TransferFlags        = 00000002 (USBD_TRANSFER_DIRECTION_OUT, USBD_SHORT_TRANSFER_OK)
  TransferBufferLength = 00000012
  TransferBuffer       = 00000000
  TransferBufferMDL    = 86af2890
  UrbLink              = 00000000
[98769 ms] UsbSnoop - FilterDispatchAny(f76d7fd2) : IRP_MJ_INTERNAL_DEVICE_CONTROL
[98769 ms] UsbSnoop - FdoHookDispatchInternalIoctl(f76d81ea) : fdo=861c0730, Irp=859e1e70, IRQL=0
[98769 ms]  >>>  URB 43 going down  >>> 
-- URB_FUNCTION_BULK_OR_INTERRUPT_TRANSFER:
  PipeHandle           = 866db8cc [endpoint 0x00000081]
  TransferFlags        = 00000003 (USBD_TRANSFER_DIRECTION_IN, USBD_SHORT_TRANSFER_OK)
  TransferBufferLength = 00000200
  TransferBuffer       = 00000000
  TransferBufferMDL    = 85ae5cb0
  UrbLink              = 00000000
[98786 ms] UsbSnoop - FilterDispatchAny(f76d7fd2) : IRP_MJ_INTERNAL_DEVICE_CONTROL
[98786 ms] UsbSnoop - FdoHookDispatchInternalIoctl(f76d81ea) : fdo=861c0730, Irp=859d5e70, IRQL=0
[98786 ms]  >>>  URB 44 going down  >>> 
-- URB_FUNCTION_BULK_OR_INTERRUPT_TRANSFER:
  PipeHandle           = 866db8ec [endpoint 0x00000002]
  TransferFlags        = 00000002 (USBD_TRANSFER_DIRECTION_OUT, USBD_SHORT_TRANSFER_OK)
  TransferBufferLength = 00000011
  TransferBuffer       = 00000000
  TransferBufferMDL    = 85a329d0
    00000000: 54 fd 64 00 80 05 64 01 40 60 0e 00 01 00 0b 59
    00000010: 0e
  UrbLink              = 00000000
[98786 ms] UsbSnoop - MyInternalIOCTLCompletion(f76d8126) : fido=85e673d0, Irp=859d5e70, Context=85b8ca40, IRQL=2
[98786 ms]  <<<  URB 44 coming back  <<< 
-- URB_FUNCTION_BULK_OR_INTERRUPT_TRANSFER:
  PipeHandle           = 866db8ec [endpoint 0x00000002]
  TransferFlags        = 00000002 (USBD_TRANSFER_DIRECTION_OUT, USBD_SHORT_TRANSFER_OK)
  TransferBufferLength = 00000011
  TransferBuffer       = 00000000
  TransferBufferMDL    = 85a329d0
  UrbLink              = 00000000
[98787 ms] UsbSnoop - MyInternalIOCTLCompletion(f76d8126) : fido=85e673d0, Irp=859e1e70, Context=86a80f80, IRQL=2
[98787 ms]  <<<  URB 43 coming back  <<< 
-- URB_FUNCTION_BULK_OR_INTERRUPT_TRANSFER:
  PipeHandle           = 866db8cc [endpoint 0x00000081]
  TransferFlags        = 00000003 (USBD_TRANSFER_DIRECTION_IN, USBD_SHORT_TRANSFER_OK)
  TransferBufferLength = 00000012
  TransferBuffer       = 00000000
  TransferBufferMDL    = 85ae5cb0
    00000000: 54 fd 64 01 00 ff 64 00 80 05 60 40 02 0a 0b 55
    00000010: 40 60
  UrbLink              = 00000000
[98787 ms] UsbSnoop - FilterDispatchAny(f76d7fd2) : IRP_MJ_INTERNAL_DEVICE_CONTROL
[98787 ms] UsbSnoop - FdoHookDispatchInternalIoctl(f76d81ea) : fdo=861c0730, Irp=859e1e70, IRQL=0
[98787 ms]  >>>  URB 45 going down  >>> 
-- URB_FUNCTION_BULK_OR_INTERRUPT_TRANSFER:
  PipeHandle           = 866db8cc [endpoint 0x00000081]
  TransferFlags        = 00000003 (USBD_TRANSFER_DIRECTION_IN, USBD_SHORT_TRANSFER_OK)
  TransferBufferLength = 00000200
  TransferBuffer       = 00000000
  TransferBufferMDL    = 85b0ba48
  UrbLink              = 00000000
[98791 ms] UsbSnoop - MyInternalIOCTLCompletion(f76d8126) : fido=85e673d0, Irp=859e1e70, Context=86a80f80, IRQL=2
[98791 ms]  <<<  URB 45 coming back  <<< 
-- URB_FUNCTION_BULK_OR_INTERRUPT_TRANSFER:
  PipeHandle           = 866db8cc [endpoint 0x00000081]
  TransferFlags        = 00000003 (USBD_TRANSFER_DIRECTION_IN, USBD_SHORT_TRANSFER_OK)
  TransferBufferLength = 00000026
  TransferBuffer       = 00000000
  TransferBufferMDL    = 85b0ba48
    00000000: 54 fd 64 01 40 60 64 00 80 05 6b c3 16 00 08 8b
    00000010: 10 00 13 4e 6f 6d 62 72 65 73 00 00 00 00 00 00
    00000020: 00 00 00 1c 01 00
  UrbLink              = 00000000
[98791 ms] UsbSnoop - FilterDispatchAny(f76d7fd2) : IRP_MJ_INTERNAL_DEVICE_CONTROL
[98791 ms] UsbSnoop - FdoHookDispatchInternalIoctl(f76d81ea) : fdo=861c0730, Irp=859e1e70, IRQL=0
[98791 ms]  >>>  URB 46 going down  >>> 
-- URB_FUNCTION_BULK_OR_INTERRUPT_TRANSFER:
  PipeHandle           = 866db8ec [endpoint 0x00000002]
  TransferFlags        = 00000002 (USBD_TRANSFER_DIRECTION_OUT, USBD_SHORT_TRANSFER_OK)
  TransferBufferLength = 00000012
  TransferBuffer       = 00000000
  TransferBufferMDL    = 86544868
    00000000: 54 fd 64 00 00 ff 64 01 40 60 05 80 02 0a 08 52
    00000010: 80 05
  UrbLink              = 00000000
[98792 ms] UsbSnoop - MyInternalIOCTLCompletion(f76d8126) : fido=85e673d0, Irp=859e1e70, Context=86a80f80, IRQL=2
[98792 ms]  <<<  URB 46 coming back  <<< 
-- URB_FUNCTION_BULK_OR_INTERRUPT_TRANSFER:
  PipeHandle           = 866db8ec [endpoint 0x00000002]
  TransferFlags        = 00000002 (USBD_TRANSFER_DIRECTION_OUT, USBD_SHORT_TRANSFER_OK)
  TransferBufferLength = 00000012
  TransferBuffer       = 00000000
  TransferBufferMDL    = 86544868
  UrbLink              = 00000000
[98792 ms] UsbSnoop - FilterDispatchAny(f76d7fd2) : IRP_MJ_INTERNAL_DEVICE_CONTROL
[98792 ms] UsbSnoop - FdoHookDispatchInternalIoctl(f76d81ea) : fdo=861c0730, Irp=859e1e70, IRQL=0
[98792 ms]  >>>  URB 47 going down  >>> 
-- URB_FUNCTION_BULK_OR_INTERRUPT_TRANSFER:
  PipeHandle           = 866db8cc [endpoint 0x00000081]
  TransferFlags        = 00000003 (USBD_TRANSFER_DIRECTION_IN, USBD_SHORT_TRANSFER_OK)
  TransferBufferLength = 00000200
  TransferBuffer       = 00000000
  TransferBufferMDL    = 85a309b8
  UrbLink              = 00000000
[98794 ms] UsbSnoop - FilterDispatchAny(f76d7fd2) : IRP_MJ_INTERNAL_DEVICE_CONTROL
[98794 ms] UsbSnoop - FdoHookDispatchInternalIoctl(f76d81ea) : fdo=861c0730, Irp=859d5e70, IRQL=0
[98794 ms]  >>>  URB 48 going down  >>> 
-- URB_FUNCTION_BULK_OR_INTERRUPT_TRANSFER:
  PipeHandle           = 866db8ec [endpoint 0x00000002]
  TransferFlags        = 00000002 (USBD_TRANSFER_DIRECTION_OUT, USBD_SHORT_TRANSFER_OK)
  TransferBufferLength = 00000011
  TransferBuffer       = 00000000
  TransferBufferMDL    = 85e5c788
    00000000: 54 fd 64 00 80 05 64 01 40 60 0e 00 01 00 0c 5a
    00000010: 0e
  UrbLink              = 00000000
[98795 ms] UsbSnoop - MyInternalIOCTLCompletion(f76d8126) : fido=85e673d0, Irp=859e1e70, Context=86a80f80, IRQL=2
[98795 ms]  <<<  URB 47 coming back  <<< 
-- URB_FUNCTION_BULK_OR_INTERRUPT_TRANSFER:
  PipeHandle           = 866db8cc [endpoint 0x00000081]
  TransferFlags        = 00000003 (USBD_TRANSFER_DIRECTION_IN, USBD_SHORT_TRANSFER_OK)
  TransferBufferLength = 00000012
  TransferBuffer       = 00000000
  TransferBufferMDL    = 85a309b8
    00000000: 54 fd 64 01 00 ff 64 00 80 05 60 40 02 0a 0c 56
    00000010: 40 60
  UrbLink              = 00000000
[98795 ms] UsbSnoop - MyInternalIOCTLCompletion(f76d8126) : fido=85e673d0, Irp=859d5e70, Context=85b8ca40, IRQL=2
[98795 ms]  <<<  URB 48 coming back  <<< 
-- URB_FUNCTION_BULK_OR_INTERRUPT_TRANSFER:
  PipeHandle           = 866db8ec [endpoint 0x00000002]
  TransferFlags        = 00000002 (USBD_TRANSFER_DIRECTION_OUT, USBD_SHORT_TRANSFER_OK)
  TransferBufferLength = 00000011
  TransferBuffer       = 00000000
  TransferBufferMDL    = 85e5c788
  UrbLink              = 00000000
[98795 ms] UsbSnoop - FilterDispatchAny(f76d7fd2) : IRP_MJ_INTERNAL_DEVICE_CONTROL
[98795 ms] UsbSnoop - FdoHookDispatchInternalIoctl(f76d81ea) : fdo=861c0730, Irp=859e1e70, IRQL=0
[98795 ms]  >>>  URB 49 going down  >>> 
-- URB_FUNCTION_BULK_OR_INTERRUPT_TRANSFER:
  PipeHandle           = 866db8cc [endpoint 0x00000081]
  TransferFlags        = 00000003 (USBD_TRANSFER_DIRECTION_IN, USBD_SHORT_TRANSFER_OK)
  TransferBufferLength = 00000200
  TransferBuffer       = 00000000
  TransferBufferMDL    = 86a0d728
  UrbLink              = 00000000
[98798 ms] UsbSnoop - MyInternalIOCTLCompletion(f76d8126) : fido=85e673d0, Irp=859e1e70, Context=85b8ca40, IRQL=2
[98798 ms]  <<<  URB 49 coming back  <<< 
-- URB_FUNCTION_BULK_OR_INTERRUPT_TRANSFER:
  PipeHandle           = 866db8cc [endpoint 0x00000081]
  TransferFlags        = 00000003 (USBD_TRANSFER_DIRECTION_IN, USBD_SHORT_TRANSFER_OK)
  TransferBufferLength = 00000012
  TransferBuffer       = 00000000
  TransferBufferMDL    = 86a0d728
    00000000: 54 fd 64 01 40 60 64 00 80 05 11 ff 02 00 09 5a
    00000010: ff 11
  UrbLink              = 00000000
[98798 ms] UsbSnoop - FilterDispatchAny(f76d7fd2) : IRP_MJ_INTERNAL_DEVICE_CONTROL
[98798 ms] UsbSnoop - FdoHookDispatchInternalIoctl(f76d81ea) : fdo=861c0730, Irp=859e1e70, IRQL=0
[98798 ms]  >>>  URB 50 going down  >>> 
-- URB_FUNCTION_BULK_OR_INTERRUPT_TRANSFER:
  PipeHandle           = 866db8ec [endpoint 0x00000002]
  TransferFlags        = 00000002 (USBD_TRANSFER_DIRECTION_OUT, USBD_SHORT_TRANSFER_OK)
  TransferBufferLength = 00000012
  TransferBuffer       = 00000000
  TransferBufferMDL    = 86a0d728
    00000000: 54 fd 64 00 00 ff 64 01 40 60 05 80 02 0a 09 53
    00000010: 80 05
  UrbLink              = 00000000
[98799 ms] UsbSnoop - MyInternalIOCTLCompletion(f76d8126) : fido=85e673d0, Irp=859e1e70, Context=85b8ca40, IRQL=2
[98799 ms]  <<<  URB 50 coming back  <<< 
-- URB_FUNCTION_BULK_OR_INTERRUPT_TRANSFER:
  PipeHandle           = 866db8ec [endpoint 0x00000002]
  TransferFlags        = 00000002 (USBD_TRANSFER_DIRECTION_OUT, USBD_SHORT_TRANSFER_OK)
  TransferBufferLength = 00000012
  TransferBuffer       = 00000000
  TransferBufferMDL    = 86a0d728
  UrbLink              = 00000000
[98799 ms] UsbSnoop - FilterDispatchAny(f76d7fd2) : IRP_MJ_INTERNAL_DEVICE_CONTROL
[98799 ms] UsbSnoop - FdoHookDispatchInternalIoctl(f76d81ea) : fdo=861c0730, Irp=859d5e70, IRQL=0
[98799 ms]  >>>  URB 51 going down  >>> 
-- URB_FUNCTION_BULK_OR_INTERRUPT_TRANSFER:
  PipeHandle           = 866db8cc [endpoint 0x00000081]
  TransferFlags        = 00000003 (USBD_TRANSFER_DIRECTION_IN, USBD_SHORT_TRANSFER_OK)
  TransferBufferLength = 00000200
  TransferBuffer       = 00000000
  TransferBufferMDL    = 86544868
  UrbLink              = 00000000
[98799 ms] UsbSnoop - FilterDispatchAny(f76d7fd2) : IRP_MJ_INTERNAL_DEVICE_CONTROL
[98799 ms] UsbSnoop - FdoHookDispatchInternalIoctl(f76d81ea) : fdo=861c0730, Irp=85a10e70, IRQL=0
[98799 ms]  >>>  URB 52 going down  >>> 
-- URB_FUNCTION_BULK_OR_INTERRUPT_TRANSFER:
  PipeHandle           = 866db8ec [endpoint 0x00000002]
  TransferFlags        = 00000002 (USBD_TRANSFER_DIRECTION_OUT, USBD_SHORT_TRANSFER_OK)
  TransferBufferLength = 00000011
  TransferBuffer       = 00000000
  TransferBufferMDL    = 85ae5cb0
    00000000: 54 fd 64 00 80 05 64 01 40 60 0f 00 01 00 0d 5c
    00000010: 0f
  UrbLink              = 00000000
[98800 ms] UsbSnoop - MyInternalIOCTLCompletion(f76d8126) : fido=85e673d0, Irp=85a10e70, Context=86a80f80, IRQL=2
[98800 ms]  <<<  URB 52 coming back  <<< 
-- URB_FUNCTION_BULK_OR_INTERRUPT_TRANSFER:
  PipeHandle           = 866db8ec [endpoint 0x00000002]
  TransferFlags        = 00000002 (USBD_TRANSFER_DIRECTION_OUT, USBD_SHORT_TRANSFER_OK)
  TransferBufferLength = 00000011
  TransferBuffer       = 00000000
  TransferBufferMDL    = 85ae5cb0
  UrbLink              = 00000000
[98802 ms] UsbSnoop - MyInternalIOCTLCompletion(f76d8126) : fido=85e673d0, Irp=859d5e70, Context=85b8ca40, IRQL=2
[98802 ms]  <<<  URB 51 coming back  <<< 
-- URB_FUNCTION_BULK_OR_INTERRUPT_TRANSFER:
  PipeHandle           = 866db8cc [endpoint 0x00000081]
  TransferFlags        = 00000003 (USBD_TRANSFER_DIRECTION_IN, USBD_SHORT_TRANSFER_OK)
  TransferBufferLength = 00000012
  TransferBuffer       = 00000000
  TransferBufferMDL    = 86544868
    00000000: 54 fd 64 01 00 ff 64 00 80 05 60 40 02 0a 0d 57
    00000010: 40 60
  UrbLink              = 00000000
[98802 ms] UsbSnoop - FilterDispatchAny(f76d7fd2) : IRP_MJ_INTERNAL_DEVICE_CONTROL
[98802 ms] UsbSnoop - FdoHookDispatchInternalIoctl(f76d81ea) : fdo=861c0730, Irp=859d5e70, IRQL=0
[98802 ms]  >>>  URB 53 going down  >>> 
-- URB_FUNCTION_BULK_OR_INTERRUPT_TRANSFER:
  PipeHandle           = 866db8cc [endpoint 0x00000081]
  TransferFlags        = 00000003 (USBD_TRANSFER_DIRECTION_IN, USBD_SHORT_TRANSFER_OK)
  TransferBufferLength = 00000200
  TransferBuffer       = 00000000
  TransferBufferMDL    = 85b0ba48
  UrbLink              = 00000000
[98805 ms] UsbSnoop - MyInternalIOCTLCompletion(f76d8126) : fido=85e673d0, Irp=859d5e70, Context=85b8ca40, IRQL=2
[98805 ms]  <<<  URB 53 coming back  <<< 
-- URB_FUNCTION_BULK_OR_INTERRUPT_TRANSFER:
  PipeHandle           = 866db8cc [endpoint 0x00000081]
  TransferFlags        = 00000003 (USBD_TRANSFER_DIRECTION_IN, USBD_SHORT_TRANSFER_OK)
  TransferBufferLength = 00000012
  TransferBuffer       = 00000000
  TransferBufferMDL    = 85b0ba48
    00000000: 54 fd 64 01 40 60 64 00 80 05 00 ff 02 00 0a 4a
    00000010: ff 00
  UrbLink              = 00000000
[98805 ms] UsbSnoop - FilterDispatchAny(f76d7fd2) : IRP_MJ_INTERNAL_DEVICE_CONTROL
[98805 ms] UsbSnoop - FdoHookDispatchInternalIoctl(f76d81ea) : fdo=861c0730, Irp=859d5e70, IRQL=0
[98805 ms]  >>>  URB 54 going down  >>> 
-- URB_FUNCTION_BULK_OR_INTERRUPT_TRANSFER:
  PipeHandle           = 866db8ec [endpoint 0x00000002]
  TransferFlags        = 00000002 (USBD_TRANSFER_DIRECTION_OUT, USBD_SHORT_TRANSFER_OK)
  TransferBufferLength = 00000012
  TransferBuffer       = 00000000
  TransferBufferMDL    = 86abce70
    00000000: 54 fd 64 00 00 ff 64 01 40 60 05 80 02 0a 0a 54
    00000010: 80 05
  UrbLink              = 00000000
[98806 ms] UsbSnoop - MyInternalIOCTLCompletion(f76d8126) : fido=85e673d0, Irp=859d5e70, Context=85b8ca40, IRQL=2
[98806 ms]  <<<  URB 54 coming back  <<< 
-- URB_FUNCTION_BULK_OR_INTERRUPT_TRANSFER:
  PipeHandle           = 866db8ec [endpoint 0x00000002]
  TransferFlags        = 00000002 (USBD_TRANSFER_DIRECTION_OUT, USBD_SHORT_TRANSFER_OK)
  TransferBufferLength = 00000012
  TransferBuffer       = 00000000
  TransferBufferMDL    = 86abce70
  UrbLink              = 00000000
[98806 ms] UsbSnoop - FilterDispatchAny(f76d7fd2) : IRP_MJ_INTERNAL_DEVICE_CONTROL
[98806 ms] UsbSnoop - FdoHookDispatchInternalIoctl(f76d81ea) : fdo=861c0730, Irp=859d5e70, IRQL=0
[98806 ms]  >>>  URB 55 going down  >>> 
-- URB_FUNCTION_BULK_OR_INTERRUPT_TRANSFER:
  PipeHandle           = 866db8cc [endpoint 0x00000081]
  TransferFlags        = 00000003 (USBD_TRANSFER_DIRECTION_IN, USBD_SHORT_TRANSFER_OK)
  TransferBufferLength = 00000200
  TransferBuffer       = 00000000
  TransferBufferMDL    = 8615e710
  UrbLink              = 00000000
[98807 ms] UsbSnoop - FilterDispatchAny(f76d7fd2) : IRP_MJ_INTERNAL_DEVICE_CONTROL
[98807 ms] UsbSnoop - FdoHookDispatchInternalIoctl(f76d81ea) : fdo=861c0730, Irp=85a10e70, IRQL=0
[98807 ms]  >>>  URB 56 going down  >>> 
-- URB_FUNCTION_BULK_OR_INTERRUPT_TRANSFER:
  PipeHandle           = 866db8ec [endpoint 0x00000002]
  TransferFlags        = 00000002 (USBD_TRANSFER_DIRECTION_OUT, USBD_SHORT_TRANSFER_OK)
  TransferBufferLength = 00000012
  TransferBuffer       = 00000000
  TransferBufferMDL    = 85a4de68
    00000000: 54 fd 64 00 40 de 64 01 40 60 05 80 02 00 0e 6d
    00000010: 80 05
  UrbLink              = 00000000
[98808 ms] UsbSnoop - MyInternalIOCTLCompletion(f76d8126) : fido=85e673d0, Irp=85a10e70, Context=86a80f80, IRQL=2
[98808 ms]  <<<  URB 56 coming back  <<< 
-- URB_FUNCTION_BULK_OR_INTERRUPT_TRANSFER:
  PipeHandle           = 866db8ec [endpoint 0x00000002]
  TransferFlags        = 00000002 (USBD_TRANSFER_DIRECTION_OUT, USBD_SHORT_TRANSFER_OK)
  TransferBufferLength = 00000012
  TransferBuffer       = 00000000
  TransferBufferMDL    = 85a4de68
  UrbLink              = 00000000
[98809 ms] UsbSnoop - MyInternalIOCTLCompletion(f76d8126) : fido=85e673d0, Irp=859d5e70, Context=85b8ca40, IRQL=2
[98809 ms]  <<<  URB 55 coming back  <<< 
-- URB_FUNCTION_BULK_OR_INTERRUPT_TRANSFER:
  PipeHandle           = 866db8cc [endpoint 0x00000081]
  TransferFlags        = 00000003 (USBD_TRANSFER_DIRECTION_IN, USBD_SHORT_TRANSFER_OK)
  TransferBufferLength = 00000012
  TransferBuffer       = 00000000
  TransferBufferMDL    = 8615e710
    00000000: 54 fd 64 01 00 ff 64 00 80 05 60 40 02 0a 0e 58
    00000010: 40 60
  UrbLink              = 00000000
[98809 ms] UsbSnoop - FilterDispatchAny(f76d7fd2) : IRP_MJ_INTERNAL_DEVICE_CONTROL
[98809 ms] UsbSnoop - FdoHookDispatchInternalIoctl(f76d81ea) : fdo=861c0730, Irp=859d5e70, IRQL=0
[98809 ms]  >>>  URB 57 going down  >>> 
-- URB_FUNCTION_BULK_OR_INTERRUPT_TRANSFER:
  PipeHandle           = 866db8cc [endpoint 0x00000081]
  TransferFlags        = 00000003 (USBD_TRANSFER_DIRECTION_IN, USBD_SHORT_TRANSFER_OK)
  TransferBufferLength = 00000200
  TransferBuffer       = 00000000
  TransferBufferMDL    = 85e5c788
  UrbLink              = 00000000
[98938 ms] UsbSnoop - FilterDispatchAny(f76d7fd2) : IRP_MJ_INTERNAL_DEVICE_CONTROL
[98938 ms] UsbSnoop - FdoHookDispatchInternalIoctl(f76d81ea) : fdo=861c0730, Irp=859deaf0, IRQL=0
[98938 ms]  >>>  URB 58 going down  >>> 
-- URB_FUNCTION_BULK_OR_INTERRUPT_TRANSFER:
  PipeHandle           = 866db8ec [endpoint 0x00000002]
  TransferFlags        = 00000002 (USBD_TRANSFER_DIRECTION_OUT, USBD_SHORT_TRANSFER_OK)
  TransferBufferLength = 0000001b
  TransferBuffer       = 00000000
  TransferBufferMDL    = 86544868
    00000000: 54 fd 64 00 80 06 64 01 40 60 0c f1 0b 00 0f 57
    00000010: 20 01 2f 00 00 00 00 00 00 00 00
  UrbLink              = 00000000
[98939 ms] UsbSnoop - MyInternalIOCTLCompletion(f76d8126) : fido=85e673d0, Irp=859deaf0, Context=86a80f80, IRQL=2
[98939 ms]  <<<  URB 58 coming back  <<< 
-- URB_FUNCTION_BULK_OR_INTERRUPT_TRANSFER:
  PipeHandle           = 866db8ec [endpoint 0x00000002]
  TransferFlags        = 00000002 (USBD_TRANSFER_DIRECTION_OUT, USBD_SHORT_TRANSFER_OK)
  TransferBufferLength = 0000001b
  TransferBuffer       = 00000000
  TransferBufferMDL    = 86544868
  UrbLink              = 00000000
[98940 ms] UsbSnoop - MyInternalIOCTLCompletion(f76d8126) : fido=85e673d0, Irp=859d5e70, Context=85b8ca40, IRQL=2
[98940 ms]  <<<  URB 57 coming back  <<< 
-- URB_FUNCTION_BULK_OR_INTERRUPT_TRANSFER:
  PipeHandle           = 866db8cc [endpoint 0x00000081]
  TransferFlags        = 00000003 (USBD_TRANSFER_DIRECTION_IN, USBD_SHORT_TRANSFER_OK)
  TransferBufferLength = 00000012
  TransferBuffer       = 00000000
  TransferBufferMDL    = 85e5c788
    00000000: 54 fd 64 01 00 ff 64 00 80 06 60 40 02 0a 0f 5a
    00000010: 40 60
  UrbLink              = 00000000
[98940 ms] UsbSnoop - FilterDispatchAny(f76d7fd2) : IRP_MJ_INTERNAL_DEVICE_CONTROL
[98940 ms] UsbSnoop - FdoHookDispatchInternalIoctl(f76d81ea) : fdo=861c0730, Irp=859d5e70, IRQL=0
[98940 ms]  >>>  URB 59 going down  >>> 
-- URB_FUNCTION_BULK_OR_INTERRUPT_TRANSFER:
  PipeHandle           = 866db8cc [endpoint 0x00000081]
  TransferFlags        = 00000003 (USBD_TRANSFER_DIRECTION_IN, USBD_SHORT_TRANSFER_OK)
  TransferBufferLength = 00000200
  TransferBuffer       = 00000000
  TransferBufferMDL    = 85b0ba48
  UrbLink              = 00000000
[98955 ms] UsbSnoop - MyInternalIOCTLCompletion(f76d8126) : fido=85e673d0, Irp=859d5e70, Context=85b8ca40, IRQL=2
[98955 ms]  <<<  URB 59 coming back  <<< 
-- URB_FUNCTION_BULK_OR_INTERRUPT_TRANSFER:
  PipeHandle           = 866db8cc [endpoint 0x00000081]
  TransferFlags        = 00000003 (USBD_TRANSFER_DIRECTION_IN, USBD_SHORT_TRANSFER_OK)
  TransferBufferLength = 0000001b
  TransferBuffer       = 00000000
  TransferBufferMDL    = 85b0ba48
    00000000: 54 fd 64 01 40 60 64 00 80 06 f7 38 0b 00 0b 85
    00000010: 20 00 00 00 00 00 00 00 00 01 00
  UrbLink              = 00000000
[98955 ms] UsbSnoop - FilterDispatchAny(f76d7fd2) : IRP_MJ_INTERNAL_DEVICE_CONTROL
[98955 ms] UsbSnoop - FdoHookDispatchInternalIoctl(f76d81ea) : fdo=861c0730, Irp=859d5e70, IRQL=0
[98955 ms]  >>>  URB 60 going down  >>> 
-- URB_FUNCTION_BULK_OR_INTERRUPT_TRANSFER:
  PipeHandle           = 866db8ec [endpoint 0x00000002]
  TransferFlags        = 00000002 (USBD_TRANSFER_DIRECTION_OUT, USBD_SHORT_TRANSFER_OK)
  TransferBufferLength = 00000012
  TransferBuffer       = 00000000
  TransferBufferMDL    = 86abce70
    00000000: 54 fd 64 00 00 ff 64 01 40 60 06 80 02 0a 0b 56
    00000010: 80 06
  UrbLink              = 00000000
[98956 ms] UsbSnoop - MyInternalIOCTLCompletion(f76d8126) : fido=85e673d0, Irp=859d5e70, Context=85b8ca40, IRQL=2
[98956 ms]  <<<  URB 60 coming back  <<< 
-- URB_FUNCTION_BULK_OR_INTERRUPT_TRANSFER:
  PipeHandle           = 866db8ec [endpoint 0x00000002]
  TransferFlags        = 00000002 (USBD_TRANSFER_DIRECTION_OUT, USBD_SHORT_TRANSFER_OK)
  TransferBufferLength = 00000012
  TransferBuffer       = 00000000
  TransferBufferMDL    = 86abce70
  UrbLink              = 00000000
[98956 ms] UsbSnoop - FilterDispatchAny(f76d7fd2) : IRP_MJ_INTERNAL_DEVICE_CONTROL
[98956 ms] UsbSnoop - FdoHookDispatchInternalIoctl(f76d81ea) : fdo=861c0730, Irp=859d5e70, IRQL=0
[98956 ms]  >>>  URB 61 going down  >>> 
-- URB_FUNCTION_BULK_OR_INTERRUPT_TRANSFER:
  PipeHandle           = 866db8cc [endpoint 0x00000081]
  TransferFlags        = 00000003 (USBD_TRANSFER_DIRECTION_IN, USBD_SHORT_TRANSFER_OK)
  TransferBufferLength = 00000200
  TransferBuffer       = 00000000
  TransferBufferMDL    = 86abce70
  UrbLink              = 00000000
[98957 ms] UsbSnoop - FilterDispatchAny(f76d7fd2) : IRP_MJ_INTERNAL_DEVICE_CONTROL
[98957 ms] UsbSnoop - FdoHookDispatchInternalIoctl(f76d81ea) : fdo=861c0730, Irp=85a10e70, IRQL=0
[98957 ms]  >>>  URB 62 going down  >>> 
-- URB_FUNCTION_BULK_OR_INTERRUPT_TRANSFER:
  PipeHandle           = 866db8ec [endpoint 0x00000002]
  TransferFlags        = 00000002 (USBD_TRANSFER_DIRECTION_OUT, USBD_SHORT_TRANSFER_OK)
  TransferBufferLength = 00000012
  TransferBuffer       = 00000000
  TransferBufferMDL    = 85a4de68
    00000000: 54 fd 64 00 40 de 64 01 40 60 06 80 02 00 10 70
    00000010: 80 06
  UrbLink              = 00000000
[98958 ms] UsbSnoop - MyInternalIOCTLCompletion(f76d8126) : fido=85e673d0, Irp=85a10e70, Context=86a80f80, IRQL=2
[98958 ms]  <<<  URB 62 coming back  <<< 
-- URB_FUNCTION_BULK_OR_INTERRUPT_TRANSFER:
  PipeHandle           = 866db8ec [endpoint 0x00000002]
  TransferFlags        = 00000002 (USBD_TRANSFER_DIRECTION_OUT, USBD_SHORT_TRANSFER_OK)
  TransferBufferLength = 00000012
  TransferBuffer       = 00000000
  TransferBufferMDL    = 85a4de68
  UrbLink              = 00000000
[98959 ms] UsbSnoop - MyInternalIOCTLCompletion(f76d8126) : fido=85e673d0, Irp=859d5e70, Context=85b8ca40, IRQL=2
[98959 ms]  <<<  URB 61 coming back  <<< 
-- URB_FUNCTION_BULK_OR_INTERRUPT_TRANSFER:
  PipeHandle           = 866db8cc [endpoint 0x00000081]
  TransferFlags        = 00000003 (USBD_TRANSFER_DIRECTION_IN, USBD_SHORT_TRANSFER_OK)
  TransferBufferLength = 00000012
  TransferBuffer       = 00000000
  TransferBufferMDL    = 86abce70
    00000000: 54 fd 64 01 00 ff 64 00 80 06 60 40 02 0a 10 5b
    00000010: 40 60
  UrbLink              = 00000000
[98959 ms] UsbSnoop - FilterDispatchAny(f76d7fd2) : IRP_MJ_INTERNAL_DEVICE_CONTROL
[98959 ms] UsbSnoop - FdoHookDispatchInternalIoctl(f76d81ea) : fdo=861c0730, Irp=859d5e70, IRQL=0
[98959 ms]  >>>  URB 63 going down  >>> 
-- URB_FUNCTION_BULK_OR_INTERRUPT_TRANSFER:
  PipeHandle           = 866db8cc [endpoint 0x00000081]
  TransferFlags        = 00000003 (USBD_TRANSFER_DIRECTION_IN, USBD_SHORT_TRANSFER_OK)
  TransferBufferLength = 00000200
  TransferBuffer       = 00000000
  TransferBufferMDL    = 8615e710
  UrbLink              = 00000000
[98963 ms] UsbSnoop - FilterDispatchAny(f76d7fd2) : IRP_MJ_INTERNAL_DEVICE_CONTROL
[98963 ms] UsbSnoop - FdoHookDispatchInternalIoctl(f76d81ea) : fdo=861c0730, Irp=859d4e70, IRQL=0
[98963 ms]  >>>  URB 64 going down  >>> 
-- URB_FUNCTION_BULK_OR_INTERRUPT_TRANSFER:
  PipeHandle           = 866db8ec [endpoint 0x00000002]
  TransferFlags        = 00000002 (USBD_TRANSFER_DIRECTION_OUT, USBD_SHORT_TRANSFER_OK)
  TransferBufferLength = 0000001a
  TransferBuffer       = 00000000
  TransferBufferMDL    = 86544868
    00000000: 54 fd 64 00 80 07 64 01 40 60 c0 aa 0a 00 11 c6
    00000010: 0d 2f 00 00 00 00 00 00 00 00
  UrbLink              = 00000000
[98963 ms] UsbSnoop - MyInternalIOCTLCompletion(f76d8126) : fido=85e673d0, Irp=859d4e70, Context=86a80f80, IRQL=2
[98963 ms]  <<<  URB 64 coming back  <<< 
-- URB_FUNCTION_BULK_OR_INTERRUPT_TRANSFER:
  PipeHandle           = 866db8ec [endpoint 0x00000002]
  TransferFlags        = 00000002 (USBD_TRANSFER_DIRECTION_OUT, USBD_SHORT_TRANSFER_OK)
  TransferBufferLength = 0000001a
  TransferBuffer       = 00000000
  TransferBufferMDL    = 86544868
  UrbLink              = 00000000
[98966 ms] UsbSnoop - MyInternalIOCTLCompletion(f76d8126) : fido=85e673d0, Irp=859d5e70, Context=85b8ca40, IRQL=2
[98966 ms]  <<<  URB 63 coming back  <<< 
-- URB_FUNCTION_BULK_OR_INTERRUPT_TRANSFER:
  PipeHandle           = 866db8cc [endpoint 0x00000081]
  TransferFlags        = 00000003 (USBD_TRANSFER_DIRECTION_IN, USBD_SHORT_TRANSFER_OK)
  TransferBufferLength = 00000012
  TransferBuffer       = 00000000
  TransferBufferMDL    = 8615e710
    00000000: 54 fd 64 01 00 ff 64 00 80 07 60 40 02 0a 11 5d
    00000010: 40 60
  UrbLink              = 00000000
[98966 ms] UsbSnoop - FilterDispatchAny(f76d7fd2) : IRP_MJ_INTERNAL_DEVICE_CONTROL
[98966 ms] UsbSnoop - FdoHookDispatchInternalIoctl(f76d81ea) : fdo=861c0730, Irp=859d4e70, IRQL=0
[98966 ms]  >>>  URB 65 going down  >>> 
-- URB_FUNCTION_BULK_OR_INTERRUPT_TRANSFER:
  PipeHandle           = 866db8cc [endpoint 0x00000081]
  TransferFlags        = 00000003 (USBD_TRANSFER_DIRECTION_IN, USBD_SHORT_TRANSFER_OK)
  TransferBufferLength = 00000200
  TransferBuffer       = 00000000
  TransferBufferMDL    = 86af2890
  UrbLink              = 00000000
[98980 ms] UsbSnoop - MyInternalIOCTLCompletion(f76d8126) : fido=85e673d0, Irp=859d4e70, Context=85b8ca40, IRQL=2
[98980 ms]  <<<  URB 65 coming back  <<< 
-- URB_FUNCTION_BULK_OR_INTERRUPT_TRANSFER:
  PipeHandle           = 866db8cc [endpoint 0x00000081]
  TransferFlags        = 00000003 (USBD_TRANSFER_DIRECTION_IN, USBD_SHORT_TRANSFER_OK)
  TransferBufferLength = 00000012
  TransferBuffer       = 00000000
  TransferBufferMDL    = 86af2890
    00000000: 54 fd 64 01 40 60 64 00 80 07 00 ff 02 00 0c 4e
    00000010: ff 00
  UrbLink              = 00000000
[98980 ms] UsbSnoop - FilterDispatchAny(f76d7fd2) : IRP_MJ_INTERNAL_DEVICE_CONTROL
[98980 ms] UsbSnoop - FdoHookDispatchInternalIoctl(f76d81ea) : fdo=861c0730, Irp=859d4e70, IRQL=0
[98980 ms]  >>>  URB 66 going down  >>> 
-- URB_FUNCTION_BULK_OR_INTERRUPT_TRANSFER:
  PipeHandle           = 866db8ec [endpoint 0x00000002]
  TransferFlags        = 00000002 (USBD_TRANSFER_DIRECTION_OUT, USBD_SHORT_TRANSFER_OK)
  TransferBufferLength = 00000012
  TransferBuffer       = 00000000
  TransferBufferMDL    = 86a0d728
    00000000: 54 fd 64 00 00 ff 64 01 40 60 07 80 02 0a 0c 58
    00000010: 80 07
  UrbLink              = 00000000
[98981 ms] UsbSnoop - MyInternalIOCTLCompletion(f76d8126) : fido=85e673d0, Irp=859d4e70, Context=85b8ca40, IRQL=2
[98981 ms]  <<<  URB 66 coming back  <<< 
-- URB_FUNCTION_BULK_OR_INTERRUPT_TRANSFER:
  PipeHandle           = 866db8ec [endpoint 0x00000002]
  TransferFlags        = 00000002 (USBD_TRANSFER_DIRECTION_OUT, USBD_SHORT_TRANSFER_OK)
  TransferBufferLength = 00000012
  TransferBuffer       = 00000000
  TransferBufferMDL    = 86a0d728
  UrbLink              = 00000000
[98981 ms] UsbSnoop - FilterDispatchAny(f76d7fd2) : IRP_MJ_INTERNAL_DEVICE_CONTROL
[98981 ms] UsbSnoop - FdoHookDispatchInternalIoctl(f76d81ea) : fdo=861c0730, Irp=859d4e70, IRQL=0
[98981 ms]  >>>  URB 67 going down  >>> 
-- URB_FUNCTION_BULK_OR_INTERRUPT_TRANSFER:
  PipeHandle           = 866db8cc [endpoint 0x00000081]
  TransferFlags        = 00000003 (USBD_TRANSFER_DIRECTION_IN, USBD_SHORT_TRANSFER_OK)
  TransferBufferLength = 00000200
  TransferBuffer       = 00000000
  TransferBufferMDL    = 86af2890
  UrbLink              = 00000000
[98981 ms] UsbSnoop - FilterDispatchAny(f76d7fd2) : IRP_MJ_INTERNAL_DEVICE_CONTROL
[98981 ms] UsbSnoop - FdoHookDispatchInternalIoctl(f76d81ea) : fdo=861c0730, Irp=859d5e70, IRQL=0
[98981 ms]  >>>  URB 68 going down  >>> 
-- URB_FUNCTION_BULK_OR_INTERRUPT_TRANSFER:
  PipeHandle           = 866db8ec [endpoint 0x00000002]
  TransferFlags        = 00000002 (USBD_TRANSFER_DIRECTION_OUT, USBD_SHORT_TRANSFER_OK)
  TransferBufferLength = 00000011
  TransferBuffer       = 00000000
  TransferBufferMDL    = 85e5c788
    00000000: 54 fd 64 00 80 07 64 01 40 60 0e 00 01 00 12 62
    00000010: 0e
  UrbLink              = 00000000
[98982 ms] UsbSnoop - MyInternalIOCTLCompletion(f76d8126) : fido=85e673d0, Irp=859d5e70, Context=86a80f80, IRQL=2
[98982 ms]  <<<  URB 68 coming back  <<< 
-- URB_FUNCTION_BULK_OR_INTERRUPT_TRANSFER:
  PipeHandle           = 866db8ec [endpoint 0x00000002]
  TransferFlags        = 00000002 (USBD_TRANSFER_DIRECTION_OUT, USBD_SHORT_TRANSFER_OK)
  TransferBufferLength = 00000011
  TransferBuffer       = 00000000
  TransferBufferMDL    = 85e5c788
  UrbLink              = 00000000
[98984 ms] UsbSnoop - MyInternalIOCTLCompletion(f76d8126) : fido=85e673d0, Irp=859d4e70, Context=85b8ca40, IRQL=2
[98984 ms]  <<<  URB 67 coming back  <<< 
-- URB_FUNCTION_BULK_OR_INTERRUPT_TRANSFER:
  PipeHandle           = 866db8cc [endpoint 0x00000081]
  TransferFlags        = 00000003 (USBD_TRANSFER_DIRECTION_IN, USBD_SHORT_TRANSFER_OK)
  TransferBufferLength = 00000012
  TransferBuffer       = 00000000
  TransferBufferMDL    = 86af2890
    00000000: 54 fd 64 01 00 ff 64 00 80 07 60 40 02 0a 12 5e
    00000010: 40 60
  UrbLink              = 00000000
[98984 ms] UsbSnoop - FilterDispatchAny(f76d7fd2) : IRP_MJ_INTERNAL_DEVICE_CONTROL
[98984 ms] UsbSnoop - FdoHookDispatchInternalIoctl(f76d81ea) : fdo=861c0730, Irp=859f7e70, IRQL=0
[98984 ms]  >>>  URB 69 going down  >>> 
-- URB_FUNCTION_BULK_OR_INTERRUPT_TRANSFER:
  PipeHandle           = 866db8cc [endpoint 0x00000081]
  TransferFlags        = 00000003 (USBD_TRANSFER_DIRECTION_IN, USBD_SHORT_TRANSFER_OK)
  TransferBufferLength = 00000200
  TransferBuffer       = 00000000
  TransferBufferMDL    = 85e5c788
  UrbLink              = 00000000
[98992 ms] UsbSnoop - MyInternalIOCTLCompletion(f76d8126) : fido=85e673d0, Irp=859f7e70, Context=85b8ca40, IRQL=2
[98992 ms]  <<<  URB 69 coming back  <<< 
-- URB_FUNCTION_BULK_OR_INTERRUPT_TRANSFER:
  PipeHandle           = 866db8cc [endpoint 0x00000081]
  TransferFlags        = 00000003 (USBD_TRANSFER_DIRECTION_IN, USBD_SHORT_TRANSFER_OK)
  TransferBufferLength = 00000026
  TransferBuffer       = 00000000
  TransferBufferMDL    = 85e5c788
    00000000: 54 fd 64 01 40 60 64 00 80 07 11 54 16 00 0d c9
    00000010: 10 00 13 45 78 61 6d 70 6c 65 73 00 00 00 00 00
    00000020: 00 00 00 0b 01 00
  UrbLink              = 00000000
[98992 ms] UsbSnoop - FilterDispatchAny(f76d7fd2) : IRP_MJ_INTERNAL_DEVICE_CONTROL
[98992 ms] UsbSnoop - FdoHookDispatchInternalIoctl(f76d81ea) : fdo=861c0730, Irp=859f7e70, IRQL=0
[98992 ms]  >>>  URB 70 going down  >>> 
-- URB_FUNCTION_BULK_OR_INTERRUPT_TRANSFER:
  PipeHandle           = 866db8ec [endpoint 0x00000002]
  TransferFlags        = 00000002 (USBD_TRANSFER_DIRECTION_OUT, USBD_SHORT_TRANSFER_OK)
  TransferBufferLength = 00000012
  TransferBuffer       = 00000000
  TransferBufferMDL    = 86a0d728
    00000000: 54 fd 64 00 00 ff 64 01 40 60 07 80 02 0a 0d 59
    00000010: 80 07
  UrbLink              = 00000000
[98993 ms] UsbSnoop - MyInternalIOCTLCompletion(f76d8126) : fido=85e673d0, Irp=859f7e70, Context=85b8ca40, IRQL=2
[98993 ms]  <<<  URB 70 coming back  <<< 
-- URB_FUNCTION_BULK_OR_INTERRUPT_TRANSFER:
  PipeHandle           = 866db8ec [endpoint 0x00000002]
  TransferFlags        = 00000002 (USBD_TRANSFER_DIRECTION_OUT, USBD_SHORT_TRANSFER_OK)
  TransferBufferLength = 00000012
  TransferBuffer       = 00000000
  TransferBufferMDL    = 86a0d728
  UrbLink              = 00000000
[98993 ms] UsbSnoop - FilterDispatchAny(f76d7fd2) : IRP_MJ_INTERNAL_DEVICE_CONTROL
[98993 ms] UsbSnoop - FdoHookDispatchInternalIoctl(f76d81ea) : fdo=861c0730, Irp=859f7e70, IRQL=0
[98993 ms]  >>>  URB 71 going down  >>> 
-- URB_FUNCTION_BULK_OR_INTERRUPT_TRANSFER:
  PipeHandle           = 866db8cc [endpoint 0x00000081]
  TransferFlags        = 00000003 (USBD_TRANSFER_DIRECTION_IN, USBD_SHORT_TRANSFER_OK)
  TransferBufferLength = 00000200
  TransferBuffer       = 00000000
  TransferBufferMDL    = 8615e710
  UrbLink              = 00000000
[99053 ms] UsbSnoop - FilterDispatchAny(f76d7fd2) : IRP_MJ_INTERNAL_DEVICE_CONTROL
[99054 ms] UsbSnoop - FdoHookDispatchInternalIoctl(f76d81ea) : fdo=861c0730, Irp=859d4e70, IRQL=0
[99054 ms]  >>>  URB 72 going down  >>> 
-- URB_FUNCTION_BULK_OR_INTERRUPT_TRANSFER:
  PipeHandle           = 866db8ec [endpoint 0x00000002]
  TransferFlags        = 00000002 (USBD_TRANSFER_DIRECTION_OUT, USBD_SHORT_TRANSFER_OK)
  TransferBufferLength = 00000011
  TransferBuffer       = 00000000
  TransferBufferMDL    = 86ad21e8
    00000000: 54 fd 64 00 80 07 64 01 40 60 0e 00 01 00 13 63
    00000010: 0e
  UrbLink              = 00000000
[99054 ms] UsbSnoop - MyInternalIOCTLCompletion(f76d8126) : fido=85e673d0, Irp=859d4e70, Context=86a80f80, IRQL=2
[99054 ms]  <<<  URB 72 coming back  <<< 
-- URB_FUNCTION_BULK_OR_INTERRUPT_TRANSFER:
  PipeHandle           = 866db8ec [endpoint 0x00000002]
  TransferFlags        = 00000002 (USBD_TRANSFER_DIRECTION_OUT, USBD_SHORT_TRANSFER_OK)
  TransferBufferLength = 00000011
  TransferBuffer       = 00000000
  TransferBufferMDL    = 86ad21e8
  UrbLink              = 00000000
[99055 ms] UsbSnoop - MyInternalIOCTLCompletion(f76d8126) : fido=85e673d0, Irp=859f7e70, Context=85b8ca40, IRQL=2
[99055 ms]  <<<  URB 71 coming back  <<< 
-- URB_FUNCTION_BULK_OR_INTERRUPT_TRANSFER:
  PipeHandle           = 866db8cc [endpoint 0x00000081]
  TransferFlags        = 00000003 (USBD_TRANSFER_DIRECTION_IN, USBD_SHORT_TRANSFER_OK)
  TransferBufferLength = 00000012
  TransferBuffer       = 00000000
  TransferBufferMDL    = 8615e710
    00000000: 54 fd 64 01 00 ff 64 00 80 07 60 40 02 0a 13 5f
    00000010: 40 60
  UrbLink              = 00000000
[99055 ms] UsbSnoop - FilterDispatchAny(f76d7fd2) : IRP_MJ_INTERNAL_DEVICE_CONTROL
[99055 ms] UsbSnoop - FdoHookDispatchInternalIoctl(f76d81ea) : fdo=861c0730, Irp=859dae70, IRQL=0
[99055 ms]  >>>  URB 73 going down  >>> 
-- URB_FUNCTION_BULK_OR_INTERRUPT_TRANSFER:
  PipeHandle           = 866db8cc [endpoint 0x00000081]
  TransferFlags        = 00000003 (USBD_TRANSFER_DIRECTION_IN, USBD_SHORT_TRANSFER_OK)
  TransferBufferLength = 00000200
  TransferBuffer       = 00000000
  TransferBufferMDL    = 86ad21e8
  UrbLink              = 00000000
[99060 ms] UsbSnoop - MyInternalIOCTLCompletion(f76d8126) : fido=85e673d0, Irp=859dae70, Context=85b8ca40, IRQL=2
[99060 ms]  <<<  URB 73 coming back  <<< 
-- URB_FUNCTION_BULK_OR_INTERRUPT_TRANSFER:
  PipeHandle           = 866db8cc [endpoint 0x00000081]
  TransferFlags        = 00000003 (USBD_TRANSFER_DIRECTION_IN, USBD_SHORT_TRANSFER_OK)
  TransferBufferLength = 00000026
  TransferBuffer       = 00000000
  TransferBufferMDL    = 86ad21e8
    00000000: 54 fd 64 01 40 60 64 00 80 07 d1 9b 16 00 0e d1
    00000010: 10 00 13 45 78 65 6d 70 6c 65 73 00 00 00 00 00
    00000020: 00 00 00 14 01 00
  UrbLink              = 00000000
[99060 ms] UsbSnoop - FilterDispatchAny(f76d7fd2) : IRP_MJ_INTERNAL_DEVICE_CONTROL
[99060 ms] UsbSnoop - FdoHookDispatchInternalIoctl(f76d81ea) : fdo=861c0730, Irp=859dae70, IRQL=0
[99060 ms]  >>>  URB 74 going down  >>> 
-- URB_FUNCTION_BULK_OR_INTERRUPT_TRANSFER:
  PipeHandle           = 866db8ec [endpoint 0x00000002]
  TransferFlags        = 00000002 (USBD_TRANSFER_DIRECTION_OUT, USBD_SHORT_TRANSFER_OK)
  TransferBufferLength = 00000012
  TransferBuffer       = 00000000
  TransferBufferMDL    = 86af2890
    00000000: 54 fd 64 00 00 ff 64 01 40 60 07 80 02 0a 0e 5a
    00000010: 80 07
  UrbLink              = 00000000
[99061 ms] UsbSnoop - MyInternalIOCTLCompletion(f76d8126) : fido=85e673d0, Irp=859dae70, Context=85b8ca40, IRQL=2
[99061 ms]  <<<  URB 74 coming back  <<< 
-- URB_FUNCTION_BULK_OR_INTERRUPT_TRANSFER:
  PipeHandle           = 866db8ec [endpoint 0x00000002]
  TransferFlags        = 00000002 (USBD_TRANSFER_DIRECTION_OUT, USBD_SHORT_TRANSFER_OK)
  TransferBufferLength = 00000012
  TransferBuffer       = 00000000
  TransferBufferMDL    = 86af2890
  UrbLink              = 00000000
[99061 ms] UsbSnoop - FilterDispatchAny(f76d7fd2) : IRP_MJ_INTERNAL_DEVICE_CONTROL
[99061 ms] UsbSnoop - FdoHookDispatchInternalIoctl(f76d81ea) : fdo=861c0730, Irp=85951af0, IRQL=0
[99061 ms]  >>>  URB 75 going down  >>> 
-- URB_FUNCTION_BULK_OR_INTERRUPT_TRANSFER:
  PipeHandle           = 866db8cc [endpoint 0x00000081]
  TransferFlags        = 00000003 (USBD_TRANSFER_DIRECTION_IN, USBD_SHORT_TRANSFER_OK)
  TransferBufferLength = 00000200
  TransferBuffer       = 00000000
  TransferBufferMDL    = 86ad21e8
  UrbLink              = 00000000
[99062 ms] UsbSnoop - FilterDispatchAny(f76d7fd2) : IRP_MJ_INTERNAL_DEVICE_CONTROL
[99062 ms] UsbSnoop - FdoHookDispatchInternalIoctl(f76d81ea) : fdo=861c0730, Irp=859ddaf0, IRQL=0
[99062 ms]  >>>  URB 76 going down  >>> 
-- URB_FUNCTION_BULK_OR_INTERRUPT_TRANSFER:
  PipeHandle           = 866db8ec [endpoint 0x00000002]
  TransferFlags        = 00000002 (USBD_TRANSFER_DIRECTION_OUT, USBD_SHORT_TRANSFER_OK)
  TransferBufferLength = 00000011
  TransferBuffer       = 00000000
  TransferBufferMDL    = 86a6ff88
    00000000: 54 fd 64 00 80 07 64 01 40 60 0e 00 01 00 14 64
    00000010: 0e
  UrbLink              = 00000000
[99063 ms] UsbSnoop - MyInternalIOCTLCompletion(f76d8126) : fido=85e673d0, Irp=859ddaf0, Context=86a80f80, IRQL=2
[99063 ms]  <<<  URB 76 coming back  <<< 
-- URB_FUNCTION_BULK_OR_INTERRUPT_TRANSFER:
  PipeHandle           = 866db8ec [endpoint 0x00000002]
  TransferFlags        = 00000002 (USBD_TRANSFER_DIRECTION_OUT, USBD_SHORT_TRANSFER_OK)
  TransferBufferLength = 00000011
  TransferBuffer       = 00000000
  TransferBufferMDL    = 86a6ff88
  UrbLink              = 00000000
[99064 ms] UsbSnoop - MyInternalIOCTLCompletion(f76d8126) : fido=85e673d0, Irp=85951af0, Context=85b8ca40, IRQL=2
[99064 ms]  <<<  URB 75 coming back  <<< 
-- URB_FUNCTION_BULK_OR_INTERRUPT_TRANSFER:
  PipeHandle           = 866db8cc [endpoint 0x00000081]
  TransferFlags        = 00000003 (USBD_TRANSFER_DIRECTION_IN, USBD_SHORT_TRANSFER_OK)
  TransferBufferLength = 00000012
  TransferBuffer       = 00000000
  TransferBufferMDL    = 86ad21e8
    00000000: 54 fd 64 01 00 ff 64 00 80 07 60 40 02 0a 14 60
    00000010: 40 60
  UrbLink              = 00000000
[99064 ms] UsbSnoop - FilterDispatchAny(f76d7fd2) : IRP_MJ_INTERNAL_DEVICE_CONTROL
[99064 ms] UsbSnoop - FdoHookDispatchInternalIoctl(f76d81ea) : fdo=861c0730, Irp=859f5cb0, IRQL=0
[99064 ms]  >>>  URB 77 going down  >>> 
-- URB_FUNCTION_BULK_OR_INTERRUPT_TRANSFER:
  PipeHandle           = 866db8cc [endpoint 0x00000081]
  TransferFlags        = 00000003 (USBD_TRANSFER_DIRECTION_IN, USBD_SHORT_TRANSFER_OK)
  TransferBufferLength = 00000200
  TransferBuffer       = 00000000
  TransferBufferMDL    = 86a6ff88
  UrbLink              = 00000000
[99068 ms] UsbSnoop - MyInternalIOCTLCompletion(f76d8126) : fido=85e673d0, Irp=859f5cb0, Context=85b8ca40, IRQL=2
[99068 ms]  <<<  URB 77 coming back  <<< 
-- URB_FUNCTION_BULK_OR_INTERRUPT_TRANSFER:
  PipeHandle           = 866db8cc [endpoint 0x00000081]
  TransferFlags        = 00000003 (USBD_TRANSFER_DIRECTION_IN, USBD_SHORT_TRANSFER_OK)
  TransferBufferLength = 00000026
  TransferBuffer       = 00000000
  TransferBufferMDL    = 86a6ff88
    00000000: 54 fd 64 01 40 60 64 00 80 07 6b c3 16 00 0f 94
    00000010: 10 00 13 4e 6f 6d 62 72 65 73 00 00 00 00 00 00
    00000020: 00 00 00 1c 01 00
  UrbLink              = 00000000
[99068 ms] UsbSnoop - FilterDispatchAny(f76d7fd2) : IRP_MJ_INTERNAL_DEVICE_CONTROL
[99068 ms] UsbSnoop - FdoHookDispatchInternalIoctl(f76d81ea) : fdo=861c0730, Irp=859f5cb0, IRQL=0
[99068 ms]  >>>  URB 78 going down  >>> 
-- URB_FUNCTION_BULK_OR_INTERRUPT_TRANSFER:
  PipeHandle           = 866db8ec [endpoint 0x00000002]
  TransferFlags        = 00000002 (USBD_TRANSFER_DIRECTION_OUT, USBD_SHORT_TRANSFER_OK)
  TransferBufferLength = 00000012
  TransferBuffer       = 00000000
  TransferBufferMDL    = 86af2890
    00000000: 54 fd 64 00 00 ff 64 01 40 60 07 80 02 0a 0f 5b
    00000010: 80 07
  UrbLink              = 00000000
[99069 ms] UsbSnoop - MyInternalIOCTLCompletion(f76d8126) : fido=85e673d0, Irp=859f5cb0, Context=85b8ca40, IRQL=2
[99069 ms]  <<<  URB 78 coming back  <<< 
-- URB_FUNCTION_BULK_OR_INTERRUPT_TRANSFER:
  PipeHandle           = 866db8ec [endpoint 0x00000002]
  TransferFlags        = 00000002 (USBD_TRANSFER_DIRECTION_OUT, USBD_SHORT_TRANSFER_OK)
  TransferBufferLength = 00000012
  TransferBuffer       = 00000000
  TransferBufferMDL    = 86af2890
  UrbLink              = 00000000
[99069 ms] UsbSnoop - FilterDispatchAny(f76d7fd2) : IRP_MJ_INTERNAL_DEVICE_CONTROL
[99069 ms] UsbSnoop - FdoHookDispatchInternalIoctl(f76d81ea) : fdo=861c0730, Irp=859d4cb0, IRQL=0
[99069 ms]  >>>  URB 79 going down  >>> 
-- URB_FUNCTION_BULK_OR_INTERRUPT_TRANSFER:
  PipeHandle           = 866db8cc [endpoint 0x00000081]
  TransferFlags        = 00000003 (USBD_TRANSFER_DIRECTION_IN, USBD_SHORT_TRANSFER_OK)
  TransferBufferLength = 00000200
  TransferBuffer       = 00000000
  TransferBufferMDL    = 86a6ff88
  UrbLink              = 00000000
[99070 ms] UsbSnoop - FilterDispatchAny(f76d7fd2) : IRP_MJ_INTERNAL_DEVICE_CONTROL
[99070 ms] UsbSnoop - FdoHookDispatchInternalIoctl(f76d81ea) : fdo=861c0730, Irp=85dd0860, IRQL=0
[99070 ms]  >>>  URB 80 going down  >>> 
-- URB_FUNCTION_BULK_OR_INTERRUPT_TRANSFER:
  PipeHandle           = 866db8ec [endpoint 0x00000002]
  TransferFlags        = 00000002 (USBD_TRANSFER_DIRECTION_OUT, USBD_SHORT_TRANSFER_OK)
  TransferBufferLength = 00000011
  TransferBuffer       = 00000000
  TransferBufferMDL    = 86a4bc60
    00000000: 54 fd 64 00 80 07 64 01 40 60 0e 00 01 00 15 65
    00000010: 0e
  UrbLink              = 00000000
[99071 ms] UsbSnoop - MyInternalIOCTLCompletion(f76d8126) : fido=85e673d0, Irp=85dd0860, Context=86a80f80, IRQL=2
[99071 ms]  <<<  URB 80 coming back  <<< 
-- URB_FUNCTION_BULK_OR_INTERRUPT_TRANSFER:
  PipeHandle           = 866db8ec [endpoint 0x00000002]
  TransferFlags        = 00000002 (USBD_TRANSFER_DIRECTION_OUT, USBD_SHORT_TRANSFER_OK)
  TransferBufferLength = 00000011
  TransferBuffer       = 00000000
  TransferBufferMDL    = 86a4bc60
  UrbLink              = 00000000
[99072 ms] UsbSnoop - MyInternalIOCTLCompletion(f76d8126) : fido=85e673d0, Irp=859d4cb0, Context=85b8ca40, IRQL=2
[99072 ms]  <<<  URB 79 coming back  <<< 
-- URB_FUNCTION_BULK_OR_INTERRUPT_TRANSFER:
  PipeHandle           = 866db8cc [endpoint 0x00000081]
  TransferFlags        = 00000003 (USBD_TRANSFER_DIRECTION_IN, USBD_SHORT_TRANSFER_OK)
  TransferBufferLength = 00000012
  TransferBuffer       = 00000000
  TransferBufferMDL    = 86a6ff88
    00000000: 54 fd 64 01 00 ff 64 00 80 07 60 40 02 0a 15 61
    00000010: 40 60
  UrbLink              = 00000000
[99072 ms] UsbSnoop - FilterDispatchAny(f76d7fd2) : IRP_MJ_INTERNAL_DEVICE_CONTROL
[99072 ms] UsbSnoop - FdoHookDispatchInternalIoctl(f76d81ea) : fdo=861c0730, Irp=859dacb0, IRQL=0
[99072 ms]  >>>  URB 81 going down  >>> 
-- URB_FUNCTION_BULK_OR_INTERRUPT_TRANSFER:
  PipeHandle           = 866db8cc [endpoint 0x00000081]
  TransferFlags        = 00000003 (USBD_TRANSFER_DIRECTION_IN, USBD_SHORT_TRANSFER_OK)
  TransferBufferLength = 00000200
  TransferBuffer       = 00000000
  TransferBufferMDL    = 86a4bc60
  UrbLink              = 00000000
[99075 ms] UsbSnoop - MyInternalIOCTLCompletion(f76d8126) : fido=85e673d0, Irp=859dacb0, Context=85b8ca40, IRQL=2
[99075 ms]  <<<  URB 81 coming back  <<< 
-- URB_FUNCTION_BULK_OR_INTERRUPT_TRANSFER:
  PipeHandle           = 866db8cc [endpoint 0x00000081]
  TransferFlags        = 00000003 (USBD_TRANSFER_DIRECTION_IN, USBD_SHORT_TRANSFER_OK)
  TransferBufferLength = 00000012
  TransferBuffer       = 00000000
  TransferBufferMDL    = 86a4bc60
    00000000: 54 fd 64 01 40 60 64 00 80 07 11 ff 02 00 10 63
    00000010: ff 11
  UrbLink              = 00000000
[99075 ms] UsbSnoop - FilterDispatchAny(f76d7fd2) : IRP_MJ_INTERNAL_DEVICE_CONTROL
[99075 ms] UsbSnoop - FdoHookDispatchInternalIoctl(f76d81ea) : fdo=861c0730, Irp=859dacb0, IRQL=0
[99075 ms]  >>>  URB 82 going down  >>> 
-- URB_FUNCTION_BULK_OR_INTERRUPT_TRANSFER:
  PipeHandle           = 866db8ec [endpoint 0x00000002]
  TransferFlags        = 00000002 (USBD_TRANSFER_DIRECTION_OUT, USBD_SHORT_TRANSFER_OK)
  TransferBufferLength = 00000012
  TransferBuffer       = 00000000
  TransferBufferMDL    = 86af2890
    00000000: 54 fd 64 00 00 ff 64 01 40 60 07 80 02 0a 10 5c
    00000010: 80 07
  UrbLink              = 00000000
[99076 ms] UsbSnoop - MyInternalIOCTLCompletion(f76d8126) : fido=85e673d0, Irp=859dacb0, Context=85b8ca40, IRQL=2
[99076 ms]  <<<  URB 82 coming back  <<< 
-- URB_FUNCTION_BULK_OR_INTERRUPT_TRANSFER:
  PipeHandle           = 866db8ec [endpoint 0x00000002]
  TransferFlags        = 00000002 (USBD_TRANSFER_DIRECTION_OUT, USBD_SHORT_TRANSFER_OK)
  TransferBufferLength = 00000012
  TransferBuffer       = 00000000
  TransferBufferMDL    = 86af2890
  UrbLink              = 00000000
[99076 ms] UsbSnoop - FilterDispatchAny(f76d7fd2) : IRP_MJ_INTERNAL_DEVICE_CONTROL
[99076 ms] UsbSnoop - FdoHookDispatchInternalIoctl(f76d81ea) : fdo=861c0730, Irp=85a10cb0, IRQL=0
[99076 ms]  >>>  URB 83 going down  >>> 
-- URB_FUNCTION_BULK_OR_INTERRUPT_TRANSFER:
  PipeHandle           = 866db8cc [endpoint 0x00000081]
  TransferFlags        = 00000003 (USBD_TRANSFER_DIRECTION_IN, USBD_SHORT_TRANSFER_OK)
  TransferBufferLength = 00000200
  TransferBuffer       = 00000000
  TransferBufferMDL    = 86a4bc60
  UrbLink              = 00000000
[99076 ms] UsbSnoop - FilterDispatchAny(f76d7fd2) : IRP_MJ_INTERNAL_DEVICE_CONTROL
[99076 ms] UsbSnoop - FdoHookDispatchInternalIoctl(f76d81ea) : fdo=861c0730, Irp=859dacb0, IRQL=0
[99076 ms]  >>>  URB 84 going down  >>> 
-- URB_FUNCTION_BULK_OR_INTERRUPT_TRANSFER:
  PipeHandle           = 866db8ec [endpoint 0x00000002]
  TransferFlags        = 00000002 (USBD_TRANSFER_DIRECTION_OUT, USBD_SHORT_TRANSFER_OK)
  TransferBufferLength = 00000011
  TransferBuffer       = 00000000
  TransferBufferMDL    = 86b2b6e0
    00000000: 54 fd 64 00 80 07 64 01 40 60 0f 00 01 00 16 67
    00000010: 0f
  UrbLink              = 00000000
[99077 ms] UsbSnoop - MyInternalIOCTLCompletion(f76d8126) : fido=85e673d0, Irp=859dacb0, Context=86a80f80, IRQL=2
[99077 ms]  <<<  URB 84 coming back  <<< 
-- URB_FUNCTION_BULK_OR_INTERRUPT_TRANSFER:
  PipeHandle           = 866db8ec [endpoint 0x00000002]
  TransferFlags        = 00000002 (USBD_TRANSFER_DIRECTION_OUT, USBD_SHORT_TRANSFER_OK)
  TransferBufferLength = 00000011
  TransferBuffer       = 00000000
  TransferBufferMDL    = 86b2b6e0
  UrbLink              = 00000000
[99079 ms] UsbSnoop - MyInternalIOCTLCompletion(f76d8126) : fido=85e673d0, Irp=85a10cb0, Context=85b8ca40, IRQL=2
[99079 ms]  <<<  URB 83 coming back  <<< 
-- URB_FUNCTION_BULK_OR_INTERRUPT_TRANSFER:
  PipeHandle           = 866db8cc [endpoint 0x00000081]
  TransferFlags        = 00000003 (USBD_TRANSFER_DIRECTION_IN, USBD_SHORT_TRANSFER_OK)
  TransferBufferLength = 00000012
  TransferBuffer       = 00000000
  TransferBufferMDL    = 86a4bc60
    00000000: 54 fd 64 01 00 ff 64 00 80 07 60 40 02 0a 16 62
    00000010: 40 60
  UrbLink              = 00000000
[99079 ms] UsbSnoop - FilterDispatchAny(f76d7fd2) : IRP_MJ_INTERNAL_DEVICE_CONTROL
[99079 ms] UsbSnoop - FdoHookDispatchInternalIoctl(f76d81ea) : fdo=861c0730, Irp=859f8e70, IRQL=0
[99079 ms]  >>>  URB 85 going down  >>> 
-- URB_FUNCTION_BULK_OR_INTERRUPT_TRANSFER:
  PipeHandle           = 866db8cc [endpoint 0x00000081]
  TransferFlags        = 00000003 (USBD_TRANSFER_DIRECTION_IN, USBD_SHORT_TRANSFER_OK)
  TransferBufferLength = 00000200
  TransferBuffer       = 00000000
  TransferBufferMDL    = 86b2b6e0
  UrbLink              = 00000000
[99082 ms] UsbSnoop - MyInternalIOCTLCompletion(f76d8126) : fido=85e673d0, Irp=859f8e70, Context=85b8ca40, IRQL=2
[99082 ms]  <<<  URB 85 coming back  <<< 
-- URB_FUNCTION_BULK_OR_INTERRUPT_TRANSFER:
  PipeHandle           = 866db8cc [endpoint 0x00000081]
  TransferFlags        = 00000003 (USBD_TRANSFER_DIRECTION_IN, USBD_SHORT_TRANSFER_OK)
  TransferBufferLength = 00000012
  TransferBuffer       = 00000000
  TransferBufferMDL    = 86b2b6e0
    00000000: 54 fd 64 01 40 60 64 00 80 07 00 ff 02 00 11 53
    00000010: ff 00
  UrbLink              = 00000000
[99082 ms] UsbSnoop - FilterDispatchAny(f76d7fd2) : IRP_MJ_INTERNAL_DEVICE_CONTROL
[99082 ms] UsbSnoop - FdoHookDispatchInternalIoctl(f76d81ea) : fdo=861c0730, Irp=859f8e70, IRQL=0
[99082 ms]  >>>  URB 86 going down  >>> 
-- URB_FUNCTION_BULK_OR_INTERRUPT_TRANSFER:
  PipeHandle           = 866db8ec [endpoint 0x00000002]
  TransferFlags        = 00000002 (USBD_TRANSFER_DIRECTION_OUT, USBD_SHORT_TRANSFER_OK)
  TransferBufferLength = 00000012
  TransferBuffer       = 00000000
  TransferBufferMDL    = 86af2890
    00000000: 54 fd 64 00 00 ff 64 01 40 60 07 80 02 0a 11 5d
    00000010: 80 07
  UrbLink              = 00000000
[99083 ms] UsbSnoop - MyInternalIOCTLCompletion(f76d8126) : fido=85e673d0, Irp=859f8e70, Context=85b8ca40, IRQL=2
[99083 ms]  <<<  URB 86 coming back  <<< 
-- URB_FUNCTION_BULK_OR_INTERRUPT_TRANSFER:
  PipeHandle           = 866db8ec [endpoint 0x00000002]
  TransferFlags        = 00000002 (USBD_TRANSFER_DIRECTION_OUT, USBD_SHORT_TRANSFER_OK)
  TransferBufferLength = 00000012
  TransferBuffer       = 00000000
  TransferBufferMDL    = 86af2890
  UrbLink              = 00000000
[99083 ms] UsbSnoop - FilterDispatchAny(f76d7fd2) : IRP_MJ_INTERNAL_DEVICE_CONTROL
[99083 ms] UsbSnoop - FdoHookDispatchInternalIoctl(f76d81ea) : fdo=861c0730, Irp=859f8e70, IRQL=0
[99083 ms]  >>>  URB 87 going down  >>> 
-- URB_FUNCTION_BULK_OR_INTERRUPT_TRANSFER:
  PipeHandle           = 866db8cc [endpoint 0x00000081]
  TransferFlags        = 00000003 (USBD_TRANSFER_DIRECTION_IN, USBD_SHORT_TRANSFER_OK)
  TransferBufferLength = 00000200
  TransferBuffer       = 00000000
  TransferBufferMDL    = 86b2b6e0
  UrbLink              = 00000000
[99084 ms] UsbSnoop - FilterDispatchAny(f76d7fd2) : IRP_MJ_INTERNAL_DEVICE_CONTROL
[99084 ms] UsbSnoop - FdoHookDispatchInternalIoctl(f76d81ea) : fdo=861c0730, Irp=859cb9e8, IRQL=0
[99084 ms]  >>>  URB 88 going down  >>> 
-- URB_FUNCTION_BULK_OR_INTERRUPT_TRANSFER:
  PipeHandle           = 866db8ec [endpoint 0x00000002]
  TransferFlags        = 00000002 (USBD_TRANSFER_DIRECTION_OUT, USBD_SHORT_TRANSFER_OK)
  TransferBufferLength = 00000012
  TransferBuffer       = 00000000
  TransferBufferMDL    = 86a722b0
    00000000: 54 fd 64 00 40 de 64 01 40 60 07 80 02 00 17 78
    00000010: 80 07
  UrbLink              = 00000000
[99085 ms] UsbSnoop - MyInternalIOCTLCompletion(f76d8126) : fido=85e673d0, Irp=859cb9e8, Context=86a80f80, IRQL=2
[99085 ms]  <<<  URB 88 coming back  <<< 
-- URB_FUNCTION_BULK_OR_INTERRUPT_TRANSFER:
  PipeHandle           = 866db8ec [endpoint 0x00000002]
  TransferFlags        = 00000002 (USBD_TRANSFER_DIRECTION_OUT, USBD_SHORT_TRANSFER_OK)
  TransferBufferLength = 00000012
  TransferBuffer       = 00000000
  TransferBufferMDL    = 86a722b0
  UrbLink              = 00000000
[99086 ms] UsbSnoop - MyInternalIOCTLCompletion(f76d8126) : fido=85e673d0, Irp=859f8e70, Context=85b8ca40, IRQL=2
[99086 ms]  <<<  URB 87 coming back  <<< 
-- URB_FUNCTION_BULK_OR_INTERRUPT_TRANSFER:
  PipeHandle           = 866db8cc [endpoint 0x00000081]
  TransferFlags        = 00000003 (USBD_TRANSFER_DIRECTION_IN, USBD_SHORT_TRANSFER_OK)
  TransferBufferLength = 00000012
  TransferBuffer       = 00000000
  TransferBufferMDL    = 86b2b6e0
    00000000: 54 fd 64 01 00 ff 64 00 80 07 60 40 02 0a 17 63
    00000010: 40 60
  UrbLink              = 00000000
[99086 ms] UsbSnoop - FilterDispatchAny(f76d7fd2) : IRP_MJ_INTERNAL_DEVICE_CONTROL
[99086 ms] UsbSnoop - FdoHookDispatchInternalIoctl(f76d81ea) : fdo=861c0730, Irp=85fb5a40, IRQL=0
[99086 ms]  >>>  URB 89 going down  >>> 
-- URB_FUNCTION_BULK_OR_INTERRUPT_TRANSFER:
  PipeHandle           = 866db8cc [endpoint 0x00000081]
  TransferFlags        = 00000003 (USBD_TRANSFER_DIRECTION_IN, USBD_SHORT_TRANSFER_OK)
  TransferBufferLength = 00000200
  TransferBuffer       = 00000000
  TransferBufferMDL    = 86a722b0
  UrbLink              = 00000000
[99148 ms] UsbSnoop - FilterDispatchAny(f76d7fd2) : IRP_MJ_INTERNAL_DEVICE_CONTROL
[99149 ms] UsbSnoop - FdoHookDispatchInternalIoctl(f76d81ea) : fdo=861c0730, Irp=85829510, IRQL=0
[99149 ms]  >>>  URB 90 going down  >>> 
-- URB_FUNCTION_BULK_OR_INTERRUPT_TRANSFER:
  PipeHandle           = 866db8ec [endpoint 0x00000002]
  TransferFlags        = 00000002 (USBD_TRANSFER_DIRECTION_OUT, USBD_SHORT_TRANSFER_OK)
  TransferBufferLength = 00000011
  TransferBuffer       = 00000000
  TransferBufferMDL    = 86416628
    00000000: 54 fd 64 00 80 09 64 01 40 20 01 00 01 00 18 1d
    00000010: 01
  UrbLink              = 00000000
[99149 ms] UsbSnoop - MyInternalIOCTLCompletion(f76d8126) : fido=85e673d0, Irp=85829510, Context=86a80f80, IRQL=2
[99149 ms]  <<<  URB 90 coming back  <<< 
-- URB_FUNCTION_BULK_OR_INTERRUPT_TRANSFER:
  PipeHandle           = 866db8ec [endpoint 0x00000002]
  TransferFlags        = 00000002 (USBD_TRANSFER_DIRECTION_OUT, USBD_SHORT_TRANSFER_OK)
  TransferBufferLength = 00000011
  TransferBuffer       = 00000000
  TransferBufferMDL    = 86416628
  UrbLink              = 00000000
[99150 ms] UsbSnoop - MyInternalIOCTLCompletion(f76d8126) : fido=85e673d0, Irp=85fb5a40, Context=85b8ca40, IRQL=2
[99150 ms]  <<<  URB 89 coming back  <<< 
-- URB_FUNCTION_BULK_OR_INTERRUPT_TRANSFER:
  PipeHandle           = 866db8cc [endpoint 0x00000081]
  TransferFlags        = 00000003 (USBD_TRANSFER_DIRECTION_IN, USBD_SHORT_TRANSFER_OK)
  TransferBufferLength = 00000012
  TransferBuffer       = 00000000
  TransferBufferMDL    = 86a722b0
    00000000: 54 fd 64 01 00 ff 64 00 80 09 20 40 02 0a 18 26
    00000010: 40 20
  UrbLink              = 00000000
[99150 ms] UsbSnoop - FilterDispatchAny(f76d7fd2) : IRP_MJ_INTERNAL_DEVICE_CONTROL
[99150 ms] UsbSnoop - FdoHookDispatchInternalIoctl(f76d81ea) : fdo=861c0730, Irp=85fb5a40, IRQL=0
[99150 ms]  >>>  URB 91 going down  >>> 
-- URB_FUNCTION_BULK_OR_INTERRUPT_TRANSFER:
  PipeHandle           = 866db8cc [endpoint 0x00000081]
  TransferFlags        = 00000003 (USBD_TRANSFER_DIRECTION_IN, USBD_SHORT_TRANSFER_OK)
  TransferBufferLength = 00000200
  TransferBuffer       = 00000000
  TransferBufferMDL    = 85a4dee8
  UrbLink              = 00000000
[99162 ms] UsbSnoop - MyInternalIOCTLCompletion(f76d8126) : fido=85e673d0, Irp=85fb5a40, Context=85b8ca40, IRQL=2
[99162 ms]  <<<  URB 91 coming back  <<< 
-- URB_FUNCTION_BULK_OR_INTERRUPT_TRANSFER:
  PipeHandle           = 866db8cc [endpoint 0x00000081]
  TransferFlags        = 00000003 (USBD_TRANSFER_DIRECTION_IN, USBD_SHORT_TRANSFER_OK)
  TransferBufferLength = 0000007f
  TransferBuffer       = 00000000
  TransferBufferMDL    = 85a4dee8
    00000000: 54 fd 64 01 40 20 64 00 80 09 78 48 6f 00 12 44
    00000010: 01 00 00 00 00 01 65 42 00 00 00 00 00 01 be 00
    00000020: 00 00 00 00 00 01 4f a7 88 00 00 00 00 01 83 5f
    00000030: 2c 7f 00 00 5a 01 01 24 25 01 01 22 d4 01 01 23
    00000040: 15 00 00 00 00 00 02 00 00 00 00 01 40 00 f0 04
    00000050: 00 1e 30 30 30 30 34 42 43 31 42 31 30 45 35 37
    00000060: 30 46 00 30 45 30 30 30 30 30 34 42 43 31 42 31
    00000070: 30 45 35 37 30 46 43 42 32 38 30 34 46 31 00
  UrbLink              = 00000000
[99162 ms] UsbSnoop - FilterDispatchAny(f76d7fd2) : IRP_MJ_INTERNAL_DEVICE_CONTROL
[99162 ms] UsbSnoop - FdoHookDispatchInternalIoctl(f76d81ea) : fdo=861c0730, Irp=85fb5a40, IRQL=0
[99162 ms]  >>>  URB 92 going down  >>> 
-- URB_FUNCTION_BULK_OR_INTERRUPT_TRANSFER:
  PipeHandle           = 866db8ec [endpoint 0x00000002]
  TransferFlags        = 00000002 (USBD_TRANSFER_DIRECTION_OUT, USBD_SHORT_TRANSFER_OK)
  TransferBufferLength = 00000012
  TransferBuffer       = 00000000
  TransferBufferMDL    = 86336228
    00000000: 54 fd 64 00 00 ff 64 01 40 20 09 80 02 0a 12 20
    00000010: 80 09
  UrbLink              = 00000000
[99163 ms] UsbSnoop - MyInternalIOCTLCompletion(f76d8126) : fido=85e673d0, Irp=85fb5a40, Context=85b8ca40, IRQL=2
[99163 ms]  <<<  URB 92 coming back  <<< 
-- URB_FUNCTION_BULK_OR_INTERRUPT_TRANSFER:
  PipeHandle           = 866db8ec [endpoint 0x00000002]
  TransferFlags        = 00000002 (USBD_TRANSFER_DIRECTION_OUT, USBD_SHORT_TRANSFER_OK)
  TransferBufferLength = 00000012
  TransferBuffer       = 00000000
  TransferBufferMDL    = 86336228
  UrbLink              = 00000000
[99163 ms] UsbSnoop - FilterDispatchAny(f76d7fd2) : IRP_MJ_INTERNAL_DEVICE_CONTROL
[99163 ms] UsbSnoop - FdoHookDispatchInternalIoctl(f76d81ea) : fdo=861c0730, Irp=85fb5a40, IRQL=0
[99163 ms]  >>>  URB 93 going down  >>> 
-- URB_FUNCTION_BULK_OR_INTERRUPT_TRANSFER:
  PipeHandle           = 866db8cc [endpoint 0x00000081]
  TransferFlags        = 00000003 (USBD_TRANSFER_DIRECTION_IN, USBD_SHORT_TRANSFER_OK)
  TransferBufferLength = 00000200
  TransferBuffer       = 00000000
  TransferBufferMDL    = 86718760
  UrbLink              = 00000000
[99163 ms] UsbSnoop - FilterDispatchAny(f76d7fd2) : IRP_MJ_INTERNAL_DEVICE_CONTROL
[99163 ms] UsbSnoop - FdoHookDispatchInternalIoctl(f76d81ea) : fdo=861c0730, Irp=85a33c38, IRQL=0
[99163 ms]  >>>  URB 94 going down  >>> 
-- URB_FUNCTION_BULK_OR_INTERRUPT_TRANSFER:
  PipeHandle           = 866db8ec [endpoint 0x00000002]
  TransferFlags        = 00000002 (USBD_TRANSFER_DIRECTION_OUT, USBD_SHORT_TRANSFER_OK)
  TransferBufferLength = 00000011
  TransferBuffer       = 00000000
  TransferBufferMDL    = 85a4dee8
    00000000: 54 fd 64 00 80 09 64 01 40 20 02 00 01 00 19 1f
    00000010: 02
  UrbLink              = 00000000
[99164 ms] UsbSnoop - MyInternalIOCTLCompletion(f76d8126) : fido=85e673d0, Irp=85a33c38, Context=86a80f80, IRQL=2
[99164 ms]  <<<  URB 94 coming back  <<< 
-- URB_FUNCTION_BULK_OR_INTERRUPT_TRANSFER:
  PipeHandle           = 866db8ec [endpoint 0x00000002]
  TransferFlags        = 00000002 (USBD_TRANSFER_DIRECTION_OUT, USBD_SHORT_TRANSFER_OK)
  TransferBufferLength = 00000011
  TransferBuffer       = 00000000
  TransferBufferMDL    = 85a4dee8
  UrbLink              = 00000000
[99166 ms] UsbSnoop - MyInternalIOCTLCompletion(f76d8126) : fido=85e673d0, Irp=85fb5a40, Context=85b8ca40, IRQL=2
[99166 ms]  <<<  URB 93 coming back  <<< 
-- URB_FUNCTION_BULK_OR_INTERRUPT_TRANSFER:
  PipeHandle           = 866db8cc [endpoint 0x00000081]
  TransferFlags        = 00000003 (USBD_TRANSFER_DIRECTION_IN, USBD_SHORT_TRANSFER_OK)
  TransferBufferLength = 00000012
  TransferBuffer       = 00000000
  TransferBufferMDL    = 86718760
    00000000: 54 fd 64 01 00 ff 64 00 80 09 20 40 02 0a 19 27
    00000010: 40 20
  UrbLink              = 00000000
[99166 ms] UsbSnoop - FilterDispatchAny(f76d7fd2) : IRP_MJ_INTERNAL_DEVICE_CONTROL
[99166 ms] UsbSnoop - FdoHookDispatchInternalIoctl(f76d81ea) : fdo=861c0730, Irp=85fb5a40, IRQL=0
[99166 ms]  >>>  URB 95 going down  >>> 
-- URB_FUNCTION_BULK_OR_INTERRUPT_TRANSFER:
  PipeHandle           = 866db8cc [endpoint 0x00000081]
  TransferFlags        = 00000003 (USBD_TRANSFER_DIRECTION_IN, USBD_SHORT_TRANSFER_OK)
  TransferBufferLength = 00000200
  TransferBuffer       = 00000000
  TransferBufferMDL    = 86336228
  UrbLink              = 00000000
[99170 ms] UsbSnoop - MyInternalIOCTLCompletion(f76d8126) : fido=85e673d0, Irp=85fb5a40, Context=85b8ca40, IRQL=2
[99170 ms]  <<<  URB 95 coming back  <<< 
-- URB_FUNCTION_BULK_OR_INTERRUPT_TRANSFER:
  PipeHandle           = 866db8cc [endpoint 0x00000081]
  TransferFlags        = 00000003 (USBD_TRANSFER_DIRECTION_IN, USBD_SHORT_TRANSFER_OK)
  TransferBufferLength = 0000001b
  TransferBuffer       = 00000000
  TransferBufferMDL    = 86336228
    00000000: 54 fd 64 01 40 20 64 00 80 09 38 5a 0b 00 13 b3
    00000010: 02 54 49 2d 4e 73 70 69 72 65 00
  UrbLink              = 00000000
[99170 ms] UsbSnoop - FilterDispatchAny(f76d7fd2) : IRP_MJ_INTERNAL_DEVICE_CONTROL
[99170 ms] UsbSnoop - FdoHookDispatchInternalIoctl(f76d81ea) : fdo=861c0730, Irp=85fb5a40, IRQL=0
[99170 ms]  >>>  URB 96 going down  >>> 
-- URB_FUNCTION_BULK_OR_INTERRUPT_TRANSFER:
  PipeHandle           = 866db8ec [endpoint 0x00000002]
  TransferFlags        = 00000002 (USBD_TRANSFER_DIRECTION_OUT, USBD_SHORT_TRANSFER_OK)
  TransferBufferLength = 00000012
  TransferBuffer       = 00000000
  TransferBufferMDL    = 86a6e4f0
    00000000: 54 fd 64 00 00 ff 64 01 40 20 09 80 02 0a 13 21
    00000010: 80 09
  UrbLink              = 00000000
[99171 ms] UsbSnoop - MyInternalIOCTLCompletion(f76d8126) : fido=85e673d0, Irp=85fb5a40, Context=85b8ca40, IRQL=2
[99171 ms]  <<<  URB 96 coming back  <<< 
-- URB_FUNCTION_BULK_OR_INTERRUPT_TRANSFER:
  PipeHandle           = 866db8ec [endpoint 0x00000002]
  TransferFlags        = 00000002 (USBD_TRANSFER_DIRECTION_OUT, USBD_SHORT_TRANSFER_OK)
  TransferBufferLength = 00000012
  TransferBuffer       = 00000000
  TransferBufferMDL    = 86a6e4f0
  UrbLink              = 00000000
[99171 ms] UsbSnoop - FilterDispatchAny(f76d7fd2) : IRP_MJ_INTERNAL_DEVICE_CONTROL
[99171 ms] UsbSnoop - FdoHookDispatchInternalIoctl(f76d81ea) : fdo=861c0730, Irp=85a0bcd8, IRQL=0
[99171 ms]  >>>  URB 97 going down  >>> 
-- URB_FUNCTION_BULK_OR_INTERRUPT_TRANSFER:
  PipeHandle           = 866db8cc [endpoint 0x00000081]
  TransferFlags        = 00000003 (USBD_TRANSFER_DIRECTION_IN, USBD_SHORT_TRANSFER_OK)
  TransferBufferLength = 00000200
  TransferBuffer       = 00000000
  TransferBufferMDL    = 86336228
  UrbLink              = 00000000
[99171 ms] UsbSnoop - FilterDispatchAny(f76d7fd2) : IRP_MJ_INTERNAL_DEVICE_CONTROL
[99171 ms] UsbSnoop - FdoHookDispatchInternalIoctl(f76d81ea) : fdo=861c0730, Irp=85fb5a40, IRQL=0
[99171 ms]  >>>  URB 98 going down  >>> 
-- URB_FUNCTION_BULK_OR_INTERRUPT_TRANSFER:
  PipeHandle           = 866db8ec [endpoint 0x00000002]
  TransferFlags        = 00000002 (USBD_TRANSFER_DIRECTION_OUT, USBD_SHORT_TRANSFER_OK)
  TransferBufferLength = 00000011
  TransferBuffer       = 00000000
  TransferBufferMDL    = 8641d678
    00000000: 54 fd 64 00 80 09 64 01 40 20 03 00 01 00 1a 21
    00000010: 03
  UrbLink              = 00000000
[99172 ms] UsbSnoop - MyInternalIOCTLCompletion(f76d8126) : fido=85e673d0, Irp=85fb5a40, Context=86a80f80, IRQL=2
[99172 ms]  <<<  URB 98 coming back  <<< 
-- URB_FUNCTION_BULK_OR_INTERRUPT_TRANSFER:
  PipeHandle           = 866db8ec [endpoint 0x00000002]
  TransferFlags        = 00000002 (USBD_TRANSFER_DIRECTION_OUT, USBD_SHORT_TRANSFER_OK)
  TransferBufferLength = 00000011
  TransferBuffer       = 00000000
  TransferBufferMDL    = 8641d678
  UrbLink              = 00000000
[99174 ms] UsbSnoop - MyInternalIOCTLCompletion(f76d8126) : fido=85e673d0, Irp=85a0bcd8, Context=85b8ca40, IRQL=2
[99174 ms]  <<<  URB 97 coming back  <<< 
-- URB_FUNCTION_BULK_OR_INTERRUPT_TRANSFER:
  PipeHandle           = 866db8cc [endpoint 0x00000081]
  TransferFlags        = 00000003 (USBD_TRANSFER_DIRECTION_IN, USBD_SHORT_TRANSFER_OK)
  TransferBufferLength = 00000012
  TransferBuffer       = 00000000
  TransferBufferMDL    = 86336228
    00000000: 54 fd 64 01 00 ff 64 00 80 09 20 40 02 0a 1a 28
    00000010: 40 20
  UrbLink              = 00000000
[99174 ms] UsbSnoop - FilterDispatchAny(f76d7fd2) : IRP_MJ_INTERNAL_DEVICE_CONTROL
[99174 ms] UsbSnoop - FdoHookDispatchInternalIoctl(f76d81ea) : fdo=861c0730, Irp=85a0bcd8, IRQL=0
[99174 ms]  >>>  URB 99 going down  >>> 
-- URB_FUNCTION_BULK_OR_INTERRUPT_TRANSFER:
  PipeHandle           = 866db8cc [endpoint 0x00000081]
  TransferFlags        = 00000003 (USBD_TRANSFER_DIRECTION_IN, USBD_SHORT_TRANSFER_OK)
  TransferBufferLength = 00000200
  TransferBuffer       = 00000000
  TransferBufferMDL    = 86b2b6e0
  UrbLink              = 00000000
[99178 ms] UsbSnoop - MyInternalIOCTLCompletion(f76d8126) : fido=85e673d0, Irp=85a0bcd8, Context=85b8ca40, IRQL=2
[99178 ms]  <<<  URB 99 coming back  <<< 
-- URB_FUNCTION_BULK_OR_INTERRUPT_TRANSFER:
  PipeHandle           = 866db8cc [endpoint 0x00000081]
  TransferFlags        = 00000003 (USBD_TRANSFER_DIRECTION_IN, USBD_SHORT_TRANSFER_OK)
  TransferBufferLength = 0000001b
  TransferBuffer       = 00000000
  TransferBufferMDL    = 86b2b6e0
    00000000: 54 fd 64 01 40 20 64 00 80 09 96 7f 0b 00 14 37
    00000010: 03 2e 74 6e 73 00 2e 74 6e 6f 00
  UrbLink              = 00000000
[99178 ms] UsbSnoop - FilterDispatchAny(f76d7fd2) : IRP_MJ_INTERNAL_DEVICE_CONTROL
[99178 ms] UsbSnoop - FdoHookDispatchInternalIoctl(f76d81ea) : fdo=861c0730, Irp=85a0bcd8, IRQL=0
[99178 ms]  >>>  URB 100 going down  >>> 
-- URB_FUNCTION_BULK_OR_INTERRUPT_TRANSFER:
  PipeHandle           = 866db8ec [endpoint 0x00000002]
  TransferFlags        = 00000002 (USBD_TRANSFER_DIRECTION_OUT, USBD_SHORT_TRANSFER_OK)
  TransferBufferLength = 00000012
  TransferBuffer       = 00000000
  TransferBufferMDL    = 85a329d0
    00000000: 54 fd 64 00 00 ff 64 01 40 20 09 80 02 0a 14 22
    00000010: 80 09
  UrbLink              = 00000000
[99179 ms] UsbSnoop - MyInternalIOCTLCompletion(f76d8126) : fido=85e673d0, Irp=85a0bcd8, Context=85b8ca40, IRQL=2
[99179 ms]  <<<  URB 100 coming back  <<< 
-- URB_FUNCTION_BULK_OR_INTERRUPT_TRANSFER:
  PipeHandle           = 866db8ec [endpoint 0x00000002]
  TransferFlags        = 00000002 (USBD_TRANSFER_DIRECTION_OUT, USBD_SHORT_TRANSFER_OK)
  TransferBufferLength = 00000012
  TransferBuffer       = 00000000
  TransferBufferMDL    = 85a329d0
  UrbLink              = 00000000
[99179 ms] UsbSnoop - FilterDispatchAny(f76d7fd2) : IRP_MJ_INTERNAL_DEVICE_CONTROL
[99179 ms] UsbSnoop - FdoHookDispatchInternalIoctl(f76d81ea) : fdo=861c0730, Irp=85a0bcd8, IRQL=0
[99179 ms]  >>>  URB 101 going down  >>> 
-- URB_FUNCTION_BULK_OR_INTERRUPT_TRANSFER:
  PipeHandle           = 866db8cc [endpoint 0x00000081]
  TransferFlags        = 00000003 (USBD_TRANSFER_DIRECTION_IN, USBD_SHORT_TRANSFER_OK)
  TransferBufferLength = 00000200
  TransferBuffer       = 00000000
  TransferBufferMDL    = 85ae5cb0
  UrbLink              = 00000000
[99179 ms] UsbSnoop - FilterDispatchAny(f76d7fd2) : IRP_MJ_INTERNAL_DEVICE_CONTROL
[99179 ms] UsbSnoop - FdoHookDispatchInternalIoctl(f76d81ea) : fdo=861c0730, Irp=85a92e70, IRQL=0
[99179 ms]  >>>  URB 102 going down  >>> 
-- URB_FUNCTION_BULK_OR_INTERRUPT_TRANSFER:
  PipeHandle           = 866db8ec [endpoint 0x00000002]
  TransferFlags        = 00000002 (USBD_TRANSFER_DIRECTION_OUT, USBD_SHORT_TRANSFER_OK)
  TransferBufferLength = 00000012
  TransferBuffer       = 00000000
  TransferBufferMDL    = 86b2b6e0
    00000000: 54 fd 64 00 40 de 64 01 40 20 09 80 02 00 1b 3e
    00000010: 80 09
  UrbLink              = 00000000
[99180 ms] UsbSnoop - MyInternalIOCTLCompletion(f76d8126) : fido=85e673d0, Irp=85a92e70, Context=86a80f80, IRQL=2
[99180 ms]  <<<  URB 102 coming back  <<< 
-- URB_FUNCTION_BULK_OR_INTERRUPT_TRANSFER:
  PipeHandle           = 866db8ec [endpoint 0x00000002]
  TransferFlags        = 00000002 (USBD_TRANSFER_DIRECTION_OUT, USBD_SHORT_TRANSFER_OK)
  TransferBufferLength = 00000012
  TransferBuffer       = 00000000
  TransferBufferMDL    = 86b2b6e0
  UrbLink              = 00000000
[99182 ms] UsbSnoop - MyInternalIOCTLCompletion(f76d8126) : fido=85e673d0, Irp=85a0bcd8, Context=85b8ca40, IRQL=2
[99182 ms]  <<<  URB 101 coming back  <<< 
-- URB_FUNCTION_BULK_OR_INTERRUPT_TRANSFER:
  PipeHandle           = 866db8cc [endpoint 0x00000081]
  TransferFlags        = 00000003 (USBD_TRANSFER_DIRECTION_IN, USBD_SHORT_TRANSFER_OK)
  TransferBufferLength = 00000012
  TransferBuffer       = 00000000
  TransferBufferMDL    = 85ae5cb0
    00000000: 54 fd 64 01 00 ff 64 00 80 09 20 40 02 0a 1b 29
    00000010: 40 20
  UrbLink              = 00000000
[99182 ms] UsbSnoop - FilterDispatchAny(f76d7fd2) : IRP_MJ_INTERNAL_DEVICE_CONTROL
[99182 ms] UsbSnoop - FdoHookDispatchInternalIoctl(f76d81ea) : fdo=861c0730, Irp=85a0bcd8, IRQL=0
[99182 ms]  >>>  URB 103 going down  >>> 
-- URB_FUNCTION_BULK_OR_INTERRUPT_TRANSFER:
  PipeHandle           = 866db8cc [endpoint 0x00000081]
  TransferFlags        = 00000003 (USBD_TRANSFER_DIRECTION_IN, USBD_SHORT_TRANSFER_OK)
  TransferBufferLength = 00000200
  TransferBuffer       = 00000000
  TransferBufferMDL    = 85a329d0
  UrbLink              = 00000000
[99184 ms] UsbSnoop - FilterDispatchAny(f76d7fd2) : IRP_MJ_INTERNAL_DEVICE_CONTROL
[99184 ms] UsbSnoop - FdoHookDispatchInternalIoctl(f76d81ea) : fdo=861c0730, Irp=85c77660, IRQL=0
[99184 ms]  >>>  URB 104 going down  >>> 
-- URB_FUNCTION_BULK_OR_INTERRUPT_TRANSFER:
  PipeHandle           = 866db8ec [endpoint 0x00000002]
  TransferFlags        = 00000002 (USBD_TRANSFER_DIRECTION_OUT, USBD_SHORT_TRANSFER_OK)
  TransferBufferLength = 00000012
  TransferBuffer       = 00000000
  TransferBufferMDL    = 86b2b6e0
    00000000: 54 fd 64 00 40 de 64 01 40 20 08 80 02 00 1c 3e
    00000010: 80 08
  UrbLink              = 00000000
[99185 ms] UsbSnoop - MyInternalIOCTLCompletion(f76d8126) : fido=85e673d0, Irp=85c77660, Context=86a80f80, IRQL=2
[99185 ms]  <<<  URB 104 coming back  <<< 
-- URB_FUNCTION_BULK_OR_INTERRUPT_TRANSFER:
  PipeHandle           = 866db8ec [endpoint 0x00000002]
  TransferFlags        = 00000002 (USBD_TRANSFER_DIRECTION_OUT, USBD_SHORT_TRANSFER_OK)
  TransferBufferLength = 00000012
  TransferBuffer       = 00000000
  TransferBufferMDL    = 86b2b6e0
  UrbLink              = 00000000
[99186 ms] UsbSnoop - MyInternalIOCTLCompletion(f76d8126) : fido=85e673d0, Irp=85a0bcd8, Context=85b8ca40, IRQL=2
[99186 ms]  <<<  URB 103 coming back  <<< 
-- URB_FUNCTION_BULK_OR_INTERRUPT_TRANSFER:
  PipeHandle           = 866db8cc [endpoint 0x00000081]
  TransferFlags        = 00000003 (USBD_TRANSFER_DIRECTION_IN, USBD_SHORT_TRANSFER_OK)
  TransferBufferLength = 00000012
  TransferBuffer       = 00000000
  TransferBufferMDL    = 85a329d0
    00000000: 54 fd 64 01 00 ff 64 00 80 08 20 40 02 0a 1c 29
    00000010: 40 20
  UrbLink              = 00000000
[99186 ms] UsbSnoop - FilterDispatchAny(f76d7fd2) : IRP_MJ_INTERNAL_DEVICE_CONTROL
[99186 ms] UsbSnoop - FdoHookDispatchInternalIoctl(f76d81ea) : fdo=861c0730, Irp=85a0bcd8, IRQL=0
[99186 ms]  >>>  URB 105 going down  >>> 
-- URB_FUNCTION_BULK_OR_INTERRUPT_TRANSFER:
  PipeHandle           = 866db8cc [endpoint 0x00000081]
  TransferFlags        = 00000003 (USBD_TRANSFER_DIRECTION_IN, USBD_SHORT_TRANSFER_OK)
  TransferBufferLength = 00000200
  TransferBuffer       = 00000000
  TransferBufferMDL    = 85ae5cb0
  UrbLink              = 00000000
[107976 ms] UsbSnoop - FilterDispatchAny(f76d7fd2) : IRP_MJ_INTERNAL_DEVICE_CONTROL
[107976 ms] UsbSnoop - FdoHookDispatchInternalIoctl(f76d81ea) : fdo=861c0730, Irp=85a6de70, IRQL=0
[107976 ms]  >>>  URB 106 going down  >>> 
-- URB_FUNCTION_BULK_OR_INTERRUPT_TRANSFER:
  PipeHandle           = 866db8ec [endpoint 0x00000002]
  TransferFlags        = 00000002 (USBD_TRANSFER_DIRECTION_OUT, USBD_SHORT_TRANSFER_OK)
  TransferBufferLength = 00000011
  TransferBuffer       = 00000000
  TransferBufferMDL    = 85b0ba48
    00000000: 54 fd 64 00 80 0b 64 01 40 20 01 00 01 00 1d 24
    00000010: 01
  UrbLink              = 00000000
[107976 ms] UsbSnoop - MyInternalIOCTLCompletion(f76d8126) : fido=85e673d0, Irp=85a6de70, Context=86a80f80, IRQL=2
[107976 ms]  <<<  URB 106 coming back  <<< 
-- URB_FUNCTION_BULK_OR_INTERRUPT_TRANSFER:
  PipeHandle           = 866db8ec [endpoint 0x00000002]
  TransferFlags        = 00000002 (USBD_TRANSFER_DIRECTION_OUT, USBD_SHORT_TRANSFER_OK)
  TransferBufferLength = 00000011
  TransferBuffer       = 00000000
  TransferBufferMDL    = 85b0ba48
  UrbLink              = 00000000
[107977 ms] UsbSnoop - MyInternalIOCTLCompletion(f76d8126) : fido=85e673d0, Irp=85a0bcd8, Context=85b8ca40, IRQL=2
[107977 ms]  <<<  URB 105 coming back  <<< 
-- URB_FUNCTION_BULK_OR_INTERRUPT_TRANSFER:
  PipeHandle           = 866db8cc [endpoint 0x00000081]
  TransferFlags        = 00000003 (USBD_TRANSFER_DIRECTION_IN, USBD_SHORT_TRANSFER_OK)
  TransferBufferLength = 00000012
  TransferBuffer       = 00000000
  TransferBufferMDL    = 85ae5cb0
    00000000: 54 fd 64 01 00 ff 64 00 80 0b 20 40 02 0a 1d 2d
    00000010: 40 20
  UrbLink              = 00000000
[107978 ms] UsbSnoop - FilterDispatchAny(f76d7fd2) : IRP_MJ_INTERNAL_DEVICE_CONTROL
[107978 ms] UsbSnoop - FdoHookDispatchInternalIoctl(f76d81ea) : fdo=861c0730, Irp=85a0bcd8, IRQL=0
[107978 ms]  >>>  URB 107 going down  >>> 
-- URB_FUNCTION_BULK_OR_INTERRUPT_TRANSFER:
  PipeHandle           = 866db8cc [endpoint 0x00000081]
  TransferFlags        = 00000003 (USBD_TRANSFER_DIRECTION_IN, USBD_SHORT_TRANSFER_OK)
  TransferBufferLength = 00000200
  TransferBuffer       = 00000000
  TransferBufferMDL    = 86b2b6e0
  UrbLink              = 00000000
[107989 ms] UsbSnoop - MyInternalIOCTLCompletion(f76d8126) : fido=85e673d0, Irp=85a0bcd8, Context=85b8ca40, IRQL=2
[107989 ms]  <<<  URB 107 coming back  <<< 
-- URB_FUNCTION_BULK_OR_INTERRUPT_TRANSFER:
  PipeHandle           = 866db8cc [endpoint 0x00000081]
  TransferFlags        = 00000003 (USBD_TRANSFER_DIRECTION_IN, USBD_SHORT_TRANSFER_OK)
  TransferBufferLength = 0000007f
  TransferBuffer       = 00000000
  TransferBufferMDL    = 86b2b6e0
    00000000: 54 fd 64 01 40 20 64 00 80 0b 78 48 6f 00 15 49
    00000010: 01 00 00 00 00 01 65 42 00 00 00 00 00 01 be 00
    00000020: 00 00 00 00 00 01 4f a7 88 00 00 00 00 01 83 5f
    00000030: 2c 7f 00 00 5a 01 01 24 25 01 01 22 d4 01 01 23
    00000040: 15 00 00 00 00 00 02 00 00 00 00 01 40 00 f0 04
    00000050: 00 1e 30 30 30 30 34 42 43 31 42 31 30 45 35 37
    00000060: 30 46 00 30 45 30 30 30 30 30 34 42 43 31 42 31
    00000070: 30 45 35 37 30 46 43 42 32 38 30 34 46 31 00
  UrbLink              = 00000000
[107990 ms] UsbSnoop - FilterDispatchAny(f76d7fd2) : IRP_MJ_INTERNAL_DEVICE_CONTROL
[107990 ms] UsbSnoop - FdoHookDispatchInternalIoctl(f76d81ea) : fdo=861c0730, Irp=85a0bcd8, IRQL=0
[107990 ms]  >>>  URB 108 going down  >>> 
-- URB_FUNCTION_BULK_OR_INTERRUPT_TRANSFER:
  PipeHandle           = 866db8ec [endpoint 0x00000002]
  TransferFlags        = 00000002 (USBD_TRANSFER_DIRECTION_OUT, USBD_SHORT_TRANSFER_OK)
  TransferBufferLength = 00000012
  TransferBuffer       = 00000000
  TransferBufferMDL    = 85e5c788
    00000000: 54 fd 64 00 00 ff 64 01 40 20 0b 80 02 0a 15 25
    00000010: 80 0b
  UrbLink              = 00000000
[107990 ms] UsbSnoop - MyInternalIOCTLCompletion(f76d8126) : fido=85e673d0, Irp=85a0bcd8, Context=85b8ca40, IRQL=2
[107990 ms]  <<<  URB 108 coming back  <<< 
-- URB_FUNCTION_BULK_OR_INTERRUPT_TRANSFER:
  PipeHandle           = 866db8ec [endpoint 0x00000002]
  TransferFlags        = 00000002 (USBD_TRANSFER_DIRECTION_OUT, USBD_SHORT_TRANSFER_OK)
  TransferBufferLength = 00000012
  TransferBuffer       = 00000000
  TransferBufferMDL    = 85e5c788
  UrbLink              = 00000000
[107991 ms] UsbSnoop - FilterDispatchAny(f76d7fd2) : IRP_MJ_INTERNAL_DEVICE_CONTROL
[107991 ms] UsbSnoop - FdoHookDispatchInternalIoctl(f76d81ea) : fdo=861c0730, Irp=85a90cb0, IRQL=0
[107991 ms]  >>>  URB 109 going down  >>> 
-- URB_FUNCTION_BULK_OR_INTERRUPT_TRANSFER:
  PipeHandle           = 866db8cc [endpoint 0x00000081]
  TransferFlags        = 00000003 (USBD_TRANSFER_DIRECTION_IN, USBD_SHORT_TRANSFER_OK)
  TransferBufferLength = 00000200
  TransferBuffer       = 00000000
  TransferBufferMDL    = 85ae5cb0
  UrbLink              = 00000000
[107991 ms] UsbSnoop - FilterDispatchAny(f76d7fd2) : IRP_MJ_INTERNAL_DEVICE_CONTROL
[107991 ms] UsbSnoop - FdoHookDispatchInternalIoctl(f76d81ea) : fdo=861c0730, Irp=85a0bcd8, IRQL=0
[107991 ms]  >>>  URB 110 going down  >>> 
-- URB_FUNCTION_BULK_OR_INTERRUPT_TRANSFER:
  PipeHandle           = 866db8ec [endpoint 0x00000002]
  TransferFlags        = 00000002 (USBD_TRANSFER_DIRECTION_OUT, USBD_SHORT_TRANSFER_OK)
  TransferBufferLength = 00000011
  TransferBuffer       = 00000000
  TransferBufferMDL    = 85e5c788
    00000000: 54 fd 64 00 80 0b 64 01 40 20 02 00 01 00 1e 26
    00000010: 02
  UrbLink              = 00000000
[107991 ms] UsbSnoop - MyInternalIOCTLCompletion(f76d8126) : fido=85e673d0, Irp=85a0bcd8, Context=86a80f80, IRQL=2
[107991 ms]  <<<  URB 110 coming back  <<< 
-- URB_FUNCTION_BULK_OR_INTERRUPT_TRANSFER:
  PipeHandle           = 866db8ec [endpoint 0x00000002]
  TransferFlags        = 00000002 (USBD_TRANSFER_DIRECTION_OUT, USBD_SHORT_TRANSFER_OK)
  TransferBufferLength = 00000011
  TransferBuffer       = 00000000
  TransferBufferMDL    = 85e5c788
  UrbLink              = 00000000
[107993 ms] UsbSnoop - MyInternalIOCTLCompletion(f76d8126) : fido=85e673d0, Irp=85a90cb0, Context=85b8ca40, IRQL=2
[107993 ms]  <<<  URB 109 coming back  <<< 
-- URB_FUNCTION_BULK_OR_INTERRUPT_TRANSFER:
  PipeHandle           = 866db8cc [endpoint 0x00000081]
  TransferFlags        = 00000003 (USBD_TRANSFER_DIRECTION_IN, USBD_SHORT_TRANSFER_OK)
  TransferBufferLength = 00000012
  TransferBuffer       = 00000000
  TransferBufferMDL    = 85ae5cb0
    00000000: 54 fd 64 01 00 ff 64 00 80 0b 20 40 02 0a 1e 2e
    00000010: 40 20
  UrbLink              = 00000000
[107994 ms] UsbSnoop - FilterDispatchAny(f76d7fd2) : IRP_MJ_INTERNAL_DEVICE_CONTROL
[107994 ms] UsbSnoop - FdoHookDispatchInternalIoctl(f76d81ea) : fdo=861c0730, Irp=85a6fe70, IRQL=0
[107994 ms]  >>>  URB 111 going down  >>> 
-- URB_FUNCTION_BULK_OR_INTERRUPT_TRANSFER:
  PipeHandle           = 866db8cc [endpoint 0x00000081]
  TransferFlags        = 00000003 (USBD_TRANSFER_DIRECTION_IN, USBD_SHORT_TRANSFER_OK)
  TransferBufferLength = 00000200
  TransferBuffer       = 00000000
  TransferBufferMDL    = 85e5c788
  UrbLink              = 00000000
[107997 ms] UsbSnoop - MyInternalIOCTLCompletion(f76d8126) : fido=85e673d0, Irp=85a6fe70, Context=85b8ca40, IRQL=2
[107997 ms]  <<<  URB 111 coming back  <<< 
-- URB_FUNCTION_BULK_OR_INTERRUPT_TRANSFER:
  PipeHandle           = 866db8cc [endpoint 0x00000081]
  TransferFlags        = 00000003 (USBD_TRANSFER_DIRECTION_IN, USBD_SHORT_TRANSFER_OK)
  TransferBufferLength = 0000001b
  TransferBuffer       = 00000000
  TransferBufferMDL    = 85e5c788
    00000000: 54 fd 64 01 40 20 64 00 80 0b 38 5a 0b 00 16 b8
    00000010: 02 54 49 2d 4e 73 70 69 72 65 00
  UrbLink              = 00000000
[107998 ms] UsbSnoop - FilterDispatchAny(f76d7fd2) : IRP_MJ_INTERNAL_DEVICE_CONTROL
[107998 ms] UsbSnoop - FdoHookDispatchInternalIoctl(f76d81ea) : fdo=861c0730, Irp=85a6fe70, IRQL=0
[107998 ms]  >>>  URB 112 going down  >>> 
-- URB_FUNCTION_BULK_OR_INTERRUPT_TRANSFER:
  PipeHandle           = 866db8ec [endpoint 0x00000002]
  TransferFlags        = 00000002 (USBD_TRANSFER_DIRECTION_OUT, USBD_SHORT_TRANSFER_OK)
  TransferBufferLength = 00000012
  TransferBuffer       = 00000000
  TransferBufferMDL    = 86b2b6e0
    00000000: 54 fd 64 00 00 ff 64 01 40 20 0b 80 02 0a 16 26
    00000010: 80 0b
  UrbLink              = 00000000
[107998 ms] UsbSnoop - MyInternalIOCTLCompletion(f76d8126) : fido=85e673d0, Irp=85a6fe70, Context=85b8ca40, IRQL=2
[107998 ms]  <<<  URB 112 coming back  <<< 
-- URB_FUNCTION_BULK_OR_INTERRUPT_TRANSFER:
  PipeHandle           = 866db8ec [endpoint 0x00000002]
  TransferFlags        = 00000002 (USBD_TRANSFER_DIRECTION_OUT, USBD_SHORT_TRANSFER_OK)
  TransferBufferLength = 00000012
  TransferBuffer       = 00000000
  TransferBufferMDL    = 86b2b6e0
  UrbLink              = 00000000
[107999 ms] UsbSnoop - FilterDispatchAny(f76d7fd2) : IRP_MJ_INTERNAL_DEVICE_CONTROL
[107999 ms] UsbSnoop - FdoHookDispatchInternalIoctl(f76d81ea) : fdo=861c0730, Irp=85e39cb0, IRQL=0
[107999 ms]  >>>  URB 113 going down  >>> 
-- URB_FUNCTION_BULK_OR_INTERRUPT_TRANSFER:
  PipeHandle           = 866db8cc [endpoint 0x00000081]
  TransferFlags        = 00000003 (USBD_TRANSFER_DIRECTION_IN, USBD_SHORT_TRANSFER_OK)
  TransferBufferLength = 00000200
  TransferBuffer       = 00000000
  TransferBufferMDL    = 85e5c788
  UrbLink              = 00000000
[107999 ms] UsbSnoop - FilterDispatchAny(f76d7fd2) : IRP_MJ_INTERNAL_DEVICE_CONTROL
[107999 ms] UsbSnoop - FdoHookDispatchInternalIoctl(f76d81ea) : fdo=861c0730, Irp=85a6fe70, IRQL=0
[107999 ms]  >>>  URB 114 going down  >>> 
-- URB_FUNCTION_BULK_OR_INTERRUPT_TRANSFER:
  PipeHandle           = 866db8ec [endpoint 0x00000002]
  TransferFlags        = 00000002 (USBD_TRANSFER_DIRECTION_OUT, USBD_SHORT_TRANSFER_OK)
  TransferBufferLength = 00000011
  TransferBuffer       = 00000000
  TransferBufferMDL    = 86a6e4f0
    00000000: 54 fd 64 00 80 0b 64 01 40 20 03 00 01 00 1f 28
    00000010: 03
  UrbLink              = 00000000
[107999 ms] UsbSnoop - MyInternalIOCTLCompletion(f76d8126) : fido=85e673d0, Irp=85a6fe70, Context=86a80f80, IRQL=2
[107999 ms]  <<<  URB 114 coming back  <<< 
-- URB_FUNCTION_BULK_OR_INTERRUPT_TRANSFER:
  PipeHandle           = 866db8ec [endpoint 0x00000002]
  TransferFlags        = 00000002 (USBD_TRANSFER_DIRECTION_OUT, USBD_SHORT_TRANSFER_OK)
  TransferBufferLength = 00000011
  TransferBuffer       = 00000000
  TransferBufferMDL    = 86a6e4f0
  UrbLink              = 00000000
[108001 ms] UsbSnoop - MyInternalIOCTLCompletion(f76d8126) : fido=85e673d0, Irp=85e39cb0, Context=85b8ca40, IRQL=2
[108001 ms]  <<<  URB 113 coming back  <<< 
-- URB_FUNCTION_BULK_OR_INTERRUPT_TRANSFER:
  PipeHandle           = 866db8cc [endpoint 0x00000081]
  TransferFlags        = 00000003 (USBD_TRANSFER_DIRECTION_IN, USBD_SHORT_TRANSFER_OK)
  TransferBufferLength = 00000012
  TransferBuffer       = 00000000
  TransferBufferMDL    = 85e5c788
    00000000: 54 fd 64 01 00 ff 64 00 80 0b 20 40 02 0a 1f 2f
    00000010: 40 20
  UrbLink              = 00000000
[108002 ms] UsbSnoop - FilterDispatchAny(f76d7fd2) : IRP_MJ_INTERNAL_DEVICE_CONTROL
[108002 ms] UsbSnoop - FdoHookDispatchInternalIoctl(f76d81ea) : fdo=861c0730, Irp=869c7cb0, IRQL=0
[108002 ms]  >>>  URB 115 going down  >>> 
-- URB_FUNCTION_BULK_OR_INTERRUPT_TRANSFER:
  PipeHandle           = 866db8cc [endpoint 0x00000081]
  TransferFlags        = 00000003 (USBD_TRANSFER_DIRECTION_IN, USBD_SHORT_TRANSFER_OK)
  TransferBufferLength = 00000200
  TransferBuffer       = 00000000
  TransferBufferMDL    = 86a6e4f0
  UrbLink              = 00000000
[108005 ms] UsbSnoop - MyInternalIOCTLCompletion(f76d8126) : fido=85e673d0, Irp=869c7cb0, Context=85b8ca40, IRQL=2
[108005 ms]  <<<  URB 115 coming back  <<< 
-- URB_FUNCTION_BULK_OR_INTERRUPT_TRANSFER:
  PipeHandle           = 866db8cc [endpoint 0x00000081]
  TransferFlags        = 00000003 (USBD_TRANSFER_DIRECTION_IN, USBD_SHORT_TRANSFER_OK)
  TransferBufferLength = 0000001b
  TransferBuffer       = 00000000
  TransferBufferMDL    = 86a6e4f0
    00000000: 54 fd 64 01 40 20 64 00 80 0b 96 7f 0b 00 17 3c
    00000010: 03 2e 74 6e 73 00 2e 74 6e 6f 00
  UrbLink              = 00000000
[108006 ms] UsbSnoop - FilterDispatchAny(f76d7fd2) : IRP_MJ_INTERNAL_DEVICE_CONTROL
[108006 ms] UsbSnoop - FdoHookDispatchInternalIoctl(f76d81ea) : fdo=861c0730, Irp=869c7cb0, IRQL=0
[108006 ms]  >>>  URB 116 going down  >>> 
-- URB_FUNCTION_BULK_OR_INTERRUPT_TRANSFER:
  PipeHandle           = 866db8ec [endpoint 0x00000002]
  TransferFlags        = 00000002 (USBD_TRANSFER_DIRECTION_OUT, USBD_SHORT_TRANSFER_OK)
  TransferBufferLength = 00000012
  TransferBuffer       = 00000000
  TransferBufferMDL    = 86b2b6e0
    00000000: 54 fd 64 00 00 ff 64 01 40 20 0b 80 02 0a 17 27
    00000010: 80 0b
  UrbLink              = 00000000
[108006 ms] UsbSnoop - MyInternalIOCTLCompletion(f76d8126) : fido=85e673d0, Irp=869c7cb0, Context=85b8ca40, IRQL=2
[108006 ms]  <<<  URB 116 coming back  <<< 
-- URB_FUNCTION_BULK_OR_INTERRUPT_TRANSFER:
  PipeHandle           = 866db8ec [endpoint 0x00000002]
  TransferFlags        = 00000002 (USBD_TRANSFER_DIRECTION_OUT, USBD_SHORT_TRANSFER_OK)
  TransferBufferLength = 00000012
  TransferBuffer       = 00000000
  TransferBufferMDL    = 86b2b6e0
  UrbLink              = 00000000
[108007 ms] UsbSnoop - FilterDispatchAny(f76d7fd2) : IRP_MJ_INTERNAL_DEVICE_CONTROL
[108007 ms] UsbSnoop - FdoHookDispatchInternalIoctl(f76d81ea) : fdo=861c0730, Irp=86586858, IRQL=0
[108007 ms]  >>>  URB 117 going down  >>> 
-- URB_FUNCTION_BULK_OR_INTERRUPT_TRANSFER:
  PipeHandle           = 866db8cc [endpoint 0x00000081]
  TransferFlags        = 00000003 (USBD_TRANSFER_DIRECTION_IN, USBD_SHORT_TRANSFER_OK)
  TransferBufferLength = 00000200
  TransferBuffer       = 00000000
  TransferBufferMDL    = 86a6e4f0
  UrbLink              = 00000000
[108007 ms] UsbSnoop - FilterDispatchAny(f76d7fd2) : IRP_MJ_INTERNAL_DEVICE_CONTROL
[108007 ms] UsbSnoop - FdoHookDispatchInternalIoctl(f76d81ea) : fdo=861c0730, Irp=869c7cb0, IRQL=0
[108007 ms]  >>>  URB 118 going down  >>> 
-- URB_FUNCTION_BULK_OR_INTERRUPT_TRANSFER:
  PipeHandle           = 866db8ec [endpoint 0x00000002]
  TransferFlags        = 00000002 (USBD_TRANSFER_DIRECTION_OUT, USBD_SHORT_TRANSFER_OK)
  TransferBufferLength = 00000012
  TransferBuffer       = 00000000
  TransferBufferMDL    = 85ae5cb0
    00000000: 54 fd 64 00 40 de 64 01 40 20 0b 80 02 00 20 45
    00000010: 80 0b
  UrbLink              = 00000000
[108007 ms] UsbSnoop - MyInternalIOCTLCompletion(f76d8126) : fido=85e673d0, Irp=869c7cb0, Context=86a80f80, IRQL=2
[108007 ms]  <<<  URB 118 coming back  <<< 
-- URB_FUNCTION_BULK_OR_INTERRUPT_TRANSFER:
  PipeHandle           = 866db8ec [endpoint 0x00000002]
  TransferFlags        = 00000002 (USBD_TRANSFER_DIRECTION_OUT, USBD_SHORT_TRANSFER_OK)
  TransferBufferLength = 00000012
  TransferBuffer       = 00000000
  TransferBufferMDL    = 85ae5cb0
  UrbLink              = 00000000
[108009 ms] UsbSnoop - MyInternalIOCTLCompletion(f76d8126) : fido=85e673d0, Irp=86586858, Context=85b8ca40, IRQL=2
[108009 ms]  <<<  URB 117 coming back  <<< 
-- URB_FUNCTION_BULK_OR_INTERRUPT_TRANSFER:
  PipeHandle           = 866db8cc [endpoint 0x00000081]
  TransferFlags        = 00000003 (USBD_TRANSFER_DIRECTION_IN, USBD_SHORT_TRANSFER_OK)
  TransferBufferLength = 00000012
  TransferBuffer       = 00000000
  TransferBufferMDL    = 86a6e4f0
    00000000: 54 fd 64 01 00 ff 64 00 80 0b 20 40 02 0a 20 30
    00000010: 40 20
  UrbLink              = 00000000
[108010 ms] UsbSnoop - FilterDispatchAny(f76d7fd2) : IRP_MJ_INTERNAL_DEVICE_CONTROL
[108010 ms] UsbSnoop - FdoHookDispatchInternalIoctl(f76d81ea) : fdo=861c0730, Irp=85c78660, IRQL=0
[108010 ms]  >>>  URB 119 going down  >>> 
-- URB_FUNCTION_BULK_OR_INTERRUPT_TRANSFER:
  PipeHandle           = 866db8cc [endpoint 0x00000081]
  TransferFlags        = 00000003 (USBD_TRANSFER_DIRECTION_IN, USBD_SHORT_TRANSFER_OK)
  TransferBufferLength = 00000200
  TransferBuffer       = 00000000
  TransferBufferMDL    = 85ae5cb0
  UrbLink              = 00000000
[108011 ms] UsbSnoop - FilterDispatchAny(f76d7fd2) : IRP_MJ_INTERNAL_DEVICE_CONTROL
[108011 ms] UsbSnoop - FdoHookDispatchInternalIoctl(f76d81ea) : fdo=861c0730, Irp=85a6dcd8, IRQL=0
[108011 ms]  >>>  URB 120 going down  >>> 
-- URB_FUNCTION_BULK_OR_INTERRUPT_TRANSFER:
  PipeHandle           = 866db8ec [endpoint 0x00000002]
  TransferFlags        = 00000002 (USBD_TRANSFER_DIRECTION_OUT, USBD_SHORT_TRANSFER_OK)
  TransferBufferLength = 00000012
  TransferBuffer       = 00000000
  TransferBufferMDL    = 85a329d0
    00000000: 54 fd 64 00 40 de 64 01 40 20 0a 80 02 00 21 45
    00000010: 80 0a
  UrbLink              = 00000000
[108012 ms] UsbSnoop - MyInternalIOCTLCompletion(f76d8126) : fido=85e673d0, Irp=85a6dcd8, Context=86a80f80, IRQL=2
[108012 ms]  <<<  URB 120 coming back  <<< 
-- URB_FUNCTION_BULK_OR_INTERRUPT_TRANSFER:
  PipeHandle           = 866db8ec [endpoint 0x00000002]
  TransferFlags        = 00000002 (USBD_TRANSFER_DIRECTION_OUT, USBD_SHORT_TRANSFER_OK)
  TransferBufferLength = 00000012
  TransferBuffer       = 00000000
  TransferBufferMDL    = 85a329d0
  UrbLink              = 00000000
[108013 ms] UsbSnoop - MyInternalIOCTLCompletion(f76d8126) : fido=85e673d0, Irp=85c78660, Context=85b8ca40, IRQL=2
[108013 ms]  <<<  URB 119 coming back  <<< 
-- URB_FUNCTION_BULK_OR_INTERRUPT_TRANSFER:
  PipeHandle           = 866db8cc [endpoint 0x00000081]
  TransferFlags        = 00000003 (USBD_TRANSFER_DIRECTION_IN, USBD_SHORT_TRANSFER_OK)
  TransferBufferLength = 00000012
  TransferBuffer       = 00000000
  TransferBufferMDL    = 85ae5cb0
    00000000: 54 fd 64 01 00 ff 64 00 80 0a 20 40 02 0a 21 30
    00000010: 40 20
  UrbLink              = 00000000
[108014 ms] UsbSnoop - FilterDispatchAny(f76d7fd2) : IRP_MJ_INTERNAL_DEVICE_CONTROL
[108014 ms] UsbSnoop - FdoHookDispatchInternalIoctl(f76d81ea) : fdo=861c0730, Irp=85bdecb0, IRQL=0
[108014 ms]  >>>  URB 121 going down  >>> 
-- URB_FUNCTION_BULK_OR_INTERRUPT_TRANSFER:
  PipeHandle           = 866db8cc [endpoint 0x00000081]
  TransferFlags        = 00000003 (USBD_TRANSFER_DIRECTION_IN, USBD_SHORT_TRANSFER_OK)
  TransferBufferLength = 00000200
  TransferBuffer       = 00000000
  TransferBufferMDL    = 85b0ba48
  UrbLink              = 00000000
[108210 ms] UsbSnoop - FilterDispatchAny(f76d7fd2) : IRP_MJ_INTERNAL_DEVICE_CONTROL
[108210 ms] UsbSnoop - FdoHookDispatchInternalIoctl(f76d81ea) : fdo=861c0730, Irp=85c78660, IRQL=0
[108210 ms]  >>>  URB 122 going down  >>> 
-- URB_FUNCTION_BULK_OR_INTERRUPT_TRANSFER:
  PipeHandle           = 866db8ec [endpoint 0x00000002]
  TransferFlags        = 00000002 (USBD_TRANSFER_DIRECTION_OUT, USBD_SHORT_TRANSFER_OK)
  TransferBufferLength = 00000011
  TransferBuffer       = 00000000
  TransferBufferMDL    = 86b2b6e0
    00000000: 54 fd 64 00 80 0c 64 01 40 24 00 00 01 00 22 2d
    00000010: 00
  UrbLink              = 00000000
[108210 ms] UsbSnoop - MyInternalIOCTLCompletion(f76d8126) : fido=85e673d0, Irp=85c78660, Context=86a80f80, IRQL=2
[108210 ms]  <<<  URB 122 coming back  <<< 
-- URB_FUNCTION_BULK_OR_INTERRUPT_TRANSFER:
  PipeHandle           = 866db8ec [endpoint 0x00000002]
  TransferFlags        = 00000002 (USBD_TRANSFER_DIRECTION_OUT, USBD_SHORT_TRANSFER_OK)
  TransferBufferLength = 00000011
  TransferBuffer       = 00000000
  TransferBufferMDL    = 86b2b6e0
  UrbLink              = 00000000
[108211 ms] UsbSnoop - MyInternalIOCTLCompletion(f76d8126) : fido=85e673d0, Irp=85bdecb0, Context=85b8ca40, IRQL=2
[108211 ms]  <<<  URB 121 coming back  <<< 
-- URB_FUNCTION_BULK_OR_INTERRUPT_TRANSFER:
  PipeHandle           = 866db8cc [endpoint 0x00000081]
  TransferFlags        = 00000003 (USBD_TRANSFER_DIRECTION_IN, USBD_SHORT_TRANSFER_OK)
  TransferBufferLength = 00000012
  TransferBuffer       = 00000000
  TransferBufferMDL    = 85b0ba48
    00000000: 54 fd 64 01 00 ff 64 00 80 0c 24 40 02 0a 22 37
    00000010: 40 24
  UrbLink              = 00000000
[108212 ms] UsbSnoop - FilterDispatchAny(f76d7fd2) : IRP_MJ_INTERNAL_DEVICE_CONTROL
[108212 ms] UsbSnoop - FdoHookDispatchInternalIoctl(f76d81ea) : fdo=861c0730, Irp=85e39cb0, IRQL=0
[108212 ms]  >>>  URB 123 going down  >>> 
-- URB_FUNCTION_BULK_OR_INTERRUPT_TRANSFER:
  PipeHandle           = 866db8cc [endpoint 0x00000081]
  TransferFlags        = 00000003 (USBD_TRANSFER_DIRECTION_IN, USBD_SHORT_TRANSFER_OK)
  TransferBufferLength = 00000200
  TransferBuffer       = 00000000
  TransferBufferMDL    = 86b2b6e0
  UrbLink              = 00000000
[108257 ms] UsbSnoop - MyInternalIOCTLCompletion(f76d8126) : fido=85e673d0, Irp=85e39cb0, Context=85b8ca40, IRQL=2
[108257 ms]  <<<  URB 123 coming back  <<< 
-- URB_FUNCTION_BULK_OR_INTERRUPT_TRANSFER:
  PipeHandle           = 866db8cc [endpoint 0x00000081]
  TransferFlags        = 00000003 (USBD_TRANSFER_DIRECTION_IN, USBD_SHORT_TRANSFER_OK)
  TransferBufferLength = 0000001f
  TransferBuffer       = 00000000
  TransferBufferMDL    = 86b2b6e0
    00000000: 54 fd 64 01 40 24 64 00 80 0c 6e 4b 0f 00 18 ea
    00000010: 01 00 00 1d 3b 00 00 00 00 01 40 00 f0 04 00
  UrbLink              = 00000000
[108258 ms] UsbSnoop - FilterDispatchAny(f76d7fd2) : IRP_MJ_INTERNAL_DEVICE_CONTROL
[108258 ms] UsbSnoop - FdoHookDispatchInternalIoctl(f76d81ea) : fdo=861c0730, Irp=85e39cb0, IRQL=0
[108258 ms]  >>>  URB 124 going down  >>> 
-- URB_FUNCTION_BULK_OR_INTERRUPT_TRANSFER:
  PipeHandle           = 866db8ec [endpoint 0x00000002]
  TransferFlags        = 00000002 (USBD_TRANSFER_DIRECTION_OUT, USBD_SHORT_TRANSFER_OK)
  TransferBufferLength = 00000012
  TransferBuffer       = 00000000
  TransferBufferMDL    = 85a4de68
    00000000: 54 fd 64 00 00 ff 64 01 40 24 0c 80 02 0a 18 2d
    00000010: 80 0c
  UrbLink              = 00000000
[108258 ms] UsbSnoop - MyInternalIOCTLCompletion(f76d8126) : fido=85e673d0, Irp=85e39cb0, Context=85b8ca40, IRQL=2
[108258 ms]  <<<  URB 124 coming back  <<< 
-- URB_FUNCTION_BULK_OR_INTERRUPT_TRANSFER:
  PipeHandle           = 866db8ec [endpoint 0x00000002]
  TransferFlags        = 00000002 (USBD_TRANSFER_DIRECTION_OUT, USBD_SHORT_TRANSFER_OK)
  TransferBufferLength = 00000012
  TransferBuffer       = 00000000
  TransferBufferMDL    = 85a4de68
  UrbLink              = 00000000
[108259 ms] UsbSnoop - FilterDispatchAny(f76d7fd2) : IRP_MJ_INTERNAL_DEVICE_CONTROL
[108259 ms] UsbSnoop - FdoHookDispatchInternalIoctl(f76d81ea) : fdo=861c0730, Irp=85e39cb0, IRQL=0
[108259 ms]  >>>  URB 125 going down  >>> 
-- URB_FUNCTION_BULK_OR_INTERRUPT_TRANSFER:
  PipeHandle           = 866db8cc [endpoint 0x00000081]
  TransferFlags        = 00000003 (USBD_TRANSFER_DIRECTION_IN, USBD_SHORT_TRANSFER_OK)
  TransferBufferLength = 00000200
  TransferBuffer       = 00000000
  TransferBufferMDL    = 86abce70
  UrbLink              = 00000000
[108262 ms] UsbSnoop - MyInternalIOCTLCompletion(f76d8126) : fido=85e673d0, Irp=85e39cb0, Context=85b8ca40, IRQL=2
[108262 ms]  <<<  URB 125 coming back  <<< 
-- URB_FUNCTION_BULK_OR_INTERRUPT_TRANSFER:
  PipeHandle           = 866db8cc [endpoint 0x00000081]
  TransferFlags        = 00000003 (USBD_TRANSFER_DIRECTION_IN, USBD_SHORT_TRANSFER_OK)
  TransferBufferLength = 0000010e
  TransferBuffer       = 00000000
  TransferBufferMDL    = 86abce70
    00000000: 54 fd 64 01 40 24 64 00 80 0c 73 f9 fe 00 19 8d
    00000010: 02 7f ee 7f ee 7f ee 7f ee 79 ee fe e0 00 00 7f
    00000020: ee 1b ee fc e0 0e ee ee 00 7f ee 1a ee 00 0e fc
    00000030: ee ee ee cc 0e 7f ee 19 ee 00 06 03 66 00 0e 03
    00000040: ee fd e0 ee ee 0e 0d ee fc e0 ee 0e ee 0e 0b ee
    00000050: ff e0 0e 70 ee 00 06 03 66 00 0e fe ee ee ee fc
    00000060: e0 e0 e0 ee 0e 0d ee fc e0 ee 0e ee 0e 0b ee ff
    00000070: 0e 0e 70 ee 00 06 03 66 00 0e 03 ee e2 00 0e ee
    00000080: 0e 00 ee ee 0e 00 ee ee 00 0e ee e0 ee ee 0e ee
    00000090: ee 0e ee 0e ee ee 00 0e ee e0 e0 00 04 ee 00 0e
    000000a0: 70 ee 00 06 03 66 00 0e 03 ee e1 00 0e ee 00 ee
    000000b0: 0e ee 00 ee ee e0 ee e0 ee e0 ee ee 0e e0 ee 0e
    000000c0: ee 0e ee e0 ee e0 ee e0 0e ee 0e 03 ee 00 0e 70
    000000d0: ee 00 06 03 66 00 0e fe ee ee ee e0 e0 e0 e0 ee
    000000e0: 0e ee e0 ee 0e ee ee 0e ee ee 0e e0 ee ee 0e e0
    000000f0: ee 0e ee 0e ee 0e ee ee 0e e0 ee ee 0e 03 ee 00
    00000100: 0e 70 ee 00 06 03 66 00 0e 03 ee e1 e0 ee
  UrbLink              = 00000000
[108263 ms] UsbSnoop - FilterDispatchAny(f76d7fd2) : IRP_MJ_INTERNAL_DEVICE_CONTROL
[108263 ms] UsbSnoop - FdoHookDispatchInternalIoctl(f76d81ea) : fdo=861c0730, Irp=85e39cb0, IRQL=0
[108263 ms]  >>>  URB 126 going down  >>> 
-- URB_FUNCTION_BULK_OR_INTERRUPT_TRANSFER:
  PipeHandle           = 866db8ec [endpoint 0x00000002]
  TransferFlags        = 00000002 (USBD_TRANSFER_DIRECTION_OUT, USBD_SHORT_TRANSFER_OK)
  TransferBufferLength = 00000012
  TransferBuffer       = 00000000
  TransferBufferMDL    = 85a4de68
    00000000: 54 fd 64 00 00 ff 64 01 40 24 0c 80 02 0a 19 2e
    00000010: 80 0c
  UrbLink              = 00000000
[108263 ms] UsbSnoop - MyInternalIOCTLCompletion(f76d8126) : fido=85e673d0, Irp=85e39cb0, Context=85b8ca40, IRQL=2
[108263 ms]  <<<  URB 126 coming back  <<< 
-- URB_FUNCTION_BULK_OR_INTERRUPT_TRANSFER:
  PipeHandle           = 866db8ec [endpoint 0x00000002]
  TransferFlags        = 00000002 (USBD_TRANSFER_DIRECTION_OUT, USBD_SHORT_TRANSFER_OK)
  TransferBufferLength = 00000012
  TransferBuffer       = 00000000
  TransferBufferMDL    = 85a4de68
  UrbLink              = 00000000
[108264 ms] UsbSnoop - FilterDispatchAny(f76d7fd2) : IRP_MJ_INTERNAL_DEVICE_CONTROL
[108264 ms] UsbSnoop - FdoHookDispatchInternalIoctl(f76d81ea) : fdo=861c0730, Irp=869c7cb0, IRQL=0
[108264 ms]  >>>  URB 127 going down  >>> 
-- URB_FUNCTION_BULK_OR_INTERRUPT_TRANSFER:
  PipeHandle           = 866db8cc [endpoint 0x00000081]
  TransferFlags        = 00000003 (USBD_TRANSFER_DIRECTION_IN, USBD_SHORT_TRANSFER_OK)
  TransferBufferLength = 00000200
  TransferBuffer       = 00000000
  TransferBufferMDL    = 85ae5cb0
  UrbLink              = 00000000
[108267 ms] UsbSnoop - MyInternalIOCTLCompletion(f76d8126) : fido=85e673d0, Irp=869c7cb0, Context=85b8ca40, IRQL=2
[108267 ms]  <<<  URB 127 coming back  <<< 
-- URB_FUNCTION_BULK_OR_INTERRUPT_TRANSFER:
  PipeHandle           = 866db8cc [endpoint 0x00000081]
  TransferFlags        = 00000003 (USBD_TRANSFER_DIRECTION_IN, USBD_SHORT_TRANSFER_OK)
  TransferBufferLength = 0000010e
  TransferBuffer       = 00000000
  TransferBufferMDL    = 85ae5cb0
    00000000: 54 fd 64 01 40 24 64 00 80 0c 47 58 fe 00 1a c1
    00000010: 02 ee 0e ee e0 ee 0e ee ee 0e ee ee 0e e0 ee ee
    00000020: 0e e0 ee 0e ee 0e ee 0e ee ee 0e e0 ee ee 0e 03
    00000030: ee 00 0e 70 ee 00 06 03 66 00 0e 06 ee e4 0e ee
    00000040: e0 ee 0e ee ee 0e ee ee 0e e0 ee ee 0e e0 ee 0e
    00000050: ee 0e ee 0e ee ee 0e e0 ee ee 0e 03 ee 00 0e 70
    00000060: ee 00 06 03 66 00 0e 06 ee e4 0e ee e0 ee 0e ee
    00000070: ee 0e ee ee 0e e0 ee ee 0e e0 ee 0e ee 0e ee 0e
    00000080: ee ee 0e e0 ee ee 0e 03 ee 00 0e 70 ee 00 06 03
    00000090: 66 00 0e 06 ee e4 00 ee 0e ee 0e ee ee e0 ee e0
    000000a0: ee e0 ee e0 0e e0 ee 0e ee 0e ee e0 ee e0 ee e0
    000000b0: ee ee 0e 03 ee 00 0e 70 ee 00 06 03 66 00 0e 06
    000000c0: ee fc 0e 00 ee ee 0e e9 ee ee ee 00 0e ee ee 00
    000000d0: 0e 0e e0 ee e0 ee e0 ee ee 00 0e ee e0 ee ee 0e
    000000e0: 03 ee 00 0e 70 ee 00 06 03 66 00 0e 7f ee 19 ee
    000000f0: 00 06 03 66 00 0e 7f ee 19 ee 04 00 00 0e 7f ee
    00000100: 7f ee 7f ee 7f ee 7f ee 00 ee 7b ff 00 4f
  UrbLink              = 00000000
[108268 ms] UsbSnoop - FilterDispatchAny(f76d7fd2) : IRP_MJ_INTERNAL_DEVICE_CONTROL
[108268 ms] UsbSnoop - FdoHookDispatchInternalIoctl(f76d81ea) : fdo=861c0730, Irp=869c7cb0, IRQL=0
[108268 ms]  >>>  URB 128 going down  >>> 
-- URB_FUNCTION_BULK_OR_INTERRUPT_TRANSFER:
  PipeHandle           = 866db8ec [endpoint 0x00000002]
  TransferFlags        = 00000002 (USBD_TRANSFER_DIRECTION_OUT, USBD_SHORT_TRANSFER_OK)
  TransferBufferLength = 00000012
  TransferBuffer       = 00000000
  TransferBufferMDL    = 85b0ba48
    00000000: 54 fd 64 00 00 ff 64 01 40 24 0c 80 02 0a 1a 2f
    00000010: 80 0c
  UrbLink              = 00000000
[108268 ms] UsbSnoop - MyInternalIOCTLCompletion(f76d8126) : fido=85e673d0, Irp=869c7cb0, Context=85b8ca40, IRQL=2
[108268 ms]  <<<  URB 128 coming back  <<< 
-- URB_FUNCTION_BULK_OR_INTERRUPT_TRANSFER:
  PipeHandle           = 866db8ec [endpoint 0x00000002]
  TransferFlags        = 00000002 (USBD_TRANSFER_DIRECTION_OUT, USBD_SHORT_TRANSFER_OK)
  TransferBufferLength = 00000012
  TransferBuffer       = 00000000
  TransferBufferMDL    = 85b0ba48
  UrbLink              = 00000000
[108269 ms] UsbSnoop - FilterDispatchAny(f76d7fd2) : IRP_MJ_INTERNAL_DEVICE_CONTROL
[108269 ms] UsbSnoop - FdoHookDispatchInternalIoctl(f76d81ea) : fdo=861c0730, Irp=85a6dcd8, IRQL=0
[108269 ms]  >>>  URB 129 going down  >>> 
-- URB_FUNCTION_BULK_OR_INTERRUPT_TRANSFER:
  PipeHandle           = 866db8cc [endpoint 0x00000081]
  TransferFlags        = 00000003 (USBD_TRANSFER_DIRECTION_IN, USBD_SHORT_TRANSFER_OK)
  TransferBufferLength = 00000200
  TransferBuffer       = 00000000
  TransferBufferMDL    = 85ae5cb0
  UrbLink              = 00000000
[108272 ms] UsbSnoop - MyInternalIOCTLCompletion(f76d8126) : fido=85e673d0, Irp=85a6dcd8, Context=85b8ca40, IRQL=2
[108272 ms]  <<<  URB 129 coming back  <<< 
-- URB_FUNCTION_BULK_OR_INTERRUPT_TRANSFER:
  PipeHandle           = 866db8cc [endpoint 0x00000081]
  TransferFlags        = 00000003 (USBD_TRANSFER_DIRECTION_IN, USBD_SHORT_TRANSFER_OK)
  TransferBufferLength = 0000010e
  TransferBuffer       = 00000000
  TransferBufferMDL    = 85ae5cb0
    00000000: 54 fd 64 01 40 24 64 00 80 0c ec ac fe 00 1b bb
    00000010: 02 1b ff 00 4f 37 ff 00 f0 fd ff ff ff f0 44 ff
    00000020: 00 4f 04 ff fd 00 00 00 0f 03 ff fd 0f f0 ff f0
    00000030: 0a ff 00 4f 37 ff fc f0 0f ff ff f0 44 ff 00 4f
    00000040: 05 ff 00 f0 05 ff fd 0f f0 ff f0 0a ff 00 4f 37
    00000050: ff f1 f0 f0 ff ff f0 ff ff 00 0f ff f0 f0 00 ff
    00000060: 00 0f 39 ff 00 4f 05 ff 00 f0 f3 ff ff ff 00 0f
    00000070: ff ff f0 ff f0 ff ff f0 0f 06 ff 00 4f 37 ff f1
    00000080: f0 ff 0f ff f0 ff f0 ff f0 ff f0 0f ff 00 ff f0
    00000090: 34 ff 00 0f 03 ff 00 4f 05 ff f2 f0 ff ff f0 ff
    000000a0: f0 ff 0f f0 ff f0 ff ff 0f f0 06 ff 00 4f 37 ff
    000000b0: f1 f0 ff f0 ff f0 ff 0f ff ff 0f f0 ff ff 0f ff
    000000c0: f0 33 ff ff f0 f0 03 ff 00 4f 05 ff 00 f0 03 ff
    000000d0: f6 f0 ff 0f f0 ff f0 ff f0 ff ff 0f 05 ff 00 4f
    000000e0: 37 ff f1 f0 ff f0 ff f0 ff 0f ff ff 0f f0 ff ff
    000000f0: 0f ff f0 33 ff fe 0f ff 0f fd ff ff ff 4f 05 ff
    00000100: 00 f0 f2 ff ff ff 00 00 ff 0f f0 ff f0 ff
  UrbLink              = 00000000
[108273 ms] UsbSnoop - FilterDispatchAny(f76d7fd2) : IRP_MJ_INTERNAL_DEVICE_CONTROL
[108273 ms] UsbSnoop - FdoHookDispatchInternalIoctl(f76d81ea) : fdo=861c0730, Irp=85a6dcd8, IRQL=0
[108273 ms]  >>>  URB 130 going down  >>> 
-- URB_FUNCTION_BULK_OR_INTERRUPT_TRANSFER:
  PipeHandle           = 866db8ec [endpoint 0x00000002]
  TransferFlags        = 00000002 (USBD_TRANSFER_DIRECTION_OUT, USBD_SHORT_TRANSFER_OK)
  TransferBufferLength = 00000012
  TransferBuffer       = 00000000
  TransferBufferMDL    = 86abce70
    00000000: 54 fd 64 00 00 ff 64 01 40 24 0c 80 02 0a 1b 30
    00000010: 80 0c
  UrbLink              = 00000000
[108273 ms] UsbSnoop - MyInternalIOCTLCompletion(f76d8126) : fido=85e673d0, Irp=85a6dcd8, Context=85b8ca40, IRQL=2
[108273 ms]  <<<  URB 130 coming back  <<< 
-- URB_FUNCTION_BULK_OR_INTERRUPT_TRANSFER:
  PipeHandle           = 866db8ec [endpoint 0x00000002]
  TransferFlags        = 00000002 (USBD_TRANSFER_DIRECTION_OUT, USBD_SHORT_TRANSFER_OK)
  TransferBufferLength = 00000012
  TransferBuffer       = 00000000
  TransferBufferMDL    = 86abce70
  UrbLink              = 00000000
[108274 ms] UsbSnoop - FilterDispatchAny(f76d7fd2) : IRP_MJ_INTERNAL_DEVICE_CONTROL
[108274 ms] UsbSnoop - FdoHookDispatchInternalIoctl(f76d81ea) : fdo=861c0730, Irp=86586858, IRQL=0
[108274 ms]  >>>  URB 131 going down  >>> 
-- URB_FUNCTION_BULK_OR_INTERRUPT_TRANSFER:
  PipeHandle           = 866db8cc [endpoint 0x00000081]
  TransferFlags        = 00000003 (USBD_TRANSFER_DIRECTION_IN, USBD_SHORT_TRANSFER_OK)
  TransferBufferLength = 00000200
  TransferBuffer       = 00000000
  TransferBufferMDL    = 85ae5cb0
  UrbLink              = 00000000
[108277 ms] UsbSnoop - MyInternalIOCTLCompletion(f76d8126) : fido=85e673d0, Irp=86586858, Context=85b8ca40, IRQL=2
[108277 ms]  <<<  URB 131 coming back  <<< 
-- URB_FUNCTION_BULK_OR_INTERRUPT_TRANSFER:
  PipeHandle           = 866db8cc [endpoint 0x00000081]
  TransferFlags        = 00000003 (USBD_TRANSFER_DIRECTION_IN, USBD_SHORT_TRANSFER_OK)
  TransferBufferLength = 0000010e
  TransferBuffer       = 00000000
  TransferBufferMDL    = 85ae5cb0
    00000000: 54 fd 64 01 40 24 64 00 80 0c b7 4c fe 00 1c 27
    00000010: 02 f0 00 00 0f 05 ff 00 4f 37 ff f1 f0 ff ff 0f
    00000020: f0 ff 0f ff ff 0f f0 ff ff 0f ff f0 32 ff fd f0
    00000030: ff ff f0 fd ff ff ff 4f 05 ff f4 f0 ff ff f0 ff
    00000040: f0 ff 0f f0 ff f0 ff f0 08 ff 00 4f 37 ff f1 f0
    00000050: ff ff f0 f0 ff 0f ff ff 0f f0 ff ff 0f ff f0 32
    00000060: ff 00 0f fa ff ff ff 0f ff ff 4f 05 ff f4 f0 ff
    00000070: ff f0 ff f0 ff 0f f0 ff f0 ff f0 08 ff 00 4f 37
    00000080: ff 00 f0 f2 ff ff ff 00 ff f0 ff f0 ff f0 ff ff
    00000090: 0f ff f0 31 ff 00 f0 04 00 fe ff ff 4f 05 ff f1
    000000a0: f0 ff ff f0 ff 00 ff 0f f0 ff f0 ff ff 0f ff 0f
    000000b0: 05 ff 00 4f 37 ff 00 f0 f2 ff ff ff f0 ff ff 00
    000000c0: 0f ff f0 ff ff 0f ff f0 39 ff 00 4f 05 ff 00 f0
    000000d0: f3 ff ff ff 00 f0 ff 0f ff 0f ff 0f ff f0 00 06
    000000e0: ff 00 4f 7f ff fe ff ff 4f 1b ff 00 4f 7f ff fe
    000000f0: ff ff 4f 1b ff 00 4f 05 ff 7f 44 1f 44 7b ff 00
    00000100: 4f 1b ff 00 4f 7f ff fe ff ff 4f 1b ff 00
  UrbLink              = 00000000
[108278 ms] UsbSnoop - FilterDispatchAny(f76d7fd2) : IRP_MJ_INTERNAL_DEVICE_CONTROL
[108278 ms] UsbSnoop - FdoHookDispatchInternalIoctl(f76d81ea) : fdo=861c0730, Irp=86586858, IRQL=0
[108278 ms]  >>>  URB 132 going down  >>> 
-- URB_FUNCTION_BULK_OR_INTERRUPT_TRANSFER:
  PipeHandle           = 866db8ec [endpoint 0x00000002]
  TransferFlags        = 00000002 (USBD_TRANSFER_DIRECTION_OUT, USBD_SHORT_TRANSFER_OK)
  TransferBufferLength = 00000012
  TransferBuffer       = 00000000
  TransferBufferMDL    = 85e5c788
    00000000: 54 fd 64 00 00 ff 64 01 40 24 0c 80 02 0a 1c 31
    00000010: 80 0c
  UrbLink              = 00000000
[108278 ms] UsbSnoop - MyInternalIOCTLCompletion(f76d8126) : fido=85e673d0, Irp=86586858, Context=85b8ca40, IRQL=2
[108278 ms]  <<<  URB 132 coming back  <<< 
-- URB_FUNCTION_BULK_OR_INTERRUPT_TRANSFER:
  PipeHandle           = 866db8ec [endpoint 0x00000002]
  TransferFlags        = 00000002 (USBD_TRANSFER_DIRECTION_OUT, USBD_SHORT_TRANSFER_OK)
  TransferBufferLength = 00000012
  TransferBuffer       = 00000000
  TransferBufferMDL    = 85e5c788
  UrbLink              = 00000000
[108279 ms] UsbSnoop - FilterDispatchAny(f76d7fd2) : IRP_MJ_INTERNAL_DEVICE_CONTROL
[108279 ms] UsbSnoop - FdoHookDispatchInternalIoctl(f76d81ea) : fdo=861c0730, Irp=86586858, IRQL=0
[108279 ms]  >>>  URB 133 going down  >>> 
-- URB_FUNCTION_BULK_OR_INTERRUPT_TRANSFER:
  PipeHandle           = 866db8cc [endpoint 0x00000081]
  TransferFlags        = 00000003 (USBD_TRANSFER_DIRECTION_IN, USBD_SHORT_TRANSFER_OK)
  TransferBufferLength = 00000200
  TransferBuffer       = 00000000
  TransferBufferMDL    = 85ae5cb0
  UrbLink              = 00000000
[108282 ms] UsbSnoop - MyInternalIOCTLCompletion(f76d8126) : fido=85e673d0, Irp=86586858, Context=85b8ca40, IRQL=2
[108282 ms]  <<<  URB 133 coming back  <<< 
-- URB_FUNCTION_BULK_OR_INTERRUPT_TRANSFER:
  PipeHandle           = 866db8cc [endpoint 0x00000081]
  TransferFlags        = 00000003 (USBD_TRANSFER_DIRECTION_IN, USBD_SHORT_TRANSFER_OK)
  TransferBufferLength = 0000010e
  TransferBuffer       = 00000000
  TransferBufferMDL    = 85ae5cb0
    00000000: 54 fd 64 01 40 24 64 00 80 0c fe 6d fe 00 1d 90
    00000010: 02 4f 7f ff fe ff ff 4f 1b ff 00 4f 07 ff 00 fe
    00000020: 06 ee 00 ef 70 ff 00 4f 1b ff 00 4f 08 ff fe f0
    00000030: 00 00 75 ff 00 4f 1b ff 00 4f 08 ff fd 0d dd dd
    00000040: 0f 74 ff 00 4f 1b ff 00 4f 07 ff 00 f0 f5 dd dd
    00000050: dd d0 00 00 0f ff ff 00 00 0f 11 ff 00 0f 59 ff
    00000060: 00 4f 0e ff f9 00 00 00 ff 0f ff ff 0f 04 ff 00
    00000070: 4f 07 ff 00 f0 05 dd fd d0 ff ff 0f 13 ff 00 0f
    00000080: 59 ff 00 4f 0e ff 00 0f fb ff ff ff 0f ff f0 05
    00000090: ff 00 4f 07 ff fd f0 dd dd d0 03 00 e2 ff ff 0f
    000000a0: ff ff f0 ff f0 ff f0 00 ff f0 f0 00 ff 00 0f ff
    000000b0: 0f 00 ff ff 0f ff ff 00 ff ff f0 0f 52 ff 00 4f
    000000c0: 0e ff 00 0f f4 ff ff ff 0f ff 0f ff ff f0 00 ff
    000000d0: ff 4f 07 ff fd f0 00 00 0d fa dd dd dd d0 ff ff
    000000e0: 0f e5 ff ff ff 0f 0f ff 0f ff 0f f0 0f ff 00 ff
    000000f0: f0 ff 00 ff 0f ff 0f ff f0 ff 0f ff 0f f0 52 ff
    00000100: 00 4f 0e ff 00 0f fc ff ff ff 0f f0 f9 ff
  UrbLink              = 00000000
[108283 ms] UsbSnoop - FilterDispatchAny(f76d7fd2) : IRP_MJ_INTERNAL_DEVICE_CONTROL
[108283 ms] UsbSnoop - FdoHookDispatchInternalIoctl(f76d81ea) : fdo=861c0730, Irp=86586858, IRQL=0
[108283 ms]  >>>  URB 134 going down  >>> 
-- URB_FUNCTION_BULK_OR_INTERRUPT_TRANSFER:
  PipeHandle           = 866db8ec [endpoint 0x00000002]
  TransferFlags        = 00000002 (USBD_TRANSFER_DIRECTION_OUT, USBD_SHORT_TRANSFER_OK)
  TransferBufferLength = 00000012
  TransferBuffer       = 00000000
  TransferBufferMDL    = 85b0ba48
    00000000: 54 fd 64 00 00 ff 64 01 40 24 0c 80 02 0a 1d 32
    00000010: 80 0c
  UrbLink              = 00000000
[108283 ms] UsbSnoop - MyInternalIOCTLCompletion(f76d8126) : fido=85e673d0, Irp=86586858, Context=85b8ca40, IRQL=2
[108283 ms]  <<<  URB 134 coming back  <<< 
-- URB_FUNCTION_BULK_OR_INTERRUPT_TRANSFER:
  PipeHandle           = 866db8ec [endpoint 0x00000002]
  TransferFlags        = 00000002 (USBD_TRANSFER_DIRECTION_OUT, USBD_SHORT_TRANSFER_OK)
  TransferBufferLength = 00000012
  TransferBuffer       = 00000000
  TransferBufferMDL    = 85b0ba48
  UrbLink              = 00000000
[108284 ms] UsbSnoop - FilterDispatchAny(f76d7fd2) : IRP_MJ_INTERNAL_DEVICE_CONTROL
[108284 ms] UsbSnoop - FdoHookDispatchInternalIoctl(f76d81ea) : fdo=861c0730, Irp=85a69b18, IRQL=0
[108284 ms]  >>>  URB 135 going down  >>> 
-- URB_FUNCTION_BULK_OR_INTERRUPT_TRANSFER:
  PipeHandle           = 866db8cc [endpoint 0x00000081]
  TransferFlags        = 00000003 (USBD_TRANSFER_DIRECTION_IN, USBD_SHORT_TRANSFER_OK)
  TransferBufferLength = 00000200
  TransferBuffer       = 00000000
  TransferBufferMDL    = 85ae5cb0
  UrbLink              = 00000000
[108287 ms] UsbSnoop - MyInternalIOCTLCompletion(f76d8126) : fido=85e673d0, Irp=85a69b18, Context=85b8ca40, IRQL=2
[108287 ms]  <<<  URB 135 coming back  <<< 
-- URB_FUNCTION_BULK_OR_INTERRUPT_TRANSFER:
  PipeHandle           = 866db8cc [endpoint 0x00000081]
  TransferFlags        = 00000003 (USBD_TRANSFER_DIRECTION_IN, USBD_SHORT_TRANSFER_OK)
  TransferBufferLength = 0000010e
  TransferBuffer       = 00000000
  TransferBufferMDL    = 85ae5cb0
    00000000: 54 fd 64 01 40 24 64 00 80 0c 23 61 fe 00 1e aa
    00000010: 02 ff ff 0f ff 0f ff 4f 07 ff 00 f0 05 dd f8 d0
    00000020: ff ff 00 00 0f ff 0f 0f eb ff ff ff 0f f0 ff ff
    00000030: 0f ff f0 ff 0f ff f0 ff 0f ff 0f ff f0 ff 0f 53
    00000040: ff 00 4f 0e ff f3 00 00 ff ff 0f 0f ff ff f0 ff
    00000050: ff f0 ff 4f 07 ff 00 f0 f7 dd dd dd 00 00 0d d0
    00000060: ff ff 0f eb ff ff ff f0 ff ff f0 00 0f f0 ff ff
    00000070: 0f ff f0 ff 0f ff f0 ff 0f ff fc 00 00 00 ff f0
    00000080: 53 ff 00 4f 10 ff f5 0f ff 00 f0 ff ff f0 ff ff
    00000090: f0 ff 4f 07 ff 00 f0 f7 dd dd dd d0 00 dd d0 ff
    000000a0: ff 0f ea ff ff ff f0 ff ff 0f ff 0f f0 ff ff 0f
    000000b0: ff f0 ff 0f ff f0 ff 0f ff 0f 03 ff 00 0f 52 ff
    000000c0: 00 4f 10 ff f5 f0 ff 0f ff 0f ff f0 ff ff f0 ff
    000000d0: 4f 07 ff 00 f0 03 dd fb 0d dd d0 ff ff 0f ea ff
    000000e0: ff ff 0f 0f ff 0f ff 0f f0 ff ff 0f ff f0 ff 0f
    000000f0: ff f0 ff 0f ff 0f 03 ff 00 f0 52 ff 00 4f 10 ff
    00000100: f5 f0 ff 0f ff f0 ff f0 ff ff f0 ff 4f 07
  UrbLink              = 00000000
[108288 ms] UsbSnoop - FilterDispatchAny(f76d7fd2) : IRP_MJ_INTERNAL_DEVICE_CONTROL
[108288 ms] UsbSnoop - FdoHookDispatchInternalIoctl(f76d81ea) : fdo=861c0730, Irp=85a69b18, IRQL=0
[108288 ms]  >>>  URB 136 going down  >>> 
-- URB_FUNCTION_BULK_OR_INTERRUPT_TRANSFER:
  PipeHandle           = 866db8ec [endpoint 0x00000002]
  TransferFlags        = 00000002 (USBD_TRANSFER_DIRECTION_OUT, USBD_SHORT_TRANSFER_OK)
  TransferBufferLength = 00000012
  TransferBuffer       = 00000000
  TransferBufferMDL    = 86abce70
    00000000: 54 fd 64 00 00 ff 64 01 40 24 0c 80 02 0a 1e 33
    00000010: 80 0c
  UrbLink              = 00000000
[108288 ms] UsbSnoop - MyInternalIOCTLCompletion(f76d8126) : fido=85e673d0, Irp=85a69b18, Context=85b8ca40, IRQL=2
[108288 ms]  <<<  URB 136 coming back  <<< 
-- URB_FUNCTION_BULK_OR_INTERRUPT_TRANSFER:
  PipeHandle           = 866db8ec [endpoint 0x00000002]
  TransferFlags        = 00000002 (USBD_TRANSFER_DIRECTION_OUT, USBD_SHORT_TRANSFER_OK)
  TransferBufferLength = 00000012
  TransferBuffer       = 00000000
  TransferBufferMDL    = 86abce70
  UrbLink              = 00000000
[108289 ms] UsbSnoop - FilterDispatchAny(f76d7fd2) : IRP_MJ_INTERNAL_DEVICE_CONTROL
[108289 ms] UsbSnoop - FdoHookDispatchInternalIoctl(f76d81ea) : fdo=861c0730, Irp=85a32a50, IRQL=0
[108289 ms]  >>>  URB 137 going down  >>> 
-- URB_FUNCTION_BULK_OR_INTERRUPT_TRANSFER:
  PipeHandle           = 866db8cc [endpoint 0x00000081]
  TransferFlags        = 00000003 (USBD_TRANSFER_DIRECTION_IN, USBD_SHORT_TRANSFER_OK)
  TransferBufferLength = 00000200
  TransferBuffer       = 00000000
  TransferBufferMDL    = 85ae5cb0
  UrbLink              = 00000000
[108292 ms] UsbSnoop - MyInternalIOCTLCompletion(f76d8126) : fido=85e673d0, Irp=85a32a50, Context=85b8ca40, IRQL=2
[108292 ms]  <<<  URB 137 coming back  <<< 
-- URB_FUNCTION_BULK_OR_INTERRUPT_TRANSFER:
  PipeHandle           = 866db8cc [endpoint 0x00000081]
  TransferFlags        = 00000003 (USBD_TRANSFER_DIRECTION_IN, USBD_SHORT_TRANSFER_OK)
  TransferBufferLength = 0000010e
  TransferBuffer       = 00000000
  TransferBufferMDL    = 85ae5cb0
    00000000: 54 fd 64 01 40 24 64 00 80 0c 1c eb fe 00 1f 2e
    00000010: 02 ff 00 f0 05 dd fd d0 ff ff 0f e5 ff ff ff 0f
    00000020: 0f ff 0f f0 0f f0 ff ff 0f ff f0 ff 00 ff 0f ff
    00000030: 0f ff f0 ff f0 ff 0f f0 52 ff 00 4f 0e ff f3 0f
    00000040: ff 0f ff 0f ff ff 0f ff 0f ff 0f ff 4f 07 ff 00
    00000050: f0 05 dd e1 d0 ff ff 00 00 0f f0 ff f0 ff f0 0f
    00000060: 0f f0 ff ff 0f ff f0 ff 0f 00 ff ff f0 ff ff 00
    00000070: 0f ff f0 0f 52 ff 00 4f 0e ff f3 f0 00 ff ff 0f
    00000080: ff ff f0 ff f0 00 ff ff 4f 07 ff 00 f0 06 00 12
    00000090: ff 00 0f 5d ff 00 4f 1b ff 00 4f 07 ff 00 fe 06
    000000a0: ee 00 ef 11 ff 00 0f 5d ff 00 4f 1b ff 00 4f 07
    000000b0: ff 00 fe 06 ee 00 ef 11 ff 00 0f 5d ff 00 4f 1b
    000000c0: ff 00 4f 7f ff fe ff ff 4f 1b ff 00 4f 7f ff fe
    000000d0: ff ff 4f 1b ff 00 4f 0f ff 00 fe 06 ee 00 ef 68
    000000e0: ff 00 4f 1b ff 00 4f 10 ff 00 f0 03 00 00 0f 6a
    000000f0: ff 00 4f 1b ff 00 4f 10 ff 00 f0 fc ee ee ee e0
    00000100: e0 6a ff 00 4f 1b ff 00 4f 10 ff 00 f0 fb
  UrbLink              = 00000000
[108293 ms] UsbSnoop - FilterDispatchAny(f76d7fd2) : IRP_MJ_INTERNAL_DEVICE_CONTROL
[108293 ms] UsbSnoop - FdoHookDispatchInternalIoctl(f76d81ea) : fdo=861c0730, Irp=85a32a50, IRQL=0
[108293 ms]  >>>  URB 138 going down  >>> 
-- URB_FUNCTION_BULK_OR_INTERRUPT_TRANSFER:
  PipeHandle           = 866db8ec [endpoint 0x00000002]
  TransferFlags        = 00000002 (USBD_TRANSFER_DIRECTION_OUT, USBD_SHORT_TRANSFER_OK)
  TransferBufferLength = 00000012
  TransferBuffer       = 00000000
  TransferBufferMDL    = 85b0ba48
    00000000: 54 fd 64 00 00 ff 64 01 40 24 0c 80 02 0a 1f 34
    00000010: 80 0c
  UrbLink              = 00000000
[108293 ms] UsbSnoop - MyInternalIOCTLCompletion(f76d8126) : fido=85e673d0, Irp=85a32a50, Context=85b8ca40, IRQL=2
[108293 ms]  <<<  URB 138 coming back  <<< 
-- URB_FUNCTION_BULK_OR_INTERRUPT_TRANSFER:
  PipeHandle           = 866db8ec [endpoint 0x00000002]
  TransferFlags        = 00000002 (USBD_TRANSFER_DIRECTION_OUT, USBD_SHORT_TRANSFER_OK)
  TransferBufferLength = 00000012
  TransferBuffer       = 00000000
  TransferBufferMDL    = 85b0ba48
  UrbLink              = 00000000
[108294 ms] UsbSnoop - FilterDispatchAny(f76d7fd2) : IRP_MJ_INTERNAL_DEVICE_CONTROL
[108294 ms] UsbSnoop - FdoHookDispatchInternalIoctl(f76d81ea) : fdo=861c0730, Irp=85c62668, IRQL=0
[108294 ms]  >>>  URB 139 going down  >>> 
-- URB_FUNCTION_BULK_OR_INTERRUPT_TRANSFER:
  PipeHandle           = 866db8cc [endpoint 0x00000081]
  TransferFlags        = 00000003 (USBD_TRANSFER_DIRECTION_IN, USBD_SHORT_TRANSFER_OK)
  TransferBufferLength = 00000200
  TransferBuffer       = 00000000
  TransferBufferMDL    = 85ae5cb0
  UrbLink              = 00000000
[108297 ms] UsbSnoop - MyInternalIOCTLCompletion(f76d8126) : fido=85e673d0, Irp=85c62668, Context=85b8ca40, IRQL=2
[108297 ms]  <<<  URB 139 coming back  <<< 
-- URB_FUNCTION_BULK_OR_INTERRUPT_TRANSFER:
  PipeHandle           = 866db8cc [endpoint 0x00000081]
  TransferFlags        = 00000003 (USBD_TRANSFER_DIRECTION_IN, USBD_SHORT_TRANSFER_OK)
  TransferBufferLength = 0000010e
  TransferBuffer       = 00000000
  TransferBufferMDL    = 85ae5cb0
    00000000: 54 fd 64 01 40 24 64 00 80 0c 16 8a fe 00 20 c8
    00000010: 02 ee ee ee e0 ee 0f fc ff ff ff 00 00 05 ff fc
    00000020: 0f ff f0 ff f0 0a ff fc f0 00 ff ff 0f 07 ff 00
    00000030: 0f 06 ff 00 f0 38 ff 00 4f 0e ff f9 00 00 00 ff
    00000040: 0f ff ff 0f 04 ff 00 4f 10 ff 00 f0 f5 ee ee ee
    00000050: e0 00 0f ff ff 00 ff ff 0f 04 ff fc 0f ff f0 ff
    00000060: f0 0a ff fc 0f ff 0f ff 0f 07 ff 00 0f 06 ff 00
    00000070: f0 38 ff 00 4f 0e ff 00 0f fb ff ff ff 0f ff f0
    00000080: 05 ff 00 4f 10 ff 00 f0 03 ee fc ed 0f ff ff 0f
    00000090: 03 ff dc f0 0f ff f0 00 0f 00 00 ff ff 0f 00 0f
    000000a0: ff f0 00 00 0f ff ff 0f ff ff f0 00 0f f0 00 ff
    000000b0: f0 f0 0f f0 00 0f ff 00 fc ff ff ff 00 f0 38 ff
    000000c0: 00 4f 0e ff 00 0f f4 ff ff ff 0f ff 0f ff ff f0
    000000d0: 00 ff ff 4f 10 ff 00 f0 03 ee fd dc 0f ff f0 04
    000000e0: ff f0 0f f0 ff ff 0f ff f0 ff f0 ff 00 ff f0 ff
    000000f0: 0f ff f0 fd ff ff ff 0f ec ff ff ff 0f ff 0f ff
    00000100: 0f f0 0f ff ff 0f ff f0 ff 0f ff f0 ff 00
  UrbLink              = 00000000
[108298 ms] UsbSnoop - FilterDispatchAny(f76d7fd2) : IRP_MJ_INTERNAL_DEVICE_CONTROL
[108298 ms] UsbSnoop - FdoHookDispatchInternalIoctl(f76d81ea) : fdo=861c0730, Irp=85a32a50, IRQL=0
[108298 ms]  >>>  URB 140 going down  >>> 
-- URB_FUNCTION_BULK_OR_INTERRUPT_TRANSFER:
  PipeHandle           = 866db8ec [endpoint 0x00000002]
  TransferFlags        = 00000002 (USBD_TRANSFER_DIRECTION_OUT, USBD_SHORT_TRANSFER_OK)
  TransferBufferLength = 00000012
  TransferBuffer       = 00000000
  TransferBufferMDL    = 86abce70
    00000000: 54 fd 64 00 00 ff 64 01 40 24 0c 80 02 0a 20 35
    00000010: 80 0c
  UrbLink              = 00000000
[108298 ms] UsbSnoop - MyInternalIOCTLCompletion(f76d8126) : fido=85e673d0, Irp=85a32a50, Context=85b8ca40, IRQL=2
[108298 ms]  <<<  URB 140 coming back  <<< 
-- URB_FUNCTION_BULK_OR_INTERRUPT_TRANSFER:
  PipeHandle           = 866db8ec [endpoint 0x00000002]
  TransferFlags        = 00000002 (USBD_TRANSFER_DIRECTION_OUT, USBD_SHORT_TRANSFER_OK)
  TransferBufferLength = 00000012
  TransferBuffer       = 00000000
  TransferBufferMDL    = 86abce70
  UrbLink              = 00000000
[108299 ms] UsbSnoop - FilterDispatchAny(f76d7fd2) : IRP_MJ_INTERNAL_DEVICE_CONTROL
[108299 ms] UsbSnoop - FdoHookDispatchInternalIoctl(f76d81ea) : fdo=861c0730, Irp=85a71af0, IRQL=0
[108299 ms]  >>>  URB 141 going down  >>> 
-- URB_FUNCTION_BULK_OR_INTERRUPT_TRANSFER:
  PipeHandle           = 866db8cc [endpoint 0x00000081]
  TransferFlags        = 00000003 (USBD_TRANSFER_DIRECTION_IN, USBD_SHORT_TRANSFER_OK)
  TransferBufferLength = 00000200
  TransferBuffer       = 00000000
  TransferBufferMDL    = 85ae5cb0
  UrbLink              = 00000000
[108302 ms] UsbSnoop - MyInternalIOCTLCompletion(f76d8126) : fido=85e673d0, Irp=85a71af0, Context=85b8ca40, IRQL=2
[108302 ms]  <<<  URB 141 coming back  <<< 
-- URB_FUNCTION_BULK_OR_INTERRUPT_TRANSFER:
  PipeHandle           = 866db8cc [endpoint 0x00000081]
  TransferFlags        = 00000003 (USBD_TRANSFER_DIRECTION_IN, USBD_SHORT_TRANSFER_OK)
  TransferBufferLength = 0000010e
  TransferBuffer       = 00000000
  TransferBufferMDL    = 85ae5cb0
    00000000: 54 fd 64 01 40 24 64 00 80 0c 7c 2a fe 00 21 cf
    00000010: 02 38 ff 00 4f 0e ff 00 0f fc ff ff ff 0f f0 f9
    00000020: ff ff ff 0f ff 0f ff 4f 10 ff 00 f0 f9 ee ee ee
    00000030: ed cc 0f ff f0 03 ff ef f0 ff ff 0f ff 0f ff f0
    00000040: ff f0 ff 0f ff f0 ff 0f ff f0 f9 ff ff ff f0 0f
    00000050: ff ff 0f fc ff ff ff 0f f0 f5 ff ff ff 0f ff 0f
    00000060: ff f0 ff 0f ff f0 38 ff 00 4f 0e ff f3 00 00 ff
    00000070: ff 0f 0f ff ff f0 ff ff f0 ff 4f 10 ff 00 f0 e3
    00000080: ee ee ee dc cc 0f ff f0 ff ff 00 0f f0 00 00 0f
    00000090: ff 0f ff f0 ff f0 ff 0f ff f0 ff 0f ff f0 03 ff
    000000a0: f8 f0 ff ff 0f ff f0 00 0f f0 fc ff ff ff 0f ff
    000000b0: fa 00 00 00 ff 0f ff f0 38 ff 00 4f 10 ff f5 0f
    000000c0: ff 00 f0 ff ff f0 ff ff f0 ff 4f 10 ff f8 f0 ee
    000000d0: ee ed cc cc 0f ff f0 fc ff ff ff 0f f0 03 ff f4
    000000e0: 0f ff f0 ff f0 ff 0f ff f0 ff f0 00 0f 04 ff f9
    000000f0: 0f ff 0f ff 0f ff 0f f0 fb ff ff ff 0f ff 0f fb
    00000100: ff ff ff 0f ff f0 38 ff 00 4f 10 ff f5 f0
  UrbLink              = 00000000
[108303 ms] UsbSnoop - FilterDispatchAny(f76d7fd2) : IRP_MJ_INTERNAL_DEVICE_CONTROL
[108303 ms] UsbSnoop - FdoHookDispatchInternalIoctl(f76d81ea) : fdo=861c0730, Irp=85a32a50, IRQL=0
[108303 ms]  >>>  URB 142 going down  >>> 
-- URB_FUNCTION_BULK_OR_INTERRUPT_TRANSFER:
  PipeHandle           = 866db8ec [endpoint 0x00000002]
  TransferFlags        = 00000002 (USBD_TRANSFER_DIRECTION_OUT, USBD_SHORT_TRANSFER_OK)
  TransferBufferLength = 00000012
  TransferBuffer       = 00000000
  TransferBufferMDL    = 85b0ba48
    00000000: 54 fd 64 00 00 ff 64 01 40 24 0c 80 02 0a 21 36
    00000010: 80 0c
  UrbLink              = 00000000
[108303 ms] UsbSnoop - MyInternalIOCTLCompletion(f76d8126) : fido=85e673d0, Irp=85a32a50, Context=85b8ca40, IRQL=2
[108303 ms]  <<<  URB 142 coming back  <<< 
-- URB_FUNCTION_BULK_OR_INTERRUPT_TRANSFER:
  PipeHandle           = 866db8ec [endpoint 0x00000002]
  TransferFlags        = 00000002 (USBD_TRANSFER_DIRECTION_OUT, USBD_SHORT_TRANSFER_OK)
  TransferBufferLength = 00000012
  TransferBuffer       = 00000000
  TransferBufferMDL    = 85b0ba48
  UrbLink              = 00000000
[108304 ms] UsbSnoop - FilterDispatchAny(f76d7fd2) : IRP_MJ_INTERNAL_DEVICE_CONTROL
[108304 ms] UsbSnoop - FdoHookDispatchInternalIoctl(f76d81ea) : fdo=861c0730, Irp=85a2daf0, IRQL=0
[108304 ms]  >>>  URB 143 going down  >>> 
-- URB_FUNCTION_BULK_OR_INTERRUPT_TRANSFER:
  PipeHandle           = 866db8cc [endpoint 0x00000081]
  TransferFlags        = 00000003 (USBD_TRANSFER_DIRECTION_IN, USBD_SHORT_TRANSFER_OK)
  TransferBufferLength = 00000200
  TransferBuffer       = 00000000
  TransferBufferMDL    = 85ae5cb0
  UrbLink              = 00000000
[108307 ms] UsbSnoop - MyInternalIOCTLCompletion(f76d8126) : fido=85e673d0, Irp=85a2daf0, Context=85b8ca40, IRQL=2
[108307 ms]  <<<  URB 143 coming back  <<< 
-- URB_FUNCTION_BULK_OR_INTERRUPT_TRANSFER:
  PipeHandle           = 866db8cc [endpoint 0x00000081]
  TransferFlags        = 00000003 (USBD_TRANSFER_DIRECTION_IN, USBD_SHORT_TRANSFER_OK)
  TransferBufferLength = 0000010e
  TransferBuffer       = 00000000
  TransferBufferMDL    = 85ae5cb0
    00000000: 54 fd 64 01 40 24 64 00 80 0c 68 4b fe 00 22 dd
    00000010: 02 ff 0f ff 0f ff f0 ff ff f0 ff 4f 10 ff f3 f0
    00000020: ee ee dc cc cc 0f ff ff 0f ff ff 0f f0 03 ff f6
    00000030: 0f ff f0 ff f0 ff 0f ff f0 ff 0f 06 ff f9 0f ff
    00000040: 0f ff 0f ff 0f f0 fb ff ff ff 0f ff 0f fb ff ff
    00000050: ff 0f ff f0 38 ff 00 4f 10 ff f5 f0 ff 0f ff f0
    00000060: ff f0 ff ff f0 ff 4f 10 ff fe f0 ee ed e8 cc cc
    00000070: cc 0f ff ff 00 ff ff 0f ff 0f ff 0f ff 0f ff f0
    00000080: ff f0 ff 0f ff f0 ff fe 00 00 00 f4 ff ff ff 0f
    00000090: ff 0f ff 0f ff 0f f0 0f f0 f5 ff ff ff 0f ff f0
    000000a0: ff f0 ff f0 ff 00 38 ff 00 4f 0e ff f3 0f ff 0f
    000000b0: ff 0f ff ff 0f ff 0f ff 0f ff 4f 10 ff fe f0 ee
    000000c0: dc fd cc cc cc 0f dc ff ff ff 00 00 ff ff f0 00
    000000d0: ff ff f0 0f ff 00 f0 ff 0f ff f0 ff f0 ff ff 0f
    000000e0: ff ff f0 00 ff ff f0 0f f0 0f 0f f0 f5 ff ff ff
    000000f0: f0 0f ff 00 0f ff ff 00 f0 38 ff 00 4f 0e ff f3
    00000100: f0 00 ff ff 0f ff ff f0 ff f0 00 ff ff 4f
  UrbLink              = 00000000
[108308 ms] UsbSnoop - FilterDispatchAny(f76d7fd2) : IRP_MJ_INTERNAL_DEVICE_CONTROL
[108308 ms] UsbSnoop - FdoHookDispatchInternalIoctl(f76d81ea) : fdo=861c0730, Irp=85a32a50, IRQL=0
[108308 ms]  >>>  URB 144 going down  >>> 
-- URB_FUNCTION_BULK_OR_INTERRUPT_TRANSFER:
  PipeHandle           = 866db8ec [endpoint 0x00000002]
  TransferFlags        = 00000002 (USBD_TRANSFER_DIRECTION_OUT, USBD_SHORT_TRANSFER_OK)
  TransferBufferLength = 00000012
  TransferBuffer       = 00000000
  TransferBufferMDL    = 86abce70
    00000000: 54 fd 64 00 00 ff 64 01 40 24 0c 80 02 0a 22 37
    00000010: 80 0c
  UrbLink              = 00000000
[108308 ms] UsbSnoop - MyInternalIOCTLCompletion(f76d8126) : fido=85e673d0, Irp=85a32a50, Context=85b8ca40, IRQL=2
[108308 ms]  <<<  URB 144 coming back  <<< 
-- URB_FUNCTION_BULK_OR_INTERRUPT_TRANSFER:
  PipeHandle           = 866db8ec [endpoint 0x00000002]
  TransferFlags        = 00000002 (USBD_TRANSFER_DIRECTION_OUT, USBD_SHORT_TRANSFER_OK)
  TransferBufferLength = 00000012
  TransferBuffer       = 00000000
  TransferBufferMDL    = 86abce70
  UrbLink              = 00000000
[108309 ms] UsbSnoop - FilterDispatchAny(f76d7fd2) : IRP_MJ_INTERNAL_DEVICE_CONTROL
[108309 ms] UsbSnoop - FdoHookDispatchInternalIoctl(f76d81ea) : fdo=861c0730, Irp=85a32a50, IRQL=0
[108309 ms]  >>>  URB 145 going down  >>> 
-- URB_FUNCTION_BULK_OR_INTERRUPT_TRANSFER:
  PipeHandle           = 866db8cc [endpoint 0x00000081]
  TransferFlags        = 00000003 (USBD_TRANSFER_DIRECTION_IN, USBD_SHORT_TRANSFER_OK)
  TransferBufferLength = 00000200
  TransferBuffer       = 00000000
  TransferBufferMDL    = 85ae5cb0
  UrbLink              = 00000000
[108312 ms] UsbSnoop - MyInternalIOCTLCompletion(f76d8126) : fido=85e673d0, Irp=85a32a50, Context=85b8ca40, IRQL=2
[108312 ms]  <<<  URB 145 coming back  <<< 
-- URB_FUNCTION_BULK_OR_INTERRUPT_TRANSFER:
  PipeHandle           = 866db8cc [endpoint 0x00000081]
  TransferFlags        = 00000003 (USBD_TRANSFER_DIRECTION_IN, USBD_SHORT_TRANSFER_OK)
  TransferBufferLength = 0000010e
  TransferBuffer       = 00000000
  TransferBufferMDL    = 85ae5cb0
    00000000: 54 fd 64 01 40 24 64 00 80 0c c7 76 fe 00 23 68
    00000010: 02 10 ff 00 f0 04 00 00 0f 14 ff fd 0f ff ff 0f
    00000020: 50 ff 00 4f 1b ff 00 4f 0f ff 00 fe 06 ee 00 ef
    00000030: 13 ff fe 0f ff f0 51 ff 00 4f 1b ff 00 4f 0f ff
    00000040: 00 fe 06 ee 00 ef 13 ff fe f0 00 0f 51 ff 00 4f
    00000050: 1b ff 00 4f 7f ff fe ff ff 4f 1b ff 00 4f 7f ff
    00000060: fe ff ff 4f 1b ff 00 4f 07 ff 00 fe 06 ee 00 ef
    00000070: 70 ff 00 4f 1b ff 00 4f 08 ff fe f0 00 00 75 ff
    00000080: 00 4f 1b ff 00 4f 08 ff fd 0d dd dd 0f 74 ff 00
    00000090: 4f 1b ff 00 4f 07 ff 00 f0 f5 dd dd dd d0 00 00
    000000a0: 0f ff ff 00 00 0f 11 ff 00 f0 59 ff 00 4f 0e ff
    000000b0: f9 00 00 00 ff 0f ff ff 0f 04 ff 00 4f 07 ff 00
    000000c0: f0 05 dd fd d0 ff ff 0f 13 ff 00 f0 59 ff 00 4f
    000000d0: 0e ff 00 0f fb ff ff ff 0f ff f0 05 ff 00 4f 07
    000000e0: ff fd f0 dd dd d0 03 00 e2 ff ff 0f ff ff f0 ff
    000000f0: f0 ff ff 00 ff ff 0f 00 0f f0 00 ff f0 f0 0f ff
    00000100: f0 ff ff f0 0f ff ff 00 52 ff 00 4f 0e ff
  UrbLink              = 00000000
[108313 ms] UsbSnoop - FilterDispatchAny(f76d7fd2) : IRP_MJ_INTERNAL_DEVICE_CONTROL
[108313 ms] UsbSnoop - FdoHookDispatchInternalIoctl(f76d81ea) : fdo=861c0730, Irp=85a32a50, IRQL=0
[108313 ms]  >>>  URB 146 going down  >>> 
-- URB_FUNCTION_BULK_OR_INTERRUPT_TRANSFER:
  PipeHandle           = 866db8ec [endpoint 0x00000002]
  TransferFlags        = 00000002 (USBD_TRANSFER_DIRECTION_OUT, USBD_SHORT_TRANSFER_OK)
  TransferBufferLength = 00000012
  TransferBuffer       = 00000000
  TransferBufferMDL    = 85b0ba48
    00000000: 54 fd 64 00 00 ff 64 01 40 24 0c 80 02 0a 23 38
    00000010: 80 0c
  UrbLink              = 00000000
[108313 ms] UsbSnoop - MyInternalIOCTLCompletion(f76d8126) : fido=85e673d0, Irp=85a32a50, Context=85b8ca40, IRQL=2
[108313 ms]  <<<  URB 146 coming back  <<< 
-- URB_FUNCTION_BULK_OR_INTERRUPT_TRANSFER:
  PipeHandle           = 866db8ec [endpoint 0x00000002]
  TransferFlags        = 00000002 (USBD_TRANSFER_DIRECTION_OUT, USBD_SHORT_TRANSFER_OK)
  TransferBufferLength = 00000012
  TransferBuffer       = 00000000
  TransferBufferMDL    = 85b0ba48
  UrbLink              = 00000000
[108314 ms] UsbSnoop - FilterDispatchAny(f76d7fd2) : IRP_MJ_INTERNAL_DEVICE_CONTROL
[108314 ms] UsbSnoop - FdoHookDispatchInternalIoctl(f76d81ea) : fdo=861c0730, Irp=85bd2cb0, IRQL=0
[108314 ms]  >>>  URB 147 going down  >>> 
-- URB_FUNCTION_BULK_OR_INTERRUPT_TRANSFER:
  PipeHandle           = 866db8cc [endpoint 0x00000081]
  TransferFlags        = 00000003 (USBD_TRANSFER_DIRECTION_IN, USBD_SHORT_TRANSFER_OK)
  TransferBufferLength = 00000200
  TransferBuffer       = 00000000
  TransferBufferMDL    = 85ae5cb0
  UrbLink              = 00000000
[108317 ms] UsbSnoop - MyInternalIOCTLCompletion(f76d8126) : fido=85e673d0, Irp=85bd2cb0, Context=85b8ca40, IRQL=2
[108317 ms]  <<<  URB 147 coming back  <<< 
-- URB_FUNCTION_BULK_OR_INTERRUPT_TRANSFER:
  PipeHandle           = 866db8cc [endpoint 0x00000081]
  TransferFlags        = 00000003 (USBD_TRANSFER_DIRECTION_IN, USBD_SHORT_TRANSFER_OK)
  TransferBufferLength = 0000010e
  TransferBuffer       = 00000000
  TransferBufferMDL    = 85ae5cb0
    00000000: 54 fd 64 01 40 24 64 00 80 0c cf 01 fe 00 24 fc
    00000010: 02 00 0f f4 ff ff ff 0f ff 0f ff ff f0 00 ff ff
    00000020: 4f 07 ff fd f0 00 00 0d fa dd dd dd d0 ff ff 0f
    00000030: e4 ff ff ff 0f 0f ff f0 ff 0f ff 00 ff f0 0f ff
    00000040: 0f f0 0f f0 ff f0 ff ff 0f f0 ff f0 ff 0f 51 ff
    00000050: 00 4f 0e ff 00 0f fc ff ff ff 0f f0 f9 ff ff ff
    00000060: 0f ff 0f ff 4f 07 ff 00 f0 05 dd e2 d0 ff ff 00
    00000070: 00 0f ff 0f 0f ff 0f ff f0 ff 0f ff f0 ff ff 0f
    00000080: f0 ff ff 0f f0 ff f0 ff ff 0f f0 53 ff 00 4f 0e
    00000090: ff f3 00 00 ff ff 0f 0f ff ff f0 ff ff f0 ff 4f
    000000a0: 07 ff 00 f0 f7 dd dd dd 00 00 0d d0 ff ff 0f fb
    000000b0: ff ff ff f0 ff ff eb 00 00 00 ff 0f ff f0 ff ff
    000000c0: 0f f0 ff ff 0f f0 ff f0 00 00 0f ff 0f 52 ff 00
    000000d0: 4f 10 ff f5 0f ff 00 f0 ff ff f0 ff ff f0 ff 4f
    000000e0: 07 ff 00 f0 f7 dd dd dd d0 00 dd d0 ff ff 0f fa
    000000f0: ff ff ff f0 ff ff 0f f1 ff ff ff 0f ff f0 ff ff
    00000100: 0f f0 ff ff 0f f0 ff f0 03 ff 00 f0 52 ff
  UrbLink              = 00000000
[108318 ms] UsbSnoop - FilterDispatchAny(f76d7fd2) : IRP_MJ_INTERNAL_DEVICE_CONTROL
[108318 ms] UsbSnoop - FdoHookDispatchInternalIoctl(f76d81ea) : fdo=861c0730, Irp=85a32a50, IRQL=0
[108318 ms]  >>>  URB 148 going down  >>> 
-- URB_FUNCTION_BULK_OR_INTERRUPT_TRANSFER:
  PipeHandle           = 866db8ec [endpoint 0x00000002]
  TransferFlags        = 00000002 (USBD_TRANSFER_DIRECTION_OUT, USBD_SHORT_TRANSFER_OK)
  TransferBufferLength = 00000012
  TransferBuffer       = 00000000
  TransferBufferMDL    = 86abce70
    00000000: 54 fd 64 00 00 ff 64 01 40 24 0c 80 02 0a 24 39
    00000010: 80 0c
  UrbLink              = 00000000
[108318 ms] UsbSnoop - MyInternalIOCTLCompletion(f76d8126) : fido=85e673d0, Irp=85a32a50, Context=85b8ca40, IRQL=2
[108318 ms]  <<<  URB 148 coming back  <<< 
-- URB_FUNCTION_BULK_OR_INTERRUPT_TRANSFER:
  PipeHandle           = 866db8ec [endpoint 0x00000002]
  TransferFlags        = 00000002 (USBD_TRANSFER_DIRECTION_OUT, USBD_SHORT_TRANSFER_OK)
  TransferBufferLength = 00000012
  TransferBuffer       = 00000000
  TransferBufferMDL    = 86abce70
  UrbLink              = 00000000
[108319 ms] UsbSnoop - FilterDispatchAny(f76d7fd2) : IRP_MJ_INTERNAL_DEVICE_CONTROL
[108319 ms] UsbSnoop - FdoHookDispatchInternalIoctl(f76d81ea) : fdo=861c0730, Irp=85a2eaf0, IRQL=0
[108319 ms]  >>>  URB 149 going down  >>> 
-- URB_FUNCTION_BULK_OR_INTERRUPT_TRANSFER:
  PipeHandle           = 866db8cc [endpoint 0x00000081]
  TransferFlags        = 00000003 (USBD_TRANSFER_DIRECTION_IN, USBD_SHORT_TRANSFER_OK)
  TransferBufferLength = 00000200
  TransferBuffer       = 00000000
  TransferBufferMDL    = 85ae5cb0
  UrbLink              = 00000000
[108322 ms] UsbSnoop - MyInternalIOCTLCompletion(f76d8126) : fido=85e673d0, Irp=85a2eaf0, Context=85b8ca40, IRQL=2
[108322 ms]  <<<  URB 149 coming back  <<< 
-- URB_FUNCTION_BULK_OR_INTERRUPT_TRANSFER:
  PipeHandle           = 866db8cc [endpoint 0x00000081]
  TransferFlags        = 00000003 (USBD_TRANSFER_DIRECTION_IN, USBD_SHORT_TRANSFER_OK)
  TransferBufferLength = 0000010e
  TransferBuffer       = 00000000
  TransferBufferMDL    = 85ae5cb0
    00000000: 54 fd 64 01 40 24 64 00 80 0c a0 20 fe 00 25 ed
    00000010: 02 00 4f 10 ff f5 f0 ff 0f ff 0f ff f0 ff ff f0
    00000020: ff 4f 07 ff 00 f0 03 dd fb 0d dd d0 ff ff 0f fa
    00000030: ff ff ff 0f 0f ff 0f f1 ff ff ff 0f ff f0 ff ff
    00000040: 0f f0 ff ff 0f f0 ff f0 04 ff 00 0f 51 ff 00 4f
    00000050: 10 ff f5 f0 ff 0f ff f0 ff f0 ff ff f0 ff 4f 07
    00000060: ff 00 f0 05 dd fd d0 ff ff 0f e4 ff ff ff 0f 0f
    00000070: ff f0 ff f0 ff 0f ff f0 ff ff 0f f0 0f f0 ff f0
    00000080: ff ff 0f ff 0f f0 ff 0f 51 ff 00 4f 0e ff f3 0f
    00000090: ff 0f ff 0f ff ff 0f ff 0f ff 0f ff 4f 07 ff 00
    000000a0: f0 05 dd e1 d0 ff ff 00 00 0f f0 ff f0 ff ff 00
    000000b0: 0f ff 0f ff f0 ff ff 0f f0 f0 0f ff ff 0f ff f0
    000000c0: 00 ff ff 00 52 ff 00 4f 0e ff f3 f0 00 ff ff 0f
    000000d0: ff ff f0 ff f0 00 ff ff 4f 07 ff 00 f0 06 00 12
    000000e0: ff 00 f0 5d ff 00 4f 1b ff 00 4f 07 ff 00 fe 06
    000000f0: ee 00 ef 11 ff 00 f0 5d ff 00 4f 1b ff 00 4f 07
    00000100: ff 00 fe 06 ee 00 ef 11 ff 00 f0 5d ff 00
  UrbLink              = 00000000
[108323 ms] UsbSnoop - FilterDispatchAny(f76d7fd2) : IRP_MJ_INTERNAL_DEVICE_CONTROL
[108323 ms] UsbSnoop - FdoHookDispatchInternalIoctl(f76d81ea) : fdo=861c0730, Irp=85a32a50, IRQL=0
[108323 ms]  >>>  URB 150 going down  >>> 
-- URB_FUNCTION_BULK_OR_INTERRUPT_TRANSFER:
  PipeHandle           = 866db8ec [endpoint 0x00000002]
  TransferFlags        = 00000002 (USBD_TRANSFER_DIRECTION_OUT, USBD_SHORT_TRANSFER_OK)
  TransferBufferLength = 00000012
  TransferBuffer       = 00000000
  TransferBufferMDL    = 85b0ba48
    00000000: 54 fd 64 00 00 ff 64 01 40 24 0c 80 02 0a 25 3a
    00000010: 80 0c
  UrbLink              = 00000000
[108323 ms] UsbSnoop - MyInternalIOCTLCompletion(f76d8126) : fido=85e673d0, Irp=85a32a50, Context=85b8ca40, IRQL=2
[108323 ms]  <<<  URB 150 coming back  <<< 
-- URB_FUNCTION_BULK_OR_INTERRUPT_TRANSFER:
  PipeHandle           = 866db8ec [endpoint 0x00000002]
  TransferFlags        = 00000002 (USBD_TRANSFER_DIRECTION_OUT, USBD_SHORT_TRANSFER_OK)
  TransferBufferLength = 00000012
  TransferBuffer       = 00000000
  TransferBufferMDL    = 85b0ba48
  UrbLink              = 00000000
[108324 ms] UsbSnoop - FilterDispatchAny(f76d7fd2) : IRP_MJ_INTERNAL_DEVICE_CONTROL
[108324 ms] UsbSnoop - FdoHookDispatchInternalIoctl(f76d81ea) : fdo=861c0730, Irp=85a91af0, IRQL=0
[108324 ms]  >>>  URB 151 going down  >>> 
-- URB_FUNCTION_BULK_OR_INTERRUPT_TRANSFER:
  PipeHandle           = 866db8cc [endpoint 0x00000081]
  TransferFlags        = 00000003 (USBD_TRANSFER_DIRECTION_IN, USBD_SHORT_TRANSFER_OK)
  TransferBufferLength = 00000200
  TransferBuffer       = 00000000
  TransferBufferMDL    = 85ae5cb0
  UrbLink              = 00000000
[108327 ms] UsbSnoop - MyInternalIOCTLCompletion(f76d8126) : fido=85e673d0, Irp=85a91af0, Context=85b8ca40, IRQL=2
[108327 ms]  <<<  URB 151 coming back  <<< 
-- URB_FUNCTION_BULK_OR_INTERRUPT_TRANSFER:
  PipeHandle           = 866db8cc [endpoint 0x00000081]
  TransferFlags        = 00000003 (USBD_TRANSFER_DIRECTION_IN, USBD_SHORT_TRANSFER_OK)
  TransferBufferLength = 0000010e
  TransferBuffer       = 00000000
  TransferBufferMDL    = 85ae5cb0
    00000000: 54 fd 64 01 40 24 64 00 80 0c 03 d8 fe 00 26 09
    00000010: 02 4f 1b ff 00 4f 7f ff fe ff ff 4f 1b ff 00 4f
    00000020: 7f ff fe ff ff 4f 1b ff 00 4f 0f ff 00 fe 06 ee
    00000030: 00 ef 68 ff 00 4f 1b ff 00 4f 10 ff 00 f0 03 00
    00000040: 00 0f 6a ff 00 4f 1b ff 00 4f 10 ff 00 f0 fc ee
    00000050: ee ee e0 e0 6a ff 00 4f 1b ff 00 4f 10 ff 00 f0
    00000060: f7 ee ee ee e0 ee 0f ff f0 00 0f 03 ff 00 f0 1d
    00000070: ff 00 0f 10 ff 00 0f fd ff ff ff 0f 2b ff 00 4f
    00000080: 0e ff f9 00 00 00 ff 0f ff ff 0f 04 ff 00 4f 10
    00000090: ff 00 f0 f7 ee ee ee e0 00 0f ff f0 ff f0 03 ff
    000000a0: 00 f0 1d ff 00 0f 10 ff 00 0f fd ff ff ff 0f 2b
    000000b0: ff 00 4f 0e ff 00 0f fb ff ff ff 0f ff f0 05 ff
    000000c0: 00 4f 10 ff 00 f0 03 ee f0 ed 0f ff f0 ff ff 0f
    000000d0: f0 f0 0f ff ff f0 0f ff ff 00 04 ff fb 00 ff ff
    000000e0: 0f 00 0f f0 ff ff ff 0f 00 0f f0 00 ff ff 00 0f
    000000f0: ff ff f0 f0 00 f5 ff ff ff f0 f0 0f ff 00 0f ff
    00000100: 0f 00 03 ff fb f0 0f 0f ff f0 0f 28 ff 00
  UrbLink              = 00000000
[108328 ms] UsbSnoop - FilterDispatchAny(f76d7fd2) : IRP_MJ_INTERNAL_DEVICE_CONTROL
[108328 ms] UsbSnoop - FdoHookDispatchInternalIoctl(f76d81ea) : fdo=861c0730, Irp=85a32a50, IRQL=0
[108328 ms]  >>>  URB 152 going down  >>> 
-- URB_FUNCTION_BULK_OR_INTERRUPT_TRANSFER:
  PipeHandle           = 866db8ec [endpoint 0x00000002]
  TransferFlags        = 00000002 (USBD_TRANSFER_DIRECTION_OUT, USBD_SHORT_TRANSFER_OK)
  TransferBufferLength = 00000012
  TransferBuffer       = 00000000
  TransferBufferMDL    = 86abce70
    00000000: 54 fd 64 00 00 ff 64 01 40 24 0c 80 02 0a 26 3b
    00000010: 80 0c
  UrbLink              = 00000000
[108328 ms] UsbSnoop - MyInternalIOCTLCompletion(f76d8126) : fido=85e673d0, Irp=85a32a50, Context=85b8ca40, IRQL=2
[108328 ms]  <<<  URB 152 coming back  <<< 
-- URB_FUNCTION_BULK_OR_INTERRUPT_TRANSFER:
  PipeHandle           = 866db8ec [endpoint 0x00000002]
  TransferFlags        = 00000002 (USBD_TRANSFER_DIRECTION_OUT, USBD_SHORT_TRANSFER_OK)
  TransferBufferLength = 00000012
  TransferBuffer       = 00000000
  TransferBufferMDL    = 86abce70
  UrbLink              = 00000000
[108329 ms] UsbSnoop - FilterDispatchAny(f76d7fd2) : IRP_MJ_INTERNAL_DEVICE_CONTROL
[108329 ms] UsbSnoop - FdoHookDispatchInternalIoctl(f76d81ea) : fdo=861c0730, Irp=85a33e70, IRQL=0
[108329 ms]  >>>  URB 153 going down  >>> 
-- URB_FUNCTION_BULK_OR_INTERRUPT_TRANSFER:
  PipeHandle           = 866db8cc [endpoint 0x00000081]
  TransferFlags        = 00000003 (USBD_TRANSFER_DIRECTION_IN, USBD_SHORT_TRANSFER_OK)
  TransferBufferLength = 00000200
  TransferBuffer       = 00000000
  TransferBufferMDL    = 85ae5cb0
  UrbLink              = 00000000
[108332 ms] UsbSnoop - MyInternalIOCTLCompletion(f76d8126) : fido=85e673d0, Irp=85a33e70, Context=85b8ca40, IRQL=2
[108332 ms]  <<<  URB 153 coming back  <<< 
-- URB_FUNCTION_BULK_OR_INTERRUPT_TRANSFER:
  PipeHandle           = 866db8cc [endpoint 0x00000081]
  TransferFlags        = 00000003 (USBD_TRANSFER_DIRECTION_IN, USBD_SHORT_TRANSFER_OK)
  TransferBufferLength = 0000010e
  TransferBuffer       = 00000000
  TransferBufferMDL    = 85ae5cb0
    00000000: 54 fd 64 01 40 24 64 00 80 0c 59 f6 fe 00 27 7e
    00000010: 02 4f 0e ff 00 0f f4 ff ff ff 0f ff 0f ff ff f0
    00000020: 00 ff ff 4f 10 ff 00 f0 03 ee ef dc 0f ff f0 ff
    00000030: ff 0f f0 0f ff f0 ff 0f f0 ff f0 ff 0f f7 ff ff
    00000040: ff f0 ff 0f ff 00 ff f0 da ff ff ff 00 ff f0 0f
    00000050: ff 0f f0 ff f0 ff 0f f0 0f ff 0f ff ff f0 0f ff
    00000060: f0 ff f0 ff 00 ff 0f ff 0f ff 0f f0 0f ff 0f f0
    00000070: 28 ff 00 4f 0e ff 00 0f fc ff ff ff 0f f0 f9 ff
    00000080: ff ff 0f ff 0f ff 4f 10 ff 00 f0 eb ee ee ee ed
    00000090: cc 0f ff f0 ff f0 ff f0 ff ff f0 ff 0f ff ff 0f
    000000a0: ff f0 f7 ff ff ff 0f ff f0 ff 0f ff f0 ec ff ff
    000000b0: ff 0f ff f0 ff ff 0f ff ff f0 ff 0f f0 ff ff 0f
    000000c0: ff ff f0 03 ff f2 f0 ff 0f ff f0 ff 0f f0 ff ff
    000000d0: 0f f0 ff ff 0f 27 ff 00 4f 0e ff f3 00 00 ff ff
    000000e0: 0f 0f ff ff f0 ff ff f0 ff 4f 10 ff 00 f0 ee ee
    000000f0: ee ee dc cc 0f ff f0 00 0f ff f0 ff ff f0 ff f0
    00000100: ff ff fe 00 00 00 fe ff ff ff fa 00 00 00
  UrbLink              = 00000000
[108333 ms] UsbSnoop - FilterDispatchAny(f76d7fd2) : IRP_MJ_INTERNAL_DEVICE_CONTROL
[108333 ms] UsbSnoop - FdoHookDispatchInternalIoctl(f76d81ea) : fdo=861c0730, Irp=85a32a50, IRQL=0
[108333 ms]  >>>  URB 154 going down  >>> 
-- URB_FUNCTION_BULK_OR_INTERRUPT_TRANSFER:
  PipeHandle           = 866db8ec [endpoint 0x00000002]
  TransferFlags        = 00000002 (USBD_TRANSFER_DIRECTION_OUT, USBD_SHORT_TRANSFER_OK)
  TransferBufferLength = 00000012
  TransferBuffer       = 00000000
  TransferBufferMDL    = 85b0ba48
    00000000: 54 fd 64 00 00 ff 64 01 40 24 0c 80 02 0a 27 3c
    00000010: 80 0c
  UrbLink              = 00000000
[108333 ms] UsbSnoop - MyInternalIOCTLCompletion(f76d8126) : fido=85e673d0, Irp=85a32a50, Context=85b8ca40, IRQL=2
[108333 ms]  <<<  URB 154 coming back  <<< 
-- URB_FUNCTION_BULK_OR_INTERRUPT_TRANSFER:
  PipeHandle           = 866db8ec [endpoint 0x00000002]
  TransferFlags        = 00000002 (USBD_TRANSFER_DIRECTION_OUT, USBD_SHORT_TRANSFER_OK)
  TransferBufferLength = 00000012
  TransferBuffer       = 00000000
  TransferBufferMDL    = 85b0ba48
  UrbLink              = 00000000
[108334 ms] UsbSnoop - FilterDispatchAny(f76d7fd2) : IRP_MJ_INTERNAL_DEVICE_CONTROL
[108334 ms] UsbSnoop - FdoHookDispatchInternalIoctl(f76d81ea) : fdo=861c0730, Irp=85a32a50, IRQL=0
[108334 ms]  >>>  URB 155 going down  >>> 
-- URB_FUNCTION_BULK_OR_INTERRUPT_TRANSFER:
  PipeHandle           = 866db8cc [endpoint 0x00000081]
  TransferFlags        = 00000003 (USBD_TRANSFER_DIRECTION_IN, USBD_SHORT_TRANSFER_OK)
  TransferBufferLength = 00000200
  TransferBuffer       = 00000000
  TransferBufferMDL    = 85a4de68
  UrbLink              = 00000000
[108337 ms] UsbSnoop - MyInternalIOCTLCompletion(f76d8126) : fido=85e673d0, Irp=85a32a50, Context=85b8ca40, IRQL=2
[108337 ms]  <<<  URB 155 coming back  <<< 
-- URB_FUNCTION_BULK_OR_INTERRUPT_TRANSFER:
  PipeHandle           = 866db8cc [endpoint 0x00000081]
  TransferFlags        = 00000003 (USBD_TRANSFER_DIRECTION_IN, USBD_SHORT_TRANSFER_OK)
  TransferBufferLength = 0000010e
  TransferBuffer       = 00000000
  TransferBufferMDL    = 85a4de68
    00000000: 54 fd 64 01 40 24 64 00 80 0c 36 a1 fe 00 28 07
    00000010: 02 ff 0f ff f0 ec ff ff ff 0f ff f0 ff ff 0f ff
    00000020: 00 00 ff 0f f0 ff ff 0f ff ff f0 ee ff ff ff 00
    00000030: 00 ff 0f ff f0 ff 0f f0 ff ff 0f f0 00 00 0f 27
    00000040: ff 00 4f 10 ff f5 0f ff 00 f0 ff ff f0 ff ff f0
    00000050: ff 4f 10 ff f8 f0 ee ee ed cc cc 0f ff f0 f5 ff
    00000060: ff ff f0 ff ff f0 ff ff 0f ff 0f 04 ff 00 0f fb
    00000070: ff ff ff 0f ff f0 dc ff ff ff 0f ff f0 ff ff 0f
    00000080: f0 ff f0 ff 0f f0 ff ff 0f ff ff f0 ff ff f0 ff
    00000090: f0 ff 0f ff f0 ff 0f f0 ff ff 0f f0 2a ff 00 4f
    000000a0: 10 ff f5 f0 ff 0f ff 0f ff f0 ff ff f0 ff 4f 10
    000000b0: ff f8 f0 ee ee dc cc cc 0f ff f0 f5 ff ff ff f0
    000000c0: ff ff f0 ff ff f0 ff 0f 04 ff 00 0f fb ff ff ff
    000000d0: 0f ff f0 dc ff ff ff 0f ff f0 ff ff 0f f0 ff f0
    000000e0: ff 0f f0 ff ff 0f ff ff f0 ff ff f0 ff f0 ff 0f
    000000f0: ff f0 ff 0f f0 ff ff 0f f0 2a ff 00 4f 10 ff f5
    00000100: f0 ff 0f ff f0 ff f0 ff ff f0 ff 4f 10 ff
  UrbLink              = 00000000
[108338 ms] UsbSnoop - FilterDispatchAny(f76d7fd2) : IRP_MJ_INTERNAL_DEVICE_CONTROL
[108338 ms] UsbSnoop - FdoHookDispatchInternalIoctl(f76d81ea) : fdo=861c0730, Irp=85a32a50, IRQL=0
[108338 ms]  >>>  URB 156 going down  >>> 
-- URB_FUNCTION_BULK_OR_INTERRUPT_TRANSFER:
  PipeHandle           = 866db8ec [endpoint 0x00000002]
  TransferFlags        = 00000002 (USBD_TRANSFER_DIRECTION_OUT, USBD_SHORT_TRANSFER_OK)
  TransferBufferLength = 00000012
  TransferBuffer       = 00000000
  TransferBufferMDL    = 85a4de68
    00000000: 54 fd 64 00 00 ff 64 01 40 24 0c 80 02 0a 28 3d
    00000010: 80 0c
  UrbLink              = 00000000
[108338 ms] UsbSnoop - MyInternalIOCTLCompletion(f76d8126) : fido=85e673d0, Irp=85a32a50, Context=85b8ca40, IRQL=2
[108338 ms]  <<<  URB 156 coming back  <<< 
-- URB_FUNCTION_BULK_OR_INTERRUPT_TRANSFER:
  PipeHandle           = 866db8ec [endpoint 0x00000002]
  TransferFlags        = 00000002 (USBD_TRANSFER_DIRECTION_OUT, USBD_SHORT_TRANSFER_OK)
  TransferBufferLength = 00000012
  TransferBuffer       = 00000000
  TransferBufferMDL    = 85a4de68
  UrbLink              = 00000000
[108339 ms] UsbSnoop - FilterDispatchAny(f76d7fd2) : IRP_MJ_INTERNAL_DEVICE_CONTROL
[108339 ms] UsbSnoop - FdoHookDispatchInternalIoctl(f76d81ea) : fdo=861c0730, Irp=85a2daf0, IRQL=0
[108339 ms]  >>>  URB 157 going down  >>> 
-- URB_FUNCTION_BULK_OR_INTERRUPT_TRANSFER:
  PipeHandle           = 866db8cc [endpoint 0x00000081]
  TransferFlags        = 00000003 (USBD_TRANSFER_DIRECTION_IN, USBD_SHORT_TRANSFER_OK)
  TransferBufferLength = 00000200
  TransferBuffer       = 00000000
  TransferBufferMDL    = 85ae5cb0
  UrbLink              = 00000000
[108342 ms] UsbSnoop - MyInternalIOCTLCompletion(f76d8126) : fido=85e673d0, Irp=85a2daf0, Context=85b8ca40, IRQL=2
[108343 ms]  <<<  URB 157 coming back  <<< 
-- URB_FUNCTION_BULK_OR_INTERRUPT_TRANSFER:
  PipeHandle           = 866db8cc [endpoint 0x00000081]
  TransferFlags        = 00000003 (USBD_TRANSFER_DIRECTION_IN, USBD_SHORT_TRANSFER_OK)
  TransferBufferLength = 0000010e
  TransferBuffer       = 00000000
  TransferBufferMDL    = 85ae5cb0
    00000000: 54 fd 64 01 40 24 64 00 80 0c 9d be fe 00 29 8c
    00000010: 02 fe f0 ee ed fb cc cc cc 0f ff f0 f3 ff ff ff
    00000020: f0 ff ff f0 ff 0f f0 ff f0 ff f0 f7 ff ff ff f0
    00000030: ff f0 ff 0f ff f0 d9 ff ff ff 0f ff f0 ff ff 0f
    00000040: f0 ff 00 ff 0f f0 ff ff 0f ff ff f0 ff ff f0 ff
    00000050: 00 ff 00 ff 0f ff 0f ff 0f f0 0f ff 0f ff 0f 27
    00000060: ff 00 4f 0e ff f3 0f ff 0f ff 0f ff ff 0f ff 0f
    00000070: ff 0f ff 4f 10 ff fe f0 ee dc fb cc cc cc 0f ff
    00000080: f0 f3 ff ff ff f0 ff ff f0 ff f0 0f ff ff 00 0f
    00000090: 03 ff fb 00 0f ff 0f ff f0 ec ff ff ff 0f ff f0
    000000a0: ff ff 0f ff 00 f0 ff 0f f0 ff ff 0f ff ff f0 ef
    000000b0: ff ff ff 00 f0 ff 0f 00 ff ff 0f ff f0 0f 0f ff
    000000c0: f0 00 28 ff 00 4f 0e ff f3 f0 00 ff ff 0f ff ff
    000000d0: f0 ff f0 00 ff ff 4f 10 ff 00 f0 04 00 00 0f 34
    000000e0: ff 00 0f 33 ff 00 4f 1b ff 00 4f 0f ff 00 fe 06
    000000f0: ee 00 ef 33 ff 00 0f 33 ff 00 4f 1b ff 00 4f 0f
    00000100: ff 00 fe 06 ee 00 ef 33 ff 00 0f 33 ff 00
  UrbLink              = 00000000
[108343 ms] UsbSnoop - FilterDispatchAny(f76d7fd2) : IRP_MJ_INTERNAL_DEVICE_CONTROL
[108343 ms] UsbSnoop - FdoHookDispatchInternalIoctl(f76d81ea) : fdo=861c0730, Irp=85a69b18, IRQL=0
[108343 ms]  >>>  URB 158 going down  >>> 
-- URB_FUNCTION_BULK_OR_INTERRUPT_TRANSFER:
  PipeHandle           = 866db8ec [endpoint 0x00000002]
  TransferFlags        = 00000002 (USBD_TRANSFER_DIRECTION_OUT, USBD_SHORT_TRANSFER_OK)
  TransferBufferLength = 00000012
  TransferBuffer       = 00000000
  TransferBufferMDL    = 85a329d0
    00000000: 54 fd 64 00 00 ff 64 01 40 24 0c 80 02 0a 29 3e
    00000010: 80 0c
  UrbLink              = 00000000
[108343 ms] UsbSnoop - MyInternalIOCTLCompletion(f76d8126) : fido=85e673d0, Irp=85a69b18, Context=85b8ca40, IRQL=2
[108343 ms]  <<<  URB 158 coming back  <<< 
-- URB_FUNCTION_BULK_OR_INTERRUPT_TRANSFER:
  PipeHandle           = 866db8ec [endpoint 0x00000002]
  TransferFlags        = 00000002 (USBD_TRANSFER_DIRECTION_OUT, USBD_SHORT_TRANSFER_OK)
  TransferBufferLength = 00000012
  TransferBuffer       = 00000000
  TransferBufferMDL    = 85a329d0
  UrbLink              = 00000000
[108344 ms] UsbSnoop - FilterDispatchAny(f76d7fd2) : IRP_MJ_INTERNAL_DEVICE_CONTROL
[108344 ms] UsbSnoop - FdoHookDispatchInternalIoctl(f76d81ea) : fdo=861c0730, Irp=85a69b18, IRQL=0
[108344 ms]  >>>  URB 159 going down  >>> 
-- URB_FUNCTION_BULK_OR_INTERRUPT_TRANSFER:
  PipeHandle           = 866db8cc [endpoint 0x00000081]
  TransferFlags        = 00000003 (USBD_TRANSFER_DIRECTION_IN, USBD_SHORT_TRANSFER_OK)
  TransferBufferLength = 00000200
  TransferBuffer       = 00000000
  TransferBufferMDL    = 85a329d0
  UrbLink              = 00000000
[108347 ms] UsbSnoop - MyInternalIOCTLCompletion(f76d8126) : fido=85e673d0, Irp=85a69b18, Context=85b8ca40, IRQL=2
[108347 ms]  <<<  URB 159 coming back  <<< 
-- URB_FUNCTION_BULK_OR_INTERRUPT_TRANSFER:
  PipeHandle           = 866db8cc [endpoint 0x00000081]
  TransferFlags        = 00000003 (USBD_TRANSFER_DIRECTION_IN, USBD_SHORT_TRANSFER_OK)
  TransferBufferLength = 0000010e
  TransferBuffer       = 00000000
  TransferBufferMDL    = 85a329d0
    00000000: 54 fd 64 01 40 24 64 00 80 0c a2 7e fe 00 2a 52
    00000010: 02 4f 1b ff 00 4f 05 ff 00 f0 7f 00 17 00 00 0f
    00000020: 05 ff 00 f0 7f 00 17 00 00 0f 05 ff fe f0 0f fe
    00000030: 06 ee 00 ef 70 ff 00 4f 1a ff ff f0 0f 05 ff fb
    00000040: f0 0f ff f0 00 00 75 ff 00 4f 1a ff ff f0 0f 05
    00000050: ff fa f0 0f ff 0d dd dd 0f 74 ff 00 4f 1a ff ff
    00000060: f0 0f 05 ff fe f0 0f f0 f7 dd dd dd d0 00 00 0f
    00000070: ff ff 0f fd ff ff ff 0f 0a ff 00 f0 5e ff 00 4f
    00000080: 0e ff f9 f0 00 0f ff 0f ff ff 0f 03 ff ff f0 0f
    00000090: 05 ff fe f0 0f f0 05 dd fd d0 ff ff 00 fd ff ff
    000000a0: ff 0f 0a ff 00 f0 5e ff 00 4f 0e ff fa 0f ff f0
    000000b0: ff 0f ff f0 04 ff ff f0 0f 05 ff fb f0 0f f0 dd
    000000c0: dd d0 03 00 e2 ff ff 0f 0f ff ff 0f ff f0 00 ff
    000000d0: ff 0f 00 0f f0 00 ff f0 f0 0f ff f0 f0 0f ff f0
    000000e0: 0f ff ff 00 52 ff 00 4f 10 ff f5 f0 ff 0f ff 0f
    000000f0: ff ff f0 00 ff f0 0f 05 ff fb f0 0f f0 00 00 0d
    00000100: dd dd dd dd d0 ff ff 0f f0 ff ff 0f ff 0f
  UrbLink              = 00000000
[108348 ms] UsbSnoop - FilterDispatchAny(f76d7fd2) : IRP_MJ_INTERNAL_DEVICE_CONTROL
[108348 ms] UsbSnoop - FdoHookDispatchInternalIoctl(f76d81ea) : fdo=861c0730, Irp=85a69b18, IRQL=0
[108348 ms]  >>>  URB 160 going down  >>> 
-- URB_FUNCTION_BULK_OR_INTERRUPT_TRANSFER:
  PipeHandle           = 866db8ec [endpoint 0x00000002]
  TransferFlags        = 00000002 (USBD_TRANSFER_DIRECTION_OUT, USBD_SHORT_TRANSFER_OK)
  TransferBufferLength = 00000012
  TransferBuffer       = 00000000
  TransferBufferMDL    = 85a329d0
    00000000: 54 fd 64 00 00 ff 64 01 40 24 0c 80 02 0a 2a 3f
    00000010: 80 0c
  UrbLink              = 00000000
[108348 ms] UsbSnoop - MyInternalIOCTLCompletion(f76d8126) : fido=85e673d0, Irp=85a69b18, Context=85b8ca40, IRQL=2
[108348 ms]  <<<  URB 160 coming back  <<< 
-- URB_FUNCTION_BULK_OR_INTERRUPT_TRANSFER:
  PipeHandle           = 866db8ec [endpoint 0x00000002]
  TransferFlags        = 00000002 (USBD_TRANSFER_DIRECTION_OUT, USBD_SHORT_TRANSFER_OK)
  TransferBufferLength = 00000012
  TransferBuffer       = 00000000
  TransferBufferMDL    = 85a329d0
  UrbLink              = 00000000
[108349 ms] UsbSnoop - FilterDispatchAny(f76d7fd2) : IRP_MJ_INTERNAL_DEVICE_CONTROL
[108349 ms] UsbSnoop - FdoHookDispatchInternalIoctl(f76d81ea) : fdo=861c0730, Irp=85a32a50, IRQL=0
[108349 ms]  >>>  URB 161 going down  >>> 
-- URB_FUNCTION_BULK_OR_INTERRUPT_TRANSFER:
  PipeHandle           = 866db8cc [endpoint 0x00000081]
  TransferFlags        = 00000003 (USBD_TRANSFER_DIRECTION_IN, USBD_SHORT_TRANSFER_OK)
  TransferBufferLength = 00000200
  TransferBuffer       = 00000000
  TransferBufferMDL    = 86abce70
  UrbLink              = 00000000
[108352 ms] UsbSnoop - MyInternalIOCTLCompletion(f76d8126) : fido=85e673d0, Irp=85a32a50, Context=85b8ca40, IRQL=2
[108352 ms]  <<<  URB 161 coming back  <<< 
-- URB_FUNCTION_BULK_OR_INTERRUPT_TRANSFER:
  PipeHandle           = 866db8cc [endpoint 0x00000081]
  TransferFlags        = 00000003 (USBD_TRANSFER_DIRECTION_IN, USBD_SHORT_TRANSFER_OK)
  TransferBufferLength = 0000010e
  TransferBuffer       = 00000000
  TransferBufferMDL    = 86abce70
    00000000: 54 fd 64 01 40 24 64 00 80 0c 3c d6 fe 00 2b 45
    00000010: 02 ff 0f ff 00 ff f0 0f ff 0f f0 0f f0 ff f0 0f
    00000020: ff ff 0f f0 ff f0 ff 0f 51 ff 00 4f 10 ff fd 0f
    00000030: ff 0f f0 f9 ff ff ff 0f ff 0f f0 0f 05 ff fe f0
    00000040: 0f f0 05 dd e2 d0 ff ff 0f ff 0f ff 0f f0 ff ff
    00000050: f0 ff 0f ff f0 ff ff 0f f0 ff ff 0f f0 ff ff f0
    00000060: ff ff 0f f0 53 ff 00 4f 0f ff f4 00 ff ff 0f 0f
    00000070: ff ff f0 ff ff f0 f0 0f 05 ff fe f0 0f f0 db dd
    00000080: dd dd 00 00 0d d0 ff ff 0f ff 0f ff 0f f0 ff ff
    00000090: f0 ff 0f ff f0 ff ff 0f f0 ff ff 0f f0 ff ff f0
    000000a0: 00 00 0f ff 0f 52 ff 00 4f 10 ff f5 0f ff 00 f0
    000000b0: ff ff f0 ff ff f0 f0 0f 05 ff fe f0 0f f0 e0 dd
    000000c0: dd dd d0 00 dd d0 ff ff 0f ff f0 ff 0f f0 ff ff
    000000d0: f0 ff 0f ff f0 ff ff 0f f0 ff ff 0f f0 ff ff f0
    000000e0: 03 ff 00 f0 52 ff 00 4f 10 ff f5 f0 ff 0f ff 0f
    000000f0: ff f0 ff ff f0 f0 0f 05 ff fe f0 0f f0 03 dd e4
    00000100: 0d dd d0 ff ff 0f ff ff 0f 0f f0 ff ff f0
  UrbLink              = 00000000
[108353 ms] UsbSnoop - FilterDispatchAny(f76d7fd2) : IRP_MJ_INTERNAL_DEVICE_CONTROL
[108353 ms] UsbSnoop - FdoHookDispatchInternalIoctl(f76d81ea) : fdo=861c0730, Irp=85a69b18, IRQL=0
[108353 ms]  >>>  URB 162 going down  >>> 
-- URB_FUNCTION_BULK_OR_INTERRUPT_TRANSFER:
  PipeHandle           = 866db8ec [endpoint 0x00000002]
  TransferFlags        = 00000002 (USBD_TRANSFER_DIRECTION_OUT, USBD_SHORT_TRANSFER_OK)
  TransferBufferLength = 00000012
  TransferBuffer       = 00000000
  TransferBufferMDL    = 85ae5cb0
    00000000: 54 fd 64 00 00 ff 64 01 40 24 0c 80 02 0a 2b 40
    00000010: 80 0c
  UrbLink              = 00000000
[108353 ms] UsbSnoop - MyInternalIOCTLCompletion(f76d8126) : fido=85e673d0, Irp=85a69b18, Context=85b8ca40, IRQL=2
[108353 ms]  <<<  URB 162 coming back  <<< 
-- URB_FUNCTION_BULK_OR_INTERRUPT_TRANSFER:
  PipeHandle           = 866db8ec [endpoint 0x00000002]
  TransferFlags        = 00000002 (USBD_TRANSFER_DIRECTION_OUT, USBD_SHORT_TRANSFER_OK)
  TransferBufferLength = 00000012
  TransferBuffer       = 00000000
  TransferBufferMDL    = 85ae5cb0
  UrbLink              = 00000000
[108354 ms] UsbSnoop - FilterDispatchAny(f76d7fd2) : IRP_MJ_INTERNAL_DEVICE_CONTROL
[108354 ms] UsbSnoop - FdoHookDispatchInternalIoctl(f76d81ea) : fdo=861c0730, Irp=85a32a50, IRQL=0
[108354 ms]  >>>  URB 163 going down  >>> 
-- URB_FUNCTION_BULK_OR_INTERRUPT_TRANSFER:
  PipeHandle           = 866db8cc [endpoint 0x00000081]
  TransferFlags        = 00000003 (USBD_TRANSFER_DIRECTION_IN, USBD_SHORT_TRANSFER_OK)
  TransferBufferLength = 00000200
  TransferBuffer       = 00000000
  TransferBufferMDL    = 86abce70
  UrbLink              = 00000000
[108357 ms] UsbSnoop - MyInternalIOCTLCompletion(f76d8126) : fido=85e673d0, Irp=85a32a50, Context=85b8ca40, IRQL=2
[108357 ms]  <<<  URB 163 coming back  <<< 
-- URB_FUNCTION_BULK_OR_INTERRUPT_TRANSFER:
  PipeHandle           = 866db8cc [endpoint 0x00000081]
  TransferFlags        = 00000003 (USBD_TRANSFER_DIRECTION_IN, USBD_SHORT_TRANSFER_OK)
  TransferBufferLength = 0000010e
  TransferBuffer       = 00000000
  TransferBufferMDL    = 86abce70
    00000000: 54 fd 64 01 40 24 64 00 80 0c fc e3 fe 00 2c 13
    00000010: 02 ff 0f ff f0 ff ff 0f f0 ff ff 0f f0 ff ff f0
    00000020: 04 ff 00 0f 51 ff 00 4f 10 ff f5 f0 ff 0f ff f0
    00000030: ff f0 ff ff f0 f0 0f 05 ff fe f0 0f f0 05 dd e9
    00000040: d0 ff ff 0f ff ff f0 0f ff 0f ff 0f ff 0f ff f0
    00000050: ff ff 0f f0 0f f0 ff f0 f8 ff ff ff 0f ff 0f f0
    00000060: ff 0f 51 ff 00 4f 0e ff f3 0f ff 0f ff 0f ff ff
    00000070: 0f ff 0f ff 0f f0 0f 05 ff fe f0 0f f0 05 dd fd
    00000080: d0 ff ff 0f ed ff ff ff 0f ff f0 00 ff ff 0f ff
    00000090: f0 ff ff 0f f0 f0 0f ff f0 f9 ff ff ff f0 00 ff
    000000a0: ff 00 52 ff 00 4f 0e ff f3 f0 00 ff ff 0f ff ff
    000000b0: f0 ff f0 00 ff f0 0f 05 ff fe f0 0f f0 06 00 71
    000000c0: ff 00 4f 1a ff ff f0 0f 05 ff fe f0 0f fe 06 ee
    000000d0: 00 ef 70 ff 00 4f 1a ff ff f0 0f 05 ff 00 f0 7f
    000000e0: 00 17 00 00 0f 05 ff 00 f0 7f 00 17 00 00 0f 7f
    000000f0: ff fe ff ff 4f 1b ff 00 4f 0f ff 00 fe 06 ee 00
    00000100: ef 68 ff 00 4f 1b ff 00 4f 10 ff 00 f0 03
  UrbLink              = 00000000
[108358 ms] UsbSnoop - FilterDispatchAny(f76d7fd2) : IRP_MJ_INTERNAL_DEVICE_CONTROL
[108358 ms] UsbSnoop - FdoHookDispatchInternalIoctl(f76d81ea) : fdo=861c0730, Irp=85a69b18, IRQL=0
[108358 ms]  >>>  URB 164 going down  >>> 
-- URB_FUNCTION_BULK_OR_INTERRUPT_TRANSFER:
  PipeHandle           = 866db8ec [endpoint 0x00000002]
  TransferFlags        = 00000002 (USBD_TRANSFER_DIRECTION_OUT, USBD_SHORT_TRANSFER_OK)
  TransferBufferLength = 00000012
  TransferBuffer       = 00000000
  TransferBufferMDL    = 85a4de68
    00000000: 54 fd 64 00 00 ff 64 01 40 24 0c 80 02 0a 2c 41
    00000010: 80 0c
  UrbLink              = 00000000
[108358 ms] UsbSnoop - MyInternalIOCTLCompletion(f76d8126) : fido=85e673d0, Irp=85a69b18, Context=85b8ca40, IRQL=2
[108358 ms]  <<<  URB 164 coming back  <<< 
-- URB_FUNCTION_BULK_OR_INTERRUPT_TRANSFER:
  PipeHandle           = 866db8ec [endpoint 0x00000002]
  TransferFlags        = 00000002 (USBD_TRANSFER_DIRECTION_OUT, USBD_SHORT_TRANSFER_OK)
  TransferBufferLength = 00000012
  TransferBuffer       = 00000000
  TransferBufferMDL    = 85a4de68
  UrbLink              = 00000000
[108359 ms] UsbSnoop - FilterDispatchAny(f76d7fd2) : IRP_MJ_INTERNAL_DEVICE_CONTROL
[108359 ms] UsbSnoop - FdoHookDispatchInternalIoctl(f76d81ea) : fdo=861c0730, Irp=85a32a50, IRQL=0
[108359 ms]  >>>  URB 165 going down  >>> 
-- URB_FUNCTION_BULK_OR_INTERRUPT_TRANSFER:
  PipeHandle           = 866db8cc [endpoint 0x00000081]
  TransferFlags        = 00000003 (USBD_TRANSFER_DIRECTION_IN, USBD_SHORT_TRANSFER_OK)
  TransferBufferLength = 00000200
  TransferBuffer       = 00000000
  TransferBufferMDL    = 86abce70
  UrbLink              = 00000000
[108362 ms] UsbSnoop - MyInternalIOCTLCompletion(f76d8126) : fido=85e673d0, Irp=85a32a50, Context=85b8ca40, IRQL=2
[108362 ms]  <<<  URB 165 coming back  <<< 
-- URB_FUNCTION_BULK_OR_INTERRUPT_TRANSFER:
  PipeHandle           = 866db8cc [endpoint 0x00000081]
  TransferFlags        = 00000003 (USBD_TRANSFER_DIRECTION_IN, USBD_SHORT_TRANSFER_OK)
  TransferBufferLength = 0000010e
  TransferBuffer       = 00000000
  TransferBufferMDL    = 86abce70
    00000000: 54 fd 64 01 40 24 64 00 80 0c d7 25 fe 00 2d 31
    00000010: 02 00 00 0f 6a ff 00 4f 1b ff 00 4f 10 ff 00 f0
    00000020: fc ee ee ee e0 e0 6a ff 00 4f 1b ff 00 4f 10 ff
    00000030: 00 f0 f9 ee ee ee e0 ee 0f ff f0 0e ff fd 0f f0
    00000040: ff f0 0c ff 00 00 46 ff 00 4f 0e ff f9 f0 00 0f
    00000050: ff 0f ff ff 0f 04 ff 00 4f 10 ff 00 f0 f9 ee ee
    00000060: ee e0 00 0f ff f0 0e ff fd 0f f0 ff f0 0b ff ff
    00000070: f0 f0 46 ff 00 4f 0e ff fa 0f ff f0 ff 0f ff f0
    00000080: 05 ff 00 4f 0c ff 00 f0 fd ff ff ff f0 03 ee e1
    00000090: ed 0f ff f0 f0 0f ff f0 f0 0f ff f0 00 ff ff 0f
    000000a0: ff f0 ff ff f0 ff f0 ff ff f0 00 ff ff 0f 00 0f
    000000b0: 03 ff 00 f0 46 ff 00 4f 10 ff f5 f0 ff 0f ff 0f
    000000c0: ff ff f0 00 ff ff 4f 0b ff fb f0 f0 f0 ff ff f0
    000000d0: 03 ee e1 dc 0f ff f0 0f f0 ff f0 0f ff ff 0f ff
    000000e0: 0f ff 0f ff f0 ff 0f f0 ff f0 ff ff 0f ff 0f ff
    000000f0: 00 ff f0 03 ff 00 f0 46 ff 00 4f 10 ff fd f0 ff
    00000100: 0f f0 f9 ff ff ff 0f ff 0f ff 4f 0c ff fc
  UrbLink              = 00000000
[108363 ms] UsbSnoop - FilterDispatchAny(f76d7fd2) : IRP_MJ_INTERNAL_DEVICE_CONTROL
[108363 ms] UsbSnoop - FdoHookDispatchInternalIoctl(f76d81ea) : fdo=861c0730, Irp=85a69b18, IRQL=0
[108363 ms]  >>>  URB 166 going down  >>> 
-- URB_FUNCTION_BULK_OR_INTERRUPT_TRANSFER:
  PipeHandle           = 866db8ec [endpoint 0x00000002]
  TransferFlags        = 00000002 (USBD_TRANSFER_DIRECTION_OUT, USBD_SHORT_TRANSFER_OK)
  TransferBufferLength = 00000012
  TransferBuffer       = 00000000
  TransferBufferMDL    = 85ae5cb0
    00000000: 54 fd 64 00 00 ff 64 01 40 24 0c 80 02 0a 2d 42
    00000010: 80 0c
  UrbLink              = 00000000
[108363 ms] UsbSnoop - MyInternalIOCTLCompletion(f76d8126) : fido=85e673d0, Irp=85a69b18, Context=85b8ca40, IRQL=2
[108363 ms]  <<<  URB 166 coming back  <<< 
-- URB_FUNCTION_BULK_OR_INTERRUPT_TRANSFER:
  PipeHandle           = 866db8ec [endpoint 0x00000002]
  TransferFlags        = 00000002 (USBD_TRANSFER_DIRECTION_OUT, USBD_SHORT_TRANSFER_OK)
  TransferBufferLength = 00000012
  TransferBuffer       = 00000000
  TransferBufferMDL    = 85ae5cb0
  UrbLink              = 00000000
[108364 ms] UsbSnoop - FilterDispatchAny(f76d7fd2) : IRP_MJ_INTERNAL_DEVICE_CONTROL
[108364 ms] UsbSnoop - FdoHookDispatchInternalIoctl(f76d81ea) : fdo=861c0730, Irp=85a32a50, IRQL=0
[108364 ms]  >>>  URB 167 going down  >>> 
-- URB_FUNCTION_BULK_OR_INTERRUPT_TRANSFER:
  PipeHandle           = 866db8cc [endpoint 0x00000081]
  TransferFlags        = 00000003 (USBD_TRANSFER_DIRECTION_IN, USBD_SHORT_TRANSFER_OK)
  TransferBufferLength = 00000200
  TransferBuffer       = 00000000
  TransferBufferMDL    = 86abce70
  UrbLink              = 00000000
[108367 ms] UsbSnoop - MyInternalIOCTLCompletion(f76d8126) : fido=85e673d0, Irp=85a32a50, Context=85b8ca40, IRQL=2
[108367 ms]  <<<  URB 167 coming back  <<< 
-- URB_FUNCTION_BULK_OR_INTERRUPT_TRANSFER:
  PipeHandle           = 866db8cc [endpoint 0x00000081]
  TransferFlags        = 00000003 (USBD_TRANSFER_DIRECTION_IN, USBD_SHORT_TRANSFER_OK)
  TransferBufferLength = 0000010e
  TransferBuffer       = 00000000
  TransferBufferMDL    = 86abce70
    00000000: 54 fd 64 01 40 24 64 00 80 0c c0 14 fe 00 2e 0a
    00000010: 02 00 0f ff ff f0 dd ee ee ee ed cc 0f ff f0 ff
    00000020: ff 0f f0 ff ff f0 ff ff f0 ff 0f ff f0 ff 0f f0
    00000030: ff f0 ff f0 ff ff f0 ff 0f ff f0 03 ff 00 f0 46
    00000040: ff 00 4f 10 ff f5 f0 ff 0f 0f ff ff f0 ff ff f0
    00000050: ff 4f 0c ff fc 00 0f ff ff f0 dd ee ee ee dc cc
    00000060: 0f ff f0 ff ff 0f f0 ff ff f0 ff ff f0 ff 0f ff
    00000070: f0 ff 0f f0 ff f0 ff f0 ff ff f0 ff 0f ff f0 03
    00000080: ff 00 f0 46 ff 00 4f 10 ff f5 0f ff 00 f0 ff ff
    00000090: f0 ff ff f0 ff 4f 0b ff d7 f0 f0 f0 ff ff f0 ee
    000000a0: ee ed cc cc 0f ff f0 ff ff 0f f0 ff ff f0 ff ff
    000000b0: f0 ff 0f ff f0 ff 0f f0 ff f0 ff f0 ff ff f0 ff
    000000c0: 0f ff f0 03 ff 00 f0 46 ff 00 4f 0f ff f4 f0 ff
    000000d0: ff 0f ff 0f ff f0 ff ff f0 ff 4f 0c ff 00 f0 d9
    000000e0: ff ff ff f0 ee ee dc cc cc 0f ff f0 ff ff 0f f0
    000000f0: ff ff f0 ff ff f0 ff 0f ff f0 ff 0f f0 ff f0 ff
    00000100: f0 ff ff f0 ff 0f ff f0 03 ff 00 f0 46 ff
  UrbLink              = 00000000
[108368 ms] UsbSnoop - FilterDispatchAny(f76d7fd2) : IRP_MJ_INTERNAL_DEVICE_CONTROL
[108368 ms] UsbSnoop - FdoHookDispatchInternalIoctl(f76d81ea) : fdo=861c0730, Irp=85a69b18, IRQL=0
[108368 ms]  >>>  URB 168 going down  >>> 
-- URB_FUNCTION_BULK_OR_INTERRUPT_TRANSFER:
  PipeHandle           = 866db8ec [endpoint 0x00000002]
  TransferFlags        = 00000002 (USBD_TRANSFER_DIRECTION_OUT, USBD_SHORT_TRANSFER_OK)
  TransferBufferLength = 00000012
  TransferBuffer       = 00000000
  TransferBufferMDL    = 85a4de68
    00000000: 54 fd 64 00 00 ff 64 01 40 24 0c 80 02 0a 2e 43
    00000010: 80 0c
  UrbLink              = 00000000
[108368 ms] UsbSnoop - MyInternalIOCTLCompletion(f76d8126) : fido=85e673d0, Irp=85a69b18, Context=85b8ca40, IRQL=2
[108368 ms]  <<<  URB 168 coming back  <<< 
-- URB_FUNCTION_BULK_OR_INTERRUPT_TRANSFER:
  PipeHandle           = 866db8ec [endpoint 0x00000002]
  TransferFlags        = 00000002 (USBD_TRANSFER_DIRECTION_OUT, USBD_SHORT_TRANSFER_OK)
  TransferBufferLength = 00000012
  TransferBuffer       = 00000000
  TransferBufferMDL    = 85a4de68
  UrbLink              = 00000000
[108369 ms] UsbSnoop - FilterDispatchAny(f76d7fd2) : IRP_MJ_INTERNAL_DEVICE_CONTROL
[108369 ms] UsbSnoop - FdoHookDispatchInternalIoctl(f76d81ea) : fdo=861c0730, Irp=85a69b18, IRQL=0
[108369 ms]  >>>  URB 169 going down  >>> 
-- URB_FUNCTION_BULK_OR_INTERRUPT_TRANSFER:
  PipeHandle           = 866db8cc [endpoint 0x00000081]
  TransferFlags        = 00000003 (USBD_TRANSFER_DIRECTION_IN, USBD_SHORT_TRANSFER_OK)
  TransferBufferLength = 00000200
  TransferBuffer       = 00000000
  TransferBufferMDL    = 85a329d0
  UrbLink              = 00000000
[108372 ms] UsbSnoop - MyInternalIOCTLCompletion(f76d8126) : fido=85e673d0, Irp=85a69b18, Context=85b8ca40, IRQL=2
[108373 ms]  <<<  URB 169 coming back  <<< 
-- URB_FUNCTION_BULK_OR_INTERRUPT_TRANSFER:
  PipeHandle           = 866db8cc [endpoint 0x00000081]
  TransferFlags        = 00000003 (USBD_TRANSFER_DIRECTION_IN, USBD_SHORT_TRANSFER_OK)
  TransferBufferLength = 0000010e
  TransferBuffer       = 00000000
  TransferBufferMDL    = 85a329d0
    00000000: 54 fd 64 01 40 24 64 00 80 0c d8 c6 fe 00 2f d5
    00000010: 02 00 4f 0f ff f4 0f ff ff 0f ff f0 ff f0 ff ff
    00000020: f0 ff 4f 10 ff fe f0 ee ed f7 cc cc cc 0f ff f0
    00000030: 0f f0 ff f0 e9 ff ff ff 0f ff 0f ff 0f ff 00 ff
    00000040: 0f f0 ff f0 ff ff 0f ff 0f ff 0f ff f0 03 ff 00
    00000050: f0 46 ff 00 4f 0e ff 00 f0 f4 ff ff ff 0f ff ff
    00000060: 0f ff 0f ff 0f ff 4f 10 ff fe f0 ee dc f7 cc cc
    00000070: cc 0f ff f0 f0 0f ff f0 e9 ff ff ff f0 00 ff ff
    00000080: f0 00 f0 ff 0f ff 0f ff 0f ff f0 00 ff ff 0f ff
    00000090: f0 03 ff 00 f0 46 ff 00 4f 0e ff f3 00 00 00 ff
    000000a0: 0f ff ff f0 ff f0 00 ff ff 4f 10 ff 00 f0 04 00
    000000b0: 00 0f 69 ff 00 4f 1b ff 00 4f 0f ff 00 fe 06 ee
    000000c0: 00 ef 68 ff 00 4f 1b ff 00 4f 0f ff 00 fe 06 ee
    000000d0: 00 ef 68 ff 00 4f 1b ff 00 4f 7f ff fe ff ff 4f
    000000e0: 1b ff 00 4f 7f ff fe ff ff 4f 1b ff 00 4f 0f ff
    000000f0: 00 fe 06 ee 00 ef 68 ff 00 4f 1b ff 00 4f 10 ff
    00000100: 00 f0 03 00 00 0f 6a ff 00 4f 1b ff 00 4f
  UrbLink              = 00000000
[108373 ms] UsbSnoop - FilterDispatchAny(f76d7fd2) : IRP_MJ_INTERNAL_DEVICE_CONTROL
[108373 ms] UsbSnoop - FdoHookDispatchInternalIoctl(f76d81ea) : fdo=861c0730, Irp=85a69b18, IRQL=0
[108373 ms]  >>>  URB 170 going down  >>> 
-- URB_FUNCTION_BULK_OR_INTERRUPT_TRANSFER:
  PipeHandle           = 866db8ec [endpoint 0x00000002]
  TransferFlags        = 00000002 (USBD_TRANSFER_DIRECTION_OUT, USBD_SHORT_TRANSFER_OK)
  TransferBufferLength = 00000012
  TransferBuffer       = 00000000
  TransferBufferMDL    = 86abce70
    00000000: 54 fd 64 00 00 ff 64 01 40 24 0c 80 02 0a 2f 44
    00000010: 80 0c
  UrbLink              = 00000000
[108373 ms] UsbSnoop - MyInternalIOCTLCompletion(f76d8126) : fido=85e673d0, Irp=85a69b18, Context=85b8ca40, IRQL=2
[108373 ms]  <<<  URB 170 coming back  <<< 
-- URB_FUNCTION_BULK_OR_INTERRUPT_TRANSFER:
  PipeHandle           = 866db8ec [endpoint 0x00000002]
  TransferFlags        = 00000002 (USBD_TRANSFER_DIRECTION_OUT, USBD_SHORT_TRANSFER_OK)
  TransferBufferLength = 00000012
  TransferBuffer       = 00000000
  TransferBufferMDL    = 86abce70
  UrbLink              = 00000000
[108374 ms] UsbSnoop - FilterDispatchAny(f76d7fd2) : IRP_MJ_INTERNAL_DEVICE_CONTROL
[108374 ms] UsbSnoop - FdoHookDispatchInternalIoctl(f76d81ea) : fdo=861c0730, Irp=85a32a50, IRQL=0
[108374 ms]  >>>  URB 171 going down  >>> 
-- URB_FUNCTION_BULK_OR_INTERRUPT_TRANSFER:
  PipeHandle           = 866db8cc [endpoint 0x00000081]
  TransferFlags        = 00000003 (USBD_TRANSFER_DIRECTION_IN, USBD_SHORT_TRANSFER_OK)
  TransferBufferLength = 00000200
  TransferBuffer       = 00000000
  TransferBufferMDL    = 85e5c788
  UrbLink              = 00000000
[108377 ms] UsbSnoop - MyInternalIOCTLCompletion(f76d8126) : fido=85e673d0, Irp=85a32a50, Context=85b8ca40, IRQL=2
[108377 ms]  <<<  URB 171 coming back  <<< 
-- URB_FUNCTION_BULK_OR_INTERRUPT_TRANSFER:
  PipeHandle           = 866db8cc [endpoint 0x00000081]
  TransferFlags        = 00000003 (USBD_TRANSFER_DIRECTION_IN, USBD_SHORT_TRANSFER_OK)
  TransferBufferLength = 0000010e
  TransferBuffer       = 00000000
  TransferBufferMDL    = 85e5c788
    00000000: 54 fd 64 01 40 24 64 00 80 0c 29 c1 fe 00 30 22
    00000010: 02 10 ff 00 f0 fc ee ee ee e0 e0 6a ff 00 4f 1b
    00000020: ff 00 4f 10 ff 00 f0 f7 ee ee ee e0 ee 0f ff ff
    00000030: f0 00 fd ff ff ff f0 1c ff 00 f0 16 ff 00 00 2b
    00000040: ff 00 4f 0e ff f9 f0 00 0f ff 0f ff ff 0f 04 ff
    00000050: 00 4f 10 ff 00 f0 f8 ee ee ee e0 00 0f ff ff 0f
    00000060: 03 ff 00 f0 1c ff 00 f0 15 ff ff f0 f0 2b ff 00
    00000070: 4f 0e ff fa 0f ff f0 ff 0f ff f0 05 ff 00 4f 10
    00000080: ff 00 f0 03 ee f9 ed 0f ff f0 00 0f f0 00 f9 ff
    00000090: ff ff 0f 00 ff ff 00 04 ff f0 00 ff ff f0 00 ff
    000000a0: ff 0f 00 0f ff 0f 00 0f ff f0 00 eb ff ff ff f0
    000000b0: 0f ff f0 0f ff f0 00 ff f0 f0 00 ff ff f0 0f ff
    000000c0: ff 00 fd ff ff ff f0 2b ff 00 4f 10 ff f5 f0 ff
    000000d0: 0f ff 0f ff ff f0 00 ff ff 4f 10 ff 00 f0 03 ee
    000000e0: f0 dc 0f ff ff 0f ff 0f ff 0f f0 ff 00 ff ff f0
    000000f0: ff 0f d2 ff ff ff f0 ff 0f ff 0f ff 0f ff 00 ff
    00000100: f0 ff 00 ff f0 ff 0f ff 0f f0 ff 0f f0 ff
  UrbLink              = 00000000
[108378 ms] UsbSnoop - FilterDispatchAny(f76d7fd2) : IRP_MJ_INTERNAL_DEVICE_CONTROL
[108378 ms] UsbSnoop - FdoHookDispatchInternalIoctl(f76d81ea) : fdo=861c0730, Irp=85a69b18, IRQL=0
[108378 ms]  >>>  URB 172 going down  >>> 
-- URB_FUNCTION_BULK_OR_INTERRUPT_TRANSFER:
  PipeHandle           = 866db8ec [endpoint 0x00000002]
  TransferFlags        = 00000002 (USBD_TRANSFER_DIRECTION_OUT, USBD_SHORT_TRANSFER_OK)
  TransferBufferLength = 00000012
  TransferBuffer       = 00000000
  TransferBufferMDL    = 85a4de68
    00000000: 54 fd 64 00 00 ff 64 01 40 24 0c 80 02 0a 30 45
    00000010: 80 0c
  UrbLink              = 00000000
[108378 ms] UsbSnoop - MyInternalIOCTLCompletion(f76d8126) : fido=85e673d0, Irp=85a69b18, Context=85b8ca40, IRQL=2
[108378 ms]  <<<  URB 172 coming back  <<< 
-- URB_FUNCTION_BULK_OR_INTERRUPT_TRANSFER:
  PipeHandle           = 866db8ec [endpoint 0x00000002]
  TransferFlags        = 00000002 (USBD_TRANSFER_DIRECTION_OUT, USBD_SHORT_TRANSFER_OK)
  TransferBufferLength = 00000012
  TransferBuffer       = 00000000
  TransferBufferMDL    = 85a4de68
  UrbLink              = 00000000
[108379 ms] UsbSnoop - FilterDispatchAny(f76d7fd2) : IRP_MJ_INTERNAL_DEVICE_CONTROL
[108379 ms] UsbSnoop - FdoHookDispatchInternalIoctl(f76d81ea) : fdo=861c0730, Irp=85a32a50, IRQL=0
[108379 ms]  >>>  URB 173 going down  >>> 
-- URB_FUNCTION_BULK_OR_INTERRUPT_TRANSFER:
  PipeHandle           = 866db8cc [endpoint 0x00000081]
  TransferFlags        = 00000003 (USBD_TRANSFER_DIRECTION_IN, USBD_SHORT_TRANSFER_OK)
  TransferBufferLength = 00000200
  TransferBuffer       = 00000000
  TransferBufferMDL    = 85e5c788
  UrbLink              = 00000000
[108382 ms] UsbSnoop - MyInternalIOCTLCompletion(f76d8126) : fido=85e673d0, Irp=85a32a50, Context=85b8ca40, IRQL=2
[108382 ms]  <<<  URB 173 coming back  <<< 
-- URB_FUNCTION_BULK_OR_INTERRUPT_TRANSFER:
  PipeHandle           = 866db8cc [endpoint 0x00000081]
  TransferFlags        = 00000003 (USBD_TRANSFER_DIRECTION_IN, USBD_SHORT_TRANSFER_OK)
  TransferBufferLength = 0000010e
  TransferBuffer       = 00000000
  TransferBufferMDL    = 85e5c788
    00000000: 54 fd 64 01 40 24 64 00 80 0c 20 cb fe 00 31 24
    00000010: 02 0f f0 ff 0f ff 0f f0 0f ff 0f ff 0f f0 ff f0
    00000020: ff 0f ff ff f0 2b ff 00 4f 10 ff fd f0 ff 0f f0
    00000030: f9 ff ff ff 0f ff 0f ff 4f 10 ff 00 f0 f8 ee ee
    00000040: ee ed cc 0f ff ff 0f f5 ff ff ff 0f f0 ff 0f ff
    00000050: ff 0f ff f0 ef ff ff ff 0f ff ff f0 ff ff f0 ff
    00000060: 0f ff f0 ff 0f ff f0 f7 ff ff ff 0f f0 ff 0f ff
    00000070: ff 0f 03 ff fb 0f f0 ff ff 0f f0 f8 ff ff ff 0f
    00000080: ff f0 ff ff f0 2b ff 00 4f 10 ff f5 f0 ff 0f 0f
    00000090: ff ff f0 ff ff f0 ff 4f 10 ff 00 f0 ef ee ee ee
    000000a0: dc cc 0f ff ff 0f ff f0 00 0f f0 ff 0f ff ff fe
    000000b0: 00 00 00 db ff ff ff 0f ff ff f0 ff ff f0 ff 0f
    000000c0: ff f0 ff 0f ff f0 ff f0 00 0f f0 ff f0 ff ff f0
    000000d0: ff ff f0 00 0f f0 ff ff 0f f0 fe ff ff ff fb 00
    000000e0: 00 00 ff ff f0 2b ff 00 4f 10 ff f5 0f ff 00 f0
    000000f0: ff ff f0 ff ff f0 ff 4f 10 ff ed f0 ee ee ed cc
    00000100: cc 0f ff ff 0f ff 0f ff 0f f0 ff 0f ff ff
  UrbLink              = 00000000
[108383 ms] UsbSnoop - FilterDispatchAny(f76d7fd2) : IRP_MJ_INTERNAL_DEVICE_CONTROL
[108383 ms] UsbSnoop - FdoHookDispatchInternalIoctl(f76d81ea) : fdo=861c0730, Irp=85a69b18, IRQL=0
[108383 ms]  >>>  URB 174 going down  >>> 
-- URB_FUNCTION_BULK_OR_INTERRUPT_TRANSFER:
  PipeHandle           = 866db8ec [endpoint 0x00000002]
  TransferFlags        = 00000002 (USBD_TRANSFER_DIRECTION_OUT, USBD_SHORT_TRANSFER_OK)
  TransferBufferLength = 00000012
  TransferBuffer       = 00000000
  TransferBufferMDL    = 86abce70
    00000000: 54 fd 64 00 00 ff 64 01 40 24 0c 80 02 0a 31 46
    00000010: 80 0c
  UrbLink              = 00000000
[108383 ms] UsbSnoop - MyInternalIOCTLCompletion(f76d8126) : fido=85e673d0, Irp=85a69b18, Context=85b8ca40, IRQL=2
[108383 ms]  <<<  URB 174 coming back  <<< 
-- URB_FUNCTION_BULK_OR_INTERRUPT_TRANSFER:
  PipeHandle           = 866db8ec [endpoint 0x00000002]
  TransferFlags        = 00000002 (USBD_TRANSFER_DIRECTION_OUT, USBD_SHORT_TRANSFER_OK)
  TransferBufferLength = 00000012
  TransferBuffer       = 00000000
  TransferBufferMDL    = 86abce70
  UrbLink              = 00000000
[108384 ms] UsbSnoop - FilterDispatchAny(f76d7fd2) : IRP_MJ_INTERNAL_DEVICE_CONTROL
[108384 ms] UsbSnoop - FdoHookDispatchInternalIoctl(f76d81ea) : fdo=861c0730, Irp=85a32a50, IRQL=0
[108384 ms]  >>>  URB 175 going down  >>> 
-- URB_FUNCTION_BULK_OR_INTERRUPT_TRANSFER:
  PipeHandle           = 866db8cc [endpoint 0x00000081]
  TransferFlags        = 00000003 (USBD_TRANSFER_DIRECTION_IN, USBD_SHORT_TRANSFER_OK)
  TransferBufferLength = 00000200
  TransferBuffer       = 00000000
  TransferBufferMDL    = 85e5c788
  UrbLink              = 00000000
[108387 ms] UsbSnoop - MyInternalIOCTLCompletion(f76d8126) : fido=85e673d0, Irp=85a32a50, Context=85b8ca40, IRQL=2
[108387 ms]  <<<  URB 175 coming back  <<< 
-- URB_FUNCTION_BULK_OR_INTERRUPT_TRANSFER:
  PipeHandle           = 866db8cc [endpoint 0x00000081]
  TransferFlags        = 00000003 (USBD_TRANSFER_DIRECTION_IN, USBD_SHORT_TRANSFER_OK)
  TransferBufferLength = 0000010e
  TransferBuffer       = 00000000
  TransferBufferMDL    = 85e5c788
    00000000: 54 fd 64 01 40 24 64 00 80 0c fc 95 fe 00 32 cb
    00000010: 02 0f 04 ff de 0f ff ff f0 ff ff f0 ff 0f ff f0
    00000020: ff 0f ff f0 ff 0f ff 0f f0 ff ff 0f ff ff 0f ff
    00000030: 0f ff 0f f0 ff ff 0f f0 fd ff ff ff 0f 03 ff 00
    00000040: f0 2b ff 00 4f 0f ff f4 f0 ff ff 0f ff 0f ff f0
    00000050: ff ff f0 ff 4f 10 ff ed f0 ee ee dc cc cc 0f ff
    00000060: ff 0f ff 0f ff 0f f0 ff 0f ff ff 0f 04 ff de 0f
    00000070: ff ff f0 ff ff f0 ff 0f ff f0 ff 0f ff f0 ff 0f
    00000080: ff 0f f0 ff ff f0 ff ff f0 ff 0f ff 0f f0 ff ff
    00000090: 0f f0 fd ff ff ff 0f 03 ff 00 f0 2b ff 00 4f 0f
    000000a0: ff f4 0f ff ff 0f ff f0 ff f0 ff ff f0 ff 4f 10
    000000b0: ff fe f0 ee ed ee cc cc cc 0f ff ff 0f ff 0f f0
    000000c0: 0f f0 ff 0f ff ff f0 ff f0 d2 ff ff ff f0 ff 0f
    000000d0: ff 0f ff 0f ff 0f ff f0 ff 0f ff f0 ff 0f f0 0f
    000000e0: f0 ff 0f f0 ff 0f f0 ff 0f f0 0f f0 ff ff 0f ff
    000000f0: 0f f0 ff f0 ff f0 ff ff f0 2b ff 00 4f 0e ff 00
    00000100: f0 f4 ff ff ff 0f ff ff 0f ff 0f ff 0f ff
  UrbLink              = 00000000
[108388 ms] UsbSnoop - FilterDispatchAny(f76d7fd2) : IRP_MJ_INTERNAL_DEVICE_CONTROL
[108388 ms] UsbSnoop - FdoHookDispatchInternalIoctl(f76d81ea) : fdo=861c0730, Irp=85a69b18, IRQL=0
[108388 ms]  >>>  URB 176 going down  >>> 
-- URB_FUNCTION_BULK_OR_INTERRUPT_TRANSFER:
  PipeHandle           = 866db8ec [endpoint 0x00000002]
  TransferFlags        = 00000002 (USBD_TRANSFER_DIRECTION_OUT, USBD_SHORT_TRANSFER_OK)
  TransferBufferLength = 00000012
  TransferBuffer       = 00000000
  TransferBufferMDL    = 85a4de68
    00000000: 54 fd 64 00 00 ff 64 01 40 24 0c 80 02 0a 32 47
    00000010: 80 0c
  UrbLink              = 00000000
[108388 ms] UsbSnoop - MyInternalIOCTLCompletion(f76d8126) : fido=85e673d0, Irp=85a69b18, Context=85b8ca40, IRQL=2
[108388 ms]  <<<  URB 176 coming back  <<< 
-- URB_FUNCTION_BULK_OR_INTERRUPT_TRANSFER:
  PipeHandle           = 866db8ec [endpoint 0x00000002]
  TransferFlags        = 00000002 (USBD_TRANSFER_DIRECTION_OUT, USBD_SHORT_TRANSFER_OK)
  TransferBufferLength = 00000012
  TransferBuffer       = 00000000
  TransferBufferMDL    = 85a4de68
  UrbLink              = 00000000
[108389 ms] UsbSnoop - FilterDispatchAny(f76d7fd2) : IRP_MJ_INTERNAL_DEVICE_CONTROL
[108389 ms] UsbSnoop - FdoHookDispatchInternalIoctl(f76d81ea) : fdo=861c0730, Irp=85a32a50, IRQL=0
[108389 ms]  >>>  URB 177 going down  >>> 
-- URB_FUNCTION_BULK_OR_INTERRUPT_TRANSFER:
  PipeHandle           = 866db8cc [endpoint 0x00000081]
  TransferFlags        = 00000003 (USBD_TRANSFER_DIRECTION_IN, USBD_SHORT_TRANSFER_OK)
  TransferBufferLength = 00000200
  TransferBuffer       = 00000000
  TransferBufferMDL    = 85e5c788
  UrbLink              = 00000000
[108392 ms] UsbSnoop - MyInternalIOCTLCompletion(f76d8126) : fido=85e673d0, Irp=85a32a50, Context=85b8ca40, IRQL=2
[108392 ms]  <<<  URB 177 coming back  <<< 
-- URB_FUNCTION_BULK_OR_INTERRUPT_TRANSFER:
  PipeHandle           = 866db8cc [endpoint 0x00000081]
  TransferFlags        = 00000003 (USBD_TRANSFER_DIRECTION_IN, USBD_SHORT_TRANSFER_OK)
  TransferBufferLength = 0000010e
  TransferBuffer       = 00000000
  TransferBufferMDL    = 85e5c788
    00000000: 54 fd 64 01 40 24 64 00 80 0c cf fd fe 00 33 07
    00000010: 02 4f 10 ff fe f0 ee dc f3 cc cc cc 0f ff ff 0f
    00000020: ff f0 0f 0f f0 ff 0f fc ff ff ff 00 0f 03 ff d6
    00000030: 00 ff ff f0 00 ff ff 0f ff f0 ff 0f ff f0 ff f0
    00000040: 0f 0f f0 ff f0 0f ff f0 0f ff f0 0f 0f f0 ff ff
    00000050: 0f ff f0 0f ff ff 00 0f ff ff f0 2b ff 00 4f 0e
    00000060: ff f3 00 00 00 ff 0f ff ff f0 ff f0 00 ff ff 4f
    00000070: 10 ff 00 f0 04 00 00 0f 69 ff 00 4f 1b ff 00 4f
    00000080: 0f ff 00 fe 06 ee 00 ef 68 ff 00 4f 1b ff 00 4f
    00000090: 0f ff 00 fe 06 ee 00 ef 68 ff 00 4f 1b ff 00 4f
    000000a0: 7f ff fe ff ff 4f 1b ff 00 4f 7f ff fe ff ff 4f
    000000b0: 1b ff 00 4f 7f ff fe ff ff 4f 1b ff 00 4f 7f ff
    000000c0: fe ff ff 4f 1b ff 00 4f 7f ff fe ff ff 4f 1b ff
    000000d0: 00 4f 7f ff fe ff ff 4f 1b ff 00 4f 7f ff fe ff
    000000e0: ff 4f 1b ff 00 4f 7f ff fe ff ff 4f 1b ff 00 4f
    000000f0: 7f ff fe ff ff 4f 1b ff 00 4f 7f ff fe ff ff 4f
    00000100: 1b ff 00 4f 7f ff fe ff ff 4f 1b ff 00 4f
  UrbLink              = 00000000
[108393 ms] UsbSnoop - FilterDispatchAny(f76d7fd2) : IRP_MJ_INTERNAL_DEVICE_CONTROL
[108393 ms] UsbSnoop - FdoHookDispatchInternalIoctl(f76d81ea) : fdo=861c0730, Irp=85a69b18, IRQL=0
[108393 ms]  >>>  URB 178 going down  >>> 
-- URB_FUNCTION_BULK_OR_INTERRUPT_TRANSFER:
  PipeHandle           = 866db8ec [endpoint 0x00000002]
  TransferFlags        = 00000002 (USBD_TRANSFER_DIRECTION_OUT, USBD_SHORT_TRANSFER_OK)
  TransferBufferLength = 00000012
  TransferBuffer       = 00000000
  TransferBufferMDL    = 86abce70
    00000000: 54 fd 64 00 00 ff 64 01 40 24 0c 80 02 0a 33 48
    00000010: 80 0c
  UrbLink              = 00000000
[108393 ms] UsbSnoop - MyInternalIOCTLCompletion(f76d8126) : fido=85e673d0, Irp=85a69b18, Context=85b8ca40, IRQL=2
[108393 ms]  <<<  URB 178 coming back  <<< 
-- URB_FUNCTION_BULK_OR_INTERRUPT_TRANSFER:
  PipeHandle           = 866db8ec [endpoint 0x00000002]
  TransferFlags        = 00000002 (USBD_TRANSFER_DIRECTION_OUT, USBD_SHORT_TRANSFER_OK)
  TransferBufferLength = 00000012
  TransferBuffer       = 00000000
  TransferBufferMDL    = 86abce70
  UrbLink              = 00000000
[108394 ms] UsbSnoop - FilterDispatchAny(f76d7fd2) : IRP_MJ_INTERNAL_DEVICE_CONTROL
[108394 ms] UsbSnoop - FdoHookDispatchInternalIoctl(f76d81ea) : fdo=861c0730, Irp=85a32a50, IRQL=0
[108394 ms]  >>>  URB 179 going down  >>> 
-- URB_FUNCTION_BULK_OR_INTERRUPT_TRANSFER:
  PipeHandle           = 866db8cc [endpoint 0x00000081]
  TransferFlags        = 00000003 (USBD_TRANSFER_DIRECTION_IN, USBD_SHORT_TRANSFER_OK)
  TransferBufferLength = 00000200
  TransferBuffer       = 00000000
  TransferBufferMDL    = 85e5c788
  UrbLink              = 00000000
[108397 ms] UsbSnoop - MyInternalIOCTLCompletion(f76d8126) : fido=85e673d0, Irp=85a32a50, Context=85b8ca40, IRQL=2
[108397 ms]  <<<  URB 179 coming back  <<< 
-- URB_FUNCTION_BULK_OR_INTERRUPT_TRANSFER:
  PipeHandle           = 866db8cc [endpoint 0x00000081]
  TransferFlags        = 00000003 (USBD_TRANSFER_DIRECTION_IN, USBD_SHORT_TRANSFER_OK)
  TransferBufferLength = 0000010e
  TransferBuffer       = 00000000
  TransferBufferMDL    = 85e5c788
    00000000: 54 fd 64 01 40 24 64 00 80 0c a1 00 fe 00 34 dd
    00000010: 02 7f ff fe ff ff 4f 1b ff 00 4f 7f ff fe ff ff
    00000020: 4f 1b ff 00 4f 7f ff fe ff ff 4f 1b ff 00 4f 7f
    00000030: ff fe ff ff 4f 1b ff 00 4f 7f ff fe ff ff 4f 1b
    00000040: ff 00 4f 7f ff fe ff ff 4f 1b ff 00 4f 7f ff fe
    00000050: ff ff 4f 1b ff 00 4f 7f ff fe ff ff 4f 1b ff 00
    00000060: 4f 7f ff fe ff ff 4f 1b ff 00 4f 7f ff fe ff ff
    00000070: 4f 1b ff 00 4f 7f ff fe ff ff 4f 1b ff 00 4f 7f
    00000080: ff fe ff ff 4f 1b ff 00 4f 7f ff fe ff ff 4f 1b
    00000090: ff 00 4f 7f ff fe ff ff 4f 1b ff 00 4f 7f ff fe
    000000a0: ff ff 4f 1b ff 00 4f 7f ff fe ff ff 4f 1b ff 00
    000000b0: 4f 7f ff fe ff ff 4f 1b ff 00 4f 7f ff fe ff ff
    000000c0: 4f 1b ff 00 4f 7f ff fe ff ff 4f 1b ff 00 4f 7f
    000000d0: ff fe ff ff 4f 1b ff 00 4f 7f ff fe ff ff 4f 1b
    000000e0: ff 00 4f 7f ff fe ff ff 4f 1b ff 00 4f 7f ff fe
    000000f0: ff ff 4f 1b ff 00 4f 7f ff fe ff ff 4f 1b ff 00
    00000100: 4f 7f ff fe ff ff 4f 1b ff 00 4f 7f ff fe
  UrbLink              = 00000000
[108398 ms] UsbSnoop - FilterDispatchAny(f76d7fd2) : IRP_MJ_INTERNAL_DEVICE_CONTROL
[108398 ms] UsbSnoop - FdoHookDispatchInternalIoctl(f76d81ea) : fdo=861c0730, Irp=85a69b18, IRQL=0
[108398 ms]  >>>  URB 180 going down  >>> 
-- URB_FUNCTION_BULK_OR_INTERRUPT_TRANSFER:
  PipeHandle           = 866db8ec [endpoint 0x00000002]
  TransferFlags        = 00000002 (USBD_TRANSFER_DIRECTION_OUT, USBD_SHORT_TRANSFER_OK)
  TransferBufferLength = 00000012
  TransferBuffer       = 00000000
  TransferBufferMDL    = 85a4de68
    00000000: 54 fd 64 00 00 ff 64 01 40 24 0c 80 02 0a 34 49
    00000010: 80 0c
  UrbLink              = 00000000
[108398 ms] UsbSnoop - MyInternalIOCTLCompletion(f76d8126) : fido=85e673d0, Irp=85a69b18, Context=85b8ca40, IRQL=2
[108398 ms]  <<<  URB 180 coming back  <<< 
-- URB_FUNCTION_BULK_OR_INTERRUPT_TRANSFER:
  PipeHandle           = 866db8ec [endpoint 0x00000002]
  TransferFlags        = 00000002 (USBD_TRANSFER_DIRECTION_OUT, USBD_SHORT_TRANSFER_OK)
  TransferBufferLength = 00000012
  TransferBuffer       = 00000000
  TransferBufferMDL    = 85a4de68
  UrbLink              = 00000000
[108399 ms] UsbSnoop - FilterDispatchAny(f76d7fd2) : IRP_MJ_INTERNAL_DEVICE_CONTROL
[108399 ms] UsbSnoop - FdoHookDispatchInternalIoctl(f76d81ea) : fdo=861c0730, Irp=85a32a50, IRQL=0
[108399 ms]  >>>  URB 181 going down  >>> 
-- URB_FUNCTION_BULK_OR_INTERRUPT_TRANSFER:
  PipeHandle           = 866db8cc [endpoint 0x00000081]
  TransferFlags        = 00000003 (USBD_TRANSFER_DIRECTION_IN, USBD_SHORT_TRANSFER_OK)
  TransferBufferLength = 00000200
  TransferBuffer       = 00000000
  TransferBufferMDL    = 85e5c788
  UrbLink              = 00000000
[108402 ms] UsbSnoop - MyInternalIOCTLCompletion(f76d8126) : fido=85e673d0, Irp=85a32a50, Context=85b8ca40, IRQL=2
[108403 ms]  <<<  URB 181 coming back  <<< 
-- URB_FUNCTION_BULK_OR_INTERRUPT_TRANSFER:
  PipeHandle           = 866db8cc [endpoint 0x00000081]
  TransferFlags        = 00000003 (USBD_TRANSFER_DIRECTION_IN, USBD_SHORT_TRANSFER_OK)
  TransferBufferLength = 0000010e
  TransferBuffer       = 00000000
  TransferBufferMDL    = 85e5c788
    00000000: 54 fd 64 01 40 24 64 00 80 0c cd d6 fe 00 35 e0
    00000010: 02 ff ff 4f 1b ff 00 4f 7f ff fe ff ff 4f 1b ff
    00000020: 00 4f 7f ff fe ff ff 4f 1b ff 00 4f 7f ff fe ff
    00000030: ff 4f 1b ff 00 4f 7f ff fe ff ff 4f 1b ff 00 4f
    00000040: 7f ff fe ff ff 4f 1b ff 00 4f 7f ff fe ff ff 4f
    00000050: 1b ff 00 4f 7f ff fe ff ff 4f 1b ff 00 4f 7f ff
    00000060: fe ff ff 4f 1b ff 00 4f 7f ff fe ff ff 4f 1b ff
    00000070: 00 4f 7f ff fe ff ff 4f 1b ff 00 4f 7f ff fe ff
    00000080: ff 4f 1b ff 00 4f 7f ff fe ff ff 4f 1b ff 00 4f
    00000090: 7f ff fe ff ff 4f 1b ff 00 4f 7f ff fe ff ff 4f
    000000a0: 1b ff 00 4f 7f ff fe ff ff 4f 1b ff 00 4f 7f ff
    000000b0: fe ff ff 4f 1b ff 00 4f 7f ff fe ff ff 4f 1b ff
    000000c0: 00 4f 7f ff fe ff ff 4f 1b ff 00 4f 7f ff fe ff
    000000d0: ff 4f 1b ff 00 4f 7f ff fe ff ff 4f 1b ff 00 4f
    000000e0: 7f ff fe ff ff 4f 1b ff 00 4f 7f ff fe ff ff 4f
    000000f0: 1b ff 00 4f 7f ff fe ff ff 4f 1b ff 00 4f 7f ff
    00000100: fe ff ff 4f 1b ff 00 4f 7f ff fe ff ff 4f
  UrbLink              = 00000000
[108403 ms] UsbSnoop - FilterDispatchAny(f76d7fd2) : IRP_MJ_INTERNAL_DEVICE_CONTROL
[108403 ms] UsbSnoop - FdoHookDispatchInternalIoctl(f76d81ea) : fdo=861c0730, Irp=85a32a50, IRQL=0
[108403 ms]  >>>  URB 182 going down  >>> 
-- URB_FUNCTION_BULK_OR_INTERRUPT_TRANSFER:
  PipeHandle           = 866db8ec [endpoint 0x00000002]
  TransferFlags        = 00000002 (USBD_TRANSFER_DIRECTION_OUT, USBD_SHORT_TRANSFER_OK)
  TransferBufferLength = 00000012
  TransferBuffer       = 00000000
  TransferBufferMDL    = 86a6e4f0
    00000000: 54 fd 64 00 00 ff 64 01 40 24 0c 80 02 0a 35 4a
    00000010: 80 0c
  UrbLink              = 00000000
[108403 ms] UsbSnoop - MyInternalIOCTLCompletion(f76d8126) : fido=85e673d0, Irp=85a32a50, Context=85b8ca40, IRQL=2
[108403 ms]  <<<  URB 182 coming back  <<< 
-- URB_FUNCTION_BULK_OR_INTERRUPT_TRANSFER:
  PipeHandle           = 866db8ec [endpoint 0x00000002]
  TransferFlags        = 00000002 (USBD_TRANSFER_DIRECTION_OUT, USBD_SHORT_TRANSFER_OK)
  TransferBufferLength = 00000012
  TransferBuffer       = 00000000
  TransferBufferMDL    = 86a6e4f0
  UrbLink              = 00000000
[108404 ms] UsbSnoop - FilterDispatchAny(f76d7fd2) : IRP_MJ_INTERNAL_DEVICE_CONTROL
[108404 ms] UsbSnoop - FdoHookDispatchInternalIoctl(f76d81ea) : fdo=861c0730, Irp=85a32a50, IRQL=0
[108404 ms]  >>>  URB 183 going down  >>> 
-- URB_FUNCTION_BULK_OR_INTERRUPT_TRANSFER:
  PipeHandle           = 866db8cc [endpoint 0x00000081]
  TransferFlags        = 00000003 (USBD_TRANSFER_DIRECTION_IN, USBD_SHORT_TRANSFER_OK)
  TransferBufferLength = 00000200
  TransferBuffer       = 00000000
  TransferBufferMDL    = 86336228
  UrbLink              = 00000000
[108406 ms] UsbSnoop - MyInternalIOCTLCompletion(f76d8126) : fido=85e673d0, Irp=85a32a50, Context=85b8ca40, IRQL=2
[108406 ms]  <<<  URB 183 coming back  <<< 
-- URB_FUNCTION_BULK_OR_INTERRUPT_TRANSFER:
  PipeHandle           = 866db8cc [endpoint 0x00000081]
  TransferFlags        = 00000003 (USBD_TRANSFER_DIRECTION_IN, USBD_SHORT_TRANSFER_OK)
  TransferBufferLength = 000000a3
  TransferBuffer       = 00000000
  TransferBufferMDL    = 86336228
    00000000: 54 fd 64 01 40 24 64 00 80 0c fc b8 93 00 36 87
    00000010: 02 1b ff 00 4f 7f ff fe ff ff 4f 1b ff 00 4f 7f
    00000020: ff fe ff ff 4f 1b ff 00 4f 7f ff fe ff ff 4f 1b
    00000030: ff 00 4f 7f ff fe ff ff 4f 1b ff 00 4f 7f ff fe
    00000040: ff ff 4f 1b ff 00 4f 7f ff fe ff ff 4f 1b ff 00
    00000050: 4f 7f ff fe ff ff 4f 1b ff 00 4f 7f ff fe ff ff
    00000060: 4f 1b ff 00 4f 7f ff fe ff ff 4f 1b ff 00 4f 7f
    00000070: ff fe ff ff 4f 1b ff 00 4f 7f ff fe ff ff 4f 1b
    00000080: ff 00 4f 7f ff fe ff ff 4f 1b ff 00 4f 7f ff fe
    00000090: ff ff 4f 1b ff 00 4f 7f ff fe ff ff 4f 1b ff 00
    000000a0: 4f 05 ff
  UrbLink              = 00000000
[108407 ms] UsbSnoop - FilterDispatchAny(f76d7fd2) : IRP_MJ_INTERNAL_DEVICE_CONTROL
[108407 ms] UsbSnoop - FdoHookDispatchInternalIoctl(f76d81ea) : fdo=861c0730, Irp=85a69b18, IRQL=0
[108407 ms]  >>>  URB 184 going down  >>> 
-- URB_FUNCTION_BULK_OR_INTERRUPT_TRANSFER:
  PipeHandle           = 866db8ec [endpoint 0x00000002]
  TransferFlags        = 00000002 (USBD_TRANSFER_DIRECTION_OUT, USBD_SHORT_TRANSFER_OK)
  TransferBufferLength = 00000012
  TransferBuffer       = 00000000
  TransferBufferMDL    = 85a4de68
    00000000: 54 fd 64 00 00 ff 64 01 40 24 0c 80 02 0a 36 4b
    00000010: 80 0c
  UrbLink              = 00000000
[108407 ms] UsbSnoop - MyInternalIOCTLCompletion(f76d8126) : fido=85e673d0, Irp=85a69b18, Context=85b8ca40, IRQL=2
[108407 ms]  <<<  URB 184 coming back  <<< 
-- URB_FUNCTION_BULK_OR_INTERRUPT_TRANSFER:
  PipeHandle           = 866db8ec [endpoint 0x00000002]
  TransferFlags        = 00000002 (USBD_TRANSFER_DIRECTION_OUT, USBD_SHORT_TRANSFER_OK)
  TransferBufferLength = 00000012
  TransferBuffer       = 00000000
  TransferBufferMDL    = 85a4de68
  UrbLink              = 00000000
[108408 ms] UsbSnoop - FilterDispatchAny(f76d7fd2) : IRP_MJ_INTERNAL_DEVICE_CONTROL
[108408 ms] UsbSnoop - FdoHookDispatchInternalIoctl(f76d81ea) : fdo=861c0730, Irp=85a32a50, IRQL=0
[108408 ms]  >>>  URB 185 going down  >>> 
-- URB_FUNCTION_BULK_OR_INTERRUPT_TRANSFER:
  PipeHandle           = 866db8cc [endpoint 0x00000081]
  TransferFlags        = 00000003 (USBD_TRANSFER_DIRECTION_IN, USBD_SHORT_TRANSFER_OK)
  TransferBufferLength = 00000200
  TransferBuffer       = 00000000
  TransferBufferMDL    = 86336228
  UrbLink              = 00000000
[108408 ms] UsbSnoop - FilterDispatchAny(f76d7fd2) : IRP_MJ_INTERNAL_DEVICE_CONTROL
[108408 ms] UsbSnoop - FdoHookDispatchInternalIoctl(f76d81ea) : fdo=861c0730, Irp=85a71af0, IRQL=0
[108408 ms]  >>>  URB 186 going down  >>> 
-- URB_FUNCTION_BULK_OR_INTERRUPT_TRANSFER:
  PipeHandle           = 866db8ec [endpoint 0x00000002]
  TransferFlags        = 00000002 (USBD_TRANSFER_DIRECTION_OUT, USBD_SHORT_TRANSFER_OK)
  TransferBufferLength = 00000012
  TransferBuffer       = 00000000
  TransferBufferMDL    = 86718760
    00000000: 54 fd 64 00 40 de 64 01 40 24 0c 80 02 00 23 4d
    00000010: 80 0c
  UrbLink              = 00000000
[108408 ms] UsbSnoop - MyInternalIOCTLCompletion(f76d8126) : fido=85e673d0, Irp=85a71af0, Context=86a80f80, IRQL=2
[108408 ms]  <<<  URB 186 coming back  <<< 
-- URB_FUNCTION_BULK_OR_INTERRUPT_TRANSFER:
  PipeHandle           = 866db8ec [endpoint 0x00000002]
  TransferFlags        = 00000002 (USBD_TRANSFER_DIRECTION_OUT, USBD_SHORT_TRANSFER_OK)
  TransferBufferLength = 00000012
  TransferBuffer       = 00000000
  TransferBufferMDL    = 86718760
  UrbLink              = 00000000
[108410 ms] UsbSnoop - MyInternalIOCTLCompletion(f76d8126) : fido=85e673d0, Irp=85a32a50, Context=85b8ca40, IRQL=2
[108410 ms]  <<<  URB 185 coming back  <<< 
-- URB_FUNCTION_BULK_OR_INTERRUPT_TRANSFER:
  PipeHandle           = 866db8cc [endpoint 0x00000081]
  TransferFlags        = 00000003 (USBD_TRANSFER_DIRECTION_IN, USBD_SHORT_TRANSFER_OK)
  TransferBufferLength = 00000012
  TransferBuffer       = 00000000
  TransferBufferMDL    = 86336228
    00000000: 54 fd 64 01 00 ff 64 00 80 0c 24 40 02 0a 23 38
    00000010: 40 24
  UrbLink              = 00000000
[108411 ms] UsbSnoop - FilterDispatchAny(f76d7fd2) : IRP_MJ_INTERNAL_DEVICE_CONTROL
[108411 ms] UsbSnoop - FdoHookDispatchInternalIoctl(f76d81ea) : fdo=861c0730, Irp=85a32a50, IRQL=0
[108411 ms]  >>>  URB 187 going down  >>> 
-- URB_FUNCTION_BULK_OR_INTERRUPT_TRANSFER:
  PipeHandle           = 866db8cc [endpoint 0x00000081]
  TransferFlags        = 00000003 (USBD_TRANSFER_DIRECTION_IN, USBD_SHORT_TRANSFER_OK)
  TransferBufferLength = 00000200
  TransferBuffer       = 00000000
  TransferBufferMDL    = 86718760
  UrbLink              = 00000000
[108528 ms] UsbSnoop - FilterDispatchAny(f76d7fd2) : IRP_MJ_INTERNAL_DEVICE_CONTROL
[108528 ms] UsbSnoop - FdoHookDispatchInternalIoctl(f76d81ea) : fdo=861c0730, Irp=85a69b18, IRQL=0
[108528 ms]  >>>  URB 188 going down  >>> 
-- URB_FUNCTION_BULK_OR_INTERRUPT_TRANSFER:
  PipeHandle           = 866db8ec [endpoint 0x00000002]
  TransferFlags        = 00000002 (USBD_TRANSFER_DIRECTION_OUT, USBD_SHORT_TRANSFER_OK)
  TransferBufferLength = 00000011
  TransferBuffer       = 00000000
  TransferBufferMDL    = 86544868
    00000000: 54 fd 64 00 80 0e 64 01 40 20 01 00 01 00 24 2e
    00000010: 01
  UrbLink              = 00000000
[108529 ms] UsbSnoop - MyInternalIOCTLCompletion(f76d8126) : fido=85e673d0, Irp=85a69b18, Context=86a80f80, IRQL=2
[108529 ms]  <<<  URB 188 coming back  <<< 
-- URB_FUNCTION_BULK_OR_INTERRUPT_TRANSFER:
  PipeHandle           = 866db8ec [endpoint 0x00000002]
  TransferFlags        = 00000002 (USBD_TRANSFER_DIRECTION_OUT, USBD_SHORT_TRANSFER_OK)
  TransferBufferLength = 00000011
  TransferBuffer       = 00000000
  TransferBufferMDL    = 86544868
  UrbLink              = 00000000
[108529 ms] UsbSnoop - MyInternalIOCTLCompletion(f76d8126) : fido=85e673d0, Irp=85a32a50, Context=85b8ca40, IRQL=2
[108529 ms]  <<<  URB 187 coming back  <<< 
-- URB_FUNCTION_BULK_OR_INTERRUPT_TRANSFER:
  PipeHandle           = 866db8cc [endpoint 0x00000081]
  TransferFlags        = 00000003 (USBD_TRANSFER_DIRECTION_IN, USBD_SHORT_TRANSFER_OK)
  TransferBufferLength = 00000012
  TransferBuffer       = 00000000
  TransferBufferMDL    = 86718760
    00000000: 54 fd 64 01 00 ff 64 00 80 0e 20 40 02 0a 24 37
    00000010: 40 20
  UrbLink              = 00000000
[108530 ms] UsbSnoop - FilterDispatchAny(f76d7fd2) : IRP_MJ_INTERNAL_DEVICE_CONTROL
[108530 ms] UsbSnoop - FdoHookDispatchInternalIoctl(f76d81ea) : fdo=861c0730, Irp=85a69b18, IRQL=0
[108530 ms]  >>>  URB 189 going down  >>> 
-- URB_FUNCTION_BULK_OR_INTERRUPT_TRANSFER:
  PipeHandle           = 866db8cc [endpoint 0x00000081]
  TransferFlags        = 00000003 (USBD_TRANSFER_DIRECTION_IN, USBD_SHORT_TRANSFER_OK)
  TransferBufferLength = 00000200
  TransferBuffer       = 00000000
  TransferBufferMDL    = 85ae5cb0
  UrbLink              = 00000000
[108541 ms] UsbSnoop - MyInternalIOCTLCompletion(f76d8126) : fido=85e673d0, Irp=85a69b18, Context=85b8ca40, IRQL=2
[108542 ms]  <<<  URB 189 coming back  <<< 
-- URB_FUNCTION_BULK_OR_INTERRUPT_TRANSFER:
  PipeHandle           = 866db8cc [endpoint 0x00000081]
  TransferFlags        = 00000003 (USBD_TRANSFER_DIRECTION_IN, USBD_SHORT_TRANSFER_OK)
  TransferBufferLength = 0000007f
  TransferBuffer       = 00000000
  TransferBufferMDL    = 85ae5cb0
    00000000: 54 fd 64 01 40 20 64 00 80 0e 78 48 6f 00 37 6e
    00000010: 01 00 00 00 00 01 65 42 00 00 00 00 00 01 be 00
    00000020: 00 00 00 00 00 01 4f a7 88 00 00 00 00 01 83 5f
    00000030: 2c 7f 00 00 5a 01 01 24 25 01 01 22 d4 01 01 23
    00000040: 15 00 00 00 00 00 02 00 00 00 00 01 40 00 f0 04
    00000050: 00 1e 30 30 30 30 34 42 43 31 42 31 30 45 35 37
    00000060: 30 46 00 30 45 30 30 30 30 30 34 42 43 31 42 31
    00000070: 30 45 35 37 30 46 43 42 32 38 30 34 46 31 00
  UrbLink              = 00000000
[108542 ms] UsbSnoop - FilterDispatchAny(f76d7fd2) : IRP_MJ_INTERNAL_DEVICE_CONTROL
[108542 ms] UsbSnoop - FdoHookDispatchInternalIoctl(f76d81ea) : fdo=861c0730, Irp=85a69b18, IRQL=0
[108542 ms]  >>>  URB 190 going down  >>> 
-- URB_FUNCTION_BULK_OR_INTERRUPT_TRANSFER:
  PipeHandle           = 866db8ec [endpoint 0x00000002]
  TransferFlags        = 00000002 (USBD_TRANSFER_DIRECTION_OUT, USBD_SHORT_TRANSFER_OK)
  TransferBufferLength = 00000012
  TransferBuffer       = 00000000
  TransferBufferMDL    = 85a309b8
    00000000: 54 fd 64 00 00 ff 64 01 40 20 0e 80 02 0a 37 4a
    00000010: 80 0e
  UrbLink              = 00000000
[108542 ms] UsbSnoop - MyInternalIOCTLCompletion(f76d8126) : fido=85e673d0, Irp=85a69b18, Context=85b8ca40, IRQL=2
[108542 ms]  <<<  URB 190 coming back  <<< 
-- URB_FUNCTION_BULK_OR_INTERRUPT_TRANSFER:
  PipeHandle           = 866db8ec [endpoint 0x00000002]
  TransferFlags        = 00000002 (USBD_TRANSFER_DIRECTION_OUT, USBD_SHORT_TRANSFER_OK)
  TransferBufferLength = 00000012
  TransferBuffer       = 00000000
  TransferBufferMDL    = 85a309b8
  UrbLink              = 00000000
[108543 ms] UsbSnoop - FilterDispatchAny(f76d7fd2) : IRP_MJ_INTERNAL_DEVICE_CONTROL
[108543 ms] UsbSnoop - FdoHookDispatchInternalIoctl(f76d81ea) : fdo=861c0730, Irp=85a69b18, IRQL=0
[108543 ms]  >>>  URB 191 going down  >>> 
-- URB_FUNCTION_BULK_OR_INTERRUPT_TRANSFER:
  PipeHandle           = 866db8cc [endpoint 0x00000081]
  TransferFlags        = 00000003 (USBD_TRANSFER_DIRECTION_IN, USBD_SHORT_TRANSFER_OK)
  TransferBufferLength = 00000200
  TransferBuffer       = 00000000
  TransferBufferMDL    = 85a309b8
  UrbLink              = 00000000
[108543 ms] UsbSnoop - FilterDispatchAny(f76d7fd2) : IRP_MJ_INTERNAL_DEVICE_CONTROL
[108543 ms] UsbSnoop - FdoHookDispatchInternalIoctl(f76d81ea) : fdo=861c0730, Irp=85a71af0, IRQL=0
[108543 ms]  >>>  URB 192 going down  >>> 
-- URB_FUNCTION_BULK_OR_INTERRUPT_TRANSFER:
  PipeHandle           = 866db8ec [endpoint 0x00000002]
  TransferFlags        = 00000002 (USBD_TRANSFER_DIRECTION_OUT, USBD_SHORT_TRANSFER_OK)
  TransferBufferLength = 00000011
  TransferBuffer       = 00000000
  TransferBufferMDL    = 85b0ba48
    00000000: 54 fd 64 00 80 0e 64 01 40 20 02 00 01 00 25 30
    00000010: 02
  UrbLink              = 00000000
[108543 ms] UsbSnoop - MyInternalIOCTLCompletion(f76d8126) : fido=85e673d0, Irp=85a71af0, Context=86a80f80, IRQL=2
[108544 ms]  <<<  URB 192 coming back  <<< 
-- URB_FUNCTION_BULK_OR_INTERRUPT_TRANSFER:
  PipeHandle           = 866db8ec [endpoint 0x00000002]
  TransferFlags        = 00000002 (USBD_TRANSFER_DIRECTION_OUT, USBD_SHORT_TRANSFER_OK)
  TransferBufferLength = 00000011
  TransferBuffer       = 00000000
  TransferBufferMDL    = 85b0ba48
  UrbLink              = 00000000
[108545 ms] UsbSnoop - MyInternalIOCTLCompletion(f76d8126) : fido=85e673d0, Irp=85a69b18, Context=85b8ca40, IRQL=2
[108545 ms]  <<<  URB 191 coming back  <<< 
-- URB_FUNCTION_BULK_OR_INTERRUPT_TRANSFER:
  PipeHandle           = 866db8cc [endpoint 0x00000081]
  TransferFlags        = 00000003 (USBD_TRANSFER_DIRECTION_IN, USBD_SHORT_TRANSFER_OK)
  TransferBufferLength = 00000012
  TransferBuffer       = 00000000
  TransferBufferMDL    = 85a309b8
    00000000: 54 fd 64 01 00 ff 64 00 80 0e 20 40 02 0a 25 38
    00000010: 40 20
  UrbLink              = 00000000
[108546 ms] UsbSnoop - FilterDispatchAny(f76d7fd2) : IRP_MJ_INTERNAL_DEVICE_CONTROL
[108546 ms] UsbSnoop - FdoHookDispatchInternalIoctl(f76d81ea) : fdo=861c0730, Irp=85a71af0, IRQL=0
[108546 ms]  >>>  URB 193 going down  >>> 
-- URB_FUNCTION_BULK_OR_INTERRUPT_TRANSFER:
  PipeHandle           = 866db8cc [endpoint 0x00000081]
  TransferFlags        = 00000003 (USBD_TRANSFER_DIRECTION_IN, USBD_SHORT_TRANSFER_OK)
  TransferBufferLength = 00000200
  TransferBuffer       = 00000000
  TransferBufferMDL    = 85ae5cb0
  UrbLink              = 00000000
[108549 ms] UsbSnoop - MyInternalIOCTLCompletion(f76d8126) : fido=85e673d0, Irp=85a71af0, Context=85b8ca40, IRQL=2
[108550 ms]  <<<  URB 193 coming back  <<< 
-- URB_FUNCTION_BULK_OR_INTERRUPT_TRANSFER:
  PipeHandle           = 866db8cc [endpoint 0x00000081]
  TransferFlags        = 00000003 (USBD_TRANSFER_DIRECTION_IN, USBD_SHORT_TRANSFER_OK)
  TransferBufferLength = 0000001b
  TransferBuffer       = 00000000
  TransferBufferMDL    = 85ae5cb0
    00000000: 54 fd 64 01 40 20 64 00 80 0e 38 5a 0b 00 38 dd
    00000010: 02 54 49 2d 4e 73 70 69 72 65 00
  UrbLink              = 00000000
[108550 ms] UsbSnoop - FilterDispatchAny(f76d7fd2) : IRP_MJ_INTERNAL_DEVICE_CONTROL
[108550 ms] UsbSnoop - FdoHookDispatchInternalIoctl(f76d81ea) : fdo=861c0730, Irp=85a71af0, IRQL=0
[108550 ms]  >>>  URB 194 going down  >>> 
-- URB_FUNCTION_BULK_OR_INTERRUPT_TRANSFER:
  PipeHandle           = 866db8ec [endpoint 0x00000002]
  TransferFlags        = 00000002 (USBD_TRANSFER_DIRECTION_OUT, USBD_SHORT_TRANSFER_OK)
  TransferBufferLength = 00000012
  TransferBuffer       = 00000000
  TransferBufferMDL    = 85ae5cb0
    00000000: 54 fd 64 00 00 ff 64 01 40 20 0e 80 02 0a 38 4b
    00000010: 80 0e
  UrbLink              = 00000000
[108550 ms] UsbSnoop - MyInternalIOCTLCompletion(f76d8126) : fido=85e673d0, Irp=85a71af0, Context=85b8ca40, IRQL=2
[108550 ms]  <<<  URB 194 coming back  <<< 
-- URB_FUNCTION_BULK_OR_INTERRUPT_TRANSFER:
  PipeHandle           = 866db8ec [endpoint 0x00000002]
  TransferFlags        = 00000002 (USBD_TRANSFER_DIRECTION_OUT, USBD_SHORT_TRANSFER_OK)
  TransferBufferLength = 00000012
  TransferBuffer       = 00000000
  TransferBufferMDL    = 85ae5cb0
  UrbLink              = 00000000
[108551 ms] UsbSnoop - FilterDispatchAny(f76d7fd2) : IRP_MJ_INTERNAL_DEVICE_CONTROL
[108551 ms] UsbSnoop - FdoHookDispatchInternalIoctl(f76d81ea) : fdo=861c0730, Irp=85a71af0, IRQL=0
[108551 ms]  >>>  URB 195 going down  >>> 
-- URB_FUNCTION_BULK_OR_INTERRUPT_TRANSFER:
  PipeHandle           = 866db8cc [endpoint 0x00000081]
  TransferFlags        = 00000003 (USBD_TRANSFER_DIRECTION_IN, USBD_SHORT_TRANSFER_OK)
  TransferBufferLength = 00000200
  TransferBuffer       = 00000000
  TransferBufferMDL    = 85ae5cb0
  UrbLink              = 00000000
[108551 ms] UsbSnoop - FilterDispatchAny(f76d7fd2) : IRP_MJ_INTERNAL_DEVICE_CONTROL
[108551 ms] UsbSnoop - FdoHookDispatchInternalIoctl(f76d81ea) : fdo=861c0730, Irp=85a69b18, IRQL=0
[108551 ms]  >>>  URB 196 going down  >>> 
-- URB_FUNCTION_BULK_OR_INTERRUPT_TRANSFER:
  PipeHandle           = 866db8ec [endpoint 0x00000002]
  TransferFlags        = 00000002 (USBD_TRANSFER_DIRECTION_OUT, USBD_SHORT_TRANSFER_OK)
  TransferBufferLength = 00000011
  TransferBuffer       = 00000000
  TransferBufferMDL    = 85b0ba48
    00000000: 54 fd 64 00 80 0e 64 01 40 20 03 00 01 00 26 32
    00000010: 03
  UrbLink              = 00000000
[108551 ms] UsbSnoop - MyInternalIOCTLCompletion(f76d8126) : fido=85e673d0, Irp=85a69b18, Context=86a80f80, IRQL=2
[108552 ms]  <<<  URB 196 coming back  <<< 
-- URB_FUNCTION_BULK_OR_INTERRUPT_TRANSFER:
  PipeHandle           = 866db8ec [endpoint 0x00000002]
  TransferFlags        = 00000002 (USBD_TRANSFER_DIRECTION_OUT, USBD_SHORT_TRANSFER_OK)
  TransferBufferLength = 00000011
  TransferBuffer       = 00000000
  TransferBufferMDL    = 85b0ba48
  UrbLink              = 00000000
[108553 ms] UsbSnoop - MyInternalIOCTLCompletion(f76d8126) : fido=85e673d0, Irp=85a71af0, Context=85b8ca40, IRQL=2
[108553 ms]  <<<  URB 195 coming back  <<< 
-- URB_FUNCTION_BULK_OR_INTERRUPT_TRANSFER:
  PipeHandle           = 866db8cc [endpoint 0x00000081]
  TransferFlags        = 00000003 (USBD_TRANSFER_DIRECTION_IN, USBD_SHORT_TRANSFER_OK)
  TransferBufferLength = 00000012
  TransferBuffer       = 00000000
  TransferBufferMDL    = 85ae5cb0
    00000000: 54 fd 64 01 00 ff 64 00 80 0e 20 40 02 0a 26 39
    00000010: 40 20
  UrbLink              = 00000000
[108554 ms] UsbSnoop - FilterDispatchAny(f76d7fd2) : IRP_MJ_INTERNAL_DEVICE_CONTROL
[108554 ms] UsbSnoop - FdoHookDispatchInternalIoctl(f76d81ea) : fdo=861c0730, Irp=85a69b18, IRQL=0
[108554 ms]  >>>  URB 197 going down  >>> 
-- URB_FUNCTION_BULK_OR_INTERRUPT_TRANSFER:
  PipeHandle           = 866db8cc [endpoint 0x00000081]
  TransferFlags        = 00000003 (USBD_TRANSFER_DIRECTION_IN, USBD_SHORT_TRANSFER_OK)
  TransferBufferLength = 00000200
  TransferBuffer       = 00000000
  TransferBufferMDL    = 85a309b8
  UrbLink              = 00000000
[108557 ms] UsbSnoop - MyInternalIOCTLCompletion(f76d8126) : fido=85e673d0, Irp=85a69b18, Context=85b8ca40, IRQL=2
[108557 ms]  <<<  URB 197 coming back  <<< 
-- URB_FUNCTION_BULK_OR_INTERRUPT_TRANSFER:
  PipeHandle           = 866db8cc [endpoint 0x00000081]
  TransferFlags        = 00000003 (USBD_TRANSFER_DIRECTION_IN, USBD_SHORT_TRANSFER_OK)
  TransferBufferLength = 0000001b
  TransferBuffer       = 00000000
  TransferBufferMDL    = 85a309b8
    00000000: 54 fd 64 01 40 20 64 00 80 0e 96 7f 0b 00 39 61
    00000010: 03 2e 74 6e 73 00 2e 74 6e 6f 00
  UrbLink              = 00000000
[108558 ms] UsbSnoop - FilterDispatchAny(f76d7fd2) : IRP_MJ_INTERNAL_DEVICE_CONTROL
[108558 ms] UsbSnoop - FdoHookDispatchInternalIoctl(f76d81ea) : fdo=861c0730, Irp=85a69b18, IRQL=0
[108558 ms]  >>>  URB 198 going down  >>> 
-- URB_FUNCTION_BULK_OR_INTERRUPT_TRANSFER:
  PipeHandle           = 866db8ec [endpoint 0x00000002]
  TransferFlags        = 00000002 (USBD_TRANSFER_DIRECTION_OUT, USBD_SHORT_TRANSFER_OK)
  TransferBufferLength = 00000012
  TransferBuffer       = 00000000
  TransferBufferMDL    = 85a309b8
    00000000: 54 fd 64 00 00 ff 64 01 40 20 0e 80 02 0a 39 4c
    00000010: 80 0e
  UrbLink              = 00000000
[108558 ms] UsbSnoop - MyInternalIOCTLCompletion(f76d8126) : fido=85e673d0, Irp=85a69b18, Context=85b8ca40, IRQL=2
[108558 ms]  <<<  URB 198 coming back  <<< 
-- URB_FUNCTION_BULK_OR_INTERRUPT_TRANSFER:
  PipeHandle           = 866db8ec [endpoint 0x00000002]
  TransferFlags        = 00000002 (USBD_TRANSFER_DIRECTION_OUT, USBD_SHORT_TRANSFER_OK)
  TransferBufferLength = 00000012
  TransferBuffer       = 00000000
  TransferBufferMDL    = 85a309b8
  UrbLink              = 00000000
[108559 ms] UsbSnoop - FilterDispatchAny(f76d7fd2) : IRP_MJ_INTERNAL_DEVICE_CONTROL
[108559 ms] UsbSnoop - FdoHookDispatchInternalIoctl(f76d81ea) : fdo=861c0730, Irp=85a69b18, IRQL=0
[108559 ms]  >>>  URB 199 going down  >>> 
-- URB_FUNCTION_BULK_OR_INTERRUPT_TRANSFER:
  PipeHandle           = 866db8cc [endpoint 0x00000081]
  TransferFlags        = 00000003 (USBD_TRANSFER_DIRECTION_IN, USBD_SHORT_TRANSFER_OK)
  TransferBufferLength = 00000200
  TransferBuffer       = 00000000
  TransferBufferMDL    = 85b0ba48
  UrbLink              = 00000000
[108559 ms] UsbSnoop - FilterDispatchAny(f76d7fd2) : IRP_MJ_INTERNAL_DEVICE_CONTROL
[108559 ms] UsbSnoop - FdoHookDispatchInternalIoctl(f76d81ea) : fdo=861c0730, Irp=86586858, IRQL=0
[108559 ms]  >>>  URB 200 going down  >>> 
-- URB_FUNCTION_BULK_OR_INTERRUPT_TRANSFER:
  PipeHandle           = 866db8ec [endpoint 0x00000002]
  TransferFlags        = 00000002 (USBD_TRANSFER_DIRECTION_OUT, USBD_SHORT_TRANSFER_OK)
  TransferBufferLength = 00000012
  TransferBuffer       = 00000000
  TransferBufferMDL    = 86718760
    00000000: 54 fd 64 00 40 de 64 01 40 20 0e 80 02 00 27 4f
    00000010: 80 0e
  UrbLink              = 00000000
[108559 ms] UsbSnoop - MyInternalIOCTLCompletion(f76d8126) : fido=85e673d0, Irp=86586858, Context=86a80f80, IRQL=2
[108559 ms]  <<<  URB 200 coming back  <<< 
-- URB_FUNCTION_BULK_OR_INTERRUPT_TRANSFER:
  PipeHandle           = 866db8ec [endpoint 0x00000002]
  TransferFlags        = 00000002 (USBD_TRANSFER_DIRECTION_OUT, USBD_SHORT_TRANSFER_OK)
  TransferBufferLength = 00000012
  TransferBuffer       = 00000000
  TransferBufferMDL    = 86718760
  UrbLink              = 00000000
[108560 ms] UsbSnoop - MyInternalIOCTLCompletion(f76d8126) : fido=85e673d0, Irp=85a69b18, Context=85b8ca40, IRQL=2
[108560 ms]  <<<  URB 199 coming back  <<< 
-- URB_FUNCTION_BULK_OR_INTERRUPT_TRANSFER:
  PipeHandle           = 866db8cc [endpoint 0x00000081]
  TransferFlags        = 00000003 (USBD_TRANSFER_DIRECTION_IN, USBD_SHORT_TRANSFER_OK)
  TransferBufferLength = 00000012
  TransferBuffer       = 00000000
  TransferBufferMDL    = 85b0ba48
    00000000: 54 fd 64 01 00 ff 64 00 80 0e 20 40 02 0a 27 3a
    00000010: 40 20
  UrbLink              = 00000000
[108561 ms] UsbSnoop - FilterDispatchAny(f76d7fd2) : IRP_MJ_INTERNAL_DEVICE_CONTROL
[108561 ms] UsbSnoop - FdoHookDispatchInternalIoctl(f76d81ea) : fdo=861c0730, Irp=85a69b18, IRQL=0
[108561 ms]  >>>  URB 201 going down  >>> 
-- URB_FUNCTION_BULK_OR_INTERRUPT_TRANSFER:
  PipeHandle           = 866db8cc [endpoint 0x00000081]
  TransferFlags        = 00000003 (USBD_TRANSFER_DIRECTION_IN, USBD_SHORT_TRANSFER_OK)
  TransferBufferLength = 00000200
  TransferBuffer       = 00000000
  TransferBufferMDL    = 85b0ba48
  UrbLink              = 00000000
[108563 ms] UsbSnoop - FilterDispatchAny(f76d7fd2) : IRP_MJ_INTERNAL_DEVICE_CONTROL
[108563 ms] UsbSnoop - FdoHookDispatchInternalIoctl(f76d81ea) : fdo=861c0730, Irp=85a71af0, IRQL=0
[108563 ms]  >>>  URB 202 going down  >>> 
-- URB_FUNCTION_BULK_OR_INTERRUPT_TRANSFER:
  PipeHandle           = 866db8ec [endpoint 0x00000002]
  TransferFlags        = 00000002 (USBD_TRANSFER_DIRECTION_OUT, USBD_SHORT_TRANSFER_OK)
  TransferBufferLength = 00000012
  TransferBuffer       = 00000000
  TransferBufferMDL    = 85a4dee8
    00000000: 54 fd 64 00 40 de 64 01 40 20 0d 80 02 00 28 4f
    00000010: 80 0d
  UrbLink              = 00000000
[108565 ms] UsbSnoop - MyInternalIOCTLCompletion(f76d8126) : fido=85e673d0, Irp=85a69b18, Context=85b8ca40, IRQL=2
[108565 ms]  <<<  URB 201 coming back  <<< 
-- URB_FUNCTION_BULK_OR_INTERRUPT_TRANSFER:
  PipeHandle           = 866db8cc [endpoint 0x00000081]
  TransferFlags        = 00000003 (USBD_TRANSFER_DIRECTION_IN, USBD_SHORT_TRANSFER_OK)
  TransferBufferLength = 00000012
  TransferBuffer       = 00000000
  TransferBufferMDL    = 85b0ba48
    00000000: 54 fd 64 01 00 ff 64 00 80 0d 20 40 02 0a 28 3a
    00000010: 40 20
  UrbLink              = 00000000
[108565 ms] UsbSnoop - MyInternalIOCTLCompletion(f76d8126) : fido=85e673d0, Irp=85a71af0, Context=86a80f80, IRQL=2
[108565 ms]  <<<  URB 202 coming back  <<< 
-- URB_FUNCTION_BULK_OR_INTERRUPT_TRANSFER:
  PipeHandle           = 866db8ec [endpoint 0x00000002]
  TransferFlags        = 00000002 (USBD_TRANSFER_DIRECTION_OUT, USBD_SHORT_TRANSFER_OK)
  TransferBufferLength = 00000012
  TransferBuffer       = 00000000
  TransferBufferMDL    = 85a4dee8
  UrbLink              = 00000000
[108565 ms] UsbSnoop - FilterDispatchAny(f76d7fd2) : IRP_MJ_INTERNAL_DEVICE_CONTROL
[108565 ms] UsbSnoop - FdoHookDispatchInternalIoctl(f76d81ea) : fdo=861c0730, Irp=85a69b18, IRQL=0
[108565 ms]  >>>  URB 203 going down  >>> 
-- URB_FUNCTION_BULK_OR_INTERRUPT_TRANSFER:
  PipeHandle           = 866db8cc [endpoint 0x00000081]
  TransferFlags        = 00000003 (USBD_TRANSFER_DIRECTION_IN, USBD_SHORT_TRANSFER_OK)
  TransferBufferLength = 00000200
  TransferBuffer       = 00000000
  TransferBufferMDL    = 8641d678
  UrbLink              = 00000000
[112677 ms] UsbSnoop - FilterDispatchAny(f76d7fd2) : IRP_MJ_INTERNAL_DEVICE_CONTROL
[112677 ms] UsbSnoop - FdoHookDispatchInternalIoctl(f76d81ea) : fdo=861c0730, Irp=85a6dcd8, IRQL=0
[112677 ms]  >>>  URB 204 going down  >>> 
-- URB_FUNCTION_BULK_OR_INTERRUPT_TRANSFER:
  PipeHandle           = 866db8ec [endpoint 0x00000002]
  TransferFlags        = 00000002 (USBD_TRANSFER_DIRECTION_OUT, USBD_SHORT_TRANSFER_OK)
  TransferBufferLength = 0000001b
  TransferBuffer       = 00000000
  TransferBufferMDL    = 86718760
    00000000: 54 fd 64 00 80 0f 64 01 40 60 0c f1 0b 00 29 7a
    00000010: 20 01 2f 00 00 00 00 00 00 00 00
  UrbLink              = 00000000
[112678 ms] UsbSnoop - MyInternalIOCTLCompletion(f76d8126) : fido=85e673d0, Irp=85a6dcd8, Context=85b8ca40, IRQL=2
[112678 ms]  <<<  URB 204 coming back  <<< 
-- URB_FUNCTION_BULK_OR_INTERRUPT_TRANSFER:
  PipeHandle           = 866db8ec [endpoint 0x00000002]
  TransferFlags        = 00000002 (USBD_TRANSFER_DIRECTION_OUT, USBD_SHORT_TRANSFER_OK)
  TransferBufferLength = 0000001b
  TransferBuffer       = 00000000
  TransferBufferMDL    = 86718760
  UrbLink              = 00000000
[112679 ms] UsbSnoop - MyInternalIOCTLCompletion(f76d8126) : fido=85e673d0, Irp=85a69b18, Context=86a80f80, IRQL=2
[112679 ms]  <<<  URB 203 coming back  <<< 
-- URB_FUNCTION_BULK_OR_INTERRUPT_TRANSFER:
  PipeHandle           = 866db8cc [endpoint 0x00000081]
  TransferFlags        = 00000003 (USBD_TRANSFER_DIRECTION_IN, USBD_SHORT_TRANSFER_OK)
  TransferBufferLength = 00000012
  TransferBuffer       = 00000000
  TransferBufferMDL    = 8641d678
    00000000: 54 fd 64 01 00 ff 64 00 80 0f 60 40 02 0a 29 7d
    00000010: 40 60
  UrbLink              = 00000000
[112679 ms] UsbSnoop - FilterDispatchAny(f76d7fd2) : IRP_MJ_INTERNAL_DEVICE_CONTROL
[112679 ms] UsbSnoop - FdoHookDispatchInternalIoctl(f76d81ea) : fdo=861c0730, Irp=85a69b18, IRQL=0
[112679 ms]  >>>  URB 205 going down  >>> 
-- URB_FUNCTION_BULK_OR_INTERRUPT_TRANSFER:
  PipeHandle           = 866db8cc [endpoint 0x00000081]
  TransferFlags        = 00000003 (USBD_TRANSFER_DIRECTION_IN, USBD_SHORT_TRANSFER_OK)
  TransferBufferLength = 00000200
  TransferBuffer       = 00000000
  TransferBufferMDL    = 869b4d68
  UrbLink              = 00000000
[112694 ms] UsbSnoop - MyInternalIOCTLCompletion(f76d8126) : fido=85e673d0, Irp=85a69b18, Context=86a80f80, IRQL=2
[112694 ms]  <<<  URB 205 coming back  <<< 
-- URB_FUNCTION_BULK_OR_INTERRUPT_TRANSFER:
  PipeHandle           = 866db8cc [endpoint 0x00000081]
  TransferFlags        = 00000003 (USBD_TRANSFER_DIRECTION_IN, USBD_SHORT_TRANSFER_OK)
  TransferBufferLength = 0000001b
  TransferBuffer       = 00000000
  TransferBufferMDL    = 869b4d68
    00000000: 54 fd 64 01 40 60 64 00 80 0f f7 38 0b 00 3a bd
    00000010: 20 00 00 00 00 00 00 00 00 01 00
  UrbLink              = 00000000
[112694 ms] UsbSnoop - FilterDispatchAny(f76d7fd2) : IRP_MJ_INTERNAL_DEVICE_CONTROL
[112694 ms] UsbSnoop - FdoHookDispatchInternalIoctl(f76d81ea) : fdo=861c0730, Irp=85a69b18, IRQL=0
[112694 ms]  >>>  URB 206 going down  >>> 
-- URB_FUNCTION_BULK_OR_INTERRUPT_TRANSFER:
  PipeHandle           = 866db8ec [endpoint 0x00000002]
  TransferFlags        = 00000002 (USBD_TRANSFER_DIRECTION_OUT, USBD_SHORT_TRANSFER_OK)
  TransferBufferLength = 00000012
  TransferBuffer       = 00000000
  TransferBufferMDL    = 869b4d68
    00000000: 54 fd 64 00 00 ff 64 01 40 60 0f 80 02 0a 3a 8e
    00000010: 80 0f
  UrbLink              = 00000000
[112695 ms] UsbSnoop - MyInternalIOCTLCompletion(f76d8126) : fido=85e673d0, Irp=85a69b18, Context=86a80f80, IRQL=2
[112695 ms]  <<<  URB 206 coming back  <<< 
-- URB_FUNCTION_BULK_OR_INTERRUPT_TRANSFER:
  PipeHandle           = 866db8ec [endpoint 0x00000002]
  TransferFlags        = 00000002 (USBD_TRANSFER_DIRECTION_OUT, USBD_SHORT_TRANSFER_OK)
  TransferBufferLength = 00000012
  TransferBuffer       = 00000000
  TransferBufferMDL    = 869b4d68
  UrbLink              = 00000000
[112695 ms] UsbSnoop - FilterDispatchAny(f76d7fd2) : IRP_MJ_INTERNAL_DEVICE_CONTROL
[112695 ms] UsbSnoop - FdoHookDispatchInternalIoctl(f76d81ea) : fdo=861c0730, Irp=85a69b18, IRQL=0
[112695 ms]  >>>  URB 207 going down  >>> 
-- URB_FUNCTION_BULK_OR_INTERRUPT_TRANSFER:
  PipeHandle           = 866db8cc [endpoint 0x00000081]
  TransferFlags        = 00000003 (USBD_TRANSFER_DIRECTION_IN, USBD_SHORT_TRANSFER_OK)
  TransferBufferLength = 00000200
  TransferBuffer       = 00000000
  TransferBufferMDL    = 869b4d68
  UrbLink              = 00000000
[112696 ms] UsbSnoop - FilterDispatchAny(f76d7fd2) : IRP_MJ_INTERNAL_DEVICE_CONTROL
[112696 ms] UsbSnoop - FdoHookDispatchInternalIoctl(f76d81ea) : fdo=861c0730, Irp=85a6dcd8, IRQL=0
[112696 ms]  >>>  URB 208 going down  >>> 
-- URB_FUNCTION_BULK_OR_INTERRUPT_TRANSFER:
  PipeHandle           = 866db8ec [endpoint 0x00000002]
  TransferFlags        = 00000002 (USBD_TRANSFER_DIRECTION_OUT, USBD_SHORT_TRANSFER_OK)
  TransferBufferLength = 00000012
  TransferBuffer       = 00000000
  TransferBufferMDL    = 86336228
    00000000: 54 fd 64 00 40 de 64 01 40 60 0f 80 02 00 2a 93
    00000010: 80 0f
  UrbLink              = 00000000
[112697 ms] UsbSnoop - MyInternalIOCTLCompletion(f76d8126) : fido=85e673d0, Irp=85a6dcd8, Context=85b8ca40, IRQL=2
[112697 ms]  <<<  URB 208 coming back  <<< 
-- URB_FUNCTION_BULK_OR_INTERRUPT_TRANSFER:
  PipeHandle           = 866db8ec [endpoint 0x00000002]
  TransferFlags        = 00000002 (USBD_TRANSFER_DIRECTION_OUT, USBD_SHORT_TRANSFER_OK)
  TransferBufferLength = 00000012
  TransferBuffer       = 00000000
  TransferBufferMDL    = 86336228
  UrbLink              = 00000000
[112698 ms] UsbSnoop - MyInternalIOCTLCompletion(f76d8126) : fido=85e673d0, Irp=85a69b18, Context=86a80f80, IRQL=2
[112698 ms]  <<<  URB 207 coming back  <<< 
-- URB_FUNCTION_BULK_OR_INTERRUPT_TRANSFER:
  PipeHandle           = 866db8cc [endpoint 0x00000081]
  TransferFlags        = 00000003 (USBD_TRANSFER_DIRECTION_IN, USBD_SHORT_TRANSFER_OK)
  TransferBufferLength = 00000012
  TransferBuffer       = 00000000
  TransferBufferMDL    = 869b4d68
    00000000: 54 fd 64 01 00 ff 64 00 80 0f 60 40 02 0a 2a 7e
    00000010: 40 60
  UrbLink              = 00000000
[112698 ms] UsbSnoop - FilterDispatchAny(f76d7fd2) : IRP_MJ_INTERNAL_DEVICE_CONTROL
[112698 ms] UsbSnoop - FdoHookDispatchInternalIoctl(f76d81ea) : fdo=861c0730, Irp=85a69b18, IRQL=0
[112698 ms]  >>>  URB 209 going down  >>> 
-- URB_FUNCTION_BULK_OR_INTERRUPT_TRANSFER:
  PipeHandle           = 866db8cc [endpoint 0x00000081]
  TransferFlags        = 00000003 (USBD_TRANSFER_DIRECTION_IN, USBD_SHORT_TRANSFER_OK)
  TransferBufferLength = 00000200
  TransferBuffer       = 00000000
  TransferBufferMDL    = 8641d678
  UrbLink              = 00000000
[112700 ms] UsbSnoop - FilterDispatchAny(f76d7fd2) : IRP_MJ_INTERNAL_DEVICE_CONTROL
[112700 ms] UsbSnoop - FdoHookDispatchInternalIoctl(f76d81ea) : fdo=861c0730, Irp=85a6dcd8, IRQL=0
[112700 ms]  >>>  URB 210 going down  >>> 
-- URB_FUNCTION_BULK_OR_INTERRUPT_TRANSFER:
  PipeHandle           = 866db8ec [endpoint 0x00000002]
  TransferFlags        = 00000002 (USBD_TRANSFER_DIRECTION_OUT, USBD_SHORT_TRANSFER_OK)
  TransferBufferLength = 0000001b
  TransferBuffer       = 00000000
  TransferBufferMDL    = 86336228
    00000000: 54 fd 64 00 80 10 64 01 40 60 0c f1 0b 00 2b 7d
    00000010: 20 01 2f 00 00 00 00 00 00 00 00
  UrbLink              = 00000000
[112701 ms] UsbSnoop - MyInternalIOCTLCompletion(f76d8126) : fido=85e673d0, Irp=85a69b18, Context=86a80f80, IRQL=2
[112701 ms]  <<<  URB 209 coming back  <<< 
-- URB_FUNCTION_BULK_OR_INTERRUPT_TRANSFER:
  PipeHandle           = 866db8cc [endpoint 0x00000081]
  TransferFlags        = 00000003 (USBD_TRANSFER_DIRECTION_IN, USBD_SHORT_TRANSFER_OK)
  TransferBufferLength = 00000012
  TransferBuffer       = 00000000
  TransferBufferMDL    = 8641d678
    00000000: 54 fd 64 01 00 ff 64 00 80 10 60 40 02 0a 2b 80
    00000010: 40 60
  UrbLink              = 00000000
[112701 ms] UsbSnoop - MyInternalIOCTLCompletion(f76d8126) : fido=85e673d0, Irp=85a6dcd8, Context=85b8ca40, IRQL=2
[112701 ms]  <<<  URB 210 coming back  <<< 
-- URB_FUNCTION_BULK_OR_INTERRUPT_TRANSFER:
  PipeHandle           = 866db8ec [endpoint 0x00000002]
  TransferFlags        = 00000002 (USBD_TRANSFER_DIRECTION_OUT, USBD_SHORT_TRANSFER_OK)
  TransferBufferLength = 0000001b
  TransferBuffer       = 00000000
  TransferBufferMDL    = 86336228
  UrbLink              = 00000000
[112701 ms] UsbSnoop - FilterDispatchAny(f76d7fd2) : IRP_MJ_INTERNAL_DEVICE_CONTROL
[112701 ms] UsbSnoop - FdoHookDispatchInternalIoctl(f76d81ea) : fdo=861c0730, Irp=85a69b18, IRQL=0
[112701 ms]  >>>  URB 211 going down  >>> 
-- URB_FUNCTION_BULK_OR_INTERRUPT_TRANSFER:
  PipeHandle           = 866db8cc [endpoint 0x00000081]
  TransferFlags        = 00000003 (USBD_TRANSFER_DIRECTION_IN, USBD_SHORT_TRANSFER_OK)
  TransferBufferLength = 00000200
  TransferBuffer       = 00000000
  TransferBufferMDL    = 869b4d68
  UrbLink              = 00000000
[112718 ms] UsbSnoop - MyInternalIOCTLCompletion(f76d8126) : fido=85e673d0, Irp=85a69b18, Context=85b8ca40, IRQL=2
[112718 ms]  <<<  URB 211 coming back  <<< 
-- URB_FUNCTION_BULK_OR_INTERRUPT_TRANSFER:
  PipeHandle           = 866db8cc [endpoint 0x00000081]
  TransferFlags        = 00000003 (USBD_TRANSFER_DIRECTION_IN, USBD_SHORT_TRANSFER_OK)
  TransferBufferLength = 0000001b
  TransferBuffer       = 00000000
  TransferBufferMDL    = 869b4d68
    00000000: 54 fd 64 01 40 60 64 00 80 10 f7 38 0b 00 3b bf
    00000010: 20 00 00 00 00 00 00 00 00 01 00
  UrbLink              = 00000000
[112718 ms] UsbSnoop - FilterDispatchAny(f76d7fd2) : IRP_MJ_INTERNAL_DEVICE_CONTROL
[112718 ms] UsbSnoop - FdoHookDispatchInternalIoctl(f76d81ea) : fdo=861c0730, Irp=85a69b18, IRQL=0
[112718 ms]  >>>  URB 212 going down  >>> 
-- URB_FUNCTION_BULK_OR_INTERRUPT_TRANSFER:
  PipeHandle           = 866db8ec [endpoint 0x00000002]
  TransferFlags        = 00000002 (USBD_TRANSFER_DIRECTION_OUT, USBD_SHORT_TRANSFER_OK)
  TransferBufferLength = 00000012
  TransferBuffer       = 00000000
  TransferBufferMDL    = 869b4d68
    00000000: 54 fd 64 00 00 ff 64 01 40 60 10 80 02 0a 3b 90
    00000010: 80 10
  UrbLink              = 00000000
[112719 ms] UsbSnoop - MyInternalIOCTLCompletion(f76d8126) : fido=85e673d0, Irp=85a69b18, Context=85b8ca40, IRQL=2
[112719 ms]  <<<  URB 212 coming back  <<< 
-- URB_FUNCTION_BULK_OR_INTERRUPT_TRANSFER:
  PipeHandle           = 866db8ec [endpoint 0x00000002]
  TransferFlags        = 00000002 (USBD_TRANSFER_DIRECTION_OUT, USBD_SHORT_TRANSFER_OK)
  TransferBufferLength = 00000012
  TransferBuffer       = 00000000
  TransferBufferMDL    = 869b4d68
  UrbLink              = 00000000
[112719 ms] UsbSnoop - FilterDispatchAny(f76d7fd2) : IRP_MJ_INTERNAL_DEVICE_CONTROL
[112719 ms] UsbSnoop - FdoHookDispatchInternalIoctl(f76d81ea) : fdo=861c0730, Irp=85a69b18, IRQL=0
[112719 ms]  >>>  URB 213 going down  >>> 
-- URB_FUNCTION_BULK_OR_INTERRUPT_TRANSFER:
  PipeHandle           = 866db8cc [endpoint 0x00000081]
  TransferFlags        = 00000003 (USBD_TRANSFER_DIRECTION_IN, USBD_SHORT_TRANSFER_OK)
  TransferBufferLength = 00000200
  TransferBuffer       = 00000000
  TransferBufferMDL    = 869b4d68
  UrbLink              = 00000000
[112720 ms] UsbSnoop - FilterDispatchAny(f76d7fd2) : IRP_MJ_INTERNAL_DEVICE_CONTROL
[112720 ms] UsbSnoop - FdoHookDispatchInternalIoctl(f76d81ea) : fdo=861c0730, Irp=85e39cb0, IRQL=0
[112720 ms]  >>>  URB 214 going down  >>> 
-- URB_FUNCTION_BULK_OR_INTERRUPT_TRANSFER:
  PipeHandle           = 866db8ec [endpoint 0x00000002]
  TransferFlags        = 00000002 (USBD_TRANSFER_DIRECTION_OUT, USBD_SHORT_TRANSFER_OK)
  TransferBufferLength = 00000012
  TransferBuffer       = 00000000
  TransferBufferMDL    = 8641d678
    00000000: 54 fd 64 00 40 de 64 01 40 60 10 80 02 00 2c 96
    00000010: 80 10
  UrbLink              = 00000000
[112721 ms] UsbSnoop - MyInternalIOCTLCompletion(f76d8126) : fido=85e673d0, Irp=85e39cb0, Context=86a80f80, IRQL=2
[112721 ms]  <<<  URB 214 coming back  <<< 
-- URB_FUNCTION_BULK_OR_INTERRUPT_TRANSFER:
  PipeHandle           = 866db8ec [endpoint 0x00000002]
  TransferFlags        = 00000002 (USBD_TRANSFER_DIRECTION_OUT, USBD_SHORT_TRANSFER_OK)
  TransferBufferLength = 00000012
  TransferBuffer       = 00000000
  TransferBufferMDL    = 8641d678
  UrbLink              = 00000000
[112722 ms] UsbSnoop - MyInternalIOCTLCompletion(f76d8126) : fido=85e673d0, Irp=85a69b18, Context=85b8ca40, IRQL=2
[112722 ms]  <<<  URB 213 coming back  <<< 
-- URB_FUNCTION_BULK_OR_INTERRUPT_TRANSFER:
  PipeHandle           = 866db8cc [endpoint 0x00000081]
  TransferFlags        = 00000003 (USBD_TRANSFER_DIRECTION_IN, USBD_SHORT_TRANSFER_OK)
  TransferBufferLength = 00000012
  TransferBuffer       = 00000000
  TransferBufferMDL    = 869b4d68
    00000000: 54 fd 64 01 00 ff 64 00 80 10 60 40 02 0a 2c 81
    00000010: 40 60
  UrbLink              = 00000000
[112722 ms] UsbSnoop - FilterDispatchAny(f76d7fd2) : IRP_MJ_INTERNAL_DEVICE_CONTROL
[112722 ms] UsbSnoop - FdoHookDispatchInternalIoctl(f76d81ea) : fdo=861c0730, Irp=85a69b18, IRQL=0
[112722 ms]  >>>  URB 215 going down  >>> 
-- URB_FUNCTION_BULK_OR_INTERRUPT_TRANSFER:
  PipeHandle           = 866db8cc [endpoint 0x00000081]
  TransferFlags        = 00000003 (USBD_TRANSFER_DIRECTION_IN, USBD_SHORT_TRANSFER_OK)
  TransferBufferLength = 00000200
  TransferBuffer       = 00000000
  TransferBufferMDL    = 86336228
  UrbLink              = 00000000
[112724 ms] UsbSnoop - FilterDispatchAny(f76d7fd2) : IRP_MJ_INTERNAL_DEVICE_CONTROL
[112724 ms] UsbSnoop - FdoHookDispatchInternalIoctl(f76d81ea) : fdo=861c0730, Irp=85a6dcd8, IRQL=0
[112724 ms]  >>>  URB 216 going down  >>> 
-- URB_FUNCTION_BULK_OR_INTERRUPT_TRANSFER:
  PipeHandle           = 866db8ec [endpoint 0x00000002]
  TransferFlags        = 00000002 (USBD_TRANSFER_DIRECTION_OUT, USBD_SHORT_TRANSFER_OK)
  TransferBufferLength = 0000001a
  TransferBuffer       = 00000000
  TransferBufferMDL    = 86544868
    00000000: 54 fd 64 00 80 11 64 01 40 60 c0 aa 0a 00 2d ec
    00000010: 0d 2f 00 00 00 00 00 00 00 00
  UrbLink              = 00000000
[112725 ms] UsbSnoop - MyInternalIOCTLCompletion(f76d8126) : fido=85e673d0, Irp=85a6dcd8, Context=86a80f80, IRQL=2
[112725 ms]  <<<  URB 216 coming back  <<< 
-- URB_FUNCTION_BULK_OR_INTERRUPT_TRANSFER:
  PipeHandle           = 866db8ec [endpoint 0x00000002]
  TransferFlags        = 00000002 (USBD_TRANSFER_DIRECTION_OUT, USBD_SHORT_TRANSFER_OK)
  TransferBufferLength = 0000001a
  TransferBuffer       = 00000000
  TransferBufferMDL    = 86544868
  UrbLink              = 00000000
[112726 ms] UsbSnoop - MyInternalIOCTLCompletion(f76d8126) : fido=85e673d0, Irp=85a69b18, Context=85b8ca40, IRQL=2
[112726 ms]  <<<  URB 215 coming back  <<< 
-- URB_FUNCTION_BULK_OR_INTERRUPT_TRANSFER:
  PipeHandle           = 866db8cc [endpoint 0x00000081]
  TransferFlags        = 00000003 (USBD_TRANSFER_DIRECTION_IN, USBD_SHORT_TRANSFER_OK)
  TransferBufferLength = 00000012
  TransferBuffer       = 00000000
  TransferBufferMDL    = 86336228
    00000000: 54 fd 64 01 00 ff 64 00 80 11 60 40 02 0a 2d 83
    00000010: 40 60
  UrbLink              = 00000000
[112726 ms] UsbSnoop - FilterDispatchAny(f76d7fd2) : IRP_MJ_INTERNAL_DEVICE_CONTROL
[112726 ms] UsbSnoop - FdoHookDispatchInternalIoctl(f76d81ea) : fdo=861c0730, Irp=869c7cb0, IRQL=0
[112726 ms]  >>>  URB 217 going down  >>> 
-- URB_FUNCTION_BULK_OR_INTERRUPT_TRANSFER:
  PipeHandle           = 866db8cc [endpoint 0x00000081]
  TransferFlags        = 00000003 (USBD_TRANSFER_DIRECTION_IN, USBD_SHORT_TRANSFER_OK)
  TransferBufferLength = 00000200
  TransferBuffer       = 00000000
  TransferBufferMDL    = 86544868
  UrbLink              = 00000000
[112747 ms] UsbSnoop - MyInternalIOCTLCompletion(f76d8126) : fido=85e673d0, Irp=869c7cb0, Context=85b8ca40, IRQL=2
[112747 ms]  <<<  URB 217 coming back  <<< 
-- URB_FUNCTION_BULK_OR_INTERRUPT_TRANSFER:
  PipeHandle           = 866db8cc [endpoint 0x00000081]
  TransferFlags        = 00000003 (USBD_TRANSFER_DIRECTION_IN, USBD_SHORT_TRANSFER_OK)
  TransferBufferLength = 00000012
  TransferBuffer       = 00000000
  TransferBufferMDL    = 86544868
    00000000: 54 fd 64 01 40 60 64 00 80 11 00 ff 02 00 3c 88
    00000010: ff 00
  UrbLink              = 00000000
[112747 ms] UsbSnoop - FilterDispatchAny(f76d7fd2) : IRP_MJ_INTERNAL_DEVICE_CONTROL
[112747 ms] UsbSnoop - FdoHookDispatchInternalIoctl(f76d81ea) : fdo=861c0730, Irp=869c7cb0, IRQL=0
[112747 ms]  >>>  URB 218 going down  >>> 
-- URB_FUNCTION_BULK_OR_INTERRUPT_TRANSFER:
  PipeHandle           = 866db8ec [endpoint 0x00000002]
  TransferFlags        = 00000002 (USBD_TRANSFER_DIRECTION_OUT, USBD_SHORT_TRANSFER_OK)
  TransferBufferLength = 00000012
  TransferBuffer       = 00000000
  TransferBufferMDL    = 85a309b8
    00000000: 54 fd 64 00 00 ff 64 01 40 60 11 80 02 0a 3c 92
    00000010: 80 11
  UrbLink              = 00000000
[112748 ms] UsbSnoop - MyInternalIOCTLCompletion(f76d8126) : fido=85e673d0, Irp=869c7cb0, Context=85b8ca40, IRQL=2
[112748 ms]  <<<  URB 218 coming back  <<< 
-- URB_FUNCTION_BULK_OR_INTERRUPT_TRANSFER:
  PipeHandle           = 866db8ec [endpoint 0x00000002]
  TransferFlags        = 00000002 (USBD_TRANSFER_DIRECTION_OUT, USBD_SHORT_TRANSFER_OK)
  TransferBufferLength = 00000012
  TransferBuffer       = 00000000
  TransferBufferMDL    = 85a309b8
  UrbLink              = 00000000
[112748 ms] UsbSnoop - FilterDispatchAny(f76d7fd2) : IRP_MJ_INTERNAL_DEVICE_CONTROL
[112748 ms] UsbSnoop - FdoHookDispatchInternalIoctl(f76d81ea) : fdo=861c0730, Irp=869c7cb0, IRQL=0
[112748 ms]  >>>  URB 219 going down  >>> 
-- URB_FUNCTION_BULK_OR_INTERRUPT_TRANSFER:
  PipeHandle           = 866db8cc [endpoint 0x00000081]
  TransferFlags        = 00000003 (USBD_TRANSFER_DIRECTION_IN, USBD_SHORT_TRANSFER_OK)
  TransferBufferLength = 00000200
  TransferBuffer       = 00000000
  TransferBufferMDL    = 86544868
  UrbLink              = 00000000
[112748 ms] UsbSnoop - FilterDispatchAny(f76d7fd2) : IRP_MJ_INTERNAL_DEVICE_CONTROL
[112748 ms] UsbSnoop - FdoHookDispatchInternalIoctl(f76d81ea) : fdo=861c0730, Irp=85a69b18, IRQL=0
[112748 ms]  >>>  URB 220 going down  >>> 
-- URB_FUNCTION_BULK_OR_INTERRUPT_TRANSFER:
  PipeHandle           = 866db8ec [endpoint 0x00000002]
  TransferFlags        = 00000002 (USBD_TRANSFER_DIRECTION_OUT, USBD_SHORT_TRANSFER_OK)
  TransferBufferLength = 00000011
  TransferBuffer       = 00000000
  TransferBufferMDL    = 86718760
    00000000: 54 fd 64 00 80 11 64 01 40 60 0e 00 01 00 2e 88
    00000010: 0e
  UrbLink              = 00000000
[112749 ms] UsbSnoop - MyInternalIOCTLCompletion(f76d8126) : fido=85e673d0, Irp=85a69b18, Context=86a80f80, IRQL=2
[112749 ms]  <<<  URB 220 coming back  <<< 
-- URB_FUNCTION_BULK_OR_INTERRUPT_TRANSFER:
  PipeHandle           = 866db8ec [endpoint 0x00000002]
  TransferFlags        = 00000002 (USBD_TRANSFER_DIRECTION_OUT, USBD_SHORT_TRANSFER_OK)
  TransferBufferLength = 00000011
  TransferBuffer       = 00000000
  TransferBufferMDL    = 86718760
  UrbLink              = 00000000
[112751 ms] UsbSnoop - MyInternalIOCTLCompletion(f76d8126) : fido=85e673d0, Irp=869c7cb0, Context=85b8ca40, IRQL=2
[112751 ms]  <<<  URB 219 coming back  <<< 
-- URB_FUNCTION_BULK_OR_INTERRUPT_TRANSFER:
  PipeHandle           = 866db8cc [endpoint 0x00000081]
  TransferFlags        = 00000003 (USBD_TRANSFER_DIRECTION_IN, USBD_SHORT_TRANSFER_OK)
  TransferBufferLength = 00000012
  TransferBuffer       = 00000000
  TransferBufferMDL    = 86544868
    00000000: 54 fd 64 01 00 ff 64 00 80 11 60 40 02 0a 2e 84
    00000010: 40 60
  UrbLink              = 00000000
[112751 ms] UsbSnoop - FilterDispatchAny(f76d7fd2) : IRP_MJ_INTERNAL_DEVICE_CONTROL
[112751 ms] UsbSnoop - FdoHookDispatchInternalIoctl(f76d81ea) : fdo=861c0730, Irp=86586858, IRQL=0
[112751 ms]  >>>  URB 221 going down  >>> 
-- URB_FUNCTION_BULK_OR_INTERRUPT_TRANSFER:
  PipeHandle           = 866db8cc [endpoint 0x00000081]
  TransferFlags        = 00000003 (USBD_TRANSFER_DIRECTION_IN, USBD_SHORT_TRANSFER_OK)
  TransferBufferLength = 00000200
  TransferBuffer       = 00000000
  TransferBufferMDL    = 86718760
  UrbLink              = 00000000
[112759 ms] UsbSnoop - MyInternalIOCTLCompletion(f76d8126) : fido=85e673d0, Irp=86586858, Context=85b8ca40, IRQL=2
[112759 ms]  <<<  URB 221 coming back  <<< 
-- URB_FUNCTION_BULK_OR_INTERRUPT_TRANSFER:
  PipeHandle           = 866db8cc [endpoint 0x00000081]
  TransferFlags        = 00000003 (USBD_TRANSFER_DIRECTION_IN, USBD_SHORT_TRANSFER_OK)
  TransferBufferLength = 00000026
  TransferBuffer       = 00000000
  TransferBufferMDL    = 86718760
    00000000: 54 fd 64 01 40 60 64 00 80 11 11 54 16 00 3d 03
    00000010: 10 00 13 45 78 61 6d 70 6c 65 73 00 00 00 00 00
    00000020: 00 00 00 0b 01 00
  UrbLink              = 00000000
[112759 ms] UsbSnoop - FilterDispatchAny(f76d7fd2) : IRP_MJ_INTERNAL_DEVICE_CONTROL
[112759 ms] UsbSnoop - FdoHookDispatchInternalIoctl(f76d81ea) : fdo=861c0730, Irp=86586858, IRQL=0
[112759 ms]  >>>  URB 222 going down  >>> 
-- URB_FUNCTION_BULK_OR_INTERRUPT_TRANSFER:
  PipeHandle           = 866db8ec [endpoint 0x00000002]
  TransferFlags        = 00000002 (USBD_TRANSFER_DIRECTION_OUT, USBD_SHORT_TRANSFER_OK)
  TransferBufferLength = 00000012
  TransferBuffer       = 00000000
  TransferBufferMDL    = 85a309b8
    00000000: 54 fd 64 00 00 ff 64 01 40 60 11 80 02 0a 3d 93
    00000010: 80 11
  UrbLink              = 00000000
[112760 ms] UsbSnoop - MyInternalIOCTLCompletion(f76d8126) : fido=85e673d0, Irp=86586858, Context=85b8ca40, IRQL=2
[112760 ms]  <<<  URB 222 coming back  <<< 
-- URB_FUNCTION_BULK_OR_INTERRUPT_TRANSFER:
  PipeHandle           = 866db8ec [endpoint 0x00000002]
  TransferFlags        = 00000002 (USBD_TRANSFER_DIRECTION_OUT, USBD_SHORT_TRANSFER_OK)
  TransferBufferLength = 00000012
  TransferBuffer       = 00000000
  TransferBufferMDL    = 85a309b8
  UrbLink              = 00000000
[112760 ms] UsbSnoop - FilterDispatchAny(f76d7fd2) : IRP_MJ_INTERNAL_DEVICE_CONTROL
[112760 ms] UsbSnoop - FdoHookDispatchInternalIoctl(f76d81ea) : fdo=861c0730, Irp=85a32a50, IRQL=0
[112760 ms]  >>>  URB 223 going down  >>> 
-- URB_FUNCTION_BULK_OR_INTERRUPT_TRANSFER:
  PipeHandle           = 866db8cc [endpoint 0x00000081]
  TransferFlags        = 00000003 (USBD_TRANSFER_DIRECTION_IN, USBD_SHORT_TRANSFER_OK)
  TransferBufferLength = 00000200
  TransferBuffer       = 00000000
  TransferBufferMDL    = 86718760
  UrbLink              = 00000000
[112761 ms] UsbSnoop - FilterDispatchAny(f76d7fd2) : IRP_MJ_INTERNAL_DEVICE_CONTROL
[112761 ms] UsbSnoop - FdoHookDispatchInternalIoctl(f76d81ea) : fdo=861c0730, Irp=85a2daf0, IRQL=0
[112761 ms]  >>>  URB 224 going down  >>> 
-- URB_FUNCTION_BULK_OR_INTERRUPT_TRANSFER:
  PipeHandle           = 866db8ec [endpoint 0x00000002]
  TransferFlags        = 00000002 (USBD_TRANSFER_DIRECTION_OUT, USBD_SHORT_TRANSFER_OK)
  TransferBufferLength = 00000011
  TransferBuffer       = 00000000
  TransferBufferMDL    = 86a6e4f0
    00000000: 54 fd 64 00 80 11 64 01 40 60 0e 00 01 00 2f 89
    00000010: 0e
  UrbLink              = 00000000
[112761 ms] UsbSnoop - MyInternalIOCTLCompletion(f76d8126) : fido=85e673d0, Irp=85a2daf0, Context=86a80f80, IRQL=2
[112761 ms]  <<<  URB 224 coming back  <<< 
-- URB_FUNCTION_BULK_OR_INTERRUPT_TRANSFER:
  PipeHandle           = 866db8ec [endpoint 0x00000002]
  TransferFlags        = 00000002 (USBD_TRANSFER_DIRECTION_OUT, USBD_SHORT_TRANSFER_OK)
  TransferBufferLength = 00000011
  TransferBuffer       = 00000000
  TransferBufferMDL    = 86a6e4f0
  UrbLink              = 00000000
[112763 ms] UsbSnoop - MyInternalIOCTLCompletion(f76d8126) : fido=85e673d0, Irp=85a32a50, Context=85b8ca40, IRQL=2
[112763 ms]  <<<  URB 223 coming back  <<< 
-- URB_FUNCTION_BULK_OR_INTERRUPT_TRANSFER:
  PipeHandle           = 866db8cc [endpoint 0x00000081]
  TransferFlags        = 00000003 (USBD_TRANSFER_DIRECTION_IN, USBD_SHORT_TRANSFER_OK)
  TransferBufferLength = 00000012
  TransferBuffer       = 00000000
  TransferBufferMDL    = 86718760
    00000000: 54 fd 64 01 00 ff 64 00 80 11 60 40 02 0a 2f 85
    00000010: 40 60
  UrbLink              = 00000000
[112763 ms] UsbSnoop - FilterDispatchAny(f76d7fd2) : IRP_MJ_INTERNAL_DEVICE_CONTROL
[112763 ms] UsbSnoop - FdoHookDispatchInternalIoctl(f76d81ea) : fdo=861c0730, Irp=85a71af0, IRQL=0
[112763 ms]  >>>  URB 225 going down  >>> 
-- URB_FUNCTION_BULK_OR_INTERRUPT_TRANSFER:
  PipeHandle           = 866db8cc [endpoint 0x00000081]
  TransferFlags        = 00000003 (USBD_TRANSFER_DIRECTION_IN, USBD_SHORT_TRANSFER_OK)
  TransferBufferLength = 00000200
  TransferBuffer       = 00000000
  TransferBufferMDL    = 86a6e4f0
  UrbLink              = 00000000
[112768 ms] UsbSnoop - MyInternalIOCTLCompletion(f76d8126) : fido=85e673d0, Irp=85a71af0, Context=85b8ca40, IRQL=2
[112768 ms]  <<<  URB 225 coming back  <<< 
-- URB_FUNCTION_BULK_OR_INTERRUPT_TRANSFER:
  PipeHandle           = 866db8cc [endpoint 0x00000081]
  TransferFlags        = 00000003 (USBD_TRANSFER_DIRECTION_IN, USBD_SHORT_TRANSFER_OK)
  TransferBufferLength = 00000026
  TransferBuffer       = 00000000
  TransferBufferMDL    = 86a6e4f0
    00000000: 54 fd 64 01 40 60 64 00 80 11 d1 9b 16 00 3e 0b
    00000010: 10 00 13 45 78 65 6d 70 6c 65 73 00 00 00 00 00
    00000020: 00 00 00 14 01 00
  UrbLink              = 00000000
[112768 ms] UsbSnoop - FilterDispatchAny(f76d7fd2) : IRP_MJ_INTERNAL_DEVICE_CONTROL
[112768 ms] UsbSnoop - FdoHookDispatchInternalIoctl(f76d81ea) : fdo=861c0730, Irp=85a2daf0, IRQL=0
[112768 ms]  >>>  URB 226 going down  >>> 
-- URB_FUNCTION_BULK_OR_INTERRUPT_TRANSFER:
  PipeHandle           = 866db8ec [endpoint 0x00000002]
  TransferFlags        = 00000002 (USBD_TRANSFER_DIRECTION_OUT, USBD_SHORT_TRANSFER_OK)
  TransferBufferLength = 00000012
  TransferBuffer       = 00000000
  TransferBufferMDL    = 85a309b8
    00000000: 54 fd 64 00 00 ff 64 01 40 60 11 80 02 0a 3e 94
    00000010: 80 11
  UrbLink              = 00000000
[112769 ms] UsbSnoop - MyInternalIOCTLCompletion(f76d8126) : fido=85e673d0, Irp=85a2daf0, Context=85b8ca40, IRQL=2
[112769 ms]  <<<  URB 226 coming back  <<< 
-- URB_FUNCTION_BULK_OR_INTERRUPT_TRANSFER:
  PipeHandle           = 866db8ec [endpoint 0x00000002]
  TransferFlags        = 00000002 (USBD_TRANSFER_DIRECTION_OUT, USBD_SHORT_TRANSFER_OK)
  TransferBufferLength = 00000012
  TransferBuffer       = 00000000
  TransferBufferMDL    = 85a309b8
  UrbLink              = 00000000
[112769 ms] UsbSnoop - FilterDispatchAny(f76d7fd2) : IRP_MJ_INTERNAL_DEVICE_CONTROL
[112769 ms] UsbSnoop - FdoHookDispatchInternalIoctl(f76d81ea) : fdo=861c0730, Irp=85a71af0, IRQL=0
[112769 ms]  >>>  URB 227 going down  >>> 
-- URB_FUNCTION_BULK_OR_INTERRUPT_TRANSFER:
  PipeHandle           = 866db8cc [endpoint 0x00000081]
  TransferFlags        = 00000003 (USBD_TRANSFER_DIRECTION_IN, USBD_SHORT_TRANSFER_OK)
  TransferBufferLength = 00000200
  TransferBuffer       = 00000000
  TransferBufferMDL    = 86a6e4f0
  UrbLink              = 00000000
[112770 ms] UsbSnoop - FilterDispatchAny(f76d7fd2) : IRP_MJ_INTERNAL_DEVICE_CONTROL
[112770 ms] UsbSnoop - FdoHookDispatchInternalIoctl(f76d81ea) : fdo=861c0730, Irp=85a32a50, IRQL=0
[112770 ms]  >>>  URB 228 going down  >>> 
-- URB_FUNCTION_BULK_OR_INTERRUPT_TRANSFER:
  PipeHandle           = 866db8ec [endpoint 0x00000002]
  TransferFlags        = 00000002 (USBD_TRANSFER_DIRECTION_OUT, USBD_SHORT_TRANSFER_OK)
  TransferBufferLength = 00000011
  TransferBuffer       = 00000000
  TransferBufferMDL    = 85a4dee8
    00000000: 54 fd 64 00 80 11 64 01 40 60 0e 00 01 00 30 8a
    00000010: 0e
  UrbLink              = 00000000
[112770 ms] UsbSnoop - MyInternalIOCTLCompletion(f76d8126) : fido=85e673d0, Irp=85a32a50, Context=86a80f80, IRQL=2
[112770 ms]  <<<  URB 228 coming back  <<< 
-- URB_FUNCTION_BULK_OR_INTERRUPT_TRANSFER:
  PipeHandle           = 866db8ec [endpoint 0x00000002]
  TransferFlags        = 00000002 (USBD_TRANSFER_DIRECTION_OUT, USBD_SHORT_TRANSFER_OK)
  TransferBufferLength = 00000011
  TransferBuffer       = 00000000
  TransferBufferMDL    = 85a4dee8
  UrbLink              = 00000000
[112772 ms] UsbSnoop - MyInternalIOCTLCompletion(f76d8126) : fido=85e673d0, Irp=85a71af0, Context=85b8ca40, IRQL=2
[112772 ms]  <<<  URB 227 coming back  <<< 
-- URB_FUNCTION_BULK_OR_INTERRUPT_TRANSFER:
  PipeHandle           = 866db8cc [endpoint 0x00000081]
  TransferFlags        = 00000003 (USBD_TRANSFER_DIRECTION_IN, USBD_SHORT_TRANSFER_OK)
  TransferBufferLength = 00000012
  TransferBuffer       = 00000000
  TransferBufferMDL    = 86a6e4f0
    00000000: 54 fd 64 01 00 ff 64 00 80 11 60 40 02 0a 30 86
    00000010: 40 60
  UrbLink              = 00000000
[112772 ms] UsbSnoop - FilterDispatchAny(f76d7fd2) : IRP_MJ_INTERNAL_DEVICE_CONTROL
[112772 ms] UsbSnoop - FdoHookDispatchInternalIoctl(f76d81ea) : fdo=861c0730, Irp=85a71af0, IRQL=0
[112772 ms]  >>>  URB 229 going down  >>> 
-- URB_FUNCTION_BULK_OR_INTERRUPT_TRANSFER:
  PipeHandle           = 866db8cc [endpoint 0x00000081]
  TransferFlags        = 00000003 (USBD_TRANSFER_DIRECTION_IN, USBD_SHORT_TRANSFER_OK)
  TransferBufferLength = 00000200
  TransferBuffer       = 00000000
  TransferBufferMDL    = 85a4dee8
  UrbLink              = 00000000
[112776 ms] UsbSnoop - MyInternalIOCTLCompletion(f76d8126) : fido=85e673d0, Irp=85a71af0, Context=85b8ca40, IRQL=2
[112776 ms]  <<<  URB 229 coming back  <<< 
-- URB_FUNCTION_BULK_OR_INTERRUPT_TRANSFER:
  PipeHandle           = 866db8cc [endpoint 0x00000081]
  TransferFlags        = 00000003 (USBD_TRANSFER_DIRECTION_IN, USBD_SHORT_TRANSFER_OK)
  TransferBufferLength = 00000026
  TransferBuffer       = 00000000
  TransferBufferMDL    = 85a4dee8
    00000000: 54 fd 64 01 40 60 64 00 80 11 6b c3 16 00 3f ce
    00000010: 10 00 13 4e 6f 6d 62 72 65 73 00 00 00 00 00 00
    00000020: 00 00 00 1c 01 00
  UrbLink              = 00000000
[112776 ms] UsbSnoop - FilterDispatchAny(f76d7fd2) : IRP_MJ_INTERNAL_DEVICE_CONTROL
[112776 ms] UsbSnoop - FdoHookDispatchInternalIoctl(f76d81ea) : fdo=861c0730, Irp=85a2daf0, IRQL=0
[112776 ms]  >>>  URB 230 going down  >>> 
-- URB_FUNCTION_BULK_OR_INTERRUPT_TRANSFER:
  PipeHandle           = 866db8ec [endpoint 0x00000002]
  TransferFlags        = 00000002 (USBD_TRANSFER_DIRECTION_OUT, USBD_SHORT_TRANSFER_OK)
  TransferBufferLength = 00000012
  TransferBuffer       = 00000000
  TransferBufferMDL    = 85a309b8
    00000000: 54 fd 64 00 00 ff 64 01 40 60 11 80 02 0a 3f 95
    00000010: 80 11
  UrbLink              = 00000000
[112777 ms] UsbSnoop - MyInternalIOCTLCompletion(f76d8126) : fido=85e673d0, Irp=85a2daf0, Context=85b8ca40, IRQL=2
[112777 ms]  <<<  URB 230 coming back  <<< 
-- URB_FUNCTION_BULK_OR_INTERRUPT_TRANSFER:
  PipeHandle           = 866db8ec [endpoint 0x00000002]
  TransferFlags        = 00000002 (USBD_TRANSFER_DIRECTION_OUT, USBD_SHORT_TRANSFER_OK)
  TransferBufferLength = 00000012
  TransferBuffer       = 00000000
  TransferBufferMDL    = 85a309b8
  UrbLink              = 00000000
[112777 ms] UsbSnoop - FilterDispatchAny(f76d7fd2) : IRP_MJ_INTERNAL_DEVICE_CONTROL
[112777 ms] UsbSnoop - FdoHookDispatchInternalIoctl(f76d81ea) : fdo=861c0730, Irp=85a71af0, IRQL=0
[112777 ms]  >>>  URB 231 going down  >>> 
-- URB_FUNCTION_BULK_OR_INTERRUPT_TRANSFER:
  PipeHandle           = 866db8cc [endpoint 0x00000081]
  TransferFlags        = 00000003 (USBD_TRANSFER_DIRECTION_IN, USBD_SHORT_TRANSFER_OK)
  TransferBufferLength = 00000200
  TransferBuffer       = 00000000
  TransferBufferMDL    = 85a4dee8
  UrbLink              = 00000000
[112778 ms] UsbSnoop - FilterDispatchAny(f76d7fd2) : IRP_MJ_INTERNAL_DEVICE_CONTROL
[112778 ms] UsbSnoop - FdoHookDispatchInternalIoctl(f76d81ea) : fdo=861c0730, Irp=85a32a50, IRQL=0
[112778 ms]  >>>  URB 232 going down  >>> 
-- URB_FUNCTION_BULK_OR_INTERRUPT_TRANSFER:
  PipeHandle           = 866db8ec [endpoint 0x00000002]
  TransferFlags        = 00000002 (USBD_TRANSFER_DIRECTION_OUT, USBD_SHORT_TRANSFER_OK)
  TransferBufferLength = 00000011
  TransferBuffer       = 00000000
  TransferBufferMDL    = 85b17aa8
    00000000: 54 fd 64 00 80 11 64 01 40 60 0e 00 01 00 31 8b
    00000010: 0e
  UrbLink              = 00000000
[112778 ms] UsbSnoop - MyInternalIOCTLCompletion(f76d8126) : fido=85e673d0, Irp=85a32a50, Context=86a80f80, IRQL=2
[112778 ms]  <<<  URB 232 coming back  <<< 
-- URB_FUNCTION_BULK_OR_INTERRUPT_TRANSFER:
  PipeHandle           = 866db8ec [endpoint 0x00000002]
  TransferFlags        = 00000002 (USBD_TRANSFER_DIRECTION_OUT, USBD_SHORT_TRANSFER_OK)
  TransferBufferLength = 00000011
  TransferBuffer       = 00000000
  TransferBufferMDL    = 85b17aa8
  UrbLink              = 00000000
[112780 ms] UsbSnoop - MyInternalIOCTLCompletion(f76d8126) : fido=85e673d0, Irp=85a71af0, Context=85b8ca40, IRQL=2
[112780 ms]  <<<  URB 231 coming back  <<< 
-- URB_FUNCTION_BULK_OR_INTERRUPT_TRANSFER:
  PipeHandle           = 866db8cc [endpoint 0x00000081]
  TransferFlags        = 00000003 (USBD_TRANSFER_DIRECTION_IN, USBD_SHORT_TRANSFER_OK)
  TransferBufferLength = 00000012
  TransferBuffer       = 00000000
  TransferBufferMDL    = 85a4dee8
    00000000: 54 fd 64 01 00 ff 64 00 80 11 60 40 02 0a 31 87
    00000010: 40 60
  UrbLink              = 00000000
[112780 ms] UsbSnoop - FilterDispatchAny(f76d7fd2) : IRP_MJ_INTERNAL_DEVICE_CONTROL
[112780 ms] UsbSnoop - FdoHookDispatchInternalIoctl(f76d81ea) : fdo=861c0730, Irp=85a71af0, IRQL=0
[112780 ms]  >>>  URB 233 going down  >>> 
-- URB_FUNCTION_BULK_OR_INTERRUPT_TRANSFER:
  PipeHandle           = 866db8cc [endpoint 0x00000081]
  TransferFlags        = 00000003 (USBD_TRANSFER_DIRECTION_IN, USBD_SHORT_TRANSFER_OK)
  TransferBufferLength = 00000200
  TransferBuffer       = 00000000
  TransferBufferMDL    = 864cc6b0
  UrbLink              = 00000000
[112783 ms] UsbSnoop - MyInternalIOCTLCompletion(f76d8126) : fido=85e673d0, Irp=85a71af0, Context=85b8ca40, IRQL=2
[112783 ms]  <<<  URB 233 coming back  <<< 
-- URB_FUNCTION_BULK_OR_INTERRUPT_TRANSFER:
  PipeHandle           = 866db8cc [endpoint 0x00000081]
  TransferFlags        = 00000003 (USBD_TRANSFER_DIRECTION_IN, USBD_SHORT_TRANSFER_OK)
  TransferBufferLength = 00000012
  TransferBuffer       = 00000000
  TransferBufferMDL    = 864cc6b0
    00000000: 54 fd 64 01 40 60 64 00 80 11 11 ff 02 00 40 9d
    00000010: ff 11
  UrbLink              = 00000000
[112783 ms] UsbSnoop - FilterDispatchAny(f76d7fd2) : IRP_MJ_INTERNAL_DEVICE_CONTROL
[112783 ms] UsbSnoop - FdoHookDispatchInternalIoctl(f76d81ea) : fdo=861c0730, Irp=85a2daf0, IRQL=0
[112783 ms]  >>>  URB 234 going down  >>> 
-- URB_FUNCTION_BULK_OR_INTERRUPT_TRANSFER:
  PipeHandle           = 866db8ec [endpoint 0x00000002]
  TransferFlags        = 00000002 (USBD_TRANSFER_DIRECTION_OUT, USBD_SHORT_TRANSFER_OK)
  TransferBufferLength = 00000012
  TransferBuffer       = 00000000
  TransferBufferMDL    = 85a309b8
    00000000: 54 fd 64 00 00 ff 64 01 40 60 11 80 02 0a 40 96
    00000010: 80 11
  UrbLink              = 00000000
[112784 ms] UsbSnoop - MyInternalIOCTLCompletion(f76d8126) : fido=85e673d0, Irp=85a2daf0, Context=85b8ca40, IRQL=2
[112784 ms]  <<<  URB 234 coming back  <<< 
-- URB_FUNCTION_BULK_OR_INTERRUPT_TRANSFER:
  PipeHandle           = 866db8ec [endpoint 0x00000002]
  TransferFlags        = 00000002 (USBD_TRANSFER_DIRECTION_OUT, USBD_SHORT_TRANSFER_OK)
  TransferBufferLength = 00000012
  TransferBuffer       = 00000000
  TransferBufferMDL    = 85a309b8
  UrbLink              = 00000000
[112784 ms] UsbSnoop - FilterDispatchAny(f76d7fd2) : IRP_MJ_INTERNAL_DEVICE_CONTROL
[112784 ms] UsbSnoop - FdoHookDispatchInternalIoctl(f76d81ea) : fdo=861c0730, Irp=85a71af0, IRQL=0
[112784 ms]  >>>  URB 235 going down  >>> 
-- URB_FUNCTION_BULK_OR_INTERRUPT_TRANSFER:
  PipeHandle           = 866db8cc [endpoint 0x00000081]
  TransferFlags        = 00000003 (USBD_TRANSFER_DIRECTION_IN, USBD_SHORT_TRANSFER_OK)
  TransferBufferLength = 00000200
  TransferBuffer       = 00000000
  TransferBufferMDL    = 864cc6b0
  UrbLink              = 00000000
[112784 ms] UsbSnoop - FilterDispatchAny(f76d7fd2) : IRP_MJ_INTERNAL_DEVICE_CONTROL
[112784 ms] UsbSnoop - FdoHookDispatchInternalIoctl(f76d81ea) : fdo=861c0730, Irp=85a2daf0, IRQL=0
[112784 ms]  >>>  URB 236 going down  >>> 
-- URB_FUNCTION_BULK_OR_INTERRUPT_TRANSFER:
  PipeHandle           = 866db8ec [endpoint 0x00000002]
  TransferFlags        = 00000002 (USBD_TRANSFER_DIRECTION_OUT, USBD_SHORT_TRANSFER_OK)
  TransferBufferLength = 00000011
  TransferBuffer       = 00000000
  TransferBufferMDL    = 85b0ba48
    00000000: 54 fd 64 00 80 11 64 01 40 60 0f 00 01 00 32 8d
    00000010: 0f
  UrbLink              = 00000000
[112785 ms] UsbSnoop - MyInternalIOCTLCompletion(f76d8126) : fido=85e673d0, Irp=85a2daf0, Context=86a80f80, IRQL=2
[112785 ms]  <<<  URB 236 coming back  <<< 
-- URB_FUNCTION_BULK_OR_INTERRUPT_TRANSFER:
  PipeHandle           = 866db8ec [endpoint 0x00000002]
  TransferFlags        = 00000002 (USBD_TRANSFER_DIRECTION_OUT, USBD_SHORT_TRANSFER_OK)
  TransferBufferLength = 00000011
  TransferBuffer       = 00000000
  TransferBufferMDL    = 85b0ba48
  UrbLink              = 00000000
[112787 ms] UsbSnoop - MyInternalIOCTLCompletion(f76d8126) : fido=85e673d0, Irp=85a71af0, Context=85b8ca40, IRQL=2
[112787 ms]  <<<  URB 235 coming back  <<< 
-- URB_FUNCTION_BULK_OR_INTERRUPT_TRANSFER:
  PipeHandle           = 866db8cc [endpoint 0x00000081]
  TransferFlags        = 00000003 (USBD_TRANSFER_DIRECTION_IN, USBD_SHORT_TRANSFER_OK)
  TransferBufferLength = 00000012
  TransferBuffer       = 00000000
  TransferBufferMDL    = 864cc6b0
    00000000: 54 fd 64 01 00 ff 64 00 80 11 60 40 02 0a 32 88
    00000010: 40 60
  UrbLink              = 00000000
[112787 ms] UsbSnoop - FilterDispatchAny(f76d7fd2) : IRP_MJ_INTERNAL_DEVICE_CONTROL
[112787 ms] UsbSnoop - FdoHookDispatchInternalIoctl(f76d81ea) : fdo=861c0730, Irp=85a71af0, IRQL=0
[112787 ms]  >>>  URB 237 going down  >>> 
-- URB_FUNCTION_BULK_OR_INTERRUPT_TRANSFER:
  PipeHandle           = 866db8cc [endpoint 0x00000081]
  TransferFlags        = 00000003 (USBD_TRANSFER_DIRECTION_IN, USBD_SHORT_TRANSFER_OK)
  TransferBufferLength = 00000200
  TransferBuffer       = 00000000
  TransferBufferMDL    = 85b0ba48
  UrbLink              = 00000000
[112790 ms] UsbSnoop - MyInternalIOCTLCompletion(f76d8126) : fido=85e673d0, Irp=85a71af0, Context=85b8ca40, IRQL=2
[112790 ms]  <<<  URB 237 coming back  <<< 
-- URB_FUNCTION_BULK_OR_INTERRUPT_TRANSFER:
  PipeHandle           = 866db8cc [endpoint 0x00000081]
  TransferFlags        = 00000003 (USBD_TRANSFER_DIRECTION_IN, USBD_SHORT_TRANSFER_OK)
  TransferBufferLength = 00000012
  TransferBuffer       = 00000000
  TransferBufferMDL    = 85b0ba48
    00000000: 54 fd 64 01 40 60 64 00 80 11 00 ff 02 00 41 8d
    00000010: ff 00
  UrbLink              = 00000000
[112790 ms] UsbSnoop - FilterDispatchAny(f76d7fd2) : IRP_MJ_INTERNAL_DEVICE_CONTROL
[112790 ms] UsbSnoop - FdoHookDispatchInternalIoctl(f76d81ea) : fdo=861c0730, Irp=85a2daf0, IRQL=0
[112790 ms]  >>>  URB 238 going down  >>> 
-- URB_FUNCTION_BULK_OR_INTERRUPT_TRANSFER:
  PipeHandle           = 866db8ec [endpoint 0x00000002]
  TransferFlags        = 00000002 (USBD_TRANSFER_DIRECTION_OUT, USBD_SHORT_TRANSFER_OK)
  TransferBufferLength = 00000012
  TransferBuffer       = 00000000
  TransferBufferMDL    = 85a309b8
    00000000: 54 fd 64 00 00 ff 64 01 40 60 11 80 02 0a 41 97
    00000010: 80 11
  UrbLink              = 00000000
[112791 ms] UsbSnoop - MyInternalIOCTLCompletion(f76d8126) : fido=85e673d0, Irp=85a2daf0, Context=85b8ca40, IRQL=2
[112791 ms]  <<<  URB 238 coming back  <<< 
-- URB_FUNCTION_BULK_OR_INTERRUPT_TRANSFER:
  PipeHandle           = 866db8ec [endpoint 0x00000002]
  TransferFlags        = 00000002 (USBD_TRANSFER_DIRECTION_OUT, USBD_SHORT_TRANSFER_OK)
  TransferBufferLength = 00000012
  TransferBuffer       = 00000000
  TransferBufferMDL    = 85a309b8
  UrbLink              = 00000000
[112791 ms] UsbSnoop - FilterDispatchAny(f76d7fd2) : IRP_MJ_INTERNAL_DEVICE_CONTROL
[112791 ms] UsbSnoop - FdoHookDispatchInternalIoctl(f76d81ea) : fdo=861c0730, Irp=85a71af0, IRQL=0
[112791 ms]  >>>  URB 239 going down  >>> 
-- URB_FUNCTION_BULK_OR_INTERRUPT_TRANSFER:
  PipeHandle           = 866db8cc [endpoint 0x00000081]
  TransferFlags        = 00000003 (USBD_TRANSFER_DIRECTION_IN, USBD_SHORT_TRANSFER_OK)
  TransferBufferLength = 00000200
  TransferBuffer       = 00000000
  TransferBufferMDL    = 85b0ba48
  UrbLink              = 00000000
[112792 ms] UsbSnoop - FilterDispatchAny(f76d7fd2) : IRP_MJ_INTERNAL_DEVICE_CONTROL
[112792 ms] UsbSnoop - FdoHookDispatchInternalIoctl(f76d81ea) : fdo=861c0730, Irp=85a32a50, IRQL=0
[112792 ms]  >>>  URB 240 going down  >>> 
-- URB_FUNCTION_BULK_OR_INTERRUPT_TRANSFER:
  PipeHandle           = 866db8ec [endpoint 0x00000002]
  TransferFlags        = 00000002 (USBD_TRANSFER_DIRECTION_OUT, USBD_SHORT_TRANSFER_OK)
  TransferBufferLength = 00000012
  TransferBuffer       = 00000000
  TransferBufferMDL    = 86b2fb78
    00000000: 54 fd 64 00 40 de 64 01 40 60 11 80 02 00 33 9e
    00000010: 80 11
  UrbLink              = 00000000
[112792 ms] UsbSnoop - MyInternalIOCTLCompletion(f76d8126) : fido=85e673d0, Irp=85a32a50, Context=86a80f80, IRQL=2
[112792 ms]  <<<  URB 240 coming back  <<< 
-- URB_FUNCTION_BULK_OR_INTERRUPT_TRANSFER:
  PipeHandle           = 866db8ec [endpoint 0x00000002]
  TransferFlags        = 00000002 (USBD_TRANSFER_DIRECTION_OUT, USBD_SHORT_TRANSFER_OK)
  TransferBufferLength = 00000012
  TransferBuffer       = 00000000
  TransferBufferMDL    = 86b2fb78
  UrbLink              = 00000000
[112794 ms] UsbSnoop - MyInternalIOCTLCompletion(f76d8126) : fido=85e673d0, Irp=85a71af0, Context=85b8ca40, IRQL=2
[112794 ms]  <<<  URB 239 coming back  <<< 
-- URB_FUNCTION_BULK_OR_INTERRUPT_TRANSFER:
  PipeHandle           = 866db8cc [endpoint 0x00000081]
  TransferFlags        = 00000003 (USBD_TRANSFER_DIRECTION_IN, USBD_SHORT_TRANSFER_OK)
  TransferBufferLength = 00000012
  TransferBuffer       = 00000000
  TransferBufferMDL    = 85b0ba48
    00000000: 54 fd 64 01 00 ff 64 00 80 11 60 40 02 0a 33 89
    00000010: 40 60
  UrbLink              = 00000000
[112794 ms] UsbSnoop - FilterDispatchAny(f76d7fd2) : IRP_MJ_INTERNAL_DEVICE_CONTROL
[112794 ms] UsbSnoop - FdoHookDispatchInternalIoctl(f76d81ea) : fdo=861c0730, Irp=85a71af0, IRQL=0
[112794 ms]  >>>  URB 241 going down  >>> 
-- URB_FUNCTION_BULK_OR_INTERRUPT_TRANSFER:
  PipeHandle           = 866db8cc [endpoint 0x00000081]
  TransferFlags        = 00000003 (USBD_TRANSFER_DIRECTION_IN, USBD_SHORT_TRANSFER_OK)
  TransferBufferLength = 00000200
  TransferBuffer       = 00000000
  TransferBufferMDL    = 86b2fb78
  UrbLink              = 00000000
[116869 ms] UsbSnoop - FilterDispatchAny(f76d7fd2) : IRP_MJ_INTERNAL_DEVICE_CONTROL
[116869 ms] UsbSnoop - FdoHookDispatchInternalIoctl(f76d81ea) : fdo=861c0730, Irp=869c7cb0, IRQL=0
[116869 ms]  >>>  URB 242 going down  >>> 
-- URB_FUNCTION_BULK_OR_INTERRUPT_TRANSFER:
  PipeHandle           = 866db8ec [endpoint 0x00000002]
  TransferFlags        = 00000002 (USBD_TRANSFER_DIRECTION_OUT, USBD_SHORT_TRANSFER_OK)
  TransferBufferLength = 00000011
  TransferBuffer       = 00000000
  TransferBufferMDL    = 86336228
    00000000: 54 fd 64 00 80 14 64 01 40 20 01 00 01 00 34 44
    00000010: 01
  UrbLink              = 00000000
[116870 ms] UsbSnoop - MyInternalIOCTLCompletion(f76d8126) : fido=85e673d0, Irp=869c7cb0, Context=86a80f80, IRQL=2
[116870 ms]  <<<  URB 242 coming back  <<< 
-- URB_FUNCTION_BULK_OR_INTERRUPT_TRANSFER:
  PipeHandle           = 866db8ec [endpoint 0x00000002]
  TransferFlags        = 00000002 (USBD_TRANSFER_DIRECTION_OUT, USBD_SHORT_TRANSFER_OK)
  TransferBufferLength = 00000011
  TransferBuffer       = 00000000
  TransferBufferMDL    = 86336228
  UrbLink              = 00000000
[116871 ms] UsbSnoop - MyInternalIOCTLCompletion(f76d8126) : fido=85e673d0, Irp=85a71af0, Context=85b8ca40, IRQL=2
[116871 ms]  <<<  URB 241 coming back  <<< 
-- URB_FUNCTION_BULK_OR_INTERRUPT_TRANSFER:
  PipeHandle           = 866db8cc [endpoint 0x00000081]
  TransferFlags        = 00000003 (USBD_TRANSFER_DIRECTION_IN, USBD_SHORT_TRANSFER_OK)
  TransferBufferLength = 00000012
  TransferBuffer       = 00000000
  TransferBufferMDL    = 86b2fb78
    00000000: 54 fd 64 01 00 ff 64 00 80 14 20 40 02 0a 34 4d
    00000010: 40 20
  UrbLink              = 00000000
[116871 ms] UsbSnoop - FilterDispatchAny(f76d7fd2) : IRP_MJ_INTERNAL_DEVICE_CONTROL
[116871 ms] UsbSnoop - FdoHookDispatchInternalIoctl(f76d81ea) : fdo=861c0730, Irp=869c7cb0, IRQL=0
[116871 ms]  >>>  URB 243 going down  >>> 
-- URB_FUNCTION_BULK_OR_INTERRUPT_TRANSFER:
  PipeHandle           = 866db8cc [endpoint 0x00000081]
  TransferFlags        = 00000003 (USBD_TRANSFER_DIRECTION_IN, USBD_SHORT_TRANSFER_OK)
  TransferBufferLength = 00000200
  TransferBuffer       = 00000000
  TransferBufferMDL    = 86abce70
  UrbLink              = 00000000
[116883 ms] UsbSnoop - MyInternalIOCTLCompletion(f76d8126) : fido=85e673d0, Irp=869c7cb0, Context=85b8ca40, IRQL=2
[116883 ms]  <<<  URB 243 coming back  <<< 
-- URB_FUNCTION_BULK_OR_INTERRUPT_TRANSFER:
  PipeHandle           = 866db8cc [endpoint 0x00000081]
  TransferFlags        = 00000003 (USBD_TRANSFER_DIRECTION_IN, USBD_SHORT_TRANSFER_OK)
  TransferBufferLength = 0000007f
  TransferBuffer       = 00000000
  TransferBufferMDL    = 86abce70
    00000000: 54 fd 64 01 40 20 64 00 80 14 78 48 6f 00 42 7f
    00000010: 01 00 00 00 00 01 65 42 00 00 00 00 00 01 be 00
    00000020: 00 00 00 00 00 01 4f a7 88 00 00 00 00 01 83 5f
    00000030: 2c 7f 00 00 5a 01 01 24 25 01 01 22 d4 01 01 23
    00000040: 15 00 00 00 00 00 02 00 00 00 00 01 40 00 f0 04
    00000050: 00 1e 30 30 30 30 34 42 43 31 42 31 30 45 35 37
    00000060: 30 46 00 30 45 30 30 30 30 30 34 42 43 31 42 31
    00000070: 30 45 35 37 30 46 43 42 32 38 30 34 46 31 00
  UrbLink              = 00000000
[116883 ms] UsbSnoop - FilterDispatchAny(f76d7fd2) : IRP_MJ_INTERNAL_DEVICE_CONTROL
[116883 ms] UsbSnoop - FdoHookDispatchInternalIoctl(f76d81ea) : fdo=861c0730, Irp=85a32a50, IRQL=0
[116883 ms]  >>>  URB 244 going down  >>> 
-- URB_FUNCTION_BULK_OR_INTERRUPT_TRANSFER:
  PipeHandle           = 866db8ec [endpoint 0x00000002]
  TransferFlags        = 00000002 (USBD_TRANSFER_DIRECTION_OUT, USBD_SHORT_TRANSFER_OK)
  TransferBufferLength = 00000012
  TransferBuffer       = 00000000
  TransferBufferMDL    = 86abce70
    00000000: 54 fd 64 00 00 ff 64 01 40 20 14 80 02 0a 42 5b
    00000010: 80 14
  UrbLink              = 00000000
[116884 ms] UsbSnoop - MyInternalIOCTLCompletion(f76d8126) : fido=85e673d0, Irp=85a32a50, Context=85b8ca40, IRQL=2
[116884 ms]  <<<  URB 244 coming back  <<< 
-- URB_FUNCTION_BULK_OR_INTERRUPT_TRANSFER:
  PipeHandle           = 866db8ec [endpoint 0x00000002]
  TransferFlags        = 00000002 (USBD_TRANSFER_DIRECTION_OUT, USBD_SHORT_TRANSFER_OK)
  TransferBufferLength = 00000012
  TransferBuffer       = 00000000
  TransferBufferMDL    = 86abce70
  UrbLink              = 00000000
[116884 ms] UsbSnoop - FilterDispatchAny(f76d7fd2) : IRP_MJ_INTERNAL_DEVICE_CONTROL
[116884 ms] UsbSnoop - FdoHookDispatchInternalIoctl(f76d81ea) : fdo=861c0730, Irp=85a32a50, IRQL=0
[116884 ms]  >>>  URB 245 going down  >>> 
-- URB_FUNCTION_BULK_OR_INTERRUPT_TRANSFER:
  PipeHandle           = 866db8cc [endpoint 0x00000081]
  TransferFlags        = 00000003 (USBD_TRANSFER_DIRECTION_IN, USBD_SHORT_TRANSFER_OK)
  TransferBufferLength = 00000200
  TransferBuffer       = 00000000
  TransferBufferMDL    = 86abce70
  UrbLink              = 00000000
[116884 ms] UsbSnoop - FilterDispatchAny(f76d7fd2) : IRP_MJ_INTERNAL_DEVICE_CONTROL
[116884 ms] UsbSnoop - FdoHookDispatchInternalIoctl(f76d81ea) : fdo=861c0730, Irp=85a2daf0, IRQL=0
[116884 ms]  >>>  URB 246 going down  >>> 
-- URB_FUNCTION_BULK_OR_INTERRUPT_TRANSFER:
  PipeHandle           = 866db8ec [endpoint 0x00000002]
  TransferFlags        = 00000002 (USBD_TRANSFER_DIRECTION_OUT, USBD_SHORT_TRANSFER_OK)
  TransferBufferLength = 00000011
  TransferBuffer       = 00000000
  TransferBufferMDL    = 86a0d728
    00000000: 54 fd 64 00 80 14 64 01 40 20 02 00 01 00 35 46
    00000010: 02
  UrbLink              = 00000000
[116885 ms] UsbSnoop - MyInternalIOCTLCompletion(f76d8126) : fido=85e673d0, Irp=85a2daf0, Context=86a80f80, IRQL=2
[116885 ms]  <<<  URB 246 coming back  <<< 
-- URB_FUNCTION_BULK_OR_INTERRUPT_TRANSFER:
  PipeHandle           = 866db8ec [endpoint 0x00000002]
  TransferFlags        = 00000002 (USBD_TRANSFER_DIRECTION_OUT, USBD_SHORT_TRANSFER_OK)
  TransferBufferLength = 00000011
  TransferBuffer       = 00000000
  TransferBufferMDL    = 86a0d728
  UrbLink              = 00000000
[116886 ms] UsbSnoop - MyInternalIOCTLCompletion(f76d8126) : fido=85e673d0, Irp=85a32a50, Context=85b8ca40, IRQL=2
[116886 ms]  <<<  URB 245 coming back  <<< 
-- URB_FUNCTION_BULK_OR_INTERRUPT_TRANSFER:
  PipeHandle           = 866db8cc [endpoint 0x00000081]
  TransferFlags        = 00000003 (USBD_TRANSFER_DIRECTION_IN, USBD_SHORT_TRANSFER_OK)
  TransferBufferLength = 00000012
  TransferBuffer       = 00000000
  TransferBufferMDL    = 86abce70
    00000000: 54 fd 64 01 00 ff 64 00 80 14 20 40 02 0a 35 4e
    00000010: 40 20
  UrbLink              = 00000000
[116886 ms] UsbSnoop - FilterDispatchAny(f76d7fd2) : IRP_MJ_INTERNAL_DEVICE_CONTROL
[116886 ms] UsbSnoop - FdoHookDispatchInternalIoctl(f76d81ea) : fdo=861c0730, Irp=85a32a50, IRQL=0
[116886 ms]  >>>  URB 247 going down  >>> 
-- URB_FUNCTION_BULK_OR_INTERRUPT_TRANSFER:
  PipeHandle           = 866db8cc [endpoint 0x00000081]
  TransferFlags        = 00000003 (USBD_TRANSFER_DIRECTION_IN, USBD_SHORT_TRANSFER_OK)
  TransferBufferLength = 00000200
  TransferBuffer       = 00000000
  TransferBufferMDL    = 869b4d68
  UrbLink              = 00000000
[116891 ms] UsbSnoop - MyInternalIOCTLCompletion(f76d8126) : fido=85e673d0, Irp=85a32a50, Context=85b8ca40, IRQL=2
[116891 ms]  <<<  URB 247 coming back  <<< 
-- URB_FUNCTION_BULK_OR_INTERRUPT_TRANSFER:
  PipeHandle           = 866db8cc [endpoint 0x00000081]
  TransferFlags        = 00000003 (USBD_TRANSFER_DIRECTION_IN, USBD_SHORT_TRANSFER_OK)
  TransferBufferLength = 0000001b
  TransferBuffer       = 00000000
  TransferBufferMDL    = 869b4d68
    00000000: 54 fd 64 01 40 20 64 00 80 14 38 5a 0b 00 43 ee
    00000010: 02 54 49 2d 4e 73 70 69 72 65 00
  UrbLink              = 00000000
[116891 ms] UsbSnoop - FilterDispatchAny(f76d7fd2) : IRP_MJ_INTERNAL_DEVICE_CONTROL
[116891 ms] UsbSnoop - FdoHookDispatchInternalIoctl(f76d81ea) : fdo=861c0730, Irp=85a32a50, IRQL=0
[116891 ms]  >>>  URB 248 going down  >>> 
-- URB_FUNCTION_BULK_OR_INTERRUPT_TRANSFER:
  PipeHandle           = 866db8ec [endpoint 0x00000002]
  TransferFlags        = 00000002 (USBD_TRANSFER_DIRECTION_OUT, USBD_SHORT_TRANSFER_OK)
  TransferBufferLength = 00000012
  TransferBuffer       = 00000000
  TransferBufferMDL    = 86544868
    00000000: 54 fd 64 00 00 ff 64 01 40 20 14 80 02 0a 43 5c
    00000010: 80 14
  UrbLink              = 00000000
[116892 ms] UsbSnoop - MyInternalIOCTLCompletion(f76d8126) : fido=85e673d0, Irp=85a32a50, Context=85b8ca40, IRQL=2
[116892 ms]  <<<  URB 248 coming back  <<< 
-- URB_FUNCTION_BULK_OR_INTERRUPT_TRANSFER:
  PipeHandle           = 866db8ec [endpoint 0x00000002]
  TransferFlags        = 00000002 (USBD_TRANSFER_DIRECTION_OUT, USBD_SHORT_TRANSFER_OK)
  TransferBufferLength = 00000012
  TransferBuffer       = 00000000
  TransferBufferMDL    = 86544868
  UrbLink              = 00000000
[116892 ms] UsbSnoop - FilterDispatchAny(f76d7fd2) : IRP_MJ_INTERNAL_DEVICE_CONTROL
[116892 ms] UsbSnoop - FdoHookDispatchInternalIoctl(f76d81ea) : fdo=861c0730, Irp=85a2daf0, IRQL=0
[116892 ms]  >>>  URB 249 going down  >>> 
-- URB_FUNCTION_BULK_OR_INTERRUPT_TRANSFER:
  PipeHandle           = 866db8ec [endpoint 0x00000002]
  TransferFlags        = 00000002 (USBD_TRANSFER_DIRECTION_OUT, USBD_SHORT_TRANSFER_OK)
  TransferBufferLength = 00000011
  TransferBuffer       = 00000000
  TransferBufferMDL    = 869b4d68
    00000000: 54 fd 64 00 80 14 64 01 40 20 03 00 01 00 36 48
    00000010: 03
  UrbLink              = 00000000
[116892 ms] UsbSnoop - FilterDispatchAny(f76d7fd2) : IRP_MJ_INTERNAL_DEVICE_CONTROL
[116892 ms] UsbSnoop - FdoHookDispatchInternalIoctl(f76d81ea) : fdo=861c0730, Irp=85a69b18, IRQL=0
[116892 ms]  >>>  URB 250 going down  >>> 
-- URB_FUNCTION_BULK_OR_INTERRUPT_TRANSFER:
  PipeHandle           = 866db8cc [endpoint 0x00000081]
  TransferFlags        = 00000003 (USBD_TRANSFER_DIRECTION_IN, USBD_SHORT_TRANSFER_OK)
  TransferBufferLength = 00000200
  TransferBuffer       = 00000000
  TransferBufferMDL    = 86b2fb78
  UrbLink              = 00000000
[116893 ms] UsbSnoop - MyInternalIOCTLCompletion(f76d8126) : fido=85e673d0, Irp=85a2daf0, Context=85b8ca40, IRQL=2
[116893 ms]  <<<  URB 249 coming back  <<< 
-- URB_FUNCTION_BULK_OR_INTERRUPT_TRANSFER:
  PipeHandle           = 866db8ec [endpoint 0x00000002]
  TransferFlags        = 00000002 (USBD_TRANSFER_DIRECTION_OUT, USBD_SHORT_TRANSFER_OK)
  TransferBufferLength = 00000011
  TransferBuffer       = 00000000
  TransferBufferMDL    = 869b4d68
  UrbLink              = 00000000
[116895 ms] UsbSnoop - MyInternalIOCTLCompletion(f76d8126) : fido=85e673d0, Irp=85a69b18, Context=86a80f80, IRQL=2
[116895 ms]  <<<  URB 250 coming back  <<< 
-- URB_FUNCTION_BULK_OR_INTERRUPT_TRANSFER:
  PipeHandle           = 866db8cc [endpoint 0x00000081]
  TransferFlags        = 00000003 (USBD_TRANSFER_DIRECTION_IN, USBD_SHORT_TRANSFER_OK)
  TransferBufferLength = 00000012
  TransferBuffer       = 00000000
  TransferBufferMDL    = 86b2fb78
    00000000: 54 fd 64 01 00 ff 64 00 80 14 20 40 02 0a 36 4f
    00000010: 40 20
  UrbLink              = 00000000
[116895 ms] UsbSnoop - FilterDispatchAny(f76d7fd2) : IRP_MJ_INTERNAL_DEVICE_CONTROL
[116895 ms] UsbSnoop - FdoHookDispatchInternalIoctl(f76d81ea) : fdo=861c0730, Irp=85a69b18, IRQL=0
[116895 ms]  >>>  URB 251 going down  >>> 
-- URB_FUNCTION_BULK_OR_INTERRUPT_TRANSFER:
  PipeHandle           = 866db8cc [endpoint 0x00000081]
  TransferFlags        = 00000003 (USBD_TRANSFER_DIRECTION_IN, USBD_SHORT_TRANSFER_OK)
  TransferBufferLength = 00000200
  TransferBuffer       = 00000000
  TransferBufferMDL    = 869b4d68
  UrbLink              = 00000000
[116899 ms] UsbSnoop - MyInternalIOCTLCompletion(f76d8126) : fido=85e673d0, Irp=85a69b18, Context=86a80f80, IRQL=2
[116899 ms]  <<<  URB 251 coming back  <<< 
-- URB_FUNCTION_BULK_OR_INTERRUPT_TRANSFER:
  PipeHandle           = 866db8cc [endpoint 0x00000081]
  TransferFlags        = 00000003 (USBD_TRANSFER_DIRECTION_IN, USBD_SHORT_TRANSFER_OK)
  TransferBufferLength = 0000001b
  TransferBuffer       = 00000000
  TransferBufferMDL    = 869b4d68
    00000000: 54 fd 64 01 40 20 64 00 80 14 96 7f 0b 00 44 72
    00000010: 03 2e 74 6e 73 00 2e 74 6e 6f 00
  UrbLink              = 00000000
[116899 ms] UsbSnoop - FilterDispatchAny(f76d7fd2) : IRP_MJ_INTERNAL_DEVICE_CONTROL
[116899 ms] UsbSnoop - FdoHookDispatchInternalIoctl(f76d81ea) : fdo=861c0730, Irp=85a69b18, IRQL=0
[116899 ms]  >>>  URB 252 going down  >>> 
-- URB_FUNCTION_BULK_OR_INTERRUPT_TRANSFER:
  PipeHandle           = 866db8ec [endpoint 0x00000002]
  TransferFlags        = 00000002 (USBD_TRANSFER_DIRECTION_OUT, USBD_SHORT_TRANSFER_OK)
  TransferBufferLength = 00000012
  TransferBuffer       = 00000000
  TransferBufferMDL    = 869b4d68
    00000000: 54 fd 64 00 00 ff 64 01 40 20 14 80 02 0a 44 5d
    00000010: 80 14
  UrbLink              = 00000000
[116900 ms] UsbSnoop - MyInternalIOCTLCompletion(f76d8126) : fido=85e673d0, Irp=85a69b18, Context=86a80f80, IRQL=2
[116900 ms]  <<<  URB 252 coming back  <<< 
-- URB_FUNCTION_BULK_OR_INTERRUPT_TRANSFER:
  PipeHandle           = 866db8ec [endpoint 0x00000002]
  TransferFlags        = 00000002 (USBD_TRANSFER_DIRECTION_OUT, USBD_SHORT_TRANSFER_OK)
  TransferBufferLength = 00000012
  TransferBuffer       = 00000000
  TransferBufferMDL    = 869b4d68
  UrbLink              = 00000000
[116900 ms] UsbSnoop - FilterDispatchAny(f76d7fd2) : IRP_MJ_INTERNAL_DEVICE_CONTROL
[116900 ms] UsbSnoop - FdoHookDispatchInternalIoctl(f76d81ea) : fdo=861c0730, Irp=85a2daf0, IRQL=0
[116900 ms]  >>>  URB 253 going down  >>> 
-- URB_FUNCTION_BULK_OR_INTERRUPT_TRANSFER:
  PipeHandle           = 866db8ec [endpoint 0x00000002]
  TransferFlags        = 00000002 (USBD_TRANSFER_DIRECTION_OUT, USBD_SHORT_TRANSFER_OK)
  TransferBufferLength = 00000012
  TransferBuffer       = 00000000
  TransferBufferMDL    = 86544868
    00000000: 54 fd 64 00 40 de 64 01 40 20 14 80 02 00 37 65
    00000010: 80 14
  UrbLink              = 00000000
[116900 ms] UsbSnoop - FilterDispatchAny(f76d7fd2) : IRP_MJ_INTERNAL_DEVICE_CONTROL
[116900 ms] UsbSnoop - FdoHookDispatchInternalIoctl(f76d81ea) : fdo=861c0730, Irp=85a6dcd8, IRQL=0
[116900 ms]  >>>  URB 254 going down  >>> 
-- URB_FUNCTION_BULK_OR_INTERRUPT_TRANSFER:
  PipeHandle           = 866db8cc [endpoint 0x00000081]
  TransferFlags        = 00000003 (USBD_TRANSFER_DIRECTION_IN, USBD_SHORT_TRANSFER_OK)
  TransferBufferLength = 00000200
  TransferBuffer       = 00000000
  TransferBufferMDL    = 85b0ba48
  UrbLink              = 00000000
[116901 ms] UsbSnoop - MyInternalIOCTLCompletion(f76d8126) : fido=85e673d0, Irp=85a2daf0, Context=86a80f80, IRQL=2
[116901 ms]  <<<  URB 253 coming back  <<< 
-- URB_FUNCTION_BULK_OR_INTERRUPT_TRANSFER:
  PipeHandle           = 866db8ec [endpoint 0x00000002]
  TransferFlags        = 00000002 (USBD_TRANSFER_DIRECTION_OUT, USBD_SHORT_TRANSFER_OK)
  TransferBufferLength = 00000012
  TransferBuffer       = 00000000
  TransferBufferMDL    = 86544868
  UrbLink              = 00000000
[116903 ms] UsbSnoop - MyInternalIOCTLCompletion(f76d8126) : fido=85e673d0, Irp=85a6dcd8, Context=85b8ca40, IRQL=2
[116903 ms]  <<<  URB 254 coming back  <<< 
-- URB_FUNCTION_BULK_OR_INTERRUPT_TRANSFER:
  PipeHandle           = 866db8cc [endpoint 0x00000081]
  TransferFlags        = 00000003 (USBD_TRANSFER_DIRECTION_IN, USBD_SHORT_TRANSFER_OK)
  TransferBufferLength = 00000012
  TransferBuffer       = 00000000
  TransferBufferMDL    = 85b0ba48
    00000000: 54 fd 64 01 00 ff 64 00 80 14 20 40 02 0a 37 50
    00000010: 40 20
  UrbLink              = 00000000
[116903 ms] UsbSnoop - FilterDispatchAny(f76d7fd2) : IRP_MJ_INTERNAL_DEVICE_CONTROL
[116903 ms] UsbSnoop - FdoHookDispatchInternalIoctl(f76d81ea) : fdo=861c0730, Irp=85a6dcd8, IRQL=0
[116903 ms]  >>>  URB 255 going down  >>> 
-- URB_FUNCTION_BULK_OR_INTERRUPT_TRANSFER:
  PipeHandle           = 866db8cc [endpoint 0x00000081]
  TransferFlags        = 00000003 (USBD_TRANSFER_DIRECTION_IN, USBD_SHORT_TRANSFER_OK)
  TransferBufferLength = 00000200
  TransferBuffer       = 00000000
  TransferBufferMDL    = 86b2fb78
  UrbLink              = 00000000
[116906 ms] UsbSnoop - FilterDispatchAny(f76d7fd2) : IRP_MJ_INTERNAL_DEVICE_CONTROL
[116906 ms] UsbSnoop - FdoHookDispatchInternalIoctl(f76d81ea) : fdo=861c0730, Irp=85a2daf0, IRQL=0
[116906 ms]  >>>  URB 256 going down  >>> 
-- URB_FUNCTION_BULK_OR_INTERRUPT_TRANSFER:
  PipeHandle           = 866db8ec [endpoint 0x00000002]
  TransferFlags        = 00000002 (USBD_TRANSFER_DIRECTION_OUT, USBD_SHORT_TRANSFER_OK)
  TransferBufferLength = 00000012
  TransferBuffer       = 00000000
  TransferBufferMDL    = 86544868
    00000000: 54 fd 64 00 40 de 64 01 40 20 13 80 02 00 38 65
    00000010: 80 13
  UrbLink              = 00000000
[116907 ms] UsbSnoop - MyInternalIOCTLCompletion(f76d8126) : fido=85e673d0, Irp=85a2daf0, Context=86a80f80, IRQL=2
[116907 ms]  <<<  URB 256 coming back  <<< 
-- URB_FUNCTION_BULK_OR_INTERRUPT_TRANSFER:
  PipeHandle           = 866db8ec [endpoint 0x00000002]
  TransferFlags        = 00000002 (USBD_TRANSFER_DIRECTION_OUT, USBD_SHORT_TRANSFER_OK)
  TransferBufferLength = 00000012
  TransferBuffer       = 00000000
  TransferBufferMDL    = 86544868
  UrbLink              = 00000000
[116908 ms] UsbSnoop - MyInternalIOCTLCompletion(f76d8126) : fido=85e673d0, Irp=85a6dcd8, Context=85b8ca40, IRQL=2
[116908 ms]  <<<  URB 255 coming back  <<< 
-- URB_FUNCTION_BULK_OR_INTERRUPT_TRANSFER:
  PipeHandle           = 866db8cc [endpoint 0x00000081]
  TransferFlags        = 00000003 (USBD_TRANSFER_DIRECTION_IN, USBD_SHORT_TRANSFER_OK)
  TransferBufferLength = 00000012
  TransferBuffer       = 00000000
  TransferBufferMDL    = 86b2fb78
    00000000: 54 fd 64 01 00 ff 64 00 80 13 20 40 02 0a 38 50
    00000010: 40 20
  UrbLink              = 00000000
[116908 ms] UsbSnoop - FilterDispatchAny(f76d7fd2) : IRP_MJ_INTERNAL_DEVICE_CONTROL
[116908 ms] UsbSnoop - FdoHookDispatchInternalIoctl(f76d81ea) : fdo=861c0730, Irp=85a6dcd8, IRQL=0
[116908 ms]  >>>  URB 257 going down  >>> 
-- URB_FUNCTION_BULK_OR_INTERRUPT_TRANSFER:
  PipeHandle           = 866db8cc [endpoint 0x00000081]
  TransferFlags        = 00000003 (USBD_TRANSFER_DIRECTION_IN, USBD_SHORT_TRANSFER_OK)
  TransferBufferLength = 00000200
  TransferBuffer       = 00000000
  TransferBufferMDL    = 86544868
  UrbLink              = 00000000
