[131023 ms] UsbSnoop - FilterDispatchAny(f76e7fd2) : IRP_MJ_INTERNAL_DEVICE_CONTROL
[131023 ms] UsbSnoop - FdoHookDispatchInternalIoctl(f76e81ea) : fdo=86169730, Irp=859aa9a8, IRQL=0
[131023 ms]  >>>  URB 5 going down  >>> 
-- URB_FUNCTION_RESET_PIPE:
  PipeHandle = 86872164 [endpoint 0x00000002]
[131024 ms] UsbSnoop - MyInternalIOCTLCompletion(f76e8126) : fido=868f2b00, Irp=859aa9a8, Context=86848828, IRQL=0
[131024 ms]  <<<  URB 5 coming back  <<< 
-- URB_FUNCTION_RESET_PIPE:
[131024 ms] UsbSnoop - FilterDispatchAny(f76e7fd2) : IRP_MJ_INTERNAL_DEVICE_CONTROL
[131024 ms] UsbSnoop - FdoHookDispatchInternalIoctl(f76e81ea) : fdo=86169730, Irp=859aa9a8, IRQL=0
[131024 ms]  >>>  URB 6 going down  >>> 
-- URB_FUNCTION_RESET_PIPE:
  PipeHandle = 86872144 [endpoint 0x00000081]
[131026 ms] UsbSnoop - MyInternalIOCTLCompletion(f76e8126) : fido=868f2b00, Irp=859aa9a8, Context=86848828, IRQL=0
[131026 ms]  <<<  URB 6 coming back  <<< 
-- URB_FUNCTION_RESET_PIPE:
[131029 ms] UsbSnoop - FilterDispatchAny(f76e7fd2) : IRP_MJ_INTERNAL_DEVICE_CONTROL
[131029 ms] UsbSnoop - FdoHookDispatchInternalIoctl(f76e81ea) : fdo=86169730, Irp=85989e70, IRQL=0
[131189 ms] UsbSnoop - FilterDispatchAny(f76e7fd2) : IRP_MJ_INTERNAL_DEVICE_CONTROL
[131189 ms] UsbSnoop - FdoHookDispatchInternalIoctl(f76e81ea) : fdo=86169730, Irp=85989e70, IRQL=0
[131189 ms]  >>>  URB 7 going down  >>> 
-- URB_FUNCTION_BULK_OR_INTERRUPT_TRANSFER:
  PipeHandle           = 86872144 [endpoint 0x00000081]
  TransferFlags        = 00000003 (USBD_TRANSFER_DIRECTION_IN, USBD_SHORT_TRANSFER_OK)
  TransferBufferLength = 00000200
  TransferBuffer       = 00000000
  TransferBufferMDL    = 85ad0a48
  UrbLink              = 00000000
[131199 ms] UsbSnoop - MyInternalIOCTLCompletion(f76e8126) : fido=868f2b00, Irp=85989e70, Context=86848828, IRQL=2
[131199 ms]  <<<  URB 7 coming back  <<< 
-- URB_FUNCTION_BULK_OR_INTERRUPT_TRANSFER:
  PipeHandle           = 86872144 [endpoint 0x00000081]
  TransferFlags        = 00000003 (USBD_TRANSFER_DIRECTION_IN, USBD_SHORT_TRANSFER_OK)
  TransferBufferLength = 00000010
  TransferBuffer       = 00000000
  TransferBufferMDL    = 85ad0a48
    00000000: 54 fd 00 00 40 03 00 00 40 03 00 00 00 00 01 d8
  UrbLink              = 00000000
[131200 ms] UsbSnoop - FilterDispatchAny(f76e7fd2) : IRP_MJ_INTERNAL_DEVICE_CONTROL
[131200 ms] UsbSnoop - FdoHookDispatchInternalIoctl(f76e81ea) : fdo=86169730, Irp=85eaa2c0, IRQL=0
[131200 ms]  >>>  URB 8 going down  >>> 
-- URB_FUNCTION_BULK_OR_INTERRUPT_TRANSFER:
  PipeHandle           = 86872164 [endpoint 0x00000002]
  TransferFlags        = 00000002 (USBD_TRANSFER_DIRECTION_OUT, USBD_SHORT_TRANSFER_OK)
  TransferBufferLength = 00000014
  TransferBuffer       = 00000000
  TransferBufferMDL    = 85abdb78
    00000000: 54 fd 64 00 40 03 64 01 40 03 13 43 04 00 01 fb
    00000010: 64 01 ff 00
  UrbLink              = 00000000
[131200 ms] UsbSnoop - MyInternalIOCTLCompletion(f76e8126) : fido=868f2b00, Irp=85eaa2c0, Context=86848828, IRQL=2
[131200 ms]  <<<  URB 8 coming back  <<< 
-- URB_FUNCTION_BULK_OR_INTERRUPT_TRANSFER:
  PipeHandle           = 86872164 [endpoint 0x00000002]
  TransferFlags        = 00000002 (USBD_TRANSFER_DIRECTION_OUT, USBD_SHORT_TRANSFER_OK)
  TransferBufferLength = 00000014
  TransferBuffer       = 00000000
  TransferBufferMDL    = 85abdb78
  UrbLink              = 00000000
[131200 ms] UsbSnoop - FilterDispatchAny(f76e7fd2) : IRP_MJ_INTERNAL_DEVICE_CONTROL
[131200 ms] UsbSnoop - FdoHookDispatchInternalIoctl(f76e81ea) : fdo=86169730, Irp=85eaa2c0, IRQL=0
[131200 ms]  >>>  URB 9 going down  >>> 
-- URB_FUNCTION_BULK_OR_INTERRUPT_TRANSFER:
  PipeHandle           = 86872144 [endpoint 0x00000081]
  TransferFlags        = 00000003 (USBD_TRANSFER_DIRECTION_IN, USBD_SHORT_TRANSFER_OK)
  TransferBufferLength = 00000200
  TransferBuffer       = 00000000
  TransferBufferMDL    = 85ad0a48
  UrbLink              = 00000000
[134240 ms] UsbSnoop - MyInternalIOCTLCompletion(f76e8126) : fido=868f2b00, Irp=85eaa2c0, Context=86848828, IRQL=2
[134240 ms]  <<<  URB 9 coming back  <<< 
-- URB_FUNCTION_BULK_OR_INTERRUPT_TRANSFER:
  PipeHandle           = 86872144 [endpoint 0x00000081]
  TransferFlags        = 00000003 (USBD_TRANSFER_DIRECTION_IN, USBD_SHORT_TRANSFER_OK)
  TransferBufferLength = 00000016
  TransferBuffer       = 00000000
  TransferBufferMDL    = 85ad0a48
    00000000: 54 fd 64 01 80 13 64 00 40 50 39 76 06 00 01 f3
    00000010: 02 00 00 00 00 00
  UrbLink              = 00000000
[134241 ms] UsbSnoop - FilterDispatchAny(f76e7fd2) : IRP_MJ_INTERNAL_DEVICE_CONTROL
[134241 ms] UsbSnoop - FdoHookDispatchInternalIoctl(f76e81ea) : fdo=86169730, Irp=85eaa2c0, IRQL=0
[134241 ms]  >>>  URB 10 going down  >>> 
-- URB_FUNCTION_BULK_OR_INTERRUPT_TRANSFER:
  PipeHandle           = 86872164 [endpoint 0x00000002]
  TransferFlags        = 00000002 (USBD_TRANSFER_DIRECTION_OUT, USBD_SHORT_TRANSFER_OK)
  TransferBufferLength = 00000012
  TransferBuffer       = 00000000
  TransferBufferMDL    = 868e1b20
    00000000: 54 fd 64 00 00 d3 64 01 80 13 50 40 02 0a 01 1d
    00000010: 40 50
  UrbLink              = 00000000
[134241 ms] UsbSnoop - MyInternalIOCTLCompletion(f76e8126) : fido=868f2b00, Irp=85eaa2c0, Context=86848828, IRQL=2
[134241 ms]  <<<  URB 10 coming back  <<< 
-- URB_FUNCTION_BULK_OR_INTERRUPT_TRANSFER:
  PipeHandle           = 86872164 [endpoint 0x00000002]
  TransferFlags        = 00000002 (USBD_TRANSFER_DIRECTION_OUT, USBD_SHORT_TRANSFER_OK)
  TransferBufferLength = 00000012
  TransferBuffer       = 00000000
  TransferBufferMDL    = 868e1b20
  UrbLink              = 00000000
[134242 ms] UsbSnoop - FilterDispatchAny(f76e7fd2) : IRP_MJ_INTERNAL_DEVICE_CONTROL
[134242 ms] UsbSnoop - FdoHookDispatchInternalIoctl(f76e81ea) : fdo=86169730, Irp=85eaa2c0, IRQL=0
[134242 ms]  >>>  URB 11 going down  >>> 
-- URB_FUNCTION_BULK_OR_INTERRUPT_TRANSFER:
  PipeHandle           = 86872144 [endpoint 0x00000081]
  TransferFlags        = 00000003 (USBD_TRANSFER_DIRECTION_IN, USBD_SHORT_TRANSFER_OK)
  TransferBufferLength = 00000200
  TransferBuffer       = 00000000
  TransferBufferMDL    = 85a8f9a0
  UrbLink              = 00000000
[146391 ms] UsbSnoop - FilterDispatchAny(f76e7fd2) : IRP_MJ_INTERNAL_DEVICE_CONTROL
[146391 ms] UsbSnoop - FdoHookDispatchInternalIoctl(f76e81ea) : fdo=86169730, Irp=8598be70, IRQL=0
[146391 ms]  >>>  URB 12 going down  >>> 
-- URB_FUNCTION_BULK_OR_INTERRUPT_TRANSFER:
  PipeHandle           = 86872164 [endpoint 0x00000002]
  TransferFlags        = 00000002 (USBD_TRANSFER_DIRECTION_OUT, USBD_SHORT_TRANSFER_OK)
  TransferBufferLength = 00000011
  TransferBuffer       = 00000000
  TransferBufferMDL    = 85b4ca00
    00000000: 54 fd 64 00 80 03 64 01 40 20 01 00 01 00 01 00
    00000010: 01
  UrbLink              = 00000000
[146392 ms] UsbSnoop - MyInternalIOCTLCompletion(f76e8126) : fido=868f2b00, Irp=8598be70, Context=85ab19b8, IRQL=2
[146392 ms]  <<<  URB 12 coming back  <<< 
-- URB_FUNCTION_BULK_OR_INTERRUPT_TRANSFER:
  PipeHandle           = 86872164 [endpoint 0x00000002]
  TransferFlags        = 00000002 (USBD_TRANSFER_DIRECTION_OUT, USBD_SHORT_TRANSFER_OK)
  TransferBufferLength = 00000011
  TransferBuffer       = 00000000
  TransferBufferMDL    = 85b4ca00
  UrbLink              = 00000000
[146393 ms] UsbSnoop - MyInternalIOCTLCompletion(f76e8126) : fido=868f2b00, Irp=85eaa2c0, Context=86848828, IRQL=2
[146393 ms]  <<<  URB 11 coming back  <<< 
-- URB_FUNCTION_BULK_OR_INTERRUPT_TRANSFER:
  PipeHandle           = 86872144 [endpoint 0x00000081]
  TransferFlags        = 00000003 (USBD_TRANSFER_DIRECTION_IN, USBD_SHORT_TRANSFER_OK)
  TransferBufferLength = 00000012
  TransferBuffer       = 00000000
  TransferBufferMDL    = 85a8f9a0
    00000000: 54 fd 64 01 00 ff 64 00 80 03 20 40 02 0a 01 09
    00000010: 40 20
  UrbLink              = 00000000
[146394 ms] UsbSnoop - FilterDispatchAny(f76e7fd2) : IRP_MJ_INTERNAL_DEVICE_CONTROL
[146394 ms] UsbSnoop - FdoHookDispatchInternalIoctl(f76e81ea) : fdo=86169730, Irp=85eaa2c0, IRQL=0
[146394 ms]  >>>  URB 13 going down  >>> 
-- URB_FUNCTION_BULK_OR_INTERRUPT_TRANSFER:
  PipeHandle           = 86872144 [endpoint 0x00000081]
  TransferFlags        = 00000003 (USBD_TRANSFER_DIRECTION_IN, USBD_SHORT_TRANSFER_OK)
  TransferBufferLength = 00000200
  TransferBuffer       = 00000000
  TransferBufferMDL    = 8688ff18
  UrbLink              = 00000000
[161390 ms] UsbSnoop - FilterDispatchAny(f76e7fd2) : IRP_MJ_INTERNAL_DEVICE_CONTROL
[161390 ms] UsbSnoop - FdoHookDispatchInternalIoctl(f76e81ea) : fdo=86169730, Irp=858da3a8, IRQL=0
[161390 ms]  >>>  URB 14 going down  >>> 
-- URB_FUNCTION_BULK_OR_INTERRUPT_TRANSFER:
  PipeHandle           = 86872164 [endpoint 0x00000002]
  TransferFlags        = 00000002 (USBD_TRANSFER_DIRECTION_OUT, USBD_SHORT_TRANSFER_OK)
  TransferBufferLength = 00000012
  TransferBuffer       = 00000000
  TransferBufferMDL    = 85aca9b0
    00000000: 54 fd 64 00 40 de 64 01 40 20 03 80 02 00 02 1f
    00000010: 80 03
  UrbLink              = 00000000
[161391 ms] UsbSnoop - MyInternalIOCTLCompletion(f76e8126) : fido=868f2b00, Irp=858da3a8, Context=85ab19b8, IRQL=2
[161391 ms]  <<<  URB 14 coming back  <<< 
-- URB_FUNCTION_BULK_OR_INTERRUPT_TRANSFER:
  PipeHandle           = 86872164 [endpoint 0x00000002]
  TransferFlags        = 00000002 (USBD_TRANSFER_DIRECTION_OUT, USBD_SHORT_TRANSFER_OK)
  TransferBufferLength = 00000012
  TransferBuffer       = 00000000
  TransferBufferMDL    = 85aca9b0
  UrbLink              = 00000000
[161392 ms] UsbSnoop - MyInternalIOCTLCompletion(f76e8126) : fido=868f2b00, Irp=85eaa2c0, Context=86848828, IRQL=2
[161392 ms]  <<<  URB 13 coming back  <<< 
-- URB_FUNCTION_BULK_OR_INTERRUPT_TRANSFER:
  PipeHandle           = 86872144 [endpoint 0x00000081]
  TransferFlags        = 00000003 (USBD_TRANSFER_DIRECTION_IN, USBD_SHORT_TRANSFER_OK)
  TransferBufferLength = 00000012
  TransferBuffer       = 00000000
  TransferBufferMDL    = 8688ff18
    00000000: 54 fd 64 01 00 ff 64 00 80 03 20 40 02 0a 02 0a
    00000010: 40 20
  UrbLink              = 00000000
[161392 ms] UsbSnoop - FilterDispatchAny(f76e7fd2) : IRP_MJ_INTERNAL_DEVICE_CONTROL
[161392 ms] UsbSnoop - FdoHookDispatchInternalIoctl(f76e81ea) : fdo=86169730, Irp=858da3a8, IRQL=0
[161392 ms]  >>>  URB 15 going down  >>> 
-- URB_FUNCTION_BULK_OR_INTERRUPT_TRANSFER:
  PipeHandle           = 86872144 [endpoint 0x00000081]
  TransferFlags        = 00000003 (USBD_TRANSFER_DIRECTION_IN, USBD_SHORT_TRANSFER_OK)
  TransferBufferLength = 00000200
  TransferBuffer       = 00000000
  TransferBufferMDL    = 85b8cf18
  UrbLink              = 00000000
[161395 ms] UsbSnoop - FilterDispatchAny(f76e7fd2) : IRP_MJ_INTERNAL_DEVICE_CONTROL
[161395 ms] UsbSnoop - FdoHookDispatchInternalIoctl(f76e81ea) : fdo=86169730, Irp=85eaa2c0, IRQL=0
[161395 ms]  >>>  URB 16 going down  >>> 
-- URB_FUNCTION_BULK_OR_INTERRUPT_TRANSFER:
  PipeHandle           = 86872164 [endpoint 0x00000002]
  TransferFlags        = 00000002 (USBD_TRANSFER_DIRECTION_OUT, USBD_SHORT_TRANSFER_OK)
  TransferBufferLength = 00000012
  TransferBuffer       = 00000000
  TransferBufferMDL    = 85a8f9a0
    00000000: 54 fd 64 00 40 de 64 01 40 20 02 80 02 00 03 1f
    00000010: 80 02
  UrbLink              = 00000000
[161396 ms] UsbSnoop - MyInternalIOCTLCompletion(f76e8126) : fido=868f2b00, Irp=85eaa2c0, Context=85ab19b8, IRQL=2
[161396 ms]  <<<  URB 16 coming back  <<< 
-- URB_FUNCTION_BULK_OR_INTERRUPT_TRANSFER:
  PipeHandle           = 86872164 [endpoint 0x00000002]
  TransferFlags        = 00000002 (USBD_TRANSFER_DIRECTION_OUT, USBD_SHORT_TRANSFER_OK)
  TransferBufferLength = 00000012
  TransferBuffer       = 00000000
  TransferBufferMDL    = 85a8f9a0
  UrbLink              = 00000000
[161397 ms] UsbSnoop - MyInternalIOCTLCompletion(f76e8126) : fido=868f2b00, Irp=858da3a8, Context=86848828, IRQL=2
[161397 ms]  <<<  URB 15 coming back  <<< 
-- URB_FUNCTION_BULK_OR_INTERRUPT_TRANSFER:
  PipeHandle           = 86872144 [endpoint 0x00000081]
  TransferFlags        = 00000003 (USBD_TRANSFER_DIRECTION_IN, USBD_SHORT_TRANSFER_OK)
  TransferBufferLength = 00000012
  TransferBuffer       = 00000000
  TransferBufferMDL    = 85b8cf18
    00000000: 54 fd 64 01 00 ff 64 00 80 02 20 40 02 0a 03 0a
    00000010: 40 20
  UrbLink              = 00000000
[161397 ms] UsbSnoop - FilterDispatchAny(f76e7fd2) : IRP_MJ_INTERNAL_DEVICE_CONTROL
[161397 ms] UsbSnoop - FdoHookDispatchInternalIoctl(f76e81ea) : fdo=86169730, Irp=858da3a8, IRQL=0
[161397 ms]  >>>  URB 17 going down  >>> 
-- URB_FUNCTION_BULK_OR_INTERRUPT_TRANSFER:
  PipeHandle           = 86872144 [endpoint 0x00000081]
  TransferFlags        = 00000003 (USBD_TRANSFER_DIRECTION_IN, USBD_SHORT_TRANSFER_OK)
  TransferBufferLength = 00000200
  TransferBuffer       = 00000000
  TransferBufferMDL    = 85a8f9a0
  UrbLink              = 00000000
[176585 ms] UsbSnoop - FilterDispatchAny(f76e7fd2) : IRP_MJ_INTERNAL_DEVICE_CONTROL
[176585 ms] UsbSnoop - FdoHookDispatchInternalIoctl(f76e81ea) : fdo=86169730, Irp=858da6d8, IRQL=0
[176585 ms]  >>>  URB 18 going down  >>> 
-- URB_FUNCTION_BULK_OR_INTERRUPT_TRANSFER:
  PipeHandle           = 86872164 [endpoint 0x00000002]
  TransferFlags        = 00000002 (USBD_TRANSFER_DIRECTION_OUT, USBD_SHORT_TRANSFER_OK)
  TransferBufferLength = 00000011
  TransferBuffer       = 00000000
  TransferBufferMDL    = 85aa9d30
    00000000: 54 fd 64 00 80 06 64 01 40 20 01 00 01 00 04 06
    00000010: 01
  UrbLink              = 00000000
[176586 ms] UsbSnoop - MyInternalIOCTLCompletion(f76e8126) : fido=868f2b00, Irp=858da6d8, Context=85ab19b8, IRQL=2
[176586 ms]  <<<  URB 18 coming back  <<< 
-- URB_FUNCTION_BULK_OR_INTERRUPT_TRANSFER:
  PipeHandle           = 86872164 [endpoint 0x00000002]
  TransferFlags        = 00000002 (USBD_TRANSFER_DIRECTION_OUT, USBD_SHORT_TRANSFER_OK)
  TransferBufferLength = 00000011
  TransferBuffer       = 00000000
  TransferBufferMDL    = 85aa9d30
  UrbLink              = 00000000
[176588 ms] UsbSnoop - MyInternalIOCTLCompletion(f76e8126) : fido=868f2b00, Irp=858da3a8, Context=86848828, IRQL=2
[176588 ms]  <<<  URB 17 coming back  <<< 
-- URB_FUNCTION_BULK_OR_INTERRUPT_TRANSFER:
  PipeHandle           = 86872144 [endpoint 0x00000081]
  TransferFlags        = 00000003 (USBD_TRANSFER_DIRECTION_IN, USBD_SHORT_TRANSFER_OK)
  TransferBufferLength = 00000012
  TransferBuffer       = 00000000
  TransferBufferMDL    = 85a8f9a0
    00000000: 54 fd 64 01 00 ff 64 00 80 06 20 40 02 0a 04 0f
    00000010: 40 20
  UrbLink              = 00000000
[176588 ms] UsbSnoop - FilterDispatchAny(f76e7fd2) : IRP_MJ_INTERNAL_DEVICE_CONTROL
[176588 ms] UsbSnoop - FdoHookDispatchInternalIoctl(f76e81ea) : fdo=86169730, Irp=858da3a8, IRQL=0
[176588 ms]  >>>  URB 19 going down  >>> 
-- URB_FUNCTION_BULK_OR_INTERRUPT_TRANSFER:
  PipeHandle           = 86872144 [endpoint 0x00000081]
  TransferFlags        = 00000003 (USBD_TRANSFER_DIRECTION_IN, USBD_SHORT_TRANSFER_OK)
  TransferBufferLength = 00000200
  TransferBuffer       = 00000000
  TransferBufferMDL    = 85ab39a0
  UrbLink              = 00000000
[176595 ms] UsbSnoop - MyInternalIOCTLCompletion(f76e8126) : fido=868f2b00, Irp=858da3a8, Context=86848828, IRQL=2
[176595 ms]  <<<  URB 19 coming back  <<< 
-- URB_FUNCTION_BULK_OR_INTERRUPT_TRANSFER:
  PipeHandle           = 86872144 [endpoint 0x00000081]
  TransferFlags        = 00000003 (USBD_TRANSFER_DIRECTION_IN, USBD_SHORT_TRANSFER_OK)
  TransferBufferLength = 0000007f
  TransferBuffer       = 00000000
  TransferBufferMDL    = 85ab39a0
    00000000: 54 fd 64 01 40 20 64 00 80 06 1b 06 6f 00 02 92
    00000010: 01 00 00 00 00 01 59 80 00 00 00 00 00 01 be 00
    00000020: 00 00 00 00 00 02 5d 74 8c 00 00 00 00 01 75 75
    00000030: ec 7f 00 00 5a 01 02 09 5e 01 01 22 d4 01 01 23
    00000040: 15 00 00 00 00 00 02 00 00 00 00 01 40 00 f0 04
    00000050: 00 1e 30 30 30 30 34 42 43 31 42 31 30 45 35 37
    00000060: 30 46 00 30 45 30 30 30 30 30 34 42 43 31 42 31
    00000070: 30 45 35 37 30 46 43 42 32 38 30 34 46 31 00
  UrbLink              = 00000000
[176596 ms] UsbSnoop - FilterDispatchAny(f76e7fd2) : IRP_MJ_INTERNAL_DEVICE_CONTROL
[176596 ms] UsbSnoop - FdoHookDispatchInternalIoctl(f76e81ea) : fdo=86169730, Irp=858838a0, IRQL=0
[176596 ms]  >>>  URB 20 going down  >>> 
-- URB_FUNCTION_BULK_OR_INTERRUPT_TRANSFER:
  PipeHandle           = 86872164 [endpoint 0x00000002]
  TransferFlags        = 00000002 (USBD_TRANSFER_DIRECTION_OUT, USBD_SHORT_TRANSFER_OK)
  TransferBufferLength = 00000012
  TransferBuffer       = 00000000
  TransferBufferMDL    = 85ab39a0
    00000000: 54 fd 64 00 00 ff 64 01 40 20 06 80 02 0a 02 0d
    00000010: 80 06
  UrbLink              = 00000000
[176596 ms] UsbSnoop - MyInternalIOCTLCompletion(f76e8126) : fido=868f2b00, Irp=858838a0, Context=86848828, IRQL=2
[176596 ms]  <<<  URB 20 coming back  <<< 
-- URB_FUNCTION_BULK_OR_INTERRUPT_TRANSFER:
  PipeHandle           = 86872164 [endpoint 0x00000002]
  TransferFlags        = 00000002 (USBD_TRANSFER_DIRECTION_OUT, USBD_SHORT_TRANSFER_OK)
  TransferBufferLength = 00000012
  TransferBuffer       = 00000000
  TransferBufferMDL    = 85ab39a0
  UrbLink              = 00000000
[176596 ms] UsbSnoop - FilterDispatchAny(f76e7fd2) : IRP_MJ_INTERNAL_DEVICE_CONTROL
[176596 ms] UsbSnoop - FdoHookDispatchInternalIoctl(f76e81ea) : fdo=86169730, Irp=858838a0, IRQL=0
[176596 ms]  >>>  URB 21 going down  >>> 
-- URB_FUNCTION_BULK_OR_INTERRUPT_TRANSFER:
  PipeHandle           = 86872144 [endpoint 0x00000081]
  TransferFlags        = 00000003 (USBD_TRANSFER_DIRECTION_IN, USBD_SHORT_TRANSFER_OK)
  TransferBufferLength = 00000200
  TransferBuffer       = 00000000
  TransferBufferMDL    = 85a8f9a0
  UrbLink              = 00000000
[176597 ms] UsbSnoop - FilterDispatchAny(f76e7fd2) : IRP_MJ_INTERNAL_DEVICE_CONTROL
[176597 ms] UsbSnoop - FdoHookDispatchInternalIoctl(f76e81ea) : fdo=86169730, Irp=8587ba50, IRQL=0
[176597 ms]  >>>  URB 22 going down  >>> 
-- URB_FUNCTION_BULK_OR_INTERRUPT_TRANSFER:
  PipeHandle           = 86872164 [endpoint 0x00000002]
  TransferFlags        = 00000002 (USBD_TRANSFER_DIRECTION_OUT, USBD_SHORT_TRANSFER_OK)
  TransferBufferLength = 00000011
  TransferBuffer       = 00000000
  TransferBufferMDL    = 86449778
    00000000: 54 fd 64 00 80 06 64 01 40 20 02 00 01 00 05 08
    00000010: 02
  UrbLink              = 00000000
[176598 ms] UsbSnoop - MyInternalIOCTLCompletion(f76e8126) : fido=868f2b00, Irp=8587ba50, Context=85ab19b8, IRQL=2
[176598 ms]  <<<  URB 22 coming back  <<< 
-- URB_FUNCTION_BULK_OR_INTERRUPT_TRANSFER:
  PipeHandle           = 86872164 [endpoint 0x00000002]
  TransferFlags        = 00000002 (USBD_TRANSFER_DIRECTION_OUT, USBD_SHORT_TRANSFER_OK)
  TransferBufferLength = 00000011
  TransferBuffer       = 00000000
  TransferBufferMDL    = 86449778
  UrbLink              = 00000000
[176601 ms] UsbSnoop - MyInternalIOCTLCompletion(f76e8126) : fido=868f2b00, Irp=858838a0, Context=86848828, IRQL=2
[176601 ms]  <<<  URB 21 coming back  <<< 
-- URB_FUNCTION_BULK_OR_INTERRUPT_TRANSFER:
  PipeHandle           = 86872144 [endpoint 0x00000081]
  TransferFlags        = 00000003 (USBD_TRANSFER_DIRECTION_IN, USBD_SHORT_TRANSFER_OK)
  TransferBufferLength = 00000012
  TransferBuffer       = 00000000
  TransferBufferMDL    = 85a8f9a0
    00000000: 54 fd 64 01 00 ff 64 00 80 06 20 40 02 0a 05 10
    00000010: 40 20
  UrbLink              = 00000000
[176601 ms] UsbSnoop - FilterDispatchAny(f76e7fd2) : IRP_MJ_INTERNAL_DEVICE_CONTROL
[176601 ms] UsbSnoop - FdoHookDispatchInternalIoctl(f76e81ea) : fdo=86169730, Irp=85883bd0, IRQL=0
[176601 ms]  >>>  URB 23 going down  >>> 
-- URB_FUNCTION_BULK_OR_INTERRUPT_TRANSFER:
  PipeHandle           = 86872144 [endpoint 0x00000081]
  TransferFlags        = 00000003 (USBD_TRANSFER_DIRECTION_IN, USBD_SHORT_TRANSFER_OK)
  TransferBufferLength = 00000200
  TransferBuffer       = 00000000
  TransferBufferMDL    = 85a8f9a0
  UrbLink              = 00000000
[176605 ms] UsbSnoop - MyInternalIOCTLCompletion(f76e8126) : fido=868f2b00, Irp=85883bd0, Context=86848828, IRQL=2
[176605 ms]  <<<  URB 23 coming back  <<< 
-- URB_FUNCTION_BULK_OR_INTERRUPT_TRANSFER:
  PipeHandle           = 86872144 [endpoint 0x00000081]
  TransferFlags        = 00000003 (USBD_TRANSFER_DIRECTION_IN, USBD_SHORT_TRANSFER_OK)
  TransferBufferLength = 0000001b
  TransferBuffer       = 00000000
  TransferBufferMDL    = 85a8f9a0
    00000000: 54 fd 64 01 40 20 64 00 80 06 38 5a 0b 00 03 a0
    00000010: 02 54 49 2d 4e 73 70 69 72 65 00
  UrbLink              = 00000000
[176605 ms] UsbSnoop - FilterDispatchAny(f76e7fd2) : IRP_MJ_INTERNAL_DEVICE_CONTROL
[176605 ms] UsbSnoop - FdoHookDispatchInternalIoctl(f76e81ea) : fdo=86169730, Irp=85883bd0, IRQL=0
[176605 ms]  >>>  URB 24 going down  >>> 
-- URB_FUNCTION_BULK_OR_INTERRUPT_TRANSFER:
  PipeHandle           = 86872164 [endpoint 0x00000002]
  TransferFlags        = 00000002 (USBD_TRANSFER_DIRECTION_OUT, USBD_SHORT_TRANSFER_OK)
  TransferBufferLength = 00000012
  TransferBuffer       = 00000000
  TransferBufferMDL    = 85b97d60
    00000000: 54 fd 64 00 00 ff 64 01 40 20 06 80 02 0a 03 0e
    00000010: 80 06
  UrbLink              = 00000000
[176606 ms] UsbSnoop - MyInternalIOCTLCompletion(f76e8126) : fido=868f2b00, Irp=85883bd0, Context=86848828, IRQL=2
[176606 ms]  <<<  URB 24 coming back  <<< 
-- URB_FUNCTION_BULK_OR_INTERRUPT_TRANSFER:
  PipeHandle           = 86872164 [endpoint 0x00000002]
  TransferFlags        = 00000002 (USBD_TRANSFER_DIRECTION_OUT, USBD_SHORT_TRANSFER_OK)
  TransferBufferLength = 00000012
  TransferBuffer       = 00000000
  TransferBufferMDL    = 85b97d60
  UrbLink              = 00000000
[176606 ms] UsbSnoop - FilterDispatchAny(f76e7fd2) : IRP_MJ_INTERNAL_DEVICE_CONTROL
[176606 ms] UsbSnoop - FdoHookDispatchInternalIoctl(f76e81ea) : fdo=86169730, Irp=85883bd0, IRQL=0
[176606 ms]  >>>  URB 25 going down  >>> 
-- URB_FUNCTION_BULK_OR_INTERRUPT_TRANSFER:
  PipeHandle           = 86872144 [endpoint 0x00000081]
  TransferFlags        = 00000003 (USBD_TRANSFER_DIRECTION_IN, USBD_SHORT_TRANSFER_OK)
  TransferBufferLength = 00000200
  TransferBuffer       = 00000000
  TransferBufferMDL    = 86034830
  UrbLink              = 00000000
[176606 ms] UsbSnoop - FilterDispatchAny(f76e7fd2) : IRP_MJ_INTERNAL_DEVICE_CONTROL
[176606 ms] UsbSnoop - FdoHookDispatchInternalIoctl(f76e81ea) : fdo=86169730, Irp=858da540, IRQL=0
[176606 ms]  >>>  URB 26 going down  >>> 
-- URB_FUNCTION_BULK_OR_INTERRUPT_TRANSFER:
  PipeHandle           = 86872164 [endpoint 0x00000002]
  TransferFlags        = 00000002 (USBD_TRANSFER_DIRECTION_OUT, USBD_SHORT_TRANSFER_OK)
  TransferBufferLength = 00000011
  TransferBuffer       = 00000000
  TransferBufferMDL    = 85b97d60
    00000000: 54 fd 64 00 80 06 64 01 40 20 03 00 01 00 06 0a
    00000010: 03
  UrbLink              = 00000000
[176608 ms] UsbSnoop - MyInternalIOCTLCompletion(f76e8126) : fido=868f2b00, Irp=858da540, Context=85ab19b8, IRQL=2
[176608 ms]  <<<  URB 26 coming back  <<< 
-- URB_FUNCTION_BULK_OR_INTERRUPT_TRANSFER:
  PipeHandle           = 86872164 [endpoint 0x00000002]
  TransferFlags        = 00000002 (USBD_TRANSFER_DIRECTION_OUT, USBD_SHORT_TRANSFER_OK)
  TransferBufferLength = 00000011
  TransferBuffer       = 00000000
  TransferBufferMDL    = 85b97d60
  UrbLink              = 00000000
[176611 ms] UsbSnoop - MyInternalIOCTLCompletion(f76e8126) : fido=868f2b00, Irp=85883bd0, Context=86848828, IRQL=2
[176611 ms]  <<<  URB 25 coming back  <<< 
-- URB_FUNCTION_BULK_OR_INTERRUPT_TRANSFER:
  PipeHandle           = 86872144 [endpoint 0x00000081]
  TransferFlags        = 00000003 (USBD_TRANSFER_DIRECTION_IN, USBD_SHORT_TRANSFER_OK)
  TransferBufferLength = 00000012
  TransferBuffer       = 00000000
  TransferBufferMDL    = 86034830
    00000000: 54 fd 64 01 00 ff 64 00 80 06 20 40 02 0a 06 11
    00000010: 40 20
  UrbLink              = 00000000
[176611 ms] UsbSnoop - FilterDispatchAny(f76e7fd2) : IRP_MJ_INTERNAL_DEVICE_CONTROL
[176611 ms] UsbSnoop - FdoHookDispatchInternalIoctl(f76e81ea) : fdo=86169730, Irp=85883bd0, IRQL=0
[176611 ms]  >>>  URB 27 going down  >>> 
-- URB_FUNCTION_BULK_OR_INTERRUPT_TRANSFER:
  PipeHandle           = 86872144 [endpoint 0x00000081]
  TransferFlags        = 00000003 (USBD_TRANSFER_DIRECTION_IN, USBD_SHORT_TRANSFER_OK)
  TransferBufferLength = 00000200
  TransferBuffer       = 00000000
  TransferBufferMDL    = 86034830
  UrbLink              = 00000000
[176615 ms] UsbSnoop - MyInternalIOCTLCompletion(f76e8126) : fido=868f2b00, Irp=85883bd0, Context=86848828, IRQL=2
[176615 ms]  <<<  URB 27 coming back  <<< 
-- URB_FUNCTION_BULK_OR_INTERRUPT_TRANSFER:
  PipeHandle           = 86872144 [endpoint 0x00000081]
  TransferFlags        = 00000003 (USBD_TRANSFER_DIRECTION_IN, USBD_SHORT_TRANSFER_OK)
  TransferBufferLength = 0000001b
  TransferBuffer       = 00000000
  TransferBufferMDL    = 86034830
    00000000: 54 fd 64 01 40 20 64 00 80 06 96 7f 0b 00 04 24
    00000010: 03 2e 74 6e 73 00 2e 74 6e 6f 00
  UrbLink              = 00000000
[176615 ms] UsbSnoop - FilterDispatchAny(f76e7fd2) : IRP_MJ_INTERNAL_DEVICE_CONTROL
[176615 ms] UsbSnoop - FdoHookDispatchInternalIoctl(f76e81ea) : fdo=86169730, Irp=85883bd0, IRQL=0
[176615 ms]  >>>  URB 28 going down  >>> 
-- URB_FUNCTION_BULK_OR_INTERRUPT_TRANSFER:
  PipeHandle           = 86872164 [endpoint 0x00000002]
  TransferFlags        = 00000002 (USBD_TRANSFER_DIRECTION_OUT, USBD_SHORT_TRANSFER_OK)
  TransferBufferLength = 00000012
  TransferBuffer       = 00000000
  TransferBufferMDL    = 85b97d60
    00000000: 54 fd 64 00 00 ff 64 01 40 20 06 80 02 0a 04 0f
    00000010: 80 06
  UrbLink              = 00000000
[176616 ms] UsbSnoop - MyInternalIOCTLCompletion(f76e8126) : fido=868f2b00, Irp=85883bd0, Context=86848828, IRQL=2
[176616 ms]  <<<  URB 28 coming back  <<< 
-- URB_FUNCTION_BULK_OR_INTERRUPT_TRANSFER:
  PipeHandle           = 86872164 [endpoint 0x00000002]
  TransferFlags        = 00000002 (USBD_TRANSFER_DIRECTION_OUT, USBD_SHORT_TRANSFER_OK)
  TransferBufferLength = 00000012
  TransferBuffer       = 00000000
  TransferBufferMDL    = 85b97d60
  UrbLink              = 00000000
[176616 ms] UsbSnoop - FilterDispatchAny(f76e7fd2) : IRP_MJ_INTERNAL_DEVICE_CONTROL
[176616 ms] UsbSnoop - FdoHookDispatchInternalIoctl(f76e81ea) : fdo=86169730, Irp=85883bd0, IRQL=0
[176616 ms]  >>>  URB 29 going down  >>> 
-- URB_FUNCTION_BULK_OR_INTERRUPT_TRANSFER:
  PipeHandle           = 86872144 [endpoint 0x00000081]
  TransferFlags        = 00000003 (USBD_TRANSFER_DIRECTION_IN, USBD_SHORT_TRANSFER_OK)
  TransferBufferLength = 00000200
  TransferBuffer       = 00000000
  TransferBufferMDL    = 860ed860
  UrbLink              = 00000000
[176616 ms] UsbSnoop - FilterDispatchAny(f76e7fd2) : IRP_MJ_INTERNAL_DEVICE_CONTROL
[176616 ms] UsbSnoop - FdoHookDispatchInternalIoctl(f76e81ea) : fdo=86169730, Irp=858838a0, IRQL=0
[176616 ms]  >>>  URB 30 going down  >>> 
-- URB_FUNCTION_BULK_OR_INTERRUPT_TRANSFER:
  PipeHandle           = 86872164 [endpoint 0x00000002]
  TransferFlags        = 00000002 (USBD_TRANSFER_DIRECTION_OUT, USBD_SHORT_TRANSFER_OK)
  TransferBufferLength = 00000012
  TransferBuffer       = 00000000
  TransferBufferMDL    = 868e1b20
    00000000: 54 fd 64 00 40 de 64 01 40 20 06 80 02 00 07 27
    00000010: 80 06
  UrbLink              = 00000000
[176618 ms] UsbSnoop - MyInternalIOCTLCompletion(f76e8126) : fido=868f2b00, Irp=858838a0, Context=85ab19b8, IRQL=2
[176618 ms]  <<<  URB 30 coming back  <<< 
-- URB_FUNCTION_BULK_OR_INTERRUPT_TRANSFER:
  PipeHandle           = 86872164 [endpoint 0x00000002]
  TransferFlags        = 00000002 (USBD_TRANSFER_DIRECTION_OUT, USBD_SHORT_TRANSFER_OK)
  TransferBufferLength = 00000012
  TransferBuffer       = 00000000
  TransferBufferMDL    = 868e1b20
  UrbLink              = 00000000
[176621 ms] UsbSnoop - MyInternalIOCTLCompletion(f76e8126) : fido=868f2b00, Irp=85883bd0, Context=86848828, IRQL=2
[176621 ms]  <<<  URB 29 coming back  <<< 
-- URB_FUNCTION_BULK_OR_INTERRUPT_TRANSFER:
  PipeHandle           = 86872144 [endpoint 0x00000081]
  TransferFlags        = 00000003 (USBD_TRANSFER_DIRECTION_IN, USBD_SHORT_TRANSFER_OK)
  TransferBufferLength = 00000012
  TransferBuffer       = 00000000
  TransferBufferMDL    = 860ed860
    00000000: 54 fd 64 01 00 ff 64 00 80 06 20 40 02 0a 07 12
    00000010: 40 20
  UrbLink              = 00000000
[176621 ms] UsbSnoop - FilterDispatchAny(f76e7fd2) : IRP_MJ_INTERNAL_DEVICE_CONTROL
[176621 ms] UsbSnoop - FdoHookDispatchInternalIoctl(f76e81ea) : fdo=86169730, Irp=85883bd0, IRQL=0
[176621 ms]  >>>  URB 31 going down  >>> 
-- URB_FUNCTION_BULK_OR_INTERRUPT_TRANSFER:
  PipeHandle           = 86872144 [endpoint 0x00000081]
  TransferFlags        = 00000003 (USBD_TRANSFER_DIRECTION_IN, USBD_SHORT_TRANSFER_OK)
  TransferBufferLength = 00000200
  TransferBuffer       = 00000000
  TransferBufferMDL    = 85b3cee0
  UrbLink              = 00000000
[176677 ms] UsbSnoop - FilterDispatchAny(f76e7fd2) : IRP_MJ_INTERNAL_DEVICE_CONTROL
[176677 ms] UsbSnoop - FdoHookDispatchInternalIoctl(f76e81ea) : fdo=86169730, Irp=85eaa2c0, IRQL=0
[176677 ms]  >>>  URB 32 going down  >>> 
-- URB_FUNCTION_BULK_OR_INTERRUPT_TRANSFER:
  PipeHandle           = 86872164 [endpoint 0x00000002]
  TransferFlags        = 00000002 (USBD_TRANSFER_DIRECTION_OUT, USBD_SHORT_TRANSFER_OK)
  TransferBufferLength = 00000012
  TransferBuffer       = 00000000
  TransferBufferMDL    = 866c3798
    00000000: 54 fd 64 00 40 de 64 01 40 20 05 80 02 00 08 27
    00000010: 80 05
  UrbLink              = 00000000
[176678 ms] UsbSnoop - MyInternalIOCTLCompletion(f76e8126) : fido=868f2b00, Irp=85eaa2c0, Context=85ab19b8, IRQL=2
[176678 ms]  <<<  URB 32 coming back  <<< 
-- URB_FUNCTION_BULK_OR_INTERRUPT_TRANSFER:
  PipeHandle           = 86872164 [endpoint 0x00000002]
  TransferFlags        = 00000002 (USBD_TRANSFER_DIRECTION_OUT, USBD_SHORT_TRANSFER_OK)
  TransferBufferLength = 00000012
  TransferBuffer       = 00000000
  TransferBufferMDL    = 866c3798
  UrbLink              = 00000000
[176679 ms] UsbSnoop - MyInternalIOCTLCompletion(f76e8126) : fido=868f2b00, Irp=85883bd0, Context=86848828, IRQL=2
[176679 ms]  <<<  URB 31 coming back  <<< 
-- URB_FUNCTION_BULK_OR_INTERRUPT_TRANSFER:
  PipeHandle           = 86872144 [endpoint 0x00000081]
  TransferFlags        = 00000003 (USBD_TRANSFER_DIRECTION_IN, USBD_SHORT_TRANSFER_OK)
  TransferBufferLength = 00000012
  TransferBuffer       = 00000000
  TransferBufferMDL    = 85b3cee0
    00000000: 54 fd 64 01 00 ff 64 00 80 05 20 40 02 0a 08 12
    00000010: 40 20
  UrbLink              = 00000000
[176679 ms] UsbSnoop - FilterDispatchAny(f76e7fd2) : IRP_MJ_INTERNAL_DEVICE_CONTROL
[176679 ms] UsbSnoop - FdoHookDispatchInternalIoctl(f76e81ea) : fdo=86169730, Irp=85883bd0, IRQL=0
[176679 ms]  >>>  URB 33 going down  >>> 
-- URB_FUNCTION_BULK_OR_INTERRUPT_TRANSFER:
  PipeHandle           = 86872144 [endpoint 0x00000081]
  TransferFlags        = 00000003 (USBD_TRANSFER_DIRECTION_IN, USBD_SHORT_TRANSFER_OK)
  TransferBufferLength = 00000200
  TransferBuffer       = 00000000
  TransferBufferMDL    = 866c3798
  UrbLink              = 00000000
