[147708 ms] UsbSnoop - FilterDispatchAny(a95c1fd2) : IRP_MJ_INTERNAL_DEVICE_CONTROL
[147708 ms] UsbSnoop - FdoHookDispatchInternalIoctl(a95c21ea) : fdo=868c0de8, Irp=85745e48, IRQL=0
[147708 ms]  >>>  URB 212 going down  >>> 
-- URB_FUNCTION_BULK_OR_INTERRUPT_TRANSFER:
  PipeHandle           = 858ccfbc [endpoint 0x00000002]
  TransferFlags        = 00000002 (USBD_TRANSFER_DIRECTION_OUT, USBD_SHORT_TRANSFER_OK)
  TransferBufferLength = 0000001d
  TransferBuffer       = 00000000
  TransferBufferMDL    = 85d89a68
    00000000: 54 fd 64 00 80 10 64 01 40 60 97 be 0d 00 32 de
    00000010: 0d 2f 31 32 33 34 35 36 37 38 39 30 00
  UrbLink              = 00000000
[147709 ms] UsbSnoop - MyInternalIOCTLCompletion(a95c2126) : fido=857e2b00, Irp=85745e48, Context=868cbac8, IRQL=2
[147709 ms]  <<<  URB 212 coming back  <<< 
-- URB_FUNCTION_BULK_OR_INTERRUPT_TRANSFER:
  PipeHandle           = 858ccfbc [endpoint 0x00000002]
  TransferFlags        = 00000002 (USBD_TRANSFER_DIRECTION_OUT, USBD_SHORT_TRANSFER_OK)
  TransferBufferLength = 0000001d
  TransferBuffer       = 00000000
  TransferBufferMDL    = 85d89a68
  UrbLink              = 00000000
[147710 ms] UsbSnoop - MyInternalIOCTLCompletion(a95c2126) : fido=857e2b00, Irp=8696c6a8, Context=86445700, IRQL=2
[147710 ms]  <<<  URB 211 coming back  <<< 
-- URB_FUNCTION_BULK_OR_INTERRUPT_TRANSFER:
  PipeHandle           = 858ccf9c [endpoint 0x00000081]
  TransferFlags        = 00000003 (USBD_TRANSFER_DIRECTION_IN, USBD_SHORT_TRANSFER_OK)
  TransferBufferLength = 00000012
  TransferBuffer       = 00000000
  TransferBufferMDL    = 86a5c4b0
    00000000: 54 fd 64 01 00 ff 64 00 80 10 60 40 02 0a 32 87
    00000010: 40 60
  UrbLink              = 00000000
[147710 ms] UsbSnoop - FilterDispatchAny(a95c1fd2) : IRP_MJ_INTERNAL_DEVICE_CONTROL
[147710 ms] UsbSnoop - FdoHookDispatchInternalIoctl(a95c21ea) : fdo=868c0de8, Irp=8696c6a8, IRQL=0
[147710 ms]  >>>  URB 213 going down  >>> 
-- URB_FUNCTION_BULK_OR_INTERRUPT_TRANSFER:
  PipeHandle           = 858ccf9c [endpoint 0x00000081]
  TransferFlags        = 00000003 (USBD_TRANSFER_DIRECTION_IN, USBD_SHORT_TRANSFER_OK)
  TransferBufferLength = 00000200
  TransferBuffer       = 00000000
  TransferBufferMDL    = 86a5c4b0
  UrbLink              = 00000000
[147725 ms] UsbSnoop - MyInternalIOCTLCompletion(a95c2126) : fido=857e2b00, Irp=8696c6a8, Context=86445700, IRQL=2
[147725 ms]  <<<  URB 213 coming back  <<< 
-- URB_FUNCTION_BULK_OR_INTERRUPT_TRANSFER:
  PipeHandle           = 858ccf9c [endpoint 0x00000081]
  TransferFlags        = 00000003 (USBD_TRANSFER_DIRECTION_IN, USBD_SHORT_TRANSFER_OK)
  TransferBufferLength = 00000012
  TransferBuffer       = 00000000
  TransferBufferMDL    = 86a5c4b0
    00000000: 54 fd 64 01 40 60 64 00 80 10 00 ff 02 00 33 7e
    00000010: ff 00
  UrbLink              = 00000000
[147725 ms] UsbSnoop - FilterDispatchAny(a95c1fd2) : IRP_MJ_INTERNAL_DEVICE_CONTROL
[147725 ms] UsbSnoop - FdoHookDispatchInternalIoctl(a95c21ea) : fdo=868c0de8, Irp=8696c6a8, IRQL=0
[147725 ms]  >>>  URB 214 going down  >>> 
-- URB_FUNCTION_BULK_OR_INTERRUPT_TRANSFER:
  PipeHandle           = 858ccfbc [endpoint 0x00000002]
  TransferFlags        = 00000002 (USBD_TRANSFER_DIRECTION_OUT, USBD_SHORT_TRANSFER_OK)
  TransferBufferLength = 00000012
  TransferBuffer       = 00000000
  TransferBufferMDL    = 86a5c4b0
    00000000: 54 fd 64 00 00 ff 64 01 40 60 10 80 02 0a 33 88
    00000010: 80 10
  UrbLink              = 00000000
[147726 ms] UsbSnoop - MyInternalIOCTLCompletion(a95c2126) : fido=857e2b00, Irp=8696c6a8, Context=86445700, IRQL=2
[147726 ms]  <<<  URB 214 coming back  <<< 
-- URB_FUNCTION_BULK_OR_INTERRUPT_TRANSFER:
  PipeHandle           = 858ccfbc [endpoint 0x00000002]
  TransferFlags        = 00000002 (USBD_TRANSFER_DIRECTION_OUT, USBD_SHORT_TRANSFER_OK)
  TransferBufferLength = 00000012
  TransferBuffer       = 00000000
  TransferBufferMDL    = 86a5c4b0
  UrbLink              = 00000000
[147726 ms] UsbSnoop - FilterDispatchAny(a95c1fd2) : IRP_MJ_INTERNAL_DEVICE_CONTROL
[147726 ms] UsbSnoop - FdoHookDispatchInternalIoctl(a95c21ea) : fdo=868c0de8, Irp=8696c6a8, IRQL=0
[147726 ms]  >>>  URB 215 going down  >>> 
-- URB_FUNCTION_BULK_OR_INTERRUPT_TRANSFER:
  PipeHandle           = 858ccf9c [endpoint 0x00000081]
  TransferFlags        = 00000003 (USBD_TRANSFER_DIRECTION_IN, USBD_SHORT_TRANSFER_OK)
  TransferBufferLength = 00000200
  TransferBuffer       = 00000000
  TransferBufferMDL    = 86a5c4b0
  UrbLink              = 00000000
[147726 ms] UsbSnoop - FilterDispatchAny(a95c1fd2) : IRP_MJ_INTERNAL_DEVICE_CONTROL
[147726 ms] UsbSnoop - FdoHookDispatchInternalIoctl(a95c21ea) : fdo=868c0de8, Irp=86a14008, IRQL=0
[147726 ms]  >>>  URB 216 going down  >>> 
-- URB_FUNCTION_BULK_OR_INTERRUPT_TRANSFER:
  PipeHandle           = 858ccfbc [endpoint 0x00000002]
  TransferFlags        = 00000002 (USBD_TRANSFER_DIRECTION_OUT, USBD_SHORT_TRANSFER_OK)
  TransferBufferLength = 00000011
  TransferBuffer       = 00000000
  TransferBufferMDL    = 85745488
    00000000: 54 fd 64 00 80 10 64 01 40 60 0e 00 01 00 33 8c
    00000010: 0e
  UrbLink              = 00000000
[147727 ms] UsbSnoop - MyInternalIOCTLCompletion(a95c2126) : fido=857e2b00, Irp=86a14008, Context=868cbac8, IRQL=2
[147727 ms]  <<<  URB 216 coming back  <<< 
-- URB_FUNCTION_BULK_OR_INTERRUPT_TRANSFER:
  PipeHandle           = 858ccfbc [endpoint 0x00000002]
  TransferFlags        = 00000002 (USBD_TRANSFER_DIRECTION_OUT, USBD_SHORT_TRANSFER_OK)
  TransferBufferLength = 00000011
  TransferBuffer       = 00000000
  TransferBufferMDL    = 85745488
  UrbLink              = 00000000
[147728 ms] UsbSnoop - MyInternalIOCTLCompletion(a95c2126) : fido=857e2b00, Irp=8696c6a8, Context=86445700, IRQL=2
[147728 ms]  <<<  URB 215 coming back  <<< 
-- URB_FUNCTION_BULK_OR_INTERRUPT_TRANSFER:
  PipeHandle           = 858ccf9c [endpoint 0x00000081]
  TransferFlags        = 00000003 (USBD_TRANSFER_DIRECTION_IN, USBD_SHORT_TRANSFER_OK)
  TransferBufferLength = 00000012
  TransferBuffer       = 00000000
  TransferBufferMDL    = 86a5c4b0
    00000000: 54 fd 64 01 00 ff 64 00 80 10 60 40 02 0a 33 88
    00000010: 40 60
  UrbLink              = 00000000
[147728 ms] UsbSnoop - FilterDispatchAny(a95c1fd2) : IRP_MJ_INTERNAL_DEVICE_CONTROL
[147728 ms] UsbSnoop - FdoHookDispatchInternalIoctl(a95c21ea) : fdo=868c0de8, Irp=8696c6a8, IRQL=0
[147728 ms]  >>>  URB 217 going down  >>> 
-- URB_FUNCTION_BULK_OR_INTERRUPT_TRANSFER:
  PipeHandle           = 858ccf9c [endpoint 0x00000081]
  TransferFlags        = 00000003 (USBD_TRANSFER_DIRECTION_IN, USBD_SHORT_TRANSFER_OK)
  TransferBufferLength = 00000200
  TransferBuffer       = 00000000
  TransferBufferMDL    = 86a5c4b0
  UrbLink              = 00000000
[147734 ms] UsbSnoop - MyInternalIOCTLCompletion(a95c2126) : fido=857e2b00, Irp=8696c6a8, Context=86445700, IRQL=2
[147734 ms]  <<<  URB 217 coming back  <<< 
-- URB_FUNCTION_BULK_OR_INTERRUPT_TRANSFER:
  PipeHandle           = 858ccf9c [endpoint 0x00000081]
  TransferFlags        = 00000003 (USBD_TRANSFER_DIRECTION_IN, USBD_SHORT_TRANSFER_OK)
  TransferBufferLength = 00000012
  TransferBuffer       = 00000000
  TransferBufferMDL    = 86a5c4b0
    00000000: 54 fd 64 01 40 60 64 00 80 10 11 ff 02 00 34 90
    00000010: ff 11
  UrbLink              = 00000000
[147734 ms] UsbSnoop - FilterDispatchAny(a95c1fd2) : IRP_MJ_INTERNAL_DEVICE_CONTROL
[147734 ms] UsbSnoop - FdoHookDispatchInternalIoctl(a95c21ea) : fdo=868c0de8, Irp=8696c6a8, IRQL=0
[147734 ms]  >>>  URB 218 going down  >>> 
-- URB_FUNCTION_BULK_OR_INTERRUPT_TRANSFER:
  PipeHandle           = 858ccfbc [endpoint 0x00000002]
  TransferFlags        = 00000002 (USBD_TRANSFER_DIRECTION_OUT, USBD_SHORT_TRANSFER_OK)
  TransferBufferLength = 00000012
  TransferBuffer       = 00000000
  TransferBufferMDL    = 86a5c4b0
    00000000: 54 fd 64 00 00 ff 64 01 40 60 10 80 02 0a 34 89
    00000010: 80 10
  UrbLink              = 00000000
[147735 ms] UsbSnoop - MyInternalIOCTLCompletion(a95c2126) : fido=857e2b00, Irp=8696c6a8, Context=86445700, IRQL=2
[147735 ms]  <<<  URB 218 coming back  <<< 
-- URB_FUNCTION_BULK_OR_INTERRUPT_TRANSFER:
  PipeHandle           = 858ccfbc [endpoint 0x00000002]
  TransferFlags        = 00000002 (USBD_TRANSFER_DIRECTION_OUT, USBD_SHORT_TRANSFER_OK)
  TransferBufferLength = 00000012
  TransferBuffer       = 00000000
  TransferBufferMDL    = 86a5c4b0
  UrbLink              = 00000000
[147735 ms] UsbSnoop - FilterDispatchAny(a95c1fd2) : IRP_MJ_INTERNAL_DEVICE_CONTROL
[147735 ms] UsbSnoop - FdoHookDispatchInternalIoctl(a95c21ea) : fdo=868c0de8, Irp=8696c6a8, IRQL=0
[147735 ms]  >>>  URB 219 going down  >>> 
-- URB_FUNCTION_BULK_OR_INTERRUPT_TRANSFER:
  PipeHandle           = 858ccf9c [endpoint 0x00000081]
  TransferFlags        = 00000003 (USBD_TRANSFER_DIRECTION_IN, USBD_SHORT_TRANSFER_OK)
  TransferBufferLength = 00000200
  TransferBuffer       = 00000000
  TransferBufferMDL    = 86a5c4b0
  UrbLink              = 00000000
[147735 ms] UsbSnoop - FilterDispatchAny(a95c1fd2) : IRP_MJ_INTERNAL_DEVICE_CONTROL
[147735 ms] UsbSnoop - FdoHookDispatchInternalIoctl(a95c21ea) : fdo=868c0de8, Irp=86ab43e0, IRQL=0
[147735 ms]  >>>  URB 220 going down  >>> 
-- URB_FUNCTION_BULK_OR_INTERRUPT_TRANSFER:
  PipeHandle           = 858ccfbc [endpoint 0x00000002]
  TransferFlags        = 00000002 (USBD_TRANSFER_DIRECTION_OUT, USBD_SHORT_TRANSFER_OK)
  TransferBufferLength = 00000011
  TransferBuffer       = 00000000
  TransferBufferMDL    = 85e360a8
    00000000: 54 fd 64 00 80 10 64 01 40 60 0f 00 01 00 34 8e
    00000010: 0f
  UrbLink              = 00000000
[147736 ms] UsbSnoop - MyInternalIOCTLCompletion(a95c2126) : fido=857e2b00, Irp=86ab43e0, Context=868cbac8, IRQL=2
[147736 ms]  <<<  URB 220 coming back  <<< 
-- URB_FUNCTION_BULK_OR_INTERRUPT_TRANSFER:
  PipeHandle           = 858ccfbc [endpoint 0x00000002]
  TransferFlags        = 00000002 (USBD_TRANSFER_DIRECTION_OUT, USBD_SHORT_TRANSFER_OK)
  TransferBufferLength = 00000011
  TransferBuffer       = 00000000
  TransferBufferMDL    = 85e360a8
  UrbLink              = 00000000
[147738 ms] UsbSnoop - MyInternalIOCTLCompletion(a95c2126) : fido=857e2b00, Irp=8696c6a8, Context=86445700, IRQL=2
[147738 ms]  <<<  URB 219 coming back  <<< 
-- URB_FUNCTION_BULK_OR_INTERRUPT_TRANSFER:
  PipeHandle           = 858ccf9c [endpoint 0x00000081]
  TransferFlags        = 00000003 (USBD_TRANSFER_DIRECTION_IN, USBD_SHORT_TRANSFER_OK)
  TransferBufferLength = 00000012
  TransferBuffer       = 00000000
  TransferBufferMDL    = 86a5c4b0
    00000000: 54 fd 64 01 00 ff 64 00 80 10 60 40 02 0a 34 89
    00000010: 40 60
  UrbLink              = 00000000
[147738 ms] UsbSnoop - FilterDispatchAny(a95c1fd2) : IRP_MJ_INTERNAL_DEVICE_CONTROL
[147738 ms] UsbSnoop - FdoHookDispatchInternalIoctl(a95c21ea) : fdo=868c0de8, Irp=85745e48, IRQL=0
[147738 ms]  >>>  URB 221 going down  >>> 
-- URB_FUNCTION_BULK_OR_INTERRUPT_TRANSFER:
  PipeHandle           = 858ccf9c [endpoint 0x00000081]
  TransferFlags        = 00000003 (USBD_TRANSFER_DIRECTION_IN, USBD_SHORT_TRANSFER_OK)
  TransferBufferLength = 00000200
  TransferBuffer       = 00000000
  TransferBufferMDL    = 85e360a8
  UrbLink              = 00000000
[147741 ms] UsbSnoop - MyInternalIOCTLCompletion(a95c2126) : fido=857e2b00, Irp=85745e48, Context=86445700, IRQL=2
[147741 ms]  <<<  URB 221 coming back  <<< 
-- URB_FUNCTION_BULK_OR_INTERRUPT_TRANSFER:
  PipeHandle           = 858ccf9c [endpoint 0x00000081]
  TransferFlags        = 00000003 (USBD_TRANSFER_DIRECTION_IN, USBD_SHORT_TRANSFER_OK)
  TransferBufferLength = 00000012
  TransferBuffer       = 00000000
  TransferBufferMDL    = 85e360a8
    00000000: 54 fd 64 01 40 60 64 00 80 10 00 ff 02 00 35 80
    00000010: ff 00
  UrbLink              = 00000000
[147741 ms] UsbSnoop - FilterDispatchAny(a95c1fd2) : IRP_MJ_INTERNAL_DEVICE_CONTROL
[147741 ms] UsbSnoop - FdoHookDispatchInternalIoctl(a95c21ea) : fdo=868c0de8, Irp=85745e48, IRQL=0
[147741 ms]  >>>  URB 222 going down  >>> 
-- URB_FUNCTION_BULK_OR_INTERRUPT_TRANSFER:
  PipeHandle           = 858ccfbc [endpoint 0x00000002]
  TransferFlags        = 00000002 (USBD_TRANSFER_DIRECTION_OUT, USBD_SHORT_TRANSFER_OK)
  TransferBufferLength = 00000012
  TransferBuffer       = 00000000
  TransferBufferMDL    = 85e360a8
    00000000: 54 fd 64 00 00 ff 64 01 40 60 10 80 02 0a 35 8a
    00000010: 80 10
  UrbLink              = 00000000
[147742 ms] UsbSnoop - MyInternalIOCTLCompletion(a95c2126) : fido=857e2b00, Irp=85745e48, Context=86445700, IRQL=2
[147742 ms]  <<<  URB 222 coming back  <<< 
-- URB_FUNCTION_BULK_OR_INTERRUPT_TRANSFER:
  PipeHandle           = 858ccfbc [endpoint 0x00000002]
  TransferFlags        = 00000002 (USBD_TRANSFER_DIRECTION_OUT, USBD_SHORT_TRANSFER_OK)
  TransferBufferLength = 00000012
  TransferBuffer       = 00000000
  TransferBufferMDL    = 85e360a8
  UrbLink              = 00000000
[147742 ms] UsbSnoop - FilterDispatchAny(a95c1fd2) : IRP_MJ_INTERNAL_DEVICE_CONTROL
[147742 ms] UsbSnoop - FdoHookDispatchInternalIoctl(a95c21ea) : fdo=868c0de8, Irp=85745e48, IRQL=0
[147742 ms]  >>>  URB 223 going down  >>> 
-- URB_FUNCTION_BULK_OR_INTERRUPT_TRANSFER:
  PipeHandle           = 858ccf9c [endpoint 0x00000081]
  TransferFlags        = 00000003 (USBD_TRANSFER_DIRECTION_IN, USBD_SHORT_TRANSFER_OK)
  TransferBufferLength = 00000200
  TransferBuffer       = 00000000
  TransferBufferMDL    = 85e360a8
  UrbLink              = 00000000
[147743 ms] UsbSnoop - FilterDispatchAny(a95c1fd2) : IRP_MJ_INTERNAL_DEVICE_CONTROL
[147743 ms] UsbSnoop - FdoHookDispatchInternalIoctl(a95c21ea) : fdo=868c0de8, Irp=86a14008, IRQL=0
[147743 ms]  >>>  URB 224 going down  >>> 
-- URB_FUNCTION_BULK_OR_INTERRUPT_TRANSFER:
  PipeHandle           = 858ccfbc [endpoint 0x00000002]
  TransferFlags        = 00000002 (USBD_TRANSFER_DIRECTION_OUT, USBD_SHORT_TRANSFER_OK)
  TransferBufferLength = 00000012
  TransferBuffer       = 00000000
  TransferBufferMDL    = 85745488
    00000000: 54 fd 64 00 40 de 64 01 40 60 10 80 02 00 35 9f
    00000010: 80 10
  UrbLink              = 00000000
[147744 ms] UsbSnoop - MyInternalIOCTLCompletion(a95c2126) : fido=857e2b00, Irp=86a14008, Context=868cbac8, IRQL=2
[147744 ms]  <<<  URB 224 coming back  <<< 
-- URB_FUNCTION_BULK_OR_INTERRUPT_TRANSFER:
  PipeHandle           = 858ccfbc [endpoint 0x00000002]
  TransferFlags        = 00000002 (USBD_TRANSFER_DIRECTION_OUT, USBD_SHORT_TRANSFER_OK)
  TransferBufferLength = 00000012
  TransferBuffer       = 00000000
  TransferBufferMDL    = 85745488
  UrbLink              = 00000000
[147745 ms] UsbSnoop - MyInternalIOCTLCompletion(a95c2126) : fido=857e2b00, Irp=85745e48, Context=86445700, IRQL=2
[147745 ms]  <<<  URB 223 coming back  <<< 
-- URB_FUNCTION_BULK_OR_INTERRUPT_TRANSFER:
  PipeHandle           = 858ccf9c [endpoint 0x00000081]
  TransferFlags        = 00000003 (USBD_TRANSFER_DIRECTION_IN, USBD_SHORT_TRANSFER_OK)
  TransferBufferLength = 00000012
  TransferBuffer       = 00000000
  TransferBufferMDL    = 85e360a8
    00000000: 54 fd 64 01 00 ff 64 00 80 10 60 40 02 0a 35 8a
    00000010: 40 60
  UrbLink              = 00000000
[147745 ms] UsbSnoop - FilterDispatchAny(a95c1fd2) : IRP_MJ_INTERNAL_DEVICE_CONTROL
[147745 ms] UsbSnoop - FdoHookDispatchInternalIoctl(a95c21ea) : fdo=868c0de8, Irp=86ab43e0, IRQL=0
[147745 ms]  >>>  URB 225 going down  >>> 
-- URB_FUNCTION_BULK_OR_INTERRUPT_TRANSFER:
  PipeHandle           = 858ccf9c [endpoint 0x00000081]
  TransferFlags        = 00000003 (USBD_TRANSFER_DIRECTION_IN, USBD_SHORT_TRANSFER_OK)
  TransferBufferLength = 00000200
  TransferBuffer       = 00000000
  TransferBufferMDL    = 85a59f60
  UrbLink              = 00000000
[147769 ms] UsbSnoop - FilterDispatchAny(a95c1fd2) : IRP_MJ_INTERNAL_DEVICE_CONTROL
[147769 ms] UsbSnoop - FdoHookDispatchInternalIoctl(a95c21ea) : fdo=868c0de8, Irp=8562e558, IRQL=0
[147769 ms]  >>>  URB 226 going down  >>> 
-- URB_FUNCTION_BULK_OR_INTERRUPT_TRANSFER:
  PipeHandle           = 858ccfbc [endpoint 0x00000002]
  TransferFlags        = 00000002 (USBD_TRANSFER_DIRECTION_OUT, USBD_SHORT_TRANSFER_OK)
  TransferBufferLength = 0000001e
  TransferBuffer       = 00000000
  TransferBufferMDL    = 86a14848
    00000000: 54 fd 64 00 80 11 64 01 40 60 5e f1 0e 00 36 de
    00000010: 20 01 2f 31 32 33 34 35 36 37 38 39 30 00
  UrbLink              = 00000000
[147770 ms] UsbSnoop - MyInternalIOCTLCompletion(a95c2126) : fido=857e2b00, Irp=8562e558, Context=868cbac8, IRQL=2
[147770 ms]  <<<  URB 226 coming back  <<< 
-- URB_FUNCTION_BULK_OR_INTERRUPT_TRANSFER:
  PipeHandle           = 858ccfbc [endpoint 0x00000002]
  TransferFlags        = 00000002 (USBD_TRANSFER_DIRECTION_OUT, USBD_SHORT_TRANSFER_OK)
  TransferBufferLength = 0000001e
  TransferBuffer       = 00000000
  TransferBufferMDL    = 86a14848
  UrbLink              = 00000000
[147771 ms] UsbSnoop - MyInternalIOCTLCompletion(a95c2126) : fido=857e2b00, Irp=86ab43e0, Context=86445700, IRQL=2
[147771 ms]  <<<  URB 225 coming back  <<< 
-- URB_FUNCTION_BULK_OR_INTERRUPT_TRANSFER:
  PipeHandle           = 858ccf9c [endpoint 0x00000081]
  TransferFlags        = 00000003 (USBD_TRANSFER_DIRECTION_IN, USBD_SHORT_TRANSFER_OK)
  TransferBufferLength = 00000012
  TransferBuffer       = 00000000
  TransferBufferMDL    = 85a59f60
    00000000: 54 fd 64 01 00 ff 64 00 80 11 60 40 02 0a 36 8c
    00000010: 40 60
  UrbLink              = 00000000
[147771 ms] UsbSnoop - FilterDispatchAny(a95c1fd2) : IRP_MJ_INTERNAL_DEVICE_CONTROL
[147771 ms] UsbSnoop - FdoHookDispatchInternalIoctl(a95c21ea) : fdo=868c0de8, Irp=856de590, IRQL=0
[147771 ms]  >>>  URB 227 going down  >>> 
-- URB_FUNCTION_BULK_OR_INTERRUPT_TRANSFER:
  PipeHandle           = 858ccf9c [endpoint 0x00000081]
  TransferFlags        = 00000003 (USBD_TRANSFER_DIRECTION_IN, USBD_SHORT_TRANSFER_OK)
  TransferBufferLength = 00000200
  TransferBuffer       = 00000000
  TransferBufferMDL    = 85a59f60
  UrbLink              = 00000000
[147787 ms] UsbSnoop - MyInternalIOCTLCompletion(a95c2126) : fido=857e2b00, Irp=856de590, Context=86445700, IRQL=2
[147787 ms]  <<<  URB 227 coming back  <<< 
-- URB_FUNCTION_BULK_OR_INTERRUPT_TRANSFER:
  PipeHandle           = 858ccf9c [endpoint 0x00000081]
  TransferFlags        = 00000003 (USBD_TRANSFER_DIRECTION_IN, USBD_SHORT_TRANSFER_OK)
  TransferBufferLength = 0000001b
  TransferBuffer       = 00000000
  TransferBufferMDL    = 85a59f60
    00000000: 54 fd 64 01 40 60 64 00 80 11 35 3f 0b 00 36 00
    00000010: 20 00 00 00 00 00 00 8a d6 01 00
  UrbLink              = 00000000
[147787 ms] UsbSnoop - FilterDispatchAny(a95c1fd2) : IRP_MJ_INTERNAL_DEVICE_CONTROL
[147787 ms] UsbSnoop - FdoHookDispatchInternalIoctl(a95c21ea) : fdo=868c0de8, Irp=85745e48, IRQL=0
[147787 ms]  >>>  URB 228 going down  >>> 
-- URB_FUNCTION_BULK_OR_INTERRUPT_TRANSFER:
  PipeHandle           = 858ccfbc [endpoint 0x00000002]
  TransferFlags        = 00000002 (USBD_TRANSFER_DIRECTION_OUT, USBD_SHORT_TRANSFER_OK)
  TransferBufferLength = 00000012
  TransferBuffer       = 00000000
  TransferBufferMDL    = 85e360a8
    00000000: 54 fd 64 00 00 ff 64 01 40 60 11 80 02 0a 36 8c
    00000010: 80 11
  UrbLink              = 00000000
[147788 ms] UsbSnoop - MyInternalIOCTLCompletion(a95c2126) : fido=857e2b00, Irp=85745e48, Context=86445700, IRQL=2
[147788 ms]  <<<  URB 228 coming back  <<< 
-- URB_FUNCTION_BULK_OR_INTERRUPT_TRANSFER:
  PipeHandle           = 858ccfbc [endpoint 0x00000002]
  TransferFlags        = 00000002 (USBD_TRANSFER_DIRECTION_OUT, USBD_SHORT_TRANSFER_OK)
  TransferBufferLength = 00000012
  TransferBuffer       = 00000000
  TransferBufferMDL    = 85e360a8
  UrbLink              = 00000000
[147788 ms] UsbSnoop - FilterDispatchAny(a95c1fd2) : IRP_MJ_INTERNAL_DEVICE_CONTROL
[147788 ms] UsbSnoop - FdoHookDispatchInternalIoctl(a95c21ea) : fdo=868c0de8, Irp=856de590, IRQL=0
[147788 ms]  >>>  URB 229 going down  >>> 
-- URB_FUNCTION_BULK_OR_INTERRUPT_TRANSFER:
  PipeHandle           = 858ccf9c [endpoint 0x00000081]
  TransferFlags        = 00000003 (USBD_TRANSFER_DIRECTION_IN, USBD_SHORT_TRANSFER_OK)
  TransferBufferLength = 00000200
  TransferBuffer       = 00000000
  TransferBufferMDL    = 85a59f60
  UrbLink              = 00000000
[147789 ms] UsbSnoop - FilterDispatchAny(a95c1fd2) : IRP_MJ_INTERNAL_DEVICE_CONTROL
[147789 ms] UsbSnoop - FdoHookDispatchInternalIoctl(a95c21ea) : fdo=868c0de8, Irp=86ab43e0, IRQL=0
[147789 ms]  >>>  URB 230 going down  >>> 
-- URB_FUNCTION_BULK_OR_INTERRUPT_TRANSFER:
  PipeHandle           = 858ccfbc [endpoint 0x00000002]
  TransferFlags        = 00000002 (USBD_TRANSFER_DIRECTION_OUT, USBD_SHORT_TRANSFER_OK)
  TransferBufferLength = 00000012
  TransferBuffer       = 00000000
  TransferBufferMDL    = 85ddb8d0
    00000000: 54 fd 64 00 40 de 64 01 40 60 11 80 02 00 37 a2
    00000010: 80 11
  UrbLink              = 00000000
[147790 ms] UsbSnoop - MyInternalIOCTLCompletion(a95c2126) : fido=857e2b00, Irp=86ab43e0, Context=868cbac8, IRQL=2
[147790 ms]  <<<  URB 230 coming back  <<< 
-- URB_FUNCTION_BULK_OR_INTERRUPT_TRANSFER:
  PipeHandle           = 858ccfbc [endpoint 0x00000002]
  TransferFlags        = 00000002 (USBD_TRANSFER_DIRECTION_OUT, USBD_SHORT_TRANSFER_OK)
  TransferBufferLength = 00000012
  TransferBuffer       = 00000000
  TransferBufferMDL    = 85ddb8d0
  UrbLink              = 00000000
[147791 ms] UsbSnoop - MyInternalIOCTLCompletion(a95c2126) : fido=857e2b00, Irp=856de590, Context=86445700, IRQL=2
[147791 ms]  <<<  URB 229 coming back  <<< 
-- URB_FUNCTION_BULK_OR_INTERRUPT_TRANSFER:
  PipeHandle           = 858ccf9c [endpoint 0x00000081]
  TransferFlags        = 00000003 (USBD_TRANSFER_DIRECTION_IN, USBD_SHORT_TRANSFER_OK)
  TransferBufferLength = 00000012
  TransferBuffer       = 00000000
  TransferBufferMDL    = 85a59f60
    00000000: 54 fd 64 01 00 ff 64 00 80 11 60 40 02 0a 37 8d
    00000010: 40 60
  UrbLink              = 00000000
[147791 ms] UsbSnoop - FilterDispatchAny(a95c1fd2) : IRP_MJ_INTERNAL_DEVICE_CONTROL
[147791 ms] UsbSnoop - FdoHookDispatchInternalIoctl(a95c21ea) : fdo=868c0de8, Irp=856de590, IRQL=0
[147791 ms]  >>>  URB 231 going down  >>> 
-- URB_FUNCTION_BULK_OR_INTERRUPT_TRANSFER:
  PipeHandle           = 858ccf9c [endpoint 0x00000081]
  TransferFlags        = 00000003 (USBD_TRANSFER_DIRECTION_IN, USBD_SHORT_TRANSFER_OK)
  TransferBufferLength = 00000200
  TransferBuffer       = 00000000
  TransferBufferMDL    = 85a59f60
  UrbLink              = 00000000
[147911 ms] UsbSnoop - FilterDispatchAny(a95c1fd2) : IRP_MJ_INTERNAL_DEVICE_CONTROL
[147911 ms] UsbSnoop - FdoHookDispatchInternalIoctl(a95c21ea) : fdo=868c0de8, Irp=868d0390, IRQL=0
[147911 ms]  >>>  URB 232 going down  >>> 
-- URB_FUNCTION_BULK_OR_INTERRUPT_TRANSFER:
  PipeHandle           = 858ccfbc [endpoint 0x00000002]
  TransferFlags        = 00000002 (USBD_TRANSFER_DIRECTION_OUT, USBD_SHORT_TRANSFER_OK)
  TransferBufferLength = 00000032
  TransferBuffer       = 00000000
  TransferBufferMDL    = 85dc0f88
    00000000: 54 fd 64 00 80 12 64 01 40 60 0f ac 22 00 38 61
    00000010: 20 01 2f 31 32 33 34 35 36 37 38 39 30 2f 47 65
    00000020: 74 74 69 6e 67 20 53 74 61 72 74 65 64 2e 74 6e
    00000030: 73 00
  UrbLink              = 00000000
[147912 ms] UsbSnoop - MyInternalIOCTLCompletion(a95c2126) : fido=857e2b00, Irp=868d0390, Context=868cbac8, IRQL=2
[147912 ms]  <<<  URB 232 coming back  <<< 
-- URB_FUNCTION_BULK_OR_INTERRUPT_TRANSFER:
  PipeHandle           = 858ccfbc [endpoint 0x00000002]
  TransferFlags        = 00000002 (USBD_TRANSFER_DIRECTION_OUT, USBD_SHORT_TRANSFER_OK)
  TransferBufferLength = 00000032
  TransferBuffer       = 00000000
  TransferBufferMDL    = 85dc0f88
  UrbLink              = 00000000
[147913 ms] UsbSnoop - MyInternalIOCTLCompletion(a95c2126) : fido=857e2b00, Irp=856de590, Context=86445700, IRQL=2
[147913 ms]  <<<  URB 231 coming back  <<< 
-- URB_FUNCTION_BULK_OR_INTERRUPT_TRANSFER:
  PipeHandle           = 858ccf9c [endpoint 0x00000081]
  TransferFlags        = 00000003 (USBD_TRANSFER_DIRECTION_IN, USBD_SHORT_TRANSFER_OK)
  TransferBufferLength = 00000012
  TransferBuffer       = 00000000
  TransferBufferMDL    = 85a59f60
    00000000: 54 fd 64 01 00 ff 64 00 80 12 60 40 02 0a 38 8f
    00000010: 40 60
  UrbLink              = 00000000
[147913 ms] UsbSnoop - FilterDispatchAny(a95c1fd2) : IRP_MJ_INTERNAL_DEVICE_CONTROL
[147913 ms] UsbSnoop - FdoHookDispatchInternalIoctl(a95c21ea) : fdo=868c0de8, Irp=856de590, IRQL=0
[147913 ms]  >>>  URB 233 going down  >>> 
-- URB_FUNCTION_BULK_OR_INTERRUPT_TRANSFER:
  PipeHandle           = 858ccf9c [endpoint 0x00000081]
  TransferFlags        = 00000003 (USBD_TRANSFER_DIRECTION_IN, USBD_SHORT_TRANSFER_OK)
  TransferBufferLength = 00000200
  TransferBuffer       = 00000000
  TransferBufferMDL    = 85a59f60
  UrbLink              = 00000000
[147927 ms] UsbSnoop - MyInternalIOCTLCompletion(a95c2126) : fido=857e2b00, Irp=856de590, Context=86445700, IRQL=2
[147927 ms]  <<<  URB 233 coming back  <<< 
-- URB_FUNCTION_BULK_OR_INTERRUPT_TRANSFER:
  PipeHandle           = 858ccf9c [endpoint 0x00000081]
  TransferFlags        = 00000003 (USBD_TRANSFER_DIRECTION_IN, USBD_SHORT_TRANSFER_OK)
  TransferBufferLength = 00000012
  TransferBuffer       = 00000000
  TransferBufferMDL    = 85a59f60
    00000000: 54 fd 64 01 40 60 64 00 80 12 0a ff 02 00 37 8e
    00000010: ff 0a
  UrbLink              = 00000000
[147927 ms] UsbSnoop - FilterDispatchAny(a95c1fd2) : IRP_MJ_INTERNAL_DEVICE_CONTROL
[147927 ms] UsbSnoop - FdoHookDispatchInternalIoctl(a95c21ea) : fdo=868c0de8, Irp=856de590, IRQL=0
[147927 ms]  >>>  URB 234 going down  >>> 
-- URB_FUNCTION_BULK_OR_INTERRUPT_TRANSFER:
  PipeHandle           = 858ccfbc [endpoint 0x00000002]
  TransferFlags        = 00000002 (USBD_TRANSFER_DIRECTION_OUT, USBD_SHORT_TRANSFER_OK)
  TransferBufferLength = 00000012
  TransferBuffer       = 00000000
  TransferBufferMDL    = 85c5f890
    00000000: 54 fd 64 00 00 ff 64 01 40 60 12 80 02 0a 37 8e
    00000010: 80 12
  UrbLink              = 00000000
[147928 ms] UsbSnoop - MyInternalIOCTLCompletion(a95c2126) : fido=857e2b00, Irp=856de590, Context=86445700, IRQL=2
[147928 ms]  <<<  URB 234 coming back  <<< 
-- URB_FUNCTION_BULK_OR_INTERRUPT_TRANSFER:
  PipeHandle           = 858ccfbc [endpoint 0x00000002]
  TransferFlags        = 00000002 (USBD_TRANSFER_DIRECTION_OUT, USBD_SHORT_TRANSFER_OK)
  TransferBufferLength = 00000012
  TransferBuffer       = 00000000
  TransferBufferMDL    = 85c5f890
  UrbLink              = 00000000
[147928 ms] UsbSnoop - FilterDispatchAny(a95c1fd2) : IRP_MJ_INTERNAL_DEVICE_CONTROL
[147928 ms] UsbSnoop - FdoHookDispatchInternalIoctl(a95c21ea) : fdo=868c0de8, Irp=856de590, IRQL=0
[147928 ms]  >>>  URB 235 going down  >>> 
-- URB_FUNCTION_BULK_OR_INTERRUPT_TRANSFER:
  PipeHandle           = 858ccf9c [endpoint 0x00000081]
  TransferFlags        = 00000003 (USBD_TRANSFER_DIRECTION_IN, USBD_SHORT_TRANSFER_OK)
  TransferBufferLength = 00000200
  TransferBuffer       = 00000000
  TransferBufferMDL    = 85dc0f88
  UrbLink              = 00000000
[147929 ms] UsbSnoop - FilterDispatchAny(a95c1fd2) : IRP_MJ_INTERNAL_DEVICE_CONTROL
[147929 ms] UsbSnoop - FdoHookDispatchInternalIoctl(a95c21ea) : fdo=868c0de8, Irp=85745e48, IRQL=0
[147929 ms]  >>>  URB 236 going down  >>> 
-- URB_FUNCTION_BULK_OR_INTERRUPT_TRANSFER:
  PipeHandle           = 858ccfbc [endpoint 0x00000002]
  TransferFlags        = 00000002 (USBD_TRANSFER_DIRECTION_OUT, USBD_SHORT_TRANSFER_OK)
  TransferBufferLength = 00000012
  TransferBuffer       = 00000000
  TransferBufferMDL    = 85d89a68
    00000000: 54 fd 64 00 40 de 64 01 40 60 12 80 02 00 39 a5
    00000010: 80 12
  UrbLink              = 00000000
[147930 ms] UsbSnoop - MyInternalIOCTLCompletion(a95c2126) : fido=857e2b00, Irp=85745e48, Context=868cbac8, IRQL=2
[147930 ms]  <<<  URB 236 coming back  <<< 
-- URB_FUNCTION_BULK_OR_INTERRUPT_TRANSFER:
  PipeHandle           = 858ccfbc [endpoint 0x00000002]
  TransferFlags        = 00000002 (USBD_TRANSFER_DIRECTION_OUT, USBD_SHORT_TRANSFER_OK)
  TransferBufferLength = 00000012
  TransferBuffer       = 00000000
  TransferBufferMDL    = 85d89a68
  UrbLink              = 00000000
[147932 ms] UsbSnoop - MyInternalIOCTLCompletion(a95c2126) : fido=857e2b00, Irp=856de590, Context=86445700, IRQL=2
[147932 ms]  <<<  URB 235 coming back  <<< 
-- URB_FUNCTION_BULK_OR_INTERRUPT_TRANSFER:
  PipeHandle           = 858ccf9c [endpoint 0x00000081]
  TransferFlags        = 00000003 (USBD_TRANSFER_DIRECTION_IN, USBD_SHORT_TRANSFER_OK)
  TransferBufferLength = 00000012
  TransferBuffer       = 00000000
  TransferBufferMDL    = 85dc0f88
    00000000: 54 fd 64 01 00 ff 64 00 80 12 60 40 02 0a 39 90
    00000010: 40 60
  UrbLink              = 00000000
[147932 ms] UsbSnoop - FilterDispatchAny(a95c1fd2) : IRP_MJ_INTERNAL_DEVICE_CONTROL
[147932 ms] UsbSnoop - FdoHookDispatchInternalIoctl(a95c21ea) : fdo=868c0de8, Irp=856de590, IRQL=0
[147932 ms]  >>>  URB 237 going down  >>> 
-- URB_FUNCTION_BULK_OR_INTERRUPT_TRANSFER:
  PipeHandle           = 858ccf9c [endpoint 0x00000081]
  TransferFlags        = 00000003 (USBD_TRANSFER_DIRECTION_IN, USBD_SHORT_TRANSFER_OK)
  TransferBufferLength = 00000200
  TransferBuffer       = 00000000
  TransferBufferMDL    = 85745488
  UrbLink              = 00000000
[147991 ms] UsbSnoop - FilterDispatchAny(a95c1fd2) : IRP_MJ_INTERNAL_DEVICE_CONTROL
[147991 ms] UsbSnoop - FdoHookDispatchInternalIoctl(a95c21ea) : fdo=868c0de8, Irp=868d0390, IRQL=0
[147991 ms]  >>>  URB 238 going down  >>> 
-- URB_FUNCTION_BULK_OR_INTERRUPT_TRANSFER:
  PipeHandle           = 858ccfbc [endpoint 0x00000002]
  TransferFlags        = 00000002 (USBD_TRANSFER_DIRECTION_OUT, USBD_SHORT_TRANSFER_OK)
  TransferBufferLength = 0000001e
  TransferBuffer       = 00000000
  TransferBufferMDL    = 85d89a68
    00000000: 54 fd 64 00 80 13 64 01 40 60 5e f1 0e 00 3a e4
    00000010: 20 01 2f 31 32 33 34 35 36 37 38 39 30 00
  UrbLink              = 00000000
[147992 ms] UsbSnoop - MyInternalIOCTLCompletion(a95c2126) : fido=857e2b00, Irp=868d0390, Context=868cbac8, IRQL=2
[147992 ms]  <<<  URB 238 coming back  <<< 
-- URB_FUNCTION_BULK_OR_INTERRUPT_TRANSFER:
  PipeHandle           = 858ccfbc [endpoint 0x00000002]
  TransferFlags        = 00000002 (USBD_TRANSFER_DIRECTION_OUT, USBD_SHORT_TRANSFER_OK)
  TransferBufferLength = 0000001e
  TransferBuffer       = 00000000
  TransferBufferMDL    = 85d89a68
  UrbLink              = 00000000
[147993 ms] UsbSnoop - MyInternalIOCTLCompletion(a95c2126) : fido=857e2b00, Irp=856de590, Context=86445700, IRQL=2
[147993 ms]  <<<  URB 237 coming back  <<< 
-- URB_FUNCTION_BULK_OR_INTERRUPT_TRANSFER:
  PipeHandle           = 858ccf9c [endpoint 0x00000081]
  TransferFlags        = 00000003 (USBD_TRANSFER_DIRECTION_IN, USBD_SHORT_TRANSFER_OK)
  TransferBufferLength = 00000012
  TransferBuffer       = 00000000
  TransferBufferMDL    = 85745488
    00000000: 54 fd 64 01 00 ff 64 00 80 13 60 40 02 0a 3a 92
    00000010: 40 60
  UrbLink              = 00000000
[147993 ms] UsbSnoop - FilterDispatchAny(a95c1fd2) : IRP_MJ_INTERNAL_DEVICE_CONTROL
[147993 ms] UsbSnoop - FdoHookDispatchInternalIoctl(a95c21ea) : fdo=868c0de8, Irp=856de590, IRQL=0
[147993 ms]  >>>  URB 239 going down  >>> 
-- URB_FUNCTION_BULK_OR_INTERRUPT_TRANSFER:
  PipeHandle           = 858ccf9c [endpoint 0x00000081]
  TransferFlags        = 00000003 (USBD_TRANSFER_DIRECTION_IN, USBD_SHORT_TRANSFER_OK)
  TransferBufferLength = 00000200
  TransferBuffer       = 00000000
  TransferBufferMDL    = 85dc0f88
  UrbLink              = 00000000
[148009 ms] UsbSnoop - MyInternalIOCTLCompletion(a95c2126) : fido=857e2b00, Irp=856de590, Context=86445700, IRQL=2
[148009 ms]  <<<  URB 239 coming back  <<< 
-- URB_FUNCTION_BULK_OR_INTERRUPT_TRANSFER:
  PipeHandle           = 858ccf9c [endpoint 0x00000081]
  TransferFlags        = 00000003 (USBD_TRANSFER_DIRECTION_IN, USBD_SHORT_TRANSFER_OK)
  TransferBufferLength = 0000001b
  TransferBuffer       = 00000000
  TransferBufferMDL    = 85dc0f88
    00000000: 54 fd 64 01 40 60 64 00 80 13 35 3f 0b 00 38 04
    00000010: 20 00 00 00 00 00 00 8a d6 01 00
  UrbLink              = 00000000
[148009 ms] UsbSnoop - FilterDispatchAny(a95c1fd2) : IRP_MJ_INTERNAL_DEVICE_CONTROL
[148009 ms] UsbSnoop - FdoHookDispatchInternalIoctl(a95c21ea) : fdo=868c0de8, Irp=856de590, IRQL=0
[148009 ms]  >>>  URB 240 going down  >>> 
-- URB_FUNCTION_BULK_OR_INTERRUPT_TRANSFER:
  PipeHandle           = 858ccfbc [endpoint 0x00000002]
  TransferFlags        = 00000002 (USBD_TRANSFER_DIRECTION_OUT, USBD_SHORT_TRANSFER_OK)
  TransferBufferLength = 00000012
  TransferBuffer       = 00000000
  TransferBufferMDL    = 85dc0f88
    00000000: 54 fd 64 00 00 ff 64 01 40 60 13 80 02 0a 38 90
    00000010: 80 13
  UrbLink              = 00000000
[148010 ms] UsbSnoop - MyInternalIOCTLCompletion(a95c2126) : fido=857e2b00, Irp=856de590, Context=86445700, IRQL=2
[148010 ms]  <<<  URB 240 coming back  <<< 
-- URB_FUNCTION_BULK_OR_INTERRUPT_TRANSFER:
  PipeHandle           = 858ccfbc [endpoint 0x00000002]
  TransferFlags        = 00000002 (USBD_TRANSFER_DIRECTION_OUT, USBD_SHORT_TRANSFER_OK)
  TransferBufferLength = 00000012
  TransferBuffer       = 00000000
  TransferBufferMDL    = 85dc0f88
  UrbLink              = 00000000
[148010 ms] UsbSnoop - FilterDispatchAny(a95c1fd2) : IRP_MJ_INTERNAL_DEVICE_CONTROL
[148010 ms] UsbSnoop - FdoHookDispatchInternalIoctl(a95c21ea) : fdo=868c0de8, Irp=856de590, IRQL=0
[148010 ms]  >>>  URB 241 going down  >>> 
-- URB_FUNCTION_BULK_OR_INTERRUPT_TRANSFER:
  PipeHandle           = 858ccf9c [endpoint 0x00000081]
  TransferFlags        = 00000003 (USBD_TRANSFER_DIRECTION_IN, USBD_SHORT_TRANSFER_OK)
  TransferBufferLength = 00000200
  TransferBuffer       = 00000000
  TransferBufferMDL    = 86946c18
  UrbLink              = 00000000
[148012 ms] UsbSnoop - FilterDispatchAny(a95c1fd2) : IRP_MJ_INTERNAL_DEVICE_CONTROL
[148012 ms] UsbSnoop - FdoHookDispatchInternalIoctl(a95c21ea) : fdo=868c0de8, Irp=868d0390, IRQL=0
[148012 ms]  >>>  URB 242 going down  >>> 
-- URB_FUNCTION_BULK_OR_INTERRUPT_TRANSFER:
  PipeHandle           = 858ccfbc [endpoint 0x00000002]
  TransferFlags        = 00000002 (USBD_TRANSFER_DIRECTION_OUT, USBD_SHORT_TRANSFER_OK)
  TransferBufferLength = 00000012
  TransferBuffer       = 00000000
  TransferBufferMDL    = 86b09108
    00000000: 54 fd 64 00 40 de 64 01 40 60 13 80 02 00 3b a8
    00000010: 80 13
  UrbLink              = 00000000
[148013 ms] UsbSnoop - MyInternalIOCTLCompletion(a95c2126) : fido=857e2b00, Irp=868d0390, Context=868cbac8, IRQL=2
[148013 ms]  <<<  URB 242 coming back  <<< 
-- URB_FUNCTION_BULK_OR_INTERRUPT_TRANSFER:
  PipeHandle           = 858ccfbc [endpoint 0x00000002]
  TransferFlags        = 00000002 (USBD_TRANSFER_DIRECTION_OUT, USBD_SHORT_TRANSFER_OK)
  TransferBufferLength = 00000012
  TransferBuffer       = 00000000
  TransferBufferMDL    = 86b09108
  UrbLink              = 00000000
[148014 ms] UsbSnoop - MyInternalIOCTLCompletion(a95c2126) : fido=857e2b00, Irp=856de590, Context=86445700, IRQL=2
[148014 ms]  <<<  URB 241 coming back  <<< 
-- URB_FUNCTION_BULK_OR_INTERRUPT_TRANSFER:
  PipeHandle           = 858ccf9c [endpoint 0x00000081]
  TransferFlags        = 00000003 (USBD_TRANSFER_DIRECTION_IN, USBD_SHORT_TRANSFER_OK)
  TransferBufferLength = 00000012
  TransferBuffer       = 00000000
  TransferBufferMDL    = 86946c18
    00000000: 54 fd 64 01 00 ff 64 00 80 13 60 40 02 0a 3b 93
    00000010: 40 60
  UrbLink              = 00000000
[148015 ms] UsbSnoop - FilterDispatchAny(a95c1fd2) : IRP_MJ_INTERNAL_DEVICE_CONTROL
[148015 ms] UsbSnoop - FdoHookDispatchInternalIoctl(a95c21ea) : fdo=868c0de8, Irp=856de590, IRQL=0
[148015 ms]  >>>  URB 243 going down  >>> 
-- URB_FUNCTION_BULK_OR_INTERRUPT_TRANSFER:
  PipeHandle           = 858ccf9c [endpoint 0x00000081]
  TransferFlags        = 00000003 (USBD_TRANSFER_DIRECTION_IN, USBD_SHORT_TRANSFER_OK)
  TransferBufferLength = 00000200
  TransferBuffer       = 00000000
  TransferBufferMDL    = 86830f88
  UrbLink              = 00000000
[148018 ms] UsbSnoop - FilterDispatchAny(a95c1fd2) : IRP_MJ_INTERNAL_DEVICE_CONTROL
[148018 ms] UsbSnoop - FdoHookDispatchInternalIoctl(a95c21ea) : fdo=868c0de8, Irp=868a56e0, IRQL=0
[148018 ms]  >>>  URB 244 going down  >>> 
-- URB_FUNCTION_BULK_OR_INTERRUPT_TRANSFER:
  PipeHandle           = 858ccfbc [endpoint 0x00000002]
  TransferFlags        = 00000002 (USBD_TRANSFER_DIRECTION_OUT, USBD_SHORT_TRANSFER_OK)
  TransferBufferLength = 00000036
  TransferBuffer       = 00000000
  TransferBufferMDL    = 865d4f88
    00000000: 54 fd 64 00 80 14 64 01 40 60 12 bb 26 00 3c 7d
    00000010: 03 01 2f 31 32 33 34 35 36 37 38 39 30 2f 47 65
    00000020: 74 74 69 6e 67 20 53 74 61 72 74 65 64 2e 74 6e
    00000030: 73 00 00 00 10 b1
  UrbLink              = 00000000
[148019 ms] UsbSnoop - MyInternalIOCTLCompletion(a95c2126) : fido=857e2b00, Irp=868a56e0, Context=868cbac8, IRQL=2
[148019 ms]  <<<  URB 244 coming back  <<< 
-- URB_FUNCTION_BULK_OR_INTERRUPT_TRANSFER:
  PipeHandle           = 858ccfbc [endpoint 0x00000002]
  TransferFlags        = 00000002 (USBD_TRANSFER_DIRECTION_OUT, USBD_SHORT_TRANSFER_OK)
  TransferBufferLength = 00000036
  TransferBuffer       = 00000000
  TransferBufferMDL    = 865d4f88
  UrbLink              = 00000000
[148020 ms] UsbSnoop - MyInternalIOCTLCompletion(a95c2126) : fido=857e2b00, Irp=856de590, Context=86445700, IRQL=2
[148020 ms]  <<<  URB 243 coming back  <<< 
-- URB_FUNCTION_BULK_OR_INTERRUPT_TRANSFER:
  PipeHandle           = 858ccf9c [endpoint 0x00000081]
  TransferFlags        = 00000003 (USBD_TRANSFER_DIRECTION_IN, USBD_SHORT_TRANSFER_OK)
  TransferBufferLength = 00000012
  TransferBuffer       = 00000000
  TransferBufferMDL    = 86830f88
    00000000: 54 fd 64 01 00 ff 64 00 80 14 60 40 02 0a 3c 95
    00000010: 40 60
  UrbLink              = 00000000
[148020 ms] UsbSnoop - FilterDispatchAny(a95c1fd2) : IRP_MJ_INTERNAL_DEVICE_CONTROL
[148020 ms] UsbSnoop - FdoHookDispatchInternalIoctl(a95c21ea) : fdo=868c0de8, Irp=868a56e0, IRQL=0
[148020 ms]  >>>  URB 245 going down  >>> 
-- URB_FUNCTION_BULK_OR_INTERRUPT_TRANSFER:
  PipeHandle           = 858ccf9c [endpoint 0x00000081]
  TransferFlags        = 00000003 (USBD_TRANSFER_DIRECTION_IN, USBD_SHORT_TRANSFER_OK)
  TransferBufferLength = 00000200
  TransferBuffer       = 00000000
  TransferBufferMDL    = 85e2d8b8
  UrbLink              = 00000000
[148045 ms] UsbSnoop - MyInternalIOCTLCompletion(a95c2126) : fido=857e2b00, Irp=868a56e0, Context=86445700, IRQL=2
[148045 ms]  <<<  URB 245 coming back  <<< 
-- URB_FUNCTION_BULK_OR_INTERRUPT_TRANSFER:
  PipeHandle           = 858ccf9c [endpoint 0x00000081]
  TransferFlags        = 00000003 (USBD_TRANSFER_DIRECTION_IN, USBD_SHORT_TRANSFER_OK)
  TransferBufferLength = 00000011
  TransferBuffer       = 00000000
  TransferBufferMDL    = 85e2d8b8
    00000000: 54 fd 64 01 40 60 64 00 80 14 04 00 01 00 39 8c
    00000010: 04
  UrbLink              = 00000000
[148045 ms] UsbSnoop - FilterDispatchAny(a95c1fd2) : IRP_MJ_INTERNAL_DEVICE_CONTROL
[148045 ms] UsbSnoop - FdoHookDispatchInternalIoctl(a95c21ea) : fdo=868c0de8, Irp=86ab43e0, IRQL=0
[148045 ms]  >>>  URB 246 going down  >>> 
-- URB_FUNCTION_BULK_OR_INTERRUPT_TRANSFER:
  PipeHandle           = 858ccfbc [endpoint 0x00000002]
  TransferFlags        = 00000002 (USBD_TRANSFER_DIRECTION_OUT, USBD_SHORT_TRANSFER_OK)
  TransferBufferLength = 00000012
  TransferBuffer       = 00000000
  TransferBufferMDL    = 86b21c10
    00000000: 54 fd 64 00 00 ff 64 01 40 60 14 80 02 0a 39 92
    00000010: 80 14
  UrbLink              = 00000000
[148046 ms] UsbSnoop - MyInternalIOCTLCompletion(a95c2126) : fido=857e2b00, Irp=86ab43e0, Context=86445700, IRQL=2
[148046 ms]  <<<  URB 246 coming back  <<< 
-- URB_FUNCTION_BULK_OR_INTERRUPT_TRANSFER:
  PipeHandle           = 858ccfbc [endpoint 0x00000002]
  TransferFlags        = 00000002 (USBD_TRANSFER_DIRECTION_OUT, USBD_SHORT_TRANSFER_OK)
  TransferBufferLength = 00000012
  TransferBuffer       = 00000000
  TransferBufferMDL    = 86b21c10
  UrbLink              = 00000000
[148046 ms] UsbSnoop - FilterDispatchAny(a95c1fd2) : IRP_MJ_INTERNAL_DEVICE_CONTROL
[148046 ms] UsbSnoop - FdoHookDispatchInternalIoctl(a95c21ea) : fdo=868c0de8, Irp=86ab43e0, IRQL=0
[148046 ms]  >>>  URB 247 going down  >>> 
-- URB_FUNCTION_BULK_OR_INTERRUPT_TRANSFER:
  PipeHandle           = 858ccf9c [endpoint 0x00000081]
  TransferFlags        = 00000003 (USBD_TRANSFER_DIRECTION_IN, USBD_SHORT_TRANSFER_OK)
  TransferBufferLength = 00000200
  TransferBuffer       = 00000000
  TransferBufferMDL    = 8688f870
  UrbLink              = 00000000
[148048 ms] UsbSnoop - FilterDispatchAny(a95c1fd2) : IRP_MJ_INTERNAL_DEVICE_CONTROL
[148048 ms] UsbSnoop - FdoHookDispatchInternalIoctl(a95c21ea) : fdo=868c0de8, Irp=85745e48, IRQL=0
[148048 ms]  >>>  URB 248 going down  >>> 
-- URB_FUNCTION_BULK_OR_INTERRUPT_TRANSFER:
  PipeHandle           = 858ccfbc [endpoint 0x00000002]
  TransferFlags        = 00000002 (USBD_TRANSFER_DIRECTION_OUT, USBD_SHORT_TRANSFER_OK)
  TransferBufferLength = 0000010e
  TransferBuffer       = 00000000
  TransferBufferMDL    = 85b848f8
    00000000: 54 fd 64 00 80 14 64 01 40 60 7a 8d fe 00 3d 90
    00000010: 05 50 4b 03 04 14 00 00 00 08 00 d0 80 b5 36 23
    00000020: d2 34 11 aa 00 00 00 27 01 00 00 0c 00 00 00 44
    00000030: 6f 63 75 6d 65 6e 74 2e 78 6d 6c 4d 8f c1 0e 82
    00000040: 30 10 44 7f 85 f4 ae 60 e2 c1 c3 50 6e 7e 81 7e
    00000050: 00 b6 0b 69 02 6d 43 0b 21 7e bd dd c5 44 4f 6f
    00000060: a6 3b bb 93 a2 db e7 a9 da 68 49 2e f8 56 5d ce
    00000070: 8d aa c8 9b 60 9d 1f 5b f5 7c dc 4f 37 55 75 1a
    00000080: 36 18 4e 1d 09 8d 44 39 97 44 d2 98 7a 3f ea 0b
    00000090: 6a 21 ec 30 67 dd a0 16 22 7f 9d 10 66 5d 16 76
    000000a0: 42 58 da 86 e0 73 72 6f 92 85 3f 0b da e3 c0 37
    000000b0: 85 b0 d6 49 83 10 a5 46 66 c2 92 ec 63 3c a2 2c
    000000c0: 60 e2 b4 0f fa 5a 4a 44 60 f5 2e f3 58 88 8d 4c
    000000d0: 96 e5 43 e0 d5 27 62 2b 44 fd fb 94 8f 89 df 19
    000000e0: a5 37 18 fd 01 50 4b 03 04 14 00 00 00 08 00 d0
    000000f0: 80 b5 36 f6 e2 0e 94 29 0f 00 00 3a 48 00 00 0c
    00000100: 00 00 00 50 72 6f 62 6c 65 6d 31 2e 78 6d
  UrbLink              = 00000000
[148049 ms] UsbSnoop - MyInternalIOCTLCompletion(a95c2126) : fido=857e2b00, Irp=85745e48, Context=868cbac8, IRQL=2
[148049 ms]  <<<  URB 248 coming back  <<< 
-- URB_FUNCTION_BULK_OR_INTERRUPT_TRANSFER:
  PipeHandle           = 858ccfbc [endpoint 0x00000002]
  TransferFlags        = 00000002 (USBD_TRANSFER_DIRECTION_OUT, USBD_SHORT_TRANSFER_OK)
  TransferBufferLength = 0000010e
  TransferBuffer       = 00000000
  TransferBufferMDL    = 85b848f8
  UrbLink              = 00000000
[148050 ms] UsbSnoop - MyInternalIOCTLCompletion(a95c2126) : fido=857e2b00, Irp=86ab43e0, Context=86445700, IRQL=2
[148050 ms]  <<<  URB 247 coming back  <<< 
-- URB_FUNCTION_BULK_OR_INTERRUPT_TRANSFER:
  PipeHandle           = 858ccf9c [endpoint 0x00000081]
  TransferFlags        = 00000003 (USBD_TRANSFER_DIRECTION_IN, USBD_SHORT_TRANSFER_OK)
  TransferBufferLength = 00000012
  TransferBuffer       = 00000000
  TransferBufferMDL    = 8688f870
    00000000: 54 fd 64 01 00 ff 64 00 80 14 60 40 02 0a 3d 96
    00000010: 40 60
  UrbLink              = 00000000
[148050 ms] UsbSnoop - FilterDispatchAny(a95c1fd2) : IRP_MJ_INTERNAL_DEVICE_CONTROL
[148050 ms] UsbSnoop - FdoHookDispatchInternalIoctl(a95c21ea) : fdo=868c0de8, Irp=86ab43e0, IRQL=0
[148050 ms]  >>>  URB 249 going down  >>> 
-- URB_FUNCTION_BULK_OR_INTERRUPT_TRANSFER:
  PipeHandle           = 858ccf9c [endpoint 0x00000081]
  TransferFlags        = 00000003 (USBD_TRANSFER_DIRECTION_IN, USBD_SHORT_TRANSFER_OK)
  TransferBufferLength = 00000200
  TransferBuffer       = 00000000
  TransferBufferMDL    = 85dbe6a8
  UrbLink              = 00000000
[148052 ms] UsbSnoop - FilterDispatchAny(a95c1fd2) : IRP_MJ_INTERNAL_DEVICE_CONTROL
[148052 ms] UsbSnoop - FdoHookDispatchInternalIoctl(a95c21ea) : fdo=868c0de8, Irp=868d0390, IRQL=0
[148052 ms]  >>>  URB 250 going down  >>> 
-- URB_FUNCTION_BULK_OR_INTERRUPT_TRANSFER:
  PipeHandle           = 858ccfbc [endpoint 0x00000002]
  TransferFlags        = 00000002 (USBD_TRANSFER_DIRECTION_OUT, USBD_SHORT_TRANSFER_OK)
  TransferBufferLength = 0000010e
  TransferBuffer       = 00000000
  TransferBufferMDL    = 85b848f8
    00000000: 54 fd 64 00 80 14 64 01 40 60 a6 ae fe 00 3e de
    00000010: 05 6c e5 1c d9 92 dc b6 f1 7d bf 02 d9 07 95 94
    00000020: ac 38 43 ce b5 b3 de 1d 97 4a 2a c9 aa b2 5d b2
    00000030: b5 b1 e3 8a 53 5b 18 12 c3 a1 45 12 14 00 ce e1
    00000040: 54 2a 2f 79 c8 73 3e 21 9f 90 4f c8 a7 f8 4b d2
    00000050: 8d 83 c7 1c bb b3 3a ec b1 b3 aa d2 34 1a 40 a3
    00000060: 2f 34 9a 04 c0 cb 4f 57 59 4a 16 4c c8 84 e7 57
    00000070: a7 be d7 3d 25 2c 0f 79 94 e4 f1 d5 e9 1f af 9f
    00000080: 3f 3e 3f 25 9f 4e 2e 0b c1 a7 04 9a e6 f2 ea b4
    00000090: 14 f9 c5 f5 4b ef 15 a0 52 96 9d 62 6f d3 73 72
    000000a0: 29 d7 d9 e4 92 11 75 75 3a 3c 25 b3 ab 53 c4 e5
    000000b0: 93 99 7f d9 c9 81 c6 64 75 d9 29 26 97 8b 89 df
    000000c0: 01 68 31 b9 ec b0 5d ad 83 8d d6 72 2d 15 cb 1e
    000000d0: ca 24 7f b8 7a 74 16 72 09 3f 8f da fd fd 46 ff
    000000e0: d4 8c b6 98 fc d5 3f 0b ce 7a 67 fd bf dd d2 36
    000000f0: 70 6d 7b 67 c3 b3 f1 99 1f d4 8d 3b 5a 98 90 8a
    00000100: 88 84 29 5d 63 17 32 f7 a1 7f 17 fe 00 0c
  UrbLink              = 00000000
[148053 ms] UsbSnoop - MyInternalIOCTLCompletion(a95c2126) : fido=857e2b00, Irp=868d0390, Context=868cbac8, IRQL=2
[148053 ms]  <<<  URB 250 coming back  <<< 
-- URB_FUNCTION_BULK_OR_INTERRUPT_TRANSFER:
  PipeHandle           = 858ccfbc [endpoint 0x00000002]
  TransferFlags        = 00000002 (USBD_TRANSFER_DIRECTION_OUT, USBD_SHORT_TRANSFER_OK)
  TransferBufferLength = 0000010e
  TransferBuffer       = 00000000
  TransferBufferMDL    = 85b848f8
  UrbLink              = 00000000
[148055 ms] UsbSnoop - MyInternalIOCTLCompletion(a95c2126) : fido=857e2b00, Irp=86ab43e0, Context=86445700, IRQL=2
[148055 ms]  <<<  URB 249 coming back  <<< 
-- URB_FUNCTION_BULK_OR_INTERRUPT_TRANSFER:
  PipeHandle           = 858ccf9c [endpoint 0x00000081]
  TransferFlags        = 00000003 (USBD_TRANSFER_DIRECTION_IN, USBD_SHORT_TRANSFER_OK)
  TransferBufferLength = 00000012
  TransferBuffer       = 00000000
  TransferBufferMDL    = 85dbe6a8
    00000000: 54 fd 64 01 00 ff 64 00 80 14 60 40 02 0a 3e 97
    00000010: 40 60
  UrbLink              = 00000000
[148055 ms] UsbSnoop - FilterDispatchAny(a95c1fd2) : IRP_MJ_INTERNAL_DEVICE_CONTROL
[148055 ms] UsbSnoop - FdoHookDispatchInternalIoctl(a95c21ea) : fdo=868c0de8, Irp=86ab43e0, IRQL=0
[148055 ms]  >>>  URB 251 going down  >>> 
-- URB_FUNCTION_BULK_OR_INTERRUPT_TRANSFER:
  PipeHandle           = 858ccf9c [endpoint 0x00000081]
  TransferFlags        = 00000003 (USBD_TRANSFER_DIRECTION_IN, USBD_SHORT_TRANSFER_OK)
  TransferBufferLength = 00000200
  TransferBuffer       = 00000000
  TransferBufferMDL    = 85df6838
  UrbLink              = 00000000
[148056 ms] UsbSnoop - FilterDispatchAny(a95c1fd2) : IRP_MJ_INTERNAL_DEVICE_CONTROL
[148057 ms] UsbSnoop - FdoHookDispatchInternalIoctl(a95c21ea) : fdo=868c0de8, Irp=868d0390, IRQL=0
[148057 ms]  >>>  URB 252 going down  >>> 
-- URB_FUNCTION_BULK_OR_INTERRUPT_TRANSFER:
  PipeHandle           = 858ccfbc [endpoint 0x00000002]
  TransferFlags        = 00000002 (USBD_TRANSFER_DIRECTION_OUT, USBD_SHORT_TRANSFER_OK)
  TransferBufferLength = 0000010e
  TransferBuffer       = 00000000
  TransferBufferMDL    = 859d29a0
    00000000: 54 fd 64 00 80 14 64 01 40 60 9f f9 fe 00 3f 23
    00000010: 05 2a 70 59 63 97 15 76 72 39 4b 69 3c e9 5e 76
    00000020: f4 ef e5 32 8a 95 d1 e0 45 5e 54 4a fc 92 2b 56
    00000030: d0 e8 94 a8 75 c1 ae 4e 9b 98 86 5a f3 e2 22 7b
    00000040: 0e 54 24 92 ab 0b 88 5f d0 b4 64 93 9e 46 1b 18
    00000050: b1 6a a5 26 2f 98 52 60 45 f2 5a 51 a1 58 44 96
    00000060: 89 9a 93 35 2f 05 b9 7e f9 f8 4b 59 24 82 fd f4
    00000070: 8f 7f 93 cf 19 15 39 b6 fb 8c e6 d1 9c a5 d1 c9
    00000080: c9 f5 3c 91 24 e2 61 99 b1 5c 91 88 c9 50 24 53
    00000090: 26 89 9a 33 32 a5 32 09 c9 8c 51 55 0a 40 f1 99
    000000a0: 21 99 b3 25 99 5b 02 de c9 ab 94 51 c9 88 60 33
    000000b0: 26 88 e2 ba e3 57 65 12 be 21 5f 23 0a 1c 8c 11
    000000c0: ad 58 35 a7 0a a0 8c 35 b8 73 64 b0 63 8a cc 11
    000000d0: 3a e5 a5 d2 44 de b0 f5 94 63 47 68 43 12 25 c9
    000000e0: ac cc 43 05 ae 2b bd 93 93 57 c0 90 61 32 e2 4b
    000000f0: e8 25 04 5f 62 0f c2 73 8d fd 92 2e 5e 51 4d 16
    00000100: 04 e2 69 6a 9a 61 4d 41 63 e6 35 fa 4f 41
  UrbLink              = 00000000
[148057 ms] UsbSnoop - MyInternalIOCTLCompletion(a95c2126) : fido=857e2b00, Irp=868d0390, Context=868cbac8, IRQL=2
[148057 ms]  <<<  URB 252 coming back  <<< 
-- URB_FUNCTION_BULK_OR_INTERRUPT_TRANSFER:
  PipeHandle           = 858ccfbc [endpoint 0x00000002]
  TransferFlags        = 00000002 (USBD_TRANSFER_DIRECTION_OUT, USBD_SHORT_TRANSFER_OK)
  TransferBufferLength = 0000010e
  TransferBuffer       = 00000000
  TransferBufferMDL    = 859d29a0
  UrbLink              = 00000000
[148061 ms] UsbSnoop - MyInternalIOCTLCompletion(a95c2126) : fido=857e2b00, Irp=86ab43e0, Context=86445700, IRQL=2
[148061 ms]  <<<  URB 251 coming back  <<< 
-- URB_FUNCTION_BULK_OR_INTERRUPT_TRANSFER:
  PipeHandle           = 858ccf9c [endpoint 0x00000081]
  TransferFlags        = 00000003 (USBD_TRANSFER_DIRECTION_IN, USBD_SHORT_TRANSFER_OK)
  TransferBufferLength = 00000012
  TransferBuffer       = 00000000
  TransferBufferMDL    = 85df6838
    00000000: 54 fd 64 01 00 ff 64 00 80 14 60 40 02 0a 3f 98
    00000010: 40 60
  UrbLink              = 00000000
[148061 ms] UsbSnoop - FilterDispatchAny(a95c1fd2) : IRP_MJ_INTERNAL_DEVICE_CONTROL
[148061 ms] UsbSnoop - FdoHookDispatchInternalIoctl(a95c21ea) : fdo=868c0de8, Irp=868d0390, IRQL=0
[148061 ms]  >>>  URB 253 going down  >>> 
-- URB_FUNCTION_BULK_OR_INTERRUPT_TRANSFER:
  PipeHandle           = 858ccf9c [endpoint 0x00000081]
  TransferFlags        = 00000003 (USBD_TRANSFER_DIRECTION_IN, USBD_SHORT_TRANSFER_OK)
  TransferBufferLength = 00000200
  TransferBuffer       = 00000000
  TransferBufferMDL    = 85df6838
  UrbLink              = 00000000
[148063 ms] UsbSnoop - FilterDispatchAny(a95c1fd2) : IRP_MJ_INTERNAL_DEVICE_CONTROL
[148063 ms] UsbSnoop - FdoHookDispatchInternalIoctl(a95c21ea) : fdo=868c0de8, Irp=856de590, IRQL=0
[148063 ms]  >>>  URB 254 going down  >>> 
-- URB_FUNCTION_BULK_OR_INTERRUPT_TRANSFER:
  PipeHandle           = 858ccfbc [endpoint 0x00000002]
  TransferFlags        = 00000002 (USBD_TRANSFER_DIRECTION_OUT, USBD_SHORT_TRANSFER_OK)
  TransferBufferLength = 0000010e
  TransferBuffer       = 00000000
  TransferBufferMDL    = 859d29a0
    00000000: 54 fd 64 00 80 14 64 01 40 60 c5 9f fe 00 40 f0
    00000010: 05 8f 24 54 22 c5 ee 67 88 32 ed 44 12 cf 55 83
    00000020: 30 90 8a b9 13 30 67 2b 65 29 9d 5c 73 c2 56 09
    00000030: f2 dc d0 e4 45 63 84 cf 78 a6 a5 21 0f a9 91 4c
    00000040: f1 c2 92 47 f9 49 c8 45 0e ba 03 f5 62 65 a5 12
    00000050: e8 01 be f1 c8 f1 0a 96 c1 d1 a3 44 66 49 93 30
    00000060: 8c 56 6a 15 09 06 66 ca 0d 87 0d 4e 0c 87 50 cb
    00000070: 0b 2d 59 93 49 d2 e0 72 6e b9 b4 2a 90 2c 65 a1
    00000080: 22 c3 0b f2 c5 9a 3c b3 1d 24 f9 de 87 26 4b 0e
    00000090: 56 f9 1e 47 d2 34 9b 0d 9a 9a 2d 0b cd 57 db 40
    000000a0: 92 94 b9 4a 52 dd 60 d3 6b 2b 37 04 1e e7 a0 9f
    000000b0: 14 75 c4 22 8f d4 34 a1 16 54 05 74 3c 3d 0b d0
    000000c0: f7 2f 3b 38 dd e0 07 bd ec d7 3c 89 9f 14 45 9a
    000000d0: 84 54 bb f8 49 53 d1 04 66 29 cc 24 50 22 23 33
    000000e0: 9c 36 e0 31 50 6a 34 47 b7 6f 4d a8 8b 13 df 23
    000000f0: 4f 69 1a 96 29 55 5c 90 93 c0 23 2f 04 2d e6 92
    00000100: 3c a0 59 f1 09 e8 1e ec ad c4 fa a4 e7 91
  UrbLink              = 00000000
[148064 ms] UsbSnoop - MyInternalIOCTLCompletion(a95c2126) : fido=857e2b00, Irp=856de590, Context=868cbac8, IRQL=2
[148064 ms]  <<<  URB 254 coming back  <<< 
-- URB_FUNCTION_BULK_OR_INTERRUPT_TRANSFER:
  PipeHandle           = 858ccfbc [endpoint 0x00000002]
  TransferFlags        = 00000002 (USBD_TRANSFER_DIRECTION_OUT, USBD_SHORT_TRANSFER_OK)
  TransferBufferLength = 0000010e
  TransferBuffer       = 00000000
  TransferBufferMDL    = 859d29a0
  UrbLink              = 00000000
[148067 ms] UsbSnoop - MyInternalIOCTLCompletion(a95c2126) : fido=857e2b00, Irp=868d0390, Context=86445700, IRQL=2
[148067 ms]  <<<  URB 253 coming back  <<< 
-- URB_FUNCTION_BULK_OR_INTERRUPT_TRANSFER:
  PipeHandle           = 858ccf9c [endpoint 0x00000081]
  TransferFlags        = 00000003 (USBD_TRANSFER_DIRECTION_IN, USBD_SHORT_TRANSFER_OK)
  TransferBufferLength = 00000012
  TransferBuffer       = 00000000
  TransferBufferMDL    = 85df6838
    00000000: 54 fd 64 01 00 ff 64 00 80 14 60 40 02 0a 40 99
    00000010: 40 60
  UrbLink              = 00000000
[148067 ms] UsbSnoop - FilterDispatchAny(a95c1fd2) : IRP_MJ_INTERNAL_DEVICE_CONTROL
[148067 ms] UsbSnoop - FdoHookDispatchInternalIoctl(a95c21ea) : fdo=868c0de8, Irp=868d0390, IRQL=0
[148067 ms]  >>>  URB 255 going down  >>> 
-- URB_FUNCTION_BULK_OR_INTERRUPT_TRANSFER:
  PipeHandle           = 858ccf9c [endpoint 0x00000081]
  TransferFlags        = 00000003 (USBD_TRANSFER_DIRECTION_IN, USBD_SHORT_TRANSFER_OK)
  TransferBufferLength = 00000200
  TransferBuffer       = 00000000
  TransferBufferMDL    = 856df3d0
  UrbLink              = 00000000
[148069 ms] UsbSnoop - FilterDispatchAny(a95c1fd2) : IRP_MJ_INTERNAL_DEVICE_CONTROL
[148069 ms] UsbSnoop - FdoHookDispatchInternalIoctl(a95c21ea) : fdo=868c0de8, Irp=856de590, IRQL=0
[148069 ms]  >>>  URB 256 going down  >>> 
-- URB_FUNCTION_BULK_OR_INTERRUPT_TRANSFER:
  PipeHandle           = 858ccfbc [endpoint 0x00000002]
  TransferFlags        = 00000002 (USBD_TRANSFER_DIRECTION_OUT, USBD_SHORT_TRANSFER_OK)
  TransferBufferLength = 0000010e
  TransferBuffer       = 00000000
  TransferBufferMDL    = 8562bd38
    00000000: 54 fd 64 00 80 14 64 01 40 60 70 51 fe 00 41 4e
    00000010: 05 cf 13 a9 1c fe 75 21 18 8d e4 9c 31 75 d2 f7
    00000020: 08 0a 27 31 4a e0 c8 69 ca 97 68 2f 74 7c 59 c5
    00000030: 0a 6d 97 2a 48 a0 c5 dd 44 a5 69 a2 d6 e8 d7 8c
    00000040: 86 f3 26 bf 1e 39 c0 7a 81 b1 de a0 32 de e0 88
    00000050: 6d 57 ab ba 65 39 ad 38 f0 59 b1 26 69 92 33 88
    00000060: 71 a0 68 30 94 f5 63 b6 2a d0 b3 b5 05 4b 89 aa
    00000070: 95 0a 14 88 3a c8 28 a8 15 fe 03 8d a5 24 e7 4a
    00000080: eb ed 8c 14 4c cc b8 c8 20 8e 9a f1 74 57 d4 39
    00000090: 4d 63 36 15 14 e2 75 46 f3 a4 70 75 67 40 11 9d
    000000a0: 65 41 45 42 61 09 07 84 9e 93 6c 86 ec d4 11 95
    000000b0: a0 bf bc d6 a1 12 9b c1 f4 c3 7e 6b 8c 9e 0c a6
    000000c0: 38 44 9d 02 8c 22 71 4e c3 b4 1f 8f 09 30 be 48
    000000d0: 78 29 1b 32 74 e0 b7 4c 31 2e 26 02 02 01 78 dc
    000000e0: 53 5e ac 3b 05 85 25 dd 39 48 ad 81 10 ea 1a 5c
    000000f0: 37 55 61 83 6c 43 6f c8 f3 94 a9 25 f2 d2 f4 7b
    00000100: 0f e6 06 38 30 04 10 05 ac e8 a6 15 ab 0d
  UrbLink              = 00000000
[148070 ms] UsbSnoop - MyInternalIOCTLCompletion(a95c2126) : fido=857e2b00, Irp=856de590, Context=868cbac8, IRQL=2
[148070 ms]  <<<  URB 256 coming back  <<< 
-- URB_FUNCTION_BULK_OR_INTERRUPT_TRANSFER:
  PipeHandle           = 858ccfbc [endpoint 0x00000002]
  TransferFlags        = 00000002 (USBD_TRANSFER_DIRECTION_OUT, USBD_SHORT_TRANSFER_OK)
  TransferBufferLength = 0000010e
  TransferBuffer       = 00000000
  TransferBufferMDL    = 8562bd38
  UrbLink              = 00000000
[148073 ms] UsbSnoop - MyInternalIOCTLCompletion(a95c2126) : fido=857e2b00, Irp=868d0390, Context=86445700, IRQL=2
[148073 ms]  <<<  URB 255 coming back  <<< 
-- URB_FUNCTION_BULK_OR_INTERRUPT_TRANSFER:
  PipeHandle           = 858ccf9c [endpoint 0x00000081]
  TransferFlags        = 00000003 (USBD_TRANSFER_DIRECTION_IN, USBD_SHORT_TRANSFER_OK)
  TransferBufferLength = 00000012
  TransferBuffer       = 00000000
  TransferBufferMDL    = 856df3d0
    00000000: 54 fd 64 01 00 ff 64 00 80 14 60 40 02 0a 41 9a
    00000010: 40 60
  UrbLink              = 00000000
[148073 ms] UsbSnoop - FilterDispatchAny(a95c1fd2) : IRP_MJ_INTERNAL_DEVICE_CONTROL
[148073 ms] UsbSnoop - FdoHookDispatchInternalIoctl(a95c21ea) : fdo=868c0de8, Irp=868d0390, IRQL=0
[148073 ms]  >>>  URB 257 going down  >>> 
-- URB_FUNCTION_BULK_OR_INTERRUPT_TRANSFER:
  PipeHandle           = 858ccf9c [endpoint 0x00000081]
  TransferFlags        = 00000003 (USBD_TRANSFER_DIRECTION_IN, USBD_SHORT_TRANSFER_OK)
  TransferBufferLength = 00000200
  TransferBuffer       = 00000000
  TransferBufferMDL    = 859d29a0
  UrbLink              = 00000000
[148075 ms] UsbSnoop - FilterDispatchAny(a95c1fd2) : IRP_MJ_INTERNAL_DEVICE_CONTROL
[148075 ms] UsbSnoop - FdoHookDispatchInternalIoctl(a95c21ea) : fdo=868c0de8, Irp=856de590, IRQL=0
[148075 ms]  >>>  URB 258 going down  >>> 
-- URB_FUNCTION_BULK_OR_INTERRUPT_TRANSFER:
  PipeHandle           = 858ccfbc [endpoint 0x00000002]
  TransferFlags        = 00000002 (USBD_TRANSFER_DIRECTION_OUT, USBD_SHORT_TRANSFER_OK)
  TransferBufferLength = 0000010e
  TransferBuffer       = 00000000
  TransferBufferMDL    = 8693e860
    00000000: 54 fd 64 00 80 14 64 01 40 60 af b8 fe 00 42 f5
    00000010: 05 15 91 24 47 ad 19 df db 72 bd 86 b3 c8 da 59
    00000020: 40 19 54 85 f3 b6 bf 34 91 cd 54 a8 e9 32 75 01
    00000030: f1 c6 4d 0c da ba 0c 40 b4 54 f3 c9 83 54 7d 22
    00000040: 82 48 71 05 3a 7e 10 ab 4f 10 91 f3 08 96 17 58
    00000050: 25 af 1e bc 2d b9 fa a4 cb 52 03 b8 06 b0 4c ce
    00000060: 5a 0d 14 ac 45 ed 26 61 29 24 cc f9 24 8f d8 ca
    00000070: b5 32 3f 1d d7 a4 83 64 aa 02 0e 5a 15 5a 2c 69
    00000080: be 35 b7 c8 36 5a 04 12 ba e0 0f 41 a7 a7 6b 34
    00000090: 42 d7 ac 42 d5 ae 41 04 d6 08 99 1a 60 09 cb bb
    000000a0: 55 84 06 11 87 c6 9a 8c 3a 43 8d d5 05 c4 ce ca
    000000b0: 34 ad b0 ba a0 a1 8a 52 08 d6 03 97 88 75 7e 17
    000000c0: 16 e9 ea ea b4 0f 00 cf 0a c4 74 6e 89 29 fe 6d
    000000d0: 2b c2 a0 0a 2a 83 a3 88 29 bb e3 75 2b bc 3c e5
    000000e0: d9 14 9c 5e 92 18 db 62 00 c1 99 12 9b b6 30 ab
    000000f0: 42 5a d0 69 02 61 38 81 36 49 6e 27 96 c4 24 2c
    00000100: c1 08 44 61 fa 2f 70 a6 2d 12 c1 73 93 2e
  UrbLink              = 00000000
[148076 ms] UsbSnoop - MyInternalIOCTLCompletion(a95c2126) : fido=857e2b00, Irp=856de590, Context=868cbac8, IRQL=2
[148076 ms]  <<<  URB 258 coming back  <<< 
-- URB_FUNCTION_BULK_OR_INTERRUPT_TRANSFER:
  PipeHandle           = 858ccfbc [endpoint 0x00000002]
  TransferFlags        = 00000002 (USBD_TRANSFER_DIRECTION_OUT, USBD_SHORT_TRANSFER_OK)
  TransferBufferLength = 0000010e
  TransferBuffer       = 00000000
  TransferBufferMDL    = 8693e860
  UrbLink              = 00000000
[148078 ms] UsbSnoop - MyInternalIOCTLCompletion(a95c2126) : fido=857e2b00, Irp=868d0390, Context=86445700, IRQL=2
[148078 ms]  <<<  URB 257 coming back  <<< 
-- URB_FUNCTION_BULK_OR_INTERRUPT_TRANSFER:
  PipeHandle           = 858ccf9c [endpoint 0x00000081]
  TransferFlags        = 00000003 (USBD_TRANSFER_DIRECTION_IN, USBD_SHORT_TRANSFER_OK)
  TransferBufferLength = 00000012
  TransferBuffer       = 00000000
  TransferBufferMDL    = 859d29a0
    00000000: 54 fd 64 01 00 ff 64 00 80 14 60 40 02 0a 42 9b
    00000010: 40 60
  UrbLink              = 00000000
[148078 ms] UsbSnoop - FilterDispatchAny(a95c1fd2) : IRP_MJ_INTERNAL_DEVICE_CONTROL
[148078 ms] UsbSnoop - FdoHookDispatchInternalIoctl(a95c21ea) : fdo=868c0de8, Irp=868d0390, IRQL=0
[148078 ms]  >>>  URB 259 going down  >>> 
-- URB_FUNCTION_BULK_OR_INTERRUPT_TRANSFER:
  PipeHandle           = 858ccf9c [endpoint 0x00000081]
  TransferFlags        = 00000003 (USBD_TRANSFER_DIRECTION_IN, USBD_SHORT_TRANSFER_OK)
  TransferBufferLength = 00000200
  TransferBuffer       = 00000000
  TransferBufferMDL    = 85d6a4d0
  UrbLink              = 00000000
[148080 ms] UsbSnoop - FilterDispatchAny(a95c1fd2) : IRP_MJ_INTERNAL_DEVICE_CONTROL
[148080 ms] UsbSnoop - FdoHookDispatchInternalIoctl(a95c21ea) : fdo=868c0de8, Irp=856de590, IRQL=0
[148080 ms]  >>>  URB 260 going down  >>> 
-- URB_FUNCTION_BULK_OR_INTERRUPT_TRANSFER:
  PipeHandle           = 858ccfbc [endpoint 0x00000002]
  TransferFlags        = 00000002 (USBD_TRANSFER_DIRECTION_OUT, USBD_SHORT_TRANSFER_OK)
  TransferBufferLength = 0000010e
  TransferBuffer       = 00000000
  TransferBufferMDL    = 859babf0
    00000000: 54 fd 64 00 80 14 64 01 40 60 3e fb fe 00 43 c8
    00000010: 05 40 20 78 d9 a8 a3 ab 44 cf 48 39 87 05 1c 7b
    00000020: 2f 12 59 42 64 ff d1 cc 2c 88 ee 21 2c 3a b1 0e
    00000030: 5e 30 e5 60 1c 98 6a ba e1 9f 34 33 df 01 05 86
    00000040: 13 55 af 41 cf 6d c4 d1 55 af a8 a0 96 d1 17 96
    00000050: 7f 4f cf e7 27 9a 67 9d 73 d9 48 85 cd 25 05 76
    00000060: 2a 41 d9 db d2 86 3f 1c 4f af 30 55 5d 06 fe ec
    00000070: e1 f2 d5 12 04 d6 a3 b5 4c 74 1e eb 02 1f d1 1a
    00000080: 87 a0 98 81 98 59 99 21 94 e4 16 42 0d 01 c9 14
    00000090: c0 88 89 64 41 91 8c 0d a0 5a 7b 92 85 55 14 1a
    000000a0: 98 28 04 61 33 09 25 29 52 ae 50 e1 61 5a 46 56
    000000b0: 33 0a 03 3e 76 5d ad 1f 63 a0 ba 35 0e c5 71 e5
    000000c0: 60 60 78 ad 1c 26 1a 3e d6 44 36 dc 2c 8e 1b 6e
    000000d0: 56 17 10 6f 5c cb d7 68 eb 66 00 c1 52 91 dd ac
    000000e0: 6c 6b 5b a8 f0 eb 49 30 ac 2b d6 ba 62 96 c4 86
    000000f0: 1c 13 e8 b3 16 42 0c 9f fe 60 46 2a 38 28 47 43
    00000100: 49 64 07 04 a0 aa b9 99 68 94 83 01 5c 4d
  UrbLink              = 00000000
[148081 ms] UsbSnoop - MyInternalIOCTLCompletion(a95c2126) : fido=857e2b00, Irp=856de590, Context=868cbac8, IRQL=2
[148081 ms]  <<<  URB 260 coming back  <<< 
-- URB_FUNCTION_BULK_OR_INTERRUPT_TRANSFER:
  PipeHandle           = 858ccfbc [endpoint 0x00000002]
  TransferFlags        = 00000002 (USBD_TRANSFER_DIRECTION_OUT, USBD_SHORT_TRANSFER_OK)
  TransferBufferLength = 0000010e
  TransferBuffer       = 00000000
  TransferBufferMDL    = 859babf0
  UrbLink              = 00000000
[148084 ms] UsbSnoop - MyInternalIOCTLCompletion(a95c2126) : fido=857e2b00, Irp=868d0390, Context=86445700, IRQL=2
[148084 ms]  <<<  URB 259 coming back  <<< 
-- URB_FUNCTION_BULK_OR_INTERRUPT_TRANSFER:
  PipeHandle           = 858ccf9c [endpoint 0x00000081]
  TransferFlags        = 00000003 (USBD_TRANSFER_DIRECTION_IN, USBD_SHORT_TRANSFER_OK)
  TransferBufferLength = 00000012
  TransferBuffer       = 00000000
  TransferBufferMDL    = 85d6a4d0
    00000000: 54 fd 64 01 00 ff 64 00 80 14 60 40 02 0a 43 9c
    00000010: 40 60
  UrbLink              = 00000000
[148084 ms] UsbSnoop - FilterDispatchAny(a95c1fd2) : IRP_MJ_INTERNAL_DEVICE_CONTROL
[148084 ms] UsbSnoop - FdoHookDispatchInternalIoctl(a95c21ea) : fdo=868c0de8, Irp=868a56e0, IRQL=0
[148084 ms]  >>>  URB 261 going down  >>> 
-- URB_FUNCTION_BULK_OR_INTERRUPT_TRANSFER:
  PipeHandle           = 858ccf9c [endpoint 0x00000081]
  TransferFlags        = 00000003 (USBD_TRANSFER_DIRECTION_IN, USBD_SHORT_TRANSFER_OK)
  TransferBufferLength = 00000200
  TransferBuffer       = 00000000
  TransferBufferMDL    = 85d6a4d0
  UrbLink              = 00000000
[148086 ms] UsbSnoop - FilterDispatchAny(a95c1fd2) : IRP_MJ_INTERNAL_DEVICE_CONTROL
[148086 ms] UsbSnoop - FdoHookDispatchInternalIoctl(a95c21ea) : fdo=868c0de8, Irp=856de590, IRQL=0
[148086 ms]  >>>  URB 262 going down  >>> 
-- URB_FUNCTION_BULK_OR_INTERRUPT_TRANSFER:
  PipeHandle           = 858ccfbc [endpoint 0x00000002]
  TransferFlags        = 00000002 (USBD_TRANSFER_DIRECTION_OUT, USBD_SHORT_TRANSFER_OK)
  TransferBufferLength = 0000010e
  TransferBuffer       = 00000000
  TransferBufferMDL    = 859dbbe8
    00000000: 54 fd 64 00 80 14 64 01 40 60 25 36 fe 00 44 eb
    00000010: 05 06 5d 2f 18 68 b4 19 7e 3d 19 f8 9e 19 db 0c
    00000020: 4b 43 9e 3a 2e 11 d4 b8 48 2a cb 83 06 35 0e bc
    00000030: d4 8e a9 41 8d 4b 79 e8 fa 22 88 b8 74 9a 1a 36
    00000040: 34 00 bf b0 ee 2a db 48 83 35 8f 86 06 b8 f0 8d
    00000050: 79 36 75 92 05 4d c9 74 7d 61 7a 39 18 a5 e1 22
    00000060: 6e 0a 87 45 2d 9f c6 57 22 3a f4 aa cc 13 cb bd
    00000070: 06 75 d3 1a b7 76 b8 15 f8 e8 e4 a7 7f fe 2b f0
    00000080: fa 96 30 22 4c 0d 5d 4d ce 3d df a1 a9 d5 67 d5
    00000090: a1 67 59 59 bb 1e 6b 6c 33 f4 82 0a 6f bb ec d4
    000000a0: 38 ac e4 4e bb d4 69 9c fe 98 b9 76 08 6a 5c 01
    000000b0: eb 85 c5 21 b8 cf 32 87 59 61 53 f7 2d ff ea b5
    000000c0: fc 8b 8a 49 40 8c e9 a8 f5 4a ec 6d e8 58 f0 3d
    000000d0: 1d ae fb 21 1d 6e d8 bf c5 e3 12 e9 84 ec df 21
    000000e0: e4 ca 34 ee d4 20 12 cd 84 b2 4e aa 41 83 f3 5b
    000000f0: 7e 83 65 83 0f 6a af c1 82 11 23 e4 95 18 a1 15
    00000100: 2d ac 55 10 3a 15 14 35 ae a8 70 87 79 00
  UrbLink              = 00000000
[148087 ms] UsbSnoop - MyInternalIOCTLCompletion(a95c2126) : fido=857e2b00, Irp=856de590, Context=868cbac8, IRQL=2
[148087 ms]  <<<  URB 262 coming back  <<< 
-- URB_FUNCTION_BULK_OR_INTERRUPT_TRANSFER:
  PipeHandle           = 858ccfbc [endpoint 0x00000002]
  TransferFlags        = 00000002 (USBD_TRANSFER_DIRECTION_OUT, USBD_SHORT_TRANSFER_OK)
  TransferBufferLength = 0000010e
  TransferBuffer       = 00000000
  TransferBufferMDL    = 859dbbe8
  UrbLink              = 00000000
[148090 ms] UsbSnoop - MyInternalIOCTLCompletion(a95c2126) : fido=857e2b00, Irp=868a56e0, Context=86445700, IRQL=2
[148090 ms]  <<<  URB 261 coming back  <<< 
-- URB_FUNCTION_BULK_OR_INTERRUPT_TRANSFER:
  PipeHandle           = 858ccf9c [endpoint 0x00000081]
  TransferFlags        = 00000003 (USBD_TRANSFER_DIRECTION_IN, USBD_SHORT_TRANSFER_OK)
  TransferBufferLength = 00000012
  TransferBuffer       = 00000000
  TransferBufferMDL    = 85d6a4d0
    00000000: 54 fd 64 01 00 ff 64 00 80 14 60 40 02 0a 44 9d
    00000010: 40 60
  UrbLink              = 00000000
[148090 ms] UsbSnoop - FilterDispatchAny(a95c1fd2) : IRP_MJ_INTERNAL_DEVICE_CONTROL
[148090 ms] UsbSnoop - FdoHookDispatchInternalIoctl(a95c21ea) : fdo=868c0de8, Irp=868d0390, IRQL=0
[148090 ms]  >>>  URB 263 going down  >>> 
-- URB_FUNCTION_BULK_OR_INTERRUPT_TRANSFER:
  PipeHandle           = 858ccf9c [endpoint 0x00000081]
  TransferFlags        = 00000003 (USBD_TRANSFER_DIRECTION_IN, USBD_SHORT_TRANSFER_OK)
  TransferBufferLength = 00000200
  TransferBuffer       = 00000000
  TransferBufferMDL    = 859dbbe8
  UrbLink              = 00000000
[148092 ms] UsbSnoop - FilterDispatchAny(a95c1fd2) : IRP_MJ_INTERNAL_DEVICE_CONTROL
[148092 ms] UsbSnoop - FdoHookDispatchInternalIoctl(a95c21ea) : fdo=868c0de8, Irp=856de590, IRQL=0
[148092 ms]  >>>  URB 264 going down  >>> 
-- URB_FUNCTION_BULK_OR_INTERRUPT_TRANSFER:
  PipeHandle           = 858ccfbc [endpoint 0x00000002]
  TransferFlags        = 00000002 (USBD_TRANSFER_DIRECTION_OUT, USBD_SHORT_TRANSFER_OK)
  TransferBufferLength = 0000010e
  TransferBuffer       = 00000000
  TransferBufferMDL    = 85deebd0
    00000000: 54 fd 64 00 80 14 64 01 40 60 67 28 fe 00 45 20
    00000010: 05 ae 17 d5 18 d6 3a a8 a1 d5 b6 ae fc e1 96 5f
    00000020: 58 49 21 63 65 a9 d3 d5 60 53 57 fd b6 ae 80 e6
    00000030: 0d d5 10 30 ed 99 d6 86 e7 c8 c5 c1 c8 f8 44 b4
    00000040: 76 e5 75 65 3a db 35 9c 0b 39 f1 89 4f 7a a4 ab
    00000050: ff ad fe ae 5b 68 bc ee cb 14 75 bd 11 d4 b2 2a
    00000060: 00 ac fc ca e2 c0 13 cf bd f1 08 f3 8d ee 86 3f
    00000070: 06 5e 37 e8 8f e1 6f d0 74 4b 55 db 44 39 9b cc
    00000080: 78 ee 70 08 be df 6c ab 95 d9 f4 c0 e1 1d 1e b8
    00000090: ae 3d 70 7d 98 07 ba 40 d4 74 c1 3a 0c 1d 83 0f
    000000a0: ae df d9 07 47 9b da 1a fe 1c 3e b8 7e 77 1f ec
    000000b0: 7a dd 9d 3e 08 be 69 fe 7e 29 1f 8c 85 d5 22 fc
    000000c0: 9c df e1 83 d8 f6 86 5a 2f ac 0a b1 0d e0 90 e7
    000000d0: 0f 87 bd 60 bc 11 d2 e3 da 6f e2 bb fc a6 7b 88
    000000e0: 2c 5b 2e 52 89 50 3f e1 3a 89 c6 4d 89 c4 0d 36
    000000f0: 30 7d 1c 6c 7b 99 77 e8 ae a0 c5 17 99 b4 41 52
    00000100: 83 8e 9f 99 bf cd d1 79 d0 3d df e0 69 83
  UrbLink              = 00000000
[148093 ms] UsbSnoop - MyInternalIOCTLCompletion(a95c2126) : fido=857e2b00, Irp=856de590, Context=868cbac8, IRQL=2
[148093 ms]  <<<  URB 264 coming back  <<< 
-- URB_FUNCTION_BULK_OR_INTERRUPT_TRANSFER:
  PipeHandle           = 858ccfbc [endpoint 0x00000002]
  TransferFlags        = 00000002 (USBD_TRANSFER_DIRECTION_OUT, USBD_SHORT_TRANSFER_OK)
  TransferBufferLength = 0000010e
  TransferBuffer       = 00000000
  TransferBufferMDL    = 85deebd0
  UrbLink              = 00000000
[148095 ms] UsbSnoop - MyInternalIOCTLCompletion(a95c2126) : fido=857e2b00, Irp=868d0390, Context=86445700, IRQL=2
[148095 ms]  <<<  URB 263 coming back  <<< 
-- URB_FUNCTION_BULK_OR_INTERRUPT_TRANSFER:
  PipeHandle           = 858ccf9c [endpoint 0x00000081]
  TransferFlags        = 00000003 (USBD_TRANSFER_DIRECTION_IN, USBD_SHORT_TRANSFER_OK)
  TransferBufferLength = 00000012
  TransferBuffer       = 00000000
  TransferBufferMDL    = 859dbbe8
    00000000: 54 fd 64 01 00 ff 64 00 80 14 60 40 02 0a 45 9e
    00000010: 40 60
  UrbLink              = 00000000
[148095 ms] UsbSnoop - FilterDispatchAny(a95c1fd2) : IRP_MJ_INTERNAL_DEVICE_CONTROL
[148095 ms] UsbSnoop - FdoHookDispatchInternalIoctl(a95c21ea) : fdo=868c0de8, Irp=868d0390, IRQL=0
[148095 ms]  >>>  URB 265 going down  >>> 
-- URB_FUNCTION_BULK_OR_INTERRUPT_TRANSFER:
  PipeHandle           = 858ccf9c [endpoint 0x00000081]
  TransferFlags        = 00000003 (USBD_TRANSFER_DIRECTION_IN, USBD_SHORT_TRANSFER_OK)
  TransferBufferLength = 00000200
  TransferBuffer       = 00000000
  TransferBufferMDL    = 86a5c4b0
  UrbLink              = 00000000
[148097 ms] UsbSnoop - FilterDispatchAny(a95c1fd2) : IRP_MJ_INTERNAL_DEVICE_CONTROL
[148097 ms] UsbSnoop - FdoHookDispatchInternalIoctl(a95c21ea) : fdo=868c0de8, Irp=856de590, IRQL=0
[148097 ms]  >>>  URB 266 going down  >>> 
-- URB_FUNCTION_BULK_OR_INTERRUPT_TRANSFER:
  PipeHandle           = 858ccfbc [endpoint 0x00000002]
  TransferFlags        = 00000002 (USBD_TRANSFER_DIRECTION_OUT, USBD_SHORT_TRANSFER_OK)
  TransferBufferLength = 0000010e
  TransferBuffer       = 00000000
  TransferBufferMDL    = 85eb1360
    00000000: 54 fd 64 00 80 14 64 01 40 60 28 5d fe 00 46 17
    00000010: 05 15 9d 37 57 19 5b 77 5b cf e3 4d 4d 43 fb 1b
    00000020: 66 87 60 05 38 71 bf 3b 1a 8e 83 1e fe 6f c7 62
    00000030: 26 05 ca b3 02 82 80 f1 1f 0d 5b a5 d4 14 f6 49
    00000040: c8 66 20 ce c3 d5 23 2b 25 14 f5 8c 81 14 d8 5a
    00000050: 42 83 7b a3 c4 0c 80 c1 60 1c f4 ad 53 6b c4 fb
    00000060: c7 0a f0 a9 c0 8e e4 dc 2b 92 61 9d 16 dc 27 bf
    00000070: ac f5 de 0a 1f be bf 69 01 bf bb 1d 40 e2 2a 80
    00000080: 04 9b 11 c4 61 ea 20 e2 bb c5 3d 32 73 b8 90 cc
    00000090: 65 72 1a ac 62 4b bc 3b b6 68 43 5c 81 91 76 c5
    000000a0: 18 ff c0 18 33 da 88 2e 43 87 f9 f9 e3 4a fb 19
    000000b0: 25 b8 4b df 85 e2 79 a5 70 78 d4 f2 7b c3 e0 bc
    000000c0: 3b ee fa fd 86 e6 85 54 0b 3b a4 06 35 af f0 e8
    000000d0: 54 65 c7 36 7b 07 60 5a e3 a6 86 dd d8 31 1b db
    000000e0: 44 b0 1e 71 85 b9 69 30 6c 0f d9 48 13 06 e7 c3
    000000f0: c1 60 e0 f7 46 c3 63 7a 62 c2 47 dc 4a c1 5b 59
    00000100: ba bf 11 bb 55 8c ed dd 13 54 5d 8a 6d ea
  UrbLink              = 00000000
[148098 ms] UsbSnoop - MyInternalIOCTLCompletion(a95c2126) : fido=857e2b00, Irp=856de590, Context=868cbac8, IRQL=2
[148098 ms]  <<<  URB 266 coming back  <<< 
-- URB_FUNCTION_BULK_OR_INTERRUPT_TRANSFER:
  PipeHandle           = 858ccfbc [endpoint 0x00000002]
  TransferFlags        = 00000002 (USBD_TRANSFER_DIRECTION_OUT, USBD_SHORT_TRANSFER_OK)
  TransferBufferLength = 0000010e
  TransferBuffer       = 00000000
  TransferBufferMDL    = 85eb1360
  UrbLink              = 00000000
[148101 ms] UsbSnoop - MyInternalIOCTLCompletion(a95c2126) : fido=857e2b00, Irp=868d0390, Context=86445700, IRQL=2
[148101 ms]  <<<  URB 265 coming back  <<< 
-- URB_FUNCTION_BULK_OR_INTERRUPT_TRANSFER:
  PipeHandle           = 858ccf9c [endpoint 0x00000081]
  TransferFlags        = 00000003 (USBD_TRANSFER_DIRECTION_IN, USBD_SHORT_TRANSFER_OK)
  TransferBufferLength = 00000012
  TransferBuffer       = 00000000
  TransferBufferMDL    = 86a5c4b0
    00000000: 54 fd 64 01 00 ff 64 00 80 14 60 40 02 0a 46 9f
    00000010: 40 60
  UrbLink              = 00000000
[148101 ms] UsbSnoop - FilterDispatchAny(a95c1fd2) : IRP_MJ_INTERNAL_DEVICE_CONTROL
[148101 ms] UsbSnoop - FdoHookDispatchInternalIoctl(a95c21ea) : fdo=868c0de8, Irp=86ab43e0, IRQL=0
[148101 ms]  >>>  URB 267 going down  >>> 
-- URB_FUNCTION_BULK_OR_INTERRUPT_TRANSFER:
  PipeHandle           = 858ccf9c [endpoint 0x00000081]
  TransferFlags        = 00000003 (USBD_TRANSFER_DIRECTION_IN, USBD_SHORT_TRANSFER_OK)
  TransferBufferLength = 00000200
  TransferBuffer       = 00000000
  TransferBufferMDL    = 86a03ca0
  UrbLink              = 00000000
[148102 ms] UsbSnoop - FilterDispatchAny(a95c1fd2) : IRP_MJ_INTERNAL_DEVICE_CONTROL
[148102 ms] UsbSnoop - FdoHookDispatchInternalIoctl(a95c21ea) : fdo=868c0de8, Irp=8562e558, IRQL=0
[148102 ms]  >>>  URB 268 going down  >>> 
-- URB_FUNCTION_BULK_OR_INTERRUPT_TRANSFER:
  PipeHandle           = 858ccfbc [endpoint 0x00000002]
  TransferFlags        = 00000002 (USBD_TRANSFER_DIRECTION_OUT, USBD_SHORT_TRANSFER_OK)
  TransferBufferLength = 0000010e
  TransferBuffer       = 00000000
  TransferBufferMDL    = 85deebd0
    00000000: 54 fd 64 00 80 14 64 01 40 60 9b 70 fe 00 47 9e
    00000010: 05 e0 ef cc 22 7a 5b 19 84 c3 dc 91 3d f8 1f 3f
    00000020: 7b 38 c0 1b 9d 86 da ce b8 95 ec fb 3d b2 91 3f
    00000030: 98 67 e7 34 6d 3e 49 a7 69 3d d1 36 1f 6d 7a de
    00000040: 60 d4 f3 7d 3f e8 0d 06 c1 11 f9 48 5b f0 ad cc
    00000050: 1d 04 ef df 47 f0 c0 0b 46 a3 00 a6 c2 b8 37 0a
    00000060: da 1a 38 ae b7 09 4a 24 34 8f d3 7a 7e 6c a5 d7
    00000070: 7e 1f 42 af 3f d8 98 24 b6 db 4d 51 b8 89 d2 c2
    00000080: ec f3 78 5c f8 fc fe 08 02 44 2f 38 60 29 5c d4
    00000090: b8 c5 3d 27 c3 61 8a 68 89 9f 97 d9 d4 be 41 42
    000000a0: 4d 6c a5 ce fe 86 ef 53 c1 e8 4d c1 ed 38 75 c9
    000000b0: 90 b2 6b 33 42 7a 1d 83 64 c2 8c 1e da b4 82 e6
    000000c0: b5 74 79 25 9d 60 95 74 82 ed 35 f3 e1 12 6f 25
    000000d0: 81 0d 29 f1 75 7d 25 ee 56 4e eb 8f 36 6c 0e ad
    000000e0: 6f ea 85 7d 38 1e f5 47 41 b7 37 ea f7 37 56 78
    000000f0: 58 5e fd e1 d0 f7 c7 e3 f3 b1 df 5c ea 21 fb f2
    00000100: fa e7 be 3f f2 cf fd 71 b5 5e 75 5a b4 ab
  UrbLink              = 00000000
[148103 ms] UsbSnoop - MyInternalIOCTLCompletion(a95c2126) : fido=857e2b00, Irp=8562e558, Context=868cbac8, IRQL=2
[148103 ms]  <<<  URB 268 coming back  <<< 
-- URB_FUNCTION_BULK_OR_INTERRUPT_TRANSFER:
  PipeHandle           = 858ccfbc [endpoint 0x00000002]
  TransferFlags        = 00000002 (USBD_TRANSFER_DIRECTION_OUT, USBD_SHORT_TRANSFER_OK)
  TransferBufferLength = 0000010e
  TransferBuffer       = 00000000
  TransferBufferMDL    = 85deebd0
  UrbLink              = 00000000
[148106 ms] UsbSnoop - MyInternalIOCTLCompletion(a95c2126) : fido=857e2b00, Irp=86ab43e0, Context=86445700, IRQL=2
[148106 ms]  <<<  URB 267 coming back  <<< 
-- URB_FUNCTION_BULK_OR_INTERRUPT_TRANSFER:
  PipeHandle           = 858ccf9c [endpoint 0x00000081]
  TransferFlags        = 00000003 (USBD_TRANSFER_DIRECTION_IN, USBD_SHORT_TRANSFER_OK)
  TransferBufferLength = 00000012
  TransferBuffer       = 00000000
  TransferBufferMDL    = 86a03ca0
    00000000: 54 fd 64 01 00 ff 64 00 80 14 60 40 02 0a 47 a0
    00000010: 40 60
  UrbLink              = 00000000
[148106 ms] UsbSnoop - FilterDispatchAny(a95c1fd2) : IRP_MJ_INTERNAL_DEVICE_CONTROL
[148106 ms] UsbSnoop - FdoHookDispatchInternalIoctl(a95c21ea) : fdo=868c0de8, Irp=8562e558, IRQL=0
[148106 ms]  >>>  URB 269 going down  >>> 
-- URB_FUNCTION_BULK_OR_INTERRUPT_TRANSFER:
  PipeHandle           = 858ccf9c [endpoint 0x00000081]
  TransferFlags        = 00000003 (USBD_TRANSFER_DIRECTION_IN, USBD_SHORT_TRANSFER_OK)
  TransferBufferLength = 00000200
  TransferBuffer       = 00000000
  TransferBufferMDL    = 859dbbe8
  UrbLink              = 00000000
[148108 ms] UsbSnoop - FilterDispatchAny(a95c1fd2) : IRP_MJ_INTERNAL_DEVICE_CONTROL
[148108 ms] UsbSnoop - FdoHookDispatchInternalIoctl(a95c21ea) : fdo=868c0de8, Irp=86ab43e0, IRQL=0
[148108 ms]  >>>  URB 270 going down  >>> 
-- URB_FUNCTION_BULK_OR_INTERRUPT_TRANSFER:
  PipeHandle           = 858ccfbc [endpoint 0x00000002]
  TransferFlags        = 00000002 (USBD_TRANSFER_DIRECTION_OUT, USBD_SHORT_TRANSFER_OK)
  TransferBufferLength = 0000010e
  TransferBuffer       = 00000000
  TransferBufferMDL    = 85eb1360
    00000000: 54 fd 64 00 80 14 64 01 40 60 9f f0 fe 00 48 23
    00000010: 05 f5 de d7 ab bd 4f 02 52 fe f7 3f ef be d6 fb
    00000020: f8 dc 10 0c c7 fe d0 0f fc cd 58 14 0c 87 5d 7f
    00000030: 34 08 fc f1 f9 cf ba fa 57 8a df 4e c4 fd 83 33
    00000040: f1 3d e7 53 e2 43 72 f3 60 9b c7 7b e6 e6 c1 8e
    00000050: dc dc ff f8 c9 f9 41 42 63 ba 1e fc 3f a6 eb c1
    00000060: 56 ba 1e dc 96 ae 37 32 c6 1d 4f fb 90 d5 b8 37
    00000070: 02 ef 9a aa a3 11 ae 76 9a ec 9d 27 74 b7 35 87
    00000080: 1b 3c 7e ac b9 bb 15 40 ad c6 11 ac 36 1a 14 b7
    00000090: 81 ff 1a 00 bb 1d a2 cb 8b 44 ba 9d 0e fb 7a 26
    000000a0: 9a db f7 02 1a 40 55 3a 44 61 11 d2 21 2a 60 93
    000000b0: 2a 96 5f e3 0e 97 e1 9b e5 6e 3a 22 e8 86 ed d6
    000000c0: c3 76 da 7d 3a 4d 8e 71 47 c5 69 02 41 c4 2d f1
    000000d0: 1d 85 46 2d 75 79 5e 95 8d d3 2d 8a d5 a4 3f 70
    000000e0: 0f 72 58 32 d8 f5 64 d8 f7 7a 0e 6b 2c 12 33 ee
    000000f0: 54 a0 41 8b 2b 27 61 e6 90 a5 61 49 6f e8 fc 36
    00000100: f6 4b f7 1d 63 39 79 25 f8 22 89 f4 e1 14
  UrbLink              = 00000000
[148109 ms] UsbSnoop - MyInternalIOCTLCompletion(a95c2126) : fido=857e2b00, Irp=86ab43e0, Context=868cbac8, IRQL=2
[148109 ms]  <<<  URB 270 coming back  <<< 
-- URB_FUNCTION_BULK_OR_INTERRUPT_TRANSFER:
  PipeHandle           = 858ccfbc [endpoint 0x00000002]
  TransferFlags        = 00000002 (USBD_TRANSFER_DIRECTION_OUT, USBD_SHORT_TRANSFER_OK)
  TransferBufferLength = 0000010e
  TransferBuffer       = 00000000
  TransferBufferMDL    = 85eb1360
  UrbLink              = 00000000
[148112 ms] UsbSnoop - MyInternalIOCTLCompletion(a95c2126) : fido=857e2b00, Irp=8562e558, Context=86445700, IRQL=2
[148112 ms]  <<<  URB 269 coming back  <<< 
-- URB_FUNCTION_BULK_OR_INTERRUPT_TRANSFER:
  PipeHandle           = 858ccf9c [endpoint 0x00000081]
  TransferFlags        = 00000003 (USBD_TRANSFER_DIRECTION_IN, USBD_SHORT_TRANSFER_OK)
  TransferBufferLength = 00000012
  TransferBuffer       = 00000000
  TransferBufferMDL    = 859dbbe8
    00000000: 54 fd 64 01 00 ff 64 00 80 14 60 40 02 0a 48 a1
    00000010: 40 60
  UrbLink              = 00000000
[148112 ms] UsbSnoop - FilterDispatchAny(a95c1fd2) : IRP_MJ_INTERNAL_DEVICE_CONTROL
[148112 ms] UsbSnoop - FdoHookDispatchInternalIoctl(a95c21ea) : fdo=868c0de8, Irp=86ab43e0, IRQL=0
[148112 ms]  >>>  URB 271 going down  >>> 
-- URB_FUNCTION_BULK_OR_INTERRUPT_TRANSFER:
  PipeHandle           = 858ccf9c [endpoint 0x00000081]
  TransferFlags        = 00000003 (USBD_TRANSFER_DIRECTION_IN, USBD_SHORT_TRANSFER_OK)
  TransferBufferLength = 00000200
  TransferBuffer       = 00000000
  TransferBufferMDL    = 859babf0
  UrbLink              = 00000000
[148114 ms] UsbSnoop - FilterDispatchAny(a95c1fd2) : IRP_MJ_INTERNAL_DEVICE_CONTROL
[148114 ms] UsbSnoop - FdoHookDispatchInternalIoctl(a95c21ea) : fdo=868c0de8, Irp=868d0390, IRQL=0
[148114 ms]  >>>  URB 272 going down  >>> 
-- URB_FUNCTION_BULK_OR_INTERRUPT_TRANSFER:
  PipeHandle           = 858ccfbc [endpoint 0x00000002]
  TransferFlags        = 00000002 (USBD_TRANSFER_DIRECTION_OUT, USBD_SHORT_TRANSFER_OK)
  TransferBufferLength = 0000010e
  TransferBuffer       = 00000000
  TransferBufferMDL    = 86504970
    00000000: 54 fd 64 00 80 14 64 01 40 60 7c ca fe 00 49 db
    00000010: 05 b7 a9 87 c7 8d 1a bb 9e 78 98 25 89 73 a6 4f
    00000020: 8c 51 3c e7 42 de ea 33 6c b8 61 c7 a8 5c 13 c8
    00000030: 13 53 b3 dd 77 46 62 96 33 61 0f 64 34 77 15 15
    00000040: 9d 96 29 15 24 a2 8a ea 7d d4 06 17 ed ad 58 59
    00000050: e2 81 18 49 42 96 a6 24 e5 71 12 9e 11 c1 52 bd
    00000060: c3 68 8e d2 e1 b9 39 7b b2 63 2a 79 5a aa 26 de
    00000070: d3 7b a9 28 ef 1e b2 d0 21 cb 0d 61 cf 1d 90 b0
    00000080: 5b 93 48 f2 35 7b 5b ea 83 79 2f 2a 49 5a 84 80
    00000090: 7e df 23 cf 40 0c 44 eb 73 1b ad 71 40 49 56 1f
    000000a0: 5a 56 32 13 3c 6b ec 3a c3 0c 85 2a 79 eb 0e a7
    000000b0: 9a 1a 97 30 3a 53 bc da dd 6c 20 1a 0e a1 a6 17
    000000c0: b8 01 9d e4 f1 e7 f9 6b f4 ec 36 02 eb 15 1e 5c
    000000d0: d1 90 e0 cb cf 18 9e 1d 93 ed a2 2e 99 4d 49 03
    000000e0: 60 79 6e aa 82 91 46 da 92 86 db fd b6 a8 04 1f
    000000f0: 84 4a ef 83 50 e9 df 9b 4a 67 5b 4f c6 6b 9a b0
    00000100: 35 09 7a e9 63 83 31 a6 80 8c 98 a6 5f d2
  UrbLink              = 00000000
[148115 ms] UsbSnoop - MyInternalIOCTLCompletion(a95c2126) : fido=857e2b00, Irp=868d0390, Context=868cbac8, IRQL=2
[148115 ms]  <<<  URB 272 coming back  <<< 
-- URB_FUNCTION_BULK_OR_INTERRUPT_TRANSFER:
  PipeHandle           = 858ccfbc [endpoint 0x00000002]
  TransferFlags        = 00000002 (USBD_TRANSFER_DIRECTION_OUT, USBD_SHORT_TRANSFER_OK)
  TransferBufferLength = 0000010e
  TransferBuffer       = 00000000
  TransferBufferMDL    = 86504970
  UrbLink              = 00000000
[148118 ms] UsbSnoop - MyInternalIOCTLCompletion(a95c2126) : fido=857e2b00, Irp=86ab43e0, Context=86445700, IRQL=2
[148118 ms]  <<<  URB 271 coming back  <<< 
-- URB_FUNCTION_BULK_OR_INTERRUPT_TRANSFER:
  PipeHandle           = 858ccf9c [endpoint 0x00000081]
  TransferFlags        = 00000003 (USBD_TRANSFER_DIRECTION_IN, USBD_SHORT_TRANSFER_OK)
  TransferBufferLength = 00000012
  TransferBuffer       = 00000000
  TransferBufferMDL    = 859babf0
    00000000: 54 fd 64 01 00 ff 64 00 80 14 60 40 02 0a 49 a2
    00000010: 40 60
  UrbLink              = 00000000
[148118 ms] UsbSnoop - FilterDispatchAny(a95c1fd2) : IRP_MJ_INTERNAL_DEVICE_CONTROL
[148118 ms] UsbSnoop - FdoHookDispatchInternalIoctl(a95c21ea) : fdo=868c0de8, Irp=86ab43e0, IRQL=0
[148118 ms]  >>>  URB 273 going down  >>> 
-- URB_FUNCTION_BULK_OR_INTERRUPT_TRANSFER:
  PipeHandle           = 858ccf9c [endpoint 0x00000081]
  TransferFlags        = 00000003 (USBD_TRANSFER_DIRECTION_IN, USBD_SHORT_TRANSFER_OK)
  TransferBufferLength = 00000200
  TransferBuffer       = 00000000
  TransferBufferMDL    = 859babf0
  UrbLink              = 00000000
[148120 ms] UsbSnoop - FilterDispatchAny(a95c1fd2) : IRP_MJ_INTERNAL_DEVICE_CONTROL
[148120 ms] UsbSnoop - FdoHookDispatchInternalIoctl(a95c21ea) : fdo=868c0de8, Irp=868d0390, IRQL=0
[148120 ms]  >>>  URB 274 going down  >>> 
-- URB_FUNCTION_BULK_OR_INTERRUPT_TRANSFER:
  PipeHandle           = 858ccfbc [endpoint 0x00000002]
  TransferFlags        = 00000002 (USBD_TRANSFER_DIRECTION_OUT, USBD_SHORT_TRANSFER_OK)
  TransferBufferLength = 0000010e
  TransferBuffer       = 00000000
  TransferBufferMDL    = 85d6a4d0
    00000000: 54 fd 64 00 80 14 64 01 40 60 51 21 fe 00 4a 08
    00000010: 05 8c 4d a8 26 54 97 b1 36 4e f9 d4 16 53 a3 ea
    00000020: 06 a6 26 fe 6d 12 c1 d2 3d ec ea 16 4d 94 36 b6
    00000030: 3e 8a f4 8c a5 e6 1d f6 06 46 13 01 a6 64 05 39
    00000040: b5 bc 74 d6 35 30 62 f1 e4 0f 78 94 c5 bb 92 19
    00000050: d5 f5 dc 20 11 ec 21 11 1c 4e a2 b7 87 44 ef 70
    00000060: 12 fd 3d 24 fa fb 48 74 6a b5 d4 3a bd 97 39 a7
    00000070: 77 98 33 38 1e 73 5e 51 ff f7 f7 50 e6 3e 93 5e
    00000080: d1 e0 3e 64 f6 99 f5 8a f6 ee 43 66 9f 69 af 68
    00000090: 7f 3f 99 f7 37 6f b8 c3 bc 1f d2 7a ef cf 61 74
    000000a0: f4 1c b2 a3 e7 70 76 f4 1c c6 47 cf e1 fc e8 39
    000000b0: 4c ee e0 10 8f 78 fc b2 1c fe 70 f4 1c be 39 7a
    000000c0: 0e d3 a3 e7 30 3b 7a 0e f3 a3 e7 90 1f 3d 87 c5
    000000d0: d1 73 f8 f6 e8 39 14 47 cf a1 3c 7a 0e d5 d1 73
    000000e0: 58 1e 3d 87 8b a3 e7 70 79 f4 1c ae ee e2 f0 17
    000000f0: cf 0f d7 47 cf e1 8f bf 8c 95 6b d8 56 d4 2f 0e
    00000100: dd b5 10 8d d9 78 51 79 fd d2 73 97 57 ae
  UrbLink              = 00000000
[148121 ms] UsbSnoop - MyInternalIOCTLCompletion(a95c2126) : fido=857e2b00, Irp=868d0390, Context=868cbac8, IRQL=2
[148121 ms]  <<<  URB 274 coming back  <<< 
-- URB_FUNCTION_BULK_OR_INTERRUPT_TRANSFER:
  PipeHandle           = 858ccfbc [endpoint 0x00000002]
  TransferFlags        = 00000002 (USBD_TRANSFER_DIRECTION_OUT, USBD_SHORT_TRANSFER_OK)
  TransferBufferLength = 0000010e
  TransferBuffer       = 00000000
  TransferBufferMDL    = 85d6a4d0
  UrbLink              = 00000000
[148124 ms] UsbSnoop - MyInternalIOCTLCompletion(a95c2126) : fido=857e2b00, Irp=86ab43e0, Context=86445700, IRQL=2
[148124 ms]  <<<  URB 273 coming back  <<< 
-- URB_FUNCTION_BULK_OR_INTERRUPT_TRANSFER:
  PipeHandle           = 858ccf9c [endpoint 0x00000081]
  TransferFlags        = 00000003 (USBD_TRANSFER_DIRECTION_IN, USBD_SHORT_TRANSFER_OK)
  TransferBufferLength = 00000012
  TransferBuffer       = 00000000
  TransferBufferMDL    = 859babf0
    00000000: 54 fd 64 01 00 ff 64 00 80 14 60 40 02 0a 4a a3
    00000010: 40 60
  UrbLink              = 00000000
[148124 ms] UsbSnoop - FilterDispatchAny(a95c1fd2) : IRP_MJ_INTERNAL_DEVICE_CONTROL
[148124 ms] UsbSnoop - FdoHookDispatchInternalIoctl(a95c21ea) : fdo=868c0de8, Irp=868d0390, IRQL=0
[148124 ms]  >>>  URB 275 going down  >>> 
-- URB_FUNCTION_BULK_OR_INTERRUPT_TRANSFER:
  PipeHandle           = 858ccf9c [endpoint 0x00000081]
  TransferFlags        = 00000003 (USBD_TRANSFER_DIRECTION_IN, USBD_SHORT_TRANSFER_OK)
  TransferBufferLength = 00000200
  TransferBuffer       = 00000000
  TransferBufferMDL    = 86a03ca0
  UrbLink              = 00000000
[148126 ms] UsbSnoop - FilterDispatchAny(a95c1fd2) : IRP_MJ_INTERNAL_DEVICE_CONTROL
[148126 ms] UsbSnoop - FdoHookDispatchInternalIoctl(a95c21ea) : fdo=868c0de8, Irp=85745e48, IRQL=0
[148126 ms]  >>>  URB 276 going down  >>> 
-- URB_FUNCTION_BULK_OR_INTERRUPT_TRANSFER:
  PipeHandle           = 858ccfbc [endpoint 0x00000002]
  TransferFlags        = 00000002 (USBD_TRANSFER_DIRECTION_OUT, USBD_SHORT_TRANSFER_OK)
  TransferBufferLength = 0000010e
  TransferBuffer       = 00000000
  TransferBufferMDL    = 868a7e10
    00000000: 54 fd 64 00 80 14 64 01 40 60 95 65 fe 00 4b 91
    00000010: 05 b1 fa b4 d5 43 a3 cc fd b9 67 7c 99 5b c6 f6
    00000020: d5 62 cf 88 cd 68 99 aa a7 db 0f 15 3b 6a 1a 1d
    00000030: 5e e6 11 2b 58 1e d1 5c e9 7b b3 df 98 0b 66 5e
    00000040: ab ef ee 46 fb a8 b0 c2 d4 fb b7 10 71 6d 76 d3
    00000050: 78 52 2a fe 05 8f d8 37 ee 96 c9 01 ad 1a 94 9e
    00000060: 1d 40 67 4f 9b 4b b5 ef cd 6f 47 1d fe 86 b3 ba
    00000070: 0f 64 2c 9f d4 3c 93 dd be bb eb bd e7 fb 3f 1f
    00000080: de 36 91 36 58 bc 8b c1 5d 6f f2 9a dc 04 bd e1
    00000090: fb 72 b8 6f 22 35 3d bf 36 4d bd 9f 53 17 10 6f
    000000a0: f6 70 cc eb 39 bb 9f f3 db d8 8e 32 57 a7 5b d7
    000000b0: f5 aa 8d 28 3c 8b 40 58 94 e8 eb ef d5 2d 5c f3
    000000c0: 89 04 b3 fd 84 57 64 71 9b 45 30 aa ec f5 b7 39
    000000d0: de ff 8e ea 9b f6 be 47 ae e7 82 31 a0 96 15 29
    000000e0: 34 93 17 e4 2b bd fd f5 e4 8c c0 50 7c a6 fb 3d
    000000f0: 33 f3 87 3c 34 1f 00 d0 23 e3 cd da 47 fa 8a ee
    00000100: 13 1c 4d ba e1 a8 c4 6d 30 02 06 07 26 1f
  UrbLink              = 00000000
[148127 ms] UsbSnoop - MyInternalIOCTLCompletion(a95c2126) : fido=857e2b00, Irp=85745e48, Context=868cbac8, IRQL=2
[148127 ms]  <<<  URB 276 coming back  <<< 
-- URB_FUNCTION_BULK_OR_INTERRUPT_TRANSFER:
  PipeHandle           = 858ccfbc [endpoint 0x00000002]
  TransferFlags        = 00000002 (USBD_TRANSFER_DIRECTION_OUT, USBD_SHORT_TRANSFER_OK)
  TransferBufferLength = 0000010e
  TransferBuffer       = 00000000
  TransferBufferMDL    = 868a7e10
  UrbLink              = 00000000
[148129 ms] UsbSnoop - MyInternalIOCTLCompletion(a95c2126) : fido=857e2b00, Irp=868d0390, Context=86445700, IRQL=2
[148129 ms]  <<<  URB 275 coming back  <<< 
-- URB_FUNCTION_BULK_OR_INTERRUPT_TRANSFER:
  PipeHandle           = 858ccf9c [endpoint 0x00000081]
  TransferFlags        = 00000003 (USBD_TRANSFER_DIRECTION_IN, USBD_SHORT_TRANSFER_OK)
  TransferBufferLength = 00000012
  TransferBuffer       = 00000000
  TransferBufferMDL    = 86a03ca0
    00000000: 54 fd 64 01 00 ff 64 00 80 14 60 40 02 0a 4b a4
    00000010: 40 60
  UrbLink              = 00000000
[148129 ms] UsbSnoop - FilterDispatchAny(a95c1fd2) : IRP_MJ_INTERNAL_DEVICE_CONTROL
[148129 ms] UsbSnoop - FdoHookDispatchInternalIoctl(a95c21ea) : fdo=868c0de8, Irp=8562e558, IRQL=0
[148129 ms]  >>>  URB 277 going down  >>> 
-- URB_FUNCTION_BULK_OR_INTERRUPT_TRANSFER:
  PipeHandle           = 858ccf9c [endpoint 0x00000081]
  TransferFlags        = 00000003 (USBD_TRANSFER_DIRECTION_IN, USBD_SHORT_TRANSFER_OK)
  TransferBufferLength = 00000200
  TransferBuffer       = 00000000
  TransferBufferMDL    = 85d6a4d0
  UrbLink              = 00000000
[148132 ms] UsbSnoop - FilterDispatchAny(a95c1fd2) : IRP_MJ_INTERNAL_DEVICE_CONTROL
[148132 ms] UsbSnoop - FdoHookDispatchInternalIoctl(a95c21ea) : fdo=868c0de8, Irp=868d0390, IRQL=0
[148132 ms]  >>>  URB 278 going down  >>> 
-- URB_FUNCTION_BULK_OR_INTERRUPT_TRANSFER:
  PipeHandle           = 858ccfbc [endpoint 0x00000002]
  TransferFlags        = 00000002 (USBD_TRANSFER_DIRECTION_OUT, USBD_SHORT_TRANSFER_OK)
  TransferBufferLength = 0000010e
  TransferBuffer       = 00000000
  TransferBufferMDL    = 86a03ca0
    00000000: 54 fd 64 00 80 14 64 01 40 60 25 1d fe 00 4c da
    00000010: 05 2a bc 55 c7 04 6e 4d 2d 12 b6 64 e2 11 b6 c9
    00000020: e8 1b a6 b7 7f e8 94 db bd 23 dc 21 d3 fb 4c 6d
    00000030: 6a e6 92 b3 de 42 43 d5 a0 20 8d 6b be fa 82 de
    00000040: 17 f8 f5 02 5e d8 7b cc 4d c9 cd 85 5d c3 2f 92
    00000050: c8 a8 78 63 4b 12 75 51 b0 db 37 98 3e be 91 df
    00000060: 52 f5 76 f2 2d 9a 2c 31 1f 27 a0 8a 67 49 48 96
    00000070: 3a e2 e0 86 e0 67 eb 48 f0 98 e5 9f ea 9e ba bd
    00000080: ed 48 c9 5b 3a d7 5f 26 b9 be ad 23 52 06 ee ba
    00000090: e7 5e c3 91 fe 7c 6d ec 72 f1 3d 21 df fb b2 9c
    000000a0: ce 19 8d c8 53 2e 04 0b d5 ef 34 d2 35 fd 0b 94
    000000b0: dc d8 f4 96 89 f5 2b fb 52 c2 f3 52 80 be 05 79
    000000c0: 59 5f eb b6 fb be 5f 33 c9 4b 11 b2 cd 0f 28 7c
    000000d0: 87 37 ce 69 4e 66 09 ba 12 de 88 c7 23 0f 49 ca
    000000e0: a2 e6 dd 70 fc 8c 82 be e6 ca 49 29 59 fb db 29
    000000f0: f5 87 39 f4 6e a7 fe 94 88 e0 51 19 2a f2 f4 99
    00000100: 99 b9 e8 b9 60 03 96 2c 5a 9f 60 a9 be 95
  UrbLink              = 00000000
[148133 ms] UsbSnoop - MyInternalIOCTLCompletion(a95c2126) : fido=857e2b00, Irp=868d0390, Context=868cbac8, IRQL=2
[148133 ms]  <<<  URB 278 coming back  <<< 
-- URB_FUNCTION_BULK_OR_INTERRUPT_TRANSFER:
  PipeHandle           = 858ccfbc [endpoint 0x00000002]
  TransferFlags        = 00000002 (USBD_TRANSFER_DIRECTION_OUT, USBD_SHORT_TRANSFER_OK)
  TransferBufferLength = 0000010e
  TransferBuffer       = 00000000
  TransferBufferMDL    = 86a03ca0
  UrbLink              = 00000000
[148135 ms] UsbSnoop - MyInternalIOCTLCompletion(a95c2126) : fido=857e2b00, Irp=8562e558, Context=86445700, IRQL=2
[148135 ms]  <<<  URB 277 coming back  <<< 
-- URB_FUNCTION_BULK_OR_INTERRUPT_TRANSFER:
  PipeHandle           = 858ccf9c [endpoint 0x00000081]
  TransferFlags        = 00000003 (USBD_TRANSFER_DIRECTION_IN, USBD_SHORT_TRANSFER_OK)
  TransferBufferLength = 00000012
  TransferBuffer       = 00000000
  TransferBufferMDL    = 85d6a4d0
    00000000: 54 fd 64 01 00 ff 64 00 80 14 60 40 02 0a 4c a5
    00000010: 40 60
  UrbLink              = 00000000
[148135 ms] UsbSnoop - FilterDispatchAny(a95c1fd2) : IRP_MJ_INTERNAL_DEVICE_CONTROL
[148135 ms] UsbSnoop - FdoHookDispatchInternalIoctl(a95c21ea) : fdo=868c0de8, Irp=868d0390, IRQL=0
[148135 ms]  >>>  URB 279 going down  >>> 
-- URB_FUNCTION_BULK_OR_INTERRUPT_TRANSFER:
  PipeHandle           = 858ccf9c [endpoint 0x00000081]
  TransferFlags        = 00000003 (USBD_TRANSFER_DIRECTION_IN, USBD_SHORT_TRANSFER_OK)
  TransferBufferLength = 00000200
  TransferBuffer       = 00000000
  TransferBufferMDL    = 85d6a4d0
  UrbLink              = 00000000
[148137 ms] UsbSnoop - FilterDispatchAny(a95c1fd2) : IRP_MJ_INTERNAL_DEVICE_CONTROL
[148137 ms] UsbSnoop - FdoHookDispatchInternalIoctl(a95c21ea) : fdo=868c0de8, Irp=86a14008, IRQL=0
[148137 ms]  >>>  URB 280 going down  >>> 
-- URB_FUNCTION_BULK_OR_INTERRUPT_TRANSFER:
  PipeHandle           = 858ccfbc [endpoint 0x00000002]
  TransferFlags        = 00000002 (USBD_TRANSFER_DIRECTION_OUT, USBD_SHORT_TRANSFER_OK)
  TransferBufferLength = 000000f2
  TransferBuffer       = 00000000
  TransferBufferMDL    = 86a03ca0
    00000000: 54 fd 64 00 80 14 64 01 40 60 6c 32 e2 00 4d 1b
    00000010: 05 42 4e da 7c d0 08 23 00 7e 27 a1 c5 44 45 ff
    00000020: 9a ad c0 d7 5f e6 52 09 fb f9 8d 25 9b ca 04 6f
    00000030: d3 f3 8d 2f bb a4 ee cb 2e 8a 85 f3 9c a7 3c 5e
    00000040: 83 57 5d 9c cc 95 2a 2e 3a 1d 06 7c 9a db ef 2a
    00000050: f1 42 9e 75 62 de c9 75 67 96 c7 69 22 e7 fb be
    00000060: c7 d0 c1 8f 01 4d fe 07 50 4b 01 02 14 00 14 00
    00000070: 00 00 08 00 d0 80 b5 36 23 d2 34 11 aa 00 00 00
    00000080: 27 01 00 00 0c 00 00 00 00 00 00 00 01 00 20 00
    00000090: 00 00 00 00 00 00 44 6f 63 75 6d 65 6e 74 2e 78
    000000a0: 6d 6c 50 4b 01 02 14 00 14 00 00 00 08 00 d0 80
    000000b0: b5 36 f6 e2 0e 94 29 0f 00 00 3a 48 00 00 0c 00
    000000c0: 00 00 00 00 00 00 01 00 20 00 00 00 d4 00 00 00
    000000d0: 50 72 6f 62 6c 65 6d 31 2e 78 6d 6c 50 4b 05 06
    000000e0: 00 00 00 00 02 00 02 00 74 00 00 00 27 10 00 00
    000000f0: 00 00
  UrbLink              = 00000000
[148138 ms] UsbSnoop - MyInternalIOCTLCompletion(a95c2126) : fido=857e2b00, Irp=86a14008, Context=868cbac8, IRQL=2
[148138 ms]  <<<  URB 280 coming back  <<< 
-- URB_FUNCTION_BULK_OR_INTERRUPT_TRANSFER:
  PipeHandle           = 858ccfbc [endpoint 0x00000002]
  TransferFlags        = 00000002 (USBD_TRANSFER_DIRECTION_OUT, USBD_SHORT_TRANSFER_OK)
  TransferBufferLength = 000000f2
  TransferBuffer       = 00000000
  TransferBufferMDL    = 86a03ca0
  UrbLink              = 00000000
[148140 ms] UsbSnoop - MyInternalIOCTLCompletion(a95c2126) : fido=857e2b00, Irp=868d0390, Context=86445700, IRQL=2
[148140 ms]  <<<  URB 279 coming back  <<< 
-- URB_FUNCTION_BULK_OR_INTERRUPT_TRANSFER:
  PipeHandle           = 858ccf9c [endpoint 0x00000081]
  TransferFlags        = 00000003 (USBD_TRANSFER_DIRECTION_IN, USBD_SHORT_TRANSFER_OK)
  TransferBufferLength = 00000012
  TransferBuffer       = 00000000
  TransferBufferMDL    = 85d6a4d0
    00000000: 54 fd 64 01 00 ff 64 00 80 14 60 40 02 0a 4d a6
    00000010: 40 60
  UrbLink              = 00000000
[148140 ms] UsbSnoop - FilterDispatchAny(a95c1fd2) : IRP_MJ_INTERNAL_DEVICE_CONTROL
[148140 ms] UsbSnoop - FdoHookDispatchInternalIoctl(a95c21ea) : fdo=868c0de8, Irp=868d0390, IRQL=0
[148140 ms]  >>>  URB 281 going down  >>> 
-- URB_FUNCTION_BULK_OR_INTERRUPT_TRANSFER:
  PipeHandle           = 858ccf9c [endpoint 0x00000081]
  TransferFlags        = 00000003 (USBD_TRANSFER_DIRECTION_IN, USBD_SHORT_TRANSFER_OK)
  TransferBufferLength = 00000200
  TransferBuffer       = 00000000
  TransferBufferMDL    = 85deebd0
  UrbLink              = 00000000
[148228 ms] UsbSnoop - MyInternalIOCTLCompletion(a95c2126) : fido=857e2b00, Irp=868d0390, Context=86445700, IRQL=2
[148228 ms]  <<<  URB 281 coming back  <<< 
-- URB_FUNCTION_BULK_OR_INTERRUPT_TRANSFER:
  PipeHandle           = 858ccf9c [endpoint 0x00000081]
  TransferFlags        = 00000003 (USBD_TRANSFER_DIRECTION_IN, USBD_SHORT_TRANSFER_OK)
  TransferBufferLength = 00000012
  TransferBuffer       = 00000000
  TransferBufferMDL    = 85deebd0
    00000000: 54 fd 64 01 40 60 64 00 80 14 00 ff 02 00 3a 89
    00000010: ff 00
  UrbLink              = 00000000
[148228 ms] UsbSnoop - FilterDispatchAny(a95c1fd2) : IRP_MJ_INTERNAL_DEVICE_CONTROL
[148228 ms] UsbSnoop - FdoHookDispatchInternalIoctl(a95c21ea) : fdo=868c0de8, Irp=868d0390, IRQL=0
[148228 ms]  >>>  URB 282 going down  >>> 
-- URB_FUNCTION_BULK_OR_INTERRUPT_TRANSFER:
  PipeHandle           = 858ccfbc [endpoint 0x00000002]
  TransferFlags        = 00000002 (USBD_TRANSFER_DIRECTION_OUT, USBD_SHORT_TRANSFER_OK)
  TransferBufferLength = 00000012
  TransferBuffer       = 00000000
  TransferBufferMDL    = 85deebd0
    00000000: 54 fd 64 00 00 ff 64 01 40 60 14 80 02 0a 3a 93
    00000010: 80 14
  UrbLink              = 00000000
[148229 ms] UsbSnoop - MyInternalIOCTLCompletion(a95c2126) : fido=857e2b00, Irp=868d0390, Context=86445700, IRQL=2
[148229 ms]  <<<  URB 282 coming back  <<< 
-- URB_FUNCTION_BULK_OR_INTERRUPT_TRANSFER:
  PipeHandle           = 858ccfbc [endpoint 0x00000002]
  TransferFlags        = 00000002 (USBD_TRANSFER_DIRECTION_OUT, USBD_SHORT_TRANSFER_OK)
  TransferBufferLength = 00000012
  TransferBuffer       = 00000000
  TransferBufferMDL    = 85deebd0
  UrbLink              = 00000000
[148229 ms] UsbSnoop - FilterDispatchAny(a95c1fd2) : IRP_MJ_INTERNAL_DEVICE_CONTROL
[148229 ms] UsbSnoop - FdoHookDispatchInternalIoctl(a95c21ea) : fdo=868c0de8, Irp=868d0390, IRQL=0
[148229 ms]  >>>  URB 283 going down  >>> 
-- URB_FUNCTION_BULK_OR_INTERRUPT_TRANSFER:
  PipeHandle           = 858ccf9c [endpoint 0x00000081]
  TransferFlags        = 00000003 (USBD_TRANSFER_DIRECTION_IN, USBD_SHORT_TRANSFER_OK)
  TransferBufferLength = 00000200
  TransferBuffer       = 00000000
  TransferBufferMDL    = 856df3d0
  UrbLink              = 00000000
[148229 ms] UsbSnoop - FilterDispatchAny(a95c1fd2) : IRP_MJ_INTERNAL_DEVICE_CONTROL
[148229 ms] UsbSnoop - FdoHookDispatchInternalIoctl(a95c21ea) : fdo=868c0de8, Irp=8562e558, IRQL=0
[148230 ms]  >>>  URB 284 going down  >>> 
-- URB_FUNCTION_BULK_OR_INTERRUPT_TRANSFER:
  PipeHandle           = 858ccfbc [endpoint 0x00000002]
  TransferFlags        = 00000002 (USBD_TRANSFER_DIRECTION_OUT, USBD_SHORT_TRANSFER_OK)
  TransferBufferLength = 00000012
  TransferBuffer       = 00000000
  TransferBufferMDL    = 85deebd0
    00000000: 54 fd 64 00 40 de 64 01 40 60 14 80 02 00 4e bc
    00000010: 80 14
  UrbLink              = 00000000
[148230 ms] UsbSnoop - MyInternalIOCTLCompletion(a95c2126) : fido=857e2b00, Irp=8562e558, Context=868cbac8, IRQL=2
[148230 ms]  <<<  URB 284 coming back  <<< 
-- URB_FUNCTION_BULK_OR_INTERRUPT_TRANSFER:
  PipeHandle           = 858ccfbc [endpoint 0x00000002]
  TransferFlags        = 00000002 (USBD_TRANSFER_DIRECTION_OUT, USBD_SHORT_TRANSFER_OK)
  TransferBufferLength = 00000012
  TransferBuffer       = 00000000
  TransferBufferMDL    = 85deebd0
  UrbLink              = 00000000
[148232 ms] UsbSnoop - MyInternalIOCTLCompletion(a95c2126) : fido=857e2b00, Irp=868d0390, Context=86445700, IRQL=2
[148232 ms]  <<<  URB 283 coming back  <<< 
-- URB_FUNCTION_BULK_OR_INTERRUPT_TRANSFER:
  PipeHandle           = 858ccf9c [endpoint 0x00000081]
  TransferFlags        = 00000003 (USBD_TRANSFER_DIRECTION_IN, USBD_SHORT_TRANSFER_OK)
  TransferBufferLength = 00000012
  TransferBuffer       = 00000000
  TransferBufferMDL    = 856df3d0
    00000000: 54 fd 64 01 00 ff 64 00 80 14 60 40 02 0a 4e a7
    00000010: 40 60
  UrbLink              = 00000000
[148232 ms] UsbSnoop - FilterDispatchAny(a95c1fd2) : IRP_MJ_INTERNAL_DEVICE_CONTROL
[148232 ms] UsbSnoop - FdoHookDispatchInternalIoctl(a95c21ea) : fdo=868c0de8, Irp=868d0390, IRQL=0
[148232 ms]  >>>  URB 285 going down  >>> 
-- URB_FUNCTION_BULK_OR_INTERRUPT_TRANSFER:
  PipeHandle           = 858ccf9c [endpoint 0x00000081]
  TransferFlags        = 00000003 (USBD_TRANSFER_DIRECTION_IN, USBD_SHORT_TRANSFER_OK)
  TransferBufferLength = 00000200
  TransferBuffer       = 00000000
  TransferBufferMDL    = 859babf0
  UrbLink              = 00000000
[148246 ms] UsbSnoop - FilterDispatchAny(a95c1fd2) : IRP_MJ_INTERNAL_DEVICE_CONTROL
[148246 ms] UsbSnoop - FdoHookDispatchInternalIoctl(a95c21ea) : fdo=868c0de8, Irp=8562e558, IRQL=0
[148246 ms]  >>>  URB 286 going down  >>> 
-- URB_FUNCTION_BULK_OR_INTERRUPT_TRANSFER:
  PipeHandle           = 858ccfbc [endpoint 0x00000002]
  TransferFlags        = 00000002 (USBD_TRANSFER_DIRECTION_OUT, USBD_SHORT_TRANSFER_OK)
  TransferBufferLength = 00000011
  TransferBuffer       = 00000000
  TransferBufferMDL    = 85eb1360
    00000000: 54 fd 64 00 80 16 64 01 40 20 01 00 01 00 4f 61
    00000010: 01
  UrbLink              = 00000000
[148265 ms] UsbSnoop - MyInternalIOCTLCompletion(a95c2126) : fido=857e2b00, Irp=8562e558, Context=868cbac8, IRQL=2
[148265 ms]  <<<  URB 286 coming back  <<< 
-- URB_FUNCTION_BULK_OR_INTERRUPT_TRANSFER:
  PipeHandle           = 858ccfbc [endpoint 0x00000002]
  TransferFlags        = 00000002 (USBD_TRANSFER_DIRECTION_OUT, USBD_SHORT_TRANSFER_OK)
  TransferBufferLength = 00000011
  TransferBuffer       = 00000000
  TransferBufferMDL    = 85eb1360
  UrbLink              = 00000000
[148266 ms] UsbSnoop - MyInternalIOCTLCompletion(a95c2126) : fido=857e2b00, Irp=868d0390, Context=86445700, IRQL=2
[148266 ms]  <<<  URB 285 coming back  <<< 
-- URB_FUNCTION_BULK_OR_INTERRUPT_TRANSFER:
  PipeHandle           = 858ccf9c [endpoint 0x00000081]
  TransferFlags        = 00000003 (USBD_TRANSFER_DIRECTION_IN, USBD_SHORT_TRANSFER_OK)
  TransferBufferLength = 00000012
  TransferBuffer       = 00000000
  TransferBufferMDL    = 859babf0
    00000000: 54 fd 64 01 00 ff 64 00 80 16 20 40 02 0a 4f 6a
    00000010: 40 20
  UrbLink              = 00000000
[148266 ms] UsbSnoop - FilterDispatchAny(a95c1fd2) : IRP_MJ_INTERNAL_DEVICE_CONTROL
[148266 ms] UsbSnoop - FdoHookDispatchInternalIoctl(a95c21ea) : fdo=868c0de8, Irp=868d0390, IRQL=0
[148266 ms]  >>>  URB 287 going down  >>> 
-- URB_FUNCTION_BULK_OR_INTERRUPT_TRANSFER:
  PipeHandle           = 858ccf9c [endpoint 0x00000081]
  TransferFlags        = 00000003 (USBD_TRANSFER_DIRECTION_IN, USBD_SHORT_TRANSFER_OK)
  TransferBufferLength = 00000200
  TransferBuffer       = 00000000
  TransferBufferMDL    = 859babf0
  UrbLink              = 00000000
[148284 ms] UsbSnoop - MyInternalIOCTLCompletion(a95c2126) : fido=857e2b00, Irp=868d0390, Context=86445700, IRQL=2
[148284 ms]  <<<  URB 287 coming back  <<< 
-- URB_FUNCTION_BULK_OR_INTERRUPT_TRANSFER:
  PipeHandle           = 858ccf9c [endpoint 0x00000081]
  TransferFlags        = 00000003 (USBD_TRANSFER_DIRECTION_IN, USBD_SHORT_TRANSFER_OK)
  TransferBufferLength = 0000007f
  TransferBuffer       = 00000000
  TransferBufferMDL    = 859babf0
    00000000: 54 fd 64 01 40 20 64 00 80 16 d9 b0 6f 00 3b 43
    00000010: 01 00 00 00 00 01 65 2c 00 00 00 00 00 01 be 00
    00000020: 00 00 00 00 00 01 41 94 cc 00 00 00 00 01 83 5f
    00000030: 2c 7f 00 00 5a 01 01 24 25 01 01 22 d4 01 01 23
    00000040: 15 00 00 00 00 00 02 00 00 00 00 01 40 00 f0 04
    00000050: 00 1e 30 30 30 30 34 42 43 31 42 31 30 45 35 37
    00000060: 30 46 00 30 45 30 30 30 30 30 34 42 43 31 42 31
    00000070: 30 45 35 37 30 46 43 42 32 38 30 34 46 31 00
  UrbLink              = 00000000
[148284 ms] UsbSnoop - FilterDispatchAny(a95c1fd2) : IRP_MJ_INTERNAL_DEVICE_CONTROL
[148284 ms] UsbSnoop - FdoHookDispatchInternalIoctl(a95c21ea) : fdo=868c0de8, Irp=868d0390, IRQL=0
[148284 ms]  >>>  URB 288 going down  >>> 
-- URB_FUNCTION_BULK_OR_INTERRUPT_TRANSFER:
  PipeHandle           = 858ccfbc [endpoint 0x00000002]
  TransferFlags        = 00000002 (USBD_TRANSFER_DIRECTION_OUT, USBD_SHORT_TRANSFER_OK)
  TransferBufferLength = 00000012
  TransferBuffer       = 00000000
  TransferBufferMDL    = 859babf0
    00000000: 54 fd 64 00 00 ff 64 01 40 20 16 80 02 0a 3b 56
    00000010: 80 16
  UrbLink              = 00000000
[148285 ms] UsbSnoop - MyInternalIOCTLCompletion(a95c2126) : fido=857e2b00, Irp=868d0390, Context=86445700, IRQL=2
[148285 ms]  <<<  URB 288 coming back  <<< 
-- URB_FUNCTION_BULK_OR_INTERRUPT_TRANSFER:
  PipeHandle           = 858ccfbc [endpoint 0x00000002]
  TransferFlags        = 00000002 (USBD_TRANSFER_DIRECTION_OUT, USBD_SHORT_TRANSFER_OK)
  TransferBufferLength = 00000012
  TransferBuffer       = 00000000
  TransferBufferMDL    = 859babf0
  UrbLink              = 00000000
[148285 ms] UsbSnoop - FilterDispatchAny(a95c1fd2) : IRP_MJ_INTERNAL_DEVICE_CONTROL
[148285 ms] UsbSnoop - FdoHookDispatchInternalIoctl(a95c21ea) : fdo=868c0de8, Irp=868d0390, IRQL=0
[148285 ms]  >>>  URB 289 going down  >>> 
-- URB_FUNCTION_BULK_OR_INTERRUPT_TRANSFER:
  PipeHandle           = 858ccf9c [endpoint 0x00000081]
  TransferFlags        = 00000003 (USBD_TRANSFER_DIRECTION_IN, USBD_SHORT_TRANSFER_OK)
  TransferBufferLength = 00000200
  TransferBuffer       = 00000000
  TransferBufferMDL    = 859babf0
  UrbLink              = 00000000
[148285 ms] UsbSnoop - FilterDispatchAny(a95c1fd2) : IRP_MJ_INTERNAL_DEVICE_CONTROL
[148285 ms] UsbSnoop - FdoHookDispatchInternalIoctl(a95c21ea) : fdo=868c0de8, Irp=85745e48, IRQL=0
[148285 ms]  >>>  URB 290 going down  >>> 
-- URB_FUNCTION_BULK_OR_INTERRUPT_TRANSFER:
  PipeHandle           = 858ccfbc [endpoint 0x00000002]
  TransferFlags        = 00000002 (USBD_TRANSFER_DIRECTION_OUT, USBD_SHORT_TRANSFER_OK)
  TransferBufferLength = 00000011
  TransferBuffer       = 00000000
  TransferBufferMDL    = 85deebd0
    00000000: 54 fd 64 00 80 16 64 01 40 20 02 00 01 00 50 63
    00000010: 02
  UrbLink              = 00000000
[148286 ms] UsbSnoop - MyInternalIOCTLCompletion(a95c2126) : fido=857e2b00, Irp=85745e48, Context=868cbac8, IRQL=2
[148286 ms]  <<<  URB 290 coming back  <<< 
-- URB_FUNCTION_BULK_OR_INTERRUPT_TRANSFER:
  PipeHandle           = 858ccfbc [endpoint 0x00000002]
  TransferFlags        = 00000002 (USBD_TRANSFER_DIRECTION_OUT, USBD_SHORT_TRANSFER_OK)
  TransferBufferLength = 00000011
  TransferBuffer       = 00000000
  TransferBufferMDL    = 85deebd0
  UrbLink              = 00000000
[148288 ms] UsbSnoop - MyInternalIOCTLCompletion(a95c2126) : fido=857e2b00, Irp=868d0390, Context=86445700, IRQL=2
[148288 ms]  <<<  URB 289 coming back  <<< 
-- URB_FUNCTION_BULK_OR_INTERRUPT_TRANSFER:
  PipeHandle           = 858ccf9c [endpoint 0x00000081]
  TransferFlags        = 00000003 (USBD_TRANSFER_DIRECTION_IN, USBD_SHORT_TRANSFER_OK)
  TransferBufferLength = 00000012
  TransferBuffer       = 00000000
  TransferBufferMDL    = 859babf0
    00000000: 54 fd 64 01 00 ff 64 00 80 16 20 40 02 0a 50 6b
    00000010: 40 20
  UrbLink              = 00000000
[148288 ms] UsbSnoop - FilterDispatchAny(a95c1fd2) : IRP_MJ_INTERNAL_DEVICE_CONTROL
[148288 ms] UsbSnoop - FdoHookDispatchInternalIoctl(a95c21ea) : fdo=868c0de8, Irp=868d0390, IRQL=0
[148288 ms]  >>>  URB 291 going down  >>> 
-- URB_FUNCTION_BULK_OR_INTERRUPT_TRANSFER:
  PipeHandle           = 858ccf9c [endpoint 0x00000081]
  TransferFlags        = 00000003 (USBD_TRANSFER_DIRECTION_IN, USBD_SHORT_TRANSFER_OK)
  TransferBufferLength = 00000200
  TransferBuffer       = 00000000
  TransferBufferMDL    = 859babf0
  UrbLink              = 00000000
[148292 ms] UsbSnoop - MyInternalIOCTLCompletion(a95c2126) : fido=857e2b00, Irp=868d0390, Context=86445700, IRQL=2
[148292 ms]  <<<  URB 291 coming back  <<< 
-- URB_FUNCTION_BULK_OR_INTERRUPT_TRANSFER:
  PipeHandle           = 858ccf9c [endpoint 0x00000081]
  TransferFlags        = 00000003 (USBD_TRANSFER_DIRECTION_IN, USBD_SHORT_TRANSFER_OK)
  TransferBufferLength = 0000001b
  TransferBuffer       = 00000000
  TransferBufferMDL    = 859babf0
    00000000: 54 fd 64 01 40 20 64 00 80 16 38 5a 0b 00 3c e9
    00000010: 02 54 49 2d 4e 73 70 69 72 65 00
  UrbLink              = 00000000
[148292 ms] UsbSnoop - FilterDispatchAny(a95c1fd2) : IRP_MJ_INTERNAL_DEVICE_CONTROL
[148292 ms] UsbSnoop - FdoHookDispatchInternalIoctl(a95c21ea) : fdo=868c0de8, Irp=868d0390, IRQL=0
[148292 ms]  >>>  URB 292 going down  >>> 
-- URB_FUNCTION_BULK_OR_INTERRUPT_TRANSFER:
  PipeHandle           = 858ccfbc [endpoint 0x00000002]
  TransferFlags        = 00000002 (USBD_TRANSFER_DIRECTION_OUT, USBD_SHORT_TRANSFER_OK)
  TransferBufferLength = 00000012
  TransferBuffer       = 00000000
  TransferBufferMDL    = 859babf0
    00000000: 54 fd 64 00 00 ff 64 01 40 20 16 80 02 0a 3c 57
    00000010: 80 16
  UrbLink              = 00000000
[148293 ms] UsbSnoop - MyInternalIOCTLCompletion(a95c2126) : fido=857e2b00, Irp=868d0390, Context=86445700, IRQL=2
[148293 ms]  <<<  URB 292 coming back  <<< 
-- URB_FUNCTION_BULK_OR_INTERRUPT_TRANSFER:
  PipeHandle           = 858ccfbc [endpoint 0x00000002]
  TransferFlags        = 00000002 (USBD_TRANSFER_DIRECTION_OUT, USBD_SHORT_TRANSFER_OK)
  TransferBufferLength = 00000012
  TransferBuffer       = 00000000
  TransferBufferMDL    = 859babf0
  UrbLink              = 00000000
[148293 ms] UsbSnoop - FilterDispatchAny(a95c1fd2) : IRP_MJ_INTERNAL_DEVICE_CONTROL
[148293 ms] UsbSnoop - FdoHookDispatchInternalIoctl(a95c21ea) : fdo=868c0de8, Irp=86ab43e0, IRQL=0
[148293 ms]  >>>  URB 293 going down  >>> 
-- URB_FUNCTION_BULK_OR_INTERRUPT_TRANSFER:
  PipeHandle           = 858ccf9c [endpoint 0x00000081]
  TransferFlags        = 00000003 (USBD_TRANSFER_DIRECTION_IN, USBD_SHORT_TRANSFER_OK)
  TransferBufferLength = 00000200
  TransferBuffer       = 00000000
  TransferBufferMDL    = 85df6838
  UrbLink              = 00000000
[148293 ms] UsbSnoop - FilterDispatchAny(a95c1fd2) : IRP_MJ_INTERNAL_DEVICE_CONTROL
[148293 ms] UsbSnoop - FdoHookDispatchInternalIoctl(a95c21ea) : fdo=868c0de8, Irp=868d0390, IRQL=0
[148293 ms]  >>>  URB 294 going down  >>> 
-- URB_FUNCTION_BULK_OR_INTERRUPT_TRANSFER:
  PipeHandle           = 858ccfbc [endpoint 0x00000002]
  TransferFlags        = 00000002 (USBD_TRANSFER_DIRECTION_OUT, USBD_SHORT_TRANSFER_OK)
  TransferBufferLength = 00000011
  TransferBuffer       = 00000000
  TransferBufferMDL    = 859babf0
    00000000: 54 fd 64 00 80 16 64 01 40 20 03 00 01 00 51 65
    00000010: 03
  UrbLink              = 00000000
[148294 ms] UsbSnoop - MyInternalIOCTLCompletion(a95c2126) : fido=857e2b00, Irp=868d0390, Context=868cbac8, IRQL=2
[148294 ms]  <<<  URB 294 coming back  <<< 
-- URB_FUNCTION_BULK_OR_INTERRUPT_TRANSFER:
  PipeHandle           = 858ccfbc [endpoint 0x00000002]
  TransferFlags        = 00000002 (USBD_TRANSFER_DIRECTION_OUT, USBD_SHORT_TRANSFER_OK)
  TransferBufferLength = 00000011
  TransferBuffer       = 00000000
  TransferBufferMDL    = 859babf0
  UrbLink              = 00000000
[148296 ms] UsbSnoop - MyInternalIOCTLCompletion(a95c2126) : fido=857e2b00, Irp=86ab43e0, Context=86445700, IRQL=2
[148296 ms]  <<<  URB 293 coming back  <<< 
-- URB_FUNCTION_BULK_OR_INTERRUPT_TRANSFER:
  PipeHandle           = 858ccf9c [endpoint 0x00000081]
  TransferFlags        = 00000003 (USBD_TRANSFER_DIRECTION_IN, USBD_SHORT_TRANSFER_OK)
  TransferBufferLength = 00000012
  TransferBuffer       = 00000000
  TransferBufferMDL    = 85df6838
    00000000: 54 fd 64 01 00 ff 64 00 80 16 20 40 02 0a 51 6c
    00000010: 40 20
  UrbLink              = 00000000
[148296 ms] UsbSnoop - FilterDispatchAny(a95c1fd2) : IRP_MJ_INTERNAL_DEVICE_CONTROL
[148296 ms] UsbSnoop - FdoHookDispatchInternalIoctl(a95c21ea) : fdo=868c0de8, Irp=86a04e48, IRQL=0
[148297 ms]  >>>  URB 295 going down  >>> 
-- URB_FUNCTION_BULK_OR_INTERRUPT_TRANSFER:
  PipeHandle           = 858ccf9c [endpoint 0x00000081]
  TransferFlags        = 00000003 (USBD_TRANSFER_DIRECTION_IN, USBD_SHORT_TRANSFER_OK)
  TransferBufferLength = 00000200
  TransferBuffer       = 00000000
  TransferBufferMDL    = 85eb1360
  UrbLink              = 00000000
[148300 ms] UsbSnoop - MyInternalIOCTLCompletion(a95c2126) : fido=857e2b00, Irp=86a04e48, Context=86445700, IRQL=2
[148300 ms]  <<<  URB 295 coming back  <<< 
-- URB_FUNCTION_BULK_OR_INTERRUPT_TRANSFER:
  PipeHandle           = 858ccf9c [endpoint 0x00000081]
  TransferFlags        = 00000003 (USBD_TRANSFER_DIRECTION_IN, USBD_SHORT_TRANSFER_OK)
  TransferBufferLength = 0000001b
  TransferBuffer       = 00000000
  TransferBufferMDL    = 85eb1360
    00000000: 54 fd 64 01 40 20 64 00 80 16 96 7f 0b 00 3d 6d
    00000010: 03 2e 74 6e 73 00 2e 74 6e 6f 00
  UrbLink              = 00000000
[148300 ms] UsbSnoop - FilterDispatchAny(a95c1fd2) : IRP_MJ_INTERNAL_DEVICE_CONTROL
[148300 ms] UsbSnoop - FdoHookDispatchInternalIoctl(a95c21ea) : fdo=868c0de8, Irp=86a04e48, IRQL=0
[148300 ms]  >>>  URB 296 going down  >>> 
-- URB_FUNCTION_BULK_OR_INTERRUPT_TRANSFER:
  PipeHandle           = 858ccfbc [endpoint 0x00000002]
  TransferFlags        = 00000002 (USBD_TRANSFER_DIRECTION_OUT, USBD_SHORT_TRANSFER_OK)
  TransferBufferLength = 00000012
  TransferBuffer       = 00000000
  TransferBufferMDL    = 85eb1360
    00000000: 54 fd 64 00 00 ff 64 01 40 20 16 80 02 0a 3d 58
    00000010: 80 16
  UrbLink              = 00000000
[148301 ms] UsbSnoop - MyInternalIOCTLCompletion(a95c2126) : fido=857e2b00, Irp=86a04e48, Context=86445700, IRQL=2
[148301 ms]  <<<  URB 296 coming back  <<< 
-- URB_FUNCTION_BULK_OR_INTERRUPT_TRANSFER:
  PipeHandle           = 858ccfbc [endpoint 0x00000002]
  TransferFlags        = 00000002 (USBD_TRANSFER_DIRECTION_OUT, USBD_SHORT_TRANSFER_OK)
  TransferBufferLength = 00000012
  TransferBuffer       = 00000000
  TransferBufferMDL    = 85eb1360
  UrbLink              = 00000000
[148301 ms] UsbSnoop - FilterDispatchAny(a95c1fd2) : IRP_MJ_INTERNAL_DEVICE_CONTROL
[148301 ms] UsbSnoop - FdoHookDispatchInternalIoctl(a95c21ea) : fdo=868c0de8, Irp=86a04e48, IRQL=0
[148301 ms]  >>>  URB 297 going down  >>> 
-- URB_FUNCTION_BULK_OR_INTERRUPT_TRANSFER:
  PipeHandle           = 858ccf9c [endpoint 0x00000081]
  TransferFlags        = 00000003 (USBD_TRANSFER_DIRECTION_IN, USBD_SHORT_TRANSFER_OK)
  TransferBufferLength = 00000200
  TransferBuffer       = 00000000
  TransferBufferMDL    = 85eb1360
  UrbLink              = 00000000
[148301 ms] UsbSnoop - FilterDispatchAny(a95c1fd2) : IRP_MJ_INTERNAL_DEVICE_CONTROL
[148301 ms] UsbSnoop - FdoHookDispatchInternalIoctl(a95c21ea) : fdo=868c0de8, Irp=85745e48, IRQL=0
[148301 ms]  >>>  URB 298 going down  >>> 
-- URB_FUNCTION_BULK_OR_INTERRUPT_TRANSFER:
  PipeHandle           = 858ccfbc [endpoint 0x00000002]
  TransferFlags        = 00000002 (USBD_TRANSFER_DIRECTION_OUT, USBD_SHORT_TRANSFER_OK)
  TransferBufferLength = 00000012
  TransferBuffer       = 00000000
  TransferBufferMDL    = 8562bd38
    00000000: 54 fd 64 00 40 de 64 01 40 20 16 80 02 00 52 82
    00000010: 80 16
  UrbLink              = 00000000
[148302 ms] UsbSnoop - MyInternalIOCTLCompletion(a95c2126) : fido=857e2b00, Irp=85745e48, Context=868cbac8, IRQL=2
[148302 ms]  <<<  URB 298 coming back  <<< 
-- URB_FUNCTION_BULK_OR_INTERRUPT_TRANSFER:
  PipeHandle           = 858ccfbc [endpoint 0x00000002]
  TransferFlags        = 00000002 (USBD_TRANSFER_DIRECTION_OUT, USBD_SHORT_TRANSFER_OK)
  TransferBufferLength = 00000012
  TransferBuffer       = 00000000
  TransferBufferMDL    = 8562bd38
  UrbLink              = 00000000
[148304 ms] UsbSnoop - MyInternalIOCTLCompletion(a95c2126) : fido=857e2b00, Irp=86a04e48, Context=86445700, IRQL=2
[148304 ms]  <<<  URB 297 coming back  <<< 
-- URB_FUNCTION_BULK_OR_INTERRUPT_TRANSFER:
  PipeHandle           = 858ccf9c [endpoint 0x00000081]
  TransferFlags        = 00000003 (USBD_TRANSFER_DIRECTION_IN, USBD_SHORT_TRANSFER_OK)
  TransferBufferLength = 00000012
  TransferBuffer       = 00000000
  TransferBufferMDL    = 85eb1360
    00000000: 54 fd 64 01 00 ff 64 00 80 16 20 40 02 0a 52 6d
    00000010: 40 20
  UrbLink              = 00000000
[148304 ms] UsbSnoop - FilterDispatchAny(a95c1fd2) : IRP_MJ_INTERNAL_DEVICE_CONTROL
[148304 ms] UsbSnoop - FdoHookDispatchInternalIoctl(a95c21ea) : fdo=868c0de8, Irp=86a04e48, IRQL=0
[148304 ms]  >>>  URB 299 going down  >>> 
-- URB_FUNCTION_BULK_OR_INTERRUPT_TRANSFER:
  PipeHandle           = 858ccf9c [endpoint 0x00000081]
  TransferFlags        = 00000003 (USBD_TRANSFER_DIRECTION_IN, USBD_SHORT_TRANSFER_OK)
  TransferBufferLength = 00000200
  TransferBuffer       = 00000000
  TransferBufferMDL    = 85eb1360
  UrbLink              = 00000000
[148306 ms] UsbSnoop - FilterDispatchAny(a95c1fd2) : IRP_MJ_INTERNAL_DEVICE_CONTROL
[148306 ms] UsbSnoop - FdoHookDispatchInternalIoctl(a95c21ea) : fdo=868c0de8, Irp=85745e48, IRQL=0
[148306 ms]  >>>  URB 300 going down  >>> 
-- URB_FUNCTION_BULK_OR_INTERRUPT_TRANSFER:
  PipeHandle           = 858ccfbc [endpoint 0x00000002]
  TransferFlags        = 00000002 (USBD_TRANSFER_DIRECTION_OUT, USBD_SHORT_TRANSFER_OK)
  TransferBufferLength = 00000012
  TransferBuffer       = 00000000
  TransferBufferMDL    = 8562bd38
    00000000: 54 fd 64 00 40 de 64 01 40 20 15 80 02 00 53 82
    00000010: 80 15
  UrbLink              = 00000000
[148307 ms] UsbSnoop - MyInternalIOCTLCompletion(a95c2126) : fido=857e2b00, Irp=85745e48, Context=868cbac8, IRQL=2
[148307 ms]  <<<  URB 300 coming back  <<< 
-- URB_FUNCTION_BULK_OR_INTERRUPT_TRANSFER:
  PipeHandle           = 858ccfbc [endpoint 0x00000002]
  TransferFlags        = 00000002 (USBD_TRANSFER_DIRECTION_OUT, USBD_SHORT_TRANSFER_OK)
  TransferBufferLength = 00000012
  TransferBuffer       = 00000000
  TransferBufferMDL    = 8562bd38
  UrbLink              = 00000000
[148308 ms] UsbSnoop - MyInternalIOCTLCompletion(a95c2126) : fido=857e2b00, Irp=86a04e48, Context=86445700, IRQL=2
[148308 ms]  <<<  URB 299 coming back  <<< 
-- URB_FUNCTION_BULK_OR_INTERRUPT_TRANSFER:
  PipeHandle           = 858ccf9c [endpoint 0x00000081]
  TransferFlags        = 00000003 (USBD_TRANSFER_DIRECTION_IN, USBD_SHORT_TRANSFER_OK)
  TransferBufferLength = 00000012
  TransferBuffer       = 00000000
  TransferBufferMDL    = 85eb1360
    00000000: 54 fd 64 01 00 ff 64 00 80 15 20 40 02 0a 53 6d
    00000010: 40 20
  UrbLink              = 00000000
[148308 ms] UsbSnoop - FilterDispatchAny(a95c1fd2) : IRP_MJ_INTERNAL_DEVICE_CONTROL
[148308 ms] UsbSnoop - FdoHookDispatchInternalIoctl(a95c21ea) : fdo=868c0de8, Irp=86a04e48, IRQL=0
[148308 ms]  >>>  URB 301 going down  >>> 
-- URB_FUNCTION_BULK_OR_INTERRUPT_TRANSFER:
  PipeHandle           = 858ccf9c [endpoint 0x00000081]
  TransferFlags        = 00000003 (USBD_TRANSFER_DIRECTION_IN, USBD_SHORT_TRANSFER_OK)
  TransferBufferLength = 00000200
  TransferBuffer       = 00000000
  TransferBufferMDL    = 85eb1360
  UrbLink              = 00000000
[148315 ms] UsbSnoop - FilterDispatchAny(a95c1fd2) : IRP_MJ_INTERNAL_DEVICE_CONTROL
[148315 ms] UsbSnoop - FdoHookDispatchInternalIoctl(a95c21ea) : fdo=868c0de8, Irp=868a56e0, IRQL=0
[148315 ms]  >>>  URB 302 going down  >>> 
-- URB_FUNCTION_BULK_OR_INTERRUPT_TRANSFER:
  PipeHandle           = 858ccfbc [endpoint 0x00000002]
  TransferFlags        = 00000002 (USBD_TRANSFER_DIRECTION_OUT, USBD_SHORT_TRANSFER_OK)
  TransferBufferLength = 0000001e
  TransferBuffer       = 00000000
  TransferBufferMDL    = 85b848f8
    00000000: 54 fd 64 00 80 17 64 01 40 60 5e f1 0e 00 54 02
    00000010: 20 01 2f 31 32 33 34 35 36 37 38 39 30 00
  UrbLink              = 00000000
[148315 ms] UsbSnoop - MyInternalIOCTLCompletion(a95c2126) : fido=857e2b00, Irp=868a56e0, Context=868cbac8, IRQL=2
[148315 ms]  <<<  URB 302 coming back  <<< 
-- URB_FUNCTION_BULK_OR_INTERRUPT_TRANSFER:
  PipeHandle           = 858ccfbc [endpoint 0x00000002]
  TransferFlags        = 00000002 (USBD_TRANSFER_DIRECTION_OUT, USBD_SHORT_TRANSFER_OK)
  TransferBufferLength = 0000001e
  TransferBuffer       = 00000000
  TransferBufferMDL    = 85b848f8
  UrbLink              = 00000000
[148316 ms] UsbSnoop - MyInternalIOCTLCompletion(a95c2126) : fido=857e2b00, Irp=86a04e48, Context=86445700, IRQL=2
[148316 ms]  <<<  URB 301 coming back  <<< 
-- URB_FUNCTION_BULK_OR_INTERRUPT_TRANSFER:
  PipeHandle           = 858ccf9c [endpoint 0x00000081]
  TransferFlags        = 00000003 (USBD_TRANSFER_DIRECTION_IN, USBD_SHORT_TRANSFER_OK)
  TransferBufferLength = 00000012
  TransferBuffer       = 00000000
  TransferBufferMDL    = 85eb1360
    00000000: 54 fd 64 01 00 ff 64 00 80 17 60 40 02 0a 54 b0
    00000010: 40 60
  UrbLink              = 00000000
[148316 ms] UsbSnoop - FilterDispatchAny(a95c1fd2) : IRP_MJ_INTERNAL_DEVICE_CONTROL
[148316 ms] UsbSnoop - FdoHookDispatchInternalIoctl(a95c21ea) : fdo=868c0de8, Irp=86ab43e0, IRQL=0
[148316 ms]  >>>  URB 303 going down  >>> 
-- URB_FUNCTION_BULK_OR_INTERRUPT_TRANSFER:
  PipeHandle           = 858ccf9c [endpoint 0x00000081]
  TransferFlags        = 00000003 (USBD_TRANSFER_DIRECTION_IN, USBD_SHORT_TRANSFER_OK)
  TransferBufferLength = 00000200
  TransferBuffer       = 00000000
  TransferBufferMDL    = 86b21c10
  UrbLink              = 00000000
[148332 ms] UsbSnoop - MyInternalIOCTLCompletion(a95c2126) : fido=857e2b00, Irp=86ab43e0, Context=86445700, IRQL=2
[148332 ms]  <<<  URB 303 coming back  <<< 
-- URB_FUNCTION_BULK_OR_INTERRUPT_TRANSFER:
  PipeHandle           = 858ccf9c [endpoint 0x00000081]
  TransferFlags        = 00000003 (USBD_TRANSFER_DIRECTION_IN, USBD_SHORT_TRANSFER_OK)
  TransferBufferLength = 0000001b
  TransferBuffer       = 00000000
  TransferBufferMDL    = 86b21c10
    00000000: 54 fd 64 01 40 60 64 00 80 17 35 3f 0b 00 3e 0e
    00000010: 20 00 00 00 00 00 00 8a d6 01 00
  UrbLink              = 00000000
[148332 ms] UsbSnoop - FilterDispatchAny(a95c1fd2) : IRP_MJ_INTERNAL_DEVICE_CONTROL
[148332 ms] UsbSnoop - FdoHookDispatchInternalIoctl(a95c21ea) : fdo=868c0de8, Irp=86ab43e0, IRQL=0
[148332 ms]  >>>  URB 304 going down  >>> 
-- URB_FUNCTION_BULK_OR_INTERRUPT_TRANSFER:
  PipeHandle           = 858ccfbc [endpoint 0x00000002]
  TransferFlags        = 00000002 (USBD_TRANSFER_DIRECTION_OUT, USBD_SHORT_TRANSFER_OK)
  TransferBufferLength = 00000012
  TransferBuffer       = 00000000
  TransferBufferMDL    = 859d29a0
    00000000: 54 fd 64 00 00 ff 64 01 40 60 17 80 02 0a 3e 9a
    00000010: 80 17
  UrbLink              = 00000000
[148333 ms] UsbSnoop - MyInternalIOCTLCompletion(a95c2126) : fido=857e2b00, Irp=86ab43e0, Context=86445700, IRQL=2
[148333 ms]  <<<  URB 304 coming back  <<< 
-- URB_FUNCTION_BULK_OR_INTERRUPT_TRANSFER:
  PipeHandle           = 858ccfbc [endpoint 0x00000002]
  TransferFlags        = 00000002 (USBD_TRANSFER_DIRECTION_OUT, USBD_SHORT_TRANSFER_OK)
  TransferBufferLength = 00000012
  TransferBuffer       = 00000000
  TransferBufferMDL    = 859d29a0
  UrbLink              = 00000000
[148333 ms] UsbSnoop - FilterDispatchAny(a95c1fd2) : IRP_MJ_INTERNAL_DEVICE_CONTROL
[148333 ms] UsbSnoop - FdoHookDispatchInternalIoctl(a95c21ea) : fdo=868c0de8, Irp=86a04e48, IRQL=0
[148333 ms]  >>>  URB 305 going down  >>> 
-- URB_FUNCTION_BULK_OR_INTERRUPT_TRANSFER:
  PipeHandle           = 858ccf9c [endpoint 0x00000081]
  TransferFlags        = 00000003 (USBD_TRANSFER_DIRECTION_IN, USBD_SHORT_TRANSFER_OK)
  TransferBufferLength = 00000200
  TransferBuffer       = 00000000
  TransferBufferMDL    = 86830f88
  UrbLink              = 00000000
[148334 ms] UsbSnoop - FilterDispatchAny(a95c1fd2) : IRP_MJ_INTERNAL_DEVICE_CONTROL
[148334 ms] UsbSnoop - FdoHookDispatchInternalIoctl(a95c21ea) : fdo=868c0de8, Irp=856de590, IRQL=0
[148335 ms]  >>>  URB 306 going down  >>> 
-- URB_FUNCTION_BULK_OR_INTERRUPT_TRANSFER:
  PipeHandle           = 858ccfbc [endpoint 0x00000002]
  TransferFlags        = 00000002 (USBD_TRANSFER_DIRECTION_OUT, USBD_SHORT_TRANSFER_OK)
  TransferBufferLength = 00000012
  TransferBuffer       = 00000000
  TransferBufferMDL    = 86946c18
    00000000: 54 fd 64 00 40 de 64 01 40 60 17 80 02 00 55 c6
    00000010: 80 17
  UrbLink              = 00000000
[148335 ms] UsbSnoop - MyInternalIOCTLCompletion(a95c2126) : fido=857e2b00, Irp=856de590, Context=868cbac8, IRQL=2
[148335 ms]  <<<  URB 306 coming back  <<< 
-- URB_FUNCTION_BULK_OR_INTERRUPT_TRANSFER:
  PipeHandle           = 858ccfbc [endpoint 0x00000002]
  TransferFlags        = 00000002 (USBD_TRANSFER_DIRECTION_OUT, USBD_SHORT_TRANSFER_OK)
  TransferBufferLength = 00000012
  TransferBuffer       = 00000000
  TransferBufferMDL    = 86946c18
  UrbLink              = 00000000
[148336 ms] UsbSnoop - MyInternalIOCTLCompletion(a95c2126) : fido=857e2b00, Irp=86a04e48, Context=86445700, IRQL=2
[148336 ms]  <<<  URB 305 coming back  <<< 
-- URB_FUNCTION_BULK_OR_INTERRUPT_TRANSFER:
  PipeHandle           = 858ccf9c [endpoint 0x00000081]
  TransferFlags        = 00000003 (USBD_TRANSFER_DIRECTION_IN, USBD_SHORT_TRANSFER_OK)
  TransferBufferLength = 00000012
  TransferBuffer       = 00000000
  TransferBufferMDL    = 86830f88
    00000000: 54 fd 64 01 00 ff 64 00 80 17 60 40 02 0a 55 b1
    00000010: 40 60
  UrbLink              = 00000000
[148336 ms] UsbSnoop - FilterDispatchAny(a95c1fd2) : IRP_MJ_INTERNAL_DEVICE_CONTROL
[148336 ms] UsbSnoop - FdoHookDispatchInternalIoctl(a95c21ea) : fdo=868c0de8, Irp=86a04e48, IRQL=0
[148336 ms]  >>>  URB 307 going down  >>> 
-- URB_FUNCTION_BULK_OR_INTERRUPT_TRANSFER:
  PipeHandle           = 858ccf9c [endpoint 0x00000081]
  TransferFlags        = 00000003 (USBD_TRANSFER_DIRECTION_IN, USBD_SHORT_TRANSFER_OK)
  TransferBufferLength = 00000200
  TransferBuffer       = 00000000
  TransferBufferMDL    = 85dc0f88
  UrbLink              = 00000000
[148340 ms] UsbSnoop - FilterDispatchAny(a95c1fd2) : IRP_MJ_INTERNAL_DEVICE_CONTROL
[148340 ms] UsbSnoop - FdoHookDispatchInternalIoctl(a95c21ea) : fdo=868c0de8, Irp=856de590, IRQL=0
[148340 ms]  >>>  URB 308 going down  >>> 
-- URB_FUNCTION_BULK_OR_INTERRUPT_TRANSFER:
  PipeHandle           = 858ccfbc [endpoint 0x00000002]
  TransferFlags        = 00000002 (USBD_TRANSFER_DIRECTION_OUT, USBD_SHORT_TRANSFER_OK)
  TransferBufferLength = 0000001b
  TransferBuffer       = 00000000
  TransferBufferMDL    = 85a59f60
    00000000: 54 fd 64 00 80 18 64 01 40 60 0c f1 0b 00 56 b0
    00000010: 20 01 2f 00 00 00 00 00 00 00 00
  UrbLink              = 00000000
[148340 ms] UsbSnoop - MyInternalIOCTLCompletion(a95c2126) : fido=857e2b00, Irp=856de590, Context=868cbac8, IRQL=2
[148340 ms]  <<<  URB 308 coming back  <<< 
-- URB_FUNCTION_BULK_OR_INTERRUPT_TRANSFER:
  PipeHandle           = 858ccfbc [endpoint 0x00000002]
  TransferFlags        = 00000002 (USBD_TRANSFER_DIRECTION_OUT, USBD_SHORT_TRANSFER_OK)
  TransferBufferLength = 0000001b
  TransferBuffer       = 00000000
  TransferBufferMDL    = 85a59f60
  UrbLink              = 00000000
[148341 ms] UsbSnoop - MyInternalIOCTLCompletion(a95c2126) : fido=857e2b00, Irp=86a04e48, Context=86445700, IRQL=2
[148341 ms]  <<<  URB 307 coming back  <<< 
-- URB_FUNCTION_BULK_OR_INTERRUPT_TRANSFER:
  PipeHandle           = 858ccf9c [endpoint 0x00000081]
  TransferFlags        = 00000003 (USBD_TRANSFER_DIRECTION_IN, USBD_SHORT_TRANSFER_OK)
  TransferBufferLength = 00000012
  TransferBuffer       = 00000000
  TransferBufferMDL    = 85dc0f88
    00000000: 54 fd 64 01 00 ff 64 00 80 18 60 40 02 0a 56 b3
    00000010: 40 60
  UrbLink              = 00000000
[148341 ms] UsbSnoop - FilterDispatchAny(a95c1fd2) : IRP_MJ_INTERNAL_DEVICE_CONTROL
[148341 ms] UsbSnoop - FdoHookDispatchInternalIoctl(a95c21ea) : fdo=868c0de8, Irp=86a04e48, IRQL=0
[148341 ms]  >>>  URB 309 going down  >>> 
-- URB_FUNCTION_BULK_OR_INTERRUPT_TRANSFER:
  PipeHandle           = 858ccf9c [endpoint 0x00000081]
  TransferFlags        = 00000003 (USBD_TRANSFER_DIRECTION_IN, USBD_SHORT_TRANSFER_OK)
  TransferBufferLength = 00000200
  TransferBuffer       = 00000000
  TransferBufferMDL    = 85745488
  UrbLink              = 00000000
[148357 ms] UsbSnoop - MyInternalIOCTLCompletion(a95c2126) : fido=857e2b00, Irp=86a04e48, Context=86445700, IRQL=2
[148357 ms]  <<<  URB 309 coming back  <<< 
-- URB_FUNCTION_BULK_OR_INTERRUPT_TRANSFER:
  PipeHandle           = 858ccf9c [endpoint 0x00000081]
  TransferFlags        = 00000003 (USBD_TRANSFER_DIRECTION_IN, USBD_SHORT_TRANSFER_OK)
  TransferBufferLength = 0000001b
  TransferBuffer       = 00000000
  TransferBufferMDL    = 85745488
    00000000: 54 fd 64 01 40 60 64 00 80 18 f7 38 0b 00 3f cb
    00000010: 20 00 00 00 00 00 00 00 00 01 00
  UrbLink              = 00000000
[148357 ms] UsbSnoop - FilterDispatchAny(a95c1fd2) : IRP_MJ_INTERNAL_DEVICE_CONTROL
[148357 ms] UsbSnoop - FdoHookDispatchInternalIoctl(a95c21ea) : fdo=868c0de8, Irp=86ab43e0, IRQL=0
[148357 ms]  >>>  URB 310 going down  >>> 
-- URB_FUNCTION_BULK_OR_INTERRUPT_TRANSFER:
  PipeHandle           = 858ccfbc [endpoint 0x00000002]
  TransferFlags        = 00000002 (USBD_TRANSFER_DIRECTION_OUT, USBD_SHORT_TRANSFER_OK)
  TransferBufferLength = 00000012
  TransferBuffer       = 00000000
  TransferBufferMDL    = 85745488
    00000000: 54 fd 64 00 00 ff 64 01 40 60 18 80 02 0a 3f 9c
    00000010: 80 18
  UrbLink              = 00000000
[148358 ms] UsbSnoop - MyInternalIOCTLCompletion(a95c2126) : fido=857e2b00, Irp=86ab43e0, Context=86445700, IRQL=2
[148358 ms]  <<<  URB 310 coming back  <<< 
-- URB_FUNCTION_BULK_OR_INTERRUPT_TRANSFER:
  PipeHandle           = 858ccfbc [endpoint 0x00000002]
  TransferFlags        = 00000002 (USBD_TRANSFER_DIRECTION_OUT, USBD_SHORT_TRANSFER_OK)
  TransferBufferLength = 00000012
  TransferBuffer       = 00000000
  TransferBufferMDL    = 85745488
  UrbLink              = 00000000
[148358 ms] UsbSnoop - FilterDispatchAny(a95c1fd2) : IRP_MJ_INTERNAL_DEVICE_CONTROL
[148358 ms] UsbSnoop - FdoHookDispatchInternalIoctl(a95c21ea) : fdo=868c0de8, Irp=86a04e48, IRQL=0
[148358 ms]  >>>  URB 311 going down  >>> 
-- URB_FUNCTION_BULK_OR_INTERRUPT_TRANSFER:
  PipeHandle           = 858ccf9c [endpoint 0x00000081]
  TransferFlags        = 00000003 (USBD_TRANSFER_DIRECTION_IN, USBD_SHORT_TRANSFER_OK)
  TransferBufferLength = 00000200
  TransferBuffer       = 00000000
  TransferBufferMDL    = 85e360a8
  UrbLink              = 00000000
[148359 ms] UsbSnoop - FilterDispatchAny(a95c1fd2) : IRP_MJ_INTERNAL_DEVICE_CONTROL
[148359 ms] UsbSnoop - FdoHookDispatchInternalIoctl(a95c21ea) : fdo=868c0de8, Irp=86ab43e0, IRQL=0
[148360 ms]  >>>  URB 312 going down  >>> 
-- URB_FUNCTION_BULK_OR_INTERRUPT_TRANSFER:
  PipeHandle           = 858ccfbc [endpoint 0x00000002]
  TransferFlags        = 00000002 (USBD_TRANSFER_DIRECTION_OUT, USBD_SHORT_TRANSFER_OK)
  TransferBufferLength = 00000012
  TransferBuffer       = 00000000
  TransferBufferMDL    = 85745488
    00000000: 54 fd 64 00 40 de 64 01 40 60 18 80 02 00 57 c9
    00000010: 80 18
  UrbLink              = 00000000
[148360 ms] UsbSnoop - MyInternalIOCTLCompletion(a95c2126) : fido=857e2b00, Irp=86ab43e0, Context=868cbac8, IRQL=2
[148360 ms]  <<<  URB 312 coming back  <<< 
-- URB_FUNCTION_BULK_OR_INTERRUPT_TRANSFER:
  PipeHandle           = 858ccfbc [endpoint 0x00000002]
  TransferFlags        = 00000002 (USBD_TRANSFER_DIRECTION_OUT, USBD_SHORT_TRANSFER_OK)
  TransferBufferLength = 00000012
  TransferBuffer       = 00000000
  TransferBufferMDL    = 85745488
  UrbLink              = 00000000
[148361 ms] UsbSnoop - MyInternalIOCTLCompletion(a95c2126) : fido=857e2b00, Irp=86a04e48, Context=86445700, IRQL=2
[148361 ms]  <<<  URB 311 coming back  <<< 
-- URB_FUNCTION_BULK_OR_INTERRUPT_TRANSFER:
  PipeHandle           = 858ccf9c [endpoint 0x00000081]
  TransferFlags        = 00000003 (USBD_TRANSFER_DIRECTION_IN, USBD_SHORT_TRANSFER_OK)
  TransferBufferLength = 00000012
  TransferBuffer       = 00000000
  TransferBufferMDL    = 85e360a8
    00000000: 54 fd 64 01 00 ff 64 00 80 18 60 40 02 0a 57 b4
    00000010: 40 60
  UrbLink              = 00000000
[148361 ms] UsbSnoop - FilterDispatchAny(a95c1fd2) : IRP_MJ_INTERNAL_DEVICE_CONTROL
[148361 ms] UsbSnoop - FdoHookDispatchInternalIoctl(a95c21ea) : fdo=868c0de8, Irp=86ab43e0, IRQL=0
[148361 ms]  >>>  URB 313 going down  >>> 
-- URB_FUNCTION_BULK_OR_INTERRUPT_TRANSFER:
  PipeHandle           = 858ccf9c [endpoint 0x00000081]
  TransferFlags        = 00000003 (USBD_TRANSFER_DIRECTION_IN, USBD_SHORT_TRANSFER_OK)
  TransferBufferLength = 00000200
  TransferBuffer       = 00000000
  TransferBufferMDL    = 85c5f890
  UrbLink              = 00000000
[148365 ms] UsbSnoop - FilterDispatchAny(a95c1fd2) : IRP_MJ_INTERNAL_DEVICE_CONTROL
[148365 ms] UsbSnoop - FdoHookDispatchInternalIoctl(a95c21ea) : fdo=868c0de8, Irp=86a04e48, IRQL=0
[148365 ms]  >>>  URB 314 going down  >>> 
-- URB_FUNCTION_BULK_OR_INTERRUPT_TRANSFER:
  PipeHandle           = 858ccfbc [endpoint 0x00000002]
  TransferFlags        = 00000002 (USBD_TRANSFER_DIRECTION_OUT, USBD_SHORT_TRANSFER_OK)
  TransferBufferLength = 0000001a
  TransferBuffer       = 00000000
  TransferBufferMDL    = 85745488
    00000000: 54 fd 64 00 80 19 64 01 40 60 c0 aa 0a 00 58 1f
    00000010: 0d 2f 00 00 00 00 00 00 00 00
  UrbLink              = 00000000
[148366 ms] UsbSnoop - MyInternalIOCTLCompletion(a95c2126) : fido=857e2b00, Irp=86a04e48, Context=868cbac8, IRQL=2
[148366 ms]  <<<  URB 314 coming back  <<< 
-- URB_FUNCTION_BULK_OR_INTERRUPT_TRANSFER:
  PipeHandle           = 858ccfbc [endpoint 0x00000002]
  TransferFlags        = 00000002 (USBD_TRANSFER_DIRECTION_OUT, USBD_SHORT_TRANSFER_OK)
  TransferBufferLength = 0000001a
  TransferBuffer       = 00000000
  TransferBufferMDL    = 85745488
  UrbLink              = 00000000
[148367 ms] UsbSnoop - MyInternalIOCTLCompletion(a95c2126) : fido=857e2b00, Irp=86ab43e0, Context=86445700, IRQL=2
[148367 ms]  <<<  URB 313 coming back  <<< 
-- URB_FUNCTION_BULK_OR_INTERRUPT_TRANSFER:
  PipeHandle           = 858ccf9c [endpoint 0x00000081]
  TransferFlags        = 00000003 (USBD_TRANSFER_DIRECTION_IN, USBD_SHORT_TRANSFER_OK)
  TransferBufferLength = 00000012
  TransferBuffer       = 00000000
  TransferBufferMDL    = 85c5f890
    00000000: 54 fd 64 01 00 ff 64 00 80 19 60 40 02 0a 58 b6
    00000010: 40 60
  UrbLink              = 00000000
[148367 ms] UsbSnoop - FilterDispatchAny(a95c1fd2) : IRP_MJ_INTERNAL_DEVICE_CONTROL
[148367 ms] UsbSnoop - FdoHookDispatchInternalIoctl(a95c21ea) : fdo=868c0de8, Irp=86ab43e0, IRQL=0
[148367 ms]  >>>  URB 315 going down  >>> 
-- URB_FUNCTION_BULK_OR_INTERRUPT_TRANSFER:
  PipeHandle           = 858ccf9c [endpoint 0x00000081]
  TransferFlags        = 00000003 (USBD_TRANSFER_DIRECTION_IN, USBD_SHORT_TRANSFER_OK)
  TransferBufferLength = 00000200
  TransferBuffer       = 00000000
  TransferBufferMDL    = 85d89a68
  UrbLink              = 00000000
[148381 ms] UsbSnoop - MyInternalIOCTLCompletion(a95c2126) : fido=857e2b00, Irp=86ab43e0, Context=86445700, IRQL=2
[148381 ms]  <<<  URB 315 coming back  <<< 
-- URB_FUNCTION_BULK_OR_INTERRUPT_TRANSFER:
  PipeHandle           = 858ccf9c [endpoint 0x00000081]
  TransferFlags        = 00000003 (USBD_TRANSFER_DIRECTION_IN, USBD_SHORT_TRANSFER_OK)
  TransferBufferLength = 00000012
  TransferBuffer       = 00000000
  TransferBufferMDL    = 85d89a68
    00000000: 54 fd 64 01 40 60 64 00 80 19 00 ff 02 00 40 94
    00000010: ff 00
  UrbLink              = 00000000
[148381 ms] UsbSnoop - FilterDispatchAny(a95c1fd2) : IRP_MJ_INTERNAL_DEVICE_CONTROL
[148381 ms] UsbSnoop - FdoHookDispatchInternalIoctl(a95c21ea) : fdo=868c0de8, Irp=86a04e48, IRQL=0
[148381 ms]  >>>  URB 316 going down  >>> 
-- URB_FUNCTION_BULK_OR_INTERRUPT_TRANSFER:
  PipeHandle           = 858ccfbc [endpoint 0x00000002]
  TransferFlags        = 00000002 (USBD_TRANSFER_DIRECTION_OUT, USBD_SHORT_TRANSFER_OK)
  TransferBufferLength = 00000012
  TransferBuffer       = 00000000
  TransferBufferMDL    = 85e360a8
    00000000: 54 fd 64 00 00 ff 64 01 40 60 19 80 02 0a 40 9e
    00000010: 80 19
  UrbLink              = 00000000
[148382 ms] UsbSnoop - MyInternalIOCTLCompletion(a95c2126) : fido=857e2b00, Irp=86a04e48, Context=86445700, IRQL=2
[148382 ms]  <<<  URB 316 coming back  <<< 
-- URB_FUNCTION_BULK_OR_INTERRUPT_TRANSFER:
  PipeHandle           = 858ccfbc [endpoint 0x00000002]
  TransferFlags        = 00000002 (USBD_TRANSFER_DIRECTION_OUT, USBD_SHORT_TRANSFER_OK)
  TransferBufferLength = 00000012
  TransferBuffer       = 00000000
  TransferBufferMDL    = 85e360a8
  UrbLink              = 00000000
[148382 ms] UsbSnoop - FilterDispatchAny(a95c1fd2) : IRP_MJ_INTERNAL_DEVICE_CONTROL
[148382 ms] UsbSnoop - FdoHookDispatchInternalIoctl(a95c21ea) : fdo=868c0de8, Irp=86ab43e0, IRQL=0
[148382 ms]  >>>  URB 317 going down  >>> 
-- URB_FUNCTION_BULK_OR_INTERRUPT_TRANSFER:
  PipeHandle           = 858ccf9c [endpoint 0x00000081]
  TransferFlags        = 00000003 (USBD_TRANSFER_DIRECTION_IN, USBD_SHORT_TRANSFER_OK)
  TransferBufferLength = 00000200
  TransferBuffer       = 00000000
  TransferBufferMDL    = 85d89a68
  UrbLink              = 00000000
[148382 ms] UsbSnoop - FilterDispatchAny(a95c1fd2) : IRP_MJ_INTERNAL_DEVICE_CONTROL
[148382 ms] UsbSnoop - FdoHookDispatchInternalIoctl(a95c21ea) : fdo=868c0de8, Irp=86a04e48, IRQL=0
[148382 ms]  >>>  URB 318 going down  >>> 
-- URB_FUNCTION_BULK_OR_INTERRUPT_TRANSFER:
  PipeHandle           = 858ccfbc [endpoint 0x00000002]
  TransferFlags        = 00000002 (USBD_TRANSFER_DIRECTION_OUT, USBD_SHORT_TRANSFER_OK)
  TransferBufferLength = 00000011
  TransferBuffer       = 00000000
  TransferBufferMDL    = 85e360a8
    00000000: 54 fd 64 00 80 19 64 01 40 60 0e 00 01 00 59 bb
    00000010: 0e
  UrbLink              = 00000000
[148383 ms] UsbSnoop - MyInternalIOCTLCompletion(a95c2126) : fido=857e2b00, Irp=86a04e48, Context=868cbac8, IRQL=2
[148383 ms]  <<<  URB 318 coming back  <<< 
-- URB_FUNCTION_BULK_OR_INTERRUPT_TRANSFER:
  PipeHandle           = 858ccfbc [endpoint 0x00000002]
  TransferFlags        = 00000002 (USBD_TRANSFER_DIRECTION_OUT, USBD_SHORT_TRANSFER_OK)
  TransferBufferLength = 00000011
  TransferBuffer       = 00000000
  TransferBufferMDL    = 85e360a8
  UrbLink              = 00000000
[148385 ms] UsbSnoop - MyInternalIOCTLCompletion(a95c2126) : fido=857e2b00, Irp=86ab43e0, Context=86445700, IRQL=2
[148385 ms]  <<<  URB 317 coming back  <<< 
-- URB_FUNCTION_BULK_OR_INTERRUPT_TRANSFER:
  PipeHandle           = 858ccf9c [endpoint 0x00000081]
  TransferFlags        = 00000003 (USBD_TRANSFER_DIRECTION_IN, USBD_SHORT_TRANSFER_OK)
  TransferBufferLength = 00000012
  TransferBuffer       = 00000000
  TransferBufferMDL    = 85d89a68
    00000000: 54 fd 64 01 00 ff 64 00 80 19 60 40 02 0a 59 b7
    00000010: 40 60
  UrbLink              = 00000000
[148385 ms] UsbSnoop - FilterDispatchAny(a95c1fd2) : IRP_MJ_INTERNAL_DEVICE_CONTROL
[148385 ms] UsbSnoop - FdoHookDispatchInternalIoctl(a95c21ea) : fdo=868c0de8, Irp=86ab43e0, IRQL=0
[148385 ms]  >>>  URB 319 going down  >>> 
-- URB_FUNCTION_BULK_OR_INTERRUPT_TRANSFER:
  PipeHandle           = 858ccf9c [endpoint 0x00000081]
  TransferFlags        = 00000003 (USBD_TRANSFER_DIRECTION_IN, USBD_SHORT_TRANSFER_OK)
  TransferBufferLength = 00000200
  TransferBuffer       = 00000000
  TransferBufferMDL    = 85d89a68
  UrbLink              = 00000000
[148393 ms] UsbSnoop - MyInternalIOCTLCompletion(a95c2126) : fido=857e2b00, Irp=86ab43e0, Context=86445700, IRQL=2
[148393 ms]  <<<  URB 319 coming back  <<< 
-- URB_FUNCTION_BULK_OR_INTERRUPT_TRANSFER:
  PipeHandle           = 858ccf9c [endpoint 0x00000081]
  TransferFlags        = 00000003 (USBD_TRANSFER_DIRECTION_IN, USBD_SHORT_TRANSFER_OK)
  TransferBufferLength = 00000026
  TransferBuffer       = 00000000
  TransferBufferMDL    = 85d89a68
    00000000: 54 fd 64 01 40 60 64 00 80 19 11 54 16 00 41 0f
    00000010: 10 00 13 45 78 61 6d 70 6c 65 73 00 00 00 00 00
    00000020: 00 00 00 0b 01 00
  UrbLink              = 00000000
[148393 ms] UsbSnoop - FilterDispatchAny(a95c1fd2) : IRP_MJ_INTERNAL_DEVICE_CONTROL
[148393 ms] UsbSnoop - FdoHookDispatchInternalIoctl(a95c21ea) : fdo=868c0de8, Irp=86a04e48, IRQL=0
[148393 ms]  >>>  URB 320 going down  >>> 
-- URB_FUNCTION_BULK_OR_INTERRUPT_TRANSFER:
  PipeHandle           = 858ccfbc [endpoint 0x00000002]
  TransferFlags        = 00000002 (USBD_TRANSFER_DIRECTION_OUT, USBD_SHORT_TRANSFER_OK)
  TransferBufferLength = 00000012
  TransferBuffer       = 00000000
  TransferBufferMDL    = 85e360a8
    00000000: 54 fd 64 00 00 ff 64 01 40 60 19 80 02 0a 41 9f
    00000010: 80 19
  UrbLink              = 00000000
[148394 ms] UsbSnoop - MyInternalIOCTLCompletion(a95c2126) : fido=857e2b00, Irp=86a04e48, Context=86445700, IRQL=2
[148394 ms]  <<<  URB 320 coming back  <<< 
-- URB_FUNCTION_BULK_OR_INTERRUPT_TRANSFER:
  PipeHandle           = 858ccfbc [endpoint 0x00000002]
  TransferFlags        = 00000002 (USBD_TRANSFER_DIRECTION_OUT, USBD_SHORT_TRANSFER_OK)
  TransferBufferLength = 00000012
  TransferBuffer       = 00000000
  TransferBufferMDL    = 85e360a8
  UrbLink              = 00000000
[148394 ms] UsbSnoop - FilterDispatchAny(a95c1fd2) : IRP_MJ_INTERNAL_DEVICE_CONTROL
[148394 ms] UsbSnoop - FdoHookDispatchInternalIoctl(a95c21ea) : fdo=868c0de8, Irp=86ab43e0, IRQL=0
[148394 ms]  >>>  URB 321 going down  >>> 
-- URB_FUNCTION_BULK_OR_INTERRUPT_TRANSFER:
  PipeHandle           = 858ccf9c [endpoint 0x00000081]
  TransferFlags        = 00000003 (USBD_TRANSFER_DIRECTION_IN, USBD_SHORT_TRANSFER_OK)
  TransferBufferLength = 00000200
  TransferBuffer       = 00000000
  TransferBufferMDL    = 85d89a68
  UrbLink              = 00000000
[148395 ms] UsbSnoop - FilterDispatchAny(a95c1fd2) : IRP_MJ_INTERNAL_DEVICE_CONTROL
[148395 ms] UsbSnoop - FdoHookDispatchInternalIoctl(a95c21ea) : fdo=868c0de8, Irp=856de590, IRQL=0
[148395 ms]  >>>  URB 322 going down  >>> 
-- URB_FUNCTION_BULK_OR_INTERRUPT_TRANSFER:
  PipeHandle           = 858ccfbc [endpoint 0x00000002]
  TransferFlags        = 00000002 (USBD_TRANSFER_DIRECTION_OUT, USBD_SHORT_TRANSFER_OK)
  TransferBufferLength = 00000011
  TransferBuffer       = 00000000
  TransferBufferMDL    = 85ddb8d0
    00000000: 54 fd 64 00 80 19 64 01 40 60 0e 00 01 00 5a bc
    00000010: 0e
  UrbLink              = 00000000
[148396 ms] UsbSnoop - MyInternalIOCTLCompletion(a95c2126) : fido=857e2b00, Irp=856de590, Context=868cbac8, IRQL=2
[148396 ms]  <<<  URB 322 coming back  <<< 
-- URB_FUNCTION_BULK_OR_INTERRUPT_TRANSFER:
  PipeHandle           = 858ccfbc [endpoint 0x00000002]
  TransferFlags        = 00000002 (USBD_TRANSFER_DIRECTION_OUT, USBD_SHORT_TRANSFER_OK)
  TransferBufferLength = 00000011
  TransferBuffer       = 00000000
  TransferBufferMDL    = 85ddb8d0
  UrbLink              = 00000000
[148397 ms] UsbSnoop - MyInternalIOCTLCompletion(a95c2126) : fido=857e2b00, Irp=86ab43e0, Context=86445700, IRQL=2
[148397 ms]  <<<  URB 321 coming back  <<< 
-- URB_FUNCTION_BULK_OR_INTERRUPT_TRANSFER:
  PipeHandle           = 858ccf9c [endpoint 0x00000081]
  TransferFlags        = 00000003 (USBD_TRANSFER_DIRECTION_IN, USBD_SHORT_TRANSFER_OK)
  TransferBufferLength = 00000012
  TransferBuffer       = 00000000
  TransferBufferMDL    = 85d89a68
    00000000: 54 fd 64 01 00 ff 64 00 80 19 60 40 02 0a 5a b8
    00000010: 40 60
  UrbLink              = 00000000
[148397 ms] UsbSnoop - FilterDispatchAny(a95c1fd2) : IRP_MJ_INTERNAL_DEVICE_CONTROL
[148397 ms] UsbSnoop - FdoHookDispatchInternalIoctl(a95c21ea) : fdo=868c0de8, Irp=86ab43e0, IRQL=0
[148397 ms]  >>>  URB 323 going down  >>> 
-- URB_FUNCTION_BULK_OR_INTERRUPT_TRANSFER:
  PipeHandle           = 858ccf9c [endpoint 0x00000081]
  TransferFlags        = 00000003 (USBD_TRANSFER_DIRECTION_IN, USBD_SHORT_TRANSFER_OK)
  TransferBufferLength = 00000200
  TransferBuffer       = 00000000
  TransferBufferMDL    = 85d89a68
  UrbLink              = 00000000
[148402 ms] UsbSnoop - MyInternalIOCTLCompletion(a95c2126) : fido=857e2b00, Irp=86ab43e0, Context=86445700, IRQL=2
[148402 ms]  <<<  URB 323 coming back  <<< 
-- URB_FUNCTION_BULK_OR_INTERRUPT_TRANSFER:
  PipeHandle           = 858ccf9c [endpoint 0x00000081]
  TransferFlags        = 00000003 (USBD_TRANSFER_DIRECTION_IN, USBD_SHORT_TRANSFER_OK)
  TransferBufferLength = 00000026
  TransferBuffer       = 00000000
  TransferBufferMDL    = 85d89a68
    00000000: 54 fd 64 01 40 60 64 00 80 19 d1 9b 16 00 42 17
    00000010: 10 00 13 45 78 65 6d 70 6c 65 73 00 00 00 00 00
    00000020: 00 00 00 14 01 00
  UrbLink              = 00000000
[148402 ms] UsbSnoop - FilterDispatchAny(a95c1fd2) : IRP_MJ_INTERNAL_DEVICE_CONTROL
[148402 ms] UsbSnoop - FdoHookDispatchInternalIoctl(a95c21ea) : fdo=868c0de8, Irp=86a04e48, IRQL=0
[148402 ms]  >>>  URB 324 going down  >>> 
-- URB_FUNCTION_BULK_OR_INTERRUPT_TRANSFER:
  PipeHandle           = 858ccfbc [endpoint 0x00000002]
  TransferFlags        = 00000002 (USBD_TRANSFER_DIRECTION_OUT, USBD_SHORT_TRANSFER_OK)
  TransferBufferLength = 00000012
  TransferBuffer       = 00000000
  TransferBufferMDL    = 85e360a8
    00000000: 54 fd 64 00 00 ff 64 01 40 60 19 80 02 0a 42 a0
    00000010: 80 19
  UrbLink              = 00000000
[148403 ms] UsbSnoop - MyInternalIOCTLCompletion(a95c2126) : fido=857e2b00, Irp=86a04e48, Context=86445700, IRQL=2
[148403 ms]  <<<  URB 324 coming back  <<< 
-- URB_FUNCTION_BULK_OR_INTERRUPT_TRANSFER:
  PipeHandle           = 858ccfbc [endpoint 0x00000002]
  TransferFlags        = 00000002 (USBD_TRANSFER_DIRECTION_OUT, USBD_SHORT_TRANSFER_OK)
  TransferBufferLength = 00000012
  TransferBuffer       = 00000000
  TransferBufferMDL    = 85e360a8
  UrbLink              = 00000000
[148403 ms] UsbSnoop - FilterDispatchAny(a95c1fd2) : IRP_MJ_INTERNAL_DEVICE_CONTROL
[148403 ms] UsbSnoop - FdoHookDispatchInternalIoctl(a95c21ea) : fdo=868c0de8, Irp=86ab43e0, IRQL=0
[148403 ms]  >>>  URB 325 going down  >>> 
-- URB_FUNCTION_BULK_OR_INTERRUPT_TRANSFER:
  PipeHandle           = 858ccf9c [endpoint 0x00000081]
  TransferFlags        = 00000003 (USBD_TRANSFER_DIRECTION_IN, USBD_SHORT_TRANSFER_OK)
  TransferBufferLength = 00000200
  TransferBuffer       = 00000000
  TransferBufferMDL    = 85d89a68
  UrbLink              = 00000000
[148404 ms] UsbSnoop - FilterDispatchAny(a95c1fd2) : IRP_MJ_INTERNAL_DEVICE_CONTROL
[148404 ms] UsbSnoop - FdoHookDispatchInternalIoctl(a95c21ea) : fdo=868c0de8, Irp=856de590, IRQL=0
[148404 ms]  >>>  URB 326 going down  >>> 
-- URB_FUNCTION_BULK_OR_INTERRUPT_TRANSFER:
  PipeHandle           = 858ccfbc [endpoint 0x00000002]
  TransferFlags        = 00000002 (USBD_TRANSFER_DIRECTION_OUT, USBD_SHORT_TRANSFER_OK)
  TransferBufferLength = 00000011
  TransferBuffer       = 00000000
  TransferBufferMDL    = 85ddb8d0
    00000000: 54 fd 64 00 80 19 64 01 40 60 0e 00 01 00 5b bd
    00000010: 0e
  UrbLink              = 00000000
[148405 ms] UsbSnoop - MyInternalIOCTLCompletion(a95c2126) : fido=857e2b00, Irp=856de590, Context=868cbac8, IRQL=2
[148405 ms]  <<<  URB 326 coming back  <<< 
-- URB_FUNCTION_BULK_OR_INTERRUPT_TRANSFER:
  PipeHandle           = 858ccfbc [endpoint 0x00000002]
  TransferFlags        = 00000002 (USBD_TRANSFER_DIRECTION_OUT, USBD_SHORT_TRANSFER_OK)
  TransferBufferLength = 00000011
  TransferBuffer       = 00000000
  TransferBufferMDL    = 85ddb8d0
  UrbLink              = 00000000
[148406 ms] UsbSnoop - MyInternalIOCTLCompletion(a95c2126) : fido=857e2b00, Irp=86ab43e0, Context=86445700, IRQL=2
[148406 ms]  <<<  URB 325 coming back  <<< 
-- URB_FUNCTION_BULK_OR_INTERRUPT_TRANSFER:
  PipeHandle           = 858ccf9c [endpoint 0x00000081]
  TransferFlags        = 00000003 (USBD_TRANSFER_DIRECTION_IN, USBD_SHORT_TRANSFER_OK)
  TransferBufferLength = 00000012
  TransferBuffer       = 00000000
  TransferBufferMDL    = 85d89a68
    00000000: 54 fd 64 01 00 ff 64 00 80 19 60 40 02 0a 5b b9
    00000010: 40 60
  UrbLink              = 00000000
[148406 ms] UsbSnoop - FilterDispatchAny(a95c1fd2) : IRP_MJ_INTERNAL_DEVICE_CONTROL
[148406 ms] UsbSnoop - FdoHookDispatchInternalIoctl(a95c21ea) : fdo=868c0de8, Irp=86ab43e0, IRQL=0
[148406 ms]  >>>  URB 327 going down  >>> 
-- URB_FUNCTION_BULK_OR_INTERRUPT_TRANSFER:
  PipeHandle           = 858ccf9c [endpoint 0x00000081]
  TransferFlags        = 00000003 (USBD_TRANSFER_DIRECTION_IN, USBD_SHORT_TRANSFER_OK)
  TransferBufferLength = 00000200
  TransferBuffer       = 00000000
  TransferBufferMDL    = 85d89a68
  UrbLink              = 00000000
[148411 ms] UsbSnoop - MyInternalIOCTLCompletion(a95c2126) : fido=857e2b00, Irp=86ab43e0, Context=86445700, IRQL=2
[148411 ms]  <<<  URB 327 coming back  <<< 
-- URB_FUNCTION_BULK_OR_INTERRUPT_TRANSFER:
  PipeHandle           = 858ccf9c [endpoint 0x00000081]
  TransferFlags        = 00000003 (USBD_TRANSFER_DIRECTION_IN, USBD_SHORT_TRANSFER_OK)
  TransferBufferLength = 00000026
  TransferBuffer       = 00000000
  TransferBufferMDL    = 85d89a68
    00000000: 54 fd 64 01 40 60 64 00 80 19 6b c3 16 00 43 da
    00000010: 10 00 13 4e 6f 6d 62 72 65 73 00 00 00 00 00 00
    00000020: 00 00 00 1c 01 00
  UrbLink              = 00000000
[148411 ms] UsbSnoop - FilterDispatchAny(a95c1fd2) : IRP_MJ_INTERNAL_DEVICE_CONTROL
[148411 ms] UsbSnoop - FdoHookDispatchInternalIoctl(a95c21ea) : fdo=868c0de8, Irp=86a04e48, IRQL=0
[148411 ms]  >>>  URB 328 going down  >>> 
-- URB_FUNCTION_BULK_OR_INTERRUPT_TRANSFER:
  PipeHandle           = 858ccfbc [endpoint 0x00000002]
  TransferFlags        = 00000002 (USBD_TRANSFER_DIRECTION_OUT, USBD_SHORT_TRANSFER_OK)
  TransferBufferLength = 00000012
  TransferBuffer       = 00000000
  TransferBufferMDL    = 85e360a8
    00000000: 54 fd 64 00 00 ff 64 01 40 60 19 80 02 0a 43 a1
    00000010: 80 19
  UrbLink              = 00000000
[148412 ms] UsbSnoop - MyInternalIOCTLCompletion(a95c2126) : fido=857e2b00, Irp=86a04e48, Context=86445700, IRQL=2
[148412 ms]  <<<  URB 328 coming back  <<< 
-- URB_FUNCTION_BULK_OR_INTERRUPT_TRANSFER:
  PipeHandle           = 858ccfbc [endpoint 0x00000002]
  TransferFlags        = 00000002 (USBD_TRANSFER_DIRECTION_OUT, USBD_SHORT_TRANSFER_OK)
  TransferBufferLength = 00000012
  TransferBuffer       = 00000000
  TransferBufferMDL    = 85e360a8
  UrbLink              = 00000000
[148412 ms] UsbSnoop - FilterDispatchAny(a95c1fd2) : IRP_MJ_INTERNAL_DEVICE_CONTROL
[148412 ms] UsbSnoop - FdoHookDispatchInternalIoctl(a95c21ea) : fdo=868c0de8, Irp=86ab43e0, IRQL=0
[148412 ms]  >>>  URB 329 going down  >>> 
-- URB_FUNCTION_BULK_OR_INTERRUPT_TRANSFER:
  PipeHandle           = 858ccf9c [endpoint 0x00000081]
  TransferFlags        = 00000003 (USBD_TRANSFER_DIRECTION_IN, USBD_SHORT_TRANSFER_OK)
  TransferBufferLength = 00000200
  TransferBuffer       = 00000000
  TransferBufferMDL    = 85d89a68
  UrbLink              = 00000000
[148413 ms] UsbSnoop - FilterDispatchAny(a95c1fd2) : IRP_MJ_INTERNAL_DEVICE_CONTROL
[148413 ms] UsbSnoop - FdoHookDispatchInternalIoctl(a95c21ea) : fdo=868c0de8, Irp=856de590, IRQL=0
[148413 ms]  >>>  URB 330 going down  >>> 
-- URB_FUNCTION_BULK_OR_INTERRUPT_TRANSFER:
  PipeHandle           = 858ccfbc [endpoint 0x00000002]
  TransferFlags        = 00000002 (USBD_TRANSFER_DIRECTION_OUT, USBD_SHORT_TRANSFER_OK)
  TransferBufferLength = 00000011
  TransferBuffer       = 00000000
  TransferBufferMDL    = 85ddb8d0
    00000000: 54 fd 64 00 80 19 64 01 40 60 0e 00 01 00 5c be
    00000010: 0e
  UrbLink              = 00000000
[148414 ms] UsbSnoop - MyInternalIOCTLCompletion(a95c2126) : fido=857e2b00, Irp=856de590, Context=868cbac8, IRQL=2
[148414 ms]  <<<  URB 330 coming back  <<< 
-- URB_FUNCTION_BULK_OR_INTERRUPT_TRANSFER:
  PipeHandle           = 858ccfbc [endpoint 0x00000002]
  TransferFlags        = 00000002 (USBD_TRANSFER_DIRECTION_OUT, USBD_SHORT_TRANSFER_OK)
  TransferBufferLength = 00000011
  TransferBuffer       = 00000000
  TransferBufferMDL    = 85ddb8d0
  UrbLink              = 00000000
[148416 ms] UsbSnoop - MyInternalIOCTLCompletion(a95c2126) : fido=857e2b00, Irp=86ab43e0, Context=86445700, IRQL=2
[148416 ms]  <<<  URB 329 coming back  <<< 
-- URB_FUNCTION_BULK_OR_INTERRUPT_TRANSFER:
  PipeHandle           = 858ccf9c [endpoint 0x00000081]
  TransferFlags        = 00000003 (USBD_TRANSFER_DIRECTION_IN, USBD_SHORT_TRANSFER_OK)
  TransferBufferLength = 00000012
  TransferBuffer       = 00000000
  TransferBufferMDL    = 85d89a68
    00000000: 54 fd 64 01 00 ff 64 00 80 19 60 40 02 0a 5c ba
    00000010: 40 60
  UrbLink              = 00000000
[148416 ms] UsbSnoop - FilterDispatchAny(a95c1fd2) : IRP_MJ_INTERNAL_DEVICE_CONTROL
[148416 ms] UsbSnoop - FdoHookDispatchInternalIoctl(a95c21ea) : fdo=868c0de8, Irp=86ab43e0, IRQL=0
[148416 ms]  >>>  URB 331 going down  >>> 
-- URB_FUNCTION_BULK_OR_INTERRUPT_TRANSFER:
  PipeHandle           = 858ccf9c [endpoint 0x00000081]
  TransferFlags        = 00000003 (USBD_TRANSFER_DIRECTION_IN, USBD_SHORT_TRANSFER_OK)
  TransferBufferLength = 00000200
  TransferBuffer       = 00000000
  TransferBufferMDL    = 85d89a68
  UrbLink              = 00000000
[148419 ms] UsbSnoop - MyInternalIOCTLCompletion(a95c2126) : fido=857e2b00, Irp=86ab43e0, Context=86445700, IRQL=2
[148419 ms]  <<<  URB 331 coming back  <<< 
-- URB_FUNCTION_BULK_OR_INTERRUPT_TRANSFER:
  PipeHandle           = 858ccf9c [endpoint 0x00000081]
  TransferFlags        = 00000003 (USBD_TRANSFER_DIRECTION_IN, USBD_SHORT_TRANSFER_OK)
  TransferBufferLength = 00000028
  TransferBuffer       = 00000000
  TransferBufferMDL    = 85d89a68
    00000000: 54 fd 64 01 40 60 64 00 80 19 03 27 18 00 44 d9
    00000010: 10 00 15 31 32 33 34 35 36 37 38 39 30 00 00 00
    00000020: 00 00 00 00 8a d6 01 00
  UrbLink              = 00000000
[148419 ms] UsbSnoop - FilterDispatchAny(a95c1fd2) : IRP_MJ_INTERNAL_DEVICE_CONTROL
[148419 ms] UsbSnoop - FdoHookDispatchInternalIoctl(a95c21ea) : fdo=868c0de8, Irp=86a04e48, IRQL=0
[148419 ms]  >>>  URB 332 going down  >>> 
-- URB_FUNCTION_BULK_OR_INTERRUPT_TRANSFER:
  PipeHandle           = 858ccfbc [endpoint 0x00000002]
  TransferFlags        = 00000002 (USBD_TRANSFER_DIRECTION_OUT, USBD_SHORT_TRANSFER_OK)
  TransferBufferLength = 00000012
  TransferBuffer       = 00000000
  TransferBufferMDL    = 85e360a8
    00000000: 54 fd 64 00 00 ff 64 01 40 60 19 80 02 0a 44 a2
    00000010: 80 19
  UrbLink              = 00000000
[148420 ms] UsbSnoop - MyInternalIOCTLCompletion(a95c2126) : fido=857e2b00, Irp=86a04e48, Context=86445700, IRQL=2
[148420 ms]  <<<  URB 332 coming back  <<< 
-- URB_FUNCTION_BULK_OR_INTERRUPT_TRANSFER:
  PipeHandle           = 858ccfbc [endpoint 0x00000002]
  TransferFlags        = 00000002 (USBD_TRANSFER_DIRECTION_OUT, USBD_SHORT_TRANSFER_OK)
  TransferBufferLength = 00000012
  TransferBuffer       = 00000000
  TransferBufferMDL    = 85e360a8
  UrbLink              = 00000000
[148420 ms] UsbSnoop - FilterDispatchAny(a95c1fd2) : IRP_MJ_INTERNAL_DEVICE_CONTROL
[148420 ms] UsbSnoop - FdoHookDispatchInternalIoctl(a95c21ea) : fdo=868c0de8, Irp=86ab43e0, IRQL=0
[148420 ms]  >>>  URB 333 going down  >>> 
-- URB_FUNCTION_BULK_OR_INTERRUPT_TRANSFER:
  PipeHandle           = 858ccf9c [endpoint 0x00000081]
  TransferFlags        = 00000003 (USBD_TRANSFER_DIRECTION_IN, USBD_SHORT_TRANSFER_OK)
  TransferBufferLength = 00000200
  TransferBuffer       = 00000000
  TransferBufferMDL    = 85d89a68
  UrbLink              = 00000000
[148421 ms] UsbSnoop - FilterDispatchAny(a95c1fd2) : IRP_MJ_INTERNAL_DEVICE_CONTROL
[148421 ms] UsbSnoop - FdoHookDispatchInternalIoctl(a95c21ea) : fdo=868c0de8, Irp=856de590, IRQL=0
[148421 ms]  >>>  URB 334 going down  >>> 
-- URB_FUNCTION_BULK_OR_INTERRUPT_TRANSFER:
  PipeHandle           = 858ccfbc [endpoint 0x00000002]
  TransferFlags        = 00000002 (USBD_TRANSFER_DIRECTION_OUT, USBD_SHORT_TRANSFER_OK)
  TransferBufferLength = 00000011
  TransferBuffer       = 00000000
  TransferBufferMDL    = 85ddb8d0
    00000000: 54 fd 64 00 80 19 64 01 40 60 0e 00 01 00 5d bf
    00000010: 0e
  UrbLink              = 00000000
[148422 ms] UsbSnoop - MyInternalIOCTLCompletion(a95c2126) : fido=857e2b00, Irp=856de590, Context=868cbac8, IRQL=2
[148422 ms]  <<<  URB 334 coming back  <<< 
-- URB_FUNCTION_BULK_OR_INTERRUPT_TRANSFER:
  PipeHandle           = 858ccfbc [endpoint 0x00000002]
  TransferFlags        = 00000002 (USBD_TRANSFER_DIRECTION_OUT, USBD_SHORT_TRANSFER_OK)
  TransferBufferLength = 00000011
  TransferBuffer       = 00000000
  TransferBufferMDL    = 85ddb8d0
  UrbLink              = 00000000
[148423 ms] UsbSnoop - MyInternalIOCTLCompletion(a95c2126) : fido=857e2b00, Irp=86ab43e0, Context=86445700, IRQL=2
[148423 ms]  <<<  URB 333 coming back  <<< 
-- URB_FUNCTION_BULK_OR_INTERRUPT_TRANSFER:
  PipeHandle           = 858ccf9c [endpoint 0x00000081]
  TransferFlags        = 00000003 (USBD_TRANSFER_DIRECTION_IN, USBD_SHORT_TRANSFER_OK)
  TransferBufferLength = 00000012
  TransferBuffer       = 00000000
  TransferBufferMDL    = 85d89a68
    00000000: 54 fd 64 01 00 ff 64 00 80 19 60 40 02 0a 5d bb
    00000010: 40 60
  UrbLink              = 00000000
[148423 ms] UsbSnoop - FilterDispatchAny(a95c1fd2) : IRP_MJ_INTERNAL_DEVICE_CONTROL
[148423 ms] UsbSnoop - FdoHookDispatchInternalIoctl(a95c21ea) : fdo=868c0de8, Irp=86ab43e0, IRQL=0
[148423 ms]  >>>  URB 335 going down  >>> 
-- URB_FUNCTION_BULK_OR_INTERRUPT_TRANSFER:
  PipeHandle           = 858ccf9c [endpoint 0x00000081]
  TransferFlags        = 00000003 (USBD_TRANSFER_DIRECTION_IN, USBD_SHORT_TRANSFER_OK)
  TransferBufferLength = 00000200
  TransferBuffer       = 00000000
  TransferBufferMDL    = 85d89a68
  UrbLink              = 00000000
[148426 ms] UsbSnoop - MyInternalIOCTLCompletion(a95c2126) : fido=857e2b00, Irp=86ab43e0, Context=86445700, IRQL=2
[148426 ms]  <<<  URB 335 coming back  <<< 
-- URB_FUNCTION_BULK_OR_INTERRUPT_TRANSFER:
  PipeHandle           = 858ccf9c [endpoint 0x00000081]
  TransferFlags        = 00000003 (USBD_TRANSFER_DIRECTION_IN, USBD_SHORT_TRANSFER_OK)
  TransferBufferLength = 00000012
  TransferBuffer       = 00000000
  TransferBufferMDL    = 85d89a68
    00000000: 54 fd 64 01 40 60 64 00 80 19 11 ff 02 00 45 aa
    00000010: ff 11
  UrbLink              = 00000000
[148426 ms] UsbSnoop - FilterDispatchAny(a95c1fd2) : IRP_MJ_INTERNAL_DEVICE_CONTROL
[148426 ms] UsbSnoop - FdoHookDispatchInternalIoctl(a95c21ea) : fdo=868c0de8, Irp=86a04e48, IRQL=0
[148426 ms]  >>>  URB 336 going down  >>> 
-- URB_FUNCTION_BULK_OR_INTERRUPT_TRANSFER:
  PipeHandle           = 858ccfbc [endpoint 0x00000002]
  TransferFlags        = 00000002 (USBD_TRANSFER_DIRECTION_OUT, USBD_SHORT_TRANSFER_OK)
  TransferBufferLength = 00000012
  TransferBuffer       = 00000000
  TransferBufferMDL    = 85e360a8
    00000000: 54 fd 64 00 00 ff 64 01 40 60 19 80 02 0a 45 a3
    00000010: 80 19
  UrbLink              = 00000000
[148427 ms] UsbSnoop - MyInternalIOCTLCompletion(a95c2126) : fido=857e2b00, Irp=86a04e48, Context=86445700, IRQL=2
[148427 ms]  <<<  URB 336 coming back  <<< 
-- URB_FUNCTION_BULK_OR_INTERRUPT_TRANSFER:
  PipeHandle           = 858ccfbc [endpoint 0x00000002]
  TransferFlags        = 00000002 (USBD_TRANSFER_DIRECTION_OUT, USBD_SHORT_TRANSFER_OK)
  TransferBufferLength = 00000012
  TransferBuffer       = 00000000
  TransferBufferMDL    = 85e360a8
  UrbLink              = 00000000
[148427 ms] UsbSnoop - FilterDispatchAny(a95c1fd2) : IRP_MJ_INTERNAL_DEVICE_CONTROL
[148427 ms] UsbSnoop - FdoHookDispatchInternalIoctl(a95c21ea) : fdo=868c0de8, Irp=86ab43e0, IRQL=0
[148427 ms]  >>>  URB 337 going down  >>> 
-- URB_FUNCTION_BULK_OR_INTERRUPT_TRANSFER:
  PipeHandle           = 858ccf9c [endpoint 0x00000081]
  TransferFlags        = 00000003 (USBD_TRANSFER_DIRECTION_IN, USBD_SHORT_TRANSFER_OK)
  TransferBufferLength = 00000200
  TransferBuffer       = 00000000
  TransferBufferMDL    = 85d89a68
  UrbLink              = 00000000
[148427 ms] UsbSnoop - FilterDispatchAny(a95c1fd2) : IRP_MJ_INTERNAL_DEVICE_CONTROL
[148427 ms] UsbSnoop - FdoHookDispatchInternalIoctl(a95c21ea) : fdo=868c0de8, Irp=86a04e48, IRQL=0
[148427 ms]  >>>  URB 338 going down  >>> 
-- URB_FUNCTION_BULK_OR_INTERRUPT_TRANSFER:
  PipeHandle           = 858ccfbc [endpoint 0x00000002]
  TransferFlags        = 00000002 (USBD_TRANSFER_DIRECTION_OUT, USBD_SHORT_TRANSFER_OK)
  TransferBufferLength = 00000011
  TransferBuffer       = 00000000
  TransferBufferMDL    = 85e360a8
    00000000: 54 fd 64 00 80 19 64 01 40 60 0f 00 01 00 5e c1
    00000010: 0f
  UrbLink              = 00000000
[148428 ms] UsbSnoop - MyInternalIOCTLCompletion(a95c2126) : fido=857e2b00, Irp=86a04e48, Context=868cbac8, IRQL=2
[148428 ms]  <<<  URB 338 coming back  <<< 
-- URB_FUNCTION_BULK_OR_INTERRUPT_TRANSFER:
  PipeHandle           = 858ccfbc [endpoint 0x00000002]
  TransferFlags        = 00000002 (USBD_TRANSFER_DIRECTION_OUT, USBD_SHORT_TRANSFER_OK)
  TransferBufferLength = 00000011
  TransferBuffer       = 00000000
  TransferBufferMDL    = 85e360a8
  UrbLink              = 00000000
[148430 ms] UsbSnoop - MyInternalIOCTLCompletion(a95c2126) : fido=857e2b00, Irp=86ab43e0, Context=86445700, IRQL=2
[148430 ms]  <<<  URB 337 coming back  <<< 
-- URB_FUNCTION_BULK_OR_INTERRUPT_TRANSFER:
  PipeHandle           = 858ccf9c [endpoint 0x00000081]
  TransferFlags        = 00000003 (USBD_TRANSFER_DIRECTION_IN, USBD_SHORT_TRANSFER_OK)
  TransferBufferLength = 00000012
  TransferBuffer       = 00000000
  TransferBufferMDL    = 85d89a68
    00000000: 54 fd 64 01 00 ff 64 00 80 19 60 40 02 0a 5e bc
    00000010: 40 60
  UrbLink              = 00000000
[148430 ms] UsbSnoop - FilterDispatchAny(a95c1fd2) : IRP_MJ_INTERNAL_DEVICE_CONTROL
[148430 ms] UsbSnoop - FdoHookDispatchInternalIoctl(a95c21ea) : fdo=868c0de8, Irp=86ab43e0, IRQL=0
[148430 ms]  >>>  URB 339 going down  >>> 
-- URB_FUNCTION_BULK_OR_INTERRUPT_TRANSFER:
  PipeHandle           = 858ccf9c [endpoint 0x00000081]
  TransferFlags        = 00000003 (USBD_TRANSFER_DIRECTION_IN, USBD_SHORT_TRANSFER_OK)
  TransferBufferLength = 00000200
  TransferBuffer       = 00000000
  TransferBufferMDL    = 85d89a68
  UrbLink              = 00000000
[148433 ms] UsbSnoop - MyInternalIOCTLCompletion(a95c2126) : fido=857e2b00, Irp=86ab43e0, Context=86445700, IRQL=2
[148433 ms]  <<<  URB 339 coming back  <<< 
-- URB_FUNCTION_BULK_OR_INTERRUPT_TRANSFER:
  PipeHandle           = 858ccf9c [endpoint 0x00000081]
  TransferFlags        = 00000003 (USBD_TRANSFER_DIRECTION_IN, USBD_SHORT_TRANSFER_OK)
  TransferBufferLength = 00000012
  TransferBuffer       = 00000000
  TransferBufferMDL    = 85d89a68
    00000000: 54 fd 64 01 40 60 64 00 80 19 00 ff 02 00 46 9a
    00000010: ff 00
  UrbLink              = 00000000
[148433 ms] UsbSnoop - FilterDispatchAny(a95c1fd2) : IRP_MJ_INTERNAL_DEVICE_CONTROL
[148433 ms] UsbSnoop - FdoHookDispatchInternalIoctl(a95c21ea) : fdo=868c0de8, Irp=86a04e48, IRQL=0
[148433 ms]  >>>  URB 340 going down  >>> 
-- URB_FUNCTION_BULK_OR_INTERRUPT_TRANSFER:
  PipeHandle           = 858ccfbc [endpoint 0x00000002]
  TransferFlags        = 00000002 (USBD_TRANSFER_DIRECTION_OUT, USBD_SHORT_TRANSFER_OK)
  TransferBufferLength = 00000012
  TransferBuffer       = 00000000
  TransferBufferMDL    = 85e360a8
    00000000: 54 fd 64 00 00 ff 64 01 40 60 19 80 02 0a 46 a4
    00000010: 80 19
  UrbLink              = 00000000
[148434 ms] UsbSnoop - MyInternalIOCTLCompletion(a95c2126) : fido=857e2b00, Irp=86a04e48, Context=86445700, IRQL=2
[148434 ms]  <<<  URB 340 coming back  <<< 
-- URB_FUNCTION_BULK_OR_INTERRUPT_TRANSFER:
  PipeHandle           = 858ccfbc [endpoint 0x00000002]
  TransferFlags        = 00000002 (USBD_TRANSFER_DIRECTION_OUT, USBD_SHORT_TRANSFER_OK)
  TransferBufferLength = 00000012
  TransferBuffer       = 00000000
  TransferBufferMDL    = 85e360a8
  UrbLink              = 00000000
[148434 ms] UsbSnoop - FilterDispatchAny(a95c1fd2) : IRP_MJ_INTERNAL_DEVICE_CONTROL
[148434 ms] UsbSnoop - FdoHookDispatchInternalIoctl(a95c21ea) : fdo=868c0de8, Irp=86ab43e0, IRQL=0
[148434 ms]  >>>  URB 341 going down  >>> 
-- URB_FUNCTION_BULK_OR_INTERRUPT_TRANSFER:
  PipeHandle           = 858ccf9c [endpoint 0x00000081]
  TransferFlags        = 00000003 (USBD_TRANSFER_DIRECTION_IN, USBD_SHORT_TRANSFER_OK)
  TransferBufferLength = 00000200
  TransferBuffer       = 00000000
  TransferBufferMDL    = 85d89a68
  UrbLink              = 00000000
[148435 ms] UsbSnoop - FilterDispatchAny(a95c1fd2) : IRP_MJ_INTERNAL_DEVICE_CONTROL
[148435 ms] UsbSnoop - FdoHookDispatchInternalIoctl(a95c21ea) : fdo=868c0de8, Irp=856de590, IRQL=0
[148435 ms]  >>>  URB 342 going down  >>> 
-- URB_FUNCTION_BULK_OR_INTERRUPT_TRANSFER:
  PipeHandle           = 858ccfbc [endpoint 0x00000002]
  TransferFlags        = 00000002 (USBD_TRANSFER_DIRECTION_OUT, USBD_SHORT_TRANSFER_OK)
  TransferBufferLength = 00000012
  TransferBuffer       = 00000000
  TransferBufferMDL    = 85ddb8d0
    00000000: 54 fd 64 00 40 de 64 01 40 60 19 80 02 00 5f d2
    00000010: 80 19
  UrbLink              = 00000000
[148436 ms] UsbSnoop - MyInternalIOCTLCompletion(a95c2126) : fido=857e2b00, Irp=856de590, Context=868cbac8, IRQL=2
[148436 ms]  <<<  URB 342 coming back  <<< 
-- URB_FUNCTION_BULK_OR_INTERRUPT_TRANSFER:
  PipeHandle           = 858ccfbc [endpoint 0x00000002]
  TransferFlags        = 00000002 (USBD_TRANSFER_DIRECTION_OUT, USBD_SHORT_TRANSFER_OK)
  TransferBufferLength = 00000012
  TransferBuffer       = 00000000
  TransferBufferMDL    = 85ddb8d0
  UrbLink              = 00000000
[148437 ms] UsbSnoop - MyInternalIOCTLCompletion(a95c2126) : fido=857e2b00, Irp=86ab43e0, Context=86445700, IRQL=2
[148437 ms]  <<<  URB 341 coming back  <<< 
-- URB_FUNCTION_BULK_OR_INTERRUPT_TRANSFER:
  PipeHandle           = 858ccf9c [endpoint 0x00000081]
  TransferFlags        = 00000003 (USBD_TRANSFER_DIRECTION_IN, USBD_SHORT_TRANSFER_OK)
  TransferBufferLength = 00000012
  TransferBuffer       = 00000000
  TransferBufferMDL    = 85d89a68
    00000000: 54 fd 64 01 00 ff 64 00 80 19 60 40 02 0a 5f bd
    00000010: 40 60
  UrbLink              = 00000000
[148437 ms] UsbSnoop - FilterDispatchAny(a95c1fd2) : IRP_MJ_INTERNAL_DEVICE_CONTROL
[148437 ms] UsbSnoop - FdoHookDispatchInternalIoctl(a95c21ea) : fdo=868c0de8, Irp=856de590, IRQL=0
[148437 ms]  >>>  URB 343 going down  >>> 
-- URB_FUNCTION_BULK_OR_INTERRUPT_TRANSFER:
  PipeHandle           = 858ccf9c [endpoint 0x00000081]
  TransferFlags        = 00000003 (USBD_TRANSFER_DIRECTION_IN, USBD_SHORT_TRANSFER_OK)
  TransferBufferLength = 00000200
  TransferBuffer       = 00000000
  TransferBufferMDL    = 8595ae50
  UrbLink              = 00000000
[148504 ms] UsbSnoop - FilterDispatchAny(a95c1fd2) : IRP_MJ_INTERNAL_DEVICE_CONTROL
[148504 ms] UsbSnoop - FdoHookDispatchInternalIoctl(a95c21ea) : fdo=868c0de8, Irp=86ab43e0, IRQL=0
[148504 ms]  >>>  URB 344 going down  >>> 
-- URB_FUNCTION_BULK_OR_INTERRUPT_TRANSFER:
  PipeHandle           = 858ccfbc [endpoint 0x00000002]
  TransferFlags        = 00000002 (USBD_TRANSFER_DIRECTION_OUT, USBD_SHORT_TRANSFER_OK)
  TransferBufferLength = 0000001d
  TransferBuffer       = 00000000
  TransferBufferMDL    = 85745488
    00000000: 54 fd 64 00 80 1a 64 01 40 60 97 be 0d 00 60 16
    00000010: 0d 2f 31 32 33 34 35 36 37 38 39 30 00
  UrbLink              = 00000000
[148505 ms] UsbSnoop - MyInternalIOCTLCompletion(a95c2126) : fido=857e2b00, Irp=86ab43e0, Context=868cbac8, IRQL=2
[148505 ms]  <<<  URB 344 coming back  <<< 
-- URB_FUNCTION_BULK_OR_INTERRUPT_TRANSFER:
  PipeHandle           = 858ccfbc [endpoint 0x00000002]
  TransferFlags        = 00000002 (USBD_TRANSFER_DIRECTION_OUT, USBD_SHORT_TRANSFER_OK)
  TransferBufferLength = 0000001d
  TransferBuffer       = 00000000
  TransferBufferMDL    = 85745488
  UrbLink              = 00000000
[148506 ms] UsbSnoop - MyInternalIOCTLCompletion(a95c2126) : fido=857e2b00, Irp=856de590, Context=86445700, IRQL=2
[148506 ms]  <<<  URB 343 coming back  <<< 
-- URB_FUNCTION_BULK_OR_INTERRUPT_TRANSFER:
  PipeHandle           = 858ccf9c [endpoint 0x00000081]
  TransferFlags        = 00000003 (USBD_TRANSFER_DIRECTION_IN, USBD_SHORT_TRANSFER_OK)
  TransferBufferLength = 00000012
  TransferBuffer       = 00000000
  TransferBufferMDL    = 8595ae50
    00000000: 54 fd 64 01 00 ff 64 00 80 1a 60 40 02 0a 60 bf
    00000010: 40 60
  UrbLink              = 00000000
[148506 ms] UsbSnoop - FilterDispatchAny(a95c1fd2) : IRP_MJ_INTERNAL_DEVICE_CONTROL
[148506 ms] UsbSnoop - FdoHookDispatchInternalIoctl(a95c21ea) : fdo=868c0de8, Irp=856de590, IRQL=0
[148506 ms]  >>>  URB 345 going down  >>> 
-- URB_FUNCTION_BULK_OR_INTERRUPT_TRANSFER:
  PipeHandle           = 858ccf9c [endpoint 0x00000081]
  TransferFlags        = 00000003 (USBD_TRANSFER_DIRECTION_IN, USBD_SHORT_TRANSFER_OK)
  TransferBufferLength = 00000200
  TransferBuffer       = 00000000
  TransferBufferMDL    = 86949ec8
  UrbLink              = 00000000
[148521 ms] UsbSnoop - MyInternalIOCTLCompletion(a95c2126) : fido=857e2b00, Irp=856de590, Context=86445700, IRQL=2
[148521 ms]  <<<  URB 345 coming back  <<< 
-- URB_FUNCTION_BULK_OR_INTERRUPT_TRANSFER:
  PipeHandle           = 858ccf9c [endpoint 0x00000081]
  TransferFlags        = 00000003 (USBD_TRANSFER_DIRECTION_IN, USBD_SHORT_TRANSFER_OK)
  TransferBufferLength = 00000012
  TransferBuffer       = 00000000
  TransferBufferMDL    = 86949ec8
    00000000: 54 fd 64 01 40 60 64 00 80 1a 00 ff 02 00 47 9c
    00000010: ff 00
  UrbLink              = 00000000
[148521 ms] UsbSnoop - FilterDispatchAny(a95c1fd2) : IRP_MJ_INTERNAL_DEVICE_CONTROL
[148521 ms] UsbSnoop - FdoHookDispatchInternalIoctl(a95c21ea) : fdo=868c0de8, Irp=86ab43e0, IRQL=0
[148521 ms]  >>>  URB 346 going down  >>> 
-- URB_FUNCTION_BULK_OR_INTERRUPT_TRANSFER:
  PipeHandle           = 858ccfbc [endpoint 0x00000002]
  TransferFlags        = 00000002 (USBD_TRANSFER_DIRECTION_OUT, USBD_SHORT_TRANSFER_OK)
  TransferBufferLength = 00000012
  TransferBuffer       = 00000000
  TransferBufferMDL    = 85e360a8
    00000000: 54 fd 64 00 00 ff 64 01 40 60 1a 80 02 0a 47 a6
    00000010: 80 1a
  UrbLink              = 00000000
[148522 ms] UsbSnoop - MyInternalIOCTLCompletion(a95c2126) : fido=857e2b00, Irp=86ab43e0, Context=86445700, IRQL=2
[148522 ms]  <<<  URB 346 coming back  <<< 
-- URB_FUNCTION_BULK_OR_INTERRUPT_TRANSFER:
  PipeHandle           = 858ccfbc [endpoint 0x00000002]
  TransferFlags        = 00000002 (USBD_TRANSFER_DIRECTION_OUT, USBD_SHORT_TRANSFER_OK)
  TransferBufferLength = 00000012
  TransferBuffer       = 00000000
  TransferBufferMDL    = 85e360a8
  UrbLink              = 00000000
[148522 ms] UsbSnoop - FilterDispatchAny(a95c1fd2) : IRP_MJ_INTERNAL_DEVICE_CONTROL
[148522 ms] UsbSnoop - FdoHookDispatchInternalIoctl(a95c21ea) : fdo=868c0de8, Irp=86ab43e0, IRQL=0
[148522 ms]  >>>  URB 347 going down  >>> 
-- URB_FUNCTION_BULK_OR_INTERRUPT_TRANSFER:
  PipeHandle           = 858ccf9c [endpoint 0x00000081]
  TransferFlags        = 00000003 (USBD_TRANSFER_DIRECTION_IN, USBD_SHORT_TRANSFER_OK)
  TransferBufferLength = 00000200
  TransferBuffer       = 00000000
  TransferBufferMDL    = 85e360a8
  UrbLink              = 00000000
[148522 ms] UsbSnoop - FilterDispatchAny(a95c1fd2) : IRP_MJ_INTERNAL_DEVICE_CONTROL
[148522 ms] UsbSnoop - FdoHookDispatchInternalIoctl(a95c21ea) : fdo=868c0de8, Irp=856de590, IRQL=0
[148522 ms]  >>>  URB 348 going down  >>> 
-- URB_FUNCTION_BULK_OR_INTERRUPT_TRANSFER:
  PipeHandle           = 858ccfbc [endpoint 0x00000002]
  TransferFlags        = 00000002 (USBD_TRANSFER_DIRECTION_OUT, USBD_SHORT_TRANSFER_OK)
  TransferBufferLength = 00000011
  TransferBuffer       = 00000000
  TransferBufferMDL    = 86949ec8
    00000000: 54 fd 64 00 80 1a 64 01 40 60 0e 00 01 00 61 c4
    00000010: 0e
  UrbLink              = 00000000
[148523 ms] UsbSnoop - MyInternalIOCTLCompletion(a95c2126) : fido=857e2b00, Irp=856de590, Context=868cbac8, IRQL=2
[148523 ms]  <<<  URB 348 coming back  <<< 
-- URB_FUNCTION_BULK_OR_INTERRUPT_TRANSFER:
  PipeHandle           = 858ccfbc [endpoint 0x00000002]
  TransferFlags        = 00000002 (USBD_TRANSFER_DIRECTION_OUT, USBD_SHORT_TRANSFER_OK)
  TransferBufferLength = 00000011
  TransferBuffer       = 00000000
  TransferBufferMDL    = 86949ec8
  UrbLink              = 00000000
[148525 ms] UsbSnoop - MyInternalIOCTLCompletion(a95c2126) : fido=857e2b00, Irp=86ab43e0, Context=86445700, IRQL=2
[148525 ms]  <<<  URB 347 coming back  <<< 
-- URB_FUNCTION_BULK_OR_INTERRUPT_TRANSFER:
  PipeHandle           = 858ccf9c [endpoint 0x00000081]
  TransferFlags        = 00000003 (USBD_TRANSFER_DIRECTION_IN, USBD_SHORT_TRANSFER_OK)
  TransferBufferLength = 00000012
  TransferBuffer       = 00000000
  TransferBufferMDL    = 85e360a8
    00000000: 54 fd 64 01 00 ff 64 00 80 1a 60 40 02 0a 61 c0
    00000010: 40 60
  UrbLink              = 00000000
[148525 ms] UsbSnoop - FilterDispatchAny(a95c1fd2) : IRP_MJ_INTERNAL_DEVICE_CONTROL
[148525 ms] UsbSnoop - FdoHookDispatchInternalIoctl(a95c21ea) : fdo=868c0de8, Irp=856de590, IRQL=0
[148525 ms]  >>>  URB 349 going down  >>> 
-- URB_FUNCTION_BULK_OR_INTERRUPT_TRANSFER:
  PipeHandle           = 858ccf9c [endpoint 0x00000081]
  TransferFlags        = 00000003 (USBD_TRANSFER_DIRECTION_IN, USBD_SHORT_TRANSFER_OK)
  TransferBufferLength = 00000200
  TransferBuffer       = 00000000
  TransferBufferMDL    = 86949ec8
  UrbLink              = 00000000
[148532 ms] UsbSnoop - MyInternalIOCTLCompletion(a95c2126) : fido=857e2b00, Irp=856de590, Context=86445700, IRQL=2
[148532 ms]  <<<  URB 349 coming back  <<< 
-- URB_FUNCTION_BULK_OR_INTERRUPT_TRANSFER:
  PipeHandle           = 858ccf9c [endpoint 0x00000081]
  TransferFlags        = 00000003 (USBD_TRANSFER_DIRECTION_IN, USBD_SHORT_TRANSFER_OK)
  TransferBufferLength = 00000031
  TransferBuffer       = 00000000
  TransferBufferMDL    = 86949ec8
    00000000: 54 fd 64 01 40 60 64 00 80 1a 87 bb 21 00 48 ff
    00000010: 10 00 1e 47 65 74 74 69 6e 67 20 53 74 61 72 74
    00000020: 65 64 2e 74 6e 73 00 00 00 10 b1 00 00 a2 09 00
    00000030: 00
  UrbLink              = 00000000
[148532 ms] UsbSnoop - FilterDispatchAny(a95c1fd2) : IRP_MJ_INTERNAL_DEVICE_CONTROL
[148532 ms] UsbSnoop - FdoHookDispatchInternalIoctl(a95c21ea) : fdo=868c0de8, Irp=856de590, IRQL=0
[148532 ms]  >>>  URB 350 going down  >>> 
-- URB_FUNCTION_BULK_OR_INTERRUPT_TRANSFER:
  PipeHandle           = 858ccfbc [endpoint 0x00000002]
  TransferFlags        = 00000002 (USBD_TRANSFER_DIRECTION_OUT, USBD_SHORT_TRANSFER_OK)
  TransferBufferLength = 00000012
  TransferBuffer       = 00000000
  TransferBufferMDL    = 86949ec8
    00000000: 54 fd 64 00 00 ff 64 01 40 60 1a 80 02 0a 48 a7
    00000010: 80 1a
  UrbLink              = 00000000
[148533 ms] UsbSnoop - MyInternalIOCTLCompletion(a95c2126) : fido=857e2b00, Irp=856de590, Context=86445700, IRQL=2
[148533 ms]  <<<  URB 350 coming back  <<< 
-- URB_FUNCTION_BULK_OR_INTERRUPT_TRANSFER:
  PipeHandle           = 858ccfbc [endpoint 0x00000002]
  TransferFlags        = 00000002 (USBD_TRANSFER_DIRECTION_OUT, USBD_SHORT_TRANSFER_OK)
  TransferBufferLength = 00000012
  TransferBuffer       = 00000000
  TransferBufferMDL    = 86949ec8
  UrbLink              = 00000000
[148533 ms] UsbSnoop - FilterDispatchAny(a95c1fd2) : IRP_MJ_INTERNAL_DEVICE_CONTROL
[148533 ms] UsbSnoop - FdoHookDispatchInternalIoctl(a95c21ea) : fdo=868c0de8, Irp=856de590, IRQL=0
[148533 ms]  >>>  URB 351 going down  >>> 
-- URB_FUNCTION_BULK_OR_INTERRUPT_TRANSFER:
  PipeHandle           = 858ccf9c [endpoint 0x00000081]
  TransferFlags        = 00000003 (USBD_TRANSFER_DIRECTION_IN, USBD_SHORT_TRANSFER_OK)
  TransferBufferLength = 00000200
  TransferBuffer       = 00000000
  TransferBufferMDL    = 86949ec8
  UrbLink              = 00000000
[148534 ms] UsbSnoop - FilterDispatchAny(a95c1fd2) : IRP_MJ_INTERNAL_DEVICE_CONTROL
[148534 ms] UsbSnoop - FdoHookDispatchInternalIoctl(a95c21ea) : fdo=868c0de8, Irp=868a56e0, IRQL=0
[148534 ms]  >>>  URB 352 going down  >>> 
-- URB_FUNCTION_BULK_OR_INTERRUPT_TRANSFER:
  PipeHandle           = 858ccfbc [endpoint 0x00000002]
  TransferFlags        = 00000002 (USBD_TRANSFER_DIRECTION_OUT, USBD_SHORT_TRANSFER_OK)
  TransferBufferLength = 00000011
  TransferBuffer       = 00000000
  TransferBufferMDL    = 86b09108
    00000000: 54 fd 64 00 80 1a 64 01 40 60 0e 00 01 00 62 c5
    00000010: 0e
  UrbLink              = 00000000
[148535 ms] UsbSnoop - MyInternalIOCTLCompletion(a95c2126) : fido=857e2b00, Irp=868a56e0, Context=868cbac8, IRQL=2
[148535 ms]  <<<  URB 352 coming back  <<< 
-- URB_FUNCTION_BULK_OR_INTERRUPT_TRANSFER:
  PipeHandle           = 858ccfbc [endpoint 0x00000002]
  TransferFlags        = 00000002 (USBD_TRANSFER_DIRECTION_OUT, USBD_SHORT_TRANSFER_OK)
  TransferBufferLength = 00000011
  TransferBuffer       = 00000000
  TransferBufferMDL    = 86b09108
  UrbLink              = 00000000
[148537 ms] UsbSnoop - MyInternalIOCTLCompletion(a95c2126) : fido=857e2b00, Irp=856de590, Context=86445700, IRQL=2
[148537 ms]  <<<  URB 351 coming back  <<< 
-- URB_FUNCTION_BULK_OR_INTERRUPT_TRANSFER:
  PipeHandle           = 858ccf9c [endpoint 0x00000081]
  TransferFlags        = 00000003 (USBD_TRANSFER_DIRECTION_IN, USBD_SHORT_TRANSFER_OK)
  TransferBufferLength = 00000012
  TransferBuffer       = 00000000
  TransferBufferMDL    = 86949ec8
    00000000: 54 fd 64 01 00 ff 64 00 80 1a 60 40 02 0a 62 c1
    00000010: 40 60
  UrbLink              = 00000000
[148537 ms] UsbSnoop - FilterDispatchAny(a95c1fd2) : IRP_MJ_INTERNAL_DEVICE_CONTROL
[148537 ms] UsbSnoop - FdoHookDispatchInternalIoctl(a95c21ea) : fdo=868c0de8, Irp=856de590, IRQL=0
[148537 ms]  >>>  URB 353 going down  >>> 
-- URB_FUNCTION_BULK_OR_INTERRUPT_TRANSFER:
  PipeHandle           = 858ccf9c [endpoint 0x00000081]
  TransferFlags        = 00000003 (USBD_TRANSFER_DIRECTION_IN, USBD_SHORT_TRANSFER_OK)
  TransferBufferLength = 00000200
  TransferBuffer       = 00000000
  TransferBufferMDL    = 86949ec8
  UrbLink              = 00000000
[148539 ms] UsbSnoop - MyInternalIOCTLCompletion(a95c2126) : fido=857e2b00, Irp=856de590, Context=86445700, IRQL=2
[148539 ms]  <<<  URB 353 coming back  <<< 
-- URB_FUNCTION_BULK_OR_INTERRUPT_TRANSFER:
  PipeHandle           = 858ccf9c [endpoint 0x00000081]
  TransferFlags        = 00000003 (USBD_TRANSFER_DIRECTION_IN, USBD_SHORT_TRANSFER_OK)
  TransferBufferLength = 00000012
  TransferBuffer       = 00000000
  TransferBufferMDL    = 86949ec8
    00000000: 54 fd 64 01 40 60 64 00 80 1a 11 ff 02 00 49 af
    00000010: ff 11
  UrbLink              = 00000000
[148539 ms] UsbSnoop - FilterDispatchAny(a95c1fd2) : IRP_MJ_INTERNAL_DEVICE_CONTROL
[148539 ms] UsbSnoop - FdoHookDispatchInternalIoctl(a95c21ea) : fdo=868c0de8, Irp=856de590, IRQL=0
[148539 ms]  >>>  URB 354 going down  >>> 
-- URB_FUNCTION_BULK_OR_INTERRUPT_TRANSFER:
  PipeHandle           = 858ccfbc [endpoint 0x00000002]
  TransferFlags        = 00000002 (USBD_TRANSFER_DIRECTION_OUT, USBD_SHORT_TRANSFER_OK)
  TransferBufferLength = 00000012
  TransferBuffer       = 00000000
  TransferBufferMDL    = 86949ec8
    00000000: 54 fd 64 00 00 ff 64 01 40 60 1a 80 02 0a 49 a8
    00000010: 80 1a
  UrbLink              = 00000000
[148540 ms] UsbSnoop - MyInternalIOCTLCompletion(a95c2126) : fido=857e2b00, Irp=856de590, Context=86445700, IRQL=2
[148540 ms]  <<<  URB 354 coming back  <<< 
-- URB_FUNCTION_BULK_OR_INTERRUPT_TRANSFER:
  PipeHandle           = 858ccfbc [endpoint 0x00000002]
  TransferFlags        = 00000002 (USBD_TRANSFER_DIRECTION_OUT, USBD_SHORT_TRANSFER_OK)
  TransferBufferLength = 00000012
  TransferBuffer       = 00000000
  TransferBufferMDL    = 86949ec8
  UrbLink              = 00000000
[148540 ms] UsbSnoop - FilterDispatchAny(a95c1fd2) : IRP_MJ_INTERNAL_DEVICE_CONTROL
[148540 ms] UsbSnoop - FdoHookDispatchInternalIoctl(a95c21ea) : fdo=868c0de8, Irp=856de590, IRQL=0
[148540 ms]  >>>  URB 355 going down  >>> 
-- URB_FUNCTION_BULK_OR_INTERRUPT_TRANSFER:
  PipeHandle           = 858ccf9c [endpoint 0x00000081]
  TransferFlags        = 00000003 (USBD_TRANSFER_DIRECTION_IN, USBD_SHORT_TRANSFER_OK)
  TransferBufferLength = 00000200
  TransferBuffer       = 00000000
  TransferBufferMDL    = 86949ec8
  UrbLink              = 00000000
[148540 ms] UsbSnoop - FilterDispatchAny(a95c1fd2) : IRP_MJ_INTERNAL_DEVICE_CONTROL
[148540 ms] UsbSnoop - FdoHookDispatchInternalIoctl(a95c21ea) : fdo=868c0de8, Irp=868a56e0, IRQL=0
[148540 ms]  >>>  URB 356 going down  >>> 
-- URB_FUNCTION_BULK_OR_INTERRUPT_TRANSFER:
  PipeHandle           = 858ccfbc [endpoint 0x00000002]
  TransferFlags        = 00000002 (USBD_TRANSFER_DIRECTION_OUT, USBD_SHORT_TRANSFER_OK)
  TransferBufferLength = 00000011
  TransferBuffer       = 00000000
  TransferBufferMDL    = 86b09108
    00000000: 54 fd 64 00 80 1a 64 01 40 60 0f 00 01 00 63 c7
    00000010: 0f
  UrbLink              = 00000000
[148541 ms] UsbSnoop - MyInternalIOCTLCompletion(a95c2126) : fido=857e2b00, Irp=868a56e0, Context=868cbac8, IRQL=2
[148541 ms]  <<<  URB 356 coming back  <<< 
-- URB_FUNCTION_BULK_OR_INTERRUPT_TRANSFER:
  PipeHandle           = 858ccfbc [endpoint 0x00000002]
  TransferFlags        = 00000002 (USBD_TRANSFER_DIRECTION_OUT, USBD_SHORT_TRANSFER_OK)
  TransferBufferLength = 00000011
  TransferBuffer       = 00000000
  TransferBufferMDL    = 86b09108
  UrbLink              = 00000000
[148543 ms] UsbSnoop - MyInternalIOCTLCompletion(a95c2126) : fido=857e2b00, Irp=856de590, Context=86445700, IRQL=2
[148543 ms]  <<<  URB 355 coming back  <<< 
-- URB_FUNCTION_BULK_OR_INTERRUPT_TRANSFER:
  PipeHandle           = 858ccf9c [endpoint 0x00000081]
  TransferFlags        = 00000003 (USBD_TRANSFER_DIRECTION_IN, USBD_SHORT_TRANSFER_OK)
  TransferBufferLength = 00000012
  TransferBuffer       = 00000000
  TransferBufferMDL    = 86949ec8
    00000000: 54 fd 64 01 00 ff 64 00 80 1a 60 40 02 0a 63 c2
    00000010: 40 60
  UrbLink              = 00000000
[148543 ms] UsbSnoop - FilterDispatchAny(a95c1fd2) : IRP_MJ_INTERNAL_DEVICE_CONTROL
[148543 ms] UsbSnoop - FdoHookDispatchInternalIoctl(a95c21ea) : fdo=868c0de8, Irp=856de590, IRQL=0
[148543 ms]  >>>  URB 357 going down  >>> 
-- URB_FUNCTION_BULK_OR_INTERRUPT_TRANSFER:
  PipeHandle           = 858ccf9c [endpoint 0x00000081]
  TransferFlags        = 00000003 (USBD_TRANSFER_DIRECTION_IN, USBD_SHORT_TRANSFER_OK)
  TransferBufferLength = 00000200
  TransferBuffer       = 00000000
  TransferBufferMDL    = 86949ec8
  UrbLink              = 00000000
[148546 ms] UsbSnoop - MyInternalIOCTLCompletion(a95c2126) : fido=857e2b00, Irp=856de590, Context=86445700, IRQL=2
[148546 ms]  <<<  URB 357 coming back  <<< 
-- URB_FUNCTION_BULK_OR_INTERRUPT_TRANSFER:
  PipeHandle           = 858ccf9c [endpoint 0x00000081]
  TransferFlags        = 00000003 (USBD_TRANSFER_DIRECTION_IN, USBD_SHORT_TRANSFER_OK)
  TransferBufferLength = 00000012
  TransferBuffer       = 00000000
  TransferBufferMDL    = 86949ec8
    00000000: 54 fd 64 01 40 60 64 00 80 1a 00 ff 02 00 4a 9f
    00000010: ff 00
  UrbLink              = 00000000
[148546 ms] UsbSnoop - FilterDispatchAny(a95c1fd2) : IRP_MJ_INTERNAL_DEVICE_CONTROL
[148546 ms] UsbSnoop - FdoHookDispatchInternalIoctl(a95c21ea) : fdo=868c0de8, Irp=856de590, IRQL=0
[148546 ms]  >>>  URB 358 going down  >>> 
-- URB_FUNCTION_BULK_OR_INTERRUPT_TRANSFER:
  PipeHandle           = 858ccfbc [endpoint 0x00000002]
  TransferFlags        = 00000002 (USBD_TRANSFER_DIRECTION_OUT, USBD_SHORT_TRANSFER_OK)
  TransferBufferLength = 00000012
  TransferBuffer       = 00000000
  TransferBufferMDL    = 86949ec8
    00000000: 54 fd 64 00 00 ff 64 01 40 60 1a 80 02 0a 4a a9
    00000010: 80 1a
  UrbLink              = 00000000
[148547 ms] UsbSnoop - MyInternalIOCTLCompletion(a95c2126) : fido=857e2b00, Irp=856de590, Context=86445700, IRQL=2
[148547 ms]  <<<  URB 358 coming back  <<< 
-- URB_FUNCTION_BULK_OR_INTERRUPT_TRANSFER:
  PipeHandle           = 858ccfbc [endpoint 0x00000002]
  TransferFlags        = 00000002 (USBD_TRANSFER_DIRECTION_OUT, USBD_SHORT_TRANSFER_OK)
  TransferBufferLength = 00000012
  TransferBuffer       = 00000000
  TransferBufferMDL    = 86949ec8
  UrbLink              = 00000000
[148547 ms] UsbSnoop - FilterDispatchAny(a95c1fd2) : IRP_MJ_INTERNAL_DEVICE_CONTROL
[148547 ms] UsbSnoop - FdoHookDispatchInternalIoctl(a95c21ea) : fdo=868c0de8, Irp=856de590, IRQL=0
[148547 ms]  >>>  URB 359 going down  >>> 
-- URB_FUNCTION_BULK_OR_INTERRUPT_TRANSFER:
  PipeHandle           = 858ccf9c [endpoint 0x00000081]
  TransferFlags        = 00000003 (USBD_TRANSFER_DIRECTION_IN, USBD_SHORT_TRANSFER_OK)
  TransferBufferLength = 00000200
  TransferBuffer       = 00000000
  TransferBufferMDL    = 86949ec8
  UrbLink              = 00000000
[148548 ms] UsbSnoop - FilterDispatchAny(a95c1fd2) : IRP_MJ_INTERNAL_DEVICE_CONTROL
[148548 ms] UsbSnoop - FdoHookDispatchInternalIoctl(a95c21ea) : fdo=868c0de8, Irp=868a56e0, IRQL=0
[148548 ms]  >>>  URB 360 going down  >>> 
-- URB_FUNCTION_BULK_OR_INTERRUPT_TRANSFER:
  PipeHandle           = 858ccfbc [endpoint 0x00000002]
  TransferFlags        = 00000002 (USBD_TRANSFER_DIRECTION_OUT, USBD_SHORT_TRANSFER_OK)
  TransferBufferLength = 00000012
  TransferBuffer       = 00000000
  TransferBufferMDL    = 85dc0f88
    00000000: 54 fd 64 00 40 de 64 01 40 60 1a 80 02 00 64 d8
    00000010: 80 1a
  UrbLink              = 00000000
[148549 ms] UsbSnoop - MyInternalIOCTLCompletion(a95c2126) : fido=857e2b00, Irp=868a56e0, Context=868cbac8, IRQL=2
[148549 ms]  <<<  URB 360 coming back  <<< 
-- URB_FUNCTION_BULK_OR_INTERRUPT_TRANSFER:
  PipeHandle           = 858ccfbc [endpoint 0x00000002]
  TransferFlags        = 00000002 (USBD_TRANSFER_DIRECTION_OUT, USBD_SHORT_TRANSFER_OK)
  TransferBufferLength = 00000012
  TransferBuffer       = 00000000
  TransferBufferMDL    = 85dc0f88
  UrbLink              = 00000000
[148550 ms] UsbSnoop - MyInternalIOCTLCompletion(a95c2126) : fido=857e2b00, Irp=856de590, Context=86445700, IRQL=2
[148550 ms]  <<<  URB 359 coming back  <<< 
-- URB_FUNCTION_BULK_OR_INTERRUPT_TRANSFER:
  PipeHandle           = 858ccf9c [endpoint 0x00000081]
  TransferFlags        = 00000003 (USBD_TRANSFER_DIRECTION_IN, USBD_SHORT_TRANSFER_OK)
  TransferBufferLength = 00000012
  TransferBuffer       = 00000000
  TransferBufferMDL    = 86949ec8
    00000000: 54 fd 64 01 00 ff 64 00 80 1a 60 40 02 0a 64 c3
    00000010: 40 60
  UrbLink              = 00000000
[148551 ms] UsbSnoop - FilterDispatchAny(a95c1fd2) : IRP_MJ_INTERNAL_DEVICE_CONTROL
[148551 ms] UsbSnoop - FdoHookDispatchInternalIoctl(a95c21ea) : fdo=868c0de8, Irp=86ab43e0, IRQL=0
[148551 ms]  >>>  URB 361 going down  >>> 
-- URB_FUNCTION_BULK_OR_INTERRUPT_TRANSFER:
  PipeHandle           = 858ccf9c [endpoint 0x00000081]
  TransferFlags        = 00000003 (USBD_TRANSFER_DIRECTION_IN, USBD_SHORT_TRANSFER_OK)
  TransferBufferLength = 00000200
  TransferBuffer       = 00000000
  TransferBufferMDL    = 85e360a8
  UrbLink              = 00000000
