[12788 ms] UsbSnoop - FilterDispatchAny(b9c8efd2) : IRP_MJ_INTERNAL_DEVICE_CONTROL
[12788 ms] UsbSnoop - FdoHookDispatchInternalIoctl(b9c8f1ea) : fdo=85e1ea58, Irp=85b54bf8, IRQL=0
[12788 ms]  >>>  URB 5 going down  >>> 
-- URB_FUNCTION_VENDOR_DEVICE:
  TransferFlags          = 00000002 (USBD_TRANSFER_DIRECTION_OUT, USBD_SHORT_TRANSFER_OK)
  TransferBufferLength = 00000000
  TransferBuffer       = 00000000
  TransferBufferMDL    = 00000000

    no data supplied
  UrbLink                 = 00000000
  RequestTypeReservedBits = 00000000
  Request                 = 000000bb
  Value                   = 00000000
  Index                   = 00000000
[12789 ms] UsbSnoop - MyInternalIOCTLCompletion(b9c8f126) : fido=858c77c8, Irp=85b54bf8, Context=858bc360, IRQL=2
[12789 ms]  <<<  URB 5 coming back  <<< 
-- URB_FUNCTION_CONTROL_TRANSFER:
  PipeHandle           = 86157708
  TransferFlags        = 0000000a (USBD_TRANSFER_DIRECTION_OUT, USBD_SHORT_TRANSFER_OK)
  TransferBufferLength = 00000000
  TransferBuffer       = 00000000
  TransferBufferMDL    = 00000000
  UrbLink              = 00000000
  SetupPacket          =
    00000000: 40 bb 00 00 00 00 00 00
[12789 ms] UsbSnoop - FilterDispatchAny(b9c8efd2) : IRP_MJ_INTERNAL_DEVICE_CONTROL
[12789 ms] UsbSnoop - FdoHookDispatchInternalIoctl(b9c8f1ea) : fdo=85e1ea58, Irp=85b54bf8, IRQL=0
[12789 ms]  >>>  URB 6 going down  >>> 
-- URB_FUNCTION_VENDOR_DEVICE:
  TransferFlags          = 00000002 (USBD_TRANSFER_DIRECTION_OUT, USBD_SHORT_TRANSFER_OK)
  TransferBufferLength = 00000000
  TransferBuffer       = 00000000
  TransferBufferMDL    = 00000000

    no data supplied
  UrbLink                 = 00000000
  RequestTypeReservedBits = 00000000
  Request                 = 000000aa
  Value                   = 00000000
  Index                   = 00000000
[12791 ms] UsbSnoop - MyInternalIOCTLCompletion(b9c8f126) : fido=858c77c8, Irp=85b54bf8, Context=858bc360, IRQL=2
[12791 ms]  <<<  URB 6 coming back  <<< 
-- URB_FUNCTION_CONTROL_TRANSFER:
  PipeHandle           = 86157708
  TransferFlags        = 0000000a (USBD_TRANSFER_DIRECTION_OUT, USBD_SHORT_TRANSFER_OK)
  TransferBufferLength = 00000000
  TransferBuffer       = 00000000
  TransferBufferMDL    = 00000000
  UrbLink              = 00000000
  SetupPacket          =
    00000000: 40 aa 00 00 00 00 00 00
[12792 ms] UsbSnoop - FilterDispatchPnp(b9c9345c) : IRP_MJ_PNP (IRP_MN_QUERY_DEVICE_RELATIONS)
[12792 ms] UsbSnoop - FdoHookDispatchPnp(b9c9345c) : IRP_MJ_PNP (IRP_MN_QUERY_DEVICE_RELATIONS)
[12792 ms] UsbSnoop - FilterDispatchPnp(b9c9345c) : IRP_MJ_PNP (IRP_MN_QUERY_DEVICE_RELATIONS)
[12792 ms] UsbSnoop - FdoHookDispatchPnp(b9c9345c) : IRP_MJ_PNP (IRP_MN_QUERY_DEVICE_RELATIONS)
[12793 ms] UsbSnoop - FilterDispatchAny(b9c8efd2) : IRP_MJ_INTERNAL_DEVICE_CONTROL
[12793 ms] UsbSnoop - FdoHookDispatchInternalIoctl(b9c8f1ea) : fdo=85e1ea58, Irp=86412858, IRQL=0
[12793 ms]  >>>  URB 7 going down  >>> 
-- URB_FUNCTION_ABORT_PIPE:
  PipeHandle = 85b719e4 [endpoint 0x00000081]
[13260 ms] UsbSnoop - MyInternalIOCTLCompletion(b9c8f126) : fido=00000000, Irp=86412858, Context=858bc360, IRQL=2
[13260 ms]  <<<  URB 7 coming back  <<< 
-- URB_FUNCTION_ABORT_PIPE:
[13260 ms] UsbSnoop - FilterDispatchAny(b9c8efd2) : IRP_MJ_INTERNAL_DEVICE_CONTROL
[13260 ms] UsbSnoop - FdoHookDispatchInternalIoctl(b9c8f1ea) : fdo=85e1ea58, Irp=86412858, IRQL=0
[13260 ms]  >>>  URB 8 going down  >>> 
-- URB_FUNCTION_ABORT_PIPE:
  PipeHandle = 85b71a04 [endpoint 0x00000002]
[13776 ms] UsbSnoop - MyInternalIOCTLCompletion(b9c8f126) : fido=00000000, Irp=86412858, Context=858bc360, IRQL=2
[13776 ms]  <<<  URB 8 coming back  <<< 
-- URB_FUNCTION_ABORT_PIPE:
[13776 ms] UsbSnoop - FilterDispatchPnp(b9c9345c) : IRP_MJ_PNP (IRP_MN_SURPRISE_REMOVAL)
[13776 ms] UsbSnoop - FdoHookDispatchPnp(b9c9345c) : IRP_MJ_PNP (IRP_MN_SURPRISE_REMOVAL)
[14420 ms] UsbSnoop - FilterAddDevice(b9c93748) : DriverObject 868877a0, pdo 858c38f8
[14420 ms] UsbSnoop - FilterDispatchPnp(b9c9345c) : IRP_MJ_PNP (IRP_MN_QUERY_LEGACY_BUS_INFORMATION)
[14420 ms] UsbSnoop - FdoHookDispatchPnp(b9c9345c) : IRP_MJ_PNP (IRP_MN_QUERY_LEGACY_BUS_INFORMATION)
[14421 ms] UsbSnoop - FilterDispatchPnp(b9c9345c) : IRP_MJ_PNP (IRP_MN_QUERY_RESOURCE_REQUIREMENTS)
[14421 ms] UsbSnoop - FdoHookDispatchPnp(b9c9345c) : IRP_MJ_PNP (IRP_MN_QUERY_RESOURCE_REQUIREMENTS)
[14421 ms] UsbSnoop - FilterDispatchPnp(b9c9345c) : IRP_MJ_PNP (IRP_MN_FILTER_RESOURCE_REQUIREMENTS)
[14421 ms] UsbSnoop - FdoHookDispatchPnp(b9c9345c) : IRP_MJ_PNP (IRP_MN_FILTER_RESOURCE_REQUIREMENTS)
[14423 ms] UsbSnoop - FilterDispatchPnp(b9c9345c) : IRP_MJ_PNP (IRP_MN_START_DEVICE)
[14423 ms] UsbSnoop - FdoHookDispatchPnp(b9c9345c) : IRP_MJ_PNP (IRP_MN_START_DEVICE)
[14424 ms] UsbSnoop - FilterDispatchAny(b9c8efd2) : IRP_MJ_SYSTEM_CONTROL
[14424 ms] UsbSnoop - FilterDispatchAny(b9c8efd2) : IRP_MJ_INTERNAL_DEVICE_CONTROL
[14424 ms] UsbSnoop - FdoHookDispatchInternalIoctl(b9c8f1ea) : fdo=858c38f8, Irp=85b8ee70, IRQL=0
[14424 ms]  >>>  URB 1 going down  >>> 
-- URB_FUNCTION_GET_DESCRIPTOR_FROM_DEVICE:
  TransferBufferLength = 00000012
  TransferBuffer       = 86988840
  TransferBufferMDL    = 00000000
  Index                = 00000000
  DescriptorType       = 00000001 (USB_DEVICE_DESCRIPTOR_TYPE)
  LanguageId           = 00000000
[14425 ms] UsbSnoop - MyInternalIOCTLCompletion(b9c8f126) : fido=00000000, Irp=85b8ee70, Context=858bc360, IRQL=2
[14425 ms]  <<<  URB 1 coming back  <<< 
-- URB_FUNCTION_CONTROL_TRANSFER:
  PipeHandle           = 86157708
  TransferFlags        = 0000000b (USBD_TRANSFER_DIRECTION_IN, USBD_SHORT_TRANSFER_OK)
  TransferBufferLength = 00000012
  TransferBuffer       = 86988840
  TransferBufferMDL    = 86a63338
    00000000: 12 01 00 02 00 00 00 40 51 04 12 e0 00 01 01 02
    00000010: 00 03
  UrbLink              = 00000000
  SetupPacket          =
    00000000: 80 06 00 01 00 00 12 00
[14425 ms] UsbSnoop - FilterDispatchAny(b9c8efd2) : IRP_MJ_INTERNAL_DEVICE_CONTROL
[14425 ms] UsbSnoop - FdoHookDispatchInternalIoctl(b9c8f1ea) : fdo=858c38f8, Irp=85b8ee70, IRQL=0
[14425 ms]  >>>  URB 2 going down  >>> 
-- URB_FUNCTION_GET_DESCRIPTOR_FROM_DEVICE:
  TransferBufferLength = 00000009
  TransferBuffer       = 85dcd830
  TransferBufferMDL    = 00000000
  Index                = 00000000
  DescriptorType       = 00000002 (USB_CONFIGURATION_DESCRIPTOR_TYPE)
  LanguageId           = 00000000
[14427 ms] UsbSnoop - MyInternalIOCTLCompletion(b9c8f126) : fido=00000000, Irp=85b8ee70, Context=858bc360, IRQL=2
[14427 ms]  <<<  URB 2 coming back  <<< 
-- URB_FUNCTION_CONTROL_TRANSFER:
  PipeHandle           = 86157708
  TransferFlags        = 0000000b (USBD_TRANSFER_DIRECTION_IN, USBD_SHORT_TRANSFER_OK)
  TransferBufferLength = 00000009
  TransferBuffer       = 85dcd830
  TransferBufferMDL    = 86a63338
    00000000: 09 02 2a 00 01 01 03 80 32
  UrbLink              = 00000000
  SetupPacket          =
    00000000: 80 06 00 02 00 00 09 00
[14427 ms] UsbSnoop - FilterDispatchAny(b9c8efd2) : IRP_MJ_INTERNAL_DEVICE_CONTROL
[14427 ms] UsbSnoop - FdoHookDispatchInternalIoctl(b9c8f1ea) : fdo=858c38f8, Irp=85b8ee70, IRQL=0
[14427 ms]  >>>  URB 3 going down  >>> 
-- URB_FUNCTION_GET_DESCRIPTOR_FROM_DEVICE:
  TransferBufferLength = 0000002a
  TransferBuffer       = 8689aef8
  TransferBufferMDL    = 00000000
  Index                = 00000000
  DescriptorType       = 00000002 (USB_CONFIGURATION_DESCRIPTOR_TYPE)
  LanguageId           = 00000000
[14429 ms] UsbSnoop - MyInternalIOCTLCompletion(b9c8f126) : fido=00000000, Irp=85b8ee70, Context=858bc360, IRQL=2
[14429 ms]  <<<  URB 3 coming back  <<< 
-- URB_FUNCTION_CONTROL_TRANSFER:
  PipeHandle           = 86157708
  TransferFlags        = 0000000b (USBD_TRANSFER_DIRECTION_IN, USBD_SHORT_TRANSFER_OK)
  TransferBufferLength = 0000002a
  TransferBuffer       = 8689aef8
  TransferBufferMDL    = 86a63338
    00000000: 09 02 2a 00 01 01 03 80 32 03 09 01 09 04 00 00
    00000010: 03 ff 02 00 00 07 05 81 02 40 00 00 07 05 02 02
    00000020: 40 00 00 07 05 83 02 40 00 00
  UrbLink              = 00000000
  SetupPacket          =
    00000000: 80 06 00 02 00 00 2a 00
[14429 ms] UsbSnoop - FilterDispatchAny(b9c8efd2) : IRP_MJ_INTERNAL_DEVICE_CONTROL
[14429 ms] UsbSnoop - FdoHookDispatchInternalIoctl(b9c8f1ea) : fdo=858c38f8, Irp=85b8ee70, IRQL=0
[14429 ms]  >>>  URB 4 going down  >>> 
-- URB_FUNCTION_SELECT_CONFIGURATION:
  ConfigurationDescriptor = 0x8689aef8 (configure)
  ConfigurationDescriptor : bLength             = 9
  ConfigurationDescriptor : bDescriptorType     = 0x00000002
  ConfigurationDescriptor : wTotalLength        = 0x0000002a
  ConfigurationDescriptor : bNumInterfaces      = 0x00000001
  ConfigurationDescriptor : bConfigurationValue = 0x00000001
  ConfigurationDescriptor : iConfiguration      = 0x00000003
  ConfigurationDescriptor : bmAttributes        = 0x00000080
  ConfigurationDescriptor : MaxPower            = 0x00000032
  ConfigurationHandle     = 0x00000000
  Interface[0]: Length            = 76
  Interface[0]: InterfaceNumber   = 0
  Interface[0]: AlternateSetting  = 0
[14526 ms] UsbSnoop - MyInternalIOCTLCompletion(b9c8f126) : fido=00000000, Irp=85b8ee70, Context=858bc360, IRQL=0
[14526 ms]  <<<  URB 4 coming back  <<< 
-- URB_FUNCTION_SELECT_CONFIGURATION:
  ConfigurationDescriptor = 0x8689aef8 (configure)
  ConfigurationDescriptor : bLength             = 9
  ConfigurationDescriptor : bDescriptorType     = 0x00000002
  ConfigurationDescriptor : wTotalLength        = 0x0000002a
  ConfigurationDescriptor : bNumInterfaces      = 0x00000001
  ConfigurationDescriptor : bConfigurationValue = 0x00000001
  ConfigurationDescriptor : iConfiguration      = 0x00000003
  ConfigurationDescriptor : bmAttributes        = 0x00000080
  ConfigurationDescriptor : MaxPower            = 0x00000032
  ConfigurationHandle     = 0x868ccd48
  Interface[0]: Length            = 76
  Interface[0]: InterfaceNumber   = 0
  Interface[0]: AlternateSetting  = 0
  Interface[0]: Class             = 0x000000ff
  Interface[0]: SubClass          = 0x00000002
  Interface[0]: Protocol          = 0x00000000
  Interface[0]: InterfaceHandle   = 0x86a79750
  Interface[0]: NumberOfPipes     = 3
  Interface[0]: Pipes[0] : MaximumPacketSize = 0x00000040
  Interface[0]: Pipes[0] : EndpointAddress   = 0x00000081
  Interface[0]: Pipes[0] : Interval          = 0x00000000
  Interface[0]: Pipes[0] : PipeType          = 0x00000002 (UsbdPipeTypeBulk)
  Interface[0]: Pipes[0] : PipeHandle        = 0x86a7976c
  Interface[0]: Pipes[0] : MaxTransferSize   = 0x00001000
  Interface[0]: Pipes[0] : PipeFlags         = 0x00000000
  Interface[0]: Pipes[1] : MaximumPacketSize = 0x00000040
  Interface[0]: Pipes[1] : EndpointAddress   = 0x00000002
  Interface[0]: Pipes[1] : Interval          = 0x00000000
  Interface[0]: Pipes[1] : PipeType          = 0x00000002 (UsbdPipeTypeBulk)
  Interface[0]: Pipes[1] : PipeHandle        = 0x86a7978c
  Interface[0]: Pipes[1] : MaxTransferSize   = 0x00001000
  Interface[0]: Pipes[1] : PipeFlags         = 0x00000000
  Interface[0]: Pipes[2] : MaximumPacketSize = 0x00000040
  Interface[0]: Pipes[2] : EndpointAddress   = 0x00000083
  Interface[0]: Pipes[2] : Interval          = 0x00000000
  Interface[0]: Pipes[2] : PipeType          = 0x00000002 (UsbdPipeTypeBulk)
  Interface[0]: Pipes[2] : PipeHandle        = 0x86a797ac
  Interface[0]: Pipes[2] : MaxTransferSize   = 0x00001000
  Interface[0]: Pipes[2] : PipeFlags         = 0x00000000
[14526 ms] UsbSnoop - FilterDispatchPnp(b9c9345c) : IRP_MJ_PNP (IRP_MN_QUERY_INTERFACE)
[14526 ms] UsbSnoop - FilterDispatchPnp: Query for Bus interface for USB Function Drivers.
[14526 ms] 	InterfaceType: USB_BUS_INTERFACE_USBDI_GUID
[14526 ms] UsbSnoop - FdoHookDispatchPnp(b9c9345c) : IRP_MJ_PNP (IRP_MN_QUERY_INTERFACE)
[14526 ms] UsbSnoop - FdoHookDispatchPnp: Query for Bus interface for USB Function Drivers.
[14526 ms] 	InterfaceType: USB_BUS_INTERFACE_USBDI_GUID
[14527 ms] UsbSnoop - FilterDispatchPnp(b9c9345c) : IRP_MJ_PNP (IRP_MN_QUERY_CAPABILITIES)
[14527 ms] UsbSnoop - FdoHookDispatchPnp(b9c9345c) : IRP_MJ_PNP (IRP_MN_QUERY_CAPABILITIES)
[14527 ms] UsbSnoop - FilterDispatchPnp(b9c9345c) : IRP_MJ_PNP (IRP_MN_QUERY_PNP_DEVICE_STATE)
[14527 ms] UsbSnoop - FdoHookDispatchPnp(b9c9345c) : IRP_MJ_PNP (IRP_MN_QUERY_PNP_DEVICE_STATE)
[14527 ms] UsbSnoop - FilterDispatchPnp(b9c9345c) : IRP_MJ_PNP (IRP_MN_QUERY_DEVICE_RELATIONS)
[14527 ms] UsbSnoop - FdoHookDispatchPnp(b9c9345c) : IRP_MJ_PNP (IRP_MN_QUERY_DEVICE_RELATIONS)
[14527 ms] UsbSnoop - FilterDispatchPnp(b9c9345c) : IRP_MJ_PNP (IRP_MN_REMOVE_DEVICE)
[14800 ms] UsbSnoop - FilterDispatchAny(b9c8efd2) : IRP_MJ_INTERNAL_DEVICE_CONTROL
[14800 ms] UsbSnoop - FdoHookDispatchInternalIoctl(b9c8f1ea) : fdo=858c38f8, Irp=86412858, IRQL=0
[14801 ms]  >>>  URB 5 going down  >>> 
-- URB_FUNCTION_BULK_OR_INTERRUPT_TRANSFER:
  PipeHandle           = 86a7976c [endpoint 0x00000081]
  TransferFlags        = 00000003 (USBD_TRANSFER_DIRECTION_IN, USBD_SHORT_TRANSFER_OK)
  TransferBufferLength = 00000200
  TransferBuffer       = 00000000
  TransferBufferMDL    = 868708f8
  UrbLink              = 00000000
[14801 ms] UsbSnoop - MyInternalIOCTLCompletion(b9c8f126) : fido=858b5488, Irp=86412858, Context=858bc360, IRQL=2
[14801 ms]  <<<  URB 5 coming back  <<< 
-- URB_FUNCTION_BULK_OR_INTERRUPT_TRANSFER:
  PipeHandle           = 86a7976c [endpoint 0x00000081]
  TransferFlags        = 00000003 (USBD_TRANSFER_DIRECTION_IN, USBD_SHORT_TRANSFER_OK)
  TransferBufferLength = 00000010
  TransferBuffer       = 00000000
  TransferBufferMDL    = 868708f8
    00000000: 54 fd 00 00 40 03 00 00 40 03 00 00 00 53 01 2b
  UrbLink              = 00000000
[14805 ms] UsbSnoop - FilterDispatchAny(b9c8efd2) : IRP_MJ_INTERNAL_DEVICE_CONTROL
[14805 ms] UsbSnoop - FdoHookDispatchInternalIoctl(b9c8f1ea) : fdo=858c38f8, Irp=86412858, IRQL=0
[14805 ms]  >>>  URB 6 going down  >>> 
-- URB_FUNCTION_BULK_OR_INTERRUPT_TRANSFER:
  PipeHandle           = 86a7976c [endpoint 0x00000081]
  TransferFlags        = 00000003 (USBD_TRANSFER_DIRECTION_IN, USBD_SHORT_TRANSFER_OK)
  TransferBufferLength = 00000200
  TransferBuffer       = 00000000
  TransferBufferMDL    = 86ae60d0
  UrbLink              = 00000000
[14806 ms] UsbSnoop - FilterDispatchAny(b9c8efd2) : IRP_MJ_INTERNAL_DEVICE_CONTROL
[14806 ms] UsbSnoop - FdoHookDispatchInternalIoctl(b9c8f1ea) : fdo=858c38f8, Irp=85b54bf8, IRQL=0
[14806 ms]  >>>  URB 7 going down  >>> 
-- URB_FUNCTION_BULK_OR_INTERRUPT_TRANSFER:
  PipeHandle           = 86a7978c [endpoint 0x00000002]
  TransferFlags        = 00000002 (USBD_TRANSFER_DIRECTION_OUT, USBD_SHORT_TRANSFER_OK)
  TransferBufferLength = 00000014
  TransferBuffer       = 00000000
  TransferBufferMDL    = 8687be28
    00000000: 54 fd 64 00 40 03 64 01 40 03 13 43 04 00 01 fb
    00000010: 64 01 ff 00
  UrbLink              = 00000000
[14806 ms] UsbSnoop - MyInternalIOCTLCompletion(b9c8f126) : fido=858b5488, Irp=85b54bf8, Context=85d29868, IRQL=2
[14806 ms]  <<<  URB 7 coming back  <<< 
-- URB_FUNCTION_BULK_OR_INTERRUPT_TRANSFER:
  PipeHandle           = 86a7978c [endpoint 0x00000002]
  TransferFlags        = 00000002 (USBD_TRANSFER_DIRECTION_OUT, USBD_SHORT_TRANSFER_OK)
  TransferBufferLength = 00000014
  TransferBuffer       = 00000000
  TransferBufferMDL    = 8687be28
  UrbLink              = 00000000
[17852 ms] UsbSnoop - MyInternalIOCTLCompletion(b9c8f126) : fido=858b5488, Irp=86412858, Context=858bc360, IRQL=2
[17852 ms]  <<<  URB 6 coming back  <<< 
-- URB_FUNCTION_BULK_OR_INTERRUPT_TRANSFER:
  PipeHandle           = 86a7976c [endpoint 0x00000081]
  TransferFlags        = 00000003 (USBD_TRANSFER_DIRECTION_IN, USBD_SHORT_TRANSFER_OK)
  TransferBufferLength = 00000016
  TransferBuffer       = 00000000
  TransferBufferMDL    = 86ae60d0
    00000000: 54 fd 64 01 80 31 64 00 40 50 39 76 06 00 01 11
    00000010: 02 00 00 00 00 00
  UrbLink              = 00000000
[17852 ms] UsbSnoop - FilterDispatchAny(b9c8efd2) : IRP_MJ_INTERNAL_DEVICE_CONTROL
[17852 ms] UsbSnoop - FdoHookDispatchInternalIoctl(b9c8f1ea) : fdo=858c38f8, Irp=86412858, IRQL=0
[17852 ms]  >>>  URB 8 going down  >>> 
-- URB_FUNCTION_BULK_OR_INTERRUPT_TRANSFER:
  PipeHandle           = 86a7976c [endpoint 0x00000081]
  TransferFlags        = 00000003 (USBD_TRANSFER_DIRECTION_IN, USBD_SHORT_TRANSFER_OK)
  TransferBufferLength = 00000200
  TransferBuffer       = 00000000
  TransferBufferMDL    = 85e63d10
  UrbLink              = 00000000
[17852 ms] UsbSnoop - FilterDispatchAny(b9c8efd2) : IRP_MJ_INTERNAL_DEVICE_CONTROL
[17852 ms] UsbSnoop - FdoHookDispatchInternalIoctl(b9c8f1ea) : fdo=858c38f8, Irp=864ce858, IRQL=0
[17852 ms]  >>>  URB 9 going down  >>> 
-- URB_FUNCTION_BULK_OR_INTERRUPT_TRANSFER:
  PipeHandle           = 86a7978c [endpoint 0x00000002]
  TransferFlags        = 00000002 (USBD_TRANSFER_DIRECTION_OUT, USBD_SHORT_TRANSFER_OK)
  TransferBufferLength = 00000012
  TransferBuffer       = 00000000
  TransferBufferMDL    = 86a086b0
    00000000: 54 fd 64 00 00 d3 64 01 80 31 50 40 02 0a 01 3b
    00000010: 40 50
  UrbLink              = 00000000
[17853 ms] UsbSnoop - MyInternalIOCTLCompletion(b9c8f126) : fido=858b5488, Irp=864ce858, Context=85d29868, IRQL=2
[17853 ms]  <<<  URB 9 coming back  <<< 
-- URB_FUNCTION_BULK_OR_INTERRUPT_TRANSFER:
  PipeHandle           = 86a7978c [endpoint 0x00000002]
  TransferFlags        = 00000002 (USBD_TRANSFER_DIRECTION_OUT, USBD_SHORT_TRANSFER_OK)
  TransferBufferLength = 00000012
  TransferBuffer       = 00000000
  TransferBufferMDL    = 86a086b0
  UrbLink              = 00000000
[20134 ms] UsbSnoop - FilterDispatchAny(b9c8efd2) : IRP_MJ_INTERNAL_DEVICE_CONTROL
[20134 ms] UsbSnoop - FdoHookDispatchInternalIoctl(b9c8f1ea) : fdo=858c38f8, Irp=863a0858, IRQL=0
[20134 ms]  >>>  URB 10 going down  >>> 
-- URB_FUNCTION_BULK_OR_INTERRUPT_TRANSFER:
  PipeHandle           = 86a7978c [endpoint 0x00000002]
  TransferFlags        = 00000002 (USBD_TRANSFER_DIRECTION_OUT, USBD_SHORT_TRANSFER_OK)
  TransferBufferLength = 00000011
  TransferBuffer       = 00000000
  TransferBufferMDL    = 85d81740
    00000000: 54 fd 64 00 80 02 64 01 40 20 01 00 01 00 01 ff
    00000010: 01
  UrbLink              = 00000000
[20135 ms] UsbSnoop - MyInternalIOCTLCompletion(b9c8f126) : fido=858b5488, Irp=863a0858, Context=85d29868, IRQL=2
[20135 ms]  <<<  URB 10 coming back  <<< 
-- URB_FUNCTION_BULK_OR_INTERRUPT_TRANSFER:
  PipeHandle           = 86a7978c [endpoint 0x00000002]
  TransferFlags        = 00000002 (USBD_TRANSFER_DIRECTION_OUT, USBD_SHORT_TRANSFER_OK)
  TransferBufferLength = 00000011
  TransferBuffer       = 00000000
  TransferBufferMDL    = 85d81740
  UrbLink              = 00000000
[20137 ms] UsbSnoop - MyInternalIOCTLCompletion(b9c8f126) : fido=858b5488, Irp=86412858, Context=858bc360, IRQL=2
[20137 ms]  <<<  URB 8 coming back  <<< 
-- URB_FUNCTION_BULK_OR_INTERRUPT_TRANSFER:
  PipeHandle           = 86a7976c [endpoint 0x00000081]
  TransferFlags        = 00000003 (USBD_TRANSFER_DIRECTION_IN, USBD_SHORT_TRANSFER_OK)
  TransferBufferLength = 00000012
  TransferBuffer       = 00000000
  TransferBufferMDL    = 85e63d10
    00000000: 54 fd 64 01 00 ff 64 00 80 02 20 40 02 0a 01 08
    00000010: 40 20
  UrbLink              = 00000000
[20138 ms] UsbSnoop - FilterDispatchAny(b9c8efd2) : IRP_MJ_INTERNAL_DEVICE_CONTROL
[20138 ms] UsbSnoop - FdoHookDispatchInternalIoctl(b9c8f1ea) : fdo=858c38f8, Irp=86412858, IRQL=0
[20138 ms]  >>>  URB 11 going down  >>> 
-- URB_FUNCTION_BULK_OR_INTERRUPT_TRANSFER:
  PipeHandle           = 86a7976c [endpoint 0x00000081]
  TransferFlags        = 00000003 (USBD_TRANSFER_DIRECTION_IN, USBD_SHORT_TRANSFER_OK)
  TransferBufferLength = 00000200
  TransferBuffer       = 00000000
  TransferBufferMDL    = 85e145c8
  UrbLink              = 00000000
[20144 ms] UsbSnoop - MyInternalIOCTLCompletion(b9c8f126) : fido=858b5488, Irp=86412858, Context=858bc360, IRQL=2
[20144 ms]  <<<  URB 11 coming back  <<< 
-- URB_FUNCTION_BULK_OR_INTERRUPT_TRANSFER:
  PipeHandle           = 86a7976c [endpoint 0x00000081]
  TransferFlags        = 00000003 (USBD_TRANSFER_DIRECTION_IN, USBD_SHORT_TRANSFER_OK)
  TransferBufferLength = 0000007f
  TransferBuffer       = 00000000
  TransferBufferMDL    = 85e145c8
    00000000: 54 fd 64 01 40 20 64 00 80 02 bf aa 6f 00 02 d6
    00000010: 01 00 00 00 00 01 59 90 00 00 00 00 00 01 be 00
    00000020: 00 00 00 00 00 08 dc 4f a0 00 00 00 00 01 75 75
    00000030: ec 7f 00 00 5a 01 02 09 5e 01 01 22 d4 01 01 23
    00000040: 15 00 00 00 00 00 02 00 00 00 00 01 40 00 f0 04
    00000050: 00 1e 30 30 30 30 34 42 43 31 42 31 30 45 35 37
    00000060: 30 46 00 30 45 30 30 30 30 30 34 42 43 31 42 31
    00000070: 30 45 35 37 30 46 43 42 32 38 30 34 46 31 00
  UrbLink              = 00000000
[20144 ms] UsbSnoop - FilterDispatchAny(b9c8efd2) : IRP_MJ_INTERNAL_DEVICE_CONTROL
[20144 ms] UsbSnoop - FdoHookDispatchInternalIoctl(b9c8f1ea) : fdo=858c38f8, Irp=86412858, IRQL=0
[20144 ms]  >>>  URB 12 going down  >>> 
-- URB_FUNCTION_BULK_OR_INTERRUPT_TRANSFER:
  PipeHandle           = 86a7976c [endpoint 0x00000081]
  TransferFlags        = 00000003 (USBD_TRANSFER_DIRECTION_IN, USBD_SHORT_TRANSFER_OK)
  TransferBufferLength = 00000200
  TransferBuffer       = 00000000
  TransferBufferMDL    = 85d7e740
  UrbLink              = 00000000
[20144 ms] UsbSnoop - FilterDispatchAny(b9c8efd2) : IRP_MJ_INTERNAL_DEVICE_CONTROL
[20144 ms] UsbSnoop - FdoHookDispatchInternalIoctl(b9c8f1ea) : fdo=858c38f8, Irp=863a0858, IRQL=0
[20144 ms]  >>>  URB 13 going down  >>> 
-- URB_FUNCTION_BULK_OR_INTERRUPT_TRANSFER:
  PipeHandle           = 86a7978c [endpoint 0x00000002]
  TransferFlags        = 00000002 (USBD_TRANSFER_DIRECTION_OUT, USBD_SHORT_TRANSFER_OK)
  TransferBufferLength = 00000012
  TransferBuffer       = 00000000
  TransferBufferMDL    = 869125d8
    00000000: 54 fd 64 00 00 ff 64 01 40 20 02 80 02 0a 02 09
    00000010: 80 02
  UrbLink              = 00000000
[20145 ms] UsbSnoop - MyInternalIOCTLCompletion(b9c8f126) : fido=858b5488, Irp=863a0858, Context=85d29868, IRQL=2
[20145 ms]  <<<  URB 13 coming back  <<< 
-- URB_FUNCTION_BULK_OR_INTERRUPT_TRANSFER:
  PipeHandle           = 86a7978c [endpoint 0x00000002]
  TransferFlags        = 00000002 (USBD_TRANSFER_DIRECTION_OUT, USBD_SHORT_TRANSFER_OK)
  TransferBufferLength = 00000012
  TransferBuffer       = 00000000
  TransferBufferMDL    = 869125d8
  UrbLink              = 00000000
[20145 ms] UsbSnoop - FilterDispatchAny(b9c8efd2) : IRP_MJ_INTERNAL_DEVICE_CONTROL
[20145 ms] UsbSnoop - FdoHookDispatchInternalIoctl(b9c8f1ea) : fdo=858c38f8, Irp=86383858, IRQL=0
[20145 ms]  >>>  URB 14 going down  >>> 
-- URB_FUNCTION_BULK_OR_INTERRUPT_TRANSFER:
  PipeHandle           = 86a7978c [endpoint 0x00000002]
  TransferFlags        = 00000002 (USBD_TRANSFER_DIRECTION_OUT, USBD_SHORT_TRANSFER_OK)
  TransferBufferLength = 00000011
  TransferBuffer       = 00000000
  TransferBufferMDL    = 85b959d0
    00000000: 54 fd 64 00 80 02 64 01 40 20 02 00 01 00 02 01
    00000010: 02
  UrbLink              = 00000000
[20147 ms] UsbSnoop - MyInternalIOCTLCompletion(b9c8f126) : fido=858b5488, Irp=86383858, Context=85d29868, IRQL=2
[20147 ms]  <<<  URB 14 coming back  <<< 
-- URB_FUNCTION_BULK_OR_INTERRUPT_TRANSFER:
  PipeHandle           = 86a7978c [endpoint 0x00000002]
  TransferFlags        = 00000002 (USBD_TRANSFER_DIRECTION_OUT, USBD_SHORT_TRANSFER_OK)
  TransferBufferLength = 00000011
  TransferBuffer       = 00000000
  TransferBufferMDL    = 85b959d0
  UrbLink              = 00000000
[20150 ms] UsbSnoop - MyInternalIOCTLCompletion(b9c8f126) : fido=858b5488, Irp=86412858, Context=858bc360, IRQL=2
[20150 ms]  <<<  URB 12 coming back  <<< 
-- URB_FUNCTION_BULK_OR_INTERRUPT_TRANSFER:
  PipeHandle           = 86a7976c [endpoint 0x00000081]
  TransferFlags        = 00000003 (USBD_TRANSFER_DIRECTION_IN, USBD_SHORT_TRANSFER_OK)
  TransferBufferLength = 00000012
  TransferBuffer       = 00000000
  TransferBufferMDL    = 85d7e740
    00000000: 54 fd 64 01 00 ff 64 00 80 02 20 40 02 0a 02 09
    00000010: 40 20
  UrbLink              = 00000000
[20150 ms] UsbSnoop - FilterDispatchAny(b9c8efd2) : IRP_MJ_INTERNAL_DEVICE_CONTROL
[20150 ms] UsbSnoop - FdoHookDispatchInternalIoctl(b9c8f1ea) : fdo=858c38f8, Irp=863d86a0, IRQL=0
[20150 ms]  >>>  URB 15 going down  >>> 
-- URB_FUNCTION_BULK_OR_INTERRUPT_TRANSFER:
  PipeHandle           = 86a7976c [endpoint 0x00000081]
  TransferFlags        = 00000003 (USBD_TRANSFER_DIRECTION_IN, USBD_SHORT_TRANSFER_OK)
  TransferBufferLength = 00000200
  TransferBuffer       = 00000000
  TransferBufferMDL    = 85b959d0
  UrbLink              = 00000000
[20154 ms] UsbSnoop - MyInternalIOCTLCompletion(b9c8f126) : fido=858b5488, Irp=863d86a0, Context=858bc360, IRQL=2
[20154 ms]  <<<  URB 15 coming back  <<< 
-- URB_FUNCTION_BULK_OR_INTERRUPT_TRANSFER:
  PipeHandle           = 86a7976c [endpoint 0x00000081]
  TransferFlags        = 00000003 (USBD_TRANSFER_DIRECTION_IN, USBD_SHORT_TRANSFER_OK)
  TransferBufferLength = 0000001b
  TransferBuffer       = 00000000
  TransferBufferMDL    = 85b959d0
    00000000: 54 fd 64 01 40 20 64 00 80 02 38 5a 0b 00 03 9c
    00000010: 02 54 49 2d 4e 73 70 69 72 65 00
  UrbLink              = 00000000
[20154 ms] UsbSnoop - FilterDispatchAny(b9c8efd2) : IRP_MJ_INTERNAL_DEVICE_CONTROL
[20154 ms] UsbSnoop - FdoHookDispatchInternalIoctl(b9c8f1ea) : fdo=858c38f8, Irp=863d86a0, IRQL=0
[20154 ms]  >>>  URB 16 going down  >>> 
-- URB_FUNCTION_BULK_OR_INTERRUPT_TRANSFER:
  PipeHandle           = 86a7976c [endpoint 0x00000081]
  TransferFlags        = 00000003 (USBD_TRANSFER_DIRECTION_IN, USBD_SHORT_TRANSFER_OK)
  TransferBufferLength = 00000200
  TransferBuffer       = 00000000
  TransferBufferMDL    = 85cdf860
  UrbLink              = 00000000
[20154 ms] UsbSnoop - FilterDispatchAny(b9c8efd2) : IRP_MJ_INTERNAL_DEVICE_CONTROL
[20154 ms] UsbSnoop - FdoHookDispatchInternalIoctl(b9c8f1ea) : fdo=858c38f8, Irp=8690aca0, IRQL=0
[20154 ms]  >>>  URB 17 going down  >>> 
-- URB_FUNCTION_BULK_OR_INTERRUPT_TRANSFER:
  PipeHandle           = 86a7978c [endpoint 0x00000002]
  TransferFlags        = 00000002 (USBD_TRANSFER_DIRECTION_OUT, USBD_SHORT_TRANSFER_OK)
  TransferBufferLength = 00000012
  TransferBuffer       = 00000000
  TransferBufferMDL    = 85b729d0
    00000000: 54 fd 64 00 00 ff 64 01 40 20 02 80 02 0a 03 0a
    00000010: 80 02
  UrbLink              = 00000000
[20155 ms] UsbSnoop - MyInternalIOCTLCompletion(b9c8f126) : fido=858b5488, Irp=8690aca0, Context=85d29868, IRQL=2
[20155 ms]  <<<  URB 17 coming back  <<< 
-- URB_FUNCTION_BULK_OR_INTERRUPT_TRANSFER:
  PipeHandle           = 86a7978c [endpoint 0x00000002]
  TransferFlags        = 00000002 (USBD_TRANSFER_DIRECTION_OUT, USBD_SHORT_TRANSFER_OK)
  TransferBufferLength = 00000012
  TransferBuffer       = 00000000
  TransferBufferMDL    = 85b729d0
  UrbLink              = 00000000
[20156 ms] UsbSnoop - FilterDispatchAny(b9c8efd2) : IRP_MJ_INTERNAL_DEVICE_CONTROL
[20156 ms] UsbSnoop - FdoHookDispatchInternalIoctl(b9c8f1ea) : fdo=858c38f8, Irp=8690aca0, IRQL=0
[20156 ms]  >>>  URB 18 going down  >>> 
-- URB_FUNCTION_BULK_OR_INTERRUPT_TRANSFER:
  PipeHandle           = 86a7978c [endpoint 0x00000002]
  TransferFlags        = 00000002 (USBD_TRANSFER_DIRECTION_OUT, USBD_SHORT_TRANSFER_OK)
  TransferBufferLength = 00000011
  TransferBuffer       = 00000000
  TransferBufferMDL    = 85b729d0
    00000000: 54 fd 64 00 80 02 64 01 40 20 03 00 01 00 03 03
    00000010: 03
  UrbLink              = 00000000
[20157 ms] UsbSnoop - MyInternalIOCTLCompletion(b9c8f126) : fido=858b5488, Irp=8690aca0, Context=85d29868, IRQL=2
[20157 ms]  <<<  URB 18 coming back  <<< 
-- URB_FUNCTION_BULK_OR_INTERRUPT_TRANSFER:
  PipeHandle           = 86a7978c [endpoint 0x00000002]
  TransferFlags        = 00000002 (USBD_TRANSFER_DIRECTION_OUT, USBD_SHORT_TRANSFER_OK)
  TransferBufferLength = 00000011
  TransferBuffer       = 00000000
  TransferBufferMDL    = 85b729d0
  UrbLink              = 00000000
[20161 ms] UsbSnoop - MyInternalIOCTLCompletion(b9c8f126) : fido=858b5488, Irp=863d86a0, Context=858bc360, IRQL=2
[20161 ms]  <<<  URB 16 coming back  <<< 
-- URB_FUNCTION_BULK_OR_INTERRUPT_TRANSFER:
  PipeHandle           = 86a7976c [endpoint 0x00000081]
  TransferFlags        = 00000003 (USBD_TRANSFER_DIRECTION_IN, USBD_SHORT_TRANSFER_OK)
  TransferBufferLength = 00000012
  TransferBuffer       = 00000000
  TransferBufferMDL    = 85cdf860
    00000000: 54 fd 64 01 00 ff 64 00 80 02 20 40 02 0a 03 0a
    00000010: 40 20
  UrbLink              = 00000000
[20161 ms] UsbSnoop - FilterDispatchAny(b9c8efd2) : IRP_MJ_INTERNAL_DEVICE_CONTROL
[20161 ms] UsbSnoop - FdoHookDispatchInternalIoctl(b9c8f1ea) : fdo=858c38f8, Irp=863d86a0, IRQL=0
[20161 ms]  >>>  URB 19 going down  >>> 
-- URB_FUNCTION_BULK_OR_INTERRUPT_TRANSFER:
  PipeHandle           = 86a7976c [endpoint 0x00000081]
  TransferFlags        = 00000003 (USBD_TRANSFER_DIRECTION_IN, USBD_SHORT_TRANSFER_OK)
  TransferBufferLength = 00000200
  TransferBuffer       = 00000000
  TransferBufferMDL    = 86ae99f0
  UrbLink              = 00000000
[20165 ms] UsbSnoop - MyInternalIOCTLCompletion(b9c8f126) : fido=858b5488, Irp=863d86a0, Context=858bc360, IRQL=2
[20165 ms]  <<<  URB 19 coming back  <<< 
-- URB_FUNCTION_BULK_OR_INTERRUPT_TRANSFER:
  PipeHandle           = 86a7976c [endpoint 0x00000081]
  TransferFlags        = 00000003 (USBD_TRANSFER_DIRECTION_IN, USBD_SHORT_TRANSFER_OK)
  TransferBufferLength = 0000001b
  TransferBuffer       = 00000000
  TransferBufferMDL    = 86ae99f0
    00000000: 54 fd 64 01 40 20 64 00 80 02 96 7f 0b 00 04 20
    00000010: 03 2e 74 6e 73 00 2e 74 6e 6f 00
  UrbLink              = 00000000
[20165 ms] UsbSnoop - FilterDispatchAny(b9c8efd2) : IRP_MJ_INTERNAL_DEVICE_CONTROL
[20165 ms] UsbSnoop - FdoHookDispatchInternalIoctl(b9c8f1ea) : fdo=858c38f8, Irp=86412858, IRQL=0
[20165 ms]  >>>  URB 20 going down  >>> 
-- URB_FUNCTION_BULK_OR_INTERRUPT_TRANSFER:
  PipeHandle           = 86a7978c [endpoint 0x00000002]
  TransferFlags        = 00000002 (USBD_TRANSFER_DIRECTION_OUT, USBD_SHORT_TRANSFER_OK)
  TransferBufferLength = 00000012
  TransferBuffer       = 00000000
  TransferBufferMDL    = 85cdf860
    00000000: 54 fd 64 00 00 ff 64 01 40 20 02 80 02 0a 04 0b
    00000010: 80 02
  UrbLink              = 00000000
[20165 ms] UsbSnoop - FilterDispatchAny(b9c8efd2) : IRP_MJ_INTERNAL_DEVICE_CONTROL
[20165 ms] UsbSnoop - FdoHookDispatchInternalIoctl(b9c8f1ea) : fdo=858c38f8, Irp=863d86a0, IRQL=0
[20165 ms]  >>>  URB 21 going down  >>> 
-- URB_FUNCTION_BULK_OR_INTERRUPT_TRANSFER:
  PipeHandle           = 86a7976c [endpoint 0x00000081]
  TransferFlags        = 00000003 (USBD_TRANSFER_DIRECTION_IN, USBD_SHORT_TRANSFER_OK)
  TransferBufferLength = 00000200
  TransferBuffer       = 00000000
  TransferBufferMDL    = 85b7dc90
  UrbLink              = 00000000
[20166 ms] UsbSnoop - MyInternalIOCTLCompletion(b9c8f126) : fido=858b5488, Irp=86412858, Context=858bc360, IRQL=2
[20166 ms]  <<<  URB 20 coming back  <<< 
-- URB_FUNCTION_BULK_OR_INTERRUPT_TRANSFER:
  PipeHandle           = 86a7978c [endpoint 0x00000002]
  TransferFlags        = 00000002 (USBD_TRANSFER_DIRECTION_OUT, USBD_SHORT_TRANSFER_OK)
  TransferBufferLength = 00000012
  TransferBuffer       = 00000000
  TransferBufferMDL    = 85cdf860
  UrbLink              = 00000000
[20166 ms] UsbSnoop - FilterDispatchAny(b9c8efd2) : IRP_MJ_INTERNAL_DEVICE_CONTROL
[20166 ms] UsbSnoop - FdoHookDispatchInternalIoctl(b9c8f1ea) : fdo=858c38f8, Irp=86412858, IRQL=0
[20166 ms]  >>>  URB 22 going down  >>> 
-- URB_FUNCTION_BULK_OR_INTERRUPT_TRANSFER:
  PipeHandle           = 86a7978c [endpoint 0x00000002]
  TransferFlags        = 00000002 (USBD_TRANSFER_DIRECTION_OUT, USBD_SHORT_TRANSFER_OK)
  TransferBufferLength = 00000012
  TransferBuffer       = 00000000
  TransferBufferMDL    = 85b729d0
    00000000: 54 fd 64 00 40 de 64 01 40 20 02 80 02 00 04 20
    00000010: 80 02
  UrbLink              = 00000000
[20168 ms] UsbSnoop - MyInternalIOCTLCompletion(b9c8f126) : fido=858b5488, Irp=86412858, Context=858bc360, IRQL=2
[20168 ms]  <<<  URB 22 coming back  <<< 
-- URB_FUNCTION_BULK_OR_INTERRUPT_TRANSFER:
  PipeHandle           = 86a7978c [endpoint 0x00000002]
  TransferFlags        = 00000002 (USBD_TRANSFER_DIRECTION_OUT, USBD_SHORT_TRANSFER_OK)
  TransferBufferLength = 00000012
  TransferBuffer       = 00000000
  TransferBufferMDL    = 85b729d0
  UrbLink              = 00000000
[20171 ms] UsbSnoop - MyInternalIOCTLCompletion(b9c8f126) : fido=858b5488, Irp=863d86a0, Context=85d29868, IRQL=2
[20171 ms]  <<<  URB 21 coming back  <<< 
-- URB_FUNCTION_BULK_OR_INTERRUPT_TRANSFER:
  PipeHandle           = 86a7976c [endpoint 0x00000081]
  TransferFlags        = 00000003 (USBD_TRANSFER_DIRECTION_IN, USBD_SHORT_TRANSFER_OK)
  TransferBufferLength = 00000012
  TransferBuffer       = 00000000
  TransferBufferMDL    = 85b7dc90
    00000000: 54 fd 64 01 00 ff 64 00 80 02 20 40 02 0a 04 0b
    00000010: 40 20
  UrbLink              = 00000000
[20171 ms] UsbSnoop - FilterDispatchAny(b9c8efd2) : IRP_MJ_INTERNAL_DEVICE_CONTROL
[20171 ms] UsbSnoop - FdoHookDispatchInternalIoctl(b9c8f1ea) : fdo=858c38f8, Irp=863d86a0, IRQL=0
[20171 ms]  >>>  URB 23 going down  >>> 
-- URB_FUNCTION_BULK_OR_INTERRUPT_TRANSFER:
  PipeHandle           = 86a7976c [endpoint 0x00000081]
  TransferFlags        = 00000003 (USBD_TRANSFER_DIRECTION_IN, USBD_SHORT_TRANSFER_OK)
  TransferBufferLength = 00000200
  TransferBuffer       = 00000000
  TransferBufferMDL    = 86ae99f0
  UrbLink              = 00000000
[27987 ms] UsbSnoop - FilterDispatchAny(b9c8efd2) : IRP_MJ_INTERNAL_DEVICE_CONTROL
[27987 ms] UsbSnoop - FdoHookDispatchInternalIoctl(b9c8f1ea) : fdo=858c38f8, Irp=85d0e7e0, IRQL=0
[27987 ms]  >>>  URB 24 going down  >>> 
-- URB_FUNCTION_BULK_OR_INTERRUPT_TRANSFER:
  PipeHandle           = 86a7978c [endpoint 0x00000002]
  TransferFlags        = 00000002 (USBD_TRANSFER_DIRECTION_OUT, USBD_SHORT_TRANSFER_OK)
  TransferBufferLength = 0000001b
  TransferBuffer       = 00000000
  TransferBufferMDL    = 868ae600
    00000000: 54 fd 64 00 80 03 64 01 40 60 0c f1 0b 00 05 4a
    00000010: 20 01 2f 00 00 00 00 00 00 00 00
  UrbLink              = 00000000
[27988 ms] UsbSnoop - MyInternalIOCTLCompletion(b9c8f126) : fido=858b5488, Irp=85d0e7e0, Context=858bc360, IRQL=2
[27988 ms]  <<<  URB 24 coming back  <<< 
-- URB_FUNCTION_BULK_OR_INTERRUPT_TRANSFER:
  PipeHandle           = 86a7978c [endpoint 0x00000002]
  TransferFlags        = 00000002 (USBD_TRANSFER_DIRECTION_OUT, USBD_SHORT_TRANSFER_OK)
  TransferBufferLength = 0000001b
  TransferBuffer       = 00000000
  TransferBufferMDL    = 868ae600
  UrbLink              = 00000000
[27989 ms] UsbSnoop - MyInternalIOCTLCompletion(b9c8f126) : fido=858b5488, Irp=863d86a0, Context=85d29868, IRQL=2
[27989 ms]  <<<  URB 23 coming back  <<< 
-- URB_FUNCTION_BULK_OR_INTERRUPT_TRANSFER:
  PipeHandle           = 86a7976c [endpoint 0x00000081]
  TransferFlags        = 00000003 (USBD_TRANSFER_DIRECTION_IN, USBD_SHORT_TRANSFER_OK)
  TransferBufferLength = 00000012
  TransferBuffer       = 00000000
  TransferBufferMDL    = 86ae99f0
    00000000: 54 fd 64 01 00 ff 64 00 80 03 60 40 02 0a 05 4d
    00000010: 40 60
  UrbLink              = 00000000
[27989 ms] UsbSnoop - FilterDispatchAny(b9c8efd2) : IRP_MJ_INTERNAL_DEVICE_CONTROL
[27989 ms] UsbSnoop - FdoHookDispatchInternalIoctl(b9c8f1ea) : fdo=858c38f8, Irp=863d86a0, IRQL=0
[27989 ms]  >>>  URB 25 going down  >>> 
-- URB_FUNCTION_BULK_OR_INTERRUPT_TRANSFER:
  PipeHandle           = 86a7976c [endpoint 0x00000081]
  TransferFlags        = 00000003 (USBD_TRANSFER_DIRECTION_IN, USBD_SHORT_TRANSFER_OK)
  TransferBufferLength = 00000200
  TransferBuffer       = 00000000
  TransferBufferMDL    = 86ae99f0
  UrbLink              = 00000000
[28000 ms] UsbSnoop - MyInternalIOCTLCompletion(b9c8f126) : fido=858b5488, Irp=863d86a0, Context=85d29868, IRQL=2
[28000 ms]  <<<  URB 25 coming back  <<< 
-- URB_FUNCTION_BULK_OR_INTERRUPT_TRANSFER:
  PipeHandle           = 86a7976c [endpoint 0x00000081]
  TransferFlags        = 00000003 (USBD_TRANSFER_DIRECTION_IN, USBD_SHORT_TRANSFER_OK)
  TransferBufferLength = 0000001b
  TransferBuffer       = 00000000
  TransferBufferMDL    = 86ae99f0
    00000000: 54 fd 64 01 40 60 64 00 80 03 f7 38 0b 00 05 7c
    00000010: 20 00 00 00 00 00 00 00 00 01 00
  UrbLink              = 00000000
[28000 ms] UsbSnoop - FilterDispatchAny(b9c8efd2) : IRP_MJ_INTERNAL_DEVICE_CONTROL
[28000 ms] UsbSnoop - FdoHookDispatchInternalIoctl(b9c8f1ea) : fdo=858c38f8, Irp=85b8ee70, IRQL=0
[28000 ms]  >>>  URB 26 going down  >>> 
-- URB_FUNCTION_BULK_OR_INTERRUPT_TRANSFER:
  PipeHandle           = 86a7976c [endpoint 0x00000081]
  TransferFlags        = 00000003 (USBD_TRANSFER_DIRECTION_IN, USBD_SHORT_TRANSFER_OK)
  TransferBufferLength = 00000200
  TransferBuffer       = 00000000
  TransferBufferMDL    = 85b959d0
  UrbLink              = 00000000
[28000 ms] UsbSnoop - FilterDispatchAny(b9c8efd2) : IRP_MJ_INTERNAL_DEVICE_CONTROL
[28000 ms] UsbSnoop - FdoHookDispatchInternalIoctl(b9c8f1ea) : fdo=858c38f8, Irp=863d86a0, IRQL=0
[28000 ms]  >>>  URB 27 going down  >>> 
-- URB_FUNCTION_BULK_OR_INTERRUPT_TRANSFER:
  PipeHandle           = 86a7978c [endpoint 0x00000002]
  TransferFlags        = 00000002 (USBD_TRANSFER_DIRECTION_OUT, USBD_SHORT_TRANSFER_OK)
  TransferBufferLength = 00000012
  TransferBuffer       = 00000000
  TransferBufferMDL    = 85e63d10
    00000000: 54 fd 64 00 00 ff 64 01 40 60 03 80 02 0a 05 4d
    00000010: 80 03
  UrbLink              = 00000000
[28001 ms] UsbSnoop - MyInternalIOCTLCompletion(b9c8f126) : fido=858b5488, Irp=863d86a0, Context=858bc360, IRQL=2
[28001 ms]  <<<  URB 27 coming back  <<< 
-- URB_FUNCTION_BULK_OR_INTERRUPT_TRANSFER:
  PipeHandle           = 86a7978c [endpoint 0x00000002]
  TransferFlags        = 00000002 (USBD_TRANSFER_DIRECTION_OUT, USBD_SHORT_TRANSFER_OK)
  TransferBufferLength = 00000012
  TransferBuffer       = 00000000
  TransferBufferMDL    = 85e63d10
  UrbLink              = 00000000
[28003 ms] UsbSnoop - FilterDispatchAny(b9c8efd2) : IRP_MJ_INTERNAL_DEVICE_CONTROL
[28003 ms] UsbSnoop - FdoHookDispatchInternalIoctl(b9c8f1ea) : fdo=858c38f8, Irp=85afecb0, IRQL=0
[28003 ms]  >>>  URB 28 going down  >>> 
-- URB_FUNCTION_BULK_OR_INTERRUPT_TRANSFER:
  PipeHandle           = 86a7978c [endpoint 0x00000002]
  TransferFlags        = 00000002 (USBD_TRANSFER_DIRECTION_OUT, USBD_SHORT_TRANSFER_OK)
  TransferBufferLength = 00000012
  TransferBuffer       = 00000000
  TransferBufferMDL    = 85cdf860
    00000000: 54 fd 64 00 40 de 64 01 40 60 03 80 02 00 06 63
    00000010: 80 03
  UrbLink              = 00000000
[28003 ms] UsbSnoop - MyInternalIOCTLCompletion(b9c8f126) : fido=858b5488, Irp=85afecb0, Context=858bc360, IRQL=2
[28003 ms]  <<<  URB 28 coming back  <<< 
-- URB_FUNCTION_BULK_OR_INTERRUPT_TRANSFER:
  PipeHandle           = 86a7978c [endpoint 0x00000002]
  TransferFlags        = 00000002 (USBD_TRANSFER_DIRECTION_OUT, USBD_SHORT_TRANSFER_OK)
  TransferBufferLength = 00000012
  TransferBuffer       = 00000000
  TransferBufferMDL    = 85cdf860
  UrbLink              = 00000000
[28006 ms] UsbSnoop - MyInternalIOCTLCompletion(b9c8f126) : fido=858b5488, Irp=85b8ee70, Context=85d29868, IRQL=2
[28006 ms]  <<<  URB 26 coming back  <<< 
-- URB_FUNCTION_BULK_OR_INTERRUPT_TRANSFER:
  PipeHandle           = 86a7976c [endpoint 0x00000081]
  TransferFlags        = 00000003 (USBD_TRANSFER_DIRECTION_IN, USBD_SHORT_TRANSFER_OK)
  TransferBufferLength = 00000012
  TransferBuffer       = 00000000
  TransferBufferMDL    = 85b959d0
    00000000: 54 fd 64 01 00 ff 64 00 80 03 60 40 02 0a 06 4e
    00000010: 40 60
  UrbLink              = 00000000
[28006 ms] UsbSnoop - FilterDispatchAny(b9c8efd2) : IRP_MJ_INTERNAL_DEVICE_CONTROL
[28006 ms] UsbSnoop - FdoHookDispatchInternalIoctl(b9c8f1ea) : fdo=858c38f8, Irp=85b8ee70, IRQL=0
[28006 ms]  >>>  URB 29 going down  >>> 
-- URB_FUNCTION_BULK_OR_INTERRUPT_TRANSFER:
  PipeHandle           = 86a7976c [endpoint 0x00000081]
  TransferFlags        = 00000003 (USBD_TRANSFER_DIRECTION_IN, USBD_SHORT_TRANSFER_OK)
  TransferBufferLength = 00000200
  TransferBuffer       = 00000000
  TransferBufferMDL    = 85b959d0
  UrbLink              = 00000000
[28009 ms] UsbSnoop - FilterDispatchAny(b9c8efd2) : IRP_MJ_INTERNAL_DEVICE_CONTROL
[28009 ms] UsbSnoop - FdoHookDispatchInternalIoctl(b9c8f1ea) : fdo=858c38f8, Irp=85d0e7e0, IRQL=0
[28009 ms]  >>>  URB 30 going down  >>> 
-- URB_FUNCTION_BULK_OR_INTERRUPT_TRANSFER:
  PipeHandle           = 86a7978c [endpoint 0x00000002]
  TransferFlags        = 00000002 (USBD_TRANSFER_DIRECTION_OUT, USBD_SHORT_TRANSFER_OK)
  TransferBufferLength = 0000001a
  TransferBuffer       = 00000000
  TransferBufferMDL    = 85b7dc90
    00000000: 54 fd 64 00 80 04 64 01 40 60 c0 aa 0a 00 07 b9
    00000010: 0d 2f 00 00 00 00 00 00 00 00
  UrbLink              = 00000000
[28010 ms] UsbSnoop - MyInternalIOCTLCompletion(b9c8f126) : fido=858b5488, Irp=85d0e7e0, Context=858bc360, IRQL=2
[28010 ms]  <<<  URB 30 coming back  <<< 
-- URB_FUNCTION_BULK_OR_INTERRUPT_TRANSFER:
  PipeHandle           = 86a7978c [endpoint 0x00000002]
  TransferFlags        = 00000002 (USBD_TRANSFER_DIRECTION_OUT, USBD_SHORT_TRANSFER_OK)
  TransferBufferLength = 0000001a
  TransferBuffer       = 00000000
  TransferBufferMDL    = 85b7dc90
  UrbLink              = 00000000
[28011 ms] UsbSnoop - MyInternalIOCTLCompletion(b9c8f126) : fido=858b5488, Irp=85b8ee70, Context=85d29868, IRQL=2
[28011 ms]  <<<  URB 29 coming back  <<< 
-- URB_FUNCTION_BULK_OR_INTERRUPT_TRANSFER:
  PipeHandle           = 86a7976c [endpoint 0x00000081]
  TransferFlags        = 00000003 (USBD_TRANSFER_DIRECTION_IN, USBD_SHORT_TRANSFER_OK)
  TransferBufferLength = 00000012
  TransferBuffer       = 00000000
  TransferBufferMDL    = 85b959d0
    00000000: 54 fd 64 01 00 ff 64 00 80 04 60 40 02 0a 07 50
    00000010: 40 60
  UrbLink              = 00000000
[28011 ms] UsbSnoop - FilterDispatchAny(b9c8efd2) : IRP_MJ_INTERNAL_DEVICE_CONTROL
[28011 ms] UsbSnoop - FdoHookDispatchInternalIoctl(b9c8f1ea) : fdo=858c38f8, Irp=85b8ee70, IRQL=0
[28011 ms]  >>>  URB 31 going down  >>> 
-- URB_FUNCTION_BULK_OR_INTERRUPT_TRANSFER:
  PipeHandle           = 86a7976c [endpoint 0x00000081]
  TransferFlags        = 00000003 (USBD_TRANSFER_DIRECTION_IN, USBD_SHORT_TRANSFER_OK)
  TransferBufferLength = 00000200
  TransferBuffer       = 00000000
  TransferBufferMDL    = 85b959d0
  UrbLink              = 00000000
[28022 ms] UsbSnoop - MyInternalIOCTLCompletion(b9c8f126) : fido=858b5488, Irp=85b8ee70, Context=85d29868, IRQL=2
[28022 ms]  <<<  URB 31 coming back  <<< 
-- URB_FUNCTION_BULK_OR_INTERRUPT_TRANSFER:
  PipeHandle           = 86a7976c [endpoint 0x00000081]
  TransferFlags        = 00000003 (USBD_TRANSFER_DIRECTION_IN, USBD_SHORT_TRANSFER_OK)
  TransferBufferLength = 00000012
  TransferBuffer       = 00000000
  TransferBufferMDL    = 85b959d0
    00000000: 54 fd 64 01 40 60 64 00 80 04 00 ff 02 00 06 45
    00000010: ff 00
  UrbLink              = 00000000
[28022 ms] UsbSnoop - FilterDispatchAny(b9c8efd2) : IRP_MJ_INTERNAL_DEVICE_CONTROL
[28022 ms] UsbSnoop - FdoHookDispatchInternalIoctl(b9c8f1ea) : fdo=858c38f8, Irp=85b8ee70, IRQL=0
[28022 ms]  >>>  URB 32 going down  >>> 
-- URB_FUNCTION_BULK_OR_INTERRUPT_TRANSFER:
  PipeHandle           = 86a7976c [endpoint 0x00000081]
  TransferFlags        = 00000003 (USBD_TRANSFER_DIRECTION_IN, USBD_SHORT_TRANSFER_OK)
  TransferBufferLength = 00000200
  TransferBuffer       = 00000000
  TransferBufferMDL    = 85b959d0
  UrbLink              = 00000000
[28022 ms] UsbSnoop - FilterDispatchAny(b9c8efd2) : IRP_MJ_INTERNAL_DEVICE_CONTROL
[28022 ms] UsbSnoop - FdoHookDispatchInternalIoctl(b9c8f1ea) : fdo=858c38f8, Irp=85e2a868, IRQL=0
[28022 ms]  >>>  URB 33 going down  >>> 
-- URB_FUNCTION_BULK_OR_INTERRUPT_TRANSFER:
  PipeHandle           = 86a7978c [endpoint 0x00000002]
  TransferFlags        = 00000002 (USBD_TRANSFER_DIRECTION_OUT, USBD_SHORT_TRANSFER_OK)
  TransferBufferLength = 00000012
  TransferBuffer       = 00000000
  TransferBufferMDL    = 85b729d0
    00000000: 54 fd 64 00 00 ff 64 01 40 60 04 80 02 0a 06 4f
    00000010: 80 04
  UrbLink              = 00000000
[28023 ms] UsbSnoop - MyInternalIOCTLCompletion(b9c8f126) : fido=858b5488, Irp=85e2a868, Context=858bc360, IRQL=2
[28023 ms]  <<<  URB 33 coming back  <<< 
-- URB_FUNCTION_BULK_OR_INTERRUPT_TRANSFER:
  PipeHandle           = 86a7978c [endpoint 0x00000002]
  TransferFlags        = 00000002 (USBD_TRANSFER_DIRECTION_OUT, USBD_SHORT_TRANSFER_OK)
  TransferBufferLength = 00000012
  TransferBuffer       = 00000000
  TransferBufferMDL    = 85b729d0
  UrbLink              = 00000000
[28024 ms] UsbSnoop - FilterDispatchAny(b9c8efd2) : IRP_MJ_INTERNAL_DEVICE_CONTROL
[28024 ms] UsbSnoop - FdoHookDispatchInternalIoctl(b9c8f1ea) : fdo=858c38f8, Irp=85b6ccb8, IRQL=0
[28024 ms]  >>>  URB 34 going down  >>> 
-- URB_FUNCTION_BULK_OR_INTERRUPT_TRANSFER:
  PipeHandle           = 86a7978c [endpoint 0x00000002]
  TransferFlags        = 00000002 (USBD_TRANSFER_DIRECTION_OUT, USBD_SHORT_TRANSFER_OK)
  TransferBufferLength = 00000011
  TransferBuffer       = 00000000
  TransferBufferMDL    = 85c767c8
    00000000: 54 fd 64 00 80 04 64 01 40 60 0e 00 01 00 08 55
    00000010: 0e
  UrbLink              = 00000000
[28025 ms] UsbSnoop - MyInternalIOCTLCompletion(b9c8f126) : fido=858b5488, Irp=85b6ccb8, Context=858bc360, IRQL=2
[28025 ms]  <<<  URB 34 coming back  <<< 
-- URB_FUNCTION_BULK_OR_INTERRUPT_TRANSFER:
  PipeHandle           = 86a7978c [endpoint 0x00000002]
  TransferFlags        = 00000002 (USBD_TRANSFER_DIRECTION_OUT, USBD_SHORT_TRANSFER_OK)
  TransferBufferLength = 00000011
  TransferBuffer       = 00000000
  TransferBufferMDL    = 85c767c8
  UrbLink              = 00000000
[28028 ms] UsbSnoop - MyInternalIOCTLCompletion(b9c8f126) : fido=858b5488, Irp=85b8ee70, Context=85d29868, IRQL=2
[28028 ms]  <<<  URB 32 coming back  <<< 
-- URB_FUNCTION_BULK_OR_INTERRUPT_TRANSFER:
  PipeHandle           = 86a7976c [endpoint 0x00000081]
  TransferFlags        = 00000003 (USBD_TRANSFER_DIRECTION_IN, USBD_SHORT_TRANSFER_OK)
  TransferBufferLength = 00000012
  TransferBuffer       = 00000000
  TransferBufferMDL    = 85b959d0
    00000000: 54 fd 64 01 00 ff 64 00 80 04 60 40 02 0a 08 51
    00000010: 40 60
  UrbLink              = 00000000
[28028 ms] UsbSnoop - FilterDispatchAny(b9c8efd2) : IRP_MJ_INTERNAL_DEVICE_CONTROL
[28028 ms] UsbSnoop - FdoHookDispatchInternalIoctl(b9c8f1ea) : fdo=858c38f8, Irp=85b8ee70, IRQL=0
[28028 ms]  >>>  URB 35 going down  >>> 
-- URB_FUNCTION_BULK_OR_INTERRUPT_TRANSFER:
  PipeHandle           = 86a7976c [endpoint 0x00000081]
  TransferFlags        = 00000003 (USBD_TRANSFER_DIRECTION_IN, USBD_SHORT_TRANSFER_OK)
  TransferBufferLength = 00000200
  TransferBuffer       = 00000000
  TransferBufferMDL    = 85b959d0
  UrbLink              = 00000000
[28035 ms] UsbSnoop - MyInternalIOCTLCompletion(b9c8f126) : fido=858b5488, Irp=85b8ee70, Context=85d29868, IRQL=2
[28035 ms]  <<<  URB 35 coming back  <<< 
-- URB_FUNCTION_BULK_OR_INTERRUPT_TRANSFER:
  PipeHandle           = 86a7976c [endpoint 0x00000081]
  TransferFlags        = 00000003 (USBD_TRANSFER_DIRECTION_IN, USBD_SHORT_TRANSFER_OK)
  TransferBufferLength = 00000026
  TransferBuffer       = 00000000
  TransferBufferMDL    = 85b959d0
    00000000: 54 fd 64 01 40 60 64 00 80 04 d0 9f 16 00 07 ca
    00000010: 10 00 13 46 6f 6c 64 65 72 31 00 00 00 00 00 00
    00000020: 00 00 0d b1 01 00
  UrbLink              = 00000000
[28035 ms] UsbSnoop - FilterDispatchAny(b9c8efd2) : IRP_MJ_INTERNAL_DEVICE_CONTROL
[28035 ms] UsbSnoop - FdoHookDispatchInternalIoctl(b9c8f1ea) : fdo=858c38f8, Irp=85b8ee70, IRQL=0
[28035 ms]  >>>  URB 36 going down  >>> 
-- URB_FUNCTION_BULK_OR_INTERRUPT_TRANSFER:
  PipeHandle           = 86a7976c [endpoint 0x00000081]
  TransferFlags        = 00000003 (USBD_TRANSFER_DIRECTION_IN, USBD_SHORT_TRANSFER_OK)
  TransferBufferLength = 00000200
  TransferBuffer       = 00000000
  TransferBufferMDL    = 85b959d0
  UrbLink              = 00000000
[28035 ms] UsbSnoop - FilterDispatchAny(b9c8efd2) : IRP_MJ_INTERNAL_DEVICE_CONTROL
[28035 ms] UsbSnoop - FdoHookDispatchInternalIoctl(b9c8f1ea) : fdo=858c38f8, Irp=85d1b7e0, IRQL=0
[28035 ms]  >>>  URB 37 going down  >>> 
-- URB_FUNCTION_BULK_OR_INTERRUPT_TRANSFER:
  PipeHandle           = 86a7978c [endpoint 0x00000002]
  TransferFlags        = 00000002 (USBD_TRANSFER_DIRECTION_OUT, USBD_SHORT_TRANSFER_OK)
  TransferBufferLength = 00000012
  TransferBuffer       = 00000000
  TransferBufferMDL    = 85b8fa50
    00000000: 54 fd 64 00 00 ff 64 01 40 60 04 80 02 0a 07 50
    00000010: 80 04
  UrbLink              = 00000000
[28036 ms] UsbSnoop - MyInternalIOCTLCompletion(b9c8f126) : fido=858b5488, Irp=85d1b7e0, Context=858bc360, IRQL=2
[28036 ms]  <<<  URB 37 coming back  <<< 
-- URB_FUNCTION_BULK_OR_INTERRUPT_TRANSFER:
  PipeHandle           = 86a7978c [endpoint 0x00000002]
  TransferFlags        = 00000002 (USBD_TRANSFER_DIRECTION_OUT, USBD_SHORT_TRANSFER_OK)
  TransferBufferLength = 00000012
  TransferBuffer       = 00000000
  TransferBufferMDL    = 85b8fa50
  UrbLink              = 00000000
[28038 ms] UsbSnoop - FilterDispatchAny(b9c8efd2) : IRP_MJ_INTERNAL_DEVICE_CONTROL
[28038 ms] UsbSnoop - FdoHookDispatchInternalIoctl(b9c8f1ea) : fdo=858c38f8, Irp=85d1b7e0, IRQL=0
[28038 ms]  >>>  URB 38 going down  >>> 
-- URB_FUNCTION_BULK_OR_INTERRUPT_TRANSFER:
  PipeHandle           = 86a7978c [endpoint 0x00000002]
  TransferFlags        = 00000002 (USBD_TRANSFER_DIRECTION_OUT, USBD_SHORT_TRANSFER_OK)
  TransferBufferLength = 00000011
  TransferBuffer       = 00000000
  TransferBufferMDL    = 85b8fa50
    00000000: 54 fd 64 00 80 04 64 01 40 60 0e 00 01 00 09 56
    00000010: 0e
  UrbLink              = 00000000
[28038 ms] UsbSnoop - MyInternalIOCTLCompletion(b9c8f126) : fido=858b5488, Irp=85d1b7e0, Context=858bc360, IRQL=2
[28038 ms]  <<<  URB 38 coming back  <<< 
-- URB_FUNCTION_BULK_OR_INTERRUPT_TRANSFER:
  PipeHandle           = 86a7978c [endpoint 0x00000002]
  TransferFlags        = 00000002 (USBD_TRANSFER_DIRECTION_OUT, USBD_SHORT_TRANSFER_OK)
  TransferBufferLength = 00000011
  TransferBuffer       = 00000000
  TransferBufferMDL    = 85b8fa50
  UrbLink              = 00000000
[28041 ms] UsbSnoop - MyInternalIOCTLCompletion(b9c8f126) : fido=858b5488, Irp=85b8ee70, Context=85d29868, IRQL=2
[28041 ms]  <<<  URB 36 coming back  <<< 
-- URB_FUNCTION_BULK_OR_INTERRUPT_TRANSFER:
  PipeHandle           = 86a7976c [endpoint 0x00000081]
  TransferFlags        = 00000003 (USBD_TRANSFER_DIRECTION_IN, USBD_SHORT_TRANSFER_OK)
  TransferBufferLength = 00000012
  TransferBuffer       = 00000000
  TransferBufferMDL    = 85b959d0
    00000000: 54 fd 64 01 00 ff 64 00 80 04 60 40 02 0a 09 52
    00000010: 40 60
  UrbLink              = 00000000
[28041 ms] UsbSnoop - FilterDispatchAny(b9c8efd2) : IRP_MJ_INTERNAL_DEVICE_CONTROL
[28041 ms] UsbSnoop - FdoHookDispatchInternalIoctl(b9c8f1ea) : fdo=858c38f8, Irp=85d1b7e0, IRQL=0
[28041 ms]  >>>  URB 39 going down  >>> 
-- URB_FUNCTION_BULK_OR_INTERRUPT_TRANSFER:
  PipeHandle           = 86a7976c [endpoint 0x00000081]
  TransferFlags        = 00000003 (USBD_TRANSFER_DIRECTION_IN, USBD_SHORT_TRANSFER_OK)
  TransferBufferLength = 00000200
  TransferBuffer       = 00000000
  TransferBufferMDL    = 85b959d0
  UrbLink              = 00000000
[28045 ms] UsbSnoop - MyInternalIOCTLCompletion(b9c8f126) : fido=858b5488, Irp=85d1b7e0, Context=85d29868, IRQL=2
[28045 ms]  <<<  URB 39 coming back  <<< 
-- URB_FUNCTION_BULK_OR_INTERRUPT_TRANSFER:
  PipeHandle           = 86a7976c [endpoint 0x00000081]
  TransferFlags        = 00000003 (USBD_TRANSFER_DIRECTION_IN, USBD_SHORT_TRANSFER_OK)
  TransferBufferLength = 00000012
  TransferBuffer       = 00000000
  TransferBufferMDL    = 85b959d0
    00000000: 54 fd 64 01 40 60 64 00 80 04 11 ff 02 00 08 58
    00000010: ff 11
  UrbLink              = 00000000
[28045 ms] UsbSnoop - FilterDispatchAny(b9c8efd2) : IRP_MJ_INTERNAL_DEVICE_CONTROL
[28045 ms] UsbSnoop - FdoHookDispatchInternalIoctl(b9c8f1ea) : fdo=858c38f8, Irp=85d1b7e0, IRQL=0
[28045 ms]  >>>  URB 40 going down  >>> 
-- URB_FUNCTION_BULK_OR_INTERRUPT_TRANSFER:
  PipeHandle           = 86a7976c [endpoint 0x00000081]
  TransferFlags        = 00000003 (USBD_TRANSFER_DIRECTION_IN, USBD_SHORT_TRANSFER_OK)
  TransferBufferLength = 00000200
  TransferBuffer       = 00000000
  TransferBufferMDL    = 85b959d0
  UrbLink              = 00000000
[28045 ms] UsbSnoop - FilterDispatchAny(b9c8efd2) : IRP_MJ_INTERNAL_DEVICE_CONTROL
[28045 ms] UsbSnoop - FdoHookDispatchInternalIoctl(b9c8f1ea) : fdo=858c38f8, Irp=85b11cb0, IRQL=0
[28045 ms]  >>>  URB 41 going down  >>> 
-- URB_FUNCTION_BULK_OR_INTERRUPT_TRANSFER:
  PipeHandle           = 86a7978c [endpoint 0x00000002]
  TransferFlags        = 00000002 (USBD_TRANSFER_DIRECTION_OUT, USBD_SHORT_TRANSFER_OK)
  TransferBufferLength = 00000012
  TransferBuffer       = 00000000
  TransferBufferMDL    = 866688b8
    00000000: 54 fd 64 00 00 ff 64 01 40 60 04 80 02 0a 08 51
    00000010: 80 04
  UrbLink              = 00000000
[28046 ms] UsbSnoop - MyInternalIOCTLCompletion(b9c8f126) : fido=858b5488, Irp=85b11cb0, Context=858bc360, IRQL=2
[28046 ms]  <<<  URB 41 coming back  <<< 
-- URB_FUNCTION_BULK_OR_INTERRUPT_TRANSFER:
  PipeHandle           = 86a7978c [endpoint 0x00000002]
  TransferFlags        = 00000002 (USBD_TRANSFER_DIRECTION_OUT, USBD_SHORT_TRANSFER_OK)
  TransferBufferLength = 00000012
  TransferBuffer       = 00000000
  TransferBufferMDL    = 866688b8
  UrbLink              = 00000000
[28046 ms] UsbSnoop - FilterDispatchAny(b9c8efd2) : IRP_MJ_INTERNAL_DEVICE_CONTROL
[28046 ms] UsbSnoop - FdoHookDispatchInternalIoctl(b9c8f1ea) : fdo=858c38f8, Irp=85b8ee70, IRQL=0
[28046 ms]  >>>  URB 42 going down  >>> 
-- URB_FUNCTION_BULK_OR_INTERRUPT_TRANSFER:
  PipeHandle           = 86a7978c [endpoint 0x00000002]
  TransferFlags        = 00000002 (USBD_TRANSFER_DIRECTION_OUT, USBD_SHORT_TRANSFER_OK)
  TransferBufferLength = 00000011
  TransferBuffer       = 00000000
  TransferBufferMDL    = 86a85d30
    00000000: 54 fd 64 00 80 04 64 01 40 60 0f 00 01 00 0a 58
    00000010: 0f
  UrbLink              = 00000000
[28048 ms] UsbSnoop - MyInternalIOCTLCompletion(b9c8f126) : fido=858b5488, Irp=85b8ee70, Context=858bc360, IRQL=2
[28048 ms]  <<<  URB 42 coming back  <<< 
-- URB_FUNCTION_BULK_OR_INTERRUPT_TRANSFER:
  PipeHandle           = 86a7978c [endpoint 0x00000002]
  TransferFlags        = 00000002 (USBD_TRANSFER_DIRECTION_OUT, USBD_SHORT_TRANSFER_OK)
  TransferBufferLength = 00000011
  TransferBuffer       = 00000000
  TransferBufferMDL    = 86a85d30
  UrbLink              = 00000000
[28051 ms] UsbSnoop - MyInternalIOCTLCompletion(b9c8f126) : fido=858b5488, Irp=85d1b7e0, Context=85d29868, IRQL=2
[28051 ms]  <<<  URB 40 coming back  <<< 
-- URB_FUNCTION_BULK_OR_INTERRUPT_TRANSFER:
  PipeHandle           = 86a7976c [endpoint 0x00000081]
  TransferFlags        = 00000003 (USBD_TRANSFER_DIRECTION_IN, USBD_SHORT_TRANSFER_OK)
  TransferBufferLength = 00000012
  TransferBuffer       = 00000000
  TransferBufferMDL    = 85b959d0
    00000000: 54 fd 64 01 00 ff 64 00 80 04 60 40 02 0a 0a 53
    00000010: 40 60
  UrbLink              = 00000000
[28051 ms] UsbSnoop - FilterDispatchAny(b9c8efd2) : IRP_MJ_INTERNAL_DEVICE_CONTROL
[28051 ms] UsbSnoop - FdoHookDispatchInternalIoctl(b9c8f1ea) : fdo=858c38f8, Irp=85b11cb0, IRQL=0
[28051 ms]  >>>  URB 43 going down  >>> 
-- URB_FUNCTION_BULK_OR_INTERRUPT_TRANSFER:
  PipeHandle           = 86a7976c [endpoint 0x00000081]
  TransferFlags        = 00000003 (USBD_TRANSFER_DIRECTION_IN, USBD_SHORT_TRANSFER_OK)
  TransferBufferLength = 00000200
  TransferBuffer       = 00000000
  TransferBufferMDL    = 85b959d0
  UrbLink              = 00000000
[28055 ms] UsbSnoop - MyInternalIOCTLCompletion(b9c8f126) : fido=858b5488, Irp=85b11cb0, Context=85d29868, IRQL=2
[28055 ms]  <<<  URB 43 coming back  <<< 
-- URB_FUNCTION_BULK_OR_INTERRUPT_TRANSFER:
  PipeHandle           = 86a7976c [endpoint 0x00000081]
  TransferFlags        = 00000003 (USBD_TRANSFER_DIRECTION_IN, USBD_SHORT_TRANSFER_OK)
  TransferBufferLength = 00000012
  TransferBuffer       = 00000000
  TransferBufferMDL    = 85b959d0
    00000000: 54 fd 64 01 40 60 64 00 80 04 00 ff 02 00 09 48
    00000010: ff 00
  UrbLink              = 00000000
[28055 ms] UsbSnoop - FilterDispatchAny(b9c8efd2) : IRP_MJ_INTERNAL_DEVICE_CONTROL
[28055 ms] UsbSnoop - FdoHookDispatchInternalIoctl(b9c8f1ea) : fdo=858c38f8, Irp=85b11cb0, IRQL=0
[28055 ms]  >>>  URB 44 going down  >>> 
-- URB_FUNCTION_BULK_OR_INTERRUPT_TRANSFER:
  PipeHandle           = 86a7976c [endpoint 0x00000081]
  TransferFlags        = 00000003 (USBD_TRANSFER_DIRECTION_IN, USBD_SHORT_TRANSFER_OK)
  TransferBufferLength = 00000200
  TransferBuffer       = 00000000
  TransferBufferMDL    = 85b959d0
  UrbLink              = 00000000
[28055 ms] UsbSnoop - FilterDispatchAny(b9c8efd2) : IRP_MJ_INTERNAL_DEVICE_CONTROL
[28055 ms] UsbSnoop - FdoHookDispatchInternalIoctl(b9c8f1ea) : fdo=858c38f8, Irp=85b8ee70, IRQL=0
[28055 ms]  >>>  URB 45 going down  >>> 
-- URB_FUNCTION_BULK_OR_INTERRUPT_TRANSFER:
  PipeHandle           = 86a7978c [endpoint 0x00000002]
  TransferFlags        = 00000002 (USBD_TRANSFER_DIRECTION_OUT, USBD_SHORT_TRANSFER_OK)
  TransferBufferLength = 00000012
  TransferBuffer       = 00000000
  TransferBufferMDL    = 868708f8
    00000000: 54 fd 64 00 00 ff 64 01 40 60 04 80 02 0a 09 52
    00000010: 80 04
  UrbLink              = 00000000
[28056 ms] UsbSnoop - MyInternalIOCTLCompletion(b9c8f126) : fido=858b5488, Irp=85b8ee70, Context=858bc360, IRQL=2
[28056 ms]  <<<  URB 45 coming back  <<< 
-- URB_FUNCTION_BULK_OR_INTERRUPT_TRANSFER:
  PipeHandle           = 86a7978c [endpoint 0x00000002]
  TransferFlags        = 00000002 (USBD_TRANSFER_DIRECTION_OUT, USBD_SHORT_TRANSFER_OK)
  TransferBufferLength = 00000012
  TransferBuffer       = 00000000
  TransferBufferMDL    = 868708f8
  UrbLink              = 00000000
[28057 ms] UsbSnoop - FilterDispatchAny(b9c8efd2) : IRP_MJ_INTERNAL_DEVICE_CONTROL
[28057 ms] UsbSnoop - FdoHookDispatchInternalIoctl(b9c8f1ea) : fdo=858c38f8, Irp=85b07cb0, IRQL=0
[28057 ms]  >>>  URB 46 going down  >>> 
-- URB_FUNCTION_BULK_OR_INTERRUPT_TRANSFER:
  PipeHandle           = 86a7978c [endpoint 0x00000002]
  TransferFlags        = 00000002 (USBD_TRANSFER_DIRECTION_OUT, USBD_SHORT_TRANSFER_OK)
  TransferBufferLength = 00000012
  TransferBuffer       = 00000000
  TransferBufferMDL    = 86b38290
    00000000: 54 fd 64 00 40 de 64 01 40 60 04 80 02 00 0b 69
    00000010: 80 04
  UrbLink              = 00000000
[28058 ms] UsbSnoop - MyInternalIOCTLCompletion(b9c8f126) : fido=858b5488, Irp=85b07cb0, Context=858bc360, IRQL=2
[28058 ms]  <<<  URB 46 coming back  <<< 
-- URB_FUNCTION_BULK_OR_INTERRUPT_TRANSFER:
  PipeHandle           = 86a7978c [endpoint 0x00000002]
  TransferFlags        = 00000002 (USBD_TRANSFER_DIRECTION_OUT, USBD_SHORT_TRANSFER_OK)
  TransferBufferLength = 00000012
  TransferBuffer       = 00000000
  TransferBufferMDL    = 86b38290
  UrbLink              = 00000000
[28061 ms] UsbSnoop - MyInternalIOCTLCompletion(b9c8f126) : fido=858b5488, Irp=85b11cb0, Context=85d29868, IRQL=2
[28061 ms]  <<<  URB 44 coming back  <<< 
-- URB_FUNCTION_BULK_OR_INTERRUPT_TRANSFER:
  PipeHandle           = 86a7976c [endpoint 0x00000081]
  TransferFlags        = 00000003 (USBD_TRANSFER_DIRECTION_IN, USBD_SHORT_TRANSFER_OK)
  TransferBufferLength = 00000012
  TransferBuffer       = 00000000
  TransferBufferMDL    = 85b959d0
    00000000: 54 fd 64 01 00 ff 64 00 80 04 60 40 02 0a 0b 54
    00000010: 40 60
  UrbLink              = 00000000
[28061 ms] UsbSnoop - FilterDispatchAny(b9c8efd2) : IRP_MJ_INTERNAL_DEVICE_CONTROL
[28061 ms] UsbSnoop - FdoHookDispatchInternalIoctl(b9c8f1ea) : fdo=858c38f8, Irp=85b8ee70, IRQL=0
[28061 ms]  >>>  URB 47 going down  >>> 
-- URB_FUNCTION_BULK_OR_INTERRUPT_TRANSFER:
  PipeHandle           = 86a7976c [endpoint 0x00000081]
  TransferFlags        = 00000003 (USBD_TRANSFER_DIRECTION_IN, USBD_SHORT_TRANSFER_OK)
  TransferBufferLength = 00000200
  TransferBuffer       = 00000000
  TransferBufferMDL    = 85b959d0
  UrbLink              = 00000000
[28112 ms] UsbSnoop - FilterDispatchAny(b9c8efd2) : IRP_MJ_INTERNAL_DEVICE_CONTROL
[28112 ms] UsbSnoop - FdoHookDispatchInternalIoctl(b9c8f1ea) : fdo=858c38f8, Irp=85b6ccb8, IRQL=0
[28112 ms]  >>>  URB 48 going down  >>> 
-- URB_FUNCTION_BULK_OR_INTERRUPT_TRANSFER:
  PipeHandle           = 86a7978c [endpoint 0x00000002]
  TransferFlags        = 00000002 (USBD_TRANSFER_DIRECTION_OUT, USBD_SHORT_TRANSFER_OK)
  TransferBufferLength = 0000001b
  TransferBuffer       = 00000000
  TransferBufferMDL    = 86ae6150
    00000000: 54 fd 64 00 80 05 64 01 40 60 0c f1 0b 00 0c 53
    00000010: 20 01 2f 00 00 00 00 00 00 00 00
  UrbLink              = 00000000
[28113 ms] UsbSnoop - MyInternalIOCTLCompletion(b9c8f126) : fido=858b5488, Irp=85b6ccb8, Context=858bc360, IRQL=2
[28113 ms]  <<<  URB 48 coming back  <<< 
-- URB_FUNCTION_BULK_OR_INTERRUPT_TRANSFER:
  PipeHandle           = 86a7978c [endpoint 0x00000002]
  TransferFlags        = 00000002 (USBD_TRANSFER_DIRECTION_OUT, USBD_SHORT_TRANSFER_OK)
  TransferBufferLength = 0000001b
  TransferBuffer       = 00000000
  TransferBufferMDL    = 86ae6150
  UrbLink              = 00000000
[28114 ms] UsbSnoop - MyInternalIOCTLCompletion(b9c8f126) : fido=858b5488, Irp=85b8ee70, Context=85d29868, IRQL=2
[28114 ms]  <<<  URB 47 coming back  <<< 
-- URB_FUNCTION_BULK_OR_INTERRUPT_TRANSFER:
  PipeHandle           = 86a7976c [endpoint 0x00000081]
  TransferFlags        = 00000003 (USBD_TRANSFER_DIRECTION_IN, USBD_SHORT_TRANSFER_OK)
  TransferBufferLength = 00000012
  TransferBuffer       = 00000000
  TransferBufferMDL    = 85b959d0
    00000000: 54 fd 64 01 00 ff 64 00 80 05 60 40 02 0a 0c 56
    00000010: 40 60
  UrbLink              = 00000000
[28114 ms] UsbSnoop - FilterDispatchAny(b9c8efd2) : IRP_MJ_INTERNAL_DEVICE_CONTROL
[28114 ms] UsbSnoop - FdoHookDispatchInternalIoctl(b9c8f1ea) : fdo=858c38f8, Irp=85b8ee70, IRQL=0
[28114 ms]  >>>  URB 49 going down  >>> 
-- URB_FUNCTION_BULK_OR_INTERRUPT_TRANSFER:
  PipeHandle           = 86a7976c [endpoint 0x00000081]
  TransferFlags        = 00000003 (USBD_TRANSFER_DIRECTION_IN, USBD_SHORT_TRANSFER_OK)
  TransferBufferLength = 00000200
  TransferBuffer       = 00000000
  TransferBufferMDL    = 85b959d0
  UrbLink              = 00000000
[28125 ms] UsbSnoop - MyInternalIOCTLCompletion(b9c8f126) : fido=858b5488, Irp=85b8ee70, Context=85d29868, IRQL=2
[28125 ms]  <<<  URB 49 coming back  <<< 
-- URB_FUNCTION_BULK_OR_INTERRUPT_TRANSFER:
  PipeHandle           = 86a7976c [endpoint 0x00000081]
  TransferFlags        = 00000003 (USBD_TRANSFER_DIRECTION_IN, USBD_SHORT_TRANSFER_OK)
  TransferBufferLength = 0000001b
  TransferBuffer       = 00000000
  TransferBufferMDL    = 85b959d0
    00000000: 54 fd 64 01 40 60 64 00 80 05 f7 38 0b 00 0a 83
    00000010: 20 00 00 00 00 00 00 00 00 01 00
  UrbLink              = 00000000
[28125 ms] UsbSnoop - FilterDispatchAny(b9c8efd2) : IRP_MJ_INTERNAL_DEVICE_CONTROL
[28125 ms] UsbSnoop - FdoHookDispatchInternalIoctl(b9c8f1ea) : fdo=858c38f8, Irp=85b8ee70, IRQL=0
[28125 ms]  >>>  URB 50 going down  >>> 
-- URB_FUNCTION_BULK_OR_INTERRUPT_TRANSFER:
  PipeHandle           = 86a7976c [endpoint 0x00000081]
  TransferFlags        = 00000003 (USBD_TRANSFER_DIRECTION_IN, USBD_SHORT_TRANSFER_OK)
  TransferBufferLength = 00000200
  TransferBuffer       = 00000000
  TransferBufferMDL    = 85b959d0
  UrbLink              = 00000000
[28125 ms] UsbSnoop - FilterDispatchAny(b9c8efd2) : IRP_MJ_INTERNAL_DEVICE_CONTROL
[28125 ms] UsbSnoop - FdoHookDispatchInternalIoctl(b9c8f1ea) : fdo=858c38f8, Irp=85b11cb0, IRQL=0
[28125 ms]  >>>  URB 51 going down  >>> 
-- URB_FUNCTION_BULK_OR_INTERRUPT_TRANSFER:
  PipeHandle           = 86a7978c [endpoint 0x00000002]
  TransferFlags        = 00000002 (USBD_TRANSFER_DIRECTION_OUT, USBD_SHORT_TRANSFER_OK)
  TransferBufferLength = 00000012
  TransferBuffer       = 00000000
  TransferBufferMDL    = 86aec098
    00000000: 54 fd 64 00 00 ff 64 01 40 60 05 80 02 0a 0a 54
    00000010: 80 05
  UrbLink              = 00000000
[28126 ms] UsbSnoop - MyInternalIOCTLCompletion(b9c8f126) : fido=858b5488, Irp=85b11cb0, Context=858bc360, IRQL=2
[28126 ms]  <<<  URB 51 coming back  <<< 
-- URB_FUNCTION_BULK_OR_INTERRUPT_TRANSFER:
  PipeHandle           = 86a7978c [endpoint 0x00000002]
  TransferFlags        = 00000002 (USBD_TRANSFER_DIRECTION_OUT, USBD_SHORT_TRANSFER_OK)
  TransferBufferLength = 00000012
  TransferBuffer       = 00000000
  TransferBufferMDL    = 86aec098
  UrbLink              = 00000000
[28127 ms] UsbSnoop - FilterDispatchAny(b9c8efd2) : IRP_MJ_INTERNAL_DEVICE_CONTROL
[28127 ms] UsbSnoop - FdoHookDispatchInternalIoctl(b9c8f1ea) : fdo=858c38f8, Irp=85b11cb0, IRQL=0
[28127 ms]  >>>  URB 52 going down  >>> 
-- URB_FUNCTION_BULK_OR_INTERRUPT_TRANSFER:
  PipeHandle           = 86a7978c [endpoint 0x00000002]
  TransferFlags        = 00000002 (USBD_TRANSFER_DIRECTION_OUT, USBD_SHORT_TRANSFER_OK)
  TransferBufferLength = 00000012
  TransferBuffer       = 00000000
  TransferBufferMDL    = 86aec098
    00000000: 54 fd 64 00 40 de 64 01 40 60 05 80 02 00 0d 6c
    00000010: 80 05
  UrbLink              = 00000000
[28128 ms] UsbSnoop - MyInternalIOCTLCompletion(b9c8f126) : fido=858b5488, Irp=85b11cb0, Context=858bc360, IRQL=2
[28128 ms]  <<<  URB 52 coming back  <<< 
-- URB_FUNCTION_BULK_OR_INTERRUPT_TRANSFER:
  PipeHandle           = 86a7978c [endpoint 0x00000002]
  TransferFlags        = 00000002 (USBD_TRANSFER_DIRECTION_OUT, USBD_SHORT_TRANSFER_OK)
  TransferBufferLength = 00000012
  TransferBuffer       = 00000000
  TransferBufferMDL    = 86aec098
  UrbLink              = 00000000
[28131 ms] UsbSnoop - MyInternalIOCTLCompletion(b9c8f126) : fido=858b5488, Irp=85b8ee70, Context=85d29868, IRQL=2
[28131 ms]  <<<  URB 50 coming back  <<< 
-- URB_FUNCTION_BULK_OR_INTERRUPT_TRANSFER:
  PipeHandle           = 86a7976c [endpoint 0x00000081]
  TransferFlags        = 00000003 (USBD_TRANSFER_DIRECTION_IN, USBD_SHORT_TRANSFER_OK)
  TransferBufferLength = 00000012
  TransferBuffer       = 00000000
  TransferBufferMDL    = 85b959d0
    00000000: 54 fd 64 01 00 ff 64 00 80 05 60 40 02 0a 0d 57
    00000010: 40 60
  UrbLink              = 00000000
[28131 ms] UsbSnoop - FilterDispatchAny(b9c8efd2) : IRP_MJ_INTERNAL_DEVICE_CONTROL
[28131 ms] UsbSnoop - FdoHookDispatchInternalIoctl(b9c8f1ea) : fdo=858c38f8, Irp=85b11cb0, IRQL=0
[28131 ms]  >>>  URB 53 going down  >>> 
-- URB_FUNCTION_BULK_OR_INTERRUPT_TRANSFER:
  PipeHandle           = 86a7976c [endpoint 0x00000081]
  TransferFlags        = 00000003 (USBD_TRANSFER_DIRECTION_IN, USBD_SHORT_TRANSFER_OK)
  TransferBufferLength = 00000200
  TransferBuffer       = 00000000
  TransferBufferMDL    = 85b959d0
  UrbLink              = 00000000
[28135 ms] UsbSnoop - FilterDispatchAny(b9c8efd2) : IRP_MJ_INTERNAL_DEVICE_CONTROL
[28135 ms] UsbSnoop - FdoHookDispatchInternalIoctl(b9c8f1ea) : fdo=858c38f8, Irp=85b6ccb8, IRQL=0
[28135 ms]  >>>  URB 54 going down  >>> 
-- URB_FUNCTION_BULK_OR_INTERRUPT_TRANSFER:
  PipeHandle           = 86a7978c [endpoint 0x00000002]
  TransferFlags        = 00000002 (USBD_TRANSFER_DIRECTION_OUT, USBD_SHORT_TRANSFER_OK)
  TransferBufferLength = 0000001a
  TransferBuffer       = 00000000
  TransferBufferMDL    = 86aec098
    00000000: 54 fd 64 00 80 06 64 01 40 60 c0 aa 0a 00 0e c2
    00000010: 0d 2f 00 00 00 00 00 00 00 00
  UrbLink              = 00000000
[28136 ms] UsbSnoop - MyInternalIOCTLCompletion(b9c8f126) : fido=858b5488, Irp=85b6ccb8, Context=858bc360, IRQL=2
[28136 ms]  <<<  URB 54 coming back  <<< 
-- URB_FUNCTION_BULK_OR_INTERRUPT_TRANSFER:
  PipeHandle           = 86a7978c [endpoint 0x00000002]
  TransferFlags        = 00000002 (USBD_TRANSFER_DIRECTION_OUT, USBD_SHORT_TRANSFER_OK)
  TransferBufferLength = 0000001a
  TransferBuffer       = 00000000
  TransferBufferMDL    = 86aec098
  UrbLink              = 00000000
[28137 ms] UsbSnoop - MyInternalIOCTLCompletion(b9c8f126) : fido=858b5488, Irp=85b11cb0, Context=85d29868, IRQL=2
[28137 ms]  <<<  URB 53 coming back  <<< 
-- URB_FUNCTION_BULK_OR_INTERRUPT_TRANSFER:
  PipeHandle           = 86a7976c [endpoint 0x00000081]
  TransferFlags        = 00000003 (USBD_TRANSFER_DIRECTION_IN, USBD_SHORT_TRANSFER_OK)
  TransferBufferLength = 00000012
  TransferBuffer       = 00000000
  TransferBufferMDL    = 85b959d0
    00000000: 54 fd 64 01 00 ff 64 00 80 06 60 40 02 0a 0e 59
    00000010: 40 60
  UrbLink              = 00000000
[28137 ms] UsbSnoop - FilterDispatchAny(b9c8efd2) : IRP_MJ_INTERNAL_DEVICE_CONTROL
[28137 ms] UsbSnoop - FdoHookDispatchInternalIoctl(b9c8f1ea) : fdo=858c38f8, Irp=85b11cb0, IRQL=0
[28137 ms]  >>>  URB 55 going down  >>> 
-- URB_FUNCTION_BULK_OR_INTERRUPT_TRANSFER:
  PipeHandle           = 86a7976c [endpoint 0x00000081]
  TransferFlags        = 00000003 (USBD_TRANSFER_DIRECTION_IN, USBD_SHORT_TRANSFER_OK)
  TransferBufferLength = 00000200
  TransferBuffer       = 00000000
  TransferBufferMDL    = 85b959d0
  UrbLink              = 00000000
[28147 ms] UsbSnoop - MyInternalIOCTLCompletion(b9c8f126) : fido=858b5488, Irp=85b11cb0, Context=85d29868, IRQL=2
[28147 ms]  <<<  URB 55 coming back  <<< 
-- URB_FUNCTION_BULK_OR_INTERRUPT_TRANSFER:
  PipeHandle           = 86a7976c [endpoint 0x00000081]
  TransferFlags        = 00000003 (USBD_TRANSFER_DIRECTION_IN, USBD_SHORT_TRANSFER_OK)
  TransferBufferLength = 00000012
  TransferBuffer       = 00000000
  TransferBufferMDL    = 85b959d0
    00000000: 54 fd 64 01 40 60 64 00 80 06 00 ff 02 00 0b 4c
    00000010: ff 00
  UrbLink              = 00000000
[28147 ms] UsbSnoop - FilterDispatchAny(b9c8efd2) : IRP_MJ_INTERNAL_DEVICE_CONTROL
[28147 ms] UsbSnoop - FdoHookDispatchInternalIoctl(b9c8f1ea) : fdo=858c38f8, Irp=85b11cb0, IRQL=0
[28147 ms]  >>>  URB 56 going down  >>> 
-- URB_FUNCTION_BULK_OR_INTERRUPT_TRANSFER:
  PipeHandle           = 86a7976c [endpoint 0x00000081]
  TransferFlags        = 00000003 (USBD_TRANSFER_DIRECTION_IN, USBD_SHORT_TRANSFER_OK)
  TransferBufferLength = 00000200
  TransferBuffer       = 00000000
  TransferBufferMDL    = 85b959d0
  UrbLink              = 00000000
[28147 ms] UsbSnoop - FilterDispatchAny(b9c8efd2) : IRP_MJ_INTERNAL_DEVICE_CONTROL
[28147 ms] UsbSnoop - FdoHookDispatchInternalIoctl(b9c8f1ea) : fdo=858c38f8, Irp=85b8ee70, IRQL=0
[28147 ms]  >>>  URB 57 going down  >>> 
-- URB_FUNCTION_BULK_OR_INTERRUPT_TRANSFER:
  PipeHandle           = 86a7978c [endpoint 0x00000002]
  TransferFlags        = 00000002 (USBD_TRANSFER_DIRECTION_OUT, USBD_SHORT_TRANSFER_OK)
  TransferBufferLength = 00000012
  TransferBuffer       = 00000000
  TransferBufferMDL    = 86a29118
    00000000: 54 fd 64 00 00 ff 64 01 40 60 06 80 02 0a 0b 56
    00000010: 80 06
  UrbLink              = 00000000
[28148 ms] UsbSnoop - MyInternalIOCTLCompletion(b9c8f126) : fido=858b5488, Irp=85b8ee70, Context=858bc360, IRQL=2
[28148 ms]  <<<  URB 57 coming back  <<< 
-- URB_FUNCTION_BULK_OR_INTERRUPT_TRANSFER:
  PipeHandle           = 86a7978c [endpoint 0x00000002]
  TransferFlags        = 00000002 (USBD_TRANSFER_DIRECTION_OUT, USBD_SHORT_TRANSFER_OK)
  TransferBufferLength = 00000012
  TransferBuffer       = 00000000
  TransferBufferMDL    = 86a29118
  UrbLink              = 00000000
[28148 ms] UsbSnoop - FilterDispatchAny(b9c8efd2) : IRP_MJ_INTERNAL_DEVICE_CONTROL
[28148 ms] UsbSnoop - FdoHookDispatchInternalIoctl(b9c8f1ea) : fdo=858c38f8, Irp=85b8ee70, IRQL=0
[28148 ms]  >>>  URB 58 going down  >>> 
-- URB_FUNCTION_BULK_OR_INTERRUPT_TRANSFER:
  PipeHandle           = 86a7978c [endpoint 0x00000002]
  TransferFlags        = 00000002 (USBD_TRANSFER_DIRECTION_OUT, USBD_SHORT_TRANSFER_OK)
  TransferBufferLength = 00000011
  TransferBuffer       = 00000000
  TransferBufferMDL    = 86a29118
    00000000: 54 fd 64 00 80 06 64 01 40 60 0e 00 01 00 0f 5e
    00000010: 0e
  UrbLink              = 00000000
[28150 ms] UsbSnoop - MyInternalIOCTLCompletion(b9c8f126) : fido=858b5488, Irp=85b8ee70, Context=858bc360, IRQL=2
[28150 ms]  <<<  URB 58 coming back  <<< 
-- URB_FUNCTION_BULK_OR_INTERRUPT_TRANSFER:
  PipeHandle           = 86a7978c [endpoint 0x00000002]
  TransferFlags        = 00000002 (USBD_TRANSFER_DIRECTION_OUT, USBD_SHORT_TRANSFER_OK)
  TransferBufferLength = 00000011
  TransferBuffer       = 00000000
  TransferBufferMDL    = 86a29118
  UrbLink              = 00000000
[28153 ms] UsbSnoop - MyInternalIOCTLCompletion(b9c8f126) : fido=858b5488, Irp=85b11cb0, Context=85d29868, IRQL=2
[28153 ms]  <<<  URB 56 coming back  <<< 
-- URB_FUNCTION_BULK_OR_INTERRUPT_TRANSFER:
  PipeHandle           = 86a7976c [endpoint 0x00000081]
  TransferFlags        = 00000003 (USBD_TRANSFER_DIRECTION_IN, USBD_SHORT_TRANSFER_OK)
  TransferBufferLength = 00000012
  TransferBuffer       = 00000000
  TransferBufferMDL    = 85b959d0
    00000000: 54 fd 64 01 00 ff 64 00 80 06 60 40 02 0a 0f 5a
    00000010: 40 60
  UrbLink              = 00000000
[28153 ms] UsbSnoop - FilterDispatchAny(b9c8efd2) : IRP_MJ_INTERNAL_DEVICE_CONTROL
[28153 ms] UsbSnoop - FdoHookDispatchInternalIoctl(b9c8f1ea) : fdo=858c38f8, Irp=85b8ee70, IRQL=0
[28153 ms]  >>>  URB 59 going down  >>> 
-- URB_FUNCTION_BULK_OR_INTERRUPT_TRANSFER:
  PipeHandle           = 86a7976c [endpoint 0x00000081]
  TransferFlags        = 00000003 (USBD_TRANSFER_DIRECTION_IN, USBD_SHORT_TRANSFER_OK)
  TransferBufferLength = 00000200
  TransferBuffer       = 00000000
  TransferBufferMDL    = 85b959d0
  UrbLink              = 00000000
[28160 ms] UsbSnoop - MyInternalIOCTLCompletion(b9c8f126) : fido=858b5488, Irp=85b8ee70, Context=85d29868, IRQL=2
[28160 ms]  <<<  URB 59 coming back  <<< 
-- URB_FUNCTION_BULK_OR_INTERRUPT_TRANSFER:
  PipeHandle           = 86a7976c [endpoint 0x00000081]
  TransferFlags        = 00000003 (USBD_TRANSFER_DIRECTION_IN, USBD_SHORT_TRANSFER_OK)
  TransferBufferLength = 00000026
  TransferBuffer       = 00000000
  TransferBufferMDL    = 85b959d0
    00000000: 54 fd 64 01 40 60 64 00 80 06 d0 9f 16 00 0c d1
    00000010: 10 00 13 46 6f 6c 64 65 72 31 00 00 00 00 00 00
    00000020: 00 00 0d b1 01 00
  UrbLink              = 00000000
[28160 ms] UsbSnoop - FilterDispatchAny(b9c8efd2) : IRP_MJ_INTERNAL_DEVICE_CONTROL
[28160 ms] UsbSnoop - FdoHookDispatchInternalIoctl(b9c8f1ea) : fdo=858c38f8, Irp=85b8ee70, IRQL=0
[28160 ms]  >>>  URB 60 going down  >>> 
-- URB_FUNCTION_BULK_OR_INTERRUPT_TRANSFER:
  PipeHandle           = 86a7976c [endpoint 0x00000081]
  TransferFlags        = 00000003 (USBD_TRANSFER_DIRECTION_IN, USBD_SHORT_TRANSFER_OK)
  TransferBufferLength = 00000200
  TransferBuffer       = 00000000
  TransferBufferMDL    = 85b959d0
  UrbLink              = 00000000
[28160 ms] UsbSnoop - FilterDispatchAny(b9c8efd2) : IRP_MJ_INTERNAL_DEVICE_CONTROL
[28160 ms] UsbSnoop - FdoHookDispatchInternalIoctl(b9c8f1ea) : fdo=858c38f8, Irp=85b11cb0, IRQL=0
[28160 ms]  >>>  URB 61 going down  >>> 
-- URB_FUNCTION_BULK_OR_INTERRUPT_TRANSFER:
  PipeHandle           = 86a7978c [endpoint 0x00000002]
  TransferFlags        = 00000002 (USBD_TRANSFER_DIRECTION_OUT, USBD_SHORT_TRANSFER_OK)
  TransferBufferLength = 00000012
  TransferBuffer       = 00000000
  TransferBufferMDL    = 86a086b0
    00000000: 54 fd 64 00 00 ff 64 01 40 60 06 80 02 0a 0c 57
    00000010: 80 06
  UrbLink              = 00000000
[28161 ms] UsbSnoop - MyInternalIOCTLCompletion(b9c8f126) : fido=858b5488, Irp=85b11cb0, Context=858bc360, IRQL=2
[28161 ms]  <<<  URB 61 coming back  <<< 
-- URB_FUNCTION_BULK_OR_INTERRUPT_TRANSFER:
  PipeHandle           = 86a7978c [endpoint 0x00000002]
  TransferFlags        = 00000002 (USBD_TRANSFER_DIRECTION_OUT, USBD_SHORT_TRANSFER_OK)
  TransferBufferLength = 00000012
  TransferBuffer       = 00000000
  TransferBufferMDL    = 86a086b0
  UrbLink              = 00000000
[28162 ms] UsbSnoop - FilterDispatchAny(b9c8efd2) : IRP_MJ_INTERNAL_DEVICE_CONTROL
[28162 ms] UsbSnoop - FdoHookDispatchInternalIoctl(b9c8f1ea) : fdo=858c38f8, Irp=85b11cb0, IRQL=0
[28162 ms]  >>>  URB 62 going down  >>> 
-- URB_FUNCTION_BULK_OR_INTERRUPT_TRANSFER:
  PipeHandle           = 86a7978c [endpoint 0x00000002]
  TransferFlags        = 00000002 (USBD_TRANSFER_DIRECTION_OUT, USBD_SHORT_TRANSFER_OK)
  TransferBufferLength = 00000011
  TransferBuffer       = 00000000
  TransferBufferMDL    = 86a086b0
    00000000: 54 fd 64 00 80 06 64 01 40 60 0e 00 01 00 10 5f
    00000010: 0e
  UrbLink              = 00000000
[28163 ms] UsbSnoop - MyInternalIOCTLCompletion(b9c8f126) : fido=858b5488, Irp=85b11cb0, Context=858bc360, IRQL=2
[28163 ms]  <<<  URB 62 coming back  <<< 
-- URB_FUNCTION_BULK_OR_INTERRUPT_TRANSFER:
  PipeHandle           = 86a7978c [endpoint 0x00000002]
  TransferFlags        = 00000002 (USBD_TRANSFER_DIRECTION_OUT, USBD_SHORT_TRANSFER_OK)
  TransferBufferLength = 00000011
  TransferBuffer       = 00000000
  TransferBufferMDL    = 86a086b0
  UrbLink              = 00000000
[28167 ms] UsbSnoop - MyInternalIOCTLCompletion(b9c8f126) : fido=858b5488, Irp=85b8ee70, Context=85d29868, IRQL=2
[28167 ms]  <<<  URB 60 coming back  <<< 
-- URB_FUNCTION_BULK_OR_INTERRUPT_TRANSFER:
  PipeHandle           = 86a7976c [endpoint 0x00000081]
  TransferFlags        = 00000003 (USBD_TRANSFER_DIRECTION_IN, USBD_SHORT_TRANSFER_OK)
  TransferBufferLength = 00000012
  TransferBuffer       = 00000000
  TransferBufferMDL    = 85b959d0
    00000000: 54 fd 64 01 00 ff 64 00 80 06 60 40 02 0a 10 5b
    00000010: 40 60
  UrbLink              = 00000000
[28167 ms] UsbSnoop - FilterDispatchAny(b9c8efd2) : IRP_MJ_INTERNAL_DEVICE_CONTROL
[28167 ms] UsbSnoop - FdoHookDispatchInternalIoctl(b9c8f1ea) : fdo=858c38f8, Irp=85b11cb0, IRQL=0
[28167 ms]  >>>  URB 63 going down  >>> 
-- URB_FUNCTION_BULK_OR_INTERRUPT_TRANSFER:
  PipeHandle           = 86a7976c [endpoint 0x00000081]
  TransferFlags        = 00000003 (USBD_TRANSFER_DIRECTION_IN, USBD_SHORT_TRANSFER_OK)
  TransferBufferLength = 00000200
  TransferBuffer       = 00000000
  TransferBufferMDL    = 85b959d0
  UrbLink              = 00000000
[28170 ms] UsbSnoop - MyInternalIOCTLCompletion(b9c8f126) : fido=858b5488, Irp=85b11cb0, Context=85d29868, IRQL=2
[28170 ms]  <<<  URB 63 coming back  <<< 
-- URB_FUNCTION_BULK_OR_INTERRUPT_TRANSFER:
  PipeHandle           = 86a7976c [endpoint 0x00000081]
  TransferFlags        = 00000003 (USBD_TRANSFER_DIRECTION_IN, USBD_SHORT_TRANSFER_OK)
  TransferBufferLength = 00000012
  TransferBuffer       = 00000000
  TransferBufferMDL    = 85b959d0
    00000000: 54 fd 64 01 40 60 64 00 80 06 11 ff 02 00 0d 5f
    00000010: ff 11
  UrbLink              = 00000000
[28170 ms] UsbSnoop - FilterDispatchAny(b9c8efd2) : IRP_MJ_INTERNAL_DEVICE_CONTROL
[28170 ms] UsbSnoop - FdoHookDispatchInternalIoctl(b9c8f1ea) : fdo=858c38f8, Irp=85b11cb0, IRQL=0
[28170 ms]  >>>  URB 64 going down  >>> 
-- URB_FUNCTION_BULK_OR_INTERRUPT_TRANSFER:
  PipeHandle           = 86a7976c [endpoint 0x00000081]
  TransferFlags        = 00000003 (USBD_TRANSFER_DIRECTION_IN, USBD_SHORT_TRANSFER_OK)
  TransferBufferLength = 00000200
  TransferBuffer       = 00000000
  TransferBufferMDL    = 85b959d0
  UrbLink              = 00000000
[28170 ms] UsbSnoop - FilterDispatchAny(b9c8efd2) : IRP_MJ_INTERNAL_DEVICE_CONTROL
[28170 ms] UsbSnoop - FdoHookDispatchInternalIoctl(b9c8f1ea) : fdo=858c38f8, Irp=85b8ee70, IRQL=0
[28170 ms]  >>>  URB 65 going down  >>> 
-- URB_FUNCTION_BULK_OR_INTERRUPT_TRANSFER:
  PipeHandle           = 86a7978c [endpoint 0x00000002]
  TransferFlags        = 00000002 (USBD_TRANSFER_DIRECTION_OUT, USBD_SHORT_TRANSFER_OK)
  TransferBufferLength = 00000012
  TransferBuffer       = 00000000
  TransferBufferMDL    = 86426678
    00000000: 54 fd 64 00 00 ff 64 01 40 60 06 80 02 0a 0d 58
    00000010: 80 06
  UrbLink              = 00000000
[28171 ms] UsbSnoop - MyInternalIOCTLCompletion(b9c8f126) : fido=858b5488, Irp=85b8ee70, Context=858bc360, IRQL=2
[28171 ms]  <<<  URB 65 coming back  <<< 
-- URB_FUNCTION_BULK_OR_INTERRUPT_TRANSFER:
  PipeHandle           = 86a7978c [endpoint 0x00000002]
  TransferFlags        = 00000002 (USBD_TRANSFER_DIRECTION_OUT, USBD_SHORT_TRANSFER_OK)
  TransferBufferLength = 00000012
  TransferBuffer       = 00000000
  TransferBufferMDL    = 86426678
  UrbLink              = 00000000
[28171 ms] UsbSnoop - FilterDispatchAny(b9c8efd2) : IRP_MJ_INTERNAL_DEVICE_CONTROL
[28171 ms] UsbSnoop - FdoHookDispatchInternalIoctl(b9c8f1ea) : fdo=858c38f8, Irp=85b8ee70, IRQL=0
[28171 ms]  >>>  URB 66 going down  >>> 
-- URB_FUNCTION_BULK_OR_INTERRUPT_TRANSFER:
  PipeHandle           = 86a7978c [endpoint 0x00000002]
  TransferFlags        = 00000002 (USBD_TRANSFER_DIRECTION_OUT, USBD_SHORT_TRANSFER_OK)
  TransferBufferLength = 00000011
  TransferBuffer       = 00000000
  TransferBufferMDL    = 86426678
    00000000: 54 fd 64 00 80 06 64 01 40 60 0f 00 01 00 11 61
    00000010: 0f
  UrbLink              = 00000000
[28173 ms] UsbSnoop - MyInternalIOCTLCompletion(b9c8f126) : fido=858b5488, Irp=85b8ee70, Context=858bc360, IRQL=2
[28173 ms]  <<<  URB 66 coming back  <<< 
-- URB_FUNCTION_BULK_OR_INTERRUPT_TRANSFER:
  PipeHandle           = 86a7978c [endpoint 0x00000002]
  TransferFlags        = 00000002 (USBD_TRANSFER_DIRECTION_OUT, USBD_SHORT_TRANSFER_OK)
  TransferBufferLength = 00000011
  TransferBuffer       = 00000000
  TransferBufferMDL    = 86426678
  UrbLink              = 00000000
[28176 ms] UsbSnoop - MyInternalIOCTLCompletion(b9c8f126) : fido=858b5488, Irp=85b11cb0, Context=85d29868, IRQL=2
[28176 ms]  <<<  URB 64 coming back  <<< 
-- URB_FUNCTION_BULK_OR_INTERRUPT_TRANSFER:
  PipeHandle           = 86a7976c [endpoint 0x00000081]
  TransferFlags        = 00000003 (USBD_TRANSFER_DIRECTION_IN, USBD_SHORT_TRANSFER_OK)
  TransferBufferLength = 00000012
  TransferBuffer       = 00000000
  TransferBufferMDL    = 85b959d0
    00000000: 54 fd 64 01 00 ff 64 00 80 06 60 40 02 0a 11 5c
    00000010: 40 60
  UrbLink              = 00000000
[28176 ms] UsbSnoop - FilterDispatchAny(b9c8efd2) : IRP_MJ_INTERNAL_DEVICE_CONTROL
[28176 ms] UsbSnoop - FdoHookDispatchInternalIoctl(b9c8f1ea) : fdo=858c38f8, Irp=85b8ee70, IRQL=0
[28176 ms]  >>>  URB 67 going down  >>> 
-- URB_FUNCTION_BULK_OR_INTERRUPT_TRANSFER:
  PipeHandle           = 86a7976c [endpoint 0x00000081]
  TransferFlags        = 00000003 (USBD_TRANSFER_DIRECTION_IN, USBD_SHORT_TRANSFER_OK)
  TransferBufferLength = 00000200
  TransferBuffer       = 00000000
  TransferBufferMDL    = 85b959d0
  UrbLink              = 00000000
[28179 ms] UsbSnoop - MyInternalIOCTLCompletion(b9c8f126) : fido=858b5488, Irp=85b8ee70, Context=85d29868, IRQL=2
[28179 ms]  <<<  URB 67 coming back  <<< 
-- URB_FUNCTION_BULK_OR_INTERRUPT_TRANSFER:
  PipeHandle           = 86a7976c [endpoint 0x00000081]
  TransferFlags        = 00000003 (USBD_TRANSFER_DIRECTION_IN, USBD_SHORT_TRANSFER_OK)
  TransferBufferLength = 00000012
  TransferBuffer       = 00000000
  TransferBufferMDL    = 85b959d0
    00000000: 54 fd 64 01 40 60 64 00 80 06 00 ff 02 00 0e 4f
    00000010: ff 00
  UrbLink              = 00000000
[28179 ms] UsbSnoop - FilterDispatchAny(b9c8efd2) : IRP_MJ_INTERNAL_DEVICE_CONTROL
[28179 ms] UsbSnoop - FdoHookDispatchInternalIoctl(b9c8f1ea) : fdo=858c38f8, Irp=85b8ee70, IRQL=0
[28179 ms]  >>>  URB 68 going down  >>> 
-- URB_FUNCTION_BULK_OR_INTERRUPT_TRANSFER:
  PipeHandle           = 86a7976c [endpoint 0x00000081]
  TransferFlags        = 00000003 (USBD_TRANSFER_DIRECTION_IN, USBD_SHORT_TRANSFER_OK)
  TransferBufferLength = 00000200
  TransferBuffer       = 00000000
  TransferBufferMDL    = 85b959d0
  UrbLink              = 00000000
[28179 ms] UsbSnoop - FilterDispatchAny(b9c8efd2) : IRP_MJ_INTERNAL_DEVICE_CONTROL
[28179 ms] UsbSnoop - FdoHookDispatchInternalIoctl(b9c8f1ea) : fdo=858c38f8, Irp=85b11cb0, IRQL=0
[28179 ms]  >>>  URB 69 going down  >>> 
-- URB_FUNCTION_BULK_OR_INTERRUPT_TRANSFER:
  PipeHandle           = 86a7978c [endpoint 0x00000002]
  TransferFlags        = 00000002 (USBD_TRANSFER_DIRECTION_OUT, USBD_SHORT_TRANSFER_OK)
  TransferBufferLength = 00000012
  TransferBuffer       = 00000000
  TransferBufferMDL    = 864b96f8
    00000000: 54 fd 64 00 00 ff 64 01 40 60 06 80 02 0a 0e 59
    00000010: 80 06
  UrbLink              = 00000000
[28180 ms] UsbSnoop - MyInternalIOCTLCompletion(b9c8f126) : fido=858b5488, Irp=85b11cb0, Context=858bc360, IRQL=2
[28180 ms]  <<<  URB 69 coming back  <<< 
-- URB_FUNCTION_BULK_OR_INTERRUPT_TRANSFER:
  PipeHandle           = 86a7978c [endpoint 0x00000002]
  TransferFlags        = 00000002 (USBD_TRANSFER_DIRECTION_OUT, USBD_SHORT_TRANSFER_OK)
  TransferBufferLength = 00000012
  TransferBuffer       = 00000000
  TransferBufferMDL    = 864b96f8
  UrbLink              = 00000000
[28181 ms] UsbSnoop - FilterDispatchAny(b9c8efd2) : IRP_MJ_INTERNAL_DEVICE_CONTROL
[28181 ms] UsbSnoop - FdoHookDispatchInternalIoctl(b9c8f1ea) : fdo=858c38f8, Irp=85b11cb0, IRQL=0
[28181 ms]  >>>  URB 70 going down  >>> 
-- URB_FUNCTION_BULK_OR_INTERRUPT_TRANSFER:
  PipeHandle           = 86a7978c [endpoint 0x00000002]
  TransferFlags        = 00000002 (USBD_TRANSFER_DIRECTION_OUT, USBD_SHORT_TRANSFER_OK)
  TransferBufferLength = 00000012
  TransferBuffer       = 00000000
  TransferBufferMDL    = 864b96f8
    00000000: 54 fd 64 00 40 de 64 01 40 60 06 80 02 00 12 72
    00000010: 80 06
  UrbLink              = 00000000
[28182 ms] UsbSnoop - MyInternalIOCTLCompletion(b9c8f126) : fido=858b5488, Irp=85b11cb0, Context=858bc360, IRQL=2
[28182 ms]  <<<  URB 70 coming back  <<< 
-- URB_FUNCTION_BULK_OR_INTERRUPT_TRANSFER:
  PipeHandle           = 86a7978c [endpoint 0x00000002]
  TransferFlags        = 00000002 (USBD_TRANSFER_DIRECTION_OUT, USBD_SHORT_TRANSFER_OK)
  TransferBufferLength = 00000012
  TransferBuffer       = 00000000
  TransferBufferMDL    = 864b96f8
  UrbLink              = 00000000
[28185 ms] UsbSnoop - MyInternalIOCTLCompletion(b9c8f126) : fido=858b5488, Irp=85b8ee70, Context=85d29868, IRQL=2
[28185 ms]  <<<  URB 68 coming back  <<< 
-- URB_FUNCTION_BULK_OR_INTERRUPT_TRANSFER:
  PipeHandle           = 86a7976c [endpoint 0x00000081]
  TransferFlags        = 00000003 (USBD_TRANSFER_DIRECTION_IN, USBD_SHORT_TRANSFER_OK)
  TransferBufferLength = 00000012
  TransferBuffer       = 00000000
  TransferBufferMDL    = 85b959d0
    00000000: 54 fd 64 01 00 ff 64 00 80 06 60 40 02 0a 12 5d
    00000010: 40 60
  UrbLink              = 00000000
[28185 ms] UsbSnoop - FilterDispatchAny(b9c8efd2) : IRP_MJ_INTERNAL_DEVICE_CONTROL
[28185 ms] UsbSnoop - FdoHookDispatchInternalIoctl(b9c8f1ea) : fdo=858c38f8, Irp=85b11cb0, IRQL=0
[28185 ms]  >>>  URB 71 going down  >>> 
-- URB_FUNCTION_BULK_OR_INTERRUPT_TRANSFER:
  PipeHandle           = 86a7976c [endpoint 0x00000081]
  TransferFlags        = 00000003 (USBD_TRANSFER_DIRECTION_IN, USBD_SHORT_TRANSFER_OK)
  TransferBufferLength = 00000200
  TransferBuffer       = 00000000
  TransferBufferMDL    = 85b959d0
  UrbLink              = 00000000
[28253 ms] UsbSnoop - FilterDispatchAny(b9c8efd2) : IRP_MJ_INTERNAL_DEVICE_CONTROL
[28253 ms] UsbSnoop - FdoHookDispatchInternalIoctl(b9c8f1ea) : fdo=858c38f8, Irp=85b8ee70, IRQL=0
[28253 ms]  >>>  URB 72 going down  >>> 
-- URB_FUNCTION_BULK_OR_INTERRUPT_TRANSFER:
  PipeHandle           = 86a7978c [endpoint 0x00000002]
  TransferFlags        = 00000002 (USBD_TRANSFER_DIRECTION_OUT, USBD_SHORT_TRANSFER_OK)
  TransferBufferLength = 00000011
  TransferBuffer       = 00000000
  TransferBufferMDL    = 85b39b28
    00000000: 54 fd 64 00 80 07 64 01 40 20 01 00 01 00 13 16
    00000010: 01
  UrbLink              = 00000000
[28254 ms] UsbSnoop - MyInternalIOCTLCompletion(b9c8f126) : fido=858b5488, Irp=85b8ee70, Context=858bc360, IRQL=2
[28254 ms]  <<<  URB 72 coming back  <<< 
-- URB_FUNCTION_BULK_OR_INTERRUPT_TRANSFER:
  PipeHandle           = 86a7978c [endpoint 0x00000002]
  TransferFlags        = 00000002 (USBD_TRANSFER_DIRECTION_OUT, USBD_SHORT_TRANSFER_OK)
  TransferBufferLength = 00000011
  TransferBuffer       = 00000000
  TransferBufferMDL    = 85b39b28
  UrbLink              = 00000000
[28255 ms] UsbSnoop - MyInternalIOCTLCompletion(b9c8f126) : fido=858b5488, Irp=85b11cb0, Context=85d29868, IRQL=2
[28255 ms]  <<<  URB 71 coming back  <<< 
-- URB_FUNCTION_BULK_OR_INTERRUPT_TRANSFER:
  PipeHandle           = 86a7976c [endpoint 0x00000081]
  TransferFlags        = 00000003 (USBD_TRANSFER_DIRECTION_IN, USBD_SHORT_TRANSFER_OK)
  TransferBufferLength = 00000012
  TransferBuffer       = 00000000
  TransferBufferMDL    = 85b959d0
    00000000: 54 fd 64 01 00 ff 64 00 80 07 20 40 02 0a 13 1f
    00000010: 40 20
  UrbLink              = 00000000
[28255 ms] UsbSnoop - FilterDispatchAny(b9c8efd2) : IRP_MJ_INTERNAL_DEVICE_CONTROL
[28255 ms] UsbSnoop - FdoHookDispatchInternalIoctl(b9c8f1ea) : fdo=858c38f8, Irp=85b8ee70, IRQL=0
[28255 ms]  >>>  URB 73 going down  >>> 
-- URB_FUNCTION_BULK_OR_INTERRUPT_TRANSFER:
  PipeHandle           = 86a7976c [endpoint 0x00000081]
  TransferFlags        = 00000003 (USBD_TRANSFER_DIRECTION_IN, USBD_SHORT_TRANSFER_OK)
  TransferBufferLength = 00000200
  TransferBuffer       = 00000000
  TransferBufferMDL    = 85b959d0
  UrbLink              = 00000000
[28262 ms] UsbSnoop - MyInternalIOCTLCompletion(b9c8f126) : fido=858b5488, Irp=85b8ee70, Context=85d29868, IRQL=2
[28262 ms]  <<<  URB 73 coming back  <<< 
-- URB_FUNCTION_BULK_OR_INTERRUPT_TRANSFER:
  PipeHandle           = 86a7976c [endpoint 0x00000081]
  TransferFlags        = 00000003 (USBD_TRANSFER_DIRECTION_IN, USBD_SHORT_TRANSFER_OK)
  TransferBufferLength = 0000007f
  TransferBuffer       = 00000000
  TransferBufferMDL    = 85b959d0
    00000000: 54 fd 64 01 40 20 64 00 80 07 bf aa 6f 00 0f e8
    00000010: 01 00 00 00 00 01 59 90 00 00 00 00 00 01 be 00
    00000020: 00 00 00 00 00 08 dc 4f a0 00 00 00 00 01 75 75
    00000030: ec 7f 00 00 5a 01 02 09 5e 01 01 22 d4 01 01 23
    00000040: 15 00 00 00 00 00 02 00 00 00 00 01 40 00 f0 04
    00000050: 00 1e 30 30 30 30 34 42 43 31 42 31 30 45 35 37
    00000060: 30 46 00 30 45 30 30 30 30 30 34 42 43 31 42 31
    00000070: 30 45 35 37 30 46 43 42 32 38 30 34 46 31 00
  UrbLink              = 00000000
[28262 ms] UsbSnoop - FilterDispatchAny(b9c8efd2) : IRP_MJ_INTERNAL_DEVICE_CONTROL
[28262 ms] UsbSnoop - FdoHookDispatchInternalIoctl(b9c8f1ea) : fdo=858c38f8, Irp=85b8ee70, IRQL=0
[28262 ms]  >>>  URB 74 going down  >>> 
-- URB_FUNCTION_BULK_OR_INTERRUPT_TRANSFER:
  PipeHandle           = 86a7976c [endpoint 0x00000081]
  TransferFlags        = 00000003 (USBD_TRANSFER_DIRECTION_IN, USBD_SHORT_TRANSFER_OK)
  TransferBufferLength = 00000200
  TransferBuffer       = 00000000
  TransferBufferMDL    = 85b959d0
  UrbLink              = 00000000
[28262 ms] UsbSnoop - FilterDispatchAny(b9c8efd2) : IRP_MJ_INTERNAL_DEVICE_CONTROL
[28262 ms] UsbSnoop - FdoHookDispatchInternalIoctl(b9c8f1ea) : fdo=858c38f8, Irp=85b6ccb8, IRQL=0
[28262 ms]  >>>  URB 75 going down  >>> 
-- URB_FUNCTION_BULK_OR_INTERRUPT_TRANSFER:
  PipeHandle           = 86a7978c [endpoint 0x00000002]
  TransferFlags        = 00000002 (USBD_TRANSFER_DIRECTION_OUT, USBD_SHORT_TRANSFER_OK)
  TransferBufferLength = 00000012
  TransferBuffer       = 00000000
  TransferBufferMDL    = 85b39b28
    00000000: 54 fd 64 00 00 ff 64 01 40 20 07 80 02 0a 0f 1b
    00000010: 80 07
  UrbLink              = 00000000
[28263 ms] UsbSnoop - MyInternalIOCTLCompletion(b9c8f126) : fido=858b5488, Irp=85b6ccb8, Context=858bc360, IRQL=2
[28263 ms]  <<<  URB 75 coming back  <<< 
-- URB_FUNCTION_BULK_OR_INTERRUPT_TRANSFER:
  PipeHandle           = 86a7978c [endpoint 0x00000002]
  TransferFlags        = 00000002 (USBD_TRANSFER_DIRECTION_OUT, USBD_SHORT_TRANSFER_OK)
  TransferBufferLength = 00000012
  TransferBuffer       = 00000000
  TransferBufferMDL    = 85b39b28
  UrbLink              = 00000000
[28263 ms] UsbSnoop - FilterDispatchAny(b9c8efd2) : IRP_MJ_INTERNAL_DEVICE_CONTROL
[28263 ms] UsbSnoop - FdoHookDispatchInternalIoctl(b9c8f1ea) : fdo=858c38f8, Irp=85b11cb0, IRQL=0
[28263 ms]  >>>  URB 76 going down  >>> 
-- URB_FUNCTION_BULK_OR_INTERRUPT_TRANSFER:
  PipeHandle           = 86a7978c [endpoint 0x00000002]
  TransferFlags        = 00000002 (USBD_TRANSFER_DIRECTION_OUT, USBD_SHORT_TRANSFER_OK)
  TransferBufferLength = 00000011
  TransferBuffer       = 00000000
  TransferBufferMDL    = 85b7dd10
    00000000: 54 fd 64 00 80 07 64 01 40 20 02 00 01 00 14 18
    00000010: 02
  UrbLink              = 00000000
[28265 ms] UsbSnoop - MyInternalIOCTLCompletion(b9c8f126) : fido=858b5488, Irp=85b11cb0, Context=858bc360, IRQL=2
[28265 ms]  <<<  URB 76 coming back  <<< 
-- URB_FUNCTION_BULK_OR_INTERRUPT_TRANSFER:
  PipeHandle           = 86a7978c [endpoint 0x00000002]
  TransferFlags        = 00000002 (USBD_TRANSFER_DIRECTION_OUT, USBD_SHORT_TRANSFER_OK)
  TransferBufferLength = 00000011
  TransferBuffer       = 00000000
  TransferBufferMDL    = 85b7dd10
  UrbLink              = 00000000
[28268 ms] UsbSnoop - MyInternalIOCTLCompletion(b9c8f126) : fido=858b5488, Irp=85b8ee70, Context=85d29868, IRQL=2
[28268 ms]  <<<  URB 74 coming back  <<< 
-- URB_FUNCTION_BULK_OR_INTERRUPT_TRANSFER:
  PipeHandle           = 86a7976c [endpoint 0x00000081]
  TransferFlags        = 00000003 (USBD_TRANSFER_DIRECTION_IN, USBD_SHORT_TRANSFER_OK)
  TransferBufferLength = 00000012
  TransferBuffer       = 00000000
  TransferBufferMDL    = 85b959d0
    00000000: 54 fd 64 01 00 ff 64 00 80 07 20 40 02 0a 14 20
    00000010: 40 20
  UrbLink              = 00000000
[28268 ms] UsbSnoop - FilterDispatchAny(b9c8efd2) : IRP_MJ_INTERNAL_DEVICE_CONTROL
[28268 ms] UsbSnoop - FdoHookDispatchInternalIoctl(b9c8f1ea) : fdo=858c38f8, Irp=85b11cb0, IRQL=0
[28268 ms]  >>>  URB 77 going down  >>> 
-- URB_FUNCTION_BULK_OR_INTERRUPT_TRANSFER:
  PipeHandle           = 86a7976c [endpoint 0x00000081]
  TransferFlags        = 00000003 (USBD_TRANSFER_DIRECTION_IN, USBD_SHORT_TRANSFER_OK)
  TransferBufferLength = 00000200
  TransferBuffer       = 00000000
  TransferBufferMDL    = 85b959d0
  UrbLink              = 00000000
[28273 ms] UsbSnoop - MyInternalIOCTLCompletion(b9c8f126) : fido=858b5488, Irp=85b11cb0, Context=85d29868, IRQL=2
[28273 ms]  <<<  URB 77 coming back  <<< 
-- URB_FUNCTION_BULK_OR_INTERRUPT_TRANSFER:
  PipeHandle           = 86a7976c [endpoint 0x00000081]
  TransferFlags        = 00000003 (USBD_TRANSFER_DIRECTION_IN, USBD_SHORT_TRANSFER_OK)
  TransferBufferLength = 0000001b
  TransferBuffer       = 00000000
  TransferBufferMDL    = 85b959d0
    00000000: 54 fd 64 01 40 20 64 00 80 07 38 5a 0b 00 10 ae
    00000010: 02 54 49 2d 4e 73 70 69 72 65 00
  UrbLink              = 00000000
[28273 ms] UsbSnoop - FilterDispatchAny(b9c8efd2) : IRP_MJ_INTERNAL_DEVICE_CONTROL
[28273 ms] UsbSnoop - FdoHookDispatchInternalIoctl(b9c8f1ea) : fdo=858c38f8, Irp=85b11cb0, IRQL=0
[28273 ms]  >>>  URB 78 going down  >>> 
-- URB_FUNCTION_BULK_OR_INTERRUPT_TRANSFER:
  PipeHandle           = 86a7976c [endpoint 0x00000081]
  TransferFlags        = 00000003 (USBD_TRANSFER_DIRECTION_IN, USBD_SHORT_TRANSFER_OK)
  TransferBufferLength = 00000200
  TransferBuffer       = 00000000
  TransferBufferMDL    = 85b959d0
  UrbLink              = 00000000
[28273 ms] UsbSnoop - FilterDispatchAny(b9c8efd2) : IRP_MJ_INTERNAL_DEVICE_CONTROL
[28273 ms] UsbSnoop - FdoHookDispatchInternalIoctl(b9c8f1ea) : fdo=858c38f8, Irp=85b8ee70, IRQL=0
[28273 ms]  >>>  URB 79 going down  >>> 
-- URB_FUNCTION_BULK_OR_INTERRUPT_TRANSFER:
  PipeHandle           = 86a7978c [endpoint 0x00000002]
  TransferFlags        = 00000002 (USBD_TRANSFER_DIRECTION_OUT, USBD_SHORT_TRANSFER_OK)
  TransferBufferLength = 00000012
  TransferBuffer       = 00000000
  TransferBufferMDL    = 85e1f878
    00000000: 54 fd 64 00 00 ff 64 01 40 20 07 80 02 0a 10 1c
    00000010: 80 07
  UrbLink              = 00000000
[28274 ms] UsbSnoop - MyInternalIOCTLCompletion(b9c8f126) : fido=858b5488, Irp=85b8ee70, Context=858bc360, IRQL=2
[28274 ms]  <<<  URB 79 coming back  <<< 
-- URB_FUNCTION_BULK_OR_INTERRUPT_TRANSFER:
  PipeHandle           = 86a7978c [endpoint 0x00000002]
  TransferFlags        = 00000002 (USBD_TRANSFER_DIRECTION_OUT, USBD_SHORT_TRANSFER_OK)
  TransferBufferLength = 00000012
  TransferBuffer       = 00000000
  TransferBufferMDL    = 85e1f878
  UrbLink              = 00000000
[28274 ms] UsbSnoop - FilterDispatchAny(b9c8efd2) : IRP_MJ_INTERNAL_DEVICE_CONTROL
[28274 ms] UsbSnoop - FdoHookDispatchInternalIoctl(b9c8f1ea) : fdo=858c38f8, Irp=85b07cb0, IRQL=0
[28274 ms]  >>>  URB 80 going down  >>> 
-- URB_FUNCTION_BULK_OR_INTERRUPT_TRANSFER:
  PipeHandle           = 86a7978c [endpoint 0x00000002]
  TransferFlags        = 00000002 (USBD_TRANSFER_DIRECTION_OUT, USBD_SHORT_TRANSFER_OK)
  TransferBufferLength = 00000011
  TransferBuffer       = 00000000
  TransferBufferMDL    = 85e1f8f8
    00000000: 54 fd 64 00 80 07 64 01 40 20 03 00 01 00 15 1a
    00000010: 03
  UrbLink              = 00000000
[28277 ms] UsbSnoop - MyInternalIOCTLCompletion(b9c8f126) : fido=858b5488, Irp=85b07cb0, Context=858bc360, IRQL=2
[28277 ms]  <<<  URB 80 coming back  <<< 
-- URB_FUNCTION_BULK_OR_INTERRUPT_TRANSFER:
  PipeHandle           = 86a7978c [endpoint 0x00000002]
  TransferFlags        = 00000002 (USBD_TRANSFER_DIRECTION_OUT, USBD_SHORT_TRANSFER_OK)
  TransferBufferLength = 00000011
  TransferBuffer       = 00000000
  TransferBufferMDL    = 85e1f8f8
  UrbLink              = 00000000
[28279 ms] UsbSnoop - MyInternalIOCTLCompletion(b9c8f126) : fido=858b5488, Irp=85b11cb0, Context=85d29868, IRQL=2
[28279 ms]  <<<  URB 78 coming back  <<< 
-- URB_FUNCTION_BULK_OR_INTERRUPT_TRANSFER:
  PipeHandle           = 86a7976c [endpoint 0x00000081]
  TransferFlags        = 00000003 (USBD_TRANSFER_DIRECTION_IN, USBD_SHORT_TRANSFER_OK)
  TransferBufferLength = 00000012
  TransferBuffer       = 00000000
  TransferBufferMDL    = 85b959d0
    00000000: 54 fd 64 01 00 ff 64 00 80 07 20 40 02 0a 15 21
    00000010: 40 20
  UrbLink              = 00000000
[28279 ms] UsbSnoop - FilterDispatchAny(b9c8efd2) : IRP_MJ_INTERNAL_DEVICE_CONTROL
[28279 ms] UsbSnoop - FdoHookDispatchInternalIoctl(b9c8f1ea) : fdo=858c38f8, Irp=85b8ee70, IRQL=0
[28279 ms]  >>>  URB 81 going down  >>> 
-- URB_FUNCTION_BULK_OR_INTERRUPT_TRANSFER:
  PipeHandle           = 86a7976c [endpoint 0x00000081]
  TransferFlags        = 00000003 (USBD_TRANSFER_DIRECTION_IN, USBD_SHORT_TRANSFER_OK)
  TransferBufferLength = 00000200
  TransferBuffer       = 00000000
  TransferBufferMDL    = 85b959d0
  UrbLink              = 00000000
[28283 ms] UsbSnoop - MyInternalIOCTLCompletion(b9c8f126) : fido=858b5488, Irp=85b8ee70, Context=85d29868, IRQL=2
[28283 ms]  <<<  URB 81 coming back  <<< 
-- URB_FUNCTION_BULK_OR_INTERRUPT_TRANSFER:
  PipeHandle           = 86a7976c [endpoint 0x00000081]
  TransferFlags        = 00000003 (USBD_TRANSFER_DIRECTION_IN, USBD_SHORT_TRANSFER_OK)
  TransferBufferLength = 0000001b
  TransferBuffer       = 00000000
  TransferBufferMDL    = 85b959d0
    00000000: 54 fd 64 01 40 20 64 00 80 07 96 7f 0b 00 11 32
    00000010: 03 2e 74 6e 73 00 2e 74 6e 6f 00
  UrbLink              = 00000000
[28283 ms] UsbSnoop - FilterDispatchAny(b9c8efd2) : IRP_MJ_INTERNAL_DEVICE_CONTROL
[28283 ms] UsbSnoop - FdoHookDispatchInternalIoctl(b9c8f1ea) : fdo=858c38f8, Irp=85b8ee70, IRQL=0
[28283 ms]  >>>  URB 82 going down  >>> 
-- URB_FUNCTION_BULK_OR_INTERRUPT_TRANSFER:
  PipeHandle           = 86a7976c [endpoint 0x00000081]
  TransferFlags        = 00000003 (USBD_TRANSFER_DIRECTION_IN, USBD_SHORT_TRANSFER_OK)
  TransferBufferLength = 00000200
  TransferBuffer       = 00000000
  TransferBufferMDL    = 85b959d0
  UrbLink              = 00000000
[28283 ms] UsbSnoop - FilterDispatchAny(b9c8efd2) : IRP_MJ_INTERNAL_DEVICE_CONTROL
[28283 ms] UsbSnoop - FdoHookDispatchInternalIoctl(b9c8f1ea) : fdo=858c38f8, Irp=85b11cb0, IRQL=0
[28283 ms]  >>>  URB 83 going down  >>> 
-- URB_FUNCTION_BULK_OR_INTERRUPT_TRANSFER:
  PipeHandle           = 86a7978c [endpoint 0x00000002]
  TransferFlags        = 00000002 (USBD_TRANSFER_DIRECTION_OUT, USBD_SHORT_TRANSFER_OK)
  TransferBufferLength = 00000012
  TransferBuffer       = 00000000
  TransferBufferMDL    = 8617c8d0
    00000000: 54 fd 64 00 00 ff 64 01 40 20 07 80 02 0a 11 1d
    00000010: 80 07
  UrbLink              = 00000000
[28284 ms] UsbSnoop - MyInternalIOCTLCompletion(b9c8f126) : fido=858b5488, Irp=85b11cb0, Context=858bc360, IRQL=2
[28284 ms]  <<<  URB 83 coming back  <<< 
-- URB_FUNCTION_BULK_OR_INTERRUPT_TRANSFER:
  PipeHandle           = 86a7978c [endpoint 0x00000002]
  TransferFlags        = 00000002 (USBD_TRANSFER_DIRECTION_OUT, USBD_SHORT_TRANSFER_OK)
  TransferBufferLength = 00000012
  TransferBuffer       = 00000000
  TransferBufferMDL    = 8617c8d0
  UrbLink              = 00000000
[28284 ms] UsbSnoop - FilterDispatchAny(b9c8efd2) : IRP_MJ_INTERNAL_DEVICE_CONTROL
[28284 ms] UsbSnoop - FdoHookDispatchInternalIoctl(b9c8f1ea) : fdo=858c38f8, Irp=85b11cb0, IRQL=0
[28284 ms]  >>>  URB 84 going down  >>> 
-- URB_FUNCTION_BULK_OR_INTERRUPT_TRANSFER:
  PipeHandle           = 86a7978c [endpoint 0x00000002]
  TransferFlags        = 00000002 (USBD_TRANSFER_DIRECTION_OUT, USBD_SHORT_TRANSFER_OK)
  TransferBufferLength = 00000012
  TransferBuffer       = 00000000
  TransferBufferMDL    = 8617c8d0
    00000000: 54 fd 64 00 40 de 64 01 40 20 07 80 02 00 16 37
    00000010: 80 07
  UrbLink              = 00000000
[28286 ms] UsbSnoop - MyInternalIOCTLCompletion(b9c8f126) : fido=858b5488, Irp=85b11cb0, Context=858bc360, IRQL=2
[28286 ms]  <<<  URB 84 coming back  <<< 
-- URB_FUNCTION_BULK_OR_INTERRUPT_TRANSFER:
  PipeHandle           = 86a7978c [endpoint 0x00000002]
  TransferFlags        = 00000002 (USBD_TRANSFER_DIRECTION_OUT, USBD_SHORT_TRANSFER_OK)
  TransferBufferLength = 00000012
  TransferBuffer       = 00000000
  TransferBufferMDL    = 8617c8d0
  UrbLink              = 00000000
[28289 ms] UsbSnoop - MyInternalIOCTLCompletion(b9c8f126) : fido=858b5488, Irp=85b8ee70, Context=85d29868, IRQL=2
[28289 ms]  <<<  URB 82 coming back  <<< 
-- URB_FUNCTION_BULK_OR_INTERRUPT_TRANSFER:
  PipeHandle           = 86a7976c [endpoint 0x00000081]
  TransferFlags        = 00000003 (USBD_TRANSFER_DIRECTION_IN, USBD_SHORT_TRANSFER_OK)
  TransferBufferLength = 00000012
  TransferBuffer       = 00000000
  TransferBufferMDL    = 85b959d0
    00000000: 54 fd 64 01 00 ff 64 00 80 07 20 40 02 0a 16 22
    00000010: 40 20
  UrbLink              = 00000000
[28289 ms] UsbSnoop - FilterDispatchAny(b9c8efd2) : IRP_MJ_INTERNAL_DEVICE_CONTROL
[28289 ms] UsbSnoop - FdoHookDispatchInternalIoctl(b9c8f1ea) : fdo=858c38f8, Irp=85b11cb0, IRQL=0
[28289 ms]  >>>  URB 85 going down  >>> 
-- URB_FUNCTION_BULK_OR_INTERRUPT_TRANSFER:
  PipeHandle           = 86a7976c [endpoint 0x00000081]
  TransferFlags        = 00000003 (USBD_TRANSFER_DIRECTION_IN, USBD_SHORT_TRANSFER_OK)
  TransferBufferLength = 00000200
  TransferBuffer       = 00000000
  TransferBufferMDL    = 85b959d0
  UrbLink              = 00000000
[36848 ms] UsbSnoop - MyInternalIOCTLCompletion(b9c8f126) : fido=858b5488, Irp=85b11cb0, Context=85d29868, IRQL=2
[36848 ms]  <<<  URB 85 coming back  <<< 
-- URB_FUNCTION_BULK_OR_INTERRUPT_TRANSFER:
  PipeHandle           = 86a7976c [endpoint 0x00000081]
  TransferFlags        = 00000003 (USBD_TRANSFER_DIRECTION_IN, USBD_SHORT_TRANSFER_OK)
  TransferBufferLength = 00000000
  TransferBuffer       = 00000000
  TransferBufferMDL    = 85b959d0
  UrbLink              = 00000000
