[123643 ms] UsbSnoop - FilterDispatchAny(b792dfd2) : IRP_MJ_INTERNAL_DEVICE_CONTROL
[123643 ms] UsbSnoop - FdoHookDispatchInternalIoctl(b792e1ea) : fdo=88a903b8, Irp=892a2e70, IRQL=0
[123643 ms]  >>>  URB 5 going down  >>> 
-- URB_FUNCTION_VENDOR_DEVICE:
  TransferFlags          = 00000002 (USBD_TRANSFER_DIRECTION_OUT, USBD_SHORT_TRANSFER_OK)
  TransferBufferLength = 00000000
  TransferBuffer       = 00000000
  TransferBufferMDL    = 00000000

    no data supplied
  UrbLink                 = 00000000
  RequestTypeReservedBits = 00000000
  Request                 = 000000bb
  Value                   = 00000000
  Index                   = 00000000
[123644 ms] UsbSnoop - MyInternalIOCTLCompletion(b792e126) : fido=88a972c0, Irp=892a2e70, Context=89309548, IRQL=2
[123644 ms]  <<<  URB 5 coming back  <<< 
-- URB_FUNCTION_CONTROL_TRANSFER:
  PipeHandle           = 891a3130
  TransferFlags        = 0000000a (USBD_TRANSFER_DIRECTION_OUT, USBD_SHORT_TRANSFER_OK)
  TransferBufferLength = 00000000
  TransferBuffer       = 00000000
  TransferBufferMDL    = 00000000
  UrbLink              = 00000000
  SetupPacket          =
    00000000: 40 bb 00 00 00 00 00 00
[123644 ms] UsbSnoop - FilterDispatchAny(b792dfd2) : IRP_MJ_INTERNAL_DEVICE_CONTROL
[123644 ms] UsbSnoop - FdoHookDispatchInternalIoctl(b792e1ea) : fdo=88a903b8, Irp=892a2e70, IRQL=0
[123644 ms]  >>>  URB 6 going down  >>> 
-- URB_FUNCTION_VENDOR_DEVICE:
  TransferFlags          = 00000002 (USBD_TRANSFER_DIRECTION_OUT, USBD_SHORT_TRANSFER_OK)
  TransferBufferLength = 00000000
  TransferBuffer       = 00000000
  TransferBufferMDL    = 00000000

    no data supplied
  UrbLink                 = 00000000
  RequestTypeReservedBits = 00000000
  Request                 = 000000aa
  Value                   = 00000000
  Index                   = 00000000
[123646 ms] UsbSnoop - MyInternalIOCTLCompletion(b792e126) : fido=88a972c0, Irp=892a2e70, Context=89309548, IRQL=2
[123646 ms]  <<<  URB 6 coming back  <<< 
-- URB_FUNCTION_CONTROL_TRANSFER:
  PipeHandle           = 891a3130
  TransferFlags        = 0000000a (USBD_TRANSFER_DIRECTION_OUT, USBD_SHORT_TRANSFER_OK)
  TransferBufferLength = 00000000
  TransferBuffer       = 00000000
  TransferBufferMDL    = 00000000
  UrbLink              = 00000000
  SetupPacket          =
    00000000: 40 aa 00 00 00 00 00 00
[123647 ms] UsbSnoop - FilterDispatchAny(b792dfd2) : IRP_MJ_INTERNAL_DEVICE_CONTROL
[123647 ms] UsbSnoop - FdoHookDispatchInternalIoctl(b792e1ea) : fdo=88a903b8, Irp=892a2e70, IRQL=0
[123647 ms]  >>>  URB 7 going down  >>> 
-- URB_FUNCTION_BULK_OR_INTERRUPT_TRANSFER:
  PipeHandle           = 8926d3cc [endpoint 0x00000081]
  TransferFlags        = 00000003 (USBD_TRANSFER_DIRECTION_IN, USBD_SHORT_TRANSFER_OK)
  TransferBufferLength = 00000200
  TransferBuffer       = 00000000
  TransferBufferMDL    = 891a3be0
  UrbLink              = 00000000
[123648 ms] UsbSnoop - MyInternalIOCTLCompletion(b792e126) : fido=88a972c0, Irp=892a2e70, Context=89309548, IRQL=2
[123648 ms]  <<<  URB 7 coming back  <<< 
-- URB_FUNCTION_BULK_OR_INTERRUPT_TRANSFER:
  PipeHandle           = 8926d3cc [endpoint 0x00000081]
  TransferFlags        = 00000003 (USBD_TRANSFER_DIRECTION_IN, USBD_SHORT_TRANSFER_OK)
  TransferBufferLength = 00000000
  TransferBuffer       = 00000000
  TransferBufferMDL    = 891a3be0
  UrbLink              = 00000000
[123648 ms] UsbSnoop - FilterDispatchAny(b792dfd2) : IRP_MJ_INTERNAL_DEVICE_CONTROL
[123648 ms] UsbSnoop - FdoHookDispatchInternalIoctl(b792e1ea) : fdo=88a903b8, Irp=892a2e70, IRQL=0
[123648 ms]  >>>  URB 8 going down  >>> 
-- URB_FUNCTION_BULK_OR_INTERRUPT_TRANSFER:
  PipeHandle           = 8926d3cc [endpoint 0x00000081]
  TransferFlags        = 00000003 (USBD_TRANSFER_DIRECTION_IN, USBD_SHORT_TRANSFER_OK)
  TransferBufferLength = 00000200
  TransferBuffer       = 00000000
  TransferBufferMDL    = 891a3be0
  UrbLink              = 00000000
[123648 ms] UsbSnoop - MyInternalIOCTLCompletion(b792e126) : fido=88a972c0, Irp=892a2e70, Context=89309548, IRQL=2
[123648 ms]  <<<  URB 8 coming back  <<< 
-- URB_FUNCTION_BULK_OR_INTERRUPT_TRANSFER:
  PipeHandle           = 8926d3cc [endpoint 0x00000081]
  TransferFlags        = 00000003 (USBD_TRANSFER_DIRECTION_IN, USBD_SHORT_TRANSFER_OK)
  TransferBufferLength = 00000000
  TransferBuffer       = 00000000
  TransferBufferMDL    = 891a3be0
  UrbLink              = 00000000
[123648 ms] UsbSnoop - FilterDispatchAny(b792dfd2) : IRP_MJ_INTERNAL_DEVICE_CONTROL
[123648 ms] UsbSnoop - FdoHookDispatchInternalIoctl(b792e1ea) : fdo=88a903b8, Irp=892a2e70, IRQL=0
[123648 ms]  >>>  URB 9 going down  >>> 
-- URB_FUNCTION_BULK_OR_INTERRUPT_TRANSFER:
  PipeHandle           = 8926d3cc [endpoint 0x00000081]
  TransferFlags        = 00000003 (USBD_TRANSFER_DIRECTION_IN, USBD_SHORT_TRANSFER_OK)
  TransferBufferLength = 00000200
  TransferBuffer       = 00000000
  TransferBufferMDL    = 891a3be0
  UrbLink              = 00000000
[123648 ms] UsbSnoop - MyInternalIOCTLCompletion(b792e126) : fido=88a972c0, Irp=892a2e70, Context=89309548, IRQL=2
[123648 ms]  <<<  URB 9 coming back  <<< 
-- URB_FUNCTION_BULK_OR_INTERRUPT_TRANSFER:
  PipeHandle           = 8926d3cc [endpoint 0x00000081]
  TransferFlags        = 00000003 (USBD_TRANSFER_DIRECTION_IN, USBD_SHORT_TRANSFER_OK)
  TransferBufferLength = 00000000
  TransferBuffer       = 00000000
  TransferBufferMDL    = 891a3be0
  UrbLink              = 00000000
[123649 ms] UsbSnoop - FilterDispatchAny(b792dfd2) : IRP_MJ_INTERNAL_DEVICE_CONTROL
[123649 ms] UsbSnoop - FdoHookDispatchInternalIoctl(b792e1ea) : fdo=88a903b8, Irp=892a2e70, IRQL=0
[123649 ms]  >>>  URB 10 going down  >>> 
-- URB_FUNCTION_BULK_OR_INTERRUPT_TRANSFER:
  PipeHandle           = 8926d3cc [endpoint 0x00000081]
  TransferFlags        = 00000003 (USBD_TRANSFER_DIRECTION_IN, USBD_SHORT_TRANSFER_OK)
  TransferBufferLength = 00000200
  TransferBuffer       = 00000000
  TransferBufferMDL    = 891a3be0
  UrbLink              = 00000000
[123649 ms] UsbSnoop - MyInternalIOCTLCompletion(b792e126) : fido=88a972c0, Irp=892a2e70, Context=89309548, IRQL=2
[123649 ms]  <<<  URB 10 coming back  <<< 
-- URB_FUNCTION_BULK_OR_INTERRUPT_TRANSFER:
  PipeHandle           = 8926d3cc [endpoint 0x00000081]
  TransferFlags        = 00000003 (USBD_TRANSFER_DIRECTION_IN, USBD_SHORT_TRANSFER_OK)
  TransferBufferLength = 00000000
  TransferBuffer       = 00000000
  TransferBufferMDL    = 891a3be0
  UrbLink              = 00000000
[123649 ms] UsbSnoop - FilterDispatchAny(b792dfd2) : IRP_MJ_INTERNAL_DEVICE_CONTROL
[123649 ms] UsbSnoop - FdoHookDispatchInternalIoctl(b792e1ea) : fdo=88a903b8, Irp=892a2e70, IRQL=0
[123649 ms]  >>>  URB 11 going down  >>> 
-- URB_FUNCTION_BULK_OR_INTERRUPT_TRANSFER:
  PipeHandle           = 8926d3cc [endpoint 0x00000081]
  TransferFlags        = 00000003 (USBD_TRANSFER_DIRECTION_IN, USBD_SHORT_TRANSFER_OK)
  TransferBufferLength = 00000200
  TransferBuffer       = 00000000
  TransferBufferMDL    = 891a3be0
  UrbLink              = 00000000
[123649 ms] UsbSnoop - MyInternalIOCTLCompletion(b792e126) : fido=88a972c0, Irp=892a2e70, Context=89309548, IRQL=2
[123649 ms]  <<<  URB 11 coming back  <<< 
-- URB_FUNCTION_BULK_OR_INTERRUPT_TRANSFER:
  PipeHandle           = 8926d3cc [endpoint 0x00000081]
  TransferFlags        = 00000003 (USBD_TRANSFER_DIRECTION_IN, USBD_SHORT_TRANSFER_OK)
  TransferBufferLength = 00000000
  TransferBuffer       = 00000000
  TransferBufferMDL    = 891a3be0
  UrbLink              = 00000000
[123649 ms] UsbSnoop - FilterDispatchAny(b792dfd2) : IRP_MJ_INTERNAL_DEVICE_CONTROL
[123649 ms] UsbSnoop - FdoHookDispatchInternalIoctl(b792e1ea) : fdo=88a903b8, Irp=892a2e70, IRQL=0
[123649 ms]  >>>  URB 12 going down  >>> 
-- URB_FUNCTION_BULK_OR_INTERRUPT_TRANSFER:
  PipeHandle           = 8926d3cc [endpoint 0x00000081]
  TransferFlags        = 00000003 (USBD_TRANSFER_DIRECTION_IN, USBD_SHORT_TRANSFER_OK)
  TransferBufferLength = 00000200
  TransferBuffer       = 00000000
  TransferBufferMDL    = 891a3be0
  UrbLink              = 00000000
[123649 ms] UsbSnoop - MyInternalIOCTLCompletion(b792e126) : fido=88a972c0, Irp=892a2e70, Context=89309548, IRQL=2
[123649 ms]  <<<  URB 12 coming back  <<< 
-- URB_FUNCTION_BULK_OR_INTERRUPT_TRANSFER:
  PipeHandle           = 8926d3cc [endpoint 0x00000081]
  TransferFlags        = 00000003 (USBD_TRANSFER_DIRECTION_IN, USBD_SHORT_TRANSFER_OK)
  TransferBufferLength = 00000000
  TransferBuffer       = 00000000
  TransferBufferMDL    = 891a3be0
  UrbLink              = 00000000
[123650 ms] UsbSnoop - FilterDispatchAny(b792dfd2) : IRP_MJ_INTERNAL_DEVICE_CONTROL
[123650 ms] UsbSnoop - FdoHookDispatchInternalIoctl(b792e1ea) : fdo=88a903b8, Irp=892a2e70, IRQL=0
[123650 ms]  >>>  URB 13 going down  >>> 
-- URB_FUNCTION_BULK_OR_INTERRUPT_TRANSFER:
  PipeHandle           = 8926d3cc [endpoint 0x00000081]
  TransferFlags        = 00000003 (USBD_TRANSFER_DIRECTION_IN, USBD_SHORT_TRANSFER_OK)
  TransferBufferLength = 00000200
  TransferBuffer       = 00000000
  TransferBufferMDL    = 891a3be0
  UrbLink              = 00000000
[123650 ms] UsbSnoop - MyInternalIOCTLCompletion(b792e126) : fido=88a972c0, Irp=892a2e70, Context=89309548, IRQL=2
[123650 ms]  <<<  URB 13 coming back  <<< 
-- URB_FUNCTION_BULK_OR_INTERRUPT_TRANSFER:
  PipeHandle           = 8926d3cc [endpoint 0x00000081]
  TransferFlags        = 00000003 (USBD_TRANSFER_DIRECTION_IN, USBD_SHORT_TRANSFER_OK)
  TransferBufferLength = 00000000
  TransferBuffer       = 00000000
  TransferBufferMDL    = 891a3be0
  UrbLink              = 00000000
[123650 ms] UsbSnoop - FilterDispatchAny(b792dfd2) : IRP_MJ_INTERNAL_DEVICE_CONTROL
[123650 ms] UsbSnoop - FdoHookDispatchInternalIoctl(b792e1ea) : fdo=88a903b8, Irp=892a2e70, IRQL=0
[123650 ms]  >>>  URB 14 going down  >>> 
-- URB_FUNCTION_BULK_OR_INTERRUPT_TRANSFER:
  PipeHandle           = 8926d3cc [endpoint 0x00000081]
  TransferFlags        = 00000003 (USBD_TRANSFER_DIRECTION_IN, USBD_SHORT_TRANSFER_OK)
  TransferBufferLength = 00000200
  TransferBuffer       = 00000000
  TransferBufferMDL    = 891a3be0
  UrbLink              = 00000000
[123650 ms] UsbSnoop - MyInternalIOCTLCompletion(b792e126) : fido=88a972c0, Irp=892a2e70, Context=89309548, IRQL=2
[123650 ms]  <<<  URB 14 coming back  <<< 
-- URB_FUNCTION_BULK_OR_INTERRUPT_TRANSFER:
  PipeHandle           = 8926d3cc [endpoint 0x00000081]
  TransferFlags        = 00000003 (USBD_TRANSFER_DIRECTION_IN, USBD_SHORT_TRANSFER_OK)
  TransferBufferLength = 00000000
  TransferBuffer       = 00000000
  TransferBufferMDL    = 891a3be0
  UrbLink              = 00000000
[123650 ms] UsbSnoop - FilterDispatchAny(b792dfd2) : IRP_MJ_INTERNAL_DEVICE_CONTROL
[123650 ms] UsbSnoop - FdoHookDispatchInternalIoctl(b792e1ea) : fdo=88a903b8, Irp=892a2e70, IRQL=0
[123650 ms]  >>>  URB 15 going down  >>> 
-- URB_FUNCTION_BULK_OR_INTERRUPT_TRANSFER:
  PipeHandle           = 8926d3cc [endpoint 0x00000081]
  TransferFlags        = 00000003 (USBD_TRANSFER_DIRECTION_IN, USBD_SHORT_TRANSFER_OK)
  TransferBufferLength = 00000200
  TransferBuffer       = 00000000
  TransferBufferMDL    = 891a3be0
  UrbLink              = 00000000
[123650 ms] UsbSnoop - MyInternalIOCTLCompletion(b792e126) : fido=88a972c0, Irp=892a2e70, Context=89309548, IRQL=2
[123650 ms]  <<<  URB 15 coming back  <<< 
-- URB_FUNCTION_BULK_OR_INTERRUPT_TRANSFER:
  PipeHandle           = 8926d3cc [endpoint 0x00000081]
  TransferFlags        = 00000003 (USBD_TRANSFER_DIRECTION_IN, USBD_SHORT_TRANSFER_OK)
  TransferBufferLength = 00000000
  TransferBuffer       = 00000000
  TransferBufferMDL    = 891a3be0
  UrbLink              = 00000000
[123650 ms] UsbSnoop - FilterDispatchAny(b792dfd2) : IRP_MJ_INTERNAL_DEVICE_CONTROL
[123650 ms] UsbSnoop - FdoHookDispatchInternalIoctl(b792e1ea) : fdo=88a903b8, Irp=892a2e70, IRQL=0
[123650 ms]  >>>  URB 16 going down  >>> 
-- URB_FUNCTION_BULK_OR_INTERRUPT_TRANSFER:
  PipeHandle           = 8926d3cc [endpoint 0x00000081]
  TransferFlags        = 00000003 (USBD_TRANSFER_DIRECTION_IN, USBD_SHORT_TRANSFER_OK)
  TransferBufferLength = 00000200
  TransferBuffer       = 00000000
  TransferBufferMDL    = 891a3be0
  UrbLink              = 00000000
[123650 ms] UsbSnoop - MyInternalIOCTLCompletion(b792e126) : fido=88a972c0, Irp=892a2e70, Context=89309548, IRQL=2
[123650 ms]  <<<  URB 16 coming back  <<< 
-- URB_FUNCTION_BULK_OR_INTERRUPT_TRANSFER:
  PipeHandle           = 8926d3cc [endpoint 0x00000081]
  TransferFlags        = 00000003 (USBD_TRANSFER_DIRECTION_IN, USBD_SHORT_TRANSFER_OK)
  TransferBufferLength = 00000000
  TransferBuffer       = 00000000
  TransferBufferMDL    = 891a3be0
  UrbLink              = 00000000
[123650 ms] UsbSnoop - FilterDispatchAny(b792dfd2) : IRP_MJ_INTERNAL_DEVICE_CONTROL
[123650 ms] UsbSnoop - FdoHookDispatchInternalIoctl(b792e1ea) : fdo=88a903b8, Irp=892a2e70, IRQL=0
[123650 ms]  >>>  URB 17 going down  >>> 
-- URB_FUNCTION_BULK_OR_INTERRUPT_TRANSFER:
  PipeHandle           = 8926d3cc [endpoint 0x00000081]
  TransferFlags        = 00000003 (USBD_TRANSFER_DIRECTION_IN, USBD_SHORT_TRANSFER_OK)
  TransferBufferLength = 00000200
  TransferBuffer       = 00000000
  TransferBufferMDL    = 891a3be0
  UrbLink              = 00000000
[123650 ms] UsbSnoop - MyInternalIOCTLCompletion(b792e126) : fido=88a972c0, Irp=892a2e70, Context=89309548, IRQL=2
[123650 ms]  <<<  URB 17 coming back  <<< 
-- URB_FUNCTION_BULK_OR_INTERRUPT_TRANSFER:
  PipeHandle           = 8926d3cc [endpoint 0x00000081]
  TransferFlags        = 00000003 (USBD_TRANSFER_DIRECTION_IN, USBD_SHORT_TRANSFER_OK)
  TransferBufferLength = 00000000
  TransferBuffer       = 00000000
  TransferBufferMDL    = 891a3be0
  UrbLink              = 00000000
[123651 ms] UsbSnoop - FilterDispatchAny(b792dfd2) : IRP_MJ_INTERNAL_DEVICE_CONTROL
[123651 ms] UsbSnoop - FdoHookDispatchInternalIoctl(b792e1ea) : fdo=88a903b8, Irp=892a2e70, IRQL=0
[123651 ms]  >>>  URB 18 going down  >>> 
-- URB_FUNCTION_BULK_OR_INTERRUPT_TRANSFER:
  PipeHandle           = 8926d3cc [endpoint 0x00000081]
  TransferFlags        = 00000003 (USBD_TRANSFER_DIRECTION_IN, USBD_SHORT_TRANSFER_OK)
  TransferBufferLength = 00000200
  TransferBuffer       = 00000000
  TransferBufferMDL    = 891a3be0
  UrbLink              = 00000000
[124137 ms] UsbSnoop - MyInternalIOCTLCompletion(b792e126) : fido=88a972c0, Irp=892a2e70, Context=89309548, IRQL=2
[124137 ms]  <<<  URB 18 coming back  <<< 
-- URB_FUNCTION_BULK_OR_INTERRUPT_TRANSFER:
  PipeHandle           = 8926d3cc [endpoint 0x00000081]
  TransferFlags        = 00000003 (USBD_TRANSFER_DIRECTION_IN, USBD_SHORT_TRANSFER_OK)
  TransferBufferLength = 00000200
  TransferBuffer       = 00000000
  TransferBufferMDL    = 891a3be0
    00000000: 00 00 00 00 00 00 00 00 00 00 00 00 00 00 00 00
    00000010: 00 00 00 00 00 00 00 00 00 00 00 00 00 00 00 00
    00000020: 00 00 00 00 00 00 00 00 00 00 00 00 00 00 00 00
    00000030: 00 00 00 00 00 00 00 00 00 00 00 00 00 00 00 00
    00000040: 00 00 00 00 00 00 00 00 00 00 00 00 00 00 00 00
    00000050: 00 00 00 00 00 00 00 00 00 00 00 00 00 00 00 00
    00000060: 00 00 00 00 00 00 00 00 00 00 00 00 00 00 00 00
    00000070: 00 00 00 00 00 00 00 00 00 00 00 00 00 00 00 00
    00000080: 00 00 00 00 00 00 00 00 00 00 00 00 00 00 00 00
    00000090: 00 00 00 00 00 00 00 00 00 00 00 00 00 00 00 00
    000000a0: 00 00 00 00 00 00 00 00 00 00 00 00 00 00 00 00
    000000b0: 00 00 00 00 00 00 00 00 00 00 00 00 00 00 00 00
    000000c0: 00 00 00 00 00 00 00 00 00 00 00 00 00 00 00 00
    000000d0: 00 00 00 00 00 00 00 00 00 00 00 00 00 00 00 00
    000000e0: 00 00 00 00 00 00 00 00 00 00 00 00 00 00 00 00
    000000f0: 00 00 00 00 00 00 00 00 00 00 00 00 00 00 00 00
    00000100: 00 00 00 00 00 00 00 00 00 00 00 00 00 00 00 00
    00000110: 00 00 00 00 00 00 00 00 00 00 00 00 00 00 00 00
    00000120: 00 00 00 00 00 00 00 00 00 00 00 00 00 00 00 00
    00000130: 00 00 00 00 00 00 00 00 00 00 00 00 00 00 00 00
    00000140: 00 00 00 00 00 00 00 00 00 00 00 00 00 00 00 00
    00000150: 00 00 00 00 00 00 00 00 00 00 00 00 00 00 00 00
    00000160: 00 00 00 00 00 00 00 00 00 00 00 00 00 00 00 00
    00000170: 00 00 00 00 00 00 00 00 00 00 00 00 00 00 00 00
    00000180: 00 00 00 00 00 00 00 00 00 00 00 00 00 00 00 00
    00000190: 00 00 00 00 00 00 00 00 00 00 00 00 00 00 00 00
    000001a0: 00 00 00 00 00 00 00 00 00 00 00 00 00 00 00 00
    000001b0: 00 00 00 00 00 00 00 00 00 00 00 00 00 00 00 00
    000001c0: 00 00 00 00 00 00 00 00 00 00 00 00 00 00 00 00
    000001d0: 00 00 00 00 00 00 00 00 00 00 00 00 00 00 00 00
    000001e0: 00 00 00 00 00 00 00 00 00 00 00 00 00 00 00 00
    000001f0: 00 00 00 00 00 00 00 00 00 00 00 00 00 00 00 00
  UrbLink              = 00000000
[124137 ms] UsbSnoop - FilterDispatchAny(b792dfd2) : IRP_MJ_INTERNAL_DEVICE_CONTROL
[124137 ms] UsbSnoop - FdoHookDispatchInternalIoctl(b792e1ea) : fdo=88a903b8, Irp=892a2e70, IRQL=0
[124137 ms]  >>>  URB 19 going down  >>> 
-- URB_FUNCTION_BULK_OR_INTERRUPT_TRANSFER:
  PipeHandle           = 8926d3cc [endpoint 0x00000081]
  TransferFlags        = 00000003 (USBD_TRANSFER_DIRECTION_IN, USBD_SHORT_TRANSFER_OK)
  TransferBufferLength = 00000200
  TransferBuffer       = 00000000
  TransferBufferMDL    = 891a3be0
  UrbLink              = 00000000
[124503 ms] UsbSnoop - FilterDispatchPnp(b793245c) : IRP_MJ_PNP (IRP_MN_QUERY_DEVICE_RELATIONS)
[124503 ms] UsbSnoop - FdoHookDispatchPnp(b793245c) : IRP_MJ_PNP (IRP_MN_QUERY_DEVICE_RELATIONS)
[124503 ms] UsbSnoop - FilterDispatchPnp(b793245c) : IRP_MJ_PNP (IRP_MN_QUERY_DEVICE_RELATIONS)
[124503 ms] UsbSnoop - FdoHookDispatchPnp(b793245c) : IRP_MJ_PNP (IRP_MN_QUERY_DEVICE_RELATIONS)
[124503 ms] UsbSnoop - FilterDispatchAny(b792dfd2) : IRP_MJ_INTERNAL_DEVICE_CONTROL
[124503 ms] UsbSnoop - FdoHookDispatchInternalIoctl(b792e1ea) : fdo=88a903b8, Irp=88aaae70, IRQL=0
[124503 ms]  >>>  URB 20 going down  >>> 
-- URB_FUNCTION_ABORT_PIPE:
  PipeHandle = 8926d3cc [endpoint 0x00000081]
[124648 ms] UsbSnoop - MyInternalIOCTLCompletion(b792e126) : fido=88a972c0, Irp=892a2e70, Context=89309548, IRQL=2
[124648 ms]  <<<  URB 19 coming back  <<< 
-- URB_FUNCTION_BULK_OR_INTERRUPT_TRANSFER:
  PipeHandle           = 8926d3cc [endpoint 0x00000081]
  TransferFlags        = 00000003 (USBD_TRANSFER_DIRECTION_IN, USBD_SHORT_TRANSFER_OK)
  TransferBufferLength = 00000200
  TransferBuffer       = 00000000
  TransferBufferMDL    = 891a3be0
    00000000: 00 00 00 00 00 00 00 00 00 00 00 00 00 00 00 00
    00000010: 00 00 00 00 00 00 00 00 00 00 00 00 00 00 00 00
    00000020: 00 00 00 00 00 00 00 00 00 00 00 00 00 00 00 00
    00000030: 00 00 00 00 00 00 00 00 00 00 00 00 00 00 00 00
    00000040: 00 00 00 00 00 00 00 00 00 00 00 00 00 00 00 00
    00000050: 00 00 00 00 00 00 00 00 00 00 00 00 00 00 00 00
    00000060: 00 00 00 00 00 00 00 00 00 00 00 00 00 00 00 00
    00000070: 00 00 00 00 00 00 00 00 00 00 00 00 00 00 00 00
    00000080: 00 00 00 00 00 00 00 00 00 00 00 00 00 00 00 00
    00000090: 00 00 00 00 00 00 00 00 00 00 00 00 00 00 00 00
    000000a0: 00 00 00 00 00 00 00 00 00 00 00 00 00 00 00 00
    000000b0: 00 00 00 00 00 00 00 00 00 00 00 00 00 00 00 00
    000000c0: 00 00 00 00 00 00 00 00 00 00 00 00 00 00 00 00
    000000d0: 00 00 00 00 00 00 00 00 00 00 00 00 00 00 00 00
    000000e0: 00 00 00 00 00 00 00 00 00 00 00 00 00 00 00 00
    000000f0: 00 00 00 00 00 00 00 00 00 00 00 00 00 00 00 00
    00000100: 00 00 00 00 00 00 00 00 00 00 00 00 00 00 00 00
    00000110: 00 00 00 00 00 00 00 00 00 00 00 00 00 00 00 00
    00000120: 00 00 00 00 00 00 00 00 00 00 00 00 00 00 00 00
    00000130: 00 00 00 00 00 00 00 00 00 00 00 00 00 00 00 00
    00000140: 00 00 00 00 00 00 00 00 00 00 00 00 00 00 00 00
    00000150: 00 00 00 00 00 00 00 00 00 00 00 00 00 00 00 00
    00000160: 00 00 00 00 00 00 00 00 00 00 00 00 00 00 00 00
    00000170: 00 00 00 00 00 00 00 00 00 00 00 00 00 00 00 00
    00000180: 00 00 00 00 00 00 00 00 00 00 00 00 00 00 00 00
    00000190: 00 00 00 00 00 00 00 00 00 00 00 00 00 00 00 00
    000001a0: 00 00 00 00 00 00 00 00 00 00 00 00 00 00 00 00
    000001b0: 00 00 00 00 00 00 00 00 00 00 00 00 00 00 00 00
    000001c0: 00 00 00 00 00 00 00 00 00 00 00 00 00 00 00 00
    000001d0: 00 00 00 00 00 00 00 00 00 00 00 00 00 00 00 00
    000001e0: 00 00 00 00 00 00 00 00 00 00 00 00 00 00 00 00
    000001f0: 00 00 00 00 00 00 00 00 00 00 00 00 00 00 00 00
  UrbLink              = 00000000
[124648 ms] UsbSnoop - MyInternalIOCTLCompletion(b792e126) : fido=00000000, Irp=88aaae70, Context=88ab1068, IRQL=2
[124648 ms]  <<<  URB 20 coming back  <<< 
-- URB_FUNCTION_ABORT_PIPE:
[124648 ms] UsbSnoop - FilterDispatchAny(b792dfd2) : IRP_MJ_INTERNAL_DEVICE_CONTROL
[124648 ms] UsbSnoop - FdoHookDispatchInternalIoctl(b792e1ea) : fdo=88a903b8, Irp=88aaae70, IRQL=0
[124648 ms]  >>>  URB 21 going down  >>> 
-- URB_FUNCTION_ABORT_PIPE:
  PipeHandle = 8926d3ec [endpoint 0x00000002]
[125158 ms] UsbSnoop - MyInternalIOCTLCompletion(b792e126) : fido=00000000, Irp=88aaae70, Context=88ab1068, IRQL=2
[125158 ms]  <<<  URB 21 coming back  <<< 
-- URB_FUNCTION_ABORT_PIPE:
[125158 ms] UsbSnoop - FilterDispatchPnp(b793245c) : IRP_MJ_PNP (IRP_MN_SURPRISE_REMOVAL)
[125158 ms] UsbSnoop - FdoHookDispatchPnp(b793245c) : IRP_MJ_PNP (IRP_MN_SURPRISE_REMOVAL)
[125195 ms] UsbSnoop - FilterAddDevice(b7932748) : DriverObject 88e16788, pdo 88acdde8
[125196 ms] UsbSnoop - FilterDispatchPnp(b793245c) : IRP_MJ_PNP (IRP_MN_QUERY_LEGACY_BUS_INFORMATION)
[125196 ms] UsbSnoop - FdoHookDispatchPnp(b793245c) : IRP_MJ_PNP (IRP_MN_QUERY_LEGACY_BUS_INFORMATION)
[125196 ms] UsbSnoop - FilterDispatchPnp(b793245c) : IRP_MJ_PNP (IRP_MN_QUERY_RESOURCE_REQUIREMENTS)
[125196 ms] UsbSnoop - FdoHookDispatchPnp(b793245c) : IRP_MJ_PNP (IRP_MN_QUERY_RESOURCE_REQUIREMENTS)
[125196 ms] UsbSnoop - FilterDispatchPnp(b793245c) : IRP_MJ_PNP (IRP_MN_FILTER_RESOURCE_REQUIREMENTS)
[125196 ms] UsbSnoop - FdoHookDispatchPnp(b793245c) : IRP_MJ_PNP (IRP_MN_FILTER_RESOURCE_REQUIREMENTS)
[125196 ms] UsbSnoop - FilterDispatchPnp(b793245c) : IRP_MJ_PNP (IRP_MN_START_DEVICE)
[125196 ms] UsbSnoop - FdoHookDispatchPnp(b793245c) : IRP_MJ_PNP (IRP_MN_START_DEVICE)
[125196 ms] UsbSnoop - FilterDispatchAny(b792dfd2) : IRP_MJ_INTERNAL_DEVICE_CONTROL
[125196 ms] UsbSnoop - FdoHookDispatchInternalIoctl(b792e1ea) : fdo=88acdde8, Irp=88aaae70, IRQL=0
[125196 ms]  >>>  URB 1 going down  >>> 
-- URB_FUNCTION_GET_DESCRIPTOR_FROM_DEVICE:
  TransferBufferLength = 00000012
  TransferBuffer       = 88a936e8
  TransferBufferMDL    = 00000000
  Index                = 00000000
  DescriptorType       = 00000001 (USB_DEVICE_DESCRIPTOR_TYPE)
  LanguageId           = 00000000
[125197 ms] UsbSnoop - FilterDispatchAny(b792dfd2) : IRP_MJ_SYSTEM_CONTROL
[125198 ms] UsbSnoop - MyInternalIOCTLCompletion(b792e126) : fido=00000000, Irp=88aaae70, Context=88ab1068, IRQL=2
[125198 ms]  <<<  URB 1 coming back  <<< 
-- URB_FUNCTION_CONTROL_TRANSFER:
  PipeHandle           = 88e19ee0
  TransferFlags        = 0000000b (USBD_TRANSFER_DIRECTION_IN, USBD_SHORT_TRANSFER_OK)
  TransferBufferLength = 00000012
  TransferBuffer       = 88a936e8
  TransferBufferMDL    = 88bd2a48
    00000000: 12 01 00 02 00 00 00 40 51 04 12 e0 04 01 01 02
    00000010: 00 03
  UrbLink              = 00000000
  SetupPacket          =
    00000000: 80 06 00 01 00 00 12 00
[125198 ms] UsbSnoop - FilterDispatchAny(b792dfd2) : IRP_MJ_INTERNAL_DEVICE_CONTROL
[125198 ms] UsbSnoop - FdoHookDispatchInternalIoctl(b792e1ea) : fdo=88acdde8, Irp=88aaae70, IRQL=0
[125198 ms]  >>>  URB 2 going down  >>> 
-- URB_FUNCTION_GET_DESCRIPTOR_FROM_DEVICE:
  TransferBufferLength = 00000009
  TransferBuffer       = 88c2fc38
  TransferBufferMDL    = 00000000
  Index                = 00000000
  DescriptorType       = 00000002 (USB_CONFIGURATION_DESCRIPTOR_TYPE)
  LanguageId           = 00000000
[125200 ms] UsbSnoop - MyInternalIOCTLCompletion(b792e126) : fido=00000000, Irp=88aaae70, Context=88ab1068, IRQL=2
[125200 ms]  <<<  URB 2 coming back  <<< 
-- URB_FUNCTION_CONTROL_TRANSFER:
  PipeHandle           = 88e19ee0
  TransferFlags        = 0000000b (USBD_TRANSFER_DIRECTION_IN, USBD_SHORT_TRANSFER_OK)
  TransferBufferLength = 00000009
  TransferBuffer       = 88c2fc38
  TransferBufferMDL    = 88bd2a48
    00000000: 09 02 2a 00 01 01 03 80 32
  UrbLink              = 00000000
  SetupPacket          =
    00000000: 80 06 00 02 00 00 09 00
[125200 ms] UsbSnoop - FilterDispatchAny(b792dfd2) : IRP_MJ_INTERNAL_DEVICE_CONTROL
[125200 ms] UsbSnoop - FdoHookDispatchInternalIoctl(b792e1ea) : fdo=88acdde8, Irp=88aaae70, IRQL=0
[125200 ms]  >>>  URB 3 going down  >>> 
-- URB_FUNCTION_GET_DESCRIPTOR_FROM_DEVICE:
  TransferBufferLength = 0000002a
  TransferBuffer       = 88a992e0
  TransferBufferMDL    = 00000000
  Index                = 00000000
  DescriptorType       = 00000002 (USB_CONFIGURATION_DESCRIPTOR_TYPE)
  LanguageId           = 00000000
[125202 ms] UsbSnoop - MyInternalIOCTLCompletion(b792e126) : fido=00000000, Irp=88aaae70, Context=88ab1068, IRQL=2
[125202 ms]  <<<  URB 3 coming back  <<< 
-- URB_FUNCTION_CONTROL_TRANSFER:
  PipeHandle           = 88e19ee0
  TransferFlags        = 0000000b (USBD_TRANSFER_DIRECTION_IN, USBD_SHORT_TRANSFER_OK)
  TransferBufferLength = 0000002a
  TransferBuffer       = 88a992e0
  TransferBufferMDL    = 88bd2a48
    00000000: 09 02 2a 00 01 01 03 80 32 09 04 00 00 03 ff 02
    00000010: 00 00 07 05 81 02 40 00 00 07 05 02 02 40 00 00
    00000020: 07 05 83 02 40 00 00 03 09 01
  UrbLink              = 00000000
  SetupPacket          =
    00000000: 80 06 00 02 00 00 2a 00
[125202 ms] UsbSnoop - FilterDispatchAny(b792dfd2) : IRP_MJ_INTERNAL_DEVICE_CONTROL
[125202 ms] UsbSnoop - FdoHookDispatchInternalIoctl(b792e1ea) : fdo=88acdde8, Irp=88aaae70, IRQL=0
[125202 ms]  >>>  URB 4 going down  >>> 
-- URB_FUNCTION_SELECT_CONFIGURATION:
  ConfigurationDescriptor = 0x88a992e0 (configure)
  ConfigurationDescriptor : bLength             = 9
  ConfigurationDescriptor : bDescriptorType     = 0x00000002
  ConfigurationDescriptor : wTotalLength        = 0x0000002a
  ConfigurationDescriptor : bNumInterfaces      = 0x00000001
  ConfigurationDescriptor : bConfigurationValue = 0x00000001
  ConfigurationDescriptor : iConfiguration      = 0x00000003
  ConfigurationDescriptor : bmAttributes        = 0x00000080
  ConfigurationDescriptor : MaxPower            = 0x00000032
  ConfigurationHandle     = 0x00000000
  Interface[0]: Length            = 76
  Interface[0]: InterfaceNumber   = 0
  Interface[0]: AlternateSetting  = 0
[125259 ms] UsbSnoop - MyInternalIOCTLCompletion(b792e126) : fido=00000000, Irp=88aaae70, Context=88ab1068, IRQL=0
[125259 ms]  <<<  URB 4 coming back  <<< 
-- URB_FUNCTION_SELECT_CONFIGURATION:
  ConfigurationDescriptor = 0x88a992e0 (configure)
  ConfigurationDescriptor : bLength             = 9
  ConfigurationDescriptor : bDescriptorType     = 0x00000002
  ConfigurationDescriptor : wTotalLength        = 0x0000002a
  ConfigurationDescriptor : bNumInterfaces      = 0x00000001
  ConfigurationDescriptor : bConfigurationValue = 0x00000001
  ConfigurationDescriptor : iConfiguration      = 0x00000003
  ConfigurationDescriptor : bmAttributes        = 0x00000080
  ConfigurationDescriptor : MaxPower            = 0x00000032
  ConfigurationHandle     = 0x88aa8630
  Interface[0]: Length            = 76
  Interface[0]: InterfaceNumber   = 0
  Interface[0]: AlternateSetting  = 0
  Interface[0]: Class             = 0x000000ff
  Interface[0]: SubClass          = 0x00000002
  Interface[0]: Protocol          = 0x00000000
  Interface[0]: InterfaceHandle   = 0x88a1f1d0
  Interface[0]: NumberOfPipes     = 3
  Interface[0]: Pipes[0] : MaximumPacketSize = 0x00000040
  Interface[0]: Pipes[0] : EndpointAddress   = 0x00000081
  Interface[0]: Pipes[0] : Interval          = 0x00000000
  Interface[0]: Pipes[0] : PipeType          = 0x00000002 (UsbdPipeTypeBulk)
  Interface[0]: Pipes[0] : PipeHandle        = 0x88a1f1ec
  Interface[0]: Pipes[0] : MaxTransferSize   = 0x00001000
  Interface[0]: Pipes[0] : PipeFlags         = 0x00000000
  Interface[0]: Pipes[1] : MaximumPacketSize = 0x00000040
  Interface[0]: Pipes[1] : EndpointAddress   = 0x00000002
  Interface[0]: Pipes[1] : Interval          = 0x00000000
  Interface[0]: Pipes[1] : PipeType          = 0x00000002 (UsbdPipeTypeBulk)
  Interface[0]: Pipes[1] : PipeHandle        = 0x88a1f20c
  Interface[0]: Pipes[1] : MaxTransferSize   = 0x00001000
  Interface[0]: Pipes[1] : PipeFlags         = 0x00000000
  Interface[0]: Pipes[2] : MaximumPacketSize = 0x00000040
  Interface[0]: Pipes[2] : EndpointAddress   = 0x00000083
  Interface[0]: Pipes[2] : Interval          = 0x00000000
  Interface[0]: Pipes[2] : PipeType          = 0x00000002 (UsbdPipeTypeBulk)
  Interface[0]: Pipes[2] : PipeHandle        = 0x88a1f22c
  Interface[0]: Pipes[2] : MaxTransferSize   = 0x00001000
  Interface[0]: Pipes[2] : PipeFlags         = 0x00000000
[125259 ms] UsbSnoop - FilterDispatchPnp(b793245c) : IRP_MJ_PNP (IRP_MN_QUERY_INTERFACE)
[125259 ms] UsbSnoop - FilterDispatchPnp: Query for Bus interface for USB Function Drivers.
[125259 ms] 	InterfaceType: USB_BUS_INTERFACE_USBDI_GUID
[125259 ms] UsbSnoop - FdoHookDispatchPnp(b793245c) : IRP_MJ_PNP (IRP_MN_QUERY_INTERFACE)
[125259 ms] UsbSnoop - FdoHookDispatchPnp: Query for Bus interface for USB Function Drivers.
[125259 ms] 	InterfaceType: USB_BUS_INTERFACE_USBDI_GUID
[125259 ms] UsbSnoop - FilterDispatchPnp(b793245c) : IRP_MJ_PNP (IRP_MN_QUERY_CAPABILITIES)
[125259 ms] UsbSnoop - FdoHookDispatchPnp(b793245c) : IRP_MJ_PNP (IRP_MN_QUERY_CAPABILITIES)
[125259 ms] UsbSnoop - FilterDispatchPnp(b793245c) : IRP_MJ_PNP (IRP_MN_QUERY_PNP_DEVICE_STATE)
[125259 ms] UsbSnoop - FdoHookDispatchPnp(b793245c) : IRP_MJ_PNP (IRP_MN_QUERY_PNP_DEVICE_STATE)
[125259 ms] UsbSnoop - FilterDispatchPnp(b793245c) : IRP_MJ_PNP (IRP_MN_QUERY_DEVICE_RELATIONS)
[125259 ms] UsbSnoop - FdoHookDispatchPnp(b793245c) : IRP_MJ_PNP (IRP_MN_QUERY_DEVICE_RELATIONS)
[125260 ms] UsbSnoop - FilterDispatchPnp(b793245c) : IRP_MJ_PNP (IRP_MN_REMOVE_DEVICE)
[125658 ms] UsbSnoop - FilterDispatchAny(b792dfd2) : IRP_MJ_INTERNAL_DEVICE_CONTROL
[125658 ms] UsbSnoop - FdoHookDispatchInternalIoctl(b792e1ea) : fdo=88acdde8, Irp=88a01950, IRQL=0
[125658 ms]  >>>  URB 5 going down  >>> 
-- URB_FUNCTION_BULK_OR_INTERRUPT_TRANSFER:
  PipeHandle           = 88a1f1ec [endpoint 0x00000081]
  TransferFlags        = 00000003 (USBD_TRANSFER_DIRECTION_IN, USBD_SHORT_TRANSFER_OK)
  TransferBufferLength = 00000200
  TransferBuffer       = 00000000
  TransferBufferMDL    = 88ded990
  UrbLink              = 00000000
[125659 ms] UsbSnoop - MyInternalIOCTLCompletion(b792e126) : fido=889da5b8, Irp=88a01950, Context=88ab1068, IRQL=2
[125659 ms]  <<<  URB 5 coming back  <<< 
-- URB_FUNCTION_BULK_OR_INTERRUPT_TRANSFER:
  PipeHandle           = 88a1f1ec [endpoint 0x00000081]
  TransferFlags        = 00000003 (USBD_TRANSFER_DIRECTION_IN, USBD_SHORT_TRANSFER_OK)
  TransferBufferLength = 00000010
  TransferBuffer       = 00000000
  TransferBufferMDL    = 88ded990
    00000000: 54 fd 00 00 40 03 00 00 40 03 00 00 00 00 01 d8
  UrbLink              = 00000000
[125662 ms] UsbSnoop - FilterDispatchAny(b792dfd2) : IRP_MJ_INTERNAL_DEVICE_CONTROL
[125662 ms] UsbSnoop - FdoHookDispatchInternalIoctl(b792e1ea) : fdo=88acdde8, Irp=88a01950, IRQL=0
[125662 ms]  >>>  URB 6 going down  >>> 
-- URB_FUNCTION_BULK_OR_INTERRUPT_TRANSFER:
  PipeHandle           = 88a1f1ec [endpoint 0x00000081]
  TransferFlags        = 00000003 (USBD_TRANSFER_DIRECTION_IN, USBD_SHORT_TRANSFER_OK)
  TransferBufferLength = 00000200
  TransferBuffer       = 00000000
  TransferBufferMDL    = 88ded990
  UrbLink              = 00000000
[125663 ms] UsbSnoop - FilterDispatchAny(b792dfd2) : IRP_MJ_INTERNAL_DEVICE_CONTROL
[125663 ms] UsbSnoop - FdoHookDispatchInternalIoctl(b792e1ea) : fdo=88acdde8, Irp=88aaae70, IRQL=0
[125663 ms]  >>>  URB 7 going down  >>> 
-- URB_FUNCTION_BULK_OR_INTERRUPT_TRANSFER:
  PipeHandle           = 88a1f20c [endpoint 0x00000002]
  TransferFlags        = 00000002 (USBD_TRANSFER_DIRECTION_OUT, USBD_SHORT_TRANSFER_OK)
  TransferBufferLength = 00000014
  TransferBuffer       = 00000000
  TransferBufferMDL    = 891a3be0
    00000000: 54 fd 64 00 40 03 64 01 40 03 13 43 04 00 01 fb
    00000010: 64 01 ff 00
  UrbLink              = 00000000
[125663 ms] UsbSnoop - MyInternalIOCTLCompletion(b792e126) : fido=889da5b8, Irp=88aaae70, Context=89309548, IRQL=2
[125663 ms]  <<<  URB 7 coming back  <<< 
-- URB_FUNCTION_BULK_OR_INTERRUPT_TRANSFER:
  PipeHandle           = 88a1f20c [endpoint 0x00000002]
  TransferFlags        = 00000002 (USBD_TRANSFER_DIRECTION_OUT, USBD_SHORT_TRANSFER_OK)
  TransferBufferLength = 00000014
  TransferBuffer       = 00000000
  TransferBufferMDL    = 891a3be0
  UrbLink              = 00000000
[128682 ms] UsbSnoop - MyInternalIOCTLCompletion(b792e126) : fido=889da5b8, Irp=88a01950, Context=88ab1068, IRQL=2
[128682 ms]  <<<  URB 6 coming back  <<< 
-- URB_FUNCTION_BULK_OR_INTERRUPT_TRANSFER:
  PipeHandle           = 88a1f1ec [endpoint 0x00000081]
  TransferFlags        = 00000003 (USBD_TRANSFER_DIRECTION_IN, USBD_SHORT_TRANSFER_OK)
  TransferBufferLength = 00000016
  TransferBuffer       = 00000000
  TransferBufferMDL    = 88ded990
    00000000: 54 fd 64 01 80 00 64 00 40 50 39 76 06 00 01 e0
    00000010: 02 00 00 00 00 00
  UrbLink              = 00000000
[128683 ms] UsbSnoop - FilterDispatchAny(b792dfd2) : IRP_MJ_INTERNAL_DEVICE_CONTROL
[128683 ms] UsbSnoop - FdoHookDispatchInternalIoctl(b792e1ea) : fdo=88acdde8, Irp=88a01950, IRQL=0
[128683 ms]  >>>  URB 8 going down  >>> 
-- URB_FUNCTION_BULK_OR_INTERRUPT_TRANSFER:
  PipeHandle           = 88a1f20c [endpoint 0x00000002]
  TransferFlags        = 00000002 (USBD_TRANSFER_DIRECTION_OUT, USBD_SHORT_TRANSFER_OK)
  TransferBufferLength = 00000012
  TransferBuffer       = 00000000
  TransferBufferMDL    = 88ded990
    00000000: 54 fd 64 00 00 d3 64 01 80 00 50 40 02 0a 01 0a
    00000010: 40 50
  UrbLink              = 00000000
[128683 ms] UsbSnoop - FilterDispatchAny(b792dfd2) : IRP_MJ_INTERNAL_DEVICE_CONTROL
[128683 ms] UsbSnoop - FdoHookDispatchInternalIoctl(b792e1ea) : fdo=88acdde8, Irp=88aaae70, IRQL=0
[128683 ms]  >>>  URB 9 going down  >>> 
-- URB_FUNCTION_BULK_OR_INTERRUPT_TRANSFER:
  PipeHandle           = 88a1f1ec [endpoint 0x00000081]
  TransferFlags        = 00000003 (USBD_TRANSFER_DIRECTION_IN, USBD_SHORT_TRANSFER_OK)
  TransferBufferLength = 00000200
  TransferBuffer       = 00000000
  TransferBufferMDL    = 88ace988
  UrbLink              = 00000000
[128683 ms] UsbSnoop - MyInternalIOCTLCompletion(b792e126) : fido=889da5b8, Irp=88a01950, Context=88ab1068, IRQL=2
[128683 ms]  <<<  URB 8 coming back  <<< 
-- URB_FUNCTION_BULK_OR_INTERRUPT_TRANSFER:
  PipeHandle           = 88a1f20c [endpoint 0x00000002]
  TransferFlags        = 00000002 (USBD_TRANSFER_DIRECTION_OUT, USBD_SHORT_TRANSFER_OK)
  TransferBufferLength = 00000012
  TransferBuffer       = 00000000
  TransferBufferMDL    = 88ded990
  UrbLink              = 00000000
[128690 ms] UsbSnoop - MyInternalIOCTLCompletion(b792e126) : fido=889da5b8, Irp=88aaae70, Context=89309548, IRQL=2
[128690 ms]  <<<  URB 9 coming back  <<< 
-- URB_FUNCTION_BULK_OR_INTERRUPT_TRANSFER:
  PipeHandle           = 88a1f1ec [endpoint 0x00000081]
  TransferFlags        = 00000003 (USBD_TRANSFER_DIRECTION_IN, USBD_SHORT_TRANSFER_OK)
  TransferBufferLength = 00000012
  TransferBuffer       = 00000000
  TransferBufferMDL    = 88ace988
    00000000: 54 fd 64 01 40 de 64 00 40 50 00 80 02 00 02 4c
    00000010: 80 00
  UrbLink              = 00000000
[128690 ms] UsbSnoop - FilterDispatchAny(b792dfd2) : IRP_MJ_INTERNAL_DEVICE_CONTROL
[128690 ms] UsbSnoop - FdoHookDispatchInternalIoctl(b792e1ea) : fdo=88acdde8, Irp=88aaae70, IRQL=0
[128690 ms]  >>>  URB 10 going down  >>> 
-- URB_FUNCTION_BULK_OR_INTERRUPT_TRANSFER:
  PipeHandle           = 88a1f1ec [endpoint 0x00000081]
  TransferFlags        = 00000003 (USBD_TRANSFER_DIRECTION_IN, USBD_SHORT_TRANSFER_OK)
  TransferBufferLength = 00000200
  TransferBuffer       = 00000000
  TransferBufferMDL    = 88ace988
  UrbLink              = 00000000
[128691 ms] UsbSnoop - FilterDispatchAny(b792dfd2) : IRP_MJ_INTERNAL_DEVICE_CONTROL
[128691 ms] UsbSnoop - FdoHookDispatchInternalIoctl(b792e1ea) : fdo=88acdde8, Irp=88a01950, IRQL=0
[128691 ms]  >>>  URB 11 going down  >>> 
-- URB_FUNCTION_BULK_OR_INTERRUPT_TRANSFER:
  PipeHandle           = 88a1f20c [endpoint 0x00000002]
  TransferFlags        = 00000002 (USBD_TRANSFER_DIRECTION_OUT, USBD_SHORT_TRANSFER_OK)
  TransferBufferLength = 00000012
  TransferBuffer       = 00000000
  TransferBufferMDL    = 88ded990
    00000000: 54 fd 64 00 00 ff 64 01 80 00 50 40 02 0a 02 37
    00000010: 40 50
  UrbLink              = 00000000
[128691 ms] UsbSnoop - MyInternalIOCTLCompletion(b792e126) : fido=889da5b8, Irp=88a01950, Context=88ab1068, IRQL=2
[128691 ms]  <<<  URB 11 coming back  <<< 
-- URB_FUNCTION_BULK_OR_INTERRUPT_TRANSFER:
  PipeHandle           = 88a1f20c [endpoint 0x00000002]
  TransferFlags        = 00000002 (USBD_TRANSFER_DIRECTION_OUT, USBD_SHORT_TRANSFER_OK)
  TransferBufferLength = 00000012
  TransferBuffer       = 00000000
  TransferBufferMDL    = 88ded990
  UrbLink              = 00000000
[132884 ms] UsbSnoop - FilterDispatchAny(b792dfd2) : IRP_MJ_INTERNAL_DEVICE_CONTROL
[132884 ms] UsbSnoop - FdoHookDispatchInternalIoctl(b792e1ea) : fdo=88acdde8, Irp=889da008, IRQL=0
[132884 ms]  >>>  URB 12 going down  >>> 
-- URB_FUNCTION_BULK_OR_INTERRUPT_TRANSFER:
  PipeHandle           = 88a1f20c [endpoint 0x00000002]
  TransferFlags        = 00000002 (USBD_TRANSFER_DIRECTION_OUT, USBD_SHORT_TRANSFER_OK)
  TransferBufferLength = 00000011
  TransferBuffer       = 00000000
  TransferBufferMDL    = 88e151f0
    00000000: 54 fd 64 00 80 02 64 01 40 20 01 00 01 00 01 ff
    00000010: 01
  UrbLink              = 00000000
[132884 ms] UsbSnoop - MyInternalIOCTLCompletion(b792e126) : fido=889da5b8, Irp=889da008, Context=88ab1068, IRQL=2
[132884 ms]  <<<  URB 12 coming back  <<< 
-- URB_FUNCTION_BULK_OR_INTERRUPT_TRANSFER:
  PipeHandle           = 88a1f20c [endpoint 0x00000002]
  TransferFlags        = 00000002 (USBD_TRANSFER_DIRECTION_OUT, USBD_SHORT_TRANSFER_OK)
  TransferBufferLength = 00000011
  TransferBuffer       = 00000000
  TransferBufferMDL    = 88e151f0
  UrbLink              = 00000000
[132886 ms] UsbSnoop - MyInternalIOCTLCompletion(b792e126) : fido=889da5b8, Irp=88aaae70, Context=89309548, IRQL=2
[132886 ms]  <<<  URB 10 coming back  <<< 
-- URB_FUNCTION_BULK_OR_INTERRUPT_TRANSFER:
  PipeHandle           = 88a1f1ec [endpoint 0x00000081]
  TransferFlags        = 00000003 (USBD_TRANSFER_DIRECTION_IN, USBD_SHORT_TRANSFER_OK)
  TransferBufferLength = 00000012
  TransferBuffer       = 00000000
  TransferBufferMDL    = 88ace988
    00000000: 54 fd 64 01 00 ff 64 00 80 02 20 40 02 0a 01 08
    00000010: 40 20
  UrbLink              = 00000000
[132886 ms] UsbSnoop - FilterDispatchAny(b792dfd2) : IRP_MJ_INTERNAL_DEVICE_CONTROL
[132886 ms] UsbSnoop - FdoHookDispatchInternalIoctl(b792e1ea) : fdo=88acdde8, Irp=88aaae70, IRQL=0
[132886 ms]  >>>  URB 13 going down  >>> 
-- URB_FUNCTION_BULK_OR_INTERRUPT_TRANSFER:
  PipeHandle           = 88a1f1ec [endpoint 0x00000081]
  TransferFlags        = 00000003 (USBD_TRANSFER_DIRECTION_IN, USBD_SHORT_TRANSFER_OK)
  TransferBufferLength = 00000200
  TransferBuffer       = 00000000
  TransferBufferMDL    = 88ace988
  UrbLink              = 00000000
[132903 ms] UsbSnoop - MyInternalIOCTLCompletion(b792e126) : fido=889da5b8, Irp=88aaae70, Context=89309548, IRQL=2
[132903 ms]  <<<  URB 13 coming back  <<< 
-- URB_FUNCTION_BULK_OR_INTERRUPT_TRANSFER:
  PipeHandle           = 88a1f1ec [endpoint 0x00000081]
  TransferFlags        = 00000003 (USBD_TRANSFER_DIRECTION_IN, USBD_SHORT_TRANSFER_OK)
  TransferBufferLength = 0000007f
  TransferBuffer       = 00000000
  TransferBufferMDL    = 88ace988
    00000000: 54 fd 64 01 40 20 64 00 80 02 84 aa 6f 00 03 9c
    00000010: 01 00 00 00 00 01 22 76 00 00 00 00 00 01 be 00
    00000020: 00 00 00 00 00 01 2e 05 c8 00 00 00 00 01 5e b4
    00000030: 84 7f 00 00 5a 01 04 2d 85 01 01 22 d4 01 04 06
    00000040: 23 00 00 00 00 00 02 00 00 00 00 01 40 00 f0 04
    00000050: 00 1e 30 30 30 30 34 42 43 31 42 31 30 45 35 37
    00000060: 30 46 00 30 45 30 30 30 30 30 34 42 43 31 42 31
    00000070: 30 45 35 37 30 46 43 42 32 38 30 34 46 31 00
  UrbLink              = 00000000
[132904 ms] UsbSnoop - FilterDispatchAny(b792dfd2) : IRP_MJ_INTERNAL_DEVICE_CONTROL
[132904 ms] UsbSnoop - FdoHookDispatchInternalIoctl(b792e1ea) : fdo=88acdde8, Irp=88aaae70, IRQL=0
[132904 ms]  >>>  URB 14 going down  >>> 
-- URB_FUNCTION_BULK_OR_INTERRUPT_TRANSFER:
  PipeHandle           = 88a1f20c [endpoint 0x00000002]
  TransferFlags        = 00000002 (USBD_TRANSFER_DIRECTION_OUT, USBD_SHORT_TRANSFER_OK)
  TransferBufferLength = 00000012
  TransferBuffer       = 00000000
  TransferBufferMDL    = 88ace988
    00000000: 54 fd 64 00 00 ff 64 01 40 20 02 80 02 0a 03 0a
    00000010: 80 02
  UrbLink              = 00000000
[132904 ms] UsbSnoop - FilterDispatchAny(b792dfd2) : IRP_MJ_INTERNAL_DEVICE_CONTROL
[132904 ms] UsbSnoop - FdoHookDispatchInternalIoctl(b792e1ea) : fdo=88acdde8, Irp=889da008, IRQL=0
[132904 ms]  >>>  URB 15 going down  >>> 
-- URB_FUNCTION_BULK_OR_INTERRUPT_TRANSFER:
  PipeHandle           = 88a1f1ec [endpoint 0x00000081]
  TransferFlags        = 00000003 (USBD_TRANSFER_DIRECTION_IN, USBD_SHORT_TRANSFER_OK)
  TransferBufferLength = 00000200
  TransferBuffer       = 00000000
  TransferBufferMDL    = 88e151f0
  UrbLink              = 00000000
[132904 ms] UsbSnoop - MyInternalIOCTLCompletion(b792e126) : fido=889da5b8, Irp=88aaae70, Context=89309548, IRQL=2
[132904 ms]  <<<  URB 14 coming back  <<< 
-- URB_FUNCTION_BULK_OR_INTERRUPT_TRANSFER:
  PipeHandle           = 88a1f20c [endpoint 0x00000002]
  TransferFlags        = 00000002 (USBD_TRANSFER_DIRECTION_OUT, USBD_SHORT_TRANSFER_OK)
  TransferBufferLength = 00000012
  TransferBuffer       = 00000000
  TransferBufferMDL    = 88ace988
  UrbLink              = 00000000
[132907 ms] UsbSnoop - FilterDispatchAny(b792dfd2) : IRP_MJ_INTERNAL_DEVICE_CONTROL
[132907 ms] UsbSnoop - FdoHookDispatchInternalIoctl(b792e1ea) : fdo=88acdde8, Irp=88aaae70, IRQL=0
[132907 ms]  >>>  URB 16 going down  >>> 
-- URB_FUNCTION_BULK_OR_INTERRUPT_TRANSFER:
  PipeHandle           = 88a1f20c [endpoint 0x00000002]
  TransferFlags        = 00000002 (USBD_TRANSFER_DIRECTION_OUT, USBD_SHORT_TRANSFER_OK)
  TransferBufferLength = 00000011
  TransferBuffer       = 00000000
  TransferBufferMDL    = 88ace988
    00000000: 54 fd 64 00 80 02 64 01 40 20 02 00 01 00 02 01
    00000010: 02
  UrbLink              = 00000000
[132907 ms] UsbSnoop - MyInternalIOCTLCompletion(b792e126) : fido=889da5b8, Irp=88aaae70, Context=89309548, IRQL=2
[132907 ms]  <<<  URB 16 coming back  <<< 
-- URB_FUNCTION_BULK_OR_INTERRUPT_TRANSFER:
  PipeHandle           = 88a1f20c [endpoint 0x00000002]
  TransferFlags        = 00000002 (USBD_TRANSFER_DIRECTION_OUT, USBD_SHORT_TRANSFER_OK)
  TransferBufferLength = 00000011
  TransferBuffer       = 00000000
  TransferBufferMDL    = 88ace988
  UrbLink              = 00000000
[132909 ms] UsbSnoop - MyInternalIOCTLCompletion(b792e126) : fido=889da5b8, Irp=889da008, Context=88ab1068, IRQL=2
[132909 ms]  <<<  URB 15 coming back  <<< 
-- URB_FUNCTION_BULK_OR_INTERRUPT_TRANSFER:
  PipeHandle           = 88a1f1ec [endpoint 0x00000081]
  TransferFlags        = 00000003 (USBD_TRANSFER_DIRECTION_IN, USBD_SHORT_TRANSFER_OK)
  TransferBufferLength = 00000012
  TransferBuffer       = 00000000
  TransferBufferMDL    = 88e151f0
    00000000: 54 fd 64 01 00 ff 64 00 80 02 20 40 02 0a 02 09
    00000010: 40 20
  UrbLink              = 00000000
[132911 ms] UsbSnoop - FilterDispatchAny(b792dfd2) : IRP_MJ_INTERNAL_DEVICE_CONTROL
[132911 ms] UsbSnoop - FdoHookDispatchInternalIoctl(b792e1ea) : fdo=88acdde8, Irp=889da008, IRQL=0
[132911 ms]  >>>  URB 17 going down  >>> 
-- URB_FUNCTION_BULK_OR_INTERRUPT_TRANSFER:
  PipeHandle           = 88a1f1ec [endpoint 0x00000081]
  TransferFlags        = 00000003 (USBD_TRANSFER_DIRECTION_IN, USBD_SHORT_TRANSFER_OK)
  TransferBufferLength = 00000200
  TransferBuffer       = 00000000
  TransferBufferMDL    = 88e151f0
  UrbLink              = 00000000
[132912 ms] UsbSnoop - MyInternalIOCTLCompletion(b792e126) : fido=889da5b8, Irp=889da008, Context=88ab1068, IRQL=2
[132912 ms]  <<<  URB 17 coming back  <<< 
-- URB_FUNCTION_BULK_OR_INTERRUPT_TRANSFER:
  PipeHandle           = 88a1f1ec [endpoint 0x00000081]
  TransferFlags        = 00000003 (USBD_TRANSFER_DIRECTION_IN, USBD_SHORT_TRANSFER_OK)
  TransferBufferLength = 0000001b
  TransferBuffer       = 00000000
  TransferBufferMDL    = 88e151f0
    00000000: 54 fd 64 01 40 20 64 00 80 02 38 5a 0b 00 04 9d
    00000010: 02 54 49 2d 4e 73 70 69 72 65 00
  UrbLink              = 00000000
[132913 ms] UsbSnoop - FilterDispatchAny(b792dfd2) : IRP_MJ_INTERNAL_DEVICE_CONTROL
[132913 ms] UsbSnoop - FdoHookDispatchInternalIoctl(b792e1ea) : fdo=88acdde8, Irp=88aaae70, IRQL=0
[132914 ms]  >>>  URB 18 going down  >>> 
-- URB_FUNCTION_BULK_OR_INTERRUPT_TRANSFER:
  PipeHandle           = 88a1f1ec [endpoint 0x00000081]
  TransferFlags        = 00000003 (USBD_TRANSFER_DIRECTION_IN, USBD_SHORT_TRANSFER_OK)
  TransferBufferLength = 00000200
  TransferBuffer       = 00000000
  TransferBufferMDL    = 88e151f0
  UrbLink              = 00000000
[132914 ms] UsbSnoop - FilterDispatchAny(b792dfd2) : IRP_MJ_INTERNAL_DEVICE_CONTROL
[132914 ms] UsbSnoop - FdoHookDispatchInternalIoctl(b792e1ea) : fdo=88acdde8, Irp=889da008, IRQL=0
[132914 ms]  >>>  URB 19 going down  >>> 
-- URB_FUNCTION_BULK_OR_INTERRUPT_TRANSFER:
  PipeHandle           = 88a1f20c [endpoint 0x00000002]
  TransferFlags        = 00000002 (USBD_TRANSFER_DIRECTION_OUT, USBD_SHORT_TRANSFER_OK)
  TransferBufferLength = 00000012
  TransferBuffer       = 00000000
  TransferBufferMDL    = 88ace988
    00000000: 54 fd 64 00 00 ff 64 01 40 20 02 80 02 0a 04 0b
    00000010: 80 02
  UrbLink              = 00000000
[132914 ms] UsbSnoop - MyInternalIOCTLCompletion(b792e126) : fido=889da5b8, Irp=889da008, Context=89309548, IRQL=2
[132914 ms]  <<<  URB 19 coming back  <<< 
-- URB_FUNCTION_BULK_OR_INTERRUPT_TRANSFER:
  PipeHandle           = 88a1f20c [endpoint 0x00000002]
  TransferFlags        = 00000002 (USBD_TRANSFER_DIRECTION_OUT, USBD_SHORT_TRANSFER_OK)
  TransferBufferLength = 00000012
  TransferBuffer       = 00000000
  TransferBufferMDL    = 88ace988
  UrbLink              = 00000000
[132914 ms] UsbSnoop - FilterDispatchAny(b792dfd2) : IRP_MJ_INTERNAL_DEVICE_CONTROL
[132914 ms] UsbSnoop - FdoHookDispatchInternalIoctl(b792e1ea) : fdo=88acdde8, Irp=889da008, IRQL=0
[132914 ms]  >>>  URB 20 going down  >>> 
-- URB_FUNCTION_BULK_OR_INTERRUPT_TRANSFER:
  PipeHandle           = 88a1f20c [endpoint 0x00000002]
  TransferFlags        = 00000002 (USBD_TRANSFER_DIRECTION_OUT, USBD_SHORT_TRANSFER_OK)
  TransferBufferLength = 00000011
  TransferBuffer       = 00000000
  TransferBufferMDL    = 88ace988
    00000000: 54 fd 64 00 80 02 64 01 40 20 03 00 01 00 03 03
    00000010: 03
  UrbLink              = 00000000
[132915 ms] UsbSnoop - MyInternalIOCTLCompletion(b792e126) : fido=889da5b8, Irp=889da008, Context=89309548, IRQL=2
[132915 ms]  <<<  URB 20 coming back  <<< 
-- URB_FUNCTION_BULK_OR_INTERRUPT_TRANSFER:
  PipeHandle           = 88a1f20c [endpoint 0x00000002]
  TransferFlags        = 00000002 (USBD_TRANSFER_DIRECTION_OUT, USBD_SHORT_TRANSFER_OK)
  TransferBufferLength = 00000011
  TransferBuffer       = 00000000
  TransferBufferMDL    = 88ace988
  UrbLink              = 00000000
[132918 ms] UsbSnoop - MyInternalIOCTLCompletion(b792e126) : fido=889da5b8, Irp=88aaae70, Context=88ab1068, IRQL=2
[132918 ms]  <<<  URB 18 coming back  <<< 
-- URB_FUNCTION_BULK_OR_INTERRUPT_TRANSFER:
  PipeHandle           = 88a1f1ec [endpoint 0x00000081]
  TransferFlags        = 00000003 (USBD_TRANSFER_DIRECTION_IN, USBD_SHORT_TRANSFER_OK)
  TransferBufferLength = 00000012
  TransferBuffer       = 00000000
  TransferBufferMDL    = 88e151f0
    00000000: 54 fd 64 01 00 ff 64 00 80 02 20 40 02 0a 03 0a
    00000010: 40 20
  UrbLink              = 00000000
[132918 ms] UsbSnoop - FilterDispatchAny(b792dfd2) : IRP_MJ_INTERNAL_DEVICE_CONTROL
[132918 ms] UsbSnoop - FdoHookDispatchInternalIoctl(b792e1ea) : fdo=88acdde8, Irp=88aaae70, IRQL=0
[132918 ms]  >>>  URB 21 going down  >>> 
-- URB_FUNCTION_BULK_OR_INTERRUPT_TRANSFER:
  PipeHandle           = 88a1f1ec [endpoint 0x00000081]
  TransferFlags        = 00000003 (USBD_TRANSFER_DIRECTION_IN, USBD_SHORT_TRANSFER_OK)
  TransferBufferLength = 00000200
  TransferBuffer       = 00000000
  TransferBufferMDL    = 88e151f0
  UrbLink              = 00000000
[132921 ms] UsbSnoop - MyInternalIOCTLCompletion(b792e126) : fido=889da5b8, Irp=88aaae70, Context=88ab1068, IRQL=2
[132921 ms]  <<<  URB 21 coming back  <<< 
-- URB_FUNCTION_BULK_OR_INTERRUPT_TRANSFER:
  PipeHandle           = 88a1f1ec [endpoint 0x00000081]
  TransferFlags        = 00000003 (USBD_TRANSFER_DIRECTION_IN, USBD_SHORT_TRANSFER_OK)
  TransferBufferLength = 0000001b
  TransferBuffer       = 00000000
  TransferBufferMDL    = 88e151f0
    00000000: 54 fd 64 01 40 20 64 00 80 02 96 7f 0b 00 05 21
    00000010: 03 2e 74 6e 73 00 2e 74 6e 6f 00
  UrbLink              = 00000000
[132924 ms] UsbSnoop - FilterDispatchAny(b792dfd2) : IRP_MJ_INTERNAL_DEVICE_CONTROL
[132924 ms] UsbSnoop - FdoHookDispatchInternalIoctl(b792e1ea) : fdo=88acdde8, Irp=88aaae70, IRQL=0
[132924 ms]  >>>  URB 22 going down  >>> 
-- URB_FUNCTION_BULK_OR_INTERRUPT_TRANSFER:
  PipeHandle           = 88a1f1ec [endpoint 0x00000081]
  TransferFlags        = 00000003 (USBD_TRANSFER_DIRECTION_IN, USBD_SHORT_TRANSFER_OK)
  TransferBufferLength = 00000200
  TransferBuffer       = 00000000
  TransferBufferMDL    = 88e151f0
  UrbLink              = 00000000
[132924 ms] UsbSnoop - FilterDispatchAny(b792dfd2) : IRP_MJ_INTERNAL_DEVICE_CONTROL
[132924 ms] UsbSnoop - FdoHookDispatchInternalIoctl(b792e1ea) : fdo=88acdde8, Irp=889da008, IRQL=0
[132924 ms]  >>>  URB 23 going down  >>> 
-- URB_FUNCTION_BULK_OR_INTERRUPT_TRANSFER:
  PipeHandle           = 88a1f20c [endpoint 0x00000002]
  TransferFlags        = 00000002 (USBD_TRANSFER_DIRECTION_OUT, USBD_SHORT_TRANSFER_OK)
  TransferBufferLength = 00000012
  TransferBuffer       = 00000000
  TransferBufferMDL    = 88ace988
    00000000: 54 fd 64 00 00 ff 64 01 40 20 02 80 02 0a 05 0c
    00000010: 80 02
  UrbLink              = 00000000
[132924 ms] UsbSnoop - MyInternalIOCTLCompletion(b792e126) : fido=889da5b8, Irp=889da008, Context=89309548, IRQL=2
[132924 ms]  <<<  URB 23 coming back  <<< 
-- URB_FUNCTION_BULK_OR_INTERRUPT_TRANSFER:
  PipeHandle           = 88a1f20c [endpoint 0x00000002]
  TransferFlags        = 00000002 (USBD_TRANSFER_DIRECTION_OUT, USBD_SHORT_TRANSFER_OK)
  TransferBufferLength = 00000012
  TransferBuffer       = 00000000
  TransferBufferMDL    = 88ace988
  UrbLink              = 00000000
[132925 ms] UsbSnoop - FilterDispatchAny(b792dfd2) : IRP_MJ_INTERNAL_DEVICE_CONTROL
[132925 ms] UsbSnoop - FdoHookDispatchInternalIoctl(b792e1ea) : fdo=88acdde8, Irp=889da008, IRQL=0
[132925 ms]  >>>  URB 24 going down  >>> 
-- URB_FUNCTION_BULK_OR_INTERRUPT_TRANSFER:
  PipeHandle           = 88a1f20c [endpoint 0x00000002]
  TransferFlags        = 00000002 (USBD_TRANSFER_DIRECTION_OUT, USBD_SHORT_TRANSFER_OK)
  TransferBufferLength = 00000012
  TransferBuffer       = 00000000
  TransferBufferMDL    = 88ace988
    00000000: 54 fd 64 00 40 de 64 01 40 20 02 80 02 00 04 20
    00000010: 80 02
  UrbLink              = 00000000
[132925 ms] UsbSnoop - MyInternalIOCTLCompletion(b792e126) : fido=889da5b8, Irp=889da008, Context=89309548, IRQL=2
[132925 ms]  <<<  URB 24 coming back  <<< 
-- URB_FUNCTION_BULK_OR_INTERRUPT_TRANSFER:
  PipeHandle           = 88a1f20c [endpoint 0x00000002]
  TransferFlags        = 00000002 (USBD_TRANSFER_DIRECTION_OUT, USBD_SHORT_TRANSFER_OK)
  TransferBufferLength = 00000012
  TransferBuffer       = 00000000
  TransferBufferMDL    = 88ace988
  UrbLink              = 00000000
[132928 ms] UsbSnoop - MyInternalIOCTLCompletion(b792e126) : fido=889da5b8, Irp=88aaae70, Context=88ab1068, IRQL=2
[132928 ms]  <<<  URB 22 coming back  <<< 
-- URB_FUNCTION_BULK_OR_INTERRUPT_TRANSFER:
  PipeHandle           = 88a1f1ec [endpoint 0x00000081]
  TransferFlags        = 00000003 (USBD_TRANSFER_DIRECTION_IN, USBD_SHORT_TRANSFER_OK)
  TransferBufferLength = 00000012
  TransferBuffer       = 00000000
  TransferBufferMDL    = 88e151f0
    00000000: 54 fd 64 01 00 ff 64 00 80 02 20 40 02 0a 04 0b
    00000010: 40 20
  UrbLink              = 00000000
[132928 ms] UsbSnoop - FilterDispatchAny(b792dfd2) : IRP_MJ_INTERNAL_DEVICE_CONTROL
[132928 ms] UsbSnoop - FdoHookDispatchInternalIoctl(b792e1ea) : fdo=88acdde8, Irp=88aaae70, IRQL=0
[132928 ms]  >>>  URB 25 going down  >>> 
-- URB_FUNCTION_BULK_OR_INTERRUPT_TRANSFER:
  PipeHandle           = 88a1f1ec [endpoint 0x00000081]
  TransferFlags        = 00000003 (USBD_TRANSFER_DIRECTION_IN, USBD_SHORT_TRANSFER_OK)
  TransferBufferLength = 00000200
  TransferBuffer       = 00000000
  TransferBufferMDL    = 88e151f0
  UrbLink              = 00000000
[137456 ms] UsbSnoop - FilterDispatchAny(b792dfd2) : IRP_MJ_INTERNAL_DEVICE_CONTROL
[137456 ms] UsbSnoop - FdoHookDispatchInternalIoctl(b792e1ea) : fdo=88acdde8, Irp=88a93708, IRQL=0
[137456 ms]  >>>  URB 26 going down  >>> 
-- URB_FUNCTION_BULK_OR_INTERRUPT_TRANSFER:
  PipeHandle           = 88a1f20c [endpoint 0x00000002]
  TransferFlags        = 00000002 (USBD_TRANSFER_DIRECTION_OUT, USBD_SHORT_TRANSFER_OK)
  TransferBufferLength = 0000001b
  TransferBuffer       = 00000000
  TransferBufferMDL    = 891a3be0
    00000000: 54 fd 64 00 80 03 64 01 40 60 0c f1 0b 00 05 4a
    00000010: 20 01 2f 00 00 00 00 00 00 00 00
  UrbLink              = 00000000
[137456 ms] UsbSnoop - MyInternalIOCTLCompletion(b792e126) : fido=889da5b8, Irp=88a93708, Context=89309548, IRQL=2
[137456 ms]  <<<  URB 26 coming back  <<< 
-- URB_FUNCTION_BULK_OR_INTERRUPT_TRANSFER:
  PipeHandle           = 88a1f20c [endpoint 0x00000002]
  TransferFlags        = 00000002 (USBD_TRANSFER_DIRECTION_OUT, USBD_SHORT_TRANSFER_OK)
  TransferBufferLength = 0000001b
  TransferBuffer       = 00000000
  TransferBufferMDL    = 891a3be0
  UrbLink              = 00000000
[137458 ms] UsbSnoop - MyInternalIOCTLCompletion(b792e126) : fido=889da5b8, Irp=88aaae70, Context=88ab1068, IRQL=2
[137458 ms]  <<<  URB 25 coming back  <<< 
-- URB_FUNCTION_BULK_OR_INTERRUPT_TRANSFER:
  PipeHandle           = 88a1f1ec [endpoint 0x00000081]
  TransferFlags        = 00000003 (USBD_TRANSFER_DIRECTION_IN, USBD_SHORT_TRANSFER_OK)
  TransferBufferLength = 00000012
  TransferBuffer       = 00000000
  TransferBufferMDL    = 88e151f0
    00000000: 54 fd 64 01 00 ff 64 00 80 03 60 40 02 0a 05 4d
    00000010: 40 60
  UrbLink              = 00000000
[137458 ms] UsbSnoop - FilterDispatchAny(b792dfd2) : IRP_MJ_INTERNAL_DEVICE_CONTROL
[137458 ms] UsbSnoop - FdoHookDispatchInternalIoctl(b792e1ea) : fdo=88acdde8, Irp=88aaae70, IRQL=0
[137458 ms]  >>>  URB 27 going down  >>> 
-- URB_FUNCTION_BULK_OR_INTERRUPT_TRANSFER:
  PipeHandle           = 88a1f1ec [endpoint 0x00000081]
  TransferFlags        = 00000003 (USBD_TRANSFER_DIRECTION_IN, USBD_SHORT_TRANSFER_OK)
  TransferBufferLength = 00000200
  TransferBuffer       = 00000000
  TransferBufferMDL    = 88e151f0
  UrbLink              = 00000000
[137467 ms] UsbSnoop - MyInternalIOCTLCompletion(b792e126) : fido=889da5b8, Irp=88aaae70, Context=88ab1068, IRQL=2
[137467 ms]  <<<  URB 27 coming back  <<< 
-- URB_FUNCTION_BULK_OR_INTERRUPT_TRANSFER:
  PipeHandle           = 88a1f1ec [endpoint 0x00000081]
  TransferFlags        = 00000003 (USBD_TRANSFER_DIRECTION_IN, USBD_SHORT_TRANSFER_OK)
  TransferBufferLength = 0000001b
  TransferBuffer       = 00000000
  TransferBufferMDL    = 88e151f0
    00000000: 54 fd 64 01 40 60 64 00 80 03 ae 33 0b 00 06 2f
    00000010: 20 00 00 00 00 00 00 d0 66 01 00
  UrbLink              = 00000000
[137467 ms] UsbSnoop - FilterDispatchAny(b792dfd2) : IRP_MJ_INTERNAL_DEVICE_CONTROL
[137467 ms] UsbSnoop - FdoHookDispatchInternalIoctl(b792e1ea) : fdo=88acdde8, Irp=88aaae70, IRQL=0
[137467 ms]  >>>  URB 28 going down  >>> 
-- URB_FUNCTION_BULK_OR_INTERRUPT_TRANSFER:
  PipeHandle           = 88a1f1ec [endpoint 0x00000081]
  TransferFlags        = 00000003 (USBD_TRANSFER_DIRECTION_IN, USBD_SHORT_TRANSFER_OK)
  TransferBufferLength = 00000200
  TransferBuffer       = 00000000
  TransferBufferMDL    = 88e151f0
  UrbLink              = 00000000
[137468 ms] UsbSnoop - FilterDispatchAny(b792dfd2) : IRP_MJ_INTERNAL_DEVICE_CONTROL
[137468 ms] UsbSnoop - FdoHookDispatchInternalIoctl(b792e1ea) : fdo=88acdde8, Irp=88a93708, IRQL=0
[137468 ms]  >>>  URB 29 going down  >>> 
-- URB_FUNCTION_BULK_OR_INTERRUPT_TRANSFER:
  PipeHandle           = 88a1f20c [endpoint 0x00000002]
  TransferFlags        = 00000002 (USBD_TRANSFER_DIRECTION_OUT, USBD_SHORT_TRANSFER_OK)
  TransferBufferLength = 00000012
  TransferBuffer       = 00000000
  TransferBufferMDL    = 891a3be0
    00000000: 54 fd 64 00 00 ff 64 01 40 60 03 80 02 0a 06 4e
    00000010: 80 03
  UrbLink              = 00000000
[137468 ms] UsbSnoop - MyInternalIOCTLCompletion(b792e126) : fido=889da5b8, Irp=88a93708, Context=89309548, IRQL=2
[137468 ms]  <<<  URB 29 coming back  <<< 
-- URB_FUNCTION_BULK_OR_INTERRUPT_TRANSFER:
  PipeHandle           = 88a1f20c [endpoint 0x00000002]
  TransferFlags        = 00000002 (USBD_TRANSFER_DIRECTION_OUT, USBD_SHORT_TRANSFER_OK)
  TransferBufferLength = 00000012
  TransferBuffer       = 00000000
  TransferBufferMDL    = 891a3be0
  UrbLink              = 00000000
[137469 ms] UsbSnoop - FilterDispatchAny(b792dfd2) : IRP_MJ_INTERNAL_DEVICE_CONTROL
[137469 ms] UsbSnoop - FdoHookDispatchInternalIoctl(b792e1ea) : fdo=88acdde8, Irp=88a93708, IRQL=0
[137470 ms]  >>>  URB 30 going down  >>> 
-- URB_FUNCTION_BULK_OR_INTERRUPT_TRANSFER:
  PipeHandle           = 88a1f20c [endpoint 0x00000002]
  TransferFlags        = 00000002 (USBD_TRANSFER_DIRECTION_OUT, USBD_SHORT_TRANSFER_OK)
  TransferBufferLength = 00000012
  TransferBuffer       = 00000000
  TransferBufferMDL    = 891a3be0
    00000000: 54 fd 64 00 40 de 64 01 40 60 03 80 02 00 06 63
    00000010: 80 03
  UrbLink              = 00000000
[137470 ms] UsbSnoop - MyInternalIOCTLCompletion(b792e126) : fido=889da5b8, Irp=88a93708, Context=89309548, IRQL=2
[137470 ms]  <<<  URB 30 coming back  <<< 
-- URB_FUNCTION_BULK_OR_INTERRUPT_TRANSFER:
  PipeHandle           = 88a1f20c [endpoint 0x00000002]
  TransferFlags        = 00000002 (USBD_TRANSFER_DIRECTION_OUT, USBD_SHORT_TRANSFER_OK)
  TransferBufferLength = 00000012
  TransferBuffer       = 00000000
  TransferBufferMDL    = 891a3be0
  UrbLink              = 00000000
[137473 ms] UsbSnoop - MyInternalIOCTLCompletion(b792e126) : fido=889da5b8, Irp=88aaae70, Context=88ab1068, IRQL=2
[137473 ms]  <<<  URB 28 coming back  <<< 
-- URB_FUNCTION_BULK_OR_INTERRUPT_TRANSFER:
  PipeHandle           = 88a1f1ec [endpoint 0x00000081]
  TransferFlags        = 00000003 (USBD_TRANSFER_DIRECTION_IN, USBD_SHORT_TRANSFER_OK)
  TransferBufferLength = 00000012
  TransferBuffer       = 00000000
  TransferBufferMDL    = 88e151f0
    00000000: 54 fd 64 01 00 ff 64 00 80 03 60 40 02 0a 06 4e
    00000010: 40 60
  UrbLink              = 00000000
[137473 ms] UsbSnoop - FilterDispatchAny(b792dfd2) : IRP_MJ_INTERNAL_DEVICE_CONTROL
[137473 ms] UsbSnoop - FdoHookDispatchInternalIoctl(b792e1ea) : fdo=88acdde8, Irp=88aaae70, IRQL=0
[137473 ms]  >>>  URB 31 going down  >>> 
-- URB_FUNCTION_BULK_OR_INTERRUPT_TRANSFER:
  PipeHandle           = 88a1f1ec [endpoint 0x00000081]
  TransferFlags        = 00000003 (USBD_TRANSFER_DIRECTION_IN, USBD_SHORT_TRANSFER_OK)
  TransferBufferLength = 00000200
  TransferBuffer       = 00000000
  TransferBufferMDL    = 88e151f0
  UrbLink              = 00000000
[137478 ms] UsbSnoop - FilterDispatchAny(b792dfd2) : IRP_MJ_INTERNAL_DEVICE_CONTROL
[137478 ms] UsbSnoop - FdoHookDispatchInternalIoctl(b792e1ea) : fdo=88acdde8, Irp=88a93708, IRQL=0
[137478 ms]  >>>  URB 32 going down  >>> 
-- URB_FUNCTION_BULK_OR_INTERRUPT_TRANSFER:
  PipeHandle           = 88a1f20c [endpoint 0x00000002]
  TransferFlags        = 00000002 (USBD_TRANSFER_DIRECTION_OUT, USBD_SHORT_TRANSFER_OK)
  TransferBufferLength = 0000001a
  TransferBuffer       = 00000000
  TransferBufferMDL    = 891a3be0
    00000000: 54 fd 64 00 80 04 64 01 40 60 c0 aa 0a 00 07 b9
    00000010: 0d 2f 00 00 00 00 00 00 00 00
  UrbLink              = 00000000
[137478 ms] UsbSnoop - MyInternalIOCTLCompletion(b792e126) : fido=889da5b8, Irp=88a93708, Context=89309548, IRQL=2
[137478 ms]  <<<  URB 32 coming back  <<< 
-- URB_FUNCTION_BULK_OR_INTERRUPT_TRANSFER:
  PipeHandle           = 88a1f20c [endpoint 0x00000002]
  TransferFlags        = 00000002 (USBD_TRANSFER_DIRECTION_OUT, USBD_SHORT_TRANSFER_OK)
  TransferBufferLength = 0000001a
  TransferBuffer       = 00000000
  TransferBufferMDL    = 891a3be0
  UrbLink              = 00000000
[137484 ms] UsbSnoop - MyInternalIOCTLCompletion(b792e126) : fido=889da5b8, Irp=88aaae70, Context=88ab1068, IRQL=2
[137484 ms]  <<<  URB 31 coming back  <<< 
-- URB_FUNCTION_BULK_OR_INTERRUPT_TRANSFER:
  PipeHandle           = 88a1f1ec [endpoint 0x00000081]
  TransferFlags        = 00000003 (USBD_TRANSFER_DIRECTION_IN, USBD_SHORT_TRANSFER_OK)
  TransferBufferLength = 00000012
  TransferBuffer       = 00000000
  TransferBufferMDL    = 88e151f0
    00000000: 54 fd 64 01 00 ff 64 00 80 04 60 40 02 0a 07 50
    00000010: 40 60
  UrbLink              = 00000000
[137484 ms] UsbSnoop - FilterDispatchAny(b792dfd2) : IRP_MJ_INTERNAL_DEVICE_CONTROL
[137484 ms] UsbSnoop - FdoHookDispatchInternalIoctl(b792e1ea) : fdo=88acdde8, Irp=88aaae70, IRQL=0
[137484 ms]  >>>  URB 33 going down  >>> 
-- URB_FUNCTION_BULK_OR_INTERRUPT_TRANSFER:
  PipeHandle           = 88a1f1ec [endpoint 0x00000081]
  TransferFlags        = 00000003 (USBD_TRANSFER_DIRECTION_IN, USBD_SHORT_TRANSFER_OK)
  TransferBufferLength = 00000200
  TransferBuffer       = 00000000
  TransferBufferMDL    = 88e151f0
  UrbLink              = 00000000
[137492 ms] UsbSnoop - MyInternalIOCTLCompletion(b792e126) : fido=889da5b8, Irp=88aaae70, Context=88ab1068, IRQL=2
[137492 ms]  <<<  URB 33 coming back  <<< 
-- URB_FUNCTION_BULK_OR_INTERRUPT_TRANSFER:
  PipeHandle           = 88a1f1ec [endpoint 0x00000081]
  TransferFlags        = 00000003 (USBD_TRANSFER_DIRECTION_IN, USBD_SHORT_TRANSFER_OK)
  TransferBufferLength = 00000012
  TransferBuffer       = 00000000
  TransferBufferMDL    = 88e151f0
    00000000: 54 fd 64 01 40 60 64 00 80 04 00 ff 02 00 07 46
    00000010: ff 00
  UrbLink              = 00000000
[137492 ms] UsbSnoop - FilterDispatchAny(b792dfd2) : IRP_MJ_INTERNAL_DEVICE_CONTROL
[137492 ms] UsbSnoop - FdoHookDispatchInternalIoctl(b792e1ea) : fdo=88acdde8, Irp=88aaae70, IRQL=0
[137492 ms]  >>>  URB 34 going down  >>> 
-- URB_FUNCTION_BULK_OR_INTERRUPT_TRANSFER:
  PipeHandle           = 88a1f1ec [endpoint 0x00000081]
  TransferFlags        = 00000003 (USBD_TRANSFER_DIRECTION_IN, USBD_SHORT_TRANSFER_OK)
  TransferBufferLength = 00000200
  TransferBuffer       = 00000000
  TransferBufferMDL    = 88e151f0
  UrbLink              = 00000000
[137493 ms] UsbSnoop - FilterDispatchAny(b792dfd2) : IRP_MJ_INTERNAL_DEVICE_CONTROL
[137493 ms] UsbSnoop - FdoHookDispatchInternalIoctl(b792e1ea) : fdo=88acdde8, Irp=88a93708, IRQL=0
[137493 ms]  >>>  URB 35 going down  >>> 
-- URB_FUNCTION_BULK_OR_INTERRUPT_TRANSFER:
  PipeHandle           = 88a1f20c [endpoint 0x00000002]
  TransferFlags        = 00000002 (USBD_TRANSFER_DIRECTION_OUT, USBD_SHORT_TRANSFER_OK)
  TransferBufferLength = 00000012
  TransferBuffer       = 00000000
  TransferBufferMDL    = 891a3be0
    00000000: 54 fd 64 00 00 ff 64 01 40 60 04 80 02 0a 07 50
    00000010: 80 04
  UrbLink              = 00000000
[137493 ms] UsbSnoop - MyInternalIOCTLCompletion(b792e126) : fido=889da5b8, Irp=88a93708, Context=89309548, IRQL=2
[137493 ms]  <<<  URB 35 coming back  <<< 
-- URB_FUNCTION_BULK_OR_INTERRUPT_TRANSFER:
  PipeHandle           = 88a1f20c [endpoint 0x00000002]
  TransferFlags        = 00000002 (USBD_TRANSFER_DIRECTION_OUT, USBD_SHORT_TRANSFER_OK)
  TransferBufferLength = 00000012
  TransferBuffer       = 00000000
  TransferBufferMDL    = 891a3be0
  UrbLink              = 00000000
[137493 ms] UsbSnoop - FilterDispatchAny(b792dfd2) : IRP_MJ_INTERNAL_DEVICE_CONTROL
[137493 ms] UsbSnoop - FdoHookDispatchInternalIoctl(b792e1ea) : fdo=88acdde8, Irp=88a93708, IRQL=0
[137493 ms]  >>>  URB 36 going down  >>> 
-- URB_FUNCTION_BULK_OR_INTERRUPT_TRANSFER:
  PipeHandle           = 88a1f20c [endpoint 0x00000002]
  TransferFlags        = 00000002 (USBD_TRANSFER_DIRECTION_OUT, USBD_SHORT_TRANSFER_OK)
  TransferBufferLength = 00000011
  TransferBuffer       = 00000000
  TransferBufferMDL    = 891a3be0
    00000000: 54 fd 64 00 80 04 64 01 40 60 0e 00 01 00 08 55
    00000010: 0e
  UrbLink              = 00000000
[137495 ms] UsbSnoop - MyInternalIOCTLCompletion(b792e126) : fido=889da5b8, Irp=88a93708, Context=89309548, IRQL=2
[137495 ms]  <<<  URB 36 coming back  <<< 
-- URB_FUNCTION_BULK_OR_INTERRUPT_TRANSFER:
  PipeHandle           = 88a1f20c [endpoint 0x00000002]
  TransferFlags        = 00000002 (USBD_TRANSFER_DIRECTION_OUT, USBD_SHORT_TRANSFER_OK)
  TransferBufferLength = 00000011
  TransferBuffer       = 00000000
  TransferBufferMDL    = 891a3be0
  UrbLink              = 00000000
[137498 ms] UsbSnoop - MyInternalIOCTLCompletion(b792e126) : fido=889da5b8, Irp=88aaae70, Context=88ab1068, IRQL=2
[137498 ms]  <<<  URB 34 coming back  <<< 
-- URB_FUNCTION_BULK_OR_INTERRUPT_TRANSFER:
  PipeHandle           = 88a1f1ec [endpoint 0x00000081]
  TransferFlags        = 00000003 (USBD_TRANSFER_DIRECTION_IN, USBD_SHORT_TRANSFER_OK)
  TransferBufferLength = 00000012
  TransferBuffer       = 00000000
  TransferBufferMDL    = 88e151f0
    00000000: 54 fd 64 01 00 ff 64 00 80 04 60 40 02 0a 08 51
    00000010: 40 60
  UrbLink              = 00000000
[137499 ms] UsbSnoop - FilterDispatchAny(b792dfd2) : IRP_MJ_INTERNAL_DEVICE_CONTROL
[137499 ms] UsbSnoop - FdoHookDispatchInternalIoctl(b792e1ea) : fdo=88acdde8, Irp=88aaae70, IRQL=0
[137499 ms]  >>>  URB 37 going down  >>> 
-- URB_FUNCTION_BULK_OR_INTERRUPT_TRANSFER:
  PipeHandle           = 88a1f1ec [endpoint 0x00000081]
  TransferFlags        = 00000003 (USBD_TRANSFER_DIRECTION_IN, USBD_SHORT_TRANSFER_OK)
  TransferBufferLength = 00000200
  TransferBuffer       = 00000000
  TransferBufferMDL    = 88e151f0
  UrbLink              = 00000000
[137505 ms] UsbSnoop - MyInternalIOCTLCompletion(b792e126) : fido=889da5b8, Irp=88aaae70, Context=88ab1068, IRQL=2
[137505 ms]  <<<  URB 37 coming back  <<< 
-- URB_FUNCTION_BULK_OR_INTERRUPT_TRANSFER:
  PipeHandle           = 88a1f1ec [endpoint 0x00000081]
  TransferFlags        = 00000003 (USBD_TRANSFER_DIRECTION_IN, USBD_SHORT_TRANSFER_OK)
  TransferBufferLength = 00000027
  TransferBuffer       = 00000000
  TransferBufferMDL    = 88e151f0
    00000000: 54 fd 64 01 40 60 64 00 80 04 b9 ce 17 00 08 e4
    00000010: 10 00 14 44 6f 73 73 69 65 72 20 31 00 00 00 00
    00000020: 00 00 00 0e a1 01 00
  UrbLink              = 00000000
[137505 ms] UsbSnoop - FilterDispatchAny(b792dfd2) : IRP_MJ_INTERNAL_DEVICE_CONTROL
[137505 ms] UsbSnoop - FdoHookDispatchInternalIoctl(b792e1ea) : fdo=88acdde8, Irp=88aaae70, IRQL=0
[137505 ms]  >>>  URB 38 going down  >>> 
-- URB_FUNCTION_BULK_OR_INTERRUPT_TRANSFER:
  PipeHandle           = 88a1f1ec [endpoint 0x00000081]
  TransferFlags        = 00000003 (USBD_TRANSFER_DIRECTION_IN, USBD_SHORT_TRANSFER_OK)
  TransferBufferLength = 00000200
  TransferBuffer       = 00000000
  TransferBufferMDL    = 88e151f0
  UrbLink              = 00000000
[137506 ms] UsbSnoop - FilterDispatchAny(b792dfd2) : IRP_MJ_INTERNAL_DEVICE_CONTROL
[137506 ms] UsbSnoop - FdoHookDispatchInternalIoctl(b792e1ea) : fdo=88acdde8, Irp=88a93708, IRQL=0
[137506 ms]  >>>  URB 39 going down  >>> 
-- URB_FUNCTION_BULK_OR_INTERRUPT_TRANSFER:
  PipeHandle           = 88a1f20c [endpoint 0x00000002]
  TransferFlags        = 00000002 (USBD_TRANSFER_DIRECTION_OUT, USBD_SHORT_TRANSFER_OK)
  TransferBufferLength = 00000012
  TransferBuffer       = 00000000
  TransferBufferMDL    = 891a3be0
    00000000: 54 fd 64 00 00 ff 64 01 40 60 04 80 02 0a 08 51
    00000010: 80 04
  UrbLink              = 00000000
[137506 ms] UsbSnoop - MyInternalIOCTLCompletion(b792e126) : fido=889da5b8, Irp=88a93708, Context=89309548, IRQL=2
[137506 ms]  <<<  URB 39 coming back  <<< 
-- URB_FUNCTION_BULK_OR_INTERRUPT_TRANSFER:
  PipeHandle           = 88a1f20c [endpoint 0x00000002]
  TransferFlags        = 00000002 (USBD_TRANSFER_DIRECTION_OUT, USBD_SHORT_TRANSFER_OK)
  TransferBufferLength = 00000012
  TransferBuffer       = 00000000
  TransferBufferMDL    = 891a3be0
  UrbLink              = 00000000
[137508 ms] UsbSnoop - FilterDispatchAny(b792dfd2) : IRP_MJ_INTERNAL_DEVICE_CONTROL
[137508 ms] UsbSnoop - FdoHookDispatchInternalIoctl(b792e1ea) : fdo=88acdde8, Irp=88a93708, IRQL=0
[137508 ms]  >>>  URB 40 going down  >>> 
-- URB_FUNCTION_BULK_OR_INTERRUPT_TRANSFER:
  PipeHandle           = 88a1f20c [endpoint 0x00000002]
  TransferFlags        = 00000002 (USBD_TRANSFER_DIRECTION_OUT, USBD_SHORT_TRANSFER_OK)
  TransferBufferLength = 00000011
  TransferBuffer       = 00000000
  TransferBufferMDL    = 891a3be0
    00000000: 54 fd 64 00 80 04 64 01 40 60 0e 00 01 00 09 56
    00000010: 0e
  UrbLink              = 00000000
[137508 ms] UsbSnoop - MyInternalIOCTLCompletion(b792e126) : fido=889da5b8, Irp=88a93708, Context=89309548, IRQL=2
[137508 ms]  <<<  URB 40 coming back  <<< 
-- URB_FUNCTION_BULK_OR_INTERRUPT_TRANSFER:
  PipeHandle           = 88a1f20c [endpoint 0x00000002]
  TransferFlags        = 00000002 (USBD_TRANSFER_DIRECTION_OUT, USBD_SHORT_TRANSFER_OK)
  TransferBufferLength = 00000011
  TransferBuffer       = 00000000
  TransferBufferMDL    = 891a3be0
  UrbLink              = 00000000
[137511 ms] UsbSnoop - MyInternalIOCTLCompletion(b792e126) : fido=889da5b8, Irp=88aaae70, Context=88ab1068, IRQL=2
[137511 ms]  <<<  URB 38 coming back  <<< 
-- URB_FUNCTION_BULK_OR_INTERRUPT_TRANSFER:
  PipeHandle           = 88a1f1ec [endpoint 0x00000081]
  TransferFlags        = 00000003 (USBD_TRANSFER_DIRECTION_IN, USBD_SHORT_TRANSFER_OK)
  TransferBufferLength = 00000012
  TransferBuffer       = 00000000
  TransferBufferMDL    = 88e151f0
    00000000: 54 fd 64 01 00 ff 64 00 80 04 60 40 02 0a 09 52
    00000010: 40 60
  UrbLink              = 00000000
[137511 ms] UsbSnoop - FilterDispatchAny(b792dfd2) : IRP_MJ_INTERNAL_DEVICE_CONTROL
[137511 ms] UsbSnoop - FdoHookDispatchInternalIoctl(b792e1ea) : fdo=88acdde8, Irp=88aaae70, IRQL=0
[137511 ms]  >>>  URB 41 going down  >>> 
-- URB_FUNCTION_BULK_OR_INTERRUPT_TRANSFER:
  PipeHandle           = 88a1f1ec [endpoint 0x00000081]
  TransferFlags        = 00000003 (USBD_TRANSFER_DIRECTION_IN, USBD_SHORT_TRANSFER_OK)
  TransferBufferLength = 00000200
  TransferBuffer       = 00000000
  TransferBufferMDL    = 88e151f0
  UrbLink              = 00000000
[137515 ms] UsbSnoop - MyInternalIOCTLCompletion(b792e126) : fido=889da5b8, Irp=88aaae70, Context=88ab1068, IRQL=2
[137515 ms]  <<<  URB 41 coming back  <<< 
-- URB_FUNCTION_BULK_OR_INTERRUPT_TRANSFER:
  PipeHandle           = 88a1f1ec [endpoint 0x00000081]
  TransferFlags        = 00000003 (USBD_TRANSFER_DIRECTION_IN, USBD_SHORT_TRANSFER_OK)
  TransferBufferLength = 00000026
  TransferBuffer       = 00000000
  TransferBufferMDL    = 88e151f0
    00000000: 54 fd 64 01 40 60 64 00 80 04 5c db 16 00 09 94
    00000010: 10 00 13 45 78 65 6d 70 6c 65 73 00 00 00 00 00
    00000020: 00 00 00 0d 01 00
  UrbLink              = 00000000
[137516 ms] UsbSnoop - FilterDispatchAny(b792dfd2) : IRP_MJ_INTERNAL_DEVICE_CONTROL
[137516 ms] UsbSnoop - FdoHookDispatchInternalIoctl(b792e1ea) : fdo=88acdde8, Irp=88aaae70, IRQL=0
[137516 ms]  >>>  URB 42 going down  >>> 
-- URB_FUNCTION_BULK_OR_INTERRUPT_TRANSFER:
  PipeHandle           = 88a1f20c [endpoint 0x00000002]
  TransferFlags        = 00000002 (USBD_TRANSFER_DIRECTION_OUT, USBD_SHORT_TRANSFER_OK)
  TransferBufferLength = 00000012
  TransferBuffer       = 00000000
  TransferBufferMDL    = 88e151f0
    00000000: 54 fd 64 00 00 ff 64 01 40 60 04 80 02 0a 09 52
    00000010: 80 04
  UrbLink              = 00000000
[137516 ms] UsbSnoop - FilterDispatchAny(b792dfd2) : IRP_MJ_INTERNAL_DEVICE_CONTROL
[137516 ms] UsbSnoop - FdoHookDispatchInternalIoctl(b792e1ea) : fdo=88acdde8, Irp=88a93708, IRQL=0
[137516 ms]  >>>  URB 43 going down  >>> 
-- URB_FUNCTION_BULK_OR_INTERRUPT_TRANSFER:
  PipeHandle           = 88a1f1ec [endpoint 0x00000081]
  TransferFlags        = 00000003 (USBD_TRANSFER_DIRECTION_IN, USBD_SHORT_TRANSFER_OK)
  TransferBufferLength = 00000200
  TransferBuffer       = 00000000
  TransferBufferMDL    = 891a3be0
  UrbLink              = 00000000
[137516 ms] UsbSnoop - MyInternalIOCTLCompletion(b792e126) : fido=889da5b8, Irp=88aaae70, Context=88ab1068, IRQL=2
[137516 ms]  <<<  URB 42 coming back  <<< 
-- URB_FUNCTION_BULK_OR_INTERRUPT_TRANSFER:
  PipeHandle           = 88a1f20c [endpoint 0x00000002]
  TransferFlags        = 00000002 (USBD_TRANSFER_DIRECTION_OUT, USBD_SHORT_TRANSFER_OK)
  TransferBufferLength = 00000012
  TransferBuffer       = 00000000
  TransferBufferMDL    = 88e151f0
  UrbLink              = 00000000
[137518 ms] UsbSnoop - FilterDispatchAny(b792dfd2) : IRP_MJ_INTERNAL_DEVICE_CONTROL
[137518 ms] UsbSnoop - FdoHookDispatchInternalIoctl(b792e1ea) : fdo=88acdde8, Irp=88aaae70, IRQL=0
[137518 ms]  >>>  URB 44 going down  >>> 
-- URB_FUNCTION_BULK_OR_INTERRUPT_TRANSFER:
  PipeHandle           = 88a1f20c [endpoint 0x00000002]
  TransferFlags        = 00000002 (USBD_TRANSFER_DIRECTION_OUT, USBD_SHORT_TRANSFER_OK)
  TransferBufferLength = 00000011
  TransferBuffer       = 00000000
  TransferBufferMDL    = 88e151f0
    00000000: 54 fd 64 00 80 04 64 01 40 60 0e 00 01 00 0a 57
    00000010: 0e
  UrbLink              = 00000000
[137518 ms] UsbSnoop - MyInternalIOCTLCompletion(b792e126) : fido=889da5b8, Irp=88aaae70, Context=88ab1068, IRQL=2
[137518 ms]  <<<  URB 44 coming back  <<< 
-- URB_FUNCTION_BULK_OR_INTERRUPT_TRANSFER:
  PipeHandle           = 88a1f20c [endpoint 0x00000002]
  TransferFlags        = 00000002 (USBD_TRANSFER_DIRECTION_OUT, USBD_SHORT_TRANSFER_OK)
  TransferBufferLength = 00000011
  TransferBuffer       = 00000000
  TransferBufferMDL    = 88e151f0
  UrbLink              = 00000000
[137521 ms] UsbSnoop - MyInternalIOCTLCompletion(b792e126) : fido=889da5b8, Irp=88a93708, Context=89309548, IRQL=2
[137521 ms]  <<<  URB 43 coming back  <<< 
-- URB_FUNCTION_BULK_OR_INTERRUPT_TRANSFER:
  PipeHandle           = 88a1f1ec [endpoint 0x00000081]
  TransferFlags        = 00000003 (USBD_TRANSFER_DIRECTION_IN, USBD_SHORT_TRANSFER_OK)
  TransferBufferLength = 00000012
  TransferBuffer       = 00000000
  TransferBufferMDL    = 891a3be0
    00000000: 54 fd 64 01 00 ff 64 00 80 04 60 40 02 0a 0a 53
    00000010: 40 60
  UrbLink              = 00000000
[137521 ms] UsbSnoop - FilterDispatchAny(b792dfd2) : IRP_MJ_INTERNAL_DEVICE_CONTROL
[137521 ms] UsbSnoop - FdoHookDispatchInternalIoctl(b792e1ea) : fdo=88acdde8, Irp=88a93708, IRQL=0
[137521 ms]  >>>  URB 45 going down  >>> 
-- URB_FUNCTION_BULK_OR_INTERRUPT_TRANSFER:
  PipeHandle           = 88a1f1ec [endpoint 0x00000081]
  TransferFlags        = 00000003 (USBD_TRANSFER_DIRECTION_IN, USBD_SHORT_TRANSFER_OK)
  TransferBufferLength = 00000200
  TransferBuffer       = 00000000
  TransferBufferMDL    = 891a3be0
  UrbLink              = 00000000
[137524 ms] UsbSnoop - MyInternalIOCTLCompletion(b792e126) : fido=889da5b8, Irp=88a93708, Context=89309548, IRQL=2
[137524 ms]  <<<  URB 45 coming back  <<< 
-- URB_FUNCTION_BULK_OR_INTERRUPT_TRANSFER:
  PipeHandle           = 88a1f1ec [endpoint 0x00000081]
  TransferFlags        = 00000003 (USBD_TRANSFER_DIRECTION_IN, USBD_SHORT_TRANSFER_OK)
  TransferBufferLength = 00000026
  TransferBuffer       = 00000000
  TransferBufferMDL    = 891a3be0
    00000000: 54 fd 64 01 40 60 64 00 80 04 2c ec 16 00 0a 76
    00000010: 10 00 13 4d 79 4c 69 62 00 00 00 00 00 00 00 00
    00000020: 00 00 01 04 01 00
  UrbLink              = 00000000
[137525 ms] UsbSnoop - FilterDispatchAny(b792dfd2) : IRP_MJ_INTERNAL_DEVICE_CONTROL
[137525 ms] UsbSnoop - FdoHookDispatchInternalIoctl(b792e1ea) : fdo=88acdde8, Irp=88a93708, IRQL=0
[137525 ms]  >>>  URB 46 going down  >>> 
-- URB_FUNCTION_BULK_OR_INTERRUPT_TRANSFER:
  PipeHandle           = 88a1f1ec [endpoint 0x00000081]
  TransferFlags        = 00000003 (USBD_TRANSFER_DIRECTION_IN, USBD_SHORT_TRANSFER_OK)
  TransferBufferLength = 00000200
  TransferBuffer       = 00000000
  TransferBufferMDL    = 891a3be0
  UrbLink              = 00000000
[137525 ms] UsbSnoop - FilterDispatchAny(b792dfd2) : IRP_MJ_INTERNAL_DEVICE_CONTROL
[137525 ms] UsbSnoop - FdoHookDispatchInternalIoctl(b792e1ea) : fdo=88acdde8, Irp=88aaae70, IRQL=0
[137525 ms]  >>>  URB 47 going down  >>> 
-- URB_FUNCTION_BULK_OR_INTERRUPT_TRANSFER:
  PipeHandle           = 88a1f20c [endpoint 0x00000002]
  TransferFlags        = 00000002 (USBD_TRANSFER_DIRECTION_OUT, USBD_SHORT_TRANSFER_OK)
  TransferBufferLength = 00000012
  TransferBuffer       = 00000000
  TransferBufferMDL    = 88e151f0
    00000000: 54 fd 64 00 00 ff 64 01 40 60 04 80 02 0a 0a 53
    00000010: 80 04
  UrbLink              = 00000000
[137525 ms] UsbSnoop - MyInternalIOCTLCompletion(b792e126) : fido=889da5b8, Irp=88aaae70, Context=88ab1068, IRQL=2
[137525 ms]  <<<  URB 47 coming back  <<< 
-- URB_FUNCTION_BULK_OR_INTERRUPT_TRANSFER:
  PipeHandle           = 88a1f20c [endpoint 0x00000002]
  TransferFlags        = 00000002 (USBD_TRANSFER_DIRECTION_OUT, USBD_SHORT_TRANSFER_OK)
  TransferBufferLength = 00000012
  TransferBuffer       = 00000000
  TransferBufferMDL    = 88e151f0
  UrbLink              = 00000000
[137527 ms] UsbSnoop - FilterDispatchAny(b792dfd2) : IRP_MJ_INTERNAL_DEVICE_CONTROL
[137527 ms] UsbSnoop - FdoHookDispatchInternalIoctl(b792e1ea) : fdo=88acdde8, Irp=88aaae70, IRQL=0
[137527 ms]  >>>  URB 48 going down  >>> 
-- URB_FUNCTION_BULK_OR_INTERRUPT_TRANSFER:
  PipeHandle           = 88a1f20c [endpoint 0x00000002]
  TransferFlags        = 00000002 (USBD_TRANSFER_DIRECTION_OUT, USBD_SHORT_TRANSFER_OK)
  TransferBufferLength = 00000011
  TransferBuffer       = 00000000
  TransferBufferMDL    = 88e151f0
    00000000: 54 fd 64 00 80 04 64 01 40 60 0e 00 01 00 0b 58
    00000010: 0e
  UrbLink              = 00000000
[137527 ms] UsbSnoop - MyInternalIOCTLCompletion(b792e126) : fido=889da5b8, Irp=88aaae70, Context=88ab1068, IRQL=2
[137527 ms]  <<<  URB 48 coming back  <<< 
-- URB_FUNCTION_BULK_OR_INTERRUPT_TRANSFER:
  PipeHandle           = 88a1f20c [endpoint 0x00000002]
  TransferFlags        = 00000002 (USBD_TRANSFER_DIRECTION_OUT, USBD_SHORT_TRANSFER_OK)
  TransferBufferLength = 00000011
  TransferBuffer       = 00000000
  TransferBufferMDL    = 88e151f0
  UrbLink              = 00000000
[137530 ms] UsbSnoop - MyInternalIOCTLCompletion(b792e126) : fido=889da5b8, Irp=88a93708, Context=89309548, IRQL=2
[137530 ms]  <<<  URB 46 coming back  <<< 
-- URB_FUNCTION_BULK_OR_INTERRUPT_TRANSFER:
  PipeHandle           = 88a1f1ec [endpoint 0x00000081]
  TransferFlags        = 00000003 (USBD_TRANSFER_DIRECTION_IN, USBD_SHORT_TRANSFER_OK)
  TransferBufferLength = 00000012
  TransferBuffer       = 00000000
  TransferBufferMDL    = 891a3be0
    00000000: 54 fd 64 01 00 ff 64 00 80 04 60 40 02 0a 0b 54
    00000010: 40 60
  UrbLink              = 00000000
[137530 ms] UsbSnoop - FilterDispatchAny(b792dfd2) : IRP_MJ_INTERNAL_DEVICE_CONTROL
[137530 ms] UsbSnoop - FdoHookDispatchInternalIoctl(b792e1ea) : fdo=88acdde8, Irp=88a93708, IRQL=0
[137530 ms]  >>>  URB 49 going down  >>> 
-- URB_FUNCTION_BULK_OR_INTERRUPT_TRANSFER:
  PipeHandle           = 88a1f1ec [endpoint 0x00000081]
  TransferFlags        = 00000003 (USBD_TRANSFER_DIRECTION_IN, USBD_SHORT_TRANSFER_OK)
  TransferBufferLength = 00000200
  TransferBuffer       = 00000000
  TransferBufferMDL    = 891a3be0
  UrbLink              = 00000000
[137532 ms] UsbSnoop - MyInternalIOCTLCompletion(b792e126) : fido=889da5b8, Irp=88a93708, Context=89309548, IRQL=2
[137532 ms]  <<<  URB 49 coming back  <<< 
-- URB_FUNCTION_BULK_OR_INTERRUPT_TRANSFER:
  PipeHandle           = 88a1f1ec [endpoint 0x00000081]
  TransferFlags        = 00000003 (USBD_TRANSFER_DIRECTION_IN, USBD_SHORT_TRANSFER_OK)
  TransferBufferLength = 00000012
  TransferBuffer       = 00000000
  TransferBufferMDL    = 891a3be0
    00000000: 54 fd 64 01 40 60 64 00 80 04 11 ff 02 00 0b 5b
    00000010: ff 11
  UrbLink              = 00000000
[137532 ms] UsbSnoop - FilterDispatchAny(b792dfd2) : IRP_MJ_INTERNAL_DEVICE_CONTROL
[137532 ms] UsbSnoop - FdoHookDispatchInternalIoctl(b792e1ea) : fdo=88acdde8, Irp=88a93708, IRQL=0
[137532 ms]  >>>  URB 50 going down  >>> 
-- URB_FUNCTION_BULK_OR_INTERRUPT_TRANSFER:
  PipeHandle           = 88a1f20c [endpoint 0x00000002]
  TransferFlags        = 00000002 (USBD_TRANSFER_DIRECTION_OUT, USBD_SHORT_TRANSFER_OK)
  TransferBufferLength = 00000012
  TransferBuffer       = 00000000
  TransferBufferMDL    = 891a3be0
    00000000: 54 fd 64 00 00 ff 64 01 40 60 04 80 02 0a 0b 54
    00000010: 80 04
  UrbLink              = 00000000
[137533 ms] UsbSnoop - FilterDispatchAny(b792dfd2) : IRP_MJ_INTERNAL_DEVICE_CONTROL
[137533 ms] UsbSnoop - FdoHookDispatchInternalIoctl(b792e1ea) : fdo=88acdde8, Irp=88aaae70, IRQL=0
[137533 ms]  >>>  URB 51 going down  >>> 
-- URB_FUNCTION_BULK_OR_INTERRUPT_TRANSFER:
  PipeHandle           = 88a1f1ec [endpoint 0x00000081]
  TransferFlags        = 00000003 (USBD_TRANSFER_DIRECTION_IN, USBD_SHORT_TRANSFER_OK)
  TransferBufferLength = 00000200
  TransferBuffer       = 00000000
  TransferBufferMDL    = 88e151f0
  UrbLink              = 00000000
[137533 ms] UsbSnoop - MyInternalIOCTLCompletion(b792e126) : fido=889da5b8, Irp=88a93708, Context=89309548, IRQL=2
[137533 ms]  <<<  URB 50 coming back  <<< 
-- URB_FUNCTION_BULK_OR_INTERRUPT_TRANSFER:
  PipeHandle           = 88a1f20c [endpoint 0x00000002]
  TransferFlags        = 00000002 (USBD_TRANSFER_DIRECTION_OUT, USBD_SHORT_TRANSFER_OK)
  TransferBufferLength = 00000012
  TransferBuffer       = 00000000
  TransferBufferMDL    = 891a3be0
  UrbLink              = 00000000
[137533 ms] UsbSnoop - FilterDispatchAny(b792dfd2) : IRP_MJ_INTERNAL_DEVICE_CONTROL
[137533 ms] UsbSnoop - FdoHookDispatchInternalIoctl(b792e1ea) : fdo=88acdde8, Irp=88a93708, IRQL=0
[137533 ms]  >>>  URB 52 going down  >>> 
-- URB_FUNCTION_BULK_OR_INTERRUPT_TRANSFER:
  PipeHandle           = 88a1f20c [endpoint 0x00000002]
  TransferFlags        = 00000002 (USBD_TRANSFER_DIRECTION_OUT, USBD_SHORT_TRANSFER_OK)
  TransferBufferLength = 00000011
  TransferBuffer       = 00000000
  TransferBufferMDL    = 891a3be0
    00000000: 54 fd 64 00 80 04 64 01 40 60 0f 00 01 00 0c 5a
    00000010: 0f
  UrbLink              = 00000000
[137535 ms] UsbSnoop - MyInternalIOCTLCompletion(b792e126) : fido=889da5b8, Irp=88a93708, Context=89309548, IRQL=2
[137535 ms]  <<<  URB 52 coming back  <<< 
-- URB_FUNCTION_BULK_OR_INTERRUPT_TRANSFER:
  PipeHandle           = 88a1f20c [endpoint 0x00000002]
  TransferFlags        = 00000002 (USBD_TRANSFER_DIRECTION_OUT, USBD_SHORT_TRANSFER_OK)
  TransferBufferLength = 00000011
  TransferBuffer       = 00000000
  TransferBufferMDL    = 891a3be0
  UrbLink              = 00000000
[137538 ms] UsbSnoop - MyInternalIOCTLCompletion(b792e126) : fido=889da5b8, Irp=88aaae70, Context=88ab1068, IRQL=2
[137538 ms]  <<<  URB 51 coming back  <<< 
-- URB_FUNCTION_BULK_OR_INTERRUPT_TRANSFER:
  PipeHandle           = 88a1f1ec [endpoint 0x00000081]
  TransferFlags        = 00000003 (USBD_TRANSFER_DIRECTION_IN, USBD_SHORT_TRANSFER_OK)
  TransferBufferLength = 00000012
  TransferBuffer       = 00000000
  TransferBufferMDL    = 88e151f0
    00000000: 54 fd 64 01 00 ff 64 00 80 04 60 40 02 0a 0c 55
    00000010: 40 60
  UrbLink              = 00000000
[137538 ms] UsbSnoop - FilterDispatchAny(b792dfd2) : IRP_MJ_INTERNAL_DEVICE_CONTROL
[137538 ms] UsbSnoop - FdoHookDispatchInternalIoctl(b792e1ea) : fdo=88acdde8, Irp=88aaae70, IRQL=0
[137538 ms]  >>>  URB 53 going down  >>> 
-- URB_FUNCTION_BULK_OR_INTERRUPT_TRANSFER:
  PipeHandle           = 88a1f1ec [endpoint 0x00000081]
  TransferFlags        = 00000003 (USBD_TRANSFER_DIRECTION_IN, USBD_SHORT_TRANSFER_OK)
  TransferBufferLength = 00000200
  TransferBuffer       = 00000000
  TransferBufferMDL    = 88e151f0
  UrbLink              = 00000000
[137541 ms] UsbSnoop - MyInternalIOCTLCompletion(b792e126) : fido=889da5b8, Irp=88aaae70, Context=88ab1068, IRQL=2
[137541 ms]  <<<  URB 53 coming back  <<< 
-- URB_FUNCTION_BULK_OR_INTERRUPT_TRANSFER:
  PipeHandle           = 88a1f1ec [endpoint 0x00000081]
  TransferFlags        = 00000003 (USBD_TRANSFER_DIRECTION_IN, USBD_SHORT_TRANSFER_OK)
  TransferBufferLength = 00000012
  TransferBuffer       = 00000000
  TransferBufferMDL    = 88e151f0
    00000000: 54 fd 64 01 40 60 64 00 80 04 00 ff 02 00 0c 4b
    00000010: ff 00
  UrbLink              = 00000000
[137541 ms] UsbSnoop - FilterDispatchAny(b792dfd2) : IRP_MJ_INTERNAL_DEVICE_CONTROL
[137541 ms] UsbSnoop - FdoHookDispatchInternalIoctl(b792e1ea) : fdo=88acdde8, Irp=88aaae70, IRQL=0
[137541 ms]  >>>  URB 54 going down  >>> 
-- URB_FUNCTION_BULK_OR_INTERRUPT_TRANSFER:
  PipeHandle           = 88a1f20c [endpoint 0x00000002]
  TransferFlags        = 00000002 (USBD_TRANSFER_DIRECTION_OUT, USBD_SHORT_TRANSFER_OK)
  TransferBufferLength = 00000012
  TransferBuffer       = 00000000
  TransferBufferMDL    = 88e151f0
    00000000: 54 fd 64 00 00 ff 64 01 40 60 04 80 02 0a 0c 55
    00000010: 80 04
  UrbLink              = 00000000
[137541 ms] UsbSnoop - FilterDispatchAny(b792dfd2) : IRP_MJ_INTERNAL_DEVICE_CONTROL
[137541 ms] UsbSnoop - FdoHookDispatchInternalIoctl(b792e1ea) : fdo=88acdde8, Irp=88a93708, IRQL=0
[137541 ms]  >>>  URB 55 going down  >>> 
-- URB_FUNCTION_BULK_OR_INTERRUPT_TRANSFER:
  PipeHandle           = 88a1f1ec [endpoint 0x00000081]
  TransferFlags        = 00000003 (USBD_TRANSFER_DIRECTION_IN, USBD_SHORT_TRANSFER_OK)
  TransferBufferLength = 00000200
  TransferBuffer       = 00000000
  TransferBufferMDL    = 891a3be0
  UrbLink              = 00000000
[137541 ms] UsbSnoop - MyInternalIOCTLCompletion(b792e126) : fido=889da5b8, Irp=88aaae70, Context=88ab1068, IRQL=2
[137541 ms]  <<<  URB 54 coming back  <<< 
-- URB_FUNCTION_BULK_OR_INTERRUPT_TRANSFER:
  PipeHandle           = 88a1f20c [endpoint 0x00000002]
  TransferFlags        = 00000002 (USBD_TRANSFER_DIRECTION_OUT, USBD_SHORT_TRANSFER_OK)
  TransferBufferLength = 00000012
  TransferBuffer       = 00000000
  TransferBufferMDL    = 88e151f0
  UrbLink              = 00000000
[137543 ms] UsbSnoop - FilterDispatchAny(b792dfd2) : IRP_MJ_INTERNAL_DEVICE_CONTROL
[137543 ms] UsbSnoop - FdoHookDispatchInternalIoctl(b792e1ea) : fdo=88acdde8, Irp=88aaae70, IRQL=0
[137543 ms]  >>>  URB 56 going down  >>> 
-- URB_FUNCTION_BULK_OR_INTERRUPT_TRANSFER:
  PipeHandle           = 88a1f20c [endpoint 0x00000002]
  TransferFlags        = 00000002 (USBD_TRANSFER_DIRECTION_OUT, USBD_SHORT_TRANSFER_OK)
  TransferBufferLength = 00000012
  TransferBuffer       = 00000000
  TransferBufferMDL    = 88e151f0
    00000000: 54 fd 64 00 40 de 64 01 40 60 04 80 02 00 0d 6b
    00000010: 80 04
  UrbLink              = 00000000
[137544 ms] UsbSnoop - MyInternalIOCTLCompletion(b792e126) : fido=889da5b8, Irp=88aaae70, Context=88ab1068, IRQL=2
[137544 ms]  <<<  URB 56 coming back  <<< 
-- URB_FUNCTION_BULK_OR_INTERRUPT_TRANSFER:
  PipeHandle           = 88a1f20c [endpoint 0x00000002]
  TransferFlags        = 00000002 (USBD_TRANSFER_DIRECTION_OUT, USBD_SHORT_TRANSFER_OK)
  TransferBufferLength = 00000012
  TransferBuffer       = 00000000
  TransferBufferMDL    = 88e151f0
  UrbLink              = 00000000
[137546 ms] UsbSnoop - MyInternalIOCTLCompletion(b792e126) : fido=889da5b8, Irp=88a93708, Context=89309548, IRQL=2
[137546 ms]  <<<  URB 55 coming back  <<< 
-- URB_FUNCTION_BULK_OR_INTERRUPT_TRANSFER:
  PipeHandle           = 88a1f1ec [endpoint 0x00000081]
  TransferFlags        = 00000003 (USBD_TRANSFER_DIRECTION_IN, USBD_SHORT_TRANSFER_OK)
  TransferBufferLength = 00000012
  TransferBuffer       = 00000000
  TransferBufferMDL    = 891a3be0
    00000000: 54 fd 64 01 00 ff 64 00 80 04 60 40 02 0a 0d 56
    00000010: 40 60
  UrbLink              = 00000000
[137547 ms] UsbSnoop - FilterDispatchAny(b792dfd2) : IRP_MJ_INTERNAL_DEVICE_CONTROL
[137547 ms] UsbSnoop - FdoHookDispatchInternalIoctl(b792e1ea) : fdo=88acdde8, Irp=88a93708, IRQL=0
[137547 ms]  >>>  URB 57 going down  >>> 
-- URB_FUNCTION_BULK_OR_INTERRUPT_TRANSFER:
  PipeHandle           = 88a1f1ec [endpoint 0x00000081]
  TransferFlags        = 00000003 (USBD_TRANSFER_DIRECTION_IN, USBD_SHORT_TRANSFER_OK)
  TransferBufferLength = 00000200
  TransferBuffer       = 00000000
  TransferBufferMDL    = 891a3be0
  UrbLink              = 00000000
[137557 ms] UsbSnoop - FilterDispatchAny(b792dfd2) : IRP_MJ_INTERNAL_DEVICE_CONTROL
[137557 ms] UsbSnoop - FdoHookDispatchInternalIoctl(b792e1ea) : fdo=88acdde8, Irp=88aaae70, IRQL=0
[137557 ms]  >>>  URB 58 going down  >>> 
-- URB_FUNCTION_BULK_OR_INTERRUPT_TRANSFER:
  PipeHandle           = 88a1f20c [endpoint 0x00000002]
  TransferFlags        = 00000002 (USBD_TRANSFER_DIRECTION_OUT, USBD_SHORT_TRANSFER_OK)
  TransferBufferLength = 0000001b
  TransferBuffer       = 00000000
  TransferBufferMDL    = 88e151f0
    00000000: 54 fd 64 00 80 05 64 01 40 60 0c f1 0b 00 0e 55
    00000010: 20 01 2f 00 00 00 00 00 00 00 00
  UrbLink              = 00000000
[137557 ms] UsbSnoop - MyInternalIOCTLCompletion(b792e126) : fido=889da5b8, Irp=88aaae70, Context=88ab1068, IRQL=2
[137557 ms]  <<<  URB 58 coming back  <<< 
-- URB_FUNCTION_BULK_OR_INTERRUPT_TRANSFER:
  PipeHandle           = 88a1f20c [endpoint 0x00000002]
  TransferFlags        = 00000002 (USBD_TRANSFER_DIRECTION_OUT, USBD_SHORT_TRANSFER_OK)
  TransferBufferLength = 0000001b
  TransferBuffer       = 00000000
  TransferBufferMDL    = 88e151f0
  UrbLink              = 00000000
[137559 ms] UsbSnoop - MyInternalIOCTLCompletion(b792e126) : fido=889da5b8, Irp=88a93708, Context=89309548, IRQL=2
[137559 ms]  <<<  URB 57 coming back  <<< 
-- URB_FUNCTION_BULK_OR_INTERRUPT_TRANSFER:
  PipeHandle           = 88a1f1ec [endpoint 0x00000081]
  TransferFlags        = 00000003 (USBD_TRANSFER_DIRECTION_IN, USBD_SHORT_TRANSFER_OK)
  TransferBufferLength = 00000012
  TransferBuffer       = 00000000
  TransferBufferMDL    = 891a3be0
    00000000: 54 fd 64 01 00 ff 64 00 80 05 60 40 02 0a 0e 58
    00000010: 40 60
  UrbLink              = 00000000
[137559 ms] UsbSnoop - FilterDispatchAny(b792dfd2) : IRP_MJ_INTERNAL_DEVICE_CONTROL
[137559 ms] UsbSnoop - FdoHookDispatchInternalIoctl(b792e1ea) : fdo=88acdde8, Irp=88a93708, IRQL=0
[137559 ms]  >>>  URB 59 going down  >>> 
-- URB_FUNCTION_BULK_OR_INTERRUPT_TRANSFER:
  PipeHandle           = 88a1f1ec [endpoint 0x00000081]
  TransferFlags        = 00000003 (USBD_TRANSFER_DIRECTION_IN, USBD_SHORT_TRANSFER_OK)
  TransferBufferLength = 00000200
  TransferBuffer       = 00000000
  TransferBufferMDL    = 891a3be0
  UrbLink              = 00000000
[137568 ms] UsbSnoop - MyInternalIOCTLCompletion(b792e126) : fido=889da5b8, Irp=88a93708, Context=89309548, IRQL=2
[137568 ms]  <<<  URB 59 coming back  <<< 
-- URB_FUNCTION_BULK_OR_INTERRUPT_TRANSFER:
  PipeHandle           = 88a1f1ec [endpoint 0x00000081]
  TransferFlags        = 00000003 (USBD_TRANSFER_DIRECTION_IN, USBD_SHORT_TRANSFER_OK)
  TransferBufferLength = 0000001b
  TransferBuffer       = 00000000
  TransferBufferMDL    = 891a3be0
    00000000: 54 fd 64 01 40 60 64 00 80 05 ae 33 0b 00 0d 38
    00000010: 20 00 00 00 00 00 00 d0 66 01 00
  UrbLink              = 00000000
[137569 ms] UsbSnoop - FilterDispatchAny(b792dfd2) : IRP_MJ_INTERNAL_DEVICE_CONTROL
[137569 ms] UsbSnoop - FdoHookDispatchInternalIoctl(b792e1ea) : fdo=88acdde8, Irp=88a93708, IRQL=0
[137569 ms]  >>>  URB 60 going down  >>> 
-- URB_FUNCTION_BULK_OR_INTERRUPT_TRANSFER:
  PipeHandle           = 88a1f20c [endpoint 0x00000002]
  TransferFlags        = 00000002 (USBD_TRANSFER_DIRECTION_OUT, USBD_SHORT_TRANSFER_OK)
  TransferBufferLength = 00000012
  TransferBuffer       = 00000000
  TransferBufferMDL    = 891a3be0
    00000000: 54 fd 64 00 00 ff 64 01 40 60 05 80 02 0a 0d 57
    00000010: 80 05
  UrbLink              = 00000000
[137569 ms] UsbSnoop - FilterDispatchAny(b792dfd2) : IRP_MJ_INTERNAL_DEVICE_CONTROL
[137569 ms] UsbSnoop - FdoHookDispatchInternalIoctl(b792e1ea) : fdo=88acdde8, Irp=88aaae70, IRQL=0
[137569 ms]  >>>  URB 61 going down  >>> 
-- URB_FUNCTION_BULK_OR_INTERRUPT_TRANSFER:
  PipeHandle           = 88a1f1ec [endpoint 0x00000081]
  TransferFlags        = 00000003 (USBD_TRANSFER_DIRECTION_IN, USBD_SHORT_TRANSFER_OK)
  TransferBufferLength = 00000200
  TransferBuffer       = 00000000
  TransferBufferMDL    = 88e151f0
  UrbLink              = 00000000
[137569 ms] UsbSnoop - MyInternalIOCTLCompletion(b792e126) : fido=889da5b8, Irp=88a93708, Context=89309548, IRQL=2
[137569 ms]  <<<  URB 60 coming back  <<< 
-- URB_FUNCTION_BULK_OR_INTERRUPT_TRANSFER:
  PipeHandle           = 88a1f20c [endpoint 0x00000002]
  TransferFlags        = 00000002 (USBD_TRANSFER_DIRECTION_OUT, USBD_SHORT_TRANSFER_OK)
  TransferBufferLength = 00000012
  TransferBuffer       = 00000000
  TransferBufferMDL    = 891a3be0
  UrbLink              = 00000000
[137571 ms] UsbSnoop - FilterDispatchAny(b792dfd2) : IRP_MJ_INTERNAL_DEVICE_CONTROL
[137571 ms] UsbSnoop - FdoHookDispatchInternalIoctl(b792e1ea) : fdo=88acdde8, Irp=88a93708, IRQL=0
[137571 ms]  >>>  URB 62 going down  >>> 
-- URB_FUNCTION_BULK_OR_INTERRUPT_TRANSFER:
  PipeHandle           = 88a1f20c [endpoint 0x00000002]
  TransferFlags        = 00000002 (USBD_TRANSFER_DIRECTION_OUT, USBD_SHORT_TRANSFER_OK)
  TransferBufferLength = 00000012
  TransferBuffer       = 00000000
  TransferBufferMDL    = 891a3be0
    00000000: 54 fd 64 00 40 de 64 01 40 60 05 80 02 00 0f 6e
    00000010: 80 05
  UrbLink              = 00000000
[137571 ms] UsbSnoop - MyInternalIOCTLCompletion(b792e126) : fido=889da5b8, Irp=88a93708, Context=89309548, IRQL=2
[137571 ms]  <<<  URB 62 coming back  <<< 
-- URB_FUNCTION_BULK_OR_INTERRUPT_TRANSFER:
  PipeHandle           = 88a1f20c [endpoint 0x00000002]
  TransferFlags        = 00000002 (USBD_TRANSFER_DIRECTION_OUT, USBD_SHORT_TRANSFER_OK)
  TransferBufferLength = 00000012
  TransferBuffer       = 00000000
  TransferBufferMDL    = 891a3be0
  UrbLink              = 00000000
[137574 ms] UsbSnoop - MyInternalIOCTLCompletion(b792e126) : fido=889da5b8, Irp=88aaae70, Context=88ab1068, IRQL=2
[137574 ms]  <<<  URB 61 coming back  <<< 
-- URB_FUNCTION_BULK_OR_INTERRUPT_TRANSFER:
  PipeHandle           = 88a1f1ec [endpoint 0x00000081]
  TransferFlags        = 00000003 (USBD_TRANSFER_DIRECTION_IN, USBD_SHORT_TRANSFER_OK)
  TransferBufferLength = 00000012
  TransferBuffer       = 00000000
  TransferBufferMDL    = 88e151f0
    00000000: 54 fd 64 01 00 ff 64 00 80 05 60 40 02 0a 0f 59
    00000010: 40 60
  UrbLink              = 00000000
[137574 ms] UsbSnoop - FilterDispatchAny(b792dfd2) : IRP_MJ_INTERNAL_DEVICE_CONTROL
[137574 ms] UsbSnoop - FdoHookDispatchInternalIoctl(b792e1ea) : fdo=88acdde8, Irp=88aaae70, IRQL=0
[137574 ms]  >>>  URB 63 going down  >>> 
-- URB_FUNCTION_BULK_OR_INTERRUPT_TRANSFER:
  PipeHandle           = 88a1f1ec [endpoint 0x00000081]
  TransferFlags        = 00000003 (USBD_TRANSFER_DIRECTION_IN, USBD_SHORT_TRANSFER_OK)
  TransferBufferLength = 00000200
  TransferBuffer       = 00000000
  TransferBufferMDL    = 88e151f0
  UrbLink              = 00000000
[137580 ms] UsbSnoop - FilterDispatchAny(b792dfd2) : IRP_MJ_INTERNAL_DEVICE_CONTROL
[137580 ms] UsbSnoop - FdoHookDispatchInternalIoctl(b792e1ea) : fdo=88acdde8, Irp=88a93708, IRQL=0
[137580 ms]  >>>  URB 64 going down  >>> 
-- URB_FUNCTION_BULK_OR_INTERRUPT_TRANSFER:
  PipeHandle           = 88a1f20c [endpoint 0x00000002]
  TransferFlags        = 00000002 (USBD_TRANSFER_DIRECTION_OUT, USBD_SHORT_TRANSFER_OK)
  TransferBufferLength = 0000001a
  TransferBuffer       = 00000000
  TransferBufferMDL    = 891a3be0
    00000000: 54 fd 64 00 80 06 64 01 40 60 c0 aa 0a 00 10 c4
    00000010: 0d 2f 00 00 00 00 00 00 00 00
  UrbLink              = 00000000
[137580 ms] UsbSnoop - MyInternalIOCTLCompletion(b792e126) : fido=889da5b8, Irp=88a93708, Context=89309548, IRQL=2
[137580 ms]  <<<  URB 64 coming back  <<< 
-- URB_FUNCTION_BULK_OR_INTERRUPT_TRANSFER:
  PipeHandle           = 88a1f20c [endpoint 0x00000002]
  TransferFlags        = 00000002 (USBD_TRANSFER_DIRECTION_OUT, USBD_SHORT_TRANSFER_OK)
  TransferBufferLength = 0000001a
  TransferBuffer       = 00000000
  TransferBufferMDL    = 891a3be0
  UrbLink              = 00000000
[137584 ms] UsbSnoop - MyInternalIOCTLCompletion(b792e126) : fido=889da5b8, Irp=88aaae70, Context=88ab1068, IRQL=2
[137584 ms]  <<<  URB 63 coming back  <<< 
-- URB_FUNCTION_BULK_OR_INTERRUPT_TRANSFER:
  PipeHandle           = 88a1f1ec [endpoint 0x00000081]
  TransferFlags        = 00000003 (USBD_TRANSFER_DIRECTION_IN, USBD_SHORT_TRANSFER_OK)
  TransferBufferLength = 00000012
  TransferBuffer       = 00000000
  TransferBufferMDL    = 88e151f0
    00000000: 54 fd 64 01 00 ff 64 00 80 06 60 40 02 0a 10 5b
    00000010: 40 60
  UrbLink              = 00000000
[137585 ms] UsbSnoop - FilterDispatchAny(b792dfd2) : IRP_MJ_INTERNAL_DEVICE_CONTROL
[137585 ms] UsbSnoop - FdoHookDispatchInternalIoctl(b792e1ea) : fdo=88acdde8, Irp=88aaae70, IRQL=0
[137585 ms]  >>>  URB 65 going down  >>> 
-- URB_FUNCTION_BULK_OR_INTERRUPT_TRANSFER:
  PipeHandle           = 88a1f1ec [endpoint 0x00000081]
  TransferFlags        = 00000003 (USBD_TRANSFER_DIRECTION_IN, USBD_SHORT_TRANSFER_OK)
  TransferBufferLength = 00000200
  TransferBuffer       = 00000000
  TransferBufferMDL    = 88e151f0
  UrbLink              = 00000000
[137593 ms] UsbSnoop - MyInternalIOCTLCompletion(b792e126) : fido=889da5b8, Irp=88aaae70, Context=88ab1068, IRQL=2
[137593 ms]  <<<  URB 65 coming back  <<< 
-- URB_FUNCTION_BULK_OR_INTERRUPT_TRANSFER:
  PipeHandle           = 88a1f1ec [endpoint 0x00000081]
  TransferFlags        = 00000003 (USBD_TRANSFER_DIRECTION_IN, USBD_SHORT_TRANSFER_OK)
  TransferBufferLength = 00000012
  TransferBuffer       = 00000000
  TransferBufferMDL    = 88e151f0
    00000000: 54 fd 64 01 40 60 64 00 80 06 00 ff 02 00 0e 4f
    00000010: ff 00
  UrbLink              = 00000000
[137593 ms] UsbSnoop - FilterDispatchAny(b792dfd2) : IRP_MJ_INTERNAL_DEVICE_CONTROL
[137593 ms] UsbSnoop - FdoHookDispatchInternalIoctl(b792e1ea) : fdo=88acdde8, Irp=88aaae70, IRQL=0
[137593 ms]  >>>  URB 66 going down  >>> 
-- URB_FUNCTION_BULK_OR_INTERRUPT_TRANSFER:
  PipeHandle           = 88a1f20c [endpoint 0x00000002]
  TransferFlags        = 00000002 (USBD_TRANSFER_DIRECTION_OUT, USBD_SHORT_TRANSFER_OK)
  TransferBufferLength = 00000012
  TransferBuffer       = 00000000
  TransferBufferMDL    = 88e151f0
    00000000: 54 fd 64 00 00 ff 64 01 40 60 06 80 02 0a 0e 59
    00000010: 80 06
  UrbLink              = 00000000
[137593 ms] UsbSnoop - FilterDispatchAny(b792dfd2) : IRP_MJ_INTERNAL_DEVICE_CONTROL
[137593 ms] UsbSnoop - FdoHookDispatchInternalIoctl(b792e1ea) : fdo=88acdde8, Irp=88a93708, IRQL=0
[137593 ms]  >>>  URB 67 going down  >>> 
-- URB_FUNCTION_BULK_OR_INTERRUPT_TRANSFER:
  PipeHandle           = 88a1f1ec [endpoint 0x00000081]
  TransferFlags        = 00000003 (USBD_TRANSFER_DIRECTION_IN, USBD_SHORT_TRANSFER_OK)
  TransferBufferLength = 00000200
  TransferBuffer       = 00000000
  TransferBufferMDL    = 891a3be0
  UrbLink              = 00000000
[137594 ms] UsbSnoop - MyInternalIOCTLCompletion(b792e126) : fido=889da5b8, Irp=88aaae70, Context=88ab1068, IRQL=2
[137594 ms]  <<<  URB 66 coming back  <<< 
-- URB_FUNCTION_BULK_OR_INTERRUPT_TRANSFER:
  PipeHandle           = 88a1f20c [endpoint 0x00000002]
  TransferFlags        = 00000002 (USBD_TRANSFER_DIRECTION_OUT, USBD_SHORT_TRANSFER_OK)
  TransferBufferLength = 00000012
  TransferBuffer       = 00000000
  TransferBufferMDL    = 88e151f0
  UrbLink              = 00000000
[137594 ms] UsbSnoop - FilterDispatchAny(b792dfd2) : IRP_MJ_INTERNAL_DEVICE_CONTROL
[137594 ms] UsbSnoop - FdoHookDispatchInternalIoctl(b792e1ea) : fdo=88acdde8, Irp=88aaae70, IRQL=0
[137594 ms]  >>>  URB 68 going down  >>> 
-- URB_FUNCTION_BULK_OR_INTERRUPT_TRANSFER:
  PipeHandle           = 88a1f20c [endpoint 0x00000002]
  TransferFlags        = 00000002 (USBD_TRANSFER_DIRECTION_OUT, USBD_SHORT_TRANSFER_OK)
  TransferBufferLength = 00000011
  TransferBuffer       = 00000000
  TransferBufferMDL    = 88e151f0
    00000000: 54 fd 64 00 80 06 64 01 40 60 0e 00 01 00 11 60
    00000010: 0e
  UrbLink              = 00000000
[137596 ms] UsbSnoop - MyInternalIOCTLCompletion(b792e126) : fido=889da5b8, Irp=88aaae70, Context=88ab1068, IRQL=2
[137596 ms]  <<<  URB 68 coming back  <<< 
-- URB_FUNCTION_BULK_OR_INTERRUPT_TRANSFER:
  PipeHandle           = 88a1f20c [endpoint 0x00000002]
  TransferFlags        = 00000002 (USBD_TRANSFER_DIRECTION_OUT, USBD_SHORT_TRANSFER_OK)
  TransferBufferLength = 00000011
  TransferBuffer       = 00000000
  TransferBufferMDL    = 88e151f0
  UrbLink              = 00000000
[137599 ms] UsbSnoop - MyInternalIOCTLCompletion(b792e126) : fido=889da5b8, Irp=88a93708, Context=89309548, IRQL=2
[137599 ms]  <<<  URB 67 coming back  <<< 
-- URB_FUNCTION_BULK_OR_INTERRUPT_TRANSFER:
  PipeHandle           = 88a1f1ec [endpoint 0x00000081]
  TransferFlags        = 00000003 (USBD_TRANSFER_DIRECTION_IN, USBD_SHORT_TRANSFER_OK)
  TransferBufferLength = 00000012
  TransferBuffer       = 00000000
  TransferBufferMDL    = 891a3be0
    00000000: 54 fd 64 01 00 ff 64 00 80 06 60 40 02 0a 11 5c
    00000010: 40 60
  UrbLink              = 00000000
[137600 ms] UsbSnoop - FilterDispatchAny(b792dfd2) : IRP_MJ_INTERNAL_DEVICE_CONTROL
[137600 ms] UsbSnoop - FdoHookDispatchInternalIoctl(b792e1ea) : fdo=88acdde8, Irp=88a93708, IRQL=0
[137600 ms]  >>>  URB 69 going down  >>> 
-- URB_FUNCTION_BULK_OR_INTERRUPT_TRANSFER:
  PipeHandle           = 88a1f1ec [endpoint 0x00000081]
  TransferFlags        = 00000003 (USBD_TRANSFER_DIRECTION_IN, USBD_SHORT_TRANSFER_OK)
  TransferBufferLength = 00000200
  TransferBuffer       = 00000000
  TransferBufferMDL    = 891a3be0
  UrbLink              = 00000000
[137606 ms] UsbSnoop - MyInternalIOCTLCompletion(b792e126) : fido=889da5b8, Irp=88a93708, Context=89309548, IRQL=2
[137606 ms]  <<<  URB 69 coming back  <<< 
-- URB_FUNCTION_BULK_OR_INTERRUPT_TRANSFER:
  PipeHandle           = 88a1f1ec [endpoint 0x00000081]
  TransferFlags        = 00000003 (USBD_TRANSFER_DIRECTION_IN, USBD_SHORT_TRANSFER_OK)
  TransferBufferLength = 00000027
  TransferBuffer       = 00000000
  TransferBufferMDL    = 891a3be0
    00000000: 54 fd 64 01 40 60 64 00 80 06 b9 ce 17 00 0f ed
    00000010: 10 00 14 44 6f 73 73 69 65 72 20 31 00 00 00 00
    00000020: 00 00 00 0e a1 01 00
  UrbLink              = 00000000
[137606 ms] UsbSnoop - FilterDispatchAny(b792dfd2) : IRP_MJ_INTERNAL_DEVICE_CONTROL
[137606 ms] UsbSnoop - FdoHookDispatchInternalIoctl(b792e1ea) : fdo=88acdde8, Irp=88a93708, IRQL=0
[137606 ms]  >>>  URB 70 going down  >>> 
-- URB_FUNCTION_BULK_OR_INTERRUPT_TRANSFER:
  PipeHandle           = 88a1f20c [endpoint 0x00000002]
  TransferFlags        = 00000002 (USBD_TRANSFER_DIRECTION_OUT, USBD_SHORT_TRANSFER_OK)
  TransferBufferLength = 00000012
  TransferBuffer       = 00000000
  TransferBufferMDL    = 891a3be0
    00000000: 54 fd 64 00 00 ff 64 01 40 60 06 80 02 0a 0f 5a
    00000010: 80 06
  UrbLink              = 00000000
[137606 ms] UsbSnoop - FilterDispatchAny(b792dfd2) : IRP_MJ_INTERNAL_DEVICE_CONTROL
[137606 ms] UsbSnoop - FdoHookDispatchInternalIoctl(b792e1ea) : fdo=88acdde8, Irp=88aaae70, IRQL=0
[137606 ms]  >>>  URB 71 going down  >>> 
-- URB_FUNCTION_BULK_OR_INTERRUPT_TRANSFER:
  PipeHandle           = 88a1f1ec [endpoint 0x00000081]
  TransferFlags        = 00000003 (USBD_TRANSFER_DIRECTION_IN, USBD_SHORT_TRANSFER_OK)
  TransferBufferLength = 00000200
  TransferBuffer       = 00000000
  TransferBufferMDL    = 88e151f0
  UrbLink              = 00000000
[137607 ms] UsbSnoop - MyInternalIOCTLCompletion(b792e126) : fido=889da5b8, Irp=88a93708, Context=89309548, IRQL=2
[137607 ms]  <<<  URB 70 coming back  <<< 
-- URB_FUNCTION_BULK_OR_INTERRUPT_TRANSFER:
  PipeHandle           = 88a1f20c [endpoint 0x00000002]
  TransferFlags        = 00000002 (USBD_TRANSFER_DIRECTION_OUT, USBD_SHORT_TRANSFER_OK)
  TransferBufferLength = 00000012
  TransferBuffer       = 00000000
  TransferBufferMDL    = 891a3be0
  UrbLink              = 00000000
[137665 ms] UsbSnoop - FilterDispatchAny(b792dfd2) : IRP_MJ_INTERNAL_DEVICE_CONTROL
[137665 ms] UsbSnoop - FdoHookDispatchInternalIoctl(b792e1ea) : fdo=88acdde8, Irp=88a93708, IRQL=0
[137666 ms]  >>>  URB 72 going down  >>> 
-- URB_FUNCTION_BULK_OR_INTERRUPT_TRANSFER:
  PipeHandle           = 88a1f20c [endpoint 0x00000002]
  TransferFlags        = 00000002 (USBD_TRANSFER_DIRECTION_OUT, USBD_SHORT_TRANSFER_OK)
  TransferBufferLength = 00000011
  TransferBuffer       = 00000000
  TransferBufferMDL    = 891a3be0
    00000000: 54 fd 64 00 80 06 64 01 40 60 0e 00 01 00 12 61
    00000010: 0e
  UrbLink              = 00000000
[137666 ms] UsbSnoop - MyInternalIOCTLCompletion(b792e126) : fido=889da5b8, Irp=88a93708, Context=89309548, IRQL=2
[137666 ms]  <<<  URB 72 coming back  <<< 
-- URB_FUNCTION_BULK_OR_INTERRUPT_TRANSFER:
  PipeHandle           = 88a1f20c [endpoint 0x00000002]
  TransferFlags        = 00000002 (USBD_TRANSFER_DIRECTION_OUT, USBD_SHORT_TRANSFER_OK)
  TransferBufferLength = 00000011
  TransferBuffer       = 00000000
  TransferBufferMDL    = 891a3be0
  UrbLink              = 00000000
[137667 ms] UsbSnoop - MyInternalIOCTLCompletion(b792e126) : fido=889da5b8, Irp=88aaae70, Context=88ab1068, IRQL=2
[137667 ms]  <<<  URB 71 coming back  <<< 
-- URB_FUNCTION_BULK_OR_INTERRUPT_TRANSFER:
  PipeHandle           = 88a1f1ec [endpoint 0x00000081]
  TransferFlags        = 00000003 (USBD_TRANSFER_DIRECTION_IN, USBD_SHORT_TRANSFER_OK)
  TransferBufferLength = 00000012
  TransferBuffer       = 00000000
  TransferBufferMDL    = 88e151f0
    00000000: 54 fd 64 01 00 ff 64 00 80 06 60 40 02 0a 12 5d
    00000010: 40 60
  UrbLink              = 00000000
[137668 ms] UsbSnoop - FilterDispatchAny(b792dfd2) : IRP_MJ_INTERNAL_DEVICE_CONTROL
[137668 ms] UsbSnoop - FdoHookDispatchInternalIoctl(b792e1ea) : fdo=88acdde8, Irp=88aaae70, IRQL=0
[137668 ms]  >>>  URB 73 going down  >>> 
-- URB_FUNCTION_BULK_OR_INTERRUPT_TRANSFER:
  PipeHandle           = 88a1f1ec [endpoint 0x00000081]
  TransferFlags        = 00000003 (USBD_TRANSFER_DIRECTION_IN, USBD_SHORT_TRANSFER_OK)
  TransferBufferLength = 00000200
  TransferBuffer       = 00000000
  TransferBufferMDL    = 88e151f0
  UrbLink              = 00000000
[137672 ms] UsbSnoop - MyInternalIOCTLCompletion(b792e126) : fido=889da5b8, Irp=88aaae70, Context=88ab1068, IRQL=2
[137672 ms]  <<<  URB 73 coming back  <<< 
-- URB_FUNCTION_BULK_OR_INTERRUPT_TRANSFER:
  PipeHandle           = 88a1f1ec [endpoint 0x00000081]
  TransferFlags        = 00000003 (USBD_TRANSFER_DIRECTION_IN, USBD_SHORT_TRANSFER_OK)
  TransferBufferLength = 00000026
  TransferBuffer       = 00000000
  TransferBufferMDL    = 88e151f0
    00000000: 54 fd 64 01 40 60 64 00 80 06 5c db 16 00 10 9d
    00000010: 10 00 13 45 78 65 6d 70 6c 65 73 00 00 00 00 00
    00000020: 00 00 00 0d 01 00
  UrbLink              = 00000000
[137672 ms] UsbSnoop - FilterDispatchAny(b792dfd2) : IRP_MJ_INTERNAL_DEVICE_CONTROL
[137672 ms] UsbSnoop - FdoHookDispatchInternalIoctl(b792e1ea) : fdo=88acdde8, Irp=88aaae70, IRQL=0
[137672 ms]  >>>  URB 74 going down  >>> 
-- URB_FUNCTION_BULK_OR_INTERRUPT_TRANSFER:
  PipeHandle           = 88a1f20c [endpoint 0x00000002]
  TransferFlags        = 00000002 (USBD_TRANSFER_DIRECTION_OUT, USBD_SHORT_TRANSFER_OK)
  TransferBufferLength = 00000012
  TransferBuffer       = 00000000
  TransferBufferMDL    = 88e151f0
    00000000: 54 fd 64 00 00 ff 64 01 40 60 06 80 02 0a 10 5b
    00000010: 80 06
  UrbLink              = 00000000
[137672 ms] UsbSnoop - FilterDispatchAny(b792dfd2) : IRP_MJ_INTERNAL_DEVICE_CONTROL
[137672 ms] UsbSnoop - FdoHookDispatchInternalIoctl(b792e1ea) : fdo=88acdde8, Irp=88a93708, IRQL=0
[137672 ms]  >>>  URB 75 going down  >>> 
-- URB_FUNCTION_BULK_OR_INTERRUPT_TRANSFER:
  PipeHandle           = 88a1f1ec [endpoint 0x00000081]
  TransferFlags        = 00000003 (USBD_TRANSFER_DIRECTION_IN, USBD_SHORT_TRANSFER_OK)
  TransferBufferLength = 00000200
  TransferBuffer       = 00000000
  TransferBufferMDL    = 891a3be0
  UrbLink              = 00000000
[137672 ms] UsbSnoop - MyInternalIOCTLCompletion(b792e126) : fido=889da5b8, Irp=88aaae70, Context=88ab1068, IRQL=2
[137672 ms]  <<<  URB 74 coming back  <<< 
-- URB_FUNCTION_BULK_OR_INTERRUPT_TRANSFER:
  PipeHandle           = 88a1f20c [endpoint 0x00000002]
  TransferFlags        = 00000002 (USBD_TRANSFER_DIRECTION_OUT, USBD_SHORT_TRANSFER_OK)
  TransferBufferLength = 00000012
  TransferBuffer       = 00000000
  TransferBufferMDL    = 88e151f0
  UrbLink              = 00000000
[137674 ms] UsbSnoop - FilterDispatchAny(b792dfd2) : IRP_MJ_INTERNAL_DEVICE_CONTROL
[137674 ms] UsbSnoop - FdoHookDispatchInternalIoctl(b792e1ea) : fdo=88acdde8, Irp=88aaae70, IRQL=0
[137674 ms]  >>>  URB 76 going down  >>> 
-- URB_FUNCTION_BULK_OR_INTERRUPT_TRANSFER:
  PipeHandle           = 88a1f20c [endpoint 0x00000002]
  TransferFlags        = 00000002 (USBD_TRANSFER_DIRECTION_OUT, USBD_SHORT_TRANSFER_OK)
  TransferBufferLength = 00000011
  TransferBuffer       = 00000000
  TransferBufferMDL    = 88e151f0
    00000000: 54 fd 64 00 80 06 64 01 40 60 0e 00 01 00 13 62
    00000010: 0e
  UrbLink              = 00000000
[137675 ms] UsbSnoop - MyInternalIOCTLCompletion(b792e126) : fido=889da5b8, Irp=88aaae70, Context=88ab1068, IRQL=2
[137675 ms]  <<<  URB 76 coming back  <<< 
-- URB_FUNCTION_BULK_OR_INTERRUPT_TRANSFER:
  PipeHandle           = 88a1f20c [endpoint 0x00000002]
  TransferFlags        = 00000002 (USBD_TRANSFER_DIRECTION_OUT, USBD_SHORT_TRANSFER_OK)
  TransferBufferLength = 00000011
  TransferBuffer       = 00000000
  TransferBufferMDL    = 88e151f0
  UrbLink              = 00000000
[137677 ms] UsbSnoop - MyInternalIOCTLCompletion(b792e126) : fido=889da5b8, Irp=88a93708, Context=89309548, IRQL=2
[137677 ms]  <<<  URB 75 coming back  <<< 
-- URB_FUNCTION_BULK_OR_INTERRUPT_TRANSFER:
  PipeHandle           = 88a1f1ec [endpoint 0x00000081]
  TransferFlags        = 00000003 (USBD_TRANSFER_DIRECTION_IN, USBD_SHORT_TRANSFER_OK)
  TransferBufferLength = 00000012
  TransferBuffer       = 00000000
  TransferBufferMDL    = 891a3be0
    00000000: 54 fd 64 01 00 ff 64 00 80 06 60 40 02 0a 13 5e
    00000010: 40 60
  UrbLink              = 00000000
[137678 ms] UsbSnoop - FilterDispatchAny(b792dfd2) : IRP_MJ_INTERNAL_DEVICE_CONTROL
[137678 ms] UsbSnoop - FdoHookDispatchInternalIoctl(b792e1ea) : fdo=88acdde8, Irp=88a93708, IRQL=0
[137678 ms]  >>>  URB 77 going down  >>> 
-- URB_FUNCTION_BULK_OR_INTERRUPT_TRANSFER:
  PipeHandle           = 88a1f1ec [endpoint 0x00000081]
  TransferFlags        = 00000003 (USBD_TRANSFER_DIRECTION_IN, USBD_SHORT_TRANSFER_OK)
  TransferBufferLength = 00000200
  TransferBuffer       = 00000000
  TransferBufferMDL    = 891a3be0
  UrbLink              = 00000000
[137681 ms] UsbSnoop - MyInternalIOCTLCompletion(b792e126) : fido=889da5b8, Irp=88a93708, Context=89309548, IRQL=2
[137681 ms]  <<<  URB 77 coming back  <<< 
-- URB_FUNCTION_BULK_OR_INTERRUPT_TRANSFER:
  PipeHandle           = 88a1f1ec [endpoint 0x00000081]
  TransferFlags        = 00000003 (USBD_TRANSFER_DIRECTION_IN, USBD_SHORT_TRANSFER_OK)
  TransferBufferLength = 00000026
  TransferBuffer       = 00000000
  TransferBufferMDL    = 891a3be0
    00000000: 54 fd 64 01 40 60 64 00 80 06 2c ec 16 00 11 7f
    00000010: 10 00 13 4d 79 4c 69 62 00 00 00 00 00 00 00 00
    00000020: 00 00 01 04 01 00
  UrbLink              = 00000000
[137681 ms] UsbSnoop - FilterDispatchAny(b792dfd2) : IRP_MJ_INTERNAL_DEVICE_CONTROL
[137681 ms] UsbSnoop - FdoHookDispatchInternalIoctl(b792e1ea) : fdo=88acdde8, Irp=88a93708, IRQL=0
[137681 ms]  >>>  URB 78 going down  >>> 
-- URB_FUNCTION_BULK_OR_INTERRUPT_TRANSFER:
  PipeHandle           = 88a1f20c [endpoint 0x00000002]
  TransferFlags        = 00000002 (USBD_TRANSFER_DIRECTION_OUT, USBD_SHORT_TRANSFER_OK)
  TransferBufferLength = 00000012
  TransferBuffer       = 00000000
  TransferBufferMDL    = 891a3be0
    00000000: 54 fd 64 00 00 ff 64 01 40 60 06 80 02 0a 11 5c
    00000010: 80 06
  UrbLink              = 00000000
[137681 ms] UsbSnoop - MyInternalIOCTLCompletion(b792e126) : fido=889da5b8, Irp=88a93708, Context=89309548, IRQL=2
[137681 ms]  <<<  URB 78 coming back  <<< 
-- URB_FUNCTION_BULK_OR_INTERRUPT_TRANSFER:
  PipeHandle           = 88a1f20c [endpoint 0x00000002]
  TransferFlags        = 00000002 (USBD_TRANSFER_DIRECTION_OUT, USBD_SHORT_TRANSFER_OK)
  TransferBufferLength = 00000012
  TransferBuffer       = 00000000
  TransferBufferMDL    = 891a3be0
  UrbLink              = 00000000
[137681 ms] UsbSnoop - FilterDispatchAny(b792dfd2) : IRP_MJ_INTERNAL_DEVICE_CONTROL
[137681 ms] UsbSnoop - FdoHookDispatchInternalIoctl(b792e1ea) : fdo=88acdde8, Irp=88a93708, IRQL=0
[137681 ms]  >>>  URB 79 going down  >>> 
-- URB_FUNCTION_BULK_OR_INTERRUPT_TRANSFER:
  PipeHandle           = 88a1f1ec [endpoint 0x00000081]
  TransferFlags        = 00000003 (USBD_TRANSFER_DIRECTION_IN, USBD_SHORT_TRANSFER_OK)
  TransferBufferLength = 00000200
  TransferBuffer       = 00000000
  TransferBufferMDL    = 891a3be0
  UrbLink              = 00000000
[137683 ms] UsbSnoop - FilterDispatchAny(b792dfd2) : IRP_MJ_INTERNAL_DEVICE_CONTROL
[137683 ms] UsbSnoop - FdoHookDispatchInternalIoctl(b792e1ea) : fdo=88acdde8, Irp=88aaae70, IRQL=0
[137683 ms]  >>>  URB 80 going down  >>> 
-- URB_FUNCTION_BULK_OR_INTERRUPT_TRANSFER:
  PipeHandle           = 88a1f20c [endpoint 0x00000002]
  TransferFlags        = 00000002 (USBD_TRANSFER_DIRECTION_OUT, USBD_SHORT_TRANSFER_OK)
  TransferBufferLength = 00000011
  TransferBuffer       = 00000000
  TransferBufferMDL    = 88e151f0
    00000000: 54 fd 64 00 80 06 64 01 40 60 0e 00 01 00 14 63
    00000010: 0e
  UrbLink              = 00000000
[137684 ms] UsbSnoop - MyInternalIOCTLCompletion(b792e126) : fido=889da5b8, Irp=88aaae70, Context=88ab1068, IRQL=2
[137684 ms]  <<<  URB 80 coming back  <<< 
-- URB_FUNCTION_BULK_OR_INTERRUPT_TRANSFER:
  PipeHandle           = 88a1f20c [endpoint 0x00000002]
  TransferFlags        = 00000002 (USBD_TRANSFER_DIRECTION_OUT, USBD_SHORT_TRANSFER_OK)
  TransferBufferLength = 00000011
  TransferBuffer       = 00000000
  TransferBufferMDL    = 88e151f0
  UrbLink              = 00000000
[137686 ms] UsbSnoop - MyInternalIOCTLCompletion(b792e126) : fido=889da5b8, Irp=88a93708, Context=89309548, IRQL=2
[137686 ms]  <<<  URB 79 coming back  <<< 
-- URB_FUNCTION_BULK_OR_INTERRUPT_TRANSFER:
  PipeHandle           = 88a1f1ec [endpoint 0x00000081]
  TransferFlags        = 00000003 (USBD_TRANSFER_DIRECTION_IN, USBD_SHORT_TRANSFER_OK)
  TransferBufferLength = 00000012
  TransferBuffer       = 00000000
  TransferBufferMDL    = 891a3be0
    00000000: 54 fd 64 01 00 ff 64 00 80 06 60 40 02 0a 14 5f
    00000010: 40 60
  UrbLink              = 00000000
[137686 ms] UsbSnoop - FilterDispatchAny(b792dfd2) : IRP_MJ_INTERNAL_DEVICE_CONTROL
[137686 ms] UsbSnoop - FdoHookDispatchInternalIoctl(b792e1ea) : fdo=88acdde8, Irp=88a93708, IRQL=0
[137686 ms]  >>>  URB 81 going down  >>> 
-- URB_FUNCTION_BULK_OR_INTERRUPT_TRANSFER:
  PipeHandle           = 88a1f1ec [endpoint 0x00000081]
  TransferFlags        = 00000003 (USBD_TRANSFER_DIRECTION_IN, USBD_SHORT_TRANSFER_OK)
  TransferBufferLength = 00000200
  TransferBuffer       = 00000000
  TransferBufferMDL    = 891a3be0
  UrbLink              = 00000000
[137688 ms] UsbSnoop - MyInternalIOCTLCompletion(b792e126) : fido=889da5b8, Irp=88a93708, Context=89309548, IRQL=2
[137688 ms]  <<<  URB 81 coming back  <<< 
-- URB_FUNCTION_BULK_OR_INTERRUPT_TRANSFER:
  PipeHandle           = 88a1f1ec [endpoint 0x00000081]
  TransferFlags        = 00000003 (USBD_TRANSFER_DIRECTION_IN, USBD_SHORT_TRANSFER_OK)
  TransferBufferLength = 00000012
  TransferBuffer       = 00000000
  TransferBufferMDL    = 891a3be0
    00000000: 54 fd 64 01 40 60 64 00 80 06 11 ff 02 00 12 64
    00000010: ff 11
  UrbLink              = 00000000
[137689 ms] UsbSnoop - FilterDispatchAny(b792dfd2) : IRP_MJ_INTERNAL_DEVICE_CONTROL
[137689 ms] UsbSnoop - FdoHookDispatchInternalIoctl(b792e1ea) : fdo=88acdde8, Irp=88a93708, IRQL=0
[137689 ms]  >>>  URB 82 going down  >>> 
-- URB_FUNCTION_BULK_OR_INTERRUPT_TRANSFER:
  PipeHandle           = 88a1f20c [endpoint 0x00000002]
  TransferFlags        = 00000002 (USBD_TRANSFER_DIRECTION_OUT, USBD_SHORT_TRANSFER_OK)
  TransferBufferLength = 00000012
  TransferBuffer       = 00000000
  TransferBufferMDL    = 891a3be0
    00000000: 54 fd 64 00 00 ff 64 01 40 60 06 80 02 0a 12 5d
    00000010: 80 06
  UrbLink              = 00000000
[137689 ms] UsbSnoop - MyInternalIOCTLCompletion(b792e126) : fido=889da5b8, Irp=88a93708, Context=89309548, IRQL=2
[137689 ms]  <<<  URB 82 coming back  <<< 
-- URB_FUNCTION_BULK_OR_INTERRUPT_TRANSFER:
  PipeHandle           = 88a1f20c [endpoint 0x00000002]
  TransferFlags        = 00000002 (USBD_TRANSFER_DIRECTION_OUT, USBD_SHORT_TRANSFER_OK)
  TransferBufferLength = 00000012
  TransferBuffer       = 00000000
  TransferBufferMDL    = 891a3be0
  UrbLink              = 00000000
[137689 ms] UsbSnoop - FilterDispatchAny(b792dfd2) : IRP_MJ_INTERNAL_DEVICE_CONTROL
[137689 ms] UsbSnoop - FdoHookDispatchInternalIoctl(b792e1ea) : fdo=88acdde8, Irp=88a93708, IRQL=0
[137689 ms]  >>>  URB 83 going down  >>> 
-- URB_FUNCTION_BULK_OR_INTERRUPT_TRANSFER:
  PipeHandle           = 88a1f20c [endpoint 0x00000002]
  TransferFlags        = 00000002 (USBD_TRANSFER_DIRECTION_OUT, USBD_SHORT_TRANSFER_OK)
  TransferBufferLength = 00000011
  TransferBuffer       = 00000000
  TransferBufferMDL    = 891a3be0
    00000000: 54 fd 64 00 80 06 64 01 40 60 0f 00 01 00 15 65
    00000010: 0f
  UrbLink              = 00000000
[137689 ms] UsbSnoop - FilterDispatchAny(b792dfd2) : IRP_MJ_INTERNAL_DEVICE_CONTROL
[137689 ms] UsbSnoop - FdoHookDispatchInternalIoctl(b792e1ea) : fdo=88acdde8, Irp=88aaae70, IRQL=0
[137689 ms]  >>>  URB 84 going down  >>> 
-- URB_FUNCTION_BULK_OR_INTERRUPT_TRANSFER:
  PipeHandle           = 88a1f1ec [endpoint 0x00000081]
  TransferFlags        = 00000003 (USBD_TRANSFER_DIRECTION_IN, USBD_SHORT_TRANSFER_OK)
  TransferBufferLength = 00000200
  TransferBuffer       = 00000000
  TransferBufferMDL    = 88e151f0
  UrbLink              = 00000000
[137691 ms] UsbSnoop - MyInternalIOCTLCompletion(b792e126) : fido=889da5b8, Irp=88a93708, Context=89309548, IRQL=2
[137691 ms]  <<<  URB 83 coming back  <<< 
-- URB_FUNCTION_BULK_OR_INTERRUPT_TRANSFER:
  PipeHandle           = 88a1f20c [endpoint 0x00000002]
  TransferFlags        = 00000002 (USBD_TRANSFER_DIRECTION_OUT, USBD_SHORT_TRANSFER_OK)
  TransferBufferLength = 00000011
  TransferBuffer       = 00000000
  TransferBufferMDL    = 891a3be0
  UrbLink              = 00000000
[137694 ms] UsbSnoop - MyInternalIOCTLCompletion(b792e126) : fido=889da5b8, Irp=88aaae70, Context=88ab1068, IRQL=2
[137694 ms]  <<<  URB 84 coming back  <<< 
-- URB_FUNCTION_BULK_OR_INTERRUPT_TRANSFER:
  PipeHandle           = 88a1f1ec [endpoint 0x00000081]
  TransferFlags        = 00000003 (USBD_TRANSFER_DIRECTION_IN, USBD_SHORT_TRANSFER_OK)
  TransferBufferLength = 00000012
  TransferBuffer       = 00000000
  TransferBufferMDL    = 88e151f0
    00000000: 54 fd 64 01 00 ff 64 00 80 06 60 40 02 0a 15 60
    00000010: 40 60
  UrbLink              = 00000000
[137694 ms] UsbSnoop - FilterDispatchAny(b792dfd2) : IRP_MJ_INTERNAL_DEVICE_CONTROL
[137694 ms] UsbSnoop - FdoHookDispatchInternalIoctl(b792e1ea) : fdo=88acdde8, Irp=88aaae70, IRQL=0
[137694 ms]  >>>  URB 85 going down  >>> 
-- URB_FUNCTION_BULK_OR_INTERRUPT_TRANSFER:
  PipeHandle           = 88a1f1ec [endpoint 0x00000081]
  TransferFlags        = 00000003 (USBD_TRANSFER_DIRECTION_IN, USBD_SHORT_TRANSFER_OK)
  TransferBufferLength = 00000200
  TransferBuffer       = 00000000
  TransferBufferMDL    = 88e151f0
  UrbLink              = 00000000
[137697 ms] UsbSnoop - MyInternalIOCTLCompletion(b792e126) : fido=889da5b8, Irp=88aaae70, Context=88ab1068, IRQL=2
[137697 ms]  <<<  URB 85 coming back  <<< 
-- URB_FUNCTION_BULK_OR_INTERRUPT_TRANSFER:
  PipeHandle           = 88a1f1ec [endpoint 0x00000081]
  TransferFlags        = 00000003 (USBD_TRANSFER_DIRECTION_IN, USBD_SHORT_TRANSFER_OK)
  TransferBufferLength = 00000012
  TransferBuffer       = 00000000
  TransferBufferMDL    = 88e151f0
    00000000: 54 fd 64 01 40 60 64 00 80 06 00 ff 02 00 13 54
    00000010: ff 00
  UrbLink              = 00000000
[137697 ms] UsbSnoop - FilterDispatchAny(b792dfd2) : IRP_MJ_INTERNAL_DEVICE_CONTROL
[137697 ms] UsbSnoop - FdoHookDispatchInternalIoctl(b792e1ea) : fdo=88acdde8, Irp=88aaae70, IRQL=0
[137697 ms]  >>>  URB 86 going down  >>> 
-- URB_FUNCTION_BULK_OR_INTERRUPT_TRANSFER:
  PipeHandle           = 88a1f1ec [endpoint 0x00000081]
  TransferFlags        = 00000003 (USBD_TRANSFER_DIRECTION_IN, USBD_SHORT_TRANSFER_OK)
  TransferBufferLength = 00000200
  TransferBuffer       = 00000000
  TransferBufferMDL    = 88e151f0
  UrbLink              = 00000000
[137697 ms] UsbSnoop - FilterDispatchAny(b792dfd2) : IRP_MJ_INTERNAL_DEVICE_CONTROL
[137697 ms] UsbSnoop - FdoHookDispatchInternalIoctl(b792e1ea) : fdo=88acdde8, Irp=88a93708, IRQL=0
[137697 ms]  >>>  URB 87 going down  >>> 
-- URB_FUNCTION_BULK_OR_INTERRUPT_TRANSFER:
  PipeHandle           = 88a1f20c [endpoint 0x00000002]
  TransferFlags        = 00000002 (USBD_TRANSFER_DIRECTION_OUT, USBD_SHORT_TRANSFER_OK)
  TransferBufferLength = 00000012
  TransferBuffer       = 00000000
  TransferBufferMDL    = 891a3be0
    00000000: 54 fd 64 00 00 ff 64 01 40 60 06 80 02 0a 13 5e
    00000010: 80 06
  UrbLink              = 00000000
[137698 ms] UsbSnoop - MyInternalIOCTLCompletion(b792e126) : fido=889da5b8, Irp=88a93708, Context=89309548, IRQL=2
[137698 ms]  <<<  URB 87 coming back  <<< 
-- URB_FUNCTION_BULK_OR_INTERRUPT_TRANSFER:
  PipeHandle           = 88a1f20c [endpoint 0x00000002]
  TransferFlags        = 00000002 (USBD_TRANSFER_DIRECTION_OUT, USBD_SHORT_TRANSFER_OK)
  TransferBufferLength = 00000012
  TransferBuffer       = 00000000
  TransferBufferMDL    = 891a3be0
  UrbLink              = 00000000
[137700 ms] UsbSnoop - FilterDispatchAny(b792dfd2) : IRP_MJ_INTERNAL_DEVICE_CONTROL
[137700 ms] UsbSnoop - FdoHookDispatchInternalIoctl(b792e1ea) : fdo=88acdde8, Irp=88a93708, IRQL=0
[137700 ms]  >>>  URB 88 going down  >>> 
-- URB_FUNCTION_BULK_OR_INTERRUPT_TRANSFER:
  PipeHandle           = 88a1f20c [endpoint 0x00000002]
  TransferFlags        = 00000002 (USBD_TRANSFER_DIRECTION_OUT, USBD_SHORT_TRANSFER_OK)
  TransferBufferLength = 00000012
  TransferBuffer       = 00000000
  TransferBufferMDL    = 891a3be0
    00000000: 54 fd 64 00 40 de 64 01 40 60 06 80 02 00 16 76
    00000010: 80 06
  UrbLink              = 00000000
[137700 ms] UsbSnoop - MyInternalIOCTLCompletion(b792e126) : fido=889da5b8, Irp=88a93708, Context=89309548, IRQL=2
[137700 ms]  <<<  URB 88 coming back  <<< 
-- URB_FUNCTION_BULK_OR_INTERRUPT_TRANSFER:
  PipeHandle           = 88a1f20c [endpoint 0x00000002]
  TransferFlags        = 00000002 (USBD_TRANSFER_DIRECTION_OUT, USBD_SHORT_TRANSFER_OK)
  TransferBufferLength = 00000012
  TransferBuffer       = 00000000
  TransferBufferMDL    = 891a3be0
  UrbLink              = 00000000
[137702 ms] UsbSnoop - MyInternalIOCTLCompletion(b792e126) : fido=889da5b8, Irp=88aaae70, Context=88ab1068, IRQL=2
[137702 ms]  <<<  URB 86 coming back  <<< 
-- URB_FUNCTION_BULK_OR_INTERRUPT_TRANSFER:
  PipeHandle           = 88a1f1ec [endpoint 0x00000081]
  TransferFlags        = 00000003 (USBD_TRANSFER_DIRECTION_IN, USBD_SHORT_TRANSFER_OK)
  TransferBufferLength = 00000012
  TransferBuffer       = 00000000
  TransferBufferMDL    = 88e151f0
    00000000: 54 fd 64 01 00 ff 64 00 80 06 60 40 02 0a 16 61
    00000010: 40 60
  UrbLink              = 00000000
[137703 ms] UsbSnoop - FilterDispatchAny(b792dfd2) : IRP_MJ_INTERNAL_DEVICE_CONTROL
[137703 ms] UsbSnoop - FdoHookDispatchInternalIoctl(b792e1ea) : fdo=88acdde8, Irp=88aaae70, IRQL=0
[137703 ms]  >>>  URB 89 going down  >>> 
-- URB_FUNCTION_BULK_OR_INTERRUPT_TRANSFER:
  PipeHandle           = 88a1f1ec [endpoint 0x00000081]
  TransferFlags        = 00000003 (USBD_TRANSFER_DIRECTION_IN, USBD_SHORT_TRANSFER_OK)
  TransferBufferLength = 00000200
  TransferBuffer       = 00000000
  TransferBufferMDL    = 88e151f0
  UrbLink              = 00000000
[137726 ms] UsbSnoop - FilterDispatchAny(b792dfd2) : IRP_MJ_INTERNAL_DEVICE_CONTROL
[137726 ms] UsbSnoop - FdoHookDispatchInternalIoctl(b792e1ea) : fdo=88acdde8, Irp=88a93708, IRQL=0
[137726 ms]  >>>  URB 90 going down  >>> 
-- URB_FUNCTION_BULK_OR_INTERRUPT_TRANSFER:
  PipeHandle           = 88a1f20c [endpoint 0x00000002]
  TransferFlags        = 00000002 (USBD_TRANSFER_DIRECTION_OUT, USBD_SHORT_TRANSFER_OK)
  TransferBufferLength = 00000011
  TransferBuffer       = 00000000
  TransferBufferMDL    = 891a3be0
    00000000: 54 fd 64 00 80 07 64 01 40 20 01 00 01 00 17 1a
    00000010: 01
  UrbLink              = 00000000
[137726 ms] UsbSnoop - MyInternalIOCTLCompletion(b792e126) : fido=889da5b8, Irp=88a93708, Context=89309548, IRQL=2
[137726 ms]  <<<  URB 90 coming back  <<< 
-- URB_FUNCTION_BULK_OR_INTERRUPT_TRANSFER:
  PipeHandle           = 88a1f20c [endpoint 0x00000002]
  TransferFlags        = 00000002 (USBD_TRANSFER_DIRECTION_OUT, USBD_SHORT_TRANSFER_OK)
  TransferBufferLength = 00000011
  TransferBuffer       = 00000000
  TransferBufferMDL    = 891a3be0
  UrbLink              = 00000000
[137728 ms] UsbSnoop - MyInternalIOCTLCompletion(b792e126) : fido=889da5b8, Irp=88aaae70, Context=88ab1068, IRQL=2
[137728 ms]  <<<  URB 89 coming back  <<< 
-- URB_FUNCTION_BULK_OR_INTERRUPT_TRANSFER:
  PipeHandle           = 88a1f1ec [endpoint 0x00000081]
  TransferFlags        = 00000003 (USBD_TRANSFER_DIRECTION_IN, USBD_SHORT_TRANSFER_OK)
  TransferBufferLength = 00000012
  TransferBuffer       = 00000000
  TransferBufferMDL    = 88e151f0
    00000000: 54 fd 64 01 00 ff 64 00 80 07 20 40 02 0a 17 23
    00000010: 40 20
  UrbLink              = 00000000
[137728 ms] UsbSnoop - FilterDispatchAny(b792dfd2) : IRP_MJ_INTERNAL_DEVICE_CONTROL
[137728 ms] UsbSnoop - FdoHookDispatchInternalIoctl(b792e1ea) : fdo=88acdde8, Irp=88aaae70, IRQL=0
[137728 ms]  >>>  URB 91 going down  >>> 
-- URB_FUNCTION_BULK_OR_INTERRUPT_TRANSFER:
  PipeHandle           = 88a1f1ec [endpoint 0x00000081]
  TransferFlags        = 00000003 (USBD_TRANSFER_DIRECTION_IN, USBD_SHORT_TRANSFER_OK)
  TransferBufferLength = 00000200
  TransferBuffer       = 00000000
  TransferBufferMDL    = 88e151f0
  UrbLink              = 00000000
[137734 ms] UsbSnoop - MyInternalIOCTLCompletion(b792e126) : fido=889da5b8, Irp=88aaae70, Context=88ab1068, IRQL=2
[137734 ms]  <<<  URB 91 coming back  <<< 
-- URB_FUNCTION_BULK_OR_INTERRUPT_TRANSFER:
  PipeHandle           = 88a1f1ec [endpoint 0x00000081]
  TransferFlags        = 00000003 (USBD_TRANSFER_DIRECTION_IN, USBD_SHORT_TRANSFER_OK)
  TransferBufferLength = 0000007f
  TransferBuffer       = 00000000
  TransferBufferMDL    = 88e151f0
    00000000: 54 fd 64 01 40 20 64 00 80 07 84 aa 6f 00 14 b2
    00000010: 01 00 00 00 00 01 22 76 00 00 00 00 00 01 be 00
    00000020: 00 00 00 00 00 01 2e 05 c8 00 00 00 00 01 5e b4
    00000030: 84 7f 00 00 5a 01 04 2d 85 01 01 22 d4 01 04 06
    00000040: 23 00 00 00 00 00 02 00 00 00 00 01 40 00 f0 04
    00000050: 00 1e 30 30 30 30 34 42 43 31 42 31 30 45 35 37
    00000060: 30 46 00 30 45 30 30 30 30 30 34 42 43 31 42 31
    00000070: 30 45 35 37 30 46 43 42 32 38 30 34 46 31 00
  UrbLink              = 00000000
[137734 ms] UsbSnoop - FilterDispatchAny(b792dfd2) : IRP_MJ_INTERNAL_DEVICE_CONTROL
[137734 ms] UsbSnoop - FdoHookDispatchInternalIoctl(b792e1ea) : fdo=88acdde8, Irp=88aaae70, IRQL=0
[137734 ms]  >>>  URB 92 going down  >>> 
-- URB_FUNCTION_BULK_OR_INTERRUPT_TRANSFER:
  PipeHandle           = 88a1f20c [endpoint 0x00000002]
  TransferFlags        = 00000002 (USBD_TRANSFER_DIRECTION_OUT, USBD_SHORT_TRANSFER_OK)
  TransferBufferLength = 00000012
  TransferBuffer       = 00000000
  TransferBufferMDL    = 88e151f0
    00000000: 54 fd 64 00 00 ff 64 01 40 20 07 80 02 0a 14 20
    00000010: 80 07
  UrbLink              = 00000000
[137734 ms] UsbSnoop - FilterDispatchAny(b792dfd2) : IRP_MJ_INTERNAL_DEVICE_CONTROL
[137734 ms] UsbSnoop - FdoHookDispatchInternalIoctl(b792e1ea) : fdo=88acdde8, Irp=88a93708, IRQL=0
[137734 ms]  >>>  URB 93 going down  >>> 
-- URB_FUNCTION_BULK_OR_INTERRUPT_TRANSFER:
  PipeHandle           = 88a1f1ec [endpoint 0x00000081]
  TransferFlags        = 00000003 (USBD_TRANSFER_DIRECTION_IN, USBD_SHORT_TRANSFER_OK)
  TransferBufferLength = 00000200
  TransferBuffer       = 00000000
  TransferBufferMDL    = 891a3be0
  UrbLink              = 00000000
[137734 ms] UsbSnoop - MyInternalIOCTLCompletion(b792e126) : fido=889da5b8, Irp=88aaae70, Context=88ab1068, IRQL=2
[137734 ms]  <<<  URB 92 coming back  <<< 
-- URB_FUNCTION_BULK_OR_INTERRUPT_TRANSFER:
  PipeHandle           = 88a1f20c [endpoint 0x00000002]
  TransferFlags        = 00000002 (USBD_TRANSFER_DIRECTION_OUT, USBD_SHORT_TRANSFER_OK)
  TransferBufferLength = 00000012
  TransferBuffer       = 00000000
  TransferBufferMDL    = 88e151f0
  UrbLink              = 00000000
[137736 ms] UsbSnoop - FilterDispatchAny(b792dfd2) : IRP_MJ_INTERNAL_DEVICE_CONTROL
[137736 ms] UsbSnoop - FdoHookDispatchInternalIoctl(b792e1ea) : fdo=88acdde8, Irp=88aaae70, IRQL=0
[137736 ms]  >>>  URB 94 going down  >>> 
-- URB_FUNCTION_BULK_OR_INTERRUPT_TRANSFER:
  PipeHandle           = 88a1f20c [endpoint 0x00000002]
  TransferFlags        = 00000002 (USBD_TRANSFER_DIRECTION_OUT, USBD_SHORT_TRANSFER_OK)
  TransferBufferLength = 00000011
  TransferBuffer       = 00000000
  TransferBufferMDL    = 88e151f0
    00000000: 54 fd 64 00 80 07 64 01 40 20 02 00 01 00 18 1c
    00000010: 02
  UrbLink              = 00000000
[137737 ms] UsbSnoop - MyInternalIOCTLCompletion(b792e126) : fido=889da5b8, Irp=88aaae70, Context=88ab1068, IRQL=2
[137737 ms]  <<<  URB 94 coming back  <<< 
-- URB_FUNCTION_BULK_OR_INTERRUPT_TRANSFER:
  PipeHandle           = 88a1f20c [endpoint 0x00000002]
  TransferFlags        = 00000002 (USBD_TRANSFER_DIRECTION_OUT, USBD_SHORT_TRANSFER_OK)
  TransferBufferLength = 00000011
  TransferBuffer       = 00000000
  TransferBufferMDL    = 88e151f0
  UrbLink              = 00000000
[137739 ms] UsbSnoop - MyInternalIOCTLCompletion(b792e126) : fido=889da5b8, Irp=88a93708, Context=89309548, IRQL=2
[137739 ms]  <<<  URB 93 coming back  <<< 
-- URB_FUNCTION_BULK_OR_INTERRUPT_TRANSFER:
  PipeHandle           = 88a1f1ec [endpoint 0x00000081]
  TransferFlags        = 00000003 (USBD_TRANSFER_DIRECTION_IN, USBD_SHORT_TRANSFER_OK)
  TransferBufferLength = 00000012
  TransferBuffer       = 00000000
  TransferBufferMDL    = 891a3be0
    00000000: 54 fd 64 01 00 ff 64 00 80 07 20 40 02 0a 18 24
    00000010: 40 20
  UrbLink              = 00000000
[137740 ms] UsbSnoop - FilterDispatchAny(b792dfd2) : IRP_MJ_INTERNAL_DEVICE_CONTROL
[137740 ms] UsbSnoop - FdoHookDispatchInternalIoctl(b792e1ea) : fdo=88acdde8, Irp=88a93708, IRQL=0
[137740 ms]  >>>  URB 95 going down  >>> 
-- URB_FUNCTION_BULK_OR_INTERRUPT_TRANSFER:
  PipeHandle           = 88a1f1ec [endpoint 0x00000081]
  TransferFlags        = 00000003 (USBD_TRANSFER_DIRECTION_IN, USBD_SHORT_TRANSFER_OK)
  TransferBufferLength = 00000200
  TransferBuffer       = 00000000
  TransferBufferMDL    = 891a3be0
  UrbLink              = 00000000
[137743 ms] UsbSnoop - MyInternalIOCTLCompletion(b792e126) : fido=889da5b8, Irp=88a93708, Context=89309548, IRQL=2
[137743 ms]  <<<  URB 95 coming back  <<< 
-- URB_FUNCTION_BULK_OR_INTERRUPT_TRANSFER:
  PipeHandle           = 88a1f1ec [endpoint 0x00000081]
  TransferFlags        = 00000003 (USBD_TRANSFER_DIRECTION_IN, USBD_SHORT_TRANSFER_OK)
  TransferBufferLength = 0000001b
  TransferBuffer       = 00000000
  TransferBufferMDL    = 891a3be0
    00000000: 54 fd 64 01 40 20 64 00 80 07 38 5a 0b 00 15 b3
    00000010: 02 54 49 2d 4e 73 70 69 72 65 00
  UrbLink              = 00000000
[137744 ms] UsbSnoop - FilterDispatchAny(b792dfd2) : IRP_MJ_INTERNAL_DEVICE_CONTROL
[137744 ms] UsbSnoop - FdoHookDispatchInternalIoctl(b792e1ea) : fdo=88acdde8, Irp=88a93708, IRQL=0
[137744 ms]  >>>  URB 96 going down  >>> 
-- URB_FUNCTION_BULK_OR_INTERRUPT_TRANSFER:
  PipeHandle           = 88a1f1ec [endpoint 0x00000081]
  TransferFlags        = 00000003 (USBD_TRANSFER_DIRECTION_IN, USBD_SHORT_TRANSFER_OK)
  TransferBufferLength = 00000200
  TransferBuffer       = 00000000
  TransferBufferMDL    = 891a3be0
  UrbLink              = 00000000
[137744 ms] UsbSnoop - FilterDispatchAny(b792dfd2) : IRP_MJ_INTERNAL_DEVICE_CONTROL
[137744 ms] UsbSnoop - FdoHookDispatchInternalIoctl(b792e1ea) : fdo=88acdde8, Irp=88aaae70, IRQL=0
[137744 ms]  >>>  URB 97 going down  >>> 
-- URB_FUNCTION_BULK_OR_INTERRUPT_TRANSFER:
  PipeHandle           = 88a1f20c [endpoint 0x00000002]
  TransferFlags        = 00000002 (USBD_TRANSFER_DIRECTION_OUT, USBD_SHORT_TRANSFER_OK)
  TransferBufferLength = 00000012
  TransferBuffer       = 00000000
  TransferBufferMDL    = 88e151f0
    00000000: 54 fd 64 00 00 ff 64 01 40 20 07 80 02 0a 15 21
    00000010: 80 07
  UrbLink              = 00000000
[137744 ms] UsbSnoop - MyInternalIOCTLCompletion(b792e126) : fido=889da5b8, Irp=88aaae70, Context=88ab1068, IRQL=2
[137744 ms]  <<<  URB 97 coming back  <<< 
-- URB_FUNCTION_BULK_OR_INTERRUPT_TRANSFER:
  PipeHandle           = 88a1f20c [endpoint 0x00000002]
  TransferFlags        = 00000002 (USBD_TRANSFER_DIRECTION_OUT, USBD_SHORT_TRANSFER_OK)
  TransferBufferLength = 00000012
  TransferBuffer       = 00000000
  TransferBufferMDL    = 88e151f0
  UrbLink              = 00000000
[137744 ms] UsbSnoop - FilterDispatchAny(b792dfd2) : IRP_MJ_INTERNAL_DEVICE_CONTROL
[137744 ms] UsbSnoop - FdoHookDispatchInternalIoctl(b792e1ea) : fdo=88acdde8, Irp=88aaae70, IRQL=0
[137744 ms]  >>>  URB 98 going down  >>> 
-- URB_FUNCTION_BULK_OR_INTERRUPT_TRANSFER:
  PipeHandle           = 88a1f20c [endpoint 0x00000002]
  TransferFlags        = 00000002 (USBD_TRANSFER_DIRECTION_OUT, USBD_SHORT_TRANSFER_OK)
  TransferBufferLength = 00000011
  TransferBuffer       = 00000000
  TransferBufferMDL    = 88e151f0
    00000000: 54 fd 64 00 80 07 64 01 40 20 03 00 01 00 19 1e
    00000010: 03
  UrbLink              = 00000000
[137746 ms] UsbSnoop - MyInternalIOCTLCompletion(b792e126) : fido=889da5b8, Irp=88aaae70, Context=88ab1068, IRQL=2
[137746 ms]  <<<  URB 98 coming back  <<< 
-- URB_FUNCTION_BULK_OR_INTERRUPT_TRANSFER:
  PipeHandle           = 88a1f20c [endpoint 0x00000002]
  TransferFlags        = 00000002 (USBD_TRANSFER_DIRECTION_OUT, USBD_SHORT_TRANSFER_OK)
  TransferBufferLength = 00000011
  TransferBuffer       = 00000000
  TransferBufferMDL    = 88e151f0
  UrbLink              = 00000000
[137748 ms] UsbSnoop - MyInternalIOCTLCompletion(b792e126) : fido=889da5b8, Irp=88a93708, Context=89309548, IRQL=2
[137748 ms]  <<<  URB 96 coming back  <<< 
-- URB_FUNCTION_BULK_OR_INTERRUPT_TRANSFER:
  PipeHandle           = 88a1f1ec [endpoint 0x00000081]
  TransferFlags        = 00000003 (USBD_TRANSFER_DIRECTION_IN, USBD_SHORT_TRANSFER_OK)
  TransferBufferLength = 00000012
  TransferBuffer       = 00000000
  TransferBufferMDL    = 891a3be0
    00000000: 54 fd 64 01 00 ff 64 00 80 07 20 40 02 0a 19 25
    00000010: 40 20
  UrbLink              = 00000000
[137749 ms] UsbSnoop - FilterDispatchAny(b792dfd2) : IRP_MJ_INTERNAL_DEVICE_CONTROL
[137749 ms] UsbSnoop - FdoHookDispatchInternalIoctl(b792e1ea) : fdo=88acdde8, Irp=88a93708, IRQL=0
[137749 ms]  >>>  URB 99 going down  >>> 
-- URB_FUNCTION_BULK_OR_INTERRUPT_TRANSFER:
  PipeHandle           = 88a1f1ec [endpoint 0x00000081]
  TransferFlags        = 00000003 (USBD_TRANSFER_DIRECTION_IN, USBD_SHORT_TRANSFER_OK)
  TransferBufferLength = 00000200
  TransferBuffer       = 00000000
  TransferBufferMDL    = 891a3be0
  UrbLink              = 00000000
[137751 ms] UsbSnoop - MyInternalIOCTLCompletion(b792e126) : fido=889da5b8, Irp=88a93708, Context=89309548, IRQL=2
[137751 ms]  <<<  URB 99 coming back  <<< 
-- URB_FUNCTION_BULK_OR_INTERRUPT_TRANSFER:
  PipeHandle           = 88a1f1ec [endpoint 0x00000081]
  TransferFlags        = 00000003 (USBD_TRANSFER_DIRECTION_IN, USBD_SHORT_TRANSFER_OK)
  TransferBufferLength = 0000001b
  TransferBuffer       = 00000000
  TransferBufferMDL    = 891a3be0
    00000000: 54 fd 64 01 40 20 64 00 80 07 96 7f 0b 00 16 37
    00000010: 03 2e 74 6e 73 00 2e 74 6e 6f 00
  UrbLink              = 00000000
[137752 ms] UsbSnoop - FilterDispatchAny(b792dfd2) : IRP_MJ_INTERNAL_DEVICE_CONTROL
[137752 ms] UsbSnoop - FdoHookDispatchInternalIoctl(b792e1ea) : fdo=88acdde8, Irp=88a93708, IRQL=0
[137752 ms]  >>>  URB 100 going down  >>> 
-- URB_FUNCTION_BULK_OR_INTERRUPT_TRANSFER:
  PipeHandle           = 88a1f1ec [endpoint 0x00000081]
  TransferFlags        = 00000003 (USBD_TRANSFER_DIRECTION_IN, USBD_SHORT_TRANSFER_OK)
  TransferBufferLength = 00000200
  TransferBuffer       = 00000000
  TransferBufferMDL    = 891a3be0
  UrbLink              = 00000000
[137752 ms] UsbSnoop - FilterDispatchAny(b792dfd2) : IRP_MJ_INTERNAL_DEVICE_CONTROL
[137752 ms] UsbSnoop - FdoHookDispatchInternalIoctl(b792e1ea) : fdo=88acdde8, Irp=88aaae70, IRQL=0
[137752 ms]  >>>  URB 101 going down  >>> 
-- URB_FUNCTION_BULK_OR_INTERRUPT_TRANSFER:
  PipeHandle           = 88a1f20c [endpoint 0x00000002]
  TransferFlags        = 00000002 (USBD_TRANSFER_DIRECTION_OUT, USBD_SHORT_TRANSFER_OK)
  TransferBufferLength = 00000012
  TransferBuffer       = 00000000
  TransferBufferMDL    = 88e151f0
    00000000: 54 fd 64 00 00 ff 64 01 40 20 07 80 02 0a 16 22
    00000010: 80 07
  UrbLink              = 00000000
[137752 ms] UsbSnoop - MyInternalIOCTLCompletion(b792e126) : fido=889da5b8, Irp=88aaae70, Context=88ab1068, IRQL=2
[137752 ms]  <<<  URB 101 coming back  <<< 
-- URB_FUNCTION_BULK_OR_INTERRUPT_TRANSFER:
  PipeHandle           = 88a1f20c [endpoint 0x00000002]
  TransferFlags        = 00000002 (USBD_TRANSFER_DIRECTION_OUT, USBD_SHORT_TRANSFER_OK)
  TransferBufferLength = 00000012
  TransferBuffer       = 00000000
  TransferBufferMDL    = 88e151f0
  UrbLink              = 00000000
[137752 ms] UsbSnoop - FilterDispatchAny(b792dfd2) : IRP_MJ_INTERNAL_DEVICE_CONTROL
[137752 ms] UsbSnoop - FdoHookDispatchInternalIoctl(b792e1ea) : fdo=88acdde8, Irp=88aaae70, IRQL=0
[137752 ms]  >>>  URB 102 going down  >>> 
-- URB_FUNCTION_BULK_OR_INTERRUPT_TRANSFER:
  PipeHandle           = 88a1f20c [endpoint 0x00000002]
  TransferFlags        = 00000002 (USBD_TRANSFER_DIRECTION_OUT, USBD_SHORT_TRANSFER_OK)
  TransferBufferLength = 00000012
  TransferBuffer       = 00000000
  TransferBufferMDL    = 88e151f0
    00000000: 54 fd 64 00 40 de 64 01 40 20 07 80 02 00 1a 3b
    00000010: 80 07
  UrbLink              = 00000000
[137754 ms] UsbSnoop - MyInternalIOCTLCompletion(b792e126) : fido=889da5b8, Irp=88aaae70, Context=88ab1068, IRQL=2
[137754 ms]  <<<  URB 102 coming back  <<< 
-- URB_FUNCTION_BULK_OR_INTERRUPT_TRANSFER:
  PipeHandle           = 88a1f20c [endpoint 0x00000002]
  TransferFlags        = 00000002 (USBD_TRANSFER_DIRECTION_OUT, USBD_SHORT_TRANSFER_OK)
  TransferBufferLength = 00000012
  TransferBuffer       = 00000000
  TransferBufferMDL    = 88e151f0
  UrbLink              = 00000000
[137757 ms] UsbSnoop - MyInternalIOCTLCompletion(b792e126) : fido=889da5b8, Irp=88a93708, Context=89309548, IRQL=2
[137757 ms]  <<<  URB 100 coming back  <<< 
-- URB_FUNCTION_BULK_OR_INTERRUPT_TRANSFER:
  PipeHandle           = 88a1f1ec [endpoint 0x00000081]
  TransferFlags        = 00000003 (USBD_TRANSFER_DIRECTION_IN, USBD_SHORT_TRANSFER_OK)
  TransferBufferLength = 00000012
  TransferBuffer       = 00000000
  TransferBufferMDL    = 891a3be0
    00000000: 54 fd 64 01 00 ff 64 00 80 07 20 40 02 0a 1a 26
    00000010: 40 20
  UrbLink              = 00000000
[137757 ms] UsbSnoop - FilterDispatchAny(b792dfd2) : IRP_MJ_INTERNAL_DEVICE_CONTROL
[137757 ms] UsbSnoop - FdoHookDispatchInternalIoctl(b792e1ea) : fdo=88acdde8, Irp=88a93708, IRQL=0
[137757 ms]  >>>  URB 103 going down  >>> 
-- URB_FUNCTION_BULK_OR_INTERRUPT_TRANSFER:
  PipeHandle           = 88a1f1ec [endpoint 0x00000081]
  TransferFlags        = 00000003 (USBD_TRANSFER_DIRECTION_IN, USBD_SHORT_TRANSFER_OK)
  TransferBufferLength = 00000200
  TransferBuffer       = 00000000
  TransferBufferMDL    = 891a3be0
  UrbLink              = 00000000
[148436 ms] UsbSnoop - MyInternalIOCTLCompletion(b792e126) : fido=889da5b8, Irp=88a93708, Context=89309548, IRQL=2
[148436 ms]  <<<  URB 103 coming back  <<< 
-- URB_FUNCTION_BULK_OR_INTERRUPT_TRANSFER:
  PipeHandle           = 88a1f1ec [endpoint 0x00000081]
  TransferFlags        = 00000003 (USBD_TRANSFER_DIRECTION_IN, USBD_SHORT_TRANSFER_OK)
  TransferBufferLength = 00000000
  TransferBuffer       = 00000000
  TransferBufferMDL    = 891a3be0
  UrbLink              = 00000000
