[480928 ms] UsbSnoop - FilterDispatchAny(b9c8efd2) : IRP_MJ_INTERNAL_DEVICE_CONTROL
[480928 ms] UsbSnoop - FdoHookDispatchInternalIoctl(b9c8f1ea) : fdo=858af400, Irp=85a65ae8, IRQL=0
[480928 ms]  >>>  URB 5 going down  >>> 
-- URB_FUNCTION_VENDOR_DEVICE:
  TransferFlags          = 00000002 (USBD_TRANSFER_DIRECTION_OUT, USBD_SHORT_TRANSFER_OK)
  TransferBufferLength = 00000000
  TransferBuffer       = 00000000
  TransferBufferMDL    = 00000000

    no data supplied
  UrbLink                 = 00000000
  RequestTypeReservedBits = 00000000
  Request                 = 000000bb
  Value                   = 00000000
  Index                   = 00000000
[480929 ms] UsbSnoop - MyInternalIOCTLCompletion(b9c8f126) : fido=86aef2a0, Irp=85a65ae8, Context=85d29868, IRQL=2
[480929 ms]  <<<  URB 5 coming back  <<< 
-- URB_FUNCTION_CONTROL_TRANSFER:
  PipeHandle           = 85953c20
  TransferFlags        = 0000000a (USBD_TRANSFER_DIRECTION_OUT, USBD_SHORT_TRANSFER_OK)
  TransferBufferLength = 00000000
  TransferBuffer       = 00000000
  TransferBufferMDL    = 00000000
  UrbLink              = 00000000
  SetupPacket          =
    00000000: 40 bb 00 00 00 00 00 00
[480929 ms] UsbSnoop - FilterDispatchAny(b9c8efd2) : IRP_MJ_INTERNAL_DEVICE_CONTROL
[480929 ms] UsbSnoop - FdoHookDispatchInternalIoctl(b9c8f1ea) : fdo=858af400, Irp=858c3008, IRQL=0
[480929 ms] UsbSnoop - FilterDispatchAny(b9c8efd2) : IRP_MJ_INTERNAL_DEVICE_CONTROL
[480929 ms] UsbSnoop - FdoHookDispatchInternalIoctl(b9c8f1ea) : fdo=858af400, Irp=858c3008, IRQL=0
[481092 ms] UsbSnoop - FilterDispatchAny(b9c8efd2) : IRP_MJ_INTERNAL_DEVICE_CONTROL
[481092 ms] UsbSnoop - FdoHookDispatchInternalIoctl(b9c8f1ea) : fdo=858af400, Irp=85a65ae8, IRQL=0
[481092 ms]  >>>  URB 6 going down  >>> 
-- URB_FUNCTION_BULK_OR_INTERRUPT_TRANSFER:
  PipeHandle           = 869bbb5c [endpoint 0x00000081]
  TransferFlags        = 00000003 (USBD_TRANSFER_DIRECTION_IN, USBD_SHORT_TRANSFER_OK)
  TransferBufferLength = 00000200
  TransferBuffer       = 00000000
  TransferBufferMDL    = 86888360
  UrbLink              = 00000000
[481117 ms] UsbSnoop - MyInternalIOCTLCompletion(b9c8f126) : fido=86aef2a0, Irp=85a65ae8, Context=85d29868, IRQL=2
[481117 ms]  <<<  URB 6 coming back  <<< 
-- URB_FUNCTION_BULK_OR_INTERRUPT_TRANSFER:
  PipeHandle           = 869bbb5c [endpoint 0x00000081]
  TransferFlags        = 00000003 (USBD_TRANSFER_DIRECTION_IN, USBD_SHORT_TRANSFER_OK)
  TransferBufferLength = 00000010
  TransferBuffer       = 00000000
  TransferBufferMDL    = 86888360
    00000000: 54 fd 00 00 40 03 00 00 40 03 00 00 00 00 01 d8
  UrbLink              = 00000000
[481117 ms] UsbSnoop - FilterDispatchAny(b9c8efd2) : IRP_MJ_INTERNAL_DEVICE_CONTROL
[481117 ms] UsbSnoop - FdoHookDispatchInternalIoctl(b9c8f1ea) : fdo=858af400, Irp=85a65ae8, IRQL=0
[481117 ms]  >>>  URB 7 going down  >>> 
-- URB_FUNCTION_BULK_OR_INTERRUPT_TRANSFER:
  PipeHandle           = 869bbb5c [endpoint 0x00000081]
  TransferFlags        = 00000003 (USBD_TRANSFER_DIRECTION_IN, USBD_SHORT_TRANSFER_OK)
  TransferBufferLength = 00000200
  TransferBuffer       = 00000000
  TransferBufferMDL    = 859a79a0
  UrbLink              = 00000000
[481118 ms] UsbSnoop - FilterDispatchAny(b9c8efd2) : IRP_MJ_INTERNAL_DEVICE_CONTROL
[481118 ms] UsbSnoop - FdoHookDispatchInternalIoctl(b9c8f1ea) : fdo=858af400, Irp=858a3008, IRQL=0
[481118 ms]  >>>  URB 8 going down  >>> 
-- URB_FUNCTION_BULK_OR_INTERRUPT_TRANSFER:
  PipeHandle           = 869bbb7c [endpoint 0x00000002]
  TransferFlags        = 00000002 (USBD_TRANSFER_DIRECTION_OUT, USBD_SHORT_TRANSFER_OK)
  TransferBufferLength = 00000014
  TransferBuffer       = 00000000
  TransferBufferMDL    = 85c23820
    00000000: 54 fd 64 00 40 03 64 01 40 03 13 43 04 00 01 fb
    00000010: 64 01 ff 00
  UrbLink              = 00000000
[481118 ms] UsbSnoop - MyInternalIOCTLCompletion(b9c8f126) : fido=86aef2a0, Irp=858a3008, Context=858bc360, IRQL=2
[481118 ms]  <<<  URB 8 coming back  <<< 
-- URB_FUNCTION_BULK_OR_INTERRUPT_TRANSFER:
  PipeHandle           = 869bbb7c [endpoint 0x00000002]
  TransferFlags        = 00000002 (USBD_TRANSFER_DIRECTION_OUT, USBD_SHORT_TRANSFER_OK)
  TransferBufferLength = 00000014
  TransferBuffer       = 00000000
  TransferBufferMDL    = 85c23820
  UrbLink              = 00000000
[488611 ms] UsbSnoop - FilterDispatchAny(b9c8efd2) : IRP_MJ_INTERNAL_DEVICE_CONTROL
[488611 ms] UsbSnoop - FdoHookDispatchInternalIoctl(b9c8f1ea) : fdo=858af400, Irp=858ac4f8, IRQL=0
[488611 ms]  >>>  URB 9 going down  >>> 
-- URB_FUNCTION_BULK_OR_INTERRUPT_TRANSFER:
  PipeHandle           = 869bbb7c [endpoint 0x00000002]
  TransferFlags        = 00000002 (USBD_TRANSFER_DIRECTION_OUT, USBD_SHORT_TRANSFER_OK)
  TransferBufferLength = 00000011
  TransferBuffer       = 00000000
  TransferBufferMDL    = 858a5820
    00000000: 54 fd 64 00 80 02 64 01 40 20 01 00 01 00 01 ff
    00000010: 01
  UrbLink              = 00000000
[488611 ms] UsbSnoop - MyInternalIOCTLCompletion(b9c8f126) : fido=86aef2a0, Irp=858ac4f8, Context=858bc360, IRQL=2
[488611 ms]  <<<  URB 9 coming back  <<< 
-- URB_FUNCTION_BULK_OR_INTERRUPT_TRANSFER:
  PipeHandle           = 869bbb7c [endpoint 0x00000002]
  TransferFlags        = 00000002 (USBD_TRANSFER_DIRECTION_OUT, USBD_SHORT_TRANSFER_OK)
  TransferBufferLength = 00000011
  TransferBuffer       = 00000000
  TransferBufferMDL    = 858a5820
  UrbLink              = 00000000
[488612 ms] UsbSnoop - MyInternalIOCTLCompletion(b9c8f126) : fido=86aef2a0, Irp=85a65ae8, Context=85d29868, IRQL=2
[488612 ms]  <<<  URB 7 coming back  <<< 
-- URB_FUNCTION_BULK_OR_INTERRUPT_TRANSFER:
  PipeHandle           = 869bbb5c [endpoint 0x00000081]
  TransferFlags        = 00000003 (USBD_TRANSFER_DIRECTION_IN, USBD_SHORT_TRANSFER_OK)
  TransferBufferLength = 00000012
  TransferBuffer       = 00000000
  TransferBufferMDL    = 859a79a0
    00000000: 54 fd 64 01 00 ff 64 00 80 02 20 40 02 0a 01 08
    00000010: 40 20
  UrbLink              = 00000000
[488612 ms] UsbSnoop - FilterDispatchAny(b9c8efd2) : IRP_MJ_INTERNAL_DEVICE_CONTROL
[488612 ms] UsbSnoop - FdoHookDispatchInternalIoctl(b9c8f1ea) : fdo=858af400, Irp=85a65ae8, IRQL=0
[488612 ms]  >>>  URB 10 going down  >>> 
-- URB_FUNCTION_BULK_OR_INTERRUPT_TRANSFER:
  PipeHandle           = 869bbb5c [endpoint 0x00000081]
  TransferFlags        = 00000003 (USBD_TRANSFER_DIRECTION_IN, USBD_SHORT_TRANSFER_OK)
  TransferBufferLength = 00000200
  TransferBuffer       = 00000000
  TransferBufferMDL    = 85b66f88
  UrbLink              = 00000000
[488625 ms] UsbSnoop - MyInternalIOCTLCompletion(b9c8f126) : fido=86aef2a0, Irp=85a65ae8, Context=85d29868, IRQL=2
[488625 ms]  <<<  URB 10 coming back  <<< 
-- URB_FUNCTION_BULK_OR_INTERRUPT_TRANSFER:
  PipeHandle           = 869bbb5c [endpoint 0x00000081]
  TransferFlags        = 00000003 (USBD_TRANSFER_DIRECTION_IN, USBD_SHORT_TRANSFER_OK)
  TransferBufferLength = 0000007f
  TransferBuffer       = 00000000
  TransferBufferMDL    = 85b66f88
    00000000: 54 fd 64 01 40 20 64 00 80 02 ec 91 6f 00 01 e9
    00000010: 01 00 00 00 00 01 65 8c 00 00 00 00 00 01 be 00
    00000020: 00 00 00 00 00 01 5b 16 c4 00 00 00 00 01 83 5f
    00000030: 2c 7f 00 00 5a 01 01 24 25 01 01 22 d4 01 01 23
    00000040: 15 00 00 00 00 00 02 00 00 00 00 01 40 00 f0 04
    00000050: 00 1e 30 30 30 30 34 42 43 31 42 31 30 45 35 37
    00000060: 30 46 00 30 45 30 30 30 30 30 34 42 43 31 42 31
    00000070: 30 45 35 37 30 46 43 42 32 38 30 34 46 31 00
  UrbLink              = 00000000
[488626 ms] UsbSnoop - FilterDispatchAny(b9c8efd2) : IRP_MJ_INTERNAL_DEVICE_CONTROL
[488626 ms] UsbSnoop - FdoHookDispatchInternalIoctl(b9c8f1ea) : fdo=858af400, Irp=85a65ae8, IRQL=0
[488626 ms]  >>>  URB 11 going down  >>> 
-- URB_FUNCTION_BULK_OR_INTERRUPT_TRANSFER:
  PipeHandle           = 869bbb5c [endpoint 0x00000081]
  TransferFlags        = 00000003 (USBD_TRANSFER_DIRECTION_IN, USBD_SHORT_TRANSFER_OK)
  TransferBufferLength = 00000200
  TransferBuffer       = 00000000
  TransferBufferMDL    = 868b6170
  UrbLink              = 00000000
[488626 ms] UsbSnoop - FilterDispatchAny(b9c8efd2) : IRP_MJ_INTERNAL_DEVICE_CONTROL
[488626 ms] UsbSnoop - FdoHookDispatchInternalIoctl(b9c8f1ea) : fdo=858af400, Irp=858ac4f8, IRQL=0
[488626 ms]  >>>  URB 12 going down  >>> 
-- URB_FUNCTION_BULK_OR_INTERRUPT_TRANSFER:
  PipeHandle           = 869bbb7c [endpoint 0x00000002]
  TransferFlags        = 00000002 (USBD_TRANSFER_DIRECTION_OUT, USBD_SHORT_TRANSFER_OK)
  TransferBufferLength = 00000012
  TransferBuffer       = 00000000
  TransferBufferMDL    = 86a82488
    00000000: 54 fd 64 00 00 ff 64 01 40 20 02 80 02 0a 01 08
    00000010: 80 02
  UrbLink              = 00000000
[488626 ms] UsbSnoop - MyInternalIOCTLCompletion(b9c8f126) : fido=86aef2a0, Irp=858ac4f8, Context=858bc360, IRQL=2
[488626 ms]  <<<  URB 12 coming back  <<< 
-- URB_FUNCTION_BULK_OR_INTERRUPT_TRANSFER:
  PipeHandle           = 869bbb7c [endpoint 0x00000002]
  TransferFlags        = 00000002 (USBD_TRANSFER_DIRECTION_OUT, USBD_SHORT_TRANSFER_OK)
  TransferBufferLength = 00000012
  TransferBuffer       = 00000000
  TransferBufferMDL    = 86a82488
  UrbLink              = 00000000
[488627 ms] UsbSnoop - FilterDispatchAny(b9c8efd2) : IRP_MJ_INTERNAL_DEVICE_CONTROL
[488627 ms] UsbSnoop - FdoHookDispatchInternalIoctl(b9c8f1ea) : fdo=858af400, Irp=858ac4f8, IRQL=0
[488627 ms]  >>>  URB 13 going down  >>> 
-- URB_FUNCTION_BULK_OR_INTERRUPT_TRANSFER:
  PipeHandle           = 869bbb7c [endpoint 0x00000002]
  TransferFlags        = 00000002 (USBD_TRANSFER_DIRECTION_OUT, USBD_SHORT_TRANSFER_OK)
  TransferBufferLength = 00000011
  TransferBuffer       = 00000000
  TransferBufferMDL    = 85b66f88
    00000000: 54 fd 64 00 80 02 64 01 40 20 02 00 01 00 02 01
    00000010: 02
  UrbLink              = 00000000
[488628 ms] UsbSnoop - MyInternalIOCTLCompletion(b9c8f126) : fido=86aef2a0, Irp=858ac4f8, Context=858bc360, IRQL=2
[488628 ms]  <<<  URB 13 coming back  <<< 
-- URB_FUNCTION_BULK_OR_INTERRUPT_TRANSFER:
  PipeHandle           = 869bbb7c [endpoint 0x00000002]
  TransferFlags        = 00000002 (USBD_TRANSFER_DIRECTION_OUT, USBD_SHORT_TRANSFER_OK)
  TransferBufferLength = 00000011
  TransferBuffer       = 00000000
  TransferBufferMDL    = 85b66f88
  UrbLink              = 00000000
[488629 ms] UsbSnoop - MyInternalIOCTLCompletion(b9c8f126) : fido=86aef2a0, Irp=85a65ae8, Context=85d29868, IRQL=2
[488629 ms]  <<<  URB 11 coming back  <<< 
-- URB_FUNCTION_BULK_OR_INTERRUPT_TRANSFER:
  PipeHandle           = 869bbb5c [endpoint 0x00000081]
  TransferFlags        = 00000003 (USBD_TRANSFER_DIRECTION_IN, USBD_SHORT_TRANSFER_OK)
  TransferBufferLength = 00000012
  TransferBuffer       = 00000000
  TransferBufferMDL    = 868b6170
    00000000: 54 fd 64 01 00 ff 64 00 80 02 20 40 02 0a 02 09
    00000010: 40 20
  UrbLink              = 00000000
[488630 ms] UsbSnoop - FilterDispatchAny(b9c8efd2) : IRP_MJ_INTERNAL_DEVICE_CONTROL
[488630 ms] UsbSnoop - FdoHookDispatchInternalIoctl(b9c8f1ea) : fdo=858af400, Irp=858a3008, IRQL=0
[488630 ms]  >>>  URB 14 going down  >>> 
-- URB_FUNCTION_BULK_OR_INTERRUPT_TRANSFER:
  PipeHandle           = 869bbb5c [endpoint 0x00000081]
  TransferFlags        = 00000003 (USBD_TRANSFER_DIRECTION_IN, USBD_SHORT_TRANSFER_OK)
  TransferBufferLength = 00000200
  TransferBuffer       = 00000000
  TransferBufferMDL    = 85b66f88
  UrbLink              = 00000000
[488633 ms] UsbSnoop - MyInternalIOCTLCompletion(b9c8f126) : fido=86aef2a0, Irp=858a3008, Context=85d29868, IRQL=2
[488633 ms]  <<<  URB 14 coming back  <<< 
-- URB_FUNCTION_BULK_OR_INTERRUPT_TRANSFER:
  PipeHandle           = 869bbb5c [endpoint 0x00000081]
  TransferFlags        = 00000003 (USBD_TRANSFER_DIRECTION_IN, USBD_SHORT_TRANSFER_OK)
  TransferBufferLength = 0000001b
  TransferBuffer       = 00000000
  TransferBufferMDL    = 85b66f88
    00000000: 54 fd 64 01 40 20 64 00 80 02 38 5a 0b 00 02 9b
    00000010: 02 54 49 2d 4e 73 70 69 72 65 00
  UrbLink              = 00000000
[488633 ms] UsbSnoop - FilterDispatchAny(b9c8efd2) : IRP_MJ_INTERNAL_DEVICE_CONTROL
[488633 ms] UsbSnoop - FdoHookDispatchInternalIoctl(b9c8f1ea) : fdo=858af400, Irp=858a3008, IRQL=0
[488634 ms]  >>>  URB 15 going down  >>> 
-- URB_FUNCTION_BULK_OR_INTERRUPT_TRANSFER:
  PipeHandle           = 869bbb5c [endpoint 0x00000081]
  TransferFlags        = 00000003 (USBD_TRANSFER_DIRECTION_IN, USBD_SHORT_TRANSFER_OK)
  TransferBufferLength = 00000200
  TransferBuffer       = 00000000
  TransferBufferMDL    = 86a82488
  UrbLink              = 00000000
[488634 ms] UsbSnoop - FilterDispatchAny(b9c8efd2) : IRP_MJ_INTERNAL_DEVICE_CONTROL
[488634 ms] UsbSnoop - FdoHookDispatchInternalIoctl(b9c8f1ea) : fdo=858af400, Irp=85a65ae8, IRQL=0
[488634 ms]  >>>  URB 16 going down  >>> 
-- URB_FUNCTION_BULK_OR_INTERRUPT_TRANSFER:
  PipeHandle           = 869bbb7c [endpoint 0x00000002]
  TransferFlags        = 00000002 (USBD_TRANSFER_DIRECTION_OUT, USBD_SHORT_TRANSFER_OK)
  TransferBufferLength = 00000012
  TransferBuffer       = 00000000
  TransferBufferMDL    = 858eb5c0
    00000000: 54 fd 64 00 00 ff 64 01 40 20 02 80 02 0a 02 09
    00000010: 80 02
  UrbLink              = 00000000
[488635 ms] UsbSnoop - MyInternalIOCTLCompletion(b9c8f126) : fido=86aef2a0, Irp=85a65ae8, Context=858bc360, IRQL=2
[488635 ms]  <<<  URB 16 coming back  <<< 
-- URB_FUNCTION_BULK_OR_INTERRUPT_TRANSFER:
  PipeHandle           = 869bbb7c [endpoint 0x00000002]
  TransferFlags        = 00000002 (USBD_TRANSFER_DIRECTION_OUT, USBD_SHORT_TRANSFER_OK)
  TransferBufferLength = 00000012
  TransferBuffer       = 00000000
  TransferBufferMDL    = 858eb5c0
  UrbLink              = 00000000
[488636 ms] UsbSnoop - FilterDispatchAny(b9c8efd2) : IRP_MJ_INTERNAL_DEVICE_CONTROL
[488636 ms] UsbSnoop - FdoHookDispatchInternalIoctl(b9c8f1ea) : fdo=858af400, Irp=85a65ae8, IRQL=0
[488636 ms]  >>>  URB 17 going down  >>> 
-- URB_FUNCTION_BULK_OR_INTERRUPT_TRANSFER:
  PipeHandle           = 869bbb7c [endpoint 0x00000002]
  TransferFlags        = 00000002 (USBD_TRANSFER_DIRECTION_OUT, USBD_SHORT_TRANSFER_OK)
  TransferBufferLength = 00000011
  TransferBuffer       = 00000000
  TransferBufferMDL    = 85b66f88
    00000000: 54 fd 64 00 80 02 64 01 40 20 03 00 01 00 03 03
    00000010: 03
  UrbLink              = 00000000
[488637 ms] UsbSnoop - MyInternalIOCTLCompletion(b9c8f126) : fido=86aef2a0, Irp=85a65ae8, Context=858bc360, IRQL=2
[488637 ms]  <<<  URB 17 coming back  <<< 
-- URB_FUNCTION_BULK_OR_INTERRUPT_TRANSFER:
  PipeHandle           = 869bbb7c [endpoint 0x00000002]
  TransferFlags        = 00000002 (USBD_TRANSFER_DIRECTION_OUT, USBD_SHORT_TRANSFER_OK)
  TransferBufferLength = 00000011
  TransferBuffer       = 00000000
  TransferBufferMDL    = 85b66f88
  UrbLink              = 00000000
[488638 ms] UsbSnoop - MyInternalIOCTLCompletion(b9c8f126) : fido=86aef2a0, Irp=858a3008, Context=85d29868, IRQL=2
[488638 ms]  <<<  URB 15 coming back  <<< 
-- URB_FUNCTION_BULK_OR_INTERRUPT_TRANSFER:
  PipeHandle           = 869bbb5c [endpoint 0x00000081]
  TransferFlags        = 00000003 (USBD_TRANSFER_DIRECTION_IN, USBD_SHORT_TRANSFER_OK)
  TransferBufferLength = 00000012
  TransferBuffer       = 00000000
  TransferBufferMDL    = 86a82488
    00000000: 54 fd 64 01 00 ff 64 00 80 02 20 40 02 0a 03 0a
    00000010: 40 20
  UrbLink              = 00000000
[488639 ms] UsbSnoop - FilterDispatchAny(b9c8efd2) : IRP_MJ_INTERNAL_DEVICE_CONTROL
[488639 ms] UsbSnoop - FdoHookDispatchInternalIoctl(b9c8f1ea) : fdo=858af400, Irp=858a3008, IRQL=0
[488639 ms]  >>>  URB 18 going down  >>> 
-- URB_FUNCTION_BULK_OR_INTERRUPT_TRANSFER:
  PipeHandle           = 869bbb5c [endpoint 0x00000081]
  TransferFlags        = 00000003 (USBD_TRANSFER_DIRECTION_IN, USBD_SHORT_TRANSFER_OK)
  TransferBufferLength = 00000200
  TransferBuffer       = 00000000
  TransferBufferMDL    = 85917618
  UrbLink              = 00000000
[488641 ms] UsbSnoop - MyInternalIOCTLCompletion(b9c8f126) : fido=86aef2a0, Irp=858a3008, Context=85d29868, IRQL=2
[488641 ms]  <<<  URB 18 coming back  <<< 
-- URB_FUNCTION_BULK_OR_INTERRUPT_TRANSFER:
  PipeHandle           = 869bbb5c [endpoint 0x00000081]
  TransferFlags        = 00000003 (USBD_TRANSFER_DIRECTION_IN, USBD_SHORT_TRANSFER_OK)
  TransferBufferLength = 0000001b
  TransferBuffer       = 00000000
  TransferBufferMDL    = 85917618
    00000000: 54 fd 64 01 40 20 64 00 80 02 96 7f 0b 00 03 1f
    00000010: 03 2e 74 6e 73 00 2e 74 6e 6f 00
  UrbLink              = 00000000
[488642 ms] UsbSnoop - FilterDispatchAny(b9c8efd2) : IRP_MJ_INTERNAL_DEVICE_CONTROL
[488642 ms] UsbSnoop - FdoHookDispatchInternalIoctl(b9c8f1ea) : fdo=858af400, Irp=858a3008, IRQL=0
[488642 ms]  >>>  URB 19 going down  >>> 
-- URB_FUNCTION_BULK_OR_INTERRUPT_TRANSFER:
  PipeHandle           = 869bbb5c [endpoint 0x00000081]
  TransferFlags        = 00000003 (USBD_TRANSFER_DIRECTION_IN, USBD_SHORT_TRANSFER_OK)
  TransferBufferLength = 00000200
  TransferBuffer       = 00000000
  TransferBufferMDL    = 85b6ae78
  UrbLink              = 00000000
[488642 ms] UsbSnoop - FilterDispatchAny(b9c8efd2) : IRP_MJ_INTERNAL_DEVICE_CONTROL
[488642 ms] UsbSnoop - FdoHookDispatchInternalIoctl(b9c8f1ea) : fdo=858af400, Irp=858ac4f8, IRQL=0
[488642 ms]  >>>  URB 20 going down  >>> 
-- URB_FUNCTION_BULK_OR_INTERRUPT_TRANSFER:
  PipeHandle           = 869bbb7c [endpoint 0x00000002]
  TransferFlags        = 00000002 (USBD_TRANSFER_DIRECTION_OUT, USBD_SHORT_TRANSFER_OK)
  TransferBufferLength = 00000012
  TransferBuffer       = 00000000
  TransferBufferMDL    = 859a79a0
    00000000: 54 fd 64 00 00 ff 64 01 40 20 02 80 02 0a 03 0a
    00000010: 80 02
  UrbLink              = 00000000
[488642 ms] UsbSnoop - MyInternalIOCTLCompletion(b9c8f126) : fido=86aef2a0, Irp=858ac4f8, Context=858bc360, IRQL=2
[488642 ms]  <<<  URB 20 coming back  <<< 
-- URB_FUNCTION_BULK_OR_INTERRUPT_TRANSFER:
  PipeHandle           = 869bbb7c [endpoint 0x00000002]
  TransferFlags        = 00000002 (USBD_TRANSFER_DIRECTION_OUT, USBD_SHORT_TRANSFER_OK)
  TransferBufferLength = 00000012
  TransferBuffer       = 00000000
  TransferBufferMDL    = 859a79a0
  UrbLink              = 00000000
[488643 ms] UsbSnoop - FilterDispatchAny(b9c8efd2) : IRP_MJ_INTERNAL_DEVICE_CONTROL
[488643 ms] UsbSnoop - FdoHookDispatchInternalIoctl(b9c8f1ea) : fdo=858af400, Irp=858ac4f8, IRQL=0
[488643 ms]  >>>  URB 21 going down  >>> 
-- URB_FUNCTION_BULK_OR_INTERRUPT_TRANSFER:
  PipeHandle           = 869bbb7c [endpoint 0x00000002]
  TransferFlags        = 00000002 (USBD_TRANSFER_DIRECTION_OUT, USBD_SHORT_TRANSFER_OK)
  TransferBufferLength = 00000012
  TransferBuffer       = 00000000
  TransferBufferMDL    = 858a5820
    00000000: 54 fd 64 00 40 de 64 01 40 20 02 80 02 00 04 20
    00000010: 80 02
  UrbLink              = 00000000
[488644 ms] UsbSnoop - MyInternalIOCTLCompletion(b9c8f126) : fido=86aef2a0, Irp=858ac4f8, Context=858bc360, IRQL=2
[488644 ms]  <<<  URB 21 coming back  <<< 
-- URB_FUNCTION_BULK_OR_INTERRUPT_TRANSFER:
  PipeHandle           = 869bbb7c [endpoint 0x00000002]
  TransferFlags        = 00000002 (USBD_TRANSFER_DIRECTION_OUT, USBD_SHORT_TRANSFER_OK)
  TransferBufferLength = 00000012
  TransferBuffer       = 00000000
  TransferBufferMDL    = 858a5820
  UrbLink              = 00000000
[488645 ms] UsbSnoop - MyInternalIOCTLCompletion(b9c8f126) : fido=86aef2a0, Irp=858a3008, Context=85d29868, IRQL=2
[488645 ms]  <<<  URB 19 coming back  <<< 
-- URB_FUNCTION_BULK_OR_INTERRUPT_TRANSFER:
  PipeHandle           = 869bbb5c [endpoint 0x00000081]
  TransferFlags        = 00000003 (USBD_TRANSFER_DIRECTION_IN, USBD_SHORT_TRANSFER_OK)
  TransferBufferLength = 00000012
  TransferBuffer       = 00000000
  TransferBufferMDL    = 85b6ae78
    00000000: 54 fd 64 01 00 ff 64 00 80 02 20 40 02 0a 04 0b
    00000010: 40 20
  UrbLink              = 00000000
[488646 ms] UsbSnoop - FilterDispatchAny(b9c8efd2) : IRP_MJ_INTERNAL_DEVICE_CONTROL
[488646 ms] UsbSnoop - FdoHookDispatchInternalIoctl(b9c8f1ea) : fdo=858af400, Irp=858a3008, IRQL=0
[488646 ms]  >>>  URB 22 going down  >>> 
-- URB_FUNCTION_BULK_OR_INTERRUPT_TRANSFER:
  PipeHandle           = 869bbb5c [endpoint 0x00000081]
  TransferFlags        = 00000003 (USBD_TRANSFER_DIRECTION_IN, USBD_SHORT_TRANSFER_OK)
  TransferBufferLength = 00000200
  TransferBuffer       = 00000000
  TransferBufferMDL    = 86198850
  UrbLink              = 00000000
[491690 ms] UsbSnoop - FilterDispatchAny(b9c8efd2) : IRP_MJ_INTERNAL_DEVICE_CONTROL
[491690 ms] UsbSnoop - FdoHookDispatchInternalIoctl(b9c8f1ea) : fdo=858af400, Irp=858ac4f8, IRQL=0
[491690 ms]  >>>  URB 23 going down  >>> 
-- URB_FUNCTION_BULK_OR_INTERRUPT_TRANSFER:
  PipeHandle           = 869bbb7c [endpoint 0x00000002]
  TransferFlags        = 00000002 (USBD_TRANSFER_DIRECTION_OUT, USBD_SHORT_TRANSFER_OK)
  TransferBufferLength = 0000001b
  TransferBuffer       = 00000000
  TransferBufferMDL    = 858b9370
    00000000: 54 fd 64 00 80 03 64 01 40 60 0c f1 0b 00 05 4a
    00000010: 20 01 2f 00 00 00 00 00 00 00 00
  UrbLink              = 00000000
[491691 ms] UsbSnoop - MyInternalIOCTLCompletion(b9c8f126) : fido=86aef2a0, Irp=858ac4f8, Context=858bc360, IRQL=2
[491691 ms]  <<<  URB 23 coming back  <<< 
-- URB_FUNCTION_BULK_OR_INTERRUPT_TRANSFER:
  PipeHandle           = 869bbb7c [endpoint 0x00000002]
  TransferFlags        = 00000002 (USBD_TRANSFER_DIRECTION_OUT, USBD_SHORT_TRANSFER_OK)
  TransferBufferLength = 0000001b
  TransferBuffer       = 00000000
  TransferBufferMDL    = 858b9370
  UrbLink              = 00000000
[491692 ms] UsbSnoop - MyInternalIOCTLCompletion(b9c8f126) : fido=86aef2a0, Irp=858a3008, Context=85d29868, IRQL=2
[491692 ms]  <<<  URB 22 coming back  <<< 
-- URB_FUNCTION_BULK_OR_INTERRUPT_TRANSFER:
  PipeHandle           = 869bbb5c [endpoint 0x00000081]
  TransferFlags        = 00000003 (USBD_TRANSFER_DIRECTION_IN, USBD_SHORT_TRANSFER_OK)
  TransferBufferLength = 00000012
  TransferBuffer       = 00000000
  TransferBufferMDL    = 86198850
    00000000: 54 fd 64 01 00 ff 64 00 80 03 60 40 02 0a 05 4d
    00000010: 40 60
  UrbLink              = 00000000
[491692 ms] UsbSnoop - FilterDispatchAny(b9c8efd2) : IRP_MJ_INTERNAL_DEVICE_CONTROL
[491692 ms] UsbSnoop - FdoHookDispatchInternalIoctl(b9c8f1ea) : fdo=858af400, Irp=858a3008, IRQL=0
[491692 ms]  >>>  URB 24 going down  >>> 
-- URB_FUNCTION_BULK_OR_INTERRUPT_TRANSFER:
  PipeHandle           = 869bbb5c [endpoint 0x00000081]
  TransferFlags        = 00000003 (USBD_TRANSFER_DIRECTION_IN, USBD_SHORT_TRANSFER_OK)
  TransferBufferLength = 00000200
  TransferBuffer       = 00000000
  TransferBufferMDL    = 86198850
  UrbLink              = 00000000
[491707 ms] UsbSnoop - MyInternalIOCTLCompletion(b9c8f126) : fido=86aef2a0, Irp=858a3008, Context=85d29868, IRQL=2
[491707 ms]  <<<  URB 24 coming back  <<< 
-- URB_FUNCTION_BULK_OR_INTERRUPT_TRANSFER:
  PipeHandle           = 869bbb5c [endpoint 0x00000081]
  TransferFlags        = 00000003 (USBD_TRANSFER_DIRECTION_IN, USBD_SHORT_TRANSFER_OK)
  TransferBufferLength = 0000001b
  TransferBuffer       = 00000000
  TransferBufferMDL    = 86198850
    00000000: 54 fd 64 01 40 60 64 00 80 03 f7 38 0b 00 04 7b
    00000010: 20 00 00 00 00 00 00 00 00 01 00
  UrbLink              = 00000000
[491707 ms] UsbSnoop - FilterDispatchAny(b9c8efd2) : IRP_MJ_INTERNAL_DEVICE_CONTROL
[491707 ms] UsbSnoop - FdoHookDispatchInternalIoctl(b9c8f1ea) : fdo=858af400, Irp=858a3008, IRQL=0
[491707 ms]  >>>  URB 25 going down  >>> 
-- URB_FUNCTION_BULK_OR_INTERRUPT_TRANSFER:
  PipeHandle           = 869bbb5c [endpoint 0x00000081]
  TransferFlags        = 00000003 (USBD_TRANSFER_DIRECTION_IN, USBD_SHORT_TRANSFER_OK)
  TransferBufferLength = 00000200
  TransferBuffer       = 00000000
  TransferBufferMDL    = 86198850
  UrbLink              = 00000000
[491707 ms] UsbSnoop - FilterDispatchAny(b9c8efd2) : IRP_MJ_INTERNAL_DEVICE_CONTROL
[491707 ms] UsbSnoop - FdoHookDispatchInternalIoctl(b9c8f1ea) : fdo=858af400, Irp=85816e48, IRQL=0
[491707 ms]  >>>  URB 26 going down  >>> 
-- URB_FUNCTION_BULK_OR_INTERRUPT_TRANSFER:
  PipeHandle           = 869bbb7c [endpoint 0x00000002]
  TransferFlags        = 00000002 (USBD_TRANSFER_DIRECTION_OUT, USBD_SHORT_TRANSFER_OK)
  TransferBufferLength = 00000012
  TransferBuffer       = 00000000
  TransferBufferMDL    = 85b65ba0
    00000000: 54 fd 64 00 00 ff 64 01 40 60 03 80 02 0a 04 4c
    00000010: 80 03
  UrbLink              = 00000000
[491708 ms] UsbSnoop - MyInternalIOCTLCompletion(b9c8f126) : fido=86aef2a0, Irp=85816e48, Context=858bc360, IRQL=2
[491708 ms]  <<<  URB 26 coming back  <<< 
-- URB_FUNCTION_BULK_OR_INTERRUPT_TRANSFER:
  PipeHandle           = 869bbb7c [endpoint 0x00000002]
  TransferFlags        = 00000002 (USBD_TRANSFER_DIRECTION_OUT, USBD_SHORT_TRANSFER_OK)
  TransferBufferLength = 00000012
  TransferBuffer       = 00000000
  TransferBufferMDL    = 85b65ba0
  UrbLink              = 00000000
[491709 ms] UsbSnoop - FilterDispatchAny(b9c8efd2) : IRP_MJ_INTERNAL_DEVICE_CONTROL
[491709 ms] UsbSnoop - FdoHookDispatchInternalIoctl(b9c8f1ea) : fdo=858af400, Irp=86a5e1d8, IRQL=0
[491709 ms]  >>>  URB 27 going down  >>> 
-- URB_FUNCTION_BULK_OR_INTERRUPT_TRANSFER:
  PipeHandle           = 869bbb7c [endpoint 0x00000002]
  TransferFlags        = 00000002 (USBD_TRANSFER_DIRECTION_OUT, USBD_SHORT_TRANSFER_OK)
  TransferBufferLength = 00000012
  TransferBuffer       = 00000000
  TransferBufferMDL    = 85b66f88
    00000000: 54 fd 64 00 40 de 64 01 40 60 03 80 02 00 06 63
    00000010: 80 03
  UrbLink              = 00000000
[491710 ms] UsbSnoop - MyInternalIOCTLCompletion(b9c8f126) : fido=86aef2a0, Irp=86a5e1d8, Context=858bc360, IRQL=2
[491710 ms]  <<<  URB 27 coming back  <<< 
-- URB_FUNCTION_BULK_OR_INTERRUPT_TRANSFER:
  PipeHandle           = 869bbb7c [endpoint 0x00000002]
  TransferFlags        = 00000002 (USBD_TRANSFER_DIRECTION_OUT, USBD_SHORT_TRANSFER_OK)
  TransferBufferLength = 00000012
  TransferBuffer       = 00000000
  TransferBufferMDL    = 85b66f88
  UrbLink              = 00000000
[491711 ms] UsbSnoop - MyInternalIOCTLCompletion(b9c8f126) : fido=86aef2a0, Irp=858a3008, Context=85d29868, IRQL=2
[491711 ms]  <<<  URB 25 coming back  <<< 
-- URB_FUNCTION_BULK_OR_INTERRUPT_TRANSFER:
  PipeHandle           = 869bbb5c [endpoint 0x00000081]
  TransferFlags        = 00000003 (USBD_TRANSFER_DIRECTION_IN, USBD_SHORT_TRANSFER_OK)
  TransferBufferLength = 00000012
  TransferBuffer       = 00000000
  TransferBufferMDL    = 86198850
    00000000: 54 fd 64 01 00 ff 64 00 80 03 60 40 02 0a 06 4e
    00000010: 40 60
  UrbLink              = 00000000
[491711 ms] UsbSnoop - FilterDispatchAny(b9c8efd2) : IRP_MJ_INTERNAL_DEVICE_CONTROL
[491711 ms] UsbSnoop - FdoHookDispatchInternalIoctl(b9c8f1ea) : fdo=858af400, Irp=858a3008, IRQL=0
[491711 ms]  >>>  URB 28 going down  >>> 
-- URB_FUNCTION_BULK_OR_INTERRUPT_TRANSFER:
  PipeHandle           = 869bbb5c [endpoint 0x00000081]
  TransferFlags        = 00000003 (USBD_TRANSFER_DIRECTION_IN, USBD_SHORT_TRANSFER_OK)
  TransferBufferLength = 00000200
  TransferBuffer       = 00000000
  TransferBufferMDL    = 86198850
  UrbLink              = 00000000
[491714 ms] UsbSnoop - FilterDispatchAny(b9c8efd2) : IRP_MJ_INTERNAL_DEVICE_CONTROL
[491714 ms] UsbSnoop - FdoHookDispatchInternalIoctl(b9c8f1ea) : fdo=858af400, Irp=85930008, IRQL=0
[491714 ms]  >>>  URB 29 going down  >>> 
-- URB_FUNCTION_BULK_OR_INTERRUPT_TRANSFER:
  PipeHandle           = 869bbb7c [endpoint 0x00000002]
  TransferFlags        = 00000002 (USBD_TRANSFER_DIRECTION_OUT, USBD_SHORT_TRANSFER_OK)
  TransferBufferLength = 0000001a
  TransferBuffer       = 00000000
  TransferBufferMDL    = 86a82488
    00000000: 54 fd 64 00 80 04 64 01 40 60 c0 aa 0a 00 07 b9
    00000010: 0d 2f 00 00 00 00 00 00 00 00
  UrbLink              = 00000000
[491715 ms] UsbSnoop - MyInternalIOCTLCompletion(b9c8f126) : fido=86aef2a0, Irp=85930008, Context=858bc360, IRQL=2
[491715 ms]  <<<  URB 29 coming back  <<< 
-- URB_FUNCTION_BULK_OR_INTERRUPT_TRANSFER:
  PipeHandle           = 869bbb7c [endpoint 0x00000002]
  TransferFlags        = 00000002 (USBD_TRANSFER_DIRECTION_OUT, USBD_SHORT_TRANSFER_OK)
  TransferBufferLength = 0000001a
  TransferBuffer       = 00000000
  TransferBufferMDL    = 86a82488
  UrbLink              = 00000000
[491716 ms] UsbSnoop - MyInternalIOCTLCompletion(b9c8f126) : fido=86aef2a0, Irp=858a3008, Context=85d29868, IRQL=2
[491716 ms]  <<<  URB 28 coming back  <<< 
-- URB_FUNCTION_BULK_OR_INTERRUPT_TRANSFER:
  PipeHandle           = 869bbb5c [endpoint 0x00000081]
  TransferFlags        = 00000003 (USBD_TRANSFER_DIRECTION_IN, USBD_SHORT_TRANSFER_OK)
  TransferBufferLength = 00000012
  TransferBuffer       = 00000000
  TransferBufferMDL    = 86198850
    00000000: 54 fd 64 01 00 ff 64 00 80 04 60 40 02 0a 07 50
    00000010: 40 60
  UrbLink              = 00000000
[491716 ms] UsbSnoop - FilterDispatchAny(b9c8efd2) : IRP_MJ_INTERNAL_DEVICE_CONTROL
[491716 ms] UsbSnoop - FdoHookDispatchInternalIoctl(b9c8f1ea) : fdo=858af400, Irp=858a3008, IRQL=0
[491716 ms]  >>>  URB 30 going down  >>> 
-- URB_FUNCTION_BULK_OR_INTERRUPT_TRANSFER:
  PipeHandle           = 869bbb5c [endpoint 0x00000081]
  TransferFlags        = 00000003 (USBD_TRANSFER_DIRECTION_IN, USBD_SHORT_TRANSFER_OK)
  TransferBufferLength = 00000200
  TransferBuffer       = 00000000
  TransferBufferMDL    = 86198850
  UrbLink              = 00000000
[491734 ms] UsbSnoop - MyInternalIOCTLCompletion(b9c8f126) : fido=86aef2a0, Irp=858a3008, Context=85d29868, IRQL=2
[491734 ms]  <<<  URB 30 coming back  <<< 
-- URB_FUNCTION_BULK_OR_INTERRUPT_TRANSFER:
  PipeHandle           = 869bbb5c [endpoint 0x00000081]
  TransferFlags        = 00000003 (USBD_TRANSFER_DIRECTION_IN, USBD_SHORT_TRANSFER_OK)
  TransferBufferLength = 00000012
  TransferBuffer       = 00000000
  TransferBufferMDL    = 86198850
    00000000: 54 fd 64 01 40 60 64 00 80 04 00 ff 02 00 05 44
    00000010: ff 00
  UrbLink              = 00000000
[491734 ms] UsbSnoop - FilterDispatchAny(b9c8efd2) : IRP_MJ_INTERNAL_DEVICE_CONTROL
[491734 ms] UsbSnoop - FdoHookDispatchInternalIoctl(b9c8f1ea) : fdo=858af400, Irp=858a3008, IRQL=0
[491734 ms]  >>>  URB 31 going down  >>> 
-- URB_FUNCTION_BULK_OR_INTERRUPT_TRANSFER:
  PipeHandle           = 869bbb5c [endpoint 0x00000081]
  TransferFlags        = 00000003 (USBD_TRANSFER_DIRECTION_IN, USBD_SHORT_TRANSFER_OK)
  TransferBufferLength = 00000200
  TransferBuffer       = 00000000
  TransferBufferMDL    = 86198850
  UrbLink              = 00000000
[491734 ms] UsbSnoop - FilterDispatchAny(b9c8efd2) : IRP_MJ_INTERNAL_DEVICE_CONTROL
[491734 ms] UsbSnoop - FdoHookDispatchInternalIoctl(b9c8f1ea) : fdo=858af400, Irp=858af9e0, IRQL=0
[491734 ms]  >>>  URB 32 going down  >>> 
-- URB_FUNCTION_BULK_OR_INTERRUPT_TRANSFER:
  PipeHandle           = 869bbb7c [endpoint 0x00000002]
  TransferFlags        = 00000002 (USBD_TRANSFER_DIRECTION_OUT, USBD_SHORT_TRANSFER_OK)
  TransferBufferLength = 00000012
  TransferBuffer       = 00000000
  TransferBufferMDL    = 858a5820
    00000000: 54 fd 64 00 00 ff 64 01 40 60 04 80 02 0a 05 4e
    00000010: 80 04
  UrbLink              = 00000000
[491735 ms] UsbSnoop - MyInternalIOCTLCompletion(b9c8f126) : fido=86aef2a0, Irp=858af9e0, Context=858bc360, IRQL=2
[491735 ms]  <<<  URB 32 coming back  <<< 
-- URB_FUNCTION_BULK_OR_INTERRUPT_TRANSFER:
  PipeHandle           = 869bbb7c [endpoint 0x00000002]
  TransferFlags        = 00000002 (USBD_TRANSFER_DIRECTION_OUT, USBD_SHORT_TRANSFER_OK)
  TransferBufferLength = 00000012
  TransferBuffer       = 00000000
  TransferBufferMDL    = 858a5820
  UrbLink              = 00000000
[491735 ms] UsbSnoop - FilterDispatchAny(b9c8efd2) : IRP_MJ_INTERNAL_DEVICE_CONTROL
[491735 ms] UsbSnoop - FdoHookDispatchInternalIoctl(b9c8f1ea) : fdo=858af400, Irp=859303f0, IRQL=0
[491735 ms]  >>>  URB 33 going down  >>> 
-- URB_FUNCTION_BULK_OR_INTERRUPT_TRANSFER:
  PipeHandle           = 869bbb7c [endpoint 0x00000002]
  TransferFlags        = 00000002 (USBD_TRANSFER_DIRECTION_OUT, USBD_SHORT_TRANSFER_OK)
  TransferBufferLength = 00000011
  TransferBuffer       = 00000000
  TransferBufferMDL    = 85b6ae78
    00000000: 54 fd 64 00 80 04 64 01 40 60 0e 00 01 00 08 55
    00000010: 0e
  UrbLink              = 00000000
[491736 ms] UsbSnoop - MyInternalIOCTLCompletion(b9c8f126) : fido=86aef2a0, Irp=859303f0, Context=858bc360, IRQL=2
[491736 ms]  <<<  URB 33 coming back  <<< 
-- URB_FUNCTION_BULK_OR_INTERRUPT_TRANSFER:
  PipeHandle           = 869bbb7c [endpoint 0x00000002]
  TransferFlags        = 00000002 (USBD_TRANSFER_DIRECTION_OUT, USBD_SHORT_TRANSFER_OK)
  TransferBufferLength = 00000011
  TransferBuffer       = 00000000
  TransferBufferMDL    = 85b6ae78
  UrbLink              = 00000000
[491738 ms] UsbSnoop - MyInternalIOCTLCompletion(b9c8f126) : fido=86aef2a0, Irp=858a3008, Context=85d29868, IRQL=2
[491738 ms]  <<<  URB 31 coming back  <<< 
-- URB_FUNCTION_BULK_OR_INTERRUPT_TRANSFER:
  PipeHandle           = 869bbb5c [endpoint 0x00000081]
  TransferFlags        = 00000003 (USBD_TRANSFER_DIRECTION_IN, USBD_SHORT_TRANSFER_OK)
  TransferBufferLength = 00000012
  TransferBuffer       = 00000000
  TransferBufferMDL    = 86198850
    00000000: 54 fd 64 01 00 ff 64 00 80 04 60 40 02 0a 08 51
    00000010: 40 60
  UrbLink              = 00000000
[491738 ms] UsbSnoop - FilterDispatchAny(b9c8efd2) : IRP_MJ_INTERNAL_DEVICE_CONTROL
[491738 ms] UsbSnoop - FdoHookDispatchInternalIoctl(b9c8f1ea) : fdo=858af400, Irp=858a3008, IRQL=0
[491738 ms]  >>>  URB 34 going down  >>> 
-- URB_FUNCTION_BULK_OR_INTERRUPT_TRANSFER:
  PipeHandle           = 869bbb5c [endpoint 0x00000081]
  TransferFlags        = 00000003 (USBD_TRANSFER_DIRECTION_IN, USBD_SHORT_TRANSFER_OK)
  TransferBufferLength = 00000200
  TransferBuffer       = 00000000
  TransferBufferMDL    = 86198850
  UrbLink              = 00000000
[491746 ms] UsbSnoop - MyInternalIOCTLCompletion(b9c8f126) : fido=86aef2a0, Irp=858a3008, Context=85d29868, IRQL=2
[491746 ms]  <<<  URB 34 coming back  <<< 
-- URB_FUNCTION_BULK_OR_INTERRUPT_TRANSFER:
  PipeHandle           = 869bbb5c [endpoint 0x00000081]
  TransferFlags        = 00000003 (USBD_TRANSFER_DIRECTION_IN, USBD_SHORT_TRANSFER_OK)
  TransferBufferLength = 00000026
  TransferBuffer       = 00000000
  TransferBufferMDL    = 86198850
    00000000: 54 fd 64 01 40 60 64 00 80 04 d0 9f 16 00 06 c9
    00000010: 10 00 13 46 6f 6c 64 65 72 31 00 00 00 00 00 00
    00000020: 00 00 0d b1 01 00
  UrbLink              = 00000000
[491746 ms] UsbSnoop - FilterDispatchAny(b9c8efd2) : IRP_MJ_INTERNAL_DEVICE_CONTROL
[491746 ms] UsbSnoop - FdoHookDispatchInternalIoctl(b9c8f1ea) : fdo=858af400, Irp=858a3008, IRQL=0
[491746 ms]  >>>  URB 35 going down  >>> 
-- URB_FUNCTION_BULK_OR_INTERRUPT_TRANSFER:
  PipeHandle           = 869bbb5c [endpoint 0x00000081]
  TransferFlags        = 00000003 (USBD_TRANSFER_DIRECTION_IN, USBD_SHORT_TRANSFER_OK)
  TransferBufferLength = 00000200
  TransferBuffer       = 00000000
  TransferBufferMDL    = 86198850
  UrbLink              = 00000000
[491746 ms] UsbSnoop - FilterDispatchAny(b9c8efd2) : IRP_MJ_INTERNAL_DEVICE_CONTROL
[491746 ms] UsbSnoop - FdoHookDispatchInternalIoctl(b9c8f1ea) : fdo=858af400, Irp=85816778, IRQL=0
[491746 ms]  >>>  URB 36 going down  >>> 
-- URB_FUNCTION_BULK_OR_INTERRUPT_TRANSFER:
  PipeHandle           = 869bbb7c [endpoint 0x00000002]
  TransferFlags        = 00000002 (USBD_TRANSFER_DIRECTION_OUT, USBD_SHORT_TRANSFER_OK)
  TransferBufferLength = 00000012
  TransferBuffer       = 00000000
  TransferBufferMDL    = 86a1d748
    00000000: 54 fd 64 00 00 ff 64 01 40 60 04 80 02 0a 06 4f
    00000010: 80 04
  UrbLink              = 00000000
[491747 ms] UsbSnoop - MyInternalIOCTLCompletion(b9c8f126) : fido=86aef2a0, Irp=85816778, Context=858bc360, IRQL=2
[491747 ms]  <<<  URB 36 coming back  <<< 
-- URB_FUNCTION_BULK_OR_INTERRUPT_TRANSFER:
  PipeHandle           = 869bbb7c [endpoint 0x00000002]
  TransferFlags        = 00000002 (USBD_TRANSFER_DIRECTION_OUT, USBD_SHORT_TRANSFER_OK)
  TransferBufferLength = 00000012
  TransferBuffer       = 00000000
  TransferBufferMDL    = 86a1d748
  UrbLink              = 00000000
[491748 ms] UsbSnoop - FilterDispatchAny(b9c8efd2) : IRP_MJ_INTERNAL_DEVICE_CONTROL
[491748 ms] UsbSnoop - FdoHookDispatchInternalIoctl(b9c8f1ea) : fdo=858af400, Irp=85901740, IRQL=0
[491748 ms]  >>>  URB 37 going down  >>> 
-- URB_FUNCTION_BULK_OR_INTERRUPT_TRANSFER:
  PipeHandle           = 869bbb7c [endpoint 0x00000002]
  TransferFlags        = 00000002 (USBD_TRANSFER_DIRECTION_OUT, USBD_SHORT_TRANSFER_OK)
  TransferBufferLength = 00000011
  TransferBuffer       = 00000000
  TransferBufferMDL    = 86a85d30
    00000000: 54 fd 64 00 80 04 64 01 40 60 0e 00 01 00 09 56
    00000010: 0e
  UrbLink              = 00000000
[491749 ms] UsbSnoop - MyInternalIOCTLCompletion(b9c8f126) : fido=86aef2a0, Irp=85901740, Context=858bc360, IRQL=2
[491749 ms]  <<<  URB 37 coming back  <<< 
-- URB_FUNCTION_BULK_OR_INTERRUPT_TRANSFER:
  PipeHandle           = 869bbb7c [endpoint 0x00000002]
  TransferFlags        = 00000002 (USBD_TRANSFER_DIRECTION_OUT, USBD_SHORT_TRANSFER_OK)
  TransferBufferLength = 00000011
  TransferBuffer       = 00000000
  TransferBufferMDL    = 86a85d30
  UrbLink              = 00000000
[491750 ms] UsbSnoop - MyInternalIOCTLCompletion(b9c8f126) : fido=86aef2a0, Irp=858a3008, Context=85d29868, IRQL=2
[491750 ms]  <<<  URB 35 coming back  <<< 
-- URB_FUNCTION_BULK_OR_INTERRUPT_TRANSFER:
  PipeHandle           = 869bbb5c [endpoint 0x00000081]
  TransferFlags        = 00000003 (USBD_TRANSFER_DIRECTION_IN, USBD_SHORT_TRANSFER_OK)
  TransferBufferLength = 00000012
  TransferBuffer       = 00000000
  TransferBufferMDL    = 86198850
    00000000: 54 fd 64 01 00 ff 64 00 80 04 60 40 02 0a 09 52
    00000010: 40 60
  UrbLink              = 00000000
[491750 ms] UsbSnoop - FilterDispatchAny(b9c8efd2) : IRP_MJ_INTERNAL_DEVICE_CONTROL
[491750 ms] UsbSnoop - FdoHookDispatchInternalIoctl(b9c8f1ea) : fdo=858af400, Irp=858a3008, IRQL=0
[491750 ms]  >>>  URB 38 going down  >>> 
-- URB_FUNCTION_BULK_OR_INTERRUPT_TRANSFER:
  PipeHandle           = 869bbb5c [endpoint 0x00000081]
  TransferFlags        = 00000003 (USBD_TRANSFER_DIRECTION_IN, USBD_SHORT_TRANSFER_OK)
  TransferBufferLength = 00000200
  TransferBuffer       = 00000000
  TransferBufferMDL    = 86198850
  UrbLink              = 00000000
[491754 ms] UsbSnoop - MyInternalIOCTLCompletion(b9c8f126) : fido=86aef2a0, Irp=858a3008, Context=85d29868, IRQL=2
[491754 ms]  <<<  URB 38 coming back  <<< 
-- URB_FUNCTION_BULK_OR_INTERRUPT_TRANSFER:
  PipeHandle           = 869bbb5c [endpoint 0x00000081]
  TransferFlags        = 00000003 (USBD_TRANSFER_DIRECTION_IN, USBD_SHORT_TRANSFER_OK)
  TransferBufferLength = 00000026
  TransferBuffer       = 00000000
  TransferBufferMDL    = 86198850
    00000000: 54 fd 64 01 40 60 64 00 80 04 39 ed 16 00 07 81
    00000010: 10 00 13 45 78 65 6d 70 6c 65 73 00 00 00 00 00
    00000020: 00 00 00 0b 01 00
  UrbLink              = 00000000
[491754 ms] UsbSnoop - FilterDispatchAny(b9c8efd2) : IRP_MJ_INTERNAL_DEVICE_CONTROL
[491754 ms] UsbSnoop - FdoHookDispatchInternalIoctl(b9c8f1ea) : fdo=858af400, Irp=858a3008, IRQL=0
[491754 ms]  >>>  URB 39 going down  >>> 
-- URB_FUNCTION_BULK_OR_INTERRUPT_TRANSFER:
  PipeHandle           = 869bbb5c [endpoint 0x00000081]
  TransferFlags        = 00000003 (USBD_TRANSFER_DIRECTION_IN, USBD_SHORT_TRANSFER_OK)
  TransferBufferLength = 00000200
  TransferBuffer       = 00000000
  TransferBufferMDL    = 86198850
  UrbLink              = 00000000
[491754 ms] UsbSnoop - FilterDispatchAny(b9c8efd2) : IRP_MJ_INTERNAL_DEVICE_CONTROL
[491754 ms] UsbSnoop - FdoHookDispatchInternalIoctl(b9c8f1ea) : fdo=858af400, Irp=859524c0, IRQL=0
[491754 ms]  >>>  URB 40 going down  >>> 
-- URB_FUNCTION_BULK_OR_INTERRUPT_TRANSFER:
  PipeHandle           = 869bbb7c [endpoint 0x00000002]
  TransferFlags        = 00000002 (USBD_TRANSFER_DIRECTION_OUT, USBD_SHORT_TRANSFER_OK)
  TransferBufferLength = 00000012
  TransferBuffer       = 00000000
  TransferBufferMDL    = 868ea268
    00000000: 54 fd 64 00 00 ff 64 01 40 60 04 80 02 0a 07 50
    00000010: 80 04
  UrbLink              = 00000000
[491755 ms] UsbSnoop - MyInternalIOCTLCompletion(b9c8f126) : fido=86aef2a0, Irp=859524c0, Context=858bc360, IRQL=2
[491755 ms]  <<<  URB 40 coming back  <<< 
-- URB_FUNCTION_BULK_OR_INTERRUPT_TRANSFER:
  PipeHandle           = 869bbb7c [endpoint 0x00000002]
  TransferFlags        = 00000002 (USBD_TRANSFER_DIRECTION_OUT, USBD_SHORT_TRANSFER_OK)
  TransferBufferLength = 00000012
  TransferBuffer       = 00000000
  TransferBufferMDL    = 868ea268
  UrbLink              = 00000000
[491756 ms] UsbSnoop - FilterDispatchAny(b9c8efd2) : IRP_MJ_INTERNAL_DEVICE_CONTROL
[491756 ms] UsbSnoop - FdoHookDispatchInternalIoctl(b9c8f1ea) : fdo=858af400, Irp=86382830, IRQL=0
[491756 ms]  >>>  URB 41 going down  >>> 
-- URB_FUNCTION_BULK_OR_INTERRUPT_TRANSFER:
  PipeHandle           = 869bbb7c [endpoint 0x00000002]
  TransferFlags        = 00000002 (USBD_TRANSFER_DIRECTION_OUT, USBD_SHORT_TRANSFER_OK)
  TransferBufferLength = 00000011
  TransferBuffer       = 00000000
  TransferBufferMDL    = 869ca890
    00000000: 54 fd 64 00 80 04 64 01 40 60 0e 00 01 00 0a 57
    00000010: 0e
  UrbLink              = 00000000
[491757 ms] UsbSnoop - MyInternalIOCTLCompletion(b9c8f126) : fido=86aef2a0, Irp=86382830, Context=858bc360, IRQL=2
[491757 ms]  <<<  URB 41 coming back  <<< 
-- URB_FUNCTION_BULK_OR_INTERRUPT_TRANSFER:
  PipeHandle           = 869bbb7c [endpoint 0x00000002]
  TransferFlags        = 00000002 (USBD_TRANSFER_DIRECTION_OUT, USBD_SHORT_TRANSFER_OK)
  TransferBufferLength = 00000011
  TransferBuffer       = 00000000
  TransferBufferMDL    = 869ca890
  UrbLink              = 00000000
[491758 ms] UsbSnoop - MyInternalIOCTLCompletion(b9c8f126) : fido=86aef2a0, Irp=858a3008, Context=85d29868, IRQL=2
[491758 ms]  <<<  URB 39 coming back  <<< 
-- URB_FUNCTION_BULK_OR_INTERRUPT_TRANSFER:
  PipeHandle           = 869bbb5c [endpoint 0x00000081]
  TransferFlags        = 00000003 (USBD_TRANSFER_DIRECTION_IN, USBD_SHORT_TRANSFER_OK)
  TransferBufferLength = 00000012
  TransferBuffer       = 00000000
  TransferBufferMDL    = 86198850
    00000000: 54 fd 64 01 00 ff 64 00 80 04 60 40 02 0a 0a 53
    00000010: 40 60
  UrbLink              = 00000000
[491758 ms] UsbSnoop - FilterDispatchAny(b9c8efd2) : IRP_MJ_INTERNAL_DEVICE_CONTROL
[491758 ms] UsbSnoop - FdoHookDispatchInternalIoctl(b9c8f1ea) : fdo=858af400, Irp=858a3008, IRQL=0
[491758 ms]  >>>  URB 42 going down  >>> 
-- URB_FUNCTION_BULK_OR_INTERRUPT_TRANSFER:
  PipeHandle           = 869bbb5c [endpoint 0x00000081]
  TransferFlags        = 00000003 (USBD_TRANSFER_DIRECTION_IN, USBD_SHORT_TRANSFER_OK)
  TransferBufferLength = 00000200
  TransferBuffer       = 00000000
  TransferBufferMDL    = 86198850
  UrbLink              = 00000000
[491761 ms] UsbSnoop - MyInternalIOCTLCompletion(b9c8f126) : fido=86aef2a0, Irp=858a3008, Context=85d29868, IRQL=2
[491761 ms]  <<<  URB 42 coming back  <<< 
-- URB_FUNCTION_BULK_OR_INTERRUPT_TRANSFER:
  PipeHandle           = 869bbb5c [endpoint 0x00000081]
  TransferFlags        = 00000003 (USBD_TRANSFER_DIRECTION_IN, USBD_SHORT_TRANSFER_OK)
  TransferBufferLength = 00000012
  TransferBuffer       = 00000000
  TransferBufferMDL    = 86198850
    00000000: 54 fd 64 01 40 60 64 00 80 04 11 ff 02 00 08 58
    00000010: ff 11
  UrbLink              = 00000000
[491761 ms] UsbSnoop - FilterDispatchAny(b9c8efd2) : IRP_MJ_INTERNAL_DEVICE_CONTROL
[491761 ms] UsbSnoop - FdoHookDispatchInternalIoctl(b9c8f1ea) : fdo=858af400, Irp=858a3008, IRQL=0
[491761 ms]  >>>  URB 43 going down  >>> 
-- URB_FUNCTION_BULK_OR_INTERRUPT_TRANSFER:
  PipeHandle           = 869bbb5c [endpoint 0x00000081]
  TransferFlags        = 00000003 (USBD_TRANSFER_DIRECTION_IN, USBD_SHORT_TRANSFER_OK)
  TransferBufferLength = 00000200
  TransferBuffer       = 00000000
  TransferBufferMDL    = 86198850
  UrbLink              = 00000000
[491761 ms] UsbSnoop - FilterDispatchAny(b9c8efd2) : IRP_MJ_INTERNAL_DEVICE_CONTROL
[491761 ms] UsbSnoop - FdoHookDispatchInternalIoctl(b9c8f1ea) : fdo=858af400, Irp=858aee48, IRQL=0
[491761 ms]  >>>  URB 44 going down  >>> 
-- URB_FUNCTION_BULK_OR_INTERRUPT_TRANSFER:
  PipeHandle           = 869bbb7c [endpoint 0x00000002]
  TransferFlags        = 00000002 (USBD_TRANSFER_DIRECTION_OUT, USBD_SHORT_TRANSFER_OK)
  TransferBufferLength = 00000012
  TransferBuffer       = 00000000
  TransferBufferMDL    = 86b591f8
    00000000: 54 fd 64 00 00 ff 64 01 40 60 04 80 02 0a 08 51
    00000010: 80 04
  UrbLink              = 00000000
[491762 ms] UsbSnoop - MyInternalIOCTLCompletion(b9c8f126) : fido=86aef2a0, Irp=858aee48, Context=858bc360, IRQL=2
[491762 ms]  <<<  URB 44 coming back  <<< 
-- URB_FUNCTION_BULK_OR_INTERRUPT_TRANSFER:
  PipeHandle           = 869bbb7c [endpoint 0x00000002]
  TransferFlags        = 00000002 (USBD_TRANSFER_DIRECTION_OUT, USBD_SHORT_TRANSFER_OK)
  TransferBufferLength = 00000012
  TransferBuffer       = 00000000
  TransferBufferMDL    = 86b591f8
  UrbLink              = 00000000
[491762 ms] UsbSnoop - FilterDispatchAny(b9c8efd2) : IRP_MJ_INTERNAL_DEVICE_CONTROL
[491762 ms] UsbSnoop - FdoHookDispatchInternalIoctl(b9c8f1ea) : fdo=858af400, Irp=858aee48, IRQL=0
[491762 ms]  >>>  URB 45 going down  >>> 
-- URB_FUNCTION_BULK_OR_INTERRUPT_TRANSFER:
  PipeHandle           = 869bbb7c [endpoint 0x00000002]
  TransferFlags        = 00000002 (USBD_TRANSFER_DIRECTION_OUT, USBD_SHORT_TRANSFER_OK)
  TransferBufferLength = 00000011
  TransferBuffer       = 00000000
  TransferBufferMDL    = 85d17868
    00000000: 54 fd 64 00 80 04 64 01 40 60 0f 00 01 00 0b 59
    00000010: 0f
  UrbLink              = 00000000
[491763 ms] UsbSnoop - MyInternalIOCTLCompletion(b9c8f126) : fido=86aef2a0, Irp=858aee48, Context=858bc360, IRQL=2
[491763 ms]  <<<  URB 45 coming back  <<< 
-- URB_FUNCTION_BULK_OR_INTERRUPT_TRANSFER:
  PipeHandle           = 869bbb7c [endpoint 0x00000002]
  TransferFlags        = 00000002 (USBD_TRANSFER_DIRECTION_OUT, USBD_SHORT_TRANSFER_OK)
  TransferBufferLength = 00000011
  TransferBuffer       = 00000000
  TransferBufferMDL    = 85d17868
  UrbLink              = 00000000
[491765 ms] UsbSnoop - MyInternalIOCTLCompletion(b9c8f126) : fido=86aef2a0, Irp=858a3008, Context=85d29868, IRQL=2
[491765 ms]  <<<  URB 43 coming back  <<< 
-- URB_FUNCTION_BULK_OR_INTERRUPT_TRANSFER:
  PipeHandle           = 869bbb5c [endpoint 0x00000081]
  TransferFlags        = 00000003 (USBD_TRANSFER_DIRECTION_IN, USBD_SHORT_TRANSFER_OK)
  TransferBufferLength = 00000012
  TransferBuffer       = 00000000
  TransferBufferMDL    = 86198850
    00000000: 54 fd 64 01 00 ff 64 00 80 04 60 40 02 0a 0b 54
    00000010: 40 60
  UrbLink              = 00000000
[491765 ms] UsbSnoop - FilterDispatchAny(b9c8efd2) : IRP_MJ_INTERNAL_DEVICE_CONTROL
[491765 ms] UsbSnoop - FdoHookDispatchInternalIoctl(b9c8f1ea) : fdo=858af400, Irp=858a3008, IRQL=0
[491765 ms]  >>>  URB 46 going down  >>> 
-- URB_FUNCTION_BULK_OR_INTERRUPT_TRANSFER:
  PipeHandle           = 869bbb5c [endpoint 0x00000081]
  TransferFlags        = 00000003 (USBD_TRANSFER_DIRECTION_IN, USBD_SHORT_TRANSFER_OK)
  TransferBufferLength = 00000200
  TransferBuffer       = 00000000
  TransferBufferMDL    = 86198850
  UrbLink              = 00000000
[491768 ms] UsbSnoop - MyInternalIOCTLCompletion(b9c8f126) : fido=86aef2a0, Irp=858a3008, Context=85d29868, IRQL=2
[491768 ms]  <<<  URB 46 coming back  <<< 
-- URB_FUNCTION_BULK_OR_INTERRUPT_TRANSFER:
  PipeHandle           = 869bbb5c [endpoint 0x00000081]
  TransferFlags        = 00000003 (USBD_TRANSFER_DIRECTION_IN, USBD_SHORT_TRANSFER_OK)
  TransferBufferLength = 00000012
  TransferBuffer       = 00000000
  TransferBufferMDL    = 86198850
    00000000: 54 fd 64 01 40 60 64 00 80 04 00 ff 02 00 09 48
    00000010: ff 00
  UrbLink              = 00000000
[491768 ms] UsbSnoop - FilterDispatchAny(b9c8efd2) : IRP_MJ_INTERNAL_DEVICE_CONTROL
[491768 ms] UsbSnoop - FdoHookDispatchInternalIoctl(b9c8f1ea) : fdo=858af400, Irp=858a3008, IRQL=0
[491768 ms]  >>>  URB 47 going down  >>> 
-- URB_FUNCTION_BULK_OR_INTERRUPT_TRANSFER:
  PipeHandle           = 869bbb5c [endpoint 0x00000081]
  TransferFlags        = 00000003 (USBD_TRANSFER_DIRECTION_IN, USBD_SHORT_TRANSFER_OK)
  TransferBufferLength = 00000200
  TransferBuffer       = 00000000
  TransferBufferMDL    = 86198850
  UrbLink              = 00000000
[491768 ms] UsbSnoop - FilterDispatchAny(b9c8efd2) : IRP_MJ_INTERNAL_DEVICE_CONTROL
[491768 ms] UsbSnoop - FdoHookDispatchInternalIoctl(b9c8f1ea) : fdo=858af400, Irp=85b1ee48, IRQL=0
[491768 ms]  >>>  URB 48 going down  >>> 
-- URB_FUNCTION_BULK_OR_INTERRUPT_TRANSFER:
  PipeHandle           = 869bbb7c [endpoint 0x00000002]
  TransferFlags        = 00000002 (USBD_TRANSFER_DIRECTION_OUT, USBD_SHORT_TRANSFER_OK)
  TransferBufferLength = 00000012
  TransferBuffer       = 00000000
  TransferBufferMDL    = 85894d98
    00000000: 54 fd 64 00 00 ff 64 01 40 60 04 80 02 0a 09 52
    00000010: 80 04
  UrbLink              = 00000000
[491769 ms] UsbSnoop - MyInternalIOCTLCompletion(b9c8f126) : fido=86aef2a0, Irp=85b1ee48, Context=858bc360, IRQL=2
[491769 ms]  <<<  URB 48 coming back  <<< 
-- URB_FUNCTION_BULK_OR_INTERRUPT_TRANSFER:
  PipeHandle           = 869bbb7c [endpoint 0x00000002]
  TransferFlags        = 00000002 (USBD_TRANSFER_DIRECTION_OUT, USBD_SHORT_TRANSFER_OK)
  TransferBufferLength = 00000012
  TransferBuffer       = 00000000
  TransferBufferMDL    = 85894d98
  UrbLink              = 00000000
[491770 ms] UsbSnoop - FilterDispatchAny(b9c8efd2) : IRP_MJ_INTERNAL_DEVICE_CONTROL
[491770 ms] UsbSnoop - FdoHookDispatchInternalIoctl(b9c8f1ea) : fdo=858af400, Irp=8594c7c8, IRQL=0
[491770 ms]  >>>  URB 49 going down  >>> 
-- URB_FUNCTION_BULK_OR_INTERRUPT_TRANSFER:
  PipeHandle           = 869bbb7c [endpoint 0x00000002]
  TransferFlags        = 00000002 (USBD_TRANSFER_DIRECTION_OUT, USBD_SHORT_TRANSFER_OK)
  TransferBufferLength = 00000012
  TransferBuffer       = 00000000
  TransferBufferMDL    = 8599e9a0
    00000000: 54 fd 64 00 40 de 64 01 40 60 04 80 02 00 0c 6a
    00000010: 80 04
  UrbLink              = 00000000
[491771 ms] UsbSnoop - MyInternalIOCTLCompletion(b9c8f126) : fido=86aef2a0, Irp=8594c7c8, Context=858bc360, IRQL=2
[491771 ms]  <<<  URB 49 coming back  <<< 
-- URB_FUNCTION_BULK_OR_INTERRUPT_TRANSFER:
  PipeHandle           = 869bbb7c [endpoint 0x00000002]
  TransferFlags        = 00000002 (USBD_TRANSFER_DIRECTION_OUT, USBD_SHORT_TRANSFER_OK)
  TransferBufferLength = 00000012
  TransferBuffer       = 00000000
  TransferBufferMDL    = 8599e9a0
  UrbLink              = 00000000
[491772 ms] UsbSnoop - MyInternalIOCTLCompletion(b9c8f126) : fido=86aef2a0, Irp=858a3008, Context=85d29868, IRQL=2
[491772 ms]  <<<  URB 47 coming back  <<< 
-- URB_FUNCTION_BULK_OR_INTERRUPT_TRANSFER:
  PipeHandle           = 869bbb5c [endpoint 0x00000081]
  TransferFlags        = 00000003 (USBD_TRANSFER_DIRECTION_IN, USBD_SHORT_TRANSFER_OK)
  TransferBufferLength = 00000012
  TransferBuffer       = 00000000
  TransferBufferMDL    = 86198850
    00000000: 54 fd 64 01 00 ff 64 00 80 04 60 40 02 0a 0c 55
    00000010: 40 60
  UrbLink              = 00000000
[491772 ms] UsbSnoop - FilterDispatchAny(b9c8efd2) : IRP_MJ_INTERNAL_DEVICE_CONTROL
[491772 ms] UsbSnoop - FdoHookDispatchInternalIoctl(b9c8f1ea) : fdo=858af400, Irp=858a3008, IRQL=0
[491772 ms]  >>>  URB 50 going down  >>> 
-- URB_FUNCTION_BULK_OR_INTERRUPT_TRANSFER:
  PipeHandle           = 869bbb5c [endpoint 0x00000081]
  TransferFlags        = 00000003 (USBD_TRANSFER_DIRECTION_IN, USBD_SHORT_TRANSFER_OK)
  TransferBufferLength = 00000200
  TransferBuffer       = 00000000
  TransferBufferMDL    = 86198850
  UrbLink              = 00000000
[491813 ms] UsbSnoop - FilterDispatchAny(b9c8efd2) : IRP_MJ_INTERNAL_DEVICE_CONTROL
[491813 ms] UsbSnoop - FdoHookDispatchInternalIoctl(b9c8f1ea) : fdo=858af400, Irp=8594c7c8, IRQL=0
[491813 ms]  >>>  URB 51 going down  >>> 
-- URB_FUNCTION_BULK_OR_INTERRUPT_TRANSFER:
  PipeHandle           = 869bbb7c [endpoint 0x00000002]
  TransferFlags        = 00000002 (USBD_TRANSFER_DIRECTION_OUT, USBD_SHORT_TRANSFER_OK)
  TransferBufferLength = 0000001b
  TransferBuffer       = 00000000
  TransferBufferMDL    = 8599e9a0
    00000000: 54 fd 64 00 80 05 64 01 40 60 0c f1 0b 00 0d 54
    00000010: 20 01 2f 00 00 00 00 00 00 00 00
  UrbLink              = 00000000
[491814 ms] UsbSnoop - MyInternalIOCTLCompletion(b9c8f126) : fido=86aef2a0, Irp=8594c7c8, Context=858bc360, IRQL=2
[491814 ms]  <<<  URB 51 coming back  <<< 
-- URB_FUNCTION_BULK_OR_INTERRUPT_TRANSFER:
  PipeHandle           = 869bbb7c [endpoint 0x00000002]
  TransferFlags        = 00000002 (USBD_TRANSFER_DIRECTION_OUT, USBD_SHORT_TRANSFER_OK)
  TransferBufferLength = 0000001b
  TransferBuffer       = 00000000
  TransferBufferMDL    = 8599e9a0
  UrbLink              = 00000000
[491815 ms] UsbSnoop - MyInternalIOCTLCompletion(b9c8f126) : fido=86aef2a0, Irp=858a3008, Context=85d29868, IRQL=2
[491815 ms]  <<<  URB 50 coming back  <<< 
-- URB_FUNCTION_BULK_OR_INTERRUPT_TRANSFER:
  PipeHandle           = 869bbb5c [endpoint 0x00000081]
  TransferFlags        = 00000003 (USBD_TRANSFER_DIRECTION_IN, USBD_SHORT_TRANSFER_OK)
  TransferBufferLength = 00000012
  TransferBuffer       = 00000000
  TransferBufferMDL    = 86198850
    00000000: 54 fd 64 01 00 ff 64 00 80 05 60 40 02 0a 0d 57
    00000010: 40 60
  UrbLink              = 00000000
[491815 ms] UsbSnoop - FilterDispatchAny(b9c8efd2) : IRP_MJ_INTERNAL_DEVICE_CONTROL
[491815 ms] UsbSnoop - FdoHookDispatchInternalIoctl(b9c8f1ea) : fdo=858af400, Irp=858a3008, IRQL=0
[491815 ms]  >>>  URB 52 going down  >>> 
-- URB_FUNCTION_BULK_OR_INTERRUPT_TRANSFER:
  PipeHandle           = 869bbb5c [endpoint 0x00000081]
  TransferFlags        = 00000003 (USBD_TRANSFER_DIRECTION_IN, USBD_SHORT_TRANSFER_OK)
  TransferBufferLength = 00000200
  TransferBuffer       = 00000000
  TransferBufferMDL    = 8699c1d0
  UrbLink              = 00000000
[491830 ms] UsbSnoop - MyInternalIOCTLCompletion(b9c8f126) : fido=86aef2a0, Irp=858a3008, Context=85d29868, IRQL=2
[491830 ms]  <<<  URB 52 coming back  <<< 
-- URB_FUNCTION_BULK_OR_INTERRUPT_TRANSFER:
  PipeHandle           = 869bbb5c [endpoint 0x00000081]
  TransferFlags        = 00000003 (USBD_TRANSFER_DIRECTION_IN, USBD_SHORT_TRANSFER_OK)
  TransferBufferLength = 0000001b
  TransferBuffer       = 00000000
  TransferBufferMDL    = 8699c1d0
    00000000: 54 fd 64 01 40 60 64 00 80 05 f7 38 0b 00 0a 83
    00000010: 20 00 00 00 00 00 00 00 00 01 00
  UrbLink              = 00000000
[491830 ms] UsbSnoop - FilterDispatchAny(b9c8efd2) : IRP_MJ_INTERNAL_DEVICE_CONTROL
[491830 ms] UsbSnoop - FdoHookDispatchInternalIoctl(b9c8f1ea) : fdo=858af400, Irp=858a3008, IRQL=0
[491830 ms]  >>>  URB 53 going down  >>> 
-- URB_FUNCTION_BULK_OR_INTERRUPT_TRANSFER:
  PipeHandle           = 869bbb5c [endpoint 0x00000081]
  TransferFlags        = 00000003 (USBD_TRANSFER_DIRECTION_IN, USBD_SHORT_TRANSFER_OK)
  TransferBufferLength = 00000200
  TransferBuffer       = 00000000
  TransferBufferMDL    = 8699c1d0
  UrbLink              = 00000000
[491830 ms] UsbSnoop - FilterDispatchAny(b9c8efd2) : IRP_MJ_INTERNAL_DEVICE_CONTROL
[491830 ms] UsbSnoop - FdoHookDispatchInternalIoctl(b9c8f1ea) : fdo=858af400, Irp=85930a58, IRQL=0
[491830 ms]  >>>  URB 54 going down  >>> 
-- URB_FUNCTION_BULK_OR_INTERRUPT_TRANSFER:
  PipeHandle           = 869bbb7c [endpoint 0x00000002]
  TransferFlags        = 00000002 (USBD_TRANSFER_DIRECTION_OUT, USBD_SHORT_TRANSFER_OK)
  TransferBufferLength = 00000012
  TransferBuffer       = 00000000
  TransferBufferMDL    = 864b96f8
    00000000: 54 fd 64 00 00 ff 64 01 40 60 05 80 02 0a 0a 54
    00000010: 80 05
  UrbLink              = 00000000
[491831 ms] UsbSnoop - MyInternalIOCTLCompletion(b9c8f126) : fido=86aef2a0, Irp=85930a58, Context=858bc360, IRQL=2
[491831 ms]  <<<  URB 54 coming back  <<< 
-- URB_FUNCTION_BULK_OR_INTERRUPT_TRANSFER:
  PipeHandle           = 869bbb7c [endpoint 0x00000002]
  TransferFlags        = 00000002 (USBD_TRANSFER_DIRECTION_OUT, USBD_SHORT_TRANSFER_OK)
  TransferBufferLength = 00000012
  TransferBuffer       = 00000000
  TransferBufferMDL    = 864b96f8
  UrbLink              = 00000000
[491832 ms] UsbSnoop - FilterDispatchAny(b9c8efd2) : IRP_MJ_INTERNAL_DEVICE_CONTROL
[491832 ms] UsbSnoop - FdoHookDispatchInternalIoctl(b9c8f1ea) : fdo=858af400, Irp=85930a58, IRQL=0
[491832 ms]  >>>  URB 55 going down  >>> 
-- URB_FUNCTION_BULK_OR_INTERRUPT_TRANSFER:
  PipeHandle           = 869bbb7c [endpoint 0x00000002]
  TransferFlags        = 00000002 (USBD_TRANSFER_DIRECTION_OUT, USBD_SHORT_TRANSFER_OK)
  TransferBufferLength = 00000012
  TransferBuffer       = 00000000
  TransferBufferMDL    = 864b96f8
    00000000: 54 fd 64 00 40 de 64 01 40 60 05 80 02 00 0e 6d
    00000010: 80 05
  UrbLink              = 00000000
[491833 ms] UsbSnoop - MyInternalIOCTLCompletion(b9c8f126) : fido=86aef2a0, Irp=85930a58, Context=858bc360, IRQL=2
[491833 ms]  <<<  URB 55 coming back  <<< 
-- URB_FUNCTION_BULK_OR_INTERRUPT_TRANSFER:
  PipeHandle           = 869bbb7c [endpoint 0x00000002]
  TransferFlags        = 00000002 (USBD_TRANSFER_DIRECTION_OUT, USBD_SHORT_TRANSFER_OK)
  TransferBufferLength = 00000012
  TransferBuffer       = 00000000
  TransferBufferMDL    = 864b96f8
  UrbLink              = 00000000
[491834 ms] UsbSnoop - MyInternalIOCTLCompletion(b9c8f126) : fido=86aef2a0, Irp=858a3008, Context=85d29868, IRQL=2
[491834 ms]  <<<  URB 53 coming back  <<< 
-- URB_FUNCTION_BULK_OR_INTERRUPT_TRANSFER:
  PipeHandle           = 869bbb5c [endpoint 0x00000081]
  TransferFlags        = 00000003 (USBD_TRANSFER_DIRECTION_IN, USBD_SHORT_TRANSFER_OK)
  TransferBufferLength = 00000012
  TransferBuffer       = 00000000
  TransferBufferMDL    = 8699c1d0
    00000000: 54 fd 64 01 00 ff 64 00 80 05 60 40 02 0a 0e 58
    00000010: 40 60
  UrbLink              = 00000000
[491834 ms] UsbSnoop - FilterDispatchAny(b9c8efd2) : IRP_MJ_INTERNAL_DEVICE_CONTROL
[491834 ms] UsbSnoop - FdoHookDispatchInternalIoctl(b9c8f1ea) : fdo=858af400, Irp=858a3008, IRQL=0
[491834 ms]  >>>  URB 56 going down  >>> 
-- URB_FUNCTION_BULK_OR_INTERRUPT_TRANSFER:
  PipeHandle           = 869bbb5c [endpoint 0x00000081]
  TransferFlags        = 00000003 (USBD_TRANSFER_DIRECTION_IN, USBD_SHORT_TRANSFER_OK)
  TransferBufferLength = 00000200
  TransferBuffer       = 00000000
  TransferBufferMDL    = 8699c1d0
  UrbLink              = 00000000
[491838 ms] UsbSnoop - FilterDispatchAny(b9c8efd2) : IRP_MJ_INTERNAL_DEVICE_CONTROL
[491838 ms] UsbSnoop - FdoHookDispatchInternalIoctl(b9c8f1ea) : fdo=858af400, Irp=858aa2c0, IRQL=0
[491838 ms]  >>>  URB 57 going down  >>> 
-- URB_FUNCTION_BULK_OR_INTERRUPT_TRANSFER:
  PipeHandle           = 869bbb7c [endpoint 0x00000002]
  TransferFlags        = 00000002 (USBD_TRANSFER_DIRECTION_OUT, USBD_SHORT_TRANSFER_OK)
  TransferBufferLength = 0000001a
  TransferBuffer       = 00000000
  TransferBufferMDL    = 868d8270
    00000000: 54 fd 64 00 80 06 64 01 40 60 c0 aa 0a 00 0f c3
    00000010: 0d 2f 00 00 00 00 00 00 00 00
  UrbLink              = 00000000
[491839 ms] UsbSnoop - MyInternalIOCTLCompletion(b9c8f126) : fido=86aef2a0, Irp=858aa2c0, Context=858bc360, IRQL=2
[491839 ms]  <<<  URB 57 coming back  <<< 
-- URB_FUNCTION_BULK_OR_INTERRUPT_TRANSFER:
  PipeHandle           = 869bbb7c [endpoint 0x00000002]
  TransferFlags        = 00000002 (USBD_TRANSFER_DIRECTION_OUT, USBD_SHORT_TRANSFER_OK)
  TransferBufferLength = 0000001a
  TransferBuffer       = 00000000
  TransferBufferMDL    = 868d8270
  UrbLink              = 00000000
[491840 ms] UsbSnoop - MyInternalIOCTLCompletion(b9c8f126) : fido=86aef2a0, Irp=858a3008, Context=85d29868, IRQL=2
[491840 ms]  <<<  URB 56 coming back  <<< 
-- URB_FUNCTION_BULK_OR_INTERRUPT_TRANSFER:
  PipeHandle           = 869bbb5c [endpoint 0x00000081]
  TransferFlags        = 00000003 (USBD_TRANSFER_DIRECTION_IN, USBD_SHORT_TRANSFER_OK)
  TransferBufferLength = 00000012
  TransferBuffer       = 00000000
  TransferBufferMDL    = 8699c1d0
    00000000: 54 fd 64 01 00 ff 64 00 80 06 60 40 02 0a 0f 5a
    00000010: 40 60
  UrbLink              = 00000000
[491840 ms] UsbSnoop - FilterDispatchAny(b9c8efd2) : IRP_MJ_INTERNAL_DEVICE_CONTROL
[491840 ms] UsbSnoop - FdoHookDispatchInternalIoctl(b9c8f1ea) : fdo=858af400, Irp=858a3008, IRQL=0
[491840 ms]  >>>  URB 58 going down  >>> 
-- URB_FUNCTION_BULK_OR_INTERRUPT_TRANSFER:
  PipeHandle           = 869bbb5c [endpoint 0x00000081]
  TransferFlags        = 00000003 (USBD_TRANSFER_DIRECTION_IN, USBD_SHORT_TRANSFER_OK)
  TransferBufferLength = 00000200
  TransferBuffer       = 00000000
  TransferBufferMDL    = 8699c1d0
  UrbLink              = 00000000
[491855 ms] UsbSnoop - MyInternalIOCTLCompletion(b9c8f126) : fido=86aef2a0, Irp=858a3008, Context=85d29868, IRQL=2
[491855 ms]  <<<  URB 58 coming back  <<< 
-- URB_FUNCTION_BULK_OR_INTERRUPT_TRANSFER:
  PipeHandle           = 869bbb5c [endpoint 0x00000081]
  TransferFlags        = 00000003 (USBD_TRANSFER_DIRECTION_IN, USBD_SHORT_TRANSFER_OK)
  TransferBufferLength = 00000012
  TransferBuffer       = 00000000
  TransferBufferMDL    = 8699c1d0
    00000000: 54 fd 64 01 40 60 64 00 80 06 00 ff 02 00 0b 4c
    00000010: ff 00
  UrbLink              = 00000000
[491855 ms] UsbSnoop - FilterDispatchAny(b9c8efd2) : IRP_MJ_INTERNAL_DEVICE_CONTROL
[491855 ms] UsbSnoop - FdoHookDispatchInternalIoctl(b9c8f1ea) : fdo=858af400, Irp=858a3008, IRQL=0
[491855 ms]  >>>  URB 59 going down  >>> 
-- URB_FUNCTION_BULK_OR_INTERRUPT_TRANSFER:
  PipeHandle           = 869bbb5c [endpoint 0x00000081]
  TransferFlags        = 00000003 (USBD_TRANSFER_DIRECTION_IN, USBD_SHORT_TRANSFER_OK)
  TransferBufferLength = 00000200
  TransferBuffer       = 00000000
  TransferBufferMDL    = 8699c1d0
  UrbLink              = 00000000
[491855 ms] UsbSnoop - FilterDispatchAny(b9c8efd2) : IRP_MJ_INTERNAL_DEVICE_CONTROL
[491855 ms] UsbSnoop - FdoHookDispatchInternalIoctl(b9c8f1ea) : fdo=858af400, Irp=86ab8d10, IRQL=0
[491855 ms]  >>>  URB 60 going down  >>> 
-- URB_FUNCTION_BULK_OR_INTERRUPT_TRANSFER:
  PipeHandle           = 869bbb7c [endpoint 0x00000002]
  TransferFlags        = 00000002 (USBD_TRANSFER_DIRECTION_OUT, USBD_SHORT_TRANSFER_OK)
  TransferBufferLength = 00000012
  TransferBuffer       = 00000000
  TransferBufferMDL    = 868ae600
    00000000: 54 fd 64 00 00 ff 64 01 40 60 06 80 02 0a 0b 56
    00000010: 80 06
  UrbLink              = 00000000
[491856 ms] UsbSnoop - MyInternalIOCTLCompletion(b9c8f126) : fido=86aef2a0, Irp=86ab8d10, Context=858bc360, IRQL=2
[491856 ms]  <<<  URB 60 coming back  <<< 
-- URB_FUNCTION_BULK_OR_INTERRUPT_TRANSFER:
  PipeHandle           = 869bbb7c [endpoint 0x00000002]
  TransferFlags        = 00000002 (USBD_TRANSFER_DIRECTION_OUT, USBD_SHORT_TRANSFER_OK)
  TransferBufferLength = 00000012
  TransferBuffer       = 00000000
  TransferBufferMDL    = 868ae600
  UrbLink              = 00000000
[491856 ms] UsbSnoop - FilterDispatchAny(b9c8efd2) : IRP_MJ_INTERNAL_DEVICE_CONTROL
[491856 ms] UsbSnoop - FdoHookDispatchInternalIoctl(b9c8f1ea) : fdo=858af400, Irp=86ab8d10, IRQL=0
[491856 ms]  >>>  URB 61 going down  >>> 
-- URB_FUNCTION_BULK_OR_INTERRUPT_TRANSFER:
  PipeHandle           = 869bbb7c [endpoint 0x00000002]
  TransferFlags        = 00000002 (USBD_TRANSFER_DIRECTION_OUT, USBD_SHORT_TRANSFER_OK)
  TransferBufferLength = 00000011
  TransferBuffer       = 00000000
  TransferBufferMDL    = 868ae600
    00000000: 54 fd 64 00 80 06 64 01 40 60 0e 00 01 00 10 5f
    00000010: 0e
  UrbLink              = 00000000
[491857 ms] UsbSnoop - MyInternalIOCTLCompletion(b9c8f126) : fido=86aef2a0, Irp=86ab8d10, Context=858bc360, IRQL=2
[491857 ms]  <<<  URB 61 coming back  <<< 
-- URB_FUNCTION_BULK_OR_INTERRUPT_TRANSFER:
  PipeHandle           = 869bbb7c [endpoint 0x00000002]
  TransferFlags        = 00000002 (USBD_TRANSFER_DIRECTION_OUT, USBD_SHORT_TRANSFER_OK)
  TransferBufferLength = 00000011
  TransferBuffer       = 00000000
  TransferBufferMDL    = 868ae600
  UrbLink              = 00000000
[491859 ms] UsbSnoop - MyInternalIOCTLCompletion(b9c8f126) : fido=86aef2a0, Irp=858a3008, Context=85d29868, IRQL=2
[491859 ms]  <<<  URB 59 coming back  <<< 
-- URB_FUNCTION_BULK_OR_INTERRUPT_TRANSFER:
  PipeHandle           = 869bbb5c [endpoint 0x00000081]
  TransferFlags        = 00000003 (USBD_TRANSFER_DIRECTION_IN, USBD_SHORT_TRANSFER_OK)
  TransferBufferLength = 00000012
  TransferBuffer       = 00000000
  TransferBufferMDL    = 8699c1d0
    00000000: 54 fd 64 01 00 ff 64 00 80 06 60 40 02 0a 10 5b
    00000010: 40 60
  UrbLink              = 00000000
[491859 ms] UsbSnoop - FilterDispatchAny(b9c8efd2) : IRP_MJ_INTERNAL_DEVICE_CONTROL
[491859 ms] UsbSnoop - FdoHookDispatchInternalIoctl(b9c8f1ea) : fdo=858af400, Irp=858a3008, IRQL=0
[491859 ms]  >>>  URB 62 going down  >>> 
-- URB_FUNCTION_BULK_OR_INTERRUPT_TRANSFER:
  PipeHandle           = 869bbb5c [endpoint 0x00000081]
  TransferFlags        = 00000003 (USBD_TRANSFER_DIRECTION_IN, USBD_SHORT_TRANSFER_OK)
  TransferBufferLength = 00000200
  TransferBuffer       = 00000000
  TransferBufferMDL    = 8699c1d0
  UrbLink              = 00000000
[491867 ms] UsbSnoop - MyInternalIOCTLCompletion(b9c8f126) : fido=86aef2a0, Irp=858a3008, Context=85d29868, IRQL=2
[491867 ms]  <<<  URB 62 coming back  <<< 
-- URB_FUNCTION_BULK_OR_INTERRUPT_TRANSFER:
  PipeHandle           = 869bbb5c [endpoint 0x00000081]
  TransferFlags        = 00000003 (USBD_TRANSFER_DIRECTION_IN, USBD_SHORT_TRANSFER_OK)
  TransferBufferLength = 00000026
  TransferBuffer       = 00000000
  TransferBufferMDL    = 8699c1d0
    00000000: 54 fd 64 01 40 60 64 00 80 06 d0 9f 16 00 0c d1
    00000010: 10 00 13 46 6f 6c 64 65 72 31 00 00 00 00 00 00
    00000020: 00 00 0d b1 01 00
  UrbLink              = 00000000
[491867 ms] UsbSnoop - FilterDispatchAny(b9c8efd2) : IRP_MJ_INTERNAL_DEVICE_CONTROL
[491867 ms] UsbSnoop - FdoHookDispatchInternalIoctl(b9c8f1ea) : fdo=858af400, Irp=858a3008, IRQL=0
[491867 ms]  >>>  URB 63 going down  >>> 
-- URB_FUNCTION_BULK_OR_INTERRUPT_TRANSFER:
  PipeHandle           = 869bbb5c [endpoint 0x00000081]
  TransferFlags        = 00000003 (USBD_TRANSFER_DIRECTION_IN, USBD_SHORT_TRANSFER_OK)
  TransferBufferLength = 00000200
  TransferBuffer       = 00000000
  TransferBufferMDL    = 8699c1d0
  UrbLink              = 00000000
[491867 ms] UsbSnoop - FilterDispatchAny(b9c8efd2) : IRP_MJ_INTERNAL_DEVICE_CONTROL
[491867 ms] UsbSnoop - FdoHookDispatchInternalIoctl(b9c8f1ea) : fdo=858af400, Irp=86ab8990, IRQL=0
[491867 ms]  >>>  URB 64 going down  >>> 
-- URB_FUNCTION_BULK_OR_INTERRUPT_TRANSFER:
  PipeHandle           = 869bbb7c [endpoint 0x00000002]
  TransferFlags        = 00000002 (USBD_TRANSFER_DIRECTION_OUT, USBD_SHORT_TRANSFER_OK)
  TransferBufferLength = 00000012
  TransferBuffer       = 00000000
  TransferBufferMDL    = 85dc78f8
    00000000: 54 fd 64 00 00 ff 64 01 40 60 06 80 02 0a 0c 57
    00000010: 80 06
  UrbLink              = 00000000
[491868 ms] UsbSnoop - MyInternalIOCTLCompletion(b9c8f126) : fido=86aef2a0, Irp=86ab8990, Context=858bc360, IRQL=2
[491868 ms]  <<<  URB 64 coming back  <<< 
-- URB_FUNCTION_BULK_OR_INTERRUPT_TRANSFER:
  PipeHandle           = 869bbb7c [endpoint 0x00000002]
  TransferFlags        = 00000002 (USBD_TRANSFER_DIRECTION_OUT, USBD_SHORT_TRANSFER_OK)
  TransferBufferLength = 00000012
  TransferBuffer       = 00000000
  TransferBufferMDL    = 85dc78f8
  UrbLink              = 00000000
[491869 ms] UsbSnoop - FilterDispatchAny(b9c8efd2) : IRP_MJ_INTERNAL_DEVICE_CONTROL
[491869 ms] UsbSnoop - FdoHookDispatchInternalIoctl(b9c8f1ea) : fdo=858af400, Irp=86ab8990, IRQL=0
[491869 ms]  >>>  URB 65 going down  >>> 
-- URB_FUNCTION_BULK_OR_INTERRUPT_TRANSFER:
  PipeHandle           = 869bbb7c [endpoint 0x00000002]
  TransferFlags        = 00000002 (USBD_TRANSFER_DIRECTION_OUT, USBD_SHORT_TRANSFER_OK)
  TransferBufferLength = 00000011
  TransferBuffer       = 00000000
  TransferBufferMDL    = 85dc78f8
    00000000: 54 fd 64 00 80 06 64 01 40 60 0e 00 01 00 11 60
    00000010: 0e
  UrbLink              = 00000000
[491870 ms] UsbSnoop - MyInternalIOCTLCompletion(b9c8f126) : fido=86aef2a0, Irp=86ab8990, Context=858bc360, IRQL=2
[491870 ms]  <<<  URB 65 coming back  <<< 
-- URB_FUNCTION_BULK_OR_INTERRUPT_TRANSFER:
  PipeHandle           = 869bbb7c [endpoint 0x00000002]
  TransferFlags        = 00000002 (USBD_TRANSFER_DIRECTION_OUT, USBD_SHORT_TRANSFER_OK)
  TransferBufferLength = 00000011
  TransferBuffer       = 00000000
  TransferBufferMDL    = 85dc78f8
  UrbLink              = 00000000
[491871 ms] UsbSnoop - MyInternalIOCTLCompletion(b9c8f126) : fido=86aef2a0, Irp=858a3008, Context=85d29868, IRQL=2
[491871 ms]  <<<  URB 63 coming back  <<< 
-- URB_FUNCTION_BULK_OR_INTERRUPT_TRANSFER:
  PipeHandle           = 869bbb5c [endpoint 0x00000081]
  TransferFlags        = 00000003 (USBD_TRANSFER_DIRECTION_IN, USBD_SHORT_TRANSFER_OK)
  TransferBufferLength = 00000012
  TransferBuffer       = 00000000
  TransferBufferMDL    = 8699c1d0
    00000000: 54 fd 64 01 00 ff 64 00 80 06 60 40 02 0a 11 5c
    00000010: 40 60
  UrbLink              = 00000000
[491871 ms] UsbSnoop - FilterDispatchAny(b9c8efd2) : IRP_MJ_INTERNAL_DEVICE_CONTROL
[491871 ms] UsbSnoop - FdoHookDispatchInternalIoctl(b9c8f1ea) : fdo=858af400, Irp=858a3008, IRQL=0
[491871 ms]  >>>  URB 66 going down  >>> 
-- URB_FUNCTION_BULK_OR_INTERRUPT_TRANSFER:
  PipeHandle           = 869bbb5c [endpoint 0x00000081]
  TransferFlags        = 00000003 (USBD_TRANSFER_DIRECTION_IN, USBD_SHORT_TRANSFER_OK)
  TransferBufferLength = 00000200
  TransferBuffer       = 00000000
  TransferBufferMDL    = 8699c1d0
  UrbLink              = 00000000
[491875 ms] UsbSnoop - MyInternalIOCTLCompletion(b9c8f126) : fido=86aef2a0, Irp=858a3008, Context=85d29868, IRQL=2
[491875 ms]  <<<  URB 66 coming back  <<< 
-- URB_FUNCTION_BULK_OR_INTERRUPT_TRANSFER:
  PipeHandle           = 869bbb5c [endpoint 0x00000081]
  TransferFlags        = 00000003 (USBD_TRANSFER_DIRECTION_IN, USBD_SHORT_TRANSFER_OK)
  TransferBufferLength = 00000026
  TransferBuffer       = 00000000
  TransferBufferMDL    = 8699c1d0
    00000000: 54 fd 64 01 40 60 64 00 80 06 39 ed 16 00 0d 89
    00000010: 10 00 13 45 78 65 6d 70 6c 65 73 00 00 00 00 00
    00000020: 00 00 00 0b 01 00
  UrbLink              = 00000000
[491875 ms] UsbSnoop - FilterDispatchAny(b9c8efd2) : IRP_MJ_INTERNAL_DEVICE_CONTROL
[491875 ms] UsbSnoop - FdoHookDispatchInternalIoctl(b9c8f1ea) : fdo=858af400, Irp=858a3008, IRQL=0
[491875 ms]  >>>  URB 67 going down  >>> 
-- URB_FUNCTION_BULK_OR_INTERRUPT_TRANSFER:
  PipeHandle           = 869bbb5c [endpoint 0x00000081]
  TransferFlags        = 00000003 (USBD_TRANSFER_DIRECTION_IN, USBD_SHORT_TRANSFER_OK)
  TransferBufferLength = 00000200
  TransferBuffer       = 00000000
  TransferBufferMDL    = 8699c1d0
  UrbLink              = 00000000
[491875 ms] UsbSnoop - FilterDispatchAny(b9c8efd2) : IRP_MJ_INTERNAL_DEVICE_CONTROL
[491875 ms] UsbSnoop - FdoHookDispatchInternalIoctl(b9c8f1ea) : fdo=858af400, Irp=86ab87d0, IRQL=0
[491875 ms]  >>>  URB 68 going down  >>> 
-- URB_FUNCTION_BULK_OR_INTERRUPT_TRANSFER:
  PipeHandle           = 869bbb7c [endpoint 0x00000002]
  TransferFlags        = 00000002 (USBD_TRANSFER_DIRECTION_OUT, USBD_SHORT_TRANSFER_OK)
  TransferBufferLength = 00000012
  TransferBuffer       = 00000000
  TransferBufferMDL    = 8685e718
    00000000: 54 fd 64 00 00 ff 64 01 40 60 06 80 02 0a 0d 58
    00000010: 80 06
  UrbLink              = 00000000
[491876 ms] UsbSnoop - MyInternalIOCTLCompletion(b9c8f126) : fido=86aef2a0, Irp=86ab87d0, Context=858bc360, IRQL=2
[491876 ms]  <<<  URB 68 coming back  <<< 
-- URB_FUNCTION_BULK_OR_INTERRUPT_TRANSFER:
  PipeHandle           = 869bbb7c [endpoint 0x00000002]
  TransferFlags        = 00000002 (USBD_TRANSFER_DIRECTION_OUT, USBD_SHORT_TRANSFER_OK)
  TransferBufferLength = 00000012
  TransferBuffer       = 00000000
  TransferBufferMDL    = 8685e718
  UrbLink              = 00000000
[491877 ms] UsbSnoop - FilterDispatchAny(b9c8efd2) : IRP_MJ_INTERNAL_DEVICE_CONTROL
[491877 ms] UsbSnoop - FdoHookDispatchInternalIoctl(b9c8f1ea) : fdo=858af400, Irp=858afcb0, IRQL=0
[491877 ms]  >>>  URB 69 going down  >>> 
-- URB_FUNCTION_BULK_OR_INTERRUPT_TRANSFER:
  PipeHandle           = 869bbb7c [endpoint 0x00000002]
  TransferFlags        = 00000002 (USBD_TRANSFER_DIRECTION_OUT, USBD_SHORT_TRANSFER_OK)
  TransferBufferLength = 00000011
  TransferBuffer       = 00000000
  TransferBufferMDL    = 861568d0
    00000000: 54 fd 64 00 80 06 64 01 40 60 0e 00 01 00 12 61
    00000010: 0e
  UrbLink              = 00000000
[491878 ms] UsbSnoop - MyInternalIOCTLCompletion(b9c8f126) : fido=86aef2a0, Irp=858afcb0, Context=858bc360, IRQL=2
[491878 ms]  <<<  URB 69 coming back  <<< 
-- URB_FUNCTION_BULK_OR_INTERRUPT_TRANSFER:
  PipeHandle           = 869bbb7c [endpoint 0x00000002]
  TransferFlags        = 00000002 (USBD_TRANSFER_DIRECTION_OUT, USBD_SHORT_TRANSFER_OK)
  TransferBufferLength = 00000011
  TransferBuffer       = 00000000
  TransferBufferMDL    = 861568d0
  UrbLink              = 00000000
[491879 ms] UsbSnoop - MyInternalIOCTLCompletion(b9c8f126) : fido=86aef2a0, Irp=858a3008, Context=85d29868, IRQL=2
[491879 ms]  <<<  URB 67 coming back  <<< 
-- URB_FUNCTION_BULK_OR_INTERRUPT_TRANSFER:
  PipeHandle           = 869bbb5c [endpoint 0x00000081]
  TransferFlags        = 00000003 (USBD_TRANSFER_DIRECTION_IN, USBD_SHORT_TRANSFER_OK)
  TransferBufferLength = 00000012
  TransferBuffer       = 00000000
  TransferBufferMDL    = 8699c1d0
    00000000: 54 fd 64 01 00 ff 64 00 80 06 60 40 02 0a 12 5d
    00000010: 40 60
  UrbLink              = 00000000
[491879 ms] UsbSnoop - FilterDispatchAny(b9c8efd2) : IRP_MJ_INTERNAL_DEVICE_CONTROL
[491879 ms] UsbSnoop - FdoHookDispatchInternalIoctl(b9c8f1ea) : fdo=858af400, Irp=858a3008, IRQL=0
[491879 ms]  >>>  URB 70 going down  >>> 
-- URB_FUNCTION_BULK_OR_INTERRUPT_TRANSFER:
  PipeHandle           = 869bbb5c [endpoint 0x00000081]
  TransferFlags        = 00000003 (USBD_TRANSFER_DIRECTION_IN, USBD_SHORT_TRANSFER_OK)
  TransferBufferLength = 00000200
  TransferBuffer       = 00000000
  TransferBufferMDL    = 86a81650
  UrbLink              = 00000000
[491882 ms] UsbSnoop - MyInternalIOCTLCompletion(b9c8f126) : fido=86aef2a0, Irp=858a3008, Context=85d29868, IRQL=2
[491882 ms]  <<<  URB 70 coming back  <<< 
-- URB_FUNCTION_BULK_OR_INTERRUPT_TRANSFER:
  PipeHandle           = 869bbb5c [endpoint 0x00000081]
  TransferFlags        = 00000003 (USBD_TRANSFER_DIRECTION_IN, USBD_SHORT_TRANSFER_OK)
  TransferBufferLength = 00000012
  TransferBuffer       = 00000000
  TransferBufferMDL    = 86a81650
    00000000: 54 fd 64 01 40 60 64 00 80 06 11 ff 02 00 0e 60
    00000010: ff 11
  UrbLink              = 00000000
[491882 ms] UsbSnoop - FilterDispatchAny(b9c8efd2) : IRP_MJ_INTERNAL_DEVICE_CONTROL
[491882 ms] UsbSnoop - FdoHookDispatchInternalIoctl(b9c8f1ea) : fdo=858af400, Irp=858a3008, IRQL=0
[491882 ms]  >>>  URB 71 going down  >>> 
-- URB_FUNCTION_BULK_OR_INTERRUPT_TRANSFER:
  PipeHandle           = 869bbb5c [endpoint 0x00000081]
  TransferFlags        = 00000003 (USBD_TRANSFER_DIRECTION_IN, USBD_SHORT_TRANSFER_OK)
  TransferBufferLength = 00000200
  TransferBuffer       = 00000000
  TransferBufferMDL    = 8599df88
  UrbLink              = 00000000
[491882 ms] UsbSnoop - FilterDispatchAny(b9c8efd2) : IRP_MJ_INTERNAL_DEVICE_CONTROL
[491882 ms] UsbSnoop - FdoHookDispatchInternalIoctl(b9c8f1ea) : fdo=858af400, Irp=858afcb0, IRQL=0
[491882 ms]  >>>  URB 72 going down  >>> 
-- URB_FUNCTION_BULK_OR_INTERRUPT_TRANSFER:
  PipeHandle           = 869bbb7c [endpoint 0x00000002]
  TransferFlags        = 00000002 (USBD_TRANSFER_DIRECTION_OUT, USBD_SHORT_TRANSFER_OK)
  TransferBufferLength = 00000012
  TransferBuffer       = 00000000
  TransferBufferMDL    = 86477838
    00000000: 54 fd 64 00 00 ff 64 01 40 60 06 80 02 0a 0e 59
    00000010: 80 06
  UrbLink              = 00000000
[491883 ms] UsbSnoop - MyInternalIOCTLCompletion(b9c8f126) : fido=86aef2a0, Irp=858afcb0, Context=858bc360, IRQL=2
[491883 ms]  <<<  URB 72 coming back  <<< 
-- URB_FUNCTION_BULK_OR_INTERRUPT_TRANSFER:
  PipeHandle           = 869bbb7c [endpoint 0x00000002]
  TransferFlags        = 00000002 (USBD_TRANSFER_DIRECTION_OUT, USBD_SHORT_TRANSFER_OK)
  TransferBufferLength = 00000012
  TransferBuffer       = 00000000
  TransferBufferMDL    = 86477838
  UrbLink              = 00000000
[491883 ms] UsbSnoop - FilterDispatchAny(b9c8efd2) : IRP_MJ_INTERNAL_DEVICE_CONTROL
[491883 ms] UsbSnoop - FdoHookDispatchInternalIoctl(b9c8f1ea) : fdo=858af400, Irp=858afcb0, IRQL=0
[491883 ms]  >>>  URB 73 going down  >>> 
-- URB_FUNCTION_BULK_OR_INTERRUPT_TRANSFER:
  PipeHandle           = 869bbb7c [endpoint 0x00000002]
  TransferFlags        = 00000002 (USBD_TRANSFER_DIRECTION_OUT, USBD_SHORT_TRANSFER_OK)
  TransferBufferLength = 00000011
  TransferBuffer       = 00000000
  TransferBufferMDL    = 858a5dc8
    00000000: 54 fd 64 00 80 06 64 01 40 60 0f 00 01 00 13 63
    00000010: 0f
  UrbLink              = 00000000
[491884 ms] UsbSnoop - MyInternalIOCTLCompletion(b9c8f126) : fido=86aef2a0, Irp=858afcb0, Context=858bc360, IRQL=2
[491884 ms]  <<<  URB 73 coming back  <<< 
-- URB_FUNCTION_BULK_OR_INTERRUPT_TRANSFER:
  PipeHandle           = 869bbb7c [endpoint 0x00000002]
  TransferFlags        = 00000002 (USBD_TRANSFER_DIRECTION_OUT, USBD_SHORT_TRANSFER_OK)
  TransferBufferLength = 00000011
  TransferBuffer       = 00000000
  TransferBufferMDL    = 858a5dc8
  UrbLink              = 00000000
[491886 ms] UsbSnoop - MyInternalIOCTLCompletion(b9c8f126) : fido=86aef2a0, Irp=858a3008, Context=85d29868, IRQL=2
[491886 ms]  <<<  URB 71 coming back  <<< 
-- URB_FUNCTION_BULK_OR_INTERRUPT_TRANSFER:
  PipeHandle           = 869bbb5c [endpoint 0x00000081]
  TransferFlags        = 00000003 (USBD_TRANSFER_DIRECTION_IN, USBD_SHORT_TRANSFER_OK)
  TransferBufferLength = 00000012
  TransferBuffer       = 00000000
  TransferBufferMDL    = 8599df88
    00000000: 54 fd 64 01 00 ff 64 00 80 06 60 40 02 0a 13 5e
    00000010: 40 60
  UrbLink              = 00000000
[491886 ms] UsbSnoop - FilterDispatchAny(b9c8efd2) : IRP_MJ_INTERNAL_DEVICE_CONTROL
[491886 ms] UsbSnoop - FdoHookDispatchInternalIoctl(b9c8f1ea) : fdo=858af400, Irp=858a3008, IRQL=0
[491886 ms]  >>>  URB 74 going down  >>> 
-- URB_FUNCTION_BULK_OR_INTERRUPT_TRANSFER:
  PipeHandle           = 869bbb5c [endpoint 0x00000081]
  TransferFlags        = 00000003 (USBD_TRANSFER_DIRECTION_IN, USBD_SHORT_TRANSFER_OK)
  TransferBufferLength = 00000200
  TransferBuffer       = 00000000
  TransferBufferMDL    = 861186f0
  UrbLink              = 00000000
[491889 ms] UsbSnoop - MyInternalIOCTLCompletion(b9c8f126) : fido=86aef2a0, Irp=858a3008, Context=85d29868, IRQL=2
[491889 ms]  <<<  URB 74 coming back  <<< 
-- URB_FUNCTION_BULK_OR_INTERRUPT_TRANSFER:
  PipeHandle           = 869bbb5c [endpoint 0x00000081]
  TransferFlags        = 00000003 (USBD_TRANSFER_DIRECTION_IN, USBD_SHORT_TRANSFER_OK)
  TransferBufferLength = 00000012
  TransferBuffer       = 00000000
  TransferBufferMDL    = 861186f0
    00000000: 54 fd 64 01 40 60 64 00 80 06 00 ff 02 00 0f 50
    00000010: ff 00
  UrbLink              = 00000000
[491889 ms] UsbSnoop - FilterDispatchAny(b9c8efd2) : IRP_MJ_INTERNAL_DEVICE_CONTROL
[491889 ms] UsbSnoop - FdoHookDispatchInternalIoctl(b9c8f1ea) : fdo=858af400, Irp=858a3008, IRQL=0
[491889 ms]  >>>  URB 75 going down  >>> 
-- URB_FUNCTION_BULK_OR_INTERRUPT_TRANSFER:
  PipeHandle           = 869bbb5c [endpoint 0x00000081]
  TransferFlags        = 00000003 (USBD_TRANSFER_DIRECTION_IN, USBD_SHORT_TRANSFER_OK)
  TransferBufferLength = 00000200
  TransferBuffer       = 00000000
  TransferBufferMDL    = 85c65800
  UrbLink              = 00000000
[491889 ms] UsbSnoop - FilterDispatchAny(b9c8efd2) : IRP_MJ_INTERNAL_DEVICE_CONTROL
[491889 ms] UsbSnoop - FdoHookDispatchInternalIoctl(b9c8f1ea) : fdo=858af400, Irp=858afcb0, IRQL=0
[491889 ms]  >>>  URB 76 going down  >>> 
-- URB_FUNCTION_BULK_OR_INTERRUPT_TRANSFER:
  PipeHandle           = 869bbb7c [endpoint 0x00000002]
  TransferFlags        = 00000002 (USBD_TRANSFER_DIRECTION_OUT, USBD_SHORT_TRANSFER_OK)
  TransferBufferLength = 00000012
  TransferBuffer       = 00000000
  TransferBufferMDL    = 86ad1150
    00000000: 54 fd 64 00 00 ff 64 01 40 60 06 80 02 0a 0f 5a
    00000010: 80 06
  UrbLink              = 00000000
[491890 ms] UsbSnoop - MyInternalIOCTLCompletion(b9c8f126) : fido=86aef2a0, Irp=858afcb0, Context=858bc360, IRQL=2
[491890 ms]  <<<  URB 76 coming back  <<< 
-- URB_FUNCTION_BULK_OR_INTERRUPT_TRANSFER:
  PipeHandle           = 869bbb7c [endpoint 0x00000002]
  TransferFlags        = 00000002 (USBD_TRANSFER_DIRECTION_OUT, USBD_SHORT_TRANSFER_OK)
  TransferBufferLength = 00000012
  TransferBuffer       = 00000000
  TransferBufferMDL    = 86ad1150
  UrbLink              = 00000000
[491891 ms] UsbSnoop - FilterDispatchAny(b9c8efd2) : IRP_MJ_INTERNAL_DEVICE_CONTROL
[491891 ms] UsbSnoop - FdoHookDispatchInternalIoctl(b9c8f1ea) : fdo=858af400, Irp=858afcb0, IRQL=0
[491891 ms]  >>>  URB 77 going down  >>> 
-- URB_FUNCTION_BULK_OR_INTERRUPT_TRANSFER:
  PipeHandle           = 869bbb7c [endpoint 0x00000002]
  TransferFlags        = 00000002 (USBD_TRANSFER_DIRECTION_OUT, USBD_SHORT_TRANSFER_OK)
  TransferBufferLength = 00000012
  TransferBuffer       = 00000000
  TransferBufferMDL    = 85b82b60
    00000000: 54 fd 64 00 40 de 64 01 40 60 06 80 02 00 14 74
    00000010: 80 06
  UrbLink              = 00000000
[491892 ms] UsbSnoop - MyInternalIOCTLCompletion(b9c8f126) : fido=86aef2a0, Irp=858afcb0, Context=858bc360, IRQL=2
[491892 ms]  <<<  URB 77 coming back  <<< 
-- URB_FUNCTION_BULK_OR_INTERRUPT_TRANSFER:
  PipeHandle           = 869bbb7c [endpoint 0x00000002]
  TransferFlags        = 00000002 (USBD_TRANSFER_DIRECTION_OUT, USBD_SHORT_TRANSFER_OK)
  TransferBufferLength = 00000012
  TransferBuffer       = 00000000
  TransferBufferMDL    = 85b82b60
  UrbLink              = 00000000
[491894 ms] UsbSnoop - MyInternalIOCTLCompletion(b9c8f126) : fido=86aef2a0, Irp=858a3008, Context=85d29868, IRQL=2
[491894 ms]  <<<  URB 75 coming back  <<< 
-- URB_FUNCTION_BULK_OR_INTERRUPT_TRANSFER:
  PipeHandle           = 869bbb5c [endpoint 0x00000081]
  TransferFlags        = 00000003 (USBD_TRANSFER_DIRECTION_IN, USBD_SHORT_TRANSFER_OK)
  TransferBufferLength = 00000012
  TransferBuffer       = 00000000
  TransferBufferMDL    = 85c65800
    00000000: 54 fd 64 01 00 ff 64 00 80 06 60 40 02 0a 14 5f
    00000010: 40 60
  UrbLink              = 00000000
[491894 ms] UsbSnoop - FilterDispatchAny(b9c8efd2) : IRP_MJ_INTERNAL_DEVICE_CONTROL
[491894 ms] UsbSnoop - FdoHookDispatchInternalIoctl(b9c8f1ea) : fdo=858af400, Irp=86ab87d0, IRQL=0
[491895 ms]  >>>  URB 78 going down  >>> 
-- URB_FUNCTION_BULK_OR_INTERRUPT_TRANSFER:
  PipeHandle           = 869bbb5c [endpoint 0x00000081]
  TransferFlags        = 00000003 (USBD_TRANSFER_DIRECTION_IN, USBD_SHORT_TRANSFER_OK)
  TransferBufferLength = 00000200
  TransferBuffer       = 00000000
  TransferBufferMDL    = 85b82b60
  UrbLink              = 00000000
[491957 ms] UsbSnoop - FilterDispatchAny(b9c8efd2) : IRP_MJ_INTERNAL_DEVICE_CONTROL
[491957 ms] UsbSnoop - FdoHookDispatchInternalIoctl(b9c8f1ea) : fdo=858af400, Irp=858afcb0, IRQL=0
[491957 ms]  >>>  URB 79 going down  >>> 
-- URB_FUNCTION_BULK_OR_INTERRUPT_TRANSFER:
  PipeHandle           = 869bbb7c [endpoint 0x00000002]
  TransferFlags        = 00000002 (USBD_TRANSFER_DIRECTION_OUT, USBD_SHORT_TRANSFER_OK)
  TransferBufferLength = 00000011
  TransferBuffer       = 00000000
  TransferBufferMDL    = 863a36f8
    00000000: 54 fd 64 00 80 07 64 01 40 20 01 00 01 00 15 18
    00000010: 01
  UrbLink              = 00000000
[491958 ms] UsbSnoop - MyInternalIOCTLCompletion(b9c8f126) : fido=86aef2a0, Irp=858afcb0, Context=858bc360, IRQL=2
[491958 ms]  <<<  URB 79 coming back  <<< 
-- URB_FUNCTION_BULK_OR_INTERRUPT_TRANSFER:
  PipeHandle           = 869bbb7c [endpoint 0x00000002]
  TransferFlags        = 00000002 (USBD_TRANSFER_DIRECTION_OUT, USBD_SHORT_TRANSFER_OK)
  TransferBufferLength = 00000011
  TransferBuffer       = 00000000
  TransferBufferMDL    = 863a36f8
  UrbLink              = 00000000
[491959 ms] UsbSnoop - MyInternalIOCTLCompletion(b9c8f126) : fido=86aef2a0, Irp=86ab87d0, Context=85d29868, IRQL=2
[491959 ms]  <<<  URB 78 coming back  <<< 
-- URB_FUNCTION_BULK_OR_INTERRUPT_TRANSFER:
  PipeHandle           = 869bbb5c [endpoint 0x00000081]
  TransferFlags        = 00000003 (USBD_TRANSFER_DIRECTION_IN, USBD_SHORT_TRANSFER_OK)
  TransferBufferLength = 00000012
  TransferBuffer       = 00000000
  TransferBufferMDL    = 85b82b60
    00000000: 54 fd 64 01 00 ff 64 00 80 07 20 40 02 0a 15 21
    00000010: 40 20
  UrbLink              = 00000000
[491959 ms] UsbSnoop - FilterDispatchAny(b9c8efd2) : IRP_MJ_INTERNAL_DEVICE_CONTROL
[491959 ms] UsbSnoop - FdoHookDispatchInternalIoctl(b9c8f1ea) : fdo=858af400, Irp=86ab87d0, IRQL=0
[491959 ms]  >>>  URB 80 going down  >>> 
-- URB_FUNCTION_BULK_OR_INTERRUPT_TRANSFER:
  PipeHandle           = 869bbb5c [endpoint 0x00000081]
  TransferFlags        = 00000003 (USBD_TRANSFER_DIRECTION_IN, USBD_SHORT_TRANSFER_OK)
  TransferBufferLength = 00000200
  TransferBuffer       = 00000000
  TransferBufferMDL    = 85b82b60
  UrbLink              = 00000000
[491971 ms] UsbSnoop - MyInternalIOCTLCompletion(b9c8f126) : fido=86aef2a0, Irp=86ab87d0, Context=85d29868, IRQL=2
[491971 ms]  <<<  URB 80 coming back  <<< 
-- URB_FUNCTION_BULK_OR_INTERRUPT_TRANSFER:
  PipeHandle           = 869bbb5c [endpoint 0x00000081]
  TransferFlags        = 00000003 (USBD_TRANSFER_DIRECTION_IN, USBD_SHORT_TRANSFER_OK)
  TransferBufferLength = 0000007f
  TransferBuffer       = 00000000
  TransferBufferMDL    = 85b82b60
    00000000: 54 fd 64 01 40 20 64 00 80 07 b6 f3 6f 00 10 29
    00000010: 01 00 00 00 00 01 65 8c 00 00 00 00 00 01 be 00
    00000020: 00 00 00 00 00 01 5b 16 b4 00 00 00 00 01 83 5f
    00000030: 2c 7f 00 00 5a 01 01 24 25 01 01 22 d4 01 01 23
    00000040: 15 00 00 00 00 00 02 00 00 00 00 01 40 00 f0 04
    00000050: 00 1e 30 30 30 30 34 42 43 31 42 31 30 45 35 37
    00000060: 30 46 00 30 45 30 30 30 30 30 34 42 43 31 42 31
    00000070: 30 45 35 37 30 46 43 42 32 38 30 34 46 31 00
  UrbLink              = 00000000
[491971 ms] UsbSnoop - FilterDispatchAny(b9c8efd2) : IRP_MJ_INTERNAL_DEVICE_CONTROL
[491971 ms] UsbSnoop - FdoHookDispatchInternalIoctl(b9c8f1ea) : fdo=858af400, Irp=86ab87d0, IRQL=0
[491971 ms]  >>>  URB 81 going down  >>> 
-- URB_FUNCTION_BULK_OR_INTERRUPT_TRANSFER:
  PipeHandle           = 869bbb5c [endpoint 0x00000081]
  TransferFlags        = 00000003 (USBD_TRANSFER_DIRECTION_IN, USBD_SHORT_TRANSFER_OK)
  TransferBufferLength = 00000200
  TransferBuffer       = 00000000
  TransferBufferMDL    = 85b82b60
  UrbLink              = 00000000
[491971 ms] UsbSnoop - FilterDispatchAny(b9c8efd2) : IRP_MJ_INTERNAL_DEVICE_CONTROL
[491971 ms] UsbSnoop - FdoHookDispatchInternalIoctl(b9c8f1ea) : fdo=858af400, Irp=86ab99f0, IRQL=0
[491971 ms]  >>>  URB 82 going down  >>> 
-- URB_FUNCTION_BULK_OR_INTERRUPT_TRANSFER:
  PipeHandle           = 869bbb7c [endpoint 0x00000002]
  TransferFlags        = 00000002 (USBD_TRANSFER_DIRECTION_OUT, USBD_SHORT_TRANSFER_OK)
  TransferBufferLength = 00000012
  TransferBuffer       = 00000000
  TransferBufferMDL    = 85d397c0
    00000000: 54 fd 64 00 00 ff 64 01 40 20 07 80 02 0a 10 1c
    00000010: 80 07
  UrbLink              = 00000000
[491972 ms] UsbSnoop - MyInternalIOCTLCompletion(b9c8f126) : fido=86aef2a0, Irp=86ab99f0, Context=858bc360, IRQL=2
[491972 ms]  <<<  URB 82 coming back  <<< 
-- URB_FUNCTION_BULK_OR_INTERRUPT_TRANSFER:
  PipeHandle           = 869bbb7c [endpoint 0x00000002]
  TransferFlags        = 00000002 (USBD_TRANSFER_DIRECTION_OUT, USBD_SHORT_TRANSFER_OK)
  TransferBufferLength = 00000012
  TransferBuffer       = 00000000
  TransferBufferMDL    = 85d397c0
  UrbLink              = 00000000
[491972 ms] UsbSnoop - FilterDispatchAny(b9c8efd2) : IRP_MJ_INTERNAL_DEVICE_CONTROL
[491972 ms] UsbSnoop - FdoHookDispatchInternalIoctl(b9c8f1ea) : fdo=858af400, Irp=85c217f8, IRQL=0
[491972 ms]  >>>  URB 83 going down  >>> 
-- URB_FUNCTION_BULK_OR_INTERRUPT_TRANSFER:
  PipeHandle           = 869bbb7c [endpoint 0x00000002]
  TransferFlags        = 00000002 (USBD_TRANSFER_DIRECTION_OUT, USBD_SHORT_TRANSFER_OK)
  TransferBufferLength = 00000011
  TransferBuffer       = 00000000
  TransferBufferMDL    = 864ec838
    00000000: 54 fd 64 00 80 07 64 01 40 20 02 00 01 00 16 1a
    00000010: 02
  UrbLink              = 00000000
[491973 ms] UsbSnoop - MyInternalIOCTLCompletion(b9c8f126) : fido=86aef2a0, Irp=85c217f8, Context=858bc360, IRQL=2
[491973 ms]  <<<  URB 83 coming back  <<< 
-- URB_FUNCTION_BULK_OR_INTERRUPT_TRANSFER:
  PipeHandle           = 869bbb7c [endpoint 0x00000002]
  TransferFlags        = 00000002 (USBD_TRANSFER_DIRECTION_OUT, USBD_SHORT_TRANSFER_OK)
  TransferBufferLength = 00000011
  TransferBuffer       = 00000000
  TransferBufferMDL    = 864ec838
  UrbLink              = 00000000
[491974 ms] UsbSnoop - MyInternalIOCTLCompletion(b9c8f126) : fido=86aef2a0, Irp=86ab87d0, Context=85d29868, IRQL=2
[491974 ms]  <<<  URB 81 coming back  <<< 
-- URB_FUNCTION_BULK_OR_INTERRUPT_TRANSFER:
  PipeHandle           = 869bbb5c [endpoint 0x00000081]
  TransferFlags        = 00000003 (USBD_TRANSFER_DIRECTION_IN, USBD_SHORT_TRANSFER_OK)
  TransferBufferLength = 00000012
  TransferBuffer       = 00000000
  TransferBufferMDL    = 85b82b60
    00000000: 54 fd 64 01 00 ff 64 00 80 07 20 40 02 0a 16 22
    00000010: 40 20
  UrbLink              = 00000000
[491974 ms] UsbSnoop - FilterDispatchAny(b9c8efd2) : IRP_MJ_INTERNAL_DEVICE_CONTROL
[491974 ms] UsbSnoop - FdoHookDispatchInternalIoctl(b9c8f1ea) : fdo=858af400, Irp=86ab87d0, IRQL=0
[491974 ms]  >>>  URB 84 going down  >>> 
-- URB_FUNCTION_BULK_OR_INTERRUPT_TRANSFER:
  PipeHandle           = 869bbb5c [endpoint 0x00000081]
  TransferFlags        = 00000003 (USBD_TRANSFER_DIRECTION_IN, USBD_SHORT_TRANSFER_OK)
  TransferBufferLength = 00000200
  TransferBuffer       = 00000000
  TransferBufferMDL    = 85b82b60
  UrbLink              = 00000000
[491979 ms] UsbSnoop - MyInternalIOCTLCompletion(b9c8f126) : fido=86aef2a0, Irp=86ab87d0, Context=85d29868, IRQL=2
[491979 ms]  <<<  URB 84 coming back  <<< 
-- URB_FUNCTION_BULK_OR_INTERRUPT_TRANSFER:
  PipeHandle           = 869bbb5c [endpoint 0x00000081]
  TransferFlags        = 00000003 (USBD_TRANSFER_DIRECTION_IN, USBD_SHORT_TRANSFER_OK)
  TransferBufferLength = 0000001b
  TransferBuffer       = 00000000
  TransferBufferMDL    = 85b82b60
    00000000: 54 fd 64 01 40 20 64 00 80 07 38 5a 0b 00 11 af
    00000010: 02 54 49 2d 4e 73 70 69 72 65 00
  UrbLink              = 00000000
[491979 ms] UsbSnoop - FilterDispatchAny(b9c8efd2) : IRP_MJ_INTERNAL_DEVICE_CONTROL
[491979 ms] UsbSnoop - FdoHookDispatchInternalIoctl(b9c8f1ea) : fdo=858af400, Irp=86ab87d0, IRQL=0
[491979 ms]  >>>  URB 85 going down  >>> 
-- URB_FUNCTION_BULK_OR_INTERRUPT_TRANSFER:
  PipeHandle           = 869bbb5c [endpoint 0x00000081]
  TransferFlags        = 00000003 (USBD_TRANSFER_DIRECTION_IN, USBD_SHORT_TRANSFER_OK)
  TransferBufferLength = 00000200
  TransferBuffer       = 00000000
  TransferBufferMDL    = 85b82b60
  UrbLink              = 00000000
[491979 ms] UsbSnoop - FilterDispatchAny(b9c8efd2) : IRP_MJ_INTERNAL_DEVICE_CONTROL
[491979 ms] UsbSnoop - FdoHookDispatchInternalIoctl(b9c8f1ea) : fdo=858af400, Irp=85917458, IRQL=0
[491979 ms]  >>>  URB 86 going down  >>> 
-- URB_FUNCTION_BULK_OR_INTERRUPT_TRANSFER:
  PipeHandle           = 869bbb7c [endpoint 0x00000002]
  TransferFlags        = 00000002 (USBD_TRANSFER_DIRECTION_OUT, USBD_SHORT_TRANSFER_OK)
  TransferBufferLength = 00000012
  TransferBuffer       = 00000000
  TransferBufferMDL    = 86ae6150
    00000000: 54 fd 64 00 00 ff 64 01 40 20 07 80 02 0a 11 1d
    00000010: 80 07
  UrbLink              = 00000000
[491980 ms] UsbSnoop - MyInternalIOCTLCompletion(b9c8f126) : fido=86aef2a0, Irp=85917458, Context=858bc360, IRQL=2
[491980 ms]  <<<  URB 86 coming back  <<< 
-- URB_FUNCTION_BULK_OR_INTERRUPT_TRANSFER:
  PipeHandle           = 869bbb7c [endpoint 0x00000002]
  TransferFlags        = 00000002 (USBD_TRANSFER_DIRECTION_OUT, USBD_SHORT_TRANSFER_OK)
  TransferBufferLength = 00000012
  TransferBuffer       = 00000000
  TransferBufferMDL    = 86ae6150
  UrbLink              = 00000000
[491980 ms] UsbSnoop - FilterDispatchAny(b9c8efd2) : IRP_MJ_INTERNAL_DEVICE_CONTROL
[491980 ms] UsbSnoop - FdoHookDispatchInternalIoctl(b9c8f1ea) : fdo=858af400, Irp=86a1d008, IRQL=0
[491980 ms]  >>>  URB 87 going down  >>> 
-- URB_FUNCTION_BULK_OR_INTERRUPT_TRANSFER:
  PipeHandle           = 869bbb7c [endpoint 0x00000002]
  TransferFlags        = 00000002 (USBD_TRANSFER_DIRECTION_OUT, USBD_SHORT_TRANSFER_OK)
  TransferBufferLength = 00000011
  TransferBuffer       = 00000000
  TransferBufferMDL    = 863fd838
    00000000: 54 fd 64 00 80 07 64 01 40 20 03 00 01 00 17 1c
    00000010: 03
  UrbLink              = 00000000
[491981 ms] UsbSnoop - MyInternalIOCTLCompletion(b9c8f126) : fido=86aef2a0, Irp=86a1d008, Context=858bc360, IRQL=2
[491981 ms]  <<<  URB 87 coming back  <<< 
-- URB_FUNCTION_BULK_OR_INTERRUPT_TRANSFER:
  PipeHandle           = 869bbb7c [endpoint 0x00000002]
  TransferFlags        = 00000002 (USBD_TRANSFER_DIRECTION_OUT, USBD_SHORT_TRANSFER_OK)
  TransferBufferLength = 00000011
  TransferBuffer       = 00000000
  TransferBufferMDL    = 863fd838
  UrbLink              = 00000000
[491983 ms] UsbSnoop - MyInternalIOCTLCompletion(b9c8f126) : fido=86aef2a0, Irp=86ab87d0, Context=85d29868, IRQL=2
[491983 ms]  <<<  URB 85 coming back  <<< 
-- URB_FUNCTION_BULK_OR_INTERRUPT_TRANSFER:
  PipeHandle           = 869bbb5c [endpoint 0x00000081]
  TransferFlags        = 00000003 (USBD_TRANSFER_DIRECTION_IN, USBD_SHORT_TRANSFER_OK)
  TransferBufferLength = 00000012
  TransferBuffer       = 00000000
  TransferBufferMDL    = 85b82b60
    00000000: 54 fd 64 01 00 ff 64 00 80 07 20 40 02 0a 17 23
    00000010: 40 20
  UrbLink              = 00000000
[491983 ms] UsbSnoop - FilterDispatchAny(b9c8efd2) : IRP_MJ_INTERNAL_DEVICE_CONTROL
[491983 ms] UsbSnoop - FdoHookDispatchInternalIoctl(b9c8f1ea) : fdo=858af400, Irp=86ab87d0, IRQL=0
[491983 ms]  >>>  URB 88 going down  >>> 
-- URB_FUNCTION_BULK_OR_INTERRUPT_TRANSFER:
  PipeHandle           = 869bbb5c [endpoint 0x00000081]
  TransferFlags        = 00000003 (USBD_TRANSFER_DIRECTION_IN, USBD_SHORT_TRANSFER_OK)
  TransferBufferLength = 00000200
  TransferBuffer       = 00000000
  TransferBufferMDL    = 85b82b60
  UrbLink              = 00000000
[491987 ms] UsbSnoop - MyInternalIOCTLCompletion(b9c8f126) : fido=86aef2a0, Irp=86ab87d0, Context=85d29868, IRQL=2
[491987 ms]  <<<  URB 88 coming back  <<< 
-- URB_FUNCTION_BULK_OR_INTERRUPT_TRANSFER:
  PipeHandle           = 869bbb5c [endpoint 0x00000081]
  TransferFlags        = 00000003 (USBD_TRANSFER_DIRECTION_IN, USBD_SHORT_TRANSFER_OK)
  TransferBufferLength = 0000001b
  TransferBuffer       = 00000000
  TransferBufferMDL    = 85b82b60
    00000000: 54 fd 64 01 40 20 64 00 80 07 96 7f 0b 00 12 33
    00000010: 03 2e 74 6e 73 00 2e 74 6e 6f 00
  UrbLink              = 00000000
[491987 ms] UsbSnoop - FilterDispatchAny(b9c8efd2) : IRP_MJ_INTERNAL_DEVICE_CONTROL
[491987 ms] UsbSnoop - FdoHookDispatchInternalIoctl(b9c8f1ea) : fdo=858af400, Irp=86ab87d0, IRQL=0
[491987 ms]  >>>  URB 89 going down  >>> 
-- URB_FUNCTION_BULK_OR_INTERRUPT_TRANSFER:
  PipeHandle           = 869bbb5c [endpoint 0x00000081]
  TransferFlags        = 00000003 (USBD_TRANSFER_DIRECTION_IN, USBD_SHORT_TRANSFER_OK)
  TransferBufferLength = 00000200
  TransferBuffer       = 00000000
  TransferBufferMDL    = 85b82b60
  UrbLink              = 00000000
[491987 ms] UsbSnoop - FilterDispatchAny(b9c8efd2) : IRP_MJ_INTERNAL_DEVICE_CONTROL
[491987 ms] UsbSnoop - FdoHookDispatchInternalIoctl(b9c8f1ea) : fdo=858af400, Irp=858a3e48, IRQL=0
[491987 ms]  >>>  URB 90 going down  >>> 
-- URB_FUNCTION_BULK_OR_INTERRUPT_TRANSFER:
  PipeHandle           = 869bbb7c [endpoint 0x00000002]
  TransferFlags        = 00000002 (USBD_TRANSFER_DIRECTION_OUT, USBD_SHORT_TRANSFER_OK)
  TransferBufferLength = 00000012
  TransferBuffer       = 00000000
  TransferBufferMDL    = 85b66b70
    00000000: 54 fd 64 00 00 ff 64 01 40 20 07 80 02 0a 12 1e
    00000010: 80 07
  UrbLink              = 00000000
[491988 ms] UsbSnoop - MyInternalIOCTLCompletion(b9c8f126) : fido=86aef2a0, Irp=858a3e48, Context=858bc360, IRQL=2
[491988 ms]  <<<  URB 90 coming back  <<< 
-- URB_FUNCTION_BULK_OR_INTERRUPT_TRANSFER:
  PipeHandle           = 869bbb7c [endpoint 0x00000002]
  TransferFlags        = 00000002 (USBD_TRANSFER_DIRECTION_OUT, USBD_SHORT_TRANSFER_OK)
  TransferBufferLength = 00000012
  TransferBuffer       = 00000000
  TransferBufferMDL    = 85b66b70
  UrbLink              = 00000000
[491988 ms] UsbSnoop - FilterDispatchAny(b9c8efd2) : IRP_MJ_INTERNAL_DEVICE_CONTROL
[491988 ms] UsbSnoop - FdoHookDispatchInternalIoctl(b9c8f1ea) : fdo=858af400, Irp=858a3e48, IRQL=0
[491988 ms]  >>>  URB 91 going down  >>> 
-- URB_FUNCTION_BULK_OR_INTERRUPT_TRANSFER:
  PipeHandle           = 869bbb7c [endpoint 0x00000002]
  TransferFlags        = 00000002 (USBD_TRANSFER_DIRECTION_OUT, USBD_SHORT_TRANSFER_OK)
  TransferBufferLength = 00000012
  TransferBuffer       = 00000000
  TransferBufferMDL    = 85b66b70
    00000000: 54 fd 64 00 40 de 64 01 40 20 07 80 02 00 18 39
    00000010: 80 07
  UrbLink              = 00000000
[491989 ms] UsbSnoop - MyInternalIOCTLCompletion(b9c8f126) : fido=86aef2a0, Irp=858a3e48, Context=858bc360, IRQL=2
[491989 ms]  <<<  URB 91 coming back  <<< 
-- URB_FUNCTION_BULK_OR_INTERRUPT_TRANSFER:
  PipeHandle           = 869bbb7c [endpoint 0x00000002]
  TransferFlags        = 00000002 (USBD_TRANSFER_DIRECTION_OUT, USBD_SHORT_TRANSFER_OK)
  TransferBufferLength = 00000012
  TransferBuffer       = 00000000
  TransferBufferMDL    = 85b66b70
  UrbLink              = 00000000
[491991 ms] UsbSnoop - MyInternalIOCTLCompletion(b9c8f126) : fido=86aef2a0, Irp=86ab87d0, Context=85d29868, IRQL=2
[491991 ms]  <<<  URB 89 coming back  <<< 
-- URB_FUNCTION_BULK_OR_INTERRUPT_TRANSFER:
  PipeHandle           = 869bbb5c [endpoint 0x00000081]
  TransferFlags        = 00000003 (USBD_TRANSFER_DIRECTION_IN, USBD_SHORT_TRANSFER_OK)
  TransferBufferLength = 00000012
  TransferBuffer       = 00000000
  TransferBufferMDL    = 85b82b60
    00000000: 54 fd 64 01 00 ff 64 00 80 07 20 40 02 0a 18 24
    00000010: 40 20
  UrbLink              = 00000000
[491991 ms] UsbSnoop - FilterDispatchAny(b9c8efd2) : IRP_MJ_INTERNAL_DEVICE_CONTROL
[491991 ms] UsbSnoop - FdoHookDispatchInternalIoctl(b9c8f1ea) : fdo=858af400, Irp=86ab87d0, IRQL=0
[491991 ms]  >>>  URB 92 going down  >>> 
-- URB_FUNCTION_BULK_OR_INTERRUPT_TRANSFER:
  PipeHandle           = 869bbb5c [endpoint 0x00000081]
  TransferFlags        = 00000003 (USBD_TRANSFER_DIRECTION_IN, USBD_SHORT_TRANSFER_OK)
  TransferBufferLength = 00000200
  TransferBuffer       = 00000000
  TransferBufferMDL    = 85b82b60
  UrbLink              = 00000000
[494579 ms] UsbSnoop - MyInternalIOCTLCompletion(b9c8f126) : fido=86aef2a0, Irp=86ab87d0, Context=85d29868, IRQL=2
[494579 ms]  <<<  URB 92 coming back  <<< 
-- URB_FUNCTION_BULK_OR_INTERRUPT_TRANSFER:
  PipeHandle           = 869bbb5c [endpoint 0x00000081]
  TransferFlags        = 00000003 (USBD_TRANSFER_DIRECTION_IN, USBD_SHORT_TRANSFER_OK)
  TransferBufferLength = 00000000
  TransferBuffer       = 00000000
  TransferBufferMDL    = 85b82b60
  UrbLink              = 00000000
