[1077844 ms] UsbSnoop - FilterDispatchAny(b9c8efd2) : IRP_MJ_INTERNAL_DEVICE_CONTROL
[1077844 ms] UsbSnoop - FdoHookDispatchInternalIoctl(b9c8f1ea) : fdo=86ab8658, Irp=8606a560, IRQL=0
[1077844 ms]  >>>  URB 5 going down  >>> 
-- URB_FUNCTION_VENDOR_DEVICE:
  TransferFlags          = 00000002 (USBD_TRANSFER_DIRECTION_OUT, USBD_SHORT_TRANSFER_OK)
  TransferBufferLength = 00000000
  TransferBuffer       = 00000000
  TransferBufferMDL    = 00000000

    no data supplied
  UrbLink                 = 00000000
  RequestTypeReservedBits = 00000000
  Request                 = 000000bb
  Value                   = 00000000
  Index                   = 00000000
[1077845 ms] UsbSnoop - MyInternalIOCTLCompletion(b9c8f126) : fido=858a9248, Irp=8606a560, Context=858bc360, IRQL=2
[1077845 ms]  <<<  URB 5 coming back  <<< 
-- URB_FUNCTION_CONTROL_TRANSFER:
  PipeHandle           = 86a11ee8
  TransferFlags        = 0000000a (USBD_TRANSFER_DIRECTION_OUT, USBD_SHORT_TRANSFER_OK)
  TransferBufferLength = 00000000
  TransferBuffer       = 00000000
  TransferBufferMDL    = 00000000
  UrbLink              = 00000000
  SetupPacket          =
    00000000: 40 bb 00 00 00 00 00 00
[1077845 ms] UsbSnoop - FilterDispatchAny(b9c8efd2) : IRP_MJ_INTERNAL_DEVICE_CONTROL
[1077845 ms] UsbSnoop - FdoHookDispatchInternalIoctl(b9c8f1ea) : fdo=86ab8658, Irp=8606a560, IRQL=0
[1077845 ms]  >>>  URB 6 going down  >>> 
-- URB_FUNCTION_VENDOR_DEVICE:
  TransferFlags          = 00000002 (USBD_TRANSFER_DIRECTION_OUT, USBD_SHORT_TRANSFER_OK)
  TransferBufferLength = 00000000
  TransferBuffer       = 00000000
  TransferBufferMDL    = 00000000

    no data supplied
  UrbLink                 = 00000000
  RequestTypeReservedBits = 00000000
  Request                 = 000000aa
  Value                   = 00000000
  Index                   = 00000000
[1077846 ms] UsbSnoop - MyInternalIOCTLCompletion(b9c8f126) : fido=858a9248, Irp=8606a560, Context=858bc360, IRQL=2
[1077846 ms]  <<<  URB 6 coming back  <<< 
-- URB_FUNCTION_CONTROL_TRANSFER:
  PipeHandle           = 86a11ee8
  TransferFlags        = 0000000a (USBD_TRANSFER_DIRECTION_OUT, USBD_SHORT_TRANSFER_OK)
  TransferBufferLength = 00000000
  TransferBuffer       = 00000000
  TransferBufferMDL    = 00000000
  UrbLink              = 00000000
  SetupPacket          =
    00000000: 40 aa 00 00 00 00 00 00
[1077847 ms] UsbSnoop - FilterDispatchPnp(b9c9345c) : IRP_MJ_PNP (IRP_MN_QUERY_DEVICE_RELATIONS)
[1077847 ms] UsbSnoop - FdoHookDispatchPnp(b9c9345c) : IRP_MJ_PNP (IRP_MN_QUERY_DEVICE_RELATIONS)
[1077847 ms] UsbSnoop - FilterDispatchPnp(b9c9345c) : IRP_MJ_PNP (IRP_MN_QUERY_DEVICE_RELATIONS)
[1077847 ms] UsbSnoop - FdoHookDispatchPnp(b9c9345c) : IRP_MJ_PNP (IRP_MN_QUERY_DEVICE_RELATIONS)
[1077848 ms] UsbSnoop - FilterDispatchAny(b9c8efd2) : IRP_MJ_INTERNAL_DEVICE_CONTROL
[1077848 ms] UsbSnoop - FdoHookDispatchInternalIoctl(b9c8f1ea) : fdo=86ab8658, Irp=858af9e0, IRQL=0
[1077848 ms]  >>>  URB 7 going down  >>> 
-- URB_FUNCTION_ABORT_PIPE:
  PipeHandle = 869fc7c4 [endpoint 0x00000081]
[1078321 ms] UsbSnoop - MyInternalIOCTLCompletion(b9c8f126) : fido=00000000, Irp=858af9e0, Context=858bc360, IRQL=2
[1078321 ms]  <<<  URB 7 coming back  <<< 
-- URB_FUNCTION_ABORT_PIPE:
[1078321 ms] UsbSnoop - FilterDispatchAny(b9c8efd2) : IRP_MJ_INTERNAL_DEVICE_CONTROL
[1078321 ms] UsbSnoop - FdoHookDispatchInternalIoctl(b9c8f1ea) : fdo=86ab8658, Irp=86a5ecf8, IRQL=0
[1078321 ms]  >>>  URB 8 going down  >>> 
-- URB_FUNCTION_ABORT_PIPE:
  PipeHandle = 869fc7e4 [endpoint 0x00000002]
[1078837 ms] UsbSnoop - MyInternalIOCTLCompletion(b9c8f126) : fido=00000000, Irp=86a5ecf8, Context=858bc360, IRQL=2
[1078837 ms]  <<<  URB 8 coming back  <<< 
-- URB_FUNCTION_ABORT_PIPE:
[1078837 ms] UsbSnoop - FilterDispatchPnp(b9c9345c) : IRP_MJ_PNP (IRP_MN_SURPRISE_REMOVAL)
[1078837 ms] UsbSnoop - FdoHookDispatchPnp(b9c9345c) : IRP_MJ_PNP (IRP_MN_SURPRISE_REMOVAL)
[1079477 ms] UsbSnoop - FilterAddDevice(b9c93748) : DriverObject 868877a0, pdo 85a18c30
[1079478 ms] UsbSnoop - FilterDispatchPnp(b9c9345c) : IRP_MJ_PNP (IRP_MN_QUERY_LEGACY_BUS_INFORMATION)
[1079478 ms] UsbSnoop - FdoHookDispatchPnp(b9c9345c) : IRP_MJ_PNP (IRP_MN_QUERY_LEGACY_BUS_INFORMATION)
[1079478 ms] UsbSnoop - FilterDispatchPnp(b9c9345c) : IRP_MJ_PNP (IRP_MN_QUERY_RESOURCE_REQUIREMENTS)
[1079478 ms] UsbSnoop - FdoHookDispatchPnp(b9c9345c) : IRP_MJ_PNP (IRP_MN_QUERY_RESOURCE_REQUIREMENTS)
[1079479 ms] UsbSnoop - FilterDispatchPnp(b9c9345c) : IRP_MJ_PNP (IRP_MN_FILTER_RESOURCE_REQUIREMENTS)
[1079479 ms] UsbSnoop - FdoHookDispatchPnp(b9c9345c) : IRP_MJ_PNP (IRP_MN_FILTER_RESOURCE_REQUIREMENTS)
[1079481 ms] UsbSnoop - FilterDispatchPnp(b9c9345c) : IRP_MJ_PNP (IRP_MN_START_DEVICE)
[1079481 ms] UsbSnoop - FdoHookDispatchPnp(b9c9345c) : IRP_MJ_PNP (IRP_MN_START_DEVICE)
[1079481 ms] UsbSnoop - FilterDispatchAny(b9c8efd2) : IRP_MJ_SYSTEM_CONTROL
[1079482 ms] UsbSnoop - FilterDispatchAny(b9c8efd2) : IRP_MJ_INTERNAL_DEVICE_CONTROL
[1079482 ms] UsbSnoop - FdoHookDispatchInternalIoctl(b9c8f1ea) : fdo=85a18c30, Irp=868bda18, IRQL=0
[1079482 ms]  >>>  URB 1 going down  >>> 
-- URB_FUNCTION_GET_DESCRIPTOR_FROM_DEVICE:
  TransferBufferLength = 00000012
  TransferBuffer       = 85aa7b40
  TransferBufferMDL    = 00000000
  Index                = 00000000
  DescriptorType       = 00000001 (USB_DEVICE_DESCRIPTOR_TYPE)
  LanguageId           = 00000000
[1079482 ms] UsbSnoop - MyInternalIOCTLCompletion(b9c8f126) : fido=00000000, Irp=868bda18, Context=858bc360, IRQL=2
[1079482 ms]  <<<  URB 1 coming back  <<< 
-- URB_FUNCTION_CONTROL_TRANSFER:
  PipeHandle           = 863cd890
  TransferFlags        = 0000000b (USBD_TRANSFER_DIRECTION_IN, USBD_SHORT_TRANSFER_OK)
  TransferBufferLength = 00000012
  TransferBuffer       = 85aa7b40
  TransferBufferMDL    = 8695ff88
    00000000: 12 01 00 02 00 00 00 40 51 04 12 e0 01 01 01 02
    00000010: 00 03
  UrbLink              = 00000000
  SetupPacket          =
    00000000: 80 06 00 01 00 00 12 00
[1079482 ms] UsbSnoop - FilterDispatchAny(b9c8efd2) : IRP_MJ_INTERNAL_DEVICE_CONTROL
[1079482 ms] UsbSnoop - FdoHookDispatchInternalIoctl(b9c8f1ea) : fdo=85a18c30, Irp=868bda18, IRQL=0
[1079482 ms]  >>>  URB 2 going down  >>> 
-- URB_FUNCTION_GET_DESCRIPTOR_FROM_DEVICE:
  TransferBufferLength = 00000009
  TransferBuffer       = 85b189f0
  TransferBufferMDL    = 00000000
  Index                = 00000000
  DescriptorType       = 00000002 (USB_CONFIGURATION_DESCRIPTOR_TYPE)
  LanguageId           = 00000000
[1079484 ms] UsbSnoop - MyInternalIOCTLCompletion(b9c8f126) : fido=00000000, Irp=868bda18, Context=858bc360, IRQL=2
[1079484 ms]  <<<  URB 2 coming back  <<< 
-- URB_FUNCTION_CONTROL_TRANSFER:
  PipeHandle           = 863cd890
  TransferFlags        = 0000000b (USBD_TRANSFER_DIRECTION_IN, USBD_SHORT_TRANSFER_OK)
  TransferBufferLength = 00000009
  TransferBuffer       = 85b189f0
  TransferBufferMDL    = 8695ff88
    00000000: 09 02 2a 00 01 01 03 80 32
  UrbLink              = 00000000
  SetupPacket          =
    00000000: 80 06 00 02 00 00 09 00
[1079484 ms] UsbSnoop - FilterDispatchAny(b9c8efd2) : IRP_MJ_INTERNAL_DEVICE_CONTROL
[1079484 ms] UsbSnoop - FdoHookDispatchInternalIoctl(b9c8f1ea) : fdo=85a18c30, Irp=868bda18, IRQL=0
[1079484 ms]  >>>  URB 3 going down  >>> 
-- URB_FUNCTION_GET_DESCRIPTOR_FROM_DEVICE:
  TransferBufferLength = 0000002a
  TransferBuffer       = 85953b68
  TransferBufferMDL    = 00000000
  Index                = 00000000
  DescriptorType       = 00000002 (USB_CONFIGURATION_DESCRIPTOR_TYPE)
  LanguageId           = 00000000
[1079486 ms] UsbSnoop - MyInternalIOCTLCompletion(b9c8f126) : fido=00000000, Irp=868bda18, Context=858bc360, IRQL=2
[1079486 ms]  <<<  URB 3 coming back  <<< 
-- URB_FUNCTION_CONTROL_TRANSFER:
  PipeHandle           = 863cd890
  TransferFlags        = 0000000b (USBD_TRANSFER_DIRECTION_IN, USBD_SHORT_TRANSFER_OK)
  TransferBufferLength = 0000002a
  TransferBuffer       = 85953b68
  TransferBufferMDL    = 8695ff88
    00000000: 09 02 2a 00 01 01 03 80 32 09 04 00 00 03 ff 02
    00000010: 00 00 07 05 81 02 40 00 00 07 05 02 02 40 00 00
    00000020: 07 05 83 02 40 00 00 03 09 01
  UrbLink              = 00000000
  SetupPacket          =
    00000000: 80 06 00 02 00 00 2a 00
[1079486 ms] UsbSnoop - FilterDispatchAny(b9c8efd2) : IRP_MJ_INTERNAL_DEVICE_CONTROL
[1079486 ms] UsbSnoop - FdoHookDispatchInternalIoctl(b9c8f1ea) : fdo=85a18c30, Irp=868bda18, IRQL=0
[1079486 ms]  >>>  URB 4 going down  >>> 
-- URB_FUNCTION_SELECT_CONFIGURATION:
  ConfigurationDescriptor = 0x85953b68 (configure)
  ConfigurationDescriptor : bLength             = 9
  ConfigurationDescriptor : bDescriptorType     = 0x00000002
  ConfigurationDescriptor : wTotalLength        = 0x0000002a
  ConfigurationDescriptor : bNumInterfaces      = 0x00000001
  ConfigurationDescriptor : bConfigurationValue = 0x00000001
  ConfigurationDescriptor : iConfiguration      = 0x00000003
  ConfigurationDescriptor : bmAttributes        = 0x00000080
  ConfigurationDescriptor : MaxPower            = 0x00000032
  ConfigurationHandle     = 0x00000000
  Interface[0]: Length            = 76
  Interface[0]: InterfaceNumber   = 0
  Interface[0]: AlternateSetting  = 0
[1079587 ms] UsbSnoop - MyInternalIOCTLCompletion(b9c8f126) : fido=00000000, Irp=868bda18, Context=858bc360, IRQL=0
[1079587 ms]  <<<  URB 4 coming back  <<< 
-- URB_FUNCTION_SELECT_CONFIGURATION:
  ConfigurationDescriptor = 0x85953b68 (configure)
  ConfigurationDescriptor : bLength             = 9
  ConfigurationDescriptor : bDescriptorType     = 0x00000002
  ConfigurationDescriptor : wTotalLength        = 0x0000002a
  ConfigurationDescriptor : bNumInterfaces      = 0x00000001
  ConfigurationDescriptor : bConfigurationValue = 0x00000001
  ConfigurationDescriptor : iConfiguration      = 0x00000003
  ConfigurationDescriptor : bmAttributes        = 0x00000080
  ConfigurationDescriptor : MaxPower            = 0x00000032
  ConfigurationHandle     = 0x85b78b20
  Interface[0]: Length            = 76
  Interface[0]: InterfaceNumber   = 0
  Interface[0]: AlternateSetting  = 0
  Interface[0]: Class             = 0x000000ff
  Interface[0]: SubClass          = 0x00000002
  Interface[0]: Protocol          = 0x00000000
  Interface[0]: InterfaceHandle   = 0x85cfd7c8
  Interface[0]: NumberOfPipes     = 3
  Interface[0]: Pipes[0] : MaximumPacketSize = 0x00000040
  Interface[0]: Pipes[0] : EndpointAddress   = 0x00000081
  Interface[0]: Pipes[0] : Interval          = 0x00000000
  Interface[0]: Pipes[0] : PipeType          = 0x00000002 (UsbdPipeTypeBulk)
  Interface[0]: Pipes[0] : PipeHandle        = 0x85cfd7e4
  Interface[0]: Pipes[0] : MaxTransferSize   = 0x00001000
  Interface[0]: Pipes[0] : PipeFlags         = 0x00000000
  Interface[0]: Pipes[1] : MaximumPacketSize = 0x00000040
  Interface[0]: Pipes[1] : EndpointAddress   = 0x00000002
  Interface[0]: Pipes[1] : Interval          = 0x00000000
  Interface[0]: Pipes[1] : PipeType          = 0x00000002 (UsbdPipeTypeBulk)
  Interface[0]: Pipes[1] : PipeHandle        = 0x85cfd804
  Interface[0]: Pipes[1] : MaxTransferSize   = 0x00001000
  Interface[0]: Pipes[1] : PipeFlags         = 0x00000000
  Interface[0]: Pipes[2] : MaximumPacketSize = 0x00000040
  Interface[0]: Pipes[2] : EndpointAddress   = 0x00000083
  Interface[0]: Pipes[2] : Interval          = 0x00000000
  Interface[0]: Pipes[2] : PipeType          = 0x00000002 (UsbdPipeTypeBulk)
  Interface[0]: Pipes[2] : PipeHandle        = 0x85cfd824
  Interface[0]: Pipes[2] : MaxTransferSize   = 0x00001000
  Interface[0]: Pipes[2] : PipeFlags         = 0x00000000
[1079587 ms] UsbSnoop - FilterDispatchPnp(b9c9345c) : IRP_MJ_PNP (IRP_MN_QUERY_INTERFACE)
[1079587 ms] UsbSnoop - FilterDispatchPnp: Query for Bus interface for USB Function Drivers.
[1079587 ms] 	InterfaceType: USB_BUS_INTERFACE_USBDI_GUID
[1079587 ms] UsbSnoop - FdoHookDispatchPnp(b9c9345c) : IRP_MJ_PNP (IRP_MN_QUERY_INTERFACE)
[1079587 ms] UsbSnoop - FdoHookDispatchPnp: Query for Bus interface for USB Function Drivers.
[1079587 ms] 	InterfaceType: USB_BUS_INTERFACE_USBDI_GUID
[1079588 ms] UsbSnoop - FilterDispatchPnp(b9c9345c) : IRP_MJ_PNP (IRP_MN_QUERY_CAPABILITIES)
[1079588 ms] UsbSnoop - FdoHookDispatchPnp(b9c9345c) : IRP_MJ_PNP (IRP_MN_QUERY_CAPABILITIES)
[1079588 ms] UsbSnoop - FilterDispatchPnp(b9c9345c) : IRP_MJ_PNP (IRP_MN_QUERY_PNP_DEVICE_STATE)
[1079588 ms] UsbSnoop - FdoHookDispatchPnp(b9c9345c) : IRP_MJ_PNP (IRP_MN_QUERY_PNP_DEVICE_STATE)
[1079588 ms] UsbSnoop - FilterDispatchPnp(b9c9345c) : IRP_MJ_PNP (IRP_MN_QUERY_DEVICE_RELATIONS)
[1079588 ms] UsbSnoop - FdoHookDispatchPnp(b9c9345c) : IRP_MJ_PNP (IRP_MN_QUERY_DEVICE_RELATIONS)
[1079588 ms] UsbSnoop - FilterDispatchPnp(b9c9345c) : IRP_MJ_PNP (IRP_MN_REMOVE_DEVICE)
[1079846 ms] UsbSnoop - FilterDispatchAny(b9c8efd2) : IRP_MJ_INTERNAL_DEVICE_CONTROL
[1079846 ms] UsbSnoop - FdoHookDispatchInternalIoctl(b9c8f1ea) : fdo=85a18c30, Irp=85952008, IRQL=0
[1079846 ms]  >>>  URB 5 going down  >>> 
-- URB_FUNCTION_BULK_OR_INTERRUPT_TRANSFER:
  PipeHandle           = 85cfd7e4 [endpoint 0x00000081]
  TransferFlags        = 00000003 (USBD_TRANSFER_DIRECTION_IN, USBD_SHORT_TRANSFER_OK)
  TransferBufferLength = 00000200
  TransferBuffer       = 00000000
  TransferBufferMDL    = 858cf8c0
  UrbLink              = 00000000
[1079846 ms] UsbSnoop - MyInternalIOCTLCompletion(b9c8f126) : fido=86af0200, Irp=85952008, Context=858bc360, IRQL=2
[1079846 ms]  <<<  URB 5 coming back  <<< 
-- URB_FUNCTION_BULK_OR_INTERRUPT_TRANSFER:
  PipeHandle           = 85cfd7e4 [endpoint 0x00000081]
  TransferFlags        = 00000003 (USBD_TRANSFER_DIRECTION_IN, USBD_SHORT_TRANSFER_OK)
  TransferBufferLength = 00000010
  TransferBuffer       = 00000000
  TransferBufferMDL    = 858cf8c0
    00000000: 54 fd 00 00 40 03 00 00 40 03 00 00 00 00 01 d8
  UrbLink              = 00000000
[1079850 ms] UsbSnoop - FilterDispatchAny(b9c8efd2) : IRP_MJ_INTERNAL_DEVICE_CONTROL
[1079850 ms] UsbSnoop - FdoHookDispatchInternalIoctl(b9c8f1ea) : fdo=85a18c30, Irp=85952008, IRQL=0
[1079850 ms]  >>>  URB 6 going down  >>> 
-- URB_FUNCTION_BULK_OR_INTERRUPT_TRANSFER:
  PipeHandle           = 85cfd7e4 [endpoint 0x00000081]
  TransferFlags        = 00000003 (USBD_TRANSFER_DIRECTION_IN, USBD_SHORT_TRANSFER_OK)
  TransferBufferLength = 00000200
  TransferBuffer       = 00000000
  TransferBufferMDL    = 8695ff88
  UrbLink              = 00000000
[1079851 ms] UsbSnoop - FilterDispatchAny(b9c8efd2) : IRP_MJ_INTERNAL_DEVICE_CONTROL
[1079851 ms] UsbSnoop - FdoHookDispatchInternalIoctl(b9c8f1ea) : fdo=85a18c30, Irp=858c85a8, IRQL=0
[1079851 ms]  >>>  URB 7 going down  >>> 
-- URB_FUNCTION_BULK_OR_INTERRUPT_TRANSFER:
  PipeHandle           = 85cfd804 [endpoint 0x00000002]
  TransferFlags        = 00000002 (USBD_TRANSFER_DIRECTION_OUT, USBD_SHORT_TRANSFER_OK)
  TransferBufferLength = 00000014
  TransferBuffer       = 00000000
  TransferBufferMDL    = 86477838
    00000000: 54 fd 64 00 40 03 64 01 40 03 13 43 04 00 01 fb
    00000010: 64 01 ff 00
  UrbLink              = 00000000
[1079851 ms] UsbSnoop - MyInternalIOCTLCompletion(b9c8f126) : fido=86af0200, Irp=858c85a8, Context=85d29868, IRQL=2
[1079851 ms]  <<<  URB 7 coming back  <<< 
-- URB_FUNCTION_BULK_OR_INTERRUPT_TRANSFER:
  PipeHandle           = 85cfd804 [endpoint 0x00000002]
  TransferFlags        = 00000002 (USBD_TRANSFER_DIRECTION_OUT, USBD_SHORT_TRANSFER_OK)
  TransferBufferLength = 00000014
  TransferBuffer       = 00000000
  TransferBufferMDL    = 86477838
  UrbLink              = 00000000
[1082891 ms] UsbSnoop - MyInternalIOCTLCompletion(b9c8f126) : fido=86af0200, Irp=85952008, Context=858bc360, IRQL=2
[1082891 ms]  <<<  URB 6 coming back  <<< 
-- URB_FUNCTION_BULK_OR_INTERRUPT_TRANSFER:
  PipeHandle           = 85cfd7e4 [endpoint 0x00000081]
  TransferFlags        = 00000003 (USBD_TRANSFER_DIRECTION_IN, USBD_SHORT_TRANSFER_OK)
  TransferBufferLength = 00000016
  TransferBuffer       = 00000000
  TransferBufferMDL    = 8695ff88
    00000000: 54 fd 64 01 80 02 64 00 40 50 39 76 06 00 01 e2
    00000010: 02 00 00 00 00 00
  UrbLink              = 00000000
[1082891 ms] UsbSnoop - FilterDispatchAny(b9c8efd2) : IRP_MJ_INTERNAL_DEVICE_CONTROL
[1082891 ms] UsbSnoop - FdoHookDispatchInternalIoctl(b9c8f1ea) : fdo=85a18c30, Irp=85952008, IRQL=0
[1082891 ms]  >>>  URB 8 going down  >>> 
-- URB_FUNCTION_BULK_OR_INTERRUPT_TRANSFER:
  PipeHandle           = 85cfd804 [endpoint 0x00000002]
  TransferFlags        = 00000002 (USBD_TRANSFER_DIRECTION_OUT, USBD_SHORT_TRANSFER_OK)
  TransferBufferLength = 00000012
  TransferBuffer       = 00000000
  TransferBufferMDL    = 858a5820
    00000000: 54 fd 64 00 00 d3 64 01 80 02 50 40 02 0a 01 0c
    00000010: 40 50
  UrbLink              = 00000000
[1082891 ms] UsbSnoop - FilterDispatchAny(b9c8efd2) : IRP_MJ_INTERNAL_DEVICE_CONTROL
[1082891 ms] UsbSnoop - FdoHookDispatchInternalIoctl(b9c8f1ea) : fdo=85a18c30, Irp=86a5ecf8, IRQL=0
[1082891 ms]  >>>  URB 9 going down  >>> 
-- URB_FUNCTION_BULK_OR_INTERRUPT_TRANSFER:
  PipeHandle           = 85cfd7e4 [endpoint 0x00000081]
  TransferFlags        = 00000003 (USBD_TRANSFER_DIRECTION_IN, USBD_SHORT_TRANSFER_OK)
  TransferBufferLength = 00000200
  TransferBuffer       = 00000000
  TransferBufferMDL    = 85894d98
  UrbLink              = 00000000
[1082892 ms] UsbSnoop - MyInternalIOCTLCompletion(b9c8f126) : fido=86af0200, Irp=85952008, Context=858bc360, IRQL=2
[1082892 ms]  <<<  URB 8 coming back  <<< 
-- URB_FUNCTION_BULK_OR_INTERRUPT_TRANSFER:
  PipeHandle           = 85cfd804 [endpoint 0x00000002]
  TransferFlags        = 00000002 (USBD_TRANSFER_DIRECTION_OUT, USBD_SHORT_TRANSFER_OK)
  TransferBufferLength = 00000012
  TransferBuffer       = 00000000
  TransferBufferMDL    = 858a5820
  UrbLink              = 00000000
[1085490 ms] UsbSnoop - FilterDispatchAny(b9c8efd2) : IRP_MJ_INTERNAL_DEVICE_CONTROL
[1085490 ms] UsbSnoop - FdoHookDispatchInternalIoctl(b9c8f1ea) : fdo=85a18c30, Irp=85812698, IRQL=0
[1085490 ms]  >>>  URB 10 going down  >>> 
-- URB_FUNCTION_BULK_OR_INTERRUPT_TRANSFER:
  PipeHandle           = 85cfd804 [endpoint 0x00000002]
  TransferFlags        = 00000002 (USBD_TRANSFER_DIRECTION_OUT, USBD_SHORT_TRANSFER_OK)
  TransferBufferLength = 00000011
  TransferBuffer       = 00000000
  TransferBufferMDL    = 868e0e70
    00000000: 54 fd 64 00 80 02 64 01 40 20 01 00 01 00 01 ff
    00000010: 01
  UrbLink              = 00000000
[1085491 ms] UsbSnoop - MyInternalIOCTLCompletion(b9c8f126) : fido=86af0200, Irp=85812698, Context=858bc360, IRQL=2
[1085491 ms]  <<<  URB 10 coming back  <<< 
-- URB_FUNCTION_BULK_OR_INTERRUPT_TRANSFER:
  PipeHandle           = 85cfd804 [endpoint 0x00000002]
  TransferFlags        = 00000002 (USBD_TRANSFER_DIRECTION_OUT, USBD_SHORT_TRANSFER_OK)
  TransferBufferLength = 00000011
  TransferBuffer       = 00000000
  TransferBufferMDL    = 868e0e70
  UrbLink              = 00000000
[1085492 ms] UsbSnoop - MyInternalIOCTLCompletion(b9c8f126) : fido=86af0200, Irp=86a5ecf8, Context=85d29868, IRQL=2
[1085492 ms]  <<<  URB 9 coming back  <<< 
-- URB_FUNCTION_BULK_OR_INTERRUPT_TRANSFER:
  PipeHandle           = 85cfd7e4 [endpoint 0x00000081]
  TransferFlags        = 00000003 (USBD_TRANSFER_DIRECTION_IN, USBD_SHORT_TRANSFER_OK)
  TransferBufferLength = 00000012
  TransferBuffer       = 00000000
  TransferBufferMDL    = 85894d98
    00000000: 54 fd 64 01 00 ff 64 00 80 02 20 40 02 0a 01 08
    00000010: 40 20
  UrbLink              = 00000000
[1085509 ms] UsbSnoop - FilterDispatchAny(b9c8efd2) : IRP_MJ_INTERNAL_DEVICE_CONTROL
[1085509 ms] UsbSnoop - FdoHookDispatchInternalIoctl(b9c8f1ea) : fdo=85a18c30, Irp=858afcb0, IRQL=0
[1085509 ms]  >>>  URB 11 going down  >>> 
-- URB_FUNCTION_BULK_OR_INTERRUPT_TRANSFER:
  PipeHandle           = 85cfd7e4 [endpoint 0x00000081]
  TransferFlags        = 00000003 (USBD_TRANSFER_DIRECTION_IN, USBD_SHORT_TRANSFER_OK)
  TransferBufferLength = 00000200
  TransferBuffer       = 00000000
  TransferBufferMDL    = 868e0e70
  UrbLink              = 00000000
[1085609 ms] UsbSnoop - MyInternalIOCTLCompletion(b9c8f126) : fido=86af0200, Irp=858afcb0, Context=85d29868, IRQL=2
[1085609 ms]  <<<  URB 11 coming back  <<< 
-- URB_FUNCTION_BULK_OR_INTERRUPT_TRANSFER:
  PipeHandle           = 85cfd7e4 [endpoint 0x00000081]
  TransferFlags        = 00000003 (USBD_TRANSFER_DIRECTION_IN, USBD_SHORT_TRANSFER_OK)
  TransferBufferLength = 0000007f
  TransferBuffer       = 00000000
  TransferBufferMDL    = 868e0e70
    00000000: 54 fd 64 01 40 20 64 00 80 02 54 ea 6f 00 02 ab
    00000010: 01 00 00 00 00 01 41 2c 00 00 00 00 00 01 be 00
    00000020: 00 00 00 00 00 01 47 da 8c 00 00 00 00 01 73 06
    00000030: 04 7f 00 00 5a 01 03 09 86 01 01 22 d4 01 01 23
    00000040: 15 00 00 00 00 00 02 00 00 00 00 01 40 00 f0 04
    00000050: 00 1e 30 30 30 30 34 42 43 31 42 31 30 45 35 37
    00000060: 30 46 00 30 45 30 30 30 30 30 34 42 43 31 42 31
    00000070: 30 45 35 37 30 46 43 42 32 38 30 34 46 31 00
  UrbLink              = 00000000
[1085610 ms] UsbSnoop - FilterDispatchAny(b9c8efd2) : IRP_MJ_INTERNAL_DEVICE_CONTROL
[1085610 ms] UsbSnoop - FdoHookDispatchInternalIoctl(b9c8f1ea) : fdo=85a18c30, Irp=858afcb0, IRQL=0
[1085610 ms]  >>>  URB 12 going down  >>> 
-- URB_FUNCTION_BULK_OR_INTERRUPT_TRANSFER:
  PipeHandle           = 85cfd7e4 [endpoint 0x00000081]
  TransferFlags        = 00000003 (USBD_TRANSFER_DIRECTION_IN, USBD_SHORT_TRANSFER_OK)
  TransferBufferLength = 00000200
  TransferBuffer       = 00000000
  TransferBufferMDL    = 868e0e70
  UrbLink              = 00000000
[1085610 ms] UsbSnoop - FilterDispatchAny(b9c8efd2) : IRP_MJ_INTERNAL_DEVICE_CONTROL
[1085610 ms] UsbSnoop - FdoHookDispatchInternalIoctl(b9c8f1ea) : fdo=85a18c30, Irp=85812698, IRQL=0
[1085611 ms]  >>>  URB 13 going down  >>> 
-- URB_FUNCTION_BULK_OR_INTERRUPT_TRANSFER:
  PipeHandle           = 85cfd804 [endpoint 0x00000002]
  TransferFlags        = 00000002 (USBD_TRANSFER_DIRECTION_OUT, USBD_SHORT_TRANSFER_OK)
  TransferBufferLength = 00000012
  TransferBuffer       = 00000000
  TransferBufferMDL    = 85891808
    00000000: 54 fd 64 00 00 ff 64 01 40 20 02 80 02 0a 02 09
    00000010: 80 02
  UrbLink              = 00000000
[1085611 ms] UsbSnoop - MyInternalIOCTLCompletion(b9c8f126) : fido=86af0200, Irp=85812698, Context=858bc360, IRQL=2
[1085611 ms]  <<<  URB 13 coming back  <<< 
-- URB_FUNCTION_BULK_OR_INTERRUPT_TRANSFER:
  PipeHandle           = 85cfd804 [endpoint 0x00000002]
  TransferFlags        = 00000002 (USBD_TRANSFER_DIRECTION_OUT, USBD_SHORT_TRANSFER_OK)
  TransferBufferLength = 00000012
  TransferBuffer       = 00000000
  TransferBufferMDL    = 85891808
  UrbLink              = 00000000
[1085613 ms] UsbSnoop - FilterDispatchAny(b9c8efd2) : IRP_MJ_INTERNAL_DEVICE_CONTROL
[1085613 ms] UsbSnoop - FdoHookDispatchInternalIoctl(b9c8f1ea) : fdo=85a18c30, Irp=86a5ecf8, IRQL=0
[1085613 ms]  >>>  URB 14 going down  >>> 
-- URB_FUNCTION_BULK_OR_INTERRUPT_TRANSFER:
  PipeHandle           = 85cfd804 [endpoint 0x00000002]
  TransferFlags        = 00000002 (USBD_TRANSFER_DIRECTION_OUT, USBD_SHORT_TRANSFER_OK)
  TransferBufferLength = 00000011
  TransferBuffer       = 00000000
  TransferBufferMDL    = 85dc78f8
    00000000: 54 fd 64 00 80 02 64 01 40 20 02 00 01 00 02 01
    00000010: 02
  UrbLink              = 00000000
[1085613 ms] UsbSnoop - MyInternalIOCTLCompletion(b9c8f126) : fido=86af0200, Irp=86a5ecf8, Context=858bc360, IRQL=2
[1085613 ms]  <<<  URB 14 coming back  <<< 
-- URB_FUNCTION_BULK_OR_INTERRUPT_TRANSFER:
  PipeHandle           = 85cfd804 [endpoint 0x00000002]
  TransferFlags        = 00000002 (USBD_TRANSFER_DIRECTION_OUT, USBD_SHORT_TRANSFER_OK)
  TransferBufferLength = 00000011
  TransferBuffer       = 00000000
  TransferBufferMDL    = 85dc78f8
  UrbLink              = 00000000
[1085615 ms] UsbSnoop - MyInternalIOCTLCompletion(b9c8f126) : fido=86af0200, Irp=858afcb0, Context=85d29868, IRQL=2
[1085615 ms]  <<<  URB 12 coming back  <<< 
-- URB_FUNCTION_BULK_OR_INTERRUPT_TRANSFER:
  PipeHandle           = 85cfd7e4 [endpoint 0x00000081]
  TransferFlags        = 00000003 (USBD_TRANSFER_DIRECTION_IN, USBD_SHORT_TRANSFER_OK)
  TransferBufferLength = 00000012
  TransferBuffer       = 00000000
  TransferBufferMDL    = 868e0e70
    00000000: 54 fd 64 01 00 ff 64 00 80 02 20 40 02 0a 02 09
    00000010: 40 20
  UrbLink              = 00000000
[1085616 ms] UsbSnoop - FilterDispatchAny(b9c8efd2) : IRP_MJ_INTERNAL_DEVICE_CONTROL
[1085616 ms] UsbSnoop - FdoHookDispatchInternalIoctl(b9c8f1ea) : fdo=85a18c30, Irp=86a5ecf8, IRQL=0
[1085616 ms]  >>>  URB 15 going down  >>> 
-- URB_FUNCTION_BULK_OR_INTERRUPT_TRANSFER:
  PipeHandle           = 85cfd7e4 [endpoint 0x00000081]
  TransferFlags        = 00000003 (USBD_TRANSFER_DIRECTION_IN, USBD_SHORT_TRANSFER_OK)
  TransferBufferLength = 00000200
  TransferBuffer       = 00000000
  TransferBufferMDL    = 85891808
  UrbLink              = 00000000
[1085619 ms] UsbSnoop - MyInternalIOCTLCompletion(b9c8f126) : fido=86af0200, Irp=86a5ecf8, Context=85d29868, IRQL=2
[1085619 ms]  <<<  URB 15 coming back  <<< 
-- URB_FUNCTION_BULK_OR_INTERRUPT_TRANSFER:
  PipeHandle           = 85cfd7e4 [endpoint 0x00000081]
  TransferFlags        = 00000003 (USBD_TRANSFER_DIRECTION_IN, USBD_SHORT_TRANSFER_OK)
  TransferBufferLength = 0000001b
  TransferBuffer       = 00000000
  TransferBufferMDL    = 85891808
    00000000: 54 fd 64 01 40 20 64 00 80 02 38 5a 0b 00 03 9c
    00000010: 02 54 49 2d 4e 73 70 69 72 65 00
  UrbLink              = 00000000
[1085620 ms] UsbSnoop - FilterDispatchAny(b9c8efd2) : IRP_MJ_INTERNAL_DEVICE_CONTROL
[1085620 ms] UsbSnoop - FdoHookDispatchInternalIoctl(b9c8f1ea) : fdo=85a18c30, Irp=86a5ecf8, IRQL=0
[1085620 ms]  >>>  URB 16 going down  >>> 
-- URB_FUNCTION_BULK_OR_INTERRUPT_TRANSFER:
  PipeHandle           = 85cfd7e4 [endpoint 0x00000081]
  TransferFlags        = 00000003 (USBD_TRANSFER_DIRECTION_IN, USBD_SHORT_TRANSFER_OK)
  TransferBufferLength = 00000200
  TransferBuffer       = 00000000
  TransferBufferMDL    = 868b4568
  UrbLink              = 00000000
[1085623 ms] UsbSnoop - FilterDispatchAny(b9c8efd2) : IRP_MJ_INTERNAL_DEVICE_CONTROL
[1085623 ms] UsbSnoop - FdoHookDispatchInternalIoctl(b9c8f1ea) : fdo=85a18c30, Irp=858da800, IRQL=0
[1085623 ms]  >>>  URB 17 going down  >>> 
-- URB_FUNCTION_BULK_OR_INTERRUPT_TRANSFER:
  PipeHandle           = 85cfd804 [endpoint 0x00000002]
  TransferFlags        = 00000002 (USBD_TRANSFER_DIRECTION_OUT, USBD_SHORT_TRANSFER_OK)
  TransferBufferLength = 00000012
  TransferBuffer       = 00000000
  TransferBufferMDL    = 864b9700
    00000000: 54 fd 64 00 00 ff 64 01 40 20 02 80 02 0a 03 0a
    00000010: 80 02
  UrbLink              = 00000000
[1085623 ms] UsbSnoop - MyInternalIOCTLCompletion(b9c8f126) : fido=86af0200, Irp=858da800, Context=858bc360, IRQL=2
[1085623 ms]  <<<  URB 17 coming back  <<< 
-- URB_FUNCTION_BULK_OR_INTERRUPT_TRANSFER:
  PipeHandle           = 85cfd804 [endpoint 0x00000002]
  TransferFlags        = 00000002 (USBD_TRANSFER_DIRECTION_OUT, USBD_SHORT_TRANSFER_OK)
  TransferBufferLength = 00000012
  TransferBuffer       = 00000000
  TransferBufferMDL    = 864b9700
  UrbLink              = 00000000
[1085624 ms] UsbSnoop - FilterDispatchAny(b9c8efd2) : IRP_MJ_INTERNAL_DEVICE_CONTROL
[1085624 ms] UsbSnoop - FdoHookDispatchInternalIoctl(b9c8f1ea) : fdo=85a18c30, Irp=858da800, IRQL=0
[1085624 ms]  >>>  URB 18 going down  >>> 
-- URB_FUNCTION_BULK_OR_INTERRUPT_TRANSFER:
  PipeHandle           = 85cfd804 [endpoint 0x00000002]
  TransferFlags        = 00000002 (USBD_TRANSFER_DIRECTION_OUT, USBD_SHORT_TRANSFER_OK)
  TransferBufferLength = 00000011
  TransferBuffer       = 00000000
  TransferBufferMDL    = 8695ff88
    00000000: 54 fd 64 00 80 02 64 01 40 20 03 00 01 00 03 03
    00000010: 03
  UrbLink              = 00000000
[1085624 ms] UsbSnoop - MyInternalIOCTLCompletion(b9c8f126) : fido=86af0200, Irp=858da800, Context=858bc360, IRQL=2
[1085624 ms]  <<<  URB 18 coming back  <<< 
-- URB_FUNCTION_BULK_OR_INTERRUPT_TRANSFER:
  PipeHandle           = 85cfd804 [endpoint 0x00000002]
  TransferFlags        = 00000002 (USBD_TRANSFER_DIRECTION_OUT, USBD_SHORT_TRANSFER_OK)
  TransferBufferLength = 00000011
  TransferBuffer       = 00000000
  TransferBufferMDL    = 8695ff88
  UrbLink              = 00000000
[1085627 ms] UsbSnoop - MyInternalIOCTLCompletion(b9c8f126) : fido=86af0200, Irp=86a5ecf8, Context=85d29868, IRQL=2
[1085627 ms]  <<<  URB 16 coming back  <<< 
-- URB_FUNCTION_BULK_OR_INTERRUPT_TRANSFER:
  PipeHandle           = 85cfd7e4 [endpoint 0x00000081]
  TransferFlags        = 00000003 (USBD_TRANSFER_DIRECTION_IN, USBD_SHORT_TRANSFER_OK)
  TransferBufferLength = 00000012
  TransferBuffer       = 00000000
  TransferBufferMDL    = 868b4568
    00000000: 54 fd 64 01 00 ff 64 00 80 02 20 40 02 0a 03 0a
    00000010: 40 20
  UrbLink              = 00000000
[1085628 ms] UsbSnoop - FilterDispatchAny(b9c8efd2) : IRP_MJ_INTERNAL_DEVICE_CONTROL
[1085628 ms] UsbSnoop - FdoHookDispatchInternalIoctl(b9c8f1ea) : fdo=85a18c30, Irp=86a5ecf8, IRQL=0
[1085628 ms]  >>>  URB 19 going down  >>> 
-- URB_FUNCTION_BULK_OR_INTERRUPT_TRANSFER:
  PipeHandle           = 85cfd7e4 [endpoint 0x00000081]
  TransferFlags        = 00000003 (USBD_TRANSFER_DIRECTION_IN, USBD_SHORT_TRANSFER_OK)
  TransferBufferLength = 00000200
  TransferBuffer       = 00000000
  TransferBufferMDL    = 85894d98
  UrbLink              = 00000000
[1085631 ms] UsbSnoop - MyInternalIOCTLCompletion(b9c8f126) : fido=86af0200, Irp=86a5ecf8, Context=85d29868, IRQL=2
[1085631 ms]  <<<  URB 19 coming back  <<< 
-- URB_FUNCTION_BULK_OR_INTERRUPT_TRANSFER:
  PipeHandle           = 85cfd7e4 [endpoint 0x00000081]
  TransferFlags        = 00000003 (USBD_TRANSFER_DIRECTION_IN, USBD_SHORT_TRANSFER_OK)
  TransferBufferLength = 0000001b
  TransferBuffer       = 00000000
  TransferBufferMDL    = 85894d98
    00000000: 54 fd 64 01 40 20 64 00 80 02 96 7f 0b 00 04 20
    00000010: 03 2e 74 6e 73 00 2e 74 6e 6f 00
  UrbLink              = 00000000
[1085632 ms] UsbSnoop - FilterDispatchAny(b9c8efd2) : IRP_MJ_INTERNAL_DEVICE_CONTROL
[1085632 ms] UsbSnoop - FdoHookDispatchInternalIoctl(b9c8f1ea) : fdo=85a18c30, Irp=858afcb0, IRQL=0
[1085632 ms]  >>>  URB 20 going down  >>> 
-- URB_FUNCTION_BULK_OR_INTERRUPT_TRANSFER:
  PipeHandle           = 85cfd804 [endpoint 0x00000002]
  TransferFlags        = 00000002 (USBD_TRANSFER_DIRECTION_OUT, USBD_SHORT_TRANSFER_OK)
  TransferBufferLength = 00000012
  TransferBuffer       = 00000000
  TransferBufferMDL    = 858a6cd0
    00000000: 54 fd 64 00 00 ff 64 01 40 20 02 80 02 0a 04 0b
    00000010: 80 02
  UrbLink              = 00000000
[1085632 ms] UsbSnoop - MyInternalIOCTLCompletion(b9c8f126) : fido=86af0200, Irp=858afcb0, Context=85d29868, IRQL=2
[1085632 ms]  <<<  URB 20 coming back  <<< 
-- URB_FUNCTION_BULK_OR_INTERRUPT_TRANSFER:
  PipeHandle           = 85cfd804 [endpoint 0x00000002]
  TransferFlags        = 00000002 (USBD_TRANSFER_DIRECTION_OUT, USBD_SHORT_TRANSFER_OK)
  TransferBufferLength = 00000012
  TransferBuffer       = 00000000
  TransferBufferMDL    = 858a6cd0
  UrbLink              = 00000000
[1085633 ms] UsbSnoop - FilterDispatchAny(b9c8efd2) : IRP_MJ_INTERNAL_DEVICE_CONTROL
[1085633 ms] UsbSnoop - FdoHookDispatchInternalIoctl(b9c8f1ea) : fdo=85a18c30, Irp=86a5ecf8, IRQL=0
[1085633 ms]  >>>  URB 21 going down  >>> 
-- URB_FUNCTION_BULK_OR_INTERRUPT_TRANSFER:
  PipeHandle           = 85cfd7e4 [endpoint 0x00000081]
  TransferFlags        = 00000003 (USBD_TRANSFER_DIRECTION_IN, USBD_SHORT_TRANSFER_OK)
  TransferBufferLength = 00000200
  TransferBuffer       = 00000000
  TransferBufferMDL    = 868e0e70
  UrbLink              = 00000000
[1085639 ms] UsbSnoop - FilterDispatchAny(b9c8efd2) : IRP_MJ_INTERNAL_DEVICE_CONTROL
[1085639 ms] UsbSnoop - FdoHookDispatchInternalIoctl(b9c8f1ea) : fdo=85a18c30, Irp=85cf97b8, IRQL=0
[1085640 ms]  >>>  URB 22 going down  >>> 
-- URB_FUNCTION_BULK_OR_INTERRUPT_TRANSFER:
  PipeHandle           = 85cfd804 [endpoint 0x00000002]
  TransferFlags        = 00000002 (USBD_TRANSFER_DIRECTION_OUT, USBD_SHORT_TRANSFER_OK)
  TransferBufferLength = 00000012
  TransferBuffer       = 00000000
  TransferBufferMDL    = 85c23938
    00000000: 54 fd 64 00 40 de 64 01 40 20 02 80 02 00 04 20
    00000010: 80 02
  UrbLink              = 00000000
[1085640 ms] UsbSnoop - MyInternalIOCTLCompletion(b9c8f126) : fido=86af0200, Irp=85cf97b8, Context=858bc360, IRQL=2
[1085640 ms]  <<<  URB 22 coming back  <<< 
-- URB_FUNCTION_BULK_OR_INTERRUPT_TRANSFER:
  PipeHandle           = 85cfd804 [endpoint 0x00000002]
  TransferFlags        = 00000002 (USBD_TRANSFER_DIRECTION_OUT, USBD_SHORT_TRANSFER_OK)
  TransferBufferLength = 00000012
  TransferBuffer       = 00000000
  TransferBufferMDL    = 85c23938
  UrbLink              = 00000000
[1085641 ms] UsbSnoop - MyInternalIOCTLCompletion(b9c8f126) : fido=86af0200, Irp=86a5ecf8, Context=85d29868, IRQL=2
[1085641 ms]  <<<  URB 21 coming back  <<< 
-- URB_FUNCTION_BULK_OR_INTERRUPT_TRANSFER:
  PipeHandle           = 85cfd7e4 [endpoint 0x00000081]
  TransferFlags        = 00000003 (USBD_TRANSFER_DIRECTION_IN, USBD_SHORT_TRANSFER_OK)
  TransferBufferLength = 00000012
  TransferBuffer       = 00000000
  TransferBufferMDL    = 868e0e70
    00000000: 54 fd 64 01 00 ff 64 00 80 02 20 40 02 0a 04 0b
    00000010: 40 20
  UrbLink              = 00000000
[1085642 ms] UsbSnoop - FilterDispatchAny(b9c8efd2) : IRP_MJ_INTERNAL_DEVICE_CONTROL
[1085642 ms] UsbSnoop - FdoHookDispatchInternalIoctl(b9c8f1ea) : fdo=85a18c30, Irp=86a5ecf8, IRQL=0
[1085642 ms]  >>>  URB 23 going down  >>> 
-- URB_FUNCTION_BULK_OR_INTERRUPT_TRANSFER:
  PipeHandle           = 85cfd7e4 [endpoint 0x00000081]
  TransferFlags        = 00000003 (USBD_TRANSFER_DIRECTION_IN, USBD_SHORT_TRANSFER_OK)
  TransferBufferLength = 00000200
  TransferBuffer       = 00000000
  TransferBufferMDL    = 8606a728
  UrbLink              = 00000000
[1088110 ms] UsbSnoop - FilterDispatchAny(b9c8efd2) : IRP_MJ_INTERNAL_DEVICE_CONTROL
[1088110 ms] UsbSnoop - FdoHookDispatchInternalIoctl(b9c8f1ea) : fdo=85a18c30, Irp=85900e48, IRQL=0
[1088110 ms]  >>>  URB 24 going down  >>> 
-- URB_FUNCTION_BULK_OR_INTERRUPT_TRANSFER:
  PipeHandle           = 85cfd804 [endpoint 0x00000002]
  TransferFlags        = 00000002 (USBD_TRANSFER_DIRECTION_OUT, USBD_SHORT_TRANSFER_OK)
  TransferBufferLength = 0000001b
  TransferBuffer       = 00000000
  TransferBufferMDL    = 85d96870
    00000000: 54 fd 64 00 80 03 64 01 40 60 0c f1 0b 00 05 4a
    00000010: 20 01 2f 00 00 00 00 00 00 00 00
  UrbLink              = 00000000
[1088111 ms] UsbSnoop - MyInternalIOCTLCompletion(b9c8f126) : fido=86af0200, Irp=85900e48, Context=858bc360, IRQL=2
[1088111 ms]  <<<  URB 24 coming back  <<< 
-- URB_FUNCTION_BULK_OR_INTERRUPT_TRANSFER:
  PipeHandle           = 85cfd804 [endpoint 0x00000002]
  TransferFlags        = 00000002 (USBD_TRANSFER_DIRECTION_OUT, USBD_SHORT_TRANSFER_OK)
  TransferBufferLength = 0000001b
  TransferBuffer       = 00000000
  TransferBufferMDL    = 85d96870
  UrbLink              = 00000000
[1088113 ms] UsbSnoop - MyInternalIOCTLCompletion(b9c8f126) : fido=86af0200, Irp=86a5ecf8, Context=85d29868, IRQL=2
[1088113 ms]  <<<  URB 23 coming back  <<< 
-- URB_FUNCTION_BULK_OR_INTERRUPT_TRANSFER:
  PipeHandle           = 85cfd7e4 [endpoint 0x00000081]
  TransferFlags        = 00000003 (USBD_TRANSFER_DIRECTION_IN, USBD_SHORT_TRANSFER_OK)
  TransferBufferLength = 00000012
  TransferBuffer       = 00000000
  TransferBufferMDL    = 8606a728
    00000000: 54 fd 64 01 00 ff 64 00 80 03 60 40 02 0a 05 4d
    00000010: 40 60
  UrbLink              = 00000000
[1088113 ms] UsbSnoop - FilterDispatchAny(b9c8efd2) : IRP_MJ_INTERNAL_DEVICE_CONTROL
[1088113 ms] UsbSnoop - FdoHookDispatchInternalIoctl(b9c8f1ea) : fdo=85a18c30, Irp=86a5ecf8, IRQL=0
[1088113 ms]  >>>  URB 25 going down  >>> 
-- URB_FUNCTION_BULK_OR_INTERRUPT_TRANSFER:
  PipeHandle           = 85cfd7e4 [endpoint 0x00000081]
  TransferFlags        = 00000003 (USBD_TRANSFER_DIRECTION_IN, USBD_SHORT_TRANSFER_OK)
  TransferBufferLength = 00000200
  TransferBuffer       = 00000000
  TransferBufferMDL    = 8606a728
  UrbLink              = 00000000
[1088124 ms] UsbSnoop - MyInternalIOCTLCompletion(b9c8f126) : fido=86af0200, Irp=86a5ecf8, Context=85d29868, IRQL=2
[1088124 ms]  <<<  URB 25 coming back  <<< 
-- URB_FUNCTION_BULK_OR_INTERRUPT_TRANSFER:
  PipeHandle           = 85cfd7e4 [endpoint 0x00000081]
  TransferFlags        = 00000003 (USBD_TRANSFER_DIRECTION_IN, USBD_SHORT_TRANSFER_OK)
  TransferBufferLength = 0000001b
  TransferBuffer       = 00000000
  TransferBufferMDL    = 8606a728
    00000000: 54 fd 64 01 40 60 64 00 80 03 f7 38 0b 00 05 7c
    00000010: 20 00 00 00 00 00 00 00 00 01 00
  UrbLink              = 00000000
[1088124 ms] UsbSnoop - FilterDispatchAny(b9c8efd2) : IRP_MJ_INTERNAL_DEVICE_CONTROL
[1088124 ms] UsbSnoop - FdoHookDispatchInternalIoctl(b9c8f1ea) : fdo=85a18c30, Irp=86a5ecf8, IRQL=0
[1088124 ms]  >>>  URB 26 going down  >>> 
-- URB_FUNCTION_BULK_OR_INTERRUPT_TRANSFER:
  PipeHandle           = 85cfd7e4 [endpoint 0x00000081]
  TransferFlags        = 00000003 (USBD_TRANSFER_DIRECTION_IN, USBD_SHORT_TRANSFER_OK)
  TransferBufferLength = 00000200
  TransferBuffer       = 00000000
  TransferBufferMDL    = 8606a728
  UrbLink              = 00000000
[1088124 ms] UsbSnoop - FilterDispatchAny(b9c8efd2) : IRP_MJ_INTERNAL_DEVICE_CONTROL
[1088124 ms] UsbSnoop - FdoHookDispatchInternalIoctl(b9c8f1ea) : fdo=85a18c30, Irp=85892008, IRQL=0
[1088124 ms]  >>>  URB 27 going down  >>> 
-- URB_FUNCTION_BULK_OR_INTERRUPT_TRANSFER:
  PipeHandle           = 85cfd804 [endpoint 0x00000002]
  TransferFlags        = 00000002 (USBD_TRANSFER_DIRECTION_OUT, USBD_SHORT_TRANSFER_OK)
  TransferBufferLength = 00000012
  TransferBuffer       = 00000000
  TransferBufferMDL    = 85906638
    00000000: 54 fd 64 00 00 ff 64 01 40 60 03 80 02 0a 05 4d
    00000010: 80 03
  UrbLink              = 00000000
[1088125 ms] UsbSnoop - MyInternalIOCTLCompletion(b9c8f126) : fido=86af0200, Irp=85892008, Context=858bc360, IRQL=2
[1088125 ms]  <<<  URB 27 coming back  <<< 
-- URB_FUNCTION_BULK_OR_INTERRUPT_TRANSFER:
  PipeHandle           = 85cfd804 [endpoint 0x00000002]
  TransferFlags        = 00000002 (USBD_TRANSFER_DIRECTION_OUT, USBD_SHORT_TRANSFER_OK)
  TransferBufferLength = 00000012
  TransferBuffer       = 00000000
  TransferBufferMDL    = 85906638
  UrbLink              = 00000000
[1088126 ms] UsbSnoop - FilterDispatchAny(b9c8efd2) : IRP_MJ_INTERNAL_DEVICE_CONTROL
[1088126 ms] UsbSnoop - FdoHookDispatchInternalIoctl(b9c8f1ea) : fdo=85a18c30, Irp=85892008, IRQL=0
[1088126 ms]  >>>  URB 28 going down  >>> 
-- URB_FUNCTION_BULK_OR_INTERRUPT_TRANSFER:
  PipeHandle           = 85cfd804 [endpoint 0x00000002]
  TransferFlags        = 00000002 (USBD_TRANSFER_DIRECTION_OUT, USBD_SHORT_TRANSFER_OK)
  TransferBufferLength = 00000012
  TransferBuffer       = 00000000
  TransferBufferMDL    = 85906638
    00000000: 54 fd 64 00 40 de 64 01 40 60 03 80 02 00 06 63
    00000010: 80 03
  UrbLink              = 00000000
[1088127 ms] UsbSnoop - MyInternalIOCTLCompletion(b9c8f126) : fido=86af0200, Irp=85892008, Context=858bc360, IRQL=2
[1088127 ms]  <<<  URB 28 coming back  <<< 
-- URB_FUNCTION_BULK_OR_INTERRUPT_TRANSFER:
  PipeHandle           = 85cfd804 [endpoint 0x00000002]
  TransferFlags        = 00000002 (USBD_TRANSFER_DIRECTION_OUT, USBD_SHORT_TRANSFER_OK)
  TransferBufferLength = 00000012
  TransferBuffer       = 00000000
  TransferBufferMDL    = 85906638
  UrbLink              = 00000000
[1088130 ms] UsbSnoop - MyInternalIOCTLCompletion(b9c8f126) : fido=86af0200, Irp=86a5ecf8, Context=85d29868, IRQL=2
[1088130 ms]  <<<  URB 26 coming back  <<< 
-- URB_FUNCTION_BULK_OR_INTERRUPT_TRANSFER:
  PipeHandle           = 85cfd7e4 [endpoint 0x00000081]
  TransferFlags        = 00000003 (USBD_TRANSFER_DIRECTION_IN, USBD_SHORT_TRANSFER_OK)
  TransferBufferLength = 00000012
  TransferBuffer       = 00000000
  TransferBufferMDL    = 8606a728
    00000000: 54 fd 64 01 00 ff 64 00 80 03 60 40 02 0a 06 4e
    00000010: 40 60
  UrbLink              = 00000000
[1088130 ms] UsbSnoop - FilterDispatchAny(b9c8efd2) : IRP_MJ_INTERNAL_DEVICE_CONTROL
[1088130 ms] UsbSnoop - FdoHookDispatchInternalIoctl(b9c8f1ea) : fdo=85a18c30, Irp=86a5ecf8, IRQL=0
[1088130 ms]  >>>  URB 29 going down  >>> 
-- URB_FUNCTION_BULK_OR_INTERRUPT_TRANSFER:
  PipeHandle           = 85cfd7e4 [endpoint 0x00000081]
  TransferFlags        = 00000003 (USBD_TRANSFER_DIRECTION_IN, USBD_SHORT_TRANSFER_OK)
  TransferBufferLength = 00000200
  TransferBuffer       = 00000000
  TransferBufferMDL    = 8606a728
  UrbLink              = 00000000
[1088133 ms] UsbSnoop - FilterDispatchAny(b9c8efd2) : IRP_MJ_INTERNAL_DEVICE_CONTROL
[1088133 ms] UsbSnoop - FdoHookDispatchInternalIoctl(b9c8f1ea) : fdo=85a18c30, Irp=85812698, IRQL=0
[1088133 ms]  >>>  URB 30 going down  >>> 
-- URB_FUNCTION_BULK_OR_INTERRUPT_TRANSFER:
  PipeHandle           = 85cfd804 [endpoint 0x00000002]
  TransferFlags        = 00000002 (USBD_TRANSFER_DIRECTION_OUT, USBD_SHORT_TRANSFER_OK)
  TransferBufferLength = 0000001a
  TransferBuffer       = 00000000
  TransferBufferMDL    = 85e39ad0
    00000000: 54 fd 64 00 80 04 64 01 40 60 c0 aa 0a 00 07 b9
    00000010: 0d 2f 00 00 00 00 00 00 00 00
  UrbLink              = 00000000
[1088134 ms] UsbSnoop - MyInternalIOCTLCompletion(b9c8f126) : fido=86af0200, Irp=85812698, Context=858bc360, IRQL=2
[1088134 ms]  <<<  URB 30 coming back  <<< 
-- URB_FUNCTION_BULK_OR_INTERRUPT_TRANSFER:
  PipeHandle           = 85cfd804 [endpoint 0x00000002]
  TransferFlags        = 00000002 (USBD_TRANSFER_DIRECTION_OUT, USBD_SHORT_TRANSFER_OK)
  TransferBufferLength = 0000001a
  TransferBuffer       = 00000000
  TransferBufferMDL    = 85e39ad0
  UrbLink              = 00000000
[1088135 ms] UsbSnoop - MyInternalIOCTLCompletion(b9c8f126) : fido=86af0200, Irp=86a5ecf8, Context=85d29868, IRQL=2
[1088135 ms]  <<<  URB 29 coming back  <<< 
-- URB_FUNCTION_BULK_OR_INTERRUPT_TRANSFER:
  PipeHandle           = 85cfd7e4 [endpoint 0x00000081]
  TransferFlags        = 00000003 (USBD_TRANSFER_DIRECTION_IN, USBD_SHORT_TRANSFER_OK)
  TransferBufferLength = 00000012
  TransferBuffer       = 00000000
  TransferBufferMDL    = 8606a728
    00000000: 54 fd 64 01 00 ff 64 00 80 04 60 40 02 0a 07 50
    00000010: 40 60
  UrbLink              = 00000000
[1088135 ms] UsbSnoop - FilterDispatchAny(b9c8efd2) : IRP_MJ_INTERNAL_DEVICE_CONTROL
[1088135 ms] UsbSnoop - FdoHookDispatchInternalIoctl(b9c8f1ea) : fdo=85a18c30, Irp=86a5ecf8, IRQL=0
[1088135 ms]  >>>  URB 31 going down  >>> 
-- URB_FUNCTION_BULK_OR_INTERRUPT_TRANSFER:
  PipeHandle           = 85cfd7e4 [endpoint 0x00000081]
  TransferFlags        = 00000003 (USBD_TRANSFER_DIRECTION_IN, USBD_SHORT_TRANSFER_OK)
  TransferBufferLength = 00000200
  TransferBuffer       = 00000000
  TransferBufferMDL    = 8606a728
  UrbLink              = 00000000
[1088150 ms] UsbSnoop - MyInternalIOCTLCompletion(b9c8f126) : fido=86af0200, Irp=86a5ecf8, Context=85d29868, IRQL=2
[1088150 ms]  <<<  URB 31 coming back  <<< 
-- URB_FUNCTION_BULK_OR_INTERRUPT_TRANSFER:
  PipeHandle           = 85cfd7e4 [endpoint 0x00000081]
  TransferFlags        = 00000003 (USBD_TRANSFER_DIRECTION_IN, USBD_SHORT_TRANSFER_OK)
  TransferBufferLength = 00000012
  TransferBuffer       = 00000000
  TransferBufferMDL    = 8606a728
    00000000: 54 fd 64 01 40 60 64 00 80 04 00 ff 02 00 06 45
    00000010: ff 00
  UrbLink              = 00000000
[1088150 ms] UsbSnoop - FilterDispatchAny(b9c8efd2) : IRP_MJ_INTERNAL_DEVICE_CONTROL
[1088150 ms] UsbSnoop - FdoHookDispatchInternalIoctl(b9c8f1ea) : fdo=85a18c30, Irp=86a5ecf8, IRQL=0
[1088150 ms]  >>>  URB 32 going down  >>> 
-- URB_FUNCTION_BULK_OR_INTERRUPT_TRANSFER:
  PipeHandle           = 85cfd7e4 [endpoint 0x00000081]
  TransferFlags        = 00000003 (USBD_TRANSFER_DIRECTION_IN, USBD_SHORT_TRANSFER_OK)
  TransferBufferLength = 00000200
  TransferBuffer       = 00000000
  TransferBufferMDL    = 8606a728
  UrbLink              = 00000000
[1088150 ms] UsbSnoop - FilterDispatchAny(b9c8efd2) : IRP_MJ_INTERNAL_DEVICE_CONTROL
[1088150 ms] UsbSnoop - FdoHookDispatchInternalIoctl(b9c8f1ea) : fdo=85a18c30, Irp=858da800, IRQL=0
[1088150 ms]  >>>  URB 33 going down  >>> 
-- URB_FUNCTION_BULK_OR_INTERRUPT_TRANSFER:
  PipeHandle           = 85cfd804 [endpoint 0x00000002]
  TransferFlags        = 00000002 (USBD_TRANSFER_DIRECTION_OUT, USBD_SHORT_TRANSFER_OK)
  TransferBufferLength = 00000012
  TransferBuffer       = 00000000
  TransferBufferMDL    = 868954d8
    00000000: 54 fd 64 00 00 ff 64 01 40 60 04 80 02 0a 06 4f
    00000010: 80 04
  UrbLink              = 00000000
[1088151 ms] UsbSnoop - MyInternalIOCTLCompletion(b9c8f126) : fido=86af0200, Irp=858da800, Context=858bc360, IRQL=2
[1088151 ms]  <<<  URB 33 coming back  <<< 
-- URB_FUNCTION_BULK_OR_INTERRUPT_TRANSFER:
  PipeHandle           = 85cfd804 [endpoint 0x00000002]
  TransferFlags        = 00000002 (USBD_TRANSFER_DIRECTION_OUT, USBD_SHORT_TRANSFER_OK)
  TransferBufferLength = 00000012
  TransferBuffer       = 00000000
  TransferBufferMDL    = 868954d8
  UrbLink              = 00000000
[1088151 ms] UsbSnoop - FilterDispatchAny(b9c8efd2) : IRP_MJ_INTERNAL_DEVICE_CONTROL
[1088151 ms] UsbSnoop - FdoHookDispatchInternalIoctl(b9c8f1ea) : fdo=85a18c30, Irp=85812698, IRQL=0
[1088151 ms]  >>>  URB 34 going down  >>> 
-- URB_FUNCTION_BULK_OR_INTERRUPT_TRANSFER:
  PipeHandle           = 85cfd804 [endpoint 0x00000002]
  TransferFlags        = 00000002 (USBD_TRANSFER_DIRECTION_OUT, USBD_SHORT_TRANSFER_OK)
  TransferBufferLength = 00000011
  TransferBuffer       = 00000000
  TransferBufferMDL    = 8591a2b8
    00000000: 54 fd 64 00 80 04 64 01 40 60 0e 00 01 00 08 55
    00000010: 0e
  UrbLink              = 00000000
[1088152 ms] UsbSnoop - MyInternalIOCTLCompletion(b9c8f126) : fido=86af0200, Irp=85812698, Context=858bc360, IRQL=2
[1088152 ms]  <<<  URB 34 coming back  <<< 
-- URB_FUNCTION_BULK_OR_INTERRUPT_TRANSFER:
  PipeHandle           = 85cfd804 [endpoint 0x00000002]
  TransferFlags        = 00000002 (USBD_TRANSFER_DIRECTION_OUT, USBD_SHORT_TRANSFER_OK)
  TransferBufferLength = 00000011
  TransferBuffer       = 00000000
  TransferBufferMDL    = 8591a2b8
  UrbLink              = 00000000
[1088155 ms] UsbSnoop - MyInternalIOCTLCompletion(b9c8f126) : fido=86af0200, Irp=86a5ecf8, Context=85d29868, IRQL=2
[1088155 ms]  <<<  URB 32 coming back  <<< 
-- URB_FUNCTION_BULK_OR_INTERRUPT_TRANSFER:
  PipeHandle           = 85cfd7e4 [endpoint 0x00000081]
  TransferFlags        = 00000003 (USBD_TRANSFER_DIRECTION_IN, USBD_SHORT_TRANSFER_OK)
  TransferBufferLength = 00000012
  TransferBuffer       = 00000000
  TransferBufferMDL    = 8606a728
    00000000: 54 fd 64 01 00 ff 64 00 80 04 60 40 02 0a 08 51
    00000010: 40 60
  UrbLink              = 00000000
[1088155 ms] UsbSnoop - FilterDispatchAny(b9c8efd2) : IRP_MJ_INTERNAL_DEVICE_CONTROL
[1088155 ms] UsbSnoop - FdoHookDispatchInternalIoctl(b9c8f1ea) : fdo=85a18c30, Irp=86a5ecf8, IRQL=0
[1088155 ms]  >>>  URB 35 going down  >>> 
-- URB_FUNCTION_BULK_OR_INTERRUPT_TRANSFER:
  PipeHandle           = 85cfd7e4 [endpoint 0x00000081]
  TransferFlags        = 00000003 (USBD_TRANSFER_DIRECTION_IN, USBD_SHORT_TRANSFER_OK)
  TransferBufferLength = 00000200
  TransferBuffer       = 00000000
  TransferBufferMDL    = 8606a728
  UrbLink              = 00000000
[1088249 ms] UsbSnoop - MyInternalIOCTLCompletion(b9c8f126) : fido=86af0200, Irp=86a5ecf8, Context=85d29868, IRQL=2
[1088249 ms]  <<<  URB 35 coming back  <<< 
-- URB_FUNCTION_BULK_OR_INTERRUPT_TRANSFER:
  PipeHandle           = 85cfd7e4 [endpoint 0x00000081]
  TransferFlags        = 00000003 (USBD_TRANSFER_DIRECTION_IN, USBD_SHORT_TRANSFER_OK)
  TransferBufferLength = 00000026
  TransferBuffer       = 00000000
  TransferBufferMDL    = 8606a728
    00000000: 54 fd 64 01 40 60 64 00 80 04 d0 9f 16 00 07 ca
    00000010: 10 00 13 46 6f 6c 64 65 72 31 00 00 00 00 00 00
    00000020: 00 00 0d b1 01 00
  UrbLink              = 00000000
[1088249 ms] UsbSnoop - FilterDispatchAny(b9c8efd2) : IRP_MJ_INTERNAL_DEVICE_CONTROL
[1088249 ms] UsbSnoop - FdoHookDispatchInternalIoctl(b9c8f1ea) : fdo=85a18c30, Irp=86a5ecf8, IRQL=0
[1088249 ms]  >>>  URB 36 going down  >>> 
-- URB_FUNCTION_BULK_OR_INTERRUPT_TRANSFER:
  PipeHandle           = 85cfd7e4 [endpoint 0x00000081]
  TransferFlags        = 00000003 (USBD_TRANSFER_DIRECTION_IN, USBD_SHORT_TRANSFER_OK)
  TransferBufferLength = 00000200
  TransferBuffer       = 00000000
  TransferBufferMDL    = 8606a728
  UrbLink              = 00000000
[1088249 ms] UsbSnoop - FilterDispatchAny(b9c8efd2) : IRP_MJ_INTERNAL_DEVICE_CONTROL
[1088249 ms] UsbSnoop - FdoHookDispatchInternalIoctl(b9c8f1ea) : fdo=85a18c30, Irp=858da800, IRQL=0
[1088249 ms]  >>>  URB 37 going down  >>> 
-- URB_FUNCTION_BULK_OR_INTERRUPT_TRANSFER:
  PipeHandle           = 85cfd804 [endpoint 0x00000002]
  TransferFlags        = 00000002 (USBD_TRANSFER_DIRECTION_OUT, USBD_SHORT_TRANSFER_OK)
  TransferBufferLength = 00000012
  TransferBuffer       = 00000000
  TransferBufferMDL    = 858a74e0
    00000000: 54 fd 64 00 00 ff 64 01 40 60 04 80 02 0a 07 50
    00000010: 80 04
  UrbLink              = 00000000
[1088250 ms] UsbSnoop - MyInternalIOCTLCompletion(b9c8f126) : fido=86af0200, Irp=858da800, Context=858bc360, IRQL=2
[1088250 ms]  <<<  URB 37 coming back  <<< 
-- URB_FUNCTION_BULK_OR_INTERRUPT_TRANSFER:
  PipeHandle           = 85cfd804 [endpoint 0x00000002]
  TransferFlags        = 00000002 (USBD_TRANSFER_DIRECTION_OUT, USBD_SHORT_TRANSFER_OK)
  TransferBufferLength = 00000012
  TransferBuffer       = 00000000
  TransferBufferMDL    = 858a74e0
  UrbLink              = 00000000
[1088251 ms] UsbSnoop - FilterDispatchAny(b9c8efd2) : IRP_MJ_INTERNAL_DEVICE_CONTROL
[1088251 ms] UsbSnoop - FdoHookDispatchInternalIoctl(b9c8f1ea) : fdo=85a18c30, Irp=858ec300, IRQL=0
[1088251 ms]  >>>  URB 38 going down  >>> 
-- URB_FUNCTION_BULK_OR_INTERRUPT_TRANSFER:
  PipeHandle           = 85cfd804 [endpoint 0x00000002]
  TransferFlags        = 00000002 (USBD_TRANSFER_DIRECTION_OUT, USBD_SHORT_TRANSFER_OK)
  TransferBufferLength = 00000011
  TransferBuffer       = 00000000
  TransferBufferMDL    = 868b4568
    00000000: 54 fd 64 00 80 04 64 01 40 60 0e 00 01 00 09 56
    00000010: 0e
  UrbLink              = 00000000
[1088252 ms] UsbSnoop - MyInternalIOCTLCompletion(b9c8f126) : fido=86af0200, Irp=858ec300, Context=858bc360, IRQL=2
[1088252 ms]  <<<  URB 38 coming back  <<< 
-- URB_FUNCTION_BULK_OR_INTERRUPT_TRANSFER:
  PipeHandle           = 85cfd804 [endpoint 0x00000002]
  TransferFlags        = 00000002 (USBD_TRANSFER_DIRECTION_OUT, USBD_SHORT_TRANSFER_OK)
  TransferBufferLength = 00000011
  TransferBuffer       = 00000000
  TransferBufferMDL    = 868b4568
  UrbLink              = 00000000
[1088255 ms] UsbSnoop - MyInternalIOCTLCompletion(b9c8f126) : fido=86af0200, Irp=86a5ecf8, Context=85d29868, IRQL=2
[1088255 ms]  <<<  URB 36 coming back  <<< 
-- URB_FUNCTION_BULK_OR_INTERRUPT_TRANSFER:
  PipeHandle           = 85cfd7e4 [endpoint 0x00000081]
  TransferFlags        = 00000003 (USBD_TRANSFER_DIRECTION_IN, USBD_SHORT_TRANSFER_OK)
  TransferBufferLength = 00000012
  TransferBuffer       = 00000000
  TransferBufferMDL    = 8606a728
    00000000: 54 fd 64 01 00 ff 64 00 80 04 60 40 02 0a 09 52
    00000010: 40 60
  UrbLink              = 00000000
[1088255 ms] UsbSnoop - FilterDispatchAny(b9c8efd2) : IRP_MJ_INTERNAL_DEVICE_CONTROL
[1088255 ms] UsbSnoop - FdoHookDispatchInternalIoctl(b9c8f1ea) : fdo=85a18c30, Irp=86a5ecf8, IRQL=0
[1088255 ms]  >>>  URB 39 going down  >>> 
-- URB_FUNCTION_BULK_OR_INTERRUPT_TRANSFER:
  PipeHandle           = 85cfd7e4 [endpoint 0x00000081]
  TransferFlags        = 00000003 (USBD_TRANSFER_DIRECTION_IN, USBD_SHORT_TRANSFER_OK)
  TransferBufferLength = 00000200
  TransferBuffer       = 00000000
  TransferBufferMDL    = 8606a728
  UrbLink              = 00000000
[1088261 ms] UsbSnoop - MyInternalIOCTLCompletion(b9c8f126) : fido=86af0200, Irp=86a5ecf8, Context=85d29868, IRQL=2
[1088261 ms]  <<<  URB 39 coming back  <<< 
-- URB_FUNCTION_BULK_OR_INTERRUPT_TRANSFER:
  PipeHandle           = 85cfd7e4 [endpoint 0x00000081]
  TransferFlags        = 00000003 (USBD_TRANSFER_DIRECTION_IN, USBD_SHORT_TRANSFER_OK)
  TransferBufferLength = 00000026
  TransferBuffer       = 00000000
  TransferBufferMDL    = 8606a728
    00000000: 54 fd 64 01 40 60 64 00 80 04 39 ed 16 00 08 82
    00000010: 10 00 13 45 78 65 6d 70 6c 65 73 00 00 00 00 00
    00000020: 00 00 00 0b 01 00
  UrbLink              = 00000000
[1088261 ms] UsbSnoop - FilterDispatchAny(b9c8efd2) : IRP_MJ_INTERNAL_DEVICE_CONTROL
[1088261 ms] UsbSnoop - FdoHookDispatchInternalIoctl(b9c8f1ea) : fdo=85a18c30, Irp=86a5ecf8, IRQL=0
[1088261 ms]  >>>  URB 40 going down  >>> 
-- URB_FUNCTION_BULK_OR_INTERRUPT_TRANSFER:
  PipeHandle           = 85cfd7e4 [endpoint 0x00000081]
  TransferFlags        = 00000003 (USBD_TRANSFER_DIRECTION_IN, USBD_SHORT_TRANSFER_OK)
  TransferBufferLength = 00000200
  TransferBuffer       = 00000000
  TransferBufferMDL    = 8606a728
  UrbLink              = 00000000
[1088261 ms] UsbSnoop - FilterDispatchAny(b9c8efd2) : IRP_MJ_INTERNAL_DEVICE_CONTROL
[1088261 ms] UsbSnoop - FdoHookDispatchInternalIoctl(b9c8f1ea) : fdo=85a18c30, Irp=86af0008, IRQL=0
[1088261 ms]  >>>  URB 41 going down  >>> 
-- URB_FUNCTION_BULK_OR_INTERRUPT_TRANSFER:
  PipeHandle           = 85cfd804 [endpoint 0x00000002]
  TransferFlags        = 00000002 (USBD_TRANSFER_DIRECTION_OUT, USBD_SHORT_TRANSFER_OK)
  TransferBufferLength = 00000012
  TransferBuffer       = 00000000
  TransferBufferMDL    = 858eb700
    00000000: 54 fd 64 00 00 ff 64 01 40 60 04 80 02 0a 08 51
    00000010: 80 04
  UrbLink              = 00000000
[1088262 ms] UsbSnoop - MyInternalIOCTLCompletion(b9c8f126) : fido=86af0200, Irp=86af0008, Context=858bc360, IRQL=2
[1088262 ms]  <<<  URB 41 coming back  <<< 
-- URB_FUNCTION_BULK_OR_INTERRUPT_TRANSFER:
  PipeHandle           = 85cfd804 [endpoint 0x00000002]
  TransferFlags        = 00000002 (USBD_TRANSFER_DIRECTION_OUT, USBD_SHORT_TRANSFER_OK)
  TransferBufferLength = 00000012
  TransferBuffer       = 00000000
  TransferBufferMDL    = 858eb700
  UrbLink              = 00000000
[1088263 ms] UsbSnoop - FilterDispatchAny(b9c8efd2) : IRP_MJ_INTERNAL_DEVICE_CONTROL
[1088263 ms] UsbSnoop - FdoHookDispatchInternalIoctl(b9c8f1ea) : fdo=85a18c30, Irp=86af0008, IRQL=0
[1088263 ms]  >>>  URB 42 going down  >>> 
-- URB_FUNCTION_BULK_OR_INTERRUPT_TRANSFER:
  PipeHandle           = 85cfd804 [endpoint 0x00000002]
  TransferFlags        = 00000002 (USBD_TRANSFER_DIRECTION_OUT, USBD_SHORT_TRANSFER_OK)
  TransferBufferLength = 00000011
  TransferBuffer       = 00000000
  TransferBufferMDL    = 858eb700
    00000000: 54 fd 64 00 80 04 64 01 40 60 0e 00 01 00 0a 57
    00000010: 0e
  UrbLink              = 00000000
[1088264 ms] UsbSnoop - MyInternalIOCTLCompletion(b9c8f126) : fido=86af0200, Irp=86af0008, Context=858bc360, IRQL=2
[1088264 ms]  <<<  URB 42 coming back  <<< 
-- URB_FUNCTION_BULK_OR_INTERRUPT_TRANSFER:
  PipeHandle           = 85cfd804 [endpoint 0x00000002]
  TransferFlags        = 00000002 (USBD_TRANSFER_DIRECTION_OUT, USBD_SHORT_TRANSFER_OK)
  TransferBufferLength = 00000011
  TransferBuffer       = 00000000
  TransferBufferMDL    = 858eb700
  UrbLink              = 00000000
[1088267 ms] UsbSnoop - MyInternalIOCTLCompletion(b9c8f126) : fido=86af0200, Irp=86a5ecf8, Context=85d29868, IRQL=2
[1088267 ms]  <<<  URB 40 coming back  <<< 
-- URB_FUNCTION_BULK_OR_INTERRUPT_TRANSFER:
  PipeHandle           = 85cfd7e4 [endpoint 0x00000081]
  TransferFlags        = 00000003 (USBD_TRANSFER_DIRECTION_IN, USBD_SHORT_TRANSFER_OK)
  TransferBufferLength = 00000012
  TransferBuffer       = 00000000
  TransferBufferMDL    = 8606a728
    00000000: 54 fd 64 01 00 ff 64 00 80 04 60 40 02 0a 0a 53
    00000010: 40 60
  UrbLink              = 00000000
[1088267 ms] UsbSnoop - FilterDispatchAny(b9c8efd2) : IRP_MJ_INTERNAL_DEVICE_CONTROL
[1088267 ms] UsbSnoop - FdoHookDispatchInternalIoctl(b9c8f1ea) : fdo=85a18c30, Irp=86a5ecf8, IRQL=0
[1088267 ms]  >>>  URB 43 going down  >>> 
-- URB_FUNCTION_BULK_OR_INTERRUPT_TRANSFER:
  PipeHandle           = 85cfd7e4 [endpoint 0x00000081]
  TransferFlags        = 00000003 (USBD_TRANSFER_DIRECTION_IN, USBD_SHORT_TRANSFER_OK)
  TransferBufferLength = 00000200
  TransferBuffer       = 00000000
  TransferBufferMDL    = 8606a728
  UrbLink              = 00000000
[1088270 ms] UsbSnoop - MyInternalIOCTLCompletion(b9c8f126) : fido=86af0200, Irp=86a5ecf8, Context=85d29868, IRQL=2
[1088270 ms]  <<<  URB 43 coming back  <<< 
-- URB_FUNCTION_BULK_OR_INTERRUPT_TRANSFER:
  PipeHandle           = 85cfd7e4 [endpoint 0x00000081]
  TransferFlags        = 00000003 (USBD_TRANSFER_DIRECTION_IN, USBD_SHORT_TRANSFER_OK)
  TransferBufferLength = 00000026
  TransferBuffer       = 00000000
  TransferBufferMDL    = 8606a728
    00000000: 54 fd 64 01 40 60 64 00 80 04 27 b4 16 00 09 38
    00000010: 10 00 13 4d 79 4c 69 62 00 00 00 00 00 00 00 00
    00000020: 00 00 01 bf 01 00
  UrbLink              = 00000000
[1088270 ms] UsbSnoop - FilterDispatchAny(b9c8efd2) : IRP_MJ_INTERNAL_DEVICE_CONTROL
[1088270 ms] UsbSnoop - FdoHookDispatchInternalIoctl(b9c8f1ea) : fdo=85a18c30, Irp=86a5ecf8, IRQL=0
[1088270 ms]  >>>  URB 44 going down  >>> 
-- URB_FUNCTION_BULK_OR_INTERRUPT_TRANSFER:
  PipeHandle           = 85cfd7e4 [endpoint 0x00000081]
  TransferFlags        = 00000003 (USBD_TRANSFER_DIRECTION_IN, USBD_SHORT_TRANSFER_OK)
  TransferBufferLength = 00000200
  TransferBuffer       = 00000000
  TransferBufferMDL    = 8606a728
  UrbLink              = 00000000
[1088270 ms] UsbSnoop - FilterDispatchAny(b9c8efd2) : IRP_MJ_INTERNAL_DEVICE_CONTROL
[1088270 ms] UsbSnoop - FdoHookDispatchInternalIoctl(b9c8f1ea) : fdo=85a18c30, Irp=858af9e0, IRQL=0
[1088270 ms]  >>>  URB 45 going down  >>> 
-- URB_FUNCTION_BULK_OR_INTERRUPT_TRANSFER:
  PipeHandle           = 85cfd804 [endpoint 0x00000002]
  TransferFlags        = 00000002 (USBD_TRANSFER_DIRECTION_OUT, USBD_SHORT_TRANSFER_OK)
  TransferBufferLength = 00000012
  TransferBuffer       = 00000000
  TransferBufferMDL    = 858cf8c0
    00000000: 54 fd 64 00 00 ff 64 01 40 60 04 80 02 0a 09 52
    00000010: 80 04
  UrbLink              = 00000000
[1088271 ms] UsbSnoop - MyInternalIOCTLCompletion(b9c8f126) : fido=86af0200, Irp=858af9e0, Context=858bc360, IRQL=2
[1088271 ms]  <<<  URB 45 coming back  <<< 
-- URB_FUNCTION_BULK_OR_INTERRUPT_TRANSFER:
  PipeHandle           = 85cfd804 [endpoint 0x00000002]
  TransferFlags        = 00000002 (USBD_TRANSFER_DIRECTION_OUT, USBD_SHORT_TRANSFER_OK)
  TransferBufferLength = 00000012
  TransferBuffer       = 00000000
  TransferBufferMDL    = 858cf8c0
  UrbLink              = 00000000
[1088272 ms] UsbSnoop - FilterDispatchAny(b9c8efd2) : IRP_MJ_INTERNAL_DEVICE_CONTROL
[1088272 ms] UsbSnoop - FdoHookDispatchInternalIoctl(b9c8f1ea) : fdo=85a18c30, Irp=858af9e0, IRQL=0
[1088272 ms]  >>>  URB 46 going down  >>> 
-- URB_FUNCTION_BULK_OR_INTERRUPT_TRANSFER:
  PipeHandle           = 85cfd804 [endpoint 0x00000002]
  TransferFlags        = 00000002 (USBD_TRANSFER_DIRECTION_OUT, USBD_SHORT_TRANSFER_OK)
  TransferBufferLength = 00000011
  TransferBuffer       = 00000000
  TransferBufferMDL    = 858cf8c0
    00000000: 54 fd 64 00 80 04 64 01 40 60 0e 00 01 00 0b 58
    00000010: 0e
  UrbLink              = 00000000
[1088273 ms] UsbSnoop - MyInternalIOCTLCompletion(b9c8f126) : fido=86af0200, Irp=858af9e0, Context=858bc360, IRQL=2
[1088273 ms]  <<<  URB 46 coming back  <<< 
-- URB_FUNCTION_BULK_OR_INTERRUPT_TRANSFER:
  PipeHandle           = 85cfd804 [endpoint 0x00000002]
  TransferFlags        = 00000002 (USBD_TRANSFER_DIRECTION_OUT, USBD_SHORT_TRANSFER_OK)
  TransferBufferLength = 00000011
  TransferBuffer       = 00000000
  TransferBufferMDL    = 858cf8c0
  UrbLink              = 00000000
[1088276 ms] UsbSnoop - MyInternalIOCTLCompletion(b9c8f126) : fido=86af0200, Irp=86a5ecf8, Context=85d29868, IRQL=2
[1088276 ms]  <<<  URB 44 coming back  <<< 
-- URB_FUNCTION_BULK_OR_INTERRUPT_TRANSFER:
  PipeHandle           = 85cfd7e4 [endpoint 0x00000081]
  TransferFlags        = 00000003 (USBD_TRANSFER_DIRECTION_IN, USBD_SHORT_TRANSFER_OK)
  TransferBufferLength = 00000012
  TransferBuffer       = 00000000
  TransferBufferMDL    = 8606a728
    00000000: 54 fd 64 01 00 ff 64 00 80 04 60 40 02 0a 0b 54
    00000010: 40 60
  UrbLink              = 00000000
[1088276 ms] UsbSnoop - FilterDispatchAny(b9c8efd2) : IRP_MJ_INTERNAL_DEVICE_CONTROL
[1088276 ms] UsbSnoop - FdoHookDispatchInternalIoctl(b9c8f1ea) : fdo=85a18c30, Irp=86a5ecf8, IRQL=0
[1088276 ms]  >>>  URB 47 going down  >>> 
-- URB_FUNCTION_BULK_OR_INTERRUPT_TRANSFER:
  PipeHandle           = 85cfd7e4 [endpoint 0x00000081]
  TransferFlags        = 00000003 (USBD_TRANSFER_DIRECTION_IN, USBD_SHORT_TRANSFER_OK)
  TransferBufferLength = 00000200
  TransferBuffer       = 00000000
  TransferBufferMDL    = 85954ad8
  UrbLink              = 00000000
[1088278 ms] UsbSnoop - MyInternalIOCTLCompletion(b9c8f126) : fido=86af0200, Irp=86a5ecf8, Context=85d29868, IRQL=2
[1088278 ms]  <<<  URB 47 coming back  <<< 
-- URB_FUNCTION_BULK_OR_INTERRUPT_TRANSFER:
  PipeHandle           = 85cfd7e4 [endpoint 0x00000081]
  TransferFlags        = 00000003 (USBD_TRANSFER_DIRECTION_IN, USBD_SHORT_TRANSFER_OK)
  TransferBufferLength = 00000012
  TransferBuffer       = 00000000
  TransferBufferMDL    = 85954ad8
    00000000: 54 fd 64 01 40 60 64 00 80 04 11 ff 02 00 0a 5a
    00000010: ff 11
  UrbLink              = 00000000
[1088278 ms] UsbSnoop - FilterDispatchAny(b9c8efd2) : IRP_MJ_INTERNAL_DEVICE_CONTROL
[1088278 ms] UsbSnoop - FdoHookDispatchInternalIoctl(b9c8f1ea) : fdo=85a18c30, Irp=86a5ecf8, IRQL=0
[1088278 ms]  >>>  URB 48 going down  >>> 
-- URB_FUNCTION_BULK_OR_INTERRUPT_TRANSFER:
  PipeHandle           = 85cfd7e4 [endpoint 0x00000081]
  TransferFlags        = 00000003 (USBD_TRANSFER_DIRECTION_IN, USBD_SHORT_TRANSFER_OK)
  TransferBufferLength = 00000200
  TransferBuffer       = 00000000
  TransferBufferMDL    = 85954ad8
  UrbLink              = 00000000
[1088278 ms] UsbSnoop - FilterDispatchAny(b9c8efd2) : IRP_MJ_INTERNAL_DEVICE_CONTROL
[1088278 ms] UsbSnoop - FdoHookDispatchInternalIoctl(b9c8f1ea) : fdo=85a18c30, Irp=858afcb0, IRQL=0
[1088278 ms]  >>>  URB 49 going down  >>> 
-- URB_FUNCTION_BULK_OR_INTERRUPT_TRANSFER:
  PipeHandle           = 85cfd804 [endpoint 0x00000002]
  TransferFlags        = 00000002 (USBD_TRANSFER_DIRECTION_OUT, USBD_SHORT_TRANSFER_OK)
  TransferBufferLength = 00000012
  TransferBuffer       = 00000000
  TransferBufferMDL    = 864f2970
    00000000: 54 fd 64 00 00 ff 64 01 40 60 04 80 02 0a 0a 53
    00000010: 80 04
  UrbLink              = 00000000
[1088279 ms] UsbSnoop - MyInternalIOCTLCompletion(b9c8f126) : fido=86af0200, Irp=858afcb0, Context=858bc360, IRQL=2
[1088279 ms]  <<<  URB 49 coming back  <<< 
-- URB_FUNCTION_BULK_OR_INTERRUPT_TRANSFER:
  PipeHandle           = 85cfd804 [endpoint 0x00000002]
  TransferFlags        = 00000002 (USBD_TRANSFER_DIRECTION_OUT, USBD_SHORT_TRANSFER_OK)
  TransferBufferLength = 00000012
  TransferBuffer       = 00000000
  TransferBufferMDL    = 864f2970
  UrbLink              = 00000000
[1088279 ms] UsbSnoop - FilterDispatchAny(b9c8efd2) : IRP_MJ_INTERNAL_DEVICE_CONTROL
[1088279 ms] UsbSnoop - FdoHookDispatchInternalIoctl(b9c8f1ea) : fdo=85a18c30, Irp=858afcb0, IRQL=0
[1088279 ms]  >>>  URB 50 going down  >>> 
-- URB_FUNCTION_BULK_OR_INTERRUPT_TRANSFER:
  PipeHandle           = 85cfd804 [endpoint 0x00000002]
  TransferFlags        = 00000002 (USBD_TRANSFER_DIRECTION_OUT, USBD_SHORT_TRANSFER_OK)
  TransferBufferLength = 00000011
  TransferBuffer       = 00000000
  TransferBufferMDL    = 864f2970
    00000000: 54 fd 64 00 80 04 64 01 40 60 0f 00 01 00 0c 5a
    00000010: 0f
  UrbLink              = 00000000
[1088280 ms] UsbSnoop - MyInternalIOCTLCompletion(b9c8f126) : fido=86af0200, Irp=858afcb0, Context=858bc360, IRQL=2
[1088280 ms]  <<<  URB 50 coming back  <<< 
-- URB_FUNCTION_BULK_OR_INTERRUPT_TRANSFER:
  PipeHandle           = 85cfd804 [endpoint 0x00000002]
  TransferFlags        = 00000002 (USBD_TRANSFER_DIRECTION_OUT, USBD_SHORT_TRANSFER_OK)
  TransferBufferLength = 00000011
  TransferBuffer       = 00000000
  TransferBufferMDL    = 864f2970
  UrbLink              = 00000000
[1088283 ms] UsbSnoop - MyInternalIOCTLCompletion(b9c8f126) : fido=86af0200, Irp=86a5ecf8, Context=85d29868, IRQL=2
[1088283 ms]  <<<  URB 48 coming back  <<< 
-- URB_FUNCTION_BULK_OR_INTERRUPT_TRANSFER:
  PipeHandle           = 85cfd7e4 [endpoint 0x00000081]
  TransferFlags        = 00000003 (USBD_TRANSFER_DIRECTION_IN, USBD_SHORT_TRANSFER_OK)
  TransferBufferLength = 00000012
  TransferBuffer       = 00000000
  TransferBufferMDL    = 85954ad8
    00000000: 54 fd 64 01 00 ff 64 00 80 04 60 40 02 0a 0c 55
    00000010: 40 60
  UrbLink              = 00000000
[1088283 ms] UsbSnoop - FilterDispatchAny(b9c8efd2) : IRP_MJ_INTERNAL_DEVICE_CONTROL
[1088283 ms] UsbSnoop - FdoHookDispatchInternalIoctl(b9c8f1ea) : fdo=85a18c30, Irp=86a5ecf8, IRQL=0
[1088283 ms]  >>>  URB 51 going down  >>> 
-- URB_FUNCTION_BULK_OR_INTERRUPT_TRANSFER:
  PipeHandle           = 85cfd7e4 [endpoint 0x00000081]
  TransferFlags        = 00000003 (USBD_TRANSFER_DIRECTION_IN, USBD_SHORT_TRANSFER_OK)
  TransferBufferLength = 00000200
  TransferBuffer       = 00000000
  TransferBufferMDL    = 85954ad8
  UrbLink              = 00000000
[1088287 ms] UsbSnoop - MyInternalIOCTLCompletion(b9c8f126) : fido=86af0200, Irp=86a5ecf8, Context=85d29868, IRQL=2
[1088287 ms]  <<<  URB 51 coming back  <<< 
-- URB_FUNCTION_BULK_OR_INTERRUPT_TRANSFER:
  PipeHandle           = 85cfd7e4 [endpoint 0x00000081]
  TransferFlags        = 00000003 (USBD_TRANSFER_DIRECTION_IN, USBD_SHORT_TRANSFER_OK)
  TransferBufferLength = 00000012
  TransferBuffer       = 00000000
  TransferBufferMDL    = 85954ad8
    00000000: 54 fd 64 01 40 60 64 00 80 04 00 ff 02 00 0b 4a
    00000010: ff 00
  UrbLink              = 00000000
[1088287 ms] UsbSnoop - FilterDispatchAny(b9c8efd2) : IRP_MJ_INTERNAL_DEVICE_CONTROL
[1088287 ms] UsbSnoop - FdoHookDispatchInternalIoctl(b9c8f1ea) : fdo=85a18c30, Irp=86a5ecf8, IRQL=0
[1088287 ms]  >>>  URB 52 going down  >>> 
-- URB_FUNCTION_BULK_OR_INTERRUPT_TRANSFER:
  PipeHandle           = 85cfd7e4 [endpoint 0x00000081]
  TransferFlags        = 00000003 (USBD_TRANSFER_DIRECTION_IN, USBD_SHORT_TRANSFER_OK)
  TransferBufferLength = 00000200
  TransferBuffer       = 00000000
  TransferBufferMDL    = 85954ad8
  UrbLink              = 00000000
[1088287 ms] UsbSnoop - FilterDispatchAny(b9c8efd2) : IRP_MJ_INTERNAL_DEVICE_CONTROL
[1088287 ms] UsbSnoop - FdoHookDispatchInternalIoctl(b9c8f1ea) : fdo=85a18c30, Irp=85930008, IRQL=0
[1088287 ms]  >>>  URB 53 going down  >>> 
-- URB_FUNCTION_BULK_OR_INTERRUPT_TRANSFER:
  PipeHandle           = 85cfd804 [endpoint 0x00000002]
  TransferFlags        = 00000002 (USBD_TRANSFER_DIRECTION_OUT, USBD_SHORT_TRANSFER_OK)
  TransferBufferLength = 00000012
  TransferBuffer       = 00000000
  TransferBufferMDL    = 863c08d8
    00000000: 54 fd 64 00 00 ff 64 01 40 60 04 80 02 0a 0b 54
    00000010: 80 04
  UrbLink              = 00000000
[1088288 ms] UsbSnoop - MyInternalIOCTLCompletion(b9c8f126) : fido=86af0200, Irp=85930008, Context=858bc360, IRQL=2
[1088288 ms]  <<<  URB 53 coming back  <<< 
-- URB_FUNCTION_BULK_OR_INTERRUPT_TRANSFER:
  PipeHandle           = 85cfd804 [endpoint 0x00000002]
  TransferFlags        = 00000002 (USBD_TRANSFER_DIRECTION_OUT, USBD_SHORT_TRANSFER_OK)
  TransferBufferLength = 00000012
  TransferBuffer       = 00000000
  TransferBufferMDL    = 863c08d8
  UrbLink              = 00000000
[1088289 ms] UsbSnoop - FilterDispatchAny(b9c8efd2) : IRP_MJ_INTERNAL_DEVICE_CONTROL
[1088289 ms] UsbSnoop - FdoHookDispatchInternalIoctl(b9c8f1ea) : fdo=85a18c30, Irp=85930008, IRQL=0
[1088289 ms]  >>>  URB 54 going down  >>> 
-- URB_FUNCTION_BULK_OR_INTERRUPT_TRANSFER:
  PipeHandle           = 85cfd804 [endpoint 0x00000002]
  TransferFlags        = 00000002 (USBD_TRANSFER_DIRECTION_OUT, USBD_SHORT_TRANSFER_OK)
  TransferBufferLength = 00000012
  TransferBuffer       = 00000000
  TransferBufferMDL    = 863c08d8
    00000000: 54 fd 64 00 40 de 64 01 40 60 04 80 02 00 0d 6b
    00000010: 80 04
  UrbLink              = 00000000
[1088290 ms] UsbSnoop - MyInternalIOCTLCompletion(b9c8f126) : fido=86af0200, Irp=85930008, Context=858bc360, IRQL=2
[1088290 ms]  <<<  URB 54 coming back  <<< 
-- URB_FUNCTION_BULK_OR_INTERRUPT_TRANSFER:
  PipeHandle           = 85cfd804 [endpoint 0x00000002]
  TransferFlags        = 00000002 (USBD_TRANSFER_DIRECTION_OUT, USBD_SHORT_TRANSFER_OK)
  TransferBufferLength = 00000012
  TransferBuffer       = 00000000
  TransferBufferMDL    = 863c08d8
  UrbLink              = 00000000
[1088293 ms] UsbSnoop - MyInternalIOCTLCompletion(b9c8f126) : fido=86af0200, Irp=86a5ecf8, Context=85d29868, IRQL=2
[1088293 ms]  <<<  URB 52 coming back  <<< 
-- URB_FUNCTION_BULK_OR_INTERRUPT_TRANSFER:
  PipeHandle           = 85cfd7e4 [endpoint 0x00000081]
  TransferFlags        = 00000003 (USBD_TRANSFER_DIRECTION_IN, USBD_SHORT_TRANSFER_OK)
  TransferBufferLength = 00000012
  TransferBuffer       = 00000000
  TransferBufferMDL    = 85954ad8
    00000000: 54 fd 64 01 00 ff 64 00 80 04 60 40 02 0a 0d 56
    00000010: 40 60
  UrbLink              = 00000000
[1088293 ms] UsbSnoop - FilterDispatchAny(b9c8efd2) : IRP_MJ_INTERNAL_DEVICE_CONTROL
[1088293 ms] UsbSnoop - FdoHookDispatchInternalIoctl(b9c8f1ea) : fdo=85a18c30, Irp=86a5ecf8, IRQL=0
[1088293 ms]  >>>  URB 55 going down  >>> 
-- URB_FUNCTION_BULK_OR_INTERRUPT_TRANSFER:
  PipeHandle           = 85cfd7e4 [endpoint 0x00000081]
  TransferFlags        = 00000003 (USBD_TRANSFER_DIRECTION_IN, USBD_SHORT_TRANSFER_OK)
  TransferBufferLength = 00000200
  TransferBuffer       = 00000000
  TransferBufferMDL    = 85954ad8
  UrbLink              = 00000000
[1088359 ms] UsbSnoop - FilterDispatchAny(b9c8efd2) : IRP_MJ_INTERNAL_DEVICE_CONTROL
[1088359 ms] UsbSnoop - FdoHookDispatchInternalIoctl(b9c8f1ea) : fdo=85a18c30, Irp=85930008, IRQL=0
[1088360 ms]  >>>  URB 56 going down  >>> 
-- URB_FUNCTION_BULK_OR_INTERRUPT_TRANSFER:
  PipeHandle           = 85cfd804 [endpoint 0x00000002]
  TransferFlags        = 00000002 (USBD_TRANSFER_DIRECTION_OUT, USBD_SHORT_TRANSFER_OK)
  TransferBufferLength = 0000001b
  TransferBuffer       = 00000000
  TransferBufferMDL    = 864f2970
    00000000: 54 fd 64 00 80 05 64 01 40 60 0c f1 0b 00 0e 55
    00000010: 20 01 2f 00 00 00 00 00 00 00 00
  UrbLink              = 00000000
[1088361 ms] UsbSnoop - MyInternalIOCTLCompletion(b9c8f126) : fido=86af0200, Irp=85930008, Context=858bc360, IRQL=2
[1088361 ms]  <<<  URB 56 coming back  <<< 
-- URB_FUNCTION_BULK_OR_INTERRUPT_TRANSFER:
  PipeHandle           = 85cfd804 [endpoint 0x00000002]
  TransferFlags        = 00000002 (USBD_TRANSFER_DIRECTION_OUT, USBD_SHORT_TRANSFER_OK)
  TransferBufferLength = 0000001b
  TransferBuffer       = 00000000
  TransferBufferMDL    = 864f2970
  UrbLink              = 00000000
[1088362 ms] UsbSnoop - MyInternalIOCTLCompletion(b9c8f126) : fido=86af0200, Irp=86a5ecf8, Context=85d29868, IRQL=2
[1088362 ms]  <<<  URB 55 coming back  <<< 
-- URB_FUNCTION_BULK_OR_INTERRUPT_TRANSFER:
  PipeHandle           = 85cfd7e4 [endpoint 0x00000081]
  TransferFlags        = 00000003 (USBD_TRANSFER_DIRECTION_IN, USBD_SHORT_TRANSFER_OK)
  TransferBufferLength = 00000012
  TransferBuffer       = 00000000
  TransferBufferMDL    = 85954ad8
    00000000: 54 fd 64 01 00 ff 64 00 80 05 60 40 02 0a 0e 58
    00000010: 40 60
  UrbLink              = 00000000
[1088362 ms] UsbSnoop - FilterDispatchAny(b9c8efd2) : IRP_MJ_INTERNAL_DEVICE_CONTROL
[1088362 ms] UsbSnoop - FdoHookDispatchInternalIoctl(b9c8f1ea) : fdo=85a18c30, Irp=86a5ecf8, IRQL=0
[1088362 ms]  >>>  URB 57 going down  >>> 
-- URB_FUNCTION_BULK_OR_INTERRUPT_TRANSFER:
  PipeHandle           = 85cfd7e4 [endpoint 0x00000081]
  TransferFlags        = 00000003 (USBD_TRANSFER_DIRECTION_IN, USBD_SHORT_TRANSFER_OK)
  TransferBufferLength = 00000200
  TransferBuffer       = 00000000
  TransferBufferMDL    = 85954ad8
  UrbLink              = 00000000
[1088374 ms] UsbSnoop - MyInternalIOCTLCompletion(b9c8f126) : fido=86af0200, Irp=86a5ecf8, Context=85d29868, IRQL=2
[1088374 ms]  <<<  URB 57 coming back  <<< 
-- URB_FUNCTION_BULK_OR_INTERRUPT_TRANSFER:
  PipeHandle           = 85cfd7e4 [endpoint 0x00000081]
  TransferFlags        = 00000003 (USBD_TRANSFER_DIRECTION_IN, USBD_SHORT_TRANSFER_OK)
  TransferBufferLength = 0000001b
  TransferBuffer       = 00000000
  TransferBufferMDL    = 85954ad8
    00000000: 54 fd 64 01 40 60 64 00 80 05 f7 38 0b 00 0c 85
    00000010: 20 00 00 00 00 00 00 00 00 01 00
  UrbLink              = 00000000
[1088374 ms] UsbSnoop - FilterDispatchAny(b9c8efd2) : IRP_MJ_INTERNAL_DEVICE_CONTROL
[1088374 ms] UsbSnoop - FdoHookDispatchInternalIoctl(b9c8f1ea) : fdo=85a18c30, Irp=86a5ecf8, IRQL=0
[1088374 ms]  >>>  URB 58 going down  >>> 
-- URB_FUNCTION_BULK_OR_INTERRUPT_TRANSFER:
  PipeHandle           = 85cfd7e4 [endpoint 0x00000081]
  TransferFlags        = 00000003 (USBD_TRANSFER_DIRECTION_IN, USBD_SHORT_TRANSFER_OK)
  TransferBufferLength = 00000200
  TransferBuffer       = 00000000
  TransferBufferMDL    = 85954ad8
  UrbLink              = 00000000
[1088374 ms] UsbSnoop - FilterDispatchAny(b9c8efd2) : IRP_MJ_INTERNAL_DEVICE_CONTROL
[1088374 ms] UsbSnoop - FdoHookDispatchInternalIoctl(b9c8f1ea) : fdo=85a18c30, Irp=85930a58, IRQL=0
[1088374 ms]  >>>  URB 59 going down  >>> 
-- URB_FUNCTION_BULK_OR_INTERRUPT_TRANSFER:
  PipeHandle           = 85cfd804 [endpoint 0x00000002]
  TransferFlags        = 00000002 (USBD_TRANSFER_DIRECTION_OUT, USBD_SHORT_TRANSFER_OK)
  TransferBufferLength = 00000012
  TransferBuffer       = 00000000
  TransferBufferMDL    = 8696df88
    00000000: 54 fd 64 00 00 ff 64 01 40 60 05 80 02 0a 0c 56
    00000010: 80 05
  UrbLink              = 00000000
[1088375 ms] UsbSnoop - MyInternalIOCTLCompletion(b9c8f126) : fido=86af0200, Irp=85930a58, Context=858bc360, IRQL=2
[1088375 ms]  <<<  URB 59 coming back  <<< 
-- URB_FUNCTION_BULK_OR_INTERRUPT_TRANSFER:
  PipeHandle           = 85cfd804 [endpoint 0x00000002]
  TransferFlags        = 00000002 (USBD_TRANSFER_DIRECTION_OUT, USBD_SHORT_TRANSFER_OK)
  TransferBufferLength = 00000012
  TransferBuffer       = 00000000
  TransferBufferMDL    = 8696df88
  UrbLink              = 00000000
[1088376 ms] UsbSnoop - FilterDispatchAny(b9c8efd2) : IRP_MJ_INTERNAL_DEVICE_CONTROL
[1088376 ms] UsbSnoop - FdoHookDispatchInternalIoctl(b9c8f1ea) : fdo=85a18c30, Irp=868bda18, IRQL=0
[1088376 ms]  >>>  URB 60 going down  >>> 
-- URB_FUNCTION_BULK_OR_INTERRUPT_TRANSFER:
  PipeHandle           = 85cfd804 [endpoint 0x00000002]
  TransferFlags        = 00000002 (USBD_TRANSFER_DIRECTION_OUT, USBD_SHORT_TRANSFER_OK)
  TransferBufferLength = 00000012
  TransferBuffer       = 00000000
  TransferBufferMDL    = 85b729d0
    00000000: 54 fd 64 00 40 de 64 01 40 60 05 80 02 00 0f 6e
    00000010: 80 05
  UrbLink              = 00000000
[1088377 ms] UsbSnoop - MyInternalIOCTLCompletion(b9c8f126) : fido=86af0200, Irp=868bda18, Context=858bc360, IRQL=2
[1088377 ms]  <<<  URB 60 coming back  <<< 
-- URB_FUNCTION_BULK_OR_INTERRUPT_TRANSFER:
  PipeHandle           = 85cfd804 [endpoint 0x00000002]
  TransferFlags        = 00000002 (USBD_TRANSFER_DIRECTION_OUT, USBD_SHORT_TRANSFER_OK)
  TransferBufferLength = 00000012
  TransferBuffer       = 00000000
  TransferBufferMDL    = 85b729d0
  UrbLink              = 00000000
[1088380 ms] UsbSnoop - MyInternalIOCTLCompletion(b9c8f126) : fido=86af0200, Irp=86a5ecf8, Context=85d29868, IRQL=2
[1088380 ms]  <<<  URB 58 coming back  <<< 
-- URB_FUNCTION_BULK_OR_INTERRUPT_TRANSFER:
  PipeHandle           = 85cfd7e4 [endpoint 0x00000081]
  TransferFlags        = 00000003 (USBD_TRANSFER_DIRECTION_IN, USBD_SHORT_TRANSFER_OK)
  TransferBufferLength = 00000012
  TransferBuffer       = 00000000
  TransferBufferMDL    = 85954ad8
    00000000: 54 fd 64 01 00 ff 64 00 80 05 60 40 02 0a 0f 59
    00000010: 40 60
  UrbLink              = 00000000
[1088380 ms] UsbSnoop - FilterDispatchAny(b9c8efd2) : IRP_MJ_INTERNAL_DEVICE_CONTROL
[1088380 ms] UsbSnoop - FdoHookDispatchInternalIoctl(b9c8f1ea) : fdo=85a18c30, Irp=86a5ecf8, IRQL=0
[1088380 ms]  >>>  URB 61 going down  >>> 
-- URB_FUNCTION_BULK_OR_INTERRUPT_TRANSFER:
  PipeHandle           = 85cfd7e4 [endpoint 0x00000081]
  TransferFlags        = 00000003 (USBD_TRANSFER_DIRECTION_IN, USBD_SHORT_TRANSFER_OK)
  TransferBufferLength = 00000200
  TransferBuffer       = 00000000
  TransferBufferMDL    = 85954ad8
  UrbLink              = 00000000
[1088384 ms] UsbSnoop - FilterDispatchAny(b9c8efd2) : IRP_MJ_INTERNAL_DEVICE_CONTROL
[1088384 ms] UsbSnoop - FdoHookDispatchInternalIoctl(b9c8f1ea) : fdo=85a18c30, Irp=86a5e968, IRQL=0
[1088384 ms]  >>>  URB 62 going down  >>> 
-- URB_FUNCTION_BULK_OR_INTERRUPT_TRANSFER:
  PipeHandle           = 85cfd804 [endpoint 0x00000002]
  TransferFlags        = 00000002 (USBD_TRANSFER_DIRECTION_OUT, USBD_SHORT_TRANSFER_OK)
  TransferBufferLength = 0000001a
  TransferBuffer       = 00000000
  TransferBufferMDL    = 85a42da8
    00000000: 54 fd 64 00 80 06 64 01 40 60 c0 aa 0a 00 10 c4
    00000010: 0d 2f 00 00 00 00 00 00 00 00
  UrbLink              = 00000000
[1088385 ms] UsbSnoop - MyInternalIOCTLCompletion(b9c8f126) : fido=86af0200, Irp=86a5e968, Context=858bc360, IRQL=2
[1088385 ms]  <<<  URB 62 coming back  <<< 
-- URB_FUNCTION_BULK_OR_INTERRUPT_TRANSFER:
  PipeHandle           = 85cfd804 [endpoint 0x00000002]
  TransferFlags        = 00000002 (USBD_TRANSFER_DIRECTION_OUT, USBD_SHORT_TRANSFER_OK)
  TransferBufferLength = 0000001a
  TransferBuffer       = 00000000
  TransferBufferMDL    = 85a42da8
  UrbLink              = 00000000
[1088386 ms] UsbSnoop - MyInternalIOCTLCompletion(b9c8f126) : fido=86af0200, Irp=86a5ecf8, Context=85d29868, IRQL=2
[1088386 ms]  <<<  URB 61 coming back  <<< 
-- URB_FUNCTION_BULK_OR_INTERRUPT_TRANSFER:
  PipeHandle           = 85cfd7e4 [endpoint 0x00000081]
  TransferFlags        = 00000003 (USBD_TRANSFER_DIRECTION_IN, USBD_SHORT_TRANSFER_OK)
  TransferBufferLength = 00000012
  TransferBuffer       = 00000000
  TransferBufferMDL    = 85954ad8
    00000000: 54 fd 64 01 00 ff 64 00 80 06 60 40 02 0a 10 5b
    00000010: 40 60
  UrbLink              = 00000000
[1088386 ms] UsbSnoop - FilterDispatchAny(b9c8efd2) : IRP_MJ_INTERNAL_DEVICE_CONTROL
[1088386 ms] UsbSnoop - FdoHookDispatchInternalIoctl(b9c8f1ea) : fdo=85a18c30, Irp=86a5ecf8, IRQL=0
[1088386 ms]  >>>  URB 63 going down  >>> 
-- URB_FUNCTION_BULK_OR_INTERRUPT_TRANSFER:
  PipeHandle           = 85cfd7e4 [endpoint 0x00000081]
  TransferFlags        = 00000003 (USBD_TRANSFER_DIRECTION_IN, USBD_SHORT_TRANSFER_OK)
  TransferBufferLength = 00000200
  TransferBuffer       = 00000000
  TransferBufferMDL    = 85954ad8
  UrbLink              = 00000000
[1088397 ms] UsbSnoop - MyInternalIOCTLCompletion(b9c8f126) : fido=86af0200, Irp=86a5ecf8, Context=85d29868, IRQL=2
[1088397 ms]  <<<  URB 63 coming back  <<< 
-- URB_FUNCTION_BULK_OR_INTERRUPT_TRANSFER:
  PipeHandle           = 85cfd7e4 [endpoint 0x00000081]
  TransferFlags        = 00000003 (USBD_TRANSFER_DIRECTION_IN, USBD_SHORT_TRANSFER_OK)
  TransferBufferLength = 00000012
  TransferBuffer       = 00000000
  TransferBufferMDL    = 85954ad8
    00000000: 54 fd 64 01 40 60 64 00 80 06 00 ff 02 00 0d 4e
    00000010: ff 00
  UrbLink              = 00000000
[1088397 ms] UsbSnoop - FilterDispatchAny(b9c8efd2) : IRP_MJ_INTERNAL_DEVICE_CONTROL
[1088397 ms] UsbSnoop - FdoHookDispatchInternalIoctl(b9c8f1ea) : fdo=85a18c30, Irp=86a5ecf8, IRQL=0
[1088397 ms]  >>>  URB 64 going down  >>> 
-- URB_FUNCTION_BULK_OR_INTERRUPT_TRANSFER:
  PipeHandle           = 85cfd7e4 [endpoint 0x00000081]
  TransferFlags        = 00000003 (USBD_TRANSFER_DIRECTION_IN, USBD_SHORT_TRANSFER_OK)
  TransferBufferLength = 00000200
  TransferBuffer       = 00000000
  TransferBufferMDL    = 85954ad8
  UrbLink              = 00000000
[1088397 ms] UsbSnoop - FilterDispatchAny(b9c8efd2) : IRP_MJ_INTERNAL_DEVICE_CONTROL
[1088397 ms] UsbSnoop - FdoHookDispatchInternalIoctl(b9c8f1ea) : fdo=85a18c30, Irp=858ad770, IRQL=0
[1088397 ms]  >>>  URB 65 going down  >>> 
-- URB_FUNCTION_BULK_OR_INTERRUPT_TRANSFER:
  PipeHandle           = 85cfd804 [endpoint 0x00000002]
  TransferFlags        = 00000002 (USBD_TRANSFER_DIRECTION_OUT, USBD_SHORT_TRANSFER_OK)
  TransferBufferLength = 00000012
  TransferBuffer       = 00000000
  TransferBufferMDL    = 869fcce0
    00000000: 54 fd 64 00 00 ff 64 01 40 60 06 80 02 0a 0d 58
    00000010: 80 06
  UrbLink              = 00000000
[1088398 ms] UsbSnoop - MyInternalIOCTLCompletion(b9c8f126) : fido=86af0200, Irp=858ad770, Context=858bc360, IRQL=2
[1088398 ms]  <<<  URB 65 coming back  <<< 
-- URB_FUNCTION_BULK_OR_INTERRUPT_TRANSFER:
  PipeHandle           = 85cfd804 [endpoint 0x00000002]
  TransferFlags        = 00000002 (USBD_TRANSFER_DIRECTION_OUT, USBD_SHORT_TRANSFER_OK)
  TransferBufferLength = 00000012
  TransferBuffer       = 00000000
  TransferBufferMDL    = 869fcce0
  UrbLink              = 00000000
[1088398 ms] UsbSnoop - FilterDispatchAny(b9c8efd2) : IRP_MJ_INTERNAL_DEVICE_CONTROL
[1088398 ms] UsbSnoop - FdoHookDispatchInternalIoctl(b9c8f1ea) : fdo=85a18c30, Irp=858c85a8, IRQL=0
[1088398 ms]  >>>  URB 66 going down  >>> 
-- URB_FUNCTION_BULK_OR_INTERRUPT_TRANSFER:
  PipeHandle           = 85cfd804 [endpoint 0x00000002]
  TransferFlags        = 00000002 (USBD_TRANSFER_DIRECTION_OUT, USBD_SHORT_TRANSFER_OK)
  TransferBufferLength = 00000011
  TransferBuffer       = 00000000
  TransferBufferMDL    = 86a33a60
    00000000: 54 fd 64 00 80 06 64 01 40 60 0e 00 01 00 11 60
    00000010: 0e
  UrbLink              = 00000000
[1088399 ms] UsbSnoop - MyInternalIOCTLCompletion(b9c8f126) : fido=86af0200, Irp=858c85a8, Context=858bc360, IRQL=2
[1088399 ms]  <<<  URB 66 coming back  <<< 
-- URB_FUNCTION_BULK_OR_INTERRUPT_TRANSFER:
  PipeHandle           = 85cfd804 [endpoint 0x00000002]
  TransferFlags        = 00000002 (USBD_TRANSFER_DIRECTION_OUT, USBD_SHORT_TRANSFER_OK)
  TransferBufferLength = 00000011
  TransferBuffer       = 00000000
  TransferBufferMDL    = 86a33a60
  UrbLink              = 00000000
[1088402 ms] UsbSnoop - MyInternalIOCTLCompletion(b9c8f126) : fido=86af0200, Irp=86a5ecf8, Context=85d29868, IRQL=2
[1088402 ms]  <<<  URB 64 coming back  <<< 
-- URB_FUNCTION_BULK_OR_INTERRUPT_TRANSFER:
  PipeHandle           = 85cfd7e4 [endpoint 0x00000081]
  TransferFlags        = 00000003 (USBD_TRANSFER_DIRECTION_IN, USBD_SHORT_TRANSFER_OK)
  TransferBufferLength = 00000012
  TransferBuffer       = 00000000
  TransferBufferMDL    = 85954ad8
    00000000: 54 fd 64 01 00 ff 64 00 80 06 60 40 02 0a 11 5c
    00000010: 40 60
  UrbLink              = 00000000
[1088402 ms] UsbSnoop - FilterDispatchAny(b9c8efd2) : IRP_MJ_INTERNAL_DEVICE_CONTROL
[1088402 ms] UsbSnoop - FdoHookDispatchInternalIoctl(b9c8f1ea) : fdo=85a18c30, Irp=858c85a8, IRQL=0
[1088402 ms]  >>>  URB 67 going down  >>> 
-- URB_FUNCTION_BULK_OR_INTERRUPT_TRANSFER:
  PipeHandle           = 85cfd7e4 [endpoint 0x00000081]
  TransferFlags        = 00000003 (USBD_TRANSFER_DIRECTION_IN, USBD_SHORT_TRANSFER_OK)
  TransferBufferLength = 00000200
  TransferBuffer       = 00000000
  TransferBufferMDL    = 85954ad8
  UrbLink              = 00000000
[1088411 ms] UsbSnoop - MyInternalIOCTLCompletion(b9c8f126) : fido=86af0200, Irp=858c85a8, Context=85d29868, IRQL=2
[1088411 ms]  <<<  URB 67 coming back  <<< 
-- URB_FUNCTION_BULK_OR_INTERRUPT_TRANSFER:
  PipeHandle           = 85cfd7e4 [endpoint 0x00000081]
  TransferFlags        = 00000003 (USBD_TRANSFER_DIRECTION_IN, USBD_SHORT_TRANSFER_OK)
  TransferBufferLength = 00000026
  TransferBuffer       = 00000000
  TransferBufferMDL    = 85954ad8
    00000000: 54 fd 64 01 40 60 64 00 80 06 d0 9f 16 00 0e d3
    00000010: 10 00 13 46 6f 6c 64 65 72 31 00 00 00 00 00 00
    00000020: 00 00 0d b1 01 00
  UrbLink              = 00000000
[1088411 ms] UsbSnoop - FilterDispatchAny(b9c8efd2) : IRP_MJ_INTERNAL_DEVICE_CONTROL
[1088411 ms] UsbSnoop - FdoHookDispatchInternalIoctl(b9c8f1ea) : fdo=85a18c30, Irp=858c85a8, IRQL=0
[1088411 ms]  >>>  URB 68 going down  >>> 
-- URB_FUNCTION_BULK_OR_INTERRUPT_TRANSFER:
  PipeHandle           = 85cfd7e4 [endpoint 0x00000081]
  TransferFlags        = 00000003 (USBD_TRANSFER_DIRECTION_IN, USBD_SHORT_TRANSFER_OK)
  TransferBufferLength = 00000200
  TransferBuffer       = 00000000
  TransferBufferMDL    = 85954ad8
  UrbLink              = 00000000
[1088411 ms] UsbSnoop - FilterDispatchAny(b9c8efd2) : IRP_MJ_INTERNAL_DEVICE_CONTROL
[1088411 ms] UsbSnoop - FdoHookDispatchInternalIoctl(b9c8f1ea) : fdo=85a18c30, Irp=858c26d8, IRQL=0
[1088411 ms]  >>>  URB 69 going down  >>> 
-- URB_FUNCTION_BULK_OR_INTERRUPT_TRANSFER:
  PipeHandle           = 85cfd804 [endpoint 0x00000002]
  TransferFlags        = 00000002 (USBD_TRANSFER_DIRECTION_OUT, USBD_SHORT_TRANSFER_OK)
  TransferBufferLength = 00000012
  TransferBuffer       = 00000000
  TransferBufferMDL    = 858d2388
    00000000: 54 fd 64 00 00 ff 64 01 40 60 06 80 02 0a 0e 59
    00000010: 80 06
  UrbLink              = 00000000
[1088412 ms] UsbSnoop - MyInternalIOCTLCompletion(b9c8f126) : fido=86af0200, Irp=858c26d8, Context=858bc360, IRQL=2
[1088412 ms]  <<<  URB 69 coming back  <<< 
-- URB_FUNCTION_BULK_OR_INTERRUPT_TRANSFER:
  PipeHandle           = 85cfd804 [endpoint 0x00000002]
  TransferFlags        = 00000002 (USBD_TRANSFER_DIRECTION_OUT, USBD_SHORT_TRANSFER_OK)
  TransferBufferLength = 00000012
  TransferBuffer       = 00000000
  TransferBufferMDL    = 858d2388
  UrbLink              = 00000000
[1088413 ms] UsbSnoop - FilterDispatchAny(b9c8efd2) : IRP_MJ_INTERNAL_DEVICE_CONTROL
[1088413 ms] UsbSnoop - FdoHookDispatchInternalIoctl(b9c8f1ea) : fdo=85a18c30, Irp=858c26d8, IRQL=0
[1088413 ms]  >>>  URB 70 going down  >>> 
-- URB_FUNCTION_BULK_OR_INTERRUPT_TRANSFER:
  PipeHandle           = 85cfd804 [endpoint 0x00000002]
  TransferFlags        = 00000002 (USBD_TRANSFER_DIRECTION_OUT, USBD_SHORT_TRANSFER_OK)
  TransferBufferLength = 00000011
  TransferBuffer       = 00000000
  TransferBufferMDL    = 858d2388
    00000000: 54 fd 64 00 80 06 64 01 40 60 0e 00 01 00 12 61
    00000010: 0e
  UrbLink              = 00000000
[1088414 ms] UsbSnoop - MyInternalIOCTLCompletion(b9c8f126) : fido=86af0200, Irp=858c26d8, Context=858bc360, IRQL=2
[1088414 ms]  <<<  URB 70 coming back  <<< 
-- URB_FUNCTION_BULK_OR_INTERRUPT_TRANSFER:
  PipeHandle           = 85cfd804 [endpoint 0x00000002]
  TransferFlags        = 00000002 (USBD_TRANSFER_DIRECTION_OUT, USBD_SHORT_TRANSFER_OK)
  TransferBufferLength = 00000011
  TransferBuffer       = 00000000
  TransferBufferMDL    = 858d2388
  UrbLink              = 00000000
[1088417 ms] UsbSnoop - MyInternalIOCTLCompletion(b9c8f126) : fido=86af0200, Irp=858c85a8, Context=85d29868, IRQL=2
[1088417 ms]  <<<  URB 68 coming back  <<< 
-- URB_FUNCTION_BULK_OR_INTERRUPT_TRANSFER:
  PipeHandle           = 85cfd7e4 [endpoint 0x00000081]
  TransferFlags        = 00000003 (USBD_TRANSFER_DIRECTION_IN, USBD_SHORT_TRANSFER_OK)
  TransferBufferLength = 00000012
  TransferBuffer       = 00000000
  TransferBufferMDL    = 85954ad8
    00000000: 54 fd 64 01 00 ff 64 00 80 06 60 40 02 0a 12 5d
    00000010: 40 60
  UrbLink              = 00000000
[1088417 ms] UsbSnoop - FilterDispatchAny(b9c8efd2) : IRP_MJ_INTERNAL_DEVICE_CONTROL
[1088417 ms] UsbSnoop - FdoHookDispatchInternalIoctl(b9c8f1ea) : fdo=85a18c30, Irp=858c26d8, IRQL=0
[1088417 ms]  >>>  URB 71 going down  >>> 
-- URB_FUNCTION_BULK_OR_INTERRUPT_TRANSFER:
  PipeHandle           = 85cfd7e4 [endpoint 0x00000081]
  TransferFlags        = 00000003 (USBD_TRANSFER_DIRECTION_IN, USBD_SHORT_TRANSFER_OK)
  TransferBufferLength = 00000200
  TransferBuffer       = 00000000
  TransferBufferMDL    = 8686a4d0
  UrbLink              = 00000000
[1088422 ms] UsbSnoop - MyInternalIOCTLCompletion(b9c8f126) : fido=86af0200, Irp=858c26d8, Context=85d29868, IRQL=2
[1088422 ms]  <<<  URB 71 coming back  <<< 
-- URB_FUNCTION_BULK_OR_INTERRUPT_TRANSFER:
  PipeHandle           = 85cfd7e4 [endpoint 0x00000081]
  TransferFlags        = 00000003 (USBD_TRANSFER_DIRECTION_IN, USBD_SHORT_TRANSFER_OK)
  TransferBufferLength = 00000026
  TransferBuffer       = 00000000
  TransferBufferMDL    = 8686a4d0
    00000000: 54 fd 64 01 40 60 64 00 80 06 39 ed 16 00 0f 8b
    00000010: 10 00 13 45 78 65 6d 70 6c 65 73 00 00 00 00 00
    00000020: 00 00 00 0b 01 00
  UrbLink              = 00000000
[1088422 ms] UsbSnoop - FilterDispatchAny(b9c8efd2) : IRP_MJ_INTERNAL_DEVICE_CONTROL
[1088422 ms] UsbSnoop - FdoHookDispatchInternalIoctl(b9c8f1ea) : fdo=85a18c30, Irp=858c26d8, IRQL=0
[1088422 ms]  >>>  URB 72 going down  >>> 
-- URB_FUNCTION_BULK_OR_INTERRUPT_TRANSFER:
  PipeHandle           = 85cfd7e4 [endpoint 0x00000081]
  TransferFlags        = 00000003 (USBD_TRANSFER_DIRECTION_IN, USBD_SHORT_TRANSFER_OK)
  TransferBufferLength = 00000200
  TransferBuffer       = 00000000
  TransferBufferMDL    = 861186f0
  UrbLink              = 00000000
[1088422 ms] UsbSnoop - FilterDispatchAny(b9c8efd2) : IRP_MJ_INTERNAL_DEVICE_CONTROL
[1088422 ms] UsbSnoop - FdoHookDispatchInternalIoctl(b9c8f1ea) : fdo=85a18c30, Irp=858ad770, IRQL=0
[1088422 ms]  >>>  URB 73 going down  >>> 
-- URB_FUNCTION_BULK_OR_INTERRUPT_TRANSFER:
  PipeHandle           = 85cfd804 [endpoint 0x00000002]
  TransferFlags        = 00000002 (USBD_TRANSFER_DIRECTION_OUT, USBD_SHORT_TRANSFER_OK)
  TransferBufferLength = 00000012
  TransferBuffer       = 00000000
  TransferBufferMDL    = 858bcba0
    00000000: 54 fd 64 00 00 ff 64 01 40 60 06 80 02 0a 0f 5a
    00000010: 80 06
  UrbLink              = 00000000
[1088423 ms] UsbSnoop - MyInternalIOCTLCompletion(b9c8f126) : fido=86af0200, Irp=858ad770, Context=858bc360, IRQL=2
[1088423 ms]  <<<  URB 73 coming back  <<< 
-- URB_FUNCTION_BULK_OR_INTERRUPT_TRANSFER:
  PipeHandle           = 85cfd804 [endpoint 0x00000002]
  TransferFlags        = 00000002 (USBD_TRANSFER_DIRECTION_OUT, USBD_SHORT_TRANSFER_OK)
  TransferBufferLength = 00000012
  TransferBuffer       = 00000000
  TransferBufferMDL    = 858bcba0
  UrbLink              = 00000000
[1088424 ms] UsbSnoop - FilterDispatchAny(b9c8efd2) : IRP_MJ_INTERNAL_DEVICE_CONTROL
[1088424 ms] UsbSnoop - FdoHookDispatchInternalIoctl(b9c8f1ea) : fdo=85a18c30, Irp=858ad770, IRQL=0
[1088424 ms]  >>>  URB 74 going down  >>> 
-- URB_FUNCTION_BULK_OR_INTERRUPT_TRANSFER:
  PipeHandle           = 85cfd804 [endpoint 0x00000002]
  TransferFlags        = 00000002 (USBD_TRANSFER_DIRECTION_OUT, USBD_SHORT_TRANSFER_OK)
  TransferBufferLength = 00000011
  TransferBuffer       = 00000000
  TransferBufferMDL    = 869fcce0
    00000000: 54 fd 64 00 80 06 64 01 40 60 0e 00 01 00 13 62
    00000010: 0e
  UrbLink              = 00000000
[1088425 ms] UsbSnoop - MyInternalIOCTLCompletion(b9c8f126) : fido=86af0200, Irp=858ad770, Context=858bc360, IRQL=2
[1088425 ms]  <<<  URB 74 coming back  <<< 
-- URB_FUNCTION_BULK_OR_INTERRUPT_TRANSFER:
  PipeHandle           = 85cfd804 [endpoint 0x00000002]
  TransferFlags        = 00000002 (USBD_TRANSFER_DIRECTION_OUT, USBD_SHORT_TRANSFER_OK)
  TransferBufferLength = 00000011
  TransferBuffer       = 00000000
  TransferBufferMDL    = 869fcce0
  UrbLink              = 00000000
[1088428 ms] UsbSnoop - MyInternalIOCTLCompletion(b9c8f126) : fido=86af0200, Irp=858c26d8, Context=85d29868, IRQL=2
[1088428 ms]  <<<  URB 72 coming back  <<< 
-- URB_FUNCTION_BULK_OR_INTERRUPT_TRANSFER:
  PipeHandle           = 85cfd7e4 [endpoint 0x00000081]
  TransferFlags        = 00000003 (USBD_TRANSFER_DIRECTION_IN, USBD_SHORT_TRANSFER_OK)
  TransferBufferLength = 00000012
  TransferBuffer       = 00000000
  TransferBufferMDL    = 861186f0
    00000000: 54 fd 64 01 00 ff 64 00 80 06 60 40 02 0a 13 5e
    00000010: 40 60
  UrbLink              = 00000000
[1088428 ms] UsbSnoop - FilterDispatchAny(b9c8efd2) : IRP_MJ_INTERNAL_DEVICE_CONTROL
[1088428 ms] UsbSnoop - FdoHookDispatchInternalIoctl(b9c8f1ea) : fdo=85a18c30, Irp=858c26d8, IRQL=0
[1088428 ms]  >>>  URB 75 going down  >>> 
-- URB_FUNCTION_BULK_OR_INTERRUPT_TRANSFER:
  PipeHandle           = 85cfd7e4 [endpoint 0x00000081]
  TransferFlags        = 00000003 (USBD_TRANSFER_DIRECTION_IN, USBD_SHORT_TRANSFER_OK)
  TransferBufferLength = 00000200
  TransferBuffer       = 00000000
  TransferBufferMDL    = 86a33a60
  UrbLink              = 00000000
[1088431 ms] UsbSnoop - MyInternalIOCTLCompletion(b9c8f126) : fido=86af0200, Irp=858c26d8, Context=85d29868, IRQL=2
[1088431 ms]  <<<  URB 75 coming back  <<< 
-- URB_FUNCTION_BULK_OR_INTERRUPT_TRANSFER:
  PipeHandle           = 85cfd7e4 [endpoint 0x00000081]
  TransferFlags        = 00000003 (USBD_TRANSFER_DIRECTION_IN, USBD_SHORT_TRANSFER_OK)
  TransferBufferLength = 00000026
  TransferBuffer       = 00000000
  TransferBufferMDL    = 86a33a60
    00000000: 54 fd 64 01 40 60 64 00 80 06 27 b4 16 00 10 41
    00000010: 10 00 13 4d 79 4c 69 62 00 00 00 00 00 00 00 00
    00000020: 00 00 01 bf 01 00
  UrbLink              = 00000000
[1088431 ms] UsbSnoop - FilterDispatchAny(b9c8efd2) : IRP_MJ_INTERNAL_DEVICE_CONTROL
[1088431 ms] UsbSnoop - FdoHookDispatchInternalIoctl(b9c8f1ea) : fdo=85a18c30, Irp=858c26d8, IRQL=0
[1088431 ms]  >>>  URB 76 going down  >>> 
-- URB_FUNCTION_BULK_OR_INTERRUPT_TRANSFER:
  PipeHandle           = 85cfd7e4 [endpoint 0x00000081]
  TransferFlags        = 00000003 (USBD_TRANSFER_DIRECTION_IN, USBD_SHORT_TRANSFER_OK)
  TransferBufferLength = 00000200
  TransferBuffer       = 00000000
  TransferBufferMDL    = 858b52b8
  UrbLink              = 00000000
[1088431 ms] UsbSnoop - FilterDispatchAny(b9c8efd2) : IRP_MJ_INTERNAL_DEVICE_CONTROL
[1088431 ms] UsbSnoop - FdoHookDispatchInternalIoctl(b9c8f1ea) : fdo=85a18c30, Irp=858ad770, IRQL=0
[1088431 ms]  >>>  URB 77 going down  >>> 
-- URB_FUNCTION_BULK_OR_INTERRUPT_TRANSFER:
  PipeHandle           = 85cfd804 [endpoint 0x00000002]
  TransferFlags        = 00000002 (USBD_TRANSFER_DIRECTION_OUT, USBD_SHORT_TRANSFER_OK)
  TransferBufferLength = 00000012
  TransferBuffer       = 00000000
  TransferBufferMDL    = 861d08d0
    00000000: 54 fd 64 00 00 ff 64 01 40 60 06 80 02 0a 10 5b
    00000010: 80 06
  UrbLink              = 00000000
[1088432 ms] UsbSnoop - MyInternalIOCTLCompletion(b9c8f126) : fido=86af0200, Irp=858ad770, Context=858bc360, IRQL=2
[1088432 ms]  <<<  URB 77 coming back  <<< 
-- URB_FUNCTION_BULK_OR_INTERRUPT_TRANSFER:
  PipeHandle           = 85cfd804 [endpoint 0x00000002]
  TransferFlags        = 00000002 (USBD_TRANSFER_DIRECTION_OUT, USBD_SHORT_TRANSFER_OK)
  TransferBufferLength = 00000012
  TransferBuffer       = 00000000
  TransferBufferMDL    = 861d08d0
  UrbLink              = 00000000
[1088434 ms] UsbSnoop - FilterDispatchAny(b9c8efd2) : IRP_MJ_INTERNAL_DEVICE_CONTROL
[1088434 ms] UsbSnoop - FdoHookDispatchInternalIoctl(b9c8f1ea) : fdo=85a18c30, Irp=858c85a8, IRQL=0
[1088434 ms]  >>>  URB 78 going down  >>> 
-- URB_FUNCTION_BULK_OR_INTERRUPT_TRANSFER:
  PipeHandle           = 85cfd804 [endpoint 0x00000002]
  TransferFlags        = 00000002 (USBD_TRANSFER_DIRECTION_OUT, USBD_SHORT_TRANSFER_OK)
  TransferBufferLength = 00000011
  TransferBuffer       = 00000000
  TransferBufferMDL    = 86a33a60
    00000000: 54 fd 64 00 80 06 64 01 40 60 0e 00 01 00 14 63
    00000010: 0e
  UrbLink              = 00000000
[1088435 ms] UsbSnoop - MyInternalIOCTLCompletion(b9c8f126) : fido=86af0200, Irp=858c85a8, Context=858bc360, IRQL=2
[1088435 ms]  <<<  URB 78 coming back  <<< 
-- URB_FUNCTION_BULK_OR_INTERRUPT_TRANSFER:
  PipeHandle           = 85cfd804 [endpoint 0x00000002]
  TransferFlags        = 00000002 (USBD_TRANSFER_DIRECTION_OUT, USBD_SHORT_TRANSFER_OK)
  TransferBufferLength = 00000011
  TransferBuffer       = 00000000
  TransferBufferMDL    = 86a33a60
  UrbLink              = 00000000
[1088437 ms] UsbSnoop - MyInternalIOCTLCompletion(b9c8f126) : fido=86af0200, Irp=858c26d8, Context=85d29868, IRQL=2
[1088437 ms]  <<<  URB 76 coming back  <<< 
-- URB_FUNCTION_BULK_OR_INTERRUPT_TRANSFER:
  PipeHandle           = 85cfd7e4 [endpoint 0x00000081]
  TransferFlags        = 00000003 (USBD_TRANSFER_DIRECTION_IN, USBD_SHORT_TRANSFER_OK)
  TransferBufferLength = 00000012
  TransferBuffer       = 00000000
  TransferBufferMDL    = 858b52b8
    00000000: 54 fd 64 01 00 ff 64 00 80 06 60 40 02 0a 14 5f
    00000010: 40 60
  UrbLink              = 00000000
[1088437 ms] UsbSnoop - FilterDispatchAny(b9c8efd2) : IRP_MJ_INTERNAL_DEVICE_CONTROL
[1088437 ms] UsbSnoop - FdoHookDispatchInternalIoctl(b9c8f1ea) : fdo=85a18c30, Irp=858c26d8, IRQL=0
[1088437 ms]  >>>  URB 79 going down  >>> 
-- URB_FUNCTION_BULK_OR_INTERRUPT_TRANSFER:
  PipeHandle           = 85cfd7e4 [endpoint 0x00000081]
  TransferFlags        = 00000003 (USBD_TRANSFER_DIRECTION_IN, USBD_SHORT_TRANSFER_OK)
  TransferBufferLength = 00000200
  TransferBuffer       = 00000000
  TransferBufferMDL    = 861d08d0
  UrbLink              = 00000000
[1088440 ms] UsbSnoop - MyInternalIOCTLCompletion(b9c8f126) : fido=86af0200, Irp=858c26d8, Context=85d29868, IRQL=2
[1088440 ms]  <<<  URB 79 coming back  <<< 
-- URB_FUNCTION_BULK_OR_INTERRUPT_TRANSFER:
  PipeHandle           = 85cfd7e4 [endpoint 0x00000081]
  TransferFlags        = 00000003 (USBD_TRANSFER_DIRECTION_IN, USBD_SHORT_TRANSFER_OK)
  TransferBufferLength = 00000012
  TransferBuffer       = 00000000
  TransferBufferMDL    = 861d08d0
    00000000: 54 fd 64 01 40 60 64 00 80 06 11 ff 02 00 11 63
    00000010: ff 11
  UrbLink              = 00000000
[1088440 ms] UsbSnoop - FilterDispatchAny(b9c8efd2) : IRP_MJ_INTERNAL_DEVICE_CONTROL
[1088440 ms] UsbSnoop - FdoHookDispatchInternalIoctl(b9c8f1ea) : fdo=85a18c30, Irp=858c26d8, IRQL=0
[1088440 ms]  >>>  URB 80 going down  >>> 
-- URB_FUNCTION_BULK_OR_INTERRUPT_TRANSFER:
  PipeHandle           = 85cfd7e4 [endpoint 0x00000081]
  TransferFlags        = 00000003 (USBD_TRANSFER_DIRECTION_IN, USBD_SHORT_TRANSFER_OK)
  TransferBufferLength = 00000200
  TransferBuffer       = 00000000
  TransferBufferMDL    = 861186f0
  UrbLink              = 00000000
[1088440 ms] UsbSnoop - FilterDispatchAny(b9c8efd2) : IRP_MJ_INTERNAL_DEVICE_CONTROL
[1088440 ms] UsbSnoop - FdoHookDispatchInternalIoctl(b9c8f1ea) : fdo=85a18c30, Irp=858c85a8, IRQL=0
[1088440 ms]  >>>  URB 81 going down  >>> 
-- URB_FUNCTION_BULK_OR_INTERRUPT_TRANSFER:
  PipeHandle           = 85cfd804 [endpoint 0x00000002]
  TransferFlags        = 00000002 (USBD_TRANSFER_DIRECTION_OUT, USBD_SHORT_TRANSFER_OK)
  TransferBufferLength = 00000012
  TransferBuffer       = 00000000
  TransferBufferMDL    = 858bcba0
    00000000: 54 fd 64 00 00 ff 64 01 40 60 06 80 02 0a 11 5c
    00000010: 80 06
  UrbLink              = 00000000
[1088441 ms] UsbSnoop - MyInternalIOCTLCompletion(b9c8f126) : fido=86af0200, Irp=858c85a8, Context=858bc360, IRQL=2
[1088441 ms]  <<<  URB 81 coming back  <<< 
-- URB_FUNCTION_BULK_OR_INTERRUPT_TRANSFER:
  PipeHandle           = 85cfd804 [endpoint 0x00000002]
  TransferFlags        = 00000002 (USBD_TRANSFER_DIRECTION_OUT, USBD_SHORT_TRANSFER_OK)
  TransferBufferLength = 00000012
  TransferBuffer       = 00000000
  TransferBufferMDL    = 858bcba0
  UrbLink              = 00000000
[1088441 ms] UsbSnoop - FilterDispatchAny(b9c8efd2) : IRP_MJ_INTERNAL_DEVICE_CONTROL
[1088441 ms] UsbSnoop - FdoHookDispatchInternalIoctl(b9c8f1ea) : fdo=85a18c30, Irp=858c85a8, IRQL=0
[1088441 ms]  >>>  URB 82 going down  >>> 
-- URB_FUNCTION_BULK_OR_INTERRUPT_TRANSFER:
  PipeHandle           = 85cfd804 [endpoint 0x00000002]
  TransferFlags        = 00000002 (USBD_TRANSFER_DIRECTION_OUT, USBD_SHORT_TRANSFER_OK)
  TransferBufferLength = 00000011
  TransferBuffer       = 00000000
  TransferBufferMDL    = 8686a4d0
    00000000: 54 fd 64 00 80 06 64 01 40 60 0f 00 01 00 15 65
    00000010: 0f
  UrbLink              = 00000000
[1088442 ms] UsbSnoop - MyInternalIOCTLCompletion(b9c8f126) : fido=86af0200, Irp=858c85a8, Context=858bc360, IRQL=2
[1088442 ms]  <<<  URB 82 coming back  <<< 
-- URB_FUNCTION_BULK_OR_INTERRUPT_TRANSFER:
  PipeHandle           = 85cfd804 [endpoint 0x00000002]
  TransferFlags        = 00000002 (USBD_TRANSFER_DIRECTION_OUT, USBD_SHORT_TRANSFER_OK)
  TransferBufferLength = 00000011
  TransferBuffer       = 00000000
  TransferBufferMDL    = 8686a4d0
  UrbLink              = 00000000
[1088445 ms] UsbSnoop - MyInternalIOCTLCompletion(b9c8f126) : fido=86af0200, Irp=858c26d8, Context=85d29868, IRQL=2
[1088445 ms]  <<<  URB 80 coming back  <<< 
-- URB_FUNCTION_BULK_OR_INTERRUPT_TRANSFER:
  PipeHandle           = 85cfd7e4 [endpoint 0x00000081]
  TransferFlags        = 00000003 (USBD_TRANSFER_DIRECTION_IN, USBD_SHORT_TRANSFER_OK)
  TransferBufferLength = 00000012
  TransferBuffer       = 00000000
  TransferBufferMDL    = 861186f0
    00000000: 54 fd 64 01 00 ff 64 00 80 06 60 40 02 0a 15 60
    00000010: 40 60
  UrbLink              = 00000000
[1088445 ms] UsbSnoop - FilterDispatchAny(b9c8efd2) : IRP_MJ_INTERNAL_DEVICE_CONTROL
[1088445 ms] UsbSnoop - FdoHookDispatchInternalIoctl(b9c8f1ea) : fdo=85a18c30, Irp=858c26d8, IRQL=0
[1088445 ms]  >>>  URB 83 going down  >>> 
-- URB_FUNCTION_BULK_OR_INTERRUPT_TRANSFER:
  PipeHandle           = 85cfd7e4 [endpoint 0x00000081]
  TransferFlags        = 00000003 (USBD_TRANSFER_DIRECTION_IN, USBD_SHORT_TRANSFER_OK)
  TransferBufferLength = 00000200
  TransferBuffer       = 00000000
  TransferBufferMDL    = 869fcce0
  UrbLink              = 00000000
[1088449 ms] UsbSnoop - MyInternalIOCTLCompletion(b9c8f126) : fido=86af0200, Irp=858c26d8, Context=85d29868, IRQL=2
[1088449 ms]  <<<  URB 83 coming back  <<< 
-- URB_FUNCTION_BULK_OR_INTERRUPT_TRANSFER:
  PipeHandle           = 85cfd7e4 [endpoint 0x00000081]
  TransferFlags        = 00000003 (USBD_TRANSFER_DIRECTION_IN, USBD_SHORT_TRANSFER_OK)
  TransferBufferLength = 00000012
  TransferBuffer       = 00000000
  TransferBufferMDL    = 869fcce0
    00000000: 54 fd 64 01 40 60 64 00 80 06 00 ff 02 00 12 53
    00000010: ff 00
  UrbLink              = 00000000
[1088449 ms] UsbSnoop - FilterDispatchAny(b9c8efd2) : IRP_MJ_INTERNAL_DEVICE_CONTROL
[1088449 ms] UsbSnoop - FdoHookDispatchInternalIoctl(b9c8f1ea) : fdo=85a18c30, Irp=858c26d8, IRQL=0
[1088449 ms]  >>>  URB 84 going down  >>> 
-- URB_FUNCTION_BULK_OR_INTERRUPT_TRANSFER:
  PipeHandle           = 85cfd7e4 [endpoint 0x00000081]
  TransferFlags        = 00000003 (USBD_TRANSFER_DIRECTION_IN, USBD_SHORT_TRANSFER_OK)
  TransferBufferLength = 00000200
  TransferBuffer       = 00000000
  TransferBufferMDL    = 85954ad8
  UrbLink              = 00000000
[1088449 ms] UsbSnoop - FilterDispatchAny(b9c8efd2) : IRP_MJ_INTERNAL_DEVICE_CONTROL
[1088449 ms] UsbSnoop - FdoHookDispatchInternalIoctl(b9c8f1ea) : fdo=85a18c30, Irp=858c85a8, IRQL=0
[1088449 ms]  >>>  URB 85 going down  >>> 
-- URB_FUNCTION_BULK_OR_INTERRUPT_TRANSFER:
  PipeHandle           = 85cfd804 [endpoint 0x00000002]
  TransferFlags        = 00000002 (USBD_TRANSFER_DIRECTION_OUT, USBD_SHORT_TRANSFER_OK)
  TransferBufferLength = 00000012
  TransferBuffer       = 00000000
  TransferBufferMDL    = 85894ec8
    00000000: 54 fd 64 00 00 ff 64 01 40 60 06 80 02 0a 12 5d
    00000010: 80 06
  UrbLink              = 00000000
[1088450 ms] UsbSnoop - MyInternalIOCTLCompletion(b9c8f126) : fido=86af0200, Irp=858c85a8, Context=858bc360, IRQL=2
[1088450 ms]  <<<  URB 85 coming back  <<< 
-- URB_FUNCTION_BULK_OR_INTERRUPT_TRANSFER:
  PipeHandle           = 85cfd804 [endpoint 0x00000002]
  TransferFlags        = 00000002 (USBD_TRANSFER_DIRECTION_OUT, USBD_SHORT_TRANSFER_OK)
  TransferBufferLength = 00000012
  TransferBuffer       = 00000000
  TransferBufferMDL    = 85894ec8
  UrbLink              = 00000000
[1088451 ms] UsbSnoop - FilterDispatchAny(b9c8efd2) : IRP_MJ_INTERNAL_DEVICE_CONTROL
[1088451 ms] UsbSnoop - FdoHookDispatchInternalIoctl(b9c8f1ea) : fdo=85a18c30, Irp=858ad770, IRQL=0
[1088451 ms]  >>>  URB 86 going down  >>> 
-- URB_FUNCTION_BULK_OR_INTERRUPT_TRANSFER:
  PipeHandle           = 85cfd804 [endpoint 0x00000002]
  TransferFlags        = 00000002 (USBD_TRANSFER_DIRECTION_OUT, USBD_SHORT_TRANSFER_OK)
  TransferBufferLength = 00000012
  TransferBuffer       = 00000000
  TransferBufferMDL    = 869fcce0
    00000000: 54 fd 64 00 40 de 64 01 40 60 06 80 02 00 16 76
    00000010: 80 06
  UrbLink              = 00000000
[1088452 ms] UsbSnoop - MyInternalIOCTLCompletion(b9c8f126) : fido=86af0200, Irp=858ad770, Context=858bc360, IRQL=2
[1088452 ms]  <<<  URB 86 coming back  <<< 
-- URB_FUNCTION_BULK_OR_INTERRUPT_TRANSFER:
  PipeHandle           = 85cfd804 [endpoint 0x00000002]
  TransferFlags        = 00000002 (USBD_TRANSFER_DIRECTION_OUT, USBD_SHORT_TRANSFER_OK)
  TransferBufferLength = 00000012
  TransferBuffer       = 00000000
  TransferBufferMDL    = 869fcce0
  UrbLink              = 00000000
[1088455 ms] UsbSnoop - MyInternalIOCTLCompletion(b9c8f126) : fido=86af0200, Irp=858c26d8, Context=85d29868, IRQL=2
[1088455 ms]  <<<  URB 84 coming back  <<< 
-- URB_FUNCTION_BULK_OR_INTERRUPT_TRANSFER:
  PipeHandle           = 85cfd7e4 [endpoint 0x00000081]
  TransferFlags        = 00000003 (USBD_TRANSFER_DIRECTION_IN, USBD_SHORT_TRANSFER_OK)
  TransferBufferLength = 00000012
  TransferBuffer       = 00000000
  TransferBufferMDL    = 85954ad8
    00000000: 54 fd 64 01 00 ff 64 00 80 06 60 40 02 0a 16 61
    00000010: 40 60
  UrbLink              = 00000000
[1088455 ms] UsbSnoop - FilterDispatchAny(b9c8efd2) : IRP_MJ_INTERNAL_DEVICE_CONTROL
[1088455 ms] UsbSnoop - FdoHookDispatchInternalIoctl(b9c8f1ea) : fdo=85a18c30, Irp=858c26d8, IRQL=0
[1088455 ms]  >>>  URB 87 going down  >>> 
-- URB_FUNCTION_BULK_OR_INTERRUPT_TRANSFER:
  PipeHandle           = 85cfd7e4 [endpoint 0x00000081]
  TransferFlags        = 00000003 (USBD_TRANSFER_DIRECTION_IN, USBD_SHORT_TRANSFER_OK)
  TransferBufferLength = 00000200
  TransferBuffer       = 00000000
  TransferBufferMDL    = 85894ec8
  UrbLink              = 00000000
[1088502 ms] UsbSnoop - FilterDispatchAny(b9c8efd2) : IRP_MJ_INTERNAL_DEVICE_CONTROL
[1088502 ms] UsbSnoop - FdoHookDispatchInternalIoctl(b9c8f1ea) : fdo=85a18c30, Irp=858ad770, IRQL=0
[1088502 ms]  >>>  URB 88 going down  >>> 
-- URB_FUNCTION_BULK_OR_INTERRUPT_TRANSFER:
  PipeHandle           = 85cfd804 [endpoint 0x00000002]
  TransferFlags        = 00000002 (USBD_TRANSFER_DIRECTION_OUT, USBD_SHORT_TRANSFER_OK)
  TransferBufferLength = 00000011
  TransferBuffer       = 00000000
  TransferBufferMDL    = 85954ad8
    00000000: 54 fd 64 00 80 07 64 01 40 20 01 00 01 00 17 1a
    00000010: 01
  UrbLink              = 00000000
[1088504 ms] UsbSnoop - MyInternalIOCTLCompletion(b9c8f126) : fido=86af0200, Irp=858ad770, Context=858bc360, IRQL=2
[1088504 ms]  <<<  URB 88 coming back  <<< 
-- URB_FUNCTION_BULK_OR_INTERRUPT_TRANSFER:
  PipeHandle           = 85cfd804 [endpoint 0x00000002]
  TransferFlags        = 00000002 (USBD_TRANSFER_DIRECTION_OUT, USBD_SHORT_TRANSFER_OK)
  TransferBufferLength = 00000011
  TransferBuffer       = 00000000
  TransferBufferMDL    = 85954ad8
  UrbLink              = 00000000
[1088505 ms] UsbSnoop - MyInternalIOCTLCompletion(b9c8f126) : fido=86af0200, Irp=858c26d8, Context=85d29868, IRQL=2
[1088505 ms]  <<<  URB 87 coming back  <<< 
-- URB_FUNCTION_BULK_OR_INTERRUPT_TRANSFER:
  PipeHandle           = 85cfd7e4 [endpoint 0x00000081]
  TransferFlags        = 00000003 (USBD_TRANSFER_DIRECTION_IN, USBD_SHORT_TRANSFER_OK)
  TransferBufferLength = 00000012
  TransferBuffer       = 00000000
  TransferBufferMDL    = 85894ec8
    00000000: 54 fd 64 01 00 ff 64 00 80 07 20 40 02 0a 17 23
    00000010: 40 20
  UrbLink              = 00000000
[1088505 ms] UsbSnoop - FilterDispatchAny(b9c8efd2) : IRP_MJ_INTERNAL_DEVICE_CONTROL
[1088505 ms] UsbSnoop - FdoHookDispatchInternalIoctl(b9c8f1ea) : fdo=85a18c30, Irp=858c26d8, IRQL=0
[1088505 ms]  >>>  URB 89 going down  >>> 
-- URB_FUNCTION_BULK_OR_INTERRUPT_TRANSFER:
  PipeHandle           = 85cfd7e4 [endpoint 0x00000081]
  TransferFlags        = 00000003 (USBD_TRANSFER_DIRECTION_IN, USBD_SHORT_TRANSFER_OK)
  TransferBufferLength = 00000200
  TransferBuffer       = 00000000
  TransferBufferMDL    = 85894ec8
  UrbLink              = 00000000
[1088513 ms] UsbSnoop - MyInternalIOCTLCompletion(b9c8f126) : fido=86af0200, Irp=858c26d8, Context=85d29868, IRQL=2
[1088513 ms]  <<<  URB 89 coming back  <<< 
-- URB_FUNCTION_BULK_OR_INTERRUPT_TRANSFER:
  PipeHandle           = 85cfd7e4 [endpoint 0x00000081]
  TransferFlags        = 00000003 (USBD_TRANSFER_DIRECTION_IN, USBD_SHORT_TRANSFER_OK)
  TransferBufferLength = 0000007f
  TransferBuffer       = 00000000
  TransferBufferMDL    = 85894ec8
    00000000: 54 fd 64 01 40 20 64 00 80 07 54 ea 6f 00 13 c1
    00000010: 01 00 00 00 00 01 41 2c 00 00 00 00 00 01 be 00
    00000020: 00 00 00 00 00 01 47 da 8c 00 00 00 00 01 73 06
    00000030: 04 7f 00 00 5a 01 03 09 86 01 01 22 d4 01 01 23
    00000040: 15 00 00 00 00 00 02 00 00 00 00 01 40 00 f0 04
    00000050: 00 1e 30 30 30 30 34 42 43 31 42 31 30 45 35 37
    00000060: 30 46 00 30 45 30 30 30 30 30 34 42 43 31 42 31
    00000070: 30 45 35 37 30 46 43 42 32 38 30 34 46 31 00
  UrbLink              = 00000000
[1088513 ms] UsbSnoop - FilterDispatchAny(b9c8efd2) : IRP_MJ_INTERNAL_DEVICE_CONTROL
[1088513 ms] UsbSnoop - FdoHookDispatchInternalIoctl(b9c8f1ea) : fdo=85a18c30, Irp=858c26d8, IRQL=0
[1088513 ms]  >>>  URB 90 going down  >>> 
-- URB_FUNCTION_BULK_OR_INTERRUPT_TRANSFER:
  PipeHandle           = 85cfd7e4 [endpoint 0x00000081]
  TransferFlags        = 00000003 (USBD_TRANSFER_DIRECTION_IN, USBD_SHORT_TRANSFER_OK)
  TransferBufferLength = 00000200
  TransferBuffer       = 00000000
  TransferBufferMDL    = 85894ec8
  UrbLink              = 00000000
[1088513 ms] UsbSnoop - FilterDispatchAny(b9c8efd2) : IRP_MJ_INTERNAL_DEVICE_CONTROL
[1088513 ms] UsbSnoop - FdoHookDispatchInternalIoctl(b9c8f1ea) : fdo=85a18c30, Irp=858c85a8, IRQL=0
[1088513 ms]  >>>  URB 91 going down  >>> 
-- URB_FUNCTION_BULK_OR_INTERRUPT_TRANSFER:
  PipeHandle           = 85cfd804 [endpoint 0x00000002]
  TransferFlags        = 00000002 (USBD_TRANSFER_DIRECTION_OUT, USBD_SHORT_TRANSFER_OK)
  TransferBufferLength = 00000012
  TransferBuffer       = 00000000
  TransferBufferMDL    = 85aa1dd0
    00000000: 54 fd 64 00 00 ff 64 01 40 20 07 80 02 0a 13 1f
    00000010: 80 07
  UrbLink              = 00000000
[1088514 ms] UsbSnoop - MyInternalIOCTLCompletion(b9c8f126) : fido=86af0200, Irp=858c85a8, Context=858bc360, IRQL=2
[1088514 ms]  <<<  URB 91 coming back  <<< 
-- URB_FUNCTION_BULK_OR_INTERRUPT_TRANSFER:
  PipeHandle           = 85cfd804 [endpoint 0x00000002]
  TransferFlags        = 00000002 (USBD_TRANSFER_DIRECTION_OUT, USBD_SHORT_TRANSFER_OK)
  TransferBufferLength = 00000012
  TransferBuffer       = 00000000
  TransferBufferMDL    = 85aa1dd0
  UrbLink              = 00000000
[1088514 ms] UsbSnoop - FilterDispatchAny(b9c8efd2) : IRP_MJ_INTERNAL_DEVICE_CONTROL
[1088514 ms] UsbSnoop - FdoHookDispatchInternalIoctl(b9c8f1ea) : fdo=85a18c30, Irp=858c85a8, IRQL=0
[1088514 ms]  >>>  URB 92 going down  >>> 
-- URB_FUNCTION_BULK_OR_INTERRUPT_TRANSFER:
  PipeHandle           = 85cfd804 [endpoint 0x00000002]
  TransferFlags        = 00000002 (USBD_TRANSFER_DIRECTION_OUT, USBD_SHORT_TRANSFER_OK)
  TransferBufferLength = 00000011
  TransferBuffer       = 00000000
  TransferBufferMDL    = 85aa1dd0
    00000000: 54 fd 64 00 80 07 64 01 40 20 02 00 01 00 18 1c
    00000010: 02
  UrbLink              = 00000000
[1088515 ms] UsbSnoop - MyInternalIOCTLCompletion(b9c8f126) : fido=86af0200, Irp=858c85a8, Context=858bc360, IRQL=2
[1088515 ms]  <<<  URB 92 coming back  <<< 
-- URB_FUNCTION_BULK_OR_INTERRUPT_TRANSFER:
  PipeHandle           = 85cfd804 [endpoint 0x00000002]
  TransferFlags        = 00000002 (USBD_TRANSFER_DIRECTION_OUT, USBD_SHORT_TRANSFER_OK)
  TransferBufferLength = 00000011
  TransferBuffer       = 00000000
  TransferBufferMDL    = 85aa1dd0
  UrbLink              = 00000000
[1088518 ms] UsbSnoop - MyInternalIOCTLCompletion(b9c8f126) : fido=86af0200, Irp=858c26d8, Context=85d29868, IRQL=2
[1088518 ms]  <<<  URB 90 coming back  <<< 
-- URB_FUNCTION_BULK_OR_INTERRUPT_TRANSFER:
  PipeHandle           = 85cfd7e4 [endpoint 0x00000081]
  TransferFlags        = 00000003 (USBD_TRANSFER_DIRECTION_IN, USBD_SHORT_TRANSFER_OK)
  TransferBufferLength = 00000012
  TransferBuffer       = 00000000
  TransferBufferMDL    = 85894ec8
    00000000: 54 fd 64 01 00 ff 64 00 80 07 20 40 02 0a 18 24
    00000010: 40 20
  UrbLink              = 00000000
[1088518 ms] UsbSnoop - FilterDispatchAny(b9c8efd2) : IRP_MJ_INTERNAL_DEVICE_CONTROL
[1088518 ms] UsbSnoop - FdoHookDispatchInternalIoctl(b9c8f1ea) : fdo=85a18c30, Irp=858c85a8, IRQL=0
[1088518 ms]  >>>  URB 93 going down  >>> 
-- URB_FUNCTION_BULK_OR_INTERRUPT_TRANSFER:
  PipeHandle           = 85cfd7e4 [endpoint 0x00000081]
  TransferFlags        = 00000003 (USBD_TRANSFER_DIRECTION_IN, USBD_SHORT_TRANSFER_OK)
  TransferBufferLength = 00000200
  TransferBuffer       = 00000000
  TransferBufferMDL    = 85894ec8
  UrbLink              = 00000000
[1088522 ms] UsbSnoop - MyInternalIOCTLCompletion(b9c8f126) : fido=86af0200, Irp=858c85a8, Context=85d29868, IRQL=2
[1088522 ms]  <<<  URB 93 coming back  <<< 
-- URB_FUNCTION_BULK_OR_INTERRUPT_TRANSFER:
  PipeHandle           = 85cfd7e4 [endpoint 0x00000081]
  TransferFlags        = 00000003 (USBD_TRANSFER_DIRECTION_IN, USBD_SHORT_TRANSFER_OK)
  TransferBufferLength = 0000001b
  TransferBuffer       = 00000000
  TransferBufferMDL    = 85894ec8
    00000000: 54 fd 64 01 40 20 64 00 80 07 38 5a 0b 00 14 b2
    00000010: 02 54 49 2d 4e 73 70 69 72 65 00
  UrbLink              = 00000000
[1088522 ms] UsbSnoop - FilterDispatchAny(b9c8efd2) : IRP_MJ_INTERNAL_DEVICE_CONTROL
[1088522 ms] UsbSnoop - FdoHookDispatchInternalIoctl(b9c8f1ea) : fdo=85a18c30, Irp=858c85a8, IRQL=0
[1088522 ms]  >>>  URB 94 going down  >>> 
-- URB_FUNCTION_BULK_OR_INTERRUPT_TRANSFER:
  PipeHandle           = 85cfd7e4 [endpoint 0x00000081]
  TransferFlags        = 00000003 (USBD_TRANSFER_DIRECTION_IN, USBD_SHORT_TRANSFER_OK)
  TransferBufferLength = 00000200
  TransferBuffer       = 00000000
  TransferBufferMDL    = 85894ec8
  UrbLink              = 00000000
[1088522 ms] UsbSnoop - FilterDispatchAny(b9c8efd2) : IRP_MJ_INTERNAL_DEVICE_CONTROL
[1088522 ms] UsbSnoop - FdoHookDispatchInternalIoctl(b9c8f1ea) : fdo=85a18c30, Irp=858c26d8, IRQL=0
[1088522 ms]  >>>  URB 95 going down  >>> 
-- URB_FUNCTION_BULK_OR_INTERRUPT_TRANSFER:
  PipeHandle           = 85cfd804 [endpoint 0x00000002]
  TransferFlags        = 00000002 (USBD_TRANSFER_DIRECTION_OUT, USBD_SHORT_TRANSFER_OK)
  TransferBufferLength = 00000012
  TransferBuffer       = 00000000
  TransferBufferMDL    = 86a85d30
    00000000: 54 fd 64 00 00 ff 64 01 40 20 07 80 02 0a 14 20
    00000010: 80 07
  UrbLink              = 00000000
[1088523 ms] UsbSnoop - MyInternalIOCTLCompletion(b9c8f126) : fido=86af0200, Irp=858c26d8, Context=858bc360, IRQL=2
[1088523 ms]  <<<  URB 95 coming back  <<< 
-- URB_FUNCTION_BULK_OR_INTERRUPT_TRANSFER:
  PipeHandle           = 85cfd804 [endpoint 0x00000002]
  TransferFlags        = 00000002 (USBD_TRANSFER_DIRECTION_OUT, USBD_SHORT_TRANSFER_OK)
  TransferBufferLength = 00000012
  TransferBuffer       = 00000000
  TransferBufferMDL    = 86a85d30
  UrbLink              = 00000000
[1088523 ms] UsbSnoop - FilterDispatchAny(b9c8efd2) : IRP_MJ_INTERNAL_DEVICE_CONTROL
[1088523 ms] UsbSnoop - FdoHookDispatchInternalIoctl(b9c8f1ea) : fdo=85a18c30, Irp=858c26d8, IRQL=0
[1088523 ms]  >>>  URB 96 going down  >>> 
-- URB_FUNCTION_BULK_OR_INTERRUPT_TRANSFER:
  PipeHandle           = 85cfd804 [endpoint 0x00000002]
  TransferFlags        = 00000002 (USBD_TRANSFER_DIRECTION_OUT, USBD_SHORT_TRANSFER_OK)
  TransferBufferLength = 00000011
  TransferBuffer       = 00000000
  TransferBufferMDL    = 86a85d30
    00000000: 54 fd 64 00 80 07 64 01 40 20 03 00 01 00 19 1e
    00000010: 03
  UrbLink              = 00000000
[1088524 ms] UsbSnoop - MyInternalIOCTLCompletion(b9c8f126) : fido=86af0200, Irp=858c26d8, Context=858bc360, IRQL=2
[1088524 ms]  <<<  URB 96 coming back  <<< 
-- URB_FUNCTION_BULK_OR_INTERRUPT_TRANSFER:
  PipeHandle           = 85cfd804 [endpoint 0x00000002]
  TransferFlags        = 00000002 (USBD_TRANSFER_DIRECTION_OUT, USBD_SHORT_TRANSFER_OK)
  TransferBufferLength = 00000011
  TransferBuffer       = 00000000
  TransferBufferMDL    = 86a85d30
  UrbLink              = 00000000
[1088527 ms] UsbSnoop - MyInternalIOCTLCompletion(b9c8f126) : fido=86af0200, Irp=858c85a8, Context=85d29868, IRQL=2
[1088527 ms]  <<<  URB 94 coming back  <<< 
-- URB_FUNCTION_BULK_OR_INTERRUPT_TRANSFER:
  PipeHandle           = 85cfd7e4 [endpoint 0x00000081]
  TransferFlags        = 00000003 (USBD_TRANSFER_DIRECTION_IN, USBD_SHORT_TRANSFER_OK)
  TransferBufferLength = 00000012
  TransferBuffer       = 00000000
  TransferBufferMDL    = 85894ec8
    00000000: 54 fd 64 01 00 ff 64 00 80 07 20 40 02 0a 19 25
    00000010: 40 20
  UrbLink              = 00000000
[1088527 ms] UsbSnoop - FilterDispatchAny(b9c8efd2) : IRP_MJ_INTERNAL_DEVICE_CONTROL
[1088527 ms] UsbSnoop - FdoHookDispatchInternalIoctl(b9c8f1ea) : fdo=85a18c30, Irp=858c26d8, IRQL=0
[1088527 ms]  >>>  URB 97 going down  >>> 
-- URB_FUNCTION_BULK_OR_INTERRUPT_TRANSFER:
  PipeHandle           = 85cfd7e4 [endpoint 0x00000081]
  TransferFlags        = 00000003 (USBD_TRANSFER_DIRECTION_IN, USBD_SHORT_TRANSFER_OK)
  TransferBufferLength = 00000200
  TransferBuffer       = 00000000
  TransferBufferMDL    = 85894ec8
  UrbLink              = 00000000
[1088531 ms] UsbSnoop - MyInternalIOCTLCompletion(b9c8f126) : fido=86af0200, Irp=858c26d8, Context=85d29868, IRQL=2
[1088531 ms]  <<<  URB 97 coming back  <<< 
-- URB_FUNCTION_BULK_OR_INTERRUPT_TRANSFER:
  PipeHandle           = 85cfd7e4 [endpoint 0x00000081]
  TransferFlags        = 00000003 (USBD_TRANSFER_DIRECTION_IN, USBD_SHORT_TRANSFER_OK)
  TransferBufferLength = 0000001b
  TransferBuffer       = 00000000
  TransferBufferMDL    = 85894ec8
    00000000: 54 fd 64 01 40 20 64 00 80 07 96 7f 0b 00 15 36
    00000010: 03 2e 74 6e 73 00 2e 74 6e 6f 00
  UrbLink              = 00000000
[1088531 ms] UsbSnoop - FilterDispatchAny(b9c8efd2) : IRP_MJ_INTERNAL_DEVICE_CONTROL
[1088531 ms] UsbSnoop - FdoHookDispatchInternalIoctl(b9c8f1ea) : fdo=85a18c30, Irp=858c26d8, IRQL=0
[1088531 ms]  >>>  URB 98 going down  >>> 
-- URB_FUNCTION_BULK_OR_INTERRUPT_TRANSFER:
  PipeHandle           = 85cfd7e4 [endpoint 0x00000081]
  TransferFlags        = 00000003 (USBD_TRANSFER_DIRECTION_IN, USBD_SHORT_TRANSFER_OK)
  TransferBufferLength = 00000200
  TransferBuffer       = 00000000
  TransferBufferMDL    = 85894ec8
  UrbLink              = 00000000
[1088531 ms] UsbSnoop - FilterDispatchAny(b9c8efd2) : IRP_MJ_INTERNAL_DEVICE_CONTROL
[1088531 ms] UsbSnoop - FdoHookDispatchInternalIoctl(b9c8f1ea) : fdo=85a18c30, Irp=858c85a8, IRQL=0
[1088531 ms]  >>>  URB 99 going down  >>> 
-- URB_FUNCTION_BULK_OR_INTERRUPT_TRANSFER:
  PipeHandle           = 85cfd804 [endpoint 0x00000002]
  TransferFlags        = 00000002 (USBD_TRANSFER_DIRECTION_OUT, USBD_SHORT_TRANSFER_OK)
  TransferBufferLength = 00000012
  TransferBuffer       = 00000000
  TransferBufferMDL    = 863dd970
    00000000: 54 fd 64 00 00 ff 64 01 40 20 07 80 02 0a 15 21
    00000010: 80 07
  UrbLink              = 00000000
[1088532 ms] UsbSnoop - MyInternalIOCTLCompletion(b9c8f126) : fido=86af0200, Irp=858c85a8, Context=858bc360, IRQL=2
[1088532 ms]  <<<  URB 99 coming back  <<< 
-- URB_FUNCTION_BULK_OR_INTERRUPT_TRANSFER:
  PipeHandle           = 85cfd804 [endpoint 0x00000002]
  TransferFlags        = 00000002 (USBD_TRANSFER_DIRECTION_OUT, USBD_SHORT_TRANSFER_OK)
  TransferBufferLength = 00000012
  TransferBuffer       = 00000000
  TransferBufferMDL    = 863dd970
  UrbLink              = 00000000
[1088532 ms] UsbSnoop - FilterDispatchAny(b9c8efd2) : IRP_MJ_INTERNAL_DEVICE_CONTROL
[1088532 ms] UsbSnoop - FdoHookDispatchInternalIoctl(b9c8f1ea) : fdo=85a18c30, Irp=858c85a8, IRQL=0
[1088532 ms]  >>>  URB 100 going down  >>> 
-- URB_FUNCTION_BULK_OR_INTERRUPT_TRANSFER:
  PipeHandle           = 85cfd804 [endpoint 0x00000002]
  TransferFlags        = 00000002 (USBD_TRANSFER_DIRECTION_OUT, USBD_SHORT_TRANSFER_OK)
  TransferBufferLength = 00000012
  TransferBuffer       = 00000000
  TransferBufferMDL    = 863dd970
    00000000: 54 fd 64 00 40 de 64 01 40 20 07 80 02 00 1a 3b
    00000010: 80 07
  UrbLink              = 00000000
[1088533 ms] UsbSnoop - MyInternalIOCTLCompletion(b9c8f126) : fido=86af0200, Irp=858c85a8, Context=858bc360, IRQL=2
[1088533 ms]  <<<  URB 100 coming back  <<< 
-- URB_FUNCTION_BULK_OR_INTERRUPT_TRANSFER:
  PipeHandle           = 85cfd804 [endpoint 0x00000002]
  TransferFlags        = 00000002 (USBD_TRANSFER_DIRECTION_OUT, USBD_SHORT_TRANSFER_OK)
  TransferBufferLength = 00000012
  TransferBuffer       = 00000000
  TransferBufferMDL    = 863dd970
  UrbLink              = 00000000
[1088536 ms] UsbSnoop - MyInternalIOCTLCompletion(b9c8f126) : fido=86af0200, Irp=858c26d8, Context=85d29868, IRQL=2
[1088536 ms]  <<<  URB 98 coming back  <<< 
-- URB_FUNCTION_BULK_OR_INTERRUPT_TRANSFER:
  PipeHandle           = 85cfd7e4 [endpoint 0x00000081]
  TransferFlags        = 00000003 (USBD_TRANSFER_DIRECTION_IN, USBD_SHORT_TRANSFER_OK)
  TransferBufferLength = 00000012
  TransferBuffer       = 00000000
  TransferBufferMDL    = 85894ec8
    00000000: 54 fd 64 01 00 ff 64 00 80 07 20 40 02 0a 1a 26
    00000010: 40 20
  UrbLink              = 00000000
[1088536 ms] UsbSnoop - FilterDispatchAny(b9c8efd2) : IRP_MJ_INTERNAL_DEVICE_CONTROL
[1088536 ms] UsbSnoop - FdoHookDispatchInternalIoctl(b9c8f1ea) : fdo=85a18c30, Irp=858c85a8, IRQL=0
[1088536 ms]  >>>  URB 101 going down  >>> 
-- URB_FUNCTION_BULK_OR_INTERRUPT_TRANSFER:
  PipeHandle           = 85cfd7e4 [endpoint 0x00000081]
  TransferFlags        = 00000003 (USBD_TRANSFER_DIRECTION_IN, USBD_SHORT_TRANSFER_OK)
  TransferBufferLength = 00000200
  TransferBuffer       = 00000000
  TransferBufferMDL    = 85894ec8
  UrbLink              = 00000000
[1092905 ms] UsbSnoop - MyInternalIOCTLCompletion(b9c8f126) : fido=86af0200, Irp=858c85a8, Context=85d29868, IRQL=2
[1092905 ms]  <<<  URB 101 coming back  <<< 
-- URB_FUNCTION_BULK_OR_INTERRUPT_TRANSFER:
  PipeHandle           = 85cfd7e4 [endpoint 0x00000081]
  TransferFlags        = 00000003 (USBD_TRANSFER_DIRECTION_IN, USBD_SHORT_TRANSFER_OK)
  TransferBufferLength = 00000000
  TransferBuffer       = 00000000
  TransferBufferMDL    = 85894ec8
  UrbLink              = 00000000
