[691110 ms] UsbSnoop - IRP_MJ_POWER (IRP_MN_WAIT_WAKE)
[691110 ms] UsbSnoop - DispatchAny(f8916610) : IRP_MJ_INTERNAL_DEVICE_CONTROL
[691110 ms] UsbSnoop - MyDispatchInternalIOCTL(f8917e80) : fdo=822eee08, Irp=81c66760, IRQL=0
[691110 ms]  >>>  URB 1030 going down  >>> 
-- URB_FUNCTION_RESET_PIPE:
  PipeHandle = 82300ef4 [endpoint 0x00000081]
[691111 ms] UsbSnoop - MyInternalIOCTLCompletion(f8917db0) : fido=00000000, Irp=81c66760, Context=81cb4e48, IRQL=0
[691111 ms]  <<<  URB 1030 coming back  <<< 
-- URB_FUNCTION_RESET_PIPE:
[691111 ms] UsbSnoop - DispatchAny(f8916610) : IRP_MJ_INTERNAL_DEVICE_CONTROL
[691111 ms] UsbSnoop - MyDispatchInternalIOCTL(f8917e80) : fdo=822eee08, Irp=81c66760, IRQL=0
[691111 ms]  >>>  URB 1031 going down  >>> 
-- URB_FUNCTION_RESET_PIPE:
  PipeHandle = 82300f14 [endpoint 0x00000002]
[691112 ms] UsbSnoop - MyInternalIOCTLCompletion(f8917db0) : fido=00000000, Irp=81c66760, Context=81ca3a10, IRQL=0
[691112 ms]  <<<  URB 1031 coming back  <<< 
-- URB_FUNCTION_RESET_PIPE:
[692112 ms] UsbSnoop - DispatchAny(f8916610) : IRP_MJ_INTERNAL_DEVICE_CONTROL
[692112 ms] UsbSnoop - MyDispatchInternalIOCTL(f8917e80) : fdo=822eee08, Irp=81c073d0, IRQL=0
[692112 ms]  >>>  URB 1032 going down  >>> 
-- URB_FUNCTION_RESET_PIPE:
  PipeHandle = 82300ef4 [endpoint 0x00000081]
[692112 ms] UsbSnoop - MyInternalIOCTLCompletion(f8917db0) : fido=00000000, Irp=81c073d0, Context=822f1a00, IRQL=0
[692112 ms]  <<<  URB 1032 coming back  <<< 
-- URB_FUNCTION_RESET_PIPE:
[692112 ms] UsbSnoop - DispatchAny(f8916610) : IRP_MJ_INTERNAL_DEVICE_CONTROL
[692112 ms] UsbSnoop - MyDispatchInternalIOCTL(f8917e80) : fdo=822eee08, Irp=81c073d0, IRQL=0
[692112 ms]  >>>  URB 1033 going down  >>> 
-- URB_FUNCTION_RESET_PIPE:
  PipeHandle = 82300f14 [endpoint 0x00000002]
[692113 ms] UsbSnoop - MyInternalIOCTLCompletion(f8917db0) : fido=00000000, Irp=81c073d0, Context=81abee68, IRQL=0
[692113 ms]  <<<  URB 1033 coming back  <<< 
-- URB_FUNCTION_RESET_PIPE:
[692113 ms] UsbSnoop - DispatchAny(f8916610) : IRP_MJ_INTERNAL_DEVICE_CONTROL
[692113 ms] UsbSnoop - MyDispatchInternalIOCTL(f8917e80) : fdo=822eee08, Irp=81cb1670, IRQL=0
[692113 ms] UsbSnoop - IRP_MJ_POWER (IRP_MN_WAIT_WAKE)
[693113 ms] UsbSnoop - DispatchAny(f8916610) : IRP_MJ_INTERNAL_DEVICE_CONTROL
[693113 ms] UsbSnoop - MyDispatchInternalIOCTL(f8917e80) : fdo=822eee08, Irp=81cb1670, IRQL=0
[693113 ms]  >>>  URB 1034 going down  >>> 
-- URB_FUNCTION_GET_DESCRIPTOR_FROM_DEVICE:
  TransferBufferLength = 00000012
  TransferBuffer       = e29b7c38
  TransferBufferMDL    = 00000000
  Index                = 00000000
  DescriptorType       = 00000001 (USB_DEVICE_DESCRIPTOR_TYPE)
  LanguageId           = 00000000
[693114 ms] UsbSnoop - MyInternalIOCTLCompletion(f8917db0) : fido=00000000, Irp=81cb1670, Context=822f3898, IRQL=2
[693114 ms]  <<<  URB 1034 coming back  <<< 
-- URB_FUNCTION_CONTROL_TRANSFER:
  PipeHandle           = 82149668
  TransferFlags        = 0000000b (USBD_TRANSFER_DIRECTION_IN, USBD_SHORT_TRANSFER_OK)
  TransferBufferLength = 00000012
  TransferBuffer       = e29b7c38
  TransferBufferMDL    = 81cb8458
    00000000: 12 01 00 02 00 00 00 40 51 04 04 e0 00 03 01 02
    00000010: 00 01
  UrbLink              = 00000000
  SetupPacket          =
    00000000: 80 06 00 01 00 00 12 00
[693114 ms] UsbSnoop - DispatchAny(f8916610) : IRP_MJ_INTERNAL_DEVICE_CONTROL
[693114 ms] UsbSnoop - MyDispatchInternalIOCTL(f8917e80) : fdo=822eee08, Irp=81ab2e48, IRQL=0
[693114 ms] UsbSnoop - IRP_MJ_POWER (IRP_MN_WAIT_WAKE)
[693114 ms] UsbSnoop - DispatchAny(f8916610) : IRP_MJ_INTERNAL_DEVICE_CONTROL
[693114 ms] UsbSnoop - MyDispatchInternalIOCTL(f8917e80) : fdo=822eee08, Irp=81c073d0, IRQL=0
[693114 ms]  >>>  URB 1035 going down  >>> 
-- URB_FUNCTION_RESET_PIPE:
  PipeHandle = 82300ef4 [endpoint 0x00000081]
[693115 ms] UsbSnoop - MyInternalIOCTLCompletion(f8917db0) : fido=00000000, Irp=81c073d0, Context=81b5f500, IRQL=0
[693115 ms]  <<<  URB 1035 coming back  <<< 
-- URB_FUNCTION_RESET_PIPE:
[693115 ms] UsbSnoop - DispatchAny(f8916610) : IRP_MJ_INTERNAL_DEVICE_CONTROL
[693115 ms] UsbSnoop - MyDispatchInternalIOCTL(f8917e80) : fdo=822eee08, Irp=81c073d0, IRQL=0
[693115 ms]  >>>  URB 1036 going down  >>> 
-- URB_FUNCTION_RESET_PIPE:
  PipeHandle = 82300f14 [endpoint 0x00000002]
[693115 ms] UsbSnoop - MyInternalIOCTLCompletion(f8917db0) : fido=00000000, Irp=81c073d0, Context=81cad160, IRQL=0
[693115 ms]  <<<  URB 1036 coming back  <<< 
-- URB_FUNCTION_RESET_PIPE:
[695637 ms] UsbSnoop - DispatchAny(f8916610) : IRP_MJ_INTERNAL_DEVICE_CONTROL
[695637 ms] UsbSnoop - MyDispatchInternalIOCTL(f8917e80) : fdo=822eee08, Irp=81b1f958, IRQL=2
[695637 ms]  >>>  URB 1037 going down  >>> 
-- URB_FUNCTION_BULK_OR_INTERRUPT_TRANSFER:
  PipeHandle           = 82300f14 [endpoint 0x00000002]
  TransferFlags        = 00000000 (USBD_TRANSFER_DIRECTION_OUT, ~USBD_SHORT_TRANSFER_OK)
  TransferBufferLength = 00000009
  TransferBuffer       = 00000000
  TransferBufferMDL    = 81cb8458
    00000000: 00 00 00 04 01 00 00 04 00
  UrbLink              = 00000000
[695638 ms] UsbSnoop - MyInternalIOCTLCompletion(f8917db0) : fido=81b964f0, Irp=81b1f958, Context=81c3bfe8, IRQL=2
[695638 ms]  <<<  URB 1037 coming back  <<< 
-- URB_FUNCTION_BULK_OR_INTERRUPT_TRANSFER:
  PipeHandle           = 82300f14 [endpoint 0x00000002]
  TransferFlags        = 00000000 (USBD_TRANSFER_DIRECTION_OUT, ~USBD_SHORT_TRANSFER_OK)
  TransferBufferLength = 00000009
  TransferBuffer       = 00000000
  TransferBufferMDL    = 81cb8458
  UrbLink              = 00000000
[695638 ms] UsbSnoop - DispatchAny(f8916610) : IRP_MJ_INTERNAL_DEVICE_CONTROL
[695638 ms] UsbSnoop - MyDispatchInternalIOCTL(f8917e80) : fdo=822eee08, Irp=81b1f958, IRQL=2
[695638 ms]  >>>  URB 1038 going down  >>> 
-- URB_FUNCTION_BULK_OR_INTERRUPT_TRANSFER:
  PipeHandle           = 82300ef4 [endpoint 0x00000081]
  TransferFlags        = 00000003 (USBD_TRANSFER_DIRECTION_IN, USBD_SHORT_TRANSFER_OK)
  TransferBufferLength = 00000100
  TransferBuffer       = 00000000
  TransferBufferMDL    = 81cb8458
  UrbLink              = 00000000
[695640 ms] UsbSnoop - MyInternalIOCTLCompletion(f8917db0) : fido=81b964f0, Irp=81b1f958, Context=81cb4e48, IRQL=2
[695640 ms]  <<<  URB 1038 coming back  <<< 
-- URB_FUNCTION_BULK_OR_INTERRUPT_TRANSFER:
  PipeHandle           = 82300ef4 [endpoint 0x00000081]
  TransferFlags        = 00000003 (USBD_TRANSFER_DIRECTION_IN, USBD_SHORT_TRANSFER_OK)
  TransferBufferLength = 00000009
  TransferBuffer       = 00000000
  TransferBufferMDL    = 81cb8458
    00000000: 00 00 00 04 02 00 00 03 ff
  UrbLink              = 00000000
[695668 ms] UsbSnoop - DispatchAny(f8916610) : IRP_MJ_INTERNAL_DEVICE_CONTROL
[695668 ms] UsbSnoop - MyDispatchInternalIOCTL(f8917e80) : fdo=822eee08, Irp=81b1f958, IRQL=2
[695668 ms]  >>>  URB 1039 going down  >>> 
-- URB_FUNCTION_BULK_OR_INTERRUPT_TRANSFER:
  PipeHandle           = 82300f14 [endpoint 0x00000002]
  TransferFlags        = 00000000 (USBD_TRANSFER_DIRECTION_OUT, ~USBD_SHORT_TRANSFER_OK)
  TransferBufferLength = 00000015
  TransferBuffer       = 00000000
  TransferBufferMDL    = 81cb8458
    00000000: 00 00 00 10 04 00 00 00 0a 00 01 00 03 00 01 00
    00000010: 00 00 00 07 d0
  UrbLink              = 00000000
[695669 ms] UsbSnoop - MyInternalIOCTLCompletion(f8917db0) : fido=81b964f0, Irp=81b1f958, Context=82304d38, IRQL=2
[695669 ms]  <<<  URB 1039 coming back  <<< 
-- URB_FUNCTION_BULK_OR_INTERRUPT_TRANSFER:
  PipeHandle           = 82300f14 [endpoint 0x00000002]
  TransferFlags        = 00000000 (USBD_TRANSFER_DIRECTION_OUT, ~USBD_SHORT_TRANSFER_OK)
  TransferBufferLength = 00000015
  TransferBuffer       = 00000000
  TransferBufferMDL    = 81cb8458
  UrbLink              = 00000000
[695677 ms] UsbSnoop - DispatchAny(f8916610) : IRP_MJ_INTERNAL_DEVICE_CONTROL
[695677 ms] UsbSnoop - MyDispatchInternalIOCTL(f8917e80) : fdo=822eee08, Irp=81b1f958, IRQL=2
[695677 ms]  >>>  URB 1040 going down  >>> 
-- URB_FUNCTION_BULK_OR_INTERRUPT_TRANSFER:
  PipeHandle           = 82300ef4 [endpoint 0x00000081]
  TransferFlags        = 00000003 (USBD_TRANSFER_DIRECTION_IN, USBD_SHORT_TRANSFER_OK)
  TransferBufferLength = 00000100
  TransferBuffer       = 00000000
  TransferBufferMDL    = 81cb8458
  UrbLink              = 00000000
[695678 ms] UsbSnoop - MyInternalIOCTLCompletion(f8917db0) : fido=81b964f0, Irp=81b1f958, Context=81cb4e48, IRQL=2
[695678 ms]  <<<  URB 1040 coming back  <<< 
-- URB_FUNCTION_BULK_OR_INTERRUPT_TRANSFER:
  PipeHandle           = 82300ef4 [endpoint 0x00000081]
  TransferFlags        = 00000003 (USBD_TRANSFER_DIRECTION_IN, USBD_SHORT_TRANSFER_OK)
  TransferBufferLength = 00000007
  TransferBuffer       = 00000000
  TransferBufferMDL    = 81cb8458
    00000000: 00 00 00 02 05 e0 00
  UrbLink              = 00000000
[695717 ms] UsbSnoop - DispatchAny(f8916610) : IRP_MJ_INTERNAL_DEVICE_CONTROL
[695717 ms] UsbSnoop - MyDispatchInternalIOCTL(f8917e80) : fdo=822eee08, Irp=81b1f958, IRQL=2
[695717 ms]  >>>  URB 1041 going down  >>> 
-- URB_FUNCTION_BULK_OR_INTERRUPT_TRANSFER:
  PipeHandle           = 82300ef4 [endpoint 0x00000081]
  TransferFlags        = 00000003 (USBD_TRANSFER_DIRECTION_IN, USBD_SHORT_TRANSFER_OK)
  TransferBufferLength = 00000100
  TransferBuffer       = 00000000
  TransferBufferMDL    = 81cb8458
  UrbLink              = 00000000
[695718 ms] UsbSnoop - MyInternalIOCTLCompletion(f8917db0) : fido=81b964f0, Irp=81b1f958, Context=81b06608, IRQL=2
[695718 ms]  <<<  URB 1041 coming back  <<< 
-- URB_FUNCTION_BULK_OR_INTERRUPT_TRANSFER:
  PipeHandle           = 82300ef4 [endpoint 0x00000081]
  TransferFlags        = 00000003 (USBD_TRANSFER_DIRECTION_IN, USBD_SHORT_TRANSFER_OK)
  TransferBufferLength = 00000005
  TransferBuffer       = 00000000
  TransferBufferMDL    = 81cb8458
    00000000: 00 00 00 0a 04
  UrbLink              = 00000000
[695747 ms] UsbSnoop - DispatchAny(f8916610) : IRP_MJ_INTERNAL_DEVICE_CONTROL
[695747 ms] UsbSnoop - MyDispatchInternalIOCTL(f8917e80) : fdo=822eee08, Irp=81b1f958, IRQL=2
[695748 ms]  >>>  URB 1042 going down  >>> 
-- URB_FUNCTION_BULK_OR_INTERRUPT_TRANSFER:
  PipeHandle           = 82300ef4 [endpoint 0x00000081]
  TransferFlags        = 00000003 (USBD_TRANSFER_DIRECTION_IN, USBD_SHORT_TRANSFER_OK)
  TransferBufferLength = 00000100
  TransferBuffer       = 00000000
  TransferBufferMDL    = 81cb8458
  UrbLink              = 00000000
[695748 ms] UsbSnoop - MyInternalIOCTLCompletion(f8917db0) : fido=81b964f0, Irp=81b1f958, Context=81abee68, IRQL=2
[695748 ms]  <<<  URB 1042 coming back  <<< 
-- URB_FUNCTION_BULK_OR_INTERRUPT_TRANSFER:
  PipeHandle           = 82300ef4 [endpoint 0x00000081]
  TransferFlags        = 00000003 (USBD_TRANSFER_DIRECTION_IN, USBD_SHORT_TRANSFER_OK)
  TransferBufferLength = 0000000a
  TransferBuffer       = 00000000
  TransferBufferMDL    = 81cb8458
    00000000: 00 00 00 04 00 12 00 00 07 d0
  UrbLink              = 00000000
[695778 ms] UsbSnoop - DispatchAny(f8916610) : IRP_MJ_INTERNAL_DEVICE_CONTROL
[695778 ms] UsbSnoop - MyDispatchInternalIOCTL(f8917e80) : fdo=822eee08, Irp=81b1f958, IRQL=2
[695778 ms]  >>>  URB 1043 going down  >>> 
-- URB_FUNCTION_BULK_OR_INTERRUPT_TRANSFER:
  PipeHandle           = 82300f14 [endpoint 0x00000002]
  TransferFlags        = 00000000 (USBD_TRANSFER_DIRECTION_OUT, ~USBD_SHORT_TRANSFER_OK)
  TransferBufferLength = 00000007
  TransferBuffer       = 00000000
  TransferBufferMDL    = 81cb8458
    00000000: 00 00 00 02 05 e0 00
  UrbLink              = 00000000
[695778 ms] UsbSnoop - MyInternalIOCTLCompletion(f8917db0) : fido=81b964f0, Irp=81b1f958, Context=81c3bfe8, IRQL=2
[695778 ms]  <<<  URB 1043 coming back  <<< 
-- URB_FUNCTION_BULK_OR_INTERRUPT_TRANSFER:
  PipeHandle           = 82300f14 [endpoint 0x00000002]
  TransferFlags        = 00000000 (USBD_TRANSFER_DIRECTION_OUT, ~USBD_SHORT_TRANSFER_OK)
  TransferBufferLength = 00000007
  TransferBuffer       = 00000000
  TransferBufferMDL    = 81cb8458
  UrbLink              = 00000000
[695788 ms] UsbSnoop - DispatchAny(f8916610) : IRP_MJ_INTERNAL_DEVICE_CONTROL
[695788 ms] UsbSnoop - MyDispatchInternalIOCTL(f8917e80) : fdo=822eee08, Irp=81b1f958, IRQL=2
[695788 ms]  >>>  URB 1044 going down  >>> 
-- URB_FUNCTION_BULK_OR_INTERRUPT_TRANSFER:
  PipeHandle           = 82300f14 [endpoint 0x00000002]
  TransferFlags        = 00000000 (USBD_TRANSFER_DIRECTION_OUT, ~USBD_SHORT_TRANSFER_OK)
  TransferBufferLength = 00000010
  TransferBuffer       = 00000000
  TransferBufferMDL    = 81cb8458
    00000000: 00 00 00 0b 04 00 00 00 05 00 0e 00 37 00 01 01
  UrbLink              = 00000000
[695788 ms] UsbSnoop - MyInternalIOCTLCompletion(f8917db0) : fido=81b964f0, Irp=81b1f958, Context=82304d38, IRQL=2
[695788 ms]  <<<  URB 1044 coming back  <<< 
-- URB_FUNCTION_BULK_OR_INTERRUPT_TRANSFER:
  PipeHandle           = 82300f14 [endpoint 0x00000002]
  TransferFlags        = 00000000 (USBD_TRANSFER_DIRECTION_OUT, ~USBD_SHORT_TRANSFER_OK)
  TransferBufferLength = 00000010
  TransferBuffer       = 00000000
  TransferBufferMDL    = 81cb8458
  UrbLink              = 00000000
[695798 ms] UsbSnoop - DispatchAny(f8916610) : IRP_MJ_INTERNAL_DEVICE_CONTROL
[695798 ms] UsbSnoop - MyDispatchInternalIOCTL(f8917e80) : fdo=822eee08, Irp=81b1f958, IRQL=2
[695798 ms]  >>>  URB 1045 going down  >>> 
-- URB_FUNCTION_BULK_OR_INTERRUPT_TRANSFER:
  PipeHandle           = 82300ef4 [endpoint 0x00000081]
  TransferFlags        = 00000003 (USBD_TRANSFER_DIRECTION_IN, USBD_SHORT_TRANSFER_OK)
  TransferBufferLength = 00000100
  TransferBuffer       = 00000000
  TransferBufferMDL    = 81cb8458
  UrbLink              = 00000000
[695798 ms] UsbSnoop - MyInternalIOCTLCompletion(f8917db0) : fido=81b964f0, Irp=81b1f958, Context=81cb4e48, IRQL=2
[695798 ms]  <<<  URB 1045 coming back  <<< 
-- URB_FUNCTION_BULK_OR_INTERRUPT_TRANSFER:
  PipeHandle           = 82300ef4 [endpoint 0x00000081]
  TransferFlags        = 00000003 (USBD_TRANSFER_DIRECTION_IN, USBD_SHORT_TRANSFER_OK)
  TransferBufferLength = 00000007
  TransferBuffer       = 00000000
  TransferBufferMDL    = 81cb8458
    00000000: 00 00 00 02 05 e0 00
  UrbLink              = 00000000
[695838 ms] UsbSnoop - DispatchAny(f8916610) : IRP_MJ_INTERNAL_DEVICE_CONTROL
[695838 ms] UsbSnoop - MyDispatchInternalIOCTL(f8917e80) : fdo=822eee08, Irp=81b1f958, IRQL=2
[695838 ms]  >>>  URB 1046 going down  >>> 
-- URB_FUNCTION_BULK_OR_INTERRUPT_TRANSFER:
  PipeHandle           = 82300ef4 [endpoint 0x00000081]
  TransferFlags        = 00000003 (USBD_TRANSFER_DIRECTION_IN, USBD_SHORT_TRANSFER_OK)
  TransferBufferLength = 00000100
  TransferBuffer       = 00000000
  TransferBufferMDL    = 81cb8458
  UrbLink              = 00000000
[695838 ms] UsbSnoop - MyInternalIOCTLCompletion(f8917db0) : fido=81b964f0, Irp=81b1f958, Context=81b06608, IRQL=2
[695838 ms]  <<<  URB 1046 coming back  <<< 
-- URB_FUNCTION_BULK_OR_INTERRUPT_TRANSFER:
  PipeHandle           = 82300ef4 [endpoint 0x00000081]
  TransferFlags        = 00000003 (USBD_TRANSFER_DIRECTION_IN, USBD_SHORT_TRANSFER_OK)
  TransferBufferLength = 00000005
  TransferBuffer       = 00000000
  TransferBufferMDL    = 81cb8458
    00000000: 00 00 00 07 04
  UrbLink              = 00000000
[695868 ms] UsbSnoop - DispatchAny(f8916610) : IRP_MJ_INTERNAL_DEVICE_CONTROL
[695868 ms] UsbSnoop - MyDispatchInternalIOCTL(f8917e80) : fdo=822eee08, Irp=81b1f958, IRQL=2
[695868 ms]  >>>  URB 1047 going down  >>> 
-- URB_FUNCTION_BULK_OR_INTERRUPT_TRANSFER:
  PipeHandle           = 82300ef4 [endpoint 0x00000081]
  TransferFlags        = 00000003 (USBD_TRANSFER_DIRECTION_IN, USBD_SHORT_TRANSFER_OK)
  TransferBufferLength = 00000100
  TransferBuffer       = 00000000
  TransferBufferMDL    = 81cb8458
  UrbLink              = 00000000
[695868 ms] UsbSnoop - MyInternalIOCTLCompletion(f8917db0) : fido=81b964f0, Irp=81b1f958, Context=81abee68, IRQL=2
[695868 ms]  <<<  URB 1047 coming back  <<< 
-- URB_FUNCTION_BULK_OR_INTERRUPT_TRANSFER:
  PipeHandle           = 82300ef4 [endpoint 0x00000081]
  TransferFlags        = 00000003 (USBD_TRANSFER_DIRECTION_IN, USBD_SHORT_TRANSFER_OK)
  TransferBufferLength = 00000007
  TransferBuffer       = 00000000
  TransferBufferMDL    = 81cb8458
    00000000: 00 00 00 01 aa 00 01
  UrbLink              = 00000000
[695898 ms] UsbSnoop - DispatchAny(f8916610) : IRP_MJ_INTERNAL_DEVICE_CONTROL
[695898 ms] UsbSnoop - MyDispatchInternalIOCTL(f8917e80) : fdo=822eee08, Irp=81b1f958, IRQL=2
[695898 ms]  >>>  URB 1048 going down  >>> 
-- URB_FUNCTION_BULK_OR_INTERRUPT_TRANSFER:
  PipeHandle           = 82300f14 [endpoint 0x00000002]
  TransferFlags        = 00000000 (USBD_TRANSFER_DIRECTION_OUT, ~USBD_SHORT_TRANSFER_OK)
  TransferBufferLength = 00000007
  TransferBuffer       = 00000000
  TransferBufferMDL    = 81cb8458
    00000000: 00 00 00 02 05 e0 00
  UrbLink              = 00000000
[695898 ms] UsbSnoop - MyInternalIOCTLCompletion(f8917db0) : fido=81b964f0, Irp=81b1f958, Context=81c3bfe8, IRQL=2
[695898 ms]  <<<  URB 1048 coming back  <<< 
-- URB_FUNCTION_BULK_OR_INTERRUPT_TRANSFER:
  PipeHandle           = 82300f14 [endpoint 0x00000002]
  TransferFlags        = 00000000 (USBD_TRANSFER_DIRECTION_OUT, ~USBD_SHORT_TRANSFER_OK)
  TransferBufferLength = 00000007
  TransferBuffer       = 00000000
  TransferBufferMDL    = 81cb8458
  UrbLink              = 00000000
[696158 ms] UsbSnoop - DispatchAny(f8916610) : IRP_MJ_INTERNAL_DEVICE_CONTROL
[696158 ms] UsbSnoop - MyDispatchInternalIOCTL(f8917e80) : fdo=822eee08, Irp=81b1f958, IRQL=2
[696158 ms]  >>>  URB 1049 going down  >>> 
-- URB_FUNCTION_BULK_OR_INTERRUPT_TRANSFER:
  PipeHandle           = 82300f14 [endpoint 0x00000002]
  TransferFlags        = 00000000 (USBD_TRANSFER_DIRECTION_OUT, ~USBD_SHORT_TRANSFER_OK)
  TransferBufferLength = 00000009
  TransferBuffer       = 00000000
  TransferBufferMDL    = 81cb8458
    00000000: 00 00 00 04 01 00 00 04 00
  UrbLink              = 00000000
[696158 ms] UsbSnoop - MyInternalIOCTLCompletion(f8917db0) : fido=81b964f0, Irp=81b1f958, Context=82304d38, IRQL=2
[696158 ms]  <<<  URB 1049 coming back  <<< 
-- URB_FUNCTION_BULK_OR_INTERRUPT_TRANSFER:
  PipeHandle           = 82300f14 [endpoint 0x00000002]
  TransferFlags        = 00000000 (USBD_TRANSFER_DIRECTION_OUT, ~USBD_SHORT_TRANSFER_OK)
  TransferBufferLength = 00000009
  TransferBuffer       = 00000000
  TransferBufferMDL    = 81cb8458
  UrbLink              = 00000000
[696159 ms] UsbSnoop - DispatchAny(f8916610) : IRP_MJ_INTERNAL_DEVICE_CONTROL
[696159 ms] UsbSnoop - MyDispatchInternalIOCTL(f8917e80) : fdo=822eee08, Irp=81b1f958, IRQL=2
[696159 ms]  >>>  URB 1050 going down  >>> 
-- URB_FUNCTION_BULK_OR_INTERRUPT_TRANSFER:
  PipeHandle           = 82300ef4 [endpoint 0x00000081]
  TransferFlags        = 00000003 (USBD_TRANSFER_DIRECTION_IN, USBD_SHORT_TRANSFER_OK)
  TransferBufferLength = 00000100
  TransferBuffer       = 00000000
  TransferBufferMDL    = 81cb8458
  UrbLink              = 00000000
[696160 ms] UsbSnoop - MyInternalIOCTLCompletion(f8917db0) : fido=81b964f0, Irp=81b1f958, Context=81cb4e48, IRQL=2
[696160 ms]  <<<  URB 1050 coming back  <<< 
-- URB_FUNCTION_BULK_OR_INTERRUPT_TRANSFER:
  PipeHandle           = 82300ef4 [endpoint 0x00000081]
  TransferFlags        = 00000003 (USBD_TRANSFER_DIRECTION_IN, USBD_SHORT_TRANSFER_OK)
  TransferBufferLength = 00000009
  TransferBuffer       = 00000000
  TransferBufferMDL    = 81cb8458
    00000000: 00 00 00 04 02 00 00 03 ff
  UrbLink              = 00000000
[696188 ms] UsbSnoop - DispatchAny(f8916610) : IRP_MJ_INTERNAL_DEVICE_CONTROL
[696188 ms] UsbSnoop - MyDispatchInternalIOCTL(f8917e80) : fdo=822eee08, Irp=81b1f958, IRQL=2
[696188 ms]  >>>  URB 1051 going down  >>> 
-- URB_FUNCTION_BULK_OR_INTERRUPT_TRANSFER:
  PipeHandle           = 82300f14 [endpoint 0x00000002]
  TransferFlags        = 00000000 (USBD_TRANSFER_DIRECTION_OUT, ~USBD_SHORT_TRANSFER_OK)
  TransferBufferLength = 00000015
  TransferBuffer       = 00000000
  TransferBufferMDL    = 81cb8458
    00000000: 00 00 00 10 04 00 00 00 0a 00 01 00 03 00 01 00
    00000010: 00 00 00 07 d0
  UrbLink              = 00000000
[696188 ms] UsbSnoop - MyInternalIOCTLCompletion(f8917db0) : fido=81b964f0, Irp=81b1f958, Context=81c3bfe8, IRQL=2
[696188 ms]  <<<  URB 1051 coming back  <<< 
-- URB_FUNCTION_BULK_OR_INTERRUPT_TRANSFER:
  PipeHandle           = 82300f14 [endpoint 0x00000002]
  TransferFlags        = 00000000 (USBD_TRANSFER_DIRECTION_OUT, ~USBD_SHORT_TRANSFER_OK)
  TransferBufferLength = 00000015
  TransferBuffer       = 00000000
  TransferBufferMDL    = 81cb8458
  UrbLink              = 00000000
[696198 ms] UsbSnoop - DispatchAny(f8916610) : IRP_MJ_INTERNAL_DEVICE_CONTROL
[696198 ms] UsbSnoop - MyDispatchInternalIOCTL(f8917e80) : fdo=822eee08, Irp=81b1f958, IRQL=2
[696198 ms]  >>>  URB 1052 going down  >>> 
-- URB_FUNCTION_BULK_OR_INTERRUPT_TRANSFER:
  PipeHandle           = 82300ef4 [endpoint 0x00000081]
  TransferFlags        = 00000003 (USBD_TRANSFER_DIRECTION_IN, USBD_SHORT_TRANSFER_OK)
  TransferBufferLength = 00000100
  TransferBuffer       = 00000000
  TransferBufferMDL    = 81cb8458
  UrbLink              = 00000000
[696198 ms] UsbSnoop - MyInternalIOCTLCompletion(f8917db0) : fido=81b964f0, Irp=81b1f958, Context=81cb4e48, IRQL=2
[696198 ms]  <<<  URB 1052 coming back  <<< 
-- URB_FUNCTION_BULK_OR_INTERRUPT_TRANSFER:
  PipeHandle           = 82300ef4 [endpoint 0x00000081]
  TransferFlags        = 00000003 (USBD_TRANSFER_DIRECTION_IN, USBD_SHORT_TRANSFER_OK)
  TransferBufferLength = 00000007
  TransferBuffer       = 00000000
  TransferBufferMDL    = 81cb8458
    00000000: 00 00 00 02 05 e0 00
  UrbLink              = 00000000
[696238 ms] UsbSnoop - DispatchAny(f8916610) : IRP_MJ_INTERNAL_DEVICE_CONTROL
[696238 ms] UsbSnoop - MyDispatchInternalIOCTL(f8917e80) : fdo=822eee08, Irp=81b1f958, IRQL=2
[696238 ms]  >>>  URB 1053 going down  >>> 
-- URB_FUNCTION_BULK_OR_INTERRUPT_TRANSFER:
  PipeHandle           = 82300ef4 [endpoint 0x00000081]
  TransferFlags        = 00000003 (USBD_TRANSFER_DIRECTION_IN, USBD_SHORT_TRANSFER_OK)
  TransferBufferLength = 00000100
  TransferBuffer       = 00000000
  TransferBufferMDL    = 81cb8458
  UrbLink              = 00000000
[696238 ms] UsbSnoop - MyInternalIOCTLCompletion(f8917db0) : fido=81b964f0, Irp=81b1f958, Context=81b30798, IRQL=2
[696238 ms]  <<<  URB 1053 coming back  <<< 
-- URB_FUNCTION_BULK_OR_INTERRUPT_TRANSFER:
  PipeHandle           = 82300ef4 [endpoint 0x00000081]
  TransferFlags        = 00000003 (USBD_TRANSFER_DIRECTION_IN, USBD_SHORT_TRANSFER_OK)
  TransferBufferLength = 00000005
  TransferBuffer       = 00000000
  TransferBufferMDL    = 81cb8458
    00000000: 00 00 00 0a 04
  UrbLink              = 00000000
[696268 ms] UsbSnoop - DispatchAny(f8916610) : IRP_MJ_INTERNAL_DEVICE_CONTROL
[696268 ms] UsbSnoop - MyDispatchInternalIOCTL(f8917e80) : fdo=822eee08, Irp=81b1f958, IRQL=2
[696268 ms]  >>>  URB 1054 going down  >>> 
-- URB_FUNCTION_BULK_OR_INTERRUPT_TRANSFER:
  PipeHandle           = 82300ef4 [endpoint 0x00000081]
  TransferFlags        = 00000003 (USBD_TRANSFER_DIRECTION_IN, USBD_SHORT_TRANSFER_OK)
  TransferBufferLength = 00000100
  TransferBuffer       = 00000000
  TransferBufferMDL    = 81cb8458
  UrbLink              = 00000000
[696268 ms] UsbSnoop - MyInternalIOCTLCompletion(f8917db0) : fido=81b964f0, Irp=81b1f958, Context=81b06608, IRQL=2
[696268 ms]  <<<  URB 1054 coming back  <<< 
-- URB_FUNCTION_BULK_OR_INTERRUPT_TRANSFER:
  PipeHandle           = 82300ef4 [endpoint 0x00000081]
  TransferFlags        = 00000003 (USBD_TRANSFER_DIRECTION_IN, USBD_SHORT_TRANSFER_OK)
  TransferBufferLength = 0000000a
  TransferBuffer       = 00000000
  TransferBufferMDL    = 81cb8458
    00000000: 00 00 00 04 00 12 00 00 07 d0
  UrbLink              = 00000000
[696298 ms] UsbSnoop - DispatchAny(f8916610) : IRP_MJ_INTERNAL_DEVICE_CONTROL
[696298 ms] UsbSnoop - MyDispatchInternalIOCTL(f8917e80) : fdo=822eee08, Irp=81b1f958, IRQL=2
[696298 ms]  >>>  URB 1055 going down  >>> 
-- URB_FUNCTION_BULK_OR_INTERRUPT_TRANSFER:
  PipeHandle           = 82300f14 [endpoint 0x00000002]
  TransferFlags        = 00000000 (USBD_TRANSFER_DIRECTION_OUT, ~USBD_SHORT_TRANSFER_OK)
  TransferBufferLength = 00000007
  TransferBuffer       = 00000000
  TransferBufferMDL    = 81cb8458
    00000000: 00 00 00 02 05 e0 00
  UrbLink              = 00000000
[696299 ms] UsbSnoop - MyInternalIOCTLCompletion(f8917db0) : fido=81b964f0, Irp=81b1f958, Context=82304d38, IRQL=2
[696299 ms]  <<<  URB 1055 coming back  <<< 
-- URB_FUNCTION_BULK_OR_INTERRUPT_TRANSFER:
  PipeHandle           = 82300f14 [endpoint 0x00000002]
  TransferFlags        = 00000000 (USBD_TRANSFER_DIRECTION_OUT, ~USBD_SHORT_TRANSFER_OK)
  TransferBufferLength = 00000007
  TransferBuffer       = 00000000
  TransferBufferMDL    = 81cb8458
  UrbLink              = 00000000
[696309 ms] UsbSnoop - DispatchAny(f8916610) : IRP_MJ_INTERNAL_DEVICE_CONTROL
[696309 ms] UsbSnoop - MyDispatchInternalIOCTL(f8917e80) : fdo=822eee08, Irp=81b1f958, IRQL=2
[696309 ms]  >>>  URB 1056 going down  >>> 
-- URB_FUNCTION_BULK_OR_INTERRUPT_TRANSFER:
  PipeHandle           = 82300f14 [endpoint 0x00000002]
  TransferFlags        = 00000000 (USBD_TRANSFER_DIRECTION_OUT, ~USBD_SHORT_TRANSFER_OK)
  TransferBufferLength = 00000028
  TransferBuffer       = 00000000
  TransferBufferMDL    = 81cb8458
    00000000: 00 00 00 23 04 00 00 00 1d 00 10 00 06 55 53 50
    00000010: 52 45 53 00 00 02 00 11 00 04 f0 0c 00 24 00 13
    00000020: 00 01 01 01 00 00 00 00
  UrbLink              = 00000000
[696309 ms] UsbSnoop - MyInternalIOCTLCompletion(f8917db0) : fido=81b964f0, Irp=81b1f958, Context=81c3bfe8, IRQL=2
[696309 ms]  <<<  URB 1056 coming back  <<< 
-- URB_FUNCTION_BULK_OR_INTERRUPT_TRANSFER:
  PipeHandle           = 82300f14 [endpoint 0x00000002]
  TransferFlags        = 00000000 (USBD_TRANSFER_DIRECTION_OUT, ~USBD_SHORT_TRANSFER_OK)
  TransferBufferLength = 00000028
  TransferBuffer       = 00000000
  TransferBufferMDL    = 81cb8458
  UrbLink              = 00000000
[696318 ms] UsbSnoop - DispatchAny(f8916610) : IRP_MJ_INTERNAL_DEVICE_CONTROL
[696318 ms] UsbSnoop - MyDispatchInternalIOCTL(f8917e80) : fdo=822eee08, Irp=81b1f958, IRQL=2
[696318 ms]  >>>  URB 1057 going down  >>> 
-- URB_FUNCTION_BULK_OR_INTERRUPT_TRANSFER:
  PipeHandle           = 82300ef4 [endpoint 0x00000081]
  TransferFlags        = 00000003 (USBD_TRANSFER_DIRECTION_IN, USBD_SHORT_TRANSFER_OK)
  TransferBufferLength = 00000100
  TransferBuffer       = 00000000
  TransferBufferMDL    = 81cb8458
  UrbLink              = 00000000
[696318 ms] UsbSnoop - MyInternalIOCTLCompletion(f8917db0) : fido=81b964f0, Irp=81b1f958, Context=81cb4e48, IRQL=2
[696318 ms]  <<<  URB 1057 coming back  <<< 
-- URB_FUNCTION_BULK_OR_INTERRUPT_TRANSFER:
  PipeHandle           = 82300ef4 [endpoint 0x00000081]
  TransferFlags        = 00000003 (USBD_TRANSFER_DIRECTION_IN, USBD_SHORT_TRANSFER_OK)
  TransferBufferLength = 00000007
  TransferBuffer       = 00000000
  TransferBufferMDL    = 81cb8458
    00000000: 00 00 00 02 05 e0 00
  UrbLink              = 00000000
[696359 ms] UsbSnoop - DispatchAny(f8916610) : IRP_MJ_INTERNAL_DEVICE_CONTROL
[696359 ms] UsbSnoop - MyDispatchInternalIOCTL(f8917e80) : fdo=822eee08, Irp=81b1f958, IRQL=2
[696359 ms]  >>>  URB 1058 going down  >>> 
-- URB_FUNCTION_BULK_OR_INTERRUPT_TRANSFER:
  PipeHandle           = 82300ef4 [endpoint 0x00000081]
  TransferFlags        = 00000003 (USBD_TRANSFER_DIRECTION_IN, USBD_SHORT_TRANSFER_OK)
  TransferBufferLength = 00000100
  TransferBuffer       = 00000000
  TransferBufferMDL    = 81cb8458
  UrbLink              = 00000000
[696359 ms] UsbSnoop - MyInternalIOCTLCompletion(f8917db0) : fido=81b964f0, Irp=81b1f958, Context=81b30798, IRQL=2
[696359 ms]  <<<  URB 1058 coming back  <<< 
-- URB_FUNCTION_BULK_OR_INTERRUPT_TRANSFER:
  PipeHandle           = 82300ef4 [endpoint 0x00000081]
  TransferFlags        = 00000003 (USBD_TRANSFER_DIRECTION_IN, USBD_SHORT_TRANSFER_OK)
  TransferBufferLength = 00000005
  TransferBuffer       = 00000000
  TransferBufferMDL    = 81cb8458
    00000000: 00 00 00 0a 04
  UrbLink              = 00000000
[696389 ms] UsbSnoop - DispatchAny(f8916610) : IRP_MJ_INTERNAL_DEVICE_CONTROL
[696389 ms] UsbSnoop - MyDispatchInternalIOCTL(f8917e80) : fdo=822eee08, Irp=81b1f958, IRQL=2
[696389 ms]  >>>  URB 1059 going down  >>> 
-- URB_FUNCTION_BULK_OR_INTERRUPT_TRANSFER:
  PipeHandle           = 82300ef4 [endpoint 0x00000081]
  TransferFlags        = 00000003 (USBD_TRANSFER_DIRECTION_IN, USBD_SHORT_TRANSFER_OK)
  TransferBufferLength = 00000100
  TransferBuffer       = 00000000
  TransferBufferMDL    = 81cb8458
  UrbLink              = 00000000
[696389 ms] UsbSnoop - MyInternalIOCTLCompletion(f8917db0) : fido=81b964f0, Irp=81b1f958, Context=81c3bfe8, IRQL=2
[696389 ms]  <<<  URB 1059 coming back  <<< 
-- URB_FUNCTION_BULK_OR_INTERRUPT_TRANSFER:
  PipeHandle           = 82300ef4 [endpoint 0x00000081]
  TransferFlags        = 00000003 (USBD_TRANSFER_DIRECTION_IN, USBD_SHORT_TRANSFER_OK)
  TransferBufferLength = 0000000a
  TransferBuffer       = 00000000
  TransferBufferMDL    = 81cb8458
    00000000: 00 00 00 04 bb 00 00 05 7e 40
  UrbLink              = 00000000
[696419 ms] UsbSnoop - DispatchAny(f8916610) : IRP_MJ_INTERNAL_DEVICE_CONTROL
[696419 ms] UsbSnoop - MyDispatchInternalIOCTL(f8917e80) : fdo=822eee08, Irp=81b1f958, IRQL=2
[696419 ms]  >>>  URB 1060 going down  >>> 
-- URB_FUNCTION_BULK_OR_INTERRUPT_TRANSFER:
  PipeHandle           = 82300f14 [endpoint 0x00000002]
  TransferFlags        = 00000000 (USBD_TRANSFER_DIRECTION_OUT, ~USBD_SHORT_TRANSFER_OK)
  TransferBufferLength = 00000007
  TransferBuffer       = 00000000
  TransferBufferMDL    = 81cb8458
    00000000: 00 00 00 02 05 e0 00
  UrbLink              = 00000000
[696419 ms] UsbSnoop - MyInternalIOCTLCompletion(f8917db0) : fido=81b964f0, Irp=81b1f958, Context=81b30798, IRQL=2
[696419 ms]  <<<  URB 1060 coming back  <<< 
-- URB_FUNCTION_BULK_OR_INTERRUPT_TRANSFER:
  PipeHandle           = 82300f14 [endpoint 0x00000002]
  TransferFlags        = 00000000 (USBD_TRANSFER_DIRECTION_OUT, ~USBD_SHORT_TRANSFER_OK)
  TransferBufferLength = 00000007
  TransferBuffer       = 00000000
  TransferBufferMDL    = 81cb8458
  UrbLink              = 00000000
[696429 ms] UsbSnoop - DispatchAny(f8916610) : IRP_MJ_INTERNAL_DEVICE_CONTROL
[696429 ms] UsbSnoop - MyDispatchInternalIOCTL(f8917e80) : fdo=822eee08, Irp=81b1f958, IRQL=2
[696429 ms]  >>>  URB 1061 going down  >>> 
-- URB_FUNCTION_BULK_OR_INTERRUPT_TRANSFER:
  PipeHandle           = 82300ef4 [endpoint 0x00000081]
  TransferFlags        = 00000003 (USBD_TRANSFER_DIRECTION_IN, USBD_SHORT_TRANSFER_OK)
  TransferBufferLength = 00000100
  TransferBuffer       = 00000000
  TransferBufferMDL    = 81cb8458
  UrbLink              = 00000000
[697229 ms] UsbSnoop - MyInternalIOCTLCompletion(f8917db0) : fido=81b964f0, Irp=81b1f958, Context=81abee68, IRQL=2
[697229 ms]  <<<  URB 1061 coming back  <<< 
-- URB_FUNCTION_BULK_OR_INTERRUPT_TRANSFER:
  PipeHandle           = 82300ef4 [endpoint 0x00000081]
  TransferFlags        = 00000003 (USBD_TRANSFER_DIRECTION_IN, USBD_SHORT_TRANSFER_OK)
  TransferBufferLength = 00000005
  TransferBuffer       = 00000000
  TransferBufferMDL    = 81cb8458
    00000000: 00 00 00 07 04
  UrbLink              = 00000000
[697250 ms] UsbSnoop - DispatchAny(f8916610) : IRP_MJ_INTERNAL_DEVICE_CONTROL
[697250 ms] UsbSnoop - MyDispatchInternalIOCTL(f8917e80) : fdo=822eee08, Irp=81b1f958, IRQL=2
[697250 ms]  >>>  URB 1062 going down  >>> 
-- URB_FUNCTION_BULK_OR_INTERRUPT_TRANSFER:
  PipeHandle           = 82300ef4 [endpoint 0x00000081]
  TransferFlags        = 00000003 (USBD_TRANSFER_DIRECTION_IN, USBD_SHORT_TRANSFER_OK)
  TransferBufferLength = 00000100
  TransferBuffer       = 00000000
  TransferBufferMDL    = 81cb8458
  UrbLink              = 00000000
[697250 ms] UsbSnoop - MyInternalIOCTLCompletion(f8917db0) : fido=81b964f0, Irp=81b1f958, Context=81c3bfe8, IRQL=2
[697250 ms]  <<<  URB 1062 coming back  <<< 
-- URB_FUNCTION_BULK_OR_INTERRUPT_TRANSFER:
  PipeHandle           = 82300ef4 [endpoint 0x00000081]
  TransferFlags        = 00000003 (USBD_TRANSFER_DIRECTION_IN, USBD_SHORT_TRANSFER_OK)
  TransferBufferLength = 00000007
  TransferBuffer       = 00000000
  TransferBufferMDL    = 81cb8458
    00000000: 00 00 00 01 aa 00 01
  UrbLink              = 00000000
[697280 ms] UsbSnoop - DispatchAny(f8916610) : IRP_MJ_INTERNAL_DEVICE_CONTROL
[697280 ms] UsbSnoop - MyDispatchInternalIOCTL(f8917e80) : fdo=822eee08, Irp=81b1f958, IRQL=2
[697280 ms]  >>>  URB 1063 going down  >>> 
-- URB_FUNCTION_BULK_OR_INTERRUPT_TRANSFER:
  PipeHandle           = 82300f14 [endpoint 0x00000002]
  TransferFlags        = 00000000 (USBD_TRANSFER_DIRECTION_OUT, ~USBD_SHORT_TRANSFER_OK)
  TransferBufferLength = 00000007
  TransferBuffer       = 00000000
  TransferBufferMDL    = 81cb8458
    00000000: 00 00 00 02 05 e0 00
  UrbLink              = 00000000
[697280 ms] UsbSnoop - MyInternalIOCTLCompletion(f8917db0) : fido=81b964f0, Irp=81b1f958, Context=81abee68, IRQL=2
[697280 ms]  <<<  URB 1063 coming back  <<< 
-- URB_FUNCTION_BULK_OR_INTERRUPT_TRANSFER:
  PipeHandle           = 82300f14 [endpoint 0x00000002]
  TransferFlags        = 00000000 (USBD_TRANSFER_DIRECTION_OUT, ~USBD_SHORT_TRANSFER_OK)
  TransferBufferLength = 00000007
  TransferBuffer       = 00000000
  TransferBufferMDL    = 81cb8458
  UrbLink              = 00000000
[697290 ms] UsbSnoop - DispatchAny(f8916610) : IRP_MJ_INTERNAL_DEVICE_CONTROL
[697290 ms] UsbSnoop - MyDispatchInternalIOCTL(f8917e80) : fdo=822eee08, Irp=81c073d0, IRQL=0
[697290 ms]  >>>  URB 1064 going down  >>> 
-- URB_FUNCTION_RESET_PIPE:
  PipeHandle = 82300ef4 [endpoint 0x00000081]
[697290 ms] UsbSnoop - MyInternalIOCTLCompletion(f8917db0) : fido=00000000, Irp=81c073d0, Context=82304d38, IRQL=0
[697290 ms]  <<<  URB 1064 coming back  <<< 
-- URB_FUNCTION_RESET_PIPE:
[697290 ms] UsbSnoop - DispatchAny(f8916610) : IRP_MJ_INTERNAL_DEVICE_CONTROL
[697290 ms] UsbSnoop - MyDispatchInternalIOCTL(f8917e80) : fdo=822eee08, Irp=81c073d0, IRQL=0
[697290 ms]  >>>  URB 1065 going down  >>> 
-- URB_FUNCTION_RESET_PIPE:
  PipeHandle = 82300f14 [endpoint 0x00000002]
[697291 ms] UsbSnoop - MyInternalIOCTLCompletion(f8917db0) : fido=00000000, Irp=81c073d0, Context=81abee68, IRQL=0
[697291 ms]  <<<  URB 1065 coming back  <<< 
-- URB_FUNCTION_RESET_PIPE:
[697291 ms] UsbSnoop - DispatchAny(f8916610) : IRP_MJ_INTERNAL_DEVICE_CONTROL
[697291 ms] UsbSnoop - MyDispatchInternalIOCTL(f8917e80) : fdo=822eee08, Irp=81ab2e48, IRQL=0
[697291 ms] UsbSnoop - IRP_MJ_POWER (IRP_MN_WAIT_WAKE)
[697490 ms] UsbSnoop - DispatchAny(f8916610) : IRP_MJ_INTERNAL_DEVICE_CONTROL
[697490 ms] UsbSnoop - MyDispatchInternalIOCTL(f8917e80) : fdo=822eee08, Irp=81ab2e48, IRQL=0
[697490 ms]  >>>  URB 1066 going down  >>> 
-- URB_FUNCTION_RESET_PIPE:
  PipeHandle = 82300ef4 [endpoint 0x00000081]
[697491 ms] UsbSnoop - MyInternalIOCTLCompletion(f8917db0) : fido=00000000, Irp=81ab2e48, Context=81b30798, IRQL=0
[697491 ms]  <<<  URB 1066 coming back  <<< 
-- URB_FUNCTION_RESET_PIPE:
[697491 ms] UsbSnoop - DispatchAny(f8916610) : IRP_MJ_INTERNAL_DEVICE_CONTROL
[697491 ms] UsbSnoop - MyDispatchInternalIOCTL(f8917e80) : fdo=822eee08, Irp=81ab2e48, IRQL=0
[697491 ms]  >>>  URB 1067 going down  >>> 
-- URB_FUNCTION_RESET_PIPE:
  PipeHandle = 82300f14 [endpoint 0x00000002]
[697491 ms] UsbSnoop - MyInternalIOCTLCompletion(f8917db0) : fido=00000000, Irp=81ab2e48, Context=81abee68, IRQL=0
[697491 ms]  <<<  URB 1067 coming back  <<< 
-- URB_FUNCTION_RESET_PIPE:
[698492 ms] UsbSnoop - DispatchAny(f8916610) : IRP_MJ_INTERNAL_DEVICE_CONTROL
[698492 ms] UsbSnoop - MyDispatchInternalIOCTL(f8917e80) : fdo=822eee08, Irp=81ab2e48, IRQL=0
[698492 ms]  >>>  URB 1068 going down  >>> 
-- URB_FUNCTION_RESET_PIPE:
  PipeHandle = 82300ef4 [endpoint 0x00000081]
[698492 ms] UsbSnoop - MyInternalIOCTLCompletion(f8917db0) : fido=00000000, Irp=81ab2e48, Context=81abee68, IRQL=0
[698492 ms]  <<<  URB 1068 coming back  <<< 
-- URB_FUNCTION_RESET_PIPE:
[698492 ms] UsbSnoop - DispatchAny(f8916610) : IRP_MJ_INTERNAL_DEVICE_CONTROL
[698492 ms] UsbSnoop - MyDispatchInternalIOCTL(f8917e80) : fdo=822eee08, Irp=81ab2e48, IRQL=0
[698492 ms]  >>>  URB 1069 going down  >>> 
-- URB_FUNCTION_RESET_PIPE:
  PipeHandle = 82300f14 [endpoint 0x00000002]
[698493 ms] UsbSnoop - MyInternalIOCTLCompletion(f8917db0) : fido=00000000, Irp=81ab2e48, Context=82304d38, IRQL=0
[698493 ms]  <<<  URB 1069 coming back  <<< 
-- URB_FUNCTION_RESET_PIPE:
[698493 ms] UsbSnoop - DispatchAny(f8916610) : IRP_MJ_INTERNAL_DEVICE_CONTROL
[698493 ms] UsbSnoop - MyDispatchInternalIOCTL(f8917e80) : fdo=822eee08, Irp=81c873d8, IRQL=0
[699494 ms] UsbSnoop - IRP_MJ_POWER (IRP_MN_WAIT_WAKE)
[699494 ms] UsbSnoop - DispatchAny(f8916610) : IRP_MJ_INTERNAL_DEVICE_CONTROL
[699494 ms] UsbSnoop - MyDispatchInternalIOCTL(f8917e80) : fdo=822eee08, Irp=81c073d0, IRQL=0
[699494 ms]  >>>  URB 1070 going down  >>> 
-- URB_FUNCTION_GET_DESCRIPTOR_FROM_DEVICE:
  TransferBufferLength = 00000012
  TransferBuffer       = e29b7c38
  TransferBufferMDL    = 00000000
  Index                = 00000000
  DescriptorType       = 00000001 (USB_DEVICE_DESCRIPTOR_TYPE)
  LanguageId           = 00000000
[699494 ms] UsbSnoop - MyInternalIOCTLCompletion(f8917db0) : fido=00000000, Irp=81c073d0, Context=82304d38, IRQL=2
[699494 ms]  <<<  URB 1070 coming back  <<< 
-- URB_FUNCTION_CONTROL_TRANSFER:
  PipeHandle           = 82149668
  TransferFlags        = 81c873db (USBD_TRANSFER_DIRECTION_IN, USBD_SHORT_TRANSFER_OK)
  TransferBufferLength = 00000012
  TransferBuffer       = e29b7c38
  TransferBufferMDL    = 81caa438
    00000000: 12 01 00 02 00 00 00 40 51 04 04 e0 00 03 01 02
    00000010: 00 01
  UrbLink              = 00000000
  SetupPacket          =
    00000000: 80 06 00 01 00 00 12 00
[699494 ms] UsbSnoop - DispatchAny(f8916610) : IRP_MJ_INTERNAL_DEVICE_CONTROL
[699494 ms] UsbSnoop - MyDispatchInternalIOCTL(f8917e80) : fdo=822eee08, Irp=81c873d8, IRQL=0
[699495 ms] UsbSnoop - IRP_MJ_POWER (IRP_MN_WAIT_WAKE)
[699495 ms] UsbSnoop - DispatchAny(f8916610) : IRP_MJ_INTERNAL_DEVICE_CONTROL
[699495 ms] UsbSnoop - MyDispatchInternalIOCTL(f8917e80) : fdo=822eee08, Irp=81c873d8, IRQL=0
[699495 ms]  >>>  URB 1071 going down  >>> 
-- URB_FUNCTION_RESET_PIPE:
  PipeHandle = 82300ef4 [endpoint 0x00000081]
[699495 ms] UsbSnoop - MyInternalIOCTLCompletion(f8917db0) : fido=00000000, Irp=81c873d8, Context=81b06608, IRQL=0
[699495 ms]  <<<  URB 1071 coming back  <<< 
-- URB_FUNCTION_RESET_PIPE:
[699495 ms] UsbSnoop - DispatchAny(f8916610) : IRP_MJ_INTERNAL_DEVICE_CONTROL
[699495 ms] UsbSnoop - MyDispatchInternalIOCTL(f8917e80) : fdo=822eee08, Irp=81c873d8, IRQL=0
[699495 ms]  >>>  URB 1072 going down  >>> 
-- URB_FUNCTION_RESET_PIPE:
  PipeHandle = 82300f14 [endpoint 0x00000002]
[699495 ms] UsbSnoop - MyInternalIOCTLCompletion(f8917db0) : fido=00000000, Irp=81c873d8, Context=81abee68, IRQL=0
[699495 ms]  <<<  URB 1072 coming back  <<< 
-- URB_FUNCTION_RESET_PIPE:
[700745 ms] UsbSnoop - DispatchAny(f8916610) : IRP_MJ_INTERNAL_DEVICE_CONTROL
[700745 ms] UsbSnoop - MyDispatchInternalIOCTL(f8917e80) : fdo=822eee08, Irp=81b1f958, IRQL=2
[700745 ms]  >>>  URB 1073 going down  >>> 
-- URB_FUNCTION_BULK_OR_INTERRUPT_TRANSFER:
  PipeHandle           = 82300f14 [endpoint 0x00000002]
  TransferFlags        = 00000000 (USBD_TRANSFER_DIRECTION_OUT, ~USBD_SHORT_TRANSFER_OK)
  TransferBufferLength = 00000009
  TransferBuffer       = 00000000
  TransferBufferMDL    = 81caa438
    00000000: 00 00 00 04 01 00 00 04 00
  UrbLink              = 00000000
[700746 ms] UsbSnoop - MyInternalIOCTLCompletion(f8917db0) : fido=81b964f0, Irp=81b1f958, Context=81b06608, IRQL=2
[700746 ms]  <<<  URB 1073 coming back  <<< 
-- URB_FUNCTION_BULK_OR_INTERRUPT_TRANSFER:
  PipeHandle           = 82300f14 [endpoint 0x00000002]
  TransferFlags        = 00000000 (USBD_TRANSFER_DIRECTION_OUT, ~USBD_SHORT_TRANSFER_OK)
  TransferBufferLength = 00000009
  TransferBuffer       = 00000000
  TransferBufferMDL    = 81caa438
  UrbLink              = 00000000
[700746 ms] UsbSnoop - DispatchAny(f8916610) : IRP_MJ_INTERNAL_DEVICE_CONTROL
[700746 ms] UsbSnoop - MyDispatchInternalIOCTL(f8917e80) : fdo=822eee08, Irp=81b1f958, IRQL=2
[700746 ms]  >>>  URB 1074 going down  >>> 
-- URB_FUNCTION_BULK_OR_INTERRUPT_TRANSFER:
  PipeHandle           = 82300ef4 [endpoint 0x00000081]
  TransferFlags        = 00000003 (USBD_TRANSFER_DIRECTION_IN, USBD_SHORT_TRANSFER_OK)
  TransferBufferLength = 00000100
  TransferBuffer       = 00000000
  TransferBufferMDL    = 81caa438
  UrbLink              = 00000000
[700748 ms] UsbSnoop - MyInternalIOCTLCompletion(f8917db0) : fido=81b964f0, Irp=81b1f958, Context=81acd810, IRQL=2
[700748 ms]  <<<  URB 1074 coming back  <<< 
-- URB_FUNCTION_BULK_OR_INTERRUPT_TRANSFER:
  PipeHandle           = 82300ef4 [endpoint 0x00000081]
  TransferFlags        = 00000003 (USBD_TRANSFER_DIRECTION_IN, USBD_SHORT_TRANSFER_OK)
  TransferBufferLength = 00000009
  TransferBuffer       = 00000000
  TransferBufferMDL    = 81caa438
    00000000: 00 00 00 04 02 00 00 03 ff
  UrbLink              = 00000000
[700776 ms] UsbSnoop - DispatchAny(f8916610) : IRP_MJ_INTERNAL_DEVICE_CONTROL
[700776 ms] UsbSnoop - MyDispatchInternalIOCTL(f8917e80) : fdo=822eee08, Irp=81b1f958, IRQL=2
[700776 ms]  >>>  URB 1075 going down  >>> 
-- URB_FUNCTION_BULK_OR_INTERRUPT_TRANSFER:
  PipeHandle           = 82300f14 [endpoint 0x00000002]
  TransferFlags        = 00000000 (USBD_TRANSFER_DIRECTION_OUT, ~USBD_SHORT_TRANSFER_OK)
  TransferBufferLength = 00000015
  TransferBuffer       = 00000000
  TransferBufferMDL    = 81caa438
    00000000: 00 00 00 10 04 00 00 00 0a 00 01 00 03 00 01 00
    00000010: 00 00 00 07 d0
  UrbLink              = 00000000
[700777 ms] UsbSnoop - MyInternalIOCTLCompletion(f8917db0) : fido=81b964f0, Irp=81b1f958, Context=82304d38, IRQL=2
[700777 ms]  <<<  URB 1075 coming back  <<< 
-- URB_FUNCTION_BULK_OR_INTERRUPT_TRANSFER:
  PipeHandle           = 82300f14 [endpoint 0x00000002]
  TransferFlags        = 00000000 (USBD_TRANSFER_DIRECTION_OUT, ~USBD_SHORT_TRANSFER_OK)
  TransferBufferLength = 00000015
  TransferBuffer       = 00000000
  TransferBufferMDL    = 81caa438
  UrbLink              = 00000000
[700786 ms] UsbSnoop - DispatchAny(f8916610) : IRP_MJ_INTERNAL_DEVICE_CONTROL
[700786 ms] UsbSnoop - MyDispatchInternalIOCTL(f8917e80) : fdo=822eee08, Irp=81b1f958, IRQL=2
[700786 ms]  >>>  URB 1076 going down  >>> 
-- URB_FUNCTION_BULK_OR_INTERRUPT_TRANSFER:
  PipeHandle           = 82300ef4 [endpoint 0x00000081]
  TransferFlags        = 00000003 (USBD_TRANSFER_DIRECTION_IN, USBD_SHORT_TRANSFER_OK)
  TransferBufferLength = 00000100
  TransferBuffer       = 00000000
  TransferBufferMDL    = 81caa438
  UrbLink              = 00000000
[700786 ms] UsbSnoop - MyInternalIOCTLCompletion(f8917db0) : fido=81b964f0, Irp=81b1f958, Context=81b06608, IRQL=2
[700786 ms]  <<<  URB 1076 coming back  <<< 
-- URB_FUNCTION_BULK_OR_INTERRUPT_TRANSFER:
  PipeHandle           = 82300ef4 [endpoint 0x00000081]
  TransferFlags        = 00000003 (USBD_TRANSFER_DIRECTION_IN, USBD_SHORT_TRANSFER_OK)
  TransferBufferLength = 00000007
  TransferBuffer       = 00000000
  TransferBufferMDL    = 81caa438
    00000000: 00 00 00 02 05 e0 00
  UrbLink              = 00000000
[700826 ms] UsbSnoop - DispatchAny(f8916610) : IRP_MJ_INTERNAL_DEVICE_CONTROL
[700826 ms] UsbSnoop - MyDispatchInternalIOCTL(f8917e80) : fdo=822eee08, Irp=81b1f958, IRQL=2
[700826 ms]  >>>  URB 1077 going down  >>> 
-- URB_FUNCTION_BULK_OR_INTERRUPT_TRANSFER:
  PipeHandle           = 82300ef4 [endpoint 0x00000081]
  TransferFlags        = 00000003 (USBD_TRANSFER_DIRECTION_IN, USBD_SHORT_TRANSFER_OK)
  TransferBufferLength = 00000100
  TransferBuffer       = 00000000
  TransferBufferMDL    = 81caa438
  UrbLink              = 00000000
[700826 ms] UsbSnoop - MyInternalIOCTLCompletion(f8917db0) : fido=81b964f0, Irp=81b1f958, Context=82304d38, IRQL=2
[700826 ms]  <<<  URB 1077 coming back  <<< 
-- URB_FUNCTION_BULK_OR_INTERRUPT_TRANSFER:
  PipeHandle           = 82300ef4 [endpoint 0x00000081]
  TransferFlags        = 00000003 (USBD_TRANSFER_DIRECTION_IN, USBD_SHORT_TRANSFER_OK)
  TransferBufferLength = 00000005
  TransferBuffer       = 00000000
  TransferBufferMDL    = 81caa438
    00000000: 00 00 00 0a 04
  UrbLink              = 00000000
[700856 ms] UsbSnoop - DispatchAny(f8916610) : IRP_MJ_INTERNAL_DEVICE_CONTROL
[700856 ms] UsbSnoop - MyDispatchInternalIOCTL(f8917e80) : fdo=822eee08, Irp=81b1f958, IRQL=2
[700856 ms]  >>>  URB 1078 going down  >>> 
-- URB_FUNCTION_BULK_OR_INTERRUPT_TRANSFER:
  PipeHandle           = 82300ef4 [endpoint 0x00000081]
  TransferFlags        = 00000003 (USBD_TRANSFER_DIRECTION_IN, USBD_SHORT_TRANSFER_OK)
  TransferBufferLength = 00000100
  TransferBuffer       = 00000000
  TransferBufferMDL    = 81caa438
  UrbLink              = 00000000
[700856 ms] UsbSnoop - MyInternalIOCTLCompletion(f8917db0) : fido=81b964f0, Irp=81b1f958, Context=81b30798, IRQL=2
[700856 ms]  <<<  URB 1078 coming back  <<< 
-- URB_FUNCTION_BULK_OR_INTERRUPT_TRANSFER:
  PipeHandle           = 82300ef4 [endpoint 0x00000081]
  TransferFlags        = 00000003 (USBD_TRANSFER_DIRECTION_IN, USBD_SHORT_TRANSFER_OK)
  TransferBufferLength = 0000000a
  TransferBuffer       = 00000000
  TransferBufferMDL    = 81caa438
    00000000: 00 00 00 04 00 12 00 00 07 d0
  UrbLink              = 00000000
[700886 ms] UsbSnoop - DispatchAny(f8916610) : IRP_MJ_INTERNAL_DEVICE_CONTROL
[700886 ms] UsbSnoop - MyDispatchInternalIOCTL(f8917e80) : fdo=822eee08, Irp=81c873d8, IRQL=2
[700886 ms]  >>>  URB 1079 going down  >>> 
-- URB_FUNCTION_BULK_OR_INTERRUPT_TRANSFER:
  PipeHandle           = 82300f14 [endpoint 0x00000002]
  TransferFlags        = 00000000 (USBD_TRANSFER_DIRECTION_OUT, ~USBD_SHORT_TRANSFER_OK)
  TransferBufferLength = 00000007
  TransferBuffer       = 00000000
  TransferBufferMDL    = 81caa438
    00000000: 00 00 00 02 05 e0 00
  UrbLink              = 00000000
[700886 ms] UsbSnoop - MyInternalIOCTLCompletion(f8917db0) : fido=81b964f0, Irp=81c873d8, Context=81b06608, IRQL=2
[700886 ms]  <<<  URB 1079 coming back  <<< 
-- URB_FUNCTION_BULK_OR_INTERRUPT_TRANSFER:
  PipeHandle           = 82300f14 [endpoint 0x00000002]
  TransferFlags        = 00000000 (USBD_TRANSFER_DIRECTION_OUT, ~USBD_SHORT_TRANSFER_OK)
  TransferBufferLength = 00000007
  TransferBuffer       = 00000000
  TransferBufferMDL    = 81caa438
  UrbLink              = 00000000
[700896 ms] UsbSnoop - DispatchAny(f8916610) : IRP_MJ_INTERNAL_DEVICE_CONTROL
[700896 ms] UsbSnoop - MyDispatchInternalIOCTL(f8917e80) : fdo=822eee08, Irp=81b1f958, IRQL=2
[700896 ms]  >>>  URB 1080 going down  >>> 
-- URB_FUNCTION_BULK_OR_INTERRUPT_TRANSFER:
  PipeHandle           = 82300f14 [endpoint 0x00000002]
  TransferFlags        = 00000000 (USBD_TRANSFER_DIRECTION_OUT, ~USBD_SHORT_TRANSFER_OK)
  TransferBufferLength = 00000022
  TransferBuffer       = 00000000
  TransferBufferMDL    = 81caa438
    00000000: 00 00 00 1d 04 00 00 00 17 00 09 00 00 00 06 00
    00000010: 02 00 03 00 05 00 01 00 41 00 42 00 01 00 01 00
    00000020: 01 01
  UrbLink              = 00000000
[700896 ms] UsbSnoop - MyInternalIOCTLCompletion(f8917db0) : fido=81b964f0, Irp=81b1f958, Context=81b30798, IRQL=2
[700896 ms]  <<<  URB 1080 coming back  <<< 
-- URB_FUNCTION_BULK_OR_INTERRUPT_TRANSFER:
  PipeHandle           = 82300f14 [endpoint 0x00000002]
  TransferFlags        = 00000000 (USBD_TRANSFER_DIRECTION_OUT, ~USBD_SHORT_TRANSFER_OK)
  TransferBufferLength = 00000022
  TransferBuffer       = 00000000
  TransferBufferMDL    = 81caa438
  UrbLink              = 00000000
[700906 ms] UsbSnoop - DispatchAny(f8916610) : IRP_MJ_INTERNAL_DEVICE_CONTROL
[700906 ms] UsbSnoop - MyDispatchInternalIOCTL(f8917e80) : fdo=822eee08, Irp=822d8640, IRQL=2
[700906 ms]  >>>  URB 1081 going down  >>> 
-- URB_FUNCTION_BULK_OR_INTERRUPT_TRANSFER:
  PipeHandle           = 82300ef4 [endpoint 0x00000081]
  TransferFlags        = 00000003 (USBD_TRANSFER_DIRECTION_IN, USBD_SHORT_TRANSFER_OK)
  TransferBufferLength = 00000100
  TransferBuffer       = 00000000
  TransferBufferMDL    = 81caa438
  UrbLink              = 00000000
[700906 ms] UsbSnoop - MyInternalIOCTLCompletion(f8917db0) : fido=81b964f0, Irp=822d8640, Context=81abee68, IRQL=2
[700906 ms]  <<<  URB 1081 coming back  <<< 
-- URB_FUNCTION_BULK_OR_INTERRUPT_TRANSFER:
  PipeHandle           = 82300ef4 [endpoint 0x00000081]
  TransferFlags        = 00000003 (USBD_TRANSFER_DIRECTION_IN, USBD_SHORT_TRANSFER_OK)
  TransferBufferLength = 00000007
  TransferBuffer       = 00000000
  TransferBufferMDL    = 81caa438
    00000000: 00 00 00 02 05 e0 00
  UrbLink              = 00000000
[700946 ms] UsbSnoop - DispatchAny(f8916610) : IRP_MJ_INTERNAL_DEVICE_CONTROL
[700946 ms] UsbSnoop - MyDispatchInternalIOCTL(f8917e80) : fdo=822eee08, Irp=822d8640, IRQL=2
[700946 ms]  >>>  URB 1082 going down  >>> 
-- URB_FUNCTION_BULK_OR_INTERRUPT_TRANSFER:
  PipeHandle           = 82300ef4 [endpoint 0x00000081]
  TransferFlags        = 00000003 (USBD_TRANSFER_DIRECTION_IN, USBD_SHORT_TRANSFER_OK)
  TransferBufferLength = 00000100
  TransferBuffer       = 00000000
  TransferBufferMDL    = 81caa438
  UrbLink              = 00000000
[700946 ms] UsbSnoop - MyInternalIOCTLCompletion(f8917db0) : fido=81b964f0, Irp=822d8640, Context=81acd810, IRQL=2
[700946 ms]  <<<  URB 1082 coming back  <<< 
-- URB_FUNCTION_BULK_OR_INTERRUPT_TRANSFER:
  PipeHandle           = 82300ef4 [endpoint 0x00000081]
  TransferFlags        = 00000003 (USBD_TRANSFER_DIRECTION_IN, USBD_SHORT_TRANSFER_OK)
  TransferBufferLength = 00000005
  TransferBuffer       = 00000000
  TransferBufferMDL    = 81caa438
    00000000: 00 00 00 33 04
  UrbLink              = 00000000
[700976 ms] UsbSnoop - DispatchAny(f8916610) : IRP_MJ_INTERNAL_DEVICE_CONTROL
[700976 ms] UsbSnoop - MyDispatchInternalIOCTL(f8917e80) : fdo=822eee08, Irp=822d8640, IRQL=2
[700976 ms]  >>>  URB 1083 going down  >>> 
-- URB_FUNCTION_BULK_OR_INTERRUPT_TRANSFER:
  PipeHandle           = 82300ef4 [endpoint 0x00000081]
  TransferFlags        = 00000003 (USBD_TRANSFER_DIRECTION_IN, USBD_SHORT_TRANSFER_OK)
  TransferBufferLength = 00000100
  TransferBuffer       = 00000000
  TransferBufferMDL    = 81caa438
  UrbLink              = 00000000
[700976 ms] UsbSnoop - MyInternalIOCTLCompletion(f8917db0) : fido=81b964f0, Irp=822d8640, Context=82304d38, IRQL=2
[700976 ms]  <<<  URB 1083 coming back  <<< 
-- URB_FUNCTION_BULK_OR_INTERRUPT_TRANSFER:
  PipeHandle           = 82300ef4 [endpoint 0x00000081]
  TransferFlags        = 00000003 (USBD_TRANSFER_DIRECTION_IN, USBD_SHORT_TRANSFER_OK)
  TransferBufferLength = 00000033
  TransferBuffer       = 00000000
  TransferBufferMDL    = 81caa438
    00000000: 00 00 00 2d 00 0a 04 6d 61 69 6e 00 00 00 06 00
    00000010: 02 00 00 04 f0 04 00 1f 00 03 00 00 01 00 00 05
    00000020: 02 00 01 00 00 04 00 00 00 0c 00 41 00 00 01 00
    00000030: 00 42 01
  UrbLink              = 00000000
[701006 ms] UsbSnoop - DispatchAny(f8916610) : IRP_MJ_INTERNAL_DEVICE_CONTROL
[701006 ms] UsbSnoop - MyDispatchInternalIOCTL(f8917e80) : fdo=822eee08, Irp=822d8640, IRQL=2
[701006 ms]  >>>  URB 1084 going down  >>> 
-- URB_FUNCTION_BULK_OR_INTERRUPT_TRANSFER:
  PipeHandle           = 82300f14 [endpoint 0x00000002]
  TransferFlags        = 00000000 (USBD_TRANSFER_DIRECTION_OUT, ~USBD_SHORT_TRANSFER_OK)
  TransferBufferLength = 00000007
  TransferBuffer       = 00000000
  TransferBufferMDL    = 81caa438
    00000000: 00 00 00 02 05 e0 00
  UrbLink              = 00000000
[701006 ms] UsbSnoop - MyInternalIOCTLCompletion(f8917db0) : fido=81b964f0, Irp=822d8640, Context=81b06608, IRQL=2
[701006 ms]  <<<  URB 1084 coming back  <<< 
-- URB_FUNCTION_BULK_OR_INTERRUPT_TRANSFER:
  PipeHandle           = 82300f14 [endpoint 0x00000002]
  TransferFlags        = 00000000 (USBD_TRANSFER_DIRECTION_OUT, ~USBD_SHORT_TRANSFER_OK)
  TransferBufferLength = 00000007
  TransferBuffer       = 00000000
  TransferBufferMDL    = 81caa438
  UrbLink              = 00000000
[701016 ms] UsbSnoop - DispatchAny(f8916610) : IRP_MJ_INTERNAL_DEVICE_CONTROL
[701016 ms] UsbSnoop - MyDispatchInternalIOCTL(f8917e80) : fdo=822eee08, Irp=822d8640, IRQL=2
[701016 ms]  >>>  URB 1085 going down  >>> 
-- URB_FUNCTION_BULK_OR_INTERRUPT_TRANSFER:
  PipeHandle           = 82300ef4 [endpoint 0x00000081]
  TransferFlags        = 00000003 (USBD_TRANSFER_DIRECTION_IN, USBD_SHORT_TRANSFER_OK)
  TransferBufferLength = 00000100
  TransferBuffer       = 00000000
  TransferBufferMDL    = 81caa438
  UrbLink              = 00000000
[701016 ms] UsbSnoop - MyInternalIOCTLCompletion(f8917db0) : fido=81b964f0, Irp=822d8640, Context=81acd810, IRQL=2
[701016 ms]  <<<  URB 1085 coming back  <<< 
-- URB_FUNCTION_BULK_OR_INTERRUPT_TRANSFER:
  PipeHandle           = 82300ef4 [endpoint 0x00000081]
  TransferFlags        = 00000003 (USBD_TRANSFER_DIRECTION_IN, USBD_SHORT_TRANSFER_OK)
  TransferBufferLength = 00000005
  TransferBuffer       = 00000000
  TransferBufferMDL    = 81caa438
    00000000: 00 00 00 35 04
  UrbLink              = 00000000
[701046 ms] UsbSnoop - DispatchAny(f8916610) : IRP_MJ_INTERNAL_DEVICE_CONTROL
[701046 ms] UsbSnoop - MyDispatchInternalIOCTL(f8917e80) : fdo=822eee08, Irp=822d8640, IRQL=2
[701046 ms]  >>>  URB 1086 going down  >>> 
-- URB_FUNCTION_BULK_OR_INTERRUPT_TRANSFER:
  PipeHandle           = 82300ef4 [endpoint 0x00000081]
  TransferFlags        = 00000003 (USBD_TRANSFER_DIRECTION_IN, USBD_SHORT_TRANSFER_OK)
  TransferBufferLength = 00000100
  TransferBuffer       = 00000000
  TransferBufferMDL    = 81caa438
  UrbLink              = 00000000
[701046 ms] UsbSnoop - MyInternalIOCTLCompletion(f8917db0) : fido=81b964f0, Irp=822d8640, Context=81b06608, IRQL=2
[701046 ms]  <<<  URB 1086 coming back  <<< 
-- URB_FUNCTION_BULK_OR_INTERRUPT_TRANSFER:
  PipeHandle           = 82300ef4 [endpoint 0x00000081]
  TransferFlags        = 00000003 (USBD_TRANSFER_DIRECTION_IN, USBD_SHORT_TRANSFER_OK)
  TransferBufferLength = 00000035
  TransferBuffer       = 00000000
  TransferBufferMDL    = 81caa438
    00000000: 00 00 00 2f 00 0a 04 6d 61 69 6e 00 01 78 00 00
    00000010: 06 00 02 00 00 04 f0 04 00 00 00 03 00 00 01 00
    00000020: 00 05 02 00 01 00 00 04 00 00 00 05 00 41 00 00
    00000030: 01 00 00 42 01
  UrbLink              = 00000000
[701076 ms] UsbSnoop - DispatchAny(f8916610) : IRP_MJ_INTERNAL_DEVICE_CONTROL
[701076 ms] UsbSnoop - MyDispatchInternalIOCTL(f8917e80) : fdo=822eee08, Irp=822d8640, IRQL=2
[701076 ms]  >>>  URB 1087 going down  >>> 
-- URB_FUNCTION_BULK_OR_INTERRUPT_TRANSFER:
  PipeHandle           = 82300f14 [endpoint 0x00000002]
  TransferFlags        = 00000000 (USBD_TRANSFER_DIRECTION_OUT, ~USBD_SHORT_TRANSFER_OK)
  TransferBufferLength = 00000007
  TransferBuffer       = 00000000
  TransferBufferMDL    = 81caa438
    00000000: 00 00 00 02 05 e0 00
  UrbLink              = 00000000
[701076 ms] UsbSnoop - MyInternalIOCTLCompletion(f8917db0) : fido=81b964f0, Irp=822d8640, Context=81cb4e48, IRQL=2
[701076 ms]  <<<  URB 1087 coming back  <<< 
-- URB_FUNCTION_BULK_OR_INTERRUPT_TRANSFER:
  PipeHandle           = 82300f14 [endpoint 0x00000002]
  TransferFlags        = 00000000 (USBD_TRANSFER_DIRECTION_OUT, ~USBD_SHORT_TRANSFER_OK)
  TransferBufferLength = 00000007
  TransferBuffer       = 00000000
  TransferBufferMDL    = 81caa438
  UrbLink              = 00000000
[701086 ms] UsbSnoop - DispatchAny(f8916610) : IRP_MJ_INTERNAL_DEVICE_CONTROL
[701086 ms] UsbSnoop - MyDispatchInternalIOCTL(f8917e80) : fdo=822eee08, Irp=822d8640, IRQL=2
[701086 ms]  >>>  URB 1088 going down  >>> 
-- URB_FUNCTION_BULK_OR_INTERRUPT_TRANSFER:
  PipeHandle           = 82300ef4 [endpoint 0x00000081]
  TransferFlags        = 00000003 (USBD_TRANSFER_DIRECTION_IN, USBD_SHORT_TRANSFER_OK)
  TransferBufferLength = 00000100
  TransferBuffer       = 00000000
  TransferBufferMDL    = 81caa438
  UrbLink              = 00000000
[701086 ms] UsbSnoop - MyInternalIOCTLCompletion(f8917db0) : fido=81b964f0, Irp=822d8640, Context=81b30798, IRQL=2
[701086 ms]  <<<  URB 1088 coming back  <<< 
-- URB_FUNCTION_BULK_OR_INTERRUPT_TRANSFER:
  PipeHandle           = 82300ef4 [endpoint 0x00000081]
  TransferFlags        = 00000003 (USBD_TRANSFER_DIRECTION_IN, USBD_SHORT_TRANSFER_OK)
  TransferBufferLength = 00000005
  TransferBuffer       = 00000000
  TransferBufferMDL    = 81caa438
    00000000: 00 00 00 35 04
  UrbLink              = 00000000
[701116 ms] UsbSnoop - DispatchAny(f8916610) : IRP_MJ_INTERNAL_DEVICE_CONTROL
[701116 ms] UsbSnoop - MyDispatchInternalIOCTL(f8917e80) : fdo=822eee08, Irp=822d8640, IRQL=2
[701116 ms]  >>>  URB 1089 going down  >>> 
-- URB_FUNCTION_BULK_OR_INTERRUPT_TRANSFER:
  PipeHandle           = 82300ef4 [endpoint 0x00000081]
  TransferFlags        = 00000003 (USBD_TRANSFER_DIRECTION_IN, USBD_SHORT_TRANSFER_OK)
  TransferBufferLength = 00000100
  TransferBuffer       = 00000000
  TransferBufferMDL    = 81caa438
  UrbLink              = 00000000
[701116 ms] UsbSnoop - MyInternalIOCTLCompletion(f8917db0) : fido=81b964f0, Irp=822d8640, Context=82304d38, IRQL=2
[701116 ms]  <<<  URB 1089 coming back  <<< 
-- URB_FUNCTION_BULK_OR_INTERRUPT_TRANSFER:
  PipeHandle           = 82300ef4 [endpoint 0x00000081]
  TransferFlags        = 00000003 (USBD_TRANSFER_DIRECTION_IN, USBD_SHORT_TRANSFER_OK)
  TransferBufferLength = 00000035
  TransferBuffer       = 00000000
  TransferBufferMDL    = 81caa438
    00000000: 00 00 00 2f 00 0a 04 6d 61 69 6e 00 01 79 00 00
    00000010: 06 00 02 00 00 04 f0 04 00 00 00 03 00 00 01 00
    00000020: 00 05 02 00 01 00 00 04 00 00 00 05 00 41 00 00
    00000030: 01 01 00 42 01
  UrbLink              = 00000000
[701146 ms] UsbSnoop - DispatchAny(f8916610) : IRP_MJ_INTERNAL_DEVICE_CONTROL
[701146 ms] UsbSnoop - MyDispatchInternalIOCTL(f8917e80) : fdo=822eee08, Irp=822d8640, IRQL=2
[701146 ms]  >>>  URB 1090 going down  >>> 
-- URB_FUNCTION_BULK_OR_INTERRUPT_TRANSFER:
  PipeHandle           = 82300f14 [endpoint 0x00000002]
  TransferFlags        = 00000000 (USBD_TRANSFER_DIRECTION_OUT, ~USBD_SHORT_TRANSFER_OK)
  TransferBufferLength = 00000007
  TransferBuffer       = 00000000
  TransferBufferMDL    = 81caa438
    00000000: 00 00 00 02 05 e0 00
  UrbLink              = 00000000
[701146 ms] UsbSnoop - MyInternalIOCTLCompletion(f8917db0) : fido=81b964f0, Irp=822d8640, Context=81cb4e48, IRQL=2
[701146 ms]  <<<  URB 1090 coming back  <<< 
-- URB_FUNCTION_BULK_OR_INTERRUPT_TRANSFER:
  PipeHandle           = 82300f14 [endpoint 0x00000002]
  TransferFlags        = 00000000 (USBD_TRANSFER_DIRECTION_OUT, ~USBD_SHORT_TRANSFER_OK)
  TransferBufferLength = 00000007
  TransferBuffer       = 00000000
  TransferBufferMDL    = 81caa438
  UrbLink              = 00000000
[701156 ms] UsbSnoop - DispatchAny(f8916610) : IRP_MJ_INTERNAL_DEVICE_CONTROL
[701156 ms] UsbSnoop - MyDispatchInternalIOCTL(f8917e80) : fdo=822eee08, Irp=822d8640, IRQL=2
[701156 ms]  >>>  URB 1091 going down  >>> 
-- URB_FUNCTION_BULK_OR_INTERRUPT_TRANSFER:
  PipeHandle           = 82300ef4 [endpoint 0x00000081]
  TransferFlags        = 00000003 (USBD_TRANSFER_DIRECTION_IN, USBD_SHORT_TRANSFER_OK)
  TransferBufferLength = 00000100
  TransferBuffer       = 00000000
  TransferBufferMDL    = 81caa438
  UrbLink              = 00000000
[701156 ms] UsbSnoop - MyInternalIOCTLCompletion(f8917db0) : fido=81b964f0, Irp=822d8640, Context=82304d38, IRQL=2
[701156 ms]  <<<  URB 1091 coming back  <<< 
-- URB_FUNCTION_BULK_OR_INTERRUPT_TRANSFER:
  PipeHandle           = 82300ef4 [endpoint 0x00000081]
  TransferFlags        = 00000003 (USBD_TRANSFER_DIRECTION_IN, USBD_SHORT_TRANSFER_OK)
  TransferBufferLength = 00000005
  TransferBuffer       = 00000000
  TransferBufferMDL    = 81caa438
    00000000: 00 00 00 35 04
  UrbLink              = 00000000
[701186 ms] UsbSnoop - DispatchAny(f8916610) : IRP_MJ_INTERNAL_DEVICE_CONTROL
[701186 ms] UsbSnoop - MyDispatchInternalIOCTL(f8917e80) : fdo=822eee08, Irp=822d8640, IRQL=2
[701186 ms]  >>>  URB 1092 going down  >>> 
-- URB_FUNCTION_BULK_OR_INTERRUPT_TRANSFER:
  PipeHandle           = 82300ef4 [endpoint 0x00000081]
  TransferFlags        = 00000003 (USBD_TRANSFER_DIRECTION_IN, USBD_SHORT_TRANSFER_OK)
  TransferBufferLength = 00000100
  TransferBuffer       = 00000000
  TransferBufferMDL    = 81caa438
  UrbLink              = 00000000
[701186 ms] UsbSnoop - MyInternalIOCTLCompletion(f8917db0) : fido=81b964f0, Irp=822d8640, Context=81b30798, IRQL=2
[701186 ms]  <<<  URB 1092 coming back  <<< 
-- URB_FUNCTION_BULK_OR_INTERRUPT_TRANSFER:
  PipeHandle           = 82300ef4 [endpoint 0x00000081]
  TransferFlags        = 00000003 (USBD_TRANSFER_DIRECTION_IN, USBD_SHORT_TRANSFER_OK)
  TransferBufferLength = 00000035
  TransferBuffer       = 00000000
  TransferBufferMDL    = 81caa438
    00000000: 00 00 00 2f 00 0a 04 6d 61 69 6e 00 01 7a 00 00
    00000010: 06 00 02 00 00 04 f0 04 00 00 00 03 00 00 01 01
    00000020: 00 05 02 00 01 00 00 04 00 00 00 05 00 41 00 00
    00000030: 01 01 00 42 01
  UrbLink              = 00000000
[701216 ms] UsbSnoop - DispatchAny(f8916610) : IRP_MJ_INTERNAL_DEVICE_CONTROL
[701216 ms] UsbSnoop - MyDispatchInternalIOCTL(f8917e80) : fdo=822eee08, Irp=822d8640, IRQL=2
[701216 ms]  >>>  URB 1093 going down  >>> 
-- URB_FUNCTION_BULK_OR_INTERRUPT_TRANSFER:
  PipeHandle           = 82300f14 [endpoint 0x00000002]
  TransferFlags        = 00000000 (USBD_TRANSFER_DIRECTION_OUT, ~USBD_SHORT_TRANSFER_OK)
  TransferBufferLength = 00000007
  TransferBuffer       = 00000000
  TransferBufferMDL    = 81caa438
    00000000: 00 00 00 02 05 e0 00
  UrbLink              = 00000000
[701216 ms] UsbSnoop - MyInternalIOCTLCompletion(f8917db0) : fido=81b964f0, Irp=822d8640, Context=82304d38, IRQL=2
[701216 ms]  <<<  URB 1093 coming back  <<< 
-- URB_FUNCTION_BULK_OR_INTERRUPT_TRANSFER:
  PipeHandle           = 82300f14 [endpoint 0x00000002]
  TransferFlags        = 00000000 (USBD_TRANSFER_DIRECTION_OUT, ~USBD_SHORT_TRANSFER_OK)
  TransferBufferLength = 00000007
  TransferBuffer       = 00000000
  TransferBufferMDL    = 81caa438
  UrbLink              = 00000000
[701226 ms] UsbSnoop - DispatchAny(f8916610) : IRP_MJ_INTERNAL_DEVICE_CONTROL
[701226 ms] UsbSnoop - MyDispatchInternalIOCTL(f8917e80) : fdo=822eee08, Irp=822d8640, IRQL=2
[701226 ms]  >>>  URB 1094 going down  >>> 
-- URB_FUNCTION_BULK_OR_INTERRUPT_TRANSFER:
  PipeHandle           = 82300ef4 [endpoint 0x00000081]
  TransferFlags        = 00000003 (USBD_TRANSFER_DIRECTION_IN, USBD_SHORT_TRANSFER_OK)
  TransferBufferLength = 00000100
  TransferBuffer       = 00000000
  TransferBufferMDL    = 81caa438
  UrbLink              = 00000000
[701226 ms] UsbSnoop - MyInternalIOCTLCompletion(f8917db0) : fido=81b964f0, Irp=822d8640, Context=81b06608, IRQL=2
[701226 ms]  <<<  URB 1094 coming back  <<< 
-- URB_FUNCTION_BULK_OR_INTERRUPT_TRANSFER:
  PipeHandle           = 82300ef4 [endpoint 0x00000081]
  TransferFlags        = 00000003 (USBD_TRANSFER_DIRECTION_IN, USBD_SHORT_TRANSFER_OK)
  TransferBufferLength = 00000005
  TransferBuffer       = 00000000
  TransferBufferMDL    = 81caa438
    00000000: 00 00 00 06 04
  UrbLink              = 00000000
[701256 ms] UsbSnoop - DispatchAny(f8916610) : IRP_MJ_INTERNAL_DEVICE_CONTROL
[701256 ms] UsbSnoop - MyDispatchInternalIOCTL(f8917e80) : fdo=822eee08, Irp=822d8640, IRQL=2
[701256 ms]  >>>  URB 1095 going down  >>> 
-- URB_FUNCTION_BULK_OR_INTERRUPT_TRANSFER:
  PipeHandle           = 82300ef4 [endpoint 0x00000081]
  TransferFlags        = 00000003 (USBD_TRANSFER_DIRECTION_IN, USBD_SHORT_TRANSFER_OK)
  TransferBufferLength = 00000100
  TransferBuffer       = 00000000
  TransferBufferMDL    = 81caa438
  UrbLink              = 00000000
[701256 ms] UsbSnoop - MyInternalIOCTLCompletion(f8917db0) : fido=81b964f0, Irp=822d8640, Context=81abee68, IRQL=2
[701256 ms]  <<<  URB 1095 coming back  <<< 
-- URB_FUNCTION_BULK_OR_INTERRUPT_TRANSFER:
  PipeHandle           = 82300ef4 [endpoint 0x00000081]
  TransferFlags        = 00000003 (USBD_TRANSFER_DIRECTION_IN, USBD_SHORT_TRANSFER_OK)
  TransferBufferLength = 00000006
  TransferBuffer       = 00000000
  TransferBufferMDL    = 81caa438
    00000000: 00 00 00 00 dd 00
  UrbLink              = 00000000
[701286 ms] UsbSnoop - DispatchAny(f8916610) : IRP_MJ_INTERNAL_DEVICE_CONTROL
[701286 ms] UsbSnoop - MyDispatchInternalIOCTL(f8917e80) : fdo=822eee08, Irp=822d8640, IRQL=2
[701286 ms]  >>>  URB 1096 going down  >>> 
-- URB_FUNCTION_BULK_OR_INTERRUPT_TRANSFER:
  PipeHandle           = 82300f14 [endpoint 0x00000002]
  TransferFlags        = 00000000 (USBD_TRANSFER_DIRECTION_OUT, ~USBD_SHORT_TRANSFER_OK)
  TransferBufferLength = 00000007
  TransferBuffer       = 00000000
  TransferBufferMDL    = 81caa438
    00000000: 00 00 00 02 05 e0 00
  UrbLink              = 00000000
[701287 ms] UsbSnoop - MyInternalIOCTLCompletion(f8917db0) : fido=81b964f0, Irp=822d8640, Context=81cb4e48, IRQL=2
[701287 ms]  <<<  URB 1096 coming back  <<< 
-- URB_FUNCTION_BULK_OR_INTERRUPT_TRANSFER:
  PipeHandle           = 82300f14 [endpoint 0x00000002]
  TransferFlags        = 00000000 (USBD_TRANSFER_DIRECTION_OUT, ~USBD_SHORT_TRANSFER_OK)
  TransferBufferLength = 00000007
  TransferBuffer       = 00000000
  TransferBufferMDL    = 81caa438
  UrbLink              = 00000000
[701299 ms] UsbSnoop - DispatchAny(f8916610) : IRP_MJ_INTERNAL_DEVICE_CONTROL
[701299 ms] UsbSnoop - MyDispatchInternalIOCTL(f8917e80) : fdo=822eee08, Irp=81c873d8, IRQL=0
[701299 ms]  >>>  URB 1097 going down  >>> 
-- URB_FUNCTION_RESET_PIPE:
  PipeHandle = 82300ef4 [endpoint 0x00000081]
[701300 ms] UsbSnoop - MyInternalIOCTLCompletion(f8917db0) : fido=00000000, Irp=81c873d8, Context=81b30798, IRQL=0
[701300 ms]  <<<  URB 1097 coming back  <<< 
-- URB_FUNCTION_RESET_PIPE:
[701300 ms] UsbSnoop - DispatchAny(f8916610) : IRP_MJ_INTERNAL_DEVICE_CONTROL
[701300 ms] UsbSnoop - MyDispatchInternalIOCTL(f8917e80) : fdo=822eee08, Irp=81c873d8, IRQL=0
[701300 ms]  >>>  URB 1098 going down  >>> 
-- URB_FUNCTION_RESET_PIPE:
  PipeHandle = 82300f14 [endpoint 0x00000002]
[701300 ms] UsbSnoop - MyInternalIOCTLCompletion(f8917db0) : fido=00000000, Irp=81c873d8, Context=81cb4e48, IRQL=0
[701300 ms]  <<<  URB 1098 coming back  <<< 
-- URB_FUNCTION_RESET_PIPE:
[701300 ms] UsbSnoop - DispatchAny(f8916610) : IRP_MJ_INTERNAL_DEVICE_CONTROL
[701300 ms] UsbSnoop - MyDispatchInternalIOCTL(f8917e80) : fdo=822eee08, Irp=81b1fe48, IRQL=0
