[298024 ms] UsbSnoop - DispatchAny(f88c6610) : IRP_MJ_INTERNAL_DEVICE_CONTROL
[298024 ms] UsbSnoop - MyDispatchInternalIOCTL(f88c7e80) : fdo=82142030, Irp=821726d0, IRQL=0
[298024 ms]  >>>  URB 342 going down  >>> 
-- URB_FUNCTION_RESET_PIPE:
  PipeHandle = 81b44acc [endpoint 0x00000081]
[298024 ms] UsbSnoop - MyInternalIOCTLCompletion(f88c7db0) : fido=00000000, Irp=821726d0, Context=81c1b1a8, IRQL=0
[298024 ms]  <<<  URB 342 coming back  <<< 
-- URB_FUNCTION_RESET_PIPE:
[298024 ms] UsbSnoop - DispatchAny(f88c6610) : IRP_MJ_INTERNAL_DEVICE_CONTROL
[298024 ms] UsbSnoop - MyDispatchInternalIOCTL(f88c7e80) : fdo=82142030, Irp=821726d0, IRQL=0
[298024 ms]  >>>  URB 343 going down  >>> 
-- URB_FUNCTION_RESET_PIPE:
  PipeHandle = 81b44aec [endpoint 0x00000002]
[298025 ms] UsbSnoop - MyInternalIOCTLCompletion(f88c7db0) : fido=00000000, Irp=821726d0, Context=822fc748, IRQL=0
[298025 ms]  <<<  URB 343 coming back  <<< 
-- URB_FUNCTION_RESET_PIPE:
[299025 ms] UsbSnoop - DispatchAny(f88c6610) : IRP_MJ_INTERNAL_DEVICE_CONTROL
[299025 ms] UsbSnoop - MyDispatchInternalIOCTL(f88c7e80) : fdo=82142030, Irp=821726d0, IRQL=0
[299025 ms]  >>>  URB 344 going down  >>> 
-- URB_FUNCTION_RESET_PIPE:
  PipeHandle = 81b44acc [endpoint 0x00000081]
[299026 ms] UsbSnoop - MyInternalIOCTLCompletion(f88c7db0) : fido=00000000, Irp=821726d0, Context=822fc748, IRQL=0
[299026 ms]  <<<  URB 344 coming back  <<< 
-- URB_FUNCTION_RESET_PIPE:
[299026 ms] UsbSnoop - DispatchAny(f88c6610) : IRP_MJ_INTERNAL_DEVICE_CONTROL
[299026 ms] UsbSnoop - MyDispatchInternalIOCTL(f88c7e80) : fdo=82142030, Irp=821726d0, IRQL=0
[299026 ms]  >>>  URB 345 going down  >>> 
-- URB_FUNCTION_RESET_PIPE:
  PipeHandle = 81b44aec [endpoint 0x00000002]
[299026 ms] UsbSnoop - MyInternalIOCTLCompletion(f88c7db0) : fido=00000000, Irp=821726d0, Context=822fc748, IRQL=0
[299026 ms]  <<<  URB 345 coming back  <<< 
-- URB_FUNCTION_RESET_PIPE:
[299026 ms] UsbSnoop - DispatchAny(f88c6610) : IRP_MJ_INTERNAL_DEVICE_CONTROL
[299026 ms] UsbSnoop - MyDispatchInternalIOCTL(f88c7e80) : fdo=82142030, Irp=81b5d388, IRQL=0
[300027 ms] UsbSnoop - IRP_MJ_POWER (IRP_MN_WAIT_WAKE)
[300027 ms] UsbSnoop - DispatchAny(f88c6610) : IRP_MJ_INTERNAL_DEVICE_CONTROL
[300027 ms] UsbSnoop - MyDispatchInternalIOCTL(f88c7e80) : fdo=82142030, Irp=81c33ae0, IRQL=0
[300027 ms]  >>>  URB 346 going down  >>> 
-- URB_FUNCTION_GET_DESCRIPTOR_FROM_DEVICE:
  TransferBufferLength = 00000012
  TransferBuffer       = e2709510
  TransferBufferMDL    = 00000000
  Index                = 00000000
  DescriptorType       = 00000001 (USB_DEVICE_DESCRIPTOR_TYPE)
  LanguageId           = 00000000
[300028 ms] UsbSnoop - MyInternalIOCTLCompletion(f88c7db0) : fido=00000000, Irp=81c33ae0, Context=822fc748, IRQL=2
[300028 ms]  <<<  URB 346 coming back  <<< 
-- URB_FUNCTION_CONTROL_TRANSFER:
  PipeHandle           = 822b9630
  TransferFlags        = 81b5d38b (USBD_TRANSFER_DIRECTION_IN, USBD_SHORT_TRANSFER_OK)
  TransferBufferLength = 00000012
  TransferBuffer       = e2709510
  TransferBufferMDL    = 81cc56a8
    00000000: 12 01 00 02 00 00 00 40 51 04 04 e0 00 03 01 02
    00000010: 00 01
  UrbLink              = 00000000
  SetupPacket          =
    00000000: 80 06 00 01 00 00 12 00
[300028 ms] UsbSnoop - DispatchAny(f88c6610) : IRP_MJ_INTERNAL_DEVICE_CONTROL
[300028 ms] UsbSnoop - MyDispatchInternalIOCTL(f88c7e80) : fdo=82142030, Irp=81b5d388, IRQL=0
[300028 ms] UsbSnoop - IRP_MJ_POWER (IRP_MN_WAIT_WAKE)
[300028 ms] UsbSnoop - DispatchAny(f88c6610) : IRP_MJ_INTERNAL_DEVICE_CONTROL
[300028 ms] UsbSnoop - MyDispatchInternalIOCTL(f88c7e80) : fdo=82142030, Irp=81b5d388, IRQL=0
[300028 ms]  >>>  URB 347 going down  >>> 
-- URB_FUNCTION_RESET_PIPE:
  PipeHandle = 81b44acc [endpoint 0x00000081]
[300028 ms] UsbSnoop - MyInternalIOCTLCompletion(f88c7db0) : fido=00000000, Irp=81b5d388, Context=82300de8, IRQL=0
[300028 ms]  <<<  URB 347 coming back  <<< 
-- URB_FUNCTION_RESET_PIPE:
[300028 ms] UsbSnoop - DispatchAny(f88c6610) : IRP_MJ_INTERNAL_DEVICE_CONTROL
[300028 ms] UsbSnoop - MyDispatchInternalIOCTL(f88c7e80) : fdo=82142030, Irp=81b5d388, IRQL=0
[300028 ms]  >>>  URB 348 going down  >>> 
-- URB_FUNCTION_RESET_PIPE:
  PipeHandle = 81b44aec [endpoint 0x00000002]
[300029 ms] UsbSnoop - MyInternalIOCTLCompletion(f88c7db0) : fido=00000000, Irp=81b5d388, Context=81c1afe8, IRQL=0
[300029 ms]  <<<  URB 348 coming back  <<< 
-- URB_FUNCTION_RESET_PIPE:
[301299 ms] UsbSnoop - DispatchAny(f88c6610) : IRP_MJ_INTERNAL_DEVICE_CONTROL
[301299 ms] UsbSnoop - MyDispatchInternalIOCTL(f88c7e80) : fdo=82142030, Irp=81b4e870, IRQL=2
[301299 ms]  >>>  URB 349 going down  >>> 
-- URB_FUNCTION_BULK_OR_INTERRUPT_TRANSFER:
  PipeHandle           = 81b44aec [endpoint 0x00000002]
  TransferFlags        = 00000000 (USBD_TRANSFER_DIRECTION_OUT, ~USBD_SHORT_TRANSFER_OK)
  TransferBufferLength = 00000009
  TransferBuffer       = 00000000
  TransferBufferMDL    = 81cc56a8
    00000000: 00 00 00 04 01 00 00 04 00
  UrbLink              = 00000000
[301299 ms] UsbSnoop - MyInternalIOCTLCompletion(f88c7db0) : fido=823a0430, Irp=81b4e870, Context=81c1ca60, IRQL=2
[301299 ms]  <<<  URB 349 coming back  <<< 
-- URB_FUNCTION_BULK_OR_INTERRUPT_TRANSFER:
  PipeHandle           = 81b44aec [endpoint 0x00000002]
  TransferFlags        = 00000000 (USBD_TRANSFER_DIRECTION_OUT, ~USBD_SHORT_TRANSFER_OK)
  TransferBufferLength = 00000009
  TransferBuffer       = 00000000
  TransferBufferMDL    = 81cc56a8
  UrbLink              = 00000000
[301300 ms] UsbSnoop - DispatchAny(f88c6610) : IRP_MJ_INTERNAL_DEVICE_CONTROL
[301300 ms] UsbSnoop - MyDispatchInternalIOCTL(f88c7e80) : fdo=82142030, Irp=81b4e870, IRQL=2
[301300 ms]  >>>  URB 350 going down  >>> 
-- URB_FUNCTION_BULK_OR_INTERRUPT_TRANSFER:
  PipeHandle           = 81b44acc [endpoint 0x00000081]
  TransferFlags        = 00000003 (USBD_TRANSFER_DIRECTION_IN, USBD_SHORT_TRANSFER_OK)
  TransferBufferLength = 00000100
  TransferBuffer       = 00000000
  TransferBufferMDL    = 81cc56a8
  UrbLink              = 00000000
[301301 ms] UsbSnoop - MyInternalIOCTLCompletion(f88c7db0) : fido=823a0430, Irp=81b4e870, Context=81acd8e0, IRQL=2
[301301 ms]  <<<  URB 350 coming back  <<< 
-- URB_FUNCTION_BULK_OR_INTERRUPT_TRANSFER:
  PipeHandle           = 81b44acc [endpoint 0x00000081]
  TransferFlags        = 00000003 (USBD_TRANSFER_DIRECTION_IN, USBD_SHORT_TRANSFER_OK)
  TransferBufferLength = 00000009
  TransferBuffer       = 00000000
  TransferBufferMDL    = 81cc56a8
    00000000: 00 00 00 04 02 00 00 03 ff
  UrbLink              = 00000000
[301329 ms] UsbSnoop - DispatchAny(f88c6610) : IRP_MJ_INTERNAL_DEVICE_CONTROL
[301329 ms] UsbSnoop - MyDispatchInternalIOCTL(f88c7e80) : fdo=82142030, Irp=81b4e870, IRQL=2
[301329 ms]  >>>  URB 351 going down  >>> 
-- URB_FUNCTION_BULK_OR_INTERRUPT_TRANSFER:
  PipeHandle           = 81b44aec [endpoint 0x00000002]
  TransferFlags        = 00000000 (USBD_TRANSFER_DIRECTION_OUT, ~USBD_SHORT_TRANSFER_OK)
  TransferBufferLength = 00000015
  TransferBuffer       = 00000000
  TransferBufferMDL    = 81cc56a8
    00000000: 00 00 00 10 04 00 00 00 0a 00 01 00 03 00 01 00
    00000010: 00 00 00 07 d0
  UrbLink              = 00000000
[301329 ms] UsbSnoop - MyInternalIOCTLCompletion(f88c7db0) : fido=823a0430, Irp=81b4e870, Context=81af3568, IRQL=2
[301329 ms]  <<<  URB 351 coming back  <<< 
-- URB_FUNCTION_BULK_OR_INTERRUPT_TRANSFER:
  PipeHandle           = 81b44aec [endpoint 0x00000002]
  TransferFlags        = 00000000 (USBD_TRANSFER_DIRECTION_OUT, ~USBD_SHORT_TRANSFER_OK)
  TransferBufferLength = 00000015
  TransferBuffer       = 00000000
  TransferBufferMDL    = 81cc56a8
  UrbLink              = 00000000
[301339 ms] UsbSnoop - DispatchAny(f88c6610) : IRP_MJ_INTERNAL_DEVICE_CONTROL
[301339 ms] UsbSnoop - MyDispatchInternalIOCTL(f88c7e80) : fdo=82142030, Irp=81b4e870, IRQL=2
[301339 ms]  >>>  URB 352 going down  >>> 
-- URB_FUNCTION_BULK_OR_INTERRUPT_TRANSFER:
  PipeHandle           = 81b44acc [endpoint 0x00000081]
  TransferFlags        = 00000003 (USBD_TRANSFER_DIRECTION_IN, USBD_SHORT_TRANSFER_OK)
  TransferBufferLength = 00000100
  TransferBuffer       = 00000000
  TransferBufferMDL    = 81cc56a8
  UrbLink              = 00000000
[301339 ms] UsbSnoop - MyInternalIOCTLCompletion(f88c7db0) : fido=823a0430, Irp=81b4e870, Context=81acd8e0, IRQL=2
[301339 ms]  <<<  URB 352 coming back  <<< 
-- URB_FUNCTION_BULK_OR_INTERRUPT_TRANSFER:
  PipeHandle           = 81b44acc [endpoint 0x00000081]
  TransferFlags        = 00000003 (USBD_TRANSFER_DIRECTION_IN, USBD_SHORT_TRANSFER_OK)
  TransferBufferLength = 00000007
  TransferBuffer       = 00000000
  TransferBufferMDL    = 81cc56a8
    00000000: 00 00 00 02 05 e0 00
  UrbLink              = 00000000
[301379 ms] UsbSnoop - DispatchAny(f88c6610) : IRP_MJ_INTERNAL_DEVICE_CONTROL
[301379 ms] UsbSnoop - MyDispatchInternalIOCTL(f88c7e80) : fdo=82142030, Irp=81b4e870, IRQL=2
[301379 ms]  >>>  URB 353 going down  >>> 
-- URB_FUNCTION_BULK_OR_INTERRUPT_TRANSFER:
  PipeHandle           = 81b44acc [endpoint 0x00000081]
  TransferFlags        = 00000003 (USBD_TRANSFER_DIRECTION_IN, USBD_SHORT_TRANSFER_OK)
  TransferBufferLength = 00000100
  TransferBuffer       = 00000000
  TransferBufferMDL    = 81cc56a8
  UrbLink              = 00000000
[301379 ms] UsbSnoop - MyInternalIOCTLCompletion(f88c7db0) : fido=823a0430, Irp=81b4e870, Context=81c03a00, IRQL=2
[301379 ms]  <<<  URB 353 coming back  <<< 
-- URB_FUNCTION_BULK_OR_INTERRUPT_TRANSFER:
  PipeHandle           = 81b44acc [endpoint 0x00000081]
  TransferFlags        = 00000003 (USBD_TRANSFER_DIRECTION_IN, USBD_SHORT_TRANSFER_OK)
  TransferBufferLength = 00000005
  TransferBuffer       = 00000000
  TransferBufferMDL    = 81cc56a8
    00000000: 00 00 00 0a 04
  UrbLink              = 00000000
[301409 ms] UsbSnoop - DispatchAny(f88c6610) : IRP_MJ_INTERNAL_DEVICE_CONTROL
[301409 ms] UsbSnoop - MyDispatchInternalIOCTL(f88c7e80) : fdo=82142030, Irp=81b4e870, IRQL=2
[301409 ms]  >>>  URB 354 going down  >>> 
-- URB_FUNCTION_BULK_OR_INTERRUPT_TRANSFER:
  PipeHandle           = 81b44acc [endpoint 0x00000081]
  TransferFlags        = 00000003 (USBD_TRANSFER_DIRECTION_IN, USBD_SHORT_TRANSFER_OK)
  TransferBufferLength = 00000100
  TransferBuffer       = 00000000
  TransferBufferMDL    = 81cc56a8
  UrbLink              = 00000000
[301409 ms] UsbSnoop - MyInternalIOCTLCompletion(f88c7db0) : fido=823a0430, Irp=81b4e870, Context=81adbf80, IRQL=2
[301409 ms]  <<<  URB 354 coming back  <<< 
-- URB_FUNCTION_BULK_OR_INTERRUPT_TRANSFER:
  PipeHandle           = 81b44acc [endpoint 0x00000081]
  TransferFlags        = 00000003 (USBD_TRANSFER_DIRECTION_IN, USBD_SHORT_TRANSFER_OK)
  TransferBufferLength = 0000000a
  TransferBuffer       = 00000000
  TransferBufferMDL    = 81cc56a8
    00000000: 00 00 00 04 00 12 00 00 07 d0
  UrbLink              = 00000000
[301439 ms] UsbSnoop - DispatchAny(f88c6610) : IRP_MJ_INTERNAL_DEVICE_CONTROL
[301439 ms] UsbSnoop - MyDispatchInternalIOCTL(f88c7e80) : fdo=82142030, Irp=81b4e870, IRQL=2
[301439 ms]  >>>  URB 355 going down  >>> 
-- URB_FUNCTION_BULK_OR_INTERRUPT_TRANSFER:
  PipeHandle           = 81b44aec [endpoint 0x00000002]
  TransferFlags        = 00000000 (USBD_TRANSFER_DIRECTION_OUT, ~USBD_SHORT_TRANSFER_OK)
  TransferBufferLength = 00000007
  TransferBuffer       = 00000000
  TransferBufferMDL    = 81cc56a8
    00000000: 00 00 00 02 05 e0 00
  UrbLink              = 00000000
[301439 ms] UsbSnoop - MyInternalIOCTLCompletion(f88c7db0) : fido=823a0430, Irp=81b4e870, Context=81ad07d0, IRQL=2
[301439 ms]  <<<  URB 355 coming back  <<< 
-- URB_FUNCTION_BULK_OR_INTERRUPT_TRANSFER:
  PipeHandle           = 81b44aec [endpoint 0x00000002]
  TransferFlags        = 00000000 (USBD_TRANSFER_DIRECTION_OUT, ~USBD_SHORT_TRANSFER_OK)
  TransferBufferLength = 00000007
  TransferBuffer       = 00000000
  TransferBufferMDL    = 81cc56a8
  UrbLink              = 00000000
[301449 ms] UsbSnoop - DispatchAny(f88c6610) : IRP_MJ_INTERNAL_DEVICE_CONTROL
[301449 ms] UsbSnoop - MyDispatchInternalIOCTL(f88c7e80) : fdo=82142030, Irp=81b4e870, IRQL=2
[301449 ms]  >>>  URB 356 going down  >>> 
-- URB_FUNCTION_BULK_OR_INTERRUPT_TRANSFER:
  PipeHandle           = 81b44aec [endpoint 0x00000002]
  TransferFlags        = 00000000 (USBD_TRANSFER_DIRECTION_OUT, ~USBD_SHORT_TRANSFER_OK)
  TransferBufferLength = 00000010
  TransferBuffer       = 00000000
  TransferBufferMDL    = 81cc56a8
    00000000: 00 00 00 0b 04 00 00 00 05 00 0e 00 37 00 01 01
  UrbLink              = 00000000
[301449 ms] UsbSnoop - MyInternalIOCTLCompletion(f88c7db0) : fido=823a0430, Irp=81b4e870, Context=81af3568, IRQL=2
[301449 ms]  <<<  URB 356 coming back  <<< 
-- URB_FUNCTION_BULK_OR_INTERRUPT_TRANSFER:
  PipeHandle           = 81b44aec [endpoint 0x00000002]
  TransferFlags        = 00000000 (USBD_TRANSFER_DIRECTION_OUT, ~USBD_SHORT_TRANSFER_OK)
  TransferBufferLength = 00000010
  TransferBuffer       = 00000000
  TransferBufferMDL    = 81cc56a8
  UrbLink              = 00000000
[301459 ms] UsbSnoop - DispatchAny(f88c6610) : IRP_MJ_INTERNAL_DEVICE_CONTROL
[301459 ms] UsbSnoop - MyDispatchInternalIOCTL(f88c7e80) : fdo=82142030, Irp=81b4e870, IRQL=2
[301459 ms]  >>>  URB 357 going down  >>> 
-- URB_FUNCTION_BULK_OR_INTERRUPT_TRANSFER:
  PipeHandle           = 81b44acc [endpoint 0x00000081]
  TransferFlags        = 00000003 (USBD_TRANSFER_DIRECTION_IN, USBD_SHORT_TRANSFER_OK)
  TransferBufferLength = 00000100
  TransferBuffer       = 00000000
  TransferBufferMDL    = 81cc56a8
  UrbLink              = 00000000
[301459 ms] UsbSnoop - MyInternalIOCTLCompletion(f88c7db0) : fido=823a0430, Irp=81b4e870, Context=81acd8e0, IRQL=2
[301459 ms]  <<<  URB 357 coming back  <<< 
-- URB_FUNCTION_BULK_OR_INTERRUPT_TRANSFER:
  PipeHandle           = 81b44acc [endpoint 0x00000081]
  TransferFlags        = 00000003 (USBD_TRANSFER_DIRECTION_IN, USBD_SHORT_TRANSFER_OK)
  TransferBufferLength = 00000007
  TransferBuffer       = 00000000
  TransferBufferMDL    = 81cc56a8
    00000000: 00 00 00 02 05 e0 00
  UrbLink              = 00000000
[301499 ms] UsbSnoop - DispatchAny(f88c6610) : IRP_MJ_INTERNAL_DEVICE_CONTROL
[301499 ms] UsbSnoop - MyDispatchInternalIOCTL(f88c7e80) : fdo=82142030, Irp=81b4e870, IRQL=2
[301499 ms]  >>>  URB 358 going down  >>> 
-- URB_FUNCTION_BULK_OR_INTERRUPT_TRANSFER:
  PipeHandle           = 81b44acc [endpoint 0x00000081]
  TransferFlags        = 00000003 (USBD_TRANSFER_DIRECTION_IN, USBD_SHORT_TRANSFER_OK)
  TransferBufferLength = 00000100
  TransferBuffer       = 00000000
  TransferBufferMDL    = 81cc56a8
  UrbLink              = 00000000
[301500 ms] UsbSnoop - MyInternalIOCTLCompletion(f88c7db0) : fido=823a0430, Irp=81b4e870, Context=81c03a00, IRQL=2
[301500 ms]  <<<  URB 358 coming back  <<< 
-- URB_FUNCTION_BULK_OR_INTERRUPT_TRANSFER:
  PipeHandle           = 81b44acc [endpoint 0x00000081]
  TransferFlags        = 00000003 (USBD_TRANSFER_DIRECTION_IN, USBD_SHORT_TRANSFER_OK)
  TransferBufferLength = 00000005
  TransferBuffer       = 00000000
  TransferBufferMDL    = 81cc56a8
    00000000: 00 00 00 07 04
  UrbLink              = 00000000
[301529 ms] UsbSnoop - DispatchAny(f88c6610) : IRP_MJ_INTERNAL_DEVICE_CONTROL
[301529 ms] UsbSnoop - MyDispatchInternalIOCTL(f88c7e80) : fdo=82142030, Irp=81b4e870, IRQL=2
[301529 ms]  >>>  URB 359 going down  >>> 
-- URB_FUNCTION_BULK_OR_INTERRUPT_TRANSFER:
  PipeHandle           = 81b44acc [endpoint 0x00000081]
  TransferFlags        = 00000003 (USBD_TRANSFER_DIRECTION_IN, USBD_SHORT_TRANSFER_OK)
  TransferBufferLength = 00000100
  TransferBuffer       = 00000000
  TransferBufferMDL    = 81cc56a8
  UrbLink              = 00000000
[301530 ms] UsbSnoop - MyInternalIOCTLCompletion(f88c7db0) : fido=823a0430, Irp=81b4e870, Context=81af3568, IRQL=2
[301530 ms]  <<<  URB 359 coming back  <<< 
-- URB_FUNCTION_BULK_OR_INTERRUPT_TRANSFER:
  PipeHandle           = 81b44acc [endpoint 0x00000081]
  TransferFlags        = 00000003 (USBD_TRANSFER_DIRECTION_IN, USBD_SHORT_TRANSFER_OK)
  TransferBufferLength = 00000007
  TransferBuffer       = 00000000
  TransferBufferMDL    = 81cc56a8
    00000000: 00 00 00 01 aa 00 01
  UrbLink              = 00000000
[301559 ms] UsbSnoop - DispatchAny(f88c6610) : IRP_MJ_INTERNAL_DEVICE_CONTROL
[301559 ms] UsbSnoop - MyDispatchInternalIOCTL(f88c7e80) : fdo=82142030, Irp=81b4e870, IRQL=2
[301559 ms]  >>>  URB 360 going down  >>> 
-- URB_FUNCTION_BULK_OR_INTERRUPT_TRANSFER:
  PipeHandle           = 81b44aec [endpoint 0x00000002]
  TransferFlags        = 00000000 (USBD_TRANSFER_DIRECTION_OUT, ~USBD_SHORT_TRANSFER_OK)
  TransferBufferLength = 00000007
  TransferBuffer       = 00000000
  TransferBufferMDL    = 81cc56a8
    00000000: 00 00 00 02 05 e0 00
  UrbLink              = 00000000
[301560 ms] UsbSnoop - MyInternalIOCTLCompletion(f88c7db0) : fido=823a0430, Irp=81b4e870, Context=81acd8e0, IRQL=2
[301560 ms]  <<<  URB 360 coming back  <<< 
-- URB_FUNCTION_BULK_OR_INTERRUPT_TRANSFER:
  PipeHandle           = 81b44aec [endpoint 0x00000002]
  TransferFlags        = 00000000 (USBD_TRANSFER_DIRECTION_OUT, ~USBD_SHORT_TRANSFER_OK)
  TransferBufferLength = 00000007
  TransferBuffer       = 00000000
  TransferBufferMDL    = 81cc56a8
  UrbLink              = 00000000
[301820 ms] UsbSnoop - DispatchAny(f88c6610) : IRP_MJ_INTERNAL_DEVICE_CONTROL
[301820 ms] UsbSnoop - MyDispatchInternalIOCTL(f88c7e80) : fdo=82142030, Irp=81b4e870, IRQL=2
[301820 ms]  >>>  URB 361 going down  >>> 
-- URB_FUNCTION_BULK_OR_INTERRUPT_TRANSFER:
  PipeHandle           = 81b44aec [endpoint 0x00000002]
  TransferFlags        = 00000000 (USBD_TRANSFER_DIRECTION_OUT, ~USBD_SHORT_TRANSFER_OK)
  TransferBufferLength = 00000009
  TransferBuffer       = 00000000
  TransferBufferMDL    = 81cc56a8
    00000000: 00 00 00 04 01 00 00 04 00
  UrbLink              = 00000000
[301820 ms] UsbSnoop - MyInternalIOCTLCompletion(f88c7db0) : fido=823a0430, Irp=81b4e870, Context=81af3568, IRQL=2
[301820 ms]  <<<  URB 361 coming back  <<< 
-- URB_FUNCTION_BULK_OR_INTERRUPT_TRANSFER:
  PipeHandle           = 81b44aec [endpoint 0x00000002]
  TransferFlags        = 00000000 (USBD_TRANSFER_DIRECTION_OUT, ~USBD_SHORT_TRANSFER_OK)
  TransferBufferLength = 00000009
  TransferBuffer       = 00000000
  TransferBufferMDL    = 81cc56a8
  UrbLink              = 00000000
[301820 ms] UsbSnoop - DispatchAny(f88c6610) : IRP_MJ_INTERNAL_DEVICE_CONTROL
[301820 ms] UsbSnoop - MyDispatchInternalIOCTL(f88c7e80) : fdo=82142030, Irp=81b4e870, IRQL=2
[301820 ms]  >>>  URB 362 going down  >>> 
-- URB_FUNCTION_BULK_OR_INTERRUPT_TRANSFER:
  PipeHandle           = 81b44acc [endpoint 0x00000081]
  TransferFlags        = 00000003 (USBD_TRANSFER_DIRECTION_IN, USBD_SHORT_TRANSFER_OK)
  TransferBufferLength = 00000100
  TransferBuffer       = 00000000
  TransferBufferMDL    = 81cc56a8
  UrbLink              = 00000000
[301952 ms] UsbSnoop - MyInternalIOCTLCompletion(f88c7db0) : fido=823a0430, Irp=81b4e870, Context=81ad5658, IRQL=2
[301952 ms]  <<<  URB 362 coming back  <<< 
-- URB_FUNCTION_BULK_OR_INTERRUPT_TRANSFER:
  PipeHandle           = 81b44acc [endpoint 0x00000081]
  TransferFlags        = 00000003 (USBD_TRANSFER_DIRECTION_IN, USBD_SHORT_TRANSFER_OK)
  TransferBufferLength = 00000009
  TransferBuffer       = 00000000
  TransferBufferMDL    = 81cc56a8
    00000000: 00 00 00 04 02 00 00 03 ff
  UrbLink              = 00000000
[301980 ms] UsbSnoop - DispatchAny(f88c6610) : IRP_MJ_INTERNAL_DEVICE_CONTROL
[301980 ms] UsbSnoop - MyDispatchInternalIOCTL(f88c7e80) : fdo=82142030, Irp=81b4e870, IRQL=2
[301980 ms]  >>>  URB 363 going down  >>> 
-- URB_FUNCTION_BULK_OR_INTERRUPT_TRANSFER:
  PipeHandle           = 81b44aec [endpoint 0x00000002]
  TransferFlags        = 00000000 (USBD_TRANSFER_DIRECTION_OUT, ~USBD_SHORT_TRANSFER_OK)
  TransferBufferLength = 00000015
  TransferBuffer       = 00000000
  TransferBufferMDL    = 81cc56a8
    00000000: 00 00 00 10 04 00 00 00 0a 00 01 00 03 00 01 00
    00000010: 00 00 00 07 d0
  UrbLink              = 00000000
[301980 ms] UsbSnoop - MyInternalIOCTLCompletion(f88c7db0) : fido=823a0430, Irp=81b4e870, Context=81c03a00, IRQL=2
[301980 ms]  <<<  URB 363 coming back  <<< 
-- URB_FUNCTION_BULK_OR_INTERRUPT_TRANSFER:
  PipeHandle           = 81b44aec [endpoint 0x00000002]
  TransferFlags        = 00000000 (USBD_TRANSFER_DIRECTION_OUT, ~USBD_SHORT_TRANSFER_OK)
  TransferBufferLength = 00000015
  TransferBuffer       = 00000000
  TransferBufferMDL    = 81cc56a8
  UrbLink              = 00000000
[301990 ms] UsbSnoop - DispatchAny(f88c6610) : IRP_MJ_INTERNAL_DEVICE_CONTROL
[301990 ms] UsbSnoop - MyDispatchInternalIOCTL(f88c7e80) : fdo=82142030, Irp=81b4e870, IRQL=2
[301990 ms]  >>>  URB 364 going down  >>> 
-- URB_FUNCTION_BULK_OR_INTERRUPT_TRANSFER:
  PipeHandle           = 81b44acc [endpoint 0x00000081]
  TransferFlags        = 00000003 (USBD_TRANSFER_DIRECTION_IN, USBD_SHORT_TRANSFER_OK)
  TransferBufferLength = 00000100
  TransferBuffer       = 00000000
  TransferBufferMDL    = 81cc56a8
  UrbLink              = 00000000
[301990 ms] UsbSnoop - MyInternalIOCTLCompletion(f88c7db0) : fido=823a0430, Irp=81b4e870, Context=81ad5658, IRQL=2
[301990 ms]  <<<  URB 364 coming back  <<< 
-- URB_FUNCTION_BULK_OR_INTERRUPT_TRANSFER:
  PipeHandle           = 81b44acc [endpoint 0x00000081]
  TransferFlags        = 00000003 (USBD_TRANSFER_DIRECTION_IN, USBD_SHORT_TRANSFER_OK)
  TransferBufferLength = 00000007
  TransferBuffer       = 00000000
  TransferBufferMDL    = 81cc56a8
    00000000: 00 00 00 02 05 e0 00
  UrbLink              = 00000000
[302030 ms] UsbSnoop - DispatchAny(f88c6610) : IRP_MJ_INTERNAL_DEVICE_CONTROL
[302030 ms] UsbSnoop - MyDispatchInternalIOCTL(f88c7e80) : fdo=82142030, Irp=81b4e870, IRQL=2
[302030 ms]  >>>  URB 365 going down  >>> 
-- URB_FUNCTION_BULK_OR_INTERRUPT_TRANSFER:
  PipeHandle           = 81b44acc [endpoint 0x00000081]
  TransferFlags        = 00000003 (USBD_TRANSFER_DIRECTION_IN, USBD_SHORT_TRANSFER_OK)
  TransferBufferLength = 00000100
  TransferBuffer       = 00000000
  TransferBufferMDL    = 81cc56a8
  UrbLink              = 00000000
[302030 ms] UsbSnoop - MyInternalIOCTLCompletion(f88c7db0) : fido=823a0430, Irp=81b4e870, Context=81adbf80, IRQL=2
[302030 ms]  <<<  URB 365 coming back  <<< 
-- URB_FUNCTION_BULK_OR_INTERRUPT_TRANSFER:
  PipeHandle           = 81b44acc [endpoint 0x00000081]
  TransferFlags        = 00000003 (USBD_TRANSFER_DIRECTION_IN, USBD_SHORT_TRANSFER_OK)
  TransferBufferLength = 00000005
  TransferBuffer       = 00000000
  TransferBufferMDL    = 81cc56a8
    00000000: 00 00 00 0a 04
  UrbLink              = 00000000
[302060 ms] UsbSnoop - DispatchAny(f88c6610) : IRP_MJ_INTERNAL_DEVICE_CONTROL
[302060 ms] UsbSnoop - MyDispatchInternalIOCTL(f88c7e80) : fdo=82142030, Irp=81b4e870, IRQL=2
[302060 ms]  >>>  URB 366 going down  >>> 
-- URB_FUNCTION_BULK_OR_INTERRUPT_TRANSFER:
  PipeHandle           = 81b44acc [endpoint 0x00000081]
  TransferFlags        = 00000003 (USBD_TRANSFER_DIRECTION_IN, USBD_SHORT_TRANSFER_OK)
  TransferBufferLength = 00000100
  TransferBuffer       = 00000000
  TransferBufferMDL    = 81cc56a8
  UrbLink              = 00000000
[302060 ms] UsbSnoop - MyInternalIOCTLCompletion(f88c7db0) : fido=823a0430, Irp=81b4e870, Context=81ad5658, IRQL=2
[302060 ms]  <<<  URB 366 coming back  <<< 
-- URB_FUNCTION_BULK_OR_INTERRUPT_TRANSFER:
  PipeHandle           = 81b44acc [endpoint 0x00000081]
  TransferFlags        = 00000003 (USBD_TRANSFER_DIRECTION_IN, USBD_SHORT_TRANSFER_OK)
  TransferBufferLength = 0000000a
  TransferBuffer       = 00000000
  TransferBufferMDL    = 81cc56a8
    00000000: 00 00 00 04 00 12 00 00 07 d0
  UrbLink              = 00000000
[302090 ms] UsbSnoop - DispatchAny(f88c6610) : IRP_MJ_INTERNAL_DEVICE_CONTROL
[302090 ms] UsbSnoop - MyDispatchInternalIOCTL(f88c7e80) : fdo=82142030, Irp=81b4e870, IRQL=2
[302090 ms]  >>>  URB 367 going down  >>> 
-- URB_FUNCTION_BULK_OR_INTERRUPT_TRANSFER:
  PipeHandle           = 81b44aec [endpoint 0x00000002]
  TransferFlags        = 00000000 (USBD_TRANSFER_DIRECTION_OUT, ~USBD_SHORT_TRANSFER_OK)
  TransferBufferLength = 00000007
  TransferBuffer       = 00000000
  TransferBufferMDL    = 81cc56a8
    00000000: 00 00 00 02 05 e0 00
  UrbLink              = 00000000
[302090 ms] UsbSnoop - MyInternalIOCTLCompletion(f88c7db0) : fido=823a0430, Irp=81b4e870, Context=81af3568, IRQL=2
[302090 ms]  <<<  URB 367 coming back  <<< 
-- URB_FUNCTION_BULK_OR_INTERRUPT_TRANSFER:
  PipeHandle           = 81b44aec [endpoint 0x00000002]
  TransferFlags        = 00000000 (USBD_TRANSFER_DIRECTION_OUT, ~USBD_SHORT_TRANSFER_OK)
  TransferBufferLength = 00000007
  TransferBuffer       = 00000000
  TransferBufferMDL    = 81cc56a8
  UrbLink              = 00000000
[302100 ms] UsbSnoop - DispatchAny(f88c6610) : IRP_MJ_INTERNAL_DEVICE_CONTROL
[302100 ms] UsbSnoop - MyDispatchInternalIOCTL(f88c7e80) : fdo=82142030, Irp=81b4e870, IRQL=2
[302100 ms]  >>>  URB 368 going down  >>> 
-- URB_FUNCTION_BULK_OR_INTERRUPT_TRANSFER:
  PipeHandle           = 81b44aec [endpoint 0x00000002]
  TransferFlags        = 00000000 (USBD_TRANSFER_DIRECTION_OUT, ~USBD_SHORT_TRANSFER_OK)
  TransferBufferLength = 0000000f
  TransferBuffer       = 00000000
  TransferBufferMDL    = 81cc56a8
    00000000: 00 00 00 0a 04 00 00 00 04 00 07 00 01 00 05
  UrbLink              = 00000000
[302100 ms] UsbSnoop - MyInternalIOCTLCompletion(f88c7db0) : fido=823a0430, Irp=81b4e870, Context=81acd8e0, IRQL=2
[302100 ms]  <<<  URB 368 coming back  <<< 
-- URB_FUNCTION_BULK_OR_INTERRUPT_TRANSFER:
  PipeHandle           = 81b44aec [endpoint 0x00000002]
  TransferFlags        = 00000000 (USBD_TRANSFER_DIRECTION_OUT, ~USBD_SHORT_TRANSFER_OK)
  TransferBufferLength = 0000000f
  TransferBuffer       = 00000000
  TransferBufferMDL    = 81cc56a8
  UrbLink              = 00000000
[302110 ms] UsbSnoop - DispatchAny(f88c6610) : IRP_MJ_INTERNAL_DEVICE_CONTROL
[302110 ms] UsbSnoop - MyDispatchInternalIOCTL(f88c7e80) : fdo=82142030, Irp=81b4e870, IRQL=2
[302110 ms]  >>>  URB 369 going down  >>> 
-- URB_FUNCTION_BULK_OR_INTERRUPT_TRANSFER:
  PipeHandle           = 81b44acc [endpoint 0x00000081]
  TransferFlags        = 00000003 (USBD_TRANSFER_DIRECTION_IN, USBD_SHORT_TRANSFER_OK)
  TransferBufferLength = 00000100
  TransferBuffer       = 00000000
  TransferBufferMDL    = 81cc56a8
  UrbLink              = 00000000
[302110 ms] UsbSnoop - MyInternalIOCTLCompletion(f88c7db0) : fido=823a0430, Irp=81b4e870, Context=81c03a00, IRQL=2
[302111 ms]  <<<  URB 369 coming back  <<< 
-- URB_FUNCTION_BULK_OR_INTERRUPT_TRANSFER:
  PipeHandle           = 81b44acc [endpoint 0x00000081]
  TransferFlags        = 00000003 (USBD_TRANSFER_DIRECTION_IN, USBD_SHORT_TRANSFER_OK)
  TransferBufferLength = 00000007
  TransferBuffer       = 00000000
  TransferBufferMDL    = 81cc56a8
    00000000: 00 00 00 02 05 e0 00
  UrbLink              = 00000000
[302150 ms] UsbSnoop - DispatchAny(f88c6610) : IRP_MJ_INTERNAL_DEVICE_CONTROL
[302150 ms] UsbSnoop - MyDispatchInternalIOCTL(f88c7e80) : fdo=82142030, Irp=81b4e870, IRQL=2
[302150 ms]  >>>  URB 370 going down  >>> 
-- URB_FUNCTION_BULK_OR_INTERRUPT_TRANSFER:
  PipeHandle           = 81b44acc [endpoint 0x00000081]
  TransferFlags        = 00000003 (USBD_TRANSFER_DIRECTION_IN, USBD_SHORT_TRANSFER_OK)
  TransferBufferLength = 00000100
  TransferBuffer       = 00000000
  TransferBufferMDL    = 81cc56a8
  UrbLink              = 00000000
[302374 ms] UsbSnoop - MyInternalIOCTLCompletion(f88c7db0) : fido=823a0430, Irp=81b4e870, Context=81adbf80, IRQL=2
[302374 ms]  <<<  URB 370 coming back  <<< 
-- URB_FUNCTION_BULK_OR_INTERRUPT_TRANSFER:
  PipeHandle           = 81b44acc [endpoint 0x00000081]
  TransferFlags        = 00000003 (USBD_TRANSFER_DIRECTION_IN, USBD_SHORT_TRANSFER_OK)
  TransferBufferLength = 00000005
  TransferBuffer       = 00000000
  TransferBufferMDL    = 81cc56a8
    00000000: 00 00 00 1f 04
  UrbLink              = 00000000
[302401 ms] UsbSnoop - DispatchAny(f88c6610) : IRP_MJ_INTERNAL_DEVICE_CONTROL
[302401 ms] UsbSnoop - MyDispatchInternalIOCTL(f88c7e80) : fdo=82142030, Irp=81b4e870, IRQL=2
[302401 ms]  >>>  URB 371 going down  >>> 
-- URB_FUNCTION_BULK_OR_INTERRUPT_TRANSFER:
  PipeHandle           = 81b44acc [endpoint 0x00000081]
  TransferFlags        = 00000003 (USBD_TRANSFER_DIRECTION_IN, USBD_SHORT_TRANSFER_OK)
  TransferBufferLength = 00000100
  TransferBuffer       = 00000000
  TransferBufferMDL    = 81cc56a8
  UrbLink              = 00000000
[302401 ms] UsbSnoop - MyInternalIOCTLCompletion(f88c7db0) : fido=823a0430, Irp=81b4e870, Context=81acd8e0, IRQL=2
[302401 ms]  <<<  URB 371 coming back  <<< 
-- URB_FUNCTION_BULK_OR_INTERRUPT_TRANSFER:
  PipeHandle           = 81b44acc [endpoint 0x00000081]
  TransferFlags        = 00000003 (USBD_TRANSFER_DIRECTION_IN, USBD_SHORT_TRANSFER_OK)
  TransferBufferLength = 0000001f
  TransferBuffer       = 00000000
  TransferBufferMDL    = 81cc56a8
    00000000: 00 00 00 19 00 08 00 01 00 05 00 00 12 22 30 39
    00000010: 32 45 34 20 43 35 36 43 37 20 34 33 45 41 22
  UrbLink              = 00000000
[302431 ms] UsbSnoop - DispatchAny(f88c6610) : IRP_MJ_INTERNAL_DEVICE_CONTROL
[302431 ms] UsbSnoop - MyDispatchInternalIOCTL(f88c7e80) : fdo=82142030, Irp=81b4e870, IRQL=2
[302431 ms]  >>>  URB 372 going down  >>> 
-- URB_FUNCTION_BULK_OR_INTERRUPT_TRANSFER:
  PipeHandle           = 81b44aec [endpoint 0x00000002]
  TransferFlags        = 00000000 (USBD_TRANSFER_DIRECTION_OUT, ~USBD_SHORT_TRANSFER_OK)
  TransferBufferLength = 00000007
  TransferBuffer       = 00000000
  TransferBufferMDL    = 81cc56a8
    00000000: 00 00 00 02 05 e0 00
  UrbLink              = 00000000
[302431 ms] UsbSnoop - MyInternalIOCTLCompletion(f88c7db0) : fido=823a0430, Irp=81b4e870, Context=81adbf80, IRQL=2
[302431 ms]  <<<  URB 372 coming back  <<< 
-- URB_FUNCTION_BULK_OR_INTERRUPT_TRANSFER:
  PipeHandle           = 81b44aec [endpoint 0x00000002]
  TransferFlags        = 00000000 (USBD_TRANSFER_DIRECTION_OUT, ~USBD_SHORT_TRANSFER_OK)
  TransferBufferLength = 00000007
  TransferBuffer       = 00000000
  TransferBufferMDL    = 81cc56a8
  UrbLink              = 00000000
[302691 ms] UsbSnoop - DispatchAny(f88c6610) : IRP_MJ_INTERNAL_DEVICE_CONTROL
[302691 ms] UsbSnoop - MyDispatchInternalIOCTL(f88c7e80) : fdo=82142030, Irp=81b4e870, IRQL=2
[302691 ms]  >>>  URB 373 going down  >>> 
-- URB_FUNCTION_BULK_OR_INTERRUPT_TRANSFER:
  PipeHandle           = 81b44aec [endpoint 0x00000002]
  TransferFlags        = 00000000 (USBD_TRANSFER_DIRECTION_OUT, ~USBD_SHORT_TRANSFER_OK)
  TransferBufferLength = 00000009
  TransferBuffer       = 00000000
  TransferBufferMDL    = 81cc56a8
    00000000: 00 00 00 04 01 00 00 04 00
  UrbLink              = 00000000
[302691 ms] UsbSnoop - MyInternalIOCTLCompletion(f88c7db0) : fido=823a0430, Irp=81b4e870, Context=81ad07d0, IRQL=2
[302691 ms]  <<<  URB 373 coming back  <<< 
-- URB_FUNCTION_BULK_OR_INTERRUPT_TRANSFER:
  PipeHandle           = 81b44aec [endpoint 0x00000002]
  TransferFlags        = 00000000 (USBD_TRANSFER_DIRECTION_OUT, ~USBD_SHORT_TRANSFER_OK)
  TransferBufferLength = 00000009
  TransferBuffer       = 00000000
  TransferBufferMDL    = 81cc56a8
  UrbLink              = 00000000
[302692 ms] UsbSnoop - DispatchAny(f88c6610) : IRP_MJ_INTERNAL_DEVICE_CONTROL
[302692 ms] UsbSnoop - MyDispatchInternalIOCTL(f88c7e80) : fdo=82142030, Irp=81b4e870, IRQL=2
[302692 ms]  >>>  URB 374 going down  >>> 
-- URB_FUNCTION_BULK_OR_INTERRUPT_TRANSFER:
  PipeHandle           = 81b44acc [endpoint 0x00000081]
  TransferFlags        = 00000003 (USBD_TRANSFER_DIRECTION_IN, USBD_SHORT_TRANSFER_OK)
  TransferBufferLength = 00000100
  TransferBuffer       = 00000000
  TransferBufferMDL    = 81cc56a8
  UrbLink              = 00000000
[302694 ms] UsbSnoop - MyInternalIOCTLCompletion(f88c7db0) : fido=823a0430, Irp=81b4e870, Context=81acd8e0, IRQL=2
[302694 ms]  <<<  URB 374 coming back  <<< 
-- URB_FUNCTION_BULK_OR_INTERRUPT_TRANSFER:
  PipeHandle           = 81b44acc [endpoint 0x00000081]
  TransferFlags        = 00000003 (USBD_TRANSFER_DIRECTION_IN, USBD_SHORT_TRANSFER_OK)
  TransferBufferLength = 00000009
  TransferBuffer       = 00000000
  TransferBufferMDL    = 81cc56a8
    00000000: 00 00 00 04 02 00 00 03 ff
  UrbLink              = 00000000
[302721 ms] UsbSnoop - DispatchAny(f88c6610) : IRP_MJ_INTERNAL_DEVICE_CONTROL
[302721 ms] UsbSnoop - MyDispatchInternalIOCTL(f88c7e80) : fdo=82142030, Irp=81b4e870, IRQL=2
[302721 ms]  >>>  URB 375 going down  >>> 
-- URB_FUNCTION_BULK_OR_INTERRUPT_TRANSFER:
  PipeHandle           = 81b44aec [endpoint 0x00000002]
  TransferFlags        = 00000000 (USBD_TRANSFER_DIRECTION_OUT, ~USBD_SHORT_TRANSFER_OK)
  TransferBufferLength = 00000015
  TransferBuffer       = 00000000
  TransferBufferMDL    = 81cc56a8
    00000000: 00 00 00 10 04 00 00 00 0a 00 01 00 03 00 01 00
    00000010: 00 00 00 07 d0
  UrbLink              = 00000000
[302722 ms] UsbSnoop - MyInternalIOCTLCompletion(f88c7db0) : fido=823a0430, Irp=81b4e870, Context=81af3568, IRQL=2
[302722 ms]  <<<  URB 375 coming back  <<< 
-- URB_FUNCTION_BULK_OR_INTERRUPT_TRANSFER:
  PipeHandle           = 81b44aec [endpoint 0x00000002]
  TransferFlags        = 00000000 (USBD_TRANSFER_DIRECTION_OUT, ~USBD_SHORT_TRANSFER_OK)
  TransferBufferLength = 00000015
  TransferBuffer       = 00000000
  TransferBufferMDL    = 81cc56a8
  UrbLink              = 00000000
[302731 ms] UsbSnoop - DispatchAny(f88c6610) : IRP_MJ_INTERNAL_DEVICE_CONTROL
[302731 ms] UsbSnoop - MyDispatchInternalIOCTL(f88c7e80) : fdo=82142030, Irp=81b4e870, IRQL=2
[302731 ms]  >>>  URB 376 going down  >>> 
-- URB_FUNCTION_BULK_OR_INTERRUPT_TRANSFER:
  PipeHandle           = 81b44acc [endpoint 0x00000081]
  TransferFlags        = 00000003 (USBD_TRANSFER_DIRECTION_IN, USBD_SHORT_TRANSFER_OK)
  TransferBufferLength = 00000100
  TransferBuffer       = 00000000
  TransferBufferMDL    = 81cc56a8
  UrbLink              = 00000000
[302731 ms] UsbSnoop - MyInternalIOCTLCompletion(f88c7db0) : fido=823a0430, Irp=81b4e870, Context=81acd8e0, IRQL=2
[302731 ms]  <<<  URB 376 coming back  <<< 
-- URB_FUNCTION_BULK_OR_INTERRUPT_TRANSFER:
  PipeHandle           = 81b44acc [endpoint 0x00000081]
  TransferFlags        = 00000003 (USBD_TRANSFER_DIRECTION_IN, USBD_SHORT_TRANSFER_OK)
  TransferBufferLength = 00000007
  TransferBuffer       = 00000000
  TransferBufferMDL    = 81cc56a8
    00000000: 00 00 00 02 05 e0 00
  UrbLink              = 00000000
[302771 ms] UsbSnoop - DispatchAny(f88c6610) : IRP_MJ_INTERNAL_DEVICE_CONTROL
[302771 ms] UsbSnoop - MyDispatchInternalIOCTL(f88c7e80) : fdo=82142030, Irp=81b4e870, IRQL=2
[302771 ms]  >>>  URB 377 going down  >>> 
-- URB_FUNCTION_BULK_OR_INTERRUPT_TRANSFER:
  PipeHandle           = 81b44acc [endpoint 0x00000081]
  TransferFlags        = 00000003 (USBD_TRANSFER_DIRECTION_IN, USBD_SHORT_TRANSFER_OK)
  TransferBufferLength = 00000100
  TransferBuffer       = 00000000
  TransferBufferMDL    = 81cc56a8
  UrbLink              = 00000000
[302772 ms] UsbSnoop - MyInternalIOCTLCompletion(f88c7db0) : fido=823a0430, Irp=81b4e870, Context=81c03a00, IRQL=2
[302772 ms]  <<<  URB 377 coming back  <<< 
-- URB_FUNCTION_BULK_OR_INTERRUPT_TRANSFER:
  PipeHandle           = 81b44acc [endpoint 0x00000081]
  TransferFlags        = 00000003 (USBD_TRANSFER_DIRECTION_IN, USBD_SHORT_TRANSFER_OK)
  TransferBufferLength = 00000005
  TransferBuffer       = 00000000
  TransferBufferMDL    = 81cc56a8
    00000000: 00 00 00 0a 04
  UrbLink              = 00000000
[302801 ms] UsbSnoop - DispatchAny(f88c6610) : IRP_MJ_INTERNAL_DEVICE_CONTROL
[302801 ms] UsbSnoop - MyDispatchInternalIOCTL(f88c7e80) : fdo=82142030, Irp=81b5d388, IRQL=2
[302801 ms]  >>>  URB 378 going down  >>> 
-- URB_FUNCTION_BULK_OR_INTERRUPT_TRANSFER:
  PipeHandle           = 81b44acc [endpoint 0x00000081]
  TransferFlags        = 00000003 (USBD_TRANSFER_DIRECTION_IN, USBD_SHORT_TRANSFER_OK)
  TransferBufferLength = 00000100
  TransferBuffer       = 00000000
  TransferBufferMDL    = 81cc56a8
  UrbLink              = 00000000
[302802 ms] UsbSnoop - MyInternalIOCTLCompletion(f88c7db0) : fido=823a0430, Irp=81b5d388, Context=81adbf80, IRQL=2
[302802 ms]  <<<  URB 378 coming back  <<< 
-- URB_FUNCTION_BULK_OR_INTERRUPT_TRANSFER:
  PipeHandle           = 81b44acc [endpoint 0x00000081]
  TransferFlags        = 00000003 (USBD_TRANSFER_DIRECTION_IN, USBD_SHORT_TRANSFER_OK)
  TransferBufferLength = 0000000a
  TransferBuffer       = 00000000
  TransferBufferMDL    = 81cc56a8
    00000000: 00 00 00 04 00 12 00 00 07 d0
  UrbLink              = 00000000
[302831 ms] UsbSnoop - DispatchAny(f88c6610) : IRP_MJ_INTERNAL_DEVICE_CONTROL
[302831 ms] UsbSnoop - MyDispatchInternalIOCTL(f88c7e80) : fdo=82142030, Irp=81b5d388, IRQL=2
[302831 ms]  >>>  URB 379 going down  >>> 
-- URB_FUNCTION_BULK_OR_INTERRUPT_TRANSFER:
  PipeHandle           = 81b44aec [endpoint 0x00000002]
  TransferFlags        = 00000000 (USBD_TRANSFER_DIRECTION_OUT, ~USBD_SHORT_TRANSFER_OK)
  TransferBufferLength = 00000007
  TransferBuffer       = 00000000
  TransferBufferMDL    = 81cc56a8
    00000000: 00 00 00 02 05 e0 00
  UrbLink              = 00000000
[302832 ms] UsbSnoop - MyInternalIOCTLCompletion(f88c7db0) : fido=823a0430, Irp=81b5d388, Context=81acd8e0, IRQL=2
[302832 ms]  <<<  URB 379 coming back  <<< 
-- URB_FUNCTION_BULK_OR_INTERRUPT_TRANSFER:
  PipeHandle           = 81b44aec [endpoint 0x00000002]
  TransferFlags        = 00000000 (USBD_TRANSFER_DIRECTION_OUT, ~USBD_SHORT_TRANSFER_OK)
  TransferBufferLength = 00000007
  TransferBuffer       = 00000000
  TransferBufferMDL    = 81cc56a8
  UrbLink              = 00000000
[302841 ms] UsbSnoop - DispatchAny(f88c6610) : IRP_MJ_INTERNAL_DEVICE_CONTROL
[302841 ms] UsbSnoop - MyDispatchInternalIOCTL(f88c7e80) : fdo=82142030, Irp=81b5d388, IRQL=2
[302841 ms]  >>>  URB 380 going down  >>> 
-- URB_FUNCTION_BULK_OR_INTERRUPT_TRANSFER:
  PipeHandle           = 81b44aec [endpoint 0x00000002]
  TransferFlags        = 00000000 (USBD_TRANSFER_DIRECTION_OUT, ~USBD_SHORT_TRANSFER_OK)
  TransferBufferLength = 0000002b
  TransferBuffer       = 00000000
  TransferBufferMDL    = 81cc56a8
    00000000: 00 00 00 26 04 00 00 00 20 00 07 00 0f 00 0b 00
    00000010: 04 00 06 00 07 00 01 00 02 00 0a 00 37 00 0c 00
    00000020: 38 00 09 00 0e 00 2d 00 03 00 2e
  UrbLink              = 00000000
[302842 ms] UsbSnoop - MyInternalIOCTLCompletion(f88c7db0) : fido=823a0430, Irp=81b5d388, Context=81c03a00, IRQL=2
[302842 ms]  <<<  URB 380 coming back  <<< 
-- URB_FUNCTION_BULK_OR_INTERRUPT_TRANSFER:
  PipeHandle           = 81b44aec [endpoint 0x00000002]
  TransferFlags        = 00000000 (USBD_TRANSFER_DIRECTION_OUT, ~USBD_SHORT_TRANSFER_OK)
  TransferBufferLength = 0000002b
  TransferBuffer       = 00000000
  TransferBufferMDL    = 81cc56a8
  UrbLink              = 00000000
[302852 ms] UsbSnoop - DispatchAny(f88c6610) : IRP_MJ_INTERNAL_DEVICE_CONTROL
[302852 ms] UsbSnoop - MyDispatchInternalIOCTL(f88c7e80) : fdo=82142030, Irp=81b5d388, IRQL=2
[302852 ms]  >>>  URB 381 going down  >>> 
-- URB_FUNCTION_BULK_OR_INTERRUPT_TRANSFER:
  PipeHandle           = 81b44acc [endpoint 0x00000081]
  TransferFlags        = 00000003 (USBD_TRANSFER_DIRECTION_IN, USBD_SHORT_TRANSFER_OK)
  TransferBufferLength = 00000100
  TransferBuffer       = 00000000
  TransferBufferMDL    = 81cc56a8
  UrbLink              = 00000000
[302852 ms] UsbSnoop - MyInternalIOCTLCompletion(f88c7db0) : fido=823a0430, Irp=81b5d388, Context=81ad5658, IRQL=2
[302852 ms]  <<<  URB 381 coming back  <<< 
-- URB_FUNCTION_BULK_OR_INTERRUPT_TRANSFER:
  PipeHandle           = 81b44acc [endpoint 0x00000081]
  TransferFlags        = 00000003 (USBD_TRANSFER_DIRECTION_IN, USBD_SHORT_TRANSFER_OK)
  TransferBufferLength = 00000007
  TransferBuffer       = 00000000
  TransferBufferMDL    = 81cc56a8
    00000000: 00 00 00 02 05 e0 00
  UrbLink              = 00000000
[302892 ms] UsbSnoop - DispatchAny(f88c6610) : IRP_MJ_INTERNAL_DEVICE_CONTROL
[302892 ms] UsbSnoop - MyDispatchInternalIOCTL(f88c7e80) : fdo=82142030, Irp=81b5d388, IRQL=2
[302892 ms]  >>>  URB 382 going down  >>> 
-- URB_FUNCTION_BULK_OR_INTERRUPT_TRANSFER:
  PipeHandle           = 81b44acc [endpoint 0x00000081]
  TransferFlags        = 00000003 (USBD_TRANSFER_DIRECTION_IN, USBD_SHORT_TRANSFER_OK)
  TransferBufferLength = 00000100
  TransferBuffer       = 00000000
  TransferBufferMDL    = 81cc56a8
  UrbLink              = 00000000
[303117 ms] UsbSnoop - MyInternalIOCTLCompletion(f88c7db0) : fido=823a0430, Irp=81b5d388, Context=81af1cb8, IRQL=2
[303118 ms]  <<<  URB 382 coming back  <<< 
-- URB_FUNCTION_BULK_OR_INTERRUPT_TRANSFER:
  PipeHandle           = 81b44acc [endpoint 0x00000081]
  TransferFlags        = 00000003 (USBD_TRANSFER_DIRECTION_IN, USBD_SHORT_TRANSFER_OK)
  TransferBufferLength = 00000005
  TransferBuffer       = 00000000
  TransferBufferMDL    = 81cc56a8
    00000000: 00 00 00 95 04
  UrbLink              = 00000000
[303142 ms] UsbSnoop - DispatchAny(f88c6610) : IRP_MJ_INTERNAL_DEVICE_CONTROL
[303142 ms] UsbSnoop - MyDispatchInternalIOCTL(f88c7e80) : fdo=82142030, Irp=81b5d388, IRQL=2
[303142 ms]  >>>  URB 383 going down  >>> 
-- URB_FUNCTION_BULK_OR_INTERRUPT_TRANSFER:
  PipeHandle           = 81b44acc [endpoint 0x00000081]
  TransferFlags        = 00000003 (USBD_TRANSFER_DIRECTION_IN, USBD_SHORT_TRANSFER_OK)
  TransferBufferLength = 00000100
  TransferBuffer       = 00000000
  TransferBufferMDL    = 81cc56a8
  UrbLink              = 00000000
[303143 ms] UsbSnoop - MyInternalIOCTLCompletion(f88c7db0) : fido=823a0430, Irp=81b5d388, Context=81c03a00, IRQL=2
[303143 ms]  <<<  URB 383 coming back  <<< 
-- URB_FUNCTION_BULK_OR_INTERRUPT_TRANSFER:
  PipeHandle           = 81b44acc [endpoint 0x00000081]
  TransferFlags        = 00000003 (USBD_TRANSFER_DIRECTION_IN, USBD_SHORT_TRANSFER_OK)
  TransferBufferLength = 00000095
  TransferBuffer       = 00000000
  TransferBufferMDL    = 81cc56a8
    00000000: 00 00 00 8f 00 08 00 0f 00 0b 00 00 04 00 03 00
    00000010: 00 00 04 00 00 02 00 02 00 06 00 00 01 09 00 07
    00000020: 00 00 01 01 00 01 00 00 04 00 00 00 09 00 02 00
    00000030: 00 0e 54 49 2d 38 39 20 54 69 74 61 6e 69 75 6d
    00000040: 00 0a 00 00 01 01 00 37 00 00 01 01 00 0c 00 00
    00000050: 08 00 00 00 00 00 03 ff f4 00 38 02 00 09 00 00
    00000060: 04 00 02 01 18 00 0e 00 00 08 00 00 00 00 00 02
    00000070: 92 a4 00 2d 00 00 01 01 00 03 00 00 12 22 30 39
    00000080: 32 45 34 20 43 35 36 43 37 20 34 33 45 41 22 00
    00000090: 2e 00 00 01 fe
  UrbLink              = 00000000
[303183 ms] UsbSnoop - DispatchAny(f88c6610) : IRP_MJ_INTERNAL_DEVICE_CONTROL
[303183 ms] UsbSnoop - MyDispatchInternalIOCTL(f88c7e80) : fdo=82142030, Irp=81b5d388, IRQL=2
[303183 ms]  >>>  URB 384 going down  >>> 
-- URB_FUNCTION_BULK_OR_INTERRUPT_TRANSFER:
  PipeHandle           = 81b44aec [endpoint 0x00000002]
  TransferFlags        = 00000000 (USBD_TRANSFER_DIRECTION_OUT, ~USBD_SHORT_TRANSFER_OK)
  TransferBufferLength = 00000007
  TransferBuffer       = 00000000
  TransferBufferMDL    = 81cc56a8
    00000000: 00 00 00 02 05 e0 00
  UrbLink              = 00000000
[303184 ms] UsbSnoop - MyInternalIOCTLCompletion(f88c7db0) : fido=823a0430, Irp=81b5d388, Context=81adbf80, IRQL=2
[303184 ms]  <<<  URB 384 coming back  <<< 
-- URB_FUNCTION_BULK_OR_INTERRUPT_TRANSFER:
  PipeHandle           = 81b44aec [endpoint 0x00000002]
  TransferFlags        = 00000000 (USBD_TRANSFER_DIRECTION_OUT, ~USBD_SHORT_TRANSFER_OK)
  TransferBufferLength = 00000007
  TransferBuffer       = 00000000
  TransferBufferMDL    = 81cc56a8
  UrbLink              = 00000000
[303442 ms] UsbSnoop - DispatchAny(f88c6610) : IRP_MJ_INTERNAL_DEVICE_CONTROL
[303442 ms] UsbSnoop - MyDispatchInternalIOCTL(f88c7e80) : fdo=82142030, Irp=81b5d388, IRQL=2
[303442 ms]  >>>  URB 385 going down  >>> 
-- URB_FUNCTION_BULK_OR_INTERRUPT_TRANSFER:
  PipeHandle           = 81b44aec [endpoint 0x00000002]
  TransferFlags        = 00000000 (USBD_TRANSFER_DIRECTION_OUT, ~USBD_SHORT_TRANSFER_OK)
  TransferBufferLength = 00000009
  TransferBuffer       = 00000000
  TransferBufferMDL    = 81cc56a8
    00000000: 00 00 00 04 01 00 00 04 00
  UrbLink              = 00000000
[303443 ms] UsbSnoop - MyInternalIOCTLCompletion(f88c7db0) : fido=823a0430, Irp=81b5d388, Context=81acd8e0, IRQL=2
[303443 ms]  <<<  URB 385 coming back  <<< 
-- URB_FUNCTION_BULK_OR_INTERRUPT_TRANSFER:
  PipeHandle           = 81b44aec [endpoint 0x00000002]
  TransferFlags        = 00000000 (USBD_TRANSFER_DIRECTION_OUT, ~USBD_SHORT_TRANSFER_OK)
  TransferBufferLength = 00000009
  TransferBuffer       = 00000000
  TransferBufferMDL    = 81cc56a8
  UrbLink              = 00000000
[303443 ms] UsbSnoop - DispatchAny(f88c6610) : IRP_MJ_INTERNAL_DEVICE_CONTROL
[303443 ms] UsbSnoop - MyDispatchInternalIOCTL(f88c7e80) : fdo=82142030, Irp=81b5d388, IRQL=2
[303443 ms]  >>>  URB 386 going down  >>> 
-- URB_FUNCTION_BULK_OR_INTERRUPT_TRANSFER:
  PipeHandle           = 81b44acc [endpoint 0x00000081]
  TransferFlags        = 00000003 (USBD_TRANSFER_DIRECTION_IN, USBD_SHORT_TRANSFER_OK)
  TransferBufferLength = 00000100
  TransferBuffer       = 00000000
  TransferBufferMDL    = 81cc56a8
  UrbLink              = 00000000
[303445 ms] UsbSnoop - MyInternalIOCTLCompletion(f88c7db0) : fido=823a0430, Irp=81b5d388, Context=81acd8e0, IRQL=2
[303445 ms]  <<<  URB 386 coming back  <<< 
-- URB_FUNCTION_BULK_OR_INTERRUPT_TRANSFER:
  PipeHandle           = 81b44acc [endpoint 0x00000081]
  TransferFlags        = 00000003 (USBD_TRANSFER_DIRECTION_IN, USBD_SHORT_TRANSFER_OK)
  TransferBufferLength = 00000009
  TransferBuffer       = 00000000
  TransferBufferMDL    = 81cc56a8
    00000000: 00 00 00 04 02 00 00 03 ff
  UrbLink              = 00000000
[303473 ms] UsbSnoop - DispatchAny(f88c6610) : IRP_MJ_INTERNAL_DEVICE_CONTROL
[303473 ms] UsbSnoop - MyDispatchInternalIOCTL(f88c7e80) : fdo=82142030, Irp=81b5d388, IRQL=2
[303473 ms]  >>>  URB 387 going down  >>> 
-- URB_FUNCTION_BULK_OR_INTERRUPT_TRANSFER:
  PipeHandle           = 81b44aec [endpoint 0x00000002]
  TransferFlags        = 00000000 (USBD_TRANSFER_DIRECTION_OUT, ~USBD_SHORT_TRANSFER_OK)
  TransferBufferLength = 00000015
  TransferBuffer       = 00000000
  TransferBufferMDL    = 81cc56a8
    00000000: 00 00 00 10 04 00 00 00 0a 00 01 00 03 00 01 00
    00000010: 00 00 00 07 d0
  UrbLink              = 00000000
[303473 ms] UsbSnoop - MyInternalIOCTLCompletion(f88c7db0) : fido=823a0430, Irp=81b5d388, Context=81c03a00, IRQL=2
[303473 ms]  <<<  URB 387 coming back  <<< 
-- URB_FUNCTION_BULK_OR_INTERRUPT_TRANSFER:
  PipeHandle           = 81b44aec [endpoint 0x00000002]
  TransferFlags        = 00000000 (USBD_TRANSFER_DIRECTION_OUT, ~USBD_SHORT_TRANSFER_OK)
  TransferBufferLength = 00000015
  TransferBuffer       = 00000000
  TransferBufferMDL    = 81cc56a8
  UrbLink              = 00000000
[303482 ms] UsbSnoop - DispatchAny(f88c6610) : IRP_MJ_INTERNAL_DEVICE_CONTROL
[303482 ms] UsbSnoop - MyDispatchInternalIOCTL(f88c7e80) : fdo=82142030, Irp=81b5d388, IRQL=2
[303482 ms]  >>>  URB 388 going down  >>> 
-- URB_FUNCTION_BULK_OR_INTERRUPT_TRANSFER:
  PipeHandle           = 81b44acc [endpoint 0x00000081]
  TransferFlags        = 00000003 (USBD_TRANSFER_DIRECTION_IN, USBD_SHORT_TRANSFER_OK)
  TransferBufferLength = 00000100
  TransferBuffer       = 00000000
  TransferBufferMDL    = 81cc56a8
  UrbLink              = 00000000
[303483 ms] UsbSnoop - MyInternalIOCTLCompletion(f88c7db0) : fido=823a0430, Irp=81b5d388, Context=81acd8e0, IRQL=2
[303483 ms]  <<<  URB 388 coming back  <<< 
-- URB_FUNCTION_BULK_OR_INTERRUPT_TRANSFER:
  PipeHandle           = 81b44acc [endpoint 0x00000081]
  TransferFlags        = 00000003 (USBD_TRANSFER_DIRECTION_IN, USBD_SHORT_TRANSFER_OK)
  TransferBufferLength = 00000007
  TransferBuffer       = 00000000
  TransferBufferMDL    = 81cc56a8
    00000000: 00 00 00 02 05 e0 00
  UrbLink              = 00000000
[303523 ms] UsbSnoop - DispatchAny(f88c6610) : IRP_MJ_INTERNAL_DEVICE_CONTROL
[303523 ms] UsbSnoop - MyDispatchInternalIOCTL(f88c7e80) : fdo=82142030, Irp=81b5d388, IRQL=2
[303523 ms]  >>>  URB 389 going down  >>> 
-- URB_FUNCTION_BULK_OR_INTERRUPT_TRANSFER:
  PipeHandle           = 81b44acc [endpoint 0x00000081]
  TransferFlags        = 00000003 (USBD_TRANSFER_DIRECTION_IN, USBD_SHORT_TRANSFER_OK)
  TransferBufferLength = 00000100
  TransferBuffer       = 00000000
  TransferBufferMDL    = 81cc56a8
  UrbLink              = 00000000
[303523 ms] UsbSnoop - MyInternalIOCTLCompletion(f88c7db0) : fido=823a0430, Irp=81b5d388, Context=81af1cb8, IRQL=2
[303523 ms]  <<<  URB 389 coming back  <<< 
-- URB_FUNCTION_BULK_OR_INTERRUPT_TRANSFER:
  PipeHandle           = 81b44acc [endpoint 0x00000081]
  TransferFlags        = 00000003 (USBD_TRANSFER_DIRECTION_IN, USBD_SHORT_TRANSFER_OK)
  TransferBufferLength = 00000005
  TransferBuffer       = 00000000
  TransferBufferMDL    = 81cc56a8
    00000000: 00 00 00 0a 04
  UrbLink              = 00000000
[303553 ms] UsbSnoop - DispatchAny(f88c6610) : IRP_MJ_INTERNAL_DEVICE_CONTROL
[303553 ms] UsbSnoop - MyDispatchInternalIOCTL(f88c7e80) : fdo=82142030, Irp=81b5d388, IRQL=2
[303553 ms]  >>>  URB 390 going down  >>> 
-- URB_FUNCTION_BULK_OR_INTERRUPT_TRANSFER:
  PipeHandle           = 81b44acc [endpoint 0x00000081]
  TransferFlags        = 00000003 (USBD_TRANSFER_DIRECTION_IN, USBD_SHORT_TRANSFER_OK)
  TransferBufferLength = 00000100
  TransferBuffer       = 00000000
  TransferBufferMDL    = 81cc56a8
  UrbLink              = 00000000
[303553 ms] UsbSnoop - MyInternalIOCTLCompletion(f88c7db0) : fido=823a0430, Irp=81b5d388, Context=822af798, IRQL=2
[303553 ms]  <<<  URB 390 coming back  <<< 
-- URB_FUNCTION_BULK_OR_INTERRUPT_TRANSFER:
  PipeHandle           = 81b44acc [endpoint 0x00000081]
  TransferFlags        = 00000003 (USBD_TRANSFER_DIRECTION_IN, USBD_SHORT_TRANSFER_OK)
  TransferBufferLength = 0000000a
  TransferBuffer       = 00000000
  TransferBufferMDL    = 81cc56a8
    00000000: 00 00 00 04 00 12 00 00 07 d0
  UrbLink              = 00000000
[303583 ms] UsbSnoop - DispatchAny(f88c6610) : IRP_MJ_INTERNAL_DEVICE_CONTROL
[303583 ms] UsbSnoop - MyDispatchInternalIOCTL(f88c7e80) : fdo=82142030, Irp=81b5d388, IRQL=2
[303583 ms]  >>>  URB 391 going down  >>> 
-- URB_FUNCTION_BULK_OR_INTERRUPT_TRANSFER:
  PipeHandle           = 81b44aec [endpoint 0x00000002]
  TransferFlags        = 00000000 (USBD_TRANSFER_DIRECTION_OUT, ~USBD_SHORT_TRANSFER_OK)
  TransferBufferLength = 00000007
  TransferBuffer       = 00000000
  TransferBufferMDL    = 81cc56a8
    00000000: 00 00 00 02 05 e0 00
  UrbLink              = 00000000
[303583 ms] UsbSnoop - MyInternalIOCTLCompletion(f88c7db0) : fido=823a0430, Irp=81b5d388, Context=81ad07d0, IRQL=2
[303583 ms]  <<<  URB 391 coming back  <<< 
-- URB_FUNCTION_BULK_OR_INTERRUPT_TRANSFER:
  PipeHandle           = 81b44aec [endpoint 0x00000002]
  TransferFlags        = 00000000 (USBD_TRANSFER_DIRECTION_OUT, ~USBD_SHORT_TRANSFER_OK)
  TransferBufferLength = 00000007
  TransferBuffer       = 00000000
  TransferBufferMDL    = 81cc56a8
  UrbLink              = 00000000
[303593 ms] UsbSnoop - DispatchAny(f88c6610) : IRP_MJ_INTERNAL_DEVICE_CONTROL
[303593 ms] UsbSnoop - MyDispatchInternalIOCTL(f88c7e80) : fdo=82142030, Irp=81b5d388, IRQL=2
[303593 ms]  >>>  URB 392 going down  >>> 
-- URB_FUNCTION_BULK_OR_INTERRUPT_TRANSFER:
  PipeHandle           = 81b44aec [endpoint 0x00000002]
  TransferFlags        = 00000000 (USBD_TRANSFER_DIRECTION_OUT, ~USBD_SHORT_TRANSFER_OK)
  TransferBufferLength = 0000000f
  TransferBuffer       = 00000000
  TransferBufferMDL    = 81cc56a8
    00000000: 00 00 00 0a 04 00 00 00 04 00 07 00 01 00 31
  UrbLink              = 00000000
[303593 ms] UsbSnoop - MyInternalIOCTLCompletion(f88c7db0) : fido=823a0430, Irp=81b5d388, Context=81c03a00, IRQL=2
[303593 ms]  <<<  URB 392 coming back  <<< 
-- URB_FUNCTION_BULK_OR_INTERRUPT_TRANSFER:
  PipeHandle           = 81b44aec [endpoint 0x00000002]
  TransferFlags        = 00000000 (USBD_TRANSFER_DIRECTION_OUT, ~USBD_SHORT_TRANSFER_OK)
  TransferBufferLength = 0000000f
  TransferBuffer       = 00000000
  TransferBufferMDL    = 81cc56a8
  UrbLink              = 00000000
[303603 ms] UsbSnoop - DispatchAny(f88c6610) : IRP_MJ_INTERNAL_DEVICE_CONTROL
[303603 ms] UsbSnoop - MyDispatchInternalIOCTL(f88c7e80) : fdo=82142030, Irp=81b5d388, IRQL=2
[303603 ms]  >>>  URB 393 going down  >>> 
-- URB_FUNCTION_BULK_OR_INTERRUPT_TRANSFER:
  PipeHandle           = 81b44acc [endpoint 0x00000081]
  TransferFlags        = 00000003 (USBD_TRANSFER_DIRECTION_IN, USBD_SHORT_TRANSFER_OK)
  TransferBufferLength = 00000100
  TransferBuffer       = 00000000
  TransferBufferMDL    = 81cc56a8
  UrbLink              = 00000000
[303603 ms] UsbSnoop - MyInternalIOCTLCompletion(f88c7db0) : fido=823a0430, Irp=81b5d388, Context=81acd8e0, IRQL=2
[303603 ms]  <<<  URB 393 coming back  <<< 
-- URB_FUNCTION_BULK_OR_INTERRUPT_TRANSFER:
  PipeHandle           = 81b44acc [endpoint 0x00000081]
  TransferFlags        = 00000003 (USBD_TRANSFER_DIRECTION_IN, USBD_SHORT_TRANSFER_OK)
  TransferBufferLength = 00000007
  TransferBuffer       = 00000000
  TransferBufferMDL    = 81cc56a8
    00000000: 00 00 00 02 05 e0 00
  UrbLink              = 00000000
[303643 ms] UsbSnoop - DispatchAny(f88c6610) : IRP_MJ_INTERNAL_DEVICE_CONTROL
[303643 ms] UsbSnoop - MyDispatchInternalIOCTL(f88c7e80) : fdo=82142030, Irp=81b5d388, IRQL=2
[303643 ms]  >>>  URB 394 going down  >>> 
-- URB_FUNCTION_BULK_OR_INTERRUPT_TRANSFER:
  PipeHandle           = 81b44acc [endpoint 0x00000081]
  TransferFlags        = 00000003 (USBD_TRANSFER_DIRECTION_IN, USBD_SHORT_TRANSFER_OK)
  TransferBufferLength = 00000100
  TransferBuffer       = 00000000
  TransferBufferMDL    = 81cc56a8
  UrbLink              = 00000000
[303876 ms] UsbSnoop - MyInternalIOCTLCompletion(f88c7db0) : fido=823a0430, Irp=81b5d388, Context=81af1cb8, IRQL=2
[303876 ms]  <<<  URB 394 coming back  <<< 
-- URB_FUNCTION_BULK_OR_INTERRUPT_TRANSFER:
  PipeHandle           = 81b44acc [endpoint 0x00000081]
  TransferFlags        = 00000003 (USBD_TRANSFER_DIRECTION_IN, USBD_SHORT_TRANSFER_OK)
  TransferBufferLength = 00000005
  TransferBuffer       = 00000000
  TransferBufferMDL    = 81cc56a8
    00000000: 00 00 01 65 04
  UrbLink              = 00000000
[303903 ms] UsbSnoop - DispatchAny(f88c6610) : IRP_MJ_INTERNAL_DEVICE_CONTROL
[303903 ms] UsbSnoop - MyDispatchInternalIOCTL(f88c7e80) : fdo=82142030, Irp=81b4e870, IRQL=2
[303903 ms]  >>>  URB 395 going down  >>> 
-- URB_FUNCTION_BULK_OR_INTERRUPT_TRANSFER:
  PipeHandle           = 81b44acc [endpoint 0x00000081]
  TransferFlags        = 00000003 (USBD_TRANSFER_DIRECTION_IN, USBD_SHORT_TRANSFER_OK)
  TransferBufferLength = 00000100
  TransferBuffer       = 00000000
  TransferBufferMDL    = 8216a008
  UrbLink              = 00000000
[303905 ms] UsbSnoop - MyInternalIOCTLCompletion(f88c7db0) : fido=823a0430, Irp=81b4e870, Context=81c03a00, IRQL=2
[303905 ms]  <<<  URB 395 coming back  <<< 
-- URB_FUNCTION_BULK_OR_INTERRUPT_TRANSFER:
  PipeHandle           = 81b44acc [endpoint 0x00000081]
  TransferFlags        = 00000003 (USBD_TRANSFER_DIRECTION_IN, USBD_SHORT_TRANSFER_OK)
  TransferBufferLength = 00000100
  TransferBuffer       = 00000000
  TransferBufferMDL    = 8216a008
    00000000: 00 00 01 5f 00 08 00 01 00 31 00 01 58 03 26 09
    00000010: 04 10 12 5e 31 02 0d 40 8b 13 29 18 27 b8 4d ed
    00000020: 1f e3 0b 7f 28 59 1b 79 70 e8 1b 22 94 41 6c a9
    00000030: bb 46 11 62 f6 6d 97 d6 0f 34 09 c5 c7 ad 53 54
    00000040: ce 19 92 0c c2 a5 2d 77 12 9a 28 e1 f3 06 67 a5
    00000050: 90 ec c7 45 50 91 5b 4f 03 3d 4a 0a 15 09 2e 4c
    00000060: 56 c7 00 0d 40 00 00 00 00 00 00 00 00 00 00 00
    00000070: 00 00 00 00 00 00 00 00 00 00 00 00 00 00 00 00
    00000080: 00 00 00 00 00 00 00 00 00 00 00 00 00 00 00 00
    00000090: 00 00 00 00 00 00 00 00 00 00 00 00 00 00 00 00
    000000a0: 00 00 00 00 00 80 0d 78 80 11 09 80 21 0d 80 32
    000000b0: 00 19 80 a1 02 80 4d 1d 41 64 76 61 6e 63 65 64
    000000c0: 20 4d 61 74 68 65 6d 61 74 69 63 73 20 53 6f 66
    000000d0: 74 77 61 72 65 03 26 09 04 0d 98 75 61 02 0d 40
    000000e0: a0 b3 cc bc d0 cb c7 91 53 65 b2 95 85 3b 4f d3
    000000f0: ea 63 45 1a 34 82 e4 97 ae b6 fe 62 71 40 27 23
  UrbLink              = 00000000
[303933 ms] UsbSnoop - DispatchAny(f88c6610) : IRP_MJ_INTERNAL_DEVICE_CONTROL
[303933 ms] UsbSnoop - MyDispatchInternalIOCTL(f88c7e80) : fdo=82142030, Irp=81b4e870, IRQL=2
[303933 ms]  >>>  URB 396 going down  >>> 
-- URB_FUNCTION_BULK_OR_INTERRUPT_TRANSFER:
  PipeHandle           = 81b44acc [endpoint 0x00000081]
  TransferFlags        = 00000003 (USBD_TRANSFER_DIRECTION_IN, USBD_SHORT_TRANSFER_OK)
  TransferBufferLength = 00000100
  TransferBuffer       = 00000000
  TransferBufferMDL    = 8216a008
  UrbLink              = 00000000
[303934 ms] UsbSnoop - MyInternalIOCTLCompletion(f88c7db0) : fido=823a0430, Irp=81b4e870, Context=822af798, IRQL=2
[303934 ms]  <<<  URB 396 coming back  <<< 
-- URB_FUNCTION_BULK_OR_INTERRUPT_TRANSFER:
  PipeHandle           = 81b44acc [endpoint 0x00000081]
  TransferFlags        = 00000003 (USBD_TRANSFER_DIRECTION_IN, USBD_SHORT_TRANSFER_OK)
  TransferBufferLength = 00000065
  TransferBuffer       = 00000000
  TransferBufferMDL    = 8216a008
    00000000: 60 be 66 5f b2 78 d1 b9 10 27 36 26 1e 00 c6 64
    00000010: da 8d bd ea 82 4c 4d 6f 35 be 08 2f 5e 64 6a 2e
    00000020: 02 0d 40 2c 4d 8b de 30 13 7f 5e 99 7b 22 67 6e
    00000030: 70 85 00 e7 a6 66 46 c0 e1 f9 55 6c e7 8f bf a7
    00000040: 4a aa 0b fa 62 48 50 b6 75 bc d9 9b 93 36 fd 1c
    00000050: 00 6d c8 20 98 bf f1 7b f1 52 70 98 f8 73 11 b1
    00000060: 0e c0 24 ff ff
  UrbLink              = 00000000
[303975 ms] UsbSnoop - DispatchAny(f88c6610) : IRP_MJ_INTERNAL_DEVICE_CONTROL
[303975 ms] UsbSnoop - MyDispatchInternalIOCTL(f88c7e80) : fdo=82142030, Irp=81b4e870, IRQL=2
[303975 ms]  >>>  URB 397 going down  >>> 
-- URB_FUNCTION_BULK_OR_INTERRUPT_TRANSFER:
  PipeHandle           = 81b44aec [endpoint 0x00000002]
  TransferFlags        = 00000000 (USBD_TRANSFER_DIRECTION_OUT, ~USBD_SHORT_TRANSFER_OK)
  TransferBufferLength = 00000007
  TransferBuffer       = 00000000
  TransferBufferMDL    = 8216a008
    00000000: 00 00 00 02 05 e0 00
  UrbLink              = 00000000
[303975 ms] UsbSnoop - MyInternalIOCTLCompletion(f88c7db0) : fido=823a0430, Irp=81b4e870, Context=822af798, IRQL=2
[303975 ms]  <<<  URB 397 coming back  <<< 
-- URB_FUNCTION_BULK_OR_INTERRUPT_TRANSFER:
  PipeHandle           = 81b44aec [endpoint 0x00000002]
  TransferFlags        = 00000000 (USBD_TRANSFER_DIRECTION_OUT, ~USBD_SHORT_TRANSFER_OK)
  TransferBufferLength = 00000007
  TransferBuffer       = 00000000
  TransferBufferMDL    = 8216a008
  UrbLink              = 00000000
[304234 ms] UsbSnoop - DispatchAny(f88c6610) : IRP_MJ_INTERNAL_DEVICE_CONTROL
[304234 ms] UsbSnoop - MyDispatchInternalIOCTL(f88c7e80) : fdo=82142030, Irp=81b4e870, IRQL=2
[304234 ms]  >>>  URB 398 going down  >>> 
-- URB_FUNCTION_BULK_OR_INTERRUPT_TRANSFER:
  PipeHandle           = 81b44aec [endpoint 0x00000002]
  TransferFlags        = 00000000 (USBD_TRANSFER_DIRECTION_OUT, ~USBD_SHORT_TRANSFER_OK)
  TransferBufferLength = 00000009
  TransferBuffer       = 00000000
  TransferBufferMDL    = 8216a008
    00000000: 00 00 00 04 01 00 00 04 00
  UrbLink              = 00000000
[304234 ms] UsbSnoop - MyInternalIOCTLCompletion(f88c7db0) : fido=823a0430, Irp=81b4e870, Context=822af798, IRQL=2
[304234 ms]  <<<  URB 398 coming back  <<< 
-- URB_FUNCTION_BULK_OR_INTERRUPT_TRANSFER:
  PipeHandle           = 81b44aec [endpoint 0x00000002]
  TransferFlags        = 00000000 (USBD_TRANSFER_DIRECTION_OUT, ~USBD_SHORT_TRANSFER_OK)
  TransferBufferLength = 00000009
  TransferBuffer       = 00000000
  TransferBufferMDL    = 8216a008
  UrbLink              = 00000000
[304234 ms] UsbSnoop - DispatchAny(f88c6610) : IRP_MJ_INTERNAL_DEVICE_CONTROL
[304234 ms] UsbSnoop - MyDispatchInternalIOCTL(f88c7e80) : fdo=82142030, Irp=81b4e870, IRQL=2
[304234 ms]  >>>  URB 399 going down  >>> 
-- URB_FUNCTION_BULK_OR_INTERRUPT_TRANSFER:
  PipeHandle           = 81b44acc [endpoint 0x00000081]
  TransferFlags        = 00000003 (USBD_TRANSFER_DIRECTION_IN, USBD_SHORT_TRANSFER_OK)
  TransferBufferLength = 00000100
  TransferBuffer       = 00000000
  TransferBufferMDL    = 8216a008
  UrbLink              = 00000000
[304236 ms] UsbSnoop - MyInternalIOCTLCompletion(f88c7db0) : fido=823a0430, Irp=81b4e870, Context=81adbf80, IRQL=2
[304236 ms]  <<<  URB 399 coming back  <<< 
-- URB_FUNCTION_BULK_OR_INTERRUPT_TRANSFER:
  PipeHandle           = 81b44acc [endpoint 0x00000081]
  TransferFlags        = 00000003 (USBD_TRANSFER_DIRECTION_IN, USBD_SHORT_TRANSFER_OK)
  TransferBufferLength = 00000009
  TransferBuffer       = 00000000
  TransferBufferMDL    = 8216a008
    00000000: 00 00 00 04 02 00 00 03 ff
  UrbLink              = 00000000
[304264 ms] UsbSnoop - DispatchAny(f88c6610) : IRP_MJ_INTERNAL_DEVICE_CONTROL
[304264 ms] UsbSnoop - MyDispatchInternalIOCTL(f88c7e80) : fdo=82142030, Irp=81b4e870, IRQL=2
[304264 ms]  >>>  URB 400 going down  >>> 
-- URB_FUNCTION_BULK_OR_INTERRUPT_TRANSFER:
  PipeHandle           = 81b44aec [endpoint 0x00000002]
  TransferFlags        = 00000000 (USBD_TRANSFER_DIRECTION_OUT, ~USBD_SHORT_TRANSFER_OK)
  TransferBufferLength = 00000015
  TransferBuffer       = 00000000
  TransferBufferMDL    = 8216a008
    00000000: 00 00 00 10 04 00 00 00 0a 00 01 00 03 00 01 00
    00000010: 00 00 00 07 d0
  UrbLink              = 00000000
[304264 ms] UsbSnoop - MyInternalIOCTLCompletion(f88c7db0) : fido=823a0430, Irp=81b4e870, Context=81ad07d0, IRQL=2
[304264 ms]  <<<  URB 400 coming back  <<< 
-- URB_FUNCTION_BULK_OR_INTERRUPT_TRANSFER:
  PipeHandle           = 81b44aec [endpoint 0x00000002]
  TransferFlags        = 00000000 (USBD_TRANSFER_DIRECTION_OUT, ~USBD_SHORT_TRANSFER_OK)
  TransferBufferLength = 00000015
  TransferBuffer       = 00000000
  TransferBufferMDL    = 8216a008
  UrbLink              = 00000000
[304274 ms] UsbSnoop - DispatchAny(f88c6610) : IRP_MJ_INTERNAL_DEVICE_CONTROL
[304274 ms] UsbSnoop - MyDispatchInternalIOCTL(f88c7e80) : fdo=82142030, Irp=81b4e870, IRQL=2
[304274 ms]  >>>  URB 401 going down  >>> 
-- URB_FUNCTION_BULK_OR_INTERRUPT_TRANSFER:
  PipeHandle           = 81b44acc [endpoint 0x00000081]
  TransferFlags        = 00000003 (USBD_TRANSFER_DIRECTION_IN, USBD_SHORT_TRANSFER_OK)
  TransferBufferLength = 00000100
  TransferBuffer       = 00000000
  TransferBufferMDL    = 8216a008
  UrbLink              = 00000000
[304274 ms] UsbSnoop - MyInternalIOCTLCompletion(f88c7db0) : fido=823a0430, Irp=81b4e870, Context=81adbf80, IRQL=2
[304274 ms]  <<<  URB 401 coming back  <<< 
-- URB_FUNCTION_BULK_OR_INTERRUPT_TRANSFER:
  PipeHandle           = 81b44acc [endpoint 0x00000081]
  TransferFlags        = 00000003 (USBD_TRANSFER_DIRECTION_IN, USBD_SHORT_TRANSFER_OK)
  TransferBufferLength = 00000007
  TransferBuffer       = 00000000
  TransferBufferMDL    = 8216a008
    00000000: 00 00 00 02 05 e0 00
  UrbLink              = 00000000
[304314 ms] UsbSnoop - DispatchAny(f88c6610) : IRP_MJ_INTERNAL_DEVICE_CONTROL
[304314 ms] UsbSnoop - MyDispatchInternalIOCTL(f88c7e80) : fdo=82142030, Irp=81b4e870, IRQL=2
[304314 ms]  >>>  URB 402 going down  >>> 
-- URB_FUNCTION_BULK_OR_INTERRUPT_TRANSFER:
  PipeHandle           = 81b44acc [endpoint 0x00000081]
  TransferFlags        = 00000003 (USBD_TRANSFER_DIRECTION_IN, USBD_SHORT_TRANSFER_OK)
  TransferBufferLength = 00000100
  TransferBuffer       = 00000000
  TransferBufferMDL    = 8216a008
  UrbLink              = 00000000
[304314 ms] UsbSnoop - MyInternalIOCTLCompletion(f88c7db0) : fido=823a0430, Irp=81b4e870, Context=81ad5658, IRQL=2
[304314 ms]  <<<  URB 402 coming back  <<< 
-- URB_FUNCTION_BULK_OR_INTERRUPT_TRANSFER:
  PipeHandle           = 81b44acc [endpoint 0x00000081]
  TransferFlags        = 00000003 (USBD_TRANSFER_DIRECTION_IN, USBD_SHORT_TRANSFER_OK)
  TransferBufferLength = 00000005
  TransferBuffer       = 00000000
  TransferBufferMDL    = 8216a008
    00000000: 00 00 00 0a 04
  UrbLink              = 00000000
[304344 ms] UsbSnoop - DispatchAny(f88c6610) : IRP_MJ_INTERNAL_DEVICE_CONTROL
[304344 ms] UsbSnoop - MyDispatchInternalIOCTL(f88c7e80) : fdo=82142030, Irp=81b4e870, IRQL=2
[304344 ms]  >>>  URB 403 going down  >>> 
-- URB_FUNCTION_BULK_OR_INTERRUPT_TRANSFER:
  PipeHandle           = 81b44acc [endpoint 0x00000081]
  TransferFlags        = 00000003 (USBD_TRANSFER_DIRECTION_IN, USBD_SHORT_TRANSFER_OK)
  TransferBufferLength = 00000100
  TransferBuffer       = 00000000
  TransferBufferMDL    = 8216a008
  UrbLink              = 00000000
[304344 ms] UsbSnoop - MyInternalIOCTLCompletion(f88c7db0) : fido=823a0430, Irp=81b4e870, Context=81ad07d0, IRQL=2
[304344 ms]  <<<  URB 403 coming back  <<< 
-- URB_FUNCTION_BULK_OR_INTERRUPT_TRANSFER:
  PipeHandle           = 81b44acc [endpoint 0x00000081]
  TransferFlags        = 00000003 (USBD_TRANSFER_DIRECTION_IN, USBD_SHORT_TRANSFER_OK)
  TransferBufferLength = 0000000a
  TransferBuffer       = 00000000
  TransferBufferMDL    = 8216a008
    00000000: 00 00 00 04 00 12 00 00 07 d0
  UrbLink              = 00000000
[304374 ms] UsbSnoop - DispatchAny(f88c6610) : IRP_MJ_INTERNAL_DEVICE_CONTROL
[304374 ms] UsbSnoop - MyDispatchInternalIOCTL(f88c7e80) : fdo=82142030, Irp=81b4e870, IRQL=2
[304374 ms]  >>>  URB 404 going down  >>> 
-- URB_FUNCTION_BULK_OR_INTERRUPT_TRANSFER:
  PipeHandle           = 81b44aec [endpoint 0x00000002]
  TransferFlags        = 00000000 (USBD_TRANSFER_DIRECTION_OUT, ~USBD_SHORT_TRANSFER_OK)
  TransferBufferLength = 00000007
  TransferBuffer       = 00000000
  TransferBufferMDL    = 8216a008
    00000000: 00 00 00 02 05 e0 00
  UrbLink              = 00000000
[304374 ms] UsbSnoop - MyInternalIOCTLCompletion(f88c7db0) : fido=823a0430, Irp=81b4e870, Context=81ad07d0, IRQL=2
[304374 ms]  <<<  URB 404 coming back  <<< 
-- URB_FUNCTION_BULK_OR_INTERRUPT_TRANSFER:
  PipeHandle           = 81b44aec [endpoint 0x00000002]
  TransferFlags        = 00000000 (USBD_TRANSFER_DIRECTION_OUT, ~USBD_SHORT_TRANSFER_OK)
  TransferBufferLength = 00000007
  TransferBuffer       = 00000000
  TransferBufferMDL    = 8216a008
  UrbLink              = 00000000
[304384 ms] UsbSnoop - DispatchAny(f88c6610) : IRP_MJ_INTERNAL_DEVICE_CONTROL
[304384 ms] UsbSnoop - MyDispatchInternalIOCTL(f88c7e80) : fdo=82142030, Irp=81b4e870, IRQL=2
[304384 ms]  >>>  URB 405 going down  >>> 
-- URB_FUNCTION_BULK_OR_INTERRUPT_TRANSFER:
  PipeHandle           = 81b44aec [endpoint 0x00000002]
  TransferFlags        = 00000000 (USBD_TRANSFER_DIRECTION_OUT, ~USBD_SHORT_TRANSFER_OK)
  TransferBufferLength = 00000022
  TransferBuffer       = 00000000
  TransferBufferMDL    = 8216a008
    00000000: 00 00 00 1d 04 00 00 00 17 00 09 00 00 00 06 00
    00000010: 02 00 03 00 05 00 01 00 41 00 42 00 01 00 01 00
    00000020: 01 01
  UrbLink              = 00000000
[304384 ms] UsbSnoop - MyInternalIOCTLCompletion(f88c7db0) : fido=823a0430, Irp=81b4e870, Context=822af798, IRQL=2
[304384 ms]  <<<  URB 405 coming back  <<< 
-- URB_FUNCTION_BULK_OR_INTERRUPT_TRANSFER:
  PipeHandle           = 81b44aec [endpoint 0x00000002]
  TransferFlags        = 00000000 (USBD_TRANSFER_DIRECTION_OUT, ~USBD_SHORT_TRANSFER_OK)
  TransferBufferLength = 00000022
  TransferBuffer       = 00000000
  TransferBufferMDL    = 8216a008
  UrbLink              = 00000000
[304394 ms] UsbSnoop - DispatchAny(f88c6610) : IRP_MJ_INTERNAL_DEVICE_CONTROL
[304394 ms] UsbSnoop - MyDispatchInternalIOCTL(f88c7e80) : fdo=82142030, Irp=81b4e870, IRQL=2
[304394 ms]  >>>  URB 406 going down  >>> 
-- URB_FUNCTION_BULK_OR_INTERRUPT_TRANSFER:
  PipeHandle           = 81b44acc [endpoint 0x00000081]
  TransferFlags        = 00000003 (USBD_TRANSFER_DIRECTION_IN, USBD_SHORT_TRANSFER_OK)
  TransferBufferLength = 00000100
  TransferBuffer       = 00000000
  TransferBufferMDL    = 8216a008
  UrbLink              = 00000000
[304394 ms] UsbSnoop - MyInternalIOCTLCompletion(f88c7db0) : fido=823a0430, Irp=81b4e870, Context=81af3568, IRQL=2
[304394 ms]  <<<  URB 406 coming back  <<< 
-- URB_FUNCTION_BULK_OR_INTERRUPT_TRANSFER:
  PipeHandle           = 81b44acc [endpoint 0x00000081]
  TransferFlags        = 00000003 (USBD_TRANSFER_DIRECTION_IN, USBD_SHORT_TRANSFER_OK)
  TransferBufferLength = 00000007
  TransferBuffer       = 00000000
  TransferBufferMDL    = 8216a008
    00000000: 00 00 00 02 05 e0 00
  UrbLink              = 00000000
[304434 ms] UsbSnoop - DispatchAny(f88c6610) : IRP_MJ_INTERNAL_DEVICE_CONTROL
[304434 ms] UsbSnoop - MyDispatchInternalIOCTL(f88c7e80) : fdo=82142030, Irp=81b4e870, IRQL=2
[304434 ms]  >>>  URB 407 going down  >>> 
-- URB_FUNCTION_BULK_OR_INTERRUPT_TRANSFER:
  PipeHandle           = 81b44acc [endpoint 0x00000081]
  TransferFlags        = 00000003 (USBD_TRANSFER_DIRECTION_IN, USBD_SHORT_TRANSFER_OK)
  TransferBufferLength = 00000100
  TransferBuffer       = 00000000
  TransferBufferMDL    = 8216a008
  UrbLink              = 00000000
[304434 ms] UsbSnoop - MyInternalIOCTLCompletion(f88c7db0) : fido=823a0430, Irp=81b4e870, Context=81ad07d0, IRQL=2
[304434 ms]  <<<  URB 407 coming back  <<< 
-- URB_FUNCTION_BULK_OR_INTERRUPT_TRANSFER:
  PipeHandle           = 81b44acc [endpoint 0x00000081]
  TransferFlags        = 00000003 (USBD_TRANSFER_DIRECTION_IN, USBD_SHORT_TRANSFER_OK)
  TransferBufferLength = 00000005
  TransferBuffer       = 00000000
  TransferBufferMDL    = 8216a008
    00000000: 00 00 00 32 04
  UrbLink              = 00000000
[304464 ms] UsbSnoop - DispatchAny(f88c6610) : IRP_MJ_INTERNAL_DEVICE_CONTROL
[304464 ms] UsbSnoop - MyDispatchInternalIOCTL(f88c7e80) : fdo=82142030, Irp=81b4e870, IRQL=2
[304464 ms]  >>>  URB 408 going down  >>> 
-- URB_FUNCTION_BULK_OR_INTERRUPT_TRANSFER:
  PipeHandle           = 81b44acc [endpoint 0x00000081]
  TransferFlags        = 00000003 (USBD_TRANSFER_DIRECTION_IN, USBD_SHORT_TRANSFER_OK)
  TransferBufferLength = 00000100
  TransferBuffer       = 00000000
  TransferBufferMDL    = 8216a008
  UrbLink              = 00000000
[304464 ms] UsbSnoop - MyInternalIOCTLCompletion(f88c7db0) : fido=823a0430, Irp=81b4e870, Context=81af3568, IRQL=2
[304464 ms]  <<<  URB 408 coming back  <<< 
-- URB_FUNCTION_BULK_OR_INTERRUPT_TRANSFER:
  PipeHandle           = 81b44acc [endpoint 0x00000081]
  TransferFlags        = 00000003 (USBD_TRANSFER_DIRECTION_IN, USBD_SHORT_TRANSFER_OK)
  TransferBufferLength = 00000032
  TransferBuffer       = 00000000
  TransferBufferMDL    = 8216a008
    00000000: 00 00 00 2c 00 0a 03 63 68 31 00 00 00 06 00 02
    00000010: 00 00 04 f0 04 00 1f 00 03 00 00 01 00 00 05 02
    00000020: 00 01 00 00 04 00 00 00 0c 00 41 00 00 01 00 00
    00000030: 42 01
  UrbLink              = 00000000
[304494 ms] UsbSnoop - DispatchAny(f88c6610) : IRP_MJ_INTERNAL_DEVICE_CONTROL
[304494 ms] UsbSnoop - MyDispatchInternalIOCTL(f88c7e80) : fdo=82142030, Irp=81b4e870, IRQL=2
[304494 ms]  >>>  URB 409 going down  >>> 
-- URB_FUNCTION_BULK_OR_INTERRUPT_TRANSFER:
  PipeHandle           = 81b44aec [endpoint 0x00000002]
  TransferFlags        = 00000000 (USBD_TRANSFER_DIRECTION_OUT, ~USBD_SHORT_TRANSFER_OK)
  TransferBufferLength = 00000007
  TransferBuffer       = 00000000
  TransferBufferMDL    = 8216a008
    00000000: 00 00 00 02 05 e0 00
  UrbLink              = 00000000
[304494 ms] UsbSnoop - MyInternalIOCTLCompletion(f88c7db0) : fido=823a0430, Irp=81b4e870, Context=81ad5658, IRQL=2
[304494 ms]  <<<  URB 409 coming back  <<< 
-- URB_FUNCTION_BULK_OR_INTERRUPT_TRANSFER:
  PipeHandle           = 81b44aec [endpoint 0x00000002]
  TransferFlags        = 00000000 (USBD_TRANSFER_DIRECTION_OUT, ~USBD_SHORT_TRANSFER_OK)
  TransferBufferLength = 00000007
  TransferBuffer       = 00000000
  TransferBufferMDL    = 8216a008
  UrbLink              = 00000000
[304504 ms] UsbSnoop - DispatchAny(f88c6610) : IRP_MJ_INTERNAL_DEVICE_CONTROL
[304504 ms] UsbSnoop - MyDispatchInternalIOCTL(f88c7e80) : fdo=82142030, Irp=81b4e870, IRQL=2
[304504 ms]  >>>  URB 410 going down  >>> 
-- URB_FUNCTION_BULK_OR_INTERRUPT_TRANSFER:
  PipeHandle           = 81b44acc [endpoint 0x00000081]
  TransferFlags        = 00000003 (USBD_TRANSFER_DIRECTION_IN, USBD_SHORT_TRANSFER_OK)
  TransferBufferLength = 00000100
  TransferBuffer       = 00000000
  TransferBufferMDL    = 8216a008
  UrbLink              = 00000000
[304504 ms] UsbSnoop - MyInternalIOCTLCompletion(f88c7db0) : fido=823a0430, Irp=81b4e870, Context=81af1cb8, IRQL=2
[304504 ms]  <<<  URB 410 coming back  <<< 
-- URB_FUNCTION_BULK_OR_INTERRUPT_TRANSFER:
  PipeHandle           = 81b44acc [endpoint 0x00000081]
  TransferFlags        = 00000003 (USBD_TRANSFER_DIRECTION_IN, USBD_SHORT_TRANSFER_OK)
  TransferBufferLength = 00000005
  TransferBuffer       = 00000000
  TransferBufferMDL    = 8216a008
    00000000: 00 00 00 3a 04
  UrbLink              = 00000000
[304534 ms] UsbSnoop - DispatchAny(f88c6610) : IRP_MJ_INTERNAL_DEVICE_CONTROL
[304534 ms] UsbSnoop - MyDispatchInternalIOCTL(f88c7e80) : fdo=82142030, Irp=81b4e870, IRQL=2
[304534 ms]  >>>  URB 411 going down  >>> 
-- URB_FUNCTION_BULK_OR_INTERRUPT_TRANSFER:
  PipeHandle           = 81b44acc [endpoint 0x00000081]
  TransferFlags        = 00000003 (USBD_TRANSFER_DIRECTION_IN, USBD_SHORT_TRANSFER_OK)
  TransferBufferLength = 00000100
  TransferBuffer       = 00000000
  TransferBufferMDL    = 8216a008
  UrbLink              = 00000000
[304534 ms] UsbSnoop - MyInternalIOCTLCompletion(f88c7db0) : fido=823a0430, Irp=81b4e870, Context=822af798, IRQL=2
[304534 ms]  <<<  URB 411 coming back  <<< 
-- URB_FUNCTION_BULK_OR_INTERRUPT_TRANSFER:
  PipeHandle           = 81b44acc [endpoint 0x00000081]
  TransferFlags        = 00000003 (USBD_TRANSFER_DIRECTION_IN, USBD_SHORT_TRANSFER_OK)
  TransferBufferLength = 0000003a
  TransferBuffer       = 00000000
  TransferBufferMDL    = 8216a008
    00000000: 00 00 00 34 00 0a 03 63 68 31 00 07 61 74 6f 6d
    00000010: 65 31 65 00 00 06 00 02 00 00 04 f0 04 00 0b 00
    00000020: 03 00 00 01 00 00 05 02 00 01 00 00 04 00 00 03
    00000030: 0e 00 41 00 00 01 00 00 42 01
  UrbLink              = 00000000
[304564 ms] UsbSnoop - DispatchAny(f88c6610) : IRP_MJ_INTERNAL_DEVICE_CONTROL
[304564 ms] UsbSnoop - MyDispatchInternalIOCTL(f88c7e80) : fdo=82142030, Irp=81b4e870, IRQL=2
[304564 ms]  >>>  URB 412 going down  >>> 
-- URB_FUNCTION_BULK_OR_INTERRUPT_TRANSFER:
  PipeHandle           = 81b44aec [endpoint 0x00000002]
  TransferFlags        = 00000000 (USBD_TRANSFER_DIRECTION_OUT, ~USBD_SHORT_TRANSFER_OK)
  TransferBufferLength = 00000007
  TransferBuffer       = 00000000
  TransferBufferMDL    = 8216a008
    00000000: 00 00 00 02 05 e0 00
  UrbLink              = 00000000
[304564 ms] UsbSnoop - MyInternalIOCTLCompletion(f88c7db0) : fido=823a0430, Irp=81b4e870, Context=81ad5658, IRQL=2
[304564 ms]  <<<  URB 412 coming back  <<< 
-- URB_FUNCTION_BULK_OR_INTERRUPT_TRANSFER:
  PipeHandle           = 81b44aec [endpoint 0x00000002]
  TransferFlags        = 00000000 (USBD_TRANSFER_DIRECTION_OUT, ~USBD_SHORT_TRANSFER_OK)
  TransferBufferLength = 00000007
  TransferBuffer       = 00000000
  TransferBufferMDL    = 8216a008
  UrbLink              = 00000000
[304574 ms] UsbSnoop - DispatchAny(f88c6610) : IRP_MJ_INTERNAL_DEVICE_CONTROL
[304574 ms] UsbSnoop - MyDispatchInternalIOCTL(f88c7e80) : fdo=82142030, Irp=81b4e870, IRQL=2
[304574 ms]  >>>  URB 413 going down  >>> 
-- URB_FUNCTION_BULK_OR_INTERRUPT_TRANSFER:
  PipeHandle           = 81b44acc [endpoint 0x00000081]
  TransferFlags        = 00000003 (USBD_TRANSFER_DIRECTION_IN, USBD_SHORT_TRANSFER_OK)
  TransferBufferLength = 00000100
  TransferBuffer       = 00000000
  TransferBufferMDL    = 8216a008
  UrbLink              = 00000000
[304574 ms] UsbSnoop - MyInternalIOCTLCompletion(f88c7db0) : fido=823a0430, Irp=81b4e870, Context=822af798, IRQL=2
[304574 ms]  <<<  URB 413 coming back  <<< 
-- URB_FUNCTION_BULK_OR_INTERRUPT_TRANSFER:
  PipeHandle           = 81b44acc [endpoint 0x00000081]
  TransferFlags        = 00000003 (USBD_TRANSFER_DIRECTION_IN, USBD_SHORT_TRANSFER_OK)
  TransferBufferLength = 00000005
  TransferBuffer       = 00000000
  TransferBufferMDL    = 8216a008
    00000000: 00 00 00 3b 04
  UrbLink              = 00000000
[304604 ms] UsbSnoop - DispatchAny(f88c6610) : IRP_MJ_INTERNAL_DEVICE_CONTROL
[304604 ms] UsbSnoop - MyDispatchInternalIOCTL(f88c7e80) : fdo=82142030, Irp=81b4e870, IRQL=2
[304604 ms]  >>>  URB 414 going down  >>> 
-- URB_FUNCTION_BULK_OR_INTERRUPT_TRANSFER:
  PipeHandle           = 81b44acc [endpoint 0x00000081]
  TransferFlags        = 00000003 (USBD_TRANSFER_DIRECTION_IN, USBD_SHORT_TRANSFER_OK)
  TransferBufferLength = 00000100
  TransferBuffer       = 00000000
  TransferBufferMDL    = 8216a008
  UrbLink              = 00000000
[304604 ms] UsbSnoop - MyInternalIOCTLCompletion(f88c7db0) : fido=823a0430, Irp=81b4e870, Context=81adbf80, IRQL=2
[304604 ms]  <<<  URB 414 coming back  <<< 
-- URB_FUNCTION_BULK_OR_INTERRUPT_TRANSFER:
  PipeHandle           = 81b44acc [endpoint 0x00000081]
  TransferFlags        = 00000003 (USBD_TRANSFER_DIRECTION_IN, USBD_SHORT_TRANSFER_OK)
  TransferBufferLength = 0000003b
  TransferBuffer       = 00000000
  TransferBufferMDL    = 8216a008
    00000000: 00 00 00 35 00 0a 03 63 68 31 00 08 63 72 69 73
    00000010: 74 61 6c 6f 00 00 06 00 02 00 00 04 f0 04 00 0b
    00000020: 00 03 00 00 01 00 00 05 02 00 01 00 00 04 00 00
    00000030: 03 29 00 41 00 00 01 00 00 42 01
  UrbLink              = 00000000
[304634 ms] UsbSnoop - DispatchAny(f88c6610) : IRP_MJ_INTERNAL_DEVICE_CONTROL
[304634 ms] UsbSnoop - MyDispatchInternalIOCTL(f88c7e80) : fdo=82142030, Irp=81b4e870, IRQL=2
[304634 ms]  >>>  URB 415 going down  >>> 
-- URB_FUNCTION_BULK_OR_INTERRUPT_TRANSFER:
  PipeHandle           = 81b44aec [endpoint 0x00000002]
  TransferFlags        = 00000000 (USBD_TRANSFER_DIRECTION_OUT, ~USBD_SHORT_TRANSFER_OK)
  TransferBufferLength = 00000007
  TransferBuffer       = 00000000
  TransferBufferMDL    = 8216a008
    00000000: 00 00 00 02 05 e0 00
  UrbLink              = 00000000
[304635 ms] UsbSnoop - MyInternalIOCTLCompletion(f88c7db0) : fido=823a0430, Irp=81b4e870, Context=81ad07d0, IRQL=2
[304635 ms]  <<<  URB 415 coming back  <<< 
-- URB_FUNCTION_BULK_OR_INTERRUPT_TRANSFER:
  PipeHandle           = 81b44aec [endpoint 0x00000002]
  TransferFlags        = 00000000 (USBD_TRANSFER_DIRECTION_OUT, ~USBD_SHORT_TRANSFER_OK)
  TransferBufferLength = 00000007
  TransferBuffer       = 00000000
  TransferBufferMDL    = 8216a008
  UrbLink              = 00000000
[304644 ms] UsbSnoop - DispatchAny(f88c6610) : IRP_MJ_INTERNAL_DEVICE_CONTROL
[304644 ms] UsbSnoop - MyDispatchInternalIOCTL(f88c7e80) : fdo=82142030, Irp=81b4e870, IRQL=2
[304644 ms]  >>>  URB 416 going down  >>> 
-- URB_FUNCTION_BULK_OR_INTERRUPT_TRANSFER:
  PipeHandle           = 81b44acc [endpoint 0x00000081]
  TransferFlags        = 00000003 (USBD_TRANSFER_DIRECTION_IN, USBD_SHORT_TRANSFER_OK)
  TransferBufferLength = 00000100
  TransferBuffer       = 00000000
  TransferBufferMDL    = 8216a008
  UrbLink              = 00000000
[304644 ms] UsbSnoop - MyInternalIOCTLCompletion(f88c7db0) : fido=823a0430, Irp=81b4e870, Context=81af1cb8, IRQL=2
[304644 ms]  <<<  URB 416 coming back  <<< 
-- URB_FUNCTION_BULK_OR_INTERRUPT_TRANSFER:
  PipeHandle           = 81b44acc [endpoint 0x00000081]
  TransferFlags        = 00000003 (USBD_TRANSFER_DIRECTION_IN, USBD_SHORT_TRANSFER_OK)
  TransferBufferLength = 00000005
  TransferBuffer       = 00000000
  TransferBufferMDL    = 8216a008
    00000000: 00 00 00 3b 04
  UrbLink              = 00000000
[304674 ms] UsbSnoop - DispatchAny(f88c6610) : IRP_MJ_INTERNAL_DEVICE_CONTROL
[304674 ms] UsbSnoop - MyDispatchInternalIOCTL(f88c7e80) : fdo=82142030, Irp=81b4e870, IRQL=2
[304674 ms]  >>>  URB 417 going down  >>> 
-- URB_FUNCTION_BULK_OR_INTERRUPT_TRANSFER:
  PipeHandle           = 81b44acc [endpoint 0x00000081]
  TransferFlags        = 00000003 (USBD_TRANSFER_DIRECTION_IN, USBD_SHORT_TRANSFER_OK)
  TransferBufferLength = 00000100
  TransferBuffer       = 00000000
  TransferBufferMDL    = 8216a008
  UrbLink              = 00000000
[304675 ms] UsbSnoop - MyInternalIOCTLCompletion(f88c7db0) : fido=823a0430, Irp=81b4e870, Context=81ad5658, IRQL=2
[304675 ms]  <<<  URB 417 coming back  <<< 
-- URB_FUNCTION_BULK_OR_INTERRUPT_TRANSFER:
  PipeHandle           = 81b44acc [endpoint 0x00000081]
  TransferFlags        = 00000003 (USBD_TRANSFER_DIRECTION_IN, USBD_SHORT_TRANSFER_OK)
  TransferBufferLength = 0000003b
  TransferBuffer       = 00000000
  TransferBufferMDL    = 8216a008
    00000000: 00 00 00 35 00 0a 03 63 68 31 00 08 65 6e 65 72
    00000010: 61 74 6f 6d 00 00 06 00 02 00 00 04 f0 04 00 0b
    00000020: 00 03 00 00 01 00 00 05 02 00 01 00 00 04 00 00
    00000030: 01 55 00 41 00 00 01 00 00 42 01
  UrbLink              = 00000000
[304704 ms] UsbSnoop - DispatchAny(f88c6610) : IRP_MJ_INTERNAL_DEVICE_CONTROL
[304704 ms] UsbSnoop - MyDispatchInternalIOCTL(f88c7e80) : fdo=82142030, Irp=81b4e870, IRQL=2
[304704 ms]  >>>  URB 418 going down  >>> 
-- URB_FUNCTION_BULK_OR_INTERRUPT_TRANSFER:
  PipeHandle           = 81b44aec [endpoint 0x00000002]
  TransferFlags        = 00000000 (USBD_TRANSFER_DIRECTION_OUT, ~USBD_SHORT_TRANSFER_OK)
  TransferBufferLength = 00000007
  TransferBuffer       = 00000000
  TransferBufferMDL    = 8216a008
    00000000: 00 00 00 02 05 e0 00
  UrbLink              = 00000000
[304705 ms] UsbSnoop - MyInternalIOCTLCompletion(f88c7db0) : fido=823a0430, Irp=81b4e870, Context=822af798, IRQL=2
[304705 ms]  <<<  URB 418 coming back  <<< 
-- URB_FUNCTION_BULK_OR_INTERRUPT_TRANSFER:
  PipeHandle           = 81b44aec [endpoint 0x00000002]
  TransferFlags        = 00000000 (USBD_TRANSFER_DIRECTION_OUT, ~USBD_SHORT_TRANSFER_OK)
  TransferBufferLength = 00000007
  TransferBuffer       = 00000000
  TransferBufferMDL    = 8216a008
  UrbLink              = 00000000
[304714 ms] UsbSnoop - DispatchAny(f88c6610) : IRP_MJ_INTERNAL_DEVICE_CONTROL
[304714 ms] UsbSnoop - MyDispatchInternalIOCTL(f88c7e80) : fdo=82142030, Irp=81b4e870, IRQL=2
[304714 ms]  >>>  URB 419 going down  >>> 
-- URB_FUNCTION_BULK_OR_INTERRUPT_TRANSFER:
  PipeHandle           = 81b44acc [endpoint 0x00000081]
  TransferFlags        = 00000003 (USBD_TRANSFER_DIRECTION_IN, USBD_SHORT_TRANSFER_OK)
  TransferBufferLength = 00000100
  TransferBuffer       = 00000000
  TransferBufferMDL    = 8216a008
  UrbLink              = 00000000
[304715 ms] UsbSnoop - MyInternalIOCTLCompletion(f88c7db0) : fido=823a0430, Irp=81b4e870, Context=81adbf80, IRQL=2
[304715 ms]  <<<  URB 419 coming back  <<< 
-- URB_FUNCTION_BULK_OR_INTERRUPT_TRANSFER:
  PipeHandle           = 81b44acc [endpoint 0x00000081]
  TransferFlags        = 00000003 (USBD_TRANSFER_DIRECTION_IN, USBD_SHORT_TRANSFER_OK)
  TransferBufferLength = 00000005
  TransferBuffer       = 00000000
  TransferBufferMDL    = 8216a008
    00000000: 00 00 00 38 04
  UrbLink              = 00000000
[304745 ms] UsbSnoop - DispatchAny(f88c6610) : IRP_MJ_INTERNAL_DEVICE_CONTROL
[304745 ms] UsbSnoop - MyDispatchInternalIOCTL(f88c7e80) : fdo=82142030, Irp=81b4e870, IRQL=2
[304745 ms]  >>>  URB 420 going down  >>> 
-- URB_FUNCTION_BULK_OR_INTERRUPT_TRANSFER:
  PipeHandle           = 81b44acc [endpoint 0x00000081]
  TransferFlags        = 00000003 (USBD_TRANSFER_DIRECTION_IN, USBD_SHORT_TRANSFER_OK)
  TransferBufferLength = 00000100
  TransferBuffer       = 00000000
  TransferBufferMDL    = 8216a008
  UrbLink              = 00000000
[304745 ms] UsbSnoop - MyInternalIOCTLCompletion(f88c7db0) : fido=823a0430, Irp=81b4e870, Context=81ad5658, IRQL=2
[304745 ms]  <<<  URB 420 coming back  <<< 
-- URB_FUNCTION_BULK_OR_INTERRUPT_TRANSFER:
  PipeHandle           = 81b44acc [endpoint 0x00000081]
  TransferFlags        = 00000003 (USBD_TRANSFER_DIRECTION_IN, USBD_SHORT_TRANSFER_OK)
  TransferBufferLength = 00000038
  TransferBuffer       = 00000000
  TransferBufferMDL    = 8216a008
    00000000: 00 00 00 32 00 0a 03 63 68 31 00 05 76 73 65 70
    00000010: 72 00 00 06 00 02 00 00 04 f0 04 00 0b 00 03 00
    00000020: 00 01 00 00 05 02 00 01 00 00 04 00 00 02 30 00
    00000030: 41 00 00 01 00 00 42 01
  UrbLink              = 00000000
[304775 ms] UsbSnoop - DispatchAny(f88c6610) : IRP_MJ_INTERNAL_DEVICE_CONTROL
[304775 ms] UsbSnoop - MyDispatchInternalIOCTL(f88c7e80) : fdo=82142030, Irp=81b4e870, IRQL=2
[304775 ms]  >>>  URB 421 going down  >>> 
-- URB_FUNCTION_BULK_OR_INTERRUPT_TRANSFER:
  PipeHandle           = 81b44aec [endpoint 0x00000002]
  TransferFlags        = 00000000 (USBD_TRANSFER_DIRECTION_OUT, ~USBD_SHORT_TRANSFER_OK)
  TransferBufferLength = 00000007
  TransferBuffer       = 00000000
  TransferBufferMDL    = 8216a008
    00000000: 00 00 00 02 05 e0 00
  UrbLink              = 00000000
[304775 ms] UsbSnoop - MyInternalIOCTLCompletion(f88c7db0) : fido=823a0430, Irp=81b4e870, Context=81adbf80, IRQL=2
[304775 ms]  <<<  URB 421 coming back  <<< 
-- URB_FUNCTION_BULK_OR_INTERRUPT_TRANSFER:
  PipeHandle           = 81b44aec [endpoint 0x00000002]
  TransferFlags        = 00000000 (USBD_TRANSFER_DIRECTION_OUT, ~USBD_SHORT_TRANSFER_OK)
  TransferBufferLength = 00000007
  TransferBuffer       = 00000000
  TransferBufferMDL    = 8216a008
  UrbLink              = 00000000
[304785 ms] UsbSnoop - DispatchAny(f88c6610) : IRP_MJ_INTERNAL_DEVICE_CONTROL
[304785 ms] UsbSnoop - MyDispatchInternalIOCTL(f88c7e80) : fdo=82142030, Irp=81b4e870, IRQL=2
[304785 ms]  >>>  URB 422 going down  >>> 
-- URB_FUNCTION_BULK_OR_INTERRUPT_TRANSFER:
  PipeHandle           = 81b44acc [endpoint 0x00000081]
  TransferFlags        = 00000003 (USBD_TRANSFER_DIRECTION_IN, USBD_SHORT_TRANSFER_OK)
  TransferBufferLength = 00000100
  TransferBuffer       = 00000000
  TransferBufferMDL    = 8216a008
  UrbLink              = 00000000
[304785 ms] UsbSnoop - MyInternalIOCTLCompletion(f88c7db0) : fido=823a0430, Irp=81b4e870, Context=81af3568, IRQL=2
[304785 ms]  <<<  URB 422 coming back  <<< 
-- URB_FUNCTION_BULK_OR_INTERRUPT_TRANSFER:
  PipeHandle           = 81b44acc [endpoint 0x00000081]
  TransferFlags        = 00000003 (USBD_TRANSFER_DIRECTION_IN, USBD_SHORT_TRANSFER_OK)
  TransferBufferLength = 00000005
  TransferBuffer       = 00000000
  TransferBufferMDL    = 8216a008
    00000000: 00 00 00 32 04
  UrbLink              = 00000000
[304815 ms] UsbSnoop - DispatchAny(f88c6610) : IRP_MJ_INTERNAL_DEVICE_CONTROL
[304815 ms] UsbSnoop - MyDispatchInternalIOCTL(f88c7e80) : fdo=82142030, Irp=81b4e870, IRQL=2
[304815 ms]  >>>  URB 423 going down  >>> 
-- URB_FUNCTION_BULK_OR_INTERRUPT_TRANSFER:
  PipeHandle           = 81b44acc [endpoint 0x00000081]
  TransferFlags        = 00000003 (USBD_TRANSFER_DIRECTION_IN, USBD_SHORT_TRANSFER_OK)
  TransferBufferLength = 00000100
  TransferBuffer       = 00000000
  TransferBufferMDL    = 8216a008
  UrbLink              = 00000000
[304815 ms] UsbSnoop - MyInternalIOCTLCompletion(f88c7db0) : fido=823a0430, Irp=81b4e870, Context=81ad5658, IRQL=2
[304815 ms]  <<<  URB 423 coming back  <<< 
-- URB_FUNCTION_BULK_OR_INTERRUPT_TRANSFER:
  PipeHandle           = 81b44acc [endpoint 0x00000081]
  TransferFlags        = 00000003 (USBD_TRANSFER_DIRECTION_IN, USBD_SHORT_TRANSFER_OK)
  TransferBufferLength = 00000032
  TransferBuffer       = 00000000
  TransferBufferMDL    = 8216a008
    00000000: 00 00 00 2c 00 0a 03 63 68 32 00 00 00 06 00 02
    00000010: 00 00 04 f0 04 00 1f 00 03 00 00 01 00 00 05 02
    00000020: 00 01 00 00 04 00 00 00 0c 00 41 00 00 01 00 00
    00000030: 42 01
  UrbLink              = 00000000
[304845 ms] UsbSnoop - DispatchAny(f88c6610) : IRP_MJ_INTERNAL_DEVICE_CONTROL
[304845 ms] UsbSnoop - MyDispatchInternalIOCTL(f88c7e80) : fdo=82142030, Irp=81b4e870, IRQL=2
[304845 ms]  >>>  URB 424 going down  >>> 
-- URB_FUNCTION_BULK_OR_INTERRUPT_TRANSFER:
  PipeHandle           = 81b44aec [endpoint 0x00000002]
  TransferFlags        = 00000000 (USBD_TRANSFER_DIRECTION_OUT, ~USBD_SHORT_TRANSFER_OK)
  TransferBufferLength = 00000007
  TransferBuffer       = 00000000
  TransferBufferMDL    = 8216a008
    00000000: 00 00 00 02 05 e0 00
  UrbLink              = 00000000
[304845 ms] UsbSnoop - MyInternalIOCTLCompletion(f88c7db0) : fido=823a0430, Irp=81b4e870, Context=81ad07d0, IRQL=2
[304845 ms]  <<<  URB 424 coming back  <<< 
-- URB_FUNCTION_BULK_OR_INTERRUPT_TRANSFER:
  PipeHandle           = 81b44aec [endpoint 0x00000002]
  TransferFlags        = 00000000 (USBD_TRANSFER_DIRECTION_OUT, ~USBD_SHORT_TRANSFER_OK)
  TransferBufferLength = 00000007
  TransferBuffer       = 00000000
  TransferBufferMDL    = 8216a008
  UrbLink              = 00000000
[304855 ms] UsbSnoop - DispatchAny(f88c6610) : IRP_MJ_INTERNAL_DEVICE_CONTROL
[304855 ms] UsbSnoop - MyDispatchInternalIOCTL(f88c7e80) : fdo=82142030, Irp=81b4e870, IRQL=2
[304855 ms]  >>>  URB 425 going down  >>> 
-- URB_FUNCTION_BULK_OR_INTERRUPT_TRANSFER:
  PipeHandle           = 81b44acc [endpoint 0x00000081]
  TransferFlags        = 00000003 (USBD_TRANSFER_DIRECTION_IN, USBD_SHORT_TRANSFER_OK)
  TransferBufferLength = 00000100
  TransferBuffer       = 00000000
  TransferBufferMDL    = 8216a008
  UrbLink              = 00000000
[304855 ms] UsbSnoop - MyInternalIOCTLCompletion(f88c7db0) : fido=823a0430, Irp=81b4e870, Context=81ad5658, IRQL=2
[304855 ms]  <<<  URB 425 coming back  <<< 
-- URB_FUNCTION_BULK_OR_INTERRUPT_TRANSFER:
  PipeHandle           = 81b44acc [endpoint 0x00000081]
  TransferFlags        = 00000003 (USBD_TRANSFER_DIRECTION_IN, USBD_SHORT_TRANSFER_OK)
  TransferBufferLength = 00000005
  TransferBuffer       = 00000000
  TransferBufferMDL    = 8216a008
    00000000: 00 00 00 3a 04
  UrbLink              = 00000000
[304885 ms] UsbSnoop - DispatchAny(f88c6610) : IRP_MJ_INTERNAL_DEVICE_CONTROL
[304885 ms] UsbSnoop - MyDispatchInternalIOCTL(f88c7e80) : fdo=82142030, Irp=81b4e870, IRQL=2
[304885 ms]  >>>  URB 426 going down  >>> 
-- URB_FUNCTION_BULK_OR_INTERRUPT_TRANSFER:
  PipeHandle           = 81b44acc [endpoint 0x00000081]
  TransferFlags        = 00000003 (USBD_TRANSFER_DIRECTION_IN, USBD_SHORT_TRANSFER_OK)
  TransferBufferLength = 00000100
  TransferBuffer       = 00000000
  TransferBufferMDL    = 8216a008
  UrbLink              = 00000000
[304885 ms] UsbSnoop - MyInternalIOCTLCompletion(f88c7db0) : fido=823a0430, Irp=81b4e870, Context=822af798, IRQL=2
[304885 ms]  <<<  URB 426 coming back  <<< 
-- URB_FUNCTION_BULK_OR_INTERRUPT_TRANSFER:
  PipeHandle           = 81b44acc [endpoint 0x00000081]
  TransferFlags        = 00000003 (USBD_TRANSFER_DIRECTION_IN, USBD_SHORT_TRANSFER_OK)
  TransferBufferLength = 0000003a
  TransferBuffer       = 00000000
  TransferBufferMDL    = 8216a008
    00000000: 00 00 00 34 00 0a 03 63 68 32 00 07 65 6c 6c 69
    00000010: 6e 67 68 00 00 06 00 02 00 00 04 f0 04 00 0b 00
    00000020: 03 00 00 01 00 00 05 02 00 01 00 00 04 00 00 01
    00000030: 0b 00 41 00 00 01 00 00 42 01
  UrbLink              = 00000000
[304915 ms] UsbSnoop - DispatchAny(f88c6610) : IRP_MJ_INTERNAL_DEVICE_CONTROL
[304915 ms] UsbSnoop - MyDispatchInternalIOCTL(f88c7e80) : fdo=82142030, Irp=81b5d388, IRQL=2
[304915 ms]  >>>  URB 427 going down  >>> 
-- URB_FUNCTION_BULK_OR_INTERRUPT_TRANSFER:
  PipeHandle           = 81b44aec [endpoint 0x00000002]
  TransferFlags        = 00000000 (USBD_TRANSFER_DIRECTION_OUT, ~USBD_SHORT_TRANSFER_OK)
  TransferBufferLength = 00000007
  TransferBuffer       = 00000000
  TransferBufferMDL    = 81cc56a8
    00000000: 00 00 00 02 05 e0 00
  UrbLink              = 00000000
[304915 ms] UsbSnoop - MyInternalIOCTLCompletion(f88c7db0) : fido=823a0430, Irp=81b5d388, Context=81ad07d0, IRQL=2
[304915 ms]  <<<  URB 427 coming back  <<< 
-- URB_FUNCTION_BULK_OR_INTERRUPT_TRANSFER:
  PipeHandle           = 81b44aec [endpoint 0x00000002]
  TransferFlags        = 00000000 (USBD_TRANSFER_DIRECTION_OUT, ~USBD_SHORT_TRANSFER_OK)
  TransferBufferLength = 00000007
  TransferBuffer       = 00000000
  TransferBufferMDL    = 81cc56a8
  UrbLink              = 00000000
[304925 ms] UsbSnoop - DispatchAny(f88c6610) : IRP_MJ_INTERNAL_DEVICE_CONTROL
[304925 ms] UsbSnoop - MyDispatchInternalIOCTL(f88c7e80) : fdo=82142030, Irp=81b5d388, IRQL=2
[304925 ms]  >>>  URB 428 going down  >>> 
-- URB_FUNCTION_BULK_OR_INTERRUPT_TRANSFER:
  PipeHandle           = 81b44acc [endpoint 0x00000081]
  TransferFlags        = 00000003 (USBD_TRANSFER_DIRECTION_IN, USBD_SHORT_TRANSFER_OK)
  TransferBufferLength = 00000100
  TransferBuffer       = 00000000
  TransferBufferMDL    = 81cc56a8
  UrbLink              = 00000000
[304925 ms] UsbSnoop - MyInternalIOCTLCompletion(f88c7db0) : fido=823a0430, Irp=81b5d388, Context=81ad07d0, IRQL=2
[304925 ms]  <<<  URB 428 coming back  <<< 
-- URB_FUNCTION_BULK_OR_INTERRUPT_TRANSFER:
  PipeHandle           = 81b44acc [endpoint 0x00000081]
  TransferFlags        = 00000003 (USBD_TRANSFER_DIRECTION_IN, USBD_SHORT_TRANSFER_OK)
  TransferBufferLength = 00000005
  TransferBuffer       = 00000000
  TransferBufferMDL    = 81cc56a8
    00000000: 00 00 00 3b 04
  UrbLink              = 00000000
[304955 ms] UsbSnoop - DispatchAny(f88c6610) : IRP_MJ_INTERNAL_DEVICE_CONTROL
[304955 ms] UsbSnoop - MyDispatchInternalIOCTL(f88c7e80) : fdo=82142030, Irp=81b5d388, IRQL=2
[304955 ms]  >>>  URB 429 going down  >>> 
-- URB_FUNCTION_BULK_OR_INTERRUPT_TRANSFER:
  PipeHandle           = 81b44acc [endpoint 0x00000081]
  TransferFlags        = 00000003 (USBD_TRANSFER_DIRECTION_IN, USBD_SHORT_TRANSFER_OK)
  TransferBufferLength = 00000100
  TransferBuffer       = 00000000
  TransferBufferMDL    = 81cc56a8
  UrbLink              = 00000000
[304955 ms] UsbSnoop - MyInternalIOCTLCompletion(f88c7db0) : fido=823a0430, Irp=81b5d388, Context=81af3568, IRQL=2
[304955 ms]  <<<  URB 429 coming back  <<< 
-- URB_FUNCTION_BULK_OR_INTERRUPT_TRANSFER:
  PipeHandle           = 81b44acc [endpoint 0x00000081]
  TransferFlags        = 00000003 (USBD_TRANSFER_DIRECTION_IN, USBD_SHORT_TRANSFER_OK)
  TransferBufferLength = 0000003b
  TransferBuffer       = 00000000
  TransferBufferMDL    = 81cc56a8
    00000000: 00 00 00 35 00 0a 03 63 68 32 00 08 65 71 75 69
    00000010: 6c 63 68 69 00 00 06 00 02 00 00 04 f0 04 00 0b
    00000020: 00 03 00 00 01 00 00 05 02 00 01 00 00 04 00 00
    00000030: 01 6b 00 41 00 00 01 00 00 42 01
  UrbLink              = 00000000
[304985 ms] UsbSnoop - DispatchAny(f88c6610) : IRP_MJ_INTERNAL_DEVICE_CONTROL
[304985 ms] UsbSnoop - MyDispatchInternalIOCTL(f88c7e80) : fdo=82142030, Irp=81b5d388, IRQL=2
[304985 ms]  >>>  URB 430 going down  >>> 
-- URB_FUNCTION_BULK_OR_INTERRUPT_TRANSFER:
  PipeHandle           = 81b44aec [endpoint 0x00000002]
  TransferFlags        = 00000000 (USBD_TRANSFER_DIRECTION_OUT, ~USBD_SHORT_TRANSFER_OK)
  TransferBufferLength = 00000007
  TransferBuffer       = 00000000
  TransferBufferMDL    = 81cc56a8
    00000000: 00 00 00 02 05 e0 00
  UrbLink              = 00000000
[304985 ms] UsbSnoop - MyInternalIOCTLCompletion(f88c7db0) : fido=823a0430, Irp=81b5d388, Context=822fb2d8, IRQL=2
[304985 ms]  <<<  URB 430 coming back  <<< 
-- URB_FUNCTION_BULK_OR_INTERRUPT_TRANSFER:
  PipeHandle           = 81b44aec [endpoint 0x00000002]
  TransferFlags        = 00000000 (USBD_TRANSFER_DIRECTION_OUT, ~USBD_SHORT_TRANSFER_OK)
  TransferBufferLength = 00000007
  TransferBuffer       = 00000000
  TransferBufferMDL    = 81cc56a8
  UrbLink              = 00000000
[304995 ms] UsbSnoop - DispatchAny(f88c6610) : IRP_MJ_INTERNAL_DEVICE_CONTROL
[304995 ms] UsbSnoop - MyDispatchInternalIOCTL(f88c7e80) : fdo=82142030, Irp=81b5d388, IRQL=2
[304995 ms]  >>>  URB 431 going down  >>> 
-- URB_FUNCTION_BULK_OR_INTERRUPT_TRANSFER:
  PipeHandle           = 81b44acc [endpoint 0x00000081]
  TransferFlags        = 00000003 (USBD_TRANSFER_DIRECTION_IN, USBD_SHORT_TRANSFER_OK)
  TransferBufferLength = 00000100
  TransferBuffer       = 00000000
  TransferBufferMDL    = 81cc56a8
  UrbLink              = 00000000
[304995 ms] UsbSnoop - MyInternalIOCTLCompletion(f88c7db0) : fido=823a0430, Irp=81b5d388, Context=81af1cb8, IRQL=2
[304995 ms]  <<<  URB 431 coming back  <<< 
-- URB_FUNCTION_BULK_OR_INTERRUPT_TRANSFER:
  PipeHandle           = 81b44acc [endpoint 0x00000081]
  TransferFlags        = 00000003 (USBD_TRANSFER_DIRECTION_IN, USBD_SHORT_TRANSFER_OK)
  TransferBufferLength = 00000005
  TransferBuffer       = 00000000
  TransferBufferMDL    = 81cc56a8
    00000000: 00 00 00 3b 04
  UrbLink              = 00000000
[305025 ms] UsbSnoop - DispatchAny(f88c6610) : IRP_MJ_INTERNAL_DEVICE_CONTROL
[305025 ms] UsbSnoop - MyDispatchInternalIOCTL(f88c7e80) : fdo=82142030, Irp=81b5d388, IRQL=2
[305025 ms]  >>>  URB 432 going down  >>> 
-- URB_FUNCTION_BULK_OR_INTERRUPT_TRANSFER:
  PipeHandle           = 81b44acc [endpoint 0x00000081]
  TransferFlags        = 00000003 (USBD_TRANSFER_DIRECTION_IN, USBD_SHORT_TRANSFER_OK)
  TransferBufferLength = 00000100
  TransferBuffer       = 00000000
  TransferBufferMDL    = 81cc56a8
  UrbLink              = 00000000
[305025 ms] UsbSnoop - MyInternalIOCTLCompletion(f88c7db0) : fido=823a0430, Irp=81b5d388, Context=81af3568, IRQL=2
[305025 ms]  <<<  URB 432 coming back  <<< 
-- URB_FUNCTION_BULK_OR_INTERRUPT_TRANSFER:
  PipeHandle           = 81b44acc [endpoint 0x00000081]
  TransferFlags        = 00000003 (USBD_TRANSFER_DIRECTION_IN, USBD_SHORT_TRANSFER_OK)
  TransferBufferLength = 0000003b
  TransferBuffer       = 00000000
  TransferBufferMDL    = 81cc56a8
    00000000: 00 00 00 35 00 0a 03 63 68 32 00 08 66 61 63 74
    00000010: 65 71 75 69 00 00 06 00 02 00 00 04 f0 04 00 0b
    00000020: 00 03 00 00 01 00 00 05 02 00 01 00 00 04 00 00
    00000030: 03 69 00 41 00 00 01 00 00 42 01
  UrbLink              = 00000000
[305055 ms] UsbSnoop - DispatchAny(f88c6610) : IRP_MJ_INTERNAL_DEVICE_CONTROL
[305055 ms] UsbSnoop - MyDispatchInternalIOCTL(f88c7e80) : fdo=82142030, Irp=81b5d388, IRQL=2
[305055 ms]  >>>  URB 433 going down  >>> 
-- URB_FUNCTION_BULK_OR_INTERRUPT_TRANSFER:
  PipeHandle           = 81b44aec [endpoint 0x00000002]
  TransferFlags        = 00000000 (USBD_TRANSFER_DIRECTION_OUT, ~USBD_SHORT_TRANSFER_OK)
  TransferBufferLength = 00000007
  TransferBuffer       = 00000000
  TransferBufferMDL    = 81cc56a8
    00000000: 00 00 00 02 05 e0 00
  UrbLink              = 00000000
[305055 ms] UsbSnoop - MyInternalIOCTLCompletion(f88c7db0) : fido=823a0430, Irp=81b5d388, Context=81af3568, IRQL=2
[305055 ms]  <<<  URB 433 coming back  <<< 
-- URB_FUNCTION_BULK_OR_INTERRUPT_TRANSFER:
  PipeHandle           = 81b44aec [endpoint 0x00000002]
  TransferFlags        = 00000000 (USBD_TRANSFER_DIRECTION_OUT, ~USBD_SHORT_TRANSFER_OK)
  TransferBufferLength = 00000007
  TransferBuffer       = 00000000
  TransferBufferMDL    = 81cc56a8
  UrbLink              = 00000000
[305065 ms] UsbSnoop - DispatchAny(f88c6610) : IRP_MJ_INTERNAL_DEVICE_CONTROL
[305065 ms] UsbSnoop - MyDispatchInternalIOCTL(f88c7e80) : fdo=82142030, Irp=81b5d388, IRQL=2
[305065 ms]  >>>  URB 434 going down  >>> 
-- URB_FUNCTION_BULK_OR_INTERRUPT_TRANSFER:
  PipeHandle           = 81b44acc [endpoint 0x00000081]
  TransferFlags        = 00000003 (USBD_TRANSFER_DIRECTION_IN, USBD_SHORT_TRANSFER_OK)
  TransferBufferLength = 00000100
  TransferBuffer       = 00000000
  TransferBufferMDL    = 81cc56a8
  UrbLink              = 00000000
[305065 ms] UsbSnoop - MyInternalIOCTLCompletion(f88c7db0) : fido=823a0430, Irp=81b5d388, Context=822af798, IRQL=2
[305065 ms]  <<<  URB 434 coming back  <<< 
-- URB_FUNCTION_BULK_OR_INTERRUPT_TRANSFER:
  PipeHandle           = 81b44acc [endpoint 0x00000081]
  TransferFlags        = 00000003 (USBD_TRANSFER_DIRECTION_IN, USBD_SHORT_TRANSFER_OK)
  TransferBufferLength = 00000005
  TransferBuffer       = 00000000
  TransferBufferMDL    = 81cc56a8
    00000000: 00 00 00 3a 04
  UrbLink              = 00000000
[305095 ms] UsbSnoop - DispatchAny(f88c6610) : IRP_MJ_INTERNAL_DEVICE_CONTROL
[305095 ms] UsbSnoop - MyDispatchInternalIOCTL(f88c7e80) : fdo=82142030, Irp=81b5d388, IRQL=2
[305095 ms]  >>>  URB 435 going down  >>> 
-- URB_FUNCTION_BULK_OR_INTERRUPT_TRANSFER:
  PipeHandle           = 81b44acc [endpoint 0x00000081]
  TransferFlags        = 00000003 (USBD_TRANSFER_DIRECTION_IN, USBD_SHORT_TRANSFER_OK)
  TransferBufferLength = 00000100
  TransferBuffer       = 00000000
  TransferBufferMDL    = 81cc56a8
  UrbLink              = 00000000
[305095 ms] UsbSnoop - MyInternalIOCTLCompletion(f88c7db0) : fido=823a0430, Irp=81b5d388, Context=81ad5658, IRQL=2
[305095 ms]  <<<  URB 435 coming back  <<< 
-- URB_FUNCTION_BULK_OR_INTERRUPT_TRANSFER:
  PipeHandle           = 81b44acc [endpoint 0x00000081]
  TransferFlags        = 00000003 (USBD_TRANSFER_DIRECTION_IN, USBD_SHORT_TRANSFER_OK)
  TransferBufferLength = 0000003a
  TransferBuffer       = 00000000
  TransferBufferMDL    = 81cc56a8
    00000000: 00 00 00 34 00 0a 03 63 68 32 00 07 67 61 7a 70
    00000010: 61 72 66 00 00 06 00 02 00 00 04 f0 04 00 0b 00
    00000020: 03 00 00 01 00 00 05 02 00 01 00 00 04 00 00 01
    00000030: 44 00 41 00 00 01 00 00 42 01
  UrbLink              = 00000000
[305125 ms] UsbSnoop - DispatchAny(f88c6610) : IRP_MJ_INTERNAL_DEVICE_CONTROL
[305125 ms] UsbSnoop - MyDispatchInternalIOCTL(f88c7e80) : fdo=82142030, Irp=81b5d388, IRQL=2
[305125 ms]  >>>  URB 436 going down  >>> 
-- URB_FUNCTION_BULK_OR_INTERRUPT_TRANSFER:
  PipeHandle           = 81b44aec [endpoint 0x00000002]
  TransferFlags        = 00000000 (USBD_TRANSFER_DIRECTION_OUT, ~USBD_SHORT_TRANSFER_OK)
  TransferBufferLength = 00000007
  TransferBuffer       = 00000000
  TransferBufferMDL    = 81cc56a8
    00000000: 00 00 00 02 05 e0 00
  UrbLink              = 00000000
[305125 ms] UsbSnoop - MyInternalIOCTLCompletion(f88c7db0) : fido=823a0430, Irp=81b5d388, Context=81af3568, IRQL=2
[305125 ms]  <<<  URB 436 coming back  <<< 
-- URB_FUNCTION_BULK_OR_INTERRUPT_TRANSFER:
  PipeHandle           = 81b44aec [endpoint 0x00000002]
  TransferFlags        = 00000000 (USBD_TRANSFER_DIRECTION_OUT, ~USBD_SHORT_TRANSFER_OK)
  TransferBufferLength = 00000007
  TransferBuffer       = 00000000
  TransferBufferMDL    = 81cc56a8
  UrbLink              = 00000000
[305135 ms] UsbSnoop - DispatchAny(f88c6610) : IRP_MJ_INTERNAL_DEVICE_CONTROL
[305135 ms] UsbSnoop - MyDispatchInternalIOCTL(f88c7e80) : fdo=82142030, Irp=81b5d388, IRQL=2
[305135 ms]  >>>  URB 437 going down  >>> 
-- URB_FUNCTION_BULK_OR_INTERRUPT_TRANSFER:
  PipeHandle           = 81b44acc [endpoint 0x00000081]
  TransferFlags        = 00000003 (USBD_TRANSFER_DIRECTION_IN, USBD_SHORT_TRANSFER_OK)
  TransferBufferLength = 00000100
  TransferBuffer       = 00000000
  TransferBufferMDL    = 81cc56a8
  UrbLink              = 00000000
[305135 ms] UsbSnoop - MyInternalIOCTLCompletion(f88c7db0) : fido=823a0430, Irp=81b5d388, Context=81ad5658, IRQL=2
[305135 ms]  <<<  URB 437 coming back  <<< 
-- URB_FUNCTION_BULK_OR_INTERRUPT_TRANSFER:
  PipeHandle           = 81b44acc [endpoint 0x00000081]
  TransferFlags        = 00000003 (USBD_TRANSFER_DIRECTION_IN, USBD_SHORT_TRANSFER_OK)
  TransferBufferLength = 00000005
  TransferBuffer       = 00000000
  TransferBufferMDL    = 81cc56a8
    00000000: 00 00 00 3b 04
  UrbLink              = 00000000
[305165 ms] UsbSnoop - DispatchAny(f88c6610) : IRP_MJ_INTERNAL_DEVICE_CONTROL
[305165 ms] UsbSnoop - MyDispatchInternalIOCTL(f88c7e80) : fdo=82142030, Irp=81b4e870, IRQL=2
[305165 ms]  >>>  URB 438 going down  >>> 
-- URB_FUNCTION_BULK_OR_INTERRUPT_TRANSFER:
  PipeHandle           = 81b44acc [endpoint 0x00000081]
  TransferFlags        = 00000003 (USBD_TRANSFER_DIRECTION_IN, USBD_SHORT_TRANSFER_OK)
  TransferBufferLength = 00000100
  TransferBuffer       = 00000000
  TransferBufferMDL    = 8216a008
  UrbLink              = 00000000
[305165 ms] UsbSnoop - MyInternalIOCTLCompletion(f88c7db0) : fido=823a0430, Irp=81b4e870, Context=81af1cb8, IRQL=2
[305165 ms]  <<<  URB 438 coming back  <<< 
-- URB_FUNCTION_BULK_OR_INTERRUPT_TRANSFER:
  PipeHandle           = 81b44acc [endpoint 0x00000081]
  TransferFlags        = 00000003 (USBD_TRANSFER_DIRECTION_IN, USBD_SHORT_TRANSFER_OK)
  TransferBufferLength = 0000003b
  TransferBuffer       = 00000000
  TransferBufferMDL    = 8216a008
    00000000: 00 00 00 35 00 0a 03 63 68 32 00 08 67 72 61 6e
    00000010: 64 73 74 64 00 00 06 00 02 00 00 04 f0 04 00 0b
    00000020: 00 03 00 00 01 00 00 05 02 00 01 00 00 04 00 00
    00000030: 01 30 00 41 00 00 01 00 00 42 01
  UrbLink              = 00000000
[305195 ms] UsbSnoop - DispatchAny(f88c6610) : IRP_MJ_INTERNAL_DEVICE_CONTROL
[305195 ms] UsbSnoop - MyDispatchInternalIOCTL(f88c7e80) : fdo=82142030, Irp=81b4e870, IRQL=2
[305195 ms]  >>>  URB 439 going down  >>> 
-- URB_FUNCTION_BULK_OR_INTERRUPT_TRANSFER:
  PipeHandle           = 81b44aec [endpoint 0x00000002]
  TransferFlags        = 00000000 (USBD_TRANSFER_DIRECTION_OUT, ~USBD_SHORT_TRANSFER_OK)
  TransferBufferLength = 00000007
  TransferBuffer       = 00000000
  TransferBufferMDL    = 8216a008
    00000000: 00 00 00 02 05 e0 00
  UrbLink              = 00000000
[305195 ms] UsbSnoop - MyInternalIOCTLCompletion(f88c7db0) : fido=823a0430, Irp=81b4e870, Context=81adbfe8, IRQL=2
[305195 ms]  <<<  URB 439 coming back  <<< 
-- URB_FUNCTION_BULK_OR_INTERRUPT_TRANSFER:
  PipeHandle           = 81b44aec [endpoint 0x00000002]
  TransferFlags        = 00000000 (USBD_TRANSFER_DIRECTION_OUT, ~USBD_SHORT_TRANSFER_OK)
  TransferBufferLength = 00000007
  TransferBuffer       = 00000000
  TransferBufferMDL    = 8216a008
  UrbLink              = 00000000
[305205 ms] UsbSnoop - DispatchAny(f88c6610) : IRP_MJ_INTERNAL_DEVICE_CONTROL
[305205 ms] UsbSnoop - MyDispatchInternalIOCTL(f88c7e80) : fdo=82142030, Irp=81b4e870, IRQL=2
[305205 ms]  >>>  URB 440 going down  >>> 
-- URB_FUNCTION_BULK_OR_INTERRUPT_TRANSFER:
  PipeHandle           = 81b44acc [endpoint 0x00000081]
  TransferFlags        = 00000003 (USBD_TRANSFER_DIRECTION_IN, USBD_SHORT_TRANSFER_OK)
  TransferBufferLength = 00000100
  TransferBuffer       = 00000000
  TransferBufferMDL    = 8216a008
  UrbLink              = 00000000
[305205 ms] UsbSnoop - MyInternalIOCTLCompletion(f88c7db0) : fido=823a0430, Irp=81b4e870, Context=822af798, IRQL=2
[305205 ms]  <<<  URB 440 coming back  <<< 
-- URB_FUNCTION_BULK_OR_INTERRUPT_TRANSFER:
  PipeHandle           = 81b44acc [endpoint 0x00000081]
  TransferFlags        = 00000003 (USBD_TRANSFER_DIRECTION_IN, USBD_SHORT_TRANSFER_OK)
  TransferBufferLength = 00000005
  TransferBuffer       = 00000000
  TransferBufferMDL    = 8216a008
    00000000: 00 00 00 3a 04
  UrbLink              = 00000000
[305236 ms] UsbSnoop - DispatchAny(f88c6610) : IRP_MJ_INTERNAL_DEVICE_CONTROL
[305236 ms] UsbSnoop - MyDispatchInternalIOCTL(f88c7e80) : fdo=82142030, Irp=81b4e870, IRQL=2
[305236 ms]  >>>  URB 441 going down  >>> 
-- URB_FUNCTION_BULK_OR_INTERRUPT_TRANSFER:
  PipeHandle           = 81b44acc [endpoint 0x00000081]
  TransferFlags        = 00000003 (USBD_TRANSFER_DIRECTION_IN, USBD_SHORT_TRANSFER_OK)
  TransferBufferLength = 00000100
  TransferBuffer       = 00000000
  TransferBufferMDL    = 8216a008
  UrbLink              = 00000000
[305236 ms] UsbSnoop - MyInternalIOCTLCompletion(f88c7db0) : fido=823a0430, Irp=81b4e870, Context=81af3568, IRQL=2
[305236 ms]  <<<  URB 441 coming back  <<< 
-- URB_FUNCTION_BULK_OR_INTERRUPT_TRANSFER:
  PipeHandle           = 81b44acc [endpoint 0x00000081]
  TransferFlags        = 00000003 (USBD_TRANSFER_DIRECTION_IN, USBD_SHORT_TRANSFER_OK)
  TransferBufferLength = 0000003a
  TransferBuffer       = 00000000
  TransferBufferMDL    = 8216a008
    00000000: 00 00 00 34 00 0a 03 63 68 32 00 07 70 6f 74 63
    00000010: 68 69 6d 00 00 06 00 02 00 00 04 f0 04 00 0b 00
    00000020: 03 00 00 01 00 00 05 02 00 01 00 00 04 00 00 00
    00000030: f7 00 41 00 00 01 00 00 42 01
  UrbLink              = 00000000
[305265 ms] UsbSnoop - DispatchAny(f88c6610) : IRP_MJ_INTERNAL_DEVICE_CONTROL
[305265 ms] UsbSnoop - MyDispatchInternalIOCTL(f88c7e80) : fdo=82142030, Irp=81b4e870, IRQL=2
[305265 ms]  >>>  URB 442 going down  >>> 
-- URB_FUNCTION_BULK_OR_INTERRUPT_TRANSFER:
  PipeHandle           = 81b44aec [endpoint 0x00000002]
  TransferFlags        = 00000000 (USBD_TRANSFER_DIRECTION_OUT, ~USBD_SHORT_TRANSFER_OK)
  TransferBufferLength = 00000007
  TransferBuffer       = 00000000
  TransferBufferMDL    = 8216a008
    00000000: 00 00 00 02 05 e0 00
  UrbLink              = 00000000
[305265 ms] UsbSnoop - MyInternalIOCTLCompletion(f88c7db0) : fido=823a0430, Irp=81b4e870, Context=81af3568, IRQL=2
[305266 ms]  <<<  URB 442 coming back  <<< 
-- URB_FUNCTION_BULK_OR_INTERRUPT_TRANSFER:
  PipeHandle           = 81b44aec [endpoint 0x00000002]
  TransferFlags        = 00000000 (USBD_TRANSFER_DIRECTION_OUT, ~USBD_SHORT_TRANSFER_OK)
  TransferBufferLength = 00000007
  TransferBuffer       = 00000000
  TransferBufferMDL    = 8216a008
  UrbLink              = 00000000
[305275 ms] UsbSnoop - DispatchAny(f88c6610) : IRP_MJ_INTERNAL_DEVICE_CONTROL
[305275 ms] UsbSnoop - MyDispatchInternalIOCTL(f88c7e80) : fdo=82142030, Irp=81b4e870, IRQL=2
[305275 ms]  >>>  URB 443 going down  >>> 
-- URB_FUNCTION_BULK_OR_INTERRUPT_TRANSFER:
  PipeHandle           = 81b44acc [endpoint 0x00000081]
  TransferFlags        = 00000003 (USBD_TRANSFER_DIRECTION_IN, USBD_SHORT_TRANSFER_OK)
  TransferBufferLength = 00000100
  TransferBuffer       = 00000000
  TransferBufferMDL    = 8216a008
  UrbLink              = 00000000
[305275 ms] UsbSnoop - MyInternalIOCTLCompletion(f88c7db0) : fido=823a0430, Irp=81b4e870, Context=81af1cb8, IRQL=2
[305275 ms]  <<<  URB 443 coming back  <<< 
-- URB_FUNCTION_BULK_OR_INTERRUPT_TRANSFER:
  PipeHandle           = 81b44acc [endpoint 0x00000081]
  TransferFlags        = 00000003 (USBD_TRANSFER_DIRECTION_IN, USBD_SHORT_TRANSFER_OK)
  TransferBufferLength = 00000005
  TransferBuffer       = 00000000
  TransferBufferMDL    = 8216a008
    00000000: 00 00 00 3a 04
  UrbLink              = 00000000
[305305 ms] UsbSnoop - DispatchAny(f88c6610) : IRP_MJ_INTERNAL_DEVICE_CONTROL
[305305 ms] UsbSnoop - MyDispatchInternalIOCTL(f88c7e80) : fdo=82142030, Irp=81b4e870, IRQL=2
[305305 ms]  >>>  URB 444 going down  >>> 
-- URB_FUNCTION_BULK_OR_INTERRUPT_TRANSFER:
  PipeHandle           = 81b44acc [endpoint 0x00000081]
  TransferFlags        = 00000003 (USBD_TRANSFER_DIRECTION_IN, USBD_SHORT_TRANSFER_OK)
  TransferBufferLength = 00000100
  TransferBuffer       = 00000000
  TransferBufferMDL    = 8216a008
  UrbLink              = 00000000
[305306 ms] UsbSnoop - MyInternalIOCTLCompletion(f88c7db0) : fido=823a0430, Irp=81b4e870, Context=822fb2d8, IRQL=2
[305306 ms]  <<<  URB 444 coming back  <<< 
-- URB_FUNCTION_BULK_OR_INTERRUPT_TRANSFER:
  PipeHandle           = 81b44acc [endpoint 0x00000081]
  TransferFlags        = 00000003 (USBD_TRANSFER_DIRECTION_IN, USBD_SHORT_TRANSFER_OK)
  TransferBufferLength = 0000003a
  TransferBuffer       = 00000000
  TransferBufferMDL    = 8216a008
    00000000: 00 00 00 34 00 0a 03 63 68 32 00 07 72 70 67 69
    00000010: 62 62 73 00 00 06 00 02 00 00 04 f0 04 00 0b 00
    00000020: 03 00 00 01 00 00 05 02 00 01 00 00 04 00 00 00
    00000030: f5 00 41 00 00 01 00 00 42 01
  UrbLink              = 00000000
[305335 ms] UsbSnoop - DispatchAny(f88c6610) : IRP_MJ_INTERNAL_DEVICE_CONTROL
[305335 ms] UsbSnoop - MyDispatchInternalIOCTL(f88c7e80) : fdo=82142030, Irp=81b4e870, IRQL=2
[305335 ms]  >>>  URB 445 going down  >>> 
-- URB_FUNCTION_BULK_OR_INTERRUPT_TRANSFER:
  PipeHandle           = 81b44aec [endpoint 0x00000002]
  TransferFlags        = 00000000 (USBD_TRANSFER_DIRECTION_OUT, ~USBD_SHORT_TRANSFER_OK)
  TransferBufferLength = 00000007
  TransferBuffer       = 00000000
  TransferBufferMDL    = 8216a008
    00000000: 00 00 00 02 05 e0 00
  UrbLink              = 00000000
[305336 ms] UsbSnoop - MyInternalIOCTLCompletion(f88c7db0) : fido=823a0430, Irp=81b4e870, Context=81adbfe8, IRQL=2
[305336 ms]  <<<  URB 445 coming back  <<< 
-- URB_FUNCTION_BULK_OR_INTERRUPT_TRANSFER:
  PipeHandle           = 81b44aec [endpoint 0x00000002]
  TransferFlags        = 00000000 (USBD_TRANSFER_DIRECTION_OUT, ~USBD_SHORT_TRANSFER_OK)
  TransferBufferLength = 00000007
  TransferBuffer       = 00000000
  TransferBufferMDL    = 8216a008
  UrbLink              = 00000000
[305345 ms] UsbSnoop - DispatchAny(f88c6610) : IRP_MJ_INTERNAL_DEVICE_CONTROL
[305345 ms] UsbSnoop - MyDispatchInternalIOCTL(f88c7e80) : fdo=82142030, Irp=81b4e870, IRQL=2
[305345 ms]  >>>  URB 446 going down  >>> 
-- URB_FUNCTION_BULK_OR_INTERRUPT_TRANSFER:
  PipeHandle           = 81b44acc [endpoint 0x00000081]
  TransferFlags        = 00000003 (USBD_TRANSFER_DIRECTION_IN, USBD_SHORT_TRANSFER_OK)
  TransferBufferLength = 00000100
  TransferBuffer       = 00000000
  TransferBufferMDL    = 8216a008
  UrbLink              = 00000000
[305346 ms] UsbSnoop - MyInternalIOCTLCompletion(f88c7db0) : fido=823a0430, Irp=81b4e870, Context=822af798, IRQL=2
[305346 ms]  <<<  URB 446 coming back  <<< 
-- URB_FUNCTION_BULK_OR_INTERRUPT_TRANSFER:
  PipeHandle           = 81b44acc [endpoint 0x00000081]
  TransferFlags        = 00000003 (USBD_TRANSFER_DIRECTION_IN, USBD_SHORT_TRANSFER_OK)
  TransferBufferLength = 00000005
  TransferBuffer       = 00000000
  TransferBufferMDL    = 8216a008
    00000000: 00 00 00 3b 04
  UrbLink              = 00000000
[305376 ms] UsbSnoop - DispatchAny(f88c6610) : IRP_MJ_INTERNAL_DEVICE_CONTROL
[305376 ms] UsbSnoop - MyDispatchInternalIOCTL(f88c7e80) : fdo=82142030, Irp=81b4e870, IRQL=2
[305376 ms]  >>>  URB 447 going down  >>> 
-- URB_FUNCTION_BULK_OR_INTERRUPT_TRANSFER:
  PipeHandle           = 81b44acc [endpoint 0x00000081]
  TransferFlags        = 00000003 (USBD_TRANSFER_DIRECTION_IN, USBD_SHORT_TRANSFER_OK)
  TransferBufferLength = 00000100
  TransferBuffer       = 00000000
  TransferBufferMDL    = 8216a008
  UrbLink              = 00000000
[305376 ms] UsbSnoop - MyInternalIOCTLCompletion(f88c7db0) : fido=823a0430, Irp=81b4e870, Context=81af3568, IRQL=2
[305376 ms]  <<<  URB 447 coming back  <<< 
-- URB_FUNCTION_BULK_OR_INTERRUPT_TRANSFER:
  PipeHandle           = 81b44acc [endpoint 0x00000081]
  TransferFlags        = 00000003 (USBD_TRANSFER_DIRECTION_IN, USBD_SHORT_TRANSFER_OK)
  TransferBufferLength = 0000003b
  TransferBuffer       = 00000000
  TransferBufferMDL    = 8216a008
    00000000: 00 00 00 35 00 0a 03 63 68 32 00 08 74 68 65 72
    00000010: 6d 6f 63 68 00 00 06 00 02 00 00 04 f0 04 00 0b
    00000020: 00 03 00 00 01 00 00 05 02 00 01 00 00 04 00 00
    00000030: 02 82 00 41 00 00 01 00 00 42 01
  UrbLink              = 00000000
[305406 ms] UsbSnoop - DispatchAny(f88c6610) : IRP_MJ_INTERNAL_DEVICE_CONTROL
[305406 ms] UsbSnoop - MyDispatchInternalIOCTL(f88c7e80) : fdo=82142030, Irp=81b4e870, IRQL=2
[305406 ms]  >>>  URB 448 going down  >>> 
-- URB_FUNCTION_BULK_OR_INTERRUPT_TRANSFER:
  PipeHandle           = 81b44aec [endpoint 0x00000002]
  TransferFlags        = 00000000 (USBD_TRANSFER_DIRECTION_OUT, ~USBD_SHORT_TRANSFER_OK)
  TransferBufferLength = 00000007
  TransferBuffer       = 00000000
  TransferBufferMDL    = 8216a008
    00000000: 00 00 00 02 05 e0 00
  UrbLink              = 00000000
[305406 ms] UsbSnoop - MyInternalIOCTLCompletion(f88c7db0) : fido=823a0430, Irp=81b4e870, Context=81af1cb8, IRQL=2
[305406 ms]  <<<  URB 448 coming back  <<< 
-- URB_FUNCTION_BULK_OR_INTERRUPT_TRANSFER:
  PipeHandle           = 81b44aec [endpoint 0x00000002]
  TransferFlags        = 00000000 (USBD_TRANSFER_DIRECTION_OUT, ~USBD_SHORT_TRANSFER_OK)
  TransferBufferLength = 00000007
  TransferBuffer       = 00000000
  TransferBufferMDL    = 8216a008
  UrbLink              = 00000000
[305416 ms] UsbSnoop - DispatchAny(f88c6610) : IRP_MJ_INTERNAL_DEVICE_CONTROL
[305416 ms] UsbSnoop - MyDispatchInternalIOCTL(f88c7e80) : fdo=82142030, Irp=81b4e870, IRQL=2
[305416 ms]  >>>  URB 449 going down  >>> 
-- URB_FUNCTION_BULK_OR_INTERRUPT_TRANSFER:
  PipeHandle           = 81b44acc [endpoint 0x00000081]
  TransferFlags        = 00000003 (USBD_TRANSFER_DIRECTION_IN, USBD_SHORT_TRANSFER_OK)
  TransferBufferLength = 00000100
  TransferBuffer       = 00000000
  TransferBufferMDL    = 8216a008
  UrbLink              = 00000000
[305416 ms] UsbSnoop - MyInternalIOCTLCompletion(f88c7db0) : fido=823a0430, Irp=81b4e870, Context=822fb2d8, IRQL=2
[305416 ms]  <<<  URB 449 coming back  <<< 
-- URB_FUNCTION_BULK_OR_INTERRUPT_TRANSFER:
  PipeHandle           = 81b44acc [endpoint 0x00000081]
  TransferFlags        = 00000003 (USBD_TRANSFER_DIRECTION_IN, USBD_SHORT_TRANSFER_OK)
  TransferBufferLength = 00000005
  TransferBuffer       = 00000000
  TransferBufferMDL    = 8216a008
    00000000: 00 00 00 32 04
  UrbLink              = 00000000
[305446 ms] UsbSnoop - DispatchAny(f88c6610) : IRP_MJ_INTERNAL_DEVICE_CONTROL
[305446 ms] UsbSnoop - MyDispatchInternalIOCTL(f88c7e80) : fdo=82142030, Irp=81b4e870, IRQL=2
[305446 ms]  >>>  URB 450 going down  >>> 
-- URB_FUNCTION_BULK_OR_INTERRUPT_TRANSFER:
  PipeHandle           = 81b44acc [endpoint 0x00000081]
  TransferFlags        = 00000003 (USBD_TRANSFER_DIRECTION_IN, USBD_SHORT_TRANSFER_OK)
  TransferBufferLength = 00000100
  TransferBuffer       = 00000000
  TransferBufferMDL    = 8216a008
  UrbLink              = 00000000
[305446 ms] UsbSnoop - MyInternalIOCTLCompletion(f88c7db0) : fido=823a0430, Irp=81b4e870, Context=81adbfe8, IRQL=2
[305446 ms]  <<<  URB 450 coming back  <<< 
-- URB_FUNCTION_BULK_OR_INTERRUPT_TRANSFER:
  PipeHandle           = 81b44acc [endpoint 0x00000081]
  TransferFlags        = 00000003 (USBD_TRANSFER_DIRECTION_IN, USBD_SHORT_TRANSFER_OK)
  TransferBufferLength = 00000032
  TransferBuffer       = 00000000
  TransferBufferMDL    = 8216a008
    00000000: 00 00 00 2c 00 0a 03 63 68 33 00 00 00 06 00 02
    00000010: 00 00 04 f0 04 00 1f 00 03 00 00 01 00 00 05 02
    00000020: 00 01 00 00 04 00 00 00 0c 00 41 00 00 01 00 00
    00000030: 42 01
  UrbLink              = 00000000
[305476 ms] UsbSnoop - DispatchAny(f88c6610) : IRP_MJ_INTERNAL_DEVICE_CONTROL
[305476 ms] UsbSnoop - MyDispatchInternalIOCTL(f88c7e80) : fdo=82142030, Irp=81b4e870, IRQL=2
[305476 ms]  >>>  URB 451 going down  >>> 
-- URB_FUNCTION_BULK_OR_INTERRUPT_TRANSFER:
  PipeHandle           = 81b44aec [endpoint 0x00000002]
  TransferFlags        = 00000000 (USBD_TRANSFER_DIRECTION_OUT, ~USBD_SHORT_TRANSFER_OK)
  TransferBufferLength = 00000007
  TransferBuffer       = 00000000
  TransferBufferMDL    = 8216a008
    00000000: 00 00 00 02 05 e0 00
  UrbLink              = 00000000
[305476 ms] UsbSnoop - MyInternalIOCTLCompletion(f88c7db0) : fido=823a0430, Irp=81b4e870, Context=81af1cb8, IRQL=2
[305476 ms]  <<<  URB 451 coming back  <<< 
-- URB_FUNCTION_BULK_OR_INTERRUPT_TRANSFER:
  PipeHandle           = 81b44aec [endpoint 0x00000002]
  TransferFlags        = 00000000 (USBD_TRANSFER_DIRECTION_OUT, ~USBD_SHORT_TRANSFER_OK)
  TransferBufferLength = 00000007
  TransferBuffer       = 00000000
  TransferBufferMDL    = 8216a008
  UrbLink              = 00000000
[305486 ms] UsbSnoop - DispatchAny(f88c6610) : IRP_MJ_INTERNAL_DEVICE_CONTROL
[305486 ms] UsbSnoop - MyDispatchInternalIOCTL(f88c7e80) : fdo=82142030, Irp=81b4e870, IRQL=2
[305486 ms]  >>>  URB 452 going down  >>> 
-- URB_FUNCTION_BULK_OR_INTERRUPT_TRANSFER:
  PipeHandle           = 81b44acc [endpoint 0x00000081]
  TransferFlags        = 00000003 (USBD_TRANSFER_DIRECTION_IN, USBD_SHORT_TRANSFER_OK)
  TransferBufferLength = 00000100
  TransferBuffer       = 00000000
  TransferBufferMDL    = 8216a008
  UrbLink              = 00000000
[305486 ms] UsbSnoop - MyInternalIOCTLCompletion(f88c7db0) : fido=823a0430, Irp=81b4e870, Context=81adbfe8, IRQL=2
[305486 ms]  <<<  URB 452 coming back  <<< 
-- URB_FUNCTION_BULK_OR_INTERRUPT_TRANSFER:
  PipeHandle           = 81b44acc [endpoint 0x00000081]
  TransferFlags        = 00000003 (USBD_TRANSFER_DIRECTION_IN, USBD_SHORT_TRANSFER_OK)
  TransferBufferLength = 00000005
  TransferBuffer       = 00000000
  TransferBufferMDL    = 8216a008
    00000000: 00 00 00 3a 04
  UrbLink              = 00000000
[305516 ms] UsbSnoop - DispatchAny(f88c6610) : IRP_MJ_INTERNAL_DEVICE_CONTROL
[305516 ms] UsbSnoop - MyDispatchInternalIOCTL(f88c7e80) : fdo=82142030, Irp=81b4e870, IRQL=2
[305516 ms]  >>>  URB 453 going down  >>> 
-- URB_FUNCTION_BULK_OR_INTERRUPT_TRANSFER:
  PipeHandle           = 81b44acc [endpoint 0x00000081]
  TransferFlags        = 00000003 (USBD_TRANSFER_DIRECTION_IN, USBD_SHORT_TRANSFER_OK)
  TransferBufferLength = 00000100
  TransferBuffer       = 00000000
  TransferBufferMDL    = 8216a008
  UrbLink              = 00000000
[305516 ms] UsbSnoop - MyInternalIOCTLCompletion(f88c7db0) : fido=823a0430, Irp=81b4e870, Context=81ad5658, IRQL=2
[305516 ms]  <<<  URB 453 coming back  <<< 
-- URB_FUNCTION_BULK_OR_INTERRUPT_TRANSFER:
  PipeHandle           = 81b44acc [endpoint 0x00000081]
  TransferFlags        = 00000003 (USBD_TRANSFER_DIRECTION_IN, USBD_SHORT_TRANSFER_OK)
  TransferBufferLength = 0000003a
  TransferBuffer       = 00000000
  TransferBufferMDL    = 8216a008
    00000000: 00 00 00 34 00 0a 03 63 68 33 00 07 63 69 6e 65
    00000010: 74 69 71 00 00 06 00 02 00 00 04 f0 04 00 0b 00
    00000020: 03 00 00 01 00 00 05 02 00 01 00 00 04 00 00 01
    00000030: 12 00 41 00 00 01 00 00 42 01
  UrbLink              = 00000000
[305546 ms] UsbSnoop - DispatchAny(f88c6610) : IRP_MJ_INTERNAL_DEVICE_CONTROL
[305546 ms] UsbSnoop - MyDispatchInternalIOCTL(f88c7e80) : fdo=82142030, Irp=81b4e870, IRQL=2
[305546 ms]  >>>  URB 454 going down  >>> 
-- URB_FUNCTION_BULK_OR_INTERRUPT_TRANSFER:
  PipeHandle           = 81b44aec [endpoint 0x00000002]
  TransferFlags        = 00000000 (USBD_TRANSFER_DIRECTION_OUT, ~USBD_SHORT_TRANSFER_OK)
  TransferBufferLength = 00000007
  TransferBuffer       = 00000000
  TransferBufferMDL    = 8216a008
    00000000: 00 00 00 02 05 e0 00
  UrbLink              = 00000000
[305546 ms] UsbSnoop - MyInternalIOCTLCompletion(f88c7db0) : fido=823a0430, Irp=81b4e870, Context=822af798, IRQL=2
[305546 ms]  <<<  URB 454 coming back  <<< 
-- URB_FUNCTION_BULK_OR_INTERRUPT_TRANSFER:
  PipeHandle           = 81b44aec [endpoint 0x00000002]
  TransferFlags        = 00000000 (USBD_TRANSFER_DIRECTION_OUT, ~USBD_SHORT_TRANSFER_OK)
  TransferBufferLength = 00000007
  TransferBuffer       = 00000000
  TransferBufferMDL    = 8216a008
  UrbLink              = 00000000
[305556 ms] UsbSnoop - DispatchAny(f88c6610) : IRP_MJ_INTERNAL_DEVICE_CONTROL
[305556 ms] UsbSnoop - MyDispatchInternalIOCTL(f88c7e80) : fdo=82142030, Irp=81b4e870, IRQL=2
[305556 ms]  >>>  URB 455 going down  >>> 
-- URB_FUNCTION_BULK_OR_INTERRUPT_TRANSFER:
  PipeHandle           = 81b44acc [endpoint 0x00000081]
  TransferFlags        = 00000003 (USBD_TRANSFER_DIRECTION_IN, USBD_SHORT_TRANSFER_OK)
  TransferBufferLength = 00000100
  TransferBuffer       = 00000000
  TransferBufferMDL    = 8216a008
  UrbLink              = 00000000
[305556 ms] UsbSnoop - MyInternalIOCTLCompletion(f88c7db0) : fido=823a0430, Irp=81b4e870, Context=822fb2d8, IRQL=2
[305556 ms]  <<<  URB 455 coming back  <<< 
-- URB_FUNCTION_BULK_OR_INTERRUPT_TRANSFER:
  PipeHandle           = 81b44acc [endpoint 0x00000081]
  TransferFlags        = 00000003 (USBD_TRANSFER_DIRECTION_IN, USBD_SHORT_TRANSFER_OK)
  TransferBufferLength = 00000005
  TransferBuffer       = 00000000
  TransferBufferMDL    = 8216a008
    00000000: 00 00 00 3b 04
  UrbLink              = 00000000
[305586 ms] UsbSnoop - DispatchAny(f88c6610) : IRP_MJ_INTERNAL_DEVICE_CONTROL
[305586 ms] UsbSnoop - MyDispatchInternalIOCTL(f88c7e80) : fdo=82142030, Irp=81b4e870, IRQL=2
[305586 ms]  >>>  URB 456 going down  >>> 
-- URB_FUNCTION_BULK_OR_INTERRUPT_TRANSFER:
  PipeHandle           = 81b44acc [endpoint 0x00000081]
  TransferFlags        = 00000003 (USBD_TRANSFER_DIRECTION_IN, USBD_SHORT_TRANSFER_OK)
  TransferBufferLength = 00000100
  TransferBuffer       = 00000000
  TransferBufferMDL    = 8216a008
  UrbLink              = 00000000
[305586 ms] UsbSnoop - MyInternalIOCTLCompletion(f88c7db0) : fido=823a0430, Irp=81b4e870, Context=81af1cb8, IRQL=2
[305586 ms]  <<<  URB 456 coming back  <<< 
-- URB_FUNCTION_BULK_OR_INTERRUPT_TRANSFER:
  PipeHandle           = 81b44acc [endpoint 0x00000081]
  TransferFlags        = 00000003 (USBD_TRANSFER_DIRECTION_IN, USBD_SHORT_TRANSFER_OK)
  TransferBufferLength = 0000003b
  TransferBuffer       = 00000000
  TransferBufferMDL    = 8216a008
    00000000: 00 00 00 35 00 0a 03 63 68 33 00 08 63 69 6e 65
    00000010: 74 69 71 32 00 00 06 00 02 00 00 04 f0 04 00 0b
    00000020: 00 03 00 00 01 00 00 05 02 00 01 00 00 04 00 00
    00000030: 02 d2 00 41 00 00 01 00 00 42 01
  UrbLink              = 00000000
[305616 ms] UsbSnoop - DispatchAny(f88c6610) : IRP_MJ_INTERNAL_DEVICE_CONTROL
[305616 ms] UsbSnoop - MyDispatchInternalIOCTL(f88c7e80) : fdo=82142030, Irp=81b4e870, IRQL=2
[305616 ms]  >>>  URB 457 going down  >>> 
-- URB_FUNCTION_BULK_OR_INTERRUPT_TRANSFER:
  PipeHandle           = 81b44aec [endpoint 0x00000002]
  TransferFlags        = 00000000 (USBD_TRANSFER_DIRECTION_OUT, ~USBD_SHORT_TRANSFER_OK)
  TransferBufferLength = 00000007
  TransferBuffer       = 00000000
  TransferBufferMDL    = 8216a008
    00000000: 00 00 00 02 05 e0 00
  UrbLink              = 00000000
[305616 ms] UsbSnoop - MyInternalIOCTLCompletion(f88c7db0) : fido=823a0430, Irp=81b4e870, Context=81adbfe8, IRQL=2
[305616 ms]  <<<  URB 457 coming back  <<< 
-- URB_FUNCTION_BULK_OR_INTERRUPT_TRANSFER:
  PipeHandle           = 81b44aec [endpoint 0x00000002]
  TransferFlags        = 00000000 (USBD_TRANSFER_DIRECTION_OUT, ~USBD_SHORT_TRANSFER_OK)
  TransferBufferLength = 00000007
  TransferBuffer       = 00000000
  TransferBufferMDL    = 8216a008
  UrbLink              = 00000000
[305626 ms] UsbSnoop - DispatchAny(f88c6610) : IRP_MJ_INTERNAL_DEVICE_CONTROL
[305626 ms] UsbSnoop - MyDispatchInternalIOCTL(f88c7e80) : fdo=82142030, Irp=81b4e870, IRQL=2
[305626 ms]  >>>  URB 458 going down  >>> 
-- URB_FUNCTION_BULK_OR_INTERRUPT_TRANSFER:
  PipeHandle           = 81b44acc [endpoint 0x00000081]
  TransferFlags        = 00000003 (USBD_TRANSFER_DIRECTION_IN, USBD_SHORT_TRANSFER_OK)
  TransferBufferLength = 00000100
  TransferBuffer       = 00000000
  TransferBufferMDL    = 8216a008
  UrbLink              = 00000000
[305626 ms] UsbSnoop - MyInternalIOCTLCompletion(f88c7db0) : fido=823a0430, Irp=81b4e870, Context=81ad5658, IRQL=2
[305626 ms]  <<<  URB 458 coming back  <<< 
-- URB_FUNCTION_BULK_OR_INTERRUPT_TRANSFER:
  PipeHandle           = 81b44acc [endpoint 0x00000081]
  TransferFlags        = 00000003 (USBD_TRANSFER_DIRECTION_IN, USBD_SHORT_TRANSFER_OK)
  TransferBufferLength = 00000005
  TransferBuffer       = 00000000
  TransferBufferMDL    = 8216a008
    00000000: 00 00 00 3b 04
  UrbLink              = 00000000
[305656 ms] UsbSnoop - DispatchAny(f88c6610) : IRP_MJ_INTERNAL_DEVICE_CONTROL
[305656 ms] UsbSnoop - MyDispatchInternalIOCTL(f88c7e80) : fdo=82142030, Irp=81b4e870, IRQL=2
[305656 ms]  >>>  URB 459 going down  >>> 
-- URB_FUNCTION_BULK_OR_INTERRUPT_TRANSFER:
  PipeHandle           = 81b44acc [endpoint 0x00000081]
  TransferFlags        = 00000003 (USBD_TRANSFER_DIRECTION_IN, USBD_SHORT_TRANSFER_OK)
  TransferBufferLength = 00000100
  TransferBuffer       = 00000000
  TransferBufferMDL    = 8216a008
  UrbLink              = 00000000
[305656 ms] UsbSnoop - MyInternalIOCTLCompletion(f88c7db0) : fido=823a0430, Irp=81b4e870, Context=81af1cb8, IRQL=2
[305656 ms]  <<<  URB 459 coming back  <<< 
-- URB_FUNCTION_BULK_OR_INTERRUPT_TRANSFER:
  PipeHandle           = 81b44acc [endpoint 0x00000081]
  TransferFlags        = 00000003 (USBD_TRANSFER_DIRECTION_IN, USBD_SHORT_TRANSFER_OK)
  TransferBufferLength = 0000003b
  TransferBuffer       = 00000000
  TransferBufferMDL    = 8216a008
    00000000: 00 00 00 35 00 0a 03 63 68 33 00 08 6d 65 63 61
    00000010: 72 65 61 63 00 00 06 00 02 00 00 04 f0 04 00 0b
    00000020: 00 03 00 00 01 00 00 05 02 00 01 00 00 04 00 00
    00000030: 03 08 00 41 00 00 01 00 00 42 01
  UrbLink              = 00000000
[305686 ms] UsbSnoop - DispatchAny(f88c6610) : IRP_MJ_INTERNAL_DEVICE_CONTROL
[305686 ms] UsbSnoop - MyDispatchInternalIOCTL(f88c7e80) : fdo=82142030, Irp=81b4e870, IRQL=2
[305686 ms]  >>>  URB 460 going down  >>> 
-- URB_FUNCTION_BULK_OR_INTERRUPT_TRANSFER:
  PipeHandle           = 81b44aec [endpoint 0x00000002]
  TransferFlags        = 00000000 (USBD_TRANSFER_DIRECTION_OUT, ~USBD_SHORT_TRANSFER_OK)
  TransferBufferLength = 00000007
  TransferBuffer       = 00000000
  TransferBufferMDL    = 8216a008
    00000000: 00 00 00 02 05 e0 00
  UrbLink              = 00000000
[305686 ms] UsbSnoop - MyInternalIOCTLCompletion(f88c7db0) : fido=823a0430, Irp=81b4e870, Context=81ad5658, IRQL=2
[305686 ms]  <<<  URB 460 coming back  <<< 
-- URB_FUNCTION_BULK_OR_INTERRUPT_TRANSFER:
  PipeHandle           = 81b44aec [endpoint 0x00000002]
  TransferFlags        = 00000000 (USBD_TRANSFER_DIRECTION_OUT, ~USBD_SHORT_TRANSFER_OK)
  TransferBufferLength = 00000007
  TransferBuffer       = 00000000
  TransferBufferMDL    = 8216a008
  UrbLink              = 00000000
[305696 ms] UsbSnoop - DispatchAny(f88c6610) : IRP_MJ_INTERNAL_DEVICE_CONTROL
[305696 ms] UsbSnoop - MyDispatchInternalIOCTL(f88c7e80) : fdo=82142030, Irp=81b4e870, IRQL=2
[305696 ms]  >>>  URB 461 going down  >>> 
-- URB_FUNCTION_BULK_OR_INTERRUPT_TRANSFER:
  PipeHandle           = 81b44acc [endpoint 0x00000081]
  TransferFlags        = 00000003 (USBD_TRANSFER_DIRECTION_IN, USBD_SHORT_TRANSFER_OK)
  TransferBufferLength = 00000100
  TransferBuffer       = 00000000
  TransferBufferMDL    = 8216a008
  UrbLink              = 00000000
[305696 ms] UsbSnoop - MyInternalIOCTLCompletion(f88c7db0) : fido=823a0430, Irp=81b4e870, Context=81af3568, IRQL=2
[305696 ms]  <<<  URB 461 coming back  <<< 
-- URB_FUNCTION_BULK_OR_INTERRUPT_TRANSFER:
  PipeHandle           = 81b44acc [endpoint 0x00000081]
  TransferFlags        = 00000003 (USBD_TRANSFER_DIRECTION_IN, USBD_SHORT_TRANSFER_OK)
  TransferBufferLength = 00000005
  TransferBuffer       = 00000000
  TransferBufferMDL    = 8216a008
    00000000: 00 00 00 32 04
  UrbLink              = 00000000
[305726 ms] UsbSnoop - DispatchAny(f88c6610) : IRP_MJ_INTERNAL_DEVICE_CONTROL
[305726 ms] UsbSnoop - MyDispatchInternalIOCTL(f88c7e80) : fdo=82142030, Irp=81b4e870, IRQL=2
[305726 ms]  >>>  URB 462 going down  >>> 
-- URB_FUNCTION_BULK_OR_INTERRUPT_TRANSFER:
  PipeHandle           = 81b44acc [endpoint 0x00000081]
  TransferFlags        = 00000003 (USBD_TRANSFER_DIRECTION_IN, USBD_SHORT_TRANSFER_OK)
  TransferBufferLength = 00000100
  TransferBuffer       = 00000000
  TransferBufferMDL    = 8216a008
  UrbLink              = 00000000
[305726 ms] UsbSnoop - MyInternalIOCTLCompletion(f88c7db0) : fido=823a0430, Irp=81b4e870, Context=81af1cb8, IRQL=2
[305726 ms]  <<<  URB 462 coming back  <<< 
-- URB_FUNCTION_BULK_OR_INTERRUPT_TRANSFER:
  PipeHandle           = 81b44acc [endpoint 0x00000081]
  TransferFlags        = 00000003 (USBD_TRANSFER_DIRECTION_IN, USBD_SHORT_TRANSFER_OK)
  TransferBufferLength = 00000032
  TransferBuffer       = 00000000
  TransferBufferMDL    = 8216a008
    00000000: 00 00 00 2c 00 0a 03 63 68 34 00 00 00 06 00 02
    00000010: 00 00 04 f0 04 00 1f 00 03 00 00 01 00 00 05 02
    00000020: 00 01 00 00 04 00 00 00 0c 00 41 00 00 01 00 00
    00000030: 42 01
  UrbLink              = 00000000
[305756 ms] UsbSnoop - DispatchAny(f88c6610) : IRP_MJ_INTERNAL_DEVICE_CONTROL
[305756 ms] UsbSnoop - MyDispatchInternalIOCTL(f88c7e80) : fdo=82142030, Irp=81b4e870, IRQL=2
[305756 ms]  >>>  URB 463 going down  >>> 
-- URB_FUNCTION_BULK_OR_INTERRUPT_TRANSFER:
  PipeHandle           = 81b44aec [endpoint 0x00000002]
  TransferFlags        = 00000000 (USBD_TRANSFER_DIRECTION_OUT, ~USBD_SHORT_TRANSFER_OK)
  TransferBufferLength = 00000007
  TransferBuffer       = 00000000
  TransferBufferMDL    = 8216a008
    00000000: 00 00 00 02 05 e0 00
  UrbLink              = 00000000
[305756 ms] UsbSnoop - MyInternalIOCTLCompletion(f88c7db0) : fido=823a0430, Irp=81b4e870, Context=81af3568, IRQL=2
[305756 ms]  <<<  URB 463 coming back  <<< 
-- URB_FUNCTION_BULK_OR_INTERRUPT_TRANSFER:
  PipeHandle           = 81b44aec [endpoint 0x00000002]
  TransferFlags        = 00000000 (USBD_TRANSFER_DIRECTION_OUT, ~USBD_SHORT_TRANSFER_OK)
  TransferBufferLength = 00000007
  TransferBuffer       = 00000000
  TransferBufferMDL    = 8216a008
  UrbLink              = 00000000
[305766 ms] UsbSnoop - DispatchAny(f88c6610) : IRP_MJ_INTERNAL_DEVICE_CONTROL
[305766 ms] UsbSnoop - MyDispatchInternalIOCTL(f88c7e80) : fdo=82142030, Irp=81b4e870, IRQL=2
[305766 ms]  >>>  URB 464 going down  >>> 
-- URB_FUNCTION_BULK_OR_INTERRUPT_TRANSFER:
  PipeHandle           = 81b44acc [endpoint 0x00000081]
  TransferFlags        = 00000003 (USBD_TRANSFER_DIRECTION_IN, USBD_SHORT_TRANSFER_OK)
  TransferBufferLength = 00000100
  TransferBuffer       = 00000000
  TransferBufferMDL    = 8216a008
  UrbLink              = 00000000
[305766 ms] UsbSnoop - MyInternalIOCTLCompletion(f88c7db0) : fido=823a0430, Irp=81b4e870, Context=822fb2d8, IRQL=2
[305766 ms]  <<<  URB 464 coming back  <<< 
-- URB_FUNCTION_BULK_OR_INTERRUPT_TRANSFER:
  PipeHandle           = 81b44acc [endpoint 0x00000081]
  TransferFlags        = 00000003 (USBD_TRANSFER_DIRECTION_IN, USBD_SHORT_TRANSFER_OK)
  TransferBufferLength = 00000005
  TransferBuffer       = 00000000
  TransferBufferMDL    = 8216a008
    00000000: 00 00 00 3b 04
  UrbLink              = 00000000
[305796 ms] UsbSnoop - DispatchAny(f88c6610) : IRP_MJ_INTERNAL_DEVICE_CONTROL
[305796 ms] UsbSnoop - MyDispatchInternalIOCTL(f88c7e80) : fdo=82142030, Irp=81b4e870, IRQL=2
[305796 ms]  >>>  URB 465 going down  >>> 
-- URB_FUNCTION_BULK_OR_INTERRUPT_TRANSFER:
  PipeHandle           = 81b44acc [endpoint 0x00000081]
  TransferFlags        = 00000003 (USBD_TRANSFER_DIRECTION_IN, USBD_SHORT_TRANSFER_OK)
  TransferBufferLength = 00000100
  TransferBuffer       = 00000000
  TransferBufferMDL    = 8216a008
  UrbLink              = 00000000
[305796 ms] UsbSnoop - MyInternalIOCTLCompletion(f88c7db0) : fido=823a0430, Irp=81b4e870, Context=822af798, IRQL=2
[305796 ms]  <<<  URB 465 coming back  <<< 
-- URB_FUNCTION_BULK_OR_INTERRUPT_TRANSFER:
  PipeHandle           = 81b44acc [endpoint 0x00000081]
  TransferFlags        = 00000003 (USBD_TRANSFER_DIRECTION_IN, USBD_SHORT_TRANSFER_OK)
  TransferBufferLength = 0000003b
  TransferBuffer       = 00000000
  TransferBufferMDL    = 8216a008
    00000000: 00 00 00 35 00 0a 03 63 68 34 00 08 64 6f 6d 70
    00000010: 72 65 64 6f 00 00 06 00 02 00 00 04 f0 04 00 0b
    00000020: 00 03 00 00 01 00 00 05 02 00 01 00 00 04 00 00
    00000030: 00 eb 00 41 00 00 01 00 00 42 01
  UrbLink              = 00000000
[305828 ms] UsbSnoop - DispatchAny(f88c6610) : IRP_MJ_INTERNAL_DEVICE_CONTROL
[305828 ms] UsbSnoop - MyDispatchInternalIOCTL(f88c7e80) : fdo=82142030, Irp=81b4e870, IRQL=2
[305828 ms]  >>>  URB 466 going down  >>> 
-- URB_FUNCTION_BULK_OR_INTERRUPT_TRANSFER:
  PipeHandle           = 81b44aec [endpoint 0x00000002]
  TransferFlags        = 00000000 (USBD_TRANSFER_DIRECTION_OUT, ~USBD_SHORT_TRANSFER_OK)
  TransferBufferLength = 00000007
  TransferBuffer       = 00000000
  TransferBufferMDL    = 8216a008
    00000000: 00 00 00 02 05 e0 00
  UrbLink              = 00000000
[305828 ms] UsbSnoop - MyInternalIOCTLCompletion(f88c7db0) : fido=823a0430, Irp=81b4e870, Context=81af3568, IRQL=2
[305828 ms]  <<<  URB 466 coming back  <<< 
-- URB_FUNCTION_BULK_OR_INTERRUPT_TRANSFER:
  PipeHandle           = 81b44aec [endpoint 0x00000002]
  TransferFlags        = 00000000 (USBD_TRANSFER_DIRECTION_OUT, ~USBD_SHORT_TRANSFER_OK)
  TransferBufferLength = 00000007
  TransferBuffer       = 00000000
  TransferBufferMDL    = 8216a008
  UrbLink              = 00000000
[305836 ms] UsbSnoop - DispatchAny(f88c6610) : IRP_MJ_INTERNAL_DEVICE_CONTROL
[305836 ms] UsbSnoop - MyDispatchInternalIOCTL(f88c7e80) : fdo=82142030, Irp=81b4e870, IRQL=2
[305836 ms]  >>>  URB 467 going down  >>> 
-- URB_FUNCTION_BULK_OR_INTERRUPT_TRANSFER:
  PipeHandle           = 81b44acc [endpoint 0x00000081]
  TransferFlags        = 00000003 (USBD_TRANSFER_DIRECTION_IN, USBD_SHORT_TRANSFER_OK)
  TransferBufferLength = 00000100
  TransferBuffer       = 00000000
  TransferBufferMDL    = 8216a008
  UrbLink              = 00000000
[305836 ms] UsbSnoop - MyInternalIOCTLCompletion(f88c7db0) : fido=823a0430, Irp=81b4e870, Context=822af798, IRQL=2
[305836 ms]  <<<  URB 467 coming back  <<< 
-- URB_FUNCTION_BULK_OR_INTERRUPT_TRANSFER:
  PipeHandle           = 81b44acc [endpoint 0x00000081]
  TransferFlags        = 00000003 (USBD_TRANSFER_DIRECTION_IN, USBD_SHORT_TRANSFER_OK)
  TransferBufferLength = 00000005
  TransferBuffer       = 00000000
  TransferBufferMDL    = 8216a008
    00000000: 00 00 00 39 04
  UrbLink              = 00000000
[305866 ms] UsbSnoop - DispatchAny(f88c6610) : IRP_MJ_INTERNAL_DEVICE_CONTROL
[305866 ms] UsbSnoop - MyDispatchInternalIOCTL(f88c7e80) : fdo=82142030, Irp=81b4e870, IRQL=2
[305866 ms]  >>>  URB 468 going down  >>> 
-- URB_FUNCTION_BULK_OR_INTERRUPT_TRANSFER:
  PipeHandle           = 81b44acc [endpoint 0x00000081]
  TransferFlags        = 00000003 (USBD_TRANSFER_DIRECTION_IN, USBD_SHORT_TRANSFER_OK)
  TransferBufferLength = 00000100
  TransferBuffer       = 00000000
  TransferBufferMDL    = 8216a008
  UrbLink              = 00000000
[305867 ms] UsbSnoop - MyInternalIOCTLCompletion(f88c7db0) : fido=823a0430, Irp=81b4e870, Context=81ad5658, IRQL=2
[305867 ms]  <<<  URB 468 coming back  <<< 
-- URB_FUNCTION_BULK_OR_INTERRUPT_TRANSFER:
  PipeHandle           = 81b44acc [endpoint 0x00000081]
  TransferFlags        = 00000003 (USBD_TRANSFER_DIRECTION_IN, USBD_SHORT_TRANSFER_OK)
  TransferBufferLength = 00000039
  TransferBuffer       = 00000000
  TransferBufferMDL    = 8216a008
    00000000: 00 00 00 33 00 0a 03 63 68 34 00 06 73 6f 6c 61
    00000010: 63 71 00 00 06 00 02 00 00 04 f0 04 00 0b 00 03
    00000020: 00 00 01 00 00 05 02 00 01 00 00 04 00 00 01 9d
    00000030: 00 41 00 00 01 00 00 42 01
  UrbLink              = 00000000
[305898 ms] UsbSnoop - DispatchAny(f88c6610) : IRP_MJ_INTERNAL_DEVICE_CONTROL
[305898 ms] UsbSnoop - MyDispatchInternalIOCTL(f88c7e80) : fdo=82142030, Irp=81b4e870, IRQL=2
[305898 ms]  >>>  URB 469 going down  >>> 
-- URB_FUNCTION_BULK_OR_INTERRUPT_TRANSFER:
  PipeHandle           = 81b44aec [endpoint 0x00000002]
  TransferFlags        = 00000000 (USBD_TRANSFER_DIRECTION_OUT, ~USBD_SHORT_TRANSFER_OK)
  TransferBufferLength = 00000007
  TransferBuffer       = 00000000
  TransferBufferMDL    = 8216a008
    00000000: 00 00 00 02 05 e0 00
  UrbLink              = 00000000
[305898 ms] UsbSnoop - MyInternalIOCTLCompletion(f88c7db0) : fido=823a0430, Irp=81b4e870, Context=8215da28, IRQL=2
[305898 ms]  <<<  URB 469 coming back  <<< 
-- URB_FUNCTION_BULK_OR_INTERRUPT_TRANSFER:
  PipeHandle           = 81b44aec [endpoint 0x00000002]
  TransferFlags        = 00000000 (USBD_TRANSFER_DIRECTION_OUT, ~USBD_SHORT_TRANSFER_OK)
  TransferBufferLength = 00000007
  TransferBuffer       = 00000000
  TransferBufferMDL    = 8216a008
  UrbLink              = 00000000
[305907 ms] UsbSnoop - DispatchAny(f88c6610) : IRP_MJ_INTERNAL_DEVICE_CONTROL
[305907 ms] UsbSnoop - MyDispatchInternalIOCTL(f88c7e80) : fdo=82142030, Irp=81b4e870, IRQL=2
[305907 ms]  >>>  URB 470 going down  >>> 
-- URB_FUNCTION_BULK_OR_INTERRUPT_TRANSFER:
  PipeHandle           = 81b44acc [endpoint 0x00000081]
  TransferFlags        = 00000003 (USBD_TRANSFER_DIRECTION_IN, USBD_SHORT_TRANSFER_OK)
  TransferBufferLength = 00000100
  TransferBuffer       = 00000000
  TransferBufferMDL    = 8216a008
  UrbLink              = 00000000
[305908 ms] UsbSnoop - MyInternalIOCTLCompletion(f88c7db0) : fido=823a0430, Irp=81b4e870, Context=81ad5658, IRQL=2
[305908 ms]  <<<  URB 470 coming back  <<< 
-- URB_FUNCTION_BULK_OR_INTERRUPT_TRANSFER:
  PipeHandle           = 81b44acc [endpoint 0x00000081]
  TransferFlags        = 00000003 (USBD_TRANSFER_DIRECTION_IN, USBD_SHORT_TRANSFER_OK)
  TransferBufferLength = 00000005
  TransferBuffer       = 00000000
  TransferBufferMDL    = 8216a008
    00000000: 00 00 00 32 04
  UrbLink              = 00000000
[305937 ms] UsbSnoop - DispatchAny(f88c6610) : IRP_MJ_INTERNAL_DEVICE_CONTROL
[305937 ms] UsbSnoop - MyDispatchInternalIOCTL(f88c7e80) : fdo=82142030, Irp=81b4e870, IRQL=2
[305937 ms]  >>>  URB 471 going down  >>> 
-- URB_FUNCTION_BULK_OR_INTERRUPT_TRANSFER:
  PipeHandle           = 81b44acc [endpoint 0x00000081]
  TransferFlags        = 00000003 (USBD_TRANSFER_DIRECTION_IN, USBD_SHORT_TRANSFER_OK)
  TransferBufferLength = 00000100
  TransferBuffer       = 00000000
  TransferBufferMDL    = 8216a008
  UrbLink              = 00000000
[305937 ms] UsbSnoop - MyInternalIOCTLCompletion(f88c7db0) : fido=823a0430, Irp=81b4e870, Context=822fb2d8, IRQL=2
[305937 ms]  <<<  URB 471 coming back  <<< 
-- URB_FUNCTION_BULK_OR_INTERRUPT_TRANSFER:
  PipeHandle           = 81b44acc [endpoint 0x00000081]
  TransferFlags        = 00000003 (USBD_TRANSFER_DIRECTION_IN, USBD_SHORT_TRANSFER_OK)
  TransferBufferLength = 00000032
  TransferBuffer       = 00000000
  TransferBufferMDL    = 8216a008
    00000000: 00 00 00 2c 00 0a 03 63 68 35 00 00 00 06 00 02
    00000010: 00 00 04 f0 04 00 1f 00 03 00 00 01 00 00 05 02
    00000020: 00 01 00 00 04 00 00 00 0c 00 41 00 00 01 00 00
    00000030: 42 01
  UrbLink              = 00000000
[305966 ms] UsbSnoop - DispatchAny(f88c6610) : IRP_MJ_INTERNAL_DEVICE_CONTROL
[305967 ms] UsbSnoop - MyDispatchInternalIOCTL(f88c7e80) : fdo=82142030, Irp=81b4e870, IRQL=2
[305967 ms]  >>>  URB 472 going down  >>> 
-- URB_FUNCTION_BULK_OR_INTERRUPT_TRANSFER:
  PipeHandle           = 81b44aec [endpoint 0x00000002]
  TransferFlags        = 00000000 (USBD_TRANSFER_DIRECTION_OUT, ~USBD_SHORT_TRANSFER_OK)
  TransferBufferLength = 00000007
  TransferBuffer       = 00000000
  TransferBufferMDL    = 8216a008
    00000000: 00 00 00 02 05 e0 00
  UrbLink              = 00000000
[305967 ms] UsbSnoop - MyInternalIOCTLCompletion(f88c7db0) : fido=823a0430, Irp=81b4e870, Context=81ad5658, IRQL=2
[305967 ms]  <<<  URB 472 coming back  <<< 
-- URB_FUNCTION_BULK_OR_INTERRUPT_TRANSFER:
  PipeHandle           = 81b44aec [endpoint 0x00000002]
  TransferFlags        = 00000000 (USBD_TRANSFER_DIRECTION_OUT, ~USBD_SHORT_TRANSFER_OK)
  TransferBufferLength = 00000007
  TransferBuffer       = 00000000
  TransferBufferMDL    = 8216a008
  UrbLink              = 00000000
[305977 ms] UsbSnoop - DispatchAny(f88c6610) : IRP_MJ_INTERNAL_DEVICE_CONTROL
[305977 ms] UsbSnoop - MyDispatchInternalIOCTL(f88c7e80) : fdo=82142030, Irp=81b4e870, IRQL=2
[305977 ms]  >>>  URB 473 going down  >>> 
-- URB_FUNCTION_BULK_OR_INTERRUPT_TRANSFER:
  PipeHandle           = 81b44acc [endpoint 0x00000081]
  TransferFlags        = 00000003 (USBD_TRANSFER_DIRECTION_IN, USBD_SHORT_TRANSFER_OK)
  TransferBufferLength = 00000100
  TransferBuffer       = 00000000
  TransferBufferMDL    = 8216a008
  UrbLink              = 00000000
[305977 ms] UsbSnoop - MyInternalIOCTLCompletion(f88c7db0) : fido=823a0430, Irp=81b4e870, Context=81adbfe8, IRQL=2
[305977 ms]  <<<  URB 473 coming back  <<< 
-- URB_FUNCTION_BULK_OR_INTERRUPT_TRANSFER:
  PipeHandle           = 81b44acc [endpoint 0x00000081]
  TransferFlags        = 00000003 (USBD_TRANSFER_DIRECTION_IN, USBD_SHORT_TRANSFER_OK)
  TransferBufferLength = 00000005
  TransferBuffer       = 00000000
  TransferBufferMDL    = 8216a008
    00000000: 00 00 00 3a 04
  UrbLink              = 00000000
[306008 ms] UsbSnoop - DispatchAny(f88c6610) : IRP_MJ_INTERNAL_DEVICE_CONTROL
[306008 ms] UsbSnoop - MyDispatchInternalIOCTL(f88c7e80) : fdo=82142030, Irp=81b4e870, IRQL=2
[306008 ms]  >>>  URB 474 going down  >>> 
-- URB_FUNCTION_BULK_OR_INTERRUPT_TRANSFER:
  PipeHandle           = 81b44acc [endpoint 0x00000081]
  TransferFlags        = 00000003 (USBD_TRANSFER_DIRECTION_IN, USBD_SHORT_TRANSFER_OK)
  TransferBufferLength = 00000100
  TransferBuffer       = 00000000
  TransferBufferMDL    = 8216a008
  UrbLink              = 00000000
[306008 ms] UsbSnoop - MyInternalIOCTLCompletion(f88c7db0) : fido=823a0430, Irp=81b4e870, Context=822fb2d8, IRQL=2
[306008 ms]  <<<  URB 474 coming back  <<< 
-- URB_FUNCTION_BULK_OR_INTERRUPT_TRANSFER:
  PipeHandle           = 81b44acc [endpoint 0x00000081]
  TransferFlags        = 00000003 (USBD_TRANSFER_DIRECTION_IN, USBD_SHORT_TRANSFER_OK)
  TransferBufferLength = 0000003a
  TransferBuffer       = 00000000
  TransferBufferMDL    = 8216a008
    00000000: 00 00 00 34 00 0a 03 63 68 35 00 07 64 69 61 67
    00000010: 65 70 68 00 00 06 00 02 00 00 04 f0 04 00 0b 00
    00000020: 03 00 00 01 00 00 05 02 00 01 00 00 04 00 00 01
    00000030: 34 00 41 00 00 01 00 00 42 01
  UrbLink              = 00000000
[306037 ms] UsbSnoop - DispatchAny(f88c6610) : IRP_MJ_INTERNAL_DEVICE_CONTROL
[306037 ms] UsbSnoop - MyDispatchInternalIOCTL(f88c7e80) : fdo=82142030, Irp=81b4e870, IRQL=2
[306037 ms]  >>>  URB 475 going down  >>> 
-- URB_FUNCTION_BULK_OR_INTERRUPT_TRANSFER:
  PipeHandle           = 81b44aec [endpoint 0x00000002]
  TransferFlags        = 00000000 (USBD_TRANSFER_DIRECTION_OUT, ~USBD_SHORT_TRANSFER_OK)
  TransferBufferLength = 00000007
  TransferBuffer       = 00000000
  TransferBufferMDL    = 8216a008
    00000000: 00 00 00 02 05 e0 00
  UrbLink              = 00000000
[306037 ms] UsbSnoop - MyInternalIOCTLCompletion(f88c7db0) : fido=823a0430, Irp=81b4e870, Context=81adbfe8, IRQL=2
[306037 ms]  <<<  URB 475 coming back  <<< 
-- URB_FUNCTION_BULK_OR_INTERRUPT_TRANSFER:
  PipeHandle           = 81b44aec [endpoint 0x00000002]
  TransferFlags        = 00000000 (USBD_TRANSFER_DIRECTION_OUT, ~USBD_SHORT_TRANSFER_OK)
  TransferBufferLength = 00000007
  TransferBuffer       = 00000000
  TransferBufferMDL    = 8216a008
  UrbLink              = 00000000
[306047 ms] UsbSnoop - DispatchAny(f88c6610) : IRP_MJ_INTERNAL_DEVICE_CONTROL
[306047 ms] UsbSnoop - MyDispatchInternalIOCTL(f88c7e80) : fdo=82142030, Irp=81b4e870, IRQL=2
[306047 ms]  >>>  URB 476 going down  >>> 
-- URB_FUNCTION_BULK_OR_INTERRUPT_TRANSFER:
  PipeHandle           = 81b44acc [endpoint 0x00000081]
  TransferFlags        = 00000003 (USBD_TRANSFER_DIRECTION_IN, USBD_SHORT_TRANSFER_OK)
  TransferBufferLength = 00000100
  TransferBuffer       = 00000000
  TransferBufferMDL    = 8216a008
  UrbLink              = 00000000
[306047 ms] UsbSnoop - MyInternalIOCTLCompletion(f88c7db0) : fido=823a0430, Irp=81b4e870, Context=81af1cb8, IRQL=2
[306047 ms]  <<<  URB 476 coming back  <<< 
-- URB_FUNCTION_BULK_OR_INTERRUPT_TRANSFER:
  PipeHandle           = 81b44acc [endpoint 0x00000081]
  TransferFlags        = 00000003 (USBD_TRANSFER_DIRECTION_IN, USBD_SHORT_TRANSFER_OK)
  TransferBufferLength = 00000005
  TransferBuffer       = 00000000
  TransferBufferMDL    = 8216a008
    00000000: 00 00 00 38 04
  UrbLink              = 00000000
[306077 ms] UsbSnoop - DispatchAny(f88c6610) : IRP_MJ_INTERNAL_DEVICE_CONTROL
[306077 ms] UsbSnoop - MyDispatchInternalIOCTL(f88c7e80) : fdo=82142030, Irp=81b4e870, IRQL=2
[306077 ms]  >>>  URB 477 going down  >>> 
-- URB_FUNCTION_BULK_OR_INTERRUPT_TRANSFER:
  PipeHandle           = 81b44acc [endpoint 0x00000081]
  TransferFlags        = 00000003 (USBD_TRANSFER_DIRECTION_IN, USBD_SHORT_TRANSFER_OK)
  TransferBufferLength = 00000100
  TransferBuffer       = 00000000
  TransferBufferMDL    = 8216a008
  UrbLink              = 00000000
[306077 ms] UsbSnoop - MyInternalIOCTLCompletion(f88c7db0) : fido=823a0430, Irp=81b4e870, Context=822fb2d8, IRQL=2
[306077 ms]  <<<  URB 477 coming back  <<< 
-- URB_FUNCTION_BULK_OR_INTERRUPT_TRANSFER:
  PipeHandle           = 81b44acc [endpoint 0x00000081]
  TransferFlags        = 00000003 (USBD_TRANSFER_DIRECTION_IN, USBD_SHORT_TRANSFER_OK)
  TransferBufferLength = 00000038
  TransferBuffer       = 00000000
  TransferBufferMDL    = 8216a008
    00000000: 00 00 00 32 00 0a 03 63 68 35 00 05 72 65 64 6f
    00000010: 78 00 00 06 00 02 00 00 04 f0 04 00 0b 00 03 00
    00000020: 00 01 00 00 05 02 00 01 00 00 04 00 00 01 73 00
    00000030: 41 00 00 01 00 00 42 01
  UrbLink              = 00000000
[306107 ms] UsbSnoop - DispatchAny(f88c6610) : IRP_MJ_INTERNAL_DEVICE_CONTROL
[306107 ms] UsbSnoop - MyDispatchInternalIOCTL(f88c7e80) : fdo=82142030, Irp=81b4e870, IRQL=2
[306108 ms]  >>>  URB 478 going down  >>> 
-- URB_FUNCTION_BULK_OR_INTERRUPT_TRANSFER:
  PipeHandle           = 81b44aec [endpoint 0x00000002]
  TransferFlags        = 00000000 (USBD_TRANSFER_DIRECTION_OUT, ~USBD_SHORT_TRANSFER_OK)
  TransferBufferLength = 00000007
  TransferBuffer       = 00000000
  TransferBufferMDL    = 8216a008
    00000000: 00 00 00 02 05 e0 00
  UrbLink              = 00000000
[306108 ms] UsbSnoop - MyInternalIOCTLCompletion(f88c7db0) : fido=823a0430, Irp=81b4e870, Context=81af3568, IRQL=2
[306108 ms]  <<<  URB 478 coming back  <<< 
-- URB_FUNCTION_BULK_OR_INTERRUPT_TRANSFER:
  PipeHandle           = 81b44aec [endpoint 0x00000002]
  TransferFlags        = 00000000 (USBD_TRANSFER_DIRECTION_OUT, ~USBD_SHORT_TRANSFER_OK)
  TransferBufferLength = 00000007
  TransferBuffer       = 00000000
  TransferBufferMDL    = 8216a008
  UrbLink              = 00000000
[306117 ms] UsbSnoop - DispatchAny(f88c6610) : IRP_MJ_INTERNAL_DEVICE_CONTROL
[306117 ms] UsbSnoop - MyDispatchInternalIOCTL(f88c7e80) : fdo=82142030, Irp=81b4e870, IRQL=2
[306117 ms]  >>>  URB 479 going down  >>> 
-- URB_FUNCTION_BULK_OR_INTERRUPT_TRANSFER:
  PipeHandle           = 81b44acc [endpoint 0x00000081]
  TransferFlags        = 00000003 (USBD_TRANSFER_DIRECTION_IN, USBD_SHORT_TRANSFER_OK)
  TransferBufferLength = 00000100
  TransferBuffer       = 00000000
  TransferBufferMDL    = 8216a008
  UrbLink              = 00000000
[306117 ms] UsbSnoop - MyInternalIOCTLCompletion(f88c7db0) : fido=823a0430, Irp=81b4e870, Context=822fb2d8, IRQL=2
[306117 ms]  <<<  URB 479 coming back  <<< 
-- URB_FUNCTION_BULK_OR_INTERRUPT_TRANSFER:
  PipeHandle           = 81b44acc [endpoint 0x00000081]
  TransferFlags        = 00000003 (USBD_TRANSFER_DIRECTION_IN, USBD_SHORT_TRANSFER_OK)
  TransferBufferLength = 00000005
  TransferBuffer       = 00000000
  TransferBufferMDL    = 8216a008
    00000000: 00 00 00 32 04
  UrbLink              = 00000000
[306147 ms] UsbSnoop - DispatchAny(f88c6610) : IRP_MJ_INTERNAL_DEVICE_CONTROL
[306147 ms] UsbSnoop - MyDispatchInternalIOCTL(f88c7e80) : fdo=82142030, Irp=81b4e870, IRQL=2
[306147 ms]  >>>  URB 480 going down  >>> 
-- URB_FUNCTION_BULK_OR_INTERRUPT_TRANSFER:
  PipeHandle           = 81b44acc [endpoint 0x00000081]
  TransferFlags        = 00000003 (USBD_TRANSFER_DIRECTION_IN, USBD_SHORT_TRANSFER_OK)
  TransferBufferLength = 00000100
  TransferBuffer       = 00000000
  TransferBufferMDL    = 8216a008
  UrbLink              = 00000000
[306147 ms] UsbSnoop - MyInternalIOCTLCompletion(f88c7db0) : fido=823a0430, Irp=81b4e870, Context=822fb2d8, IRQL=2
[306147 ms]  <<<  URB 480 coming back  <<< 
-- URB_FUNCTION_BULK_OR_INTERRUPT_TRANSFER:
  PipeHandle           = 81b44acc [endpoint 0x00000081]
  TransferFlags        = 00000003 (USBD_TRANSFER_DIRECTION_IN, USBD_SHORT_TRANSFER_OK)
  TransferBufferLength = 00000032
  TransferBuffer       = 00000000
  TransferBufferMDL    = 8216a008
    00000000: 00 00 00 2c 00 0a 03 63 68 36 00 00 00 06 00 02
    00000010: 00 00 04 f0 04 00 1f 00 03 00 00 01 00 00 05 02
    00000020: 00 01 00 00 04 00 00 00 0c 00 41 00 00 01 00 00
    00000030: 42 01
  UrbLink              = 00000000
[306177 ms] UsbSnoop - DispatchAny(f88c6610) : IRP_MJ_INTERNAL_DEVICE_CONTROL
[306177 ms] UsbSnoop - MyDispatchInternalIOCTL(f88c7e80) : fdo=82142030, Irp=81b4e870, IRQL=2
[306177 ms]  >>>  URB 481 going down  >>> 
-- URB_FUNCTION_BULK_OR_INTERRUPT_TRANSFER:
  PipeHandle           = 81b44aec [endpoint 0x00000002]
  TransferFlags        = 00000000 (USBD_TRANSFER_DIRECTION_OUT, ~USBD_SHORT_TRANSFER_OK)
  TransferBufferLength = 00000007
  TransferBuffer       = 00000000
  TransferBufferMDL    = 8216a008
    00000000: 00 00 00 02 05 e0 00
  UrbLink              = 00000000
[306177 ms] UsbSnoop - MyInternalIOCTLCompletion(f88c7db0) : fido=823a0430, Irp=81b4e870, Context=822fb2d8, IRQL=2
[306177 ms]  <<<  URB 481 coming back  <<< 
-- URB_FUNCTION_BULK_OR_INTERRUPT_TRANSFER:
  PipeHandle           = 81b44aec [endpoint 0x00000002]
  TransferFlags        = 00000000 (USBD_TRANSFER_DIRECTION_OUT, ~USBD_SHORT_TRANSFER_OK)
  TransferBufferLength = 00000007
  TransferBuffer       = 00000000
  TransferBufferMDL    = 8216a008
  UrbLink              = 00000000
[306187 ms] UsbSnoop - DispatchAny(f88c6610) : IRP_MJ_INTERNAL_DEVICE_CONTROL
[306187 ms] UsbSnoop - MyDispatchInternalIOCTL(f88c7e80) : fdo=82142030, Irp=81b4e870, IRQL=2
[306187 ms]  >>>  URB 482 going down  >>> 
-- URB_FUNCTION_BULK_OR_INTERRUPT_TRANSFER:
  PipeHandle           = 81b44acc [endpoint 0x00000081]
  TransferFlags        = 00000003 (USBD_TRANSFER_DIRECTION_IN, USBD_SHORT_TRANSFER_OK)
  TransferBufferLength = 00000100
  TransferBuffer       = 00000000
  TransferBufferMDL    = 8216a008
  UrbLink              = 00000000
[306187 ms] UsbSnoop - MyInternalIOCTLCompletion(f88c7db0) : fido=823a0430, Irp=81b4e870, Context=81adbfe8, IRQL=2
[306187 ms]  <<<  URB 482 coming back  <<< 
-- URB_FUNCTION_BULK_OR_INTERRUPT_TRANSFER:
  PipeHandle           = 81b44acc [endpoint 0x00000081]
  TransferFlags        = 00000003 (USBD_TRANSFER_DIRECTION_IN, USBD_SHORT_TRANSFER_OK)
  TransferBufferLength = 00000005
  TransferBuffer       = 00000000
  TransferBufferMDL    = 8216a008
    00000000: 00 00 00 3b 04
  UrbLink              = 00000000
[306217 ms] UsbSnoop - DispatchAny(f88c6610) : IRP_MJ_INTERNAL_DEVICE_CONTROL
[306217 ms] UsbSnoop - MyDispatchInternalIOCTL(f88c7e80) : fdo=82142030, Irp=81b4e870, IRQL=2
[306217 ms]  >>>  URB 483 going down  >>> 
-- URB_FUNCTION_BULK_OR_INTERRUPT_TRANSFER:
  PipeHandle           = 81b44acc [endpoint 0x00000081]
  TransferFlags        = 00000003 (USBD_TRANSFER_DIRECTION_IN, USBD_SHORT_TRANSFER_OK)
  TransferBufferLength = 00000100
  TransferBuffer       = 00000000
  TransferBufferMDL    = 8216a008
  UrbLink              = 00000000
[306217 ms] UsbSnoop - MyInternalIOCTLCompletion(f88c7db0) : fido=823a0430, Irp=81b4e870, Context=8215da28, IRQL=2
[306217 ms]  <<<  URB 483 coming back  <<< 
-- URB_FUNCTION_BULK_OR_INTERRUPT_TRANSFER:
  PipeHandle           = 81b44acc [endpoint 0x00000081]
  TransferFlags        = 00000003 (USBD_TRANSFER_DIRECTION_IN, USBD_SHORT_TRANSFER_OK)
  TransferBufferLength = 0000003b
  TransferBuffer       = 00000000
  TransferBufferMDL    = 8216a008
    00000000: 00 00 00 35 00 0a 03 63 68 36 00 08 63 6f 6d 70
    00000010: 6c 65 78 65 00 00 06 00 02 00 00 04 f0 04 00 0b
    00000020: 00 03 00 00 01 00 00 05 02 00 01 00 00 04 00 00
    00000030: 00 1d 00 41 00 00 01 00 00 42 01
  UrbLink              = 00000000
[306247 ms] UsbSnoop - DispatchAny(f88c6610) : IRP_MJ_INTERNAL_DEVICE_CONTROL
[306247 ms] UsbSnoop - MyDispatchInternalIOCTL(f88c7e80) : fdo=82142030, Irp=81b4e870, IRQL=2
[306247 ms]  >>>  URB 484 going down  >>> 
-- URB_FUNCTION_BULK_OR_INTERRUPT_TRANSFER:
  PipeHandle           = 81b44aec [endpoint 0x00000002]
  TransferFlags        = 00000000 (USBD_TRANSFER_DIRECTION_OUT, ~USBD_SHORT_TRANSFER_OK)
  TransferBufferLength = 00000007
  TransferBuffer       = 00000000
  TransferBufferMDL    = 8216a008
    00000000: 00 00 00 02 05 e0 00
  UrbLink              = 00000000
[306247 ms] UsbSnoop - MyInternalIOCTLCompletion(f88c7db0) : fido=823a0430, Irp=81b4e870, Context=81ad5658, IRQL=2
[306247 ms]  <<<  URB 484 coming back  <<< 
-- URB_FUNCTION_BULK_OR_INTERRUPT_TRANSFER:
  PipeHandle           = 81b44aec [endpoint 0x00000002]
  TransferFlags        = 00000000 (USBD_TRANSFER_DIRECTION_OUT, ~USBD_SHORT_TRANSFER_OK)
  TransferBufferLength = 00000007
  TransferBuffer       = 00000000
  TransferBufferMDL    = 8216a008
  UrbLink              = 00000000
[306258 ms] UsbSnoop - DispatchAny(f88c6610) : IRP_MJ_INTERNAL_DEVICE_CONTROL
[306258 ms] UsbSnoop - MyDispatchInternalIOCTL(f88c7e80) : fdo=82142030, Irp=81b4e870, IRQL=2
[306258 ms]  >>>  URB 485 going down  >>> 
-- URB_FUNCTION_BULK_OR_INTERRUPT_TRANSFER:
  PipeHandle           = 81b44acc [endpoint 0x00000081]
  TransferFlags        = 00000003 (USBD_TRANSFER_DIRECTION_IN, USBD_SHORT_TRANSFER_OK)
  TransferBufferLength = 00000100
  TransferBuffer       = 00000000
  TransferBufferMDL    = 8216a008
  UrbLink              = 00000000
[306258 ms] UsbSnoop - MyInternalIOCTLCompletion(f88c7db0) : fido=823a0430, Irp=81b4e870, Context=8215da28, IRQL=2
[306258 ms]  <<<  URB 485 coming back  <<< 
-- URB_FUNCTION_BULK_OR_INTERRUPT_TRANSFER:
  PipeHandle           = 81b44acc [endpoint 0x00000081]
  TransferFlags        = 00000003 (USBD_TRANSFER_DIRECTION_IN, USBD_SHORT_TRANSFER_OK)
  TransferBufferLength = 00000005
  TransferBuffer       = 00000000
  TransferBufferMDL    = 8216a008
    00000000: 00 00 00 3b 04
  UrbLink              = 00000000
[306287 ms] UsbSnoop - DispatchAny(f88c6610) : IRP_MJ_INTERNAL_DEVICE_CONTROL
[306287 ms] UsbSnoop - MyDispatchInternalIOCTL(f88c7e80) : fdo=82142030, Irp=81b4e870, IRQL=2
[306287 ms]  >>>  URB 486 going down  >>> 
-- URB_FUNCTION_BULK_OR_INTERRUPT_TRANSFER:
  PipeHandle           = 81b44acc [endpoint 0x00000081]
  TransferFlags        = 00000003 (USBD_TRANSFER_DIRECTION_IN, USBD_SHORT_TRANSFER_OK)
  TransferBufferLength = 00000100
  TransferBuffer       = 00000000
  TransferBufferMDL    = 8216a008
  UrbLink              = 00000000
[306287 ms] UsbSnoop - MyInternalIOCTLCompletion(f88c7db0) : fido=823a0430, Irp=81b4e870, Context=822fb2d8, IRQL=2
[306287 ms]  <<<  URB 486 coming back  <<< 
-- URB_FUNCTION_BULK_OR_INTERRUPT_TRANSFER:
  PipeHandle           = 81b44acc [endpoint 0x00000081]
  TransferFlags        = 00000003 (USBD_TRANSFER_DIRECTION_IN, USBD_SHORT_TRANSFER_OK)
  TransferBufferLength = 0000003b
  TransferBuffer       = 00000000
  TransferBufferMDL    = 8216a008
    00000000: 00 00 00 35 00 0a 03 63 68 36 00 08 6e 6f 6d 63
    00000010: 6f 6d 70 6c 00 00 06 00 02 00 00 04 f0 04 00 0b
    00000020: 00 03 00 00 01 00 00 05 02 00 01 00 00 04 00 00
    00000030: 01 4a 00 41 00 00 01 00 00 42 01
  UrbLink              = 00000000
[306317 ms] UsbSnoop - DispatchAny(f88c6610) : IRP_MJ_INTERNAL_DEVICE_CONTROL
[306317 ms] UsbSnoop - MyDispatchInternalIOCTL(f88c7e80) : fdo=82142030, Irp=81b4e870, IRQL=2
[306317 ms]  >>>  URB 487 going down  >>> 
-- URB_FUNCTION_BULK_OR_INTERRUPT_TRANSFER:
  PipeHandle           = 81b44aec [endpoint 0x00000002]
  TransferFlags        = 00000000 (USBD_TRANSFER_DIRECTION_OUT, ~USBD_SHORT_TRANSFER_OK)
  TransferBufferLength = 00000007
  TransferBuffer       = 00000000
  TransferBufferMDL    = 8216a008
    00000000: 00 00 00 02 05 e0 00
  UrbLink              = 00000000
[306317 ms] UsbSnoop - MyInternalIOCTLCompletion(f88c7db0) : fido=823a0430, Irp=81b4e870, Context=81c6cb60, IRQL=2
[306317 ms]  <<<  URB 487 coming back  <<< 
-- URB_FUNCTION_BULK_OR_INTERRUPT_TRANSFER:
  PipeHandle           = 81b44aec [endpoint 0x00000002]
  TransferFlags        = 00000000 (USBD_TRANSFER_DIRECTION_OUT, ~USBD_SHORT_TRANSFER_OK)
  TransferBufferLength = 00000007
  TransferBuffer       = 00000000
  TransferBufferMDL    = 8216a008
  UrbLink              = 00000000
[306327 ms] UsbSnoop - DispatchAny(f88c6610) : IRP_MJ_INTERNAL_DEVICE_CONTROL
[306327 ms] UsbSnoop - MyDispatchInternalIOCTL(f88c7e80) : fdo=82142030, Irp=81b4e870, IRQL=2
[306327 ms]  >>>  URB 488 going down  >>> 
-- URB_FUNCTION_BULK_OR_INTERRUPT_TRANSFER:
  PipeHandle           = 81b44acc [endpoint 0x00000081]
  TransferFlags        = 00000003 (USBD_TRANSFER_DIRECTION_IN, USBD_SHORT_TRANSFER_OK)
  TransferBufferLength = 00000100
  TransferBuffer       = 00000000
  TransferBufferMDL    = 8216a008
  UrbLink              = 00000000
[306327 ms] UsbSnoop - MyInternalIOCTLCompletion(f88c7db0) : fido=823a0430, Irp=81b4e870, Context=822fb2d8, IRQL=2
[306327 ms]  <<<  URB 488 coming back  <<< 
-- URB_FUNCTION_BULK_OR_INTERRUPT_TRANSFER:
  PipeHandle           = 81b44acc [endpoint 0x00000081]
  TransferFlags        = 00000003 (USBD_TRANSFER_DIRECTION_IN, USBD_SHORT_TRANSFER_OK)
  TransferBufferLength = 00000005
  TransferBuffer       = 00000000
  TransferBufferMDL    = 8216a008
    00000000: 00 00 00 34 04
  UrbLink              = 00000000
[306358 ms] UsbSnoop - DispatchAny(f88c6610) : IRP_MJ_INTERNAL_DEVICE_CONTROL
[306358 ms] UsbSnoop - MyDispatchInternalIOCTL(f88c7e80) : fdo=82142030, Irp=81b4e870, IRQL=2
[306358 ms]  >>>  URB 489 going down  >>> 
-- URB_FUNCTION_BULK_OR_INTERRUPT_TRANSFER:
  PipeHandle           = 81b44acc [endpoint 0x00000081]
  TransferFlags        = 00000003 (USBD_TRANSFER_DIRECTION_IN, USBD_SHORT_TRANSFER_OK)
  TransferBufferLength = 00000100
  TransferBuffer       = 00000000
  TransferBufferMDL    = 8216a008
  UrbLink              = 00000000
[306358 ms] UsbSnoop - MyInternalIOCTLCompletion(f88c7db0) : fido=823a0430, Irp=81b4e870, Context=81ad5658, IRQL=2
[306358 ms]  <<<  URB 489 coming back  <<< 
-- URB_FUNCTION_BULK_OR_INTERRUPT_TRANSFER:
  PipeHandle           = 81b44acc [endpoint 0x00000081]
  TransferFlags        = 00000003 (USBD_TRANSFER_DIRECTION_IN, USBD_SHORT_TRANSFER_OK)
  TransferBufferLength = 00000034
  TransferBuffer       = 00000000
  TransferBufferMDL    = 8216a008
    00000000: 00 00 00 2e 00 0a 05 6c 79 63 65 65 00 00 00 06
    00000010: 00 02 00 00 04 f0 04 00 1f 00 03 00 00 01 00 00
    00000020: 05 02 00 01 00 00 04 00 00 00 0c 00 41 00 00 01
    00000030: 00 00 42 01
  UrbLink              = 00000000
[306387 ms] UsbSnoop - DispatchAny(f88c6610) : IRP_MJ_INTERNAL_DEVICE_CONTROL
[306387 ms] UsbSnoop - MyDispatchInternalIOCTL(f88c7e80) : fdo=82142030, Irp=81b4e870, IRQL=2
[306387 ms]  >>>  URB 490 going down  >>> 
-- URB_FUNCTION_BULK_OR_INTERRUPT_TRANSFER:
  PipeHandle           = 81b44aec [endpoint 0x00000002]
  TransferFlags        = 00000000 (USBD_TRANSFER_DIRECTION_OUT, ~USBD_SHORT_TRANSFER_OK)
  TransferBufferLength = 00000007
  TransferBuffer       = 00000000
  TransferBufferMDL    = 8216a008
    00000000: 00 00 00 02 05 e0 00
  UrbLink              = 00000000
[306387 ms] UsbSnoop - MyInternalIOCTLCompletion(f88c7db0) : fido=823a0430, Irp=81b4e870, Context=81adbfe8, IRQL=2
[306387 ms]  <<<  URB 490 coming back  <<< 
-- URB_FUNCTION_BULK_OR_INTERRUPT_TRANSFER:
  PipeHandle           = 81b44aec [endpoint 0x00000002]
  TransferFlags        = 00000000 (USBD_TRANSFER_DIRECTION_OUT, ~USBD_SHORT_TRANSFER_OK)
  TransferBufferLength = 00000007
  TransferBuffer       = 00000000
  TransferBufferMDL    = 8216a008
  UrbLink              = 00000000
[306397 ms] UsbSnoop - DispatchAny(f88c6610) : IRP_MJ_INTERNAL_DEVICE_CONTROL
[306397 ms] UsbSnoop - MyDispatchInternalIOCTL(f88c7e80) : fdo=82142030, Irp=81b4e870, IRQL=2
[306397 ms]  >>>  URB 491 going down  >>> 
-- URB_FUNCTION_BULK_OR_INTERRUPT_TRANSFER:
  PipeHandle           = 81b44acc [endpoint 0x00000081]
  TransferFlags        = 00000003 (USBD_TRANSFER_DIRECTION_IN, USBD_SHORT_TRANSFER_OK)
  TransferBufferLength = 00000100
  TransferBuffer       = 00000000
  TransferBufferMDL    = 8216a008
  UrbLink              = 00000000
[306397 ms] UsbSnoop - MyInternalIOCTLCompletion(f88c7db0) : fido=823a0430, Irp=81b4e870, Context=81ad5658, IRQL=2
[306397 ms]  <<<  URB 491 coming back  <<< 
-- URB_FUNCTION_BULK_OR_INTERRUPT_TRANSFER:
  PipeHandle           = 81b44acc [endpoint 0x00000081]
  TransferFlags        = 00000003 (USBD_TRANSFER_DIRECTION_IN, USBD_SHORT_TRANSFER_OK)
  TransferBufferLength = 00000005
  TransferBuffer       = 00000000
  TransferBufferMDL    = 8216a008
    00000000: 00 00 00 3d 04
  UrbLink              = 00000000
[306427 ms] UsbSnoop - DispatchAny(f88c6610) : IRP_MJ_INTERNAL_DEVICE_CONTROL
[306427 ms] UsbSnoop - MyDispatchInternalIOCTL(f88c7e80) : fdo=82142030, Irp=81b4e870, IRQL=2
[306427 ms]  >>>  URB 492 going down  >>> 
-- URB_FUNCTION_BULK_OR_INTERRUPT_TRANSFER:
  PipeHandle           = 81b44acc [endpoint 0x00000081]
  TransferFlags        = 00000003 (USBD_TRANSFER_DIRECTION_IN, USBD_SHORT_TRANSFER_OK)
  TransferBufferLength = 00000100
  TransferBuffer       = 00000000
  TransferBufferMDL    = 8216a008
  UrbLink              = 00000000
[306427 ms] UsbSnoop - MyInternalIOCTLCompletion(f88c7db0) : fido=823a0430, Irp=81b4e870, Context=81ad5658, IRQL=2
[306427 ms]  <<<  URB 492 coming back  <<< 
-- URB_FUNCTION_BULK_OR_INTERRUPT_TRANSFER:
  PipeHandle           = 81b44acc [endpoint 0x00000081]
  TransferFlags        = 00000003 (USBD_TRANSFER_DIRECTION_IN, USBD_SHORT_TRANSFER_OK)
  TransferBufferLength = 0000003d
  TransferBuffer       = 00000000
  TransferBufferMDL    = 8216a008
    00000000: 00 00 00 37 00 0a 05 6c 79 63 65 65 00 08 61 6e
    00000010: 64 69 6d 65 6e 73 00 00 06 00 02 00 00 04 f0 04
    00000020: 00 0b 00 03 00 00 01 00 00 05 02 00 01 00 00 04
    00000030: 00 00 00 64 00 41 00 00 01 00 00 42 01
  UrbLink              = 00000000
[306458 ms] UsbSnoop - DispatchAny(f88c6610) : IRP_MJ_INTERNAL_DEVICE_CONTROL
[306458 ms] UsbSnoop - MyDispatchInternalIOCTL(f88c7e80) : fdo=82142030, Irp=81b4e870, IRQL=2
[306458 ms]  >>>  URB 493 going down  >>> 
-- URB_FUNCTION_BULK_OR_INTERRUPT_TRANSFER:
  PipeHandle           = 81b44aec [endpoint 0x00000002]
  TransferFlags        = 00000000 (USBD_TRANSFER_DIRECTION_OUT, ~USBD_SHORT_TRANSFER_OK)
  TransferBufferLength = 00000007
  TransferBuffer       = 00000000
  TransferBufferMDL    = 8216a008
    00000000: 00 00 00 02 05 e0 00
  UrbLink              = 00000000
[306458 ms] UsbSnoop - MyInternalIOCTLCompletion(f88c7db0) : fido=823a0430, Irp=81b4e870, Context=822fb2d8, IRQL=2
[306458 ms]  <<<  URB 493 coming back  <<< 
-- URB_FUNCTION_BULK_OR_INTERRUPT_TRANSFER:
  PipeHandle           = 81b44aec [endpoint 0x00000002]
  TransferFlags        = 00000000 (USBD_TRANSFER_DIRECTION_OUT, ~USBD_SHORT_TRANSFER_OK)
  TransferBufferLength = 00000007
  TransferBuffer       = 00000000
  TransferBufferMDL    = 8216a008
  UrbLink              = 00000000
[306467 ms] UsbSnoop - DispatchAny(f88c6610) : IRP_MJ_INTERNAL_DEVICE_CONTROL
[306467 ms] UsbSnoop - MyDispatchInternalIOCTL(f88c7e80) : fdo=82142030, Irp=81b4e870, IRQL=2
[306467 ms]  >>>  URB 494 going down  >>> 
-- URB_FUNCTION_BULK_OR_INTERRUPT_TRANSFER:
  PipeHandle           = 81b44acc [endpoint 0x00000081]
  TransferFlags        = 00000003 (USBD_TRANSFER_DIRECTION_IN, USBD_SHORT_TRANSFER_OK)
  TransferBufferLength = 00000100
  TransferBuffer       = 00000000
  TransferBufferMDL    = 8216a008
  UrbLink              = 00000000
[306467 ms] UsbSnoop - MyInternalIOCTLCompletion(f88c7db0) : fido=823a0430, Irp=81b4e870, Context=81af1cb8, IRQL=2
[306467 ms]  <<<  URB 494 coming back  <<< 
-- URB_FUNCTION_BULK_OR_INTERRUPT_TRANSFER:
  PipeHandle           = 81b44acc [endpoint 0x00000081]
  TransferFlags        = 00000003 (USBD_TRANSFER_DIRECTION_IN, USBD_SHORT_TRANSFER_OK)
  TransferBufferLength = 00000005
  TransferBuffer       = 00000000
  TransferBufferMDL    = 8216a008
    00000000: 00 00 00 3a 04
  UrbLink              = 00000000
[306497 ms] UsbSnoop - DispatchAny(f88c6610) : IRP_MJ_INTERNAL_DEVICE_CONTROL
[306497 ms] UsbSnoop - MyDispatchInternalIOCTL(f88c7e80) : fdo=82142030, Irp=81b4e870, IRQL=2
[306497 ms]  >>>  URB 495 going down  >>> 
-- URB_FUNCTION_BULK_OR_INTERRUPT_TRANSFER:
  PipeHandle           = 81b44acc [endpoint 0x00000081]
  TransferFlags        = 00000003 (USBD_TRANSFER_DIRECTION_IN, USBD_SHORT_TRANSFER_OK)
  TransferBufferLength = 00000100
  TransferBuffer       = 00000000
  TransferBufferMDL    = 8216a008
  UrbLink              = 00000000
[306497 ms] UsbSnoop - MyInternalIOCTLCompletion(f88c7db0) : fido=823a0430, Irp=81b4e870, Context=81af1cb8, IRQL=2
[306497 ms]  <<<  URB 495 coming back  <<< 
-- URB_FUNCTION_BULK_OR_INTERRUPT_TRANSFER:
  PipeHandle           = 81b44acc [endpoint 0x00000081]
  TransferFlags        = 00000003 (USBD_TRANSFER_DIRECTION_IN, USBD_SHORT_TRANSFER_OK)
  TransferBufferLength = 0000003a
  TransferBuffer       = 00000000
  TransferBufferMDL    = 8216a008
    00000000: 00 00 00 34 00 0a 05 6c 79 63 65 65 00 05 64 61
    00000010: 74 65 73 00 00 06 00 02 00 00 04 f0 04 00 0b 00
    00000020: 03 00 00 01 00 00 05 02 00 01 00 00 04 00 00 01
    00000030: 2b 00 41 00 00 01 00 00 42 01
  UrbLink              = 00000000
[306527 ms] UsbSnoop - DispatchAny(f88c6610) : IRP_MJ_INTERNAL_DEVICE_CONTROL
[306527 ms] UsbSnoop - MyDispatchInternalIOCTL(f88c7e80) : fdo=82142030, Irp=81b4e870, IRQL=2
[306527 ms]  >>>  URB 496 going down  >>> 
-- URB_FUNCTION_BULK_OR_INTERRUPT_TRANSFER:
  PipeHandle           = 81b44aec [endpoint 0x00000002]
  TransferFlags        = 00000000 (USBD_TRANSFER_DIRECTION_OUT, ~USBD_SHORT_TRANSFER_OK)
  TransferBufferLength = 00000007
  TransferBuffer       = 00000000
  TransferBufferMDL    = 8216a008
    00000000: 00 00 00 02 05 e0 00
  UrbLink              = 00000000
[306528 ms] UsbSnoop - MyInternalIOCTLCompletion(f88c7db0) : fido=823a0430, Irp=81b4e870, Context=81ad5658, IRQL=2
[306528 ms]  <<<  URB 496 coming back  <<< 
-- URB_FUNCTION_BULK_OR_INTERRUPT_TRANSFER:
  PipeHandle           = 81b44aec [endpoint 0x00000002]
  TransferFlags        = 00000000 (USBD_TRANSFER_DIRECTION_OUT, ~USBD_SHORT_TRANSFER_OK)
  TransferBufferLength = 00000007
  TransferBuffer       = 00000000
  TransferBufferMDL    = 8216a008
  UrbLink              = 00000000
[306537 ms] UsbSnoop - DispatchAny(f88c6610) : IRP_MJ_INTERNAL_DEVICE_CONTROL
[306537 ms] UsbSnoop - MyDispatchInternalIOCTL(f88c7e80) : fdo=82142030, Irp=81b4e870, IRQL=2
[306537 ms]  >>>  URB 497 going down  >>> 
-- URB_FUNCTION_BULK_OR_INTERRUPT_TRANSFER:
  PipeHandle           = 81b44acc [endpoint 0x00000081]
  TransferFlags        = 00000003 (USBD_TRANSFER_DIRECTION_IN, USBD_SHORT_TRANSFER_OK)
  TransferBufferLength = 00000100
  TransferBuffer       = 00000000
  TransferBufferMDL    = 8216a008
  UrbLink              = 00000000
[306537 ms] UsbSnoop - MyInternalIOCTLCompletion(f88c7db0) : fido=823a0430, Irp=81b4e870, Context=81af1cb8, IRQL=2
[306538 ms]  <<<  URB 497 coming back  <<< 
-- URB_FUNCTION_BULK_OR_INTERRUPT_TRANSFER:
  PipeHandle           = 81b44acc [endpoint 0x00000081]
  TransferFlags        = 00000003 (USBD_TRANSFER_DIRECTION_IN, USBD_SHORT_TRANSFER_OK)
  TransferBufferLength = 00000005
  TransferBuffer       = 00000000
  TransferBufferMDL    = 8216a008
    00000000: 00 00 00 3c 04
  UrbLink              = 00000000
[306567 ms] UsbSnoop - DispatchAny(f88c6610) : IRP_MJ_INTERNAL_DEVICE_CONTROL
[306567 ms] UsbSnoop - MyDispatchInternalIOCTL(f88c7e80) : fdo=82142030, Irp=81b4e870, IRQL=2
[306567 ms]  >>>  URB 498 going down  >>> 
-- URB_FUNCTION_BULK_OR_INTERRUPT_TRANSFER:
  PipeHandle           = 81b44acc [endpoint 0x00000081]
  TransferFlags        = 00000003 (USBD_TRANSFER_DIRECTION_IN, USBD_SHORT_TRANSFER_OK)
  TransferBufferLength = 00000100
  TransferBuffer       = 00000000
  TransferBufferMDL    = 8216a008
  UrbLink              = 00000000
[306568 ms] UsbSnoop - MyInternalIOCTLCompletion(f88c7db0) : fido=823a0430, Irp=81b4e870, Context=822fb2d8, IRQL=2
[306568 ms]  <<<  URB 498 coming back  <<< 
-- URB_FUNCTION_BULK_OR_INTERRUPT_TRANSFER:
  PipeHandle           = 81b44acc [endpoint 0x00000081]
  TransferFlags        = 00000003 (USBD_TRANSFER_DIRECTION_IN, USBD_SHORT_TRANSFER_OK)
  TransferBufferLength = 0000003c
  TransferBuffer       = 00000000
  TransferBufferMDL    = 8216a008
    00000000: 00 00 00 36 00 0a 05 6c 79 63 65 65 00 07 6f 70
    00000010: 74 69 71 75 65 00 00 06 00 02 00 00 04 f0 04 00
    00000020: 0b 00 03 00 00 01 00 00 05 02 00 01 00 00 04 00
    00000030: 00 01 37 00 41 00 00 01 00 00 42 01
  UrbLink              = 00000000
[306597 ms] UsbSnoop - DispatchAny(f88c6610) : IRP_MJ_INTERNAL_DEVICE_CONTROL
[306598 ms] UsbSnoop - MyDispatchInternalIOCTL(f88c7e80) : fdo=82142030, Irp=81b4e870, IRQL=2
[306598 ms]  >>>  URB 499 going down  >>> 
-- URB_FUNCTION_BULK_OR_INTERRUPT_TRANSFER:
  PipeHandle           = 81b44aec [endpoint 0x00000002]
  TransferFlags        = 00000000 (USBD_TRANSFER_DIRECTION_OUT, ~USBD_SHORT_TRANSFER_OK)
  TransferBufferLength = 00000007
  TransferBuffer       = 00000000
  TransferBufferMDL    = 8216a008
    00000000: 00 00 00 02 05 e0 00
  UrbLink              = 00000000
[306598 ms] UsbSnoop - MyInternalIOCTLCompletion(f88c7db0) : fido=823a0430, Irp=81b4e870, Context=81af1cb8, IRQL=2
[306598 ms]  <<<  URB 499 coming back  <<< 
-- URB_FUNCTION_BULK_OR_INTERRUPT_TRANSFER:
  PipeHandle           = 81b44aec [endpoint 0x00000002]
  TransferFlags        = 00000000 (USBD_TRANSFER_DIRECTION_OUT, ~USBD_SHORT_TRANSFER_OK)
  TransferBufferLength = 00000007
  TransferBuffer       = 00000000
  TransferBufferMDL    = 8216a008
  UrbLink              = 00000000
[306608 ms] UsbSnoop - DispatchAny(f88c6610) : IRP_MJ_INTERNAL_DEVICE_CONTROL
[306608 ms] UsbSnoop - MyDispatchInternalIOCTL(f88c7e80) : fdo=82142030, Irp=81b4e870, IRQL=2
[306608 ms]  >>>  URB 500 going down  >>> 
-- URB_FUNCTION_BULK_OR_INTERRUPT_TRANSFER:
  PipeHandle           = 81b44acc [endpoint 0x00000081]
  TransferFlags        = 00000003 (USBD_TRANSFER_DIRECTION_IN, USBD_SHORT_TRANSFER_OK)
  TransferBufferLength = 00000100
  TransferBuffer       = 00000000
  TransferBufferMDL    = 8216a008
  UrbLink              = 00000000
[306608 ms] UsbSnoop - MyInternalIOCTLCompletion(f88c7db0) : fido=823a0430, Irp=81b4e870, Context=8215da28, IRQL=2
[306608 ms]  <<<  URB 500 coming back  <<< 
-- URB_FUNCTION_BULK_OR_INTERRUPT_TRANSFER:
  PipeHandle           = 81b44acc [endpoint 0x00000081]
  TransferFlags        = 00000003 (USBD_TRANSFER_DIRECTION_IN, USBD_SHORT_TRANSFER_OK)
  TransferBufferLength = 00000005
  TransferBuffer       = 00000000
  TransferBufferMDL    = 8216a008
    00000000: 00 00 00 39 04
  UrbLink              = 00000000
[306638 ms] UsbSnoop - DispatchAny(f88c6610) : IRP_MJ_INTERNAL_DEVICE_CONTROL
[306638 ms] UsbSnoop - MyDispatchInternalIOCTL(f88c7e80) : fdo=82142030, Irp=81b4e870, IRQL=2
[306638 ms]  >>>  URB 501 going down  >>> 
-- URB_FUNCTION_BULK_OR_INTERRUPT_TRANSFER:
  PipeHandle           = 81b44acc [endpoint 0x00000081]
  TransferFlags        = 00000003 (USBD_TRANSFER_DIRECTION_IN, USBD_SHORT_TRANSFER_OK)
  TransferBufferLength = 00000100
  TransferBuffer       = 00000000
  TransferBufferMDL    = 8216a008
  UrbLink              = 00000000
[306638 ms] UsbSnoop - MyInternalIOCTLCompletion(f88c7db0) : fido=823a0430, Irp=81b4e870, Context=81c6cb60, IRQL=2
[306638 ms]  <<<  URB 501 coming back  <<< 
-- URB_FUNCTION_BULK_OR_INTERRUPT_TRANSFER:
  PipeHandle           = 81b44acc [endpoint 0x00000081]
  TransferFlags        = 00000003 (USBD_TRANSFER_DIRECTION_IN, USBD_SHORT_TRANSFER_OK)
  TransferBufferLength = 00000039
  TransferBuffer       = 00000000
  TransferBufferMDL    = 8216a008
    00000000: 00 00 00 33 00 0a 05 6c 79 63 65 65 00 04 73 6f
    00000010: 6e 73 00 00 06 00 02 00 00 04 f0 04 00 0b 00 03
    00000020: 00 00 01 00 00 05 02 00 01 00 00 04 00 00 01 91
    00000030: 00 41 00 00 01 00 00 42 01
  UrbLink              = 00000000
[306668 ms] UsbSnoop - DispatchAny(f88c6610) : IRP_MJ_INTERNAL_DEVICE_CONTROL
[306668 ms] UsbSnoop - MyDispatchInternalIOCTL(f88c7e80) : fdo=82142030, Irp=81b4e870, IRQL=2
[306668 ms]  >>>  URB 502 going down  >>> 
-- URB_FUNCTION_BULK_OR_INTERRUPT_TRANSFER:
  PipeHandle           = 81b44aec [endpoint 0x00000002]
  TransferFlags        = 00000000 (USBD_TRANSFER_DIRECTION_OUT, ~USBD_SHORT_TRANSFER_OK)
  TransferBufferLength = 00000007
  TransferBuffer       = 00000000
  TransferBufferMDL    = 8216a008
    00000000: 00 00 00 02 05 e0 00
  UrbLink              = 00000000
[306668 ms] UsbSnoop - MyInternalIOCTLCompletion(f88c7db0) : fido=823a0430, Irp=81b4e870, Context=81ad5658, IRQL=2
[306668 ms]  <<<  URB 502 coming back  <<< 
-- URB_FUNCTION_BULK_OR_INTERRUPT_TRANSFER:
  PipeHandle           = 81b44aec [endpoint 0x00000002]
  TransferFlags        = 00000000 (USBD_TRANSFER_DIRECTION_OUT, ~USBD_SHORT_TRANSFER_OK)
  TransferBufferLength = 00000007
  TransferBuffer       = 00000000
  TransferBufferMDL    = 8216a008
  UrbLink              = 00000000
[306678 ms] UsbSnoop - DispatchAny(f88c6610) : IRP_MJ_INTERNAL_DEVICE_CONTROL
[306678 ms] UsbSnoop - MyDispatchInternalIOCTL(f88c7e80) : fdo=82142030, Irp=81b4e870, IRQL=2
[306678 ms]  >>>  URB 503 going down  >>> 
-- URB_FUNCTION_BULK_OR_INTERRUPT_TRANSFER:
  PipeHandle           = 81b44acc [endpoint 0x00000081]
  TransferFlags        = 00000003 (USBD_TRANSFER_DIRECTION_IN, USBD_SHORT_TRANSFER_OK)
  TransferBufferLength = 00000100
  TransferBuffer       = 00000000
  TransferBufferMDL    = 8216a008
  UrbLink              = 00000000
[306678 ms] UsbSnoop - MyInternalIOCTLCompletion(f88c7db0) : fido=823a0430, Irp=81b4e870, Context=822fb2d8, IRQL=2
[306678 ms]  <<<  URB 503 coming back  <<< 
-- URB_FUNCTION_BULK_OR_INTERRUPT_TRANSFER:
  PipeHandle           = 81b44acc [endpoint 0x00000081]
  TransferFlags        = 00000003 (USBD_TRANSFER_DIRECTION_IN, USBD_SHORT_TRANSFER_OK)
  TransferBufferLength = 00000005
  TransferBuffer       = 00000000
  TransferBufferMDL    = 8216a008
    00000000: 00 00 00 33 04
  UrbLink              = 00000000
[306708 ms] UsbSnoop - DispatchAny(f88c6610) : IRP_MJ_INTERNAL_DEVICE_CONTROL
[306708 ms] UsbSnoop - MyDispatchInternalIOCTL(f88c7e80) : fdo=82142030, Irp=81b4e870, IRQL=2
[306708 ms]  >>>  URB 504 going down  >>> 
-- URB_FUNCTION_BULK_OR_INTERRUPT_TRANSFER:
  PipeHandle           = 81b44acc [endpoint 0x00000081]
  TransferFlags        = 00000003 (USBD_TRANSFER_DIRECTION_IN, USBD_SHORT_TRANSFER_OK)
  TransferBufferLength = 00000100
  TransferBuffer       = 00000000
  TransferBufferMDL    = 8216a008
  UrbLink              = 00000000
[306709 ms] UsbSnoop - MyInternalIOCTLCompletion(f88c7db0) : fido=823a0430, Irp=81b4e870, Context=81c6cb60, IRQL=2
[306709 ms]  <<<  URB 504 coming back  <<< 
-- URB_FUNCTION_BULK_OR_INTERRUPT_TRANSFER:
  PipeHandle           = 81b44acc [endpoint 0x00000081]
  TransferFlags        = 00000003 (USBD_TRANSFER_DIRECTION_IN, USBD_SHORT_TRANSFER_OK)
  TransferBufferLength = 00000033
  TransferBuffer       = 00000000
  TransferBufferMDL    = 8216a008
    00000000: 00 00 00 2d 00 0a 04 6d 61 69 6e 00 00 00 06 00
    00000010: 02 00 00 04 f0 04 00 1f 00 03 00 00 01 00 00 05
    00000020: 02 00 01 00 00 04 00 00 00 0c 00 41 00 00 01 00
    00000030: 00 42 01
  UrbLink              = 00000000
[306738 ms] UsbSnoop - DispatchAny(f88c6610) : IRP_MJ_INTERNAL_DEVICE_CONTROL
[306738 ms] UsbSnoop - MyDispatchInternalIOCTL(f88c7e80) : fdo=82142030, Irp=81b4e870, IRQL=2
[306738 ms]  >>>  URB 505 going down  >>> 
-- URB_FUNCTION_BULK_OR_INTERRUPT_TRANSFER:
  PipeHandle           = 81b44aec [endpoint 0x00000002]
  TransferFlags        = 00000000 (USBD_TRANSFER_DIRECTION_OUT, ~USBD_SHORT_TRANSFER_OK)
  TransferBufferLength = 00000007
  TransferBuffer       = 00000000
  TransferBufferMDL    = 8216a008
    00000000: 00 00 00 02 05 e0 00
  UrbLink              = 00000000
[306738 ms] UsbSnoop - MyInternalIOCTLCompletion(f88c7db0) : fido=823a0430, Irp=81b4e870, Context=822fb2d8, IRQL=2
[306738 ms]  <<<  URB 505 coming back  <<< 
-- URB_FUNCTION_BULK_OR_INTERRUPT_TRANSFER:
  PipeHandle           = 81b44aec [endpoint 0x00000002]
  TransferFlags        = 00000000 (USBD_TRANSFER_DIRECTION_OUT, ~USBD_SHORT_TRANSFER_OK)
  TransferBufferLength = 00000007
  TransferBuffer       = 00000000
  TransferBufferMDL    = 8216a008
  UrbLink              = 00000000
[306748 ms] UsbSnoop - DispatchAny(f88c6610) : IRP_MJ_INTERNAL_DEVICE_CONTROL
[306748 ms] UsbSnoop - MyDispatchInternalIOCTL(f88c7e80) : fdo=82142030, Irp=81b4e870, IRQL=2
[306748 ms]  >>>  URB 506 going down  >>> 
-- URB_FUNCTION_BULK_OR_INTERRUPT_TRANSFER:
  PipeHandle           = 81b44acc [endpoint 0x00000081]
  TransferFlags        = 00000003 (USBD_TRANSFER_DIRECTION_IN, USBD_SHORT_TRANSFER_OK)
  TransferBufferLength = 00000100
  TransferBuffer       = 00000000
  TransferBufferMDL    = 8216a008
  UrbLink              = 00000000
[306748 ms] UsbSnoop - MyInternalIOCTLCompletion(f88c7db0) : fido=823a0430, Irp=81b4e870, Context=81adbfe8, IRQL=2
[306748 ms]  <<<  URB 506 coming back  <<< 
-- URB_FUNCTION_BULK_OR_INTERRUPT_TRANSFER:
  PipeHandle           = 81b44acc [endpoint 0x00000081]
  TransferFlags        = 00000003 (USBD_TRANSFER_DIRECTION_IN, USBD_SHORT_TRANSFER_OK)
  TransferBufferLength = 00000005
  TransferBuffer       = 00000000
  TransferBufferMDL    = 8216a008
    00000000: 00 00 00 39 04
  UrbLink              = 00000000
[306778 ms] UsbSnoop - DispatchAny(f88c6610) : IRP_MJ_INTERNAL_DEVICE_CONTROL
[306778 ms] UsbSnoop - MyDispatchInternalIOCTL(f88c7e80) : fdo=82142030, Irp=81b4e870, IRQL=2
[306778 ms]  >>>  URB 507 going down  >>> 
-- URB_FUNCTION_BULK_OR_INTERRUPT_TRANSFER:
  PipeHandle           = 81b44acc [endpoint 0x00000081]
  TransferFlags        = 00000003 (USBD_TRANSFER_DIRECTION_IN, USBD_SHORT_TRANSFER_OK)
  TransferBufferLength = 00000100
  TransferBuffer       = 00000000
  TransferBufferMDL    = 8216a008
  UrbLink              = 00000000
[306778 ms] UsbSnoop - MyInternalIOCTLCompletion(f88c7db0) : fido=823a0430, Irp=81b4e870, Context=81af1cb8, IRQL=2
[306778 ms]  <<<  URB 507 coming back  <<< 
-- URB_FUNCTION_BULK_OR_INTERRUPT_TRANSFER:
  PipeHandle           = 81b44acc [endpoint 0x00000081]
  TransferFlags        = 00000003 (USBD_TRANSFER_DIRECTION_IN, USBD_SHORT_TRANSFER_OK)
  TransferBufferLength = 00000039
  TransferBuffer       = 00000000
  TransferBufferMDL    = 8216a008
    00000000: 00 00 00 33 00 0a 04 6d 61 69 6e 00 05 63 74 65
    00000010: 70 63 00 00 06 00 02 00 00 04 f0 04 00 0b 00 03
    00000020: 00 00 01 00 00 05 02 00 01 00 00 04 00 00 00 fb
    00000030: 00 41 00 00 01 00 00 42 01
  UrbLink              = 00000000
[306809 ms] UsbSnoop - DispatchAny(f88c6610) : IRP_MJ_INTERNAL_DEVICE_CONTROL
[306809 ms] UsbSnoop - MyDispatchInternalIOCTL(f88c7e80) : fdo=82142030, Irp=81b4e870, IRQL=2
[306809 ms]  >>>  URB 508 going down  >>> 
-- URB_FUNCTION_BULK_OR_INTERRUPT_TRANSFER:
  PipeHandle           = 81b44aec [endpoint 0x00000002]
  TransferFlags        = 00000000 (USBD_TRANSFER_DIRECTION_OUT, ~USBD_SHORT_TRANSFER_OK)
  TransferBufferLength = 00000007
  TransferBuffer       = 00000000
  TransferBufferMDL    = 8216a008
    00000000: 00 00 00 02 05 e0 00
  UrbLink              = 00000000
[306809 ms] UsbSnoop - MyInternalIOCTLCompletion(f88c7db0) : fido=823a0430, Irp=81b4e870, Context=81ad5658, IRQL=2
[306809 ms]  <<<  URB 508 coming back  <<< 
-- URB_FUNCTION_BULK_OR_INTERRUPT_TRANSFER:
  PipeHandle           = 81b44aec [endpoint 0x00000002]
  TransferFlags        = 00000000 (USBD_TRANSFER_DIRECTION_OUT, ~USBD_SHORT_TRANSFER_OK)
  TransferBufferLength = 00000007
  TransferBuffer       = 00000000
  TransferBufferMDL    = 8216a008
  UrbLink              = 00000000
[306818 ms] UsbSnoop - DispatchAny(f88c6610) : IRP_MJ_INTERNAL_DEVICE_CONTROL
[306818 ms] UsbSnoop - MyDispatchInternalIOCTL(f88c7e80) : fdo=82142030, Irp=81b4e870, IRQL=2
[306818 ms]  >>>  URB 509 going down  >>> 
-- URB_FUNCTION_BULK_OR_INTERRUPT_TRANSFER:
  PipeHandle           = 81b44acc [endpoint 0x00000081]
  TransferFlags        = 00000003 (USBD_TRANSFER_DIRECTION_IN, USBD_SHORT_TRANSFER_OK)
  TransferBufferLength = 00000100
  TransferBuffer       = 00000000
  TransferBufferMDL    = 8216a008
  UrbLink              = 00000000
[306818 ms] UsbSnoop - MyInternalIOCTLCompletion(f88c7db0) : fido=823a0430, Irp=81b4e870, Context=81c6cb60, IRQL=2
[306818 ms]  <<<  URB 509 coming back  <<< 
-- URB_FUNCTION_BULK_OR_INTERRUPT_TRANSFER:
  PipeHandle           = 81b44acc [endpoint 0x00000081]
  TransferFlags        = 00000003 (USBD_TRANSFER_DIRECTION_IN, USBD_SHORT_TRANSFER_OK)
  TransferBufferLength = 00000005
  TransferBuffer       = 00000000
  TransferBufferMDL    = 8216a008
    00000000: 00 00 00 3c 04
  UrbLink              = 00000000
[306848 ms] UsbSnoop - DispatchAny(f88c6610) : IRP_MJ_INTERNAL_DEVICE_CONTROL
[306848 ms] UsbSnoop - MyDispatchInternalIOCTL(f88c7e80) : fdo=82142030, Irp=81b4e870, IRQL=2
[306848 ms]  >>>  URB 510 going down  >>> 
-- URB_FUNCTION_BULK_OR_INTERRUPT_TRANSFER:
  PipeHandle           = 81b44acc [endpoint 0x00000081]
  TransferFlags        = 00000003 (USBD_TRANSFER_DIRECTION_IN, USBD_SHORT_TRANSFER_OK)
  TransferBufferLength = 00000100
  TransferBuffer       = 00000000
  TransferBufferMDL    = 8216a008
  UrbLink              = 00000000
[306848 ms] UsbSnoop - MyInternalIOCTLCompletion(f88c7db0) : fido=823a0430, Irp=81b4e870, Context=81af1cb8, IRQL=2
[306848 ms]  <<<  URB 510 coming back  <<< 
-- URB_FUNCTION_BULK_OR_INTERRUPT_TRANSFER:
  PipeHandle           = 81b44acc [endpoint 0x00000081]
  TransferFlags        = 00000003 (USBD_TRANSFER_DIRECTION_IN, USBD_SHORT_TRANSFER_OK)
  TransferBufferLength = 0000003c
  TransferBuffer       = 00000000
  TransferBufferMDL    = 8216a008
    00000000: 00 00 00 36 00 0a 04 6d 61 69 6e 00 08 73 6f 6d
    00000010: 6d 61 69 72 65 00 00 06 00 02 00 00 04 f0 04 00
    00000020: 0b 00 03 00 00 01 00 00 05 02 00 01 00 00 04 00
    00000030: 00 01 12 00 41 00 00 01 00 00 42 01
  UrbLink              = 00000000
[306878 ms] UsbSnoop - DispatchAny(f88c6610) : IRP_MJ_INTERNAL_DEVICE_CONTROL
[306878 ms] UsbSnoop - MyDispatchInternalIOCTL(f88c7e80) : fdo=82142030, Irp=81b4e870, IRQL=2
[306878 ms]  >>>  URB 511 going down  >>> 
-- URB_FUNCTION_BULK_OR_INTERRUPT_TRANSFER:
  PipeHandle           = 81b44aec [endpoint 0x00000002]
  TransferFlags        = 00000000 (USBD_TRANSFER_DIRECTION_OUT, ~USBD_SHORT_TRANSFER_OK)
  TransferBufferLength = 00000007
  TransferBuffer       = 00000000
  TransferBufferMDL    = 8216a008
    00000000: 00 00 00 02 05 e0 00
  UrbLink              = 00000000
[306878 ms] UsbSnoop - MyInternalIOCTLCompletion(f88c7db0) : fido=823a0430, Irp=81b4e870, Context=81c6cb60, IRQL=2
[306878 ms]  <<<  URB 511 coming back  <<< 
-- URB_FUNCTION_BULK_OR_INTERRUPT_TRANSFER:
  PipeHandle           = 81b44aec [endpoint 0x00000002]
  TransferFlags        = 00000000 (USBD_TRANSFER_DIRECTION_OUT, ~USBD_SHORT_TRANSFER_OK)
  TransferBufferLength = 00000007
  TransferBuffer       = 00000000
  TransferBufferMDL    = 8216a008
  UrbLink              = 00000000
[306888 ms] UsbSnoop - DispatchAny(f88c6610) : IRP_MJ_INTERNAL_DEVICE_CONTROL
[306888 ms] UsbSnoop - MyDispatchInternalIOCTL(f88c7e80) : fdo=82142030, Irp=81b4e870, IRQL=2
[306888 ms]  >>>  URB 512 going down  >>> 
-- URB_FUNCTION_BULK_OR_INTERRUPT_TRANSFER:
  PipeHandle           = 81b44acc [endpoint 0x00000081]
  TransferFlags        = 00000003 (USBD_TRANSFER_DIRECTION_IN, USBD_SHORT_TRANSFER_OK)
  TransferBufferLength = 00000100
  TransferBuffer       = 00000000
  TransferBufferMDL    = 8216a008
  UrbLink              = 00000000
[306888 ms] UsbSnoop - MyInternalIOCTLCompletion(f88c7db0) : fido=823a0430, Irp=81b4e870, Context=8215da28, IRQL=2
[306888 ms]  <<<  URB 512 coming back  <<< 
-- URB_FUNCTION_BULK_OR_INTERRUPT_TRANSFER:
  PipeHandle           = 81b44acc [endpoint 0x00000081]
  TransferFlags        = 00000003 (USBD_TRANSFER_DIRECTION_IN, USBD_SHORT_TRANSFER_OK)
  TransferBufferLength = 00000005
  TransferBuffer       = 00000000
  TransferBufferMDL    = 8216a008
    00000000: 00 00 00 35 04
  UrbLink              = 00000000
[306921 ms] UsbSnoop - DispatchAny(f88c6610) : IRP_MJ_INTERNAL_DEVICE_CONTROL
[306921 ms] UsbSnoop - MyDispatchInternalIOCTL(f88c7e80) : fdo=82142030, Irp=81b5d388, IRQL=2
[306921 ms]  >>>  URB 513 going down  >>> 
-- URB_FUNCTION_BULK_OR_INTERRUPT_TRANSFER:
  PipeHandle           = 81b44acc [endpoint 0x00000081]
  TransferFlags        = 00000003 (USBD_TRANSFER_DIRECTION_IN, USBD_SHORT_TRANSFER_OK)
  TransferBufferLength = 00000100
  TransferBuffer       = 00000000
  TransferBufferMDL    = 81cc56a8
  UrbLink              = 00000000
[306922 ms] UsbSnoop - MyInternalIOCTLCompletion(f88c7db0) : fido=823a0430, Irp=81b5d388, Context=81af1cb8, IRQL=2
[306922 ms]  <<<  URB 513 coming back  <<< 
-- URB_FUNCTION_BULK_OR_INTERRUPT_TRANSFER:
  PipeHandle           = 81b44acc [endpoint 0x00000081]
  TransferFlags        = 00000003 (USBD_TRANSFER_DIRECTION_IN, USBD_SHORT_TRANSFER_OK)
  TransferBufferLength = 00000035
  TransferBuffer       = 00000000
  TransferBufferMDL    = 81cc56a8
    00000000: 00 00 00 2f 00 0a 04 6d 61 69 6e 00 01 78 00 00
    00000010: 06 00 02 00 00 04 f0 04 00 00 00 03 00 00 01 00
    00000020: 00 05 02 00 01 00 00 04 00 00 00 05 00 41 00 00
    00000030: 01 00 00 42 01
  UrbLink              = 00000000
[306948 ms] UsbSnoop - DispatchAny(f88c6610) : IRP_MJ_INTERNAL_DEVICE_CONTROL
[306948 ms] UsbSnoop - MyDispatchInternalIOCTL(f88c7e80) : fdo=82142030, Irp=81b5d388, IRQL=2
[306948 ms]  >>>  URB 514 going down  >>> 
-- URB_FUNCTION_BULK_OR_INTERRUPT_TRANSFER:
  PipeHandle           = 81b44aec [endpoint 0x00000002]
  TransferFlags        = 00000000 (USBD_TRANSFER_DIRECTION_OUT, ~USBD_SHORT_TRANSFER_OK)
  TransferBufferLength = 00000007
  TransferBuffer       = 00000000
  TransferBufferMDL    = 81cc56a8
    00000000: 00 00 00 02 05 e0 00
  UrbLink              = 00000000
[306948 ms] UsbSnoop - MyInternalIOCTLCompletion(f88c7db0) : fido=823a0430, Irp=81b5d388, Context=8215da28, IRQL=2
[306948 ms]  <<<  URB 514 coming back  <<< 
-- URB_FUNCTION_BULK_OR_INTERRUPT_TRANSFER:
  PipeHandle           = 81b44aec [endpoint 0x00000002]
  TransferFlags        = 00000000 (USBD_TRANSFER_DIRECTION_OUT, ~USBD_SHORT_TRANSFER_OK)
  TransferBufferLength = 00000007
  TransferBuffer       = 00000000
  TransferBufferMDL    = 81cc56a8
  UrbLink              = 00000000
[306962 ms] UsbSnoop - DispatchAny(f88c6610) : IRP_MJ_INTERNAL_DEVICE_CONTROL
[306962 ms] UsbSnoop - MyDispatchInternalIOCTL(f88c7e80) : fdo=82142030, Irp=81b5d388, IRQL=2
[306962 ms]  >>>  URB 515 going down  >>> 
-- URB_FUNCTION_BULK_OR_INTERRUPT_TRANSFER:
  PipeHandle           = 81b44acc [endpoint 0x00000081]
  TransferFlags        = 00000003 (USBD_TRANSFER_DIRECTION_IN, USBD_SHORT_TRANSFER_OK)
  TransferBufferLength = 00000100
  TransferBuffer       = 00000000
  TransferBufferMDL    = 81cc56a8
  UrbLink              = 00000000
[306963 ms] UsbSnoop - MyInternalIOCTLCompletion(f88c7db0) : fido=823a0430, Irp=81b5d388, Context=81adbfe8, IRQL=2
[306963 ms]  <<<  URB 515 coming back  <<< 
-- URB_FUNCTION_BULK_OR_INTERRUPT_TRANSFER:
  PipeHandle           = 81b44acc [endpoint 0x00000081]
  TransferFlags        = 00000003 (USBD_TRANSFER_DIRECTION_IN, USBD_SHORT_TRANSFER_OK)
  TransferBufferLength = 00000005
  TransferBuffer       = 00000000
  TransferBufferMDL    = 81cc56a8
    00000000: 00 00 00 35 04
  UrbLink              = 00000000
[306988 ms] UsbSnoop - DispatchAny(f88c6610) : IRP_MJ_INTERNAL_DEVICE_CONTROL
[306988 ms] UsbSnoop - MyDispatchInternalIOCTL(f88c7e80) : fdo=82142030, Irp=81b5d388, IRQL=2
[306988 ms]  >>>  URB 516 going down  >>> 
-- URB_FUNCTION_BULK_OR_INTERRUPT_TRANSFER:
  PipeHandle           = 81b44acc [endpoint 0x00000081]
  TransferFlags        = 00000003 (USBD_TRANSFER_DIRECTION_IN, USBD_SHORT_TRANSFER_OK)
  TransferBufferLength = 00000100
  TransferBuffer       = 00000000
  TransferBufferMDL    = 81cc56a8
  UrbLink              = 00000000
[306988 ms] UsbSnoop - MyInternalIOCTLCompletion(f88c7db0) : fido=823a0430, Irp=81b5d388, Context=822fb2d8, IRQL=2
[306988 ms]  <<<  URB 516 coming back  <<< 
-- URB_FUNCTION_BULK_OR_INTERRUPT_TRANSFER:
  PipeHandle           = 81b44acc [endpoint 0x00000081]
  TransferFlags        = 00000003 (USBD_TRANSFER_DIRECTION_IN, USBD_SHORT_TRANSFER_OK)
  TransferBufferLength = 00000035
  TransferBuffer       = 00000000
  TransferBufferMDL    = 81cc56a8
    00000000: 00 00 00 2f 00 0a 04 6d 61 69 6e 00 01 79 00 00
    00000010: 06 00 02 00 00 04 f0 04 00 00 00 03 00 00 01 00
    00000020: 00 05 02 00 01 00 00 04 00 00 00 05 00 41 00 00
    00000030: 01 01 00 42 01
  UrbLink              = 00000000
[307018 ms] UsbSnoop - DispatchAny(f88c6610) : IRP_MJ_INTERNAL_DEVICE_CONTROL
[307018 ms] UsbSnoop - MyDispatchInternalIOCTL(f88c7e80) : fdo=82142030, Irp=81b5d388, IRQL=2
[307018 ms]  >>>  URB 517 going down  >>> 
-- URB_FUNCTION_BULK_OR_INTERRUPT_TRANSFER:
  PipeHandle           = 81b44aec [endpoint 0x00000002]
  TransferFlags        = 00000000 (USBD_TRANSFER_DIRECTION_OUT, ~USBD_SHORT_TRANSFER_OK)
  TransferBufferLength = 00000007
  TransferBuffer       = 00000000
  TransferBufferMDL    = 81cc56a8
    00000000: 00 00 00 02 05 e0 00
  UrbLink              = 00000000
[307018 ms] UsbSnoop - MyInternalIOCTLCompletion(f88c7db0) : fido=823a0430, Irp=81b5d388, Context=8215da28, IRQL=2
[307018 ms]  <<<  URB 517 coming back  <<< 
-- URB_FUNCTION_BULK_OR_INTERRUPT_TRANSFER:
  PipeHandle           = 81b44aec [endpoint 0x00000002]
  TransferFlags        = 00000000 (USBD_TRANSFER_DIRECTION_OUT, ~USBD_SHORT_TRANSFER_OK)
  TransferBufferLength = 00000007
  TransferBuffer       = 00000000
  TransferBufferMDL    = 81cc56a8
  UrbLink              = 00000000
[307028 ms] UsbSnoop - DispatchAny(f88c6610) : IRP_MJ_INTERNAL_DEVICE_CONTROL
[307028 ms] UsbSnoop - MyDispatchInternalIOCTL(f88c7e80) : fdo=82142030, Irp=81b5d388, IRQL=2
[307028 ms]  >>>  URB 518 going down  >>> 
-- URB_FUNCTION_BULK_OR_INTERRUPT_TRANSFER:
  PipeHandle           = 81b44acc [endpoint 0x00000081]
  TransferFlags        = 00000003 (USBD_TRANSFER_DIRECTION_IN, USBD_SHORT_TRANSFER_OK)
  TransferBufferLength = 00000100
  TransferBuffer       = 00000000
  TransferBufferMDL    = 81cc56a8
  UrbLink              = 00000000
[307028 ms] UsbSnoop - MyInternalIOCTLCompletion(f88c7db0) : fido=823a0430, Irp=81b5d388, Context=822fb2d8, IRQL=2
[307028 ms]  <<<  URB 518 coming back  <<< 
-- URB_FUNCTION_BULK_OR_INTERRUPT_TRANSFER:
  PipeHandle           = 81b44acc [endpoint 0x00000081]
  TransferFlags        = 00000003 (USBD_TRANSFER_DIRECTION_IN, USBD_SHORT_TRANSFER_OK)
  TransferBufferLength = 00000005
  TransferBuffer       = 00000000
  TransferBufferMDL    = 81cc56a8
    00000000: 00 00 00 35 04
  UrbLink              = 00000000
[307059 ms] UsbSnoop - DispatchAny(f88c6610) : IRP_MJ_INTERNAL_DEVICE_CONTROL
[307059 ms] UsbSnoop - MyDispatchInternalIOCTL(f88c7e80) : fdo=82142030, Irp=81b5d388, IRQL=2
[307059 ms]  >>>  URB 519 going down  >>> 
-- URB_FUNCTION_BULK_OR_INTERRUPT_TRANSFER:
  PipeHandle           = 81b44acc [endpoint 0x00000081]
  TransferFlags        = 00000003 (USBD_TRANSFER_DIRECTION_IN, USBD_SHORT_TRANSFER_OK)
  TransferBufferLength = 00000100
  TransferBuffer       = 00000000
  TransferBufferMDL    = 81cc56a8
  UrbLink              = 00000000
[307059 ms] UsbSnoop - MyInternalIOCTLCompletion(f88c7db0) : fido=823a0430, Irp=81b5d388, Context=81ad5658, IRQL=2
[307059 ms]  <<<  URB 519 coming back  <<< 
-- URB_FUNCTION_BULK_OR_INTERRUPT_TRANSFER:
  PipeHandle           = 81b44acc [endpoint 0x00000081]
  TransferFlags        = 00000003 (USBD_TRANSFER_DIRECTION_IN, USBD_SHORT_TRANSFER_OK)
  TransferBufferLength = 00000035
  TransferBuffer       = 00000000
  TransferBufferMDL    = 81cc56a8
    00000000: 00 00 00 2f 00 0a 04 6d 61 69 6e 00 01 7a 00 00
    00000010: 06 00 02 00 00 04 f0 04 00 00 00 03 00 00 01 01
    00000020: 00 05 02 00 01 00 00 04 00 00 00 05 00 41 00 00
    00000030: 01 01 00 42 01
  UrbLink              = 00000000
[307088 ms] UsbSnoop - DispatchAny(f88c6610) : IRP_MJ_INTERNAL_DEVICE_CONTROL
[307088 ms] UsbSnoop - MyDispatchInternalIOCTL(f88c7e80) : fdo=82142030, Irp=81b5d388, IRQL=2
[307088 ms]  >>>  URB 520 going down  >>> 
-- URB_FUNCTION_BULK_OR_INTERRUPT_TRANSFER:
  PipeHandle           = 81b44aec [endpoint 0x00000002]
  TransferFlags        = 00000000 (USBD_TRANSFER_DIRECTION_OUT, ~USBD_SHORT_TRANSFER_OK)
  TransferBufferLength = 00000007
  TransferBuffer       = 00000000
  TransferBufferMDL    = 81cc56a8
    00000000: 00 00 00 02 05 e0 00
  UrbLink              = 00000000
[307088 ms] UsbSnoop - MyInternalIOCTLCompletion(f88c7db0) : fido=823a0430, Irp=81b5d388, Context=81c6cb60, IRQL=2
[307088 ms]  <<<  URB 520 coming back  <<< 
-- URB_FUNCTION_BULK_OR_INTERRUPT_TRANSFER:
  PipeHandle           = 81b44aec [endpoint 0x00000002]
  TransferFlags        = 00000000 (USBD_TRANSFER_DIRECTION_OUT, ~USBD_SHORT_TRANSFER_OK)
  TransferBufferLength = 00000007
  TransferBuffer       = 00000000
  TransferBufferMDL    = 81cc56a8
  UrbLink              = 00000000
[307099 ms] UsbSnoop - DispatchAny(f88c6610) : IRP_MJ_INTERNAL_DEVICE_CONTROL
[307099 ms] UsbSnoop - MyDispatchInternalIOCTL(f88c7e80) : fdo=82142030, Irp=81b5d388, IRQL=2
[307099 ms]  >>>  URB 521 going down  >>> 
-- URB_FUNCTION_BULK_OR_INTERRUPT_TRANSFER:
  PipeHandle           = 81b44acc [endpoint 0x00000081]
  TransferFlags        = 00000003 (USBD_TRANSFER_DIRECTION_IN, USBD_SHORT_TRANSFER_OK)
  TransferBufferLength = 00000100
  TransferBuffer       = 00000000
  TransferBufferMDL    = 81cc56a8
  UrbLink              = 00000000
[307099 ms] UsbSnoop - MyInternalIOCTLCompletion(f88c7db0) : fido=823a0430, Irp=81b5d388, Context=81adbfe8, IRQL=2
[307099 ms]  <<<  URB 521 coming back  <<< 
-- URB_FUNCTION_BULK_OR_INTERRUPT_TRANSFER:
  PipeHandle           = 81b44acc [endpoint 0x00000081]
  TransferFlags        = 00000003 (USBD_TRANSFER_DIRECTION_IN, USBD_SHORT_TRANSFER_OK)
  TransferBufferLength = 00000005
  TransferBuffer       = 00000000
  TransferBufferMDL    = 81cc56a8
    00000000: 00 00 00 34 04
  UrbLink              = 00000000
[307128 ms] UsbSnoop - DispatchAny(f88c6610) : IRP_MJ_INTERNAL_DEVICE_CONTROL
[307128 ms] UsbSnoop - MyDispatchInternalIOCTL(f88c7e80) : fdo=82142030, Irp=81b5d388, IRQL=2
[307128 ms]  >>>  URB 522 going down  >>> 
-- URB_FUNCTION_BULK_OR_INTERRUPT_TRANSFER:
  PipeHandle           = 81b44acc [endpoint 0x00000081]
  TransferFlags        = 00000003 (USBD_TRANSFER_DIRECTION_IN, USBD_SHORT_TRANSFER_OK)
  TransferBufferLength = 00000100
  TransferBuffer       = 00000000
  TransferBufferMDL    = 81cc56a8
  UrbLink              = 00000000
[307128 ms] UsbSnoop - MyInternalIOCTLCompletion(f88c7db0) : fido=823a0430, Irp=81b5d388, Context=81adbfe8, IRQL=2
[307128 ms]  <<<  URB 522 coming back  <<< 
-- URB_FUNCTION_BULK_OR_INTERRUPT_TRANSFER:
  PipeHandle           = 81b44acc [endpoint 0x00000081]
  TransferFlags        = 00000003 (USBD_TRANSFER_DIRECTION_IN, USBD_SHORT_TRANSFER_OK)
  TransferBufferLength = 00000034
  TransferBuffer       = 00000000
  TransferBufferMDL    = 81cc56a8
    00000000: 00 00 00 2e 00 0a 05 6d 61 74 68 73 00 00 00 06
    00000010: 00 02 00 00 04 f0 04 00 1f 00 03 00 00 01 00 00
    00000020: 05 02 00 01 00 00 04 00 00 00 0c 00 41 00 00 01
    00000030: 00 00 42 01
  UrbLink              = 00000000
[307159 ms] UsbSnoop - DispatchAny(f88c6610) : IRP_MJ_INTERNAL_DEVICE_CONTROL
[307159 ms] UsbSnoop - MyDispatchInternalIOCTL(f88c7e80) : fdo=82142030, Irp=81b5d388, IRQL=2
[307159 ms]  >>>  URB 523 going down  >>> 
-- URB_FUNCTION_BULK_OR_INTERRUPT_TRANSFER:
  PipeHandle           = 81b44aec [endpoint 0x00000002]
  TransferFlags        = 00000000 (USBD_TRANSFER_DIRECTION_OUT, ~USBD_SHORT_TRANSFER_OK)
  TransferBufferLength = 00000007
  TransferBuffer       = 00000000
  TransferBufferMDL    = 81cc56a8
    00000000: 00 00 00 02 05 e0 00
  UrbLink              = 00000000
[307159 ms] UsbSnoop - MyInternalIOCTLCompletion(f88c7db0) : fido=823a0430, Irp=81b5d388, Context=822fb2d8, IRQL=2
[307159 ms]  <<<  URB 523 coming back  <<< 
-- URB_FUNCTION_BULK_OR_INTERRUPT_TRANSFER:
  PipeHandle           = 81b44aec [endpoint 0x00000002]
  TransferFlags        = 00000000 (USBD_TRANSFER_DIRECTION_OUT, ~USBD_SHORT_TRANSFER_OK)
  TransferBufferLength = 00000007
  TransferBuffer       = 00000000
  TransferBufferMDL    = 81cc56a8
  UrbLink              = 00000000
[307168 ms] UsbSnoop - DispatchAny(f88c6610) : IRP_MJ_INTERNAL_DEVICE_CONTROL
[307168 ms] UsbSnoop - MyDispatchInternalIOCTL(f88c7e80) : fdo=82142030, Irp=81b5d388, IRQL=2
[307168 ms]  >>>  URB 524 going down  >>> 
-- URB_FUNCTION_BULK_OR_INTERRUPT_TRANSFER:
  PipeHandle           = 81b44acc [endpoint 0x00000081]
  TransferFlags        = 00000003 (USBD_TRANSFER_DIRECTION_IN, USBD_SHORT_TRANSFER_OK)
  TransferBufferLength = 00000100
  TransferBuffer       = 00000000
  TransferBufferMDL    = 81cc56a8
  UrbLink              = 00000000
[307169 ms] UsbSnoop - MyInternalIOCTLCompletion(f88c7db0) : fido=823a0430, Irp=81b5d388, Context=81af1cb8, IRQL=2
[307169 ms]  <<<  URB 524 coming back  <<< 
-- URB_FUNCTION_BULK_OR_INTERRUPT_TRANSFER:
  PipeHandle           = 81b44acc [endpoint 0x00000081]
  TransferFlags        = 00000003 (USBD_TRANSFER_DIRECTION_IN, USBD_SHORT_TRANSFER_OK)
  TransferBufferLength = 00000005
  TransferBuffer       = 00000000
  TransferBufferMDL    = 81cc56a8
    00000000: 00 00 00 3c 04
  UrbLink              = 00000000
[307198 ms] UsbSnoop - DispatchAny(f88c6610) : IRP_MJ_INTERNAL_DEVICE_CONTROL
[307198 ms] UsbSnoop - MyDispatchInternalIOCTL(f88c7e80) : fdo=82142030, Irp=81b5d388, IRQL=2
[307198 ms]  >>>  URB 525 going down  >>> 
-- URB_FUNCTION_BULK_OR_INTERRUPT_TRANSFER:
  PipeHandle           = 81b44acc [endpoint 0x00000081]
  TransferFlags        = 00000003 (USBD_TRANSFER_DIRECTION_IN, USBD_SHORT_TRANSFER_OK)
  TransferBufferLength = 00000100
  TransferBuffer       = 00000000
  TransferBufferMDL    = 81cc56a8
  UrbLink              = 00000000
[307199 ms] UsbSnoop - MyInternalIOCTLCompletion(f88c7db0) : fido=823a0430, Irp=81b5d388, Context=81adbfe8, IRQL=2
[307199 ms]  <<<  URB 525 coming back  <<< 
-- URB_FUNCTION_BULK_OR_INTERRUPT_TRANSFER:
  PipeHandle           = 81b44acc [endpoint 0x00000081]
  TransferFlags        = 00000003 (USBD_TRANSFER_DIRECTION_IN, USBD_SHORT_TRANSFER_OK)
  TransferBufferLength = 0000003c
  TransferBuffer       = 00000000
  TransferBufferMDL    = 81cc56a8
    00000000: 00 00 00 36 00 0a 05 6d 61 74 68 73 00 07 61 6e
    00000010: 61 76 65 63 74 00 00 06 00 02 00 00 04 f0 04 00
    00000020: 0b 00 03 00 00 01 00 00 05 02 00 01 00 00 04 00
    00000030: 00 00 da 00 41 00 00 01 00 00 42 01
  UrbLink              = 00000000
[307228 ms] UsbSnoop - DispatchAny(f88c6610) : IRP_MJ_INTERNAL_DEVICE_CONTROL
[307228 ms] UsbSnoop - MyDispatchInternalIOCTL(f88c7e80) : fdo=82142030, Irp=81b5d388, IRQL=2
[307228 ms]  >>>  URB 526 going down  >>> 
-- URB_FUNCTION_BULK_OR_INTERRUPT_TRANSFER:
  PipeHandle           = 81b44aec [endpoint 0x00000002]
  TransferFlags        = 00000000 (USBD_TRANSFER_DIRECTION_OUT, ~USBD_SHORT_TRANSFER_OK)
  TransferBufferLength = 00000007
  TransferBuffer       = 00000000
  TransferBufferMDL    = 81cc56a8
    00000000: 00 00 00 02 05 e0 00
  UrbLink              = 00000000
[307229 ms] UsbSnoop - MyInternalIOCTLCompletion(f88c7db0) : fido=823a0430, Irp=81b5d388, Context=81af1cb8, IRQL=2
[307229 ms]  <<<  URB 526 coming back  <<< 
-- URB_FUNCTION_BULK_OR_INTERRUPT_TRANSFER:
  PipeHandle           = 81b44aec [endpoint 0x00000002]
  TransferFlags        = 00000000 (USBD_TRANSFER_DIRECTION_OUT, ~USBD_SHORT_TRANSFER_OK)
  TransferBufferLength = 00000007
  TransferBuffer       = 00000000
  TransferBufferMDL    = 81cc56a8
  UrbLink              = 00000000
[307238 ms] UsbSnoop - DispatchAny(f88c6610) : IRP_MJ_INTERNAL_DEVICE_CONTROL
[307239 ms] UsbSnoop - MyDispatchInternalIOCTL(f88c7e80) : fdo=82142030, Irp=81b5d388, IRQL=2
[307239 ms]  >>>  URB 527 going down  >>> 
-- URB_FUNCTION_BULK_OR_INTERRUPT_TRANSFER:
  PipeHandle           = 81b44acc [endpoint 0x00000081]
  TransferFlags        = 00000003 (USBD_TRANSFER_DIRECTION_IN, USBD_SHORT_TRANSFER_OK)
  TransferBufferLength = 00000100
  TransferBuffer       = 00000000
  TransferBufferMDL    = 81cc56a8
  UrbLink              = 00000000
[307239 ms] UsbSnoop - MyInternalIOCTLCompletion(f88c7db0) : fido=823a0430, Irp=81b5d388, Context=8215da28, IRQL=2
[307239 ms]  <<<  URB 527 coming back  <<< 
-- URB_FUNCTION_BULK_OR_INTERRUPT_TRANSFER:
  PipeHandle           = 81b44acc [endpoint 0x00000081]
  TransferFlags        = 00000003 (USBD_TRANSFER_DIRECTION_IN, USBD_SHORT_TRANSFER_OK)
  TransferBufferLength = 00000005
  TransferBuffer       = 00000000
  TransferBufferMDL    = 81cc56a8
    00000000: 00 00 00 3c 04
  UrbLink              = 00000000
[307269 ms] UsbSnoop - DispatchAny(f88c6610) : IRP_MJ_INTERNAL_DEVICE_CONTROL
[307269 ms] UsbSnoop - MyDispatchInternalIOCTL(f88c7e80) : fdo=82142030, Irp=81b5d388, IRQL=2
[307269 ms]  >>>  URB 528 going down  >>> 
-- URB_FUNCTION_BULK_OR_INTERRUPT_TRANSFER:
  PipeHandle           = 81b44acc [endpoint 0x00000081]
  TransferFlags        = 00000003 (USBD_TRANSFER_DIRECTION_IN, USBD_SHORT_TRANSFER_OK)
  TransferBufferLength = 00000100
  TransferBuffer       = 00000000
  TransferBufferMDL    = 81cc56a8
  UrbLink              = 00000000
[307269 ms] UsbSnoop - MyInternalIOCTLCompletion(f88c7db0) : fido=823a0430, Irp=81b5d388, Context=81ad5658, IRQL=2
[307269 ms]  <<<  URB 528 coming back  <<< 
-- URB_FUNCTION_BULK_OR_INTERRUPT_TRANSFER:
  PipeHandle           = 81b44acc [endpoint 0x00000081]
  TransferFlags        = 00000003 (USBD_TRANSFER_DIRECTION_IN, USBD_SHORT_TRANSFER_OK)
  TransferBufferLength = 0000003c
  TransferBuffer       = 00000000
  TransferBufferMDL    = 81cc56a8
    00000000: 00 00 00 36 00 0a 05 6d 61 74 68 73 00 07 63 6f
    00000010: 6f 72 64 6f 6e 00 00 06 00 02 00 00 04 f0 04 00
    00000020: 0b 00 03 00 00 01 00 00 05 02 00 01 00 00 04 00
    00000030: 00 01 39 00 41 00 00 01 00 00 42 01
  UrbLink              = 00000000
[307299 ms] UsbSnoop - DispatchAny(f88c6610) : IRP_MJ_INTERNAL_DEVICE_CONTROL
[307299 ms] UsbSnoop - MyDispatchInternalIOCTL(f88c7e80) : fdo=82142030, Irp=81b5d388, IRQL=2
[307299 ms]  >>>  URB 529 going down  >>> 
-- URB_FUNCTION_BULK_OR_INTERRUPT_TRANSFER:
  PipeHandle           = 81b44aec [endpoint 0x00000002]
  TransferFlags        = 00000000 (USBD_TRANSFER_DIRECTION_OUT, ~USBD_SHORT_TRANSFER_OK)
  TransferBufferLength = 00000007
  TransferBuffer       = 00000000
  TransferBufferMDL    = 81cc56a8
    00000000: 00 00 00 02 05 e0 00
  UrbLink              = 00000000
[307299 ms] UsbSnoop - MyInternalIOCTLCompletion(f88c7db0) : fido=823a0430, Irp=81b5d388, Context=822fb2d8, IRQL=2
[307299 ms]  <<<  URB 529 coming back  <<< 
-- URB_FUNCTION_BULK_OR_INTERRUPT_TRANSFER:
  PipeHandle           = 81b44aec [endpoint 0x00000002]
  TransferFlags        = 00000000 (USBD_TRANSFER_DIRECTION_OUT, ~USBD_SHORT_TRANSFER_OK)
  TransferBufferLength = 00000007
  TransferBuffer       = 00000000
  TransferBufferMDL    = 81cc56a8
  UrbLink              = 00000000
[307309 ms] UsbSnoop - DispatchAny(f88c6610) : IRP_MJ_INTERNAL_DEVICE_CONTROL
[307309 ms] UsbSnoop - MyDispatchInternalIOCTL(f88c7e80) : fdo=82142030, Irp=81b5d388, IRQL=2
[307309 ms]  >>>  URB 530 going down  >>> 
-- URB_FUNCTION_BULK_OR_INTERRUPT_TRANSFER:
  PipeHandle           = 81b44acc [endpoint 0x00000081]
  TransferFlags        = 00000003 (USBD_TRANSFER_DIRECTION_IN, USBD_SHORT_TRANSFER_OK)
  TransferBufferLength = 00000100
  TransferBuffer       = 00000000
  TransferBufferMDL    = 81cc56a8
  UrbLink              = 00000000
[307310 ms] UsbSnoop - MyInternalIOCTLCompletion(f88c7db0) : fido=823a0430, Irp=81b5d388, Context=81adbfe8, IRQL=2
[307310 ms]  <<<  URB 530 coming back  <<< 
-- URB_FUNCTION_BULK_OR_INTERRUPT_TRANSFER:
  PipeHandle           = 81b44acc [endpoint 0x00000081]
  TransferFlags        = 00000003 (USBD_TRANSFER_DIRECTION_IN, USBD_SHORT_TRANSFER_OK)
  TransferBufferLength = 00000005
  TransferBuffer       = 00000000
  TransferBufferMDL    = 81cc56a8
    00000000: 00 00 00 3d 04
  UrbLink              = 00000000
[307339 ms] UsbSnoop - DispatchAny(f88c6610) : IRP_MJ_INTERNAL_DEVICE_CONTROL
[307339 ms] UsbSnoop - MyDispatchInternalIOCTL(f88c7e80) : fdo=82142030, Irp=81b5d388, IRQL=2
[307339 ms]  >>>  URB 531 going down  >>> 
-- URB_FUNCTION_BULK_OR_INTERRUPT_TRANSFER:
  PipeHandle           = 81b44acc [endpoint 0x00000081]
  TransferFlags        = 00000003 (USBD_TRANSFER_DIRECTION_IN, USBD_SHORT_TRANSFER_OK)
  TransferBufferLength = 00000100
  TransferBuffer       = 00000000
  TransferBufferMDL    = 81cc56a8
  UrbLink              = 00000000
[307339 ms] UsbSnoop - MyInternalIOCTLCompletion(f88c7db0) : fido=823a0430, Irp=81b5d388, Context=81ad5658, IRQL=2
[307339 ms]  <<<  URB 531 coming back  <<< 
-- URB_FUNCTION_BULK_OR_INTERRUPT_TRANSFER:
  PipeHandle           = 81b44acc [endpoint 0x00000081]
  TransferFlags        = 00000003 (USBD_TRANSFER_DIRECTION_IN, USBD_SHORT_TRANSFER_OK)
  TransferBufferLength = 0000003d
  TransferBuffer       = 00000000
  TransferBufferMDL    = 81cc56a8
    00000000: 00 00 00 37 00 0a 05 6d 61 74 68 73 00 08 64 65
    00000010: 72 69 76 65 65 73 00 00 06 00 02 00 00 04 f0 04
    00000020: 00 0b 00 03 00 00 01 00 00 05 02 00 01 00 00 04
    00000030: 00 00 00 e5 00 41 00 00 01 00 00 42 01
  UrbLink              = 00000000
[307369 ms] UsbSnoop - DispatchAny(f88c6610) : IRP_MJ_INTERNAL_DEVICE_CONTROL
[307369 ms] UsbSnoop - MyDispatchInternalIOCTL(f88c7e80) : fdo=82142030, Irp=81b5d388, IRQL=2
[307369 ms]  >>>  URB 532 going down  >>> 
-- URB_FUNCTION_BULK_OR_INTERRUPT_TRANSFER:
  PipeHandle           = 81b44aec [endpoint 0x00000002]
  TransferFlags        = 00000000 (USBD_TRANSFER_DIRECTION_OUT, ~USBD_SHORT_TRANSFER_OK)
  TransferBufferLength = 00000007
  TransferBuffer       = 00000000
  TransferBufferMDL    = 81cc56a8
    00000000: 00 00 00 02 05 e0 00
  UrbLink              = 00000000
[307369 ms] UsbSnoop - MyInternalIOCTLCompletion(f88c7db0) : fido=823a0430, Irp=81b5d388, Context=81adbfe8, IRQL=2
[307369 ms]  <<<  URB 532 coming back  <<< 
-- URB_FUNCTION_BULK_OR_INTERRUPT_TRANSFER:
  PipeHandle           = 81b44aec [endpoint 0x00000002]
  TransferFlags        = 00000000 (USBD_TRANSFER_DIRECTION_OUT, ~USBD_SHORT_TRANSFER_OK)
  TransferBufferLength = 00000007
  TransferBuffer       = 00000000
  TransferBufferMDL    = 81cc56a8
  UrbLink              = 00000000
[307379 ms] UsbSnoop - DispatchAny(f88c6610) : IRP_MJ_INTERNAL_DEVICE_CONTROL
[307379 ms] UsbSnoop - MyDispatchInternalIOCTL(f88c7e80) : fdo=82142030, Irp=81b5d388, IRQL=2
[307379 ms]  >>>  URB 533 going down  >>> 
-- URB_FUNCTION_BULK_OR_INTERRUPT_TRANSFER:
  PipeHandle           = 81b44acc [endpoint 0x00000081]
  TransferFlags        = 00000003 (USBD_TRANSFER_DIRECTION_IN, USBD_SHORT_TRANSFER_OK)
  TransferBufferLength = 00000100
  TransferBuffer       = 00000000
  TransferBufferMDL    = 81cc56a8
  UrbLink              = 00000000
[307379 ms] UsbSnoop - MyInternalIOCTLCompletion(f88c7db0) : fido=823a0430, Irp=81b5d388, Context=81c6cb60, IRQL=2
[307379 ms]  <<<  URB 533 coming back  <<< 
-- URB_FUNCTION_BULK_OR_INTERRUPT_TRANSFER:
  PipeHandle           = 81b44acc [endpoint 0x00000081]
  TransferFlags        = 00000003 (USBD_TRANSFER_DIRECTION_IN, USBD_SHORT_TRANSFER_OK)
  TransferBufferLength = 00000005
  TransferBuffer       = 00000000
  TransferBufferMDL    = 81cc56a8
    00000000: 00 00 00 3d 04
  UrbLink              = 00000000
[307410 ms] UsbSnoop - DispatchAny(f88c6610) : IRP_MJ_INTERNAL_DEVICE_CONTROL
[307410 ms] UsbSnoop - MyDispatchInternalIOCTL(f88c7e80) : fdo=82142030, Irp=81b5d388, IRQL=2
[307410 ms]  >>>  URB 534 going down  >>> 
-- URB_FUNCTION_BULK_OR_INTERRUPT_TRANSFER:
  PipeHandle           = 81b44acc [endpoint 0x00000081]
  TransferFlags        = 00000003 (USBD_TRANSFER_DIRECTION_IN, USBD_SHORT_TRANSFER_OK)
  TransferBufferLength = 00000100
  TransferBuffer       = 00000000
  TransferBufferMDL    = 81cc56a8
  UrbLink              = 00000000
[307410 ms] UsbSnoop - MyInternalIOCTLCompletion(f88c7db0) : fido=823a0430, Irp=81b5d388, Context=81ad5658, IRQL=2
[307410 ms]  <<<  URB 534 coming back  <<< 
-- URB_FUNCTION_BULK_OR_INTERRUPT_TRANSFER:
  PipeHandle           = 81b44acc [endpoint 0x00000081]
  TransferFlags        = 00000003 (USBD_TRANSFER_DIRECTION_IN, USBD_SHORT_TRANSFER_OK)
  TransferBufferLength = 0000003d
  TransferBuffer       = 00000000
  TransferBufferMDL    = 81cc56a8
    00000000: 00 00 00 37 00 0a 05 6d 61 74 68 73 00 08 65 71
    00000010: 75 61 64 69 66 66 00 00 06 00 02 00 00 04 f0 04
    00000020: 00 0b 00 03 00 00 01 00 00 05 02 00 01 00 00 04
    00000030: 00 00 00 bc 00 41 00 00 01 00 00 42 01
  UrbLink              = 00000000
[307439 ms] UsbSnoop - DispatchAny(f88c6610) : IRP_MJ_INTERNAL_DEVICE_CONTROL
[307439 ms] UsbSnoop - MyDispatchInternalIOCTL(f88c7e80) : fdo=82142030, Irp=81b5d388, IRQL=2
[307439 ms]  >>>  URB 535 going down  >>> 
-- URB_FUNCTION_BULK_OR_INTERRUPT_TRANSFER:
  PipeHandle           = 81b44aec [endpoint 0x00000002]
  TransferFlags        = 00000000 (USBD_TRANSFER_DIRECTION_OUT, ~USBD_SHORT_TRANSFER_OK)
  TransferBufferLength = 00000007
  TransferBuffer       = 00000000
  TransferBufferMDL    = 81cc56a8
    00000000: 00 00 00 02 05 e0 00
  UrbLink              = 00000000
[307439 ms] UsbSnoop - MyInternalIOCTLCompletion(f88c7db0) : fido=823a0430, Irp=81b5d388, Context=81c6cb60, IRQL=2
[307439 ms]  <<<  URB 535 coming back  <<< 
-- URB_FUNCTION_BULK_OR_INTERRUPT_TRANSFER:
  PipeHandle           = 81b44aec [endpoint 0x00000002]
  TransferFlags        = 00000000 (USBD_TRANSFER_DIRECTION_OUT, ~USBD_SHORT_TRANSFER_OK)
  TransferBufferLength = 00000007
  TransferBuffer       = 00000000
  TransferBufferMDL    = 81cc56a8
  UrbLink              = 00000000
[307449 ms] UsbSnoop - DispatchAny(f88c6610) : IRP_MJ_INTERNAL_DEVICE_CONTROL
[307449 ms] UsbSnoop - MyDispatchInternalIOCTL(f88c7e80) : fdo=82142030, Irp=81b5d388, IRQL=2
[307449 ms]  >>>  URB 536 going down  >>> 
-- URB_FUNCTION_BULK_OR_INTERRUPT_TRANSFER:
  PipeHandle           = 81b44acc [endpoint 0x00000081]
  TransferFlags        = 00000003 (USBD_TRANSFER_DIRECTION_IN, USBD_SHORT_TRANSFER_OK)
  TransferBufferLength = 00000100
  TransferBuffer       = 00000000
  TransferBufferMDL    = 81cc56a8
  UrbLink              = 00000000
[307449 ms] UsbSnoop - MyInternalIOCTLCompletion(f88c7db0) : fido=823a0430, Irp=81b5d388, Context=8215da28, IRQL=2
[307449 ms]  <<<  URB 536 coming back  <<< 
-- URB_FUNCTION_BULK_OR_INTERRUPT_TRANSFER:
  PipeHandle           = 81b44acc [endpoint 0x00000081]
  TransferFlags        = 00000003 (USBD_TRANSFER_DIRECTION_IN, USBD_SHORT_TRANSFER_OK)
  TransferBufferLength = 00000005
  TransferBuffer       = 00000000
  TransferBufferMDL    = 81cc56a8
    00000000: 00 00 00 3d 04
  UrbLink              = 00000000
[307479 ms] UsbSnoop - DispatchAny(f88c6610) : IRP_MJ_INTERNAL_DEVICE_CONTROL
[307479 ms] UsbSnoop - MyDispatchInternalIOCTL(f88c7e80) : fdo=82142030, Irp=81b5d388, IRQL=2
[307479 ms]  >>>  URB 537 going down  >>> 
-- URB_FUNCTION_BULK_OR_INTERRUPT_TRANSFER:
  PipeHandle           = 81b44acc [endpoint 0x00000081]
  TransferFlags        = 00000003 (USBD_TRANSFER_DIRECTION_IN, USBD_SHORT_TRANSFER_OK)
  TransferBufferLength = 00000100
  TransferBuffer       = 00000000
  TransferBufferMDL    = 81cc56a8
  UrbLink              = 00000000
[307479 ms] UsbSnoop - MyInternalIOCTLCompletion(f88c7db0) : fido=823a0430, Irp=81b5d388, Context=81af1cb8, IRQL=2
[307479 ms]  <<<  URB 537 coming back  <<< 
-- URB_FUNCTION_BULK_OR_INTERRUPT_TRANSFER:
  PipeHandle           = 81b44acc [endpoint 0x00000081]
  TransferFlags        = 00000003 (USBD_TRANSFER_DIRECTION_IN, USBD_SHORT_TRANSFER_OK)
  TransferBufferLength = 0000003d
  TransferBuffer       = 00000000
  TransferBufferMDL    = 81cc56a8
    00000000: 00 00 00 37 00 0a 05 6d 61 74 68 73 00 08 69 6e
    00000010: 74 65 67 72 61 74 00 00 06 00 02 00 00 04 f0 04
    00000020: 00 0b 00 03 00 00 01 00 00 05 02 00 01 00 00 04
    00000030: 00 00 00 39 00 41 00 00 01 00 00 42 01
  UrbLink              = 00000000
[307510 ms] UsbSnoop - DispatchAny(f88c6610) : IRP_MJ_INTERNAL_DEVICE_CONTROL
[307510 ms] UsbSnoop - MyDispatchInternalIOCTL(f88c7e80) : fdo=82142030, Irp=81b5d388, IRQL=2
[307510 ms]  >>>  URB 538 going down  >>> 
-- URB_FUNCTION_BULK_OR_INTERRUPT_TRANSFER:
  PipeHandle           = 81b44aec [endpoint 0x00000002]
  TransferFlags        = 00000000 (USBD_TRANSFER_DIRECTION_OUT, ~USBD_SHORT_TRANSFER_OK)
  TransferBufferLength = 00000007
  TransferBuffer       = 00000000
  TransferBufferMDL    = 81cc56a8
    00000000: 00 00 00 02 05 e0 00
  UrbLink              = 00000000
[307510 ms] UsbSnoop - MyInternalIOCTLCompletion(f88c7db0) : fido=823a0430, Irp=81b5d388, Context=81adbfe8, IRQL=2
[307510 ms]  <<<  URB 538 coming back  <<< 
-- URB_FUNCTION_BULK_OR_INTERRUPT_TRANSFER:
  PipeHandle           = 81b44aec [endpoint 0x00000002]
  TransferFlags        = 00000000 (USBD_TRANSFER_DIRECTION_OUT, ~USBD_SHORT_TRANSFER_OK)
  TransferBufferLength = 00000007
  TransferBuffer       = 00000000
  TransferBufferMDL    = 81cc56a8
  UrbLink              = 00000000
[307519 ms] UsbSnoop - DispatchAny(f88c6610) : IRP_MJ_INTERNAL_DEVICE_CONTROL
[307519 ms] UsbSnoop - MyDispatchInternalIOCTL(f88c7e80) : fdo=82142030, Irp=81b5d388, IRQL=2
[307519 ms]  >>>  URB 539 going down  >>> 
-- URB_FUNCTION_BULK_OR_INTERRUPT_TRANSFER:
  PipeHandle           = 81b44acc [endpoint 0x00000081]
  TransferFlags        = 00000003 (USBD_TRANSFER_DIRECTION_IN, USBD_SHORT_TRANSFER_OK)
  TransferBufferLength = 00000100
  TransferBuffer       = 00000000
  TransferBufferMDL    = 81cc56a8
  UrbLink              = 00000000
[307519 ms] UsbSnoop - MyInternalIOCTLCompletion(f88c7db0) : fido=823a0430, Irp=81b5d388, Context=81ad5658, IRQL=2
[307519 ms]  <<<  URB 539 coming back  <<< 
-- URB_FUNCTION_BULK_OR_INTERRUPT_TRANSFER:
  PipeHandle           = 81b44acc [endpoint 0x00000081]
  TransferFlags        = 00000003 (USBD_TRANSFER_DIRECTION_IN, USBD_SHORT_TRANSFER_OK)
  TransferBufferLength = 00000005
  TransferBuffer       = 00000000
  TransferBufferMDL    = 81cc56a8
    00000000: 00 00 00 3d 04
  UrbLink              = 00000000
[307549 ms] UsbSnoop - DispatchAny(f88c6610) : IRP_MJ_INTERNAL_DEVICE_CONTROL
[307549 ms] UsbSnoop - MyDispatchInternalIOCTL(f88c7e80) : fdo=82142030, Irp=81b5d388, IRQL=2
[307549 ms]  >>>  URB 540 going down  >>> 
-- URB_FUNCTION_BULK_OR_INTERRUPT_TRANSFER:
  PipeHandle           = 81b44acc [endpoint 0x00000081]
  TransferFlags        = 00000003 (USBD_TRANSFER_DIRECTION_IN, USBD_SHORT_TRANSFER_OK)
  TransferBufferLength = 00000100
  TransferBuffer       = 00000000
  TransferBufferMDL    = 81cc56a8
  UrbLink              = 00000000
[307549 ms] UsbSnoop - MyInternalIOCTLCompletion(f88c7db0) : fido=823a0430, Irp=81b5d388, Context=81c6cb60, IRQL=2
[307549 ms]  <<<  URB 540 coming back  <<< 
-- URB_FUNCTION_BULK_OR_INTERRUPT_TRANSFER:
  PipeHandle           = 81b44acc [endpoint 0x00000081]
  TransferFlags        = 00000003 (USBD_TRANSFER_DIRECTION_IN, USBD_SHORT_TRANSFER_OK)
  TransferBufferLength = 0000003d
  TransferBuffer       = 00000000
  TransferBufferMDL    = 81cc56a8
    00000000: 00 00 00 37 00 0a 05 6d 61 74 68 73 00 08 6f 70
    00000010: 65 72 61 74 65 75 00 00 06 00 02 00 00 04 f0 04
    00000020: 00 0b 00 03 00 00 01 00 00 05 02 00 01 00 00 04
    00000030: 00 00 01 18 00 41 00 00 01 00 00 42 01
  UrbLink              = 00000000
[307579 ms] UsbSnoop - DispatchAny(f88c6610) : IRP_MJ_INTERNAL_DEVICE_CONTROL
[307579 ms] UsbSnoop - MyDispatchInternalIOCTL(f88c7e80) : fdo=82142030, Irp=81b5d388, IRQL=2
[307579 ms]  >>>  URB 541 going down  >>> 
-- URB_FUNCTION_BULK_OR_INTERRUPT_TRANSFER:
  PipeHandle           = 81b44aec [endpoint 0x00000002]
  TransferFlags        = 00000000 (USBD_TRANSFER_DIRECTION_OUT, ~USBD_SHORT_TRANSFER_OK)
  TransferBufferLength = 00000007
  TransferBuffer       = 00000000
  TransferBufferMDL    = 81cc56a8
    00000000: 00 00 00 02 05 e0 00
  UrbLink              = 00000000
[307579 ms] UsbSnoop - MyInternalIOCTLCompletion(f88c7db0) : fido=823a0430, Irp=81b5d388, Context=81adbfe8, IRQL=2
[307579 ms]  <<<  URB 541 coming back  <<< 
-- URB_FUNCTION_BULK_OR_INTERRUPT_TRANSFER:
  PipeHandle           = 81b44aec [endpoint 0x00000002]
  TransferFlags        = 00000000 (USBD_TRANSFER_DIRECTION_OUT, ~USBD_SHORT_TRANSFER_OK)
  TransferBufferLength = 00000007
  TransferBuffer       = 00000000
  TransferBufferMDL    = 81cc56a8
  UrbLink              = 00000000
[307589 ms] UsbSnoop - DispatchAny(f88c6610) : IRP_MJ_INTERNAL_DEVICE_CONTROL
[307589 ms] UsbSnoop - MyDispatchInternalIOCTL(f88c7e80) : fdo=82142030, Irp=81b5d388, IRQL=2
[307589 ms]  >>>  URB 542 going down  >>> 
-- URB_FUNCTION_BULK_OR_INTERRUPT_TRANSFER:
  PipeHandle           = 81b44acc [endpoint 0x00000081]
  TransferFlags        = 00000003 (USBD_TRANSFER_DIRECTION_IN, USBD_SHORT_TRANSFER_OK)
  TransferBufferLength = 00000100
  TransferBuffer       = 00000000
  TransferBufferMDL    = 81cc56a8
  UrbLink              = 00000000
[307589 ms] UsbSnoop - MyInternalIOCTLCompletion(f88c7db0) : fido=823a0430, Irp=81b5d388, Context=81c6cb60, IRQL=2
[307589 ms]  <<<  URB 542 coming back  <<< 
-- URB_FUNCTION_BULK_OR_INTERRUPT_TRANSFER:
  PipeHandle           = 81b44acc [endpoint 0x00000081]
  TransferFlags        = 00000003 (USBD_TRANSFER_DIRECTION_IN, USBD_SHORT_TRANSFER_OK)
  TransferBufferLength = 00000005
  TransferBuffer       = 00000000
  TransferBufferMDL    = 81cc56a8
    00000000: 00 00 00 3a 04
  UrbLink              = 00000000
[307619 ms] UsbSnoop - DispatchAny(f88c6610) : IRP_MJ_INTERNAL_DEVICE_CONTROL
[307619 ms] UsbSnoop - MyDispatchInternalIOCTL(f88c7e80) : fdo=82142030, Irp=81b5d388, IRQL=2
[307619 ms]  >>>  URB 543 going down  >>> 
-- URB_FUNCTION_BULK_OR_INTERRUPT_TRANSFER:
  PipeHandle           = 81b44acc [endpoint 0x00000081]
  TransferFlags        = 00000003 (USBD_TRANSFER_DIRECTION_IN, USBD_SHORT_TRANSFER_OK)
  TransferBufferLength = 00000100
  TransferBuffer       = 00000000
  TransferBufferMDL    = 81cc56a8
  UrbLink              = 00000000
[307619 ms] UsbSnoop - MyInternalIOCTLCompletion(f88c7db0) : fido=823a0430, Irp=81b5d388, Context=81ad5658, IRQL=2
[307619 ms]  <<<  URB 543 coming back  <<< 
-- URB_FUNCTION_BULK_OR_INTERRUPT_TRANSFER:
  PipeHandle           = 81b44acc [endpoint 0x00000081]
  TransferFlags        = 00000003 (USBD_TRANSFER_DIRECTION_IN, USBD_SHORT_TRANSFER_OK)
  TransferBufferLength = 0000003a
  TransferBuffer       = 00000000
  TransferBufferMDL    = 81cc56a8
    00000000: 00 00 00 34 00 0a 05 6d 61 74 68 73 00 05 74 72
    00000010: 69 67 6f 00 00 06 00 02 00 00 04 f0 04 00 0b 00
    00000020: 03 00 00 01 00 00 05 02 00 01 00 00 04 00 00 02
    00000030: 95 00 41 00 00 01 00 00 42 01
  UrbLink              = 00000000
[307649 ms] UsbSnoop - DispatchAny(f88c6610) : IRP_MJ_INTERNAL_DEVICE_CONTROL
[307649 ms] UsbSnoop - MyDispatchInternalIOCTL(f88c7e80) : fdo=82142030, Irp=81b5d388, IRQL=2
[307649 ms]  >>>  URB 544 going down  >>> 
-- URB_FUNCTION_BULK_OR_INTERRUPT_TRANSFER:
  PipeHandle           = 81b44aec [endpoint 0x00000002]
  TransferFlags        = 00000000 (USBD_TRANSFER_DIRECTION_OUT, ~USBD_SHORT_TRANSFER_OK)
  TransferBufferLength = 00000007
  TransferBuffer       = 00000000
  TransferBufferMDL    = 81cc56a8
    00000000: 00 00 00 02 05 e0 00
  UrbLink              = 00000000
[307649 ms] UsbSnoop - MyInternalIOCTLCompletion(f88c7db0) : fido=823a0430, Irp=81b5d388, Context=81c6cb60, IRQL=2
[307649 ms]  <<<  URB 544 coming back  <<< 
-- URB_FUNCTION_BULK_OR_INTERRUPT_TRANSFER:
  PipeHandle           = 81b44aec [endpoint 0x00000002]
  TransferFlags        = 00000000 (USBD_TRANSFER_DIRECTION_OUT, ~USBD_SHORT_TRANSFER_OK)
  TransferBufferLength = 00000007
  TransferBuffer       = 00000000
  TransferBufferMDL    = 81cc56a8
  UrbLink              = 00000000
[307660 ms] UsbSnoop - DispatchAny(f88c6610) : IRP_MJ_INTERNAL_DEVICE_CONTROL
[307660 ms] UsbSnoop - MyDispatchInternalIOCTL(f88c7e80) : fdo=82142030, Irp=81b5d388, IRQL=2
[307660 ms]  >>>  URB 545 going down  >>> 
-- URB_FUNCTION_BULK_OR_INTERRUPT_TRANSFER:
  PipeHandle           = 81b44acc [endpoint 0x00000081]
  TransferFlags        = 00000003 (USBD_TRANSFER_DIRECTION_IN, USBD_SHORT_TRANSFER_OK)
  TransferBufferLength = 00000100
  TransferBuffer       = 00000000
  TransferBufferMDL    = 81cc56a8
  UrbLink              = 00000000
[307660 ms] UsbSnoop - MyInternalIOCTLCompletion(f88c7db0) : fido=823a0430, Irp=81b5d388, Context=81af1cb8, IRQL=2
[307660 ms]  <<<  URB 545 coming back  <<< 
-- URB_FUNCTION_BULK_OR_INTERRUPT_TRANSFER:
  PipeHandle           = 81b44acc [endpoint 0x00000081]
  TransferFlags        = 00000003 (USBD_TRANSFER_DIRECTION_IN, USBD_SHORT_TRANSFER_OK)
  TransferBufferLength = 00000005
  TransferBuffer       = 00000000
  TransferBufferMDL    = 81cc56a8
    00000000: 00 00 00 31 04
  UrbLink              = 00000000
[307689 ms] UsbSnoop - DispatchAny(f88c6610) : IRP_MJ_INTERNAL_DEVICE_CONTROL
[307689 ms] UsbSnoop - MyDispatchInternalIOCTL(f88c7e80) : fdo=82142030, Irp=81b5d388, IRQL=2
[307689 ms]  >>>  URB 546 going down  >>> 
-- URB_FUNCTION_BULK_OR_INTERRUPT_TRANSFER:
  PipeHandle           = 81b44acc [endpoint 0x00000081]
  TransferFlags        = 00000003 (USBD_TRANSFER_DIRECTION_IN, USBD_SHORT_TRANSFER_OK)
  TransferBufferLength = 00000100
  TransferBuffer       = 00000000
  TransferBufferMDL    = 81cc56a8
  UrbLink              = 00000000
[307689 ms] UsbSnoop - MyInternalIOCTLCompletion(f88c7db0) : fido=823a0430, Irp=81b5d388, Context=81ad5658, IRQL=2
[307689 ms]  <<<  URB 546 coming back  <<< 
-- URB_FUNCTION_BULK_OR_INTERRUPT_TRANSFER:
  PipeHandle           = 81b44acc [endpoint 0x00000081]
  TransferFlags        = 00000003 (USBD_TRANSFER_DIRECTION_IN, USBD_SHORT_TRANSFER_OK)
  TransferBufferLength = 00000031
  TransferBuffer       = 00000000
  TransferBufferMDL    = 81cc56a8
    00000000: 00 00 00 2b 00 0a 02 70 31 00 00 00 06 00 02 00
    00000010: 00 04 f0 04 00 1f 00 03 00 00 01 00 00 05 02 00
    00000020: 01 00 00 04 00 00 00 0c 00 41 00 00 01 00 00 42
    00000030: 01
  UrbLink              = 00000000
[307719 ms] UsbSnoop - DispatchAny(f88c6610) : IRP_MJ_INTERNAL_DEVICE_CONTROL
[307719 ms] UsbSnoop - MyDispatchInternalIOCTL(f88c7e80) : fdo=82142030, Irp=81b5d388, IRQL=2
[307719 ms]  >>>  URB 547 going down  >>> 
-- URB_FUNCTION_BULK_OR_INTERRUPT_TRANSFER:
  PipeHandle           = 81b44aec [endpoint 0x00000002]
  TransferFlags        = 00000000 (USBD_TRANSFER_DIRECTION_OUT, ~USBD_SHORT_TRANSFER_OK)
  TransferBufferLength = 00000007
  TransferBuffer       = 00000000
  TransferBufferMDL    = 81cc56a8
    00000000: 00 00 00 02 05 e0 00
  UrbLink              = 00000000
[307719 ms] UsbSnoop - MyInternalIOCTLCompletion(f88c7db0) : fido=823a0430, Irp=81b5d388, Context=81af1cb8, IRQL=2
[307719 ms]  <<<  URB 547 coming back  <<< 
-- URB_FUNCTION_BULK_OR_INTERRUPT_TRANSFER:
  PipeHandle           = 81b44aec [endpoint 0x00000002]
  TransferFlags        = 00000000 (USBD_TRANSFER_DIRECTION_OUT, ~USBD_SHORT_TRANSFER_OK)
  TransferBufferLength = 00000007
  TransferBuffer       = 00000000
  TransferBufferMDL    = 81cc56a8
  UrbLink              = 00000000
[307729 ms] UsbSnoop - DispatchAny(f88c6610) : IRP_MJ_INTERNAL_DEVICE_CONTROL
[307729 ms] UsbSnoop - MyDispatchInternalIOCTL(f88c7e80) : fdo=82142030, Irp=81b5d388, IRQL=2
[307729 ms]  >>>  URB 548 going down  >>> 
-- URB_FUNCTION_BULK_OR_INTERRUPT_TRANSFER:
  PipeHandle           = 81b44acc [endpoint 0x00000081]
  TransferFlags        = 00000003 (USBD_TRANSFER_DIRECTION_IN, USBD_SHORT_TRANSFER_OK)
  TransferBufferLength = 00000100
  TransferBuffer       = 00000000
  TransferBufferMDL    = 81cc56a8
  UrbLink              = 00000000
[307729 ms] UsbSnoop - MyInternalIOCTLCompletion(f88c7db0) : fido=823a0430, Irp=81b5d388, Context=8215da28, IRQL=2
[307729 ms]  <<<  URB 548 coming back  <<< 
-- URB_FUNCTION_BULK_OR_INTERRUPT_TRANSFER:
  PipeHandle           = 81b44acc [endpoint 0x00000081]
  TransferFlags        = 00000003 (USBD_TRANSFER_DIRECTION_IN, USBD_SHORT_TRANSFER_OK)
  TransferBufferLength = 00000005
  TransferBuffer       = 00000000
  TransferBufferMDL    = 81cc56a8
    00000000: 00 00 00 3a 04
  UrbLink              = 00000000
[307760 ms] UsbSnoop - DispatchAny(f88c6610) : IRP_MJ_INTERNAL_DEVICE_CONTROL
[307760 ms] UsbSnoop - MyDispatchInternalIOCTL(f88c7e80) : fdo=82142030, Irp=81b5d388, IRQL=2
[307760 ms]  >>>  URB 549 going down  >>> 
-- URB_FUNCTION_BULK_OR_INTERRUPT_TRANSFER:
  PipeHandle           = 81b44acc [endpoint 0x00000081]
  TransferFlags        = 00000003 (USBD_TRANSFER_DIRECTION_IN, USBD_SHORT_TRANSFER_OK)
  TransferBufferLength = 00000100
  TransferBuffer       = 00000000
  TransferBufferMDL    = 81cc56a8
  UrbLink              = 00000000
[307761 ms] UsbSnoop - MyInternalIOCTLCompletion(f88c7db0) : fido=823a0430, Irp=81b5d388, Context=81c6cb60, IRQL=2
[307761 ms]  <<<  URB 549 coming back  <<< 
-- URB_FUNCTION_BULK_OR_INTERRUPT_TRANSFER:
  PipeHandle           = 81b44acc [endpoint 0x00000081]
  TransferFlags        = 00000003 (USBD_TRANSFER_DIRECTION_IN, USBD_SHORT_TRANSFER_OK)
  TransferBufferLength = 0000003a
  TransferBuffer       = 00000000
  TransferBufferMDL    = 81cc56a8
    00000000: 00 00 00 34 00 0a 02 70 31 00 08 65 6c 65 63 74
    00000010: 72 6f 63 00 00 06 00 02 00 00 04 f0 04 00 0b 00
    00000020: 03 00 00 01 00 00 05 02 00 01 00 00 04 00 00 01
    00000030: a5 00 41 00 00 01 00 00 42 01
  UrbLink              = 00000000
[307789 ms] UsbSnoop - DispatchAny(f88c6610) : IRP_MJ_INTERNAL_DEVICE_CONTROL
[307789 ms] UsbSnoop - MyDispatchInternalIOCTL(f88c7e80) : fdo=82142030, Irp=81b5d388, IRQL=2
[307789 ms]  >>>  URB 550 going down  >>> 
-- URB_FUNCTION_BULK_OR_INTERRUPT_TRANSFER:
  PipeHandle           = 81b44aec [endpoint 0x00000002]
  TransferFlags        = 00000000 (USBD_TRANSFER_DIRECTION_OUT, ~USBD_SHORT_TRANSFER_OK)
  TransferBufferLength = 00000007
  TransferBuffer       = 00000000
  TransferBufferMDL    = 81cc56a8
    00000000: 00 00 00 02 05 e0 00
  UrbLink              = 00000000
[307789 ms] UsbSnoop - MyInternalIOCTLCompletion(f88c7db0) : fido=823a0430, Irp=81b5d388, Context=81ad5658, IRQL=2
[307789 ms]  <<<  URB 550 coming back  <<< 
-- URB_FUNCTION_BULK_OR_INTERRUPT_TRANSFER:
  PipeHandle           = 81b44aec [endpoint 0x00000002]
  TransferFlags        = 00000000 (USBD_TRANSFER_DIRECTION_OUT, ~USBD_SHORT_TRANSFER_OK)
  TransferBufferLength = 00000007
  TransferBuffer       = 00000000
  TransferBufferMDL    = 81cc56a8
  UrbLink              = 00000000
[307799 ms] UsbSnoop - DispatchAny(f88c6610) : IRP_MJ_INTERNAL_DEVICE_CONTROL
[307799 ms] UsbSnoop - MyDispatchInternalIOCTL(f88c7e80) : fdo=82142030, Irp=81b5d388, IRQL=2
[307799 ms]  >>>  URB 551 going down  >>> 
-- URB_FUNCTION_BULK_OR_INTERRUPT_TRANSFER:
  PipeHandle           = 81b44acc [endpoint 0x00000081]
  TransferFlags        = 00000003 (USBD_TRANSFER_DIRECTION_IN, USBD_SHORT_TRANSFER_OK)
  TransferBufferLength = 00000100
  TransferBuffer       = 00000000
  TransferBufferMDL    = 81cc56a8
  UrbLink              = 00000000
[307800 ms] UsbSnoop - MyInternalIOCTLCompletion(f88c7db0) : fido=823a0430, Irp=81b5d388, Context=81c6cb60, IRQL=2
[307800 ms]  <<<  URB 551 coming back  <<< 
-- URB_FUNCTION_BULK_OR_INTERRUPT_TRANSFER:
  PipeHandle           = 81b44acc [endpoint 0x00000081]
  TransferFlags        = 00000003 (USBD_TRANSFER_DIRECTION_IN, USBD_SHORT_TRANSFER_OK)
  TransferBufferLength = 00000005
  TransferBuffer       = 00000000
  TransferBufferMDL    = 81cc56a8
    00000000: 00 00 00 3a 04
  UrbLink              = 00000000
[307830 ms] UsbSnoop - DispatchAny(f88c6610) : IRP_MJ_INTERNAL_DEVICE_CONTROL
[307830 ms] UsbSnoop - MyDispatchInternalIOCTL(f88c7e80) : fdo=82142030, Irp=81b5d388, IRQL=2
[307830 ms]  >>>  URB 552 going down  >>> 
-- URB_FUNCTION_BULK_OR_INTERRUPT_TRANSFER:
  PipeHandle           = 81b44acc [endpoint 0x00000081]
  TransferFlags        = 00000003 (USBD_TRANSFER_DIRECTION_IN, USBD_SHORT_TRANSFER_OK)
  TransferBufferLength = 00000100
  TransferBuffer       = 00000000
  TransferBufferMDL    = 81cc56a8
  UrbLink              = 00000000
[307830 ms] UsbSnoop - MyInternalIOCTLCompletion(f88c7db0) : fido=823a0430, Irp=81b5d388, Context=81af1cb8, IRQL=2
[307830 ms]  <<<  URB 552 coming back  <<< 
-- URB_FUNCTION_BULK_OR_INTERRUPT_TRANSFER:
  PipeHandle           = 81b44acc [endpoint 0x00000081]
  TransferFlags        = 00000003 (USBD_TRANSFER_DIRECTION_IN, USBD_SHORT_TRANSFER_OK)
  TransferBufferLength = 0000003a
  TransferBuffer       = 00000000
  TransferBufferMDL    = 81cc56a8
    00000000: 00 00 00 34 00 0a 02 70 31 00 08 72 65 67 73 69
    00000010: 6e 66 6f 00 00 06 00 02 00 00 04 f0 04 00 0b 00
    00000020: 03 00 00 01 00 00 05 02 00 01 00 00 04 00 00 01
    00000030: bd 00 41 00 00 01 00 00 42 01
  UrbLink              = 00000000
[307860 ms] UsbSnoop - DispatchAny(f88c6610) : IRP_MJ_INTERNAL_DEVICE_CONTROL
[307860 ms] UsbSnoop - MyDispatchInternalIOCTL(f88c7e80) : fdo=82142030, Irp=81b5d388, IRQL=2
[307860 ms]  >>>  URB 553 going down  >>> 
-- URB_FUNCTION_BULK_OR_INTERRUPT_TRANSFER:
  PipeHandle           = 81b44aec [endpoint 0x00000002]
  TransferFlags        = 00000000 (USBD_TRANSFER_DIRECTION_OUT, ~USBD_SHORT_TRANSFER_OK)
  TransferBufferLength = 00000007
  TransferBuffer       = 00000000
  TransferBufferMDL    = 81cc56a8
    00000000: 00 00 00 02 05 e0 00
  UrbLink              = 00000000
[307860 ms] UsbSnoop - MyInternalIOCTLCompletion(f88c7db0) : fido=823a0430, Irp=81b5d388, Context=81c6cb60, IRQL=2
[307860 ms]  <<<  URB 553 coming back  <<< 
-- URB_FUNCTION_BULK_OR_INTERRUPT_TRANSFER:
  PipeHandle           = 81b44aec [endpoint 0x00000002]
  TransferFlags        = 00000000 (USBD_TRANSFER_DIRECTION_OUT, ~USBD_SHORT_TRANSFER_OK)
  TransferBufferLength = 00000007
  TransferBuffer       = 00000000
  TransferBufferMDL    = 81cc56a8
  UrbLink              = 00000000
[307869 ms] UsbSnoop - DispatchAny(f88c6610) : IRP_MJ_INTERNAL_DEVICE_CONTROL
[307869 ms] UsbSnoop - MyDispatchInternalIOCTL(f88c7e80) : fdo=82142030, Irp=81b5d388, IRQL=2
[307869 ms]  >>>  URB 554 going down  >>> 
-- URB_FUNCTION_BULK_OR_INTERRUPT_TRANSFER:
  PipeHandle           = 81b44acc [endpoint 0x00000081]
  TransferFlags        = 00000003 (USBD_TRANSFER_DIRECTION_IN, USBD_SHORT_TRANSFER_OK)
  TransferBufferLength = 00000100
  TransferBuffer       = 00000000
  TransferBufferMDL    = 81cc56a8
  UrbLink              = 00000000
[307870 ms] UsbSnoop - MyInternalIOCTLCompletion(f88c7db0) : fido=823a0430, Irp=81b5d388, Context=822fb2d8, IRQL=2
[307870 ms]  <<<  URB 554 coming back  <<< 
-- URB_FUNCTION_BULK_OR_INTERRUPT_TRANSFER:
  PipeHandle           = 81b44acc [endpoint 0x00000081]
  TransferFlags        = 00000003 (USBD_TRANSFER_DIRECTION_IN, USBD_SHORT_TRANSFER_OK)
  TransferBufferLength = 00000005
  TransferBuffer       = 00000000
  TransferBufferMDL    = 81cc56a8
    00000000: 00 00 00 3a 04
  UrbLink              = 00000000
[307900 ms] UsbSnoop - DispatchAny(f88c6610) : IRP_MJ_INTERNAL_DEVICE_CONTROL
[307900 ms] UsbSnoop - MyDispatchInternalIOCTL(f88c7e80) : fdo=82142030, Irp=81c46308, IRQL=2
[307900 ms]  >>>  URB 555 going down  >>> 
-- URB_FUNCTION_BULK_OR_INTERRUPT_TRANSFER:
  PipeHandle           = 81b44acc [endpoint 0x00000081]
  TransferFlags        = 00000003 (USBD_TRANSFER_DIRECTION_IN, USBD_SHORT_TRANSFER_OK)
  TransferBufferLength = 00000100
  TransferBuffer       = 00000000
  TransferBufferMDL    = 81b6d910
  UrbLink              = 00000000
[307900 ms] UsbSnoop - MyInternalIOCTLCompletion(f88c7db0) : fido=823a0430, Irp=81c46308, Context=81af1cb8, IRQL=2
[307900 ms]  <<<  URB 555 coming back  <<< 
-- URB_FUNCTION_BULK_OR_INTERRUPT_TRANSFER:
  PipeHandle           = 81b44acc [endpoint 0x00000081]
  TransferFlags        = 00000003 (USBD_TRANSFER_DIRECTION_IN, USBD_SHORT_TRANSFER_OK)
  TransferBufferLength = 0000003a
  TransferBuffer       = 00000000
  TransferBufferMDL    = 81b6d910
    00000000: 00 00 00 34 00 0a 02 70 31 00 08 72 65 73 65 61
    00000010: 75 6c 69 00 00 06 00 02 00 00 04 f0 04 00 0b 00
    00000020: 03 00 00 01 00 00 05 02 00 01 00 00 04 00 00 00
    00000030: 45 00 41 00 00 01 00 00 42 01
  UrbLink              = 00000000
[307930 ms] UsbSnoop - DispatchAny(f88c6610) : IRP_MJ_INTERNAL_DEVICE_CONTROL
[307930 ms] UsbSnoop - MyDispatchInternalIOCTL(f88c7e80) : fdo=82142030, Irp=81b4e870, IRQL=2
[307930 ms]  >>>  URB 556 going down  >>> 
-- URB_FUNCTION_BULK_OR_INTERRUPT_TRANSFER:
  PipeHandle           = 81b44aec [endpoint 0x00000002]
  TransferFlags        = 00000000 (USBD_TRANSFER_DIRECTION_OUT, ~USBD_SHORT_TRANSFER_OK)
  TransferBufferLength = 00000007
  TransferBuffer       = 00000000
  TransferBufferMDL    = 8216a008
    00000000: 00 00 00 02 05 e0 00
  UrbLink              = 00000000
[307930 ms] UsbSnoop - MyInternalIOCTLCompletion(f88c7db0) : fido=823a0430, Irp=81b4e870, Context=822fb2d8, IRQL=2
[307930 ms]  <<<  URB 556 coming back  <<< 
-- URB_FUNCTION_BULK_OR_INTERRUPT_TRANSFER:
  PipeHandle           = 81b44aec [endpoint 0x00000002]
  TransferFlags        = 00000000 (USBD_TRANSFER_DIRECTION_OUT, ~USBD_SHORT_TRANSFER_OK)
  TransferBufferLength = 00000007
  TransferBuffer       = 00000000
  TransferBufferMDL    = 8216a008
  UrbLink              = 00000000
[307940 ms] UsbSnoop - DispatchAny(f88c6610) : IRP_MJ_INTERNAL_DEVICE_CONTROL
[307940 ms] UsbSnoop - MyDispatchInternalIOCTL(f88c7e80) : fdo=82142030, Irp=81b4e870, IRQL=2
[307940 ms]  >>>  URB 557 going down  >>> 
-- URB_FUNCTION_BULK_OR_INTERRUPT_TRANSFER:
  PipeHandle           = 81b44acc [endpoint 0x00000081]
  TransferFlags        = 00000003 (USBD_TRANSFER_DIRECTION_IN, USBD_SHORT_TRANSFER_OK)
  TransferBufferLength = 00000100
  TransferBuffer       = 00000000
  TransferBufferMDL    = 8216a008
  UrbLink              = 00000000
[307940 ms] UsbSnoop - MyInternalIOCTLCompletion(f88c7db0) : fido=823a0430, Irp=81b4e870, Context=8215da28, IRQL=2
[307940 ms]  <<<  URB 557 coming back  <<< 
-- URB_FUNCTION_BULK_OR_INTERRUPT_TRANSFER:
  PipeHandle           = 81b44acc [endpoint 0x00000081]
  TransferFlags        = 00000003 (USBD_TRANSFER_DIRECTION_IN, USBD_SHORT_TRANSFER_OK)
  TransferBufferLength = 00000005
  TransferBuffer       = 00000000
  TransferBufferMDL    = 8216a008
    00000000: 00 00 00 39 04
  UrbLink              = 00000000
[307970 ms] UsbSnoop - DispatchAny(f88c6610) : IRP_MJ_INTERNAL_DEVICE_CONTROL
[307970 ms] UsbSnoop - MyDispatchInternalIOCTL(f88c7e80) : fdo=82142030, Irp=81b4e870, IRQL=2
[307970 ms]  >>>  URB 558 going down  >>> 
-- URB_FUNCTION_BULK_OR_INTERRUPT_TRANSFER:
  PipeHandle           = 81b44acc [endpoint 0x00000081]
  TransferFlags        = 00000003 (USBD_TRANSFER_DIRECTION_IN, USBD_SHORT_TRANSFER_OK)
  TransferBufferLength = 00000100
  TransferBuffer       = 00000000
  TransferBufferMDL    = 8216a008
  UrbLink              = 00000000
[307970 ms] UsbSnoop - MyInternalIOCTLCompletion(f88c7db0) : fido=823a0430, Irp=81b4e870, Context=81adbfe8, IRQL=2
[307970 ms]  <<<  URB 558 coming back  <<< 
-- URB_FUNCTION_BULK_OR_INTERRUPT_TRANSFER:
  PipeHandle           = 81b44acc [endpoint 0x00000081]
  TransferFlags        = 00000003 (USBD_TRANSFER_DIRECTION_IN, USBD_SHORT_TRANSFER_OK)
  TransferBufferLength = 00000039
  TransferBuffer       = 00000000
  TransferBufferMDL    = 8216a008
    00000000: 00 00 00 33 00 0a 02 70 31 00 07 72 6c 72 63 72
    00000010: 6c 63 00 00 06 00 02 00 00 04 f0 04 00 0b 00 03
    00000020: 00 00 01 00 00 05 02 00 01 00 00 04 00 00 00 a6
    00000030: 00 41 00 00 01 00 00 42 01
  UrbLink              = 00000000
[308000 ms] UsbSnoop - DispatchAny(f88c6610) : IRP_MJ_INTERNAL_DEVICE_CONTROL
[308000 ms] UsbSnoop - MyDispatchInternalIOCTL(f88c7e80) : fdo=82142030, Irp=81b4e870, IRQL=2
[308000 ms]  >>>  URB 559 going down  >>> 
-- URB_FUNCTION_BULK_OR_INTERRUPT_TRANSFER:
  PipeHandle           = 81b44aec [endpoint 0x00000002]
  TransferFlags        = 00000000 (USBD_TRANSFER_DIRECTION_OUT, ~USBD_SHORT_TRANSFER_OK)
  TransferBufferLength = 00000007
  TransferBuffer       = 00000000
  TransferBufferMDL    = 8216a008
    00000000: 00 00 00 02 05 e0 00
  UrbLink              = 00000000
[308000 ms] UsbSnoop - MyInternalIOCTLCompletion(f88c7db0) : fido=823a0430, Irp=81b4e870, Context=822fb2d8, IRQL=2
[308000 ms]  <<<  URB 559 coming back  <<< 
-- URB_FUNCTION_BULK_OR_INTERRUPT_TRANSFER:
  PipeHandle           = 81b44aec [endpoint 0x00000002]
  TransferFlags        = 00000000 (USBD_TRANSFER_DIRECTION_OUT, ~USBD_SHORT_TRANSFER_OK)
  TransferBufferLength = 00000007
  TransferBuffer       = 00000000
  TransferBufferMDL    = 8216a008
  UrbLink              = 00000000
[308011 ms] UsbSnoop - DispatchAny(f88c6610) : IRP_MJ_INTERNAL_DEVICE_CONTROL
[308011 ms] UsbSnoop - MyDispatchInternalIOCTL(f88c7e80) : fdo=82142030, Irp=81b4e870, IRQL=2
[308011 ms]  >>>  URB 560 going down  >>> 
-- URB_FUNCTION_BULK_OR_INTERRUPT_TRANSFER:
  PipeHandle           = 81b44acc [endpoint 0x00000081]
  TransferFlags        = 00000003 (USBD_TRANSFER_DIRECTION_IN, USBD_SHORT_TRANSFER_OK)
  TransferBufferLength = 00000100
  TransferBuffer       = 00000000
  TransferBufferMDL    = 8216a008
  UrbLink              = 00000000
[308011 ms] UsbSnoop - MyInternalIOCTLCompletion(f88c7db0) : fido=823a0430, Irp=81b4e870, Context=81adbfe8, IRQL=2
[308011 ms]  <<<  URB 560 coming back  <<< 
-- URB_FUNCTION_BULK_OR_INTERRUPT_TRANSFER:
  PipeHandle           = 81b44acc [endpoint 0x00000081]
  TransferFlags        = 00000003 (USBD_TRANSFER_DIRECTION_IN, USBD_SHORT_TRANSFER_OK)
  TransferBufferLength = 00000005
  TransferBuffer       = 00000000
  TransferBufferMDL    = 8216a008
    00000000: 00 00 00 3a 04
  UrbLink              = 00000000
[308040 ms] UsbSnoop - DispatchAny(f88c6610) : IRP_MJ_INTERNAL_DEVICE_CONTROL
[308040 ms] UsbSnoop - MyDispatchInternalIOCTL(f88c7e80) : fdo=82142030, Irp=81b4e870, IRQL=2
[308040 ms]  >>>  URB 561 going down  >>> 
-- URB_FUNCTION_BULK_OR_INTERRUPT_TRANSFER:
  PipeHandle           = 81b44acc [endpoint 0x00000081]
  TransferFlags        = 00000003 (USBD_TRANSFER_DIRECTION_IN, USBD_SHORT_TRANSFER_OK)
  TransferBufferLength = 00000100
  TransferBuffer       = 00000000
  TransferBufferMDL    = 8216a008
  UrbLink              = 00000000
[308040 ms] UsbSnoop - MyInternalIOCTLCompletion(f88c7db0) : fido=823a0430, Irp=81b4e870, Context=81ad5658, IRQL=2
[308040 ms]  <<<  URB 561 coming back  <<< 
-- URB_FUNCTION_BULK_OR_INTERRUPT_TRANSFER:
  PipeHandle           = 81b44acc [endpoint 0x00000081]
  TransferFlags        = 00000003 (USBD_TRANSFER_DIRECTION_IN, USBD_SHORT_TRANSFER_OK)
  TransferBufferLength = 0000003a
  TransferBuffer       = 00000000
  TransferBufferMDL    = 8216a008
    00000000: 00 00 00 34 00 0a 02 70 31 00 08 74 72 61 6e 73
    00000010: 66 65 72 00 00 06 00 02 00 00 04 f0 04 00 0b 00
    00000020: 03 00 00 01 00 00 05 02 00 01 00 00 04 00 00 00
    00000030: 4e 00 41 00 00 01 00 00 42 01
  UrbLink              = 00000000
[308070 ms] UsbSnoop - DispatchAny(f88c6610) : IRP_MJ_INTERNAL_DEVICE_CONTROL
[308070 ms] UsbSnoop - MyDispatchInternalIOCTL(f88c7e80) : fdo=82142030, Irp=81b4e870, IRQL=2
[308070 ms]  >>>  URB 562 going down  >>> 
-- URB_FUNCTION_BULK_OR_INTERRUPT_TRANSFER:
  PipeHandle           = 81b44aec [endpoint 0x00000002]
  TransferFlags        = 00000000 (USBD_TRANSFER_DIRECTION_OUT, ~USBD_SHORT_TRANSFER_OK)
  TransferBufferLength = 00000007
  TransferBuffer       = 00000000
  TransferBufferMDL    = 8216a008
    00000000: 00 00 00 02 05 e0 00
  UrbLink              = 00000000
[308070 ms] UsbSnoop - MyInternalIOCTLCompletion(f88c7db0) : fido=823a0430, Irp=81b4e870, Context=822fb2d8, IRQL=2
[308070 ms]  <<<  URB 562 coming back  <<< 
-- URB_FUNCTION_BULK_OR_INTERRUPT_TRANSFER:
  PipeHandle           = 81b44aec [endpoint 0x00000002]
  TransferFlags        = 00000000 (USBD_TRANSFER_DIRECTION_OUT, ~USBD_SHORT_TRANSFER_OK)
  TransferBufferLength = 00000007
  TransferBuffer       = 00000000
  TransferBufferMDL    = 8216a008
  UrbLink              = 00000000
[308080 ms] UsbSnoop - DispatchAny(f88c6610) : IRP_MJ_INTERNAL_DEVICE_CONTROL
[308080 ms] UsbSnoop - MyDispatchInternalIOCTL(f88c7e80) : fdo=82142030, Irp=81b4e870, IRQL=2
[308080 ms]  >>>  URB 563 going down  >>> 
-- URB_FUNCTION_BULK_OR_INTERRUPT_TRANSFER:
  PipeHandle           = 81b44acc [endpoint 0x00000081]
  TransferFlags        = 00000003 (USBD_TRANSFER_DIRECTION_IN, USBD_SHORT_TRANSFER_OK)
  TransferBufferLength = 00000100
  TransferBuffer       = 00000000
  TransferBufferMDL    = 8216a008
  UrbLink              = 00000000
[308080 ms] UsbSnoop - MyInternalIOCTLCompletion(f88c7db0) : fido=823a0430, Irp=81b4e870, Context=81ad5658, IRQL=2
[308080 ms]  <<<  URB 563 coming back  <<< 
-- URB_FUNCTION_BULK_OR_INTERRUPT_TRANSFER:
  PipeHandle           = 81b44acc [endpoint 0x00000081]
  TransferFlags        = 00000003 (USBD_TRANSFER_DIRECTION_IN, USBD_SHORT_TRANSFER_OK)
  TransferBufferLength = 00000005
  TransferBuffer       = 00000000
  TransferBufferMDL    = 8216a008
    00000000: 00 00 00 31 04
  UrbLink              = 00000000
[308111 ms] UsbSnoop - DispatchAny(f88c6610) : IRP_MJ_INTERNAL_DEVICE_CONTROL
[308111 ms] UsbSnoop - MyDispatchInternalIOCTL(f88c7e80) : fdo=82142030, Irp=81b4e870, IRQL=2
[308111 ms]  >>>  URB 564 going down  >>> 
-- URB_FUNCTION_BULK_OR_INTERRUPT_TRANSFER:
  PipeHandle           = 81b44acc [endpoint 0x00000081]
  TransferFlags        = 00000003 (USBD_TRANSFER_DIRECTION_IN, USBD_SHORT_TRANSFER_OK)
  TransferBufferLength = 00000100
  TransferBuffer       = 00000000
  TransferBufferMDL    = 8216a008
  UrbLink              = 00000000
[308111 ms] UsbSnoop - MyInternalIOCTLCompletion(f88c7db0) : fido=823a0430, Irp=81b4e870, Context=81adbfe8, IRQL=2
[308111 ms]  <<<  URB 564 coming back  <<< 
-- URB_FUNCTION_BULK_OR_INTERRUPT_TRANSFER:
  PipeHandle           = 81b44acc [endpoint 0x00000081]
  TransferFlags        = 00000003 (USBD_TRANSFER_DIRECTION_IN, USBD_SHORT_TRANSFER_OK)
  TransferBufferLength = 00000031
  TransferBuffer       = 00000000
  TransferBufferMDL    = 8216a008
    00000000: 00 00 00 2b 00 0a 02 70 32 00 00 00 06 00 02 00
    00000010: 00 04 f0 04 00 1f 00 03 00 00 01 00 00 05 02 00
    00000020: 01 00 00 04 00 00 00 0c 00 41 00 00 01 00 00 42
    00000030: 01
  UrbLink              = 00000000
[308140 ms] UsbSnoop - DispatchAny(f88c6610) : IRP_MJ_INTERNAL_DEVICE_CONTROL
[308140 ms] UsbSnoop - MyDispatchInternalIOCTL(f88c7e80) : fdo=82142030, Irp=81b4e870, IRQL=2
[308140 ms]  >>>  URB 565 going down  >>> 
-- URB_FUNCTION_BULK_OR_INTERRUPT_TRANSFER:
  PipeHandle           = 81b44aec [endpoint 0x00000002]
  TransferFlags        = 00000000 (USBD_TRANSFER_DIRECTION_OUT, ~USBD_SHORT_TRANSFER_OK)
  TransferBufferLength = 00000007
  TransferBuffer       = 00000000
  TransferBufferMDL    = 81b6d910
    00000000: 00 00 00 02 05 e0 00
  UrbLink              = 00000000
[308141 ms] UsbSnoop - MyInternalIOCTLCompletion(f88c7db0) : fido=823a0430, Irp=81b4e870, Context=81ad5658, IRQL=2
[308141 ms]  <<<  URB 565 coming back  <<< 
-- URB_FUNCTION_BULK_OR_INTERRUPT_TRANSFER:
  PipeHandle           = 81b44aec [endpoint 0x00000002]
  TransferFlags        = 00000000 (USBD_TRANSFER_DIRECTION_OUT, ~USBD_SHORT_TRANSFER_OK)
  TransferBufferLength = 00000007
  TransferBuffer       = 00000000
  TransferBufferMDL    = 81b6d910
  UrbLink              = 00000000
[308150 ms] UsbSnoop - DispatchAny(f88c6610) : IRP_MJ_INTERNAL_DEVICE_CONTROL
[308150 ms] UsbSnoop - MyDispatchInternalIOCTL(f88c7e80) : fdo=82142030, Irp=81b4e870, IRQL=2
[308150 ms]  >>>  URB 566 going down  >>> 
-- URB_FUNCTION_BULK_OR_INTERRUPT_TRANSFER:
  PipeHandle           = 81b44acc [endpoint 0x00000081]
  TransferFlags        = 00000003 (USBD_TRANSFER_DIRECTION_IN, USBD_SHORT_TRANSFER_OK)
  TransferBufferLength = 00000100
  TransferBuffer       = 00000000
  TransferBufferMDL    = 8216a008
  UrbLink              = 00000000
[308150 ms] UsbSnoop - MyInternalIOCTLCompletion(f88c7db0) : fido=823a0430, Irp=81b4e870, Context=8215da28, IRQL=2
[308150 ms]  <<<  URB 566 coming back  <<< 
-- URB_FUNCTION_BULK_OR_INTERRUPT_TRANSFER:
  PipeHandle           = 81b44acc [endpoint 0x00000081]
  TransferFlags        = 00000003 (USBD_TRANSFER_DIRECTION_IN, USBD_SHORT_TRANSFER_OK)
  TransferBufferLength = 00000005
  TransferBuffer       = 00000000
  TransferBufferMDL    = 8216a008
    00000000: 00 00 00 39 04
  UrbLink              = 00000000
[308180 ms] UsbSnoop - DispatchAny(f88c6610) : IRP_MJ_INTERNAL_DEVICE_CONTROL
[308180 ms] UsbSnoop - MyDispatchInternalIOCTL(f88c7e80) : fdo=82142030, Irp=81b4e870, IRQL=2
[308180 ms]  >>>  URB 567 going down  >>> 
-- URB_FUNCTION_BULK_OR_INTERRUPT_TRANSFER:
  PipeHandle           = 81b44acc [endpoint 0x00000081]
  TransferFlags        = 00000003 (USBD_TRANSFER_DIRECTION_IN, USBD_SHORT_TRANSFER_OK)
  TransferBufferLength = 00000100
  TransferBuffer       = 00000000
  TransferBufferMDL    = 8216a008
  UrbLink              = 00000000
[308181 ms] UsbSnoop - MyInternalIOCTLCompletion(f88c7db0) : fido=823a0430, Irp=81b4e870, Context=81af1cb8, IRQL=2
[308181 ms]  <<<  URB 567 coming back  <<< 
-- URB_FUNCTION_BULK_OR_INTERRUPT_TRANSFER:
  PipeHandle           = 81b44acc [endpoint 0x00000081]
  TransferFlags        = 00000003 (USBD_TRANSFER_DIRECTION_IN, USBD_SHORT_TRANSFER_OK)
  TransferBufferLength = 00000039
  TransferBuffer       = 00000000
  TransferBufferMDL    = 8216a008
    00000000: 00 00 00 33 00 0a 02 70 32 00 07 63 68 67 74 72
    00000010: 65 66 00 00 06 00 02 00 00 04 f0 04 00 0b 00 03
    00000020: 00 00 01 00 00 05 02 00 01 00 00 04 00 00 00 ef
    00000030: 00 41 00 00 01 00 00 42 01
  UrbLink              = 00000000
[308211 ms] UsbSnoop - DispatchAny(f88c6610) : IRP_MJ_INTERNAL_DEVICE_CONTROL
[308211 ms] UsbSnoop - MyDispatchInternalIOCTL(f88c7e80) : fdo=82142030, Irp=81b4e870, IRQL=2
[308211 ms]  >>>  URB 568 going down  >>> 
-- URB_FUNCTION_BULK_OR_INTERRUPT_TRANSFER:
  PipeHandle           = 81b44aec [endpoint 0x00000002]
  TransferFlags        = 00000000 (USBD_TRANSFER_DIRECTION_OUT, ~USBD_SHORT_TRANSFER_OK)
  TransferBufferLength = 00000007
  TransferBuffer       = 00000000
  TransferBufferMDL    = 8216a008
    00000000: 00 00 00 02 05 e0 00
  UrbLink              = 00000000
[308211 ms] UsbSnoop - MyInternalIOCTLCompletion(f88c7db0) : fido=823a0430, Irp=81b4e870, Context=81ad5658, IRQL=2
[308211 ms]  <<<  URB 568 coming back  <<< 
-- URB_FUNCTION_BULK_OR_INTERRUPT_TRANSFER:
  PipeHandle           = 81b44aec [endpoint 0x00000002]
  TransferFlags        = 00000000 (USBD_TRANSFER_DIRECTION_OUT, ~USBD_SHORT_TRANSFER_OK)
  TransferBufferLength = 00000007
  TransferBuffer       = 00000000
  TransferBufferMDL    = 8216a008
  UrbLink              = 00000000
[308220 ms] UsbSnoop - DispatchAny(f88c6610) : IRP_MJ_INTERNAL_DEVICE_CONTROL
[308220 ms] UsbSnoop - MyDispatchInternalIOCTL(f88c7e80) : fdo=82142030, Irp=81b4e870, IRQL=2
[308220 ms]  >>>  URB 569 going down  >>> 
-- URB_FUNCTION_BULK_OR_INTERRUPT_TRANSFER:
  PipeHandle           = 81b44acc [endpoint 0x00000081]
  TransferFlags        = 00000003 (USBD_TRANSFER_DIRECTION_IN, USBD_SHORT_TRANSFER_OK)
  TransferBufferLength = 00000100
  TransferBuffer       = 00000000
  TransferBufferMDL    = 8216a008
  UrbLink              = 00000000
[308220 ms] UsbSnoop - MyInternalIOCTLCompletion(f88c7db0) : fido=823a0430, Irp=81b4e870, Context=81af1cb8, IRQL=2
[308220 ms]  <<<  URB 569 coming back  <<< 
-- URB_FUNCTION_BULK_OR_INTERRUPT_TRANSFER:
  PipeHandle           = 81b44acc [endpoint 0x00000081]
  TransferFlags        = 00000003 (USBD_TRANSFER_DIRECTION_IN, USBD_SHORT_TRANSFER_OK)
  TransferBufferLength = 00000005
  TransferBuffer       = 00000000
  TransferBufferMDL    = 8216a008
    00000000: 00 00 00 3a 04
  UrbLink              = 00000000
[308250 ms] UsbSnoop - DispatchAny(f88c6610) : IRP_MJ_INTERNAL_DEVICE_CONTROL
[308250 ms] UsbSnoop - MyDispatchInternalIOCTL(f88c7e80) : fdo=82142030, Irp=81b4e870, IRQL=2
[308250 ms]  >>>  URB 570 going down  >>> 
-- URB_FUNCTION_BULK_OR_INTERRUPT_TRANSFER:
  PipeHandle           = 81b44acc [endpoint 0x00000081]
  TransferFlags        = 00000003 (USBD_TRANSFER_DIRECTION_IN, USBD_SHORT_TRANSFER_OK)
  TransferBufferLength = 00000100
  TransferBuffer       = 00000000
  TransferBufferMDL    = 8216a008
  UrbLink              = 00000000
[308250 ms] UsbSnoop - MyInternalIOCTLCompletion(f88c7db0) : fido=823a0430, Irp=81b4e870, Context=8215da28, IRQL=2
[308250 ms]  <<<  URB 570 coming back  <<< 
-- URB_FUNCTION_BULK_OR_INTERRUPT_TRANSFER:
  PipeHandle           = 81b44acc [endpoint 0x00000081]
  TransferFlags        = 00000003 (USBD_TRANSFER_DIRECTION_IN, USBD_SHORT_TRANSFER_OK)
  TransferBufferLength = 0000003a
  TransferBuffer       = 00000000
  TransferBufferMDL    = 8216a008
    00000000: 00 00 00 34 00 0a 02 70 32 00 08 63 69 6e 65 6d
    00000010: 61 74 69 00 00 06 00 02 00 00 04 f0 04 00 0b 00
    00000020: 03 00 00 01 00 00 05 02 00 01 00 00 04 00 00 01
    00000030: bf 00 41 00 00 01 00 00 42 01
  UrbLink              = 00000000
[308280 ms] UsbSnoop - DispatchAny(f88c6610) : IRP_MJ_INTERNAL_DEVICE_CONTROL
[308280 ms] UsbSnoop - MyDispatchInternalIOCTL(f88c7e80) : fdo=82142030, Irp=81b4e870, IRQL=2
[308280 ms]  >>>  URB 571 going down  >>> 
-- URB_FUNCTION_BULK_OR_INTERRUPT_TRANSFER:
  PipeHandle           = 81b44aec [endpoint 0x00000002]
  TransferFlags        = 00000000 (USBD_TRANSFER_DIRECTION_OUT, ~USBD_SHORT_TRANSFER_OK)
  TransferBufferLength = 00000007
  TransferBuffer       = 00000000
  TransferBufferMDL    = 8216a008
    00000000: 00 00 00 02 05 e0 00
  UrbLink              = 00000000
[308280 ms] UsbSnoop - MyInternalIOCTLCompletion(f88c7db0) : fido=823a0430, Irp=81b4e870, Context=81c6cb60, IRQL=2
[308280 ms]  <<<  URB 571 coming back  <<< 
-- URB_FUNCTION_BULK_OR_INTERRUPT_TRANSFER:
  PipeHandle           = 81b44aec [endpoint 0x00000002]
  TransferFlags        = 00000000 (USBD_TRANSFER_DIRECTION_OUT, ~USBD_SHORT_TRANSFER_OK)
  TransferBufferLength = 00000007
  TransferBuffer       = 00000000
  TransferBufferMDL    = 8216a008
  UrbLink              = 00000000
[308290 ms] UsbSnoop - DispatchAny(f88c6610) : IRP_MJ_INTERNAL_DEVICE_CONTROL
[308290 ms] UsbSnoop - MyDispatchInternalIOCTL(f88c7e80) : fdo=82142030, Irp=81b4e870, IRQL=2
[308290 ms]  >>>  URB 572 going down  >>> 
-- URB_FUNCTION_BULK_OR_INTERRUPT_TRANSFER:
  PipeHandle           = 81b44acc [endpoint 0x00000081]
  TransferFlags        = 00000003 (USBD_TRANSFER_DIRECTION_IN, USBD_SHORT_TRANSFER_OK)
  TransferBufferLength = 00000100
  TransferBuffer       = 00000000
  TransferBufferMDL    = 8216a008
  UrbLink              = 00000000
[308290 ms] UsbSnoop - MyInternalIOCTLCompletion(f88c7db0) : fido=823a0430, Irp=81b4e870, Context=8215da28, IRQL=2
[308290 ms]  <<<  URB 572 coming back  <<< 
-- URB_FUNCTION_BULK_OR_INTERRUPT_TRANSFER:
  PipeHandle           = 81b44acc [endpoint 0x00000081]
  TransferFlags        = 00000003 (USBD_TRANSFER_DIRECTION_IN, USBD_SHORT_TRANSFER_OK)
  TransferBufferLength = 00000005
  TransferBuffer       = 00000000
  TransferBufferMDL    = 8216a008
    00000000: 00 00 00 3a 04
  UrbLink              = 00000000
[308320 ms] UsbSnoop - DispatchAny(f88c6610) : IRP_MJ_INTERNAL_DEVICE_CONTROL
[308320 ms] UsbSnoop - MyDispatchInternalIOCTL(f88c7e80) : fdo=82142030, Irp=81b4e870, IRQL=2
[308320 ms]  >>>  URB 573 going down  >>> 
-- URB_FUNCTION_BULK_OR_INTERRUPT_TRANSFER:
  PipeHandle           = 81b44acc [endpoint 0x00000081]
  TransferFlags        = 00000003 (USBD_TRANSFER_DIRECTION_IN, USBD_SHORT_TRANSFER_OK)
  TransferBufferLength = 00000100
  TransferBuffer       = 00000000
  TransferBufferMDL    = 8216a008
  UrbLink              = 00000000
[308320 ms] UsbSnoop - MyInternalIOCTLCompletion(f88c7db0) : fido=823a0430, Irp=81b4e870, Context=81ad5658, IRQL=2
[308320 ms]  <<<  URB 573 coming back  <<< 
-- URB_FUNCTION_BULK_OR_INTERRUPT_TRANSFER:
  PipeHandle           = 81b44acc [endpoint 0x00000081]
  TransferFlags        = 00000003 (USBD_TRANSFER_DIRECTION_IN, USBD_SHORT_TRANSFER_OK)
  TransferBufferLength = 0000003a
  TransferBuffer       = 00000000
  TransferBufferMDL    = 8216a008
    00000000: 00 00 00 34 00 0a 02 70 32 00 08 66 6f 72 63 65
    00000010: 63 65 6e 00 00 06 00 02 00 00 04 f0 04 00 0b 00
    00000020: 03 00 00 01 00 00 05 02 00 01 00 00 04 00 00 03
    00000030: 0e 00 41 00 00 01 00 00 42 01
  UrbLink              = 00000000
[308350 ms] UsbSnoop - DispatchAny(f88c6610) : IRP_MJ_INTERNAL_DEVICE_CONTROL
[308350 ms] UsbSnoop - MyDispatchInternalIOCTL(f88c7e80) : fdo=82142030, Irp=81b4e870, IRQL=2
[308350 ms]  >>>  URB 574 going down  >>> 
-- URB_FUNCTION_BULK_OR_INTERRUPT_TRANSFER:
  PipeHandle           = 81b44aec [endpoint 0x00000002]
  TransferFlags        = 00000000 (USBD_TRANSFER_DIRECTION_OUT, ~USBD_SHORT_TRANSFER_OK)
  TransferBufferLength = 00000007
  TransferBuffer       = 00000000
  TransferBufferMDL    = 8216a008
    00000000: 00 00 00 02 05 e0 00
  UrbLink              = 00000000
[308350 ms] UsbSnoop - MyInternalIOCTLCompletion(f88c7db0) : fido=823a0430, Irp=81b4e870, Context=8215da28, IRQL=2
[308350 ms]  <<<  URB 574 coming back  <<< 
-- URB_FUNCTION_BULK_OR_INTERRUPT_TRANSFER:
  PipeHandle           = 81b44aec [endpoint 0x00000002]
  TransferFlags        = 00000000 (USBD_TRANSFER_DIRECTION_OUT, ~USBD_SHORT_TRANSFER_OK)
  TransferBufferLength = 00000007
  TransferBuffer       = 00000000
  TransferBufferMDL    = 8216a008
  UrbLink              = 00000000
[308361 ms] UsbSnoop - DispatchAny(f88c6610) : IRP_MJ_INTERNAL_DEVICE_CONTROL
[308361 ms] UsbSnoop - MyDispatchInternalIOCTL(f88c7e80) : fdo=82142030, Irp=81b4e870, IRQL=2
[308361 ms]  >>>  URB 575 going down  >>> 
-- URB_FUNCTION_BULK_OR_INTERRUPT_TRANSFER:
  PipeHandle           = 81b44acc [endpoint 0x00000081]
  TransferFlags        = 00000003 (USBD_TRANSFER_DIRECTION_IN, USBD_SHORT_TRANSFER_OK)
  TransferBufferLength = 00000100
  TransferBuffer       = 00000000
  TransferBufferMDL    = 8216a008
  UrbLink              = 00000000
[308361 ms] UsbSnoop - MyInternalIOCTLCompletion(f88c7db0) : fido=823a0430, Irp=81b4e870, Context=81adbfe8, IRQL=2
[308361 ms]  <<<  URB 575 coming back  <<< 
-- URB_FUNCTION_BULK_OR_INTERRUPT_TRANSFER:
  PipeHandle           = 81b44acc [endpoint 0x00000081]
  TransferFlags        = 00000003 (USBD_TRANSFER_DIRECTION_IN, USBD_SHORT_TRANSFER_OK)
  TransferBufferLength = 00000005
  TransferBuffer       = 00000000
  TransferBufferMDL    = 8216a008
    00000000: 00 00 00 3a 04
  UrbLink              = 00000000
[308390 ms] UsbSnoop - DispatchAny(f88c6610) : IRP_MJ_INTERNAL_DEVICE_CONTROL
[308390 ms] UsbSnoop - MyDispatchInternalIOCTL(f88c7e80) : fdo=82142030, Irp=81b4e870, IRQL=2
[308390 ms]  >>>  URB 576 going down  >>> 
-- URB_FUNCTION_BULK_OR_INTERRUPT_TRANSFER:
  PipeHandle           = 81b44acc [endpoint 0x00000081]
  TransferFlags        = 00000003 (USBD_TRANSFER_DIRECTION_IN, USBD_SHORT_TRANSFER_OK)
  TransferBufferLength = 00000100
  TransferBuffer       = 00000000
  TransferBufferMDL    = 8216a008
  UrbLink              = 00000000
[308390 ms] UsbSnoop - MyInternalIOCTLCompletion(f88c7db0) : fido=823a0430, Irp=81b4e870, Context=822fb2d8, IRQL=2
[308390 ms]  <<<  URB 576 coming back  <<< 
-- URB_FUNCTION_BULK_OR_INTERRUPT_TRANSFER:
  PipeHandle           = 81b44acc [endpoint 0x00000081]
  TransferFlags        = 00000003 (USBD_TRANSFER_DIRECTION_IN, USBD_SHORT_TRANSFER_OK)
  TransferBufferLength = 0000003a
  TransferBuffer       = 00000000
  TransferBufferMDL    = 8216a008
    00000000: 00 00 00 34 00 0a 02 70 32 00 08 6d 65 63 61 65
    00000010: 63 65 70 00 00 06 00 02 00 00 04 f0 04 00 0b 00
    00000020: 03 00 00 01 00 00 05 02 00 01 00 00 04 00 00 00
    00000030: f9 00 41 00 00 01 00 00 42 01
  UrbLink              = 00000000
[308420 ms] UsbSnoop - DispatchAny(f88c6610) : IRP_MJ_INTERNAL_DEVICE_CONTROL
[308420 ms] UsbSnoop - MyDispatchInternalIOCTL(f88c7e80) : fdo=82142030, Irp=81b4e870, IRQL=2
[308420 ms]  >>>  URB 577 going down  >>> 
-- URB_FUNCTION_BULK_OR_INTERRUPT_TRANSFER:
  PipeHandle           = 81b44aec [endpoint 0x00000002]
  TransferFlags        = 00000000 (USBD_TRANSFER_DIRECTION_OUT, ~USBD_SHORT_TRANSFER_OK)
  TransferBufferLength = 00000007
  TransferBuffer       = 00000000
  TransferBufferMDL    = 8216a008
    00000000: 00 00 00 02 05 e0 00
  UrbLink              = 00000000
[308420 ms] UsbSnoop - MyInternalIOCTLCompletion(f88c7db0) : fido=823a0430, Irp=81b4e870, Context=81af1cb8, IRQL=2
[308421 ms]  <<<  URB 577 coming back  <<< 
-- URB_FUNCTION_BULK_OR_INTERRUPT_TRANSFER:
  PipeHandle           = 81b44aec [endpoint 0x00000002]
  TransferFlags        = 00000000 (USBD_TRANSFER_DIRECTION_OUT, ~USBD_SHORT_TRANSFER_OK)
  TransferBufferLength = 00000007
  TransferBuffer       = 00000000
  TransferBufferMDL    = 8216a008
  UrbLink              = 00000000
[308430 ms] UsbSnoop - DispatchAny(f88c6610) : IRP_MJ_INTERNAL_DEVICE_CONTROL
[308430 ms] UsbSnoop - MyDispatchInternalIOCTL(f88c7e80) : fdo=82142030, Irp=81b4e870, IRQL=2
[308430 ms]  >>>  URB 578 going down  >>> 
-- URB_FUNCTION_BULK_OR_INTERRUPT_TRANSFER:
  PipeHandle           = 81b44acc [endpoint 0x00000081]
  TransferFlags        = 00000003 (USBD_TRANSFER_DIRECTION_IN, USBD_SHORT_TRANSFER_OK)
  TransferBufferLength = 00000100
  TransferBuffer       = 00000000
  TransferBufferMDL    = 8216a008
  UrbLink              = 00000000
[308430 ms] UsbSnoop - MyInternalIOCTLCompletion(f88c7db0) : fido=823a0430, Irp=81b4e870, Context=822fb2d8, IRQL=2
[308430 ms]  <<<  URB 578 coming back  <<< 
-- URB_FUNCTION_BULK_OR_INTERRUPT_TRANSFER:
  PipeHandle           = 81b44acc [endpoint 0x00000081]
  TransferFlags        = 00000003 (USBD_TRANSFER_DIRECTION_IN, USBD_SHORT_TRANSFER_OK)
  TransferBufferLength = 00000005
  TransferBuffer       = 00000000
  TransferBufferMDL    = 8216a008
    00000000: 00 00 00 38 04
  UrbLink              = 00000000
[308461 ms] UsbSnoop - DispatchAny(f88c6610) : IRP_MJ_INTERNAL_DEVICE_CONTROL
[308461 ms] UsbSnoop - MyDispatchInternalIOCTL(f88c7e80) : fdo=82142030, Irp=81b4e870, IRQL=2
[308461 ms]  >>>  URB 579 going down  >>> 
-- URB_FUNCTION_BULK_OR_INTERRUPT_TRANSFER:
  PipeHandle           = 81b44acc [endpoint 0x00000081]
  TransferFlags        = 00000003 (USBD_TRANSFER_DIRECTION_IN, USBD_SHORT_TRANSFER_OK)
  TransferBufferLength = 00000100
  TransferBuffer       = 00000000
  TransferBufferMDL    = 8216a008
  UrbLink              = 00000000
[308461 ms] UsbSnoop - MyInternalIOCTLCompletion(f88c7db0) : fido=823a0430, Irp=81b4e870, Context=8215da28, IRQL=2
[308461 ms]  <<<  URB 579 coming back  <<< 
-- URB_FUNCTION_BULK_OR_INTERRUPT_TRANSFER:
  PipeHandle           = 81b44acc [endpoint 0x00000081]
  TransferFlags        = 00000003 (USBD_TRANSFER_DIRECTION_IN, USBD_SHORT_TRANSFER_OK)
  TransferBufferLength = 00000038
  TransferBuffer       = 00000000
  TransferBufferMDL    = 8216a008
    00000000: 00 00 00 32 00 0a 02 70 32 00 06 6d 65 63 61 70
    00000010: 74 00 00 06 00 02 00 00 04 f0 04 00 0b 00 03 00
    00000020: 00 01 00 00 05 02 00 01 00 00 04 00 00 01 73 00
    00000030: 41 00 00 01 00 00 42 01
  UrbLink              = 00000000
[308490 ms] UsbSnoop - DispatchAny(f88c6610) : IRP_MJ_INTERNAL_DEVICE_CONTROL
[308490 ms] UsbSnoop - MyDispatchInternalIOCTL(f88c7e80) : fdo=82142030, Irp=81b4e870, IRQL=2
[308490 ms]  >>>  URB 580 going down  >>> 
-- URB_FUNCTION_BULK_OR_INTERRUPT_TRANSFER:
  PipeHandle           = 81b44aec [endpoint 0x00000002]
  TransferFlags        = 00000000 (USBD_TRANSFER_DIRECTION_OUT, ~USBD_SHORT_TRANSFER_OK)
  TransferBufferLength = 00000007
  TransferBuffer       = 00000000
  TransferBufferMDL    = 8216a008
    00000000: 00 00 00 02 05 e0 00
  UrbLink              = 00000000
[308491 ms] UsbSnoop - MyInternalIOCTLCompletion(f88c7db0) : fido=823a0430, Irp=81b4e870, Context=8215da28, IRQL=2
[308491 ms]  <<<  URB 580 coming back  <<< 
-- URB_FUNCTION_BULK_OR_INTERRUPT_TRANSFER:
  PipeHandle           = 81b44aec [endpoint 0x00000002]
  TransferFlags        = 00000000 (USBD_TRANSFER_DIRECTION_OUT, ~USBD_SHORT_TRANSFER_OK)
  TransferBufferLength = 00000007
  TransferBuffer       = 00000000
  TransferBufferMDL    = 8216a008
  UrbLink              = 00000000
[308500 ms] UsbSnoop - DispatchAny(f88c6610) : IRP_MJ_INTERNAL_DEVICE_CONTROL
[308500 ms] UsbSnoop - MyDispatchInternalIOCTL(f88c7e80) : fdo=82142030, Irp=81b4e870, IRQL=2
[308500 ms]  >>>  URB 581 going down  >>> 
-- URB_FUNCTION_BULK_OR_INTERRUPT_TRANSFER:
  PipeHandle           = 81b44acc [endpoint 0x00000081]
  TransferFlags        = 00000003 (USBD_TRANSFER_DIRECTION_IN, USBD_SHORT_TRANSFER_OK)
  TransferBufferLength = 00000100
  TransferBuffer       = 00000000
  TransferBufferMDL    = 8216a008
  UrbLink              = 00000000
[308501 ms] UsbSnoop - MyInternalIOCTLCompletion(f88c7db0) : fido=823a0430, Irp=81b4e870, Context=81adbfe8, IRQL=2
[308501 ms]  <<<  URB 581 coming back  <<< 
-- URB_FUNCTION_BULK_OR_INTERRUPT_TRANSFER:
  PipeHandle           = 81b44acc [endpoint 0x00000081]
  TransferFlags        = 00000003 (USBD_TRANSFER_DIRECTION_IN, USBD_SHORT_TRANSFER_OK)
  TransferBufferLength = 00000005
  TransferBuffer       = 00000000
  TransferBufferMDL    = 8216a008
    00000000: 00 00 00 39 04
  UrbLink              = 00000000
[308531 ms] UsbSnoop - DispatchAny(f88c6610) : IRP_MJ_INTERNAL_DEVICE_CONTROL
[308531 ms] UsbSnoop - MyDispatchInternalIOCTL(f88c7e80) : fdo=82142030, Irp=81b4e870, IRQL=2
[308531 ms]  >>>  URB 582 going down  >>> 
-- URB_FUNCTION_BULK_OR_INTERRUPT_TRANSFER:
  PipeHandle           = 81b44acc [endpoint 0x00000081]
  TransferFlags        = 00000003 (USBD_TRANSFER_DIRECTION_IN, USBD_SHORT_TRANSFER_OK)
  TransferBufferLength = 00000100
  TransferBuffer       = 00000000
  TransferBufferMDL    = 8216a008
  UrbLink              = 00000000
[308531 ms] UsbSnoop - MyInternalIOCTLCompletion(f88c7db0) : fido=823a0430, Irp=81b4e870, Context=81af1cb8, IRQL=2
[308531 ms]  <<<  URB 582 coming back  <<< 
-- URB_FUNCTION_BULK_OR_INTERRUPT_TRANSFER:
  PipeHandle           = 81b44acc [endpoint 0x00000081]
  TransferFlags        = 00000003 (USBD_TRANSFER_DIRECTION_IN, USBD_SHORT_TRANSFER_OK)
  TransferBufferLength = 00000039
  TransferBuffer       = 00000000
  TransferBufferMDL    = 8216a008
    00000000: 00 00 00 33 00 0a 02 70 32 00 07 6f 73 63 68 61
    00000010: 72 6d 00 00 06 00 02 00 00 04 f0 04 00 0b 00 03
    00000020: 00 00 01 00 00 05 02 00 01 00 00 04 00 00 00 47
    00000030: 00 41 00 00 01 00 00 42 01
  UrbLink              = 00000000
[308561 ms] UsbSnoop - DispatchAny(f88c6610) : IRP_MJ_INTERNAL_DEVICE_CONTROL
[308561 ms] UsbSnoop - MyDispatchInternalIOCTL(f88c7e80) : fdo=82142030, Irp=81b4e870, IRQL=2
[308561 ms]  >>>  URB 583 going down  >>> 
-- URB_FUNCTION_BULK_OR_INTERRUPT_TRANSFER:
  PipeHandle           = 81b44aec [endpoint 0x00000002]
  TransferFlags        = 00000000 (USBD_TRANSFER_DIRECTION_OUT, ~USBD_SHORT_TRANSFER_OK)
  TransferBufferLength = 00000007
  TransferBuffer       = 00000000
  TransferBufferMDL    = 8216a008
    00000000: 00 00 00 02 05 e0 00
  UrbLink              = 00000000
[308562 ms] UsbSnoop - MyInternalIOCTLCompletion(f88c7db0) : fido=823a0430, Irp=81b4e870, Context=81c6cb60, IRQL=2
[308562 ms]  <<<  URB 583 coming back  <<< 
-- URB_FUNCTION_BULK_OR_INTERRUPT_TRANSFER:
  PipeHandle           = 81b44aec [endpoint 0x00000002]
  TransferFlags        = 00000000 (USBD_TRANSFER_DIRECTION_OUT, ~USBD_SHORT_TRANSFER_OK)
  TransferBufferLength = 00000007
  TransferBuffer       = 00000000
  TransferBufferMDL    = 8216a008
  UrbLink              = 00000000
[308571 ms] UsbSnoop - DispatchAny(f88c6610) : IRP_MJ_INTERNAL_DEVICE_CONTROL
[308571 ms] UsbSnoop - MyDispatchInternalIOCTL(f88c7e80) : fdo=82142030, Irp=81b4e870, IRQL=2
[308571 ms]  >>>  URB 584 going down  >>> 
-- URB_FUNCTION_BULK_OR_INTERRUPT_TRANSFER:
  PipeHandle           = 81b44acc [endpoint 0x00000081]
  TransferFlags        = 00000003 (USBD_TRANSFER_DIRECTION_IN, USBD_SHORT_TRANSFER_OK)
  TransferBufferLength = 00000100
  TransferBuffer       = 00000000
  TransferBufferMDL    = 8216a008
  UrbLink              = 00000000
[308571 ms] UsbSnoop - MyInternalIOCTLCompletion(f88c7db0) : fido=823a0430, Irp=81b4e870, Context=81af1cb8, IRQL=2
[308571 ms]  <<<  URB 584 coming back  <<< 
-- URB_FUNCTION_BULK_OR_INTERRUPT_TRANSFER:
  PipeHandle           = 81b44acc [endpoint 0x00000081]
  TransferFlags        = 00000003 (USBD_TRANSFER_DIRECTION_IN, USBD_SHORT_TRANSFER_OK)
  TransferBufferLength = 00000005
  TransferBuffer       = 00000000
  TransferBufferMDL    = 8216a008
    00000000: 00 00 00 31 04
  UrbLink              = 00000000
[308601 ms] UsbSnoop - DispatchAny(f88c6610) : IRP_MJ_INTERNAL_DEVICE_CONTROL
[308601 ms] UsbSnoop - MyDispatchInternalIOCTL(f88c7e80) : fdo=82142030, Irp=81b4e870, IRQL=2
[308601 ms]  >>>  URB 585 going down  >>> 
-- URB_FUNCTION_BULK_OR_INTERRUPT_TRANSFER:
  PipeHandle           = 81b44acc [endpoint 0x00000081]
  TransferFlags        = 00000003 (USBD_TRANSFER_DIRECTION_IN, USBD_SHORT_TRANSFER_OK)
  TransferBufferLength = 00000100
  TransferBuffer       = 00000000
  TransferBufferMDL    = 8216a008
  UrbLink              = 00000000
[308601 ms] UsbSnoop - MyInternalIOCTLCompletion(f88c7db0) : fido=823a0430, Irp=81b4e870, Context=8215da28, IRQL=2
[308601 ms]  <<<  URB 585 coming back  <<< 
-- URB_FUNCTION_BULK_OR_INTERRUPT_TRANSFER:
  PipeHandle           = 81b44acc [endpoint 0x00000081]
  TransferFlags        = 00000003 (USBD_TRANSFER_DIRECTION_IN, USBD_SHORT_TRANSFER_OK)
  TransferBufferLength = 00000031
  TransferBuffer       = 00000000
  TransferBufferMDL    = 8216a008
    00000000: 00 00 00 2b 00 0a 02 70 33 00 00 00 06 00 02 00
    00000010: 00 04 f0 04 00 1f 00 03 00 00 01 00 00 05 02 00
    00000020: 01 00 00 04 00 00 00 0c 00 41 00 00 01 00 00 42
    00000030: 01
  UrbLink              = 00000000
[308631 ms] UsbSnoop - DispatchAny(f88c6610) : IRP_MJ_INTERNAL_DEVICE_CONTROL
[308631 ms] UsbSnoop - MyDispatchInternalIOCTL(f88c7e80) : fdo=82142030, Irp=81b4e870, IRQL=2
[308631 ms]  >>>  URB 586 going down  >>> 
-- URB_FUNCTION_BULK_OR_INTERRUPT_TRANSFER:
  PipeHandle           = 81b44aec [endpoint 0x00000002]
  TransferFlags        = 00000000 (USBD_TRANSFER_DIRECTION_OUT, ~USBD_SHORT_TRANSFER_OK)
  TransferBufferLength = 00000007
  TransferBuffer       = 00000000
  TransferBufferMDL    = 8216a008
    00000000: 00 00 00 02 05 e0 00
  UrbLink              = 00000000
[308631 ms] UsbSnoop - MyInternalIOCTLCompletion(f88c7db0) : fido=823a0430, Irp=81b4e870, Context=81ad5658, IRQL=2
[308631 ms]  <<<  URB 586 coming back  <<< 
-- URB_FUNCTION_BULK_OR_INTERRUPT_TRANSFER:
  PipeHandle           = 81b44aec [endpoint 0x00000002]
  TransferFlags        = 00000000 (USBD_TRANSFER_DIRECTION_OUT, ~USBD_SHORT_TRANSFER_OK)
  TransferBufferLength = 00000007
  TransferBuffer       = 00000000
  TransferBufferMDL    = 8216a008
  UrbLink              = 00000000
[308641 ms] UsbSnoop - DispatchAny(f88c6610) : IRP_MJ_INTERNAL_DEVICE_CONTROL
[308641 ms] UsbSnoop - MyDispatchInternalIOCTL(f88c7e80) : fdo=82142030, Irp=81b4e870, IRQL=2
[308641 ms]  >>>  URB 587 going down  >>> 
-- URB_FUNCTION_BULK_OR_INTERRUPT_TRANSFER:
  PipeHandle           = 81b44acc [endpoint 0x00000081]
  TransferFlags        = 00000003 (USBD_TRANSFER_DIRECTION_IN, USBD_SHORT_TRANSFER_OK)
  TransferBufferLength = 00000100
  TransferBuffer       = 00000000
  TransferBufferMDL    = 8216a008
  UrbLink              = 00000000
[308641 ms] UsbSnoop - MyInternalIOCTLCompletion(f88c7db0) : fido=823a0430, Irp=81b4e870, Context=8215da28, IRQL=2
[308641 ms]  <<<  URB 587 coming back  <<< 
-- URB_FUNCTION_BULK_OR_INTERRUPT_TRANSFER:
  PipeHandle           = 81b44acc [endpoint 0x00000081]
  TransferFlags        = 00000003 (USBD_TRANSFER_DIRECTION_IN, USBD_SHORT_TRANSFER_OK)
  TransferBufferLength = 00000005
  TransferBuffer       = 00000000
  TransferBufferMDL    = 8216a008
    00000000: 00 00 00 3a 04
  UrbLink              = 00000000
[308671 ms] UsbSnoop - DispatchAny(f88c6610) : IRP_MJ_INTERNAL_DEVICE_CONTROL
[308671 ms] UsbSnoop - MyDispatchInternalIOCTL(f88c7e80) : fdo=82142030, Irp=81b4e870, IRQL=2
[308671 ms]  >>>  URB 588 going down  >>> 
-- URB_FUNCTION_BULK_OR_INTERRUPT_TRANSFER:
  PipeHandle           = 81b44acc [endpoint 0x00000081]
  TransferFlags        = 00000003 (USBD_TRANSFER_DIRECTION_IN, USBD_SHORT_TRANSFER_OK)
  TransferBufferLength = 00000100
  TransferBuffer       = 00000000
  TransferBufferMDL    = 8216a008
  UrbLink              = 00000000
[308671 ms] UsbSnoop - MyInternalIOCTLCompletion(f88c7db0) : fido=823a0430, Irp=81b4e870, Context=81c6cb60, IRQL=2
[308671 ms]  <<<  URB 588 coming back  <<< 
-- URB_FUNCTION_BULK_OR_INTERRUPT_TRANSFER:
  PipeHandle           = 81b44acc [endpoint 0x00000081]
  TransferFlags        = 00000003 (USBD_TRANSFER_DIRECTION_IN, USBD_SHORT_TRANSFER_OK)
  TransferBufferLength = 0000003a
  TransferBuffer       = 00000000
  TransferBufferMDL    = 8216a008
    00000000: 00 00 00 34 00 0a 02 70 33 00 08 73 74 61 74 66
    00000010: 6c 75 69 00 00 06 00 02 00 00 04 f0 04 00 0b 00
    00000020: 03 00 00 01 00 00 05 02 00 01 00 00 04 00 00 00
    00000030: 6b 00 41 00 00 01 00 00 42 01
  UrbLink              = 00000000
[308701 ms] UsbSnoop - DispatchAny(f88c6610) : IRP_MJ_INTERNAL_DEVICE_CONTROL
[308701 ms] UsbSnoop - MyDispatchInternalIOCTL(f88c7e80) : fdo=82142030, Irp=81b4e870, IRQL=2
[308701 ms]  >>>  URB 589 going down  >>> 
-- URB_FUNCTION_BULK_OR_INTERRUPT_TRANSFER:
  PipeHandle           = 81b44aec [endpoint 0x00000002]
  TransferFlags        = 00000000 (USBD_TRANSFER_DIRECTION_OUT, ~USBD_SHORT_TRANSFER_OK)
  TransferBufferLength = 00000007
  TransferBuffer       = 00000000
  TransferBufferMDL    = 8216a008
    00000000: 00 00 00 02 05 e0 00
  UrbLink              = 00000000
[308701 ms] UsbSnoop - MyInternalIOCTLCompletion(f88c7db0) : fido=823a0430, Irp=81b4e870, Context=8215da28, IRQL=2
[308701 ms]  <<<  URB 589 coming back  <<< 
-- URB_FUNCTION_BULK_OR_INTERRUPT_TRANSFER:
  PipeHandle           = 81b44aec [endpoint 0x00000002]
  TransferFlags        = 00000000 (USBD_TRANSFER_DIRECTION_OUT, ~USBD_SHORT_TRANSFER_OK)
  TransferBufferLength = 00000007
  TransferBuffer       = 00000000
  TransferBufferMDL    = 8216a008
  UrbLink              = 00000000
[308712 ms] UsbSnoop - DispatchAny(f88c6610) : IRP_MJ_INTERNAL_DEVICE_CONTROL
[308712 ms] UsbSnoop - MyDispatchInternalIOCTL(f88c7e80) : fdo=82142030, Irp=81b4e870, IRQL=2
[308712 ms]  >>>  URB 590 going down  >>> 
-- URB_FUNCTION_BULK_OR_INTERRUPT_TRANSFER:
  PipeHandle           = 81b44acc [endpoint 0x00000081]
  TransferFlags        = 00000003 (USBD_TRANSFER_DIRECTION_IN, USBD_SHORT_TRANSFER_OK)
  TransferBufferLength = 00000100
  TransferBuffer       = 00000000
  TransferBufferMDL    = 8216a008
  UrbLink              = 00000000
[308712 ms] UsbSnoop - MyInternalIOCTLCompletion(f88c7db0) : fido=823a0430, Irp=81b4e870, Context=822fb2d8, IRQL=2
[308712 ms]  <<<  URB 590 coming back  <<< 
-- URB_FUNCTION_BULK_OR_INTERRUPT_TRANSFER:
  PipeHandle           = 81b44acc [endpoint 0x00000081]
  TransferFlags        = 00000003 (USBD_TRANSFER_DIRECTION_IN, USBD_SHORT_TRANSFER_OK)
  TransferBufferLength = 00000005
  TransferBuffer       = 00000000
  TransferBufferMDL    = 8216a008
    00000000: 00 00 00 39 04
  UrbLink              = 00000000
[308741 ms] UsbSnoop - DispatchAny(f88c6610) : IRP_MJ_INTERNAL_DEVICE_CONTROL
[308741 ms] UsbSnoop - MyDispatchInternalIOCTL(f88c7e80) : fdo=82142030, Irp=81b4e870, IRQL=2
[308741 ms]  >>>  URB 591 going down  >>> 
-- URB_FUNCTION_BULK_OR_INTERRUPT_TRANSFER:
  PipeHandle           = 81b44acc [endpoint 0x00000081]
  TransferFlags        = 00000003 (USBD_TRANSFER_DIRECTION_IN, USBD_SHORT_TRANSFER_OK)
  TransferBufferLength = 00000100
  TransferBuffer       = 00000000
  TransferBufferMDL    = 8216a008
  UrbLink              = 00000000
[308741 ms] UsbSnoop - MyInternalIOCTLCompletion(f88c7db0) : fido=823a0430, Irp=81b4e870, Context=81ad5658, IRQL=2
[308741 ms]  <<<  URB 591 coming back  <<< 
-- URB_FUNCTION_BULK_OR_INTERRUPT_TRANSFER:
  PipeHandle           = 81b44acc [endpoint 0x00000081]
  TransferFlags        = 00000003 (USBD_TRANSFER_DIRECTION_IN, USBD_SHORT_TRANSFER_OK)
  TransferBufferLength = 00000039
  TransferBuffer       = 00000000
  TransferBufferMDL    = 8216a008
    00000000: 00 00 00 33 00 0a 02 70 33 00 07 74 68 65 72 6d
    00000010: 6f 31 00 00 06 00 02 00 00 04 f0 04 00 0b 00 03
    00000020: 00 00 01 00 00 05 02 00 01 00 00 04 00 00 01 8f
    00000030: 00 41 00 00 01 00 00 42 01
  UrbLink              = 00000000
[308771 ms] UsbSnoop - DispatchAny(f88c6610) : IRP_MJ_INTERNAL_DEVICE_CONTROL
[308771 ms] UsbSnoop - MyDispatchInternalIOCTL(f88c7e80) : fdo=82142030, Irp=81b4e870, IRQL=2
[308771 ms]  >>>  URB 592 going down  >>> 
-- URB_FUNCTION_BULK_OR_INTERRUPT_TRANSFER:
  PipeHandle           = 81b44aec [endpoint 0x00000002]
  TransferFlags        = 00000000 (USBD_TRANSFER_DIRECTION_OUT, ~USBD_SHORT_TRANSFER_OK)
  TransferBufferLength = 00000007
  TransferBuffer       = 00000000
  TransferBufferMDL    = 8216a008
    00000000: 00 00 00 02 05 e0 00
  UrbLink              = 00000000
[308771 ms] UsbSnoop - MyInternalIOCTLCompletion(f88c7db0) : fido=823a0430, Irp=81b4e870, Context=81c6cb60, IRQL=2
[308771 ms]  <<<  URB 592 coming back  <<< 
-- URB_FUNCTION_BULK_OR_INTERRUPT_TRANSFER:
  PipeHandle           = 81b44aec [endpoint 0x00000002]
  TransferFlags        = 00000000 (USBD_TRANSFER_DIRECTION_OUT, ~USBD_SHORT_TRANSFER_OK)
  TransferBufferLength = 00000007
  TransferBuffer       = 00000000
  TransferBufferMDL    = 8216a008
  UrbLink              = 00000000
[308781 ms] UsbSnoop - DispatchAny(f88c6610) : IRP_MJ_INTERNAL_DEVICE_CONTROL
[308781 ms] UsbSnoop - MyDispatchInternalIOCTL(f88c7e80) : fdo=82142030, Irp=81b4e870, IRQL=2
[308781 ms]  >>>  URB 593 going down  >>> 
-- URB_FUNCTION_BULK_OR_INTERRUPT_TRANSFER:
  PipeHandle           = 81b44acc [endpoint 0x00000081]
  TransferFlags        = 00000003 (USBD_TRANSFER_DIRECTION_IN, USBD_SHORT_TRANSFER_OK)
  TransferBufferLength = 00000100
  TransferBuffer       = 00000000
  TransferBufferMDL    = 8216a008
  UrbLink              = 00000000
[308781 ms] UsbSnoop - MyInternalIOCTLCompletion(f88c7db0) : fido=823a0430, Irp=81b4e870, Context=81ad5658, IRQL=2
[308781 ms]  <<<  URB 593 coming back  <<< 
-- URB_FUNCTION_BULK_OR_INTERRUPT_TRANSFER:
  PipeHandle           = 81b44acc [endpoint 0x00000081]
  TransferFlags        = 00000003 (USBD_TRANSFER_DIRECTION_IN, USBD_SHORT_TRANSFER_OK)
  TransferBufferLength = 00000005
  TransferBuffer       = 00000000
  TransferBufferMDL    = 8216a008
    00000000: 00 00 00 39 04
  UrbLink              = 00000000
[308812 ms] UsbSnoop - DispatchAny(f88c6610) : IRP_MJ_INTERNAL_DEVICE_CONTROL
[308812 ms] UsbSnoop - MyDispatchInternalIOCTL(f88c7e80) : fdo=82142030, Irp=81b4e870, IRQL=2
[308812 ms]  >>>  URB 594 going down  >>> 
-- URB_FUNCTION_BULK_OR_INTERRUPT_TRANSFER:
  PipeHandle           = 81b44acc [endpoint 0x00000081]
  TransferFlags        = 00000003 (USBD_TRANSFER_DIRECTION_IN, USBD_SHORT_TRANSFER_OK)
  TransferBufferLength = 00000100
  TransferBuffer       = 00000000
  TransferBufferMDL    = 8216a008
  UrbLink              = 00000000
[308812 ms] UsbSnoop - MyInternalIOCTLCompletion(f88c7db0) : fido=823a0430, Irp=81b4e870, Context=8215da28, IRQL=2
[308812 ms]  <<<  URB 594 coming back  <<< 
-- URB_FUNCTION_BULK_OR_INTERRUPT_TRANSFER:
  PipeHandle           = 81b44acc [endpoint 0x00000081]
  TransferFlags        = 00000003 (USBD_TRANSFER_DIRECTION_IN, USBD_SHORT_TRANSFER_OK)
  TransferBufferLength = 00000039
  TransferBuffer       = 00000000
  TransferBufferMDL    = 8216a008
    00000000: 00 00 00 33 00 0a 02 70 33 00 07 74 68 65 72 6d
    00000010: 6f 32 00 00 06 00 02 00 00 04 f0 04 00 0b 00 03
    00000020: 00 00 01 00 00 05 02 00 01 00 00 04 00 00 01 9e
    00000030: 00 41 00 00 01 00 00 42 01
  UrbLink              = 00000000
[308841 ms] UsbSnoop - DispatchAny(f88c6610) : IRP_MJ_INTERNAL_DEVICE_CONTROL
[308841 ms] UsbSnoop - MyDispatchInternalIOCTL(f88c7e80) : fdo=82142030, Irp=81b4e870, IRQL=2
[308841 ms]  >>>  URB 595 going down  >>> 
-- URB_FUNCTION_BULK_OR_INTERRUPT_TRANSFER:
  PipeHandle           = 81b44aec [endpoint 0x00000002]
  TransferFlags        = 00000000 (USBD_TRANSFER_DIRECTION_OUT, ~USBD_SHORT_TRANSFER_OK)
  TransferBufferLength = 00000007
  TransferBuffer       = 00000000
  TransferBufferMDL    = 8216a008
    00000000: 00 00 00 02 05 e0 00
  UrbLink              = 00000000
[308841 ms] UsbSnoop - MyInternalIOCTLCompletion(f88c7db0) : fido=823a0430, Irp=81b4e870, Context=81ad5658, IRQL=2
[308841 ms]  <<<  URB 595 coming back  <<< 
-- URB_FUNCTION_BULK_OR_INTERRUPT_TRANSFER:
  PipeHandle           = 81b44aec [endpoint 0x00000002]
  TransferFlags        = 00000000 (USBD_TRANSFER_DIRECTION_OUT, ~USBD_SHORT_TRANSFER_OK)
  TransferBufferLength = 00000007
  TransferBuffer       = 00000000
  TransferBufferMDL    = 8216a008
  UrbLink              = 00000000
[308851 ms] UsbSnoop - DispatchAny(f88c6610) : IRP_MJ_INTERNAL_DEVICE_CONTROL
[308851 ms] UsbSnoop - MyDispatchInternalIOCTL(f88c7e80) : fdo=82142030, Irp=81b4e870, IRQL=2
[308851 ms]  >>>  URB 596 going down  >>> 
-- URB_FUNCTION_BULK_OR_INTERRUPT_TRANSFER:
  PipeHandle           = 81b44acc [endpoint 0x00000081]
  TransferFlags        = 00000003 (USBD_TRANSFER_DIRECTION_IN, USBD_SHORT_TRANSFER_OK)
  TransferBufferLength = 00000100
  TransferBuffer       = 00000000
  TransferBufferMDL    = 8216a008
  UrbLink              = 00000000
[308851 ms] UsbSnoop - MyInternalIOCTLCompletion(f88c7db0) : fido=823a0430, Irp=81b4e870, Context=81adbfe8, IRQL=2
[308851 ms]  <<<  URB 596 coming back  <<< 
-- URB_FUNCTION_BULK_OR_INTERRUPT_TRANSFER:
  PipeHandle           = 81b44acc [endpoint 0x00000081]
  TransferFlags        = 00000003 (USBD_TRANSFER_DIRECTION_IN, USBD_SHORT_TRANSFER_OK)
  TransferBufferLength = 00000005
  TransferBuffer       = 00000000
  TransferBufferMDL    = 8216a008
    00000000: 00 00 00 31 04
  UrbLink              = 00000000
[308881 ms] UsbSnoop - DispatchAny(f88c6610) : IRP_MJ_INTERNAL_DEVICE_CONTROL
[308881 ms] UsbSnoop - MyDispatchInternalIOCTL(f88c7e80) : fdo=82142030, Irp=81b4e870, IRQL=2
[308881 ms]  >>>  URB 597 going down  >>> 
-- URB_FUNCTION_BULK_OR_INTERRUPT_TRANSFER:
  PipeHandle           = 81b44acc [endpoint 0x00000081]
  TransferFlags        = 00000003 (USBD_TRANSFER_DIRECTION_IN, USBD_SHORT_TRANSFER_OK)
  TransferBufferLength = 00000100
  TransferBuffer       = 00000000
  TransferBufferMDL    = 8216a008
  UrbLink              = 00000000
[308882 ms] UsbSnoop - MyInternalIOCTLCompletion(f88c7db0) : fido=823a0430, Irp=81b4e870, Context=81af1cb8, IRQL=2
[308882 ms]  <<<  URB 597 coming back  <<< 
-- URB_FUNCTION_BULK_OR_INTERRUPT_TRANSFER:
  PipeHandle           = 81b44acc [endpoint 0x00000081]
  TransferFlags        = 00000003 (USBD_TRANSFER_DIRECTION_IN, USBD_SHORT_TRANSFER_OK)
  TransferBufferLength = 00000031
  TransferBuffer       = 00000000
  TransferBufferMDL    = 8216a008
    00000000: 00 00 00 2b 00 0a 02 70 34 00 00 00 06 00 02 00
    00000010: 00 04 f0 04 00 1f 00 03 00 00 01 00 00 05 02 00
    00000020: 01 00 00 04 00 00 00 0c 00 41 00 00 01 00 00 42
    00000030: 01
  UrbLink              = 00000000
[308912 ms] UsbSnoop - DispatchAny(f88c6610) : IRP_MJ_INTERNAL_DEVICE_CONTROL
[308912 ms] UsbSnoop - MyDispatchInternalIOCTL(f88c7e80) : fdo=82142030, Irp=81b5d388, IRQL=2
[308912 ms]  >>>  URB 598 going down  >>> 
-- URB_FUNCTION_BULK_OR_INTERRUPT_TRANSFER:
  PipeHandle           = 81b44aec [endpoint 0x00000002]
  TransferFlags        = 00000000 (USBD_TRANSFER_DIRECTION_OUT, ~USBD_SHORT_TRANSFER_OK)
  TransferBufferLength = 00000007
  TransferBuffer       = 00000000
  TransferBufferMDL    = 81cc56a8
    00000000: 00 00 00 02 05 e0 00
  UrbLink              = 00000000
[308912 ms] UsbSnoop - MyInternalIOCTLCompletion(f88c7db0) : fido=823a0430, Irp=81b5d388, Context=81c6cb60, IRQL=2
[308912 ms]  <<<  URB 598 coming back  <<< 
-- URB_FUNCTION_BULK_OR_INTERRUPT_TRANSFER:
  PipeHandle           = 81b44aec [endpoint 0x00000002]
  TransferFlags        = 00000000 (USBD_TRANSFER_DIRECTION_OUT, ~USBD_SHORT_TRANSFER_OK)
  TransferBufferLength = 00000007
  TransferBuffer       = 00000000
  TransferBufferMDL    = 81cc56a8
  UrbLink              = 00000000
[308925 ms] UsbSnoop - DispatchAny(f88c6610) : IRP_MJ_INTERNAL_DEVICE_CONTROL
[308925 ms] UsbSnoop - MyDispatchInternalIOCTL(f88c7e80) : fdo=82142030, Irp=81b5d388, IRQL=2
[308925 ms]  >>>  URB 599 going down  >>> 
-- URB_FUNCTION_BULK_OR_INTERRUPT_TRANSFER:
  PipeHandle           = 81b44acc [endpoint 0x00000081]
  TransferFlags        = 00000003 (USBD_TRANSFER_DIRECTION_IN, USBD_SHORT_TRANSFER_OK)
  TransferBufferLength = 00000100
  TransferBuffer       = 00000000
  TransferBufferMDL    = 81cc56a8
  UrbLink              = 00000000
[308925 ms] UsbSnoop - MyInternalIOCTLCompletion(f88c7db0) : fido=823a0430, Irp=81b5d388, Context=81adbfe8, IRQL=2
[308925 ms]  <<<  URB 599 coming back  <<< 
-- URB_FUNCTION_BULK_OR_INTERRUPT_TRANSFER:
  PipeHandle           = 81b44acc [endpoint 0x00000081]
  TransferFlags        = 00000003 (USBD_TRANSFER_DIRECTION_IN, USBD_SHORT_TRANSFER_OK)
  TransferBufferLength = 00000005
  TransferBuffer       = 00000000
  TransferBufferMDL    = 81cc56a8
    00000000: 00 00 00 3a 04
  UrbLink              = 00000000
[308951 ms] UsbSnoop - DispatchAny(f88c6610) : IRP_MJ_INTERNAL_DEVICE_CONTROL
[308951 ms] UsbSnoop - MyDispatchInternalIOCTL(f88c7e80) : fdo=82142030, Irp=81b5d388, IRQL=2
[308951 ms]  >>>  URB 600 going down  >>> 
-- URB_FUNCTION_BULK_OR_INTERRUPT_TRANSFER:
  PipeHandle           = 81b44acc [endpoint 0x00000081]
  TransferFlags        = 00000003 (USBD_TRANSFER_DIRECTION_IN, USBD_SHORT_TRANSFER_OK)
  TransferBufferLength = 00000100
  TransferBuffer       = 00000000
  TransferBufferMDL    = 81cc56a8
  UrbLink              = 00000000
[308952 ms] UsbSnoop - MyInternalIOCTLCompletion(f88c7db0) : fido=823a0430, Irp=81b5d388, Context=822fb2d8, IRQL=2
[308952 ms]  <<<  URB 600 coming back  <<< 
-- URB_FUNCTION_BULK_OR_INTERRUPT_TRANSFER:
  PipeHandle           = 81b44acc [endpoint 0x00000081]
  TransferFlags        = 00000003 (USBD_TRANSFER_DIRECTION_IN, USBD_SHORT_TRANSFER_OK)
  TransferBufferLength = 0000003a
  TransferBuffer       = 00000000
  TransferBufferMDL    = 81cc56a8
    00000000: 00 00 00 34 00 0a 02 70 34 00 08 63 68 70 65 6c
    00000010: 65 63 74 00 00 06 00 02 00 00 04 f0 04 00 0b 00
    00000020: 03 00 00 01 00 00 05 02 00 01 00 00 04 00 00 01
    00000030: d5 00 41 00 00 01 00 00 42 01
  UrbLink              = 00000000
[308981 ms] UsbSnoop - DispatchAny(f88c6610) : IRP_MJ_INTERNAL_DEVICE_CONTROL
[308982 ms] UsbSnoop - MyDispatchInternalIOCTL(f88c7e80) : fdo=82142030, Irp=81b5d388, IRQL=2
[308982 ms]  >>>  URB 601 going down  >>> 
-- URB_FUNCTION_BULK_OR_INTERRUPT_TRANSFER:
  PipeHandle           = 81b44aec [endpoint 0x00000002]
  TransferFlags        = 00000000 (USBD_TRANSFER_DIRECTION_OUT, ~USBD_SHORT_TRANSFER_OK)
  TransferBufferLength = 00000007
  TransferBuffer       = 00000000
  TransferBufferMDL    = 81cc56a8
    00000000: 00 00 00 02 05 e0 00
  UrbLink              = 00000000
[308982 ms] UsbSnoop - MyInternalIOCTLCompletion(f88c7db0) : fido=823a0430, Irp=81b5d388, Context=81ad5658, IRQL=2
[308982 ms]  <<<  URB 601 coming back  <<< 
-- URB_FUNCTION_BULK_OR_INTERRUPT_TRANSFER:
  PipeHandle           = 81b44aec [endpoint 0x00000002]
  TransferFlags        = 00000000 (USBD_TRANSFER_DIRECTION_OUT, ~USBD_SHORT_TRANSFER_OK)
  TransferBufferLength = 00000007
  TransferBuffer       = 00000000
  TransferBufferMDL    = 81cc56a8
  UrbLink              = 00000000
[308991 ms] UsbSnoop - DispatchAny(f88c6610) : IRP_MJ_INTERNAL_DEVICE_CONTROL
[308991 ms] UsbSnoop - MyDispatchInternalIOCTL(f88c7e80) : fdo=82142030, Irp=81b5d388, IRQL=2
[308991 ms]  >>>  URB 602 going down  >>> 
-- URB_FUNCTION_BULK_OR_INTERRUPT_TRANSFER:
  PipeHandle           = 81b44acc [endpoint 0x00000081]
  TransferFlags        = 00000003 (USBD_TRANSFER_DIRECTION_IN, USBD_SHORT_TRANSFER_OK)
  TransferBufferLength = 00000100
  TransferBuffer       = 00000000
  TransferBufferMDL    = 81cc56a8
  UrbLink              = 00000000
[308991 ms] UsbSnoop - MyInternalIOCTLCompletion(f88c7db0) : fido=823a0430, Irp=81b5d388, Context=81af1cb8, IRQL=2
[308991 ms]  <<<  URB 602 coming back  <<< 
-- URB_FUNCTION_BULK_OR_INTERRUPT_TRANSFER:
  PipeHandle           = 81b44acc [endpoint 0x00000081]
  TransferFlags        = 00000003 (USBD_TRANSFER_DIRECTION_IN, USBD_SHORT_TRANSFER_OK)
  TransferBufferLength = 00000005
  TransferBuffer       = 00000000
  TransferBufferMDL    = 81cc56a8
    00000000: 00 00 00 3a 04
  UrbLink              = 00000000
[309021 ms] UsbSnoop - DispatchAny(f88c6610) : IRP_MJ_INTERNAL_DEVICE_CONTROL
[309021 ms] UsbSnoop - MyDispatchInternalIOCTL(f88c7e80) : fdo=82142030, Irp=81b5d388, IRQL=2
[309021 ms]  >>>  URB 603 going down  >>> 
-- URB_FUNCTION_BULK_OR_INTERRUPT_TRANSFER:
  PipeHandle           = 81b44acc [endpoint 0x00000081]
  TransferFlags        = 00000003 (USBD_TRANSFER_DIRECTION_IN, USBD_SHORT_TRANSFER_OK)
  TransferBufferLength = 00000100
  TransferBuffer       = 00000000
  TransferBufferMDL    = 81cc56a8
  UrbLink              = 00000000
[309022 ms] UsbSnoop - MyInternalIOCTLCompletion(f88c7db0) : fido=823a0430, Irp=81b5d388, Context=822fb2d8, IRQL=2
[309022 ms]  <<<  URB 603 coming back  <<< 
-- URB_FUNCTION_BULK_OR_INTERRUPT_TRANSFER:
  PipeHandle           = 81b44acc [endpoint 0x00000081]
  TransferFlags        = 00000003 (USBD_TRANSFER_DIRECTION_IN, USBD_SHORT_TRANSFER_OK)
  TransferBufferLength = 0000003a
  TransferBuffer       = 00000000
  TransferBufferMDL    = 81cc56a8
    00000000: 00 00 00 34 00 0a 02 70 34 00 08 63 68 70 6d 61
    00000010: 67 6e 65 00 00 06 00 02 00 00 04 f0 04 00 0b 00
    00000020: 03 00 00 01 00 00 05 02 00 01 00 00 04 00 00 00
    00000030: c6 00 41 00 00 01 00 00 42 01
  UrbLink              = 00000000
[309051 ms] UsbSnoop - DispatchAny(f88c6610) : IRP_MJ_INTERNAL_DEVICE_CONTROL
[309051 ms] UsbSnoop - MyDispatchInternalIOCTL(f88c7e80) : fdo=82142030, Irp=81b5d388, IRQL=2
[309051 ms]  >>>  URB 604 going down  >>> 
-- URB_FUNCTION_BULK_OR_INTERRUPT_TRANSFER:
  PipeHandle           = 81b44aec [endpoint 0x00000002]
  TransferFlags        = 00000000 (USBD_TRANSFER_DIRECTION_OUT, ~USBD_SHORT_TRANSFER_OK)
  TransferBufferLength = 00000007
  TransferBuffer       = 00000000
  TransferBufferMDL    = 81cc56a8
    00000000: 00 00 00 02 05 e0 00
  UrbLink              = 00000000
[309052 ms] UsbSnoop - MyInternalIOCTLCompletion(f88c7db0) : fido=823a0430, Irp=81b5d388, Context=81af1cb8, IRQL=2
[309052 ms]  <<<  URB 604 coming back  <<< 
-- URB_FUNCTION_BULK_OR_INTERRUPT_TRANSFER:
  PipeHandle           = 81b44aec [endpoint 0x00000002]
  TransferFlags        = 00000000 (USBD_TRANSFER_DIRECTION_OUT, ~USBD_SHORT_TRANSFER_OK)
  TransferBufferLength = 00000007
  TransferBuffer       = 00000000
  TransferBufferMDL    = 81cc56a8
  UrbLink              = 00000000
[309063 ms] UsbSnoop - DispatchAny(f88c6610) : IRP_MJ_INTERNAL_DEVICE_CONTROL
[309063 ms] UsbSnoop - MyDispatchInternalIOCTL(f88c7e80) : fdo=82142030, Irp=81b5d388, IRQL=2
[309063 ms]  >>>  URB 605 going down  >>> 
-- URB_FUNCTION_BULK_OR_INTERRUPT_TRANSFER:
  PipeHandle           = 81b44acc [endpoint 0x00000081]
  TransferFlags        = 00000003 (USBD_TRANSFER_DIRECTION_IN, USBD_SHORT_TRANSFER_OK)
  TransferBufferLength = 00000100
  TransferBuffer       = 00000000
  TransferBufferMDL    = 81cc56a8
  UrbLink              = 00000000
[309063 ms] UsbSnoop - MyInternalIOCTLCompletion(f88c7db0) : fido=823a0430, Irp=81b5d388, Context=8215da28, IRQL=2
[309063 ms]  <<<  URB 605 coming back  <<< 
-- URB_FUNCTION_BULK_OR_INTERRUPT_TRANSFER:
  PipeHandle           = 81b44acc [endpoint 0x00000081]
  TransferFlags        = 00000003 (USBD_TRANSFER_DIRECTION_IN, USBD_SHORT_TRANSFER_OK)
  TransferBufferLength = 00000005
  TransferBuffer       = 00000000
  TransferBufferMDL    = 81cc56a8
    00000000: 00 00 00 3a 04
  UrbLink              = 00000000
[309091 ms] UsbSnoop - DispatchAny(f88c6610) : IRP_MJ_INTERNAL_DEVICE_CONTROL
[309091 ms] UsbSnoop - MyDispatchInternalIOCTL(f88c7e80) : fdo=82142030, Irp=81b5d388, IRQL=2
[309091 ms]  >>>  URB 606 going down  >>> 
-- URB_FUNCTION_BULK_OR_INTERRUPT_TRANSFER:
  PipeHandle           = 81b44acc [endpoint 0x00000081]
  TransferFlags        = 00000003 (USBD_TRANSFER_DIRECTION_IN, USBD_SHORT_TRANSFER_OK)
  TransferBufferLength = 00000100
  TransferBuffer       = 00000000
  TransferBufferMDL    = 81cc56a8
  UrbLink              = 00000000
[309092 ms] UsbSnoop - MyInternalIOCTLCompletion(f88c7db0) : fido=823a0430, Irp=81b5d388, Context=822fb2d8, IRQL=2
[309092 ms]  <<<  URB 606 coming back  <<< 
-- URB_FUNCTION_BULK_OR_INTERRUPT_TRANSFER:
  PipeHandle           = 81b44acc [endpoint 0x00000081]
  TransferFlags        = 00000003 (USBD_TRANSFER_DIRECTION_IN, USBD_SHORT_TRANSFER_OK)
  TransferBufferLength = 0000003a
  TransferBuffer       = 00000000
  TransferBufferMDL    = 81cc56a8
    00000000: 00 00 00 34 00 0a 02 70 34 00 08 64 69 70 6f 6c
    00000010: 65 6c 65 00 00 06 00 02 00 00 04 f0 04 00 0b 00
    00000020: 03 00 00 01 00 00 05 02 00 01 00 00 04 00 00 00
    00000030: a0 00 41 00 00 01 00 00 42 01
  UrbLink              = 00000000
[309121 ms] UsbSnoop - DispatchAny(f88c6610) : IRP_MJ_INTERNAL_DEVICE_CONTROL
[309121 ms] UsbSnoop - MyDispatchInternalIOCTL(f88c7e80) : fdo=82142030, Irp=81b5d388, IRQL=2
[309121 ms]  >>>  URB 607 going down  >>> 
-- URB_FUNCTION_BULK_OR_INTERRUPT_TRANSFER:
  PipeHandle           = 81b44aec [endpoint 0x00000002]
  TransferFlags        = 00000000 (USBD_TRANSFER_DIRECTION_OUT, ~USBD_SHORT_TRANSFER_OK)
  TransferBufferLength = 00000007
  TransferBuffer       = 00000000
  TransferBufferMDL    = 81cc56a8
    00000000: 00 00 00 02 05 e0 00
  UrbLink              = 00000000
[309122 ms] UsbSnoop - MyInternalIOCTLCompletion(f88c7db0) : fido=823a0430, Irp=81b5d388, Context=81c6cb60, IRQL=2
[309122 ms]  <<<  URB 607 coming back  <<< 
-- URB_FUNCTION_BULK_OR_INTERRUPT_TRANSFER:
  PipeHandle           = 81b44aec [endpoint 0x00000002]
  TransferFlags        = 00000000 (USBD_TRANSFER_DIRECTION_OUT, ~USBD_SHORT_TRANSFER_OK)
  TransferBufferLength = 00000007
  TransferBuffer       = 00000000
  TransferBufferMDL    = 81cc56a8
  UrbLink              = 00000000
[309132 ms] UsbSnoop - DispatchAny(f88c6610) : IRP_MJ_INTERNAL_DEVICE_CONTROL
[309132 ms] UsbSnoop - MyDispatchInternalIOCTL(f88c7e80) : fdo=82142030, Irp=81b5d388, IRQL=2
[309132 ms]  >>>  URB 608 going down  >>> 
-- URB_FUNCTION_BULK_OR_INTERRUPT_TRANSFER:
  PipeHandle           = 81b44acc [endpoint 0x00000081]
  TransferFlags        = 00000003 (USBD_TRANSFER_DIRECTION_IN, USBD_SHORT_TRANSFER_OK)
  TransferBufferLength = 00000100
  TransferBuffer       = 00000000
  TransferBufferMDL    = 81cc56a8
  UrbLink              = 00000000
[309132 ms] UsbSnoop - MyInternalIOCTLCompletion(f88c7db0) : fido=823a0430, Irp=81b5d388, Context=822fb2d8, IRQL=2
[309132 ms]  <<<  URB 608 coming back  <<< 
-- URB_FUNCTION_BULK_OR_INTERRUPT_TRANSFER:
  PipeHandle           = 81b44acc [endpoint 0x00000081]
  TransferFlags        = 00000003 (USBD_TRANSFER_DIRECTION_IN, USBD_SHORT_TRANSFER_OK)
  TransferBufferLength = 00000005
  TransferBuffer       = 00000000
  TransferBufferMDL    = 81cc56a8
    00000000: 00 00 00 3a 04
  UrbLink              = 00000000
[309162 ms] UsbSnoop - DispatchAny(f88c6610) : IRP_MJ_INTERNAL_DEVICE_CONTROL
[309162 ms] UsbSnoop - MyDispatchInternalIOCTL(f88c7e80) : fdo=82142030, Irp=81b5d388, IRQL=2
[309162 ms]  >>>  URB 609 going down  >>> 
-- URB_FUNCTION_BULK_OR_INTERRUPT_TRANSFER:
  PipeHandle           = 81b44acc [endpoint 0x00000081]
  TransferFlags        = 00000003 (USBD_TRANSFER_DIRECTION_IN, USBD_SHORT_TRANSFER_OK)
  TransferBufferLength = 00000100
  TransferBuffer       = 00000000
  TransferBufferMDL    = 81cc56a8
  UrbLink              = 00000000
[309163 ms] UsbSnoop - MyInternalIOCTLCompletion(f88c7db0) : fido=823a0430, Irp=81b5d388, Context=81af1cb8, IRQL=2
[309163 ms]  <<<  URB 609 coming back  <<< 
-- URB_FUNCTION_BULK_OR_INTERRUPT_TRANSFER:
  PipeHandle           = 81b44acc [endpoint 0x00000081]
  TransferFlags        = 00000003 (USBD_TRANSFER_DIRECTION_IN, USBD_SHORT_TRANSFER_OK)
  TransferBufferLength = 0000003a
  TransferBuffer       = 00000000
  TransferBufferMDL    = 81cc56a8
    00000000: 00 00 00 34 00 0a 02 70 34 00 08 64 69 70 6f 6c
    00000010: 6d 61 67 00 00 06 00 02 00 00 04 f0 04 00 0b 00
    00000020: 03 00 00 01 00 00 05 02 00 01 00 00 04 00 00 00
    00000030: 7f 00 41 00 00 01 00 00 42 01
  UrbLink              = 00000000
[309192 ms] UsbSnoop - DispatchAny(f88c6610) : IRP_MJ_INTERNAL_DEVICE_CONTROL
[309192 ms] UsbSnoop - MyDispatchInternalIOCTL(f88c7e80) : fdo=82142030, Irp=81b5d388, IRQL=2
[309192 ms]  >>>  URB 610 going down  >>> 
-- URB_FUNCTION_BULK_OR_INTERRUPT_TRANSFER:
  PipeHandle           = 81b44aec [endpoint 0x00000002]
  TransferFlags        = 00000000 (USBD_TRANSFER_DIRECTION_OUT, ~USBD_SHORT_TRANSFER_OK)
  TransferBufferLength = 00000007
  TransferBuffer       = 00000000
  TransferBufferMDL    = 81cc56a8
    00000000: 00 00 00 02 05 e0 00
  UrbLink              = 00000000
[309192 ms] UsbSnoop - MyInternalIOCTLCompletion(f88c7db0) : fido=823a0430, Irp=81b5d388, Context=81ad5658, IRQL=2
[309192 ms]  <<<  URB 610 coming back  <<< 
-- URB_FUNCTION_BULK_OR_INTERRUPT_TRANSFER:
  PipeHandle           = 81b44aec [endpoint 0x00000002]
  TransferFlags        = 00000000 (USBD_TRANSFER_DIRECTION_OUT, ~USBD_SHORT_TRANSFER_OK)
  TransferBufferLength = 00000007
  TransferBuffer       = 00000000
  TransferBufferMDL    = 81cc56a8
  UrbLink              = 00000000
[309202 ms] UsbSnoop - DispatchAny(f88c6610) : IRP_MJ_INTERNAL_DEVICE_CONTROL
[309202 ms] UsbSnoop - MyDispatchInternalIOCTL(f88c7e80) : fdo=82142030, Irp=81b5d388, IRQL=2
[309202 ms]  >>>  URB 611 going down  >>> 
-- URB_FUNCTION_BULK_OR_INTERRUPT_TRANSFER:
  PipeHandle           = 81b44acc [endpoint 0x00000081]
  TransferFlags        = 00000003 (USBD_TRANSFER_DIRECTION_IN, USBD_SHORT_TRANSFER_OK)
  TransferBufferLength = 00000100
  TransferBuffer       = 00000000
  TransferBufferMDL    = 81cc56a8
  UrbLink              = 00000000
[309202 ms] UsbSnoop - MyInternalIOCTLCompletion(f88c7db0) : fido=823a0430, Irp=81b5d388, Context=81af1cb8, IRQL=2
[309202 ms]  <<<  URB 611 coming back  <<< 
-- URB_FUNCTION_BULK_OR_INTERRUPT_TRANSFER:
  PipeHandle           = 81b44acc [endpoint 0x00000081]
  TransferFlags        = 00000003 (USBD_TRANSFER_DIRECTION_IN, USBD_SHORT_TRANSFER_OK)
  TransferBufferLength = 00000005
  TransferBuffer       = 00000000
  TransferBufferMDL    = 81cc56a8
    00000000: 00 00 00 3a 04
  UrbLink              = 00000000
[309232 ms] UsbSnoop - DispatchAny(f88c6610) : IRP_MJ_INTERNAL_DEVICE_CONTROL
[309232 ms] UsbSnoop - MyDispatchInternalIOCTL(f88c7e80) : fdo=82142030, Irp=81b5d388, IRQL=2
[309232 ms]  >>>  URB 612 going down  >>> 
-- URB_FUNCTION_BULK_OR_INTERRUPT_TRANSFER:
  PipeHandle           = 81b44acc [endpoint 0x00000081]
  TransferFlags        = 00000003 (USBD_TRANSFER_DIRECTION_IN, USBD_SHORT_TRANSFER_OK)
  TransferBufferLength = 00000100
  TransferBuffer       = 00000000
  TransferBufferMDL    = 81cc56a8
  UrbLink              = 00000000
[309232 ms] UsbSnoop - MyInternalIOCTLCompletion(f88c7db0) : fido=823a0430, Irp=81b5d388, Context=81c6cb60, IRQL=2
[309232 ms]  <<<  URB 612 coming back  <<< 
-- URB_FUNCTION_BULK_OR_INTERRUPT_TRANSFER:
  PipeHandle           = 81b44acc [endpoint 0x00000081]
  TransferFlags        = 00000003 (USBD_TRANSFER_DIRECTION_IN, USBD_SHORT_TRANSFER_OK)
  TransferBufferLength = 0000003a
  TransferBuffer       = 00000000
  TransferBufferMDL    = 81cc56a8
    00000000: 00 00 00 34 00 0a 02 70 34 00 08 6c 65 6e 74 69
    00000010: 6c 6c 65 00 00 06 00 02 00 00 04 f0 04 00 0b 00
    00000020: 03 00 00 01 00 00 05 02 00 01 00 00 04 00 00 01
    00000030: 9a 00 41 00 00 01 00 00 42 01
  UrbLink              = 00000000
[309262 ms] UsbSnoop - DispatchAny(f88c6610) : IRP_MJ_INTERNAL_DEVICE_CONTROL
[309262 ms] UsbSnoop - MyDispatchInternalIOCTL(f88c7e80) : fdo=82142030, Irp=81b5d388, IRQL=2
[309262 ms]  >>>  URB 613 going down  >>> 
-- URB_FUNCTION_BULK_OR_INTERRUPT_TRANSFER:
  PipeHandle           = 81b44aec [endpoint 0x00000002]
  TransferFlags        = 00000000 (USBD_TRANSFER_DIRECTION_OUT, ~USBD_SHORT_TRANSFER_OK)
  TransferBufferLength = 00000007
  TransferBuffer       = 00000000
  TransferBufferMDL    = 81cc56a8
    00000000: 00 00 00 02 05 e0 00
  UrbLink              = 00000000
[309263 ms] UsbSnoop - MyInternalIOCTLCompletion(f88c7db0) : fido=823a0430, Irp=81b5d388, Context=8215da28, IRQL=2
[309263 ms]  <<<  URB 613 coming back  <<< 
-- URB_FUNCTION_BULK_OR_INTERRUPT_TRANSFER:
  PipeHandle           = 81b44aec [endpoint 0x00000002]
  TransferFlags        = 00000000 (USBD_TRANSFER_DIRECTION_OUT, ~USBD_SHORT_TRANSFER_OK)
  TransferBufferLength = 00000007
  TransferBuffer       = 00000000
  TransferBufferMDL    = 81cc56a8
  UrbLink              = 00000000
[309272 ms] UsbSnoop - DispatchAny(f88c6610) : IRP_MJ_INTERNAL_DEVICE_CONTROL
[309272 ms] UsbSnoop - MyDispatchInternalIOCTL(f88c7e80) : fdo=82142030, Irp=81b5d388, IRQL=2
[309272 ms]  >>>  URB 614 going down  >>> 
-- URB_FUNCTION_BULK_OR_INTERRUPT_TRANSFER:
  PipeHandle           = 81b44acc [endpoint 0x00000081]
  TransferFlags        = 00000003 (USBD_TRANSFER_DIRECTION_IN, USBD_SHORT_TRANSFER_OK)
  TransferBufferLength = 00000100
  TransferBuffer       = 00000000
  TransferBufferMDL    = 81cc56a8
  UrbLink              = 00000000
[309272 ms] UsbSnoop - MyInternalIOCTLCompletion(f88c7db0) : fido=823a0430, Irp=81b5d388, Context=81c6cb60, IRQL=2
[309272 ms]  <<<  URB 614 coming back  <<< 
-- URB_FUNCTION_BULK_OR_INTERRUPT_TRANSFER:
  PipeHandle           = 81b44acc [endpoint 0x00000081]
  TransferFlags        = 00000003 (USBD_TRANSFER_DIRECTION_IN, USBD_SHORT_TRANSFER_OK)
  TransferBufferLength = 00000005
  TransferBuffer       = 00000000
  TransferBufferMDL    = 81cc56a8
    00000000: 00 00 00 39 04
  UrbLink              = 00000000
[309302 ms] UsbSnoop - DispatchAny(f88c6610) : IRP_MJ_INTERNAL_DEVICE_CONTROL
[309302 ms] UsbSnoop - MyDispatchInternalIOCTL(f88c7e80) : fdo=82142030, Irp=81b5d388, IRQL=2
[309302 ms]  >>>  URB 615 going down  >>> 
-- URB_FUNCTION_BULK_OR_INTERRUPT_TRANSFER:
  PipeHandle           = 81b44acc [endpoint 0x00000081]
  TransferFlags        = 00000003 (USBD_TRANSFER_DIRECTION_IN, USBD_SHORT_TRANSFER_OK)
  TransferBufferLength = 00000100
  TransferBuffer       = 00000000
  TransferBufferMDL    = 81cc56a8
  UrbLink              = 00000000
[309302 ms] UsbSnoop - MyInternalIOCTLCompletion(f88c7db0) : fido=823a0430, Irp=81b5d388, Context=81ad5658, IRQL=2
[309302 ms]  <<<  URB 615 coming back  <<< 
-- URB_FUNCTION_BULK_OR_INTERRUPT_TRANSFER:
  PipeHandle           = 81b44acc [endpoint 0x00000081]
  TransferFlags        = 00000003 (USBD_TRANSFER_DIRECTION_IN, USBD_SHORT_TRANSFER_OK)
  TransferBufferLength = 00000039
  TransferBuffer       = 00000000
  TransferBufferMDL    = 81cc56a8
    00000000: 00 00 00 33 00 0a 02 70 34 00 07 6d 69 72 6f 69
    00000010: 72 73 00 00 06 00 02 00 00 04 f0 04 00 0b 00 03
    00000020: 00 00 01 00 00 05 02 00 01 00 00 04 00 00 01 65
    00000030: 00 41 00 00 01 00 00 42 01
  UrbLink              = 00000000
[309332 ms] UsbSnoop - DispatchAny(f88c6610) : IRP_MJ_INTERNAL_DEVICE_CONTROL
[309332 ms] UsbSnoop - MyDispatchInternalIOCTL(f88c7e80) : fdo=82142030, Irp=81b5d388, IRQL=2
[309332 ms]  >>>  URB 616 going down  >>> 
-- URB_FUNCTION_BULK_OR_INTERRUPT_TRANSFER:
  PipeHandle           = 81b44aec [endpoint 0x00000002]
  TransferFlags        = 00000000 (USBD_TRANSFER_DIRECTION_OUT, ~USBD_SHORT_TRANSFER_OK)
  TransferBufferLength = 00000007
  TransferBuffer       = 00000000
  TransferBufferMDL    = 81cc56a8
    00000000: 00 00 00 02 05 e0 00
  UrbLink              = 00000000
[309332 ms] UsbSnoop - MyInternalIOCTLCompletion(f88c7db0) : fido=823a0430, Irp=81b5d388, Context=822fb2d8, IRQL=2
[309332 ms]  <<<  URB 616 coming back  <<< 
-- URB_FUNCTION_BULK_OR_INTERRUPT_TRANSFER:
  PipeHandle           = 81b44aec [endpoint 0x00000002]
  TransferFlags        = 00000000 (USBD_TRANSFER_DIRECTION_OUT, ~USBD_SHORT_TRANSFER_OK)
  TransferBufferLength = 00000007
  TransferBuffer       = 00000000
  TransferBufferMDL    = 81cc56a8
  UrbLink              = 00000000
[309342 ms] UsbSnoop - DispatchAny(f88c6610) : IRP_MJ_INTERNAL_DEVICE_CONTROL
[309342 ms] UsbSnoop - MyDispatchInternalIOCTL(f88c7e80) : fdo=82142030, Irp=81b5d388, IRQL=2
[309342 ms]  >>>  URB 617 going down  >>> 
-- URB_FUNCTION_BULK_OR_INTERRUPT_TRANSFER:
  PipeHandle           = 81b44acc [endpoint 0x00000081]
  TransferFlags        = 00000003 (USBD_TRANSFER_DIRECTION_IN, USBD_SHORT_TRANSFER_OK)
  TransferBufferLength = 00000100
  TransferBuffer       = 00000000
  TransferBufferMDL    = 81cc56a8
  UrbLink              = 00000000
[309342 ms] UsbSnoop - MyInternalIOCTLCompletion(f88c7db0) : fido=823a0430, Irp=81b5d388, Context=81ad5658, IRQL=2
[309342 ms]  <<<  URB 617 coming back  <<< 
-- URB_FUNCTION_BULK_OR_INTERRUPT_TRANSFER:
  PipeHandle           = 81b44acc [endpoint 0x00000081]
  TransferFlags        = 00000003 (USBD_TRANSFER_DIRECTION_IN, USBD_SHORT_TRANSFER_OK)
  TransferBufferLength = 00000005
  TransferBuffer       = 00000000
  TransferBufferMDL    = 81cc56a8
    00000000: 00 00 00 39 04
  UrbLink              = 00000000
[309372 ms] UsbSnoop - DispatchAny(f88c6610) : IRP_MJ_INTERNAL_DEVICE_CONTROL
[309372 ms] UsbSnoop - MyDispatchInternalIOCTL(f88c7e80) : fdo=82142030, Irp=81b5d388, IRQL=2
[309372 ms]  >>>  URB 618 going down  >>> 
-- URB_FUNCTION_BULK_OR_INTERRUPT_TRANSFER:
  PipeHandle           = 81b44acc [endpoint 0x00000081]
  TransferFlags        = 00000003 (USBD_TRANSFER_DIRECTION_IN, USBD_SHORT_TRANSFER_OK)
  TransferBufferLength = 00000100
  TransferBuffer       = 00000000
  TransferBufferMDL    = 81cc56a8
  UrbLink              = 00000000
[309372 ms] UsbSnoop - MyInternalIOCTLCompletion(f88c7db0) : fido=823a0430, Irp=81b5d388, Context=81af1cb8, IRQL=2
[309372 ms]  <<<  URB 618 coming back  <<< 
-- URB_FUNCTION_BULK_OR_INTERRUPT_TRANSFER:
  PipeHandle           = 81b44acc [endpoint 0x00000081]
  TransferFlags        = 00000003 (USBD_TRANSFER_DIRECTION_IN, USBD_SHORT_TRANSFER_OK)
  TransferBufferLength = 00000039
  TransferBuffer       = 00000000
  TransferBufferMDL    = 81cc56a8
    00000000: 00 00 00 33 00 0a 02 70 34 00 07 6f 70 74 69 71
    00000010: 75 65 00 00 06 00 02 00 00 04 f0 04 00 0b 00 03
    00000020: 00 00 01 00 00 05 02 00 01 00 00 04 00 00 00 c2
    00000030: 00 41 00 00 01 00 00 42 01
  UrbLink              = 00000000
[309402 ms] UsbSnoop - DispatchAny(f88c6610) : IRP_MJ_INTERNAL_DEVICE_CONTROL
[309402 ms] UsbSnoop - MyDispatchInternalIOCTL(f88c7e80) : fdo=82142030, Irp=81b5d388, IRQL=2
[309402 ms]  >>>  URB 619 going down  >>> 
-- URB_FUNCTION_BULK_OR_INTERRUPT_TRANSFER:
  PipeHandle           = 81b44aec [endpoint 0x00000002]
  TransferFlags        = 00000000 (USBD_TRANSFER_DIRECTION_OUT, ~USBD_SHORT_TRANSFER_OK)
  TransferBufferLength = 00000007
  TransferBuffer       = 00000000
  TransferBufferMDL    = 81cc56a8
    00000000: 00 00 00 02 05 e0 00
  UrbLink              = 00000000
[309402 ms] UsbSnoop - MyInternalIOCTLCompletion(f88c7db0) : fido=823a0430, Irp=81b5d388, Context=81c6cb60, IRQL=2
[309402 ms]  <<<  URB 619 coming back  <<< 
-- URB_FUNCTION_BULK_OR_INTERRUPT_TRANSFER:
  PipeHandle           = 81b44aec [endpoint 0x00000002]
  TransferFlags        = 00000000 (USBD_TRANSFER_DIRECTION_OUT, ~USBD_SHORT_TRANSFER_OK)
  TransferBufferLength = 00000007
  TransferBuffer       = 00000000
  TransferBufferMDL    = 81cc56a8
  UrbLink              = 00000000
[309413 ms] UsbSnoop - DispatchAny(f88c6610) : IRP_MJ_INTERNAL_DEVICE_CONTROL
[309413 ms] UsbSnoop - MyDispatchInternalIOCTL(f88c7e80) : fdo=82142030, Irp=81b5d388, IRQL=2
[309413 ms]  >>>  URB 620 going down  >>> 
-- URB_FUNCTION_BULK_OR_INTERRUPT_TRANSFER:
  PipeHandle           = 81b44acc [endpoint 0x00000081]
  TransferFlags        = 00000003 (USBD_TRANSFER_DIRECTION_IN, USBD_SHORT_TRANSFER_OK)
  TransferBufferLength = 00000100
  TransferBuffer       = 00000000
  TransferBufferMDL    = 81cc56a8
  UrbLink              = 00000000
[309413 ms] UsbSnoop - MyInternalIOCTLCompletion(f88c7db0) : fido=823a0430, Irp=81b5d388, Context=8215da28, IRQL=2
[309413 ms]  <<<  URB 620 coming back  <<< 
-- URB_FUNCTION_BULK_OR_INTERRUPT_TRANSFER:
  PipeHandle           = 81b44acc [endpoint 0x00000081]
  TransferFlags        = 00000003 (USBD_TRANSFER_DIRECTION_IN, USBD_SHORT_TRANSFER_OK)
  TransferBufferLength = 00000005
  TransferBuffer       = 00000000
  TransferBufferMDL    = 81cc56a8
    00000000: 00 00 00 31 04
  UrbLink              = 00000000
[309442 ms] UsbSnoop - DispatchAny(f88c6610) : IRP_MJ_INTERNAL_DEVICE_CONTROL
[309442 ms] UsbSnoop - MyDispatchInternalIOCTL(f88c7e80) : fdo=82142030, Irp=81b5d388, IRQL=2
[309442 ms]  >>>  URB 621 going down  >>> 
-- URB_FUNCTION_BULK_OR_INTERRUPT_TRANSFER:
  PipeHandle           = 81b44acc [endpoint 0x00000081]
  TransferFlags        = 00000003 (USBD_TRANSFER_DIRECTION_IN, USBD_SHORT_TRANSFER_OK)
  TransferBufferLength = 00000100
  TransferBuffer       = 00000000
  TransferBufferMDL    = 81cc56a8
  UrbLink              = 00000000
[309442 ms] UsbSnoop - MyInternalIOCTLCompletion(f88c7db0) : fido=823a0430, Irp=81b5d388, Context=822fb2d8, IRQL=2
[309442 ms]  <<<  URB 621 coming back  <<< 
-- URB_FUNCTION_BULK_OR_INTERRUPT_TRANSFER:
  PipeHandle           = 81b44acc [endpoint 0x00000081]
  TransferFlags        = 00000003 (USBD_TRANSFER_DIRECTION_IN, USBD_SHORT_TRANSFER_OK)
  TransferBufferLength = 00000031
  TransferBuffer       = 00000000
  TransferBufferMDL    = 81cc56a8
    00000000: 00 00 00 2b 00 0a 02 70 35 00 00 00 06 00 02 00
    00000010: 00 04 f0 04 00 1f 00 03 00 00 01 00 00 05 02 00
    00000020: 01 00 00 04 00 00 00 0c 00 41 00 00 01 00 00 42
    00000030: 01
  UrbLink              = 00000000
[309472 ms] UsbSnoop - DispatchAny(f88c6610) : IRP_MJ_INTERNAL_DEVICE_CONTROL
[309472 ms] UsbSnoop - MyDispatchInternalIOCTL(f88c7e80) : fdo=82142030, Irp=81b5d388, IRQL=2
[309472 ms]  >>>  URB 622 going down  >>> 
-- URB_FUNCTION_BULK_OR_INTERRUPT_TRANSFER:
  PipeHandle           = 81b44aec [endpoint 0x00000002]
  TransferFlags        = 00000000 (USBD_TRANSFER_DIRECTION_OUT, ~USBD_SHORT_TRANSFER_OK)
  TransferBufferLength = 00000007
  TransferBuffer       = 00000000
  TransferBufferMDL    = 81cc56a8
    00000000: 00 00 00 02 05 e0 00
  UrbLink              = 00000000
[309472 ms] UsbSnoop - MyInternalIOCTLCompletion(f88c7db0) : fido=823a0430, Irp=81b5d388, Context=81c6cb60, IRQL=2
[309472 ms]  <<<  URB 622 coming back  <<< 
-- URB_FUNCTION_BULK_OR_INTERRUPT_TRANSFER:
  PipeHandle           = 81b44aec [endpoint 0x00000002]
  TransferFlags        = 00000000 (USBD_TRANSFER_DIRECTION_OUT, ~USBD_SHORT_TRANSFER_OK)
  TransferBufferLength = 00000007
  TransferBuffer       = 00000000
  TransferBufferMDL    = 81cc56a8
  UrbLink              = 00000000
[309482 ms] UsbSnoop - DispatchAny(f88c6610) : IRP_MJ_INTERNAL_DEVICE_CONTROL
[309482 ms] UsbSnoop - MyDispatchInternalIOCTL(f88c7e80) : fdo=82142030, Irp=81b5d388, IRQL=2
[309482 ms]  >>>  URB 623 going down  >>> 
-- URB_FUNCTION_BULK_OR_INTERRUPT_TRANSFER:
  PipeHandle           = 81b44acc [endpoint 0x00000081]
  TransferFlags        = 00000003 (USBD_TRANSFER_DIRECTION_IN, USBD_SHORT_TRANSFER_OK)
  TransferBufferLength = 00000100
  TransferBuffer       = 00000000
  TransferBufferMDL    = 81cc56a8
  UrbLink              = 00000000
[309482 ms] UsbSnoop - MyInternalIOCTLCompletion(f88c7db0) : fido=823a0430, Irp=81b5d388, Context=822fb2d8, IRQL=2
[309482 ms]  <<<  URB 623 coming back  <<< 
-- URB_FUNCTION_BULK_OR_INTERRUPT_TRANSFER:
  PipeHandle           = 81b44acc [endpoint 0x00000081]
  TransferFlags        = 00000003 (USBD_TRANSFER_DIRECTION_IN, USBD_SHORT_TRANSFER_OK)
  TransferBufferLength = 00000005
  TransferBuffer       = 00000000
  TransferBufferMDL    = 81cc56a8
    00000000: 00 00 00 3a 04
  UrbLink              = 00000000
[309513 ms] UsbSnoop - DispatchAny(f88c6610) : IRP_MJ_INTERNAL_DEVICE_CONTROL
[309513 ms] UsbSnoop - MyDispatchInternalIOCTL(f88c7e80) : fdo=82142030, Irp=81b5d388, IRQL=2
[309513 ms]  >>>  URB 624 going down  >>> 
-- URB_FUNCTION_BULK_OR_INTERRUPT_TRANSFER:
  PipeHandle           = 81b44acc [endpoint 0x00000081]
  TransferFlags        = 00000003 (USBD_TRANSFER_DIRECTION_IN, USBD_SHORT_TRANSFER_OK)
  TransferBufferLength = 00000100
  TransferBuffer       = 00000000
  TransferBufferMDL    = 81cc56a8
  UrbLink              = 00000000
[309513 ms] UsbSnoop - MyInternalIOCTLCompletion(f88c7db0) : fido=823a0430, Irp=81b5d388, Context=8215da28, IRQL=2
[309513 ms]  <<<  URB 624 coming back  <<< 
-- URB_FUNCTION_BULK_OR_INTERRUPT_TRANSFER:
  PipeHandle           = 81b44acc [endpoint 0x00000081]
  TransferFlags        = 00000003 (USBD_TRANSFER_DIRECTION_IN, USBD_SHORT_TRANSFER_OK)
  TransferBufferLength = 0000003a
  TransferBuffer       = 00000000
  TransferBufferMDL    = 81cc56a8
    00000000: 00 00 00 34 00 0a 02 70 35 00 08 63 65 6c 69 71
    00000010: 76 61 70 00 00 06 00 02 00 00 04 f0 04 00 0b 00
    00000020: 03 00 00 01 00 00 05 02 00 01 00 00 04 00 00 00
    00000030: ed 00 41 00 00 01 00 00 42 01
  UrbLink              = 00000000
[309542 ms] UsbSnoop - DispatchAny(f88c6610) : IRP_MJ_INTERNAL_DEVICE_CONTROL
[309542 ms] UsbSnoop - MyDispatchInternalIOCTL(f88c7e80) : fdo=82142030, Irp=81b5d388, IRQL=2
[309542 ms]  >>>  URB 625 going down  >>> 
-- URB_FUNCTION_BULK_OR_INTERRUPT_TRANSFER:
  PipeHandle           = 81b44aec [endpoint 0x00000002]
  TransferFlags        = 00000000 (USBD_TRANSFER_DIRECTION_OUT, ~USBD_SHORT_TRANSFER_OK)
  TransferBufferLength = 00000007
  TransferBuffer       = 00000000
  TransferBufferMDL    = 81cc56a8
    00000000: 00 00 00 02 05 e0 00
  UrbLink              = 00000000
[309542 ms] UsbSnoop - MyInternalIOCTLCompletion(f88c7db0) : fido=823a0430, Irp=81b5d388, Context=822fb2d8, IRQL=2
[309542 ms]  <<<  URB 625 coming back  <<< 
-- URB_FUNCTION_BULK_OR_INTERRUPT_TRANSFER:
  PipeHandle           = 81b44aec [endpoint 0x00000002]
  TransferFlags        = 00000000 (USBD_TRANSFER_DIRECTION_OUT, ~USBD_SHORT_TRANSFER_OK)
  TransferBufferLength = 00000007
  TransferBuffer       = 00000000
  TransferBufferMDL    = 81cc56a8
  UrbLink              = 00000000
[309552 ms] UsbSnoop - DispatchAny(f88c6610) : IRP_MJ_INTERNAL_DEVICE_CONTROL
[309552 ms] UsbSnoop - MyDispatchInternalIOCTL(f88c7e80) : fdo=82142030, Irp=81b5d388, IRQL=2
[309552 ms]  >>>  URB 626 going down  >>> 
-- URB_FUNCTION_BULK_OR_INTERRUPT_TRANSFER:
  PipeHandle           = 81b44acc [endpoint 0x00000081]
  TransferFlags        = 00000003 (USBD_TRANSFER_DIRECTION_IN, USBD_SHORT_TRANSFER_OK)
  TransferBufferLength = 00000100
  TransferBuffer       = 00000000
  TransferBufferMDL    = 81cc56a8
  UrbLink              = 00000000
[309552 ms] UsbSnoop - MyInternalIOCTLCompletion(f88c7db0) : fido=823a0430, Irp=81b5d388, Context=81af1cb8, IRQL=2
[309552 ms]  <<<  URB 626 coming back  <<< 
-- URB_FUNCTION_BULK_OR_INTERRUPT_TRANSFER:
  PipeHandle           = 81b44acc [endpoint 0x00000081]
  TransferFlags        = 00000003 (USBD_TRANSFER_DIRECTION_IN, USBD_SHORT_TRANSFER_OK)
  TransferBufferLength = 00000005
  TransferBuffer       = 00000000
  TransferBufferMDL    = 81cc56a8
    00000000: 00 00 00 3a 04
  UrbLink              = 00000000
[309582 ms] UsbSnoop - DispatchAny(f88c6610) : IRP_MJ_INTERNAL_DEVICE_CONTROL
[309582 ms] UsbSnoop - MyDispatchInternalIOCTL(f88c7e80) : fdo=82142030, Irp=81b5d388, IRQL=2
[309582 ms]  >>>  URB 627 going down  >>> 
-- URB_FUNCTION_BULK_OR_INTERRUPT_TRANSFER:
  PipeHandle           = 81b44acc [endpoint 0x00000081]
  TransferFlags        = 00000003 (USBD_TRANSFER_DIRECTION_IN, USBD_SHORT_TRANSFER_OK)
  TransferBufferLength = 00000100
  TransferBuffer       = 00000000
  TransferBufferMDL    = 81cc56a8
  UrbLink              = 00000000
[309583 ms] UsbSnoop - MyInternalIOCTLCompletion(f88c7db0) : fido=823a0430, Irp=81b5d388, Context=8215da28, IRQL=2
[309583 ms]  <<<  URB 627 coming back  <<< 
-- URB_FUNCTION_BULK_OR_INTERRUPT_TRANSFER:
  PipeHandle           = 81b44acc [endpoint 0x00000081]
  TransferFlags        = 00000003 (USBD_TRANSFER_DIRECTION_IN, USBD_SHORT_TRANSFER_OK)
  TransferBufferLength = 0000003a
  TransferBuffer       = 00000000
  TransferBufferMDL    = 81cc56a8
    00000000: 00 00 00 34 00 0a 02 70 35 00 08 63 6f 65 66 66
    00000010: 63 61 6c 00 00 06 00 02 00 00 04 f0 04 00 0b 00
    00000020: 03 00 00 01 00 00 05 02 00 01 00 00 04 00 00 00
    00000030: f0 00 41 00 00 01 00 00 42 01
  UrbLink              = 00000000
[309613 ms] UsbSnoop - DispatchAny(f88c6610) : IRP_MJ_INTERNAL_DEVICE_CONTROL
[309613 ms] UsbSnoop - MyDispatchInternalIOCTL(f88c7e80) : fdo=82142030, Irp=81b5d388, IRQL=2
[309613 ms]  >>>  URB 628 going down  >>> 
-- URB_FUNCTION_BULK_OR_INTERRUPT_TRANSFER:
  PipeHandle           = 81b44aec [endpoint 0x00000002]
  TransferFlags        = 00000000 (USBD_TRANSFER_DIRECTION_OUT, ~USBD_SHORT_TRANSFER_OK)
  TransferBufferLength = 00000007
  TransferBuffer       = 00000000
  TransferBufferMDL    = 81cc56a8
    00000000: 00 00 00 02 05 e0 00
  UrbLink              = 00000000
[309613 ms] UsbSnoop - MyInternalIOCTLCompletion(f88c7db0) : fido=823a0430, Irp=81b5d388, Context=81af1cb8, IRQL=2
[309613 ms]  <<<  URB 628 coming back  <<< 
-- URB_FUNCTION_BULK_OR_INTERRUPT_TRANSFER:
  PipeHandle           = 81b44aec [endpoint 0x00000002]
  TransferFlags        = 00000000 (USBD_TRANSFER_DIRECTION_OUT, ~USBD_SHORT_TRANSFER_OK)
  TransferBufferLength = 00000007
  TransferBuffer       = 00000000
  TransferBufferMDL    = 81cc56a8
  UrbLink              = 00000000
[309622 ms] UsbSnoop - DispatchAny(f88c6610) : IRP_MJ_INTERNAL_DEVICE_CONTROL
[309622 ms] UsbSnoop - MyDispatchInternalIOCTL(f88c7e80) : fdo=82142030, Irp=81b5d388, IRQL=2
[309622 ms]  >>>  URB 629 going down  >>> 
-- URB_FUNCTION_BULK_OR_INTERRUPT_TRANSFER:
  PipeHandle           = 81b44acc [endpoint 0x00000081]
  TransferFlags        = 00000003 (USBD_TRANSFER_DIRECTION_IN, USBD_SHORT_TRANSFER_OK)
  TransferBufferLength = 00000100
  TransferBuffer       = 00000000
  TransferBufferMDL    = 81cc56a8
  UrbLink              = 00000000
[309622 ms] UsbSnoop - MyInternalIOCTLCompletion(f88c7db0) : fido=823a0430, Irp=81b5d388, Context=81ad5658, IRQL=2
[309622 ms]  <<<  URB 629 coming back  <<< 
-- URB_FUNCTION_BULK_OR_INTERRUPT_TRANSFER:
  PipeHandle           = 81b44acc [endpoint 0x00000081]
  TransferFlags        = 00000003 (USBD_TRANSFER_DIRECTION_IN, USBD_SHORT_TRANSFER_OK)
  TransferBufferLength = 00000005
  TransferBuffer       = 00000000
  TransferBufferMDL    = 81cc56a8
    00000000: 00 00 00 3a 04
  UrbLink              = 00000000
[309652 ms] UsbSnoop - DispatchAny(f88c6610) : IRP_MJ_INTERNAL_DEVICE_CONTROL
[309652 ms] UsbSnoop - MyDispatchInternalIOCTL(f88c7e80) : fdo=82142030, Irp=81b5d388, IRQL=2
[309652 ms]  >>>  URB 630 going down  >>> 
-- URB_FUNCTION_BULK_OR_INTERRUPT_TRANSFER:
  PipeHandle           = 81b44acc [endpoint 0x00000081]
  TransferFlags        = 00000003 (USBD_TRANSFER_DIRECTION_IN, USBD_SHORT_TRANSFER_OK)
  TransferBufferLength = 00000100
  TransferBuffer       = 00000000
  TransferBufferMDL    = 81cc56a8
  UrbLink              = 00000000
[309652 ms] UsbSnoop - MyInternalIOCTLCompletion(f88c7db0) : fido=823a0430, Irp=81b5d388, Context=81adbfe8, IRQL=2
[309652 ms]  <<<  URB 630 coming back  <<< 
-- URB_FUNCTION_BULK_OR_INTERRUPT_TRANSFER:
  PipeHandle           = 81b44acc [endpoint 0x00000081]
  TransferFlags        = 00000003 (USBD_TRANSFER_DIRECTION_IN, USBD_SHORT_TRANSFER_OK)
  TransferBufferLength = 0000003a
  TransferBuffer       = 00000000
  TransferBufferMDL    = 81cc56a8
    00000000: 00 00 00 34 00 0a 02 70 35 00 08 63 6f 6e 64 74
    00000010: 68 65 72 00 00 06 00 02 00 00 04 f0 04 00 0b 00
    00000020: 03 00 00 01 00 00 05 02 00 01 00 00 04 00 00 01
    00000030: de 00 41 00 00 01 00 00 42 01
  UrbLink              = 00000000
[309682 ms] UsbSnoop - DispatchAny(f88c6610) : IRP_MJ_INTERNAL_DEVICE_CONTROL
[309682 ms] UsbSnoop - MyDispatchInternalIOCTL(f88c7e80) : fdo=82142030, Irp=81b5d388, IRQL=2
[309682 ms]  >>>  URB 631 going down  >>> 
-- URB_FUNCTION_BULK_OR_INTERRUPT_TRANSFER:
  PipeHandle           = 81b44aec [endpoint 0x00000002]
  TransferFlags        = 00000000 (USBD_TRANSFER_DIRECTION_OUT, ~USBD_SHORT_TRANSFER_OK)
  TransferBufferLength = 00000007
  TransferBuffer       = 00000000
  TransferBufferMDL    = 81cc56a8
    00000000: 00 00 00 02 05 e0 00
  UrbLink              = 00000000
[309683 ms] UsbSnoop - MyInternalIOCTLCompletion(f88c7db0) : fido=823a0430, Irp=81b5d388, Context=81af1cb8, IRQL=2
[309683 ms]  <<<  URB 631 coming back  <<< 
-- URB_FUNCTION_BULK_OR_INTERRUPT_TRANSFER:
  PipeHandle           = 81b44aec [endpoint 0x00000002]
  TransferFlags        = 00000000 (USBD_TRANSFER_DIRECTION_OUT, ~USBD_SHORT_TRANSFER_OK)
  TransferBufferLength = 00000007
  TransferBuffer       = 00000000
  TransferBufferMDL    = 81cc56a8
  UrbLink              = 00000000
[309692 ms] UsbSnoop - DispatchAny(f88c6610) : IRP_MJ_INTERNAL_DEVICE_CONTROL
[309692 ms] UsbSnoop - MyDispatchInternalIOCTL(f88c7e80) : fdo=82142030, Irp=81b5d388, IRQL=2
[309692 ms]  >>>  URB 632 going down  >>> 
-- URB_FUNCTION_BULK_OR_INTERRUPT_TRANSFER:
  PipeHandle           = 81b44acc [endpoint 0x00000081]
  TransferFlags        = 00000003 (USBD_TRANSFER_DIRECTION_IN, USBD_SHORT_TRANSFER_OK)
  TransferBufferLength = 00000100
  TransferBuffer       = 00000000
  TransferBufferMDL    = 81cc56a8
  UrbLink              = 00000000
[309692 ms] UsbSnoop - MyInternalIOCTLCompletion(f88c7db0) : fido=823a0430, Irp=81b5d388, Context=81adbfe8, IRQL=2
[309693 ms]  <<<  URB 632 coming back  <<< 
-- URB_FUNCTION_BULK_OR_INTERRUPT_TRANSFER:
  PipeHandle           = 81b44acc [endpoint 0x00000081]
  TransferFlags        = 00000003 (USBD_TRANSFER_DIRECTION_IN, USBD_SHORT_TRANSFER_OK)
  TransferBufferLength = 00000005
  TransferBuffer       = 00000000
  TransferBufferMDL    = 81cc56a8
    00000000: 00 00 00 3a 04
  UrbLink              = 00000000
[309722 ms] UsbSnoop - DispatchAny(f88c6610) : IRP_MJ_INTERNAL_DEVICE_CONTROL
[309722 ms] UsbSnoop - MyDispatchInternalIOCTL(f88c7e80) : fdo=82142030, Irp=81b5d388, IRQL=2
[309722 ms]  >>>  URB 633 going down  >>> 
-- URB_FUNCTION_BULK_OR_INTERRUPT_TRANSFER:
  PipeHandle           = 81b44acc [endpoint 0x00000081]
  TransferFlags        = 00000003 (USBD_TRANSFER_DIRECTION_IN, USBD_SHORT_TRANSFER_OK)
  TransferBufferLength = 00000100
  TransferBuffer       = 00000000
  TransferBufferMDL    = 81cc56a8
  UrbLink              = 00000000
[309723 ms] UsbSnoop - MyInternalIOCTLCompletion(f88c7db0) : fido=823a0430, Irp=81b5d388, Context=81ad5658, IRQL=2
[309723 ms]  <<<  URB 633 coming back  <<< 
-- URB_FUNCTION_BULK_OR_INTERRUPT_TRANSFER:
  PipeHandle           = 81b44acc [endpoint 0x00000081]
  TransferFlags        = 00000003 (USBD_TRANSFER_DIRECTION_IN, USBD_SHORT_TRANSFER_OK)
  TransferBufferLength = 0000003a
  TransferBuffer       = 00000000
  TransferBufferMDL    = 81cc56a8
    00000000: 00 00 00 34 00 0a 02 70 35 00 08 63 70 64 69 70
    00000010: 68 61 73 00 00 06 00 02 00 00 04 f0 04 00 0b 00
    00000020: 03 00 00 01 00 00 05 02 00 01 00 00 04 00 00 00
    00000030: d2 00 41 00 00 01 00 00 42 01
  UrbLink              = 00000000
[309752 ms] UsbSnoop - DispatchAny(f88c6610) : IRP_MJ_INTERNAL_DEVICE_CONTROL
[309752 ms] UsbSnoop - MyDispatchInternalIOCTL(f88c7e80) : fdo=82142030, Irp=81b5d388, IRQL=2
[309752 ms]  >>>  URB 634 going down  >>> 
-- URB_FUNCTION_BULK_OR_INTERRUPT_TRANSFER:
  PipeHandle           = 81b44aec [endpoint 0x00000002]
  TransferFlags        = 00000000 (USBD_TRANSFER_DIRECTION_OUT, ~USBD_SHORT_TRANSFER_OK)
  TransferBufferLength = 00000007
  TransferBuffer       = 00000000
  TransferBufferMDL    = 81cc56a8
    00000000: 00 00 00 02 05 e0 00
  UrbLink              = 00000000
[309753 ms] UsbSnoop - MyInternalIOCTLCompletion(f88c7db0) : fido=823a0430, Irp=81b5d388, Context=81adbfe8, IRQL=2
[309753 ms]  <<<  URB 634 coming back  <<< 
-- URB_FUNCTION_BULK_OR_INTERRUPT_TRANSFER:
  PipeHandle           = 81b44aec [endpoint 0x00000002]
  TransferFlags        = 00000000 (USBD_TRANSFER_DIRECTION_OUT, ~USBD_SHORT_TRANSFER_OK)
  TransferBufferLength = 00000007
  TransferBuffer       = 00000000
  TransferBufferMDL    = 81cc56a8
  UrbLink              = 00000000
[309764 ms] UsbSnoop - DispatchAny(f88c6610) : IRP_MJ_INTERNAL_DEVICE_CONTROL
[309764 ms] UsbSnoop - MyDispatchInternalIOCTL(f88c7e80) : fdo=82142030, Irp=81b5d388, IRQL=2
[309764 ms]  >>>  URB 635 going down  >>> 
-- URB_FUNCTION_BULK_OR_INTERRUPT_TRANSFER:
  PipeHandle           = 81b44acc [endpoint 0x00000081]
  TransferFlags        = 00000003 (USBD_TRANSFER_DIRECTION_IN, USBD_SHORT_TRANSFER_OK)
  TransferBufferLength = 00000100
  TransferBuffer       = 00000000
  TransferBufferMDL    = 81cc56a8
  UrbLink              = 00000000
[309764 ms] UsbSnoop - MyInternalIOCTLCompletion(f88c7db0) : fido=823a0430, Irp=81b5d388, Context=81af1cb8, IRQL=2
[309764 ms]  <<<  URB 635 coming back  <<< 
-- URB_FUNCTION_BULK_OR_INTERRUPT_TRANSFER:
  PipeHandle           = 81b44acc [endpoint 0x00000081]
  TransferFlags        = 00000003 (USBD_TRANSFER_DIRECTION_IN, USBD_SHORT_TRANSFER_OK)
  TransferBufferLength = 00000005
  TransferBuffer       = 00000000
  TransferBufferMDL    = 81cc56a8
    00000000: 00 00 00 3a 04
  UrbLink              = 00000000
[309793 ms] UsbSnoop - DispatchAny(f88c6610) : IRP_MJ_INTERNAL_DEVICE_CONTROL
[309793 ms] UsbSnoop - MyDispatchInternalIOCTL(f88c7e80) : fdo=82142030, Irp=81b5d388, IRQL=2
[309793 ms]  >>>  URB 636 going down  >>> 
-- URB_FUNCTION_BULK_OR_INTERRUPT_TRANSFER:
  PipeHandle           = 81b44acc [endpoint 0x00000081]
  TransferFlags        = 00000003 (USBD_TRANSFER_DIRECTION_IN, USBD_SHORT_TRANSFER_OK)
  TransferBufferLength = 00000100
  TransferBuffer       = 00000000
  TransferBufferMDL    = 81cc56a8
  UrbLink              = 00000000
[309793 ms] UsbSnoop - MyInternalIOCTLCompletion(f88c7db0) : fido=823a0430, Irp=81b5d388, Context=8215da28, IRQL=2
[309793 ms]  <<<  URB 636 coming back  <<< 
-- URB_FUNCTION_BULK_OR_INTERRUPT_TRANSFER:
  PipeHandle           = 81b44acc [endpoint 0x00000081]
  TransferFlags        = 00000003 (USBD_TRANSFER_DIRECTION_IN, USBD_SHORT_TRANSFER_OK)
  TransferBufferLength = 0000003a
  TransferBuffer       = 00000000
  TransferBufferMDL    = 81cc56a8
    00000000: 00 00 00 34 00 0a 02 70 35 00 08 73 79 73 6f 75
    00000010: 76 65 72 00 00 06 00 02 00 00 04 f0 04 00 0b 00
    00000020: 03 00 00 01 00 00 05 02 00 01 00 00 04 00 00 01
    00000030: 06 00 41 00 00 01 00 00 42 01
  UrbLink              = 00000000
[309823 ms] UsbSnoop - DispatchAny(f88c6610) : IRP_MJ_INTERNAL_DEVICE_CONTROL
[309823 ms] UsbSnoop - MyDispatchInternalIOCTL(f88c7e80) : fdo=82142030, Irp=81b5d388, IRQL=2
[309823 ms]  >>>  URB 637 going down  >>> 
-- URB_FUNCTION_BULK_OR_INTERRUPT_TRANSFER:
  PipeHandle           = 81b44aec [endpoint 0x00000002]
  TransferFlags        = 00000000 (USBD_TRANSFER_DIRECTION_OUT, ~USBD_SHORT_TRANSFER_OK)
  TransferBufferLength = 00000007
  TransferBuffer       = 00000000
  TransferBufferMDL    = 81cc56a8
    00000000: 00 00 00 02 05 e0 00
  UrbLink              = 00000000
[309823 ms] UsbSnoop - MyInternalIOCTLCompletion(f88c7db0) : fido=823a0430, Irp=81b5d388, Context=81adbfe8, IRQL=2
[309823 ms]  <<<  URB 637 coming back  <<< 
-- URB_FUNCTION_BULK_OR_INTERRUPT_TRANSFER:
  PipeHandle           = 81b44aec [endpoint 0x00000002]
  TransferFlags        = 00000000 (USBD_TRANSFER_DIRECTION_OUT, ~USBD_SHORT_TRANSFER_OK)
  TransferBufferLength = 00000007
  TransferBuffer       = 00000000
  TransferBufferMDL    = 81cc56a8
  UrbLink              = 00000000
[309833 ms] UsbSnoop - DispatchAny(f88c6610) : IRP_MJ_INTERNAL_DEVICE_CONTROL
[309833 ms] UsbSnoop - MyDispatchInternalIOCTL(f88c7e80) : fdo=82142030, Irp=81b5d388, IRQL=2
[309833 ms]  >>>  URB 638 going down  >>> 
-- URB_FUNCTION_BULK_OR_INTERRUPT_TRANSFER:
  PipeHandle           = 81b44acc [endpoint 0x00000081]
  TransferFlags        = 00000003 (USBD_TRANSFER_DIRECTION_IN, USBD_SHORT_TRANSFER_OK)
  TransferBufferLength = 00000100
  TransferBuffer       = 00000000
  TransferBufferMDL    = 81cc56a8
  UrbLink              = 00000000
[309833 ms] UsbSnoop - MyInternalIOCTLCompletion(f88c7db0) : fido=823a0430, Irp=81b5d388, Context=822fb2d8, IRQL=2
[309833 ms]  <<<  URB 638 coming back  <<< 
-- URB_FUNCTION_BULK_OR_INTERRUPT_TRANSFER:
  PipeHandle           = 81b44acc [endpoint 0x00000081]
  TransferFlags        = 00000003 (USBD_TRANSFER_DIRECTION_IN, USBD_SHORT_TRANSFER_OK)
  TransferBufferLength = 00000005
  TransferBuffer       = 00000000
  TransferBufferMDL    = 81cc56a8
    00000000: 00 00 00 31 04
  UrbLink              = 00000000
[309863 ms] UsbSnoop - DispatchAny(f88c6610) : IRP_MJ_INTERNAL_DEVICE_CONTROL
[309863 ms] UsbSnoop - MyDispatchInternalIOCTL(f88c7e80) : fdo=82142030, Irp=81b5d388, IRQL=2
[309863 ms]  >>>  URB 639 going down  >>> 
-- URB_FUNCTION_BULK_OR_INTERRUPT_TRANSFER:
  PipeHandle           = 81b44acc [endpoint 0x00000081]
  TransferFlags        = 00000003 (USBD_TRANSFER_DIRECTION_IN, USBD_SHORT_TRANSFER_OK)
  TransferBufferLength = 00000100
  TransferBuffer       = 00000000
  TransferBufferMDL    = 81cc56a8
  UrbLink              = 00000000
[309864 ms] UsbSnoop - MyInternalIOCTLCompletion(f88c7db0) : fido=823a0430, Irp=81b5d388, Context=8215da28, IRQL=2
[309864 ms]  <<<  URB 639 coming back  <<< 
-- URB_FUNCTION_BULK_OR_INTERRUPT_TRANSFER:
  PipeHandle           = 81b44acc [endpoint 0x00000081]
  TransferFlags        = 00000003 (USBD_TRANSFER_DIRECTION_IN, USBD_SHORT_TRANSFER_OK)
  TransferBufferLength = 00000031
  TransferBuffer       = 00000000
  TransferBufferMDL    = 81cc56a8
    00000000: 00 00 00 2b 00 0a 02 70 36 00 00 00 06 00 02 00
    00000010: 00 04 f0 04 00 1f 00 03 00 00 01 00 00 05 02 00
    00000020: 01 00 00 04 00 00 00 0c 00 41 00 00 01 00 00 42
    00000030: 01
  UrbLink              = 00000000
[309893 ms] UsbSnoop - DispatchAny(f88c6610) : IRP_MJ_INTERNAL_DEVICE_CONTROL
[309893 ms] UsbSnoop - MyDispatchInternalIOCTL(f88c7e80) : fdo=82142030, Irp=81b5d388, IRQL=2
[309893 ms]  >>>  URB 640 going down  >>> 
-- URB_FUNCTION_BULK_OR_INTERRUPT_TRANSFER:
  PipeHandle           = 81b44aec [endpoint 0x00000002]
  TransferFlags        = 00000000 (USBD_TRANSFER_DIRECTION_OUT, ~USBD_SHORT_TRANSFER_OK)
  TransferBufferLength = 00000007
  TransferBuffer       = 00000000
  TransferBufferMDL    = 81cc56a8
    00000000: 00 00 00 02 05 e0 00
  UrbLink              = 00000000
[309893 ms] UsbSnoop - MyInternalIOCTLCompletion(f88c7db0) : fido=823a0430, Irp=81b5d388, Context=8215da28, IRQL=2
[309893 ms]  <<<  URB 640 coming back  <<< 
-- URB_FUNCTION_BULK_OR_INTERRUPT_TRANSFER:
  PipeHandle           = 81b44aec [endpoint 0x00000002]
  TransferFlags        = 00000000 (USBD_TRANSFER_DIRECTION_OUT, ~USBD_SHORT_TRANSFER_OK)
  TransferBufferLength = 00000007
  TransferBuffer       = 00000000
  TransferBufferMDL    = 81cc56a8
  UrbLink              = 00000000
[309903 ms] UsbSnoop - DispatchAny(f88c6610) : IRP_MJ_INTERNAL_DEVICE_CONTROL
[309903 ms] UsbSnoop - MyDispatchInternalIOCTL(f88c7e80) : fdo=82142030, Irp=81b5d388, IRQL=2
[309903 ms]  >>>  URB 641 going down  >>> 
-- URB_FUNCTION_BULK_OR_INTERRUPT_TRANSFER:
  PipeHandle           = 81b44acc [endpoint 0x00000081]
  TransferFlags        = 00000003 (USBD_TRANSFER_DIRECTION_IN, USBD_SHORT_TRANSFER_OK)
  TransferBufferLength = 00000100
  TransferBuffer       = 00000000
  TransferBufferMDL    = 81cc56a8
  UrbLink              = 00000000
[309903 ms] UsbSnoop - MyInternalIOCTLCompletion(f88c7db0) : fido=823a0430, Irp=81b5d388, Context=81c6cb60, IRQL=2
[309903 ms]  <<<  URB 641 coming back  <<< 
-- URB_FUNCTION_BULK_OR_INTERRUPT_TRANSFER:
  PipeHandle           = 81b44acc [endpoint 0x00000081]
  TransferFlags        = 00000003 (USBD_TRANSFER_DIRECTION_IN, USBD_SHORT_TRANSFER_OK)
  TransferBufferLength = 00000005
  TransferBuffer       = 00000000
  TransferBufferMDL    = 81cc56a8
    00000000: 00 00 00 3a 04
  UrbLink              = 00000000
[309933 ms] UsbSnoop - DispatchAny(f88c6610) : IRP_MJ_INTERNAL_DEVICE_CONTROL
[309933 ms] UsbSnoop - MyDispatchInternalIOCTL(f88c7e80) : fdo=82142030, Irp=81b5d388, IRQL=2
[309933 ms]  >>>  URB 642 going down  >>> 
-- URB_FUNCTION_BULK_OR_INTERRUPT_TRANSFER:
  PipeHandle           = 81b44acc [endpoint 0x00000081]
  TransferFlags        = 00000003 (USBD_TRANSFER_DIRECTION_IN, USBD_SHORT_TRANSFER_OK)
  TransferBufferLength = 00000100
  TransferBuffer       = 00000000
  TransferBufferMDL    = 81cc56a8
  UrbLink              = 00000000
[309933 ms] UsbSnoop - MyInternalIOCTLCompletion(f88c7db0) : fido=823a0430, Irp=81b5d388, Context=81af1cb8, IRQL=2
[309933 ms]  <<<  URB 642 coming back  <<< 
-- URB_FUNCTION_BULK_OR_INTERRUPT_TRANSFER:
  PipeHandle           = 81b44acc [endpoint 0x00000081]
  TransferFlags        = 00000003 (USBD_TRANSFER_DIRECTION_IN, USBD_SHORT_TRANSFER_OK)
  TransferBufferLength = 0000003a
  TransferBuffer       = 00000000
  TransferBufferMDL    = 81cc56a8
    00000000: 00 00 00 34 00 0a 02 70 36 00 08 64 79 6e 61 6d
    00000010: 69 71 75 00 00 06 00 02 00 00 04 f0 04 00 0b 00
    00000020: 03 00 00 01 00 00 05 02 00 01 00 00 04 00 00 00
    00000030: f4 00 41 00 00 01 00 00 42 01
  UrbLink              = 00000000
[309965 ms] UsbSnoop - DispatchAny(f88c6610) : IRP_MJ_INTERNAL_DEVICE_CONTROL
[309965 ms] UsbSnoop - MyDispatchInternalIOCTL(f88c7e80) : fdo=82142030, Irp=81b5d388, IRQL=2
[309965 ms]  >>>  URB 643 going down  >>> 
-- URB_FUNCTION_BULK_OR_INTERRUPT_TRANSFER:
  PipeHandle           = 81b44aec [endpoint 0x00000002]
  TransferFlags        = 00000000 (USBD_TRANSFER_DIRECTION_OUT, ~USBD_SHORT_TRANSFER_OK)
  TransferBufferLength = 00000007
  TransferBuffer       = 00000000
  TransferBufferMDL    = 81cc56a8
    00000000: 00 00 00 02 05 e0 00
  UrbLink              = 00000000
[309965 ms] UsbSnoop - MyInternalIOCTLCompletion(f88c7db0) : fido=823a0430, Irp=81b5d388, Context=81af3568, IRQL=2
[309965 ms]  <<<  URB 643 coming back  <<< 
-- URB_FUNCTION_BULK_OR_INTERRUPT_TRANSFER:
  PipeHandle           = 81b44aec [endpoint 0x00000002]
  TransferFlags        = 00000000 (USBD_TRANSFER_DIRECTION_OUT, ~USBD_SHORT_TRANSFER_OK)
  TransferBufferLength = 00000007
  TransferBuffer       = 00000000
  TransferBufferMDL    = 81cc56a8
  UrbLink              = 00000000
[309973 ms] UsbSnoop - DispatchAny(f88c6610) : IRP_MJ_INTERNAL_DEVICE_CONTROL
[309973 ms] UsbSnoop - MyDispatchInternalIOCTL(f88c7e80) : fdo=82142030, Irp=81b5d388, IRQL=2
[309973 ms]  >>>  URB 644 going down  >>> 
-- URB_FUNCTION_BULK_OR_INTERRUPT_TRANSFER:
  PipeHandle           = 81b44acc [endpoint 0x00000081]
  TransferFlags        = 00000003 (USBD_TRANSFER_DIRECTION_IN, USBD_SHORT_TRANSFER_OK)
  TransferBufferLength = 00000100
  TransferBuffer       = 00000000
  TransferBufferMDL    = 81cc56a8
  UrbLink              = 00000000
[309973 ms] UsbSnoop - MyInternalIOCTLCompletion(f88c7db0) : fido=823a0430, Irp=81b5d388, Context=81adbfe8, IRQL=2
[309973 ms]  <<<  URB 644 coming back  <<< 
-- URB_FUNCTION_BULK_OR_INTERRUPT_TRANSFER:
  PipeHandle           = 81b44acc [endpoint 0x00000081]
  TransferFlags        = 00000003 (USBD_TRANSFER_DIRECTION_IN, USBD_SHORT_TRANSFER_OK)
  TransferBufferLength = 00000005
  TransferBuffer       = 00000000
  TransferBufferMDL    = 81cc56a8
    00000000: 00 00 00 3a 04
  UrbLink              = 00000000
[310003 ms] UsbSnoop - DispatchAny(f88c6610) : IRP_MJ_INTERNAL_DEVICE_CONTROL
[310003 ms] UsbSnoop - MyDispatchInternalIOCTL(f88c7e80) : fdo=82142030, Irp=81b5d388, IRQL=2
[310003 ms]  >>>  URB 645 going down  >>> 
-- URB_FUNCTION_BULK_OR_INTERRUPT_TRANSFER:
  PipeHandle           = 81b44acc [endpoint 0x00000081]
  TransferFlags        = 00000003 (USBD_TRANSFER_DIRECTION_IN, USBD_SHORT_TRANSFER_OK)
  TransferBufferLength = 00000100
  TransferBuffer       = 00000000
  TransferBufferMDL    = 81cc56a8
  UrbLink              = 00000000
[310003 ms] UsbSnoop - MyInternalIOCTLCompletion(f88c7db0) : fido=823a0430, Irp=81b5d388, Context=81adbfe8, IRQL=2
[310003 ms]  <<<  URB 645 coming back  <<< 
-- URB_FUNCTION_BULK_OR_INTERRUPT_TRANSFER:
  PipeHandle           = 81b44acc [endpoint 0x00000081]
  TransferFlags        = 00000003 (USBD_TRANSFER_DIRECTION_IN, USBD_SHORT_TRANSFER_OK)
  TransferBufferLength = 0000003a
  TransferBuffer       = 00000000
  TransferBufferMDL    = 81cc56a8
    00000000: 00 00 00 34 00 0a 02 70 36 00 08 6d 65 63 61 66
    00000010: 6c 75 69 00 00 06 00 02 00 00 04 f0 04 00 0b 00
    00000020: 03 00 00 01 00 00 05 02 00 01 00 00 04 00 00 01
    00000030: 6c 00 41 00 00 01 00 00 42 01
  UrbLink              = 00000000
[310033 ms] UsbSnoop - DispatchAny(f88c6610) : IRP_MJ_INTERNAL_DEVICE_CONTROL
[310033 ms] UsbSnoop - MyDispatchInternalIOCTL(f88c7e80) : fdo=82142030, Irp=81b5d388, IRQL=2
[310033 ms]  >>>  URB 646 going down  >>> 
-- URB_FUNCTION_BULK_OR_INTERRUPT_TRANSFER:
  PipeHandle           = 81b44aec [endpoint 0x00000002]
  TransferFlags        = 00000000 (USBD_TRANSFER_DIRECTION_OUT, ~USBD_SHORT_TRANSFER_OK)
  TransferBufferLength = 00000007
  TransferBuffer       = 00000000
  TransferBufferMDL    = 81cc56a8
    00000000: 00 00 00 02 05 e0 00
  UrbLink              = 00000000
[310033 ms] UsbSnoop - MyInternalIOCTLCompletion(f88c7db0) : fido=823a0430, Irp=81b5d388, Context=81adbfe8, IRQL=2
[310033 ms]  <<<  URB 646 coming back  <<< 
-- URB_FUNCTION_BULK_OR_INTERRUPT_TRANSFER:
  PipeHandle           = 81b44aec [endpoint 0x00000002]
  TransferFlags        = 00000000 (USBD_TRANSFER_DIRECTION_OUT, ~USBD_SHORT_TRANSFER_OK)
  TransferBufferLength = 00000007
  TransferBuffer       = 00000000
  TransferBufferMDL    = 81cc56a8
  UrbLink              = 00000000
[310043 ms] UsbSnoop - DispatchAny(f88c6610) : IRP_MJ_INTERNAL_DEVICE_CONTROL
[310043 ms] UsbSnoop - MyDispatchInternalIOCTL(f88c7e80) : fdo=82142030, Irp=81b5d388, IRQL=2
[310043 ms]  >>>  URB 647 going down  >>> 
-- URB_FUNCTION_BULK_OR_INTERRUPT_TRANSFER:
  PipeHandle           = 81b44acc [endpoint 0x00000081]
  TransferFlags        = 00000003 (USBD_TRANSFER_DIRECTION_IN, USBD_SHORT_TRANSFER_OK)
  TransferBufferLength = 00000100
  TransferBuffer       = 00000000
  TransferBufferMDL    = 81cc56a8
  UrbLink              = 00000000
[310043 ms] UsbSnoop - MyInternalIOCTLCompletion(f88c7db0) : fido=823a0430, Irp=81b5d388, Context=822fb2d8, IRQL=2
[310043 ms]  <<<  URB 647 coming back  <<< 
-- URB_FUNCTION_BULK_OR_INTERRUPT_TRANSFER:
  PipeHandle           = 81b44acc [endpoint 0x00000081]
  TransferFlags        = 00000003 (USBD_TRANSFER_DIRECTION_IN, USBD_SHORT_TRANSFER_OK)
  TransferBufferLength = 00000005
  TransferBuffer       = 00000000
  TransferBufferMDL    = 81cc56a8
    00000000: 00 00 00 39 04
  UrbLink              = 00000000
[310073 ms] UsbSnoop - DispatchAny(f88c6610) : IRP_MJ_INTERNAL_DEVICE_CONTROL
[310073 ms] UsbSnoop - MyDispatchInternalIOCTL(f88c7e80) : fdo=82142030, Irp=81b5d388, IRQL=2
[310073 ms]  >>>  URB 648 going down  >>> 
-- URB_FUNCTION_BULK_OR_INTERRUPT_TRANSFER:
  PipeHandle           = 81b44acc [endpoint 0x00000081]
  TransferFlags        = 00000003 (USBD_TRANSFER_DIRECTION_IN, USBD_SHORT_TRANSFER_OK)
  TransferBufferLength = 00000100
  TransferBuffer       = 00000000
  TransferBufferMDL    = 81cc56a8
  UrbLink              = 00000000
[310073 ms] UsbSnoop - MyInternalIOCTLCompletion(f88c7db0) : fido=823a0430, Irp=81b5d388, Context=8215da28, IRQL=2
[310073 ms]  <<<  URB 648 coming back  <<< 
-- URB_FUNCTION_BULK_OR_INTERRUPT_TRANSFER:
  PipeHandle           = 81b44acc [endpoint 0x00000081]
  TransferFlags        = 00000003 (USBD_TRANSFER_DIRECTION_IN, USBD_SHORT_TRANSFER_OK)
  TransferBufferLength = 00000039
  TransferBuffer       = 00000000
  TransferBufferMDL    = 81cc56a8
    00000000: 00 00 00 33 00 0a 02 70 36 00 07 6d 65 63 61 70
    00000010: 74 32 00 00 06 00 02 00 00 04 f0 04 00 0b 00 03
    00000020: 00 00 01 00 00 05 02 00 01 00 00 04 00 00 00 b4
    00000030: 00 41 00 00 01 00 00 42 01
  UrbLink              = 00000000
[310103 ms] UsbSnoop - DispatchAny(f88c6610) : IRP_MJ_INTERNAL_DEVICE_CONTROL
[310103 ms] UsbSnoop - MyDispatchInternalIOCTL(f88c7e80) : fdo=82142030, Irp=81b5d388, IRQL=2
[310103 ms]  >>>  URB 649 going down  >>> 
-- URB_FUNCTION_BULK_OR_INTERRUPT_TRANSFER:
  PipeHandle           = 81b44aec [endpoint 0x00000002]
  TransferFlags        = 00000000 (USBD_TRANSFER_DIRECTION_OUT, ~USBD_SHORT_TRANSFER_OK)
  TransferBufferLength = 00000007
  TransferBuffer       = 00000000
  TransferBufferMDL    = 81cc56a8
    00000000: 00 00 00 02 05 e0 00
  UrbLink              = 00000000
[310103 ms] UsbSnoop - MyInternalIOCTLCompletion(f88c7db0) : fido=823a0430, Irp=81b5d388, Context=81af1cb8, IRQL=2
[310103 ms]  <<<  URB 649 coming back  <<< 
-- URB_FUNCTION_BULK_OR_INTERRUPT_TRANSFER:
  PipeHandle           = 81b44aec [endpoint 0x00000002]
  TransferFlags        = 00000000 (USBD_TRANSFER_DIRECTION_OUT, ~USBD_SHORT_TRANSFER_OK)
  TransferBufferLength = 00000007
  TransferBuffer       = 00000000
  TransferBufferMDL    = 81cc56a8
  UrbLink              = 00000000
[310114 ms] UsbSnoop - DispatchAny(f88c6610) : IRP_MJ_INTERNAL_DEVICE_CONTROL
[310114 ms] UsbSnoop - MyDispatchInternalIOCTL(f88c7e80) : fdo=82142030, Irp=81b5d388, IRQL=2
[310114 ms]  >>>  URB 650 going down  >>> 
-- URB_FUNCTION_BULK_OR_INTERRUPT_TRANSFER:
  PipeHandle           = 81b44acc [endpoint 0x00000081]
  TransferFlags        = 00000003 (USBD_TRANSFER_DIRECTION_IN, USBD_SHORT_TRANSFER_OK)
  TransferBufferLength = 00000100
  TransferBuffer       = 00000000
  TransferBufferMDL    = 81cc56a8
  UrbLink              = 00000000
[310114 ms] UsbSnoop - MyInternalIOCTLCompletion(f88c7db0) : fido=823a0430, Irp=81b5d388, Context=81af3568, IRQL=2
[310114 ms]  <<<  URB 650 coming back  <<< 
-- URB_FUNCTION_BULK_OR_INTERRUPT_TRANSFER:
  PipeHandle           = 81b44acc [endpoint 0x00000081]
  TransferFlags        = 00000003 (USBD_TRANSFER_DIRECTION_IN, USBD_SHORT_TRANSFER_OK)
  TransferBufferLength = 00000005
  TransferBuffer       = 00000000
  TransferBufferMDL    = 81cc56a8
    00000000: 00 00 00 3a 04
  UrbLink              = 00000000
[310143 ms] UsbSnoop - DispatchAny(f88c6610) : IRP_MJ_INTERNAL_DEVICE_CONTROL
[310143 ms] UsbSnoop - MyDispatchInternalIOCTL(f88c7e80) : fdo=82142030, Irp=81b5d388, IRQL=2
[310144 ms]  >>>  URB 651 going down  >>> 
-- URB_FUNCTION_BULK_OR_INTERRUPT_TRANSFER:
  PipeHandle           = 81b44acc [endpoint 0x00000081]
  TransferFlags        = 00000003 (USBD_TRANSFER_DIRECTION_IN, USBD_SHORT_TRANSFER_OK)
  TransferBufferLength = 00000100
  TransferBuffer       = 00000000
  TransferBufferMDL    = 81b6d910
  UrbLink              = 00000000
[310144 ms] UsbSnoop - MyInternalIOCTLCompletion(f88c7db0) : fido=823a0430, Irp=81b5d388, Context=81adbfe8, IRQL=2
[310144 ms]  <<<  URB 651 coming back  <<< 
-- URB_FUNCTION_BULK_OR_INTERRUPT_TRANSFER:
  PipeHandle           = 81b44acc [endpoint 0x00000081]
  TransferFlags        = 00000003 (USBD_TRANSFER_DIRECTION_IN, USBD_SHORT_TRANSFER_OK)
  TransferBufferLength = 0000003a
  TransferBuffer       = 00000000
  TransferBufferMDL    = 81b6d910
    00000000: 00 00 00 34 00 0a 02 70 36 00 08 6d 65 63 61 73
    00000010: 79 73 74 00 00 06 00 02 00 00 04 f0 04 00 0b 00
    00000020: 03 00 00 01 00 00 05 02 00 01 00 00 04 00 00 00
    00000030: a9 00 41 00 00 01 00 00 42 01
  UrbLink              = 00000000
[310173 ms] UsbSnoop - DispatchAny(f88c6610) : IRP_MJ_INTERNAL_DEVICE_CONTROL
[310173 ms] UsbSnoop - MyDispatchInternalIOCTL(f88c7e80) : fdo=82142030, Irp=81b5d388, IRQL=2
[310173 ms]  >>>  URB 652 going down  >>> 
-- URB_FUNCTION_BULK_OR_INTERRUPT_TRANSFER:
  PipeHandle           = 81b44aec [endpoint 0x00000002]
  TransferFlags        = 00000000 (USBD_TRANSFER_DIRECTION_OUT, ~USBD_SHORT_TRANSFER_OK)
  TransferBufferLength = 00000007
  TransferBuffer       = 00000000
  TransferBufferMDL    = 81cc56a8
    00000000: 00 00 00 02 05 e0 00
  UrbLink              = 00000000
[310173 ms] UsbSnoop - MyInternalIOCTLCompletion(f88c7db0) : fido=823a0430, Irp=81b5d388, Context=822fb2d8, IRQL=2
[310173 ms]  <<<  URB 652 coming back  <<< 
-- URB_FUNCTION_BULK_OR_INTERRUPT_TRANSFER:
  PipeHandle           = 81b44aec [endpoint 0x00000002]
  TransferFlags        = 00000000 (USBD_TRANSFER_DIRECTION_OUT, ~USBD_SHORT_TRANSFER_OK)
  TransferBufferLength = 00000007
  TransferBuffer       = 00000000
  TransferBufferMDL    = 81cc56a8
  UrbLink              = 00000000
[310185 ms] UsbSnoop - DispatchAny(f88c6610) : IRP_MJ_INTERNAL_DEVICE_CONTROL
[310185 ms] UsbSnoop - MyDispatchInternalIOCTL(f88c7e80) : fdo=82142030, Irp=81b5d388, IRQL=2
[310185 ms]  >>>  URB 653 going down  >>> 
-- URB_FUNCTION_BULK_OR_INTERRUPT_TRANSFER:
  PipeHandle           = 81b44acc [endpoint 0x00000081]
  TransferFlags        = 00000003 (USBD_TRANSFER_DIRECTION_IN, USBD_SHORT_TRANSFER_OK)
  TransferBufferLength = 00000100
  TransferBuffer       = 00000000
  TransferBufferMDL    = 8216a008
  UrbLink              = 00000000
[310185 ms] UsbSnoop - MyInternalIOCTLCompletion(f88c7db0) : fido=823a0430, Irp=81b5d388, Context=8215da28, IRQL=2
[310185 ms]  <<<  URB 653 coming back  <<< 
-- URB_FUNCTION_BULK_OR_INTERRUPT_TRANSFER:
  PipeHandle           = 81b44acc [endpoint 0x00000081]
  TransferFlags        = 00000003 (USBD_TRANSFER_DIRECTION_IN, USBD_SHORT_TRANSFER_OK)
  TransferBufferLength = 00000005
  TransferBuffer       = 00000000
  TransferBufferMDL    = 8216a008
    00000000: 00 00 00 31 04
  UrbLink              = 00000000
[310214 ms] UsbSnoop - DispatchAny(f88c6610) : IRP_MJ_INTERNAL_DEVICE_CONTROL
[310214 ms] UsbSnoop - MyDispatchInternalIOCTL(f88c7e80) : fdo=82142030, Irp=81b5d388, IRQL=2
[310214 ms]  >>>  URB 654 going down  >>> 
-- URB_FUNCTION_BULK_OR_INTERRUPT_TRANSFER:
  PipeHandle           = 81b44acc [endpoint 0x00000081]
  TransferFlags        = 00000003 (USBD_TRANSFER_DIRECTION_IN, USBD_SHORT_TRANSFER_OK)
  TransferBufferLength = 00000100
  TransferBuffer       = 00000000
  TransferBufferMDL    = 8216a008
  UrbLink              = 00000000
[310214 ms] UsbSnoop - MyInternalIOCTLCompletion(f88c7db0) : fido=823a0430, Irp=81b5d388, Context=81af1cb8, IRQL=2
[310214 ms]  <<<  URB 654 coming back  <<< 
-- URB_FUNCTION_BULK_OR_INTERRUPT_TRANSFER:
  PipeHandle           = 81b44acc [endpoint 0x00000081]
  TransferFlags        = 00000003 (USBD_TRANSFER_DIRECTION_IN, USBD_SHORT_TRANSFER_OK)
  TransferBufferLength = 00000031
  TransferBuffer       = 00000000
  TransferBufferMDL    = 8216a008
    00000000: 00 00 00 2b 00 0a 02 70 37 00 00 00 06 00 02 00
    00000010: 00 04 f0 04 00 1f 00 03 00 00 01 00 00 05 02 00
    00000020: 01 00 00 04 00 00 00 0c 00 41 00 00 01 00 00 42
    00000030: 01
  UrbLink              = 00000000
[310243 ms] UsbSnoop - DispatchAny(f88c6610) : IRP_MJ_INTERNAL_DEVICE_CONTROL
[310243 ms] UsbSnoop - MyDispatchInternalIOCTL(f88c7e80) : fdo=82142030, Irp=81b5d388, IRQL=2
[310243 ms]  >>>  URB 655 going down  >>> 
-- URB_FUNCTION_BULK_OR_INTERRUPT_TRANSFER:
  PipeHandle           = 81b44aec [endpoint 0x00000002]
  TransferFlags        = 00000000 (USBD_TRANSFER_DIRECTION_OUT, ~USBD_SHORT_TRANSFER_OK)
  TransferBufferLength = 00000007
  TransferBuffer       = 00000000
  TransferBufferMDL    = 8216a008
    00000000: 00 00 00 02 05 e0 00
  UrbLink              = 00000000
[310243 ms] UsbSnoop - MyInternalIOCTLCompletion(f88c7db0) : fido=823a0430, Irp=81b5d388, Context=822fb2d8, IRQL=2
[310243 ms]  <<<  URB 655 coming back  <<< 
-- URB_FUNCTION_BULK_OR_INTERRUPT_TRANSFER:
  PipeHandle           = 81b44aec [endpoint 0x00000002]
  TransferFlags        = 00000000 (USBD_TRANSFER_DIRECTION_OUT, ~USBD_SHORT_TRANSFER_OK)
  TransferBufferLength = 00000007
  TransferBuffer       = 00000000
  TransferBufferMDL    = 8216a008
  UrbLink              = 00000000
[310253 ms] UsbSnoop - DispatchAny(f88c6610) : IRP_MJ_INTERNAL_DEVICE_CONTROL
[310253 ms] UsbSnoop - MyDispatchInternalIOCTL(f88c7e80) : fdo=82142030, Irp=81b5d388, IRQL=2
[310253 ms]  >>>  URB 656 going down  >>> 
-- URB_FUNCTION_BULK_OR_INTERRUPT_TRANSFER:
  PipeHandle           = 81b44acc [endpoint 0x00000081]
  TransferFlags        = 00000003 (USBD_TRANSFER_DIRECTION_IN, USBD_SHORT_TRANSFER_OK)
  TransferBufferLength = 00000100
  TransferBuffer       = 00000000
  TransferBufferMDL    = 8216a008
  UrbLink              = 00000000
[310253 ms] UsbSnoop - MyInternalIOCTLCompletion(f88c7db0) : fido=823a0430, Irp=81b5d388, Context=81af1cb8, IRQL=2
[310253 ms]  <<<  URB 656 coming back  <<< 
-- URB_FUNCTION_BULK_OR_INTERRUPT_TRANSFER:
  PipeHandle           = 81b44acc [endpoint 0x00000081]
  TransferFlags        = 00000003 (USBD_TRANSFER_DIRECTION_IN, USBD_SHORT_TRANSFER_OK)
  TransferBufferLength = 00000005
  TransferBuffer       = 00000000
  TransferBufferMDL    = 8216a008
    00000000: 00 00 00 3a 04
  UrbLink              = 00000000
[310283 ms] UsbSnoop - DispatchAny(f88c6610) : IRP_MJ_INTERNAL_DEVICE_CONTROL
[310283 ms] UsbSnoop - MyDispatchInternalIOCTL(f88c7e80) : fdo=82142030, Irp=81b5d388, IRQL=2
[310284 ms]  >>>  URB 657 going down  >>> 
-- URB_FUNCTION_BULK_OR_INTERRUPT_TRANSFER:
  PipeHandle           = 81b44acc [endpoint 0x00000081]
  TransferFlags        = 00000003 (USBD_TRANSFER_DIRECTION_IN, USBD_SHORT_TRANSFER_OK)
  TransferBufferLength = 00000100
  TransferBuffer       = 00000000
  TransferBufferMDL    = 8216a008
  UrbLink              = 00000000
[310284 ms] UsbSnoop - MyInternalIOCTLCompletion(f88c7db0) : fido=823a0430, Irp=81b5d388, Context=8215da28, IRQL=2
[310284 ms]  <<<  URB 657 coming back  <<< 
-- URB_FUNCTION_BULK_OR_INTERRUPT_TRANSFER:
  PipeHandle           = 81b44acc [endpoint 0x00000081]
  TransferFlags        = 00000003 (USBD_TRANSFER_DIRECTION_IN, USBD_SHORT_TRANSFER_OK)
  TransferBufferLength = 0000003a
  TransferBuffer       = 00000000
  TransferBufferMDL    = 8216a008
    00000000: 00 00 00 34 00 0a 02 70 37 00 08 63 68 70 65 6c
    00000010: 65 63 74 00 00 06 00 02 00 00 04 f0 04 00 0b 00
    00000020: 03 00 00 01 00 00 05 02 00 01 00 00 04 00 00 00
    00000030: ae 00 41 00 00 01 00 00 42 01
  UrbLink              = 00000000
[310314 ms] UsbSnoop - DispatchAny(f88c6610) : IRP_MJ_INTERNAL_DEVICE_CONTROL
[310314 ms] UsbSnoop - MyDispatchInternalIOCTL(f88c7e80) : fdo=82142030, Irp=81b5d388, IRQL=2
[310314 ms]  >>>  URB 658 going down  >>> 
-- URB_FUNCTION_BULK_OR_INTERRUPT_TRANSFER:
  PipeHandle           = 81b44aec [endpoint 0x00000002]
  TransferFlags        = 00000000 (USBD_TRANSFER_DIRECTION_OUT, ~USBD_SHORT_TRANSFER_OK)
  TransferBufferLength = 00000007
  TransferBuffer       = 00000000
  TransferBufferMDL    = 8216a008
    00000000: 00 00 00 02 05 e0 00
  UrbLink              = 00000000
[310314 ms] UsbSnoop - MyInternalIOCTLCompletion(f88c7db0) : fido=823a0430, Irp=81b5d388, Context=81af1cb8, IRQL=2
[310314 ms]  <<<  URB 658 coming back  <<< 
-- URB_FUNCTION_BULK_OR_INTERRUPT_TRANSFER:
  PipeHandle           = 81b44aec [endpoint 0x00000002]
  TransferFlags        = 00000000 (USBD_TRANSFER_DIRECTION_OUT, ~USBD_SHORT_TRANSFER_OK)
  TransferBufferLength = 00000007
  TransferBuffer       = 00000000
  TransferBufferMDL    = 8216a008
  UrbLink              = 00000000
[310323 ms] UsbSnoop - DispatchAny(f88c6610) : IRP_MJ_INTERNAL_DEVICE_CONTROL
[310323 ms] UsbSnoop - MyDispatchInternalIOCTL(f88c7e80) : fdo=82142030, Irp=81b5d388, IRQL=2
[310323 ms]  >>>  URB 659 going down  >>> 
-- URB_FUNCTION_BULK_OR_INTERRUPT_TRANSFER:
  PipeHandle           = 81b44acc [endpoint 0x00000081]
  TransferFlags        = 00000003 (USBD_TRANSFER_DIRECTION_IN, USBD_SHORT_TRANSFER_OK)
  TransferBufferLength = 00000100
  TransferBuffer       = 00000000
  TransferBufferMDL    = 8216a008
  UrbLink              = 00000000
[310324 ms] UsbSnoop - MyInternalIOCTLCompletion(f88c7db0) : fido=823a0430, Irp=81b5d388, Context=81adbfe8, IRQL=2
[310324 ms]  <<<  URB 659 coming back  <<< 
-- URB_FUNCTION_BULK_OR_INTERRUPT_TRANSFER:
  PipeHandle           = 81b44acc [endpoint 0x00000081]
  TransferFlags        = 00000003 (USBD_TRANSFER_DIRECTION_IN, USBD_SHORT_TRANSFER_OK)
  TransferBufferLength = 00000005
  TransferBuffer       = 00000000
  TransferBufferMDL    = 8216a008
    00000000: 00 00 00 3a 04
  UrbLink              = 00000000
[310424 ms] UsbSnoop - DispatchAny(f88c6610) : IRP_MJ_INTERNAL_DEVICE_CONTROL
[310424 ms] UsbSnoop - MyDispatchInternalIOCTL(f88c7e80) : fdo=82142030, Irp=81b5d388, IRQL=2
[310424 ms]  >>>  URB 660 going down  >>> 
-- URB_FUNCTION_BULK_OR_INTERRUPT_TRANSFER:
  PipeHandle           = 81b44acc [endpoint 0x00000081]
  TransferFlags        = 00000003 (USBD_TRANSFER_DIRECTION_IN, USBD_SHORT_TRANSFER_OK)
  TransferBufferLength = 00000100
  TransferBuffer       = 00000000
  TransferBufferMDL    = 8216a008
  UrbLink              = 00000000
[310424 ms] UsbSnoop - MyInternalIOCTLCompletion(f88c7db0) : fido=823a0430, Irp=81b5d388, Context=8215da28, IRQL=2
[310424 ms]  <<<  URB 660 coming back  <<< 
-- URB_FUNCTION_BULK_OR_INTERRUPT_TRANSFER:
  PipeHandle           = 81b44acc [endpoint 0x00000081]
  TransferFlags        = 00000003 (USBD_TRANSFER_DIRECTION_IN, USBD_SHORT_TRANSFER_OK)
  TransferBufferLength = 0000003a
  TransferBuffer       = 00000000
  TransferBufferMDL    = 8216a008
    00000000: 00 00 00 34 00 0a 02 70 37 00 08 66 6f 72 63 65
    00000010: 6d 61 67 00 00 06 00 02 00 00 04 f0 04 00 0b 00
    00000020: 03 00 00 01 00 00 05 02 00 01 00 00 04 00 00 00
    00000030: 91 00 41 00 00 01 00 00 42 01
  UrbLink              = 00000000
[310454 ms] UsbSnoop - DispatchAny(f88c6610) : IRP_MJ_INTERNAL_DEVICE_CONTROL
[310454 ms] UsbSnoop - MyDispatchInternalIOCTL(f88c7e80) : fdo=82142030, Irp=81b5d388, IRQL=2
[310454 ms]  >>>  URB 661 going down  >>> 
-- URB_FUNCTION_BULK_OR_INTERRUPT_TRANSFER:
  PipeHandle           = 81b44aec [endpoint 0x00000002]
  TransferFlags        = 00000000 (USBD_TRANSFER_DIRECTION_OUT, ~USBD_SHORT_TRANSFER_OK)
  TransferBufferLength = 00000007
  TransferBuffer       = 00000000
  TransferBufferMDL    = 8216a008
    00000000: 00 00 00 02 05 e0 00
  UrbLink              = 00000000
[310454 ms] UsbSnoop - MyInternalIOCTLCompletion(f88c7db0) : fido=823a0430, Irp=81b5d388, Context=81c6cb60, IRQL=2
[310454 ms]  <<<  URB 661 coming back  <<< 
-- URB_FUNCTION_BULK_OR_INTERRUPT_TRANSFER:
  PipeHandle           = 81b44aec [endpoint 0x00000002]
  TransferFlags        = 00000000 (USBD_TRANSFER_DIRECTION_OUT, ~USBD_SHORT_TRANSFER_OK)
  TransferBufferLength = 00000007
  TransferBuffer       = 00000000
  TransferBufferMDL    = 8216a008
  UrbLink              = 00000000
[310465 ms] UsbSnoop - DispatchAny(f88c6610) : IRP_MJ_INTERNAL_DEVICE_CONTROL
[310465 ms] UsbSnoop - MyDispatchInternalIOCTL(f88c7e80) : fdo=82142030, Irp=81b5d388, IRQL=2
[310465 ms]  >>>  URB 662 going down  >>> 
-- URB_FUNCTION_BULK_OR_INTERRUPT_TRANSFER:
  PipeHandle           = 81b44acc [endpoint 0x00000081]
  TransferFlags        = 00000003 (USBD_TRANSFER_DIRECTION_IN, USBD_SHORT_TRANSFER_OK)
  TransferBufferLength = 00000100
  TransferBuffer       = 00000000
  TransferBufferMDL    = 8216a008
  UrbLink              = 00000000
[310465 ms] UsbSnoop - MyInternalIOCTLCompletion(f88c7db0) : fido=823a0430, Irp=81b5d388, Context=8215da28, IRQL=2
[310465 ms]  <<<  URB 662 coming back  <<< 
-- URB_FUNCTION_BULK_OR_INTERRUPT_TRANSFER:
  PipeHandle           = 81b44acc [endpoint 0x00000081]
  TransferFlags        = 00000003 (USBD_TRANSFER_DIRECTION_IN, USBD_SHORT_TRANSFER_OK)
  TransferBufferLength = 00000005
  TransferBuffer       = 00000000
  TransferBufferMDL    = 8216a008
    00000000: 00 00 00 3a 04
  UrbLink              = 00000000
[310494 ms] UsbSnoop - DispatchAny(f88c6610) : IRP_MJ_INTERNAL_DEVICE_CONTROL
[310494 ms] UsbSnoop - MyDispatchInternalIOCTL(f88c7e80) : fdo=82142030, Irp=81b5d388, IRQL=2
[310494 ms]  >>>  URB 663 going down  >>> 
-- URB_FUNCTION_BULK_OR_INTERRUPT_TRANSFER:
  PipeHandle           = 81b44acc [endpoint 0x00000081]
  TransferFlags        = 00000003 (USBD_TRANSFER_DIRECTION_IN, USBD_SHORT_TRANSFER_OK)
  TransferBufferLength = 00000100
  TransferBuffer       = 00000000
  TransferBufferMDL    = 8216a008
  UrbLink              = 00000000
[310494 ms] UsbSnoop - MyInternalIOCTLCompletion(f88c7db0) : fido=823a0430, Irp=81b5d388, Context=81af1cb8, IRQL=2
[310494 ms]  <<<  URB 663 coming back  <<< 
-- URB_FUNCTION_BULK_OR_INTERRUPT_TRANSFER:
  PipeHandle           = 81b44acc [endpoint 0x00000081]
  TransferFlags        = 00000003 (USBD_TRANSFER_DIRECTION_IN, USBD_SHORT_TRANSFER_OK)
  TransferBufferLength = 0000003a
  TransferBuffer       = 00000000
  TransferBufferMDL    = 8216a008
    00000000: 00 00 00 34 00 0a 02 70 37 00 08 69 6e 64 75 63
    00000010: 74 69 6f 00 00 06 00 02 00 00 04 f0 04 00 0b 00
    00000020: 03 00 00 01 00 00 05 02 00 01 00 00 04 00 00 01
    00000030: 81 00 41 00 00 01 00 00 42 01
  UrbLink              = 00000000
[310524 ms] UsbSnoop - DispatchAny(f88c6610) : IRP_MJ_INTERNAL_DEVICE_CONTROL
[310524 ms] UsbSnoop - MyDispatchInternalIOCTL(f88c7e80) : fdo=82142030, Irp=81b5d388, IRQL=2
[310524 ms]  >>>  URB 664 going down  >>> 
-- URB_FUNCTION_BULK_OR_INTERRUPT_TRANSFER:
  PipeHandle           = 81b44aec [endpoint 0x00000002]
  TransferFlags        = 00000000 (USBD_TRANSFER_DIRECTION_OUT, ~USBD_SHORT_TRANSFER_OK)
  TransferBufferLength = 00000007
  TransferBuffer       = 00000000
  TransferBufferMDL    = 8216a008
    00000000: 00 00 00 02 05 e0 00
  UrbLink              = 00000000
[310524 ms] UsbSnoop - MyInternalIOCTLCompletion(f88c7db0) : fido=823a0430, Irp=81b5d388, Context=822fb2d8, IRQL=2
[310524 ms]  <<<  URB 664 coming back  <<< 
-- URB_FUNCTION_BULK_OR_INTERRUPT_TRANSFER:
  PipeHandle           = 81b44aec [endpoint 0x00000002]
  TransferFlags        = 00000000 (USBD_TRANSFER_DIRECTION_OUT, ~USBD_SHORT_TRANSFER_OK)
  TransferBufferLength = 00000007
  TransferBuffer       = 00000000
  TransferBufferMDL    = 8216a008
  UrbLink              = 00000000
[310534 ms] UsbSnoop - DispatchAny(f88c6610) : IRP_MJ_INTERNAL_DEVICE_CONTROL
[310534 ms] UsbSnoop - MyDispatchInternalIOCTL(f88c7e80) : fdo=82142030, Irp=81b5d388, IRQL=2
[310534 ms]  >>>  URB 665 going down  >>> 
-- URB_FUNCTION_BULK_OR_INTERRUPT_TRANSFER:
  PipeHandle           = 81b44acc [endpoint 0x00000081]
  TransferFlags        = 00000003 (USBD_TRANSFER_DIRECTION_IN, USBD_SHORT_TRANSFER_OK)
  TransferBufferLength = 00000100
  TransferBuffer       = 00000000
  TransferBufferMDL    = 8216a008
  UrbLink              = 00000000
[310534 ms] UsbSnoop - MyInternalIOCTLCompletion(f88c7db0) : fido=823a0430, Irp=81b5d388, Context=81af1cb8, IRQL=2
[310534 ms]  <<<  URB 665 coming back  <<< 
-- URB_FUNCTION_BULK_OR_INTERRUPT_TRANSFER:
  PipeHandle           = 81b44acc [endpoint 0x00000081]
  TransferFlags        = 00000003 (USBD_TRANSFER_DIRECTION_IN, USBD_SHORT_TRANSFER_OK)
  TransferBufferLength = 00000005
  TransferBuffer       = 00000000
  TransferBufferMDL    = 8216a008
    00000000: 00 00 00 3a 04
  UrbLink              = 00000000
[310564 ms] UsbSnoop - DispatchAny(f88c6610) : IRP_MJ_INTERNAL_DEVICE_CONTROL
[310564 ms] UsbSnoop - MyDispatchInternalIOCTL(f88c7e80) : fdo=82142030, Irp=81b5d388, IRQL=2
[310565 ms]  >>>  URB 666 going down  >>> 
-- URB_FUNCTION_BULK_OR_INTERRUPT_TRANSFER:
  PipeHandle           = 81b44acc [endpoint 0x00000081]
  TransferFlags        = 00000003 (USBD_TRANSFER_DIRECTION_IN, USBD_SHORT_TRANSFER_OK)
  TransferBufferLength = 00000100
  TransferBuffer       = 00000000
  TransferBufferMDL    = 8216a008
  UrbLink              = 00000000
[310565 ms] UsbSnoop - MyInternalIOCTLCompletion(f88c7db0) : fido=823a0430, Irp=81b5d388, Context=81c6cb60, IRQL=2
[310565 ms]  <<<  URB 666 coming back  <<< 
-- URB_FUNCTION_BULK_OR_INTERRUPT_TRANSFER:
  PipeHandle           = 81b44acc [endpoint 0x00000081]
  TransferFlags        = 00000003 (USBD_TRANSFER_DIRECTION_IN, USBD_SHORT_TRANSFER_OK)
  TransferBufferLength = 0000003a
  TransferBuffer       = 00000000
  TransferBufferMDL    = 8216a008
    00000000: 00 00 00 34 00 0a 02 70 37 00 08 6d 61 67 6e 65
    00000010: 74 6f 73 00 00 06 00 02 00 00 04 f0 04 00 0b 00
    00000020: 03 00 00 01 00 00 05 02 00 01 00 00 04 00 00 00
    00000030: c6 00 41 00 00 01 00 00 42 01
  UrbLink              = 00000000
[310594 ms] UsbSnoop - DispatchAny(f88c6610) : IRP_MJ_INTERNAL_DEVICE_CONTROL
[310594 ms] UsbSnoop - MyDispatchInternalIOCTL(f88c7e80) : fdo=82142030, Irp=81b5d388, IRQL=2
[310594 ms]  >>>  URB 667 going down  >>> 
-- URB_FUNCTION_BULK_OR_INTERRUPT_TRANSFER:
  PipeHandle           = 81b44aec [endpoint 0x00000002]
  TransferFlags        = 00000000 (USBD_TRANSFER_DIRECTION_OUT, ~USBD_SHORT_TRANSFER_OK)
  TransferBufferLength = 00000007
  TransferBuffer       = 00000000
  TransferBufferMDL    = 8216a008
    00000000: 00 00 00 02 05 e0 00
  UrbLink              = 00000000
[310594 ms] UsbSnoop - MyInternalIOCTLCompletion(f88c7db0) : fido=823a0430, Irp=81b5d388, Context=81af1cb8, IRQL=2
[310594 ms]  <<<  URB 667 coming back  <<< 
-- URB_FUNCTION_BULK_OR_INTERRUPT_TRANSFER:
  PipeHandle           = 81b44aec [endpoint 0x00000002]
  TransferFlags        = 00000000 (USBD_TRANSFER_DIRECTION_OUT, ~USBD_SHORT_TRANSFER_OK)
  TransferBufferLength = 00000007
  TransferBuffer       = 00000000
  TransferBufferMDL    = 8216a008
  UrbLink              = 00000000
[310604 ms] UsbSnoop - DispatchAny(f88c6610) : IRP_MJ_INTERNAL_DEVICE_CONTROL
[310604 ms] UsbSnoop - MyDispatchInternalIOCTL(f88c7e80) : fdo=82142030, Irp=81b5d388, IRQL=2
[310604 ms]  >>>  URB 668 going down  >>> 
-- URB_FUNCTION_BULK_OR_INTERRUPT_TRANSFER:
  PipeHandle           = 81b44acc [endpoint 0x00000081]
  TransferFlags        = 00000003 (USBD_TRANSFER_DIRECTION_IN, USBD_SHORT_TRANSFER_OK)
  TransferBufferLength = 00000100
  TransferBuffer       = 00000000
  TransferBufferMDL    = 8216a008
  UrbLink              = 00000000
[310604 ms] UsbSnoop - MyInternalIOCTLCompletion(f88c7db0) : fido=823a0430, Irp=81b5d388, Context=81af3568, IRQL=2
[310604 ms]  <<<  URB 668 coming back  <<< 
-- URB_FUNCTION_BULK_OR_INTERRUPT_TRANSFER:
  PipeHandle           = 81b44acc [endpoint 0x00000081]
  TransferFlags        = 00000003 (USBD_TRANSFER_DIRECTION_IN, USBD_SHORT_TRANSFER_OK)
  TransferBufferLength = 00000005
  TransferBuffer       = 00000000
  TransferBufferMDL    = 8216a008
    00000000: 00 00 00 39 04
  UrbLink              = 00000000
[310634 ms] UsbSnoop - DispatchAny(f88c6610) : IRP_MJ_INTERNAL_DEVICE_CONTROL
[310634 ms] UsbSnoop - MyDispatchInternalIOCTL(f88c7e80) : fdo=82142030, Irp=81b5d388, IRQL=2
[310634 ms]  >>>  URB 669 going down  >>> 
-- URB_FUNCTION_BULK_OR_INTERRUPT_TRANSFER:
  PipeHandle           = 81b44acc [endpoint 0x00000081]
  TransferFlags        = 00000003 (USBD_TRANSFER_DIRECTION_IN, USBD_SHORT_TRANSFER_OK)
  TransferBufferLength = 00000100
  TransferBuffer       = 00000000
  TransferBufferMDL    = 8216a008
  UrbLink              = 00000000
[310634 ms] UsbSnoop - MyInternalIOCTLCompletion(f88c7db0) : fido=823a0430, Irp=81b5d388, Context=81c6cb60, IRQL=2
[310634 ms]  <<<  URB 669 coming back  <<< 
-- URB_FUNCTION_BULK_OR_INTERRUPT_TRANSFER:
  PipeHandle           = 81b44acc [endpoint 0x00000081]
  TransferFlags        = 00000003 (USBD_TRANSFER_DIRECTION_IN, USBD_SHORT_TRANSFER_OK)
  TransferBufferLength = 00000039
  TransferBuffer       = 00000000
  TransferBufferMDL    = 8216a008
    00000000: 00 00 00 33 00 0a 02 70 37 00 07 6d 61 78 77 65
    00000010: 6c 6c 00 00 06 00 02 00 00 04 f0 04 00 0b 00 03
    00000020: 00 00 01 00 00 05 02 00 01 00 00 04 00 00 01 55
    00000030: 00 41 00 00 01 00 00 42 01
  UrbLink              = 00000000
[310665 ms] UsbSnoop - DispatchAny(f88c6610) : IRP_MJ_INTERNAL_DEVICE_CONTROL
[310665 ms] UsbSnoop - MyDispatchInternalIOCTL(f88c7e80) : fdo=82142030, Irp=81b5d388, IRQL=2
[310665 ms]  >>>  URB 670 going down  >>> 
-- URB_FUNCTION_BULK_OR_INTERRUPT_TRANSFER:
  PipeHandle           = 81b44aec [endpoint 0x00000002]
  TransferFlags        = 00000000 (USBD_TRANSFER_DIRECTION_OUT, ~USBD_SHORT_TRANSFER_OK)
  TransferBufferLength = 00000007
  TransferBuffer       = 00000000
  TransferBufferMDL    = 8216a008
    00000000: 00 00 00 02 05 e0 00
  UrbLink              = 00000000
[310665 ms] UsbSnoop - MyInternalIOCTLCompletion(f88c7db0) : fido=823a0430, Irp=81b5d388, Context=81af3568, IRQL=2
[310665 ms]  <<<  URB 670 coming back  <<< 
-- URB_FUNCTION_BULK_OR_INTERRUPT_TRANSFER:
  PipeHandle           = 81b44aec [endpoint 0x00000002]
  TransferFlags        = 00000000 (USBD_TRANSFER_DIRECTION_OUT, ~USBD_SHORT_TRANSFER_OK)
  TransferBufferLength = 00000007
  TransferBuffer       = 00000000
  TransferBufferMDL    = 8216a008
  UrbLink              = 00000000
[310674 ms] UsbSnoop - DispatchAny(f88c6610) : IRP_MJ_INTERNAL_DEVICE_CONTROL
[310674 ms] UsbSnoop - MyDispatchInternalIOCTL(f88c7e80) : fdo=82142030, Irp=81b5d388, IRQL=2
[310674 ms]  >>>  URB 671 going down  >>> 
-- URB_FUNCTION_BULK_OR_INTERRUPT_TRANSFER:
  PipeHandle           = 81b44acc [endpoint 0x00000081]
  TransferFlags        = 00000003 (USBD_TRANSFER_DIRECTION_IN, USBD_SHORT_TRANSFER_OK)
  TransferBufferLength = 00000100
  TransferBuffer       = 00000000
  TransferBufferMDL    = 8216a008
  UrbLink              = 00000000
[310674 ms] UsbSnoop - MyInternalIOCTLCompletion(f88c7db0) : fido=823a0430, Irp=81b5d388, Context=8215da28, IRQL=2
[310674 ms]  <<<  URB 671 coming back  <<< 
-- URB_FUNCTION_BULK_OR_INTERRUPT_TRANSFER:
  PipeHandle           = 81b44acc [endpoint 0x00000081]
  TransferFlags        = 00000003 (USBD_TRANSFER_DIRECTION_IN, USBD_SHORT_TRANSFER_OK)
  TransferBufferLength = 00000005
  TransferBuffer       = 00000000
  TransferBufferMDL    = 8216a008
    00000000: 00 00 00 35 04
  UrbLink              = 00000000
[310704 ms] UsbSnoop - DispatchAny(f88c6610) : IRP_MJ_INTERNAL_DEVICE_CONTROL
[310704 ms] UsbSnoop - MyDispatchInternalIOCTL(f88c7e80) : fdo=82142030, Irp=81b5d388, IRQL=2
[310704 ms]  >>>  URB 672 going down  >>> 
-- URB_FUNCTION_BULK_OR_INTERRUPT_TRANSFER:
  PipeHandle           = 81b44acc [endpoint 0x00000081]
  TransferFlags        = 00000003 (USBD_TRANSFER_DIRECTION_IN, USBD_SHORT_TRANSFER_OK)
  TransferBufferLength = 00000100
  TransferBuffer       = 00000000
  TransferBufferMDL    = 8216a008
  UrbLink              = 00000000
[310704 ms] UsbSnoop - MyInternalIOCTLCompletion(f88c7db0) : fido=823a0430, Irp=81b5d388, Context=81c6cb60, IRQL=2
[310704 ms]  <<<  URB 672 coming back  <<< 
-- URB_FUNCTION_BULK_OR_INTERRUPT_TRANSFER:
  PipeHandle           = 81b44acc [endpoint 0x00000081]
  TransferFlags        = 00000003 (USBD_TRANSFER_DIRECTION_IN, USBD_SHORT_TRANSFER_OK)
  TransferBufferLength = 00000035
  TransferBuffer       = 00000000
  TransferBufferMDL    = 8216a008
    00000000: 00 00 00 2f 00 0a 02 70 37 00 03 6f 65 6d 00 00
    00000010: 06 00 02 00 00 04 f0 04 00 0b 00 03 00 00 01 00
    00000020: 00 05 02 00 01 00 00 04 00 00 01 20 00 41 00 00
    00000030: 01 00 00 42 01
  UrbLink              = 00000000
[310734 ms] UsbSnoop - DispatchAny(f88c6610) : IRP_MJ_INTERNAL_DEVICE_CONTROL
[310734 ms] UsbSnoop - MyDispatchInternalIOCTL(f88c7e80) : fdo=82142030, Irp=81b5d388, IRQL=2
[310734 ms]  >>>  URB 673 going down  >>> 
-- URB_FUNCTION_BULK_OR_INTERRUPT_TRANSFER:
  PipeHandle           = 81b44aec [endpoint 0x00000002]
  TransferFlags        = 00000000 (USBD_TRANSFER_DIRECTION_OUT, ~USBD_SHORT_TRANSFER_OK)
  TransferBufferLength = 00000007
  TransferBuffer       = 00000000
  TransferBufferMDL    = 8216a008
    00000000: 00 00 00 02 05 e0 00
  UrbLink              = 00000000
[310734 ms] UsbSnoop - MyInternalIOCTLCompletion(f88c7db0) : fido=823a0430, Irp=81b5d388, Context=81adbfe8, IRQL=2
[310734 ms]  <<<  URB 673 coming back  <<< 
-- URB_FUNCTION_BULK_OR_INTERRUPT_TRANSFER:
  PipeHandle           = 81b44aec [endpoint 0x00000002]
  TransferFlags        = 00000000 (USBD_TRANSFER_DIRECTION_OUT, ~USBD_SHORT_TRANSFER_OK)
  TransferBufferLength = 00000007
  TransferBuffer       = 00000000
  TransferBufferMDL    = 8216a008
  UrbLink              = 00000000
[310744 ms] UsbSnoop - DispatchAny(f88c6610) : IRP_MJ_INTERNAL_DEVICE_CONTROL
[310744 ms] UsbSnoop - MyDispatchInternalIOCTL(f88c7e80) : fdo=82142030, Irp=81b5d388, IRQL=2
[310744 ms]  >>>  URB 674 going down  >>> 
-- URB_FUNCTION_BULK_OR_INTERRUPT_TRANSFER:
  PipeHandle           = 81b44acc [endpoint 0x00000081]
  TransferFlags        = 00000003 (USBD_TRANSFER_DIRECTION_IN, USBD_SHORT_TRANSFER_OK)
  TransferBufferLength = 00000100
  TransferBuffer       = 00000000
  TransferBufferMDL    = 8216a008
  UrbLink              = 00000000
[310744 ms] UsbSnoop - MyInternalIOCTLCompletion(f88c7db0) : fido=823a0430, Irp=81b5d388, Context=81c6cb60, IRQL=2
[310744 ms]  <<<  URB 674 coming back  <<< 
-- URB_FUNCTION_BULK_OR_INTERRUPT_TRANSFER:
  PipeHandle           = 81b44acc [endpoint 0x00000081]
  TransferFlags        = 00000003 (USBD_TRANSFER_DIRECTION_IN, USBD_SHORT_TRANSFER_OK)
  TransferBufferLength = 00000005
  TransferBuffer       = 00000000
  TransferBufferMDL    = 8216a008
    00000000: 00 00 00 37 04
  UrbLink              = 00000000
[310774 ms] UsbSnoop - DispatchAny(f88c6610) : IRP_MJ_INTERNAL_DEVICE_CONTROL
[310774 ms] UsbSnoop - MyDispatchInternalIOCTL(f88c7e80) : fdo=82142030, Irp=81b5d388, IRQL=2
[310774 ms]  >>>  URB 675 going down  >>> 
-- URB_FUNCTION_BULK_OR_INTERRUPT_TRANSFER:
  PipeHandle           = 81b44acc [endpoint 0x00000081]
  TransferFlags        = 00000003 (USBD_TRANSFER_DIRECTION_IN, USBD_SHORT_TRANSFER_OK)
  TransferBufferLength = 00000100
  TransferBuffer       = 00000000
  TransferBufferMDL    = 8216a008
  UrbLink              = 00000000
[310774 ms] UsbSnoop - MyInternalIOCTLCompletion(f88c7db0) : fido=823a0430, Irp=81b5d388, Context=81af3568, IRQL=2
[310774 ms]  <<<  URB 675 coming back  <<< 
-- URB_FUNCTION_BULK_OR_INTERRUPT_TRANSFER:
  PipeHandle           = 81b44acc [endpoint 0x00000081]
  TransferFlags        = 00000003 (USBD_TRANSFER_DIRECTION_IN, USBD_SHORT_TRANSFER_OK)
  TransferBufferLength = 00000037
  TransferBuffer       = 00000000
  TransferBufferMDL    = 8216a008
    00000000: 00 00 00 31 00 0a 02 70 37 00 05 6f 6e 64 65 73
    00000010: 00 00 06 00 02 00 00 04 f0 04 00 0b 00 03 00 00
    00000020: 01 01 00 05 02 00 01 00 00 04 00 00 02 77 00 41
    00000030: 00 00 01 01 00 42 01
  UrbLink              = 00000000
[310804 ms] UsbSnoop - DispatchAny(f88c6610) : IRP_MJ_INTERNAL_DEVICE_CONTROL
[310804 ms] UsbSnoop - MyDispatchInternalIOCTL(f88c7e80) : fdo=82142030, Irp=81b5d388, IRQL=2
[310804 ms]  >>>  URB 676 going down  >>> 
-- URB_FUNCTION_BULK_OR_INTERRUPT_TRANSFER:
  PipeHandle           = 81b44aec [endpoint 0x00000002]
  TransferFlags        = 00000000 (USBD_TRANSFER_DIRECTION_OUT, ~USBD_SHORT_TRANSFER_OK)
  TransferBufferLength = 00000007
  TransferBuffer       = 00000000
  TransferBufferMDL    = 8216a008
    00000000: 00 00 00 02 05 e0 00
  UrbLink              = 00000000
[310804 ms] UsbSnoop - MyInternalIOCTLCompletion(f88c7db0) : fido=823a0430, Irp=81b5d388, Context=81c6cb60, IRQL=2
[310804 ms]  <<<  URB 676 coming back  <<< 
-- URB_FUNCTION_BULK_OR_INTERRUPT_TRANSFER:
  PipeHandle           = 81b44aec [endpoint 0x00000002]
  TransferFlags        = 00000000 (USBD_TRANSFER_DIRECTION_OUT, ~USBD_SHORT_TRANSFER_OK)
  TransferBufferLength = 00000007
  TransferBuffer       = 00000000
  TransferBufferMDL    = 8216a008
  UrbLink              = 00000000
[310815 ms] UsbSnoop - DispatchAny(f88c6610) : IRP_MJ_INTERNAL_DEVICE_CONTROL
[310815 ms] UsbSnoop - MyDispatchInternalIOCTL(f88c7e80) : fdo=82142030, Irp=81b5d388, IRQL=2
[310815 ms]  >>>  URB 677 going down  >>> 
-- URB_FUNCTION_BULK_OR_INTERRUPT_TRANSFER:
  PipeHandle           = 81b44acc [endpoint 0x00000081]
  TransferFlags        = 00000003 (USBD_TRANSFER_DIRECTION_IN, USBD_SHORT_TRANSFER_OK)
  TransferBufferLength = 00000100
  TransferBuffer       = 00000000
  TransferBufferMDL    = 8216a008
  UrbLink              = 00000000
[310815 ms] UsbSnoop - MyInternalIOCTLCompletion(f88c7db0) : fido=823a0430, Irp=81b5d388, Context=822fb2d8, IRQL=2
[310815 ms]  <<<  URB 677 coming back  <<< 
-- URB_FUNCTION_BULK_OR_INTERRUPT_TRANSFER:
  PipeHandle           = 81b44acc [endpoint 0x00000081]
  TransferFlags        = 00000003 (USBD_TRANSFER_DIRECTION_IN, USBD_SHORT_TRANSFER_OK)
  TransferBufferLength = 00000005
  TransferBuffer       = 00000000
  TransferBufferMDL    = 8216a008
    00000000: 00 00 00 06 04
  UrbLink              = 00000000
[310844 ms] UsbSnoop - DispatchAny(f88c6610) : IRP_MJ_INTERNAL_DEVICE_CONTROL
[310844 ms] UsbSnoop - MyDispatchInternalIOCTL(f88c7e80) : fdo=82142030, Irp=81b5d388, IRQL=2
[310844 ms]  >>>  URB 678 going down  >>> 
-- URB_FUNCTION_BULK_OR_INTERRUPT_TRANSFER:
  PipeHandle           = 81b44acc [endpoint 0x00000081]
  TransferFlags        = 00000003 (USBD_TRANSFER_DIRECTION_IN, USBD_SHORT_TRANSFER_OK)
  TransferBufferLength = 00000100
  TransferBuffer       = 00000000
  TransferBufferMDL    = 8216a008
  UrbLink              = 00000000
[310844 ms] UsbSnoop - MyInternalIOCTLCompletion(f88c7db0) : fido=823a0430, Irp=81b5d388, Context=81af3568, IRQL=2
[310844 ms]  <<<  URB 678 coming back  <<< 
-- URB_FUNCTION_BULK_OR_INTERRUPT_TRANSFER:
  PipeHandle           = 81b44acc [endpoint 0x00000081]
  TransferFlags        = 00000003 (USBD_TRANSFER_DIRECTION_IN, USBD_SHORT_TRANSFER_OK)
  TransferBufferLength = 00000006
  TransferBuffer       = 00000000
  TransferBufferMDL    = 8216a008
    00000000: 00 00 00 00 dd 00
  UrbLink              = 00000000
[310874 ms] UsbSnoop - DispatchAny(f88c6610) : IRP_MJ_INTERNAL_DEVICE_CONTROL
[310874 ms] UsbSnoop - MyDispatchInternalIOCTL(f88c7e80) : fdo=82142030, Irp=81b5d388, IRQL=2
[310874 ms]  >>>  URB 679 going down  >>> 
-- URB_FUNCTION_BULK_OR_INTERRUPT_TRANSFER:
  PipeHandle           = 81b44aec [endpoint 0x00000002]
  TransferFlags        = 00000000 (USBD_TRANSFER_DIRECTION_OUT, ~USBD_SHORT_TRANSFER_OK)
  TransferBufferLength = 00000007
  TransferBuffer       = 00000000
  TransferBufferMDL    = 8216a008
    00000000: 00 00 00 02 05 e0 00
  UrbLink              = 00000000
[310874 ms] UsbSnoop - MyInternalIOCTLCompletion(f88c7db0) : fido=823a0430, Irp=81b5d388, Context=81af1cb8, IRQL=2
[310874 ms]  <<<  URB 679 coming back  <<< 
-- URB_FUNCTION_BULK_OR_INTERRUPT_TRANSFER:
  PipeHandle           = 81b44aec [endpoint 0x00000002]
  TransferFlags        = 00000000 (USBD_TRANSFER_DIRECTION_OUT, ~USBD_SHORT_TRANSFER_OK)
  TransferBufferLength = 00000007
  TransferBuffer       = 00000000
  TransferBufferMDL    = 8216a008
  UrbLink              = 00000000
[310887 ms] UsbSnoop - DispatchAny(f88c6610) : IRP_MJ_INTERNAL_DEVICE_CONTROL
[310887 ms] UsbSnoop - MyDispatchInternalIOCTL(f88c7e80) : fdo=82142030, Irp=81b4e870, IRQL=0
[310887 ms]  >>>  URB 680 going down  >>> 
-- URB_FUNCTION_RESET_PIPE:
  PipeHandle = 81b44acc [endpoint 0x00000081]
[310887 ms] UsbSnoop - MyInternalIOCTLCompletion(f88c7db0) : fido=00000000, Irp=81b4e870, Context=81af3568, IRQL=0
[310887 ms]  <<<  URB 680 coming back  <<< 
-- URB_FUNCTION_RESET_PIPE:
[310887 ms] UsbSnoop - DispatchAny(f88c6610) : IRP_MJ_INTERNAL_DEVICE_CONTROL
[310887 ms] UsbSnoop - MyDispatchInternalIOCTL(f88c7e80) : fdo=82142030, Irp=81b4e870, IRQL=0
[310887 ms]  >>>  URB 681 going down  >>> 
-- URB_FUNCTION_RESET_PIPE:
  PipeHandle = 81b44aec [endpoint 0x00000002]
[310887 ms] UsbSnoop - MyInternalIOCTLCompletion(f88c7db0) : fido=00000000, Irp=81b4e870, Context=81af1cb8, IRQL=0
[310887 ms]  <<<  URB 681 coming back  <<< 
-- URB_FUNCTION_RESET_PIPE:
[310887 ms] UsbSnoop - DispatchAny(f88c6610) : IRP_MJ_INTERNAL_DEVICE_CONTROL
[310887 ms] UsbSnoop - MyDispatchInternalIOCTL(f88c7e80) : fdo=82142030, Irp=81adb588, IRQL=0
