[73145 ms] UsbSnoop - IRP_MJ_POWER (IRP_MN_WAIT_WAKE)
[73145 ms] UsbSnoop - DispatchAny(f88f6610) : IRP_MJ_INTERNAL_DEVICE_CONTROL
[73145 ms] UsbSnoop - MyDispatchInternalIOCTL(f88f7e80) : fdo=81ac1860, Irp=81c5e3f0, IRQL=0
[73145 ms]  >>>  URB 37 going down  >>> 
-- URB_FUNCTION_RESET_PIPE:
  PipeHandle = 8216a024 [endpoint 0x00000081]
[73145 ms] UsbSnoop - MyInternalIOCTLCompletion(f88f7db0) : fido=00000000, Irp=81c5e3f0, Context=81b4e850, IRQL=0
[73145 ms]  <<<  URB 37 coming back  <<< 
-- URB_FUNCTION_RESET_PIPE:
[73145 ms] UsbSnoop - DispatchAny(f88f6610) : IRP_MJ_INTERNAL_DEVICE_CONTROL
[73145 ms] UsbSnoop - MyDispatchInternalIOCTL(f88f7e80) : fdo=81ac1860, Irp=81c5e3f0, IRQL=0
[73145 ms]  >>>  URB 38 going down  >>> 
-- URB_FUNCTION_RESET_PIPE:
  PipeHandle = 8216a044 [endpoint 0x00000002]
[73146 ms] UsbSnoop - MyInternalIOCTLCompletion(f88f7db0) : fido=00000000, Irp=81c5e3f0, Context=81c7fda0, IRQL=0
[73146 ms]  <<<  URB 38 coming back  <<< 
-- URB_FUNCTION_RESET_PIPE:
[74146 ms] UsbSnoop - DispatchAny(f88f6610) : IRP_MJ_INTERNAL_DEVICE_CONTROL
[74146 ms] UsbSnoop - MyDispatchInternalIOCTL(f88f7e80) : fdo=81ac1860, Irp=81c5e3f0, IRQL=0
[74146 ms]  >>>  URB 39 going down  >>> 
-- URB_FUNCTION_RESET_PIPE:
  PipeHandle = 8216a024 [endpoint 0x00000081]
[74147 ms] UsbSnoop - MyInternalIOCTLCompletion(f88f7db0) : fido=00000000, Irp=81c5e3f0, Context=81c7fda0, IRQL=0
[74147 ms]  <<<  URB 39 coming back  <<< 
-- URB_FUNCTION_RESET_PIPE:
[74147 ms] UsbSnoop - DispatchAny(f88f6610) : IRP_MJ_INTERNAL_DEVICE_CONTROL
[74147 ms] UsbSnoop - MyDispatchInternalIOCTL(f88f7e80) : fdo=81ac1860, Irp=81c5e3f0, IRQL=0
[74147 ms]  >>>  URB 40 going down  >>> 
-- URB_FUNCTION_RESET_PIPE:
  PipeHandle = 8216a044 [endpoint 0x00000002]
[74147 ms] UsbSnoop - MyInternalIOCTLCompletion(f88f7db0) : fido=00000000, Irp=81c5e3f0, Context=81b61910, IRQL=0
[74147 ms]  <<<  URB 40 coming back  <<< 
-- URB_FUNCTION_RESET_PIPE:
[74147 ms] UsbSnoop - DispatchAny(f88f6610) : IRP_MJ_INTERNAL_DEVICE_CONTROL
[74147 ms] UsbSnoop - MyDispatchInternalIOCTL(f88f7e80) : fdo=81ac1860, Irp=81acb740, IRQL=0
[74147 ms] UsbSnoop - IRP_MJ_POWER (IRP_MN_WAIT_WAKE)
[75148 ms] UsbSnoop - DispatchAny(f88f6610) : IRP_MJ_INTERNAL_DEVICE_CONTROL
[75148 ms] UsbSnoop - MyDispatchInternalIOCTL(f88f7e80) : fdo=81ac1860, Irp=81acb740, IRQL=0
[75148 ms]  >>>  URB 41 going down  >>> 
-- URB_FUNCTION_GET_DESCRIPTOR_FROM_DEVICE:
  TransferBufferLength = 00000012
  TransferBuffer       = e136cea8
  TransferBufferMDL    = 00000000
  Index                = 00000000
  DescriptorType       = 00000001 (USB_DEVICE_DESCRIPTOR_TYPE)
  LanguageId           = 00000000
[75149 ms] UsbSnoop - MyInternalIOCTLCompletion(f88f7db0) : fido=00000000, Irp=81acb740, Context=821cc9c0, IRQL=2
[75149 ms]  <<<  URB 41 coming back  <<< 
-- URB_FUNCTION_CONTROL_TRANSFER:
  PipeHandle           = 822b9630
  TransferFlags        = 0000000b (USBD_TRANSFER_DIRECTION_IN, USBD_SHORT_TRANSFER_OK)
  TransferBufferLength = 00000012
  TransferBuffer       = e136cea8
  TransferBufferMDL    = 822ff590
    00000000: 12 01 00 02 00 00 00 40 51 04 04 e0 00 03 01 02
    00000010: 00 01
  UrbLink              = 00000000
  SetupPacket          =
    00000000: 80 06 00 01 00 00 12 00
[75149 ms] UsbSnoop - DispatchAny(f88f6610) : IRP_MJ_INTERNAL_DEVICE_CONTROL
[75149 ms] UsbSnoop - MyDispatchInternalIOCTL(f88f7e80) : fdo=81ac1860, Irp=822ed450, IRQL=0
[75149 ms] UsbSnoop - IRP_MJ_POWER (IRP_MN_WAIT_WAKE)
[75149 ms] UsbSnoop - DispatchAny(f88f6610) : IRP_MJ_INTERNAL_DEVICE_CONTROL
[75149 ms] UsbSnoop - MyDispatchInternalIOCTL(f88f7e80) : fdo=81ac1860, Irp=81c5e3f0, IRQL=0
[75149 ms]  >>>  URB 42 going down  >>> 
-- URB_FUNCTION_RESET_PIPE:
  PipeHandle = 8216a024 [endpoint 0x00000081]
[75149 ms] UsbSnoop - MyInternalIOCTLCompletion(f88f7db0) : fido=00000000, Irp=81c5e3f0, Context=81b48e58, IRQL=0
[75149 ms]  <<<  URB 42 coming back  <<< 
-- URB_FUNCTION_RESET_PIPE:
[75149 ms] UsbSnoop - DispatchAny(f88f6610) : IRP_MJ_INTERNAL_DEVICE_CONTROL
[75149 ms] UsbSnoop - MyDispatchInternalIOCTL(f88f7e80) : fdo=81ac1860, Irp=81c5e3f0, IRQL=0
[75149 ms]  >>>  URB 43 going down  >>> 
-- URB_FUNCTION_RESET_PIPE:
  PipeHandle = 8216a044 [endpoint 0x00000002]
[75150 ms] UsbSnoop - MyInternalIOCTLCompletion(f88f7db0) : fido=00000000, Irp=81c5e3f0, Context=81b4e850, IRQL=0
[75150 ms]  <<<  URB 43 coming back  <<< 
-- URB_FUNCTION_RESET_PIPE:
[76400 ms] UsbSnoop - DispatchAny(f88f6610) : IRP_MJ_INTERNAL_DEVICE_CONTROL
[76400 ms] UsbSnoop - MyDispatchInternalIOCTL(f88f7e80) : fdo=81ac1860, Irp=81abd418, IRQL=2
[76400 ms]  >>>  URB 44 going down  >>> 
-- URB_FUNCTION_BULK_OR_INTERRUPT_TRANSFER:
  PipeHandle           = 8216a044 [endpoint 0x00000002]
  TransferFlags        = 00000000 (USBD_TRANSFER_DIRECTION_OUT, ~USBD_SHORT_TRANSFER_OK)
  TransferBufferLength = 00000009
  TransferBuffer       = 00000000
  TransferBufferMDL    = 822ff590
    00000000: 00 00 00 04 01 00 00 04 00
  UrbLink              = 00000000
[76400 ms] UsbSnoop - MyInternalIOCTLCompletion(f88f7db0) : fido=81ac2788, Irp=81abd418, Context=81b48e58, IRQL=2
[76400 ms]  <<<  URB 44 coming back  <<< 
-- URB_FUNCTION_BULK_OR_INTERRUPT_TRANSFER:
  PipeHandle           = 8216a044 [endpoint 0x00000002]
  TransferFlags        = 00000000 (USBD_TRANSFER_DIRECTION_OUT, ~USBD_SHORT_TRANSFER_OK)
  TransferBufferLength = 00000009
  TransferBuffer       = 00000000
  TransferBufferMDL    = 822ff590
  UrbLink              = 00000000
[76401 ms] UsbSnoop - DispatchAny(f88f6610) : IRP_MJ_INTERNAL_DEVICE_CONTROL
[76401 ms] UsbSnoop - MyDispatchInternalIOCTL(f88f7e80) : fdo=81ac1860, Irp=81abd418, IRQL=2
[76401 ms]  >>>  URB 45 going down  >>> 
-- URB_FUNCTION_BULK_OR_INTERRUPT_TRANSFER:
  PipeHandle           = 8216a024 [endpoint 0x00000081]
  TransferFlags        = 00000003 (USBD_TRANSFER_DIRECTION_IN, USBD_SHORT_TRANSFER_OK)
  TransferBufferLength = 00000100
  TransferBuffer       = 00000000
  TransferBufferMDL    = 822ff590
  UrbLink              = 00000000
[76402 ms] UsbSnoop - MyInternalIOCTLCompletion(f88f7db0) : fido=81ac2788, Irp=81abd418, Context=81b64160, IRQL=2
[76402 ms]  <<<  URB 45 coming back  <<< 
-- URB_FUNCTION_BULK_OR_INTERRUPT_TRANSFER:
  PipeHandle           = 8216a024 [endpoint 0x00000081]
  TransferFlags        = 00000003 (USBD_TRANSFER_DIRECTION_IN, USBD_SHORT_TRANSFER_OK)
  TransferBufferLength = 00000009
  TransferBuffer       = 00000000
  TransferBufferMDL    = 822ff590
    00000000: 00 00 00 04 02 00 00 03 ff
  UrbLink              = 00000000
[76431 ms] UsbSnoop - DispatchAny(f88f6610) : IRP_MJ_INTERNAL_DEVICE_CONTROL
[76431 ms] UsbSnoop - MyDispatchInternalIOCTL(f88f7e80) : fdo=81ac1860, Irp=81abd418, IRQL=2
[76431 ms]  >>>  URB 46 going down  >>> 
-- URB_FUNCTION_BULK_OR_INTERRUPT_TRANSFER:
  PipeHandle           = 8216a044 [endpoint 0x00000002]
  TransferFlags        = 00000000 (USBD_TRANSFER_DIRECTION_OUT, ~USBD_SHORT_TRANSFER_OK)
  TransferBufferLength = 00000015
  TransferBuffer       = 00000000
  TransferBufferMDL    = 822ff590
    00000000: 00 00 00 10 04 00 00 00 0a 00 01 00 03 00 01 00
    00000010: 00 00 00 07 d0
  UrbLink              = 00000000
[76431 ms] UsbSnoop - MyInternalIOCTLCompletion(f88f7db0) : fido=81ac2788, Irp=81abd418, Context=822b3200, IRQL=2
[76431 ms]  <<<  URB 46 coming back  <<< 
-- URB_FUNCTION_BULK_OR_INTERRUPT_TRANSFER:
  PipeHandle           = 8216a044 [endpoint 0x00000002]
  TransferFlags        = 00000000 (USBD_TRANSFER_DIRECTION_OUT, ~USBD_SHORT_TRANSFER_OK)
  TransferBufferLength = 00000015
  TransferBuffer       = 00000000
  TransferBufferMDL    = 822ff590
  UrbLink              = 00000000
[76440 ms] UsbSnoop - DispatchAny(f88f6610) : IRP_MJ_INTERNAL_DEVICE_CONTROL
[76440 ms] UsbSnoop - MyDispatchInternalIOCTL(f88f7e80) : fdo=81ac1860, Irp=81abd418, IRQL=2
[76440 ms]  >>>  URB 47 going down  >>> 
-- URB_FUNCTION_BULK_OR_INTERRUPT_TRANSFER:
  PipeHandle           = 8216a024 [endpoint 0x00000081]
  TransferFlags        = 00000003 (USBD_TRANSFER_DIRECTION_IN, USBD_SHORT_TRANSFER_OK)
  TransferBufferLength = 00000100
  TransferBuffer       = 00000000
  TransferBufferMDL    = 822ff590
  UrbLink              = 00000000
[76440 ms] UsbSnoop - MyInternalIOCTLCompletion(f88f7db0) : fido=81ac2788, Irp=81abd418, Context=81b64160, IRQL=2
[76440 ms]  <<<  URB 47 coming back  <<< 
-- URB_FUNCTION_BULK_OR_INTERRUPT_TRANSFER:
  PipeHandle           = 8216a024 [endpoint 0x00000081]
  TransferFlags        = 00000003 (USBD_TRANSFER_DIRECTION_IN, USBD_SHORT_TRANSFER_OK)
  TransferBufferLength = 00000007
  TransferBuffer       = 00000000
  TransferBufferMDL    = 822ff590
    00000000: 00 00 00 02 05 e0 00
  UrbLink              = 00000000
[76480 ms] UsbSnoop - DispatchAny(f88f6610) : IRP_MJ_INTERNAL_DEVICE_CONTROL
[76480 ms] UsbSnoop - MyDispatchInternalIOCTL(f88f7e80) : fdo=81ac1860, Irp=81abd418, IRQL=2
[76480 ms]  >>>  URB 48 going down  >>> 
-- URB_FUNCTION_BULK_OR_INTERRUPT_TRANSFER:
  PipeHandle           = 8216a024 [endpoint 0x00000081]
  TransferFlags        = 00000003 (USBD_TRANSFER_DIRECTION_IN, USBD_SHORT_TRANSFER_OK)
  TransferBufferLength = 00000100
  TransferBuffer       = 00000000
  TransferBufferMDL    = 822ff590
  UrbLink              = 00000000
[76480 ms] UsbSnoop - MyInternalIOCTLCompletion(f88f7db0) : fido=81ac2788, Irp=81abd418, Context=81b61910, IRQL=2
[76480 ms]  <<<  URB 48 coming back  <<< 
-- URB_FUNCTION_BULK_OR_INTERRUPT_TRANSFER:
  PipeHandle           = 8216a024 [endpoint 0x00000081]
  TransferFlags        = 00000003 (USBD_TRANSFER_DIRECTION_IN, USBD_SHORT_TRANSFER_OK)
  TransferBufferLength = 00000005
  TransferBuffer       = 00000000
  TransferBufferMDL    = 822ff590
    00000000: 00 00 00 0a 04
  UrbLink              = 00000000
[76510 ms] UsbSnoop - DispatchAny(f88f6610) : IRP_MJ_INTERNAL_DEVICE_CONTROL
[76510 ms] UsbSnoop - MyDispatchInternalIOCTL(f88f7e80) : fdo=81ac1860, Irp=81abd418, IRQL=2
[76510 ms]  >>>  URB 49 going down  >>> 
-- URB_FUNCTION_BULK_OR_INTERRUPT_TRANSFER:
  PipeHandle           = 8216a024 [endpoint 0x00000081]
  TransferFlags        = 00000003 (USBD_TRANSFER_DIRECTION_IN, USBD_SHORT_TRANSFER_OK)
  TransferBufferLength = 00000100
  TransferBuffer       = 00000000
  TransferBufferMDL    = 822ff590
  UrbLink              = 00000000
[76510 ms] UsbSnoop - MyInternalIOCTLCompletion(f88f7db0) : fido=81ac2788, Irp=81abd418, Context=81b4e850, IRQL=2
[76510 ms]  <<<  URB 49 coming back  <<< 
-- URB_FUNCTION_BULK_OR_INTERRUPT_TRANSFER:
  PipeHandle           = 8216a024 [endpoint 0x00000081]
  TransferFlags        = 00000003 (USBD_TRANSFER_DIRECTION_IN, USBD_SHORT_TRANSFER_OK)
  TransferBufferLength = 0000000a
  TransferBuffer       = 00000000
  TransferBufferMDL    = 822ff590
    00000000: 00 00 00 04 00 12 00 00 07 d0
  UrbLink              = 00000000
[76540 ms] UsbSnoop - DispatchAny(f88f6610) : IRP_MJ_INTERNAL_DEVICE_CONTROL
[76540 ms] UsbSnoop - MyDispatchInternalIOCTL(f88f7e80) : fdo=81ac1860, Irp=81abd418, IRQL=2
[76540 ms]  >>>  URB 50 going down  >>> 
-- URB_FUNCTION_BULK_OR_INTERRUPT_TRANSFER:
  PipeHandle           = 8216a044 [endpoint 0x00000002]
  TransferFlags        = 00000000 (USBD_TRANSFER_DIRECTION_OUT, ~USBD_SHORT_TRANSFER_OK)
  TransferBufferLength = 00000007
  TransferBuffer       = 00000000
  TransferBufferMDL    = 822ff590
    00000000: 00 00 00 02 05 e0 00
  UrbLink              = 00000000
[76541 ms] UsbSnoop - MyInternalIOCTLCompletion(f88f7db0) : fido=81ac2788, Irp=81abd418, Context=81b48e58, IRQL=2
[76541 ms]  <<<  URB 50 coming back  <<< 
-- URB_FUNCTION_BULK_OR_INTERRUPT_TRANSFER:
  PipeHandle           = 8216a044 [endpoint 0x00000002]
  TransferFlags        = 00000000 (USBD_TRANSFER_DIRECTION_OUT, ~USBD_SHORT_TRANSFER_OK)
  TransferBufferLength = 00000007
  TransferBuffer       = 00000000
  TransferBufferMDL    = 822ff590
  UrbLink              = 00000000
[76550 ms] UsbSnoop - DispatchAny(f88f6610) : IRP_MJ_INTERNAL_DEVICE_CONTROL
[76550 ms] UsbSnoop - MyDispatchInternalIOCTL(f88f7e80) : fdo=81ac1860, Irp=81abd418, IRQL=2
[76550 ms]  >>>  URB 51 going down  >>> 
-- URB_FUNCTION_BULK_OR_INTERRUPT_TRANSFER:
  PipeHandle           = 8216a044 [endpoint 0x00000002]
  TransferFlags        = 00000000 (USBD_TRANSFER_DIRECTION_OUT, ~USBD_SHORT_TRANSFER_OK)
  TransferBufferLength = 00000022
  TransferBuffer       = 00000000
  TransferBufferMDL    = 822ff590
    00000000: 00 00 00 1d 04 00 00 00 17 00 09 00 00 00 06 00
    00000010: 02 00 03 00 05 00 01 00 41 00 42 00 01 00 01 00
    00000020: 01 01
  UrbLink              = 00000000
[76550 ms] UsbSnoop - MyInternalIOCTLCompletion(f88f7db0) : fido=81ac2788, Irp=81abd418, Context=822b3200, IRQL=2
[76550 ms]  <<<  URB 51 coming back  <<< 
-- URB_FUNCTION_BULK_OR_INTERRUPT_TRANSFER:
  PipeHandle           = 8216a044 [endpoint 0x00000002]
  TransferFlags        = 00000000 (USBD_TRANSFER_DIRECTION_OUT, ~USBD_SHORT_TRANSFER_OK)
  TransferBufferLength = 00000022
  TransferBuffer       = 00000000
  TransferBufferMDL    = 822ff590
  UrbLink              = 00000000
[76560 ms] UsbSnoop - DispatchAny(f88f6610) : IRP_MJ_INTERNAL_DEVICE_CONTROL
[76560 ms] UsbSnoop - MyDispatchInternalIOCTL(f88f7e80) : fdo=81ac1860, Irp=81abd418, IRQL=2
[76560 ms]  >>>  URB 52 going down  >>> 
-- URB_FUNCTION_BULK_OR_INTERRUPT_TRANSFER:
  PipeHandle           = 8216a024 [endpoint 0x00000081]
  TransferFlags        = 00000003 (USBD_TRANSFER_DIRECTION_IN, USBD_SHORT_TRANSFER_OK)
  TransferBufferLength = 00000100
  TransferBuffer       = 00000000
  TransferBufferMDL    = 822ff590
  UrbLink              = 00000000
[76560 ms] UsbSnoop - MyInternalIOCTLCompletion(f88f7db0) : fido=81ac2788, Irp=81abd418, Context=81b64160, IRQL=2
[76560 ms]  <<<  URB 52 coming back  <<< 
-- URB_FUNCTION_BULK_OR_INTERRUPT_TRANSFER:
  PipeHandle           = 8216a024 [endpoint 0x00000081]
  TransferFlags        = 00000003 (USBD_TRANSFER_DIRECTION_IN, USBD_SHORT_TRANSFER_OK)
  TransferBufferLength = 00000007
  TransferBuffer       = 00000000
  TransferBufferMDL    = 822ff590
    00000000: 00 00 00 02 05 e0 00
  UrbLink              = 00000000
[76600 ms] UsbSnoop - DispatchAny(f88f6610) : IRP_MJ_INTERNAL_DEVICE_CONTROL
[76600 ms] UsbSnoop - MyDispatchInternalIOCTL(f88f7e80) : fdo=81ac1860, Irp=81abd418, IRQL=2
[76600 ms]  >>>  URB 53 going down  >>> 
-- URB_FUNCTION_BULK_OR_INTERRUPT_TRANSFER:
  PipeHandle           = 8216a024 [endpoint 0x00000081]
  TransferFlags        = 00000003 (USBD_TRANSFER_DIRECTION_IN, USBD_SHORT_TRANSFER_OK)
  TransferBufferLength = 00000100
  TransferBuffer       = 00000000
  TransferBufferMDL    = 822ff590
  UrbLink              = 00000000
[76601 ms] UsbSnoop - MyInternalIOCTLCompletion(f88f7db0) : fido=81ac2788, Irp=81abd418, Context=81b48e58, IRQL=2
[76601 ms]  <<<  URB 53 coming back  <<< 
-- URB_FUNCTION_BULK_OR_INTERRUPT_TRANSFER:
  PipeHandle           = 8216a024 [endpoint 0x00000081]
  TransferFlags        = 00000003 (USBD_TRANSFER_DIRECTION_IN, USBD_SHORT_TRANSFER_OK)
  TransferBufferLength = 00000005
  TransferBuffer       = 00000000
  TransferBufferMDL    = 822ff590
    00000000: 00 00 00 33 04
  UrbLink              = 00000000
[76630 ms] UsbSnoop - DispatchAny(f88f6610) : IRP_MJ_INTERNAL_DEVICE_CONTROL
[76630 ms] UsbSnoop - MyDispatchInternalIOCTL(f88f7e80) : fdo=81ac1860, Irp=81abd418, IRQL=2
[76630 ms]  >>>  URB 54 going down  >>> 
-- URB_FUNCTION_BULK_OR_INTERRUPT_TRANSFER:
  PipeHandle           = 8216a024 [endpoint 0x00000081]
  TransferFlags        = 00000003 (USBD_TRANSFER_DIRECTION_IN, USBD_SHORT_TRANSFER_OK)
  TransferBufferLength = 00000100
  TransferBuffer       = 00000000
  TransferBufferMDL    = 822ff590
  UrbLink              = 00000000
[76631 ms] UsbSnoop - MyInternalIOCTLCompletion(f88f7db0) : fido=81ac2788, Irp=81abd418, Context=81b64160, IRQL=2
[76631 ms]  <<<  URB 54 coming back  <<< 
-- URB_FUNCTION_BULK_OR_INTERRUPT_TRANSFER:
  PipeHandle           = 8216a024 [endpoint 0x00000081]
  TransferFlags        = 00000003 (USBD_TRANSFER_DIRECTION_IN, USBD_SHORT_TRANSFER_OK)
  TransferBufferLength = 00000033
  TransferBuffer       = 00000000
  TransferBufferMDL    = 822ff590
    00000000: 00 00 00 2d 00 0a 04 6d 61 69 6e 00 00 00 06 00
    00000010: 02 00 00 04 f0 04 00 1f 00 03 00 00 01 00 00 05
    00000020: 02 00 01 00 00 04 00 00 00 0c 00 41 00 00 01 00
    00000030: 00 42 01
  UrbLink              = 00000000
[76660 ms] UsbSnoop - DispatchAny(f88f6610) : IRP_MJ_INTERNAL_DEVICE_CONTROL
[76660 ms] UsbSnoop - MyDispatchInternalIOCTL(f88f7e80) : fdo=81ac1860, Irp=81abd418, IRQL=2
[76660 ms]  >>>  URB 55 going down  >>> 
-- URB_FUNCTION_BULK_OR_INTERRUPT_TRANSFER:
  PipeHandle           = 8216a044 [endpoint 0x00000002]
  TransferFlags        = 00000000 (USBD_TRANSFER_DIRECTION_OUT, ~USBD_SHORT_TRANSFER_OK)
  TransferBufferLength = 00000007
  TransferBuffer       = 00000000
  TransferBufferMDL    = 822ff590
    00000000: 00 00 00 02 05 e0 00
  UrbLink              = 00000000
[76661 ms] UsbSnoop - MyInternalIOCTLCompletion(f88f7db0) : fido=81ac2788, Irp=81abd418, Context=81bb8ae8, IRQL=2
[76661 ms]  <<<  URB 55 coming back  <<< 
-- URB_FUNCTION_BULK_OR_INTERRUPT_TRANSFER:
  PipeHandle           = 8216a044 [endpoint 0x00000002]
  TransferFlags        = 00000000 (USBD_TRANSFER_DIRECTION_OUT, ~USBD_SHORT_TRANSFER_OK)
  TransferBufferLength = 00000007
  TransferBuffer       = 00000000
  TransferBufferMDL    = 822ff590
  UrbLink              = 00000000
[76670 ms] UsbSnoop - DispatchAny(f88f6610) : IRP_MJ_INTERNAL_DEVICE_CONTROL
[76670 ms] UsbSnoop - MyDispatchInternalIOCTL(f88f7e80) : fdo=81ac1860, Irp=81abd418, IRQL=2
[76670 ms]  >>>  URB 56 going down  >>> 
-- URB_FUNCTION_BULK_OR_INTERRUPT_TRANSFER:
  PipeHandle           = 8216a024 [endpoint 0x00000081]
  TransferFlags        = 00000003 (USBD_TRANSFER_DIRECTION_IN, USBD_SHORT_TRANSFER_OK)
  TransferBufferLength = 00000100
  TransferBuffer       = 00000000
  TransferBufferMDL    = 822ff590
  UrbLink              = 00000000
[76671 ms] UsbSnoop - MyInternalIOCTLCompletion(f88f7db0) : fido=81ac2788, Irp=81abd418, Context=81b61910, IRQL=2
[76671 ms]  <<<  URB 56 coming back  <<< 
-- URB_FUNCTION_BULK_OR_INTERRUPT_TRANSFER:
  PipeHandle           = 8216a024 [endpoint 0x00000081]
  TransferFlags        = 00000003 (USBD_TRANSFER_DIRECTION_IN, USBD_SHORT_TRANSFER_OK)
  TransferBufferLength = 00000005
  TransferBuffer       = 00000000
  TransferBufferMDL    = 822ff590
    00000000: 00 00 00 35 04
  UrbLink              = 00000000
[76701 ms] UsbSnoop - DispatchAny(f88f6610) : IRP_MJ_INTERNAL_DEVICE_CONTROL
[76701 ms] UsbSnoop - MyDispatchInternalIOCTL(f88f7e80) : fdo=81ac1860, Irp=81abd418, IRQL=2
[76701 ms]  >>>  URB 57 going down  >>> 
-- URB_FUNCTION_BULK_OR_INTERRUPT_TRANSFER:
  PipeHandle           = 8216a024 [endpoint 0x00000081]
  TransferFlags        = 00000003 (USBD_TRANSFER_DIRECTION_IN, USBD_SHORT_TRANSFER_OK)
  TransferBufferLength = 00000100
  TransferBuffer       = 00000000
  TransferBufferMDL    = 822ff590
  UrbLink              = 00000000
[76701 ms] UsbSnoop - MyInternalIOCTLCompletion(f88f7db0) : fido=81ac2788, Irp=81abd418, Context=822b3200, IRQL=2
[76701 ms]  <<<  URB 57 coming back  <<< 
-- URB_FUNCTION_BULK_OR_INTERRUPT_TRANSFER:
  PipeHandle           = 8216a024 [endpoint 0x00000081]
  TransferFlags        = 00000003 (USBD_TRANSFER_DIRECTION_IN, USBD_SHORT_TRANSFER_OK)
  TransferBufferLength = 00000035
  TransferBuffer       = 00000000
  TransferBufferMDL    = 822ff590
    00000000: 00 00 00 2f 00 0a 04 6d 61 69 6e 00 01 78 00 00
    00000010: 06 00 02 00 00 04 f0 04 00 00 00 03 00 00 01 00
    00000020: 00 05 02 00 01 00 00 04 00 00 00 05 00 41 00 00
    00000030: 01 00 00 42 01
  UrbLink              = 00000000
[76731 ms] UsbSnoop - DispatchAny(f88f6610) : IRP_MJ_INTERNAL_DEVICE_CONTROL
[76731 ms] UsbSnoop - MyDispatchInternalIOCTL(f88f7e80) : fdo=81ac1860, Irp=81abd418, IRQL=2
[76731 ms]  >>>  URB 58 going down  >>> 
-- URB_FUNCTION_BULK_OR_INTERRUPT_TRANSFER:
  PipeHandle           = 8216a044 [endpoint 0x00000002]
  TransferFlags        = 00000000 (USBD_TRANSFER_DIRECTION_OUT, ~USBD_SHORT_TRANSFER_OK)
  TransferBufferLength = 00000007
  TransferBuffer       = 00000000
  TransferBufferMDL    = 822ff590
    00000000: 00 00 00 02 05 e0 00
  UrbLink              = 00000000
[76731 ms] UsbSnoop - MyInternalIOCTLCompletion(f88f7db0) : fido=81ac2788, Irp=81abd418, Context=81b48e58, IRQL=2
[76731 ms]  <<<  URB 58 coming back  <<< 
-- URB_FUNCTION_BULK_OR_INTERRUPT_TRANSFER:
  PipeHandle           = 8216a044 [endpoint 0x00000002]
  TransferFlags        = 00000000 (USBD_TRANSFER_DIRECTION_OUT, ~USBD_SHORT_TRANSFER_OK)
  TransferBufferLength = 00000007
  TransferBuffer       = 00000000
  TransferBufferMDL    = 822ff590
  UrbLink              = 00000000
[76741 ms] UsbSnoop - DispatchAny(f88f6610) : IRP_MJ_INTERNAL_DEVICE_CONTROL
[76741 ms] UsbSnoop - MyDispatchInternalIOCTL(f88f7e80) : fdo=81ac1860, Irp=81abd418, IRQL=2
[76741 ms]  >>>  URB 59 going down  >>> 
-- URB_FUNCTION_BULK_OR_INTERRUPT_TRANSFER:
  PipeHandle           = 8216a024 [endpoint 0x00000081]
  TransferFlags        = 00000003 (USBD_TRANSFER_DIRECTION_IN, USBD_SHORT_TRANSFER_OK)
  TransferBufferLength = 00000100
  TransferBuffer       = 00000000
  TransferBufferMDL    = 822ff590
  UrbLink              = 00000000
[76741 ms] UsbSnoop - MyInternalIOCTLCompletion(f88f7db0) : fido=81ac2788, Irp=81abd418, Context=81b64160, IRQL=2
[76741 ms]  <<<  URB 59 coming back  <<< 
-- URB_FUNCTION_BULK_OR_INTERRUPT_TRANSFER:
  PipeHandle           = 8216a024 [endpoint 0x00000081]
  TransferFlags        = 00000003 (USBD_TRANSFER_DIRECTION_IN, USBD_SHORT_TRANSFER_OK)
  TransferBufferLength = 00000005
  TransferBuffer       = 00000000
  TransferBufferMDL    = 822ff590
    00000000: 00 00 00 35 04
  UrbLink              = 00000000
[76771 ms] UsbSnoop - DispatchAny(f88f6610) : IRP_MJ_INTERNAL_DEVICE_CONTROL
[76771 ms] UsbSnoop - MyDispatchInternalIOCTL(f88f7e80) : fdo=81ac1860, Irp=81abd418, IRQL=2
[76771 ms]  >>>  URB 60 going down  >>> 
-- URB_FUNCTION_BULK_OR_INTERRUPT_TRANSFER:
  PipeHandle           = 8216a024 [endpoint 0x00000081]
  TransferFlags        = 00000003 (USBD_TRANSFER_DIRECTION_IN, USBD_SHORT_TRANSFER_OK)
  TransferBufferLength = 00000100
  TransferBuffer       = 00000000
  TransferBufferMDL    = 822ff590
  UrbLink              = 00000000
[76771 ms] UsbSnoop - MyInternalIOCTLCompletion(f88f7db0) : fido=81ac2788, Irp=81abd418, Context=822b3200, IRQL=2
[76771 ms]  <<<  URB 60 coming back  <<< 
-- URB_FUNCTION_BULK_OR_INTERRUPT_TRANSFER:
  PipeHandle           = 8216a024 [endpoint 0x00000081]
  TransferFlags        = 00000003 (USBD_TRANSFER_DIRECTION_IN, USBD_SHORT_TRANSFER_OK)
  TransferBufferLength = 00000035
  TransferBuffer       = 00000000
  TransferBufferMDL    = 822ff590
    00000000: 00 00 00 2f 00 0a 04 6d 61 69 6e 00 01 79 00 00
    00000010: 06 00 02 00 00 04 f0 04 00 00 00 03 00 00 01 00
    00000020: 00 05 02 00 01 00 00 04 00 00 00 05 00 41 00 00
    00000030: 01 01 00 42 01
  UrbLink              = 00000000
[76801 ms] UsbSnoop - DispatchAny(f88f6610) : IRP_MJ_INTERNAL_DEVICE_CONTROL
[76801 ms] UsbSnoop - MyDispatchInternalIOCTL(f88f7e80) : fdo=81ac1860, Irp=81abd418, IRQL=2
[76801 ms]  >>>  URB 61 going down  >>> 
-- URB_FUNCTION_BULK_OR_INTERRUPT_TRANSFER:
  PipeHandle           = 8216a044 [endpoint 0x00000002]
  TransferFlags        = 00000000 (USBD_TRANSFER_DIRECTION_OUT, ~USBD_SHORT_TRANSFER_OK)
  TransferBufferLength = 00000007
  TransferBuffer       = 00000000
  TransferBufferMDL    = 822ff590
    00000000: 00 00 00 02 05 e0 00
  UrbLink              = 00000000
[76801 ms] UsbSnoop - MyInternalIOCTLCompletion(f88f7db0) : fido=81ac2788, Irp=81abd418, Context=822b3200, IRQL=2
[76801 ms]  <<<  URB 61 coming back  <<< 
-- URB_FUNCTION_BULK_OR_INTERRUPT_TRANSFER:
  PipeHandle           = 8216a044 [endpoint 0x00000002]
  TransferFlags        = 00000000 (USBD_TRANSFER_DIRECTION_OUT, ~USBD_SHORT_TRANSFER_OK)
  TransferBufferLength = 00000007
  TransferBuffer       = 00000000
  TransferBufferMDL    = 822ff590
  UrbLink              = 00000000
[76811 ms] UsbSnoop - DispatchAny(f88f6610) : IRP_MJ_INTERNAL_DEVICE_CONTROL
[76811 ms] UsbSnoop - MyDispatchInternalIOCTL(f88f7e80) : fdo=81ac1860, Irp=81abd418, IRQL=2
[76811 ms]  >>>  URB 62 going down  >>> 
-- URB_FUNCTION_BULK_OR_INTERRUPT_TRANSFER:
  PipeHandle           = 8216a024 [endpoint 0x00000081]
  TransferFlags        = 00000003 (USBD_TRANSFER_DIRECTION_IN, USBD_SHORT_TRANSFER_OK)
  TransferBufferLength = 00000100
  TransferBuffer       = 00000000
  TransferBufferMDL    = 822ff590
  UrbLink              = 00000000
[76811 ms] UsbSnoop - MyInternalIOCTLCompletion(f88f7db0) : fido=81ac2788, Irp=81abd418, Context=81b4e850, IRQL=2
[76811 ms]  <<<  URB 62 coming back  <<< 
-- URB_FUNCTION_BULK_OR_INTERRUPT_TRANSFER:
  PipeHandle           = 8216a024 [endpoint 0x00000081]
  TransferFlags        = 00000003 (USBD_TRANSFER_DIRECTION_IN, USBD_SHORT_TRANSFER_OK)
  TransferBufferLength = 00000005
  TransferBuffer       = 00000000
  TransferBufferMDL    = 822ff590
    00000000: 00 00 00 35 04
  UrbLink              = 00000000
[76841 ms] UsbSnoop - DispatchAny(f88f6610) : IRP_MJ_INTERNAL_DEVICE_CONTROL
[76841 ms] UsbSnoop - MyDispatchInternalIOCTL(f88f7e80) : fdo=81ac1860, Irp=81abd418, IRQL=2
[76841 ms]  >>>  URB 63 going down  >>> 
-- URB_FUNCTION_BULK_OR_INTERRUPT_TRANSFER:
  PipeHandle           = 8216a024 [endpoint 0x00000081]
  TransferFlags        = 00000003 (USBD_TRANSFER_DIRECTION_IN, USBD_SHORT_TRANSFER_OK)
  TransferBufferLength = 00000100
  TransferBuffer       = 00000000
  TransferBufferMDL    = 822ff590
  UrbLink              = 00000000
[76841 ms] UsbSnoop - MyInternalIOCTLCompletion(f88f7db0) : fido=81ac2788, Irp=81abd418, Context=81b48e58, IRQL=2
[76841 ms]  <<<  URB 63 coming back  <<< 
-- URB_FUNCTION_BULK_OR_INTERRUPT_TRANSFER:
  PipeHandle           = 8216a024 [endpoint 0x00000081]
  TransferFlags        = 00000003 (USBD_TRANSFER_DIRECTION_IN, USBD_SHORT_TRANSFER_OK)
  TransferBufferLength = 00000035
  TransferBuffer       = 00000000
  TransferBufferMDL    = 822ff590
    00000000: 00 00 00 2f 00 0a 04 6d 61 69 6e 00 01 7a 00 00
    00000010: 06 00 02 00 00 04 f0 04 00 00 00 03 00 00 01 01
    00000020: 00 05 02 00 01 00 00 04 00 00 00 05 00 41 00 00
    00000030: 01 01 00 42 01
  UrbLink              = 00000000
[76871 ms] UsbSnoop - DispatchAny(f88f6610) : IRP_MJ_INTERNAL_DEVICE_CONTROL
[76871 ms] UsbSnoop - MyDispatchInternalIOCTL(f88f7e80) : fdo=81ac1860, Irp=81abd418, IRQL=2
[76871 ms]  >>>  URB 64 going down  >>> 
-- URB_FUNCTION_BULK_OR_INTERRUPT_TRANSFER:
  PipeHandle           = 8216a044 [endpoint 0x00000002]
  TransferFlags        = 00000000 (USBD_TRANSFER_DIRECTION_OUT, ~USBD_SHORT_TRANSFER_OK)
  TransferBufferLength = 00000007
  TransferBuffer       = 00000000
  TransferBufferMDL    = 822ff590
    00000000: 00 00 00 02 05 e0 00
  UrbLink              = 00000000
[76871 ms] UsbSnoop - MyInternalIOCTLCompletion(f88f7db0) : fido=81ac2788, Irp=81abd418, Context=81b61910, IRQL=2
[76871 ms]  <<<  URB 64 coming back  <<< 
-- URB_FUNCTION_BULK_OR_INTERRUPT_TRANSFER:
  PipeHandle           = 8216a044 [endpoint 0x00000002]
  TransferFlags        = 00000000 (USBD_TRANSFER_DIRECTION_OUT, ~USBD_SHORT_TRANSFER_OK)
  TransferBufferLength = 00000007
  TransferBuffer       = 00000000
  TransferBufferMDL    = 822ff590
  UrbLink              = 00000000
[76881 ms] UsbSnoop - DispatchAny(f88f6610) : IRP_MJ_INTERNAL_DEVICE_CONTROL
[76881 ms] UsbSnoop - MyDispatchInternalIOCTL(f88f7e80) : fdo=81ac1860, Irp=81abd418, IRQL=2
[76881 ms]  >>>  URB 65 going down  >>> 
-- URB_FUNCTION_BULK_OR_INTERRUPT_TRANSFER:
  PipeHandle           = 8216a024 [endpoint 0x00000081]
  TransferFlags        = 00000003 (USBD_TRANSFER_DIRECTION_IN, USBD_SHORT_TRANSFER_OK)
  TransferBufferLength = 00000100
  TransferBuffer       = 00000000
  TransferBufferMDL    = 822ff590
  UrbLink              = 00000000
[76881 ms] UsbSnoop - MyInternalIOCTLCompletion(f88f7db0) : fido=81ac2788, Irp=81abd418, Context=81b48e58, IRQL=2
[76881 ms]  <<<  URB 65 coming back  <<< 
-- URB_FUNCTION_BULK_OR_INTERRUPT_TRANSFER:
  PipeHandle           = 8216a024 [endpoint 0x00000081]
  TransferFlags        = 00000003 (USBD_TRANSFER_DIRECTION_IN, USBD_SHORT_TRANSFER_OK)
  TransferBufferLength = 00000005
  TransferBuffer       = 00000000
  TransferBufferMDL    = 822ff590
    00000000: 00 00 00 06 04
  UrbLink              = 00000000
[76912 ms] UsbSnoop - DispatchAny(f88f6610) : IRP_MJ_INTERNAL_DEVICE_CONTROL
[76912 ms] UsbSnoop - MyDispatchInternalIOCTL(f88f7e80) : fdo=81ac1860, Irp=81abd418, IRQL=2
[76912 ms]  >>>  URB 66 going down  >>> 
-- URB_FUNCTION_BULK_OR_INTERRUPT_TRANSFER:
  PipeHandle           = 8216a024 [endpoint 0x00000081]
  TransferFlags        = 00000003 (USBD_TRANSFER_DIRECTION_IN, USBD_SHORT_TRANSFER_OK)
  TransferBufferLength = 00000100
  TransferBuffer       = 00000000
  TransferBufferMDL    = 822ff590
  UrbLink              = 00000000
[76912 ms] UsbSnoop - MyInternalIOCTLCompletion(f88f7db0) : fido=81ac2788, Irp=81abd418, Context=81bb8ae8, IRQL=2
[76912 ms]  <<<  URB 66 coming back  <<< 
-- URB_FUNCTION_BULK_OR_INTERRUPT_TRANSFER:
  PipeHandle           = 8216a024 [endpoint 0x00000081]
  TransferFlags        = 00000003 (USBD_TRANSFER_DIRECTION_IN, USBD_SHORT_TRANSFER_OK)
  TransferBufferLength = 00000006
  TransferBuffer       = 00000000
  TransferBufferMDL    = 822ff590
    00000000: 00 00 00 00 dd 00
  UrbLink              = 00000000
[76941 ms] UsbSnoop - DispatchAny(f88f6610) : IRP_MJ_INTERNAL_DEVICE_CONTROL
[76941 ms] UsbSnoop - MyDispatchInternalIOCTL(f88f7e80) : fdo=81ac1860, Irp=81abd418, IRQL=2
[76941 ms]  >>>  URB 67 going down  >>> 
-- URB_FUNCTION_BULK_OR_INTERRUPT_TRANSFER:
  PipeHandle           = 8216a044 [endpoint 0x00000002]
  TransferFlags        = 00000000 (USBD_TRANSFER_DIRECTION_OUT, ~USBD_SHORT_TRANSFER_OK)
  TransferBufferLength = 00000007
  TransferBuffer       = 00000000
  TransferBufferMDL    = 822ff590
    00000000: 00 00 00 02 05 e0 00
  UrbLink              = 00000000
[76941 ms] UsbSnoop - MyInternalIOCTLCompletion(f88f7db0) : fido=81ac2788, Irp=81abd418, Context=81b4e850, IRQL=2
[76941 ms]  <<<  URB 67 coming back  <<< 
-- URB_FUNCTION_BULK_OR_INTERRUPT_TRANSFER:
  PipeHandle           = 8216a044 [endpoint 0x00000002]
  TransferFlags        = 00000000 (USBD_TRANSFER_DIRECTION_OUT, ~USBD_SHORT_TRANSFER_OK)
  TransferBufferLength = 00000007
  TransferBuffer       = 00000000
  TransferBufferMDL    = 822ff590
  UrbLink              = 00000000
[76953 ms] UsbSnoop - DispatchAny(f88f6610) : IRP_MJ_INTERNAL_DEVICE_CONTROL
[76953 ms] UsbSnoop - MyDispatchInternalIOCTL(f88f7e80) : fdo=81ac1860, Irp=81c5e3f0, IRQL=0
[76953 ms]  >>>  URB 68 going down  >>> 
-- URB_FUNCTION_RESET_PIPE:
  PipeHandle = 8216a024 [endpoint 0x00000081]
[76953 ms] UsbSnoop - MyInternalIOCTLCompletion(f88f7db0) : fido=00000000, Irp=81c5e3f0, Context=822b3200, IRQL=0
[76953 ms]  <<<  URB 68 coming back  <<< 
-- URB_FUNCTION_RESET_PIPE:
[76953 ms] UsbSnoop - DispatchAny(f88f6610) : IRP_MJ_INTERNAL_DEVICE_CONTROL
[76953 ms] UsbSnoop - MyDispatchInternalIOCTL(f88f7e80) : fdo=81ac1860, Irp=81c5e3f0, IRQL=0
[76953 ms]  >>>  URB 69 going down  >>> 
-- URB_FUNCTION_RESET_PIPE:
  PipeHandle = 8216a044 [endpoint 0x00000002]
[76954 ms] UsbSnoop - MyInternalIOCTLCompletion(f88f7db0) : fido=00000000, Irp=81c5e3f0, Context=822b3200, IRQL=0
[76954 ms]  <<<  URB 69 coming back  <<< 
-- URB_FUNCTION_RESET_PIPE:
[76954 ms] UsbSnoop - DispatchAny(f88f6610) : IRP_MJ_INTERNAL_DEVICE_CONTROL
[76954 ms] UsbSnoop - MyDispatchInternalIOCTL(f88f7e80) : fdo=81ac1860, Irp=822ed450, IRQL=0
[76954 ms] UsbSnoop - IRP_MJ_POWER (IRP_MN_WAIT_WAKE)
