[621480 ms] UsbSnoop - DispatchAny(f8916610) : IRP_MJ_INTERNAL_DEVICE_CONTROL
[621480 ms] UsbSnoop - MyDispatchInternalIOCTL(f8917e80) : fdo=822eee08, Irp=81ce1a30, IRQL=0
[621480 ms]  >>>  URB 761 going down  >>> 
-- URB_FUNCTION_RESET_PIPE:
  PipeHandle = 82300ef4 [endpoint 0x00000081]
[621480 ms] UsbSnoop - MyInternalIOCTLCompletion(f8917db0) : fido=00000000, Irp=81ce1a30, Context=81c429b8, IRQL=0
[621480 ms]  <<<  URB 761 coming back  <<< 
-- URB_FUNCTION_RESET_PIPE:
[621480 ms] UsbSnoop - DispatchAny(f8916610) : IRP_MJ_INTERNAL_DEVICE_CONTROL
[621480 ms] UsbSnoop - MyDispatchInternalIOCTL(f8917e80) : fdo=822eee08, Irp=81ce1a30, IRQL=0
[621480 ms]  >>>  URB 762 going down  >>> 
-- URB_FUNCTION_RESET_PIPE:
  PipeHandle = 82300f14 [endpoint 0x00000002]
[621481 ms] UsbSnoop - MyInternalIOCTLCompletion(f8917db0) : fido=00000000, Irp=81ce1a30, Context=81adb8c0, IRQL=0
[621481 ms]  <<<  URB 762 coming back  <<< 
-- URB_FUNCTION_RESET_PIPE:
[622481 ms] UsbSnoop - DispatchAny(f8916610) : IRP_MJ_INTERNAL_DEVICE_CONTROL
[622481 ms] UsbSnoop - MyDispatchInternalIOCTL(f8917e80) : fdo=822eee08, Irp=81ce1a30, IRQL=0
[622481 ms]  >>>  URB 763 going down  >>> 
-- URB_FUNCTION_RESET_PIPE:
  PipeHandle = 82300ef4 [endpoint 0x00000081]
[622482 ms] UsbSnoop - MyInternalIOCTLCompletion(f8917db0) : fido=00000000, Irp=81ce1a30, Context=81adb8c0, IRQL=0
[622482 ms]  <<<  URB 763 coming back  <<< 
-- URB_FUNCTION_RESET_PIPE:
[622482 ms] UsbSnoop - DispatchAny(f8916610) : IRP_MJ_INTERNAL_DEVICE_CONTROL
[622482 ms] UsbSnoop - MyDispatchInternalIOCTL(f8917e80) : fdo=822eee08, Irp=81ce1a30, IRQL=0
[622482 ms]  >>>  URB 764 going down  >>> 
-- URB_FUNCTION_RESET_PIPE:
  PipeHandle = 82300f14 [endpoint 0x00000002]
[622482 ms] UsbSnoop - MyInternalIOCTLCompletion(f8917db0) : fido=00000000, Irp=81ce1a30, Context=81b4d110, IRQL=0
[622482 ms]  <<<  URB 764 coming back  <<< 
-- URB_FUNCTION_RESET_PIPE:
[622482 ms] UsbSnoop - DispatchAny(f8916610) : IRP_MJ_INTERNAL_DEVICE_CONTROL
[622482 ms] UsbSnoop - MyDispatchInternalIOCTL(f8917e80) : fdo=822eee08, Irp=81b22778, IRQL=0
[623483 ms] UsbSnoop - IRP_MJ_POWER (IRP_MN_WAIT_WAKE)
[623483 ms] UsbSnoop - DispatchAny(f8916610) : IRP_MJ_INTERNAL_DEVICE_CONTROL
[623483 ms] UsbSnoop - MyDispatchInternalIOCTL(f8917e80) : fdo=822eee08, Irp=81b24958, IRQL=0
[623483 ms]  >>>  URB 765 going down  >>> 
-- URB_FUNCTION_GET_DESCRIPTOR_FROM_DEVICE:
  TransferBufferLength = 00000012
  TransferBuffer       = e238aef8
  TransferBufferMDL    = 00000000
  Index                = 00000000
  DescriptorType       = 00000001 (USB_DEVICE_DESCRIPTOR_TYPE)
  LanguageId           = 00000000
[623483 ms] UsbSnoop - MyInternalIOCTLCompletion(f8917db0) : fido=00000000, Irp=81b24958, Context=81ca3a10, IRQL=2
[623483 ms]  <<<  URB 765 coming back  <<< 
-- URB_FUNCTION_CONTROL_TRANSFER:
  PipeHandle           = 82149668
  TransferFlags        = 81b76e4b (USBD_TRANSFER_DIRECTION_IN, USBD_SHORT_TRANSFER_OK)
  TransferBufferLength = 00000012
  TransferBuffer       = e238aef8
  TransferBufferMDL    = 81b65b08
    00000000: 12 01 00 02 00 00 00 40 51 04 04 e0 00 03 01 02
    00000010: 00 01
  UrbLink              = 00000000
  SetupPacket          =
    00000000: 80 06 00 01 00 00 12 00
[623483 ms] UsbSnoop - DispatchAny(f8916610) : IRP_MJ_INTERNAL_DEVICE_CONTROL
[623483 ms] UsbSnoop - MyDispatchInternalIOCTL(f8917e80) : fdo=822eee08, Irp=81c2c5d8, IRQL=0
[623483 ms] UsbSnoop - IRP_MJ_POWER (IRP_MN_WAIT_WAKE)
[623484 ms] UsbSnoop - DispatchAny(f8916610) : IRP_MJ_INTERNAL_DEVICE_CONTROL
[623484 ms] UsbSnoop - MyDispatchInternalIOCTL(f8917e80) : fdo=822eee08, Irp=81c2c5d8, IRQL=0
[623484 ms]  >>>  URB 766 going down  >>> 
-- URB_FUNCTION_RESET_PIPE:
  PipeHandle = 82300ef4 [endpoint 0x00000081]
[623484 ms] UsbSnoop - MyInternalIOCTLCompletion(f8917db0) : fido=00000000, Irp=81c2c5d8, Context=82304d38, IRQL=0
[623484 ms]  <<<  URB 766 coming back  <<< 
-- URB_FUNCTION_RESET_PIPE:
[623484 ms] UsbSnoop - DispatchAny(f8916610) : IRP_MJ_INTERNAL_DEVICE_CONTROL
[623484 ms] UsbSnoop - MyDispatchInternalIOCTL(f8917e80) : fdo=822eee08, Irp=81c2c5d8, IRQL=0
[623484 ms]  >>>  URB 767 going down  >>> 
-- URB_FUNCTION_RESET_PIPE:
  PipeHandle = 82300f14 [endpoint 0x00000002]
[623484 ms] UsbSnoop - MyInternalIOCTLCompletion(f8917db0) : fido=00000000, Irp=81c2c5d8, Context=81d30f40, IRQL=0
[623484 ms]  <<<  URB 767 coming back  <<< 
-- URB_FUNCTION_RESET_PIPE:
[624745 ms] UsbSnoop - DispatchAny(f8916610) : IRP_MJ_INTERNAL_DEVICE_CONTROL
[624745 ms] UsbSnoop - MyDispatchInternalIOCTL(f8917e80) : fdo=822eee08, Irp=81d19818, IRQL=2
[624745 ms]  >>>  URB 768 going down  >>> 
-- URB_FUNCTION_BULK_OR_INTERRUPT_TRANSFER:
  PipeHandle           = 82300f14 [endpoint 0x00000002]
  TransferFlags        = 00000000 (USBD_TRANSFER_DIRECTION_OUT, ~USBD_SHORT_TRANSFER_OK)
  TransferBufferLength = 00000009
  TransferBuffer       = 00000000
  TransferBufferMDL    = 81ac92e0
    00000000: 00 00 00 04 01 00 00 04 00
  UrbLink              = 00000000
[624745 ms] UsbSnoop - MyInternalIOCTLCompletion(f8917db0) : fido=81b964f0, Irp=81d19818, Context=81ca3a10, IRQL=2
[624745 ms]  <<<  URB 768 coming back  <<< 
-- URB_FUNCTION_BULK_OR_INTERRUPT_TRANSFER:
  PipeHandle           = 82300f14 [endpoint 0x00000002]
  TransferFlags        = 00000000 (USBD_TRANSFER_DIRECTION_OUT, ~USBD_SHORT_TRANSFER_OK)
  TransferBufferLength = 00000009
  TransferBuffer       = 00000000
  TransferBufferMDL    = 81ac92e0
  UrbLink              = 00000000
[624745 ms] UsbSnoop - DispatchAny(f8916610) : IRP_MJ_INTERNAL_DEVICE_CONTROL
[624745 ms] UsbSnoop - MyDispatchInternalIOCTL(f8917e80) : fdo=822eee08, Irp=81d19818, IRQL=2
[624745 ms]  >>>  URB 769 going down  >>> 
-- URB_FUNCTION_BULK_OR_INTERRUPT_TRANSFER:
  PipeHandle           = 82300ef4 [endpoint 0x00000081]
  TransferFlags        = 00000003 (USBD_TRANSFER_DIRECTION_IN, USBD_SHORT_TRANSFER_OK)
  TransferBufferLength = 00000100
  TransferBuffer       = 00000000
  TransferBufferMDL    = 81ac92e0
  UrbLink              = 00000000
[624747 ms] UsbSnoop - MyInternalIOCTLCompletion(f8917db0) : fido=81b964f0, Irp=81d19818, Context=81abee68, IRQL=2
[624747 ms]  <<<  URB 769 coming back  <<< 
-- URB_FUNCTION_BULK_OR_INTERRUPT_TRANSFER:
  PipeHandle           = 82300ef4 [endpoint 0x00000081]
  TransferFlags        = 00000003 (USBD_TRANSFER_DIRECTION_IN, USBD_SHORT_TRANSFER_OK)
  TransferBufferLength = 00000009
  TransferBuffer       = 00000000
  TransferBufferMDL    = 81ac92e0
    00000000: 00 00 00 04 02 00 00 03 ff
  UrbLink              = 00000000
[624775 ms] UsbSnoop - DispatchAny(f8916610) : IRP_MJ_INTERNAL_DEVICE_CONTROL
[624775 ms] UsbSnoop - MyDispatchInternalIOCTL(f8917e80) : fdo=822eee08, Irp=81d19818, IRQL=2
[624775 ms]  >>>  URB 770 going down  >>> 
-- URB_FUNCTION_BULK_OR_INTERRUPT_TRANSFER:
  PipeHandle           = 82300f14 [endpoint 0x00000002]
  TransferFlags        = 00000000 (USBD_TRANSFER_DIRECTION_OUT, ~USBD_SHORT_TRANSFER_OK)
  TransferBufferLength = 00000015
  TransferBuffer       = 00000000
  TransferBufferMDL    = 81ac92e0
    00000000: 00 00 00 10 04 00 00 00 0a 00 01 00 03 00 01 00
    00000010: 00 00 00 07 d0
  UrbLink              = 00000000
[624775 ms] UsbSnoop - MyInternalIOCTLCompletion(f8917db0) : fido=81b964f0, Irp=81d19818, Context=81b4ccc0, IRQL=2
[624775 ms]  <<<  URB 770 coming back  <<< 
-- URB_FUNCTION_BULK_OR_INTERRUPT_TRANSFER:
  PipeHandle           = 82300f14 [endpoint 0x00000002]
  TransferFlags        = 00000000 (USBD_TRANSFER_DIRECTION_OUT, ~USBD_SHORT_TRANSFER_OK)
  TransferBufferLength = 00000015
  TransferBuffer       = 00000000
  TransferBufferMDL    = 81ac92e0
  UrbLink              = 00000000
[624785 ms] UsbSnoop - DispatchAny(f8916610) : IRP_MJ_INTERNAL_DEVICE_CONTROL
[624785 ms] UsbSnoop - MyDispatchInternalIOCTL(f8917e80) : fdo=822eee08, Irp=81d19818, IRQL=2
[624785 ms]  >>>  URB 771 going down  >>> 
-- URB_FUNCTION_BULK_OR_INTERRUPT_TRANSFER:
  PipeHandle           = 82300ef4 [endpoint 0x00000081]
  TransferFlags        = 00000003 (USBD_TRANSFER_DIRECTION_IN, USBD_SHORT_TRANSFER_OK)
  TransferBufferLength = 00000100
  TransferBuffer       = 00000000
  TransferBufferMDL    = 81ac92e0
  UrbLink              = 00000000
[624785 ms] UsbSnoop - MyInternalIOCTLCompletion(f8917db0) : fido=81b964f0, Irp=81d19818, Context=81abee68, IRQL=2
[624785 ms]  <<<  URB 771 coming back  <<< 
-- URB_FUNCTION_BULK_OR_INTERRUPT_TRANSFER:
  PipeHandle           = 82300ef4 [endpoint 0x00000081]
  TransferFlags        = 00000003 (USBD_TRANSFER_DIRECTION_IN, USBD_SHORT_TRANSFER_OK)
  TransferBufferLength = 00000007
  TransferBuffer       = 00000000
  TransferBufferMDL    = 81ac92e0
    00000000: 00 00 00 02 05 e0 00
  UrbLink              = 00000000
[624825 ms] UsbSnoop - DispatchAny(f8916610) : IRP_MJ_INTERNAL_DEVICE_CONTROL
[624825 ms] UsbSnoop - MyDispatchInternalIOCTL(f8917e80) : fdo=822eee08, Irp=81d19818, IRQL=2
[624825 ms]  >>>  URB 772 going down  >>> 
-- URB_FUNCTION_BULK_OR_INTERRUPT_TRANSFER:
  PipeHandle           = 82300ef4 [endpoint 0x00000081]
  TransferFlags        = 00000003 (USBD_TRANSFER_DIRECTION_IN, USBD_SHORT_TRANSFER_OK)
  TransferBufferLength = 00000100
  TransferBuffer       = 00000000
  TransferBufferMDL    = 81ac92e0
  UrbLink              = 00000000
[624825 ms] UsbSnoop - MyInternalIOCTLCompletion(f8917db0) : fido=81b964f0, Irp=81d19818, Context=81bbf2f0, IRQL=2
[624825 ms]  <<<  URB 772 coming back  <<< 
-- URB_FUNCTION_BULK_OR_INTERRUPT_TRANSFER:
  PipeHandle           = 82300ef4 [endpoint 0x00000081]
  TransferFlags        = 00000003 (USBD_TRANSFER_DIRECTION_IN, USBD_SHORT_TRANSFER_OK)
  TransferBufferLength = 00000005
  TransferBuffer       = 00000000
  TransferBufferMDL    = 81ac92e0
    00000000: 00 00 00 0a 04
  UrbLink              = 00000000
[624855 ms] UsbSnoop - DispatchAny(f8916610) : IRP_MJ_INTERNAL_DEVICE_CONTROL
[624855 ms] UsbSnoop - MyDispatchInternalIOCTL(f8917e80) : fdo=822eee08, Irp=81d19818, IRQL=2
[624855 ms]  >>>  URB 773 going down  >>> 
-- URB_FUNCTION_BULK_OR_INTERRUPT_TRANSFER:
  PipeHandle           = 82300ef4 [endpoint 0x00000081]
  TransferFlags        = 00000003 (USBD_TRANSFER_DIRECTION_IN, USBD_SHORT_TRANSFER_OK)
  TransferBufferLength = 00000100
  TransferBuffer       = 00000000
  TransferBufferMDL    = 81ac92e0
  UrbLink              = 00000000
[624855 ms] UsbSnoop - MyInternalIOCTLCompletion(f8917db0) : fido=81b964f0, Irp=81d19818, Context=81abee68, IRQL=2
[624855 ms]  <<<  URB 773 coming back  <<< 
-- URB_FUNCTION_BULK_OR_INTERRUPT_TRANSFER:
  PipeHandle           = 82300ef4 [endpoint 0x00000081]
  TransferFlags        = 00000003 (USBD_TRANSFER_DIRECTION_IN, USBD_SHORT_TRANSFER_OK)
  TransferBufferLength = 0000000a
  TransferBuffer       = 00000000
  TransferBufferMDL    = 81ac92e0
    00000000: 00 00 00 04 00 12 00 00 07 d0
  UrbLink              = 00000000
[624885 ms] UsbSnoop - DispatchAny(f8916610) : IRP_MJ_INTERNAL_DEVICE_CONTROL
[624885 ms] UsbSnoop - MyDispatchInternalIOCTL(f8917e80) : fdo=822eee08, Irp=81d19818, IRQL=2
[624885 ms]  >>>  URB 774 going down  >>> 
-- URB_FUNCTION_BULK_OR_INTERRUPT_TRANSFER:
  PipeHandle           = 82300f14 [endpoint 0x00000002]
  TransferFlags        = 00000000 (USBD_TRANSFER_DIRECTION_OUT, ~USBD_SHORT_TRANSFER_OK)
  TransferBufferLength = 00000007
  TransferBuffer       = 00000000
  TransferBufferMDL    = 81ac92e0
    00000000: 00 00 00 02 05 e0 00
  UrbLink              = 00000000
[624885 ms] UsbSnoop - MyInternalIOCTLCompletion(f8917db0) : fido=81b964f0, Irp=81d19818, Context=81cb4e48, IRQL=2
[624885 ms]  <<<  URB 774 coming back  <<< 
-- URB_FUNCTION_BULK_OR_INTERRUPT_TRANSFER:
  PipeHandle           = 82300f14 [endpoint 0x00000002]
  TransferFlags        = 00000000 (USBD_TRANSFER_DIRECTION_OUT, ~USBD_SHORT_TRANSFER_OK)
  TransferBufferLength = 00000007
  TransferBuffer       = 00000000
  TransferBufferMDL    = 81ac92e0
  UrbLink              = 00000000
[624896 ms] UsbSnoop - DispatchAny(f8916610) : IRP_MJ_INTERNAL_DEVICE_CONTROL
[624896 ms] UsbSnoop - MyDispatchInternalIOCTL(f8917e80) : fdo=822eee08, Irp=81d19818, IRQL=2
[624896 ms]  >>>  URB 775 going down  >>> 
-- URB_FUNCTION_BULK_OR_INTERRUPT_TRANSFER:
  PipeHandle           = 82300f14 [endpoint 0x00000002]
  TransferFlags        = 00000000 (USBD_TRANSFER_DIRECTION_OUT, ~USBD_SHORT_TRANSFER_OK)
  TransferBufferLength = 00000022
  TransferBuffer       = 00000000
  TransferBufferMDL    = 81ac92e0
    00000000: 00 00 00 1d 04 00 00 00 17 00 09 00 00 00 06 00
    00000010: 02 00 03 00 05 00 01 00 41 00 42 00 01 00 01 00
    00000020: 01 01
  UrbLink              = 00000000
[624896 ms] UsbSnoop - MyInternalIOCTLCompletion(f8917db0) : fido=81b964f0, Irp=81d19818, Context=822fdcd0, IRQL=2
[624896 ms]  <<<  URB 775 coming back  <<< 
-- URB_FUNCTION_BULK_OR_INTERRUPT_TRANSFER:
  PipeHandle           = 82300f14 [endpoint 0x00000002]
  TransferFlags        = 00000000 (USBD_TRANSFER_DIRECTION_OUT, ~USBD_SHORT_TRANSFER_OK)
  TransferBufferLength = 00000022
  TransferBuffer       = 00000000
  TransferBufferMDL    = 81ac92e0
  UrbLink              = 00000000
[624905 ms] UsbSnoop - DispatchAny(f8916610) : IRP_MJ_INTERNAL_DEVICE_CONTROL
[624905 ms] UsbSnoop - MyDispatchInternalIOCTL(f8917e80) : fdo=822eee08, Irp=81d19818, IRQL=2
[624905 ms]  >>>  URB 776 going down  >>> 
-- URB_FUNCTION_BULK_OR_INTERRUPT_TRANSFER:
  PipeHandle           = 82300ef4 [endpoint 0x00000081]
  TransferFlags        = 00000003 (USBD_TRANSFER_DIRECTION_IN, USBD_SHORT_TRANSFER_OK)
  TransferBufferLength = 00000100
  TransferBuffer       = 00000000
  TransferBufferMDL    = 81ac92e0
  UrbLink              = 00000000
[624905 ms] UsbSnoop - MyInternalIOCTLCompletion(f8917db0) : fido=81b964f0, Irp=81d19818, Context=81abee68, IRQL=2
[624905 ms]  <<<  URB 776 coming back  <<< 
-- URB_FUNCTION_BULK_OR_INTERRUPT_TRANSFER:
  PipeHandle           = 82300ef4 [endpoint 0x00000081]
  TransferFlags        = 00000003 (USBD_TRANSFER_DIRECTION_IN, USBD_SHORT_TRANSFER_OK)
  TransferBufferLength = 00000007
  TransferBuffer       = 00000000
  TransferBufferMDL    = 81ac92e0
    00000000: 00 00 00 02 05 e0 00
  UrbLink              = 00000000
[624945 ms] UsbSnoop - DispatchAny(f8916610) : IRP_MJ_INTERNAL_DEVICE_CONTROL
[624945 ms] UsbSnoop - MyDispatchInternalIOCTL(f8917e80) : fdo=822eee08, Irp=81d19818, IRQL=2
[624945 ms]  >>>  URB 777 going down  >>> 
-- URB_FUNCTION_BULK_OR_INTERRUPT_TRANSFER:
  PipeHandle           = 82300ef4 [endpoint 0x00000081]
  TransferFlags        = 00000003 (USBD_TRANSFER_DIRECTION_IN, USBD_SHORT_TRANSFER_OK)
  TransferBufferLength = 00000100
  TransferBuffer       = 00000000
  TransferBufferMDL    = 81ac92e0
  UrbLink              = 00000000
[624945 ms] UsbSnoop - MyInternalIOCTLCompletion(f8917db0) : fido=81b964f0, Irp=81d19818, Context=822fdcd0, IRQL=2
[624945 ms]  <<<  URB 777 coming back  <<< 
-- URB_FUNCTION_BULK_OR_INTERRUPT_TRANSFER:
  PipeHandle           = 82300ef4 [endpoint 0x00000081]
  TransferFlags        = 00000003 (USBD_TRANSFER_DIRECTION_IN, USBD_SHORT_TRANSFER_OK)
  TransferBufferLength = 00000005
  TransferBuffer       = 00000000
  TransferBufferMDL    = 81ac92e0
    00000000: 00 00 00 33 04
  UrbLink              = 00000000
[624975 ms] UsbSnoop - DispatchAny(f8916610) : IRP_MJ_INTERNAL_DEVICE_CONTROL
[624975 ms] UsbSnoop - MyDispatchInternalIOCTL(f8917e80) : fdo=822eee08, Irp=81d19818, IRQL=2
[624975 ms]  >>>  URB 778 going down  >>> 
-- URB_FUNCTION_BULK_OR_INTERRUPT_TRANSFER:
  PipeHandle           = 82300ef4 [endpoint 0x00000081]
  TransferFlags        = 00000003 (USBD_TRANSFER_DIRECTION_IN, USBD_SHORT_TRANSFER_OK)
  TransferBufferLength = 00000100
  TransferBuffer       = 00000000
  TransferBufferMDL    = 81ac92e0
  UrbLink              = 00000000
[624975 ms] UsbSnoop - MyInternalIOCTLCompletion(f8917db0) : fido=81b964f0, Irp=81d19818, Context=81b06608, IRQL=2
[624975 ms]  <<<  URB 778 coming back  <<< 
-- URB_FUNCTION_BULK_OR_INTERRUPT_TRANSFER:
  PipeHandle           = 82300ef4 [endpoint 0x00000081]
  TransferFlags        = 00000003 (USBD_TRANSFER_DIRECTION_IN, USBD_SHORT_TRANSFER_OK)
  TransferBufferLength = 00000033
  TransferBuffer       = 00000000
  TransferBufferMDL    = 81ac92e0
    00000000: 00 00 00 2d 00 0a 04 6d 61 69 6e 00 00 00 06 00
    00000010: 02 00 00 04 f0 04 00 1f 00 03 00 00 01 00 00 05
    00000020: 02 00 01 00 00 04 00 00 00 0c 00 41 00 00 01 00
    00000030: 00 42 01
  UrbLink              = 00000000
[625005 ms] UsbSnoop - DispatchAny(f8916610) : IRP_MJ_INTERNAL_DEVICE_CONTROL
[625005 ms] UsbSnoop - MyDispatchInternalIOCTL(f8917e80) : fdo=822eee08, Irp=81d19818, IRQL=2
[625005 ms]  >>>  URB 779 going down  >>> 
-- URB_FUNCTION_BULK_OR_INTERRUPT_TRANSFER:
  PipeHandle           = 82300f14 [endpoint 0x00000002]
  TransferFlags        = 00000000 (USBD_TRANSFER_DIRECTION_OUT, ~USBD_SHORT_TRANSFER_OK)
  TransferBufferLength = 00000007
  TransferBuffer       = 00000000
  TransferBufferMDL    = 81ac92e0
    00000000: 00 00 00 02 05 e0 00
  UrbLink              = 00000000
[625005 ms] UsbSnoop - MyInternalIOCTLCompletion(f8917db0) : fido=81b964f0, Irp=81d19818, Context=81b4ccc0, IRQL=2
[625005 ms]  <<<  URB 779 coming back  <<< 
-- URB_FUNCTION_BULK_OR_INTERRUPT_TRANSFER:
  PipeHandle           = 82300f14 [endpoint 0x00000002]
  TransferFlags        = 00000000 (USBD_TRANSFER_DIRECTION_OUT, ~USBD_SHORT_TRANSFER_OK)
  TransferBufferLength = 00000007
  TransferBuffer       = 00000000
  TransferBufferMDL    = 81ac92e0
  UrbLink              = 00000000
[625015 ms] UsbSnoop - DispatchAny(f8916610) : IRP_MJ_INTERNAL_DEVICE_CONTROL
[625015 ms] UsbSnoop - MyDispatchInternalIOCTL(f8917e80) : fdo=822eee08, Irp=81d19818, IRQL=2
[625015 ms]  >>>  URB 780 going down  >>> 
-- URB_FUNCTION_BULK_OR_INTERRUPT_TRANSFER:
  PipeHandle           = 82300ef4 [endpoint 0x00000081]
  TransferFlags        = 00000003 (USBD_TRANSFER_DIRECTION_IN, USBD_SHORT_TRANSFER_OK)
  TransferBufferLength = 00000100
  TransferBuffer       = 00000000
  TransferBufferMDL    = 81ac92e0
  UrbLink              = 00000000
[625015 ms] UsbSnoop - MyInternalIOCTLCompletion(f8917db0) : fido=81b964f0, Irp=81d19818, Context=81cb4e48, IRQL=2
[625015 ms]  <<<  URB 780 coming back  <<< 
-- URB_FUNCTION_BULK_OR_INTERRUPT_TRANSFER:
  PipeHandle           = 82300ef4 [endpoint 0x00000081]
  TransferFlags        = 00000003 (USBD_TRANSFER_DIRECTION_IN, USBD_SHORT_TRANSFER_OK)
  TransferBufferLength = 00000005
  TransferBuffer       = 00000000
  TransferBufferMDL    = 81ac92e0
    00000000: 00 00 00 35 04
  UrbLink              = 00000000
[625045 ms] UsbSnoop - DispatchAny(f8916610) : IRP_MJ_INTERNAL_DEVICE_CONTROL
[625045 ms] UsbSnoop - MyDispatchInternalIOCTL(f8917e80) : fdo=822eee08, Irp=81d19818, IRQL=2
[625045 ms]  >>>  URB 781 going down  >>> 
-- URB_FUNCTION_BULK_OR_INTERRUPT_TRANSFER:
  PipeHandle           = 82300ef4 [endpoint 0x00000081]
  TransferFlags        = 00000003 (USBD_TRANSFER_DIRECTION_IN, USBD_SHORT_TRANSFER_OK)
  TransferBufferLength = 00000100
  TransferBuffer       = 00000000
  TransferBufferMDL    = 81ac92e0
  UrbLink              = 00000000
[625045 ms] UsbSnoop - MyInternalIOCTLCompletion(f8917db0) : fido=81b964f0, Irp=81d19818, Context=81b06608, IRQL=2
[625045 ms]  <<<  URB 781 coming back  <<< 
-- URB_FUNCTION_BULK_OR_INTERRUPT_TRANSFER:
  PipeHandle           = 82300ef4 [endpoint 0x00000081]
  TransferFlags        = 00000003 (USBD_TRANSFER_DIRECTION_IN, USBD_SHORT_TRANSFER_OK)
  TransferBufferLength = 00000035
  TransferBuffer       = 00000000
  TransferBufferMDL    = 81ac92e0
    00000000: 00 00 00 2f 00 0a 04 6d 61 69 6e 00 01 78 00 00
    00000010: 06 00 02 00 00 04 f0 04 00 00 00 03 00 00 01 00
    00000020: 00 05 02 00 01 00 00 04 00 00 00 05 00 41 00 00
    00000030: 01 00 00 42 01
  UrbLink              = 00000000
[625075 ms] UsbSnoop - DispatchAny(f8916610) : IRP_MJ_INTERNAL_DEVICE_CONTROL
[625075 ms] UsbSnoop - MyDispatchInternalIOCTL(f8917e80) : fdo=822eee08, Irp=81d19818, IRQL=2
[625075 ms]  >>>  URB 782 going down  >>> 
-- URB_FUNCTION_BULK_OR_INTERRUPT_TRANSFER:
  PipeHandle           = 82300f14 [endpoint 0x00000002]
  TransferFlags        = 00000000 (USBD_TRANSFER_DIRECTION_OUT, ~USBD_SHORT_TRANSFER_OK)
  TransferBufferLength = 00000007
  TransferBuffer       = 00000000
  TransferBufferMDL    = 81ac92e0
    00000000: 00 00 00 02 05 e0 00
  UrbLink              = 00000000
[625075 ms] UsbSnoop - MyInternalIOCTLCompletion(f8917db0) : fido=81b964f0, Irp=81d19818, Context=81cb4e48, IRQL=2
[625075 ms]  <<<  URB 782 coming back  <<< 
-- URB_FUNCTION_BULK_OR_INTERRUPT_TRANSFER:
  PipeHandle           = 82300f14 [endpoint 0x00000002]
  TransferFlags        = 00000000 (USBD_TRANSFER_DIRECTION_OUT, ~USBD_SHORT_TRANSFER_OK)
  TransferBufferLength = 00000007
  TransferBuffer       = 00000000
  TransferBufferMDL    = 81ac92e0
  UrbLink              = 00000000
[625085 ms] UsbSnoop - DispatchAny(f8916610) : IRP_MJ_INTERNAL_DEVICE_CONTROL
[625085 ms] UsbSnoop - MyDispatchInternalIOCTL(f8917e80) : fdo=822eee08, Irp=81d19818, IRQL=2
[625085 ms]  >>>  URB 783 going down  >>> 
-- URB_FUNCTION_BULK_OR_INTERRUPT_TRANSFER:
  PipeHandle           = 82300ef4 [endpoint 0x00000081]
  TransferFlags        = 00000003 (USBD_TRANSFER_DIRECTION_IN, USBD_SHORT_TRANSFER_OK)
  TransferBufferLength = 00000100
  TransferBuffer       = 00000000
  TransferBufferMDL    = 81ac92e0
  UrbLink              = 00000000
[625085 ms] UsbSnoop - MyInternalIOCTLCompletion(f8917db0) : fido=81b964f0, Irp=81d19818, Context=81bbf2f0, IRQL=2
[625085 ms]  <<<  URB 783 coming back  <<< 
-- URB_FUNCTION_BULK_OR_INTERRUPT_TRANSFER:
  PipeHandle           = 82300ef4 [endpoint 0x00000081]
  TransferFlags        = 00000003 (USBD_TRANSFER_DIRECTION_IN, USBD_SHORT_TRANSFER_OK)
  TransferBufferLength = 00000005
  TransferBuffer       = 00000000
  TransferBufferMDL    = 81ac92e0
    00000000: 00 00 00 35 04
  UrbLink              = 00000000
[625115 ms] UsbSnoop - DispatchAny(f8916610) : IRP_MJ_INTERNAL_DEVICE_CONTROL
[625115 ms] UsbSnoop - MyDispatchInternalIOCTL(f8917e80) : fdo=822eee08, Irp=81d19818, IRQL=2
[625115 ms]  >>>  URB 784 going down  >>> 
-- URB_FUNCTION_BULK_OR_INTERRUPT_TRANSFER:
  PipeHandle           = 82300ef4 [endpoint 0x00000081]
  TransferFlags        = 00000003 (USBD_TRANSFER_DIRECTION_IN, USBD_SHORT_TRANSFER_OK)
  TransferBufferLength = 00000100
  TransferBuffer       = 00000000
  TransferBufferMDL    = 81ac92e0
  UrbLink              = 00000000
[625115 ms] UsbSnoop - MyInternalIOCTLCompletion(f8917db0) : fido=81b964f0, Irp=81d19818, Context=81b06608, IRQL=2
[625115 ms]  <<<  URB 784 coming back  <<< 
-- URB_FUNCTION_BULK_OR_INTERRUPT_TRANSFER:
  PipeHandle           = 82300ef4 [endpoint 0x00000081]
  TransferFlags        = 00000003 (USBD_TRANSFER_DIRECTION_IN, USBD_SHORT_TRANSFER_OK)
  TransferBufferLength = 00000035
  TransferBuffer       = 00000000
  TransferBufferMDL    = 81ac92e0
    00000000: 00 00 00 2f 00 0a 04 6d 61 69 6e 00 01 79 00 00
    00000010: 06 00 02 00 00 04 f0 04 00 00 00 03 00 00 01 00
    00000020: 00 05 02 00 01 00 00 04 00 00 00 05 00 41 00 00
    00000030: 01 01 00 42 01
  UrbLink              = 00000000
[625145 ms] UsbSnoop - DispatchAny(f8916610) : IRP_MJ_INTERNAL_DEVICE_CONTROL
[625145 ms] UsbSnoop - MyDispatchInternalIOCTL(f8917e80) : fdo=822eee08, Irp=81d19818, IRQL=2
[625145 ms]  >>>  URB 785 going down  >>> 
-- URB_FUNCTION_BULK_OR_INTERRUPT_TRANSFER:
  PipeHandle           = 82300f14 [endpoint 0x00000002]
  TransferFlags        = 00000000 (USBD_TRANSFER_DIRECTION_OUT, ~USBD_SHORT_TRANSFER_OK)
  TransferBufferLength = 00000007
  TransferBuffer       = 00000000
  TransferBufferMDL    = 81ac92e0
    00000000: 00 00 00 02 05 e0 00
  UrbLink              = 00000000
[625145 ms] UsbSnoop - MyInternalIOCTLCompletion(f8917db0) : fido=81b964f0, Irp=81d19818, Context=81bbf2f0, IRQL=2
[625145 ms]  <<<  URB 785 coming back  <<< 
-- URB_FUNCTION_BULK_OR_INTERRUPT_TRANSFER:
  PipeHandle           = 82300f14 [endpoint 0x00000002]
  TransferFlags        = 00000000 (USBD_TRANSFER_DIRECTION_OUT, ~USBD_SHORT_TRANSFER_OK)
  TransferBufferLength = 00000007
  TransferBuffer       = 00000000
  TransferBufferMDL    = 81ac92e0
  UrbLink              = 00000000
[625156 ms] UsbSnoop - DispatchAny(f8916610) : IRP_MJ_INTERNAL_DEVICE_CONTROL
[625156 ms] UsbSnoop - MyDispatchInternalIOCTL(f8917e80) : fdo=822eee08, Irp=81d19818, IRQL=2
[625156 ms]  >>>  URB 786 going down  >>> 
-- URB_FUNCTION_BULK_OR_INTERRUPT_TRANSFER:
  PipeHandle           = 82300ef4 [endpoint 0x00000081]
  TransferFlags        = 00000003 (USBD_TRANSFER_DIRECTION_IN, USBD_SHORT_TRANSFER_OK)
  TransferBufferLength = 00000100
  TransferBuffer       = 00000000
  TransferBufferMDL    = 81ac92e0
  UrbLink              = 00000000
[625156 ms] UsbSnoop - MyInternalIOCTLCompletion(f8917db0) : fido=81b964f0, Irp=81d19818, Context=81cb4e48, IRQL=2
[625156 ms]  <<<  URB 786 coming back  <<< 
-- URB_FUNCTION_BULK_OR_INTERRUPT_TRANSFER:
  PipeHandle           = 82300ef4 [endpoint 0x00000081]
  TransferFlags        = 00000003 (USBD_TRANSFER_DIRECTION_IN, USBD_SHORT_TRANSFER_OK)
  TransferBufferLength = 00000005
  TransferBuffer       = 00000000
  TransferBufferMDL    = 81ac92e0
    00000000: 00 00 00 35 04
  UrbLink              = 00000000
[625185 ms] UsbSnoop - DispatchAny(f8916610) : IRP_MJ_INTERNAL_DEVICE_CONTROL
[625185 ms] UsbSnoop - MyDispatchInternalIOCTL(f8917e80) : fdo=822eee08, Irp=81d19818, IRQL=2
[625185 ms]  >>>  URB 787 going down  >>> 
-- URB_FUNCTION_BULK_OR_INTERRUPT_TRANSFER:
  PipeHandle           = 82300ef4 [endpoint 0x00000081]
  TransferFlags        = 00000003 (USBD_TRANSFER_DIRECTION_IN, USBD_SHORT_TRANSFER_OK)
  TransferBufferLength = 00000100
  TransferBuffer       = 00000000
  TransferBufferMDL    = 81ac92e0
  UrbLink              = 00000000
[625185 ms] UsbSnoop - MyInternalIOCTLCompletion(f8917db0) : fido=81b964f0, Irp=81d19818, Context=81bbf2f0, IRQL=2
[625185 ms]  <<<  URB 787 coming back  <<< 
-- URB_FUNCTION_BULK_OR_INTERRUPT_TRANSFER:
  PipeHandle           = 82300ef4 [endpoint 0x00000081]
  TransferFlags        = 00000003 (USBD_TRANSFER_DIRECTION_IN, USBD_SHORT_TRANSFER_OK)
  TransferBufferLength = 00000035
  TransferBuffer       = 00000000
  TransferBufferMDL    = 81ac92e0
    00000000: 00 00 00 2f 00 0a 04 6d 61 69 6e 00 01 7a 00 00
    00000010: 06 00 02 00 00 04 f0 04 00 00 00 03 00 00 01 01
    00000020: 00 05 02 00 01 00 00 04 00 00 00 05 00 41 00 00
    00000030: 01 01 00 42 01
  UrbLink              = 00000000
[625215 ms] UsbSnoop - DispatchAny(f8916610) : IRP_MJ_INTERNAL_DEVICE_CONTROL
[625215 ms] UsbSnoop - MyDispatchInternalIOCTL(f8917e80) : fdo=822eee08, Irp=81d19818, IRQL=2
[625215 ms]  >>>  URB 788 going down  >>> 
-- URB_FUNCTION_BULK_OR_INTERRUPT_TRANSFER:
  PipeHandle           = 82300f14 [endpoint 0x00000002]
  TransferFlags        = 00000000 (USBD_TRANSFER_DIRECTION_OUT, ~USBD_SHORT_TRANSFER_OK)
  TransferBufferLength = 00000007
  TransferBuffer       = 00000000
  TransferBufferMDL    = 81ac92e0
    00000000: 00 00 00 02 05 e0 00
  UrbLink              = 00000000
[625216 ms] UsbSnoop - MyInternalIOCTLCompletion(f8917db0) : fido=81b964f0, Irp=81d19818, Context=81b06608, IRQL=2
[625216 ms]  <<<  URB 788 coming back  <<< 
-- URB_FUNCTION_BULK_OR_INTERRUPT_TRANSFER:
  PipeHandle           = 82300f14 [endpoint 0x00000002]
  TransferFlags        = 00000000 (USBD_TRANSFER_DIRECTION_OUT, ~USBD_SHORT_TRANSFER_OK)
  TransferBufferLength = 00000007
  TransferBuffer       = 00000000
  TransferBufferMDL    = 81ac92e0
  UrbLink              = 00000000
[625225 ms] UsbSnoop - DispatchAny(f8916610) : IRP_MJ_INTERNAL_DEVICE_CONTROL
[625225 ms] UsbSnoop - MyDispatchInternalIOCTL(f8917e80) : fdo=822eee08, Irp=81d19818, IRQL=2
[625225 ms]  >>>  URB 789 going down  >>> 
-- URB_FUNCTION_BULK_OR_INTERRUPT_TRANSFER:
  PipeHandle           = 82300ef4 [endpoint 0x00000081]
  TransferFlags        = 00000003 (USBD_TRANSFER_DIRECTION_IN, USBD_SHORT_TRANSFER_OK)
  TransferBufferLength = 00000100
  TransferBuffer       = 00000000
  TransferBufferMDL    = 81ac92e0
  UrbLink              = 00000000
[625226 ms] UsbSnoop - MyInternalIOCTLCompletion(f8917db0) : fido=81b964f0, Irp=81d19818, Context=81bbf2f0, IRQL=2
[625226 ms]  <<<  URB 789 coming back  <<< 
-- URB_FUNCTION_BULK_OR_INTERRUPT_TRANSFER:
  PipeHandle           = 82300ef4 [endpoint 0x00000081]
  TransferFlags        = 00000003 (USBD_TRANSFER_DIRECTION_IN, USBD_SHORT_TRANSFER_OK)
  TransferBufferLength = 00000005
  TransferBuffer       = 00000000
  TransferBufferMDL    = 81ac92e0
    00000000: 00 00 00 35 04
  UrbLink              = 00000000
[625255 ms] UsbSnoop - DispatchAny(f8916610) : IRP_MJ_INTERNAL_DEVICE_CONTROL
[625255 ms] UsbSnoop - MyDispatchInternalIOCTL(f8917e80) : fdo=822eee08, Irp=81d19818, IRQL=2
[625255 ms]  >>>  URB 790 going down  >>> 
-- URB_FUNCTION_BULK_OR_INTERRUPT_TRANSFER:
  PipeHandle           = 82300ef4 [endpoint 0x00000081]
  TransferFlags        = 00000003 (USBD_TRANSFER_DIRECTION_IN, USBD_SHORT_TRANSFER_OK)
  TransferBufferLength = 00000100
  TransferBuffer       = 00000000
  TransferBufferMDL    = 81ac92e0
  UrbLink              = 00000000
[625256 ms] UsbSnoop - MyInternalIOCTLCompletion(f8917db0) : fido=81b964f0, Irp=81d19818, Context=81abee68, IRQL=2
[625256 ms]  <<<  URB 790 coming back  <<< 
-- URB_FUNCTION_BULK_OR_INTERRUPT_TRANSFER:
  PipeHandle           = 82300ef4 [endpoint 0x00000081]
  TransferFlags        = 00000003 (USBD_TRANSFER_DIRECTION_IN, USBD_SHORT_TRANSFER_OK)
  TransferBufferLength = 00000035
  TransferBuffer       = 00000000
  TransferBufferMDL    = 81ac92e0
    00000000: 00 00 00 2f 00 0a 00 06 55 53 50 52 45 53 00 00
    00000010: 06 00 02 00 00 04 f0 04 00 24 00 03 00 00 01 01
    00000020: 00 05 02 00 01 00 00 04 00 00 82 19 00 41 00 00
    00000030: 01 00 00 42 01
  UrbLink              = 00000000
[625286 ms] UsbSnoop - DispatchAny(f8916610) : IRP_MJ_INTERNAL_DEVICE_CONTROL
[625286 ms] UsbSnoop - MyDispatchInternalIOCTL(f8917e80) : fdo=822eee08, Irp=81c873d8, IRQL=2
[625286 ms]  >>>  URB 791 going down  >>> 
-- URB_FUNCTION_BULK_OR_INTERRUPT_TRANSFER:
  PipeHandle           = 82300f14 [endpoint 0x00000002]
  TransferFlags        = 00000000 (USBD_TRANSFER_DIRECTION_OUT, ~USBD_SHORT_TRANSFER_OK)
  TransferBufferLength = 00000007
  TransferBuffer       = 00000000
  TransferBufferMDL    = 81ac92e0
    00000000: 00 00 00 02 05 e0 00
  UrbLink              = 00000000
[625286 ms] UsbSnoop - MyInternalIOCTLCompletion(f8917db0) : fido=81b964f0, Irp=81c873d8, Context=81b4ccc0, IRQL=2
[625286 ms]  <<<  URB 791 coming back  <<< 
-- URB_FUNCTION_BULK_OR_INTERRUPT_TRANSFER:
  PipeHandle           = 82300f14 [endpoint 0x00000002]
  TransferFlags        = 00000000 (USBD_TRANSFER_DIRECTION_OUT, ~USBD_SHORT_TRANSFER_OK)
  TransferBufferLength = 00000007
  TransferBuffer       = 00000000
  TransferBufferMDL    = 81ac92e0
  UrbLink              = 00000000
[625297 ms] UsbSnoop - DispatchAny(f8916610) : IRP_MJ_INTERNAL_DEVICE_CONTROL
[625297 ms] UsbSnoop - MyDispatchInternalIOCTL(f8917e80) : fdo=822eee08, Irp=81c873d8, IRQL=2
[625297 ms]  >>>  URB 792 going down  >>> 
-- URB_FUNCTION_BULK_OR_INTERRUPT_TRANSFER:
  PipeHandle           = 82300ef4 [endpoint 0x00000081]
  TransferFlags        = 00000003 (USBD_TRANSFER_DIRECTION_IN, USBD_SHORT_TRANSFER_OK)
  TransferBufferLength = 00000100
  TransferBuffer       = 00000000
  TransferBufferMDL    = 81ac92e0
  UrbLink              = 00000000
[625297 ms] UsbSnoop - MyInternalIOCTLCompletion(f8917db0) : fido=81b964f0, Irp=81c873d8, Context=81bbf2f0, IRQL=2
[625297 ms]  <<<  URB 792 coming back  <<< 
-- URB_FUNCTION_BULK_OR_INTERRUPT_TRANSFER:
  PipeHandle           = 82300ef4 [endpoint 0x00000081]
  TransferFlags        = 00000003 (USBD_TRANSFER_DIRECTION_IN, USBD_SHORT_TRANSFER_OK)
  TransferBufferLength = 00000005
  TransferBuffer       = 00000000
  TransferBufferMDL    = 81ac92e0
    00000000: 00 00 00 06 04
  UrbLink              = 00000000
[625326 ms] UsbSnoop - DispatchAny(f8916610) : IRP_MJ_INTERNAL_DEVICE_CONTROL
[625326 ms] UsbSnoop - MyDispatchInternalIOCTL(f8917e80) : fdo=822eee08, Irp=81c873d8, IRQL=2
[625326 ms]  >>>  URB 793 going down  >>> 
-- URB_FUNCTION_BULK_OR_INTERRUPT_TRANSFER:
  PipeHandle           = 82300ef4 [endpoint 0x00000081]
  TransferFlags        = 00000003 (USBD_TRANSFER_DIRECTION_IN, USBD_SHORT_TRANSFER_OK)
  TransferBufferLength = 00000100
  TransferBuffer       = 00000000
  TransferBufferMDL    = 81ac92e0
  UrbLink              = 00000000
[625326 ms] UsbSnoop - MyInternalIOCTLCompletion(f8917db0) : fido=81b964f0, Irp=81c873d8, Context=81b4ccc0, IRQL=2
[625326 ms]  <<<  URB 793 coming back  <<< 
-- URB_FUNCTION_BULK_OR_INTERRUPT_TRANSFER:
  PipeHandle           = 82300ef4 [endpoint 0x00000081]
  TransferFlags        = 00000003 (USBD_TRANSFER_DIRECTION_IN, USBD_SHORT_TRANSFER_OK)
  TransferBufferLength = 00000006
  TransferBuffer       = 00000000
  TransferBufferMDL    = 81ac92e0
    00000000: 00 00 00 00 dd 00
  UrbLink              = 00000000
[625356 ms] UsbSnoop - DispatchAny(f8916610) : IRP_MJ_INTERNAL_DEVICE_CONTROL
[625356 ms] UsbSnoop - MyDispatchInternalIOCTL(f8917e80) : fdo=822eee08, Irp=81c873d8, IRQL=2
[625356 ms]  >>>  URB 794 going down  >>> 
-- URB_FUNCTION_BULK_OR_INTERRUPT_TRANSFER:
  PipeHandle           = 82300f14 [endpoint 0x00000002]
  TransferFlags        = 00000000 (USBD_TRANSFER_DIRECTION_OUT, ~USBD_SHORT_TRANSFER_OK)
  TransferBufferLength = 00000007
  TransferBuffer       = 00000000
  TransferBufferMDL    = 81ac92e0
    00000000: 00 00 00 02 05 e0 00
  UrbLink              = 00000000
[625356 ms] UsbSnoop - MyInternalIOCTLCompletion(f8917db0) : fido=81b964f0, Irp=81c873d8, Context=822fdcd0, IRQL=2
[625356 ms]  <<<  URB 794 coming back  <<< 
-- URB_FUNCTION_BULK_OR_INTERRUPT_TRANSFER:
  PipeHandle           = 82300f14 [endpoint 0x00000002]
  TransferFlags        = 00000000 (USBD_TRANSFER_DIRECTION_OUT, ~USBD_SHORT_TRANSFER_OK)
  TransferBufferLength = 00000007
  TransferBuffer       = 00000000
  TransferBufferMDL    = 81ac92e0
  UrbLink              = 00000000
[625616 ms] UsbSnoop - DispatchAny(f8916610) : IRP_MJ_INTERNAL_DEVICE_CONTROL
[625616 ms] UsbSnoop - MyDispatchInternalIOCTL(f8917e80) : fdo=822eee08, Irp=81c873d8, IRQL=2
[625616 ms]  >>>  URB 795 going down  >>> 
-- URB_FUNCTION_BULK_OR_INTERRUPT_TRANSFER:
  PipeHandle           = 82300f14 [endpoint 0x00000002]
  TransferFlags        = 00000000 (USBD_TRANSFER_DIRECTION_OUT, ~USBD_SHORT_TRANSFER_OK)
  TransferBufferLength = 00000009
  TransferBuffer       = 00000000
  TransferBufferMDL    = 81ac92e0
    00000000: 00 00 00 04 01 00 00 04 00
  UrbLink              = 00000000
[625616 ms] UsbSnoop - MyInternalIOCTLCompletion(f8917db0) : fido=81b964f0, Irp=81c873d8, Context=81cb4e48, IRQL=2
[625616 ms]  <<<  URB 795 coming back  <<< 
-- URB_FUNCTION_BULK_OR_INTERRUPT_TRANSFER:
  PipeHandle           = 82300f14 [endpoint 0x00000002]
  TransferFlags        = 00000000 (USBD_TRANSFER_DIRECTION_OUT, ~USBD_SHORT_TRANSFER_OK)
  TransferBufferLength = 00000009
  TransferBuffer       = 00000000
  TransferBufferMDL    = 81ac92e0
  UrbLink              = 00000000
[625616 ms] UsbSnoop - DispatchAny(f8916610) : IRP_MJ_INTERNAL_DEVICE_CONTROL
[625616 ms] UsbSnoop - MyDispatchInternalIOCTL(f8917e80) : fdo=822eee08, Irp=81c873d8, IRQL=2
[625616 ms]  >>>  URB 796 going down  >>> 
-- URB_FUNCTION_BULK_OR_INTERRUPT_TRANSFER:
  PipeHandle           = 82300ef4 [endpoint 0x00000081]
  TransferFlags        = 00000003 (USBD_TRANSFER_DIRECTION_IN, USBD_SHORT_TRANSFER_OK)
  TransferBufferLength = 00000100
  TransferBuffer       = 00000000
  TransferBufferMDL    = 81ac92e0
  UrbLink              = 00000000
[625618 ms] UsbSnoop - MyInternalIOCTLCompletion(f8917db0) : fido=81b964f0, Irp=81c873d8, Context=81bbf2f0, IRQL=2
[625618 ms]  <<<  URB 796 coming back  <<< 
-- URB_FUNCTION_BULK_OR_INTERRUPT_TRANSFER:
  PipeHandle           = 82300ef4 [endpoint 0x00000081]
  TransferFlags        = 00000003 (USBD_TRANSFER_DIRECTION_IN, USBD_SHORT_TRANSFER_OK)
  TransferBufferLength = 00000009
  TransferBuffer       = 00000000
  TransferBufferMDL    = 81ac92e0
    00000000: 00 00 00 04 02 00 00 03 ff
  UrbLink              = 00000000
[625646 ms] UsbSnoop - DispatchAny(f8916610) : IRP_MJ_INTERNAL_DEVICE_CONTROL
[625646 ms] UsbSnoop - MyDispatchInternalIOCTL(f8917e80) : fdo=822eee08, Irp=81c873d8, IRQL=2
[625646 ms]  >>>  URB 797 going down  >>> 
-- URB_FUNCTION_BULK_OR_INTERRUPT_TRANSFER:
  PipeHandle           = 82300f14 [endpoint 0x00000002]
  TransferFlags        = 00000000 (USBD_TRANSFER_DIRECTION_OUT, ~USBD_SHORT_TRANSFER_OK)
  TransferBufferLength = 00000015
  TransferBuffer       = 00000000
  TransferBufferMDL    = 81ac92e0
    00000000: 00 00 00 10 04 00 00 00 0a 00 01 00 03 00 01 00
    00000010: 00 00 00 07 d0
  UrbLink              = 00000000
[625646 ms] UsbSnoop - MyInternalIOCTLCompletion(f8917db0) : fido=81b964f0, Irp=81c873d8, Context=81abee68, IRQL=2
[625646 ms]  <<<  URB 797 coming back  <<< 
-- URB_FUNCTION_BULK_OR_INTERRUPT_TRANSFER:
  PipeHandle           = 82300f14 [endpoint 0x00000002]
  TransferFlags        = 00000000 (USBD_TRANSFER_DIRECTION_OUT, ~USBD_SHORT_TRANSFER_OK)
  TransferBufferLength = 00000015
  TransferBuffer       = 00000000
  TransferBufferMDL    = 81ac92e0
  UrbLink              = 00000000
[625656 ms] UsbSnoop - DispatchAny(f8916610) : IRP_MJ_INTERNAL_DEVICE_CONTROL
[625656 ms] UsbSnoop - MyDispatchInternalIOCTL(f8917e80) : fdo=822eee08, Irp=81c873d8, IRQL=2
[625656 ms]  >>>  URB 798 going down  >>> 
-- URB_FUNCTION_BULK_OR_INTERRUPT_TRANSFER:
  PipeHandle           = 82300ef4 [endpoint 0x00000081]
  TransferFlags        = 00000003 (USBD_TRANSFER_DIRECTION_IN, USBD_SHORT_TRANSFER_OK)
  TransferBufferLength = 00000100
  TransferBuffer       = 00000000
  TransferBufferMDL    = 81ac92e0
  UrbLink              = 00000000
[625656 ms] UsbSnoop - MyInternalIOCTLCompletion(f8917db0) : fido=81b964f0, Irp=81c873d8, Context=81b4ccc0, IRQL=2
[625656 ms]  <<<  URB 798 coming back  <<< 
-- URB_FUNCTION_BULK_OR_INTERRUPT_TRANSFER:
  PipeHandle           = 82300ef4 [endpoint 0x00000081]
  TransferFlags        = 00000003 (USBD_TRANSFER_DIRECTION_IN, USBD_SHORT_TRANSFER_OK)
  TransferBufferLength = 00000007
  TransferBuffer       = 00000000
  TransferBufferMDL    = 81ac92e0
    00000000: 00 00 00 02 05 e0 00
  UrbLink              = 00000000
[625697 ms] UsbSnoop - DispatchAny(f8916610) : IRP_MJ_INTERNAL_DEVICE_CONTROL
[625697 ms] UsbSnoop - MyDispatchInternalIOCTL(f8917e80) : fdo=822eee08, Irp=81c873d8, IRQL=2
[625697 ms]  >>>  URB 799 going down  >>> 
-- URB_FUNCTION_BULK_OR_INTERRUPT_TRANSFER:
  PipeHandle           = 82300ef4 [endpoint 0x00000081]
  TransferFlags        = 00000003 (USBD_TRANSFER_DIRECTION_IN, USBD_SHORT_TRANSFER_OK)
  TransferBufferLength = 00000100
  TransferBuffer       = 00000000
  TransferBufferMDL    = 81ac92e0
  UrbLink              = 00000000
[625697 ms] UsbSnoop - MyInternalIOCTLCompletion(f8917db0) : fido=81b964f0, Irp=81c873d8, Context=81abee68, IRQL=2
[625697 ms]  <<<  URB 799 coming back  <<< 
-- URB_FUNCTION_BULK_OR_INTERRUPT_TRANSFER:
  PipeHandle           = 82300ef4 [endpoint 0x00000081]
  TransferFlags        = 00000003 (USBD_TRANSFER_DIRECTION_IN, USBD_SHORT_TRANSFER_OK)
  TransferBufferLength = 00000005
  TransferBuffer       = 00000000
  TransferBufferMDL    = 81ac92e0
    00000000: 00 00 00 0a 04
  UrbLink              = 00000000
[625726 ms] UsbSnoop - DispatchAny(f8916610) : IRP_MJ_INTERNAL_DEVICE_CONTROL
[625726 ms] UsbSnoop - MyDispatchInternalIOCTL(f8917e80) : fdo=822eee08, Irp=81c873d8, IRQL=2
[625726 ms]  >>>  URB 800 going down  >>> 
-- URB_FUNCTION_BULK_OR_INTERRUPT_TRANSFER:
  PipeHandle           = 82300ef4 [endpoint 0x00000081]
  TransferFlags        = 00000003 (USBD_TRANSFER_DIRECTION_IN, USBD_SHORT_TRANSFER_OK)
  TransferBufferLength = 00000100
  TransferBuffer       = 00000000
  TransferBufferMDL    = 81ac92e0
  UrbLink              = 00000000
[625726 ms] UsbSnoop - MyInternalIOCTLCompletion(f8917db0) : fido=81b964f0, Irp=81c873d8, Context=81cb4e48, IRQL=2
[625726 ms]  <<<  URB 800 coming back  <<< 
-- URB_FUNCTION_BULK_OR_INTERRUPT_TRANSFER:
  PipeHandle           = 82300ef4 [endpoint 0x00000081]
  TransferFlags        = 00000003 (USBD_TRANSFER_DIRECTION_IN, USBD_SHORT_TRANSFER_OK)
  TransferBufferLength = 0000000a
  TransferBuffer       = 00000000
  TransferBufferMDL    = 81ac92e0
    00000000: 00 00 00 04 00 12 00 00 07 d0
  UrbLink              = 00000000
[625756 ms] UsbSnoop - DispatchAny(f8916610) : IRP_MJ_INTERNAL_DEVICE_CONTROL
[625756 ms] UsbSnoop - MyDispatchInternalIOCTL(f8917e80) : fdo=822eee08, Irp=81c873d8, IRQL=2
[625756 ms]  >>>  URB 801 going down  >>> 
-- URB_FUNCTION_BULK_OR_INTERRUPT_TRANSFER:
  PipeHandle           = 82300f14 [endpoint 0x00000002]
  TransferFlags        = 00000000 (USBD_TRANSFER_DIRECTION_OUT, ~USBD_SHORT_TRANSFER_OK)
  TransferBufferLength = 00000007
  TransferBuffer       = 00000000
  TransferBufferMDL    = 81ac92e0
    00000000: 00 00 00 02 05 e0 00
  UrbLink              = 00000000
[625756 ms] UsbSnoop - MyInternalIOCTLCompletion(f8917db0) : fido=81b964f0, Irp=81c873d8, Context=81bbf2f0, IRQL=2
[625756 ms]  <<<  URB 801 coming back  <<< 
-- URB_FUNCTION_BULK_OR_INTERRUPT_TRANSFER:
  PipeHandle           = 82300f14 [endpoint 0x00000002]
  TransferFlags        = 00000000 (USBD_TRANSFER_DIRECTION_OUT, ~USBD_SHORT_TRANSFER_OK)
  TransferBufferLength = 00000007
  TransferBuffer       = 00000000
  TransferBufferMDL    = 81ac92e0
  UrbLink              = 00000000
[625766 ms] UsbSnoop - DispatchAny(f8916610) : IRP_MJ_INTERNAL_DEVICE_CONTROL
[625766 ms] UsbSnoop - MyDispatchInternalIOCTL(f8917e80) : fdo=822eee08, Irp=81c2c5d8, IRQL=2
[625766 ms]  >>>  URB 802 going down  >>> 
-- URB_FUNCTION_BULK_OR_INTERRUPT_TRANSFER:
  PipeHandle           = 82300f14 [endpoint 0x00000002]
  TransferFlags        = 00000000 (USBD_TRANSFER_DIRECTION_OUT, ~USBD_SHORT_TRANSFER_OK)
  TransferBufferLength = 0000000f
  TransferBuffer       = 00000000
  TransferBufferMDL    = 81ac92e0
    00000000: 00 00 00 0a 04 00 00 00 04 00 07 00 01 00 0e
  UrbLink              = 00000000
[625767 ms] UsbSnoop - MyInternalIOCTLCompletion(f8917db0) : fido=81b964f0, Irp=81c2c5d8, Context=81b06608, IRQL=2
[625767 ms]  <<<  URB 802 coming back  <<< 
-- URB_FUNCTION_BULK_OR_INTERRUPT_TRANSFER:
  PipeHandle           = 82300f14 [endpoint 0x00000002]
  TransferFlags        = 00000000 (USBD_TRANSFER_DIRECTION_OUT, ~USBD_SHORT_TRANSFER_OK)
  TransferBufferLength = 0000000f
  TransferBuffer       = 00000000
  TransferBufferMDL    = 81ac92e0
  UrbLink              = 00000000
[625776 ms] UsbSnoop - DispatchAny(f8916610) : IRP_MJ_INTERNAL_DEVICE_CONTROL
[625776 ms] UsbSnoop - MyDispatchInternalIOCTL(f8917e80) : fdo=822eee08, Irp=81c873d8, IRQL=2
[625776 ms]  >>>  URB 803 going down  >>> 
-- URB_FUNCTION_BULK_OR_INTERRUPT_TRANSFER:
  PipeHandle           = 82300ef4 [endpoint 0x00000081]
  TransferFlags        = 00000003 (USBD_TRANSFER_DIRECTION_IN, USBD_SHORT_TRANSFER_OK)
  TransferBufferLength = 00000100
  TransferBuffer       = 00000000
  TransferBufferMDL    = 81ac92e0
  UrbLink              = 00000000
[625776 ms] UsbSnoop - MyInternalIOCTLCompletion(f8917db0) : fido=81b964f0, Irp=81c873d8, Context=81b4ccc0, IRQL=2
[625776 ms]  <<<  URB 803 coming back  <<< 
-- URB_FUNCTION_BULK_OR_INTERRUPT_TRANSFER:
  PipeHandle           = 82300ef4 [endpoint 0x00000081]
  TransferFlags        = 00000003 (USBD_TRANSFER_DIRECTION_IN, USBD_SHORT_TRANSFER_OK)
  TransferBufferLength = 00000007
  TransferBuffer       = 00000000
  TransferBufferMDL    = 81ac92e0
    00000000: 00 00 00 02 05 e0 00
  UrbLink              = 00000000
[625816 ms] UsbSnoop - DispatchAny(f8916610) : IRP_MJ_INTERNAL_DEVICE_CONTROL
[625816 ms] UsbSnoop - MyDispatchInternalIOCTL(f8917e80) : fdo=822eee08, Irp=81c873d8, IRQL=2
[625816 ms]  >>>  URB 804 going down  >>> 
-- URB_FUNCTION_BULK_OR_INTERRUPT_TRANSFER:
  PipeHandle           = 82300ef4 [endpoint 0x00000081]
  TransferFlags        = 00000003 (USBD_TRANSFER_DIRECTION_IN, USBD_SHORT_TRANSFER_OK)
  TransferBufferLength = 00000100
  TransferBuffer       = 00000000
  TransferBufferMDL    = 81ac92e0
  UrbLink              = 00000000
[625817 ms] UsbSnoop - MyInternalIOCTLCompletion(f8917db0) : fido=81b964f0, Irp=81c873d8, Context=81abee68, IRQL=2
[625817 ms]  <<<  URB 804 coming back  <<< 
-- URB_FUNCTION_BULK_OR_INTERRUPT_TRANSFER:
  PipeHandle           = 82300ef4 [endpoint 0x00000081]
  TransferFlags        = 00000003 (USBD_TRANSFER_DIRECTION_IN, USBD_SHORT_TRANSFER_OK)
  TransferBufferLength = 00000005
  TransferBuffer       = 00000000
  TransferBufferMDL    = 81ac92e0
    00000000: 00 00 00 15 04
  UrbLink              = 00000000
[625846 ms] UsbSnoop - DispatchAny(f8916610) : IRP_MJ_INTERNAL_DEVICE_CONTROL
[625846 ms] UsbSnoop - MyDispatchInternalIOCTL(f8917e80) : fdo=822eee08, Irp=81c873d8, IRQL=2
[625846 ms]  >>>  URB 805 going down  >>> 
-- URB_FUNCTION_BULK_OR_INTERRUPT_TRANSFER:
  PipeHandle           = 82300ef4 [endpoint 0x00000081]
  TransferFlags        = 00000003 (USBD_TRANSFER_DIRECTION_IN, USBD_SHORT_TRANSFER_OK)
  TransferBufferLength = 00000100
  TransferBuffer       = 00000000
  TransferBufferMDL    = 81ac92e0
  UrbLink              = 00000000
[625846 ms] UsbSnoop - MyInternalIOCTLCompletion(f8917db0) : fido=81b964f0, Irp=81c873d8, Context=81cb4e48, IRQL=2
[625847 ms]  <<<  URB 805 coming back  <<< 
-- URB_FUNCTION_BULK_OR_INTERRUPT_TRANSFER:
  PipeHandle           = 82300ef4 [endpoint 0x00000081]
  TransferFlags        = 00000003 (USBD_TRANSFER_DIRECTION_IN, USBD_SHORT_TRANSFER_OK)
  TransferBufferLength = 00000015
  TransferBuffer       = 00000000
  TransferBufferMDL    = 81ac92e0
    00000000: 00 00 00 0f 00 08 00 01 00 0e 00 00 08 00 00 00
    00000010: 00 00 02 f4 4e
  UrbLink              = 00000000
[625876 ms] UsbSnoop - DispatchAny(f8916610) : IRP_MJ_INTERNAL_DEVICE_CONTROL
[625876 ms] UsbSnoop - MyDispatchInternalIOCTL(f8917e80) : fdo=822eee08, Irp=81c873d8, IRQL=2
[625876 ms]  >>>  URB 806 going down  >>> 
-- URB_FUNCTION_BULK_OR_INTERRUPT_TRANSFER:
  PipeHandle           = 82300f14 [endpoint 0x00000002]
  TransferFlags        = 00000000 (USBD_TRANSFER_DIRECTION_OUT, ~USBD_SHORT_TRANSFER_OK)
  TransferBufferLength = 00000007
  TransferBuffer       = 00000000
  TransferBufferMDL    = 81ac92e0
    00000000: 00 00 00 02 05 e0 00
  UrbLink              = 00000000
[625877 ms] UsbSnoop - MyInternalIOCTLCompletion(f8917db0) : fido=81b964f0, Irp=81c873d8, Context=81b4ccc0, IRQL=2
[625877 ms]  <<<  URB 806 coming back  <<< 
-- URB_FUNCTION_BULK_OR_INTERRUPT_TRANSFER:
  PipeHandle           = 82300f14 [endpoint 0x00000002]
  TransferFlags        = 00000000 (USBD_TRANSFER_DIRECTION_OUT, ~USBD_SHORT_TRANSFER_OK)
  TransferBufferLength = 00000007
  TransferBuffer       = 00000000
  TransferBufferMDL    = 81ac92e0
  UrbLink              = 00000000
[626137 ms] UsbSnoop - DispatchAny(f8916610) : IRP_MJ_INTERNAL_DEVICE_CONTROL
[626137 ms] UsbSnoop - MyDispatchInternalIOCTL(f8917e80) : fdo=822eee08, Irp=81c873d8, IRQL=2
[626137 ms]  >>>  URB 807 going down  >>> 
-- URB_FUNCTION_BULK_OR_INTERRUPT_TRANSFER:
  PipeHandle           = 82300f14 [endpoint 0x00000002]
  TransferFlags        = 00000000 (USBD_TRANSFER_DIRECTION_OUT, ~USBD_SHORT_TRANSFER_OK)
  TransferBufferLength = 00000009
  TransferBuffer       = 00000000
  TransferBufferMDL    = 81ac92e0
    00000000: 00 00 00 04 01 00 00 04 00
  UrbLink              = 00000000
[626137 ms] UsbSnoop - MyInternalIOCTLCompletion(f8917db0) : fido=81b964f0, Irp=81c873d8, Context=81cb4e48, IRQL=2
[626137 ms]  <<<  URB 807 coming back  <<< 
-- URB_FUNCTION_BULK_OR_INTERRUPT_TRANSFER:
  PipeHandle           = 82300f14 [endpoint 0x00000002]
  TransferFlags        = 00000000 (USBD_TRANSFER_DIRECTION_OUT, ~USBD_SHORT_TRANSFER_OK)
  TransferBufferLength = 00000009
  TransferBuffer       = 00000000
  TransferBufferMDL    = 81ac92e0
  UrbLink              = 00000000
[626137 ms] UsbSnoop - DispatchAny(f8916610) : IRP_MJ_INTERNAL_DEVICE_CONTROL
[626137 ms] UsbSnoop - MyDispatchInternalIOCTL(f8917e80) : fdo=822eee08, Irp=81c873d8, IRQL=2
[626137 ms]  >>>  URB 808 going down  >>> 
-- URB_FUNCTION_BULK_OR_INTERRUPT_TRANSFER:
  PipeHandle           = 82300ef4 [endpoint 0x00000081]
  TransferFlags        = 00000003 (USBD_TRANSFER_DIRECTION_IN, USBD_SHORT_TRANSFER_OK)
  TransferBufferLength = 00000100
  TransferBuffer       = 00000000
  TransferBufferMDL    = 81ac92e0
  UrbLink              = 00000000
[626139 ms] UsbSnoop - MyInternalIOCTLCompletion(f8917db0) : fido=81b964f0, Irp=81c873d8, Context=822fdcd0, IRQL=2
[626139 ms]  <<<  URB 808 coming back  <<< 
-- URB_FUNCTION_BULK_OR_INTERRUPT_TRANSFER:
  PipeHandle           = 82300ef4 [endpoint 0x00000081]
  TransferFlags        = 00000003 (USBD_TRANSFER_DIRECTION_IN, USBD_SHORT_TRANSFER_OK)
  TransferBufferLength = 00000009
  TransferBuffer       = 00000000
  TransferBufferMDL    = 81ac92e0
    00000000: 00 00 00 04 02 00 00 03 ff
  UrbLink              = 00000000
[626167 ms] UsbSnoop - DispatchAny(f8916610) : IRP_MJ_INTERNAL_DEVICE_CONTROL
[626167 ms] UsbSnoop - MyDispatchInternalIOCTL(f8917e80) : fdo=822eee08, Irp=81c873d8, IRQL=2
[626167 ms]  >>>  URB 809 going down  >>> 
-- URB_FUNCTION_BULK_OR_INTERRUPT_TRANSFER:
  PipeHandle           = 82300f14 [endpoint 0x00000002]
  TransferFlags        = 00000000 (USBD_TRANSFER_DIRECTION_OUT, ~USBD_SHORT_TRANSFER_OK)
  TransferBufferLength = 00000015
  TransferBuffer       = 00000000
  TransferBufferMDL    = 81ac92e0
    00000000: 00 00 00 10 04 00 00 00 0a 00 01 00 03 00 01 00
    00000010: 00 00 00 07 d0
  UrbLink              = 00000000
[626167 ms] UsbSnoop - MyInternalIOCTLCompletion(f8917db0) : fido=81b964f0, Irp=81c873d8, Context=81b4ccc0, IRQL=2
[626167 ms]  <<<  URB 809 coming back  <<< 
-- URB_FUNCTION_BULK_OR_INTERRUPT_TRANSFER:
  PipeHandle           = 82300f14 [endpoint 0x00000002]
  TransferFlags        = 00000000 (USBD_TRANSFER_DIRECTION_OUT, ~USBD_SHORT_TRANSFER_OK)
  TransferBufferLength = 00000015
  TransferBuffer       = 00000000
  TransferBufferMDL    = 81ac92e0
  UrbLink              = 00000000
[626177 ms] UsbSnoop - DispatchAny(f8916610) : IRP_MJ_INTERNAL_DEVICE_CONTROL
[626177 ms] UsbSnoop - MyDispatchInternalIOCTL(f8917e80) : fdo=822eee08, Irp=81c873d8, IRQL=2
[626177 ms]  >>>  URB 810 going down  >>> 
-- URB_FUNCTION_BULK_OR_INTERRUPT_TRANSFER:
  PipeHandle           = 82300ef4 [endpoint 0x00000081]
  TransferFlags        = 00000003 (USBD_TRANSFER_DIRECTION_IN, USBD_SHORT_TRANSFER_OK)
  TransferBufferLength = 00000100
  TransferBuffer       = 00000000
  TransferBufferMDL    = 81ac92e0
  UrbLink              = 00000000
[626177 ms] UsbSnoop - MyInternalIOCTLCompletion(f8917db0) : fido=81b964f0, Irp=81c873d8, Context=822fdcd0, IRQL=2
[626177 ms]  <<<  URB 810 coming back  <<< 
-- URB_FUNCTION_BULK_OR_INTERRUPT_TRANSFER:
  PipeHandle           = 82300ef4 [endpoint 0x00000081]
  TransferFlags        = 00000003 (USBD_TRANSFER_DIRECTION_IN, USBD_SHORT_TRANSFER_OK)
  TransferBufferLength = 00000007
  TransferBuffer       = 00000000
  TransferBufferMDL    = 81ac92e0
    00000000: 00 00 00 02 05 e0 00
  UrbLink              = 00000000
[626217 ms] UsbSnoop - DispatchAny(f8916610) : IRP_MJ_INTERNAL_DEVICE_CONTROL
[626217 ms] UsbSnoop - MyDispatchInternalIOCTL(f8917e80) : fdo=822eee08, Irp=81c873d8, IRQL=2
[626217 ms]  >>>  URB 811 going down  >>> 
-- URB_FUNCTION_BULK_OR_INTERRUPT_TRANSFER:
  PipeHandle           = 82300ef4 [endpoint 0x00000081]
  TransferFlags        = 00000003 (USBD_TRANSFER_DIRECTION_IN, USBD_SHORT_TRANSFER_OK)
  TransferBufferLength = 00000100
  TransferBuffer       = 00000000
  TransferBufferMDL    = 81ac92e0
  UrbLink              = 00000000
[626217 ms] UsbSnoop - MyInternalIOCTLCompletion(f8917db0) : fido=81b964f0, Irp=81c873d8, Context=81b06608, IRQL=2
[626217 ms]  <<<  URB 811 coming back  <<< 
-- URB_FUNCTION_BULK_OR_INTERRUPT_TRANSFER:
  PipeHandle           = 82300ef4 [endpoint 0x00000081]
  TransferFlags        = 00000003 (USBD_TRANSFER_DIRECTION_IN, USBD_SHORT_TRANSFER_OK)
  TransferBufferLength = 00000005
  TransferBuffer       = 00000000
  TransferBufferMDL    = 81ac92e0
    00000000: 00 00 00 0a 04
  UrbLink              = 00000000
[626247 ms] UsbSnoop - DispatchAny(f8916610) : IRP_MJ_INTERNAL_DEVICE_CONTROL
[626247 ms] UsbSnoop - MyDispatchInternalIOCTL(f8917e80) : fdo=822eee08, Irp=81c873d8, IRQL=2
[626247 ms]  >>>  URB 812 going down  >>> 
-- URB_FUNCTION_BULK_OR_INTERRUPT_TRANSFER:
  PipeHandle           = 82300ef4 [endpoint 0x00000081]
  TransferFlags        = 00000003 (USBD_TRANSFER_DIRECTION_IN, USBD_SHORT_TRANSFER_OK)
  TransferBufferLength = 00000100
  TransferBuffer       = 00000000
  TransferBufferMDL    = 81ac92e0
  UrbLink              = 00000000
[626247 ms] UsbSnoop - MyInternalIOCTLCompletion(f8917db0) : fido=81b964f0, Irp=81c873d8, Context=81bbf2f0, IRQL=2
[626247 ms]  <<<  URB 812 coming back  <<< 
-- URB_FUNCTION_BULK_OR_INTERRUPT_TRANSFER:
  PipeHandle           = 82300ef4 [endpoint 0x00000081]
  TransferFlags        = 00000003 (USBD_TRANSFER_DIRECTION_IN, USBD_SHORT_TRANSFER_OK)
  TransferBufferLength = 0000000a
  TransferBuffer       = 00000000
  TransferBufferMDL    = 81ac92e0
    00000000: 00 00 00 04 00 12 00 00 07 d0
  UrbLink              = 00000000
[626277 ms] UsbSnoop - DispatchAny(f8916610) : IRP_MJ_INTERNAL_DEVICE_CONTROL
[626277 ms] UsbSnoop - MyDispatchInternalIOCTL(f8917e80) : fdo=822eee08, Irp=81c873d8, IRQL=2
[626277 ms]  >>>  URB 813 going down  >>> 
-- URB_FUNCTION_BULK_OR_INTERRUPT_TRANSFER:
  PipeHandle           = 82300f14 [endpoint 0x00000002]
  TransferFlags        = 00000000 (USBD_TRANSFER_DIRECTION_OUT, ~USBD_SHORT_TRANSFER_OK)
  TransferBufferLength = 00000007
  TransferBuffer       = 00000000
  TransferBufferMDL    = 81ac92e0
    00000000: 00 00 00 02 05 e0 00
  UrbLink              = 00000000
[626277 ms] UsbSnoop - MyInternalIOCTLCompletion(f8917db0) : fido=81b964f0, Irp=81c873d8, Context=822fdcd0, IRQL=2
[626277 ms]  <<<  URB 813 coming back  <<< 
-- URB_FUNCTION_BULK_OR_INTERRUPT_TRANSFER:
  PipeHandle           = 82300f14 [endpoint 0x00000002]
  TransferFlags        = 00000000 (USBD_TRANSFER_DIRECTION_OUT, ~USBD_SHORT_TRANSFER_OK)
  TransferBufferLength = 00000007
  TransferBuffer       = 00000000
  TransferBufferMDL    = 81ac92e0
  UrbLink              = 00000000
[626287 ms] UsbSnoop - DispatchAny(f8916610) : IRP_MJ_INTERNAL_DEVICE_CONTROL
[626287 ms] UsbSnoop - MyDispatchInternalIOCTL(f8917e80) : fdo=822eee08, Irp=81c873d8, IRQL=2
[626287 ms]  >>>  URB 814 going down  >>> 
-- URB_FUNCTION_BULK_OR_INTERRUPT_TRANSFER:
  PipeHandle           = 82300f14 [endpoint 0x00000002]
  TransferFlags        = 00000000 (USBD_TRANSFER_DIRECTION_OUT, ~USBD_SHORT_TRANSFER_OK)
  TransferBufferLength = 00000010
  TransferBuffer       = 00000000
  TransferBufferMDL    = 81ac92e0
    00000000: 00 00 00 0b 04 00 00 00 05 00 0e 00 37 00 01 01
  UrbLink              = 00000000
[626287 ms] UsbSnoop - MyInternalIOCTLCompletion(f8917db0) : fido=81b964f0, Irp=81c873d8, Context=81bbf2f0, IRQL=2
[626287 ms]  <<<  URB 814 coming back  <<< 
-- URB_FUNCTION_BULK_OR_INTERRUPT_TRANSFER:
  PipeHandle           = 82300f14 [endpoint 0x00000002]
  TransferFlags        = 00000000 (USBD_TRANSFER_DIRECTION_OUT, ~USBD_SHORT_TRANSFER_OK)
  TransferBufferLength = 00000010
  TransferBuffer       = 00000000
  TransferBufferMDL    = 81ac92e0
  UrbLink              = 00000000
[626298 ms] UsbSnoop - DispatchAny(f8916610) : IRP_MJ_INTERNAL_DEVICE_CONTROL
[626298 ms] UsbSnoop - MyDispatchInternalIOCTL(f8917e80) : fdo=822eee08, Irp=81c873d8, IRQL=2
[626298 ms]  >>>  URB 815 going down  >>> 
-- URB_FUNCTION_BULK_OR_INTERRUPT_TRANSFER:
  PipeHandle           = 82300ef4 [endpoint 0x00000081]
  TransferFlags        = 00000003 (USBD_TRANSFER_DIRECTION_IN, USBD_SHORT_TRANSFER_OK)
  TransferBufferLength = 00000100
  TransferBuffer       = 00000000
  TransferBufferMDL    = 81ac92e0
  UrbLink              = 00000000
[626298 ms] UsbSnoop - MyInternalIOCTLCompletion(f8917db0) : fido=81b964f0, Irp=81c873d8, Context=81abee68, IRQL=2
[626298 ms]  <<<  URB 815 coming back  <<< 
-- URB_FUNCTION_BULK_OR_INTERRUPT_TRANSFER:
  PipeHandle           = 82300ef4 [endpoint 0x00000081]
  TransferFlags        = 00000003 (USBD_TRANSFER_DIRECTION_IN, USBD_SHORT_TRANSFER_OK)
  TransferBufferLength = 00000007
  TransferBuffer       = 00000000
  TransferBufferMDL    = 81ac92e0
    00000000: 00 00 00 02 05 e0 00
  UrbLink              = 00000000
[626337 ms] UsbSnoop - DispatchAny(f8916610) : IRP_MJ_INTERNAL_DEVICE_CONTROL
[626337 ms] UsbSnoop - MyDispatchInternalIOCTL(f8917e80) : fdo=822eee08, Irp=81c873d8, IRQL=2
[626337 ms]  >>>  URB 816 going down  >>> 
-- URB_FUNCTION_BULK_OR_INTERRUPT_TRANSFER:
  PipeHandle           = 82300ef4 [endpoint 0x00000081]
  TransferFlags        = 00000003 (USBD_TRANSFER_DIRECTION_IN, USBD_SHORT_TRANSFER_OK)
  TransferBufferLength = 00000100
  TransferBuffer       = 00000000
  TransferBufferMDL    = 81ac92e0
  UrbLink              = 00000000
[626337 ms] UsbSnoop - MyInternalIOCTLCompletion(f8917db0) : fido=81b964f0, Irp=81c873d8, Context=81cb4e48, IRQL=2
[626337 ms]  <<<  URB 816 coming back  <<< 
-- URB_FUNCTION_BULK_OR_INTERRUPT_TRANSFER:
  PipeHandle           = 82300ef4 [endpoint 0x00000081]
  TransferFlags        = 00000003 (USBD_TRANSFER_DIRECTION_IN, USBD_SHORT_TRANSFER_OK)
  TransferBufferLength = 00000005
  TransferBuffer       = 00000000
  TransferBufferMDL    = 81ac92e0
    00000000: 00 00 00 07 04
  UrbLink              = 00000000
[626367 ms] UsbSnoop - DispatchAny(f8916610) : IRP_MJ_INTERNAL_DEVICE_CONTROL
[626367 ms] UsbSnoop - MyDispatchInternalIOCTL(f8917e80) : fdo=822eee08, Irp=81c873d8, IRQL=2
[626367 ms]  >>>  URB 817 going down  >>> 
-- URB_FUNCTION_BULK_OR_INTERRUPT_TRANSFER:
  PipeHandle           = 82300ef4 [endpoint 0x00000081]
  TransferFlags        = 00000003 (USBD_TRANSFER_DIRECTION_IN, USBD_SHORT_TRANSFER_OK)
  TransferBufferLength = 00000100
  TransferBuffer       = 00000000
  TransferBufferMDL    = 81ac92e0
  UrbLink              = 00000000
[626367 ms] UsbSnoop - MyInternalIOCTLCompletion(f8917db0) : fido=81b964f0, Irp=81c873d8, Context=81b06608, IRQL=2
[626367 ms]  <<<  URB 817 coming back  <<< 
-- URB_FUNCTION_BULK_OR_INTERRUPT_TRANSFER:
  PipeHandle           = 82300ef4 [endpoint 0x00000081]
  TransferFlags        = 00000003 (USBD_TRANSFER_DIRECTION_IN, USBD_SHORT_TRANSFER_OK)
  TransferBufferLength = 00000007
  TransferBuffer       = 00000000
  TransferBufferMDL    = 81ac92e0
    00000000: 00 00 00 01 aa 00 01
  UrbLink              = 00000000
[626397 ms] UsbSnoop - DispatchAny(f8916610) : IRP_MJ_INTERNAL_DEVICE_CONTROL
[626397 ms] UsbSnoop - MyDispatchInternalIOCTL(f8917e80) : fdo=822eee08, Irp=81c873d8, IRQL=2
[626397 ms]  >>>  URB 818 going down  >>> 
-- URB_FUNCTION_BULK_OR_INTERRUPT_TRANSFER:
  PipeHandle           = 82300f14 [endpoint 0x00000002]
  TransferFlags        = 00000000 (USBD_TRANSFER_DIRECTION_OUT, ~USBD_SHORT_TRANSFER_OK)
  TransferBufferLength = 00000007
  TransferBuffer       = 00000000
  TransferBufferMDL    = 81ac92e0
    00000000: 00 00 00 02 05 e0 00
  UrbLink              = 00000000
[626397 ms] UsbSnoop - MyInternalIOCTLCompletion(f8917db0) : fido=81b964f0, Irp=81c873d8, Context=822fdcd0, IRQL=2
[626397 ms]  <<<  URB 818 coming back  <<< 
-- URB_FUNCTION_BULK_OR_INTERRUPT_TRANSFER:
  PipeHandle           = 82300f14 [endpoint 0x00000002]
  TransferFlags        = 00000000 (USBD_TRANSFER_DIRECTION_OUT, ~USBD_SHORT_TRANSFER_OK)
  TransferBufferLength = 00000007
  TransferBuffer       = 00000000
  TransferBufferMDL    = 81ac92e0
  UrbLink              = 00000000
[626658 ms] UsbSnoop - DispatchAny(f8916610) : IRP_MJ_INTERNAL_DEVICE_CONTROL
[626658 ms] UsbSnoop - MyDispatchInternalIOCTL(f8917e80) : fdo=822eee08, Irp=81c873d8, IRQL=2
[626658 ms]  >>>  URB 819 going down  >>> 
-- URB_FUNCTION_BULK_OR_INTERRUPT_TRANSFER:
  PipeHandle           = 82300f14 [endpoint 0x00000002]
  TransferFlags        = 00000000 (USBD_TRANSFER_DIRECTION_OUT, ~USBD_SHORT_TRANSFER_OK)
  TransferBufferLength = 00000009
  TransferBuffer       = 00000000
  TransferBufferMDL    = 81ac92e0
    00000000: 00 00 00 04 01 00 00 04 00
  UrbLink              = 00000000
[626658 ms] UsbSnoop - MyInternalIOCTLCompletion(f8917db0) : fido=81b964f0, Irp=81c873d8, Context=81bbf2f0, IRQL=2
[626658 ms]  <<<  URB 819 coming back  <<< 
-- URB_FUNCTION_BULK_OR_INTERRUPT_TRANSFER:
  PipeHandle           = 82300f14 [endpoint 0x00000002]
  TransferFlags        = 00000000 (USBD_TRANSFER_DIRECTION_OUT, ~USBD_SHORT_TRANSFER_OK)
  TransferBufferLength = 00000009
  TransferBuffer       = 00000000
  TransferBufferMDL    = 81ac92e0
  UrbLink              = 00000000
[626659 ms] UsbSnoop - DispatchAny(f8916610) : IRP_MJ_INTERNAL_DEVICE_CONTROL
[626659 ms] UsbSnoop - MyDispatchInternalIOCTL(f8917e80) : fdo=822eee08, Irp=81c873d8, IRQL=2
[626659 ms]  >>>  URB 820 going down  >>> 
-- URB_FUNCTION_BULK_OR_INTERRUPT_TRANSFER:
  PipeHandle           = 82300ef4 [endpoint 0x00000081]
  TransferFlags        = 00000003 (USBD_TRANSFER_DIRECTION_IN, USBD_SHORT_TRANSFER_OK)
  TransferBufferLength = 00000100
  TransferBuffer       = 00000000
  TransferBufferMDL    = 81ac92e0
  UrbLink              = 00000000
[626661 ms] UsbSnoop - MyInternalIOCTLCompletion(f8917db0) : fido=81b964f0, Irp=81c873d8, Context=81b06608, IRQL=2
[626661 ms]  <<<  URB 820 coming back  <<< 
-- URB_FUNCTION_BULK_OR_INTERRUPT_TRANSFER:
  PipeHandle           = 82300ef4 [endpoint 0x00000081]
  TransferFlags        = 00000003 (USBD_TRANSFER_DIRECTION_IN, USBD_SHORT_TRANSFER_OK)
  TransferBufferLength = 00000009
  TransferBuffer       = 00000000
  TransferBufferMDL    = 81ac92e0
    00000000: 00 00 00 04 02 00 00 03 ff
  UrbLink              = 00000000
[626688 ms] UsbSnoop - DispatchAny(f8916610) : IRP_MJ_INTERNAL_DEVICE_CONTROL
[626688 ms] UsbSnoop - MyDispatchInternalIOCTL(f8917e80) : fdo=822eee08, Irp=81c873d8, IRQL=2
[626688 ms]  >>>  URB 821 going down  >>> 
-- URB_FUNCTION_BULK_OR_INTERRUPT_TRANSFER:
  PipeHandle           = 82300f14 [endpoint 0x00000002]
  TransferFlags        = 00000000 (USBD_TRANSFER_DIRECTION_OUT, ~USBD_SHORT_TRANSFER_OK)
  TransferBufferLength = 00000015
  TransferBuffer       = 00000000
  TransferBufferMDL    = 81ac92e0
    00000000: 00 00 00 10 04 00 00 00 0a 00 01 00 03 00 01 00
    00000010: 00 00 00 07 d0
  UrbLink              = 00000000
[626688 ms] UsbSnoop - MyInternalIOCTLCompletion(f8917db0) : fido=81b964f0, Irp=81c873d8, Context=81b4ccc0, IRQL=2
[626688 ms]  <<<  URB 821 coming back  <<< 
-- URB_FUNCTION_BULK_OR_INTERRUPT_TRANSFER:
  PipeHandle           = 82300f14 [endpoint 0x00000002]
  TransferFlags        = 00000000 (USBD_TRANSFER_DIRECTION_OUT, ~USBD_SHORT_TRANSFER_OK)
  TransferBufferLength = 00000015
  TransferBuffer       = 00000000
  TransferBufferMDL    = 81ac92e0
  UrbLink              = 00000000
[626699 ms] UsbSnoop - DispatchAny(f8916610) : IRP_MJ_INTERNAL_DEVICE_CONTROL
[626699 ms] UsbSnoop - MyDispatchInternalIOCTL(f8917e80) : fdo=822eee08, Irp=81c873d8, IRQL=2
[626699 ms]  >>>  URB 822 going down  >>> 
-- URB_FUNCTION_BULK_OR_INTERRUPT_TRANSFER:
  PipeHandle           = 82300ef4 [endpoint 0x00000081]
  TransferFlags        = 00000003 (USBD_TRANSFER_DIRECTION_IN, USBD_SHORT_TRANSFER_OK)
  TransferBufferLength = 00000100
  TransferBuffer       = 00000000
  TransferBufferMDL    = 81ac92e0
  UrbLink              = 00000000
[626699 ms] UsbSnoop - MyInternalIOCTLCompletion(f8917db0) : fido=81b964f0, Irp=81c873d8, Context=81abee68, IRQL=2
[626699 ms]  <<<  URB 822 coming back  <<< 
-- URB_FUNCTION_BULK_OR_INTERRUPT_TRANSFER:
  PipeHandle           = 82300ef4 [endpoint 0x00000081]
  TransferFlags        = 00000003 (USBD_TRANSFER_DIRECTION_IN, USBD_SHORT_TRANSFER_OK)
  TransferBufferLength = 00000007
  TransferBuffer       = 00000000
  TransferBufferMDL    = 81ac92e0
    00000000: 00 00 00 02 05 e0 00
  UrbLink              = 00000000
[626738 ms] UsbSnoop - DispatchAny(f8916610) : IRP_MJ_INTERNAL_DEVICE_CONTROL
[626738 ms] UsbSnoop - MyDispatchInternalIOCTL(f8917e80) : fdo=822eee08, Irp=81c873d8, IRQL=2
[626738 ms]  >>>  URB 823 going down  >>> 
-- URB_FUNCTION_BULK_OR_INTERRUPT_TRANSFER:
  PipeHandle           = 82300ef4 [endpoint 0x00000081]
  TransferFlags        = 00000003 (USBD_TRANSFER_DIRECTION_IN, USBD_SHORT_TRANSFER_OK)
  TransferBufferLength = 00000100
  TransferBuffer       = 00000000
  TransferBufferMDL    = 81ac92e0
  UrbLink              = 00000000
[626738 ms] UsbSnoop - MyInternalIOCTLCompletion(f8917db0) : fido=81b964f0, Irp=81c873d8, Context=81b4ccc0, IRQL=2
[626738 ms]  <<<  URB 823 coming back  <<< 
-- URB_FUNCTION_BULK_OR_INTERRUPT_TRANSFER:
  PipeHandle           = 82300ef4 [endpoint 0x00000081]
  TransferFlags        = 00000003 (USBD_TRANSFER_DIRECTION_IN, USBD_SHORT_TRANSFER_OK)
  TransferBufferLength = 00000005
  TransferBuffer       = 00000000
  TransferBufferMDL    = 81ac92e0
    00000000: 00 00 00 0a 04
  UrbLink              = 00000000
[626768 ms] UsbSnoop - DispatchAny(f8916610) : IRP_MJ_INTERNAL_DEVICE_CONTROL
[626768 ms] UsbSnoop - MyDispatchInternalIOCTL(f8917e80) : fdo=822eee08, Irp=81c66760, IRQL=2
[626768 ms]  >>>  URB 824 going down  >>> 
-- URB_FUNCTION_BULK_OR_INTERRUPT_TRANSFER:
  PipeHandle           = 82300ef4 [endpoint 0x00000081]
  TransferFlags        = 00000003 (USBD_TRANSFER_DIRECTION_IN, USBD_SHORT_TRANSFER_OK)
  TransferBufferLength = 00000100
  TransferBuffer       = 00000000
  TransferBufferMDL    = 81b65b08
  UrbLink              = 00000000
[626768 ms] UsbSnoop - MyInternalIOCTLCompletion(f8917db0) : fido=81b964f0, Irp=81c66760, Context=81cb4e48, IRQL=2
[626768 ms]  <<<  URB 824 coming back  <<< 
-- URB_FUNCTION_BULK_OR_INTERRUPT_TRANSFER:
  PipeHandle           = 82300ef4 [endpoint 0x00000081]
  TransferFlags        = 00000003 (USBD_TRANSFER_DIRECTION_IN, USBD_SHORT_TRANSFER_OK)
  TransferBufferLength = 0000000a
  TransferBuffer       = 00000000
  TransferBufferMDL    = 81b65b08
    00000000: 00 00 00 04 00 12 00 00 07 d0
  UrbLink              = 00000000
[626798 ms] UsbSnoop - DispatchAny(f8916610) : IRP_MJ_INTERNAL_DEVICE_CONTROL
[626798 ms] UsbSnoop - MyDispatchInternalIOCTL(f8917e80) : fdo=822eee08, Irp=81c873d8, IRQL=2
[626798 ms]  >>>  URB 825 going down  >>> 
-- URB_FUNCTION_BULK_OR_INTERRUPT_TRANSFER:
  PipeHandle           = 82300f14 [endpoint 0x00000002]
  TransferFlags        = 00000000 (USBD_TRANSFER_DIRECTION_OUT, ~USBD_SHORT_TRANSFER_OK)
  TransferBufferLength = 00000007
  TransferBuffer       = 00000000
  TransferBufferMDL    = 81b17168
    00000000: 00 00 00 02 05 e0 00
  UrbLink              = 00000000
[626798 ms] UsbSnoop - MyInternalIOCTLCompletion(f8917db0) : fido=81b964f0, Irp=81c873d8, Context=81b4ccc0, IRQL=2
[626798 ms]  <<<  URB 825 coming back  <<< 
-- URB_FUNCTION_BULK_OR_INTERRUPT_TRANSFER:
  PipeHandle           = 82300f14 [endpoint 0x00000002]
  TransferFlags        = 00000000 (USBD_TRANSFER_DIRECTION_OUT, ~USBD_SHORT_TRANSFER_OK)
  TransferBufferLength = 00000007
  TransferBuffer       = 00000000
  TransferBufferMDL    = 81b17168
  UrbLink              = 00000000
[626808 ms] UsbSnoop - DispatchAny(f8916610) : IRP_MJ_INTERNAL_DEVICE_CONTROL
[626808 ms] UsbSnoop - MyDispatchInternalIOCTL(f8917e80) : fdo=822eee08, Irp=81c873d8, IRQL=2
[626808 ms]  >>>  URB 826 going down  >>> 
-- URB_FUNCTION_BULK_OR_INTERRUPT_TRANSFER:
  PipeHandle           = 82300f14 [endpoint 0x00000002]
  TransferFlags        = 00000000 (USBD_TRANSFER_DIRECTION_OUT, ~USBD_SHORT_TRANSFER_OK)
  TransferBufferLength = 0000002d
  TransferBuffer       = 00000000
  TransferBufferMDL    = 81b17168
    00000000: 00 00 00 28 04 00 00 00 22 00 0c 00 06 55 53 50
    00000010: 52 45 53 00 01 ff ff ff ff 00 03 00 03 00 08 00
    00000020: 41 00 01 00 11 00 04 f0 0c 00 24 00 00
  UrbLink              = 00000000
[626808 ms] UsbSnoop - MyInternalIOCTLCompletion(f8917db0) : fido=81b964f0, Irp=81c873d8, Context=81abee68, IRQL=2
[626808 ms]  <<<  URB 826 coming back  <<< 
-- URB_FUNCTION_BULK_OR_INTERRUPT_TRANSFER:
  PipeHandle           = 82300f14 [endpoint 0x00000002]
  TransferFlags        = 00000000 (USBD_TRANSFER_DIRECTION_OUT, ~USBD_SHORT_TRANSFER_OK)
  TransferBufferLength = 0000002d
  TransferBuffer       = 00000000
  TransferBufferMDL    = 81b17168
  UrbLink              = 00000000
[626818 ms] UsbSnoop - DispatchAny(f8916610) : IRP_MJ_INTERNAL_DEVICE_CONTROL
[626818 ms] UsbSnoop - MyDispatchInternalIOCTL(f8917e80) : fdo=822eee08, Irp=81c873d8, IRQL=2
[626818 ms]  >>>  URB 827 going down  >>> 
-- URB_FUNCTION_BULK_OR_INTERRUPT_TRANSFER:
  PipeHandle           = 82300ef4 [endpoint 0x00000081]
  TransferFlags        = 00000003 (USBD_TRANSFER_DIRECTION_IN, USBD_SHORT_TRANSFER_OK)
  TransferBufferLength = 00000100
  TransferBuffer       = 00000000
  TransferBufferMDL    = 81b17168
  UrbLink              = 00000000
[626818 ms] UsbSnoop - MyInternalIOCTLCompletion(f8917db0) : fido=81b964f0, Irp=81c873d8, Context=81b4ccc0, IRQL=2
[626818 ms]  <<<  URB 827 coming back  <<< 
-- URB_FUNCTION_BULK_OR_INTERRUPT_TRANSFER:
  PipeHandle           = 82300ef4 [endpoint 0x00000081]
  TransferFlags        = 00000003 (USBD_TRANSFER_DIRECTION_IN, USBD_SHORT_TRANSFER_OK)
  TransferBufferLength = 00000007
  TransferBuffer       = 00000000
  TransferBufferMDL    = 81b17168
    00000000: 00 00 00 02 05 e0 00
  UrbLink              = 00000000
[626858 ms] UsbSnoop - DispatchAny(f8916610) : IRP_MJ_INTERNAL_DEVICE_CONTROL
[626858 ms] UsbSnoop - MyDispatchInternalIOCTL(f8917e80) : fdo=822eee08, Irp=81c873d8, IRQL=2
[626858 ms]  >>>  URB 828 going down  >>> 
-- URB_FUNCTION_BULK_OR_INTERRUPT_TRANSFER:
  PipeHandle           = 82300ef4 [endpoint 0x00000081]
  TransferFlags        = 00000003 (USBD_TRANSFER_DIRECTION_IN, USBD_SHORT_TRANSFER_OK)
  TransferBufferLength = 00000100
  TransferBuffer       = 00000000
  TransferBufferMDL    = 81b17168
  UrbLink              = 00000000
[626858 ms] UsbSnoop - MyInternalIOCTLCompletion(f8917db0) : fido=81b964f0, Irp=81c873d8, Context=81b4ccc0, IRQL=2
[626858 ms]  <<<  URB 828 coming back  <<< 
-- URB_FUNCTION_BULK_OR_INTERRUPT_TRANSFER:
  PipeHandle           = 82300ef4 [endpoint 0x00000081]
  TransferFlags        = 00000003 (USBD_TRANSFER_DIRECTION_IN, USBD_SHORT_TRANSFER_OK)
  TransferBufferLength = 00000005
  TransferBuffer       = 00000000
  TransferBufferMDL    = 81b17168
    00000000: 00 00 00 26 04
  UrbLink              = 00000000
[626888 ms] UsbSnoop - DispatchAny(f8916610) : IRP_MJ_INTERNAL_DEVICE_CONTROL
[626888 ms] UsbSnoop - MyDispatchInternalIOCTL(f8917e80) : fdo=822eee08, Irp=81cb8e48, IRQL=2
[626888 ms]  >>>  URB 829 going down  >>> 
-- URB_FUNCTION_BULK_OR_INTERRUPT_TRANSFER:
  PipeHandle           = 82300ef4 [endpoint 0x00000081]
  TransferFlags        = 00000003 (USBD_TRANSFER_DIRECTION_IN, USBD_SHORT_TRANSFER_OK)
  TransferBufferLength = 00000100
  TransferBuffer       = 00000000
  TransferBufferMDL    = 81b17168
  UrbLink              = 00000000
[626888 ms] UsbSnoop - MyInternalIOCTLCompletion(f8917db0) : fido=81b964f0, Irp=81cb8e48, Context=822fdcd0, IRQL=2
[626888 ms]  <<<  URB 829 coming back  <<< 
-- URB_FUNCTION_BULK_OR_INTERRUPT_TRANSFER:
  PipeHandle           = 82300ef4 [endpoint 0x00000081]
  TransferFlags        = 00000003 (USBD_TRANSFER_DIRECTION_IN, USBD_SHORT_TRANSFER_OK)
  TransferBufferLength = 00000026
  TransferBuffer       = 00000000
  TransferBufferMDL    = 81b17168
    00000000: 00 00 00 20 00 0a 00 06 55 53 50 52 45 53 00 00
    00000010: 03 00 03 00 00 01 01 00 08 00 00 04 00 00 00 00
    00000020: 00 41 00 00 01 00
  UrbLink              = 00000000
[626918 ms] UsbSnoop - DispatchAny(f8916610) : IRP_MJ_INTERNAL_DEVICE_CONTROL
[626918 ms] UsbSnoop - MyDispatchInternalIOCTL(f8917e80) : fdo=822eee08, Irp=81cb8e48, IRQL=2
[626918 ms]  >>>  URB 830 going down  >>> 
-- URB_FUNCTION_BULK_OR_INTERRUPT_TRANSFER:
  PipeHandle           = 82300f14 [endpoint 0x00000002]
  TransferFlags        = 00000000 (USBD_TRANSFER_DIRECTION_OUT, ~USBD_SHORT_TRANSFER_OK)
  TransferBufferLength = 00000007
  TransferBuffer       = 00000000
  TransferBufferMDL    = 81b17168
    00000000: 00 00 00 02 05 e0 00
  UrbLink              = 00000000
[626918 ms] UsbSnoop - MyInternalIOCTLCompletion(f8917db0) : fido=81b964f0, Irp=81cb8e48, Context=81abee68, IRQL=2
[626918 ms]  <<<  URB 830 coming back  <<< 
-- URB_FUNCTION_BULK_OR_INTERRUPT_TRANSFER:
  PipeHandle           = 82300f14 [endpoint 0x00000002]
  TransferFlags        = 00000000 (USBD_TRANSFER_DIRECTION_OUT, ~USBD_SHORT_TRANSFER_OK)
  TransferBufferLength = 00000007
  TransferBuffer       = 00000000
  TransferBufferMDL    = 81b17168
  UrbLink              = 00000000
[626928 ms] UsbSnoop - DispatchAny(f8916610) : IRP_MJ_INTERNAL_DEVICE_CONTROL
[626928 ms] UsbSnoop - MyDispatchInternalIOCTL(f8917e80) : fdo=822eee08, Irp=81cb8e48, IRQL=2
[626928 ms]  >>>  URB 831 going down  >>> 
-- URB_FUNCTION_BULK_OR_INTERRUPT_TRANSFER:
  PipeHandle           = 82300ef4 [endpoint 0x00000081]
  TransferFlags        = 00000003 (USBD_TRANSFER_DIRECTION_IN, USBD_SHORT_TRANSFER_OK)
  TransferBufferLength = 00000100
  TransferBuffer       = 00000000
  TransferBufferMDL    = 81b17168
  UrbLink              = 00000000
[626928 ms] UsbSnoop - MyInternalIOCTLCompletion(f8917db0) : fido=81b964f0, Irp=81cb8e48, Context=81abee68, IRQL=2
[626928 ms]  <<<  URB 831 coming back  <<< 
-- URB_FUNCTION_BULK_OR_INTERRUPT_TRANSFER:
  PipeHandle           = 82300ef4 [endpoint 0x00000081]
  TransferFlags        = 00000003 (USBD_TRANSFER_DIRECTION_IN, USBD_SHORT_TRANSFER_OK)
  TransferBufferLength = 00000005
  TransferBuffer       = 00000000
  TransferBufferMDL    = 81b17168
    00000000: 00 00 03 ff 03
  UrbLink              = 00000000
[626958 ms] UsbSnoop - DispatchAny(f8916610) : IRP_MJ_INTERNAL_DEVICE_CONTROL
[626958 ms] UsbSnoop - MyDispatchInternalIOCTL(f8917e80) : fdo=822eee08, Irp=81cb8e48, IRQL=2
[626958 ms]  >>>  URB 832 going down  >>> 
-- URB_FUNCTION_BULK_OR_INTERRUPT_TRANSFER:
  PipeHandle           = 82300ef4 [endpoint 0x00000081]
  TransferFlags        = 00000003 (USBD_TRANSFER_DIRECTION_IN, USBD_SHORT_TRANSFER_OK)
  TransferBufferLength = 00000100
  TransferBuffer       = 00000000
  TransferBufferMDL    = 81b17168
  UrbLink              = 00000000
[626960 ms] UsbSnoop - MyInternalIOCTLCompletion(f8917db0) : fido=81b964f0, Irp=81cb8e48, Context=81bbf2f0, IRQL=2
[626960 ms]  <<<  URB 832 coming back  <<< 
-- URB_FUNCTION_BULK_OR_INTERRUPT_TRANSFER:
  PipeHandle           = 82300ef4 [endpoint 0x00000081]
  TransferFlags        = 00000003 (USBD_TRANSFER_DIRECTION_IN, USBD_SHORT_TRANSFER_OK)
  TransferBufferLength = 00000100
  TransferBuffer       = 00000000
  TransferBufferMDL    = 81b17168
    00000000: 00 00 82 19 00 0d 81 0f 00 00 81 d0 81 12 01 03
    00000010: 81 21 00 81 31 00 81 46 55 53 50 52 45 53 03 26
    00000020: 09 04 07 b0 00 4d 02 0d 40 12 1f ed 81 7a 46 b4
    00000030: 03 b0 d7 28 1f d9 0c fa 1a 90 7d b4 e5 64 21 e1
    00000040: a1 a0 5f 1a 43 33 75 a0 12 76 42 6f 6d 70 7a 3b
    00000050: fe 6a 43 ee cf c9 de 33 50 76 21 94 08 19 fb b2
    00000060: ef 69 f2 1c 09 9e 76 20 71 00 01 ff 81 7f 00 00
    00000070: 81 6a 16 7b 53 3d 55 53 50 52 45 53 00 00 00 00
    00000080: 00 00 00 00 00 00 00 00 00 00 00 00 00 00 00 00
    00000090: 00 00 00 00 00 00 00 00 00 00 00 08 00 00 01 ba
    000000a0: 00 00 81 62 00 00 00 08 00 00 00 00 00 00 1e 00
    000000b0: 00 3a 00 00 26 00 00 48 00 00 2e 00 7a e8 00 00
    000000c0: 36 00 7e 4c 00 77 30 80 00 04 00 77 6a 80 00 04
    000000d0: 00 78 60 00 78 36 00 7a f4 80 00 06 00 7b 1a 80
    000000e0: 00 00 00 7b 30 80 00 06 00 7b 50 80 00 04 00 7b
    000000f0: 64 00 78 d8 00 7b 6e 00 00 4f 00 7b 7c 00 02 5c
  UrbLink              = 00000000
[626988 ms] UsbSnoop - DispatchAny(f8916610) : IRP_MJ_INTERNAL_DEVICE_CONTROL
[626988 ms] UsbSnoop - MyDispatchInternalIOCTL(f8917e80) : fdo=822eee08, Irp=81cb8e48, IRQL=2
[626988 ms]  >>>  URB 833 going down  >>> 
-- URB_FUNCTION_BULK_OR_INTERRUPT_TRANSFER:
  PipeHandle           = 82300ef4 [endpoint 0x00000081]
  TransferFlags        = 00000003 (USBD_TRANSFER_DIRECTION_IN, USBD_SHORT_TRANSFER_OK)
  TransferBufferLength = 00000100
  TransferBuffer       = 00000000
  TransferBufferMDL    = 81b17168
  UrbLink              = 00000000
[626990 ms] UsbSnoop - MyInternalIOCTLCompletion(f8917db0) : fido=81b964f0, Irp=81cb8e48, Context=81b06608, IRQL=2
[626990 ms]  <<<  URB 833 coming back  <<< 
-- URB_FUNCTION_BULK_OR_INTERRUPT_TRANSFER:
  PipeHandle           = 82300ef4 [endpoint 0x00000081]
  TransferFlags        = 00000003 (USBD_TRANSFER_DIRECTION_IN, USBD_SHORT_TRANSFER_OK)
  TransferBufferLength = 00000100
  TransferBuffer       = 00000000
  TransferBufferMDL    = 81b17168
    00000000: 00 7b 8a 00 04 69 00 7b 98 00 06 76 00 7b a6 00
    00000010: 08 cd 00 7b b4 00 0b 6e 00 7b c2 00 0d c5 00 7b
    00000020: d0 00 10 66 00 7b de 00 12 81 00 7b ec 00 14 d8
    00000030: 00 7b fa 00 17 2f 00 7c 08 00 19 86 00 7c 16 00
    00000040: 1b dd 00 7c 24 00 1d ea 00 7c 32 00 20 41 00 7c
    00000050: 40 00 22 98 00 7c 4e 00 24 ef 00 7c 5c 00 27 46
    00000060: 00 7c 6a 00 29 53 00 7c 78 00 2b 60 00 7c 86 00
    00000070: 2d b7 00 7c 94 00 30 0e 00 7c a2 00 32 65 00 7c
    00000080: b0 00 34 72 00 7c be 00 36 7f 00 7c cc 00 38 8c
    00000090: 00 7c da 00 3a 99 00 7c e8 00 3c f0 00 7c f6 00
    000000a0: 3f 47 00 7d 04 00 41 9e 00 7d 12 00 48 e4 00 7d
    000000b0: 20 00 56 67 00 7d 2e 00 59 29 00 7d 3c 00 5b 80
    000000c0: 00 7d 4a 00 5d 8d 00 7d 58 00 5f e4 00 7d 66 00
    000000d0: 62 3b 00 7d 74 00 64 92 00 7d 82 00 66 9f 00 7d
    000000e0: 90 00 68 f6 00 7d 9e 00 6b 03 00 7d ac 00 6d 5a
    000000f0: 00 7d ba 00 6f b1 00 7d c8 00 72 08 00 7d d6 00
  UrbLink              = 00000000
[627018 ms] UsbSnoop - DispatchAny(f8916610) : IRP_MJ_INTERNAL_DEVICE_CONTROL
[627018 ms] UsbSnoop - MyDispatchInternalIOCTL(f8917e80) : fdo=822eee08, Irp=81cb8e48, IRQL=2
[627018 ms]  >>>  URB 834 going down  >>> 
-- URB_FUNCTION_BULK_OR_INTERRUPT_TRANSFER:
  PipeHandle           = 82300ef4 [endpoint 0x00000081]
  TransferFlags        = 00000003 (USBD_TRANSFER_DIRECTION_IN, USBD_SHORT_TRANSFER_OK)
  TransferBufferLength = 00000100
  TransferBuffer       = 00000000
  TransferBufferMDL    = 81b17168
  UrbLink              = 00000000
[627020 ms] UsbSnoop - MyInternalIOCTLCompletion(f8917db0) : fido=81b964f0, Irp=81cb8e48, Context=81abee68, IRQL=2
[627020 ms]  <<<  URB 834 coming back  <<< 
-- URB_FUNCTION_BULK_OR_INTERRUPT_TRANSFER:
  PipeHandle           = 82300ef4 [endpoint 0x00000081]
  TransferFlags        = 00000003 (USBD_TRANSFER_DIRECTION_IN, USBD_SHORT_TRANSFER_OK)
  TransferBufferLength = 00000100
  TransferBuffer       = 00000000
  TransferBufferMDL    = 81b17168
    00000000: 74 5f 00 7d e8 00 7a d0 00 7d f2 00 7a dc 00 7d
    00000010: fc 00 7a e2 00 7e c2 00 7e 54 00 7e e4 00 7f 36
    00000020: 00 7e f0 00 7f 68 00 7f a8 00 00 00 ff 00 00 00
    00000030: 00 00 00 00 00 03 00 00 00 01 00 00 00 05 00 00
    00000040: 00 01 00 00 00 01 00 00 00 02 ff ff ff ff 00 00
    00000050: 00 03 ff ff ff ff 00 00 00 04 ff ff ff ff 00 00
    00000060: 00 12 ff ff ff ff 55 53 20 50 72 65 73 69 64 65
    00000070: 6e 74 73 00 55 53 50 52 45 53 00 02 0b 00 4a 00
    00000080: 38 ff ff ff ff ff ff ff ff ff ff ff ff ff ff ff
    00000090: ff ff 8f ff ff ff ff ff e3 00 ff ff ff ff ff 81
    000000a0: 00 0f ff ff ff ff 81 80 01 ff ff ff ef cd 00 00
    000000b0: 1f ff ff ff df 00 00 0f ff ff ff f6 00 00 07 ff
    000000c0: ff 7f e2 30 30 03 ff ff ff e1 00 00 01 ff ff ff
    000000d0: f3 20 06 00 ff ff ff f3 a0 3f 98 ff ff ff fc 00
    000000e0: 3f e0 7f ff fc 78 00 0f e0 7f ff b8 3f f0 0f f0
    000000f0: 7f ff 70 00 30 07 e0 7f fe 70 00 00 07 e0 7f ff
  UrbLink              = 00000000
[627048 ms] UsbSnoop - DispatchAny(f8916610) : IRP_MJ_INTERNAL_DEVICE_CONTROL
[627048 ms] UsbSnoop - MyDispatchInternalIOCTL(f8917e80) : fdo=822eee08, Irp=81cb8e48, IRQL=2
[627048 ms]  >>>  URB 835 going down  >>> 
-- URB_FUNCTION_BULK_OR_INTERRUPT_TRANSFER:
  PipeHandle           = 82300ef4 [endpoint 0x00000081]
  TransferFlags        = 00000003 (USBD_TRANSFER_DIRECTION_IN, USBD_SHORT_TRANSFER_OK)
  TransferBufferLength = 00000100
  TransferBuffer       = 00000000
  TransferBufferMDL    = 81b17168
  UrbLink              = 00000000
[627050 ms] UsbSnoop - MyInternalIOCTLCompletion(f8917db0) : fido=81b964f0, Irp=81cb8e48, Context=81bbf2f0, IRQL=2
[627050 ms]  <<<  URB 835 coming back  <<< 
-- URB_FUNCTION_BULK_OR_INTERRUPT_TRANSFER:
  PipeHandle           = 82300ef4 [endpoint 0x00000081]
  TransferFlags        = 00000003 (USBD_TRANSFER_DIRECTION_IN, USBD_SHORT_TRANSFER_OK)
  TransferBufferLength = 000000ff
  TransferBuffer       = 00000000
  TransferBufferMDL    = 81b17168
    00000000: 30 00 00 07 30 3f fe 68 00 00 07 10 3f fc 60 00
    00000010: 00 1f 00 1f fd e0 00 00 1e 00 00 ff e0 00 00 3e
    00000020: 00 02 fe e0 10 00 07 00 01 ff e0 00 00 13 00 01
    00000030: ff 84 00 00 11 00 07 ff fd f0 00 01 80 07 ff fd
    00000040: 7f 00 80 80 0f ff fc ff c0 c0 c0 07 ff fe 7f c0
    00000050: 00 c0 03 ff fe 3e c0 00 44 07 ff fe 1f 20 00 63
    00000060: 0f ff 9e 1f b0 00 09 8f ff 84 0d 00 00 04 3f ff
    00000070: 0c 04 80 00 06 3f ff 08 00 00 00 64 3f ff 18 00
    00000080: 00 00 60 3f ff 00 00 00 10 65 3f ff 80 00 00 00
    00000090: e3 7f ff 80 18 00 04 e5 ff ff c0 0c 00 07 05 ff
    000000a0: ff f0 0c 00 03 05 ff ff fe ce 00 0c 11 ff ff f3
    000000b0: 87 00 0c 33 ff ff f1 81 00 00 3f ff ff e1 c8 80
    000000c0: 00 1f ff ff cf fc 80 00 1f ff ff c8 0c 00 00 1f
    000000d0: ff ff c0 06 00 00 1f ff ff e7 03 00 00 7f ff fe
    000000e0: c3 80 00 00 ff ff ff a0 00 00 03 ff ff ff 20 02
    000000f0: 00 07 ff ff ff 10 02 00 3f ff ff fe 18 06 00
  UrbLink              = 00000000
[627090 ms] UsbSnoop - DispatchAny(f8916610) : IRP_MJ_INTERNAL_DEVICE_CONTROL
[627090 ms] UsbSnoop - MyDispatchInternalIOCTL(f8917e80) : fdo=822eee08, Irp=81cb8e48, IRQL=2
[627090 ms]  >>>  URB 836 going down  >>> 
-- URB_FUNCTION_BULK_OR_INTERRUPT_TRANSFER:
  PipeHandle           = 82300f14 [endpoint 0x00000002]
  TransferFlags        = 00000000 (USBD_TRANSFER_DIRECTION_OUT, ~USBD_SHORT_TRANSFER_OK)
  TransferBufferLength = 00000007
  TransferBuffer       = 00000000
  TransferBufferMDL    = 81b17168
    00000000: 00 00 00 02 05 e0 00
  UrbLink              = 00000000
[627090 ms] UsbSnoop - MyInternalIOCTLCompletion(f8917db0) : fido=81b964f0, Irp=81cb8e48, Context=81b06608, IRQL=2
[627090 ms]  <<<  URB 836 coming back  <<< 
-- URB_FUNCTION_BULK_OR_INTERRUPT_TRANSFER:
  PipeHandle           = 82300f14 [endpoint 0x00000002]
  TransferFlags        = 00000000 (USBD_TRANSFER_DIRECTION_OUT, ~USBD_SHORT_TRANSFER_OK)
  TransferBufferLength = 00000007
  TransferBuffer       = 00000000
  TransferBufferMDL    = 81b17168
  UrbLink              = 00000000
[627098 ms] UsbSnoop - DispatchAny(f8916610) : IRP_MJ_INTERNAL_DEVICE_CONTROL
[627098 ms] UsbSnoop - MyDispatchInternalIOCTL(f8917e80) : fdo=822eee08, Irp=81cb8e48, IRQL=2
[627098 ms]  >>>  URB 837 going down  >>> 
-- URB_FUNCTION_BULK_OR_INTERRUPT_TRANSFER:
  PipeHandle           = 82300ef4 [endpoint 0x00000081]
  TransferFlags        = 00000003 (USBD_TRANSFER_DIRECTION_IN, USBD_SHORT_TRANSFER_OK)
  TransferBufferLength = 00000100
  TransferBuffer       = 00000000
  TransferBufferMDL    = 81b17168
  UrbLink              = 00000000
[627099 ms] UsbSnoop - MyInternalIOCTLCompletion(f8917db0) : fido=81b964f0, Irp=81cb8e48, Context=81bbf2f0, IRQL=2
[627099 ms]  <<<  URB 837 coming back  <<< 
-- URB_FUNCTION_BULK_OR_INTERRUPT_TRANSFER:
  PipeHandle           = 82300ef4 [endpoint 0x00000081]
  TransferFlags        = 00000003 (USBD_TRANSFER_DIRECTION_IN, USBD_SHORT_TRANSFER_OK)
  TransferBufferLength = 00000005
  TransferBuffer       = 00000000
  TransferBufferMDL    = 81b17168
    00000000: 00 00 03 ff 03
  UrbLink              = 00000000
[627128 ms] UsbSnoop - DispatchAny(f8916610) : IRP_MJ_INTERNAL_DEVICE_CONTROL
[627128 ms] UsbSnoop - MyDispatchInternalIOCTL(f8917e80) : fdo=822eee08, Irp=81cb8e48, IRQL=2
[627128 ms]  >>>  URB 838 going down  >>> 
-- URB_FUNCTION_BULK_OR_INTERRUPT_TRANSFER:
  PipeHandle           = 82300ef4 [endpoint 0x00000081]
  TransferFlags        = 00000003 (USBD_TRANSFER_DIRECTION_IN, USBD_SHORT_TRANSFER_OK)
  TransferBufferLength = 00000100
  TransferBuffer       = 00000000
  TransferBufferMDL    = 81b17168
  UrbLink              = 00000000
[627130 ms] UsbSnoop - MyInternalIOCTLCompletion(f8917db0) : fido=81b964f0, Irp=81cb8e48, Context=822fdcd0, IRQL=2
[627130 ms]  <<<  URB 838 coming back  <<< 
-- URB_FUNCTION_BULK_OR_INTERRUPT_TRANSFER:
  PipeHandle           = 82300ef4 [endpoint 0x00000081]
  TransferFlags        = 00000003 (USBD_TRANSFER_DIRECTION_IN, USBD_SHORT_TRANSFER_OK)
  TransferBufferLength = 00000100
  TransferBuffer       = 00000000
  TransferBufferMDL    = 81b17168
    00000000: 7f ff ff fe f7 86 c1 ff ff ff ff 77 c7 c3 ff ff
    00000010: ff ff 9f ff cf ff ff ff ff ff ff ff ff ff ff ff
    00000020: ff ff ff ff ff ff ff ff ff ff ff ff ff ff ff ff
    00000030: ff ff ff ff ff ff ff ff ff ff ff 8f ff ff ff ff
    00000040: ff ff 00 7f ff ff ff ff ff 00 1f ff ff ff ff ff
    00000050: 80 07 ff ff ff ff ff c0 07 ff ff ff ff ff c0 07
    00000060: ff ff ff ff ff c0 07 ff ff ff ff ff c0 03 ff ff
    00000070: ff ff ff f8 07 ff ff ff ff ff f8 0f ff ff ff ff
    00000080: ff fc 1f ff ff ff ff ff df 02 0b 00 4a 00 37 00
    00000090: 00 00 00 00 00 00 00 00 00 1c 00 00 00 00 00 03
    000000a0: ff fc 00 00 00 00 1f fb fe 00 00 00 00 38 ff ff
    000000b0: c0 00 00 00 10 a6 bf c0 00 00 06 f4 01 b3 f0 00
    000000c0: 00 07 f0 03 b7 f0 00 00 0b 80 03 bc f8 00 00 05
    000000d0: 80 00 2f bc 00 00 44 00 00 03 bc 00 00 84 00 00
    000000e0: 00 1e 00 00 86 00 00 00 0e 00 01 bf 80 00 00 07
    000000f0: 00 01 3f 00 00 00 03 80 01 7c 00 00 00 03 80 03
  UrbLink              = 00000000
[627158 ms] UsbSnoop - DispatchAny(f8916610) : IRP_MJ_INTERNAL_DEVICE_CONTROL
[627159 ms] UsbSnoop - MyDispatchInternalIOCTL(f8917e80) : fdo=822eee08, Irp=81cb8e48, IRQL=2
[627159 ms]  >>>  URB 839 going down  >>> 
-- URB_FUNCTION_BULK_OR_INTERRUPT_TRANSFER:
  PipeHandle           = 82300ef4 [endpoint 0x00000081]
  TransferFlags        = 00000003 (USBD_TRANSFER_DIRECTION_IN, USBD_SHORT_TRANSFER_OK)
  TransferBufferLength = 00000100
  TransferBuffer       = 00000000
  TransferBufferMDL    = 81b17168
  UrbLink              = 00000000
[627161 ms] UsbSnoop - MyInternalIOCTLCompletion(f8917db0) : fido=81b964f0, Irp=81cb8e48, Context=81b06608, IRQL=2
[627161 ms]  <<<  URB 839 coming back  <<< 
-- URB_FUNCTION_BULK_OR_INTERRUPT_TRANSFER:
  PipeHandle           = 82300ef4 [endpoint 0x00000081]
  TransferFlags        = 00000003 (USBD_TRANSFER_DIRECTION_IN, USBD_SHORT_TRANSFER_OK)
  TransferBufferLength = 00000100
  TransferBuffer       = 00000000
  TransferBufferMDL    = 81b17168
    00000000: 5d 00 00 00 03 00 03 f9 80 00 00 03 00 03 fb 80
    00000010: 00 00 01 00 07 ff 80 00 06 03 00 07 ff 80 00 00
    00000020: 01 00 07 fb a0 80 00 01 00 07 38 78 00 00 01 00
    00000030: 07 66 7a 00 00 00 00 06 ee f8 07 80 03 20 00 d8
    00000040: e0 1f fc 5f 00 03 cc e0 7e fd ff c0 07 ff a1 ff
    00000050: f9 f9 a0 0f ff 91 ff f8 ff e0 08 ff c1 f3 dc ff
    00000060: e0 0e ff e0 00 00 14 c0 1e ff f0 00 02 05 80 1f
    00000070: ff f8 00 00 01 80 1f ff fc 00 00 00 00 1f ff ff
    00000080: 00 00 01 00 1f ff ff c0 60 03 00 1f ff ff c0 70
    00000090: 13 00 0f df fd f0 bf b2 00 0f c3 fc f1 9f f2 00
    000000a0: 07 ff ff f9 03 ca 00 07 ff ff b8 03 ca 00 07 ff
    000000b0: ff ba 00 2e 00 03 ff ff b2 00 06 00 03 ff ff 00
    000000c0: ff f6 00 0d ff ff 61 80 36 00 01 ff fe 60 02 04
    000000d0: 00 01 ff ff e0 0f cc 00 00 ff ff fc 7f f8 00 00
    000000e0: 10 ff 7e f0 38 00 00 18 0f fa 00 10 00 00 38 03
    000000f0: fc 00 30 00 00 3c 00 7e 00 00 00 00 7f 00 3f 8e
  UrbLink              = 00000000
[627188 ms] UsbSnoop - DispatchAny(f8916610) : IRP_MJ_INTERNAL_DEVICE_CONTROL
[627188 ms] UsbSnoop - MyDispatchInternalIOCTL(f8917e80) : fdo=822eee08, Irp=81cb8e48, IRQL=2
[627188 ms]  >>>  URB 840 going down  >>> 
-- URB_FUNCTION_BULK_OR_INTERRUPT_TRANSFER:
  PipeHandle           = 82300ef4 [endpoint 0x00000081]
  TransferFlags        = 00000003 (USBD_TRANSFER_DIRECTION_IN, USBD_SHORT_TRANSFER_OK)
  TransferBufferLength = 00000100
  TransferBuffer       = 00000000
  TransferBufferMDL    = 81b17168
  UrbLink              = 00000000
[627191 ms] UsbSnoop - MyInternalIOCTLCompletion(f8917db0) : fido=81b964f0, Irp=81cb8e48, Context=81abee68, IRQL=2
[627191 ms]  <<<  URB 840 coming back  <<< 
-- URB_FUNCTION_BULK_OR_INTERRUPT_TRANSFER:
  PipeHandle           = 82300ef4 [endpoint 0x00000081]
  TransferFlags        = 00000003 (USBD_TRANSFER_DIRECTION_IN, USBD_SHORT_TRANSFER_OK)
  TransferBufferLength = 00000100
  TransferBuffer       = 00000000
  TransferBufferMDL    = 81b17168
    00000000: 40 00 00 7f c0 1f ff c0 00 00 ff f0 1f ff 80 00
    00000010: 00 ff fc 1f ff 80 00 00 ff ff 1f ff 80 00 03 ff
    00000020: ff ff ff c0 00 07 ff ff ff ff c0 00 0f ff ff ff
    00000030: ff e0 00 1f ff ff ff ff f0 00 ff ff ff ef ff f8
    00000040: 00 ff ff ff ef ff be 00 ff ff ff df ff df c0 ff
    00000050: ff ff ff ff c7 f0 ff ff ff ff fe 0f fe ff ff ff
    00000060: bf fc 3f fe ff ff fe 9f ff ff fe ff ff ff 1f 80
    00000070: ff fe ff ff ff 86 00 7f fe ff ff ff 80 00 7f fe
    00000080: ff ff ff c8 00 3f fe ff ff ff ec 00 3f fe ff ff
    00000090: ff f6 00 1f fe df 02 0b 00 4a 00 32 00 00 00 00
    000000a0: 00 00 00 00 00 00 00 00 00 00 00 00 1e 00 00 00
    000000b0: 00 00 01 ff ff 00 00 00 00 03 fd ff 80 00 00 00
    000000c0: 07 ff ff e0 00 00 00 0f ff ff f0 00 00 00 0f ff
    000000d0: ff f8 00 00 00 1f ff ff f8 00 00 00 1f ff ff fc
    000000e0: 00 00 00 3f ff ff fc 00 00 00 7f ff ff fe 00 00
    000000f0: 00 7f ff f3 ff 00 00 00 ff ff 81 ff 80 00 00 fe
  UrbLink              = 00000000
[627219 ms] UsbSnoop - DispatchAny(f8916610) : IRP_MJ_INTERNAL_DEVICE_CONTROL
[627219 ms] UsbSnoop - MyDispatchInternalIOCTL(f8917e80) : fdo=822eee08, Irp=81cb8e48, IRQL=2
[627219 ms]  >>>  URB 841 going down  >>> 
-- URB_FUNCTION_BULK_OR_INTERRUPT_TRANSFER:
  PipeHandle           = 82300ef4 [endpoint 0x00000081]
  TransferFlags        = 00000003 (USBD_TRANSFER_DIRECTION_IN, USBD_SHORT_TRANSFER_OK)
  TransferBufferLength = 00000100
  TransferBuffer       = 00000000
  TransferBufferMDL    = 81b17168
  UrbLink              = 00000000
[627221 ms] UsbSnoop - MyInternalIOCTLCompletion(f8917db0) : fido=81b964f0, Irp=81cb8e48, Context=822fdcd0, IRQL=2
[627221 ms]  <<<  URB 841 coming back  <<< 
-- URB_FUNCTION_BULK_OR_INTERRUPT_TRANSFER:
  PipeHandle           = 82300ef4 [endpoint 0x00000081]
  TransferFlags        = 00000003 (USBD_TRANSFER_DIRECTION_IN, USBD_SHORT_TRANSFER_OK)
  TransferBufferLength = 000000ff
  TransferBuffer       = 00000000
  TransferBufferMDL    = 81b17168
    00000000: 3c 00 7f c0 00 00 7c 00 00 7f 60 00 01 f8 00 00
    00000010: 7f e0 00 01 f0 00 00 1f e0 00 01 f0 00 00 3f e0
    00000020: 00 03 e0 00 00 3f e0 00 03 e0 00 00 1f f0 00 03
    00000030: f8 00 00 3f f0 00 03 e0 00 00 3f f0 00 07 e0 00
    00000040: 00 3f f0 00 0f e0 00 20 3f f0 00 07 e0 01 e0 7f
    00000050: f0 00 07 ff 07 f0 7f fc 00 07 ff df fc ff f4 00
    00000060: 07 ff cf fc 7f f0 00 01 ff c7 fe 3f f8 00 03 ff
    00000070: c3 f6 7f 8c 00 00 ff 81 c0 1f 8c 00 00 fd 81 00
    00000080: 1f cc 00 00 7d 00 00 39 88 00 00 49 00 00 38 80
    00000090: 00 00 40 00 00 78 80 00 00 61 02 00 f8 00 00 00
    000000a0: 61 83 07 f8 00 00 00 33 fd 8f f0 20 00 00 3f fc
    000000b0: da f8 60 00 00 3f e0 6e ed c0 00 00 1f e0 3c 6f
    000000c0: 80 00 00 1f f8 cc 7f 00 00 00 1f ff c8 7e 00 00
    000000d0: 00 1f 00 1e 3c 00 00 00 1f fe 0e 7c 00 00 00 0f
    000000e0: f0 28 7c 00 00 00 0f 07 fe 78 00 00 00 1f ff ff
    000000f0: f0 00 00 00 1f ff ff e0 00 00 00 1f ff ff c0
  UrbLink              = 00000000
[627249 ms] UsbSnoop - DispatchAny(f8916610) : IRP_MJ_INTERNAL_DEVICE_CONTROL
[627249 ms] UsbSnoop - MyDispatchInternalIOCTL(f8917e80) : fdo=822eee08, Irp=81cb8e48, IRQL=2
[627249 ms]  >>>  URB 842 going down  >>> 
-- URB_FUNCTION_BULK_OR_INTERRUPT_TRANSFER:
  PipeHandle           = 82300f14 [endpoint 0x00000002]
  TransferFlags        = 00000000 (USBD_TRANSFER_DIRECTION_OUT, ~USBD_SHORT_TRANSFER_OK)
  TransferBufferLength = 00000007
  TransferBuffer       = 00000000
  TransferBufferMDL    = 81b17168
    00000000: 00 00 00 02 05 e0 00
  UrbLink              = 00000000
[627249 ms] UsbSnoop - MyInternalIOCTLCompletion(f8917db0) : fido=81b964f0, Irp=81cb8e48, Context=81b06608, IRQL=2
[627249 ms]  <<<  URB 842 coming back  <<< 
-- URB_FUNCTION_BULK_OR_INTERRUPT_TRANSFER:
  PipeHandle           = 82300f14 [endpoint 0x00000002]
  TransferFlags        = 00000000 (USBD_TRANSFER_DIRECTION_OUT, ~USBD_SHORT_TRANSFER_OK)
  TransferBufferLength = 00000007
  TransferBuffer       = 00000000
  TransferBufferMDL    = 81b17168
  UrbLink              = 00000000
[627259 ms] UsbSnoop - DispatchAny(f8916610) : IRP_MJ_INTERNAL_DEVICE_CONTROL
[627259 ms] UsbSnoop - MyDispatchInternalIOCTL(f8917e80) : fdo=822eee08, Irp=81ab2e48, IRQL=2
[627259 ms]  >>>  URB 843 going down  >>> 
-- URB_FUNCTION_BULK_OR_INTERRUPT_TRANSFER:
  PipeHandle           = 82300ef4 [endpoint 0x00000081]
  TransferFlags        = 00000003 (USBD_TRANSFER_DIRECTION_IN, USBD_SHORT_TRANSFER_OK)
  TransferBufferLength = 00000100
  TransferBuffer       = 00000000
  TransferBufferMDL    = 81b17168
  UrbLink              = 00000000
[627259 ms] UsbSnoop - MyInternalIOCTLCompletion(f8917db0) : fido=81b964f0, Irp=81ab2e48, Context=822fdcd0, IRQL=2
[627259 ms]  <<<  URB 843 coming back  <<< 
-- URB_FUNCTION_BULK_OR_INTERRUPT_TRANSFER:
  PipeHandle           = 82300ef4 [endpoint 0x00000081]
  TransferFlags        = 00000003 (USBD_TRANSFER_DIRECTION_IN, USBD_SHORT_TRANSFER_OK)
  TransferBufferLength = 00000005
  TransferBuffer       = 00000000
  TransferBufferMDL    = 81b17168
    00000000: 00 00 03 ff 03
  UrbLink              = 00000000
[627289 ms] UsbSnoop - DispatchAny(f8916610) : IRP_MJ_INTERNAL_DEVICE_CONTROL
[627289 ms] UsbSnoop - MyDispatchInternalIOCTL(f8917e80) : fdo=822eee08, Irp=81ab2e48, IRQL=2
[627289 ms]  >>>  URB 844 going down  >>> 
-- URB_FUNCTION_BULK_OR_INTERRUPT_TRANSFER:
  PipeHandle           = 82300ef4 [endpoint 0x00000081]
  TransferFlags        = 00000003 (USBD_TRANSFER_DIRECTION_IN, USBD_SHORT_TRANSFER_OK)
  TransferBufferLength = 00000100
  TransferBuffer       = 00000000
  TransferBufferMDL    = 81b17168
  UrbLink              = 00000000
[627291 ms] UsbSnoop - MyInternalIOCTLCompletion(f8917db0) : fido=81b964f0, Irp=81ab2e48, Context=81b4ccc0, IRQL=2
[627291 ms]  <<<  URB 844 coming back  <<< 
-- URB_FUNCTION_BULK_OR_INTERRUPT_TRANSFER:
  PipeHandle           = 82300ef4 [endpoint 0x00000081]
  TransferFlags        = 00000003 (USBD_TRANSFER_DIRECTION_IN, USBD_SHORT_TRANSFER_OK)
  TransferBufferLength = 00000100
  TransferBuffer       = 00000000
  TransferBufferMDL    = 81b17168
    00000000: 00 00 00 0f ff ff 04 00 00 00 0f ff fe 06 00 00
    00000010: 00 07 ff f8 0e 00 00 00 07 ff f0 1f 00 00 00 03
    00000020: ff c0 3f 00 00 00 01 ff 80 ff 80 00 00 07 fe 01
    00000030: ff 80 00 00 0f f8 06 ff c0 00 00 1f ff 1d ff 60
    00000040: 00 00 3f ff ff ff f0 00 00 7f ff fb fe f8 00 00
    00000050: ff ff e7 ff ff 00 03 bf fe ef fd ff c0 07 3f ff
    00000060: cf fb ff c0 0f 3f ff 0f fb ff c0 1f 83 fe 1f f7
    00000070: ff c0 ff de 7c 3f e7 ff c0 fe fc 00 7f ef ff c0
    00000080: ff f0 00 7f ff ff c0 fd e0 00 ff df ff c0 fb e0
    00000090: 00 ff ff ff c0 fb c0 01 ff ff ff c0 f7 c0 03 ff
    000000a0: ff ff c0 df 02 55 00 4a 00 3c 00 00 00 00 00 00
    000000b0: 00 00 00 00 00 00 00 00 00 00 00 00 00 00 00 00
    000000c0: 00 00 00 00 00 00 00 00 00 00 00 00 00 00 00 00
    000000d0: 00 00 00 00 00 00 00 00 00 00 00 00 00 00 00 00
    000000e0: 00 00 00 00 00 00 00 00 00 00 00 20 00 00 00 00
    000000f0: 00 00 00 00 00 00 00 00 00 00 00 00 00 00 00 00
  UrbLink              = 00000000
[627319 ms] UsbSnoop - DispatchAny(f8916610) : IRP_MJ_INTERNAL_DEVICE_CONTROL
[627319 ms] UsbSnoop - MyDispatchInternalIOCTL(f8917e80) : fdo=822eee08, Irp=81ab2e48, IRQL=2
[627319 ms]  >>>  URB 845 going down  >>> 
-- URB_FUNCTION_BULK_OR_INTERRUPT_TRANSFER:
  PipeHandle           = 82300ef4 [endpoint 0x00000081]
  TransferFlags        = 00000003 (USBD_TRANSFER_DIRECTION_IN, USBD_SHORT_TRANSFER_OK)
  TransferBufferLength = 00000100
  TransferBuffer       = 00000000
  TransferBufferMDL    = 81b17168
  UrbLink              = 00000000
[627321 ms] UsbSnoop - MyInternalIOCTLCompletion(f8917db0) : fido=81b964f0, Irp=81ab2e48, Context=81b06608, IRQL=2
[627321 ms]  <<<  URB 845 coming back  <<< 
-- URB_FUNCTION_BULK_OR_INTERRUPT_TRANSFER:
  PipeHandle           = 82300ef4 [endpoint 0x00000081]
  TransferFlags        = 00000003 (USBD_TRANSFER_DIRECTION_IN, USBD_SHORT_TRANSFER_OK)
  TransferBufferLength = 00000100
  TransferBuffer       = 00000000
  TransferBufferMDL    = 81b17168
    00000000: 00 00 00 00 00 00 00 08 00 00 14 00 00 00 00 24
    00000010: 00 00 1a 40 00 00 00 36 00 00 3c 80 00 00 04 12
    00000020: 00 00 fc 80 00 00 00 1b 80 00 ff 80 00 00 10 0d
    00000030: 80 00 fd 00 00 00 00 01 80 00 fd 00 00 00 0c 00
    00000040: c0 00 ff 00 00 00 3e 00 c0 00 ff 00 00 00 1f 02
    00000050: 40 00 ff 00 00 00 7e 02 00 00 ff 00 00 00 3f 01
    00000060: 00 00 ff 00 00 00 ff 90 00 00 ff 18 07 fe 7f a0
    00000070: 00 00 ff 1f 8f ff ff ec 60 00 ff 01 8f f7 ff d8
    00000080: 60 00 fe 00 9f 01 ff 73 c0 00 ff 3f 8f ff ff ff
    00000090: 38 00 ff 2f 8f ff ff fe 78 00 ff 01 0f 81 ff fd
    000000a0: fc 00 ff 00 07 07 ff ff fc 00 ff 00 0e 81 dd df
    000000b0: f8 00 ff 00 0e 43 cf 9f dc 00 ff 00 1e 3f 07 fb
    000000c0: f8 00 ff 00 1c 00 1f f9 f0 00 ff 00 1f 00 7f b9
    000000d0: b0 00 ff 00 3f 03 ff 53 20 00 ff 02 3b 80 ff a6
    000000e0: 40 00 ff 06 3f 80 7f bc c0 00 ff 07 ff c0 ff 39
    000000f0: 00 00 ff 0c ff c0 6f 78 00 00 ff 0c 7f e0 1e 78
  UrbLink              = 00000000
[627349 ms] UsbSnoop - DispatchAny(f8916610) : IRP_MJ_INTERNAL_DEVICE_CONTROL
[627349 ms] UsbSnoop - MyDispatchInternalIOCTL(f8917e80) : fdo=822eee08, Irp=81ab2e48, IRQL=2
[627349 ms]  >>>  URB 846 going down  >>> 
-- URB_FUNCTION_BULK_OR_INTERRUPT_TRANSFER:
  PipeHandle           = 82300ef4 [endpoint 0x00000081]
  TransferFlags        = 00000003 (USBD_TRANSFER_DIRECTION_IN, USBD_SHORT_TRANSFER_OK)
  TransferBufferLength = 00000100
  TransferBuffer       = 00000000
  TransferBufferMDL    = 81b17168
  UrbLink              = 00000000
[627351 ms] UsbSnoop - MyInternalIOCTLCompletion(f8917db0) : fido=81b964f0, Irp=81ab2e48, Context=81abee68, IRQL=2
[627351 ms]  <<<  URB 846 coming back  <<< 
-- URB_FUNCTION_BULK_OR_INTERRUPT_TRANSFER:
  PipeHandle           = 82300ef4 [endpoint 0x00000081]
  TransferFlags        = 00000003 (USBD_TRANSFER_DIRECTION_IN, USBD_SHORT_TRANSFER_OK)
  TransferBufferLength = 00000100
  TransferBuffer       = 00000000
  TransferBufferMDL    = 81b17168
    00000000: 00 00 ff 18 5f f4 9c 3a 00 00 ff 10 01 7c 9d 2e
    00000010: 00 00 fe 00 01 59 73 6c 00 00 fe 81 fb 4d f9 8c
    00000020: 00 00 ff 8b fb 4f f8 88 00 00 ff 0f ff e7 bc 08
    00000030: 00 00 ff 0e 03 e7 fc 1e 00 00 ff 08 01 f3 fe 3f
    00000040: 00 00 fe 00 0b 91 f8 f7 00 00 fe 00 00 81 f9 e7
    00000050: 80 00 ff 00 02 01 f3 c7 80 00 ff 00 68 01 e7 8f
    00000060: c0 00 ff 00 42 9b ff 3f e0 00 ff 00 01 e7 fe 7f
    00000070: e0 00 ff 00 0c e7 f8 ff f0 00 ff 00 02 e7 e3 ff
    00000080: f8 00 ff 80 31 df c7 ff fc 00 ff e0 71 3e 0f ff
    00000090: ff 00 fe f0 07 fc 3f ff ff c0 ff f8 01 f0 7f ff
    000000a0: ff f0 ff fc 0b e0 ff ff ff f0 ff f8 cf 81 ff ff
    000000b0: ff f0 7f f8 46 03 ff ff ff f0 ff f0 60 07 ff ff
    000000c0: ff f0 ff f0 60 0f ff ff ff f0 ff f0 00 1f ff ff
    000000d0: ff f0 ff f0 80 3f ff ff ff f0 ff e1 e0 7f ff ff
    000000e0: ff f0 ff ef f0 ff ff ff ff f0 ff ff fb ff ff ff
    000000f0: ff f0 ff ff 7f ff ff ff ff f0 df 02 9f 00 4a 00
  UrbLink              = 00000000
[627379 ms] UsbSnoop - DispatchAny(f8916610) : IRP_MJ_INTERNAL_DEVICE_CONTROL
[627379 ms] UsbSnoop - MyDispatchInternalIOCTL(f8917e80) : fdo=822eee08, Irp=81ab2e48, IRQL=2
[627379 ms]  >>>  URB 847 going down  >>> 
-- URB_FUNCTION_BULK_OR_INTERRUPT_TRANSFER:
  PipeHandle           = 82300ef4 [endpoint 0x00000081]
  TransferFlags        = 00000003 (USBD_TRANSFER_DIRECTION_IN, USBD_SHORT_TRANSFER_OK)
  TransferBufferLength = 00000100
  TransferBuffer       = 00000000
  TransferBufferMDL    = 81b17168
  UrbLink              = 00000000
[627381 ms] UsbSnoop - MyInternalIOCTLCompletion(f8917db0) : fido=81b964f0, Irp=81ab2e48, Context=81b4ccc0, IRQL=2
[627381 ms]  <<<  URB 847 coming back  <<< 
-- URB_FUNCTION_BULK_OR_INTERRUPT_TRANSFER:
  PipeHandle           = 82300ef4 [endpoint 0x00000081]
  TransferFlags        = 00000003 (USBD_TRANSFER_DIRECTION_IN, USBD_SHORT_TRANSFER_OK)
  TransferBufferLength = 000000ff
  TransferBuffer       = 00000000
  TransferBufferMDL    = 81b17168
    00000000: 45 00 00 00 00 00 00 00 00 00 00 00 00 0e 00 00
    00000010: 00 00 00 00 00 00 00 02 00 00 00 00 00 00 01 00
    00000020: 00 40 00 00 00 00 00 05 f8 0f c8 00 00 00 00 00
    00000030: 04 f0 01 fe 00 00 00 00 00 4a ac 03 fe 00 00 00
    00000040: 00 00 18 4e 40 77 00 00 00 00 00 30 56 03 f7 00
    00000050: 00 00 00 00 01 a5 81 e1 80 00 00 00 00 00 63 00
    00000060: 0d c0 00 00 00 04 01 90 00 f1 c0 00 00 00 09 07
    00000070: 00 00 3f c0 00 00 00 12 16 40 00 07 e0 00 00 00
    00000080: 17 10 00 00 01 f0 00 00 00 03 22 00 00 00 f0 00
    00000090: 00 00 03 44 00 00 00 70 00 00 00 10 90 00 00 00
    000000a0: 60 00 00 00 13 04 00 00 00 70 00 00 00 03 00 00
    000000b0: 00 00 30 00 00 00 03 00 00 00 00 30 00 00 00 00
    000000c0: 40 00 00 00 30 00 00 00 10 00 00 00 00 18 00 00
    000000d0: 00 00 00 00 00 00 18 00 00 00 08 80 00 00 0f f8
    000000e0: 00 00 00 08 00 00 bc 3e 70 00 00 00 0c 00 01 ff
    000000f0: bf b8 00 00 00 10 04 02 3e 3f e8 00 00 00 10
  UrbLink              = 00000000
[627409 ms] UsbSnoop - DispatchAny(f8916610) : IRP_MJ_INTERNAL_DEVICE_CONTROL
[627409 ms] UsbSnoop - MyDispatchInternalIOCTL(f8917e80) : fdo=822eee08, Irp=81ab2e48, IRQL=2
[627409 ms]  >>>  URB 848 going down  >>> 
-- URB_FUNCTION_BULK_OR_INTERRUPT_TRANSFER:
  PipeHandle           = 82300f14 [endpoint 0x00000002]
  TransferFlags        = 00000000 (USBD_TRANSFER_DIRECTION_OUT, ~USBD_SHORT_TRANSFER_OK)
  TransferBufferLength = 00000007
  TransferBuffer       = 00000000
  TransferBufferMDL    = 81b17168
    00000000: 00 00 00 02 05 e0 00
  UrbLink              = 00000000
[627409 ms] UsbSnoop - MyInternalIOCTLCompletion(f8917db0) : fido=81b964f0, Irp=81ab2e48, Context=81b06608, IRQL=2
[627409 ms]  <<<  URB 848 coming back  <<< 
-- URB_FUNCTION_BULK_OR_INTERRUPT_TRANSFER:
  PipeHandle           = 82300f14 [endpoint 0x00000002]
  TransferFlags        = 00000000 (USBD_TRANSFER_DIRECTION_OUT, ~USBD_SHORT_TRANSFER_OK)
  TransferBufferLength = 00000007
  TransferBuffer       = 00000000
  TransferBufferMDL    = 81b17168
  UrbLink              = 00000000
[627419 ms] UsbSnoop - DispatchAny(f8916610) : IRP_MJ_INTERNAL_DEVICE_CONTROL
[627419 ms] UsbSnoop - MyDispatchInternalIOCTL(f8917e80) : fdo=822eee08, Irp=81ab2e48, IRQL=2
[627419 ms]  >>>  URB 849 going down  >>> 
-- URB_FUNCTION_BULK_OR_INTERRUPT_TRANSFER:
  PipeHandle           = 82300ef4 [endpoint 0x00000081]
  TransferFlags        = 00000003 (USBD_TRANSFER_DIRECTION_IN, USBD_SHORT_TRANSFER_OK)
  TransferBufferLength = 00000100
  TransferBuffer       = 00000000
  TransferBufferMDL    = 81b17168
  UrbLink              = 00000000
[627419 ms] UsbSnoop - MyInternalIOCTLCompletion(f8917db0) : fido=81b964f0, Irp=81ab2e48, Context=81b4ccc0, IRQL=2
[627419 ms]  <<<  URB 849 coming back  <<< 
-- URB_FUNCTION_BULK_OR_INTERRUPT_TRANSFER:
  PipeHandle           = 82300ef4 [endpoint 0x00000081]
  TransferFlags        = 00000003 (USBD_TRANSFER_DIRECTION_IN, USBD_SHORT_TRANSFER_OK)
  TransferBufferLength = 00000005
  TransferBuffer       = 00000000
  TransferBufferMDL    = 81b17168
    00000000: 00 00 03 ff 03
  UrbLink              = 00000000
[627449 ms] UsbSnoop - DispatchAny(f8916610) : IRP_MJ_INTERNAL_DEVICE_CONTROL
[627449 ms] UsbSnoop - MyDispatchInternalIOCTL(f8917e80) : fdo=822eee08, Irp=81ab2e48, IRQL=2
[627449 ms]  >>>  URB 850 going down  >>> 
-- URB_FUNCTION_BULK_OR_INTERRUPT_TRANSFER:
  PipeHandle           = 82300ef4 [endpoint 0x00000081]
  TransferFlags        = 00000003 (USBD_TRANSFER_DIRECTION_IN, USBD_SHORT_TRANSFER_OK)
  TransferBufferLength = 00000100
  TransferBuffer       = 00000000
  TransferBufferMDL    = 81b17168
  UrbLink              = 00000000
[627451 ms] UsbSnoop - MyInternalIOCTLCompletion(f8917db0) : fido=81b964f0, Irp=81ab2e48, Context=81bbf2f0, IRQL=2
[627451 ms]  <<<  URB 850 coming back  <<< 
-- URB_FUNCTION_BULK_OR_INTERRUPT_TRANSFER:
  PipeHandle           = 82300ef4 [endpoint 0x00000081]
  TransferFlags        = 00000003 (USBD_TRANSFER_DIRECTION_IN, USBD_SHORT_TRANSFER_OK)
  TransferBufferLength = 00000100
  TransferBuffer       = 00000000
  TransferBufferMDL    = 81b17168
    00000000: 00 19 fc 3f d8 00 00 00 00 00 03 f8 3e 68 00 00
    00000010: 00 06 00 07 d8 3c 78 00 00 00 06 00 00 10 0e 38
    00000020: 00 00 00 04 c0 00 20 00 18 00 00 00 04 c8 00 00
    00000030: 10 08 00 00 00 06 88 00 00 18 10 00 00 00 06 00
    00000040: 00 00 08 18 00 00 00 13 00 00 08 04 18 00 00 00
    00000050: 07 00 00 08 06 10 00 00 00 46 80 00 19 9f 14 00
    00000060: 00 02 07 40 00 17 fb 0c 00 00 00 1b 40 00 33 fd
    00000070: 8c 00 00 00 0d 20 00 60 79 ce 00 00 00 06 c0 00
    00000080: e0 7f d8 00 00 02 01 e0 00 80 7f 4e 00 10 00 0f
    00000090: e0 00 03 ff 29 80 00 04 1f c0 00 4f ff 28 00 00
    000000a0: 00 bf c0 00 7c 03 28 00 00 00 86 c0 00 30 61 0c
    000000b0: 80 00 00 60 40 00 61 b8 fd 00 00 02 38 00 00 81
    000000c0: b8 30 00 00 06 00 30 06 00 00 f0 00 00 04 80 30
    000000d0: 06 00 01 78 00 00 02 00 70 0f 00 00 78 00 00 00
    000000e0: 00 d8 1f 00 02 fc 00 00 00 01 f8 07 c0 e4 fe 00
    000000f0: 00 00 03 ec 03 ff f8 ff 00 00 00 0f ec 01 ff f0
  UrbLink              = 00000000
[627479 ms] UsbSnoop - DispatchAny(f8916610) : IRP_MJ_INTERNAL_DEVICE_CONTROL
[627479 ms] UsbSnoop - MyDispatchInternalIOCTL(f8917e80) : fdo=822eee08, Irp=81ab2e48, IRQL=2
[627479 ms]  >>>  URB 851 going down  >>> 
-- URB_FUNCTION_BULK_OR_INTERRUPT_TRANSFER:
  PipeHandle           = 82300ef4 [endpoint 0x00000081]
  TransferFlags        = 00000003 (USBD_TRANSFER_DIRECTION_IN, USBD_SHORT_TRANSFER_OK)
  TransferBufferLength = 00000100
  TransferBuffer       = 00000000
  TransferBufferMDL    = 81b17168
  UrbLink              = 00000000
[627481 ms] UsbSnoop - MyInternalIOCTLCompletion(f8917db0) : fido=81b964f0, Irp=81ab2e48, Context=81b06608, IRQL=2
[627481 ms]  <<<  URB 851 coming back  <<< 
-- URB_FUNCTION_BULK_OR_INTERRUPT_TRANSFER:
  PipeHandle           = 82300ef4 [endpoint 0x00000081]
  TransferFlags        = 00000003 (USBD_TRANSFER_DIRECTION_IN, USBD_SHORT_TRANSFER_OK)
  TransferBufferLength = 00000100
  TransferBuffer       = 00000000
  TransferBufferMDL    = 81b17168
    00000000: ff c0 00 00 3e ed 01 ff b0 ff f0 00 01 ff fe 40
    00000010: ff e0 ff ff 00 03 ff fb 00 8f c0 ff ff c0 0f ff
    00000020: f9 20 7f bf ff ff f0 3f ff f9 bf 7f ff ff ff f8
    00000030: ff fb f8 df ff ff ff ff f8 ff f3 f8 7d 6f ff ff
    00000040: ff f8 ff f3 f8 61 65 7f ff ff f8 ff f7 f8 3f 3b
    00000050: fd ff ff f8 ff f7 f0 3e df ff ff ff f8 ff f7 90
    00000060: 1f ff ff ff ff f8 ff e7 f0 1f c8 ff ff ff f8 ff
    00000070: e0 00 07 c3 ff ff ff f8 ff 18 20 06 27 ff ff ff
    00000080: f8 ff 8f e0 03 d7 3f ff ff f8 ff 00 20 07 ff ef
    00000090: ff ff f8 fa 04 00 05 df cf ff ff f8 df 02 55 00
    000000a0: 4a 00 3d ff fb ff ff ff ff ff f8 7f 3f ff ff ff
    000000b0: ff ff f8 ff ff ff ff 80 7f ff f8 fe ff ff ff fe
    000000c0: 3f ff f8 fd ff ff cf f9 0f ff f8 ff ff ff ff e0
    000000d0: 07 ff f8 ff ff ff ff 88 07 ff f8 ff ff ff ff f0
    000000e0: 03 ff f8 7f ff ff ff 88 03 ff f8 5f ff fc 00 00
    000000f0: 03 ff f8 7f ff f0 00 00 01 ff f8 1f ff c0 00 00
  UrbLink              = 00000000
[627509 ms] UsbSnoop - DispatchAny(f8916610) : IRP_MJ_INTERNAL_DEVICE_CONTROL
[627509 ms] UsbSnoop - MyDispatchInternalIOCTL(f8917e80) : fdo=822eee08, Irp=81ab2e48, IRQL=2
[627509 ms]  >>>  URB 852 going down  >>> 
-- URB_FUNCTION_BULK_OR_INTERRUPT_TRANSFER:
  PipeHandle           = 82300ef4 [endpoint 0x00000081]
  TransferFlags        = 00000003 (USBD_TRANSFER_DIRECTION_IN, USBD_SHORT_TRANSFER_OK)
  TransferBufferLength = 00000100
  TransferBuffer       = 00000000
  TransferBufferMDL    = 81b17168
  UrbLink              = 00000000
[627511 ms] UsbSnoop - MyInternalIOCTLCompletion(f8917db0) : fido=81b964f0, Irp=81ab2e48, Context=81abee68, IRQL=2
[627511 ms]  <<<  URB 852 coming back  <<< 
-- URB_FUNCTION_BULK_OR_INTERRUPT_TRANSFER:
  PipeHandle           = 82300ef4 [endpoint 0x00000081]
  TransferFlags        = 00000003 (USBD_TRANSFER_DIRECTION_IN, USBD_SHORT_TRANSFER_OK)
  TransferBufferLength = 00000100
  TransferBuffer       = 00000000
  TransferBufferMDL    = 81b17168
    00000000: 00 7f f8 df ff 80 00 00 00 3f f8 4f fd 00 00 00
    00000010: 00 1f f8 5b ff 00 00 00 00 0f f8 0f ff 00 00 00
    00000020: 00 0f f8 1f ff 00 00 00 00 07 f8 3f fe 00 00 00
    00000030: 00 07 f8 3f ff 00 00 00 00 07 f8 07 ff 00 00 00
    00000040: 00 03 f8 47 ff 00 00 00 00 03 f8 07 ff 00 00 00
    00000050: 00 01 f8 8f fe 80 00 00 00 01 f8 03 fc 80 00 00
    00000060: 00 01 f8 07 f5 80 00 00 00 00 f8 07 e5 00 00 00
    00000070: 00 01 f8 0f e5 00 00 00 00 01 f8 3f ea 00 00 00
    00000080: 00 01 f8 3f 89 00 00 00 00 01 f8 3f cc 00 23 80
    00000090: 00 03 f8 0c 60 00 77 e0 00 07 f8 18 04 00 09 7c
    000000a0: 01 c7 f8 12 00 00 3f fa 03 03 f8 10 00 00 fe f8
    000000b0: 06 07 f8 18 22 01 00 f9 1f c7 f8 18 00 00 00 34
    000000c0: 9b 27 f8 28 30 00 50 60 80 07 f8 18 32 00 00 60
    000000d0: 80 07 f8 1c 62 00 00 00 40 07 f8 34 40 00 01 80
    000000e0: 40 07 f8 06 22 00 00 40 20 07 f8 0a 38 40 00 06
    000000f0: 00 07 f8 03 0c 00 00 01 20 07 f8 09 00 00 00 30
  UrbLink              = 00000000
[627539 ms] UsbSnoop - DispatchAny(f8916610) : IRP_MJ_INTERNAL_DEVICE_CONTROL
[627539 ms] UsbSnoop - MyDispatchInternalIOCTL(f8917e80) : fdo=822eee08, Irp=81ab2e48, IRQL=2
[627539 ms]  >>>  URB 853 going down  >>> 
-- URB_FUNCTION_BULK_OR_INTERRUPT_TRANSFER:
  PipeHandle           = 82300ef4 [endpoint 0x00000081]
  TransferFlags        = 00000003 (USBD_TRANSFER_DIRECTION_IN, USBD_SHORT_TRANSFER_OK)
  TransferBufferLength = 00000100
  TransferBuffer       = 00000000
  TransferBufferMDL    = 81b17168
  UrbLink              = 00000000
[627541 ms] UsbSnoop - MyInternalIOCTLCompletion(f8917db0) : fido=81b964f0, Irp=81ab2e48, Context=81bbf2f0, IRQL=2
[627541 ms]  <<<  URB 853 coming back  <<< 
-- URB_FUNCTION_BULK_OR_INTERRUPT_TRANSFER:
  PipeHandle           = 82300ef4 [endpoint 0x00000081]
  TransferFlags        = 00000003 (USBD_TRANSFER_DIRECTION_IN, USBD_SHORT_TRANSFER_OK)
  TransferBufferLength = 000000ff
  TransferBuffer       = 00000000
  TransferBufferMDL    = 81b17168
    00000000: 40 07 f8 0d 91 00 01 7c 00 07 f8 07 c0 00 01 ef
    00000010: a0 07 f8 03 c2 00 05 c6 f2 07 f8 01 f6 00 01 1e
    00000020: e0 07 f8 03 f0 00 03 3f 20 07 f8 03 f8 00 40 7c
    00000030: 20 0f f8 02 f8 00 1c 08 00 0f f8 02 f8 00 04 0b
    00000040: 00 0f f8 00 f8 40 08 ff 90 1f f8 00 fc 40 0b 80
    00000050: 06 1f f8 01 fc 20 07 04 00 1f f8 03 f9 30 0c 6c
    00000060: 00 3f f8 02 f9 18 00 7c 00 3f f8 03 f0 9a 01 9c
    00000070: 00 7f f8 03 f0 4d 2c 80 00 7f f8 0f f0 33 f4 08
    00000080: 00 ff f8 1f f0 1d e8 0c 01 ff f8 3f f0 06 7c 10
    00000090: 03 ff f8 5f f8 03 af 90 83 ff f8 7f f8 00 c3 f1
    000000a0: 87 ff f8 7f fc 00 34 f9 cf ff f8 ff fe 00 1c ff
    000000b0: 97 ff f8 ff ff 00 06 7e 1b ff f8 ff ff 00 03 80
    000000c0: 1b ff f8 ff ff 80 00 60 9b ff f8 ff ff c0 00 01
    000000d0: 1d ff f8 ff ff e0 00 02 1c ff f8 ff ff f0 00 00
    000000e0: 1c 7f f8 ff ff f8 00 02 1e f7 f8 ff ff f0 00 3b
    000000f0: 1e 1c 78 df 02 9f 00 4a 00 43 c7 e0 f8 00 0f
  UrbLink              = 00000000
[627569 ms] UsbSnoop - DispatchAny(f8916610) : IRP_MJ_INTERNAL_DEVICE_CONTROL
[627569 ms] UsbSnoop - MyDispatchInternalIOCTL(f8917e80) : fdo=822eee08, Irp=81ab2e48, IRQL=2
[627569 ms]  >>>  URB 854 going down  >>> 
-- URB_FUNCTION_BULK_OR_INTERRUPT_TRANSFER:
  PipeHandle           = 82300f14 [endpoint 0x00000002]
  TransferFlags        = 00000000 (USBD_TRANSFER_DIRECTION_OUT, ~USBD_SHORT_TRANSFER_OK)
  TransferBufferLength = 00000007
  TransferBuffer       = 00000000
  TransferBufferMDL    = 81b17168
    00000000: 00 00 00 02 05 e0 00
  UrbLink              = 00000000
[627569 ms] UsbSnoop - MyInternalIOCTLCompletion(f8917db0) : fido=81b964f0, Irp=81ab2e48, Context=81b06608, IRQL=2
[627569 ms]  <<<  URB 854 coming back  <<< 
-- URB_FUNCTION_BULK_OR_INTERRUPT_TRANSFER:
  PipeHandle           = 82300f14 [endpoint 0x00000002]
  TransferFlags        = 00000000 (USBD_TRANSFER_DIRECTION_OUT, ~USBD_SHORT_TRANSFER_OK)
  TransferBufferLength = 00000007
  TransferBuffer       = 00000000
  TransferBufferMDL    = 81b17168
  UrbLink              = 00000000
[627579 ms] UsbSnoop - DispatchAny(f8916610) : IRP_MJ_INTERNAL_DEVICE_CONTROL
[627579 ms] UsbSnoop - MyDispatchInternalIOCTL(f8917e80) : fdo=822eee08, Irp=81c873d8, IRQL=2
[627579 ms]  >>>  URB 855 going down  >>> 
-- URB_FUNCTION_BULK_OR_INTERRUPT_TRANSFER:
  PipeHandle           = 82300ef4 [endpoint 0x00000081]
  TransferFlags        = 00000003 (USBD_TRANSFER_DIRECTION_IN, USBD_SHORT_TRANSFER_OK)
  TransferBufferLength = 00000100
  TransferBuffer       = 00000000
  TransferBufferMDL    = 81b17168
  UrbLink              = 00000000
[627579 ms] UsbSnoop - MyInternalIOCTLCompletion(f8917db0) : fido=81b964f0, Irp=81c873d8, Context=81bbf2f0, IRQL=2
[627579 ms]  <<<  URB 855 coming back  <<< 
-- URB_FUNCTION_BULK_OR_INTERRUPT_TRANSFER:
  PipeHandle           = 82300ef4 [endpoint 0x00000081]
  TransferFlags        = 00000003 (USBD_TRANSFER_DIRECTION_IN, USBD_SHORT_TRANSFER_OK)
  TransferBufferLength = 00000005
  TransferBuffer       = 00000000
  TransferBufferMDL    = 81b17168
    00000000: 00 00 03 ff 03
  UrbLink              = 00000000
[627609 ms] UsbSnoop - DispatchAny(f8916610) : IRP_MJ_INTERNAL_DEVICE_CONTROL
[627609 ms] UsbSnoop - MyDispatchInternalIOCTL(f8917e80) : fdo=822eee08, Irp=81c873d8, IRQL=2
[627609 ms]  >>>  URB 856 going down  >>> 
-- URB_FUNCTION_BULK_OR_INTERRUPT_TRANSFER:
  PipeHandle           = 82300ef4 [endpoint 0x00000081]
  TransferFlags        = 00000003 (USBD_TRANSFER_DIRECTION_IN, USBD_SHORT_TRANSFER_OK)
  TransferBufferLength = 00000100
  TransferBuffer       = 00000000
  TransferBufferMDL    = 81b17168
  UrbLink              = 00000000
[627611 ms] UsbSnoop - MyInternalIOCTLCompletion(f8917db0) : fido=81b964f0, Irp=81c873d8, Context=822fdcd0, IRQL=2
[627611 ms]  <<<  URB 856 coming back  <<< 
-- URB_FUNCTION_BULK_OR_INTERRUPT_TRANSFER:
  PipeHandle           = 82300ef4 [endpoint 0x00000081]
  TransferFlags        = 00000003 (USBD_TRANSFER_DIRECTION_IN, USBD_SHORT_TRANSFER_OK)
  TransferBufferLength = 00000100
  TransferBuffer       = 00000000
  TransferBufferMDL    = 81b17168
    00000000: ff ff ff e0 c7 e0 fc 03 ff ff ff ff e0 cf e0 fc
    00000010: 0f ff 07 ff ff e0 cf e0 fe 3d 0f e3 ff ff e0 cf
    00000020: e0 ff f0 67 01 ff ff e0 cf e0 ff 82 38 c0 7f ff
    00000030: e0 df ec 1b 80 00 04 3f ff e0 ef f8 33 80 00 04
    00000040: 3f ff e0 e7 f8 7c 00 00 22 1f ff e0 e0 08 f8 00
    00000050: 00 00 0f ff e0 e0 0c c0 00 00 00 07 ff e0 e0 0d
    00000060: c0 00 00 00 07 ff e0 f0 07 80 00 00 00 03 ff e0
    00000070: f0 0e 00 00 00 00 03 ff e0 f0 1e 00 00 00 00 03
    00000080: ff e0 f0 1e 00 00 00 00 03 ff e0 74 7e 00 00 00
    00000090: 00 03 ff e0 3f 7c 00 00 00 00 03 df e0 1f 7c 00
    000000a0: 00 00 00 01 df e0 0f fc 00 00 00 00 01 ff e0 07
    000000b0: fc 00 00 00 00 01 ff e0 83 fc 00 00 00 00 01 ff
    000000c0: e0 83 7c 00 00 00 00 01 ff e0 81 fc 00 00 00 00
    000000d0: 01 ff e0 80 fc 00 00 00 00 01 ff e0 80 fc 00 00
    000000e0: 00 00 01 df e0 80 7c 00 00 00 08 01 1f e0 80 3e
    000000f0: 00 00 00 00 04 6f e0 80 3e 00 00 00 40 0c ef e0
  UrbLink              = 00000000
[627639 ms] UsbSnoop - DispatchAny(f8916610) : IRP_MJ_INTERNAL_DEVICE_CONTROL
[627639 ms] UsbSnoop - MyDispatchInternalIOCTL(f8917e80) : fdo=822eee08, Irp=81c873d8, IRQL=2
[627639 ms]  >>>  URB 857 going down  >>> 
-- URB_FUNCTION_BULK_OR_INTERRUPT_TRANSFER:
  PipeHandle           = 82300ef4 [endpoint 0x00000081]
  TransferFlags        = 00000003 (USBD_TRANSFER_DIRECTION_IN, USBD_SHORT_TRANSFER_OK)
  TransferBufferLength = 00000100
  TransferBuffer       = 00000000
  TransferBufferMDL    = 81b17168
  UrbLink              = 00000000
[627641 ms] UsbSnoop - MyInternalIOCTLCompletion(f8917db0) : fido=81b964f0, Irp=81c873d8, Context=81b06608, IRQL=2
[627641 ms]  <<<  URB 857 coming back  <<< 
-- URB_FUNCTION_BULK_OR_INTERRUPT_TRANSFER:
  PipeHandle           = 82300ef4 [endpoint 0x00000081]
  TransferFlags        = 00000003 (USBD_TRANSFER_DIRECTION_IN, USBD_SHORT_TRANSFER_OK)
  TransferBufferLength = 00000100
  TransferBuffer       = 00000000
  TransferBufferMDL    = 81b17168
    00000000: 80 1e 00 00 00 00 0d ef e0 80 0f 00 00 00 00 04
    00000010: 0f e0 80 0f 00 00 00 00 07 2f e0 80 0c 80 00 01
    00000020: c0 05 1f e0 80 07 00 00 03 e4 04 1f e0 80 03 80
    00000030: 00 0e 06 00 1f e0 80 00 80 00 38 f4 02 1f e0 c0
    00000040: 00 56 00 67 fc 02 3f e0 c0 00 c3 d8 f9 84 00 7f
    00000050: e0 c0 00 df f0 f0 00 00 7f e0 c0 00 77 10 0c 48
    00000060: 02 7f e0 c0 00 30 10 0c 00 02 7f e0 c0 00 10 00
    00000070: 00 00 81 7f e0 e0 00 10 00 00 01 80 7f e0 e0 00
    00000080: 08 08 00 07 00 7f e0 f0 00 20 18 00 07 00 7f e0
    00000090: f0 00 20 10 00 02 00 7b e0 f8 00 30 10 18 00 00
    000000a0: 7d e0 fc 00 10 20 8b 08 04 7d e0 fc 00 18 60 09
    000000b0: 84 04 7e e0 fe 00 18 30 78 c4 04 7f e0 ff 00 18
    000000c0: 18 f0 06 0c 7f e0 ff 80 08 0f c0 06 0c ff e0 ff
    000000d0: 80 0c 07 80 22 18 ff e0 ff c0 0c 01 80 f2 1c ff
    000000e0: e0 ff e0 04 e0 03 e1 19 ff e0 ff e0 06 70 7e 02
    000000f0: 19 ff e0 ff f0 3e 1f e0 03 71 ff e0 ff f8 7f 0c
  UrbLink              = 00000000
[627669 ms] UsbSnoop - DispatchAny(f8916610) : IRP_MJ_INTERNAL_DEVICE_CONTROL
[627669 ms] UsbSnoop - MyDispatchInternalIOCTL(f8917e80) : fdo=822eee08, Irp=81c873d8, IRQL=2
[627669 ms]  >>>  URB 858 going down  >>> 
-- URB_FUNCTION_BULK_OR_INTERRUPT_TRANSFER:
  PipeHandle           = 82300ef4 [endpoint 0x00000081]
  TransferFlags        = 00000003 (USBD_TRANSFER_DIRECTION_IN, USBD_SHORT_TRANSFER_OK)
  TransferBufferLength = 00000100
  TransferBuffer       = 00000000
  TransferBufferMDL    = 81b17168
  UrbLink              = 00000000
[627671 ms] UsbSnoop - MyInternalIOCTLCompletion(f8917db0) : fido=81b964f0, Irp=81c873d8, Context=81abee68, IRQL=2
[627671 ms]  <<<  URB 858 coming back  <<< 
-- URB_FUNCTION_BULK_OR_INTERRUPT_TRANSFER:
  PipeHandle           = 82300ef4 [endpoint 0x00000081]
  TransferFlags        = 00000003 (USBD_TRANSFER_DIRECTION_IN, USBD_SHORT_TRANSFER_OK)
  TransferBufferLength = 00000100
  TransferBuffer       = 00000000
  TransferBufferMDL    = 81b17168
    00000000: 08 00 f1 ff e0 ff f8 ff 87 f0 03 e3 ff e0 ff fd
    00000010: ff c3 00 07 e3 ff e0 ff ff ff e0 00 1f c3 ff e0
    00000020: ff ff ff f0 00 1f 87 ff e0 ff ff ff f8 00 7f 07
    00000030: ff e0 ff ff ff fc 00 fe 07 ff e0 ff ff ff ff 07
    00000040: fe 07 ff e0 bf ff ff ff ff fc 0f ff e0 bf ff ff
    00000050: ff ff f0 0f ff e0 bf ff ff ff ff e0 1f ff e0 9f
    00000060: ff ff ff f7 c0 1f ff e0 8f ff ff ff f3 80 1f ff
    00000070: e0 8f ff ff ff f7 00 3f ff e0 87 ff ff ff ff 00
    00000080: 3f ff e0 83 ff ff ff ff 80 7f ff e0 81 ff ff ff
    00000090: ff 80 7f ff e0 df 02 19 00 4c 00 37 df b7 af 7f
    000000a0: ff ff fe 9d 9f e9 6f f7 7f fe 57 ff ff f3 d7 bf
    000000b0: fe fe bf ea f5 7f ff fe ef df eb ff fb ff fe d9
    000000c0: ad 18 17 ef ff fe 6f dc ff c0 df af fa 59 ab ff
    000000d0: ff 1a f3 de 95 27 ff ff c7 fc fe 77 cb ff ff f3
    000000e0: ff be aa 9f ff ff f9 ff fe 6b 1f ff ff ff 7e fe
    000000f0: ed ff ff ff ff 5f be 8f ff ff 00 ff 5f 74 25 bf
  UrbLink              = 00000000
[627700 ms] UsbSnoop - DispatchAny(f8916610) : IRP_MJ_INTERNAL_DEVICE_CONTROL
[627700 ms] UsbSnoop - MyDispatchInternalIOCTL(f8917e80) : fdo=822eee08, Irp=81c873d8, IRQL=2
[627700 ms]  >>>  URB 859 going down  >>> 
-- URB_FUNCTION_BULK_OR_INTERRUPT_TRANSFER:
  PipeHandle           = 82300ef4 [endpoint 0x00000081]
  TransferFlags        = 00000003 (USBD_TRANSFER_DIRECTION_IN, USBD_SHORT_TRANSFER_OK)
  TransferBufferLength = 00000100
  TransferBuffer       = 00000000
  TransferBufferMDL    = 81b17168
  UrbLink              = 00000000
[627702 ms] UsbSnoop - MyInternalIOCTLCompletion(f8917db0) : fido=81b964f0, Irp=81c873d8, Context=822fdcd0, IRQL=2
[627702 ms]  <<<  URB 859 coming back  <<< 
-- URB_FUNCTION_BULK_OR_INTERRUPT_TRANSFER:
  PipeHandle           = 82300ef4 [endpoint 0x00000081]
  TransferFlags        = 00000003 (USBD_TRANSFER_DIRECTION_IN, USBD_SHORT_TRANSFER_OK)
  TransferBufferLength = 000000ff
  TransferBuffer       = 00000000
  TransferBufferMDL    = 81b17168
    00000000: f8 00 35 9a de 5b bf e0 00 0f f7 fe 46 bf c0 00
    00000010: 1f fb fe ae 7f c0 00 1f f5 76 30 ff c0 00 17 fe
    00000020: 5a d5 ff 80 00 1f ff 5c 29 7f 80 00 0f ff 3a 0e
    00000030: ff 80 00 0f ff 6e 90 ff 80 00 1e ff 9e 4b 3f 80
    00000040: 00 1f ff 76 9c 3f 00 7c 02 ff be 25 7e 63 f7 0f
    00000050: ff 7e 86 fd f9 11 87 ff ba 32 7f f8 fe 41 ff 9e
    00000060: 42 7f f8 ad 03 ff de 29 3f a8 30 41 bf d6 21 3f
    00000070: d0 20 01 9f ba 62 8f 90 10 01 6f ae 10 4e 10 00
    00000080: 02 2f 5e 00 aa 30 00 00 27 3e 01 03 20 00 08 4f
    00000090: fe 00 0b 32 00 00 07 62 21 03 f3 80 00 2f 9e 42
    000000a0: 51 fc 00 21 1f 6c 12 25 fe 00 00 bf 76 00 01 f0
    000000b0: 00 00 fc ae 00 15 fb f0 01 fa dc 80 41 b4 08 43
    000000c0: 32 f6 21 00 da 00 0c 25 ba 00 16 db 00 70 4a 4e
    000000d0: 00 00 7c c3 81 e5 7a 04 05 70 04 27 f2 96 00 00
    000000e0: 70 08 8f fb 6e 02 04 38 06 3b fd de 00 00 1e 70
    000000f0: ff fd 6e 00 00 8f e3 ef fd be 00 01 27 ff df
  UrbLink              = 00000000
[627729 ms] UsbSnoop - DispatchAny(f8916610) : IRP_MJ_INTERNAL_DEVICE_CONTROL
[627729 ms] UsbSnoop - MyDispatchInternalIOCTL(f8917e80) : fdo=822eee08, Irp=81c873d8, IRQL=2
[627729 ms]  >>>  URB 860 going down  >>> 
-- URB_FUNCTION_BULK_OR_INTERRUPT_TRANSFER:
  PipeHandle           = 82300f14 [endpoint 0x00000002]
  TransferFlags        = 00000000 (USBD_TRANSFER_DIRECTION_OUT, ~USBD_SHORT_TRANSFER_OK)
  TransferBufferLength = 00000007
  TransferBuffer       = 00000000
  TransferBufferMDL    = 81b17168
    00000000: 00 00 00 02 05 e0 00
  UrbLink              = 00000000
[627730 ms] UsbSnoop - MyInternalIOCTLCompletion(f8917db0) : fido=81b964f0, Irp=81c873d8, Context=81b06608, IRQL=2
[627730 ms]  <<<  URB 860 coming back  <<< 
-- URB_FUNCTION_BULK_OR_INTERRUPT_TRANSFER:
  PipeHandle           = 82300f14 [endpoint 0x00000002]
  TransferFlags        = 00000000 (USBD_TRANSFER_DIRECTION_OUT, ~USBD_SHORT_TRANSFER_OK)
  TransferBufferLength = 00000007
  TransferBuffer       = 00000000
  TransferBufferMDL    = 81b17168
  UrbLink              = 00000000
[627739 ms] UsbSnoop - DispatchAny(f8916610) : IRP_MJ_INTERNAL_DEVICE_CONTROL
[627739 ms] UsbSnoop - MyDispatchInternalIOCTL(f8917e80) : fdo=822eee08, Irp=81c873d8, IRQL=2
[627739 ms]  >>>  URB 861 going down  >>> 
-- URB_FUNCTION_BULK_OR_INTERRUPT_TRANSFER:
  PipeHandle           = 82300ef4 [endpoint 0x00000081]
  TransferFlags        = 00000003 (USBD_TRANSFER_DIRECTION_IN, USBD_SHORT_TRANSFER_OK)
  TransferBufferLength = 00000100
  TransferBuffer       = 00000000
  TransferBufferMDL    = 81b17168
  UrbLink              = 00000000
[627739 ms] UsbSnoop - MyInternalIOCTLCompletion(f8917db0) : fido=81b964f0, Irp=81c873d8, Context=81abee68, IRQL=2
[627739 ms]  <<<  URB 861 coming back  <<< 
-- URB_FUNCTION_BULK_OR_INTERRUPT_TRANSFER:
  PipeHandle           = 82300ef4 [endpoint 0x00000081]
  TransferFlags        = 00000003 (USBD_TRANSFER_DIRECTION_IN, USBD_SHORT_TRANSFER_OK)
  TransferBufferLength = 00000005
  TransferBuffer       = 00000000
  TransferBufferMDL    = 81b17168
    00000000: 00 00 03 ff 03
  UrbLink              = 00000000
[627770 ms] UsbSnoop - DispatchAny(f8916610) : IRP_MJ_INTERNAL_DEVICE_CONTROL
[627770 ms] UsbSnoop - MyDispatchInternalIOCTL(f8917e80) : fdo=822eee08, Irp=81c2c5d8, IRQL=2
[627770 ms]  >>>  URB 862 going down  >>> 
-- URB_FUNCTION_BULK_OR_INTERRUPT_TRANSFER:
  PipeHandle           = 82300ef4 [endpoint 0x00000081]
  TransferFlags        = 00000003 (USBD_TRANSFER_DIRECTION_IN, USBD_SHORT_TRANSFER_OK)
  TransferBufferLength = 00000100
  TransferBuffer       = 00000000
  TransferBufferMDL    = 81b65b08
  UrbLink              = 00000000
[627772 ms] UsbSnoop - MyInternalIOCTLCompletion(f8917db0) : fido=81b964f0, Irp=81c2c5d8, Context=81b06608, IRQL=2
[627772 ms]  <<<  URB 862 coming back  <<< 
-- URB_FUNCTION_BULK_OR_INTERRUPT_TRANSFER:
  PipeHandle           = 82300ef4 [endpoint 0x00000081]
  TransferFlags        = 00000003 (USBD_TRANSFER_DIRECTION_IN, USBD_SHORT_TRANSFER_OK)
  TransferBufferLength = 00000100
  TransferBuffer       = 00000000
  TransferBufferMDL    = 81b65b08
    00000000: fc da 08 18 17 ff ff fe fc 01 01 1b ff ff fe 6e
    00000010: 02 00 0d ff ff ff 56 24 88 49 ff ff ff 2e 80 10
    00000020: a3 ff ff ff 9e 49 08 8f ff ff ff ce 12 10 3f ff
    00000030: ff ff e6 10 00 ff ff ff ff fa 00 08 ff ff ff ff
    00000040: fc 01 13 7f ff ff ff fe 80 05 3f f7 ff ff fe 00
    00000050: 00 7f ff ff ff fe 00 02 ff ff ff ff fe 22 85 ff
    00000060: ff ff ff fe 58 09 f7 7f ff ff fe 10 93 f0 7f ff
    00000070: ff fe 01 17 e0 ff ff ff fe 50 27 c3 ff ff ff fe
    00000080: 68 af 83 ff ff ff fe 00 5f 87 ff ff ff fe 80 1f
    00000090: 0f ff ff ff fe 00 be 1f ff ff ff fe 0d 7c 3f ff
    000000a0: ff ff fe 42 7c 7f ff ff ff fe 84 f8 7f ff ff ff
    000000b0: fe df 02 55 00 4a 00 3f 03 ff ff cf c5 f0 00 00
    000000c0: 13 ff ff fd 43 f0 00 00 3f ff ff c0 37 f0 00 00
    000000d0: 3f ff f8 00 07 f8 00 00 3f ff f0 00 07 f8 00 00
    000000e0: 1f ff c0 00 10 3e c0 00 1f ff 80 00 0e 3f c0 00
    000000f0: 4f ff 00 00 02 3f e0 00 07 fe 00 00 01 3e 60 00
  UrbLink              = 00000000
[627799 ms] UsbSnoop - DispatchAny(f8916610) : IRP_MJ_INTERNAL_DEVICE_CONTROL
[627799 ms] UsbSnoop - MyDispatchInternalIOCTL(f8917e80) : fdo=822eee08, Irp=81c2c5d8, IRQL=2
[627799 ms]  >>>  URB 863 going down  >>> 
-- URB_FUNCTION_BULK_OR_INTERRUPT_TRANSFER:
  PipeHandle           = 82300ef4 [endpoint 0x00000081]
  TransferFlags        = 00000003 (USBD_TRANSFER_DIRECTION_IN, USBD_SHORT_TRANSFER_OK)
  TransferBufferLength = 00000100
  TransferBuffer       = 00000000
  TransferBufferMDL    = 81b65b08
  UrbLink              = 00000000
[627801 ms] UsbSnoop - MyInternalIOCTLCompletion(f8917db0) : fido=81b964f0, Irp=81c2c5d8, Context=81bbf2f0, IRQL=2
[627801 ms]  <<<  URB 863 coming back  <<< 
-- URB_FUNCTION_BULK_OR_INTERRUPT_TRANSFER:
  PipeHandle           = 82300ef4 [endpoint 0x00000081]
  TransferFlags        = 00000003 (USBD_TRANSFER_DIRECTION_IN, USBD_SHORT_TRANSFER_OK)
  TransferBufferLength = 00000100
  TransferBuffer       = 00000000
  TransferBufferMDL    = 81b65b08
    00000000: 27 fe 00 00 01 9f 80 00 7f fc 00 00 00 bf c0 00
    00000010: ff fc 00 00 00 3f c0 00 ff fc 00 00 00 3f e0 00
    00000020: ff fc 00 00 00 3f e0 00 ff f8 00 00 02 0f f0 00
    00000030: ff f8 00 00 02 0f f0 00 ff f0 00 00 00 0a fc 00
    00000040: ff f0 00 00 00 05 7e 00 ff f0 00 00 00 01 fe 00
    00000050: ff f0 00 00 00 00 fe 00 ff f0 00 00 00 80 3f 00
    00000060: ff f0 00 00 00 20 3e 00 ff e0 00 00 00 30 3e 00
    00000070: ff e0 00 03 e8 38 1e 38 ff e0 00 1f fe 38 3e d0
    00000080: ff e0 20 3e 3f 78 7e 00 ff f1 f8 30 0f fd de 00
    00000090: ff f1 0c 37 ff fe 9b 00 ff f2 34 3d 3f fe 0b 00
    000000a0: ff f2 fc 70 58 7f db c0 ff f1 a0 70 00 7f 57 c0
    000000b0: ff f9 08 e2 00 7f 67 f0 ff f8 1c e0 00 ff 27 c0
    000000c0: ff f8 18 f0 00 7f 6f c0 ff f8 00 e0 00 ff cf e0
    000000d0: ff fc 00 f0 01 ff 9f e0 ff fc 00 c8 03 ff 1f f0
    000000e0: ff fc 00 c8 07 ff 3f f0 ff fe 11 fc 07 7f 7f f0
    000000f0: ff fe 1f fe c6 7f ff f0 ff fe 33 fe 26 7f ff f0
  UrbLink              = 00000000
[627829 ms] UsbSnoop - DispatchAny(f8916610) : IRP_MJ_INTERNAL_DEVICE_CONTROL
[627829 ms] UsbSnoop - MyDispatchInternalIOCTL(f8917e80) : fdo=822eee08, Irp=81c2c5d8, IRQL=2
[627830 ms]  >>>  URB 864 going down  >>> 
-- URB_FUNCTION_BULK_OR_INTERRUPT_TRANSFER:
  PipeHandle           = 82300ef4 [endpoint 0x00000081]
  TransferFlags        = 00000003 (USBD_TRANSFER_DIRECTION_IN, USBD_SHORT_TRANSFER_OK)
  TransferBufferLength = 00000100
  TransferBuffer       = 00000000
  TransferBufferMDL    = 81b65b08
  UrbLink              = 00000000
[627831 ms] UsbSnoop - MyInternalIOCTLCompletion(f8917db0) : fido=81b964f0, Irp=81c2c5d8, Context=81cb4e48, IRQL=2
[627832 ms]  <<<  URB 864 coming back  <<< 
-- URB_FUNCTION_BULK_OR_INTERRUPT_TRANSFER:
  PipeHandle           = 82300ef4 [endpoint 0x00000081]
  TransferFlags        = 00000003 (USBD_TRANSFER_DIRECTION_IN, USBD_SHORT_TRANSFER_OK)
  TransferBufferLength = 00000100
  TransferBuffer       = 00000000
  TransferBufferMDL    = 81b65b08
    00000000: ff fe 30 f8 06 3f ff f0 ff fe 20 30 04 7f ff f8
    00000010: ff fe 00 07 80 ff ff f8 ff ff 03 ff 80 ff ff fc
    00000020: ff ff 0f 80 07 ff ff fc ff ff 00 06 07 ff df fc
    00000030: ff ff 01 fc 07 ff df fe ff ff 81 90 0f ff bf fe
    00000040: ff ff 80 00 4f ff bf fe ff ff d0 00 9f ff 3f f6
    00000050: ff ff c0 00 3f ff 3f f8 ff ff e0 00 ff fe 7f fc
    00000060: ff ff f0 25 ff fe 7f fe ff ff f9 ff ff f8 ff fe
    00000070: ff ff ff ff ff f9 ff fe ff ff ff ff ff f1 ff fe
    00000080: ff ff ff ff ff e3 ff fe ff ff ff ff ff c3 ff fe
    00000090: ff ff ff ff ff 87 ff fe ff ff ff ef ff 07 ff fe
    000000a0: ff ff ff e7 fc 0f ff fe ff ff ff e3 f8 1f ff fe
    000000b0: ff ff ff f1 f0 3f ff fe ff ff ff f1 c0 7f ff fe
    000000c0: ff ff ff f0 c0 7f ff fe ff ff ff f1 c0 bf ff fe
    000000d0: ff ff ff f1 c0 3f ff fe ff ff ff f1 c0 7f ff fe
    000000e0: ff ff ff f3 e0 7f ff fe ff ff ff f3 e0 ff ff fe
    000000f0: ff ff ff f3 e0 ff ff fe ff ff ff f7 61 ff ff fe
  UrbLink              = 00000000
[627860 ms] UsbSnoop - DispatchAny(f8916610) : IRP_MJ_INTERNAL_DEVICE_CONTROL
[627860 ms] UsbSnoop - MyDispatchInternalIOCTL(f8917e80) : fdo=822eee08, Irp=81c2c5d8, IRQL=2
[627860 ms]  >>>  URB 865 going down  >>> 
-- URB_FUNCTION_BULK_OR_INTERRUPT_TRANSFER:
  PipeHandle           = 82300ef4 [endpoint 0x00000081]
  TransferFlags        = 00000003 (USBD_TRANSFER_DIRECTION_IN, USBD_SHORT_TRANSFER_OK)
  TransferBufferLength = 00000100
  TransferBuffer       = 00000000
  TransferBufferMDL    = 81b65b08
  UrbLink              = 00000000
[627862 ms] UsbSnoop - MyInternalIOCTLCompletion(f8917db0) : fido=81b964f0, Irp=81c2c5d8, Context=81b06608, IRQL=2
[627862 ms]  <<<  URB 865 coming back  <<< 
-- URB_FUNCTION_BULK_OR_INTERRUPT_TRANSFER:
  PipeHandle           = 82300ef4 [endpoint 0x00000081]
  TransferFlags        = 00000003 (USBD_TRANSFER_DIRECTION_IN, USBD_SHORT_TRANSFER_OK)
  TransferBufferLength = 000000ff
  TransferBuffer       = 00000000
  TransferBufferMDL    = 81b65b08
    00000000: ff ff ff e7 f1 ff ff fe df 02 55 00 4a 00 3a 00
    00000010: 00 00 00 00 00 00 00 00 00 01 fe 00 00 00 00 00
    00000020: 00 0f ff 80 00 00 00 00 00 7e 3f e0 00 00 00 00
    00000030: 01 ff ff fe 00 00 00 00 03 ff ff ff 80 00 00 00
    00000040: 0f ff ff ff c0 00 00 00 1f ff ff 8f c0 00 00 00
    00000050: 3f ff fc 03 e0 00 00 00 7f ff f0 01 e0 00 00 00
    00000060: 7f ff 80 00 f8 00 00 00 ff c0 00 00 78 00 00 00
    00000070: ff 00 00 00 7c 00 00 00 fe 00 00 00 3e 00 00 00
    00000080: 7c 00 00 00 3e 00 00 00 f8 00 00 00 3f 00 00 00
    00000090: f0 00 00 00 1f 80 00 01 f0 00 00 00 1f c0 00 01
    000000a0: f0 00 00 03 1f c0 00 01 f0 00 00 01 0f e0 00 05
    000000b0: e0 00 00 02 ff e0 00 01 e0 00 00 07 3f e0 00 01
    000000c0: e0 00 00 06 df f0 00 01 e0 00 00 04 df e0 00 01
    000000d0: e0 00 00 00 7f e0 00 01 c0 00 00 00 3f f0 00 01
    000000e0: f0 00 00 e4 7f f0 00 05 f0 1e 03 fe ff f0 00 01
    000000f0: f0 ff 87 ff ff e0 00 01 f3 ff 8f ff ef f0 00
  UrbLink              = 00000000
[627890 ms] UsbSnoop - DispatchAny(f8916610) : IRP_MJ_INTERNAL_DEVICE_CONTROL
[627890 ms] UsbSnoop - MyDispatchInternalIOCTL(f8917e80) : fdo=822eee08, Irp=81c873d8, IRQL=2
[627890 ms]  >>>  URB 866 going down  >>> 
-- URB_FUNCTION_BULK_OR_INTERRUPT_TRANSFER:
  PipeHandle           = 82300f14 [endpoint 0x00000002]
  TransferFlags        = 00000000 (USBD_TRANSFER_DIRECTION_OUT, ~USBD_SHORT_TRANSFER_OK)
  TransferBufferLength = 00000007
  TransferBuffer       = 00000000
  TransferBufferMDL    = 81b65b08
    00000000: 00 00 00 02 05 e0 00
  UrbLink              = 00000000
[627890 ms] UsbSnoop - MyInternalIOCTLCompletion(f8917db0) : fido=81b964f0, Irp=81c873d8, Context=81bbf2f0, IRQL=2
[627890 ms]  <<<  URB 866 coming back  <<< 
-- URB_FUNCTION_BULK_OR_INTERRUPT_TRANSFER:
  PipeHandle           = 82300f14 [endpoint 0x00000002]
  TransferFlags        = 00000000 (USBD_TRANSFER_DIRECTION_OUT, ~USBD_SHORT_TRANSFER_OK)
  TransferBufferLength = 00000007
  TransferBuffer       = 00000000
  TransferBufferMDL    = 81b65b08
  UrbLink              = 00000000
[627901 ms] UsbSnoop - DispatchAny(f8916610) : IRP_MJ_INTERNAL_DEVICE_CONTROL
[627901 ms] UsbSnoop - MyDispatchInternalIOCTL(f8917e80) : fdo=822eee08, Irp=81c873d8, IRQL=2
[627901 ms]  >>>  URB 867 going down  >>> 
-- URB_FUNCTION_BULK_OR_INTERRUPT_TRANSFER:
  PipeHandle           = 82300ef4 [endpoint 0x00000081]
  TransferFlags        = 00000003 (USBD_TRANSFER_DIRECTION_IN, USBD_SHORT_TRANSFER_OK)
  TransferBufferLength = 00000100
  TransferBuffer       = 00000000
  TransferBufferMDL    = 81b65b08
  UrbLink              = 00000000
[627901 ms] UsbSnoop - MyInternalIOCTLCompletion(f8917db0) : fido=81b964f0, Irp=81c873d8, Context=81b06608, IRQL=2
[627901 ms]  <<<  URB 867 coming back  <<< 
-- URB_FUNCTION_BULK_OR_INTERRUPT_TRANSFER:
  PipeHandle           = 82300ef4 [endpoint 0x00000081]
  TransferFlags        = 00000003 (USBD_TRANSFER_DIRECTION_IN, USBD_SHORT_TRANSFER_OK)
  TransferBufferLength = 00000005
  TransferBuffer       = 00000000
  TransferBufferMDL    = 81b65b08
    00000000: 00 00 03 ff 03
  UrbLink              = 00000000
[627930 ms] UsbSnoop - DispatchAny(f8916610) : IRP_MJ_INTERNAL_DEVICE_CONTROL
[627930 ms] UsbSnoop - MyDispatchInternalIOCTL(f8917e80) : fdo=822eee08, Irp=81c873d8, IRQL=2
[627930 ms]  >>>  URB 868 going down  >>> 
-- URB_FUNCTION_BULK_OR_INTERRUPT_TRANSFER:
  PipeHandle           = 82300ef4 [endpoint 0x00000081]
  TransferFlags        = 00000003 (USBD_TRANSFER_DIRECTION_IN, USBD_SHORT_TRANSFER_OK)
  TransferBufferLength = 00000100
  TransferBuffer       = 00000000
  TransferBufferMDL    = 81b65b08
  UrbLink              = 00000000
[627932 ms] UsbSnoop - MyInternalIOCTLCompletion(f8917db0) : fido=81b964f0, Irp=81c873d8, Context=822fdcd0, IRQL=2
[627932 ms]  <<<  URB 868 coming back  <<< 
-- URB_FUNCTION_BULK_OR_INTERRUPT_TRANSFER:
  PipeHandle           = 82300ef4 [endpoint 0x00000081]
  TransferFlags        = 00000003 (USBD_TRANSFER_DIRECTION_IN, USBD_SHORT_TRANSFER_OK)
  TransferBufferLength = 00000100
  TransferBuffer       = 00000000
  TransferBufferMDL    = 81b65b08
    00000000: 00 fb e7 87 ff b7 f0 00 cc f3 3f 8f bf ff f0 00
    00000010: 09 f0 ff 8f 83 db f0 00 01 b1 86 0f fc 1d e0 00
    00000020: 40 b0 0c 0f c0 1d e0 00 00 c0 00 0f 80 3d e0 00
    00000030: 00 80 00 07 c0 7c e0 00 01 30 00 07 c0 7e c0 00
    00000040: 00 30 01 03 e0 fe c0 00 04 30 03 07 e0 ff c0 00
    00000050: 00 30 06 07 f0 f9 80 00 00 10 0c ff fd fb 40 00
    00000060: 00 00 18 ff fd fc c0 00 0c 40 18 3f ff fe c0 00
    00000070: 10 60 30 1b ff ff 80 00 c0 40 70 03 fe ff 80 00
    00000080: 80 00 6f ff fe ff 00 00 01 c8 7f ff fc fc 00 00
    00000090: c3 00 3e 01 7c fc 00 00 81 40 13 ff f8 fc 00 00
    000000a0: b4 42 00 04 f8 fc 00 00 8c 02 00 00 f1 fc 00 00
    000000b0: 00 03 00 01 f9 fc 00 00 80 01 00 0f e3 b8 00 00
    000000c0: ce 01 80 0f e7 f8 00 00 9d 40 80 01 8f fc 00 00
    000000d0: b1 c0 00 01 9f fc 00 00 82 40 00 03 ff f8 00 00
    000000e0: 80 00 30 07 ff fc 00 00 81 00 5c 7f ff f6 00 00
    000000f0: c3 80 0f ff ff f2 00 00 c1 c0 27 ff ff e3 00 00
  UrbLink              = 00000000
[627960 ms] UsbSnoop - DispatchAny(f8916610) : IRP_MJ_INTERNAL_DEVICE_CONTROL
[627960 ms] UsbSnoop - MyDispatchInternalIOCTL(f8917e80) : fdo=822eee08, Irp=81c66760, IRQL=2
[627960 ms]  >>>  URB 869 going down  >>> 
-- URB_FUNCTION_BULK_OR_INTERRUPT_TRANSFER:
  PipeHandle           = 82300ef4 [endpoint 0x00000081]
  TransferFlags        = 00000003 (USBD_TRANSFER_DIRECTION_IN, USBD_SHORT_TRANSFER_OK)
  TransferBufferLength = 00000100
  TransferBuffer       = 00000000
  TransferBufferMDL    = 81ac92e0
  UrbLink              = 00000000
[627962 ms] UsbSnoop - MyInternalIOCTLCompletion(f8917db0) : fido=81b964f0, Irp=81c66760, Context=81bbf2f0, IRQL=2
[627962 ms]  <<<  URB 869 coming back  <<< 
-- URB_FUNCTION_BULK_OR_INTERRUPT_TRANSFER:
  PipeHandle           = 82300ef4 [endpoint 0x00000081]
  TransferFlags        = 00000003 (USBD_TRANSFER_DIRECTION_IN, USBD_SHORT_TRANSFER_OK)
  TransferBufferLength = 00000100
  TransferBuffer       = 00000000
  TransferBufferMDL    = 81ac92e0
    00000000: dc 00 73 ff ff c3 c0 00 dc 00 d1 7f ff c3 e8 00
    00000010: c0 01 dc 7f ff 03 e0 00 c0 03 ce 77 fe 03 f8 00
    00000020: ce 07 83 7f fc 03 fe 00 dd cf c3 ff f8 03 ff c0
    00000030: d7 3f 81 ff f0 07 ff c0 c1 ff 80 ff e0 07 ff c0
    00000040: c7 ff 80 3f c0 07 ff c0 0f ff c0 1f 00 0f ff c0
    00000050: 3f ff c0 1e 00 0f ff c0 ff ff c0 3e 00 0f ff c0
    00000060: df 02 55 00 4a 00 3c 00 00 00 00 00 00 00 00 00
    00000070: 00 00 00 00 00 00 00 00 00 00 04 00 00 00 00 00
    00000080: 00 00 7f 80 00 00 00 00 00 07 ff e0 00 00 00 00
    00000090: 00 3f ff f8 00 00 00 00 00 3f ff fc 00 00 00 00
    000000a0: 03 ff ff fc 00 00 00 00 07 ff ff ff 80 00 00 00
    000000b0: 0f ff ff ff e0 00 00 00 0f ff ff ff fc 00 00 00
    000000c0: 0f ff ff ff fe 00 00 00 1f ff ff ff ff 00 00 00
    000000d0: 3f ff ff ff ff 00 00 00 3f ff e0 7f ff 00 00 00
    000000e0: 7f f8 00 7f ff 00 00 00 7e 80 00 3f ff 00 00 00
    000000f0: 7c 00 00 1f ff 80 00 00 7c 00 00 1f ff 80 00 00
  UrbLink              = 00000000
[627990 ms] UsbSnoop - DispatchAny(f8916610) : IRP_MJ_INTERNAL_DEVICE_CONTROL
[627990 ms] UsbSnoop - MyDispatchInternalIOCTL(f8917e80) : fdo=822eee08, Irp=81c66760, IRQL=2
[627990 ms]  >>>  URB 870 going down  >>> 
-- URB_FUNCTION_BULK_OR_INTERRUPT_TRANSFER:
  PipeHandle           = 82300ef4 [endpoint 0x00000081]
  TransferFlags        = 00000003 (USBD_TRANSFER_DIRECTION_IN, USBD_SHORT_TRANSFER_OK)
  TransferBufferLength = 00000100
  TransferBuffer       = 00000000
  TransferBufferMDL    = 81ac92e0
  UrbLink              = 00000000
[627992 ms] UsbSnoop - MyInternalIOCTLCompletion(f8917db0) : fido=81b964f0, Irp=81c66760, Context=81cb4e48, IRQL=2
[627992 ms]  <<<  URB 870 coming back  <<< 
-- URB_FUNCTION_BULK_OR_INTERRUPT_TRANSFER:
  PipeHandle           = 82300ef4 [endpoint 0x00000081]
  TransferFlags        = 00000003 (USBD_TRANSFER_DIRECTION_IN, USBD_SHORT_TRANSFER_OK)
  TransferBufferLength = 00000100
  TransferBuffer       = 00000000
  TransferBufferMDL    = 81ac92e0
    00000000: fc 00 00 1f ff 80 00 00 fc 00 00 1f ff c0 00 00
    00000010: fc 00 00 1f ff c0 00 00 fc 00 00 1f ff c0 00 00
    00000020: f8 00 00 0f ff c0 00 00 f8 00 00 07 ff c0 00 00
    00000030: 7c 00 01 9f ff c0 00 00 fc 00 03 ff ff c0 00 00
    00000040: fc 00 03 ff ff e0 00 00 7c 7f 03 ff ff e0 00 00
    00000050: 7c 7f c3 ff ff e0 00 00 7c 9f c7 ff ff e0 00 00
    00000060: 3c 3f c7 02 ff e0 00 00 1c 3f 86 04 7f e0 00 00
    00000070: 1c 00 06 00 7f e0 00 00 0c 00 07 00 ff e0 00 00
    00000080: 0c 00 07 80 ff c0 00 00 0c 00 03 80 ff c0 00 00
    00000090: 0c 00 03 c0 ff c0 00 00 02 00 02 e0 ff 80 00 00
    000000a0: 02 02 03 f9 ff 00 00 00 02 02 67 ff ff 00 00 00
    000000b0: 01 04 1f ff fc 00 00 00 01 0c 0f fc fc 00 00 00
    000000c0: 01 0c 01 fc 7c 00 00 00 03 80 01 f8 7c 00 00 00
    000000d0: 00 81 ff fc fc 00 00 00 00 80 63 f0 fc 00 00 00
    000000e0: 00 80 00 60 fc 00 00 00 00 00 00 60 fc 00 00 00
    000000f0: 00 40 07 e3 ff 00 00 00 00 68 03 e3 ff 80 00 00
  UrbLink              = 00000000
[628020 ms] UsbSnoop - DispatchAny(f8916610) : IRP_MJ_INTERNAL_DEVICE_CONTROL
[628020 ms] UsbSnoop - MyDispatchInternalIOCTL(f8917e80) : fdo=822eee08, Irp=81c66760, IRQL=2
[628020 ms]  >>>  URB 871 going down  >>> 
-- URB_FUNCTION_BULK_OR_INTERRUPT_TRANSFER:
  PipeHandle           = 82300ef4 [endpoint 0x00000081]
  TransferFlags        = 00000003 (USBD_TRANSFER_DIRECTION_IN, USBD_SHORT_TRANSFER_OK)
  TransferBufferLength = 00000100
  TransferBuffer       = 00000000
  TransferBufferMDL    = 81ac92e0
  UrbLink              = 00000000
[628022 ms] UsbSnoop - MyInternalIOCTLCompletion(f8917db0) : fido=81b964f0, Irp=81c66760, Context=822fdcd0, IRQL=2
[628022 ms]  <<<  URB 871 coming back  <<< 
-- URB_FUNCTION_BULK_OR_INTERRUPT_TRANSFER:
  PipeHandle           = 82300ef4 [endpoint 0x00000081]
  TransferFlags        = 00000003 (USBD_TRANSFER_DIRECTION_IN, USBD_SHORT_TRANSFER_OK)
  TransferBufferLength = 000000ff
  TransferBuffer       = 00000000
  TransferBufferMDL    = 81ac92e0
    00000000: 00 10 00 03 f9 e0 00 00 00 08 00 07 f9 f0 00 00
    00000010: 00 0c 00 07 f9 f8 00 00 00 0f 00 1f f1 ff 00 00
    00000020: 00 0f 80 1f e1 ff e0 00 00 0f 80 3f e1 ff f0 00
    00000030: 00 1b ff ff 83 ff f0 00 00 39 ff ff 03 ff f0 00
    00000040: 01 f8 7f fe 03 ff f0 00 03 f8 7f fc 03 ff f0 00
    00000050: 0f f8 3f fc 03 ff f0 00 7f fc 0f f0 03 ff f0 00
    00000060: ff fc 07 e0 03 ff f0 03 ff fc 03 c0 03 ff f0 1f
    00000070: ff fc 00 00 03 ff f0 7f ff fc 03 80 03 ff f0 ff
    00000080: ff fe 07 e0 07 ff f0 ff ff fe 0f f0 07 ff f0 ff
    00000090: ff fe 1f f8 07 ff f0 ff ff fe 13 f8 07 ff f0 ff
    000000a0: ff fe 23 f0 07 ff f0 ff ff ff 03 f0 07 ff f0 ff
    000000b0: ff ff 03 e0 07 ff f0 df 02 55 00 4a 00 3b 23 3c
    000000c0: ff ff ff ff ff e0 01 ef 0f ff ff ff ff e0 13 ee
    000000d0: 7f fb ff ff ff e0 0b ef ff c0 0f ff ff e0 3f fd
    000000e0: f8 00 01 ff ff e0 9f ff c0 00 00 7f ff e0 ef ff
    000000f0: c0 00 00 1f ff e0 fe ff 80 00 00 07 ff e0 ff
  UrbLink              = 00000000
[628050 ms] UsbSnoop - DispatchAny(f8916610) : IRP_MJ_INTERNAL_DEVICE_CONTROL
[628050 ms] UsbSnoop - MyDispatchInternalIOCTL(f8917e80) : fdo=822eee08, Irp=81c66760, IRQL=2
[628050 ms]  >>>  URB 872 going down  >>> 
-- URB_FUNCTION_BULK_OR_INTERRUPT_TRANSFER:
  PipeHandle           = 82300f14 [endpoint 0x00000002]
  TransferFlags        = 00000000 (USBD_TRANSFER_DIRECTION_OUT, ~USBD_SHORT_TRANSFER_OK)
  TransferBufferLength = 00000007
  TransferBuffer       = 00000000
  TransferBufferMDL    = 81ac92e0
    00000000: 00 00 00 02 05 e0 00
  UrbLink              = 00000000
[628050 ms] UsbSnoop - MyInternalIOCTLCompletion(f8917db0) : fido=81b964f0, Irp=81c66760, Context=81bbf2f0, IRQL=2
[628050 ms]  <<<  URB 872 coming back  <<< 
-- URB_FUNCTION_BULK_OR_INTERRUPT_TRANSFER:
  PipeHandle           = 82300f14 [endpoint 0x00000002]
  TransferFlags        = 00000000 (USBD_TRANSFER_DIRECTION_OUT, ~USBD_SHORT_TRANSFER_OK)
  TransferBufferLength = 00000007
  TransferBuffer       = 00000000
  TransferBufferMDL    = 81ac92e0
  UrbLink              = 00000000
[628060 ms] UsbSnoop - DispatchAny(f8916610) : IRP_MJ_INTERNAL_DEVICE_CONTROL
[628060 ms] UsbSnoop - MyDispatchInternalIOCTL(f8917e80) : fdo=822eee08, Irp=81c66760, IRQL=2
[628060 ms]  >>>  URB 873 going down  >>> 
-- URB_FUNCTION_BULK_OR_INTERRUPT_TRANSFER:
  PipeHandle           = 82300ef4 [endpoint 0x00000081]
  TransferFlags        = 00000003 (USBD_TRANSFER_DIRECTION_IN, USBD_SHORT_TRANSFER_OK)
  TransferBufferLength = 00000100
  TransferBuffer       = 00000000
  TransferBufferMDL    = 81ac92e0
  UrbLink              = 00000000
[628060 ms] UsbSnoop - MyInternalIOCTLCompletion(f8917db0) : fido=81b964f0, Irp=81c66760, Context=822fdcd0, IRQL=2
[628060 ms]  <<<  URB 873 coming back  <<< 
-- URB_FUNCTION_BULK_OR_INTERRUPT_TRANSFER:
  PipeHandle           = 82300ef4 [endpoint 0x00000081]
  TransferFlags        = 00000003 (USBD_TRANSFER_DIRECTION_IN, USBD_SHORT_TRANSFER_OK)
  TransferBufferLength = 00000005
  TransferBuffer       = 00000000
  TransferBufferMDL    = 81ac92e0
    00000000: 00 00 03 ff 03
  UrbLink              = 00000000
[628090 ms] UsbSnoop - DispatchAny(f8916610) : IRP_MJ_INTERNAL_DEVICE_CONTROL
[628090 ms] UsbSnoop - MyDispatchInternalIOCTL(f8917e80) : fdo=822eee08, Irp=81c66760, IRQL=2
[628090 ms]  >>>  URB 874 going down  >>> 
-- URB_FUNCTION_BULK_OR_INTERRUPT_TRANSFER:
  PipeHandle           = 82300ef4 [endpoint 0x00000081]
  TransferFlags        = 00000003 (USBD_TRANSFER_DIRECTION_IN, USBD_SHORT_TRANSFER_OK)
  TransferBufferLength = 00000100
  TransferBuffer       = 00000000
  TransferBufferMDL    = 81ac92e0
  UrbLink              = 00000000
[628092 ms] UsbSnoop - MyInternalIOCTLCompletion(f8917db0) : fido=81b964f0, Irp=81c66760, Context=81abee68, IRQL=2
[628092 ms]  <<<  URB 874 coming back  <<< 
-- URB_FUNCTION_BULK_OR_INTERRUPT_TRANSFER:
  PipeHandle           = 82300ef4 [endpoint 0x00000081]
  TransferFlags        = 00000003 (USBD_TRANSFER_DIRECTION_IN, USBD_SHORT_TRANSFER_OK)
  TransferBufferLength = 00000100
  TransferBuffer       = 00000000
  TransferBufferMDL    = 81ac92e0
    00000000: ff 00 00 00 19 ff e0 ff fe 00 00 00 09 ff e0 ff
    00000010: fc 00 00 00 00 7f e0 ff fc 00 00 00 00 7f e0 ff
    00000020: fc 00 00 00 00 1f e0 ff f8 00 00 00 04 1f e0 ff
    00000030: f8 00 00 00 06 1f e0 ff f0 00 00 00 03 9f e0 ff
    00000040: f0 00 00 00 03 ff e0 ff f0 00 00 00 00 77 e0 ff
    00000050: f0 00 00 00 00 77 e0 ff f0 00 00 00 00 3f e0 ff
    00000060: e0 00 00 00 00 1f e0 ff c0 00 f0 00 00 9f e0 ff
    00000070: f8 05 fe 00 00 0f e0 ff ff 07 c3 00 08 1f e0 ff
    00000080: f7 c3 01 80 03 4f e0 ff e7 c3 72 c0 03 87 e0 ff
    00000090: ff c1 ff 40 03 27 e0 ff ff c0 ff e0 06 73 e0 ff
    000000a0: fc 40 00 60 04 db e0 ff fc 00 00 00 03 9b e0 ff
    000000b0: e1 00 00 00 03 83 e0 ff cf 00 00 00 01 c3 e0 ff
    000000c0: c4 00 00 00 00 43 e0 ff e0 00 00 00 00 07 e0 ff
    000000d0: f0 00 80 00 00 07 e0 ff e3 cf c0 00 02 27 e0 ff
    000000e0: e3 ff 80 00 00 6f e0 ff e3 fa 20 00 00 0f e0 ff
    000000f0: fc f0 20 00 00 1f e0 ff fc 60 00 00 00 3f e0 ff
  UrbLink              = 00000000
[628120 ms] UsbSnoop - DispatchAny(f8916610) : IRP_MJ_INTERNAL_DEVICE_CONTROL
[628120 ms] UsbSnoop - MyDispatchInternalIOCTL(f8917e80) : fdo=822eee08, Irp=81c66760, IRQL=2
[628120 ms]  >>>  URB 875 going down  >>> 
-- URB_FUNCTION_BULK_OR_INTERRUPT_TRANSFER:
  PipeHandle           = 82300ef4 [endpoint 0x00000081]
  TransferFlags        = 00000003 (USBD_TRANSFER_DIRECTION_IN, USBD_SHORT_TRANSFER_OK)
  TransferBufferLength = 00000100
  TransferBuffer       = 00000000
  TransferBufferMDL    = 81ac92e0
  UrbLink              = 00000000
[628122 ms] UsbSnoop - MyInternalIOCTLCompletion(f8917db0) : fido=81b964f0, Irp=81c66760, Context=81bbf2f0, IRQL=2
[628122 ms]  <<<  URB 875 coming back  <<< 
-- URB_FUNCTION_BULK_OR_INTERRUPT_TRANSFER:
  PipeHandle           = 82300ef4 [endpoint 0x00000081]
  TransferFlags        = 00000003 (USBD_TRANSFER_DIRECTION_IN, USBD_SHORT_TRANSFER_OK)
  TransferBufferLength = 00000100
  TransferBuffer       = 00000000
  TransferBufferMDL    = 81ac92e0
    00000000: f8 40 00 00 04 3f e0 ff f1 40 00 00 06 7f e0 ff
    00000010: e1 fc 00 00 03 ff e0 ff e7 fc 80 00 03 ff e0 ff
    00000020: cf 80 80 00 03 ff e0 ff cf fe c0 00 01 ff e0 ff
    00000030: ef fe 00 00 01 ff e0 ff f3 fe 00 00 01 ff e0 ff
    00000040: ff f7 00 01 00 ff e0 ff fe 00 00 02 00 7f e0 ff
    00000050: fe 00 00 02 00 7f e0 ff fe 00 07 e4 00 7f e0 ff
    00000060: ff 80 1f fc 00 7f e0 ff ff ff ff e0 01 ff e0 ff
    00000070: ff ff fe 00 43 ff e0 ff ff ff c0 00 8f ff e0 ff
    00000080: ff ff c0 00 3f ff e0 ff ff ff c0 00 7f ff e0 ff
    00000090: ff ff e0 61 ff ff e0 ff ff ff f3 c7 ff ff e0 ff
    000000a0: ff bf f6 1f ff ff e0 ff ff 3e 78 3f ff ff e0 ff
    000000b0: ff ff e0 ff ff ff e0 ff ff ff f1 ff 77 ff e0 ff
    000000c0: ff 3f fb ff df ff e0 ff fe 7f 8f ff ff ff e0 ff
    000000d0: fc ff 1f fe f3 bf e0 ff fd fe 3f fd ff ff e0 ff
    000000e0: f9 fc 7f ff ff ff e0 ff fb 78 df ee fb ef e0 ff
    000000f0: fb e3 ff df d3 ff 60 ff ff c7 ff d7 f6 fd e0 ff
  UrbLink              = 00000000
[628150 ms] UsbSnoop - DispatchAny(f8916610) : IRP_MJ_INTERNAL_DEVICE_CONTROL
[628150 ms] UsbSnoop - MyDispatchInternalIOCTL(f8917e80) : fdo=822eee08, Irp=81c66760, IRQL=2
[628150 ms]  >>>  URB 876 going down  >>> 
-- URB_FUNCTION_BULK_OR_INTERRUPT_TRANSFER:
  PipeHandle           = 82300ef4 [endpoint 0x00000081]
  TransferFlags        = 00000003 (USBD_TRANSFER_DIRECTION_IN, USBD_SHORT_TRANSFER_OK)
  TransferBufferLength = 00000100
  TransferBuffer       = 00000000
  TransferBufferMDL    = 81ac92e0
  UrbLink              = 00000000
[628152 ms] UsbSnoop - MyInternalIOCTLCompletion(f8917db0) : fido=81b964f0, Irp=81c66760, Context=81cb4e48, IRQL=2
[628152 ms]  <<<  URB 876 coming back  <<< 
-- URB_FUNCTION_BULK_OR_INTERRUPT_TRANSFER:
  PipeHandle           = 82300ef4 [endpoint 0x00000081]
  TransferFlags        = 00000003 (USBD_TRANSFER_DIRECTION_IN, USBD_SHORT_TRANSFER_OK)
  TransferBufferLength = 00000100
  TransferBuffer       = 00000000
  TransferBufferMDL    = 81ac92e0
    00000000: ff 9f bf ff ef e7 e0 ff ff bf bf ef fe fd c0 df
    00000010: 02 0b 00 4a 00 38 00 00 1e 3f ff ff 80 00 00 1c
    00000020: 3f ff ff c0 00 00 1c ff ff ff c0 00 00 1f cf ff
    00000030: ff c1 00 00 38 00 ff ff c0 00 00 e0 00 ff ff c0
    00000040: 00 01 e0 00 73 ff c0 00 03 00 00 3f ff c0 80 06
    00000050: 00 00 06 7f c0 c0 04 00 00 04 3f c0 c0 00 00 00
    00000060: 02 9f c0 e0 10 00 00 07 9f 80 e0 10 00 00 07 cf
    00000070: cc e0 20 00 00 03 8f f8 e0 20 00 00 07 8f f8 e0
    00000080: 00 00 00 07 9f f8 e0 40 00 00 07 df fc e0 40 00
    00000090: 00 07 ff ff c0 c0 00 00 07 ff ff c0 80 00 00 07
    000000a0: df ff c0 80 00 00 07 ff ff c0 80 00 00 07 ff ff
    000000b0: c0 80 00 00 0f ff ff c0 80 00 00 07 ff ff c0 c0
    000000c0: 00 00 07 ff ff c0 c0 00 00 07 ff ff c0 e0 00 00
    000000d0: 07 ff ff c0 e0 00 00 07 ff ff c0 e0 00 00 0f ff
    000000e0: ff c0 e0 30 07 1f ff ff c0 e0 3c 3f 7f ff ff c0
    000000f0: e3 fc 3c ff ff ff 60 c2 20 30 1c 7f ff 20 c0 10
  UrbLink              = 00000000
[628180 ms] UsbSnoop - DispatchAny(f8916610) : IRP_MJ_INTERNAL_DEVICE_CONTROL
[628180 ms] UsbSnoop - MyDispatchInternalIOCTL(f8917e80) : fdo=822eee08, Irp=81c66760, IRQL=2
[628180 ms]  >>>  URB 877 going down  >>> 
-- URB_FUNCTION_BULK_OR_INTERRUPT_TRANSFER:
  PipeHandle           = 82300ef4 [endpoint 0x00000081]
  TransferFlags        = 00000003 (USBD_TRANSFER_DIRECTION_IN, USBD_SHORT_TRANSFER_OK)
  TransferBufferLength = 00000100
  TransferBuffer       = 00000000
  TransferBufferMDL    = 81ac92e0
  UrbLink              = 00000000
[628182 ms] UsbSnoop - MyInternalIOCTLCompletion(f8917db0) : fido=81b964f0, Irp=81c66760, Context=81abee68, IRQL=2
[628182 ms]  <<<  URB 877 coming back  <<< 
-- URB_FUNCTION_BULK_OR_INTERRUPT_TRANSFER:
  PipeHandle           = 82300ef4 [endpoint 0x00000081]
  TransferFlags        = 00000003 (USBD_TRANSFER_DIRECTION_IN, USBD_SHORT_TRANSFER_OK)
  TransferBufferLength = 000000ff
  TransferBuffer       = 00000000
  TransferBufferMDL    = 81ac92e0
    00000000: 30 00 7f ff 00 c0 00 30 00 7f e7 00 e0 00 30 00
    00000010: ff e7 04 e0 00 18 00 ff e1 04 e0 00 18 00 ff c0
    00000020: 00 c0 00 34 01 ff c1 00 c0 00 26 01 ff c3 00 80
    00000030: 00 3e 01 ff c1 00 80 0c 7e 03 ff d9 00 00 47 fe
    00000040: 03 ff df 00 00 c1 f8 03 fd ff 00 01 c0 00 03 ff
    00000050: ff 00 01 00 00 c3 fd ff 00 00 60 03 c3 ff ff 00
    00000060: 00 1f ff c3 ff ff 00 00 00 06 06 ff ff 00 00 00
    00000070: 00 04 ff ff 00 00 00 02 05 ff ff 00 00 00 04 0d
    00000080: ff ff 00 00 00 00 0f ff ff 00 00 00 00 1f ff ff
    00000090: 00 00 00 00 1f ff ff 00 00 00 00 3f ff ff 00 00
    000000a0: c0 00 7f ff ff 00 01 c0 00 ff ff ff 00 3f c0 03
    000000b0: ff ff ff 0f ff c0 07 ff ff ff ff ff c7 ff ff 3f
    000000c0: ff ff ff c1 ff fc 3f ff ff ff c0 ff f0 7f ff ff
    000000d0: ff c0 7f c0 ff ff ff ff c0 3e 00 ff ff ff ff c0
    000000e0: 10 01 ff ff ff ff c0 00 03 ff ff ff ff c0 78 07
    000000f0: ff ff ff ff c0 f8 0f ff ff ff ff c3 fc 0f ff
  UrbLink              = 00000000
[628210 ms] UsbSnoop - DispatchAny(f8916610) : IRP_MJ_INTERNAL_DEVICE_CONTROL
[628210 ms] UsbSnoop - MyDispatchInternalIOCTL(f8917e80) : fdo=822eee08, Irp=81c66760, IRQL=2
[628210 ms]  >>>  URB 878 going down  >>> 
-- URB_FUNCTION_BULK_OR_INTERRUPT_TRANSFER:
  PipeHandle           = 82300f14 [endpoint 0x00000002]
  TransferFlags        = 00000000 (USBD_TRANSFER_DIRECTION_OUT, ~USBD_SHORT_TRANSFER_OK)
  TransferBufferLength = 00000007
  TransferBuffer       = 00000000
  TransferBufferMDL    = 81ac92e0
    00000000: 00 00 00 02 05 e0 00
  UrbLink              = 00000000
[628210 ms] UsbSnoop - MyInternalIOCTLCompletion(f8917db0) : fido=81b964f0, Irp=81c66760, Context=81bbf2f0, IRQL=2
[628210 ms]  <<<  URB 878 coming back  <<< 
-- URB_FUNCTION_BULK_OR_INTERRUPT_TRANSFER:
  PipeHandle           = 82300f14 [endpoint 0x00000002]
  TransferFlags        = 00000000 (USBD_TRANSFER_DIRECTION_OUT, ~USBD_SHORT_TRANSFER_OK)
  TransferBufferLength = 00000007
  TransferBuffer       = 00000000
  TransferBufferMDL    = 81ac92e0
  UrbLink              = 00000000
[628220 ms] UsbSnoop - DispatchAny(f8916610) : IRP_MJ_INTERNAL_DEVICE_CONTROL
[628220 ms] UsbSnoop - MyDispatchInternalIOCTL(f8917e80) : fdo=822eee08, Irp=81c66760, IRQL=2
[628220 ms]  >>>  URB 879 going down  >>> 
-- URB_FUNCTION_BULK_OR_INTERRUPT_TRANSFER:
  PipeHandle           = 82300ef4 [endpoint 0x00000081]
  TransferFlags        = 00000003 (USBD_TRANSFER_DIRECTION_IN, USBD_SHORT_TRANSFER_OK)
  TransferBufferLength = 00000100
  TransferBuffer       = 00000000
  TransferBufferMDL    = 81ac92e0
  UrbLink              = 00000000
[628220 ms] UsbSnoop - MyInternalIOCTLCompletion(f8917db0) : fido=81b964f0, Irp=81c66760, Context=81abee68, IRQL=2
[628220 ms]  <<<  URB 879 coming back  <<< 
-- URB_FUNCTION_BULK_OR_INTERRUPT_TRANSFER:
  PipeHandle           = 82300ef4 [endpoint 0x00000081]
  TransferFlags        = 00000003 (USBD_TRANSFER_DIRECTION_IN, USBD_SHORT_TRANSFER_OK)
  TransferBufferLength = 00000005
  TransferBuffer       = 00000000
  TransferBufferMDL    = 81ac92e0
    00000000: 00 00 03 ff 03
  UrbLink              = 00000000
[628250 ms] UsbSnoop - DispatchAny(f8916610) : IRP_MJ_INTERNAL_DEVICE_CONTROL
[628250 ms] UsbSnoop - MyDispatchInternalIOCTL(f8917e80) : fdo=822eee08, Irp=81c66760, IRQL=2
[628250 ms]  >>>  URB 880 going down  >>> 
-- URB_FUNCTION_BULK_OR_INTERRUPT_TRANSFER:
  PipeHandle           = 82300ef4 [endpoint 0x00000081]
  TransferFlags        = 00000003 (USBD_TRANSFER_DIRECTION_IN, USBD_SHORT_TRANSFER_OK)
  TransferBufferLength = 00000100
  TransferBuffer       = 00000000
  TransferBufferMDL    = 81ac92e0
  UrbLink              = 00000000
[628252 ms] UsbSnoop - MyInternalIOCTLCompletion(f8917db0) : fido=81b964f0, Irp=81c66760, Context=822f3898, IRQL=2
[628252 ms]  <<<  URB 880 coming back  <<< 
-- URB_FUNCTION_BULK_OR_INTERRUPT_TRANSFER:
  PipeHandle           = 82300ef4 [endpoint 0x00000081]
  TransferFlags        = 00000003 (USBD_TRANSFER_DIRECTION_IN, USBD_SHORT_TRANSFER_OK)
  TransferBufferLength = 00000100
  TransferBuffer       = 00000000
  TransferBufferMDL    = 81ac92e0
    00000000: ff ff ff c3 fc 1f ff ff ff ff c7 fc 3f ff ff ff
    00000010: ff cf fc 3f ff ff ff ff cf f8 7f ff ff df 02 55
    00000020: 00 4a 00 3a ff ff ff ff ff ff ff c0 ff ff ff ff
    00000030: ff ff ff c0 ff ff ff ff 3f ff ff c0 ff ff fe 40
    00000040: 03 ff ff c0 ff ff f8 00 00 ff ff c0 ff ff e0 00
    00000050: 00 3f ff c0 ff ff c0 00 00 3f ff c0 ff ff 00 00
    00000060: 00 7f ff c0 ff fe 00 00 00 3f ff c0 ff fc 00 00
    00000070: 00 1b ff c0 ff f8 00 00 00 0d ff c0 ff f0 00 00
    00000080: 00 05 ff c0 ff e0 00 00 00 1d ff c0 ff e0 00 00
    00000090: 00 05 ff c0 ff c8 00 00 00 06 ff c0 ff c0 00 00
    000000a0: 00 03 7f c0 ff 90 00 00 00 03 7f c0 ff 80 00 00
    000000b0: 00 03 7f c0 ff 80 00 00 00 01 ff c0 ff 80 00 00
    000000c0: 00 05 ff c0 ff 00 00 00 00 03 ff c0 fe 00 00 01
    000000d0: c0 1f ff c0 fe 01 00 07 e1 3d ff c0 f8 00 00 08
    000000e0: 10 ff ff c0 f0 00 00 12 00 c7 ff c0 f0 00 00 0f
    000000f0: 00 bf ff c0 f0 00 00 06 40 7d ef c0 f0 00 80 00
  UrbLink              = 00000000
[628280 ms] UsbSnoop - DispatchAny(f8916610) : IRP_MJ_INTERNAL_DEVICE_CONTROL
[628280 ms] UsbSnoop - MyDispatchInternalIOCTL(f8917e80) : fdo=822eee08, Irp=81c66760, IRQL=2
[628280 ms]  >>>  URB 881 going down  >>> 
-- URB_FUNCTION_BULK_OR_INTERRUPT_TRANSFER:
  PipeHandle           = 82300ef4 [endpoint 0x00000081]
  TransferFlags        = 00000003 (USBD_TRANSFER_DIRECTION_IN, USBD_SHORT_TRANSFER_OK)
  TransferBufferLength = 00000100
  TransferBuffer       = 00000000
  TransferBufferMDL    = 81ac92e0
  UrbLink              = 00000000
[628282 ms] UsbSnoop - MyInternalIOCTLCompletion(f8917db0) : fido=81b964f0, Irp=81c66760, Context=81bbf2f0, IRQL=2
[628282 ms]  <<<  URB 881 coming back  <<< 
-- URB_FUNCTION_BULK_OR_INTERRUPT_TRANSFER:
  PipeHandle           = 82300ef4 [endpoint 0x00000081]
  TransferFlags        = 00000003 (USBD_TRANSFER_DIRECTION_IN, USBD_SHORT_TRANSFER_OK)
  TransferBufferLength = 00000100
  TransferBuffer       = 00000000
  TransferBufferMDL    = 81ac92e0
    00000000: 00 85 fa c0 f7 08 00 00 00 c4 ff c0 fb e4 00 00
    00000010: 00 40 ff c0 ff fa 00 00 00 40 ff c0 ff df 00 00
    00000020: 00 60 ff c0 ff fd 30 00 00 60 ff c0 ff fc 60 00
    00000030: 00 60 ff c0 ff ee 28 00 00 41 ff c0 ff f6 30 00
    00000040: 00 23 ff c0 ff ef f0 00 1c 62 ff c0 ff f3 c0 00
    00000050: 0f e0 ff c0 ff f3 80 00 03 e1 ff c0 ff df 80 00
    00000060: 00 e1 ff c0 fe ff 80 00 00 63 ff c0 f7 ff 00 00
    00000070: 89 e3 7f c0 fb ff 00 02 07 93 ff c0 ef fe 80 00
    00000080: 00 03 ff c0 ff fc c4 00 00 0f ff c0 ff fd c2 00
    00000090: 00 2f ff c0 ff fc e1 00 00 6f ff c0 ef fa e1 80
    000000a0: 00 0d ff c0 bf fb e0 80 00 1f ff c0 cf fb e0 58
    000000b0: 00 3f ff c0 bf f3 70 26 00 7f ff c0 df f3 50 3b
    000000c0: 80 ef ff c0 e7 e7 78 1f ff ff ff c0 df e7 f8 0f
    000000d0: 7f f7 ff c0 ef ef 78 07 ff fb ff c0 2f ef fc 03
    000000e0: ff fd ff c0 f7 ef fe 00 ff fe 7f c0 b7 df be 00
    000000f0: ff ff 9f c0 f7 9f ff 00 3f ff ef c0 ef 9f ff 00
  UrbLink              = 00000000
[628310 ms] UsbSnoop - DispatchAny(f8916610) : IRP_MJ_INTERNAL_DEVICE_CONTROL
[628310 ms] UsbSnoop - MyDispatchInternalIOCTL(f8917e80) : fdo=822eee08, Irp=81c66760, IRQL=2
[628310 ms]  >>>  URB 882 going down  >>> 
-- URB_FUNCTION_BULK_OR_INTERRUPT_TRANSFER:
  PipeHandle           = 82300ef4 [endpoint 0x00000081]
  TransferFlags        = 00000003 (USBD_TRANSFER_DIRECTION_IN, USBD_SHORT_TRANSFER_OK)
  TransferBufferLength = 00000100
  TransferBuffer       = 00000000
  TransferBufferMDL    = 81ac92e0
  UrbLink              = 00000000
[628312 ms] UsbSnoop - MyInternalIOCTLCompletion(f8917db0) : fido=81b964f0, Irp=81c66760, Context=81cb4e48, IRQL=2
[628312 ms]  <<<  URB 882 coming back  <<< 
-- URB_FUNCTION_BULK_OR_INTERRUPT_TRANSFER:
  PipeHandle           = 82300ef4 [endpoint 0x00000081]
  TransferFlags        = 00000003 (USBD_TRANSFER_DIRECTION_IN, USBD_SHORT_TRANSFER_OK)
  TransferBufferLength = 00000100
  TransferBuffer       = 00000000
  TransferBufferMDL    = 81ac92e0
    00000000: 07 ff f7 c0 ee 5f ff 80 01 ff fb c0 f8 3f ff c0
    00000010: 00 7f ff c0 f0 5f ff c0 00 3f ff c0 c5 ff ff e0
    00000020: 00 3f ff c0 9f ff ff f0 00 3f ff c0 77 ff ff f0
    00000030: 00 0f ff c0 ff ff ff f8 00 0f ff c0 ff ff ff fe
    00000040: 00 0f ff c0 ff ff ff ff 00 0f ff c0 ff ff ff ff
    00000050: 00 1f ff c0 ff ff ff ff 80 1f ff c0 ff ff ff ff
    00000060: 80 0f ff c0 ff ff ff ff 80 06 fd c0 ff ff ff ff
    00000070: c0 06 ff c0 df 02 55 00 4a 00 3c 00 00 00 00 00
    00000080: 00 00 00 00 00 01 f8 00 00 00 00 00 00 0f f0 20
    00000090: 00 00 00 00 00 3f f0 00 00 00 00 00 00 7f e0 00
    000000a0: 00 00 00 00 00 ff e0 00 00 00 00 00 03 ff e0 00
    000000b0: 00 00 00 00 07 ef 00 00 00 00 00 00 0f d4 c0 01
    000000c0: 00 00 00 00 0f ca 00 00 80 00 00 00 3f e0 00 00
    000000d0: 0a 00 00 00 3f 80 00 00 2b 00 00 00 7e 00 00 00
    000000e0: 35 00 00 00 7c 00 00 00 0d 80 00 00 78 00 00 00
    000000f0: 05 80 00 00 70 00 00 00 07 80 00 00 78 00 00 00
  UrbLink              = 00000000
[628340 ms] UsbSnoop - DispatchAny(f8916610) : IRP_MJ_INTERNAL_DEVICE_CONTROL
[628340 ms] UsbSnoop - MyDispatchInternalIOCTL(f8917e80) : fdo=822eee08, Irp=81c66760, IRQL=2
[628340 ms]  >>>  URB 883 going down  >>> 
-- URB_FUNCTION_BULK_OR_INTERRUPT_TRANSFER:
  PipeHandle           = 82300ef4 [endpoint 0x00000081]
  TransferFlags        = 00000003 (USBD_TRANSFER_DIRECTION_IN, USBD_SHORT_TRANSFER_OK)
  TransferBufferLength = 00000100
  TransferBuffer       = 00000000
  TransferBufferMDL    = 81ac92e0
  UrbLink              = 00000000
[628342 ms] UsbSnoop - MyInternalIOCTLCompletion(f8917db0) : fido=81b964f0, Irp=81c66760, Context=822f3898, IRQL=2
[628342 ms]  <<<  URB 883 coming back  <<< 
-- URB_FUNCTION_BULK_OR_INTERRUPT_TRANSFER:
  PipeHandle           = 82300ef4 [endpoint 0x00000081]
  TransferFlags        = 00000003 (USBD_TRANSFER_DIRECTION_IN, USBD_SHORT_TRANSFER_OK)
  TransferBufferLength = 000000ff
  TransferBuffer       = 00000000
  TransferBufferMDL    = 81ac92e0
    00000000: 07 c0 00 00 78 00 00 00 03 c0 00 00 7c 00 00 00
    00000010: 03 c0 00 00 7f 00 00 00 03 e0 00 00 7f 00 00 00
    00000020: 03 e0 00 00 7f 80 00 00 00 e0 00 00 7d 00 00 00
    00000030: 00 c0 00 00 7c 00 00 00 00 40 00 00 78 00 00 00
    00000040: 00 00 00 00 7e 00 00 00 00 00 00 00 70 06 00 00
    00000050: 00 10 00 00 70 02 9f f8 00 38 00 00 7f 60 7f 0c
    00000060: 00 30 00 00 7f f1 fc 00 00 00 00 00 7c f8 ff f0
    00000070: 01 00 00 00 3f f8 7f fc 01 00 00 00 7f f8 3c 00
    00000080: 00 80 00 00 3d 18 08 00 00 00 00 00 3c 10 00 00
    00000090: 00 00 00 00 3f 30 00 00 00 00 00 00 3f 30 00 00
    000000a0: 00 00 00 00 20 20 00 00 00 00 00 00 70 20 00 00
    000000b0: 00 00 00 00 78 60 08 00 00 00 00 00 38 60 0c 00
    000000c0: 00 00 00 00 3c 7d e6 00 00 40 00 00 3e ff e2 00
    000000d0: 00 c0 00 00 3f fe 03 00 00 c0 00 00 3f fe 01 80
    000000e0: 00 80 00 00 3f f8 00 80 00 80 00 00 3f f0 00 40
    000000f0: 00 00 00 00 1f fc fe 00 00 20 00 00 1f ff c3
  UrbLink              = 00000000
[628371 ms] UsbSnoop - DispatchAny(f8916610) : IRP_MJ_INTERNAL_DEVICE_CONTROL
[628371 ms] UsbSnoop - MyDispatchInternalIOCTL(f8917e80) : fdo=822eee08, Irp=81c873d8, IRQL=2
[628371 ms]  >>>  URB 884 going down  >>> 
-- URB_FUNCTION_BULK_OR_INTERRUPT_TRANSFER:
  PipeHandle           = 82300f14 [endpoint 0x00000002]
  TransferFlags        = 00000000 (USBD_TRANSFER_DIRECTION_OUT, ~USBD_SHORT_TRANSFER_OK)
  TransferBufferLength = 00000007
  TransferBuffer       = 00000000
  TransferBufferMDL    = 81b65b08
    00000000: 00 00 00 02 05 e0 00
  UrbLink              = 00000000
[628371 ms] UsbSnoop - MyInternalIOCTLCompletion(f8917db0) : fido=81b964f0, Irp=81c873d8, Context=81cdfe48, IRQL=2
[628371 ms]  <<<  URB 884 coming back  <<< 
-- URB_FUNCTION_BULK_OR_INTERRUPT_TRANSFER:
  PipeHandle           = 82300f14 [endpoint 0x00000002]
  TransferFlags        = 00000000 (USBD_TRANSFER_DIRECTION_OUT, ~USBD_SHORT_TRANSFER_OK)
  TransferBufferLength = 00000007
  TransferBuffer       = 00000000
  TransferBufferMDL    = 81b65b08
  UrbLink              = 00000000
[628380 ms] UsbSnoop - DispatchAny(f8916610) : IRP_MJ_INTERNAL_DEVICE_CONTROL
[628380 ms] UsbSnoop - MyDispatchInternalIOCTL(f8917e80) : fdo=822eee08, Irp=81c873d8, IRQL=2
[628380 ms]  >>>  URB 885 going down  >>> 
-- URB_FUNCTION_BULK_OR_INTERRUPT_TRANSFER:
  PipeHandle           = 82300ef4 [endpoint 0x00000081]
  TransferFlags        = 00000003 (USBD_TRANSFER_DIRECTION_IN, USBD_SHORT_TRANSFER_OK)
  TransferBufferLength = 00000100
  TransferBuffer       = 00000000
  TransferBufferMDL    = 81ac92e0
  UrbLink              = 00000000
[628381 ms] UsbSnoop - MyInternalIOCTLCompletion(f8917db0) : fido=81b964f0, Irp=81c873d8, Context=81bbf2f0, IRQL=2
[628381 ms]  <<<  URB 885 coming back  <<< 
-- URB_FUNCTION_BULK_OR_INTERRUPT_TRANSFER:
  PipeHandle           = 82300ef4 [endpoint 0x00000081]
  TransferFlags        = 00000003 (USBD_TRANSFER_DIRECTION_IN, USBD_SHORT_TRANSFER_OK)
  TransferBufferLength = 00000005
  TransferBuffer       = 00000000
  TransferBufferMDL    = 81ac92e0
    00000000: 00 00 03 ff 03
  UrbLink              = 00000000
[628410 ms] UsbSnoop - DispatchAny(f8916610) : IRP_MJ_INTERNAL_DEVICE_CONTROL
[628410 ms] UsbSnoop - MyDispatchInternalIOCTL(f8917e80) : fdo=822eee08, Irp=81c873d8, IRQL=2
[628410 ms]  >>>  URB 886 going down  >>> 
-- URB_FUNCTION_BULK_OR_INTERRUPT_TRANSFER:
  PipeHandle           = 82300ef4 [endpoint 0x00000081]
  TransferFlags        = 00000003 (USBD_TRANSFER_DIRECTION_IN, USBD_SHORT_TRANSFER_OK)
  TransferBufferLength = 00000100
  TransferBuffer       = 00000000
  TransferBufferMDL    = 81ac92e0
  UrbLink              = 00000000
[628412 ms] UsbSnoop - MyInternalIOCTLCompletion(f8917db0) : fido=81b964f0, Irp=81c873d8, Context=81abee68, IRQL=2
[628412 ms]  <<<  URB 886 coming back  <<< 
-- URB_FUNCTION_BULK_OR_INTERRUPT_TRANSFER:
  PipeHandle           = 82300ef4 [endpoint 0x00000081]
  TransferFlags        = 00000003 (USBD_TRANSFER_DIRECTION_IN, USBD_SHORT_TRANSFER_OK)
  TransferBufferLength = 00000100
  TransferBuffer       = 00000000
  TransferBufferMDL    = 81ac92e0
    00000000: 00 0e 10 00 00 1f f2 00 00 1e 18 00 00 0f f0 00
    00000010: 00 fc 3c 00 00 0f ff c0 04 f8 3e 00 00 0f ff c0
    00000020: 19 f8 7f 00 00 07 f8 00 1f f0 7f 80 00 03 c0 00
    00000030: 1f e0 ff f0 00 03 c0 00 1f c0 ff f0 00 01 c0 00
    00000040: 7f 81 ff f0 00 00 f9 03 fe 03 ff f0 00 00 3f ff
    00000050: fc 03 ff f0 00 00 1f ff f8 07 ff f0 00 00 7f ff
    00000060: e0 0f ff f0 00 03 f7 ff 80 1f ff f0 00 0f f7 fe
    00000070: 00 3f ff f0 00 7f fb f0 00 3f ff f0 01 ff fb 40
    00000080: 00 7f ff f0 07 ff fa 00 00 ff ff f0 0f ff fb 00
    00000090: 00 ff ff f0 1f ff fb 00 01 ff ff f0 3f ff fb 00
    000000a0: 03 ff ff f0 7f ff fb 80 07 ff ff f0 ff ff ff 80
    000000b0: 07 ff ff f0 ff ff ff 80 0f ff ff f0 ff ff ff 40
    000000c0: 1f ff ff f0 ff ff ff 60 1f ff ff f0 df 02 55 00
    000000d0: 4a 00 39 00 00 00 00 00 00 00 00 00 00 00 00 00
    000000e0: 00 00 00 00 00 00 31 e0 00 00 00 00 00 00 1d f8
    000000f0: 00 00 00 00 00 04 07 fe 00 00 00 00 01 01 8f ff
  UrbLink              = 00000000
[628440 ms] UsbSnoop - DispatchAny(f8916610) : IRP_MJ_INTERNAL_DEVICE_CONTROL
[628440 ms] UsbSnoop - MyDispatchInternalIOCTL(f8917e80) : fdo=822eee08, Irp=81c873d8, IRQL=2
[628440 ms]  >>>  URB 887 going down  >>> 
-- URB_FUNCTION_BULK_OR_INTERRUPT_TRANSFER:
  PipeHandle           = 82300ef4 [endpoint 0x00000081]
  TransferFlags        = 00000003 (USBD_TRANSFER_DIRECTION_IN, USBD_SHORT_TRANSFER_OK)
  TransferBufferLength = 00000100
  TransferBuffer       = 00000000
  TransferBufferMDL    = 81ac92e0
  UrbLink              = 00000000
[628442 ms] UsbSnoop - MyInternalIOCTLCompletion(f8917db0) : fido=81b964f0, Irp=81c873d8, Context=81c3bfe8, IRQL=2
[628442 ms]  <<<  URB 887 coming back  <<< 
-- URB_FUNCTION_BULK_OR_INTERRUPT_TRANSFER:
  PipeHandle           = 82300ef4 [endpoint 0x00000081]
  TransferFlags        = 00000003 (USBD_TRANSFER_DIRECTION_IN, USBD_SHORT_TRANSFER_OK)
  TransferBufferLength = 00000100
  TransferBuffer       = 00000000
  TransferBufferMDL    = 81ac92e0
    00000000: c0 00 00 00 00 18 7f ff f0 00 00 00 00 40 20 7f
    00000010: f8 00 00 00 10 00 00 1f ec 00 00 00 20 00 00 0f
    00000020: f6 00 00 00 20 00 00 0f fb 00 00 00 40 00 00 07
    00000030: ff 80 00 00 40 00 00 07 ff 80 00 00 80 00 00 07
    00000040: ff c0 00 00 00 00 00 03 ff 40 00 00 00 00 00 03
    00000050: ff 60 00 00 00 00 00 01 ff a0 00 00 00 00 00 07
    00000060: ff 80 00 01 00 00 00 01 ff c0 00 01 00 00 00 00
    00000070: ff e0 00 01 00 00 00 03 ff e0 00 01 00 00 00 00
    00000080: 7f e0 00 01 00 00 00 03 7f e0 00 01 00 00 00 01
    00000090: ff e0 00 01 00 00 00 00 ff e0 00 01 00 00 00 1e
    000000a0: 7f e0 00 01 00 00 03 ff 7f e0 00 00 01 e0 03 f7
    000000b0: fd 60 00 00 86 78 05 f3 e1 e0 00 00 00 fc 6b fc
    000000c0: 0f cc 00 00 17 fc 1f bf f9 fc 00 01 1f fc 15 bf
    000000d0: ff fe 00 01 06 40 19 07 2f fe 00 00 00 1c 1f e5
    000000e0: 83 fe 00 00 80 3c 3a 8c 02 7c 00 00 80 00 38 40
    000000f0: 06 6c 00 00 80 00 3c 00 0f 28 00 00 80 00 36 00
  UrbLink              = 00000000
[628471 ms] UsbSnoop - DispatchAny(f8916610) : IRP_MJ_INTERNAL_DEVICE_CONTROL
[628471 ms] UsbSnoop - MyDispatchInternalIOCTL(f8917e80) : fdo=822eee08, Irp=81cb8e48, IRQL=2
[628471 ms]  >>>  URB 888 going down  >>> 
-- URB_FUNCTION_BULK_OR_INTERRUPT_TRANSFER:
  PipeHandle           = 82300ef4 [endpoint 0x00000081]
  TransferFlags        = 00000003 (USBD_TRANSFER_DIRECTION_IN, USBD_SHORT_TRANSFER_OK)
  TransferBufferLength = 00000100
  TransferBuffer       = 00000000
  TransferBufferMDL    = 81ac92e0
  UrbLink              = 00000000
[628473 ms] UsbSnoop - MyInternalIOCTLCompletion(f8917db0) : fido=81b964f0, Irp=81cb8e48, Context=81c3bfe8, IRQL=2
[628473 ms]  <<<  URB 888 coming back  <<< 
-- URB_FUNCTION_BULK_OR_INTERRUPT_TRANSFER:
  PipeHandle           = 82300ef4 [endpoint 0x00000081]
  TransferFlags        = 00000003 (USBD_TRANSFER_DIRECTION_IN, USBD_SHORT_TRANSFER_OK)
  TransferBufferLength = 00000100
  TransferBuffer       = 00000000
  TransferBufferMDL    = 81ac92e0
    00000000: 1f 38 00 00 c0 00 38 00 3f 58 00 00 40 00 3e 00
    00000010: 7f f0 00 00 40 00 1b 00 ff a0 00 00 40 00 11 81
    00000020: ff a0 00 00 40 14 1e c1 df 40 00 00 40 24 3f 81
    00000030: 9e c0 00 00 00 00 ff 01 9f 80 00 00 00 00 3e 21
    00000040: 9f 00 00 00 00 00 80 11 9f 00 00 00 20 00 01 d9
    00000050: 9f 00 00 00 20 10 0f f9 bf 00 00 00 00 37 ff e1
    00000060: bf 00 00 00 10 00 00 81 bf 80 00 00 00 00 1f a3
    00000070: ff 80 00 00 00 00 fc 63 ff c0 00 00 00 00 00 63
    00000080: ff c0 00 00 00 00 00 47 ff f0 00 00 00 00 00 f7
    00000090: ef fc 00 00 00 00 10 7f df fe 00 00 00 40 03 ff
    000000a0: 9f ff 00 00 01 e0 0f ff 3f ff 80 00 03 f7 7f fe
    000000b0: 7f ff 80 00 3f f1 ff f8 ff ff 80 00 7f f0 ff f1
    000000c0: ff ff 80 03 ff f0 fb c1 ff ff 80 0f ff f0 e7 83
    000000d0: ff ff 80 1f ff f0 ce 07 ff ff 80 3f ff f0 70 0f
    000000e0: ff ff 80 7f ff f7 00 1f ff ff 80 7f ff e7 00 1f
    000000f0: ff ff 80 ff ff ef 00 3f ff ff 80 ff ff ff 00 7f
  UrbLink              = 00000000
[628502 ms] UsbSnoop - DispatchAny(f8916610) : IRP_MJ_INTERNAL_DEVICE_CONTROL
[628502 ms] UsbSnoop - MyDispatchInternalIOCTL(f8917e80) : fdo=822eee08, Irp=81cb8e48, IRQL=2
[628502 ms]  >>>  URB 889 going down  >>> 
-- URB_FUNCTION_BULK_OR_INTERRUPT_TRANSFER:
  PipeHandle           = 82300ef4 [endpoint 0x00000081]
  TransferFlags        = 00000003 (USBD_TRANSFER_DIRECTION_IN, USBD_SHORT_TRANSFER_OK)
  TransferBufferLength = 00000100
  TransferBuffer       = 00000000
  TransferBufferMDL    = 81ac92e0
  UrbLink              = 00000000
[628504 ms] UsbSnoop - MyInternalIOCTLCompletion(f8917db0) : fido=81b964f0, Irp=81cb8e48, Context=81cdfe48, IRQL=2
[628504 ms]  <<<  URB 889 coming back  <<< 
-- URB_FUNCTION_BULK_OR_INTERRUPT_TRANSFER:
  PipeHandle           = 82300ef4 [endpoint 0x00000081]
  TransferFlags        = 00000003 (USBD_TRANSFER_DIRECTION_IN, USBD_SHORT_TRANSFER_OK)
  TransferBufferLength = 000000ff
  TransferBuffer       = 00000000
  TransferBufferMDL    = 81ac92e0
    00000000: ff ff 80 ff ff ff 80 ff ff ff 80 ff ff ff 81 ff
    00000010: ff ff 80 ff ff ff 81 ff ff ff 80 ff ff fe 83 ff
    00000020: ff ff 80 df 02 55 00 4a 00 40 ff ff ff ff ff ff
    00000030: ff ff ff ff ff ff ff ff ff ff ff ff ff ff ff bf
    00000040: ff ff ff ff ff ff fe f7 ff ff ff ff ff ff cb f9
    00000050: ff ff ff ff ff ff bf fd ff ff ff ff fb ff ef 27
    00000060: ff ff ff ff ee 40 08 79 ef ff ff ff 04 00 08 67
    00000070: df ff ff fe 80 00 02 23 bb ff ff fe 20 00 00 5b
    00000080: ff ff ff fa 80 00 04 81 dd ed ff e5 00 00 00 12
    00000090: 7f af ff f9 00 00 00 06 5f 7f ff f6 00 00 02 02
    000000a0: 9f bf ff f4 00 00 00 00 7b ef ff f8 00 00 00 07
    000000b0: 4f 6b ff f8 00 00 00 33 ff cf ff fc 00 00 00 00
    000000c0: 3f e6 ff fa 00 00 00 04 6e e2 ff fa 00 00 00 01
    000000d0: 97 97 ff fc 00 00 00 19 2f 76 ff f0 00 00 00 00
    000000e0: 1d ef ff f0 00 00 00 04 73 75 ff fe 00 e8 00 01
    000000f0: c3 f9 ff ff c3 fe 00 02 3d 8f ff 50 e1 01 80
  UrbLink              = 00000000
[628531 ms] UsbSnoop - DispatchAny(f8916610) : IRP_MJ_INTERNAL_DEVICE_CONTROL
[628531 ms] UsbSnoop - MyDispatchInternalIOCTL(f8917e80) : fdo=822eee08, Irp=81cb8e48, IRQL=2
[628531 ms]  >>>  URB 890 going down  >>> 
-- URB_FUNCTION_BULK_OR_INTERRUPT_TRANSFER:
  PipeHandle           = 82300f14 [endpoint 0x00000002]
  TransferFlags        = 00000000 (USBD_TRANSFER_DIRECTION_OUT, ~USBD_SHORT_TRANSFER_OK)
  TransferBufferLength = 00000007
  TransferBuffer       = 00000000
  TransferBufferMDL    = 81ac92e0
    00000000: 00 00 00 02 05 e0 00
  UrbLink              = 00000000
[628531 ms] UsbSnoop - MyInternalIOCTLCompletion(f8917db0) : fido=81b964f0, Irp=81cb8e48, Context=81cb4e48, IRQL=2
[628531 ms]  <<<  URB 890 coming back  <<< 
-- URB_FUNCTION_BULK_OR_INTERRUPT_TRANSFER:
  PipeHandle           = 82300f14 [endpoint 0x00000002]
  TransferFlags        = 00000000 (USBD_TRANSFER_DIRECTION_OUT, ~USBD_SHORT_TRANSFER_OK)
  TransferBufferLength = 00000007
  TransferBuffer       = 00000000
  TransferBufferMDL    = 81ac92e0
  UrbLink              = 00000000
[628541 ms] UsbSnoop - DispatchAny(f8916610) : IRP_MJ_INTERNAL_DEVICE_CONTROL
[628541 ms] UsbSnoop - MyDispatchInternalIOCTL(f8917e80) : fdo=822eee08, Irp=81cb8e48, IRQL=2
[628541 ms]  >>>  URB 891 going down  >>> 
-- URB_FUNCTION_BULK_OR_INTERRUPT_TRANSFER:
  PipeHandle           = 82300ef4 [endpoint 0x00000081]
  TransferFlags        = 00000003 (USBD_TRANSFER_DIRECTION_IN, USBD_SHORT_TRANSFER_OK)
  TransferBufferLength = 00000100
  TransferBuffer       = 00000000
  TransferBufferMDL    = 81ac92e0
  UrbLink              = 00000000
[628542 ms] UsbSnoop - MyInternalIOCTLCompletion(f8917db0) : fido=81b964f0, Irp=81cb8e48, Context=81c3bfe8, IRQL=2
[628542 ms]  <<<  URB 891 coming back  <<< 
-- URB_FUNCTION_BULK_OR_INTERRUPT_TRANSFER:
  PipeHandle           = 82300ef4 [endpoint 0x00000081]
  TransferFlags        = 00000003 (USBD_TRANSFER_DIRECTION_IN, USBD_SHORT_TRANSFER_OK)
  TransferBufferLength = 00000005
  TransferBuffer       = 00000000
  TransferBufferMDL    = 81ac92e0
    00000000: 00 00 03 ff 03
  UrbLink              = 00000000
[628571 ms] UsbSnoop - DispatchAny(f8916610) : IRP_MJ_INTERNAL_DEVICE_CONTROL
[628571 ms] UsbSnoop - MyDispatchInternalIOCTL(f8917e80) : fdo=822eee08, Irp=81cb8e48, IRQL=2
[628571 ms]  >>>  URB 892 going down  >>> 
-- URB_FUNCTION_BULK_OR_INTERRUPT_TRANSFER:
  PipeHandle           = 82300ef4 [endpoint 0x00000081]
  TransferFlags        = 00000003 (USBD_TRANSFER_DIRECTION_IN, USBD_SHORT_TRANSFER_OK)
  TransferBufferLength = 00000100
  TransferBuffer       = 00000000
  TransferBufferMDL    = 81ac92e0
  UrbLink              = 00000000
[628573 ms] UsbSnoop - MyInternalIOCTLCompletion(f8917db0) : fido=81b964f0, Irp=81cb8e48, Context=81cb4e48, IRQL=2
[628573 ms]  <<<  URB 892 coming back  <<< 
-- URB_FUNCTION_BULK_OR_INTERRUPT_TRANSFER:
  PipeHandle           = 82300ef4 [endpoint 0x00000081]
  TransferFlags        = 00000003 (USBD_TRANSFER_DIRECTION_IN, USBD_SHORT_TRANSFER_OK)
  TransferBufferLength = 00000100
  TransferBuffer       = 00000000
  TransferBufferMDL    = 81ac92e0
    00000000: 00 8b 87 ff f4 62 24 80 02 f7 b6 ff ff 32 da 40
    00000010: 01 65 e6 fe ff e1 3f 40 00 08 69 fd fb 60 c8 80
    00000020: 04 f2 1d fe 78 00 42 00 00 96 e6 fb 3e 40 34 01
    00000030: 00 08 76 f9 67 40 00 00 02 77 f6 f4 b2 80 00 00
    00000040: 02 77 c4 fa b0 82 00 00 00 ff b6 fc b0 81 00 00
    00000050: 02 fa e9 fc f0 8c 80 00 01 e1 72 fb d0 de 40 00
    00000060: 03 cc d6 ff 30 f2 00 04 03 e9 ac ff d9 e0 20 02
    00000070: 07 eb 15 ff d9 ea 10 01 8f ea f6 ff f9 60 00 00
    00000080: 37 ee 0d ff f8 ff c8 02 4f e0 62 ff fc c8 60 01
    00000090: 9f ef ca ff fd 80 10 03 3f f7 b0 ff fd 20 18 02
    000000a0: 3f fa 74 ff fc 9e 00 06 7f ff cf ff fe cd 00 2c
    000000b0: 7f ff f0 ff fe 60 01 98 ff fd e4 ff ff 00 0e 30
    000000c0: ff fc 36 ff ff c4 1f e1 ff fe b3 ff ff f3 7f c3
    000000d0: ff ff 13 ff ff f9 ff 83 ff ff 92 ff ff ff f7 07
    000000e0: ff fd 73 ff ff f8 fc 0f ff ff 9c ff ff ff f8 1f
    000000f0: ff ff c7 ff ff fd e0 3f ff ff f1 ff ff fb 40 3f
  UrbLink              = 00000000
[628601 ms] UsbSnoop - DispatchAny(f8916610) : IRP_MJ_INTERNAL_DEVICE_CONTROL
[628601 ms] UsbSnoop - MyDispatchInternalIOCTL(f8917e80) : fdo=822eee08, Irp=81cb8e48, IRQL=2
[628601 ms]  >>>  URB 893 going down  >>> 
-- URB_FUNCTION_BULK_OR_INTERRUPT_TRANSFER:
  PipeHandle           = 82300ef4 [endpoint 0x00000081]
  TransferFlags        = 00000003 (USBD_TRANSFER_DIRECTION_IN, USBD_SHORT_TRANSFER_OK)
  TransferBufferLength = 00000100
  TransferBuffer       = 00000000
  TransferBufferMDL    = 81ac92e0
  UrbLink              = 00000000
[628603 ms] UsbSnoop - MyInternalIOCTLCompletion(f8917db0) : fido=81b964f0, Irp=81cb8e48, Context=822f3898, IRQL=2
[628603 ms]  <<<  URB 893 coming back  <<< 
-- URB_FUNCTION_BULK_OR_INTERRUPT_TRANSFER:
  PipeHandle           = 82300ef4 [endpoint 0x00000081]
  TransferFlags        = 00000003 (USBD_TRANSFER_DIRECTION_IN, USBD_SHORT_TRANSFER_OK)
  TransferBufferLength = 00000100
  TransferBuffer       = 00000000
  TransferBufferMDL    = 81ac92e0
    00000000: ff ff fc ff ff e0 00 ff ff ff ff ff ff a0 01 ff
    00000010: ff ff ff ff ff a4 03 ff ff ff ff ff ff c0 07 ff
    00000020: ff ff ff ff ff 80 0f ff ff ff ff ff ff 10 0f ff
    00000030: ff ff ff ff ff 24 8f ff ff ff ff ff fe 20 1f ff
    00000040: ff ff ff ff fc 94 7f ff ff ff ff ff fa 08 ff ff
    00000050: ff ff ff ff fe 09 ff ff ff ff ff ff fc 87 ff ff
    00000060: ff ff ff ff fc 67 ff ff ff ff ff ff f8 2f ff ff
    00000070: ff ff ff ff fc df ff ff ff ff ff df 02 0b 00 4a
    00000080: 00 37 ff ff ff ff ff ff fe ff ff ff ff ff ff fe
    00000090: ff ff ff ff ff ff fe ff ff ff ff ff ff fe ff ff
    000000a0: ff ff ff ff fe ff ff fe 03 ff ff fe ff ff f8 00
    000000b0: 7f ff fe ff ff c0 00 1f ff fe ff ff 80 00 0f ff
    000000c0: fe ff ff 00 00 0f ff fe ff fe 00 00 07 ff fe ff
    000000d0: fc 00 00 07 f7 fe ff f8 00 00 03 f7 fe ff f8 00
    000000e0: 00 03 fb fe ff f0 00 00 07 fb fe ff f0 00 00 01
    000000f0: fb fe ff f0 00 00 03 fb fe ff d0 00 00 03 7f fe
  UrbLink              = 00000000
[628631 ms] UsbSnoop - DispatchAny(f8916610) : IRP_MJ_INTERNAL_DEVICE_CONTROL
[628631 ms] UsbSnoop - MyDispatchInternalIOCTL(f8917e80) : fdo=822eee08, Irp=81cb8e48, IRQL=2
[628631 ms]  >>>  URB 894 going down  >>> 
-- URB_FUNCTION_BULK_OR_INTERRUPT_TRANSFER:
  PipeHandle           = 82300ef4 [endpoint 0x00000081]
  TransferFlags        = 00000003 (USBD_TRANSFER_DIRECTION_IN, USBD_SHORT_TRANSFER_OK)
  TransferBufferLength = 00000100
  TransferBuffer       = 00000000
  TransferBufferMDL    = 81ac92e0
  UrbLink              = 00000000
[628633 ms] UsbSnoop - MyInternalIOCTLCompletion(f8917db0) : fido=81b964f0, Irp=81cb8e48, Context=81abee68, IRQL=2
[628633 ms]  <<<  URB 894 coming back  <<< 
-- URB_FUNCTION_BULK_OR_INTERRUPT_TRANSFER:
  PipeHandle           = 82300ef4 [endpoint 0x00000081]
  TransferFlags        = 00000003 (USBD_TRANSFER_DIRECTION_IN, USBD_SHORT_TRANSFER_OK)
  TransferBufferLength = 00000100
  TransferBuffer       = 00000000
  TransferBufferMDL    = 81ac92e0
    00000000: ff d0 00 00 07 ff fe ff d0 00 00 07 ff fe ff e8
    00000010: 00 00 07 ff fe ff e3 00 07 0f ff fe ff e6 c0 1e
    00000020: ff ff fe ff e4 30 78 3f ff fe ff f1 18 7f 1f ff
    00000030: fe ff e3 c8 f0 df ff fe ff f7 e0 c7 bf ff fe ff
    00000040: f4 c0 d7 db ff fe ff f0 00 c0 c7 ff fe ff f0 00
    00000050: 60 03 ff fe ff e0 01 00 07 ff fe ff e0 00 00 07
    00000060: ff fe ff e0 01 00 03 ff fe ff c0 02 80 07 ff be
    00000070: ff f0 02 40 0f ff be ff e0 37 e0 1f ff fe ff c0
    00000080: 3f e0 7f ff fe ff d8 07 80 6f ff fe ff c8 03 00
    00000090: 7e ff fe ff c8 00 00 35 ff fe ff e0 00 00 09 ff
    000000a0: fe ff e0 7f fc 41 ff fe ff e0 00 04 43 ff fe ff
    000000b0: f8 00 20 07 ff fe ff f4 00 00 9f cf fe ff f4 00
    000000c0: 00 ff 9f fe ff f2 00 01 fc 7f fe ff f9 80 03 f1
    000000d0: ff fe ff fc 40 0f e7 ff fe ff ff 30 7f 3f ff fe
    000000e0: ff ff df fc 7f ff fe ff ff cf bf ef ff ee ff ff
    000000f0: 23 ff db ff fe ff ff 80 00 07 ff fe ff ff 00 00
  UrbLink              = 00000000
[628661 ms] UsbSnoop - DispatchAny(f8916610) : IRP_MJ_INTERNAL_DEVICE_CONTROL
[628661 ms] UsbSnoop - MyDispatchInternalIOCTL(f8917e80) : fdo=822eee08, Irp=81cb8e48, IRQL=2
[628661 ms]  >>>  URB 895 going down  >>> 
-- URB_FUNCTION_BULK_OR_INTERRUPT_TRANSFER:
  PipeHandle           = 82300ef4 [endpoint 0x00000081]
  TransferFlags        = 00000003 (USBD_TRANSFER_DIRECTION_IN, USBD_SHORT_TRANSFER_OK)
  TransferBufferLength = 00000100
  TransferBuffer       = 00000000
  TransferBufferMDL    = 81ac92e0
  UrbLink              = 00000000
[628663 ms] UsbSnoop - MyInternalIOCTLCompletion(f8917db0) : fido=81b964f0, Irp=81cb8e48, Context=81cb4e48, IRQL=2
[628663 ms]  <<<  URB 895 coming back  <<< 
-- URB_FUNCTION_BULK_OR_INTERRUPT_TRANSFER:
  PipeHandle           = 82300ef4 [endpoint 0x00000081]
  TransferFlags        = 00000003 (USBD_TRANSFER_DIRECTION_IN, USBD_SHORT_TRANSFER_OK)
  TransferBufferLength = 000000ff
  TransferBuffer       = 00000000
  TransferBufferMDL    = 81ac92e0
    00000000: 3d ff fe ff ff 80 03 83 ff fe ff f9 80 10 0f ff
    00000010: fe ff f0 c0 00 3f ff fe ff f0 00 00 ff ff fe ff
    00000020: f0 00 01 ff ff fe ff f0 00 07 ff ff fe ff f8 40
    00000030: 0f ff ff fe ff f8 40 3f ff ff fe ff f9 b0 7f ff
    00000040: ff fe ff fe 00 ff ff ff fe ff f0 01 ff ff ff fe
    00000050: ff f8 03 ff ff ff fe ff fc 07 ff ff ff fe ff fc
    00000060: 0f ff ff ff fe ff fc 1f ff ff ff fe ff fe 3f ff
    00000070: ff ff fe ff fe 7f ff ff ff fe ff fe ff ff ff ff
    00000080: fe ff ff ff ff ff ff fe df 02 0b 00 4a 00 35 ff
    00000090: ff ff ff ef ff f8 ff ff ff f1 90 ff f8 ff ff ff
    000000a0: e6 67 ff f8 ff ff f8 fa 06 ff f8 ff ff fb b0 00
    000000b0: 7f f8 ff ff f7 c0 08 17 f8 ff ff fe 00 30 3f f8
    000000c0: ff fe c0 00 00 0b f8 ff ff 80 00 80 29 f8 ff ff
    000000d0: 00 00 00 0d f8 ff fe 00 00 00 0d f8 ff fc 00 00
    000000e0: 00 10 f8 ff f8 00 00 00 10 78 ff f2 00 00 00 23
    000000f0: f8 ff e4 00 00 00 07 f8 ff c4 00 00 00 07 78
  UrbLink              = 00000000
[628691 ms] UsbSnoop - DispatchAny(f8916610) : IRP_MJ_INTERNAL_DEVICE_CONTROL
[628691 ms] UsbSnoop - MyDispatchInternalIOCTL(f8917e80) : fdo=822eee08, Irp=81cb8e48, IRQL=2
[628691 ms]  >>>  URB 896 going down  >>> 
-- URB_FUNCTION_BULK_OR_INTERRUPT_TRANSFER:
  PipeHandle           = 82300f14 [endpoint 0x00000002]
  TransferFlags        = 00000000 (USBD_TRANSFER_DIRECTION_OUT, ~USBD_SHORT_TRANSFER_OK)
  TransferBufferLength = 00000007
  TransferBuffer       = 00000000
  TransferBufferMDL    = 81ac92e0
    00000000: 00 00 00 02 05 e0 00
  UrbLink              = 00000000
[628691 ms] UsbSnoop - MyInternalIOCTLCompletion(f8917db0) : fido=81b964f0, Irp=81cb8e48, Context=822f3898, IRQL=2
[628691 ms]  <<<  URB 896 coming back  <<< 
-- URB_FUNCTION_BULK_OR_INTERRUPT_TRANSFER:
  PipeHandle           = 82300f14 [endpoint 0x00000002]
  TransferFlags        = 00000000 (USBD_TRANSFER_DIRECTION_OUT, ~USBD_SHORT_TRANSFER_OK)
  TransferBufferLength = 00000007
  TransferBuffer       = 00000000
  TransferBufferMDL    = 81ac92e0
  UrbLink              = 00000000
[628702 ms] UsbSnoop - DispatchAny(f8916610) : IRP_MJ_INTERNAL_DEVICE_CONTROL
[628702 ms] UsbSnoop - MyDispatchInternalIOCTL(f8917e80) : fdo=822eee08, Irp=81cb8e48, IRQL=2
[628702 ms]  >>>  URB 897 going down  >>> 
-- URB_FUNCTION_BULK_OR_INTERRUPT_TRANSFER:
  PipeHandle           = 82300ef4 [endpoint 0x00000081]
  TransferFlags        = 00000003 (USBD_TRANSFER_DIRECTION_IN, USBD_SHORT_TRANSFER_OK)
  TransferBufferLength = 00000100
  TransferBuffer       = 00000000
  TransferBufferMDL    = 81ac92e0
  UrbLink              = 00000000
[628702 ms] UsbSnoop - MyInternalIOCTLCompletion(f8917db0) : fido=81b964f0, Irp=81cb8e48, Context=81cb4e48, IRQL=2
[628702 ms]  <<<  URB 897 coming back  <<< 
-- URB_FUNCTION_BULK_OR_INTERRUPT_TRANSFER:
  PipeHandle           = 82300ef4 [endpoint 0x00000081]
  TransferFlags        = 00000003 (USBD_TRANSFER_DIRECTION_IN, USBD_SHORT_TRANSFER_OK)
  TransferBufferLength = 00000005
  TransferBuffer       = 00000000
  TransferBufferMDL    = 81ac92e0
    00000000: 00 00 03 ff 03
  UrbLink              = 00000000
[628731 ms] UsbSnoop - DispatchAny(f8916610) : IRP_MJ_INTERNAL_DEVICE_CONTROL
[628731 ms] UsbSnoop - MyDispatchInternalIOCTL(f8917e80) : fdo=822eee08, Irp=81cb8e48, IRQL=2
[628731 ms]  >>>  URB 898 going down  >>> 
-- URB_FUNCTION_BULK_OR_INTERRUPT_TRANSFER:
  PipeHandle           = 82300ef4 [endpoint 0x00000081]
  TransferFlags        = 00000003 (USBD_TRANSFER_DIRECTION_IN, USBD_SHORT_TRANSFER_OK)
  TransferBufferLength = 00000100
  TransferBuffer       = 00000000
  TransferBufferMDL    = 81ac92e0
  UrbLink              = 00000000
[628733 ms] UsbSnoop - MyInternalIOCTLCompletion(f8917db0) : fido=81b964f0, Irp=81cb8e48, Context=81cdfe48, IRQL=2
[628733 ms]  <<<  URB 898 coming back  <<< 
-- URB_FUNCTION_BULK_OR_INTERRUPT_TRANSFER:
  PipeHandle           = 82300ef4 [endpoint 0x00000081]
  TransferFlags        = 00000003 (USBD_TRANSFER_DIRECTION_IN, USBD_SHORT_TRANSFER_OK)
  TransferBufferLength = 00000100
  TransferBuffer       = 00000000
  TransferBufferMDL    = 81ac92e0
    00000000: ff c8 00 00 00 00 f8 ff 00 00 00 00 02 f8 fe 80
    00000010: 00 00 00 03 f8 ff 00 00 00 00 01 f8 ff 00 00 00
    00000020: 00 05 f8 ff 20 00 00 00 07 78 fe 00 00 00 00 05
    00000030: f8 fc 00 00 00 00 0f b8 f4 00 00 00 02 0b 38 fc
    00000040: 00 00 00 00 06 78 f8 00 00 00 00 07 f8 fc 05 80
    00000050: 00 00 17 f8 f8 0d 00 07 fc 37 f8 f9 98 20 5b f8
    00000060: 4f f8 f8 08 00 7c e3 ff f8 fe 84 00 05 83 ff f8
    00000070: fe c0 00 01 83 ff f8 fc 40 04 0f 03 37 f8 f0 60
    00000080: 00 02 03 ff b8 e0 22 02 00 02 ff f8 fa 1c 00 c0
    00000090: 03 bf f8 f6 e8 00 00 01 bf f8 ff e0 00 01 01 7f
    000000a0: f8 ff c0 00 03 00 7f f8 ff 84 00 02 e1 6f f8 ff
    000000b0: 82 00 04 73 ff f8 ff 80 00 00 1e df f8 ff 80 00
    000000c0: 00 3d ff f8 fd 80 00 16 0d ff f8 ff c0 08 1f ff
    000000d0: bf f8 ff e0 04 10 7d 9f f8 ff f0 00 20 19 1f f8
    000000e0: ff f8 00 00 fb 3f f8 f7 fc 00 00 3b 7f f8 ff fe
    000000f0: 00 00 0e ff f8 ff fe 00 00 07 ff f8 ff ff 00 c0
  UrbLink              = 00000000
[628761 ms] UsbSnoop - DispatchAny(f8916610) : IRP_MJ_INTERNAL_DEVICE_CONTROL
[628761 ms] UsbSnoop - MyDispatchInternalIOCTL(f8917e80) : fdo=822eee08, Irp=81cb8e48, IRQL=2
[628761 ms]  >>>  URB 899 going down  >>> 
-- URB_FUNCTION_BULK_OR_INTERRUPT_TRANSFER:
  PipeHandle           = 82300ef4 [endpoint 0x00000081]
  TransferFlags        = 00000003 (USBD_TRANSFER_DIRECTION_IN, USBD_SHORT_TRANSFER_OK)
  TransferBufferLength = 00000100
  TransferBuffer       = 00000000
  TransferBufferMDL    = 81ac92e0
  UrbLink              = 00000000
[628763 ms] UsbSnoop - MyInternalIOCTLCompletion(f8917db0) : fido=81b964f0, Irp=81cb8e48, Context=81c3bfe8, IRQL=2
[628763 ms]  <<<  URB 899 coming back  <<< 
-- URB_FUNCTION_BULK_OR_INTERRUPT_TRANSFER:
  PipeHandle           = 82300ef4 [endpoint 0x00000081]
  TransferFlags        = 00000003 (USBD_TRANSFER_DIRECTION_IN, USBD_SHORT_TRANSFER_OK)
  TransferBufferLength = 00000100
  TransferBuffer       = 00000000
  TransferBufferMDL    = 81ac92e0
    00000000: 0d ff f8 ff ff 80 a0 0b ff f8 3f ff c0 90 5b ff
    00000010: f8 ff ff e0 2c 13 ff f8 ff ff f0 1f f3 7f f8 ff
    00000020: ff f0 00 63 7f f8 ff ff f8 00 03 bf f8 ff ff fc
    00000030: 00 17 df f8 ff ff fe 00 87 ef f8 ff ff ff 00 0f
    00000040: fb 78 ff ff ff 80 00 ff f8 ff ff ff 80 00 7f e8
    00000050: ff ff ff c0 00 3f f8 ff ff ff e4 00 3f f8 ff ff
    00000060: ff e1 80 3f f8 ff ff ff f0 00 0f f8 ff ff ff f8
    00000070: 00 07 f8 ff ff ff fc 00 07 f8 ff ff ff fc 00 03
    00000080: f8 ff ff ff fe 00 61 f8 ff ff ff ff 00 31 f8 ff
    00000090: ff ff ff 80 1f f8 df 02 55 00 4a 00 39 fc 00 1d
    000000a0: e7 00 04 c0 80 fc 00 1d e7 00 04 c0 80 fc 00 19
    000000b0: e7 00 04 c0 80 fc 00 18 1f 00 04 c1 80 fc 00 00
    000000c0: 3f c0 04 c0 80 fc 00 07 ff f0 04 c0 80 fc 00 4f
    000000d0: ff fc 04 c0 80 fc 01 ef ff ff 04 c0 00 fc 0f ff
    000000e0: ff ff 84 c0 80 fc 1f ff ff ff c4 c0 80 fc 1f df
    000000f0: ff ff e0 c0 00 fc 1f 0f ff ff f8 c0 00 fc 3e 07
  UrbLink              = 00000000
[628791 ms] UsbSnoop - DispatchAny(f8916610) : IRP_MJ_INTERNAL_DEVICE_CONTROL
[628791 ms] UsbSnoop - MyDispatchInternalIOCTL(f8917e80) : fdo=822eee08, Irp=81cb8e48, IRQL=2
[628791 ms]  >>>  URB 900 going down  >>> 
-- URB_FUNCTION_BULK_OR_INTERRUPT_TRANSFER:
  PipeHandle           = 82300ef4 [endpoint 0x00000081]
  TransferFlags        = 00000003 (USBD_TRANSFER_DIRECTION_IN, USBD_SHORT_TRANSFER_OK)
  TransferBufferLength = 00000100
  TransferBuffer       = 00000000
  TransferBufferMDL    = 81b65b08
  UrbLink              = 00000000
[628793 ms] UsbSnoop - MyInternalIOCTLCompletion(f8917db0) : fido=81b964f0, Irp=81cb8e48, Context=822f3898, IRQL=2
[628793 ms]  <<<  URB 900 coming back  <<< 
-- URB_FUNCTION_BULK_OR_INTERRUPT_TRANSFER:
  PipeHandle           = 82300ef4 [endpoint 0x00000081]
  TransferFlags        = 00000003 (USBD_TRANSFER_DIRECTION_IN, USBD_SHORT_TRANSFER_OK)
  TransferBufferLength = 00000100
  TransferBuffer       = 00000000
  TransferBufferMDL    = 81b65b08
    00000000: ff ff f8 c0 00 fe 3c 03 ff ff fc c0 00 fc 30 01
    00000010: ff ff fc c0 00 fc 20 00 17 ff fe 80 00 fe 00 00
    00000020: 0f ff fe 80 00 fe 10 00 00 ff ff 80 00 7f 00 00
    00000030: 00 ff ff 80 00 7f 00 00 03 ff ff 80 00 7e 00 00
    00000040: 01 ff ff 80 00 7e 00 00 00 7f ff 80 00 7e 00 00
    00000050: 00 7f ff 80 00 3e 00 00 00 1f df 80 00 3e 00 00
    00000060: 00 0f ff 80 00 3e 00 00 00 1f ff c0 00 3e 00 02
    00000070: 00 3f ff c0 00 1f 40 02 40 7f ff c0 00 1f 41 f8
    00000080: 4f bf ff c0 00 1f 40 78 64 1f ff c0 00 1f c1 f0
    00000090: 7f ff ff c0 00 0f 06 f0 79 ff ff c0 00 0f 80 00
    000000a0: f8 3f ff c0 00 0f 00 10 fc 3f ff c0 00 0f 00 01
    000000b0: fe 7f ff 40 00 07 00 01 fe 7f ff c0 00 07 00 01
    000000c0: f9 0f ff c0 00 07 80 01 f8 87 fd 80 00 03 80 01
    000000d0: fc 07 fd 80 00 03 80 43 fe 07 ff 80 00 07 c0 d3
    000000e0: ff 0f ff 80 00 03 c0 83 ff 9f ff 00 00 07 c1 00
    000000f0: ff ff f7 00 00 03 c1 00 7f bf ff 00 00 07 c0 00
  UrbLink              = 00000000
[628821 ms] UsbSnoop - DispatchAny(f8916610) : IRP_MJ_INTERNAL_DEVICE_CONTROL
[628821 ms] UsbSnoop - MyDispatchInternalIOCTL(f8917e80) : fdo=822eee08, Irp=81cb8e48, IRQL=2
[628821 ms]  >>>  URB 901 going down  >>> 
-- URB_FUNCTION_BULK_OR_INTERRUPT_TRANSFER:
  PipeHandle           = 82300ef4 [endpoint 0x00000081]
  TransferFlags        = 00000003 (USBD_TRANSFER_DIRECTION_IN, USBD_SHORT_TRANSFER_OK)
  TransferBufferLength = 00000100
  TransferBuffer       = 00000000
  TransferBufferMDL    = 81b65b08
  UrbLink              = 00000000
[628823 ms] UsbSnoop - MyInternalIOCTLCompletion(f8917db0) : fido=81b964f0, Irp=81cb8e48, Context=81cdfe48, IRQL=2
[628823 ms]  <<<  URB 901 coming back  <<< 
-- URB_FUNCTION_BULK_OR_INTERRUPT_TRANSFER:
  PipeHandle           = 82300ef4 [endpoint 0x00000081]
  TransferFlags        = 00000003 (USBD_TRANSFER_DIRECTION_IN, USBD_SHORT_TRANSFER_OK)
  TransferBufferLength = 000000ff
  TransferBuffer       = 00000000
  TransferBufferMDL    = 81b65b08
    00000000: 6f 9f fe 00 00 07 e0 00 ff df fe 00 00 03 e0 6b
    00000010: ff df fd 00 00 03 e0 60 7f df fd 00 00 03 e0 00
    00000020: ff df f9 00 00 03 e0 00 3f ff f9 00 00 03 f0 00
    00000030: 3f ff f9 00 00 03 f0 00 7f ff f9 00 00 03 f8 00
    00000040: ff ff f9 00 00 03 f8 00 07 ff f1 00 00 03 fc 00
    00000050: 07 ff f1 00 00 03 fe 00 07 ff f1 00 00 03 ff 00
    00000060: 0f ff f3 00 00 03 ff 00 3f ff e3 00 00 03 ff 0f
    00000070: ff ff c3 00 00 03 ff 0f ff ff 83 00 00 03 ff 03
    00000080: ff ff 03 80 00 03 ff 03 bf fe 03 c0 00 03 ff c1
    00000090: df fc 03 e0 00 03 ff c0 cf f8 03 f0 00 03 ff c0
    000000a0: 0f e0 03 f8 00 03 ff c0 07 c0 07 fc 00 83 ff c0
    000000b0: 07 80 07 ff 00 81 ff c0 06 00 07 ff 80 81 ff c0
    000000c0: 08 00 0f ff 80 87 ff 80 70 00 0f ff 80 ff ff 80
    000000d0: f0 00 1f ff 80 ff ff 81 f8 00 1f ff 80 ff ff 83
    000000e0: f8 00 3f ff 80 ff ff 07 f8 00 3f ff 80 df 02 55
    000000f0: 00 4a 00 3c ff ff ff ff ff ff ff f0 ff ff fe
  UrbLink              = 00000000
[628851 ms] UsbSnoop - DispatchAny(f8916610) : IRP_MJ_INTERNAL_DEVICE_CONTROL
[628851 ms] UsbSnoop - MyDispatchInternalIOCTL(f8917e80) : fdo=822eee08, Irp=81cb8e48, IRQL=2
[628851 ms]  >>>  URB 902 going down  >>> 
-- URB_FUNCTION_BULK_OR_INTERRUPT_TRANSFER:
  PipeHandle           = 82300f14 [endpoint 0x00000002]
  TransferFlags        = 00000000 (USBD_TRANSFER_DIRECTION_OUT, ~USBD_SHORT_TRANSFER_OK)
  TransferBufferLength = 00000007
  TransferBuffer       = 00000000
  TransferBufferMDL    = 81b65b08
    00000000: 00 00 00 02 05 e0 00
  UrbLink              = 00000000
[628851 ms] UsbSnoop - MyInternalIOCTLCompletion(f8917db0) : fido=81b964f0, Irp=81cb8e48, Context=81c3bfe8, IRQL=2
[628851 ms]  <<<  URB 902 coming back  <<< 
-- URB_FUNCTION_BULK_OR_INTERRUPT_TRANSFER:
  PipeHandle           = 82300f14 [endpoint 0x00000002]
  TransferFlags        = 00000000 (USBD_TRANSFER_DIRECTION_OUT, ~USBD_SHORT_TRANSFER_OK)
  TransferBufferLength = 00000007
  TransferBuffer       = 00000000
  TransferBufferMDL    = 81b65b08
  UrbLink              = 00000000
[628861 ms] UsbSnoop - DispatchAny(f8916610) : IRP_MJ_INTERNAL_DEVICE_CONTROL
[628861 ms] UsbSnoop - MyDispatchInternalIOCTL(f8917e80) : fdo=822eee08, Irp=81cb8e48, IRQL=2
[628861 ms]  >>>  URB 903 going down  >>> 
-- URB_FUNCTION_BULK_OR_INTERRUPT_TRANSFER:
  PipeHandle           = 82300ef4 [endpoint 0x00000081]
  TransferFlags        = 00000003 (USBD_TRANSFER_DIRECTION_IN, USBD_SHORT_TRANSFER_OK)
  TransferBufferLength = 00000100
  TransferBuffer       = 00000000
  TransferBufferMDL    = 81b65b08
  UrbLink              = 00000000
[628861 ms] UsbSnoop - MyInternalIOCTLCompletion(f8917db0) : fido=81b964f0, Irp=81cb8e48, Context=81cdfe48, IRQL=2
[628861 ms]  <<<  URB 903 coming back  <<< 
-- URB_FUNCTION_BULK_OR_INTERRUPT_TRANSFER:
  PipeHandle           = 82300ef4 [endpoint 0x00000081]
  TransferFlags        = 00000003 (USBD_TRANSFER_DIRECTION_IN, USBD_SHORT_TRANSFER_OK)
  TransferBufferLength = 00000005
  TransferBuffer       = 00000000
  TransferBufferMDL    = 81b65b08
    00000000: 00 00 03 ff 03
  UrbLink              = 00000000
[628891 ms] UsbSnoop - DispatchAny(f8916610) : IRP_MJ_INTERNAL_DEVICE_CONTROL
[628891 ms] UsbSnoop - MyDispatchInternalIOCTL(f8917e80) : fdo=822eee08, Irp=81d19818, IRQL=2
[628891 ms]  >>>  URB 904 going down  >>> 
-- URB_FUNCTION_BULK_OR_INTERRUPT_TRANSFER:
  PipeHandle           = 82300ef4 [endpoint 0x00000081]
  TransferFlags        = 00000003 (USBD_TRANSFER_DIRECTION_IN, USBD_SHORT_TRANSFER_OK)
  TransferBufferLength = 00000100
  TransferBuffer       = 00000000
  TransferBufferMDL    = 81b65b08
  UrbLink              = 00000000
[628893 ms] UsbSnoop - MyInternalIOCTLCompletion(f8917db0) : fido=81b964f0, Irp=81d19818, Context=81b4ccc0, IRQL=2
[628893 ms]  <<<  URB 904 coming back  <<< 
-- URB_FUNCTION_BULK_OR_INTERRUPT_TRANSFER:
  PipeHandle           = 82300ef4 [endpoint 0x00000081]
  TransferFlags        = 00000003 (USBD_TRANSFER_DIRECTION_IN, USBD_SHORT_TRANSFER_OK)
  TransferBufferLength = 00000100
  TransferBuffer       = 00000000
  TransferBufferMDL    = 81b65b08
    00000000: 01 ff ff ff f0 ff ff f2 00 07 ff ff f0 ff ff c0
    00000010: 00 03 ff ff f0 ff ff 00 00 01 ff ff f0 ff fe 00
    00000020: 00 00 ff ff f0 ff ff 80 00 00 7f ff f0 ff ff 00
    00000030: 00 00 07 ff f0 ff fc 00 00 00 03 ff f0 ff f9 00
    00000040: 00 00 00 ff f0 ff fe 00 00 00 00 ff f0 ff fc 00
    00000050: 00 00 01 7f f0 ff f8 00 00 00 00 3f f0 ff f8 00
    00000060: 00 00 00 bf f0 ff f0 00 00 00 00 5f f0 ff d0 00
    00000070: 00 00 01 6f f0 ff c0 00 00 00 01 ff f0 ff a0 00
    00000080: 00 00 03 ff f0 ff c0 00 00 01 03 ff f0 ff c0 00
    00000090: 00 00 03 ff f0 ff 80 00 00 01 43 fd f0 ff 80 00
    000000a0: 00 13 3f fd f0 ff 20 00 00 0f 3f fd f0 ff 00 00
    000000b0: 00 04 9f f5 f0 ff 20 02 00 00 df ff f0 ff 61 dd
    000000c0: fc 20 9f fa f0 ff a3 ff ff f8 0f f9 f0 ff a0 7e
    000000d0: 7f 9e 0f fc b0 ff 40 fe 3f 83 87 fc 60 ff 83 dc
    000000e0: 3f 79 c7 fe b0 ff 86 dc 3f 6f c3 f9 70 ff 00 28
    000000f0: 7c b3 03 fc 70 ff 00 00 03 2c 07 7e d0 ff 80 20
  UrbLink              = 00000000
[628921 ms] UsbSnoop - DispatchAny(f8916610) : IRP_MJ_INTERNAL_DEVICE_CONTROL
[628921 ms] UsbSnoop - MyDispatchInternalIOCTL(f8917e80) : fdo=822eee08, Irp=81d19818, IRQL=2
[628921 ms]  >>>  URB 905 going down  >>> 
-- URB_FUNCTION_BULK_OR_INTERRUPT_TRANSFER:
  PipeHandle           = 82300ef4 [endpoint 0x00000081]
  TransferFlags        = 00000003 (USBD_TRANSFER_DIRECTION_IN, USBD_SHORT_TRANSFER_OK)
  TransferBufferLength = 00000100
  TransferBuffer       = 00000000
  TransferBufferMDL    = 81b65b08
  UrbLink              = 00000000
[628923 ms] UsbSnoop - MyInternalIOCTLCompletion(f8917db0) : fido=81b964f0, Irp=81d19818, Context=81c3bfe8, IRQL=2
[628923 ms]  <<<  URB 905 coming back  <<< 
-- URB_FUNCTION_BULK_OR_INTERRUPT_TRANSFER:
  PipeHandle           = 82300ef4 [endpoint 0x00000081]
  TransferFlags        = 00000003 (USBD_TRANSFER_DIRECTION_IN, USBD_SHORT_TRANSFER_OK)
  TransferBufferLength = 00000100
  TransferBuffer       = 00000000
  TransferBufferMDL    = 81b65b08
    00000000: 51 e0 27 ce f0 ff 00 00 68 00 0f ee b0 ff 80 00
    00000010: 30 00 4b 74 f0 fe 00 10 38 00 7e fc a0 fe 80 10
    00000020: 0c 01 bc bd 70 ff 80 20 26 0b 5d 69 30 ff 00 33
    00000030: fe 0e ee d9 20 ff 00 6f ff 0f dc d8 50 ff 00 c7
    00000040: f3 8b cf 40 10 ff 02 c3 f9 fe d5 90 50 fd 01 83
    00000050: fe e4 f6 e0 80 ff 07 1f ff 77 f7 80 00 fe 86 1f
    00000060: fd 9b f1 00 10 fd 08 ff fe 96 f9 40 00 ff 11 fb
    00000070: 3f 74 c2 80 00 ff a5 fe 7f ff 63 80 00 ff 8e ff
    00000080: ff ff 48 00 00 ff 97 ff 5f fb e8 80 00 fe 03 ac
    00000090: 97 fa 85 80 00 ff 83 99 d7 ff 43 00 00 ff 0e 73
    000000a0: ff f7 e3 00 00 ff 8c c7 7f f6 f3 40 00 ff 89 a6
    000000b0: 5b bb 36 40 00 ff 0b 4d db fe ec 60 00 ff 46 0a
    000000c0: fd fe d8 60 00 ff e1 7f fe fe 90 f0 00 ff c3 8b
    000000d0: cf ff c1 f8 00 ff 92 17 bd ff 03 fc 00 ff ec bf
    000000e0: 73 be 07 fc 00 ff 09 a6 6d f8 0f fe 00 fe 01 34
    000000f0: ff f0 1f ff 80 f0 0d 6c fb f0 3f ff e0 80 2c 19
  UrbLink              = 00000000
[628951 ms] UsbSnoop - DispatchAny(f8916610) : IRP_MJ_INTERNAL_DEVICE_CONTROL
[628951 ms] UsbSnoop - MyDispatchInternalIOCTL(f8917e80) : fdo=822eee08, Irp=81d19818, IRQL=2
[628951 ms]  >>>  URB 906 going down  >>> 
-- URB_FUNCTION_BULK_OR_INTERRUPT_TRANSFER:
  PipeHandle           = 82300ef4 [endpoint 0x00000081]
  TransferFlags        = 00000003 (USBD_TRANSFER_DIRECTION_IN, USBD_SHORT_TRANSFER_OK)
  TransferBufferLength = 00000100
  TransferBuffer       = 00000000
  TransferBufferMDL    = 81b65b08
  UrbLink              = 00000000
[628953 ms] UsbSnoop - MyInternalIOCTLCompletion(f8917db0) : fido=81b964f0, Irp=81d19818, Context=822f3898, IRQL=2
[628953 ms]  <<<  URB 906 coming back  <<< 
-- URB_FUNCTION_BULK_OR_INTERRUPT_TRANSFER:
  PipeHandle           = 82300ef4 [endpoint 0x00000081]
  TransferFlags        = 00000003 (USBD_TRANSFER_DIRECTION_IN, USBD_SHORT_TRANSFER_OK)
  TransferBufferLength = 00000100
  TransferBuffer       = 00000000
  TransferBufferMDL    = 81b65b08
    00000000: 7b c0 7f ff f0 00 4a 5f e7 80 7f ff f0 00 9e 7f
    00000010: fe 00 ff ff f0 69 3e ff fe 01 ff ff f0 d0 3e ff
    00000020: fe 03 ff ff f0 c0 3c ff ff 07 ff fd f0 e4 3d ff
    00000030: ff 8f ff fb f0 a8 3f ff ff ff ff ff f0 40 7f ff
    00000040: ff ff ff ff f0 df 02 55 00 4a 00 3a ff ff ff fc
    00000050: ff ff ff c0 ff ff ff f0 01 ff ff c0 ff ff fe 00
    00000060: 00 7f ff c0 ff fe 00 07 9d ff ff c0 ff f8 03 e2
    00000070: ff ff ff c0 ff e0 3f ff 7f ff ff c0 ff cb ff ff
    00000080: ff ff ff c0 ff 9f ff ff ff ff ff c0 ff ab ff ff
    00000090: ff ff ff c0 fe 0f ff ff ff ff ff c0 fe ef ff ff
    000000a0: ff ff 3f c0 fe ff ff ff ff ff ff c0 fd ff ff fe
    000000b0: ff ff ff c0 f9 ff ff ff ff ff ff c0 fb ff ff ff
    000000c0: ff ff ff c0 ff ff ff ff ff ff ff c0 ff ff ff ff
    000000d0: ff ff ff c0 ff ff ff ff ff ff ff c0 ff ff ff ff
    000000e0: ff ff ff c0 ff ff ff ff ff ff ff c0 ff ff ff ff
    000000f0: 3f ff ff c0 ff ff ff f8 37 ff ff c0 ff 9f ff e0
  UrbLink              = 00000000
[628981 ms] UsbSnoop - DispatchAny(f8916610) : IRP_MJ_INTERNAL_DEVICE_CONTROL
[628981 ms] UsbSnoop - MyDispatchInternalIOCTL(f8917e80) : fdo=822eee08, Irp=81d19818, IRQL=2
[628981 ms]  >>>  URB 907 going down  >>> 
-- URB_FUNCTION_BULK_OR_INTERRUPT_TRANSFER:
  PipeHandle           = 82300ef4 [endpoint 0x00000081]
  TransferFlags        = 00000003 (USBD_TRANSFER_DIRECTION_IN, USBD_SHORT_TRANSFER_OK)
  TransferBufferLength = 00000100
  TransferBuffer       = 00000000
  TransferBufferMDL    = 81b65b08
  UrbLink              = 00000000
[628983 ms] UsbSnoop - MyInternalIOCTLCompletion(f8917db0) : fido=81b964f0, Irp=81d19818, Context=81b4ccc0, IRQL=2
[628983 ms]  <<<  URB 907 coming back  <<< 
-- URB_FUNCTION_BULK_OR_INTERRUPT_TRANSFER:
  PipeHandle           = 82300ef4 [endpoint 0x00000081]
  TransferFlags        = 00000003 (USBD_TRANSFER_DIRECTION_IN, USBD_SHORT_TRANSFER_OK)
  TransferBufferLength = 000000ff
  TransferBuffer       = 00000000
  TransferBufferMDL    = 81b65b08
    00000000: 4f ff ff c0 fe 00 00 00 0f ff ff c0 ff 00 00 00
    00000010: 1f ff ff c0 ff 00 00 00 1f ff ff c0 ff 00 00 00
    00000020: 1f ff ff c0 ff 00 00 00 1f ff ff c0 ff 00 00 00
    00000030: 1f ff ff c0 ff 80 00 00 1f ff ff c0 ff 80 00 00
    00000040: 3f ff ff c0 ff 80 00 00 1f ff ff c0 ff 80 00 08
    00000050: 1f ff ff c0 ff 80 00 7f ff ff ff c0 ff 8f c3 e0
    00000060: 7f ff fc c0 ff c1 e3 c0 3f ff f6 c0 ff c7 e1 ff
    00000070: ff ff f6 c0 ff ff 63 a7 fd ff f3 c0 ff 76 03 a0
    00000080: 70 ff f9 c0 ff 30 c3 ff c1 ff b1 c0 ff 1f 01 c0
    00000090: 00 ff b1 c0 ff 00 40 80 01 ff b1 c0 ff 00 40 80
    000000a0: 01 ff a1 c0 ff 00 01 c0 01 ff 85 c0 ff 00 00 60
    000000b0: 01 ff cb c0 ff 00 00 74 03 ff c3 c0 ff 03 80 60
    000000c0: 03 ff cf c0 ff 02 cf e0 03 ff 9f c0 ff 00 7e 00
    000000d0: 87 ff df c0 ff 84 0c 00 67 ff ff c0 ff 80 00 00
    000000e0: 01 ff ff c0 ff 80 00 00 40 3f ff c0 ff 80 e0 7f
    000000f0: c0 3f ff c0 ff 81 fa 00 02 3f ff c0 ff c0 00
  UrbLink              = 00000000
[629011 ms] UsbSnoop - DispatchAny(f8916610) : IRP_MJ_INTERNAL_DEVICE_CONTROL
[629011 ms] UsbSnoop - MyDispatchInternalIOCTL(f8917e80) : fdo=822eee08, Irp=81d19818, IRQL=2
[629011 ms]  >>>  URB 908 going down  >>> 
-- URB_FUNCTION_BULK_OR_INTERRUPT_TRANSFER:
  PipeHandle           = 82300f14 [endpoint 0x00000002]
  TransferFlags        = 00000000 (USBD_TRANSFER_DIRECTION_OUT, ~USBD_SHORT_TRANSFER_OK)
  TransferBufferLength = 00000007
  TransferBuffer       = 00000000
  TransferBufferMDL    = 81b65b08
    00000000: 00 00 00 02 05 e0 00
  UrbLink              = 00000000
[629011 ms] UsbSnoop - MyInternalIOCTLCompletion(f8917db0) : fido=81b964f0, Irp=81d19818, Context=81c3bfe8, IRQL=2
[629012 ms]  <<<  URB 908 coming back  <<< 
-- URB_FUNCTION_BULK_OR_INTERRUPT_TRANSFER:
  PipeHandle           = 82300f14 [endpoint 0x00000002]
  TransferFlags        = 00000000 (USBD_TRANSFER_DIRECTION_OUT, ~USBD_SHORT_TRANSFER_OK)
  TransferBufferLength = 00000007
  TransferBuffer       = 00000000
  TransferBufferMDL    = 81b65b08
  UrbLink              = 00000000
[629021 ms] UsbSnoop - DispatchAny(f8916610) : IRP_MJ_INTERNAL_DEVICE_CONTROL
[629021 ms] UsbSnoop - MyDispatchInternalIOCTL(f8917e80) : fdo=822eee08, Irp=81d19818, IRQL=2
[629021 ms]  >>>  URB 909 going down  >>> 
-- URB_FUNCTION_BULK_OR_INTERRUPT_TRANSFER:
  PipeHandle           = 82300ef4 [endpoint 0x00000081]
  TransferFlags        = 00000003 (USBD_TRANSFER_DIRECTION_IN, USBD_SHORT_TRANSFER_OK)
  TransferBufferLength = 00000100
  TransferBuffer       = 00000000
  TransferBufferMDL    = 81b65b08
  UrbLink              = 00000000
[629022 ms] UsbSnoop - MyInternalIOCTLCompletion(f8917db0) : fido=81b964f0, Irp=81d19818, Context=81b4ccc0, IRQL=2
[629022 ms]  <<<  URB 909 coming back  <<< 
-- URB_FUNCTION_BULK_OR_INTERRUPT_TRANSFER:
  PipeHandle           = 82300ef4 [endpoint 0x00000081]
  TransferFlags        = 00000003 (USBD_TRANSFER_DIRECTION_IN, USBD_SHORT_TRANSFER_OK)
  TransferBufferLength = 00000005
  TransferBuffer       = 00000000
  TransferBufferMDL    = 81b65b08
    00000000: 00 00 03 ff 03
  UrbLink              = 00000000
[629051 ms] UsbSnoop - DispatchAny(f8916610) : IRP_MJ_INTERNAL_DEVICE_CONTROL
[629051 ms] UsbSnoop - MyDispatchInternalIOCTL(f8917e80) : fdo=822eee08, Irp=81d19818, IRQL=2
[629051 ms]  >>>  URB 910 going down  >>> 
-- URB_FUNCTION_BULK_OR_INTERRUPT_TRANSFER:
  PipeHandle           = 82300ef4 [endpoint 0x00000081]
  TransferFlags        = 00000003 (USBD_TRANSFER_DIRECTION_IN, USBD_SHORT_TRANSFER_OK)
  TransferBufferLength = 00000100
  TransferBuffer       = 00000000
  TransferBufferMDL    = 81b65b08
  UrbLink              = 00000000
[629053 ms] UsbSnoop - MyInternalIOCTLCompletion(f8917db0) : fido=81b964f0, Irp=81d19818, Context=81cb4e48, IRQL=2
[629053 ms]  <<<  URB 910 coming back  <<< 
-- URB_FUNCTION_BULK_OR_INTERRUPT_TRANSFER:
  PipeHandle           = 82300ef4 [endpoint 0x00000081]
  TransferFlags        = 00000003 (USBD_TRANSFER_DIRECTION_IN, USBD_SHORT_TRANSFER_OK)
  TransferBufferLength = 00000100
  TransferBuffer       = 00000000
  TransferBufferMDL    = 81b65b08
    00000000: 00 00 3f ff c0 ff c0 00 14 02 3f ff c0 ff c0 00
    00000010: 70 06 7f ff c0 ff e0 00 00 04 7f ff c0 ff f0 00
    00000020: 00 04 ff ff c0 ff f2 00 00 0c ff ff c0 ff f8 00
    00000030: 00 0d ff ff c0 ff fd 00 00 19 fb ff c0 ff fe 00
    00000040: 00 3b f7 ff c0 ff ff 80 00 3f e7 ff c0 ff ff 80
    00000050: 00 7f cf ff c0 ff ff c0 00 ff 9f ff c0 ff ff c0
    00000060: 01 ff 3f ff c0 ff ff e0 07 fc 6f ff c0 ff ff f8
    00000070: 7f f8 cf ff c0 ff ff ff ff f1 9f ff c0 ff ff ff
    00000080: ff e7 3f ff c0 ff ff fe 3f 8c 3f ff c0 ff ff fe
    00000090: 0c 18 7f ff c0 ff ff fe 00 40 7f ff c0 df 02 0b
    000000a0: 00 4a 00 37 ff ff ff ff ff ff fe ff ff ff ff ff
    000000b0: ff fe ff ff ff c1 ff ff fe ff ff fe 00 3f ff fe
    000000c0: ff ff f8 00 0f ff fe ff ff c0 00 03 ff fe ff ff
    000000d0: 80 00 09 ff fe ff ff 00 00 00 7f fe ff fe 00 00
    000000e0: 01 3f fe ff f8 00 00 00 9f fe ff f0 00 00 00 4f
    000000f0: fe ff f0 00 00 00 67 fe ff e0 00 00 00 27 fe fb
  UrbLink              = 00000000
[629081 ms] UsbSnoop - DispatchAny(f8916610) : IRP_MJ_INTERNAL_DEVICE_CONTROL
[629081 ms] UsbSnoop - MyDispatchInternalIOCTL(f8917e80) : fdo=822eee08, Irp=81d19818, IRQL=2
[629081 ms]  >>>  URB 911 going down  >>> 
-- URB_FUNCTION_BULK_OR_INTERRUPT_TRANSFER:
  PipeHandle           = 82300ef4 [endpoint 0x00000081]
  TransferFlags        = 00000003 (USBD_TRANSFER_DIRECTION_IN, USBD_SHORT_TRANSFER_OK)
  TransferBufferLength = 00000100
  TransferBuffer       = 00000000
  TransferBufferMDL    = 81b65b08
  UrbLink              = 00000000
[629084 ms] UsbSnoop - MyInternalIOCTLCompletion(f8917db0) : fido=81b964f0, Irp=81d19818, Context=81c3bfe8, IRQL=2
[629084 ms]  <<<  URB 911 coming back  <<< 
-- URB_FUNCTION_BULK_OR_INTERRUPT_TRANSFER:
  PipeHandle           = 82300ef4 [endpoint 0x00000081]
  TransferFlags        = 00000003 (USBD_TRANSFER_DIRECTION_IN, USBD_SHORT_TRANSFER_OK)
  TransferBufferLength = 00000100
  TransferBuffer       = 00000000
  TransferBufferMDL    = 81b65b08
    00000000: e0 00 00 00 3b fe ff c0 00 00 00 3b fe ff c0 00
    00000010: 00 00 3d fe ff 80 00 00 00 7d fe ff 00 00 00 00
    00000020: 6f fe ff 00 00 00 00 36 fe ff 80 00 20 00 1f fe
    00000030: fe 00 00 0c 00 8f fe fe 00 00 cf 8b ff fe fe 80
    00000040: 00 3f 0f ff fe fe 00 02 7f 0f ff fe fd 00 01 ca
    00000050: 1f ff fe fd 80 00 24 0c 7f fe fe 89 20 04 0d 7f
    00000060: fe fe b0 20 08 0d 7f fe fc 00 30 00 0c ff fe fe
    00000070: 6c 30 00 06 3f fe fc b4 10 80 26 bf fe fc 14 09
    00000080: 00 06 7f fe ff 64 c9 02 66 7f fe fc 02 a1 00 ee
    00000090: 7f fe fa 03 a0 00 9f 7f fe f6 1f b0 00 0f ff fe
    000000a0: fc 1f d8 00 01 ff fe f0 ff ee 07 ff ff fe f7 ff
    000000b0: d4 07 3e ff fe ff ff 4f 08 05 ff fe ff fe 47 00
    000000c0: 7d bf fe ff fe c0 26 7f ff fe ff fc c0 88 03 ff
    000000d0: fe ff fc c0 64 27 ff fe ff ff c0 b8 0f ff fe ff
    000000e0: ff 40 6f ff ff fe ff ff e0 17 ef ff fe ff ff e0
    000000f0: 0e 1f ff fe ff ff e0 03 9f ff fe ff ff f0 01 ff
  UrbLink              = 00000000
[629112 ms] UsbSnoop - DispatchAny(f8916610) : IRP_MJ_INTERNAL_DEVICE_CONTROL
[629112 ms] UsbSnoop - MyDispatchInternalIOCTL(f8917e80) : fdo=822eee08, Irp=81d19818, IRQL=2
[629112 ms]  >>>  URB 912 going down  >>> 
-- URB_FUNCTION_BULK_OR_INTERRUPT_TRANSFER:
  PipeHandle           = 82300ef4 [endpoint 0x00000081]
  TransferFlags        = 00000003 (USBD_TRANSFER_DIRECTION_IN, USBD_SHORT_TRANSFER_OK)
  TransferBufferLength = 00000100
  TransferBuffer       = 00000000
  TransferBufferMDL    = 81b65b08
  UrbLink              = 00000000
[629114 ms] UsbSnoop - MyInternalIOCTLCompletion(f8917db0) : fido=81b964f0, Irp=81d19818, Context=822f3898, IRQL=2
[629114 ms]  <<<  URB 912 coming back  <<< 
-- URB_FUNCTION_BULK_OR_INTERRUPT_TRANSFER:
  PipeHandle           = 82300ef4 [endpoint 0x00000081]
  TransferFlags        = 00000003 (USBD_TRANSFER_DIRECTION_IN, USBD_SHORT_TRANSFER_OK)
  TransferBufferLength = 00000100
  TransferBuffer       = 00000000
  TransferBufferMDL    = 81b65b08
    00000000: ff fe ff ff f0 00 7f ff fe ff ff f0 00 07 ff fe
    00000010: ff ff f8 00 05 ff fe ff ff f8 00 19 ff fe ff ff
    00000020: fc 00 03 ff fe ff ff fe 00 03 ff fe ff ff fe 00
    00000030: 03 ff fe ff ff ff 00 07 ff fe ff ff ff 80 07 ff
    00000040: fe ff ff ff 80 0f ff fe ff ff ff 80 0f ff fe ff
    00000050: ff ff c0 0f ff fe ff ff ff c4 0f ff fe ff ff ff
    00000060: c2 bf ff fe ff ff ff c2 6f ff fe ff ff ff c0 5f
    00000070: ff fe ff ff ff 81 1f ff fe ff ff ff c0 3f ff fe
    00000080: ff ff ff e0 7f ff fe ff ff ff e0 3f ff fe ff ff
    00000090: ff 60 3f ff fe ff ff ff f0 ff ff fe ff ff ff f0
    000000a0: bf ff fe ff ff ff f0 7f ff fe df 02 0b 00 4a 00
    000000b0: 35 00 00 00 00 00 00 00 00 00 00 00 00 00 00 00
    000000c0: 00 00 00 00 00 00 00 00 31 20 00 00 00 00 00 00
    000000d0: 00 00 00 00 00 00 00 10 40 00 00 00 00 00 10 20
    000000e0: 00 00 00 08 00 20 1c 00 00 00 20 00 20 06 00 00
    000000f0: 00 60 00 a0 0f 80 00 00 40 01 01 37 c0 00 00 66
  UrbLink              = 00000000
[629142 ms] UsbSnoop - DispatchAny(f8916610) : IRP_MJ_INTERNAL_DEVICE_CONTROL
[629142 ms] UsbSnoop - MyDispatchInternalIOCTL(f8917e80) : fdo=822eee08, Irp=81d19818, IRQL=2
[629142 ms]  >>>  URB 913 going down  >>> 
-- URB_FUNCTION_BULK_OR_INTERRUPT_TRANSFER:
  PipeHandle           = 82300ef4 [endpoint 0x00000081]
  TransferFlags        = 00000003 (USBD_TRANSFER_DIRECTION_IN, USBD_SHORT_TRANSFER_OK)
  TransferBufferLength = 00000100
  TransferBuffer       = 00000000
  TransferBufferMDL    = 81b65b08
  UrbLink              = 00000000
[629144 ms] UsbSnoop - MyInternalIOCTLCompletion(f8917db0) : fido=81b964f0, Irp=81d19818, Context=81cb4e48, IRQL=2
[629144 ms]  <<<  URB 913 coming back  <<< 
-- URB_FUNCTION_BULK_OR_INTERRUPT_TRANSFER:
  PipeHandle           = 82300ef4 [endpoint 0x00000081]
  TransferFlags        = 00000003 (USBD_TRANSFER_DIRECTION_IN, USBD_SHORT_TRANSFER_OK)
  TransferBufferLength = 000000ff
  TransferBuffer       = 00000000
  TransferBufferMDL    = 81b65b08
    00000000: 01 01 39 80 00 00 3c 00 00 74 c0 00 00 70 00 00
    00000010: 0d 80 00 00 c0 00 00 0d e0 00 00 c0 00 00 05 b0
    00000020: 00 00 c0 00 00 17 d8 00 01 80 00 00 13 f8 00 03
    00000030: 80 00 00 1c 78 20 01 c0 00 00 00 d0 80 01 80 00
    00000040: 00 01 b8 00 03 80 01 80 06 f8 20 03 00 0c 80 07
    00000050: d8 70 07 70 10 00 05 19 d8 07 18 0f 00 07 3d 98
    00000060: 03 7c 08 60 0f 7c 38 07 ce 03 90 0f 8c 60 0f fe
    00000070: 09 c0 0f fc e8 0e e6 00 00 0f fc c8 0f f6 04 01
    00000080: 8f fd 98 07 64 00 01 b7 79 b8 0e 04 00 01 bf 78
    00000090: 78 07 1c 00 03 ff fb e0 07 3c 00 03 fe 73 f8 01
    000000a0: ec 00 0f fc f7 d8 01 cc a0 0f f9 f7 98 01 cc 24
    000000b0: 1f fb e7 98 01 cc e6 1e 6f e7 78 00 df c2 1f dd
    000000c0: f7 f8 00 df 01 0f fb f3 f8 00 f6 00 01 f3 ff f8
    000000d0: 00 fc 0c 01 f3 ff f8 00 df fe 33 e3 fb f8 00 c7
    000000e0: 01 33 c3 f9 f8 00 4e 3d b3 83 fd f8 10 7f e8 f3
    000000f0: 07 fd f8 30 3d e4 96 07 fd f8 00 3f a4 3c 07
  UrbLink              = 00000000
[629172 ms] UsbSnoop - DispatchAny(f8916610) : IRP_MJ_INTERNAL_DEVICE_CONTROL
[629172 ms] UsbSnoop - MyDispatchInternalIOCTL(f8917e80) : fdo=822eee08, Irp=81d19818, IRQL=2
[629172 ms]  >>>  URB 914 going down  >>> 
-- URB_FUNCTION_BULK_OR_INTERRUPT_TRANSFER:
  PipeHandle           = 82300f14 [endpoint 0x00000002]
  TransferFlags        = 00000000 (USBD_TRANSFER_DIRECTION_OUT, ~USBD_SHORT_TRANSFER_OK)
  TransferBufferLength = 00000007
  TransferBuffer       = 00000000
  TransferBufferMDL    = 81b65b08
    00000000: 00 00 00 02 05 e0 00
  UrbLink              = 00000000
[629172 ms] UsbSnoop - MyInternalIOCTLCompletion(f8917db0) : fido=81b964f0, Irp=81d19818, Context=81c3bfe8, IRQL=2
[629172 ms]  <<<  URB 914 coming back  <<< 
-- URB_FUNCTION_BULK_OR_INTERRUPT_TRANSFER:
  PipeHandle           = 82300f14 [endpoint 0x00000002]
  TransferFlags        = 00000000 (USBD_TRANSFER_DIRECTION_OUT, ~USBD_SHORT_TRANSFER_OK)
  TransferBufferLength = 00000007
  TransferBuffer       = 00000000
  TransferBufferMDL    = 81b65b08
  UrbLink              = 00000000
[629182 ms] UsbSnoop - DispatchAny(f8916610) : IRP_MJ_INTERNAL_DEVICE_CONTROL
[629182 ms] UsbSnoop - MyDispatchInternalIOCTL(f8917e80) : fdo=822eee08, Irp=81d19818, IRQL=2
[629182 ms]  >>>  URB 915 going down  >>> 
-- URB_FUNCTION_BULK_OR_INTERRUPT_TRANSFER:
  PipeHandle           = 82300ef4 [endpoint 0x00000081]
  TransferFlags        = 00000003 (USBD_TRANSFER_DIRECTION_IN, USBD_SHORT_TRANSFER_OK)
  TransferBufferLength = 00000100
  TransferBuffer       = 00000000
  TransferBufferMDL    = 81b65b08
  UrbLink              = 00000000
[629182 ms] UsbSnoop - MyInternalIOCTLCompletion(f8917db0) : fido=81b964f0, Irp=81d19818, Context=81cb4e48, IRQL=2
[629182 ms]  <<<  URB 915 coming back  <<< 
-- URB_FUNCTION_BULK_OR_INTERRUPT_TRANSFER:
  PipeHandle           = 82300ef4 [endpoint 0x00000081]
  TransferFlags        = 00000003 (USBD_TRANSFER_DIRECTION_IN, USBD_SHORT_TRANSFER_OK)
  TransferBufferLength = 00000005
  TransferBuffer       = 00000000
  TransferBufferMDL    = 81b65b08
    00000000: 00 00 03 ff 03
  UrbLink              = 00000000
[629212 ms] UsbSnoop - DispatchAny(f8916610) : IRP_MJ_INTERNAL_DEVICE_CONTROL
[629212 ms] UsbSnoop - MyDispatchInternalIOCTL(f8917e80) : fdo=822eee08, Irp=81d19818, IRQL=2
[629212 ms]  >>>  URB 916 going down  >>> 
-- URB_FUNCTION_BULK_OR_INTERRUPT_TRANSFER:
  PipeHandle           = 82300ef4 [endpoint 0x00000081]
  TransferFlags        = 00000003 (USBD_TRANSFER_DIRECTION_IN, USBD_SHORT_TRANSFER_OK)
  TransferBufferLength = 00000100
  TransferBuffer       = 00000000
  TransferBufferMDL    = 81b65b08
  UrbLink              = 00000000
[629214 ms] UsbSnoop - MyInternalIOCTLCompletion(f8917db0) : fido=81b964f0, Irp=81d19818, Context=81cdfe48, IRQL=2
[629214 ms]  <<<  URB 916 coming back  <<< 
-- URB_FUNCTION_BULK_OR_INTERRUPT_TRANSFER:
  PipeHandle           = 82300ef4 [endpoint 0x00000081]
  TransferFlags        = 00000003 (USBD_TRANSFER_DIRECTION_IN, USBD_SHORT_TRANSFER_OK)
  TransferBufferLength = 00000100
  TransferBuffer       = 00000000
  TransferBufferMDL    = 81b65b08
    00000000: fd f8 00 1e 0c 68 0f fd f8 00 ce d9 f0 0f ff f8
    00000010: 00 83 4f e0 1f ff f8 00 63 cf 80 1f ff f8 41 27
    00000020: ff 00 3f ff f8 11 8e fe 00 7f ff f8 60 ce 78 00
    00000030: 7f ff f8 e6 1e 00 00 ff ff f8 ff 3f 10 00 ff ff
    00000040: f8 fd e1 80 01 ff ff f8 de 41 20 03 ff ff f8 de
    00000050: c0 80 03 ff ff f8 ff 80 00 07 ff ff f8 ff 80 00
    00000060: 0f ff ff f8 ff 20 00 1f ff ff f8 ff 60 00 3f ff
    00000070: ff f8 ff 60 00 7f ff ff f8 ff 60 00 ff ff ff f8
    00000080: ff 42 00 ff ff ff f8 ff 00 09 ff ff ff f8 fe 80
    00000090: 07 ff ff ff f8 fc 00 0f ff ff ff f8 fc 00 1f ff
    000000a0: ff ff f8 fc 00 3f ff ff ff f8 fc 00 7f ff ff ff
    000000b0: f8 fe 00 ff ff ff ff f8 df 02 0b 00 4a 00 35 ff
    000000c0: ff ff ff bf ff f8 ff ff ff 69 ff ff f8 ff ff ff
    000000d0: 20 7f ff f8 ff ff 80 00 3f ff f8 ff fc d0 30 1b
    000000e0: ff f8 ff f1 81 80 03 ff f8 ff fe 00 00 01 7f f8
    000000f0: ff f8 00 00 01 ff f8 ff f0 00 00 61 bf f8 ff f0
  UrbLink              = 00000000
[629242 ms] UsbSnoop - DispatchAny(f8916610) : IRP_MJ_INTERNAL_DEVICE_CONTROL
[629242 ms] UsbSnoop - MyDispatchInternalIOCTL(f8917e80) : fdo=822eee08, Irp=81d19818, IRQL=2
[629242 ms]  >>>  URB 917 going down  >>> 
-- URB_FUNCTION_BULK_OR_INTERRUPT_TRANSFER:
  PipeHandle           = 82300ef4 [endpoint 0x00000081]
  TransferFlags        = 00000003 (USBD_TRANSFER_DIRECTION_IN, USBD_SHORT_TRANSFER_OK)
  TransferBufferLength = 00000100
  TransferBuffer       = 00000000
  TransferBufferMDL    = 81b65b08
  UrbLink              = 00000000
[629244 ms] UsbSnoop - MyInternalIOCTLCompletion(f8917db0) : fido=81b964f0, Irp=81d19818, Context=81c3bfe8, IRQL=2
[629244 ms]  <<<  URB 917 coming back  <<< 
-- URB_FUNCTION_BULK_OR_INTERRUPT_TRANSFER:
  PipeHandle           = 82300ef4 [endpoint 0x00000081]
  TransferFlags        = 00000003 (USBD_TRANSFER_DIRECTION_IN, USBD_SHORT_TRANSFER_OK)
  TransferBufferLength = 00000100
  TransferBuffer       = 00000000
  TransferBufferMDL    = 81b65b08
    00000000: 00 00 00 7f f8 ff e0 00 00 00 37 f8 ff c0 00 00
    00000010: 00 1b f8 ff c0 00 00 00 1f f8 ff c0 00 00 00 1f
    00000020: f8 ff c0 00 00 00 0f f8 ff c0 00 00 00 0f f8 ff
    00000030: 80 10 00 00 07 f8 ff 80 00 00 00 05 f8 ff 80 00
    00000040: 00 00 07 f8 ff 00 00 00 00 07 f8 ff 00 00 00 00
    00000050: 26 f8 ff 00 00 00 e0 06 f8 ff 01 00 07 f2 5f f8
    00000060: fe 08 30 07 dd fe f8 fe 5e 20 0f ed ff f8 fe 40
    00000070: e0 3e c1 f7 f8 fe 10 60 33 81 df e8 fe a0 60 03
    00000080: 81 f7 f8 fc 80 c0 01 01 a6 b8 fc 00 20 04 00 97
    00000090: f8 fa 04 48 00 00 a6 f8 fa 04 80 00 00 87 f8 ff
    000000a0: 24 24 00 40 8d b8 ff a2 40 00 80 07 f0 ff 00 00
    000000b0: 00 b8 ef e8 ff 08 00 01 3d ef f8 ff 04 40 02 07
    000000c0: 2f f8 ff 82 c0 02 07 4f f8 ff 13 00 04 04 0f f8
    000000d0: ff 92 00 00 00 0f f8 ff 32 00 01 ff 9f f8 ff a7
    000000e0: 04 03 00 9e b8 ff 4b 01 80 1a 5f f8 ff 4b c0 7c
    000000f0: 7b 1e f8 ff 03 f0 00 0e 27 d8 fe 03 f8 00 01 67
  UrbLink              = 00000000
[629272 ms] UsbSnoop - DispatchAny(f8916610) : IRP_MJ_INTERNAL_DEVICE_CONTROL
[629272 ms] UsbSnoop - MyDispatchInternalIOCTL(f8917e80) : fdo=822eee08, Irp=81d19818, IRQL=2
[629272 ms]  >>>  URB 918 going down  >>> 
-- URB_FUNCTION_BULK_OR_INTERRUPT_TRANSFER:
  PipeHandle           = 82300ef4 [endpoint 0x00000081]
  TransferFlags        = 00000003 (USBD_TRANSFER_DIRECTION_IN, USBD_SHORT_TRANSFER_OK)
  TransferBufferLength = 00000100
  TransferBuffer       = 00000000
  TransferBufferMDL    = 81b65b08
  UrbLink              = 00000000
[629274 ms] UsbSnoop - MyInternalIOCTLCompletion(f8917db0) : fido=81b964f0, Irp=81d19818, Context=822f3898, IRQL=2
[629274 ms]  <<<  URB 918 coming back  <<< 
-- URB_FUNCTION_BULK_OR_INTERRUPT_TRANSFER:
  PipeHandle           = 82300ef4 [endpoint 0x00000081]
  TransferFlags        = 00000003 (USBD_TRANSFER_DIRECTION_IN, USBD_SHORT_TRANSFER_OK)
  TransferBufferLength = 00000100
  TransferBuffer       = 00000000
  TransferBufferMDL    = 81b65b08
    00000000: f8 fc 1f fc 01 01 4f 78 f8 33 ff 01 01 1f 78 f0
    00000010: 67 ff 82 42 b7 e8 f0 df ff e1 00 9f 78 ff af ff
    00000020: f9 a3 c9 b8 ff ff ff ff ff e6 e8 ff ff ff ff ff
    00000030: f7 d8 ff ff ff ff ff fb f8 ff ff ff ff ff f8 e8
    00000040: fb ff ff ff ff ff 10 f7 ff ff ff ff ff 88 ff ff
    00000050: ff ff ff ff f0 ff ff ff ff ff ff f8 ff ff ff ff
    00000060: ff ff f8 ff ff ff ff fe 7f f8 ff ff ff ff fe 7f
    00000070: f8 ff ff ff ff fc 3f f8 ff ff fe 3f f8 1f f8 ff
    00000080: ff ff 07 e0 1f f8 ff ff ff 00 00 1f f8 ff ff ff
    00000090: 00 00 1f f8 ff ff ff 80 00 0f f8 ff ff ff c0 00
    000000a0: 07 f8 ff ff ff c0 00 07 f8 ff ff ff e0 00 07 f8
    000000b0: ff ff ff e0 00 03 f8 ff ff ff f0 00 01 f8 ff ff
    000000c0: ff f0 00 01 f8 df 02 0b 00 4a 00 38 ff ff ff ff
    000000d0: ff ff ff ff ff ff e1 ff ff ff ff ff f9 0f e3 ff
    000000e0: ff ff ff f0 39 e1 ff ff ff ff cf f0 41 ff ff ff
    000000f0: ff fb 80 26 3f ff ff ff c3 00 03 cf ff ff ff f4
  UrbLink              = 00000000
[629303 ms] UsbSnoop - DispatchAny(f8916610) : IRP_MJ_INTERNAL_DEVICE_CONTROL
[629303 ms] UsbSnoop - MyDispatchInternalIOCTL(f8917e80) : fdo=822eee08, Irp=81d19818, IRQL=2
[629303 ms]  >>>  URB 919 going down  >>> 
-- URB_FUNCTION_BULK_OR_INTERRUPT_TRANSFER:
  PipeHandle           = 82300ef4 [endpoint 0x00000081]
  TransferFlags        = 00000003 (USBD_TRANSFER_DIRECTION_IN, USBD_SHORT_TRANSFER_OK)
  TransferBufferLength = 00000100
  TransferBuffer       = 00000000
  TransferBufferMDL    = 81b65b08
  UrbLink              = 00000000
[629305 ms] UsbSnoop - MyInternalIOCTLCompletion(f8917db0) : fido=81b964f0, Irp=81d19818, Context=81cdfe48, IRQL=2
[629305 ms]  <<<  URB 919 coming back  <<< 
-- URB_FUNCTION_BULK_OR_INTERRUPT_TRANSFER:
  PipeHandle           = 82300ef4 [endpoint 0x00000081]
  TransferFlags        = 00000003 (USBD_TRANSFER_DIRECTION_IN, USBD_SHORT_TRANSFER_OK)
  TransferBufferLength = 000000ff
  TransferBuffer       = 00000000
  TransferBufferMDL    = 81b65b08
    00000000: 00 1d ff ff ff fe c0 00 00 9f ff ff fc 00 00 00
    00000010: ff ff ff f8 00 00 00 7f ff ff f8 c0 00 00 07 ff
    00000020: ff f3 c0 00 00 07 ff ff ff 00 00 00 0f ff ff fe
    00000030: 40 00 00 19 ff ff fc 40 00 00 1c ff ff fa 40 00
    00000040: 00 0c ff ff f6 40 00 00 1e 7f ff fd 00 0f 00 09
    00000050: 7d ff f8 00 3f c0 0c ff ff e3 80 44 cf e7 bf ff
    00000060: f7 80 de 0d f3 cf ff cc 00 73 0f dc df ff 21 40
    00000070: 00 0d 79 bb ff 23 60 00 00 7f 1f ff 0e 80 00 00
    00000080: 18 17 ff 80 c0 00 04 1e 3f ff 80 60 00 0c 18 6f
    00000090: ff 84 30 00 04 19 bf ff c0 10 00 04 1f ff ff e0
    000000a0: 08 00 00 2e df ff e0 80 00 c6 6f ff fe f0 00 00
    000000b0: e4 fb ff ff 78 00 00 38 f7 ff ff dc 00 00 39 ff
    000000c0: fb ff ff 80 00 18 ff ff ff ff 80 00 04 ff 79 ff
    000000d0: ff 80 04 9c de 60 ff e7 00 19 7c ff 1e ff ef 20
    000000e0: 00 00 ff f3 ff fe 30 00 09 bf ee ff fa 18 01 dd
    000000f0: fe f0 ff fe 08 00 33 7f 6c ff fe 06 00 02 5f
  UrbLink              = 00000000
[629332 ms] UsbSnoop - DispatchAny(f8916610) : IRP_MJ_INTERNAL_DEVICE_CONTROL
[629332 ms] UsbSnoop - MyDispatchInternalIOCTL(f8917e80) : fdo=822eee08, Irp=81d19818, IRQL=2
[629332 ms]  >>>  URB 920 going down  >>> 
-- URB_FUNCTION_BULK_OR_INTERRUPT_TRANSFER:
  PipeHandle           = 82300f14 [endpoint 0x00000002]
  TransferFlags        = 00000000 (USBD_TRANSFER_DIRECTION_OUT, ~USBD_SHORT_TRANSFER_OK)
  TransferBufferLength = 00000007
  TransferBuffer       = 00000000
  TransferBufferMDL    = 81b65b08
    00000000: 00 00 00 02 05 e0 00
  UrbLink              = 00000000
[629332 ms] UsbSnoop - MyInternalIOCTLCompletion(f8917db0) : fido=81b964f0, Irp=81d19818, Context=81c3bfe8, IRQL=2
[629332 ms]  <<<  URB 920 coming back  <<< 
-- URB_FUNCTION_BULK_OR_INTERRUPT_TRANSFER:
  PipeHandle           = 82300f14 [endpoint 0x00000002]
  TransferFlags        = 00000000 (USBD_TRANSFER_DIRECTION_OUT, ~USBD_SHORT_TRANSFER_OK)
  TransferBufferLength = 00000007
  TransferBuffer       = 00000000
  TransferBufferMDL    = 81b65b08
  UrbLink              = 00000000
[629342 ms] UsbSnoop - DispatchAny(f8916610) : IRP_MJ_INTERNAL_DEVICE_CONTROL
[629342 ms] UsbSnoop - MyDispatchInternalIOCTL(f8917e80) : fdo=822eee08, Irp=81d19818, IRQL=2
[629342 ms]  >>>  URB 921 going down  >>> 
-- URB_FUNCTION_BULK_OR_INTERRUPT_TRANSFER:
  PipeHandle           = 82300ef4 [endpoint 0x00000081]
  TransferFlags        = 00000003 (USBD_TRANSFER_DIRECTION_IN, USBD_SHORT_TRANSFER_OK)
  TransferBufferLength = 00000100
  TransferBuffer       = 00000000
  TransferBufferMDL    = 81b65b08
  UrbLink              = 00000000
[629342 ms] UsbSnoop - MyInternalIOCTLCompletion(f8917db0) : fido=81b964f0, Irp=81d19818, Context=81cdfe48, IRQL=2
[629342 ms]  <<<  URB 921 coming back  <<< 
-- URB_FUNCTION_BULK_OR_INTERRUPT_TRANSFER:
  PipeHandle           = 82300ef4 [endpoint 0x00000081]
  TransferFlags        = 00000003 (USBD_TRANSFER_DIRECTION_IN, USBD_SHORT_TRANSFER_OK)
  TransferBufferLength = 00000005
  TransferBuffer       = 00000000
  TransferBufferMDL    = 81b65b08
    00000000: 00 00 03 ff 03
  UrbLink              = 00000000
[629372 ms] UsbSnoop - DispatchAny(f8916610) : IRP_MJ_INTERNAL_DEVICE_CONTROL
[629372 ms] UsbSnoop - MyDispatchInternalIOCTL(f8917e80) : fdo=822eee08, Irp=81d19818, IRQL=2
[629372 ms]  >>>  URB 922 going down  >>> 
-- URB_FUNCTION_BULK_OR_INTERRUPT_TRANSFER:
  PipeHandle           = 82300ef4 [endpoint 0x00000081]
  TransferFlags        = 00000003 (USBD_TRANSFER_DIRECTION_IN, USBD_SHORT_TRANSFER_OK)
  TransferBufferLength = 00000100
  TransferBuffer       = 00000000
  TransferBufferMDL    = 81b65b08
  UrbLink              = 00000000
[629374 ms] UsbSnoop - MyInternalIOCTLCompletion(f8917db0) : fido=81b964f0, Irp=81d19818, Context=81b4ccc0, IRQL=2
[629374 ms]  <<<  URB 922 coming back  <<< 
-- URB_FUNCTION_BULK_OR_INTERRUPT_TRANSFER:
  PipeHandle           = 82300ef4 [endpoint 0x00000081]
  TransferFlags        = 00000003 (USBD_TRANSFER_DIRECTION_IN, USBD_SHORT_TRANSFER_OK)
  TransferBufferLength = 00000100
  TransferBuffer       = 00000000
  TransferBufferMDL    = 81b65b08
    00000000: bc ff ff 01 00 06 ff 9b ff ff 81 e0 1c ff bf ff
    00000010: ff 81 f0 38 fe e7 ff ff c0 1f fd 7f ad ff ff f0
    00000020: 07 fc 3f 7c ff ff dc 03 fd ff 78 ff ff ef 83 f9
    00000030: fb ce ff ff f7 ff f8 bf 6e ff ff f1 ff fd 67 fd
    00000040: ff ff e4 7f fc f7 ce f9 ff cf 3f fe 7e 32 e3 ff
    00000050: df 9f ff 7f f3 cf ff f8 ed ff 3f e0 bf ff f0 39
    00000060: 23 9e ec 7f ff e3 ff f1 cf f2 7f ff cf ff fc e7
    00000070: 77 ff ff ff ff de 70 fe ff ff fb b7 c3 bc 31 ff
    00000080: ff f7 33 4b df 0f ff ff fe 61 6c ff e3 ff bf fe
    00000090: c1 a2 ff f1 ff ff ff d0 a6 3f fc fe ff fd 90 b7
    000000a0: b7 fe f9 ff fc e0 5f b7 ff fb ff fc c0 5f 3f ff
    000000b0: ff ff f3 00 5b 1f ff ff ff f0 20 32 ff ff ff ff
    000000c0: f8 60 30 ff ff ff ff f9 c0 2d ff ff ff ff f9 e0
    000000d0: 3f ef ff df 02 55 00 4a 00 3b ff 07 ff ff ff c1
    000000e0: 80 00 ff 07 ff ff ff e3 c0 00 ff 07 ff f1 3f e3
    000000f0: 80 00 ff 07 ff bb f7 e3 c0 00 ff 87 ff bf ff e3
  UrbLink              = 00000000
[629402 ms] UsbSnoop - DispatchAny(f8916610) : IRP_MJ_INTERNAL_DEVICE_CONTROL
[629402 ms] UsbSnoop - MyDispatchInternalIOCTL(f8917e80) : fdo=822eee08, Irp=81d19818, IRQL=2
[629402 ms]  >>>  URB 923 going down  >>> 
-- URB_FUNCTION_BULK_OR_INTERRUPT_TRANSFER:
  PipeHandle           = 82300ef4 [endpoint 0x00000081]
  TransferFlags        = 00000003 (USBD_TRANSFER_DIRECTION_IN, USBD_SHORT_TRANSFER_OK)
  TransferBufferLength = 00000100
  TransferBuffer       = 00000000
  TransferBufferMDL    = 81b65b08
  UrbLink              = 00000000
[629404 ms] UsbSnoop - MyInternalIOCTLCompletion(f8917db0) : fido=81b964f0, Irp=81d19818, Context=81c3bfe8, IRQL=2
[629404 ms]  <<<  URB 923 coming back  <<< 
-- URB_FUNCTION_BULK_OR_INTERRUPT_TRANSFER:
  PipeHandle           = 82300ef4 [endpoint 0x00000081]
  TransferFlags        = 00000003 (USBD_TRANSFER_DIRECTION_IN, USBD_SHORT_TRANSFER_OK)
  TransferBufferLength = 00000100
  TransferBuffer       = 00000000
  TransferBufferMDL    = 81b65b08
    00000000: c0 00 ff 87 ff 7f ff c3 c0 00 ff 84 ff 7f ff e3
    00000010: c0 00 ff cf fe 07 7f f3 c0 00 ff df f8 02 7f fb
    00000020: c0 00 ff ff f8 00 1f fb c0 00 ff fe f0 00 3f fd
    00000030: c0 00 ff bb 60 00 07 ff c0 00 ff 70 60 00 0f ff
    00000040: c0 00 fe 40 00 00 03 ff c0 00 fe 40 00 00 06 ff
    00000050: 80 00 fc 00 00 00 07 ef 80 00 fc 00 00 00 01 61
    00000060: c0 00 fc 00 00 00 0c 10 c0 00 fc 00 00 00 04 00
    00000070: c0 00 fc 00 00 01 22 12 40 00 fc 00 00 00 05 86
    00000080: 00 00 fc 00 00 02 25 84 e0 00 fc 00 00 10 39 09
    00000090: f0 00 f8 00 41 80 00 1b f8 00 f8 01 82 00 00 13
    000000a0: 60 00 f8 1e 00 00 00 16 60 00 fd 00 40 1e 00 1e
    000000b0: a8 00 fc 07 80 ff 80 1f c0 00 fd 80 03 e3 c0 13
    000000c0: c0 00 fc 00 0f c0 c0 11 10 00 fe 01 0f fe c0 30
    000000d0: 10 00 fe 40 1f ff 80 b8 10 00 fe fe 9f b0 00 f9
    000000e0: 28 00 fe ff cf 80 00 39 08 00 ff ff c0 f8 01 7a
    000000f0: 40 00 fe 7f c0 f0 03 f4 00 00 ff 7f c0 78 07 f4
  UrbLink              = 00000000
[629432 ms] UsbSnoop - DispatchAny(f8916610) : IRP_MJ_INTERNAL_DEVICE_CONTROL
[629432 ms] UsbSnoop - MyDispatchInternalIOCTL(f8917e80) : fdo=822eee08, Irp=81d19818, IRQL=2
[629432 ms]  >>>  URB 924 going down  >>> 
-- URB_FUNCTION_BULK_OR_INTERRUPT_TRANSFER:
  PipeHandle           = 82300ef4 [endpoint 0x00000081]
  TransferFlags        = 00000003 (USBD_TRANSFER_DIRECTION_IN, USBD_SHORT_TRANSFER_OK)
  TransferBufferLength = 00000100
  TransferBuffer       = 00000000
  TransferBufferMDL    = 81b65b08
  UrbLink              = 00000000
[629434 ms] UsbSnoop - MyInternalIOCTLCompletion(f8917db0) : fido=81b964f0, Irp=81d19818, Context=822f3898, IRQL=2
[629434 ms]  <<<  URB 924 coming back  <<< 
-- URB_FUNCTION_BULK_OR_INTERRUPT_TRANSFER:
  PipeHandle           = 82300ef4 [endpoint 0x00000081]
  TransferFlags        = 00000003 (USBD_TRANSFER_DIRECTION_IN, USBD_SHORT_TRANSFER_OK)
  TransferBufferLength = 00000100
  TransferBuffer       = 00000000
  TransferBufferMDL    = 81b65b08
    00000000: 08 00 ff be 00 00 07 66 0c 00 ff d1 c0 00 1d e3
    00000010: 0c 00 ff d7 80 00 00 91 8d 00 ff ef 80 00 00 82
    00000020: fe 80 ff e7 80 e0 00 82 fe e0 ff f1 00 38 00 06
    00000030: b4 60 7f f0 00 0e 00 0e 94 60 00 36 00 67 9c 1f
    00000040: 98 60 00 04 07 e1 e4 0f 98 60 00 04 87 c0 36 3f
    00000050: 98 e0 00 06 ff 00 0e 3f 98 e0 00 03 ff 83 c6 7f
    00000060: 90 e0 00 01 ff df 63 3d b0 e0 00 01 ff 78 31 3d
    00000070: a0 e0 00 00 ff e0 19 3d 60 e0 00 00 ff 5c 1f 7b
    00000080: 41 e0 00 00 7e 7e 07 fb 41 e0 00 00 7f f0 07 fa
    00000090: 81 e0 00 00 3e e0 07 ff 81 e0 00 00 3e 40 07 fd
    000000a0: 01 e0 00 00 1f 00 0f fe 03 e0 00 00 0e 00 3f fe
    000000b0: 03 e0 00 00 03 0f ff fc 07 e0 00 00 01 f7 ff f8
    000000c0: 07 e0 00 00 00 ff ff f8 07 e0 00 00 01 ff ff f0
    000000d0: 07 e0 00 00 03 ff ff e0 07 e0 00 00 0f ff ff c0
    000000e0: 0f e0 00 00 1f ff ff c0 0f e0 00 00 3f ff ff 80
    000000f0: 0f e0 80 00 7f ff f9 80 0f e0 82 00 ff ff fd 80
  UrbLink              = 00000000
[629462 ms] UsbSnoop - DispatchAny(f8916610) : IRP_MJ_INTERNAL_DEVICE_CONTROL
[629462 ms] UsbSnoop - MyDispatchInternalIOCTL(f8917e80) : fdo=822eee08, Irp=81d19818, IRQL=2
[629462 ms]  >>>  URB 925 going down  >>> 
-- URB_FUNCTION_BULK_OR_INTERRUPT_TRANSFER:
  PipeHandle           = 82300ef4 [endpoint 0x00000081]
  TransferFlags        = 00000003 (USBD_TRANSFER_DIRECTION_IN, USBD_SHORT_TRANSFER_OK)
  TransferBufferLength = 00000100
  TransferBuffer       = 00000000
  TransferBufferMDL    = 81b65b08
  UrbLink              = 00000000
[629464 ms] UsbSnoop - MyInternalIOCTLCompletion(f8917db0) : fido=81b964f0, Irp=81d19818, Context=81b4ccc0, IRQL=2
[629464 ms]  <<<  URB 925 coming back  <<< 
-- URB_FUNCTION_BULK_OR_INTERRUPT_TRANSFER:
  PipeHandle           = 82300ef4 [endpoint 0x00000081]
  TransferFlags        = 00000003 (USBD_TRANSFER_DIRECTION_IN, USBD_SHORT_TRANSFER_OK)
  TransferBufferLength = 000000ff
  TransferBuffer       = 00000000
  TransferBufferMDL    = 81b65b08
    00000000: 0f e0 8e 01 ff ff fd e0 1f e0 1f 03 ff ff ff f0
    00000010: 1f e0 0f 07 ff ff ff f8 1f e0 07 0f ff ff ff fc
    00000020: 1f e0 07 9f ff ff ff f0 3f e0 df 02 55 00 4a 00
    00000030: 3e ff ff ff ff ff ff ff fc ff ff ff ff ff ff ff
    00000040: fc ff ff ff ff ff ff ff fc ff ff ff fe 9f ff ff
    00000050: fc ff ff ff 80 03 ff ff fc ff ff fe 00 01 ff ff
    00000060: fc ff ff f8 00 00 7f ff fc ff fe 40 00 00 3f ff
    00000070: fc ff f0 00 00 00 1f ff fc ff f0 00 00 00 0f ff
    00000080: fc ff e0 00 00 00 07 ff fc ff c0 00 00 00 07 ff
    00000090: fc ff c0 00 00 00 03 ff fc ff 00 00 00 00 01 ff
    000000a0: fc fe 00 00 00 00 00 ff fc ff 80 00 00 00 00 7f
    000000b0: fc ff 04 00 00 00 04 3f fc f2 00 00 00 00 06 1f
    000000c0: fc fc 00 30 00 00 00 0f fc f0 00 20 00 00 03 03
    000000d0: fc f0 00 30 00 00 03 00 fc f0 40 19 00 00 07 00
    000000e0: 7c e0 a0 5b 00 00 07 00 1c c0 8c 4a 7f 80 07 00
    000000f0: 04 c0 70 46 f7 f2 01 80 24 c4 28 03 fe e1 c1
  UrbLink              = 00000000
[629492 ms] UsbSnoop - DispatchAny(f8916610) : IRP_MJ_INTERNAL_DEVICE_CONTROL
[629492 ms] UsbSnoop - MyDispatchInternalIOCTL(f8917e80) : fdo=822eee08, Irp=81d19818, IRQL=2
[629492 ms]  >>>  URB 926 going down  >>> 
-- URB_FUNCTION_BULK_OR_INTERRUPT_TRANSFER:
  PipeHandle           = 82300f14 [endpoint 0x00000002]
  TransferFlags        = 00000000 (USBD_TRANSFER_DIRECTION_OUT, ~USBD_SHORT_TRANSFER_OK)
  TransferBufferLength = 00000007
  TransferBuffer       = 00000000
  TransferBufferMDL    = 81b65b08
    00000000: 00 00 00 02 05 e0 00
  UrbLink              = 00000000
[629492 ms] UsbSnoop - MyInternalIOCTLCompletion(f8917db0) : fido=81b964f0, Irp=81d19818, Context=81c3bfe8, IRQL=2
[629492 ms]  <<<  URB 926 coming back  <<< 
-- URB_FUNCTION_BULK_OR_INTERRUPT_TRANSFER:
  PipeHandle           = 82300f14 [endpoint 0x00000002]
  TransferFlags        = 00000000 (USBD_TRANSFER_DIRECTION_OUT, ~USBD_SHORT_TRANSFER_OK)
  TransferBufferLength = 00000007
  TransferBuffer       = 00000000
  TransferBufferMDL    = 81b65b08
  UrbLink              = 00000000
[629504 ms] UsbSnoop - DispatchAny(f8916610) : IRP_MJ_INTERNAL_DEVICE_CONTROL
[629504 ms] UsbSnoop - MyDispatchInternalIOCTL(f8917e80) : fdo=822eee08, Irp=81ab2e48, IRQL=2
[629504 ms]  >>>  URB 927 going down  >>> 
-- URB_FUNCTION_BULK_OR_INTERRUPT_TRANSFER:
  PipeHandle           = 82300ef4 [endpoint 0x00000081]
  TransferFlags        = 00000003 (USBD_TRANSFER_DIRECTION_IN, USBD_SHORT_TRANSFER_OK)
  TransferBufferLength = 00000100
  TransferBuffer       = 00000000
  TransferBufferMDL    = 81ac92e0
  UrbLink              = 00000000
[629504 ms] UsbSnoop - MyInternalIOCTLCompletion(f8917db0) : fido=81b964f0, Irp=81ab2e48, Context=81b4ccc0, IRQL=2
[629504 ms]  <<<  URB 927 coming back  <<< 
-- URB_FUNCTION_BULK_OR_INTERRUPT_TRANSFER:
  PipeHandle           = 82300ef4 [endpoint 0x00000081]
  TransferFlags        = 00000003 (USBD_TRANSFER_DIRECTION_IN, USBD_SHORT_TRANSFER_OK)
  TransferBufferLength = 00000005
  TransferBuffer       = 00000000
  TransferBufferMDL    = 81ac92e0
    00000000: 00 00 03 ff 03
  UrbLink              = 00000000
[629532 ms] UsbSnoop - DispatchAny(f8916610) : IRP_MJ_INTERNAL_DEVICE_CONTROL
[629532 ms] UsbSnoop - MyDispatchInternalIOCTL(f8917e80) : fdo=822eee08, Irp=81ab2e48, IRQL=2
[629532 ms]  >>>  URB 928 going down  >>> 
-- URB_FUNCTION_BULK_OR_INTERRUPT_TRANSFER:
  PipeHandle           = 82300ef4 [endpoint 0x00000081]
  TransferFlags        = 00000003 (USBD_TRANSFER_DIRECTION_IN, USBD_SHORT_TRANSFER_OK)
  TransferBufferLength = 00000100
  TransferBuffer       = 00000000
  TransferBufferMDL    = 81ac92e0
  UrbLink              = 00000000
[629534 ms] UsbSnoop - MyInternalIOCTLCompletion(f8917db0) : fido=81b964f0, Irp=81ab2e48, Context=81cb4e48, IRQL=2
[629534 ms]  <<<  URB 928 coming back  <<< 
-- URB_FUNCTION_BULK_OR_INTERRUPT_TRANSFER:
  PipeHandle           = 82300ef4 [endpoint 0x00000081]
  TransferFlags        = 00000003 (USBD_TRANSFER_DIRECTION_IN, USBD_SHORT_TRANSFER_OK)
  TransferBufferLength = 00000100
  TransferBuffer       = 00000000
  TransferBufferMDL    = 81ac92e0
    00000000: 80 1c c5 d0 41 ff e7 f1 80 1c f4 e0 00 1b e3 df
    00000010: 00 9c ff e0 60 1f 03 fe 01 9c ff e0 00 46 03 7e
    00000020: 81 fc ff e0 c0 1e 03 1e c7 fc ff f3 e0 1c 03 7e
    00000030: e7 fc ff f6 e0 40 02 5e 63 fc ff f8 70 c0 03 66
    00000040: 39 fc ff e0 30 02 01 07 88 fc ff f0 80 0e 03 1f
    00000050: 00 fc ff c0 00 39 e7 1f 82 fc ff c0 00 30 7f 82
    00000060: c1 fc ff c0 00 60 3e 87 1c fc ff e0 00 4c 3e cf
    00000070: e6 7c ff ec 01 1f 8c 46 0b fc ff fc 01 31 ff 42
    00000080: 0b fc ff f8 00 00 07 20 00 fc ff fc 00 01 d9 20
    00000090: 01 fc ff ff 02 00 1c 00 0b fc ff ff 83 00 08 04
    000000a0: 07 fc ff ff c1 c0 00 0c 0f fc ff ff f0 e0 20 5f
    000000b0: 0f fc ff ff fc 70 61 ff df fc ff ff ff 9d 87 ff
    000000c0: ff fc ff ff ff cf 9f ff ff fc ff ff ff e7 fd ff
    000000d0: ff fc ff ff ff f1 f7 ff ff fc ff ff ff fe 0f ff
    000000e0: ff fc ff ff ff ff ff ff ff fc ff ff ff ff ff ff
    000000f0: ff fc ff ff ff ff ff ff ff fc ff ff ff ff ff ff
  UrbLink              = 00000000
[629562 ms] UsbSnoop - DispatchAny(f8916610) : IRP_MJ_INTERNAL_DEVICE_CONTROL
[629562 ms] UsbSnoop - MyDispatchInternalIOCTL(f8917e80) : fdo=822eee08, Irp=81ab2e48, IRQL=2
[629562 ms]  >>>  URB 929 going down  >>> 
-- URB_FUNCTION_BULK_OR_INTERRUPT_TRANSFER:
  PipeHandle           = 82300ef4 [endpoint 0x00000081]
  TransferFlags        = 00000003 (USBD_TRANSFER_DIRECTION_IN, USBD_SHORT_TRANSFER_OK)
  TransferBufferLength = 00000100
  TransferBuffer       = 00000000
  TransferBufferMDL    = 81ac92e0
  UrbLink              = 00000000
[629564 ms] UsbSnoop - MyInternalIOCTLCompletion(f8917db0) : fido=81b964f0, Irp=81ab2e48, Context=81c3bfe8, IRQL=2
[629564 ms]  <<<  URB 929 coming back  <<< 
-- URB_FUNCTION_BULK_OR_INTERRUPT_TRANSFER:
  PipeHandle           = 82300ef4 [endpoint 0x00000081]
  TransferFlags        = 00000003 (USBD_TRANSFER_DIRECTION_IN, USBD_SHORT_TRANSFER_OK)
  TransferBufferLength = 00000100
  TransferBuffer       = 00000000
  TransferBufferMDL    = 81ac92e0
    00000000: ff fc ff ff f1 ff fe ff ff fc ff ff f9 cf fe ff
    00000010: ff fc ff ff fc e6 6f ff ff fc ff ff fe 7e 7e ff
    00000020: ff fc ff ff ff 1f 7f ff ff fc ff ff ff 87 ff ff
    00000030: ff fc ff ff ff c1 ff ff ff fc ff ff ff e0 ff ff
    00000040: ff fc ff ff ff e0 00 7f ff fc ff ff ff f0 00 7f
    00000050: ff fc ff ff ff f8 00 7f ff fc ff ff ff f8 00 7f
    00000060: ff fc ff ff ff fc 00 ff ff fc ff ff ff fe 00 ff
    00000070: ff fc ff ff ff fe 00 ff ff fc ff ff ff ff 00 ff
    00000080: ff fc df 02 55 00 4a 00 3b 00 00 17 ff f3 9b ef
    00000090: 40 00 00 8e 00 1b ad e1 20 04 92 f0 00 0e 7f cd
    000000a0: 20 30 01 00 00 03 f3 f7 80 00 83 00 00 01 9f e3
    000000b0: 80 0c 6e 00 00 00 7b df 60 23 88 00 00 00 3f f6
    000000c0: a0 6b 98 00 00 00 1b f6 e0 4c db 00 00 00 0e ff
    000000d0: c0 10 d4 00 00 00 07 f7 20 13 65 c0 00 00 03 ff
    000000e0: e0 82 79 f8 00 00 01 ef c0 08 eb 00 00 00 00 fc
    000000f0: e0 22 d3 80 00 00 00 fd e0 79 a3 00 00 00 00 7f
  UrbLink              = 00000000
[629592 ms] UsbSnoop - DispatchAny(f8916610) : IRP_MJ_INTERNAL_DEVICE_CONTROL
[629592 ms] UsbSnoop - MyDispatchInternalIOCTL(f8917e80) : fdo=822eee08, Irp=81ab2e48, IRQL=2
[629592 ms]  >>>  URB 930 going down  >>> 
-- URB_FUNCTION_BULK_OR_INTERRUPT_TRANSFER:
  PipeHandle           = 82300ef4 [endpoint 0x00000081]
  TransferFlags        = 00000003 (USBD_TRANSFER_DIRECTION_IN, USBD_SHORT_TRANSFER_OK)
  TransferBufferLength = 00000100
  TransferBuffer       = 00000000
  TransferBufferMDL    = 81ac92e0
  UrbLink              = 00000000
[629594 ms] UsbSnoop - MyInternalIOCTLCompletion(f8917db0) : fido=81b964f0, Irp=81ab2e48, Context=822f3898, IRQL=2
[629594 ms]  <<<  URB 930 coming back  <<< 
-- URB_FUNCTION_BULK_OR_INTERRUPT_TRANSFER:
  PipeHandle           = 82300ef4 [endpoint 0x00000081]
  TransferFlags        = 00000003 (USBD_TRANSFER_DIRECTION_IN, USBD_SHORT_TRANSFER_OK)
  TransferBufferLength = 00000100
  TransferBuffer       = 00000000
  TransferBufferMDL    = 81ac92e0
    00000000: e0 0b a3 00 00 00 01 37 e0 87 e3 80 00 00 00 fd
    00000010: c0 5b c3 40 00 00 00 df c0 2f d7 00 00 00 00 df
    00000020: e0 36 16 00 80 00 00 7f 00 5b a7 00 00 00 00 9f
    00000030: c0 cf 27 c0 00 00 00 9f a0 67 6e e0 00 00 00 17
    00000040: e0 4a 4c 52 81 e0 00 7b c0 0b 8b 0c bf 90 40 43
    00000050: e0 08 69 fe fe 18 60 d0 e0 cc 6e 1f 78 0c 60 ac
    00000060: e0 04 ee 0e 3f f4 20 15 20 80 ef fc 3d f8 22 09
    00000070: 20 12 7f ec 06 00 02 1a e0 16 3f 04 18 00 04 3b
    00000080: 20 1a 9d bc 0e 00 3d f6 a0 19 ac e8 07 00 0f e7
    00000090: c0 dd 2c 48 00 00 87 6f 80 6c 6e 18 20 21 17 cb
    000000a0: e0 36 a6 18 30 07 05 4c 80 28 86 38 18 04 26 4d
    000000b0: 80 13 26 3f e8 00 00 d2 c0 b0 87 3f e4 00 88 c2
    000000c0: 40 00 57 7f e6 00 07 93 20 eb 27 ff 03 01 07 5d
    000000d0: 00 b1 67 ff 01 80 27 68 60 39 a7 fd 08 80 26 b2
    000000e0: c0 89 b7 ff fe 62 65 ec 00 bc 97 fb 0f 20 7d e0
    000000f0: 00 50 c3 f8 27 00 f9 4c c0 53 83 ff e9 a0 f2 c4
  UrbLink              = 00000000
[629622 ms] UsbSnoop - DispatchAny(f8916610) : IRP_MJ_INTERNAL_DEVICE_CONTROL
[629622 ms] UsbSnoop - MyDispatchInternalIOCTL(f8917e80) : fdo=822eee08, Irp=81ab2e48, IRQL=2
[629622 ms]  >>>  URB 931 going down  >>> 
-- URB_FUNCTION_BULK_OR_INTERRUPT_TRANSFER:
  PipeHandle           = 82300ef4 [endpoint 0x00000081]
  TransferFlags        = 00000003 (USBD_TRANSFER_DIRECTION_IN, USBD_SHORT_TRANSFER_OK)
  TransferBufferLength = 00000100
  TransferBuffer       = 00000000
  TransferBufferMDL    = 81ac92e0
  UrbLink              = 00000000
[629624 ms] UsbSnoop - MyInternalIOCTLCompletion(f8917db0) : fido=81b964f0, Irp=81ab2e48, Context=81cb4e48, IRQL=2
[629624 ms]  <<<  URB 931 coming back  <<< 
-- URB_FUNCTION_BULK_OR_INTERRUPT_TRANSFER:
  PipeHandle           = 82300ef4 [endpoint 0x00000081]
  TransferFlags        = 00000003 (USBD_TRANSFER_DIRECTION_IN, USBD_SHORT_TRANSFER_OK)
  TransferBufferLength = 000000ff
  TransferBuffer       = 00000000
  TransferBufferMDL    = 81ac92e0
    00000000: 00 63 43 ff 80 80 f6 68 00 92 13 f8 00 03 c7 50
    00000010: 80 9a 03 f8 00 49 8f 08 00 21 13 f8 00 27 0f a0
    00000020: 00 08 0b ff 00 24 1f 90 00 90 29 ff f3 ec 1f d2
    00000030: 40 00 09 ff ff fc 3f e9 80 80 c6 ff 7f b0 7f f2
    00000040: 80 0d 06 7f fc a0 ff f8 40 00 3f bf e8 43 ff fe
    00000050: 20 03 ff df 93 cf ff ff 80 3f ff ff df 9f ff ff
    00000060: c0 ff ff ff ff ff ff ff e0 ff ff ff ff ff ff ff
    00000070: e0 ff ff ff ff ff ff ff e0 ff ff ff ff ff ff ff
    00000080: e0 ff ff ff ff ff ff ff e0 ff ff ff ff ff ff ff
    00000090: e0 ff ff ff ff ff ff ff e0 ff ff ff ff ff ff ff
    000000a0: e0 ff ff 3f ff ff ff ff e0 ff fe 7f ff ff ff ff
    000000b0: e0 ff fe ff ff ff ff ff e0 ff ff ff ff ff ff ff
    000000c0: e0 ff ff f9 ff ff ff ff e0 ff ff e0 03 ff ff ff
    000000d0: e0 ff ff 80 01 ff ff ff e0 df 07 44 e9 12 e4 00
    000000e0: e8 00 e8 04 e4 00 e8 03 e4 00 e8 01 e4 00 e8 02
    000000f0: e4 00 e8 e5 7c e4 00 e8 e5 00 48 6f 6d 65 00
  UrbLink              = 00000000
[629652 ms] UsbSnoop - DispatchAny(f8916610) : IRP_MJ_INTERNAL_DEVICE_CONTROL
[629652 ms] UsbSnoop - MyDispatchInternalIOCTL(f8917e80) : fdo=822eee08, Irp=81ab2e48, IRQL=2
[629652 ms]  >>>  URB 932 going down  >>> 
-- URB_FUNCTION_BULK_OR_INTERRUPT_TRANSFER:
  PipeHandle           = 82300f14 [endpoint 0x00000002]
  TransferFlags        = 00000000 (USBD_TRANSFER_DIRECTION_OUT, ~USBD_SHORT_TRANSFER_OK)
  TransferBufferLength = 00000007
  TransferBuffer       = 00000000
  TransferBufferMDL    = 81ac92e0
    00000000: 00 00 00 02 05 e0 00
  UrbLink              = 00000000
[629653 ms] UsbSnoop - MyInternalIOCTLCompletion(f8917db0) : fido=81b964f0, Irp=81ab2e48, Context=81c3bfe8, IRQL=2
[629653 ms]  <<<  URB 932 coming back  <<< 
-- URB_FUNCTION_BULK_OR_INTERRUPT_TRANSFER:
  PipeHandle           = 82300f14 [endpoint 0x00000002]
  TransferFlags        = 00000000 (USBD_TRANSFER_DIRECTION_OUT, ~USBD_SHORT_TRANSFER_OK)
  TransferBufferLength = 00000007
  TransferBuffer       = 00000000
  TransferBufferMDL    = 81ac92e0
  UrbLink              = 00000000
[629662 ms] UsbSnoop - DispatchAny(f8916610) : IRP_MJ_INTERNAL_DEVICE_CONTROL
[629662 ms] UsbSnoop - MyDispatchInternalIOCTL(f8917e80) : fdo=822eee08, Irp=81ab2e48, IRQL=2
[629662 ms]  >>>  URB 933 going down  >>> 
-- URB_FUNCTION_BULK_OR_INTERRUPT_TRANSFER:
  PipeHandle           = 82300ef4 [endpoint 0x00000081]
  TransferFlags        = 00000003 (USBD_TRANSFER_DIRECTION_IN, USBD_SHORT_TRANSFER_OK)
  TransferBufferLength = 00000100
  TransferBuffer       = 00000000
  TransferBufferMDL    = 81ac92e0
  UrbLink              = 00000000
[629663 ms] UsbSnoop - MyInternalIOCTLCompletion(f8917db0) : fido=81b964f0, Irp=81ab2e48, Context=822f3898, IRQL=2
[629663 ms]  <<<  URB 933 coming back  <<< 
-- URB_FUNCTION_BULK_OR_INTERRUPT_TRANSFER:
  PipeHandle           = 82300ef4 [endpoint 0x00000081]
  TransferFlags        = 00000003 (USBD_TRANSFER_DIRECTION_IN, USBD_SHORT_TRANSFER_OK)
  TransferBufferLength = 00000005
  TransferBuffer       = 00000000
  TransferBufferMDL    = 81ac92e0
    00000000: 00 00 03 ff 03
  UrbLink              = 00000000
[629692 ms] UsbSnoop - DispatchAny(f8916610) : IRP_MJ_INTERNAL_DEVICE_CONTROL
[629692 ms] UsbSnoop - MyDispatchInternalIOCTL(f8917e80) : fdo=822eee08, Irp=81ab2e48, IRQL=2
[629692 ms]  >>>  URB 934 going down  >>> 
-- URB_FUNCTION_BULK_OR_INTERRUPT_TRANSFER:
  PipeHandle           = 82300ef4 [endpoint 0x00000081]
  TransferFlags        = 00000003 (USBD_TRANSFER_DIRECTION_IN, USBD_SHORT_TRANSFER_OK)
  TransferBufferLength = 00000100
  TransferBuffer       = 00000000
  TransferBufferMDL    = 81ac92e0
  UrbLink              = 00000000
[629694 ms] UsbSnoop - MyInternalIOCTLCompletion(f8917db0) : fido=81b964f0, Irp=81ab2e48, Context=81c3bfe8, IRQL=2
[629694 ms]  <<<  URB 934 coming back  <<< 
-- URB_FUNCTION_BULK_OR_INTERRUPT_TRANSFER:
  PipeHandle           = 82300ef4 [endpoint 0x00000081]
  TransferFlags        = 00000003 (USBD_TRANSFER_DIRECTION_IN, USBD_SHORT_TRANSFER_OK)
  TransferBufferLength = 00000100
  TransferBuffer       = 00000000
  TransferBufferMDL    = 81ac92e0
    00000000: 2d 00 53 70 6c 69 74 20 31 20 41 70 70 00 2d 11
    00000010: e3 00 e8 00 e8 00 65 78 69 74 6c 6f 6f 70 00 30
    00000020: e4 00 e8 00 e8 00 20 61 6e 64 20 63 6c 65 61 72
    00000030: 20 65 76 65 72 79 74 68 69 6e 67 2e 00 00 e6 00
    00000040: e8 00 20 41 74 20 65 78 69 74 2c 20 72 65 73 74
    00000050: 6f 72 65 20 73 65 74 74 69 6e 67 73 2c 20 67 6f
    00000060: 74 6f 20 66 75 6c 6c 20 73 63 72 65 65 6e 00 00
    00000070: e6 00 e8 00 e8 a2 02 11 e4 00 e8 00 e8 00 e8 10
    00000080: e4 00 e8 00 74 6f 70 64 69 73 70 00 2f e4 02 e8
    00000090: 00 63 6f 64 65 00 f0 00 63 70 00 f0 80 02 e8 10
    000000a0: e4 02 e8 00 63 6f 64 65 00 f0 0a 01 1f 91 4f 00
    000000b0: 63 6f 64 65 00 f0 80 04 e8 2b 01 1f 00 63 6f 64
    000000c0: 65 00 f0 89 3b e4 02 e8 0a 01 1f 13 f0 89 00 1f
    000000d0: 00 63 6f 64 65 00 f0 89 84 3b e4 00 e8 00 e8 10
    000000e0: e4 00 e8 00 e8 10 e4 02 e8 00 63 6f 64 65 00 f0
    000000f0: 0a 01 1f 91 4f 00 63 6f 64 65 00 f0 80 04 e8 2b
  UrbLink              = 00000000
[629723 ms] UsbSnoop - DispatchAny(f8916610) : IRP_MJ_INTERNAL_DEVICE_CONTROL
[629723 ms] UsbSnoop - MyDispatchInternalIOCTL(f8917e80) : fdo=822eee08, Irp=81ab2e48, IRQL=2
[629723 ms]  >>>  URB 935 going down  >>> 
-- URB_FUNCTION_BULK_OR_INTERRUPT_TRANSFER:
  PipeHandle           = 82300ef4 [endpoint 0x00000081]
  TransferFlags        = 00000003 (USBD_TRANSFER_DIRECTION_IN, USBD_SHORT_TRANSFER_OK)
  TransferBufferLength = 00000100
  TransferBuffer       = 00000000
  TransferBufferMDL    = 81ac92e0
  UrbLink              = 00000000
[629725 ms] UsbSnoop - MyInternalIOCTLCompletion(f8917db0) : fido=81b964f0, Irp=81ab2e48, Context=81b4ccc0, IRQL=2
[629725 ms]  <<<  URB 935 coming back  <<< 
-- URB_FUNCTION_BULK_OR_INTERRUPT_TRANSFER:
  PipeHandle           = 82300ef4 [endpoint 0x00000081]
  TransferFlags        = 00000003 (USBD_TRANSFER_DIRECTION_IN, USBD_SHORT_TRANSFER_OK)
  TransferBufferLength = 00000100
  TransferBuffer       = 00000000
  TransferBufferMDL    = 81ac92e0
    00000000: 01 1f 00 63 6f 64 65 00 f0 89 3b e4 02 e8 00 1f
    00000010: 13 f0 80 02 e8 00 63 6f 64 65 00 f0 15 f0 8b 00
    00000020: 63 6f 64 65 00 f0 80 02 e8 00 63 6f 64 65 00 f0
    00000030: 0a 01 1f 8f 00 63 6f 64 65 00 f0 80 02 e8 15 f0
    00000040: 30 01 1f 8d 15 f0 80 02 e8 3a 01 1f 15 f0 85 2f
    00000050: 01 1f 15 f0 89 84 39 e4 00 e8 00 e8 00 74 6f 70
    00000060: 64 69 73 70 00 2f e4 02 e8 01 01 1f 00 63 70 00
    00000070: f0 80 02 e8 07 01 02 1f 15 f0 87 39 e4 00 e8 00
    00000080: 20 43 4c 45 41 52 2e 2e 2e 20 47 6f 74 6f 20 31
    00000090: 73 74 20 50 72 65 73 69 64 65 6e 74 00 00 e6 00
    000000a0: e8 00 e8 00 74 6f 70 64 69 73 70 00 2f e4 02 e8
    000000b0: 10 e4 02 e8 2b 01 1f 00 63 70 00 f0 80 04 e8 01
    000000c0: 01 1f 00 63 70 00 f0 85 3b e4 02 e8 00 63 70 00
    000000d0: f0 01 01 1f 8d 00 63 70 00 f0 80 02 e8 51 01 02
    000000e0: 1f 15 f0 87 01 01 02 1f 15 f0 87 83 39 e4 00 e8
    000000f0: 00 20 42 53 20 6f 72 20 4c 45 46 54 20 41 72 72
  UrbLink              = 00000000
[629753 ms] UsbSnoop - DispatchAny(f8916610) : IRP_MJ_INTERNAL_DEVICE_CONTROL
[629753 ms] UsbSnoop - MyDispatchInternalIOCTL(f8917e80) : fdo=822eee08, Irp=81ab2e48, IRQL=2
[629753 ms]  >>>  URB 936 going down  >>> 
-- URB_FUNCTION_BULK_OR_INTERRUPT_TRANSFER:
  PipeHandle           = 82300ef4 [endpoint 0x00000081]
  TransferFlags        = 00000003 (USBD_TRANSFER_DIRECTION_IN, USBD_SHORT_TRANSFER_OK)
  TransferBufferLength = 00000100
  TransferBuffer       = 00000000
  TransferBufferMDL    = 81ac92e0
  UrbLink              = 00000000
[629754 ms] UsbSnoop - MyInternalIOCTLCompletion(f8917db0) : fido=81b964f0, Irp=81ab2e48, Context=81abee68, IRQL=2
[629754 ms]  <<<  URB 936 coming back  <<< 
-- URB_FUNCTION_BULK_OR_INTERRUPT_TRANSFER:
  PipeHandle           = 82300ef4 [endpoint 0x00000081]
  TransferFlags        = 00000003 (USBD_TRANSFER_DIRECTION_IN, USBD_SHORT_TRANSFER_OK)
  TransferBufferLength = 00000100
  TransferBuffer       = 00000000
  TransferBufferMDL    = 81ac92e0
    00000000: 6f 77 2e 2e 2e 20 70 72 65 76 69 6f 75 73 20 50
    00000010: 72 65 73 69 64 65 6e 74 00 00 e6 00 e8 00 e8 00
    00000020: 65 78 69 74 6c 6f 6f 70 00 2f e4 02 e8 08 11 02
    00000030: 1f 15 f0 87 08 01 02 1f 15 f0 87 51 01 1f 15 f0
    00000040: 87 71 01 1f 15 f0 87 83 83 83 39 e4 00 e8 00 20
    00000050: 45 53 43 2c 20 51 55 49 54 2c 20 51 2c 20 71 2e
    00000060: 2e 2e 20 45 78 69 74 20 70 72 6f 67 72 61 6d 00
    00000070: 00 e6 00 e8 00 e8 00 74 6f 70 64 69 73 70 00 2f
    00000080: e4 02 e8 10 e4 02 e8 01 01 1f 00 63 70 00 f0 80
    00000090: 04 e8 2b 01 1f 00 63 70 00 f0 89 3b e4 02 e8 00
    000000a0: 63 70 00 f0 01 01 1f 8b 00 63 70 00 f0 80 02 e8
    000000b0: 54 01 02 1f 15 f0 87 02 01 02 1f 15 f0 87 0d 01
    000000c0: 1f 15 f0 87 83 83 3b e4 00 e8 00 20 45 4e 54 45
    000000d0: 52 20 6f 72 20 6f 72 20 53 54 4f 3e 20 6f 72 20
    000000e0: 52 49 47 48 54 20 41 72 72 6f 77 2e 2e 2e 20 6e
    000000f0: 65 78 74 20 50 72 65 73 69 64 65 6e 74 00 00 e6
  UrbLink              = 00000000
[629783 ms] UsbSnoop - DispatchAny(f8916610) : IRP_MJ_INTERNAL_DEVICE_CONTROL
[629783 ms] UsbSnoop - MyDispatchInternalIOCTL(f8917e80) : fdo=822eee08, Irp=81ab2e48, IRQL=2
[629783 ms]  >>>  URB 937 going down  >>> 
-- URB_FUNCTION_BULK_OR_INTERRUPT_TRANSFER:
  PipeHandle           = 82300ef4 [endpoint 0x00000081]
  TransferFlags        = 00000003 (USBD_TRANSFER_DIRECTION_IN, USBD_SHORT_TRANSFER_OK)
  TransferBufferLength = 00000100
  TransferBuffer       = 00000000
  TransferBufferMDL    = 81b65b08
  UrbLink              = 00000000
[629785 ms] UsbSnoop - MyInternalIOCTLCompletion(f8917db0) : fido=81b964f0, Irp=81ab2e48, Context=81c3bfe8, IRQL=2
[629785 ms]  <<<  URB 937 coming back  <<< 
-- URB_FUNCTION_BULK_OR_INTERRUPT_TRANSFER:
  PipeHandle           = 82300ef4 [endpoint 0x00000081]
  TransferFlags        = 00000003 (USBD_TRANSFER_DIRECTION_IN, USBD_SHORT_TRANSFER_OK)
  TransferBufferLength = 000000ff
  TransferBuffer       = 00000000
  TransferBufferMDL    = 81b65b08
    00000000: 00 e8 01 01 1f 13 f0 8b 13 f0 80 00 e8 e5 02 e3
    00000010: 15 f0 80 00 e8 00 e8 18 e4 00 e8 00 1f 00 63 6f
    00000020: 64 65 00 f0 80 00 e8 00 1f 13 f0 80 00 e8 00 1f
    00000030: 15 f0 80 00 e8 00 20 6e 6f 77 2c 20 68 61 6e 64
    00000040: 6c 65 20 63 6f 6d 6d 61 6e 64 2f 63 6f 6e 74 72
    00000050: 6f 6c 20 6b 65 79 73 00 00 e6 00 e8 00 e8 48 01
    00000060: 1f 19 f0 38 01 1f 8b e5 07 01 1f e5 00 63 70 00
    00000070: f0 00 70 6f 74 75 73 5c 70 72 64 62 00 d5 d5 4f
    00000080: e4 00 e8 44 01 1f 19 f0 30 01 1f 8b 00 50 61 72
    00000090: 74 79 3a 00 2d 4f e4 00 e8 48 01 1f 19 f0 24 01
    000000a0: 1f 8b 00 54 6f 3a 00 2d e5 05 01 1f e5 00 63 70
    000000b0: 00 f0 00 70 6f 74 75 73 5c 70 72 64 62 00 d5 d5
    000000c0: 14 e3 4f e4 00 e8 48 01 1f 19 f0 1c 01 1f 8b 00
    000000d0: 46 72 3a 00 2d e5 04 01 1f e5 00 63 70 00 f0 00
    000000e0: 70 6f 74 75 73 5c 70 72 64 62 00 d5 d5 14 e3 4f
    000000f0: e4 00 e8 44 01 1f 19 f0 14 01 1f 8b 00 54 65
  UrbLink              = 00000000
[629813 ms] UsbSnoop - DispatchAny(f8916610) : IRP_MJ_INTERNAL_DEVICE_CONTROL
[629813 ms] UsbSnoop - MyDispatchInternalIOCTL(f8917e80) : fdo=822eee08, Irp=81ab2e48, IRQL=2
[629813 ms]  >>>  URB 938 going down  >>> 
-- URB_FUNCTION_BULK_OR_INTERRUPT_TRANSFER:
  PipeHandle           = 82300f14 [endpoint 0x00000002]
  TransferFlags        = 00000000 (USBD_TRANSFER_DIRECTION_OUT, ~USBD_SHORT_TRANSFER_OK)
  TransferBufferLength = 00000007
  TransferBuffer       = 00000000
  TransferBufferMDL    = 81b65b08
    00000000: 00 00 00 02 05 e0 00
  UrbLink              = 00000000
[629813 ms] UsbSnoop - MyInternalIOCTLCompletion(f8917db0) : fido=81b964f0, Irp=81ab2e48, Context=81b4ccc0, IRQL=2
[629813 ms]  <<<  URB 938 coming back  <<< 
-- URB_FUNCTION_BULK_OR_INTERRUPT_TRANSFER:
  PipeHandle           = 82300f14 [endpoint 0x00000002]
  TransferFlags        = 00000000 (USBD_TRANSFER_DIRECTION_OUT, ~USBD_SHORT_TRANSFER_OK)
  TransferBufferLength = 00000007
  TransferBuffer       = 00000000
  TransferBufferMDL    = 81b65b08
  UrbLink              = 00000000
[629823 ms] UsbSnoop - DispatchAny(f8916610) : IRP_MJ_INTERNAL_DEVICE_CONTROL
[629823 ms] UsbSnoop - MyDispatchInternalIOCTL(f8917e80) : fdo=822eee08, Irp=81ab2e48, IRQL=2
[629823 ms]  >>>  URB 939 going down  >>> 
-- URB_FUNCTION_BULK_OR_INTERRUPT_TRANSFER:
  PipeHandle           = 82300ef4 [endpoint 0x00000081]
  TransferFlags        = 00000003 (USBD_TRANSFER_DIRECTION_IN, USBD_SHORT_TRANSFER_OK)
  TransferBufferLength = 00000100
  TransferBuffer       = 00000000
  TransferBufferMDL    = 81b65b08
  UrbLink              = 00000000
[629823 ms] UsbSnoop - MyInternalIOCTLCompletion(f8917db0) : fido=81b964f0, Irp=81ab2e48, Context=81c3bfe8, IRQL=2
[629823 ms]  <<<  URB 939 coming back  <<< 
-- URB_FUNCTION_BULK_OR_INTERRUPT_TRANSFER:
  PipeHandle           = 82300ef4 [endpoint 0x00000081]
  TransferFlags        = 00000003 (USBD_TRANSFER_DIRECTION_IN, USBD_SHORT_TRANSFER_OK)
  TransferBufferLength = 00000005
  TransferBuffer       = 00000000
  TransferBufferMDL    = 81b65b08
    00000000: 00 00 03 ff 03
  UrbLink              = 00000000
[629853 ms] UsbSnoop - DispatchAny(f8916610) : IRP_MJ_INTERNAL_DEVICE_CONTROL
[629853 ms] UsbSnoop - MyDispatchInternalIOCTL(f8917e80) : fdo=822eee08, Irp=81ab2e48, IRQL=2
[629853 ms]  >>>  URB 940 going down  >>> 
-- URB_FUNCTION_BULK_OR_INTERRUPT_TRANSFER:
  PipeHandle           = 82300ef4 [endpoint 0x00000081]
  TransferFlags        = 00000003 (USBD_TRANSFER_DIRECTION_IN, USBD_SHORT_TRANSFER_OK)
  TransferBufferLength = 00000100
  TransferBuffer       = 00000000
  TransferBufferMDL    = 81b65b08
  UrbLink              = 00000000
[629855 ms] UsbSnoop - MyInternalIOCTLCompletion(f8917db0) : fido=81b964f0, Irp=81ab2e48, Context=822f3898, IRQL=2
[629855 ms]  <<<  URB 940 coming back  <<< 
-- URB_FUNCTION_BULK_OR_INTERRUPT_TRANSFER:
  PipeHandle           = 82300ef4 [endpoint 0x00000081]
  TransferFlags        = 00000003 (USBD_TRANSFER_DIRECTION_IN, USBD_SHORT_TRANSFER_OK)
  TransferBufferLength = 00000100
  TransferBuffer       = 00000000
  TransferBufferMDL    = 81b65b08
    00000000: 72 6d 20 6f 66 20 4f 66 66 69 63 65 3a 00 2d 4f
    00000010: e4 00 e8 00 e8 10 e4 00 e8 44 01 1f 19 f0 08 01
    00000020: 1f 8b e5 02 01 1f e5 00 63 70 00 f0 00 70 6f 74
    00000030: 75 73 5c 70 72 64 62 00 d5 d5 4f e4 02 e8 19 f0
    00000040: 08 01 1f 8b 19 f0 80 02 e8 00 1f e5 02 01 1f e5
    00000050: 00 63 70 00 f0 00 70 6f 74 75 73 5c 70 72 64 62
    00000060: 00 d5 d5 6c 8a 3b e4 00 e8 44 01 1f 19 f0 08 01
    00000070: 1f 8b e5 01 01 1f e5 00 63 70 00 f0 00 70 6f 74
    00000080: 75 73 5c 70 72 64 62 00 d5 d5 4f e4 00 e8 44 01
    00000090: 1f 19 f0 e5 03 01 1f e5 00 63 70 00 f0 00 70 6f
    000000a0: 74 75 73 5c 70 72 64 62 00 d5 d5 00 20 50 72 65
    000000b0: 73 69 64 65 6e 74 00 2d 14 e3 4f e4 00 e8 02 01
    000000c0: 1f 19 f0 80 00 e8 00 20 66 72 6f 6d 20 6f 75 72
    000000d0: 20 64 61 74 61 62 61 73 65 00 00 e6 00 e8 00 20
    000000e0: 6e 6f 77 2c 20 64 69 73 70 6c 61 79 20 69 6e 66
    000000f0: 6f 20 61 62 6f 75 74 20 74 68 69 73 20 50 72 65
  UrbLink              = 00000000
[629883 ms] UsbSnoop - DispatchAny(f8916610) : IRP_MJ_INTERNAL_DEVICE_CONTROL
[629883 ms] UsbSnoop - MyDispatchInternalIOCTL(f8917e80) : fdo=822eee08, Irp=81ab2e48, IRQL=2
[629883 ms]  >>>  URB 941 going down  >>> 
-- URB_FUNCTION_BULK_OR_INTERRUPT_TRANSFER:
  PipeHandle           = 82300ef4 [endpoint 0x00000081]
  TransferFlags        = 00000003 (USBD_TRANSFER_DIRECTION_IN, USBD_SHORT_TRANSFER_OK)
  TransferBufferLength = 00000100
  TransferBuffer       = 00000000
  TransferBufferMDL    = 81b65b08
  UrbLink              = 00000000
[629885 ms] UsbSnoop - MyInternalIOCTLCompletion(f8917db0) : fido=81b964f0, Irp=81ab2e48, Context=81cb4e48, IRQL=2
[629885 ms]  <<<  URB 941 coming back  <<< 
-- URB_FUNCTION_BULK_OR_INTERRUPT_TRANSFER:
  PipeHandle           = 82300ef4 [endpoint 0x00000081]
  TransferFlags        = 00000003 (USBD_TRANSFER_DIRECTION_IN, USBD_SHORT_TRANSFER_OK)
  TransferBufferLength = 00000100
  TransferBuffer       = 00000000
  TransferBufferMDL    = 81b65b08
    00000000: 73 69 64 65 6e 74 00 00 e6 00 e8 00 e8 e5 00 1f
    00000010: 00 1f 00 70 6f 74 75 73 5c 00 2d e5 06 01 1f e5
    00000020: 00 63 70 00 f0 00 70 6f 74 75 73 5c 70 72 64 62
    00000030: 00 d5 d5 14 e3 01 e3 5f e4 00 e8 00 20 67 65 74
    00000040: 20 70 69 63 74 75 72 65 20 6f 66 20 63 75 72 72
    00000050: 65 6e 74 20 73 65 6c 65 63 74 65 64 20 50 72 65
    00000060: 73 69 64 65 6e 74 00 00 e6 00 e8 01 e4 00 e7 02
    00000070: e4 00 e8 00 e8 00 74 6f 70 64 69 73 70 00 30 e4
    00000080: 00 e8 00 20 54 6f 70 20 6f 66 20 64 69 73 70 6c
    00000090: 61 79 20 6c 6f 6f 70 20 66 6f 72 20 65 61 63 68
    000000a0: 00 00 e6 00 e8 00 e8 01 01 1f 00 63 70 00 f0 80
    000000b0: 00 e8 00 20 49 6e 69 74 69 61 6c 69 7a 65 20 76
    000000c0: 61 72 69 61 62 6c 65 73 00 00 e6 00 e8 00 e8 00
    000000d0: 4f 66 66 00 2d 00 41 78 65 73 00 2d 0f e3 00 e8
    000000e0: e5 7b e4 00 e8 00 20 54 75 72 6e 20 6f 66 66 20
    000000f0: 66 75 6e 63 74 69 6f 6e 73 20 61 6e 64 20 73 65
  UrbLink              = 00000000
[629913 ms] UsbSnoop - DispatchAny(f8916610) : IRP_MJ_INTERNAL_DEVICE_CONTROL
[629913 ms] UsbSnoop - MyDispatchInternalIOCTL(f8917e80) : fdo=822eee08, Irp=81ab2e48, IRQL=2
[629913 ms]  >>>  URB 942 going down  >>> 
-- URB_FUNCTION_BULK_OR_INTERRUPT_TRANSFER:
  PipeHandle           = 82300ef4 [endpoint 0x00000081]
  TransferFlags        = 00000003 (USBD_TRANSFER_DIRECTION_IN, USBD_SHORT_TRANSFER_OK)
  TransferBufferLength = 00000100
  TransferBuffer       = 00000000
  TransferBufferMDL    = 81b65b08
  UrbLink              = 00000000
[629915 ms] UsbSnoop - MyInternalIOCTLCompletion(f8917db0) : fido=81b964f0, Irp=81ab2e48, Context=81c3bfe8, IRQL=2
[629915 ms]  <<<  URB 942 coming back  <<< 
-- URB_FUNCTION_BULK_OR_INTERRUPT_TRANSFER:
  PipeHandle           = 82300ef4 [endpoint 0x00000081]
  TransferFlags        = 00000003 (USBD_TRANSFER_DIRECTION_IN, USBD_SHORT_TRANSFER_OK)
  TransferBufferLength = 00000100
  TransferBuffer       = 00000000
  TransferBufferMDL    = 81b65b08
    00000000: 74 75 70 20 73 63 72 65 65 6e 00 00 e6 00 e8 00
    00000010: e8 e5 00 63 6f 64 65 00 13 19 15 00 63 70 00 7d
    00000020: e4 00 e8 00 20 64 65 66 69 6e 65 20 6c 6f 63 61
    00000030: 6c 20 76 61 72 69 61 62 6c 65 73 20 75 73 65 64
    00000040: 20 62 79 20 70 72 6f 67 72 61 6d 00 00 e6 00 e8
    00000050: 00 e8 00 3d 3d 3d 3d 3d 3d 3d 3d 3d 3d 3d 3d 3d
    00000060: 3d 3d 3d 3d 3d 3d 3d 3d 3d 3d 3d 3d 3d 3d 3d 3d
    00000070: 3d 3d 3d 00 00 e6 00 e8 00 20 44 61 74 65 3a 20
    00000080: 30 32 20 4e 6f 76 65 6d 62 65 72 20 32 30 30 30
    00000090: 00 00 e6 00 e8 00 20 52 65 76 69 73 69 6f 6e 3a
    000000a0: 20 31 2e 31 00 00 e6 00 e8 00 20 a9 31 39 39 39
    000000b0: 2d 32 30 30 30 20 62 79 20 53 74 65 70 68 65 6e
    000000c0: 20 4c 2e 20 52 65 69 64 00 00 e6 00 e8 00 20 50
    000000d0: 72 65 73 69 64 65 6e 74 73 20 4f 66 20 54 68 65
    000000e0: 20 55 6e 69 74 65 64 20 53 74 61 74 65 73 00 00
    000000f0: e6 00 e8 00 3d 3d 3d 3d 3d 3d 3d 3d 3d 3d 3d 3d
  UrbLink              = 00000000
[629943 ms] UsbSnoop - DispatchAny(f8916610) : IRP_MJ_INTERNAL_DEVICE_CONTROL
[629943 ms] UsbSnoop - MyDispatchInternalIOCTL(f8917e80) : fdo=822eee08, Irp=81ab2e48, IRQL=2
[629943 ms]  >>>  URB 943 going down  >>> 
-- URB_FUNCTION_BULK_OR_INTERRUPT_TRANSFER:
  PipeHandle           = 82300ef4 [endpoint 0x00000081]
  TransferFlags        = 00000003 (USBD_TRANSFER_DIRECTION_IN, USBD_SHORT_TRANSFER_OK)
  TransferBufferLength = 00000100
  TransferBuffer       = 00000000
  TransferBufferMDL    = 81b65b08
  UrbLink              = 00000000
[629945 ms] UsbSnoop - MyInternalIOCTLCompletion(f8917db0) : fido=81b964f0, Irp=81ab2e48, Context=822f3898, IRQL=2
[629945 ms]  <<<  URB 943 coming back  <<< 
-- URB_FUNCTION_BULK_OR_INTERRUPT_TRANSFER:
  PipeHandle           = 82300ef4 [endpoint 0x00000081]
  TransferFlags        = 00000003 (USBD_TRANSFER_DIRECTION_IN, USBD_SHORT_TRANSFER_OK)
  TransferBufferLength = 000000ff
  TransferBuffer       = 00000000
  TransferBufferMDL    = 81b65b08
    00000000: 3d 3d 3d 3d 3d 3d 3d 3d 3d 3d 3d 3d 3d 3d 3d 3d
    00000010: 3d 3d 3d 3d 00 00 e6 00 e8 00 e8 19 e4 e5 00 01
    00000020: 00 dc 0d 81 04 2b 01 00 4d e5 00 46 65 64 65 72
    00000030: 61 6c 69 73 74 00 2d 00 67 77 30 31 00 2d 00 4d
    00000040: 61 72 20 33 2c 31 37 39 37 00 2d 00 41 70 72 20
    00000050: 33 30 2c 31 37 38 39 00 2d 00 31 73 74 00 2d 00
    00000060: 57 61 73 68 69 6e 67 74 6f 6e 00 2d 00 47 65 6f
    00000070: 72 67 65 00 2d d9 02 00 46 e5 00 46 65 64 65 72
    00000080: 61 6c 69 73 74 00 2d 00 6a 61 30 32 00 2d 00 4d
    00000090: 61 72 20 33 2c 31 38 30 31 00 2d 00 4d 61 72 20
    000000a0: 34 2c 31 37 39 37 00 2d 00 32 6e 64 00 2d 00 00
    000000b0: 2d 00 4a 6f 68 6e 20 41 64 61 6d 73 00 2d d9 03
    000000c0: 00 4d e5 00 44 65 6d 6f 2e 2d 52 65 70 75 62 2e
    000000d0: 00 2d 00 74 6a 30 33 00 2d 00 4d 61 72 20 33 2c
    000000e0: 31 38 30 39 00 2d 00 4d 61 72 20 34 2c 31 38 30
    000000f0: 31 00 2d 00 33 72 64 00 2d 00 4a 65 66 66 65
  UrbLink              = 00000000
[629973 ms] UsbSnoop - DispatchAny(f8916610) : IRP_MJ_INTERNAL_DEVICE_CONTROL
[629973 ms] UsbSnoop - MyDispatchInternalIOCTL(f8917e80) : fdo=822eee08, Irp=81ab2e48, IRQL=2
[629973 ms]  >>>  URB 944 going down  >>> 
-- URB_FUNCTION_BULK_OR_INTERRUPT_TRANSFER:
  PipeHandle           = 82300f14 [endpoint 0x00000002]
  TransferFlags        = 00000000 (USBD_TRANSFER_DIRECTION_OUT, ~USBD_SHORT_TRANSFER_OK)
  TransferBufferLength = 00000007
  TransferBuffer       = 00000000
  TransferBufferMDL    = 81b65b08
    00000000: 00 00 00 02 05 e0 00
  UrbLink              = 00000000
[629973 ms] UsbSnoop - MyInternalIOCTLCompletion(f8917db0) : fido=81b964f0, Irp=81ab2e48, Context=81cb4e48, IRQL=2
[629973 ms]  <<<  URB 944 coming back  <<< 
-- URB_FUNCTION_BULK_OR_INTERRUPT_TRANSFER:
  PipeHandle           = 82300f14 [endpoint 0x00000002]
  TransferFlags        = 00000000 (USBD_TRANSFER_DIRECTION_OUT, ~USBD_SHORT_TRANSFER_OK)
  TransferBufferLength = 00000007
  TransferBuffer       = 00000000
  TransferBufferMDL    = 81b65b08
  UrbLink              = 00000000
[629983 ms] UsbSnoop - DispatchAny(f8916610) : IRP_MJ_INTERNAL_DEVICE_CONTROL
[629983 ms] UsbSnoop - MyDispatchInternalIOCTL(f8917e80) : fdo=822eee08, Irp=81c2c5d8, IRQL=2
[629983 ms]  >>>  URB 945 going down  >>> 
-- URB_FUNCTION_BULK_OR_INTERRUPT_TRANSFER:
  PipeHandle           = 82300ef4 [endpoint 0x00000081]
  TransferFlags        = 00000003 (USBD_TRANSFER_DIRECTION_IN, USBD_SHORT_TRANSFER_OK)
  TransferBufferLength = 00000100
  TransferBuffer       = 00000000
  TransferBufferMDL    = 81b65b08
  UrbLink              = 00000000
[629983 ms] UsbSnoop - MyInternalIOCTLCompletion(f8917db0) : fido=81b964f0, Irp=81c2c5d8, Context=822f3898, IRQL=2
[629983 ms]  <<<  URB 945 coming back  <<< 
-- URB_FUNCTION_BULK_OR_INTERRUPT_TRANSFER:
  PipeHandle           = 82300ef4 [endpoint 0x00000081]
  TransferFlags        = 00000003 (USBD_TRANSFER_DIRECTION_IN, USBD_SHORT_TRANSFER_OK)
  TransferBufferLength = 00000005
  TransferBuffer       = 00000000
  TransferBufferMDL    = 81b65b08
    00000000: 00 00 03 ff 03
  UrbLink              = 00000000
[630013 ms] UsbSnoop - DispatchAny(f8916610) : IRP_MJ_INTERNAL_DEVICE_CONTROL
[630013 ms] UsbSnoop - MyDispatchInternalIOCTL(f8917e80) : fdo=822eee08, Irp=81c2c5d8, IRQL=2
[630013 ms]  >>>  URB 946 going down  >>> 
-- URB_FUNCTION_BULK_OR_INTERRUPT_TRANSFER:
  PipeHandle           = 82300ef4 [endpoint 0x00000081]
  TransferFlags        = 00000003 (USBD_TRANSFER_DIRECTION_IN, USBD_SHORT_TRANSFER_OK)
  TransferBufferLength = 00000100
  TransferBuffer       = 00000000
  TransferBufferMDL    = 81b65b08
  UrbLink              = 00000000
[630015 ms] UsbSnoop - MyInternalIOCTLCompletion(f8917db0) : fido=81b964f0, Irp=81c2c5d8, Context=81cdfe48, IRQL=2
[630015 ms]  <<<  URB 946 coming back  <<< 
-- URB_FUNCTION_BULK_OR_INTERRUPT_TRANSFER:
  PipeHandle           = 82300ef4 [endpoint 0x00000081]
  TransferFlags        = 00000003 (USBD_TRANSFER_DIRECTION_IN, USBD_SHORT_TRANSFER_OK)
  TransferBufferLength = 00000100
  TransferBuffer       = 00000000
  TransferBufferMDL    = 81b65b08
    00000000: 72 73 6f 6e 00 2d 00 54 68 6f 6d 61 73 00 2d d9
    00000010: 04 00 4b e5 00 44 65 6d 6f 2e 2d 52 65 70 75 62
    00000020: 2e 00 2d 00 6a 6d 30 34 00 2d 00 4d 61 72 20 33
    00000030: 2c 31 38 31 37 00 2d 00 4d 61 72 20 33 2c 31 38
    00000040: 30 39 00 2d 00 34 74 68 00 2d 00 00 2d 00 4a 61
    00000050: 6d 65 73 20 4d 61 64 69 73 6f 6e 00 2d d9 05 00
    00000060: 4a e5 00 44 65 6d 6f 2e 2d 52 65 70 75 62 2e 00
    00000070: 2d 00 6a 6d 30 35 00 2d 00 4d 61 72 20 33 2c 31
    00000080: 38 32 35 00 2d 00 4d 61 72 20 34 2c 31 38 31 37
    00000090: 00 2d 00 35 74 68 00 2d 00 00 2d 00 4a 61 6d 65
    000000a0: 73 20 4d 6f 6e 72 6f 65 00 2d d9 06 00 4e e5 00
    000000b0: 44 65 6d 6f 2e 2d 52 65 70 75 62 2e 00 2d 00 6a
    000000c0: 61 30 36 00 2d 00 4d 61 72 20 33 2c 31 38 32 39
    000000d0: 00 2d 00 4d 61 72 20 34 2c 31 38 32 35 00 2d 00
    000000e0: 36 74 68 00 2d 00 41 64 61 6d 73 00 2d 00 4a 6f
    000000f0: 68 6e 20 51 75 69 6e 63 79 00 2d d9 07 00 4a e5
  UrbLink              = 00000000
[630043 ms] UsbSnoop - DispatchAny(f8916610) : IRP_MJ_INTERNAL_DEVICE_CONTROL
[630043 ms] UsbSnoop - MyDispatchInternalIOCTL(f8917e80) : fdo=822eee08, Irp=81c2c5d8, IRQL=2
[630043 ms]  >>>  URB 947 going down  >>> 
-- URB_FUNCTION_BULK_OR_INTERRUPT_TRANSFER:
  PipeHandle           = 82300ef4 [endpoint 0x00000081]
  TransferFlags        = 00000003 (USBD_TRANSFER_DIRECTION_IN, USBD_SHORT_TRANSFER_OK)
  TransferBufferLength = 00000100
  TransferBuffer       = 00000000
  TransferBufferMDL    = 81b65b08
  UrbLink              = 00000000
[630045 ms] UsbSnoop - MyInternalIOCTLCompletion(f8917db0) : fido=81b964f0, Irp=81c2c5d8, Context=81cb4e48, IRQL=2
[630045 ms]  <<<  URB 947 coming back  <<< 
-- URB_FUNCTION_BULK_OR_INTERRUPT_TRANSFER:
  PipeHandle           = 82300ef4 [endpoint 0x00000081]
  TransferFlags        = 00000003 (USBD_TRANSFER_DIRECTION_IN, USBD_SHORT_TRANSFER_OK)
  TransferBufferLength = 00000100
  TransferBuffer       = 00000000
  TransferBufferMDL    = 81b65b08
    00000000: 00 44 65 6d 6f 63 72 61 74 69 63 00 2d 00 61 6a
    00000010: 30 37 00 2d 00 4d 61 72 20 33 2c 31 38 33 37 00
    00000020: 2d 00 4d 61 72 20 34 2c 31 38 32 39 00 2d 00 37
    00000030: 74 68 00 2d 00 00 2d 00 41 6e 64 72 65 77 20 4a
    00000040: 61 63 6b 73 6f 6e 00 2d d9 08 00 4b e5 00 44 65
    00000050: 6d 6f 63 72 61 74 69 63 00 2d 00 6d 62 30 38 00
    00000060: 2d 00 4d 61 72 20 33 2c 31 38 34 31 00 2d 00 4d
    00000070: 61 72 20 34 2c 31 38 33 37 00 2d 00 38 74 68 00
    00000080: 2d 00 56 61 6e 20 42 75 72 65 6e 00 2d 00 4d 61
    00000090: 72 74 69 6e 00 2d d9 09 00 4b e5 00 57 68 69 67
    000000a0: 00 2d 00 77 68 30 39 00 2d 00 41 70 72 20 34 2c
    000000b0: 31 38 34 31 00 2d 00 4d 61 72 20 34 2c 31 38 34
    000000c0: 31 00 2d 00 39 74 68 00 2d 00 48 61 72 72 69 73
    000000d0: 6f 6e 00 2d 00 57 69 6c 6c 69 61 6d 20 48 65 6e
    000000e0: 72 79 00 2d d9 0a 00 41 e5 00 57 68 69 67 00 2d
    000000f0: 00 6a 74 31 30 00 2d 00 4d 61 72 20 33 2c 31 38
  UrbLink              = 00000000
[630073 ms] UsbSnoop - DispatchAny(f8916610) : IRP_MJ_INTERNAL_DEVICE_CONTROL
[630073 ms] UsbSnoop - MyDispatchInternalIOCTL(f8917e80) : fdo=822eee08, Irp=81c2c5d8, IRQL=2
[630073 ms]  >>>  URB 948 going down  >>> 
-- URB_FUNCTION_BULK_OR_INTERRUPT_TRANSFER:
  PipeHandle           = 82300ef4 [endpoint 0x00000081]
  TransferFlags        = 00000003 (USBD_TRANSFER_DIRECTION_IN, USBD_SHORT_TRANSFER_OK)
  TransferBufferLength = 00000100
  TransferBuffer       = 00000000
  TransferBufferMDL    = 81b65b08
  UrbLink              = 00000000
[630075 ms] UsbSnoop - MyInternalIOCTLCompletion(f8917db0) : fido=81b964f0, Irp=81c2c5d8, Context=81c3bfe8, IRQL=2
[630075 ms]  <<<  URB 948 coming back  <<< 
-- URB_FUNCTION_BULK_OR_INTERRUPT_TRANSFER:
  PipeHandle           = 82300ef4 [endpoint 0x00000081]
  TransferFlags        = 00000003 (USBD_TRANSFER_DIRECTION_IN, USBD_SHORT_TRANSFER_OK)
  TransferBufferLength = 00000100
  TransferBuffer       = 00000000
  TransferBufferMDL    = 81b65b08
    00000000: 34 35 00 2d 00 41 70 72 20 36 2c 31 38 34 31 00
    00000010: 2d 00 31 30 74 68 00 2d 00 00 2d 00 4a 6f 68 6e
    00000020: 20 54 79 6c 65 72 00 2d d9 0b 00 4b e5 00 44 65
    00000030: 6d 6f 63 72 61 74 69 63 00 2d 00 6a 70 31 31 00
    00000040: 2d 00 4d 61 72 20 33 2c 31 38 34 39 00 2d 00 4d
    00000050: 61 72 20 34 2c 31 38 34 35 00 2d 00 31 31 74 68
    00000060: 00 2d 00 50 6f 6c 6b 00 2d 00 4a 61 6d 65 73 20
    00000070: 4b 6e 6f 78 00 2d d9 0c 00 45 e5 00 57 68 69 67
    00000080: 00 2d 00 7a 72 31 32 00 2d 00 4a 75 6c 20 39 2c
    00000090: 31 38 35 30 00 2d 00 4d 61 72 20 35 2c 31 38 34
    000000a0: 39 00 2d 00 31 32 74 68 00 2d 00 00 2d 00 5a 61
    000000b0: 63 68 61 72 79 20 54 61 79 6c 6f 72 00 2d d9 0d
    000000c0: 00 46 e5 00 57 68 69 67 00 2d 00 6d 66 31 33 00
    000000d0: 2d 00 4d 61 72 20 33 2c 31 38 35 33 00 2d 00 4a
    000000e0: 75 6c 20 39 2c 31 38 35 30 00 2d 00 31 33 74 68
    000000f0: 00 2d 00 46 69 6c 6c 6d 6f 72 65 00 2d 00 4d 69
  UrbLink              = 00000000
[630104 ms] UsbSnoop - DispatchAny(f8916610) : IRP_MJ_INTERNAL_DEVICE_CONTROL
[630104 ms] UsbSnoop - MyDispatchInternalIOCTL(f8917e80) : fdo=822eee08, Irp=81c2c5d8, IRQL=2
[630104 ms]  >>>  URB 949 going down  >>> 
-- URB_FUNCTION_BULK_OR_INTERRUPT_TRANSFER:
  PipeHandle           = 82300ef4 [endpoint 0x00000081]
  TransferFlags        = 00000003 (USBD_TRANSFER_DIRECTION_IN, USBD_SHORT_TRANSFER_OK)
  TransferBufferLength = 00000100
  TransferBuffer       = 00000000
  TransferBufferMDL    = 81b65b08
  UrbLink              = 00000000
[630106 ms] UsbSnoop - MyInternalIOCTLCompletion(f8917db0) : fido=81b964f0, Irp=81c2c5d8, Context=81cdfe48, IRQL=2
[630106 ms]  <<<  URB 949 coming back  <<< 
-- URB_FUNCTION_BULK_OR_INTERRUPT_TRANSFER:
  PipeHandle           = 82300ef4 [endpoint 0x00000081]
  TransferFlags        = 00000003 (USBD_TRANSFER_DIRECTION_IN, USBD_SHORT_TRANSFER_OK)
  TransferBufferLength = 000000ff
  TransferBuffer       = 00000000
  TransferBufferMDL    = 81b65b08
    00000000: 6c 6c 61 72 64 00 2d d9 0e 00 4a e5 00 44 65 6d
    00000010: 6f 63 72 61 74 00 2d 00 66 70 31 34 00 2d 00 4d
    00000020: 61 72 20 33 2c 31 38 35 37 00 2d 00 4d 61 72 20
    00000030: 34 2c 31 38 35 33 00 2d 00 31 34 74 68 00 2d 00
    00000040: 00 2d 00 46 72 61 6e 6b 6c 69 6e 20 50 69 65 72
    00000050: 63 65 00 2d d9 0f 00 49 e5 00 44 65 6d 6f 63 72
    00000060: 61 74 00 2d 00 6a 62 31 35 00 2d 00 4d 61 72 20
    00000070: 33 2c 31 38 36 31 00 2d 00 4d 61 72 20 34 2c 31
    00000080: 38 35 37 00 2d 00 31 35 74 68 00 2d 00 00 2d 00
    00000090: 4a 61 6d 65 73 20 42 75 63 68 61 6e 61 6e 00 2d
    000000a0: d9 10 00 4d e5 00 52 65 70 75 62 6c 69 63 61 6e
    000000b0: 00 2d 00 61 6c 31 36 00 2d 00 41 70 72 20 31 35
    000000c0: 2c 31 38 36 35 00 2d 00 4d 61 72 20 34 2c 31 38
    000000d0: 36 31 00 2d 00 31 36 74 68 00 2d 00 00 2d 00 41
    000000e0: 62 72 61 68 61 6d 20 4c 69 6e 63 6f 6c 6e 00 2d
    000000f0: d9 11 00 4a e5 00 44 65 6d 6f 63 72 61 74 00
  UrbLink              = 00000000
[630133 ms] UsbSnoop - DispatchAny(f8916610) : IRP_MJ_INTERNAL_DEVICE_CONTROL
[630133 ms] UsbSnoop - MyDispatchInternalIOCTL(f8917e80) : fdo=822eee08, Irp=81c2c5d8, IRQL=2
[630133 ms]  >>>  URB 950 going down  >>> 
-- URB_FUNCTION_BULK_OR_INTERRUPT_TRANSFER:
  PipeHandle           = 82300f14 [endpoint 0x00000002]
  TransferFlags        = 00000000 (USBD_TRANSFER_DIRECTION_OUT, ~USBD_SHORT_TRANSFER_OK)
  TransferBufferLength = 00000007
  TransferBuffer       = 00000000
  TransferBufferMDL    = 81b65b08
    00000000: 00 00 00 02 05 e0 00
  UrbLink              = 00000000
[630133 ms] UsbSnoop - MyInternalIOCTLCompletion(f8917db0) : fido=81b964f0, Irp=81c2c5d8, Context=81cb4e48, IRQL=2
[630133 ms]  <<<  URB 950 coming back  <<< 
-- URB_FUNCTION_BULK_OR_INTERRUPT_TRANSFER:
  PipeHandle           = 82300f14 [endpoint 0x00000002]
  TransferFlags        = 00000000 (USBD_TRANSFER_DIRECTION_OUT, ~USBD_SHORT_TRANSFER_OK)
  TransferBufferLength = 00000007
  TransferBuffer       = 00000000
  TransferBufferMDL    = 81b65b08
  UrbLink              = 00000000
[630143 ms] UsbSnoop - DispatchAny(f8916610) : IRP_MJ_INTERNAL_DEVICE_CONTROL
[630143 ms] UsbSnoop - MyDispatchInternalIOCTL(f8917e80) : fdo=822eee08, Irp=81c2c5d8, IRQL=2
[630143 ms]  >>>  URB 951 going down  >>> 
-- URB_FUNCTION_BULK_OR_INTERRUPT_TRANSFER:
  PipeHandle           = 82300ef4 [endpoint 0x00000081]
  TransferFlags        = 00000003 (USBD_TRANSFER_DIRECTION_IN, USBD_SHORT_TRANSFER_OK)
  TransferBufferLength = 00000100
  TransferBuffer       = 00000000
  TransferBufferMDL    = 81b65b08
  UrbLink              = 00000000
[630143 ms] UsbSnoop - MyInternalIOCTLCompletion(f8917db0) : fido=81b964f0, Irp=81c2c5d8, Context=81cdfe48, IRQL=2
[630143 ms]  <<<  URB 951 coming back  <<< 
-- URB_FUNCTION_BULK_OR_INTERRUPT_TRANSFER:
  PipeHandle           = 82300ef4 [endpoint 0x00000081]
  TransferFlags        = 00000003 (USBD_TRANSFER_DIRECTION_IN, USBD_SHORT_TRANSFER_OK)
  TransferBufferLength = 00000005
  TransferBuffer       = 00000000
  TransferBufferMDL    = 81b65b08
    00000000: 00 00 03 ff 03
  UrbLink              = 00000000
[630173 ms] UsbSnoop - DispatchAny(f8916610) : IRP_MJ_INTERNAL_DEVICE_CONTROL
[630173 ms] UsbSnoop - MyDispatchInternalIOCTL(f8917e80) : fdo=822eee08, Irp=81c2c5d8, IRQL=2
[630173 ms]  >>>  URB 952 going down  >>> 
-- URB_FUNCTION_BULK_OR_INTERRUPT_TRANSFER:
  PipeHandle           = 82300ef4 [endpoint 0x00000081]
  TransferFlags        = 00000003 (USBD_TRANSFER_DIRECTION_IN, USBD_SHORT_TRANSFER_OK)
  TransferBufferLength = 00000100
  TransferBuffer       = 00000000
  TransferBufferMDL    = 81b65b08
  UrbLink              = 00000000
[630175 ms] UsbSnoop - MyInternalIOCTLCompletion(f8917db0) : fido=81b964f0, Irp=81c2c5d8, Context=81b4ccc0, IRQL=2
[630175 ms]  <<<  URB 952 coming back  <<< 
-- URB_FUNCTION_BULK_OR_INTERRUPT_TRANSFER:
  PipeHandle           = 82300ef4 [endpoint 0x00000081]
  TransferFlags        = 00000003 (USBD_TRANSFER_DIRECTION_IN, USBD_SHORT_TRANSFER_OK)
  TransferBufferLength = 00000100
  TransferBuffer       = 00000000
  TransferBufferMDL    = 81b65b08
    00000000: 2d 00 61 6a 31 37 00 2d 00 4d 61 72 20 33 2c 31
    00000010: 38 36 39 00 2d 00 41 70 72 20 31 35 2c 31 38 36
    00000020: 35 00 2d 00 31 37 74 68 00 2d 00 00 2d 00 41 6e
    00000030: 64 72 65 77 20 4a 6f 68 6e 73 6f 6e 00 2d d9 12
    00000040: 00 51 e5 00 52 65 70 75 62 6c 69 63 61 6e 00 2d
    00000050: 00 75 67 31 38 00 2d 00 4d 61 72 20 33 2c 31 38
    00000060: 37 37 00 2d 00 4d 61 72 20 34 2c 31 38 36 39 00
    00000070: 2d 00 31 38 74 68 00 2d 00 47 72 61 6e 74 00 2d
    00000080: 00 55 6c 79 73 73 65 73 20 53 69 6d 70 73 6f 6e
    00000090: 00 2d d9 13 00 55 e5 00 52 65 70 75 62 6c 69 63
    000000a0: 61 6e 00 2d 00 72 68 31 39 00 2d 00 4d 61 72 20
    000000b0: 33 2c 31 38 38 31 00 2d 00 4d 61 72 20 34 2c 31
    000000c0: 38 37 37 00 2d 00 31 39 74 68 00 2d 00 42 69 72
    000000d0: 63 68 61 72 64 20 48 61 79 65 73 00 2d 00 52 75
    000000e0: 74 68 65 72 66 6f 72 64 00 2d d9 14 00 51 e5 00
    000000f0: 52 65 70 75 62 6c 69 63 61 6e 00 2d 00 6a 67 32
  UrbLink              = 00000000
[630203 ms] UsbSnoop - DispatchAny(f8916610) : IRP_MJ_INTERNAL_DEVICE_CONTROL
[630203 ms] UsbSnoop - MyDispatchInternalIOCTL(f8917e80) : fdo=822eee08, Irp=81c2c5d8, IRQL=2
[630203 ms]  >>>  URB 953 going down  >>> 
-- URB_FUNCTION_BULK_OR_INTERRUPT_TRANSFER:
  PipeHandle           = 82300ef4 [endpoint 0x00000081]
  TransferFlags        = 00000003 (USBD_TRANSFER_DIRECTION_IN, USBD_SHORT_TRANSFER_OK)
  TransferBufferLength = 00000100
  TransferBuffer       = 00000000
  TransferBufferMDL    = 81b65b08
  UrbLink              = 00000000
[630205 ms] UsbSnoop - MyInternalIOCTLCompletion(f8917db0) : fido=81b964f0, Irp=81c2c5d8, Context=81cb4e48, IRQL=2
[630205 ms]  <<<  URB 953 coming back  <<< 
-- URB_FUNCTION_BULK_OR_INTERRUPT_TRANSFER:
  PipeHandle           = 82300ef4 [endpoint 0x00000081]
  TransferFlags        = 00000003 (USBD_TRANSFER_DIRECTION_IN, USBD_SHORT_TRANSFER_OK)
  TransferBufferLength = 00000100
  TransferBuffer       = 00000000
  TransferBufferMDL    = 81b65b08
    00000000: 30 00 2d 00 53 65 70 20 31 39 2c 31 38 38 31 00
    00000010: 2d 00 4d 61 72 20 34 2c 31 38 38 31 00 2d 00 32
    00000020: 30 74 68 00 2d 00 47 61 72 66 69 65 6c 64 00 2d
    00000030: 00 4a 61 6d 65 73 20 41 62 72 61 6d 00 2d d9 15
    00000040: 00 50 e5 00 52 65 70 75 62 6c 69 63 61 6e 00 2d
    00000050: 00 63 61 32 31 00 2d 00 4d 61 72 20 33 2c 31 38
    00000060: 38 35 00 2d 00 53 65 70 20 31 39 2c 31 38 38 31
    00000070: 00 2d 00 32 31 73 74 00 2d 00 41 72 74 68 75 72
    00000080: 00 2d 00 43 68 65 73 74 65 72 20 41 6c 61 6e 00
    00000090: 2d d9 16 00 4a e5 00 44 65 6d 6f 63 72 61 74 00
    000000a0: 2d 00 67 63 32 32 00 2d 00 4d 61 72 20 33 2c 31
    000000b0: 38 38 39 00 2d 00 4d 61 72 20 34 2c 31 38 38 35
    000000c0: 00 2d 00 32 32 6e 64 00 2d 00 43 6c 65 76 65 6c
    000000d0: 61 6e 64 00 2d 00 47 72 6f 76 65 72 00 2d d9 17
    000000e0: 00 4d e5 00 52 65 70 75 62 6c 69 63 61 6e 00 2d
    000000f0: 00 62 68 32 33 00 2d 00 4d 61 72 20 33 2c 31 38
  UrbLink              = 00000000
[630233 ms] UsbSnoop - DispatchAny(f8916610) : IRP_MJ_INTERNAL_DEVICE_CONTROL
[630233 ms] UsbSnoop - MyDispatchInternalIOCTL(f8917e80) : fdo=822eee08, Irp=81c2c5d8, IRQL=2
[630233 ms]  >>>  URB 954 going down  >>> 
-- URB_FUNCTION_BULK_OR_INTERRUPT_TRANSFER:
  PipeHandle           = 82300ef4 [endpoint 0x00000081]
  TransferFlags        = 00000003 (USBD_TRANSFER_DIRECTION_IN, USBD_SHORT_TRANSFER_OK)
  TransferBufferLength = 00000100
  TransferBuffer       = 00000000
  TransferBufferMDL    = 81b65b08
  UrbLink              = 00000000
[630235 ms] UsbSnoop - MyInternalIOCTLCompletion(f8917db0) : fido=81b964f0, Irp=81c2c5d8, Context=81c3bfe8, IRQL=2
[630235 ms]  <<<  URB 954 coming back  <<< 
-- URB_FUNCTION_BULK_OR_INTERRUPT_TRANSFER:
  PipeHandle           = 82300ef4 [endpoint 0x00000081]
  TransferFlags        = 00000003 (USBD_TRANSFER_DIRECTION_IN, USBD_SHORT_TRANSFER_OK)
  TransferBufferLength = 00000100
  TransferBuffer       = 00000000
  TransferBufferMDL    = 81b65b08
    00000000: 39 33 00 2d 00 4d 61 72 20 34 2c 31 38 38 39 00
    00000010: 2d 00 32 33 72 64 00 2d 00 48 61 72 72 69 73 6f
    00000020: 6e 00 2d 00 42 65 6e 6a 61 6d 69 6e 00 2d d9 18
    00000030: 00 4a e5 00 44 65 6d 6f 63 72 61 74 00 2d 00 67
    00000040: 63 32 32 00 2d 00 4d 61 72 20 33 2c 31 38 39 37
    00000050: 00 2d 00 4d 61 72 20 34 2c 31 38 39 33 00 2d 00
    00000060: 32 34 74 68 00 2d 00 43 6c 65 76 65 6c 61 6e 64
    00000070: 00 2d 00 47 72 6f 76 65 72 00 2d d9 19 00 4d e5
    00000080: 00 52 65 70 75 62 6c 69 63 61 6e 00 2d 00 77 6d
    00000090: 32 35 00 2d 00 53 65 70 20 31 34 2c 31 39 30 31
    000000a0: 00 2d 00 4d 61 72 20 34 2c 31 38 39 37 00 2d 00
    000000b0: 32 35 74 68 00 2d 00 4d 63 4b 69 6e 6c 65 79 00
    000000c0: 2d 00 57 69 6c 6c 69 61 6d 00 2d d9 1a 00 4f e5
    000000d0: 00 52 65 70 75 62 6c 69 63 61 6e 00 2d 00 74 72
    000000e0: 32 36 00 2d 00 4d 61 72 20 33 2c 31 39 30 39 00
    000000f0: 2d 00 53 65 70 20 31 34 2c 31 39 30 31 00 2d 00
  UrbLink              = 00000000
[630263 ms] UsbSnoop - DispatchAny(f8916610) : IRP_MJ_INTERNAL_DEVICE_CONTROL
[630263 ms] UsbSnoop - MyDispatchInternalIOCTL(f8917e80) : fdo=822eee08, Irp=81c2c5d8, IRQL=2
[630263 ms]  >>>  URB 955 going down  >>> 
-- URB_FUNCTION_BULK_OR_INTERRUPT_TRANSFER:
  PipeHandle           = 82300ef4 [endpoint 0x00000081]
  TransferFlags        = 00000003 (USBD_TRANSFER_DIRECTION_IN, USBD_SHORT_TRANSFER_OK)
  TransferBufferLength = 00000100
  TransferBuffer       = 00000000
  TransferBufferMDL    = 81b65b08
  UrbLink              = 00000000
[630265 ms] UsbSnoop - MyInternalIOCTLCompletion(f8917db0) : fido=81b964f0, Irp=81c2c5d8, Context=81b4ccc0, IRQL=2
[630265 ms]  <<<  URB 955 coming back  <<< 
-- URB_FUNCTION_BULK_OR_INTERRUPT_TRANSFER:
  PipeHandle           = 82300ef4 [endpoint 0x00000081]
  TransferFlags        = 00000003 (USBD_TRANSFER_DIRECTION_IN, USBD_SHORT_TRANSFER_OK)
  TransferBufferLength = 000000ff
  TransferBuffer       = 00000000
  TransferBufferMDL    = 81b65b08
    00000000: 32 36 74 68 00 2d 00 52 6f 6f 73 65 76 65 6c 74
    00000010: 00 2d 00 54 68 65 6f 64 6f 72 65 00 2d d9 1b 00
    00000020: 4f e5 00 52 65 70 75 62 6c 69 63 61 6e 00 2d 00
    00000030: 77 74 32 37 00 2d 00 4d 61 72 20 33 2c 31 39 31
    00000040: 33 00 2d 00 4d 61 72 20 34 2c 31 39 30 39 00 2d
    00000050: 00 32 37 74 68 00 2d 00 54 61 66 74 00 2d 00 57
    00000060: 69 6c 6c 69 61 6d 20 48 6f 77 61 72 64 00 2d d9
    00000070: 1c 00 49 e5 00 44 65 6d 6f 63 72 61 74 00 2d 00
    00000080: 77 77 32 38 00 2d 00 4d 61 72 20 33 2c 31 39 32
    00000090: 31 00 2d 00 4d 61 72 20 34 2c 31 39 31 33 00 2d
    000000a0: 00 32 38 74 68 00 2d 00 00 2d 00 57 6f 6f 64 72
    000000b0: 6f 77 20 57 69 6c 73 6f 6e 00 2d d9 1d 00 53 e5
    000000c0: 00 52 65 70 75 62 6c 69 63 61 6e 00 2d 00 77 68
    000000d0: 32 39 00 2d 00 41 75 67 20 32 2c 31 39 32 33 00
    000000e0: 2d 00 4d 61 72 20 34 2c 31 39 32 31 00 2d 00 32
    000000f0: 39 74 68 00 2d 00 48 61 72 64 69 6e 67 00 2d
  UrbLink              = 00000000
[630293 ms] UsbSnoop - DispatchAny(f8916610) : IRP_MJ_INTERNAL_DEVICE_CONTROL
[630293 ms] UsbSnoop - MyDispatchInternalIOCTL(f8917e80) : fdo=822eee08, Irp=81c2c5d8, IRQL=2
[630293 ms]  >>>  URB 956 going down  >>> 
-- URB_FUNCTION_BULK_OR_INTERRUPT_TRANSFER:
  PipeHandle           = 82300f14 [endpoint 0x00000002]
  TransferFlags        = 00000000 (USBD_TRANSFER_DIRECTION_OUT, ~USBD_SHORT_TRANSFER_OK)
  TransferBufferLength = 00000007
  TransferBuffer       = 00000000
  TransferBufferMDL    = 81b65b08
    00000000: 00 00 00 02 05 e0 00
  UrbLink              = 00000000
[630294 ms] UsbSnoop - MyInternalIOCTLCompletion(f8917db0) : fido=81b964f0, Irp=81c2c5d8, Context=81cb4e48, IRQL=2
[630294 ms]  <<<  URB 956 coming back  <<< 
-- URB_FUNCTION_BULK_OR_INTERRUPT_TRANSFER:
  PipeHandle           = 82300f14 [endpoint 0x00000002]
  TransferFlags        = 00000000 (USBD_TRANSFER_DIRECTION_OUT, ~USBD_SHORT_TRANSFER_OK)
  TransferBufferLength = 00000007
  TransferBuffer       = 00000000
  TransferBufferMDL    = 81b65b08
  UrbLink              = 00000000
[630304 ms] UsbSnoop - DispatchAny(f8916610) : IRP_MJ_INTERNAL_DEVICE_CONTROL
[630304 ms] UsbSnoop - MyDispatchInternalIOCTL(f8917e80) : fdo=822eee08, Irp=81c2c5d8, IRQL=2
[630304 ms]  >>>  URB 957 going down  >>> 
-- URB_FUNCTION_BULK_OR_INTERRUPT_TRANSFER:
  PipeHandle           = 82300ef4 [endpoint 0x00000081]
  TransferFlags        = 00000003 (USBD_TRANSFER_DIRECTION_IN, USBD_SHORT_TRANSFER_OK)
  TransferBufferLength = 00000100
  TransferBuffer       = 00000000
  TransferBufferMDL    = 81b65b08
  UrbLink              = 00000000
[630305 ms] UsbSnoop - MyInternalIOCTLCompletion(f8917db0) : fido=81b964f0, Irp=81c2c5d8, Context=81c3bfe8, IRQL=2
[630305 ms]  <<<  URB 957 coming back  <<< 
-- URB_FUNCTION_BULK_OR_INTERRUPT_TRANSFER:
  PipeHandle           = 82300ef4 [endpoint 0x00000081]
  TransferFlags        = 00000003 (USBD_TRANSFER_DIRECTION_IN, USBD_SHORT_TRANSFER_OK)
  TransferBufferLength = 00000005
  TransferBuffer       = 00000000
  TransferBufferMDL    = 81b65b08
    00000000: 00 00 03 ff 03
  UrbLink              = 00000000
[630333 ms] UsbSnoop - DispatchAny(f8916610) : IRP_MJ_INTERNAL_DEVICE_CONTROL
[630333 ms] UsbSnoop - MyDispatchInternalIOCTL(f8917e80) : fdo=822eee08, Irp=81c2c5d8, IRQL=2
[630333 ms]  >>>  URB 958 going down  >>> 
-- URB_FUNCTION_BULK_OR_INTERRUPT_TRANSFER:
  PipeHandle           = 82300ef4 [endpoint 0x00000081]
  TransferFlags        = 00000003 (USBD_TRANSFER_DIRECTION_IN, USBD_SHORT_TRANSFER_OK)
  TransferBufferLength = 00000100
  TransferBuffer       = 00000000
  TransferBufferMDL    = 81b65b08
  UrbLink              = 00000000
[630336 ms] UsbSnoop - MyInternalIOCTLCompletion(f8917db0) : fido=81b964f0, Irp=81c2c5d8, Context=81b4ccc0, IRQL=2
[630336 ms]  <<<  URB 958 coming back  <<< 
-- URB_FUNCTION_BULK_OR_INTERRUPT_TRANSFER:
  PipeHandle           = 82300ef4 [endpoint 0x00000081]
  TransferFlags        = 00000003 (USBD_TRANSFER_DIRECTION_IN, USBD_SHORT_TRANSFER_OK)
  TransferBufferLength = 00000100
  TransferBuffer       = 00000000
  TransferBufferMDL    = 81b65b08
    00000000: 00 57 61 72 72 65 6e 20 47 61 6d 61 6c 65 69 6c
    00000010: 00 2d d9 1e 00 4c e5 00 52 65 70 75 62 6c 69 63
    00000020: 61 6e 00 2d 00 63 63 33 30 00 2d 00 4d 61 72 20
    00000030: 33 2c 31 39 32 39 00 2d 00 41 75 67 20 33 2c 31
    00000040: 39 32 33 00 2d 00 33 30 74 68 00 2d 00 00 2d 00
    00000050: 43 61 6c 76 69 6e 20 43 6f 6f 6c 69 64 67 65 00
    00000060: 2d d9 1f 00 50 e5 00 52 65 70 75 62 6c 69 63 61
    00000070: 6e 00 2d 00 68 68 33 31 00 2d 00 4d 61 72 20 33
    00000080: 2c 31 39 33 33 00 2d 00 4d 61 72 20 34 2c 31 39
    00000090: 32 39 00 2d 00 33 31 73 74 00 2d 00 48 6f 6f 76
    000000a0: 65 72 00 2d 00 48 65 72 62 65 72 74 20 43 6c 61
    000000b0: 72 6b 00 2d d9 20 00 54 e5 00 44 65 6d 6f 63 72
    000000c0: 61 74 00 2d 00 66 72 33 32 00 2d 00 41 70 72 20
    000000d0: 31 32 2c 31 39 34 35 00 2d 00 4d 61 72 20 34 2c
    000000e0: 31 39 33 33 00 2d 00 33 32 6e 64 00 2d 00 52 6f
    000000f0: 6f 73 65 76 65 6c 74 00 2d 00 46 72 61 6e 6b 6c
  UrbLink              = 00000000
[630364 ms] UsbSnoop - DispatchAny(f8916610) : IRP_MJ_INTERNAL_DEVICE_CONTROL
[630364 ms] UsbSnoop - MyDispatchInternalIOCTL(f8917e80) : fdo=822eee08, Irp=81c2c5d8, IRQL=2
[630364 ms]  >>>  URB 959 going down  >>> 
-- URB_FUNCTION_BULK_OR_INTERRUPT_TRANSFER:
  PipeHandle           = 82300ef4 [endpoint 0x00000081]
  TransferFlags        = 00000003 (USBD_TRANSFER_DIRECTION_IN, USBD_SHORT_TRANSFER_OK)
  TransferBufferLength = 00000100
  TransferBuffer       = 00000000
  TransferBufferMDL    = 81b65b08
  UrbLink              = 00000000
[630366 ms] UsbSnoop - MyInternalIOCTLCompletion(f8917db0) : fido=81b964f0, Irp=81c2c5d8, Context=81cb4e48, IRQL=2
[630366 ms]  <<<  URB 959 coming back  <<< 
-- URB_FUNCTION_BULK_OR_INTERRUPT_TRANSFER:
  PipeHandle           = 82300ef4 [endpoint 0x00000081]
  TransferFlags        = 00000003 (USBD_TRANSFER_DIRECTION_IN, USBD_SHORT_TRANSFER_OK)
  TransferBufferLength = 00000100
  TransferBuffer       = 00000000
  TransferBufferMDL    = 81b65b08
    00000000: 69 6e 20 44 65 6c 61 6e 6f 00 2d d9 21 00 4b e5
    00000010: 00 44 65 6d 6f 63 72 61 74 00 2d 00 68 74 33 33
    00000020: 00 2d 00 4a 61 6e 20 32 30 2c 31 39 35 33 00 2d
    00000030: 00 41 70 72 20 31 32 2c 31 39 34 35 00 2d 00 33
    00000040: 33 72 64 00 2d 00 54 72 75 6d 61 6e 00 2d 00 48
    00000050: 61 72 72 79 20 53 2e 00 2d d9 22 00 55 e5 00 52
    00000060: 65 70 75 62 6c 69 63 61 6e 00 2d 00 64 65 33 34
    00000070: 00 2d 00 4a 61 6e 20 32 30 2c 31 39 36 31 00 2d
    00000080: 00 4a 61 6e 20 32 30 2c 31 39 35 33 00 2d 00 33
    00000090: 34 74 68 00 2d 00 45 69 73 65 6e 68 6f 77 65 72
    000000a0: 00 2d 00 44 77 69 67 68 74 20 44 61 76 69 64 00
    000000b0: 2d d9 23 00 53 e5 00 44 65 6d 6f 63 72 61 74 00
    000000c0: 2d 00 6a 6b 33 35 00 2d 00 4e 6f 76 20 32 32 2c
    000000d0: 31 39 36 33 00 2d 00 4a 61 6e 20 32 30 2c 31 39
    000000e0: 36 31 00 2d 00 33 35 74 68 00 2d 00 4b 65 6e 6e
    000000f0: 65 64 79 00 2d 00 4a 6f 68 6e 20 46 69 74 7a 67
  UrbLink              = 00000000
[630394 ms] UsbSnoop - DispatchAny(f8916610) : IRP_MJ_INTERNAL_DEVICE_CONTROL
[630394 ms] UsbSnoop - MyDispatchInternalIOCTL(f8917e80) : fdo=822eee08, Irp=81c2c5d8, IRQL=2
[630394 ms]  >>>  URB 960 going down  >>> 
-- URB_FUNCTION_BULK_OR_INTERRUPT_TRANSFER:
  PipeHandle           = 82300ef4 [endpoint 0x00000081]
  TransferFlags        = 00000003 (USBD_TRANSFER_DIRECTION_IN, USBD_SHORT_TRANSFER_OK)
  TransferBufferLength = 00000100
  TransferBuffer       = 00000000
  TransferBufferMDL    = 81b65b08
  UrbLink              = 00000000
[630396 ms] UsbSnoop - MyInternalIOCTLCompletion(f8917db0) : fido=81b964f0, Irp=81c2c5d8, Context=81c3bfe8, IRQL=2
[630396 ms]  <<<  URB 960 coming back  <<< 
-- URB_FUNCTION_BULK_OR_INTERRUPT_TRANSFER:
  PipeHandle           = 82300ef4 [endpoint 0x00000081]
  TransferFlags        = 00000003 (USBD_TRANSFER_DIRECTION_IN, USBD_SHORT_TRANSFER_OK)
  TransferBufferLength = 00000100
  TransferBuffer       = 00000000
  TransferBufferMDL    = 81b65b08
    00000000: 65 72 61 6c 64 00 2d d9 24 00 51 e5 00 44 65 6d
    00000010: 6f 63 72 61 74 00 2d 00 6c 6a 33 36 00 2d 00 4a
    00000020: 61 6e 20 32 30 2c 31 39 36 39 00 2d 00 4e 6f 76
    00000030: 20 32 32 2c 31 39 36 33 00 2d 00 33 36 74 68 00
    00000040: 2d 00 4a 6f 68 6e 73 6f 6e 00 2d 00 4c 79 6e 64
    00000050: 6f 6e 20 42 61 69 6e 65 73 00 2d d9 25 00 52 e5
    00000060: 00 52 65 70 75 62 6c 69 63 61 6e 00 2d 00 72 6e
    00000070: 33 37 00 2d 00 41 75 67 20 39 2c 31 39 37 34 00
    00000080: 2d 00 4a 61 6e 20 32 30 2c 31 39 36 39 00 2d 00
    00000090: 33 37 74 68 00 2d 00 4e 69 78 6f 6e 00 2d 00 52
    000000a0: 69 63 68 61 72 64 20 4d 69 6c 68 6f 75 73 00 2d
    000000b0: d9 26 00 50 e5 00 52 65 70 75 62 6c 69 63 61 6e
    000000c0: 00 2d 00 67 66 33 38 00 2d 00 4a 61 6e 20 32 30
    000000d0: 2c 31 39 37 37 00 2d 00 41 75 67 20 39 2c 31 39
    000000e0: 37 34 00 2d 00 33 38 74 68 00 2d 00 46 6f 72 64
    000000f0: 00 2d 00 47 65 72 61 6c 64 20 52 75 64 6f 6c 70
  UrbLink              = 00000000
[630424 ms] UsbSnoop - DispatchAny(f8916610) : IRP_MJ_INTERNAL_DEVICE_CONTROL
[630424 ms] UsbSnoop - MyDispatchInternalIOCTL(f8917e80) : fdo=822eee08, Irp=81c2c5d8, IRQL=2
[630424 ms]  >>>  URB 961 going down  >>> 
-- URB_FUNCTION_BULK_OR_INTERRUPT_TRANSFER:
  PipeHandle           = 82300ef4 [endpoint 0x00000081]
  TransferFlags        = 00000003 (USBD_TRANSFER_DIRECTION_IN, USBD_SHORT_TRANSFER_OK)
  TransferBufferLength = 00000100
  TransferBuffer       = 00000000
  TransferBufferMDL    = 81b65b08
  UrbLink              = 00000000
[630426 ms] UsbSnoop - MyInternalIOCTLCompletion(f8917db0) : fido=81b964f0, Irp=81c2c5d8, Context=81b4ccc0, IRQL=2
[630426 ms]  <<<  URB 961 coming back  <<< 
-- URB_FUNCTION_BULK_OR_INTERRUPT_TRANSFER:
  PipeHandle           = 82300ef4 [endpoint 0x00000081]
  TransferFlags        = 00000003 (USBD_TRANSFER_DIRECTION_IN, USBD_SHORT_TRANSFER_OK)
  TransferBufferLength = 000000ff
  TransferBuffer       = 00000000
  TransferBufferMDL    = 81b65b08
    00000000: 68 00 2d d9 27 00 52 e5 00 44 65 6d 6f 63 72 61
    00000010: 74 00 2d 00 6a 63 33 39 00 2d 00 4a 61 6e 20 32
    00000020: 30 2c 31 39 38 31 00 2d 00 4a 61 6e 20 32 30 2c
    00000030: 31 39 37 37 00 2d 00 33 39 74 68 00 2d 00 43 61
    00000040: 72 74 65 72 2c 20 4a 72 2e 00 2d 00 4a 61 6d 65
    00000050: 73 20 45 61 72 6c 00 2d d9 28 00 52 e5 00 52 65
    00000060: 70 75 62 6c 69 63 61 6e 00 2d 00 72 72 34 30 00
    00000070: 2d 00 4a 61 6e 20 32 30 2c 31 39 38 39 00 2d 00
    00000080: 4a 61 6e 20 32 30 2c 31 39 38 31 00 2d 00 34 30
    00000090: 74 68 00 2d 00 52 65 61 67 61 6e 00 2d 00 52 6f
    000000a0: 6e 61 6c 64 20 57 69 6c 73 6f 6e 00 2d d9 29 00
    000000b0: 58 e5 00 52 65 70 75 62 6c 69 63 61 6e 00 2d 00
    000000c0: 67 62 34 31 00 2d 00 4a 61 6e 20 32 30 2c 31 39
    000000d0: 39 33 00 2d 00 4a 61 6e 20 32 30 2c 31 39 38 39
    000000e0: 00 2d 00 34 31 73 74 00 2d 00 57 61 6c 6b 65 72
    000000f0: 20 42 75 73 68 00 2d 00 47 65 6f 72 67 65 20
  UrbLink              = 00000000
[630454 ms] UsbSnoop - DispatchAny(f8916610) : IRP_MJ_INTERNAL_DEVICE_CONTROL
[630454 ms] UsbSnoop - MyDispatchInternalIOCTL(f8917e80) : fdo=822eee08, Irp=81c2c5d8, IRQL=2
[630454 ms]  >>>  URB 962 going down  >>> 
-- URB_FUNCTION_BULK_OR_INTERRUPT_TRANSFER:
  PipeHandle           = 82300f14 [endpoint 0x00000002]
  TransferFlags        = 00000000 (USBD_TRANSFER_DIRECTION_OUT, ~USBD_SHORT_TRANSFER_OK)
  TransferBufferLength = 00000007
  TransferBuffer       = 00000000
  TransferBufferMDL    = 81b65b08
    00000000: 00 00 00 02 05 e0 00
  UrbLink              = 00000000
[630454 ms] UsbSnoop - MyInternalIOCTLCompletion(f8917db0) : fido=81b964f0, Irp=81c2c5d8, Context=81cb4e48, IRQL=2
[630454 ms]  <<<  URB 962 coming back  <<< 
-- URB_FUNCTION_BULK_OR_INTERRUPT_TRANSFER:
  PipeHandle           = 82300f14 [endpoint 0x00000002]
  TransferFlags        = 00000000 (USBD_TRANSFER_DIRECTION_OUT, ~USBD_SHORT_TRANSFER_OK)
  TransferBufferLength = 00000007
  TransferBuffer       = 00000000
  TransferBufferMDL    = 81b65b08
  UrbLink              = 00000000
[630464 ms] UsbSnoop - DispatchAny(f8916610) : IRP_MJ_INTERNAL_DEVICE_CONTROL
[630464 ms] UsbSnoop - MyDispatchInternalIOCTL(f8917e80) : fdo=822eee08, Irp=81c2c5d8, IRQL=2
[630464 ms]  >>>  URB 963 going down  >>> 
-- URB_FUNCTION_BULK_OR_INTERRUPT_TRANSFER:
  PipeHandle           = 82300ef4 [endpoint 0x00000081]
  TransferFlags        = 00000003 (USBD_TRANSFER_DIRECTION_IN, USBD_SHORT_TRANSFER_OK)
  TransferBufferLength = 00000100
  TransferBuffer       = 00000000
  TransferBufferMDL    = 81b65b08
  UrbLink              = 00000000
[630464 ms] UsbSnoop - MyInternalIOCTLCompletion(f8917db0) : fido=81b964f0, Irp=81c2c5d8, Context=81c3bfe8, IRQL=2
[630464 ms]  <<<  URB 963 coming back  <<< 
-- URB_FUNCTION_BULK_OR_INTERRUPT_TRANSFER:
  PipeHandle           = 82300ef4 [endpoint 0x00000081]
  TransferFlags        = 00000003 (USBD_TRANSFER_DIRECTION_IN, USBD_SHORT_TRANSFER_OK)
  TransferBufferLength = 00000005
  TransferBuffer       = 00000000
  TransferBufferMDL    = 81b65b08
    00000000: 00 00 03 ff 03
  UrbLink              = 00000000
[630494 ms] UsbSnoop - DispatchAny(f8916610) : IRP_MJ_INTERNAL_DEVICE_CONTROL
[630494 ms] UsbSnoop - MyDispatchInternalIOCTL(f8917e80) : fdo=822eee08, Irp=81c2c5d8, IRQL=2
[630494 ms]  >>>  URB 964 going down  >>> 
-- URB_FUNCTION_BULK_OR_INTERRUPT_TRANSFER:
  PipeHandle           = 82300ef4 [endpoint 0x00000081]
  TransferFlags        = 00000003 (USBD_TRANSFER_DIRECTION_IN, USBD_SHORT_TRANSFER_OK)
  TransferBufferLength = 00000100
  TransferBuffer       = 00000000
  TransferBufferMDL    = 81b65b08
  UrbLink              = 00000000
[630496 ms] UsbSnoop - MyInternalIOCTLCompletion(f8917db0) : fido=81b964f0, Irp=81c2c5d8, Context=81cb4e48, IRQL=2
[630496 ms]  <<<  URB 964 coming back  <<< 
-- URB_FUNCTION_BULK_OR_INTERRUPT_TRANSFER:
  PipeHandle           = 82300ef4 [endpoint 0x00000081]
  TransferFlags        = 00000003 (USBD_TRANSFER_DIRECTION_IN, USBD_SHORT_TRANSFER_OK)
  TransferBufferLength = 00000100
  TransferBuffer       = 00000000
  TransferBufferMDL    = 81b65b08
    00000000: 48 65 72 62 65 72 74 00 2d d9 2a 00 4e e5 00 44
    00000010: 65 6d 6f 63 72 61 74 00 2d 00 77 63 34 32 00 2d
    00000020: 00 4a 61 6e 20 32 30 2c 32 30 30 31 00 2d 00 4a
    00000030: 61 6e 20 32 30 2c 31 39 39 33 00 2d 00 34 32 6e
    00000040: 64 00 2d 00 43 6c 69 6e 74 6f 6e 00 2d 00 57 69
    00000050: 6c 6c 69 61 6d 20 4a 2e 00 2d d9 2b 00 48 e5 00
    00000060: 52 65 70 75 62 6c 69 63 61 6e 00 2d 00 67 62 34
    00000070: 33 00 2d 00 70 72 65 73 65 6e 74 00 2d 00 4a 61
    00000080: 6e 20 32 30 2c 32 30 30 31 00 2d 00 34 33 72 64
    00000090: 00 2d 00 42 75 73 68 00 2d 00 47 65 6f 72 67 65
    000000a0: 20 57 2e 00 2d d9 00 00 dd 02 c0 00 01 20 49 6e
    000000b0: 73 74 72 75 63 74 69 6f 6e 73 20 66 6f 72 20 75
    000000c0: 73 69 6e 67 20 74 68 65 0d 20 50 72 65 73 69 64
    000000d0: 65 6e 74 73 20 6f 66 20 54 68 65 20 55 6e 69 74
    000000e0: 65 64 20 53 74 61 74 65 73 0d 20 50 72 6f 67 72
    000000f0: 61 6d 20 66 6f 72 20 54 49 2d 38 39 2e 0d 20 0d
  UrbLink              = 00000000
[630524 ms] UsbSnoop - DispatchAny(f8916610) : IRP_MJ_INTERNAL_DEVICE_CONTROL
[630524 ms] UsbSnoop - MyDispatchInternalIOCTL(f8917e80) : fdo=822eee08, Irp=81c2c5d8, IRQL=2
[630524 ms]  >>>  URB 965 going down  >>> 
-- URB_FUNCTION_BULK_OR_INTERRUPT_TRANSFER:
  PipeHandle           = 82300ef4 [endpoint 0x00000081]
  TransferFlags        = 00000003 (USBD_TRANSFER_DIRECTION_IN, USBD_SHORT_TRANSFER_OK)
  TransferBufferLength = 00000100
  TransferBuffer       = 00000000
  TransferBufferMDL    = 81b65b08
  UrbLink              = 00000000
[630526 ms] UsbSnoop - MyInternalIOCTLCompletion(f8917db0) : fido=81b964f0, Irp=81c2c5d8, Context=81cdfe48, IRQL=2
[630526 ms]  <<<  URB 965 coming back  <<< 
-- URB_FUNCTION_BULK_OR_INTERRUPT_TRANSFER:
  PipeHandle           = 82300ef4 [endpoint 0x00000081]
  TransferFlags        = 00000003 (USBD_TRANSFER_DIRECTION_IN, USBD_SHORT_TRANSFER_OK)
  TransferBufferLength = 00000100
  TransferBuffer       = 00000000
  TransferBufferMDL    = 81b65b08
    00000000: 20 31 29 20 4c 6f 61 64 20 74 68 65 20 67 72 6f
    00000010: 75 70 20 66 69 6c 65 20 74 6f 20 79 6f 75 72 20
    00000020: 63 61 6c 63 75 6c 61 74 6f 72 0d 20 76 69 61 20
    00000030: 54 49 2d 47 72 61 70 68 20 4c 69 6e 6b 2e 0d 20
    00000040: 0d 20 32 29 20 52 75 6e 20 74 68 65 20 70 72 6f
    00000050: 67 72 61 6d 20 27 70 6f 74 75 73 5c 70 6f 74 75
    00000060: 73 28 29 27 0d 20 0d 20 33 29 20 57 69 74 68 69
    00000070: 6e 20 74 68 65 20 70 72 6f 67 72 61 6d 2c 20 74
    00000080: 68 65 20 66 6f 6c 6c 6f 77 69 6e 67 0d 20 6b 65
    00000090: 79 73 20 70 65 72 66 6f 72 6d 20 74 68 65 73 65
    000000a0: 20 61 63 74 69 6f 6e 73 3a 0d 20 0d 20 20 20 41
    000000b0: 29 20 27 51 27 20 71 75 69 74 73 20 74 68 65 20
    000000c0: 70 72 6f 67 72 61 6d 0d 20 20 20 42 29 20 27 45
    000000d0: 53 43 27 20 71 75 69 74 73 20 74 68 65 20 70 72
    000000e0: 6f 67 72 61 6d 0d 20 20 20 43 29 20 27 51 55 49
    000000f0: 54 27 20 28 32 6e 64 20 45 53 43 29 20 71 75 69
  UrbLink              = 00000000
[630554 ms] UsbSnoop - DispatchAny(f8916610) : IRP_MJ_INTERNAL_DEVICE_CONTROL
[630554 ms] UsbSnoop - MyDispatchInternalIOCTL(f8917e80) : fdo=822eee08, Irp=81c2c5d8, IRQL=2
[630554 ms]  >>>  URB 966 going down  >>> 
-- URB_FUNCTION_BULK_OR_INTERRUPT_TRANSFER:
  PipeHandle           = 82300ef4 [endpoint 0x00000081]
  TransferFlags        = 00000003 (USBD_TRANSFER_DIRECTION_IN, USBD_SHORT_TRANSFER_OK)
  TransferBufferLength = 00000100
  TransferBuffer       = 00000000
  TransferBufferMDL    = 81b65b08
  UrbLink              = 00000000
[630556 ms] UsbSnoop - MyInternalIOCTLCompletion(f8917db0) : fido=81b964f0, Irp=81c2c5d8, Context=81abee68, IRQL=2
[630556 ms]  <<<  URB 966 coming back  <<< 
-- URB_FUNCTION_BULK_OR_INTERRUPT_TRANSFER:
  PipeHandle           = 82300ef4 [endpoint 0x00000081]
  TransferFlags        = 00000003 (USBD_TRANSFER_DIRECTION_IN, USBD_SHORT_TRANSFER_OK)
  TransferBufferLength = 00000100
  TransferBuffer       = 00000000
  TransferBufferMDL    = 81b65b08
    00000000: 74 73 20 74 68 65 20 70 72 6f 67 72 61 6d 0d 20
    00000010: 20 20 44 29 20 45 4e 54 45 52 20 61 64 76 61 6e
    00000020: 63 65 73 20 74 6f 20 74 68 65 20 6e 65 78 74 20
    00000030: 50 72 65 73 69 64 65 6e 74 0d 20 20 20 45 29 20
    00000040: 44 4f 57 4e 20 61 72 72 6f 77 20 61 64 76 61 6e
    00000050: 63 65 73 20 74 6f 20 74 68 65 20 6e 65 78 74 20
    00000060: 50 72 65 73 69 64 65 6e 74 0d 20 20 20 46 29 20
    00000070: 55 50 20 61 72 72 6f 77 20 72 65 74 72 65 61 74
    00000080: 73 20 74 6f 20 74 68 65 20 70 72 65 76 69 6f 75
    00000090: 73 20 50 72 65 73 69 64 65 6e 74 0d 20 20 20 47
    000000a0: 29 20 4e 75 6d 62 65 72 20 6b 65 79 73 20 28 61
    000000b0: 6e 64 20 63 6f 6d 62 6f 73 29 20 73 65 6c 65 63
    000000c0: 74 20 74 68 65 20 73 70 65 63 69 66 69 65 64 0d
    000000d0: 20 20 20 20 20 20 50 72 65 73 69 64 65 6e 74 20
    000000e0: 28 69 2e 65 20 31 2b 37 20 3d 20 31 37 74 68 20
    000000f0: 50 72 65 73 69 64 65 6e 74 29 0d 20 0d 20 50 72
  UrbLink              = 00000000
[630584 ms] UsbSnoop - DispatchAny(f8916610) : IRP_MJ_INTERNAL_DEVICE_CONTROL
[630584 ms] UsbSnoop - MyDispatchInternalIOCTL(f8917e80) : fdo=822eee08, Irp=81c2c5d8, IRQL=2
[630584 ms]  >>>  URB 967 going down  >>> 
-- URB_FUNCTION_BULK_OR_INTERRUPT_TRANSFER:
  PipeHandle           = 82300ef4 [endpoint 0x00000081]
  TransferFlags        = 00000003 (USBD_TRANSFER_DIRECTION_IN, USBD_SHORT_TRANSFER_OK)
  TransferBufferLength = 00000100
  TransferBuffer       = 00000000
  TransferBufferMDL    = 81b65b08
  UrbLink              = 00000000
[630586 ms] UsbSnoop - MyInternalIOCTLCompletion(f8917db0) : fido=81b964f0, Irp=81c2c5d8, Context=81cb4e48, IRQL=2
[630586 ms]  <<<  URB 967 coming back  <<< 
-- URB_FUNCTION_BULK_OR_INTERRUPT_TRANSFER:
  PipeHandle           = 82300ef4 [endpoint 0x00000081]
  TransferFlags        = 00000003 (USBD_TRANSFER_DIRECTION_IN, USBD_SHORT_TRANSFER_OK)
  TransferBufferLength = 000000ff
  TransferBuffer       = 00000000
  TransferBufferMDL    = 81b65b08
    00000000: 65 73 69 64 65 6e 74 73 20 6f 66 20 54 68 65 20
    00000010: 55 6e 69 74 65 64 20 53 74 61 74 65 73 20 69 73
    00000020: 0d 20 a9 31 39 39 39 2d 32 30 30 31 20 62 79 20
    00000030: 53 74 65 70 68 65 6e 20 52 65 69 64 0d 20 20 65
    00000040: 6d 61 69 6c 3a 20 73 72 65 69 64 40 61 69 72 6d
    00000050: 61 69 6c 2e 6e 65 74 0d 20 0d 20 45 6e 6a 6f 79
    00000060: 21 0d 20 0d 20 0d 20 0d 20 00 e0 02 55 00 4a 00
    00000070: 3b 00 00 00 00 00 00 00 00 00 00 00 00 00 00 00
    00000080: 00 00 00 00 1f c0 00 00 00 00 00 01 3f e0 00 00
    00000090: 00 00 00 00 e3 f0 00 00 00 00 00 02 cb ff 00 00
    000000a0: 00 00 00 05 93 ff c0 00 00 00 00 0f 27 5f f0 00
    000000b0: 00 00 00 1f ec 7f f0 00 00 00 00 fe 7f e7 f0 00
    000000c0: 00 00 01 f0 1f ff f8 00 00 00 03 f0 01 ff f0 00
    000000d0: 00 00 07 c0 00 03 f0 00 00 00 0f 80 00 00 78 00
    000000e0: 00 00 0f 00 00 00 3c 00 00 00 1e 00 00 00 0c 00
    000000f0: 00 00 1c 00 00 00 0e 00 00 00 38 00 00 00 0e
  UrbLink              = 00000000
[630615 ms] UsbSnoop - DispatchAny(f8916610) : IRP_MJ_INTERNAL_DEVICE_CONTROL
[630615 ms] UsbSnoop - MyDispatchInternalIOCTL(f8917e80) : fdo=822eee08, Irp=81c2c5d8, IRQL=2
[630615 ms]  >>>  URB 968 going down  >>> 
-- URB_FUNCTION_BULK_OR_INTERRUPT_TRANSFER:
  PipeHandle           = 82300f14 [endpoint 0x00000002]
  TransferFlags        = 00000000 (USBD_TRANSFER_DIRECTION_OUT, ~USBD_SHORT_TRANSFER_OK)
  TransferBufferLength = 00000007
  TransferBuffer       = 00000000
  TransferBufferMDL    = 81b65b08
    00000000: 00 00 00 02 05 e0 00
  UrbLink              = 00000000
[630615 ms] UsbSnoop - MyInternalIOCTLCompletion(f8917db0) : fido=81b964f0, Irp=81c2c5d8, Context=81cdfe48, IRQL=2
[630615 ms]  <<<  URB 968 coming back  <<< 
-- URB_FUNCTION_BULK_OR_INTERRUPT_TRANSFER:
  PipeHandle           = 82300f14 [endpoint 0x00000002]
  TransferFlags        = 00000000 (USBD_TRANSFER_DIRECTION_OUT, ~USBD_SHORT_TRANSFER_OK)
  TransferBufferLength = 00000007
  TransferBuffer       = 00000000
  TransferBufferMDL    = 81b65b08
  UrbLink              = 00000000
[630624 ms] UsbSnoop - DispatchAny(f8916610) : IRP_MJ_INTERNAL_DEVICE_CONTROL
[630624 ms] UsbSnoop - MyDispatchInternalIOCTL(f8917e80) : fdo=822eee08, Irp=81c2c5d8, IRQL=2
[630624 ms]  >>>  URB 969 going down  >>> 
-- URB_FUNCTION_BULK_OR_INTERRUPT_TRANSFER:
  PipeHandle           = 82300ef4 [endpoint 0x00000081]
  TransferFlags        = 00000003 (USBD_TRANSFER_DIRECTION_IN, USBD_SHORT_TRANSFER_OK)
  TransferBufferLength = 00000100
  TransferBuffer       = 00000000
  TransferBufferMDL    = 81b65b08
  UrbLink              = 00000000
[630624 ms] UsbSnoop - MyInternalIOCTLCompletion(f8917db0) : fido=81b964f0, Irp=81c2c5d8, Context=81cb4e48, IRQL=2
[630624 ms]  <<<  URB 969 coming back  <<< 
-- URB_FUNCTION_BULK_OR_INTERRUPT_TRANSFER:
  PipeHandle           = 82300ef4 [endpoint 0x00000081]
  TransferFlags        = 00000003 (USBD_TRANSFER_DIRECTION_IN, USBD_SHORT_TRANSFER_OK)
  TransferBufferLength = 00000005
  TransferBuffer       = 00000000
  TransferBufferMDL    = 81b65b08
    00000000: 00 00 03 ff 03
  UrbLink              = 00000000
[630654 ms] UsbSnoop - DispatchAny(f8916610) : IRP_MJ_INTERNAL_DEVICE_CONTROL
[630654 ms] UsbSnoop - MyDispatchInternalIOCTL(f8917e80) : fdo=822eee08, Irp=81c2c5d8, IRQL=2
[630654 ms]  >>>  URB 970 going down  >>> 
-- URB_FUNCTION_BULK_OR_INTERRUPT_TRANSFER:
  PipeHandle           = 82300ef4 [endpoint 0x00000081]
  TransferFlags        = 00000003 (USBD_TRANSFER_DIRECTION_IN, USBD_SHORT_TRANSFER_OK)
  TransferBufferLength = 00000100
  TransferBuffer       = 00000000
  TransferBufferMDL    = 81b65b08
  UrbLink              = 00000000
[630656 ms] UsbSnoop - MyInternalIOCTLCompletion(f8917db0) : fido=81b964f0, Irp=81c2c5d8, Context=81c3bfe8, IRQL=2
[630656 ms]  <<<  URB 970 coming back  <<< 
-- URB_FUNCTION_BULK_OR_INTERRUPT_TRANSFER:
  PipeHandle           = 82300ef4 [endpoint 0x00000081]
  TransferFlags        = 00000003 (USBD_TRANSFER_DIRECTION_IN, USBD_SHORT_TRANSFER_OK)
  TransferBufferLength = 00000100
  TransferBuffer       = 00000000
  TransferBufferMDL    = 81b65b08
    00000000: 00 00 00 30 00 00 00 0f 00 00 00 30 00 00 00 07
    00000010: 00 00 00 70 00 00 00 07 00 00 00 60 00 00 00 07
    00000020: 00 00 00 c8 00 00 00 07 00 00 00 c8 00 00 00 07
    00000030: 00 00 00 c8 00 00 00 07 00 00 00 c4 00 00 00 07
    00000040: 00 00 00 e4 00 00 00 07 00 00 00 66 00 08 02 0f
    00000050: 00 00 00 c6 01 ff 7f ee 00 00 01 fa 03 fe 7f ee
    00000060: 00 00 01 cf 07 fc 3f ee 00 00 01 ef 0d b8 3e ee
    00000070: 00 00 01 e7 08 00 38 6e 00 00 01 ff 00 70 06 8e
    00000080: 00 00 00 ef 00 00 14 0e 00 00 00 3f 00 00 10 0e
    00000090: 00 00 00 3f 00 00 08 0e 00 00 00 3f 00 00 08 0e
    000000a0: 00 00 00 16 00 00 0c 3e 00 00 00 02 00 08 0d fe
    000000b0: 00 00 00 03 00 1f 0f fc 00 00 00 07 80 23 7b fc
    000000c0: 00 00 00 0f 80 41 f9 fe 00 00 00 07 80 87 fc fd
    000000d0: 00 00 00 03 e0 1d ff fc 00 00 00 03 f6 7f ff fe
    000000e0: 00 00 00 07 f6 df ff fe 00 00 00 03 f7 df ff fe
    000000f0: 00 00 00 07 fe bf ff fc 00 00 00 07 ff ff bf fc
  UrbLink              = 00000000
[630684 ms] UsbSnoop - DispatchAny(f8916610) : IRP_MJ_INTERNAL_DEVICE_CONTROL
[630684 ms] UsbSnoop - MyDispatchInternalIOCTL(f8917e80) : fdo=822eee08, Irp=81c2c5d8, IRQL=2
[630684 ms]  >>>  URB 971 going down  >>> 
-- URB_FUNCTION_BULK_OR_INTERRUPT_TRANSFER:
  PipeHandle           = 82300ef4 [endpoint 0x00000081]
  TransferFlags        = 00000003 (USBD_TRANSFER_DIRECTION_IN, USBD_SHORT_TRANSFER_OK)
  TransferBufferLength = 00000100
  TransferBuffer       = 00000000
  TransferBufferMDL    = 81b65b08
  UrbLink              = 00000000
[630686 ms] UsbSnoop - MyInternalIOCTLCompletion(f8917db0) : fido=81b964f0, Irp=81c2c5d8, Context=81b4ccc0, IRQL=2
[630686 ms]  <<<  URB 971 coming back  <<< 
-- URB_FUNCTION_BULK_OR_INTERRUPT_TRANSFER:
  PipeHandle           = 82300ef4 [endpoint 0x00000081]
  TransferFlags        = 00000003 (USBD_TRANSFER_DIRECTION_IN, USBD_SHORT_TRANSFER_OK)
  TransferBufferLength = 00000100
  TransferBuffer       = 00000000
  TransferBufferMDL    = 81b65b08
    00000000: 00 00 00 07 fb 7b bf fe 00 00 00 07 ff fa 77 fc
    00000010: 00 00 00 03 ff f8 7f fc 00 00 00 03 7f f2 df fc
    00000020: 00 00 00 06 7f f6 fd fc 00 00 00 0e 7f f7 fc fc
    00000030: 00 00 00 0e 1f fb fb f8 00 00 00 1f 0f bb ff f0
    00000040: 00 00 00 3f 87 bf 7f d0 00 00 00 3f c3 df ff f8
    00000050: 00 00 00 ff e0 ff ff fc 00 00 01 ff f0 7f fb be
    00000060: 00 00 07 ff fc 03 fe 3f 00 00 0f ff fe 61 88 3f
    00000070: 80 00 3f ff ff ff e6 7f e0 00 7f ff f5 ff ff ff
    00000080: f8 00 ff ff f7 9f ff ff ff 00 ff ff e2 7f ff ff
    00000090: ff c0 ff ff f0 ff ff ff ff e0 ff ff ff ff ff ff
    000000a0: ff e0 ff ff ff ff ff ff ff e0 ff ff ff ff e7 ff
    000000b0: ff e0 fb ff ff ff f1 ff ff e0 fb ff ff ff fc ff
    000000c0: ff e0 df 02 0b 00 4a 00 38 00 00 00 00 00 00 00
    000000d0: 00 00 00 0f c0 00 00 00 00 03 ff fc 00 00 00 00
    000000e0: 1f ff ff 80 00 00 00 7f ff ff c0 00 00 00 ff ff
    000000f0: ff e0 00 00 01 ff ff ff f0 00 00 03 ff ff ff f8
  UrbLink              = 00000000
[630714 ms] UsbSnoop - DispatchAny(f8916610) : IRP_MJ_INTERNAL_DEVICE_CONTROL
[630714 ms] UsbSnoop - MyDispatchInternalIOCTL(f8917e80) : fdo=822eee08, Irp=81c2c5d8, IRQL=2
[630714 ms]  >>>  URB 972 going down  >>> 
-- URB_FUNCTION_BULK_OR_INTERRUPT_TRANSFER:
  PipeHandle           = 82300ef4 [endpoint 0x00000081]
  TransferFlags        = 00000003 (USBD_TRANSFER_DIRECTION_IN, USBD_SHORT_TRANSFER_OK)
  TransferBufferLength = 00000100
  TransferBuffer       = 00000000
  TransferBufferMDL    = 81b65b08
  UrbLink              = 00000000
[630716 ms] UsbSnoop - MyInternalIOCTLCompletion(f8917db0) : fido=81b964f0, Irp=81c2c5d8, Context=81cb4e48, IRQL=2
[630716 ms]  <<<  URB 972 coming back  <<< 
-- URB_FUNCTION_BULK_OR_INTERRUPT_TRANSFER:
  PipeHandle           = 82300ef4 [endpoint 0x00000081]
  TransferFlags        = 00000003 (USBD_TRANSFER_DIRECTION_IN, USBD_SHORT_TRANSFER_OK)
  TransferBufferLength = 00000100
  TransferBuffer       = 00000000
  TransferBufferMDL    = 81b65b08
    00000000: 00 00 07 ff ff ff fc 00 00 0f ff ff ff fe 00 00
    00000010: 1f ff ff ff ff 00 00 1f ff ff ff ff 80 00 3f ff
    00000020: fd ff ff c0 00 3f ff c0 9f ff c0 00 3f ff c0 03
    00000030: f3 e0 00 7f ff c0 00 01 e0 00 7f ff c0 00 01 f0
    00000040: 00 7f ff c0 00 01 f0 00 7f ff 80 00 00 f0 00 7f
    00000050: ff 00 00 00 f0 00 ff fe 00 00 00 f0 00 ff ff 00
    00000060: 00 00 f0 00 ff ff 00 00 00 f0 00 ff ff 00 00 00
    00000070: f0 00 ff ff 00 00 00 f0 00 ff ff 00 00 00 e0 00
    00000080: ff fe 00 00 00 e0 03 ff ff 00 00 01 e0 07 ff ff
    00000090: c0 00 01 c0 07 ff ff f0 00 01 80 07 ff ff fe 00
    000000a0: 01 80 07 ff ff ff 00 01 00 07 ff ff df 03 cf 00
    000000b0: 07 ff ff 87 07 ff 00 07 ff b8 03 07 fe 00 07 ff
    000000c0: 90 03 00 48 00 03 ff c0 03 00 00 00 03 ff c0 07
    000000d0: 00 00 00 03 ff e0 0f 80 00 00 01 ff f0 0f 80 00
    000000e0: 00 00 ff f0 07 00 00 00 00 ff f0 1f 00 00 00 00
    000000f0: 7f f0 3f 00 00 00 00 3f f0 7f 00 00 00 00 3f f0
  UrbLink              = 00000000
[630744 ms] UsbSnoop - DispatchAny(f8916610) : IRP_MJ_INTERNAL_DEVICE_CONTROL
[630744 ms] UsbSnoop - MyDispatchInternalIOCTL(f8917e80) : fdo=822eee08, Irp=81c2c5d8, IRQL=2
[630744 ms]  >>>  URB 973 going down  >>> 
-- URB_FUNCTION_BULK_OR_INTERRUPT_TRANSFER:
  PipeHandle           = 82300ef4 [endpoint 0x00000081]
  TransferFlags        = 00000003 (USBD_TRANSFER_DIRECTION_IN, USBD_SHORT_TRANSFER_OK)
  TransferBufferLength = 00000100
  TransferBuffer       = 00000000
  TransferBufferMDL    = 81b65b08
  UrbLink              = 00000000
[630746 ms] UsbSnoop - MyInternalIOCTLCompletion(f8917db0) : fido=81b964f0, Irp=81c2c5d8, Context=81c3bfe8, IRQL=2
[630746 ms]  <<<  URB 973 coming back  <<< 
-- URB_FUNCTION_BULK_OR_INTERRUPT_TRANSFER:
  PipeHandle           = 82300ef4 [endpoint 0x00000081]
  TransferFlags        = 00000003 (USBD_TRANSFER_DIRECTION_IN, USBD_SHORT_TRANSFER_OK)
  TransferBufferLength = 000000ff
  TransferBuffer       = 00000000
  TransferBufferMDL    = 81b65b08
    00000000: 7f 00 00 00 00 3f f0 7f 00 00 00 00 3f f0 3f 80
    00000010: 00 00 00 3f f0 3f e0 00 00 00 7f e2 ff 80 00 00
    00000020: 00 ff e7 f0 00 00 00 00 ff e7 fc 00 00 00 01 ff
    00000030: f1 ff 80 00 00 03 ff f0 7d fe 00 00 07 ff f0 78
    00000040: 00 00 00 07 ff f0 78 00 00 00 0f ff f1 fc 00 00
    00000050: 00 1f ff f9 7c 00 00 00 7f ff ff 30 00 7c 00 ff
    00000060: ff ff 80 00 ff 80 ff ff ff 80 01 ff f0 ff ff ff
    00000070: f0 07 ff fe ff ff ff f8 07 ff ff ff ff ff fc 07
    00000080: ff ff ff ff ff ff 87 ff ff ff ff ff ff 03 ff ff
    00000090: ff ff fe 38 03 ff ff ff ff 80 00 03 ff ff ff ff
    000000a0: 80 01 03 ff ff ff ff 80 07 c3 ff ff ff ff c0 07
    000000b0: e3 ff ff ff ff c0 0f f3 ff ff ff ff e0 0f f3 ff
    000000c0: ff ff ff e0 1f f3 ff ff ff ff f0 1f fb ff ff df
    000000d0: 02 55 00 4a 00 3a 01 fc ff ff f3 ff ff 00 19 fe
    000000e0: 7f ff ff ff f3 00 93 fc 3f ff ff ff c2 00 03 ce
    000000f0: 7f e0 00 ff 86 00 03 89 ff e0 00 3f 07 c0 f1
  UrbLink              = 00000000
[630774 ms] UsbSnoop - DispatchAny(f8916610) : IRP_MJ_INTERNAL_DEVICE_CONTROL
[630774 ms] UsbSnoop - MyDispatchInternalIOCTL(f8917e80) : fdo=822eee08, Irp=81c873d8, IRQL=2
[630774 ms]  >>>  URB 974 going down  >>> 
-- URB_FUNCTION_BULK_OR_INTERRUPT_TRANSFER:
  PipeHandle           = 82300f14 [endpoint 0x00000002]
  TransferFlags        = 00000000 (USBD_TRANSFER_DIRECTION_OUT, ~USBD_SHORT_TRANSFER_OK)
  TransferBufferLength = 00000007
  TransferBuffer       = 00000000
  TransferBufferMDL    = 81b65b08
    00000000: 00 00 00 02 05 e0 00
  UrbLink              = 00000000
[630775 ms] UsbSnoop - MyInternalIOCTLCompletion(f8917db0) : fido=81b964f0, Irp=81c873d8, Context=81b4ccc0, IRQL=2
[630775 ms]  <<<  URB 974 coming back  <<< 
-- URB_FUNCTION_BULK_OR_INTERRUPT_TRANSFER:
  PipeHandle           = 82300f14 [endpoint 0x00000002]
  TransferFlags        = 00000000 (USBD_TRANSFER_DIRECTION_OUT, ~USBD_SHORT_TRANSFER_OK)
  TransferBufferLength = 00000007
  TransferBuffer       = 00000000
  TransferBufferMDL    = 81b65b08
  UrbLink              = 00000000
[630784 ms] UsbSnoop - DispatchAny(f8916610) : IRP_MJ_INTERNAL_DEVICE_CONTROL
[630784 ms] UsbSnoop - MyDispatchInternalIOCTL(f8917e80) : fdo=822eee08, Irp=81c2c5d8, IRQL=2
[630784 ms]  >>>  URB 975 going down  >>> 
-- URB_FUNCTION_BULK_OR_INTERRUPT_TRANSFER:
  PipeHandle           = 82300ef4 [endpoint 0x00000081]
  TransferFlags        = 00000003 (USBD_TRANSFER_DIRECTION_IN, USBD_SHORT_TRANSFER_OK)
  TransferBufferLength = 00000100
  TransferBuffer       = 00000000
  TransferBufferMDL    = 81b65b08
  UrbLink              = 00000000
[630784 ms] UsbSnoop - MyInternalIOCTLCompletion(f8917db0) : fido=81b964f0, Irp=81c2c5d8, Context=81c3bfe8, IRQL=2
[630784 ms]  <<<  URB 975 coming back  <<< 
-- URB_FUNCTION_BULK_OR_INTERRUPT_TRANSFER:
  PipeHandle           = 82300ef4 [endpoint 0x00000081]
  TransferFlags        = 00000003 (USBD_TRANSFER_DIRECTION_IN, USBD_SHORT_TRANSFER_OK)
  TransferBufferLength = 00000005
  TransferBuffer       = 00000000
  TransferBufferMDL    = 81b65b08
    00000000: 00 00 03 ff 03
  UrbLink              = 00000000
[630814 ms] UsbSnoop - DispatchAny(f8916610) : IRP_MJ_INTERNAL_DEVICE_CONTROL
[630814 ms] UsbSnoop - MyDispatchInternalIOCTL(f8917e80) : fdo=822eee08, Irp=81c2c5d8, IRQL=2
[630814 ms]  >>>  URB 976 going down  >>> 
-- URB_FUNCTION_BULK_OR_INTERRUPT_TRANSFER:
  PipeHandle           = 82300ef4 [endpoint 0x00000081]
  TransferFlags        = 00000003 (USBD_TRANSFER_DIRECTION_IN, USBD_SHORT_TRANSFER_OK)
  TransferBufferLength = 00000100
  TransferBuffer       = 00000000
  TransferBufferMDL    = 81b65b08
  UrbLink              = 00000000
[630816 ms] UsbSnoop - MyInternalIOCTLCompletion(f8917db0) : fido=81b964f0, Irp=81c2c5d8, Context=822f3898, IRQL=2
[630816 ms]  <<<  URB 976 coming back  <<< 
-- URB_FUNCTION_BULK_OR_INTERRUPT_TRANSFER:
  PipeHandle           = 82300ef4 [endpoint 0x00000081]
  TransferFlags        = 00000003 (USBD_TRANSFER_DIRECTION_IN, USBD_SHORT_TRANSFER_OK)
  TransferBufferLength = 00000100
  TransferBuffer       = 00000000
  TransferBufferMDL    = 81b65b08
    00000000: 83 fe 60 00 0f e3 c0 f9 83 c4 40 00 07 e7 c0 ff
    00000010: 0f 86 7b 00 03 ef c0 cf 9f 06 3f bf c1 ff c0 ef
    00000020: 0f c6 2f ff c8 ff c0 ff 3f c2 3f ff fc 7f c0 ff
    00000030: 7f 02 3d ff fe 7f c0 3f fe 00 3f ff fe 3f c0 ff
    00000040: fe 00 07 ff ff 3f c0 ff dc 00 01 ff ff 3f c0 ff
    00000050: 9e 80 00 ff ff 1f c0 fe 1c 00 00 1f ff 1f c0 c6
    00000060: 3c 00 00 07 ff 9f c0 c7 bc 00 00 01 ff 9f c0 cf
    00000070: fc 00 00 01 ff 8d c0 3f f8 00 00 00 ff 2f c0 ff
    00000080: f8 00 00 00 7f 3f c0 ff 70 00 00 00 3f 3f c0 fe
    00000090: 70 00 00 00 1f 9f c0 00 70 00 00 00 1f ff c0 80
    000000a0: 70 1f 00 00 0f ff c0 ff f0 01 80 00 0f f0 00 ff
    000000b0: f0 00 00 1f 8f ff c0 ff 70 04 00 1f cf ff c0 ff
    000000c0: 60 0f 43 80 c7 ff c0 ff a0 07 c3 80 67 ff c0 ff
    000000d0: 00 01 83 ef 07 ff c0 ff 00 06 03 ef 87 ff c0 ff
    000000e0: 00 04 01 e1 83 ff c0 ff 00 00 01 f9 c3 9f c0 ff
    000000f0: 00 00 00 fc 03 bf c0 ff 00 00 00 f0 03 ff c0 ff
  UrbLink              = 00000000
[630844 ms] UsbSnoop - DispatchAny(f8916610) : IRP_MJ_INTERNAL_DEVICE_CONTROL
[630844 ms] UsbSnoop - MyDispatchInternalIOCTL(f8917e80) : fdo=822eee08, Irp=81c2c5d8, IRQL=2
[630844 ms]  >>>  URB 977 going down  >>> 
-- URB_FUNCTION_BULK_OR_INTERRUPT_TRANSFER:
  PipeHandle           = 82300ef4 [endpoint 0x00000081]
  TransferFlags        = 00000003 (USBD_TRANSFER_DIRECTION_IN, USBD_SHORT_TRANSFER_OK)
  TransferBufferLength = 00000100
  TransferBuffer       = 00000000
  TransferBufferMDL    = 81b65b08
  UrbLink              = 00000000
[630846 ms] UsbSnoop - MyInternalIOCTLCompletion(f8917db0) : fido=81b964f0, Irp=81c2c5d8, Context=81b4ccc0, IRQL=2
[630846 ms]  <<<  URB 977 coming back  <<< 
-- URB_FUNCTION_BULK_OR_INTERRUPT_TRANSFER:
  PipeHandle           = 82300ef4 [endpoint 0x00000081]
  TransferFlags        = 00000003 (USBD_TRANSFER_DIRECTION_IN, USBD_SHORT_TRANSFER_OK)
  TransferBufferLength = 00000100
  TransferBuffer       = 00000000
  TransferBufferMDL    = 81b65b08
    00000000: 00 03 01 f8 03 ff c0 ff 00 0e 00 fc 03 ff c0 ff
    00000010: 00 1c 40 fe 03 7f c0 ff 00 30 07 fe 01 7f c0 f3
    00000020: 00 60 0f fe 03 7f c0 f3 00 40 07 f7 03 7f c0 e7
    00000030: 80 c0 03 f3 c0 7f c0 c7 90 80 03 fb c0 ff c0 07
    00000040: f0 d8 07 fb 80 ff c0 07 f0 48 0f f9 81 ff c0 87
    00000050: f0 00 07 f9 89 ff c0 ff f0 00 cf f3 09 ff c0 ff
    00000060: f8 00 01 f3 1f ff c0 ff f8 00 06 77 bf ff c0 ff
    00000070: f8 00 06 f7 ff ff c0 ff f8 00 07 ff df ff c0 ff
    00000080: f8 00 0f ff ff ff c0 ff f8 00 05 3f ff ff c0 ff
    00000090: b8 00 02 3f bf ff c0 ff 38 00 0c 7f bf ff c0 fc
    000000a0: 3c 00 07 ff bf ff c0 fc 78 00 0f ff bf ff c0 fe
    000000b0: 38 00 1f ff 17 ff c0 ff f0 00 bf ff 1b ff c0 c3
    000000c0: f0 01 ff fe 1c ff c0 0f f0 01 f7 fc 1e 3f c0 ff
    000000d0: f0 03 f3 f8 3f 9f c0 ff e0 03 b3 f0 3f f7 c0 ff
    000000e0: e0 00 33 c0 3f ff c0 ff e0 00 37 80 3f ff c0 ff
    000000f0: e0 20 37 00 7f ff c0 ff e0 10 7e 00 7f ff c0 ff
  UrbLink              = 00000000
[630874 ms] UsbSnoop - DispatchAny(f8916610) : IRP_MJ_INTERNAL_DEVICE_CONTROL
[630874 ms] UsbSnoop - MyDispatchInternalIOCTL(f8917e80) : fdo=822eee08, Irp=81c2c5d8, IRQL=2
[630874 ms]  >>>  URB 978 going down  >>> 
-- URB_FUNCTION_BULK_OR_INTERRUPT_TRANSFER:
  PipeHandle           = 82300ef4 [endpoint 0x00000081]
  TransferFlags        = 00000003 (USBD_TRANSFER_DIRECTION_IN, USBD_SHORT_TRANSFER_OK)
  TransferBufferLength = 00000100
  TransferBuffer       = 00000000
  TransferBufferMDL    = 81b65b08
  UrbLink              = 00000000
[630876 ms] UsbSnoop - MyInternalIOCTLCompletion(f8917db0) : fido=81b964f0, Irp=81c2c5d8, Context=81cb4e48, IRQL=2
[630876 ms]  <<<  URB 978 coming back  <<< 
-- URB_FUNCTION_BULK_OR_INTERRUPT_TRANSFER:
  PipeHandle           = 82300ef4 [endpoint 0x00000081]
  TransferFlags        = 00000003 (USBD_TRANSFER_DIRECTION_IN, USBD_SHORT_TRANSFER_OK)
  TransferBufferLength = 00000100
  TransferBuffer       = 00000000
  TransferBufferMDL    = 81b65b08
    00000000: e0 18 7c 00 ff ff c0 ff e0 08 78 00 ff ff c0 ff
    00000010: e0 04 e0 00 ff ff c0 ff e0 07 c0 00 ff ff c0 ff
    00000020: e0 1f e0 01 ff ff c0 df 02 55 00 4a 00 3c ff ff
    00000030: ff ff ff ff f6 f0 ff ff ff ed ff ff ff f0 ff ff
    00000040: ef d3 fe ff fe 70 ff ff f0 00 03 ff ff d0 ff ff
    00000050: 80 00 00 1f ff e0 ff ff 00 00 00 07 ff e0 ff fe
    00000060: 40 00 00 00 ff 60 ff fe 00 00 00 00 ef d0 ff f4
    00000070: 80 00 02 00 37 50 ff fc 00 00 02 10 9e f0 ff f6
    00000080: 00 00 01 20 5e d0 ff fc 90 00 80 40 7f e0 ff f9
    00000090: 20 00 20 09 13 a0 ff f8 00 00 41 84 1b f0 ff f8
    000000a0: 00 00 05 e2 0c e0 ff fc 00 00 07 00 86 f0 ff fc
    000000b0: 00 00 00 00 1b 70 ff f8 00 00 00 00 17 f0 ff f4
    000000c0: 80 00 0c 0c d7 70 ff e8 00 00 09 08 5f 70 ff c8
    000000d0: 00 00 02 13 bb 70 fc 80 00 00 0c 3b fe c0 ff 80
    000000e0: 00 00 04 1d f9 60 ff 08 00 00 05 25 f9 30 fb 1e
    000000f0: e0 38 bd 20 16 30 f8 0f f0 7f 7e 00 1f 00 fe 0a
  UrbLink              = 00000000
[630906 ms] UsbSnoop - DispatchAny(f8916610) : IRP_MJ_INTERNAL_DEVICE_CONTROL
[630906 ms] UsbSnoop - MyDispatchInternalIOCTL(f8917e80) : fdo=822eee08, Irp=81c2c5d8, IRQL=2
[630906 ms]  >>>  URB 979 going down  >>> 
-- URB_FUNCTION_BULK_OR_INTERRUPT_TRANSFER:
  PipeHandle           = 82300ef4 [endpoint 0x00000081]
  TransferFlags        = 00000003 (USBD_TRANSFER_DIRECTION_IN, USBD_SHORT_TRANSFER_OK)
  TransferBufferLength = 00000100
  TransferBuffer       = 00000000
  TransferBufferMDL    = 81b65b08
  UrbLink              = 00000000
[630907 ms] UsbSnoop - MyInternalIOCTLCompletion(f8917db0) : fido=81b964f0, Irp=81c2c5d8, Context=822f3898, IRQL=2
[630907 ms]  <<<  URB 979 coming back  <<< 
-- URB_FUNCTION_BULK_OR_INTERRUPT_TRANSFER:
  PipeHandle           = 82300ef4 [endpoint 0x00000081]
  TransferFlags        = 00000003 (USBD_TRANSFER_DIRECTION_IN, USBD_SHORT_TRANSFER_OK)
  TransferBufferLength = 000000ff
  TransferBuffer       = 00000000
  TransferBufferMDL    = 81b65b08
    00000000: 18 f1 9f 00 c7 80 fc 0c c8 e6 ff 00 47 c0 fc 07
    00000010: f1 c7 9f a9 ad c0 fe 00 41 53 8f 91 6f 80 fc 08
    00000020: 00 40 af 3b 57 80 fc 20 00 60 0f af ff 00 fe 40
    00000030: 00 00 1f 79 ff 80 ff 90 01 00 7f 2f fe 80 ff 30
    00000040: 01 40 3e df ff 80 ff d0 03 80 1f df be 20 ff d0
    00000050: 06 40 1f bf fe 00 ff d0 25 c0 3f ff ff 00 ff f0
    00000060: 2f e0 1f ff ff 00 ff f0 4f c0 bf ff fe 00 ff f0
    00000070: 09 80 9f ff fc 00 ff f0 00 00 1f ff f0 00 ff f0
    00000080: 3b e8 1f ff e0 00 ff f0 ed f0 1f ff e0 00 ff f0
    00000090: 00 10 3f ff c0 00 ff f8 08 24 ff df 80 00 ff f8
    000000a0: 00 00 ff 9f 00 00 ff f8 00 05 ff df 80 00 ff f8
    000000b0: 00 0d 7f 3f 80 00 ff fc 00 0f fe 7f 80 00 ff ff
    000000c0: 00 1f fc 7f 80 00 ff ff 00 7f f2 ff 80 00 ff ff
    000000d0: 80 fe 30 ff c8 00 ff ff ff 80 c1 ff e0 00 ff ff
    000000e0: f4 03 83 ff f0 00 ff ff f2 76 07 ff f8 00 ff ff
    000000f0: e7 20 0f ff fc 00 ff ff e0 e0 0f ff f8 00 ff
  UrbLink              = 00000000
[630934 ms] UsbSnoop - DispatchAny(f8916610) : IRP_MJ_INTERNAL_DEVICE_CONTROL
[630934 ms] UsbSnoop - MyDispatchInternalIOCTL(f8917e80) : fdo=822eee08, Irp=81c2c5d8, IRQL=2
[630934 ms]  >>>  URB 980 going down  >>> 
-- URB_FUNCTION_BULK_OR_INTERRUPT_TRANSFER:
  PipeHandle           = 82300f14 [endpoint 0x00000002]
  TransferFlags        = 00000000 (USBD_TRANSFER_DIRECTION_OUT, ~USBD_SHORT_TRANSFER_OK)
  TransferBufferLength = 00000007
  TransferBuffer       = 00000000
  TransferBufferMDL    = 81b65b08
    00000000: 00 00 00 02 05 e0 00
  UrbLink              = 00000000
[630935 ms] UsbSnoop - MyInternalIOCTLCompletion(f8917db0) : fido=81b964f0, Irp=81c2c5d8, Context=81b4ccc0, IRQL=2
[630935 ms]  <<<  URB 980 coming back  <<< 
-- URB_FUNCTION_BULK_OR_INTERRUPT_TRANSFER:
  PipeHandle           = 82300f14 [endpoint 0x00000002]
  TransferFlags        = 00000000 (USBD_TRANSFER_DIRECTION_OUT, ~USBD_SHORT_TRANSFER_OK)
  TransferBufferLength = 00000007
  TransferBuffer       = 00000000
  TransferBufferMDL    = 81b65b08
  UrbLink              = 00000000
[630944 ms] UsbSnoop - DispatchAny(f8916610) : IRP_MJ_INTERNAL_DEVICE_CONTROL
[630944 ms] UsbSnoop - MyDispatchInternalIOCTL(f8917e80) : fdo=822eee08, Irp=81c2c5d8, IRQL=2
[630944 ms]  >>>  URB 981 going down  >>> 
-- URB_FUNCTION_BULK_OR_INTERRUPT_TRANSFER:
  PipeHandle           = 82300ef4 [endpoint 0x00000081]
  TransferFlags        = 00000003 (USBD_TRANSFER_DIRECTION_IN, USBD_SHORT_TRANSFER_OK)
  TransferBufferLength = 00000100
  TransferBuffer       = 00000000
  TransferBufferMDL    = 81b65b08
  UrbLink              = 00000000
[630945 ms] UsbSnoop - MyInternalIOCTLCompletion(f8917db0) : fido=81b964f0, Irp=81c2c5d8, Context=822f3898, IRQL=2
[630945 ms]  <<<  URB 981 coming back  <<< 
-- URB_FUNCTION_BULK_OR_INTERRUPT_TRANSFER:
  PipeHandle           = 82300ef4 [endpoint 0x00000081]
  TransferFlags        = 00000003 (USBD_TRANSFER_DIRECTION_IN, USBD_SHORT_TRANSFER_OK)
  TransferBufferLength = 00000005
  TransferBuffer       = 00000000
  TransferBufferMDL    = 81b65b08
    00000000: 00 00 03 ff 03
  UrbLink              = 00000000
[630974 ms] UsbSnoop - DispatchAny(f8916610) : IRP_MJ_INTERNAL_DEVICE_CONTROL
[630975 ms] UsbSnoop - MyDispatchInternalIOCTL(f8917e80) : fdo=822eee08, Irp=81c2c5d8, IRQL=2
[630975 ms]  >>>  URB 982 going down  >>> 
-- URB_FUNCTION_BULK_OR_INTERRUPT_TRANSFER:
  PipeHandle           = 82300ef4 [endpoint 0x00000081]
  TransferFlags        = 00000003 (USBD_TRANSFER_DIRECTION_IN, USBD_SHORT_TRANSFER_OK)
  TransferBufferLength = 00000100
  TransferBuffer       = 00000000
  TransferBufferMDL    = 81b65b08
  UrbLink              = 00000000
[630976 ms] UsbSnoop - MyInternalIOCTLCompletion(f8917db0) : fido=81b964f0, Irp=81c2c5d8, Context=81c3bfe8, IRQL=2
[630977 ms]  <<<  URB 982 coming back  <<< 
-- URB_FUNCTION_BULK_OR_INTERRUPT_TRANSFER:
  PipeHandle           = 82300ef4 [endpoint 0x00000081]
  TransferFlags        = 00000003 (USBD_TRANSFER_DIRECTION_IN, USBD_SHORT_TRANSFER_OK)
  TransferBufferLength = 00000100
  TransferBuffer       = 00000000
  TransferBufferMDL    = 81b65b08
    00000000: ff f0 00 3f ff fc 00 ff ff f0 00 3f ff fe 00 ff
    00000010: ff f0 00 7f ff ff 00 ff ff f0 00 ff ff ff 00 ff
    00000020: ff f8 01 ff ff ff 40 ff ff fc 00 ff ff ff 80 ff
    00000030: ff f8 00 ff ff ff c0 ff ff f8 00 ff ff ff f0 ff
    00000040: ff f0 01 ff ff ff f0 ff ff e0 07 ff ff ff f0 ff
    00000050: ff f0 05 ff ff ff f0 ff ff f0 0f ff ff ff f0 ff
    00000060: ff e0 0f ff ff ff f0 ff ff e0 0f ff ff ff f0 ff
    00000070: ff c0 1f ff ff ff f0 ff ff 80 3f ff ff ff f0 df
    00000080: 02 55 00 4a 00 3a ff ff ff ff ff ff ff c0 ff ff
    00000090: ff ff ff ff ff c0 ff ff ff ff e7 ff ff c0 ff ff
    000000a0: ff ff c7 1f ff c0 ff ff ff ff 8f 87 ff c0 ff ff
    000000b0: ff ff ff 73 ff c0 ff ff ff fe 0f 79 ff c0 ff ff
    000000c0: ff fe 4f bf ff c0 ff ff ff ff 8c ff ff c0 ff ff
    000000d0: ff f8 0a 3f ff c0 ff ff ff f0 03 ff ff c0 ff ff
    000000e0: ff e0 03 ff ff c0 ff ff fe 00 01 ff ff c0 ff f8
    000000f0: 00 00 00 7f ff c0 ff f0 00 00 00 1f ff c0 ff f0
  UrbLink              = 00000000
[631005 ms] UsbSnoop - DispatchAny(f8916610) : IRP_MJ_INTERNAL_DEVICE_CONTROL
[631005 ms] UsbSnoop - MyDispatchInternalIOCTL(f8917e80) : fdo=822eee08, Irp=81c2c5d8, IRQL=2
[631005 ms]  >>>  URB 983 going down  >>> 
-- URB_FUNCTION_BULK_OR_INTERRUPT_TRANSFER:
  PipeHandle           = 82300ef4 [endpoint 0x00000081]
  TransferFlags        = 00000003 (USBD_TRANSFER_DIRECTION_IN, USBD_SHORT_TRANSFER_OK)
  TransferBufferLength = 00000100
  TransferBuffer       = 00000000
  TransferBufferMDL    = 81b65b08
  UrbLink              = 00000000
[631006 ms] UsbSnoop - MyInternalIOCTLCompletion(f8917db0) : fido=81b964f0, Irp=81c2c5d8, Context=81cdfe48, IRQL=2
[631007 ms]  <<<  URB 983 coming back  <<< 
-- URB_FUNCTION_BULK_OR_INTERRUPT_TRANSFER:
  PipeHandle           = 82300ef4 [endpoint 0x00000081]
  TransferFlags        = 00000003 (USBD_TRANSFER_DIRECTION_IN, USBD_SHORT_TRANSFER_OK)
  TransferBufferLength = 00000100
  TransferBuffer       = 00000000
  TransferBufferMDL    = 81b65b08
    00000000: 00 00 00 07 ff c0 ff e0 00 00 00 07 ff c0 ff c0
    00000010: 00 00 00 01 ff c0 ff c0 00 00 00 00 ff c0 ff 80
    00000020: 00 00 00 00 ff c0 ff 80 00 00 00 00 7f c0 ff 80
    00000030: 00 00 00 00 ff c0 ff 80 00 00 00 00 ff c0 ff 80
    00000040: 00 00 00 00 ff c0 ff 80 00 00 00 00 ff c0 ff 80
    00000050: 40 00 00 01 ff c0 ff 80 00 00 00 01 ff c0 ff 80
    00000060: 01 00 00 00 ff c0 ff a4 0d 8f 00 00 ff c0 ff 89
    00000070: ff 8f c0 00 ff c0 ff 98 03 01 c0 00 ff c0 ff 98
    00000080: d9 17 fe 00 ff c0 ff db 5f 17 e7 00 f7 c0 ff d2
    00000090: 0e 01 c1 80 ff c0 ff d0 7e 00 e0 00 ff c0 ff 81
    000000a0: 0e 00 00 00 c7 c0 ff 98 04 00 00 00 07 c0 ff f4
    000000b0: 04 00 00 00 47 c0 ff d2 0c 02 00 00 cf c0 ff f4
    000000c0: 1c 03 00 00 4f c0 ff f0 3c 01 00 00 1f c0 ff f8
    000000d0: 3e 01 80 00 1f c0 ff fe 7e 1c c0 00 3f c0 ff de
    000000e0: ff fc 40 00 3f c0 ff df ff e0 00 00 3f c0 ff db
    000000f0: 84 c0 00 00 7f c0 ff cc 08 40 00 00 ff c0 ff fe
  UrbLink              = 00000000
[631035 ms] UsbSnoop - DispatchAny(f8916610) : IRP_MJ_INTERNAL_DEVICE_CONTROL
[631035 ms] UsbSnoop - MyDispatchInternalIOCTL(f8917e80) : fdo=822eee08, Irp=81c2c5d8, IRQL=2
[631035 ms]  >>>  URB 984 going down  >>> 
-- URB_FUNCTION_BULK_OR_INTERRUPT_TRANSFER:
  PipeHandle           = 82300ef4 [endpoint 0x00000081]
  TransferFlags        = 00000003 (USBD_TRANSFER_DIRECTION_IN, USBD_SHORT_TRANSFER_OK)
  TransferBufferLength = 00000100
  TransferBuffer       = 00000000
  TransferBufferMDL    = 81b65b08
  UrbLink              = 00000000
[631037 ms] UsbSnoop - MyInternalIOCTLCompletion(f8917db0) : fido=81b964f0, Irp=81c2c5d8, Context=822f3898, IRQL=2
[631037 ms]  <<<  URB 984 coming back  <<< 
-- URB_FUNCTION_BULK_OR_INTERRUPT_TRANSFER:
  PipeHandle           = 82300ef4 [endpoint 0x00000081]
  TransferFlags        = 00000003 (USBD_TRANSFER_DIRECTION_IN, USBD_SHORT_TRANSFER_OK)
  TransferBufferLength = 00000100
  TransferBuffer       = 00000000
  TransferBufferMDL    = 81b65b08
    00000000: 0c d0 00 00 ff c0 ff fc 01 f0 00 00 ff c0 ff fc
    00000010: 3f fe 00 01 ff c0 ff fe 7e 1f 60 01 ff c0 ff fc
    00000020: 78 07 d0 01 ff c0 ff f5 3f f0 c0 01 ff c0 ff ff
    00000030: ff 00 00 00 ff c0 ff ff fe 00 00 20 7f c0 ff ff
    00000040: f8 00 00 24 7f c0 ff ff f0 00 00 04 7f c0 ff ff
    00000050: f8 00 00 00 3f c0 ff ff fe 00 00 00 3f c0 ff ff
    00000060: ff 00 1c 00 7f c0 ff fe ff f0 18 00 7f c0 ff ff
    00000070: 7f f8 98 00 7f c0 ff fe 7f f8 30 00 ff c0 ff fe
    00000080: 7f fe 70 00 ff c0 ff fc 3f ff fc 01 ff c0 ff fc
    00000090: 3f ff f8 01 ff c0 ff fc 1f fd f0 01 ff c0 ff fc
    000000a0: 0f fc 40 03 ff c0 ff fc 0f e9 80 03 ff c0 ff fc
    000000b0: 07 c7 00 07 ff c0 ff fc 03 8e 00 07 ff c0 ff fc
    000000c0: 01 98 00 0f ff c0 ff fc 00 f0 00 1f ff c0 ff fc
    000000d0: 00 60 00 3f ff c0 df 02 0b 00 4a 00 35 00 00 00
    000000e0: 00 00 00 00 00 00 00 00 00 00 00 00 00 00 01 00
    000000f0: 00 00 00 00 08 00 80 00 00 00 00 80 c8 c0 00 00
  UrbLink              = 00000000
[631065 ms] UsbSnoop - DispatchAny(f8916610) : IRP_MJ_INTERNAL_DEVICE_CONTROL
[631065 ms] UsbSnoop - MyDispatchInternalIOCTL(f8917e80) : fdo=822eee08, Irp=81c2c5d8, IRQL=2
[631065 ms]  >>>  URB 985 going down  >>> 
-- URB_FUNCTION_BULK_OR_INTERRUPT_TRANSFER:
  PipeHandle           = 82300ef4 [endpoint 0x00000081]
  TransferFlags        = 00000003 (USBD_TRANSFER_DIRECTION_IN, USBD_SHORT_TRANSFER_OK)
  TransferBufferLength = 00000100
  TransferBuffer       = 00000000
  TransferBufferMDL    = 81b65b08
  UrbLink              = 00000000
[631067 ms] UsbSnoop - MyInternalIOCTLCompletion(f8917db0) : fido=81b964f0, Irp=81c2c5d8, Context=81c3bfe8, IRQL=2
[631067 ms]  <<<  URB 985 coming back  <<< 
-- URB_FUNCTION_BULK_OR_INTERRUPT_TRANSFER:
  PipeHandle           = 82300ef4 [endpoint 0x00000081]
  TransferFlags        = 00000003 (USBD_TRANSFER_DIRECTION_IN, USBD_SHORT_TRANSFER_OK)
  TransferBufferLength = 000000ff
  TransferBuffer       = 00000000
  TransferBufferMDL    = 81b65b08
    00000000: 00 00 8f ee 70 00 00 00 00 0f ff f8 00 00 00 03
    00000010: 77 ff fe 00 00 00 02 3b ff 7b 00 00 00 04 7f 1f
    00000020: ff 80 00 00 09 f8 01 ff c0 00 00 21 e0 01 ff e0
    00000030: 00 00 47 c0 00 ff f0 00 00 87 80 00 7d f8 00 01
    00000040: 05 00 00 00 3c 00 03 09 00 00 00 1c 00 02 02 00
    00000050: 00 00 0e 00 02 1e 00 00 00 0f 00 06 7c 00 00 00
    00000060: 07 00 04 d0 00 00 00 07 80 01 c0 00 00 00 02 80
    00000070: 07 c0 00 00 00 03 00 06 90 00 00 00 03 80 06 b0
    00000080: 00 00 00 03 80 02 b0 00 00 00 09 80 02 20 00 00
    00000090: 00 09 80 02 60 00 1f 00 0d 80 03 e0 01 ff 80 03
    000000a0: 00 01 c0 00 1f 9e 03 00 00 50 01 7f 1f fb 00 02
    000000b0: 38 03 fe 1f fb 00 07 00 18 0e 0f fb 00 06 00 00
    000000c0: 0c 08 fb 00 04 00 00 08 00 1f 00 00 40 00 10 00
    000000d0: 7f 00 00 40 00 00 03 07 00 00 c0 00 00 00 03 00
    000000e0: 00 c0 00 00 04 02 00 00 00 00 08 02 06 00 00 00
    000000f0: 00 19 06 06 00 00 00 00 17 9e 06 00 00 04 00
  UrbLink              = 00000000
[631095 ms] UsbSnoop - DispatchAny(f8916610) : IRP_MJ_INTERNAL_DEVICE_CONTROL
[631095 ms] UsbSnoop - MyDispatchInternalIOCTL(f8917e80) : fdo=822eee08, Irp=81c2c5d8, IRQL=2
[631095 ms]  >>>  URB 986 going down  >>> 
-- URB_FUNCTION_BULK_OR_INTERRUPT_TRANSFER:
  PipeHandle           = 82300f14 [endpoint 0x00000002]
  TransferFlags        = 00000000 (USBD_TRANSFER_DIRECTION_OUT, ~USBD_SHORT_TRANSFER_OK)
  TransferBufferLength = 00000007
  TransferBuffer       = 00000000
  TransferBufferMDL    = 81b65b08
    00000000: 00 00 00 02 05 e0 00
  UrbLink              = 00000000
[631095 ms] UsbSnoop - MyInternalIOCTLCompletion(f8917db0) : fido=81b964f0, Irp=81c2c5d8, Context=81cdfe48, IRQL=2
[631095 ms]  <<<  URB 986 coming back  <<< 
-- URB_FUNCTION_BULK_OR_INTERRUPT_TRANSFER:
  PipeHandle           = 82300f14 [endpoint 0x00000002]
  TransferFlags        = 00000000 (USBD_TRANSFER_DIRECTION_OUT, ~USBD_SHORT_TRANSFER_OK)
  TransferBufferLength = 00000007
  TransferBuffer       = 00000000
  TransferBufferMDL    = 81b65b08
  UrbLink              = 00000000
[631106 ms] UsbSnoop - DispatchAny(f8916610) : IRP_MJ_INTERNAL_DEVICE_CONTROL
[631106 ms] UsbSnoop - MyDispatchInternalIOCTL(f8917e80) : fdo=822eee08, Irp=81c2c5d8, IRQL=2
[631106 ms]  >>>  URB 987 going down  >>> 
-- URB_FUNCTION_BULK_OR_INTERRUPT_TRANSFER:
  PipeHandle           = 82300ef4 [endpoint 0x00000081]
  TransferFlags        = 00000003 (USBD_TRANSFER_DIRECTION_IN, USBD_SHORT_TRANSFER_OK)
  TransferBufferLength = 00000100
  TransferBuffer       = 00000000
  TransferBufferMDL    = 81b65b08
  UrbLink              = 00000000
[631106 ms] UsbSnoop - MyInternalIOCTLCompletion(f8917db0) : fido=81b964f0, Irp=81c2c5d8, Context=822f3898, IRQL=2
[631106 ms]  <<<  URB 987 coming back  <<< 
-- URB_FUNCTION_BULK_OR_INTERRUPT_TRANSFER:
  PipeHandle           = 82300ef4 [endpoint 0x00000081]
  TransferFlags        = 00000003 (USBD_TRANSFER_DIRECTION_IN, USBD_SHORT_TRANSFER_OK)
  TransferBufferLength = 00000005
  TransferBuffer       = 00000000
  TransferBufferMDL    = 81b65b08
    00000000: 00 00 03 ff 03
  UrbLink              = 00000000
[631135 ms] UsbSnoop - DispatchAny(f8916610) : IRP_MJ_INTERNAL_DEVICE_CONTROL
[631135 ms] UsbSnoop - MyDispatchInternalIOCTL(f8917e80) : fdo=822eee08, Irp=81c2c5d8, IRQL=2
[631135 ms]  >>>  URB 988 going down  >>> 
-- URB_FUNCTION_BULK_OR_INTERRUPT_TRANSFER:
  PipeHandle           = 82300ef4 [endpoint 0x00000081]
  TransferFlags        = 00000003 (USBD_TRANSFER_DIRECTION_IN, USBD_SHORT_TRANSFER_OK)
  TransferBufferLength = 00000100
  TransferBuffer       = 00000000
  TransferBufferMDL    = 81b65b08
  UrbLink              = 00000000
[631137 ms] UsbSnoop - MyInternalIOCTLCompletion(f8917db0) : fido=81b964f0, Irp=81c2c5d8, Context=81cdfe48, IRQL=2
[631137 ms]  <<<  URB 988 coming back  <<< 
-- URB_FUNCTION_BULK_OR_INTERRUPT_TRANSFER:
  PipeHandle           = 82300ef4 [endpoint 0x00000081]
  TransferFlags        = 00000003 (USBD_TRANSFER_DIRECTION_IN, USBD_SHORT_TRANSFER_OK)
  TransferBufferLength = 00000100
  TransferBuffer       = 00000000
  TransferBufferMDL    = 81b65b08
    00000000: 20 7e 06 00 00 08 00 61 7e 0c 00 00 81 00 40 fe
    00000010: cc 00 00 14 81 80 7e 6c 00 00 21 02 85 7a 3c 00
    00000020: 00 20 01 8f ff fc 00 00 20 82 3c 67 fc 00 00 22
    00000030: b4 78 39 fc 00 00 25 40 f1 2b fc 00 00 17 a9 83
    00000040: 64 fc 00 00 07 bb 09 10 38 00 00 03 1b 00 08 38
    00000050: 00 00 01 7e 02 00 38 00 00 c0 fd 00 48 10 00 00
    00000060: c0 ff 80 f8 10 00 01 c0 3f 80 f3 70 00 03 f0 1f
    00000070: 82 fc f8 00 07 fe 0c fe ff f8 00 1f ff c7 ff ff
    00000080: f8 00 ff ff f9 ff ff e0 00 ff ff fc 7f ff f8 00
    00000090: ff ff ff ff ff fe 00 ff ff ff ff ff ff f0 ff ff
    000000a0: ff ff ff ff f8 ff ff f7 7f ff ff f8 ff ff f0 3f
    000000b0: ff ff f8 ff ff fc 7f ff ff f8 ff ff fc 3f ff ff
    000000c0: f8 ff ff fe 1f ff ff f8 ff ff ff 0f e3 df f8 ff
    000000d0: ff ff 83 80 6f f8 ff ff ff c0 00 0f f8 ff ff ff
    000000e0: e0 00 03 f8 df 02 55 00 4a 00 3a f0 71 11 88 06
    000000f0: 03 80 00 fe 71 11 00 06 03 80 00 fe 71 30 00 06
  UrbLink              = 00000000
[631165 ms] UsbSnoop - DispatchAny(f8916610) : IRP_MJ_INTERNAL_DEVICE_CONTROL
[631165 ms] UsbSnoop - MyDispatchInternalIOCTL(f8917e80) : fdo=822eee08, Irp=81c2c5d8, IRQL=2
[631165 ms]  >>>  URB 989 going down  >>> 
-- URB_FUNCTION_BULK_OR_INTERRUPT_TRANSFER:
  PipeHandle           = 82300ef4 [endpoint 0x00000081]
  TransferFlags        = 00000003 (USBD_TRANSFER_DIRECTION_IN, USBD_SHORT_TRANSFER_OK)
  TransferBufferLength = 00000100
  TransferBuffer       = 00000000
  TransferBufferMDL    = 81b65b08
  UrbLink              = 00000000
[631167 ms] UsbSnoop - MyInternalIOCTLCompletion(f8917db0) : fido=81b964f0, Irp=81c2c5d8, Context=81b4ccc0, IRQL=2
[631167 ms]  <<<  URB 989 coming back  <<< 
-- URB_FUNCTION_BULK_OR_INTERRUPT_TRANSFER:
  PipeHandle           = 82300ef4 [endpoint 0x00000081]
  TransferFlags        = 00000003 (USBD_TRANSFER_DIRECTION_IN, USBD_SHORT_TRANSFER_OK)
  TransferBufferLength = 00000100
  TransferBuffer       = 00000000
  TransferBufferMDL    = 81b65b08
    00000000: 03 80 00 fe 71 04 20 00 03 80 00 fe 71 0c 80 00
    00000010: 03 80 00 ff 70 06 f0 06 03 80 00 ff 31 cf f8 02
    00000020: 83 80 00 f3 f2 bf fc 00 63 80 00 e1 f8 ff f6 1e
    00000030: 21 80 00 e1 98 ef e4 7e 01 80 00 f1 c0 df 63 e4
    00000040: e8 00 00 f3 e1 ee c0 07 98 00 00 ff ae 33 ed df
    00000050: 26 03 c0 ff 07 ff 86 e7 60 03 c0 ff 8f fe 59 ff
    00000060: 8c 03 c0 ff 0f fd d9 8d e6 07 c0 ff 8f ef 37 e7
    00000070: c7 bf c0 f7 9f df 67 d0 02 3f c0 f1 9f 1f e6 71
    00000080: f1 1f c0 e1 44 01 40 2f f7 ff c0 e1 00 00 00 15
    00000090: fc ff c0 f3 44 00 00 1e f9 9f c0 ff 44 00 00 0d
    000000a0: ff 9f c0 ff 60 00 00 03 fc 1f c0 ff 08 00 00 03
    000000b0: f8 df c0 ff b0 00 00 01 7c 0f c0 ff c0 00 00 02
    000000c0: 18 4f c0 fe c0 00 00 00 61 ff c0 e3 40 00 00 00
    000000d0: 70 4f c0 c3 e0 00 00 00 7a 07 c0 c3 20 00 00 02
    000000e0: 78 07 c0 e3 a0 00 00 00 19 1f c0 ff a0 00 03 08
    000000f0: 0f a3 40 ff a0 00 00 00 08 e3 40 ff a0 00 00 00
  UrbLink              = 00000000
[631195 ms] UsbSnoop - DispatchAny(f8916610) : IRP_MJ_INTERNAL_DEVICE_CONTROL
[631195 ms] UsbSnoop - MyDispatchInternalIOCTL(f8917e80) : fdo=822eee08, Irp=81c2c5d8, IRQL=2
[631195 ms]  >>>  URB 990 going down  >>> 
-- URB_FUNCTION_BULK_OR_INTERRUPT_TRANSFER:
  PipeHandle           = 82300ef4 [endpoint 0x00000081]
  TransferFlags        = 00000003 (USBD_TRANSFER_DIRECTION_IN, USBD_SHORT_TRANSFER_OK)
  TransferBufferLength = 00000100
  TransferBuffer       = 00000000
  TransferBufferMDL    = 81b65b08
  UrbLink              = 00000000
[631197 ms] UsbSnoop - MyInternalIOCTLCompletion(f8917db0) : fido=81b964f0, Irp=81c2c5d8, Context=81cb4e48, IRQL=2
[631197 ms]  <<<  URB 990 coming back  <<< 
-- URB_FUNCTION_BULK_OR_INTERRUPT_TRANSFER:
  PipeHandle           = 82300ef4 [endpoint 0x00000081]
  TransferFlags        = 00000003 (USBD_TRANSFER_DIRECTION_IN, USBD_SHORT_TRANSFER_OK)
  TransferBufferLength = 00000100
  TransferBuffer       = 00000000
  TransferBufferMDL    = 81b65b08
    00000000: 00 7f c0 ff e0 00 10 f2 01 ff c0 ff c0 38 1a 7c
    00000010: 07 ff c0 ff c1 b4 30 0f 0c ef c0 e7 e0 00 18 00
    00000020: 0c ef c0 c3 e0 00 3c 04 0d 8f c0 c3 e0 00 1c 00
    00000030: 1f 9f c0 e3 e0 00 1e 00 0f 1f c0 ef e0 00 1e 00
    00000040: 0d 9f c0 ff f0 00 1c 00 1d 6f c0 ff f0 00 0e 00
    00000050: 3d ef c0 ff f0 00 03 00 1b ef c0 ff f0 00 0b 00
    00000060: 7d ef c0 ff f0 00 1f 00 3c 6f c0 ef f8 00 3f 00
    00000070: 7e e7 80 c7 f8 00 1b 00 7e e7 80 87 e0 00 01 00
    00000080: 7d e7 80 c7 c0 00 02 00 3d e7 80 ef c0 04 0d c0
    00000090: 7d e7 80 ff e4 02 03 00 fd ef 80 ff fc 01 96 00
    000000a0: 7e e7 80 ff fe 00 70 00 fe f7 80 ff ff 00 00 00
    000000b0: fc ff 80 ff ff 00 00 09 fc ff 80 df ff 80 00 09
    000000c0: fc ff 80 c7 ff c0 00 0b fc ff 80 87 ff e0 00 1f
    000000d0: f9 ff 80 87 ff f0 00 1f f9 ff c0 cf f9 f8 00 7f
    000000e0: f1 ff c0 ff f3 fc 00 7f e3 ff c0 ff ff fc 00 ff
    000000f0: c3 ff c0 ff ff fd 07 ff 87 ff c0 ff ff fc 00 07
  UrbLink              = 00000000
[631225 ms] UsbSnoop - DispatchAny(f8916610) : IRP_MJ_INTERNAL_DEVICE_CONTROL
[631225 ms] UsbSnoop - MyDispatchInternalIOCTL(f8917e80) : fdo=822eee08, Irp=81c2c5d8, IRQL=2
[631225 ms]  >>>  URB 991 going down  >>> 
-- URB_FUNCTION_BULK_OR_INTERRUPT_TRANSFER:
  PipeHandle           = 82300ef4 [endpoint 0x00000081]
  TransferFlags        = 00000003 (USBD_TRANSFER_DIRECTION_IN, USBD_SHORT_TRANSFER_OK)
  TransferBufferLength = 00000100
  TransferBuffer       = 00000000
  TransferBufferMDL    = 81b65b08
  UrbLink              = 00000000
[631227 ms] UsbSnoop - MyInternalIOCTLCompletion(f8917db0) : fido=81b964f0, Irp=81c2c5d8, Context=81cdfe48, IRQL=2
[631227 ms]  <<<  URB 991 coming back  <<< 
-- URB_FUNCTION_BULK_OR_INTERRUPT_TRANSFER:
  PipeHandle           = 82300ef4 [endpoint 0x00000081]
  TransferFlags        = 00000003 (USBD_TRANSFER_DIRECTION_IN, USBD_SHORT_TRANSFER_OK)
  TransferBufferLength = 000000ff
  TransferBuffer       = 00000000
  TransferBufferMDL    = 81b65b08
    00000000: 07 ff c0 ff ff fc 00 06 0f ff c0 ff ff fc 00 08
    00000010: 0f ff c0 ff ff fc 00 08 1f ff c0 ff ff fc 00 00
    00000020: 1f ff c0 ff ff fc 00 00 3f ff c0 ff ff fe 00 00
    00000030: 3f ff c0 ff ff fe 00 00 7f ff c0 df 02 0b 00 4a
    00000040: 00 32 ff ff ff ff ff ff c0 ff ff ff af ff ff c0
    00000050: ff ff fe f0 f7 ff c0 ff ff f9 9c 3f ff c0 ff ff
    00000060: fb 40 1f ff c0 ff ff 0f 80 0b ff c0 ff ff df 00
    00000070: 07 ff c0 ff ff f0 00 03 ff c0 ff fd e0 09 01 ff
    00000080: c0 ff f3 c0 00 90 ff c0 ff e7 80 60 0c ff c0 ff
    00000090: ed 80 80 01 5f c0 ff cb 80 00 00 1f c0 ff db 80
    000000a0: 00 00 6f c0 ff f1 c0 00 00 17 c0 ff f0 e0 00 00
    000000b0: 17 c0 ff f0 61 00 00 0f c0 ff f0 61 00 00 2f c0
    000000c0: ff f0 60 00 00 0f c0 ff f0 00 00 00 0f c0 ff f0
    000000d0: 00 00 00 0f c0 ff f0 00 00 00 0f c0 ff f0 00 00
    000000e0: 00 17 c0 ff f0 00 00 00 07 c0 ff f0 00 00 00 17
    000000f0: c0 ff e0 01 fb 00 1f c0 ff df 83 fd 80 1f c0
  UrbLink              = 00000000
[631255 ms] UsbSnoop - DispatchAny(f8916610) : IRP_MJ_INTERNAL_DEVICE_CONTROL
[631255 ms] UsbSnoop - MyDispatchInternalIOCTL(f8917e80) : fdo=822eee08, Irp=81c2c5d8, IRQL=2
[631255 ms]  >>>  URB 992 going down  >>> 
-- URB_FUNCTION_BULK_OR_INTERRUPT_TRANSFER:
  PipeHandle           = 82300f14 [endpoint 0x00000002]
  TransferFlags        = 00000000 (USBD_TRANSFER_DIRECTION_OUT, ~USBD_SHORT_TRANSFER_OK)
  TransferBufferLength = 00000007
  TransferBuffer       = 00000000
  TransferBufferMDL    = 81b65b08
    00000000: 00 00 00 02 05 e0 00
  UrbLink              = 00000000
[631255 ms] UsbSnoop - MyInternalIOCTLCompletion(f8917db0) : fido=81b964f0, Irp=81c2c5d8, Context=81b4ccc0, IRQL=2
[631255 ms]  <<<  URB 992 coming back  <<< 
-- URB_FUNCTION_BULK_OR_INTERRUPT_TRANSFER:
  PipeHandle           = 82300f14 [endpoint 0x00000002]
  TransferFlags        = 00000000 (USBD_TRANSFER_DIRECTION_OUT, ~USBD_SHORT_TRANSFER_OK)
  TransferBufferLength = 00000007
  TransferBuffer       = 00000000
  TransferBufferMDL    = 81b65b08
  UrbLink              = 00000000
[631265 ms] UsbSnoop - DispatchAny(f8916610) : IRP_MJ_INTERNAL_DEVICE_CONTROL
[631265 ms] UsbSnoop - MyDispatchInternalIOCTL(f8917e80) : fdo=822eee08, Irp=81c2c5d8, IRQL=2
[631265 ms]  >>>  URB 993 going down  >>> 
-- URB_FUNCTION_BULK_OR_INTERRUPT_TRANSFER:
  PipeHandle           = 82300ef4 [endpoint 0x00000081]
  TransferFlags        = 00000003 (USBD_TRANSFER_DIRECTION_IN, USBD_SHORT_TRANSFER_OK)
  TransferBufferLength = 00000100
  TransferBuffer       = 00000000
  TransferBufferMDL    = 81b65b08
  UrbLink              = 00000000
[631265 ms] UsbSnoop - MyInternalIOCTLCompletion(f8917db0) : fido=81b964f0, Irp=81c2c5d8, Context=81cdfe48, IRQL=2
[631265 ms]  <<<  URB 993 coming back  <<< 
-- URB_FUNCTION_BULK_OR_INTERRUPT_TRANSFER:
  PipeHandle           = 82300ef4 [endpoint 0x00000081]
  TransferFlags        = 00000003 (USBD_TRANSFER_DIRECTION_IN, USBD_SHORT_TRANSFER_OK)
  TransferBufferLength = 00000005
  TransferBuffer       = 00000000
  TransferBufferMDL    = 81b65b08
    00000000: 00 00 03 ff 03
  UrbLink              = 00000000
[631295 ms] UsbSnoop - DispatchAny(f8916610) : IRP_MJ_INTERNAL_DEVICE_CONTROL
[631295 ms] UsbSnoop - MyDispatchInternalIOCTL(f8917e80) : fdo=822eee08, Irp=81cb8e48, IRQL=2
[631295 ms]  >>>  URB 994 going down  >>> 
-- URB_FUNCTION_BULK_OR_INTERRUPT_TRANSFER:
  PipeHandle           = 82300ef4 [endpoint 0x00000081]
  TransferFlags        = 00000003 (USBD_TRANSFER_DIRECTION_IN, USBD_SHORT_TRANSFER_OK)
  TransferBufferLength = 00000100
  TransferBuffer       = 00000000
  TransferBufferMDL    = 81b65b08
  UrbLink              = 00000000
[631297 ms] UsbSnoop - MyInternalIOCTLCompletion(f8917db0) : fido=81b964f0, Irp=81cb8e48, Context=81c3bfe8, IRQL=2
[631297 ms]  <<<  URB 994 coming back  <<< 
-- URB_FUNCTION_BULK_OR_INTERRUPT_TRANSFER:
  PipeHandle           = 82300ef4 [endpoint 0x00000081]
  TransferFlags        = 00000003 (USBD_TRANSFER_DIRECTION_IN, USBD_SHORT_TRANSFER_OK)
  TransferBufferLength = 00000100
  TransferBuffer       = 00000000
  TransferBufferMDL    = 81b65b08
    00000000: ff bf c1 a6 00 0f c0 ff ef 60 5f c0 0f c0 ff fb
    00000010: a0 8c 80 1f c0 ff f1 a0 00 01 1f c0 ff c8 60 00
    00000020: 00 37 c0 ff ec 60 00 02 ef c0 ff e4 40 00 01 cf
    00000030: c0 ff e0 40 00 06 cf c0 ff f0 40 00 05 6f c0 ff
    00000040: f0 40 00 00 7f c0 ff f0 c0 00 00 cf c0 ff f8 80
    00000050: 00 00 9f c0 ff fc 80 00 00 3f c0 ff fc c3 80 00
    00000060: 3f c0 ff fe ee 00 00 3f c0 ff fe f8 00 00 7f c0
    00000070: ff fe 60 00 00 bf c0 ff fc 88 00 01 bf c0 ff fc
    00000080: e0 30 00 3f c0 ff fc 7d 00 00 3f c0 ff fc 70 00
    00000090: 02 7f c0 ff fe 60 00 00 ff c0 ff ff f8 00 03 ff
    000000a0: c0 ff f7 a8 00 06 ff c0 ff fb c0 00 0e ff c0 ff
    000000b0: cf 80 00 3f ff c0 ff ed 80 00 7f ff c0 ff e6 ca
    000000c0: 00 ff ff c0 ff c3 7a 03 ff ff c0 ff e1 96 0f ff
    000000d0: ff c0 ff fe 7c 3f ff ff c0 ff ff 80 ff ff ff c0
    000000e0: ff ff fb ff ff ff c0 ff ff ff ff ff ff c0 ff ff
    000000f0: ff ff ff ff c0 ff ff ff ff ff ff c0 ff ff ff ff
  UrbLink              = 00000000
[631325 ms] UsbSnoop - DispatchAny(f8916610) : IRP_MJ_INTERNAL_DEVICE_CONTROL
[631325 ms] UsbSnoop - MyDispatchInternalIOCTL(f8917e80) : fdo=822eee08, Irp=81cb8e48, IRQL=2
[631325 ms]  >>>  URB 995 going down  >>> 
-- URB_FUNCTION_BULK_OR_INTERRUPT_TRANSFER:
  PipeHandle           = 82300ef4 [endpoint 0x00000081]
  TransferFlags        = 00000003 (USBD_TRANSFER_DIRECTION_IN, USBD_SHORT_TRANSFER_OK)
  TransferBufferLength = 00000100
  TransferBuffer       = 00000000
  TransferBufferMDL    = 81b65b08
  UrbLink              = 00000000
[631327 ms] UsbSnoop - MyInternalIOCTLCompletion(f8917db0) : fido=81b964f0, Irp=81cb8e48, Context=81b4ccc0, IRQL=2
[631327 ms]  <<<  URB 995 coming back  <<< 
-- URB_FUNCTION_BULK_OR_INTERRUPT_TRANSFER:
  PipeHandle           = 82300ef4 [endpoint 0x00000081]
  TransferFlags        = 00000003 (USBD_TRANSFER_DIRECTION_IN, USBD_SHORT_TRANSFER_OK)
  TransferBufferLength = 00000100
  TransferBuffer       = 00000000
  TransferBufferMDL    = 81b65b08
    00000000: ff ff c0 ff ff ff ff ff ff c0 ff ff ff ff ff ff
    00000010: c0 ff ff ff ff ff ff c0 ff ff ff ff ff ff c0 ff
    00000020: ff ff ff ff ff c0 ff ff ff ff ff ff c0 ff ff ff
    00000030: ff ff ff c0 ff e7 ff fb ff ff c0 ff c3 ff e7 ff
    00000040: ff c0 ff 81 ff cf ff ff c0 df 02 55 00 4a 00 3f
    00000050: ff ff ff ff ff ff ff fe ff ff ff ff ff ff ff fe
    00000060: ff ff fe 80 7f ff ff fe ff ff f0 00 00 3f ff fe
    00000070: ff ff f0 02 c0 07 ff fe ff ff e0 17 fd 71 ff fe
    00000080: ff ff c0 1f fd fe 7f fe ff ff c0 7f ff ff bf fe
    00000090: ff ff 00 77 ff ff ef fe ff ff 00 3b ff ff fb fe
    000000a0: ff ff 00 3b ff ff ff fe ff fe 00 11 ff ff ff fe
    000000b0: ff fe 00 09 ff ff ff fe ff fc 00 05 ff ff ff fe
    000000c0: ff f8 00 00 ff ff ff fe ff f8 00 00 7f f7 ff fe
    000000d0: ff f8 00 00 17 7f ff fe ff f0 00 00 13 bf ff fe
    000000e0: ff f0 00 00 00 eb ff fe ff e0 40 10 40 ab ff fe
    000000f0: ff e0 3c 48 00 67 ff fe ff e3 9e 00 04 17 ff fe
  UrbLink              = 00000000
[631355 ms] UsbSnoop - DispatchAny(f8916610) : IRP_MJ_INTERNAL_DEVICE_CONTROL
[631355 ms] UsbSnoop - MyDispatchInternalIOCTL(f8917e80) : fdo=822eee08, Irp=81cb8e48, IRQL=2
[631355 ms]  >>>  URB 996 going down  >>> 
-- URB_FUNCTION_BULK_OR_INTERRUPT_TRANSFER:
  PipeHandle           = 82300ef4 [endpoint 0x00000081]
  TransferFlags        = 00000003 (USBD_TRANSFER_DIRECTION_IN, USBD_SHORT_TRANSFER_OK)
  TransferBufferLength = 00000100
  TransferBuffer       = 00000000
  TransferBufferMDL    = 81b65b08
  UrbLink              = 00000000
[631357 ms] UsbSnoop - MyInternalIOCTLCompletion(f8917db0) : fido=81b964f0, Irp=81cb8e48, Context=81cb4e48, IRQL=2
[631357 ms]  <<<  URB 996 coming back  <<< 
-- URB_FUNCTION_BULK_OR_INTERRUPT_TRANSFER:
  PipeHandle           = 82300ef4 [endpoint 0x00000081]
  TransferFlags        = 00000003 (USBD_TRANSFER_DIRECTION_IN, USBD_SHORT_TRANSFER_OK)
  TransferBufferLength = 00000100
  TransferBuffer       = 00000000
  TransferBufferMDL    = 81b65b08
    00000000: ff 8f c4 00 00 1a df fe ff af 72 00 40 28 af fe
    00000010: ff a6 3c c0 09 01 8f fe ff e7 9d 81 01 c0 0b fe
    00000020: ff ed fc 81 06 60 27 be ff ce 3c 02 0d 99 03 7e
    00000030: ff 9e 18 00 49 85 02 7e ff 3a 78 00 01 8b 4a fe
    00000040: ff 59 e4 00 01 07 0c fe fe dc 02 00 25 06 4d 7e
    00000050: fe e4 01 c0 23 c4 90 3e fd f0 02 00 03 cc 94 7e
    00000060: f9 f8 0c 68 03 8a 70 7e f9 0c 01 00 0e 9a e2 fe
    00000070: fd fc 01 08 08 85 5c fe fc fc 00 60 13 24 fc fe
    00000080: ff dc 00 10 10 d7 fe fe ff c0 00 08 0b 27 ff fe
    00000090: ff c2 00 00 06 01 fb fe ff c0 00 00 00 01 7f fe
    000000a0: ff d8 00 00 00 04 4f fe ff ee 00 00 cb 06 ff fe
    000000b0: ff e3 00 18 f0 05 7f fe ff ed 00 00 5f 70 9f fe
    000000c0: ff e4 00 21 3a e7 1f fe ff f3 20 84 04 9c 1f fe
    000000d0: ff e0 00 85 80 f0 0f fe ff e0 01 98 03 80 0f fe
    000000e0: ff e2 27 68 0e 00 1f fe ff c0 3f 20 38 00 3f fe
    000000f0: ff e5 fe c1 c0 00 7f fe ff f7 dc 07 00 00 ff fe
  UrbLink              = 00000000
[631385 ms] UsbSnoop - DispatchAny(f8916610) : IRP_MJ_INTERNAL_DEVICE_CONTROL
[631385 ms] UsbSnoop - MyDispatchInternalIOCTL(f8917e80) : fdo=822eee08, Irp=81cb8e48, IRQL=2
[631385 ms]  >>>  URB 997 going down  >>> 
-- URB_FUNCTION_BULK_OR_INTERRUPT_TRANSFER:
  PipeHandle           = 82300ef4 [endpoint 0x00000081]
  TransferFlags        = 00000003 (USBD_TRANSFER_DIRECTION_IN, USBD_SHORT_TRANSFER_OK)
  TransferBufferLength = 00000100
  TransferBuffer       = 00000000
  TransferBufferMDL    = 81b65b08
  UrbLink              = 00000000
[631387 ms] UsbSnoop - MyInternalIOCTLCompletion(f8917db0) : fido=81b964f0, Irp=81cb8e48, Context=81c3bfe8, IRQL=2
[631387 ms]  <<<  URB 997 coming back  <<< 
-- URB_FUNCTION_BULK_OR_INTERRUPT_TRANSFER:
  PipeHandle           = 82300ef4 [endpoint 0x00000081]
  TransferFlags        = 00000003 (USBD_TRANSFER_DIRECTION_IN, USBD_SHORT_TRANSFER_OK)
  TransferBufferLength = 000000ff
  TransferBuffer       = 00000000
  TransferBufferMDL    = 81b65b08
    00000000: ff fe 08 18 00 01 ff 7e ff ff c0 e0 00 07 ff be
    00000010: ff ff fd 00 00 0f ff 9e ff ff fc 00 00 1f ff de
    00000020: ff ff fb 00 00 7f ff e6 ff ff fb 00 00 ff ff f2
    00000030: ff ff e9 80 01 ff ff fc ff ff db c0 0f ff ff fe
    00000040: ff ff 33 e0 1f ff ff fe ff fe 77 e0 7f ff ff fe
    00000050: ff f4 f7 80 ff ff ff fe ff e9 ef 01 ff ff ff fe
    00000060: ff c3 de 07 ff ff ff fe ff a7 dc 0f ff ff ff fe
    00000070: ff cf b8 1f ff ff ff fe ff 9f f8 7f ff ff ff fe
    00000080: ff 3c f1 ff ff ff ff fe ff 7d f3 f7 ff ff ff fe
    00000090: fe ff ff ef ff ff ff fe fd fd ff df ff ff ff fe
    000000a0: df 02 55 00 4a 00 3a 00 00 00 00 00 00 00 00 00
    000000b0: 00 07 f7 f8 00 00 00 00 00 3e 17 ff 00 00 00 00
    000000c0: 00 61 df ed c0 00 00 00 00 fe 80 1f e0 00 00 00
    000000d0: 01 c0 00 03 f0 00 00 00 03 00 00 01 f8 00 00 00
    000000e0: 02 00 00 01 3c 00 00 00 00 00 00 02 3e 00 00 00
    000000f0: 00 00 00 00 1f 80 00 00 00 00 00 02 1f c0 00
  UrbLink              = 00000000
[631415 ms] UsbSnoop - DispatchAny(f8916610) : IRP_MJ_INTERNAL_DEVICE_CONTROL
[631415 ms] UsbSnoop - MyDispatchInternalIOCTL(f8917e80) : fdo=822eee08, Irp=81cb8e48, IRQL=2
[631415 ms]  >>>  URB 998 going down  >>> 
-- URB_FUNCTION_BULK_OR_INTERRUPT_TRANSFER:
  PipeHandle           = 82300f14 [endpoint 0x00000002]
  TransferFlags        = 00000000 (USBD_TRANSFER_DIRECTION_OUT, ~USBD_SHORT_TRANSFER_OK)
  TransferBufferLength = 00000007
  TransferBuffer       = 00000000
  TransferBufferMDL    = 81b65b08
    00000000: 00 00 00 02 05 e0 00
  UrbLink              = 00000000
[631415 ms] UsbSnoop - MyInternalIOCTLCompletion(f8917db0) : fido=81b964f0, Irp=81cb8e48, Context=81b4ccc0, IRQL=2
[631415 ms]  <<<  URB 998 coming back  <<< 
-- URB_FUNCTION_BULK_OR_INTERRUPT_TRANSFER:
  PipeHandle           = 82300f14 [endpoint 0x00000002]
  TransferFlags        = 00000000 (USBD_TRANSFER_DIRECTION_OUT, ~USBD_SHORT_TRANSFER_OK)
  TransferBufferLength = 00000007
  TransferBuffer       = 00000000
  TransferBufferMDL    = 81b65b08
  UrbLink              = 00000000
[631425 ms] UsbSnoop - DispatchAny(f8916610) : IRP_MJ_INTERNAL_DEVICE_CONTROL
[631425 ms] UsbSnoop - MyDispatchInternalIOCTL(f8917e80) : fdo=822eee08, Irp=81cb8e48, IRQL=2
[631425 ms]  >>>  URB 999 going down  >>> 
-- URB_FUNCTION_BULK_OR_INTERRUPT_TRANSFER:
  PipeHandle           = 82300ef4 [endpoint 0x00000081]
  TransferFlags        = 00000003 (USBD_TRANSFER_DIRECTION_IN, USBD_SHORT_TRANSFER_OK)
  TransferBufferLength = 00000100
  TransferBuffer       = 00000000
  TransferBufferMDL    = 81b65b08
  UrbLink              = 00000000
[631425 ms] UsbSnoop - MyInternalIOCTLCompletion(f8917db0) : fido=81b964f0, Irp=81cb8e48, Context=81c3bfe8, IRQL=2
[631425 ms]  <<<  URB 999 coming back  <<< 
-- URB_FUNCTION_BULK_OR_INTERRUPT_TRANSFER:
  PipeHandle           = 82300ef4 [endpoint 0x00000081]
  TransferFlags        = 00000003 (USBD_TRANSFER_DIRECTION_IN, USBD_SHORT_TRANSFER_OK)
  TransferBufferLength = 00000005
  TransferBuffer       = 00000000
  TransferBufferMDL    = 81b65b08
    00000000: 00 00 03 ff 03
  UrbLink              = 00000000
[631455 ms] UsbSnoop - DispatchAny(f8916610) : IRP_MJ_INTERNAL_DEVICE_CONTROL
[631455 ms] UsbSnoop - MyDispatchInternalIOCTL(f8917e80) : fdo=822eee08, Irp=81cb8e48, IRQL=2
[631455 ms]  >>>  URB 1000 going down  >>> 
-- URB_FUNCTION_BULK_OR_INTERRUPT_TRANSFER:
  PipeHandle           = 82300ef4 [endpoint 0x00000081]
  TransferFlags        = 00000003 (USBD_TRANSFER_DIRECTION_IN, USBD_SHORT_TRANSFER_OK)
  TransferBufferLength = 00000100
  TransferBuffer       = 00000000
  TransferBufferMDL    = 81b65b08
  UrbLink              = 00000000
[631457 ms] UsbSnoop - MyInternalIOCTLCompletion(f8917db0) : fido=81b964f0, Irp=81cb8e48, Context=822f3898, IRQL=2
[631457 ms]  <<<  URB 1000 coming back  <<< 
-- URB_FUNCTION_BULK_OR_INTERRUPT_TRANSFER:
  PipeHandle           = 82300ef4 [endpoint 0x00000081]
  TransferFlags        = 00000003 (USBD_TRANSFER_DIRECTION_IN, USBD_SHORT_TRANSFER_OK)
  TransferBufferLength = 00000100
  TransferBuffer       = 00000000
  TransferBufferMDL    = 81b65b08
    00000000: 00 00 00 00 0d cf e0 00 00 00 00 00 14 ff e0 00
    00000010: 00 00 00 00 a7 9f f0 00 00 00 00 00 63 cf f8 00
    00000020: 00 00 00 00 67 ef fc 00 00 00 00 00 9f 9f fc 00
    00000030: 00 00 00 00 bf ff fc 00 00 00 00 01 ef ff fc 00
    00000040: 00 00 00 03 ff ff fc 00 00 00 00 45 ff df fe 00
    00000050: 00 00 00 40 7f ff fe 00 00 40 40 05 ff ff fe 00
    00000060: 00 f0 02 7f ff ff fc 00 00 7f c7 ff ff ff fc 00
    00000070: 00 7f e7 ff ff ff fe 00 00 7f e3 ff ff ff fc 00
    00000080: 00 3d c7 ff ff ff fc 00 00 1b 8f a6 ff ff fc 00
    00000090: 00 17 8f 83 ff ff fc 00 00 00 1e cf ff ff fc 00
    000000a0: 00 00 1f 83 ef ff fc 00 00 00 1f 8f 0f fd fc 00
    000000b0: 00 00 1f 80 1f ff ff 00 01 00 1f 80 7f ff fd 00
    000000c0: 00 00 3f 00 ff ff fc 00 00 00 3f 80 7f fe fc 00
    000000d0: 00 00 ff 81 ff ff f8 00 01 01 ff c0 ff ff f8 00
    000000e0: 04 00 ff 85 ff ff f0 00 01 04 3f 87 ff ff e0 00
    000000f0: 01 00 0f a7 ff ff f0 00 00 80 2d 17 bf ff b0 00
  UrbLink              = 00000000
[631485 ms] UsbSnoop - DispatchAny(f8916610) : IRP_MJ_INTERNAL_DEVICE_CONTROL
[631485 ms] UsbSnoop - MyDispatchInternalIOCTL(f8917e80) : fdo=822eee08, Irp=81cb8e48, IRQL=2
[631485 ms]  >>>  URB 1001 going down  >>> 
-- URB_FUNCTION_BULK_OR_INTERRUPT_TRANSFER:
  PipeHandle           = 82300ef4 [endpoint 0x00000081]
  TransferFlags        = 00000003 (USBD_TRANSFER_DIRECTION_IN, USBD_SHORT_TRANSFER_OK)
  TransferBufferLength = 00000100
  TransferBuffer       = 00000000
  TransferBufferMDL    = 81b65b08
  UrbLink              = 00000000
[631487 ms] UsbSnoop - MyInternalIOCTLCompletion(f8917db0) : fido=81b964f0, Irp=81cb8e48, Context=81b4ccc0, IRQL=2
[631487 ms]  <<<  URB 1001 coming back  <<< 
-- URB_FUNCTION_BULK_OR_INTERRUPT_TRANSFER:
  PipeHandle           = 82300ef4 [endpoint 0x00000081]
  TransferFlags        = 00000003 (USBD_TRANSFER_DIRECTION_IN, USBD_SHORT_TRANSFER_OK)
  TransferBufferLength = 00000100
  TransferBuffer       = 00000000
  TransferBufferMDL    = 81b65b08
    00000000: 00 80 21 1f ff fe e0 00 08 80 01 ed ff ff e0 00
    00000010: 02 80 ff ed ff ff e0 00 01 87 ff f9 ff ff c0 00
    00000020: 08 06 03 f9 ff ff 80 00 00 48 7f f1 ff ff 00 00
    00000030: 00 08 ff f1 ff ff 00 00 00 00 7f 21 ff fe 00 00
    00000040: 00 00 00 01 ff fe 00 00 00 00 00 00 ff fd 80 00
    00000050: 00 00 00 21 ff f9 c0 00 00 00 21 7f ff e3 c0 00
    00000060: 00 00 21 ff ff c7 e0 00 00 00 63 ff ff 0f e0 00
    00000070: 00 06 67 ff f8 3f f0 00 00 01 f7 ff e0 ff f0 00
    00000080: 00 00 ff ff 83 ff f8 00 00 02 3f fe 0f ff f8 00
    00000090: 00 00 0f f1 ff ff fc 00 00 04 3f ff ef ff fc 00
    000000a0: 00 0e 6f fb 1f ff ff 00 00 1f 7f e0 7f ff ff 80
    000000b0: 3f bf 0f 07 ff ff ff c0 3f ff 8c 1f ff ff ff c0
    000000c0: 7f ff c0 7f ff ff ff c0 7f ff 79 ff ff ff ff c0
    000000d0: ff ff ff ff ff ff ff c0 ff ff d3 ff ff ff ff c0
    000000e0: ff ff bf ff ff ff ff c0 ff ff 7f ff ff ff ff c0
    000000f0: ff fe ff ff ff ff ff c0 df 02 55 00 4a 00 3a ff
  UrbLink              = 00000000
[631515 ms] UsbSnoop - DispatchAny(f8916610) : IRP_MJ_INTERNAL_DEVICE_CONTROL
[631515 ms] UsbSnoop - MyDispatchInternalIOCTL(f8917e80) : fdo=822eee08, Irp=81cb8e48, IRQL=2
[631515 ms]  >>>  URB 1002 going down  >>> 
-- URB_FUNCTION_BULK_OR_INTERRUPT_TRANSFER:
  PipeHandle           = 82300ef4 [endpoint 0x00000081]
  TransferFlags        = 00000003 (USBD_TRANSFER_DIRECTION_IN, USBD_SHORT_TRANSFER_OK)
  TransferBufferLength = 00000100
  TransferBuffer       = 00000000
  TransferBufferMDL    = 81b65b08
  UrbLink              = 00000000
[631517 ms] UsbSnoop - MyInternalIOCTLCompletion(f8917db0) : fido=81b964f0, Irp=81cb8e48, Context=81cb4e48, IRQL=2
[631517 ms]  <<<  URB 1002 coming back  <<< 
-- URB_FUNCTION_BULK_OR_INTERRUPT_TRANSFER:
  PipeHandle           = 82300ef4 [endpoint 0x00000081]
  TransferFlags        = 00000003 (USBD_TRANSFER_DIRECTION_IN, USBD_SHORT_TRANSFER_OK)
  TransferBufferLength = 00000100
  TransferBuffer       = 00000000
  TransferBufferMDL    = 81b65b08
    00000000: ff ff ff ff ff ff c0 ff ff ff fe 1f ff ff c0 ff
    00000010: ff fc 20 07 ff ff c0 ff ff dc 00 08 ff ff c0 ff
    00000020: ff b8 00 0c 3f ff c0 ff ff f0 00 03 8f ff c0 ff
    00000030: ff c0 00 01 f3 ff c0 ff ff 80 00 00 7f ff c0 ff
    00000040: ff 00 00 00 3f ff c0 ff fe 00 00 00 3f ff c0 ff
    00000050: fc 00 00 00 3f ff c0 ff fc 00 00 00 3f ff c0 ff
    00000060: f8 00 00 00 3f ff c0 ff f0 00 00 00 1f ff c0 ff
    00000070: f4 00 00 00 1f ff c0 ff f0 00 00 00 0f ff c0 ff
    00000080: f0 00 00 00 0f ff c0 ff e4 00 00 00 0f ff c0 ff
    00000090: e0 00 00 00 07 ff c0 ff e8 00 00 00 0f ff c0 ff
    000000a0: e8 00 00 00 07 ff c0 ff ec 00 10 00 07 ff c0 ff
    000000b0: ff c0 00 00 00 ff c0 ff e0 e0 00 00 00 df c0 ff
    000000c0: e0 20 be 00 00 7f c0 ff ef 60 ff 80 00 3f c0 ff
    000000d0: ff c0 0c 60 00 3f c0 ff fd c0 00 00 00 3f c0 ff
    000000e0: f5 c0 00 00 03 9f c0 ff f7 c0 00 00 01 df c0 ff
    000000f0: e7 c0 00 00 00 df c0 ff ef c0 00 00 00 9f c0 ff
  UrbLink              = 00000000
[631545 ms] UsbSnoop - DispatchAny(f8916610) : IRP_MJ_INTERNAL_DEVICE_CONTROL
[631545 ms] UsbSnoop - MyDispatchInternalIOCTL(f8917e80) : fdo=822eee08, Irp=81cb8e48, IRQL=2
[631545 ms]  >>>  URB 1003 going down  >>> 
-- URB_FUNCTION_BULK_OR_INTERRUPT_TRANSFER:
  PipeHandle           = 82300ef4 [endpoint 0x00000081]
  TransferFlags        = 00000003 (USBD_TRANSFER_DIRECTION_IN, USBD_SHORT_TRANSFER_OK)
  TransferBufferLength = 00000100
  TransferBuffer       = 00000000
  TransferBufferMDL    = 81b65b08
  UrbLink              = 00000000
[631547 ms] UsbSnoop - MyInternalIOCTLCompletion(f8917db0) : fido=81b964f0, Irp=81cb8e48, Context=822f3898, IRQL=2
[631547 ms]  <<<  URB 1003 coming back  <<< 
-- URB_FUNCTION_BULK_OR_INTERRUPT_TRANSFER:
  PipeHandle           = 82300ef4 [endpoint 0x00000081]
  TransferFlags        = 00000003 (USBD_TRANSFER_DIRECTION_IN, USBD_SHORT_TRANSFER_OK)
  TransferBufferLength = 000000ff
  TransferBuffer       = 00000000
  TransferBufferMDL    = 81b65b08
    00000000: ef 80 00 00 20 3f c0 ff ef 00 40 00 22 3f c0 ff
    00000010: ef c0 60 00 00 3f c0 ff ff e7 30 00 00 7f c0 ff
    00000020: f7 f8 18 00 00 7f c0 ff f7 c8 0c 00 00 ff c0 ff
    00000030: f7 00 06 00 03 ff c0 ff fc 00 03 40 03 ff c0 ff
    00000040: f8 80 01 00 01 ff c0 ff f1 9d 00 00 01 ff c0 ff
    00000050: fd fe e0 80 01 ff c0 ff ff f0 7f 80 03 ff c0 ff
    00000060: ff f9 00 00 02 ff c0 ff ff f8 00 00 00 ff c0 ff
    00000070: ff f8 00 00 01 1f c0 ff ff f8 00 03 02 1f c0 ff
    00000080: ff f0 00 02 00 1f c0 ff ff f0 00 e4 00 1f c0 ff
    00000090: ff f1 00 f8 40 7f c0 ff ff f9 83 f8 00 ff c0 ff
    000000a0: ff ff df f2 03 ff c0 ff ff ff ff cc 0f ff c0 ff
    000000b0: ff ff ff b0 3f ff c0 ff ff ff ff e0 7f ff c0 ff
    000000c0: ff ff ff 81 ff ff c0 ff ff f7 fe 07 ff ff c0 ff
    000000d0: ff f7 f8 1f ff ff c0 ff ff e3 e0 7f ff ff c0 ff
    000000e0: ff e3 00 ff ff ff c0 ff ff e2 03 ff ff ff c0 ff
    000000f0: ff df 0f ff ff ff c0 ff ff ff 9f ff ff ff c0
  UrbLink              = 00000000
[631575 ms] UsbSnoop - DispatchAny(f8916610) : IRP_MJ_INTERNAL_DEVICE_CONTROL
[631575 ms] UsbSnoop - MyDispatchInternalIOCTL(f8917e80) : fdo=822eee08, Irp=81cb8e48, IRQL=2
[631575 ms]  >>>  URB 1004 going down  >>> 
-- URB_FUNCTION_BULK_OR_INTERRUPT_TRANSFER:
  PipeHandle           = 82300f14 [endpoint 0x00000002]
  TransferFlags        = 00000000 (USBD_TRANSFER_DIRECTION_OUT, ~USBD_SHORT_TRANSFER_OK)
  TransferBufferLength = 00000007
  TransferBuffer       = 00000000
  TransferBufferMDL    = 81b65b08
    00000000: 00 00 00 02 05 e0 00
  UrbLink              = 00000000
[631576 ms] UsbSnoop - MyInternalIOCTLCompletion(f8917db0) : fido=81b964f0, Irp=81cb8e48, Context=81b4ccc0, IRQL=2
[631576 ms]  <<<  URB 1004 coming back  <<< 
-- URB_FUNCTION_BULK_OR_INTERRUPT_TRANSFER:
  PipeHandle           = 82300f14 [endpoint 0x00000002]
  TransferFlags        = 00000000 (USBD_TRANSFER_DIRECTION_OUT, ~USBD_SHORT_TRANSFER_OK)
  TransferBufferLength = 00000007
  TransferBuffer       = 00000000
  TransferBufferMDL    = 81b65b08
  UrbLink              = 00000000
[631586 ms] UsbSnoop - DispatchAny(f8916610) : IRP_MJ_INTERNAL_DEVICE_CONTROL
[631586 ms] UsbSnoop - MyDispatchInternalIOCTL(f8917e80) : fdo=822eee08, Irp=81cb8e48, IRQL=2
[631586 ms]  >>>  URB 1005 going down  >>> 
-- URB_FUNCTION_BULK_OR_INTERRUPT_TRANSFER:
  PipeHandle           = 82300ef4 [endpoint 0x00000081]
  TransferFlags        = 00000003 (USBD_TRANSFER_DIRECTION_IN, USBD_SHORT_TRANSFER_OK)
  TransferBufferLength = 00000100
  TransferBuffer       = 00000000
  TransferBufferMDL    = 81b65b08
  UrbLink              = 00000000
[631586 ms] UsbSnoop - MyInternalIOCTLCompletion(f8917db0) : fido=81b964f0, Irp=81cb8e48, Context=822f3898, IRQL=2
[631586 ms]  <<<  URB 1005 coming back  <<< 
-- URB_FUNCTION_BULK_OR_INTERRUPT_TRANSFER:
  PipeHandle           = 82300ef4 [endpoint 0x00000081]
  TransferFlags        = 00000003 (USBD_TRANSFER_DIRECTION_IN, USBD_SHORT_TRANSFER_OK)
  TransferBufferLength = 00000005
  TransferBuffer       = 00000000
  TransferBufferMDL    = 81b65b08
    00000000: 00 00 03 ff 03
  UrbLink              = 00000000
[631615 ms] UsbSnoop - DispatchAny(f8916610) : IRP_MJ_INTERNAL_DEVICE_CONTROL
[631615 ms] UsbSnoop - MyDispatchInternalIOCTL(f8917e80) : fdo=822eee08, Irp=81cb8e48, IRQL=2
[631616 ms]  >>>  URB 1006 going down  >>> 
-- URB_FUNCTION_BULK_OR_INTERRUPT_TRANSFER:
  PipeHandle           = 82300ef4 [endpoint 0x00000081]
  TransferFlags        = 00000003 (USBD_TRANSFER_DIRECTION_IN, USBD_SHORT_TRANSFER_OK)
  TransferBufferLength = 00000100
  TransferBuffer       = 00000000
  TransferBufferMDL    = 81b65b08
  UrbLink              = 00000000
[631617 ms] UsbSnoop - MyInternalIOCTLCompletion(f8917db0) : fido=81b964f0, Irp=81cb8e48, Context=81cdfe48, IRQL=2
[631617 ms]  <<<  URB 1006 coming back  <<< 
-- URB_FUNCTION_BULK_OR_INTERRUPT_TRANSFER:
  PipeHandle           = 82300ef4 [endpoint 0x00000081]
  TransferFlags        = 00000003 (USBD_TRANSFER_DIRECTION_IN, USBD_SHORT_TRANSFER_OK)
  TransferBufferLength = 00000100
  TransferBuffer       = 00000000
  TransferBufferMDL    = 81b65b08
    00000000: ff ff ff ff ff ff ff c0 ff fd ff ff ff ff ff c0
    00000010: ff fd ff ff ff ff ff c0 ff fb ff ff ff ff ff c0
    00000020: ff ff ff ff ff ff ff c0 ff ff ff ff ff ff ff c0
    00000030: ff e7 ff ff ff ff ff c0 ff ef ff ff ff ff ff c0
    00000040: ff ff ff ff ff ff ff c0 ff ff ff ff ff ff ff c0
    00000050: df 02 55 00 4a 00 3f ff ff ff ff ff ff ff fe ff
    00000060: ff ff 93 ff ff ff fe ff ff f8 3f ff ff ff fe ff
    00000070: ff e1 7f ff ff ff fe ff ff 9b ff ff fb ff fe ff
    00000080: ff 3d ff ff fd ff fe ff fe df ff 7f fe ff fe ff
    00000090: f9 ff ff ff ff ff fe ff fa ff 8f ef ff ff fe ff
    000000a0: f1 ff 0f ff ff ff fe ff ef fc 1f bf ff ff fe ff
    000000b0: cf 80 3f ff ff ff fe ff f0 00 3f ff ff ff fe ff
    000000c0: 80 00 3f ff ff ff fe ff 80 00 9f ff ff ff fe ff
    000000d0: 00 00 1f ff ff ff fe ff 00 00 3f ff ff ff fe ff
    000000e0: 00 00 3f ff ff ff fe ff 00 00 3f ff ff ff fe ff
    000000f0: 00 00 7f ff ff ff fe fe 00 00 7f ff ff ff fe fe
  UrbLink              = 00000000
[631646 ms] UsbSnoop - DispatchAny(f8916610) : IRP_MJ_INTERNAL_DEVICE_CONTROL
[631646 ms] UsbSnoop - MyDispatchInternalIOCTL(f8917e80) : fdo=822eee08, Irp=81cb8e48, IRQL=2
[631646 ms]  >>>  URB 1007 going down  >>> 
-- URB_FUNCTION_BULK_OR_INTERRUPT_TRANSFER:
  PipeHandle           = 82300ef4 [endpoint 0x00000081]
  TransferFlags        = 00000003 (USBD_TRANSFER_DIRECTION_IN, USBD_SHORT_TRANSFER_OK)
  TransferBufferLength = 00000100
  TransferBuffer       = 00000000
  TransferBufferMDL    = 81b65b08
  UrbLink              = 00000000
[631648 ms] UsbSnoop - MyInternalIOCTLCompletion(f8917db0) : fido=81b964f0, Irp=81cb8e48, Context=81b4ccc0, IRQL=2
[631648 ms]  <<<  URB 1007 coming back  <<< 
-- URB_FUNCTION_BULK_OR_INTERRUPT_TRANSFER:
  PipeHandle           = 82300ef4 [endpoint 0x00000081]
  TransferFlags        = 00000003 (USBD_TRANSFER_DIRECTION_IN, USBD_SHORT_TRANSFER_OK)
  TransferBufferLength = 00000100
  TransferBuffer       = 00000000
  TransferBufferMDL    = 81b65b08
    00000000: 00 01 ff ff ff ff fe fe 00 00 ff ff ff ff fe fe
    00000010: 00 00 ff ff ff ff fe fe 00 03 ff ff ff ff fe ff
    00000020: 00 07 ff ff ff ff fe ff 00 0f 9f ff ff ff fe ff
    00000030: 00 5f 0f ff ff ff fe ff 00 7c ff ff ff ff fe ff
    00000040: 1c 37 2f ff ff ff fe ff 3a 3f 2f ff ff ff fe ff
    00000050: c6 2f 07 ff ff ff fe ff 9d 3e 87 bf ff ff fe ff
    00000060: ba 3d 85 7f ff ff fe ff e0 7f 00 ff ff ff fe ff
    00000070: e2 7f 90 ff ff ff fe ff e6 7f e1 ff ff ff fe ff
    00000080: e0 7f 80 ff ff ff fe ff e0 7f 81 ff ff ff fe ff
    00000090: e0 7f c1 ff ff ff fe ff f0 7f e1 ff ff ff fe ff
    000000a0: f0 7f f3 ff ff ff fe ff f0 7f f9 ff ff ff 7e ff
    000000b0: f8 df f9 ff ff ff 3e ff f8 8f fe 7f ff ff 7e ff
    000000c0: f8 83 ff 7f ff fe 7e ff fd 82 7f ff ff fc fe ff
    000000d0: fc 80 27 ff ff fc fe ff fc 03 fd ff ff f9 fe ff
    000000e0: fe 03 f8 7f ff f3 fe ff fe 0f 0e 7f ff e3 fe ff
    000000f0: ff 30 7f 7f ff c7 fe ff ff 20 7f 7f ff cf fe ff
  UrbLink              = 00000000
[631676 ms] UsbSnoop - DispatchAny(f8916610) : IRP_MJ_INTERNAL_DEVICE_CONTROL
[631676 ms] UsbSnoop - MyDispatchInternalIOCTL(f8917e80) : fdo=822eee08, Irp=81cb8e48, IRQL=2
[631676 ms]  >>>  URB 1008 going down  >>> 
-- URB_FUNCTION_BULK_OR_INTERRUPT_TRANSFER:
  PipeHandle           = 82300ef4 [endpoint 0x00000081]
  TransferFlags        = 00000003 (USBD_TRANSFER_DIRECTION_IN, USBD_SHORT_TRANSFER_OK)
  TransferBufferLength = 00000100
  TransferBuffer       = 00000000
  TransferBufferMDL    = 81b65b08
  UrbLink              = 00000000
[631678 ms] UsbSnoop - MyInternalIOCTLCompletion(f8917db0) : fido=81b964f0, Irp=81cb8e48, Context=81cb4e48, IRQL=2
[631678 ms]  <<<  URB 1008 coming back  <<< 
-- URB_FUNCTION_BULK_OR_INTERRUPT_TRANSFER:
  PipeHandle           = 82300ef4 [endpoint 0x00000081]
  TransferFlags        = 00000003 (USBD_TRANSFER_DIRECTION_IN, USBD_SHORT_TRANSFER_OK)
  TransferBufferLength = 00000100
  TransferBuffer       = 00000000
  TransferBufferMDL    = 81b65b08
    00000000: ff 80 7f ff ff 1f fe ff ff 80 7f ff fe 1f fe ff
    00000010: ff c0 3f ff fc 3f fe ff ff c0 0f ff f8 3f fe ff
    00000020: ff e0 1f ff f0 7f fe ff ff f0 1f ff e0 ff fe ff
    00000030: ff f0 07 ff c0 ff fe ff ff f8 1f ff 01 ff fe ff
    00000040: ff fc 1f be 01 ff fe ff ff fc 1f 3c 03 ff fe ff
    00000050: ff ff 7f f0 07 ff fe ff ff ff e6 00 07 ff fe ff
    00000060: ff ff f4 00 03 ff fe ff ff ff c2 00 07 ff fe ff
    00000070: ff ff c2 00 07 ff fe ff ff fe c0 00 07 ff fe ff
    00000080: ff fe 81 00 0f ff fe ff ff fd 82 00 0b ff fe ff
    00000090: ff ff 02 00 0b ff fe ff ff fb 00 00 03 ff fe ff
    000000a0: ff f7 04 00 01 ff fe df 02 0b 00 4a 00 37 ff ff
    000000b0: ff ff ff ff fe ff ff ff ff ff ff fe ff ff ff ff
    000000c0: ff ff fe ff ff fc 00 3f ff fe ff fb 1f 20 0f ff
    000000d0: fe ff f2 9e 4d e3 ff fe ff fc f9 bf f9 ff fe ff
    000000e0: fc 73 7f fe 7f fe ff fe 2f fe 1f 3f fe ff f2 fc
    000000f0: 00 03 df fe ff cd f8 00 00 6f fe ff bf e0 00 00
  UrbLink              = 00000000
[631707 ms] UsbSnoop - DispatchAny(f8916610) : IRP_MJ_INTERNAL_DEVICE_CONTROL
[631707 ms] UsbSnoop - MyDispatchInternalIOCTL(f8917e80) : fdo=822eee08, Irp=81cb8e48, IRQL=2
[631707 ms]  >>>  URB 1009 going down  >>> 
-- URB_FUNCTION_BULK_OR_INTERRUPT_TRANSFER:
  PipeHandle           = 82300ef4 [endpoint 0x00000081]
  TransferFlags        = 00000003 (USBD_TRANSFER_DIRECTION_IN, USBD_SHORT_TRANSFER_OK)
  TransferBufferLength = 00000100
  TransferBuffer       = 00000000
  TransferBufferMDL    = 81b65b08
  UrbLink              = 00000000
[631709 ms] UsbSnoop - MyInternalIOCTLCompletion(f8917db0) : fido=81b964f0, Irp=81cb8e48, Context=81cdfe48, IRQL=2
[631709 ms]  <<<  URB 1009 coming back  <<< 
-- URB_FUNCTION_BULK_OR_INTERRUPT_TRANSFER:
  PipeHandle           = 82300ef4 [endpoint 0x00000081]
  TransferFlags        = 00000003 (USBD_TRANSFER_DIRECTION_IN, USBD_SHORT_TRANSFER_OK)
  TransferBufferLength = 000000ff
  TransferBuffer       = 00000000
  TransferBufferMDL    = 81b65b08
    00000000: f7 fe ff ff 00 00 00 ff fe ff f8 00 00 00 7f fe
    00000010: ff f8 00 00 00 0f fe ff 38 00 00 00 0d 7e ff f0
    00000020: 00 00 00 01 fe fd 28 00 00 00 40 be ff 60 00 00
    00000030: 00 40 be ff 40 00 00 00 20 2e d6 c0 00 00 00 20
    00000040: 36 fe 80 00 00 00 24 b6 da 20 00 00 00 24 ba 8d
    00000050: f0 20 00 00 a6 ba fd fc 00 00 00 e3 3e 75 bf 2c
    00000060: 00 00 60 7a cc ff 3f f1 00 60 7a fd fe 1e f0 08
    00000070: c0 6e f1 26 1f 8c 10 a0 de e1 04 0f c4 80 84 7e
    00000080: ce 78 06 f2 02 0f 5e f2 18 01 0c 04 00 2e 12 18
    00000090: 00 00 00 46 3e f6 20 06 00 00 05 be f2 20 00 00
    000000a0: 01 60 be d2 00 00 00 00 1d 2e fb 00 00 00 00 4c
    000000b0: 5e f2 40 20 00 00 8c de fe e0 10 00 40 28 5e bf
    000000c0: 33 90 00 60 43 de ff 3e c8 08 40 01 fe fe 7c 0c
    000000d0: 06 00 03 fe f6 f0 04 52 00 0b 3e ff 64 06 00 01
    000000e0: 1e fe 6d e0 02 00 01 be 7e ed fc 01 00 09 fb be
    000000f0: ed 5f 00 00 31 1d fe ee c1 f0 00 23 2d fe 27
  UrbLink              = 00000000
[631736 ms] UsbSnoop - DispatchAny(f8916610) : IRP_MJ_INTERNAL_DEVICE_CONTROL
[631736 ms] UsbSnoop - MyDispatchInternalIOCTL(f8917e80) : fdo=822eee08, Irp=81cb8e48, IRQL=2
[631736 ms]  >>>  URB 1010 going down  >>> 
-- URB_FUNCTION_BULK_OR_INTERRUPT_TRANSFER:
  PipeHandle           = 82300f14 [endpoint 0x00000002]
  TransferFlags        = 00000000 (USBD_TRANSFER_DIRECTION_OUT, ~USBD_SHORT_TRANSFER_OK)
  TransferBufferLength = 00000007
  TransferBuffer       = 00000000
  TransferBufferMDL    = 81b65b08
    00000000: 00 00 00 02 05 e0 00
  UrbLink              = 00000000
[631736 ms] UsbSnoop - MyInternalIOCTLCompletion(f8917db0) : fido=81b964f0, Irp=81cb8e48, Context=81b4ccc0, IRQL=2
[631736 ms]  <<<  URB 1010 coming back  <<< 
-- URB_FUNCTION_BULK_OR_INTERRUPT_TRANSFER:
  PipeHandle           = 82300f14 [endpoint 0x00000002]
  TransferFlags        = 00000000 (USBD_TRANSFER_DIRECTION_OUT, ~USBD_SHORT_TRANSFER_OK)
  TransferBufferLength = 00000007
  TransferBuffer       = 00000000
  TransferBufferMDL    = 81b65b08
  UrbLink              = 00000000
[631746 ms] UsbSnoop - DispatchAny(f8916610) : IRP_MJ_INTERNAL_DEVICE_CONTROL
[631746 ms] UsbSnoop - MyDispatchInternalIOCTL(f8917e80) : fdo=822eee08, Irp=81cb8e48, IRQL=2
[631746 ms]  >>>  URB 1011 going down  >>> 
-- URB_FUNCTION_BULK_OR_INTERRUPT_TRANSFER:
  PipeHandle           = 82300ef4 [endpoint 0x00000081]
  TransferFlags        = 00000003 (USBD_TRANSFER_DIRECTION_IN, USBD_SHORT_TRANSFER_OK)
  TransferBufferLength = 00000100
  TransferBuffer       = 00000000
  TransferBufferMDL    = 81b65b08
  UrbLink              = 00000000
[631746 ms] UsbSnoop - MyInternalIOCTLCompletion(f8917db0) : fido=81b964f0, Irp=81cb8e48, Context=81cb4e48, IRQL=2
[631746 ms]  <<<  URB 1011 coming back  <<< 
-- URB_FUNCTION_BULK_OR_INTERRUPT_TRANSFER:
  PipeHandle           = 82300ef4 [endpoint 0x00000081]
  TransferFlags        = 00000003 (USBD_TRANSFER_DIRECTION_IN, USBD_SHORT_TRANSFER_OK)
  TransferBufferLength = 00000005
  TransferBuffer       = 00000000
  TransferBufferMDL    = 81b65b08
    00000000: 00 00 03 ff 03
  UrbLink              = 00000000
[631776 ms] UsbSnoop - DispatchAny(f8916610) : IRP_MJ_INTERNAL_DEVICE_CONTROL
[631776 ms] UsbSnoop - MyDispatchInternalIOCTL(f8917e80) : fdo=822eee08, Irp=81aac3f8, IRQL=2
[631776 ms]  >>>  URB 1012 going down  >>> 
-- URB_FUNCTION_BULK_OR_INTERRUPT_TRANSFER:
  PipeHandle           = 82300ef4 [endpoint 0x00000081]
  TransferFlags        = 00000003 (USBD_TRANSFER_DIRECTION_IN, USBD_SHORT_TRANSFER_OK)
  TransferBufferLength = 00000100
  TransferBuffer       = 00000000
  TransferBufferMDL    = 81bbe5c0
  UrbLink              = 00000000
[631778 ms] UsbSnoop - MyInternalIOCTLCompletion(f8917db0) : fido=81b964f0, Irp=81aac3f8, Context=81c3bfe8, IRQL=2
[631778 ms]  <<<  URB 1012 coming back  <<< 
-- URB_FUNCTION_BULK_OR_INTERRUPT_TRANSFER:
  PipeHandle           = 82300ef4 [endpoint 0x00000081]
  TransferFlags        = 00000003 (USBD_TRANSFER_DIRECTION_IN, USBD_SHORT_TRANSFER_OK)
  TransferBufferLength = 00000100
  TransferBuffer       = 00000000
  TransferBufferMDL    = 81bbe5c0
    00000000: 70 30 00 48 e7 fe 77 f8 00 00 11 bf fe b6 fc 00
    00000010: 00 21 7f fe fb 9e 08 03 03 bf fe fb 01 0c 2e 07
    00000020: bf fe 3d c0 06 70 0f ff fe fd e0 00 c0 3f ff fe
    00000030: ec f8 00 80 7f ff fe fd a7 19 41 ff ff fe f3 f4
    00000040: ff c3 ff ff fe c7 ff fe 9f ff ff fe 3f fb f0 bf
    00000050: ff ff fe ff fe 01 ff 7f ff fe ff ff ff f9 ff ff
    00000060: fe ed ff ff e7 ff ff fe bf ff ff 1f ff ff ee ff
    00000070: ff ee ff ff ff fe ff f7 df ff ff ff fe f0 7f bf
    00000080: ff ff ff fe 87 ff e7 ff ff ff fe 7f ff ff ff ff
    00000090: ff fe ff ff ff ff ff ff fe ff c1 8f ff ff ff fe
    000000a0: ff 00 3f df ff ff fe ff 00 07 3f ff ff fe fe 00
    000000b0: 01 ff ff ff fe df 4e 56 ff a8 48 ee 0c 08 ff f4
    000000c0: 34 7c 00 c8 24 52 3e bc 00 00 20 6e 00 08 2f 08
    000000d0: f8 80 58 8f 26 48 20 0b 67 34 41 ee ff ac 2e 88
    000000e0: f9 54 36 00 66 0c 20 6a 04 24 2e 90 fb 64 f9 55
    000000f0: 60 12 22 6a 04 24 22 8b 0c 43 01 0e 67 06 30 3c
  UrbLink              = 00000000
[631806 ms] UsbSnoop - DispatchAny(f8916610) : IRP_MJ_INTERNAL_DEVICE_CONTROL
[631806 ms] UsbSnoop - MyDispatchInternalIOCTL(f8917e80) : fdo=822eee08, Irp=81cb8e48, IRQL=2
[631806 ms]  >>>  URB 1013 going down  >>> 
-- URB_FUNCTION_BULK_OR_INTERRUPT_TRANSFER:
  PipeHandle           = 82300ef4 [endpoint 0x00000081]
  TransferFlags        = 00000003 (USBD_TRANSFER_DIRECTION_IN, USBD_SHORT_TRANSFER_OK)
  TransferBufferLength = 00000100
  TransferBuffer       = 00000000
  TransferBufferMDL    = 81bbe5c0
  UrbLink              = 00000000
[631808 ms] UsbSnoop - MyInternalIOCTLCompletion(f8917db0) : fido=81b964f0, Irp=81cb8e48, Context=81abee68, IRQL=2
[631808 ms]  <<<  URB 1013 coming back  <<< 
-- URB_FUNCTION_BULK_OR_INTERRUPT_TRANSFER:
  PipeHandle           = 82300ef4 [endpoint 0x00000081]
  TransferFlags        = 00000003 (USBD_TRANSFER_DIRECTION_IN, USBD_SHORT_TRANSFER_OK)
  TransferBufferLength = 00000100
  TransferBuffer       = 00000000
  TransferBufferMDL    = 81bbe5c0
    00000000: 00 00 60 0a 22 6a 04 24 22 8b 30 3c 00 01 4c ee
    00000010: 0c 08 ff f4 4e 5e 4e 75 4e 56 ff e8 41 ee ff ec
    00000020: 2e 88 20 6e 00 08 2f 08 f8 7b 3e bc 00 00 48 6e
    00000030: ff ff f8 66 4e 5e 4e 75 4e 56 ff 54 48 ee 1c 18
    00000040: ff ec 24 6e 00 0a 36 7c 00 c8 26 53 28 6b 04 24
    00000050: 28 54 70 00 3d 40 ff e8 26 00 34 80 41 ee ff a0
    00000060: 2e 88 f9 54 38 00 66 00 00 6a 41 ee ff 58 2e 88
    00000070: f9 54 38 00 66 3a 33 fc 00 01 ff ff ff ff 41 ee
    00000080: ff ea 2e 88 2f 0a 3f 2e 00 08 fa 60 5c 8f 4a 40
    00000090: 67 1c fa 44 3d 40 ff e8 3e bc 00 00 3f 00 fa 5d
    000000a0: 54 8f 22 6b 04 24 b9 d1 67 04 fa 44 36 00 f9 55
    000000b0: 33 fc 00 00 ff ff ff ff 43 ee ff e8 2e 89 f8 98
    000000c0: 22 6b 04 24 22 8c 4a 44 67 04 3e 84 f9 53 f9 55
    000000d0: 60 02 34 84 30 03 4c ee 1c 18 ff ec 4e 5e 4e 75
    000000e0: 4e 56 ff 8c 48 ee 0c 38 ff ec 24 6e 00 0c 78 00
    000000f0: 42 40 10 12 e1 48 42 42 14 2a 00 01 d0 42 54 40
  UrbLink              = 00000000
[631836 ms] UsbSnoop - DispatchAny(f8916610) : IRP_MJ_INTERNAL_DEVICE_CONTROL
[631836 ms] UsbSnoop - MyDispatchInternalIOCTL(f8917e80) : fdo=822eee08, Irp=81cb8e48, IRQL=2
[631836 ms]  >>>  URB 1014 going down  >>> 
-- URB_FUNCTION_BULK_OR_INTERRUPT_TRANSFER:
  PipeHandle           = 82300ef4 [endpoint 0x00000081]
  TransferFlags        = 00000003 (USBD_TRANSFER_DIRECTION_IN, USBD_SHORT_TRANSFER_OK)
  TransferBufferLength = 00000100
  TransferBuffer       = 00000000
  TransferBufferMDL    = 81bbe5c0
  UrbLink              = 00000000
[631838 ms] UsbSnoop - MyInternalIOCTLCompletion(f8917db0) : fido=81b964f0, Irp=81cb8e48, Context=81cdfe48, IRQL=2
[631838 ms]  <<<  URB 1014 coming back  <<< 
-- URB_FUNCTION_BULK_OR_INTERRUPT_TRANSFER:
  PipeHandle           = 82300ef4 [endpoint 0x00000081]
  TransferFlags        = 00000003 (USBD_TRANSFER_DIRECTION_IN, USBD_SHORT_TRANSFER_OK)
  TransferBufferLength = 00000100
  TransferBuffer       = 00000000
  TransferBufferMDL    = 81bbe5c0
    00000000: 3a 00 43 ee ff 90 2e 89 f9 54 36 00 66 5a 43 ee
    00000010: ff d8 2e 89 2f 2e 00 08 fb e9 58 8f 4a 40 66 44
    00000020: 43 ee ff eb 2e 89 fb 3b 22 4a 56 89 2e 89 3f 05
    00000030: 3f 3c 40 02 48 6e ff eb f8 86 50 8f 26 00 67 24
    00000040: 2e 83 f8 79 26 48 20 0b 67 1a 38 2b 00 0c 67 14
    00000050: 70 00 30 05 2e 80 2f 0a 3f 04 f8 96 54 8f 2f 08
    00000060: fa 6a 50 8f f9 55 60 0c 3e bc 00 00 3f 03 f9 51
    00000070: 70 00 60 02 30 04 4c ee 0c 38 ff ec 4e 5e 4e 75
    00000080: 28 29 00 00 4e 56 ff ec 48 ee 04 18 ff f4 70 50
    00000090: 2e 80 f8 90 36 00 67 4c 2e ae 00 08 3f 03 f8 96
    000000a0: 54 8f 24 48 2f 0a fa 6c 2e bc ff ff ff ff 2f 0a
    000000b0: fa 6e 41 ee ff f2 2e 88 3f 03 4e ba fe 7c 4f ef
    000000c0: 00 0a 38 00 67 04 3e 84 f8 97 3e 83 f8 97 4a 6e
    000000d0: ff f2 67 10 3e bc 00 00 3f 2e ff f2 f9 51 30 3c
    000000e0: 00 00 60 04 30 3c 00 01 4c ee 04 18 ff f4 4e 5e
    000000f0: 4e 75 4e 56 ff a0 41 ee ff a4 2e 88 f9 54 4a 40
  UrbLink              = 00000000
[631866 ms] UsbSnoop - DispatchAny(f8916610) : IRP_MJ_INTERNAL_DEVICE_CONTROL
[631866 ms] UsbSnoop - MyDispatchInternalIOCTL(f8917e80) : fdo=822eee08, Irp=81cb8e48, IRQL=2
[631866 ms]  >>>  URB 1015 going down  >>> 
-- URB_FUNCTION_BULK_OR_INTERRUPT_TRANSFER:
  PipeHandle           = 82300ef4 [endpoint 0x00000081]
  TransferFlags        = 00000003 (USBD_TRANSFER_DIRECTION_IN, USBD_SHORT_TRANSFER_OK)
  TransferBufferLength = 00000100
  TransferBuffer       = 00000000
  TransferBufferMDL    = 81bbe5c0
  UrbLink              = 00000000
[631868 ms] UsbSnoop - MyInternalIOCTLCompletion(f8917db0) : fido=81b964f0, Irp=81cb8e48, Context=81c3bfe8, IRQL=2
[631868 ms]  <<<  URB 1015 coming back  <<< 
-- URB_FUNCTION_BULK_OR_INTERRUPT_TRANSFER:
  PipeHandle           = 82300ef4 [endpoint 0x00000081]
  TransferFlags        = 00000003 (USBD_TRANSFER_DIRECTION_IN, USBD_SHORT_TRANSFER_OK)
  TransferBufferLength = 000000ff
  TransferBuffer       = 00000000
  TransferBufferMDL    = 81bbe5c0
    00000000: 66 1c 41 ee ff ec 2e 88 2f 2e 00 08 fb e9 58 8f
    00000010: 4a 40 66 08 41 ee ff ff 2e 88 fb 3b f9 55 4e 5e
    00000020: 4e 75 70 6f 74 75 73 00 70 6f 74 75 73 5c 61 6a
    00000030: 30 37 00 70 6f 74 75 73 5c 61 6a 31 37 00 70 6f
    00000040: 74 75 73 5c 61 6c 31 36 00 70 6f 74 75 73 5c 62
    00000050: 68 32 33 00 70 6f 74 75 73 5c 63 61 32 31 00 70
    00000060: 6f 74 75 73 5c 63 63 33 30 00 70 6f 74 75 73 5c
    00000070: 64 65 33 34 00 70 6f 74 75 73 5c 66 70 31 34 00
    00000080: 70 6f 74 75 73 5c 66 72 33 32 00 70 6f 74 75 73
    00000090: 5c 67 62 34 31 00 70 6f 74 75 73 5c 67 62 34 33
    000000a0: 00 70 6f 74 75 73 5c 67 63 32 32 00 70 6f 74 75
    000000b0: 73 5c 67 66 33 38 00 70 6f 74 75 73 5c 67 77 30
    000000c0: 31 00 70 6f 74 75 73 5c 68 68 33 31 00 70 6f 74
    000000d0: 75 73 5c 68 74 33 33 00 70 6f 74 75 73 5c 6a 61
    000000e0: 30 32 00 70 6f 74 75 73 5c 6a 61 30 36 00 70 6f
    000000f0: 74 75 73 5c 6a 62 31 35 00 70 6f 74 75 73 5c
  UrbLink              = 00000000
[631896 ms] UsbSnoop - DispatchAny(f8916610) : IRP_MJ_INTERNAL_DEVICE_CONTROL
[631896 ms] UsbSnoop - MyDispatchInternalIOCTL(f8917e80) : fdo=822eee08, Irp=81d19818, IRQL=2
[631896 ms]  >>>  URB 1016 going down  >>> 
-- URB_FUNCTION_BULK_OR_INTERRUPT_TRANSFER:
  PipeHandle           = 82300f14 [endpoint 0x00000002]
  TransferFlags        = 00000000 (USBD_TRANSFER_DIRECTION_OUT, ~USBD_SHORT_TRANSFER_OK)
  TransferBufferLength = 00000007
  TransferBuffer       = 00000000
  TransferBufferMDL    = 81bbe5c0
    00000000: 00 00 00 02 05 e0 00
  UrbLink              = 00000000
[631896 ms] UsbSnoop - MyInternalIOCTLCompletion(f8917db0) : fido=81b964f0, Irp=81d19818, Context=81abee68, IRQL=2
[631896 ms]  <<<  URB 1016 coming back  <<< 
-- URB_FUNCTION_BULK_OR_INTERRUPT_TRANSFER:
  PipeHandle           = 82300f14 [endpoint 0x00000002]
  TransferFlags        = 00000000 (USBD_TRANSFER_DIRECTION_OUT, ~USBD_SHORT_TRANSFER_OK)
  TransferBufferLength = 00000007
  TransferBuffer       = 00000000
  TransferBufferMDL    = 81bbe5c0
  UrbLink              = 00000000
[631907 ms] UsbSnoop - DispatchAny(f8916610) : IRP_MJ_INTERNAL_DEVICE_CONTROL
[631907 ms] UsbSnoop - MyDispatchInternalIOCTL(f8917e80) : fdo=822eee08, Irp=81d19818, IRQL=2
[631907 ms]  >>>  URB 1017 going down  >>> 
-- URB_FUNCTION_BULK_OR_INTERRUPT_TRANSFER:
  PipeHandle           = 82300ef4 [endpoint 0x00000081]
  TransferFlags        = 00000003 (USBD_TRANSFER_DIRECTION_IN, USBD_SHORT_TRANSFER_OK)
  TransferBufferLength = 00000100
  TransferBuffer       = 00000000
  TransferBufferMDL    = 81bbe5c0
  UrbLink              = 00000000
[631910 ms] UsbSnoop - MyInternalIOCTLCompletion(f8917db0) : fido=81b964f0, Irp=81d19818, Context=81cdfe48, IRQL=2
[631910 ms]  <<<  URB 1017 coming back  <<< 
-- URB_FUNCTION_BULK_OR_INTERRUPT_TRANSFER:
  PipeHandle           = 82300ef4 [endpoint 0x00000081]
  TransferFlags        = 00000003 (USBD_TRANSFER_DIRECTION_IN, USBD_SHORT_TRANSFER_OK)
  TransferBufferLength = 00000005
  TransferBuffer       = 00000000
  TransferBufferMDL    = 81bbe5c0
    00000000: 00 00 03 ff 03
  UrbLink              = 00000000
[631936 ms] UsbSnoop - DispatchAny(f8916610) : IRP_MJ_INTERNAL_DEVICE_CONTROL
[631936 ms] UsbSnoop - MyDispatchInternalIOCTL(f8917e80) : fdo=822eee08, Irp=81d19818, IRQL=2
[631936 ms]  >>>  URB 1018 going down  >>> 
-- URB_FUNCTION_BULK_OR_INTERRUPT_TRANSFER:
  PipeHandle           = 82300ef4 [endpoint 0x00000081]
  TransferFlags        = 00000003 (USBD_TRANSFER_DIRECTION_IN, USBD_SHORT_TRANSFER_OK)
  TransferBufferLength = 00000100
  TransferBuffer       = 00000000
  TransferBufferMDL    = 81bbe5c0
  UrbLink              = 00000000
[631938 ms] UsbSnoop - MyInternalIOCTLCompletion(f8917db0) : fido=81b964f0, Irp=81d19818, Context=81c3bfe8, IRQL=2
[631938 ms]  <<<  URB 1018 coming back  <<< 
-- URB_FUNCTION_BULK_OR_INTERRUPT_TRANSFER:
  PipeHandle           = 82300ef4 [endpoint 0x00000081]
  TransferFlags        = 00000003 (USBD_TRANSFER_DIRECTION_IN, USBD_SHORT_TRANSFER_OK)
  TransferBufferLength = 00000100
  TransferBuffer       = 00000000
  TransferBufferMDL    = 81bbe5c0
    00000000: 6a 63 33 39 00 70 6f 74 75 73 5c 6a 67 32 30 00
    00000010: 70 6f 74 75 73 5c 6a 6b 33 35 00 70 6f 74 75 73
    00000020: 5c 6a 6d 30 34 00 70 6f 74 75 73 5c 6a 6d 30 35
    00000030: 00 70 6f 74 75 73 5c 6a 70 31 31 00 70 6f 74 75
    00000040: 73 5c 6a 74 31 30 00 70 6f 74 75 73 5c 6c 6a 33
    00000050: 36 00 70 6f 74 75 73 5c 6d 62 30 38 00 70 6f 74
    00000060: 75 73 5c 6d 66 31 33 00 70 6f 74 75 73 5c 70 6f
    00000070: 74 75 73 00 70 6f 74 75 73 5c 70 72 64 62 00 70
    00000080: 6f 74 75 73 5c 72 65 61 64 6d 65 00 70 6f 74 75
    00000090: 73 5c 72 68 31 39 00 70 6f 74 75 73 5c 72 6e 33
    000000a0: 37 00 70 6f 74 75 73 5c 72 72 34 30 00 70 6f 74
    000000b0: 75 73 5c 74 6a 30 33 00 70 6f 74 75 73 5c 74 72
    000000c0: 32 36 00 70 6f 74 75 73 5c 75 67 31 38 00 70 6f
    000000d0: 74 75 73 5c 77 63 34 32 00 70 6f 74 75 73 5c 77
    000000e0: 68 30 39 00 70 6f 74 75 73 5c 77 68 32 39 00 70
    000000f0: 6f 74 75 73 5c 77 6d 32 35 00 70 6f 74 75 73 5c
  UrbLink              = 00000000
[631966 ms] UsbSnoop - DispatchAny(f8916610) : IRP_MJ_INTERNAL_DEVICE_CONTROL
[631966 ms] UsbSnoop - MyDispatchInternalIOCTL(f8917e80) : fdo=822eee08, Irp=81d19818, IRQL=2
[631966 ms]  >>>  URB 1019 going down  >>> 
-- URB_FUNCTION_BULK_OR_INTERRUPT_TRANSFER:
  PipeHandle           = 82300ef4 [endpoint 0x00000081]
  TransferFlags        = 00000003 (USBD_TRANSFER_DIRECTION_IN, USBD_SHORT_TRANSFER_OK)
  TransferBufferLength = 00000100
  TransferBuffer       = 00000000
  TransferBufferMDL    = 81bbe5c0
  UrbLink              = 00000000
[631968 ms] UsbSnoop - MyInternalIOCTLCompletion(f8917db0) : fido=81b964f0, Irp=81d19818, Context=81abee68, IRQL=2
[631968 ms]  <<<  URB 1019 coming back  <<< 
-- URB_FUNCTION_BULK_OR_INTERRUPT_TRANSFER:
  PipeHandle           = 82300ef4 [endpoint 0x00000081]
  TransferFlags        = 00000003 (USBD_TRANSFER_DIRECTION_IN, USBD_SHORT_TRANSFER_OK)
  TransferBufferLength = 00000100
  TransferBuffer       = 00000000
  TransferBufferMDL    = 81bbe5c0
    00000000: 77 74 32 37 00 70 6f 74 75 73 5c 77 77 32 38 00
    00000010: 70 6f 74 75 73 5c 7a 72 31 32 00 70 6f 74 75 73
    00000020: 5c 70 6f 74 75 73 00 70 6f 74 75 73 00 4d 41 49
    00000030: 4e 00 00 48 e7 00 30 51 8f 24 6f 00 18 4a 79 ff
    00000040: ff ff ff 66 3a 36 7c 00 c8 26 53 20 4b 0c a0 00
    00000050: 00 05 db 6d 0e 20 6b 17 68 4e 90 0c 68 02 04 00
    00000060: 02 64 14 41 f9 ff ff ff ff 70 14 91 c0 08 e8 00
    00000070: 04 00 01 60 00 02 e0 33 fc 00 01 ff ff ff ff 70
    00000080: 00 30 12 0c 80 00 00 07 03 67 0e 0c 80 00 00 07
    00000090: 07 67 00 02 c2 60 00 02 ba 4a 79 ff ff ff ff 66
    000000a0: 00 02 b4 3e bc 00 e5 fa ee 2e 8a f9 57 2e bc ff
    000000b0: ff ff ff 4e ba fb 02 2e bc ff ff ff ff 48 7a fd
    000000c0: 6a 4e ba fc 1e 2e bc ff ff ff ff 48 7a fd 67 4e
    000000d0: ba fc 10 2e bc ff ff ff ff 48 7a fd 64 4e ba fc
    000000e0: 02 2e bc ff ff ff ff 48 7a fd 61 4e ba fb f4 2e
    000000f0: bc ff ff ff ff 48 7a fd 5e 4e ba fb e6 2e bc ff
  UrbLink              = 00000000
[631996 ms] UsbSnoop - DispatchAny(f8916610) : IRP_MJ_INTERNAL_DEVICE_CONTROL
[631996 ms] UsbSnoop - MyDispatchInternalIOCTL(f8917e80) : fdo=822eee08, Irp=81d19818, IRQL=2
[631996 ms]  >>>  URB 1020 going down  >>> 
-- URB_FUNCTION_BULK_OR_INTERRUPT_TRANSFER:
  PipeHandle           = 82300ef4 [endpoint 0x00000081]
  TransferFlags        = 00000003 (USBD_TRANSFER_DIRECTION_IN, USBD_SHORT_TRANSFER_OK)
  TransferBufferLength = 00000100
  TransferBuffer       = 00000000
  TransferBufferMDL    = 81bbe5c0
  UrbLink              = 00000000
[631998 ms] UsbSnoop - MyInternalIOCTLCompletion(f8917db0) : fido=81b964f0, Irp=81d19818, Context=81cdfe48, IRQL=2
[631998 ms]  <<<  URB 1020 coming back  <<< 
-- URB_FUNCTION_BULK_OR_INTERRUPT_TRANSFER:
  PipeHandle           = 82300ef4 [endpoint 0x00000081]
  TransferFlags        = 00000003 (USBD_TRANSFER_DIRECTION_IN, USBD_SHORT_TRANSFER_OK)
  TransferBufferLength = 00000100
  TransferBuffer       = 00000000
  TransferBufferMDL    = 81bbe5c0
    00000000: ff ff ff 48 7a fd 5b 4e ba fb d8 2e bc ff ff ff
    00000010: ff 48 7a fd 58 4e ba fb ca 2e bc ff ff ff ff 48
    00000020: 7a fd 55 4e ba fb bc 2e bc ff ff ff ff 48 7a fd
    00000030: 52 4e ba fb ae 2e bc ff ff ff ff 48 7a fd 4f 4e
    00000040: ba fb a0 2e bc ff ff ff ff 48 7a fd 4c 4e ba fb
    00000050: 92 2e bc ff ff ff ff 48 7a fd 49 4e ba fb 84 2e
    00000060: bc ff ff ff ff 48 7a fd 46 4e ba fb 76 2e bc ff
    00000070: ff ff ff 48 7a fd 43 4e ba fb 68 2e bc ff ff ff
    00000080: ff 48 7a fd 40 4e ba fb 5a 2e bc ff ff ff ff 48
    00000090: 7a fd 3d 4e ba fb 4c 2e bc ff ff ff ff 48 7a fd
    000000a0: 3a 4e ba fb 3e 2e bc ff ff ff ff 48 7a fd 37 4e
    000000b0: ba fb 30 2e bc ff ff ff ff 48 7a fd 34 4e ba fb
    000000c0: 22 2e bc ff ff ff ff 48 7a fd 31 4e ba fb 14 2e
    000000d0: bc ff ff ff ff 48 7a fd 2e 4e ba fb 06 2e bc ff
    000000e0: ff ff ff 48 7a fd 2b 4e ba fa f8 2e bc ff ff ff
    000000f0: ff 48 7a fd 28 4e ba fa ea 2e bc ff ff ff ff 48
  UrbLink              = 00000000
[632026 ms] UsbSnoop - DispatchAny(f8916610) : IRP_MJ_INTERNAL_DEVICE_CONTROL
[632026 ms] UsbSnoop - MyDispatchInternalIOCTL(f8917e80) : fdo=822eee08, Irp=81d19818, IRQL=2
[632026 ms]  >>>  URB 1021 going down  >>> 
-- URB_FUNCTION_BULK_OR_INTERRUPT_TRANSFER:
  PipeHandle           = 82300ef4 [endpoint 0x00000081]
  TransferFlags        = 00000003 (USBD_TRANSFER_DIRECTION_IN, USBD_SHORT_TRANSFER_OK)
  TransferBufferLength = 00000100
  TransferBuffer       = 00000000
  TransferBufferMDL    = 81bbe5c0
  UrbLink              = 00000000
[632028 ms] UsbSnoop - MyInternalIOCTLCompletion(f8917db0) : fido=81b964f0, Irp=81d19818, Context=81c3bfe8, IRQL=2
[632028 ms]  <<<  URB 1021 coming back  <<< 
-- URB_FUNCTION_BULK_OR_INTERRUPT_TRANSFER:
  PipeHandle           = 82300ef4 [endpoint 0x00000081]
  TransferFlags        = 00000003 (USBD_TRANSFER_DIRECTION_IN, USBD_SHORT_TRANSFER_OK)
  TransferBufferLength = 000000ff
  TransferBuffer       = 00000000
  TransferBufferMDL    = 81bbe5c0
    00000000: 7a fd 25 4e ba fa dc 2e bc ff ff ff ff 48 7a fd
    00000010: 22 4e ba fa ce 2e bc ff ff ff ff 48 7a fd 1f 4e
    00000020: ba fa c0 2e bc ff ff ff ff 48 7a fd 1c 4e ba fa
    00000030: b2 2e bc ff ff ff ff 48 7a fd 19 4e ba fa a4 2e
    00000040: bc ff ff ff ff 48 7a fd 16 4e ba fa 96 2e bc ff
    00000050: ff ff ff 48 7a fd 13 4e ba fa 88 2e bc ff ff ff
    00000060: ff 48 7a fd 11 4e ba fa 7a 2e bc ff ff ff ff 48
    00000070: 7a fd 0e 4e ba fa 6c 2e bc ff ff ff ff 48 7a fd
    00000080: 0d 4e ba fa 5e 2e bc ff ff ff ff 48 7a fd 0a 4e
    00000090: ba fa 50 2e bc ff ff ff ff 48 7a fd 07 4e ba fa
    000000a0: 42 2e bc ff ff ff ff 48 7a fd 04 4e ba fa 34 2e
    000000b0: bc ff ff ff ff 48 7a fd 01 4e ba fa 26 2e bc ff
    000000c0: ff ff ff 48 7a fc fe 4e ba fa 18 2e bc ff ff ff
    000000d0: ff 48 7a fc fb 4e ba fa 0a 2e bc ff ff ff ff 48
    000000e0: 7a fc f8 4e ba f9 fc 2e bc ff ff ff ff 48 7a fc
    000000f0: f5 4e ba f9 ee 2e bc ff ff ff ff 48 7a fc f2
  UrbLink              = 00000000
[632056 ms] UsbSnoop - DispatchAny(f8916610) : IRP_MJ_INTERNAL_DEVICE_CONTROL
[632056 ms] UsbSnoop - MyDispatchInternalIOCTL(f8917e80) : fdo=822eee08, Irp=81d19818, IRQL=2
[632056 ms]  >>>  URB 1022 going down  >>> 
-- URB_FUNCTION_BULK_OR_INTERRUPT_TRANSFER:
  PipeHandle           = 82300f14 [endpoint 0x00000002]
  TransferFlags        = 00000000 (USBD_TRANSFER_DIRECTION_OUT, ~USBD_SHORT_TRANSFER_OK)
  TransferBufferLength = 00000007
  TransferBuffer       = 00000000
  TransferBufferMDL    = 81bbe5c0
    00000000: 00 00 00 02 05 e0 00
  UrbLink              = 00000000
[632056 ms] UsbSnoop - MyInternalIOCTLCompletion(f8917db0) : fido=81b964f0, Irp=81d19818, Context=81abee68, IRQL=2
[632056 ms]  <<<  URB 1022 coming back  <<< 
-- URB_FUNCTION_BULK_OR_INTERRUPT_TRANSFER:
  PipeHandle           = 82300f14 [endpoint 0x00000002]
  TransferFlags        = 00000000 (USBD_TRANSFER_DIRECTION_OUT, ~USBD_SHORT_TRANSFER_OK)
  TransferBufferLength = 00000007
  TransferBuffer       = 00000000
  TransferBufferMDL    = 81bbe5c0
  UrbLink              = 00000000
[632066 ms] UsbSnoop - DispatchAny(f8916610) : IRP_MJ_INTERNAL_DEVICE_CONTROL
[632066 ms] UsbSnoop - MyDispatchInternalIOCTL(f8917e80) : fdo=822eee08, Irp=81d19818, IRQL=2
[632066 ms]  >>>  URB 1023 going down  >>> 
-- URB_FUNCTION_BULK_OR_INTERRUPT_TRANSFER:
  PipeHandle           = 82300ef4 [endpoint 0x00000081]
  TransferFlags        = 00000003 (USBD_TRANSFER_DIRECTION_IN, USBD_SHORT_TRANSFER_OK)
  TransferBufferLength = 00000100
  TransferBuffer       = 00000000
  TransferBufferMDL    = 81bbe5c0
  UrbLink              = 00000000
[632066 ms] UsbSnoop - MyInternalIOCTLCompletion(f8917db0) : fido=81b964f0, Irp=81d19818, Context=81cdfe48, IRQL=2
[632066 ms]  <<<  URB 1023 coming back  <<< 
-- URB_FUNCTION_BULK_OR_INTERRUPT_TRANSFER:
  PipeHandle           = 82300ef4 [endpoint 0x00000081]
  TransferFlags        = 00000003 (USBD_TRANSFER_DIRECTION_IN, USBD_SHORT_TRANSFER_OK)
  TransferBufferLength = 00000005
  TransferBuffer       = 00000000
  TransferBufferMDL    = 81bbe5c0
    00000000: 00 00 02 3f 04
  UrbLink              = 00000000
[632097 ms] UsbSnoop - DispatchAny(f8916610) : IRP_MJ_INTERNAL_DEVICE_CONTROL
[632097 ms] UsbSnoop - MyDispatchInternalIOCTL(f8917e80) : fdo=822eee08, Irp=81d19818, IRQL=2
[632097 ms]  >>>  URB 1024 going down  >>> 
-- URB_FUNCTION_BULK_OR_INTERRUPT_TRANSFER:
  PipeHandle           = 82300ef4 [endpoint 0x00000081]
  TransferFlags        = 00000003 (USBD_TRANSFER_DIRECTION_IN, USBD_SHORT_TRANSFER_OK)
  TransferBufferLength = 00000100
  TransferBuffer       = 00000000
  TransferBufferMDL    = 81bbe5c0
  UrbLink              = 00000000
[632099 ms] UsbSnoop - MyInternalIOCTLCompletion(f8917db0) : fido=81b964f0, Irp=81d19818, Context=81abee68, IRQL=2
[632099 ms]  <<<  URB 1024 coming back  <<< 
-- URB_FUNCTION_BULK_OR_INTERRUPT_TRANSFER:
  PipeHandle           = 82300ef4 [endpoint 0x00000081]
  TransferFlags        = 00000003 (USBD_TRANSFER_DIRECTION_IN, USBD_SHORT_TRANSFER_OK)
  TransferBufferLength = 00000100
  TransferBuffer       = 00000000
  TransferBufferMDL    = 81bbe5c0
    00000000: 4e ba f9 e0 2e bc ff ff ff ff 48 7a fc ef 4e ba
    00000010: f9 d2 2e bc ff ff ff ff 48 7a fc ec 4e ba f9 c4
    00000020: 2e bc ff ff ff ff 48 7a fc e9 4e ba f9 b6 4f ef
    00000030: 00 b4 2e bc ff ff ff ff 4e ba fa 4c 2e bc ff ff
    00000040: ff ff 4e ba f8 d6 2e bc ff ff ff ff f8 e4 fc 8e
    00000050: 60 04 2e 8a f9 57 50 8f 4c df 0c 00 4e 75 43 6f
    00000060: 6e 63 65 70 74 20 41 70 70 3a 55 53 20 50 72 65
    00000070: 73 69 64 65 6e 74 73 0a 55 53 50 52 45 53 0a 56
    00000080: 65 72 73 69 6f 6e 20 31 2e 30 30 0a 30 32 2f 30
    00000090: 31 2f 32 30 30 31 00 00 41 fa ff c4 4e 75 00 00
    000000a0: 70 01 4e 75 00 36 40 06 00 05 f0 12 00 02 00 00
    000000b0: 00 00 00 00 ff ff ff ff cf ff 00 00 00 22 85 04
    000000c0: 00 27 ff ff ff ff 85 00 00 08 85 01 00 0f 85 02
    000000d0: 00 16 85 03 00 1c ff ff ff ff 41 63 74 69 6f 6e
    000000e0: 73 00 57 69 6e 53 74 72 00 44 69 61 6c 6f 67 00
    000000f0: 50 6f 70 75 70 00 47 72 61 79 65 64 2d 6f 75 74
  UrbLink              = 00000000
[632126 ms] UsbSnoop - DispatchAny(f8916610) : IRP_MJ_INTERNAL_DEVICE_CONTROL
[632126 ms] UsbSnoop - MyDispatchInternalIOCTL(f8917e80) : fdo=822eee08, Irp=81d19818, IRQL=2
[632126 ms]  >>>  URB 1025 going down  >>> 
-- URB_FUNCTION_BULK_OR_INTERRUPT_TRANSFER:
  PipeHandle           = 82300ef4 [endpoint 0x00000081]
  TransferFlags        = 00000003 (USBD_TRANSFER_DIRECTION_IN, USBD_SHORT_TRANSFER_OK)
  TransferBufferLength = 00000100
  TransferBuffer       = 00000000
  TransferBufferMDL    = 81bbe5c0
  UrbLink              = 00000000
[632128 ms] UsbSnoop - MyInternalIOCTLCompletion(f8917db0) : fido=81b964f0, Irp=81d19818, Context=81cb4e48, IRQL=2
[632128 ms]  <<<  URB 1025 coming back  <<< 
-- URB_FUNCTION_BULK_OR_INTERRUPT_TRANSFER:
  PipeHandle           = 82300ef4 [endpoint 0x00000081]
  TransferFlags        = 00000003 (USBD_TRANSFER_DIRECTION_IN, USBD_SHORT_TRANSFER_OK)
  TransferBufferLength = 00000100
  TransferBuffer       = 00000000
  TransferBufferMDL    = 81bbe5c0
    00000000: 00 48 46 4f 4e 54 00 00 00 48 00 05 b4 46 ff ff
    00000010: ff ff 02 04 0c 0e 00 00 00 00 00 0a 0b 00 02 04
    00000020: 0c 18 00 06 00 0b 00 0a 0b 00 0a 01 0c 22 00 0c
    00000030: ff ff ff ff 00 00 0a 01 0c 2c 00 18 ff ff ff ff
    00000040: 00 01 08 80 00 00 00 22 01 04 00 00 00 00 00 00
    00000050: 45 44 49 54 31 00 45 44 49 54 32 00 46 49 52 53
    00000060: 54 20 50 4f 50 55 50 00 32 4e 44 20 50 4f 50 55
    00000070: 50 00 44 49 41 4c 4f 47 20 48 45 41 44 45 52 00
    00000080: 00 00 00 20 40 05 00 02 00 13 00 02 00 00 00 00
    00000090: 00 00 ff ff ff ff 80 01 00 00 80 02 00 09 ff ff
    000000a0: ff ff 49 74 65 6d 20 31 2d 31 00 49 74 65 6d 20
    000000b0: 31 2d 32 00 00 24 40 05 00 03 00 1b 00 03 00 00
    000000c0: 00 00 00 00 ff ff ff ff 80 01 00 00 80 02 00 09
    000000d0: 80 03 00 12 ff ff ff ff 49 74 65 6d 20 32 2d 31
    000000e0: 00 49 74 65 6d 20 32 2d 32 00 49 74 65 6d 20 32
    000000f0: 2d 33 00 00 ff ff ff ff 00 00 00 00 02 0d 40 7b
  UrbLink              = 00000000
[632156 ms] UsbSnoop - DispatchAny(f8916610) : IRP_MJ_INTERNAL_DEVICE_CONTROL
[632156 ms] UsbSnoop - MyDispatchInternalIOCTL(f8917e80) : fdo=822eee08, Irp=81d19818, IRQL=2
[632156 ms]  >>>  URB 1026 going down  >>> 
-- URB_FUNCTION_BULK_OR_INTERRUPT_TRANSFER:
  PipeHandle           = 82300ef4 [endpoint 0x00000081]
  TransferFlags        = 00000003 (USBD_TRANSFER_DIRECTION_IN, USBD_SHORT_TRANSFER_OK)
  TransferBufferLength = 00000100
  TransferBuffer       = 00000000
  TransferBufferMDL    = 81bbe5c0
  UrbLink              = 00000000
[632156 ms] UsbSnoop - MyInternalIOCTLCompletion(f8917db0) : fido=81b964f0, Irp=81d19818, Context=81b4ccc0, IRQL=2
[632156 ms]  <<<  URB 1026 coming back  <<< 
-- URB_FUNCTION_BULK_OR_INTERRUPT_TRANSFER:
  PipeHandle           = 82300ef4 [endpoint 0x00000081]
  TransferFlags        = 00000003 (USBD_TRANSFER_DIRECTION_IN, USBD_SHORT_TRANSFER_OK)
  TransferBufferLength = 0000003f
  TransferBuffer       = 00000000
  TransferBufferMDL    = 81bbe5c0
    00000000: 63 e2 8e 10 ca 7d 36 1b 23 a7 44 1c 14 28 63 11
    00000010: d9 6c 17 07 dc 94 9a 15 98 f0 64 7b ba cb 36 b2
    00000020: 86 5b d2 e0 a3 7a d4 1f 61 fb 2c 5f 8b 2a 48 6a
    00000030: 6d d8 15 76 ae 86 90 09 ca 96 06 a9 65 67 87
  UrbLink              = 00000000
[632186 ms] UsbSnoop - DispatchAny(f8916610) : IRP_MJ_INTERNAL_DEVICE_CONTROL
[632186 ms] UsbSnoop - MyDispatchInternalIOCTL(f8917e80) : fdo=822eee08, Irp=81d19818, IRQL=2
[632186 ms]  >>>  URB 1027 going down  >>> 
-- URB_FUNCTION_BULK_OR_INTERRUPT_TRANSFER:
  PipeHandle           = 82300f14 [endpoint 0x00000002]
  TransferFlags        = 00000000 (USBD_TRANSFER_DIRECTION_OUT, ~USBD_SHORT_TRANSFER_OK)
  TransferBufferLength = 00000007
  TransferBuffer       = 00000000
  TransferBufferMDL    = 81bbe5c0
    00000000: 00 00 00 02 05 e0 00
  UrbLink              = 00000000
[632187 ms] UsbSnoop - MyInternalIOCTLCompletion(f8917db0) : fido=81b964f0, Irp=81d19818, Context=81abee68, IRQL=2
[632187 ms]  <<<  URB 1027 coming back  <<< 
-- URB_FUNCTION_BULK_OR_INTERRUPT_TRANSFER:
  PipeHandle           = 82300f14 [endpoint 0x00000002]
  TransferFlags        = 00000000 (USBD_TRANSFER_DIRECTION_OUT, ~USBD_SHORT_TRANSFER_OK)
  TransferBufferLength = 00000007
  TransferBuffer       = 00000000
  TransferBufferMDL    = 81bbe5c0
  UrbLink              = 00000000
[633200 ms] UsbSnoop - DispatchAny(f8916610) : IRP_MJ_INTERNAL_DEVICE_CONTROL
[633200 ms] UsbSnoop - MyDispatchInternalIOCTL(f8917e80) : fdo=822eee08, Irp=81ab2e48, IRQL=0
[633200 ms]  >>>  URB 1028 going down  >>> 
-- URB_FUNCTION_RESET_PIPE:
  PipeHandle = 82300ef4 [endpoint 0x00000081]
[633200 ms] UsbSnoop - MyInternalIOCTLCompletion(f8917db0) : fido=00000000, Irp=81ab2e48, Context=822f3898, IRQL=0
[633200 ms]  <<<  URB 1028 coming back  <<< 
-- URB_FUNCTION_RESET_PIPE:
[633201 ms] UsbSnoop - DispatchAny(f8916610) : IRP_MJ_INTERNAL_DEVICE_CONTROL
[633201 ms] UsbSnoop - MyDispatchInternalIOCTL(f8917e80) : fdo=822eee08, Irp=81ab2e48, IRQL=0
[633201 ms]  >>>  URB 1029 going down  >>> 
-- URB_FUNCTION_RESET_PIPE:
  PipeHandle = 82300f14 [endpoint 0x00000002]
[633201 ms] UsbSnoop - MyInternalIOCTLCompletion(f8917db0) : fido=00000000, Irp=81ab2e48, Context=81c9a168, IRQL=0
[633201 ms]  <<<  URB 1029 coming back  <<< 
-- URB_FUNCTION_RESET_PIPE:
[633201 ms] UsbSnoop - DispatchAny(f8916610) : IRP_MJ_INTERNAL_DEVICE_CONTROL
[633201 ms] UsbSnoop - MyDispatchInternalIOCTL(f8917e80) : fdo=822eee08, Irp=81cb1670, IRQL=0
