[369337 ms] UsbSnoop - IRP_MJ_POWER (IRP_MN_WAIT_WAKE)
[369337 ms] UsbSnoop - DispatchAny(f88c6610) : IRP_MJ_INTERNAL_DEVICE_CONTROL
[369337 ms] UsbSnoop - MyDispatchInternalIOCTL(f88c7e80) : fdo=82142030, Irp=81baa008, IRQL=0
[369337 ms]  >>>  URB 682 going down  >>> 
-- URB_FUNCTION_RESET_PIPE:
  PipeHandle = 81b44acc [endpoint 0x00000081]
[369338 ms] UsbSnoop - MyInternalIOCTLCompletion(f88c7db0) : fido=00000000, Irp=81baa008, Context=821cc9e0, IRQL=0
[369338 ms]  <<<  URB 682 coming back  <<< 
-- URB_FUNCTION_RESET_PIPE:
[369338 ms] UsbSnoop - DispatchAny(f88c6610) : IRP_MJ_INTERNAL_DEVICE_CONTROL
[369338 ms] UsbSnoop - MyDispatchInternalIOCTL(f88c7e80) : fdo=82142030, Irp=81baa008, IRQL=0
[369338 ms]  >>>  URB 683 going down  >>> 
-- URB_FUNCTION_RESET_PIPE:
  PipeHandle = 81b44aec [endpoint 0x00000002]
[369338 ms] UsbSnoop - MyInternalIOCTLCompletion(f88c7db0) : fido=00000000, Irp=81baa008, Context=81b4d108, IRQL=0
[369338 ms]  <<<  URB 683 coming back  <<< 
-- URB_FUNCTION_RESET_PIPE:
[370629 ms] UsbSnoop - DispatchAny(f88c6610) : IRP_MJ_INTERNAL_DEVICE_CONTROL
[370629 ms] UsbSnoop - MyDispatchInternalIOCTL(f88c7e80) : fdo=82142030, Irp=81c33ae0, IRQL=2
[370629 ms]  >>>  URB 684 going down  >>> 
-- URB_FUNCTION_BULK_OR_INTERRUPT_TRANSFER:
  PipeHandle           = 81b44aec [endpoint 0x00000002]
  TransferFlags        = 00000000 (USBD_TRANSFER_DIRECTION_OUT, ~USBD_SHORT_TRANSFER_OK)
  TransferBufferLength = 00000009
  TransferBuffer       = 00000000
  TransferBufferMDL    = 8216a008
    00000000: 00 00 00 04 01 00 00 04 00
  UrbLink              = 00000000
[370629 ms] UsbSnoop - MyInternalIOCTLCompletion(f88c7db0) : fido=823a0430, Irp=81c33ae0, Context=81b64160, IRQL=2
[370629 ms]  <<<  URB 684 coming back  <<< 
-- URB_FUNCTION_BULK_OR_INTERRUPT_TRANSFER:
  PipeHandle           = 81b44aec [endpoint 0x00000002]
  TransferFlags        = 00000000 (USBD_TRANSFER_DIRECTION_OUT, ~USBD_SHORT_TRANSFER_OK)
  TransferBufferLength = 00000009
  TransferBuffer       = 00000000
  TransferBufferMDL    = 8216a008
  UrbLink              = 00000000
[370630 ms] UsbSnoop - DispatchAny(f88c6610) : IRP_MJ_INTERNAL_DEVICE_CONTROL
[370630 ms] UsbSnoop - MyDispatchInternalIOCTL(f88c7e80) : fdo=82142030, Irp=81c33ae0, IRQL=2
[370630 ms]  >>>  URB 685 going down  >>> 
-- URB_FUNCTION_BULK_OR_INTERRUPT_TRANSFER:
  PipeHandle           = 81b44acc [endpoint 0x00000081]
  TransferFlags        = 00000003 (USBD_TRANSFER_DIRECTION_IN, USBD_SHORT_TRANSFER_OK)
  TransferBufferLength = 00000100
  TransferBuffer       = 00000000
  TransferBufferMDL    = 8216a008
  UrbLink              = 00000000
[370631 ms] UsbSnoop - MyInternalIOCTLCompletion(f88c7db0) : fido=823a0430, Irp=81c33ae0, Context=81b64160, IRQL=2
[370631 ms]  <<<  URB 685 coming back  <<< 
-- URB_FUNCTION_BULK_OR_INTERRUPT_TRANSFER:
  PipeHandle           = 81b44acc [endpoint 0x00000081]
  TransferFlags        = 00000003 (USBD_TRANSFER_DIRECTION_IN, USBD_SHORT_TRANSFER_OK)
  TransferBufferLength = 00000009
  TransferBuffer       = 00000000
  TransferBufferMDL    = 8216a008
    00000000: 00 00 00 04 02 00 00 03 ff
  UrbLink              = 00000000
[370660 ms] UsbSnoop - DispatchAny(f88c6610) : IRP_MJ_INTERNAL_DEVICE_CONTROL
[370660 ms] UsbSnoop - MyDispatchInternalIOCTL(f88c7e80) : fdo=82142030, Irp=81c33ae0, IRQL=2
[370660 ms]  >>>  URB 686 going down  >>> 
-- URB_FUNCTION_BULK_OR_INTERRUPT_TRANSFER:
  PipeHandle           = 81b44aec [endpoint 0x00000002]
  TransferFlags        = 00000000 (USBD_TRANSFER_DIRECTION_OUT, ~USBD_SHORT_TRANSFER_OK)
  TransferBufferLength = 00000015
  TransferBuffer       = 00000000
  TransferBufferMDL    = 8216a008
    00000000: 00 00 00 10 04 00 00 00 0a 00 01 00 03 00 01 00
    00000010: 00 00 00 07 d0
  UrbLink              = 00000000
[370660 ms] UsbSnoop - MyInternalIOCTLCompletion(f88c7db0) : fido=823a0430, Irp=81c33ae0, Context=81b5f3d0, IRQL=2
[370660 ms]  <<<  URB 686 coming back  <<< 
-- URB_FUNCTION_BULK_OR_INTERRUPT_TRANSFER:
  PipeHandle           = 81b44aec [endpoint 0x00000002]
  TransferFlags        = 00000000 (USBD_TRANSFER_DIRECTION_OUT, ~USBD_SHORT_TRANSFER_OK)
  TransferBufferLength = 00000015
  TransferBuffer       = 00000000
  TransferBufferMDL    = 8216a008
  UrbLink              = 00000000
[370669 ms] UsbSnoop - DispatchAny(f88c6610) : IRP_MJ_INTERNAL_DEVICE_CONTROL
[370669 ms] UsbSnoop - MyDispatchInternalIOCTL(f88c7e80) : fdo=82142030, Irp=81c33ae0, IRQL=2
[370669 ms]  >>>  URB 687 going down  >>> 
-- URB_FUNCTION_BULK_OR_INTERRUPT_TRANSFER:
  PipeHandle           = 81b44acc [endpoint 0x00000081]
  TransferFlags        = 00000003 (USBD_TRANSFER_DIRECTION_IN, USBD_SHORT_TRANSFER_OK)
  TransferBufferLength = 00000100
  TransferBuffer       = 00000000
  TransferBufferMDL    = 8216a008
  UrbLink              = 00000000
[370669 ms] UsbSnoop - MyInternalIOCTLCompletion(f88c7db0) : fido=823a0430, Irp=81c33ae0, Context=81b64160, IRQL=2
[370669 ms]  <<<  URB 687 coming back  <<< 
-- URB_FUNCTION_BULK_OR_INTERRUPT_TRANSFER:
  PipeHandle           = 81b44acc [endpoint 0x00000081]
  TransferFlags        = 00000003 (USBD_TRANSFER_DIRECTION_IN, USBD_SHORT_TRANSFER_OK)
  TransferBufferLength = 00000007
  TransferBuffer       = 00000000
  TransferBufferMDL    = 8216a008
    00000000: 00 00 00 02 05 e0 00
  UrbLink              = 00000000
[370709 ms] UsbSnoop - DispatchAny(f88c6610) : IRP_MJ_INTERNAL_DEVICE_CONTROL
[370709 ms] UsbSnoop - MyDispatchInternalIOCTL(f88c7e80) : fdo=82142030, Irp=81c33ae0, IRQL=2
[370709 ms]  >>>  URB 688 going down  >>> 
-- URB_FUNCTION_BULK_OR_INTERRUPT_TRANSFER:
  PipeHandle           = 81b44acc [endpoint 0x00000081]
  TransferFlags        = 00000003 (USBD_TRANSFER_DIRECTION_IN, USBD_SHORT_TRANSFER_OK)
  TransferBufferLength = 00000100
  TransferBuffer       = 00000000
  TransferBufferMDL    = 8216a008
  UrbLink              = 00000000
[370710 ms] UsbSnoop - MyInternalIOCTLCompletion(f88c7db0) : fido=823a0430, Irp=81c33ae0, Context=81b73460, IRQL=2
[370710 ms]  <<<  URB 688 coming back  <<< 
-- URB_FUNCTION_BULK_OR_INTERRUPT_TRANSFER:
  PipeHandle           = 81b44acc [endpoint 0x00000081]
  TransferFlags        = 00000003 (USBD_TRANSFER_DIRECTION_IN, USBD_SHORT_TRANSFER_OK)
  TransferBufferLength = 00000005
  TransferBuffer       = 00000000
  TransferBufferMDL    = 8216a008
    00000000: 00 00 00 0a 04
  UrbLink              = 00000000
[370739 ms] UsbSnoop - DispatchAny(f88c6610) : IRP_MJ_INTERNAL_DEVICE_CONTROL
[370739 ms] UsbSnoop - MyDispatchInternalIOCTL(f88c7e80) : fdo=82142030, Irp=81c33ae0, IRQL=2
[370739 ms]  >>>  URB 689 going down  >>> 
-- URB_FUNCTION_BULK_OR_INTERRUPT_TRANSFER:
  PipeHandle           = 81b44acc [endpoint 0x00000081]
  TransferFlags        = 00000003 (USBD_TRANSFER_DIRECTION_IN, USBD_SHORT_TRANSFER_OK)
  TransferBufferLength = 00000100
  TransferBuffer       = 00000000
  TransferBufferMDL    = 8216a008
  UrbLink              = 00000000
[370740 ms] UsbSnoop - MyInternalIOCTLCompletion(f88c7db0) : fido=823a0430, Irp=81c33ae0, Context=81b64160, IRQL=2
[370740 ms]  <<<  URB 689 coming back  <<< 
-- URB_FUNCTION_BULK_OR_INTERRUPT_TRANSFER:
  PipeHandle           = 81b44acc [endpoint 0x00000081]
  TransferFlags        = 00000003 (USBD_TRANSFER_DIRECTION_IN, USBD_SHORT_TRANSFER_OK)
  TransferBufferLength = 0000000a
  TransferBuffer       = 00000000
  TransferBufferMDL    = 8216a008
    00000000: 00 00 00 04 00 12 00 00 07 d0
  UrbLink              = 00000000
[370770 ms] UsbSnoop - DispatchAny(f88c6610) : IRP_MJ_INTERNAL_DEVICE_CONTROL
[370770 ms] UsbSnoop - MyDispatchInternalIOCTL(f88c7e80) : fdo=82142030, Irp=81c33ae0, IRQL=2
[370770 ms]  >>>  URB 690 going down  >>> 
-- URB_FUNCTION_BULK_OR_INTERRUPT_TRANSFER:
  PipeHandle           = 81b44aec [endpoint 0x00000002]
  TransferFlags        = 00000000 (USBD_TRANSFER_DIRECTION_OUT, ~USBD_SHORT_TRANSFER_OK)
  TransferBufferLength = 00000007
  TransferBuffer       = 00000000
  TransferBufferMDL    = 8216a008
    00000000: 00 00 00 02 05 e0 00
  UrbLink              = 00000000
[370770 ms] UsbSnoop - MyInternalIOCTLCompletion(f88c7db0) : fido=823a0430, Irp=81c33ae0, Context=81b5f3d0, IRQL=2
[370770 ms]  <<<  URB 690 coming back  <<< 
-- URB_FUNCTION_BULK_OR_INTERRUPT_TRANSFER:
  PipeHandle           = 81b44aec [endpoint 0x00000002]
  TransferFlags        = 00000000 (USBD_TRANSFER_DIRECTION_OUT, ~USBD_SHORT_TRANSFER_OK)
  TransferBufferLength = 00000007
  TransferBuffer       = 00000000
  TransferBufferMDL    = 8216a008
  UrbLink              = 00000000
[370780 ms] UsbSnoop - DispatchAny(f88c6610) : IRP_MJ_INTERNAL_DEVICE_CONTROL
[370780 ms] UsbSnoop - MyDispatchInternalIOCTL(f88c7e80) : fdo=82142030, Irp=81c33ae0, IRQL=2
[370780 ms]  >>>  URB 691 going down  >>> 
-- URB_FUNCTION_BULK_OR_INTERRUPT_TRANSFER:
  PipeHandle           = 81b44aec [endpoint 0x00000002]
  TransferFlags        = 00000000 (USBD_TRANSFER_DIRECTION_OUT, ~USBD_SHORT_TRANSFER_OK)
  TransferBufferLength = 0000000f
  TransferBuffer       = 00000000
  TransferBufferMDL    = 8216a008
    00000000: 00 00 00 0a 04 00 00 00 04 00 07 00 01 00 22
  UrbLink              = 00000000
[370780 ms] UsbSnoop - MyInternalIOCTLCompletion(f88c7db0) : fido=823a0430, Irp=81c33ae0, Context=81b64160, IRQL=2
[370780 ms]  <<<  URB 691 coming back  <<< 
-- URB_FUNCTION_BULK_OR_INTERRUPT_TRANSFER:
  PipeHandle           = 81b44aec [endpoint 0x00000002]
  TransferFlags        = 00000000 (USBD_TRANSFER_DIRECTION_OUT, ~USBD_SHORT_TRANSFER_OK)
  TransferBufferLength = 0000000f
  TransferBuffer       = 00000000
  TransferBufferMDL    = 8216a008
  UrbLink              = 00000000
[370790 ms] UsbSnoop - DispatchAny(f88c6610) : IRP_MJ_INTERNAL_DEVICE_CONTROL
[370790 ms] UsbSnoop - MyDispatchInternalIOCTL(f88c7e80) : fdo=82142030, Irp=81c33ae0, IRQL=2
[370790 ms]  >>>  URB 692 going down  >>> 
-- URB_FUNCTION_BULK_OR_INTERRUPT_TRANSFER:
  PipeHandle           = 81b44acc [endpoint 0x00000081]
  TransferFlags        = 00000003 (USBD_TRANSFER_DIRECTION_IN, USBD_SHORT_TRANSFER_OK)
  TransferBufferLength = 00000100
  TransferBuffer       = 00000000
  TransferBufferMDL    = 8216a008
  UrbLink              = 00000000
[370790 ms] UsbSnoop - MyInternalIOCTLCompletion(f88c7db0) : fido=823a0430, Irp=81c33ae0, Context=81b4e308, IRQL=2
[370790 ms]  <<<  URB 692 coming back  <<< 
-- URB_FUNCTION_BULK_OR_INTERRUPT_TRANSFER:
  PipeHandle           = 81b44acc [endpoint 0x00000081]
  TransferFlags        = 00000003 (USBD_TRANSFER_DIRECTION_IN, USBD_SHORT_TRANSFER_OK)
  TransferBufferLength = 00000007
  TransferBuffer       = 00000000
  TransferBufferMDL    = 8216a008
    00000000: 00 00 00 02 05 e0 00
  UrbLink              = 00000000
[370830 ms] UsbSnoop - DispatchAny(f88c6610) : IRP_MJ_INTERNAL_DEVICE_CONTROL
[370830 ms] UsbSnoop - MyDispatchInternalIOCTL(f88c7e80) : fdo=82142030, Irp=81c33ae0, IRQL=2
[370830 ms]  >>>  URB 693 going down  >>> 
-- URB_FUNCTION_BULK_OR_INTERRUPT_TRANSFER:
  PipeHandle           = 81b44acc [endpoint 0x00000081]
  TransferFlags        = 00000003 (USBD_TRANSFER_DIRECTION_IN, USBD_SHORT_TRANSFER_OK)
  TransferBufferLength = 00000100
  TransferBuffer       = 00000000
  TransferBufferMDL    = 8216a008
  UrbLink              = 00000000
[370830 ms] UsbSnoop - MyInternalIOCTLCompletion(f88c7db0) : fido=823a0430, Irp=81c33ae0, Context=81b60e50, IRQL=2
[370830 ms]  <<<  URB 693 coming back  <<< 
-- URB_FUNCTION_BULK_OR_INTERRUPT_TRANSFER:
  PipeHandle           = 81b44acc [endpoint 0x00000081]
  TransferFlags        = 00000003 (USBD_TRANSFER_DIRECTION_IN, USBD_SHORT_TRANSFER_OK)
  TransferBufferLength = 00000005
  TransferBuffer       = 00000000
  TransferBufferMDL    = 8216a008
    00000000: 00 00 03 ff 03
  UrbLink              = 00000000
[370860 ms] UsbSnoop - DispatchAny(f88c6610) : IRP_MJ_INTERNAL_DEVICE_CONTROL
[370860 ms] UsbSnoop - MyDispatchInternalIOCTL(f88c7e80) : fdo=82142030, Irp=81c33ae0, IRQL=2
[370860 ms]  >>>  URB 694 going down  >>> 
-- URB_FUNCTION_BULK_OR_INTERRUPT_TRANSFER:
  PipeHandle           = 81b44acc [endpoint 0x00000081]
  TransferFlags        = 00000003 (USBD_TRANSFER_DIRECTION_IN, USBD_SHORT_TRANSFER_OK)
  TransferBufferLength = 00000100
  TransferBuffer       = 00000000
  TransferBufferMDL    = 8216a008
  UrbLink              = 00000000
[370862 ms] UsbSnoop - MyInternalIOCTLCompletion(f88c7db0) : fido=823a0430, Irp=81c33ae0, Context=81b73460, IRQL=2
[370862 ms]  <<<  URB 694 coming back  <<< 
-- URB_FUNCTION_BULK_OR_INTERRUPT_TRANSFER:
  PipeHandle           = 81b44acc [endpoint 0x00000081]
  TransferFlags        = 00000003 (USBD_TRANSFER_DIRECTION_IN, USBD_SHORT_TRANSFER_OK)
  TransferBufferLength = 00000100
  TransferBuffer       = 00000000
  TransferBufferMDL    = 8216a008
    00000000: 00 00 0f 07 00 08 00 01 00 22 00 0f 00 00 00 0c
    00000010: 00 00 00 00 00 00 00 00 00 00 00 00 0c 00 00 00
    00000020: 00 00 00 00 00 00 00 00 00 00 00 01 c8 0c 00 00
    00000030: 00 28 00 00 00 00 00 00 00 00 0c 07 08 86 44 00
    00000040: 00 00 00 00 00 00 00 00 00 01 18 0c 00 00 00 29
    00000050: 34 40 00 00 00 00 00 00 0c 01 55 45 6c 00 00 00
    00000060: 00 00 00 00 00 00 00 01 88 0c 00 00 00 3a aa a0
    00000070: 00 00 00 00 00 00 0c 02 15 46 54 00 00 00 00 00
    00000080: 00 00 00 00 00 01 08 0c 00 00 00 2a aa c0 00 00
    00000090: 00 00 00 00 0c 04 55 44 44 00 00 00 00 00 00 00
    000000a0: 00 00 00 01 1c 0c 00 00 00 29 22 60 00 00 00 00
    000000b0: 00 00 0c 04 08 84 44 00 00 00 00 00 00 00 00 00
    000000c0: 00 00 00 0c 00 00 00 00 00 00 00 00 00 00 00 00
    000000d0: 0c 00 00 00 00 00 00 00 00 00 00 00 00 00 00 00
    000000e0: 00 0c 00 00 00 00 00 00 00 00 00 00 00 00 0c 00
    000000f0: 00 00 00 00 00 00 00 00 00 00 00 00 00 22 00 0c
  UrbLink              = 00000000
[370890 ms] UsbSnoop - DispatchAny(f88c6610) : IRP_MJ_INTERNAL_DEVICE_CONTROL
[370890 ms] UsbSnoop - MyDispatchInternalIOCTL(f88c7e80) : fdo=82142030, Irp=81c33ae0, IRQL=2
[370890 ms]  >>>  URB 695 going down  >>> 
-- URB_FUNCTION_BULK_OR_INTERRUPT_TRANSFER:
  PipeHandle           = 81b44acc [endpoint 0x00000081]
  TransferFlags        = 00000003 (USBD_TRANSFER_DIRECTION_IN, USBD_SHORT_TRANSFER_OK)
  TransferBufferLength = 00000100
  TransferBuffer       = 00000000
  TransferBufferMDL    = 8216a008
  UrbLink              = 00000000
[370892 ms] UsbSnoop - MyInternalIOCTLCompletion(f88c7db0) : fido=823a0430, Irp=81c33ae0, Context=81b4e308, IRQL=2
[370892 ms]  <<<  URB 695 coming back  <<< 
-- URB_FUNCTION_BULK_OR_INTERRUPT_TRANSFER:
  PipeHandle           = 81b44acc [endpoint 0x00000081]
  TransferFlags        = 00000003 (USBD_TRANSFER_DIRECTION_IN, USBD_SHORT_TRANSFER_OK)
  TransferBufferLength = 00000100
  TransferBuffer       = 00000000
  TransferBufferMDL    = 8216a008
    00000000: 00 00 00 00 00 00 00 00 00 00 00 00 0c 9c 49 84
    00000010: 8c 00 00 00 00 00 00 00 00 00 00 36 4c ac 00 00
    00000020: 00 00 00 00 00 00 00 00 00 00 0d 50 54 45 50 00
    00000030: 00 00 00 00 00 00 00 00 00 2a aa ac 00 00 00 00
    00000040: 00 00 00 00 00 00 00 00 0d 58 94 89 5c 00 00 00
    00000050: 00 00 00 00 00 00 00 22 ca ac 00 00 00 00 00 00
    00000060: 00 00 00 00 00 00 0d 45 15 11 54 00 00 00 00 00
    00000070: 00 00 00 00 00 22 6a ec 00 00 00 00 00 00 00 00
    00000080: 00 00 00 00 0c 99 09 d0 9c 00 00 00 00 00 00 00
    00000090: 00 00 00 00 00 0c 00 00 00 00 00 00 00 00 00 00
    000000a0: 00 00 0c 00 00 00 00 00 00 00 00 00 00 00 00 00
    000000b0: 00 ff ff ff ff ff ff ff ff ff ff ff ff ff ff ff
    000000c0: ff ff ff ff ff 00 00 00 00 00 00 00 00 00 00 ff
    000000d0: ff ff ff ff ff ff ff ff ff ff ff ff ff ff ff ff
    000000e0: ff ff ff 00 00 00 00 00 00 00 00 00 00 00 00 00
    000000f0: 00 00 00 00 00 00 00 00 00 00 00 00 00 00 00 00
  UrbLink              = 00000000
[370920 ms] UsbSnoop - DispatchAny(f88c6610) : IRP_MJ_INTERNAL_DEVICE_CONTROL
[370920 ms] UsbSnoop - MyDispatchInternalIOCTL(f88c7e80) : fdo=82142030, Irp=81c33ae0, IRQL=2
[370920 ms]  >>>  URB 696 going down  >>> 
-- URB_FUNCTION_BULK_OR_INTERRUPT_TRANSFER:
  PipeHandle           = 81b44acc [endpoint 0x00000081]
  TransferFlags        = 00000003 (USBD_TRANSFER_DIRECTION_IN, USBD_SHORT_TRANSFER_OK)
  TransferBufferLength = 00000100
  TransferBuffer       = 00000000
  TransferBufferMDL    = 8216a008
  UrbLink              = 00000000
[370922 ms] UsbSnoop - MyInternalIOCTLCompletion(f88c7db0) : fido=823a0430, Irp=81c33ae0, Context=81b5f3d0, IRQL=2
[370922 ms]  <<<  URB 696 coming back  <<< 
-- URB_FUNCTION_BULK_OR_INTERRUPT_TRANSFER:
  PipeHandle           = 81b44acc [endpoint 0x00000081]
  TransferFlags        = 00000003 (USBD_TRANSFER_DIRECTION_IN, USBD_SHORT_TRANSFER_OK)
  TransferBufferLength = 00000100
  TransferBuffer       = 00000000
  TransferBufferMDL    = 8216a008
    00000000: 00 00 00 00 00 00 00 00 00 00 00 00 00 00 00 00
    00000010: 00 00 00 00 00 00 00 00 00 00 00 00 00 00 00 00
    00000020: 00 00 00 00 00 00 00 00 00 00 00 00 00 00 00 00
    00000030: 00 00 00 00 00 00 00 00 00 00 00 00 00 00 00 00
    00000040: 00 00 00 00 00 00 00 00 00 00 00 00 00 00 00 00
    00000050: 00 00 00 00 00 00 00 00 00 00 00 00 00 00 00 00
    00000060: 00 00 00 00 00 3f ff ff ff ff ff 80 00 00 00 00
    00000070: 00 00 00 00 00 00 00 00 20 00 00 00 00 00 00 00
    00000080: 00 00 00 3f ff 80 00 1f ff 80 00 00 00 00 00 00
    00000090: 00 00 00 00 00 00 70 00 00 00 00 00 00 00 00 00
    000000a0: 00 3f ff bf ff df ff 80 00 00 00 00 00 00 00 00
    000000b0: 00 00 00 00 f8 00 00 00 00 00 00 00 00 00 00 3f
    000000c0: ff a0 00 5f ff 80 00 00 00 00 00 00 00 00 00 00
    000000d0: 00 01 fc 00 00 00 00 00 00 00 00 00 00 3f ff af
    000000e0: ff 5f ff 80 00 00 00 00 00 00 00 00 00 00 00 03
    000000f0: fe 00 00 00 00 00 00 00 00 00 00 3f ff af ff 5f
  UrbLink              = 00000000
[370950 ms] UsbSnoop - DispatchAny(f88c6610) : IRP_MJ_INTERNAL_DEVICE_CONTROL
[370950 ms] UsbSnoop - MyDispatchInternalIOCTL(f88c7e80) : fdo=82142030, Irp=81c33ae0, IRQL=2
[370950 ms]  >>>  URB 697 going down  >>> 
-- URB_FUNCTION_BULK_OR_INTERRUPT_TRANSFER:
  PipeHandle           = 81b44acc [endpoint 0x00000081]
  TransferFlags        = 00000003 (USBD_TRANSFER_DIRECTION_IN, USBD_SHORT_TRANSFER_OK)
  TransferBufferLength = 00000100
  TransferBuffer       = 00000000
  TransferBufferMDL    = 8216a008
  UrbLink              = 00000000
[370952 ms] UsbSnoop - MyInternalIOCTLCompletion(f88c7db0) : fido=823a0430, Irp=81c33ae0, Context=81b73460, IRQL=2
[370952 ms]  <<<  URB 697 coming back  <<< 
-- URB_FUNCTION_BULK_OR_INTERRUPT_TRANSFER:
  PipeHandle           = 81b44acc [endpoint 0x00000081]
  TransferFlags        = 00000003 (USBD_TRANSFER_DIRECTION_IN, USBD_SHORT_TRANSFER_OK)
  TransferBufferLength = 000000ff
  TransferBuffer       = 00000000
  TransferBufferMDL    = 8216a008
    00000000: ff 80 00 00 00 00 00 00 00 00 f8 00 00 00 00 00
    00000010: 00 00 00 00 00 00 00 00 00 3f ff af ff 5f ff 80
    00000020: 00 00 00 00 00 00 00 00 88 00 00 00 00 00 00 00
    00000030: 00 00 00 00 00 00 00 3f ff af ff 5f ff 80 00 00
    00000040: 00 00 00 00 00 1e 88 00 00 00 00 00 00 00 00 00
    00000050: 00 00 00 00 00 3f ff a0 00 5f ff 80 00 00 00 00
    00000060: 00 00 00 1e 88 00 00 00 00 00 00 00 00 00 00 00
    00000070: 00 00 00 3f ff bf ff df ff 80 00 32 08 00 00 00
    00000080: 00 1e f8 00 00 00 00 00 00 00 00 00 00 00 00 00
    00000090: 00 3f ff a4 92 5f ff 80 00 24 04 0c 00 00 00 1e
    000000a0: 80 00 00 00 00 00 00 00 00 00 00 00 00 00 00 3f
    000000b0: ff a4 92 5f ff 80 00 25 14 12 00 00 00 00 9d ca
    000000c0: 00 00 00 00 00 00 00 00 00 00 00 00 00 3f ff bf
    000000d0: ff df ff 80 00 74 a5 d2 00 00 00 00 91 55 00 00
    000000e0: 00 00 00 00 00 00 00 00 00 00 00 3f ff a4 92 5f
    000000f0: ff 80 00 24 44 12 00 00 00 1e 91 55 00 00 00
  UrbLink              = 00000000
[370991 ms] UsbSnoop - DispatchAny(f88c6610) : IRP_MJ_INTERNAL_DEVICE_CONTROL
[370991 ms] UsbSnoop - MyDispatchInternalIOCTL(f88c7e80) : fdo=82142030, Irp=81c33ae0, IRQL=2
[370991 ms]  >>>  URB 698 going down  >>> 
-- URB_FUNCTION_BULK_OR_INTERRUPT_TRANSFER:
  PipeHandle           = 81b44aec [endpoint 0x00000002]
  TransferFlags        = 00000000 (USBD_TRANSFER_DIRECTION_OUT, ~USBD_SHORT_TRANSFER_OK)
  TransferBufferLength = 00000007
  TransferBuffer       = 00000000
  TransferBufferMDL    = 8216a008
    00000000: 00 00 00 02 05 e0 00
  UrbLink              = 00000000
[370991 ms] UsbSnoop - MyInternalIOCTLCompletion(f88c7db0) : fido=823a0430, Irp=81c33ae0, Context=81b4e308, IRQL=2
[370991 ms]  <<<  URB 698 coming back  <<< 
-- URB_FUNCTION_BULK_OR_INTERRUPT_TRANSFER:
  PipeHandle           = 81b44aec [endpoint 0x00000002]
  TransferFlags        = 00000000 (USBD_TRANSFER_DIRECTION_OUT, ~USBD_SHORT_TRANSFER_OK)
  TransferBufferLength = 00000007
  TransferBuffer       = 00000000
  TransferBufferMDL    = 8216a008
  UrbLink              = 00000000
[371000 ms] UsbSnoop - DispatchAny(f88c6610) : IRP_MJ_INTERNAL_DEVICE_CONTROL
[371000 ms] UsbSnoop - MyDispatchInternalIOCTL(f88c7e80) : fdo=82142030, Irp=81b564a0, IRQL=2
[371000 ms]  >>>  URB 699 going down  >>> 
-- URB_FUNCTION_BULK_OR_INTERRUPT_TRANSFER:
  PipeHandle           = 81b44acc [endpoint 0x00000081]
  TransferFlags        = 00000003 (USBD_TRANSFER_DIRECTION_IN, USBD_SHORT_TRANSFER_OK)
  TransferBufferLength = 00000100
  TransferBuffer       = 00000000
  TransferBufferMDL    = 82173850
  UrbLink              = 00000000
[371000 ms] UsbSnoop - MyInternalIOCTLCompletion(f88c7db0) : fido=823a0430, Irp=81b564a0, Context=81b5f3d0, IRQL=2
[371000 ms]  <<<  URB 699 coming back  <<< 
-- URB_FUNCTION_BULK_OR_INTERRUPT_TRANSFER:
  PipeHandle           = 81b44acc [endpoint 0x00000081]
  TransferFlags        = 00000003 (USBD_TRANSFER_DIRECTION_IN, USBD_SHORT_TRANSFER_OK)
  TransferBufferLength = 00000005
  TransferBuffer       = 00000000
  TransferBufferMDL    = 82173850
    00000000: 00 00 03 ff 03
  UrbLink              = 00000000
[371030 ms] UsbSnoop - DispatchAny(f88c6610) : IRP_MJ_INTERNAL_DEVICE_CONTROL
[371030 ms] UsbSnoop - MyDispatchInternalIOCTL(f88c7e80) : fdo=82142030, Irp=81baa008, IRQL=2
[371030 ms]  >>>  URB 700 going down  >>> 
-- URB_FUNCTION_BULK_OR_INTERRUPT_TRANSFER:
  PipeHandle           = 81b44acc [endpoint 0x00000081]
  TransferFlags        = 00000003 (USBD_TRANSFER_DIRECTION_IN, USBD_SHORT_TRANSFER_OK)
  TransferBufferLength = 00000100
  TransferBuffer       = 00000000
  TransferBufferMDL    = 81bd0480
  UrbLink              = 00000000
[371032 ms] UsbSnoop - MyInternalIOCTLCompletion(f88c7db0) : fido=823a0430, Irp=81baa008, Context=81b73460, IRQL=2
[371032 ms]  <<<  URB 700 coming back  <<< 
-- URB_FUNCTION_BULK_OR_INTERRUPT_TRANSFER:
  PipeHandle           = 81b44acc [endpoint 0x00000081]
  TransferFlags        = 00000003 (USBD_TRANSFER_DIRECTION_IN, USBD_SHORT_TRANSFER_OK)
  TransferBufferLength = 00000100
  TransferBuffer       = 00000000
  TransferBufferMDL    = 81bd0480
    00000000: 00 00 00 00 00 00 00 00 00 00 3f ff a4 92 5f ff
    00000010: 80 00 24 a5 d2 00 00 00 1e 91 d5 00 00 00 00 00
    00000020: 00 00 00 00 00 00 00 00 3f ff bf ff df ff 80 00
    00000030: 25 14 12 00 00 00 1e 90 51 00 00 00 00 00 00 00
    00000040: 00 00 00 00 00 00 3f ff a4 92 5f ff 80 00 24 04
    00000050: 0c 00 00 00 1e 91 d1 00 00 00 00 00 00 00 00 00
    00000060: 00 00 00 00 3f ff a4 92 5f ff 80 00 02 08 00 00
    00000070: 00 00 00 00 00 00 00 00 00 00 00 00 00 00 00 00
    00000080: 00 00 3f ff bf ff df ff 80 00 00 00 00 00 00 00
    00000090: 00 00 00 00 00 00 00 00 00 00 00 00 00 00 00 00
    000000a0: 3f ff a4 92 5f ff 80 00 00 00 00 00 00 00 00 00
    000000b0: 00 00 00 00 00 00 00 00 00 00 00 00 00 00 3f ff
    000000c0: a4 92 5f ff 80 00 00 00 00 00 00 00 00 00 00 00
    000000d0: 00 00 00 00 00 00 00 00 00 00 00 00 3f ff bf ff
    000000e0: df ff 80 00 00 00 00 00 00 00 00 00 00 00 00 00
    000000f0: 00 00 00 00 00 00 00 00 00 00 3f ff 80 00 1f ff
  UrbLink              = 00000000
[371060 ms] UsbSnoop - DispatchAny(f88c6610) : IRP_MJ_INTERNAL_DEVICE_CONTROL
[371060 ms] UsbSnoop - MyDispatchInternalIOCTL(f88c7e80) : fdo=82142030, Irp=81baa008, IRQL=2
[371060 ms]  >>>  URB 701 going down  >>> 
-- URB_FUNCTION_BULK_OR_INTERRUPT_TRANSFER:
  PipeHandle           = 81b44acc [endpoint 0x00000081]
  TransferFlags        = 00000003 (USBD_TRANSFER_DIRECTION_IN, USBD_SHORT_TRANSFER_OK)
  TransferBufferLength = 00000100
  TransferBuffer       = 00000000
  TransferBufferMDL    = 81bd0480
  UrbLink              = 00000000
[371062 ms] UsbSnoop - MyInternalIOCTLCompletion(f88c7db0) : fido=823a0430, Irp=81baa008, Context=81b64160, IRQL=2
[371062 ms]  <<<  URB 701 coming back  <<< 
-- URB_FUNCTION_BULK_OR_INTERRUPT_TRANSFER:
  PipeHandle           = 81b44acc [endpoint 0x00000081]
  TransferFlags        = 00000003 (USBD_TRANSFER_DIRECTION_IN, USBD_SHORT_TRANSFER_OK)
  TransferBufferLength = 00000100
  TransferBuffer       = 00000000
  TransferBufferMDL    = 81bd0480
    00000000: 80 00 00 00 00 00 00 00 00 00 00 00 00 00 00 00
    00000010: 00 00 00 00 00 00 00 00 3f ff ff ff ff ff 80 00
    00000020: 00 00 00 00 00 00 00 00 00 00 00 00 00 00 00 00
    00000030: 00 00 00 00 00 00 3f ff ff ff ff ff 80 00 00 00
    00000040: 00 00 00 00 00 00 00 00 00 00 00 00 00 00 00 00
    00000050: 00 00 00 00 3f ff af ff ff ff 82 40 00 04 03 00
    00000060: 01 80 0c 00 01 c4 00 00 00 00 00 00 00 00 00 00
    00000070: 00 00 3f ff ad 97 7f ff 83 55 a2 50 c4 20 01 54
    00000080: 95 4d a1 0c 00 00 00 00 00 00 00 00 00 00 00 00
    00000090: 3f ff 8a aa bf ff 83 d5 55 65 02 50 01 99 4d 95
    000000a0: 51 94 00 00 00 00 00 00 00 00 00 00 00 00 3f ff
    000000b0: aa aa 7f ff 82 d5 56 45 01 50 01 11 45 15 51 14
    000000c0: 00 00 00 00 00 00 00 00 00 00 00 00 3f ff ad bb
    000000d0: 3f ff 82 5d 13 44 c6 25 41 10 99 0d 11 cd 50 00
    000000e0: 00 00 00 00 00 00 00 00 00 00 3f ff ff ff ff ff
    000000f0: 80 00 00 00 00 00 00 00 00 00 00 00 00 00 00 00
  UrbLink              = 00000000
[371090 ms] UsbSnoop - DispatchAny(f88c6610) : IRP_MJ_INTERNAL_DEVICE_CONTROL
[371090 ms] UsbSnoop - MyDispatchInternalIOCTL(f88c7e80) : fdo=82142030, Irp=81baa008, IRQL=2
[371090 ms]  >>>  URB 702 going down  >>> 
-- URB_FUNCTION_BULK_OR_INTERRUPT_TRANSFER:
  PipeHandle           = 81b44acc [endpoint 0x00000081]
  TransferFlags        = 00000003 (USBD_TRANSFER_DIRECTION_IN, USBD_SHORT_TRANSFER_OK)
  TransferBufferLength = 00000100
  TransferBuffer       = 00000000
  TransferBufferMDL    = 81bd0480
  UrbLink              = 00000000
[371092 ms] UsbSnoop - MyInternalIOCTLCompletion(f88c7db0) : fido=823a0430, Irp=81baa008, Context=81b4e308, IRQL=2
[371092 ms]  <<<  URB 702 coming back  <<< 
-- URB_FUNCTION_BULK_OR_INTERRUPT_TRANSFER:
  PipeHandle           = 81b44acc [endpoint 0x00000081]
  TransferFlags        = 00000003 (USBD_TRANSFER_DIRECTION_IN, USBD_SHORT_TRANSFER_OK)
  TransferBufferLength = 00000100
  TransferBuffer       = 00000000
  TransferBufferMDL    = 81bd0480
    00000000: 00 00 00 00 00 00 00 00 00 00 00 00 00 00 00 00
    00000010: 00 00 00 00 00 00 00 00 00 00 00 00 00 00 00 00
    00000020: 00 00 00 00 00 00 00 00 00 00 00 00 00 00 00 00
    00000030: 00 00 00 00 00 00 00 00 00 00 00 00 00 00 00 00
    00000040: 00 00 00 00 00 00 00 00 00 00 00 00 00 00 00 00
    00000050: 00 00 00 00 00 00 00 00 00 00 00 00 00 00 00 00
    00000060: 00 00 00 00 00 00 00 00 00 00 00 00 00 00 00 00
    00000070: 00 00 00 00 00 00 00 00 00 00 00 00 00 00 00 00
    00000080: 00 00 00 00 00 00 00 00 00 00 00 00 00 00 00 00
    00000090: 00 00 00 00 00 00 00 00 00 00 00 00 00 00 00 00
    000000a0: 00 00 00 00 00 00 00 00 00 00 00 00 00 00 00 00
    000000b0: 00 00 00 00 00 00 00 00 00 00 00 00 00 01 ff ff
    000000c0: f8 00 00 00 00 00 06 00 00 00 18 00 18 00 00 00
    000000d0: 00 00 00 00 00 00 00 00 00 00 00 01 00 60 08 00
    000000e0: 00 00 00 00 0c 00 00 00 1f ff f8 00 00 00 00 00
    000000f0: 00 00 00 00 00 00 00 00 00 01 22 64 48 00 00 00
  UrbLink              = 00000000
[371120 ms] UsbSnoop - DispatchAny(f88c6610) : IRP_MJ_INTERNAL_DEVICE_CONTROL
[371120 ms] UsbSnoop - MyDispatchInternalIOCTL(f88c7e80) : fdo=82142030, Irp=81baa008, IRQL=2
[371120 ms]  >>>  URB 703 going down  >>> 
-- URB_FUNCTION_BULK_OR_INTERRUPT_TRANSFER:
  PipeHandle           = 81b44acc [endpoint 0x00000081]
  TransferFlags        = 00000003 (USBD_TRANSFER_DIRECTION_IN, USBD_SHORT_TRANSFER_OK)
  TransferBufferLength = 00000100
  TransferBuffer       = 00000000
  TransferBufferMDL    = 81bd0480
  UrbLink              = 00000000
[371122 ms] UsbSnoop - MyInternalIOCTLCompletion(f88c7db0) : fido=823a0430, Irp=81baa008, Context=81b73460, IRQL=2
[371122 ms]  <<<  URB 703 coming back  <<< 
-- URB_FUNCTION_BULK_OR_INTERRUPT_TRANSFER:
  PipeHandle           = 81b44acc [endpoint 0x00000081]
  TransferFlags        = 00000003 (USBD_TRANSFER_DIRECTION_IN, USBD_SHORT_TRANSFER_OK)
  TransferBufferLength = 000000ff
  TransferBuffer       = 00000000
  TransferBufferMDL    = 81bd0480
    00000000: 00 00 18 00 00 00 08 00 10 00 00 00 00 00 00 00
    00000010: 00 00 00 00 00 00 00 01 14 62 88 00 00 00 00 00
    00000020: 30 00 00 00 08 00 10 00 00 00 00 00 00 00 00 00
    00000030: 00 00 00 00 00 01 08 61 08 00 00 00 00 00 62 00
    00000040: 00 00 08 00 10 00 00 00 00 00 00 00 00 00 00 00
    00000050: 00 00 00 01 14 61 08 00 00 00 00 00 c4 00 00 00
    00000060: 08 00 10 00 00 00 00 00 00 00 00 00 00 00 00 00
    00000070: 00 01 22 61 08 00 00 00 00 01 88 00 00 00 08 00
    00000080: 10 00 00 00 00 00 00 00 00 00 00 00 00 00 00 01
    00000090: 00 60 08 00 00 00 39 e3 10 00 00 00 08 00 10 00
    000000a0: 00 00 00 00 00 00 00 00 00 00 00 00 00 01 00 60
    000000b0: 08 00 00 00 45 e6 22 00 00 00 08 00 10 00 00 00
    000000c0: 00 00 00 00 00 00 00 00 00 00 00 01 ff ff f8 00
    000000d0: 00 00 41 ef 44 00 00 00 08 00 10 00 00 00 00 00
    000000e0: 00 00 00 00 00 00 00 00 00 01 00 60 08 00 00 00
    000000f0: 41 e9 88 00 00 00 08 00 10 00 00 00 00 00 00
  UrbLink              = 00000000
[371150 ms] UsbSnoop - DispatchAny(f88c6610) : IRP_MJ_INTERNAL_DEVICE_CONTROL
[371150 ms] UsbSnoop - MyDispatchInternalIOCTL(f88c7e80) : fdo=82142030, Irp=81baa008, IRQL=2
[371150 ms]  >>>  URB 704 going down  >>> 
-- URB_FUNCTION_BULK_OR_INTERRUPT_TRANSFER:
  PipeHandle           = 81b44aec [endpoint 0x00000002]
  TransferFlags        = 00000000 (USBD_TRANSFER_DIRECTION_OUT, ~USBD_SHORT_TRANSFER_OK)
  TransferBufferLength = 00000007
  TransferBuffer       = 00000000
  TransferBufferMDL    = 81bd0480
    00000000: 00 00 00 02 05 e0 00
  UrbLink              = 00000000
[371150 ms] UsbSnoop - MyInternalIOCTLCompletion(f88c7db0) : fido=823a0430, Irp=81baa008, Context=81b64160, IRQL=2
[371150 ms]  <<<  URB 704 coming back  <<< 
-- URB_FUNCTION_BULK_OR_INTERRUPT_TRANSFER:
  PipeHandle           = 81b44aec [endpoint 0x00000002]
  TransferFlags        = 00000000 (USBD_TRANSFER_DIRECTION_OUT, ~USBD_SHORT_TRANSFER_OK)
  TransferBufferLength = 00000007
  TransferBuffer       = 00000000
  TransferBufferMDL    = 81bd0480
  UrbLink              = 00000000
[371160 ms] UsbSnoop - DispatchAny(f88c6610) : IRP_MJ_INTERNAL_DEVICE_CONTROL
[371160 ms] UsbSnoop - MyDispatchInternalIOCTL(f88c7e80) : fdo=82142030, Irp=81baa008, IRQL=2
[371160 ms]  >>>  URB 705 going down  >>> 
-- URB_FUNCTION_BULK_OR_INTERRUPT_TRANSFER:
  PipeHandle           = 81b44acc [endpoint 0x00000081]
  TransferFlags        = 00000003 (USBD_TRANSFER_DIRECTION_IN, USBD_SHORT_TRANSFER_OK)
  TransferBufferLength = 00000100
  TransferBuffer       = 00000000
  TransferBufferMDL    = 81bd0480
  UrbLink              = 00000000
[371160 ms] UsbSnoop - MyInternalIOCTLCompletion(f88c7db0) : fido=823a0430, Irp=81baa008, Context=81b73460, IRQL=2
[371160 ms]  <<<  URB 705 coming back  <<< 
-- URB_FUNCTION_BULK_OR_INTERRUPT_TRANSFER:
  PipeHandle           = 81b44acc [endpoint 0x00000081]
  TransferFlags        = 00000003 (USBD_TRANSFER_DIRECTION_IN, USBD_SHORT_TRANSFER_OK)
  TransferBufferLength = 00000005
  TransferBuffer       = 00000000
  TransferBufferMDL    = 81bd0480
    00000000: 00 00 03 ff 03
  UrbLink              = 00000000
[371190 ms] UsbSnoop - DispatchAny(f88c6610) : IRP_MJ_INTERNAL_DEVICE_CONTROL
[371190 ms] UsbSnoop - MyDispatchInternalIOCTL(f88c7e80) : fdo=82142030, Irp=81baa008, IRQL=2
[371190 ms]  >>>  URB 706 going down  >>> 
-- URB_FUNCTION_BULK_OR_INTERRUPT_TRANSFER:
  PipeHandle           = 81b44acc [endpoint 0x00000081]
  TransferFlags        = 00000003 (USBD_TRANSFER_DIRECTION_IN, USBD_SHORT_TRANSFER_OK)
  TransferBufferLength = 00000100
  TransferBuffer       = 00000000
  TransferBufferMDL    = 81bd0480
  UrbLink              = 00000000
[371192 ms] UsbSnoop - MyInternalIOCTLCompletion(f88c7db0) : fido=823a0430, Irp=81baa008, Context=81b73ad0, IRQL=2
[371192 ms]  <<<  URB 706 coming back  <<< 
-- URB_FUNCTION_BULK_OR_INTERRUPT_TRANSFER:
  PipeHandle           = 81b44acc [endpoint 0x00000081]
  TransferFlags        = 00000003 (USBD_TRANSFER_DIRECTION_IN, USBD_SHORT_TRANSFER_OK)
  TransferBufferLength = 00000100
  TransferBuffer       = 00000000
  TransferBufferMDL    = 81bd0480
    00000000: 00 00 00 00 00 00 00 00 01 00 60 08 00 00 00 40
    00000010: 08 d0 00 00 00 08 00 10 00 00 00 00 00 00 00 00
    00000020: 00 00 00 00 00 00 01 ff ff f8 00 00 00 40 08 62
    00000030: 00 00 00 08 00 10 00 00 00 00 00 00 00 00 00 00
    00000040: 00 00 00 00 01 00 60 08 00 00 00 41 e8 36 00 00
    00000050: 00 08 00 10 00 00 00 00 00 00 00 00 00 00 00 00
    00000060: 00 00 01 00 60 08 00 00 00 41 ec 1c 00 00 00 08
    00000070: 00 10 00 00 00 00 00 00 00 00 00 00 00 00 00 00
    00000080: 01 ff ff f8 00 00 00 45 ee 18 00 00 00 08 00 10
    00000090: 00 00 00 00 00 00 00 00 00 00 00 00 00 00 01 00
    000000a0: 60 08 00 00 00 39 ef e0 00 00 00 1f ff f8 00 00
    000000b0: 00 00 00 00 00 00 00 00 00 00 00 00 01 00 60 08
    000000c0: 00 00 00 00 00 00 00 00 00 18 00 1f 00 00 00 00
    000000d0: 00 00 00 00 00 00 00 00 00 00 01 ff ff f8 00 00
    000000e0: 00 00 00 00 00 00 00 00 00 0c 00 00 00 00 00 00
    000000f0: 00 00 00 00 00 00 00 00 01 00 60 08 00 00 00 00
  UrbLink              = 00000000
[371220 ms] UsbSnoop - DispatchAny(f88c6610) : IRP_MJ_INTERNAL_DEVICE_CONTROL
[371220 ms] UsbSnoop - MyDispatchInternalIOCTL(f88c7e80) : fdo=82142030, Irp=81baa008, IRQL=2
[371220 ms]  >>>  URB 707 going down  >>> 
-- URB_FUNCTION_BULK_OR_INTERRUPT_TRANSFER:
  PipeHandle           = 81b44acc [endpoint 0x00000081]
  TransferFlags        = 00000003 (USBD_TRANSFER_DIRECTION_IN, USBD_SHORT_TRANSFER_OK)
  TransferBufferLength = 00000100
  TransferBuffer       = 00000000
  TransferBufferMDL    = 81bd0480
  UrbLink              = 00000000
[371222 ms] UsbSnoop - MyInternalIOCTLCompletion(f88c7db0) : fido=823a0430, Irp=81baa008, Context=81b64160, IRQL=2
[371222 ms]  <<<  URB 707 coming back  <<< 
-- URB_FUNCTION_BULK_OR_INTERRUPT_TRANSFER:
  PipeHandle           = 81b44acc [endpoint 0x00000081]
  TransferFlags        = 00000003 (USBD_TRANSFER_DIRECTION_IN, USBD_SHORT_TRANSFER_OK)
  TransferBufferLength = 00000100
  TransferBuffer       = 00000000
  TransferBufferMDL    = 81bd0480
    00000000: 00 00 00 00 00 00 00 0a 00 00 00 00 00 00 00 00
    00000010: 00 00 00 00 00 00 01 00 60 08 00 00 00 00 00 00
    00000020: 00 00 00 00 00 09 00 00 00 00 00 00 00 00 00 00
    00000030: 00 00 00 00 01 ff ff f8 00 00 00 00 00 00 00 00
    00000040: 00 00 00 00 80 00 00 00 00 00 00 00 00 00 00 00
    00000050: 00 00 00 00 00 00 00 00 00 00 00 00 00 00 00 00
    00000060: 00 00 00 00 00 00 00 00 00 00 00 00 00 00 00 00
    00000070: 00 00 00 00 00 00 00 00 00 00 00 00 00 00 00 00
    00000080: 00 00 00 00 00 00 00 00 00 00 00 00 00 00 00 70
    00000090: 46 00 00 00 70 04 38 a8 00 01 14 04 00 1c 54 03
    000000a0: fe 00 00 00 00 00 00 00 00 00 00 00 00 23 62 40
    000000b0: 00 00 22 56 21 8c 94 01 11 8c 91 10 c6 01 fc 00
    000000c0: 00 00 00 00 00 00 00 00 00 00 00 25 52 a0 00 00
    000000d0: 25 24 32 a9 58 01 55 55 55 19 54 00 f8 00 00 00
    000000e0: 00 00 00 00 00 00 00 00 00 25 52 c0 00 00 26 24
    000000f0: 22 a9 50 01 b5 55 55 11 54 00 70 00 00 00 00 00
  UrbLink              = 00000000
[371250 ms] UsbSnoop - DispatchAny(f88c6610) : IRP_MJ_INTERNAL_DEVICE_CONTROL
[371250 ms] UsbSnoop - MyDispatchInternalIOCTL(f88c7e80) : fdo=82142030, Irp=81baa008, IRQL=2
[371250 ms]  >>>  URB 708 going down  >>> 
-- URB_FUNCTION_BULK_OR_INTERRUPT_TRANSFER:
  PipeHandle           = 81b44acc [endpoint 0x00000081]
  TransferFlags        = 00000003 (USBD_TRANSFER_DIRECTION_IN, USBD_SHORT_TRANSFER_OK)
  TransferBufferLength = 00000100
  TransferBuffer       = 00000000
  TransferBufferMDL    = 81bd0480
  UrbLink              = 00000000
[371252 ms] UsbSnoop - MyInternalIOCTLCompletion(f88c7db0) : fido=823a0430, Irp=81baa008, Context=81b4e308, IRQL=2
[371252 ms]  <<<  URB 708 coming back  <<< 
-- URB_FUNCTION_BULK_OR_INTERRUPT_TRANSFER:
  PipeHandle           = 81b44acc [endpoint 0x00000081]
  TransferFlags        = 00000003 (USBD_TRANSFER_DIRECTION_IN, USBD_SHORT_TRANSFER_OK)
  TransferBufferLength = 00000100
  TransferBuffer       = 00000000
  TransferBufferMDL    = 81bd0480
    00000000: 00 00 00 00 00 00 00 23 62 60 00 00 23 52 39 a4
    00000010: 90 01 15 4c 8a 1c d2 a8 20 00 00 00 00 00 00 00
    00000020: 00 00 00 00 00 00 00 00 00 00 00 00 00 00 00 00
    00000030: 00 00 00 00 00 00 00 00 00 00 00 00 00 00 00 00
    00000040: 00 00 00 00 00 00 00 00 00 00 00 00 00 00 00 00
    00000050: 00 00 00 00 00 00 00 00 00 00 00 00 00 00 00 00
    00000060: 00 00 00 00 00 00 00 00 00 00 00 00 00 00 00 00
    00000070: 00 00 00 00 00 00 00 00 00 00 00 00 00 00 00 00
    00000080: 00 00 00 00 00 00 00 00 00 00 00 00 00 00 00 00
    00000090: 00 00 00 00 00 00 00 00 00 00 00 00 00 00 00 00
    000000a0: 00 00 00 00 00 00 00 00 00 00 00 00 00 00 00 00
    000000b0: 00 00 00 00 00 00 00 00 00 00 00 00 00 00 00 00
    000000c0: 00 00 00 00 00 00 00 00 00 00 00 00 00 00 00 00
    000000d0: 00 00 00 00 00 00 00 00 00 00 00 00 00 00 00 00
    000000e0: 00 00 00 00 00 00 00 00 00 00 00 00 00 00 00 00
    000000f0: 00 00 00 00 00 ff ff ff ff ff ff ff ff ff ff ff
  UrbLink              = 00000000
[371280 ms] UsbSnoop - DispatchAny(f88c6610) : IRP_MJ_INTERNAL_DEVICE_CONTROL
[371280 ms] UsbSnoop - MyDispatchInternalIOCTL(f88c7e80) : fdo=82142030, Irp=81baa008, IRQL=2
[371280 ms]  >>>  URB 709 going down  >>> 
-- URB_FUNCTION_BULK_OR_INTERRUPT_TRANSFER:
  PipeHandle           = 81b44acc [endpoint 0x00000081]
  TransferFlags        = 00000003 (USBD_TRANSFER_DIRECTION_IN, USBD_SHORT_TRANSFER_OK)
  TransferBufferLength = 00000100
  TransferBuffer       = 00000000
  TransferBufferMDL    = 81bd0480
  UrbLink              = 00000000
[371282 ms] UsbSnoop - MyInternalIOCTLCompletion(f88c7db0) : fido=823a0430, Irp=81baa008, Context=81b73ad0, IRQL=2
[371282 ms]  <<<  URB 709 coming back  <<< 
-- URB_FUNCTION_BULK_OR_INTERRUPT_TRANSFER:
  PipeHandle           = 81b44acc [endpoint 0x00000081]
  TransferFlags        = 00000003 (USBD_TRANSFER_DIRECTION_IN, USBD_SHORT_TRANSFER_OK)
  TransferBufferLength = 000000ff
  TransferBuffer       = 00000000
  TransferBufferMDL    = 81bd0480
    00000000: ff ff ff ff ff ff ff ff ff 00 00 00 00 00 00 00
    00000010: 00 00 00 00 00 00 00 00 00 00 00 00 00 00 00 00
    00000020: 00 00 00 00 00 00 00 00 00 00 00 00 00 00 00 00
    00000030: 00 44 94 80 00 00 00 0c 4c 12 bb 80 00 01 d5 26
    00000040: 00 00 00 00 00 00 00 00 00 00 00 00 00 00 00 6d
    00000050: 56 80 00 00 00 0a aa 2a 92 80 00 01 15 a8 00 00
    00000060: 00 00 00 00 00 00 00 00 00 00 00 00 00 55 d7 80
    00000070: 00 00 00 0c ea 3a 92 80 00 01 95 e8 00 00 00 00
    00000080: 00 00 00 00 00 00 00 00 00 00 00 45 55 80 00 00
    00000090: 00 0a aa 2a 92 80 00 01 15 68 00 00 00 00 00 00
    000000a0: 00 00 00 00 00 00 00 00 00 45 54 80 00 00 00 0a
    000000b0: ac 2b 93 80 00 01 1d 26 00 00 00 00 00 00 00 00
    000000c0: 00 00 00 00 00 00 00 00 00 00 00 00 00 00 00 00
    000000d0: 00 00 00 00 00 00 00 00 00 00 00 00 00 00 00 00
    000000e0: 00 00 00 00 00 00 00 00 00 00 00 00 00 00 00 00
    000000f0: 00 00 00 00 00 00 00 00 00 00 00 00 00 00 00
  UrbLink              = 00000000
[371310 ms] UsbSnoop - DispatchAny(f88c6610) : IRP_MJ_INTERNAL_DEVICE_CONTROL
[371310 ms] UsbSnoop - MyDispatchInternalIOCTL(f88c7e80) : fdo=82142030, Irp=81baa008, IRQL=2
[371310 ms]  >>>  URB 710 going down  >>> 
-- URB_FUNCTION_BULK_OR_INTERRUPT_TRANSFER:
  PipeHandle           = 81b44aec [endpoint 0x00000002]
  TransferFlags        = 00000000 (USBD_TRANSFER_DIRECTION_OUT, ~USBD_SHORT_TRANSFER_OK)
  TransferBufferLength = 00000007
  TransferBuffer       = 00000000
  TransferBufferMDL    = 81bd0480
    00000000: 00 00 00 02 05 e0 00
  UrbLink              = 00000000
[371311 ms] UsbSnoop - MyInternalIOCTLCompletion(f88c7db0) : fido=823a0430, Irp=81baa008, Context=81b64160, IRQL=2
[371311 ms]  <<<  URB 710 coming back  <<< 
-- URB_FUNCTION_BULK_OR_INTERRUPT_TRANSFER:
  PipeHandle           = 81b44aec [endpoint 0x00000002]
  TransferFlags        = 00000000 (USBD_TRANSFER_DIRECTION_OUT, ~USBD_SHORT_TRANSFER_OK)
  TransferBufferLength = 00000007
  TransferBuffer       = 00000000
  TransferBufferMDL    = 81bd0480
  UrbLink              = 00000000
[371320 ms] UsbSnoop - DispatchAny(f88c6610) : IRP_MJ_INTERNAL_DEVICE_CONTROL
[371320 ms] UsbSnoop - MyDispatchInternalIOCTL(f88c7e80) : fdo=82142030, Irp=81baa008, IRQL=2
[371320 ms]  >>>  URB 711 going down  >>> 
-- URB_FUNCTION_BULK_OR_INTERRUPT_TRANSFER:
  PipeHandle           = 81b44acc [endpoint 0x00000081]
  TransferFlags        = 00000003 (USBD_TRANSFER_DIRECTION_IN, USBD_SHORT_TRANSFER_OK)
  TransferBufferLength = 00000100
  TransferBuffer       = 00000000
  TransferBufferMDL    = 81bd0480
  UrbLink              = 00000000
[371321 ms] UsbSnoop - MyInternalIOCTLCompletion(f88c7db0) : fido=823a0430, Irp=81baa008, Context=81b73ad0, IRQL=2
[371321 ms]  <<<  URB 711 coming back  <<< 
-- URB_FUNCTION_BULK_OR_INTERRUPT_TRANSFER:
  PipeHandle           = 81b44acc [endpoint 0x00000081]
  TransferFlags        = 00000003 (USBD_TRANSFER_DIRECTION_IN, USBD_SHORT_TRANSFER_OK)
  TransferBufferLength = 00000005
  TransferBuffer       = 00000000
  TransferBufferMDL    = 81bd0480
    00000000: 00 00 03 10 04
  UrbLink              = 00000000
[371350 ms] UsbSnoop - DispatchAny(f88c6610) : IRP_MJ_INTERNAL_DEVICE_CONTROL
[371350 ms] UsbSnoop - MyDispatchInternalIOCTL(f88c7e80) : fdo=82142030, Irp=81baa008, IRQL=2
[371350 ms]  >>>  URB 712 going down  >>> 
-- URB_FUNCTION_BULK_OR_INTERRUPT_TRANSFER:
  PipeHandle           = 81b44acc [endpoint 0x00000081]
  TransferFlags        = 00000003 (USBD_TRANSFER_DIRECTION_IN, USBD_SHORT_TRANSFER_OK)
  TransferBufferLength = 00000100
  TransferBuffer       = 00000000
  TransferBufferMDL    = 81bd0480
  UrbLink              = 00000000
[371352 ms] UsbSnoop - MyInternalIOCTLCompletion(f88c7db0) : fido=823a0430, Irp=81baa008, Context=81b48e58, IRQL=2
[371352 ms]  <<<  URB 712 coming back  <<< 
-- URB_FUNCTION_BULK_OR_INTERRUPT_TRANSFER:
  PipeHandle           = 81b44acc [endpoint 0x00000081]
  TransferFlags        = 00000003 (USBD_TRANSFER_DIRECTION_IN, USBD_SHORT_TRANSFER_OK)
  TransferBufferLength = 00000100
  TransferBuffer       = 00000000
  TransferBufferMDL    = 81bd0480
    00000000: 00 00 00 00 00 00 00 00 00 00 00 00 00 00 00 00
    00000010: 00 00 00 00 00 00 00 00 00 00 00 00 00 00 00 00
    00000020: 00 00 00 00 00 00 00 00 00 00 00 00 00 00 00 00
    00000030: 00 00 00 00 00 00 00 00 00 00 00 00 00 00 00 00
    00000040: 00 00 00 00 00 00 00 00 00 00 00 00 00 00 00 00
    00000050: 00 00 00 00 00 00 00 00 00 00 00 00 00 00 00 00
    00000060: 00 00 00 00 00 00 00 00 00 00 00 00 00 00 00 00
    00000070: 00 00 00 00 00 00 00 00 00 00 00 00 00 00 00 00
    00000080: 00 00 00 00 00 00 00 00 00 00 00 00 00 00 00 00
    00000090: 00 00 00 00 00 00 00 00 00 00 00 00 00 00 00 00
    000000a0: 00 00 00 00 00 00 00 00 00 00 00 00 00 00 00 00
    000000b0: 00 00 00 00 00 00 00 00 00 00 00 00 00 00 00 00
    000000c0: 00 00 00 00 00 00 00 00 00 00 00 00 00 00 00 00
    000000d0: 00 00 00 00 00 00 00 00 00 00 00 00 00 00 00 00
    000000e0: 00 00 00 00 00 00 00 00 00 00 00 00 00 00 00 00
    000000f0: 00 00 00 00 00 00 00 00 00 00 00 00 00 00 00 00
  UrbLink              = 00000000
[371380 ms] UsbSnoop - DispatchAny(f88c6610) : IRP_MJ_INTERNAL_DEVICE_CONTROL
[371381 ms] UsbSnoop - MyDispatchInternalIOCTL(f88c7e80) : fdo=82142030, Irp=81baa008, IRQL=2
[371381 ms]  >>>  URB 713 going down  >>> 
-- URB_FUNCTION_BULK_OR_INTERRUPT_TRANSFER:
  PipeHandle           = 81b44acc [endpoint 0x00000081]
  TransferFlags        = 00000003 (USBD_TRANSFER_DIRECTION_IN, USBD_SHORT_TRANSFER_OK)
  TransferBufferLength = 00000100
  TransferBuffer       = 00000000
  TransferBufferMDL    = 81bd0480
  UrbLink              = 00000000
[371383 ms] UsbSnoop - MyInternalIOCTLCompletion(f88c7db0) : fido=823a0430, Irp=81baa008, Context=81b5f3d0, IRQL=2
[371383 ms]  <<<  URB 713 coming back  <<< 
-- URB_FUNCTION_BULK_OR_INTERRUPT_TRANSFER:
  PipeHandle           = 81b44acc [endpoint 0x00000081]
  TransferFlags        = 00000003 (USBD_TRANSFER_DIRECTION_IN, USBD_SHORT_TRANSFER_OK)
  TransferBufferLength = 00000100
  TransferBuffer       = 00000000
  TransferBufferMDL    = 81bd0480
    00000000: 00 00 00 00 00 00 00 00 00 00 00 00 00 00 00 00
    00000010: 00 00 00 00 00 00 00 00 00 00 00 00 00 00 00 00
    00000020: 00 00 00 00 00 00 00 00 00 00 00 00 00 00 00 00
    00000030: 00 00 00 00 00 00 00 00 00 00 00 00 00 00 00 00
    00000040: 00 00 00 00 00 00 00 00 00 00 00 00 00 00 00 00
    00000050: 00 00 00 00 00 00 00 00 00 00 00 00 00 00 00 00
    00000060: 00 00 00 00 00 00 00 00 00 00 00 00 00 00 00 00
    00000070: 00 00 00 00 00 00 00 00 00 00 00 00 00 00 00 00
    00000080: 00 00 00 00 00 00 00 00 00 00 00 00 00 00 00 00
    00000090: 00 00 00 00 00 00 00 00 00 00 00 00 00 00 00 00
    000000a0: 00 00 00 00 00 00 00 00 00 00 00 00 00 00 00 00
    000000b0: 00 00 00 00 00 00 00 00 00 00 00 00 00 00 00 00
    000000c0: 00 00 00 00 00 00 00 00 00 00 00 00 00 00 00 00
    000000d0: 00 00 00 00 00 00 00 00 00 00 00 00 00 00 00 00
    000000e0: 00 00 00 00 00 00 00 00 00 00 00 00 00 00 00 00
    000000f0: 00 00 00 00 00 00 00 00 00 00 00 00 00 00 00 00
  UrbLink              = 00000000
[371410 ms] UsbSnoop - DispatchAny(f88c6610) : IRP_MJ_INTERNAL_DEVICE_CONTROL
[371410 ms] UsbSnoop - MyDispatchInternalIOCTL(f88c7e80) : fdo=82142030, Irp=81baa008, IRQL=2
[371410 ms]  >>>  URB 714 going down  >>> 
-- URB_FUNCTION_BULK_OR_INTERRUPT_TRANSFER:
  PipeHandle           = 81b44acc [endpoint 0x00000081]
  TransferFlags        = 00000003 (USBD_TRANSFER_DIRECTION_IN, USBD_SHORT_TRANSFER_OK)
  TransferBufferLength = 00000100
  TransferBuffer       = 00000000
  TransferBufferMDL    = 81bd0480
  UrbLink              = 00000000
[371412 ms] UsbSnoop - MyInternalIOCTLCompletion(f88c7db0) : fido=823a0430, Irp=81baa008, Context=81b73ad0, IRQL=2
[371412 ms]  <<<  URB 714 coming back  <<< 
-- URB_FUNCTION_BULK_OR_INTERRUPT_TRANSFER:
  PipeHandle           = 81b44acc [endpoint 0x00000081]
  TransferFlags        = 00000003 (USBD_TRANSFER_DIRECTION_IN, USBD_SHORT_TRANSFER_OK)
  TransferBufferLength = 00000100
  TransferBuffer       = 00000000
  TransferBufferMDL    = 81bd0480
    00000000: 00 00 00 00 00 00 00 00 00 00 00 00 00 00 00 00
    00000010: 00 00 00 00 00 00 00 00 00 00 00 00 00 00 00 00
    00000020: 00 00 00 00 00 00 00 00 00 00 00 00 00 00 00 00
    00000030: 00 00 00 00 00 00 00 00 00 00 00 00 00 00 00 00
    00000040: 00 00 00 00 00 00 00 00 00 00 00 00 00 00 00 00
    00000050: 00 00 00 00 00 00 00 00 00 00 00 00 00 00 00 00
    00000060: 00 00 00 00 00 00 00 00 00 00 00 00 00 00 00 00
    00000070: 00 00 00 00 00 00 00 00 00 00 00 00 00 00 00 00
    00000080: 00 00 00 00 00 00 00 00 00 00 00 00 00 00 00 00
    00000090: 00 00 00 00 00 00 00 00 00 00 00 00 00 00 00 00
    000000a0: 00 00 00 00 00 00 00 00 00 00 00 00 00 00 00 00
    000000b0: 00 00 00 00 00 00 00 00 00 00 00 00 00 00 00 00
    000000c0: 00 00 00 00 00 00 00 00 00 00 00 00 00 00 00 00
    000000d0: 00 00 00 00 00 00 00 00 00 00 00 00 00 00 00 00
    000000e0: 00 00 00 00 00 00 00 00 00 00 00 00 00 00 00 00
    000000f0: 00 00 00 00 00 00 00 00 00 00 00 00 00 00 00 00
  UrbLink              = 00000000
[371441 ms] UsbSnoop - DispatchAny(f88c6610) : IRP_MJ_INTERNAL_DEVICE_CONTROL
[371441 ms] UsbSnoop - MyDispatchInternalIOCTL(f88c7e80) : fdo=82142030, Irp=81baa008, IRQL=2
[371441 ms]  >>>  URB 715 going down  >>> 
-- URB_FUNCTION_BULK_OR_INTERRUPT_TRANSFER:
  PipeHandle           = 81b44acc [endpoint 0x00000081]
  TransferFlags        = 00000003 (USBD_TRANSFER_DIRECTION_IN, USBD_SHORT_TRANSFER_OK)
  TransferBufferLength = 00000100
  TransferBuffer       = 00000000
  TransferBufferMDL    = 81bd0480
  UrbLink              = 00000000
[371441 ms] UsbSnoop - MyInternalIOCTLCompletion(f88c7db0) : fido=823a0430, Irp=81baa008, Context=81b48e58, IRQL=2
[371441 ms]  <<<  URB 715 coming back  <<< 
-- URB_FUNCTION_BULK_OR_INTERRUPT_TRANSFER:
  PipeHandle           = 81b44acc [endpoint 0x00000081]
  TransferFlags        = 00000003 (USBD_TRANSFER_DIRECTION_IN, USBD_SHORT_TRANSFER_OK)
  TransferBufferLength = 00000010
  TransferBuffer       = 00000000
  TransferBufferMDL    = 81bd0480
    00000000: 00 00 00 00 00 00 00 00 00 00 00 00 00 00 00 00
  UrbLink              = 00000000
[371471 ms] UsbSnoop - DispatchAny(f88c6610) : IRP_MJ_INTERNAL_DEVICE_CONTROL
[371471 ms] UsbSnoop - MyDispatchInternalIOCTL(f88c7e80) : fdo=82142030, Irp=81baa008, IRQL=2
[371471 ms]  >>>  URB 716 going down  >>> 
-- URB_FUNCTION_BULK_OR_INTERRUPT_TRANSFER:
  PipeHandle           = 81b44aec [endpoint 0x00000002]
  TransferFlags        = 00000000 (USBD_TRANSFER_DIRECTION_OUT, ~USBD_SHORT_TRANSFER_OK)
  TransferBufferLength = 00000007
  TransferBuffer       = 00000000
  TransferBufferMDL    = 81bd0480
    00000000: 00 00 00 02 05 e0 00
  UrbLink              = 00000000
[371471 ms] UsbSnoop - MyInternalIOCTLCompletion(f88c7db0) : fido=823a0430, Irp=81baa008, Context=81b5f3d0, IRQL=2
[371471 ms]  <<<  URB 716 coming back  <<< 
-- URB_FUNCTION_BULK_OR_INTERRUPT_TRANSFER:
  PipeHandle           = 81b44aec [endpoint 0x00000002]
  TransferFlags        = 00000000 (USBD_TRANSFER_DIRECTION_OUT, ~USBD_SHORT_TRANSFER_OK)
  TransferBufferLength = 00000007
  TransferBuffer       = 00000000
  TransferBufferMDL    = 81bd0480
  UrbLink              = 00000000
[371533 ms] UsbSnoop - DispatchAny(f88c6610) : IRP_MJ_INTERNAL_DEVICE_CONTROL
[371533 ms] UsbSnoop - MyDispatchInternalIOCTL(f88c7e80) : fdo=82142030, Irp=81b564a0, IRQL=0
[371533 ms]  >>>  URB 717 going down  >>> 
-- URB_FUNCTION_RESET_PIPE:
  PipeHandle = 81b44acc [endpoint 0x00000081]
[371533 ms] UsbSnoop - MyInternalIOCTLCompletion(f88c7db0) : fido=00000000, Irp=81b564a0, Context=81b73460, IRQL=0
[371533 ms]  <<<  URB 717 coming back  <<< 
-- URB_FUNCTION_RESET_PIPE:
[371534 ms] UsbSnoop - DispatchAny(f88c6610) : IRP_MJ_INTERNAL_DEVICE_CONTROL
[371534 ms] UsbSnoop - MyDispatchInternalIOCTL(f88c7e80) : fdo=82142030, Irp=81b564a0, IRQL=0
[371534 ms]  >>>  URB 718 going down  >>> 
-- URB_FUNCTION_RESET_PIPE:
  PipeHandle = 81b44aec [endpoint 0x00000002]
[371534 ms] UsbSnoop - MyInternalIOCTLCompletion(f88c7db0) : fido=00000000, Irp=81b564a0, Context=81b73ad0, IRQL=0
[371534 ms]  <<<  URB 718 coming back  <<< 
-- URB_FUNCTION_RESET_PIPE:
[371534 ms] UsbSnoop - DispatchAny(f88c6610) : IRP_MJ_INTERNAL_DEVICE_CONTROL
[371534 ms] UsbSnoop - MyDispatchInternalIOCTL(f88c7e80) : fdo=82142030, Irp=81adb588, IRQL=0
[371534 ms] UsbSnoop - IRP_MJ_POWER (IRP_MN_WAIT_WAKE)
