[540841 ms] UsbSnoop - DispatchAny(f8916610) : IRP_MJ_INTERNAL_DEVICE_CONTROL
[540841 ms] UsbSnoop - MyDispatchInternalIOCTL(f8917e80) : fdo=822eee08, Irp=81ac18e0, IRQL=0
[540841 ms]  >>>  URB 566 going down  >>> 
-- URB_FUNCTION_RESET_PIPE:
  PipeHandle = 82300ef4 [endpoint 0x00000081]
[540842 ms] UsbSnoop - MyInternalIOCTLCompletion(f8917db0) : fido=00000000, Irp=81ac18e0, Context=81ba8040, IRQL=0
[540842 ms]  <<<  URB 566 coming back  <<< 
-- URB_FUNCTION_RESET_PIPE:
[540842 ms] UsbSnoop - DispatchAny(f8916610) : IRP_MJ_INTERNAL_DEVICE_CONTROL
[540842 ms] UsbSnoop - MyDispatchInternalIOCTL(f8917e80) : fdo=822eee08, Irp=81ac18e0, IRQL=0
[540842 ms]  >>>  URB 567 going down  >>> 
-- URB_FUNCTION_RESET_PIPE:
  PipeHandle = 82300f14 [endpoint 0x00000002]
[540842 ms] UsbSnoop - MyInternalIOCTLCompletion(f8917db0) : fido=00000000, Irp=81ac18e0, Context=81cb4e48, IRQL=0
[540842 ms]  <<<  URB 567 coming back  <<< 
-- URB_FUNCTION_RESET_PIPE:
[541843 ms] UsbSnoop - DispatchAny(f8916610) : IRP_MJ_INTERNAL_DEVICE_CONTROL
[541843 ms] UsbSnoop - MyDispatchInternalIOCTL(f8917e80) : fdo=822eee08, Irp=81b20c88, IRQL=0
[541843 ms]  >>>  URB 568 going down  >>> 
-- URB_FUNCTION_RESET_PIPE:
  PipeHandle = 82300ef4 [endpoint 0x00000081]
[541843 ms] UsbSnoop - MyInternalIOCTLCompletion(f8917db0) : fido=00000000, Irp=81b20c88, Context=81cb4e48, IRQL=0
[541843 ms]  <<<  URB 568 coming back  <<< 
-- URB_FUNCTION_RESET_PIPE:
[541843 ms] UsbSnoop - DispatchAny(f8916610) : IRP_MJ_INTERNAL_DEVICE_CONTROL
[541843 ms] UsbSnoop - MyDispatchInternalIOCTL(f8917e80) : fdo=822eee08, Irp=81b20c88, IRQL=0
[541843 ms]  >>>  URB 569 going down  >>> 
-- URB_FUNCTION_RESET_PIPE:
  PipeHandle = 82300f14 [endpoint 0x00000002]
[541844 ms] UsbSnoop - MyInternalIOCTLCompletion(f8917db0) : fido=00000000, Irp=81b20c88, Context=81be7968, IRQL=0
[541844 ms]  <<<  URB 569 coming back  <<< 
-- URB_FUNCTION_RESET_PIPE:
[541844 ms] UsbSnoop - DispatchAny(f8916610) : IRP_MJ_INTERNAL_DEVICE_CONTROL
[541844 ms] UsbSnoop - MyDispatchInternalIOCTL(f8917e80) : fdo=822eee08, Irp=81abb730, IRQL=0
[542844 ms] UsbSnoop - IRP_MJ_POWER (IRP_MN_WAIT_WAKE)
[542845 ms] UsbSnoop - DispatchAny(f8916610) : IRP_MJ_INTERNAL_DEVICE_CONTROL
[542845 ms] UsbSnoop - MyDispatchInternalIOCTL(f8917e80) : fdo=822eee08, Irp=81b20c88, IRQL=0
[542845 ms]  >>>  URB 570 going down  >>> 
-- URB_FUNCTION_GET_DESCRIPTOR_FROM_DEVICE:
  TransferBufferLength = 00000012
  TransferBuffer       = e1146350
  TransferBufferMDL    = 00000000
  Index                = 00000000
  DescriptorType       = 00000001 (USB_DEVICE_DESCRIPTOR_TYPE)
  LanguageId           = 00000000
[542845 ms] UsbSnoop - MyInternalIOCTLCompletion(f8917db0) : fido=00000000, Irp=81b20c88, Context=81be7968, IRQL=2
[542845 ms]  <<<  URB 570 coming back  <<< 
-- URB_FUNCTION_CONTROL_TRANSFER:
  PipeHandle           = 82149668
  TransferFlags        = 81abb73b (USBD_TRANSFER_DIRECTION_IN, USBD_SHORT_TRANSFER_OK)
  TransferBufferLength = 00000012
  TransferBuffer       = e1146350
  TransferBufferMDL    = 81ac92e0
    00000000: 12 01 00 02 00 00 00 40 51 04 04 e0 00 03 01 02
    00000010: 00 01
  UrbLink              = 00000000
  SetupPacket          =
    00000000: 80 06 00 01 00 00 12 00
[542845 ms] UsbSnoop - DispatchAny(f8916610) : IRP_MJ_INTERNAL_DEVICE_CONTROL
[542845 ms] UsbSnoop - MyDispatchInternalIOCTL(f8917e80) : fdo=822eee08, Irp=81abb730, IRQL=0
[542845 ms] UsbSnoop - IRP_MJ_POWER (IRP_MN_WAIT_WAKE)
[542845 ms] UsbSnoop - DispatchAny(f8916610) : IRP_MJ_INTERNAL_DEVICE_CONTROL
[542845 ms] UsbSnoop - MyDispatchInternalIOCTL(f8917e80) : fdo=822eee08, Irp=81abb730, IRQL=0
[542845 ms]  >>>  URB 571 going down  >>> 
-- URB_FUNCTION_RESET_PIPE:
  PipeHandle = 82300ef4 [endpoint 0x00000081]
[542846 ms] UsbSnoop - MyInternalIOCTLCompletion(f8917db0) : fido=00000000, Irp=81abb730, Context=81c49750, IRQL=0
[542846 ms]  <<<  URB 571 coming back  <<< 
-- URB_FUNCTION_RESET_PIPE:
[542846 ms] UsbSnoop - DispatchAny(f8916610) : IRP_MJ_INTERNAL_DEVICE_CONTROL
[542846 ms] UsbSnoop - MyDispatchInternalIOCTL(f8917e80) : fdo=822eee08, Irp=81abb730, IRQL=0
[542846 ms]  >>>  URB 572 going down  >>> 
-- URB_FUNCTION_RESET_PIPE:
  PipeHandle = 82300f14 [endpoint 0x00000002]
[542846 ms] UsbSnoop - MyInternalIOCTLCompletion(f8917db0) : fido=00000000, Irp=81abb730, Context=81abee68, IRQL=0
[542846 ms]  <<<  URB 572 coming back  <<< 
-- URB_FUNCTION_RESET_PIPE:
[544096 ms] UsbSnoop - DispatchAny(f8916610) : IRP_MJ_INTERNAL_DEVICE_CONTROL
[544096 ms] UsbSnoop - MyDispatchInternalIOCTL(f8917e80) : fdo=822eee08, Irp=81c21570, IRQL=2
[544096 ms]  >>>  URB 573 going down  >>> 
-- URB_FUNCTION_BULK_OR_INTERRUPT_TRANSFER:
  PipeHandle           = 82300f14 [endpoint 0x00000002]
  TransferFlags        = 00000000 (USBD_TRANSFER_DIRECTION_OUT, ~USBD_SHORT_TRANSFER_OK)
  TransferBufferLength = 00000009
  TransferBuffer       = 00000000
  TransferBufferMDL    = 81ac92e0
    00000000: 00 00 00 04 01 00 00 04 00
  UrbLink              = 00000000
[544097 ms] UsbSnoop - MyInternalIOCTLCompletion(f8917db0) : fido=81b964f0, Irp=81c21570, Context=81c3bfe8, IRQL=2
[544097 ms]  <<<  URB 573 coming back  <<< 
-- URB_FUNCTION_BULK_OR_INTERRUPT_TRANSFER:
  PipeHandle           = 82300f14 [endpoint 0x00000002]
  TransferFlags        = 00000000 (USBD_TRANSFER_DIRECTION_OUT, ~USBD_SHORT_TRANSFER_OK)
  TransferBufferLength = 00000009
  TransferBuffer       = 00000000
  TransferBufferMDL    = 81ac92e0
  UrbLink              = 00000000
[544097 ms] UsbSnoop - DispatchAny(f8916610) : IRP_MJ_INTERNAL_DEVICE_CONTROL
[544097 ms] UsbSnoop - MyDispatchInternalIOCTL(f8917e80) : fdo=822eee08, Irp=81c21570, IRQL=2
[544097 ms]  >>>  URB 574 going down  >>> 
-- URB_FUNCTION_BULK_OR_INTERRUPT_TRANSFER:
  PipeHandle           = 82300ef4 [endpoint 0x00000081]
  TransferFlags        = 00000003 (USBD_TRANSFER_DIRECTION_IN, USBD_SHORT_TRANSFER_OK)
  TransferBufferLength = 00000100
  TransferBuffer       = 00000000
  TransferBufferMDL    = 81ac92e0
  UrbLink              = 00000000
[544098 ms] UsbSnoop - MyInternalIOCTLCompletion(f8917db0) : fido=81b964f0, Irp=81c21570, Context=81b4ccc0, IRQL=2
[544098 ms]  <<<  URB 574 coming back  <<< 
-- URB_FUNCTION_BULK_OR_INTERRUPT_TRANSFER:
  PipeHandle           = 82300ef4 [endpoint 0x00000081]
  TransferFlags        = 00000003 (USBD_TRANSFER_DIRECTION_IN, USBD_SHORT_TRANSFER_OK)
  TransferBufferLength = 00000009
  TransferBuffer       = 00000000
  TransferBufferMDL    = 81ac92e0
    00000000: 00 00 00 04 02 00 00 03 ff
  UrbLink              = 00000000
[544127 ms] UsbSnoop - DispatchAny(f8916610) : IRP_MJ_INTERNAL_DEVICE_CONTROL
[544127 ms] UsbSnoop - MyDispatchInternalIOCTL(f8917e80) : fdo=822eee08, Irp=81c21570, IRQL=2
[544127 ms]  >>>  URB 575 going down  >>> 
-- URB_FUNCTION_BULK_OR_INTERRUPT_TRANSFER:
  PipeHandle           = 82300f14 [endpoint 0x00000002]
  TransferFlags        = 00000000 (USBD_TRANSFER_DIRECTION_OUT, ~USBD_SHORT_TRANSFER_OK)
  TransferBufferLength = 00000015
  TransferBuffer       = 00000000
  TransferBufferMDL    = 81ac92e0
    00000000: 00 00 00 10 04 00 00 00 0a 00 01 00 03 00 01 00
    00000010: 00 00 00 07 d0
  UrbLink              = 00000000
[544128 ms] UsbSnoop - MyInternalIOCTLCompletion(f8917db0) : fido=81b964f0, Irp=81c21570, Context=81c429b8, IRQL=2
[544128 ms]  <<<  URB 575 coming back  <<< 
-- URB_FUNCTION_BULK_OR_INTERRUPT_TRANSFER:
  PipeHandle           = 82300f14 [endpoint 0x00000002]
  TransferFlags        = 00000000 (USBD_TRANSFER_DIRECTION_OUT, ~USBD_SHORT_TRANSFER_OK)
  TransferBufferLength = 00000015
  TransferBuffer       = 00000000
  TransferBufferMDL    = 81ac92e0
  UrbLink              = 00000000
[544136 ms] UsbSnoop - DispatchAny(f8916610) : IRP_MJ_INTERNAL_DEVICE_CONTROL
[544136 ms] UsbSnoop - MyDispatchInternalIOCTL(f8917e80) : fdo=822eee08, Irp=81c21570, IRQL=2
[544136 ms]  >>>  URB 576 going down  >>> 
-- URB_FUNCTION_BULK_OR_INTERRUPT_TRANSFER:
  PipeHandle           = 82300ef4 [endpoint 0x00000081]
  TransferFlags        = 00000003 (USBD_TRANSFER_DIRECTION_IN, USBD_SHORT_TRANSFER_OK)
  TransferBufferLength = 00000100
  TransferBuffer       = 00000000
  TransferBufferMDL    = 81ac92e0
  UrbLink              = 00000000
[544136 ms] UsbSnoop - MyInternalIOCTLCompletion(f8917db0) : fido=81b964f0, Irp=81c21570, Context=81b4ccc0, IRQL=2
[544136 ms]  <<<  URB 576 coming back  <<< 
-- URB_FUNCTION_BULK_OR_INTERRUPT_TRANSFER:
  PipeHandle           = 82300ef4 [endpoint 0x00000081]
  TransferFlags        = 00000003 (USBD_TRANSFER_DIRECTION_IN, USBD_SHORT_TRANSFER_OK)
  TransferBufferLength = 00000007
  TransferBuffer       = 00000000
  TransferBufferMDL    = 81ac92e0
    00000000: 00 00 00 02 05 e0 00
  UrbLink              = 00000000
[544176 ms] UsbSnoop - DispatchAny(f8916610) : IRP_MJ_INTERNAL_DEVICE_CONTROL
[544176 ms] UsbSnoop - MyDispatchInternalIOCTL(f8917e80) : fdo=822eee08, Irp=81c21570, IRQL=2
[544176 ms]  >>>  URB 577 going down  >>> 
-- URB_FUNCTION_BULK_OR_INTERRUPT_TRANSFER:
  PipeHandle           = 82300ef4 [endpoint 0x00000081]
  TransferFlags        = 00000003 (USBD_TRANSFER_DIRECTION_IN, USBD_SHORT_TRANSFER_OK)
  TransferBufferLength = 00000100
  TransferBuffer       = 00000000
  TransferBufferMDL    = 81ac92e0
  UrbLink              = 00000000
[544177 ms] UsbSnoop - MyInternalIOCTLCompletion(f8917db0) : fido=81b964f0, Irp=81c21570, Context=81d30f40, IRQL=2
[544177 ms]  <<<  URB 577 coming back  <<< 
-- URB_FUNCTION_BULK_OR_INTERRUPT_TRANSFER:
  PipeHandle           = 82300ef4 [endpoint 0x00000081]
  TransferFlags        = 00000003 (USBD_TRANSFER_DIRECTION_IN, USBD_SHORT_TRANSFER_OK)
  TransferBufferLength = 00000005
  TransferBuffer       = 00000000
  TransferBufferMDL    = 81ac92e0
    00000000: 00 00 00 0a 04
  UrbLink              = 00000000
[544207 ms] UsbSnoop - DispatchAny(f8916610) : IRP_MJ_INTERNAL_DEVICE_CONTROL
[544207 ms] UsbSnoop - MyDispatchInternalIOCTL(f8917e80) : fdo=822eee08, Irp=81c21570, IRQL=2
[544207 ms]  >>>  URB 578 going down  >>> 
-- URB_FUNCTION_BULK_OR_INTERRUPT_TRANSFER:
  PipeHandle           = 82300ef4 [endpoint 0x00000081]
  TransferFlags        = 00000003 (USBD_TRANSFER_DIRECTION_IN, USBD_SHORT_TRANSFER_OK)
  TransferBufferLength = 00000100
  TransferBuffer       = 00000000
  TransferBufferMDL    = 81ac92e0
  UrbLink              = 00000000
[544207 ms] UsbSnoop - MyInternalIOCTLCompletion(f8917db0) : fido=81b964f0, Irp=81c21570, Context=81be7968, IRQL=2
[544207 ms]  <<<  URB 578 coming back  <<< 
-- URB_FUNCTION_BULK_OR_INTERRUPT_TRANSFER:
  PipeHandle           = 82300ef4 [endpoint 0x00000081]
  TransferFlags        = 00000003 (USBD_TRANSFER_DIRECTION_IN, USBD_SHORT_TRANSFER_OK)
  TransferBufferLength = 0000000a
  TransferBuffer       = 00000000
  TransferBufferMDL    = 81ac92e0
    00000000: 00 00 00 04 00 12 00 00 07 d0
  UrbLink              = 00000000
[544237 ms] UsbSnoop - DispatchAny(f8916610) : IRP_MJ_INTERNAL_DEVICE_CONTROL
[544237 ms] UsbSnoop - MyDispatchInternalIOCTL(f8917e80) : fdo=822eee08, Irp=81c21570, IRQL=2
[544237 ms]  >>>  URB 579 going down  >>> 
-- URB_FUNCTION_BULK_OR_INTERRUPT_TRANSFER:
  PipeHandle           = 82300f14 [endpoint 0x00000002]
  TransferFlags        = 00000000 (USBD_TRANSFER_DIRECTION_OUT, ~USBD_SHORT_TRANSFER_OK)
  TransferBufferLength = 00000007
  TransferBuffer       = 00000000
  TransferBufferMDL    = 81ac92e0
    00000000: 00 00 00 02 05 e0 00
  UrbLink              = 00000000
[544237 ms] UsbSnoop - MyInternalIOCTLCompletion(f8917db0) : fido=81b964f0, Irp=81c21570, Context=81b4ccc0, IRQL=2
[544237 ms]  <<<  URB 579 coming back  <<< 
-- URB_FUNCTION_BULK_OR_INTERRUPT_TRANSFER:
  PipeHandle           = 82300f14 [endpoint 0x00000002]
  TransferFlags        = 00000000 (USBD_TRANSFER_DIRECTION_OUT, ~USBD_SHORT_TRANSFER_OK)
  TransferBufferLength = 00000007
  TransferBuffer       = 00000000
  TransferBufferMDL    = 81ac92e0
  UrbLink              = 00000000
[544247 ms] UsbSnoop - DispatchAny(f8916610) : IRP_MJ_INTERNAL_DEVICE_CONTROL
[544247 ms] UsbSnoop - MyDispatchInternalIOCTL(f8917e80) : fdo=822eee08, Irp=81c21570, IRQL=2
[544247 ms]  >>>  URB 580 going down  >>> 
-- URB_FUNCTION_BULK_OR_INTERRUPT_TRANSFER:
  PipeHandle           = 82300f14 [endpoint 0x00000002]
  TransferFlags        = 00000000 (USBD_TRANSFER_DIRECTION_OUT, ~USBD_SHORT_TRANSFER_OK)
  TransferBufferLength = 0000002b
  TransferBuffer       = 00000000
  TransferBufferMDL    = 81ac92e0
    00000000: 00 00 00 26 04 00 00 00 20 00 07 00 0f 00 0b 00
    00000010: 04 00 06 00 07 00 01 00 02 00 0a 00 37 00 0c 00
    00000020: 38 00 09 00 0e 00 2d 00 03 00 2e
  UrbLink              = 00000000
[544247 ms] UsbSnoop - MyInternalIOCTLCompletion(f8917db0) : fido=81b964f0, Irp=81c21570, Context=81be7968, IRQL=2
[544247 ms]  <<<  URB 580 coming back  <<< 
-- URB_FUNCTION_BULK_OR_INTERRUPT_TRANSFER:
  PipeHandle           = 82300f14 [endpoint 0x00000002]
  TransferFlags        = 00000000 (USBD_TRANSFER_DIRECTION_OUT, ~USBD_SHORT_TRANSFER_OK)
  TransferBufferLength = 0000002b
  TransferBuffer       = 00000000
  TransferBufferMDL    = 81ac92e0
  UrbLink              = 00000000
[544257 ms] UsbSnoop - DispatchAny(f8916610) : IRP_MJ_INTERNAL_DEVICE_CONTROL
[544257 ms] UsbSnoop - MyDispatchInternalIOCTL(f8917e80) : fdo=822eee08, Irp=81c21570, IRQL=2
[544257 ms]  >>>  URB 581 going down  >>> 
-- URB_FUNCTION_BULK_OR_INTERRUPT_TRANSFER:
  PipeHandle           = 82300ef4 [endpoint 0x00000081]
  TransferFlags        = 00000003 (USBD_TRANSFER_DIRECTION_IN, USBD_SHORT_TRANSFER_OK)
  TransferBufferLength = 00000100
  TransferBuffer       = 00000000
  TransferBufferMDL    = 81ac92e0
  UrbLink              = 00000000
[544257 ms] UsbSnoop - MyInternalIOCTLCompletion(f8917db0) : fido=81b964f0, Irp=81c21570, Context=81abee68, IRQL=2
[544257 ms]  <<<  URB 581 coming back  <<< 
-- URB_FUNCTION_BULK_OR_INTERRUPT_TRANSFER:
  PipeHandle           = 82300ef4 [endpoint 0x00000081]
  TransferFlags        = 00000003 (USBD_TRANSFER_DIRECTION_IN, USBD_SHORT_TRANSFER_OK)
  TransferBufferLength = 00000007
  TransferBuffer       = 00000000
  TransferBufferMDL    = 81ac92e0
    00000000: 00 00 00 02 05 e0 00
  UrbLink              = 00000000
[544297 ms] UsbSnoop - DispatchAny(f8916610) : IRP_MJ_INTERNAL_DEVICE_CONTROL
[544297 ms] UsbSnoop - MyDispatchInternalIOCTL(f8917e80) : fdo=822eee08, Irp=81c21570, IRQL=2
[544297 ms]  >>>  URB 582 going down  >>> 
-- URB_FUNCTION_BULK_OR_INTERRUPT_TRANSFER:
  PipeHandle           = 82300ef4 [endpoint 0x00000081]
  TransferFlags        = 00000003 (USBD_TRANSFER_DIRECTION_IN, USBD_SHORT_TRANSFER_OK)
  TransferBufferLength = 00000100
  TransferBuffer       = 00000000
  TransferBufferMDL    = 81ac92e0
  UrbLink              = 00000000
[544523 ms] UsbSnoop - MyInternalIOCTLCompletion(f8917db0) : fido=81b964f0, Irp=81c21570, Context=81c3bfe8, IRQL=2
[544523 ms]  <<<  URB 582 coming back  <<< 
-- URB_FUNCTION_BULK_OR_INTERRUPT_TRANSFER:
  PipeHandle           = 82300ef4 [endpoint 0x00000081]
  TransferFlags        = 00000003 (USBD_TRANSFER_DIRECTION_IN, USBD_SHORT_TRANSFER_OK)
  TransferBufferLength = 00000005
  TransferBuffer       = 00000000
  TransferBufferMDL    = 81ac92e0
    00000000: 00 00 00 95 04
  UrbLink              = 00000000
[544547 ms] UsbSnoop - DispatchAny(f8916610) : IRP_MJ_INTERNAL_DEVICE_CONTROL
[544547 ms] UsbSnoop - MyDispatchInternalIOCTL(f8917e80) : fdo=822eee08, Irp=81c21570, IRQL=2
[544547 ms]  >>>  URB 583 going down  >>> 
-- URB_FUNCTION_BULK_OR_INTERRUPT_TRANSFER:
  PipeHandle           = 82300ef4 [endpoint 0x00000081]
  TransferFlags        = 00000003 (USBD_TRANSFER_DIRECTION_IN, USBD_SHORT_TRANSFER_OK)
  TransferBufferLength = 00000100
  TransferBuffer       = 00000000
  TransferBufferMDL    = 81ac92e0
  UrbLink              = 00000000
[544548 ms] UsbSnoop - MyInternalIOCTLCompletion(f8917db0) : fido=81b964f0, Irp=81c21570, Context=81be7968, IRQL=2
[544548 ms]  <<<  URB 583 coming back  <<< 
-- URB_FUNCTION_BULK_OR_INTERRUPT_TRANSFER:
  PipeHandle           = 82300ef4 [endpoint 0x00000081]
  TransferFlags        = 00000003 (USBD_TRANSFER_DIRECTION_IN, USBD_SHORT_TRANSFER_OK)
  TransferBufferLength = 00000095
  TransferBuffer       = 00000000
  TransferBufferMDL    = 81ac92e0
    00000000: 00 00 00 8f 00 08 00 0f 00 0b 00 00 04 00 03 00
    00000010: 00 00 04 00 00 02 00 02 00 06 00 00 01 09 00 07
    00000020: 00 00 01 01 00 01 00 00 04 00 00 00 09 00 02 00
    00000030: 00 0e 54 49 2d 38 39 20 54 69 74 61 6e 69 75 6d
    00000040: 00 0a 00 00 01 01 00 37 00 00 01 01 00 0c 00 00
    00000050: 08 00 00 00 00 00 03 ff f4 00 38 02 00 09 00 00
    00000060: 04 00 02 01 18 00 0e 00 00 08 00 00 00 00 00 02
    00000070: f4 6e 00 2d 00 00 01 01 00 03 00 00 12 22 30 39
    00000080: 32 45 34 20 43 35 36 43 37 20 34 33 45 41 22 00
    00000090: 2e 00 00 01 fe
  UrbLink              = 00000000
[544589 ms] UsbSnoop - DispatchAny(f8916610) : IRP_MJ_INTERNAL_DEVICE_CONTROL
[544589 ms] UsbSnoop - MyDispatchInternalIOCTL(f8917e80) : fdo=822eee08, Irp=81c21570, IRQL=2
[544589 ms]  >>>  URB 584 going down  >>> 
-- URB_FUNCTION_BULK_OR_INTERRUPT_TRANSFER:
  PipeHandle           = 82300f14 [endpoint 0x00000002]
  TransferFlags        = 00000000 (USBD_TRANSFER_DIRECTION_OUT, ~USBD_SHORT_TRANSFER_OK)
  TransferBufferLength = 00000007
  TransferBuffer       = 00000000
  TransferBufferMDL    = 81ac92e0
    00000000: 00 00 00 02 05 e0 00
  UrbLink              = 00000000
[544589 ms] UsbSnoop - MyInternalIOCTLCompletion(f8917db0) : fido=81b964f0, Irp=81c21570, Context=81d30f40, IRQL=2
[544589 ms]  <<<  URB 584 coming back  <<< 
-- URB_FUNCTION_BULK_OR_INTERRUPT_TRANSFER:
  PipeHandle           = 82300f14 [endpoint 0x00000002]
  TransferFlags        = 00000000 (USBD_TRANSFER_DIRECTION_OUT, ~USBD_SHORT_TRANSFER_OK)
  TransferBufferLength = 00000007
  TransferBuffer       = 00000000
  TransferBufferMDL    = 81ac92e0
  UrbLink              = 00000000
[544848 ms] UsbSnoop - DispatchAny(f8916610) : IRP_MJ_INTERNAL_DEVICE_CONTROL
[544848 ms] UsbSnoop - MyDispatchInternalIOCTL(f8917e80) : fdo=822eee08, Irp=81c21570, IRQL=2
[544848 ms]  >>>  URB 585 going down  >>> 
-- URB_FUNCTION_BULK_OR_INTERRUPT_TRANSFER:
  PipeHandle           = 82300f14 [endpoint 0x00000002]
  TransferFlags        = 00000000 (USBD_TRANSFER_DIRECTION_OUT, ~USBD_SHORT_TRANSFER_OK)
  TransferBufferLength = 00000009
  TransferBuffer       = 00000000
  TransferBufferMDL    = 81ac92e0
    00000000: 00 00 00 04 01 00 00 04 00
  UrbLink              = 00000000
[544848 ms] UsbSnoop - MyInternalIOCTLCompletion(f8917db0) : fido=81b964f0, Irp=81c21570, Context=81b4ccc0, IRQL=2
[544848 ms]  <<<  URB 585 coming back  <<< 
-- URB_FUNCTION_BULK_OR_INTERRUPT_TRANSFER:
  PipeHandle           = 82300f14 [endpoint 0x00000002]
  TransferFlags        = 00000000 (USBD_TRANSFER_DIRECTION_OUT, ~USBD_SHORT_TRANSFER_OK)
  TransferBufferLength = 00000009
  TransferBuffer       = 00000000
  TransferBufferMDL    = 81ac92e0
  UrbLink              = 00000000
[544848 ms] UsbSnoop - DispatchAny(f8916610) : IRP_MJ_INTERNAL_DEVICE_CONTROL
[544848 ms] UsbSnoop - MyDispatchInternalIOCTL(f8917e80) : fdo=822eee08, Irp=81c21570, IRQL=2
[544848 ms]  >>>  URB 586 going down  >>> 
-- URB_FUNCTION_BULK_OR_INTERRUPT_TRANSFER:
  PipeHandle           = 82300ef4 [endpoint 0x00000081]
  TransferFlags        = 00000003 (USBD_TRANSFER_DIRECTION_IN, USBD_SHORT_TRANSFER_OK)
  TransferBufferLength = 00000100
  TransferBuffer       = 00000000
  TransferBufferMDL    = 81ac92e0
  UrbLink              = 00000000
[544850 ms] UsbSnoop - MyInternalIOCTLCompletion(f8917db0) : fido=81b964f0, Irp=81c21570, Context=81c429b8, IRQL=2
[544850 ms]  <<<  URB 586 coming back  <<< 
-- URB_FUNCTION_BULK_OR_INTERRUPT_TRANSFER:
  PipeHandle           = 82300ef4 [endpoint 0x00000081]
  TransferFlags        = 00000003 (USBD_TRANSFER_DIRECTION_IN, USBD_SHORT_TRANSFER_OK)
  TransferBufferLength = 00000009
  TransferBuffer       = 00000000
  TransferBufferMDL    = 81ac92e0
    00000000: 00 00 00 04 02 00 00 03 ff
  UrbLink              = 00000000
[544878 ms] UsbSnoop - DispatchAny(f8916610) : IRP_MJ_INTERNAL_DEVICE_CONTROL
[544878 ms] UsbSnoop - MyDispatchInternalIOCTL(f8917e80) : fdo=822eee08, Irp=81c21570, IRQL=2
[544878 ms]  >>>  URB 587 going down  >>> 
-- URB_FUNCTION_BULK_OR_INTERRUPT_TRANSFER:
  PipeHandle           = 82300f14 [endpoint 0x00000002]
  TransferFlags        = 00000000 (USBD_TRANSFER_DIRECTION_OUT, ~USBD_SHORT_TRANSFER_OK)
  TransferBufferLength = 00000015
  TransferBuffer       = 00000000
  TransferBufferMDL    = 81ac92e0
    00000000: 00 00 00 10 04 00 00 00 0a 00 01 00 03 00 01 00
    00000010: 00 00 00 07 d0
  UrbLink              = 00000000
[544879 ms] UsbSnoop - MyInternalIOCTLCompletion(f8917db0) : fido=81b964f0, Irp=81c21570, Context=81c3bfe8, IRQL=2
[544879 ms]  <<<  URB 587 coming back  <<< 
-- URB_FUNCTION_BULK_OR_INTERRUPT_TRANSFER:
  PipeHandle           = 82300f14 [endpoint 0x00000002]
  TransferFlags        = 00000000 (USBD_TRANSFER_DIRECTION_OUT, ~USBD_SHORT_TRANSFER_OK)
  TransferBufferLength = 00000015
  TransferBuffer       = 00000000
  TransferBufferMDL    = 81ac92e0
  UrbLink              = 00000000
[544888 ms] UsbSnoop - DispatchAny(f8916610) : IRP_MJ_INTERNAL_DEVICE_CONTROL
[544888 ms] UsbSnoop - MyDispatchInternalIOCTL(f8917e80) : fdo=822eee08, Irp=81c21570, IRQL=2
[544888 ms]  >>>  URB 588 going down  >>> 
-- URB_FUNCTION_BULK_OR_INTERRUPT_TRANSFER:
  PipeHandle           = 82300ef4 [endpoint 0x00000081]
  TransferFlags        = 00000003 (USBD_TRANSFER_DIRECTION_IN, USBD_SHORT_TRANSFER_OK)
  TransferBufferLength = 00000100
  TransferBuffer       = 00000000
  TransferBufferMDL    = 81ac92e0
  UrbLink              = 00000000
[544888 ms] UsbSnoop - MyInternalIOCTLCompletion(f8917db0) : fido=81b964f0, Irp=81c21570, Context=81c429b8, IRQL=2
[544888 ms]  <<<  URB 588 coming back  <<< 
-- URB_FUNCTION_BULK_OR_INTERRUPT_TRANSFER:
  PipeHandle           = 82300ef4 [endpoint 0x00000081]
  TransferFlags        = 00000003 (USBD_TRANSFER_DIRECTION_IN, USBD_SHORT_TRANSFER_OK)
  TransferBufferLength = 00000007
  TransferBuffer       = 00000000
  TransferBufferMDL    = 81ac92e0
    00000000: 00 00 00 02 05 e0 00
  UrbLink              = 00000000
[544928 ms] UsbSnoop - DispatchAny(f8916610) : IRP_MJ_INTERNAL_DEVICE_CONTROL
[544928 ms] UsbSnoop - MyDispatchInternalIOCTL(f8917e80) : fdo=822eee08, Irp=81c21570, IRQL=2
[544928 ms]  >>>  URB 589 going down  >>> 
-- URB_FUNCTION_BULK_OR_INTERRUPT_TRANSFER:
  PipeHandle           = 82300ef4 [endpoint 0x00000081]
  TransferFlags        = 00000003 (USBD_TRANSFER_DIRECTION_IN, USBD_SHORT_TRANSFER_OK)
  TransferBufferLength = 00000100
  TransferBuffer       = 00000000
  TransferBufferMDL    = 81ac92e0
  UrbLink              = 00000000
[544928 ms] UsbSnoop - MyInternalIOCTLCompletion(f8917db0) : fido=81b964f0, Irp=81c21570, Context=81b4ccc0, IRQL=2
[544928 ms]  <<<  URB 589 coming back  <<< 
-- URB_FUNCTION_BULK_OR_INTERRUPT_TRANSFER:
  PipeHandle           = 82300ef4 [endpoint 0x00000081]
  TransferFlags        = 00000003 (USBD_TRANSFER_DIRECTION_IN, USBD_SHORT_TRANSFER_OK)
  TransferBufferLength = 00000005
  TransferBuffer       = 00000000
  TransferBufferMDL    = 81ac92e0
    00000000: 00 00 00 0a 04
  UrbLink              = 00000000
[544958 ms] UsbSnoop - DispatchAny(f8916610) : IRP_MJ_INTERNAL_DEVICE_CONTROL
[544958 ms] UsbSnoop - MyDispatchInternalIOCTL(f8917e80) : fdo=822eee08, Irp=81c21570, IRQL=2
[544958 ms]  >>>  URB 590 going down  >>> 
-- URB_FUNCTION_BULK_OR_INTERRUPT_TRANSFER:
  PipeHandle           = 82300ef4 [endpoint 0x00000081]
  TransferFlags        = 00000003 (USBD_TRANSFER_DIRECTION_IN, USBD_SHORT_TRANSFER_OK)
  TransferBufferLength = 00000100
  TransferBuffer       = 00000000
  TransferBufferMDL    = 81ac92e0
  UrbLink              = 00000000
[544958 ms] UsbSnoop - MyInternalIOCTLCompletion(f8917db0) : fido=81b964f0, Irp=81c21570, Context=81c429b8, IRQL=2
[544958 ms]  <<<  URB 590 coming back  <<< 
-- URB_FUNCTION_BULK_OR_INTERRUPT_TRANSFER:
  PipeHandle           = 82300ef4 [endpoint 0x00000081]
  TransferFlags        = 00000003 (USBD_TRANSFER_DIRECTION_IN, USBD_SHORT_TRANSFER_OK)
  TransferBufferLength = 0000000a
  TransferBuffer       = 00000000
  TransferBufferMDL    = 81ac92e0
    00000000: 00 00 00 04 00 12 00 00 07 d0
  UrbLink              = 00000000
[544988 ms] UsbSnoop - DispatchAny(f8916610) : IRP_MJ_INTERNAL_DEVICE_CONTROL
[544988 ms] UsbSnoop - MyDispatchInternalIOCTL(f8917e80) : fdo=822eee08, Irp=81c21570, IRQL=2
[544988 ms]  >>>  URB 591 going down  >>> 
-- URB_FUNCTION_BULK_OR_INTERRUPT_TRANSFER:
  PipeHandle           = 82300f14 [endpoint 0x00000002]
  TransferFlags        = 00000000 (USBD_TRANSFER_DIRECTION_OUT, ~USBD_SHORT_TRANSFER_OK)
  TransferBufferLength = 00000007
  TransferBuffer       = 00000000
  TransferBufferMDL    = 81ac92e0
    00000000: 00 00 00 02 05 e0 00
  UrbLink              = 00000000
[544988 ms] UsbSnoop - MyInternalIOCTLCompletion(f8917db0) : fido=81b964f0, Irp=81c21570, Context=81c429b8, IRQL=2
[544988 ms]  <<<  URB 591 coming back  <<< 
-- URB_FUNCTION_BULK_OR_INTERRUPT_TRANSFER:
  PipeHandle           = 82300f14 [endpoint 0x00000002]
  TransferFlags        = 00000000 (USBD_TRANSFER_DIRECTION_OUT, ~USBD_SHORT_TRANSFER_OK)
  TransferBufferLength = 00000007
  TransferBuffer       = 00000000
  TransferBufferMDL    = 81ac92e0
  UrbLink              = 00000000
[544998 ms] UsbSnoop - DispatchAny(f8916610) : IRP_MJ_INTERNAL_DEVICE_CONTROL
[544998 ms] UsbSnoop - MyDispatchInternalIOCTL(f8917e80) : fdo=822eee08, Irp=81c21570, IRQL=2
[544998 ms]  >>>  URB 592 going down  >>> 
-- URB_FUNCTION_BULK_OR_INTERRUPT_TRANSFER:
  PipeHandle           = 82300f14 [endpoint 0x00000002]
  TransferFlags        = 00000000 (USBD_TRANSFER_DIRECTION_OUT, ~USBD_SHORT_TRANSFER_OK)
  TransferBufferLength = 0000000f
  TransferBuffer       = 00000000
  TransferBufferMDL    = 81ac92e0
    00000000: 00 00 00 0a 04 00 00 00 04 00 07 00 01 00 31
  UrbLink              = 00000000
[544998 ms] UsbSnoop - MyInternalIOCTLCompletion(f8917db0) : fido=81b964f0, Irp=81c21570, Context=81abee68, IRQL=2
[544998 ms]  <<<  URB 592 coming back  <<< 
-- URB_FUNCTION_BULK_OR_INTERRUPT_TRANSFER:
  PipeHandle           = 82300f14 [endpoint 0x00000002]
  TransferFlags        = 00000000 (USBD_TRANSFER_DIRECTION_OUT, ~USBD_SHORT_TRANSFER_OK)
  TransferBufferLength = 0000000f
  TransferBuffer       = 00000000
  TransferBufferMDL    = 81ac92e0
  UrbLink              = 00000000
[545008 ms] UsbSnoop - DispatchAny(f8916610) : IRP_MJ_INTERNAL_DEVICE_CONTROL
[545008 ms] UsbSnoop - MyDispatchInternalIOCTL(f8917e80) : fdo=822eee08, Irp=81c21570, IRQL=2
[545008 ms]  >>>  URB 593 going down  >>> 
-- URB_FUNCTION_BULK_OR_INTERRUPT_TRANSFER:
  PipeHandle           = 82300ef4 [endpoint 0x00000081]
  TransferFlags        = 00000003 (USBD_TRANSFER_DIRECTION_IN, USBD_SHORT_TRANSFER_OK)
  TransferBufferLength = 00000100
  TransferBuffer       = 00000000
  TransferBufferMDL    = 81ac92e0
  UrbLink              = 00000000
[545008 ms] UsbSnoop - MyInternalIOCTLCompletion(f8917db0) : fido=81b964f0, Irp=81c21570, Context=81be7968, IRQL=2
[545008 ms]  <<<  URB 593 coming back  <<< 
-- URB_FUNCTION_BULK_OR_INTERRUPT_TRANSFER:
  PipeHandle           = 82300ef4 [endpoint 0x00000081]
  TransferFlags        = 00000003 (USBD_TRANSFER_DIRECTION_IN, USBD_SHORT_TRANSFER_OK)
  TransferBufferLength = 00000007
  TransferBuffer       = 00000000
  TransferBufferMDL    = 81ac92e0
    00000000: 00 00 00 02 05 e0 00
  UrbLink              = 00000000
[545048 ms] UsbSnoop - DispatchAny(f8916610) : IRP_MJ_INTERNAL_DEVICE_CONTROL
[545048 ms] UsbSnoop - MyDispatchInternalIOCTL(f8917e80) : fdo=822eee08, Irp=81c21570, IRQL=2
[545048 ms]  >>>  URB 594 going down  >>> 
-- URB_FUNCTION_BULK_OR_INTERRUPT_TRANSFER:
  PipeHandle           = 82300ef4 [endpoint 0x00000081]
  TransferFlags        = 00000003 (USBD_TRANSFER_DIRECTION_IN, USBD_SHORT_TRANSFER_OK)
  TransferBufferLength = 00000100
  TransferBuffer       = 00000000
  TransferBufferMDL    = 81ac92e0
  UrbLink              = 00000000
[545282 ms] UsbSnoop - MyInternalIOCTLCompletion(f8917db0) : fido=81b964f0, Irp=81c21570, Context=81c429b8, IRQL=2
[545282 ms]  <<<  URB 594 coming back  <<< 
-- URB_FUNCTION_BULK_OR_INTERRUPT_TRANSFER:
  PipeHandle           = 82300ef4 [endpoint 0x00000081]
  TransferFlags        = 00000003 (USBD_TRANSFER_DIRECTION_IN, USBD_SHORT_TRANSFER_OK)
  TransferBufferLength = 00000005
  TransferBuffer       = 00000000
  TransferBufferMDL    = 81ac92e0
    00000000: 00 00 01 65 04
  UrbLink              = 00000000
[545308 ms] UsbSnoop - DispatchAny(f8916610) : IRP_MJ_INTERNAL_DEVICE_CONTROL
[545308 ms] UsbSnoop - MyDispatchInternalIOCTL(f8917e80) : fdo=822eee08, Irp=81c21570, IRQL=2
[545308 ms]  >>>  URB 595 going down  >>> 
-- URB_FUNCTION_BULK_OR_INTERRUPT_TRANSFER:
  PipeHandle           = 82300ef4 [endpoint 0x00000081]
  TransferFlags        = 00000003 (USBD_TRANSFER_DIRECTION_IN, USBD_SHORT_TRANSFER_OK)
  TransferBufferLength = 00000100
  TransferBuffer       = 00000000
  TransferBufferMDL    = 81ac92e0
  UrbLink              = 00000000
[545310 ms] UsbSnoop - MyInternalIOCTLCompletion(f8917db0) : fido=81b964f0, Irp=81c21570, Context=81c3bfe8, IRQL=2
[545310 ms]  <<<  URB 595 coming back  <<< 
-- URB_FUNCTION_BULK_OR_INTERRUPT_TRANSFER:
  PipeHandle           = 82300ef4 [endpoint 0x00000081]
  TransferFlags        = 00000003 (USBD_TRANSFER_DIRECTION_IN, USBD_SHORT_TRANSFER_OK)
  TransferBufferLength = 00000100
  TransferBuffer       = 00000000
  TransferBufferMDL    = 81ac92e0
    00000000: 00 00 01 5f 00 08 00 01 00 31 00 01 58 03 26 09
    00000010: 04 10 12 5e 31 02 0d 40 8b 13 29 18 27 b8 4d ed
    00000020: 1f e3 0b 7f 28 59 1b 79 70 e8 1b 22 94 41 6c a9
    00000030: bb 46 11 62 f6 6d 97 d6 0f 34 09 c5 c7 ad 53 54
    00000040: ce 19 92 0c c2 a5 2d 77 12 9a 28 e1 f3 06 67 a5
    00000050: 90 ec c7 45 50 91 5b 4f 03 3d 4a 0a 15 09 2e 4c
    00000060: 56 c7 00 0d 40 00 00 00 00 00 00 00 00 00 00 00
    00000070: 00 00 00 00 00 00 00 00 00 00 00 00 00 00 00 00
    00000080: 00 00 00 00 00 00 00 00 00 00 00 00 00 00 00 00
    00000090: 00 00 00 00 00 00 00 00 00 00 00 00 00 00 00 00
    000000a0: 00 00 00 00 00 80 0d 78 80 11 09 80 21 0d 80 32
    000000b0: 00 19 80 a1 02 80 4d 1d 41 64 76 61 6e 63 65 64
    000000c0: 20 4d 61 74 68 65 6d 61 74 69 63 73 20 53 6f 66
    000000d0: 74 77 61 72 65 03 26 09 04 0d 98 75 61 02 0d 40
    000000e0: a0 b3 cc bc d0 cb c7 91 53 65 b2 95 85 3b 4f d3
    000000f0: ea 63 45 1a 34 82 e4 97 ae b6 fe 62 71 40 27 23
  UrbLink              = 00000000
[545338 ms] UsbSnoop - DispatchAny(f8916610) : IRP_MJ_INTERNAL_DEVICE_CONTROL
[545338 ms] UsbSnoop - MyDispatchInternalIOCTL(f8917e80) : fdo=822eee08, Irp=81c21570, IRQL=2
[545338 ms]  >>>  URB 596 going down  >>> 
-- URB_FUNCTION_BULK_OR_INTERRUPT_TRANSFER:
  PipeHandle           = 82300ef4 [endpoint 0x00000081]
  TransferFlags        = 00000003 (USBD_TRANSFER_DIRECTION_IN, USBD_SHORT_TRANSFER_OK)
  TransferBufferLength = 00000100
  TransferBuffer       = 00000000
  TransferBufferMDL    = 81ac92e0
  UrbLink              = 00000000
[545339 ms] UsbSnoop - MyInternalIOCTLCompletion(f8917db0) : fido=81b964f0, Irp=81c21570, Context=81be7968, IRQL=2
[545339 ms]  <<<  URB 596 coming back  <<< 
-- URB_FUNCTION_BULK_OR_INTERRUPT_TRANSFER:
  PipeHandle           = 82300ef4 [endpoint 0x00000081]
  TransferFlags        = 00000003 (USBD_TRANSFER_DIRECTION_IN, USBD_SHORT_TRANSFER_OK)
  TransferBufferLength = 00000065
  TransferBuffer       = 00000000
  TransferBufferMDL    = 81ac92e0
    00000000: 60 be 66 5f b2 78 d1 b9 10 27 36 26 1e 00 c6 64
    00000010: da 8d bd ea 82 4c 4d 6f 35 be 08 2f 5e 64 6a 2e
    00000020: 02 0d 40 2c 4d 8b de 30 13 7f 5e 99 7b 22 67 6e
    00000030: 70 85 00 e7 a6 66 46 c0 e1 f9 55 6c e7 8f bf a7
    00000040: 4a aa 0b fa 62 48 50 b6 75 bc d9 9b 93 36 fd 1c
    00000050: 00 6d c8 20 98 bf f1 7b f1 52 70 98 f8 73 11 b1
    00000060: 0e c0 24 ff ff
  UrbLink              = 00000000
[545381 ms] UsbSnoop - DispatchAny(f8916610) : IRP_MJ_INTERNAL_DEVICE_CONTROL
[545381 ms] UsbSnoop - MyDispatchInternalIOCTL(f8917e80) : fdo=822eee08, Irp=81c21570, IRQL=2
[545381 ms]  >>>  URB 597 going down  >>> 
-- URB_FUNCTION_BULK_OR_INTERRUPT_TRANSFER:
  PipeHandle           = 82300f14 [endpoint 0x00000002]
  TransferFlags        = 00000000 (USBD_TRANSFER_DIRECTION_OUT, ~USBD_SHORT_TRANSFER_OK)
  TransferBufferLength = 00000007
  TransferBuffer       = 00000000
  TransferBufferMDL    = 81ac92e0
    00000000: 00 00 00 02 05 e0 00
  UrbLink              = 00000000
[545381 ms] UsbSnoop - MyInternalIOCTLCompletion(f8917db0) : fido=81b964f0, Irp=81c21570, Context=81c429b8, IRQL=2
[545381 ms]  <<<  URB 597 coming back  <<< 
-- URB_FUNCTION_BULK_OR_INTERRUPT_TRANSFER:
  PipeHandle           = 82300f14 [endpoint 0x00000002]
  TransferFlags        = 00000000 (USBD_TRANSFER_DIRECTION_OUT, ~USBD_SHORT_TRANSFER_OK)
  TransferBufferLength = 00000007
  TransferBuffer       = 00000000
  TransferBufferMDL    = 81ac92e0
  UrbLink              = 00000000
[546390 ms] UsbSnoop - DispatchAny(f8916610) : IRP_MJ_INTERNAL_DEVICE_CONTROL
[546390 ms] UsbSnoop - MyDispatchInternalIOCTL(f8917e80) : fdo=822eee08, Irp=81c21570, IRQL=2
[546390 ms]  >>>  URB 598 going down  >>> 
-- URB_FUNCTION_BULK_OR_INTERRUPT_TRANSFER:
  PipeHandle           = 82300f14 [endpoint 0x00000002]
  TransferFlags        = 00000000 (USBD_TRANSFER_DIRECTION_OUT, ~USBD_SHORT_TRANSFER_OK)
  TransferBufferLength = 00000009
  TransferBuffer       = 00000000
  TransferBufferMDL    = 81ac92e0
    00000000: 00 00 00 04 01 00 00 04 00
  UrbLink              = 00000000
[546390 ms] UsbSnoop - MyInternalIOCTLCompletion(f8917db0) : fido=81b964f0, Irp=81c21570, Context=81be7968, IRQL=2
[546390 ms]  <<<  URB 598 coming back  <<< 
-- URB_FUNCTION_BULK_OR_INTERRUPT_TRANSFER:
  PipeHandle           = 82300f14 [endpoint 0x00000002]
  TransferFlags        = 00000000 (USBD_TRANSFER_DIRECTION_OUT, ~USBD_SHORT_TRANSFER_OK)
  TransferBufferLength = 00000009
  TransferBuffer       = 00000000
  TransferBufferMDL    = 81ac92e0
  UrbLink              = 00000000
[546390 ms] UsbSnoop - DispatchAny(f8916610) : IRP_MJ_INTERNAL_DEVICE_CONTROL
[546390 ms] UsbSnoop - MyDispatchInternalIOCTL(f8917e80) : fdo=822eee08, Irp=81c21570, IRQL=2
[546390 ms]  >>>  URB 599 going down  >>> 
-- URB_FUNCTION_BULK_OR_INTERRUPT_TRANSFER:
  PipeHandle           = 82300ef4 [endpoint 0x00000081]
  TransferFlags        = 00000003 (USBD_TRANSFER_DIRECTION_IN, USBD_SHORT_TRANSFER_OK)
  TransferBufferLength = 00000100
  TransferBuffer       = 00000000
  TransferBufferMDL    = 81ac92e0
  UrbLink              = 00000000
[546392 ms] UsbSnoop - MyInternalIOCTLCompletion(f8917db0) : fido=81b964f0, Irp=81c21570, Context=81ba8040, IRQL=2
[546392 ms]  <<<  URB 599 coming back  <<< 
-- URB_FUNCTION_BULK_OR_INTERRUPT_TRANSFER:
  PipeHandle           = 82300ef4 [endpoint 0x00000081]
  TransferFlags        = 00000003 (USBD_TRANSFER_DIRECTION_IN, USBD_SHORT_TRANSFER_OK)
  TransferBufferLength = 00000009
  TransferBuffer       = 00000000
  TransferBufferMDL    = 81ac92e0
    00000000: 00 00 00 04 02 00 00 03 ff
  UrbLink              = 00000000
[546420 ms] UsbSnoop - DispatchAny(f8916610) : IRP_MJ_INTERNAL_DEVICE_CONTROL
[546420 ms] UsbSnoop - MyDispatchInternalIOCTL(f8917e80) : fdo=822eee08, Irp=81c21570, IRQL=2
[546420 ms]  >>>  URB 600 going down  >>> 
-- URB_FUNCTION_BULK_OR_INTERRUPT_TRANSFER:
  PipeHandle           = 82300f14 [endpoint 0x00000002]
  TransferFlags        = 00000000 (USBD_TRANSFER_DIRECTION_OUT, ~USBD_SHORT_TRANSFER_OK)
  TransferBufferLength = 00000015
  TransferBuffer       = 00000000
  TransferBufferMDL    = 81ac92e0
    00000000: 00 00 00 10 04 00 00 00 0a 00 01 00 03 00 01 00
    00000010: 00 00 00 07 d0
  UrbLink              = 00000000
[546420 ms] UsbSnoop - MyInternalIOCTLCompletion(f8917db0) : fido=81b964f0, Irp=81c21570, Context=81abee68, IRQL=2
[546420 ms]  <<<  URB 600 coming back  <<< 
-- URB_FUNCTION_BULK_OR_INTERRUPT_TRANSFER:
  PipeHandle           = 82300f14 [endpoint 0x00000002]
  TransferFlags        = 00000000 (USBD_TRANSFER_DIRECTION_OUT, ~USBD_SHORT_TRANSFER_OK)
  TransferBufferLength = 00000015
  TransferBuffer       = 00000000
  TransferBufferMDL    = 81ac92e0
  UrbLink              = 00000000
[546430 ms] UsbSnoop - DispatchAny(f8916610) : IRP_MJ_INTERNAL_DEVICE_CONTROL
[546430 ms] UsbSnoop - MyDispatchInternalIOCTL(f8917e80) : fdo=822eee08, Irp=81c21570, IRQL=2
[546430 ms]  >>>  URB 601 going down  >>> 
-- URB_FUNCTION_BULK_OR_INTERRUPT_TRANSFER:
  PipeHandle           = 82300ef4 [endpoint 0x00000081]
  TransferFlags        = 00000003 (USBD_TRANSFER_DIRECTION_IN, USBD_SHORT_TRANSFER_OK)
  TransferBufferLength = 00000100
  TransferBuffer       = 00000000
  TransferBufferMDL    = 81ac92e0
  UrbLink              = 00000000
[546430 ms] UsbSnoop - MyInternalIOCTLCompletion(f8917db0) : fido=81b964f0, Irp=81c21570, Context=81ba8040, IRQL=2
[546430 ms]  <<<  URB 601 coming back  <<< 
-- URB_FUNCTION_BULK_OR_INTERRUPT_TRANSFER:
  PipeHandle           = 82300ef4 [endpoint 0x00000081]
  TransferFlags        = 00000003 (USBD_TRANSFER_DIRECTION_IN, USBD_SHORT_TRANSFER_OK)
  TransferBufferLength = 00000007
  TransferBuffer       = 00000000
  TransferBufferMDL    = 81ac92e0
    00000000: 00 00 00 02 05 e0 00
  UrbLink              = 00000000
[546470 ms] UsbSnoop - DispatchAny(f8916610) : IRP_MJ_INTERNAL_DEVICE_CONTROL
[546470 ms] UsbSnoop - MyDispatchInternalIOCTL(f8917e80) : fdo=822eee08, Irp=81c21570, IRQL=2
[546470 ms]  >>>  URB 602 going down  >>> 
-- URB_FUNCTION_BULK_OR_INTERRUPT_TRANSFER:
  PipeHandle           = 82300ef4 [endpoint 0x00000081]
  TransferFlags        = 00000003 (USBD_TRANSFER_DIRECTION_IN, USBD_SHORT_TRANSFER_OK)
  TransferBufferLength = 00000100
  TransferBuffer       = 00000000
  TransferBufferMDL    = 81ac92e0
  UrbLink              = 00000000
[546470 ms] UsbSnoop - MyInternalIOCTLCompletion(f8917db0) : fido=81b964f0, Irp=81c21570, Context=81c429b8, IRQL=2
[546470 ms]  <<<  URB 602 coming back  <<< 
-- URB_FUNCTION_BULK_OR_INTERRUPT_TRANSFER:
  PipeHandle           = 82300ef4 [endpoint 0x00000081]
  TransferFlags        = 00000003 (USBD_TRANSFER_DIRECTION_IN, USBD_SHORT_TRANSFER_OK)
  TransferBufferLength = 00000005
  TransferBuffer       = 00000000
  TransferBufferMDL    = 81ac92e0
    00000000: 00 00 00 0a 04
  UrbLink              = 00000000
[546500 ms] UsbSnoop - DispatchAny(f8916610) : IRP_MJ_INTERNAL_DEVICE_CONTROL
[546500 ms] UsbSnoop - MyDispatchInternalIOCTL(f8917e80) : fdo=822eee08, Irp=81c21570, IRQL=2
[546500 ms]  >>>  URB 603 going down  >>> 
-- URB_FUNCTION_BULK_OR_INTERRUPT_TRANSFER:
  PipeHandle           = 82300ef4 [endpoint 0x00000081]
  TransferFlags        = 00000003 (USBD_TRANSFER_DIRECTION_IN, USBD_SHORT_TRANSFER_OK)
  TransferBufferLength = 00000100
  TransferBuffer       = 00000000
  TransferBufferMDL    = 81ac92e0
  UrbLink              = 00000000
[546500 ms] UsbSnoop - MyInternalIOCTLCompletion(f8917db0) : fido=81b964f0, Irp=81c21570, Context=81abee68, IRQL=2
[546500 ms]  <<<  URB 603 coming back  <<< 
-- URB_FUNCTION_BULK_OR_INTERRUPT_TRANSFER:
  PipeHandle           = 82300ef4 [endpoint 0x00000081]
  TransferFlags        = 00000003 (USBD_TRANSFER_DIRECTION_IN, USBD_SHORT_TRANSFER_OK)
  TransferBufferLength = 0000000a
  TransferBuffer       = 00000000
  TransferBufferMDL    = 81ac92e0
    00000000: 00 00 00 04 00 12 00 00 07 d0
  UrbLink              = 00000000
[546530 ms] UsbSnoop - DispatchAny(f8916610) : IRP_MJ_INTERNAL_DEVICE_CONTROL
[546530 ms] UsbSnoop - MyDispatchInternalIOCTL(f8917e80) : fdo=822eee08, Irp=81c21570, IRQL=2
[546530 ms]  >>>  URB 604 going down  >>> 
-- URB_FUNCTION_BULK_OR_INTERRUPT_TRANSFER:
  PipeHandle           = 82300f14 [endpoint 0x00000002]
  TransferFlags        = 00000000 (USBD_TRANSFER_DIRECTION_OUT, ~USBD_SHORT_TRANSFER_OK)
  TransferBufferLength = 00000007
  TransferBuffer       = 00000000
  TransferBufferMDL    = 81ac92e0
    00000000: 00 00 00 02 05 e0 00
  UrbLink              = 00000000
[546530 ms] UsbSnoop - MyInternalIOCTLCompletion(f8917db0) : fido=81b964f0, Irp=81c21570, Context=81c429b8, IRQL=2
[546530 ms]  <<<  URB 604 coming back  <<< 
-- URB_FUNCTION_BULK_OR_INTERRUPT_TRANSFER:
  PipeHandle           = 82300f14 [endpoint 0x00000002]
  TransferFlags        = 00000000 (USBD_TRANSFER_DIRECTION_OUT, ~USBD_SHORT_TRANSFER_OK)
  TransferBufferLength = 00000007
  TransferBuffer       = 00000000
  TransferBufferMDL    = 81ac92e0
  UrbLink              = 00000000
[546540 ms] UsbSnoop - DispatchAny(f8916610) : IRP_MJ_INTERNAL_DEVICE_CONTROL
[546540 ms] UsbSnoop - MyDispatchInternalIOCTL(f8917e80) : fdo=822eee08, Irp=81c21570, IRQL=2
[546540 ms]  >>>  URB 605 going down  >>> 
-- URB_FUNCTION_BULK_OR_INTERRUPT_TRANSFER:
  PipeHandle           = 82300f14 [endpoint 0x00000002]
  TransferFlags        = 00000000 (USBD_TRANSFER_DIRECTION_OUT, ~USBD_SHORT_TRANSFER_OK)
  TransferBufferLength = 00000022
  TransferBuffer       = 00000000
  TransferBufferMDL    = 81ac92e0
    00000000: 00 00 00 1d 04 00 00 00 17 00 09 00 00 00 06 00
    00000010: 02 00 03 00 05 00 01 00 41 00 42 00 01 00 01 00
    00000020: 01 01
  UrbLink              = 00000000
[546540 ms] UsbSnoop - MyInternalIOCTLCompletion(f8917db0) : fido=81b964f0, Irp=81c21570, Context=822f3898, IRQL=2
[546540 ms]  <<<  URB 605 coming back  <<< 
-- URB_FUNCTION_BULK_OR_INTERRUPT_TRANSFER:
  PipeHandle           = 82300f14 [endpoint 0x00000002]
  TransferFlags        = 00000000 (USBD_TRANSFER_DIRECTION_OUT, ~USBD_SHORT_TRANSFER_OK)
  TransferBufferLength = 00000022
  TransferBuffer       = 00000000
  TransferBufferMDL    = 81ac92e0
  UrbLink              = 00000000
[546550 ms] UsbSnoop - DispatchAny(f8916610) : IRP_MJ_INTERNAL_DEVICE_CONTROL
[546550 ms] UsbSnoop - MyDispatchInternalIOCTL(f8917e80) : fdo=822eee08, Irp=81c21570, IRQL=2
[546550 ms]  >>>  URB 606 going down  >>> 
-- URB_FUNCTION_BULK_OR_INTERRUPT_TRANSFER:
  PipeHandle           = 82300ef4 [endpoint 0x00000081]
  TransferFlags        = 00000003 (USBD_TRANSFER_DIRECTION_IN, USBD_SHORT_TRANSFER_OK)
  TransferBufferLength = 00000100
  TransferBuffer       = 00000000
  TransferBufferMDL    = 81ac92e0
  UrbLink              = 00000000
[546550 ms] UsbSnoop - MyInternalIOCTLCompletion(f8917db0) : fido=81b964f0, Irp=81c21570, Context=81d30f40, IRQL=2
[546550 ms]  <<<  URB 606 coming back  <<< 
-- URB_FUNCTION_BULK_OR_INTERRUPT_TRANSFER:
  PipeHandle           = 82300ef4 [endpoint 0x00000081]
  TransferFlags        = 00000003 (USBD_TRANSFER_DIRECTION_IN, USBD_SHORT_TRANSFER_OK)
  TransferBufferLength = 00000007
  TransferBuffer       = 00000000
  TransferBufferMDL    = 81ac92e0
    00000000: 00 00 00 02 05 e0 00
  UrbLink              = 00000000
[546590 ms] UsbSnoop - DispatchAny(f8916610) : IRP_MJ_INTERNAL_DEVICE_CONTROL
[546590 ms] UsbSnoop - MyDispatchInternalIOCTL(f8917e80) : fdo=822eee08, Irp=81c21570, IRQL=2
[546590 ms]  >>>  URB 607 going down  >>> 
-- URB_FUNCTION_BULK_OR_INTERRUPT_TRANSFER:
  PipeHandle           = 82300ef4 [endpoint 0x00000081]
  TransferFlags        = 00000003 (USBD_TRANSFER_DIRECTION_IN, USBD_SHORT_TRANSFER_OK)
  TransferBufferLength = 00000100
  TransferBuffer       = 00000000
  TransferBufferMDL    = 81ac92e0
  UrbLink              = 00000000
[546591 ms] UsbSnoop - MyInternalIOCTLCompletion(f8917db0) : fido=81b964f0, Irp=81c21570, Context=81ba8040, IRQL=2
[546591 ms]  <<<  URB 607 coming back  <<< 
-- URB_FUNCTION_BULK_OR_INTERRUPT_TRANSFER:
  PipeHandle           = 82300ef4 [endpoint 0x00000081]
  TransferFlags        = 00000003 (USBD_TRANSFER_DIRECTION_IN, USBD_SHORT_TRANSFER_OK)
  TransferBufferLength = 00000005
  TransferBuffer       = 00000000
  TransferBufferMDL    = 81ac92e0
    00000000: 00 00 00 33 04
  UrbLink              = 00000000
[546621 ms] UsbSnoop - DispatchAny(f8916610) : IRP_MJ_INTERNAL_DEVICE_CONTROL
[546621 ms] UsbSnoop - MyDispatchInternalIOCTL(f8917e80) : fdo=822eee08, Irp=81c21570, IRQL=2
[546621 ms]  >>>  URB 608 going down  >>> 
-- URB_FUNCTION_BULK_OR_INTERRUPT_TRANSFER:
  PipeHandle           = 82300ef4 [endpoint 0x00000081]
  TransferFlags        = 00000003 (USBD_TRANSFER_DIRECTION_IN, USBD_SHORT_TRANSFER_OK)
  TransferBufferLength = 00000100
  TransferBuffer       = 00000000
  TransferBufferMDL    = 81ac92e0
  UrbLink              = 00000000
[546621 ms] UsbSnoop - MyInternalIOCTLCompletion(f8917db0) : fido=81b964f0, Irp=81c21570, Context=81abee68, IRQL=2
[546621 ms]  <<<  URB 608 coming back  <<< 
-- URB_FUNCTION_BULK_OR_INTERRUPT_TRANSFER:
  PipeHandle           = 82300ef4 [endpoint 0x00000081]
  TransferFlags        = 00000003 (USBD_TRANSFER_DIRECTION_IN, USBD_SHORT_TRANSFER_OK)
  TransferBufferLength = 00000033
  TransferBuffer       = 00000000
  TransferBufferMDL    = 81ac92e0
    00000000: 00 00 00 2d 00 0a 04 6d 61 69 6e 00 00 00 06 00
    00000010: 02 00 00 04 f0 04 00 1f 00 03 00 00 01 00 00 05
    00000020: 02 00 01 00 00 04 00 00 00 0c 00 41 00 00 01 00
    00000030: 00 42 01
  UrbLink              = 00000000
[546650 ms] UsbSnoop - DispatchAny(f8916610) : IRP_MJ_INTERNAL_DEVICE_CONTROL
[546650 ms] UsbSnoop - MyDispatchInternalIOCTL(f8917e80) : fdo=822eee08, Irp=81c21570, IRQL=2
[546650 ms]  >>>  URB 609 going down  >>> 
-- URB_FUNCTION_BULK_OR_INTERRUPT_TRANSFER:
  PipeHandle           = 82300f14 [endpoint 0x00000002]
  TransferFlags        = 00000000 (USBD_TRANSFER_DIRECTION_OUT, ~USBD_SHORT_TRANSFER_OK)
  TransferBufferLength = 00000007
  TransferBuffer       = 00000000
  TransferBufferMDL    = 81ac92e0
    00000000: 00 00 00 02 05 e0 00
  UrbLink              = 00000000
[546651 ms] UsbSnoop - MyInternalIOCTLCompletion(f8917db0) : fido=81b964f0, Irp=81c21570, Context=81c429b8, IRQL=2
[546651 ms]  <<<  URB 609 coming back  <<< 
-- URB_FUNCTION_BULK_OR_INTERRUPT_TRANSFER:
  PipeHandle           = 82300f14 [endpoint 0x00000002]
  TransferFlags        = 00000000 (USBD_TRANSFER_DIRECTION_OUT, ~USBD_SHORT_TRANSFER_OK)
  TransferBufferLength = 00000007
  TransferBuffer       = 00000000
  TransferBufferMDL    = 81ac92e0
  UrbLink              = 00000000
[546660 ms] UsbSnoop - DispatchAny(f8916610) : IRP_MJ_INTERNAL_DEVICE_CONTROL
[546660 ms] UsbSnoop - MyDispatchInternalIOCTL(f8917e80) : fdo=822eee08, Irp=81c21570, IRQL=2
[546660 ms]  >>>  URB 610 going down  >>> 
-- URB_FUNCTION_BULK_OR_INTERRUPT_TRANSFER:
  PipeHandle           = 82300ef4 [endpoint 0x00000081]
  TransferFlags        = 00000003 (USBD_TRANSFER_DIRECTION_IN, USBD_SHORT_TRANSFER_OK)
  TransferBufferLength = 00000100
  TransferBuffer       = 00000000
  TransferBufferMDL    = 81ac92e0
  UrbLink              = 00000000
[546661 ms] UsbSnoop - MyInternalIOCTLCompletion(f8917db0) : fido=81b964f0, Irp=81c21570, Context=81ba8040, IRQL=2
[546661 ms]  <<<  URB 610 coming back  <<< 
-- URB_FUNCTION_BULK_OR_INTERRUPT_TRANSFER:
  PipeHandle           = 82300ef4 [endpoint 0x00000081]
  TransferFlags        = 00000003 (USBD_TRANSFER_DIRECTION_IN, USBD_SHORT_TRANSFER_OK)
  TransferBufferLength = 00000005
  TransferBuffer       = 00000000
  TransferBufferMDL    = 81ac92e0
    00000000: 00 00 00 35 04
  UrbLink              = 00000000
[546690 ms] UsbSnoop - DispatchAny(f8916610) : IRP_MJ_INTERNAL_DEVICE_CONTROL
[546690 ms] UsbSnoop - MyDispatchInternalIOCTL(f8917e80) : fdo=822eee08, Irp=81c21570, IRQL=2
[546690 ms]  >>>  URB 611 going down  >>> 
-- URB_FUNCTION_BULK_OR_INTERRUPT_TRANSFER:
  PipeHandle           = 82300ef4 [endpoint 0x00000081]
  TransferFlags        = 00000003 (USBD_TRANSFER_DIRECTION_IN, USBD_SHORT_TRANSFER_OK)
  TransferBufferLength = 00000100
  TransferBuffer       = 00000000
  TransferBufferMDL    = 81ac92e0
  UrbLink              = 00000000
[546691 ms] UsbSnoop - MyInternalIOCTLCompletion(f8917db0) : fido=81b964f0, Irp=81c21570, Context=81ba8040, IRQL=2
[546691 ms]  <<<  URB 611 coming back  <<< 
-- URB_FUNCTION_BULK_OR_INTERRUPT_TRANSFER:
  PipeHandle           = 82300ef4 [endpoint 0x00000081]
  TransferFlags        = 00000003 (USBD_TRANSFER_DIRECTION_IN, USBD_SHORT_TRANSFER_OK)
  TransferBufferLength = 00000035
  TransferBuffer       = 00000000
  TransferBufferMDL    = 81ac92e0
    00000000: 00 00 00 2f 00 0a 04 6d 61 69 6e 00 01 78 00 00
    00000010: 06 00 02 00 00 04 f0 04 00 00 00 03 00 00 01 00
    00000020: 00 05 02 00 01 00 00 04 00 00 00 05 00 41 00 00
    00000030: 01 00 00 42 01
  UrbLink              = 00000000
[546721 ms] UsbSnoop - DispatchAny(f8916610) : IRP_MJ_INTERNAL_DEVICE_CONTROL
[546721 ms] UsbSnoop - MyDispatchInternalIOCTL(f8917e80) : fdo=822eee08, Irp=81c21570, IRQL=2
[546721 ms]  >>>  URB 612 going down  >>> 
-- URB_FUNCTION_BULK_OR_INTERRUPT_TRANSFER:
  PipeHandle           = 82300f14 [endpoint 0x00000002]
  TransferFlags        = 00000000 (USBD_TRANSFER_DIRECTION_OUT, ~USBD_SHORT_TRANSFER_OK)
  TransferBufferLength = 00000007
  TransferBuffer       = 00000000
  TransferBufferMDL    = 81ac92e0
    00000000: 00 00 00 02 05 e0 00
  UrbLink              = 00000000
[546721 ms] UsbSnoop - MyInternalIOCTLCompletion(f8917db0) : fido=81b964f0, Irp=81c21570, Context=81ba8040, IRQL=2
[546721 ms]  <<<  URB 612 coming back  <<< 
-- URB_FUNCTION_BULK_OR_INTERRUPT_TRANSFER:
  PipeHandle           = 82300f14 [endpoint 0x00000002]
  TransferFlags        = 00000000 (USBD_TRANSFER_DIRECTION_OUT, ~USBD_SHORT_TRANSFER_OK)
  TransferBufferLength = 00000007
  TransferBuffer       = 00000000
  TransferBufferMDL    = 81ac92e0
  UrbLink              = 00000000
[546731 ms] UsbSnoop - DispatchAny(f8916610) : IRP_MJ_INTERNAL_DEVICE_CONTROL
[546731 ms] UsbSnoop - MyDispatchInternalIOCTL(f8917e80) : fdo=822eee08, Irp=81c21570, IRQL=2
[546731 ms]  >>>  URB 613 going down  >>> 
-- URB_FUNCTION_BULK_OR_INTERRUPT_TRANSFER:
  PipeHandle           = 82300ef4 [endpoint 0x00000081]
  TransferFlags        = 00000003 (USBD_TRANSFER_DIRECTION_IN, USBD_SHORT_TRANSFER_OK)
  TransferBufferLength = 00000100
  TransferBuffer       = 00000000
  TransferBufferMDL    = 81ac92e0
  UrbLink              = 00000000
[546731 ms] UsbSnoop - MyInternalIOCTLCompletion(f8917db0) : fido=81b964f0, Irp=81c21570, Context=81d30f40, IRQL=2
[546731 ms]  <<<  URB 613 coming back  <<< 
-- URB_FUNCTION_BULK_OR_INTERRUPT_TRANSFER:
  PipeHandle           = 82300ef4 [endpoint 0x00000081]
  TransferFlags        = 00000003 (USBD_TRANSFER_DIRECTION_IN, USBD_SHORT_TRANSFER_OK)
  TransferBufferLength = 00000005
  TransferBuffer       = 00000000
  TransferBufferMDL    = 81ac92e0
    00000000: 00 00 00 35 04
  UrbLink              = 00000000
[546761 ms] UsbSnoop - DispatchAny(f8916610) : IRP_MJ_INTERNAL_DEVICE_CONTROL
[546761 ms] UsbSnoop - MyDispatchInternalIOCTL(f8917e80) : fdo=822eee08, Irp=81c21570, IRQL=2
[546761 ms]  >>>  URB 614 going down  >>> 
-- URB_FUNCTION_BULK_OR_INTERRUPT_TRANSFER:
  PipeHandle           = 82300ef4 [endpoint 0x00000081]
  TransferFlags        = 00000003 (USBD_TRANSFER_DIRECTION_IN, USBD_SHORT_TRANSFER_OK)
  TransferBufferLength = 00000100
  TransferBuffer       = 00000000
  TransferBufferMDL    = 81ac92e0
  UrbLink              = 00000000
[546761 ms] UsbSnoop - MyInternalIOCTLCompletion(f8917db0) : fido=81b964f0, Irp=81c21570, Context=81c429b8, IRQL=2
[546761 ms]  <<<  URB 614 coming back  <<< 
-- URB_FUNCTION_BULK_OR_INTERRUPT_TRANSFER:
  PipeHandle           = 82300ef4 [endpoint 0x00000081]
  TransferFlags        = 00000003 (USBD_TRANSFER_DIRECTION_IN, USBD_SHORT_TRANSFER_OK)
  TransferBufferLength = 00000035
  TransferBuffer       = 00000000
  TransferBufferMDL    = 81ac92e0
    00000000: 00 00 00 2f 00 0a 04 6d 61 69 6e 00 01 79 00 00
    00000010: 06 00 02 00 00 04 f0 04 00 00 00 03 00 00 01 00
    00000020: 00 05 02 00 01 00 00 04 00 00 00 05 00 41 00 00
    00000030: 01 01 00 42 01
  UrbLink              = 00000000
[546791 ms] UsbSnoop - DispatchAny(f8916610) : IRP_MJ_INTERNAL_DEVICE_CONTROL
[546791 ms] UsbSnoop - MyDispatchInternalIOCTL(f8917e80) : fdo=822eee08, Irp=81c21570, IRQL=2
[546791 ms]  >>>  URB 615 going down  >>> 
-- URB_FUNCTION_BULK_OR_INTERRUPT_TRANSFER:
  PipeHandle           = 82300f14 [endpoint 0x00000002]
  TransferFlags        = 00000000 (USBD_TRANSFER_DIRECTION_OUT, ~USBD_SHORT_TRANSFER_OK)
  TransferBufferLength = 00000007
  TransferBuffer       = 00000000
  TransferBufferMDL    = 81ac92e0
    00000000: 00 00 00 02 05 e0 00
  UrbLink              = 00000000
[546791 ms] UsbSnoop - MyInternalIOCTLCompletion(f8917db0) : fido=81b964f0, Irp=81c21570, Context=81ba8040, IRQL=2
[546791 ms]  <<<  URB 615 coming back  <<< 
-- URB_FUNCTION_BULK_OR_INTERRUPT_TRANSFER:
  PipeHandle           = 82300f14 [endpoint 0x00000002]
  TransferFlags        = 00000000 (USBD_TRANSFER_DIRECTION_OUT, ~USBD_SHORT_TRANSFER_OK)
  TransferBufferLength = 00000007
  TransferBuffer       = 00000000
  TransferBufferMDL    = 81ac92e0
  UrbLink              = 00000000
[546801 ms] UsbSnoop - DispatchAny(f8916610) : IRP_MJ_INTERNAL_DEVICE_CONTROL
[546801 ms] UsbSnoop - MyDispatchInternalIOCTL(f8917e80) : fdo=822eee08, Irp=81c21570, IRQL=2
[546801 ms]  >>>  URB 616 going down  >>> 
-- URB_FUNCTION_BULK_OR_INTERRUPT_TRANSFER:
  PipeHandle           = 82300ef4 [endpoint 0x00000081]
  TransferFlags        = 00000003 (USBD_TRANSFER_DIRECTION_IN, USBD_SHORT_TRANSFER_OK)
  TransferBufferLength = 00000100
  TransferBuffer       = 00000000
  TransferBufferMDL    = 81ac92e0
  UrbLink              = 00000000
[546801 ms] UsbSnoop - MyInternalIOCTLCompletion(f8917db0) : fido=81b964f0, Irp=81c21570, Context=81c429b8, IRQL=2
[546801 ms]  <<<  URB 616 coming back  <<< 
-- URB_FUNCTION_BULK_OR_INTERRUPT_TRANSFER:
  PipeHandle           = 82300ef4 [endpoint 0x00000081]
  TransferFlags        = 00000003 (USBD_TRANSFER_DIRECTION_IN, USBD_SHORT_TRANSFER_OK)
  TransferBufferLength = 00000005
  TransferBuffer       = 00000000
  TransferBufferMDL    = 81ac92e0
    00000000: 00 00 00 35 04
  UrbLink              = 00000000
[546831 ms] UsbSnoop - DispatchAny(f8916610) : IRP_MJ_INTERNAL_DEVICE_CONTROL
[546831 ms] UsbSnoop - MyDispatchInternalIOCTL(f8917e80) : fdo=822eee08, Irp=81c21570, IRQL=2
[546831 ms]  >>>  URB 617 going down  >>> 
-- URB_FUNCTION_BULK_OR_INTERRUPT_TRANSFER:
  PipeHandle           = 82300ef4 [endpoint 0x00000081]
  TransferFlags        = 00000003 (USBD_TRANSFER_DIRECTION_IN, USBD_SHORT_TRANSFER_OK)
  TransferBufferLength = 00000100
  TransferBuffer       = 00000000
  TransferBufferMDL    = 81ac92e0
  UrbLink              = 00000000
[546831 ms] UsbSnoop - MyInternalIOCTLCompletion(f8917db0) : fido=81b964f0, Irp=81c21570, Context=81d30f40, IRQL=2
[546831 ms]  <<<  URB 617 coming back  <<< 
-- URB_FUNCTION_BULK_OR_INTERRUPT_TRANSFER:
  PipeHandle           = 82300ef4 [endpoint 0x00000081]
  TransferFlags        = 00000003 (USBD_TRANSFER_DIRECTION_IN, USBD_SHORT_TRANSFER_OK)
  TransferBufferLength = 00000035
  TransferBuffer       = 00000000
  TransferBufferMDL    = 81ac92e0
    00000000: 00 00 00 2f 00 0a 04 6d 61 69 6e 00 01 7a 00 00
    00000010: 06 00 02 00 00 04 f0 04 00 00 00 03 00 00 01 01
    00000020: 00 05 02 00 01 00 00 04 00 00 00 05 00 41 00 00
    00000030: 01 01 00 42 01
  UrbLink              = 00000000
[546861 ms] UsbSnoop - DispatchAny(f8916610) : IRP_MJ_INTERNAL_DEVICE_CONTROL
[546861 ms] UsbSnoop - MyDispatchInternalIOCTL(f8917e80) : fdo=822eee08, Irp=81c21570, IRQL=2
[546861 ms]  >>>  URB 618 going down  >>> 
-- URB_FUNCTION_BULK_OR_INTERRUPT_TRANSFER:
  PipeHandle           = 82300f14 [endpoint 0x00000002]
  TransferFlags        = 00000000 (USBD_TRANSFER_DIRECTION_OUT, ~USBD_SHORT_TRANSFER_OK)
  TransferBufferLength = 00000007
  TransferBuffer       = 00000000
  TransferBufferMDL    = 81ac92e0
    00000000: 00 00 00 02 05 e0 00
  UrbLink              = 00000000
[546861 ms] UsbSnoop - MyInternalIOCTLCompletion(f8917db0) : fido=81b964f0, Irp=81c21570, Context=81c429b8, IRQL=2
[546861 ms]  <<<  URB 618 coming back  <<< 
-- URB_FUNCTION_BULK_OR_INTERRUPT_TRANSFER:
  PipeHandle           = 82300f14 [endpoint 0x00000002]
  TransferFlags        = 00000000 (USBD_TRANSFER_DIRECTION_OUT, ~USBD_SHORT_TRANSFER_OK)
  TransferBufferLength = 00000007
  TransferBuffer       = 00000000
  TransferBufferMDL    = 81ac92e0
  UrbLink              = 00000000
[546871 ms] UsbSnoop - DispatchAny(f8916610) : IRP_MJ_INTERNAL_DEVICE_CONTROL
[546871 ms] UsbSnoop - MyDispatchInternalIOCTL(f8917e80) : fdo=822eee08, Irp=81c21570, IRQL=2
[546871 ms]  >>>  URB 619 going down  >>> 
-- URB_FUNCTION_BULK_OR_INTERRUPT_TRANSFER:
  PipeHandle           = 82300ef4 [endpoint 0x00000081]
  TransferFlags        = 00000003 (USBD_TRANSFER_DIRECTION_IN, USBD_SHORT_TRANSFER_OK)
  TransferBufferLength = 00000100
  TransferBuffer       = 00000000
  TransferBufferMDL    = 81ac92e0
  UrbLink              = 00000000
[546871 ms] UsbSnoop - MyInternalIOCTLCompletion(f8917db0) : fido=81b964f0, Irp=81c21570, Context=81ba8040, IRQL=2
[546871 ms]  <<<  URB 619 coming back  <<< 
-- URB_FUNCTION_BULK_OR_INTERRUPT_TRANSFER:
  PipeHandle           = 82300ef4 [endpoint 0x00000081]
  TransferFlags        = 00000003 (USBD_TRANSFER_DIRECTION_IN, USBD_SHORT_TRANSFER_OK)
  TransferBufferLength = 00000005
  TransferBuffer       = 00000000
  TransferBufferMDL    = 81ac92e0
    00000000: 00 00 00 06 04
  UrbLink              = 00000000
[546901 ms] UsbSnoop - DispatchAny(f8916610) : IRP_MJ_INTERNAL_DEVICE_CONTROL
[546901 ms] UsbSnoop - MyDispatchInternalIOCTL(f8917e80) : fdo=822eee08, Irp=81c21570, IRQL=2
[546901 ms]  >>>  URB 620 going down  >>> 
-- URB_FUNCTION_BULK_OR_INTERRUPT_TRANSFER:
  PipeHandle           = 82300ef4 [endpoint 0x00000081]
  TransferFlags        = 00000003 (USBD_TRANSFER_DIRECTION_IN, USBD_SHORT_TRANSFER_OK)
  TransferBufferLength = 00000100
  TransferBuffer       = 00000000
  TransferBufferMDL    = 81ac92e0
  UrbLink              = 00000000
[546901 ms] UsbSnoop - MyInternalIOCTLCompletion(f8917db0) : fido=81b964f0, Irp=81c21570, Context=81c429b8, IRQL=2
[546901 ms]  <<<  URB 620 coming back  <<< 
-- URB_FUNCTION_BULK_OR_INTERRUPT_TRANSFER:
  PipeHandle           = 82300ef4 [endpoint 0x00000081]
  TransferFlags        = 00000003 (USBD_TRANSFER_DIRECTION_IN, USBD_SHORT_TRANSFER_OK)
  TransferBufferLength = 00000006
  TransferBuffer       = 00000000
  TransferBufferMDL    = 81ac92e0
    00000000: 00 00 00 00 dd 00
  UrbLink              = 00000000
[546932 ms] UsbSnoop - DispatchAny(f8916610) : IRP_MJ_INTERNAL_DEVICE_CONTROL
[546932 ms] UsbSnoop - MyDispatchInternalIOCTL(f8917e80) : fdo=822eee08, Irp=81c21570, IRQL=2
[546932 ms]  >>>  URB 621 going down  >>> 
-- URB_FUNCTION_BULK_OR_INTERRUPT_TRANSFER:
  PipeHandle           = 82300f14 [endpoint 0x00000002]
  TransferFlags        = 00000000 (USBD_TRANSFER_DIRECTION_OUT, ~USBD_SHORT_TRANSFER_OK)
  TransferBufferLength = 00000007
  TransferBuffer       = 00000000
  TransferBufferMDL    = 81ac92e0
    00000000: 00 00 00 02 05 e0 00
  UrbLink              = 00000000
[546932 ms] UsbSnoop - MyInternalIOCTLCompletion(f8917db0) : fido=81b964f0, Irp=81c21570, Context=822f3898, IRQL=2
[546932 ms]  <<<  URB 621 coming back  <<< 
-- URB_FUNCTION_BULK_OR_INTERRUPT_TRANSFER:
  PipeHandle           = 82300f14 [endpoint 0x00000002]
  TransferFlags        = 00000000 (USBD_TRANSFER_DIRECTION_OUT, ~USBD_SHORT_TRANSFER_OK)
  TransferBufferLength = 00000007
  TransferBuffer       = 00000000
  TransferBufferMDL    = 81ac92e0
  UrbLink              = 00000000
[547201 ms] UsbSnoop - DispatchAny(f8916610) : IRP_MJ_INTERNAL_DEVICE_CONTROL
[547201 ms] UsbSnoop - MyDispatchInternalIOCTL(f8917e80) : fdo=822eee08, Irp=81c21570, IRQL=2
[547201 ms]  >>>  URB 622 going down  >>> 
-- URB_FUNCTION_BULK_OR_INTERRUPT_TRANSFER:
  PipeHandle           = 82300f14 [endpoint 0x00000002]
  TransferFlags        = 00000000 (USBD_TRANSFER_DIRECTION_OUT, ~USBD_SHORT_TRANSFER_OK)
  TransferBufferLength = 00000009
  TransferBuffer       = 00000000
  TransferBufferMDL    = 81ac92e0
    00000000: 00 00 00 04 01 00 00 04 00
  UrbLink              = 00000000
[547202 ms] UsbSnoop - MyInternalIOCTLCompletion(f8917db0) : fido=81b964f0, Irp=81c21570, Context=81b4d110, IRQL=2
[547202 ms]  <<<  URB 622 coming back  <<< 
-- URB_FUNCTION_BULK_OR_INTERRUPT_TRANSFER:
  PipeHandle           = 82300f14 [endpoint 0x00000002]
  TransferFlags        = 00000000 (USBD_TRANSFER_DIRECTION_OUT, ~USBD_SHORT_TRANSFER_OK)
  TransferBufferLength = 00000009
  TransferBuffer       = 00000000
  TransferBufferMDL    = 81ac92e0
  UrbLink              = 00000000
[547202 ms] UsbSnoop - DispatchAny(f8916610) : IRP_MJ_INTERNAL_DEVICE_CONTROL
[547202 ms] UsbSnoop - MyDispatchInternalIOCTL(f8917e80) : fdo=822eee08, Irp=81c21570, IRQL=2
[547202 ms]  >>>  URB 623 going down  >>> 
-- URB_FUNCTION_BULK_OR_INTERRUPT_TRANSFER:
  PipeHandle           = 82300ef4 [endpoint 0x00000081]
  TransferFlags        = 00000003 (USBD_TRANSFER_DIRECTION_IN, USBD_SHORT_TRANSFER_OK)
  TransferBufferLength = 00000100
  TransferBuffer       = 00000000
  TransferBufferMDL    = 81ac92e0
  UrbLink              = 00000000
[547203 ms] UsbSnoop - MyInternalIOCTLCompletion(f8917db0) : fido=81b964f0, Irp=81c21570, Context=81d30f40, IRQL=2
[547203 ms]  <<<  URB 623 coming back  <<< 
-- URB_FUNCTION_BULK_OR_INTERRUPT_TRANSFER:
  PipeHandle           = 82300ef4 [endpoint 0x00000081]
  TransferFlags        = 00000003 (USBD_TRANSFER_DIRECTION_IN, USBD_SHORT_TRANSFER_OK)
  TransferBufferLength = 00000009
  TransferBuffer       = 00000000
  TransferBufferMDL    = 81ac92e0
    00000000: 00 00 00 04 02 00 00 03 ff
  UrbLink              = 00000000
[547232 ms] UsbSnoop - DispatchAny(f8916610) : IRP_MJ_INTERNAL_DEVICE_CONTROL
[547232 ms] UsbSnoop - MyDispatchInternalIOCTL(f8917e80) : fdo=822eee08, Irp=81c21570, IRQL=2
[547232 ms]  >>>  URB 624 going down  >>> 
-- URB_FUNCTION_BULK_OR_INTERRUPT_TRANSFER:
  PipeHandle           = 82300f14 [endpoint 0x00000002]
  TransferFlags        = 00000000 (USBD_TRANSFER_DIRECTION_OUT, ~USBD_SHORT_TRANSFER_OK)
  TransferBufferLength = 00000015
  TransferBuffer       = 00000000
  TransferBufferMDL    = 81ac92e0
    00000000: 00 00 00 10 04 00 00 00 0a 00 01 00 03 00 01 00
    00000010: 00 00 00 07 d0
  UrbLink              = 00000000
[547232 ms] UsbSnoop - MyInternalIOCTLCompletion(f8917db0) : fido=81b964f0, Irp=81c21570, Context=81ba8040, IRQL=2
[547233 ms]  <<<  URB 624 coming back  <<< 
-- URB_FUNCTION_BULK_OR_INTERRUPT_TRANSFER:
  PipeHandle           = 82300f14 [endpoint 0x00000002]
  TransferFlags        = 00000000 (USBD_TRANSFER_DIRECTION_OUT, ~USBD_SHORT_TRANSFER_OK)
  TransferBufferLength = 00000015
  TransferBuffer       = 00000000
  TransferBufferMDL    = 81ac92e0
  UrbLink              = 00000000
[547241 ms] UsbSnoop - DispatchAny(f8916610) : IRP_MJ_INTERNAL_DEVICE_CONTROL
[547241 ms] UsbSnoop - MyDispatchInternalIOCTL(f8917e80) : fdo=822eee08, Irp=81c21570, IRQL=2
[547241 ms]  >>>  URB 625 going down  >>> 
-- URB_FUNCTION_BULK_OR_INTERRUPT_TRANSFER:
  PipeHandle           = 82300ef4 [endpoint 0x00000081]
  TransferFlags        = 00000003 (USBD_TRANSFER_DIRECTION_IN, USBD_SHORT_TRANSFER_OK)
  TransferBufferLength = 00000100
  TransferBuffer       = 00000000
  TransferBufferMDL    = 81ac92e0
  UrbLink              = 00000000
[547242 ms] UsbSnoop - MyInternalIOCTLCompletion(f8917db0) : fido=81b964f0, Irp=81c21570, Context=81d30f40, IRQL=2
[547242 ms]  <<<  URB 625 coming back  <<< 
-- URB_FUNCTION_BULK_OR_INTERRUPT_TRANSFER:
  PipeHandle           = 82300ef4 [endpoint 0x00000081]
  TransferFlags        = 00000003 (USBD_TRANSFER_DIRECTION_IN, USBD_SHORT_TRANSFER_OK)
  TransferBufferLength = 00000007
  TransferBuffer       = 00000000
  TransferBufferMDL    = 81ac92e0
    00000000: 00 00 00 02 05 e0 00
  UrbLink              = 00000000
[547281 ms] UsbSnoop - DispatchAny(f8916610) : IRP_MJ_INTERNAL_DEVICE_CONTROL
[547281 ms] UsbSnoop - MyDispatchInternalIOCTL(f8917e80) : fdo=822eee08, Irp=81c21570, IRQL=2
[547281 ms]  >>>  URB 626 going down  >>> 
-- URB_FUNCTION_BULK_OR_INTERRUPT_TRANSFER:
  PipeHandle           = 82300ef4 [endpoint 0x00000081]
  TransferFlags        = 00000003 (USBD_TRANSFER_DIRECTION_IN, USBD_SHORT_TRANSFER_OK)
  TransferBufferLength = 00000100
  TransferBuffer       = 00000000
  TransferBufferMDL    = 81ac92e0
  UrbLink              = 00000000
[547282 ms] UsbSnoop - MyInternalIOCTLCompletion(f8917db0) : fido=81b964f0, Irp=81c21570, Context=81d30f40, IRQL=2
[547282 ms]  <<<  URB 626 coming back  <<< 
-- URB_FUNCTION_BULK_OR_INTERRUPT_TRANSFER:
  PipeHandle           = 82300ef4 [endpoint 0x00000081]
  TransferFlags        = 00000003 (USBD_TRANSFER_DIRECTION_IN, USBD_SHORT_TRANSFER_OK)
  TransferBufferLength = 00000005
  TransferBuffer       = 00000000
  TransferBufferMDL    = 81ac92e0
    00000000: 00 00 00 0a 04
  UrbLink              = 00000000
[547311 ms] UsbSnoop - DispatchAny(f8916610) : IRP_MJ_INTERNAL_DEVICE_CONTROL
[547311 ms] UsbSnoop - MyDispatchInternalIOCTL(f8917e80) : fdo=822eee08, Irp=81c21570, IRQL=2
[547311 ms]  >>>  URB 627 going down  >>> 
-- URB_FUNCTION_BULK_OR_INTERRUPT_TRANSFER:
  PipeHandle           = 82300ef4 [endpoint 0x00000081]
  TransferFlags        = 00000003 (USBD_TRANSFER_DIRECTION_IN, USBD_SHORT_TRANSFER_OK)
  TransferBufferLength = 00000100
  TransferBuffer       = 00000000
  TransferBufferMDL    = 81ac92e0
  UrbLink              = 00000000
[547312 ms] UsbSnoop - MyInternalIOCTLCompletion(f8917db0) : fido=81b964f0, Irp=81c21570, Context=81b4d110, IRQL=2
[547312 ms]  <<<  URB 627 coming back  <<< 
-- URB_FUNCTION_BULK_OR_INTERRUPT_TRANSFER:
  PipeHandle           = 82300ef4 [endpoint 0x00000081]
  TransferFlags        = 00000003 (USBD_TRANSFER_DIRECTION_IN, USBD_SHORT_TRANSFER_OK)
  TransferBufferLength = 0000000a
  TransferBuffer       = 00000000
  TransferBufferMDL    = 81ac92e0
    00000000: 00 00 00 04 00 12 00 00 07 d0
  UrbLink              = 00000000
[547342 ms] UsbSnoop - DispatchAny(f8916610) : IRP_MJ_INTERNAL_DEVICE_CONTROL
[547342 ms] UsbSnoop - MyDispatchInternalIOCTL(f8917e80) : fdo=822eee08, Irp=81c21570, IRQL=2
[547342 ms]  >>>  URB 628 going down  >>> 
-- URB_FUNCTION_BULK_OR_INTERRUPT_TRANSFER:
  PipeHandle           = 82300f14 [endpoint 0x00000002]
  TransferFlags        = 00000000 (USBD_TRANSFER_DIRECTION_OUT, ~USBD_SHORT_TRANSFER_OK)
  TransferBufferLength = 00000007
  TransferBuffer       = 00000000
  TransferBufferMDL    = 81ac92e0
    00000000: 00 00 00 02 05 e0 00
  UrbLink              = 00000000
[547342 ms] UsbSnoop - MyInternalIOCTLCompletion(f8917db0) : fido=81b964f0, Irp=81c21570, Context=81ba8040, IRQL=2
[547342 ms]  <<<  URB 628 coming back  <<< 
-- URB_FUNCTION_BULK_OR_INTERRUPT_TRANSFER:
  PipeHandle           = 82300f14 [endpoint 0x00000002]
  TransferFlags        = 00000000 (USBD_TRANSFER_DIRECTION_OUT, ~USBD_SHORT_TRANSFER_OK)
  TransferBufferLength = 00000007
  TransferBuffer       = 00000000
  TransferBufferMDL    = 81ac92e0
  UrbLink              = 00000000
[547353 ms] UsbSnoop - DispatchAny(f8916610) : IRP_MJ_INTERNAL_DEVICE_CONTROL
[547353 ms] UsbSnoop - MyDispatchInternalIOCTL(f8917e80) : fdo=822eee08, Irp=81c21570, IRQL=2
[547353 ms]  >>>  URB 629 going down  >>> 
-- URB_FUNCTION_BULK_OR_INTERRUPT_TRANSFER:
  PipeHandle           = 82300f14 [endpoint 0x00000002]
  TransferFlags        = 00000000 (USBD_TRANSFER_DIRECTION_OUT, ~USBD_SHORT_TRANSFER_OK)
  TransferBufferLength = 00000010
  TransferBuffer       = 00000000
  TransferBufferMDL    = 81ac92e0
    00000000: 00 00 00 0b 04 00 00 00 05 00 0e 00 37 00 01 01
  UrbLink              = 00000000
[547353 ms] UsbSnoop - MyInternalIOCTLCompletion(f8917db0) : fido=81b964f0, Irp=81c21570, Context=822f3898, IRQL=2
[547353 ms]  <<<  URB 629 coming back  <<< 
-- URB_FUNCTION_BULK_OR_INTERRUPT_TRANSFER:
  PipeHandle           = 82300f14 [endpoint 0x00000002]
  TransferFlags        = 00000000 (USBD_TRANSFER_DIRECTION_OUT, ~USBD_SHORT_TRANSFER_OK)
  TransferBufferLength = 00000010
  TransferBuffer       = 00000000
  TransferBufferMDL    = 81ac92e0
  UrbLink              = 00000000
[547362 ms] UsbSnoop - DispatchAny(f8916610) : IRP_MJ_INTERNAL_DEVICE_CONTROL
[547362 ms] UsbSnoop - MyDispatchInternalIOCTL(f8917e80) : fdo=822eee08, Irp=81c21570, IRQL=2
[547362 ms]  >>>  URB 630 going down  >>> 
-- URB_FUNCTION_BULK_OR_INTERRUPT_TRANSFER:
  PipeHandle           = 82300ef4 [endpoint 0x00000081]
  TransferFlags        = 00000003 (USBD_TRANSFER_DIRECTION_IN, USBD_SHORT_TRANSFER_OK)
  TransferBufferLength = 00000100
  TransferBuffer       = 00000000
  TransferBufferMDL    = 81ac92e0
  UrbLink              = 00000000
[547362 ms] UsbSnoop - MyInternalIOCTLCompletion(f8917db0) : fido=81b964f0, Irp=81c21570, Context=81ba8040, IRQL=2
[547362 ms]  <<<  URB 630 coming back  <<< 
-- URB_FUNCTION_BULK_OR_INTERRUPT_TRANSFER:
  PipeHandle           = 82300ef4 [endpoint 0x00000081]
  TransferFlags        = 00000003 (USBD_TRANSFER_DIRECTION_IN, USBD_SHORT_TRANSFER_OK)
  TransferBufferLength = 00000007
  TransferBuffer       = 00000000
  TransferBufferMDL    = 81ac92e0
    00000000: 00 00 00 02 05 e0 00
  UrbLink              = 00000000
[547402 ms] UsbSnoop - DispatchAny(f8916610) : IRP_MJ_INTERNAL_DEVICE_CONTROL
[547402 ms] UsbSnoop - MyDispatchInternalIOCTL(f8917e80) : fdo=822eee08, Irp=81abb730, IRQL=2
[547402 ms]  >>>  URB 631 going down  >>> 
-- URB_FUNCTION_BULK_OR_INTERRUPT_TRANSFER:
  PipeHandle           = 82300ef4 [endpoint 0x00000081]
  TransferFlags        = 00000003 (USBD_TRANSFER_DIRECTION_IN, USBD_SHORT_TRANSFER_OK)
  TransferBufferLength = 00000100
  TransferBuffer       = 00000000
  TransferBufferMDL    = 81bbe5c0
  UrbLink              = 00000000
[547402 ms] UsbSnoop - MyInternalIOCTLCompletion(f8917db0) : fido=81b964f0, Irp=81abb730, Context=81c3bfe8, IRQL=2
[547402 ms]  <<<  URB 631 coming back  <<< 
-- URB_FUNCTION_BULK_OR_INTERRUPT_TRANSFER:
  PipeHandle           = 82300ef4 [endpoint 0x00000081]
  TransferFlags        = 00000003 (USBD_TRANSFER_DIRECTION_IN, USBD_SHORT_TRANSFER_OK)
  TransferBufferLength = 00000005
  TransferBuffer       = 00000000
  TransferBufferMDL    = 81bbe5c0
    00000000: 00 00 00 07 04
  UrbLink              = 00000000
[547432 ms] UsbSnoop - DispatchAny(f8916610) : IRP_MJ_INTERNAL_DEVICE_CONTROL
[547432 ms] UsbSnoop - MyDispatchInternalIOCTL(f8917e80) : fdo=822eee08, Irp=81abb730, IRQL=2
[547432 ms]  >>>  URB 632 going down  >>> 
-- URB_FUNCTION_BULK_OR_INTERRUPT_TRANSFER:
  PipeHandle           = 82300ef4 [endpoint 0x00000081]
  TransferFlags        = 00000003 (USBD_TRANSFER_DIRECTION_IN, USBD_SHORT_TRANSFER_OK)
  TransferBufferLength = 00000100
  TransferBuffer       = 00000000
  TransferBufferMDL    = 81bbe5c0
  UrbLink              = 00000000
[547432 ms] UsbSnoop - MyInternalIOCTLCompletion(f8917db0) : fido=81b964f0, Irp=81abb730, Context=81b4d110, IRQL=2
[547432 ms]  <<<  URB 632 coming back  <<< 
-- URB_FUNCTION_BULK_OR_INTERRUPT_TRANSFER:
  PipeHandle           = 82300ef4 [endpoint 0x00000081]
  TransferFlags        = 00000003 (USBD_TRANSFER_DIRECTION_IN, USBD_SHORT_TRANSFER_OK)
  TransferBufferLength = 00000007
  TransferBuffer       = 00000000
  TransferBufferMDL    = 81bbe5c0
    00000000: 00 00 00 01 aa 00 01
  UrbLink              = 00000000
[547462 ms] UsbSnoop - DispatchAny(f8916610) : IRP_MJ_INTERNAL_DEVICE_CONTROL
[547462 ms] UsbSnoop - MyDispatchInternalIOCTL(f8917e80) : fdo=822eee08, Irp=81abb730, IRQL=2
[547462 ms]  >>>  URB 633 going down  >>> 
-- URB_FUNCTION_BULK_OR_INTERRUPT_TRANSFER:
  PipeHandle           = 82300f14 [endpoint 0x00000002]
  TransferFlags        = 00000000 (USBD_TRANSFER_DIRECTION_OUT, ~USBD_SHORT_TRANSFER_OK)
  TransferBufferLength = 00000007
  TransferBuffer       = 00000000
  TransferBufferMDL    = 81bbe5c0
    00000000: 00 00 00 02 05 e0 00
  UrbLink              = 00000000
[547462 ms] UsbSnoop - MyInternalIOCTLCompletion(f8917db0) : fido=81b964f0, Irp=81abb730, Context=81d30f40, IRQL=2
[547462 ms]  <<<  URB 633 coming back  <<< 
-- URB_FUNCTION_BULK_OR_INTERRUPT_TRANSFER:
  PipeHandle           = 82300f14 [endpoint 0x00000002]
  TransferFlags        = 00000000 (USBD_TRANSFER_DIRECTION_OUT, ~USBD_SHORT_TRANSFER_OK)
  TransferBufferLength = 00000007
  TransferBuffer       = 00000000
  TransferBufferMDL    = 81bbe5c0
  UrbLink              = 00000000
[547722 ms] UsbSnoop - DispatchAny(f8916610) : IRP_MJ_INTERNAL_DEVICE_CONTROL
[547722 ms] UsbSnoop - MyDispatchInternalIOCTL(f8917e80) : fdo=822eee08, Irp=81abb730, IRQL=2
[547722 ms]  >>>  URB 634 going down  >>> 
-- URB_FUNCTION_BULK_OR_INTERRUPT_TRANSFER:
  PipeHandle           = 82300f14 [endpoint 0x00000002]
  TransferFlags        = 00000000 (USBD_TRANSFER_DIRECTION_OUT, ~USBD_SHORT_TRANSFER_OK)
  TransferBufferLength = 00000009
  TransferBuffer       = 00000000
  TransferBufferMDL    = 81ac92e0
    00000000: 00 00 00 04 01 00 00 04 00
  UrbLink              = 00000000
[547722 ms] UsbSnoop - MyInternalIOCTLCompletion(f8917db0) : fido=81b964f0, Irp=81abb730, Context=81c3bfe8, IRQL=2
[547722 ms]  <<<  URB 634 coming back  <<< 
-- URB_FUNCTION_BULK_OR_INTERRUPT_TRANSFER:
  PipeHandle           = 82300f14 [endpoint 0x00000002]
  TransferFlags        = 00000000 (USBD_TRANSFER_DIRECTION_OUT, ~USBD_SHORT_TRANSFER_OK)
  TransferBufferLength = 00000009
  TransferBuffer       = 00000000
  TransferBufferMDL    = 81ac92e0
  UrbLink              = 00000000
[547723 ms] UsbSnoop - DispatchAny(f8916610) : IRP_MJ_INTERNAL_DEVICE_CONTROL
[547723 ms] UsbSnoop - MyDispatchInternalIOCTL(f8917e80) : fdo=822eee08, Irp=822f0008, IRQL=2
[547723 ms]  >>>  URB 635 going down  >>> 
-- URB_FUNCTION_BULK_OR_INTERRUPT_TRANSFER:
  PipeHandle           = 82300ef4 [endpoint 0x00000081]
  TransferFlags        = 00000003 (USBD_TRANSFER_DIRECTION_IN, USBD_SHORT_TRANSFER_OK)
  TransferBufferLength = 00000100
  TransferBuffer       = 00000000
  TransferBufferMDL    = 81ac92e0
  UrbLink              = 00000000
[547724 ms] UsbSnoop - MyInternalIOCTLCompletion(f8917db0) : fido=81b964f0, Irp=822f0008, Context=81d30f40, IRQL=2
[547724 ms]  <<<  URB 635 coming back  <<< 
-- URB_FUNCTION_BULK_OR_INTERRUPT_TRANSFER:
  PipeHandle           = 82300ef4 [endpoint 0x00000081]
  TransferFlags        = 00000003 (USBD_TRANSFER_DIRECTION_IN, USBD_SHORT_TRANSFER_OK)
  TransferBufferLength = 00000009
  TransferBuffer       = 00000000
  TransferBufferMDL    = 81ac92e0
    00000000: 00 00 00 04 02 00 00 03 ff
  UrbLink              = 00000000
[547753 ms] UsbSnoop - DispatchAny(f8916610) : IRP_MJ_INTERNAL_DEVICE_CONTROL
[547753 ms] UsbSnoop - MyDispatchInternalIOCTL(f8917e80) : fdo=822eee08, Irp=822f0008, IRQL=2
[547753 ms]  >>>  URB 636 going down  >>> 
-- URB_FUNCTION_BULK_OR_INTERRUPT_TRANSFER:
  PipeHandle           = 82300f14 [endpoint 0x00000002]
  TransferFlags        = 00000000 (USBD_TRANSFER_DIRECTION_OUT, ~USBD_SHORT_TRANSFER_OK)
  TransferBufferLength = 00000015
  TransferBuffer       = 00000000
  TransferBufferMDL    = 81ac92e0
    00000000: 00 00 00 10 04 00 00 00 0a 00 01 00 03 00 01 00
    00000010: 00 00 00 07 d0
  UrbLink              = 00000000
[547754 ms] UsbSnoop - MyInternalIOCTLCompletion(f8917db0) : fido=81b964f0, Irp=822f0008, Context=81b4d110, IRQL=2
[547754 ms]  <<<  URB 636 coming back  <<< 
-- URB_FUNCTION_BULK_OR_INTERRUPT_TRANSFER:
  PipeHandle           = 82300f14 [endpoint 0x00000002]
  TransferFlags        = 00000000 (USBD_TRANSFER_DIRECTION_OUT, ~USBD_SHORT_TRANSFER_OK)
  TransferBufferLength = 00000015
  TransferBuffer       = 00000000
  TransferBufferMDL    = 81ac92e0
  UrbLink              = 00000000
[547762 ms] UsbSnoop - DispatchAny(f8916610) : IRP_MJ_INTERNAL_DEVICE_CONTROL
[547762 ms] UsbSnoop - MyDispatchInternalIOCTL(f8917e80) : fdo=822eee08, Irp=822f0008, IRQL=2
[547762 ms]  >>>  URB 637 going down  >>> 
-- URB_FUNCTION_BULK_OR_INTERRUPT_TRANSFER:
  PipeHandle           = 82300ef4 [endpoint 0x00000081]
  TransferFlags        = 00000003 (USBD_TRANSFER_DIRECTION_IN, USBD_SHORT_TRANSFER_OK)
  TransferBufferLength = 00000100
  TransferBuffer       = 00000000
  TransferBufferMDL    = 81ac92e0
  UrbLink              = 00000000
[547762 ms] UsbSnoop - MyInternalIOCTLCompletion(f8917db0) : fido=81b964f0, Irp=822f0008, Context=81d30f40, IRQL=2
[547762 ms]  <<<  URB 637 coming back  <<< 
-- URB_FUNCTION_BULK_OR_INTERRUPT_TRANSFER:
  PipeHandle           = 82300ef4 [endpoint 0x00000081]
  TransferFlags        = 00000003 (USBD_TRANSFER_DIRECTION_IN, USBD_SHORT_TRANSFER_OK)
  TransferBufferLength = 00000007
  TransferBuffer       = 00000000
  TransferBufferMDL    = 81ac92e0
    00000000: 00 00 00 02 05 e0 00
  UrbLink              = 00000000
[547802 ms] UsbSnoop - DispatchAny(f8916610) : IRP_MJ_INTERNAL_DEVICE_CONTROL
[547802 ms] UsbSnoop - MyDispatchInternalIOCTL(f8917e80) : fdo=822eee08, Irp=822f0008, IRQL=2
[547802 ms]  >>>  URB 638 going down  >>> 
-- URB_FUNCTION_BULK_OR_INTERRUPT_TRANSFER:
  PipeHandle           = 82300ef4 [endpoint 0x00000081]
  TransferFlags        = 00000003 (USBD_TRANSFER_DIRECTION_IN, USBD_SHORT_TRANSFER_OK)
  TransferBufferLength = 00000100
  TransferBuffer       = 00000000
  TransferBufferMDL    = 81ac92e0
  UrbLink              = 00000000
[547803 ms] UsbSnoop - MyInternalIOCTLCompletion(f8917db0) : fido=81b964f0, Irp=822f0008, Context=81ba8040, IRQL=2
[547803 ms]  <<<  URB 638 coming back  <<< 
-- URB_FUNCTION_BULK_OR_INTERRUPT_TRANSFER:
  PipeHandle           = 82300ef4 [endpoint 0x00000081]
  TransferFlags        = 00000003 (USBD_TRANSFER_DIRECTION_IN, USBD_SHORT_TRANSFER_OK)
  TransferBufferLength = 00000005
  TransferBuffer       = 00000000
  TransferBufferMDL    = 81ac92e0
    00000000: 00 00 00 0a 04
  UrbLink              = 00000000
[547832 ms] UsbSnoop - DispatchAny(f8916610) : IRP_MJ_INTERNAL_DEVICE_CONTROL
[547832 ms] UsbSnoop - MyDispatchInternalIOCTL(f8917e80) : fdo=822eee08, Irp=822f0008, IRQL=2
[547832 ms]  >>>  URB 639 going down  >>> 
-- URB_FUNCTION_BULK_OR_INTERRUPT_TRANSFER:
  PipeHandle           = 82300ef4 [endpoint 0x00000081]
  TransferFlags        = 00000003 (USBD_TRANSFER_DIRECTION_IN, USBD_SHORT_TRANSFER_OK)
  TransferBufferLength = 00000100
  TransferBuffer       = 00000000
  TransferBufferMDL    = 81ac92e0
  UrbLink              = 00000000
[547833 ms] UsbSnoop - MyInternalIOCTLCompletion(f8917db0) : fido=81b964f0, Irp=822f0008, Context=81b4d110, IRQL=2
[547833 ms]  <<<  URB 639 coming back  <<< 
-- URB_FUNCTION_BULK_OR_INTERRUPT_TRANSFER:
  PipeHandle           = 82300ef4 [endpoint 0x00000081]
  TransferFlags        = 00000003 (USBD_TRANSFER_DIRECTION_IN, USBD_SHORT_TRANSFER_OK)
  TransferBufferLength = 0000000a
  TransferBuffer       = 00000000
  TransferBufferMDL    = 81ac92e0
    00000000: 00 00 00 04 00 12 00 00 07 d0
  UrbLink              = 00000000
[547862 ms] UsbSnoop - DispatchAny(f8916610) : IRP_MJ_INTERNAL_DEVICE_CONTROL
[547862 ms] UsbSnoop - MyDispatchInternalIOCTL(f8917e80) : fdo=822eee08, Irp=822f0008, IRQL=2
[547862 ms]  >>>  URB 640 going down  >>> 
-- URB_FUNCTION_BULK_OR_INTERRUPT_TRANSFER:
  PipeHandle           = 82300f14 [endpoint 0x00000002]
  TransferFlags        = 00000000 (USBD_TRANSFER_DIRECTION_OUT, ~USBD_SHORT_TRANSFER_OK)
  TransferBufferLength = 00000007
  TransferBuffer       = 00000000
  TransferBufferMDL    = 81ac92e0
    00000000: 00 00 00 02 05 e0 00
  UrbLink              = 00000000
[547863 ms] UsbSnoop - MyInternalIOCTLCompletion(f8917db0) : fido=81b964f0, Irp=822f0008, Context=81ba8040, IRQL=2
[547863 ms]  <<<  URB 640 coming back  <<< 
-- URB_FUNCTION_BULK_OR_INTERRUPT_TRANSFER:
  PipeHandle           = 82300f14 [endpoint 0x00000002]
  TransferFlags        = 00000000 (USBD_TRANSFER_DIRECTION_OUT, ~USBD_SHORT_TRANSFER_OK)
  TransferBufferLength = 00000007
  TransferBuffer       = 00000000
  TransferBufferMDL    = 81ac92e0
  UrbLink              = 00000000
[547872 ms] UsbSnoop - DispatchAny(f8916610) : IRP_MJ_INTERNAL_DEVICE_CONTROL
[547872 ms] UsbSnoop - MyDispatchInternalIOCTL(f8917e80) : fdo=822eee08, Irp=822f0008, IRQL=2
[547872 ms]  >>>  URB 641 going down  >>> 
-- URB_FUNCTION_BULK_OR_INTERRUPT_TRANSFER:
  PipeHandle           = 82300f14 [endpoint 0x00000002]
  TransferFlags        = 00000000 (USBD_TRANSFER_DIRECTION_OUT, ~USBD_SHORT_TRANSFER_OK)
  TransferBufferLength = 00000035
  TransferBuffer       = 00000000
  TransferBufferMDL    = 81ac92e0
    00000000: 00 00 00 30 04 00 00 00 2a 00 0b 00 06 55 53 50
    00000010: 52 45 53 00 00 00 82 19 01 00 04 00 02 00 04 f0
    00000020: 0c 00 24 00 03 00 01 00 00 08 00 04 00 00 00 01
    00000030: 00 41 00 01 00
  UrbLink              = 00000000
[547873 ms] UsbSnoop - MyInternalIOCTLCompletion(f8917db0) : fido=81b964f0, Irp=822f0008, Context=81d30f40, IRQL=2
[547873 ms]  <<<  URB 641 coming back  <<< 
-- URB_FUNCTION_BULK_OR_INTERRUPT_TRANSFER:
  PipeHandle           = 82300f14 [endpoint 0x00000002]
  TransferFlags        = 00000000 (USBD_TRANSFER_DIRECTION_OUT, ~USBD_SHORT_TRANSFER_OK)
  TransferBufferLength = 00000035
  TransferBuffer       = 00000000
  TransferBufferMDL    = 81ac92e0
  UrbLink              = 00000000
[547882 ms] UsbSnoop - DispatchAny(f8916610) : IRP_MJ_INTERNAL_DEVICE_CONTROL
[547882 ms] UsbSnoop - MyDispatchInternalIOCTL(f8917e80) : fdo=822eee08, Irp=822f0008, IRQL=2
[547882 ms]  >>>  URB 642 going down  >>> 
-- URB_FUNCTION_BULK_OR_INTERRUPT_TRANSFER:
  PipeHandle           = 82300ef4 [endpoint 0x00000081]
  TransferFlags        = 00000003 (USBD_TRANSFER_DIRECTION_IN, USBD_SHORT_TRANSFER_OK)
  TransferBufferLength = 00000100
  TransferBuffer       = 00000000
  TransferBufferMDL    = 81ac92e0
  UrbLink              = 00000000
[547883 ms] UsbSnoop - MyInternalIOCTLCompletion(f8917db0) : fido=81b964f0, Irp=822f0008, Context=822f3898, IRQL=2
[547883 ms]  <<<  URB 642 coming back  <<< 
-- URB_FUNCTION_BULK_OR_INTERRUPT_TRANSFER:
  PipeHandle           = 82300ef4 [endpoint 0x00000081]
  TransferFlags        = 00000003 (USBD_TRANSFER_DIRECTION_IN, USBD_SHORT_TRANSFER_OK)
  TransferBufferLength = 00000007
  TransferBuffer       = 00000000
  TransferBufferMDL    = 81ac92e0
    00000000: 00 00 00 02 05 e0 00
  UrbLink              = 00000000
[547922 ms] UsbSnoop - DispatchAny(f8916610) : IRP_MJ_INTERNAL_DEVICE_CONTROL
[547922 ms] UsbSnoop - MyDispatchInternalIOCTL(f8917e80) : fdo=822eee08, Irp=822f0008, IRQL=2
[547922 ms]  >>>  URB 643 going down  >>> 
-- URB_FUNCTION_BULK_OR_INTERRUPT_TRANSFER:
  PipeHandle           = 82300ef4 [endpoint 0x00000081]
  TransferFlags        = 00000003 (USBD_TRANSFER_DIRECTION_IN, USBD_SHORT_TRANSFER_OK)
  TransferBufferLength = 00000100
  TransferBuffer       = 00000000
  TransferBufferMDL    = 81ac92e0
  UrbLink              = 00000000
[547923 ms] UsbSnoop - MyInternalIOCTLCompletion(f8917db0) : fido=81b964f0, Irp=822f0008, Context=81d30f40, IRQL=2
[547923 ms]  <<<  URB 643 coming back  <<< 
-- URB_FUNCTION_BULK_OR_INTERRUPT_TRANSFER:
  PipeHandle           = 82300ef4 [endpoint 0x00000081]
  TransferFlags        = 00000003 (USBD_TRANSFER_DIRECTION_IN, USBD_SHORT_TRANSFER_OK)
  TransferBufferLength = 00000005
  TransferBuffer       = 00000000
  TransferBufferMDL    = 81ac92e0
    00000000: 00 00 00 0a 04
  UrbLink              = 00000000
[547954 ms] UsbSnoop - DispatchAny(f8916610) : IRP_MJ_INTERNAL_DEVICE_CONTROL
[547954 ms] UsbSnoop - MyDispatchInternalIOCTL(f8917e80) : fdo=822eee08, Irp=822f0008, IRQL=2
[547954 ms]  >>>  URB 644 going down  >>> 
-- URB_FUNCTION_BULK_OR_INTERRUPT_TRANSFER:
  PipeHandle           = 82300ef4 [endpoint 0x00000081]
  TransferFlags        = 00000003 (USBD_TRANSFER_DIRECTION_IN, USBD_SHORT_TRANSFER_OK)
  TransferBufferLength = 00000100
  TransferBuffer       = 00000000
  TransferBufferMDL    = 81ac92e0
  UrbLink              = 00000000
[547954 ms] UsbSnoop - MyInternalIOCTLCompletion(f8917db0) : fido=81b964f0, Irp=822f0008, Context=81c429b8, IRQL=2
[547954 ms]  <<<  URB 644 coming back  <<< 
-- URB_FUNCTION_BULK_OR_INTERRUPT_TRANSFER:
  PipeHandle           = 82300ef4 [endpoint 0x00000081]
  TransferFlags        = 00000003 (USBD_TRANSFER_DIRECTION_IN, USBD_SHORT_TRANSFER_OK)
  TransferBufferLength = 0000000a
  TransferBuffer       = 00000000
  TransferBufferMDL    = 81ac92e0
    00000000: 00 00 00 04 bb 00 00 05 7e 40
  UrbLink              = 00000000
[547983 ms] UsbSnoop - DispatchAny(f8916610) : IRP_MJ_INTERNAL_DEVICE_CONTROL
[547983 ms] UsbSnoop - MyDispatchInternalIOCTL(f8917e80) : fdo=822eee08, Irp=822f0008, IRQL=2
[547983 ms]  >>>  URB 645 going down  >>> 
-- URB_FUNCTION_BULK_OR_INTERRUPT_TRANSFER:
  PipeHandle           = 82300f14 [endpoint 0x00000002]
  TransferFlags        = 00000000 (USBD_TRANSFER_DIRECTION_OUT, ~USBD_SHORT_TRANSFER_OK)
  TransferBufferLength = 00000007
  TransferBuffer       = 00000000
  TransferBufferMDL    = 81ac92e0
    00000000: 00 00 00 02 05 e0 00
  UrbLink              = 00000000
[547983 ms] UsbSnoop - MyInternalIOCTLCompletion(f8917db0) : fido=81b964f0, Irp=822f0008, Context=81ba8040, IRQL=2
[547983 ms]  <<<  URB 645 coming back  <<< 
-- URB_FUNCTION_BULK_OR_INTERRUPT_TRANSFER:
  PipeHandle           = 82300f14 [endpoint 0x00000002]
  TransferFlags        = 00000000 (USBD_TRANSFER_DIRECTION_OUT, ~USBD_SHORT_TRANSFER_OK)
  TransferBufferLength = 00000007
  TransferBuffer       = 00000000
  TransferBufferMDL    = 81ac92e0
  UrbLink              = 00000000
[547993 ms] UsbSnoop - DispatchAny(f8916610) : IRP_MJ_INTERNAL_DEVICE_CONTROL
[547993 ms] UsbSnoop - MyDispatchInternalIOCTL(f8917e80) : fdo=822eee08, Irp=822f0008, IRQL=2
[547993 ms]  >>>  URB 646 going down  >>> 
-- URB_FUNCTION_BULK_OR_INTERRUPT_TRANSFER:
  PipeHandle           = 82300ef4 [endpoint 0x00000081]
  TransferFlags        = 00000003 (USBD_TRANSFER_DIRECTION_IN, USBD_SHORT_TRANSFER_OK)
  TransferBufferLength = 00000100
  TransferBuffer       = 00000000
  TransferBufferMDL    = 81ac92e0
  UrbLink              = 00000000
[548504 ms] UsbSnoop - MyInternalIOCTLCompletion(f8917db0) : fido=81b964f0, Irp=822f0008, Context=81b4d110, IRQL=2
[548504 ms]  <<<  URB 646 coming back  <<< 
-- URB_FUNCTION_BULK_OR_INTERRUPT_TRANSFER:
  PipeHandle           = 82300ef4 [endpoint 0x00000081]
  TransferFlags        = 00000003 (USBD_TRANSFER_DIRECTION_IN, USBD_SHORT_TRANSFER_OK)
  TransferBufferLength = 00000005
  TransferBuffer       = 00000000
  TransferBufferMDL    = 81ac92e0
    00000000: 00 00 00 07 04
  UrbLink              = 00000000
[548533 ms] UsbSnoop - DispatchAny(f8916610) : IRP_MJ_INTERNAL_DEVICE_CONTROL
[548533 ms] UsbSnoop - MyDispatchInternalIOCTL(f8917e80) : fdo=822eee08, Irp=81b20e48, IRQL=2
[548533 ms]  >>>  URB 647 going down  >>> 
-- URB_FUNCTION_BULK_OR_INTERRUPT_TRANSFER:
  PipeHandle           = 82300ef4 [endpoint 0x00000081]
  TransferFlags        = 00000003 (USBD_TRANSFER_DIRECTION_IN, USBD_SHORT_TRANSFER_OK)
  TransferBufferLength = 00000100
  TransferBuffer       = 00000000
  TransferBufferMDL    = 81ac92e0
  UrbLink              = 00000000
[548534 ms] UsbSnoop - MyInternalIOCTLCompletion(f8917db0) : fido=81b964f0, Irp=81b20e48, Context=81c429b8, IRQL=2
[548534 ms]  <<<  URB 647 coming back  <<< 
-- URB_FUNCTION_BULK_OR_INTERRUPT_TRANSFER:
  PipeHandle           = 82300ef4 [endpoint 0x00000081]
  TransferFlags        = 00000003 (USBD_TRANSFER_DIRECTION_IN, USBD_SHORT_TRANSFER_OK)
  TransferBufferLength = 00000007
  TransferBuffer       = 00000000
  TransferBufferMDL    = 81ac92e0
    00000000: 00 00 00 01 aa 00 01
  UrbLink              = 00000000
[548563 ms] UsbSnoop - DispatchAny(f8916610) : IRP_MJ_INTERNAL_DEVICE_CONTROL
[548563 ms] UsbSnoop - MyDispatchInternalIOCTL(f8917e80) : fdo=822eee08, Irp=81b20e48, IRQL=2
[548563 ms]  >>>  URB 648 going down  >>> 
-- URB_FUNCTION_BULK_OR_INTERRUPT_TRANSFER:
  PipeHandle           = 82300f14 [endpoint 0x00000002]
  TransferFlags        = 00000000 (USBD_TRANSFER_DIRECTION_OUT, ~USBD_SHORT_TRANSFER_OK)
  TransferBufferLength = 00000007
  TransferBuffer       = 00000000
  TransferBufferMDL    = 81ac92e0
    00000000: 00 00 00 02 05 e0 00
  UrbLink              = 00000000
[548564 ms] UsbSnoop - MyInternalIOCTLCompletion(f8917db0) : fido=81b964f0, Irp=81b20e48, Context=81b4d110, IRQL=2
[548564 ms]  <<<  URB 648 coming back  <<< 
-- URB_FUNCTION_BULK_OR_INTERRUPT_TRANSFER:
  PipeHandle           = 82300f14 [endpoint 0x00000002]
  TransferFlags        = 00000000 (USBD_TRANSFER_DIRECTION_OUT, ~USBD_SHORT_TRANSFER_OK)
  TransferBufferLength = 00000007
  TransferBuffer       = 00000000
  TransferBufferMDL    = 81ac92e0
  UrbLink              = 00000000
[548586 ms] UsbSnoop - DispatchAny(f8916610) : IRP_MJ_INTERNAL_DEVICE_CONTROL
[548586 ms] UsbSnoop - MyDispatchInternalIOCTL(f8917e80) : fdo=822eee08, Irp=81b20e48, IRQL=2
[548586 ms]  >>>  URB 649 going down  >>> 
-- URB_FUNCTION_BULK_OR_INTERRUPT_TRANSFER:
  PipeHandle           = 82300f14 [endpoint 0x00000002]
  TransferFlags        = 00000000 (USBD_TRANSFER_DIRECTION_OUT, ~USBD_SHORT_TRANSFER_OK)
  TransferBufferLength = 00000404
  TransferBuffer       = 00000000
  TransferBufferMDL    = 81ac92e0
    00000000: 00 00 03 ff 03 00 00 82 19 00 0d 81 0f 00 00 81
    00000010: d0 81 12 01 03 81 21 00 81 31 00 81 46 55 53 50
    00000020: 52 45 53 03 26 09 04 07 b0 00 4d 02 0d 40 12 1f
    00000030: ed 81 7a 46 b4 03 b0 d7 28 1f d9 0c fa 1a 90 7d
    00000040: b4 e5 64 21 e1 a1 a0 5f 1a 43 33 75 a0 12 76 42
    00000050: 6f 6d 70 7a 3b fe 6a 43 ee cf c9 de 33 50 76 21
    00000060: 94 08 19 fb b2 ef 69 f2 1c 09 9e 76 20 71 00 01
    00000070: ff 81 7f 00 00 81 6a 16 7b 53 3d 55 53 50 52 45
    00000080: 53 00 00 00 00 00 00 00 00 00 00 00 00 00 00 00
    00000090: 00 00 00 00 00 00 00 00 00 00 00 00 00 00 00 00
    000000a0: 08 00 00 01 ba 00 00 81 62 00 00 00 08 00 00 00
    000000b0: 00 00 00 1e 00 00 3a 00 00 26 00 00 48 00 00 2e
    000000c0: 00 7a e8 00 00 36 00 7e 4c 00 77 30 80 00 04 00
    000000d0: 77 6a 80 00 04 00 78 60 00 78 36 00 7a f4 80 00
    000000e0: 06 00 7b 1a 80 00 00 00 7b 30 80 00 06 00 7b 50
    000000f0: 80 00 04 00 7b 64 00 78 d8 00 7b 6e 00 00 4f 00
    00000100: 7b 7c 00 02 5c 00 7b 8a 00 04 69 00 7b 98 00 06
    00000110: 76 00 7b a6 00 08 cd 00 7b b4 00 0b 6e 00 7b c2
    00000120: 00 0d c5 00 7b d0 00 10 66 00 7b de 00 12 81 00
    00000130: 7b ec 00 14 d8 00 7b fa 00 17 2f 00 7c 08 00 19
    00000140: 86 00 7c 16 00 1b dd 00 7c 24 00 1d ea 00 7c 32
    00000150: 00 20 41 00 7c 40 00 22 98 00 7c 4e 00 24 ef 00
    00000160: 7c 5c 00 27 46 00 7c 6a 00 29 53 00 7c 78 00 2b
    00000170: 60 00 7c 86 00 2d b7 00 7c 94 00 30 0e 00 7c a2
    00000180: 00 32 65 00 7c b0 00 34 72 00 7c be 00 36 7f 00
    00000190: 7c cc 00 38 8c 00 7c da 00 3a 99 00 7c e8 00 3c
    000001a0: f0 00 7c f6 00 3f 47 00 7d 04 00 41 9e 00 7d 12
    000001b0: 00 48 e4 00 7d 20 00 56 67 00 7d 2e 00 59 29 00
    000001c0: 7d 3c 00 5b 80 00 7d 4a 00 5d 8d 00 7d 58 00 5f
    000001d0: e4 00 7d 66 00 62 3b 00 7d 74 00 64 92 00 7d 82
    000001e0: 00 66 9f 00 7d 90 00 68 f6 00 7d 9e 00 6b 03 00
    000001f0: 7d ac 00 6d 5a 00 7d ba 00 6f b1 00 7d c8 00 72
    00000200: 08 00 7d d6 00 74 5f 00 7d e8 00 7a d0 00 7d f2
    00000210: 00 7a dc 00 7d fc 00 7a e2 00 7e c2 00 7e 54 00
    00000220: 7e e4 00 7f 36 00 7e f0 00 7f 68 00 7f a8 00 00
    00000230: 00 ff 00 00 00 00 00 00 00 00 03 00 00 00 01 00
    00000240: 00 00 05 00 00 00 01 00 00 00 01 00 00 00 02 ff
    00000250: ff ff ff 00 00 00 03 ff ff ff ff 00 00 00 04 ff
    00000260: ff ff ff 00 00 00 12 ff ff ff ff 55 53 20 50 72
    00000270: 65 73 69 64 65 6e 74 73 00 55 53 50 52 45 53 00
    00000280: 02 0b 00 4a 00 38 ff ff ff ff ff ff ff ff ff ff
    00000290: ff ff ff ff ff ff ff 8f ff ff ff ff ff e3 00 ff
    000002a0: ff ff ff ff 81 00 0f ff ff ff ff 81 80 01 ff ff
    000002b0: ff ef cd 00 00 1f ff ff ff df 00 00 0f ff ff ff
    000002c0: f6 00 00 07 ff ff 7f e2 30 30 03 ff ff ff e1 00
    000002d0: 00 01 ff ff ff f3 20 06 00 ff ff ff f3 a0 3f 98
    000002e0: ff ff ff fc 00 3f e0 7f ff fc 78 00 0f e0 7f ff
    000002f0: b8 3f f0 0f f0 7f ff 70 00 30 07 e0 7f fe 70 00
    00000300: 00 07 e0 7f ff 30 00 00 07 30 3f fe 68 00 00 07
    00000310: 10 3f fc 60 00 00 1f 00 1f fd e0 00 00 1e 00 00
    00000320: ff e0 00 00 3e 00 02 fe e0 10 00 07 00 01 ff e0
    00000330: 00 00 13 00 01 ff 84 00 00 11 00 07 ff fd f0 00
    00000340: 01 80 07 ff fd 7f 00 80 80 0f ff fc ff c0 c0 c0
    00000350: 07 ff fe 7f c0 00 c0 03 ff fe 3e c0 00 44 07 ff
    00000360: fe 1f 20 00 63 0f ff 9e 1f b0 00 09 8f ff 84 0d
    00000370: 00 00 04 3f ff 0c 04 80 00 06 3f ff 08 00 00 00
    00000380: 64 3f ff 18 00 00 00 60 3f ff 00 00 00 10 65 3f
    00000390: ff 80 00 00 00 e3 7f ff 80 18 00 04 e5 ff ff c0
    000003a0: 0c 00 07 05 ff ff f0 0c 00 03 05 ff ff fe ce 00
    000003b0: 0c 11 ff ff f3 87 00 0c 33 ff ff f1 81 00 00 3f
    000003c0: ff ff e1 c8 80 00 1f ff ff cf fc 80 00 1f ff ff
    000003d0: c8 0c 00 00 1f ff ff c0 06 00 00 1f ff ff e7 03
    000003e0: 00 00 7f ff fe c3 80 00 00 ff ff ff a0 00 00 03
    000003f0: ff ff ff 20 02 00 07 ff ff ff 10 02 00 3f ff ff
    00000400: fe 18 06 00
  UrbLink              = 00000000
[548597 ms] UsbSnoop - MyInternalIOCTLCompletion(f8917db0) : fido=81b964f0, Irp=81b20e48, Context=81c3bfe8, IRQL=2
[548597 ms]  <<<  URB 649 coming back  <<< 
-- URB_FUNCTION_BULK_OR_INTERRUPT_TRANSFER:
  PipeHandle           = 82300f14 [endpoint 0x00000002]
  TransferFlags        = 00000000 (USBD_TRANSFER_DIRECTION_OUT, ~USBD_SHORT_TRANSFER_OK)
  TransferBufferLength = 00000404
  TransferBuffer       = 00000000
  TransferBufferMDL    = 81ac92e0
  UrbLink              = 00000000
[548604 ms] UsbSnoop - DispatchAny(f8916610) : IRP_MJ_INTERNAL_DEVICE_CONTROL
[548604 ms] UsbSnoop - MyDispatchInternalIOCTL(f8917e80) : fdo=822eee08, Irp=81b20e48, IRQL=2
[548604 ms]  >>>  URB 650 going down  >>> 
-- URB_FUNCTION_BULK_OR_INTERRUPT_TRANSFER:
  PipeHandle           = 82300ef4 [endpoint 0x00000081]
  TransferFlags        = 00000003 (USBD_TRANSFER_DIRECTION_IN, USBD_SHORT_TRANSFER_OK)
  TransferBufferLength = 00000100
  TransferBuffer       = 00000000
  TransferBufferMDL    = 81ac92e0
  UrbLink              = 00000000
[548604 ms] UsbSnoop - MyInternalIOCTLCompletion(f8917db0) : fido=81b964f0, Irp=81b20e48, Context=81c429b8, IRQL=2
[548604 ms]  <<<  URB 650 coming back  <<< 
-- URB_FUNCTION_BULK_OR_INTERRUPT_TRANSFER:
  PipeHandle           = 82300ef4 [endpoint 0x00000081]
  TransferFlags        = 00000003 (USBD_TRANSFER_DIRECTION_IN, USBD_SHORT_TRANSFER_OK)
  TransferBufferLength = 00000007
  TransferBuffer       = 00000000
  TransferBufferMDL    = 81ac92e0
    00000000: 00 00 00 02 05 e0 00
  UrbLink              = 00000000
[548644 ms] UsbSnoop - DispatchAny(f8916610) : IRP_MJ_INTERNAL_DEVICE_CONTROL
[548644 ms] UsbSnoop - MyDispatchInternalIOCTL(f8917e80) : fdo=822eee08, Irp=81c21570, IRQL=2
[548644 ms]  >>>  URB 651 going down  >>> 
-- URB_FUNCTION_BULK_OR_INTERRUPT_TRANSFER:
  PipeHandle           = 82300f14 [endpoint 0x00000002]
  TransferFlags        = 00000000 (USBD_TRANSFER_DIRECTION_OUT, ~USBD_SHORT_TRANSFER_OK)
  TransferBufferLength = 00000404
  TransferBuffer       = 00000000
  TransferBufferMDL    = 81ac92e0
    00000000: 00 00 03 ff 03 7f ff ff fe f7 86 c1 ff ff ff ff
    00000010: 77 c7 c3 ff ff ff ff 9f ff cf ff ff ff ff ff ff
    00000020: ff ff ff ff ff ff ff ff ff ff ff ff ff ff ff ff
    00000030: ff ff ff ff ff ff ff ff ff ff ff ff ff ff ff ff
    00000040: 8f ff ff ff ff ff ff 00 7f ff ff ff ff ff 00 1f
    00000050: ff ff ff ff ff 80 07 ff ff ff ff ff c0 07 ff ff
    00000060: ff ff ff c0 07 ff ff ff ff ff c0 07 ff ff ff ff
    00000070: ff c0 03 ff ff ff ff ff f8 07 ff ff ff ff ff f8
    00000080: 0f ff ff ff ff ff fc 1f ff ff ff ff ff df 02 0b
    00000090: 00 4a 00 37 00 00 00 00 00 00 00 00 00 00 1c 00
    000000a0: 00 00 00 00 03 ff fc 00 00 00 00 1f fb fe 00 00
    000000b0: 00 00 38 ff ff c0 00 00 00 10 a6 bf c0 00 00 06
    000000c0: f4 01 b3 f0 00 00 07 f0 03 b7 f0 00 00 0b 80 03
    000000d0: bc f8 00 00 05 80 00 2f bc 00 00 44 00 00 03 bc
    000000e0: 00 00 84 00 00 00 1e 00 00 86 00 00 00 0e 00 01
    000000f0: bf 80 00 00 07 00 01 3f 00 00 00 03 80 01 7c 00
    00000100: 00 00 03 80 03 5d 00 00 00 03 00 03 f9 80 00 00
    00000110: 03 00 03 fb 80 00 00 01 00 07 ff 80 00 06 03 00
    00000120: 07 ff 80 00 00 01 00 07 fb a0 80 00 01 00 07 38
    00000130: 78 00 00 01 00 07 66 7a 00 00 00 00 06 ee f8 07
    00000140: 80 03 20 00 d8 e0 1f fc 5f 00 03 cc e0 7e fd ff
    00000150: c0 07 ff a1 ff f9 f9 a0 0f ff 91 ff f8 ff e0 08
    00000160: ff c1 f3 dc ff e0 0e ff e0 00 00 14 c0 1e ff f0
    00000170: 00 02 05 80 1f ff f8 00 00 01 80 1f ff fc 00 00
    00000180: 00 00 1f ff ff 00 00 01 00 1f ff ff c0 60 03 00
    00000190: 1f ff ff c0 70 13 00 0f df fd f0 bf b2 00 0f c3
    000001a0: fc f1 9f f2 00 07 ff ff f9 03 ca 00 07 ff ff b8
    000001b0: 03 ca 00 07 ff ff ba 00 2e 00 03 ff ff b2 00 06
    000001c0: 00 03 ff ff 00 ff f6 00 0d ff ff 61 80 36 00 01
    000001d0: ff fe 60 02 04 00 01 ff ff e0 0f cc 00 00 ff ff
    000001e0: fc 7f f8 00 00 10 ff 7e f0 38 00 00 18 0f fa 00
    000001f0: 10 00 00 38 03 fc 00 30 00 00 3c 00 7e 00 00 00
    00000200: 00 7f 00 3f 8e 40 00 00 7f c0 1f ff c0 00 00 ff
    00000210: f0 1f ff 80 00 00 ff fc 1f ff 80 00 00 ff ff 1f
    00000220: ff 80 00 03 ff ff ff ff c0 00 07 ff ff ff ff c0
    00000230: 00 0f ff ff ff ff e0 00 1f ff ff ff ff f0 00 ff
    00000240: ff ff ef ff f8 00 ff ff ff ef ff be 00 ff ff ff
    00000250: df ff df c0 ff ff ff ff ff c7 f0 ff ff ff ff fe
    00000260: 0f fe ff ff ff bf fc 3f fe ff ff fe 9f ff ff fe
    00000270: ff ff ff 1f 80 ff fe ff ff ff 86 00 7f fe ff ff
    00000280: ff 80 00 7f fe ff ff ff c8 00 3f fe ff ff ff ec
    00000290: 00 3f fe ff ff ff f6 00 1f fe df 02 0b 00 4a 00
    000002a0: 32 00 00 00 00 00 00 00 00 00 00 00 00 00 00 00
    000002b0: 00 1e 00 00 00 00 00 01 ff ff 00 00 00 00 03 fd
    000002c0: ff 80 00 00 00 07 ff ff e0 00 00 00 0f ff ff f0
    000002d0: 00 00 00 0f ff ff f8 00 00 00 1f ff ff f8 00 00
    000002e0: 00 1f ff ff fc 00 00 00 3f ff ff fc 00 00 00 7f
    000002f0: ff ff fe 00 00 00 7f ff f3 ff 00 00 00 ff ff 81
    00000300: ff 80 00 00 fe 3c 00 7f c0 00 00 7c 00 00 7f 60
    00000310: 00 01 f8 00 00 7f e0 00 01 f0 00 00 1f e0 00 01
    00000320: f0 00 00 3f e0 00 03 e0 00 00 3f e0 00 03 e0 00
    00000330: 00 1f f0 00 03 f8 00 00 3f f0 00 03 e0 00 00 3f
    00000340: f0 00 07 e0 00 00 3f f0 00 0f e0 00 20 3f f0 00
    00000350: 07 e0 01 e0 7f f0 00 07 ff 07 f0 7f fc 00 07 ff
    00000360: df fc ff f4 00 07 ff cf fc 7f f0 00 01 ff c7 fe
    00000370: 3f f8 00 03 ff c3 f6 7f 8c 00 00 ff 81 c0 1f 8c
    00000380: 00 00 fd 81 00 1f cc 00 00 7d 00 00 39 88 00 00
    00000390: 49 00 00 38 80 00 00 40 00 00 78 80 00 00 61 02
    000003a0: 00 f8 00 00 00 61 83 07 f8 00 00 00 33 fd 8f f0
    000003b0: 20 00 00 3f fc da f8 60 00 00 3f e0 6e ed c0 00
    000003c0: 00 1f e0 3c 6f 80 00 00 1f f8 cc 7f 00 00 00 1f
    000003d0: ff c8 7e 00 00 00 1f 00 1e 3c 00 00 00 1f fe 0e
    000003e0: 7c 00 00 00 0f f0 28 7c 00 00 00 0f 07 fe 78 00
    000003f0: 00 00 1f ff ff f0 00 00 00 1f ff ff e0 00 00 00
    00000400: 1f ff ff c0
  UrbLink              = 00000000
[548658 ms] UsbSnoop - MyInternalIOCTLCompletion(f8917db0) : fido=81b964f0, Irp=81c21570, Context=822f3898, IRQL=2
[548658 ms]  <<<  URB 651 coming back  <<< 
-- URB_FUNCTION_BULK_OR_INTERRUPT_TRANSFER:
  PipeHandle           = 82300f14 [endpoint 0x00000002]
  TransferFlags        = 00000000 (USBD_TRANSFER_DIRECTION_OUT, ~USBD_SHORT_TRANSFER_OK)
  TransferBufferLength = 00000404
  TransferBuffer       = 00000000
  TransferBufferMDL    = 81ac92e0
  UrbLink              = 00000000
[548664 ms] UsbSnoop - DispatchAny(f8916610) : IRP_MJ_INTERNAL_DEVICE_CONTROL
[548664 ms] UsbSnoop - MyDispatchInternalIOCTL(f8917e80) : fdo=822eee08, Irp=81c21570, IRQL=2
[548664 ms]  >>>  URB 652 going down  >>> 
-- URB_FUNCTION_BULK_OR_INTERRUPT_TRANSFER:
  PipeHandle           = 82300ef4 [endpoint 0x00000081]
  TransferFlags        = 00000003 (USBD_TRANSFER_DIRECTION_IN, USBD_SHORT_TRANSFER_OK)
  TransferBufferLength = 00000100
  TransferBuffer       = 00000000
  TransferBufferMDL    = 81ac92e0
  UrbLink              = 00000000
[548664 ms] UsbSnoop - MyInternalIOCTLCompletion(f8917db0) : fido=81b964f0, Irp=81c21570, Context=81c3bfe8, IRQL=2
[548664 ms]  <<<  URB 652 coming back  <<< 
-- URB_FUNCTION_BULK_OR_INTERRUPT_TRANSFER:
  PipeHandle           = 82300ef4 [endpoint 0x00000081]
  TransferFlags        = 00000003 (USBD_TRANSFER_DIRECTION_IN, USBD_SHORT_TRANSFER_OK)
  TransferBufferLength = 00000007
  TransferBuffer       = 00000000
  TransferBufferMDL    = 81ac92e0
    00000000: 00 00 00 02 05 e0 00
  UrbLink              = 00000000
[548704 ms] UsbSnoop - DispatchAny(f8916610) : IRP_MJ_INTERNAL_DEVICE_CONTROL
[548704 ms] UsbSnoop - MyDispatchInternalIOCTL(f8917e80) : fdo=822eee08, Irp=81c21570, IRQL=2
[548705 ms]  >>>  URB 653 going down  >>> 
-- URB_FUNCTION_BULK_OR_INTERRUPT_TRANSFER:
  PipeHandle           = 82300f14 [endpoint 0x00000002]
  TransferFlags        = 00000000 (USBD_TRANSFER_DIRECTION_OUT, ~USBD_SHORT_TRANSFER_OK)
  TransferBufferLength = 00000404
  TransferBuffer       = 00000000
  TransferBufferMDL    = 81ac92e0
    00000000: 00 00 03 ff 03 00 00 00 0f ff ff 04 00 00 00 0f
    00000010: ff fe 06 00 00 00 07 ff f8 0e 00 00 00 07 ff f0
    00000020: 1f 00 00 00 03 ff c0 3f 00 00 00 01 ff 80 ff 80
    00000030: 00 00 07 fe 01 ff 80 00 00 0f f8 06 ff c0 00 00
    00000040: 1f ff 1d ff 60 00 00 3f ff ff ff f0 00 00 7f ff
    00000050: fb fe f8 00 00 ff ff e7 ff ff 00 03 bf fe ef fd
    00000060: ff c0 07 3f ff cf fb ff c0 0f 3f ff 0f fb ff c0
    00000070: 1f 83 fe 1f f7 ff c0 ff de 7c 3f e7 ff c0 fe fc
    00000080: 00 7f ef ff c0 ff f0 00 7f ff ff c0 fd e0 00 ff
    00000090: df ff c0 fb e0 00 ff ff ff c0 fb c0 01 ff ff ff
    000000a0: c0 f7 c0 03 ff ff ff c0 df 02 55 00 4a 00 3c 00
    000000b0: 00 00 00 00 00 00 00 00 00 00 00 00 00 00 00 00
    000000c0: 00 00 00 00 00 00 00 00 00 00 00 00 00 00 00 00
    000000d0: 00 00 00 00 00 00 00 00 00 00 00 00 00 00 00 00
    000000e0: 00 00 00 00 00 00 00 00 00 00 00 00 00 00 00 00
    000000f0: 20 00 00 00 00 00 00 00 00 00 00 00 00 00 00 00
    00000100: 00 00 00 00 00 00 00 00 00 00 00 00 08 00 00 14
    00000110: 00 00 00 00 24 00 00 1a 40 00 00 00 36 00 00 3c
    00000120: 80 00 00 04 12 00 00 fc 80 00 00 00 1b 80 00 ff
    00000130: 80 00 00 10 0d 80 00 fd 00 00 00 00 01 80 00 fd
    00000140: 00 00 00 0c 00 c0 00 ff 00 00 00 3e 00 c0 00 ff
    00000150: 00 00 00 1f 02 40 00 ff 00 00 00 7e 02 00 00 ff
    00000160: 00 00 00 3f 01 00 00 ff 00 00 00 ff 90 00 00 ff
    00000170: 18 07 fe 7f a0 00 00 ff 1f 8f ff ff ec 60 00 ff
    00000180: 01 8f f7 ff d8 60 00 fe 00 9f 01 ff 73 c0 00 ff
    00000190: 3f 8f ff ff ff 38 00 ff 2f 8f ff ff fe 78 00 ff
    000001a0: 01 0f 81 ff fd fc 00 ff 00 07 07 ff ff fc 00 ff
    000001b0: 00 0e 81 dd df f8 00 ff 00 0e 43 cf 9f dc 00 ff
    000001c0: 00 1e 3f 07 fb f8 00 ff 00 1c 00 1f f9 f0 00 ff
    000001d0: 00 1f 00 7f b9 b0 00 ff 00 3f 03 ff 53 20 00 ff
    000001e0: 02 3b 80 ff a6 40 00 ff 06 3f 80 7f bc c0 00 ff
    000001f0: 07 ff c0 ff 39 00 00 ff 0c ff c0 6f 78 00 00 ff
    00000200: 0c 7f e0 1e 78 00 00 ff 18 5f f4 9c 3a 00 00 ff
    00000210: 10 01 7c 9d 2e 00 00 fe 00 01 59 73 6c 00 00 fe
    00000220: 81 fb 4d f9 8c 00 00 ff 8b fb 4f f8 88 00 00 ff
    00000230: 0f ff e7 bc 08 00 00 ff 0e 03 e7 fc 1e 00 00 ff
    00000240: 08 01 f3 fe 3f 00 00 fe 00 0b 91 f8 f7 00 00 fe
    00000250: 00 00 81 f9 e7 80 00 ff 00 02 01 f3 c7 80 00 ff
    00000260: 00 68 01 e7 8f c0 00 ff 00 42 9b ff 3f e0 00 ff
    00000270: 00 01 e7 fe 7f e0 00 ff 00 0c e7 f8 ff f0 00 ff
    00000280: 00 02 e7 e3 ff f8 00 ff 80 31 df c7 ff fc 00 ff
    00000290: e0 71 3e 0f ff ff 00 fe f0 07 fc 3f ff ff c0 ff
    000002a0: f8 01 f0 7f ff ff f0 ff fc 0b e0 ff ff ff f0 ff
    000002b0: f8 cf 81 ff ff ff f0 7f f8 46 03 ff ff ff f0 ff
    000002c0: f0 60 07 ff ff ff f0 ff f0 60 0f ff ff ff f0 ff
    000002d0: f0 00 1f ff ff ff f0 ff f0 80 3f ff ff ff f0 ff
    000002e0: e1 e0 7f ff ff ff f0 ff ef f0 ff ff ff ff f0 ff
    000002f0: ff fb ff ff ff ff f0 ff ff 7f ff ff ff ff f0 df
    00000300: 02 9f 00 4a 00 45 00 00 00 00 00 00 00 00 00 00
    00000310: 00 00 0e 00 00 00 00 00 00 00 00 00 02 00 00 00
    00000320: 00 00 00 01 00 00 40 00 00 00 00 00 05 f8 0f c8
    00000330: 00 00 00 00 00 04 f0 01 fe 00 00 00 00 00 4a ac
    00000340: 03 fe 00 00 00 00 00 18 4e 40 77 00 00 00 00 00
    00000350: 30 56 03 f7 00 00 00 00 00 01 a5 81 e1 80 00 00
    00000360: 00 00 00 63 00 0d c0 00 00 00 04 01 90 00 f1 c0
    00000370: 00 00 00 09 07 00 00 3f c0 00 00 00 12 16 40 00
    00000380: 07 e0 00 00 00 17 10 00 00 01 f0 00 00 00 03 22
    00000390: 00 00 00 f0 00 00 00 03 44 00 00 00 70 00 00 00
    000003a0: 10 90 00 00 00 60 00 00 00 13 04 00 00 00 70 00
    000003b0: 00 00 03 00 00 00 00 30 00 00 00 03 00 00 00 00
    000003c0: 30 00 00 00 00 40 00 00 00 30 00 00 00 10 00 00
    000003d0: 00 00 18 00 00 00 00 00 00 00 00 18 00 00 00 08
    000003e0: 80 00 00 0f f8 00 00 00 08 00 00 bc 3e 70 00 00
    000003f0: 00 0c 00 01 ff bf b8 00 00 00 10 04 02 3e 3f e8
    00000400: 00 00 00 10
  UrbLink              = 00000000
[548716 ms] UsbSnoop - MyInternalIOCTLCompletion(f8917db0) : fido=81b964f0, Irp=81c21570, Context=822f3898, IRQL=2
[548716 ms]  <<<  URB 653 coming back  <<< 
-- URB_FUNCTION_BULK_OR_INTERRUPT_TRANSFER:
  PipeHandle           = 82300f14 [endpoint 0x00000002]
  TransferFlags        = 00000000 (USBD_TRANSFER_DIRECTION_OUT, ~USBD_SHORT_TRANSFER_OK)
  TransferBufferLength = 00000404
  TransferBuffer       = 00000000
  TransferBufferMDL    = 81ac92e0
  UrbLink              = 00000000
[548724 ms] UsbSnoop - DispatchAny(f8916610) : IRP_MJ_INTERNAL_DEVICE_CONTROL
[548724 ms] UsbSnoop - MyDispatchInternalIOCTL(f8917e80) : fdo=822eee08, Irp=81c21570, IRQL=2
[548724 ms]  >>>  URB 654 going down  >>> 
-- URB_FUNCTION_BULK_OR_INTERRUPT_TRANSFER:
  PipeHandle           = 82300ef4 [endpoint 0x00000081]
  TransferFlags        = 00000003 (USBD_TRANSFER_DIRECTION_IN, USBD_SHORT_TRANSFER_OK)
  TransferBufferLength = 00000100
  TransferBuffer       = 00000000
  TransferBufferMDL    = 81ac92e0
  UrbLink              = 00000000
[548724 ms] UsbSnoop - MyInternalIOCTLCompletion(f8917db0) : fido=81b964f0, Irp=81c21570, Context=81b4d110, IRQL=2
[548724 ms]  <<<  URB 654 coming back  <<< 
-- URB_FUNCTION_BULK_OR_INTERRUPT_TRANSFER:
  PipeHandle           = 82300ef4 [endpoint 0x00000081]
  TransferFlags        = 00000003 (USBD_TRANSFER_DIRECTION_IN, USBD_SHORT_TRANSFER_OK)
  TransferBufferLength = 00000007
  TransferBuffer       = 00000000
  TransferBufferMDL    = 81ac92e0
    00000000: 00 00 00 02 05 e0 00
  UrbLink              = 00000000
[548764 ms] UsbSnoop - DispatchAny(f8916610) : IRP_MJ_INTERNAL_DEVICE_CONTROL
[548764 ms] UsbSnoop - MyDispatchInternalIOCTL(f8917e80) : fdo=822eee08, Irp=81c21570, IRQL=2
[548764 ms]  >>>  URB 655 going down  >>> 
-- URB_FUNCTION_BULK_OR_INTERRUPT_TRANSFER:
  PipeHandle           = 82300f14 [endpoint 0x00000002]
  TransferFlags        = 00000000 (USBD_TRANSFER_DIRECTION_OUT, ~USBD_SHORT_TRANSFER_OK)
  TransferBufferLength = 00000404
  TransferBuffer       = 00000000
  TransferBufferMDL    = 81ac92e0
    00000000: 00 00 03 ff 03 00 19 fc 3f d8 00 00 00 00 00 03
    00000010: f8 3e 68 00 00 00 06 00 07 d8 3c 78 00 00 00 06
    00000020: 00 00 10 0e 38 00 00 00 04 c0 00 20 00 18 00 00
    00000030: 00 04 c8 00 00 10 08 00 00 00 06 88 00 00 18 10
    00000040: 00 00 00 06 00 00 00 08 18 00 00 00 13 00 00 08
    00000050: 04 18 00 00 00 07 00 00 08 06 10 00 00 00 46 80
    00000060: 00 19 9f 14 00 00 02 07 40 00 17 fb 0c 00 00 00
    00000070: 1b 40 00 33 fd 8c 00 00 00 0d 20 00 60 79 ce 00
    00000080: 00 00 06 c0 00 e0 7f d8 00 00 02 01 e0 00 80 7f
    00000090: 4e 00 10 00 0f e0 00 03 ff 29 80 00 04 1f c0 00
    000000a0: 4f ff 28 00 00 00 bf c0 00 7c 03 28 00 00 00 86
    000000b0: c0 00 30 61 0c 80 00 00 60 40 00 61 b8 fd 00 00
    000000c0: 02 38 00 00 81 b8 30 00 00 06 00 30 06 00 00 f0
    000000d0: 00 00 04 80 30 06 00 01 78 00 00 02 00 70 0f 00
    000000e0: 00 78 00 00 00 00 d8 1f 00 02 fc 00 00 00 01 f8
    000000f0: 07 c0 e4 fe 00 00 00 03 ec 03 ff f8 ff 00 00 00
    00000100: 0f ec 01 ff f0 ff c0 00 00 3e ed 01 ff b0 ff f0
    00000110: 00 01 ff fe 40 ff e0 ff ff 00 03 ff fb 00 8f c0
    00000120: ff ff c0 0f ff f9 20 7f bf ff ff f0 3f ff f9 bf
    00000130: 7f ff ff ff f8 ff fb f8 df ff ff ff ff f8 ff f3
    00000140: f8 7d 6f ff ff ff f8 ff f3 f8 61 65 7f ff ff f8
    00000150: ff f7 f8 3f 3b fd ff ff f8 ff f7 f0 3e df ff ff
    00000160: ff f8 ff f7 90 1f ff ff ff ff f8 ff e7 f0 1f c8
    00000170: ff ff ff f8 ff e0 00 07 c3 ff ff ff f8 ff 18 20
    00000180: 06 27 ff ff ff f8 ff 8f e0 03 d7 3f ff ff f8 ff
    00000190: 00 20 07 ff ef ff ff f8 fa 04 00 05 df cf ff ff
    000001a0: f8 df 02 55 00 4a 00 3d ff fb ff ff ff ff ff f8
    000001b0: 7f 3f ff ff ff ff ff f8 ff ff ff ff 80 7f ff f8
    000001c0: fe ff ff ff fe 3f ff f8 fd ff ff cf f9 0f ff f8
    000001d0: ff ff ff ff e0 07 ff f8 ff ff ff ff 88 07 ff f8
    000001e0: ff ff ff ff f0 03 ff f8 7f ff ff ff 88 03 ff f8
    000001f0: 5f ff fc 00 00 03 ff f8 7f ff f0 00 00 01 ff f8
    00000200: 1f ff c0 00 00 00 7f f8 df ff 80 00 00 00 3f f8
    00000210: 4f fd 00 00 00 00 1f f8 5b ff 00 00 00 00 0f f8
    00000220: 0f ff 00 00 00 00 0f f8 1f ff 00 00 00 00 07 f8
    00000230: 3f fe 00 00 00 00 07 f8 3f ff 00 00 00 00 07 f8
    00000240: 07 ff 00 00 00 00 03 f8 47 ff 00 00 00 00 03 f8
    00000250: 07 ff 00 00 00 00 01 f8 8f fe 80 00 00 00 01 f8
    00000260: 03 fc 80 00 00 00 01 f8 07 f5 80 00 00 00 00 f8
    00000270: 07 e5 00 00 00 00 01 f8 0f e5 00 00 00 00 01 f8
    00000280: 3f ea 00 00 00 00 01 f8 3f 89 00 00 00 00 01 f8
    00000290: 3f cc 00 23 80 00 03 f8 0c 60 00 77 e0 00 07 f8
    000002a0: 18 04 00 09 7c 01 c7 f8 12 00 00 3f fa 03 03 f8
    000002b0: 10 00 00 fe f8 06 07 f8 18 22 01 00 f9 1f c7 f8
    000002c0: 18 00 00 00 34 9b 27 f8 28 30 00 50 60 80 07 f8
    000002d0: 18 32 00 00 60 80 07 f8 1c 62 00 00 00 40 07 f8
    000002e0: 34 40 00 01 80 40 07 f8 06 22 00 00 40 20 07 f8
    000002f0: 0a 38 40 00 06 00 07 f8 03 0c 00 00 01 20 07 f8
    00000300: 09 00 00 00 30 40 07 f8 0d 91 00 01 7c 00 07 f8
    00000310: 07 c0 00 01 ef a0 07 f8 03 c2 00 05 c6 f2 07 f8
    00000320: 01 f6 00 01 1e e0 07 f8 03 f0 00 03 3f 20 07 f8
    00000330: 03 f8 00 40 7c 20 0f f8 02 f8 00 1c 08 00 0f f8
    00000340: 02 f8 00 04 0b 00 0f f8 00 f8 40 08 ff 90 1f f8
    00000350: 00 fc 40 0b 80 06 1f f8 01 fc 20 07 04 00 1f f8
    00000360: 03 f9 30 0c 6c 00 3f f8 02 f9 18 00 7c 00 3f f8
    00000370: 03 f0 9a 01 9c 00 7f f8 03 f0 4d 2c 80 00 7f f8
    00000380: 0f f0 33 f4 08 00 ff f8 1f f0 1d e8 0c 01 ff f8
    00000390: 3f f0 06 7c 10 03 ff f8 5f f8 03 af 90 83 ff f8
    000003a0: 7f f8 00 c3 f1 87 ff f8 7f fc 00 34 f9 cf ff f8
    000003b0: ff fe 00 1c ff 97 ff f8 ff ff 00 06 7e 1b ff f8
    000003c0: ff ff 00 03 80 1b ff f8 ff ff 80 00 60 9b ff f8
    000003d0: ff ff c0 00 01 1d ff f8 ff ff e0 00 02 1c ff f8
    000003e0: ff ff f0 00 00 1c 7f f8 ff ff f8 00 02 1e f7 f8
    000003f0: ff ff f0 00 3b 1e 1c 78 df 02 9f 00 4a 00 43 c7
    00000400: e0 f8 00 0f
  UrbLink              = 00000000
[548775 ms] UsbSnoop - MyInternalIOCTLCompletion(f8917db0) : fido=81b964f0, Irp=81c21570, Context=822f3898, IRQL=2
[548775 ms]  <<<  URB 655 coming back  <<< 
-- URB_FUNCTION_BULK_OR_INTERRUPT_TRANSFER:
  PipeHandle           = 82300f14 [endpoint 0x00000002]
  TransferFlags        = 00000000 (USBD_TRANSFER_DIRECTION_OUT, ~USBD_SHORT_TRANSFER_OK)
  TransferBufferLength = 00000404
  TransferBuffer       = 00000000
  TransferBufferMDL    = 81ac92e0
  UrbLink              = 00000000
[548784 ms] UsbSnoop - DispatchAny(f8916610) : IRP_MJ_INTERNAL_DEVICE_CONTROL
[548784 ms] UsbSnoop - MyDispatchInternalIOCTL(f8917e80) : fdo=822eee08, Irp=81c21570, IRQL=2
[548784 ms]  >>>  URB 656 going down  >>> 
-- URB_FUNCTION_BULK_OR_INTERRUPT_TRANSFER:
  PipeHandle           = 82300ef4 [endpoint 0x00000081]
  TransferFlags        = 00000003 (USBD_TRANSFER_DIRECTION_IN, USBD_SHORT_TRANSFER_OK)
  TransferBufferLength = 00000100
  TransferBuffer       = 00000000
  TransferBufferMDL    = 81ac92e0
  UrbLink              = 00000000
[548784 ms] UsbSnoop - MyInternalIOCTLCompletion(f8917db0) : fido=81b964f0, Irp=81c21570, Context=81c3bfe8, IRQL=2
[548784 ms]  <<<  URB 656 coming back  <<< 
-- URB_FUNCTION_BULK_OR_INTERRUPT_TRANSFER:
  PipeHandle           = 82300ef4 [endpoint 0x00000081]
  TransferFlags        = 00000003 (USBD_TRANSFER_DIRECTION_IN, USBD_SHORT_TRANSFER_OK)
  TransferBufferLength = 00000007
  TransferBuffer       = 00000000
  TransferBufferMDL    = 81ac92e0
    00000000: 00 00 00 02 05 e0 00
  UrbLink              = 00000000
[548824 ms] UsbSnoop - DispatchAny(f8916610) : IRP_MJ_INTERNAL_DEVICE_CONTROL
[548824 ms] UsbSnoop - MyDispatchInternalIOCTL(f8917e80) : fdo=822eee08, Irp=81c21570, IRQL=2
[548824 ms]  >>>  URB 657 going down  >>> 
-- URB_FUNCTION_BULK_OR_INTERRUPT_TRANSFER:
  PipeHandle           = 82300f14 [endpoint 0x00000002]
  TransferFlags        = 00000000 (USBD_TRANSFER_DIRECTION_OUT, ~USBD_SHORT_TRANSFER_OK)
  TransferBufferLength = 00000404
  TransferBuffer       = 00000000
  TransferBufferMDL    = 81ac92e0
    00000000: 00 00 03 ff 03 ff ff ff e0 c7 e0 fc 03 ff ff ff
    00000010: ff e0 cf e0 fc 0f ff 07 ff ff e0 cf e0 fe 3d 0f
    00000020: e3 ff ff e0 cf e0 ff f0 67 01 ff ff e0 cf e0 ff
    00000030: 82 38 c0 7f ff e0 df ec 1b 80 00 04 3f ff e0 ef
    00000040: f8 33 80 00 04 3f ff e0 e7 f8 7c 00 00 22 1f ff
    00000050: e0 e0 08 f8 00 00 00 0f ff e0 e0 0c c0 00 00 00
    00000060: 07 ff e0 e0 0d c0 00 00 00 07 ff e0 f0 07 80 00
    00000070: 00 00 03 ff e0 f0 0e 00 00 00 00 03 ff e0 f0 1e
    00000080: 00 00 00 00 03 ff e0 f0 1e 00 00 00 00 03 ff e0
    00000090: 74 7e 00 00 00 00 03 ff e0 3f 7c 00 00 00 00 03
    000000a0: df e0 1f 7c 00 00 00 00 01 df e0 0f fc 00 00 00
    000000b0: 00 01 ff e0 07 fc 00 00 00 00 01 ff e0 83 fc 00
    000000c0: 00 00 00 01 ff e0 83 7c 00 00 00 00 01 ff e0 81
    000000d0: fc 00 00 00 00 01 ff e0 80 fc 00 00 00 00 01 ff
    000000e0: e0 80 fc 00 00 00 00 01 df e0 80 7c 00 00 00 08
    000000f0: 01 1f e0 80 3e 00 00 00 00 04 6f e0 80 3e 00 00
    00000100: 00 40 0c ef e0 80 1e 00 00 00 00 0d ef e0 80 0f
    00000110: 00 00 00 00 04 0f e0 80 0f 00 00 00 00 07 2f e0
    00000120: 80 0c 80 00 01 c0 05 1f e0 80 07 00 00 03 e4 04
    00000130: 1f e0 80 03 80 00 0e 06 00 1f e0 80 00 80 00 38
    00000140: f4 02 1f e0 c0 00 56 00 67 fc 02 3f e0 c0 00 c3
    00000150: d8 f9 84 00 7f e0 c0 00 df f0 f0 00 00 7f e0 c0
    00000160: 00 77 10 0c 48 02 7f e0 c0 00 30 10 0c 00 02 7f
    00000170: e0 c0 00 10 00 00 00 81 7f e0 e0 00 10 00 00 01
    00000180: 80 7f e0 e0 00 08 08 00 07 00 7f e0 f0 00 20 18
    00000190: 00 07 00 7f e0 f0 00 20 10 00 02 00 7b e0 f8 00
    000001a0: 30 10 18 00 00 7d e0 fc 00 10 20 8b 08 04 7d e0
    000001b0: fc 00 18 60 09 84 04 7e e0 fe 00 18 30 78 c4 04
    000001c0: 7f e0 ff 00 18 18 f0 06 0c 7f e0 ff 80 08 0f c0
    000001d0: 06 0c ff e0 ff 80 0c 07 80 22 18 ff e0 ff c0 0c
    000001e0: 01 80 f2 1c ff e0 ff e0 04 e0 03 e1 19 ff e0 ff
    000001f0: e0 06 70 7e 02 19 ff e0 ff f0 3e 1f e0 03 71 ff
    00000200: e0 ff f8 7f 0c 08 00 f1 ff e0 ff f8 ff 87 f0 03
    00000210: e3 ff e0 ff fd ff c3 00 07 e3 ff e0 ff ff ff e0
    00000220: 00 1f c3 ff e0 ff ff ff f0 00 1f 87 ff e0 ff ff
    00000230: ff f8 00 7f 07 ff e0 ff ff ff fc 00 fe 07 ff e0
    00000240: ff ff ff ff 07 fe 07 ff e0 bf ff ff ff ff fc 0f
    00000250: ff e0 bf ff ff ff ff f0 0f ff e0 bf ff ff ff ff
    00000260: e0 1f ff e0 9f ff ff ff f7 c0 1f ff e0 8f ff ff
    00000270: ff f3 80 1f ff e0 8f ff ff ff f7 00 3f ff e0 87
    00000280: ff ff ff ff 00 3f ff e0 83 ff ff ff ff 80 7f ff
    00000290: e0 81 ff ff ff ff 80 7f ff e0 df 02 19 00 4c 00
    000002a0: 37 df b7 af 7f ff ff fe 9d 9f e9 6f f7 7f fe 57
    000002b0: ff ff f3 d7 bf fe fe bf ea f5 7f ff fe ef df eb
    000002c0: ff fb ff fe d9 ad 18 17 ef ff fe 6f dc ff c0 df
    000002d0: af fa 59 ab ff ff 1a f3 de 95 27 ff ff c7 fc fe
    000002e0: 77 cb ff ff f3 ff be aa 9f ff ff f9 ff fe 6b 1f
    000002f0: ff ff ff 7e fe ed ff ff ff ff 5f be 8f ff ff 00
    00000300: ff 5f 74 25 bf f8 00 35 9a de 5b bf e0 00 0f f7
    00000310: fe 46 bf c0 00 1f fb fe ae 7f c0 00 1f f5 76 30
    00000320: ff c0 00 17 fe 5a d5 ff 80 00 1f ff 5c 29 7f 80
    00000330: 00 0f ff 3a 0e ff 80 00 0f ff 6e 90 ff 80 00 1e
    00000340: ff 9e 4b 3f 80 00 1f ff 76 9c 3f 00 7c 02 ff be
    00000350: 25 7e 63 f7 0f ff 7e 86 fd f9 11 87 ff ba 32 7f
    00000360: f8 fe 41 ff 9e 42 7f f8 ad 03 ff de 29 3f a8 30
    00000370: 41 bf d6 21 3f d0 20 01 9f ba 62 8f 90 10 01 6f
    00000380: ae 10 4e 10 00 02 2f 5e 00 aa 30 00 00 27 3e 01
    00000390: 03 20 00 08 4f fe 00 0b 32 00 00 07 62 21 03 f3
    000003a0: 80 00 2f 9e 42 51 fc 00 21 1f 6c 12 25 fe 00 00
    000003b0: bf 76 00 01 f0 00 00 fc ae 00 15 fb f0 01 fa dc
    000003c0: 80 41 b4 08 43 32 f6 21 00 da 00 0c 25 ba 00 16
    000003d0: db 00 70 4a 4e 00 00 7c c3 81 e5 7a 04 05 70 04
    000003e0: 27 f2 96 00 00 70 08 8f fb 6e 02 04 38 06 3b fd
    000003f0: de 00 00 1e 70 ff fd 6e 00 00 8f e3 ef fd be 00
    00000400: 01 27 ff df
  UrbLink              = 00000000
[548835 ms] UsbSnoop - MyInternalIOCTLCompletion(f8917db0) : fido=81b964f0, Irp=81c21570, Context=822f3898, IRQL=2
[548835 ms]  <<<  URB 657 coming back  <<< 
-- URB_FUNCTION_BULK_OR_INTERRUPT_TRANSFER:
  PipeHandle           = 82300f14 [endpoint 0x00000002]
  TransferFlags        = 00000000 (USBD_TRANSFER_DIRECTION_OUT, ~USBD_SHORT_TRANSFER_OK)
  TransferBufferLength = 00000404
  TransferBuffer       = 00000000
  TransferBufferMDL    = 81ac92e0
  UrbLink              = 00000000
[548844 ms] UsbSnoop - DispatchAny(f8916610) : IRP_MJ_INTERNAL_DEVICE_CONTROL
[548844 ms] UsbSnoop - MyDispatchInternalIOCTL(f8917e80) : fdo=822eee08, Irp=81c21570, IRQL=2
[548844 ms]  >>>  URB 658 going down  >>> 
-- URB_FUNCTION_BULK_OR_INTERRUPT_TRANSFER:
  PipeHandle           = 82300ef4 [endpoint 0x00000081]
  TransferFlags        = 00000003 (USBD_TRANSFER_DIRECTION_IN, USBD_SHORT_TRANSFER_OK)
  TransferBufferLength = 00000100
  TransferBuffer       = 00000000
  TransferBufferMDL    = 81ac92e0
  UrbLink              = 00000000
[548844 ms] UsbSnoop - MyInternalIOCTLCompletion(f8917db0) : fido=81b964f0, Irp=81c21570, Context=81b4d110, IRQL=2
[548844 ms]  <<<  URB 658 coming back  <<< 
-- URB_FUNCTION_BULK_OR_INTERRUPT_TRANSFER:
  PipeHandle           = 82300ef4 [endpoint 0x00000081]
  TransferFlags        = 00000003 (USBD_TRANSFER_DIRECTION_IN, USBD_SHORT_TRANSFER_OK)
  TransferBufferLength = 00000007
  TransferBuffer       = 00000000
  TransferBufferMDL    = 81ac92e0
    00000000: 00 00 00 02 05 e0 00
  UrbLink              = 00000000
[548884 ms] UsbSnoop - DispatchAny(f8916610) : IRP_MJ_INTERNAL_DEVICE_CONTROL
[548884 ms] UsbSnoop - MyDispatchInternalIOCTL(f8917e80) : fdo=822eee08, Irp=81c21570, IRQL=2
[548884 ms]  >>>  URB 659 going down  >>> 
-- URB_FUNCTION_BULK_OR_INTERRUPT_TRANSFER:
  PipeHandle           = 82300f14 [endpoint 0x00000002]
  TransferFlags        = 00000000 (USBD_TRANSFER_DIRECTION_OUT, ~USBD_SHORT_TRANSFER_OK)
  TransferBufferLength = 00000404
  TransferBuffer       = 00000000
  TransferBufferMDL    = 81ac92e0
    00000000: 00 00 03 ff 03 fc da 08 18 17 ff ff fe fc 01 01
    00000010: 1b ff ff fe 6e 02 00 0d ff ff ff 56 24 88 49 ff
    00000020: ff ff 2e 80 10 a3 ff ff ff 9e 49 08 8f ff ff ff
    00000030: ce 12 10 3f ff ff ff e6 10 00 ff ff ff ff fa 00
    00000040: 08 ff ff ff ff fc 01 13 7f ff ff ff fe 80 05 3f
    00000050: f7 ff ff fe 00 00 7f ff ff ff fe 00 02 ff ff ff
    00000060: ff fe 22 85 ff ff ff ff fe 58 09 f7 7f ff ff fe
    00000070: 10 93 f0 7f ff ff fe 01 17 e0 ff ff ff fe 50 27
    00000080: c3 ff ff ff fe 68 af 83 ff ff ff fe 00 5f 87 ff
    00000090: ff ff fe 80 1f 0f ff ff ff fe 00 be 1f ff ff ff
    000000a0: fe 0d 7c 3f ff ff ff fe 42 7c 7f ff ff ff fe 84
    000000b0: f8 7f ff ff ff fe df 02 55 00 4a 00 3f 03 ff ff
    000000c0: cf c5 f0 00 00 13 ff ff fd 43 f0 00 00 3f ff ff
    000000d0: c0 37 f0 00 00 3f ff f8 00 07 f8 00 00 3f ff f0
    000000e0: 00 07 f8 00 00 1f ff c0 00 10 3e c0 00 1f ff 80
    000000f0: 00 0e 3f c0 00 4f ff 00 00 02 3f e0 00 07 fe 00
    00000100: 00 01 3e 60 00 27 fe 00 00 01 9f 80 00 7f fc 00
    00000110: 00 00 bf c0 00 ff fc 00 00 00 3f c0 00 ff fc 00
    00000120: 00 00 3f e0 00 ff fc 00 00 00 3f e0 00 ff f8 00
    00000130: 00 02 0f f0 00 ff f8 00 00 02 0f f0 00 ff f0 00
    00000140: 00 00 0a fc 00 ff f0 00 00 00 05 7e 00 ff f0 00
    00000150: 00 00 01 fe 00 ff f0 00 00 00 00 fe 00 ff f0 00
    00000160: 00 00 80 3f 00 ff f0 00 00 00 20 3e 00 ff e0 00
    00000170: 00 00 30 3e 00 ff e0 00 03 e8 38 1e 38 ff e0 00
    00000180: 1f fe 38 3e d0 ff e0 20 3e 3f 78 7e 00 ff f1 f8
    00000190: 30 0f fd de 00 ff f1 0c 37 ff fe 9b 00 ff f2 34
    000001a0: 3d 3f fe 0b 00 ff f2 fc 70 58 7f db c0 ff f1 a0
    000001b0: 70 00 7f 57 c0 ff f9 08 e2 00 7f 67 f0 ff f8 1c
    000001c0: e0 00 ff 27 c0 ff f8 18 f0 00 7f 6f c0 ff f8 00
    000001d0: e0 00 ff cf e0 ff fc 00 f0 01 ff 9f e0 ff fc 00
    000001e0: c8 03 ff 1f f0 ff fc 00 c8 07 ff 3f f0 ff fe 11
    000001f0: fc 07 7f 7f f0 ff fe 1f fe c6 7f ff f0 ff fe 33
    00000200: fe 26 7f ff f0 ff fe 30 f8 06 3f ff f0 ff fe 20
    00000210: 30 04 7f ff f8 ff fe 00 07 80 ff ff f8 ff ff 03
    00000220: ff 80 ff ff fc ff ff 0f 80 07 ff ff fc ff ff 00
    00000230: 06 07 ff df fc ff ff 01 fc 07 ff df fe ff ff 81
    00000240: 90 0f ff bf fe ff ff 80 00 4f ff bf fe ff ff d0
    00000250: 00 9f ff 3f f6 ff ff c0 00 3f ff 3f f8 ff ff e0
    00000260: 00 ff fe 7f fc ff ff f0 25 ff fe 7f fe ff ff f9
    00000270: ff ff f8 ff fe ff ff ff ff ff f9 ff fe ff ff ff
    00000280: ff ff f1 ff fe ff ff ff ff ff e3 ff fe ff ff ff
    00000290: ff ff c3 ff fe ff ff ff ff ff 87 ff fe ff ff ff
    000002a0: ef ff 07 ff fe ff ff ff e7 fc 0f ff fe ff ff ff
    000002b0: e3 f8 1f ff fe ff ff ff f1 f0 3f ff fe ff ff ff
    000002c0: f1 c0 7f ff fe ff ff ff f0 c0 7f ff fe ff ff ff
    000002d0: f1 c0 bf ff fe ff ff ff f1 c0 3f ff fe ff ff ff
    000002e0: f1 c0 7f ff fe ff ff ff f3 e0 7f ff fe ff ff ff
    000002f0: f3 e0 ff ff fe ff ff ff f3 e0 ff ff fe ff ff ff
    00000300: f7 61 ff ff fe ff ff ff e7 f1 ff ff fe df 02 55
    00000310: 00 4a 00 3a 00 00 00 00 00 00 00 00 00 00 01 fe
    00000320: 00 00 00 00 00 00 0f ff 80 00 00 00 00 00 7e 3f
    00000330: e0 00 00 00 00 01 ff ff fe 00 00 00 00 03 ff ff
    00000340: ff 80 00 00 00 0f ff ff ff c0 00 00 00 1f ff ff
    00000350: 8f c0 00 00 00 3f ff fc 03 e0 00 00 00 7f ff f0
    00000360: 01 e0 00 00 00 7f ff 80 00 f8 00 00 00 ff c0 00
    00000370: 00 78 00 00 00 ff 00 00 00 7c 00 00 00 fe 00 00
    00000380: 00 3e 00 00 00 7c 00 00 00 3e 00 00 00 f8 00 00
    00000390: 00 3f 00 00 00 f0 00 00 00 1f 80 00 01 f0 00 00
    000003a0: 00 1f c0 00 01 f0 00 00 03 1f c0 00 01 f0 00 00
    000003b0: 01 0f e0 00 05 e0 00 00 02 ff e0 00 01 e0 00 00
    000003c0: 07 3f e0 00 01 e0 00 00 06 df f0 00 01 e0 00 00
    000003d0: 04 df e0 00 01 e0 00 00 00 7f e0 00 01 c0 00 00
    000003e0: 00 3f f0 00 01 f0 00 00 e4 7f f0 00 05 f0 1e 03
    000003f0: fe ff f0 00 01 f0 ff 87 ff ff e0 00 01 f3 ff 8f
    00000400: ff ef f0 00
  UrbLink              = 00000000
[548895 ms] UsbSnoop - MyInternalIOCTLCompletion(f8917db0) : fido=81b964f0, Irp=81c21570, Context=822f3898, IRQL=2
[548895 ms]  <<<  URB 659 coming back  <<< 
-- URB_FUNCTION_BULK_OR_INTERRUPT_TRANSFER:
  PipeHandle           = 82300f14 [endpoint 0x00000002]
  TransferFlags        = 00000000 (USBD_TRANSFER_DIRECTION_OUT, ~USBD_SHORT_TRANSFER_OK)
  TransferBufferLength = 00000404
  TransferBuffer       = 00000000
  TransferBufferMDL    = 81ac92e0
  UrbLink              = 00000000
[548904 ms] UsbSnoop - DispatchAny(f8916610) : IRP_MJ_INTERNAL_DEVICE_CONTROL
[548904 ms] UsbSnoop - MyDispatchInternalIOCTL(f8917e80) : fdo=822eee08, Irp=81c21570, IRQL=2
[548904 ms]  >>>  URB 660 going down  >>> 
-- URB_FUNCTION_BULK_OR_INTERRUPT_TRANSFER:
  PipeHandle           = 82300ef4 [endpoint 0x00000081]
  TransferFlags        = 00000003 (USBD_TRANSFER_DIRECTION_IN, USBD_SHORT_TRANSFER_OK)
  TransferBufferLength = 00000100
  TransferBuffer       = 00000000
  TransferBufferMDL    = 81ac92e0
  UrbLink              = 00000000
[548904 ms] UsbSnoop - MyInternalIOCTLCompletion(f8917db0) : fido=81b964f0, Irp=81c21570, Context=81c3bfe8, IRQL=2
[548904 ms]  <<<  URB 660 coming back  <<< 
-- URB_FUNCTION_BULK_OR_INTERRUPT_TRANSFER:
  PipeHandle           = 82300ef4 [endpoint 0x00000081]
  TransferFlags        = 00000003 (USBD_TRANSFER_DIRECTION_IN, USBD_SHORT_TRANSFER_OK)
  TransferBufferLength = 00000007
  TransferBuffer       = 00000000
  TransferBufferMDL    = 81ac92e0
    00000000: 00 00 00 02 05 e0 00
  UrbLink              = 00000000
[548944 ms] UsbSnoop - DispatchAny(f8916610) : IRP_MJ_INTERNAL_DEVICE_CONTROL
[548944 ms] UsbSnoop - MyDispatchInternalIOCTL(f8917e80) : fdo=822eee08, Irp=81c21570, IRQL=2
[548944 ms]  >>>  URB 661 going down  >>> 
-- URB_FUNCTION_BULK_OR_INTERRUPT_TRANSFER:
  PipeHandle           = 82300f14 [endpoint 0x00000002]
  TransferFlags        = 00000000 (USBD_TRANSFER_DIRECTION_OUT, ~USBD_SHORT_TRANSFER_OK)
  TransferBufferLength = 00000404
  TransferBuffer       = 00000000
  TransferBufferMDL    = 81ac92e0
    00000000: 00 00 03 ff 03 00 fb e7 87 ff b7 f0 00 cc f3 3f
    00000010: 8f bf ff f0 00 09 f0 ff 8f 83 db f0 00 01 b1 86
    00000020: 0f fc 1d e0 00 40 b0 0c 0f c0 1d e0 00 00 c0 00
    00000030: 0f 80 3d e0 00 00 80 00 07 c0 7c e0 00 01 30 00
    00000040: 07 c0 7e c0 00 00 30 01 03 e0 fe c0 00 04 30 03
    00000050: 07 e0 ff c0 00 00 30 06 07 f0 f9 80 00 00 10 0c
    00000060: ff fd fb 40 00 00 00 18 ff fd fc c0 00 0c 40 18
    00000070: 3f ff fe c0 00 10 60 30 1b ff ff 80 00 c0 40 70
    00000080: 03 fe ff 80 00 80 00 6f ff fe ff 00 00 01 c8 7f
    00000090: ff fc fc 00 00 c3 00 3e 01 7c fc 00 00 81 40 13
    000000a0: ff f8 fc 00 00 b4 42 00 04 f8 fc 00 00 8c 02 00
    000000b0: 00 f1 fc 00 00 00 03 00 01 f9 fc 00 00 80 01 00
    000000c0: 0f e3 b8 00 00 ce 01 80 0f e7 f8 00 00 9d 40 80
    000000d0: 01 8f fc 00 00 b1 c0 00 01 9f fc 00 00 82 40 00
    000000e0: 03 ff f8 00 00 80 00 30 07 ff fc 00 00 81 00 5c
    000000f0: 7f ff f6 00 00 c3 80 0f ff ff f2 00 00 c1 c0 27
    00000100: ff ff e3 00 00 dc 00 73 ff ff c3 c0 00 dc 00 d1
    00000110: 7f ff c3 e8 00 c0 01 dc 7f ff 03 e0 00 c0 03 ce
    00000120: 77 fe 03 f8 00 ce 07 83 7f fc 03 fe 00 dd cf c3
    00000130: ff f8 03 ff c0 d7 3f 81 ff f0 07 ff c0 c1 ff 80
    00000140: ff e0 07 ff c0 c7 ff 80 3f c0 07 ff c0 0f ff c0
    00000150: 1f 00 0f ff c0 3f ff c0 1e 00 0f ff c0 ff ff c0
    00000160: 3e 00 0f ff c0 df 02 55 00 4a 00 3c 00 00 00 00
    00000170: 00 00 00 00 00 00 00 00 00 00 00 00 00 00 00 04
    00000180: 00 00 00 00 00 00 00 7f 80 00 00 00 00 00 07 ff
    00000190: e0 00 00 00 00 00 3f ff f8 00 00 00 00 00 3f ff
    000001a0: fc 00 00 00 00 03 ff ff fc 00 00 00 00 07 ff ff
    000001b0: ff 80 00 00 00 0f ff ff ff e0 00 00 00 0f ff ff
    000001c0: ff fc 00 00 00 0f ff ff ff fe 00 00 00 1f ff ff
    000001d0: ff ff 00 00 00 3f ff ff ff ff 00 00 00 3f ff e0
    000001e0: 7f ff 00 00 00 7f f8 00 7f ff 00 00 00 7e 80 00
    000001f0: 3f ff 00 00 00 7c 00 00 1f ff 80 00 00 7c 00 00
    00000200: 1f ff 80 00 00 fc 00 00 1f ff 80 00 00 fc 00 00
    00000210: 1f ff c0 00 00 fc 00 00 1f ff c0 00 00 fc 00 00
    00000220: 1f ff c0 00 00 f8 00 00 0f ff c0 00 00 f8 00 00
    00000230: 07 ff c0 00 00 7c 00 01 9f ff c0 00 00 fc 00 03
    00000240: ff ff c0 00 00 fc 00 03 ff ff e0 00 00 7c 7f 03
    00000250: ff ff e0 00 00 7c 7f c3 ff ff e0 00 00 7c 9f c7
    00000260: ff ff e0 00 00 3c 3f c7 02 ff e0 00 00 1c 3f 86
    00000270: 04 7f e0 00 00 1c 00 06 00 7f e0 00 00 0c 00 07
    00000280: 00 ff e0 00 00 0c 00 07 80 ff c0 00 00 0c 00 03
    00000290: 80 ff c0 00 00 0c 00 03 c0 ff c0 00 00 02 00 02
    000002a0: e0 ff 80 00 00 02 02 03 f9 ff 00 00 00 02 02 67
    000002b0: ff ff 00 00 00 01 04 1f ff fc 00 00 00 01 0c 0f
    000002c0: fc fc 00 00 00 01 0c 01 fc 7c 00 00 00 03 80 01
    000002d0: f8 7c 00 00 00 00 81 ff fc fc 00 00 00 00 80 63
    000002e0: f0 fc 00 00 00 00 80 00 60 fc 00 00 00 00 00 00
    000002f0: 60 fc 00 00 00 00 40 07 e3 ff 00 00 00 00 68 03
    00000300: e3 ff 80 00 00 00 10 00 03 f9 e0 00 00 00 08 00
    00000310: 07 f9 f0 00 00 00 0c 00 07 f9 f8 00 00 00 0f 00
    00000320: 1f f1 ff 00 00 00 0f 80 1f e1 ff e0 00 00 0f 80
    00000330: 3f e1 ff f0 00 00 1b ff ff 83 ff f0 00 00 39 ff
    00000340: ff 03 ff f0 00 01 f8 7f fe 03 ff f0 00 03 f8 7f
    00000350: fc 03 ff f0 00 0f f8 3f fc 03 ff f0 00 7f fc 0f
    00000360: f0 03 ff f0 00 ff fc 07 e0 03 ff f0 03 ff fc 03
    00000370: c0 03 ff f0 1f ff fc 00 00 03 ff f0 7f ff fc 03
    00000380: 80 03 ff f0 ff ff fe 07 e0 07 ff f0 ff ff fe 0f
    00000390: f0 07 ff f0 ff ff fe 1f f8 07 ff f0 ff ff fe 13
    000003a0: f8 07 ff f0 ff ff fe 23 f0 07 ff f0 ff ff ff 03
    000003b0: f0 07 ff f0 ff ff ff 03 e0 07 ff f0 df 02 55 00
    000003c0: 4a 00 3b 23 3c ff ff ff ff ff e0 01 ef 0f ff ff
    000003d0: ff ff e0 13 ee 7f fb ff ff ff e0 0b ef ff c0 0f
    000003e0: ff ff e0 3f fd f8 00 01 ff ff e0 9f ff c0 00 00
    000003f0: 7f ff e0 ef ff c0 00 00 1f ff e0 fe ff 80 00 00
    00000400: 07 ff e0 ff
  UrbLink              = 00000000
[548956 ms] UsbSnoop - MyInternalIOCTLCompletion(f8917db0) : fido=81b964f0, Irp=81c21570, Context=81d30f40, IRQL=2
[548956 ms]  <<<  URB 661 coming back  <<< 
-- URB_FUNCTION_BULK_OR_INTERRUPT_TRANSFER:
  PipeHandle           = 82300f14 [endpoint 0x00000002]
  TransferFlags        = 00000000 (USBD_TRANSFER_DIRECTION_OUT, ~USBD_SHORT_TRANSFER_OK)
  TransferBufferLength = 00000404
  TransferBuffer       = 00000000
  TransferBufferMDL    = 81ac92e0
  UrbLink              = 00000000
[548964 ms] UsbSnoop - DispatchAny(f8916610) : IRP_MJ_INTERNAL_DEVICE_CONTROL
[548964 ms] UsbSnoop - MyDispatchInternalIOCTL(f8917e80) : fdo=822eee08, Irp=81c21570, IRQL=2
[548964 ms]  >>>  URB 662 going down  >>> 
-- URB_FUNCTION_BULK_OR_INTERRUPT_TRANSFER:
  PipeHandle           = 82300ef4 [endpoint 0x00000081]
  TransferFlags        = 00000003 (USBD_TRANSFER_DIRECTION_IN, USBD_SHORT_TRANSFER_OK)
  TransferBufferLength = 00000100
  TransferBuffer       = 00000000
  TransferBufferMDL    = 81ac92e0
  UrbLink              = 00000000
[548965 ms] UsbSnoop - MyInternalIOCTLCompletion(f8917db0) : fido=81b964f0, Irp=81c21570, Context=822f3898, IRQL=2
[548965 ms]  <<<  URB 662 coming back  <<< 
-- URB_FUNCTION_BULK_OR_INTERRUPT_TRANSFER:
  PipeHandle           = 82300ef4 [endpoint 0x00000081]
  TransferFlags        = 00000003 (USBD_TRANSFER_DIRECTION_IN, USBD_SHORT_TRANSFER_OK)
  TransferBufferLength = 00000007
  TransferBuffer       = 00000000
  TransferBufferMDL    = 81ac92e0
    00000000: 00 00 00 02 05 e0 00
  UrbLink              = 00000000
[549004 ms] UsbSnoop - DispatchAny(f8916610) : IRP_MJ_INTERNAL_DEVICE_CONTROL
[549004 ms] UsbSnoop - MyDispatchInternalIOCTL(f8917e80) : fdo=822eee08, Irp=81c21570, IRQL=2
[549004 ms]  >>>  URB 663 going down  >>> 
-- URB_FUNCTION_BULK_OR_INTERRUPT_TRANSFER:
  PipeHandle           = 82300f14 [endpoint 0x00000002]
  TransferFlags        = 00000000 (USBD_TRANSFER_DIRECTION_OUT, ~USBD_SHORT_TRANSFER_OK)
  TransferBufferLength = 00000404
  TransferBuffer       = 00000000
  TransferBufferMDL    = 81ac92e0
    00000000: 00 00 03 ff 03 ff 00 00 00 19 ff e0 ff fe 00 00
    00000010: 00 09 ff e0 ff fc 00 00 00 00 7f e0 ff fc 00 00
    00000020: 00 00 7f e0 ff fc 00 00 00 00 1f e0 ff f8 00 00
    00000030: 00 04 1f e0 ff f8 00 00 00 06 1f e0 ff f0 00 00
    00000040: 00 03 9f e0 ff f0 00 00 00 03 ff e0 ff f0 00 00
    00000050: 00 00 77 e0 ff f0 00 00 00 00 77 e0 ff f0 00 00
    00000060: 00 00 3f e0 ff e0 00 00 00 00 1f e0 ff c0 00 f0
    00000070: 00 00 9f e0 ff f8 05 fe 00 00 0f e0 ff ff 07 c3
    00000080: 00 08 1f e0 ff f7 c3 01 80 03 4f e0 ff e7 c3 72
    00000090: c0 03 87 e0 ff ff c1 ff 40 03 27 e0 ff ff c0 ff
    000000a0: e0 06 73 e0 ff fc 40 00 60 04 db e0 ff fc 00 00
    000000b0: 00 03 9b e0 ff e1 00 00 00 03 83 e0 ff cf 00 00
    000000c0: 00 01 c3 e0 ff c4 00 00 00 00 43 e0 ff e0 00 00
    000000d0: 00 00 07 e0 ff f0 00 80 00 00 07 e0 ff e3 cf c0
    000000e0: 00 02 27 e0 ff e3 ff 80 00 00 6f e0 ff e3 fa 20
    000000f0: 00 00 0f e0 ff fc f0 20 00 00 1f e0 ff fc 60 00
    00000100: 00 00 3f e0 ff f8 40 00 00 04 3f e0 ff f1 40 00
    00000110: 00 06 7f e0 ff e1 fc 00 00 03 ff e0 ff e7 fc 80
    00000120: 00 03 ff e0 ff cf 80 80 00 03 ff e0 ff cf fe c0
    00000130: 00 01 ff e0 ff ef fe 00 00 01 ff e0 ff f3 fe 00
    00000140: 00 01 ff e0 ff ff f7 00 01 00 ff e0 ff fe 00 00
    00000150: 02 00 7f e0 ff fe 00 00 02 00 7f e0 ff fe 00 07
    00000160: e4 00 7f e0 ff ff 80 1f fc 00 7f e0 ff ff ff ff
    00000170: e0 01 ff e0 ff ff ff fe 00 43 ff e0 ff ff ff c0
    00000180: 00 8f ff e0 ff ff ff c0 00 3f ff e0 ff ff ff c0
    00000190: 00 7f ff e0 ff ff ff e0 61 ff ff e0 ff ff ff f3
    000001a0: c7 ff ff e0 ff ff bf f6 1f ff ff e0 ff ff 3e 78
    000001b0: 3f ff ff e0 ff ff ff e0 ff ff ff e0 ff ff ff f1
    000001c0: ff 77 ff e0 ff ff 3f fb ff df ff e0 ff fe 7f 8f
    000001d0: ff ff ff e0 ff fc ff 1f fe f3 bf e0 ff fd fe 3f
    000001e0: fd ff ff e0 ff f9 fc 7f ff ff ff e0 ff fb 78 df
    000001f0: ee fb ef e0 ff fb e3 ff df d3 ff 60 ff ff c7 ff
    00000200: d7 f6 fd e0 ff ff 9f bf ff ef e7 e0 ff ff bf bf
    00000210: ef fe fd c0 df 02 0b 00 4a 00 38 00 00 1e 3f ff
    00000220: ff 80 00 00 1c 3f ff ff c0 00 00 1c ff ff ff c0
    00000230: 00 00 1f cf ff ff c1 00 00 38 00 ff ff c0 00 00
    00000240: e0 00 ff ff c0 00 01 e0 00 73 ff c0 00 03 00 00
    00000250: 3f ff c0 80 06 00 00 06 7f c0 c0 04 00 00 04 3f
    00000260: c0 c0 00 00 00 02 9f c0 e0 10 00 00 07 9f 80 e0
    00000270: 10 00 00 07 cf cc e0 20 00 00 03 8f f8 e0 20 00
    00000280: 00 07 8f f8 e0 00 00 00 07 9f f8 e0 40 00 00 07
    00000290: df fc e0 40 00 00 07 ff ff c0 c0 00 00 07 ff ff
    000002a0: c0 80 00 00 07 df ff c0 80 00 00 07 ff ff c0 80
    000002b0: 00 00 07 ff ff c0 80 00 00 0f ff ff c0 80 00 00
    000002c0: 07 ff ff c0 c0 00 00 07 ff ff c0 c0 00 00 07 ff
    000002d0: ff c0 e0 00 00 07 ff ff c0 e0 00 00 07 ff ff c0
    000002e0: e0 00 00 0f ff ff c0 e0 30 07 1f ff ff c0 e0 3c
    000002f0: 3f 7f ff ff c0 e3 fc 3c ff ff ff 60 c2 20 30 1c
    00000300: 7f ff 20 c0 10 30 00 7f ff 00 c0 00 30 00 7f e7
    00000310: 00 e0 00 30 00 ff e7 04 e0 00 18 00 ff e1 04 e0
    00000320: 00 18 00 ff c0 00 c0 00 34 01 ff c1 00 c0 00 26
    00000330: 01 ff c3 00 80 00 3e 01 ff c1 00 80 0c 7e 03 ff
    00000340: d9 00 00 47 fe 03 ff df 00 00 c1 f8 03 fd ff 00
    00000350: 01 c0 00 03 ff ff 00 01 00 00 c3 fd ff 00 00 60
    00000360: 03 c3 ff ff 00 00 1f ff c3 ff ff 00 00 00 06 06
    00000370: ff ff 00 00 00 00 04 ff ff 00 00 00 02 05 ff ff
    00000380: 00 00 00 04 0d ff ff 00 00 00 00 0f ff ff 00 00
    00000390: 00 00 1f ff ff 00 00 00 00 1f ff ff 00 00 00 00
    000003a0: 3f ff ff 00 00 c0 00 7f ff ff 00 01 c0 00 ff ff
    000003b0: ff 00 3f c0 03 ff ff ff 0f ff c0 07 ff ff ff ff
    000003c0: ff c7 ff ff 3f ff ff ff c1 ff fc 3f ff ff ff c0
    000003d0: ff f0 7f ff ff ff c0 7f c0 ff ff ff ff c0 3e 00
    000003e0: ff ff ff ff c0 10 01 ff ff ff ff c0 00 03 ff ff
    000003f0: ff ff c0 78 07 ff ff ff ff c0 f8 0f ff ff ff ff
    00000400: c3 fc 0f ff
  UrbLink              = 00000000
[549016 ms] UsbSnoop - MyInternalIOCTLCompletion(f8917db0) : fido=81b964f0, Irp=81c21570, Context=81c3bfe8, IRQL=2
[549016 ms]  <<<  URB 663 coming back  <<< 
-- URB_FUNCTION_BULK_OR_INTERRUPT_TRANSFER:
  PipeHandle           = 82300f14 [endpoint 0x00000002]
  TransferFlags        = 00000000 (USBD_TRANSFER_DIRECTION_OUT, ~USBD_SHORT_TRANSFER_OK)
  TransferBufferLength = 00000404
  TransferBuffer       = 00000000
  TransferBufferMDL    = 81ac92e0
  UrbLink              = 00000000
[549024 ms] UsbSnoop - DispatchAny(f8916610) : IRP_MJ_INTERNAL_DEVICE_CONTROL
[549024 ms] UsbSnoop - MyDispatchInternalIOCTL(f8917e80) : fdo=822eee08, Irp=81c21570, IRQL=2
[549024 ms]  >>>  URB 664 going down  >>> 
-- URB_FUNCTION_BULK_OR_INTERRUPT_TRANSFER:
  PipeHandle           = 82300ef4 [endpoint 0x00000081]
  TransferFlags        = 00000003 (USBD_TRANSFER_DIRECTION_IN, USBD_SHORT_TRANSFER_OK)
  TransferBufferLength = 00000100
  TransferBuffer       = 00000000
  TransferBufferMDL    = 81ac92e0
  UrbLink              = 00000000
[549024 ms] UsbSnoop - MyInternalIOCTLCompletion(f8917db0) : fido=81b964f0, Irp=81c21570, Context=81d30f40, IRQL=2
[549024 ms]  <<<  URB 664 coming back  <<< 
-- URB_FUNCTION_BULK_OR_INTERRUPT_TRANSFER:
  PipeHandle           = 82300ef4 [endpoint 0x00000081]
  TransferFlags        = 00000003 (USBD_TRANSFER_DIRECTION_IN, USBD_SHORT_TRANSFER_OK)
  TransferBufferLength = 00000007
  TransferBuffer       = 00000000
  TransferBufferMDL    = 81ac92e0
    00000000: 00 00 00 02 05 e0 00
  UrbLink              = 00000000
[549064 ms] UsbSnoop - DispatchAny(f8916610) : IRP_MJ_INTERNAL_DEVICE_CONTROL
[549064 ms] UsbSnoop - MyDispatchInternalIOCTL(f8917e80) : fdo=822eee08, Irp=81c21570, IRQL=2
[549064 ms]  >>>  URB 665 going down  >>> 
-- URB_FUNCTION_BULK_OR_INTERRUPT_TRANSFER:
  PipeHandle           = 82300f14 [endpoint 0x00000002]
  TransferFlags        = 00000000 (USBD_TRANSFER_DIRECTION_OUT, ~USBD_SHORT_TRANSFER_OK)
  TransferBufferLength = 00000404
  TransferBuffer       = 00000000
  TransferBufferMDL    = 81ac92e0
    00000000: 00 00 03 ff 03 ff ff ff c3 fc 1f ff ff ff ff c7
    00000010: fc 3f ff ff ff ff cf fc 3f ff ff ff ff cf f8 7f
    00000020: ff ff df 02 55 00 4a 00 3a ff ff ff ff ff ff ff
    00000030: c0 ff ff ff ff ff ff ff c0 ff ff ff ff 3f ff ff
    00000040: c0 ff ff fe 40 03 ff ff c0 ff ff f8 00 00 ff ff
    00000050: c0 ff ff e0 00 00 3f ff c0 ff ff c0 00 00 3f ff
    00000060: c0 ff ff 00 00 00 7f ff c0 ff fe 00 00 00 3f ff
    00000070: c0 ff fc 00 00 00 1b ff c0 ff f8 00 00 00 0d ff
    00000080: c0 ff f0 00 00 00 05 ff c0 ff e0 00 00 00 1d ff
    00000090: c0 ff e0 00 00 00 05 ff c0 ff c8 00 00 00 06 ff
    000000a0: c0 ff c0 00 00 00 03 7f c0 ff 90 00 00 00 03 7f
    000000b0: c0 ff 80 00 00 00 03 7f c0 ff 80 00 00 00 01 ff
    000000c0: c0 ff 80 00 00 00 05 ff c0 ff 00 00 00 00 03 ff
    000000d0: c0 fe 00 00 01 c0 1f ff c0 fe 01 00 07 e1 3d ff
    000000e0: c0 f8 00 00 08 10 ff ff c0 f0 00 00 12 00 c7 ff
    000000f0: c0 f0 00 00 0f 00 bf ff c0 f0 00 00 06 40 7d ef
    00000100: c0 f0 00 80 00 00 85 fa c0 f7 08 00 00 00 c4 ff
    00000110: c0 fb e4 00 00 00 40 ff c0 ff fa 00 00 00 40 ff
    00000120: c0 ff df 00 00 00 60 ff c0 ff fd 30 00 00 60 ff
    00000130: c0 ff fc 60 00 00 60 ff c0 ff ee 28 00 00 41 ff
    00000140: c0 ff f6 30 00 00 23 ff c0 ff ef f0 00 1c 62 ff
    00000150: c0 ff f3 c0 00 0f e0 ff c0 ff f3 80 00 03 e1 ff
    00000160: c0 ff df 80 00 00 e1 ff c0 fe ff 80 00 00 63 ff
    00000170: c0 f7 ff 00 00 89 e3 7f c0 fb ff 00 02 07 93 ff
    00000180: c0 ef fe 80 00 00 03 ff c0 ff fc c4 00 00 0f ff
    00000190: c0 ff fd c2 00 00 2f ff c0 ff fc e1 00 00 6f ff
    000001a0: c0 ef fa e1 80 00 0d ff c0 bf fb e0 80 00 1f ff
    000001b0: c0 cf fb e0 58 00 3f ff c0 bf f3 70 26 00 7f ff
    000001c0: c0 df f3 50 3b 80 ef ff c0 e7 e7 78 1f ff ff ff
    000001d0: c0 df e7 f8 0f 7f f7 ff c0 ef ef 78 07 ff fb ff
    000001e0: c0 2f ef fc 03 ff fd ff c0 f7 ef fe 00 ff fe 7f
    000001f0: c0 b7 df be 00 ff ff 9f c0 f7 9f ff 00 3f ff ef
    00000200: c0 ef 9f ff 00 07 ff f7 c0 ee 5f ff 80 01 ff fb
    00000210: c0 f8 3f ff c0 00 7f ff c0 f0 5f ff c0 00 3f ff
    00000220: c0 c5 ff ff e0 00 3f ff c0 9f ff ff f0 00 3f ff
    00000230: c0 77 ff ff f0 00 0f ff c0 ff ff ff f8 00 0f ff
    00000240: c0 ff ff ff fe 00 0f ff c0 ff ff ff ff 00 0f ff
    00000250: c0 ff ff ff ff 00 1f ff c0 ff ff ff ff 80 1f ff
    00000260: c0 ff ff ff ff 80 0f ff c0 ff ff ff ff 80 06 fd
    00000270: c0 ff ff ff ff c0 06 ff c0 df 02 55 00 4a 00 3c
    00000280: 00 00 00 00 00 00 00 00 00 00 01 f8 00 00 00 00
    00000290: 00 00 0f f0 20 00 00 00 00 00 3f f0 00 00 00 00
    000002a0: 00 00 7f e0 00 00 00 00 00 00 ff e0 00 00 00 00
    000002b0: 00 03 ff e0 00 00 00 00 00 07 ef 00 00 00 00 00
    000002c0: 00 0f d4 c0 01 00 00 00 00 0f ca 00 00 80 00 00
    000002d0: 00 3f e0 00 00 0a 00 00 00 3f 80 00 00 2b 00 00
    000002e0: 00 7e 00 00 00 35 00 00 00 7c 00 00 00 0d 80 00
    000002f0: 00 78 00 00 00 05 80 00 00 70 00 00 00 07 80 00
    00000300: 00 78 00 00 00 07 c0 00 00 78 00 00 00 03 c0 00
    00000310: 00 7c 00 00 00 03 c0 00 00 7f 00 00 00 03 e0 00
    00000320: 00 7f 00 00 00 03 e0 00 00 7f 80 00 00 00 e0 00
    00000330: 00 7d 00 00 00 00 c0 00 00 7c 00 00 00 00 40 00
    00000340: 00 78 00 00 00 00 00 00 00 7e 00 00 00 00 00 00
    00000350: 00 70 06 00 00 00 10 00 00 70 02 9f f8 00 38 00
    00000360: 00 7f 60 7f 0c 00 30 00 00 7f f1 fc 00 00 00 00
    00000370: 00 7c f8 ff f0 01 00 00 00 3f f8 7f fc 01 00 00
    00000380: 00 7f f8 3c 00 00 80 00 00 3d 18 08 00 00 00 00
    00000390: 00 3c 10 00 00 00 00 00 00 3f 30 00 00 00 00 00
    000003a0: 00 3f 30 00 00 00 00 00 00 20 20 00 00 00 00 00
    000003b0: 00 70 20 00 00 00 00 00 00 78 60 08 00 00 00 00
    000003c0: 00 38 60 0c 00 00 00 00 00 3c 7d e6 00 00 40 00
    000003d0: 00 3e ff e2 00 00 c0 00 00 3f fe 03 00 00 c0 00
    000003e0: 00 3f fe 01 80 00 80 00 00 3f f8 00 80 00 80 00
    000003f0: 00 3f f0 00 40 00 00 00 00 1f fc fe 00 00 20 00
    00000400: 00 1f ff c3
  UrbLink              = 00000000
[549075 ms] UsbSnoop - MyInternalIOCTLCompletion(f8917db0) : fido=81b964f0, Irp=81c21570, Context=81c3bfe8, IRQL=2
[549075 ms]  <<<  URB 665 coming back  <<< 
-- URB_FUNCTION_BULK_OR_INTERRUPT_TRANSFER:
  PipeHandle           = 82300f14 [endpoint 0x00000002]
  TransferFlags        = 00000000 (USBD_TRANSFER_DIRECTION_OUT, ~USBD_SHORT_TRANSFER_OK)
  TransferBufferLength = 00000404
  TransferBuffer       = 00000000
  TransferBufferMDL    = 81ac92e0
  UrbLink              = 00000000
[549084 ms] UsbSnoop - DispatchAny(f8916610) : IRP_MJ_INTERNAL_DEVICE_CONTROL
[549084 ms] UsbSnoop - MyDispatchInternalIOCTL(f8917e80) : fdo=822eee08, Irp=81c21570, IRQL=2
[549084 ms]  >>>  URB 666 going down  >>> 
-- URB_FUNCTION_BULK_OR_INTERRUPT_TRANSFER:
  PipeHandle           = 82300ef4 [endpoint 0x00000081]
  TransferFlags        = 00000003 (USBD_TRANSFER_DIRECTION_IN, USBD_SHORT_TRANSFER_OK)
  TransferBufferLength = 00000100
  TransferBuffer       = 00000000
  TransferBufferMDL    = 81ac92e0
  UrbLink              = 00000000
[549085 ms] UsbSnoop - MyInternalIOCTLCompletion(f8917db0) : fido=81b964f0, Irp=81c21570, Context=81b4d110, IRQL=2
[549085 ms]  <<<  URB 666 coming back  <<< 
-- URB_FUNCTION_BULK_OR_INTERRUPT_TRANSFER:
  PipeHandle           = 82300ef4 [endpoint 0x00000081]
  TransferFlags        = 00000003 (USBD_TRANSFER_DIRECTION_IN, USBD_SHORT_TRANSFER_OK)
  TransferBufferLength = 00000007
  TransferBuffer       = 00000000
  TransferBufferMDL    = 81ac92e0
    00000000: 00 00 00 02 05 e0 00
  UrbLink              = 00000000
[549124 ms] UsbSnoop - DispatchAny(f8916610) : IRP_MJ_INTERNAL_DEVICE_CONTROL
[549124 ms] UsbSnoop - MyDispatchInternalIOCTL(f8917e80) : fdo=822eee08, Irp=81c21570, IRQL=2
[549124 ms]  >>>  URB 667 going down  >>> 
-- URB_FUNCTION_BULK_OR_INTERRUPT_TRANSFER:
  PipeHandle           = 82300f14 [endpoint 0x00000002]
  TransferFlags        = 00000000 (USBD_TRANSFER_DIRECTION_OUT, ~USBD_SHORT_TRANSFER_OK)
  TransferBufferLength = 00000404
  TransferBuffer       = 00000000
  TransferBufferMDL    = 81ac92e0
    00000000: 00 00 03 ff 03 00 0e 10 00 00 1f f2 00 00 1e 18
    00000010: 00 00 0f f0 00 00 fc 3c 00 00 0f ff c0 04 f8 3e
    00000020: 00 00 0f ff c0 19 f8 7f 00 00 07 f8 00 1f f0 7f
    00000030: 80 00 03 c0 00 1f e0 ff f0 00 03 c0 00 1f c0 ff
    00000040: f0 00 01 c0 00 7f 81 ff f0 00 00 f9 03 fe 03 ff
    00000050: f0 00 00 3f ff fc 03 ff f0 00 00 1f ff f8 07 ff
    00000060: f0 00 00 7f ff e0 0f ff f0 00 03 f7 ff 80 1f ff
    00000070: f0 00 0f f7 fe 00 3f ff f0 00 7f fb f0 00 3f ff
    00000080: f0 01 ff fb 40 00 7f ff f0 07 ff fa 00 00 ff ff
    00000090: f0 0f ff fb 00 00 ff ff f0 1f ff fb 00 01 ff ff
    000000a0: f0 3f ff fb 00 03 ff ff f0 7f ff fb 80 07 ff ff
    000000b0: f0 ff ff ff 80 07 ff ff f0 ff ff ff 80 0f ff ff
    000000c0: f0 ff ff ff 40 1f ff ff f0 ff ff ff 60 1f ff ff
    000000d0: f0 df 02 55 00 4a 00 39 00 00 00 00 00 00 00 00
    000000e0: 00 00 00 00 00 00 00 00 00 00 00 31 e0 00 00 00
    000000f0: 00 00 00 1d f8 00 00 00 00 00 04 07 fe 00 00 00
    00000100: 00 01 01 8f ff c0 00 00 00 00 18 7f ff f0 00 00
    00000110: 00 00 40 20 7f f8 00 00 00 10 00 00 1f ec 00 00
    00000120: 00 20 00 00 0f f6 00 00 00 20 00 00 0f fb 00 00
    00000130: 00 40 00 00 07 ff 80 00 00 40 00 00 07 ff 80 00
    00000140: 00 80 00 00 07 ff c0 00 00 00 00 00 03 ff 40 00
    00000150: 00 00 00 00 03 ff 60 00 00 00 00 00 01 ff a0 00
    00000160: 00 00 00 00 07 ff 80 00 01 00 00 00 01 ff c0 00
    00000170: 01 00 00 00 00 ff e0 00 01 00 00 00 03 ff e0 00
    00000180: 01 00 00 00 00 7f e0 00 01 00 00 00 03 7f e0 00
    00000190: 01 00 00 00 01 ff e0 00 01 00 00 00 00 ff e0 00
    000001a0: 01 00 00 00 1e 7f e0 00 01 00 00 03 ff 7f e0 00
    000001b0: 00 01 e0 03 f7 fd 60 00 00 86 78 05 f3 e1 e0 00
    000001c0: 00 00 fc 6b fc 0f cc 00 00 17 fc 1f bf f9 fc 00
    000001d0: 01 1f fc 15 bf ff fe 00 01 06 40 19 07 2f fe 00
    000001e0: 00 00 1c 1f e5 83 fe 00 00 80 3c 3a 8c 02 7c 00
    000001f0: 00 80 00 38 40 06 6c 00 00 80 00 3c 00 0f 28 00
    00000200: 00 80 00 36 00 1f 38 00 00 c0 00 38 00 3f 58 00
    00000210: 00 40 00 3e 00 7f f0 00 00 40 00 1b 00 ff a0 00
    00000220: 00 40 00 11 81 ff a0 00 00 40 14 1e c1 df 40 00
    00000230: 00 40 24 3f 81 9e c0 00 00 00 00 ff 01 9f 80 00
    00000240: 00 00 00 3e 21 9f 00 00 00 00 00 80 11 9f 00 00
    00000250: 00 20 00 01 d9 9f 00 00 00 20 10 0f f9 bf 00 00
    00000260: 00 00 37 ff e1 bf 00 00 00 10 00 00 81 bf 80 00
    00000270: 00 00 00 1f a3 ff 80 00 00 00 00 fc 63 ff c0 00
    00000280: 00 00 00 00 63 ff c0 00 00 00 00 00 47 ff f0 00
    00000290: 00 00 00 00 f7 ef fc 00 00 00 00 10 7f df fe 00
    000002a0: 00 00 40 03 ff 9f ff 00 00 01 e0 0f ff 3f ff 80
    000002b0: 00 03 f7 7f fe 7f ff 80 00 3f f1 ff f8 ff ff 80
    000002c0: 00 7f f0 ff f1 ff ff 80 03 ff f0 fb c1 ff ff 80
    000002d0: 0f ff f0 e7 83 ff ff 80 1f ff f0 ce 07 ff ff 80
    000002e0: 3f ff f0 70 0f ff ff 80 7f ff f7 00 1f ff ff 80
    000002f0: 7f ff e7 00 1f ff ff 80 ff ff ef 00 3f ff ff 80
    00000300: ff ff ff 00 7f ff ff 80 ff ff ff 80 ff ff ff 80
    00000310: ff ff ff 81 ff ff ff 80 ff ff ff 81 ff ff ff 80
    00000320: ff ff fe 83 ff ff ff 80 df 02 55 00 4a 00 40 ff
    00000330: ff ff ff ff ff ff ff ff ff ff ff ff ff ff ff ff
    00000340: ff ff ff ff bf ff ff ff ff ff ff fe f7 ff ff ff
    00000350: ff ff ff cb f9 ff ff ff ff ff ff bf fd ff ff ff
    00000360: ff fb ff ef 27 ff ff ff ff ee 40 08 79 ef ff ff
    00000370: ff 04 00 08 67 df ff ff fe 80 00 02 23 bb ff ff
    00000380: fe 20 00 00 5b ff ff ff fa 80 00 04 81 dd ed ff
    00000390: e5 00 00 00 12 7f af ff f9 00 00 00 06 5f 7f ff
    000003a0: f6 00 00 02 02 9f bf ff f4 00 00 00 00 7b ef ff
    000003b0: f8 00 00 00 07 4f 6b ff f8 00 00 00 33 ff cf ff
    000003c0: fc 00 00 00 00 3f e6 ff fa 00 00 00 04 6e e2 ff
    000003d0: fa 00 00 00 01 97 97 ff fc 00 00 00 19 2f 76 ff
    000003e0: f0 00 00 00 00 1d ef ff f0 00 00 00 04 73 75 ff
    000003f0: fe 00 e8 00 01 c3 f9 ff ff c3 fe 00 02 3d 8f ff
    00000400: 50 e1 01 80
  UrbLink              = 00000000
[549135 ms] UsbSnoop - MyInternalIOCTLCompletion(f8917db0) : fido=81b964f0, Irp=81c21570, Context=81c3bfe8, IRQL=2
[549136 ms]  <<<  URB 667 coming back  <<< 
-- URB_FUNCTION_BULK_OR_INTERRUPT_TRANSFER:
  PipeHandle           = 82300f14 [endpoint 0x00000002]
  TransferFlags        = 00000000 (USBD_TRANSFER_DIRECTION_OUT, ~USBD_SHORT_TRANSFER_OK)
  TransferBufferLength = 00000404
  TransferBuffer       = 00000000
  TransferBufferMDL    = 81ac92e0
  UrbLink              = 00000000
[549144 ms] UsbSnoop - DispatchAny(f8916610) : IRP_MJ_INTERNAL_DEVICE_CONTROL
[549144 ms] UsbSnoop - MyDispatchInternalIOCTL(f8917e80) : fdo=822eee08, Irp=81c21570, IRQL=2
[549144 ms]  >>>  URB 668 going down  >>> 
-- URB_FUNCTION_BULK_OR_INTERRUPT_TRANSFER:
  PipeHandle           = 82300ef4 [endpoint 0x00000081]
  TransferFlags        = 00000003 (USBD_TRANSFER_DIRECTION_IN, USBD_SHORT_TRANSFER_OK)
  TransferBufferLength = 00000100
  TransferBuffer       = 00000000
  TransferBufferMDL    = 81ac92e0
  UrbLink              = 00000000
[549145 ms] UsbSnoop - MyInternalIOCTLCompletion(f8917db0) : fido=81b964f0, Irp=81c21570, Context=81d30f40, IRQL=2
[549145 ms]  <<<  URB 668 coming back  <<< 
-- URB_FUNCTION_BULK_OR_INTERRUPT_TRANSFER:
  PipeHandle           = 82300ef4 [endpoint 0x00000081]
  TransferFlags        = 00000003 (USBD_TRANSFER_DIRECTION_IN, USBD_SHORT_TRANSFER_OK)
  TransferBufferLength = 00000007
  TransferBuffer       = 00000000
  TransferBufferMDL    = 81ac92e0
    00000000: 00 00 00 02 05 e0 00
  UrbLink              = 00000000
[549184 ms] UsbSnoop - DispatchAny(f8916610) : IRP_MJ_INTERNAL_DEVICE_CONTROL
[549184 ms] UsbSnoop - MyDispatchInternalIOCTL(f8917e80) : fdo=822eee08, Irp=81c21570, IRQL=2
[549185 ms]  >>>  URB 669 going down  >>> 
-- URB_FUNCTION_BULK_OR_INTERRUPT_TRANSFER:
  PipeHandle           = 82300f14 [endpoint 0x00000002]
  TransferFlags        = 00000000 (USBD_TRANSFER_DIRECTION_OUT, ~USBD_SHORT_TRANSFER_OK)
  TransferBufferLength = 00000404
  TransferBuffer       = 00000000
  TransferBufferMDL    = 81ac92e0
    00000000: 00 00 03 ff 03 00 8b 87 ff f4 62 24 80 02 f7 b6
    00000010: ff ff 32 da 40 01 65 e6 fe ff e1 3f 40 00 08 69
    00000020: fd fb 60 c8 80 04 f2 1d fe 78 00 42 00 00 96 e6
    00000030: fb 3e 40 34 01 00 08 76 f9 67 40 00 00 02 77 f6
    00000040: f4 b2 80 00 00 02 77 c4 fa b0 82 00 00 00 ff b6
    00000050: fc b0 81 00 00 02 fa e9 fc f0 8c 80 00 01 e1 72
    00000060: fb d0 de 40 00 03 cc d6 ff 30 f2 00 04 03 e9 ac
    00000070: ff d9 e0 20 02 07 eb 15 ff d9 ea 10 01 8f ea f6
    00000080: ff f9 60 00 00 37 ee 0d ff f8 ff c8 02 4f e0 62
    00000090: ff fc c8 60 01 9f ef ca ff fd 80 10 03 3f f7 b0
    000000a0: ff fd 20 18 02 3f fa 74 ff fc 9e 00 06 7f ff cf
    000000b0: ff fe cd 00 2c 7f ff f0 ff fe 60 01 98 ff fd e4
    000000c0: ff ff 00 0e 30 ff fc 36 ff ff c4 1f e1 ff fe b3
    000000d0: ff ff f3 7f c3 ff ff 13 ff ff f9 ff 83 ff ff 92
    000000e0: ff ff ff f7 07 ff fd 73 ff ff f8 fc 0f ff ff 9c
    000000f0: ff ff ff f8 1f ff ff c7 ff ff fd e0 3f ff ff f1
    00000100: ff ff fb 40 3f ff ff fc ff ff e0 00 ff ff ff ff
    00000110: ff ff a0 01 ff ff ff ff ff ff a4 03 ff ff ff ff
    00000120: ff ff c0 07 ff ff ff ff ff ff 80 0f ff ff ff ff
    00000130: ff ff 10 0f ff ff ff ff ff ff 24 8f ff ff ff ff
    00000140: ff fe 20 1f ff ff ff ff ff fc 94 7f ff ff ff ff
    00000150: ff fa 08 ff ff ff ff ff ff fe 09 ff ff ff ff ff
    00000160: ff fc 87 ff ff ff ff ff ff fc 67 ff ff ff ff ff
    00000170: ff f8 2f ff ff ff ff ff ff fc df ff ff ff ff ff
    00000180: df 02 0b 00 4a 00 37 ff ff ff ff ff ff fe ff ff
    00000190: ff ff ff ff fe ff ff ff ff ff ff fe ff ff ff ff
    000001a0: ff ff fe ff ff ff ff ff ff fe ff ff fe 03 ff ff
    000001b0: fe ff ff f8 00 7f ff fe ff ff c0 00 1f ff fe ff
    000001c0: ff 80 00 0f ff fe ff ff 00 00 0f ff fe ff fe 00
    000001d0: 00 07 ff fe ff fc 00 00 07 f7 fe ff f8 00 00 03
    000001e0: f7 fe ff f8 00 00 03 fb fe ff f0 00 00 07 fb fe
    000001f0: ff f0 00 00 01 fb fe ff f0 00 00 03 fb fe ff d0
    00000200: 00 00 03 7f fe ff d0 00 00 07 ff fe ff d0 00 00
    00000210: 07 ff fe ff e8 00 00 07 ff fe ff e3 00 07 0f ff
    00000220: fe ff e6 c0 1e ff ff fe ff e4 30 78 3f ff fe ff
    00000230: f1 18 7f 1f ff fe ff e3 c8 f0 df ff fe ff f7 e0
    00000240: c7 bf ff fe ff f4 c0 d7 db ff fe ff f0 00 c0 c7
    00000250: ff fe ff f0 00 60 03 ff fe ff e0 01 00 07 ff fe
    00000260: ff e0 00 00 07 ff fe ff e0 01 00 03 ff fe ff c0
    00000270: 02 80 07 ff be ff f0 02 40 0f ff be ff e0 37 e0
    00000280: 1f ff fe ff c0 3f e0 7f ff fe ff d8 07 80 6f ff
    00000290: fe ff c8 03 00 7e ff fe ff c8 00 00 35 ff fe ff
    000002a0: e0 00 00 09 ff fe ff e0 7f fc 41 ff fe ff e0 00
    000002b0: 04 43 ff fe ff f8 00 20 07 ff fe ff f4 00 00 9f
    000002c0: cf fe ff f4 00 00 ff 9f fe ff f2 00 01 fc 7f fe
    000002d0: ff f9 80 03 f1 ff fe ff fc 40 0f e7 ff fe ff ff
    000002e0: 30 7f 3f ff fe ff ff df fc 7f ff fe ff ff cf bf
    000002f0: ef ff ee ff ff 23 ff db ff fe ff ff 80 00 07 ff
    00000300: fe ff ff 00 00 3d ff fe ff ff 80 03 83 ff fe ff
    00000310: f9 80 10 0f ff fe ff f0 c0 00 3f ff fe ff f0 00
    00000320: 00 ff ff fe ff f0 00 01 ff ff fe ff f0 00 07 ff
    00000330: ff fe ff f8 40 0f ff ff fe ff f8 40 3f ff ff fe
    00000340: ff f9 b0 7f ff ff fe ff fe 00 ff ff ff fe ff f0
    00000350: 01 ff ff ff fe ff f8 03 ff ff ff fe ff fc 07 ff
    00000360: ff ff fe ff fc 0f ff ff ff fe ff fc 1f ff ff ff
    00000370: fe ff fe 3f ff ff ff fe ff fe 7f ff ff ff fe ff
    00000380: fe ff ff ff ff fe ff ff ff ff ff ff fe df 02 0b
    00000390: 00 4a 00 35 ff ff ff ff ef ff f8 ff ff ff f1 90
    000003a0: ff f8 ff ff ff e6 67 ff f8 ff ff f8 fa 06 ff f8
    000003b0: ff ff fb b0 00 7f f8 ff ff f7 c0 08 17 f8 ff ff
    000003c0: fe 00 30 3f f8 ff fe c0 00 00 0b f8 ff ff 80 00
    000003d0: 80 29 f8 ff ff 00 00 00 0d f8 ff fe 00 00 00 0d
    000003e0: f8 ff fc 00 00 00 10 f8 ff f8 00 00 00 10 78 ff
    000003f0: f2 00 00 00 23 f8 ff e4 00 00 00 07 f8 ff c4 00
    00000400: 00 00 07 78
  UrbLink              = 00000000
[549196 ms] UsbSnoop - MyInternalIOCTLCompletion(f8917db0) : fido=81b964f0, Irp=81c21570, Context=81c3bfe8, IRQL=2
[549196 ms]  <<<  URB 669 coming back  <<< 
-- URB_FUNCTION_BULK_OR_INTERRUPT_TRANSFER:
  PipeHandle           = 82300f14 [endpoint 0x00000002]
  TransferFlags        = 00000000 (USBD_TRANSFER_DIRECTION_OUT, ~USBD_SHORT_TRANSFER_OK)
  TransferBufferLength = 00000404
  TransferBuffer       = 00000000
  TransferBufferMDL    = 81ac92e0
  UrbLink              = 00000000
[549204 ms] UsbSnoop - DispatchAny(f8916610) : IRP_MJ_INTERNAL_DEVICE_CONTROL
[549204 ms] UsbSnoop - MyDispatchInternalIOCTL(f8917e80) : fdo=822eee08, Irp=81c21570, IRQL=2
[549205 ms]  >>>  URB 670 going down  >>> 
-- URB_FUNCTION_BULK_OR_INTERRUPT_TRANSFER:
  PipeHandle           = 82300ef4 [endpoint 0x00000081]
  TransferFlags        = 00000003 (USBD_TRANSFER_DIRECTION_IN, USBD_SHORT_TRANSFER_OK)
  TransferBufferLength = 00000100
  TransferBuffer       = 00000000
  TransferBufferMDL    = 81ac92e0
  UrbLink              = 00000000
[549205 ms] UsbSnoop - MyInternalIOCTLCompletion(f8917db0) : fido=81b964f0, Irp=81c21570, Context=81b4d110, IRQL=2
[549205 ms]  <<<  URB 670 coming back  <<< 
-- URB_FUNCTION_BULK_OR_INTERRUPT_TRANSFER:
  PipeHandle           = 82300ef4 [endpoint 0x00000081]
  TransferFlags        = 00000003 (USBD_TRANSFER_DIRECTION_IN, USBD_SHORT_TRANSFER_OK)
  TransferBufferLength = 00000007
  TransferBuffer       = 00000000
  TransferBufferMDL    = 81ac92e0
    00000000: 00 00 00 02 05 e0 00
  UrbLink              = 00000000
[549245 ms] UsbSnoop - DispatchAny(f8916610) : IRP_MJ_INTERNAL_DEVICE_CONTROL
[549245 ms] UsbSnoop - MyDispatchInternalIOCTL(f8917e80) : fdo=822eee08, Irp=81c21570, IRQL=2
[549245 ms]  >>>  URB 671 going down  >>> 
-- URB_FUNCTION_BULK_OR_INTERRUPT_TRANSFER:
  PipeHandle           = 82300f14 [endpoint 0x00000002]
  TransferFlags        = 00000000 (USBD_TRANSFER_DIRECTION_OUT, ~USBD_SHORT_TRANSFER_OK)
  TransferBufferLength = 00000404
  TransferBuffer       = 00000000
  TransferBufferMDL    = 81ac92e0
    00000000: 00 00 03 ff 03 ff c8 00 00 00 00 f8 ff 00 00 00
    00000010: 00 02 f8 fe 80 00 00 00 03 f8 ff 00 00 00 00 01
    00000020: f8 ff 00 00 00 00 05 f8 ff 20 00 00 00 07 78 fe
    00000030: 00 00 00 00 05 f8 fc 00 00 00 00 0f b8 f4 00 00
    00000040: 00 02 0b 38 fc 00 00 00 00 06 78 f8 00 00 00 00
    00000050: 07 f8 fc 05 80 00 00 17 f8 f8 0d 00 07 fc 37 f8
    00000060: f9 98 20 5b f8 4f f8 f8 08 00 7c e3 ff f8 fe 84
    00000070: 00 05 83 ff f8 fe c0 00 01 83 ff f8 fc 40 04 0f
    00000080: 03 37 f8 f0 60 00 02 03 ff b8 e0 22 02 00 02 ff
    00000090: f8 fa 1c 00 c0 03 bf f8 f6 e8 00 00 01 bf f8 ff
    000000a0: e0 00 01 01 7f f8 ff c0 00 03 00 7f f8 ff 84 00
    000000b0: 02 e1 6f f8 ff 82 00 04 73 ff f8 ff 80 00 00 1e
    000000c0: df f8 ff 80 00 00 3d ff f8 fd 80 00 16 0d ff f8
    000000d0: ff c0 08 1f ff bf f8 ff e0 04 10 7d 9f f8 ff f0
    000000e0: 00 20 19 1f f8 ff f8 00 00 fb 3f f8 f7 fc 00 00
    000000f0: 3b 7f f8 ff fe 00 00 0e ff f8 ff fe 00 00 07 ff
    00000100: f8 ff ff 00 c0 0d ff f8 ff ff 80 a0 0b ff f8 3f
    00000110: ff c0 90 5b ff f8 ff ff e0 2c 13 ff f8 ff ff f0
    00000120: 1f f3 7f f8 ff ff f0 00 63 7f f8 ff ff f8 00 03
    00000130: bf f8 ff ff fc 00 17 df f8 ff ff fe 00 87 ef f8
    00000140: ff ff ff 00 0f fb 78 ff ff ff 80 00 ff f8 ff ff
    00000150: ff 80 00 7f e8 ff ff ff c0 00 3f f8 ff ff ff e4
    00000160: 00 3f f8 ff ff ff e1 80 3f f8 ff ff ff f0 00 0f
    00000170: f8 ff ff ff f8 00 07 f8 ff ff ff fc 00 07 f8 ff
    00000180: ff ff fc 00 03 f8 ff ff ff fe 00 61 f8 ff ff ff
    00000190: ff 00 31 f8 ff ff ff ff 80 1f f8 df 02 55 00 4a
    000001a0: 00 39 fc 00 1d e7 00 04 c0 80 fc 00 1d e7 00 04
    000001b0: c0 80 fc 00 19 e7 00 04 c0 80 fc 00 18 1f 00 04
    000001c0: c1 80 fc 00 00 3f c0 04 c0 80 fc 00 07 ff f0 04
    000001d0: c0 80 fc 00 4f ff fc 04 c0 80 fc 01 ef ff ff 04
    000001e0: c0 00 fc 0f ff ff ff 84 c0 80 fc 1f ff ff ff c4
    000001f0: c0 80 fc 1f df ff ff e0 c0 00 fc 1f 0f ff ff f8
    00000200: c0 00 fc 3e 07 ff ff f8 c0 00 fe 3c 03 ff ff fc
    00000210: c0 00 fc 30 01 ff ff fc c0 00 fc 20 00 17 ff fe
    00000220: 80 00 fe 00 00 0f ff fe 80 00 fe 10 00 00 ff ff
    00000230: 80 00 7f 00 00 00 ff ff 80 00 7f 00 00 03 ff ff
    00000240: 80 00 7e 00 00 01 ff ff 80 00 7e 00 00 00 7f ff
    00000250: 80 00 7e 00 00 00 7f ff 80 00 3e 00 00 00 1f df
    00000260: 80 00 3e 00 00 00 0f ff 80 00 3e 00 00 00 1f ff
    00000270: c0 00 3e 00 02 00 3f ff c0 00 1f 40 02 40 7f ff
    00000280: c0 00 1f 41 f8 4f bf ff c0 00 1f 40 78 64 1f ff
    00000290: c0 00 1f c1 f0 7f ff ff c0 00 0f 06 f0 79 ff ff
    000002a0: c0 00 0f 80 00 f8 3f ff c0 00 0f 00 10 fc 3f ff
    000002b0: c0 00 0f 00 01 fe 7f ff 40 00 07 00 01 fe 7f ff
    000002c0: c0 00 07 00 01 f9 0f ff c0 00 07 80 01 f8 87 fd
    000002d0: 80 00 03 80 01 fc 07 fd 80 00 03 80 43 fe 07 ff
    000002e0: 80 00 07 c0 d3 ff 0f ff 80 00 03 c0 83 ff 9f ff
    000002f0: 00 00 07 c1 00 ff ff f7 00 00 03 c1 00 7f bf ff
    00000300: 00 00 07 c0 00 6f 9f fe 00 00 07 e0 00 ff df fe
    00000310: 00 00 03 e0 6b ff df fd 00 00 03 e0 60 7f df fd
    00000320: 00 00 03 e0 00 ff df f9 00 00 03 e0 00 3f ff f9
    00000330: 00 00 03 f0 00 3f ff f9 00 00 03 f0 00 7f ff f9
    00000340: 00 00 03 f8 00 ff ff f9 00 00 03 f8 00 07 ff f1
    00000350: 00 00 03 fc 00 07 ff f1 00 00 03 fe 00 07 ff f1
    00000360: 00 00 03 ff 00 0f ff f3 00 00 03 ff 00 3f ff e3
    00000370: 00 00 03 ff 0f ff ff c3 00 00 03 ff 0f ff ff 83
    00000380: 00 00 03 ff 03 ff ff 03 80 00 03 ff 03 bf fe 03
    00000390: c0 00 03 ff c1 df fc 03 e0 00 03 ff c0 cf f8 03
    000003a0: f0 00 03 ff c0 0f e0 03 f8 00 03 ff c0 07 c0 07
    000003b0: fc 00 83 ff c0 07 80 07 ff 00 81 ff c0 06 00 07
    000003c0: ff 80 81 ff c0 08 00 0f ff 80 87 ff 80 70 00 0f
    000003d0: ff 80 ff ff 80 f0 00 1f ff 80 ff ff 81 f8 00 1f
    000003e0: ff 80 ff ff 83 f8 00 3f ff 80 ff ff 07 f8 00 3f
    000003f0: ff 80 df 02 55 00 4a 00 3c ff ff ff ff ff ff ff
    00000400: f0 ff ff fe
  UrbLink              = 00000000
[549256 ms] UsbSnoop - MyInternalIOCTLCompletion(f8917db0) : fido=81b964f0, Irp=81c21570, Context=81c3bfe8, IRQL=2
[549256 ms]  <<<  URB 671 coming back  <<< 
-- URB_FUNCTION_BULK_OR_INTERRUPT_TRANSFER:
  PipeHandle           = 82300f14 [endpoint 0x00000002]
  TransferFlags        = 00000000 (USBD_TRANSFER_DIRECTION_OUT, ~USBD_SHORT_TRANSFER_OK)
  TransferBufferLength = 00000404
  TransferBuffer       = 00000000
  TransferBufferMDL    = 81ac92e0
  UrbLink              = 00000000
[549265 ms] UsbSnoop - DispatchAny(f8916610) : IRP_MJ_INTERNAL_DEVICE_CONTROL
[549265 ms] UsbSnoop - MyDispatchInternalIOCTL(f8917e80) : fdo=822eee08, Irp=81c21570, IRQL=2
[549265 ms]  >>>  URB 672 going down  >>> 
-- URB_FUNCTION_BULK_OR_INTERRUPT_TRANSFER:
  PipeHandle           = 82300ef4 [endpoint 0x00000081]
  TransferFlags        = 00000003 (USBD_TRANSFER_DIRECTION_IN, USBD_SHORT_TRANSFER_OK)
  TransferBufferLength = 00000100
  TransferBuffer       = 00000000
  TransferBufferMDL    = 81ac92e0
  UrbLink              = 00000000
[549265 ms] UsbSnoop - MyInternalIOCTLCompletion(f8917db0) : fido=81b964f0, Irp=81c21570, Context=81d30f40, IRQL=2
[549265 ms]  <<<  URB 672 coming back  <<< 
-- URB_FUNCTION_BULK_OR_INTERRUPT_TRANSFER:
  PipeHandle           = 82300ef4 [endpoint 0x00000081]
  TransferFlags        = 00000003 (USBD_TRANSFER_DIRECTION_IN, USBD_SHORT_TRANSFER_OK)
  TransferBufferLength = 00000007
  TransferBuffer       = 00000000
  TransferBufferMDL    = 81ac92e0
    00000000: 00 00 00 02 05 e0 00
  UrbLink              = 00000000
[549305 ms] UsbSnoop - DispatchAny(f8916610) : IRP_MJ_INTERNAL_DEVICE_CONTROL
[549305 ms] UsbSnoop - MyDispatchInternalIOCTL(f8917e80) : fdo=822eee08, Irp=81c21570, IRQL=2
[549305 ms]  >>>  URB 673 going down  >>> 
-- URB_FUNCTION_BULK_OR_INTERRUPT_TRANSFER:
  PipeHandle           = 82300f14 [endpoint 0x00000002]
  TransferFlags        = 00000000 (USBD_TRANSFER_DIRECTION_OUT, ~USBD_SHORT_TRANSFER_OK)
  TransferBufferLength = 00000404
  TransferBuffer       = 00000000
  TransferBufferMDL    = 81ac92e0
    00000000: 00 00 03 ff 03 01 ff ff ff f0 ff ff f2 00 07 ff
    00000010: ff f0 ff ff c0 00 03 ff ff f0 ff ff 00 00 01 ff
    00000020: ff f0 ff fe 00 00 00 ff ff f0 ff ff 80 00 00 7f
    00000030: ff f0 ff ff 00 00 00 07 ff f0 ff fc 00 00 00 03
    00000040: ff f0 ff f9 00 00 00 00 ff f0 ff fe 00 00 00 00
    00000050: ff f0 ff fc 00 00 00 01 7f f0 ff f8 00 00 00 00
    00000060: 3f f0 ff f8 00 00 00 00 bf f0 ff f0 00 00 00 00
    00000070: 5f f0 ff d0 00 00 00 01 6f f0 ff c0 00 00 00 01
    00000080: ff f0 ff a0 00 00 00 03 ff f0 ff c0 00 00 01 03
    00000090: ff f0 ff c0 00 00 00 03 ff f0 ff 80 00 00 01 43
    000000a0: fd f0 ff 80 00 00 13 3f fd f0 ff 20 00 00 0f 3f
    000000b0: fd f0 ff 00 00 00 04 9f f5 f0 ff 20 02 00 00 df
    000000c0: ff f0 ff 61 dd fc 20 9f fa f0 ff a3 ff ff f8 0f
    000000d0: f9 f0 ff a0 7e 7f 9e 0f fc b0 ff 40 fe 3f 83 87
    000000e0: fc 60 ff 83 dc 3f 79 c7 fe b0 ff 86 dc 3f 6f c3
    000000f0: f9 70 ff 00 28 7c b3 03 fc 70 ff 00 00 03 2c 07
    00000100: 7e d0 ff 80 20 51 e0 27 ce f0 ff 00 00 68 00 0f
    00000110: ee b0 ff 80 00 30 00 4b 74 f0 fe 00 10 38 00 7e
    00000120: fc a0 fe 80 10 0c 01 bc bd 70 ff 80 20 26 0b 5d
    00000130: 69 30 ff 00 33 fe 0e ee d9 20 ff 00 6f ff 0f dc
    00000140: d8 50 ff 00 c7 f3 8b cf 40 10 ff 02 c3 f9 fe d5
    00000150: 90 50 fd 01 83 fe e4 f6 e0 80 ff 07 1f ff 77 f7
    00000160: 80 00 fe 86 1f fd 9b f1 00 10 fd 08 ff fe 96 f9
    00000170: 40 00 ff 11 fb 3f 74 c2 80 00 ff a5 fe 7f ff 63
    00000180: 80 00 ff 8e ff ff ff 48 00 00 ff 97 ff 5f fb e8
    00000190: 80 00 fe 03 ac 97 fa 85 80 00 ff 83 99 d7 ff 43
    000001a0: 00 00 ff 0e 73 ff f7 e3 00 00 ff 8c c7 7f f6 f3
    000001b0: 40 00 ff 89 a6 5b bb 36 40 00 ff 0b 4d db fe ec
    000001c0: 60 00 ff 46 0a fd fe d8 60 00 ff e1 7f fe fe 90
    000001d0: f0 00 ff c3 8b cf ff c1 f8 00 ff 92 17 bd ff 03
    000001e0: fc 00 ff ec bf 73 be 07 fc 00 ff 09 a6 6d f8 0f
    000001f0: fe 00 fe 01 34 ff f0 1f ff 80 f0 0d 6c fb f0 3f
    00000200: ff e0 80 2c 19 7b c0 7f ff f0 00 4a 5f e7 80 7f
    00000210: ff f0 00 9e 7f fe 00 ff ff f0 69 3e ff fe 01 ff
    00000220: ff f0 d0 3e ff fe 03 ff ff f0 c0 3c ff ff 07 ff
    00000230: fd f0 e4 3d ff ff 8f ff fb f0 a8 3f ff ff ff ff
    00000240: ff f0 40 7f ff ff ff ff ff f0 df 02 55 00 4a 00
    00000250: 3a ff ff ff fc ff ff ff c0 ff ff ff f0 01 ff ff
    00000260: c0 ff ff fe 00 00 7f ff c0 ff fe 00 07 9d ff ff
    00000270: c0 ff f8 03 e2 ff ff ff c0 ff e0 3f ff 7f ff ff
    00000280: c0 ff cb ff ff ff ff ff c0 ff 9f ff ff ff ff ff
    00000290: c0 ff ab ff ff ff ff ff c0 fe 0f ff ff ff ff ff
    000002a0: c0 fe ef ff ff ff ff 3f c0 fe ff ff ff ff ff ff
    000002b0: c0 fd ff ff fe ff ff ff c0 f9 ff ff ff ff ff ff
    000002c0: c0 fb ff ff ff ff ff ff c0 ff ff ff ff ff ff ff
    000002d0: c0 ff ff ff ff ff ff ff c0 ff ff ff ff ff ff ff
    000002e0: c0 ff ff ff ff ff ff ff c0 ff ff ff ff ff ff ff
    000002f0: c0 ff ff ff ff 3f ff ff c0 ff ff ff f8 37 ff ff
    00000300: c0 ff 9f ff e0 4f ff ff c0 fe 00 00 00 0f ff ff
    00000310: c0 ff 00 00 00 1f ff ff c0 ff 00 00 00 1f ff ff
    00000320: c0 ff 00 00 00 1f ff ff c0 ff 00 00 00 1f ff ff
    00000330: c0 ff 00 00 00 1f ff ff c0 ff 80 00 00 1f ff ff
    00000340: c0 ff 80 00 00 3f ff ff c0 ff 80 00 00 1f ff ff
    00000350: c0 ff 80 00 08 1f ff ff c0 ff 80 00 7f ff ff ff
    00000360: c0 ff 8f c3 e0 7f ff fc c0 ff c1 e3 c0 3f ff f6
    00000370: c0 ff c7 e1 ff ff ff f6 c0 ff ff 63 a7 fd ff f3
    00000380: c0 ff 76 03 a0 70 ff f9 c0 ff 30 c3 ff c1 ff b1
    00000390: c0 ff 1f 01 c0 00 ff b1 c0 ff 00 40 80 01 ff b1
    000003a0: c0 ff 00 40 80 01 ff a1 c0 ff 00 01 c0 01 ff 85
    000003b0: c0 ff 00 00 60 01 ff cb c0 ff 00 00 74 03 ff c3
    000003c0: c0 ff 03 80 60 03 ff cf c0 ff 02 cf e0 03 ff 9f
    000003d0: c0 ff 00 7e 00 87 ff df c0 ff 84 0c 00 67 ff ff
    000003e0: c0 ff 80 00 00 01 ff ff c0 ff 80 00 00 40 3f ff
    000003f0: c0 ff 80 e0 7f c0 3f ff c0 ff 81 fa 00 02 3f ff
    00000400: c0 ff c0 00
  UrbLink              = 00000000
[549316 ms] UsbSnoop - MyInternalIOCTLCompletion(f8917db0) : fido=81b964f0, Irp=81c21570, Context=81c3bfe8, IRQL=2
[549316 ms]  <<<  URB 673 coming back  <<< 
-- URB_FUNCTION_BULK_OR_INTERRUPT_TRANSFER:
  PipeHandle           = 82300f14 [endpoint 0x00000002]
  TransferFlags        = 00000000 (USBD_TRANSFER_DIRECTION_OUT, ~USBD_SHORT_TRANSFER_OK)
  TransferBufferLength = 00000404
  TransferBuffer       = 00000000
  TransferBufferMDL    = 81ac92e0
  UrbLink              = 00000000
[549325 ms] UsbSnoop - DispatchAny(f8916610) : IRP_MJ_INTERNAL_DEVICE_CONTROL
[549325 ms] UsbSnoop - MyDispatchInternalIOCTL(f8917e80) : fdo=822eee08, Irp=81c21570, IRQL=2
[549325 ms]  >>>  URB 674 going down  >>> 
-- URB_FUNCTION_BULK_OR_INTERRUPT_TRANSFER:
  PipeHandle           = 82300ef4 [endpoint 0x00000081]
  TransferFlags        = 00000003 (USBD_TRANSFER_DIRECTION_IN, USBD_SHORT_TRANSFER_OK)
  TransferBufferLength = 00000100
  TransferBuffer       = 00000000
  TransferBufferMDL    = 81ac92e0
  UrbLink              = 00000000
[549325 ms] UsbSnoop - MyInternalIOCTLCompletion(f8917db0) : fido=81b964f0, Irp=81c21570, Context=81b4d110, IRQL=2
[549325 ms]  <<<  URB 674 coming back  <<< 
-- URB_FUNCTION_BULK_OR_INTERRUPT_TRANSFER:
  PipeHandle           = 82300ef4 [endpoint 0x00000081]
  TransferFlags        = 00000003 (USBD_TRANSFER_DIRECTION_IN, USBD_SHORT_TRANSFER_OK)
  TransferBufferLength = 00000007
  TransferBuffer       = 00000000
  TransferBufferMDL    = 81ac92e0
    00000000: 00 00 00 02 05 e0 00
  UrbLink              = 00000000
[549365 ms] UsbSnoop - DispatchAny(f8916610) : IRP_MJ_INTERNAL_DEVICE_CONTROL
[549365 ms] UsbSnoop - MyDispatchInternalIOCTL(f8917e80) : fdo=822eee08, Irp=81c21570, IRQL=2
[549365 ms]  >>>  URB 675 going down  >>> 
-- URB_FUNCTION_BULK_OR_INTERRUPT_TRANSFER:
  PipeHandle           = 82300f14 [endpoint 0x00000002]
  TransferFlags        = 00000000 (USBD_TRANSFER_DIRECTION_OUT, ~USBD_SHORT_TRANSFER_OK)
  TransferBufferLength = 00000404
  TransferBuffer       = 00000000
  TransferBufferMDL    = 81ac92e0
    00000000: 00 00 03 ff 03 00 00 3f ff c0 ff c0 00 14 02 3f
    00000010: ff c0 ff c0 00 70 06 7f ff c0 ff e0 00 00 04 7f
    00000020: ff c0 ff f0 00 00 04 ff ff c0 ff f2 00 00 0c ff
    00000030: ff c0 ff f8 00 00 0d ff ff c0 ff fd 00 00 19 fb
    00000040: ff c0 ff fe 00 00 3b f7 ff c0 ff ff 80 00 3f e7
    00000050: ff c0 ff ff 80 00 7f cf ff c0 ff ff c0 00 ff 9f
    00000060: ff c0 ff ff c0 01 ff 3f ff c0 ff ff e0 07 fc 6f
    00000070: ff c0 ff ff f8 7f f8 cf ff c0 ff ff ff ff f1 9f
    00000080: ff c0 ff ff ff ff e7 3f ff c0 ff ff fe 3f 8c 3f
    00000090: ff c0 ff ff fe 0c 18 7f ff c0 ff ff fe 00 40 7f
    000000a0: ff c0 df 02 0b 00 4a 00 37 ff ff ff ff ff ff fe
    000000b0: ff ff ff ff ff ff fe ff ff ff c1 ff ff fe ff ff
    000000c0: fe 00 3f ff fe ff ff f8 00 0f ff fe ff ff c0 00
    000000d0: 03 ff fe ff ff 80 00 09 ff fe ff ff 00 00 00 7f
    000000e0: fe ff fe 00 00 01 3f fe ff f8 00 00 00 9f fe ff
    000000f0: f0 00 00 00 4f fe ff f0 00 00 00 67 fe ff e0 00
    00000100: 00 00 27 fe fb e0 00 00 00 3b fe ff c0 00 00 00
    00000110: 3b fe ff c0 00 00 00 3d fe ff 80 00 00 00 7d fe
    00000120: ff 00 00 00 00 6f fe ff 00 00 00 00 36 fe ff 80
    00000130: 00 20 00 1f fe fe 00 00 0c 00 8f fe fe 00 00 cf
    00000140: 8b ff fe fe 80 00 3f 0f ff fe fe 00 02 7f 0f ff
    00000150: fe fd 00 01 ca 1f ff fe fd 80 00 24 0c 7f fe fe
    00000160: 89 20 04 0d 7f fe fe b0 20 08 0d 7f fe fc 00 30
    00000170: 00 0c ff fe fe 6c 30 00 06 3f fe fc b4 10 80 26
    00000180: bf fe fc 14 09 00 06 7f fe ff 64 c9 02 66 7f fe
    00000190: fc 02 a1 00 ee 7f fe fa 03 a0 00 9f 7f fe f6 1f
    000001a0: b0 00 0f ff fe fc 1f d8 00 01 ff fe f0 ff ee 07
    000001b0: ff ff fe f7 ff d4 07 3e ff fe ff ff 4f 08 05 ff
    000001c0: fe ff fe 47 00 7d bf fe ff fe c0 26 7f ff fe ff
    000001d0: fc c0 88 03 ff fe ff fc c0 64 27 ff fe ff ff c0
    000001e0: b8 0f ff fe ff ff 40 6f ff ff fe ff ff e0 17 ef
    000001f0: ff fe ff ff e0 0e 1f ff fe ff ff e0 03 9f ff fe
    00000200: ff ff f0 01 ff ff fe ff ff f0 00 7f ff fe ff ff
    00000210: f0 00 07 ff fe ff ff f8 00 05 ff fe ff ff f8 00
    00000220: 19 ff fe ff ff fc 00 03 ff fe ff ff fe 00 03 ff
    00000230: fe ff ff fe 00 03 ff fe ff ff ff 00 07 ff fe ff
    00000240: ff ff 80 07 ff fe ff ff ff 80 0f ff fe ff ff ff
    00000250: 80 0f ff fe ff ff ff c0 0f ff fe ff ff ff c4 0f
    00000260: ff fe ff ff ff c2 bf ff fe ff ff ff c2 6f ff fe
    00000270: ff ff ff c0 5f ff fe ff ff ff 81 1f ff fe ff ff
    00000280: ff c0 3f ff fe ff ff ff e0 7f ff fe ff ff ff e0
    00000290: 3f ff fe ff ff ff 60 3f ff fe ff ff ff f0 ff ff
    000002a0: fe ff ff ff f0 bf ff fe ff ff ff f0 7f ff fe df
    000002b0: 02 0b 00 4a 00 35 00 00 00 00 00 00 00 00 00 00
    000002c0: 00 00 00 00 00 00 00 00 00 00 00 00 00 31 20 00
    000002d0: 00 00 00 00 00 00 00 00 00 00 00 00 10 40 00 00
    000002e0: 00 00 00 10 20 00 00 00 08 00 20 1c 00 00 00 20
    000002f0: 00 20 06 00 00 00 60 00 a0 0f 80 00 00 40 01 01
    00000300: 37 c0 00 00 66 01 01 39 80 00 00 3c 00 00 74 c0
    00000310: 00 00 70 00 00 0d 80 00 00 c0 00 00 0d e0 00 00
    00000320: c0 00 00 05 b0 00 00 c0 00 00 17 d8 00 01 80 00
    00000330: 00 13 f8 00 03 80 00 00 1c 78 20 01 c0 00 00 00
    00000340: d0 80 01 80 00 00 01 b8 00 03 80 01 80 06 f8 20
    00000350: 03 00 0c 80 07 d8 70 07 70 10 00 05 19 d8 07 18
    00000360: 0f 00 07 3d 98 03 7c 08 60 0f 7c 38 07 ce 03 90
    00000370: 0f 8c 60 0f fe 09 c0 0f fc e8 0e e6 00 00 0f fc
    00000380: c8 0f f6 04 01 8f fd 98 07 64 00 01 b7 79 b8 0e
    00000390: 04 00 01 bf 78 78 07 1c 00 03 ff fb e0 07 3c 00
    000003a0: 03 fe 73 f8 01 ec 00 0f fc f7 d8 01 cc a0 0f f9
    000003b0: f7 98 01 cc 24 1f fb e7 98 01 cc e6 1e 6f e7 78
    000003c0: 00 df c2 1f dd f7 f8 00 df 01 0f fb f3 f8 00 f6
    000003d0: 00 01 f3 ff f8 00 fc 0c 01 f3 ff f8 00 df fe 33
    000003e0: e3 fb f8 00 c7 01 33 c3 f9 f8 00 4e 3d b3 83 fd
    000003f0: f8 10 7f e8 f3 07 fd f8 30 3d e4 96 07 fd f8 00
    00000400: 3f a4 3c 07
  UrbLink              = 00000000
[549376 ms] UsbSnoop - MyInternalIOCTLCompletion(f8917db0) : fido=81b964f0, Irp=81c21570, Context=81c3bfe8, IRQL=2
[549376 ms]  <<<  URB 675 coming back  <<< 
-- URB_FUNCTION_BULK_OR_INTERRUPT_TRANSFER:
  PipeHandle           = 82300f14 [endpoint 0x00000002]
  TransferFlags        = 00000000 (USBD_TRANSFER_DIRECTION_OUT, ~USBD_SHORT_TRANSFER_OK)
  TransferBufferLength = 00000404
  TransferBuffer       = 00000000
  TransferBufferMDL    = 81ac92e0
  UrbLink              = 00000000
[549386 ms] UsbSnoop - DispatchAny(f8916610) : IRP_MJ_INTERNAL_DEVICE_CONTROL
[549386 ms] UsbSnoop - MyDispatchInternalIOCTL(f8917e80) : fdo=822eee08, Irp=81c21570, IRQL=2
[549386 ms]  >>>  URB 676 going down  >>> 
-- URB_FUNCTION_BULK_OR_INTERRUPT_TRANSFER:
  PipeHandle           = 82300ef4 [endpoint 0x00000081]
  TransferFlags        = 00000003 (USBD_TRANSFER_DIRECTION_IN, USBD_SHORT_TRANSFER_OK)
  TransferBufferLength = 00000100
  TransferBuffer       = 00000000
  TransferBufferMDL    = 81ac92e0
  UrbLink              = 00000000
[549386 ms] UsbSnoop - MyInternalIOCTLCompletion(f8917db0) : fido=81b964f0, Irp=81c21570, Context=81d30f40, IRQL=2
[549386 ms]  <<<  URB 676 coming back  <<< 
-- URB_FUNCTION_BULK_OR_INTERRUPT_TRANSFER:
  PipeHandle           = 82300ef4 [endpoint 0x00000081]
  TransferFlags        = 00000003 (USBD_TRANSFER_DIRECTION_IN, USBD_SHORT_TRANSFER_OK)
  TransferBufferLength = 00000007
  TransferBuffer       = 00000000
  TransferBufferMDL    = 81ac92e0
    00000000: 00 00 00 02 05 e0 00
  UrbLink              = 00000000
[549425 ms] UsbSnoop - DispatchAny(f8916610) : IRP_MJ_INTERNAL_DEVICE_CONTROL
[549425 ms] UsbSnoop - MyDispatchInternalIOCTL(f8917e80) : fdo=822eee08, Irp=81c21570, IRQL=2
[549425 ms]  >>>  URB 677 going down  >>> 
-- URB_FUNCTION_BULK_OR_INTERRUPT_TRANSFER:
  PipeHandle           = 82300f14 [endpoint 0x00000002]
  TransferFlags        = 00000000 (USBD_TRANSFER_DIRECTION_OUT, ~USBD_SHORT_TRANSFER_OK)
  TransferBufferLength = 00000404
  TransferBuffer       = 00000000
  TransferBufferMDL    = 81ac92e0
    00000000: 00 00 03 ff 03 fd f8 00 1e 0c 68 0f fd f8 00 ce
    00000010: d9 f0 0f ff f8 00 83 4f e0 1f ff f8 00 63 cf 80
    00000020: 1f ff f8 41 27 ff 00 3f ff f8 11 8e fe 00 7f ff
    00000030: f8 60 ce 78 00 7f ff f8 e6 1e 00 00 ff ff f8 ff
    00000040: 3f 10 00 ff ff f8 fd e1 80 01 ff ff f8 de 41 20
    00000050: 03 ff ff f8 de c0 80 03 ff ff f8 ff 80 00 07 ff
    00000060: ff f8 ff 80 00 0f ff ff f8 ff 20 00 1f ff ff f8
    00000070: ff 60 00 3f ff ff f8 ff 60 00 7f ff ff f8 ff 60
    00000080: 00 ff ff ff f8 ff 42 00 ff ff ff f8 ff 00 09 ff
    00000090: ff ff f8 fe 80 07 ff ff ff f8 fc 00 0f ff ff ff
    000000a0: f8 fc 00 1f ff ff ff f8 fc 00 3f ff ff ff f8 fc
    000000b0: 00 7f ff ff ff f8 fe 00 ff ff ff ff f8 df 02 0b
    000000c0: 00 4a 00 35 ff ff ff ff bf ff f8 ff ff ff 69 ff
    000000d0: ff f8 ff ff ff 20 7f ff f8 ff ff 80 00 3f ff f8
    000000e0: ff fc d0 30 1b ff f8 ff f1 81 80 03 ff f8 ff fe
    000000f0: 00 00 01 7f f8 ff f8 00 00 01 ff f8 ff f0 00 00
    00000100: 61 bf f8 ff f0 00 00 00 7f f8 ff e0 00 00 00 37
    00000110: f8 ff c0 00 00 00 1b f8 ff c0 00 00 00 1f f8 ff
    00000120: c0 00 00 00 1f f8 ff c0 00 00 00 0f f8 ff c0 00
    00000130: 00 00 0f f8 ff 80 10 00 00 07 f8 ff 80 00 00 00
    00000140: 05 f8 ff 80 00 00 00 07 f8 ff 00 00 00 00 07 f8
    00000150: ff 00 00 00 00 26 f8 ff 00 00 00 e0 06 f8 ff 01
    00000160: 00 07 f2 5f f8 fe 08 30 07 dd fe f8 fe 5e 20 0f
    00000170: ed ff f8 fe 40 e0 3e c1 f7 f8 fe 10 60 33 81 df
    00000180: e8 fe a0 60 03 81 f7 f8 fc 80 c0 01 01 a6 b8 fc
    00000190: 00 20 04 00 97 f8 fa 04 48 00 00 a6 f8 fa 04 80
    000001a0: 00 00 87 f8 ff 24 24 00 40 8d b8 ff a2 40 00 80
    000001b0: 07 f0 ff 00 00 00 b8 ef e8 ff 08 00 01 3d ef f8
    000001c0: ff 04 40 02 07 2f f8 ff 82 c0 02 07 4f f8 ff 13
    000001d0: 00 04 04 0f f8 ff 92 00 00 00 0f f8 ff 32 00 01
    000001e0: ff 9f f8 ff a7 04 03 00 9e b8 ff 4b 01 80 1a 5f
    000001f0: f8 ff 4b c0 7c 7b 1e f8 ff 03 f0 00 0e 27 d8 fe
    00000200: 03 f8 00 01 67 f8 fc 1f fc 01 01 4f 78 f8 33 ff
    00000210: 01 01 1f 78 f0 67 ff 82 42 b7 e8 f0 df ff e1 00
    00000220: 9f 78 ff af ff f9 a3 c9 b8 ff ff ff ff ff e6 e8
    00000230: ff ff ff ff ff f7 d8 ff ff ff ff ff fb f8 ff ff
    00000240: ff ff ff f8 e8 fb ff ff ff ff ff 10 f7 ff ff ff
    00000250: ff ff 88 ff ff ff ff ff ff f0 ff ff ff ff ff ff
    00000260: f8 ff ff ff ff ff ff f8 ff ff ff ff fe 7f f8 ff
    00000270: ff ff ff fe 7f f8 ff ff ff ff fc 3f f8 ff ff fe
    00000280: 3f f8 1f f8 ff ff ff 07 e0 1f f8 ff ff ff 00 00
    00000290: 1f f8 ff ff ff 00 00 1f f8 ff ff ff 80 00 0f f8
    000002a0: ff ff ff c0 00 07 f8 ff ff ff c0 00 07 f8 ff ff
    000002b0: ff e0 00 07 f8 ff ff ff e0 00 03 f8 ff ff ff f0
    000002c0: 00 01 f8 ff ff ff f0 00 01 f8 df 02 0b 00 4a 00
    000002d0: 38 ff ff ff ff ff ff ff ff ff ff e1 ff ff ff ff
    000002e0: ff f9 0f e3 ff ff ff ff f0 39 e1 ff ff ff ff cf
    000002f0: f0 41 ff ff ff ff fb 80 26 3f ff ff ff c3 00 03
    00000300: cf ff ff ff f4 00 1d ff ff ff fe c0 00 00 9f ff
    00000310: ff fc 00 00 00 ff ff ff f8 00 00 00 7f ff ff f8
    00000320: c0 00 00 07 ff ff f3 c0 00 00 07 ff ff ff 00 00
    00000330: 00 0f ff ff fe 40 00 00 19 ff ff fc 40 00 00 1c
    00000340: ff ff fa 40 00 00 0c ff ff f6 40 00 00 1e 7f ff
    00000350: fd 00 0f 00 09 7d ff f8 00 3f c0 0c ff ff e3 80
    00000360: 44 cf e7 bf ff f7 80 de 0d f3 cf ff cc 00 73 0f
    00000370: dc df ff 21 40 00 0d 79 bb ff 23 60 00 00 7f 1f
    00000380: ff 0e 80 00 00 18 17 ff 80 c0 00 04 1e 3f ff 80
    00000390: 60 00 0c 18 6f ff 84 30 00 04 19 bf ff c0 10 00
    000003a0: 04 1f ff ff e0 08 00 00 2e df ff e0 80 00 c6 6f
    000003b0: ff fe f0 00 00 e4 fb ff ff 78 00 00 38 f7 ff ff
    000003c0: dc 00 00 39 ff fb ff ff 80 00 18 ff ff ff ff 80
    000003d0: 00 04 ff 79 ff ff 80 04 9c de 60 ff e7 00 19 7c
    000003e0: ff 1e ff ef 20 00 00 ff f3 ff fe 30 00 09 bf ee
    000003f0: ff fa 18 01 dd fe f0 ff fe 08 00 33 7f 6c ff fe
    00000400: 06 00 02 5f
  UrbLink              = 00000000
[549436 ms] UsbSnoop - MyInternalIOCTLCompletion(f8917db0) : fido=81b964f0, Irp=81c21570, Context=822f3898, IRQL=2
[549436 ms]  <<<  URB 677 coming back  <<< 
-- URB_FUNCTION_BULK_OR_INTERRUPT_TRANSFER:
  PipeHandle           = 82300f14 [endpoint 0x00000002]
  TransferFlags        = 00000000 (USBD_TRANSFER_DIRECTION_OUT, ~USBD_SHORT_TRANSFER_OK)
  TransferBufferLength = 00000404
  TransferBuffer       = 00000000
  TransferBufferMDL    = 81ac92e0
  UrbLink              = 00000000
[549445 ms] UsbSnoop - DispatchAny(f8916610) : IRP_MJ_INTERNAL_DEVICE_CONTROL
[549445 ms] UsbSnoop - MyDispatchInternalIOCTL(f8917e80) : fdo=822eee08, Irp=81c21570, IRQL=2
[549445 ms]  >>>  URB 678 going down  >>> 
-- URB_FUNCTION_BULK_OR_INTERRUPT_TRANSFER:
  PipeHandle           = 82300ef4 [endpoint 0x00000081]
  TransferFlags        = 00000003 (USBD_TRANSFER_DIRECTION_IN, USBD_SHORT_TRANSFER_OK)
  TransferBufferLength = 00000100
  TransferBuffer       = 00000000
  TransferBufferMDL    = 81ac92e0
  UrbLink              = 00000000
[549445 ms] UsbSnoop - MyInternalIOCTLCompletion(f8917db0) : fido=81b964f0, Irp=81c21570, Context=81c3bfe8, IRQL=2
[549445 ms]  <<<  URB 678 coming back  <<< 
-- URB_FUNCTION_BULK_OR_INTERRUPT_TRANSFER:
  PipeHandle           = 82300ef4 [endpoint 0x00000081]
  TransferFlags        = 00000003 (USBD_TRANSFER_DIRECTION_IN, USBD_SHORT_TRANSFER_OK)
  TransferBufferLength = 00000007
  TransferBuffer       = 00000000
  TransferBufferMDL    = 81ac92e0
    00000000: 00 00 00 02 05 e0 00
  UrbLink              = 00000000
[549485 ms] UsbSnoop - DispatchAny(f8916610) : IRP_MJ_INTERNAL_DEVICE_CONTROL
[549485 ms] UsbSnoop - MyDispatchInternalIOCTL(f8917e80) : fdo=822eee08, Irp=81c21570, IRQL=2
[549485 ms]  >>>  URB 679 going down  >>> 
-- URB_FUNCTION_BULK_OR_INTERRUPT_TRANSFER:
  PipeHandle           = 82300f14 [endpoint 0x00000002]
  TransferFlags        = 00000000 (USBD_TRANSFER_DIRECTION_OUT, ~USBD_SHORT_TRANSFER_OK)
  TransferBufferLength = 00000404
  TransferBuffer       = 00000000
  TransferBufferMDL    = 81ac92e0
    00000000: 00 00 03 ff 03 bc ff ff 01 00 06 ff 9b ff ff 81
    00000010: e0 1c ff bf ff ff 81 f0 38 fe e7 ff ff c0 1f fd
    00000020: 7f ad ff ff f0 07 fc 3f 7c ff ff dc 03 fd ff 78
    00000030: ff ff ef 83 f9 fb ce ff ff f7 ff f8 bf 6e ff ff
    00000040: f1 ff fd 67 fd ff ff e4 7f fc f7 ce f9 ff cf 3f
    00000050: fe 7e 32 e3 ff df 9f ff 7f f3 cf ff f8 ed ff 3f
    00000060: e0 bf ff f0 39 23 9e ec 7f ff e3 ff f1 cf f2 7f
    00000070: ff cf ff fc e7 77 ff ff ff ff de 70 fe ff ff fb
    00000080: b7 c3 bc 31 ff ff f7 33 4b df 0f ff ff fe 61 6c
    00000090: ff e3 ff bf fe c1 a2 ff f1 ff ff ff d0 a6 3f fc
    000000a0: fe ff fd 90 b7 b7 fe f9 ff fc e0 5f b7 ff fb ff
    000000b0: fc c0 5f 3f ff ff ff f3 00 5b 1f ff ff ff f0 20
    000000c0: 32 ff ff ff ff f8 60 30 ff ff ff ff f9 c0 2d ff
    000000d0: ff ff ff f9 e0 3f ef ff df 02 55 00 4a 00 3b ff
    000000e0: 07 ff ff ff c1 80 00 ff 07 ff ff ff e3 c0 00 ff
    000000f0: 07 ff f1 3f e3 80 00 ff 07 ff bb f7 e3 c0 00 ff
    00000100: 87 ff bf ff e3 c0 00 ff 87 ff 7f ff c3 c0 00 ff
    00000110: 84 ff 7f ff e3 c0 00 ff cf fe 07 7f f3 c0 00 ff
    00000120: df f8 02 7f fb c0 00 ff ff f8 00 1f fb c0 00 ff
    00000130: fe f0 00 3f fd c0 00 ff bb 60 00 07 ff c0 00 ff
    00000140: 70 60 00 0f ff c0 00 fe 40 00 00 03 ff c0 00 fe
    00000150: 40 00 00 06 ff 80 00 fc 00 00 00 07 ef 80 00 fc
    00000160: 00 00 00 01 61 c0 00 fc 00 00 00 0c 10 c0 00 fc
    00000170: 00 00 00 04 00 c0 00 fc 00 00 01 22 12 40 00 fc
    00000180: 00 00 00 05 86 00 00 fc 00 00 02 25 84 e0 00 fc
    00000190: 00 00 10 39 09 f0 00 f8 00 41 80 00 1b f8 00 f8
    000001a0: 01 82 00 00 13 60 00 f8 1e 00 00 00 16 60 00 fd
    000001b0: 00 40 1e 00 1e a8 00 fc 07 80 ff 80 1f c0 00 fd
    000001c0: 80 03 e3 c0 13 c0 00 fc 00 0f c0 c0 11 10 00 fe
    000001d0: 01 0f fe c0 30 10 00 fe 40 1f ff 80 b8 10 00 fe
    000001e0: fe 9f b0 00 f9 28 00 fe ff cf 80 00 39 08 00 ff
    000001f0: ff c0 f8 01 7a 40 00 fe 7f c0 f0 03 f4 00 00 ff
    00000200: 7f c0 78 07 f4 08 00 ff be 00 00 07 66 0c 00 ff
    00000210: d1 c0 00 1d e3 0c 00 ff d7 80 00 00 91 8d 00 ff
    00000220: ef 80 00 00 82 fe 80 ff e7 80 e0 00 82 fe e0 ff
    00000230: f1 00 38 00 06 b4 60 7f f0 00 0e 00 0e 94 60 00
    00000240: 36 00 67 9c 1f 98 60 00 04 07 e1 e4 0f 98 60 00
    00000250: 04 87 c0 36 3f 98 e0 00 06 ff 00 0e 3f 98 e0 00
    00000260: 03 ff 83 c6 7f 90 e0 00 01 ff df 63 3d b0 e0 00
    00000270: 01 ff 78 31 3d a0 e0 00 00 ff e0 19 3d 60 e0 00
    00000280: 00 ff 5c 1f 7b 41 e0 00 00 7e 7e 07 fb 41 e0 00
    00000290: 00 7f f0 07 fa 81 e0 00 00 3e e0 07 ff 81 e0 00
    000002a0: 00 3e 40 07 fd 01 e0 00 00 1f 00 0f fe 03 e0 00
    000002b0: 00 0e 00 3f fe 03 e0 00 00 03 0f ff fc 07 e0 00
    000002c0: 00 01 f7 ff f8 07 e0 00 00 00 ff ff f8 07 e0 00
    000002d0: 00 01 ff ff f0 07 e0 00 00 03 ff ff e0 07 e0 00
    000002e0: 00 0f ff ff c0 0f e0 00 00 1f ff ff c0 0f e0 00
    000002f0: 00 3f ff ff 80 0f e0 80 00 7f ff f9 80 0f e0 82
    00000300: 00 ff ff fd 80 0f e0 8e 01 ff ff fd e0 1f e0 1f
    00000310: 03 ff ff ff f0 1f e0 0f 07 ff ff ff f8 1f e0 07
    00000320: 0f ff ff ff fc 1f e0 07 9f ff ff ff f0 3f e0 df
    00000330: 02 55 00 4a 00 3e ff ff ff ff ff ff ff fc ff ff
    00000340: ff ff ff ff ff fc ff ff ff ff ff ff ff fc ff ff
    00000350: ff fe 9f ff ff fc ff ff ff 80 03 ff ff fc ff ff
    00000360: fe 00 01 ff ff fc ff ff f8 00 00 7f ff fc ff fe
    00000370: 40 00 00 3f ff fc ff f0 00 00 00 1f ff fc ff f0
    00000380: 00 00 00 0f ff fc ff e0 00 00 00 07 ff fc ff c0
    00000390: 00 00 00 07 ff fc ff c0 00 00 00 03 ff fc ff 00
    000003a0: 00 00 00 01 ff fc fe 00 00 00 00 00 ff fc ff 80
    000003b0: 00 00 00 00 7f fc ff 04 00 00 00 04 3f fc f2 00
    000003c0: 00 00 00 06 1f fc fc 00 30 00 00 00 0f fc f0 00
    000003d0: 20 00 00 03 03 fc f0 00 30 00 00 03 00 fc f0 40
    000003e0: 19 00 00 07 00 7c e0 a0 5b 00 00 07 00 1c c0 8c
    000003f0: 4a 7f 80 07 00 04 c0 70 46 f7 f2 01 80 24 c4 28
    00000400: 03 fe e1 c1
  UrbLink              = 00000000
[549496 ms] UsbSnoop - MyInternalIOCTLCompletion(f8917db0) : fido=81b964f0, Irp=81c21570, Context=822f3898, IRQL=2
[549496 ms]  <<<  URB 679 coming back  <<< 
-- URB_FUNCTION_BULK_OR_INTERRUPT_TRANSFER:
  PipeHandle           = 82300f14 [endpoint 0x00000002]
  TransferFlags        = 00000000 (USBD_TRANSFER_DIRECTION_OUT, ~USBD_SHORT_TRANSFER_OK)
  TransferBufferLength = 00000404
  TransferBuffer       = 00000000
  TransferBufferMDL    = 81ac92e0
  UrbLink              = 00000000
[549505 ms] UsbSnoop - DispatchAny(f8916610) : IRP_MJ_INTERNAL_DEVICE_CONTROL
[549505 ms] UsbSnoop - MyDispatchInternalIOCTL(f8917e80) : fdo=822eee08, Irp=81c21570, IRQL=2
[549505 ms]  >>>  URB 680 going down  >>> 
-- URB_FUNCTION_BULK_OR_INTERRUPT_TRANSFER:
  PipeHandle           = 82300ef4 [endpoint 0x00000081]
  TransferFlags        = 00000003 (USBD_TRANSFER_DIRECTION_IN, USBD_SHORT_TRANSFER_OK)
  TransferBufferLength = 00000100
  TransferBuffer       = 00000000
  TransferBufferMDL    = 81ac92e0
  UrbLink              = 00000000
[549505 ms] UsbSnoop - MyInternalIOCTLCompletion(f8917db0) : fido=81b964f0, Irp=81c21570, Context=81b4d110, IRQL=2
[549505 ms]  <<<  URB 680 coming back  <<< 
-- URB_FUNCTION_BULK_OR_INTERRUPT_TRANSFER:
  PipeHandle           = 82300ef4 [endpoint 0x00000081]
  TransferFlags        = 00000003 (USBD_TRANSFER_DIRECTION_IN, USBD_SHORT_TRANSFER_OK)
  TransferBufferLength = 00000007
  TransferBuffer       = 00000000
  TransferBufferMDL    = 81ac92e0
    00000000: 00 00 00 02 05 e0 00
  UrbLink              = 00000000
[549545 ms] UsbSnoop - DispatchAny(f8916610) : IRP_MJ_INTERNAL_DEVICE_CONTROL
[549545 ms] UsbSnoop - MyDispatchInternalIOCTL(f8917e80) : fdo=822eee08, Irp=81c21570, IRQL=2
[549545 ms]  >>>  URB 681 going down  >>> 
-- URB_FUNCTION_BULK_OR_INTERRUPT_TRANSFER:
  PipeHandle           = 82300f14 [endpoint 0x00000002]
  TransferFlags        = 00000000 (USBD_TRANSFER_DIRECTION_OUT, ~USBD_SHORT_TRANSFER_OK)
  TransferBufferLength = 00000404
  TransferBuffer       = 00000000
  TransferBufferMDL    = 81ac92e0
    00000000: 00 00 03 ff 03 80 1c c5 d0 41 ff e7 f1 80 1c f4
    00000010: e0 00 1b e3 df 00 9c ff e0 60 1f 03 fe 01 9c ff
    00000020: e0 00 46 03 7e 81 fc ff e0 c0 1e 03 1e c7 fc ff
    00000030: f3 e0 1c 03 7e e7 fc ff f6 e0 40 02 5e 63 fc ff
    00000040: f8 70 c0 03 66 39 fc ff e0 30 02 01 07 88 fc ff
    00000050: f0 80 0e 03 1f 00 fc ff c0 00 39 e7 1f 82 fc ff
    00000060: c0 00 30 7f 82 c1 fc ff c0 00 60 3e 87 1c fc ff
    00000070: e0 00 4c 3e cf e6 7c ff ec 01 1f 8c 46 0b fc ff
    00000080: fc 01 31 ff 42 0b fc ff f8 00 00 07 20 00 fc ff
    00000090: fc 00 01 d9 20 01 fc ff ff 02 00 1c 00 0b fc ff
    000000a0: ff 83 00 08 04 07 fc ff ff c1 c0 00 0c 0f fc ff
    000000b0: ff f0 e0 20 5f 0f fc ff ff fc 70 61 ff df fc ff
    000000c0: ff ff 9d 87 ff ff fc ff ff ff cf 9f ff ff fc ff
    000000d0: ff ff e7 fd ff ff fc ff ff ff f1 f7 ff ff fc ff
    000000e0: ff ff fe 0f ff ff fc ff ff ff ff ff ff ff fc ff
    000000f0: ff ff ff ff ff ff fc ff ff ff ff ff ff ff fc ff
    00000100: ff ff ff ff ff ff fc ff ff f1 ff fe ff ff fc ff
    00000110: ff f9 cf fe ff ff fc ff ff fc e6 6f ff ff fc ff
    00000120: ff fe 7e 7e ff ff fc ff ff ff 1f 7f ff ff fc ff
    00000130: ff ff 87 ff ff ff fc ff ff ff c1 ff ff ff fc ff
    00000140: ff ff e0 ff ff ff fc ff ff ff e0 00 7f ff fc ff
    00000150: ff ff f0 00 7f ff fc ff ff ff f8 00 7f ff fc ff
    00000160: ff ff f8 00 7f ff fc ff ff ff fc 00 ff ff fc ff
    00000170: ff ff fe 00 ff ff fc ff ff ff fe 00 ff ff fc ff
    00000180: ff ff ff 00 ff ff fc df 02 55 00 4a 00 3b 00 00
    00000190: 17 ff f3 9b ef 40 00 00 8e 00 1b ad e1 20 04 92
    000001a0: f0 00 0e 7f cd 20 30 01 00 00 03 f3 f7 80 00 83
    000001b0: 00 00 01 9f e3 80 0c 6e 00 00 00 7b df 60 23 88
    000001c0: 00 00 00 3f f6 a0 6b 98 00 00 00 1b f6 e0 4c db
    000001d0: 00 00 00 0e ff c0 10 d4 00 00 00 07 f7 20 13 65
    000001e0: c0 00 00 03 ff e0 82 79 f8 00 00 01 ef c0 08 eb
    000001f0: 00 00 00 00 fc e0 22 d3 80 00 00 00 fd e0 79 a3
    00000200: 00 00 00 00 7f e0 0b a3 00 00 00 01 37 e0 87 e3
    00000210: 80 00 00 00 fd c0 5b c3 40 00 00 00 df c0 2f d7
    00000220: 00 00 00 00 df e0 36 16 00 80 00 00 7f 00 5b a7
    00000230: 00 00 00 00 9f c0 cf 27 c0 00 00 00 9f a0 67 6e
    00000240: e0 00 00 00 17 e0 4a 4c 52 81 e0 00 7b c0 0b 8b
    00000250: 0c bf 90 40 43 e0 08 69 fe fe 18 60 d0 e0 cc 6e
    00000260: 1f 78 0c 60 ac e0 04 ee 0e 3f f4 20 15 20 80 ef
    00000270: fc 3d f8 22 09 20 12 7f ec 06 00 02 1a e0 16 3f
    00000280: 04 18 00 04 3b 20 1a 9d bc 0e 00 3d f6 a0 19 ac
    00000290: e8 07 00 0f e7 c0 dd 2c 48 00 00 87 6f 80 6c 6e
    000002a0: 18 20 21 17 cb e0 36 a6 18 30 07 05 4c 80 28 86
    000002b0: 38 18 04 26 4d 80 13 26 3f e8 00 00 d2 c0 b0 87
    000002c0: 3f e4 00 88 c2 40 00 57 7f e6 00 07 93 20 eb 27
    000002d0: ff 03 01 07 5d 00 b1 67 ff 01 80 27 68 60 39 a7
    000002e0: fd 08 80 26 b2 c0 89 b7 ff fe 62 65 ec 00 bc 97
    000002f0: fb 0f 20 7d e0 00 50 c3 f8 27 00 f9 4c c0 53 83
    00000300: ff e9 a0 f2 c4 00 63 43 ff 80 80 f6 68 00 92 13
    00000310: f8 00 03 c7 50 80 9a 03 f8 00 49 8f 08 00 21 13
    00000320: f8 00 27 0f a0 00 08 0b ff 00 24 1f 90 00 90 29
    00000330: ff f3 ec 1f d2 40 00 09 ff ff fc 3f e9 80 80 c6
    00000340: ff 7f b0 7f f2 80 0d 06 7f fc a0 ff f8 40 00 3f
    00000350: bf e8 43 ff fe 20 03 ff df 93 cf ff ff 80 3f ff
    00000360: ff df 9f ff ff c0 ff ff ff ff ff ff ff e0 ff ff
    00000370: ff ff ff ff ff e0 ff ff ff ff ff ff ff e0 ff ff
    00000380: ff ff ff ff ff e0 ff ff ff ff ff ff ff e0 ff ff
    00000390: ff ff ff ff ff e0 ff ff ff ff ff ff ff e0 ff ff
    000003a0: ff ff ff ff ff e0 ff ff 3f ff ff ff ff e0 ff fe
    000003b0: 7f ff ff ff ff e0 ff fe ff ff ff ff ff e0 ff ff
    000003c0: ff ff ff ff ff e0 ff ff f9 ff ff ff ff e0 ff ff
    000003d0: e0 03 ff ff ff e0 ff ff 80 01 ff ff ff e0 df 07
    000003e0: 44 e9 12 e4 00 e8 00 e8 04 e4 00 e8 03 e4 00 e8
    000003f0: 01 e4 00 e8 02 e4 00 e8 e5 7c e4 00 e8 e5 00 48
    00000400: 6f 6d 65 00
  UrbLink              = 00000000
[549556 ms] UsbSnoop - MyInternalIOCTLCompletion(f8917db0) : fido=81b964f0, Irp=81c21570, Context=81ba8040, IRQL=2
[549556 ms]  <<<  URB 681 coming back  <<< 
-- URB_FUNCTION_BULK_OR_INTERRUPT_TRANSFER:
  PipeHandle           = 82300f14 [endpoint 0x00000002]
  TransferFlags        = 00000000 (USBD_TRANSFER_DIRECTION_OUT, ~USBD_SHORT_TRANSFER_OK)
  TransferBufferLength = 00000404
  TransferBuffer       = 00000000
  TransferBufferMDL    = 81ac92e0
  UrbLink              = 00000000
[549565 ms] UsbSnoop - DispatchAny(f8916610) : IRP_MJ_INTERNAL_DEVICE_CONTROL
[549565 ms] UsbSnoop - MyDispatchInternalIOCTL(f8917e80) : fdo=822eee08, Irp=81c21570, IRQL=2
[549565 ms]  >>>  URB 682 going down  >>> 
-- URB_FUNCTION_BULK_OR_INTERRUPT_TRANSFER:
  PipeHandle           = 82300ef4 [endpoint 0x00000081]
  TransferFlags        = 00000003 (USBD_TRANSFER_DIRECTION_IN, USBD_SHORT_TRANSFER_OK)
  TransferBufferLength = 00000100
  TransferBuffer       = 00000000
  TransferBufferMDL    = 81ac92e0
  UrbLink              = 00000000
[549565 ms] UsbSnoop - MyInternalIOCTLCompletion(f8917db0) : fido=81b964f0, Irp=81c21570, Context=822f3898, IRQL=2
[549565 ms]  <<<  URB 682 coming back  <<< 
-- URB_FUNCTION_BULK_OR_INTERRUPT_TRANSFER:
  PipeHandle           = 82300ef4 [endpoint 0x00000081]
  TransferFlags        = 00000003 (USBD_TRANSFER_DIRECTION_IN, USBD_SHORT_TRANSFER_OK)
  TransferBufferLength = 00000007
  TransferBuffer       = 00000000
  TransferBufferMDL    = 81ac92e0
    00000000: 00 00 00 02 05 e0 00
  UrbLink              = 00000000
[549605 ms] UsbSnoop - DispatchAny(f8916610) : IRP_MJ_INTERNAL_DEVICE_CONTROL
[549605 ms] UsbSnoop - MyDispatchInternalIOCTL(f8917e80) : fdo=822eee08, Irp=81c21570, IRQL=2
[549605 ms]  >>>  URB 683 going down  >>> 
-- URB_FUNCTION_BULK_OR_INTERRUPT_TRANSFER:
  PipeHandle           = 82300f14 [endpoint 0x00000002]
  TransferFlags        = 00000000 (USBD_TRANSFER_DIRECTION_OUT, ~USBD_SHORT_TRANSFER_OK)
  TransferBufferLength = 00000404
  TransferBuffer       = 00000000
  TransferBufferMDL    = 81ac92e0
    00000000: 00 00 03 ff 03 2d 00 53 70 6c 69 74 20 31 20 41
    00000010: 70 70 00 2d 11 e3 00 e8 00 e8 00 65 78 69 74 6c
    00000020: 6f 6f 70 00 30 e4 00 e8 00 e8 00 20 61 6e 64 20
    00000030: 63 6c 65 61 72 20 65 76 65 72 79 74 68 69 6e 67
    00000040: 2e 00 00 e6 00 e8 00 20 41 74 20 65 78 69 74 2c
    00000050: 20 72 65 73 74 6f 72 65 20 73 65 74 74 69 6e 67
    00000060: 73 2c 20 67 6f 74 6f 20 66 75 6c 6c 20 73 63 72
    00000070: 65 65 6e 00 00 e6 00 e8 00 e8 a2 02 11 e4 00 e8
    00000080: 00 e8 00 e8 10 e4 00 e8 00 74 6f 70 64 69 73 70
    00000090: 00 2f e4 02 e8 00 63 6f 64 65 00 f0 00 63 70 00
    000000a0: f0 80 02 e8 10 e4 02 e8 00 63 6f 64 65 00 f0 0a
    000000b0: 01 1f 91 4f 00 63 6f 64 65 00 f0 80 04 e8 2b 01
    000000c0: 1f 00 63 6f 64 65 00 f0 89 3b e4 02 e8 0a 01 1f
    000000d0: 13 f0 89 00 1f 00 63 6f 64 65 00 f0 89 84 3b e4
    000000e0: 00 e8 00 e8 10 e4 00 e8 00 e8 10 e4 02 e8 00 63
    000000f0: 6f 64 65 00 f0 0a 01 1f 91 4f 00 63 6f 64 65 00
    00000100: f0 80 04 e8 2b 01 1f 00 63 6f 64 65 00 f0 89 3b
    00000110: e4 02 e8 00 1f 13 f0 80 02 e8 00 63 6f 64 65 00
    00000120: f0 15 f0 8b 00 63 6f 64 65 00 f0 80 02 e8 00 63
    00000130: 6f 64 65 00 f0 0a 01 1f 8f 00 63 6f 64 65 00 f0
    00000140: 80 02 e8 15 f0 30 01 1f 8d 15 f0 80 02 e8 3a 01
    00000150: 1f 15 f0 85 2f 01 1f 15 f0 89 84 39 e4 00 e8 00
    00000160: e8 00 74 6f 70 64 69 73 70 00 2f e4 02 e8 01 01
    00000170: 1f 00 63 70 00 f0 80 02 e8 07 01 02 1f 15 f0 87
    00000180: 39 e4 00 e8 00 20 43 4c 45 41 52 2e 2e 2e 20 47
    00000190: 6f 74 6f 20 31 73 74 20 50 72 65 73 69 64 65 6e
    000001a0: 74 00 00 e6 00 e8 00 e8 00 74 6f 70 64 69 73 70
    000001b0: 00 2f e4 02 e8 10 e4 02 e8 2b 01 1f 00 63 70 00
    000001c0: f0 80 04 e8 01 01 1f 00 63 70 00 f0 85 3b e4 02
    000001d0: e8 00 63 70 00 f0 01 01 1f 8d 00 63 70 00 f0 80
    000001e0: 02 e8 51 01 02 1f 15 f0 87 01 01 02 1f 15 f0 87
    000001f0: 83 39 e4 00 e8 00 20 42 53 20 6f 72 20 4c 45 46
    00000200: 54 20 41 72 72 6f 77 2e 2e 2e 20 70 72 65 76 69
    00000210: 6f 75 73 20 50 72 65 73 69 64 65 6e 74 00 00 e6
    00000220: 00 e8 00 e8 00 65 78 69 74 6c 6f 6f 70 00 2f e4
    00000230: 02 e8 08 11 02 1f 15 f0 87 08 01 02 1f 15 f0 87
    00000240: 51 01 1f 15 f0 87 71 01 1f 15 f0 87 83 83 83 39
    00000250: e4 00 e8 00 20 45 53 43 2c 20 51 55 49 54 2c 20
    00000260: 51 2c 20 71 2e 2e 2e 20 45 78 69 74 20 70 72 6f
    00000270: 67 72 61 6d 00 00 e6 00 e8 00 e8 00 74 6f 70 64
    00000280: 69 73 70 00 2f e4 02 e8 10 e4 02 e8 01 01 1f 00
    00000290: 63 70 00 f0 80 04 e8 2b 01 1f 00 63 70 00 f0 89
    000002a0: 3b e4 02 e8 00 63 70 00 f0 01 01 1f 8b 00 63 70
    000002b0: 00 f0 80 02 e8 54 01 02 1f 15 f0 87 02 01 02 1f
    000002c0: 15 f0 87 0d 01 1f 15 f0 87 83 83 3b e4 00 e8 00
    000002d0: 20 45 4e 54 45 52 20 6f 72 20 6f 72 20 53 54 4f
    000002e0: 3e 20 6f 72 20 52 49 47 48 54 20 41 72 72 6f 77
    000002f0: 2e 2e 2e 20 6e 65 78 74 20 50 72 65 73 69 64 65
    00000300: 6e 74 00 00 e6 00 e8 01 01 1f 13 f0 8b 13 f0 80
    00000310: 00 e8 e5 02 e3 15 f0 80 00 e8 00 e8 18 e4 00 e8
    00000320: 00 1f 00 63 6f 64 65 00 f0 80 00 e8 00 1f 13 f0
    00000330: 80 00 e8 00 1f 15 f0 80 00 e8 00 20 6e 6f 77 2c
    00000340: 20 68 61 6e 64 6c 65 20 63 6f 6d 6d 61 6e 64 2f
    00000350: 63 6f 6e 74 72 6f 6c 20 6b 65 79 73 00 00 e6 00
    00000360: e8 00 e8 48 01 1f 19 f0 38 01 1f 8b e5 07 01 1f
    00000370: e5 00 63 70 00 f0 00 70 6f 74 75 73 5c 70 72 64
    00000380: 62 00 d5 d5 4f e4 00 e8 44 01 1f 19 f0 30 01 1f
    00000390: 8b 00 50 61 72 74 79 3a 00 2d 4f e4 00 e8 48 01
    000003a0: 1f 19 f0 24 01 1f 8b 00 54 6f 3a 00 2d e5 05 01
    000003b0: 1f e5 00 63 70 00 f0 00 70 6f 74 75 73 5c 70 72
    000003c0: 64 62 00 d5 d5 14 e3 4f e4 00 e8 48 01 1f 19 f0
    000003d0: 1c 01 1f 8b 00 46 72 3a 00 2d e5 04 01 1f e5 00
    000003e0: 63 70 00 f0 00 70 6f 74 75 73 5c 70 72 64 62 00
    000003f0: d5 d5 14 e3 4f e4 00 e8 44 01 1f 19 f0 14 01 1f
    00000400: 8b 00 54 65
  UrbLink              = 00000000
[549616 ms] UsbSnoop - MyInternalIOCTLCompletion(f8917db0) : fido=81b964f0, Irp=81c21570, Context=81b4d110, IRQL=2
[549616 ms]  <<<  URB 683 coming back  <<< 
-- URB_FUNCTION_BULK_OR_INTERRUPT_TRANSFER:
  PipeHandle           = 82300f14 [endpoint 0x00000002]
  TransferFlags        = 00000000 (USBD_TRANSFER_DIRECTION_OUT, ~USBD_SHORT_TRANSFER_OK)
  TransferBufferLength = 00000404
  TransferBuffer       = 00000000
  TransferBufferMDL    = 81ac92e0
  UrbLink              = 00000000
[549625 ms] UsbSnoop - DispatchAny(f8916610) : IRP_MJ_INTERNAL_DEVICE_CONTROL
[549625 ms] UsbSnoop - MyDispatchInternalIOCTL(f8917e80) : fdo=822eee08, Irp=81c21570, IRQL=2
[549625 ms]  >>>  URB 684 going down  >>> 
-- URB_FUNCTION_BULK_OR_INTERRUPT_TRANSFER:
  PipeHandle           = 82300ef4 [endpoint 0x00000081]
  TransferFlags        = 00000003 (USBD_TRANSFER_DIRECTION_IN, USBD_SHORT_TRANSFER_OK)
  TransferBufferLength = 00000100
  TransferBuffer       = 00000000
  TransferBufferMDL    = 81ac92e0
  UrbLink              = 00000000
[549625 ms] UsbSnoop - MyInternalIOCTLCompletion(f8917db0) : fido=81b964f0, Irp=81c21570, Context=81ba8040, IRQL=2
[549625 ms]  <<<  URB 684 coming back  <<< 
-- URB_FUNCTION_BULK_OR_INTERRUPT_TRANSFER:
  PipeHandle           = 82300ef4 [endpoint 0x00000081]
  TransferFlags        = 00000003 (USBD_TRANSFER_DIRECTION_IN, USBD_SHORT_TRANSFER_OK)
  TransferBufferLength = 00000007
  TransferBuffer       = 00000000
  TransferBufferMDL    = 81ac92e0
    00000000: 00 00 00 02 05 e0 00
  UrbLink              = 00000000
[549665 ms] UsbSnoop - DispatchAny(f8916610) : IRP_MJ_INTERNAL_DEVICE_CONTROL
[549665 ms] UsbSnoop - MyDispatchInternalIOCTL(f8917e80) : fdo=822eee08, Irp=81c21570, IRQL=2
[549665 ms]  >>>  URB 685 going down  >>> 
-- URB_FUNCTION_BULK_OR_INTERRUPT_TRANSFER:
  PipeHandle           = 82300f14 [endpoint 0x00000002]
  TransferFlags        = 00000000 (USBD_TRANSFER_DIRECTION_OUT, ~USBD_SHORT_TRANSFER_OK)
  TransferBufferLength = 00000404
  TransferBuffer       = 00000000
  TransferBufferMDL    = 81bbe5c0
    00000000: 00 00 03 ff 03 72 6d 20 6f 66 20 4f 66 66 69 63
    00000010: 65 3a 00 2d 4f e4 00 e8 00 e8 10 e4 00 e8 44 01
    00000020: 1f 19 f0 08 01 1f 8b e5 02 01 1f e5 00 63 70 00
    00000030: f0 00 70 6f 74 75 73 5c 70 72 64 62 00 d5 d5 4f
    00000040: e4 02 e8 19 f0 08 01 1f 8b 19 f0 80 02 e8 00 1f
    00000050: e5 02 01 1f e5 00 63 70 00 f0 00 70 6f 74 75 73
    00000060: 5c 70 72 64 62 00 d5 d5 6c 8a 3b e4 00 e8 44 01
    00000070: 1f 19 f0 08 01 1f 8b e5 01 01 1f e5 00 63 70 00
    00000080: f0 00 70 6f 74 75 73 5c 70 72 64 62 00 d5 d5 4f
    00000090: e4 00 e8 44 01 1f 19 f0 e5 03 01 1f e5 00 63 70
    000000a0: 00 f0 00 70 6f 74 75 73 5c 70 72 64 62 00 d5 d5
    000000b0: 00 20 50 72 65 73 69 64 65 6e 74 00 2d 14 e3 4f
    000000c0: e4 00 e8 02 01 1f 19 f0 80 00 e8 00 20 66 72 6f
    000000d0: 6d 20 6f 75 72 20 64 61 74 61 62 61 73 65 00 00
    000000e0: e6 00 e8 00 20 6e 6f 77 2c 20 64 69 73 70 6c 61
    000000f0: 79 20 69 6e 66 6f 20 61 62 6f 75 74 20 74 68 69
    00000100: 73 20 50 72 65 73 69 64 65 6e 74 00 00 e6 00 e8
    00000110: 00 e8 e5 00 1f 00 1f 00 70 6f 74 75 73 5c 00 2d
    00000120: e5 06 01 1f e5 00 63 70 00 f0 00 70 6f 74 75 73
    00000130: 5c 70 72 64 62 00 d5 d5 14 e3 01 e3 5f e4 00 e8
    00000140: 00 20 67 65 74 20 70 69 63 74 75 72 65 20 6f 66
    00000150: 20 63 75 72 72 65 6e 74 20 73 65 6c 65 63 74 65
    00000160: 64 20 50 72 65 73 69 64 65 6e 74 00 00 e6 00 e8
    00000170: 01 e4 00 e7 02 e4 00 e8 00 e8 00 74 6f 70 64 69
    00000180: 73 70 00 30 e4 00 e8 00 20 54 6f 70 20 6f 66 20
    00000190: 64 69 73 70 6c 61 79 20 6c 6f 6f 70 20 66 6f 72
    000001a0: 20 65 61 63 68 00 00 e6 00 e8 00 e8 01 01 1f 00
    000001b0: 63 70 00 f0 80 00 e8 00 20 49 6e 69 74 69 61 6c
    000001c0: 69 7a 65 20 76 61 72 69 61 62 6c 65 73 00 00 e6
    000001d0: 00 e8 00 e8 00 4f 66 66 00 2d 00 41 78 65 73 00
    000001e0: 2d 0f e3 00 e8 e5 7b e4 00 e8 00 20 54 75 72 6e
    000001f0: 20 6f 66 66 20 66 75 6e 63 74 69 6f 6e 73 20 61
    00000200: 6e 64 20 73 65 74 75 70 20 73 63 72 65 65 6e 00
    00000210: 00 e6 00 e8 00 e8 e5 00 63 6f 64 65 00 13 19 15
    00000220: 00 63 70 00 7d e4 00 e8 00 20 64 65 66 69 6e 65
    00000230: 20 6c 6f 63 61 6c 20 76 61 72 69 61 62 6c 65 73
    00000240: 20 75 73 65 64 20 62 79 20 70 72 6f 67 72 61 6d
    00000250: 00 00 e6 00 e8 00 e8 00 3d 3d 3d 3d 3d 3d 3d 3d
    00000260: 3d 3d 3d 3d 3d 3d 3d 3d 3d 3d 3d 3d 3d 3d 3d 3d
    00000270: 3d 3d 3d 3d 3d 3d 3d 3d 00 00 e6 00 e8 00 20 44
    00000280: 61 74 65 3a 20 30 32 20 4e 6f 76 65 6d 62 65 72
    00000290: 20 32 30 30 30 00 00 e6 00 e8 00 20 52 65 76 69
    000002a0: 73 69 6f 6e 3a 20 31 2e 31 00 00 e6 00 e8 00 20
    000002b0: a9 31 39 39 39 2d 32 30 30 30 20 62 79 20 53 74
    000002c0: 65 70 68 65 6e 20 4c 2e 20 52 65 69 64 00 00 e6
    000002d0: 00 e8 00 20 50 72 65 73 69 64 65 6e 74 73 20 4f
    000002e0: 66 20 54 68 65 20 55 6e 69 74 65 64 20 53 74 61
    000002f0: 74 65 73 00 00 e6 00 e8 00 3d 3d 3d 3d 3d 3d 3d
    00000300: 3d 3d 3d 3d 3d 3d 3d 3d 3d 3d 3d 3d 3d 3d 3d 3d
    00000310: 3d 3d 3d 3d 3d 3d 3d 3d 3d 00 00 e6 00 e8 00 e8
    00000320: 19 e4 e5 00 01 00 dc 0d 81 04 2b 01 00 4d e5 00
    00000330: 46 65 64 65 72 61 6c 69 73 74 00 2d 00 67 77 30
    00000340: 31 00 2d 00 4d 61 72 20 33 2c 31 37 39 37 00 2d
    00000350: 00 41 70 72 20 33 30 2c 31 37 38 39 00 2d 00 31
    00000360: 73 74 00 2d 00 57 61 73 68 69 6e 67 74 6f 6e 00
    00000370: 2d 00 47 65 6f 72 67 65 00 2d d9 02 00 46 e5 00
    00000380: 46 65 64 65 72 61 6c 69 73 74 00 2d 00 6a 61 30
    00000390: 32 00 2d 00 4d 61 72 20 33 2c 31 38 30 31 00 2d
    000003a0: 00 4d 61 72 20 34 2c 31 37 39 37 00 2d 00 32 6e
    000003b0: 64 00 2d 00 00 2d 00 4a 6f 68 6e 20 41 64 61 6d
    000003c0: 73 00 2d d9 03 00 4d e5 00 44 65 6d 6f 2e 2d 52
    000003d0: 65 70 75 62 2e 00 2d 00 74 6a 30 33 00 2d 00 4d
    000003e0: 61 72 20 33 2c 31 38 30 39 00 2d 00 4d 61 72 20
    000003f0: 34 2c 31 38 30 31 00 2d 00 33 72 64 00 2d 00 4a
    00000400: 65 66 66 65
  UrbLink              = 00000000
[549676 ms] UsbSnoop - MyInternalIOCTLCompletion(f8917db0) : fido=81b964f0, Irp=81c21570, Context=81b4d110, IRQL=2
[549676 ms]  <<<  URB 685 coming back  <<< 
-- URB_FUNCTION_BULK_OR_INTERRUPT_TRANSFER:
  PipeHandle           = 82300f14 [endpoint 0x00000002]
  TransferFlags        = 00000000 (USBD_TRANSFER_DIRECTION_OUT, ~USBD_SHORT_TRANSFER_OK)
  TransferBufferLength = 00000404
  TransferBuffer       = 00000000
  TransferBufferMDL    = 81bbe5c0
  UrbLink              = 00000000
[549685 ms] UsbSnoop - DispatchAny(f8916610) : IRP_MJ_INTERNAL_DEVICE_CONTROL
[549685 ms] UsbSnoop - MyDispatchInternalIOCTL(f8917e80) : fdo=822eee08, Irp=81c21570, IRQL=2
[549685 ms]  >>>  URB 686 going down  >>> 
-- URB_FUNCTION_BULK_OR_INTERRUPT_TRANSFER:
  PipeHandle           = 82300ef4 [endpoint 0x00000081]
  TransferFlags        = 00000003 (USBD_TRANSFER_DIRECTION_IN, USBD_SHORT_TRANSFER_OK)
  TransferBufferLength = 00000100
  TransferBuffer       = 00000000
  TransferBufferMDL    = 81bbe5c0
  UrbLink              = 00000000
[549686 ms] UsbSnoop - MyInternalIOCTLCompletion(f8917db0) : fido=81b964f0, Irp=81c21570, Context=81c3bfe8, IRQL=2
[549686 ms]  <<<  URB 686 coming back  <<< 
-- URB_FUNCTION_BULK_OR_INTERRUPT_TRANSFER:
  PipeHandle           = 82300ef4 [endpoint 0x00000081]
  TransferFlags        = 00000003 (USBD_TRANSFER_DIRECTION_IN, USBD_SHORT_TRANSFER_OK)
  TransferBufferLength = 00000007
  TransferBuffer       = 00000000
  TransferBufferMDL    = 81bbe5c0
    00000000: 00 00 00 02 05 e0 00
  UrbLink              = 00000000
[549725 ms] UsbSnoop - DispatchAny(f8916610) : IRP_MJ_INTERNAL_DEVICE_CONTROL
[549725 ms] UsbSnoop - MyDispatchInternalIOCTL(f8917e80) : fdo=822eee08, Irp=81c21570, IRQL=2
[549725 ms]  >>>  URB 687 going down  >>> 
-- URB_FUNCTION_BULK_OR_INTERRUPT_TRANSFER:
  PipeHandle           = 82300f14 [endpoint 0x00000002]
  TransferFlags        = 00000000 (USBD_TRANSFER_DIRECTION_OUT, ~USBD_SHORT_TRANSFER_OK)
  TransferBufferLength = 00000404
  TransferBuffer       = 00000000
  TransferBufferMDL    = 81bbe5c0
    00000000: 00 00 03 ff 03 72 73 6f 6e 00 2d 00 54 68 6f 6d
    00000010: 61 73 00 2d d9 04 00 4b e5 00 44 65 6d 6f 2e 2d
    00000020: 52 65 70 75 62 2e 00 2d 00 6a 6d 30 34 00 2d 00
    00000030: 4d 61 72 20 33 2c 31 38 31 37 00 2d 00 4d 61 72
    00000040: 20 33 2c 31 38 30 39 00 2d 00 34 74 68 00 2d 00
    00000050: 00 2d 00 4a 61 6d 65 73 20 4d 61 64 69 73 6f 6e
    00000060: 00 2d d9 05 00 4a e5 00 44 65 6d 6f 2e 2d 52 65
    00000070: 70 75 62 2e 00 2d 00 6a 6d 30 35 00 2d 00 4d 61
    00000080: 72 20 33 2c 31 38 32 35 00 2d 00 4d 61 72 20 34
    00000090: 2c 31 38 31 37 00 2d 00 35 74 68 00 2d 00 00 2d
    000000a0: 00 4a 61 6d 65 73 20 4d 6f 6e 72 6f 65 00 2d d9
    000000b0: 06 00 4e e5 00 44 65 6d 6f 2e 2d 52 65 70 75 62
    000000c0: 2e 00 2d 00 6a 61 30 36 00 2d 00 4d 61 72 20 33
    000000d0: 2c 31 38 32 39 00 2d 00 4d 61 72 20 34 2c 31 38
    000000e0: 32 35 00 2d 00 36 74 68 00 2d 00 41 64 61 6d 73
    000000f0: 00 2d 00 4a 6f 68 6e 20 51 75 69 6e 63 79 00 2d
    00000100: d9 07 00 4a e5 00 44 65 6d 6f 63 72 61 74 69 63
    00000110: 00 2d 00 61 6a 30 37 00 2d 00 4d 61 72 20 33 2c
    00000120: 31 38 33 37 00 2d 00 4d 61 72 20 34 2c 31 38 32
    00000130: 39 00 2d 00 37 74 68 00 2d 00 00 2d 00 41 6e 64
    00000140: 72 65 77 20 4a 61 63 6b 73 6f 6e 00 2d d9 08 00
    00000150: 4b e5 00 44 65 6d 6f 63 72 61 74 69 63 00 2d 00
    00000160: 6d 62 30 38 00 2d 00 4d 61 72 20 33 2c 31 38 34
    00000170: 31 00 2d 00 4d 61 72 20 34 2c 31 38 33 37 00 2d
    00000180: 00 38 74 68 00 2d 00 56 61 6e 20 42 75 72 65 6e
    00000190: 00 2d 00 4d 61 72 74 69 6e 00 2d d9 09 00 4b e5
    000001a0: 00 57 68 69 67 00 2d 00 77 68 30 39 00 2d 00 41
    000001b0: 70 72 20 34 2c 31 38 34 31 00 2d 00 4d 61 72 20
    000001c0: 34 2c 31 38 34 31 00 2d 00 39 74 68 00 2d 00 48
    000001d0: 61 72 72 69 73 6f 6e 00 2d 00 57 69 6c 6c 69 61
    000001e0: 6d 20 48 65 6e 72 79 00 2d d9 0a 00 41 e5 00 57
    000001f0: 68 69 67 00 2d 00 6a 74 31 30 00 2d 00 4d 61 72
    00000200: 20 33 2c 31 38 34 35 00 2d 00 41 70 72 20 36 2c
    00000210: 31 38 34 31 00 2d 00 31 30 74 68 00 2d 00 00 2d
    00000220: 00 4a 6f 68 6e 20 54 79 6c 65 72 00 2d d9 0b 00
    00000230: 4b e5 00 44 65 6d 6f 63 72 61 74 69 63 00 2d 00
    00000240: 6a 70 31 31 00 2d 00 4d 61 72 20 33 2c 31 38 34
    00000250: 39 00 2d 00 4d 61 72 20 34 2c 31 38 34 35 00 2d
    00000260: 00 31 31 74 68 00 2d 00 50 6f 6c 6b 00 2d 00 4a
    00000270: 61 6d 65 73 20 4b 6e 6f 78 00 2d d9 0c 00 45 e5
    00000280: 00 57 68 69 67 00 2d 00 7a 72 31 32 00 2d 00 4a
    00000290: 75 6c 20 39 2c 31 38 35 30 00 2d 00 4d 61 72 20
    000002a0: 35 2c 31 38 34 39 00 2d 00 31 32 74 68 00 2d 00
    000002b0: 00 2d 00 5a 61 63 68 61 72 79 20 54 61 79 6c 6f
    000002c0: 72 00 2d d9 0d 00 46 e5 00 57 68 69 67 00 2d 00
    000002d0: 6d 66 31 33 00 2d 00 4d 61 72 20 33 2c 31 38 35
    000002e0: 33 00 2d 00 4a 75 6c 20 39 2c 31 38 35 30 00 2d
    000002f0: 00 31 33 74 68 00 2d 00 46 69 6c 6c 6d 6f 72 65
    00000300: 00 2d 00 4d 69 6c 6c 61 72 64 00 2d d9 0e 00 4a
    00000310: e5 00 44 65 6d 6f 63 72 61 74 00 2d 00 66 70 31
    00000320: 34 00 2d 00 4d 61 72 20 33 2c 31 38 35 37 00 2d
    00000330: 00 4d 61 72 20 34 2c 31 38 35 33 00 2d 00 31 34
    00000340: 74 68 00 2d 00 00 2d 00 46 72 61 6e 6b 6c 69 6e
    00000350: 20 50 69 65 72 63 65 00 2d d9 0f 00 49 e5 00 44
    00000360: 65 6d 6f 63 72 61 74 00 2d 00 6a 62 31 35 00 2d
    00000370: 00 4d 61 72 20 33 2c 31 38 36 31 00 2d 00 4d 61
    00000380: 72 20 34 2c 31 38 35 37 00 2d 00 31 35 74 68 00
    00000390: 2d 00 00 2d 00 4a 61 6d 65 73 20 42 75 63 68 61
    000003a0: 6e 61 6e 00 2d d9 10 00 4d e5 00 52 65 70 75 62
    000003b0: 6c 69 63 61 6e 00 2d 00 61 6c 31 36 00 2d 00 41
    000003c0: 70 72 20 31 35 2c 31 38 36 35 00 2d 00 4d 61 72
    000003d0: 20 34 2c 31 38 36 31 00 2d 00 31 36 74 68 00 2d
    000003e0: 00 00 2d 00 41 62 72 61 68 61 6d 20 4c 69 6e 63
    000003f0: 6f 6c 6e 00 2d d9 11 00 4a e5 00 44 65 6d 6f 63
    00000400: 72 61 74 00
  UrbLink              = 00000000
[549737 ms] UsbSnoop - MyInternalIOCTLCompletion(f8917db0) : fido=81b964f0, Irp=81c21570, Context=81b4d110, IRQL=2
[549737 ms]  <<<  URB 687 coming back  <<< 
-- URB_FUNCTION_BULK_OR_INTERRUPT_TRANSFER:
  PipeHandle           = 82300f14 [endpoint 0x00000002]
  TransferFlags        = 00000000 (USBD_TRANSFER_DIRECTION_OUT, ~USBD_SHORT_TRANSFER_OK)
  TransferBufferLength = 00000404
  TransferBuffer       = 00000000
  TransferBufferMDL    = 81bbe5c0
  UrbLink              = 00000000
[549745 ms] UsbSnoop - DispatchAny(f8916610) : IRP_MJ_INTERNAL_DEVICE_CONTROL
[549745 ms] UsbSnoop - MyDispatchInternalIOCTL(f8917e80) : fdo=822eee08, Irp=81c21570, IRQL=2
[549745 ms]  >>>  URB 688 going down  >>> 
-- URB_FUNCTION_BULK_OR_INTERRUPT_TRANSFER:
  PipeHandle           = 82300ef4 [endpoint 0x00000081]
  TransferFlags        = 00000003 (USBD_TRANSFER_DIRECTION_IN, USBD_SHORT_TRANSFER_OK)
  TransferBufferLength = 00000100
  TransferBuffer       = 00000000
  TransferBufferMDL    = 81bbe5c0
  UrbLink              = 00000000
[549746 ms] UsbSnoop - MyInternalIOCTLCompletion(f8917db0) : fido=81b964f0, Irp=81c21570, Context=81ba8040, IRQL=2
[549746 ms]  <<<  URB 688 coming back  <<< 
-- URB_FUNCTION_BULK_OR_INTERRUPT_TRANSFER:
  PipeHandle           = 82300ef4 [endpoint 0x00000081]
  TransferFlags        = 00000003 (USBD_TRANSFER_DIRECTION_IN, USBD_SHORT_TRANSFER_OK)
  TransferBufferLength = 00000007
  TransferBuffer       = 00000000
  TransferBufferMDL    = 81bbe5c0
    00000000: 00 00 00 02 05 e0 00
  UrbLink              = 00000000
[549785 ms] UsbSnoop - DispatchAny(f8916610) : IRP_MJ_INTERNAL_DEVICE_CONTROL
[549785 ms] UsbSnoop - MyDispatchInternalIOCTL(f8917e80) : fdo=822eee08, Irp=81c21570, IRQL=2
[549785 ms]  >>>  URB 689 going down  >>> 
-- URB_FUNCTION_BULK_OR_INTERRUPT_TRANSFER:
  PipeHandle           = 82300f14 [endpoint 0x00000002]
  TransferFlags        = 00000000 (USBD_TRANSFER_DIRECTION_OUT, ~USBD_SHORT_TRANSFER_OK)
  TransferBufferLength = 00000404
  TransferBuffer       = 00000000
  TransferBufferMDL    = 81bbe5c0
    00000000: 00 00 03 ff 03 2d 00 61 6a 31 37 00 2d 00 4d 61
    00000010: 72 20 33 2c 31 38 36 39 00 2d 00 41 70 72 20 31
    00000020: 35 2c 31 38 36 35 00 2d 00 31 37 74 68 00 2d 00
    00000030: 00 2d 00 41 6e 64 72 65 77 20 4a 6f 68 6e 73 6f
    00000040: 6e 00 2d d9 12 00 51 e5 00 52 65 70 75 62 6c 69
    00000050: 63 61 6e 00 2d 00 75 67 31 38 00 2d 00 4d 61 72
    00000060: 20 33 2c 31 38 37 37 00 2d 00 4d 61 72 20 34 2c
    00000070: 31 38 36 39 00 2d 00 31 38 74 68 00 2d 00 47 72
    00000080: 61 6e 74 00 2d 00 55 6c 79 73 73 65 73 20 53 69
    00000090: 6d 70 73 6f 6e 00 2d d9 13 00 55 e5 00 52 65 70
    000000a0: 75 62 6c 69 63 61 6e 00 2d 00 72 68 31 39 00 2d
    000000b0: 00 4d 61 72 20 33 2c 31 38 38 31 00 2d 00 4d 61
    000000c0: 72 20 34 2c 31 38 37 37 00 2d 00 31 39 74 68 00
    000000d0: 2d 00 42 69 72 63 68 61 72 64 20 48 61 79 65 73
    000000e0: 00 2d 00 52 75 74 68 65 72 66 6f 72 64 00 2d d9
    000000f0: 14 00 51 e5 00 52 65 70 75 62 6c 69 63 61 6e 00
    00000100: 2d 00 6a 67 32 30 00 2d 00 53 65 70 20 31 39 2c
    00000110: 31 38 38 31 00 2d 00 4d 61 72 20 34 2c 31 38 38
    00000120: 31 00 2d 00 32 30 74 68 00 2d 00 47 61 72 66 69
    00000130: 65 6c 64 00 2d 00 4a 61 6d 65 73 20 41 62 72 61
    00000140: 6d 00 2d d9 15 00 50 e5 00 52 65 70 75 62 6c 69
    00000150: 63 61 6e 00 2d 00 63 61 32 31 00 2d 00 4d 61 72
    00000160: 20 33 2c 31 38 38 35 00 2d 00 53 65 70 20 31 39
    00000170: 2c 31 38 38 31 00 2d 00 32 31 73 74 00 2d 00 41
    00000180: 72 74 68 75 72 00 2d 00 43 68 65 73 74 65 72 20
    00000190: 41 6c 61 6e 00 2d d9 16 00 4a e5 00 44 65 6d 6f
    000001a0: 63 72 61 74 00 2d 00 67 63 32 32 00 2d 00 4d 61
    000001b0: 72 20 33 2c 31 38 38 39 00 2d 00 4d 61 72 20 34
    000001c0: 2c 31 38 38 35 00 2d 00 32 32 6e 64 00 2d 00 43
    000001d0: 6c 65 76 65 6c 61 6e 64 00 2d 00 47 72 6f 76 65
    000001e0: 72 00 2d d9 17 00 4d e5 00 52 65 70 75 62 6c 69
    000001f0: 63 61 6e 00 2d 00 62 68 32 33 00 2d 00 4d 61 72
    00000200: 20 33 2c 31 38 39 33 00 2d 00 4d 61 72 20 34 2c
    00000210: 31 38 38 39 00 2d 00 32 33 72 64 00 2d 00 48 61
    00000220: 72 72 69 73 6f 6e 00 2d 00 42 65 6e 6a 61 6d 69
    00000230: 6e 00 2d d9 18 00 4a e5 00 44 65 6d 6f 63 72 61
    00000240: 74 00 2d 00 67 63 32 32 00 2d 00 4d 61 72 20 33
    00000250: 2c 31 38 39 37 00 2d 00 4d 61 72 20 34 2c 31 38
    00000260: 39 33 00 2d 00 32 34 74 68 00 2d 00 43 6c 65 76
    00000270: 65 6c 61 6e 64 00 2d 00 47 72 6f 76 65 72 00 2d
    00000280: d9 19 00 4d e5 00 52 65 70 75 62 6c 69 63 61 6e
    00000290: 00 2d 00 77 6d 32 35 00 2d 00 53 65 70 20 31 34
    000002a0: 2c 31 39 30 31 00 2d 00 4d 61 72 20 34 2c 31 38
    000002b0: 39 37 00 2d 00 32 35 74 68 00 2d 00 4d 63 4b 69
    000002c0: 6e 6c 65 79 00 2d 00 57 69 6c 6c 69 61 6d 00 2d
    000002d0: d9 1a 00 4f e5 00 52 65 70 75 62 6c 69 63 61 6e
    000002e0: 00 2d 00 74 72 32 36 00 2d 00 4d 61 72 20 33 2c
    000002f0: 31 39 30 39 00 2d 00 53 65 70 20 31 34 2c 31 39
    00000300: 30 31 00 2d 00 32 36 74 68 00 2d 00 52 6f 6f 73
    00000310: 65 76 65 6c 74 00 2d 00 54 68 65 6f 64 6f 72 65
    00000320: 00 2d d9 1b 00 4f e5 00 52 65 70 75 62 6c 69 63
    00000330: 61 6e 00 2d 00 77 74 32 37 00 2d 00 4d 61 72 20
    00000340: 33 2c 31 39 31 33 00 2d 00 4d 61 72 20 34 2c 31
    00000350: 39 30 39 00 2d 00 32 37 74 68 00 2d 00 54 61 66
    00000360: 74 00 2d 00 57 69 6c 6c 69 61 6d 20 48 6f 77 61
    00000370: 72 64 00 2d d9 1c 00 49 e5 00 44 65 6d 6f 63 72
    00000380: 61 74 00 2d 00 77 77 32 38 00 2d 00 4d 61 72 20
    00000390: 33 2c 31 39 32 31 00 2d 00 4d 61 72 20 34 2c 31
    000003a0: 39 31 33 00 2d 00 32 38 74 68 00 2d 00 00 2d 00
    000003b0: 57 6f 6f 64 72 6f 77 20 57 69 6c 73 6f 6e 00 2d
    000003c0: d9 1d 00 53 e5 00 52 65 70 75 62 6c 69 63 61 6e
    000003d0: 00 2d 00 77 68 32 39 00 2d 00 41 75 67 20 32 2c
    000003e0: 31 39 32 33 00 2d 00 4d 61 72 20 34 2c 31 39 32
    000003f0: 31 00 2d 00 32 39 74 68 00 2d 00 48 61 72 64 69
    00000400: 6e 67 00 2d
  UrbLink              = 00000000
[549796 ms] UsbSnoop - MyInternalIOCTLCompletion(f8917db0) : fido=81b964f0, Irp=81c21570, Context=81b4d110, IRQL=2
[549796 ms]  <<<  URB 689 coming back  <<< 
-- URB_FUNCTION_BULK_OR_INTERRUPT_TRANSFER:
  PipeHandle           = 82300f14 [endpoint 0x00000002]
  TransferFlags        = 00000000 (USBD_TRANSFER_DIRECTION_OUT, ~USBD_SHORT_TRANSFER_OK)
  TransferBufferLength = 00000404
  TransferBuffer       = 00000000
  TransferBufferMDL    = 81bbe5c0
  UrbLink              = 00000000
[549805 ms] UsbSnoop - DispatchAny(f8916610) : IRP_MJ_INTERNAL_DEVICE_CONTROL
[549805 ms] UsbSnoop - MyDispatchInternalIOCTL(f8917e80) : fdo=822eee08, Irp=81c21570, IRQL=2
[549805 ms]  >>>  URB 690 going down  >>> 
-- URB_FUNCTION_BULK_OR_INTERRUPT_TRANSFER:
  PipeHandle           = 82300ef4 [endpoint 0x00000081]
  TransferFlags        = 00000003 (USBD_TRANSFER_DIRECTION_IN, USBD_SHORT_TRANSFER_OK)
  TransferBufferLength = 00000100
  TransferBuffer       = 00000000
  TransferBufferMDL    = 81bbe5c0
  UrbLink              = 00000000
[549806 ms] UsbSnoop - MyInternalIOCTLCompletion(f8917db0) : fido=81b964f0, Irp=81c21570, Context=81c3bfe8, IRQL=2
[549806 ms]  <<<  URB 690 coming back  <<< 
-- URB_FUNCTION_BULK_OR_INTERRUPT_TRANSFER:
  PipeHandle           = 82300ef4 [endpoint 0x00000081]
  TransferFlags        = 00000003 (USBD_TRANSFER_DIRECTION_IN, USBD_SHORT_TRANSFER_OK)
  TransferBufferLength = 00000007
  TransferBuffer       = 00000000
  TransferBufferMDL    = 81bbe5c0
    00000000: 00 00 00 02 05 e0 00
  UrbLink              = 00000000
[549846 ms] UsbSnoop - DispatchAny(f8916610) : IRP_MJ_INTERNAL_DEVICE_CONTROL
[549846 ms] UsbSnoop - MyDispatchInternalIOCTL(f8917e80) : fdo=822eee08, Irp=81abb730, IRQL=2
[549846 ms]  >>>  URB 691 going down  >>> 
-- URB_FUNCTION_BULK_OR_INTERRUPT_TRANSFER:
  PipeHandle           = 82300f14 [endpoint 0x00000002]
  TransferFlags        = 00000000 (USBD_TRANSFER_DIRECTION_OUT, ~USBD_SHORT_TRANSFER_OK)
  TransferBufferLength = 00000404
  TransferBuffer       = 00000000
  TransferBufferMDL    = 81bbe5c0
    00000000: 00 00 03 ff 03 00 57 61 72 72 65 6e 20 47 61 6d
    00000010: 61 6c 65 69 6c 00 2d d9 1e 00 4c e5 00 52 65 70
    00000020: 75 62 6c 69 63 61 6e 00 2d 00 63 63 33 30 00 2d
    00000030: 00 4d 61 72 20 33 2c 31 39 32 39 00 2d 00 41 75
    00000040: 67 20 33 2c 31 39 32 33 00 2d 00 33 30 74 68 00
    00000050: 2d 00 00 2d 00 43 61 6c 76 69 6e 20 43 6f 6f 6c
    00000060: 69 64 67 65 00 2d d9 1f 00 50 e5 00 52 65 70 75
    00000070: 62 6c 69 63 61 6e 00 2d 00 68 68 33 31 00 2d 00
    00000080: 4d 61 72 20 33 2c 31 39 33 33 00 2d 00 4d 61 72
    00000090: 20 34 2c 31 39 32 39 00 2d 00 33 31 73 74 00 2d
    000000a0: 00 48 6f 6f 76 65 72 00 2d 00 48 65 72 62 65 72
    000000b0: 74 20 43 6c 61 72 6b 00 2d d9 20 00 54 e5 00 44
    000000c0: 65 6d 6f 63 72 61 74 00 2d 00 66 72 33 32 00 2d
    000000d0: 00 41 70 72 20 31 32 2c 31 39 34 35 00 2d 00 4d
    000000e0: 61 72 20 34 2c 31 39 33 33 00 2d 00 33 32 6e 64
    000000f0: 00 2d 00 52 6f 6f 73 65 76 65 6c 74 00 2d 00 46
    00000100: 72 61 6e 6b 6c 69 6e 20 44 65 6c 61 6e 6f 00 2d
    00000110: d9 21 00 4b e5 00 44 65 6d 6f 63 72 61 74 00 2d
    00000120: 00 68 74 33 33 00 2d 00 4a 61 6e 20 32 30 2c 31
    00000130: 39 35 33 00 2d 00 41 70 72 20 31 32 2c 31 39 34
    00000140: 35 00 2d 00 33 33 72 64 00 2d 00 54 72 75 6d 61
    00000150: 6e 00 2d 00 48 61 72 72 79 20 53 2e 00 2d d9 22
    00000160: 00 55 e5 00 52 65 70 75 62 6c 69 63 61 6e 00 2d
    00000170: 00 64 65 33 34 00 2d 00 4a 61 6e 20 32 30 2c 31
    00000180: 39 36 31 00 2d 00 4a 61 6e 20 32 30 2c 31 39 35
    00000190: 33 00 2d 00 33 34 74 68 00 2d 00 45 69 73 65 6e
    000001a0: 68 6f 77 65 72 00 2d 00 44 77 69 67 68 74 20 44
    000001b0: 61 76 69 64 00 2d d9 23 00 53 e5 00 44 65 6d 6f
    000001c0: 63 72 61 74 00 2d 00 6a 6b 33 35 00 2d 00 4e 6f
    000001d0: 76 20 32 32 2c 31 39 36 33 00 2d 00 4a 61 6e 20
    000001e0: 32 30 2c 31 39 36 31 00 2d 00 33 35 74 68 00 2d
    000001f0: 00 4b 65 6e 6e 65 64 79 00 2d 00 4a 6f 68 6e 20
    00000200: 46 69 74 7a 67 65 72 61 6c 64 00 2d d9 24 00 51
    00000210: e5 00 44 65 6d 6f 63 72 61 74 00 2d 00 6c 6a 33
    00000220: 36 00 2d 00 4a 61 6e 20 32 30 2c 31 39 36 39 00
    00000230: 2d 00 4e 6f 76 20 32 32 2c 31 39 36 33 00 2d 00
    00000240: 33 36 74 68 00 2d 00 4a 6f 68 6e 73 6f 6e 00 2d
    00000250: 00 4c 79 6e 64 6f 6e 20 42 61 69 6e 65 73 00 2d
    00000260: d9 25 00 52 e5 00 52 65 70 75 62 6c 69 63 61 6e
    00000270: 00 2d 00 72 6e 33 37 00 2d 00 41 75 67 20 39 2c
    00000280: 31 39 37 34 00 2d 00 4a 61 6e 20 32 30 2c 31 39
    00000290: 36 39 00 2d 00 33 37 74 68 00 2d 00 4e 69 78 6f
    000002a0: 6e 00 2d 00 52 69 63 68 61 72 64 20 4d 69 6c 68
    000002b0: 6f 75 73 00 2d d9 26 00 50 e5 00 52 65 70 75 62
    000002c0: 6c 69 63 61 6e 00 2d 00 67 66 33 38 00 2d 00 4a
    000002d0: 61 6e 20 32 30 2c 31 39 37 37 00 2d 00 41 75 67
    000002e0: 20 39 2c 31 39 37 34 00 2d 00 33 38 74 68 00 2d
    000002f0: 00 46 6f 72 64 00 2d 00 47 65 72 61 6c 64 20 52
    00000300: 75 64 6f 6c 70 68 00 2d d9 27 00 52 e5 00 44 65
    00000310: 6d 6f 63 72 61 74 00 2d 00 6a 63 33 39 00 2d 00
    00000320: 4a 61 6e 20 32 30 2c 31 39 38 31 00 2d 00 4a 61
    00000330: 6e 20 32 30 2c 31 39 37 37 00 2d 00 33 39 74 68
    00000340: 00 2d 00 43 61 72 74 65 72 2c 20 4a 72 2e 00 2d
    00000350: 00 4a 61 6d 65 73 20 45 61 72 6c 00 2d d9 28 00
    00000360: 52 e5 00 52 65 70 75 62 6c 69 63 61 6e 00 2d 00
    00000370: 72 72 34 30 00 2d 00 4a 61 6e 20 32 30 2c 31 39
    00000380: 38 39 00 2d 00 4a 61 6e 20 32 30 2c 31 39 38 31
    00000390: 00 2d 00 34 30 74 68 00 2d 00 52 65 61 67 61 6e
    000003a0: 00 2d 00 52 6f 6e 61 6c 64 20 57 69 6c 73 6f 6e
    000003b0: 00 2d d9 29 00 58 e5 00 52 65 70 75 62 6c 69 63
    000003c0: 61 6e 00 2d 00 67 62 34 31 00 2d 00 4a 61 6e 20
    000003d0: 32 30 2c 31 39 39 33 00 2d 00 4a 61 6e 20 32 30
    000003e0: 2c 31 39 38 39 00 2d 00 34 31 73 74 00 2d 00 57
    000003f0: 61 6c 6b 65 72 20 42 75 73 68 00 2d 00 47 65 6f
    00000400: 72 67 65 20
  UrbLink              = 00000000
[549857 ms] UsbSnoop - MyInternalIOCTLCompletion(f8917db0) : fido=81b964f0, Irp=81abb730, Context=81b4d110, IRQL=2
[549857 ms]  <<<  URB 691 coming back  <<< 
-- URB_FUNCTION_BULK_OR_INTERRUPT_TRANSFER:
  PipeHandle           = 82300f14 [endpoint 0x00000002]
  TransferFlags        = 00000000 (USBD_TRANSFER_DIRECTION_OUT, ~USBD_SHORT_TRANSFER_OK)
  TransferBufferLength = 00000404
  TransferBuffer       = 00000000
  TransferBufferMDL    = 81bbe5c0
  UrbLink              = 00000000
[549866 ms] UsbSnoop - DispatchAny(f8916610) : IRP_MJ_INTERNAL_DEVICE_CONTROL
[549866 ms] UsbSnoop - MyDispatchInternalIOCTL(f8917e80) : fdo=822eee08, Irp=81abb730, IRQL=2
[549866 ms]  >>>  URB 692 going down  >>> 
-- URB_FUNCTION_BULK_OR_INTERRUPT_TRANSFER:
  PipeHandle           = 82300ef4 [endpoint 0x00000081]
  TransferFlags        = 00000003 (USBD_TRANSFER_DIRECTION_IN, USBD_SHORT_TRANSFER_OK)
  TransferBufferLength = 00000100
  TransferBuffer       = 00000000
  TransferBufferMDL    = 81bbe5c0
  UrbLink              = 00000000
[549866 ms] UsbSnoop - MyInternalIOCTLCompletion(f8917db0) : fido=81b964f0, Irp=81abb730, Context=81d30f40, IRQL=2
[549866 ms]  <<<  URB 692 coming back  <<< 
-- URB_FUNCTION_BULK_OR_INTERRUPT_TRANSFER:
  PipeHandle           = 82300ef4 [endpoint 0x00000081]
  TransferFlags        = 00000003 (USBD_TRANSFER_DIRECTION_IN, USBD_SHORT_TRANSFER_OK)
  TransferBufferLength = 00000007
  TransferBuffer       = 00000000
  TransferBufferMDL    = 81bbe5c0
    00000000: 00 00 00 02 05 e0 00
  UrbLink              = 00000000
[549906 ms] UsbSnoop - DispatchAny(f8916610) : IRP_MJ_INTERNAL_DEVICE_CONTROL
[549906 ms] UsbSnoop - MyDispatchInternalIOCTL(f8917e80) : fdo=822eee08, Irp=81abb730, IRQL=2
[549906 ms]  >>>  URB 693 going down  >>> 
-- URB_FUNCTION_BULK_OR_INTERRUPT_TRANSFER:
  PipeHandle           = 82300f14 [endpoint 0x00000002]
  TransferFlags        = 00000000 (USBD_TRANSFER_DIRECTION_OUT, ~USBD_SHORT_TRANSFER_OK)
  TransferBufferLength = 00000404
  TransferBuffer       = 00000000
  TransferBufferMDL    = 81bbe5c0
    00000000: 00 00 03 ff 03 48 65 72 62 65 72 74 00 2d d9 2a
    00000010: 00 4e e5 00 44 65 6d 6f 63 72 61 74 00 2d 00 77
    00000020: 63 34 32 00 2d 00 4a 61 6e 20 32 30 2c 32 30 30
    00000030: 31 00 2d 00 4a 61 6e 20 32 30 2c 31 39 39 33 00
    00000040: 2d 00 34 32 6e 64 00 2d 00 43 6c 69 6e 74 6f 6e
    00000050: 00 2d 00 57 69 6c 6c 69 61 6d 20 4a 2e 00 2d d9
    00000060: 2b 00 48 e5 00 52 65 70 75 62 6c 69 63 61 6e 00
    00000070: 2d 00 67 62 34 33 00 2d 00 70 72 65 73 65 6e 74
    00000080: 00 2d 00 4a 61 6e 20 32 30 2c 32 30 30 31 00 2d
    00000090: 00 34 33 72 64 00 2d 00 42 75 73 68 00 2d 00 47
    000000a0: 65 6f 72 67 65 20 57 2e 00 2d d9 00 00 dd 02 c0
    000000b0: 00 01 20 49 6e 73 74 72 75 63 74 69 6f 6e 73 20
    000000c0: 66 6f 72 20 75 73 69 6e 67 20 74 68 65 0d 20 50
    000000d0: 72 65 73 69 64 65 6e 74 73 20 6f 66 20 54 68 65
    000000e0: 20 55 6e 69 74 65 64 20 53 74 61 74 65 73 0d 20
    000000f0: 50 72 6f 67 72 61 6d 20 66 6f 72 20 54 49 2d 38
    00000100: 39 2e 0d 20 0d 20 31 29 20 4c 6f 61 64 20 74 68
    00000110: 65 20 67 72 6f 75 70 20 66 69 6c 65 20 74 6f 20
    00000120: 79 6f 75 72 20 63 61 6c 63 75 6c 61 74 6f 72 0d
    00000130: 20 76 69 61 20 54 49 2d 47 72 61 70 68 20 4c 69
    00000140: 6e 6b 2e 0d 20 0d 20 32 29 20 52 75 6e 20 74 68
    00000150: 65 20 70 72 6f 67 72 61 6d 20 27 70 6f 74 75 73
    00000160: 5c 70 6f 74 75 73 28 29 27 0d 20 0d 20 33 29 20
    00000170: 57 69 74 68 69 6e 20 74 68 65 20 70 72 6f 67 72
    00000180: 61 6d 2c 20 74 68 65 20 66 6f 6c 6c 6f 77 69 6e
    00000190: 67 0d 20 6b 65 79 73 20 70 65 72 66 6f 72 6d 20
    000001a0: 74 68 65 73 65 20 61 63 74 69 6f 6e 73 3a 0d 20
    000001b0: 0d 20 20 20 41 29 20 27 51 27 20 71 75 69 74 73
    000001c0: 20 74 68 65 20 70 72 6f 67 72 61 6d 0d 20 20 20
    000001d0: 42 29 20 27 45 53 43 27 20 71 75 69 74 73 20 74
    000001e0: 68 65 20 70 72 6f 67 72 61 6d 0d 20 20 20 43 29
    000001f0: 20 27 51 55 49 54 27 20 28 32 6e 64 20 45 53 43
    00000200: 29 20 71 75 69 74 73 20 74 68 65 20 70 72 6f 67
    00000210: 72 61 6d 0d 20 20 20 44 29 20 45 4e 54 45 52 20
    00000220: 61 64 76 61 6e 63 65 73 20 74 6f 20 74 68 65 20
    00000230: 6e 65 78 74 20 50 72 65 73 69 64 65 6e 74 0d 20
    00000240: 20 20 45 29 20 44 4f 57 4e 20 61 72 72 6f 77 20
    00000250: 61 64 76 61 6e 63 65 73 20 74 6f 20 74 68 65 20
    00000260: 6e 65 78 74 20 50 72 65 73 69 64 65 6e 74 0d 20
    00000270: 20 20 46 29 20 55 50 20 61 72 72 6f 77 20 72 65
    00000280: 74 72 65 61 74 73 20 74 6f 20 74 68 65 20 70 72
    00000290: 65 76 69 6f 75 73 20 50 72 65 73 69 64 65 6e 74
    000002a0: 0d 20 20 20 47 29 20 4e 75 6d 62 65 72 20 6b 65
    000002b0: 79 73 20 28 61 6e 64 20 63 6f 6d 62 6f 73 29 20
    000002c0: 73 65 6c 65 63 74 20 74 68 65 20 73 70 65 63 69
    000002d0: 66 69 65 64 0d 20 20 20 20 20 20 50 72 65 73 69
    000002e0: 64 65 6e 74 20 28 69 2e 65 20 31 2b 37 20 3d 20
    000002f0: 31 37 74 68 20 50 72 65 73 69 64 65 6e 74 29 0d
    00000300: 20 0d 20 50 72 65 73 69 64 65 6e 74 73 20 6f 66
    00000310: 20 54 68 65 20 55 6e 69 74 65 64 20 53 74 61 74
    00000320: 65 73 20 69 73 0d 20 a9 31 39 39 39 2d 32 30 30
    00000330: 31 20 62 79 20 53 74 65 70 68 65 6e 20 52 65 69
    00000340: 64 0d 20 20 65 6d 61 69 6c 3a 20 73 72 65 69 64
    00000350: 40 61 69 72 6d 61 69 6c 2e 6e 65 74 0d 20 0d 20
    00000360: 45 6e 6a 6f 79 21 0d 20 0d 20 0d 20 0d 20 00 e0
    00000370: 02 55 00 4a 00 3b 00 00 00 00 00 00 00 00 00 00
    00000380: 00 00 00 00 00 00 00 00 00 1f c0 00 00 00 00 00
    00000390: 01 3f e0 00 00 00 00 00 00 e3 f0 00 00 00 00 00
    000003a0: 02 cb ff 00 00 00 00 00 05 93 ff c0 00 00 00 00
    000003b0: 0f 27 5f f0 00 00 00 00 1f ec 7f f0 00 00 00 00
    000003c0: fe 7f e7 f0 00 00 00 01 f0 1f ff f8 00 00 00 03
    000003d0: f0 01 ff f0 00 00 00 07 c0 00 03 f0 00 00 00 0f
    000003e0: 80 00 00 78 00 00 00 0f 00 00 00 3c 00 00 00 1e
    000003f0: 00 00 00 0c 00 00 00 1c 00 00 00 0e 00 00 00 38
    00000400: 00 00 00 0e
  UrbLink              = 00000000
[549917 ms] UsbSnoop - MyInternalIOCTLCompletion(f8917db0) : fido=81b964f0, Irp=81abb730, Context=81b4d110, IRQL=2
[549917 ms]  <<<  URB 693 coming back  <<< 
-- URB_FUNCTION_BULK_OR_INTERRUPT_TRANSFER:
  PipeHandle           = 82300f14 [endpoint 0x00000002]
  TransferFlags        = 00000000 (USBD_TRANSFER_DIRECTION_OUT, ~USBD_SHORT_TRANSFER_OK)
  TransferBufferLength = 00000404
  TransferBuffer       = 00000000
  TransferBufferMDL    = 81bbe5c0
  UrbLink              = 00000000
[549926 ms] UsbSnoop - DispatchAny(f8916610) : IRP_MJ_INTERNAL_DEVICE_CONTROL
[549926 ms] UsbSnoop - MyDispatchInternalIOCTL(f8917e80) : fdo=822eee08, Irp=81abb730, IRQL=2
[549926 ms]  >>>  URB 694 going down  >>> 
-- URB_FUNCTION_BULK_OR_INTERRUPT_TRANSFER:
  PipeHandle           = 82300ef4 [endpoint 0x00000081]
  TransferFlags        = 00000003 (USBD_TRANSFER_DIRECTION_IN, USBD_SHORT_TRANSFER_OK)
  TransferBufferLength = 00000100
  TransferBuffer       = 00000000
  TransferBufferMDL    = 81bbe5c0
  UrbLink              = 00000000
[549926 ms] UsbSnoop - MyInternalIOCTLCompletion(f8917db0) : fido=81b964f0, Irp=81abb730, Context=81ba8040, IRQL=2
[549926 ms]  <<<  URB 694 coming back  <<< 
-- URB_FUNCTION_BULK_OR_INTERRUPT_TRANSFER:
  PipeHandle           = 82300ef4 [endpoint 0x00000081]
  TransferFlags        = 00000003 (USBD_TRANSFER_DIRECTION_IN, USBD_SHORT_TRANSFER_OK)
  TransferBufferLength = 00000007
  TransferBuffer       = 00000000
  TransferBufferMDL    = 81bbe5c0
    00000000: 00 00 00 02 05 e0 00
  UrbLink              = 00000000
[549966 ms] UsbSnoop - DispatchAny(f8916610) : IRP_MJ_INTERNAL_DEVICE_CONTROL
[549966 ms] UsbSnoop - MyDispatchInternalIOCTL(f8917e80) : fdo=822eee08, Irp=81abb730, IRQL=2
[549966 ms]  >>>  URB 695 going down  >>> 
-- URB_FUNCTION_BULK_OR_INTERRUPT_TRANSFER:
  PipeHandle           = 82300f14 [endpoint 0x00000002]
  TransferFlags        = 00000000 (USBD_TRANSFER_DIRECTION_OUT, ~USBD_SHORT_TRANSFER_OK)
  TransferBufferLength = 00000404
  TransferBuffer       = 00000000
  TransferBufferMDL    = 81bbe5c0
    00000000: 00 00 03 ff 03 00 00 00 30 00 00 00 0f 00 00 00
    00000010: 30 00 00 00 07 00 00 00 70 00 00 00 07 00 00 00
    00000020: 60 00 00 00 07 00 00 00 c8 00 00 00 07 00 00 00
    00000030: c8 00 00 00 07 00 00 00 c8 00 00 00 07 00 00 00
    00000040: c4 00 00 00 07 00 00 00 e4 00 00 00 07 00 00 00
    00000050: 66 00 08 02 0f 00 00 00 c6 01 ff 7f ee 00 00 01
    00000060: fa 03 fe 7f ee 00 00 01 cf 07 fc 3f ee 00 00 01
    00000070: ef 0d b8 3e ee 00 00 01 e7 08 00 38 6e 00 00 01
    00000080: ff 00 70 06 8e 00 00 00 ef 00 00 14 0e 00 00 00
    00000090: 3f 00 00 10 0e 00 00 00 3f 00 00 08 0e 00 00 00
    000000a0: 3f 00 00 08 0e 00 00 00 16 00 00 0c 3e 00 00 00
    000000b0: 02 00 08 0d fe 00 00 00 03 00 1f 0f fc 00 00 00
    000000c0: 07 80 23 7b fc 00 00 00 0f 80 41 f9 fe 00 00 00
    000000d0: 07 80 87 fc fd 00 00 00 03 e0 1d ff fc 00 00 00
    000000e0: 03 f6 7f ff fe 00 00 00 07 f6 df ff fe 00 00 00
    000000f0: 03 f7 df ff fe 00 00 00 07 fe bf ff fc 00 00 00
    00000100: 07 ff ff bf fc 00 00 00 07 fb 7b bf fe 00 00 00
    00000110: 07 ff fa 77 fc 00 00 00 03 ff f8 7f fc 00 00 00
    00000120: 03 7f f2 df fc 00 00 00 06 7f f6 fd fc 00 00 00
    00000130: 0e 7f f7 fc fc 00 00 00 0e 1f fb fb f8 00 00 00
    00000140: 1f 0f bb ff f0 00 00 00 3f 87 bf 7f d0 00 00 00
    00000150: 3f c3 df ff f8 00 00 00 ff e0 ff ff fc 00 00 01
    00000160: ff f0 7f fb be 00 00 07 ff fc 03 fe 3f 00 00 0f
    00000170: ff fe 61 88 3f 80 00 3f ff ff ff e6 7f e0 00 7f
    00000180: ff f5 ff ff ff f8 00 ff ff f7 9f ff ff ff 00 ff
    00000190: ff e2 7f ff ff ff c0 ff ff f0 ff ff ff ff e0 ff
    000001a0: ff ff ff ff ff ff e0 ff ff ff ff ff ff ff e0 ff
    000001b0: ff ff ff e7 ff ff e0 fb ff ff ff f1 ff ff e0 fb
    000001c0: ff ff ff fc ff ff e0 df 02 0b 00 4a 00 38 00 00
    000001d0: 00 00 00 00 00 00 00 00 0f c0 00 00 00 00 03 ff
    000001e0: fc 00 00 00 00 1f ff ff 80 00 00 00 7f ff ff c0
    000001f0: 00 00 00 ff ff ff e0 00 00 01 ff ff ff f0 00 00
    00000200: 03 ff ff ff f8 00 00 07 ff ff ff fc 00 00 0f ff
    00000210: ff ff fe 00 00 1f ff ff ff ff 00 00 1f ff ff ff
    00000220: ff 80 00 3f ff fd ff ff c0 00 3f ff c0 9f ff c0
    00000230: 00 3f ff c0 03 f3 e0 00 7f ff c0 00 01 e0 00 7f
    00000240: ff c0 00 01 f0 00 7f ff c0 00 01 f0 00 7f ff 80
    00000250: 00 00 f0 00 7f ff 00 00 00 f0 00 ff fe 00 00 00
    00000260: f0 00 ff ff 00 00 00 f0 00 ff ff 00 00 00 f0 00
    00000270: ff ff 00 00 00 f0 00 ff ff 00 00 00 f0 00 ff ff
    00000280: 00 00 00 e0 00 ff fe 00 00 00 e0 03 ff ff 00 00
    00000290: 01 e0 07 ff ff c0 00 01 c0 07 ff ff f0 00 01 80
    000002a0: 07 ff ff fe 00 01 80 07 ff ff ff 00 01 00 07 ff
    000002b0: ff df 03 cf 00 07 ff ff 87 07 ff 00 07 ff b8 03
    000002c0: 07 fe 00 07 ff 90 03 00 48 00 03 ff c0 03 00 00
    000002d0: 00 03 ff c0 07 00 00 00 03 ff e0 0f 80 00 00 01
    000002e0: ff f0 0f 80 00 00 00 ff f0 07 00 00 00 00 ff f0
    000002f0: 1f 00 00 00 00 7f f0 3f 00 00 00 00 3f f0 7f 00
    00000300: 00 00 00 3f f0 7f 00 00 00 00 3f f0 7f 00 00 00
    00000310: 00 3f f0 3f 80 00 00 00 3f f0 3f e0 00 00 00 7f
    00000320: e2 ff 80 00 00 00 ff e7 f0 00 00 00 00 ff e7 fc
    00000330: 00 00 00 01 ff f1 ff 80 00 00 03 ff f0 7d fe 00
    00000340: 00 07 ff f0 78 00 00 00 07 ff f0 78 00 00 00 0f
    00000350: ff f1 fc 00 00 00 1f ff f9 7c 00 00 00 7f ff ff
    00000360: 30 00 7c 00 ff ff ff 80 00 ff 80 ff ff ff 80 01
    00000370: ff f0 ff ff ff f0 07 ff fe ff ff ff f8 07 ff ff
    00000380: ff ff ff fc 07 ff ff ff ff ff ff 87 ff ff ff ff
    00000390: ff ff 03 ff ff ff ff fe 38 03 ff ff ff ff 80 00
    000003a0: 03 ff ff ff ff 80 01 03 ff ff ff ff 80 07 c3 ff
    000003b0: ff ff ff c0 07 e3 ff ff ff ff c0 0f f3 ff ff ff
    000003c0: ff e0 0f f3 ff ff ff ff e0 1f f3 ff ff ff ff f0
    000003d0: 1f fb ff ff df 02 55 00 4a 00 3a 01 fc ff ff f3
    000003e0: ff ff 00 19 fe 7f ff ff ff f3 00 93 fc 3f ff ff
    000003f0: ff c2 00 03 ce 7f e0 00 ff 86 00 03 89 ff e0 00
    00000400: 3f 07 c0 f1
  UrbLink              = 00000000
[549977 ms] UsbSnoop - MyInternalIOCTLCompletion(f8917db0) : fido=81b964f0, Irp=81abb730, Context=81b4d110, IRQL=2
[549977 ms]  <<<  URB 695 coming back  <<< 
-- URB_FUNCTION_BULK_OR_INTERRUPT_TRANSFER:
  PipeHandle           = 82300f14 [endpoint 0x00000002]
  TransferFlags        = 00000000 (USBD_TRANSFER_DIRECTION_OUT, ~USBD_SHORT_TRANSFER_OK)
  TransferBufferLength = 00000404
  TransferBuffer       = 00000000
  TransferBufferMDL    = 81bbe5c0
  UrbLink              = 00000000
[549986 ms] UsbSnoop - DispatchAny(f8916610) : IRP_MJ_INTERNAL_DEVICE_CONTROL
[549986 ms] UsbSnoop - MyDispatchInternalIOCTL(f8917e80) : fdo=822eee08, Irp=81abb730, IRQL=2
[549986 ms]  >>>  URB 696 going down  >>> 
-- URB_FUNCTION_BULK_OR_INTERRUPT_TRANSFER:
  PipeHandle           = 82300ef4 [endpoint 0x00000081]
  TransferFlags        = 00000003 (USBD_TRANSFER_DIRECTION_IN, USBD_SHORT_TRANSFER_OK)
  TransferBufferLength = 00000100
  TransferBuffer       = 00000000
  TransferBufferMDL    = 81bbe5c0
  UrbLink              = 00000000
[549986 ms] UsbSnoop - MyInternalIOCTLCompletion(f8917db0) : fido=81b964f0, Irp=81abb730, Context=81d30f40, IRQL=2
[549986 ms]  <<<  URB 696 coming back  <<< 
-- URB_FUNCTION_BULK_OR_INTERRUPT_TRANSFER:
  PipeHandle           = 82300ef4 [endpoint 0x00000081]
  TransferFlags        = 00000003 (USBD_TRANSFER_DIRECTION_IN, USBD_SHORT_TRANSFER_OK)
  TransferBufferLength = 00000007
  TransferBuffer       = 00000000
  TransferBufferMDL    = 81bbe5c0
    00000000: 00 00 00 02 05 e0 00
  UrbLink              = 00000000
[550026 ms] UsbSnoop - DispatchAny(f8916610) : IRP_MJ_INTERNAL_DEVICE_CONTROL
[550026 ms] UsbSnoop - MyDispatchInternalIOCTL(f8917e80) : fdo=822eee08, Irp=81abb730, IRQL=2
[550026 ms]  >>>  URB 697 going down  >>> 
-- URB_FUNCTION_BULK_OR_INTERRUPT_TRANSFER:
  PipeHandle           = 82300f14 [endpoint 0x00000002]
  TransferFlags        = 00000000 (USBD_TRANSFER_DIRECTION_OUT, ~USBD_SHORT_TRANSFER_OK)
  TransferBufferLength = 00000404
  TransferBuffer       = 00000000
  TransferBufferMDL    = 81bbe5c0
    00000000: 00 00 03 ff 03 83 fe 60 00 0f e3 c0 f9 83 c4 40
    00000010: 00 07 e7 c0 ff 0f 86 7b 00 03 ef c0 cf 9f 06 3f
    00000020: bf c1 ff c0 ef 0f c6 2f ff c8 ff c0 ff 3f c2 3f
    00000030: ff fc 7f c0 ff 7f 02 3d ff fe 7f c0 3f fe 00 3f
    00000040: ff fe 3f c0 ff fe 00 07 ff ff 3f c0 ff dc 00 01
    00000050: ff ff 3f c0 ff 9e 80 00 ff ff 1f c0 fe 1c 00 00
    00000060: 1f ff 1f c0 c6 3c 00 00 07 ff 9f c0 c7 bc 00 00
    00000070: 01 ff 9f c0 cf fc 00 00 01 ff 8d c0 3f f8 00 00
    00000080: 00 ff 2f c0 ff f8 00 00 00 7f 3f c0 ff 70 00 00
    00000090: 00 3f 3f c0 fe 70 00 00 00 1f 9f c0 00 70 00 00
    000000a0: 00 1f ff c0 80 70 1f 00 00 0f ff c0 ff f0 01 80
    000000b0: 00 0f f0 00 ff f0 00 00 1f 8f ff c0 ff 70 04 00
    000000c0: 1f cf ff c0 ff 60 0f 43 80 c7 ff c0 ff a0 07 c3
    000000d0: 80 67 ff c0 ff 00 01 83 ef 07 ff c0 ff 00 06 03
    000000e0: ef 87 ff c0 ff 00 04 01 e1 83 ff c0 ff 00 00 01
    000000f0: f9 c3 9f c0 ff 00 00 00 fc 03 bf c0 ff 00 00 00
    00000100: f0 03 ff c0 ff 00 03 01 f8 03 ff c0 ff 00 0e 00
    00000110: fc 03 ff c0 ff 00 1c 40 fe 03 7f c0 ff 00 30 07
    00000120: fe 01 7f c0 f3 00 60 0f fe 03 7f c0 f3 00 40 07
    00000130: f7 03 7f c0 e7 80 c0 03 f3 c0 7f c0 c7 90 80 03
    00000140: fb c0 ff c0 07 f0 d8 07 fb 80 ff c0 07 f0 48 0f
    00000150: f9 81 ff c0 87 f0 00 07 f9 89 ff c0 ff f0 00 cf
    00000160: f3 09 ff c0 ff f8 00 01 f3 1f ff c0 ff f8 00 06
    00000170: 77 bf ff c0 ff f8 00 06 f7 ff ff c0 ff f8 00 07
    00000180: ff df ff c0 ff f8 00 0f ff ff ff c0 ff f8 00 05
    00000190: 3f ff ff c0 ff b8 00 02 3f bf ff c0 ff 38 00 0c
    000001a0: 7f bf ff c0 fc 3c 00 07 ff bf ff c0 fc 78 00 0f
    000001b0: ff bf ff c0 fe 38 00 1f ff 17 ff c0 ff f0 00 bf
    000001c0: ff 1b ff c0 c3 f0 01 ff fe 1c ff c0 0f f0 01 f7
    000001d0: fc 1e 3f c0 ff f0 03 f3 f8 3f 9f c0 ff e0 03 b3
    000001e0: f0 3f f7 c0 ff e0 00 33 c0 3f ff c0 ff e0 00 37
    000001f0: 80 3f ff c0 ff e0 20 37 00 7f ff c0 ff e0 10 7e
    00000200: 00 7f ff c0 ff e0 18 7c 00 ff ff c0 ff e0 08 78
    00000210: 00 ff ff c0 ff e0 04 e0 00 ff ff c0 ff e0 07 c0
    00000220: 00 ff ff c0 ff e0 1f e0 01 ff ff c0 df 02 55 00
    00000230: 4a 00 3c ff ff ff ff ff ff f6 f0 ff ff ff ed ff
    00000240: ff ff f0 ff ff ef d3 fe ff fe 70 ff ff f0 00 03
    00000250: ff ff d0 ff ff 80 00 00 1f ff e0 ff ff 00 00 00
    00000260: 07 ff e0 ff fe 40 00 00 00 ff 60 ff fe 00 00 00
    00000270: 00 ef d0 ff f4 80 00 02 00 37 50 ff fc 00 00 02
    00000280: 10 9e f0 ff f6 00 00 01 20 5e d0 ff fc 90 00 80
    00000290: 40 7f e0 ff f9 20 00 20 09 13 a0 ff f8 00 00 41
    000002a0: 84 1b f0 ff f8 00 00 05 e2 0c e0 ff fc 00 00 07
    000002b0: 00 86 f0 ff fc 00 00 00 00 1b 70 ff f8 00 00 00
    000002c0: 00 17 f0 ff f4 80 00 0c 0c d7 70 ff e8 00 00 09
    000002d0: 08 5f 70 ff c8 00 00 02 13 bb 70 fc 80 00 00 0c
    000002e0: 3b fe c0 ff 80 00 00 04 1d f9 60 ff 08 00 00 05
    000002f0: 25 f9 30 fb 1e e0 38 bd 20 16 30 f8 0f f0 7f 7e
    00000300: 00 1f 00 fe 0a 18 f1 9f 00 c7 80 fc 0c c8 e6 ff
    00000310: 00 47 c0 fc 07 f1 c7 9f a9 ad c0 fe 00 41 53 8f
    00000320: 91 6f 80 fc 08 00 40 af 3b 57 80 fc 20 00 60 0f
    00000330: af ff 00 fe 40 00 00 1f 79 ff 80 ff 90 01 00 7f
    00000340: 2f fe 80 ff 30 01 40 3e df ff 80 ff d0 03 80 1f
    00000350: df be 20 ff d0 06 40 1f bf fe 00 ff d0 25 c0 3f
    00000360: ff ff 00 ff f0 2f e0 1f ff ff 00 ff f0 4f c0 bf
    00000370: ff fe 00 ff f0 09 80 9f ff fc 00 ff f0 00 00 1f
    00000380: ff f0 00 ff f0 3b e8 1f ff e0 00 ff f0 ed f0 1f
    00000390: ff e0 00 ff f0 00 10 3f ff c0 00 ff f8 08 24 ff
    000003a0: df 80 00 ff f8 00 00 ff 9f 00 00 ff f8 00 05 ff
    000003b0: df 80 00 ff f8 00 0d 7f 3f 80 00 ff fc 00 0f fe
    000003c0: 7f 80 00 ff ff 00 1f fc 7f 80 00 ff ff 00 7f f2
    000003d0: ff 80 00 ff ff 80 fe 30 ff c8 00 ff ff ff 80 c1
    000003e0: ff e0 00 ff ff f4 03 83 ff f0 00 ff ff f2 76 07
    000003f0: ff f8 00 ff ff e7 20 0f ff fc 00 ff ff e0 e0 0f
    00000400: ff f8 00 ff
  UrbLink              = 00000000
[550037 ms] UsbSnoop - MyInternalIOCTLCompletion(f8917db0) : fido=81b964f0, Irp=81abb730, Context=81b4d110, IRQL=2
[550037 ms]  <<<  URB 697 coming back  <<< 
-- URB_FUNCTION_BULK_OR_INTERRUPT_TRANSFER:
  PipeHandle           = 82300f14 [endpoint 0x00000002]
  TransferFlags        = 00000000 (USBD_TRANSFER_DIRECTION_OUT, ~USBD_SHORT_TRANSFER_OK)
  TransferBufferLength = 00000404
  TransferBuffer       = 00000000
  TransferBufferMDL    = 81bbe5c0
  UrbLink              = 00000000
[550046 ms] UsbSnoop - DispatchAny(f8916610) : IRP_MJ_INTERNAL_DEVICE_CONTROL
[550046 ms] UsbSnoop - MyDispatchInternalIOCTL(f8917e80) : fdo=822eee08, Irp=81abb730, IRQL=2
[550046 ms]  >>>  URB 698 going down  >>> 
-- URB_FUNCTION_BULK_OR_INTERRUPT_TRANSFER:
  PipeHandle           = 82300ef4 [endpoint 0x00000081]
  TransferFlags        = 00000003 (USBD_TRANSFER_DIRECTION_IN, USBD_SHORT_TRANSFER_OK)
  TransferBufferLength = 00000100
  TransferBuffer       = 00000000
  TransferBufferMDL    = 81bbe5c0
  UrbLink              = 00000000
[550046 ms] UsbSnoop - MyInternalIOCTLCompletion(f8917db0) : fido=81b964f0, Irp=81abb730, Context=81ba8040, IRQL=2
[550046 ms]  <<<  URB 698 coming back  <<< 
-- URB_FUNCTION_BULK_OR_INTERRUPT_TRANSFER:
  PipeHandle           = 82300ef4 [endpoint 0x00000081]
  TransferFlags        = 00000003 (USBD_TRANSFER_DIRECTION_IN, USBD_SHORT_TRANSFER_OK)
  TransferBufferLength = 00000007
  TransferBuffer       = 00000000
  TransferBufferMDL    = 81bbe5c0
    00000000: 00 00 00 02 05 e0 00
  UrbLink              = 00000000
[550086 ms] UsbSnoop - DispatchAny(f8916610) : IRP_MJ_INTERNAL_DEVICE_CONTROL
[550086 ms] UsbSnoop - MyDispatchInternalIOCTL(f8917e80) : fdo=822eee08, Irp=81abb730, IRQL=2
[550086 ms]  >>>  URB 699 going down  >>> 
-- URB_FUNCTION_BULK_OR_INTERRUPT_TRANSFER:
  PipeHandle           = 82300f14 [endpoint 0x00000002]
  TransferFlags        = 00000000 (USBD_TRANSFER_DIRECTION_OUT, ~USBD_SHORT_TRANSFER_OK)
  TransferBufferLength = 00000404
  TransferBuffer       = 00000000
  TransferBufferMDL    = 81bbe5c0
    00000000: 00 00 03 ff 03 ff f0 00 3f ff fc 00 ff ff f0 00
    00000010: 3f ff fe 00 ff ff f0 00 7f ff ff 00 ff ff f0 00
    00000020: ff ff ff 00 ff ff f8 01 ff ff ff 40 ff ff fc 00
    00000030: ff ff ff 80 ff ff f8 00 ff ff ff c0 ff ff f8 00
    00000040: ff ff ff f0 ff ff f0 01 ff ff ff f0 ff ff e0 07
    00000050: ff ff ff f0 ff ff f0 05 ff ff ff f0 ff ff f0 0f
    00000060: ff ff ff f0 ff ff e0 0f ff ff ff f0 ff ff e0 0f
    00000070: ff ff ff f0 ff ff c0 1f ff ff ff f0 ff ff 80 3f
    00000080: ff ff ff f0 df 02 55 00 4a 00 3a ff ff ff ff ff
    00000090: ff ff c0 ff ff ff ff ff ff ff c0 ff ff ff ff e7
    000000a0: ff ff c0 ff ff ff ff c7 1f ff c0 ff ff ff ff 8f
    000000b0: 87 ff c0 ff ff ff ff ff 73 ff c0 ff ff ff fe 0f
    000000c0: 79 ff c0 ff ff ff fe 4f bf ff c0 ff ff ff ff 8c
    000000d0: ff ff c0 ff ff ff f8 0a 3f ff c0 ff ff ff f0 03
    000000e0: ff ff c0 ff ff ff e0 03 ff ff c0 ff ff fe 00 01
    000000f0: ff ff c0 ff f8 00 00 00 7f ff c0 ff f0 00 00 00
    00000100: 1f ff c0 ff f0 00 00 00 07 ff c0 ff e0 00 00 00
    00000110: 07 ff c0 ff c0 00 00 00 01 ff c0 ff c0 00 00 00
    00000120: 00 ff c0 ff 80 00 00 00 00 ff c0 ff 80 00 00 00
    00000130: 00 7f c0 ff 80 00 00 00 00 ff c0 ff 80 00 00 00
    00000140: 00 ff c0 ff 80 00 00 00 00 ff c0 ff 80 00 00 00
    00000150: 00 ff c0 ff 80 40 00 00 01 ff c0 ff 80 00 00 00
    00000160: 01 ff c0 ff 80 01 00 00 00 ff c0 ff a4 0d 8f 00
    00000170: 00 ff c0 ff 89 ff 8f c0 00 ff c0 ff 98 03 01 c0
    00000180: 00 ff c0 ff 98 d9 17 fe 00 ff c0 ff db 5f 17 e7
    00000190: 00 f7 c0 ff d2 0e 01 c1 80 ff c0 ff d0 7e 00 e0
    000001a0: 00 ff c0 ff 81 0e 00 00 00 c7 c0 ff 98 04 00 00
    000001b0: 00 07 c0 ff f4 04 00 00 00 47 c0 ff d2 0c 02 00
    000001c0: 00 cf c0 ff f4 1c 03 00 00 4f c0 ff f0 3c 01 00
    000001d0: 00 1f c0 ff f8 3e 01 80 00 1f c0 ff fe 7e 1c c0
    000001e0: 00 3f c0 ff de ff fc 40 00 3f c0 ff df ff e0 00
    000001f0: 00 3f c0 ff db 84 c0 00 00 7f c0 ff cc 08 40 00
    00000200: 00 ff c0 ff fe 0c d0 00 00 ff c0 ff fc 01 f0 00
    00000210: 00 ff c0 ff fc 3f fe 00 01 ff c0 ff fe 7e 1f 60
    00000220: 01 ff c0 ff fc 78 07 d0 01 ff c0 ff f5 3f f0 c0
    00000230: 01 ff c0 ff ff ff 00 00 00 ff c0 ff ff fe 00 00
    00000240: 20 7f c0 ff ff f8 00 00 24 7f c0 ff ff f0 00 00
    00000250: 04 7f c0 ff ff f8 00 00 00 3f c0 ff ff fe 00 00
    00000260: 00 3f c0 ff ff ff 00 1c 00 7f c0 ff fe ff f0 18
    00000270: 00 7f c0 ff ff 7f f8 98 00 7f c0 ff fe 7f f8 30
    00000280: 00 ff c0 ff fe 7f fe 70 00 ff c0 ff fc 3f ff fc
    00000290: 01 ff c0 ff fc 3f ff f8 01 ff c0 ff fc 1f fd f0
    000002a0: 01 ff c0 ff fc 0f fc 40 03 ff c0 ff fc 0f e9 80
    000002b0: 03 ff c0 ff fc 07 c7 00 07 ff c0 ff fc 03 8e 00
    000002c0: 07 ff c0 ff fc 01 98 00 0f ff c0 ff fc 00 f0 00
    000002d0: 1f ff c0 ff fc 00 60 00 3f ff c0 df 02 0b 00 4a
    000002e0: 00 35 00 00 00 00 00 00 00 00 00 00 00 00 00 00
    000002f0: 00 00 00 01 00 00 00 00 00 08 00 80 00 00 00 00
    00000300: 80 c8 c0 00 00 00 00 8f ee 70 00 00 00 00 0f ff
    00000310: f8 00 00 00 03 77 ff fe 00 00 00 02 3b ff 7b 00
    00000320: 00 00 04 7f 1f ff 80 00 00 09 f8 01 ff c0 00 00
    00000330: 21 e0 01 ff e0 00 00 47 c0 00 ff f0 00 00 87 80
    00000340: 00 7d f8 00 01 05 00 00 00 3c 00 03 09 00 00 00
    00000350: 1c 00 02 02 00 00 00 0e 00 02 1e 00 00 00 0f 00
    00000360: 06 7c 00 00 00 07 00 04 d0 00 00 00 07 80 01 c0
    00000370: 00 00 00 02 80 07 c0 00 00 00 03 00 06 90 00 00
    00000380: 00 03 80 06 b0 00 00 00 03 80 02 b0 00 00 00 09
    00000390: 80 02 20 00 00 00 09 80 02 60 00 1f 00 0d 80 03
    000003a0: e0 01 ff 80 03 00 01 c0 00 1f 9e 03 00 00 50 01
    000003b0: 7f 1f fb 00 02 38 03 fe 1f fb 00 07 00 18 0e 0f
    000003c0: fb 00 06 00 00 0c 08 fb 00 04 00 00 08 00 1f 00
    000003d0: 00 40 00 10 00 7f 00 00 40 00 00 03 07 00 00 c0
    000003e0: 00 00 00 03 00 00 c0 00 00 04 02 00 00 00 00 08
    000003f0: 02 06 00 00 00 00 19 06 06 00 00 00 00 17 9e 06
    00000400: 00 00 04 00
  UrbLink              = 00000000
[550097 ms] UsbSnoop - MyInternalIOCTLCompletion(f8917db0) : fido=81b964f0, Irp=81abb730, Context=81b4d110, IRQL=2
[550097 ms]  <<<  URB 699 coming back  <<< 
-- URB_FUNCTION_BULK_OR_INTERRUPT_TRANSFER:
  PipeHandle           = 82300f14 [endpoint 0x00000002]
  TransferFlags        = 00000000 (USBD_TRANSFER_DIRECTION_OUT, ~USBD_SHORT_TRANSFER_OK)
  TransferBufferLength = 00000404
  TransferBuffer       = 00000000
  TransferBufferMDL    = 81bbe5c0
  UrbLink              = 00000000
[550106 ms] UsbSnoop - DispatchAny(f8916610) : IRP_MJ_INTERNAL_DEVICE_CONTROL
[550106 ms] UsbSnoop - MyDispatchInternalIOCTL(f8917e80) : fdo=822eee08, Irp=81abb730, IRQL=2
[550106 ms]  >>>  URB 700 going down  >>> 
-- URB_FUNCTION_BULK_OR_INTERRUPT_TRANSFER:
  PipeHandle           = 82300ef4 [endpoint 0x00000081]
  TransferFlags        = 00000003 (USBD_TRANSFER_DIRECTION_IN, USBD_SHORT_TRANSFER_OK)
  TransferBufferLength = 00000100
  TransferBuffer       = 00000000
  TransferBufferMDL    = 81bbe5c0
  UrbLink              = 00000000
[550106 ms] UsbSnoop - MyInternalIOCTLCompletion(f8917db0) : fido=81b964f0, Irp=81abb730, Context=81d30f40, IRQL=2
[550106 ms]  <<<  URB 700 coming back  <<< 
-- URB_FUNCTION_BULK_OR_INTERRUPT_TRANSFER:
  PipeHandle           = 82300ef4 [endpoint 0x00000081]
  TransferFlags        = 00000003 (USBD_TRANSFER_DIRECTION_IN, USBD_SHORT_TRANSFER_OK)
  TransferBufferLength = 00000007
  TransferBuffer       = 00000000
  TransferBufferMDL    = 81bbe5c0
    00000000: 00 00 00 02 05 e0 00
  UrbLink              = 00000000
[550146 ms] UsbSnoop - DispatchAny(f8916610) : IRP_MJ_INTERNAL_DEVICE_CONTROL
[550146 ms] UsbSnoop - MyDispatchInternalIOCTL(f8917e80) : fdo=822eee08, Irp=81abb730, IRQL=2
[550146 ms]  >>>  URB 701 going down  >>> 
-- URB_FUNCTION_BULK_OR_INTERRUPT_TRANSFER:
  PipeHandle           = 82300f14 [endpoint 0x00000002]
  TransferFlags        = 00000000 (USBD_TRANSFER_DIRECTION_OUT, ~USBD_SHORT_TRANSFER_OK)
  TransferBufferLength = 00000404
  TransferBuffer       = 00000000
  TransferBufferMDL    = 81bbe5c0
    00000000: 00 00 03 ff 03 20 7e 06 00 00 08 00 61 7e 0c 00
    00000010: 00 81 00 40 fe cc 00 00 14 81 80 7e 6c 00 00 21
    00000020: 02 85 7a 3c 00 00 20 01 8f ff fc 00 00 20 82 3c
    00000030: 67 fc 00 00 22 b4 78 39 fc 00 00 25 40 f1 2b fc
    00000040: 00 00 17 a9 83 64 fc 00 00 07 bb 09 10 38 00 00
    00000050: 03 1b 00 08 38 00 00 01 7e 02 00 38 00 00 c0 fd
    00000060: 00 48 10 00 00 c0 ff 80 f8 10 00 01 c0 3f 80 f3
    00000070: 70 00 03 f0 1f 82 fc f8 00 07 fe 0c fe ff f8 00
    00000080: 1f ff c7 ff ff f8 00 ff ff f9 ff ff e0 00 ff ff
    00000090: fc 7f ff f8 00 ff ff ff ff ff fe 00 ff ff ff ff
    000000a0: ff ff f0 ff ff ff ff ff ff f8 ff ff f7 7f ff ff
    000000b0: f8 ff ff f0 3f ff ff f8 ff ff fc 7f ff ff f8 ff
    000000c0: ff fc 3f ff ff f8 ff ff fe 1f ff ff f8 ff ff ff
    000000d0: 0f e3 df f8 ff ff ff 83 80 6f f8 ff ff ff c0 00
    000000e0: 0f f8 ff ff ff e0 00 03 f8 df 02 55 00 4a 00 3a
    000000f0: f0 71 11 88 06 03 80 00 fe 71 11 00 06 03 80 00
    00000100: fe 71 30 00 06 03 80 00 fe 71 04 20 00 03 80 00
    00000110: fe 71 0c 80 00 03 80 00 ff 70 06 f0 06 03 80 00
    00000120: ff 31 cf f8 02 83 80 00 f3 f2 bf fc 00 63 80 00
    00000130: e1 f8 ff f6 1e 21 80 00 e1 98 ef e4 7e 01 80 00
    00000140: f1 c0 df 63 e4 e8 00 00 f3 e1 ee c0 07 98 00 00
    00000150: ff ae 33 ed df 26 03 c0 ff 07 ff 86 e7 60 03 c0
    00000160: ff 8f fe 59 ff 8c 03 c0 ff 0f fd d9 8d e6 07 c0
    00000170: ff 8f ef 37 e7 c7 bf c0 f7 9f df 67 d0 02 3f c0
    00000180: f1 9f 1f e6 71 f1 1f c0 e1 44 01 40 2f f7 ff c0
    00000190: e1 00 00 00 15 fc ff c0 f3 44 00 00 1e f9 9f c0
    000001a0: ff 44 00 00 0d ff 9f c0 ff 60 00 00 03 fc 1f c0
    000001b0: ff 08 00 00 03 f8 df c0 ff b0 00 00 01 7c 0f c0
    000001c0: ff c0 00 00 02 18 4f c0 fe c0 00 00 00 61 ff c0
    000001d0: e3 40 00 00 00 70 4f c0 c3 e0 00 00 00 7a 07 c0
    000001e0: c3 20 00 00 02 78 07 c0 e3 a0 00 00 00 19 1f c0
    000001f0: ff a0 00 03 08 0f a3 40 ff a0 00 00 00 08 e3 40
    00000200: ff a0 00 00 00 00 7f c0 ff e0 00 10 f2 01 ff c0
    00000210: ff c0 38 1a 7c 07 ff c0 ff c1 b4 30 0f 0c ef c0
    00000220: e7 e0 00 18 00 0c ef c0 c3 e0 00 3c 04 0d 8f c0
    00000230: c3 e0 00 1c 00 1f 9f c0 e3 e0 00 1e 00 0f 1f c0
    00000240: ef e0 00 1e 00 0d 9f c0 ff f0 00 1c 00 1d 6f c0
    00000250: ff f0 00 0e 00 3d ef c0 ff f0 00 03 00 1b ef c0
    00000260: ff f0 00 0b 00 7d ef c0 ff f0 00 1f 00 3c 6f c0
    00000270: ef f8 00 3f 00 7e e7 80 c7 f8 00 1b 00 7e e7 80
    00000280: 87 e0 00 01 00 7d e7 80 c7 c0 00 02 00 3d e7 80
    00000290: ef c0 04 0d c0 7d e7 80 ff e4 02 03 00 fd ef 80
    000002a0: ff fc 01 96 00 7e e7 80 ff fe 00 70 00 fe f7 80
    000002b0: ff ff 00 00 00 fc ff 80 ff ff 00 00 09 fc ff 80
    000002c0: df ff 80 00 09 fc ff 80 c7 ff c0 00 0b fc ff 80
    000002d0: 87 ff e0 00 1f f9 ff 80 87 ff f0 00 1f f9 ff c0
    000002e0: cf f9 f8 00 7f f1 ff c0 ff f3 fc 00 7f e3 ff c0
    000002f0: ff ff fc 00 ff c3 ff c0 ff ff fd 07 ff 87 ff c0
    00000300: ff ff fc 00 07 07 ff c0 ff ff fc 00 06 0f ff c0
    00000310: ff ff fc 00 08 0f ff c0 ff ff fc 00 08 1f ff c0
    00000320: ff ff fc 00 00 1f ff c0 ff ff fc 00 00 3f ff c0
    00000330: ff ff fe 00 00 3f ff c0 ff ff fe 00 00 7f ff c0
    00000340: df 02 0b 00 4a 00 32 ff ff ff ff ff ff c0 ff ff
    00000350: ff af ff ff c0 ff ff fe f0 f7 ff c0 ff ff f9 9c
    00000360: 3f ff c0 ff ff fb 40 1f ff c0 ff ff 0f 80 0b ff
    00000370: c0 ff ff df 00 07 ff c0 ff ff f0 00 03 ff c0 ff
    00000380: fd e0 09 01 ff c0 ff f3 c0 00 90 ff c0 ff e7 80
    00000390: 60 0c ff c0 ff ed 80 80 01 5f c0 ff cb 80 00 00
    000003a0: 1f c0 ff db 80 00 00 6f c0 ff f1 c0 00 00 17 c0
    000003b0: ff f0 e0 00 00 17 c0 ff f0 61 00 00 0f c0 ff f0
    000003c0: 61 00 00 2f c0 ff f0 60 00 00 0f c0 ff f0 00 00
    000003d0: 00 0f c0 ff f0 00 00 00 0f c0 ff f0 00 00 00 0f
    000003e0: c0 ff f0 00 00 00 17 c0 ff f0 00 00 00 07 c0 ff
    000003f0: f0 00 00 00 17 c0 ff e0 01 fb 00 1f c0 ff df 83
    00000400: fd 80 1f c0
  UrbLink              = 00000000
[550157 ms] UsbSnoop - MyInternalIOCTLCompletion(f8917db0) : fido=81b964f0, Irp=81abb730, Context=81b4d110, IRQL=2
[550157 ms]  <<<  URB 701 coming back  <<< 
-- URB_FUNCTION_BULK_OR_INTERRUPT_TRANSFER:
  PipeHandle           = 82300f14 [endpoint 0x00000002]
  TransferFlags        = 00000000 (USBD_TRANSFER_DIRECTION_OUT, ~USBD_SHORT_TRANSFER_OK)
  TransferBufferLength = 00000404
  TransferBuffer       = 00000000
  TransferBufferMDL    = 81bbe5c0
  UrbLink              = 00000000
[550166 ms] UsbSnoop - DispatchAny(f8916610) : IRP_MJ_INTERNAL_DEVICE_CONTROL
[550166 ms] UsbSnoop - MyDispatchInternalIOCTL(f8917e80) : fdo=822eee08, Irp=81abb730, IRQL=2
[550166 ms]  >>>  URB 702 going down  >>> 
-- URB_FUNCTION_BULK_OR_INTERRUPT_TRANSFER:
  PipeHandle           = 82300ef4 [endpoint 0x00000081]
  TransferFlags        = 00000003 (USBD_TRANSFER_DIRECTION_IN, USBD_SHORT_TRANSFER_OK)
  TransferBufferLength = 00000100
  TransferBuffer       = 00000000
  TransferBufferMDL    = 81bbe5c0
  UrbLink              = 00000000
[550166 ms] UsbSnoop - MyInternalIOCTLCompletion(f8917db0) : fido=81b964f0, Irp=81abb730, Context=81ba8040, IRQL=2
[550166 ms]  <<<  URB 702 coming back  <<< 
-- URB_FUNCTION_BULK_OR_INTERRUPT_TRANSFER:
  PipeHandle           = 82300ef4 [endpoint 0x00000081]
  TransferFlags        = 00000003 (USBD_TRANSFER_DIRECTION_IN, USBD_SHORT_TRANSFER_OK)
  TransferBufferLength = 00000007
  TransferBuffer       = 00000000
  TransferBufferMDL    = 81bbe5c0
    00000000: 00 00 00 02 05 e0 00
  UrbLink              = 00000000
[550206 ms] UsbSnoop - DispatchAny(f8916610) : IRP_MJ_INTERNAL_DEVICE_CONTROL
[550206 ms] UsbSnoop - MyDispatchInternalIOCTL(f8917e80) : fdo=822eee08, Irp=81abb730, IRQL=2
[550206 ms]  >>>  URB 703 going down  >>> 
-- URB_FUNCTION_BULK_OR_INTERRUPT_TRANSFER:
  PipeHandle           = 82300f14 [endpoint 0x00000002]
  TransferFlags        = 00000000 (USBD_TRANSFER_DIRECTION_OUT, ~USBD_SHORT_TRANSFER_OK)
  TransferBufferLength = 00000404
  TransferBuffer       = 00000000
  TransferBufferMDL    = 81bbe5c0
    00000000: 00 00 03 ff 03 ff bf c1 a6 00 0f c0 ff ef 60 5f
    00000010: c0 0f c0 ff fb a0 8c 80 1f c0 ff f1 a0 00 01 1f
    00000020: c0 ff c8 60 00 00 37 c0 ff ec 60 00 02 ef c0 ff
    00000030: e4 40 00 01 cf c0 ff e0 40 00 06 cf c0 ff f0 40
    00000040: 00 05 6f c0 ff f0 40 00 00 7f c0 ff f0 c0 00 00
    00000050: cf c0 ff f8 80 00 00 9f c0 ff fc 80 00 00 3f c0
    00000060: ff fc c3 80 00 3f c0 ff fe ee 00 00 3f c0 ff fe
    00000070: f8 00 00 7f c0 ff fe 60 00 00 bf c0 ff fc 88 00
    00000080: 01 bf c0 ff fc e0 30 00 3f c0 ff fc 7d 00 00 3f
    00000090: c0 ff fc 70 00 02 7f c0 ff fe 60 00 00 ff c0 ff
    000000a0: ff f8 00 03 ff c0 ff f7 a8 00 06 ff c0 ff fb c0
    000000b0: 00 0e ff c0 ff cf 80 00 3f ff c0 ff ed 80 00 7f
    000000c0: ff c0 ff e6 ca 00 ff ff c0 ff c3 7a 03 ff ff c0
    000000d0: ff e1 96 0f ff ff c0 ff fe 7c 3f ff ff c0 ff ff
    000000e0: 80 ff ff ff c0 ff ff fb ff ff ff c0 ff ff ff ff
    000000f0: ff ff c0 ff ff ff ff ff ff c0 ff ff ff ff ff ff
    00000100: c0 ff ff ff ff ff ff c0 ff ff ff ff ff ff c0 ff
    00000110: ff ff ff ff ff c0 ff ff ff ff ff ff c0 ff ff ff
    00000120: ff ff ff c0 ff ff ff ff ff ff c0 ff ff ff ff ff
    00000130: ff c0 ff ff ff ff ff ff c0 ff e7 ff fb ff ff c0
    00000140: ff c3 ff e7 ff ff c0 ff 81 ff cf ff ff c0 df 02
    00000150: 55 00 4a 00 3f ff ff ff ff ff ff ff fe ff ff ff
    00000160: ff ff ff ff fe ff ff fe 80 7f ff ff fe ff ff f0
    00000170: 00 00 3f ff fe ff ff f0 02 c0 07 ff fe ff ff e0
    00000180: 17 fd 71 ff fe ff ff c0 1f fd fe 7f fe ff ff c0
    00000190: 7f ff ff bf fe ff ff 00 77 ff ff ef fe ff ff 00
    000001a0: 3b ff ff fb fe ff ff 00 3b ff ff ff fe ff fe 00
    000001b0: 11 ff ff ff fe ff fe 00 09 ff ff ff fe ff fc 00
    000001c0: 05 ff ff ff fe ff f8 00 00 ff ff ff fe ff f8 00
    000001d0: 00 7f f7 ff fe ff f8 00 00 17 7f ff fe ff f0 00
    000001e0: 00 13 bf ff fe ff f0 00 00 00 eb ff fe ff e0 40
    000001f0: 10 40 ab ff fe ff e0 3c 48 00 67 ff fe ff e3 9e
    00000200: 00 04 17 ff fe ff 8f c4 00 00 1a df fe ff af 72
    00000210: 00 40 28 af fe ff a6 3c c0 09 01 8f fe ff e7 9d
    00000220: 81 01 c0 0b fe ff ed fc 81 06 60 27 be ff ce 3c
    00000230: 02 0d 99 03 7e ff 9e 18 00 49 85 02 7e ff 3a 78
    00000240: 00 01 8b 4a fe ff 59 e4 00 01 07 0c fe fe dc 02
    00000250: 00 25 06 4d 7e fe e4 01 c0 23 c4 90 3e fd f0 02
    00000260: 00 03 cc 94 7e f9 f8 0c 68 03 8a 70 7e f9 0c 01
    00000270: 00 0e 9a e2 fe fd fc 01 08 08 85 5c fe fc fc 00
    00000280: 60 13 24 fc fe ff dc 00 10 10 d7 fe fe ff c0 00
    00000290: 08 0b 27 ff fe ff c2 00 00 06 01 fb fe ff c0 00
    000002a0: 00 00 01 7f fe ff d8 00 00 00 04 4f fe ff ee 00
    000002b0: 00 cb 06 ff fe ff e3 00 18 f0 05 7f fe ff ed 00
    000002c0: 00 5f 70 9f fe ff e4 00 21 3a e7 1f fe ff f3 20
    000002d0: 84 04 9c 1f fe ff e0 00 85 80 f0 0f fe ff e0 01
    000002e0: 98 03 80 0f fe ff e2 27 68 0e 00 1f fe ff c0 3f
    000002f0: 20 38 00 3f fe ff e5 fe c1 c0 00 7f fe ff f7 dc
    00000300: 07 00 00 ff fe ff fe 08 18 00 01 ff 7e ff ff c0
    00000310: e0 00 07 ff be ff ff fd 00 00 0f ff 9e ff ff fc
    00000320: 00 00 1f ff de ff ff fb 00 00 7f ff e6 ff ff fb
    00000330: 00 00 ff ff f2 ff ff e9 80 01 ff ff fc ff ff db
    00000340: c0 0f ff ff fe ff ff 33 e0 1f ff ff fe ff fe 77
    00000350: e0 7f ff ff fe ff f4 f7 80 ff ff ff fe ff e9 ef
    00000360: 01 ff ff ff fe ff c3 de 07 ff ff ff fe ff a7 dc
    00000370: 0f ff ff ff fe ff cf b8 1f ff ff ff fe ff 9f f8
    00000380: 7f ff ff ff fe ff 3c f1 ff ff ff ff fe ff 7d f3
    00000390: f7 ff ff ff fe fe ff ff ef ff ff ff fe fd fd ff
    000003a0: df ff ff ff fe df 02 55 00 4a 00 3a 00 00 00 00
    000003b0: 00 00 00 00 00 00 07 f7 f8 00 00 00 00 00 3e 17
    000003c0: ff 00 00 00 00 00 61 df ed c0 00 00 00 00 fe 80
    000003d0: 1f e0 00 00 00 01 c0 00 03 f0 00 00 00 03 00 00
    000003e0: 01 f8 00 00 00 02 00 00 01 3c 00 00 00 00 00 00
    000003f0: 02 3e 00 00 00 00 00 00 00 1f 80 00 00 00 00 00
    00000400: 02 1f c0 00
  UrbLink              = 00000000
[550217 ms] UsbSnoop - MyInternalIOCTLCompletion(f8917db0) : fido=81b964f0, Irp=81abb730, Context=81c3bfe8, IRQL=2
[550217 ms]  <<<  URB 703 coming back  <<< 
-- URB_FUNCTION_BULK_OR_INTERRUPT_TRANSFER:
  PipeHandle           = 82300f14 [endpoint 0x00000002]
  TransferFlags        = 00000000 (USBD_TRANSFER_DIRECTION_OUT, ~USBD_SHORT_TRANSFER_OK)
  TransferBufferLength = 00000404
  TransferBuffer       = 00000000
  TransferBufferMDL    = 81bbe5c0
  UrbLink              = 00000000
[550226 ms] UsbSnoop - DispatchAny(f8916610) : IRP_MJ_INTERNAL_DEVICE_CONTROL
[550226 ms] UsbSnoop - MyDispatchInternalIOCTL(f8917e80) : fdo=822eee08, Irp=81abb730, IRQL=2
[550226 ms]  >>>  URB 704 going down  >>> 
-- URB_FUNCTION_BULK_OR_INTERRUPT_TRANSFER:
  PipeHandle           = 82300ef4 [endpoint 0x00000081]
  TransferFlags        = 00000003 (USBD_TRANSFER_DIRECTION_IN, USBD_SHORT_TRANSFER_OK)
  TransferBufferLength = 00000100
  TransferBuffer       = 00000000
  TransferBufferMDL    = 81bbe5c0
  UrbLink              = 00000000
[550226 ms] UsbSnoop - MyInternalIOCTLCompletion(f8917db0) : fido=81b964f0, Irp=81abb730, Context=81b4d110, IRQL=2
[550226 ms]  <<<  URB 704 coming back  <<< 
-- URB_FUNCTION_BULK_OR_INTERRUPT_TRANSFER:
  PipeHandle           = 82300ef4 [endpoint 0x00000081]
  TransferFlags        = 00000003 (USBD_TRANSFER_DIRECTION_IN, USBD_SHORT_TRANSFER_OK)
  TransferBufferLength = 00000007
  TransferBuffer       = 00000000
  TransferBufferMDL    = 81bbe5c0
    00000000: 00 00 00 02 05 e0 00
  UrbLink              = 00000000
[550266 ms] UsbSnoop - DispatchAny(f8916610) : IRP_MJ_INTERNAL_DEVICE_CONTROL
[550266 ms] UsbSnoop - MyDispatchInternalIOCTL(f8917e80) : fdo=822eee08, Irp=81abb730, IRQL=2
[550266 ms]  >>>  URB 705 going down  >>> 
-- URB_FUNCTION_BULK_OR_INTERRUPT_TRANSFER:
  PipeHandle           = 82300f14 [endpoint 0x00000002]
  TransferFlags        = 00000000 (USBD_TRANSFER_DIRECTION_OUT, ~USBD_SHORT_TRANSFER_OK)
  TransferBufferLength = 00000404
  TransferBuffer       = 00000000
  TransferBufferMDL    = 81bbe5c0
    00000000: 00 00 03 ff 03 00 00 00 00 0d cf e0 00 00 00 00
    00000010: 00 14 ff e0 00 00 00 00 00 a7 9f f0 00 00 00 00
    00000020: 00 63 cf f8 00 00 00 00 00 67 ef fc 00 00 00 00
    00000030: 00 9f 9f fc 00 00 00 00 00 bf ff fc 00 00 00 00
    00000040: 01 ef ff fc 00 00 00 00 03 ff ff fc 00 00 00 00
    00000050: 45 ff df fe 00 00 00 00 40 7f ff fe 00 00 40 40
    00000060: 05 ff ff fe 00 00 f0 02 7f ff ff fc 00 00 7f c7
    00000070: ff ff ff fc 00 00 7f e7 ff ff ff fe 00 00 7f e3
    00000080: ff ff ff fc 00 00 3d c7 ff ff ff fc 00 00 1b 8f
    00000090: a6 ff ff fc 00 00 17 8f 83 ff ff fc 00 00 00 1e
    000000a0: cf ff ff fc 00 00 00 1f 83 ef ff fc 00 00 00 1f
    000000b0: 8f 0f fd fc 00 00 00 1f 80 1f ff ff 00 01 00 1f
    000000c0: 80 7f ff fd 00 00 00 3f 00 ff ff fc 00 00 00 3f
    000000d0: 80 7f fe fc 00 00 00 ff 81 ff ff f8 00 01 01 ff
    000000e0: c0 ff ff f8 00 04 00 ff 85 ff ff f0 00 01 04 3f
    000000f0: 87 ff ff e0 00 01 00 0f a7 ff ff f0 00 00 80 2d
    00000100: 17 bf ff b0 00 00 80 21 1f ff fe e0 00 08 80 01
    00000110: ed ff ff e0 00 02 80 ff ed ff ff e0 00 01 87 ff
    00000120: f9 ff ff c0 00 08 06 03 f9 ff ff 80 00 00 48 7f
    00000130: f1 ff ff 00 00 00 08 ff f1 ff ff 00 00 00 00 7f
    00000140: 21 ff fe 00 00 00 00 00 01 ff fe 00 00 00 00 00
    00000150: 00 ff fd 80 00 00 00 00 21 ff f9 c0 00 00 00 21
    00000160: 7f ff e3 c0 00 00 00 21 ff ff c7 e0 00 00 00 63
    00000170: ff ff 0f e0 00 00 06 67 ff f8 3f f0 00 00 01 f7
    00000180: ff e0 ff f0 00 00 00 ff ff 83 ff f8 00 00 02 3f
    00000190: fe 0f ff f8 00 00 00 0f f1 ff ff fc 00 00 04 3f
    000001a0: ff ef ff fc 00 00 0e 6f fb 1f ff ff 00 00 1f 7f
    000001b0: e0 7f ff ff 80 3f bf 0f 07 ff ff ff c0 3f ff 8c
    000001c0: 1f ff ff ff c0 7f ff c0 7f ff ff ff c0 7f ff 79
    000001d0: ff ff ff ff c0 ff ff ff ff ff ff ff c0 ff ff d3
    000001e0: ff ff ff ff c0 ff ff bf ff ff ff ff c0 ff ff 7f
    000001f0: ff ff ff ff c0 ff fe ff ff ff ff ff c0 df 02 55
    00000200: 00 4a 00 3a ff ff ff ff ff ff ff c0 ff ff ff fe
    00000210: 1f ff ff c0 ff ff fc 20 07 ff ff c0 ff ff dc 00
    00000220: 08 ff ff c0 ff ff b8 00 0c 3f ff c0 ff ff f0 00
    00000230: 03 8f ff c0 ff ff c0 00 01 f3 ff c0 ff ff 80 00
    00000240: 00 7f ff c0 ff ff 00 00 00 3f ff c0 ff fe 00 00
    00000250: 00 3f ff c0 ff fc 00 00 00 3f ff c0 ff fc 00 00
    00000260: 00 3f ff c0 ff f8 00 00 00 3f ff c0 ff f0 00 00
    00000270: 00 1f ff c0 ff f4 00 00 00 1f ff c0 ff f0 00 00
    00000280: 00 0f ff c0 ff f0 00 00 00 0f ff c0 ff e4 00 00
    00000290: 00 0f ff c0 ff e0 00 00 00 07 ff c0 ff e8 00 00
    000002a0: 00 0f ff c0 ff e8 00 00 00 07 ff c0 ff ec 00 10
    000002b0: 00 07 ff c0 ff ff c0 00 00 00 ff c0 ff e0 e0 00
    000002c0: 00 00 df c0 ff e0 20 be 00 00 7f c0 ff ef 60 ff
    000002d0: 80 00 3f c0 ff ff c0 0c 60 00 3f c0 ff fd c0 00
    000002e0: 00 00 3f c0 ff f5 c0 00 00 03 9f c0 ff f7 c0 00
    000002f0: 00 01 df c0 ff e7 c0 00 00 00 df c0 ff ef c0 00
    00000300: 00 00 9f c0 ff ef 80 00 00 20 3f c0 ff ef 00 40
    00000310: 00 22 3f c0 ff ef c0 60 00 00 3f c0 ff ff e7 30
    00000320: 00 00 7f c0 ff f7 f8 18 00 00 7f c0 ff f7 c8 0c
    00000330: 00 00 ff c0 ff f7 00 06 00 03 ff c0 ff fc 00 03
    00000340: 40 03 ff c0 ff f8 80 01 00 01 ff c0 ff f1 9d 00
    00000350: 00 01 ff c0 ff fd fe e0 80 01 ff c0 ff ff f0 7f
    00000360: 80 03 ff c0 ff ff f9 00 00 02 ff c0 ff ff f8 00
    00000370: 00 00 ff c0 ff ff f8 00 00 01 1f c0 ff ff f8 00
    00000380: 03 02 1f c0 ff ff f0 00 02 00 1f c0 ff ff f0 00
    00000390: e4 00 1f c0 ff ff f1 00 f8 40 7f c0 ff ff f9 83
    000003a0: f8 00 ff c0 ff ff ff df f2 03 ff c0 ff ff ff ff
    000003b0: cc 0f ff c0 ff ff ff ff b0 3f ff c0 ff ff ff ff
    000003c0: e0 7f ff c0 ff ff ff ff 81 ff ff c0 ff ff f7 fe
    000003d0: 07 ff ff c0 ff ff f7 f8 1f ff ff c0 ff ff e3 e0
    000003e0: 7f ff ff c0 ff ff e3 00 ff ff ff c0 ff ff e2 03
    000003f0: ff ff ff c0 ff ff df 0f ff ff ff c0 ff ff ff 9f
    00000400: ff ff ff c0
  UrbLink              = 00000000
[550277 ms] UsbSnoop - MyInternalIOCTLCompletion(f8917db0) : fido=81b964f0, Irp=81abb730, Context=81c3bfe8, IRQL=2
[550277 ms]  <<<  URB 705 coming back  <<< 
-- URB_FUNCTION_BULK_OR_INTERRUPT_TRANSFER:
  PipeHandle           = 82300f14 [endpoint 0x00000002]
  TransferFlags        = 00000000 (USBD_TRANSFER_DIRECTION_OUT, ~USBD_SHORT_TRANSFER_OK)
  TransferBufferLength = 00000404
  TransferBuffer       = 00000000
  TransferBufferMDL    = 81bbe5c0
  UrbLink              = 00000000
[550286 ms] UsbSnoop - DispatchAny(f8916610) : IRP_MJ_INTERNAL_DEVICE_CONTROL
[550286 ms] UsbSnoop - MyDispatchInternalIOCTL(f8917e80) : fdo=822eee08, Irp=81abb730, IRQL=2
[550286 ms]  >>>  URB 706 going down  >>> 
-- URB_FUNCTION_BULK_OR_INTERRUPT_TRANSFER:
  PipeHandle           = 82300ef4 [endpoint 0x00000081]
  TransferFlags        = 00000003 (USBD_TRANSFER_DIRECTION_IN, USBD_SHORT_TRANSFER_OK)
  TransferBufferLength = 00000100
  TransferBuffer       = 00000000
  TransferBufferMDL    = 81bbe5c0
  UrbLink              = 00000000
[550286 ms] UsbSnoop - MyInternalIOCTLCompletion(f8917db0) : fido=81b964f0, Irp=81abb730, Context=81d30f40, IRQL=2
[550286 ms]  <<<  URB 706 coming back  <<< 
-- URB_FUNCTION_BULK_OR_INTERRUPT_TRANSFER:
  PipeHandle           = 82300ef4 [endpoint 0x00000081]
  TransferFlags        = 00000003 (USBD_TRANSFER_DIRECTION_IN, USBD_SHORT_TRANSFER_OK)
  TransferBufferLength = 00000007
  TransferBuffer       = 00000000
  TransferBufferMDL    = 81bbe5c0
    00000000: 00 00 00 02 05 e0 00
  UrbLink              = 00000000
[550326 ms] UsbSnoop - DispatchAny(f8916610) : IRP_MJ_INTERNAL_DEVICE_CONTROL
[550326 ms] UsbSnoop - MyDispatchInternalIOCTL(f8917e80) : fdo=822eee08, Irp=81abb730, IRQL=2
[550327 ms]  >>>  URB 707 going down  >>> 
-- URB_FUNCTION_BULK_OR_INTERRUPT_TRANSFER:
  PipeHandle           = 82300f14 [endpoint 0x00000002]
  TransferFlags        = 00000000 (USBD_TRANSFER_DIRECTION_OUT, ~USBD_SHORT_TRANSFER_OK)
  TransferBufferLength = 00000404
  TransferBuffer       = 00000000
  TransferBufferMDL    = 81bbe5c0
    00000000: 00 00 03 ff 03 ff ff ff ff ff ff ff c0 ff fd ff
    00000010: ff ff ff ff c0 ff fd ff ff ff ff ff c0 ff fb ff
    00000020: ff ff ff ff c0 ff ff ff ff ff ff ff c0 ff ff ff
    00000030: ff ff ff ff c0 ff e7 ff ff ff ff ff c0 ff ef ff
    00000040: ff ff ff ff c0 ff ff ff ff ff ff ff c0 ff ff ff
    00000050: ff ff ff ff c0 df 02 55 00 4a 00 3f ff ff ff ff
    00000060: ff ff ff fe ff ff ff 93 ff ff ff fe ff ff f8 3f
    00000070: ff ff ff fe ff ff e1 7f ff ff ff fe ff ff 9b ff
    00000080: ff fb ff fe ff ff 3d ff ff fd ff fe ff fe df ff
    00000090: 7f fe ff fe ff f9 ff ff ff ff ff fe ff fa ff 8f
    000000a0: ef ff ff fe ff f1 ff 0f ff ff ff fe ff ef fc 1f
    000000b0: bf ff ff fe ff cf 80 3f ff ff ff fe ff f0 00 3f
    000000c0: ff ff ff fe ff 80 00 3f ff ff ff fe ff 80 00 9f
    000000d0: ff ff ff fe ff 00 00 1f ff ff ff fe ff 00 00 3f
    000000e0: ff ff ff fe ff 00 00 3f ff ff ff fe ff 00 00 3f
    000000f0: ff ff ff fe ff 00 00 7f ff ff ff fe fe 00 00 7f
    00000100: ff ff ff fe fe 00 01 ff ff ff ff fe fe 00 00 ff
    00000110: ff ff ff fe fe 00 00 ff ff ff ff fe fe 00 03 ff
    00000120: ff ff ff fe ff 00 07 ff ff ff ff fe ff 00 0f 9f
    00000130: ff ff ff fe ff 00 5f 0f ff ff ff fe ff 00 7c ff
    00000140: ff ff ff fe ff 1c 37 2f ff ff ff fe ff 3a 3f 2f
    00000150: ff ff ff fe ff c6 2f 07 ff ff ff fe ff 9d 3e 87
    00000160: bf ff ff fe ff ba 3d 85 7f ff ff fe ff e0 7f 00
    00000170: ff ff ff fe ff e2 7f 90 ff ff ff fe ff e6 7f e1
    00000180: ff ff ff fe ff e0 7f 80 ff ff ff fe ff e0 7f 81
    00000190: ff ff ff fe ff e0 7f c1 ff ff ff fe ff f0 7f e1
    000001a0: ff ff ff fe ff f0 7f f3 ff ff ff fe ff f0 7f f9
    000001b0: ff ff ff 7e ff f8 df f9 ff ff ff 3e ff f8 8f fe
    000001c0: 7f ff ff 7e ff f8 83 ff 7f ff fe 7e ff fd 82 7f
    000001d0: ff ff fc fe ff fc 80 27 ff ff fc fe ff fc 03 fd
    000001e0: ff ff f9 fe ff fe 03 f8 7f ff f3 fe ff fe 0f 0e
    000001f0: 7f ff e3 fe ff ff 30 7f 7f ff c7 fe ff ff 20 7f
    00000200: 7f ff cf fe ff ff 80 7f ff ff 1f fe ff ff 80 7f
    00000210: ff fe 1f fe ff ff c0 3f ff fc 3f fe ff ff c0 0f
    00000220: ff f8 3f fe ff ff e0 1f ff f0 7f fe ff ff f0 1f
    00000230: ff e0 ff fe ff ff f0 07 ff c0 ff fe ff ff f8 1f
    00000240: ff 01 ff fe ff ff fc 1f be 01 ff fe ff ff fc 1f
    00000250: 3c 03 ff fe ff ff ff 7f f0 07 ff fe ff ff ff e6
    00000260: 00 07 ff fe ff ff ff f4 00 03 ff fe ff ff ff c2
    00000270: 00 07 ff fe ff ff ff c2 00 07 ff fe ff ff fe c0
    00000280: 00 07 ff fe ff ff fe 81 00 0f ff fe ff ff fd 82
    00000290: 00 0b ff fe ff ff ff 02 00 0b ff fe ff ff fb 00
    000002a0: 00 03 ff fe ff ff f7 04 00 01 ff fe df 02 0b 00
    000002b0: 4a 00 37 ff ff ff ff ff ff fe ff ff ff ff ff ff
    000002c0: fe ff ff ff ff ff ff fe ff ff fc 00 3f ff fe ff
    000002d0: fb 1f 20 0f ff fe ff f2 9e 4d e3 ff fe ff fc f9
    000002e0: bf f9 ff fe ff fc 73 7f fe 7f fe ff fe 2f fe 1f
    000002f0: 3f fe ff f2 fc 00 03 df fe ff cd f8 00 00 6f fe
    00000300: ff bf e0 00 00 f7 fe ff ff 00 00 00 ff fe ff f8
    00000310: 00 00 00 7f fe ff f8 00 00 00 0f fe ff 38 00 00
    00000320: 00 0d 7e ff f0 00 00 00 01 fe fd 28 00 00 00 40
    00000330: be ff 60 00 00 00 40 be ff 40 00 00 00 20 2e d6
    00000340: c0 00 00 00 20 36 fe 80 00 00 00 24 b6 da 20 00
    00000350: 00 00 24 ba 8d f0 20 00 00 a6 ba fd fc 00 00 00
    00000360: e3 3e 75 bf 2c 00 00 60 7a cc ff 3f f1 00 60 7a
    00000370: fd fe 1e f0 08 c0 6e f1 26 1f 8c 10 a0 de e1 04
    00000380: 0f c4 80 84 7e ce 78 06 f2 02 0f 5e f2 18 01 0c
    00000390: 04 00 2e 12 18 00 00 00 46 3e f6 20 06 00 00 05
    000003a0: be f2 20 00 00 01 60 be d2 00 00 00 00 1d 2e fb
    000003b0: 00 00 00 00 4c 5e f2 40 20 00 00 8c de fe e0 10
    000003c0: 00 40 28 5e bf 33 90 00 60 43 de ff 3e c8 08 40
    000003d0: 01 fe fe 7c 0c 06 00 03 fe f6 f0 04 52 00 0b 3e
    000003e0: ff 64 06 00 01 1e fe 6d e0 02 00 01 be 7e ed fc
    000003f0: 01 00 09 fb be ed 5f 00 00 31 1d fe ee c1 f0 00
    00000400: 23 2d fe 27
  UrbLink              = 00000000
[550338 ms] UsbSnoop - MyInternalIOCTLCompletion(f8917db0) : fido=81b964f0, Irp=81abb730, Context=81c3bfe8, IRQL=2
[550338 ms]  <<<  URB 707 coming back  <<< 
-- URB_FUNCTION_BULK_OR_INTERRUPT_TRANSFER:
  PipeHandle           = 82300f14 [endpoint 0x00000002]
  TransferFlags        = 00000000 (USBD_TRANSFER_DIRECTION_OUT, ~USBD_SHORT_TRANSFER_OK)
  TransferBufferLength = 00000404
  TransferBuffer       = 00000000
  TransferBufferMDL    = 81bbe5c0
  UrbLink              = 00000000
[550346 ms] UsbSnoop - DispatchAny(f8916610) : IRP_MJ_INTERNAL_DEVICE_CONTROL
[550346 ms] UsbSnoop - MyDispatchInternalIOCTL(f8917e80) : fdo=822eee08, Irp=81abb730, IRQL=2
[550346 ms]  >>>  URB 708 going down  >>> 
-- URB_FUNCTION_BULK_OR_INTERRUPT_TRANSFER:
  PipeHandle           = 82300ef4 [endpoint 0x00000081]
  TransferFlags        = 00000003 (USBD_TRANSFER_DIRECTION_IN, USBD_SHORT_TRANSFER_OK)
  TransferBufferLength = 00000100
  TransferBuffer       = 00000000
  TransferBufferMDL    = 81bbe5c0
  UrbLink              = 00000000
[550346 ms] UsbSnoop - MyInternalIOCTLCompletion(f8917db0) : fido=81b964f0, Irp=81abb730, Context=81b4d110, IRQL=2
[550346 ms]  <<<  URB 708 coming back  <<< 
-- URB_FUNCTION_BULK_OR_INTERRUPT_TRANSFER:
  PipeHandle           = 82300ef4 [endpoint 0x00000081]
  TransferFlags        = 00000003 (USBD_TRANSFER_DIRECTION_IN, USBD_SHORT_TRANSFER_OK)
  TransferBufferLength = 00000007
  TransferBuffer       = 00000000
  TransferBufferMDL    = 81bbe5c0
    00000000: 00 00 00 02 05 e0 00
  UrbLink              = 00000000
[550386 ms] UsbSnoop - DispatchAny(f8916610) : IRP_MJ_INTERNAL_DEVICE_CONTROL
[550386 ms] UsbSnoop - MyDispatchInternalIOCTL(f8917e80) : fdo=822eee08, Irp=81abb730, IRQL=2
[550386 ms]  >>>  URB 709 going down  >>> 
-- URB_FUNCTION_BULK_OR_INTERRUPT_TRANSFER:
  PipeHandle           = 82300f14 [endpoint 0x00000002]
  TransferFlags        = 00000000 (USBD_TRANSFER_DIRECTION_OUT, ~USBD_SHORT_TRANSFER_OK)
  TransferBufferLength = 00000404
  TransferBuffer       = 00000000
  TransferBufferMDL    = 81bbe5c0
    00000000: 00 00 03 ff 03 70 30 00 48 e7 fe 77 f8 00 00 11
    00000010: bf fe b6 fc 00 00 21 7f fe fb 9e 08 03 03 bf fe
    00000020: fb 01 0c 2e 07 bf fe 3d c0 06 70 0f ff fe fd e0
    00000030: 00 c0 3f ff fe ec f8 00 80 7f ff fe fd a7 19 41
    00000040: ff ff fe f3 f4 ff c3 ff ff fe c7 ff fe 9f ff ff
    00000050: fe 3f fb f0 bf ff ff fe ff fe 01 ff 7f ff fe ff
    00000060: ff ff f9 ff ff fe ed ff ff e7 ff ff fe bf ff ff
    00000070: 1f ff ff ee ff ff ee ff ff ff fe ff f7 df ff ff
    00000080: ff fe f0 7f bf ff ff ff fe 87 ff e7 ff ff ff fe
    00000090: 7f ff ff ff ff ff fe ff ff ff ff ff ff fe ff c1
    000000a0: 8f ff ff ff fe ff 00 3f df ff ff fe ff 00 07 3f
    000000b0: ff ff fe fe 00 01 ff ff ff fe df 4e 56 ff a8 48
    000000c0: ee 0c 08 ff f4 34 7c 00 c8 24 52 3e bc 00 00 20
    000000d0: 6e 00 08 2f 08 f8 80 58 8f 26 48 20 0b 67 34 41
    000000e0: ee ff ac 2e 88 f9 54 36 00 66 0c 20 6a 04 24 2e
    000000f0: 90 fb 64 f9 55 60 12 22 6a 04 24 22 8b 0c 43 01
    00000100: 0e 67 06 30 3c 00 00 60 0a 22 6a 04 24 22 8b 30
    00000110: 3c 00 01 4c ee 0c 08 ff f4 4e 5e 4e 75 4e 56 ff
    00000120: e8 41 ee ff ec 2e 88 20 6e 00 08 2f 08 f8 7b 3e
    00000130: bc 00 00 48 6e ff ff f8 66 4e 5e 4e 75 4e 56 ff
    00000140: 54 48 ee 1c 18 ff ec 24 6e 00 0a 36 7c 00 c8 26
    00000150: 53 28 6b 04 24 28 54 70 00 3d 40 ff e8 26 00 34
    00000160: 80 41 ee ff a0 2e 88 f9 54 38 00 66 00 00 6a 41
    00000170: ee ff 58 2e 88 f9 54 38 00 66 3a 33 fc 00 01 ff
    00000180: ff ff ff 41 ee ff ea 2e 88 2f 0a 3f 2e 00 08 fa
    00000190: 60 5c 8f 4a 40 67 1c fa 44 3d 40 ff e8 3e bc 00
    000001a0: 00 3f 00 fa 5d 54 8f 22 6b 04 24 b9 d1 67 04 fa
    000001b0: 44 36 00 f9 55 33 fc 00 00 ff ff ff ff 43 ee ff
    000001c0: e8 2e 89 f8 98 22 6b 04 24 22 8c 4a 44 67 04 3e
    000001d0: 84 f9 53 f9 55 60 02 34 84 30 03 4c ee 1c 18 ff
    000001e0: ec 4e 5e 4e 75 4e 56 ff 8c 48 ee 0c 38 ff ec 24
    000001f0: 6e 00 0c 78 00 42 40 10 12 e1 48 42 42 14 2a 00
    00000200: 01 d0 42 54 40 3a 00 43 ee ff 90 2e 89 f9 54 36
    00000210: 00 66 5a 43 ee ff d8 2e 89 2f 2e 00 08 fb e9 58
    00000220: 8f 4a 40 66 44 43 ee ff eb 2e 89 fb 3b 22 4a 56
    00000230: 89 2e 89 3f 05 3f 3c 40 02 48 6e ff eb f8 86 50
    00000240: 8f 26 00 67 24 2e 83 f8 79 26 48 20 0b 67 1a 38
    00000250: 2b 00 0c 67 14 70 00 30 05 2e 80 2f 0a 3f 04 f8
    00000260: 96 54 8f 2f 08 fa 6a 50 8f f9 55 60 0c 3e bc 00
    00000270: 00 3f 03 f9 51 70 00 60 02 30 04 4c ee 0c 38 ff
    00000280: ec 4e 5e 4e 75 28 29 00 00 4e 56 ff ec 48 ee 04
    00000290: 18 ff f4 70 50 2e 80 f8 90 36 00 67 4c 2e ae 00
    000002a0: 08 3f 03 f8 96 54 8f 24 48 2f 0a fa 6c 2e bc ff
    000002b0: ff ff ff 2f 0a fa 6e 41 ee ff f2 2e 88 3f 03 4e
    000002c0: ba fe 7c 4f ef 00 0a 38 00 67 04 3e 84 f8 97 3e
    000002d0: 83 f8 97 4a 6e ff f2 67 10 3e bc 00 00 3f 2e ff
    000002e0: f2 f9 51 30 3c 00 00 60 04 30 3c 00 01 4c ee 04
    000002f0: 18 ff f4 4e 5e 4e 75 4e 56 ff a0 41 ee ff a4 2e
    00000300: 88 f9 54 4a 40 66 1c 41 ee ff ec 2e 88 2f 2e 00
    00000310: 08 fb e9 58 8f 4a 40 66 08 41 ee ff ff 2e 88 fb
    00000320: 3b f9 55 4e 5e 4e 75 70 6f 74 75 73 00 70 6f 74
    00000330: 75 73 5c 61 6a 30 37 00 70 6f 74 75 73 5c 61 6a
    00000340: 31 37 00 70 6f 74 75 73 5c 61 6c 31 36 00 70 6f
    00000350: 74 75 73 5c 62 68 32 33 00 70 6f 74 75 73 5c 63
    00000360: 61 32 31 00 70 6f 74 75 73 5c 63 63 33 30 00 70
    00000370: 6f 74 75 73 5c 64 65 33 34 00 70 6f 74 75 73 5c
    00000380: 66 70 31 34 00 70 6f 74 75 73 5c 66 72 33 32 00
    00000390: 70 6f 74 75 73 5c 67 62 34 31 00 70 6f 74 75 73
    000003a0: 5c 67 62 34 33 00 70 6f 74 75 73 5c 67 63 32 32
    000003b0: 00 70 6f 74 75 73 5c 67 66 33 38 00 70 6f 74 75
    000003c0: 73 5c 67 77 30 31 00 70 6f 74 75 73 5c 68 68 33
    000003d0: 31 00 70 6f 74 75 73 5c 68 74 33 33 00 70 6f 74
    000003e0: 75 73 5c 6a 61 30 32 00 70 6f 74 75 73 5c 6a 61
    000003f0: 30 36 00 70 6f 74 75 73 5c 6a 62 31 35 00 70 6f
    00000400: 74 75 73 5c
  UrbLink              = 00000000
[550397 ms] UsbSnoop - MyInternalIOCTLCompletion(f8917db0) : fido=81b964f0, Irp=81abb730, Context=81c3bfe8, IRQL=2
[550397 ms]  <<<  URB 709 coming back  <<< 
-- URB_FUNCTION_BULK_OR_INTERRUPT_TRANSFER:
  PipeHandle           = 82300f14 [endpoint 0x00000002]
  TransferFlags        = 00000000 (USBD_TRANSFER_DIRECTION_OUT, ~USBD_SHORT_TRANSFER_OK)
  TransferBufferLength = 00000404
  TransferBuffer       = 00000000
  TransferBufferMDL    = 81bbe5c0
  UrbLink              = 00000000
[550406 ms] UsbSnoop - DispatchAny(f8916610) : IRP_MJ_INTERNAL_DEVICE_CONTROL
[550406 ms] UsbSnoop - MyDispatchInternalIOCTL(f8917e80) : fdo=822eee08, Irp=81abb730, IRQL=2
[550406 ms]  >>>  URB 710 going down  >>> 
-- URB_FUNCTION_BULK_OR_INTERRUPT_TRANSFER:
  PipeHandle           = 82300ef4 [endpoint 0x00000081]
  TransferFlags        = 00000003 (USBD_TRANSFER_DIRECTION_IN, USBD_SHORT_TRANSFER_OK)
  TransferBufferLength = 00000100
  TransferBuffer       = 00000000
  TransferBufferMDL    = 81bbe5c0
  UrbLink              = 00000000
[550407 ms] UsbSnoop - MyInternalIOCTLCompletion(f8917db0) : fido=81b964f0, Irp=81abb730, Context=81d30f40, IRQL=2
[550407 ms]  <<<  URB 710 coming back  <<< 
-- URB_FUNCTION_BULK_OR_INTERRUPT_TRANSFER:
  PipeHandle           = 82300ef4 [endpoint 0x00000081]
  TransferFlags        = 00000003 (USBD_TRANSFER_DIRECTION_IN, USBD_SHORT_TRANSFER_OK)
  TransferBufferLength = 00000007
  TransferBuffer       = 00000000
  TransferBufferMDL    = 81bbe5c0
    00000000: 00 00 00 02 05 e0 00
  UrbLink              = 00000000
[550446 ms] UsbSnoop - DispatchAny(f8916610) : IRP_MJ_INTERNAL_DEVICE_CONTROL
[550446 ms] UsbSnoop - MyDispatchInternalIOCTL(f8917e80) : fdo=822eee08, Irp=81abb730, IRQL=2
[550447 ms]  >>>  URB 711 going down  >>> 
-- URB_FUNCTION_BULK_OR_INTERRUPT_TRANSFER:
  PipeHandle           = 82300f14 [endpoint 0x00000002]
  TransferFlags        = 00000000 (USBD_TRANSFER_DIRECTION_OUT, ~USBD_SHORT_TRANSFER_OK)
  TransferBufferLength = 00000404
  TransferBuffer       = 00000000
  TransferBufferMDL    = 81bbe5c0
    00000000: 00 00 03 ff 03 6a 63 33 39 00 70 6f 74 75 73 5c
    00000010: 6a 67 32 30 00 70 6f 74 75 73 5c 6a 6b 33 35 00
    00000020: 70 6f 74 75 73 5c 6a 6d 30 34 00 70 6f 74 75 73
    00000030: 5c 6a 6d 30 35 00 70 6f 74 75 73 5c 6a 70 31 31
    00000040: 00 70 6f 74 75 73 5c 6a 74 31 30 00 70 6f 74 75
    00000050: 73 5c 6c 6a 33 36 00 70 6f 74 75 73 5c 6d 62 30
    00000060: 38 00 70 6f 74 75 73 5c 6d 66 31 33 00 70 6f 74
    00000070: 75 73 5c 70 6f 74 75 73 00 70 6f 74 75 73 5c 70
    00000080: 72 64 62 00 70 6f 74 75 73 5c 72 65 61 64 6d 65
    00000090: 00 70 6f 74 75 73 5c 72 68 31 39 00 70 6f 74 75
    000000a0: 73 5c 72 6e 33 37 00 70 6f 74 75 73 5c 72 72 34
    000000b0: 30 00 70 6f 74 75 73 5c 74 6a 30 33 00 70 6f 74
    000000c0: 75 73 5c 74 72 32 36 00 70 6f 74 75 73 5c 75 67
    000000d0: 31 38 00 70 6f 74 75 73 5c 77 63 34 32 00 70 6f
    000000e0: 74 75 73 5c 77 68 30 39 00 70 6f 74 75 73 5c 77
    000000f0: 68 32 39 00 70 6f 74 75 73 5c 77 6d 32 35 00 70
    00000100: 6f 74 75 73 5c 77 74 32 37 00 70 6f 74 75 73 5c
    00000110: 77 77 32 38 00 70 6f 74 75 73 5c 7a 72 31 32 00
    00000120: 70 6f 74 75 73 5c 70 6f 74 75 73 00 70 6f 74 75
    00000130: 73 00 4d 41 49 4e 00 00 48 e7 00 30 51 8f 24 6f
    00000140: 00 18 4a 79 ff ff ff ff 66 3a 36 7c 00 c8 26 53
    00000150: 20 4b 0c a0 00 00 05 db 6d 0e 20 6b 17 68 4e 90
    00000160: 0c 68 02 04 00 02 64 14 41 f9 ff ff ff ff 70 14
    00000170: 91 c0 08 e8 00 04 00 01 60 00 02 e0 33 fc 00 01
    00000180: ff ff ff ff 70 00 30 12 0c 80 00 00 07 03 67 0e
    00000190: 0c 80 00 00 07 07 67 00 02 c2 60 00 02 ba 4a 79
    000001a0: ff ff ff ff 66 00 02 b4 3e bc 00 e5 fa ee 2e 8a
    000001b0: f9 57 2e bc ff ff ff ff 4e ba fb 02 2e bc ff ff
    000001c0: ff ff 48 7a fd 6a 4e ba fc 1e 2e bc ff ff ff ff
    000001d0: 48 7a fd 67 4e ba fc 10 2e bc ff ff ff ff 48 7a
    000001e0: fd 64 4e ba fc 02 2e bc ff ff ff ff 48 7a fd 61
    000001f0: 4e ba fb f4 2e bc ff ff ff ff 48 7a fd 5e 4e ba
    00000200: fb e6 2e bc ff ff ff ff 48 7a fd 5b 4e ba fb d8
    00000210: 2e bc ff ff ff ff 48 7a fd 58 4e ba fb ca 2e bc
    00000220: ff ff ff ff 48 7a fd 55 4e ba fb bc 2e bc ff ff
    00000230: ff ff 48 7a fd 52 4e ba fb ae 2e bc ff ff ff ff
    00000240: 48 7a fd 4f 4e ba fb a0 2e bc ff ff ff ff 48 7a
    00000250: fd 4c 4e ba fb 92 2e bc ff ff ff ff 48 7a fd 49
    00000260: 4e ba fb 84 2e bc ff ff ff ff 48 7a fd 46 4e ba
    00000270: fb 76 2e bc ff ff ff ff 48 7a fd 43 4e ba fb 68
    00000280: 2e bc ff ff ff ff 48 7a fd 40 4e ba fb 5a 2e bc
    00000290: ff ff ff ff 48 7a fd 3d 4e ba fb 4c 2e bc ff ff
    000002a0: ff ff 48 7a fd 3a 4e ba fb 3e 2e bc ff ff ff ff
    000002b0: 48 7a fd 37 4e ba fb 30 2e bc ff ff ff ff 48 7a
    000002c0: fd 34 4e ba fb 22 2e bc ff ff ff ff 48 7a fd 31
    000002d0: 4e ba fb 14 2e bc ff ff ff ff 48 7a fd 2e 4e ba
    000002e0: fb 06 2e bc ff ff ff ff 48 7a fd 2b 4e ba fa f8
    000002f0: 2e bc ff ff ff ff 48 7a fd 28 4e ba fa ea 2e bc
    00000300: ff ff ff ff 48 7a fd 25 4e ba fa dc 2e bc ff ff
    00000310: ff ff 48 7a fd 22 4e ba fa ce 2e bc ff ff ff ff
    00000320: 48 7a fd 1f 4e ba fa c0 2e bc ff ff ff ff 48 7a
    00000330: fd 1c 4e ba fa b2 2e bc ff ff ff ff 48 7a fd 19
    00000340: 4e ba fa a4 2e bc ff ff ff ff 48 7a fd 16 4e ba
    00000350: fa 96 2e bc ff ff ff ff 48 7a fd 13 4e ba fa 88
    00000360: 2e bc ff ff ff ff 48 7a fd 11 4e ba fa 7a 2e bc
    00000370: ff ff ff ff 48 7a fd 0e 4e ba fa 6c 2e bc ff ff
    00000380: ff ff 48 7a fd 0d 4e ba fa 5e 2e bc ff ff ff ff
    00000390: 48 7a fd 0a 4e ba fa 50 2e bc ff ff ff ff 48 7a
    000003a0: fd 07 4e ba fa 42 2e bc ff ff ff ff 48 7a fd 04
    000003b0: 4e ba fa 34 2e bc ff ff ff ff 48 7a fd 01 4e ba
    000003c0: fa 26 2e bc ff ff ff ff 48 7a fc fe 4e ba fa 18
    000003d0: 2e bc ff ff ff ff 48 7a fc fb 4e ba fa 0a 2e bc
    000003e0: ff ff ff ff 48 7a fc f8 4e ba f9 fc 2e bc ff ff
    000003f0: ff ff 48 7a fc f5 4e ba f9 ee 2e bc ff ff ff ff
    00000400: 48 7a fc f2
  UrbLink              = 00000000
[550458 ms] UsbSnoop - MyInternalIOCTLCompletion(f8917db0) : fido=81b964f0, Irp=81abb730, Context=81c3bfe8, IRQL=2
[550458 ms]  <<<  URB 711 coming back  <<< 
-- URB_FUNCTION_BULK_OR_INTERRUPT_TRANSFER:
  PipeHandle           = 82300f14 [endpoint 0x00000002]
  TransferFlags        = 00000000 (USBD_TRANSFER_DIRECTION_OUT, ~USBD_SHORT_TRANSFER_OK)
  TransferBufferLength = 00000404
  TransferBuffer       = 00000000
  TransferBufferMDL    = 81bbe5c0
  UrbLink              = 00000000
[550467 ms] UsbSnoop - DispatchAny(f8916610) : IRP_MJ_INTERNAL_DEVICE_CONTROL
[550467 ms] UsbSnoop - MyDispatchInternalIOCTL(f8917e80) : fdo=822eee08, Irp=81abb730, IRQL=2
[550467 ms]  >>>  URB 712 going down  >>> 
-- URB_FUNCTION_BULK_OR_INTERRUPT_TRANSFER:
  PipeHandle           = 82300ef4 [endpoint 0x00000081]
  TransferFlags        = 00000003 (USBD_TRANSFER_DIRECTION_IN, USBD_SHORT_TRANSFER_OK)
  TransferBufferLength = 00000100
  TransferBuffer       = 00000000
  TransferBufferMDL    = 81bbe5c0
  UrbLink              = 00000000
[550467 ms] UsbSnoop - MyInternalIOCTLCompletion(f8917db0) : fido=81b964f0, Irp=81abb730, Context=81b4d110, IRQL=2
[550467 ms]  <<<  URB 712 coming back  <<< 
-- URB_FUNCTION_BULK_OR_INTERRUPT_TRANSFER:
  PipeHandle           = 82300ef4 [endpoint 0x00000081]
  TransferFlags        = 00000003 (USBD_TRANSFER_DIRECTION_IN, USBD_SHORT_TRANSFER_OK)
  TransferBufferLength = 00000007
  TransferBuffer       = 00000000
  TransferBufferMDL    = 81bbe5c0
    00000000: 00 00 00 02 05 e0 00
  UrbLink              = 00000000
[550507 ms] UsbSnoop - DispatchAny(f8916610) : IRP_MJ_INTERNAL_DEVICE_CONTROL
[550507 ms] UsbSnoop - MyDispatchInternalIOCTL(f8917e80) : fdo=822eee08, Irp=81abb730, IRQL=2
[550507 ms]  >>>  URB 713 going down  >>> 
-- URB_FUNCTION_BULK_OR_INTERRUPT_TRANSFER:
  PipeHandle           = 82300f14 [endpoint 0x00000002]
  TransferFlags        = 00000000 (USBD_TRANSFER_DIRECTION_OUT, ~USBD_SHORT_TRANSFER_OK)
  TransferBufferLength = 00000244
  TransferBuffer       = 00000000
  TransferBufferMDL    = 81bbe5c0
    00000000: 00 00 02 3f 04 4e ba f9 e0 2e bc ff ff ff ff 48
    00000010: 7a fc ef 4e ba f9 d2 2e bc ff ff ff ff 48 7a fc
    00000020: ec 4e ba f9 c4 2e bc ff ff ff ff 48 7a fc e9 4e
    00000030: ba f9 b6 4f ef 00 b4 2e bc ff ff ff ff 4e ba fa
    00000040: 4c 2e bc ff ff ff ff 4e ba f8 d6 2e bc ff ff ff
    00000050: ff f8 e4 fc 8e 60 04 2e 8a f9 57 50 8f 4c df 0c
    00000060: 00 4e 75 43 6f 6e 63 65 70 74 20 41 70 70 3a 55
    00000070: 53 20 50 72 65 73 69 64 65 6e 74 73 0a 55 53 50
    00000080: 52 45 53 0a 56 65 72 73 69 6f 6e 20 31 2e 30 30
    00000090: 0a 30 32 2f 30 31 2f 32 30 30 31 00 00 41 fa ff
    000000a0: c4 4e 75 00 00 70 01 4e 75 00 36 40 06 00 05 f0
    000000b0: 12 00 02 00 00 00 00 00 00 ff ff ff ff cf ff 00
    000000c0: 00 00 22 85 04 00 27 ff ff ff ff 85 00 00 08 85
    000000d0: 01 00 0f 85 02 00 16 85 03 00 1c ff ff ff ff 41
    000000e0: 63 74 69 6f 6e 73 00 57 69 6e 53 74 72 00 44 69
    000000f0: 61 6c 6f 67 00 50 6f 70 75 70 00 47 72 61 79 65
    00000100: 64 2d 6f 75 74 00 48 46 4f 4e 54 00 00 00 48 00
    00000110: 05 b4 46 ff ff ff ff 02 04 0c 0e 00 00 00 00 00
    00000120: 0a 0b 00 02 04 0c 18 00 06 00 0b 00 0a 0b 00 0a
    00000130: 01 0c 22 00 0c ff ff ff ff 00 00 0a 01 0c 2c 00
    00000140: 18 ff ff ff ff 00 01 08 80 00 00 00 22 01 04 00
    00000150: 00 00 00 00 00 45 44 49 54 31 00 45 44 49 54 32
    00000160: 00 46 49 52 53 54 20 50 4f 50 55 50 00 32 4e 44
    00000170: 20 50 4f 50 55 50 00 44 49 41 4c 4f 47 20 48 45
    00000180: 41 44 45 52 00 00 00 00 20 40 05 00 02 00 13 00
    00000190: 02 00 00 00 00 00 00 ff ff ff ff 80 01 00 00 80
    000001a0: 02 00 09 ff ff ff ff 49 74 65 6d 20 31 2d 31 00
    000001b0: 49 74 65 6d 20 31 2d 32 00 00 24 40 05 00 03 00
    000001c0: 1b 00 03 00 00 00 00 00 00 ff ff ff ff 80 01 00
    000001d0: 00 80 02 00 09 80 03 00 12 ff ff ff ff 49 74 65
    000001e0: 6d 20 32 2d 31 00 49 74 65 6d 20 32 2d 32 00 49
    000001f0: 74 65 6d 20 32 2d 33 00 00 ff ff ff ff 00 00 00
    00000200: 00 02 0d 40 7b 63 e2 8e 10 ca 7d 36 1b 23 a7 44
    00000210: 1c 14 28 63 11 d9 6c 17 07 dc 94 9a 15 98 f0 64
    00000220: 7b ba cb 36 b2 86 5b d2 e0 a3 7a d4 1f 61 fb 2c
    00000230: 5f 8b 2a 48 6a 6d d8 15 76 ae 86 90 09 ca 96 06
    00000240: a9 65 67 87
  UrbLink              = 00000000
[550513 ms] UsbSnoop - MyInternalIOCTLCompletion(f8917db0) : fido=81b964f0, Irp=81abb730, Context=81c429b8, IRQL=2
[550513 ms]  <<<  URB 713 coming back  <<< 
-- URB_FUNCTION_BULK_OR_INTERRUPT_TRANSFER:
  PipeHandle           = 82300f14 [endpoint 0x00000002]
  TransferFlags        = 00000000 (USBD_TRANSFER_DIRECTION_OUT, ~USBD_SHORT_TRANSFER_OK)
  TransferBufferLength = 00000244
  TransferBuffer       = 00000000
  TransferBufferMDL    = 81bbe5c0
  UrbLink              = 00000000
[550517 ms] UsbSnoop - DispatchAny(f8916610) : IRP_MJ_INTERNAL_DEVICE_CONTROL
[550517 ms] UsbSnoop - MyDispatchInternalIOCTL(f8917e80) : fdo=822eee08, Irp=81abb730, IRQL=2
[550517 ms]  >>>  URB 714 going down  >>> 
-- URB_FUNCTION_BULK_OR_INTERRUPT_TRANSFER:
  PipeHandle           = 82300ef4 [endpoint 0x00000081]
  TransferFlags        = 00000003 (USBD_TRANSFER_DIRECTION_IN, USBD_SHORT_TRANSFER_OK)
  TransferBufferLength = 00000100
  TransferBuffer       = 00000000
  TransferBufferMDL    = 81bbe5c0
  UrbLink              = 00000000
[550517 ms] UsbSnoop - MyInternalIOCTLCompletion(f8917db0) : fido=81b964f0, Irp=81abb730, Context=81c3bfe8, IRQL=2
[550517 ms]  <<<  URB 714 coming back  <<< 
-- URB_FUNCTION_BULK_OR_INTERRUPT_TRANSFER:
  PipeHandle           = 82300ef4 [endpoint 0x00000081]
  TransferFlags        = 00000003 (USBD_TRANSFER_DIRECTION_IN, USBD_SHORT_TRANSFER_OK)
  TransferBufferLength = 00000007
  TransferBuffer       = 00000000
  TransferBufferMDL    = 81bbe5c0
    00000000: 00 00 00 02 05 e0 00
  UrbLink              = 00000000
[550558 ms] UsbSnoop - DispatchAny(f8916610) : IRP_MJ_INTERNAL_DEVICE_CONTROL
[550558 ms] UsbSnoop - MyDispatchInternalIOCTL(f8917e80) : fdo=822eee08, Irp=81abb730, IRQL=2
[550558 ms]  >>>  URB 715 going down  >>> 
-- URB_FUNCTION_BULK_OR_INTERRUPT_TRANSFER:
  PipeHandle           = 82300ef4 [endpoint 0x00000081]
  TransferFlags        = 00000003 (USBD_TRANSFER_DIRECTION_IN, USBD_SHORT_TRANSFER_OK)
  TransferBufferLength = 00000100
  TransferBuffer       = 00000000
  TransferBufferMDL    = 81bbe5c0
  UrbLink              = 00000000
[550558 ms] UsbSnoop - MyInternalIOCTLCompletion(f8917db0) : fido=81b964f0, Irp=81abb730, Context=81b4d110, IRQL=2
[550558 ms]  <<<  URB 715 coming back  <<< 
-- URB_FUNCTION_BULK_OR_INTERRUPT_TRANSFER:
  PipeHandle           = 82300ef4 [endpoint 0x00000081]
  TransferFlags        = 00000003 (USBD_TRANSFER_DIRECTION_IN, USBD_SHORT_TRANSFER_OK)
  TransferBufferLength = 00000005
  TransferBuffer       = 00000000
  TransferBufferMDL    = 81bbe5c0
    00000000: 00 00 00 0a 04
  UrbLink              = 00000000
[550587 ms] UsbSnoop - DispatchAny(f8916610) : IRP_MJ_INTERNAL_DEVICE_CONTROL
[550587 ms] UsbSnoop - MyDispatchInternalIOCTL(f8917e80) : fdo=822eee08, Irp=81abb730, IRQL=2
[550587 ms]  >>>  URB 716 going down  >>> 
-- URB_FUNCTION_BULK_OR_INTERRUPT_TRANSFER:
  PipeHandle           = 82300ef4 [endpoint 0x00000081]
  TransferFlags        = 00000003 (USBD_TRANSFER_DIRECTION_IN, USBD_SHORT_TRANSFER_OK)
  TransferBufferLength = 00000100
  TransferBuffer       = 00000000
  TransferBufferMDL    = 81bbe5c0
  UrbLink              = 00000000
[550587 ms] UsbSnoop - MyInternalIOCTLCompletion(f8917db0) : fido=81b964f0, Irp=81abb730, Context=81c3bfe8, IRQL=2
[550587 ms]  <<<  URB 716 coming back  <<< 
-- URB_FUNCTION_BULK_OR_INTERRUPT_TRANSFER:
  PipeHandle           = 82300ef4 [endpoint 0x00000081]
  TransferFlags        = 00000003 (USBD_TRANSFER_DIRECTION_IN, USBD_SHORT_TRANSFER_OK)
  TransferBufferLength = 0000000a
  TransferBuffer       = 00000000
  TransferBufferMDL    = 81bbe5c0
    00000000: 00 00 00 04 bb 00 00 05 7e 40
  UrbLink              = 00000000
[550617 ms] UsbSnoop - DispatchAny(f8916610) : IRP_MJ_INTERNAL_DEVICE_CONTROL
[550617 ms] UsbSnoop - MyDispatchInternalIOCTL(f8917e80) : fdo=822eee08, Irp=81abb730, IRQL=2
[550617 ms]  >>>  URB 717 going down  >>> 
-- URB_FUNCTION_BULK_OR_INTERRUPT_TRANSFER:
  PipeHandle           = 82300f14 [endpoint 0x00000002]
  TransferFlags        = 00000000 (USBD_TRANSFER_DIRECTION_OUT, ~USBD_SHORT_TRANSFER_OK)
  TransferBufferLength = 00000007
  TransferBuffer       = 00000000
  TransferBufferMDL    = 81bbe5c0
    00000000: 00 00 00 02 05 e0 00
  UrbLink              = 00000000
[550617 ms] UsbSnoop - MyInternalIOCTLCompletion(f8917db0) : fido=81b964f0, Irp=81abb730, Context=81ba8040, IRQL=2
[550617 ms]  <<<  URB 717 coming back  <<< 
-- URB_FUNCTION_BULK_OR_INTERRUPT_TRANSFER:
  PipeHandle           = 82300f14 [endpoint 0x00000002]
  TransferFlags        = 00000000 (USBD_TRANSFER_DIRECTION_OUT, ~USBD_SHORT_TRANSFER_OK)
  TransferBufferLength = 00000007
  TransferBuffer       = 00000000
  TransferBufferMDL    = 81bbe5c0
  UrbLink              = 00000000
[550627 ms] UsbSnoop - DispatchAny(f8916610) : IRP_MJ_INTERNAL_DEVICE_CONTROL
[550627 ms] UsbSnoop - MyDispatchInternalIOCTL(f8917e80) : fdo=822eee08, Irp=81abb730, IRQL=2
[550627 ms]  >>>  URB 718 going down  >>> 
-- URB_FUNCTION_BULK_OR_INTERRUPT_TRANSFER:
  PipeHandle           = 82300ef4 [endpoint 0x00000081]
  TransferFlags        = 00000003 (USBD_TRANSFER_DIRECTION_IN, USBD_SHORT_TRANSFER_OK)
  TransferBufferLength = 00000100
  TransferBuffer       = 00000000
  TransferBufferMDL    = 81bbe5c0
  UrbLink              = 00000000
[552568 ms] UsbSnoop - MyInternalIOCTLCompletion(f8917db0) : fido=81b964f0, Irp=81abb730, Context=81c429b8, IRQL=2
[552568 ms]  <<<  URB 718 coming back  <<< 
-- URB_FUNCTION_BULK_OR_INTERRUPT_TRANSFER:
  PipeHandle           = 82300ef4 [endpoint 0x00000081]
  TransferFlags        = 00000003 (USBD_TRANSFER_DIRECTION_IN, USBD_SHORT_TRANSFER_OK)
  TransferBufferLength = 00000005
  TransferBuffer       = 00000000
  TransferBufferMDL    = 81bbe5c0
    00000000: 00 00 00 07 04
  UrbLink              = 00000000
[552590 ms] UsbSnoop - DispatchAny(f8916610) : IRP_MJ_INTERNAL_DEVICE_CONTROL
[552590 ms] UsbSnoop - MyDispatchInternalIOCTL(f8917e80) : fdo=822eee08, Irp=81abb730, IRQL=2
[552590 ms]  >>>  URB 719 going down  >>> 
-- URB_FUNCTION_BULK_OR_INTERRUPT_TRANSFER:
  PipeHandle           = 82300ef4 [endpoint 0x00000081]
  TransferFlags        = 00000003 (USBD_TRANSFER_DIRECTION_IN, USBD_SHORT_TRANSFER_OK)
  TransferBufferLength = 00000100
  TransferBuffer       = 00000000
  TransferBufferMDL    = 81bbe5c0
  UrbLink              = 00000000
[552590 ms] UsbSnoop - MyInternalIOCTLCompletion(f8917db0) : fido=81b964f0, Irp=81abb730, Context=822f3898, IRQL=2
[552590 ms]  <<<  URB 719 coming back  <<< 
-- URB_FUNCTION_BULK_OR_INTERRUPT_TRANSFER:
  PipeHandle           = 82300ef4 [endpoint 0x00000081]
  TransferFlags        = 00000003 (USBD_TRANSFER_DIRECTION_IN, USBD_SHORT_TRANSFER_OK)
  TransferBufferLength = 00000007
  TransferBuffer       = 00000000
  TransferBufferMDL    = 81bbe5c0
    00000000: 00 00 00 01 aa 00 01
  UrbLink              = 00000000
[552620 ms] UsbSnoop - DispatchAny(f8916610) : IRP_MJ_INTERNAL_DEVICE_CONTROL
[552620 ms] UsbSnoop - MyDispatchInternalIOCTL(f8917e80) : fdo=822eee08, Irp=81abb730, IRQL=2
[552620 ms]  >>>  URB 720 going down  >>> 
-- URB_FUNCTION_BULK_OR_INTERRUPT_TRANSFER:
  PipeHandle           = 82300f14 [endpoint 0x00000002]
  TransferFlags        = 00000000 (USBD_TRANSFER_DIRECTION_OUT, ~USBD_SHORT_TRANSFER_OK)
  TransferBufferLength = 00000007
  TransferBuffer       = 00000000
  TransferBufferMDL    = 81bbe5c0
    00000000: 00 00 00 02 05 e0 00
  UrbLink              = 00000000
[552620 ms] UsbSnoop - MyInternalIOCTLCompletion(f8917db0) : fido=81b964f0, Irp=81abb730, Context=81c429b8, IRQL=2
[552620 ms]  <<<  URB 720 coming back  <<< 
-- URB_FUNCTION_BULK_OR_INTERRUPT_TRANSFER:
  PipeHandle           = 82300f14 [endpoint 0x00000002]
  TransferFlags        = 00000000 (USBD_TRANSFER_DIRECTION_OUT, ~USBD_SHORT_TRANSFER_OK)
  TransferBufferLength = 00000007
  TransferBuffer       = 00000000
  TransferBufferMDL    = 81bbe5c0
  UrbLink              = 00000000
[552630 ms] UsbSnoop - DispatchAny(f8916610) : IRP_MJ_INTERNAL_DEVICE_CONTROL
[552630 ms] UsbSnoop - MyDispatchInternalIOCTL(f8917e80) : fdo=822eee08, Irp=81abb730, IRQL=2
[552630 ms]  >>>  URB 721 going down  >>> 
-- URB_FUNCTION_BULK_OR_INTERRUPT_TRANSFER:
  PipeHandle           = 82300f14 [endpoint 0x00000002]
  TransferFlags        = 00000000 (USBD_TRANSFER_DIRECTION_OUT, ~USBD_SHORT_TRANSFER_OK)
  TransferBufferLength = 0000000b
  TransferBuffer       = 00000000
  TransferBufferMDL    = 81bbe5c0
    00000000: 00 00 00 06 04 00 00 00 00 dd 00
  UrbLink              = 00000000
[552630 ms] UsbSnoop - MyInternalIOCTLCompletion(f8917db0) : fido=81b964f0, Irp=81abb730, Context=81b4d110, IRQL=2
[552630 ms]  <<<  URB 721 coming back  <<< 
-- URB_FUNCTION_BULK_OR_INTERRUPT_TRANSFER:
  PipeHandle           = 82300f14 [endpoint 0x00000002]
  TransferFlags        = 00000000 (USBD_TRANSFER_DIRECTION_OUT, ~USBD_SHORT_TRANSFER_OK)
  TransferBufferLength = 0000000b
  TransferBuffer       = 00000000
  TransferBufferMDL    = 81bbe5c0
  UrbLink              = 00000000
[552640 ms] UsbSnoop - DispatchAny(f8916610) : IRP_MJ_INTERNAL_DEVICE_CONTROL
[552640 ms] UsbSnoop - MyDispatchInternalIOCTL(f8917e80) : fdo=822eee08, Irp=81abb730, IRQL=2
[552640 ms]  >>>  URB 722 going down  >>> 
-- URB_FUNCTION_BULK_OR_INTERRUPT_TRANSFER:
  PipeHandle           = 82300ef4 [endpoint 0x00000081]
  TransferFlags        = 00000003 (USBD_TRANSFER_DIRECTION_IN, USBD_SHORT_TRANSFER_OK)
  TransferBufferLength = 00000100
  TransferBuffer       = 00000000
  TransferBufferMDL    = 81bbe5c0
  UrbLink              = 00000000
[552640 ms] UsbSnoop - MyInternalIOCTLCompletion(f8917db0) : fido=81b964f0, Irp=81abb730, Context=81d30f40, IRQL=2
[552640 ms]  <<<  URB 722 coming back  <<< 
-- URB_FUNCTION_BULK_OR_INTERRUPT_TRANSFER:
  PipeHandle           = 82300ef4 [endpoint 0x00000081]
  TransferFlags        = 00000003 (USBD_TRANSFER_DIRECTION_IN, USBD_SHORT_TRANSFER_OK)
  TransferBufferLength = 00000007
  TransferBuffer       = 00000000
  TransferBufferMDL    = 81bbe5c0
    00000000: 00 00 00 02 05 e0 00
  UrbLink              = 00000000
[558690 ms] UsbSnoop - DispatchAny(f8916610) : IRP_MJ_INTERNAL_DEVICE_CONTROL
[558690 ms] UsbSnoop - MyDispatchInternalIOCTL(f8917e80) : fdo=822eee08, Irp=81b20e48, IRQL=0
[558690 ms]  >>>  URB 723 going down  >>> 
-- URB_FUNCTION_RESET_PIPE:
  PipeHandle = 82300ef4 [endpoint 0x00000081]
[558690 ms] UsbSnoop - MyInternalIOCTLCompletion(f8917db0) : fido=00000000, Irp=81b20e48, Context=81ba8040, IRQL=0
[558690 ms]  <<<  URB 723 coming back  <<< 
-- URB_FUNCTION_RESET_PIPE:
[558690 ms] UsbSnoop - DispatchAny(f8916610) : IRP_MJ_INTERNAL_DEVICE_CONTROL
[558690 ms] UsbSnoop - MyDispatchInternalIOCTL(f8917e80) : fdo=822eee08, Irp=81b20e48, IRQL=0
[558690 ms]  >>>  URB 724 going down  >>> 
-- URB_FUNCTION_RESET_PIPE:
  PipeHandle = 82300f14 [endpoint 0x00000002]
[558691 ms] UsbSnoop - MyInternalIOCTLCompletion(f8917db0) : fido=00000000, Irp=81b20e48, Context=81c3bfe8, IRQL=0
[558691 ms]  <<<  URB 724 coming back  <<< 
-- URB_FUNCTION_RESET_PIPE:
[558691 ms] UsbSnoop - DispatchAny(f8916610) : IRP_MJ_INTERNAL_DEVICE_CONTROL
[558691 ms] UsbSnoop - MyDispatchInternalIOCTL(f8917e80) : fdo=822eee08, Irp=81b22778, IRQL=0
[558900 ms] UsbSnoop - IRP_MJ_POWER (IRP_MN_WAIT_WAKE)
[558900 ms] UsbSnoop - DispatchAny(f8916610) : IRP_MJ_INTERNAL_DEVICE_CONTROL
[558900 ms] UsbSnoop - MyDispatchInternalIOCTL(f8917e80) : fdo=822eee08, Irp=81b20c88, IRQL=0
[558900 ms]  >>>  URB 725 going down  >>> 
-- URB_FUNCTION_RESET_PIPE:
  PipeHandle = 82300ef4 [endpoint 0x00000081]
[558900 ms] UsbSnoop - MyInternalIOCTLCompletion(f8917db0) : fido=00000000, Irp=81b20c88, Context=81c3bfe8, IRQL=0
[558900 ms]  <<<  URB 725 coming back  <<< 
-- URB_FUNCTION_RESET_PIPE:
[558900 ms] UsbSnoop - DispatchAny(f8916610) : IRP_MJ_INTERNAL_DEVICE_CONTROL
[558900 ms] UsbSnoop - MyDispatchInternalIOCTL(f8917e80) : fdo=822eee08, Irp=81b20c88, IRQL=0
[558900 ms]  >>>  URB 726 going down  >>> 
-- URB_FUNCTION_RESET_PIPE:
  PipeHandle = 82300f14 [endpoint 0x00000002]
[558901 ms] UsbSnoop - MyInternalIOCTLCompletion(f8917db0) : fido=00000000, Irp=81b20c88, Context=81be7968, IRQL=0
[558901 ms]  <<<  URB 726 coming back  <<< 
-- URB_FUNCTION_RESET_PIPE:
[559902 ms] UsbSnoop - DispatchAny(f8916610) : IRP_MJ_INTERNAL_DEVICE_CONTROL
[559902 ms] UsbSnoop - MyDispatchInternalIOCTL(f8917e80) : fdo=822eee08, Irp=81b20c88, IRQL=0
[559902 ms]  >>>  URB 727 going down  >>> 
-- URB_FUNCTION_RESET_PIPE:
  PipeHandle = 82300ef4 [endpoint 0x00000081]
[559902 ms] UsbSnoop - MyInternalIOCTLCompletion(f8917db0) : fido=00000000, Irp=81b20c88, Context=81b4ccc0, IRQL=0
[559902 ms]  <<<  URB 727 coming back  <<< 
-- URB_FUNCTION_RESET_PIPE:
[559902 ms] UsbSnoop - DispatchAny(f8916610) : IRP_MJ_INTERNAL_DEVICE_CONTROL
[559902 ms] UsbSnoop - MyDispatchInternalIOCTL(f8917e80) : fdo=822eee08, Irp=81b20c88, IRQL=0
[559902 ms]  >>>  URB 728 going down  >>> 
-- URB_FUNCTION_RESET_PIPE:
  PipeHandle = 82300f14 [endpoint 0x00000002]
[559903 ms] UsbSnoop - MyInternalIOCTLCompletion(f8917db0) : fido=00000000, Irp=81b20c88, Context=81c429b8, IRQL=0
[559903 ms]  <<<  URB 728 coming back  <<< 
-- URB_FUNCTION_RESET_PIPE:
[559903 ms] UsbSnoop - DispatchAny(f8916610) : IRP_MJ_INTERNAL_DEVICE_CONTROL
[559903 ms] UsbSnoop - MyDispatchInternalIOCTL(f8917e80) : fdo=822eee08, Irp=81b22778, IRQL=0
[559903 ms] UsbSnoop - IRP_MJ_POWER (IRP_MN_WAIT_WAKE)
[560903 ms] UsbSnoop - DispatchAny(f8916610) : IRP_MJ_INTERNAL_DEVICE_CONTROL
[560903 ms] UsbSnoop - MyDispatchInternalIOCTL(f8917e80) : fdo=822eee08, Irp=81b22778, IRQL=0
[560903 ms]  >>>  URB 729 going down  >>> 
-- URB_FUNCTION_GET_DESCRIPTOR_FROM_DEVICE:
  TransferBufferLength = 00000012
  TransferBuffer       = e238aef8
  TransferBufferMDL    = 00000000
  Index                = 00000000
  DescriptorType       = 00000001 (USB_DEVICE_DESCRIPTOR_TYPE)
  LanguageId           = 00000000
[560904 ms] UsbSnoop - MyInternalIOCTLCompletion(f8917db0) : fido=00000000, Irp=81b22778, Context=81b4ccc0, IRQL=2
[560904 ms]  <<<  URB 729 coming back  <<< 
-- URB_FUNCTION_CONTROL_TRANSFER:
  PipeHandle           = 82149668
  TransferFlags        = 0000000b (USBD_TRANSFER_DIRECTION_IN, USBD_SHORT_TRANSFER_OK)
  TransferBufferLength = 00000012
  TransferBuffer       = e238aef8
  TransferBufferMDL    = 81ac92e0
    00000000: 12 01 00 02 00 00 00 40 51 04 04 e0 00 03 01 02
    00000010: 00 01
  UrbLink              = 00000000
  SetupPacket          =
    00000000: 80 06 00 01 00 00 12 00
[560904 ms] UsbSnoop - DispatchAny(f8916610) : IRP_MJ_INTERNAL_DEVICE_CONTROL
[560904 ms] UsbSnoop - MyDispatchInternalIOCTL(f8917e80) : fdo=822eee08, Irp=81c21570, IRQL=0
[560904 ms] UsbSnoop - IRP_MJ_POWER (IRP_MN_WAIT_WAKE)
[560904 ms] UsbSnoop - DispatchAny(f8916610) : IRP_MJ_INTERNAL_DEVICE_CONTROL
[560904 ms] UsbSnoop - MyDispatchInternalIOCTL(f8917e80) : fdo=822eee08, Irp=81b20c88, IRQL=0
[560904 ms]  >>>  URB 730 going down  >>> 
-- URB_FUNCTION_RESET_PIPE:
  PipeHandle = 82300ef4 [endpoint 0x00000081]
[560905 ms] UsbSnoop - MyInternalIOCTLCompletion(f8917db0) : fido=00000000, Irp=81b20c88, Context=81abee68, IRQL=0
[560905 ms]  <<<  URB 730 coming back  <<< 
-- URB_FUNCTION_RESET_PIPE:
[560905 ms] UsbSnoop - DispatchAny(f8916610) : IRP_MJ_INTERNAL_DEVICE_CONTROL
[560905 ms] UsbSnoop - MyDispatchInternalIOCTL(f8917e80) : fdo=822eee08, Irp=81b20c88, IRQL=0
[560905 ms]  >>>  URB 731 going down  >>> 
-- URB_FUNCTION_RESET_PIPE:
  PipeHandle = 82300f14 [endpoint 0x00000002]
[560905 ms] UsbSnoop - MyInternalIOCTLCompletion(f8917db0) : fido=00000000, Irp=81b20c88, Context=81adb8c0, IRQL=0
[560905 ms]  <<<  URB 731 coming back  <<< 
-- URB_FUNCTION_RESET_PIPE:
[562155 ms] UsbSnoop - DispatchAny(f8916610) : IRP_MJ_INTERNAL_DEVICE_CONTROL
[562155 ms] UsbSnoop - MyDispatchInternalIOCTL(f8917e80) : fdo=822eee08, Irp=81b76e48, IRQL=2
[562155 ms]  >>>  URB 732 going down  >>> 
-- URB_FUNCTION_BULK_OR_INTERRUPT_TRANSFER:
  PipeHandle           = 82300f14 [endpoint 0x00000002]
  TransferFlags        = 00000000 (USBD_TRANSFER_DIRECTION_OUT, ~USBD_SHORT_TRANSFER_OK)
  TransferBufferLength = 00000009
  TransferBuffer       = 00000000
  TransferBufferMDL    = 81ac92e0
    00000000: 00 00 00 04 01 00 00 04 00
  UrbLink              = 00000000
[562155 ms] UsbSnoop - MyInternalIOCTLCompletion(f8917db0) : fido=81b964f0, Irp=81b76e48, Context=821465e8, IRQL=2
[562155 ms]  <<<  URB 732 coming back  <<< 
-- URB_FUNCTION_BULK_OR_INTERRUPT_TRANSFER:
  PipeHandle           = 82300f14 [endpoint 0x00000002]
  TransferFlags        = 00000000 (USBD_TRANSFER_DIRECTION_OUT, ~USBD_SHORT_TRANSFER_OK)
  TransferBufferLength = 00000009
  TransferBuffer       = 00000000
  TransferBufferMDL    = 81ac92e0
  UrbLink              = 00000000
[562157 ms] UsbSnoop - DispatchAny(f8916610) : IRP_MJ_INTERNAL_DEVICE_CONTROL
[562157 ms] UsbSnoop - MyDispatchInternalIOCTL(f8917e80) : fdo=822eee08, Irp=81b76e48, IRQL=2
[562157 ms]  >>>  URB 733 going down  >>> 
-- URB_FUNCTION_BULK_OR_INTERRUPT_TRANSFER:
  PipeHandle           = 82300ef4 [endpoint 0x00000081]
  TransferFlags        = 00000003 (USBD_TRANSFER_DIRECTION_IN, USBD_SHORT_TRANSFER_OK)
  TransferBufferLength = 00000100
  TransferBuffer       = 00000000
  TransferBufferMDL    = 81ac92e0
  UrbLink              = 00000000
[562158 ms] UsbSnoop - MyInternalIOCTLCompletion(f8917db0) : fido=81b964f0, Irp=81b76e48, Context=81cdfe48, IRQL=2
[562158 ms]  <<<  URB 733 coming back  <<< 
-- URB_FUNCTION_BULK_OR_INTERRUPT_TRANSFER:
  PipeHandle           = 82300ef4 [endpoint 0x00000081]
  TransferFlags        = 00000003 (USBD_TRANSFER_DIRECTION_IN, USBD_SHORT_TRANSFER_OK)
  TransferBufferLength = 00000009
  TransferBuffer       = 00000000
  TransferBufferMDL    = 81ac92e0
    00000000: 00 00 00 04 02 00 00 03 ff
  UrbLink              = 00000000
[562185 ms] UsbSnoop - DispatchAny(f8916610) : IRP_MJ_INTERNAL_DEVICE_CONTROL
[562185 ms] UsbSnoop - MyDispatchInternalIOCTL(f8917e80) : fdo=822eee08, Irp=81b76e48, IRQL=2
[562185 ms]  >>>  URB 734 going down  >>> 
-- URB_FUNCTION_BULK_OR_INTERRUPT_TRANSFER:
  PipeHandle           = 82300f14 [endpoint 0x00000002]
  TransferFlags        = 00000000 (USBD_TRANSFER_DIRECTION_OUT, ~USBD_SHORT_TRANSFER_OK)
  TransferBufferLength = 00000015
  TransferBuffer       = 00000000
  TransferBufferMDL    = 81ac92e0
    00000000: 00 00 00 10 04 00 00 00 0a 00 01 00 03 00 01 00
    00000010: 00 00 00 07 d0
  UrbLink              = 00000000
[562185 ms] UsbSnoop - MyInternalIOCTLCompletion(f8917db0) : fido=81b964f0, Irp=81b76e48, Context=81acd810, IRQL=2
[562185 ms]  <<<  URB 734 coming back  <<< 
-- URB_FUNCTION_BULK_OR_INTERRUPT_TRANSFER:
  PipeHandle           = 82300f14 [endpoint 0x00000002]
  TransferFlags        = 00000000 (USBD_TRANSFER_DIRECTION_OUT, ~USBD_SHORT_TRANSFER_OK)
  TransferBufferLength = 00000015
  TransferBuffer       = 00000000
  TransferBufferMDL    = 81ac92e0
  UrbLink              = 00000000
[562195 ms] UsbSnoop - DispatchAny(f8916610) : IRP_MJ_INTERNAL_DEVICE_CONTROL
[562195 ms] UsbSnoop - MyDispatchInternalIOCTL(f8917e80) : fdo=822eee08, Irp=81b76e48, IRQL=2
[562195 ms]  >>>  URB 735 going down  >>> 
-- URB_FUNCTION_BULK_OR_INTERRUPT_TRANSFER:
  PipeHandle           = 82300ef4 [endpoint 0x00000081]
  TransferFlags        = 00000003 (USBD_TRANSFER_DIRECTION_IN, USBD_SHORT_TRANSFER_OK)
  TransferBufferLength = 00000100
  TransferBuffer       = 00000000
  TransferBufferMDL    = 81ac92e0
  UrbLink              = 00000000
[562195 ms] UsbSnoop - MyInternalIOCTLCompletion(f8917db0) : fido=81b964f0, Irp=81b76e48, Context=81cdfe48, IRQL=2
[562195 ms]  <<<  URB 735 coming back  <<< 
-- URB_FUNCTION_BULK_OR_INTERRUPT_TRANSFER:
  PipeHandle           = 82300ef4 [endpoint 0x00000081]
  TransferFlags        = 00000003 (USBD_TRANSFER_DIRECTION_IN, USBD_SHORT_TRANSFER_OK)
  TransferBufferLength = 00000007
  TransferBuffer       = 00000000
  TransferBufferMDL    = 81ac92e0
    00000000: 00 00 00 02 05 e0 00
  UrbLink              = 00000000
[562235 ms] UsbSnoop - DispatchAny(f8916610) : IRP_MJ_INTERNAL_DEVICE_CONTROL
[562235 ms] UsbSnoop - MyDispatchInternalIOCTL(f8917e80) : fdo=822eee08, Irp=81b76e48, IRQL=2
[562235 ms]  >>>  URB 736 going down  >>> 
-- URB_FUNCTION_BULK_OR_INTERRUPT_TRANSFER:
  PipeHandle           = 82300ef4 [endpoint 0x00000081]
  TransferFlags        = 00000003 (USBD_TRANSFER_DIRECTION_IN, USBD_SHORT_TRANSFER_OK)
  TransferBufferLength = 00000100
  TransferBuffer       = 00000000
  TransferBufferMDL    = 81ac92e0
  UrbLink              = 00000000
[562235 ms] UsbSnoop - MyInternalIOCTLCompletion(f8917db0) : fido=81b964f0, Irp=81b76e48, Context=81b9a168, IRQL=2
[562235 ms]  <<<  URB 736 coming back  <<< 
-- URB_FUNCTION_BULK_OR_INTERRUPT_TRANSFER:
  PipeHandle           = 82300ef4 [endpoint 0x00000081]
  TransferFlags        = 00000003 (USBD_TRANSFER_DIRECTION_IN, USBD_SHORT_TRANSFER_OK)
  TransferBufferLength = 00000005
  TransferBuffer       = 00000000
  TransferBufferMDL    = 81ac92e0
    00000000: 00 00 00 0a 04
  UrbLink              = 00000000
[562265 ms] UsbSnoop - DispatchAny(f8916610) : IRP_MJ_INTERNAL_DEVICE_CONTROL
[562265 ms] UsbSnoop - MyDispatchInternalIOCTL(f8917e80) : fdo=822eee08, Irp=81b76e48, IRQL=2
[562265 ms]  >>>  URB 737 going down  >>> 
-- URB_FUNCTION_BULK_OR_INTERRUPT_TRANSFER:
  PipeHandle           = 82300ef4 [endpoint 0x00000081]
  TransferFlags        = 00000003 (USBD_TRANSFER_DIRECTION_IN, USBD_SHORT_TRANSFER_OK)
  TransferBufferLength = 00000100
  TransferBuffer       = 00000000
  TransferBufferMDL    = 81ac92e0
  UrbLink              = 00000000
[562265 ms] UsbSnoop - MyInternalIOCTLCompletion(f8917db0) : fido=81b964f0, Irp=81b76e48, Context=81acd810, IRQL=2
[562265 ms]  <<<  URB 737 coming back  <<< 
-- URB_FUNCTION_BULK_OR_INTERRUPT_TRANSFER:
  PipeHandle           = 82300ef4 [endpoint 0x00000081]
  TransferFlags        = 00000003 (USBD_TRANSFER_DIRECTION_IN, USBD_SHORT_TRANSFER_OK)
  TransferBufferLength = 0000000a
  TransferBuffer       = 00000000
  TransferBufferMDL    = 81ac92e0
    00000000: 00 00 00 04 00 12 00 00 07 d0
  UrbLink              = 00000000
[562295 ms] UsbSnoop - DispatchAny(f8916610) : IRP_MJ_INTERNAL_DEVICE_CONTROL
[562295 ms] UsbSnoop - MyDispatchInternalIOCTL(f8917e80) : fdo=822eee08, Irp=81b76e48, IRQL=2
[562295 ms]  >>>  URB 738 going down  >>> 
-- URB_FUNCTION_BULK_OR_INTERRUPT_TRANSFER:
  PipeHandle           = 82300f14 [endpoint 0x00000002]
  TransferFlags        = 00000000 (USBD_TRANSFER_DIRECTION_OUT, ~USBD_SHORT_TRANSFER_OK)
  TransferBufferLength = 00000007
  TransferBuffer       = 00000000
  TransferBufferMDL    = 81ac92e0
    00000000: 00 00 00 02 05 e0 00
  UrbLink              = 00000000
[562295 ms] UsbSnoop - MyInternalIOCTLCompletion(f8917db0) : fido=81b964f0, Irp=81b76e48, Context=81b9a168, IRQL=2
[562295 ms]  <<<  URB 738 coming back  <<< 
-- URB_FUNCTION_BULK_OR_INTERRUPT_TRANSFER:
  PipeHandle           = 82300f14 [endpoint 0x00000002]
  TransferFlags        = 00000000 (USBD_TRANSFER_DIRECTION_OUT, ~USBD_SHORT_TRANSFER_OK)
  TransferBufferLength = 00000007
  TransferBuffer       = 00000000
  TransferBufferMDL    = 81ac92e0
  UrbLink              = 00000000
[562305 ms] UsbSnoop - DispatchAny(f8916610) : IRP_MJ_INTERNAL_DEVICE_CONTROL
[562305 ms] UsbSnoop - MyDispatchInternalIOCTL(f8917e80) : fdo=822eee08, Irp=81b76e48, IRQL=2
[562305 ms]  >>>  URB 739 going down  >>> 
-- URB_FUNCTION_BULK_OR_INTERRUPT_TRANSFER:
  PipeHandle           = 82300f14 [endpoint 0x00000002]
  TransferFlags        = 00000000 (USBD_TRANSFER_DIRECTION_OUT, ~USBD_SHORT_TRANSFER_OK)
  TransferBufferLength = 00000022
  TransferBuffer       = 00000000
  TransferBufferMDL    = 81ac92e0
    00000000: 00 00 00 1d 04 00 00 00 17 00 09 00 00 00 06 00
    00000010: 02 00 03 00 05 00 01 00 41 00 42 00 01 00 01 00
    00000020: 01 01
  UrbLink              = 00000000
[562305 ms] UsbSnoop - MyInternalIOCTLCompletion(f8917db0) : fido=81b964f0, Irp=81b76e48, Context=81c3bfe8, IRQL=2
[562305 ms]  <<<  URB 739 coming back  <<< 
-- URB_FUNCTION_BULK_OR_INTERRUPT_TRANSFER:
  PipeHandle           = 82300f14 [endpoint 0x00000002]
  TransferFlags        = 00000000 (USBD_TRANSFER_DIRECTION_OUT, ~USBD_SHORT_TRANSFER_OK)
  TransferBufferLength = 00000022
  TransferBuffer       = 00000000
  TransferBufferMDL    = 81ac92e0
  UrbLink              = 00000000
[562315 ms] UsbSnoop - DispatchAny(f8916610) : IRP_MJ_INTERNAL_DEVICE_CONTROL
[562315 ms] UsbSnoop - MyDispatchInternalIOCTL(f8917e80) : fdo=822eee08, Irp=81b76e48, IRQL=2
[562315 ms]  >>>  URB 740 going down  >>> 
-- URB_FUNCTION_BULK_OR_INTERRUPT_TRANSFER:
  PipeHandle           = 82300ef4 [endpoint 0x00000081]
  TransferFlags        = 00000003 (USBD_TRANSFER_DIRECTION_IN, USBD_SHORT_TRANSFER_OK)
  TransferBufferLength = 00000100
  TransferBuffer       = 00000000
  TransferBufferMDL    = 81ac92e0
  UrbLink              = 00000000
[562315 ms] UsbSnoop - MyInternalIOCTLCompletion(f8917db0) : fido=81b964f0, Irp=81b76e48, Context=822f3898, IRQL=2
[562315 ms]  <<<  URB 740 coming back  <<< 
-- URB_FUNCTION_BULK_OR_INTERRUPT_TRANSFER:
  PipeHandle           = 82300ef4 [endpoint 0x00000081]
  TransferFlags        = 00000003 (USBD_TRANSFER_DIRECTION_IN, USBD_SHORT_TRANSFER_OK)
  TransferBufferLength = 00000007
  TransferBuffer       = 00000000
  TransferBufferMDL    = 81ac92e0
    00000000: 00 00 00 02 05 e0 00
  UrbLink              = 00000000
[562355 ms] UsbSnoop - DispatchAny(f8916610) : IRP_MJ_INTERNAL_DEVICE_CONTROL
[562355 ms] UsbSnoop - MyDispatchInternalIOCTL(f8917e80) : fdo=822eee08, Irp=81b76e48, IRQL=2
[562355 ms]  >>>  URB 741 going down  >>> 
-- URB_FUNCTION_BULK_OR_INTERRUPT_TRANSFER:
  PipeHandle           = 82300ef4 [endpoint 0x00000081]
  TransferFlags        = 00000003 (USBD_TRANSFER_DIRECTION_IN, USBD_SHORT_TRANSFER_OK)
  TransferBufferLength = 00000100
  TransferBuffer       = 00000000
  TransferBufferMDL    = 81ac92e0
  UrbLink              = 00000000
[562356 ms] UsbSnoop - MyInternalIOCTLCompletion(f8917db0) : fido=81b964f0, Irp=81b76e48, Context=81cdfe48, IRQL=2
[562356 ms]  <<<  URB 741 coming back  <<< 
-- URB_FUNCTION_BULK_OR_INTERRUPT_TRANSFER:
  PipeHandle           = 82300ef4 [endpoint 0x00000081]
  TransferFlags        = 00000003 (USBD_TRANSFER_DIRECTION_IN, USBD_SHORT_TRANSFER_OK)
  TransferBufferLength = 00000005
  TransferBuffer       = 00000000
  TransferBufferMDL    = 81ac92e0
    00000000: 00 00 00 33 04
  UrbLink              = 00000000
[562385 ms] UsbSnoop - DispatchAny(f8916610) : IRP_MJ_INTERNAL_DEVICE_CONTROL
[562385 ms] UsbSnoop - MyDispatchInternalIOCTL(f8917e80) : fdo=822eee08, Irp=81b76e48, IRQL=2
[562385 ms]  >>>  URB 742 going down  >>> 
-- URB_FUNCTION_BULK_OR_INTERRUPT_TRANSFER:
  PipeHandle           = 82300ef4 [endpoint 0x00000081]
  TransferFlags        = 00000003 (USBD_TRANSFER_DIRECTION_IN, USBD_SHORT_TRANSFER_OK)
  TransferBufferLength = 00000100
  TransferBuffer       = 00000000
  TransferBufferMDL    = 81ac92e0
  UrbLink              = 00000000
[562386 ms] UsbSnoop - MyInternalIOCTLCompletion(f8917db0) : fido=81b964f0, Irp=81b76e48, Context=81acd810, IRQL=2
[562386 ms]  <<<  URB 742 coming back  <<< 
-- URB_FUNCTION_BULK_OR_INTERRUPT_TRANSFER:
  PipeHandle           = 82300ef4 [endpoint 0x00000081]
  TransferFlags        = 00000003 (USBD_TRANSFER_DIRECTION_IN, USBD_SHORT_TRANSFER_OK)
  TransferBufferLength = 00000033
  TransferBuffer       = 00000000
  TransferBufferMDL    = 81ac92e0
    00000000: 00 00 00 2d 00 0a 04 6d 61 69 6e 00 00 00 06 00
    00000010: 02 00 00 04 f0 04 00 1f 00 03 00 00 01 00 00 05
    00000020: 02 00 01 00 00 04 00 00 00 0c 00 41 00 00 01 00
    00000030: 00 42 01
  UrbLink              = 00000000
[562415 ms] UsbSnoop - DispatchAny(f8916610) : IRP_MJ_INTERNAL_DEVICE_CONTROL
[562415 ms] UsbSnoop - MyDispatchInternalIOCTL(f8917e80) : fdo=822eee08, Irp=81b20c88, IRQL=2
[562416 ms]  >>>  URB 743 going down  >>> 
-- URB_FUNCTION_BULK_OR_INTERRUPT_TRANSFER:
  PipeHandle           = 82300f14 [endpoint 0x00000002]
  TransferFlags        = 00000000 (USBD_TRANSFER_DIRECTION_OUT, ~USBD_SHORT_TRANSFER_OK)
  TransferBufferLength = 00000007
  TransferBuffer       = 00000000
  TransferBufferMDL    = 81ac92e0
    00000000: 00 00 00 02 05 e0 00
  UrbLink              = 00000000
[562416 ms] UsbSnoop - MyInternalIOCTLCompletion(f8917db0) : fido=81b964f0, Irp=81b20c88, Context=81b9a168, IRQL=2
[562416 ms]  <<<  URB 743 coming back  <<< 
-- URB_FUNCTION_BULK_OR_INTERRUPT_TRANSFER:
  PipeHandle           = 82300f14 [endpoint 0x00000002]
  TransferFlags        = 00000000 (USBD_TRANSFER_DIRECTION_OUT, ~USBD_SHORT_TRANSFER_OK)
  TransferBufferLength = 00000007
  TransferBuffer       = 00000000
  TransferBufferMDL    = 81ac92e0
  UrbLink              = 00000000
[562426 ms] UsbSnoop - DispatchAny(f8916610) : IRP_MJ_INTERNAL_DEVICE_CONTROL
[562426 ms] UsbSnoop - MyDispatchInternalIOCTL(f8917e80) : fdo=822eee08, Irp=81b20c88, IRQL=2
[562426 ms]  >>>  URB 744 going down  >>> 
-- URB_FUNCTION_BULK_OR_INTERRUPT_TRANSFER:
  PipeHandle           = 82300ef4 [endpoint 0x00000081]
  TransferFlags        = 00000003 (USBD_TRANSFER_DIRECTION_IN, USBD_SHORT_TRANSFER_OK)
  TransferBufferLength = 00000100
  TransferBuffer       = 00000000
  TransferBufferMDL    = 81ac92e0
  UrbLink              = 00000000
[562426 ms] UsbSnoop - MyInternalIOCTLCompletion(f8917db0) : fido=81b964f0, Irp=81b20c88, Context=81c3bfe8, IRQL=2
[562426 ms]  <<<  URB 744 coming back  <<< 
-- URB_FUNCTION_BULK_OR_INTERRUPT_TRANSFER:
  PipeHandle           = 82300ef4 [endpoint 0x00000081]
  TransferFlags        = 00000003 (USBD_TRANSFER_DIRECTION_IN, USBD_SHORT_TRANSFER_OK)
  TransferBufferLength = 00000005
  TransferBuffer       = 00000000
  TransferBufferMDL    = 81ac92e0
    00000000: 00 00 00 35 04
  UrbLink              = 00000000
[562456 ms] UsbSnoop - DispatchAny(f8916610) : IRP_MJ_INTERNAL_DEVICE_CONTROL
[562456 ms] UsbSnoop - MyDispatchInternalIOCTL(f8917e80) : fdo=822eee08, Irp=81b20c88, IRQL=2
[562456 ms]  >>>  URB 745 going down  >>> 
-- URB_FUNCTION_BULK_OR_INTERRUPT_TRANSFER:
  PipeHandle           = 82300ef4 [endpoint 0x00000081]
  TransferFlags        = 00000003 (USBD_TRANSFER_DIRECTION_IN, USBD_SHORT_TRANSFER_OK)
  TransferBufferLength = 00000100
  TransferBuffer       = 00000000
  TransferBufferMDL    = 81ac92e0
  UrbLink              = 00000000
[562456 ms] UsbSnoop - MyInternalIOCTLCompletion(f8917db0) : fido=81b964f0, Irp=81b20c88, Context=822f3898, IRQL=2
[562456 ms]  <<<  URB 745 coming back  <<< 
-- URB_FUNCTION_BULK_OR_INTERRUPT_TRANSFER:
  PipeHandle           = 82300ef4 [endpoint 0x00000081]
  TransferFlags        = 00000003 (USBD_TRANSFER_DIRECTION_IN, USBD_SHORT_TRANSFER_OK)
  TransferBufferLength = 00000035
  TransferBuffer       = 00000000
  TransferBufferMDL    = 81ac92e0
    00000000: 00 00 00 2f 00 0a 04 6d 61 69 6e 00 01 78 00 00
    00000010: 06 00 02 00 00 04 f0 04 00 00 00 03 00 00 01 00
    00000020: 00 05 02 00 01 00 00 04 00 00 00 05 00 41 00 00
    00000030: 01 00 00 42 01
  UrbLink              = 00000000
[562486 ms] UsbSnoop - DispatchAny(f8916610) : IRP_MJ_INTERNAL_DEVICE_CONTROL
[562486 ms] UsbSnoop - MyDispatchInternalIOCTL(f8917e80) : fdo=822eee08, Irp=81b20c88, IRQL=2
[562486 ms]  >>>  URB 746 going down  >>> 
-- URB_FUNCTION_BULK_OR_INTERRUPT_TRANSFER:
  PipeHandle           = 82300f14 [endpoint 0x00000002]
  TransferFlags        = 00000000 (USBD_TRANSFER_DIRECTION_OUT, ~USBD_SHORT_TRANSFER_OK)
  TransferBufferLength = 00000007
  TransferBuffer       = 00000000
  TransferBufferMDL    = 81ac92e0
    00000000: 00 00 00 02 05 e0 00
  UrbLink              = 00000000
[562486 ms] UsbSnoop - MyInternalIOCTLCompletion(f8917db0) : fido=81b964f0, Irp=81b20c88, Context=81cdfe48, IRQL=2
[562486 ms]  <<<  URB 746 coming back  <<< 
-- URB_FUNCTION_BULK_OR_INTERRUPT_TRANSFER:
  PipeHandle           = 82300f14 [endpoint 0x00000002]
  TransferFlags        = 00000000 (USBD_TRANSFER_DIRECTION_OUT, ~USBD_SHORT_TRANSFER_OK)
  TransferBufferLength = 00000007
  TransferBuffer       = 00000000
  TransferBufferMDL    = 81ac92e0
  UrbLink              = 00000000
[562496 ms] UsbSnoop - DispatchAny(f8916610) : IRP_MJ_INTERNAL_DEVICE_CONTROL
[562496 ms] UsbSnoop - MyDispatchInternalIOCTL(f8917e80) : fdo=822eee08, Irp=81b20c88, IRQL=2
[562496 ms]  >>>  URB 747 going down  >>> 
-- URB_FUNCTION_BULK_OR_INTERRUPT_TRANSFER:
  PipeHandle           = 82300ef4 [endpoint 0x00000081]
  TransferFlags        = 00000003 (USBD_TRANSFER_DIRECTION_IN, USBD_SHORT_TRANSFER_OK)
  TransferBufferLength = 00000100
  TransferBuffer       = 00000000
  TransferBufferMDL    = 81ac92e0
  UrbLink              = 00000000
[562496 ms] UsbSnoop - MyInternalIOCTLCompletion(f8917db0) : fido=81b964f0, Irp=81b20c88, Context=81acd810, IRQL=2
[562496 ms]  <<<  URB 747 coming back  <<< 
-- URB_FUNCTION_BULK_OR_INTERRUPT_TRANSFER:
  PipeHandle           = 82300ef4 [endpoint 0x00000081]
  TransferFlags        = 00000003 (USBD_TRANSFER_DIRECTION_IN, USBD_SHORT_TRANSFER_OK)
  TransferBufferLength = 00000005
  TransferBuffer       = 00000000
  TransferBufferMDL    = 81ac92e0
    00000000: 00 00 00 35 04
  UrbLink              = 00000000
[562526 ms] UsbSnoop - DispatchAny(f8916610) : IRP_MJ_INTERNAL_DEVICE_CONTROL
[562526 ms] UsbSnoop - MyDispatchInternalIOCTL(f8917e80) : fdo=822eee08, Irp=81b20c88, IRQL=2
[562526 ms]  >>>  URB 748 going down  >>> 
-- URB_FUNCTION_BULK_OR_INTERRUPT_TRANSFER:
  PipeHandle           = 82300ef4 [endpoint 0x00000081]
  TransferFlags        = 00000003 (USBD_TRANSFER_DIRECTION_IN, USBD_SHORT_TRANSFER_OK)
  TransferBufferLength = 00000100
  TransferBuffer       = 00000000
  TransferBufferMDL    = 81ac92e0
  UrbLink              = 00000000
[562526 ms] UsbSnoop - MyInternalIOCTLCompletion(f8917db0) : fido=81b964f0, Irp=81b20c88, Context=822f3898, IRQL=2
[562526 ms]  <<<  URB 748 coming back  <<< 
-- URB_FUNCTION_BULK_OR_INTERRUPT_TRANSFER:
  PipeHandle           = 82300ef4 [endpoint 0x00000081]
  TransferFlags        = 00000003 (USBD_TRANSFER_DIRECTION_IN, USBD_SHORT_TRANSFER_OK)
  TransferBufferLength = 00000035
  TransferBuffer       = 00000000
  TransferBufferMDL    = 81ac92e0
    00000000: 00 00 00 2f 00 0a 04 6d 61 69 6e 00 01 79 00 00
    00000010: 06 00 02 00 00 04 f0 04 00 00 00 03 00 00 01 00
    00000020: 00 05 02 00 01 00 00 04 00 00 00 05 00 41 00 00
    00000030: 01 01 00 42 01
  UrbLink              = 00000000
[562556 ms] UsbSnoop - DispatchAny(f8916610) : IRP_MJ_INTERNAL_DEVICE_CONTROL
[562556 ms] UsbSnoop - MyDispatchInternalIOCTL(f8917e80) : fdo=822eee08, Irp=81b20c88, IRQL=2
[562556 ms]  >>>  URB 749 going down  >>> 
-- URB_FUNCTION_BULK_OR_INTERRUPT_TRANSFER:
  PipeHandle           = 82300f14 [endpoint 0x00000002]
  TransferFlags        = 00000000 (USBD_TRANSFER_DIRECTION_OUT, ~USBD_SHORT_TRANSFER_OK)
  TransferBufferLength = 00000007
  TransferBuffer       = 00000000
  TransferBufferMDL    = 81ac92e0
    00000000: 00 00 00 02 05 e0 00
  UrbLink              = 00000000
[562556 ms] UsbSnoop - MyInternalIOCTLCompletion(f8917db0) : fido=81b964f0, Irp=81b20c88, Context=81b9a168, IRQL=2
[562556 ms]  <<<  URB 749 coming back  <<< 
-- URB_FUNCTION_BULK_OR_INTERRUPT_TRANSFER:
  PipeHandle           = 82300f14 [endpoint 0x00000002]
  TransferFlags        = 00000000 (USBD_TRANSFER_DIRECTION_OUT, ~USBD_SHORT_TRANSFER_OK)
  TransferBufferLength = 00000007
  TransferBuffer       = 00000000
  TransferBufferMDL    = 81ac92e0
  UrbLink              = 00000000
[562566 ms] UsbSnoop - DispatchAny(f8916610) : IRP_MJ_INTERNAL_DEVICE_CONTROL
[562566 ms] UsbSnoop - MyDispatchInternalIOCTL(f8917e80) : fdo=822eee08, Irp=81b20c88, IRQL=2
[562566 ms]  >>>  URB 750 going down  >>> 
-- URB_FUNCTION_BULK_OR_INTERRUPT_TRANSFER:
  PipeHandle           = 82300ef4 [endpoint 0x00000081]
  TransferFlags        = 00000003 (USBD_TRANSFER_DIRECTION_IN, USBD_SHORT_TRANSFER_OK)
  TransferBufferLength = 00000100
  TransferBuffer       = 00000000
  TransferBufferMDL    = 81ac92e0
  UrbLink              = 00000000
[562566 ms] UsbSnoop - MyInternalIOCTLCompletion(f8917db0) : fido=81b964f0, Irp=81b20c88, Context=822f3898, IRQL=2
[562566 ms]  <<<  URB 750 coming back  <<< 
-- URB_FUNCTION_BULK_OR_INTERRUPT_TRANSFER:
  PipeHandle           = 82300ef4 [endpoint 0x00000081]
  TransferFlags        = 00000003 (USBD_TRANSFER_DIRECTION_IN, USBD_SHORT_TRANSFER_OK)
  TransferBufferLength = 00000005
  TransferBuffer       = 00000000
  TransferBufferMDL    = 81ac92e0
    00000000: 00 00 00 35 04
  UrbLink              = 00000000
[562596 ms] UsbSnoop - DispatchAny(f8916610) : IRP_MJ_INTERNAL_DEVICE_CONTROL
[562596 ms] UsbSnoop - MyDispatchInternalIOCTL(f8917e80) : fdo=822eee08, Irp=81b20c88, IRQL=2
[562596 ms]  >>>  URB 751 going down  >>> 
-- URB_FUNCTION_BULK_OR_INTERRUPT_TRANSFER:
  PipeHandle           = 82300ef4 [endpoint 0x00000081]
  TransferFlags        = 00000003 (USBD_TRANSFER_DIRECTION_IN, USBD_SHORT_TRANSFER_OK)
  TransferBufferLength = 00000100
  TransferBuffer       = 00000000
  TransferBufferMDL    = 81ac92e0
  UrbLink              = 00000000
[562596 ms] UsbSnoop - MyInternalIOCTLCompletion(f8917db0) : fido=81b964f0, Irp=81b20c88, Context=822f3898, IRQL=2
[562596 ms]  <<<  URB 751 coming back  <<< 
-- URB_FUNCTION_BULK_OR_INTERRUPT_TRANSFER:
  PipeHandle           = 82300ef4 [endpoint 0x00000081]
  TransferFlags        = 00000003 (USBD_TRANSFER_DIRECTION_IN, USBD_SHORT_TRANSFER_OK)
  TransferBufferLength = 00000035
  TransferBuffer       = 00000000
  TransferBufferMDL    = 81ac92e0
    00000000: 00 00 00 2f 00 0a 04 6d 61 69 6e 00 01 7a 00 00
    00000010: 06 00 02 00 00 04 f0 04 00 00 00 03 00 00 01 01
    00000020: 00 05 02 00 01 00 00 04 00 00 00 05 00 41 00 00
    00000030: 01 01 00 42 01
  UrbLink              = 00000000
[562626 ms] UsbSnoop - DispatchAny(f8916610) : IRP_MJ_INTERNAL_DEVICE_CONTROL
[562626 ms] UsbSnoop - MyDispatchInternalIOCTL(f8917e80) : fdo=822eee08, Irp=81b20c88, IRQL=2
[562626 ms]  >>>  URB 752 going down  >>> 
-- URB_FUNCTION_BULK_OR_INTERRUPT_TRANSFER:
  PipeHandle           = 82300f14 [endpoint 0x00000002]
  TransferFlags        = 00000000 (USBD_TRANSFER_DIRECTION_OUT, ~USBD_SHORT_TRANSFER_OK)
  TransferBufferLength = 00000007
  TransferBuffer       = 00000000
  TransferBufferMDL    = 81ac92e0
    00000000: 00 00 00 02 05 e0 00
  UrbLink              = 00000000
[562626 ms] UsbSnoop - MyInternalIOCTLCompletion(f8917db0) : fido=81b964f0, Irp=81b20c88, Context=81cdfe48, IRQL=2
[562626 ms]  <<<  URB 752 coming back  <<< 
-- URB_FUNCTION_BULK_OR_INTERRUPT_TRANSFER:
  PipeHandle           = 82300f14 [endpoint 0x00000002]
  TransferFlags        = 00000000 (USBD_TRANSFER_DIRECTION_OUT, ~USBD_SHORT_TRANSFER_OK)
  TransferBufferLength = 00000007
  TransferBuffer       = 00000000
  TransferBufferMDL    = 81ac92e0
  UrbLink              = 00000000
[562636 ms] UsbSnoop - DispatchAny(f8916610) : IRP_MJ_INTERNAL_DEVICE_CONTROL
[562636 ms] UsbSnoop - MyDispatchInternalIOCTL(f8917e80) : fdo=822eee08, Irp=81b20c88, IRQL=2
[562636 ms]  >>>  URB 753 going down  >>> 
-- URB_FUNCTION_BULK_OR_INTERRUPT_TRANSFER:
  PipeHandle           = 82300ef4 [endpoint 0x00000081]
  TransferFlags        = 00000003 (USBD_TRANSFER_DIRECTION_IN, USBD_SHORT_TRANSFER_OK)
  TransferBufferLength = 00000100
  TransferBuffer       = 00000000
  TransferBufferMDL    = 81ac92e0
  UrbLink              = 00000000
[562636 ms] UsbSnoop - MyInternalIOCTLCompletion(f8917db0) : fido=81b964f0, Irp=81b20c88, Context=822f3898, IRQL=2
[562636 ms]  <<<  URB 753 coming back  <<< 
-- URB_FUNCTION_BULK_OR_INTERRUPT_TRANSFER:
  PipeHandle           = 82300ef4 [endpoint 0x00000081]
  TransferFlags        = 00000003 (USBD_TRANSFER_DIRECTION_IN, USBD_SHORT_TRANSFER_OK)
  TransferBufferLength = 00000005
  TransferBuffer       = 00000000
  TransferBufferMDL    = 81ac92e0
    00000000: 00 00 00 35 04
  UrbLink              = 00000000
[562666 ms] UsbSnoop - DispatchAny(f8916610) : IRP_MJ_INTERNAL_DEVICE_CONTROL
[562666 ms] UsbSnoop - MyDispatchInternalIOCTL(f8917e80) : fdo=822eee08, Irp=81b76e48, IRQL=2
[562666 ms]  >>>  URB 754 going down  >>> 
-- URB_FUNCTION_BULK_OR_INTERRUPT_TRANSFER:
  PipeHandle           = 82300ef4 [endpoint 0x00000081]
  TransferFlags        = 00000003 (USBD_TRANSFER_DIRECTION_IN, USBD_SHORT_TRANSFER_OK)
  TransferBufferLength = 00000100
  TransferBuffer       = 00000000
  TransferBufferMDL    = 81ac92e0
  UrbLink              = 00000000
[562666 ms] UsbSnoop - MyInternalIOCTLCompletion(f8917db0) : fido=81b964f0, Irp=81b76e48, Context=822f3898, IRQL=2
[562666 ms]  <<<  URB 754 coming back  <<< 
-- URB_FUNCTION_BULK_OR_INTERRUPT_TRANSFER:
  PipeHandle           = 82300ef4 [endpoint 0x00000081]
  TransferFlags        = 00000003 (USBD_TRANSFER_DIRECTION_IN, USBD_SHORT_TRANSFER_OK)
  TransferBufferLength = 00000035
  TransferBuffer       = 00000000
  TransferBufferMDL    = 81ac92e0
    00000000: 00 00 00 2f 00 0a 00 06 55 53 50 52 45 53 00 00
    00000010: 06 00 02 00 00 04 f0 04 00 24 00 03 00 00 01 01
    00000020: 00 05 02 00 01 00 00 04 00 00 82 19 00 41 00 00
    00000030: 01 00 00 42 01
  UrbLink              = 00000000
[562696 ms] UsbSnoop - DispatchAny(f8916610) : IRP_MJ_INTERNAL_DEVICE_CONTROL
[562696 ms] UsbSnoop - MyDispatchInternalIOCTL(f8917e80) : fdo=822eee08, Irp=81b20c88, IRQL=2
[562696 ms]  >>>  URB 755 going down  >>> 
-- URB_FUNCTION_BULK_OR_INTERRUPT_TRANSFER:
  PipeHandle           = 82300f14 [endpoint 0x00000002]
  TransferFlags        = 00000000 (USBD_TRANSFER_DIRECTION_OUT, ~USBD_SHORT_TRANSFER_OK)
  TransferBufferLength = 00000007
  TransferBuffer       = 00000000
  TransferBufferMDL    = 81ac92e0
    00000000: 00 00 00 02 05 e0 00
  UrbLink              = 00000000
[562696 ms] UsbSnoop - MyInternalIOCTLCompletion(f8917db0) : fido=81b964f0, Irp=81b20c88, Context=81acd810, IRQL=2
[562696 ms]  <<<  URB 755 coming back  <<< 
-- URB_FUNCTION_BULK_OR_INTERRUPT_TRANSFER:
  PipeHandle           = 82300f14 [endpoint 0x00000002]
  TransferFlags        = 00000000 (USBD_TRANSFER_DIRECTION_OUT, ~USBD_SHORT_TRANSFER_OK)
  TransferBufferLength = 00000007
  TransferBuffer       = 00000000
  TransferBufferMDL    = 81ac92e0
  UrbLink              = 00000000
[562706 ms] UsbSnoop - DispatchAny(f8916610) : IRP_MJ_INTERNAL_DEVICE_CONTROL
[562706 ms] UsbSnoop - MyDispatchInternalIOCTL(f8917e80) : fdo=822eee08, Irp=81b20c88, IRQL=2
[562706 ms]  >>>  URB 756 going down  >>> 
-- URB_FUNCTION_BULK_OR_INTERRUPT_TRANSFER:
  PipeHandle           = 82300ef4 [endpoint 0x00000081]
  TransferFlags        = 00000003 (USBD_TRANSFER_DIRECTION_IN, USBD_SHORT_TRANSFER_OK)
  TransferBufferLength = 00000100
  TransferBuffer       = 00000000
  TransferBufferMDL    = 81ac92e0
  UrbLink              = 00000000
[562706 ms] UsbSnoop - MyInternalIOCTLCompletion(f8917db0) : fido=81b964f0, Irp=81b20c88, Context=821465e8, IRQL=2
[562706 ms]  <<<  URB 756 coming back  <<< 
-- URB_FUNCTION_BULK_OR_INTERRUPT_TRANSFER:
  PipeHandle           = 82300ef4 [endpoint 0x00000081]
  TransferFlags        = 00000003 (USBD_TRANSFER_DIRECTION_IN, USBD_SHORT_TRANSFER_OK)
  TransferBufferLength = 00000005
  TransferBuffer       = 00000000
  TransferBufferMDL    = 81ac92e0
    00000000: 00 00 00 06 04
  UrbLink              = 00000000
[562736 ms] UsbSnoop - DispatchAny(f8916610) : IRP_MJ_INTERNAL_DEVICE_CONTROL
[562736 ms] UsbSnoop - MyDispatchInternalIOCTL(f8917e80) : fdo=822eee08, Irp=81b20c88, IRQL=2
[562736 ms]  >>>  URB 757 going down  >>> 
-- URB_FUNCTION_BULK_OR_INTERRUPT_TRANSFER:
  PipeHandle           = 82300ef4 [endpoint 0x00000081]
  TransferFlags        = 00000003 (USBD_TRANSFER_DIRECTION_IN, USBD_SHORT_TRANSFER_OK)
  TransferBufferLength = 00000100
  TransferBuffer       = 00000000
  TransferBufferMDL    = 81ac92e0
  UrbLink              = 00000000
[562736 ms] UsbSnoop - MyInternalIOCTLCompletion(f8917db0) : fido=81b964f0, Irp=81b20c88, Context=81b9a168, IRQL=2
[562736 ms]  <<<  URB 757 coming back  <<< 
-- URB_FUNCTION_BULK_OR_INTERRUPT_TRANSFER:
  PipeHandle           = 82300ef4 [endpoint 0x00000081]
  TransferFlags        = 00000003 (USBD_TRANSFER_DIRECTION_IN, USBD_SHORT_TRANSFER_OK)
  TransferBufferLength = 00000006
  TransferBuffer       = 00000000
  TransferBufferMDL    = 81ac92e0
    00000000: 00 00 00 00 dd 00
  UrbLink              = 00000000
[562766 ms] UsbSnoop - DispatchAny(f8916610) : IRP_MJ_INTERNAL_DEVICE_CONTROL
[562766 ms] UsbSnoop - MyDispatchInternalIOCTL(f8917e80) : fdo=822eee08, Irp=81b20c88, IRQL=2
[562766 ms]  >>>  URB 758 going down  >>> 
-- URB_FUNCTION_BULK_OR_INTERRUPT_TRANSFER:
  PipeHandle           = 82300f14 [endpoint 0x00000002]
  TransferFlags        = 00000000 (USBD_TRANSFER_DIRECTION_OUT, ~USBD_SHORT_TRANSFER_OK)
  TransferBufferLength = 00000007
  TransferBuffer       = 00000000
  TransferBufferMDL    = 81ac92e0
    00000000: 00 00 00 02 05 e0 00
  UrbLink              = 00000000
[562766 ms] UsbSnoop - MyInternalIOCTLCompletion(f8917db0) : fido=81b964f0, Irp=81b20c88, Context=81cdfe48, IRQL=2
[562766 ms]  <<<  URB 758 coming back  <<< 
-- URB_FUNCTION_BULK_OR_INTERRUPT_TRANSFER:
  PipeHandle           = 82300f14 [endpoint 0x00000002]
  TransferFlags        = 00000000 (USBD_TRANSFER_DIRECTION_OUT, ~USBD_SHORT_TRANSFER_OK)
  TransferBufferLength = 00000007
  TransferBuffer       = 00000000
  TransferBufferMDL    = 81ac92e0
  UrbLink              = 00000000
[562779 ms] UsbSnoop - DispatchAny(f8916610) : IRP_MJ_INTERNAL_DEVICE_CONTROL
[562779 ms] UsbSnoop - MyDispatchInternalIOCTL(f8917e80) : fdo=822eee08, Irp=81b76e48, IRQL=0
[562779 ms]  >>>  URB 759 going down  >>> 
-- URB_FUNCTION_RESET_PIPE:
  PipeHandle = 82300ef4 [endpoint 0x00000081]
[562779 ms] UsbSnoop - MyInternalIOCTLCompletion(f8917db0) : fido=00000000, Irp=81b76e48, Context=822f3898, IRQL=0
[562779 ms]  <<<  URB 759 coming back  <<< 
-- URB_FUNCTION_RESET_PIPE:
[562779 ms] UsbSnoop - DispatchAny(f8916610) : IRP_MJ_INTERNAL_DEVICE_CONTROL
[562779 ms] UsbSnoop - MyDispatchInternalIOCTL(f8917e80) : fdo=822eee08, Irp=81b76e48, IRQL=0
[562779 ms]  >>>  URB 760 going down  >>> 
-- URB_FUNCTION_RESET_PIPE:
  PipeHandle = 82300f14 [endpoint 0x00000002]
[562780 ms] UsbSnoop - MyInternalIOCTLCompletion(f8917db0) : fido=00000000, Irp=81b76e48, Context=81d30f40, IRQL=0
[562780 ms]  <<<  URB 760 coming back  <<< 
-- URB_FUNCTION_RESET_PIPE:
[562780 ms] UsbSnoop - DispatchAny(f8916610) : IRP_MJ_INTERNAL_DEVICE_CONTROL
[562780 ms] UsbSnoop - MyDispatchInternalIOCTL(f8917e80) : fdo=822eee08, Irp=81c21570, IRQL=0
[562780 ms] UsbSnoop - IRP_MJ_POWER (IRP_MN_WAIT_WAKE)
