[422473 ms] UsbSnoop - DispatchAny(f8916610) : IRP_MJ_INTERNAL_DEVICE_CONTROL
[422473 ms] UsbSnoop - MyDispatchInternalIOCTL(f8917e80) : fdo=822eee08, Irp=821756b8, IRQL=0
[422473 ms]  >>>  URB 384 going down  >>> 
-- URB_FUNCTION_RESET_PIPE:
  PipeHandle = 82300ef4 [endpoint 0x00000081]
[422474 ms] UsbSnoop - MyInternalIOCTLCompletion(f8917db0) : fido=00000000, Irp=821756b8, Context=81aba700, IRQL=0
[422474 ms]  <<<  URB 384 coming back  <<< 
-- URB_FUNCTION_RESET_PIPE:
[422474 ms] UsbSnoop - DispatchAny(f8916610) : IRP_MJ_INTERNAL_DEVICE_CONTROL
[422474 ms] UsbSnoop - MyDispatchInternalIOCTL(f8917e80) : fdo=822eee08, Irp=821756b8, IRQL=0
[422474 ms]  >>>  URB 385 going down  >>> 
-- URB_FUNCTION_RESET_PIPE:
  PipeHandle = 82300f14 [endpoint 0x00000002]
[422474 ms] UsbSnoop - MyInternalIOCTLCompletion(f8917db0) : fido=00000000, Irp=821756b8, Context=822ef3d8, IRQL=0
[422474 ms]  <<<  URB 385 coming back  <<< 
-- URB_FUNCTION_RESET_PIPE:
[423475 ms] UsbSnoop - DispatchAny(f8916610) : IRP_MJ_INTERNAL_DEVICE_CONTROL
[423475 ms] UsbSnoop - MyDispatchInternalIOCTL(f8917e80) : fdo=822eee08, Irp=821756b8, IRQL=0
[423475 ms]  >>>  URB 386 going down  >>> 
-- URB_FUNCTION_RESET_PIPE:
  PipeHandle = 82300ef4 [endpoint 0x00000081]
[423475 ms] UsbSnoop - MyInternalIOCTLCompletion(f8917db0) : fido=00000000, Irp=821756b8, Context=822ef3d8, IRQL=0
[423475 ms]  <<<  URB 386 coming back  <<< 
-- URB_FUNCTION_RESET_PIPE:
[423475 ms] UsbSnoop - DispatchAny(f8916610) : IRP_MJ_INTERNAL_DEVICE_CONTROL
[423475 ms] UsbSnoop - MyDispatchInternalIOCTL(f8917e80) : fdo=822eee08, Irp=821756b8, IRQL=0
[423475 ms]  >>>  URB 387 going down  >>> 
-- URB_FUNCTION_RESET_PIPE:
  PipeHandle = 82300f14 [endpoint 0x00000002]
[423475 ms] UsbSnoop - MyInternalIOCTLCompletion(f8917db0) : fido=00000000, Irp=821756b8, Context=821b9890, IRQL=0
[423475 ms]  <<<  URB 387 coming back  <<< 
-- URB_FUNCTION_RESET_PIPE:
[423476 ms] UsbSnoop - DispatchAny(f8916610) : IRP_MJ_INTERNAL_DEVICE_CONTROL
[423476 ms] UsbSnoop - MyDispatchInternalIOCTL(f8917e80) : fdo=822eee08, Irp=81abae48, IRQL=0
[424476 ms] UsbSnoop - IRP_MJ_POWER (IRP_MN_WAIT_WAKE)
[424476 ms] UsbSnoop - DispatchAny(f8916610) : IRP_MJ_INTERNAL_DEVICE_CONTROL
[424476 ms] UsbSnoop - MyDispatchInternalIOCTL(f8917e80) : fdo=822eee08, Irp=821756b8, IRQL=0
[424476 ms]  >>>  URB 388 going down  >>> 
-- URB_FUNCTION_GET_DESCRIPTOR_FROM_DEVICE:
  TransferBufferLength = 00000012
  TransferBuffer       = e284fc38
  TransferBufferMDL    = 00000000
  Index                = 00000000
  DescriptorType       = 00000001 (USB_DEVICE_DESCRIPTOR_TYPE)
  LanguageId           = 00000000
[424477 ms] UsbSnoop - MyInternalIOCTLCompletion(f8917db0) : fido=00000000, Irp=821756b8, Context=81acbac0, IRQL=2
[424477 ms]  <<<  URB 388 coming back  <<< 
-- URB_FUNCTION_CONTROL_TRANSFER:
  PipeHandle           = 82149668
  TransferFlags        = 81abae4b (USBD_TRANSFER_DIRECTION_IN, USBD_SHORT_TRANSFER_OK)
  TransferBufferLength = 00000012
  TransferBuffer       = e284fc38
  TransferBufferMDL    = 81cacbd8
    00000000: 12 01 00 02 00 00 00 40 51 04 04 e0 00 03 01 02
    00000010: 00 01
  UrbLink              = 00000000
  SetupPacket          =
    00000000: 80 06 00 01 00 00 12 00
[424477 ms] UsbSnoop - DispatchAny(f8916610) : IRP_MJ_INTERNAL_DEVICE_CONTROL
[424477 ms] UsbSnoop - MyDispatchInternalIOCTL(f8917e80) : fdo=822eee08, Irp=81abae48, IRQL=0
[424477 ms] UsbSnoop - IRP_MJ_POWER (IRP_MN_WAIT_WAKE)
[424477 ms] UsbSnoop - DispatchAny(f8916610) : IRP_MJ_INTERNAL_DEVICE_CONTROL
[424477 ms] UsbSnoop - MyDispatchInternalIOCTL(f8917e80) : fdo=822eee08, Irp=81abae48, IRQL=0
[424477 ms]  >>>  URB 389 going down  >>> 
-- URB_FUNCTION_RESET_PIPE:
  PipeHandle = 82300ef4 [endpoint 0x00000081]
[424478 ms] UsbSnoop - MyInternalIOCTLCompletion(f8917db0) : fido=00000000, Irp=81abae48, Context=81abee68, IRQL=0
[424478 ms]  <<<  URB 389 coming back  <<< 
-- URB_FUNCTION_RESET_PIPE:
[424478 ms] UsbSnoop - DispatchAny(f8916610) : IRP_MJ_INTERNAL_DEVICE_CONTROL
[424478 ms] UsbSnoop - MyDispatchInternalIOCTL(f8917e80) : fdo=822eee08, Irp=81abae48, IRQL=0
[424478 ms]  >>>  URB 390 going down  >>> 
-- URB_FUNCTION_RESET_PIPE:
  PipeHandle = 82300f14 [endpoint 0x00000002]
[424478 ms] UsbSnoop - MyInternalIOCTLCompletion(f8917db0) : fido=00000000, Irp=81abae48, Context=81aef518, IRQL=0
[424478 ms]  <<<  URB 390 coming back  <<< 
-- URB_FUNCTION_RESET_PIPE:
[425738 ms] UsbSnoop - DispatchAny(f8916610) : IRP_MJ_INTERNAL_DEVICE_CONTROL
[425738 ms] UsbSnoop - MyDispatchInternalIOCTL(f8917e80) : fdo=822eee08, Irp=81b228c8, IRQL=2
[425738 ms]  >>>  URB 391 going down  >>> 
-- URB_FUNCTION_BULK_OR_INTERRUPT_TRANSFER:
  PipeHandle           = 82300f14 [endpoint 0x00000002]
  TransferFlags        = 00000000 (USBD_TRANSFER_DIRECTION_OUT, ~USBD_SHORT_TRANSFER_OK)
  TransferBufferLength = 00000009
  TransferBuffer       = 00000000
  TransferBufferMDL    = 81ad0f88
    00000000: 00 00 00 04 01 00 00 04 00
  UrbLink              = 00000000
[425738 ms] UsbSnoop - MyInternalIOCTLCompletion(f8917db0) : fido=81b964f0, Irp=81b228c8, Context=81b06608, IRQL=2
[425738 ms]  <<<  URB 391 coming back  <<< 
-- URB_FUNCTION_BULK_OR_INTERRUPT_TRANSFER:
  PipeHandle           = 82300f14 [endpoint 0x00000002]
  TransferFlags        = 00000000 (USBD_TRANSFER_DIRECTION_OUT, ~USBD_SHORT_TRANSFER_OK)
  TransferBufferLength = 00000009
  TransferBuffer       = 00000000
  TransferBufferMDL    = 81ad0f88
  UrbLink              = 00000000
[425740 ms] UsbSnoop - DispatchAny(f8916610) : IRP_MJ_INTERNAL_DEVICE_CONTROL
[425740 ms] UsbSnoop - MyDispatchInternalIOCTL(f8917e80) : fdo=822eee08, Irp=81b228c8, IRQL=2
[425740 ms]  >>>  URB 392 going down  >>> 
-- URB_FUNCTION_BULK_OR_INTERRUPT_TRANSFER:
  PipeHandle           = 82300ef4 [endpoint 0x00000081]
  TransferFlags        = 00000003 (USBD_TRANSFER_DIRECTION_IN, USBD_SHORT_TRANSFER_OK)
  TransferBufferLength = 00000100
  TransferBuffer       = 00000000
  TransferBufferMDL    = 81ad0f88
  UrbLink              = 00000000
[425741 ms] UsbSnoop - MyInternalIOCTLCompletion(f8917db0) : fido=81b964f0, Irp=81b228c8, Context=822ef3d8, IRQL=2
[425741 ms]  <<<  URB 392 coming back  <<< 
-- URB_FUNCTION_BULK_OR_INTERRUPT_TRANSFER:
  PipeHandle           = 82300ef4 [endpoint 0x00000081]
  TransferFlags        = 00000003 (USBD_TRANSFER_DIRECTION_IN, USBD_SHORT_TRANSFER_OK)
  TransferBufferLength = 00000009
  TransferBuffer       = 00000000
  TransferBufferMDL    = 81ad0f88
    00000000: 00 00 00 04 02 00 00 03 ff
  UrbLink              = 00000000
[425768 ms] UsbSnoop - DispatchAny(f8916610) : IRP_MJ_INTERNAL_DEVICE_CONTROL
[425768 ms] UsbSnoop - MyDispatchInternalIOCTL(f8917e80) : fdo=822eee08, Irp=81b228c8, IRQL=2
[425768 ms]  >>>  URB 393 going down  >>> 
-- URB_FUNCTION_BULK_OR_INTERRUPT_TRANSFER:
  PipeHandle           = 82300f14 [endpoint 0x00000002]
  TransferFlags        = 00000000 (USBD_TRANSFER_DIRECTION_OUT, ~USBD_SHORT_TRANSFER_OK)
  TransferBufferLength = 00000015
  TransferBuffer       = 00000000
  TransferBufferMDL    = 81ad0f88
    00000000: 00 00 00 10 04 00 00 00 0a 00 01 00 03 00 01 00
    00000010: 00 00 00 07 d0
  UrbLink              = 00000000
[425768 ms] UsbSnoop - MyInternalIOCTLCompletion(f8917db0) : fido=81b964f0, Irp=81b228c8, Context=81c49750, IRQL=2
[425768 ms]  <<<  URB 393 coming back  <<< 
-- URB_FUNCTION_BULK_OR_INTERRUPT_TRANSFER:
  PipeHandle           = 82300f14 [endpoint 0x00000002]
  TransferFlags        = 00000000 (USBD_TRANSFER_DIRECTION_OUT, ~USBD_SHORT_TRANSFER_OK)
  TransferBufferLength = 00000015
  TransferBuffer       = 00000000
  TransferBufferMDL    = 81ad0f88
  UrbLink              = 00000000
[425778 ms] UsbSnoop - DispatchAny(f8916610) : IRP_MJ_INTERNAL_DEVICE_CONTROL
[425778 ms] UsbSnoop - MyDispatchInternalIOCTL(f8917e80) : fdo=822eee08, Irp=81b228c8, IRQL=2
[425778 ms]  >>>  URB 394 going down  >>> 
-- URB_FUNCTION_BULK_OR_INTERRUPT_TRANSFER:
  PipeHandle           = 82300ef4 [endpoint 0x00000081]
  TransferFlags        = 00000003 (USBD_TRANSFER_DIRECTION_IN, USBD_SHORT_TRANSFER_OK)
  TransferBufferLength = 00000100
  TransferBuffer       = 00000000
  TransferBufferMDL    = 81ad0f88
  UrbLink              = 00000000
[425778 ms] UsbSnoop - MyInternalIOCTLCompletion(f8917db0) : fido=81b964f0, Irp=81b228c8, Context=822ef3d8, IRQL=2
[425778 ms]  <<<  URB 394 coming back  <<< 
-- URB_FUNCTION_BULK_OR_INTERRUPT_TRANSFER:
  PipeHandle           = 82300ef4 [endpoint 0x00000081]
  TransferFlags        = 00000003 (USBD_TRANSFER_DIRECTION_IN, USBD_SHORT_TRANSFER_OK)
  TransferBufferLength = 00000007
  TransferBuffer       = 00000000
  TransferBufferMDL    = 81ad0f88
    00000000: 00 00 00 02 05 e0 00
  UrbLink              = 00000000
[425818 ms] UsbSnoop - DispatchAny(f8916610) : IRP_MJ_INTERNAL_DEVICE_CONTROL
[425818 ms] UsbSnoop - MyDispatchInternalIOCTL(f8917e80) : fdo=822eee08, Irp=81b228c8, IRQL=2
[425818 ms]  >>>  URB 395 going down  >>> 
-- URB_FUNCTION_BULK_OR_INTERRUPT_TRANSFER:
  PipeHandle           = 82300ef4 [endpoint 0x00000081]
  TransferFlags        = 00000003 (USBD_TRANSFER_DIRECTION_IN, USBD_SHORT_TRANSFER_OK)
  TransferBufferLength = 00000100
  TransferBuffer       = 00000000
  TransferBufferMDL    = 81ad0f88
  UrbLink              = 00000000
[425818 ms] UsbSnoop - MyInternalIOCTLCompletion(f8917db0) : fido=81b964f0, Irp=81b228c8, Context=81aef518, IRQL=2
[425818 ms]  <<<  URB 395 coming back  <<< 
-- URB_FUNCTION_BULK_OR_INTERRUPT_TRANSFER:
  PipeHandle           = 82300ef4 [endpoint 0x00000081]
  TransferFlags        = 00000003 (USBD_TRANSFER_DIRECTION_IN, USBD_SHORT_TRANSFER_OK)
  TransferBufferLength = 00000005
  TransferBuffer       = 00000000
  TransferBufferMDL    = 81ad0f88
    00000000: 00 00 00 0a 04
  UrbLink              = 00000000
[425848 ms] UsbSnoop - DispatchAny(f8916610) : IRP_MJ_INTERNAL_DEVICE_CONTROL
[425848 ms] UsbSnoop - MyDispatchInternalIOCTL(f8917e80) : fdo=822eee08, Irp=81b228c8, IRQL=2
[425848 ms]  >>>  URB 396 going down  >>> 
-- URB_FUNCTION_BULK_OR_INTERRUPT_TRANSFER:
  PipeHandle           = 82300ef4 [endpoint 0x00000081]
  TransferFlags        = 00000003 (USBD_TRANSFER_DIRECTION_IN, USBD_SHORT_TRANSFER_OK)
  TransferBufferLength = 00000100
  TransferBuffer       = 00000000
  TransferBufferMDL    = 81ad0f88
  UrbLink              = 00000000
[425849 ms] UsbSnoop - MyInternalIOCTLCompletion(f8917db0) : fido=81b964f0, Irp=81b228c8, Context=822ef3d8, IRQL=2
[425849 ms]  <<<  URB 396 coming back  <<< 
-- URB_FUNCTION_BULK_OR_INTERRUPT_TRANSFER:
  PipeHandle           = 82300ef4 [endpoint 0x00000081]
  TransferFlags        = 00000003 (USBD_TRANSFER_DIRECTION_IN, USBD_SHORT_TRANSFER_OK)
  TransferBufferLength = 0000000a
  TransferBuffer       = 00000000
  TransferBufferMDL    = 81ad0f88
    00000000: 00 00 00 04 00 12 00 00 07 d0
  UrbLink              = 00000000
[425878 ms] UsbSnoop - DispatchAny(f8916610) : IRP_MJ_INTERNAL_DEVICE_CONTROL
[425878 ms] UsbSnoop - MyDispatchInternalIOCTL(f8917e80) : fdo=822eee08, Irp=81b228c8, IRQL=2
[425878 ms]  >>>  URB 397 going down  >>> 
-- URB_FUNCTION_BULK_OR_INTERRUPT_TRANSFER:
  PipeHandle           = 82300f14 [endpoint 0x00000002]
  TransferFlags        = 00000000 (USBD_TRANSFER_DIRECTION_OUT, ~USBD_SHORT_TRANSFER_OK)
  TransferBufferLength = 00000007
  TransferBuffer       = 00000000
  TransferBufferMDL    = 81ad0f88
    00000000: 00 00 00 02 05 e0 00
  UrbLink              = 00000000
[425878 ms] UsbSnoop - MyInternalIOCTLCompletion(f8917db0) : fido=81b964f0, Irp=81b228c8, Context=81c49750, IRQL=2
[425878 ms]  <<<  URB 397 coming back  <<< 
-- URB_FUNCTION_BULK_OR_INTERRUPT_TRANSFER:
  PipeHandle           = 82300f14 [endpoint 0x00000002]
  TransferFlags        = 00000000 (USBD_TRANSFER_DIRECTION_OUT, ~USBD_SHORT_TRANSFER_OK)
  TransferBufferLength = 00000007
  TransferBuffer       = 00000000
  TransferBufferMDL    = 81ad0f88
  UrbLink              = 00000000
[425888 ms] UsbSnoop - DispatchAny(f8916610) : IRP_MJ_INTERNAL_DEVICE_CONTROL
[425888 ms] UsbSnoop - MyDispatchInternalIOCTL(f8917e80) : fdo=822eee08, Irp=81b228c8, IRQL=2
[425888 ms]  >>>  URB 398 going down  >>> 
-- URB_FUNCTION_BULK_OR_INTERRUPT_TRANSFER:
  PipeHandle           = 82300f14 [endpoint 0x00000002]
  TransferFlags        = 00000000 (USBD_TRANSFER_DIRECTION_OUT, ~USBD_SHORT_TRANSFER_OK)
  TransferBufferLength = 00000022
  TransferBuffer       = 00000000
  TransferBufferMDL    = 81ad0f88
    00000000: 00 00 00 1d 04 00 00 00 17 00 09 00 00 00 06 00
    00000010: 02 00 03 00 05 00 01 00 41 00 42 00 01 00 01 00
    00000020: 01 01
  UrbLink              = 00000000
[425889 ms] UsbSnoop - MyInternalIOCTLCompletion(f8917db0) : fido=81b964f0, Irp=81b228c8, Context=822ef3d8, IRQL=2
[425889 ms]  <<<  URB 398 coming back  <<< 
-- URB_FUNCTION_BULK_OR_INTERRUPT_TRANSFER:
  PipeHandle           = 82300f14 [endpoint 0x00000002]
  TransferFlags        = 00000000 (USBD_TRANSFER_DIRECTION_OUT, ~USBD_SHORT_TRANSFER_OK)
  TransferBufferLength = 00000022
  TransferBuffer       = 00000000
  TransferBufferMDL    = 81ad0f88
  UrbLink              = 00000000
[425898 ms] UsbSnoop - DispatchAny(f8916610) : IRP_MJ_INTERNAL_DEVICE_CONTROL
[425898 ms] UsbSnoop - MyDispatchInternalIOCTL(f8917e80) : fdo=822eee08, Irp=81b228c8, IRQL=2
[425898 ms]  >>>  URB 399 going down  >>> 
-- URB_FUNCTION_BULK_OR_INTERRUPT_TRANSFER:
  PipeHandle           = 82300ef4 [endpoint 0x00000081]
  TransferFlags        = 00000003 (USBD_TRANSFER_DIRECTION_IN, USBD_SHORT_TRANSFER_OK)
  TransferBufferLength = 00000100
  TransferBuffer       = 00000000
  TransferBufferMDL    = 81ad0f88
  UrbLink              = 00000000
[425899 ms] UsbSnoop - MyInternalIOCTLCompletion(f8917db0) : fido=81b964f0, Irp=81b228c8, Context=81b06608, IRQL=2
[425899 ms]  <<<  URB 399 coming back  <<< 
-- URB_FUNCTION_BULK_OR_INTERRUPT_TRANSFER:
  PipeHandle           = 82300ef4 [endpoint 0x00000081]
  TransferFlags        = 00000003 (USBD_TRANSFER_DIRECTION_IN, USBD_SHORT_TRANSFER_OK)
  TransferBufferLength = 00000007
  TransferBuffer       = 00000000
  TransferBufferMDL    = 81ad0f88
    00000000: 00 00 00 02 05 e0 00
  UrbLink              = 00000000
[425939 ms] UsbSnoop - DispatchAny(f8916610) : IRP_MJ_INTERNAL_DEVICE_CONTROL
[425939 ms] UsbSnoop - MyDispatchInternalIOCTL(f8917e80) : fdo=822eee08, Irp=81b23680, IRQL=2
[425939 ms]  >>>  URB 400 going down  >>> 
-- URB_FUNCTION_BULK_OR_INTERRUPT_TRANSFER:
  PipeHandle           = 82300ef4 [endpoint 0x00000081]
  TransferFlags        = 00000003 (USBD_TRANSFER_DIRECTION_IN, USBD_SHORT_TRANSFER_OK)
  TransferBufferLength = 00000100
  TransferBuffer       = 00000000
  TransferBufferMDL    = 81ad0f88
  UrbLink              = 00000000
[425939 ms] UsbSnoop - MyInternalIOCTLCompletion(f8917db0) : fido=81b964f0, Irp=81b23680, Context=81aba700, IRQL=2
[425939 ms]  <<<  URB 400 coming back  <<< 
-- URB_FUNCTION_BULK_OR_INTERRUPT_TRANSFER:
  PipeHandle           = 82300ef4 [endpoint 0x00000081]
  TransferFlags        = 00000003 (USBD_TRANSFER_DIRECTION_IN, USBD_SHORT_TRANSFER_OK)
  TransferBufferLength = 00000005
  TransferBuffer       = 00000000
  TransferBufferMDL    = 81ad0f88
    00000000: 00 00 00 33 04
  UrbLink              = 00000000
[425968 ms] UsbSnoop - DispatchAny(f8916610) : IRP_MJ_INTERNAL_DEVICE_CONTROL
[425968 ms] UsbSnoop - MyDispatchInternalIOCTL(f8917e80) : fdo=822eee08, Irp=81b23680, IRQL=2
[425969 ms]  >>>  URB 401 going down  >>> 
-- URB_FUNCTION_BULK_OR_INTERRUPT_TRANSFER:
  PipeHandle           = 82300ef4 [endpoint 0x00000081]
  TransferFlags        = 00000003 (USBD_TRANSFER_DIRECTION_IN, USBD_SHORT_TRANSFER_OK)
  TransferBufferLength = 00000100
  TransferBuffer       = 00000000
  TransferBufferMDL    = 81ad0f88
  UrbLink              = 00000000
[425969 ms] UsbSnoop - MyInternalIOCTLCompletion(f8917db0) : fido=81b964f0, Irp=81b23680, Context=81aef518, IRQL=2
[425969 ms]  <<<  URB 401 coming back  <<< 
-- URB_FUNCTION_BULK_OR_INTERRUPT_TRANSFER:
  PipeHandle           = 82300ef4 [endpoint 0x00000081]
  TransferFlags        = 00000003 (USBD_TRANSFER_DIRECTION_IN, USBD_SHORT_TRANSFER_OK)
  TransferBufferLength = 00000033
  TransferBuffer       = 00000000
  TransferBufferMDL    = 81ad0f88
    00000000: 00 00 00 2d 00 0a 04 6d 61 69 6e 00 00 00 06 00
    00000010: 02 00 00 04 f0 04 00 1f 00 03 00 00 01 00 00 05
    00000020: 02 00 01 00 00 04 00 00 00 0c 00 41 00 00 01 00
    00000030: 00 42 01
  UrbLink              = 00000000
[425999 ms] UsbSnoop - DispatchAny(f8916610) : IRP_MJ_INTERNAL_DEVICE_CONTROL
[425999 ms] UsbSnoop - MyDispatchInternalIOCTL(f8917e80) : fdo=822eee08, Irp=81b23680, IRQL=2
[425999 ms]  >>>  URB 402 going down  >>> 
-- URB_FUNCTION_BULK_OR_INTERRUPT_TRANSFER:
  PipeHandle           = 82300f14 [endpoint 0x00000002]
  TransferFlags        = 00000000 (USBD_TRANSFER_DIRECTION_OUT, ~USBD_SHORT_TRANSFER_OK)
  TransferBufferLength = 00000007
  TransferBuffer       = 00000000
  TransferBufferMDL    = 81ad0f88
    00000000: 00 00 00 02 05 e0 00
  UrbLink              = 00000000
[425999 ms] UsbSnoop - MyInternalIOCTLCompletion(f8917db0) : fido=81b964f0, Irp=81b23680, Context=81b06608, IRQL=2
[425999 ms]  <<<  URB 402 coming back  <<< 
-- URB_FUNCTION_BULK_OR_INTERRUPT_TRANSFER:
  PipeHandle           = 82300f14 [endpoint 0x00000002]
  TransferFlags        = 00000000 (USBD_TRANSFER_DIRECTION_OUT, ~USBD_SHORT_TRANSFER_OK)
  TransferBufferLength = 00000007
  TransferBuffer       = 00000000
  TransferBufferMDL    = 81ad0f88
  UrbLink              = 00000000
[426009 ms] UsbSnoop - DispatchAny(f8916610) : IRP_MJ_INTERNAL_DEVICE_CONTROL
[426009 ms] UsbSnoop - MyDispatchInternalIOCTL(f8917e80) : fdo=822eee08, Irp=81ab2e48, IRQL=2
[426009 ms]  >>>  URB 403 going down  >>> 
-- URB_FUNCTION_BULK_OR_INTERRUPT_TRANSFER:
  PipeHandle           = 82300ef4 [endpoint 0x00000081]
  TransferFlags        = 00000003 (USBD_TRANSFER_DIRECTION_IN, USBD_SHORT_TRANSFER_OK)
  TransferBufferLength = 00000100
  TransferBuffer       = 00000000
  TransferBufferMDL    = 81ad0f88
  UrbLink              = 00000000
[426009 ms] UsbSnoop - MyInternalIOCTLCompletion(f8917db0) : fido=81b964f0, Irp=81ab2e48, Context=81aef518, IRQL=2
[426009 ms]  <<<  URB 403 coming back  <<< 
-- URB_FUNCTION_BULK_OR_INTERRUPT_TRANSFER:
  PipeHandle           = 82300ef4 [endpoint 0x00000081]
  TransferFlags        = 00000003 (USBD_TRANSFER_DIRECTION_IN, USBD_SHORT_TRANSFER_OK)
  TransferBufferLength = 00000005
  TransferBuffer       = 00000000
  TransferBufferMDL    = 81ad0f88
    00000000: 00 00 00 35 04
  UrbLink              = 00000000
[426039 ms] UsbSnoop - DispatchAny(f8916610) : IRP_MJ_INTERNAL_DEVICE_CONTROL
[426039 ms] UsbSnoop - MyDispatchInternalIOCTL(f8917e80) : fdo=822eee08, Irp=81ab2e48, IRQL=2
[426039 ms]  >>>  URB 404 going down  >>> 
-- URB_FUNCTION_BULK_OR_INTERRUPT_TRANSFER:
  PipeHandle           = 82300ef4 [endpoint 0x00000081]
  TransferFlags        = 00000003 (USBD_TRANSFER_DIRECTION_IN, USBD_SHORT_TRANSFER_OK)
  TransferBufferLength = 00000100
  TransferBuffer       = 00000000
  TransferBufferMDL    = 81ad0f88
  UrbLink              = 00000000
[426039 ms] UsbSnoop - MyInternalIOCTLCompletion(f8917db0) : fido=81b964f0, Irp=81ab2e48, Context=81aba700, IRQL=2
[426039 ms]  <<<  URB 404 coming back  <<< 
-- URB_FUNCTION_BULK_OR_INTERRUPT_TRANSFER:
  PipeHandle           = 82300ef4 [endpoint 0x00000081]
  TransferFlags        = 00000003 (USBD_TRANSFER_DIRECTION_IN, USBD_SHORT_TRANSFER_OK)
  TransferBufferLength = 00000035
  TransferBuffer       = 00000000
  TransferBufferMDL    = 81ad0f88
    00000000: 00 00 00 2f 00 0a 04 6d 61 69 6e 00 01 78 00 00
    00000010: 06 00 02 00 00 04 f0 04 00 00 00 03 00 00 01 00
    00000020: 00 05 02 00 01 00 00 04 00 00 00 05 00 41 00 00
    00000030: 01 00 00 42 01
  UrbLink              = 00000000
[426069 ms] UsbSnoop - DispatchAny(f8916610) : IRP_MJ_INTERNAL_DEVICE_CONTROL
[426069 ms] UsbSnoop - MyDispatchInternalIOCTL(f8917e80) : fdo=822eee08, Irp=81ab2e48, IRQL=2
[426069 ms]  >>>  URB 405 going down  >>> 
-- URB_FUNCTION_BULK_OR_INTERRUPT_TRANSFER:
  PipeHandle           = 82300f14 [endpoint 0x00000002]
  TransferFlags        = 00000000 (USBD_TRANSFER_DIRECTION_OUT, ~USBD_SHORT_TRANSFER_OK)
  TransferBufferLength = 00000007
  TransferBuffer       = 00000000
  TransferBufferMDL    = 81ad0f88
    00000000: 00 00 00 02 05 e0 00
  UrbLink              = 00000000
[426069 ms] UsbSnoop - MyInternalIOCTLCompletion(f8917db0) : fido=81b964f0, Irp=81ab2e48, Context=81aef518, IRQL=2
[426069 ms]  <<<  URB 405 coming back  <<< 
-- URB_FUNCTION_BULK_OR_INTERRUPT_TRANSFER:
  PipeHandle           = 82300f14 [endpoint 0x00000002]
  TransferFlags        = 00000000 (USBD_TRANSFER_DIRECTION_OUT, ~USBD_SHORT_TRANSFER_OK)
  TransferBufferLength = 00000007
  TransferBuffer       = 00000000
  TransferBufferMDL    = 81ad0f88
  UrbLink              = 00000000
[426079 ms] UsbSnoop - DispatchAny(f8916610) : IRP_MJ_INTERNAL_DEVICE_CONTROL
[426079 ms] UsbSnoop - MyDispatchInternalIOCTL(f8917e80) : fdo=822eee08, Irp=81ab2e48, IRQL=2
[426079 ms]  >>>  URB 406 going down  >>> 
-- URB_FUNCTION_BULK_OR_INTERRUPT_TRANSFER:
  PipeHandle           = 82300ef4 [endpoint 0x00000081]
  TransferFlags        = 00000003 (USBD_TRANSFER_DIRECTION_IN, USBD_SHORT_TRANSFER_OK)
  TransferBufferLength = 00000100
  TransferBuffer       = 00000000
  TransferBufferMDL    = 81ad0f88
  UrbLink              = 00000000
[426079 ms] UsbSnoop - MyInternalIOCTLCompletion(f8917db0) : fido=81b964f0, Irp=81ab2e48, Context=81b06608, IRQL=2
[426079 ms]  <<<  URB 406 coming back  <<< 
-- URB_FUNCTION_BULK_OR_INTERRUPT_TRANSFER:
  PipeHandle           = 82300ef4 [endpoint 0x00000081]
  TransferFlags        = 00000003 (USBD_TRANSFER_DIRECTION_IN, USBD_SHORT_TRANSFER_OK)
  TransferBufferLength = 00000005
  TransferBuffer       = 00000000
  TransferBufferMDL    = 81ad0f88
    00000000: 00 00 00 06 04
  UrbLink              = 00000000
[426109 ms] UsbSnoop - DispatchAny(f8916610) : IRP_MJ_INTERNAL_DEVICE_CONTROL
[426109 ms] UsbSnoop - MyDispatchInternalIOCTL(f8917e80) : fdo=822eee08, Irp=81ab2e48, IRQL=2
[426109 ms]  >>>  URB 407 going down  >>> 
-- URB_FUNCTION_BULK_OR_INTERRUPT_TRANSFER:
  PipeHandle           = 82300ef4 [endpoint 0x00000081]
  TransferFlags        = 00000003 (USBD_TRANSFER_DIRECTION_IN, USBD_SHORT_TRANSFER_OK)
  TransferBufferLength = 00000100
  TransferBuffer       = 00000000
  TransferBufferMDL    = 81ad0f88
  UrbLink              = 00000000
[426109 ms] UsbSnoop - MyInternalIOCTLCompletion(f8917db0) : fido=81b964f0, Irp=81ab2e48, Context=81aef518, IRQL=2
[426109 ms]  <<<  URB 407 coming back  <<< 
-- URB_FUNCTION_BULK_OR_INTERRUPT_TRANSFER:
  PipeHandle           = 82300ef4 [endpoint 0x00000081]
  TransferFlags        = 00000003 (USBD_TRANSFER_DIRECTION_IN, USBD_SHORT_TRANSFER_OK)
  TransferBufferLength = 00000006
  TransferBuffer       = 00000000
  TransferBufferMDL    = 81ad0f88
    00000000: 00 00 00 00 dd 00
  UrbLink              = 00000000
[426139 ms] UsbSnoop - DispatchAny(f8916610) : IRP_MJ_INTERNAL_DEVICE_CONTROL
[426139 ms] UsbSnoop - MyDispatchInternalIOCTL(f8917e80) : fdo=822eee08, Irp=81ab2e48, IRQL=2
[426139 ms]  >>>  URB 408 going down  >>> 
-- URB_FUNCTION_BULK_OR_INTERRUPT_TRANSFER:
  PipeHandle           = 82300f14 [endpoint 0x00000002]
  TransferFlags        = 00000000 (USBD_TRANSFER_DIRECTION_OUT, ~USBD_SHORT_TRANSFER_OK)
  TransferBufferLength = 00000007
  TransferBuffer       = 00000000
  TransferBufferMDL    = 81ad0f88
    00000000: 00 00 00 02 05 e0 00
  UrbLink              = 00000000
[426139 ms] UsbSnoop - MyInternalIOCTLCompletion(f8917db0) : fido=81b964f0, Irp=81ab2e48, Context=81c49750, IRQL=2
[426139 ms]  <<<  URB 408 coming back  <<< 
-- URB_FUNCTION_BULK_OR_INTERRUPT_TRANSFER:
  PipeHandle           = 82300f14 [endpoint 0x00000002]
  TransferFlags        = 00000000 (USBD_TRANSFER_DIRECTION_OUT, ~USBD_SHORT_TRANSFER_OK)
  TransferBufferLength = 00000007
  TransferBuffer       = 00000000
  TransferBufferMDL    = 81ad0f88
  UrbLink              = 00000000
[426419 ms] UsbSnoop - DispatchAny(f8916610) : IRP_MJ_INTERNAL_DEVICE_CONTROL
[426419 ms] UsbSnoop - MyDispatchInternalIOCTL(f8917e80) : fdo=822eee08, Irp=81ab2e48, IRQL=2
[426419 ms]  >>>  URB 409 going down  >>> 
-- URB_FUNCTION_BULK_OR_INTERRUPT_TRANSFER:
  PipeHandle           = 82300f14 [endpoint 0x00000002]
  TransferFlags        = 00000000 (USBD_TRANSFER_DIRECTION_OUT, ~USBD_SHORT_TRANSFER_OK)
  TransferBufferLength = 00000009
  TransferBuffer       = 00000000
  TransferBufferMDL    = 81ad0f88
    00000000: 00 00 00 04 01 00 00 04 00
  UrbLink              = 00000000
[426420 ms] UsbSnoop - MyInternalIOCTLCompletion(f8917db0) : fido=81b964f0, Irp=81ab2e48, Context=81b06608, IRQL=2
[426420 ms]  <<<  URB 409 coming back  <<< 
-- URB_FUNCTION_BULK_OR_INTERRUPT_TRANSFER:
  PipeHandle           = 82300f14 [endpoint 0x00000002]
  TransferFlags        = 00000000 (USBD_TRANSFER_DIRECTION_OUT, ~USBD_SHORT_TRANSFER_OK)
  TransferBufferLength = 00000009
  TransferBuffer       = 00000000
  TransferBufferMDL    = 81ad0f88
  UrbLink              = 00000000
[426420 ms] UsbSnoop - DispatchAny(f8916610) : IRP_MJ_INTERNAL_DEVICE_CONTROL
[426420 ms] UsbSnoop - MyDispatchInternalIOCTL(f8917e80) : fdo=822eee08, Irp=81ab2e48, IRQL=2
[426420 ms]  >>>  URB 410 going down  >>> 
-- URB_FUNCTION_BULK_OR_INTERRUPT_TRANSFER:
  PipeHandle           = 82300ef4 [endpoint 0x00000081]
  TransferFlags        = 00000003 (USBD_TRANSFER_DIRECTION_IN, USBD_SHORT_TRANSFER_OK)
  TransferBufferLength = 00000100
  TransferBuffer       = 00000000
  TransferBufferMDL    = 81ad0f88
  UrbLink              = 00000000
[426422 ms] UsbSnoop - MyInternalIOCTLCompletion(f8917db0) : fido=81b964f0, Irp=81ab2e48, Context=81acbac0, IRQL=2
[426422 ms]  <<<  URB 410 coming back  <<< 
-- URB_FUNCTION_BULK_OR_INTERRUPT_TRANSFER:
  PipeHandle           = 82300ef4 [endpoint 0x00000081]
  TransferFlags        = 00000003 (USBD_TRANSFER_DIRECTION_IN, USBD_SHORT_TRANSFER_OK)
  TransferBufferLength = 00000009
  TransferBuffer       = 00000000
  TransferBufferMDL    = 81ad0f88
    00000000: 00 00 00 04 02 00 00 03 ff
  UrbLink              = 00000000
[426450 ms] UsbSnoop - DispatchAny(f8916610) : IRP_MJ_INTERNAL_DEVICE_CONTROL
[426450 ms] UsbSnoop - MyDispatchInternalIOCTL(f8917e80) : fdo=822eee08, Irp=822f0008, IRQL=2
[426450 ms]  >>>  URB 411 going down  >>> 
-- URB_FUNCTION_BULK_OR_INTERRUPT_TRANSFER:
  PipeHandle           = 82300f14 [endpoint 0x00000002]
  TransferFlags        = 00000000 (USBD_TRANSFER_DIRECTION_OUT, ~USBD_SHORT_TRANSFER_OK)
  TransferBufferLength = 00000015
  TransferBuffer       = 00000000
  TransferBufferMDL    = 81c35f88
    00000000: 00 00 00 10 04 00 00 00 0a 00 01 00 03 00 01 00
    00000010: 00 00 00 07 d0
  UrbLink              = 00000000
[426450 ms] UsbSnoop - MyInternalIOCTLCompletion(f8917db0) : fido=81b964f0, Irp=822f0008, Context=822ef3d8, IRQL=2
[426450 ms]  <<<  URB 411 coming back  <<< 
-- URB_FUNCTION_BULK_OR_INTERRUPT_TRANSFER:
  PipeHandle           = 82300f14 [endpoint 0x00000002]
  TransferFlags        = 00000000 (USBD_TRANSFER_DIRECTION_OUT, ~USBD_SHORT_TRANSFER_OK)
  TransferBufferLength = 00000015
  TransferBuffer       = 00000000
  TransferBufferMDL    = 81c35f88
  UrbLink              = 00000000
[426459 ms] UsbSnoop - DispatchAny(f8916610) : IRP_MJ_INTERNAL_DEVICE_CONTROL
[426459 ms] UsbSnoop - MyDispatchInternalIOCTL(f8917e80) : fdo=822eee08, Irp=81ab2e48, IRQL=2
[426459 ms]  >>>  URB 412 going down  >>> 
-- URB_FUNCTION_BULK_OR_INTERRUPT_TRANSFER:
  PipeHandle           = 82300ef4 [endpoint 0x00000081]
  TransferFlags        = 00000003 (USBD_TRANSFER_DIRECTION_IN, USBD_SHORT_TRANSFER_OK)
  TransferBufferLength = 00000100
  TransferBuffer       = 00000000
  TransferBufferMDL    = 81cacbd8
  UrbLink              = 00000000
[426459 ms] UsbSnoop - MyInternalIOCTLCompletion(f8917db0) : fido=81b964f0, Irp=81ab2e48, Context=81acbac0, IRQL=2
[426459 ms]  <<<  URB 412 coming back  <<< 
-- URB_FUNCTION_BULK_OR_INTERRUPT_TRANSFER:
  PipeHandle           = 82300ef4 [endpoint 0x00000081]
  TransferFlags        = 00000003 (USBD_TRANSFER_DIRECTION_IN, USBD_SHORT_TRANSFER_OK)
  TransferBufferLength = 00000007
  TransferBuffer       = 00000000
  TransferBufferMDL    = 81cacbd8
    00000000: 00 00 00 02 05 e0 00
  UrbLink              = 00000000
[426499 ms] UsbSnoop - DispatchAny(f8916610) : IRP_MJ_INTERNAL_DEVICE_CONTROL
[426499 ms] UsbSnoop - MyDispatchInternalIOCTL(f8917e80) : fdo=822eee08, Irp=81ab2e48, IRQL=2
[426499 ms]  >>>  URB 413 going down  >>> 
-- URB_FUNCTION_BULK_OR_INTERRUPT_TRANSFER:
  PipeHandle           = 82300ef4 [endpoint 0x00000081]
  TransferFlags        = 00000003 (USBD_TRANSFER_DIRECTION_IN, USBD_SHORT_TRANSFER_OK)
  TransferBufferLength = 00000100
  TransferBuffer       = 00000000
  TransferBufferMDL    = 81cacbd8
  UrbLink              = 00000000
[426500 ms] UsbSnoop - MyInternalIOCTLCompletion(f8917db0) : fido=81b964f0, Irp=81ab2e48, Context=81c49750, IRQL=2
[426500 ms]  <<<  URB 413 coming back  <<< 
-- URB_FUNCTION_BULK_OR_INTERRUPT_TRANSFER:
  PipeHandle           = 82300ef4 [endpoint 0x00000081]
  TransferFlags        = 00000003 (USBD_TRANSFER_DIRECTION_IN, USBD_SHORT_TRANSFER_OK)
  TransferBufferLength = 00000005
  TransferBuffer       = 00000000
  TransferBufferMDL    = 81cacbd8
    00000000: 00 00 00 0a 04
  UrbLink              = 00000000
[426529 ms] UsbSnoop - DispatchAny(f8916610) : IRP_MJ_INTERNAL_DEVICE_CONTROL
[426529 ms] UsbSnoop - MyDispatchInternalIOCTL(f8917e80) : fdo=822eee08, Irp=81b228c8, IRQL=2
[426529 ms]  >>>  URB 414 going down  >>> 
-- URB_FUNCTION_BULK_OR_INTERRUPT_TRANSFER:
  PipeHandle           = 82300ef4 [endpoint 0x00000081]
  TransferFlags        = 00000003 (USBD_TRANSFER_DIRECTION_IN, USBD_SHORT_TRANSFER_OK)
  TransferBufferLength = 00000100
  TransferBuffer       = 00000000
  TransferBufferMDL    = 81cacbd8
  UrbLink              = 00000000
[426530 ms] UsbSnoop - MyInternalIOCTLCompletion(f8917db0) : fido=81b964f0, Irp=81b228c8, Context=81b06608, IRQL=2
[426530 ms]  <<<  URB 414 coming back  <<< 
-- URB_FUNCTION_BULK_OR_INTERRUPT_TRANSFER:
  PipeHandle           = 82300ef4 [endpoint 0x00000081]
  TransferFlags        = 00000003 (USBD_TRANSFER_DIRECTION_IN, USBD_SHORT_TRANSFER_OK)
  TransferBufferLength = 0000000a
  TransferBuffer       = 00000000
  TransferBufferMDL    = 81cacbd8
    00000000: 00 00 00 04 00 12 00 00 07 d0
  UrbLink              = 00000000
[426561 ms] UsbSnoop - DispatchAny(f8916610) : IRP_MJ_INTERNAL_DEVICE_CONTROL
[426561 ms] UsbSnoop - MyDispatchInternalIOCTL(f8917e80) : fdo=822eee08, Irp=81b228c8, IRQL=2
[426561 ms]  >>>  URB 415 going down  >>> 
-- URB_FUNCTION_BULK_OR_INTERRUPT_TRANSFER:
  PipeHandle           = 82300f14 [endpoint 0x00000002]
  TransferFlags        = 00000000 (USBD_TRANSFER_DIRECTION_OUT, ~USBD_SHORT_TRANSFER_OK)
  TransferBufferLength = 00000007
  TransferBuffer       = 00000000
  TransferBufferMDL    = 81cacbd8
    00000000: 00 00 00 02 05 e0 00
  UrbLink              = 00000000
[426561 ms] UsbSnoop - MyInternalIOCTLCompletion(f8917db0) : fido=81b964f0, Irp=81b228c8, Context=81acbac0, IRQL=2
[426561 ms]  <<<  URB 415 coming back  <<< 
-- URB_FUNCTION_BULK_OR_INTERRUPT_TRANSFER:
  PipeHandle           = 82300f14 [endpoint 0x00000002]
  TransferFlags        = 00000000 (USBD_TRANSFER_DIRECTION_OUT, ~USBD_SHORT_TRANSFER_OK)
  TransferBufferLength = 00000007
  TransferBuffer       = 00000000
  TransferBufferMDL    = 81cacbd8
  UrbLink              = 00000000
[426569 ms] UsbSnoop - DispatchAny(f8916610) : IRP_MJ_INTERNAL_DEVICE_CONTROL
[426569 ms] UsbSnoop - MyDispatchInternalIOCTL(f8917e80) : fdo=822eee08, Irp=81b228c8, IRQL=2
[426570 ms]  >>>  URB 416 going down  >>> 
-- URB_FUNCTION_BULK_OR_INTERRUPT_TRANSFER:
  PipeHandle           = 82300f14 [endpoint 0x00000002]
  TransferFlags        = 00000000 (USBD_TRANSFER_DIRECTION_OUT, ~USBD_SHORT_TRANSFER_OK)
  TransferBufferLength = 00000010
  TransferBuffer       = 00000000
  TransferBufferMDL    = 81cacbd8
    00000000: 00 00 00 0b 04 00 00 00 05 00 0e 00 37 00 01 01
  UrbLink              = 00000000
[426570 ms] UsbSnoop - MyInternalIOCTLCompletion(f8917db0) : fido=81b964f0, Irp=81b228c8, Context=81b06608, IRQL=2
[426570 ms]  <<<  URB 416 coming back  <<< 
-- URB_FUNCTION_BULK_OR_INTERRUPT_TRANSFER:
  PipeHandle           = 82300f14 [endpoint 0x00000002]
  TransferFlags        = 00000000 (USBD_TRANSFER_DIRECTION_OUT, ~USBD_SHORT_TRANSFER_OK)
  TransferBufferLength = 00000010
  TransferBuffer       = 00000000
  TransferBufferMDL    = 81cacbd8
  UrbLink              = 00000000
[426579 ms] UsbSnoop - DispatchAny(f8916610) : IRP_MJ_INTERNAL_DEVICE_CONTROL
[426579 ms] UsbSnoop - MyDispatchInternalIOCTL(f8917e80) : fdo=822eee08, Irp=81b228c8, IRQL=2
[426579 ms]  >>>  URB 417 going down  >>> 
-- URB_FUNCTION_BULK_OR_INTERRUPT_TRANSFER:
  PipeHandle           = 82300ef4 [endpoint 0x00000081]
  TransferFlags        = 00000003 (USBD_TRANSFER_DIRECTION_IN, USBD_SHORT_TRANSFER_OK)
  TransferBufferLength = 00000100
  TransferBuffer       = 00000000
  TransferBufferMDL    = 81cacbd8
  UrbLink              = 00000000
[426580 ms] UsbSnoop - MyInternalIOCTLCompletion(f8917db0) : fido=81b964f0, Irp=81b228c8, Context=81aba700, IRQL=2
[426580 ms]  <<<  URB 417 coming back  <<< 
-- URB_FUNCTION_BULK_OR_INTERRUPT_TRANSFER:
  PipeHandle           = 82300ef4 [endpoint 0x00000081]
  TransferFlags        = 00000003 (USBD_TRANSFER_DIRECTION_IN, USBD_SHORT_TRANSFER_OK)
  TransferBufferLength = 00000007
  TransferBuffer       = 00000000
  TransferBufferMDL    = 81cacbd8
    00000000: 00 00 00 02 05 e0 00
  UrbLink              = 00000000
[426620 ms] UsbSnoop - DispatchAny(f8916610) : IRP_MJ_INTERNAL_DEVICE_CONTROL
[426620 ms] UsbSnoop - MyDispatchInternalIOCTL(f8917e80) : fdo=822eee08, Irp=81b228c8, IRQL=2
[426620 ms]  >>>  URB 418 going down  >>> 
-- URB_FUNCTION_BULK_OR_INTERRUPT_TRANSFER:
  PipeHandle           = 82300ef4 [endpoint 0x00000081]
  TransferFlags        = 00000003 (USBD_TRANSFER_DIRECTION_IN, USBD_SHORT_TRANSFER_OK)
  TransferBufferLength = 00000100
  TransferBuffer       = 00000000
  TransferBufferMDL    = 81cacbd8
  UrbLink              = 00000000
[426620 ms] UsbSnoop - MyInternalIOCTLCompletion(f8917db0) : fido=81b964f0, Irp=81b228c8, Context=81d30f40, IRQL=2
[426620 ms]  <<<  URB 418 coming back  <<< 
-- URB_FUNCTION_BULK_OR_INTERRUPT_TRANSFER:
  PipeHandle           = 82300ef4 [endpoint 0x00000081]
  TransferFlags        = 00000003 (USBD_TRANSFER_DIRECTION_IN, USBD_SHORT_TRANSFER_OK)
  TransferBufferLength = 00000005
  TransferBuffer       = 00000000
  TransferBufferMDL    = 81cacbd8
    00000000: 00 00 00 07 04
  UrbLink              = 00000000
[426650 ms] UsbSnoop - DispatchAny(f8916610) : IRP_MJ_INTERNAL_DEVICE_CONTROL
[426650 ms] UsbSnoop - MyDispatchInternalIOCTL(f8917e80) : fdo=822eee08, Irp=81b228c8, IRQL=2
[426650 ms]  >>>  URB 419 going down  >>> 
-- URB_FUNCTION_BULK_OR_INTERRUPT_TRANSFER:
  PipeHandle           = 82300ef4 [endpoint 0x00000081]
  TransferFlags        = 00000003 (USBD_TRANSFER_DIRECTION_IN, USBD_SHORT_TRANSFER_OK)
  TransferBufferLength = 00000100
  TransferBuffer       = 00000000
  TransferBufferMDL    = 81cacbd8
  UrbLink              = 00000000
[426650 ms] UsbSnoop - MyInternalIOCTLCompletion(f8917db0) : fido=81b964f0, Irp=81b228c8, Context=81c49750, IRQL=2
[426650 ms]  <<<  URB 419 coming back  <<< 
-- URB_FUNCTION_BULK_OR_INTERRUPT_TRANSFER:
  PipeHandle           = 82300ef4 [endpoint 0x00000081]
  TransferFlags        = 00000003 (USBD_TRANSFER_DIRECTION_IN, USBD_SHORT_TRANSFER_OK)
  TransferBufferLength = 00000007
  TransferBuffer       = 00000000
  TransferBufferMDL    = 81cacbd8
    00000000: 00 00 00 01 aa 00 01
  UrbLink              = 00000000
[426680 ms] UsbSnoop - DispatchAny(f8916610) : IRP_MJ_INTERNAL_DEVICE_CONTROL
[426680 ms] UsbSnoop - MyDispatchInternalIOCTL(f8917e80) : fdo=822eee08, Irp=81b228c8, IRQL=2
[426680 ms]  >>>  URB 420 going down  >>> 
-- URB_FUNCTION_BULK_OR_INTERRUPT_TRANSFER:
  PipeHandle           = 82300f14 [endpoint 0x00000002]
  TransferFlags        = 00000000 (USBD_TRANSFER_DIRECTION_OUT, ~USBD_SHORT_TRANSFER_OK)
  TransferBufferLength = 00000007
  TransferBuffer       = 00000000
  TransferBufferMDL    = 81cacbd8
    00000000: 00 00 00 02 05 e0 00
  UrbLink              = 00000000
[426680 ms] UsbSnoop - MyInternalIOCTLCompletion(f8917db0) : fido=81b964f0, Irp=81b228c8, Context=81acbac0, IRQL=2
[426680 ms]  <<<  URB 420 coming back  <<< 
-- URB_FUNCTION_BULK_OR_INTERRUPT_TRANSFER:
  PipeHandle           = 82300f14 [endpoint 0x00000002]
  TransferFlags        = 00000000 (USBD_TRANSFER_DIRECTION_OUT, ~USBD_SHORT_TRANSFER_OK)
  TransferBufferLength = 00000007
  TransferBuffer       = 00000000
  TransferBufferMDL    = 81cacbd8
  UrbLink              = 00000000
[426940 ms] UsbSnoop - DispatchAny(f8916610) : IRP_MJ_INTERNAL_DEVICE_CONTROL
[426940 ms] UsbSnoop - MyDispatchInternalIOCTL(f8917e80) : fdo=822eee08, Irp=81b228c8, IRQL=2
[426940 ms]  >>>  URB 421 going down  >>> 
-- URB_FUNCTION_BULK_OR_INTERRUPT_TRANSFER:
  PipeHandle           = 82300f14 [endpoint 0x00000002]
  TransferFlags        = 00000000 (USBD_TRANSFER_DIRECTION_OUT, ~USBD_SHORT_TRANSFER_OK)
  TransferBufferLength = 00000009
  TransferBuffer       = 00000000
  TransferBufferMDL    = 81cacbd8
    00000000: 00 00 00 04 01 00 00 04 00
  UrbLink              = 00000000
[426941 ms] UsbSnoop - MyInternalIOCTLCompletion(f8917db0) : fido=81b964f0, Irp=81b228c8, Context=81b06608, IRQL=2
[426941 ms]  <<<  URB 421 coming back  <<< 
-- URB_FUNCTION_BULK_OR_INTERRUPT_TRANSFER:
  PipeHandle           = 82300f14 [endpoint 0x00000002]
  TransferFlags        = 00000000 (USBD_TRANSFER_DIRECTION_OUT, ~USBD_SHORT_TRANSFER_OK)
  TransferBufferLength = 00000009
  TransferBuffer       = 00000000
  TransferBufferMDL    = 81cacbd8
  UrbLink              = 00000000
[426942 ms] UsbSnoop - DispatchAny(f8916610) : IRP_MJ_INTERNAL_DEVICE_CONTROL
[426942 ms] UsbSnoop - MyDispatchInternalIOCTL(f8917e80) : fdo=822eee08, Irp=81b228c8, IRQL=2
[426942 ms]  >>>  URB 422 going down  >>> 
-- URB_FUNCTION_BULK_OR_INTERRUPT_TRANSFER:
  PipeHandle           = 82300ef4 [endpoint 0x00000081]
  TransferFlags        = 00000003 (USBD_TRANSFER_DIRECTION_IN, USBD_SHORT_TRANSFER_OK)
  TransferBufferLength = 00000100
  TransferBuffer       = 00000000
  TransferBufferMDL    = 81cacbd8
  UrbLink              = 00000000
[426943 ms] UsbSnoop - MyInternalIOCTLCompletion(f8917db0) : fido=81b964f0, Irp=81b228c8, Context=81be7968, IRQL=2
[426943 ms]  <<<  URB 422 coming back  <<< 
-- URB_FUNCTION_BULK_OR_INTERRUPT_TRANSFER:
  PipeHandle           = 82300ef4 [endpoint 0x00000081]
  TransferFlags        = 00000003 (USBD_TRANSFER_DIRECTION_IN, USBD_SHORT_TRANSFER_OK)
  TransferBufferLength = 00000009
  TransferBuffer       = 00000000
  TransferBufferMDL    = 81cacbd8
    00000000: 00 00 00 04 02 00 00 03 ff
  UrbLink              = 00000000
[426970 ms] UsbSnoop - DispatchAny(f8916610) : IRP_MJ_INTERNAL_DEVICE_CONTROL
[426970 ms] UsbSnoop - MyDispatchInternalIOCTL(f8917e80) : fdo=822eee08, Irp=81b228c8, IRQL=2
[426970 ms]  >>>  URB 423 going down  >>> 
-- URB_FUNCTION_BULK_OR_INTERRUPT_TRANSFER:
  PipeHandle           = 82300f14 [endpoint 0x00000002]
  TransferFlags        = 00000000 (USBD_TRANSFER_DIRECTION_OUT, ~USBD_SHORT_TRANSFER_OK)
  TransferBufferLength = 00000015
  TransferBuffer       = 00000000
  TransferBufferMDL    = 81cacbd8
    00000000: 00 00 00 10 04 00 00 00 0a 00 01 00 03 00 01 00
    00000010: 00 00 00 07 d0
  UrbLink              = 00000000
[426970 ms] UsbSnoop - MyInternalIOCTLCompletion(f8917db0) : fido=81b964f0, Irp=81b228c8, Context=81c49750, IRQL=2
[426970 ms]  <<<  URB 423 coming back  <<< 
-- URB_FUNCTION_BULK_OR_INTERRUPT_TRANSFER:
  PipeHandle           = 82300f14 [endpoint 0x00000002]
  TransferFlags        = 00000000 (USBD_TRANSFER_DIRECTION_OUT, ~USBD_SHORT_TRANSFER_OK)
  TransferBufferLength = 00000015
  TransferBuffer       = 00000000
  TransferBufferMDL    = 81cacbd8
  UrbLink              = 00000000
[426980 ms] UsbSnoop - DispatchAny(f8916610) : IRP_MJ_INTERNAL_DEVICE_CONTROL
[426980 ms] UsbSnoop - MyDispatchInternalIOCTL(f8917e80) : fdo=822eee08, Irp=81b228c8, IRQL=2
[426980 ms]  >>>  URB 424 going down  >>> 
-- URB_FUNCTION_BULK_OR_INTERRUPT_TRANSFER:
  PipeHandle           = 82300ef4 [endpoint 0x00000081]
  TransferFlags        = 00000003 (USBD_TRANSFER_DIRECTION_IN, USBD_SHORT_TRANSFER_OK)
  TransferBufferLength = 00000100
  TransferBuffer       = 00000000
  TransferBufferMDL    = 81cacbd8
  UrbLink              = 00000000
[426980 ms] UsbSnoop - MyInternalIOCTLCompletion(f8917db0) : fido=81b964f0, Irp=81b228c8, Context=81be7968, IRQL=2
[426980 ms]  <<<  URB 424 coming back  <<< 
-- URB_FUNCTION_BULK_OR_INTERRUPT_TRANSFER:
  PipeHandle           = 82300ef4 [endpoint 0x00000081]
  TransferFlags        = 00000003 (USBD_TRANSFER_DIRECTION_IN, USBD_SHORT_TRANSFER_OK)
  TransferBufferLength = 00000007
  TransferBuffer       = 00000000
  TransferBufferMDL    = 81cacbd8
    00000000: 00 00 00 02 05 e0 00
  UrbLink              = 00000000
[427020 ms] UsbSnoop - DispatchAny(f8916610) : IRP_MJ_INTERNAL_DEVICE_CONTROL
[427020 ms] UsbSnoop - MyDispatchInternalIOCTL(f8917e80) : fdo=822eee08, Irp=81b228c8, IRQL=2
[427020 ms]  >>>  URB 425 going down  >>> 
-- URB_FUNCTION_BULK_OR_INTERRUPT_TRANSFER:
  PipeHandle           = 82300ef4 [endpoint 0x00000081]
  TransferFlags        = 00000003 (USBD_TRANSFER_DIRECTION_IN, USBD_SHORT_TRANSFER_OK)
  TransferBufferLength = 00000100
  TransferBuffer       = 00000000
  TransferBufferMDL    = 81cacbd8
  UrbLink              = 00000000
[427020 ms] UsbSnoop - MyInternalIOCTLCompletion(f8917db0) : fido=81b964f0, Irp=81b228c8, Context=81acbac0, IRQL=2
[427020 ms]  <<<  URB 425 coming back  <<< 
-- URB_FUNCTION_BULK_OR_INTERRUPT_TRANSFER:
  PipeHandle           = 82300ef4 [endpoint 0x00000081]
  TransferFlags        = 00000003 (USBD_TRANSFER_DIRECTION_IN, USBD_SHORT_TRANSFER_OK)
  TransferBufferLength = 00000005
  TransferBuffer       = 00000000
  TransferBufferMDL    = 81cacbd8
    00000000: 00 00 00 0a 04
  UrbLink              = 00000000
[427050 ms] UsbSnoop - DispatchAny(f8916610) : IRP_MJ_INTERNAL_DEVICE_CONTROL
[427050 ms] UsbSnoop - MyDispatchInternalIOCTL(f8917e80) : fdo=822eee08, Irp=81b228c8, IRQL=2
[427050 ms]  >>>  URB 426 going down  >>> 
-- URB_FUNCTION_BULK_OR_INTERRUPT_TRANSFER:
  PipeHandle           = 82300ef4 [endpoint 0x00000081]
  TransferFlags        = 00000003 (USBD_TRANSFER_DIRECTION_IN, USBD_SHORT_TRANSFER_OK)
  TransferBufferLength = 00000100
  TransferBuffer       = 00000000
  TransferBufferMDL    = 81cacbd8
  UrbLink              = 00000000
[427050 ms] UsbSnoop - MyInternalIOCTLCompletion(f8917db0) : fido=81b964f0, Irp=81b228c8, Context=81c49750, IRQL=2
[427050 ms]  <<<  URB 426 coming back  <<< 
-- URB_FUNCTION_BULK_OR_INTERRUPT_TRANSFER:
  PipeHandle           = 82300ef4 [endpoint 0x00000081]
  TransferFlags        = 00000003 (USBD_TRANSFER_DIRECTION_IN, USBD_SHORT_TRANSFER_OK)
  TransferBufferLength = 0000000a
  TransferBuffer       = 00000000
  TransferBufferMDL    = 81cacbd8
    00000000: 00 00 00 04 00 12 00 00 07 d0
  UrbLink              = 00000000
[427080 ms] UsbSnoop - DispatchAny(f8916610) : IRP_MJ_INTERNAL_DEVICE_CONTROL
[427080 ms] UsbSnoop - MyDispatchInternalIOCTL(f8917e80) : fdo=822eee08, Irp=81b228c8, IRQL=2
[427080 ms]  >>>  URB 427 going down  >>> 
-- URB_FUNCTION_BULK_OR_INTERRUPT_TRANSFER:
  PipeHandle           = 82300f14 [endpoint 0x00000002]
  TransferFlags        = 00000000 (USBD_TRANSFER_DIRECTION_OUT, ~USBD_SHORT_TRANSFER_OK)
  TransferBufferLength = 00000007
  TransferBuffer       = 00000000
  TransferBufferMDL    = 81cacbd8
    00000000: 00 00 00 02 05 e0 00
  UrbLink              = 00000000
[427080 ms] UsbSnoop - MyInternalIOCTLCompletion(f8917db0) : fido=81b964f0, Irp=81b228c8, Context=81acbac0, IRQL=2
[427080 ms]  <<<  URB 427 coming back  <<< 
-- URB_FUNCTION_BULK_OR_INTERRUPT_TRANSFER:
  PipeHandle           = 82300f14 [endpoint 0x00000002]
  TransferFlags        = 00000000 (USBD_TRANSFER_DIRECTION_OUT, ~USBD_SHORT_TRANSFER_OK)
  TransferBufferLength = 00000007
  TransferBuffer       = 00000000
  TransferBufferMDL    = 81cacbd8
  UrbLink              = 00000000
[427090 ms] UsbSnoop - DispatchAny(f8916610) : IRP_MJ_INTERNAL_DEVICE_CONTROL
[427090 ms] UsbSnoop - MyDispatchInternalIOCTL(f8917e80) : fdo=822eee08, Irp=81b228c8, IRQL=2
[427090 ms]  >>>  URB 428 going down  >>> 
-- URB_FUNCTION_BULK_OR_INTERRUPT_TRANSFER:
  PipeHandle           = 82300f14 [endpoint 0x00000002]
  TransferFlags        = 00000000 (USBD_TRANSFER_DIRECTION_OUT, ~USBD_SHORT_TRANSFER_OK)
  TransferBufferLength = 00000035
  TransferBuffer       = 00000000
  TransferBufferMDL    = 81cacbd8
    00000000: 00 00 00 30 04 00 00 00 2a 00 0b 04 6d 61 69 6e
    00000010: 00 01 79 00 00 00 00 05 01 00 04 00 02 00 04 f0
    00000020: 0c 00 00 00 03 00 01 00 00 08 00 04 00 00 00 00
    00000030: 00 41 00 01 01
  UrbLink              = 00000000
[427090 ms] UsbSnoop - MyInternalIOCTLCompletion(f8917db0) : fido=81b964f0, Irp=81b228c8, Context=81be7968, IRQL=2
[427090 ms]  <<<  URB 428 coming back  <<< 
-- URB_FUNCTION_BULK_OR_INTERRUPT_TRANSFER:
  PipeHandle           = 82300f14 [endpoint 0x00000002]
  TransferFlags        = 00000000 (USBD_TRANSFER_DIRECTION_OUT, ~USBD_SHORT_TRANSFER_OK)
  TransferBufferLength = 00000035
  TransferBuffer       = 00000000
  TransferBufferMDL    = 81cacbd8
  UrbLink              = 00000000
[427100 ms] UsbSnoop - DispatchAny(f8916610) : IRP_MJ_INTERNAL_DEVICE_CONTROL
[427100 ms] UsbSnoop - MyDispatchInternalIOCTL(f8917e80) : fdo=822eee08, Irp=81b228c8, IRQL=2
[427100 ms]  >>>  URB 429 going down  >>> 
-- URB_FUNCTION_BULK_OR_INTERRUPT_TRANSFER:
  PipeHandle           = 82300ef4 [endpoint 0x00000081]
  TransferFlags        = 00000003 (USBD_TRANSFER_DIRECTION_IN, USBD_SHORT_TRANSFER_OK)
  TransferBufferLength = 00000100
  TransferBuffer       = 00000000
  TransferBufferMDL    = 81cacbd8
  UrbLink              = 00000000
[427100 ms] UsbSnoop - MyInternalIOCTLCompletion(f8917db0) : fido=81b964f0, Irp=81b228c8, Context=81acbac0, IRQL=2
[427100 ms]  <<<  URB 429 coming back  <<< 
-- URB_FUNCTION_BULK_OR_INTERRUPT_TRANSFER:
  PipeHandle           = 82300ef4 [endpoint 0x00000081]
  TransferFlags        = 00000003 (USBD_TRANSFER_DIRECTION_IN, USBD_SHORT_TRANSFER_OK)
  TransferBufferLength = 00000007
  TransferBuffer       = 00000000
  TransferBufferMDL    = 81cacbd8
    00000000: 00 00 00 02 05 e0 00
  UrbLink              = 00000000
[427140 ms] UsbSnoop - DispatchAny(f8916610) : IRP_MJ_INTERNAL_DEVICE_CONTROL
[427140 ms] UsbSnoop - MyDispatchInternalIOCTL(f8917e80) : fdo=822eee08, Irp=81b228c8, IRQL=2
[427140 ms]  >>>  URB 430 going down  >>> 
-- URB_FUNCTION_BULK_OR_INTERRUPT_TRANSFER:
  PipeHandle           = 82300ef4 [endpoint 0x00000081]
  TransferFlags        = 00000003 (USBD_TRANSFER_DIRECTION_IN, USBD_SHORT_TRANSFER_OK)
  TransferBufferLength = 00000100
  TransferBuffer       = 00000000
  TransferBufferMDL    = 81cacbd8
  UrbLink              = 00000000
[427141 ms] UsbSnoop - MyInternalIOCTLCompletion(f8917db0) : fido=81b964f0, Irp=81b228c8, Context=822ef3d8, IRQL=2
[427141 ms]  <<<  URB 430 coming back  <<< 
-- URB_FUNCTION_BULK_OR_INTERRUPT_TRANSFER:
  PipeHandle           = 82300ef4 [endpoint 0x00000081]
  TransferFlags        = 00000003 (USBD_TRANSFER_DIRECTION_IN, USBD_SHORT_TRANSFER_OK)
  TransferBufferLength = 00000005
  TransferBuffer       = 00000000
  TransferBufferMDL    = 81cacbd8
    00000000: 00 00 00 07 04
  UrbLink              = 00000000
[427171 ms] UsbSnoop - DispatchAny(f8916610) : IRP_MJ_INTERNAL_DEVICE_CONTROL
[427171 ms] UsbSnoop - MyDispatchInternalIOCTL(f8917e80) : fdo=822eee08, Irp=81b228c8, IRQL=2
[427171 ms]  >>>  URB 431 going down  >>> 
-- URB_FUNCTION_BULK_OR_INTERRUPT_TRANSFER:
  PipeHandle           = 82300ef4 [endpoint 0x00000081]
  TransferFlags        = 00000003 (USBD_TRANSFER_DIRECTION_IN, USBD_SHORT_TRANSFER_OK)
  TransferBufferLength = 00000100
  TransferBuffer       = 00000000
  TransferBufferMDL    = 81cacbd8
  UrbLink              = 00000000
[427171 ms] UsbSnoop - MyInternalIOCTLCompletion(f8917db0) : fido=81b964f0, Irp=81b228c8, Context=81b6eb58, IRQL=2
[427171 ms]  <<<  URB 431 coming back  <<< 
-- URB_FUNCTION_BULK_OR_INTERRUPT_TRANSFER:
  PipeHandle           = 82300ef4 [endpoint 0x00000081]
  TransferFlags        = 00000003 (USBD_TRANSFER_DIRECTION_IN, USBD_SHORT_TRANSFER_OK)
  TransferBufferLength = 00000007
  TransferBuffer       = 00000000
  TransferBufferMDL    = 81cacbd8
    00000000: 00 00 00 01 aa 00 01
  UrbLink              = 00000000
[427200 ms] UsbSnoop - DispatchAny(f8916610) : IRP_MJ_INTERNAL_DEVICE_CONTROL
[427201 ms] UsbSnoop - MyDispatchInternalIOCTL(f8917e80) : fdo=822eee08, Irp=81b228c8, IRQL=2
[427201 ms]  >>>  URB 432 going down  >>> 
-- URB_FUNCTION_BULK_OR_INTERRUPT_TRANSFER:
  PipeHandle           = 82300f14 [endpoint 0x00000002]
  TransferFlags        = 00000000 (USBD_TRANSFER_DIRECTION_OUT, ~USBD_SHORT_TRANSFER_OK)
  TransferBufferLength = 00000007
  TransferBuffer       = 00000000
  TransferBufferMDL    = 81cacbd8
    00000000: 00 00 00 02 05 e0 00
  UrbLink              = 00000000
[427201 ms] UsbSnoop - MyInternalIOCTLCompletion(f8917db0) : fido=81b964f0, Irp=81b228c8, Context=81c49750, IRQL=2
[427201 ms]  <<<  URB 432 coming back  <<< 
-- URB_FUNCTION_BULK_OR_INTERRUPT_TRANSFER:
  PipeHandle           = 82300f14 [endpoint 0x00000002]
  TransferFlags        = 00000000 (USBD_TRANSFER_DIRECTION_OUT, ~USBD_SHORT_TRANSFER_OK)
  TransferBufferLength = 00000007
  TransferBuffer       = 00000000
  TransferBufferMDL    = 81cacbd8
  UrbLink              = 00000000
[427211 ms] UsbSnoop - DispatchAny(f8916610) : IRP_MJ_INTERNAL_DEVICE_CONTROL
[427211 ms] UsbSnoop - MyDispatchInternalIOCTL(f8917e80) : fdo=822eee08, Irp=81b228c8, IRQL=2
[427211 ms]  >>>  URB 433 going down  >>> 
-- URB_FUNCTION_BULK_OR_INTERRUPT_TRANSFER:
  PipeHandle           = 82300f14 [endpoint 0x00000002]
  TransferFlags        = 00000000 (USBD_TRANSFER_DIRECTION_OUT, ~USBD_SHORT_TRANSFER_OK)
  TransferBufferLength = 00000010
  TransferBuffer       = 00000000
  TransferBufferMDL    = 81cacbd8
    00000000: 00 00 00 0b 04 00 00 00 05 00 0d 00 03 02 01 1f
  UrbLink              = 00000000
[427211 ms] UsbSnoop - MyInternalIOCTLCompletion(f8917db0) : fido=81b964f0, Irp=81b228c8, Context=81be7968, IRQL=2
[427211 ms]  <<<  URB 433 coming back  <<< 
-- URB_FUNCTION_BULK_OR_INTERRUPT_TRANSFER:
  PipeHandle           = 82300f14 [endpoint 0x00000002]
  TransferFlags        = 00000000 (USBD_TRANSFER_DIRECTION_OUT, ~USBD_SHORT_TRANSFER_OK)
  TransferBufferLength = 00000010
  TransferBuffer       = 00000000
  TransferBufferMDL    = 81cacbd8
  UrbLink              = 00000000
[427220 ms] UsbSnoop - DispatchAny(f8916610) : IRP_MJ_INTERNAL_DEVICE_CONTROL
[427220 ms] UsbSnoop - MyDispatchInternalIOCTL(f8917e80) : fdo=822eee08, Irp=81b228c8, IRQL=2
[427221 ms]  >>>  URB 434 going down  >>> 
-- URB_FUNCTION_BULK_OR_INTERRUPT_TRANSFER:
  PipeHandle           = 82300ef4 [endpoint 0x00000081]
  TransferFlags        = 00000003 (USBD_TRANSFER_DIRECTION_IN, USBD_SHORT_TRANSFER_OK)
  TransferBufferLength = 00000100
  TransferBuffer       = 00000000
  TransferBufferMDL    = 81cacbd8
  UrbLink              = 00000000
[427221 ms] UsbSnoop - MyInternalIOCTLCompletion(f8917db0) : fido=81b964f0, Irp=81b228c8, Context=81acbac0, IRQL=2
[427221 ms]  <<<  URB 434 coming back  <<< 
-- URB_FUNCTION_BULK_OR_INTERRUPT_TRANSFER:
  PipeHandle           = 82300ef4 [endpoint 0x00000081]
  TransferFlags        = 00000003 (USBD_TRANSFER_DIRECTION_IN, USBD_SHORT_TRANSFER_OK)
  TransferBufferLength = 00000007
  TransferBuffer       = 00000000
  TransferBufferMDL    = 81cacbd8
    00000000: 00 00 00 02 05 e0 00
  UrbLink              = 00000000
[427261 ms] UsbSnoop - DispatchAny(f8916610) : IRP_MJ_INTERNAL_DEVICE_CONTROL
[427261 ms] UsbSnoop - MyDispatchInternalIOCTL(f8917e80) : fdo=822eee08, Irp=81b228c8, IRQL=2
[427261 ms]  >>>  URB 435 going down  >>> 
-- URB_FUNCTION_BULK_OR_INTERRUPT_TRANSFER:
  PipeHandle           = 82300ef4 [endpoint 0x00000081]
  TransferFlags        = 00000003 (USBD_TRANSFER_DIRECTION_IN, USBD_SHORT_TRANSFER_OK)
  TransferBufferLength = 00000100
  TransferBuffer       = 00000000
  TransferBufferMDL    = 81cacbd8
  UrbLink              = 00000000
[427261 ms] UsbSnoop - MyInternalIOCTLCompletion(f8917db0) : fido=81b964f0, Irp=81b228c8, Context=822ef3d8, IRQL=2
[427261 ms]  <<<  URB 435 coming back  <<< 
-- URB_FUNCTION_BULK_OR_INTERRUPT_TRANSFER:
  PipeHandle           = 82300ef4 [endpoint 0x00000081]
  TransferFlags        = 00000003 (USBD_TRANSFER_DIRECTION_IN, USBD_SHORT_TRANSFER_OK)
  TransferBufferLength = 00000005
  TransferBuffer       = 00000000
  TransferBufferMDL    = 81cacbd8
    00000000: 00 00 00 07 04
  UrbLink              = 00000000
[427291 ms] UsbSnoop - DispatchAny(f8916610) : IRP_MJ_INTERNAL_DEVICE_CONTROL
[427291 ms] UsbSnoop - MyDispatchInternalIOCTL(f8917e80) : fdo=822eee08, Irp=81b228c8, IRQL=2
[427291 ms]  >>>  URB 436 going down  >>> 
-- URB_FUNCTION_BULK_OR_INTERRUPT_TRANSFER:
  PipeHandle           = 82300ef4 [endpoint 0x00000081]
  TransferFlags        = 00000003 (USBD_TRANSFER_DIRECTION_IN, USBD_SHORT_TRANSFER_OK)
  TransferBufferLength = 00000100
  TransferBuffer       = 00000000
  TransferBufferMDL    = 81cacbd8
  UrbLink              = 00000000
[427291 ms] UsbSnoop - MyInternalIOCTLCompletion(f8917db0) : fido=81b964f0, Irp=81b228c8, Context=81b6eb58, IRQL=2
[427291 ms]  <<<  URB 436 coming back  <<< 
-- URB_FUNCTION_BULK_OR_INTERRUPT_TRANSFER:
  PipeHandle           = 82300ef4 [endpoint 0x00000081]
  TransferFlags        = 00000003 (USBD_TRANSFER_DIRECTION_IN, USBD_SHORT_TRANSFER_OK)
  TransferBufferLength = 00000007
  TransferBuffer       = 00000000
  TransferBufferMDL    = 81cacbd8
    00000000: 00 00 00 01 aa 00 01
  UrbLink              = 00000000
[427321 ms] UsbSnoop - DispatchAny(f8916610) : IRP_MJ_INTERNAL_DEVICE_CONTROL
[427321 ms] UsbSnoop - MyDispatchInternalIOCTL(f8917e80) : fdo=822eee08, Irp=81b228c8, IRQL=2
[427321 ms]  >>>  URB 437 going down  >>> 
-- URB_FUNCTION_BULK_OR_INTERRUPT_TRANSFER:
  PipeHandle           = 82300f14 [endpoint 0x00000002]
  TransferFlags        = 00000000 (USBD_TRANSFER_DIRECTION_OUT, ~USBD_SHORT_TRANSFER_OK)
  TransferBufferLength = 00000007
  TransferBuffer       = 00000000
  TransferBufferMDL    = 81cacbd8
    00000000: 00 00 00 02 05 e0 00
  UrbLink              = 00000000
[427321 ms] UsbSnoop - MyInternalIOCTLCompletion(f8917db0) : fido=81b964f0, Irp=81b228c8, Context=81c49750, IRQL=2
[427321 ms]  <<<  URB 437 coming back  <<< 
-- URB_FUNCTION_BULK_OR_INTERRUPT_TRANSFER:
  PipeHandle           = 82300f14 [endpoint 0x00000002]
  TransferFlags        = 00000000 (USBD_TRANSFER_DIRECTION_OUT, ~USBD_SHORT_TRANSFER_OK)
  TransferBufferLength = 00000007
  TransferBuffer       = 00000000
  TransferBufferMDL    = 81cacbd8
  UrbLink              = 00000000
[427331 ms] UsbSnoop - DispatchAny(f8916610) : IRP_MJ_INTERNAL_DEVICE_CONTROL
[427331 ms] UsbSnoop - MyDispatchInternalIOCTL(f8917e80) : fdo=822eee08, Irp=81b228c8, IRQL=2
[427331 ms]  >>>  URB 438 going down  >>> 
-- URB_FUNCTION_BULK_OR_INTERRUPT_TRANSFER:
  PipeHandle           = 82300f14 [endpoint 0x00000002]
  TransferFlags        = 00000000 (USBD_TRANSFER_DIRECTION_OUT, ~USBD_SHORT_TRANSFER_OK)
  TransferBufferLength = 0000000b
  TransferBuffer       = 00000000
  TransferBufferMDL    = 81cacbd8
    00000000: 00 00 00 06 04 00 00 00 00 dd 00
  UrbLink              = 00000000
[427331 ms] UsbSnoop - MyInternalIOCTLCompletion(f8917db0) : fido=81b964f0, Irp=81b228c8, Context=81be7968, IRQL=2
[427331 ms]  <<<  URB 438 coming back  <<< 
-- URB_FUNCTION_BULK_OR_INTERRUPT_TRANSFER:
  PipeHandle           = 82300f14 [endpoint 0x00000002]
  TransferFlags        = 00000000 (USBD_TRANSFER_DIRECTION_OUT, ~USBD_SHORT_TRANSFER_OK)
  TransferBufferLength = 0000000b
  TransferBuffer       = 00000000
  TransferBufferMDL    = 81cacbd8
  UrbLink              = 00000000
[427341 ms] UsbSnoop - DispatchAny(f8916610) : IRP_MJ_INTERNAL_DEVICE_CONTROL
[427341 ms] UsbSnoop - MyDispatchInternalIOCTL(f8917e80) : fdo=822eee08, Irp=81b228c8, IRQL=2
[427341 ms]  >>>  URB 439 going down  >>> 
-- URB_FUNCTION_BULK_OR_INTERRUPT_TRANSFER:
  PipeHandle           = 82300ef4 [endpoint 0x00000081]
  TransferFlags        = 00000003 (USBD_TRANSFER_DIRECTION_IN, USBD_SHORT_TRANSFER_OK)
  TransferBufferLength = 00000100
  TransferBuffer       = 00000000
  TransferBufferMDL    = 81cacbd8
  UrbLink              = 00000000
[427341 ms] UsbSnoop - MyInternalIOCTLCompletion(f8917db0) : fido=81b964f0, Irp=81b228c8, Context=81b6eb58, IRQL=2
[427341 ms]  <<<  URB 439 coming back  <<< 
-- URB_FUNCTION_BULK_OR_INTERRUPT_TRANSFER:
  PipeHandle           = 82300ef4 [endpoint 0x00000081]
  TransferFlags        = 00000003 (USBD_TRANSFER_DIRECTION_IN, USBD_SHORT_TRANSFER_OK)
  TransferBufferLength = 00000007
  TransferBuffer       = 00000000
  TransferBufferMDL    = 81cacbd8
    00000000: 00 00 00 02 05 e0 00
  UrbLink              = 00000000
[430386 ms] UsbSnoop - DispatchAny(f8916610) : IRP_MJ_INTERNAL_DEVICE_CONTROL
[430386 ms] UsbSnoop - MyDispatchInternalIOCTL(f8917e80) : fdo=822eee08, Irp=81abae48, IRQL=0
[430386 ms]  >>>  URB 440 going down  >>> 
-- URB_FUNCTION_RESET_PIPE:
  PipeHandle = 82300ef4 [endpoint 0x00000081]
[430386 ms] UsbSnoop - MyInternalIOCTLCompletion(f8917db0) : fido=00000000, Irp=81abae48, Context=81abee68, IRQL=0
[430386 ms]  <<<  URB 440 coming back  <<< 
-- URB_FUNCTION_RESET_PIPE:
[430386 ms] UsbSnoop - DispatchAny(f8916610) : IRP_MJ_INTERNAL_DEVICE_CONTROL
[430386 ms] UsbSnoop - MyDispatchInternalIOCTL(f8917e80) : fdo=822eee08, Irp=81abae48, IRQL=0
[430386 ms]  >>>  URB 441 going down  >>> 
-- URB_FUNCTION_RESET_PIPE:
  PipeHandle = 82300f14 [endpoint 0x00000002]
[430387 ms] UsbSnoop - MyInternalIOCTLCompletion(f8917db0) : fido=00000000, Irp=81abae48, Context=81aba700, IRQL=0
[430387 ms]  <<<  URB 441 coming back  <<< 
-- URB_FUNCTION_RESET_PIPE:
[430387 ms] UsbSnoop - DispatchAny(f8916610) : IRP_MJ_INTERNAL_DEVICE_CONTROL
[430387 ms] UsbSnoop - MyDispatchInternalIOCTL(f8917e80) : fdo=822eee08, Irp=81cae810, IRQL=0
[430596 ms] UsbSnoop - IRP_MJ_POWER (IRP_MN_WAIT_WAKE)
[430596 ms] UsbSnoop - DispatchAny(f8916610) : IRP_MJ_INTERNAL_DEVICE_CONTROL
[430596 ms] UsbSnoop - MyDispatchInternalIOCTL(f8917e80) : fdo=822eee08, Irp=821756b8, IRQL=0
[430596 ms]  >>>  URB 442 going down  >>> 
-- URB_FUNCTION_RESET_PIPE:
  PipeHandle = 82300ef4 [endpoint 0x00000081]
[430596 ms] UsbSnoop - MyInternalIOCTLCompletion(f8917db0) : fido=00000000, Irp=821756b8, Context=81aba700, IRQL=0
[430596 ms]  <<<  URB 442 coming back  <<< 
-- URB_FUNCTION_RESET_PIPE:
[430597 ms] UsbSnoop - DispatchAny(f8916610) : IRP_MJ_INTERNAL_DEVICE_CONTROL
[430597 ms] UsbSnoop - MyDispatchInternalIOCTL(f8917e80) : fdo=822eee08, Irp=821756b8, IRQL=0
[430597 ms]  >>>  URB 443 going down  >>> 
-- URB_FUNCTION_RESET_PIPE:
  PipeHandle = 82300f14 [endpoint 0x00000002]
[430597 ms] UsbSnoop - MyInternalIOCTLCompletion(f8917db0) : fido=00000000, Irp=821756b8, Context=81aef518, IRQL=0
[430597 ms]  <<<  URB 443 coming back  <<< 
-- URB_FUNCTION_RESET_PIPE:
[431597 ms] UsbSnoop - DispatchAny(f8916610) : IRP_MJ_INTERNAL_DEVICE_CONTROL
[431598 ms] UsbSnoop - MyDispatchInternalIOCTL(f8917e80) : fdo=822eee08, Irp=81b228c8, IRQL=0
[431598 ms]  >>>  URB 444 going down  >>> 
-- URB_FUNCTION_RESET_PIPE:
  PipeHandle = 82300ef4 [endpoint 0x00000081]
[431598 ms] UsbSnoop - MyInternalIOCTLCompletion(f8917db0) : fido=00000000, Irp=81b228c8, Context=81acbac0, IRQL=0
[431598 ms]  <<<  URB 444 coming back  <<< 
-- URB_FUNCTION_RESET_PIPE:
[431599 ms] UsbSnoop - DispatchAny(f8916610) : IRP_MJ_INTERNAL_DEVICE_CONTROL
[431599 ms] UsbSnoop - MyDispatchInternalIOCTL(f8917e80) : fdo=822eee08, Irp=81b228c8, IRQL=0
[431599 ms]  >>>  URB 445 going down  >>> 
-- URB_FUNCTION_RESET_PIPE:
  PipeHandle = 82300f14 [endpoint 0x00000002]
[431599 ms] UsbSnoop - MyInternalIOCTLCompletion(f8917db0) : fido=00000000, Irp=81b228c8, Context=81d30f40, IRQL=0
[431599 ms]  <<<  URB 445 coming back  <<< 
-- URB_FUNCTION_RESET_PIPE:
[431599 ms] UsbSnoop - DispatchAny(f8916610) : IRP_MJ_INTERNAL_DEVICE_CONTROL
[431599 ms] UsbSnoop - MyDispatchInternalIOCTL(f8917e80) : fdo=822eee08, Irp=81cae810, IRQL=0
[431599 ms] UsbSnoop - IRP_MJ_POWER (IRP_MN_WAIT_WAKE)
[432599 ms] UsbSnoop - DispatchAny(f8916610) : IRP_MJ_INTERNAL_DEVICE_CONTROL
[432599 ms] UsbSnoop - MyDispatchInternalIOCTL(f8917e80) : fdo=822eee08, Irp=81cae810, IRQL=0
[432599 ms]  >>>  URB 446 going down  >>> 
-- URB_FUNCTION_GET_DESCRIPTOR_FROM_DEVICE:
  TransferBufferLength = 00000012
  TransferBuffer       = e2705eb0
  TransferBufferMDL    = 00000000
  Index                = 00000000
  DescriptorType       = 00000001 (USB_DEVICE_DESCRIPTOR_TYPE)
  LanguageId           = 00000000
[432600 ms] UsbSnoop - MyInternalIOCTLCompletion(f8917db0) : fido=00000000, Irp=81cae810, Context=822ef3d8, IRQL=2
[432600 ms]  <<<  URB 446 coming back  <<< 
-- URB_FUNCTION_CONTROL_TRANSFER:
  PipeHandle           = 82149668
  TransferFlags        = 0000000b (USBD_TRANSFER_DIRECTION_IN, USBD_SHORT_TRANSFER_OK)
  TransferBufferLength = 00000012
  TransferBuffer       = e2705eb0
  TransferBufferMDL    = 81cacbd8
    00000000: 12 01 00 02 00 00 00 40 51 04 04 e0 00 03 01 02
    00000010: 00 01
  UrbLink              = 00000000
  SetupPacket          =
    00000000: 80 06 00 01 00 00 12 00
[432600 ms] UsbSnoop - DispatchAny(f8916610) : IRP_MJ_INTERNAL_DEVICE_CONTROL
[432600 ms] UsbSnoop - MyDispatchInternalIOCTL(f8917e80) : fdo=822eee08, Irp=822f0008, IRQL=0
[432600 ms] UsbSnoop - IRP_MJ_POWER (IRP_MN_WAIT_WAKE)
[432600 ms] UsbSnoop - DispatchAny(f8916610) : IRP_MJ_INTERNAL_DEVICE_CONTROL
[432600 ms] UsbSnoop - MyDispatchInternalIOCTL(f8917e80) : fdo=822eee08, Irp=81b228c8, IRQL=0
[432600 ms]  >>>  URB 447 going down  >>> 
-- URB_FUNCTION_RESET_PIPE:
  PipeHandle = 82300ef4 [endpoint 0x00000081]
[432601 ms] UsbSnoop - MyInternalIOCTLCompletion(f8917db0) : fido=00000000, Irp=81b228c8, Context=81ba8040, IRQL=0
[432601 ms]  <<<  URB 447 coming back  <<< 
-- URB_FUNCTION_RESET_PIPE:
[432601 ms] UsbSnoop - DispatchAny(f8916610) : IRP_MJ_INTERNAL_DEVICE_CONTROL
[432601 ms] UsbSnoop - MyDispatchInternalIOCTL(f8917e80) : fdo=822eee08, Irp=81b228c8, IRQL=0
[432601 ms]  >>>  URB 448 going down  >>> 
-- URB_FUNCTION_RESET_PIPE:
  PipeHandle = 82300f14 [endpoint 0x00000002]
[432601 ms] UsbSnoop - MyInternalIOCTLCompletion(f8917db0) : fido=00000000, Irp=81b228c8, Context=81ace670, IRQL=0
[432601 ms]  <<<  URB 448 coming back  <<< 
-- URB_FUNCTION_RESET_PIPE:
[433851 ms] UsbSnoop - DispatchAny(f8916610) : IRP_MJ_INTERNAL_DEVICE_CONTROL
[433851 ms] UsbSnoop - MyDispatchInternalIOCTL(f8917e80) : fdo=822eee08, Irp=821756b8, IRQL=2
[433851 ms]  >>>  URB 449 going down  >>> 
-- URB_FUNCTION_BULK_OR_INTERRUPT_TRANSFER:
  PipeHandle           = 82300f14 [endpoint 0x00000002]
  TransferFlags        = 00000000 (USBD_TRANSFER_DIRECTION_OUT, ~USBD_SHORT_TRANSFER_OK)
  TransferBufferLength = 00000009
  TransferBuffer       = 00000000
  TransferBufferMDL    = 81cacbd8
    00000000: 00 00 00 04 01 00 00 04 00
  UrbLink              = 00000000
[433851 ms] UsbSnoop - MyInternalIOCTLCompletion(f8917db0) : fido=81b964f0, Irp=821756b8, Context=81c49750, IRQL=2
[433851 ms]  <<<  URB 449 coming back  <<< 
-- URB_FUNCTION_BULK_OR_INTERRUPT_TRANSFER:
  PipeHandle           = 82300f14 [endpoint 0x00000002]
  TransferFlags        = 00000000 (USBD_TRANSFER_DIRECTION_OUT, ~USBD_SHORT_TRANSFER_OK)
  TransferBufferLength = 00000009
  TransferBuffer       = 00000000
  TransferBufferMDL    = 81cacbd8
  UrbLink              = 00000000
[433853 ms] UsbSnoop - DispatchAny(f8916610) : IRP_MJ_INTERNAL_DEVICE_CONTROL
[433853 ms] UsbSnoop - MyDispatchInternalIOCTL(f8917e80) : fdo=822eee08, Irp=821756b8, IRQL=2
[433853 ms]  >>>  URB 450 going down  >>> 
-- URB_FUNCTION_BULK_OR_INTERRUPT_TRANSFER:
  PipeHandle           = 82300ef4 [endpoint 0x00000081]
  TransferFlags        = 00000003 (USBD_TRANSFER_DIRECTION_IN, USBD_SHORT_TRANSFER_OK)
  TransferBufferLength = 00000100
  TransferBuffer       = 00000000
  TransferBufferMDL    = 81cacbd8
  UrbLink              = 00000000
[433853 ms] UsbSnoop - MyInternalIOCTLCompletion(f8917db0) : fido=81b964f0, Irp=821756b8, Context=81b6eb58, IRQL=2
[433853 ms]  <<<  URB 450 coming back  <<< 
-- URB_FUNCTION_BULK_OR_INTERRUPT_TRANSFER:
  PipeHandle           = 82300ef4 [endpoint 0x00000081]
  TransferFlags        = 00000003 (USBD_TRANSFER_DIRECTION_IN, USBD_SHORT_TRANSFER_OK)
  TransferBufferLength = 00000009
  TransferBuffer       = 00000000
  TransferBufferMDL    = 81cacbd8
    00000000: 00 00 00 04 02 00 00 03 ff
  UrbLink              = 00000000
[433881 ms] UsbSnoop - DispatchAny(f8916610) : IRP_MJ_INTERNAL_DEVICE_CONTROL
[433881 ms] UsbSnoop - MyDispatchInternalIOCTL(f8917e80) : fdo=822eee08, Irp=821756b8, IRQL=2
[433881 ms]  >>>  URB 451 going down  >>> 
-- URB_FUNCTION_BULK_OR_INTERRUPT_TRANSFER:
  PipeHandle           = 82300f14 [endpoint 0x00000002]
  TransferFlags        = 00000000 (USBD_TRANSFER_DIRECTION_OUT, ~USBD_SHORT_TRANSFER_OK)
  TransferBufferLength = 00000015
  TransferBuffer       = 00000000
  TransferBufferMDL    = 81cacbd8
    00000000: 00 00 00 10 04 00 00 00 0a 00 01 00 03 00 01 00
    00000010: 00 00 00 07 d0
  UrbLink              = 00000000
[433881 ms] UsbSnoop - MyInternalIOCTLCompletion(f8917db0) : fido=81b964f0, Irp=821756b8, Context=81b06608, IRQL=2
[433881 ms]  <<<  URB 451 coming back  <<< 
-- URB_FUNCTION_BULK_OR_INTERRUPT_TRANSFER:
  PipeHandle           = 82300f14 [endpoint 0x00000002]
  TransferFlags        = 00000000 (USBD_TRANSFER_DIRECTION_OUT, ~USBD_SHORT_TRANSFER_OK)
  TransferBufferLength = 00000015
  TransferBuffer       = 00000000
  TransferBufferMDL    = 81cacbd8
  UrbLink              = 00000000
[433892 ms] UsbSnoop - DispatchAny(f8916610) : IRP_MJ_INTERNAL_DEVICE_CONTROL
[433892 ms] UsbSnoop - MyDispatchInternalIOCTL(f8917e80) : fdo=822eee08, Irp=821756b8, IRQL=2
[433892 ms]  >>>  URB 452 going down  >>> 
-- URB_FUNCTION_BULK_OR_INTERRUPT_TRANSFER:
  PipeHandle           = 82300ef4 [endpoint 0x00000081]
  TransferFlags        = 00000003 (USBD_TRANSFER_DIRECTION_IN, USBD_SHORT_TRANSFER_OK)
  TransferBufferLength = 00000100
  TransferBuffer       = 00000000
  TransferBufferMDL    = 81cacbd8
  UrbLink              = 00000000
[433892 ms] UsbSnoop - MyInternalIOCTLCompletion(f8917db0) : fido=81b964f0, Irp=821756b8, Context=81c49750, IRQL=2
[433892 ms]  <<<  URB 452 coming back  <<< 
-- URB_FUNCTION_BULK_OR_INTERRUPT_TRANSFER:
  PipeHandle           = 82300ef4 [endpoint 0x00000081]
  TransferFlags        = 00000003 (USBD_TRANSFER_DIRECTION_IN, USBD_SHORT_TRANSFER_OK)
  TransferBufferLength = 00000007
  TransferBuffer       = 00000000
  TransferBufferMDL    = 81cacbd8
    00000000: 00 00 00 02 05 e0 00
  UrbLink              = 00000000
[433931 ms] UsbSnoop - DispatchAny(f8916610) : IRP_MJ_INTERNAL_DEVICE_CONTROL
[433931 ms] UsbSnoop - MyDispatchInternalIOCTL(f8917e80) : fdo=822eee08, Irp=821756b8, IRQL=2
[433931 ms]  >>>  URB 453 going down  >>> 
-- URB_FUNCTION_BULK_OR_INTERRUPT_TRANSFER:
  PipeHandle           = 82300ef4 [endpoint 0x00000081]
  TransferFlags        = 00000003 (USBD_TRANSFER_DIRECTION_IN, USBD_SHORT_TRANSFER_OK)
  TransferBufferLength = 00000100
  TransferBuffer       = 00000000
  TransferBufferMDL    = 81cacbd8
  UrbLink              = 00000000
[433931 ms] UsbSnoop - MyInternalIOCTLCompletion(f8917db0) : fido=81b964f0, Irp=821756b8, Context=81b06608, IRQL=2
[433931 ms]  <<<  URB 453 coming back  <<< 
-- URB_FUNCTION_BULK_OR_INTERRUPT_TRANSFER:
  PipeHandle           = 82300ef4 [endpoint 0x00000081]
  TransferFlags        = 00000003 (USBD_TRANSFER_DIRECTION_IN, USBD_SHORT_TRANSFER_OK)
  TransferBufferLength = 00000005
  TransferBuffer       = 00000000
  TransferBufferMDL    = 81cacbd8
    00000000: 00 00 00 0a 04
  UrbLink              = 00000000
[433961 ms] UsbSnoop - DispatchAny(f8916610) : IRP_MJ_INTERNAL_DEVICE_CONTROL
[433961 ms] UsbSnoop - MyDispatchInternalIOCTL(f8917e80) : fdo=822eee08, Irp=821756b8, IRQL=2
[433961 ms]  >>>  URB 454 going down  >>> 
-- URB_FUNCTION_BULK_OR_INTERRUPT_TRANSFER:
  PipeHandle           = 82300ef4 [endpoint 0x00000081]
  TransferFlags        = 00000003 (USBD_TRANSFER_DIRECTION_IN, USBD_SHORT_TRANSFER_OK)
  TransferBufferLength = 00000100
  TransferBuffer       = 00000000
  TransferBufferMDL    = 81cacbd8
  UrbLink              = 00000000
[433961 ms] UsbSnoop - MyInternalIOCTLCompletion(f8917db0) : fido=81b964f0, Irp=821756b8, Context=81acbac0, IRQL=2
[433961 ms]  <<<  URB 454 coming back  <<< 
-- URB_FUNCTION_BULK_OR_INTERRUPT_TRANSFER:
  PipeHandle           = 82300ef4 [endpoint 0x00000081]
  TransferFlags        = 00000003 (USBD_TRANSFER_DIRECTION_IN, USBD_SHORT_TRANSFER_OK)
  TransferBufferLength = 0000000a
  TransferBuffer       = 00000000
  TransferBufferMDL    = 81cacbd8
    00000000: 00 00 00 04 00 12 00 00 07 d0
  UrbLink              = 00000000
[433991 ms] UsbSnoop - DispatchAny(f8916610) : IRP_MJ_INTERNAL_DEVICE_CONTROL
[433991 ms] UsbSnoop - MyDispatchInternalIOCTL(f8917e80) : fdo=822eee08, Irp=821756b8, IRQL=2
[433991 ms]  >>>  URB 455 going down  >>> 
-- URB_FUNCTION_BULK_OR_INTERRUPT_TRANSFER:
  PipeHandle           = 82300f14 [endpoint 0x00000002]
  TransferFlags        = 00000000 (USBD_TRANSFER_DIRECTION_OUT, ~USBD_SHORT_TRANSFER_OK)
  TransferBufferLength = 00000007
  TransferBuffer       = 00000000
  TransferBufferMDL    = 81cacbd8
    00000000: 00 00 00 02 05 e0 00
  UrbLink              = 00000000
[433991 ms] UsbSnoop - MyInternalIOCTLCompletion(f8917db0) : fido=81b964f0, Irp=821756b8, Context=81b6eb58, IRQL=2
[433991 ms]  <<<  URB 455 coming back  <<< 
-- URB_FUNCTION_BULK_OR_INTERRUPT_TRANSFER:
  PipeHandle           = 82300f14 [endpoint 0x00000002]
  TransferFlags        = 00000000 (USBD_TRANSFER_DIRECTION_OUT, ~USBD_SHORT_TRANSFER_OK)
  TransferBufferLength = 00000007
  TransferBuffer       = 00000000
  TransferBufferMDL    = 81cacbd8
  UrbLink              = 00000000
[434001 ms] UsbSnoop - DispatchAny(f8916610) : IRP_MJ_INTERNAL_DEVICE_CONTROL
[434001 ms] UsbSnoop - MyDispatchInternalIOCTL(f8917e80) : fdo=822eee08, Irp=821756b8, IRQL=2
[434001 ms]  >>>  URB 456 going down  >>> 
-- URB_FUNCTION_BULK_OR_INTERRUPT_TRANSFER:
  PipeHandle           = 82300f14 [endpoint 0x00000002]
  TransferFlags        = 00000000 (USBD_TRANSFER_DIRECTION_OUT, ~USBD_SHORT_TRANSFER_OK)
  TransferBufferLength = 00000022
  TransferBuffer       = 00000000
  TransferBufferMDL    = 81cacbd8
    00000000: 00 00 00 1d 04 00 00 00 17 00 09 00 00 00 06 00
    00000010: 02 00 03 00 05 00 01 00 41 00 42 00 01 00 01 00
    00000020: 01 01
  UrbLink              = 00000000
[434002 ms] UsbSnoop - MyInternalIOCTLCompletion(f8917db0) : fido=81b964f0, Irp=821756b8, Context=81b06608, IRQL=2
[434002 ms]  <<<  URB 456 coming back  <<< 
-- URB_FUNCTION_BULK_OR_INTERRUPT_TRANSFER:
  PipeHandle           = 82300f14 [endpoint 0x00000002]
  TransferFlags        = 00000000 (USBD_TRANSFER_DIRECTION_OUT, ~USBD_SHORT_TRANSFER_OK)
  TransferBufferLength = 00000022
  TransferBuffer       = 00000000
  TransferBufferMDL    = 81cacbd8
  UrbLink              = 00000000
[434011 ms] UsbSnoop - DispatchAny(f8916610) : IRP_MJ_INTERNAL_DEVICE_CONTROL
[434011 ms] UsbSnoop - MyDispatchInternalIOCTL(f8917e80) : fdo=822eee08, Irp=821756b8, IRQL=2
[434011 ms]  >>>  URB 457 going down  >>> 
-- URB_FUNCTION_BULK_OR_INTERRUPT_TRANSFER:
  PipeHandle           = 82300ef4 [endpoint 0x00000081]
  TransferFlags        = 00000003 (USBD_TRANSFER_DIRECTION_IN, USBD_SHORT_TRANSFER_OK)
  TransferBufferLength = 00000100
  TransferBuffer       = 00000000
  TransferBufferMDL    = 81cacbd8
  UrbLink              = 00000000
[434012 ms] UsbSnoop - MyInternalIOCTLCompletion(f8917db0) : fido=81b964f0, Irp=821756b8, Context=81b6eb58, IRQL=2
[434012 ms]  <<<  URB 457 coming back  <<< 
-- URB_FUNCTION_BULK_OR_INTERRUPT_TRANSFER:
  PipeHandle           = 82300ef4 [endpoint 0x00000081]
  TransferFlags        = 00000003 (USBD_TRANSFER_DIRECTION_IN, USBD_SHORT_TRANSFER_OK)
  TransferBufferLength = 00000007
  TransferBuffer       = 00000000
  TransferBufferMDL    = 81cacbd8
    00000000: 00 00 00 02 05 e0 00
  UrbLink              = 00000000
[434051 ms] UsbSnoop - DispatchAny(f8916610) : IRP_MJ_INTERNAL_DEVICE_CONTROL
[434051 ms] UsbSnoop - MyDispatchInternalIOCTL(f8917e80) : fdo=822eee08, Irp=821756b8, IRQL=2
[434051 ms]  >>>  URB 458 going down  >>> 
-- URB_FUNCTION_BULK_OR_INTERRUPT_TRANSFER:
  PipeHandle           = 82300ef4 [endpoint 0x00000081]
  TransferFlags        = 00000003 (USBD_TRANSFER_DIRECTION_IN, USBD_SHORT_TRANSFER_OK)
  TransferBufferLength = 00000100
  TransferBuffer       = 00000000
  TransferBufferMDL    = 81cacbd8
  UrbLink              = 00000000
[434052 ms] UsbSnoop - MyInternalIOCTLCompletion(f8917db0) : fido=81b964f0, Irp=821756b8, Context=81d30f40, IRQL=2
[434052 ms]  <<<  URB 458 coming back  <<< 
-- URB_FUNCTION_BULK_OR_INTERRUPT_TRANSFER:
  PipeHandle           = 82300ef4 [endpoint 0x00000081]
  TransferFlags        = 00000003 (USBD_TRANSFER_DIRECTION_IN, USBD_SHORT_TRANSFER_OK)
  TransferBufferLength = 00000005
  TransferBuffer       = 00000000
  TransferBufferMDL    = 81cacbd8
    00000000: 00 00 00 33 04
  UrbLink              = 00000000
[434081 ms] UsbSnoop - DispatchAny(f8916610) : IRP_MJ_INTERNAL_DEVICE_CONTROL
[434081 ms] UsbSnoop - MyDispatchInternalIOCTL(f8917e80) : fdo=822eee08, Irp=821756b8, IRQL=2
[434081 ms]  >>>  URB 459 going down  >>> 
-- URB_FUNCTION_BULK_OR_INTERRUPT_TRANSFER:
  PipeHandle           = 82300ef4 [endpoint 0x00000081]
  TransferFlags        = 00000003 (USBD_TRANSFER_DIRECTION_IN, USBD_SHORT_TRANSFER_OK)
  TransferBufferLength = 00000100
  TransferBuffer       = 00000000
  TransferBufferMDL    = 81cacbd8
  UrbLink              = 00000000
[434082 ms] UsbSnoop - MyInternalIOCTLCompletion(f8917db0) : fido=81b964f0, Irp=821756b8, Context=81ace670, IRQL=2
[434082 ms]  <<<  URB 459 coming back  <<< 
-- URB_FUNCTION_BULK_OR_INTERRUPT_TRANSFER:
  PipeHandle           = 82300ef4 [endpoint 0x00000081]
  TransferFlags        = 00000003 (USBD_TRANSFER_DIRECTION_IN, USBD_SHORT_TRANSFER_OK)
  TransferBufferLength = 00000033
  TransferBuffer       = 00000000
  TransferBufferMDL    = 81cacbd8
    00000000: 00 00 00 2d 00 0a 04 6d 61 69 6e 00 00 00 06 00
    00000010: 02 00 00 04 f0 04 00 1f 00 03 00 00 01 00 00 05
    00000020: 02 00 01 00 00 04 00 00 00 0c 00 41 00 00 01 00
    00000030: 00 42 01
  UrbLink              = 00000000
[434111 ms] UsbSnoop - DispatchAny(f8916610) : IRP_MJ_INTERNAL_DEVICE_CONTROL
[434111 ms] UsbSnoop - MyDispatchInternalIOCTL(f8917e80) : fdo=822eee08, Irp=821756b8, IRQL=2
[434111 ms]  >>>  URB 460 going down  >>> 
-- URB_FUNCTION_BULK_OR_INTERRUPT_TRANSFER:
  PipeHandle           = 82300f14 [endpoint 0x00000002]
  TransferFlags        = 00000000 (USBD_TRANSFER_DIRECTION_OUT, ~USBD_SHORT_TRANSFER_OK)
  TransferBufferLength = 00000007
  TransferBuffer       = 00000000
  TransferBufferMDL    = 81cacbd8
    00000000: 00 00 00 02 05 e0 00
  UrbLink              = 00000000
[434112 ms] UsbSnoop - MyInternalIOCTLCompletion(f8917db0) : fido=81b964f0, Irp=821756b8, Context=81acbac0, IRQL=2
[434112 ms]  <<<  URB 460 coming back  <<< 
-- URB_FUNCTION_BULK_OR_INTERRUPT_TRANSFER:
  PipeHandle           = 82300f14 [endpoint 0x00000002]
  TransferFlags        = 00000000 (USBD_TRANSFER_DIRECTION_OUT, ~USBD_SHORT_TRANSFER_OK)
  TransferBufferLength = 00000007
  TransferBuffer       = 00000000
  TransferBufferMDL    = 81cacbd8
  UrbLink              = 00000000
[434121 ms] UsbSnoop - DispatchAny(f8916610) : IRP_MJ_INTERNAL_DEVICE_CONTROL
[434121 ms] UsbSnoop - MyDispatchInternalIOCTL(f8917e80) : fdo=822eee08, Irp=81b23680, IRQL=2
[434121 ms]  >>>  URB 461 going down  >>> 
-- URB_FUNCTION_BULK_OR_INTERRUPT_TRANSFER:
  PipeHandle           = 82300ef4 [endpoint 0x00000081]
  TransferFlags        = 00000003 (USBD_TRANSFER_DIRECTION_IN, USBD_SHORT_TRANSFER_OK)
  TransferBufferLength = 00000100
  TransferBuffer       = 00000000
  TransferBufferMDL    = 81cacbd8
  UrbLink              = 00000000
[434122 ms] UsbSnoop - MyInternalIOCTLCompletion(f8917db0) : fido=81b964f0, Irp=81b23680, Context=81b06608, IRQL=2
[434122 ms]  <<<  URB 461 coming back  <<< 
-- URB_FUNCTION_BULK_OR_INTERRUPT_TRANSFER:
  PipeHandle           = 82300ef4 [endpoint 0x00000081]
  TransferFlags        = 00000003 (USBD_TRANSFER_DIRECTION_IN, USBD_SHORT_TRANSFER_OK)
  TransferBufferLength = 00000005
  TransferBuffer       = 00000000
  TransferBufferMDL    = 81cacbd8
    00000000: 00 00 00 35 04
  UrbLink              = 00000000
[434152 ms] UsbSnoop - DispatchAny(f8916610) : IRP_MJ_INTERNAL_DEVICE_CONTROL
[434152 ms] UsbSnoop - MyDispatchInternalIOCTL(f8917e80) : fdo=822eee08, Irp=81b23680, IRQL=2
[434152 ms]  >>>  URB 462 going down  >>> 
-- URB_FUNCTION_BULK_OR_INTERRUPT_TRANSFER:
  PipeHandle           = 82300ef4 [endpoint 0x00000081]
  TransferFlags        = 00000003 (USBD_TRANSFER_DIRECTION_IN, USBD_SHORT_TRANSFER_OK)
  TransferBufferLength = 00000100
  TransferBuffer       = 00000000
  TransferBufferMDL    = 81cacbd8
  UrbLink              = 00000000
[434152 ms] UsbSnoop - MyInternalIOCTLCompletion(f8917db0) : fido=81b964f0, Irp=81b23680, Context=81ace670, IRQL=2
[434152 ms]  <<<  URB 462 coming back  <<< 
-- URB_FUNCTION_BULK_OR_INTERRUPT_TRANSFER:
  PipeHandle           = 82300ef4 [endpoint 0x00000081]
  TransferFlags        = 00000003 (USBD_TRANSFER_DIRECTION_IN, USBD_SHORT_TRANSFER_OK)
  TransferBufferLength = 00000035
  TransferBuffer       = 00000000
  TransferBufferMDL    = 81cacbd8
    00000000: 00 00 00 2f 00 0a 04 6d 61 69 6e 00 01 78 00 00
    00000010: 06 00 02 00 00 04 f0 04 00 00 00 03 00 00 01 00
    00000020: 00 05 02 00 01 00 00 04 00 00 00 05 00 41 00 00
    00000030: 01 00 00 42 01
  UrbLink              = 00000000
[434182 ms] UsbSnoop - DispatchAny(f8916610) : IRP_MJ_INTERNAL_DEVICE_CONTROL
[434182 ms] UsbSnoop - MyDispatchInternalIOCTL(f8917e80) : fdo=822eee08, Irp=81b23680, IRQL=2
[434182 ms]  >>>  URB 463 going down  >>> 
-- URB_FUNCTION_BULK_OR_INTERRUPT_TRANSFER:
  PipeHandle           = 82300f14 [endpoint 0x00000002]
  TransferFlags        = 00000000 (USBD_TRANSFER_DIRECTION_OUT, ~USBD_SHORT_TRANSFER_OK)
  TransferBufferLength = 00000007
  TransferBuffer       = 00000000
  TransferBufferMDL    = 81cacbd8
    00000000: 00 00 00 02 05 e0 00
  UrbLink              = 00000000
[434182 ms] UsbSnoop - MyInternalIOCTLCompletion(f8917db0) : fido=81b964f0, Irp=81b23680, Context=81b06608, IRQL=2
[434182 ms]  <<<  URB 463 coming back  <<< 
-- URB_FUNCTION_BULK_OR_INTERRUPT_TRANSFER:
  PipeHandle           = 82300f14 [endpoint 0x00000002]
  TransferFlags        = 00000000 (USBD_TRANSFER_DIRECTION_OUT, ~USBD_SHORT_TRANSFER_OK)
  TransferBufferLength = 00000007
  TransferBuffer       = 00000000
  TransferBufferMDL    = 81cacbd8
  UrbLink              = 00000000
[434192 ms] UsbSnoop - DispatchAny(f8916610) : IRP_MJ_INTERNAL_DEVICE_CONTROL
[434192 ms] UsbSnoop - MyDispatchInternalIOCTL(f8917e80) : fdo=822eee08, Irp=822dc818, IRQL=2
[434192 ms]  >>>  URB 464 going down  >>> 
-- URB_FUNCTION_BULK_OR_INTERRUPT_TRANSFER:
  PipeHandle           = 82300ef4 [endpoint 0x00000081]
  TransferFlags        = 00000003 (USBD_TRANSFER_DIRECTION_IN, USBD_SHORT_TRANSFER_OK)
  TransferBufferLength = 00000100
  TransferBuffer       = 00000000
  TransferBufferMDL    = 81c35f88
  UrbLink              = 00000000
[434192 ms] UsbSnoop - MyInternalIOCTLCompletion(f8917db0) : fido=81b964f0, Irp=822dc818, Context=81c49750, IRQL=2
[434192 ms]  <<<  URB 464 coming back  <<< 
-- URB_FUNCTION_BULK_OR_INTERRUPT_TRANSFER:
  PipeHandle           = 82300ef4 [endpoint 0x00000081]
  TransferFlags        = 00000003 (USBD_TRANSFER_DIRECTION_IN, USBD_SHORT_TRANSFER_OK)
  TransferBufferLength = 00000005
  TransferBuffer       = 00000000
  TransferBufferMDL    = 81c35f88
    00000000: 00 00 00 35 04
  UrbLink              = 00000000
[434222 ms] UsbSnoop - DispatchAny(f8916610) : IRP_MJ_INTERNAL_DEVICE_CONTROL
[434222 ms] UsbSnoop - MyDispatchInternalIOCTL(f8917e80) : fdo=822eee08, Irp=81b23680, IRQL=2
[434222 ms]  >>>  URB 465 going down  >>> 
-- URB_FUNCTION_BULK_OR_INTERRUPT_TRANSFER:
  PipeHandle           = 82300ef4 [endpoint 0x00000081]
  TransferFlags        = 00000003 (USBD_TRANSFER_DIRECTION_IN, USBD_SHORT_TRANSFER_OK)
  TransferBufferLength = 00000100
  TransferBuffer       = 00000000
  TransferBufferMDL    = 81c35f88
  UrbLink              = 00000000
[434222 ms] UsbSnoop - MyInternalIOCTLCompletion(f8917db0) : fido=81b964f0, Irp=81b23680, Context=81b6eb58, IRQL=2
[434222 ms]  <<<  URB 465 coming back  <<< 
-- URB_FUNCTION_BULK_OR_INTERRUPT_TRANSFER:
  PipeHandle           = 82300ef4 [endpoint 0x00000081]
  TransferFlags        = 00000003 (USBD_TRANSFER_DIRECTION_IN, USBD_SHORT_TRANSFER_OK)
  TransferBufferLength = 00000035
  TransferBuffer       = 00000000
  TransferBufferMDL    = 81c35f88
    00000000: 00 00 00 2f 00 0a 04 6d 61 69 6e 00 01 79 00 00
    00000010: 06 00 02 00 00 04 f0 04 00 00 00 03 00 00 01 00
    00000020: 00 05 02 00 01 00 00 04 00 00 00 05 00 41 00 00
    00000030: 01 01 00 42 01
  UrbLink              = 00000000
[434252 ms] UsbSnoop - DispatchAny(f8916610) : IRP_MJ_INTERNAL_DEVICE_CONTROL
[434252 ms] UsbSnoop - MyDispatchInternalIOCTL(f8917e80) : fdo=822eee08, Irp=81b23680, IRQL=2
[434252 ms]  >>>  URB 466 going down  >>> 
-- URB_FUNCTION_BULK_OR_INTERRUPT_TRANSFER:
  PipeHandle           = 82300f14 [endpoint 0x00000002]
  TransferFlags        = 00000000 (USBD_TRANSFER_DIRECTION_OUT, ~USBD_SHORT_TRANSFER_OK)
  TransferBufferLength = 00000007
  TransferBuffer       = 00000000
  TransferBufferMDL    = 81c35f88
    00000000: 00 00 00 02 05 e0 00
  UrbLink              = 00000000
[434252 ms] UsbSnoop - MyInternalIOCTLCompletion(f8917db0) : fido=81b964f0, Irp=81b23680, Context=81acbac0, IRQL=2
[434252 ms]  <<<  URB 466 coming back  <<< 
-- URB_FUNCTION_BULK_OR_INTERRUPT_TRANSFER:
  PipeHandle           = 82300f14 [endpoint 0x00000002]
  TransferFlags        = 00000000 (USBD_TRANSFER_DIRECTION_OUT, ~USBD_SHORT_TRANSFER_OK)
  TransferBufferLength = 00000007
  TransferBuffer       = 00000000
  TransferBufferMDL    = 81c35f88
  UrbLink              = 00000000
[434262 ms] UsbSnoop - DispatchAny(f8916610) : IRP_MJ_INTERNAL_DEVICE_CONTROL
[434262 ms] UsbSnoop - MyDispatchInternalIOCTL(f8917e80) : fdo=822eee08, Irp=81b23680, IRQL=2
[434262 ms]  >>>  URB 467 going down  >>> 
-- URB_FUNCTION_BULK_OR_INTERRUPT_TRANSFER:
  PipeHandle           = 82300ef4 [endpoint 0x00000081]
  TransferFlags        = 00000003 (USBD_TRANSFER_DIRECTION_IN, USBD_SHORT_TRANSFER_OK)
  TransferBufferLength = 00000100
  TransferBuffer       = 00000000
  TransferBufferMDL    = 81c35f88
  UrbLink              = 00000000
[434262 ms] UsbSnoop - MyInternalIOCTLCompletion(f8917db0) : fido=81b964f0, Irp=81b23680, Context=81c49750, IRQL=2
[434262 ms]  <<<  URB 467 coming back  <<< 
-- URB_FUNCTION_BULK_OR_INTERRUPT_TRANSFER:
  PipeHandle           = 82300ef4 [endpoint 0x00000081]
  TransferFlags        = 00000003 (USBD_TRANSFER_DIRECTION_IN, USBD_SHORT_TRANSFER_OK)
  TransferBufferLength = 00000005
  TransferBuffer       = 00000000
  TransferBufferMDL    = 81c35f88
    00000000: 00 00 00 06 04
  UrbLink              = 00000000
[434292 ms] UsbSnoop - DispatchAny(f8916610) : IRP_MJ_INTERNAL_DEVICE_CONTROL
[434292 ms] UsbSnoop - MyDispatchInternalIOCTL(f8917e80) : fdo=822eee08, Irp=81b23680, IRQL=2
[434292 ms]  >>>  URB 468 going down  >>> 
-- URB_FUNCTION_BULK_OR_INTERRUPT_TRANSFER:
  PipeHandle           = 82300ef4 [endpoint 0x00000081]
  TransferFlags        = 00000003 (USBD_TRANSFER_DIRECTION_IN, USBD_SHORT_TRANSFER_OK)
  TransferBufferLength = 00000100
  TransferBuffer       = 00000000
  TransferBufferMDL    = 81c35f88
  UrbLink              = 00000000
[434292 ms] UsbSnoop - MyInternalIOCTLCompletion(f8917db0) : fido=81b964f0, Irp=81b23680, Context=81b6eb58, IRQL=2
[434292 ms]  <<<  URB 468 coming back  <<< 
-- URB_FUNCTION_BULK_OR_INTERRUPT_TRANSFER:
  PipeHandle           = 82300ef4 [endpoint 0x00000081]
  TransferFlags        = 00000003 (USBD_TRANSFER_DIRECTION_IN, USBD_SHORT_TRANSFER_OK)
  TransferBufferLength = 00000006
  TransferBuffer       = 00000000
  TransferBufferMDL    = 81c35f88
    00000000: 00 00 00 00 dd 00
  UrbLink              = 00000000
[434322 ms] UsbSnoop - DispatchAny(f8916610) : IRP_MJ_INTERNAL_DEVICE_CONTROL
[434322 ms] UsbSnoop - MyDispatchInternalIOCTL(f8917e80) : fdo=822eee08, Irp=81b23680, IRQL=2
[434322 ms]  >>>  URB 469 going down  >>> 
-- URB_FUNCTION_BULK_OR_INTERRUPT_TRANSFER:
  PipeHandle           = 82300f14 [endpoint 0x00000002]
  TransferFlags        = 00000000 (USBD_TRANSFER_DIRECTION_OUT, ~USBD_SHORT_TRANSFER_OK)
  TransferBufferLength = 00000007
  TransferBuffer       = 00000000
  TransferBufferMDL    = 81c35f88
    00000000: 00 00 00 02 05 e0 00
  UrbLink              = 00000000
[434322 ms] UsbSnoop - MyInternalIOCTLCompletion(f8917db0) : fido=81b964f0, Irp=81b23680, Context=81d30f40, IRQL=2
[434322 ms]  <<<  URB 469 coming back  <<< 
-- URB_FUNCTION_BULK_OR_INTERRUPT_TRANSFER:
  PipeHandle           = 82300f14 [endpoint 0x00000002]
  TransferFlags        = 00000000 (USBD_TRANSFER_DIRECTION_OUT, ~USBD_SHORT_TRANSFER_OK)
  TransferBufferLength = 00000007
  TransferBuffer       = 00000000
  TransferBufferMDL    = 81c35f88
  UrbLink              = 00000000
[434334 ms] UsbSnoop - DispatchAny(f8916610) : IRP_MJ_INTERNAL_DEVICE_CONTROL
[434334 ms] UsbSnoop - MyDispatchInternalIOCTL(f8917e80) : fdo=822eee08, Irp=822dc818, IRQL=0
[434334 ms]  >>>  URB 470 going down  >>> 
-- URB_FUNCTION_RESET_PIPE:
  PipeHandle = 82300ef4 [endpoint 0x00000081]
[434335 ms] UsbSnoop - MyInternalIOCTLCompletion(f8917db0) : fido=00000000, Irp=822dc818, Context=81b6eb58, IRQL=0
[434335 ms]  <<<  URB 470 coming back  <<< 
-- URB_FUNCTION_RESET_PIPE:
[434335 ms] UsbSnoop - DispatchAny(f8916610) : IRP_MJ_INTERNAL_DEVICE_CONTROL
[434335 ms] UsbSnoop - MyDispatchInternalIOCTL(f8917e80) : fdo=822eee08, Irp=822dc818, IRQL=0
[434335 ms]  >>>  URB 471 going down  >>> 
-- URB_FUNCTION_RESET_PIPE:
  PipeHandle = 82300f14 [endpoint 0x00000002]
[434335 ms] UsbSnoop - MyInternalIOCTLCompletion(f8917db0) : fido=00000000, Irp=822dc818, Context=81be7968, IRQL=0
[434335 ms]  <<<  URB 471 coming back  <<< 
-- URB_FUNCTION_RESET_PIPE:
[434335 ms] UsbSnoop - DispatchAny(f8916610) : IRP_MJ_INTERNAL_DEVICE_CONTROL
[434335 ms] UsbSnoop - MyDispatchInternalIOCTL(f8917e80) : fdo=822eee08, Irp=822f0008, IRQL=0
[434335 ms] UsbSnoop - IRP_MJ_POWER (IRP_MN_WAIT_WAKE)
