[912203 ms] UsbSnoop - DispatchAny(f890e610) : IRP_MJ_INTERNAL_DEVICE_CONTROL
[912203 ms] UsbSnoop - MyDispatchInternalIOCTL(f890fe80) : fdo=81b1aac0, Irp=822da178, IRQL=0
[912203 ms]  >>>  URB 402 going down  >>> 
-- URB_FUNCTION_RESET_PIPE:
  PipeHandle = 822e77d4 [endpoint 0x00000081]
[912206 ms] UsbSnoop - MyInternalIOCTLCompletion(f890fdb0) : fido=00000000, Irp=822da178, Context=81ae6180, IRQL=0
[912206 ms]  <<<  URB 402 coming back  <<< 
-- URB_FUNCTION_RESET_PIPE:
[912207 ms] UsbSnoop - DispatchAny(f890e610) : IRP_MJ_INTERNAL_DEVICE_CONTROL
[912207 ms] UsbSnoop - MyDispatchInternalIOCTL(f890fe80) : fdo=81b1aac0, Irp=822da178, IRQL=0
[912207 ms]  >>>  URB 403 going down  >>> 
-- URB_FUNCTION_RESET_PIPE:
  PipeHandle = 822e77f4 [endpoint 0x00000002]
[912216 ms] UsbSnoop - MyInternalIOCTLCompletion(f890fdb0) : fido=00000000, Irp=822da178, Context=81c4ac30, IRQL=0
[912216 ms]  <<<  URB 403 coming back  <<< 
-- URB_FUNCTION_RESET_PIPE:
[913215 ms] UsbSnoop - DispatchAny(f890e610) : IRP_MJ_INTERNAL_DEVICE_CONTROL
[913215 ms] UsbSnoop - MyDispatchInternalIOCTL(f890fe80) : fdo=81b1aac0, Irp=822da178, IRQL=0
[913215 ms]  >>>  URB 404 going down  >>> 
-- URB_FUNCTION_RESET_PIPE:
  PipeHandle = 822e77d4 [endpoint 0x00000081]
[913218 ms] UsbSnoop - MyInternalIOCTLCompletion(f890fdb0) : fido=00000000, Irp=822da178, Context=81c4ac30, IRQL=0
[913218 ms]  <<<  URB 404 coming back  <<< 
-- URB_FUNCTION_RESET_PIPE:
[913218 ms] UsbSnoop - DispatchAny(f890e610) : IRP_MJ_INTERNAL_DEVICE_CONTROL
[913218 ms] UsbSnoop - MyDispatchInternalIOCTL(f890fe80) : fdo=81b1aac0, Irp=822da178, IRQL=0
[913218 ms]  >>>  URB 405 going down  >>> 
-- URB_FUNCTION_RESET_PIPE:
  PipeHandle = 822e77f4 [endpoint 0x00000002]
[913218 ms] UsbSnoop - MyInternalIOCTLCompletion(f890fdb0) : fido=00000000, Irp=822da178, Context=81b61f40, IRQL=0
[913218 ms]  <<<  URB 405 coming back  <<< 
-- URB_FUNCTION_RESET_PIPE:
[913218 ms] UsbSnoop - DispatchAny(f890e610) : IRP_MJ_INTERNAL_DEVICE_CONTROL
[913218 ms] UsbSnoop - MyDispatchInternalIOCTL(f890fe80) : fdo=81b1aac0, Irp=822da178, IRQL=0
[914217 ms] UsbSnoop - DispatchAny(f890e610) : IRP_MJ_INTERNAL_DEVICE_CONTROL
[914217 ms] UsbSnoop - MyDispatchInternalIOCTL(f890fe80) : fdo=81b1aac0, Irp=822da178, IRQL=0
[914217 ms]  >>>  URB 406 going down  >>> 
-- URB_FUNCTION_GET_DESCRIPTOR_FROM_DEVICE:
  TransferBufferLength = 00000012
  TransferBuffer       = e1aae818
  TransferBufferMDL    = 00000000
  Index                = 00000000
  DescriptorType       = 00000001 (USB_DEVICE_DESCRIPTOR_TYPE)
  LanguageId           = 00000000
[914220 ms] UsbSnoop - MyInternalIOCTLCompletion(f890fdb0) : fido=00000000, Irp=822da178, Context=822d7958, IRQL=2
[914220 ms]  <<<  URB 406 coming back  <<< 
-- URB_FUNCTION_CONTROL_TRANSFER:
  PipeHandle           = 81c52dc0
  TransferFlags        = 822da10b (USBD_TRANSFER_DIRECTION_IN, USBD_SHORT_TRANSFER_OK)
  TransferBufferLength = 00000012
  TransferBuffer       = e1aae818
  TransferBufferMDL    = 81ceef88
    00000000: 12 01 00 02 00 00 00 40 51 04 08 e0 10 01 01 02
    00000010: 00 01
  UrbLink              = 00000000
  SetupPacket          =
    00000000: 80 06 00 01 00 00 12 00
[914220 ms] UsbSnoop - DispatchAny(f890e610) : IRP_MJ_INTERNAL_DEVICE_CONTROL
[914220 ms] UsbSnoop - MyDispatchInternalIOCTL(f890fe80) : fdo=81b1aac0, Irp=822da178, IRQL=0
[914220 ms] UsbSnoop - DispatchAny(f890e610) : IRP_MJ_INTERNAL_DEVICE_CONTROL
[914220 ms] UsbSnoop - MyDispatchInternalIOCTL(f890fe80) : fdo=81b1aac0, Irp=822da178, IRQL=0
[914220 ms]  >>>  URB 407 going down  >>> 
-- URB_FUNCTION_RESET_PIPE:
  PipeHandle = 822e77d4 [endpoint 0x00000081]
[914229 ms] UsbSnoop - MyInternalIOCTLCompletion(f890fdb0) : fido=00000000, Irp=822da178, Context=822db980, IRQL=0
[914229 ms]  <<<  URB 407 coming back  <<< 
-- URB_FUNCTION_RESET_PIPE:
[914229 ms] UsbSnoop - DispatchAny(f890e610) : IRP_MJ_INTERNAL_DEVICE_CONTROL
[914229 ms] UsbSnoop - MyDispatchInternalIOCTL(f890fe80) : fdo=81b1aac0, Irp=822da178, IRQL=0
[914229 ms]  >>>  URB 408 going down  >>> 
-- URB_FUNCTION_RESET_PIPE:
  PipeHandle = 822e77f4 [endpoint 0x00000002]
[914230 ms] UsbSnoop - MyInternalIOCTLCompletion(f890fdb0) : fido=00000000, Irp=822da178, Context=81ae6180, IRQL=0
[914230 ms]  <<<  URB 408 coming back  <<< 
-- URB_FUNCTION_RESET_PIPE:
[915489 ms] UsbSnoop - DispatchAny(f890e610) : IRP_MJ_INTERNAL_DEVICE_CONTROL
[915489 ms] UsbSnoop - MyDispatchInternalIOCTL(f890fe80) : fdo=81b1aac0, Irp=81abe008, IRQL=2
[915489 ms]  >>>  URB 409 going down  >>> 
-- URB_FUNCTION_BULK_OR_INTERRUPT_TRANSFER:
  PipeHandle           = 822e77f4 [endpoint 0x00000002]
  TransferFlags        = 00000000 (USBD_TRANSFER_DIRECTION_OUT, ~USBD_SHORT_TRANSFER_OK)
  TransferBufferLength = 00000009
  TransferBuffer       = 00000000
  TransferBufferMDL    = 81ceef88
    00000000: 00 00 00 04 01 00 00 04 00
  UrbLink              = 00000000
[915489 ms] UsbSnoop - MyInternalIOCTLCompletion(f890fdb0) : fido=81b19728, Irp=81abe008, Context=822f37e8, IRQL=2
[915489 ms]  <<<  URB 409 coming back  <<< 
-- URB_FUNCTION_BULK_OR_INTERRUPT_TRANSFER:
  PipeHandle           = 822e77f4 [endpoint 0x00000002]
  TransferFlags        = 00000000 (USBD_TRANSFER_DIRECTION_OUT, ~USBD_SHORT_TRANSFER_OK)
  TransferBufferLength = 00000009
  TransferBuffer       = 00000000
  TransferBufferMDL    = 81ceef88
  UrbLink              = 00000000
[915489 ms] UsbSnoop - DispatchAny(f890e610) : IRP_MJ_INTERNAL_DEVICE_CONTROL
[915489 ms] UsbSnoop - MyDispatchInternalIOCTL(f890fe80) : fdo=81b1aac0, Irp=81abe008, IRQL=2
[915489 ms]  >>>  URB 410 going down  >>> 
-- URB_FUNCTION_BULK_OR_INTERRUPT_TRANSFER:
  PipeHandle           = 822e77d4 [endpoint 0x00000081]
  TransferFlags        = 00000003 (USBD_TRANSFER_DIRECTION_IN, USBD_SHORT_TRANSFER_OK)
  TransferBufferLength = 00000100
  TransferBuffer       = 00000000
  TransferBufferMDL    = 81ceef88
  UrbLink              = 00000000
[915496 ms] UsbSnoop - MyInternalIOCTLCompletion(f890fdb0) : fido=81b19728, Irp=81abe008, Context=822f29c8, IRQL=2
[915496 ms]  <<<  URB 410 coming back  <<< 
-- URB_FUNCTION_BULK_OR_INTERRUPT_TRANSFER:
  PipeHandle           = 822e77d4 [endpoint 0x00000081]
  TransferFlags        = 00000003 (USBD_TRANSFER_DIRECTION_IN, USBD_SHORT_TRANSFER_OK)
  TransferBufferLength = 00000009
  TransferBuffer       = 00000000
  TransferBufferMDL    = 81ceef88
    00000000: 00 00 00 04 02 00 00 00 fa
  UrbLink              = 00000000
[915519 ms] UsbSnoop - DispatchAny(f890e610) : IRP_MJ_INTERNAL_DEVICE_CONTROL
[915519 ms] UsbSnoop - MyDispatchInternalIOCTL(f890fe80) : fdo=81b1aac0, Irp=81abe008, IRQL=2
[915519 ms]  >>>  URB 411 going down  >>> 
-- URB_FUNCTION_BULK_OR_INTERRUPT_TRANSFER:
  PipeHandle           = 822e77f4 [endpoint 0x00000002]
  TransferFlags        = 00000000 (USBD_TRANSFER_DIRECTION_OUT, ~USBD_SHORT_TRANSFER_OK)
  TransferBufferLength = 00000015
  TransferBuffer       = 00000000
  TransferBufferMDL    = 81ceef88
    00000000: 00 00 00 10 04 00 00 00 0a 00 01 00 03 00 01 00
    00000010: 00 00 00 07 d0
  UrbLink              = 00000000
[915519 ms] UsbSnoop - MyInternalIOCTLCompletion(f890fdb0) : fido=81b19728, Irp=81abe008, Context=821d0b40, IRQL=2
[915519 ms]  <<<  URB 411 coming back  <<< 
-- URB_FUNCTION_BULK_OR_INTERRUPT_TRANSFER:
  PipeHandle           = 822e77f4 [endpoint 0x00000002]
  TransferFlags        = 00000000 (USBD_TRANSFER_DIRECTION_OUT, ~USBD_SHORT_TRANSFER_OK)
  TransferBufferLength = 00000015
  TransferBuffer       = 00000000
  TransferBufferMDL    = 81ceef88
  UrbLink              = 00000000
[915529 ms] UsbSnoop - DispatchAny(f890e610) : IRP_MJ_INTERNAL_DEVICE_CONTROL
[915529 ms] UsbSnoop - MyDispatchInternalIOCTL(f890fe80) : fdo=81b1aac0, Irp=81abe008, IRQL=2
[915529 ms]  >>>  URB 412 going down  >>> 
-- URB_FUNCTION_BULK_OR_INTERRUPT_TRANSFER:
  PipeHandle           = 822e77d4 [endpoint 0x00000081]
  TransferFlags        = 00000003 (USBD_TRANSFER_DIRECTION_IN, USBD_SHORT_TRANSFER_OK)
  TransferBufferLength = 00000100
  TransferBuffer       = 00000000
  TransferBufferMDL    = 81ceef88
  UrbLink              = 00000000
[915529 ms] UsbSnoop - MyInternalIOCTLCompletion(f890fdb0) : fido=81b19728, Irp=81abe008, Context=822f37e8, IRQL=2
[915529 ms]  <<<  URB 412 coming back  <<< 
-- URB_FUNCTION_BULK_OR_INTERRUPT_TRANSFER:
  PipeHandle           = 822e77d4 [endpoint 0x00000081]
  TransferFlags        = 00000003 (USBD_TRANSFER_DIRECTION_IN, USBD_SHORT_TRANSFER_OK)
  TransferBufferLength = 00000007
  TransferBuffer       = 00000000
  TransferBufferMDL    = 81ceef88
    00000000: 00 00 00 02 05 e0 00
  UrbLink              = 00000000
[915569 ms] UsbSnoop - DispatchAny(f890e610) : IRP_MJ_INTERNAL_DEVICE_CONTROL
[915569 ms] UsbSnoop - MyDispatchInternalIOCTL(f890fe80) : fdo=81b1aac0, Irp=81abe008, IRQL=2
[915569 ms]  >>>  URB 413 going down  >>> 
-- URB_FUNCTION_BULK_OR_INTERRUPT_TRANSFER:
  PipeHandle           = 822e77d4 [endpoint 0x00000081]
  TransferFlags        = 00000003 (USBD_TRANSFER_DIRECTION_IN, USBD_SHORT_TRANSFER_OK)
  TransferBufferLength = 00000100
  TransferBuffer       = 00000000
  TransferBufferMDL    = 81ceef88
  UrbLink              = 00000000
[915569 ms] UsbSnoop - MyInternalIOCTLCompletion(f890fdb0) : fido=81b19728, Irp=81abe008, Context=821d0b40, IRQL=2
[915569 ms]  <<<  URB 413 coming back  <<< 
-- URB_FUNCTION_BULK_OR_INTERRUPT_TRANSFER:
  PipeHandle           = 822e77d4 [endpoint 0x00000081]
  TransferFlags        = 00000003 (USBD_TRANSFER_DIRECTION_IN, USBD_SHORT_TRANSFER_OK)
  TransferBufferLength = 0000000f
  TransferBuffer       = 00000000
  TransferBufferMDL    = 81ceef88
    00000000: 00 00 00 0a 04 00 00 00 04 00 12 00 00 07 d0
  UrbLink              = 00000000
[915609 ms] UsbSnoop - DispatchAny(f890e610) : IRP_MJ_INTERNAL_DEVICE_CONTROL
[915609 ms] UsbSnoop - MyDispatchInternalIOCTL(f890fe80) : fdo=81b1aac0, Irp=81abe008, IRQL=2
[915609 ms]  >>>  URB 414 going down  >>> 
-- URB_FUNCTION_BULK_OR_INTERRUPT_TRANSFER:
  PipeHandle           = 822e77f4 [endpoint 0x00000002]
  TransferFlags        = 00000000 (USBD_TRANSFER_DIRECTION_OUT, ~USBD_SHORT_TRANSFER_OK)
  TransferBufferLength = 00000007
  TransferBuffer       = 00000000
  TransferBufferMDL    = 81ceef88
    00000000: 00 00 00 02 05 e0 00
  UrbLink              = 00000000
[915609 ms] UsbSnoop - MyInternalIOCTLCompletion(f890fdb0) : fido=81b19728, Irp=81abe008, Context=81d44d98, IRQL=2
[915609 ms]  <<<  URB 414 coming back  <<< 
-- URB_FUNCTION_BULK_OR_INTERRUPT_TRANSFER:
  PipeHandle           = 822e77f4 [endpoint 0x00000002]
  TransferFlags        = 00000000 (USBD_TRANSFER_DIRECTION_OUT, ~USBD_SHORT_TRANSFER_OK)
  TransferBufferLength = 00000007
  TransferBuffer       = 00000000
  TransferBufferMDL    = 81ceef88
  UrbLink              = 00000000
[915619 ms] UsbSnoop - DispatchAny(f890e610) : IRP_MJ_INTERNAL_DEVICE_CONTROL
[915619 ms] UsbSnoop - MyDispatchInternalIOCTL(f890fe80) : fdo=81b1aac0, Irp=81abe008, IRQL=2
[915619 ms]  >>>  URB 415 going down  >>> 
-- URB_FUNCTION_BULK_OR_INTERRUPT_TRANSFER:
  PipeHandle           = 822e77f4 [endpoint 0x00000002]
  TransferFlags        = 00000000 (USBD_TRANSFER_DIRECTION_OUT, ~USBD_SHORT_TRANSFER_OK)
  TransferBufferLength = 0000002b
  TransferBuffer       = 00000000
  TransferBufferMDL    = 81ceef88
    00000000: 00 00 00 26 04 00 00 00 20 00 0c 00 06 49 44 4c
    00000010: 69 73 74 00 01 ff ff ff ff 00 02 00 03 00 08 00
    00000020: 01 00 11 00 04 f0 07 00 26 00 00
  UrbLink              = 00000000
[915619 ms] UsbSnoop - MyInternalIOCTLCompletion(f890fdb0) : fido=81b19728, Irp=81abe008, Context=821d0b40, IRQL=2
[915619 ms]  <<<  URB 415 coming back  <<< 
-- URB_FUNCTION_BULK_OR_INTERRUPT_TRANSFER:
  PipeHandle           = 822e77f4 [endpoint 0x00000002]
  TransferFlags        = 00000000 (USBD_TRANSFER_DIRECTION_OUT, ~USBD_SHORT_TRANSFER_OK)
  TransferBufferLength = 0000002b
  TransferBuffer       = 00000000
  TransferBufferMDL    = 81ceef88
  UrbLink              = 00000000
[915629 ms] UsbSnoop - DispatchAny(f890e610) : IRP_MJ_INTERNAL_DEVICE_CONTROL
[915629 ms] UsbSnoop - MyDispatchInternalIOCTL(f890fe80) : fdo=81b1aac0, Irp=81abe008, IRQL=2
[915629 ms]  >>>  URB 416 going down  >>> 
-- URB_FUNCTION_BULK_OR_INTERRUPT_TRANSFER:
  PipeHandle           = 822e77d4 [endpoint 0x00000081]
  TransferFlags        = 00000003 (USBD_TRANSFER_DIRECTION_IN, USBD_SHORT_TRANSFER_OK)
  TransferBufferLength = 00000100
  TransferBuffer       = 00000000
  TransferBufferMDL    = 81ceef88
  UrbLink              = 00000000
[915629 ms] UsbSnoop - MyInternalIOCTLCompletion(f890fdb0) : fido=81b19728, Irp=81abe008, Context=822f37e8, IRQL=2
[915629 ms]  <<<  URB 416 coming back  <<< 
-- URB_FUNCTION_BULK_OR_INTERRUPT_TRANSFER:
  PipeHandle           = 822e77d4 [endpoint 0x00000081]
  TransferFlags        = 00000003 (USBD_TRANSFER_DIRECTION_IN, USBD_SHORT_TRANSFER_OK)
  TransferBufferLength = 00000007
  TransferBuffer       = 00000000
  TransferBufferMDL    = 81ceef88
    00000000: 00 00 00 02 05 e0 00
  UrbLink              = 00000000
[915669 ms] UsbSnoop - DispatchAny(f890e610) : IRP_MJ_INTERNAL_DEVICE_CONTROL
[915669 ms] UsbSnoop - MyDispatchInternalIOCTL(f890fe80) : fdo=81b1aac0, Irp=81b5ce48, IRQL=2
[915669 ms]  >>>  URB 417 going down  >>> 
-- URB_FUNCTION_BULK_OR_INTERRUPT_TRANSFER:
  PipeHandle           = 822e77d4 [endpoint 0x00000081]
  TransferFlags        = 00000003 (USBD_TRANSFER_DIRECTION_IN, USBD_SHORT_TRANSFER_OK)
  TransferBufferLength = 00000100
  TransferBuffer       = 00000000
  TransferBufferMDL    = 81ceef88
  UrbLink              = 00000000
[915669 ms] UsbSnoop - MyInternalIOCTLCompletion(f890fdb0) : fido=81b19728, Irp=81b5ce48, Context=822fea10, IRQL=2
[915669 ms]  <<<  URB 417 coming back  <<< 
-- URB_FUNCTION_BULK_OR_INTERRUPT_TRANSFER:
  PipeHandle           = 822e77d4 [endpoint 0x00000081]
  TransferFlags        = 00000003 (USBD_TRANSFER_DIRECTION_IN, USBD_SHORT_TRANSFER_OK)
  TransferBufferLength = 00000020
  TransferBuffer       = 00000000
  TransferBufferMDL    = 81ceef88
    00000000: 00 00 00 1b 04 00 00 00 15 00 0a 00 01 80 00 00
    00000010: 02 00 03 00 00 01 01 00 08 00 00 04 00 00 00 00
  UrbLink              = 00000000
[915709 ms] UsbSnoop - DispatchAny(f890e610) : IRP_MJ_INTERNAL_DEVICE_CONTROL
[915709 ms] UsbSnoop - MyDispatchInternalIOCTL(f890fe80) : fdo=81b1aac0, Irp=81b5ce48, IRQL=2
[915709 ms]  >>>  URB 418 going down  >>> 
-- URB_FUNCTION_BULK_OR_INTERRUPT_TRANSFER:
  PipeHandle           = 822e77f4 [endpoint 0x00000002]
  TransferFlags        = 00000000 (USBD_TRANSFER_DIRECTION_OUT, ~USBD_SHORT_TRANSFER_OK)
  TransferBufferLength = 00000007
  TransferBuffer       = 00000000
  TransferBufferMDL    = 81ceef88
    00000000: 00 00 00 02 05 e0 00
  UrbLink              = 00000000
[915709 ms] UsbSnoop - MyInternalIOCTLCompletion(f890fdb0) : fido=81b19728, Irp=81b5ce48, Context=822f37e8, IRQL=2
[915709 ms]  <<<  URB 418 coming back  <<< 
-- URB_FUNCTION_BULK_OR_INTERRUPT_TRANSFER:
  PipeHandle           = 822e77f4 [endpoint 0x00000002]
  TransferFlags        = 00000000 (USBD_TRANSFER_DIRECTION_OUT, ~USBD_SHORT_TRANSFER_OK)
  TransferBufferLength = 00000007
  TransferBuffer       = 00000000
  TransferBufferMDL    = 81ceef88
  UrbLink              = 00000000
[915719 ms] UsbSnoop - DispatchAny(f890e610) : IRP_MJ_INTERNAL_DEVICE_CONTROL
[915719 ms] UsbSnoop - MyDispatchInternalIOCTL(f890fe80) : fdo=81b1aac0, Irp=81b5ce48, IRQL=2
[915719 ms]  >>>  URB 419 going down  >>> 
-- URB_FUNCTION_BULK_OR_INTERRUPT_TRANSFER:
  PipeHandle           = 822e77d4 [endpoint 0x00000081]
  TransferFlags        = 00000003 (USBD_TRANSFER_DIRECTION_IN, USBD_SHORT_TRANSFER_OK)
  TransferBufferLength = 00000100
  TransferBuffer       = 00000000
  TransferBufferMDL    = 81ceef88
  UrbLink              = 00000000
[915719 ms] UsbSnoop - MyInternalIOCTLCompletion(f890fdb0) : fido=81b19728, Irp=81b5ce48, Context=81b374a8, IRQL=2
[915719 ms]  <<<  URB 419 coming back  <<< 
-- URB_FUNCTION_BULK_OR_INTERRUPT_TRANSFER:
  PipeHandle           = 822e77d4 [endpoint 0x00000081]
  TransferFlags        = 00000003 (USBD_TRANSFER_DIRECTION_IN, USBD_SHORT_TRANSFER_OK)
  TransferBufferLength = 00000016
  TransferBuffer       = 00000000
  TransferBufferMDL    = 81ceef88
    00000000: 00 00 00 11 04 00 00 00 0b 00 0d 01 00 00 80 0a
    00000010: 32 cc e3 01 21 18
  UrbLink              = 00000000
[915759 ms] UsbSnoop - DispatchAny(f890e610) : IRP_MJ_INTERNAL_DEVICE_CONTROL
[915759 ms] UsbSnoop - MyDispatchInternalIOCTL(f890fe80) : fdo=81b1aac0, Irp=81b5ce48, IRQL=2
[915759 ms]  >>>  URB 420 going down  >>> 
-- URB_FUNCTION_BULK_OR_INTERRUPT_TRANSFER:
  PipeHandle           = 822e77f4 [endpoint 0x00000002]
  TransferFlags        = 00000000 (USBD_TRANSFER_DIRECTION_OUT, ~USBD_SHORT_TRANSFER_OK)
  TransferBufferLength = 00000007
  TransferBuffer       = 00000000
  TransferBufferMDL    = 81ceef88
    00000000: 00 00 00 02 05 e0 00
  UrbLink              = 00000000
[915759 ms] UsbSnoop - MyInternalIOCTLCompletion(f890fdb0) : fido=81b19728, Irp=81b5ce48, Context=822fea10, IRQL=2
[915759 ms]  <<<  URB 420 coming back  <<< 
-- URB_FUNCTION_BULK_OR_INTERRUPT_TRANSFER:
  PipeHandle           = 822e77f4 [endpoint 0x00000002]
  TransferFlags        = 00000000 (USBD_TRANSFER_DIRECTION_OUT, ~USBD_SHORT_TRANSFER_OK)
  TransferBufferLength = 00000007
  TransferBuffer       = 00000000
  TransferBufferMDL    = 81ceef88
  UrbLink              = 00000000
[917522 ms] UsbSnoop - DispatchAny(f890e610) : IRP_MJ_INTERNAL_DEVICE_CONTROL
[917522 ms] UsbSnoop - MyDispatchInternalIOCTL(f890fe80) : fdo=81b1aac0, Irp=81b5ce48, IRQL=2
[917522 ms]  >>>  URB 421 going down  >>> 
-- URB_FUNCTION_BULK_OR_INTERRUPT_TRANSFER:
  PipeHandle           = 822e77f4 [endpoint 0x00000002]
  TransferFlags        = 00000000 (USBD_TRANSFER_DIRECTION_OUT, ~USBD_SHORT_TRANSFER_OK)
  TransferBufferLength = 00000009
  TransferBuffer       = 00000000
  TransferBufferMDL    = 81ceef88
    00000000: 00 00 00 04 01 00 00 04 00
  UrbLink              = 00000000
[917522 ms] UsbSnoop - MyInternalIOCTLCompletion(f890fdb0) : fido=81b19728, Irp=81b5ce48, Context=81b374a8, IRQL=2
[917522 ms]  <<<  URB 421 coming back  <<< 
-- URB_FUNCTION_BULK_OR_INTERRUPT_TRANSFER:
  PipeHandle           = 822e77f4 [endpoint 0x00000002]
  TransferFlags        = 00000000 (USBD_TRANSFER_DIRECTION_OUT, ~USBD_SHORT_TRANSFER_OK)
  TransferBufferLength = 00000009
  TransferBuffer       = 00000000
  TransferBufferMDL    = 81ceef88
  UrbLink              = 00000000
[917522 ms] UsbSnoop - DispatchAny(f890e610) : IRP_MJ_INTERNAL_DEVICE_CONTROL
[917522 ms] UsbSnoop - MyDispatchInternalIOCTL(f890fe80) : fdo=81b1aac0, Irp=81b5ce48, IRQL=2
[917522 ms]  >>>  URB 422 going down  >>> 
-- URB_FUNCTION_BULK_OR_INTERRUPT_TRANSFER:
  PipeHandle           = 822e77d4 [endpoint 0x00000081]
  TransferFlags        = 00000003 (USBD_TRANSFER_DIRECTION_IN, USBD_SHORT_TRANSFER_OK)
  TransferBufferLength = 00000100
  TransferBuffer       = 00000000
  TransferBufferMDL    = 81ceef88
  UrbLink              = 00000000
[917528 ms] UsbSnoop - MyInternalIOCTLCompletion(f890fdb0) : fido=81b19728, Irp=81b5ce48, Context=82307450, IRQL=2
[917528 ms]  <<<  URB 422 coming back  <<< 
-- URB_FUNCTION_BULK_OR_INTERRUPT_TRANSFER:
  PipeHandle           = 822e77d4 [endpoint 0x00000081]
  TransferFlags        = 00000003 (USBD_TRANSFER_DIRECTION_IN, USBD_SHORT_TRANSFER_OK)
  TransferBufferLength = 00000009
  TransferBuffer       = 00000000
  TransferBufferMDL    = 81ceef88
    00000000: 00 00 00 04 02 00 00 00 fa
  UrbLink              = 00000000
[917553 ms] UsbSnoop - DispatchAny(f890e610) : IRP_MJ_INTERNAL_DEVICE_CONTROL
[917553 ms] UsbSnoop - MyDispatchInternalIOCTL(f890fe80) : fdo=81b1aac0, Irp=81b5ce48, IRQL=2
[917553 ms]  >>>  URB 423 going down  >>> 
-- URB_FUNCTION_BULK_OR_INTERRUPT_TRANSFER:
  PipeHandle           = 822e77f4 [endpoint 0x00000002]
  TransferFlags        = 00000000 (USBD_TRANSFER_DIRECTION_OUT, ~USBD_SHORT_TRANSFER_OK)
  TransferBufferLength = 00000015
  TransferBuffer       = 00000000
  TransferBufferMDL    = 81ceef88
    00000000: 00 00 00 10 04 00 00 00 0a 00 01 00 03 00 01 00
    00000010: 00 00 00 07 d0
  UrbLink              = 00000000
[917553 ms] UsbSnoop - MyInternalIOCTLCompletion(f890fdb0) : fido=81b19728, Irp=81b5ce48, Context=822f29c8, IRQL=2
[917553 ms]  <<<  URB 423 coming back  <<< 
-- URB_FUNCTION_BULK_OR_INTERRUPT_TRANSFER:
  PipeHandle           = 822e77f4 [endpoint 0x00000002]
  TransferFlags        = 00000000 (USBD_TRANSFER_DIRECTION_OUT, ~USBD_SHORT_TRANSFER_OK)
  TransferBufferLength = 00000015
  TransferBuffer       = 00000000
  TransferBufferMDL    = 81ceef88
  UrbLink              = 00000000
[917562 ms] UsbSnoop - DispatchAny(f890e610) : IRP_MJ_INTERNAL_DEVICE_CONTROL
[917562 ms] UsbSnoop - MyDispatchInternalIOCTL(f890fe80) : fdo=81b1aac0, Irp=81b5ce48, IRQL=2
[917562 ms]  >>>  URB 424 going down  >>> 
-- URB_FUNCTION_BULK_OR_INTERRUPT_TRANSFER:
  PipeHandle           = 822e77d4 [endpoint 0x00000081]
  TransferFlags        = 00000003 (USBD_TRANSFER_DIRECTION_IN, USBD_SHORT_TRANSFER_OK)
  TransferBufferLength = 00000100
  TransferBuffer       = 00000000
  TransferBufferMDL    = 81ceef88
  UrbLink              = 00000000
[917562 ms] UsbSnoop - MyInternalIOCTLCompletion(f890fdb0) : fido=81b19728, Irp=81b5ce48, Context=81b374a8, IRQL=2
[917562 ms]  <<<  URB 424 coming back  <<< 
-- URB_FUNCTION_BULK_OR_INTERRUPT_TRANSFER:
  PipeHandle           = 822e77d4 [endpoint 0x00000081]
  TransferFlags        = 00000003 (USBD_TRANSFER_DIRECTION_IN, USBD_SHORT_TRANSFER_OK)
  TransferBufferLength = 00000007
  TransferBuffer       = 00000000
  TransferBufferMDL    = 81ceef88
    00000000: 00 00 00 02 05 e0 00
  UrbLink              = 00000000
[917602 ms] UsbSnoop - DispatchAny(f890e610) : IRP_MJ_INTERNAL_DEVICE_CONTROL
[917602 ms] UsbSnoop - MyDispatchInternalIOCTL(f890fe80) : fdo=81b1aac0, Irp=81b5ce48, IRQL=2
[917602 ms]  >>>  URB 425 going down  >>> 
-- URB_FUNCTION_BULK_OR_INTERRUPT_TRANSFER:
  PipeHandle           = 822e77d4 [endpoint 0x00000081]
  TransferFlags        = 00000003 (USBD_TRANSFER_DIRECTION_IN, USBD_SHORT_TRANSFER_OK)
  TransferBufferLength = 00000100
  TransferBuffer       = 00000000
  TransferBufferMDL    = 81ceef88
  UrbLink              = 00000000
[917602 ms] UsbSnoop - MyInternalIOCTLCompletion(f890fdb0) : fido=81b19728, Irp=81b5ce48, Context=822f29c8, IRQL=2
[917602 ms]  <<<  URB 425 coming back  <<< 
-- URB_FUNCTION_BULK_OR_INTERRUPT_TRANSFER:
  PipeHandle           = 822e77d4 [endpoint 0x00000081]
  TransferFlags        = 00000003 (USBD_TRANSFER_DIRECTION_IN, USBD_SHORT_TRANSFER_OK)
  TransferBufferLength = 0000000f
  TransferBuffer       = 00000000
  TransferBufferMDL    = 81ceef88
    00000000: 00 00 00 0a 04 00 00 00 04 00 12 00 00 07 d0
  UrbLink              = 00000000
[917642 ms] UsbSnoop - DispatchAny(f890e610) : IRP_MJ_INTERNAL_DEVICE_CONTROL
[917642 ms] UsbSnoop - MyDispatchInternalIOCTL(f890fe80) : fdo=81b1aac0, Irp=81b5ce48, IRQL=2
[917642 ms]  >>>  URB 426 going down  >>> 
-- URB_FUNCTION_BULK_OR_INTERRUPT_TRANSFER:
  PipeHandle           = 822e77f4 [endpoint 0x00000002]
  TransferFlags        = 00000000 (USBD_TRANSFER_DIRECTION_OUT, ~USBD_SHORT_TRANSFER_OK)
  TransferBufferLength = 00000007
  TransferBuffer       = 00000000
  TransferBufferMDL    = 81ceef88
    00000000: 00 00 00 02 05 e0 00
  UrbLink              = 00000000
[917642 ms] UsbSnoop - MyInternalIOCTLCompletion(f890fdb0) : fido=81b19728, Irp=81b5ce48, Context=81b223d8, IRQL=2
[917642 ms]  <<<  URB 426 coming back  <<< 
-- URB_FUNCTION_BULK_OR_INTERRUPT_TRANSFER:
  PipeHandle           = 822e77f4 [endpoint 0x00000002]
  TransferFlags        = 00000000 (USBD_TRANSFER_DIRECTION_OUT, ~USBD_SHORT_TRANSFER_OK)
  TransferBufferLength = 00000007
  TransferBuffer       = 00000000
  TransferBufferMDL    = 81ceef88
  UrbLink              = 00000000
[917653 ms] UsbSnoop - DispatchAny(f890e610) : IRP_MJ_INTERNAL_DEVICE_CONTROL
[917653 ms] UsbSnoop - MyDispatchInternalIOCTL(f890fe80) : fdo=81b1aac0, Irp=81ae0e48, IRQL=2
[917653 ms]  >>>  URB 427 going down  >>> 
-- URB_FUNCTION_BULK_OR_INTERRUPT_TRANSFER:
  PipeHandle           = 822e77f4 [endpoint 0x00000002]
  TransferFlags        = 00000000 (USBD_TRANSFER_DIRECTION_OUT, ~USBD_SHORT_TRANSFER_OK)
  TransferBufferLength = 00000029
  TransferBuffer       = 00000000
  TransferBufferMDL    = 81ae7dc8
    00000000: 00 00 00 24 04 00 00 00 1e 00 07 00 0e 00 0b 00
    00000010: 04 00 06 00 07 00 01 00 02 00 0a 00 37 00 0d 00
    00000020: 38 00 09 00 0e 00 2d 00 03
  UrbLink              = 00000000
[917653 ms] UsbSnoop - MyInternalIOCTLCompletion(f890fdb0) : fido=81b19728, Irp=81ae0e48, Context=82307450, IRQL=2
[917653 ms]  <<<  URB 427 coming back  <<< 
-- URB_FUNCTION_BULK_OR_INTERRUPT_TRANSFER:
  PipeHandle           = 822e77f4 [endpoint 0x00000002]
  TransferFlags        = 00000000 (USBD_TRANSFER_DIRECTION_OUT, ~USBD_SHORT_TRANSFER_OK)
  TransferBufferLength = 00000029
  TransferBuffer       = 00000000
  TransferBufferMDL    = 81ae7dc8
  UrbLink              = 00000000
[917662 ms] UsbSnoop - DispatchAny(f890e610) : IRP_MJ_INTERNAL_DEVICE_CONTROL
[917662 ms] UsbSnoop - MyDispatchInternalIOCTL(f890fe80) : fdo=81b1aac0, Irp=822da178, IRQL=2
[917662 ms]  >>>  URB 428 going down  >>> 
-- URB_FUNCTION_BULK_OR_INTERRUPT_TRANSFER:
  PipeHandle           = 822e77d4 [endpoint 0x00000081]
  TransferFlags        = 00000003 (USBD_TRANSFER_DIRECTION_IN, USBD_SHORT_TRANSFER_OK)
  TransferBufferLength = 00000100
  TransferBuffer       = 00000000
  TransferBufferMDL    = 81ceef88
  UrbLink              = 00000000
[917662 ms] UsbSnoop - MyInternalIOCTLCompletion(f890fdb0) : fido=81b19728, Irp=822da178, Context=81d44d98, IRQL=2
[917662 ms]  <<<  URB 428 coming back  <<< 
-- URB_FUNCTION_BULK_OR_INTERRUPT_TRANSFER:
  PipeHandle           = 822e77d4 [endpoint 0x00000081]
  TransferFlags        = 00000003 (USBD_TRANSFER_DIRECTION_IN, USBD_SHORT_TRANSFER_OK)
  TransferBufferLength = 00000007
  TransferBuffer       = 00000000
  TransferBufferMDL    = 81ceef88
    00000000: 00 00 00 02 05 e0 00
  UrbLink              = 00000000
[917702 ms] UsbSnoop - DispatchAny(f890e610) : IRP_MJ_INTERNAL_DEVICE_CONTROL
[917702 ms] UsbSnoop - MyDispatchInternalIOCTL(f890fe80) : fdo=81b1aac0, Irp=822da178, IRQL=2
[917702 ms]  >>>  URB 429 going down  >>> 
-- URB_FUNCTION_BULK_OR_INTERRUPT_TRANSFER:
  PipeHandle           = 822e77d4 [endpoint 0x00000081]
  TransferFlags        = 00000003 (USBD_TRANSFER_DIRECTION_IN, USBD_SHORT_TRANSFER_OK)
  TransferBufferLength = 00000100
  TransferBuffer       = 00000000
  TransferBufferMDL    = 81ceef88
  UrbLink              = 00000000
[917702 ms] UsbSnoop - MyInternalIOCTLCompletion(f890fdb0) : fido=81b19728, Irp=822da178, Context=81b374a8, IRQL=2
[917702 ms]  <<<  URB 429 coming back  <<< 
-- URB_FUNCTION_BULK_OR_INTERRUPT_TRANSFER:
  PipeHandle           = 822e77d4 [endpoint 0x00000081]
  TransferFlags        = 00000003 (USBD_TRANSFER_DIRECTION_IN, USBD_SHORT_TRANSFER_OK)
  TransferBufferLength = 0000000f
  TransferBuffer       = 00000000
  TransferBufferMDL    = 81ceef88
    00000000: 00 00 00 0a 04 00 00 00 04 bb 00 00 01 d4 c0
  UrbLink              = 00000000
[917742 ms] UsbSnoop - DispatchAny(f890e610) : IRP_MJ_INTERNAL_DEVICE_CONTROL
[917742 ms] UsbSnoop - MyDispatchInternalIOCTL(f890fe80) : fdo=81b1aac0, Irp=81b4fe48, IRQL=2
[917742 ms]  >>>  URB 430 going down  >>> 
-- URB_FUNCTION_BULK_OR_INTERRUPT_TRANSFER:
  PipeHandle           = 822e77f4 [endpoint 0x00000002]
  TransferFlags        = 00000000 (USBD_TRANSFER_DIRECTION_OUT, ~USBD_SHORT_TRANSFER_OK)
  TransferBufferLength = 00000007
  TransferBuffer       = 00000000
  TransferBufferMDL    = 81ceef88
    00000000: 00 00 00 02 05 e0 00
  UrbLink              = 00000000
[917742 ms] UsbSnoop - MyInternalIOCTLCompletion(f890fdb0) : fido=81b19728, Irp=81b4fe48, Context=822f29c8, IRQL=2
[917742 ms]  <<<  URB 430 coming back  <<< 
-- URB_FUNCTION_BULK_OR_INTERRUPT_TRANSFER:
  PipeHandle           = 822e77f4 [endpoint 0x00000002]
  TransferFlags        = 00000000 (USBD_TRANSFER_DIRECTION_OUT, ~USBD_SHORT_TRANSFER_OK)
  TransferBufferLength = 00000007
  TransferBuffer       = 00000000
  TransferBufferMDL    = 81ceef88
  UrbLink              = 00000000
[917752 ms] UsbSnoop - DispatchAny(f890e610) : IRP_MJ_INTERNAL_DEVICE_CONTROL
[917752 ms] UsbSnoop - MyDispatchInternalIOCTL(f890fe80) : fdo=81b1aac0, Irp=81b4fe48, IRQL=2
[917752 ms]  >>>  URB 431 going down  >>> 
-- URB_FUNCTION_BULK_OR_INTERRUPT_TRANSFER:
  PipeHandle           = 822e77d4 [endpoint 0x00000081]
  TransferFlags        = 00000003 (USBD_TRANSFER_DIRECTION_IN, USBD_SHORT_TRANSFER_OK)
  TransferBufferLength = 00000100
  TransferBuffer       = 00000000
  TransferBufferMDL    = 81ceef88
  UrbLink              = 00000000
[917812 ms] UsbSnoop - MyInternalIOCTLCompletion(f890fdb0) : fido=81b19728, Irp=81b4fe48, Context=81d44d98, IRQL=2
[917812 ms]  <<<  URB 431 coming back  <<< 
-- URB_FUNCTION_BULK_OR_INTERRUPT_TRANSFER:
  PipeHandle           = 822e77d4 [endpoint 0x00000081]
  TransferFlags        = 00000003 (USBD_TRANSFER_DIRECTION_IN, USBD_SHORT_TRANSFER_OK)
  TransferBufferLength = 00000095
  TransferBuffer       = 00000000
  TransferBufferMDL    = 81ceef88
    00000000: 00 00 00 90 04 00 00 00 8a 00 08 00 0e 00 0b 00
    00000010: 00 04 00 02 28 00 00 04 00 00 02 00 03 00 06 00
    00000020: 00 01 09 00 07 00 00 01 01 00 01 00 00 04 00 00
    00000030: 00 0a 00 02 00 00 19 54 49 2d 38 34 20 50 6c 75
    00000040: 73 20 53 69 6c 76 65 72 20 45 64 69 74 69 6f 6e
    00000050: 00 0a 00 00 01 01 00 37 00 00 01 01 00 0d 00 00
    00000060: 08 00 00 00 00 00 00 5e fd 00 38 00 00 01 00 00
    00000070: 09 00 00 04 00 01 00 00 00 0e 00 00 08 00 00 00
    00000080: 00 00 00 5e bb 00 2d 00 00 01 01 00 03 00 00 05
    00000090: 0a 32 cc e3 01
  UrbLink              = 00000000
[917854 ms] UsbSnoop - DispatchAny(f890e610) : IRP_MJ_INTERNAL_DEVICE_CONTROL
[917854 ms] UsbSnoop - MyDispatchInternalIOCTL(f890fe80) : fdo=81b1aac0, Irp=81b4fe48, IRQL=2
[917854 ms]  >>>  URB 432 going down  >>> 
-- URB_FUNCTION_BULK_OR_INTERRUPT_TRANSFER:
  PipeHandle           = 822e77f4 [endpoint 0x00000002]
  TransferFlags        = 00000000 (USBD_TRANSFER_DIRECTION_OUT, ~USBD_SHORT_TRANSFER_OK)
  TransferBufferLength = 00000007
  TransferBuffer       = 00000000
  TransferBufferMDL    = 81ceef88
    00000000: 00 00 00 02 05 e0 00
  UrbLink              = 00000000
[917855 ms] UsbSnoop - MyInternalIOCTLCompletion(f890fdb0) : fido=81b19728, Irp=81b4fe48, Context=81b223d8, IRQL=2
[917855 ms]  <<<  URB 432 coming back  <<< 
-- URB_FUNCTION_BULK_OR_INTERRUPT_TRANSFER:
  PipeHandle           = 822e77f4 [endpoint 0x00000002]
  TransferFlags        = 00000000 (USBD_TRANSFER_DIRECTION_OUT, ~USBD_SHORT_TRANSFER_OK)
  TransferBufferLength = 00000007
  TransferBuffer       = 00000000
  TransferBufferMDL    = 81ceef88
  UrbLink              = 00000000
[918113 ms] UsbSnoop - DispatchAny(f890e610) : IRP_MJ_INTERNAL_DEVICE_CONTROL
[918113 ms] UsbSnoop - MyDispatchInternalIOCTL(f890fe80) : fdo=81b1aac0, Irp=81b4fe48, IRQL=2
[918113 ms]  >>>  URB 433 going down  >>> 
-- URB_FUNCTION_BULK_OR_INTERRUPT_TRANSFER:
  PipeHandle           = 822e77f4 [endpoint 0x00000002]
  TransferFlags        = 00000000 (USBD_TRANSFER_DIRECTION_OUT, ~USBD_SHORT_TRANSFER_OK)
  TransferBufferLength = 00000009
  TransferBuffer       = 00000000
  TransferBufferMDL    = 81ceef88
    00000000: 00 00 00 04 01 00 00 04 00
  UrbLink              = 00000000
[918113 ms] UsbSnoop - MyInternalIOCTLCompletion(f890fdb0) : fido=81b19728, Irp=81b4fe48, Context=81d44d98, IRQL=2
[918113 ms]  <<<  URB 433 coming back  <<< 
-- URB_FUNCTION_BULK_OR_INTERRUPT_TRANSFER:
  PipeHandle           = 822e77f4 [endpoint 0x00000002]
  TransferFlags        = 00000000 (USBD_TRANSFER_DIRECTION_OUT, ~USBD_SHORT_TRANSFER_OK)
  TransferBufferLength = 00000009
  TransferBuffer       = 00000000
  TransferBufferMDL    = 81ceef88
  UrbLink              = 00000000
[918113 ms] UsbSnoop - DispatchAny(f890e610) : IRP_MJ_INTERNAL_DEVICE_CONTROL
[918113 ms] UsbSnoop - MyDispatchInternalIOCTL(f890fe80) : fdo=81b1aac0, Irp=81b4fe48, IRQL=2
[918113 ms]  >>>  URB 434 going down  >>> 
-- URB_FUNCTION_BULK_OR_INTERRUPT_TRANSFER:
  PipeHandle           = 822e77d4 [endpoint 0x00000081]
  TransferFlags        = 00000003 (USBD_TRANSFER_DIRECTION_IN, USBD_SHORT_TRANSFER_OK)
  TransferBufferLength = 00000100
  TransferBuffer       = 00000000
  TransferBufferMDL    = 81ceef88
  UrbLink              = 00000000
[918122 ms] UsbSnoop - MyInternalIOCTLCompletion(f890fdb0) : fido=81b19728, Irp=81b4fe48, Context=821d0b40, IRQL=2
[918122 ms]  <<<  URB 434 coming back  <<< 
-- URB_FUNCTION_BULK_OR_INTERRUPT_TRANSFER:
  PipeHandle           = 822e77d4 [endpoint 0x00000081]
  TransferFlags        = 00000003 (USBD_TRANSFER_DIRECTION_IN, USBD_SHORT_TRANSFER_OK)
  TransferBufferLength = 00000009
  TransferBuffer       = 00000000
  TransferBufferMDL    = 81ceef88
    00000000: 00 00 00 04 02 00 00 00 fa
  UrbLink              = 00000000
[918143 ms] UsbSnoop - DispatchAny(f890e610) : IRP_MJ_INTERNAL_DEVICE_CONTROL
[918143 ms] UsbSnoop - MyDispatchInternalIOCTL(f890fe80) : fdo=81b1aac0, Irp=81b4fe48, IRQL=2
[918143 ms]  >>>  URB 435 going down  >>> 
-- URB_FUNCTION_BULK_OR_INTERRUPT_TRANSFER:
  PipeHandle           = 822e77f4 [endpoint 0x00000002]
  TransferFlags        = 00000000 (USBD_TRANSFER_DIRECTION_OUT, ~USBD_SHORT_TRANSFER_OK)
  TransferBufferLength = 00000015
  TransferBuffer       = 00000000
  TransferBufferMDL    = 81ceef88
    00000000: 00 00 00 10 04 00 00 00 0a 00 01 00 03 00 01 00
    00000010: 00 00 00 07 d0
  UrbLink              = 00000000
[918143 ms] UsbSnoop - MyInternalIOCTLCompletion(f890fdb0) : fido=81b19728, Irp=81b4fe48, Context=82307450, IRQL=2
[918143 ms]  <<<  URB 435 coming back  <<< 
-- URB_FUNCTION_BULK_OR_INTERRUPT_TRANSFER:
  PipeHandle           = 822e77f4 [endpoint 0x00000002]
  TransferFlags        = 00000000 (USBD_TRANSFER_DIRECTION_OUT, ~USBD_SHORT_TRANSFER_OK)
  TransferBufferLength = 00000015
  TransferBuffer       = 00000000
  TransferBufferMDL    = 81ceef88
  UrbLink              = 00000000
[918153 ms] UsbSnoop - DispatchAny(f890e610) : IRP_MJ_INTERNAL_DEVICE_CONTROL
[918153 ms] UsbSnoop - MyDispatchInternalIOCTL(f890fe80) : fdo=81b1aac0, Irp=81b4fe48, IRQL=2
[918153 ms]  >>>  URB 436 going down  >>> 
-- URB_FUNCTION_BULK_OR_INTERRUPT_TRANSFER:
  PipeHandle           = 822e77d4 [endpoint 0x00000081]
  TransferFlags        = 00000003 (USBD_TRANSFER_DIRECTION_IN, USBD_SHORT_TRANSFER_OK)
  TransferBufferLength = 00000100
  TransferBuffer       = 00000000
  TransferBufferMDL    = 81ceef88
  UrbLink              = 00000000
[918153 ms] UsbSnoop - MyInternalIOCTLCompletion(f890fdb0) : fido=81b19728, Irp=81b4fe48, Context=81b223d8, IRQL=2
[918153 ms]  <<<  URB 436 coming back  <<< 
-- URB_FUNCTION_BULK_OR_INTERRUPT_TRANSFER:
  PipeHandle           = 822e77d4 [endpoint 0x00000081]
  TransferFlags        = 00000003 (USBD_TRANSFER_DIRECTION_IN, USBD_SHORT_TRANSFER_OK)
  TransferBufferLength = 00000007
  TransferBuffer       = 00000000
  TransferBufferMDL    = 81ceef88
    00000000: 00 00 00 02 05 e0 00
  UrbLink              = 00000000
[918193 ms] UsbSnoop - DispatchAny(f890e610) : IRP_MJ_INTERNAL_DEVICE_CONTROL
[918193 ms] UsbSnoop - MyDispatchInternalIOCTL(f890fe80) : fdo=81b1aac0, Irp=81b4fe48, IRQL=2
[918193 ms]  >>>  URB 437 going down  >>> 
-- URB_FUNCTION_BULK_OR_INTERRUPT_TRANSFER:
  PipeHandle           = 822e77d4 [endpoint 0x00000081]
  TransferFlags        = 00000003 (USBD_TRANSFER_DIRECTION_IN, USBD_SHORT_TRANSFER_OK)
  TransferBufferLength = 00000100
  TransferBuffer       = 00000000
  TransferBufferMDL    = 81ceef88
  UrbLink              = 00000000
[918193 ms] UsbSnoop - MyInternalIOCTLCompletion(f890fdb0) : fido=81b19728, Irp=81b4fe48, Context=82307450, IRQL=2
[918193 ms]  <<<  URB 437 coming back  <<< 
-- URB_FUNCTION_BULK_OR_INTERRUPT_TRANSFER:
  PipeHandle           = 822e77d4 [endpoint 0x00000081]
  TransferFlags        = 00000003 (USBD_TRANSFER_DIRECTION_IN, USBD_SHORT_TRANSFER_OK)
  TransferBufferLength = 0000000f
  TransferBuffer       = 00000000
  TransferBufferMDL    = 81ceef88
    00000000: 00 00 00 0a 04 00 00 00 04 00 12 00 00 07 d0
  UrbLink              = 00000000
[918233 ms] UsbSnoop - DispatchAny(f890e610) : IRP_MJ_INTERNAL_DEVICE_CONTROL
[918233 ms] UsbSnoop - MyDispatchInternalIOCTL(f890fe80) : fdo=81b1aac0, Irp=81b4fe48, IRQL=2
[918233 ms]  >>>  URB 438 going down  >>> 
-- URB_FUNCTION_BULK_OR_INTERRUPT_TRANSFER:
  PipeHandle           = 822e77f4 [endpoint 0x00000002]
  TransferFlags        = 00000000 (USBD_TRANSFER_DIRECTION_OUT, ~USBD_SHORT_TRANSFER_OK)
  TransferBufferLength = 00000007
  TransferBuffer       = 00000000
  TransferBufferMDL    = 81ceef88
    00000000: 00 00 00 02 05 e0 00
  UrbLink              = 00000000
[918233 ms] UsbSnoop - MyInternalIOCTLCompletion(f890fdb0) : fido=81b19728, Irp=81b4fe48, Context=822f37e8, IRQL=2
[918233 ms]  <<<  URB 438 coming back  <<< 
-- URB_FUNCTION_BULK_OR_INTERRUPT_TRANSFER:
  PipeHandle           = 822e77f4 [endpoint 0x00000002]
  TransferFlags        = 00000000 (USBD_TRANSFER_DIRECTION_OUT, ~USBD_SHORT_TRANSFER_OK)
  TransferBufferLength = 00000007
  TransferBuffer       = 00000000
  TransferBufferMDL    = 81ceef88
  UrbLink              = 00000000
[918243 ms] UsbSnoop - DispatchAny(f890e610) : IRP_MJ_INTERNAL_DEVICE_CONTROL
[918243 ms] UsbSnoop - MyDispatchInternalIOCTL(f890fe80) : fdo=81b1aac0, Irp=81b4fe48, IRQL=2
[918243 ms]  >>>  URB 439 going down  >>> 
-- URB_FUNCTION_BULK_OR_INTERRUPT_TRANSFER:
  PipeHandle           = 822e77f4 [endpoint 0x00000002]
  TransferFlags        = 00000000 (USBD_TRANSFER_DIRECTION_OUT, ~USBD_SHORT_TRANSFER_OK)
  TransferBufferLength = 0000000f
  TransferBuffer       = 00000000
  TransferBufferMDL    = 81ceef88
    00000000: 00 00 00 0a 04 00 00 00 04 00 07 00 01 00 31
  UrbLink              = 00000000
[918243 ms] UsbSnoop - MyInternalIOCTLCompletion(f890fdb0) : fido=81b19728, Irp=81b4fe48, Context=821d0b40, IRQL=2
[918243 ms]  <<<  URB 439 coming back  <<< 
-- URB_FUNCTION_BULK_OR_INTERRUPT_TRANSFER:
  PipeHandle           = 822e77f4 [endpoint 0x00000002]
  TransferFlags        = 00000000 (USBD_TRANSFER_DIRECTION_OUT, ~USBD_SHORT_TRANSFER_OK)
  TransferBufferLength = 0000000f
  TransferBuffer       = 00000000
  TransferBufferMDL    = 81ceef88
  UrbLink              = 00000000
[918253 ms] UsbSnoop - DispatchAny(f890e610) : IRP_MJ_INTERNAL_DEVICE_CONTROL
[918253 ms] UsbSnoop - MyDispatchInternalIOCTL(f890fe80) : fdo=81b1aac0, Irp=81b4fe48, IRQL=2
[918253 ms]  >>>  URB 440 going down  >>> 
-- URB_FUNCTION_BULK_OR_INTERRUPT_TRANSFER:
  PipeHandle           = 822e77d4 [endpoint 0x00000081]
  TransferFlags        = 00000003 (USBD_TRANSFER_DIRECTION_IN, USBD_SHORT_TRANSFER_OK)
  TransferBufferLength = 00000100
  TransferBuffer       = 00000000
  TransferBufferMDL    = 81ceef88
  UrbLink              = 00000000
[918253 ms] UsbSnoop - MyInternalIOCTLCompletion(f890fdb0) : fido=81b19728, Irp=81b4fe48, Context=821d0b40, IRQL=2
[918253 ms]  <<<  URB 440 coming back  <<< 
-- URB_FUNCTION_BULK_OR_INTERRUPT_TRANSFER:
  PipeHandle           = 822e77d4 [endpoint 0x00000081]
  TransferFlags        = 00000003 (USBD_TRANSFER_DIRECTION_IN, USBD_SHORT_TRANSFER_OK)
  TransferBufferLength = 00000007
  TransferBuffer       = 00000000
  TransferBufferMDL    = 81ceef88
    00000000: 00 00 00 02 05 e0 00
  UrbLink              = 00000000
[918293 ms] UsbSnoop - DispatchAny(f890e610) : IRP_MJ_INTERNAL_DEVICE_CONTROL
[918293 ms] UsbSnoop - MyDispatchInternalIOCTL(f890fe80) : fdo=81b1aac0, Irp=81b4fe48, IRQL=2
[918293 ms]  >>>  URB 441 going down  >>> 
-- URB_FUNCTION_BULK_OR_INTERRUPT_TRANSFER:
  PipeHandle           = 822e77d4 [endpoint 0x00000081]
  TransferFlags        = 00000003 (USBD_TRANSFER_DIRECTION_IN, USBD_SHORT_TRANSFER_OK)
  TransferBufferLength = 00000100
  TransferBuffer       = 00000000
  TransferBufferMDL    = 81ceef88
  UrbLink              = 00000000
[918293 ms] UsbSnoop - MyInternalIOCTLCompletion(f890fdb0) : fido=81b19728, Irp=81b4fe48, Context=822f37e8, IRQL=2
[918293 ms]  <<<  URB 441 coming back  <<< 
-- URB_FUNCTION_BULK_OR_INTERRUPT_TRANSFER:
  PipeHandle           = 822e77d4 [endpoint 0x00000081]
  TransferFlags        = 00000003 (USBD_TRANSFER_DIRECTION_IN, USBD_SHORT_TRANSFER_OK)
  TransferBufferLength = 0000000f
  TransferBuffer       = 00000000
  TransferBufferMDL    = 81ceef88
    00000000: 00 00 00 0a 04 00 00 00 04 bb 00 00 01 d4 c0
  UrbLink              = 00000000
[918333 ms] UsbSnoop - DispatchAny(f890e610) : IRP_MJ_INTERNAL_DEVICE_CONTROL
[918333 ms] UsbSnoop - MyDispatchInternalIOCTL(f890fe80) : fdo=81b1aac0, Irp=81b4fe48, IRQL=2
[918333 ms]  >>>  URB 442 going down  >>> 
-- URB_FUNCTION_BULK_OR_INTERRUPT_TRANSFER:
  PipeHandle           = 822e77f4 [endpoint 0x00000002]
  TransferFlags        = 00000000 (USBD_TRANSFER_DIRECTION_OUT, ~USBD_SHORT_TRANSFER_OK)
  TransferBufferLength = 00000007
  TransferBuffer       = 00000000
  TransferBufferMDL    = 81ceef88
    00000000: 00 00 00 02 05 e0 00
  UrbLink              = 00000000
[918333 ms] UsbSnoop - MyInternalIOCTLCompletion(f890fdb0) : fido=81b19728, Irp=81b4fe48, Context=81b223d8, IRQL=2
[918333 ms]  <<<  URB 442 coming back  <<< 
-- URB_FUNCTION_BULK_OR_INTERRUPT_TRANSFER:
  PipeHandle           = 822e77f4 [endpoint 0x00000002]
  TransferFlags        = 00000000 (USBD_TRANSFER_DIRECTION_OUT, ~USBD_SHORT_TRANSFER_OK)
  TransferBufferLength = 00000007
  TransferBuffer       = 00000000
  TransferBufferMDL    = 81ceef88
  UrbLink              = 00000000
[918343 ms] UsbSnoop - DispatchAny(f890e610) : IRP_MJ_INTERNAL_DEVICE_CONTROL
[918343 ms] UsbSnoop - MyDispatchInternalIOCTL(f890fe80) : fdo=81b1aac0, Irp=81b4fe48, IRQL=2
[918343 ms]  >>>  URB 443 going down  >>> 
-- URB_FUNCTION_BULK_OR_INTERRUPT_TRANSFER:
  PipeHandle           = 822e77d4 [endpoint 0x00000081]
  TransferFlags        = 00000003 (USBD_TRANSFER_DIRECTION_IN, USBD_SHORT_TRANSFER_OK)
  TransferBufferLength = 00000100
  TransferBuffer       = 00000000
  TransferBufferMDL    = 81ceef88
  UrbLink              = 00000000
[926845 ms] UsbSnoop - MyInternalIOCTLCompletion(f890fdb0) : fido=81b19728, Irp=81b4fe48, Context=821d0b40, IRQL=2
[926845 ms]  <<<  URB 443 coming back  <<< 
-- URB_FUNCTION_BULK_OR_INTERRUPT_TRANSFER:
  PipeHandle           = 822e77d4 [endpoint 0x00000081]
  TransferFlags        = 00000003 (USBD_TRANSFER_DIRECTION_IN, USBD_SHORT_TRANSFER_OK)
  TransferBufferLength = 000000ff
  TransferBuffer       = 00000000
  TransferBufferMDL    = 81ceef88
    00000000: 00 00 00 fa 03 00 00 04 6e 00 08 00 01 00 31 00
    00000010: 04 67 0a 15 0a 32 cc e3 01 0a 2d 40 00 00 00 00
    00000020: 00 00 00 00 00 00 00 00 00 00 00 00 00 00 00 00
    00000030: 00 00 00 00 00 00 00 00 00 00 00 00 00 00 00 00
    00000040: 00 00 00 00 00 00 00 00 00 00 00 00 00 00 00 00
    00000050: 00 00 00 00 00 00 00 00 00 00 00 00 04 12 21 18
    00000060: 03 26 09 04 0b d4 31 b0 02 0d 40 a4 f7 87 78 b9
    00000070: da 56 1a 21 97 57 2e 90 de 87 7a 0b 6c 5f 63 2c
    00000080: 01 8a 32 17 9b 65 73 af b1 a1 1b 2f 0c 0b 67 b8
    00000090: f7 84 22 44 04 bd 33 76 f8 06 2e 82 57 ff 63 a1
    000000a0: c9 27 8e f4 46 8e b1 ea 96 c3 9a 80 0f 00 00 00
    000000b0: 00 80 11 0a 80 21 02 80 31 28 80 a1 03 80 81 12
    000000c0: 80 7f 00 00 00 00 80 0f 00 00 6c 24 80 12 01 04
    000000d0: 80 21 01 80 31 01 80 48 43 42 4c 45 78 70 6d 74
    000000e0: 80 81 02 80 90 03 26 09 04 05 39 d3 85 02 0d 40
    000000f0: 2b 80 80 bf f0 a4 96 2e 7b 40 eb cf 73 9d a7
  UrbLink              = 00000000
[926888 ms] UsbSnoop - DispatchAny(f890e610) : IRP_MJ_INTERNAL_DEVICE_CONTROL
[926888 ms] UsbSnoop - MyDispatchInternalIOCTL(f890fe80) : fdo=81b1aac0, Irp=81b4fe48, IRQL=2
[926888 ms]  >>>  URB 444 going down  >>> 
-- URB_FUNCTION_BULK_OR_INTERRUPT_TRANSFER:
  PipeHandle           = 822e77f4 [endpoint 0x00000002]
  TransferFlags        = 00000000 (USBD_TRANSFER_DIRECTION_OUT, ~USBD_SHORT_TRANSFER_OK)
  TransferBufferLength = 00000007
  TransferBuffer       = 00000000
  TransferBufferMDL    = 81ceef88
    00000000: 00 00 00 02 05 e0 00
  UrbLink              = 00000000
[926888 ms] UsbSnoop - MyInternalIOCTLCompletion(f890fdb0) : fido=81b19728, Irp=81b4fe48, Context=81b374a8, IRQL=2
[926888 ms]  <<<  URB 444 coming back  <<< 
-- URB_FUNCTION_BULK_OR_INTERRUPT_TRANSFER:
  PipeHandle           = 822e77f4 [endpoint 0x00000002]
  TransferFlags        = 00000000 (USBD_TRANSFER_DIRECTION_OUT, ~USBD_SHORT_TRANSFER_OK)
  TransferBufferLength = 00000007
  TransferBuffer       = 00000000
  TransferBufferMDL    = 81ceef88
  UrbLink              = 00000000
[926897 ms] UsbSnoop - DispatchAny(f890e610) : IRP_MJ_INTERNAL_DEVICE_CONTROL
[926897 ms] UsbSnoop - MyDispatchInternalIOCTL(f890fe80) : fdo=81b1aac0, Irp=81b4fe48, IRQL=2
[926897 ms]  >>>  URB 445 going down  >>> 
-- URB_FUNCTION_BULK_OR_INTERRUPT_TRANSFER:
  PipeHandle           = 822e77d4 [endpoint 0x00000081]
  TransferFlags        = 00000003 (USBD_TRANSFER_DIRECTION_IN, USBD_SHORT_TRANSFER_OK)
  TransferBufferLength = 00000100
  TransferBuffer       = 00000000
  TransferBufferMDL    = 81ceef88
  UrbLink              = 00000000
[926919 ms] UsbSnoop - MyInternalIOCTLCompletion(f890fdb0) : fido=81b19728, Irp=81b4fe48, Context=821d0b40, IRQL=2
[926919 ms]  <<<  URB 445 coming back  <<< 
-- URB_FUNCTION_BULK_OR_INTERRUPT_TRANSFER:
  PipeHandle           = 822e77d4 [endpoint 0x00000081]
  TransferFlags        = 00000003 (USBD_TRANSFER_DIRECTION_IN, USBD_SHORT_TRANSFER_OK)
  TransferBufferLength = 000000ff
  TransferBuffer       = 00000000
  TransferBufferMDL    = 81ceef88
    00000000: 00 00 00 fa 03 9e ed 50 e1 60 26 bb f9 0f a4 20
    00000010: 2c 65 f3 0c 4c bc 85 be b9 9a af 73 54 bb bd 67
    00000020: f6 f9 9e 4a bd 5b 2f 3a 75 c2 50 cd 7a c7 07 30
    00000030: b5 aa 40 f0 1e 90 80 7f 00 00 00 00 02 0d 40 ad
    00000040: 9b d6 89 35 66 67 aa d3 23 39 d1 3d 55 0f 30 68
    00000050: 58 a7 ae e9 89 bd c2 2d a6 48 a4 0b ba 55 a1 d7
    00000060: 8b ac 39 fe 5c 8a 16 a1 38 f9 e8 55 62 a0 95 c5
    00000070: 95 ef d2 a2 58 ae 08 22 89 79 62 75 eb fc 13 ff
    00000080: ff ff ff ff ff ff ff ff ff ff ff ff ff ff ff ff
    00000090: ff ff ff ff ff ff ff ff ff ff ff ff ff ff ff ff
    000000a0: ff ff ff ff ff ff ff ff ff ff ff ff ff ff ff ff
    000000b0: ff ff ff ff ff ff ff ff ff ff ff ff ff ff ff ff
    000000c0: ff ff ff ff ff ff ff ff ff ff ff ff ff ff ff ff
    000000d0: ff ff ff ff ff ff ff ff ff ff ff ff ff ff ff ff
    000000e0: ff ff ff ff ff ff ff ff ff ff ff ff ff ff ff ff
    000000f0: ff ff ff ff ff ff ff ff ff ff ff ff ff ff ff
  UrbLink              = 00000000
[926957 ms] UsbSnoop - DispatchAny(f890e610) : IRP_MJ_INTERNAL_DEVICE_CONTROL
[926957 ms] UsbSnoop - MyDispatchInternalIOCTL(f890fe80) : fdo=81b1aac0, Irp=81b4fe48, IRQL=2
[926957 ms]  >>>  URB 446 going down  >>> 
-- URB_FUNCTION_BULK_OR_INTERRUPT_TRANSFER:
  PipeHandle           = 822e77f4 [endpoint 0x00000002]
  TransferFlags        = 00000000 (USBD_TRANSFER_DIRECTION_OUT, ~USBD_SHORT_TRANSFER_OK)
  TransferBufferLength = 00000007
  TransferBuffer       = 00000000
  TransferBufferMDL    = 81ceef88
    00000000: 00 00 00 02 05 e0 00
  UrbLink              = 00000000
[926957 ms] UsbSnoop - MyInternalIOCTLCompletion(f890fdb0) : fido=81b19728, Irp=81b4fe48, Context=822fea10, IRQL=2
[926957 ms]  <<<  URB 446 coming back  <<< 
-- URB_FUNCTION_BULK_OR_INTERRUPT_TRANSFER:
  PipeHandle           = 822e77f4 [endpoint 0x00000002]
  TransferFlags        = 00000000 (USBD_TRANSFER_DIRECTION_OUT, ~USBD_SHORT_TRANSFER_OK)
  TransferBufferLength = 00000007
  TransferBuffer       = 00000000
  TransferBufferMDL    = 81ceef88
  UrbLink              = 00000000
[926967 ms] UsbSnoop - DispatchAny(f890e610) : IRP_MJ_INTERNAL_DEVICE_CONTROL
[926967 ms] UsbSnoop - MyDispatchInternalIOCTL(f890fe80) : fdo=81b1aac0, Irp=81b4fe48, IRQL=2
[926967 ms]  >>>  URB 447 going down  >>> 
-- URB_FUNCTION_BULK_OR_INTERRUPT_TRANSFER:
  PipeHandle           = 822e77d4 [endpoint 0x00000081]
  TransferFlags        = 00000003 (USBD_TRANSFER_DIRECTION_IN, USBD_SHORT_TRANSFER_OK)
  TransferBufferLength = 00000100
  TransferBuffer       = 00000000
  TransferBufferMDL    = 81ceef88
  UrbLink              = 00000000
[926988 ms] UsbSnoop - MyInternalIOCTLCompletion(f890fdb0) : fido=81b19728, Irp=81b4fe48, Context=81b223d8, IRQL=2
[926988 ms]  <<<  URB 447 coming back  <<< 
-- URB_FUNCTION_BULK_OR_INTERRUPT_TRANSFER:
  PipeHandle           = 822e77d4 [endpoint 0x00000081]
  TransferFlags        = 00000003 (USBD_TRANSFER_DIRECTION_IN, USBD_SHORT_TRANSFER_OK)
  TransferBufferLength = 000000ff
  TransferBuffer       = 00000000
  TransferBufferMDL    = 81ceef88
    00000000: 00 00 00 fa 03 ff ff ff ff ff ff ff ff ff ff ff
    00000010: ff ff ff ff ff ff ff ff ff ff ff ff ff ff ff ff
    00000020: ff ff ff ff ff ff ff ff ff ff ff ff ff ff ff ff
    00000030: ff ff ff ff ff ff ff ff ff ff ff ff ff ff ff ff
    00000040: ff ff ff ff ff ff ff ff ff ff ff ff ff ff ff ff
    00000050: ff ff ff ff ff ff ff ff ff ff ff ff ff ff ff ff
    00000060: ff ff ff ff ff ff ff ff ff ff ff ff ff ff ff ff
    00000070: ff ff ff ff ff ff ff ff ff ff ff ff ff ff ff ff
    00000080: ff ff ff ff ff ff ff ff ff ff ff ff ff ff ff ff
    00000090: ff ff ff ff ff ff ff ff ff ff ff ff ff ff ff ff
    000000a0: ff ff ff ff ff ff ff ff ff ff ff ff ff ff ff ff
    000000b0: ff ff ff ff ff ff ff ff ff ff ff ff ff ff ff ff
    000000c0: ff ff ff ff ff ff ff ff ff ff ff ff ff ff ff ff
    000000d0: ff ff ff ff ff 80 00 ff ff ff ff ff ff ff ff ff
    000000e0: ff ff ff ff ff ff ff ff ff ff ff ff ff ff ff ff
    000000f0: ff ff ff ff ff ff ff ff ff ff ff ff ff ff ff
  UrbLink              = 00000000
[927027 ms] UsbSnoop - DispatchAny(f890e610) : IRP_MJ_INTERNAL_DEVICE_CONTROL
[927027 ms] UsbSnoop - MyDispatchInternalIOCTL(f890fe80) : fdo=81b1aac0, Irp=81b4fe48, IRQL=2
[927027 ms]  >>>  URB 448 going down  >>> 
-- URB_FUNCTION_BULK_OR_INTERRUPT_TRANSFER:
  PipeHandle           = 822e77f4 [endpoint 0x00000002]
  TransferFlags        = 00000000 (USBD_TRANSFER_DIRECTION_OUT, ~USBD_SHORT_TRANSFER_OK)
  TransferBufferLength = 00000007
  TransferBuffer       = 00000000
  TransferBufferMDL    = 81ceef88
    00000000: 00 00 00 02 05 e0 00
  UrbLink              = 00000000
[927027 ms] UsbSnoop - MyInternalIOCTLCompletion(f890fdb0) : fido=81b19728, Irp=81b4fe48, Context=821d0b40, IRQL=2
[927027 ms]  <<<  URB 448 coming back  <<< 
-- URB_FUNCTION_BULK_OR_INTERRUPT_TRANSFER:
  PipeHandle           = 822e77f4 [endpoint 0x00000002]
  TransferFlags        = 00000000 (USBD_TRANSFER_DIRECTION_OUT, ~USBD_SHORT_TRANSFER_OK)
  TransferBufferLength = 00000007
  TransferBuffer       = 00000000
  TransferBufferMDL    = 81ceef88
  UrbLink              = 00000000
[927037 ms] UsbSnoop - DispatchAny(f890e610) : IRP_MJ_INTERNAL_DEVICE_CONTROL
[927037 ms] UsbSnoop - MyDispatchInternalIOCTL(f890fe80) : fdo=81b1aac0, Irp=81b4fe48, IRQL=2
[927037 ms]  >>>  URB 449 going down  >>> 
-- URB_FUNCTION_BULK_OR_INTERRUPT_TRANSFER:
  PipeHandle           = 822e77d4 [endpoint 0x00000081]
  TransferFlags        = 00000003 (USBD_TRANSFER_DIRECTION_IN, USBD_SHORT_TRANSFER_OK)
  TransferBufferLength = 00000100
  TransferBuffer       = 00000000
  TransferBufferMDL    = 81ceef88
  UrbLink              = 00000000
[927058 ms] UsbSnoop - MyInternalIOCTLCompletion(f890fdb0) : fido=81b19728, Irp=81b4fe48, Context=81b223d8, IRQL=2
[927058 ms]  <<<  URB 449 coming back  <<< 
-- URB_FUNCTION_BULK_OR_INTERRUPT_TRANSFER:
  PipeHandle           = 822e77d4 [endpoint 0x00000081]
  TransferFlags        = 00000003 (USBD_TRANSFER_DIRECTION_IN, USBD_SHORT_TRANSFER_OK)
  TransferBufferLength = 000000ff
  TransferBuffer       = 00000000
  TransferBufferMDL    = 81ceef88
    00000000: 00 00 00 fa 03 ff ff ff ff ff ff ff ff ff ff ff
    00000010: ff ff ff ff ff ff ff ff ff ff ff ff ff ff ff ff
    00000020: ff ff ff ff ff ff ff ff ff ff ff ff ff ff ff ff
    00000030: ff ff ff ff ff ff ff ff ff ff ff ff ff ff ff ff
    00000040: ff ff ff ff ff ff ff ff ff ff ff ff ff ff ff ff
    00000050: ff ff ff ff ff ff ff ff ff ff ff ff ff ff ff ff
    00000060: ff ff ff ff ff ff ff ff ff ff ff ff ff ff ff ff
    00000070: ff ff ff ff ff ff ff ff ff ff ff ff ff ff ff ff
    00000080: ff ff ff ff ff ff ff ff ff ff ff ff ff ff ff ff
    00000090: ff ff ff ff ff ff ff ff ff ff ff ff ff ff ff ff
    000000a0: ff ff ff ff ff ff ff ff ff ff ff ff ff ff ff ff
    000000b0: ff ff ff ff ff ff ff ff ff ff ff ff ff ff ff ff
    000000c0: ff ff ff ff ff ff ff ff ff ff ff ff ff ff ff ff
    000000d0: ff ff ff ff ff ff ff ff ff ff ff ff ff ff ff ff
    000000e0: ff ff ff ff ff ff ff ff ff ff ff ff ff ff ff ff
    000000f0: ff ff ff ff ff ff ff ff ff ff ff ff ff ff ff
  UrbLink              = 00000000
[927097 ms] UsbSnoop - DispatchAny(f890e610) : IRP_MJ_INTERNAL_DEVICE_CONTROL
[927097 ms] UsbSnoop - MyDispatchInternalIOCTL(f890fe80) : fdo=81b1aac0, Irp=81b4fe48, IRQL=2
[927097 ms]  >>>  URB 450 going down  >>> 
-- URB_FUNCTION_BULK_OR_INTERRUPT_TRANSFER:
  PipeHandle           = 822e77f4 [endpoint 0x00000002]
  TransferFlags        = 00000000 (USBD_TRANSFER_DIRECTION_OUT, ~USBD_SHORT_TRANSFER_OK)
  TransferBufferLength = 00000007
  TransferBuffer       = 00000000
  TransferBufferMDL    = 81ceef88
    00000000: 00 00 00 02 05 e0 00
  UrbLink              = 00000000
[927097 ms] UsbSnoop - MyInternalIOCTLCompletion(f890fdb0) : fido=81b19728, Irp=81b4fe48, Context=81b374a8, IRQL=2
[927097 ms]  <<<  URB 450 coming back  <<< 
-- URB_FUNCTION_BULK_OR_INTERRUPT_TRANSFER:
  PipeHandle           = 822e77f4 [endpoint 0x00000002]
  TransferFlags        = 00000000 (USBD_TRANSFER_DIRECTION_OUT, ~USBD_SHORT_TRANSFER_OK)
  TransferBufferLength = 00000007
  TransferBuffer       = 00000000
  TransferBufferMDL    = 81ceef88
  UrbLink              = 00000000
[927107 ms] UsbSnoop - DispatchAny(f890e610) : IRP_MJ_INTERNAL_DEVICE_CONTROL
[927107 ms] UsbSnoop - MyDispatchInternalIOCTL(f890fe80) : fdo=81b1aac0, Irp=81b4fe48, IRQL=2
[927107 ms]  >>>  URB 451 going down  >>> 
-- URB_FUNCTION_BULK_OR_INTERRUPT_TRANSFER:
  PipeHandle           = 822e77d4 [endpoint 0x00000081]
  TransferFlags        = 00000003 (USBD_TRANSFER_DIRECTION_IN, USBD_SHORT_TRANSFER_OK)
  TransferBufferLength = 00000100
  TransferBuffer       = 00000000
  TransferBufferMDL    = 81ceef88
  UrbLink              = 00000000
[927646 ms] UsbSnoop - MyInternalIOCTLCompletion(f890fdb0) : fido=81b19728, Irp=81b4fe48, Context=81b223d8, IRQL=2
[927646 ms]  <<<  URB 451 coming back  <<< 
-- URB_FUNCTION_BULK_OR_INTERRUPT_TRANSFER:
  PipeHandle           = 822e77d4 [endpoint 0x00000081]
  TransferFlags        = 00000003 (USBD_TRANSFER_DIRECTION_IN, USBD_SHORT_TRANSFER_OK)
  TransferBufferLength = 00000091
  TransferBuffer       = 00000000
  TransferBufferMDL    = 81ceef88
    00000000: 00 00 00 8c 04 ff ff ff ff ff ff ff ff ff ff ff
    00000010: ff ff ff ff ff ff ff ff ff ff ff ff ff ff ff ff
    00000020: ff ff ff ff ff ff ff ff ff ff ff ff ff ff ff ff
    00000030: ff ff ff ff ff ff ff ff ff ff ff ff ff ff ff ff
    00000040: ff ff ff ff ff ff ff ff ff ff ff ff ff ff ff ff
    00000050: ff ff ff ff ff ff ff ff ff ff ff ff ff ff ff ff
    00000060: ff ff ff ff ff ff ff ff ff ff ff ff ff ff ff ff
    00000070: ff 00 00 00 00 00 00 00 00 00 00 00 00 fc ff ff
    00000080: ff ff ff ff ff ff ff ff ff ff ff ff ff ff ff ff
    00000090: ff
  UrbLink              = 00000000
[927678 ms] UsbSnoop - DispatchAny(f890e610) : IRP_MJ_INTERNAL_DEVICE_CONTROL
[927678 ms] UsbSnoop - MyDispatchInternalIOCTL(f890fe80) : fdo=81b1aac0, Irp=81b4fe48, IRQL=2
[927678 ms]  >>>  URB 452 going down  >>> 
-- URB_FUNCTION_BULK_OR_INTERRUPT_TRANSFER:
  PipeHandle           = 822e77f4 [endpoint 0x00000002]
  TransferFlags        = 00000000 (USBD_TRANSFER_DIRECTION_OUT, ~USBD_SHORT_TRANSFER_OK)
  TransferBufferLength = 00000007
  TransferBuffer       = 00000000
  TransferBufferMDL    = 81ceef88
    00000000: 00 00 00 02 05 e0 00
  UrbLink              = 00000000
[927678 ms] UsbSnoop - MyInternalIOCTLCompletion(f890fdb0) : fido=81b19728, Irp=81b4fe48, Context=821d0b40, IRQL=2
[927678 ms]  <<<  URB 452 coming back  <<< 
-- URB_FUNCTION_BULK_OR_INTERRUPT_TRANSFER:
  PipeHandle           = 822e77f4 [endpoint 0x00000002]
  TransferFlags        = 00000000 (USBD_TRANSFER_DIRECTION_OUT, ~USBD_SHORT_TRANSFER_OK)
  TransferBufferLength = 00000007
  TransferBuffer       = 00000000
  TransferBufferMDL    = 81ceef88
  UrbLink              = 00000000
