[417004 ms] UsbSnoop - DispatchAny(f88fe610) : IRP_MJ_INTERNAL_DEVICE_CONTROL
[417004 ms] UsbSnoop - MyDispatchInternalIOCTL(f88ffe80) : fdo=82141030, Irp=81d44e70, IRQL=0
[417004 ms]  >>>  URB 286 going down  >>> 
-- URB_FUNCTION_RESET_PIPE:
  PipeHandle = 81b38414 [endpoint 0x00000081]
[417013 ms] UsbSnoop - MyInternalIOCTLCompletion(f88ffdb0) : fido=00000000, Irp=81d44e70, Context=81c05390, IRQL=0
[417013 ms]  <<<  URB 286 coming back  <<< 
-- URB_FUNCTION_RESET_PIPE:
[417013 ms] UsbSnoop - DispatchAny(f88fe610) : IRP_MJ_INTERNAL_DEVICE_CONTROL
[417013 ms] UsbSnoop - MyDispatchInternalIOCTL(f88ffe80) : fdo=82141030, Irp=81d44e70, IRQL=0
[417013 ms]  >>>  URB 287 going down  >>> 
-- URB_FUNCTION_RESET_PIPE:
  PipeHandle = 81b38434 [endpoint 0x00000002]
[417022 ms] UsbSnoop - MyInternalIOCTLCompletion(f88ffdb0) : fido=00000000, Irp=81d44e70, Context=81c55e28, IRQL=0
[417022 ms]  <<<  URB 287 coming back  <<< 
-- URB_FUNCTION_RESET_PIPE:
[418016 ms] UsbSnoop - DispatchAny(f88fe610) : IRP_MJ_INTERNAL_DEVICE_CONTROL
[418016 ms] UsbSnoop - MyDispatchInternalIOCTL(f88ffe80) : fdo=82141030, Irp=81d44e70, IRQL=0
[418016 ms]  >>>  URB 288 going down  >>> 
-- URB_FUNCTION_RESET_PIPE:
  PipeHandle = 81b38414 [endpoint 0x00000081]
[418024 ms] UsbSnoop - MyInternalIOCTLCompletion(f88ffdb0) : fido=00000000, Irp=81d44e70, Context=81c55e28, IRQL=0
[418024 ms]  <<<  URB 288 coming back  <<< 
-- URB_FUNCTION_RESET_PIPE:
[418024 ms] UsbSnoop - DispatchAny(f88fe610) : IRP_MJ_INTERNAL_DEVICE_CONTROL
[418024 ms] UsbSnoop - MyDispatchInternalIOCTL(f88ffe80) : fdo=82141030, Irp=81d44e70, IRQL=0
[418024 ms]  >>>  URB 289 going down  >>> 
-- URB_FUNCTION_RESET_PIPE:
  PipeHandle = 81b38434 [endpoint 0x00000002]
[418024 ms] UsbSnoop - MyInternalIOCTLCompletion(f88ffdb0) : fido=00000000, Irp=81d44e70, Context=81bbd930, IRQL=0
[418024 ms]  <<<  URB 289 coming back  <<< 
-- URB_FUNCTION_RESET_PIPE:
[418024 ms] UsbSnoop - DispatchAny(f88fe610) : IRP_MJ_INTERNAL_DEVICE_CONTROL
[418024 ms] UsbSnoop - MyDispatchInternalIOCTL(f88ffe80) : fdo=82141030, Irp=81d44e70, IRQL=0
[419018 ms] UsbSnoop - DispatchAny(f88fe610) : IRP_MJ_INTERNAL_DEVICE_CONTROL
[419018 ms] UsbSnoop - MyDispatchInternalIOCTL(f88ffe80) : fdo=82141030, Irp=81d44e70, IRQL=0
[419018 ms]  >>>  URB 290 going down  >>> 
-- URB_FUNCTION_GET_DESCRIPTOR_FROM_DEVICE:
  TransferBufferLength = 00000012
  TransferBuffer       = e2dd2dd0
  TransferBufferMDL    = 00000000
  Index                = 00000000
  DescriptorType       = 00000001 (USB_DEVICE_DESCRIPTOR_TYPE)
  LanguageId           = 00000000
[419026 ms] UsbSnoop - MyInternalIOCTLCompletion(f88ffdb0) : fido=00000000, Irp=81d44e70, Context=81c20298, IRQL=2
[419026 ms]  <<<  URB 290 coming back  <<< 
-- URB_FUNCTION_CONTROL_TRANSFER:
  PipeHandle           = 82184a90
  TransferFlags        = 0000000b (USBD_TRANSFER_DIRECTION_IN, USBD_SHORT_TRANSFER_OK)
  TransferBufferLength = 00000012
  TransferBuffer       = e2dd2dd0
  TransferBufferMDL    = 81badf88
    00000000: 12 01 00 02 00 00 00 40 51 04 08 e0 10 01 01 02
    00000010: 00 01
  UrbLink              = 00000000
  SetupPacket          =
    00000000: 80 06 00 01 00 00 12 00
[419026 ms] UsbSnoop - DispatchAny(f88fe610) : IRP_MJ_INTERNAL_DEVICE_CONTROL
[419026 ms] UsbSnoop - MyDispatchInternalIOCTL(f88ffe80) : fdo=82141030, Irp=81d44e70, IRQL=0
[419027 ms] UsbSnoop - DispatchAny(f88fe610) : IRP_MJ_INTERNAL_DEVICE_CONTROL
[419027 ms] UsbSnoop - MyDispatchInternalIOCTL(f88ffe80) : fdo=82141030, Irp=81d44e70, IRQL=0
[419027 ms]  >>>  URB 291 going down  >>> 
-- URB_FUNCTION_RESET_PIPE:
  PipeHandle = 81b38414 [endpoint 0x00000081]
[419027 ms] UsbSnoop - MyInternalIOCTLCompletion(f88ffdb0) : fido=00000000, Irp=81d44e70, Context=81ba1d70, IRQL=0
[419027 ms]  <<<  URB 291 coming back  <<< 
-- URB_FUNCTION_RESET_PIPE:
[419027 ms] UsbSnoop - DispatchAny(f88fe610) : IRP_MJ_INTERNAL_DEVICE_CONTROL
[419027 ms] UsbSnoop - MyDispatchInternalIOCTL(f88ffe80) : fdo=82141030, Irp=81d44e70, IRQL=0
[419027 ms]  >>>  URB 292 going down  >>> 
-- URB_FUNCTION_RESET_PIPE:
  PipeHandle = 81b38434 [endpoint 0x00000002]
[419027 ms] UsbSnoop - MyInternalIOCTLCompletion(f88ffdb0) : fido=00000000, Irp=81d44e70, Context=81c55e28, IRQL=0
[419027 ms]  <<<  URB 292 coming back  <<< 
-- URB_FUNCTION_RESET_PIPE:
[420280 ms] UsbSnoop - DispatchAny(f88fe610) : IRP_MJ_INTERNAL_DEVICE_CONTROL
[420280 ms] UsbSnoop - MyDispatchInternalIOCTL(f88ffe80) : fdo=82141030, Irp=81d44e70, IRQL=2
[420280 ms]  >>>  URB 293 going down  >>> 
-- URB_FUNCTION_BULK_OR_INTERRUPT_TRANSFER:
  PipeHandle           = 81b38434 [endpoint 0x00000002]
  TransferFlags        = 00000000 (USBD_TRANSFER_DIRECTION_OUT, ~USBD_SHORT_TRANSFER_OK)
  TransferBufferLength = 00000009
  TransferBuffer       = 00000000
  TransferBufferMDL    = 8218ef88
    00000000: 00 00 00 04 01 00 00 04 00
  UrbLink              = 00000000
[420280 ms] UsbSnoop - MyInternalIOCTLCompletion(f88ffdb0) : fido=81b37020, Irp=81d44e70, Context=81bb4b80, IRQL=2
[420280 ms]  <<<  URB 293 coming back  <<< 
-- URB_FUNCTION_BULK_OR_INTERRUPT_TRANSFER:
  PipeHandle           = 81b38434 [endpoint 0x00000002]
  TransferFlags        = 00000000 (USBD_TRANSFER_DIRECTION_OUT, ~USBD_SHORT_TRANSFER_OK)
  TransferBufferLength = 00000009
  TransferBuffer       = 00000000
  TransferBufferMDL    = 8218ef88
  UrbLink              = 00000000
[420280 ms] UsbSnoop - DispatchAny(f88fe610) : IRP_MJ_INTERNAL_DEVICE_CONTROL
[420280 ms] UsbSnoop - MyDispatchInternalIOCTL(f88ffe80) : fdo=82141030, Irp=81d44e70, IRQL=2
[420280 ms]  >>>  URB 294 going down  >>> 
-- URB_FUNCTION_BULK_OR_INTERRUPT_TRANSFER:
  PipeHandle           = 81b38414 [endpoint 0x00000081]
  TransferFlags        = 00000003 (USBD_TRANSFER_DIRECTION_IN, USBD_SHORT_TRANSFER_OK)
  TransferBufferLength = 00000100
  TransferBuffer       = 00000000
  TransferBufferMDL    = 8218ef88
  UrbLink              = 00000000
[420293 ms] UsbSnoop - MyInternalIOCTLCompletion(f88ffdb0) : fido=81b37020, Irp=81d44e70, Context=81bb8478, IRQL=2
[420293 ms]  <<<  URB 294 coming back  <<< 
-- URB_FUNCTION_BULK_OR_INTERRUPT_TRANSFER:
  PipeHandle           = 81b38414 [endpoint 0x00000081]
  TransferFlags        = 00000003 (USBD_TRANSFER_DIRECTION_IN, USBD_SHORT_TRANSFER_OK)
  TransferBufferLength = 00000009
  TransferBuffer       = 00000000
  TransferBufferMDL    = 8218ef88
    00000000: 00 00 00 04 02 00 00 00 fa
  UrbLink              = 00000000
[420320 ms] UsbSnoop - DispatchAny(f88fe610) : IRP_MJ_INTERNAL_DEVICE_CONTROL
[420320 ms] UsbSnoop - MyDispatchInternalIOCTL(f88ffe80) : fdo=82141030, Irp=81d44e70, IRQL=2
[420320 ms]  >>>  URB 295 going down  >>> 
-- URB_FUNCTION_BULK_OR_INTERRUPT_TRANSFER:
  PipeHandle           = 81b38434 [endpoint 0x00000002]
  TransferFlags        = 00000000 (USBD_TRANSFER_DIRECTION_OUT, ~USBD_SHORT_TRANSFER_OK)
  TransferBufferLength = 00000015
  TransferBuffer       = 00000000
  TransferBufferMDL    = 8218ef88
    00000000: 00 00 00 10 04 00 00 00 0a 00 01 00 03 00 01 00
    00000010: 00 00 00 07 d0
  UrbLink              = 00000000
[420320 ms] UsbSnoop - MyInternalIOCTLCompletion(f88ffdb0) : fido=81b37020, Irp=81d44e70, Context=81bc60c8, IRQL=2
[420320 ms]  <<<  URB 295 coming back  <<< 
-- URB_FUNCTION_BULK_OR_INTERRUPT_TRANSFER:
  PipeHandle           = 81b38434 [endpoint 0x00000002]
  TransferFlags        = 00000000 (USBD_TRANSFER_DIRECTION_OUT, ~USBD_SHORT_TRANSFER_OK)
  TransferBufferLength = 00000015
  TransferBuffer       = 00000000
  TransferBufferMDL    = 8218ef88
  UrbLink              = 00000000
[420330 ms] UsbSnoop - DispatchAny(f88fe610) : IRP_MJ_INTERNAL_DEVICE_CONTROL
[420330 ms] UsbSnoop - MyDispatchInternalIOCTL(f88ffe80) : fdo=82141030, Irp=81d44e70, IRQL=2
[420330 ms]  >>>  URB 296 going down  >>> 
-- URB_FUNCTION_BULK_OR_INTERRUPT_TRANSFER:
  PipeHandle           = 81b38414 [endpoint 0x00000081]
  TransferFlags        = 00000003 (USBD_TRANSFER_DIRECTION_IN, USBD_SHORT_TRANSFER_OK)
  TransferBufferLength = 00000100
  TransferBuffer       = 00000000
  TransferBufferMDL    = 8218ef88
  UrbLink              = 00000000
[420330 ms] UsbSnoop - MyInternalIOCTLCompletion(f88ffdb0) : fido=81b37020, Irp=81d44e70, Context=81bb4b80, IRQL=2
[420330 ms]  <<<  URB 296 coming back  <<< 
-- URB_FUNCTION_BULK_OR_INTERRUPT_TRANSFER:
  PipeHandle           = 81b38414 [endpoint 0x00000081]
  TransferFlags        = 00000003 (USBD_TRANSFER_DIRECTION_IN, USBD_SHORT_TRANSFER_OK)
  TransferBufferLength = 00000007
  TransferBuffer       = 00000000
  TransferBufferMDL    = 8218ef88
    00000000: 00 00 00 02 05 e0 00
  UrbLink              = 00000000
[420370 ms] UsbSnoop - DispatchAny(f88fe610) : IRP_MJ_INTERNAL_DEVICE_CONTROL
[420370 ms] UsbSnoop - MyDispatchInternalIOCTL(f88ffe80) : fdo=82141030, Irp=81d44e70, IRQL=2
[420370 ms]  >>>  URB 297 going down  >>> 
-- URB_FUNCTION_BULK_OR_INTERRUPT_TRANSFER:
  PipeHandle           = 81b38414 [endpoint 0x00000081]
  TransferFlags        = 00000003 (USBD_TRANSFER_DIRECTION_IN, USBD_SHORT_TRANSFER_OK)
  TransferBufferLength = 00000100
  TransferBuffer       = 00000000
  TransferBufferMDL    = 8218ef88
  UrbLink              = 00000000
[420370 ms] UsbSnoop - MyInternalIOCTLCompletion(f88ffdb0) : fido=81b37020, Irp=81d44e70, Context=81bc60c8, IRQL=2
[420370 ms]  <<<  URB 297 coming back  <<< 
-- URB_FUNCTION_BULK_OR_INTERRUPT_TRANSFER:
  PipeHandle           = 81b38414 [endpoint 0x00000081]
  TransferFlags        = 00000003 (USBD_TRANSFER_DIRECTION_IN, USBD_SHORT_TRANSFER_OK)
  TransferBufferLength = 0000000f
  TransferBuffer       = 00000000
  TransferBufferMDL    = 8218ef88
    00000000: 00 00 00 0a 04 00 00 00 04 00 12 00 00 07 d0
  UrbLink              = 00000000
[420410 ms] UsbSnoop - DispatchAny(f88fe610) : IRP_MJ_INTERNAL_DEVICE_CONTROL
[420410 ms] UsbSnoop - MyDispatchInternalIOCTL(f88ffe80) : fdo=82141030, Irp=81d44e70, IRQL=2
[420410 ms]  >>>  URB 298 going down  >>> 
-- URB_FUNCTION_BULK_OR_INTERRUPT_TRANSFER:
  PipeHandle           = 81b38434 [endpoint 0x00000002]
  TransferFlags        = 00000000 (USBD_TRANSFER_DIRECTION_OUT, ~USBD_SHORT_TRANSFER_OK)
  TransferBufferLength = 00000007
  TransferBuffer       = 00000000
  TransferBufferMDL    = 8218ef88
    00000000: 00 00 00 02 05 e0 00
  UrbLink              = 00000000
[420410 ms] UsbSnoop - MyInternalIOCTLCompletion(f88ffdb0) : fido=81b37020, Irp=81d44e70, Context=81bbd930, IRQL=2
[420410 ms]  <<<  URB 298 coming back  <<< 
-- URB_FUNCTION_BULK_OR_INTERRUPT_TRANSFER:
  PipeHandle           = 81b38434 [endpoint 0x00000002]
  TransferFlags        = 00000000 (USBD_TRANSFER_DIRECTION_OUT, ~USBD_SHORT_TRANSFER_OK)
  TransferBufferLength = 00000007
  TransferBuffer       = 00000000
  TransferBufferMDL    = 8218ef88
  UrbLink              = 00000000
[420420 ms] UsbSnoop - DispatchAny(f88fe610) : IRP_MJ_INTERNAL_DEVICE_CONTROL
[420420 ms] UsbSnoop - MyDispatchInternalIOCTL(f88ffe80) : fdo=82141030, Irp=81d44e70, IRQL=2
[420420 ms]  >>>  URB 299 going down  >>> 
-- URB_FUNCTION_BULK_OR_INTERRUPT_TRANSFER:
  PipeHandle           = 81b38434 [endpoint 0x00000002]
  TransferFlags        = 00000000 (USBD_TRANSFER_DIRECTION_OUT, ~USBD_SHORT_TRANSFER_OK)
  TransferBufferLength = 00000015
  TransferBuffer       = 00000000
  TransferBufferMDL    = 8218ef88
    00000000: 00 00 00 10 04 00 00 00 0a 00 07 00 04 00 25 00
    00000010: 27 00 28 00 24
  UrbLink              = 00000000
[420420 ms] UsbSnoop - MyInternalIOCTLCompletion(f88ffdb0) : fido=81b37020, Irp=81d44e70, Context=81bb8478, IRQL=2
[420420 ms]  <<<  URB 299 coming back  <<< 
-- URB_FUNCTION_BULK_OR_INTERRUPT_TRANSFER:
  PipeHandle           = 81b38434 [endpoint 0x00000002]
  TransferFlags        = 00000000 (USBD_TRANSFER_DIRECTION_OUT, ~USBD_SHORT_TRANSFER_OK)
  TransferBufferLength = 00000015
  TransferBuffer       = 00000000
  TransferBufferMDL    = 8218ef88
  UrbLink              = 00000000
[420430 ms] UsbSnoop - DispatchAny(f88fe610) : IRP_MJ_INTERNAL_DEVICE_CONTROL
[420430 ms] UsbSnoop - MyDispatchInternalIOCTL(f88ffe80) : fdo=82141030, Irp=81b64008, IRQL=2
[420430 ms]  >>>  URB 300 going down  >>> 
-- URB_FUNCTION_BULK_OR_INTERRUPT_TRANSFER:
  PipeHandle           = 81b38414 [endpoint 0x00000081]
  TransferFlags        = 00000003 (USBD_TRANSFER_DIRECTION_IN, USBD_SHORT_TRANSFER_OK)
  TransferBufferLength = 00000100
  TransferBuffer       = 00000000
  TransferBufferMDL    = 8218ef88
  UrbLink              = 00000000
[420433 ms] UsbSnoop - MyInternalIOCTLCompletion(f88ffdb0) : fido=81b37020, Irp=81b64008, Context=81b94d20, IRQL=2
[420433 ms]  <<<  URB 300 coming back  <<< 
-- URB_FUNCTION_BULK_OR_INTERRUPT_TRANSFER:
  PipeHandle           = 81b38414 [endpoint 0x00000081]
  TransferFlags        = 00000003 (USBD_TRANSFER_DIRECTION_IN, USBD_SHORT_TRANSFER_OK)
  TransferBufferLength = 00000007
  TransferBuffer       = 00000000
  TransferBufferMDL    = 8218ef88
    00000000: 00 00 00 02 05 e0 00
  UrbLink              = 00000000
[420470 ms] UsbSnoop - DispatchAny(f88fe610) : IRP_MJ_INTERNAL_DEVICE_CONTROL
[420470 ms] UsbSnoop - MyDispatchInternalIOCTL(f88ffe80) : fdo=82141030, Irp=81b64008, IRQL=2
[420470 ms]  >>>  URB 301 going down  >>> 
-- URB_FUNCTION_BULK_OR_INTERRUPT_TRANSFER:
  PipeHandle           = 81b38414 [endpoint 0x00000081]
  TransferFlags        = 00000003 (USBD_TRANSFER_DIRECTION_IN, USBD_SHORT_TRANSFER_OK)
  TransferBufferLength = 00000100
  TransferBuffer       = 00000000
  TransferBufferMDL    = 8218ef88
  UrbLink              = 00000000
[420470 ms] UsbSnoop - MyInternalIOCTLCompletion(f88ffdb0) : fido=81b37020, Irp=81b64008, Context=81bbd930, IRQL=2
[420470 ms]  <<<  URB 301 coming back  <<< 
-- URB_FUNCTION_BULK_OR_INTERRUPT_TRANSFER:
  PipeHandle           = 81b38414 [endpoint 0x00000081]
  TransferFlags        = 00000003 (USBD_TRANSFER_DIRECTION_IN, USBD_SHORT_TRANSFER_OK)
  TransferBufferLength = 0000000f
  TransferBuffer       = 00000000
  TransferBufferMDL    = 8218ef88
    00000000: 00 00 00 0a 04 00 00 00 04 bb 00 00 01 d4 c0
  UrbLink              = 00000000
[420510 ms] UsbSnoop - DispatchAny(f88fe610) : IRP_MJ_INTERNAL_DEVICE_CONTROL
[420510 ms] UsbSnoop - MyDispatchInternalIOCTL(f88ffe80) : fdo=82141030, Irp=81b64008, IRQL=2
[420510 ms]  >>>  URB 302 going down  >>> 
-- URB_FUNCTION_BULK_OR_INTERRUPT_TRANSFER:
  PipeHandle           = 81b38434 [endpoint 0x00000002]
  TransferFlags        = 00000000 (USBD_TRANSFER_DIRECTION_OUT, ~USBD_SHORT_TRANSFER_OK)
  TransferBufferLength = 00000007
  TransferBuffer       = 00000000
  TransferBufferMDL    = 8218ef88
    00000000: 00 00 00 02 05 e0 00
  UrbLink              = 00000000
[420510 ms] UsbSnoop - MyInternalIOCTLCompletion(f88ffdb0) : fido=81b37020, Irp=81b64008, Context=81b94d20, IRQL=2
[420510 ms]  <<<  URB 302 coming back  <<< 
-- URB_FUNCTION_BULK_OR_INTERRUPT_TRANSFER:
  PipeHandle           = 81b38434 [endpoint 0x00000002]
  TransferFlags        = 00000000 (USBD_TRANSFER_DIRECTION_OUT, ~USBD_SHORT_TRANSFER_OK)
  TransferBufferLength = 00000007
  TransferBuffer       = 00000000
  TransferBufferMDL    = 8218ef88
  UrbLink              = 00000000
[420520 ms] UsbSnoop - DispatchAny(f88fe610) : IRP_MJ_INTERNAL_DEVICE_CONTROL
[420520 ms] UsbSnoop - MyDispatchInternalIOCTL(f88ffe80) : fdo=82141030, Irp=81b64008, IRQL=2
[420520 ms]  >>>  URB 303 going down  >>> 
-- URB_FUNCTION_BULK_OR_INTERRUPT_TRANSFER:
  PipeHandle           = 81b38414 [endpoint 0x00000081]
  TransferFlags        = 00000003 (USBD_TRANSFER_DIRECTION_IN, USBD_SHORT_TRANSFER_OK)
  TransferBufferLength = 00000100
  TransferBuffer       = 00000000
  TransferBufferMDL    = 8218ef88
  UrbLink              = 00000000
[420520 ms] UsbSnoop - MyInternalIOCTLCompletion(f88ffdb0) : fido=81b37020, Irp=81b64008, Context=81c2a7d0, IRQL=2
[420520 ms]  <<<  URB 303 coming back  <<< 
-- URB_FUNCTION_BULK_OR_INTERRUPT_TRANSFER:
  PipeHandle           = 81b38414 [endpoint 0x00000081]
  TransferFlags        = 00000003 (USBD_TRANSFER_DIRECTION_IN, USBD_SHORT_TRANSFER_OK)
  TransferBufferLength = 00000028
  TransferBuffer       = 00000000
  TransferBufferMDL    = 8218ef88
    00000000: 00 00 00 23 04 00 00 00 1d 00 08 00 04 00 25 00
    00000010: 00 04 11 6a 2c 02 00 27 00 00 01 02 00 28 00 00
    00000020: 01 01 00 24 00 00 01 01
  UrbLink              = 00000000
[420560 ms] UsbSnoop - DispatchAny(f88fe610) : IRP_MJ_INTERNAL_DEVICE_CONTROL
[420560 ms] UsbSnoop - MyDispatchInternalIOCTL(f88ffe80) : fdo=82141030, Irp=81b64008, IRQL=2
[420560 ms]  >>>  URB 304 going down  >>> 
-- URB_FUNCTION_BULK_OR_INTERRUPT_TRANSFER:
  PipeHandle           = 81b38434 [endpoint 0x00000002]
  TransferFlags        = 00000000 (USBD_TRANSFER_DIRECTION_OUT, ~USBD_SHORT_TRANSFER_OK)
  TransferBufferLength = 00000007
  TransferBuffer       = 00000000
  TransferBufferMDL    = 8218ef88
    00000000: 00 00 00 02 05 e0 00
  UrbLink              = 00000000
[420560 ms] UsbSnoop - MyInternalIOCTLCompletion(f88ffdb0) : fido=81b37020, Irp=81b64008, Context=81bb4b80, IRQL=2
[420560 ms]  <<<  URB 304 coming back  <<< 
-- URB_FUNCTION_BULK_OR_INTERRUPT_TRANSFER:
  PipeHandle           = 81b38434 [endpoint 0x00000002]
  TransferFlags        = 00000000 (USBD_TRANSFER_DIRECTION_OUT, ~USBD_SHORT_TRANSFER_OK)
  TransferBufferLength = 00000007
  TransferBuffer       = 00000000
  TransferBufferMDL    = 8218ef88
  UrbLink              = 00000000
