[520850 ms] UsbSnoop - DispatchAny(f88fe610) : IRP_MJ_INTERNAL_DEVICE_CONTROL
[520850 ms] UsbSnoop - MyDispatchInternalIOCTL(f88ffe80) : fdo=82141030, Irp=81b34008, IRQL=0
[520850 ms]  >>>  URB 347 going down  >>> 
-- URB_FUNCTION_RESET_PIPE:
  PipeHandle = 81b38414 [endpoint 0x00000081]
[520856 ms] UsbSnoop - MyInternalIOCTLCompletion(f88ffdb0) : fido=00000000, Irp=81b34008, Context=81b94d20, IRQL=0
[520856 ms]  <<<  URB 347 coming back  <<< 
-- URB_FUNCTION_RESET_PIPE:
[520856 ms] UsbSnoop - DispatchAny(f88fe610) : IRP_MJ_INTERNAL_DEVICE_CONTROL
[520856 ms] UsbSnoop - MyDispatchInternalIOCTL(f88ffe80) : fdo=82141030, Irp=81b34008, IRQL=0
[520856 ms]  >>>  URB 348 going down  >>> 
-- URB_FUNCTION_RESET_PIPE:
  PipeHandle = 81b38434 [endpoint 0x00000002]
[520857 ms] UsbSnoop - MyInternalIOCTLCompletion(f88ffdb0) : fido=00000000, Irp=81b34008, Context=822c0400, IRQL=0
[520857 ms]  <<<  URB 348 coming back  <<< 
-- URB_FUNCTION_RESET_PIPE:
[521851 ms] UsbSnoop - DispatchAny(f88fe610) : IRP_MJ_INTERNAL_DEVICE_CONTROL
[521851 ms] UsbSnoop - MyDispatchInternalIOCTL(f88ffe80) : fdo=82141030, Irp=81b34008, IRQL=0
[521851 ms]  >>>  URB 349 going down  >>> 
-- URB_FUNCTION_RESET_PIPE:
  PipeHandle = 81b38414 [endpoint 0x00000081]
[521859 ms] UsbSnoop - MyInternalIOCTLCompletion(f88ffdb0) : fido=00000000, Irp=81b34008, Context=822c0400, IRQL=0
[521859 ms]  <<<  URB 349 coming back  <<< 
-- URB_FUNCTION_RESET_PIPE:
[521859 ms] UsbSnoop - DispatchAny(f88fe610) : IRP_MJ_INTERNAL_DEVICE_CONTROL
[521859 ms] UsbSnoop - MyDispatchInternalIOCTL(f88ffe80) : fdo=82141030, Irp=81b34008, IRQL=0
[521859 ms]  >>>  URB 350 going down  >>> 
-- URB_FUNCTION_RESET_PIPE:
  PipeHandle = 81b38434 [endpoint 0x00000002]
[521859 ms] UsbSnoop - MyInternalIOCTLCompletion(f88ffdb0) : fido=00000000, Irp=81b34008, Context=8221a078, IRQL=0
[521859 ms]  <<<  URB 350 coming back  <<< 
-- URB_FUNCTION_RESET_PIPE:
[521859 ms] UsbSnoop - DispatchAny(f88fe610) : IRP_MJ_INTERNAL_DEVICE_CONTROL
[521859 ms] UsbSnoop - MyDispatchInternalIOCTL(f88ffe80) : fdo=82141030, Irp=81b34008, IRQL=0
[522853 ms] UsbSnoop - DispatchAny(f88fe610) : IRP_MJ_INTERNAL_DEVICE_CONTROL
[522853 ms] UsbSnoop - MyDispatchInternalIOCTL(f88ffe80) : fdo=82141030, Irp=822d9008, IRQL=0
[522853 ms]  >>>  URB 351 going down  >>> 
-- URB_FUNCTION_GET_DESCRIPTOR_FROM_DEVICE:
  TransferBufferLength = 00000012
  TransferBuffer       = e2e65ec8
  TransferBufferMDL    = 00000000
  Index                = 00000000
  DescriptorType       = 00000001 (USB_DEVICE_DESCRIPTOR_TYPE)
  LanguageId           = 00000000
[522861 ms] UsbSnoop - MyInternalIOCTLCompletion(f88ffdb0) : fido=00000000, Irp=822d9008, Context=81c20ed8, IRQL=2
[522861 ms]  <<<  URB 351 coming back  <<< 
-- URB_FUNCTION_CONTROL_TRANSFER:
  PipeHandle           = 82184a90
  TransferFlags        = 81b3400b (USBD_TRANSFER_DIRECTION_IN, USBD_SHORT_TRANSFER_OK)
  TransferBufferLength = 00000012
  TransferBuffer       = e2e65ec8
  TransferBufferMDL    = 81c87518
    00000000: 12 01 00 02 00 00 00 40 51 04 08 e0 10 01 01 02
    00000010: 00 01
  UrbLink              = 00000000
  SetupPacket          =
    00000000: 80 06 00 01 00 00 12 00
[522861 ms] UsbSnoop - DispatchAny(f88fe610) : IRP_MJ_INTERNAL_DEVICE_CONTROL
[522861 ms] UsbSnoop - MyDispatchInternalIOCTL(f88ffe80) : fdo=82141030, Irp=822d9008, IRQL=0
[522861 ms] UsbSnoop - DispatchAny(f88fe610) : IRP_MJ_INTERNAL_DEVICE_CONTROL
[522861 ms] UsbSnoop - MyDispatchInternalIOCTL(f88ffe80) : fdo=82141030, Irp=822d9008, IRQL=0
[522861 ms]  >>>  URB 352 going down  >>> 
-- URB_FUNCTION_RESET_PIPE:
  PipeHandle = 81b38414 [endpoint 0x00000081]
[522861 ms] UsbSnoop - MyInternalIOCTLCompletion(f88ffdb0) : fido=00000000, Irp=822d9008, Context=81b99298, IRQL=0
[522861 ms]  <<<  URB 352 coming back  <<< 
-- URB_FUNCTION_RESET_PIPE:
[522861 ms] UsbSnoop - DispatchAny(f88fe610) : IRP_MJ_INTERNAL_DEVICE_CONTROL
[522861 ms] UsbSnoop - MyDispatchInternalIOCTL(f88ffe80) : fdo=82141030, Irp=822d9008, IRQL=0
[522861 ms]  >>>  URB 353 going down  >>> 
-- URB_FUNCTION_RESET_PIPE:
  PipeHandle = 81b38434 [endpoint 0x00000002]
[522862 ms] UsbSnoop - MyInternalIOCTLCompletion(f88ffdb0) : fido=00000000, Irp=822d9008, Context=81cd6ed8, IRQL=0
[522862 ms]  <<<  URB 353 coming back  <<< 
-- URB_FUNCTION_RESET_PIPE:
[524115 ms] UsbSnoop - DispatchAny(f88fe610) : IRP_MJ_INTERNAL_DEVICE_CONTROL
[524115 ms] UsbSnoop - MyDispatchInternalIOCTL(f88ffe80) : fdo=82141030, Irp=822dc2d0, IRQL=2
[524115 ms]  >>>  URB 354 going down  >>> 
-- URB_FUNCTION_BULK_OR_INTERRUPT_TRANSFER:
  PipeHandle           = 81b38434 [endpoint 0x00000002]
  TransferFlags        = 00000000 (USBD_TRANSFER_DIRECTION_OUT, ~USBD_SHORT_TRANSFER_OK)
  TransferBufferLength = 00000009
  TransferBuffer       = 00000000
  TransferBufferMDL    = 81c87518
    00000000: 00 00 00 04 01 00 00 04 00
  UrbLink              = 00000000
[524115 ms] UsbSnoop - MyInternalIOCTLCompletion(f88ffdb0) : fido=81b37020, Irp=822dc2d0, Context=821a66e0, IRQL=2
[524115 ms]  <<<  URB 354 coming back  <<< 
-- URB_FUNCTION_BULK_OR_INTERRUPT_TRANSFER:
  PipeHandle           = 81b38434 [endpoint 0x00000002]
  TransferFlags        = 00000000 (USBD_TRANSFER_DIRECTION_OUT, ~USBD_SHORT_TRANSFER_OK)
  TransferBufferLength = 00000009
  TransferBuffer       = 00000000
  TransferBufferMDL    = 81c87518
  UrbLink              = 00000000
[524115 ms] UsbSnoop - DispatchAny(f88fe610) : IRP_MJ_INTERNAL_DEVICE_CONTROL
[524115 ms] UsbSnoop - MyDispatchInternalIOCTL(f88ffe80) : fdo=82141030, Irp=822dc2d0, IRQL=2
[524115 ms]  >>>  URB 355 going down  >>> 
-- URB_FUNCTION_BULK_OR_INTERRUPT_TRANSFER:
  PipeHandle           = 81b38414 [endpoint 0x00000081]
  TransferFlags        = 00000003 (USBD_TRANSFER_DIRECTION_IN, USBD_SHORT_TRANSFER_OK)
  TransferBufferLength = 00000100
  TransferBuffer       = 00000000
  TransferBufferMDL    = 81c87518
  UrbLink              = 00000000
[524127 ms] UsbSnoop - MyInternalIOCTLCompletion(f88ffdb0) : fido=81b37020, Irp=822dc2d0, Context=81ba5ed8, IRQL=2
[524127 ms]  <<<  URB 355 coming back  <<< 
-- URB_FUNCTION_BULK_OR_INTERRUPT_TRANSFER:
  PipeHandle           = 81b38414 [endpoint 0x00000081]
  TransferFlags        = 00000003 (USBD_TRANSFER_DIRECTION_IN, USBD_SHORT_TRANSFER_OK)
  TransferBufferLength = 00000009
  TransferBuffer       = 00000000
  TransferBufferMDL    = 81c87518
    00000000: 00 00 00 04 02 00 00 00 fa
  UrbLink              = 00000000
[524155 ms] UsbSnoop - DispatchAny(f88fe610) : IRP_MJ_INTERNAL_DEVICE_CONTROL
[524155 ms] UsbSnoop - MyDispatchInternalIOCTL(f88ffe80) : fdo=82141030, Irp=822dc2d0, IRQL=2
[524155 ms]  >>>  URB 356 going down  >>> 
-- URB_FUNCTION_BULK_OR_INTERRUPT_TRANSFER:
  PipeHandle           = 81b38434 [endpoint 0x00000002]
  TransferFlags        = 00000000 (USBD_TRANSFER_DIRECTION_OUT, ~USBD_SHORT_TRANSFER_OK)
  TransferBufferLength = 00000015
  TransferBuffer       = 00000000
  TransferBufferMDL    = 81c87518
    00000000: 00 00 00 10 04 00 00 00 0a 00 01 00 03 00 01 00
    00000010: 00 00 00 07 d0
  UrbLink              = 00000000
[524155 ms] UsbSnoop - MyInternalIOCTLCompletion(f88ffdb0) : fido=81b37020, Irp=822dc2d0, Context=81bba800, IRQL=2
[524155 ms]  <<<  URB 356 coming back  <<< 
-- URB_FUNCTION_BULK_OR_INTERRUPT_TRANSFER:
  PipeHandle           = 81b38434 [endpoint 0x00000002]
  TransferFlags        = 00000000 (USBD_TRANSFER_DIRECTION_OUT, ~USBD_SHORT_TRANSFER_OK)
  TransferBufferLength = 00000015
  TransferBuffer       = 00000000
  TransferBufferMDL    = 81c87518
  UrbLink              = 00000000
[524165 ms] UsbSnoop - DispatchAny(f88fe610) : IRP_MJ_INTERNAL_DEVICE_CONTROL
[524165 ms] UsbSnoop - MyDispatchInternalIOCTL(f88ffe80) : fdo=82141030, Irp=822dc2d0, IRQL=2
[524165 ms]  >>>  URB 357 going down  >>> 
-- URB_FUNCTION_BULK_OR_INTERRUPT_TRANSFER:
  PipeHandle           = 81b38414 [endpoint 0x00000081]
  TransferFlags        = 00000003 (USBD_TRANSFER_DIRECTION_IN, USBD_SHORT_TRANSFER_OK)
  TransferBufferLength = 00000100
  TransferBuffer       = 00000000
  TransferBufferMDL    = 81c87518
  UrbLink              = 00000000
[524165 ms] UsbSnoop - MyInternalIOCTLCompletion(f88ffdb0) : fido=81b37020, Irp=822dc2d0, Context=821a66e0, IRQL=2
[524165 ms]  <<<  URB 357 coming back  <<< 
-- URB_FUNCTION_BULK_OR_INTERRUPT_TRANSFER:
  PipeHandle           = 81b38414 [endpoint 0x00000081]
  TransferFlags        = 00000003 (USBD_TRANSFER_DIRECTION_IN, USBD_SHORT_TRANSFER_OK)
  TransferBufferLength = 00000007
  TransferBuffer       = 00000000
  TransferBufferMDL    = 81c87518
    00000000: 00 00 00 02 05 e0 00
  UrbLink              = 00000000
[524205 ms] UsbSnoop - DispatchAny(f88fe610) : IRP_MJ_INTERNAL_DEVICE_CONTROL
[524205 ms] UsbSnoop - MyDispatchInternalIOCTL(f88ffe80) : fdo=82141030, Irp=822dc2d0, IRQL=2
[524205 ms]  >>>  URB 358 going down  >>> 
-- URB_FUNCTION_BULK_OR_INTERRUPT_TRANSFER:
  PipeHandle           = 81b38414 [endpoint 0x00000081]
  TransferFlags        = 00000003 (USBD_TRANSFER_DIRECTION_IN, USBD_SHORT_TRANSFER_OK)
  TransferBufferLength = 00000100
  TransferBuffer       = 00000000
  TransferBufferMDL    = 81c87518
  UrbLink              = 00000000
[524205 ms] UsbSnoop - MyInternalIOCTLCompletion(f88ffdb0) : fido=81b37020, Irp=822dc2d0, Context=81bba800, IRQL=2
[524205 ms]  <<<  URB 358 coming back  <<< 
-- URB_FUNCTION_BULK_OR_INTERRUPT_TRANSFER:
  PipeHandle           = 81b38414 [endpoint 0x00000081]
  TransferFlags        = 00000003 (USBD_TRANSFER_DIRECTION_IN, USBD_SHORT_TRANSFER_OK)
  TransferBufferLength = 0000000f
  TransferBuffer       = 00000000
  TransferBufferMDL    = 81c87518
    00000000: 00 00 00 0a 04 00 00 00 04 00 12 00 00 07 d0
  UrbLink              = 00000000
[524245 ms] UsbSnoop - DispatchAny(f88fe610) : IRP_MJ_INTERNAL_DEVICE_CONTROL
[524245 ms] UsbSnoop - MyDispatchInternalIOCTL(f88ffe80) : fdo=82141030, Irp=822dc2d0, IRQL=2
[524245 ms]  >>>  URB 359 going down  >>> 
-- URB_FUNCTION_BULK_OR_INTERRUPT_TRANSFER:
  PipeHandle           = 81b38434 [endpoint 0x00000002]
  TransferFlags        = 00000000 (USBD_TRANSFER_DIRECTION_OUT, ~USBD_SHORT_TRANSFER_OK)
  TransferBufferLength = 00000007
  TransferBuffer       = 00000000
  TransferBufferMDL    = 81c87518
    00000000: 00 00 00 02 05 e0 00
  UrbLink              = 00000000
[524245 ms] UsbSnoop - MyInternalIOCTLCompletion(f88ffdb0) : fido=81b37020, Irp=822dc2d0, Context=822c0400, IRQL=2
[524245 ms]  <<<  URB 359 coming back  <<< 
-- URB_FUNCTION_BULK_OR_INTERRUPT_TRANSFER:
  PipeHandle           = 81b38434 [endpoint 0x00000002]
  TransferFlags        = 00000000 (USBD_TRANSFER_DIRECTION_OUT, ~USBD_SHORT_TRANSFER_OK)
  TransferBufferLength = 00000007
  TransferBuffer       = 00000000
  TransferBufferMDL    = 81c87518
  UrbLink              = 00000000
[524255 ms] UsbSnoop - DispatchAny(f88fe610) : IRP_MJ_INTERNAL_DEVICE_CONTROL
[524255 ms] UsbSnoop - MyDispatchInternalIOCTL(f88ffe80) : fdo=82141030, Irp=822dc2d0, IRQL=2
[524255 ms]  >>>  URB 360 going down  >>> 
-- URB_FUNCTION_BULK_OR_INTERRUPT_TRANSFER:
  PipeHandle           = 81b38434 [endpoint 0x00000002]
  TransferFlags        = 00000000 (USBD_TRANSFER_DIRECTION_OUT, ~USBD_SHORT_TRANSFER_OK)
  TransferBufferLength = 00000023
  TransferBuffer       = 00000000
  TransferBufferMDL    = 81c87518
    00000000: 00 00 00 1e 04 00 00 00 18 00 10 00 01 41 00 00
    00000010: 02 00 11 00 04 f0 0b 00 00 00 13 00 01 00 01 00
    00000020: 00 00 00
  UrbLink              = 00000000
[524255 ms] UsbSnoop - MyInternalIOCTLCompletion(f88ffdb0) : fido=81b37020, Irp=822dc2d0, Context=81bba800, IRQL=2
[524255 ms]  <<<  URB 360 coming back  <<< 
-- URB_FUNCTION_BULK_OR_INTERRUPT_TRANSFER:
  PipeHandle           = 81b38434 [endpoint 0x00000002]
  TransferFlags        = 00000000 (USBD_TRANSFER_DIRECTION_OUT, ~USBD_SHORT_TRANSFER_OK)
  TransferBufferLength = 00000023
  TransferBuffer       = 00000000
  TransferBufferMDL    = 81c87518
  UrbLink              = 00000000
[524265 ms] UsbSnoop - DispatchAny(f88fe610) : IRP_MJ_INTERNAL_DEVICE_CONTROL
[524265 ms] UsbSnoop - MyDispatchInternalIOCTL(f88ffe80) : fdo=82141030, Irp=822dc2d0, IRQL=2
[524265 ms]  >>>  URB 361 going down  >>> 
-- URB_FUNCTION_BULK_OR_INTERRUPT_TRANSFER:
  PipeHandle           = 81b38414 [endpoint 0x00000081]
  TransferFlags        = 00000003 (USBD_TRANSFER_DIRECTION_IN, USBD_SHORT_TRANSFER_OK)
  TransferBufferLength = 00000100
  TransferBuffer       = 00000000
  TransferBufferMDL    = 81c87518
  UrbLink              = 00000000
[524268 ms] UsbSnoop - MyInternalIOCTLCompletion(f88ffdb0) : fido=81b37020, Irp=822dc2d0, Context=821a66e0, IRQL=2
[524268 ms]  <<<  URB 361 coming back  <<< 
-- URB_FUNCTION_BULK_OR_INTERRUPT_TRANSFER:
  PipeHandle           = 81b38414 [endpoint 0x00000081]
  TransferFlags        = 00000003 (USBD_TRANSFER_DIRECTION_IN, USBD_SHORT_TRANSFER_OK)
  TransferBufferLength = 00000007
  TransferBuffer       = 00000000
  TransferBufferMDL    = 81c87518
    00000000: 00 00 00 02 05 e0 00
  UrbLink              = 00000000
[524305 ms] UsbSnoop - DispatchAny(f88fe610) : IRP_MJ_INTERNAL_DEVICE_CONTROL
[524305 ms] UsbSnoop - MyDispatchInternalIOCTL(f88ffe80) : fdo=82141030, Irp=822dc2d0, IRQL=2
[524305 ms]  >>>  URB 362 going down  >>> 
-- URB_FUNCTION_BULK_OR_INTERRUPT_TRANSFER:
  PipeHandle           = 81b38414 [endpoint 0x00000081]
  TransferFlags        = 00000003 (USBD_TRANSFER_DIRECTION_IN, USBD_SHORT_TRANSFER_OK)
  TransferBufferLength = 00000100
  TransferBuffer       = 00000000
  TransferBufferMDL    = 81c87518
  UrbLink              = 00000000
[524305 ms] UsbSnoop - MyInternalIOCTLCompletion(f88ffdb0) : fido=81b37020, Irp=822dc2d0, Context=81c02ed8, IRQL=2
[524305 ms]  <<<  URB 362 coming back  <<< 
-- URB_FUNCTION_BULK_OR_INTERRUPT_TRANSFER:
  PipeHandle           = 81b38414 [endpoint 0x00000081]
  TransferFlags        = 00000003 (USBD_TRANSFER_DIRECTION_IN, USBD_SHORT_TRANSFER_OK)
  TransferBufferLength = 0000000c
  TransferBuffer       = 00000000
  TransferBufferMDL    = 81c87518
    00000000: 00 00 00 07 04 00 00 00 01 aa 00 01
  UrbLink              = 00000000
[524345 ms] UsbSnoop - DispatchAny(f88fe610) : IRP_MJ_INTERNAL_DEVICE_CONTROL
[524345 ms] UsbSnoop - MyDispatchInternalIOCTL(f88ffe80) : fdo=82141030, Irp=822dc2d0, IRQL=2
[524345 ms]  >>>  URB 363 going down  >>> 
-- URB_FUNCTION_BULK_OR_INTERRUPT_TRANSFER:
  PipeHandle           = 81b38434 [endpoint 0x00000002]
  TransferFlags        = 00000000 (USBD_TRANSFER_DIRECTION_OUT, ~USBD_SHORT_TRANSFER_OK)
  TransferBufferLength = 00000007
  TransferBuffer       = 00000000
  TransferBufferMDL    = 81c87518
    00000000: 00 00 00 02 05 e0 00
  UrbLink              = 00000000
[524345 ms] UsbSnoop - MyInternalIOCTLCompletion(f88ffdb0) : fido=81b37020, Irp=822dc2d0, Context=81bba800, IRQL=2
[524345 ms]  <<<  URB 363 coming back  <<< 
-- URB_FUNCTION_BULK_OR_INTERRUPT_TRANSFER:
  PipeHandle           = 81b38434 [endpoint 0x00000002]
  TransferFlags        = 00000000 (USBD_TRANSFER_DIRECTION_OUT, ~USBD_SHORT_TRANSFER_OK)
  TransferBufferLength = 00000007
  TransferBuffer       = 00000000
  TransferBufferMDL    = 81c87518
  UrbLink              = 00000000
[524355 ms] UsbSnoop - DispatchAny(f88fe610) : IRP_MJ_INTERNAL_DEVICE_CONTROL
[524355 ms] UsbSnoop - MyDispatchInternalIOCTL(f88ffe80) : fdo=82141030, Irp=822d9008, IRQL=0
[524355 ms]  >>>  URB 364 going down  >>> 
-- URB_FUNCTION_RESET_PIPE:
  PipeHandle = 81b38414 [endpoint 0x00000081]
[524414 ms] UsbSnoop - MyInternalIOCTLCompletion(f88ffdb0) : fido=00000000, Irp=822d9008, Context=81c02ed8, IRQL=0
[524414 ms]  <<<  URB 364 coming back  <<< 
-- URB_FUNCTION_RESET_PIPE:
[524414 ms] UsbSnoop - DispatchAny(f88fe610) : IRP_MJ_INTERNAL_DEVICE_CONTROL
[524414 ms] UsbSnoop - MyDispatchInternalIOCTL(f88ffe80) : fdo=82141030, Irp=822d9008, IRQL=0
[524414 ms]  >>>  URB 365 going down  >>> 
-- URB_FUNCTION_RESET_PIPE:
  PipeHandle = 81b38434 [endpoint 0x00000002]
[524415 ms] UsbSnoop - MyInternalIOCTLCompletion(f88ffdb0) : fido=00000000, Irp=822d9008, Context=81bba800, IRQL=0
[524415 ms]  <<<  URB 365 coming back  <<< 
-- URB_FUNCTION_RESET_PIPE:
[524415 ms] UsbSnoop - DispatchAny(f88fe610) : IRP_MJ_INTERNAL_DEVICE_CONTROL
[524415 ms] UsbSnoop - MyDispatchInternalIOCTL(f88ffe80) : fdo=82141030, Irp=822d9008, IRQL=0
[524615 ms] UsbSnoop - DispatchAny(f88fe610) : IRP_MJ_INTERNAL_DEVICE_CONTROL
[524615 ms] UsbSnoop - MyDispatchInternalIOCTL(f88ffe80) : fdo=82141030, Irp=822d9008, IRQL=0
[524615 ms]  >>>  URB 366 going down  >>> 
-- URB_FUNCTION_RESET_PIPE:
  PipeHandle = 81b38414 [endpoint 0x00000081]
[524624 ms] UsbSnoop - MyInternalIOCTLCompletion(f88ffdb0) : fido=00000000, Irp=822d9008, Context=81bed7d8, IRQL=0
[524624 ms]  <<<  URB 366 coming back  <<< 
-- URB_FUNCTION_RESET_PIPE:
[524624 ms] UsbSnoop - DispatchAny(f88fe610) : IRP_MJ_INTERNAL_DEVICE_CONTROL
[524624 ms] UsbSnoop - MyDispatchInternalIOCTL(f88ffe80) : fdo=82141030, Irp=822d9008, IRQL=0
[524624 ms]  >>>  URB 367 going down  >>> 
-- URB_FUNCTION_RESET_PIPE:
  PipeHandle = 81b38434 [endpoint 0x00000002]
[524624 ms] UsbSnoop - MyInternalIOCTLCompletion(f88ffdb0) : fido=00000000, Irp=822d9008, Context=81ba5ed8, IRQL=0
[524624 ms]  <<<  URB 367 coming back  <<< 
-- URB_FUNCTION_RESET_PIPE:
[525617 ms] UsbSnoop - DispatchAny(f88fe610) : IRP_MJ_INTERNAL_DEVICE_CONTROL
[525617 ms] UsbSnoop - MyDispatchInternalIOCTL(f88ffe80) : fdo=82141030, Irp=81b0b2c0, IRQL=0
[525617 ms]  >>>  URB 368 going down  >>> 
-- URB_FUNCTION_RESET_PIPE:
  PipeHandle = 81b38414 [endpoint 0x00000081]
[525617 ms] UsbSnoop - MyInternalIOCTLCompletion(f88ffdb0) : fido=00000000, Irp=81b0b2c0, Context=81ba5ed8, IRQL=0
[525617 ms]  <<<  URB 368 coming back  <<< 
-- URB_FUNCTION_RESET_PIPE:
[525617 ms] UsbSnoop - DispatchAny(f88fe610) : IRP_MJ_INTERNAL_DEVICE_CONTROL
[525618 ms] UsbSnoop - MyDispatchInternalIOCTL(f88ffe80) : fdo=82141030, Irp=81b0b2c0, IRQL=0
[525618 ms]  >>>  URB 369 going down  >>> 
-- URB_FUNCTION_RESET_PIPE:
  PipeHandle = 81b38434 [endpoint 0x00000002]
[525626 ms] UsbSnoop - MyInternalIOCTLCompletion(f88ffdb0) : fido=00000000, Irp=81b0b2c0, Context=822c0400, IRQL=0
[525626 ms]  <<<  URB 369 coming back  <<< 
-- URB_FUNCTION_RESET_PIPE:
[525626 ms] UsbSnoop - DispatchAny(f88fe610) : IRP_MJ_INTERNAL_DEVICE_CONTROL
[525626 ms] UsbSnoop - MyDispatchInternalIOCTL(f88ffe80) : fdo=82141030, Irp=81b0b2c0, IRQL=0
[526619 ms] UsbSnoop - DispatchAny(f88fe610) : IRP_MJ_INTERNAL_DEVICE_CONTROL
[526619 ms] UsbSnoop - MyDispatchInternalIOCTL(f88ffe80) : fdo=82141030, Irp=81b0b2c0, IRQL=0
[526619 ms]  >>>  URB 370 going down  >>> 
-- URB_FUNCTION_GET_DESCRIPTOR_FROM_DEVICE:
  TransferBufferLength = 00000012
  TransferBuffer       = e2e65ec8
  TransferBufferMDL    = 00000000
  Index                = 00000000
  DescriptorType       = 00000001 (USB_DEVICE_DESCRIPTOR_TYPE)
  LanguageId           = 00000000
[526619 ms] UsbSnoop - MyInternalIOCTLCompletion(f88ffdb0) : fido=00000000, Irp=81b0b2c0, Context=81bba800, IRQL=2
[526619 ms]  <<<  URB 370 coming back  <<< 
-- URB_FUNCTION_CONTROL_TRANSFER:
  PipeHandle           = 82184a90
  TransferFlags        = 0000000b (USBD_TRANSFER_DIRECTION_IN, USBD_SHORT_TRANSFER_OK)
  TransferBufferLength = 00000012
  TransferBuffer       = e2e65ec8
  TransferBufferMDL    = 81c87518
    00000000: 12 01 00 02 00 00 00 40 51 04 08 e0 10 01 01 02
    00000010: 00 01
  UrbLink              = 00000000
  SetupPacket          =
    00000000: 80 06 00 01 00 00 12 00
[526619 ms] UsbSnoop - DispatchAny(f88fe610) : IRP_MJ_INTERNAL_DEVICE_CONTROL
[526619 ms] UsbSnoop - MyDispatchInternalIOCTL(f88ffe80) : fdo=82141030, Irp=81b0b2c0, IRQL=0
[526619 ms] UsbSnoop - DispatchAny(f88fe610) : IRP_MJ_INTERNAL_DEVICE_CONTROL
[526619 ms] UsbSnoop - MyDispatchInternalIOCTL(f88ffe80) : fdo=82141030, Irp=81b0b2c0, IRQL=0
[526619 ms]  >>>  URB 371 going down  >>> 
-- URB_FUNCTION_RESET_PIPE:
  PipeHandle = 81b38414 [endpoint 0x00000081]
[526628 ms] UsbSnoop - MyInternalIOCTLCompletion(f88ffdb0) : fido=00000000, Irp=81b0b2c0, Context=81cd6d18, IRQL=0
[526628 ms]  <<<  URB 371 coming back  <<< 
-- URB_FUNCTION_RESET_PIPE:
[526628 ms] UsbSnoop - DispatchAny(f88fe610) : IRP_MJ_INTERNAL_DEVICE_CONTROL
[526628 ms] UsbSnoop - MyDispatchInternalIOCTL(f88ffe80) : fdo=82141030, Irp=81b0b2c0, IRQL=0
[526628 ms]  >>>  URB 372 going down  >>> 
-- URB_FUNCTION_RESET_PIPE:
  PipeHandle = 81b38434 [endpoint 0x00000002]
[526628 ms] UsbSnoop - MyInternalIOCTLCompletion(f88ffdb0) : fido=00000000, Irp=81b0b2c0, Context=81cf4d28, IRQL=0
[526628 ms]  <<<  URB 372 coming back  <<< 
-- URB_FUNCTION_RESET_PIPE:
[527871 ms] UsbSnoop - DispatchAny(f88fe610) : IRP_MJ_INTERNAL_DEVICE_CONTROL
[527871 ms] UsbSnoop - MyDispatchInternalIOCTL(f88ffe80) : fdo=82141030, Irp=81b34008, IRQL=2
[527871 ms]  >>>  URB 373 going down  >>> 
-- URB_FUNCTION_BULK_OR_INTERRUPT_TRANSFER:
  PipeHandle           = 81b38434 [endpoint 0x00000002]
  TransferFlags        = 00000000 (USBD_TRANSFER_DIRECTION_OUT, ~USBD_SHORT_TRANSFER_OK)
  TransferBufferLength = 00000009
  TransferBuffer       = 00000000
  TransferBufferMDL    = 81c87518
    00000000: 00 00 00 04 01 00 00 04 00
  UrbLink              = 00000000
[527871 ms] UsbSnoop - MyInternalIOCTLCompletion(f88ffdb0) : fido=81b37020, Irp=81b34008, Context=81cf4d28, IRQL=2
[527871 ms]  <<<  URB 373 coming back  <<< 
-- URB_FUNCTION_BULK_OR_INTERRUPT_TRANSFER:
  PipeHandle           = 81b38434 [endpoint 0x00000002]
  TransferFlags        = 00000000 (USBD_TRANSFER_DIRECTION_OUT, ~USBD_SHORT_TRANSFER_OK)
  TransferBufferLength = 00000009
  TransferBuffer       = 00000000
  TransferBufferMDL    = 81c87518
  UrbLink              = 00000000
[527871 ms] UsbSnoop - DispatchAny(f88fe610) : IRP_MJ_INTERNAL_DEVICE_CONTROL
[527871 ms] UsbSnoop - MyDispatchInternalIOCTL(f88ffe80) : fdo=82141030, Irp=81b34008, IRQL=2
[527871 ms]  >>>  URB 374 going down  >>> 
-- URB_FUNCTION_BULK_OR_INTERRUPT_TRANSFER:
  PipeHandle           = 81b38414 [endpoint 0x00000081]
  TransferFlags        = 00000003 (USBD_TRANSFER_DIRECTION_IN, USBD_SHORT_TRANSFER_OK)
  TransferBufferLength = 00000100
  TransferBuffer       = 00000000
  TransferBufferMDL    = 81c87518
  UrbLink              = 00000000
[527876 ms] UsbSnoop - MyInternalIOCTLCompletion(f88ffdb0) : fido=81b37020, Irp=81b34008, Context=81ba5ed8, IRQL=2
[527876 ms]  <<<  URB 374 coming back  <<< 
-- URB_FUNCTION_BULK_OR_INTERRUPT_TRANSFER:
  PipeHandle           = 81b38414 [endpoint 0x00000081]
  TransferFlags        = 00000003 (USBD_TRANSFER_DIRECTION_IN, USBD_SHORT_TRANSFER_OK)
  TransferBufferLength = 00000009
  TransferBuffer       = 00000000
  TransferBufferMDL    = 81c87518
    00000000: 00 00 00 04 02 00 00 00 fa
  UrbLink              = 00000000
[527901 ms] UsbSnoop - DispatchAny(f88fe610) : IRP_MJ_INTERNAL_DEVICE_CONTROL
[527901 ms] UsbSnoop - MyDispatchInternalIOCTL(f88ffe80) : fdo=82141030, Irp=81b34008, IRQL=2
[527901 ms]  >>>  URB 375 going down  >>> 
-- URB_FUNCTION_BULK_OR_INTERRUPT_TRANSFER:
  PipeHandle           = 81b38434 [endpoint 0x00000002]
  TransferFlags        = 00000000 (USBD_TRANSFER_DIRECTION_OUT, ~USBD_SHORT_TRANSFER_OK)
  TransferBufferLength = 00000015
  TransferBuffer       = 00000000
  TransferBufferMDL    = 81c87518
    00000000: 00 00 00 10 04 00 00 00 0a 00 01 00 03 00 01 00
    00000010: 00 00 00 07 d0
  UrbLink              = 00000000
[527901 ms] UsbSnoop - MyInternalIOCTLCompletion(f88ffdb0) : fido=81b37020, Irp=81b34008, Context=81bba800, IRQL=2
[527901 ms]  <<<  URB 375 coming back  <<< 
-- URB_FUNCTION_BULK_OR_INTERRUPT_TRANSFER:
  PipeHandle           = 81b38434 [endpoint 0x00000002]
  TransferFlags        = 00000000 (USBD_TRANSFER_DIRECTION_OUT, ~USBD_SHORT_TRANSFER_OK)
  TransferBufferLength = 00000015
  TransferBuffer       = 00000000
  TransferBufferMDL    = 81c87518
  UrbLink              = 00000000
[527911 ms] UsbSnoop - DispatchAny(f88fe610) : IRP_MJ_INTERNAL_DEVICE_CONTROL
[527911 ms] UsbSnoop - MyDispatchInternalIOCTL(f88ffe80) : fdo=82141030, Irp=81b34008, IRQL=2
[527911 ms]  >>>  URB 376 going down  >>> 
-- URB_FUNCTION_BULK_OR_INTERRUPT_TRANSFER:
  PipeHandle           = 81b38414 [endpoint 0x00000081]
  TransferFlags        = 00000003 (USBD_TRANSFER_DIRECTION_IN, USBD_SHORT_TRANSFER_OK)
  TransferBufferLength = 00000100
  TransferBuffer       = 00000000
  TransferBufferMDL    = 81c87518
  UrbLink              = 00000000
[527911 ms] UsbSnoop - MyInternalIOCTLCompletion(f88ffdb0) : fido=81b37020, Irp=81b34008, Context=81ba5ed8, IRQL=2
[527911 ms]  <<<  URB 376 coming back  <<< 
-- URB_FUNCTION_BULK_OR_INTERRUPT_TRANSFER:
  PipeHandle           = 81b38414 [endpoint 0x00000081]
  TransferFlags        = 00000003 (USBD_TRANSFER_DIRECTION_IN, USBD_SHORT_TRANSFER_OK)
  TransferBufferLength = 00000007
  TransferBuffer       = 00000000
  TransferBufferMDL    = 81c87518
    00000000: 00 00 00 02 05 e0 00
  UrbLink              = 00000000
[527951 ms] UsbSnoop - DispatchAny(f88fe610) : IRP_MJ_INTERNAL_DEVICE_CONTROL
[527951 ms] UsbSnoop - MyDispatchInternalIOCTL(f88ffe80) : fdo=82141030, Irp=81b34008, IRQL=2
[527951 ms]  >>>  URB 377 going down  >>> 
-- URB_FUNCTION_BULK_OR_INTERRUPT_TRANSFER:
  PipeHandle           = 81b38414 [endpoint 0x00000081]
  TransferFlags        = 00000003 (USBD_TRANSFER_DIRECTION_IN, USBD_SHORT_TRANSFER_OK)
  TransferBufferLength = 00000100
  TransferBuffer       = 00000000
  TransferBufferMDL    = 81c87518
  UrbLink              = 00000000
[527951 ms] UsbSnoop - MyInternalIOCTLCompletion(f88ffdb0) : fido=81b37020, Irp=81b34008, Context=81c02ed8, IRQL=2
[527951 ms]  <<<  URB 377 coming back  <<< 
-- URB_FUNCTION_BULK_OR_INTERRUPT_TRANSFER:
  PipeHandle           = 81b38414 [endpoint 0x00000081]
  TransferFlags        = 00000003 (USBD_TRANSFER_DIRECTION_IN, USBD_SHORT_TRANSFER_OK)
  TransferBufferLength = 0000000f
  TransferBuffer       = 00000000
  TransferBufferMDL    = 81c87518
    00000000: 00 00 00 0a 04 00 00 00 04 00 12 00 00 07 d0
  UrbLink              = 00000000
[527991 ms] UsbSnoop - DispatchAny(f88fe610) : IRP_MJ_INTERNAL_DEVICE_CONTROL
[527991 ms] UsbSnoop - MyDispatchInternalIOCTL(f88ffe80) : fdo=82141030, Irp=81b34008, IRQL=2
[527991 ms]  >>>  URB 378 going down  >>> 
-- URB_FUNCTION_BULK_OR_INTERRUPT_TRANSFER:
  PipeHandle           = 81b38434 [endpoint 0x00000002]
  TransferFlags        = 00000000 (USBD_TRANSFER_DIRECTION_OUT, ~USBD_SHORT_TRANSFER_OK)
  TransferBufferLength = 00000007
  TransferBuffer       = 00000000
  TransferBufferMDL    = 81c87518
    00000000: 00 00 00 02 05 e0 00
  UrbLink              = 00000000
[527991 ms] UsbSnoop - MyInternalIOCTLCompletion(f88ffdb0) : fido=81b37020, Irp=81b34008, Context=81ba5ed8, IRQL=2
[527991 ms]  <<<  URB 378 coming back  <<< 
-- URB_FUNCTION_BULK_OR_INTERRUPT_TRANSFER:
  PipeHandle           = 81b38434 [endpoint 0x00000002]
  TransferFlags        = 00000000 (USBD_TRANSFER_DIRECTION_OUT, ~USBD_SHORT_TRANSFER_OK)
  TransferBufferLength = 00000007
  TransferBuffer       = 00000000
  TransferBufferMDL    = 81c87518
  UrbLink              = 00000000
[528001 ms] UsbSnoop - DispatchAny(f88fe610) : IRP_MJ_INTERNAL_DEVICE_CONTROL
[528001 ms] UsbSnoop - MyDispatchInternalIOCTL(f88ffe80) : fdo=82141030, Irp=81b34008, IRQL=2
[528001 ms]  >>>  URB 379 going down  >>> 
-- URB_FUNCTION_BULK_OR_INTERRUPT_TRANSFER:
  PipeHandle           = 81b38434 [endpoint 0x00000002]
  TransferFlags        = 00000000 (USBD_TRANSFER_DIRECTION_OUT, ~USBD_SHORT_TRANSFER_OK)
  TransferBufferLength = 00000022
  TransferBuffer       = 00000000
  TransferBufferMDL    = 81c87518
    00000000: 00 00 00 1d 04 00 00 00 17 00 09 00 00 00 06 00
    00000010: 02 00 03 00 05 00 01 00 41 00 42 00 01 00 01 00
    00000020: 01 01
  UrbLink              = 00000000
[528001 ms] UsbSnoop - MyInternalIOCTLCompletion(f88ffdb0) : fido=81b37020, Irp=81b34008, Context=81cf4d28, IRQL=2
[528001 ms]  <<<  URB 379 coming back  <<< 
-- URB_FUNCTION_BULK_OR_INTERRUPT_TRANSFER:
  PipeHandle           = 81b38434 [endpoint 0x00000002]
  TransferFlags        = 00000000 (USBD_TRANSFER_DIRECTION_OUT, ~USBD_SHORT_TRANSFER_OK)
  TransferBufferLength = 00000022
  TransferBuffer       = 00000000
  TransferBufferMDL    = 81c87518
  UrbLink              = 00000000
[528011 ms] UsbSnoop - DispatchAny(f88fe610) : IRP_MJ_INTERNAL_DEVICE_CONTROL
[528011 ms] UsbSnoop - MyDispatchInternalIOCTL(f88ffe80) : fdo=82141030, Irp=81b34008, IRQL=2
[528011 ms]  >>>  URB 380 going down  >>> 
-- URB_FUNCTION_BULK_OR_INTERRUPT_TRANSFER:
  PipeHandle           = 81b38414 [endpoint 0x00000081]
  TransferFlags        = 00000003 (USBD_TRANSFER_DIRECTION_IN, USBD_SHORT_TRANSFER_OK)
  TransferBufferLength = 00000100
  TransferBuffer       = 00000000
  TransferBufferMDL    = 81c87518
  UrbLink              = 00000000
[528011 ms] UsbSnoop - MyInternalIOCTLCompletion(f88ffdb0) : fido=81b37020, Irp=81b34008, Context=81bb4b80, IRQL=2
[528011 ms]  <<<  URB 380 coming back  <<< 
-- URB_FUNCTION_BULK_OR_INTERRUPT_TRANSFER:
  PipeHandle           = 81b38414 [endpoint 0x00000081]
  TransferFlags        = 00000003 (USBD_TRANSFER_DIRECTION_IN, USBD_SHORT_TRANSFER_OK)
  TransferBufferLength = 00000007
  TransferBuffer       = 00000000
  TransferBufferMDL    = 81c87518
    00000000: 00 00 00 02 05 e0 00
  UrbLink              = 00000000
[528051 ms] UsbSnoop - DispatchAny(f88fe610) : IRP_MJ_INTERNAL_DEVICE_CONTROL
[528051 ms] UsbSnoop - MyDispatchInternalIOCTL(f88ffe80) : fdo=82141030, Irp=81b34008, IRQL=2
[528051 ms]  >>>  URB 381 going down  >>> 
-- URB_FUNCTION_BULK_OR_INTERRUPT_TRANSFER:
  PipeHandle           = 81b38414 [endpoint 0x00000081]
  TransferFlags        = 00000003 (USBD_TRANSFER_DIRECTION_IN, USBD_SHORT_TRANSFER_OK)
  TransferBufferLength = 00000100
  TransferBuffer       = 00000000
  TransferBufferMDL    = 81c87518
  UrbLink              = 00000000
[528051 ms] UsbSnoop - MyInternalIOCTLCompletion(f88ffdb0) : fido=81b37020, Irp=81b34008, Context=81ba5ed8, IRQL=2
[528051 ms]  <<<  URB 381 coming back  <<< 
-- URB_FUNCTION_BULK_OR_INTERRUPT_TRANSFER:
  PipeHandle           = 81b38414 [endpoint 0x00000081]
  TransferFlags        = 00000003 (USBD_TRANSFER_DIRECTION_IN, USBD_SHORT_TRANSFER_OK)
  TransferBufferLength = 00000032
  TransferBuffer       = 00000000
  TransferBufferMDL    = 81c87518
    00000000: 00 00 00 2d 04 00 00 00 27 00 0a 00 01 42 00 00
    00000010: 06 00 02 00 00 04 f0 07 00 00 00 03 00 00 01 00
    00000020: 00 05 01 00 01 00 00 04 00 00 00 09 00 41 01 00
    00000030: 42 01
  UrbLink              = 00000000
[528101 ms] UsbSnoop - DispatchAny(f88fe610) : IRP_MJ_INTERNAL_DEVICE_CONTROL
[528101 ms] UsbSnoop - MyDispatchInternalIOCTL(f88ffe80) : fdo=82141030, Irp=81b34008, IRQL=2
[528101 ms]  >>>  URB 382 going down  >>> 
-- URB_FUNCTION_BULK_OR_INTERRUPT_TRANSFER:
  PipeHandle           = 81b38434 [endpoint 0x00000002]
  TransferFlags        = 00000000 (USBD_TRANSFER_DIRECTION_OUT, ~USBD_SHORT_TRANSFER_OK)
  TransferBufferLength = 00000007
  TransferBuffer       = 00000000
  TransferBufferMDL    = 81cf8160
    00000000: 00 00 00 02 05 e0 00
  UrbLink              = 00000000
[528101 ms] UsbSnoop - MyInternalIOCTLCompletion(f88ffdb0) : fido=81b37020, Irp=81b34008, Context=81bb4b80, IRQL=2
[528101 ms]  <<<  URB 382 coming back  <<< 
-- URB_FUNCTION_BULK_OR_INTERRUPT_TRANSFER:
  PipeHandle           = 81b38434 [endpoint 0x00000002]
  TransferFlags        = 00000000 (USBD_TRANSFER_DIRECTION_OUT, ~USBD_SHORT_TRANSFER_OK)
  TransferBufferLength = 00000007
  TransferBuffer       = 00000000
  TransferBufferMDL    = 81cf8160
  UrbLink              = 00000000
[528111 ms] UsbSnoop - DispatchAny(f88fe610) : IRP_MJ_INTERNAL_DEVICE_CONTROL
[528111 ms] UsbSnoop - MyDispatchInternalIOCTL(f88ffe80) : fdo=82141030, Irp=81b34008, IRQL=2
[528111 ms]  >>>  URB 383 going down  >>> 
-- URB_FUNCTION_BULK_OR_INTERRUPT_TRANSFER:
  PipeHandle           = 81b38414 [endpoint 0x00000081]
  TransferFlags        = 00000003 (USBD_TRANSFER_DIRECTION_IN, USBD_SHORT_TRANSFER_OK)
  TransferBufferLength = 00000100
  TransferBuffer       = 00000000
  TransferBufferMDL    = 81cf8160
  UrbLink              = 00000000
[528111 ms] UsbSnoop - MyInternalIOCTLCompletion(f88ffdb0) : fido=81b37020, Irp=81b34008, Context=822c0400, IRQL=2
[528111 ms]  <<<  URB 383 coming back  <<< 
-- URB_FUNCTION_BULK_OR_INTERRUPT_TRANSFER:
  PipeHandle           = 81b38414 [endpoint 0x00000081]
  TransferFlags        = 00000003 (USBD_TRANSFER_DIRECTION_IN, USBD_SHORT_TRANSFER_OK)
  TransferBufferLength = 00000035
  TransferBuffer       = 00000000
  TransferBufferMDL    = 81cf8160
    00000000: 00 00 00 30 04 00 00 00 2a 00 0a 00 04 4c e2 82
    00000010: 81 00 00 06 00 02 00 00 04 f0 07 00 01 00 03 00
    00000020: 00 01 00 00 05 01 00 01 00 00 04 00 00 00 02 00
    00000030: 41 01 00 42 01
  UrbLink              = 00000000
[528151 ms] UsbSnoop - DispatchAny(f88fe610) : IRP_MJ_INTERNAL_DEVICE_CONTROL
[528151 ms] UsbSnoop - MyDispatchInternalIOCTL(f88ffe80) : fdo=82141030, Irp=81b34008, IRQL=2
[528151 ms]  >>>  URB 384 going down  >>> 
-- URB_FUNCTION_BULK_OR_INTERRUPT_TRANSFER:
  PipeHandle           = 81b38434 [endpoint 0x00000002]
  TransferFlags        = 00000000 (USBD_TRANSFER_DIRECTION_OUT, ~USBD_SHORT_TRANSFER_OK)
  TransferBufferLength = 00000007
  TransferBuffer       = 00000000
  TransferBufferMDL    = 81cf8160
    00000000: 00 00 00 02 05 e0 00
  UrbLink              = 00000000
[528151 ms] UsbSnoop - MyInternalIOCTLCompletion(f88ffdb0) : fido=81b37020, Irp=81b34008, Context=81c34e50, IRQL=2
[528151 ms]  <<<  URB 384 coming back  <<< 
-- URB_FUNCTION_BULK_OR_INTERRUPT_TRANSFER:
  PipeHandle           = 81b38434 [endpoint 0x00000002]
  TransferFlags        = 00000000 (USBD_TRANSFER_DIRECTION_OUT, ~USBD_SHORT_TRANSFER_OK)
  TransferBufferLength = 00000007
  TransferBuffer       = 00000000
  TransferBufferMDL    = 81cf8160
  UrbLink              = 00000000
[528161 ms] UsbSnoop - DispatchAny(f88fe610) : IRP_MJ_INTERNAL_DEVICE_CONTROL
[528161 ms] UsbSnoop - MyDispatchInternalIOCTL(f88ffe80) : fdo=82141030, Irp=81b34008, IRQL=2
[528161 ms]  >>>  URB 385 going down  >>> 
-- URB_FUNCTION_BULK_OR_INTERRUPT_TRANSFER:
  PipeHandle           = 81b38414 [endpoint 0x00000081]
  TransferFlags        = 00000003 (USBD_TRANSFER_DIRECTION_IN, USBD_SHORT_TRANSFER_OK)
  TransferBufferLength = 00000100
  TransferBuffer       = 00000000
  TransferBufferMDL    = 81cf8160
  UrbLink              = 00000000
[528161 ms] UsbSnoop - MyInternalIOCTLCompletion(f88ffdb0) : fido=81b37020, Irp=81b34008, Context=81bed7d8, IRQL=2
[528161 ms]  <<<  URB 385 coming back  <<< 
-- URB_FUNCTION_BULK_OR_INTERRUPT_TRANSFER:
  PipeHandle           = 81b38414 [endpoint 0x00000081]
  TransferFlags        = 00000003 (USBD_TRANSFER_DIRECTION_IN, USBD_SHORT_TRANSFER_OK)
  TransferBufferLength = 00000035
  TransferBuffer       = 00000000
  TransferBufferMDL    = 81cf8160
    00000000: 00 00 00 30 04 00 00 00 2a 00 0a 00 04 4c e2 82
    00000010: 82 00 00 06 00 02 00 00 04 f0 07 00 01 00 03 00
    00000020: 00 01 00 00 05 01 00 01 00 00 04 00 00 00 02 00
    00000030: 41 01 00 42 01
  UrbLink              = 00000000
[528201 ms] UsbSnoop - DispatchAny(f88fe610) : IRP_MJ_INTERNAL_DEVICE_CONTROL
[528201 ms] UsbSnoop - MyDispatchInternalIOCTL(f88ffe80) : fdo=82141030, Irp=81b34008, IRQL=2
[528201 ms]  >>>  URB 386 going down  >>> 
-- URB_FUNCTION_BULK_OR_INTERRUPT_TRANSFER:
  PipeHandle           = 81b38434 [endpoint 0x00000002]
  TransferFlags        = 00000000 (USBD_TRANSFER_DIRECTION_OUT, ~USBD_SHORT_TRANSFER_OK)
  TransferBufferLength = 00000007
  TransferBuffer       = 00000000
  TransferBufferMDL    = 81cf8160
    00000000: 00 00 00 02 05 e0 00
  UrbLink              = 00000000
[528201 ms] UsbSnoop - MyInternalIOCTLCompletion(f88ffdb0) : fido=81b37020, Irp=81b34008, Context=81cf4d28, IRQL=2
[528201 ms]  <<<  URB 386 coming back  <<< 
-- URB_FUNCTION_BULK_OR_INTERRUPT_TRANSFER:
  PipeHandle           = 81b38434 [endpoint 0x00000002]
  TransferFlags        = 00000000 (USBD_TRANSFER_DIRECTION_OUT, ~USBD_SHORT_TRANSFER_OK)
  TransferBufferLength = 00000007
  TransferBuffer       = 00000000
  TransferBufferMDL    = 81cf8160
  UrbLink              = 00000000
[528211 ms] UsbSnoop - DispatchAny(f88fe610) : IRP_MJ_INTERNAL_DEVICE_CONTROL
[528211 ms] UsbSnoop - MyDispatchInternalIOCTL(f88ffe80) : fdo=82141030, Irp=81b34008, IRQL=2
[528211 ms]  >>>  URB 387 going down  >>> 
-- URB_FUNCTION_BULK_OR_INTERRUPT_TRANSFER:
  PipeHandle           = 81b38414 [endpoint 0x00000081]
  TransferFlags        = 00000003 (USBD_TRANSFER_DIRECTION_IN, USBD_SHORT_TRANSFER_OK)
  TransferBufferLength = 00000100
  TransferBuffer       = 00000000
  TransferBufferMDL    = 81cf8160
  UrbLink              = 00000000
[528211 ms] UsbSnoop - MyInternalIOCTLCompletion(f88ffdb0) : fido=81b37020, Irp=81b34008, Context=81b8aa68, IRQL=2
[528211 ms]  <<<  URB 387 coming back  <<< 
-- URB_FUNCTION_BULK_OR_INTERRUPT_TRANSFER:
  PipeHandle           = 81b38414 [endpoint 0x00000081]
  TransferFlags        = 00000003 (USBD_TRANSFER_DIRECTION_IN, USBD_SHORT_TRANSFER_OK)
  TransferBufferLength = 00000035
  TransferBuffer       = 00000000
  TransferBufferMDL    = 81cf8160
    00000000: 00 00 00 30 04 00 00 00 2a 00 0a 00 04 4c e2 82
    00000010: 83 00 00 06 00 02 00 00 04 f0 07 00 01 00 03 00
    00000020: 00 01 00 00 05 01 00 01 00 00 04 00 00 00 02 00
    00000030: 41 01 00 42 01
  UrbLink              = 00000000
[528251 ms] UsbSnoop - DispatchAny(f88fe610) : IRP_MJ_INTERNAL_DEVICE_CONTROL
[528251 ms] UsbSnoop - MyDispatchInternalIOCTL(f88ffe80) : fdo=82141030, Irp=81b34008, IRQL=2
[528251 ms]  >>>  URB 388 going down  >>> 
-- URB_FUNCTION_BULK_OR_INTERRUPT_TRANSFER:
  PipeHandle           = 81b38434 [endpoint 0x00000002]
  TransferFlags        = 00000000 (USBD_TRANSFER_DIRECTION_OUT, ~USBD_SHORT_TRANSFER_OK)
  TransferBufferLength = 00000007
  TransferBuffer       = 00000000
  TransferBufferMDL    = 81cf8160
    00000000: 00 00 00 02 05 e0 00
  UrbLink              = 00000000
[528251 ms] UsbSnoop - MyInternalIOCTLCompletion(f88ffdb0) : fido=81b37020, Irp=81b34008, Context=81bed7d8, IRQL=2
[528251 ms]  <<<  URB 388 coming back  <<< 
-- URB_FUNCTION_BULK_OR_INTERRUPT_TRANSFER:
  PipeHandle           = 81b38434 [endpoint 0x00000002]
  TransferFlags        = 00000000 (USBD_TRANSFER_DIRECTION_OUT, ~USBD_SHORT_TRANSFER_OK)
  TransferBufferLength = 00000007
  TransferBuffer       = 00000000
  TransferBufferMDL    = 81cf8160
  UrbLink              = 00000000
[528261 ms] UsbSnoop - DispatchAny(f88fe610) : IRP_MJ_INTERNAL_DEVICE_CONTROL
[528261 ms] UsbSnoop - MyDispatchInternalIOCTL(f88ffe80) : fdo=82141030, Irp=81b34008, IRQL=2
[528261 ms]  >>>  URB 389 going down  >>> 
-- URB_FUNCTION_BULK_OR_INTERRUPT_TRANSFER:
  PipeHandle           = 81b38414 [endpoint 0x00000081]
  TransferFlags        = 00000003 (USBD_TRANSFER_DIRECTION_IN, USBD_SHORT_TRANSFER_OK)
  TransferBufferLength = 00000100
  TransferBuffer       = 00000000
  TransferBufferMDL    = 81cf8160
  UrbLink              = 00000000
[528261 ms] UsbSnoop - MyInternalIOCTLCompletion(f88ffdb0) : fido=81b37020, Irp=81b34008, Context=81b8aa68, IRQL=2
[528261 ms]  <<<  URB 389 coming back  <<< 
-- URB_FUNCTION_BULK_OR_INTERRUPT_TRANSFER:
  PipeHandle           = 81b38414 [endpoint 0x00000081]
  TransferFlags        = 00000003 (USBD_TRANSFER_DIRECTION_IN, USBD_SHORT_TRANSFER_OK)
  TransferBufferLength = 00000035
  TransferBuffer       = 00000000
  TransferBufferMDL    = 81cf8160
    00000000: 00 00 00 30 04 00 00 00 2a 00 0a 00 04 4c e2 82
    00000010: 84 00 00 06 00 02 00 00 04 f0 07 00 01 00 03 00
    00000020: 00 01 00 00 05 01 00 01 00 00 04 00 00 00 02 00
    00000030: 41 01 00 42 01
  UrbLink              = 00000000
[528301 ms] UsbSnoop - DispatchAny(f88fe610) : IRP_MJ_INTERNAL_DEVICE_CONTROL
[528301 ms] UsbSnoop - MyDispatchInternalIOCTL(f88ffe80) : fdo=82141030, Irp=81b34008, IRQL=2
[528301 ms]  >>>  URB 390 going down  >>> 
-- URB_FUNCTION_BULK_OR_INTERRUPT_TRANSFER:
  PipeHandle           = 81b38434 [endpoint 0x00000002]
  TransferFlags        = 00000000 (USBD_TRANSFER_DIRECTION_OUT, ~USBD_SHORT_TRANSFER_OK)
  TransferBufferLength = 00000007
  TransferBuffer       = 00000000
  TransferBufferMDL    = 81cf8160
    00000000: 00 00 00 02 05 e0 00
  UrbLink              = 00000000
[528301 ms] UsbSnoop - MyInternalIOCTLCompletion(f88ffdb0) : fido=81b37020, Irp=81b34008, Context=81bb4b80, IRQL=2
[528301 ms]  <<<  URB 390 coming back  <<< 
-- URB_FUNCTION_BULK_OR_INTERRUPT_TRANSFER:
  PipeHandle           = 81b38434 [endpoint 0x00000002]
  TransferFlags        = 00000000 (USBD_TRANSFER_DIRECTION_OUT, ~USBD_SHORT_TRANSFER_OK)
  TransferBufferLength = 00000007
  TransferBuffer       = 00000000
  TransferBufferMDL    = 81cf8160
  UrbLink              = 00000000
[528311 ms] UsbSnoop - DispatchAny(f88fe610) : IRP_MJ_INTERNAL_DEVICE_CONTROL
[528311 ms] UsbSnoop - MyDispatchInternalIOCTL(f88ffe80) : fdo=82141030, Irp=81b34008, IRQL=2
[528311 ms]  >>>  URB 391 going down  >>> 
-- URB_FUNCTION_BULK_OR_INTERRUPT_TRANSFER:
  PipeHandle           = 81b38414 [endpoint 0x00000081]
  TransferFlags        = 00000003 (USBD_TRANSFER_DIRECTION_IN, USBD_SHORT_TRANSFER_OK)
  TransferBufferLength = 00000100
  TransferBuffer       = 00000000
  TransferBufferMDL    = 81cf8160
  UrbLink              = 00000000
[528311 ms] UsbSnoop - MyInternalIOCTLCompletion(f88ffdb0) : fido=81b37020, Irp=81b34008, Context=81ba5ed8, IRQL=2
[528311 ms]  <<<  URB 391 coming back  <<< 
-- URB_FUNCTION_BULK_OR_INTERRUPT_TRANSFER:
  PipeHandle           = 81b38414 [endpoint 0x00000081]
  TransferFlags        = 00000003 (USBD_TRANSFER_DIRECTION_IN, USBD_SHORT_TRANSFER_OK)
  TransferBufferLength = 00000035
  TransferBuffer       = 00000000
  TransferBufferMDL    = 81cf8160
    00000000: 00 00 00 30 04 00 00 00 2a 00 0a 00 04 4c e2 82
    00000010: 85 00 00 06 00 02 00 00 04 f0 07 00 01 00 03 00
    00000020: 00 01 00 00 05 01 00 01 00 00 04 00 00 00 02 00
    00000030: 41 01 00 42 01
  UrbLink              = 00000000
[528351 ms] UsbSnoop - DispatchAny(f88fe610) : IRP_MJ_INTERNAL_DEVICE_CONTROL
[528351 ms] UsbSnoop - MyDispatchInternalIOCTL(f88ffe80) : fdo=82141030, Irp=822dc2d0, IRQL=2
[528351 ms]  >>>  URB 392 going down  >>> 
-- URB_FUNCTION_BULK_OR_INTERRUPT_TRANSFER:
  PipeHandle           = 81b38434 [endpoint 0x00000002]
  TransferFlags        = 00000000 (USBD_TRANSFER_DIRECTION_OUT, ~USBD_SHORT_TRANSFER_OK)
  TransferBufferLength = 00000007
  TransferBuffer       = 00000000
  TransferBufferMDL    = 81cf8160
    00000000: 00 00 00 02 05 e0 00
  UrbLink              = 00000000
[528352 ms] UsbSnoop - MyInternalIOCTLCompletion(f88ffdb0) : fido=81b37020, Irp=822dc2d0, Context=81b8aa68, IRQL=2
[528352 ms]  <<<  URB 392 coming back  <<< 
-- URB_FUNCTION_BULK_OR_INTERRUPT_TRANSFER:
  PipeHandle           = 81b38434 [endpoint 0x00000002]
  TransferFlags        = 00000000 (USBD_TRANSFER_DIRECTION_OUT, ~USBD_SHORT_TRANSFER_OK)
  TransferBufferLength = 00000007
  TransferBuffer       = 00000000
  TransferBufferMDL    = 81cf8160
  UrbLink              = 00000000
[528361 ms] UsbSnoop - DispatchAny(f88fe610) : IRP_MJ_INTERNAL_DEVICE_CONTROL
[528361 ms] UsbSnoop - MyDispatchInternalIOCTL(f88ffe80) : fdo=82141030, Irp=822dc2d0, IRQL=2
[528361 ms]  >>>  URB 393 going down  >>> 
-- URB_FUNCTION_BULK_OR_INTERRUPT_TRANSFER:
  PipeHandle           = 81b38414 [endpoint 0x00000081]
  TransferFlags        = 00000003 (USBD_TRANSFER_DIRECTION_IN, USBD_SHORT_TRANSFER_OK)
  TransferBufferLength = 00000100
  TransferBuffer       = 00000000
  TransferBufferMDL    = 81cf8160
  UrbLink              = 00000000
[528362 ms] UsbSnoop - MyInternalIOCTLCompletion(f88ffdb0) : fido=81b37020, Irp=822dc2d0, Context=81ba5ed8, IRQL=2
[528362 ms]  <<<  URB 393 coming back  <<< 
-- URB_FUNCTION_BULK_OR_INTERRUPT_TRANSFER:
  PipeHandle           = 81b38414 [endpoint 0x00000081]
  TransferFlags        = 00000003 (USBD_TRANSFER_DIRECTION_IN, USBD_SHORT_TRANSFER_OK)
  TransferBufferLength = 00000035
  TransferBuffer       = 00000000
  TransferBufferMDL    = 81cf8160
    00000000: 00 00 00 30 04 00 00 00 2a 00 0a 00 04 4c e2 82
    00000010: 86 00 00 06 00 02 00 00 04 f0 07 00 01 00 03 00
    00000020: 00 01 00 00 05 01 00 01 00 00 04 00 00 00 02 00
    00000030: 41 01 00 42 01
  UrbLink              = 00000000
[528401 ms] UsbSnoop - DispatchAny(f88fe610) : IRP_MJ_INTERNAL_DEVICE_CONTROL
[528401 ms] UsbSnoop - MyDispatchInternalIOCTL(f88ffe80) : fdo=82141030, Irp=822dc2d0, IRQL=2
[528401 ms]  >>>  URB 394 going down  >>> 
-- URB_FUNCTION_BULK_OR_INTERRUPT_TRANSFER:
  PipeHandle           = 81b38434 [endpoint 0x00000002]
  TransferFlags        = 00000000 (USBD_TRANSFER_DIRECTION_OUT, ~USBD_SHORT_TRANSFER_OK)
  TransferBufferLength = 00000007
  TransferBuffer       = 00000000
  TransferBufferMDL    = 81cf8160
    00000000: 00 00 00 02 05 e0 00
  UrbLink              = 00000000
[528402 ms] UsbSnoop - MyInternalIOCTLCompletion(f88ffdb0) : fido=81b37020, Irp=822dc2d0, Context=81c34e50, IRQL=2
[528402 ms]  <<<  URB 394 coming back  <<< 
-- URB_FUNCTION_BULK_OR_INTERRUPT_TRANSFER:
  PipeHandle           = 81b38434 [endpoint 0x00000002]
  TransferFlags        = 00000000 (USBD_TRANSFER_DIRECTION_OUT, ~USBD_SHORT_TRANSFER_OK)
  TransferBufferLength = 00000007
  TransferBuffer       = 00000000
  TransferBufferMDL    = 81cf8160
  UrbLink              = 00000000
[528411 ms] UsbSnoop - DispatchAny(f88fe610) : IRP_MJ_INTERNAL_DEVICE_CONTROL
[528412 ms] UsbSnoop - MyDispatchInternalIOCTL(f88ffe80) : fdo=82141030, Irp=822dc2d0, IRQL=2
[528412 ms]  >>>  URB 395 going down  >>> 
-- URB_FUNCTION_BULK_OR_INTERRUPT_TRANSFER:
  PipeHandle           = 81b38414 [endpoint 0x00000081]
  TransferFlags        = 00000003 (USBD_TRANSFER_DIRECTION_IN, USBD_SHORT_TRANSFER_OK)
  TransferBufferLength = 00000100
  TransferBuffer       = 00000000
  TransferBufferMDL    = 81cf8160
  UrbLink              = 00000000
[528437 ms] UsbSnoop - MyInternalIOCTLCompletion(f88ffdb0) : fido=81b37020, Irp=822dc2d0, Context=81cf4d28, IRQL=2
[528437 ms]  <<<  URB 395 coming back  <<< 
-- URB_FUNCTION_BULK_OR_INTERRUPT_TRANSFER:
  PipeHandle           = 81b38414 [endpoint 0x00000081]
  TransferFlags        = 00000003 (USBD_TRANSFER_DIRECTION_IN, USBD_SHORT_TRANSFER_OK)
  TransferBufferLength = 00000037
  TransferBuffer       = 00000000
  TransferBufferMDL    = 81cf8160
    00000000: 00 00 00 32 04 00 00 00 2c 00 0a 00 06 43 6f 6e
    00000010: 69 63 73 00 00 06 00 02 00 00 04 f0 07 00 24 00
    00000020: 03 00 00 01 01 00 05 01 00 01 00 00 04 00 00 50
    00000030: 79 00 41 01 00 42 01
  UrbLink              = 00000000
[528472 ms] UsbSnoop - DispatchAny(f88fe610) : IRP_MJ_INTERNAL_DEVICE_CONTROL
[528472 ms] UsbSnoop - MyDispatchInternalIOCTL(f88ffe80) : fdo=82141030, Irp=822dc2d0, IRQL=2
[528472 ms]  >>>  URB 396 going down  >>> 
-- URB_FUNCTION_BULK_OR_INTERRUPT_TRANSFER:
  PipeHandle           = 81b38434 [endpoint 0x00000002]
  TransferFlags        = 00000000 (USBD_TRANSFER_DIRECTION_OUT, ~USBD_SHORT_TRANSFER_OK)
  TransferBufferLength = 00000007
  TransferBuffer       = 00000000
  TransferBufferMDL    = 81cf8160
    00000000: 00 00 00 02 05 e0 00
  UrbLink              = 00000000
[528472 ms] UsbSnoop - MyInternalIOCTLCompletion(f88ffdb0) : fido=81b37020, Irp=822dc2d0, Context=81ba5ed8, IRQL=2
[528472 ms]  <<<  URB 396 coming back  <<< 
-- URB_FUNCTION_BULK_OR_INTERRUPT_TRANSFER:
  PipeHandle           = 81b38434 [endpoint 0x00000002]
  TransferFlags        = 00000000 (USBD_TRANSFER_DIRECTION_OUT, ~USBD_SHORT_TRANSFER_OK)
  TransferBufferLength = 00000007
  TransferBuffer       = 00000000
  TransferBufferMDL    = 81cf8160
  UrbLink              = 00000000
[528482 ms] UsbSnoop - DispatchAny(f88fe610) : IRP_MJ_INTERNAL_DEVICE_CONTROL
[528482 ms] UsbSnoop - MyDispatchInternalIOCTL(f88ffe80) : fdo=82141030, Irp=822dc2d0, IRQL=2
[528482 ms]  >>>  URB 397 going down  >>> 
-- URB_FUNCTION_BULK_OR_INTERRUPT_TRANSFER:
  PipeHandle           = 81b38414 [endpoint 0x00000081]
  TransferFlags        = 00000003 (USBD_TRANSFER_DIRECTION_IN, USBD_SHORT_TRANSFER_OK)
  TransferBufferLength = 00000100
  TransferBuffer       = 00000000
  TransferBufferMDL    = 81cf8160
  UrbLink              = 00000000
[528482 ms] UsbSnoop - MyInternalIOCTLCompletion(f88ffdb0) : fido=81b37020, Irp=822dc2d0, Context=81cf4d28, IRQL=2
[528482 ms]  <<<  URB 397 coming back  <<< 
-- URB_FUNCTION_BULK_OR_INTERRUPT_TRANSFER:
  PipeHandle           = 81b38414 [endpoint 0x00000081]
  TransferFlags        = 00000003 (USBD_TRANSFER_DIRECTION_IN, USBD_SHORT_TRANSFER_OK)
  TransferBufferLength = 0000000b
  TransferBuffer       = 00000000
  TransferBufferMDL    = 81cf8160
    00000000: 00 00 00 06 04 00 00 00 00 dd 00
  UrbLink              = 00000000
[528522 ms] UsbSnoop - DispatchAny(f88fe610) : IRP_MJ_INTERNAL_DEVICE_CONTROL
[528522 ms] UsbSnoop - MyDispatchInternalIOCTL(f88ffe80) : fdo=82141030, Irp=822dc2d0, IRQL=2
[528522 ms]  >>>  URB 398 going down  >>> 
-- URB_FUNCTION_BULK_OR_INTERRUPT_TRANSFER:
  PipeHandle           = 81b38434 [endpoint 0x00000002]
  TransferFlags        = 00000000 (USBD_TRANSFER_DIRECTION_OUT, ~USBD_SHORT_TRANSFER_OK)
  TransferBufferLength = 00000007
  TransferBuffer       = 00000000
  TransferBufferMDL    = 81cf8160
    00000000: 00 00 00 02 05 e0 00
  UrbLink              = 00000000
[528522 ms] UsbSnoop - MyInternalIOCTLCompletion(f88ffdb0) : fido=81b37020, Irp=822dc2d0, Context=81bed7d8, IRQL=2
[528522 ms]  <<<  URB 398 coming back  <<< 
-- URB_FUNCTION_BULK_OR_INTERRUPT_TRANSFER:
  PipeHandle           = 81b38434 [endpoint 0x00000002]
  TransferFlags        = 00000000 (USBD_TRANSFER_DIRECTION_OUT, ~USBD_SHORT_TRANSFER_OK)
  TransferBufferLength = 00000007
  TransferBuffer       = 00000000
  TransferBufferMDL    = 81cf8160
  UrbLink              = 00000000
[528783 ms] UsbSnoop - DispatchAny(f88fe610) : IRP_MJ_INTERNAL_DEVICE_CONTROL
[528783 ms] UsbSnoop - MyDispatchInternalIOCTL(f88ffe80) : fdo=82141030, Irp=822fa008, IRQL=2
[528783 ms]  >>>  URB 399 going down  >>> 
-- URB_FUNCTION_BULK_OR_INTERRUPT_TRANSFER:
  PipeHandle           = 81b38434 [endpoint 0x00000002]
  TransferFlags        = 00000000 (USBD_TRANSFER_DIRECTION_OUT, ~USBD_SHORT_TRANSFER_OK)
  TransferBufferLength = 00000009
  TransferBuffer       = 00000000
  TransferBufferMDL    = 81c87518
    00000000: 00 00 00 04 01 00 00 04 00
  UrbLink              = 00000000
[528783 ms] UsbSnoop - MyInternalIOCTLCompletion(f88ffdb0) : fido=81b37020, Irp=822fa008, Context=81bb4b80, IRQL=2
[528783 ms]  <<<  URB 399 coming back  <<< 
-- URB_FUNCTION_BULK_OR_INTERRUPT_TRANSFER:
  PipeHandle           = 81b38434 [endpoint 0x00000002]
  TransferFlags        = 00000000 (USBD_TRANSFER_DIRECTION_OUT, ~USBD_SHORT_TRANSFER_OK)
  TransferBufferLength = 00000009
  TransferBuffer       = 00000000
  TransferBufferMDL    = 81c87518
  UrbLink              = 00000000
[528785 ms] UsbSnoop - DispatchAny(f88fe610) : IRP_MJ_INTERNAL_DEVICE_CONTROL
[528785 ms] UsbSnoop - MyDispatchInternalIOCTL(f88ffe80) : fdo=82141030, Irp=822dc2d0, IRQL=2
[528785 ms]  >>>  URB 400 going down  >>> 
-- URB_FUNCTION_BULK_OR_INTERRUPT_TRANSFER:
  PipeHandle           = 81b38414 [endpoint 0x00000081]
  TransferFlags        = 00000003 (USBD_TRANSFER_DIRECTION_IN, USBD_SHORT_TRANSFER_OK)
  TransferBufferLength = 00000100
  TransferBuffer       = 00000000
  TransferBufferMDL    = 81cf8160
  UrbLink              = 00000000
[528795 ms] UsbSnoop - MyInternalIOCTLCompletion(f88ffdb0) : fido=81b37020, Irp=822dc2d0, Context=81c34e50, IRQL=2
[528795 ms]  <<<  URB 400 coming back  <<< 
-- URB_FUNCTION_BULK_OR_INTERRUPT_TRANSFER:
  PipeHandle           = 81b38414 [endpoint 0x00000081]
  TransferFlags        = 00000003 (USBD_TRANSFER_DIRECTION_IN, USBD_SHORT_TRANSFER_OK)
  TransferBufferLength = 00000009
  TransferBuffer       = 00000000
  TransferBufferMDL    = 81cf8160
    00000000: 00 00 00 04 02 00 00 00 fa
  UrbLink              = 00000000
[528822 ms] UsbSnoop - DispatchAny(f88fe610) : IRP_MJ_INTERNAL_DEVICE_CONTROL
[528822 ms] UsbSnoop - MyDispatchInternalIOCTL(f88ffe80) : fdo=82141030, Irp=822dc2d0, IRQL=2
[528822 ms]  >>>  URB 401 going down  >>> 
-- URB_FUNCTION_BULK_OR_INTERRUPT_TRANSFER:
  PipeHandle           = 81b38434 [endpoint 0x00000002]
  TransferFlags        = 00000000 (USBD_TRANSFER_DIRECTION_OUT, ~USBD_SHORT_TRANSFER_OK)
  TransferBufferLength = 00000015
  TransferBuffer       = 00000000
  TransferBufferMDL    = 81cf8160
    00000000: 00 00 00 10 04 00 00 00 0a 00 01 00 03 00 01 00
    00000010: 00 00 00 07 d0
  UrbLink              = 00000000
[528822 ms] UsbSnoop - MyInternalIOCTLCompletion(f88ffdb0) : fido=81b37020, Irp=822dc2d0, Context=81bed7d8, IRQL=2
[528822 ms]  <<<  URB 401 coming back  <<< 
-- URB_FUNCTION_BULK_OR_INTERRUPT_TRANSFER:
  PipeHandle           = 81b38434 [endpoint 0x00000002]
  TransferFlags        = 00000000 (USBD_TRANSFER_DIRECTION_OUT, ~USBD_SHORT_TRANSFER_OK)
  TransferBufferLength = 00000015
  TransferBuffer       = 00000000
  TransferBufferMDL    = 81cf8160
  UrbLink              = 00000000
[528832 ms] UsbSnoop - DispatchAny(f88fe610) : IRP_MJ_INTERNAL_DEVICE_CONTROL
[528832 ms] UsbSnoop - MyDispatchInternalIOCTL(f88ffe80) : fdo=82141030, Irp=822dc2d0, IRQL=2
[528832 ms]  >>>  URB 402 going down  >>> 
-- URB_FUNCTION_BULK_OR_INTERRUPT_TRANSFER:
  PipeHandle           = 81b38414 [endpoint 0x00000081]
  TransferFlags        = 00000003 (USBD_TRANSFER_DIRECTION_IN, USBD_SHORT_TRANSFER_OK)
  TransferBufferLength = 00000100
  TransferBuffer       = 00000000
  TransferBufferMDL    = 81cf8160
  UrbLink              = 00000000
[528832 ms] UsbSnoop - MyInternalIOCTLCompletion(f88ffdb0) : fido=81b37020, Irp=822dc2d0, Context=81c34e50, IRQL=2
[528832 ms]  <<<  URB 402 coming back  <<< 
-- URB_FUNCTION_BULK_OR_INTERRUPT_TRANSFER:
  PipeHandle           = 81b38414 [endpoint 0x00000081]
  TransferFlags        = 00000003 (USBD_TRANSFER_DIRECTION_IN, USBD_SHORT_TRANSFER_OK)
  TransferBufferLength = 00000007
  TransferBuffer       = 00000000
  TransferBufferMDL    = 81cf8160
    00000000: 00 00 00 02 05 e0 00
  UrbLink              = 00000000
[528872 ms] UsbSnoop - DispatchAny(f88fe610) : IRP_MJ_INTERNAL_DEVICE_CONTROL
[528872 ms] UsbSnoop - MyDispatchInternalIOCTL(f88ffe80) : fdo=82141030, Irp=822dc2d0, IRQL=2
[528872 ms]  >>>  URB 403 going down  >>> 
-- URB_FUNCTION_BULK_OR_INTERRUPT_TRANSFER:
  PipeHandle           = 81b38414 [endpoint 0x00000081]
  TransferFlags        = 00000003 (USBD_TRANSFER_DIRECTION_IN, USBD_SHORT_TRANSFER_OK)
  TransferBufferLength = 00000100
  TransferBuffer       = 00000000
  TransferBufferMDL    = 81cf8160
  UrbLink              = 00000000
[528872 ms] UsbSnoop - MyInternalIOCTLCompletion(f88ffdb0) : fido=81b37020, Irp=822dc2d0, Context=81b8aa68, IRQL=2
[528872 ms]  <<<  URB 403 coming back  <<< 
-- URB_FUNCTION_BULK_OR_INTERRUPT_TRANSFER:
  PipeHandle           = 81b38414 [endpoint 0x00000081]
  TransferFlags        = 00000003 (USBD_TRANSFER_DIRECTION_IN, USBD_SHORT_TRANSFER_OK)
  TransferBufferLength = 0000000f
  TransferBuffer       = 00000000
  TransferBufferMDL    = 81cf8160
    00000000: 00 00 00 0a 04 00 00 00 04 00 12 00 00 07 d0
  UrbLink              = 00000000
[528912 ms] UsbSnoop - DispatchAny(f88fe610) : IRP_MJ_INTERNAL_DEVICE_CONTROL
[528912 ms] UsbSnoop - MyDispatchInternalIOCTL(f88ffe80) : fdo=82141030, Irp=81b5d008, IRQL=2
[528912 ms]  >>>  URB 404 going down  >>> 
-- URB_FUNCTION_BULK_OR_INTERRUPT_TRANSFER:
  PipeHandle           = 81b38434 [endpoint 0x00000002]
  TransferFlags        = 00000000 (USBD_TRANSFER_DIRECTION_OUT, ~USBD_SHORT_TRANSFER_OK)
  TransferBufferLength = 00000007
  TransferBuffer       = 00000000
  TransferBufferMDL    = 81cf8160
    00000000: 00 00 00 02 05 e0 00
  UrbLink              = 00000000
[528913 ms] UsbSnoop - MyInternalIOCTLCompletion(f88ffdb0) : fido=81b37020, Irp=81b5d008, Context=81ba5ed8, IRQL=2
[528913 ms]  <<<  URB 404 coming back  <<< 
-- URB_FUNCTION_BULK_OR_INTERRUPT_TRANSFER:
  PipeHandle           = 81b38434 [endpoint 0x00000002]
  TransferFlags        = 00000000 (USBD_TRANSFER_DIRECTION_OUT, ~USBD_SHORT_TRANSFER_OK)
  TransferBufferLength = 00000007
  TransferBuffer       = 00000000
  TransferBufferMDL    = 81cf8160
  UrbLink              = 00000000
[528922 ms] UsbSnoop - DispatchAny(f88fe610) : IRP_MJ_INTERNAL_DEVICE_CONTROL
[528922 ms] UsbSnoop - MyDispatchInternalIOCTL(f88ffe80) : fdo=82141030, Irp=81b5d008, IRQL=2
[528922 ms]  >>>  URB 405 going down  >>> 
-- URB_FUNCTION_BULK_OR_INTERRUPT_TRANSFER:
  PipeHandle           = 81b38434 [endpoint 0x00000002]
  TransferFlags        = 00000000 (USBD_TRANSFER_DIRECTION_OUT, ~USBD_SHORT_TRANSFER_OK)
  TransferBufferLength = 0000000f
  TransferBuffer       = 00000000
  TransferBufferMDL    = 81cf8160
    00000000: 00 00 00 0a 04 00 00 00 04 00 07 00 01 00 0e
  UrbLink              = 00000000
[528923 ms] UsbSnoop - MyInternalIOCTLCompletion(f88ffdb0) : fido=81b37020, Irp=81b5d008, Context=81bb4b80, IRQL=2
[528923 ms]  <<<  URB 405 coming back  <<< 
-- URB_FUNCTION_BULK_OR_INTERRUPT_TRANSFER:
  PipeHandle           = 81b38434 [endpoint 0x00000002]
  TransferFlags        = 00000000 (USBD_TRANSFER_DIRECTION_OUT, ~USBD_SHORT_TRANSFER_OK)
  TransferBufferLength = 0000000f
  TransferBuffer       = 00000000
  TransferBufferMDL    = 81cf8160
  UrbLink              = 00000000
[528932 ms] UsbSnoop - DispatchAny(f88fe610) : IRP_MJ_INTERNAL_DEVICE_CONTROL
[528932 ms] UsbSnoop - MyDispatchInternalIOCTL(f88ffe80) : fdo=82141030, Irp=81b5d008, IRQL=2
[528932 ms]  >>>  URB 406 going down  >>> 
-- URB_FUNCTION_BULK_OR_INTERRUPT_TRANSFER:
  PipeHandle           = 81b38414 [endpoint 0x00000081]
  TransferFlags        = 00000003 (USBD_TRANSFER_DIRECTION_IN, USBD_SHORT_TRANSFER_OK)
  TransferBufferLength = 00000100
  TransferBuffer       = 00000000
  TransferBufferMDL    = 81cf8160
  UrbLink              = 00000000
[528934 ms] UsbSnoop - MyInternalIOCTLCompletion(f88ffdb0) : fido=81b37020, Irp=81b5d008, Context=81bed7d8, IRQL=2
[528934 ms]  <<<  URB 406 coming back  <<< 
-- URB_FUNCTION_BULK_OR_INTERRUPT_TRANSFER:
  PipeHandle           = 81b38414 [endpoint 0x00000081]
  TransferFlags        = 00000003 (USBD_TRANSFER_DIRECTION_IN, USBD_SHORT_TRANSFER_OK)
  TransferBufferLength = 00000007
  TransferBuffer       = 00000000
  TransferBufferMDL    = 81cf8160
    00000000: 00 00 00 02 05 e0 00
  UrbLink              = 00000000
[528972 ms] UsbSnoop - DispatchAny(f88fe610) : IRP_MJ_INTERNAL_DEVICE_CONTROL
[528972 ms] UsbSnoop - MyDispatchInternalIOCTL(f88ffe80) : fdo=82141030, Irp=81b5d008, IRQL=2
[528972 ms]  >>>  URB 407 going down  >>> 
-- URB_FUNCTION_BULK_OR_INTERRUPT_TRANSFER:
  PipeHandle           = 81b38414 [endpoint 0x00000081]
  TransferFlags        = 00000003 (USBD_TRANSFER_DIRECTION_IN, USBD_SHORT_TRANSFER_OK)
  TransferBufferLength = 00000100
  TransferBuffer       = 00000000
  TransferBufferMDL    = 81cf8160
  UrbLink              = 00000000
[528973 ms] UsbSnoop - MyInternalIOCTLCompletion(f88ffdb0) : fido=81b37020, Irp=81b5d008, Context=81ba5ed8, IRQL=2
[528973 ms]  <<<  URB 407 coming back  <<< 
-- URB_FUNCTION_BULK_OR_INTERRUPT_TRANSFER:
  PipeHandle           = 81b38414 [endpoint 0x00000081]
  TransferFlags        = 00000003 (USBD_TRANSFER_DIRECTION_IN, USBD_SHORT_TRANSFER_OK)
  TransferBufferLength = 0000000f
  TransferBuffer       = 00000000
  TransferBufferMDL    = 81cf8160
    00000000: 00 00 00 0a 04 00 00 00 04 bb 00 00 01 d4 c0
  UrbLink              = 00000000
[529012 ms] UsbSnoop - DispatchAny(f88fe610) : IRP_MJ_INTERNAL_DEVICE_CONTROL
[529012 ms] UsbSnoop - MyDispatchInternalIOCTL(f88ffe80) : fdo=82141030, Irp=81b5d008, IRQL=2
[529012 ms]  >>>  URB 408 going down  >>> 
-- URB_FUNCTION_BULK_OR_INTERRUPT_TRANSFER:
  PipeHandle           = 81b38434 [endpoint 0x00000002]
  TransferFlags        = 00000000 (USBD_TRANSFER_DIRECTION_OUT, ~USBD_SHORT_TRANSFER_OK)
  TransferBufferLength = 00000007
  TransferBuffer       = 00000000
  TransferBufferMDL    = 81cf8160
    00000000: 00 00 00 02 05 e0 00
  UrbLink              = 00000000
[529013 ms] UsbSnoop - MyInternalIOCTLCompletion(f88ffdb0) : fido=81b37020, Irp=81b5d008, Context=81bed7d8, IRQL=2
[529013 ms]  <<<  URB 408 coming back  <<< 
-- URB_FUNCTION_BULK_OR_INTERRUPT_TRANSFER:
  PipeHandle           = 81b38434 [endpoint 0x00000002]
  TransferFlags        = 00000000 (USBD_TRANSFER_DIRECTION_OUT, ~USBD_SHORT_TRANSFER_OK)
  TransferBufferLength = 00000007
  TransferBuffer       = 00000000
  TransferBufferMDL    = 81cf8160
  UrbLink              = 00000000
[529022 ms] UsbSnoop - DispatchAny(f88fe610) : IRP_MJ_INTERNAL_DEVICE_CONTROL
[529022 ms] UsbSnoop - MyDispatchInternalIOCTL(f88ffe80) : fdo=82141030, Irp=81b5d008, IRQL=2
[529022 ms]  >>>  URB 409 going down  >>> 
-- URB_FUNCTION_BULK_OR_INTERRUPT_TRANSFER:
  PipeHandle           = 81b38414 [endpoint 0x00000081]
  TransferFlags        = 00000003 (USBD_TRANSFER_DIRECTION_IN, USBD_SHORT_TRANSFER_OK)
  TransferBufferLength = 00000100
  TransferBuffer       = 00000000
  TransferBufferMDL    = 81cf8160
  UrbLink              = 00000000
[529023 ms] UsbSnoop - MyInternalIOCTLCompletion(f88ffdb0) : fido=81b37020, Irp=81b5d008, Context=81cf4d28, IRQL=2
[529023 ms]  <<<  URB 409 coming back  <<< 
-- URB_FUNCTION_BULK_OR_INTERRUPT_TRANSFER:
  PipeHandle           = 81b38414 [endpoint 0x00000081]
  TransferFlags        = 00000003 (USBD_TRANSFER_DIRECTION_IN, USBD_SHORT_TRANSFER_OK)
  TransferBufferLength = 0000001a
  TransferBuffer       = 00000000
  TransferBufferMDL    = 81cf8160
    00000000: 00 00 00 15 04 00 00 00 0f 00 08 00 01 00 0e 00
    00000010: 00 08 00 00 00 00 00 00 5e d3
  UrbLink              = 00000000
[529062 ms] UsbSnoop - DispatchAny(f88fe610) : IRP_MJ_INTERNAL_DEVICE_CONTROL
[529062 ms] UsbSnoop - MyDispatchInternalIOCTL(f88ffe80) : fdo=82141030, Irp=81b5d008, IRQL=2
[529063 ms]  >>>  URB 410 going down  >>> 
-- URB_FUNCTION_BULK_OR_INTERRUPT_TRANSFER:
  PipeHandle           = 81b38434 [endpoint 0x00000002]
  TransferFlags        = 00000000 (USBD_TRANSFER_DIRECTION_OUT, ~USBD_SHORT_TRANSFER_OK)
  TransferBufferLength = 00000007
  TransferBuffer       = 00000000
  TransferBufferMDL    = 81cf8160
    00000000: 00 00 00 02 05 e0 00
  UrbLink              = 00000000
[529063 ms] UsbSnoop - MyInternalIOCTLCompletion(f88ffdb0) : fido=81b37020, Irp=81b5d008, Context=81bb4b80, IRQL=2
[529063 ms]  <<<  URB 410 coming back  <<< 
-- URB_FUNCTION_BULK_OR_INTERRUPT_TRANSFER:
  PipeHandle           = 81b38434 [endpoint 0x00000002]
  TransferFlags        = 00000000 (USBD_TRANSFER_DIRECTION_OUT, ~USBD_SHORT_TRANSFER_OK)
  TransferBufferLength = 00000007
  TransferBuffer       = 00000000
  TransferBufferMDL    = 81cf8160
  UrbLink              = 00000000
[529079 ms] UsbSnoop - DispatchAny(f88fe610) : IRP_MJ_INTERNAL_DEVICE_CONTROL
[529079 ms] UsbSnoop - MyDispatchInternalIOCTL(f88ffe80) : fdo=82141030, Irp=822fa008, IRQL=0
[529079 ms]  >>>  URB 411 going down  >>> 
-- URB_FUNCTION_RESET_PIPE:
  PipeHandle = 81b38414 [endpoint 0x00000081]
[529131 ms] UsbSnoop - MyInternalIOCTLCompletion(f88ffdb0) : fido=00000000, Irp=822fa008, Context=81b8aa68, IRQL=0
[529131 ms]  <<<  URB 411 coming back  <<< 
-- URB_FUNCTION_RESET_PIPE:
[529131 ms] UsbSnoop - DispatchAny(f88fe610) : IRP_MJ_INTERNAL_DEVICE_CONTROL
[529131 ms] UsbSnoop - MyDispatchInternalIOCTL(f88ffe80) : fdo=82141030, Irp=822fa008, IRQL=0
[529131 ms]  >>>  URB 412 going down  >>> 
-- URB_FUNCTION_RESET_PIPE:
  PipeHandle = 81b38434 [endpoint 0x00000002]
[529132 ms] UsbSnoop - MyInternalIOCTLCompletion(f88ffdb0) : fido=00000000, Irp=822fa008, Context=81bb4b80, IRQL=0
[529132 ms]  <<<  URB 412 coming back  <<< 
-- URB_FUNCTION_RESET_PIPE:
[529132 ms] UsbSnoop - DispatchAny(f88fe610) : IRP_MJ_INTERNAL_DEVICE_CONTROL
[529132 ms] UsbSnoop - MyDispatchInternalIOCTL(f88ffe80) : fdo=82141030, Irp=822fa008, IRQL=0
