[0 ms] UsbSnoop compiled on Jan 18 2003 22:41:32 loading
[0 ms] UsbSnoop - DriverEntry(f9e0cc40) : Windows NT WDM version 1.32
[3 ms] UsbSnoop - AddDevice(f9e0cf50) : DriverObject 81532030, pdo 815e4d28
[3 ms] UsbSnoop - DispatchAny(f9e0a610) : IRP_MJ_PNP (0x00000018)
[3 ms] UsbSnoop - MyDispatchPNP(f9e0cee0) : IRP_MJ_PNP (0x00000018)
[3 ms] UsbSnoop - DispatchAny(f9e0a610) : IRP_MJ_PNP (IRP_MN_QUERY_RESOURCE_REQUIREMENTS)
[3 ms] UsbSnoop - MyDispatchPNP(f9e0cee0) : IRP_MJ_PNP (IRP_MN_QUERY_RESOURCE_REQUIREMENTS)
[4 ms] UsbSnoop - DispatchAny(f9e0a610) : IRP_MJ_PNP (IRP_MN_FILTER_RESOURCE_REQUIREMENTS)
[4 ms] UsbSnoop - MyDispatchPNP(f9e0cee0) : IRP_MJ_PNP (IRP_MN_FILTER_RESOURCE_REQUIREMENTS)
[4 ms] UsbSnoop - DispatchAny(f9e0a610) : IRP_MJ_PNP (IRP_MN_START_DEVICE)
[4 ms] UsbSnoop - MyDispatchPNP(f9e0cee0) : IRP_MJ_PNP (IRP_MN_START_DEVICE)
[4 ms] UsbSnoop - DispatchAny(f9e0a610) : IRP_MJ_PNP (IRP_MN_QUERY_CAPABILITIES)
[4 ms] UsbSnoop - MyDispatchPNP(f9e0cee0) : IRP_MJ_PNP (IRP_MN_QUERY_CAPABILITIES)
[4 ms] UsbSnoop - DispatchAny(f9e0a610) : IRP_MJ_PNP (IRP_MN_QUERY_PNP_DEVICE_STATE)
[4 ms] UsbSnoop - MyDispatchPNP(f9e0cee0) : IRP_MJ_PNP (IRP_MN_QUERY_PNP_DEVICE_STATE)
[4 ms] UsbSnoop - DispatchAny(f9e0a610) : IRP_MJ_PNP (IRP_MN_QUERY_DEVICE_RELATIONS)
[4 ms] UsbSnoop - MyDispatchPNP(f9e0cee0) : IRP_MJ_PNP (IRP_MN_QUERY_DEVICE_RELATIONS)
[5 ms] UsbSnoop - DispatchAny(f9e0a610) : IRP_MJ_SYSTEM_CONTROL
[13234 ms] UsbSnoop - DispatchAny(f9e0a610) : IRP_MJ_INTERNAL_DEVICE_CONTROL
[13234 ms] UsbSnoop - MyDispatchInternalIOCTL(f9e0be80) : fdo=815e4d28, Irp=8143e848, IRQL=0
[13234 ms]  >>>  URB 1 going down  >>> 
-- URB_FUNCTION_GET_DESCRIPTOR_FROM_DEVICE:
  TransferBufferLength = 00000009
  TransferBuffer       = f33fa38c
  TransferBufferMDL    = 00000000
  Index                = 00000001
  DescriptorType       = 00000002 (USB_CONFIGURATION_DESCRIPTOR_TYPE)
  LanguageId           = 00000000
[13237 ms] UsbSnoop - MyInternalIOCTLCompletion(f9e0bdb0) : fido=00000000, Irp=8143e848, Context=814dee38, IRQL=2
[13237 ms]  <<<  URB 1 coming back  <<< 
-- URB_FUNCTION_CONTROL_TRANSFER:
  PipeHandle           = 8158e6f8
  TransferFlags        = 8110396b (USBD_TRANSFER_DIRECTION_IN, USBD_SHORT_TRANSFER_OK)
  TransferBufferLength = 00000009
  TransferBuffer       = f33fa38c
  TransferBufferMDL    = 816b7a80
    00000000: 09 02 23 00 01 01 00 e0 00
  UrbLink              = 00000000
  SetupPacket          =
    00000000: 80 06 01 02 00 00 09 00
[13237 ms] UsbSnoop - DispatchAny(f9e0a610) : IRP_MJ_INTERNAL_DEVICE_CONTROL
[13237 ms] UsbSnoop - MyDispatchInternalIOCTL(f9e0be80) : fdo=815e4d28, Irp=8143e848, IRQL=0
[13237 ms]  >>>  URB 2 going down  >>> 
-- URB_FUNCTION_GET_DESCRIPTOR_FROM_DEVICE:
  TransferBufferLength = 00000023
  TransferBuffer       = 814de880
  TransferBufferMDL    = 00000000
  Index                = 00000001
  DescriptorType       = 00000002 (USB_CONFIGURATION_DESCRIPTOR_TYPE)
  LanguageId           = 00000000
[13246 ms] UsbSnoop - MyInternalIOCTLCompletion(f9e0bdb0) : fido=00000000, Irp=8143e848, Context=81461d50, IRQL=2
[13246 ms]  <<<  URB 2 coming back  <<< 
-- URB_FUNCTION_CONTROL_TRANSFER:
  PipeHandle           = 8158e6f8
  TransferFlags        = 8110396b (USBD_TRANSFER_DIRECTION_IN, USBD_SHORT_TRANSFER_OK)
  TransferBufferLength = 00000023
  TransferBuffer       = 814de880
  TransferBufferMDL    = 816b7a80
    00000000: 09 02 23 00 01 01 00 e0 00 09 04 00 00 02 ff 01
    00000010: 00 00 07 05 81 02 40 00 00 07 05 02 02 40 00 00
    00000020: 03 09 03
  UrbLink              = 00000000
  SetupPacket          =
    00000000: 80 06 01 02 00 00 23 00
[13246 ms] UsbSnoop - DispatchAny(f9e0a610) : IRP_MJ_INTERNAL_DEVICE_CONTROL
[13246 ms] UsbSnoop - MyDispatchInternalIOCTL(f9e0be80) : fdo=815e4d28, Irp=8143e848, IRQL=0
[13246 ms]  >>>  URB 3 going down  >>> 
-- URB_FUNCTION_SELECT_CONFIGURATION:
  ConfigurationDescriptor = 0x814de880 (configure)
  ConfigurationDescriptor : bLength             = 9
  ConfigurationDescriptor : bDescriptorType     = 0x00000002
  ConfigurationDescriptor : wTotalLength        = 0x00000023
  ConfigurationDescriptor : bNumInterfaces      = 0x00000001
  ConfigurationDescriptor : bConfigurationValue = 0x00000001
  ConfigurationDescriptor : iConfiguration      = 0x00000000
  ConfigurationDescriptor : bmAttributes        = 0x000000e0
  ConfigurationDescriptor : MaxPower            = 0x00000000
  ConfigurationHandle     = 0x00000000
  Interface[0]: Length            = 56
  Interface[0]: InterfaceNumber   = 0
  Interface[0]: AlternateSetting  = 0
[13284 ms] UsbSnoop - MyInternalIOCTLCompletion(f9e0bdb0) : fido=00000000, Irp=8143e848, Context=814de118, IRQL=0
[13284 ms]  <<<  URB 3 coming back  <<< 
-- URB_FUNCTION_SELECT_CONFIGURATION:
  ConfigurationDescriptor = 0x814de880 (configure)
  ConfigurationDescriptor : bLength             = 9
  ConfigurationDescriptor : bDescriptorType     = 0x00000002
  ConfigurationDescriptor : wTotalLength        = 0x00000023
  ConfigurationDescriptor : bNumInterfaces      = 0x00000001
  ConfigurationDescriptor : bConfigurationValue = 0x00000001
  ConfigurationDescriptor : iConfiguration      = 0x00000000
  ConfigurationDescriptor : bmAttributes        = 0x000000e0
  ConfigurationDescriptor : MaxPower            = 0x00000000
  ConfigurationHandle     = 0x8168a4e8
  Interface[0]: Length            = 56
  Interface[0]: InterfaceNumber   = 0
  Interface[0]: AlternateSetting  = 0
  Interface[0]: Class             = 0x000000ff
  Interface[0]: SubClass          = 0x00000001
  Interface[0]: Protocol          = 0x00000000
  Interface[0]: InterfaceHandle   = 0x813bf9f8
  Interface[0]: NumberOfPipes     = 2
  Interface[0]: Pipes[0] : MaximumPacketSize = 0x00000040
  Interface[0]: Pipes[0] : EndpointAddress   = 0x00000081
  Interface[0]: Pipes[0] : Interval          = 0x00000000
  Interface[0]: Pipes[0] : PipeType          = 0x00000002 (UsbdPipeTypeBulk)
  Interface[0]: Pipes[0] : PipeHandle        = 0x813bfa14
  Interface[0]: Pipes[0] : MaxTransferSize   = 0x00001000
  Interface[0]: Pipes[0] : PipeFlags         = 0x00000000
  Interface[0]: Pipes[1] : MaximumPacketSize = 0x00000040
  Interface[0]: Pipes[1] : EndpointAddress   = 0x00000002
  Interface[0]: Pipes[1] : Interval          = 0x00000000
  Interface[0]: Pipes[1] : PipeType          = 0x00000002 (UsbdPipeTypeBulk)
  Interface[0]: Pipes[1] : PipeHandle        = 0x813bfa34
  Interface[0]: Pipes[1] : MaxTransferSize   = 0x00001000
  Interface[0]: Pipes[1] : PipeFlags         = 0x00000000
[13284 ms] UsbSnoop - IRP_MJ_POWER (IRP_MN_WAIT_WAKE)
[13284 ms] UsbSnoop - DispatchAny(f9e0a610) : IRP_MJ_INTERNAL_DEVICE_CONTROL
[13284 ms] UsbSnoop - MyDispatchInternalIOCTL(f9e0be80) : fdo=815e4d28, Irp=814e4848, IRQL=0
[13284 ms]  >>>  URB 4 going down  >>> 
-- URB_FUNCTION_RESET_PIPE:
  PipeHandle = 813bfa14 [endpoint 0x00000081]
[13292 ms] UsbSnoop - MyInternalIOCTLCompletion(f9e0bdb0) : fido=00000000, Irp=814e4848, Context=81774670, IRQL=0
[13292 ms]  <<<  URB 4 coming back  <<< 
-- URB_FUNCTION_RESET_PIPE:
[13292 ms] UsbSnoop - DispatchAny(f9e0a610) : IRP_MJ_INTERNAL_DEVICE_CONTROL
[13292 ms] UsbSnoop - MyDispatchInternalIOCTL(f9e0be80) : fdo=815e4d28, Irp=814e4848, IRQL=0
[13292 ms]  >>>  URB 5 going down  >>> 
-- URB_FUNCTION_RESET_PIPE:
  PipeHandle = 813bfa34 [endpoint 0x00000002]
[13293 ms] UsbSnoop - MyInternalIOCTLCompletion(f9e0bdb0) : fido=00000000, Irp=814e4848, Context=8110d1a8, IRQL=0
[13293 ms]  <<<  URB 5 coming back  <<< 
-- URB_FUNCTION_RESET_PIPE:
[13293 ms] UsbSnoop - DispatchAny(f9e0a610) : IRP_MJ_INTERNAL_DEVICE_CONTROL
[13293 ms] UsbSnoop - MyDispatchInternalIOCTL(f9e0be80) : fdo=815e4d28, Irp=8143e848, IRQL=0
[13293 ms] UsbSnoop - IRP_MJ_POWER (IRP_MN_WAIT_WAKE)
[14286 ms] UsbSnoop - DispatchAny(f9e0a610) : IRP_MJ_INTERNAL_DEVICE_CONTROL
[14286 ms] UsbSnoop - MyDispatchInternalIOCTL(f9e0be80) : fdo=815e4d28, Irp=8143e848, IRQL=0
[14286 ms]  >>>  URB 6 going down  >>> 
-- URB_FUNCTION_GET_DESCRIPTOR_FROM_DEVICE:
  TransferBufferLength = 00000012
  TransferBuffer       = e238a130
  TransferBufferMDL    = 00000000
  Index                = 00000000
  DescriptorType       = 00000001 (USB_DEVICE_DESCRIPTOR_TYPE)
  LanguageId           = 00000000
[14295 ms] UsbSnoop - MyInternalIOCTLCompletion(f9e0bdb0) : fido=00000000, Irp=8143e848, Context=814df150, IRQL=2
[14295 ms]  <<<  URB 6 coming back  <<< 
-- URB_FUNCTION_CONTROL_TRANSFER:
  PipeHandle           = 8158e6f8
  TransferFlags        = 8157c03b (USBD_TRANSFER_DIRECTION_IN, USBD_SHORT_TRANSFER_OK)
  TransferBufferLength = 00000012
  TransferBuffer       = e238a130
  TransferBufferMDL    = 816b7a80
    00000000: 12 01 00 02 00 00 00 40 51 04 08 e0 00 01 01 02
    00000010: 00 01
  UrbLink              = 00000000
  SetupPacket          =
    00000000: 80 06 00 01 00 00 12 00
[14295 ms] UsbSnoop - DispatchAny(f9e0a610) : IRP_MJ_INTERNAL_DEVICE_CONTROL
[14295 ms] UsbSnoop - MyDispatchInternalIOCTL(f9e0be80) : fdo=815e4d28, Irp=811054b0, IRQL=0
[14295 ms] UsbSnoop - IRP_MJ_POWER (IRP_MN_WAIT_WAKE)
[14295 ms] UsbSnoop - DispatchAny(f9e0a610) : IRP_MJ_INTERNAL_DEVICE_CONTROL
[14295 ms] UsbSnoop - MyDispatchInternalIOCTL(f9e0be80) : fdo=815e4d28, Irp=814e4848, IRQL=0
[14295 ms]  >>>  URB 7 going down  >>> 
-- URB_FUNCTION_RESET_PIPE:
  PipeHandle = 813bfa14 [endpoint 0x00000081]
[14304 ms] UsbSnoop - MyInternalIOCTLCompletion(f9e0bdb0) : fido=00000000, Irp=814e4848, Context=81102a48, IRQL=0
[14304 ms]  <<<  URB 7 coming back  <<< 
-- URB_FUNCTION_RESET_PIPE:
[14304 ms] UsbSnoop - DispatchAny(f9e0a610) : IRP_MJ_INTERNAL_DEVICE_CONTROL
[14304 ms] UsbSnoop - MyDispatchInternalIOCTL(f9e0be80) : fdo=815e4d28, Irp=814e4848, IRQL=0
[14304 ms]  >>>  URB 8 going down  >>> 
-- URB_FUNCTION_RESET_PIPE:
  PipeHandle = 813bfa34 [endpoint 0x00000002]
[14313 ms] UsbSnoop - MyInternalIOCTLCompletion(f9e0bdb0) : fido=00000000, Irp=814e4848, Context=816a8568, IRQL=0
[14313 ms]  <<<  URB 8 coming back  <<< 
-- URB_FUNCTION_RESET_PIPE:
[15708 ms] UsbSnoop - DispatchAny(f9e0a610) : IRP_MJ_INTERNAL_DEVICE_CONTROL
[15708 ms] UsbSnoop - MyDispatchInternalIOCTL(f9e0be80) : fdo=815e4d28, Irp=81480a20, IRQL=2
[15708 ms]  >>>  URB 9 going down  >>> 
-- URB_FUNCTION_BULK_OR_INTERRUPT_TRANSFER:
  PipeHandle           = 813bfa34 [endpoint 0x00000002]
  TransferFlags        = 00000000 (USBD_TRANSFER_DIRECTION_OUT, ~USBD_SHORT_TRANSFER_OK)
  TransferBufferLength = 00000009
  TransferBuffer       = 00000000
  TransferBufferMDL    = 816b7a80
    00000000: 00 00 00 04 01 00 00 04 00
  UrbLink              = 00000000
[15709 ms] UsbSnoop - MyInternalIOCTLCompletion(f9e0bdb0) : fido=81103020, Irp=81480a20, Context=811084b8, IRQL=2
[15709 ms]  <<<  URB 9 coming back  <<< 
-- URB_FUNCTION_BULK_OR_INTERRUPT_TRANSFER:
  PipeHandle           = 813bfa34 [endpoint 0x00000002]
  TransferFlags        = 00000000 (USBD_TRANSFER_DIRECTION_OUT, ~USBD_SHORT_TRANSFER_OK)
  TransferBufferLength = 00000009
  TransferBuffer       = 00000000
  TransferBufferMDL    = 816b7a80
  UrbLink              = 00000000
[15709 ms] UsbSnoop - DispatchAny(f9e0a610) : IRP_MJ_INTERNAL_DEVICE_CONTROL
[15709 ms] UsbSnoop - MyDispatchInternalIOCTL(f9e0be80) : fdo=815e4d28, Irp=81480a20, IRQL=2
[15709 ms]  >>>  URB 10 going down  >>> 
-- URB_FUNCTION_BULK_OR_INTERRUPT_TRANSFER:
  PipeHandle           = 813bfa14 [endpoint 0x00000081]
  TransferFlags        = 00000003 (USBD_TRANSFER_DIRECTION_IN, USBD_SHORT_TRANSFER_OK)
  TransferBufferLength = 00000100
  TransferBuffer       = 00000000
  TransferBufferMDL    = 816b7a80
  UrbLink              = 00000000
[15719 ms] UsbSnoop - MyInternalIOCTLCompletion(f9e0bdb0) : fido=81103020, Irp=81480a20, Context=81774670, IRQL=2
[15719 ms]  <<<  URB 10 coming back  <<< 
-- URB_FUNCTION_BULK_OR_INTERRUPT_TRANSFER:
  PipeHandle           = 813bfa14 [endpoint 0x00000081]
  TransferFlags        = 00000003 (USBD_TRANSFER_DIRECTION_IN, USBD_SHORT_TRANSFER_OK)
  TransferBufferLength = 00000009
  TransferBuffer       = 00000000
  TransferBufferMDL    = 816b7a80
    00000000: 00 00 00 04 02 00 00 00 fa
  UrbLink              = 00000000
[15748 ms] UsbSnoop - DispatchAny(f9e0a610) : IRP_MJ_INTERNAL_DEVICE_CONTROL
[15748 ms] UsbSnoop - MyDispatchInternalIOCTL(f9e0be80) : fdo=815e4d28, Irp=81480a20, IRQL=2
[15748 ms]  >>>  URB 11 going down  >>> 
-- URB_FUNCTION_BULK_OR_INTERRUPT_TRANSFER:
  PipeHandle           = 813bfa34 [endpoint 0x00000002]
  TransferFlags        = 00000000 (USBD_TRANSFER_DIRECTION_OUT, ~USBD_SHORT_TRANSFER_OK)
  TransferBufferLength = 00000015
  TransferBuffer       = 00000000
  TransferBufferMDL    = 816b7a80
    00000000: 00 00 00 10 04 00 00 00 0a 00 01 00 03 00 01 00
    00000010: 00 00 00 07 d0
  UrbLink              = 00000000
[15749 ms] UsbSnoop - MyInternalIOCTLCompletion(f9e0bdb0) : fido=81103020, Irp=81480a20, Context=81108498, IRQL=2
[15749 ms]  <<<  URB 11 coming back  <<< 
-- URB_FUNCTION_BULK_OR_INTERRUPT_TRANSFER:
  PipeHandle           = 813bfa34 [endpoint 0x00000002]
  TransferFlags        = 00000000 (USBD_TRANSFER_DIRECTION_OUT, ~USBD_SHORT_TRANSFER_OK)
  TransferBufferLength = 00000015
  TransferBuffer       = 00000000
  TransferBufferMDL    = 816b7a80
  UrbLink              = 00000000
[15758 ms] UsbSnoop - DispatchAny(f9e0a610) : IRP_MJ_INTERNAL_DEVICE_CONTROL
[15758 ms] UsbSnoop - MyDispatchInternalIOCTL(f9e0be80) : fdo=815e4d28, Irp=81480a20, IRQL=2
[15758 ms]  >>>  URB 12 going down  >>> 
-- URB_FUNCTION_BULK_OR_INTERRUPT_TRANSFER:
  PipeHandle           = 813bfa14 [endpoint 0x00000081]
  TransferFlags        = 00000003 (USBD_TRANSFER_DIRECTION_IN, USBD_SHORT_TRANSFER_OK)
  TransferBufferLength = 00000100
  TransferBuffer       = 00000000
  TransferBufferMDL    = 816b7a80
  UrbLink              = 00000000
[15759 ms] UsbSnoop - MyInternalIOCTLCompletion(f9e0bdb0) : fido=81103020, Irp=81480a20, Context=81774670, IRQL=2
[15759 ms]  <<<  URB 12 coming back  <<< 
-- URB_FUNCTION_BULK_OR_INTERRUPT_TRANSFER:
  PipeHandle           = 813bfa14 [endpoint 0x00000081]
  TransferFlags        = 00000003 (USBD_TRANSFER_DIRECTION_IN, USBD_SHORT_TRANSFER_OK)
  TransferBufferLength = 00000007
  TransferBuffer       = 00000000
  TransferBufferMDL    = 816b7a80
    00000000: 00 00 00 02 05 e0 00
  UrbLink              = 00000000
[15798 ms] UsbSnoop - DispatchAny(f9e0a610) : IRP_MJ_INTERNAL_DEVICE_CONTROL
[15798 ms] UsbSnoop - MyDispatchInternalIOCTL(f9e0be80) : fdo=815e4d28, Irp=81480a20, IRQL=2
[15798 ms]  >>>  URB 13 going down  >>> 
-- URB_FUNCTION_BULK_OR_INTERRUPT_TRANSFER:
  PipeHandle           = 813bfa14 [endpoint 0x00000081]
  TransferFlags        = 00000003 (USBD_TRANSFER_DIRECTION_IN, USBD_SHORT_TRANSFER_OK)
  TransferBufferLength = 00000100
  TransferBuffer       = 00000000
  TransferBufferMDL    = 816b7a80
  UrbLink              = 00000000
[15799 ms] UsbSnoop - MyInternalIOCTLCompletion(f9e0bdb0) : fido=81103020, Irp=81480a20, Context=811084b8, IRQL=2
[15799 ms]  <<<  URB 13 coming back  <<< 
-- URB_FUNCTION_BULK_OR_INTERRUPT_TRANSFER:
  PipeHandle           = 813bfa14 [endpoint 0x00000081]
  TransferFlags        = 00000003 (USBD_TRANSFER_DIRECTION_IN, USBD_SHORT_TRANSFER_OK)
  TransferBufferLength = 0000000f
  TransferBuffer       = 00000000
  TransferBufferMDL    = 816b7a80
    00000000: 00 00 00 0a 04 00 00 00 04 00 12 00 00 07 d0
  UrbLink              = 00000000
[15838 ms] UsbSnoop - DispatchAny(f9e0a610) : IRP_MJ_INTERNAL_DEVICE_CONTROL
[15838 ms] UsbSnoop - MyDispatchInternalIOCTL(f9e0be80) : fdo=815e4d28, Irp=81480a20, IRQL=2
[15838 ms]  >>>  URB 14 going down  >>> 
-- URB_FUNCTION_BULK_OR_INTERRUPT_TRANSFER:
  PipeHandle           = 813bfa34 [endpoint 0x00000002]
  TransferFlags        = 00000000 (USBD_TRANSFER_DIRECTION_OUT, ~USBD_SHORT_TRANSFER_OK)
  TransferBufferLength = 00000007
  TransferBuffer       = 00000000
  TransferBufferMDL    = 816b7a80
    00000000: 00 00 00 02 05 e0 00
  UrbLink              = 00000000
[15839 ms] UsbSnoop - MyInternalIOCTLCompletion(f9e0bdb0) : fido=81103020, Irp=81480a20, Context=811084d8, IRQL=2
[15839 ms]  <<<  URB 14 coming back  <<< 
-- URB_FUNCTION_BULK_OR_INTERRUPT_TRANSFER:
  PipeHandle           = 813bfa34 [endpoint 0x00000002]
  TransferFlags        = 00000000 (USBD_TRANSFER_DIRECTION_OUT, ~USBD_SHORT_TRANSFER_OK)
  TransferBufferLength = 00000007
  TransferBuffer       = 00000000
  TransferBufferMDL    = 816b7a80
  UrbLink              = 00000000
[15848 ms] UsbSnoop - DispatchAny(f9e0a610) : IRP_MJ_INTERNAL_DEVICE_CONTROL
[15848 ms] UsbSnoop - MyDispatchInternalIOCTL(f9e0be80) : fdo=815e4d28, Irp=81480a20, IRQL=2
[15848 ms]  >>>  URB 15 going down  >>> 
-- URB_FUNCTION_BULK_OR_INTERRUPT_TRANSFER:
  PipeHandle           = 813bfa34 [endpoint 0x00000002]
  TransferFlags        = 00000000 (USBD_TRANSFER_DIRECTION_OUT, ~USBD_SHORT_TRANSFER_OK)
  TransferBufferLength = 0000002b
  TransferBuffer       = 00000000
  TransferBufferMDL    = 816b7a80
    00000000: 00 00 00 26 04 00 00 00 20 00 0c 00 06 49 44 4c
    00000010: 69 73 74 00 01 ff ff ff ff 00 02 00 03 00 08 00
    00000020: 01 00 11 00 04 f0 07 00 26 00 00
  UrbLink              = 00000000
[15849 ms] UsbSnoop - MyInternalIOCTLCompletion(f9e0bdb0) : fido=81103020, Irp=81480a20, Context=811084b8, IRQL=2
[15849 ms]  <<<  URB 15 coming back  <<< 
-- URB_FUNCTION_BULK_OR_INTERRUPT_TRANSFER:
  PipeHandle           = 813bfa34 [endpoint 0x00000002]
  TransferFlags        = 00000000 (USBD_TRANSFER_DIRECTION_OUT, ~USBD_SHORT_TRANSFER_OK)
  TransferBufferLength = 0000002b
  TransferBuffer       = 00000000
  TransferBufferMDL    = 816b7a80
  UrbLink              = 00000000
[15858 ms] UsbSnoop - DispatchAny(f9e0a610) : IRP_MJ_INTERNAL_DEVICE_CONTROL
[15858 ms] UsbSnoop - MyDispatchInternalIOCTL(f9e0be80) : fdo=815e4d28, Irp=81480a20, IRQL=2
[15858 ms]  >>>  URB 16 going down  >>> 
-- URB_FUNCTION_BULK_OR_INTERRUPT_TRANSFER:
  PipeHandle           = 813bfa14 [endpoint 0x00000081]
  TransferFlags        = 00000003 (USBD_TRANSFER_DIRECTION_IN, USBD_SHORT_TRANSFER_OK)
  TransferBufferLength = 00000100
  TransferBuffer       = 00000000
  TransferBufferMDL    = 816b7a80
  UrbLink              = 00000000
[15869 ms] UsbSnoop - MyInternalIOCTLCompletion(f9e0bdb0) : fido=81103020, Irp=81480a20, Context=81102048, IRQL=2
[15869 ms]  <<<  URB 16 coming back  <<< 
-- URB_FUNCTION_BULK_OR_INTERRUPT_TRANSFER:
  PipeHandle           = 813bfa14 [endpoint 0x00000081]
  TransferFlags        = 00000003 (USBD_TRANSFER_DIRECTION_IN, USBD_SHORT_TRANSFER_OK)
  TransferBufferLength = 00000007
  TransferBuffer       = 00000000
  TransferBufferMDL    = 816b7a80
    00000000: 00 00 00 02 05 e0 00
  UrbLink              = 00000000
[15908 ms] UsbSnoop - DispatchAny(f9e0a610) : IRP_MJ_INTERNAL_DEVICE_CONTROL
[15908 ms] UsbSnoop - MyDispatchInternalIOCTL(f9e0be80) : fdo=815e4d28, Irp=81480a20, IRQL=2
[15908 ms]  >>>  URB 17 going down  >>> 
-- URB_FUNCTION_BULK_OR_INTERRUPT_TRANSFER:
  PipeHandle           = 813bfa14 [endpoint 0x00000081]
  TransferFlags        = 00000003 (USBD_TRANSFER_DIRECTION_IN, USBD_SHORT_TRANSFER_OK)
  TransferBufferLength = 00000100
  TransferBuffer       = 00000000
  TransferBufferMDL    = 816b7a80
  UrbLink              = 00000000
[15909 ms] UsbSnoop - MyInternalIOCTLCompletion(f9e0bdb0) : fido=81103020, Irp=81480a20, Context=811084d8, IRQL=2
[15909 ms]  <<<  URB 17 coming back  <<< 
-- URB_FUNCTION_BULK_OR_INTERRUPT_TRANSFER:
  PipeHandle           = 813bfa14 [endpoint 0x00000081]
  TransferFlags        = 00000003 (USBD_TRANSFER_DIRECTION_IN, USBD_SHORT_TRANSFER_OK)
  TransferBufferLength = 00000025
  TransferBuffer       = 00000000
  TransferBufferMDL    = 816b7a80
    00000000: 00 00 00 20 04 00 00 00 1a 00 0a 00 06 49 44 4c
    00000010: 69 73 74 00 00 02 00 03 00 00 01 01 00 08 00 00
    00000020: 04 00 00 00 00
  UrbLink              = 00000000
[15948 ms] UsbSnoop - DispatchAny(f9e0a610) : IRP_MJ_INTERNAL_DEVICE_CONTROL
[15948 ms] UsbSnoop - MyDispatchInternalIOCTL(f9e0be80) : fdo=815e4d28, Irp=81480a20, IRQL=2
[15948 ms]  >>>  URB 18 going down  >>> 
-- URB_FUNCTION_BULK_OR_INTERRUPT_TRANSFER:
  PipeHandle           = 813bfa34 [endpoint 0x00000002]
  TransferFlags        = 00000000 (USBD_TRANSFER_DIRECTION_OUT, ~USBD_SHORT_TRANSFER_OK)
  TransferBufferLength = 00000007
  TransferBuffer       = 00000000
  TransferBufferMDL    = 816b7a80
    00000000: 00 00 00 02 05 e0 00
  UrbLink              = 00000000
[15949 ms] UsbSnoop - MyInternalIOCTLCompletion(f9e0bdb0) : fido=81103020, Irp=81480a20, Context=81774670, IRQL=2
[15949 ms]  <<<  URB 18 coming back  <<< 
-- URB_FUNCTION_BULK_OR_INTERRUPT_TRANSFER:
  PipeHandle           = 813bfa34 [endpoint 0x00000002]
  TransferFlags        = 00000000 (USBD_TRANSFER_DIRECTION_OUT, ~USBD_SHORT_TRANSFER_OK)
  TransferBufferLength = 00000007
  TransferBuffer       = 00000000
  TransferBufferMDL    = 816b7a80
  UrbLink              = 00000000
[15958 ms] UsbSnoop - DispatchAny(f9e0a610) : IRP_MJ_INTERNAL_DEVICE_CONTROL
[15958 ms] UsbSnoop - MyDispatchInternalIOCTL(f9e0be80) : fdo=815e4d28, Irp=81480a20, IRQL=2
[15958 ms]  >>>  URB 19 going down  >>> 
-- URB_FUNCTION_BULK_OR_INTERRUPT_TRANSFER:
  PipeHandle           = 813bfa14 [endpoint 0x00000081]
  TransferFlags        = 00000003 (USBD_TRANSFER_DIRECTION_IN, USBD_SHORT_TRANSFER_OK)
  TransferBufferLength = 00000100
  TransferBuffer       = 00000000
  TransferBufferMDL    = 816b7a80
  UrbLink              = 00000000
[15959 ms] UsbSnoop - MyInternalIOCTLCompletion(f9e0bdb0) : fido=81103020, Irp=81480a20, Context=811084d8, IRQL=2
[15959 ms]  <<<  URB 19 coming back  <<< 
-- URB_FUNCTION_BULK_OR_INTERRUPT_TRANSFER:
  PipeHandle           = 813bfa14 [endpoint 0x00000081]
  TransferFlags        = 00000003 (USBD_TRANSFER_DIRECTION_IN, USBD_SHORT_TRANSFER_OK)
  TransferBufferLength = 00000016
  TransferBuffer       = 00000000
  TransferBufferMDL    = 816b7a80
    00000000: 00 00 00 11 04 00 00 00 0b 00 0d 01 00 00 80 0a
    00000010: 32 cc e3 01 21 18
  UrbLink              = 00000000
[15998 ms] UsbSnoop - DispatchAny(f9e0a610) : IRP_MJ_INTERNAL_DEVICE_CONTROL
[15998 ms] UsbSnoop - MyDispatchInternalIOCTL(f9e0be80) : fdo=815e4d28, Irp=81480a20, IRQL=2
[15998 ms]  >>>  URB 20 going down  >>> 
-- URB_FUNCTION_BULK_OR_INTERRUPT_TRANSFER:
  PipeHandle           = 813bfa34 [endpoint 0x00000002]
  TransferFlags        = 00000000 (USBD_TRANSFER_DIRECTION_OUT, ~USBD_SHORT_TRANSFER_OK)
  TransferBufferLength = 00000007
  TransferBuffer       = 00000000
  TransferBufferMDL    = 816b7a80
    00000000: 00 00 00 02 05 e0 00
  UrbLink              = 00000000
[15999 ms] UsbSnoop - MyInternalIOCTLCompletion(f9e0bdb0) : fido=81103020, Irp=81480a20, Context=811084b8, IRQL=2
[15999 ms]  <<<  URB 20 coming back  <<< 
-- URB_FUNCTION_BULK_OR_INTERRUPT_TRANSFER:
  PipeHandle           = 813bfa34 [endpoint 0x00000002]
  TransferFlags        = 00000000 (USBD_TRANSFER_DIRECTION_OUT, ~USBD_SHORT_TRANSFER_OK)
  TransferBufferLength = 00000007
  TransferBuffer       = 00000000
  TransferBufferMDL    = 816b7a80
  UrbLink              = 00000000
[16259 ms] UsbSnoop - DispatchAny(f9e0a610) : IRP_MJ_INTERNAL_DEVICE_CONTROL
[16259 ms] UsbSnoop - MyDispatchInternalIOCTL(f9e0be80) : fdo=815e4d28, Irp=81480a20, IRQL=2
[16259 ms]  >>>  URB 21 going down  >>> 
-- URB_FUNCTION_BULK_OR_INTERRUPT_TRANSFER:
  PipeHandle           = 813bfa34 [endpoint 0x00000002]
  TransferFlags        = 00000000 (USBD_TRANSFER_DIRECTION_OUT, ~USBD_SHORT_TRANSFER_OK)
  TransferBufferLength = 00000009
  TransferBuffer       = 00000000
  TransferBufferMDL    = 816b7a80
    00000000: 00 00 00 04 01 00 00 04 00
  UrbLink              = 00000000
[16260 ms] UsbSnoop - MyInternalIOCTLCompletion(f9e0bdb0) : fido=81103020, Irp=81480a20, Context=811084d8, IRQL=2
[16260 ms]  <<<  URB 21 coming back  <<< 
-- URB_FUNCTION_BULK_OR_INTERRUPT_TRANSFER:
  PipeHandle           = 813bfa34 [endpoint 0x00000002]
  TransferFlags        = 00000000 (USBD_TRANSFER_DIRECTION_OUT, ~USBD_SHORT_TRANSFER_OK)
  TransferBufferLength = 00000009
  TransferBuffer       = 00000000
  TransferBufferMDL    = 816b7a80
  UrbLink              = 00000000
[16260 ms] UsbSnoop - DispatchAny(f9e0a610) : IRP_MJ_INTERNAL_DEVICE_CONTROL
[16260 ms] UsbSnoop - MyDispatchInternalIOCTL(f9e0be80) : fdo=815e4d28, Irp=81480a20, IRQL=2
[16260 ms]  >>>  URB 22 going down  >>> 
-- URB_FUNCTION_BULK_OR_INTERRUPT_TRANSFER:
  PipeHandle           = 813bfa14 [endpoint 0x00000081]
  TransferFlags        = 00000003 (USBD_TRANSFER_DIRECTION_IN, USBD_SHORT_TRANSFER_OK)
  TransferBufferLength = 00000100
  TransferBuffer       = 00000000
  TransferBufferMDL    = 816b7a80
  UrbLink              = 00000000
[16266 ms] UsbSnoop - MyInternalIOCTLCompletion(f9e0bdb0) : fido=81103020, Irp=81480a20, Context=81774670, IRQL=2
[16266 ms]  <<<  URB 22 coming back  <<< 
-- URB_FUNCTION_BULK_OR_INTERRUPT_TRANSFER:
  PipeHandle           = 813bfa14 [endpoint 0x00000081]
  TransferFlags        = 00000003 (USBD_TRANSFER_DIRECTION_IN, USBD_SHORT_TRANSFER_OK)
  TransferBufferLength = 00000009
  TransferBuffer       = 00000000
  TransferBufferMDL    = 816b7a80
    00000000: 00 00 00 04 02 00 00 00 fa
  UrbLink              = 00000000
[16289 ms] UsbSnoop - DispatchAny(f9e0a610) : IRP_MJ_INTERNAL_DEVICE_CONTROL
[16289 ms] UsbSnoop - MyDispatchInternalIOCTL(f9e0be80) : fdo=815e4d28, Irp=81480a20, IRQL=2
[16289 ms]  >>>  URB 23 going down  >>> 
-- URB_FUNCTION_BULK_OR_INTERRUPT_TRANSFER:
  PipeHandle           = 813bfa34 [endpoint 0x00000002]
  TransferFlags        = 00000000 (USBD_TRANSFER_DIRECTION_OUT, ~USBD_SHORT_TRANSFER_OK)
  TransferBufferLength = 00000015
  TransferBuffer       = 00000000
  TransferBufferMDL    = 816b7a80
    00000000: 00 00 00 10 04 00 00 00 0a 00 01 00 03 00 01 00
    00000010: 00 00 00 07 d0
  UrbLink              = 00000000
[16290 ms] UsbSnoop - MyInternalIOCTLCompletion(f9e0bdb0) : fido=81103020, Irp=81480a20, Context=81102048, IRQL=2
[16290 ms]  <<<  URB 23 coming back  <<< 
-- URB_FUNCTION_BULK_OR_INTERRUPT_TRANSFER:
  PipeHandle           = 813bfa34 [endpoint 0x00000002]
  TransferFlags        = 00000000 (USBD_TRANSFER_DIRECTION_OUT, ~USBD_SHORT_TRANSFER_OK)
  TransferBufferLength = 00000015
  TransferBuffer       = 00000000
  TransferBufferMDL    = 816b7a80
  UrbLink              = 00000000
[16299 ms] UsbSnoop - DispatchAny(f9e0a610) : IRP_MJ_INTERNAL_DEVICE_CONTROL
[16299 ms] UsbSnoop - MyDispatchInternalIOCTL(f9e0be80) : fdo=815e4d28, Irp=81480a20, IRQL=2
[16299 ms]  >>>  URB 24 going down  >>> 
-- URB_FUNCTION_BULK_OR_INTERRUPT_TRANSFER:
  PipeHandle           = 813bfa14 [endpoint 0x00000081]
  TransferFlags        = 00000003 (USBD_TRANSFER_DIRECTION_IN, USBD_SHORT_TRANSFER_OK)
  TransferBufferLength = 00000100
  TransferBuffer       = 00000000
  TransferBufferMDL    = 816b7a80
  UrbLink              = 00000000
[16300 ms] UsbSnoop - MyInternalIOCTLCompletion(f9e0bdb0) : fido=81103020, Irp=81480a20, Context=81774670, IRQL=2
[16300 ms]  <<<  URB 24 coming back  <<< 
-- URB_FUNCTION_BULK_OR_INTERRUPT_TRANSFER:
  PipeHandle           = 813bfa14 [endpoint 0x00000081]
  TransferFlags        = 00000003 (USBD_TRANSFER_DIRECTION_IN, USBD_SHORT_TRANSFER_OK)
  TransferBufferLength = 00000007
  TransferBuffer       = 00000000
  TransferBufferMDL    = 816b7a80
    00000000: 00 00 00 02 05 e0 00
  UrbLink              = 00000000
[16339 ms] UsbSnoop - DispatchAny(f9e0a610) : IRP_MJ_INTERNAL_DEVICE_CONTROL
[16339 ms] UsbSnoop - MyDispatchInternalIOCTL(f9e0be80) : fdo=815e4d28, Irp=81480a20, IRQL=2
[16339 ms]  >>>  URB 25 going down  >>> 
-- URB_FUNCTION_BULK_OR_INTERRUPT_TRANSFER:
  PipeHandle           = 813bfa14 [endpoint 0x00000081]
  TransferFlags        = 00000003 (USBD_TRANSFER_DIRECTION_IN, USBD_SHORT_TRANSFER_OK)
  TransferBufferLength = 00000100
  TransferBuffer       = 00000000
  TransferBufferMDL    = 816b7a80
  UrbLink              = 00000000
[16340 ms] UsbSnoop - MyInternalIOCTLCompletion(f9e0bdb0) : fido=81103020, Irp=81480a20, Context=81108498, IRQL=2
[16340 ms]  <<<  URB 25 coming back  <<< 
-- URB_FUNCTION_BULK_OR_INTERRUPT_TRANSFER:
  PipeHandle           = 813bfa14 [endpoint 0x00000081]
  TransferFlags        = 00000003 (USBD_TRANSFER_DIRECTION_IN, USBD_SHORT_TRANSFER_OK)
  TransferBufferLength = 0000000f
  TransferBuffer       = 00000000
  TransferBufferMDL    = 816b7a80
    00000000: 00 00 00 0a 04 00 00 00 04 00 12 00 00 07 d0
  UrbLink              = 00000000
[16379 ms] UsbSnoop - DispatchAny(f9e0a610) : IRP_MJ_INTERNAL_DEVICE_CONTROL
[16379 ms] UsbSnoop - MyDispatchInternalIOCTL(f9e0be80) : fdo=815e4d28, Irp=81480a20, IRQL=2
[16379 ms]  >>>  URB 26 going down  >>> 
-- URB_FUNCTION_BULK_OR_INTERRUPT_TRANSFER:
  PipeHandle           = 813bfa34 [endpoint 0x00000002]
  TransferFlags        = 00000000 (USBD_TRANSFER_DIRECTION_OUT, ~USBD_SHORT_TRANSFER_OK)
  TransferBufferLength = 00000007
  TransferBuffer       = 00000000
  TransferBufferMDL    = 816b7a80
    00000000: 00 00 00 02 05 e0 00
  UrbLink              = 00000000
[16380 ms] UsbSnoop - MyInternalIOCTLCompletion(f9e0bdb0) : fido=81103020, Irp=81480a20, Context=811084b8, IRQL=2
[16380 ms]  <<<  URB 26 coming back  <<< 
-- URB_FUNCTION_BULK_OR_INTERRUPT_TRANSFER:
  PipeHandle           = 813bfa34 [endpoint 0x00000002]
  TransferFlags        = 00000000 (USBD_TRANSFER_DIRECTION_OUT, ~USBD_SHORT_TRANSFER_OK)
  TransferBufferLength = 00000007
  TransferBuffer       = 00000000
  TransferBufferMDL    = 816b7a80
  UrbLink              = 00000000
[16389 ms] UsbSnoop - DispatchAny(f9e0a610) : IRP_MJ_INTERNAL_DEVICE_CONTROL
[16389 ms] UsbSnoop - MyDispatchInternalIOCTL(f9e0be80) : fdo=815e4d28, Irp=81480a20, IRQL=2
[16389 ms]  >>>  URB 27 going down  >>> 
-- URB_FUNCTION_BULK_OR_INTERRUPT_TRANSFER:
  PipeHandle           = 813bfa34 [endpoint 0x00000002]
  TransferFlags        = 00000000 (USBD_TRANSFER_DIRECTION_OUT, ~USBD_SHORT_TRANSFER_OK)
  TransferBufferLength = 00000029
  TransferBuffer       = 00000000
  TransferBufferMDL    = 816b7a80
    00000000: 00 00 00 24 04 00 00 00 1e 00 07 00 0e 00 0b 00
    00000010: 04 00 06 00 07 00 01 00 02 00 0a 00 37 00 0d 00
    00000020: 38 00 09 00 0e 00 2d 00 03
  UrbLink              = 00000000
[16390 ms] UsbSnoop - MyInternalIOCTLCompletion(f9e0bdb0) : fido=81103020, Irp=81480a20, Context=81108498, IRQL=2
[16390 ms]  <<<  URB 27 coming back  <<< 
-- URB_FUNCTION_BULK_OR_INTERRUPT_TRANSFER:
  PipeHandle           = 813bfa34 [endpoint 0x00000002]
  TransferFlags        = 00000000 (USBD_TRANSFER_DIRECTION_OUT, ~USBD_SHORT_TRANSFER_OK)
  TransferBufferLength = 00000029
  TransferBuffer       = 00000000
  TransferBufferMDL    = 816b7a80
  UrbLink              = 00000000
[16399 ms] UsbSnoop - DispatchAny(f9e0a610) : IRP_MJ_INTERNAL_DEVICE_CONTROL
[16399 ms] UsbSnoop - MyDispatchInternalIOCTL(f9e0be80) : fdo=815e4d28, Irp=81480a20, IRQL=2
[16399 ms]  >>>  URB 28 going down  >>> 
-- URB_FUNCTION_BULK_OR_INTERRUPT_TRANSFER:
  PipeHandle           = 813bfa14 [endpoint 0x00000081]
  TransferFlags        = 00000003 (USBD_TRANSFER_DIRECTION_IN, USBD_SHORT_TRANSFER_OK)
  TransferBufferLength = 00000100
  TransferBuffer       = 00000000
  TransferBufferMDL    = 816b7a80
  UrbLink              = 00000000
[16416 ms] UsbSnoop - MyInternalIOCTLCompletion(f9e0bdb0) : fido=81103020, Irp=81480a20, Context=81108478, IRQL=2
[16416 ms]  <<<  URB 28 coming back  <<< 
-- URB_FUNCTION_BULK_OR_INTERRUPT_TRANSFER:
  PipeHandle           = 813bfa14 [endpoint 0x00000081]
  TransferFlags        = 00000003 (USBD_TRANSFER_DIRECTION_IN, USBD_SHORT_TRANSFER_OK)
  TransferBufferLength = 00000007
  TransferBuffer       = 00000000
  TransferBufferMDL    = 816b7a80
    00000000: 00 00 00 02 05 e0 00
  UrbLink              = 00000000
[16449 ms] UsbSnoop - DispatchAny(f9e0a610) : IRP_MJ_INTERNAL_DEVICE_CONTROL
[16449 ms] UsbSnoop - MyDispatchInternalIOCTL(f9e0be80) : fdo=815e4d28, Irp=81480a20, IRQL=2
[16449 ms]  >>>  URB 29 going down  >>> 
-- URB_FUNCTION_BULK_OR_INTERRUPT_TRANSFER:
  PipeHandle           = 813bfa14 [endpoint 0x00000081]
  TransferFlags        = 00000003 (USBD_TRANSFER_DIRECTION_IN, USBD_SHORT_TRANSFER_OK)
  TransferBufferLength = 00000100
  TransferBuffer       = 00000000
  TransferBufferMDL    = 816b7a80
  UrbLink              = 00000000
[16450 ms] UsbSnoop - MyInternalIOCTLCompletion(f9e0bdb0) : fido=81103020, Irp=81480a20, Context=811084b8, IRQL=2
[16450 ms]  <<<  URB 29 coming back  <<< 
-- URB_FUNCTION_BULK_OR_INTERRUPT_TRANSFER:
  PipeHandle           = 813bfa14 [endpoint 0x00000081]
  TransferFlags        = 00000003 (USBD_TRANSFER_DIRECTION_IN, USBD_SHORT_TRANSFER_OK)
  TransferBufferLength = 0000000f
  TransferBuffer       = 00000000
  TransferBufferMDL    = 816b7a80
    00000000: 00 00 00 0a 04 00 00 00 04 bb 00 00 01 d4 c0
  UrbLink              = 00000000
[16489 ms] UsbSnoop - DispatchAny(f9e0a610) : IRP_MJ_INTERNAL_DEVICE_CONTROL
[16489 ms] UsbSnoop - MyDispatchInternalIOCTL(f9e0be80) : fdo=815e4d28, Irp=81480a20, IRQL=2
[16489 ms]  >>>  URB 30 going down  >>> 
-- URB_FUNCTION_BULK_OR_INTERRUPT_TRANSFER:
  PipeHandle           = 813bfa34 [endpoint 0x00000002]
  TransferFlags        = 00000000 (USBD_TRANSFER_DIRECTION_OUT, ~USBD_SHORT_TRANSFER_OK)
  TransferBufferLength = 00000007
  TransferBuffer       = 00000000
  TransferBufferMDL    = 816b7a80
    00000000: 00 00 00 02 05 e0 00
  UrbLink              = 00000000
[16490 ms] UsbSnoop - MyInternalIOCTLCompletion(f9e0bdb0) : fido=81103020, Irp=81480a20, Context=81774670, IRQL=2
[16490 ms]  <<<  URB 30 coming back  <<< 
-- URB_FUNCTION_BULK_OR_INTERRUPT_TRANSFER:
  PipeHandle           = 813bfa34 [endpoint 0x00000002]
  TransferFlags        = 00000000 (USBD_TRANSFER_DIRECTION_OUT, ~USBD_SHORT_TRANSFER_OK)
  TransferBufferLength = 00000007
  TransferBuffer       = 00000000
  TransferBufferMDL    = 816b7a80
  UrbLink              = 00000000
[16499 ms] UsbSnoop - DispatchAny(f9e0a610) : IRP_MJ_INTERNAL_DEVICE_CONTROL
[16499 ms] UsbSnoop - MyDispatchInternalIOCTL(f9e0be80) : fdo=815e4d28, Irp=81480a20, IRQL=2
[16499 ms]  >>>  URB 31 going down  >>> 
-- URB_FUNCTION_BULK_OR_INTERRUPT_TRANSFER:
  PipeHandle           = 813bfa14 [endpoint 0x00000081]
  TransferFlags        = 00000003 (USBD_TRANSFER_DIRECTION_IN, USBD_SHORT_TRANSFER_OK)
  TransferBufferLength = 00000100
  TransferBuffer       = 00000000
  TransferBufferMDL    = 816b7a80
  UrbLink              = 00000000
[16555 ms] UsbSnoop - MyInternalIOCTLCompletion(f9e0bdb0) : fido=81103020, Irp=81480a20, Context=811084b8, IRQL=2
[16555 ms]  <<<  URB 31 coming back  <<< 
-- URB_FUNCTION_BULK_OR_INTERRUPT_TRANSFER:
  PipeHandle           = 813bfa14 [endpoint 0x00000081]
  TransferFlags        = 00000003 (USBD_TRANSFER_DIRECTION_IN, USBD_SHORT_TRANSFER_OK)
  TransferBufferLength = 00000095
  TransferBuffer       = 00000000
  TransferBufferMDL    = 816b7a80
    00000000: 00 00 00 90 04 00 00 00 8a 00 08 00 0e 00 0b 00
    00000010: 00 04 00 02 16 00 00 04 00 00 02 00 03 00 06 00
    00000020: 00 01 09 00 07 00 00 01 01 00 01 00 00 04 00 00
    00000030: 00 0a 00 02 00 00 19 54 49 2d 38 34 20 50 6c 75
    00000040: 73 20 53 69 6c 76 65 72 20 45 64 69 74 69 6f 6e
    00000050: 00 0a 00 00 01 01 00 37 00 00 01 01 00 0d 00 00
    00000060: 08 00 00 00 00 00 00 5e fd 00 38 00 00 01 00 00
    00000070: 09 00 00 04 00 01 00 00 00 0e 00 00 08 00 00 00
    00000080: 00 00 00 5e ca 00 2d 00 00 01 01 00 03 00 00 05
    00000090: 0a 32 cc e3 01
  UrbLink              = 00000000
[23601 ms] UsbSnoop - DispatchAny(f9e0a610) : IRP_MJ_INTERNAL_DEVICE_CONTROL
[23601 ms] UsbSnoop - MyDispatchInternalIOCTL(f9e0be80) : fdo=815e4d28, Irp=81480a20, IRQL=2
[23601 ms]  >>>  URB 32 going down  >>> 
-- URB_FUNCTION_BULK_OR_INTERRUPT_TRANSFER:
  PipeHandle           = 813bfa34 [endpoint 0x00000002]
  TransferFlags        = 00000000 (USBD_TRANSFER_DIRECTION_OUT, ~USBD_SHORT_TRANSFER_OK)
  TransferBufferLength = 00000007
  TransferBuffer       = 00000000
  TransferBufferMDL    = 8152af88
    00000000: 00 00 00 02 05 e0 00
  UrbLink              = 00000000
[23602 ms] UsbSnoop - MyInternalIOCTLCompletion(f9e0bdb0) : fido=81103020, Irp=81480a20, Context=815939e0, IRQL=2
[23602 ms]  <<<  URB 32 coming back  <<< 
-- URB_FUNCTION_BULK_OR_INTERRUPT_TRANSFER:
  PipeHandle           = 813bfa34 [endpoint 0x00000002]
  TransferFlags        = 00000000 (USBD_TRANSFER_DIRECTION_OUT, ~USBD_SHORT_TRANSFER_OK)
  TransferBufferLength = 00000007
  TransferBuffer       = 00000000
  TransferBufferMDL    = 8152af88
  UrbLink              = 00000000
[23861 ms] UsbSnoop - DispatchAny(f9e0a610) : IRP_MJ_INTERNAL_DEVICE_CONTROL
[23861 ms] UsbSnoop - MyDispatchInternalIOCTL(f9e0be80) : fdo=815e4d28, Irp=81480a20, IRQL=2
[23861 ms]  >>>  URB 33 going down  >>> 
-- URB_FUNCTION_BULK_OR_INTERRUPT_TRANSFER:
  PipeHandle           = 813bfa34 [endpoint 0x00000002]
  TransferFlags        = 00000000 (USBD_TRANSFER_DIRECTION_OUT, ~USBD_SHORT_TRANSFER_OK)
  TransferBufferLength = 00000009
  TransferBuffer       = 00000000
  TransferBufferMDL    = 8152af88
    00000000: 00 00 00 04 01 00 00 04 00
  UrbLink              = 00000000
[23862 ms] UsbSnoop - MyInternalIOCTLCompletion(f9e0bdb0) : fido=81103020, Irp=81480a20, Context=81422700, IRQL=2
[23862 ms]  <<<  URB 33 coming back  <<< 
-- URB_FUNCTION_BULK_OR_INTERRUPT_TRANSFER:
  PipeHandle           = 813bfa34 [endpoint 0x00000002]
  TransferFlags        = 00000000 (USBD_TRANSFER_DIRECTION_OUT, ~USBD_SHORT_TRANSFER_OK)
  TransferBufferLength = 00000009
  TransferBuffer       = 00000000
  TransferBufferMDL    = 8152af88
  UrbLink              = 00000000
[23862 ms] UsbSnoop - DispatchAny(f9e0a610) : IRP_MJ_INTERNAL_DEVICE_CONTROL
[23862 ms] UsbSnoop - MyDispatchInternalIOCTL(f9e0be80) : fdo=815e4d28, Irp=81480a20, IRQL=2
[23862 ms]  >>>  URB 34 going down  >>> 
-- URB_FUNCTION_BULK_OR_INTERRUPT_TRANSFER:
  PipeHandle           = 813bfa14 [endpoint 0x00000081]
  TransferFlags        = 00000003 (USBD_TRANSFER_DIRECTION_IN, USBD_SHORT_TRANSFER_OK)
  TransferBufferLength = 00000100
  TransferBuffer       = 00000000
  TransferBufferMDL    = 8152af88
  UrbLink              = 00000000
[23866 ms] UsbSnoop - MyInternalIOCTLCompletion(f9e0bdb0) : fido=81103020, Irp=81480a20, Context=81464ad0, IRQL=2
[23866 ms]  <<<  URB 34 coming back  <<< 
-- URB_FUNCTION_BULK_OR_INTERRUPT_TRANSFER:
  PipeHandle           = 813bfa14 [endpoint 0x00000081]
  TransferFlags        = 00000003 (USBD_TRANSFER_DIRECTION_IN, USBD_SHORT_TRANSFER_OK)
  TransferBufferLength = 00000009
  TransferBuffer       = 00000000
  TransferBufferMDL    = 8152af88
    00000000: 00 00 00 04 02 00 00 00 fa
  UrbLink              = 00000000
[23891 ms] UsbSnoop - DispatchAny(f9e0a610) : IRP_MJ_INTERNAL_DEVICE_CONTROL
[23891 ms] UsbSnoop - MyDispatchInternalIOCTL(f9e0be80) : fdo=815e4d28, Irp=81480a20, IRQL=2
[23891 ms]  >>>  URB 35 going down  >>> 
-- URB_FUNCTION_BULK_OR_INTERRUPT_TRANSFER:
  PipeHandle           = 813bfa34 [endpoint 0x00000002]
  TransferFlags        = 00000000 (USBD_TRANSFER_DIRECTION_OUT, ~USBD_SHORT_TRANSFER_OK)
  TransferBufferLength = 00000015
  TransferBuffer       = 00000000
  TransferBufferMDL    = 8152af88
    00000000: 00 00 00 10 04 00 00 00 0a 00 01 00 03 00 01 00
    00000010: 00 00 00 07 d0
  UrbLink              = 00000000
[23892 ms] UsbSnoop - MyInternalIOCTLCompletion(f9e0bdb0) : fido=81103020, Irp=81480a20, Context=813c8288, IRQL=2
[23892 ms]  <<<  URB 35 coming back  <<< 
-- URB_FUNCTION_BULK_OR_INTERRUPT_TRANSFER:
  PipeHandle           = 813bfa34 [endpoint 0x00000002]
  TransferFlags        = 00000000 (USBD_TRANSFER_DIRECTION_OUT, ~USBD_SHORT_TRANSFER_OK)
  TransferBufferLength = 00000015
  TransferBuffer       = 00000000
  TransferBufferMDL    = 8152af88
  UrbLink              = 00000000
[23901 ms] UsbSnoop - DispatchAny(f9e0a610) : IRP_MJ_INTERNAL_DEVICE_CONTROL
[23901 ms] UsbSnoop - MyDispatchInternalIOCTL(f9e0be80) : fdo=815e4d28, Irp=81480a20, IRQL=2
[23901 ms]  >>>  URB 36 going down  >>> 
-- URB_FUNCTION_BULK_OR_INTERRUPT_TRANSFER:
  PipeHandle           = 813bfa14 [endpoint 0x00000081]
  TransferFlags        = 00000003 (USBD_TRANSFER_DIRECTION_IN, USBD_SHORT_TRANSFER_OK)
  TransferBufferLength = 00000100
  TransferBuffer       = 00000000
  TransferBufferMDL    = 8152af88
  UrbLink              = 00000000
[23902 ms] UsbSnoop - MyInternalIOCTLCompletion(f9e0bdb0) : fido=81103020, Irp=81480a20, Context=81464ad0, IRQL=2
[23902 ms]  <<<  URB 36 coming back  <<< 
-- URB_FUNCTION_BULK_OR_INTERRUPT_TRANSFER:
  PipeHandle           = 813bfa14 [endpoint 0x00000081]
  TransferFlags        = 00000003 (USBD_TRANSFER_DIRECTION_IN, USBD_SHORT_TRANSFER_OK)
  TransferBufferLength = 00000007
  TransferBuffer       = 00000000
  TransferBufferMDL    = 8152af88
    00000000: 00 00 00 02 05 e0 00
  UrbLink              = 00000000
[23941 ms] UsbSnoop - DispatchAny(f9e0a610) : IRP_MJ_INTERNAL_DEVICE_CONTROL
[23941 ms] UsbSnoop - MyDispatchInternalIOCTL(f9e0be80) : fdo=815e4d28, Irp=81480a20, IRQL=2
[23941 ms]  >>>  URB 37 going down  >>> 
-- URB_FUNCTION_BULK_OR_INTERRUPT_TRANSFER:
  PipeHandle           = 813bfa14 [endpoint 0x00000081]
  TransferFlags        = 00000003 (USBD_TRANSFER_DIRECTION_IN, USBD_SHORT_TRANSFER_OK)
  TransferBufferLength = 00000100
  TransferBuffer       = 00000000
  TransferBufferMDL    = 8152af88
  UrbLink              = 00000000
[23942 ms] UsbSnoop - MyInternalIOCTLCompletion(f9e0bdb0) : fido=81103020, Irp=81480a20, Context=8163d9c8, IRQL=2
[23942 ms]  <<<  URB 37 coming back  <<< 
-- URB_FUNCTION_BULK_OR_INTERRUPT_TRANSFER:
  PipeHandle           = 813bfa14 [endpoint 0x00000081]
  TransferFlags        = 00000003 (USBD_TRANSFER_DIRECTION_IN, USBD_SHORT_TRANSFER_OK)
  TransferBufferLength = 0000000f
  TransferBuffer       = 00000000
  TransferBufferMDL    = 8152af88
    00000000: 00 00 00 0a 04 00 00 00 04 00 12 00 00 07 d0
  UrbLink              = 00000000
[23981 ms] UsbSnoop - DispatchAny(f9e0a610) : IRP_MJ_INTERNAL_DEVICE_CONTROL
[23981 ms] UsbSnoop - MyDispatchInternalIOCTL(f9e0be80) : fdo=815e4d28, Irp=81480a20, IRQL=2
[23981 ms]  >>>  URB 38 going down  >>> 
-- URB_FUNCTION_BULK_OR_INTERRUPT_TRANSFER:
  PipeHandle           = 813bfa34 [endpoint 0x00000002]
  TransferFlags        = 00000000 (USBD_TRANSFER_DIRECTION_OUT, ~USBD_SHORT_TRANSFER_OK)
  TransferBufferLength = 00000007
  TransferBuffer       = 00000000
  TransferBufferMDL    = 8152af88
    00000000: 00 00 00 02 05 e0 00
  UrbLink              = 00000000
[23982 ms] UsbSnoop - MyInternalIOCTLCompletion(f9e0bdb0) : fido=81103020, Irp=81480a20, Context=815939e0, IRQL=2
[23982 ms]  <<<  URB 38 coming back  <<< 
-- URB_FUNCTION_BULK_OR_INTERRUPT_TRANSFER:
  PipeHandle           = 813bfa34 [endpoint 0x00000002]
  TransferFlags        = 00000000 (USBD_TRANSFER_DIRECTION_OUT, ~USBD_SHORT_TRANSFER_OK)
  TransferBufferLength = 00000007
  TransferBuffer       = 00000000
  TransferBufferMDL    = 8152af88
  UrbLink              = 00000000
[23991 ms] UsbSnoop - DispatchAny(f9e0a610) : IRP_MJ_INTERNAL_DEVICE_CONTROL
[23991 ms] UsbSnoop - MyDispatchInternalIOCTL(f9e0be80) : fdo=815e4d28, Irp=81480a20, IRQL=2
[23991 ms]  >>>  URB 39 going down  >>> 
-- URB_FUNCTION_BULK_OR_INTERRUPT_TRANSFER:
  PipeHandle           = 813bfa34 [endpoint 0x00000002]
  TransferFlags        = 00000000 (USBD_TRANSFER_DIRECTION_OUT, ~USBD_SHORT_TRANSFER_OK)
  TransferBufferLength = 0000000f
  TransferBuffer       = 00000000
  TransferBufferMDL    = 8152af88
    00000000: 00 00 00 0a 04 00 00 00 04 00 07 00 01 00 31
  UrbLink              = 00000000
[23992 ms] UsbSnoop - MyInternalIOCTLCompletion(f9e0bdb0) : fido=81103020, Irp=81480a20, Context=8163d9c8, IRQL=2
[23992 ms]  <<<  URB 39 coming back  <<< 
-- URB_FUNCTION_BULK_OR_INTERRUPT_TRANSFER:
  PipeHandle           = 813bfa34 [endpoint 0x00000002]
  TransferFlags        = 00000000 (USBD_TRANSFER_DIRECTION_OUT, ~USBD_SHORT_TRANSFER_OK)
  TransferBufferLength = 0000000f
  TransferBuffer       = 00000000
  TransferBufferMDL    = 8152af88
  UrbLink              = 00000000
[24001 ms] UsbSnoop - DispatchAny(f9e0a610) : IRP_MJ_INTERNAL_DEVICE_CONTROL
[24001 ms] UsbSnoop - MyDispatchInternalIOCTL(f9e0be80) : fdo=815e4d28, Irp=81480a20, IRQL=2
[24001 ms]  >>>  URB 40 going down  >>> 
-- URB_FUNCTION_BULK_OR_INTERRUPT_TRANSFER:
  PipeHandle           = 813bfa14 [endpoint 0x00000081]
  TransferFlags        = 00000003 (USBD_TRANSFER_DIRECTION_IN, USBD_SHORT_TRANSFER_OK)
  TransferBufferLength = 00000100
  TransferBuffer       = 00000000
  TransferBufferMDL    = 8152af88
  UrbLink              = 00000000
[24015 ms] UsbSnoop - MyInternalIOCTLCompletion(f9e0bdb0) : fido=81103020, Irp=81480a20, Context=814da120, IRQL=2
[24015 ms]  <<<  URB 40 coming back  <<< 
-- URB_FUNCTION_BULK_OR_INTERRUPT_TRANSFER:
  PipeHandle           = 813bfa14 [endpoint 0x00000081]
  TransferFlags        = 00000003 (USBD_TRANSFER_DIRECTION_IN, USBD_SHORT_TRANSFER_OK)
  TransferBufferLength = 00000007
  TransferBuffer       = 00000000
  TransferBufferMDL    = 8152af88
    00000000: 00 00 00 02 05 e0 00
  UrbLink              = 00000000
[24051 ms] UsbSnoop - DispatchAny(f9e0a610) : IRP_MJ_INTERNAL_DEVICE_CONTROL
[24051 ms] UsbSnoop - MyDispatchInternalIOCTL(f9e0be80) : fdo=815e4d28, Irp=81480a20, IRQL=2
[24051 ms]  >>>  URB 41 going down  >>> 
-- URB_FUNCTION_BULK_OR_INTERRUPT_TRANSFER:
  PipeHandle           = 813bfa14 [endpoint 0x00000081]
  TransferFlags        = 00000003 (USBD_TRANSFER_DIRECTION_IN, USBD_SHORT_TRANSFER_OK)
  TransferBufferLength = 00000100
  TransferBuffer       = 00000000
  TransferBufferMDL    = 8152af88
  UrbLink              = 00000000
[24052 ms] UsbSnoop - MyInternalIOCTLCompletion(f9e0bdb0) : fido=81103020, Irp=81480a20, Context=815939e0, IRQL=2
[24052 ms]  <<<  URB 41 coming back  <<< 
-- URB_FUNCTION_BULK_OR_INTERRUPT_TRANSFER:
  PipeHandle           = 813bfa14 [endpoint 0x00000081]
  TransferFlags        = 00000003 (USBD_TRANSFER_DIRECTION_IN, USBD_SHORT_TRANSFER_OK)
  TransferBufferLength = 0000000f
  TransferBuffer       = 00000000
  TransferBufferMDL    = 8152af88
    00000000: 00 00 00 0a 04 00 00 00 04 bb 00 00 01 d4 c0
  UrbLink              = 00000000
[24091 ms] UsbSnoop - DispatchAny(f9e0a610) : IRP_MJ_INTERNAL_DEVICE_CONTROL
[24091 ms] UsbSnoop - MyDispatchInternalIOCTL(f9e0be80) : fdo=815e4d28, Irp=81480a20, IRQL=2
[24091 ms]  >>>  URB 42 going down  >>> 
-- URB_FUNCTION_BULK_OR_INTERRUPT_TRANSFER:
  PipeHandle           = 813bfa34 [endpoint 0x00000002]
  TransferFlags        = 00000000 (USBD_TRANSFER_DIRECTION_OUT, ~USBD_SHORT_TRANSFER_OK)
  TransferBufferLength = 00000007
  TransferBuffer       = 00000000
  TransferBufferMDL    = 8152af88
    00000000: 00 00 00 02 05 e0 00
  UrbLink              = 00000000
[24092 ms] UsbSnoop - MyInternalIOCTLCompletion(f9e0bdb0) : fido=81103020, Irp=81480a20, Context=81464ad0, IRQL=2
[24092 ms]  <<<  URB 42 coming back  <<< 
-- URB_FUNCTION_BULK_OR_INTERRUPT_TRANSFER:
  PipeHandle           = 813bfa34 [endpoint 0x00000002]
  TransferFlags        = 00000000 (USBD_TRANSFER_DIRECTION_OUT, ~USBD_SHORT_TRANSFER_OK)
  TransferBufferLength = 00000007
  TransferBuffer       = 00000000
  TransferBufferMDL    = 8152af88
  UrbLink              = 00000000
[24101 ms] UsbSnoop - DispatchAny(f9e0a610) : IRP_MJ_INTERNAL_DEVICE_CONTROL
[24101 ms] UsbSnoop - MyDispatchInternalIOCTL(f9e0be80) : fdo=815e4d28, Irp=81480a20, IRQL=2
[24101 ms]  >>>  URB 43 going down  >>> 
-- URB_FUNCTION_BULK_OR_INTERRUPT_TRANSFER:
  PipeHandle           = 813bfa14 [endpoint 0x00000081]
  TransferFlags        = 00000003 (USBD_TRANSFER_DIRECTION_IN, USBD_SHORT_TRANSFER_OK)
  TransferBufferLength = 00000100
  TransferBuffer       = 00000000
  TransferBufferMDL    = 8152af88
  UrbLink              = 00000000
[32166 ms] UsbSnoop - MyInternalIOCTLCompletion(f9e0bdb0) : fido=81103020, Irp=81480a20, Context=815939e0, IRQL=2
[32166 ms]  <<<  URB 43 coming back  <<< 
-- URB_FUNCTION_BULK_OR_INTERRUPT_TRANSFER:
  PipeHandle           = 813bfa14 [endpoint 0x00000081]
  TransferFlags        = 00000003 (USBD_TRANSFER_DIRECTION_IN, USBD_SHORT_TRANSFER_OK)
  TransferBufferLength = 00000000
  TransferBuffer       = 00000000
  TransferBufferMDL    = 8152af88
  UrbLink              = 00000000
[32174 ms] UsbSnoop - DispatchAny(f9e0a610) : IRP_MJ_INTERNAL_DEVICE_CONTROL
[32174 ms] UsbSnoop - MyDispatchInternalIOCTL(f9e0be80) : fdo=815e4d28, Irp=814e4848, IRQL=0
[32174 ms]  >>>  URB 44 going down  >>> 
-- URB_FUNCTION_RESET_PIPE:
  PipeHandle = 813bfa14 [endpoint 0x00000081]
[32174 ms] UsbSnoop - MyInternalIOCTLCompletion(f9e0bdb0) : fido=00000000, Irp=814e4848, Context=81422700, IRQL=0
[32174 ms]  <<<  URB 44 coming back  <<< 
-- URB_FUNCTION_RESET_PIPE:
[32175 ms] UsbSnoop - DispatchAny(f9e0a610) : IRP_MJ_INTERNAL_DEVICE_CONTROL
[32175 ms] UsbSnoop - MyDispatchInternalIOCTL(f9e0be80) : fdo=815e4d28, Irp=814e4848, IRQL=0
[32175 ms]  >>>  URB 45 going down  >>> 
-- URB_FUNCTION_RESET_PIPE:
  PipeHandle = 813bfa34 [endpoint 0x00000002]
[32196 ms] UsbSnoop - MyInternalIOCTLCompletion(f9e0bdb0) : fido=00000000, Irp=814e4848, Context=813fb880, IRQL=0
[32196 ms]  <<<  URB 45 coming back  <<< 
-- URB_FUNCTION_RESET_PIPE:
[32454 ms] UsbSnoop - DispatchAny(f9e0a610) : IRP_MJ_INTERNAL_DEVICE_CONTROL
[32454 ms] UsbSnoop - MyDispatchInternalIOCTL(f9e0be80) : fdo=815e4d28, Irp=81480a20, IRQL=2
[32454 ms]  >>>  URB 46 going down  >>> 
-- URB_FUNCTION_BULK_OR_INTERRUPT_TRANSFER:
  PipeHandle           = 813bfa34 [endpoint 0x00000002]
  TransferFlags        = 00000000 (USBD_TRANSFER_DIRECTION_OUT, ~USBD_SHORT_TRANSFER_OK)
  TransferBufferLength = 00000009
  TransferBuffer       = 00000000
  TransferBufferMDL    = 8152af88
    00000000: 00 00 00 04 01 00 00 04 00
  UrbLink              = 00000000
[32455 ms] UsbSnoop - MyInternalIOCTLCompletion(f9e0bdb0) : fido=81103020, Irp=81480a20, Context=813c8288, IRQL=2
[32456 ms]  <<<  URB 46 coming back  <<< 
-- URB_FUNCTION_BULK_OR_INTERRUPT_TRANSFER:
  PipeHandle           = 813bfa34 [endpoint 0x00000002]
  TransferFlags        = 00000000 (USBD_TRANSFER_DIRECTION_OUT, ~USBD_SHORT_TRANSFER_OK)
  TransferBufferLength = 00000009
  TransferBuffer       = 00000000
  TransferBufferMDL    = 8152af88
  UrbLink              = 00000000
[32456 ms] UsbSnoop - DispatchAny(f9e0a610) : IRP_MJ_INTERNAL_DEVICE_CONTROL
[32456 ms] UsbSnoop - MyDispatchInternalIOCTL(f9e0be80) : fdo=815e4d28, Irp=81480a20, IRQL=2
[32456 ms]  >>>  URB 47 going down  >>> 
-- URB_FUNCTION_BULK_OR_INTERRUPT_TRANSFER:
  PipeHandle           = 813bfa14 [endpoint 0x00000081]
  TransferFlags        = 00000003 (USBD_TRANSFER_DIRECTION_IN, USBD_SHORT_TRANSFER_OK)
  TransferBufferLength = 00000100
  TransferBuffer       = 00000000
  TransferBufferMDL    = 8152af88
  UrbLink              = 00000000
[34468 ms] UsbSnoop - MyInternalIOCTLCompletion(f9e0bdb0) : fido=81103020, Irp=81480a20, Context=817142f0, IRQL=2
[34468 ms]  <<<  URB 47 coming back  <<< 
-- URB_FUNCTION_BULK_OR_INTERRUPT_TRANSFER:
  PipeHandle           = 813bfa14 [endpoint 0x00000081]
  TransferFlags        = 00000003 (USBD_TRANSFER_DIRECTION_IN, USBD_SHORT_TRANSFER_OK)
  TransferBufferLength = 00000000
  TransferBuffer       = 00000000
  TransferBufferMDL    = 8152af88
  UrbLink              = 00000000
[34478 ms] UsbSnoop - DispatchAny(f9e0a610) : IRP_MJ_INTERNAL_DEVICE_CONTROL
[34478 ms] UsbSnoop - MyDispatchInternalIOCTL(f9e0be80) : fdo=815e4d28, Irp=814e4848, IRQL=0
[34478 ms]  >>>  URB 48 going down  >>> 
-- URB_FUNCTION_RESET_PIPE:
  PipeHandle = 813bfa14 [endpoint 0x00000081]
[34497 ms] UsbSnoop - MyInternalIOCTLCompletion(f9e0bdb0) : fido=00000000, Irp=814e4848, Context=815938b8, IRQL=0
[34497 ms]  <<<  URB 48 coming back  <<< 
-- URB_FUNCTION_RESET_PIPE:
[34497 ms] UsbSnoop - DispatchAny(f9e0a610) : IRP_MJ_INTERNAL_DEVICE_CONTROL
[34497 ms] UsbSnoop - MyDispatchInternalIOCTL(f9e0be80) : fdo=815e4d28, Irp=814e4848, IRQL=0
[34497 ms]  >>>  URB 49 going down  >>> 
-- URB_FUNCTION_RESET_PIPE:
  PipeHandle = 813bfa34 [endpoint 0x00000002]
[34498 ms] UsbSnoop - MyInternalIOCTLCompletion(f9e0bdb0) : fido=00000000, Irp=814e4848, Context=813c8288, IRQL=0
[34498 ms]  <<<  URB 49 coming back  <<< 
-- URB_FUNCTION_RESET_PIPE:
[34498 ms] UsbSnoop - DispatchAny(f9e0a610) : IRP_MJ_INTERNAL_DEVICE_CONTROL
[34498 ms] UsbSnoop - MyDispatchInternalIOCTL(f9e0be80) : fdo=815e4d28, Irp=811054b0, IRQL=0
[34499 ms] UsbSnoop - IRP_MJ_POWER (IRP_MN_WAIT_WAKE)
