[708889 ms] UsbSnoop - DispatchAny(f88fe610) : IRP_MJ_INTERNAL_DEVICE_CONTROL
[708889 ms] UsbSnoop - MyDispatchInternalIOCTL(f88ffe80) : fdo=82141030, Irp=81c4d008, IRQL=0
[708889 ms]  >>>  URB 591 going down  >>> 
-- URB_FUNCTION_RESET_PIPE:
  PipeHandle = 81b38414 [endpoint 0x00000081]
[708890 ms] UsbSnoop - MyInternalIOCTLCompletion(f88ffdb0) : fido=00000000, Irp=81c4d008, Context=81b907f8, IRQL=0
[708891 ms]  <<<  URB 591 coming back  <<< 
-- URB_FUNCTION_RESET_PIPE:
[708891 ms] UsbSnoop - DispatchAny(f88fe610) : IRP_MJ_INTERNAL_DEVICE_CONTROL
[708891 ms] UsbSnoop - MyDispatchInternalIOCTL(f88ffe80) : fdo=82141030, Irp=81c4d008, IRQL=0
[708891 ms]  >>>  URB 592 going down  >>> 
-- URB_FUNCTION_RESET_PIPE:
  PipeHandle = 81b38434 [endpoint 0x00000002]
[708891 ms] UsbSnoop - MyInternalIOCTLCompletion(f88ffdb0) : fido=00000000, Irp=81c4d008, Context=822a1498, IRQL=0
[708891 ms]  <<<  URB 592 coming back  <<< 
-- URB_FUNCTION_RESET_PIPE:
[709890 ms] UsbSnoop - DispatchAny(f88fe610) : IRP_MJ_INTERNAL_DEVICE_CONTROL
[709890 ms] UsbSnoop - MyDispatchInternalIOCTL(f88ffe80) : fdo=82141030, Irp=81c4d008, IRQL=0
[709890 ms]  >>>  URB 593 going down  >>> 
-- URB_FUNCTION_RESET_PIPE:
  PipeHandle = 81b38414 [endpoint 0x00000081]
[709893 ms] UsbSnoop - MyInternalIOCTLCompletion(f88ffdb0) : fido=00000000, Irp=81c4d008, Context=81ba5340, IRQL=0
[709893 ms]  <<<  URB 593 coming back  <<< 
-- URB_FUNCTION_RESET_PIPE:
[709893 ms] UsbSnoop - DispatchAny(f88fe610) : IRP_MJ_INTERNAL_DEVICE_CONTROL
[709893 ms] UsbSnoop - MyDispatchInternalIOCTL(f88ffe80) : fdo=82141030, Irp=81c4d008, IRQL=0
[709893 ms]  >>>  URB 594 going down  >>> 
-- URB_FUNCTION_RESET_PIPE:
  PipeHandle = 81b38434 [endpoint 0x00000002]
[709893 ms] UsbSnoop - MyInternalIOCTLCompletion(f88ffdb0) : fido=00000000, Irp=81c4d008, Context=81b6c560, IRQL=0
[709893 ms]  <<<  URB 594 coming back  <<< 
-- URB_FUNCTION_RESET_PIPE:
[709893 ms] UsbSnoop - DispatchAny(f88fe610) : IRP_MJ_INTERNAL_DEVICE_CONTROL
[709893 ms] UsbSnoop - MyDispatchInternalIOCTL(f88ffe80) : fdo=82141030, Irp=81c4d008, IRQL=0
[710892 ms] UsbSnoop - DispatchAny(f88fe610) : IRP_MJ_INTERNAL_DEVICE_CONTROL
[710892 ms] UsbSnoop - MyDispatchInternalIOCTL(f88ffe80) : fdo=82141030, Irp=81c20008, IRQL=0
[710892 ms]  >>>  URB 595 going down  >>> 
-- URB_FUNCTION_GET_DESCRIPTOR_FROM_DEVICE:
  TransferBufferLength = 00000012
  TransferBuffer       = e2378b20
  TransferBufferMDL    = 00000000
  Index                = 00000000
  DescriptorType       = 00000001 (USB_DEVICE_DESCRIPTOR_TYPE)
  LanguageId           = 00000000
[710895 ms] UsbSnoop - MyInternalIOCTLCompletion(f88ffdb0) : fido=00000000, Irp=81c20008, Context=81b6c560, IRQL=2
[710895 ms]  <<<  URB 595 coming back  <<< 
-- URB_FUNCTION_CONTROL_TRANSFER:
  PipeHandle           = 82184a90
  TransferFlags        = 81c4d00b (USBD_TRANSFER_DIRECTION_IN, USBD_SHORT_TRANSFER_OK)
  TransferBufferLength = 00000012
  TransferBuffer       = e2378b20
  TransferBufferMDL    = 81c55998
    00000000: 12 01 00 02 00 00 00 40 51 04 08 e0 10 01 01 02
    00000010: 00 01
  UrbLink              = 00000000
  SetupPacket          =
    00000000: 80 06 00 01 00 00 12 00
[710895 ms] UsbSnoop - DispatchAny(f88fe610) : IRP_MJ_INTERNAL_DEVICE_CONTROL
[710895 ms] UsbSnoop - MyDispatchInternalIOCTL(f88ffe80) : fdo=82141030, Irp=81c20008, IRQL=0
[710895 ms] UsbSnoop - DispatchAny(f88fe610) : IRP_MJ_INTERNAL_DEVICE_CONTROL
[710895 ms] UsbSnoop - MyDispatchInternalIOCTL(f88ffe80) : fdo=82141030, Irp=81c20008, IRQL=0
[710895 ms]  >>>  URB 596 going down  >>> 
-- URB_FUNCTION_RESET_PIPE:
  PipeHandle = 81b38414 [endpoint 0x00000081]
[710904 ms] UsbSnoop - MyInternalIOCTLCompletion(f88ffdb0) : fido=00000000, Irp=81c20008, Context=81b86b58, IRQL=0
[710904 ms]  <<<  URB 596 coming back  <<< 
-- URB_FUNCTION_RESET_PIPE:
[710904 ms] UsbSnoop - DispatchAny(f88fe610) : IRP_MJ_INTERNAL_DEVICE_CONTROL
[710904 ms] UsbSnoop - MyDispatchInternalIOCTL(f88ffe80) : fdo=82141030, Irp=81c20008, IRQL=0
[710904 ms]  >>>  URB 597 going down  >>> 
-- URB_FUNCTION_RESET_PIPE:
  PipeHandle = 81b38434 [endpoint 0x00000002]
[710904 ms] UsbSnoop - MyInternalIOCTLCompletion(f88ffdb0) : fido=00000000, Irp=81c20008, Context=81b907f8, IRQL=0
[710904 ms]  <<<  URB 597 coming back  <<< 
-- URB_FUNCTION_RESET_PIPE:
[712184 ms] UsbSnoop - DispatchAny(f88fe610) : IRP_MJ_INTERNAL_DEVICE_CONTROL
[712184 ms] UsbSnoop - MyDispatchInternalIOCTL(f88ffe80) : fdo=82141030, Irp=81c4d008, IRQL=2
[712184 ms]  >>>  URB 598 going down  >>> 
-- URB_FUNCTION_BULK_OR_INTERRUPT_TRANSFER:
  PipeHandle           = 81b38434 [endpoint 0x00000002]
  TransferFlags        = 00000000 (USBD_TRANSFER_DIRECTION_OUT, ~USBD_SHORT_TRANSFER_OK)
  TransferBufferLength = 00000009
  TransferBuffer       = 00000000
  TransferBufferMDL    = 81c55998
    00000000: 00 00 00 04 01 00 00 04 00
  UrbLink              = 00000000
[712184 ms] UsbSnoop - MyInternalIOCTLCompletion(f88ffdb0) : fido=81b37020, Irp=81c4d008, Context=81bd0c08, IRQL=2
[712184 ms]  <<<  URB 598 coming back  <<< 
-- URB_FUNCTION_BULK_OR_INTERRUPT_TRANSFER:
  PipeHandle           = 81b38434 [endpoint 0x00000002]
  TransferFlags        = 00000000 (USBD_TRANSFER_DIRECTION_OUT, ~USBD_SHORT_TRANSFER_OK)
  TransferBufferLength = 00000009
  TransferBuffer       = 00000000
  TransferBufferMDL    = 81c55998
  UrbLink              = 00000000
[712187 ms] UsbSnoop - DispatchAny(f88fe610) : IRP_MJ_INTERNAL_DEVICE_CONTROL
[712187 ms] UsbSnoop - MyDispatchInternalIOCTL(f88ffe80) : fdo=82141030, Irp=81c4d008, IRQL=2
[712187 ms]  >>>  URB 599 going down  >>> 
-- URB_FUNCTION_BULK_OR_INTERRUPT_TRANSFER:
  PipeHandle           = 81b38414 [endpoint 0x00000081]
  TransferFlags        = 00000003 (USBD_TRANSFER_DIRECTION_IN, USBD_SHORT_TRANSFER_OK)
  TransferBufferLength = 00000100
  TransferBuffer       = 00000000
  TransferBufferMDL    = 81c55998
  UrbLink              = 00000000
[712189 ms] UsbSnoop - MyInternalIOCTLCompletion(f88ffdb0) : fido=81b37020, Irp=81c4d008, Context=81c36700, IRQL=2
[712189 ms]  <<<  URB 599 coming back  <<< 
-- URB_FUNCTION_BULK_OR_INTERRUPT_TRANSFER:
  PipeHandle           = 81b38414 [endpoint 0x00000081]
  TransferFlags        = 00000003 (USBD_TRANSFER_DIRECTION_IN, USBD_SHORT_TRANSFER_OK)
  TransferBufferLength = 00000009
  TransferBuffer       = 00000000
  TransferBufferMDL    = 81c55998
    00000000: 00 00 00 04 02 00 00 00 fa
  UrbLink              = 00000000
[712216 ms] UsbSnoop - DispatchAny(f88fe610) : IRP_MJ_INTERNAL_DEVICE_CONTROL
[712216 ms] UsbSnoop - MyDispatchInternalIOCTL(f88ffe80) : fdo=82141030, Irp=81c4d008, IRQL=2
[712216 ms]  >>>  URB 600 going down  >>> 
-- URB_FUNCTION_BULK_OR_INTERRUPT_TRANSFER:
  PipeHandle           = 81b38434 [endpoint 0x00000002]
  TransferFlags        = 00000000 (USBD_TRANSFER_DIRECTION_OUT, ~USBD_SHORT_TRANSFER_OK)
  TransferBufferLength = 00000015
  TransferBuffer       = 00000000
  TransferBufferMDL    = 81c55998
    00000000: 00 00 00 10 04 00 00 00 0a 00 01 00 03 00 01 00
    00000010: 00 00 00 07 d0
  UrbLink              = 00000000
[712216 ms] UsbSnoop - MyInternalIOCTLCompletion(f88ffdb0) : fido=81b37020, Irp=81c4d008, Context=822ca258, IRQL=2
[712216 ms]  <<<  URB 600 coming back  <<< 
-- URB_FUNCTION_BULK_OR_INTERRUPT_TRANSFER:
  PipeHandle           = 81b38434 [endpoint 0x00000002]
  TransferFlags        = 00000000 (USBD_TRANSFER_DIRECTION_OUT, ~USBD_SHORT_TRANSFER_OK)
  TransferBufferLength = 00000015
  TransferBuffer       = 00000000
  TransferBufferMDL    = 81c55998
  UrbLink              = 00000000
[712224 ms] UsbSnoop - DispatchAny(f88fe610) : IRP_MJ_INTERNAL_DEVICE_CONTROL
[712224 ms] UsbSnoop - MyDispatchInternalIOCTL(f88ffe80) : fdo=82141030, Irp=81c4d008, IRQL=2
[712224 ms]  >>>  URB 601 going down  >>> 
-- URB_FUNCTION_BULK_OR_INTERRUPT_TRANSFER:
  PipeHandle           = 81b38414 [endpoint 0x00000081]
  TransferFlags        = 00000003 (USBD_TRANSFER_DIRECTION_IN, USBD_SHORT_TRANSFER_OK)
  TransferBufferLength = 00000100
  TransferBuffer       = 00000000
  TransferBufferMDL    = 81c55998
  UrbLink              = 00000000
[712224 ms] UsbSnoop - MyInternalIOCTLCompletion(f88ffdb0) : fido=81b37020, Irp=81c4d008, Context=81c36700, IRQL=2
[712224 ms]  <<<  URB 601 coming back  <<< 
-- URB_FUNCTION_BULK_OR_INTERRUPT_TRANSFER:
  PipeHandle           = 81b38414 [endpoint 0x00000081]
  TransferFlags        = 00000003 (USBD_TRANSFER_DIRECTION_IN, USBD_SHORT_TRANSFER_OK)
  TransferBufferLength = 00000007
  TransferBuffer       = 00000000
  TransferBufferMDL    = 81c55998
    00000000: 00 00 00 02 05 e0 00
  UrbLink              = 00000000
[712264 ms] UsbSnoop - DispatchAny(f88fe610) : IRP_MJ_INTERNAL_DEVICE_CONTROL
[712264 ms] UsbSnoop - MyDispatchInternalIOCTL(f88ffe80) : fdo=82141030, Irp=81c4d008, IRQL=2
[712264 ms]  >>>  URB 602 going down  >>> 
-- URB_FUNCTION_BULK_OR_INTERRUPT_TRANSFER:
  PipeHandle           = 81b38414 [endpoint 0x00000081]
  TransferFlags        = 00000003 (USBD_TRANSFER_DIRECTION_IN, USBD_SHORT_TRANSFER_OK)
  TransferBufferLength = 00000100
  TransferBuffer       = 00000000
  TransferBufferMDL    = 81c55998
  UrbLink              = 00000000
[712264 ms] UsbSnoop - MyInternalIOCTLCompletion(f88ffdb0) : fido=81b37020, Irp=81c4d008, Context=81b96ed8, IRQL=2
[712264 ms]  <<<  URB 602 coming back  <<< 
-- URB_FUNCTION_BULK_OR_INTERRUPT_TRANSFER:
  PipeHandle           = 81b38414 [endpoint 0x00000081]
  TransferFlags        = 00000003 (USBD_TRANSFER_DIRECTION_IN, USBD_SHORT_TRANSFER_OK)
  TransferBufferLength = 0000000f
  TransferBuffer       = 00000000
  TransferBufferMDL    = 81c55998
    00000000: 00 00 00 0a 04 00 00 00 04 00 12 00 00 07 d0
  UrbLink              = 00000000
[712304 ms] UsbSnoop - DispatchAny(f88fe610) : IRP_MJ_INTERNAL_DEVICE_CONTROL
[712304 ms] UsbSnoop - MyDispatchInternalIOCTL(f88ffe80) : fdo=82141030, Irp=81c4d008, IRQL=2
[712304 ms]  >>>  URB 603 going down  >>> 
-- URB_FUNCTION_BULK_OR_INTERRUPT_TRANSFER:
  PipeHandle           = 81b38434 [endpoint 0x00000002]
  TransferFlags        = 00000000 (USBD_TRANSFER_DIRECTION_OUT, ~USBD_SHORT_TRANSFER_OK)
  TransferBufferLength = 00000007
  TransferBuffer       = 00000000
  TransferBufferMDL    = 81c55998
    00000000: 00 00 00 02 05 e0 00
  UrbLink              = 00000000
[712304 ms] UsbSnoop - MyInternalIOCTLCompletion(f88ffdb0) : fido=81b37020, Irp=81c4d008, Context=81b5c250, IRQL=2
[712304 ms]  <<<  URB 603 coming back  <<< 
-- URB_FUNCTION_BULK_OR_INTERRUPT_TRANSFER:
  PipeHandle           = 81b38434 [endpoint 0x00000002]
  TransferFlags        = 00000000 (USBD_TRANSFER_DIRECTION_OUT, ~USBD_SHORT_TRANSFER_OK)
  TransferBufferLength = 00000007
  TransferBuffer       = 00000000
  TransferBufferMDL    = 81c55998
  UrbLink              = 00000000
[712314 ms] UsbSnoop - DispatchAny(f88fe610) : IRP_MJ_INTERNAL_DEVICE_CONTROL
[712314 ms] UsbSnoop - MyDispatchInternalIOCTL(f88ffe80) : fdo=82141030, Irp=81c4d008, IRQL=2
[712314 ms]  >>>  URB 604 going down  >>> 
-- URB_FUNCTION_BULK_OR_INTERRUPT_TRANSFER:
  PipeHandle           = 81b38434 [endpoint 0x00000002]
  TransferFlags        = 00000000 (USBD_TRANSFER_DIRECTION_OUT, ~USBD_SHORT_TRANSFER_OK)
  TransferBufferLength = 00000029
  TransferBuffer       = 00000000
  TransferBufferMDL    = 81c55998
    00000000: 00 00 00 24 04 00 00 00 1e 00 07 00 0e 00 0b 00
    00000010: 04 00 06 00 07 00 01 00 02 00 0a 00 37 00 0d 00
    00000020: 38 00 09 00 0e 00 2d 00 03
  UrbLink              = 00000000
[712314 ms] UsbSnoop - MyInternalIOCTLCompletion(f88ffdb0) : fido=81b37020, Irp=81c4d008, Context=81bd0c08, IRQL=2
[712314 ms]  <<<  URB 604 coming back  <<< 
-- URB_FUNCTION_BULK_OR_INTERRUPT_TRANSFER:
  PipeHandle           = 81b38434 [endpoint 0x00000002]
  TransferFlags        = 00000000 (USBD_TRANSFER_DIRECTION_OUT, ~USBD_SHORT_TRANSFER_OK)
  TransferBufferLength = 00000029
  TransferBuffer       = 00000000
  TransferBufferMDL    = 81c55998
  UrbLink              = 00000000
[712324 ms] UsbSnoop - DispatchAny(f88fe610) : IRP_MJ_INTERNAL_DEVICE_CONTROL
[712324 ms] UsbSnoop - MyDispatchInternalIOCTL(f88ffe80) : fdo=82141030, Irp=81c4d008, IRQL=2
[712324 ms]  >>>  URB 605 going down  >>> 
-- URB_FUNCTION_BULK_OR_INTERRUPT_TRANSFER:
  PipeHandle           = 81b38414 [endpoint 0x00000081]
  TransferFlags        = 00000003 (USBD_TRANSFER_DIRECTION_IN, USBD_SHORT_TRANSFER_OK)
  TransferBufferLength = 00000100
  TransferBuffer       = 00000000
  TransferBufferMDL    = 81c55998
  UrbLink              = 00000000
[712324 ms] UsbSnoop - MyInternalIOCTLCompletion(f88ffdb0) : fido=81b37020, Irp=81c4d008, Context=822a1498, IRQL=2
[712324 ms]  <<<  URB 605 coming back  <<< 
-- URB_FUNCTION_BULK_OR_INTERRUPT_TRANSFER:
  PipeHandle           = 81b38414 [endpoint 0x00000081]
  TransferFlags        = 00000003 (USBD_TRANSFER_DIRECTION_IN, USBD_SHORT_TRANSFER_OK)
  TransferBufferLength = 00000007
  TransferBuffer       = 00000000
  TransferBufferMDL    = 81c55998
    00000000: 00 00 00 02 05 e0 00
  UrbLink              = 00000000
[712364 ms] UsbSnoop - DispatchAny(f88fe610) : IRP_MJ_INTERNAL_DEVICE_CONTROL
[712364 ms] UsbSnoop - MyDispatchInternalIOCTL(f88ffe80) : fdo=82141030, Irp=81c4d008, IRQL=2
[712364 ms]  >>>  URB 606 going down  >>> 
-- URB_FUNCTION_BULK_OR_INTERRUPT_TRANSFER:
  PipeHandle           = 81b38414 [endpoint 0x00000081]
  TransferFlags        = 00000003 (USBD_TRANSFER_DIRECTION_IN, USBD_SHORT_TRANSFER_OK)
  TransferBufferLength = 00000100
  TransferBuffer       = 00000000
  TransferBufferMDL    = 81c55998
  UrbLink              = 00000000
[712364 ms] UsbSnoop - MyInternalIOCTLCompletion(f88ffdb0) : fido=81b37020, Irp=81c4d008, Context=822ca258, IRQL=2
[712364 ms]  <<<  URB 606 coming back  <<< 
-- URB_FUNCTION_BULK_OR_INTERRUPT_TRANSFER:
  PipeHandle           = 81b38414 [endpoint 0x00000081]
  TransferFlags        = 00000003 (USBD_TRANSFER_DIRECTION_IN, USBD_SHORT_TRANSFER_OK)
  TransferBufferLength = 0000000f
  TransferBuffer       = 00000000
  TransferBufferMDL    = 81c55998
    00000000: 00 00 00 0a 04 00 00 00 04 bb 00 00 01 d4 c0
  UrbLink              = 00000000
[712404 ms] UsbSnoop - DispatchAny(f88fe610) : IRP_MJ_INTERNAL_DEVICE_CONTROL
[712404 ms] UsbSnoop - MyDispatchInternalIOCTL(f88ffe80) : fdo=82141030, Irp=81c4d008, IRQL=2
[712404 ms]  >>>  URB 607 going down  >>> 
-- URB_FUNCTION_BULK_OR_INTERRUPT_TRANSFER:
  PipeHandle           = 81b38434 [endpoint 0x00000002]
  TransferFlags        = 00000000 (USBD_TRANSFER_DIRECTION_OUT, ~USBD_SHORT_TRANSFER_OK)
  TransferBufferLength = 00000007
  TransferBuffer       = 00000000
  TransferBufferMDL    = 81c55998
    00000000: 00 00 00 02 05 e0 00
  UrbLink              = 00000000
[712404 ms] UsbSnoop - MyInternalIOCTLCompletion(f88ffdb0) : fido=81b37020, Irp=81c4d008, Context=81bd0c08, IRQL=2
[712404 ms]  <<<  URB 607 coming back  <<< 
-- URB_FUNCTION_BULK_OR_INTERRUPT_TRANSFER:
  PipeHandle           = 81b38434 [endpoint 0x00000002]
  TransferFlags        = 00000000 (USBD_TRANSFER_DIRECTION_OUT, ~USBD_SHORT_TRANSFER_OK)
  TransferBufferLength = 00000007
  TransferBuffer       = 00000000
  TransferBufferMDL    = 81c55998
  UrbLink              = 00000000
[712414 ms] UsbSnoop - DispatchAny(f88fe610) : IRP_MJ_INTERNAL_DEVICE_CONTROL
[712414 ms] UsbSnoop - MyDispatchInternalIOCTL(f88ffe80) : fdo=82141030, Irp=81c4d008, IRQL=2
[712414 ms]  >>>  URB 608 going down  >>> 
-- URB_FUNCTION_BULK_OR_INTERRUPT_TRANSFER:
  PipeHandle           = 81b38414 [endpoint 0x00000081]
  TransferFlags        = 00000003 (USBD_TRANSFER_DIRECTION_IN, USBD_SHORT_TRANSFER_OK)
  TransferBufferLength = 00000100
  TransferBuffer       = 00000000
  TransferBufferMDL    = 81c55998
  UrbLink              = 00000000
[712475 ms] UsbSnoop - MyInternalIOCTLCompletion(f88ffdb0) : fido=81b37020, Irp=81c4d008, Context=81bd0c08, IRQL=2
[712475 ms]  <<<  URB 608 coming back  <<< 
-- URB_FUNCTION_BULK_OR_INTERRUPT_TRANSFER:
  PipeHandle           = 81b38414 [endpoint 0x00000081]
  TransferFlags        = 00000003 (USBD_TRANSFER_DIRECTION_IN, USBD_SHORT_TRANSFER_OK)
  TransferBufferLength = 00000095
  TransferBuffer       = 00000000
  TransferBufferMDL    = 81c55998
    00000000: 00 00 00 90 04 00 00 00 8a 00 08 00 0e 00 0b 00
    00000010: 00 04 00 02 28 00 00 04 00 00 02 00 03 00 06 00
    00000020: 00 01 09 00 07 00 00 01 01 00 01 00 00 04 00 00
    00000030: 00 0a 00 02 00 00 19 54 49 2d 38 34 20 50 6c 75
    00000040: 73 20 53 69 6c 76 65 72 20 45 64 69 74 69 6f 6e
    00000050: 00 0a 00 00 01 01 00 37 00 00 01 01 00 0d 00 00
    00000060: 08 00 00 00 00 00 00 5e fd 00 38 00 00 01 00 00
    00000070: 09 00 00 04 00 01 00 00 00 0e 00 00 08 00 00 00
    00000080: 00 00 00 5e c1 00 2d 00 00 01 01 00 03 00 00 05
    00000090: 0a 32 cc e3 01
  UrbLink              = 00000000
[712526 ms] UsbSnoop - DispatchAny(f88fe610) : IRP_MJ_INTERNAL_DEVICE_CONTROL
[712526 ms] UsbSnoop - MyDispatchInternalIOCTL(f88ffe80) : fdo=82141030, Irp=81c4d008, IRQL=2
[712526 ms]  >>>  URB 609 going down  >>> 
-- URB_FUNCTION_BULK_OR_INTERRUPT_TRANSFER:
  PipeHandle           = 81b38434 [endpoint 0x00000002]
  TransferFlags        = 00000000 (USBD_TRANSFER_DIRECTION_OUT, ~USBD_SHORT_TRANSFER_OK)
  TransferBufferLength = 00000007
  TransferBuffer       = 00000000
  TransferBufferMDL    = 81c55998
    00000000: 00 00 00 02 05 e0 00
  UrbLink              = 00000000
[712527 ms] UsbSnoop - MyInternalIOCTLCompletion(f88ffdb0) : fido=81b37020, Irp=81c4d008, Context=81c36700, IRQL=2
[712527 ms]  <<<  URB 609 coming back  <<< 
-- URB_FUNCTION_BULK_OR_INTERRUPT_TRANSFER:
  PipeHandle           = 81b38434 [endpoint 0x00000002]
  TransferFlags        = 00000000 (USBD_TRANSFER_DIRECTION_OUT, ~USBD_SHORT_TRANSFER_OK)
  TransferBufferLength = 00000007
  TransferBuffer       = 00000000
  TransferBufferMDL    = 81c55998
  UrbLink              = 00000000
[712785 ms] UsbSnoop - DispatchAny(f88fe610) : IRP_MJ_INTERNAL_DEVICE_CONTROL
[712785 ms] UsbSnoop - MyDispatchInternalIOCTL(f88ffe80) : fdo=82141030, Irp=81c4d008, IRQL=2
[712785 ms]  >>>  URB 610 going down  >>> 
-- URB_FUNCTION_BULK_OR_INTERRUPT_TRANSFER:
  PipeHandle           = 81b38434 [endpoint 0x00000002]
  TransferFlags        = 00000000 (USBD_TRANSFER_DIRECTION_OUT, ~USBD_SHORT_TRANSFER_OK)
  TransferBufferLength = 00000009
  TransferBuffer       = 00000000
  TransferBufferMDL    = 81c55998
    00000000: 00 00 00 04 01 00 00 04 00
  UrbLink              = 00000000
[712785 ms] UsbSnoop - MyInternalIOCTLCompletion(f88ffdb0) : fido=81b37020, Irp=81c4d008, Context=81b5c250, IRQL=2
[712785 ms]  <<<  URB 610 coming back  <<< 
-- URB_FUNCTION_BULK_OR_INTERRUPT_TRANSFER:
  PipeHandle           = 81b38434 [endpoint 0x00000002]
  TransferFlags        = 00000000 (USBD_TRANSFER_DIRECTION_OUT, ~USBD_SHORT_TRANSFER_OK)
  TransferBufferLength = 00000009
  TransferBuffer       = 00000000
  TransferBufferMDL    = 81c55998
  UrbLink              = 00000000
[712785 ms] UsbSnoop - DispatchAny(f88fe610) : IRP_MJ_INTERNAL_DEVICE_CONTROL
[712785 ms] UsbSnoop - MyDispatchInternalIOCTL(f88ffe80) : fdo=82141030, Irp=81c4d008, IRQL=2
[712785 ms]  >>>  URB 611 going down  >>> 
-- URB_FUNCTION_BULK_OR_INTERRUPT_TRANSFER:
  PipeHandle           = 81b38414 [endpoint 0x00000081]
  TransferFlags        = 00000003 (USBD_TRANSFER_DIRECTION_IN, USBD_SHORT_TRANSFER_OK)
  TransferBufferLength = 00000100
  TransferBuffer       = 00000000
  TransferBufferMDL    = 81c55998
  UrbLink              = 00000000
[712793 ms] UsbSnoop - MyInternalIOCTLCompletion(f88ffdb0) : fido=81b37020, Irp=81c4d008, Context=81c36700, IRQL=2
[712793 ms]  <<<  URB 611 coming back  <<< 
-- URB_FUNCTION_BULK_OR_INTERRUPT_TRANSFER:
  PipeHandle           = 81b38414 [endpoint 0x00000081]
  TransferFlags        = 00000003 (USBD_TRANSFER_DIRECTION_IN, USBD_SHORT_TRANSFER_OK)
  TransferBufferLength = 00000009
  TransferBuffer       = 00000000
  TransferBufferMDL    = 81c55998
    00000000: 00 00 00 04 02 00 00 00 fa
  UrbLink              = 00000000
[712815 ms] UsbSnoop - DispatchAny(f88fe610) : IRP_MJ_INTERNAL_DEVICE_CONTROL
[712815 ms] UsbSnoop - MyDispatchInternalIOCTL(f88ffe80) : fdo=82141030, Irp=81c4d008, IRQL=2
[712815 ms]  >>>  URB 612 going down  >>> 
-- URB_FUNCTION_BULK_OR_INTERRUPT_TRANSFER:
  PipeHandle           = 81b38434 [endpoint 0x00000002]
  TransferFlags        = 00000000 (USBD_TRANSFER_DIRECTION_OUT, ~USBD_SHORT_TRANSFER_OK)
  TransferBufferLength = 00000015
  TransferBuffer       = 00000000
  TransferBufferMDL    = 81c55998
    00000000: 00 00 00 10 04 00 00 00 0a 00 01 00 03 00 01 00
    00000010: 00 00 00 07 d0
  UrbLink              = 00000000
[712815 ms] UsbSnoop - MyInternalIOCTLCompletion(f88ffdb0) : fido=81b37020, Irp=81c4d008, Context=822ca258, IRQL=2
[712815 ms]  <<<  URB 612 coming back  <<< 
-- URB_FUNCTION_BULK_OR_INTERRUPT_TRANSFER:
  PipeHandle           = 81b38434 [endpoint 0x00000002]
  TransferFlags        = 00000000 (USBD_TRANSFER_DIRECTION_OUT, ~USBD_SHORT_TRANSFER_OK)
  TransferBufferLength = 00000015
  TransferBuffer       = 00000000
  TransferBufferMDL    = 81c55998
  UrbLink              = 00000000
[712825 ms] UsbSnoop - DispatchAny(f88fe610) : IRP_MJ_INTERNAL_DEVICE_CONTROL
[712825 ms] UsbSnoop - MyDispatchInternalIOCTL(f88ffe80) : fdo=82141030, Irp=81c4d008, IRQL=2
[712825 ms]  >>>  URB 613 going down  >>> 
-- URB_FUNCTION_BULK_OR_INTERRUPT_TRANSFER:
  PipeHandle           = 81b38414 [endpoint 0x00000081]
  TransferFlags        = 00000003 (USBD_TRANSFER_DIRECTION_IN, USBD_SHORT_TRANSFER_OK)
  TransferBufferLength = 00000100
  TransferBuffer       = 00000000
  TransferBufferMDL    = 81c55998
  UrbLink              = 00000000
[712825 ms] UsbSnoop - MyInternalIOCTLCompletion(f88ffdb0) : fido=81b37020, Irp=81c4d008, Context=81b96ed8, IRQL=2
[712825 ms]  <<<  URB 613 coming back  <<< 
-- URB_FUNCTION_BULK_OR_INTERRUPT_TRANSFER:
  PipeHandle           = 81b38414 [endpoint 0x00000081]
  TransferFlags        = 00000003 (USBD_TRANSFER_DIRECTION_IN, USBD_SHORT_TRANSFER_OK)
  TransferBufferLength = 00000007
  TransferBuffer       = 00000000
  TransferBufferMDL    = 81c55998
    00000000: 00 00 00 02 05 e0 00
  UrbLink              = 00000000
[712865 ms] UsbSnoop - DispatchAny(f88fe610) : IRP_MJ_INTERNAL_DEVICE_CONTROL
[712865 ms] UsbSnoop - MyDispatchInternalIOCTL(f88ffe80) : fdo=82141030, Irp=81c4d008, IRQL=2
[712865 ms]  >>>  URB 614 going down  >>> 
-- URB_FUNCTION_BULK_OR_INTERRUPT_TRANSFER:
  PipeHandle           = 81b38414 [endpoint 0x00000081]
  TransferFlags        = 00000003 (USBD_TRANSFER_DIRECTION_IN, USBD_SHORT_TRANSFER_OK)
  TransferBufferLength = 00000100
  TransferBuffer       = 00000000
  TransferBufferMDL    = 81c55998
  UrbLink              = 00000000
[712865 ms] UsbSnoop - MyInternalIOCTLCompletion(f88ffdb0) : fido=81b37020, Irp=81c4d008, Context=822ca258, IRQL=2
[712865 ms]  <<<  URB 614 coming back  <<< 
-- URB_FUNCTION_BULK_OR_INTERRUPT_TRANSFER:
  PipeHandle           = 81b38414 [endpoint 0x00000081]
  TransferFlags        = 00000003 (USBD_TRANSFER_DIRECTION_IN, USBD_SHORT_TRANSFER_OK)
  TransferBufferLength = 0000000f
  TransferBuffer       = 00000000
  TransferBufferMDL    = 81c55998
    00000000: 00 00 00 0a 04 00 00 00 04 00 12 00 00 07 d0
  UrbLink              = 00000000
[712905 ms] UsbSnoop - DispatchAny(f88fe610) : IRP_MJ_INTERNAL_DEVICE_CONTROL
[712905 ms] UsbSnoop - MyDispatchInternalIOCTL(f88ffe80) : fdo=82141030, Irp=81c4d008, IRQL=2
[712905 ms]  >>>  URB 615 going down  >>> 
-- URB_FUNCTION_BULK_OR_INTERRUPT_TRANSFER:
  PipeHandle           = 81b38434 [endpoint 0x00000002]
  TransferFlags        = 00000000 (USBD_TRANSFER_DIRECTION_OUT, ~USBD_SHORT_TRANSFER_OK)
  TransferBufferLength = 00000007
  TransferBuffer       = 00000000
  TransferBufferMDL    = 81c55998
    00000000: 00 00 00 02 05 e0 00
  UrbLink              = 00000000
[712905 ms] UsbSnoop - MyInternalIOCTLCompletion(f88ffdb0) : fido=81b37020, Irp=81c4d008, Context=81b5c250, IRQL=2
[712905 ms]  <<<  URB 615 coming back  <<< 
-- URB_FUNCTION_BULK_OR_INTERRUPT_TRANSFER:
  PipeHandle           = 81b38434 [endpoint 0x00000002]
  TransferFlags        = 00000000 (USBD_TRANSFER_DIRECTION_OUT, ~USBD_SHORT_TRANSFER_OK)
  TransferBufferLength = 00000007
  TransferBuffer       = 00000000
  TransferBufferMDL    = 81c55998
  UrbLink              = 00000000
[712915 ms] UsbSnoop - DispatchAny(f88fe610) : IRP_MJ_INTERNAL_DEVICE_CONTROL
[712915 ms] UsbSnoop - MyDispatchInternalIOCTL(f88ffe80) : fdo=82141030, Irp=81c4d008, IRQL=2
[712915 ms]  >>>  URB 616 going down  >>> 
-- URB_FUNCTION_BULK_OR_INTERRUPT_TRANSFER:
  PipeHandle           = 81b38434 [endpoint 0x00000002]
  TransferFlags        = 00000000 (USBD_TRANSFER_DIRECTION_OUT, ~USBD_SHORT_TRANSFER_OK)
  TransferBufferLength = 0000000f
  TransferBuffer       = 00000000
  TransferBufferMDL    = 81c55998
    00000000: 00 00 00 0a 04 00 00 00 04 00 07 00 01 00 31
  UrbLink              = 00000000
[712915 ms] UsbSnoop - MyInternalIOCTLCompletion(f88ffdb0) : fido=81b37020, Irp=81c4d008, Context=822ca258, IRQL=2
[712915 ms]  <<<  URB 616 coming back  <<< 
-- URB_FUNCTION_BULK_OR_INTERRUPT_TRANSFER:
  PipeHandle           = 81b38434 [endpoint 0x00000002]
  TransferFlags        = 00000000 (USBD_TRANSFER_DIRECTION_OUT, ~USBD_SHORT_TRANSFER_OK)
  TransferBufferLength = 0000000f
  TransferBuffer       = 00000000
  TransferBufferMDL    = 81c55998
  UrbLink              = 00000000
[712925 ms] UsbSnoop - DispatchAny(f88fe610) : IRP_MJ_INTERNAL_DEVICE_CONTROL
[712925 ms] UsbSnoop - MyDispatchInternalIOCTL(f88ffe80) : fdo=82141030, Irp=81c4d008, IRQL=2
[712925 ms]  >>>  URB 617 going down  >>> 
-- URB_FUNCTION_BULK_OR_INTERRUPT_TRANSFER:
  PipeHandle           = 81b38414 [endpoint 0x00000081]
  TransferFlags        = 00000003 (USBD_TRANSFER_DIRECTION_IN, USBD_SHORT_TRANSFER_OK)
  TransferBufferLength = 00000100
  TransferBuffer       = 00000000
  TransferBufferMDL    = 81c55998
  UrbLink              = 00000000
[712925 ms] UsbSnoop - MyInternalIOCTLCompletion(f88ffdb0) : fido=81b37020, Irp=81c4d008, Context=81b96ed8, IRQL=2
[712925 ms]  <<<  URB 617 coming back  <<< 
-- URB_FUNCTION_BULK_OR_INTERRUPT_TRANSFER:
  PipeHandle           = 81b38414 [endpoint 0x00000081]
  TransferFlags        = 00000003 (USBD_TRANSFER_DIRECTION_IN, USBD_SHORT_TRANSFER_OK)
  TransferBufferLength = 00000007
  TransferBuffer       = 00000000
  TransferBufferMDL    = 81c55998
    00000000: 00 00 00 02 05 e0 00
  UrbLink              = 00000000
[712965 ms] UsbSnoop - DispatchAny(f88fe610) : IRP_MJ_INTERNAL_DEVICE_CONTROL
[712965 ms] UsbSnoop - MyDispatchInternalIOCTL(f88ffe80) : fdo=82141030, Irp=81c4d008, IRQL=2
[712965 ms]  >>>  URB 618 going down  >>> 
-- URB_FUNCTION_BULK_OR_INTERRUPT_TRANSFER:
  PipeHandle           = 81b38414 [endpoint 0x00000081]
  TransferFlags        = 00000003 (USBD_TRANSFER_DIRECTION_IN, USBD_SHORT_TRANSFER_OK)
  TransferBufferLength = 00000100
  TransferBuffer       = 00000000
  TransferBufferMDL    = 81c55998
  UrbLink              = 00000000
[712965 ms] UsbSnoop - MyInternalIOCTLCompletion(f88ffdb0) : fido=81b37020, Irp=81c4d008, Context=822ca258, IRQL=2
[712965 ms]  <<<  URB 618 coming back  <<< 
-- URB_FUNCTION_BULK_OR_INTERRUPT_TRANSFER:
  PipeHandle           = 81b38414 [endpoint 0x00000081]
  TransferFlags        = 00000003 (USBD_TRANSFER_DIRECTION_IN, USBD_SHORT_TRANSFER_OK)
  TransferBufferLength = 0000000f
  TransferBuffer       = 00000000
  TransferBufferMDL    = 81c55998
    00000000: 00 00 00 0a 04 00 00 00 04 bb 00 00 01 d4 c0
  UrbLink              = 00000000
[713005 ms] UsbSnoop - DispatchAny(f88fe610) : IRP_MJ_INTERNAL_DEVICE_CONTROL
[713005 ms] UsbSnoop - MyDispatchInternalIOCTL(f88ffe80) : fdo=82141030, Irp=81c4d008, IRQL=2
[713005 ms]  >>>  URB 619 going down  >>> 
-- URB_FUNCTION_BULK_OR_INTERRUPT_TRANSFER:
  PipeHandle           = 81b38434 [endpoint 0x00000002]
  TransferFlags        = 00000000 (USBD_TRANSFER_DIRECTION_OUT, ~USBD_SHORT_TRANSFER_OK)
  TransferBufferLength = 00000007
  TransferBuffer       = 00000000
  TransferBufferMDL    = 81c55998
    00000000: 00 00 00 02 05 e0 00
  UrbLink              = 00000000
[713005 ms] UsbSnoop - MyInternalIOCTLCompletion(f88ffdb0) : fido=81b37020, Irp=81c4d008, Context=81c36700, IRQL=2
[713005 ms]  <<<  URB 619 coming back  <<< 
-- URB_FUNCTION_BULK_OR_INTERRUPT_TRANSFER:
  PipeHandle           = 81b38434 [endpoint 0x00000002]
  TransferFlags        = 00000000 (USBD_TRANSFER_DIRECTION_OUT, ~USBD_SHORT_TRANSFER_OK)
  TransferBufferLength = 00000007
  TransferBuffer       = 00000000
  TransferBufferMDL    = 81c55998
  UrbLink              = 00000000
[713015 ms] UsbSnoop - DispatchAny(f88fe610) : IRP_MJ_INTERNAL_DEVICE_CONTROL
[713015 ms] UsbSnoop - MyDispatchInternalIOCTL(f88ffe80) : fdo=82141030, Irp=81c4d008, IRQL=2
[713015 ms]  >>>  URB 620 going down  >>> 
-- URB_FUNCTION_BULK_OR_INTERRUPT_TRANSFER:
  PipeHandle           = 81b38414 [endpoint 0x00000081]
  TransferFlags        = 00000003 (USBD_TRANSFER_DIRECTION_IN, USBD_SHORT_TRANSFER_OK)
  TransferBufferLength = 00000100
  TransferBuffer       = 00000000
  TransferBufferMDL    = 81c55998
  UrbLink              = 00000000
[720813 ms] UsbSnoop - MyInternalIOCTLCompletion(f88ffdb0) : fido=81b37020, Irp=81c4d008, Context=822a1498, IRQL=2
[720813 ms]  <<<  URB 620 coming back  <<< 
-- URB_FUNCTION_BULK_OR_INTERRUPT_TRANSFER:
  PipeHandle           = 81b38414 [endpoint 0x00000081]
  TransferFlags        = 00000003 (USBD_TRANSFER_DIRECTION_IN, USBD_SHORT_TRANSFER_OK)
  TransferBufferLength = 000000ff
  TransferBuffer       = 00000000
  TransferBufferMDL    = 81c55998
    00000000: 00 00 00 fa 03 00 00 03 fe 00 08 00 01 00 31 00
    00000010: 03 f7 0a 15 0a 32 cc e3 01 0a 2d 40 00 00 00 00
    00000020: 00 00 00 00 00 00 00 00 00 00 00 00 00 00 00 00
    00000030: 00 00 00 00 00 00 00 00 00 00 00 00 00 00 00 00
    00000040: 00 00 00 00 00 00 00 00 00 00 00 00 00 00 00 00
    00000050: 00 00 00 00 00 00 00 00 00 00 00 00 04 12 21 18
    00000060: 03 26 09 04 0b d4 31 b0 02 0d 40 a4 f7 87 78 b9
    00000070: da 56 1a 21 97 57 2e 90 de 87 7a 0b 6c 5f 63 2c
    00000080: 01 8a 32 17 9b 65 73 af b1 a1 1b 2f 0c 0b 67 b8
    00000090: f7 84 22 44 04 bd 33 76 f8 06 2e 82 57 ff 63 a1
    000000a0: c9 27 8e f4 46 8e b1 ea 96 c3 9a 80 0f 00 00 00
    000000b0: 00 80 11 0a 80 21 02 80 31 28 80 a1 03 80 81 12
    000000c0: 80 7f 00 00 00 00 02 0d 40 50 ed 7d 34 7b 37 b2
    000000d0: 6e 5f d9 b6 60 23 55 a0 8d 68 42 da 55 bd a0 50
    000000e0: 64 2e b3 12 f9 b8 a9 1d 29 9d 90 7e 15 18 66 1d
    000000f0: aa 74 03 e8 78 c4 3c e6 b3 0e d2 d9 c9 eb 6b
  UrbLink              = 00000000
[720859 ms] UsbSnoop - DispatchAny(f88fe610) : IRP_MJ_INTERNAL_DEVICE_CONTROL
[720859 ms] UsbSnoop - MyDispatchInternalIOCTL(f88ffe80) : fdo=82141030, Irp=81c4d008, IRQL=2
[720859 ms]  >>>  URB 621 going down  >>> 
-- URB_FUNCTION_BULK_OR_INTERRUPT_TRANSFER:
  PipeHandle           = 81b38434 [endpoint 0x00000002]
  TransferFlags        = 00000000 (USBD_TRANSFER_DIRECTION_OUT, ~USBD_SHORT_TRANSFER_OK)
  TransferBufferLength = 00000007
  TransferBuffer       = 00000000
  TransferBufferMDL    = 81c55998
    00000000: 00 00 00 02 05 e0 00
  UrbLink              = 00000000
[720859 ms] UsbSnoop - MyInternalIOCTLCompletion(f88ffdb0) : fido=81b37020, Irp=81c4d008, Context=81ba1c68, IRQL=2
[720859 ms]  <<<  URB 621 coming back  <<< 
-- URB_FUNCTION_BULK_OR_INTERRUPT_TRANSFER:
  PipeHandle           = 81b38434 [endpoint 0x00000002]
  TransferFlags        = 00000000 (USBD_TRANSFER_DIRECTION_OUT, ~USBD_SHORT_TRANSFER_OK)
  TransferBufferLength = 00000007
  TransferBuffer       = 00000000
  TransferBufferMDL    = 81c55998
  UrbLink              = 00000000
[720867 ms] UsbSnoop - DispatchAny(f88fe610) : IRP_MJ_INTERNAL_DEVICE_CONTROL
[720867 ms] UsbSnoop - MyDispatchInternalIOCTL(f88ffe80) : fdo=82141030, Irp=81c4d008, IRQL=2
[720867 ms]  >>>  URB 622 going down  >>> 
-- URB_FUNCTION_BULK_OR_INTERRUPT_TRANSFER:
  PipeHandle           = 81b38414 [endpoint 0x00000081]
  TransferFlags        = 00000003 (USBD_TRANSFER_DIRECTION_IN, USBD_SHORT_TRANSFER_OK)
  TransferBufferLength = 00000100
  TransferBuffer       = 00000000
  TransferBufferMDL    = 81c55998
  UrbLink              = 00000000
[720890 ms] UsbSnoop - MyInternalIOCTLCompletion(f88ffdb0) : fido=81b37020, Irp=81c4d008, Context=81c72a40, IRQL=2
[720890 ms]  <<<  URB 622 coming back  <<< 
-- URB_FUNCTION_BULK_OR_INTERRUPT_TRANSFER:
  PipeHandle           = 81b38414 [endpoint 0x00000081]
  TransferFlags        = 00000003 (USBD_TRANSFER_DIRECTION_IN, USBD_SHORT_TRANSFER_OK)
  TransferBufferLength = 000000ff
  TransferBuffer       = 00000000
  TransferBufferMDL    = 81c55998
    00000000: 00 00 00 fa 03 7a 96 13 d4 71 3b eb 0c 01 6c ff
    00000010: ff ff ff ff ff ff ff ff ff ff ff ff ff ff ff ff
    00000020: ff ff ff ff ff ff ff ff ff ff ff ff ff ff ff ff
    00000030: ff ff ff ff ff ff ff ff ff ff ff ff ff ff ff ff
    00000040: ff ff ff ff ff ff ff ff ff ff ff ff ff ff ff ff
    00000050: ff ff ff ff ff ff ff ff ff ff ff ff ff ff ff ff
    00000060: ff ff ff ff ff ff ff ff ff ff ff ff ff ff ff ff
    00000070: ff ff ff ff ff ff ff ff ff ff ff ff ff ff ff ff
    00000080: ff ff ff ff ff ff ff ff ff ff ff ff ff ff ff ff
    00000090: ff ff ff ff ff ff ff ff ff ff ff ff ff ff ff ff
    000000a0: ff ff ff ff ff ff ff ff ff ff ff ff ff ff ff ff
    000000b0: ff ff ff ff ff ff ff ff ff ff ff ff ff ff ff ff
    000000c0: ff ff ff ff ff ff ff ff ff ff ff ff ff ff ff ff
    000000d0: ff ff ff ff ff ff ff ff ff ff ff ff ff ff ff ff
    000000e0: ff ff ff ff ff ff ff ff ff ff ff ff ff ff ff ff
    000000f0: ff ff ff ff ff ff ff ff ff ff ff ff ff ff ff
  UrbLink              = 00000000
[720928 ms] UsbSnoop - DispatchAny(f88fe610) : IRP_MJ_INTERNAL_DEVICE_CONTROL
[720928 ms] UsbSnoop - MyDispatchInternalIOCTL(f88ffe80) : fdo=82141030, Irp=81c4d008, IRQL=2
[720928 ms]  >>>  URB 623 going down  >>> 
-- URB_FUNCTION_BULK_OR_INTERRUPT_TRANSFER:
  PipeHandle           = 81b38434 [endpoint 0x00000002]
  TransferFlags        = 00000000 (USBD_TRANSFER_DIRECTION_OUT, ~USBD_SHORT_TRANSFER_OK)
  TransferBufferLength = 00000007
  TransferBuffer       = 00000000
  TransferBufferMDL    = 81c55998
    00000000: 00 00 00 02 05 e0 00
  UrbLink              = 00000000
[720928 ms] UsbSnoop - MyInternalIOCTLCompletion(f88ffdb0) : fido=81b37020, Irp=81c4d008, Context=822a1498, IRQL=2
[720928 ms]  <<<  URB 623 coming back  <<< 
-- URB_FUNCTION_BULK_OR_INTERRUPT_TRANSFER:
  PipeHandle           = 81b38434 [endpoint 0x00000002]
  TransferFlags        = 00000000 (USBD_TRANSFER_DIRECTION_OUT, ~USBD_SHORT_TRANSFER_OK)
  TransferBufferLength = 00000007
  TransferBuffer       = 00000000
  TransferBufferMDL    = 81c55998
  UrbLink              = 00000000
[720938 ms] UsbSnoop - DispatchAny(f88fe610) : IRP_MJ_INTERNAL_DEVICE_CONTROL
[720938 ms] UsbSnoop - MyDispatchInternalIOCTL(f88ffe80) : fdo=82141030, Irp=81c4d008, IRQL=2
[720938 ms]  >>>  URB 624 going down  >>> 
-- URB_FUNCTION_BULK_OR_INTERRUPT_TRANSFER:
  PipeHandle           = 81b38414 [endpoint 0x00000081]
  TransferFlags        = 00000003 (USBD_TRANSFER_DIRECTION_IN, USBD_SHORT_TRANSFER_OK)
  TransferBufferLength = 00000100
  TransferBuffer       = 00000000
  TransferBufferMDL    = 81c55998
  UrbLink              = 00000000
[720959 ms] UsbSnoop - MyInternalIOCTLCompletion(f88ffdb0) : fido=81b37020, Irp=81c4d008, Context=81ba1c68, IRQL=2
[720959 ms]  <<<  URB 624 coming back  <<< 
-- URB_FUNCTION_BULK_OR_INTERRUPT_TRANSFER:
  PipeHandle           = 81b38414 [endpoint 0x00000081]
  TransferFlags        = 00000003 (USBD_TRANSFER_DIRECTION_IN, USBD_SHORT_TRANSFER_OK)
  TransferBufferLength = 000000ff
  TransferBuffer       = 00000000
  TransferBufferMDL    = 81c55998
    00000000: 00 00 00 fa 03 ff ff ff ff ff ff ff ff ff ff ff
    00000010: ff ff ff ff ff ff ff ff ff ff ff ff ff ff ff ff
    00000020: ff ff ff ff ff ff ff ff ff ff ff ff ff ff ff ff
    00000030: ff ff ff ff ff ff ff ff ff ff ff ff ff ff ff ff
    00000040: ff ff ff ff ff ff ff ff ff ff ff ff ff ff ff ff
    00000050: ff ff ff ff ff ff ff ff ff ff ff ff ff ff ff ff
    00000060: ff ff ff ff ff ff ff ff ff ff ff ff ff ff ff ff
    00000070: ff ff ff ff ff ff ff ff ff ff ff ff ff ff ff ff
    00000080: ff ff ff ff ff ff ff ff ff ff ff ff ff ff ff ff
    00000090: ff ff ff ff ff ff ff ff ff ff ff ff ff ff ff ff
    000000a0: ff ff ff ff ff ff ff ff ff ff ff ff ff ff ff ff
    000000b0: ff ff ff ff ff ff ff ff ff ff ff ff ff ff ff ff
    000000c0: ff ff ff ff ff ff ff ff ff ff ff ff ff ff ff ff
    000000d0: ff ff ff ff ff ff ff ff ff ff ff ff ff ff ff ff
    000000e0: ff ff ff ff ff ff ff ff ff ff ff ff ff ff ff ff
    000000f0: ff ff ff ff ff ff ff ff ff ff ff ff ff ff ff
  UrbLink              = 00000000
[720998 ms] UsbSnoop - DispatchAny(f88fe610) : IRP_MJ_INTERNAL_DEVICE_CONTROL
[720998 ms] UsbSnoop - MyDispatchInternalIOCTL(f88ffe80) : fdo=82141030, Irp=81c4d008, IRQL=2
[720998 ms]  >>>  URB 625 going down  >>> 
-- URB_FUNCTION_BULK_OR_INTERRUPT_TRANSFER:
  PipeHandle           = 81b38434 [endpoint 0x00000002]
  TransferFlags        = 00000000 (USBD_TRANSFER_DIRECTION_OUT, ~USBD_SHORT_TRANSFER_OK)
  TransferBufferLength = 00000007
  TransferBuffer       = 00000000
  TransferBufferMDL    = 81c55998
    00000000: 00 00 00 02 05 e0 00
  UrbLink              = 00000000
[720998 ms] UsbSnoop - MyInternalIOCTLCompletion(f88ffdb0) : fido=81b37020, Irp=81c4d008, Context=81c72a40, IRQL=2
[720998 ms]  <<<  URB 625 coming back  <<< 
-- URB_FUNCTION_BULK_OR_INTERRUPT_TRANSFER:
  PipeHandle           = 81b38434 [endpoint 0x00000002]
  TransferFlags        = 00000000 (USBD_TRANSFER_DIRECTION_OUT, ~USBD_SHORT_TRANSFER_OK)
  TransferBufferLength = 00000007
  TransferBuffer       = 00000000
  TransferBufferMDL    = 81c55998
  UrbLink              = 00000000
[721008 ms] UsbSnoop - DispatchAny(f88fe610) : IRP_MJ_INTERNAL_DEVICE_CONTROL
[721008 ms] UsbSnoop - MyDispatchInternalIOCTL(f88ffe80) : fdo=82141030, Irp=81c4d008, IRQL=2
[721008 ms]  >>>  URB 626 going down  >>> 
-- URB_FUNCTION_BULK_OR_INTERRUPT_TRANSFER:
  PipeHandle           = 81b38414 [endpoint 0x00000081]
  TransferFlags        = 00000003 (USBD_TRANSFER_DIRECTION_IN, USBD_SHORT_TRANSFER_OK)
  TransferBufferLength = 00000100
  TransferBuffer       = 00000000
  TransferBufferMDL    = 81c55998
  UrbLink              = 00000000
[721029 ms] UsbSnoop - MyInternalIOCTLCompletion(f88ffdb0) : fido=81b37020, Irp=81c4d008, Context=822a1498, IRQL=2
[721029 ms]  <<<  URB 626 coming back  <<< 
-- URB_FUNCTION_BULK_OR_INTERRUPT_TRANSFER:
  PipeHandle           = 81b38414 [endpoint 0x00000081]
  TransferFlags        = 00000003 (USBD_TRANSFER_DIRECTION_IN, USBD_SHORT_TRANSFER_OK)
  TransferBufferLength = 000000ff
  TransferBuffer       = 00000000
  TransferBufferMDL    = 81c55998
    00000000: 00 00 00 fa 03 ff ff ff ff ff ff ff ff ff ff ff
    00000010: ff ff ff ff ff ff ff ff ff ff ff ff ff ff ff ff
    00000020: ff ff ff ff ff ff ff ff ff ff ff ff ff ff ff ff
    00000030: ff ff ff ff ff ff ff ff ff ff ff ff ff ff ff ff
    00000040: ff ff ff ff ff ff ff ff ff ff ff ff ff ff ff ff
    00000050: ff ff ff ff ff ff ff ff ff ff ff ff ff ff ff ff
    00000060: ff ff ff ff ff ff ff ff ff ff ff ff ff ff ff ff
    00000070: ff ff ff ff ff ff ff ff ff ff ff ff ff ff ff ff
    00000080: ff ff ff ff ff ff ff ff ff ff ff ff ff ff ff ff
    00000090: ff ff ff ff ff ff ff ff ff ff ff ff ff ff ff ff
    000000a0: ff ff ff ff ff ff ff ff ff ff ff ff ff ff ff ff
    000000b0: ff ff ff ff ff ff ff ff ff ff ff ff ff ff ff ff
    000000c0: ff ff ff ff ff ff ff ff ff ff ff ff ff ff ff ff
    000000d0: ff ff ff ff ff ff ff ff ff ff ff ff ff ff ff ff
    000000e0: ff ff ff ff ff ff ff ff ff ff ff ff ff ff ff ff
    000000f0: ff ff ff ff ff ff ff ff ff ff ff 00 00 00 00
  UrbLink              = 00000000
[721068 ms] UsbSnoop - DispatchAny(f88fe610) : IRP_MJ_INTERNAL_DEVICE_CONTROL
[721068 ms] UsbSnoop - MyDispatchInternalIOCTL(f88ffe80) : fdo=82141030, Irp=81c4d008, IRQL=2
[721068 ms]  >>>  URB 627 going down  >>> 
-- URB_FUNCTION_BULK_OR_INTERRUPT_TRANSFER:
  PipeHandle           = 81b38434 [endpoint 0x00000002]
  TransferFlags        = 00000000 (USBD_TRANSFER_DIRECTION_OUT, ~USBD_SHORT_TRANSFER_OK)
  TransferBufferLength = 00000007
  TransferBuffer       = 00000000
  TransferBufferMDL    = 81c55998
    00000000: 00 00 00 02 05 e0 00
  UrbLink              = 00000000
[721068 ms] UsbSnoop - MyInternalIOCTLCompletion(f88ffdb0) : fido=81b37020, Irp=81c4d008, Context=81ba1c68, IRQL=2
[721068 ms]  <<<  URB 627 coming back  <<< 
-- URB_FUNCTION_BULK_OR_INTERRUPT_TRANSFER:
  PipeHandle           = 81b38434 [endpoint 0x00000002]
  TransferFlags        = 00000000 (USBD_TRANSFER_DIRECTION_OUT, ~USBD_SHORT_TRANSFER_OK)
  TransferBufferLength = 00000007
  TransferBuffer       = 00000000
  TransferBufferMDL    = 81c55998
  UrbLink              = 00000000
[721078 ms] UsbSnoop - DispatchAny(f88fe610) : IRP_MJ_INTERNAL_DEVICE_CONTROL
[721078 ms] UsbSnoop - MyDispatchInternalIOCTL(f88ffe80) : fdo=82141030, Irp=81c4d008, IRQL=2
[721078 ms]  >>>  URB 628 going down  >>> 
-- URB_FUNCTION_BULK_OR_INTERRUPT_TRANSFER:
  PipeHandle           = 81b38414 [endpoint 0x00000081]
  TransferFlags        = 00000003 (USBD_TRANSFER_DIRECTION_IN, USBD_SHORT_TRANSFER_OK)
  TransferBufferLength = 00000100
  TransferBuffer       = 00000000
  TransferBufferMDL    = 81c55998
  UrbLink              = 00000000
[721562 ms] UsbSnoop - MyInternalIOCTLCompletion(f88ffdb0) : fido=81b37020, Irp=81c4d008, Context=822a1498, IRQL=2
[721562 ms]  <<<  URB 628 coming back  <<< 
-- URB_FUNCTION_BULK_OR_INTERRUPT_TRANSFER:
  PipeHandle           = 81b38414 [endpoint 0x00000081]
  TransferFlags        = 00000003 (USBD_TRANSFER_DIRECTION_IN, USBD_SHORT_TRANSFER_OK)
  TransferBufferLength = 00000021
  TransferBuffer       = 00000000
  TransferBufferMDL    = 81c55998
    00000000: 00 00 00 1c 04 00 00 00 00 00 00 00 00 fc ff ff
    00000010: ff ff ff ff ff ff ff ff ff ff ff ff ff ff ff ff
    00000020: ff
  UrbLink              = 00000000
[721599 ms] UsbSnoop - DispatchAny(f88fe610) : IRP_MJ_INTERNAL_DEVICE_CONTROL
[721599 ms] UsbSnoop - MyDispatchInternalIOCTL(f88ffe80) : fdo=82141030, Irp=81c4d008, IRQL=2
[721599 ms]  >>>  URB 629 going down  >>> 
-- URB_FUNCTION_BULK_OR_INTERRUPT_TRANSFER:
  PipeHandle           = 81b38434 [endpoint 0x00000002]
  TransferFlags        = 00000000 (USBD_TRANSFER_DIRECTION_OUT, ~USBD_SHORT_TRANSFER_OK)
  TransferBufferLength = 00000007
  TransferBuffer       = 00000000
  TransferBufferMDL    = 81c55998
    00000000: 00 00 00 02 05 e0 00
  UrbLink              = 00000000
[721599 ms] UsbSnoop - MyInternalIOCTLCompletion(f88ffdb0) : fido=81b37020, Irp=81c4d008, Context=81c35588, IRQL=2
[721599 ms]  <<<  URB 629 coming back  <<< 
-- URB_FUNCTION_BULK_OR_INTERRUPT_TRANSFER:
  PipeHandle           = 81b38434 [endpoint 0x00000002]
  TransferFlags        = 00000000 (USBD_TRANSFER_DIRECTION_OUT, ~USBD_SHORT_TRANSFER_OK)
  TransferBufferLength = 00000007
  TransferBuffer       = 00000000
  TransferBufferMDL    = 81c55998
  UrbLink              = 00000000
[721859 ms] UsbSnoop - DispatchAny(f88fe610) : IRP_MJ_INTERNAL_DEVICE_CONTROL
[721859 ms] UsbSnoop - MyDispatchInternalIOCTL(f88ffe80) : fdo=82141030, Irp=81c4d008, IRQL=2
[721859 ms]  >>>  URB 630 going down  >>> 
-- URB_FUNCTION_BULK_OR_INTERRUPT_TRANSFER:
  PipeHandle           = 81b38434 [endpoint 0x00000002]
  TransferFlags        = 00000000 (USBD_TRANSFER_DIRECTION_OUT, ~USBD_SHORT_TRANSFER_OK)
  TransferBufferLength = 00000009
  TransferBuffer       = 00000000
  TransferBufferMDL    = 81c55998
    00000000: 00 00 00 04 01 00 00 04 00
  UrbLink              = 00000000
[721859 ms] UsbSnoop - MyInternalIOCTLCompletion(f88ffdb0) : fido=81b37020, Irp=81c4d008, Context=81c72a40, IRQL=2
[721859 ms]  <<<  URB 630 coming back  <<< 
-- URB_FUNCTION_BULK_OR_INTERRUPT_TRANSFER:
  PipeHandle           = 81b38434 [endpoint 0x00000002]
  TransferFlags        = 00000000 (USBD_TRANSFER_DIRECTION_OUT, ~USBD_SHORT_TRANSFER_OK)
  TransferBufferLength = 00000009
  TransferBuffer       = 00000000
  TransferBufferMDL    = 81c55998
  UrbLink              = 00000000
[721860 ms] UsbSnoop - DispatchAny(f88fe610) : IRP_MJ_INTERNAL_DEVICE_CONTROL
[721860 ms] UsbSnoop - MyDispatchInternalIOCTL(f88ffe80) : fdo=82141030, Irp=81c4d008, IRQL=2
[721860 ms]  >>>  URB 631 going down  >>> 
-- URB_FUNCTION_BULK_OR_INTERRUPT_TRANSFER:
  PipeHandle           = 81b38414 [endpoint 0x00000081]
  TransferFlags        = 00000003 (USBD_TRANSFER_DIRECTION_IN, USBD_SHORT_TRANSFER_OK)
  TransferBufferLength = 00000100
  TransferBuffer       = 00000000
  TransferBufferMDL    = 81c55998
  UrbLink              = 00000000
[721868 ms] UsbSnoop - MyInternalIOCTLCompletion(f88ffdb0) : fido=81b37020, Irp=81c4d008, Context=81b5c250, IRQL=2
[721868 ms]  <<<  URB 631 coming back  <<< 
-- URB_FUNCTION_BULK_OR_INTERRUPT_TRANSFER:
  PipeHandle           = 81b38414 [endpoint 0x00000081]
  TransferFlags        = 00000003 (USBD_TRANSFER_DIRECTION_IN, USBD_SHORT_TRANSFER_OK)
  TransferBufferLength = 00000009
  TransferBuffer       = 00000000
  TransferBufferMDL    = 81c55998
    00000000: 00 00 00 04 02 00 00 00 fa
  UrbLink              = 00000000
[721890 ms] UsbSnoop - DispatchAny(f88fe610) : IRP_MJ_INTERNAL_DEVICE_CONTROL
[721890 ms] UsbSnoop - MyDispatchInternalIOCTL(f88ffe80) : fdo=82141030, Irp=81c4d008, IRQL=2
[721890 ms]  >>>  URB 632 going down  >>> 
-- URB_FUNCTION_BULK_OR_INTERRUPT_TRANSFER:
  PipeHandle           = 81b38434 [endpoint 0x00000002]
  TransferFlags        = 00000000 (USBD_TRANSFER_DIRECTION_OUT, ~USBD_SHORT_TRANSFER_OK)
  TransferBufferLength = 00000015
  TransferBuffer       = 00000000
  TransferBufferMDL    = 81c55998
    00000000: 00 00 00 10 04 00 00 00 0a 00 01 00 03 00 01 00
    00000010: 00 00 00 07 d0
  UrbLink              = 00000000
[721890 ms] UsbSnoop - MyInternalIOCTLCompletion(f88ffdb0) : fido=81b37020, Irp=81c4d008, Context=81b9b240, IRQL=2
[721890 ms]  <<<  URB 632 coming back  <<< 
-- URB_FUNCTION_BULK_OR_INTERRUPT_TRANSFER:
  PipeHandle           = 81b38434 [endpoint 0x00000002]
  TransferFlags        = 00000000 (USBD_TRANSFER_DIRECTION_OUT, ~USBD_SHORT_TRANSFER_OK)
  TransferBufferLength = 00000015
  TransferBuffer       = 00000000
  TransferBufferMDL    = 81c55998
  UrbLink              = 00000000
[721899 ms] UsbSnoop - DispatchAny(f88fe610) : IRP_MJ_INTERNAL_DEVICE_CONTROL
[721899 ms] UsbSnoop - MyDispatchInternalIOCTL(f88ffe80) : fdo=82141030, Irp=81c4d008, IRQL=2
[721899 ms]  >>>  URB 633 going down  >>> 
-- URB_FUNCTION_BULK_OR_INTERRUPT_TRANSFER:
  PipeHandle           = 81b38414 [endpoint 0x00000081]
  TransferFlags        = 00000003 (USBD_TRANSFER_DIRECTION_IN, USBD_SHORT_TRANSFER_OK)
  TransferBufferLength = 00000100
  TransferBuffer       = 00000000
  TransferBufferMDL    = 81c55998
  UrbLink              = 00000000
[721899 ms] UsbSnoop - MyInternalIOCTLCompletion(f88ffdb0) : fido=81b37020, Irp=81c4d008, Context=81b5c250, IRQL=2
[721899 ms]  <<<  URB 633 coming back  <<< 
-- URB_FUNCTION_BULK_OR_INTERRUPT_TRANSFER:
  PipeHandle           = 81b38414 [endpoint 0x00000081]
  TransferFlags        = 00000003 (USBD_TRANSFER_DIRECTION_IN, USBD_SHORT_TRANSFER_OK)
  TransferBufferLength = 00000007
  TransferBuffer       = 00000000
  TransferBufferMDL    = 81c55998
    00000000: 00 00 00 02 05 e0 00
  UrbLink              = 00000000
[721939 ms] UsbSnoop - DispatchAny(f88fe610) : IRP_MJ_INTERNAL_DEVICE_CONTROL
[721939 ms] UsbSnoop - MyDispatchInternalIOCTL(f88ffe80) : fdo=82141030, Irp=81c4d008, IRQL=2
[721939 ms]  >>>  URB 634 going down  >>> 
-- URB_FUNCTION_BULK_OR_INTERRUPT_TRANSFER:
  PipeHandle           = 81b38414 [endpoint 0x00000081]
  TransferFlags        = 00000003 (USBD_TRANSFER_DIRECTION_IN, USBD_SHORT_TRANSFER_OK)
  TransferBufferLength = 00000100
  TransferBuffer       = 00000000
  TransferBufferMDL    = 81c55998
  UrbLink              = 00000000
[721939 ms] UsbSnoop - MyInternalIOCTLCompletion(f88ffdb0) : fido=81b37020, Irp=81c4d008, Context=81b96ed8, IRQL=2
[721939 ms]  <<<  URB 634 coming back  <<< 
-- URB_FUNCTION_BULK_OR_INTERRUPT_TRANSFER:
  PipeHandle           = 81b38414 [endpoint 0x00000081]
  TransferFlags        = 00000003 (USBD_TRANSFER_DIRECTION_IN, USBD_SHORT_TRANSFER_OK)
  TransferBufferLength = 0000000f
  TransferBuffer       = 00000000
  TransferBufferMDL    = 81c55998
    00000000: 00 00 00 0a 04 00 00 00 04 00 12 00 00 07 d0
  UrbLink              = 00000000
[721979 ms] UsbSnoop - DispatchAny(f88fe610) : IRP_MJ_INTERNAL_DEVICE_CONTROL
[721979 ms] UsbSnoop - MyDispatchInternalIOCTL(f88ffe80) : fdo=82141030, Irp=81c4d008, IRQL=2
[721979 ms]  >>>  URB 635 going down  >>> 
-- URB_FUNCTION_BULK_OR_INTERRUPT_TRANSFER:
  PipeHandle           = 81b38434 [endpoint 0x00000002]
  TransferFlags        = 00000000 (USBD_TRANSFER_DIRECTION_OUT, ~USBD_SHORT_TRANSFER_OK)
  TransferBufferLength = 00000007
  TransferBuffer       = 00000000
  TransferBufferMDL    = 81c55998
    00000000: 00 00 00 02 05 e0 00
  UrbLink              = 00000000
[721980 ms] UsbSnoop - MyInternalIOCTLCompletion(f88ffdb0) : fido=81b37020, Irp=81c4d008, Context=81c72a40, IRQL=2
[721980 ms]  <<<  URB 635 coming back  <<< 
-- URB_FUNCTION_BULK_OR_INTERRUPT_TRANSFER:
  PipeHandle           = 81b38434 [endpoint 0x00000002]
  TransferFlags        = 00000000 (USBD_TRANSFER_DIRECTION_OUT, ~USBD_SHORT_TRANSFER_OK)
  TransferBufferLength = 00000007
  TransferBuffer       = 00000000
  TransferBufferMDL    = 81c55998
  UrbLink              = 00000000
[721989 ms] UsbSnoop - DispatchAny(f88fe610) : IRP_MJ_INTERNAL_DEVICE_CONTROL
[721989 ms] UsbSnoop - MyDispatchInternalIOCTL(f88ffe80) : fdo=82141030, Irp=81c4d008, IRQL=2
[721989 ms]  >>>  URB 636 going down  >>> 
-- URB_FUNCTION_BULK_OR_INTERRUPT_TRANSFER:
  PipeHandle           = 81b38434 [endpoint 0x00000002]
  TransferFlags        = 00000000 (USBD_TRANSFER_DIRECTION_OUT, ~USBD_SHORT_TRANSFER_OK)
  TransferBufferLength = 00000026
  TransferBuffer       = 00000000
  TransferBufferMDL    = 81c55998
    00000000: 00 00 00 21 04 00 00 00 1b 00 0c 00 01 41 00 01
    00000010: ff ff ff ff 00 02 00 03 00 08 00 01 00 11 00 04
    00000020: f0 07 00 00 00 00
  UrbLink              = 00000000
[721989 ms] UsbSnoop - MyInternalIOCTLCompletion(f88ffdb0) : fido=81b37020, Irp=81c4d008, Context=81b5c250, IRQL=2
[721989 ms]  <<<  URB 636 coming back  <<< 
-- URB_FUNCTION_BULK_OR_INTERRUPT_TRANSFER:
  PipeHandle           = 81b38434 [endpoint 0x00000002]
  TransferFlags        = 00000000 (USBD_TRANSFER_DIRECTION_OUT, ~USBD_SHORT_TRANSFER_OK)
  TransferBufferLength = 00000026
  TransferBuffer       = 00000000
  TransferBufferMDL    = 81c55998
  UrbLink              = 00000000
[721999 ms] UsbSnoop - DispatchAny(f88fe610) : IRP_MJ_INTERNAL_DEVICE_CONTROL
[721999 ms] UsbSnoop - MyDispatchInternalIOCTL(f88ffe80) : fdo=82141030, Irp=81c4d008, IRQL=2
[721999 ms]  >>>  URB 637 going down  >>> 
-- URB_FUNCTION_BULK_OR_INTERRUPT_TRANSFER:
  PipeHandle           = 81b38414 [endpoint 0x00000081]
  TransferFlags        = 00000003 (USBD_TRANSFER_DIRECTION_IN, USBD_SHORT_TRANSFER_OK)
  TransferBufferLength = 00000100
  TransferBuffer       = 00000000
  TransferBufferMDL    = 81c55998
  UrbLink              = 00000000
[722000 ms] UsbSnoop - MyInternalIOCTLCompletion(f88ffdb0) : fido=81b37020, Irp=81c4d008, Context=81c72a40, IRQL=2
[722000 ms]  <<<  URB 637 coming back  <<< 
-- URB_FUNCTION_BULK_OR_INTERRUPT_TRANSFER:
  PipeHandle           = 81b38414 [endpoint 0x00000081]
  TransferFlags        = 00000003 (USBD_TRANSFER_DIRECTION_IN, USBD_SHORT_TRANSFER_OK)
  TransferBufferLength = 00000007
  TransferBuffer       = 00000000
  TransferBufferMDL    = 81c55998
    00000000: 00 00 00 02 05 e0 00
  UrbLink              = 00000000
[722039 ms] UsbSnoop - DispatchAny(f88fe610) : IRP_MJ_INTERNAL_DEVICE_CONTROL
[722039 ms] UsbSnoop - MyDispatchInternalIOCTL(f88ffe80) : fdo=82141030, Irp=81c4d008, IRQL=2
[722039 ms]  >>>  URB 638 going down  >>> 
-- URB_FUNCTION_BULK_OR_INTERRUPT_TRANSFER:
  PipeHandle           = 81b38414 [endpoint 0x00000081]
  TransferFlags        = 00000003 (USBD_TRANSFER_DIRECTION_IN, USBD_SHORT_TRANSFER_OK)
  TransferBufferLength = 00000100
  TransferBuffer       = 00000000
  TransferBufferMDL    = 81c55998
  UrbLink              = 00000000
[722040 ms] UsbSnoop - MyInternalIOCTLCompletion(f88ffdb0) : fido=81b37020, Irp=81c4d008, Context=81b96ed8, IRQL=2
[722040 ms]  <<<  URB 638 coming back  <<< 
-- URB_FUNCTION_BULK_OR_INTERRUPT_TRANSFER:
  PipeHandle           = 81b38414 [endpoint 0x00000081]
  TransferFlags        = 00000003 (USBD_TRANSFER_DIRECTION_IN, USBD_SHORT_TRANSFER_OK)
  TransferBufferLength = 00000020
  TransferBuffer       = 00000000
  TransferBufferMDL    = 81c55998
    00000000: 00 00 00 1b 04 00 00 00 15 00 0a 00 01 41 00 00
    00000010: 02 00 03 00 00 01 00 00 08 00 00 04 00 00 00 00
  UrbLink              = 00000000
[722079 ms] UsbSnoop - DispatchAny(f88fe610) : IRP_MJ_INTERNAL_DEVICE_CONTROL
[722079 ms] UsbSnoop - MyDispatchInternalIOCTL(f88ffe80) : fdo=82141030, Irp=81c4d008, IRQL=2
[722079 ms]  >>>  URB 639 going down  >>> 
-- URB_FUNCTION_BULK_OR_INTERRUPT_TRANSFER:
  PipeHandle           = 81b38434 [endpoint 0x00000002]
  TransferFlags        = 00000000 (USBD_TRANSFER_DIRECTION_OUT, ~USBD_SHORT_TRANSFER_OK)
  TransferBufferLength = 00000007
  TransferBuffer       = 00000000
  TransferBufferMDL    = 81c55998
    00000000: 00 00 00 02 05 e0 00
  UrbLink              = 00000000
[722080 ms] UsbSnoop - MyInternalIOCTLCompletion(f88ffdb0) : fido=81b37020, Irp=81c4d008, Context=81c72a40, IRQL=2
[722080 ms]  <<<  URB 639 coming back  <<< 
-- URB_FUNCTION_BULK_OR_INTERRUPT_TRANSFER:
  PipeHandle           = 81b38434 [endpoint 0x00000002]
  TransferFlags        = 00000000 (USBD_TRANSFER_DIRECTION_OUT, ~USBD_SHORT_TRANSFER_OK)
  TransferBufferLength = 00000007
  TransferBuffer       = 00000000
  TransferBufferMDL    = 81c55998
  UrbLink              = 00000000
[722089 ms] UsbSnoop - DispatchAny(f88fe610) : IRP_MJ_INTERNAL_DEVICE_CONTROL
[722089 ms] UsbSnoop - MyDispatchInternalIOCTL(f88ffe80) : fdo=82141030, Irp=81c4d008, IRQL=2
[722089 ms]  >>>  URB 640 going down  >>> 
-- URB_FUNCTION_BULK_OR_INTERRUPT_TRANSFER:
  PipeHandle           = 81b38414 [endpoint 0x00000081]
  TransferFlags        = 00000003 (USBD_TRANSFER_DIRECTION_IN, USBD_SHORT_TRANSFER_OK)
  TransferBufferLength = 00000100
  TransferBuffer       = 00000000
  TransferBufferMDL    = 81c55998
  UrbLink              = 00000000
[722090 ms] UsbSnoop - MyInternalIOCTLCompletion(f88ffdb0) : fido=81b37020, Irp=81c4d008, Context=81b9b240, IRQL=2
[722090 ms]  <<<  URB 640 coming back  <<< 
-- URB_FUNCTION_BULK_OR_INTERRUPT_TRANSFER:
  PipeHandle           = 81b38414 [endpoint 0x00000081]
  TransferFlags        = 00000003 (USBD_TRANSFER_DIRECTION_IN, USBD_SHORT_TRANSFER_OK)
  TransferBufferLength = 00000014
  TransferBuffer       = 00000000
  TransferBufferMDL    = 81c55998
    00000000: 00 00 00 0f 04 00 00 00 09 00 0d 00 80 10 00 00
    00000010: 00 00 00 00
  UrbLink              = 00000000
[722129 ms] UsbSnoop - DispatchAny(f88fe610) : IRP_MJ_INTERNAL_DEVICE_CONTROL
[722129 ms] UsbSnoop - MyDispatchInternalIOCTL(f88ffe80) : fdo=82141030, Irp=81c4d008, IRQL=2
[722129 ms]  >>>  URB 641 going down  >>> 
-- URB_FUNCTION_BULK_OR_INTERRUPT_TRANSFER:
  PipeHandle           = 81b38434 [endpoint 0x00000002]
  TransferFlags        = 00000000 (USBD_TRANSFER_DIRECTION_OUT, ~USBD_SHORT_TRANSFER_OK)
  TransferBufferLength = 00000007
  TransferBuffer       = 00000000
  TransferBufferMDL    = 81c55998
    00000000: 00 00 00 02 05 e0 00
  UrbLink              = 00000000
[722130 ms] UsbSnoop - MyInternalIOCTLCompletion(f88ffdb0) : fido=81b37020, Irp=81c4d008, Context=822ca258, IRQL=2
[722130 ms]  <<<  URB 641 coming back  <<< 
-- URB_FUNCTION_BULK_OR_INTERRUPT_TRANSFER:
  PipeHandle           = 81b38434 [endpoint 0x00000002]
  TransferFlags        = 00000000 (USBD_TRANSFER_DIRECTION_OUT, ~USBD_SHORT_TRANSFER_OK)
  TransferBufferLength = 00000007
  TransferBuffer       = 00000000
  TransferBufferMDL    = 81c55998
  UrbLink              = 00000000
[723143 ms] UsbSnoop - DispatchAny(f88fe610) : IRP_MJ_INTERNAL_DEVICE_CONTROL
[723143 ms] UsbSnoop - MyDispatchInternalIOCTL(f88ffe80) : fdo=82141030, Irp=81c20008, IRQL=0
[723143 ms]  >>>  URB 642 going down  >>> 
-- URB_FUNCTION_RESET_PIPE:
  PipeHandle = 81b38414 [endpoint 0x00000081]
[723143 ms] UsbSnoop - MyInternalIOCTLCompletion(f88ffdb0) : fido=00000000, Irp=81c20008, Context=81b96ed8, IRQL=0
[723143 ms]  <<<  URB 642 coming back  <<< 
-- URB_FUNCTION_RESET_PIPE:
[723147 ms] UsbSnoop - DispatchAny(f88fe610) : IRP_MJ_INTERNAL_DEVICE_CONTROL
[723147 ms] UsbSnoop - MyDispatchInternalIOCTL(f88ffe80) : fdo=82141030, Irp=81c20008, IRQL=0
[723147 ms]  >>>  URB 643 going down  >>> 
-- URB_FUNCTION_RESET_PIPE:
  PipeHandle = 81b38434 [endpoint 0x00000002]
[723153 ms] UsbSnoop - MyInternalIOCTLCompletion(f88ffdb0) : fido=00000000, Irp=81c20008, Context=81b990c8, IRQL=0
[723153 ms]  <<<  URB 643 coming back  <<< 
-- URB_FUNCTION_RESET_PIPE:
[723153 ms] UsbSnoop - DispatchAny(f88fe610) : IRP_MJ_INTERNAL_DEVICE_CONTROL
[723153 ms] UsbSnoop - MyDispatchInternalIOCTL(f88ffe80) : fdo=82141030, Irp=81c20008, IRQL=0
