[790308 ms] UsbSnoop - DispatchAny(f88fe610) : IRP_MJ_INTERNAL_DEVICE_CONTROL
[790308 ms] UsbSnoop - MyDispatchInternalIOCTL(f88ffe80) : fdo=82141030, Irp=81b5dad8, IRQL=0
[790308 ms]  >>>  URB 644 going down  >>> 
-- URB_FUNCTION_RESET_PIPE:
  PipeHandle = 81b38414 [endpoint 0x00000081]
[790316 ms] UsbSnoop - MyInternalIOCTLCompletion(f88ffdb0) : fido=00000000, Irp=81b5dad8, Context=81c36700, IRQL=0
[790316 ms]  <<<  URB 644 coming back  <<< 
-- URB_FUNCTION_RESET_PIPE:
[790316 ms] UsbSnoop - DispatchAny(f88fe610) : IRP_MJ_INTERNAL_DEVICE_CONTROL
[790316 ms] UsbSnoop - MyDispatchInternalIOCTL(f88ffe80) : fdo=82141030, Irp=81b5dad8, IRQL=0
[790316 ms]  >>>  URB 645 going down  >>> 
-- URB_FUNCTION_RESET_PIPE:
  PipeHandle = 81b38434 [endpoint 0x00000002]
[790316 ms] UsbSnoop - MyInternalIOCTLCompletion(f88ffdb0) : fido=00000000, Irp=81b5dad8, Context=81b99358, IRQL=0
[790316 ms]  <<<  URB 645 coming back  <<< 
-- URB_FUNCTION_RESET_PIPE:
[791309 ms] UsbSnoop - DispatchAny(f88fe610) : IRP_MJ_INTERNAL_DEVICE_CONTROL
[791310 ms] UsbSnoop - MyDispatchInternalIOCTL(f88ffe80) : fdo=82141030, Irp=81cfa008, IRQL=0
[791310 ms]  >>>  URB 646 going down  >>> 
-- URB_FUNCTION_RESET_PIPE:
  PipeHandle = 81b38414 [endpoint 0x00000081]
[791318 ms] UsbSnoop - MyInternalIOCTLCompletion(f88ffdb0) : fido=00000000, Irp=81cfa008, Context=81bd0c08, IRQL=0
[791318 ms]  <<<  URB 646 coming back  <<< 
-- URB_FUNCTION_RESET_PIPE:
[791318 ms] UsbSnoop - DispatchAny(f88fe610) : IRP_MJ_INTERNAL_DEVICE_CONTROL
[791318 ms] UsbSnoop - MyDispatchInternalIOCTL(f88ffe80) : fdo=82141030, Irp=81cfa008, IRQL=0
[791318 ms]  >>>  URB 647 going down  >>> 
-- URB_FUNCTION_RESET_PIPE:
  PipeHandle = 81b38434 [endpoint 0x00000002]
[791318 ms] UsbSnoop - MyInternalIOCTLCompletion(f88ffdb0) : fido=00000000, Irp=81cfa008, Context=81b21168, IRQL=0
[791318 ms]  <<<  URB 647 coming back  <<< 
-- URB_FUNCTION_RESET_PIPE:
[791318 ms] UsbSnoop - DispatchAny(f88fe610) : IRP_MJ_INTERNAL_DEVICE_CONTROL
[791318 ms] UsbSnoop - MyDispatchInternalIOCTL(f88ffe80) : fdo=82141030, Irp=81cfa008, IRQL=0
[792311 ms] UsbSnoop - DispatchAny(f88fe610) : IRP_MJ_INTERNAL_DEVICE_CONTROL
[792311 ms] UsbSnoop - MyDispatchInternalIOCTL(f88ffe80) : fdo=82141030, Irp=81cfa008, IRQL=0
[792311 ms]  >>>  URB 648 going down  >>> 
-- URB_FUNCTION_GET_DESCRIPTOR_FROM_DEVICE:
  TransferBufferLength = 00000012
  TransferBuffer       = e27dd078
  TransferBufferMDL    = 00000000
  Index                = 00000000
  DescriptorType       = 00000001 (USB_DEVICE_DESCRIPTOR_TYPE)
  LanguageId           = 00000000
[792312 ms] UsbSnoop - MyInternalIOCTLCompletion(f88ffdb0) : fido=00000000, Irp=81cfa008, Context=81c35588, IRQL=2
[792312 ms]  <<<  URB 648 coming back  <<< 
-- URB_FUNCTION_CONTROL_TRANSFER:
  PipeHandle           = 82184a90
  TransferFlags        = 0000000b (USBD_TRANSFER_DIRECTION_IN, USBD_SHORT_TRANSFER_OK)
  TransferBufferLength = 00000012
  TransferBuffer       = e27dd078
  TransferBufferMDL    = 822de568
    00000000: 12 01 00 02 00 00 00 40 51 04 08 e0 10 01 01 02
    00000010: 00 01
  UrbLink              = 00000000
  SetupPacket          =
    00000000: 80 06 00 01 00 00 12 00
[792312 ms] UsbSnoop - DispatchAny(f88fe610) : IRP_MJ_INTERNAL_DEVICE_CONTROL
[792312 ms] UsbSnoop - MyDispatchInternalIOCTL(f88ffe80) : fdo=82141030, Irp=81cfa008, IRQL=0
[792312 ms] UsbSnoop - DispatchAny(f88fe610) : IRP_MJ_INTERNAL_DEVICE_CONTROL
[792312 ms] UsbSnoop - MyDispatchInternalIOCTL(f88ffe80) : fdo=82141030, Irp=81cfa008, IRQL=0
[792312 ms]  >>>  URB 649 going down  >>> 
-- URB_FUNCTION_RESET_PIPE:
  PipeHandle = 81b38414 [endpoint 0x00000081]
[792320 ms] UsbSnoop - MyInternalIOCTLCompletion(f88ffdb0) : fido=00000000, Irp=81cfa008, Context=81c72a40, IRQL=0
[792320 ms]  <<<  URB 649 coming back  <<< 
-- URB_FUNCTION_RESET_PIPE:
[792320 ms] UsbSnoop - DispatchAny(f88fe610) : IRP_MJ_INTERNAL_DEVICE_CONTROL
[792320 ms] UsbSnoop - MyDispatchInternalIOCTL(f88ffe80) : fdo=82141030, Irp=81cfa008, IRQL=0
[792320 ms]  >>>  URB 650 going down  >>> 
-- URB_FUNCTION_RESET_PIPE:
  PipeHandle = 81b38434 [endpoint 0x00000002]
[792320 ms] UsbSnoop - MyInternalIOCTLCompletion(f88ffdb0) : fido=00000000, Irp=81cfa008, Context=81b21168, IRQL=0
[792320 ms]  <<<  URB 650 coming back  <<< 
-- URB_FUNCTION_RESET_PIPE:
[793603 ms] UsbSnoop - DispatchAny(f88fe610) : IRP_MJ_INTERNAL_DEVICE_CONTROL
[793603 ms] UsbSnoop - MyDispatchInternalIOCTL(f88ffe80) : fdo=82141030, Irp=81c8e008, IRQL=2
[793603 ms]  >>>  URB 651 going down  >>> 
-- URB_FUNCTION_BULK_OR_INTERRUPT_TRANSFER:
  PipeHandle           = 81b38434 [endpoint 0x00000002]
  TransferFlags        = 00000000 (USBD_TRANSFER_DIRECTION_OUT, ~USBD_SHORT_TRANSFER_OK)
  TransferBufferLength = 00000009
  TransferBuffer       = 00000000
  TransferBufferMDL    = 822de568
    00000000: 00 00 00 04 01 00 00 04 00
  UrbLink              = 00000000
[793603 ms] UsbSnoop - MyInternalIOCTLCompletion(f88ffdb0) : fido=81b37020, Irp=81c8e008, Context=81b86b58, IRQL=2
[793603 ms]  <<<  URB 651 coming back  <<< 
-- URB_FUNCTION_BULK_OR_INTERRUPT_TRANSFER:
  PipeHandle           = 81b38434 [endpoint 0x00000002]
  TransferFlags        = 00000000 (USBD_TRANSFER_DIRECTION_OUT, ~USBD_SHORT_TRANSFER_OK)
  TransferBufferLength = 00000009
  TransferBuffer       = 00000000
  TransferBufferMDL    = 822de568
  UrbLink              = 00000000
[793605 ms] UsbSnoop - DispatchAny(f88fe610) : IRP_MJ_INTERNAL_DEVICE_CONTROL
[793605 ms] UsbSnoop - MyDispatchInternalIOCTL(f88ffe80) : fdo=82141030, Irp=81c8e008, IRQL=2
[793605 ms]  >>>  URB 652 going down  >>> 
-- URB_FUNCTION_BULK_OR_INTERRUPT_TRANSFER:
  PipeHandle           = 81b38414 [endpoint 0x00000081]
  TransferFlags        = 00000003 (USBD_TRANSFER_DIRECTION_IN, USBD_SHORT_TRANSFER_OK)
  TransferBufferLength = 00000100
  TransferBuffer       = 00000000
  TransferBufferMDL    = 822de568
  UrbLink              = 00000000
[793615 ms] UsbSnoop - MyInternalIOCTLCompletion(f88ffdb0) : fido=81b37020, Irp=81c8e008, Context=822a1498, IRQL=2
[793615 ms]  <<<  URB 652 coming back  <<< 
-- URB_FUNCTION_BULK_OR_INTERRUPT_TRANSFER:
  PipeHandle           = 81b38414 [endpoint 0x00000081]
  TransferFlags        = 00000003 (USBD_TRANSFER_DIRECTION_IN, USBD_SHORT_TRANSFER_OK)
  TransferBufferLength = 00000009
  TransferBuffer       = 00000000
  TransferBufferMDL    = 822de568
    00000000: 00 00 00 04 02 00 00 00 fa
  UrbLink              = 00000000
[793643 ms] UsbSnoop - DispatchAny(f88fe610) : IRP_MJ_INTERNAL_DEVICE_CONTROL
[793643 ms] UsbSnoop - MyDispatchInternalIOCTL(f88ffe80) : fdo=82141030, Irp=81c8e008, IRQL=2
[793643 ms]  >>>  URB 653 going down  >>> 
-- URB_FUNCTION_BULK_OR_INTERRUPT_TRANSFER:
  PipeHandle           = 81b38434 [endpoint 0x00000002]
  TransferFlags        = 00000000 (USBD_TRANSFER_DIRECTION_OUT, ~USBD_SHORT_TRANSFER_OK)
  TransferBufferLength = 00000015
  TransferBuffer       = 00000000
  TransferBufferMDL    = 822de568
    00000000: 00 00 00 10 04 00 00 00 0a 00 01 00 03 00 01 00
    00000010: 00 00 00 07 d0
  UrbLink              = 00000000
[793643 ms] UsbSnoop - MyInternalIOCTLCompletion(f88ffdb0) : fido=81b37020, Irp=81c8e008, Context=81b33e28, IRQL=2
[793643 ms]  <<<  URB 653 coming back  <<< 
-- URB_FUNCTION_BULK_OR_INTERRUPT_TRANSFER:
  PipeHandle           = 81b38434 [endpoint 0x00000002]
  TransferFlags        = 00000000 (USBD_TRANSFER_DIRECTION_OUT, ~USBD_SHORT_TRANSFER_OK)
  TransferBufferLength = 00000015
  TransferBuffer       = 00000000
  TransferBufferMDL    = 822de568
  UrbLink              = 00000000
[793653 ms] UsbSnoop - DispatchAny(f88fe610) : IRP_MJ_INTERNAL_DEVICE_CONTROL
[793653 ms] UsbSnoop - MyDispatchInternalIOCTL(f88ffe80) : fdo=82141030, Irp=81c8e008, IRQL=2
[793653 ms]  >>>  URB 654 going down  >>> 
-- URB_FUNCTION_BULK_OR_INTERRUPT_TRANSFER:
  PipeHandle           = 81b38414 [endpoint 0x00000081]
  TransferFlags        = 00000003 (USBD_TRANSFER_DIRECTION_IN, USBD_SHORT_TRANSFER_OK)
  TransferBufferLength = 00000100
  TransferBuffer       = 00000000
  TransferBufferMDL    = 822de568
  UrbLink              = 00000000
[793653 ms] UsbSnoop - MyInternalIOCTLCompletion(f88ffdb0) : fido=81b37020, Irp=81c8e008, Context=822a1498, IRQL=2
[793653 ms]  <<<  URB 654 coming back  <<< 
-- URB_FUNCTION_BULK_OR_INTERRUPT_TRANSFER:
  PipeHandle           = 81b38414 [endpoint 0x00000081]
  TransferFlags        = 00000003 (USBD_TRANSFER_DIRECTION_IN, USBD_SHORT_TRANSFER_OK)
  TransferBufferLength = 00000007
  TransferBuffer       = 00000000
  TransferBufferMDL    = 822de568
    00000000: 00 00 00 02 05 e0 00
  UrbLink              = 00000000
[793693 ms] UsbSnoop - DispatchAny(f88fe610) : IRP_MJ_INTERNAL_DEVICE_CONTROL
[793693 ms] UsbSnoop - MyDispatchInternalIOCTL(f88ffe80) : fdo=82141030, Irp=81c8e008, IRQL=2
[793693 ms]  >>>  URB 655 going down  >>> 
-- URB_FUNCTION_BULK_OR_INTERRUPT_TRANSFER:
  PipeHandle           = 81b38414 [endpoint 0x00000081]
  TransferFlags        = 00000003 (USBD_TRANSFER_DIRECTION_IN, USBD_SHORT_TRANSFER_OK)
  TransferBufferLength = 00000100
  TransferBuffer       = 00000000
  TransferBufferMDL    = 822de568
  UrbLink              = 00000000
[793693 ms] UsbSnoop - MyInternalIOCTLCompletion(f88ffdb0) : fido=81b37020, Irp=81c8e008, Context=81b6c560, IRQL=2
[793694 ms]  <<<  URB 655 coming back  <<< 
-- URB_FUNCTION_BULK_OR_INTERRUPT_TRANSFER:
  PipeHandle           = 81b38414 [endpoint 0x00000081]
  TransferFlags        = 00000003 (USBD_TRANSFER_DIRECTION_IN, USBD_SHORT_TRANSFER_OK)
  TransferBufferLength = 0000000f
  TransferBuffer       = 00000000
  TransferBufferMDL    = 822de568
    00000000: 00 00 00 0a 04 00 00 00 04 00 12 00 00 07 d0
  UrbLink              = 00000000
[793733 ms] UsbSnoop - DispatchAny(f88fe610) : IRP_MJ_INTERNAL_DEVICE_CONTROL
[793733 ms] UsbSnoop - MyDispatchInternalIOCTL(f88ffe80) : fdo=82141030, Irp=81c8e008, IRQL=2
[793733 ms]  >>>  URB 656 going down  >>> 
-- URB_FUNCTION_BULK_OR_INTERRUPT_TRANSFER:
  PipeHandle           = 81b38434 [endpoint 0x00000002]
  TransferFlags        = 00000000 (USBD_TRANSFER_DIRECTION_OUT, ~USBD_SHORT_TRANSFER_OK)
  TransferBufferLength = 00000007
  TransferBuffer       = 00000000
  TransferBufferMDL    = 822de568
    00000000: 00 00 00 02 05 e0 00
  UrbLink              = 00000000
[793734 ms] UsbSnoop - MyInternalIOCTLCompletion(f88ffdb0) : fido=81b37020, Irp=81c8e008, Context=823094d0, IRQL=2
[793734 ms]  <<<  URB 656 coming back  <<< 
-- URB_FUNCTION_BULK_OR_INTERRUPT_TRANSFER:
  PipeHandle           = 81b38434 [endpoint 0x00000002]
  TransferFlags        = 00000000 (USBD_TRANSFER_DIRECTION_OUT, ~USBD_SHORT_TRANSFER_OK)
  TransferBufferLength = 00000007
  TransferBuffer       = 00000000
  TransferBufferMDL    = 822de568
  UrbLink              = 00000000
[793744 ms] UsbSnoop - DispatchAny(f88fe610) : IRP_MJ_INTERNAL_DEVICE_CONTROL
[793744 ms] UsbSnoop - MyDispatchInternalIOCTL(f88ffe80) : fdo=82141030, Irp=81c8e008, IRQL=2
[793744 ms]  >>>  URB 657 going down  >>> 
-- URB_FUNCTION_BULK_OR_INTERRUPT_TRANSFER:
  PipeHandle           = 81b38434 [endpoint 0x00000002]
  TransferFlags        = 00000000 (USBD_TRANSFER_DIRECTION_OUT, ~USBD_SHORT_TRANSFER_OK)
  TransferBufferLength = 00000029
  TransferBuffer       = 00000000
  TransferBufferMDL    = 822de568
    00000000: 00 00 00 24 04 00 00 00 1e 00 07 00 0e 00 0b 00
    00000010: 04 00 06 00 07 00 01 00 02 00 0a 00 37 00 0d 00
    00000020: 38 00 09 00 0e 00 2d 00 03
  UrbLink              = 00000000
[793744 ms] UsbSnoop - MyInternalIOCTLCompletion(f88ffdb0) : fido=81b37020, Irp=81c8e008, Context=81b86b58, IRQL=2
[793745 ms]  <<<  URB 657 coming back  <<< 
-- URB_FUNCTION_BULK_OR_INTERRUPT_TRANSFER:
  PipeHandle           = 81b38434 [endpoint 0x00000002]
  TransferFlags        = 00000000 (USBD_TRANSFER_DIRECTION_OUT, ~USBD_SHORT_TRANSFER_OK)
  TransferBufferLength = 00000029
  TransferBuffer       = 00000000
  TransferBufferMDL    = 822de568
  UrbLink              = 00000000
[793753 ms] UsbSnoop - DispatchAny(f88fe610) : IRP_MJ_INTERNAL_DEVICE_CONTROL
[793753 ms] UsbSnoop - MyDispatchInternalIOCTL(f88ffe80) : fdo=82141030, Irp=81c8e008, IRQL=2
[793753 ms]  >>>  URB 658 going down  >>> 
-- URB_FUNCTION_BULK_OR_INTERRUPT_TRANSFER:
  PipeHandle           = 81b38414 [endpoint 0x00000081]
  TransferFlags        = 00000003 (USBD_TRANSFER_DIRECTION_IN, USBD_SHORT_TRANSFER_OK)
  TransferBufferLength = 00000100
  TransferBuffer       = 00000000
  TransferBufferMDL    = 822de568
  UrbLink              = 00000000
[793756 ms] UsbSnoop - MyInternalIOCTLCompletion(f88ffdb0) : fido=81b37020, Irp=81c8e008, Context=81b86b58, IRQL=2
[793756 ms]  <<<  URB 658 coming back  <<< 
-- URB_FUNCTION_BULK_OR_INTERRUPT_TRANSFER:
  PipeHandle           = 81b38414 [endpoint 0x00000081]
  TransferFlags        = 00000003 (USBD_TRANSFER_DIRECTION_IN, USBD_SHORT_TRANSFER_OK)
  TransferBufferLength = 00000007
  TransferBuffer       = 00000000
  TransferBufferMDL    = 822de568
    00000000: 00 00 00 02 05 e0 00
  UrbLink              = 00000000
[793793 ms] UsbSnoop - DispatchAny(f88fe610) : IRP_MJ_INTERNAL_DEVICE_CONTROL
[793793 ms] UsbSnoop - MyDispatchInternalIOCTL(f88ffe80) : fdo=82141030, Irp=81c8e008, IRQL=2
[793793 ms]  >>>  URB 659 going down  >>> 
-- URB_FUNCTION_BULK_OR_INTERRUPT_TRANSFER:
  PipeHandle           = 81b38414 [endpoint 0x00000081]
  TransferFlags        = 00000003 (USBD_TRANSFER_DIRECTION_IN, USBD_SHORT_TRANSFER_OK)
  TransferBufferLength = 00000100
  TransferBuffer       = 00000000
  TransferBufferMDL    = 822de568
  UrbLink              = 00000000
[793794 ms] UsbSnoop - MyInternalIOCTLCompletion(f88ffdb0) : fido=81b37020, Irp=81c8e008, Context=81b6c560, IRQL=2
[793794 ms]  <<<  URB 659 coming back  <<< 
-- URB_FUNCTION_BULK_OR_INTERRUPT_TRANSFER:
  PipeHandle           = 81b38414 [endpoint 0x00000081]
  TransferFlags        = 00000003 (USBD_TRANSFER_DIRECTION_IN, USBD_SHORT_TRANSFER_OK)
  TransferBufferLength = 0000000f
  TransferBuffer       = 00000000
  TransferBufferMDL    = 822de568
    00000000: 00 00 00 0a 04 00 00 00 04 bb 00 00 01 d4 c0
  UrbLink              = 00000000
[793833 ms] UsbSnoop - DispatchAny(f88fe610) : IRP_MJ_INTERNAL_DEVICE_CONTROL
[793833 ms] UsbSnoop - MyDispatchInternalIOCTL(f88ffe80) : fdo=82141030, Irp=81c8e008, IRQL=2
[793834 ms]  >>>  URB 660 going down  >>> 
-- URB_FUNCTION_BULK_OR_INTERRUPT_TRANSFER:
  PipeHandle           = 81b38434 [endpoint 0x00000002]
  TransferFlags        = 00000000 (USBD_TRANSFER_DIRECTION_OUT, ~USBD_SHORT_TRANSFER_OK)
  TransferBufferLength = 00000007
  TransferBuffer       = 00000000
  TransferBufferMDL    = 822de568
    00000000: 00 00 00 02 05 e0 00
  UrbLink              = 00000000
[793834 ms] UsbSnoop - MyInternalIOCTLCompletion(f88ffdb0) : fido=81b37020, Irp=81c8e008, Context=822a1498, IRQL=2
[793834 ms]  <<<  URB 660 coming back  <<< 
-- URB_FUNCTION_BULK_OR_INTERRUPT_TRANSFER:
  PipeHandle           = 81b38434 [endpoint 0x00000002]
  TransferFlags        = 00000000 (USBD_TRANSFER_DIRECTION_OUT, ~USBD_SHORT_TRANSFER_OK)
  TransferBufferLength = 00000007
  TransferBuffer       = 00000000
  TransferBufferMDL    = 822de568
  UrbLink              = 00000000
[793843 ms] UsbSnoop - DispatchAny(f88fe610) : IRP_MJ_INTERNAL_DEVICE_CONTROL
[793843 ms] UsbSnoop - MyDispatchInternalIOCTL(f88ffe80) : fdo=82141030, Irp=81c8e008, IRQL=2
[793844 ms]  >>>  URB 661 going down  >>> 
-- URB_FUNCTION_BULK_OR_INTERRUPT_TRANSFER:
  PipeHandle           = 81b38414 [endpoint 0x00000081]
  TransferFlags        = 00000003 (USBD_TRANSFER_DIRECTION_IN, USBD_SHORT_TRANSFER_OK)
  TransferBufferLength = 00000100
  TransferBuffer       = 00000000
  TransferBufferMDL    = 822de568
  UrbLink              = 00000000
[793904 ms] UsbSnoop - MyInternalIOCTLCompletion(f88ffdb0) : fido=81b37020, Irp=81c8e008, Context=81b6c560, IRQL=2
[793904 ms]  <<<  URB 661 coming back  <<< 
-- URB_FUNCTION_BULK_OR_INTERRUPT_TRANSFER:
  PipeHandle           = 81b38414 [endpoint 0x00000081]
  TransferFlags        = 00000003 (USBD_TRANSFER_DIRECTION_IN, USBD_SHORT_TRANSFER_OK)
  TransferBufferLength = 00000095
  TransferBuffer       = 00000000
  TransferBufferMDL    = 822de568
    00000000: 00 00 00 90 04 00 00 00 8a 00 08 00 0e 00 0b 00
    00000010: 00 04 00 02 28 00 00 04 00 00 02 00 03 00 06 00
    00000020: 00 01 09 00 07 00 00 01 01 00 01 00 00 04 00 00
    00000030: 00 0a 00 02 00 00 19 54 49 2d 38 34 20 50 6c 75
    00000040: 73 20 53 69 6c 76 65 72 20 45 64 69 74 69 6f 6e
    00000050: 00 0a 00 00 01 01 00 37 00 00 01 01 00 0d 00 00
    00000060: 08 00 00 00 00 00 00 5e fd 00 38 00 00 01 00 00
    00000070: 09 00 00 04 00 01 00 00 00 0e 00 00 08 00 00 00
    00000080: 00 00 00 5e a7 00 2d 00 00 01 01 00 03 00 00 05
    00000090: 0a 32 cc e3 01
  UrbLink              = 00000000
[793956 ms] UsbSnoop - DispatchAny(f88fe610) : IRP_MJ_INTERNAL_DEVICE_CONTROL
[793956 ms] UsbSnoop - MyDispatchInternalIOCTL(f88ffe80) : fdo=82141030, Irp=81c8e008, IRQL=2
[793956 ms]  >>>  URB 662 going down  >>> 
-- URB_FUNCTION_BULK_OR_INTERRUPT_TRANSFER:
  PipeHandle           = 81b38434 [endpoint 0x00000002]
  TransferFlags        = 00000000 (USBD_TRANSFER_DIRECTION_OUT, ~USBD_SHORT_TRANSFER_OK)
  TransferBufferLength = 00000007
  TransferBuffer       = 00000000
  TransferBufferMDL    = 822de568
    00000000: 00 00 00 02 05 e0 00
  UrbLink              = 00000000
[793956 ms] UsbSnoop - MyInternalIOCTLCompletion(f88ffdb0) : fido=81b37020, Irp=81c8e008, Context=823094d0, IRQL=2
[793956 ms]  <<<  URB 662 coming back  <<< 
-- URB_FUNCTION_BULK_OR_INTERRUPT_TRANSFER:
  PipeHandle           = 81b38434 [endpoint 0x00000002]
  TransferFlags        = 00000000 (USBD_TRANSFER_DIRECTION_OUT, ~USBD_SHORT_TRANSFER_OK)
  TransferBufferLength = 00000007
  TransferBuffer       = 00000000
  TransferBufferMDL    = 822de568
  UrbLink              = 00000000
[794215 ms] UsbSnoop - DispatchAny(f88fe610) : IRP_MJ_INTERNAL_DEVICE_CONTROL
[794215 ms] UsbSnoop - MyDispatchInternalIOCTL(f88ffe80) : fdo=82141030, Irp=81b59008, IRQL=2
[794215 ms]  >>>  URB 663 going down  >>> 
-- URB_FUNCTION_BULK_OR_INTERRUPT_TRANSFER:
  PipeHandle           = 81b38434 [endpoint 0x00000002]
  TransferFlags        = 00000000 (USBD_TRANSFER_DIRECTION_OUT, ~USBD_SHORT_TRANSFER_OK)
  TransferBufferLength = 00000009
  TransferBuffer       = 00000000
  TransferBufferMDL    = 81b9ade0
    00000000: 00 00 00 04 01 00 00 04 00
  UrbLink              = 00000000
[794215 ms] UsbSnoop - MyInternalIOCTLCompletion(f88ffdb0) : fido=81b37020, Irp=81b59008, Context=81bd0c08, IRQL=2
[794215 ms]  <<<  URB 663 coming back  <<< 
-- URB_FUNCTION_BULK_OR_INTERRUPT_TRANSFER:
  PipeHandle           = 81b38434 [endpoint 0x00000002]
  TransferFlags        = 00000000 (USBD_TRANSFER_DIRECTION_OUT, ~USBD_SHORT_TRANSFER_OK)
  TransferBufferLength = 00000009
  TransferBuffer       = 00000000
  TransferBufferMDL    = 81b9ade0
  UrbLink              = 00000000
[794215 ms] UsbSnoop - DispatchAny(f88fe610) : IRP_MJ_INTERNAL_DEVICE_CONTROL
[794215 ms] UsbSnoop - MyDispatchInternalIOCTL(f88ffe80) : fdo=82141030, Irp=81b59008, IRQL=2
[794215 ms]  >>>  URB 664 going down  >>> 
-- URB_FUNCTION_BULK_OR_INTERRUPT_TRANSFER:
  PipeHandle           = 81b38414 [endpoint 0x00000081]
  TransferFlags        = 00000003 (USBD_TRANSFER_DIRECTION_IN, USBD_SHORT_TRANSFER_OK)
  TransferBufferLength = 00000100
  TransferBuffer       = 00000000
  TransferBufferMDL    = 81b9ade0
  UrbLink              = 00000000
[794227 ms] UsbSnoop - MyInternalIOCTLCompletion(f88ffdb0) : fido=81b37020, Irp=81b59008, Context=823094d0, IRQL=2
[794227 ms]  <<<  URB 664 coming back  <<< 
-- URB_FUNCTION_BULK_OR_INTERRUPT_TRANSFER:
  PipeHandle           = 81b38414 [endpoint 0x00000081]
  TransferFlags        = 00000003 (USBD_TRANSFER_DIRECTION_IN, USBD_SHORT_TRANSFER_OK)
  TransferBufferLength = 00000009
  TransferBuffer       = 00000000
  TransferBufferMDL    = 81b9ade0
    00000000: 00 00 00 04 02 00 00 00 fa
  UrbLink              = 00000000
[794255 ms] UsbSnoop - DispatchAny(f88fe610) : IRP_MJ_INTERNAL_DEVICE_CONTROL
[794255 ms] UsbSnoop - MyDispatchInternalIOCTL(f88ffe80) : fdo=82141030, Irp=81b59008, IRQL=2
[794255 ms]  >>>  URB 665 going down  >>> 
-- URB_FUNCTION_BULK_OR_INTERRUPT_TRANSFER:
  PipeHandle           = 81b38434 [endpoint 0x00000002]
  TransferFlags        = 00000000 (USBD_TRANSFER_DIRECTION_OUT, ~USBD_SHORT_TRANSFER_OK)
  TransferBufferLength = 00000015
  TransferBuffer       = 00000000
  TransferBufferMDL    = 81b9ade0
    00000000: 00 00 00 10 04 00 00 00 0a 00 01 00 03 00 01 00
    00000010: 00 00 00 07 d0
  UrbLink              = 00000000
[794255 ms] UsbSnoop - MyInternalIOCTLCompletion(f88ffdb0) : fido=81b37020, Irp=81b59008, Context=81b86b58, IRQL=2
[794255 ms]  <<<  URB 665 coming back  <<< 
-- URB_FUNCTION_BULK_OR_INTERRUPT_TRANSFER:
  PipeHandle           = 81b38434 [endpoint 0x00000002]
  TransferFlags        = 00000000 (USBD_TRANSFER_DIRECTION_OUT, ~USBD_SHORT_TRANSFER_OK)
  TransferBufferLength = 00000015
  TransferBuffer       = 00000000
  TransferBufferMDL    = 81b9ade0
  UrbLink              = 00000000
[794264 ms] UsbSnoop - DispatchAny(f88fe610) : IRP_MJ_INTERNAL_DEVICE_CONTROL
[794264 ms] UsbSnoop - MyDispatchInternalIOCTL(f88ffe80) : fdo=82141030, Irp=81b59008, IRQL=2
[794264 ms]  >>>  URB 666 going down  >>> 
-- URB_FUNCTION_BULK_OR_INTERRUPT_TRANSFER:
  PipeHandle           = 81b38414 [endpoint 0x00000081]
  TransferFlags        = 00000003 (USBD_TRANSFER_DIRECTION_IN, USBD_SHORT_TRANSFER_OK)
  TransferBufferLength = 00000100
  TransferBuffer       = 00000000
  TransferBufferMDL    = 81b9ade0
  UrbLink              = 00000000
[794264 ms] UsbSnoop - MyInternalIOCTLCompletion(f88ffdb0) : fido=81b37020, Irp=81b59008, Context=81b6c560, IRQL=2
[794264 ms]  <<<  URB 666 coming back  <<< 
-- URB_FUNCTION_BULK_OR_INTERRUPT_TRANSFER:
  PipeHandle           = 81b38414 [endpoint 0x00000081]
  TransferFlags        = 00000003 (USBD_TRANSFER_DIRECTION_IN, USBD_SHORT_TRANSFER_OK)
  TransferBufferLength = 00000007
  TransferBuffer       = 00000000
  TransferBufferMDL    = 81b9ade0
    00000000: 00 00 00 02 05 e0 00
  UrbLink              = 00000000
[794304 ms] UsbSnoop - DispatchAny(f88fe610) : IRP_MJ_INTERNAL_DEVICE_CONTROL
[794304 ms] UsbSnoop - MyDispatchInternalIOCTL(f88ffe80) : fdo=82141030, Irp=81b59008, IRQL=2
[794304 ms]  >>>  URB 667 going down  >>> 
-- URB_FUNCTION_BULK_OR_INTERRUPT_TRANSFER:
  PipeHandle           = 81b38414 [endpoint 0x00000081]
  TransferFlags        = 00000003 (USBD_TRANSFER_DIRECTION_IN, USBD_SHORT_TRANSFER_OK)
  TransferBufferLength = 00000100
  TransferBuffer       = 00000000
  TransferBufferMDL    = 81b9ade0
  UrbLink              = 00000000
[794304 ms] UsbSnoop - MyInternalIOCTLCompletion(f88ffdb0) : fido=81b37020, Irp=81b59008, Context=81b86b58, IRQL=2
[794304 ms]  <<<  URB 667 coming back  <<< 
-- URB_FUNCTION_BULK_OR_INTERRUPT_TRANSFER:
  PipeHandle           = 81b38414 [endpoint 0x00000081]
  TransferFlags        = 00000003 (USBD_TRANSFER_DIRECTION_IN, USBD_SHORT_TRANSFER_OK)
  TransferBufferLength = 0000000f
  TransferBuffer       = 00000000
  TransferBufferMDL    = 81b9ade0
    00000000: 00 00 00 0a 04 00 00 00 04 00 12 00 00 07 d0
  UrbLink              = 00000000
[794345 ms] UsbSnoop - DispatchAny(f88fe610) : IRP_MJ_INTERNAL_DEVICE_CONTROL
[794345 ms] UsbSnoop - MyDispatchInternalIOCTL(f88ffe80) : fdo=82141030, Irp=81b59008, IRQL=2
[794345 ms]  >>>  URB 668 going down  >>> 
-- URB_FUNCTION_BULK_OR_INTERRUPT_TRANSFER:
  PipeHandle           = 81b38434 [endpoint 0x00000002]
  TransferFlags        = 00000000 (USBD_TRANSFER_DIRECTION_OUT, ~USBD_SHORT_TRANSFER_OK)
  TransferBufferLength = 00000007
  TransferBuffer       = 00000000
  TransferBufferMDL    = 81b9ade0
    00000000: 00 00 00 02 05 e0 00
  UrbLink              = 00000000
[794346 ms] UsbSnoop - MyInternalIOCTLCompletion(f88ffdb0) : fido=81b37020, Irp=81b59008, Context=81bd0c08, IRQL=2
[794346 ms]  <<<  URB 668 coming back  <<< 
-- URB_FUNCTION_BULK_OR_INTERRUPT_TRANSFER:
  PipeHandle           = 81b38434 [endpoint 0x00000002]
  TransferFlags        = 00000000 (USBD_TRANSFER_DIRECTION_OUT, ~USBD_SHORT_TRANSFER_OK)
  TransferBufferLength = 00000007
  TransferBuffer       = 00000000
  TransferBufferMDL    = 81b9ade0
  UrbLink              = 00000000
[794355 ms] UsbSnoop - DispatchAny(f88fe610) : IRP_MJ_INTERNAL_DEVICE_CONTROL
[794355 ms] UsbSnoop - MyDispatchInternalIOCTL(f88ffe80) : fdo=82141030, Irp=81b59008, IRQL=2
[794355 ms]  >>>  URB 669 going down  >>> 
-- URB_FUNCTION_BULK_OR_INTERRUPT_TRANSFER:
  PipeHandle           = 81b38434 [endpoint 0x00000002]
  TransferFlags        = 00000000 (USBD_TRANSFER_DIRECTION_OUT, ~USBD_SHORT_TRANSFER_OK)
  TransferBufferLength = 0000000f
  TransferBuffer       = 00000000
  TransferBufferMDL    = 81b9ade0
    00000000: 00 00 00 0a 04 00 00 00 04 00 07 00 01 00 31
  UrbLink              = 00000000
[794355 ms] UsbSnoop - MyInternalIOCTLCompletion(f88ffdb0) : fido=81b37020, Irp=81b59008, Context=823094d0, IRQL=2
[794355 ms]  <<<  URB 669 coming back  <<< 
-- URB_FUNCTION_BULK_OR_INTERRUPT_TRANSFER:
  PipeHandle           = 81b38434 [endpoint 0x00000002]
  TransferFlags        = 00000000 (USBD_TRANSFER_DIRECTION_OUT, ~USBD_SHORT_TRANSFER_OK)
  TransferBufferLength = 0000000f
  TransferBuffer       = 00000000
  TransferBufferMDL    = 81b9ade0
  UrbLink              = 00000000
[794364 ms] UsbSnoop - DispatchAny(f88fe610) : IRP_MJ_INTERNAL_DEVICE_CONTROL
[794364 ms] UsbSnoop - MyDispatchInternalIOCTL(f88ffe80) : fdo=82141030, Irp=81b59008, IRQL=2
[794364 ms]  >>>  URB 670 going down  >>> 
-- URB_FUNCTION_BULK_OR_INTERRUPT_TRANSFER:
  PipeHandle           = 81b38414 [endpoint 0x00000081]
  TransferFlags        = 00000003 (USBD_TRANSFER_DIRECTION_IN, USBD_SHORT_TRANSFER_OK)
  TransferBufferLength = 00000100
  TransferBuffer       = 00000000
  TransferBufferMDL    = 81b9ade0
  UrbLink              = 00000000
[794366 ms] UsbSnoop - MyInternalIOCTLCompletion(f88ffdb0) : fido=81b37020, Irp=81b59008, Context=81b33e28, IRQL=2
[794366 ms]  <<<  URB 670 coming back  <<< 
-- URB_FUNCTION_BULK_OR_INTERRUPT_TRANSFER:
  PipeHandle           = 81b38414 [endpoint 0x00000081]
  TransferFlags        = 00000003 (USBD_TRANSFER_DIRECTION_IN, USBD_SHORT_TRANSFER_OK)
  TransferBufferLength = 00000007
  TransferBuffer       = 00000000
  TransferBufferMDL    = 81b9ade0
    00000000: 00 00 00 02 05 e0 00
  UrbLink              = 00000000
[794404 ms] UsbSnoop - DispatchAny(f88fe610) : IRP_MJ_INTERNAL_DEVICE_CONTROL
[794404 ms] UsbSnoop - MyDispatchInternalIOCTL(f88ffe80) : fdo=82141030, Irp=81b59008, IRQL=2
[794404 ms]  >>>  URB 671 going down  >>> 
-- URB_FUNCTION_BULK_OR_INTERRUPT_TRANSFER:
  PipeHandle           = 81b38414 [endpoint 0x00000081]
  TransferFlags        = 00000003 (USBD_TRANSFER_DIRECTION_IN, USBD_SHORT_TRANSFER_OK)
  TransferBufferLength = 00000100
  TransferBuffer       = 00000000
  TransferBufferMDL    = 81b9ade0
  UrbLink              = 00000000
[794405 ms] UsbSnoop - MyInternalIOCTLCompletion(f88ffdb0) : fido=81b37020, Irp=81b59008, Context=81bd0c08, IRQL=2
[794405 ms]  <<<  URB 671 coming back  <<< 
-- URB_FUNCTION_BULK_OR_INTERRUPT_TRANSFER:
  PipeHandle           = 81b38414 [endpoint 0x00000081]
  TransferFlags        = 00000003 (USBD_TRANSFER_DIRECTION_IN, USBD_SHORT_TRANSFER_OK)
  TransferBufferLength = 0000000f
  TransferBuffer       = 00000000
  TransferBufferMDL    = 81b9ade0
    00000000: 00 00 00 0a 04 00 00 00 04 bb 00 00 01 d4 c0
  UrbLink              = 00000000
[794444 ms] UsbSnoop - DispatchAny(f88fe610) : IRP_MJ_INTERNAL_DEVICE_CONTROL
[794444 ms] UsbSnoop - MyDispatchInternalIOCTL(f88ffe80) : fdo=82141030, Irp=81b59008, IRQL=2
[794444 ms]  >>>  URB 672 going down  >>> 
-- URB_FUNCTION_BULK_OR_INTERRUPT_TRANSFER:
  PipeHandle           = 81b38434 [endpoint 0x00000002]
  TransferFlags        = 00000000 (USBD_TRANSFER_DIRECTION_OUT, ~USBD_SHORT_TRANSFER_OK)
  TransferBufferLength = 00000007
  TransferBuffer       = 00000000
  TransferBufferMDL    = 81b9ade0
    00000000: 00 00 00 02 05 e0 00
  UrbLink              = 00000000
[794445 ms] UsbSnoop - MyInternalIOCTLCompletion(f88ffdb0) : fido=81b37020, Irp=81b59008, Context=81b33e28, IRQL=2
[794445 ms]  <<<  URB 672 coming back  <<< 
-- URB_FUNCTION_BULK_OR_INTERRUPT_TRANSFER:
  PipeHandle           = 81b38434 [endpoint 0x00000002]
  TransferFlags        = 00000000 (USBD_TRANSFER_DIRECTION_OUT, ~USBD_SHORT_TRANSFER_OK)
  TransferBufferLength = 00000007
  TransferBuffer       = 00000000
  TransferBufferMDL    = 81b9ade0
  UrbLink              = 00000000
[794455 ms] UsbSnoop - DispatchAny(f88fe610) : IRP_MJ_INTERNAL_DEVICE_CONTROL
[794455 ms] UsbSnoop - MyDispatchInternalIOCTL(f88ffe80) : fdo=82141030, Irp=81b59008, IRQL=2
[794455 ms]  >>>  URB 673 going down  >>> 
-- URB_FUNCTION_BULK_OR_INTERRUPT_TRANSFER:
  PipeHandle           = 81b38414 [endpoint 0x00000081]
  TransferFlags        = 00000003 (USBD_TRANSFER_DIRECTION_IN, USBD_SHORT_TRANSFER_OK)
  TransferBufferLength = 00000100
  TransferBuffer       = 00000000
  TransferBufferMDL    = 81b9ade0
  UrbLink              = 00000000
[802263 ms] UsbSnoop - MyInternalIOCTLCompletion(f88ffdb0) : fido=81b37020, Irp=81b59008, Context=822a1498, IRQL=2
[802263 ms]  <<<  URB 673 coming back  <<< 
-- URB_FUNCTION_BULK_OR_INTERRUPT_TRANSFER:
  PipeHandle           = 81b38414 [endpoint 0x00000081]
  TransferFlags        = 00000003 (USBD_TRANSFER_DIRECTION_IN, USBD_SHORT_TRANSFER_OK)
  TransferBufferLength = 000000ff
  TransferBuffer       = 00000000
  TransferBufferMDL    = 81b9ade0
    00000000: 00 00 00 fa 03 00 00 03 fe 00 08 00 01 00 31 00
    00000010: 03 f7 0a 15 0a 32 cc e3 01 0a 2d 40 00 00 00 00
    00000020: 00 00 00 00 00 00 00 00 00 00 00 00 00 00 00 00
    00000030: 00 00 00 00 00 00 00 00 00 00 00 00 00 00 00 00
    00000040: 00 00 00 00 00 00 00 00 00 00 00 00 00 00 00 00
    00000050: 00 00 00 00 00 00 00 00 00 00 00 00 04 12 21 18
    00000060: 03 26 09 04 0b d4 31 b0 02 0d 40 a4 f7 87 78 b9
    00000070: da 56 1a 21 97 57 2e 90 de 87 7a 0b 6c 5f 63 2c
    00000080: 01 8a 32 17 9b 65 73 af b1 a1 1b 2f 0c 0b 67 b8
    00000090: f7 84 22 44 04 bd 33 76 f8 06 2e 82 57 ff 63 a1
    000000a0: c9 27 8e f4 46 8e b1 ea 96 c3 9a 80 0f 00 00 00
    000000b0: 00 80 11 0a 80 21 02 80 31 28 80 a1 03 80 81 12
    000000c0: 80 7f 00 00 00 00 02 0d 40 50 ed 7d 34 7b 37 b2
    000000d0: 6e 5f d9 b6 60 23 55 a0 8d 68 42 da 55 bd a0 50
    000000e0: 64 2e b3 12 f9 b8 a9 1d 29 9d 90 7e 15 18 66 1d
    000000f0: aa 74 03 e8 78 c4 3c e6 b3 0e d2 d9 c9 eb 6b
  UrbLink              = 00000000
[802308 ms] UsbSnoop - DispatchAny(f88fe610) : IRP_MJ_INTERNAL_DEVICE_CONTROL
[802308 ms] UsbSnoop - MyDispatchInternalIOCTL(f88ffe80) : fdo=82141030, Irp=81c8e008, IRQL=2
[802308 ms]  >>>  URB 674 going down  >>> 
-- URB_FUNCTION_BULK_OR_INTERRUPT_TRANSFER:
  PipeHandle           = 81b38434 [endpoint 0x00000002]
  TransferFlags        = 00000000 (USBD_TRANSFER_DIRECTION_OUT, ~USBD_SHORT_TRANSFER_OK)
  TransferBufferLength = 00000007
  TransferBuffer       = 00000000
  TransferBufferMDL    = 81b9ade0
    00000000: 00 00 00 02 05 e0 00
  UrbLink              = 00000000
[802308 ms] UsbSnoop - MyInternalIOCTLCompletion(f88ffdb0) : fido=81b37020, Irp=81c8e008, Context=822f4330, IRQL=2
[802308 ms]  <<<  URB 674 coming back  <<< 
-- URB_FUNCTION_BULK_OR_INTERRUPT_TRANSFER:
  PipeHandle           = 81b38434 [endpoint 0x00000002]
  TransferFlags        = 00000000 (USBD_TRANSFER_DIRECTION_OUT, ~USBD_SHORT_TRANSFER_OK)
  TransferBufferLength = 00000007
  TransferBuffer       = 00000000
  TransferBufferMDL    = 81b9ade0
  UrbLink              = 00000000
[802317 ms] UsbSnoop - DispatchAny(f88fe610) : IRP_MJ_INTERNAL_DEVICE_CONTROL
[802317 ms] UsbSnoop - MyDispatchInternalIOCTL(f88ffe80) : fdo=82141030, Irp=81c8e008, IRQL=2
[802317 ms]  >>>  URB 675 going down  >>> 
-- URB_FUNCTION_BULK_OR_INTERRUPT_TRANSFER:
  PipeHandle           = 81b38414 [endpoint 0x00000081]
  TransferFlags        = 00000003 (USBD_TRANSFER_DIRECTION_IN, USBD_SHORT_TRANSFER_OK)
  TransferBufferLength = 00000100
  TransferBuffer       = 00000000
  TransferBufferMDL    = 81b9ade0
  UrbLink              = 00000000
[802340 ms] UsbSnoop - MyInternalIOCTLCompletion(f88ffdb0) : fido=81b37020, Irp=81c8e008, Context=822a1498, IRQL=2
[802340 ms]  <<<  URB 675 coming back  <<< 
-- URB_FUNCTION_BULK_OR_INTERRUPT_TRANSFER:
  PipeHandle           = 81b38414 [endpoint 0x00000081]
  TransferFlags        = 00000003 (USBD_TRANSFER_DIRECTION_IN, USBD_SHORT_TRANSFER_OK)
  TransferBufferLength = 000000ff
  TransferBuffer       = 00000000
  TransferBufferMDL    = 81b9ade0
    00000000: 00 00 00 fa 03 7a 96 13 d4 71 3b eb 0c 01 6c ff
    00000010: ff ff ff ff ff ff ff ff ff ff ff ff ff ff ff ff
    00000020: ff ff ff ff ff ff ff ff ff ff ff ff ff ff ff ff
    00000030: ff ff ff ff ff ff ff ff ff ff ff ff ff ff ff ff
    00000040: ff ff ff ff ff ff ff ff ff ff ff ff ff ff ff ff
    00000050: ff ff ff ff ff ff ff ff ff ff ff ff ff ff ff ff
    00000060: ff ff ff ff ff ff ff ff ff ff ff ff ff ff ff ff
    00000070: ff ff ff ff ff ff ff ff ff ff ff ff ff ff ff ff
    00000080: ff ff ff ff ff ff ff ff ff ff ff ff ff ff ff ff
    00000090: ff ff ff ff ff ff ff ff ff ff ff ff ff ff ff ff
    000000a0: ff ff ff ff ff ff ff ff ff ff ff ff ff ff ff ff
    000000b0: ff ff ff ff ff ff ff ff ff ff ff ff ff ff ff ff
    000000c0: ff ff ff ff ff ff ff ff ff ff ff ff ff ff ff ff
    000000d0: ff ff ff ff ff ff ff ff ff ff ff ff ff ff ff ff
    000000e0: ff ff ff ff ff ff ff ff ff ff ff ff ff ff ff ff
    000000f0: ff ff ff ff ff ff ff ff ff ff ff ff ff ff ff
  UrbLink              = 00000000
[802377 ms] UsbSnoop - DispatchAny(f88fe610) : IRP_MJ_INTERNAL_DEVICE_CONTROL
[802377 ms] UsbSnoop - MyDispatchInternalIOCTL(f88ffe80) : fdo=82141030, Irp=81c8e008, IRQL=2
[802377 ms]  >>>  URB 676 going down  >>> 
-- URB_FUNCTION_BULK_OR_INTERRUPT_TRANSFER:
  PipeHandle           = 81b38434 [endpoint 0x00000002]
  TransferFlags        = 00000000 (USBD_TRANSFER_DIRECTION_OUT, ~USBD_SHORT_TRANSFER_OK)
  TransferBufferLength = 00000007
  TransferBuffer       = 00000000
  TransferBufferMDL    = 81b9ade0
    00000000: 00 00 00 02 05 e0 00
  UrbLink              = 00000000
[802377 ms] UsbSnoop - MyInternalIOCTLCompletion(f88ffdb0) : fido=81b37020, Irp=81c8e008, Context=81b6c560, IRQL=2
[802377 ms]  <<<  URB 676 coming back  <<< 
-- URB_FUNCTION_BULK_OR_INTERRUPT_TRANSFER:
  PipeHandle           = 81b38434 [endpoint 0x00000002]
  TransferFlags        = 00000000 (USBD_TRANSFER_DIRECTION_OUT, ~USBD_SHORT_TRANSFER_OK)
  TransferBufferLength = 00000007
  TransferBuffer       = 00000000
  TransferBufferMDL    = 81b9ade0
  UrbLink              = 00000000
[802387 ms] UsbSnoop - DispatchAny(f88fe610) : IRP_MJ_INTERNAL_DEVICE_CONTROL
[802387 ms] UsbSnoop - MyDispatchInternalIOCTL(f88ffe80) : fdo=82141030, Irp=81c8e008, IRQL=2
[802387 ms]  >>>  URB 677 going down  >>> 
-- URB_FUNCTION_BULK_OR_INTERRUPT_TRANSFER:
  PipeHandle           = 81b38414 [endpoint 0x00000081]
  TransferFlags        = 00000003 (USBD_TRANSFER_DIRECTION_IN, USBD_SHORT_TRANSFER_OK)
  TransferBufferLength = 00000100
  TransferBuffer       = 00000000
  TransferBufferMDL    = 81b9ade0
  UrbLink              = 00000000
[802408 ms] UsbSnoop - MyInternalIOCTLCompletion(f88ffdb0) : fido=81b37020, Irp=81c8e008, Context=822a1498, IRQL=2
[802408 ms]  <<<  URB 677 coming back  <<< 
-- URB_FUNCTION_BULK_OR_INTERRUPT_TRANSFER:
  PipeHandle           = 81b38414 [endpoint 0x00000081]
  TransferFlags        = 00000003 (USBD_TRANSFER_DIRECTION_IN, USBD_SHORT_TRANSFER_OK)
  TransferBufferLength = 000000ff
  TransferBuffer       = 00000000
  TransferBufferMDL    = 81b9ade0
    00000000: 00 00 00 fa 03 ff ff ff ff ff ff ff ff ff ff ff
    00000010: ff ff ff ff ff ff ff ff ff ff ff ff ff ff ff ff
    00000020: ff ff ff ff ff ff ff ff ff ff ff ff ff ff ff ff
    00000030: ff ff ff ff ff ff ff ff ff ff ff ff ff ff ff ff
    00000040: ff ff ff ff ff ff ff ff ff ff ff ff ff ff ff ff
    00000050: ff ff ff ff ff ff ff ff ff ff ff ff ff ff ff ff
    00000060: ff ff ff ff ff ff ff ff ff ff ff ff ff ff ff ff
    00000070: ff ff ff ff ff ff ff ff ff ff ff ff ff ff ff ff
    00000080: ff ff ff ff ff ff ff ff ff ff ff ff ff ff ff ff
    00000090: ff ff ff ff ff ff ff ff ff ff ff ff ff ff ff ff
    000000a0: ff ff ff ff ff ff ff ff ff ff ff ff ff ff ff ff
    000000b0: ff ff ff ff ff ff ff ff ff ff ff ff ff ff ff ff
    000000c0: ff ff ff ff ff ff ff ff ff ff ff ff ff ff ff ff
    000000d0: ff ff ff ff ff ff ff ff ff ff ff ff ff ff ff ff
    000000e0: ff ff ff ff ff ff ff ff ff ff ff ff ff ff ff ff
    000000f0: ff ff ff ff ff ff ff ff ff ff ff ff ff ff ff
  UrbLink              = 00000000
[802447 ms] UsbSnoop - DispatchAny(f88fe610) : IRP_MJ_INTERNAL_DEVICE_CONTROL
[802447 ms] UsbSnoop - MyDispatchInternalIOCTL(f88ffe80) : fdo=82141030, Irp=81c8e008, IRQL=2
[802447 ms]  >>>  URB 678 going down  >>> 
-- URB_FUNCTION_BULK_OR_INTERRUPT_TRANSFER:
  PipeHandle           = 81b38434 [endpoint 0x00000002]
  TransferFlags        = 00000000 (USBD_TRANSFER_DIRECTION_OUT, ~USBD_SHORT_TRANSFER_OK)
  TransferBufferLength = 00000007
  TransferBuffer       = 00000000
  TransferBufferMDL    = 81b9ade0
    00000000: 00 00 00 02 05 e0 00
  UrbLink              = 00000000
[802447 ms] UsbSnoop - MyInternalIOCTLCompletion(f88ffdb0) : fido=81b37020, Irp=81c8e008, Context=822f4330, IRQL=2
[802447 ms]  <<<  URB 678 coming back  <<< 
-- URB_FUNCTION_BULK_OR_INTERRUPT_TRANSFER:
  PipeHandle           = 81b38434 [endpoint 0x00000002]
  TransferFlags        = 00000000 (USBD_TRANSFER_DIRECTION_OUT, ~USBD_SHORT_TRANSFER_OK)
  TransferBufferLength = 00000007
  TransferBuffer       = 00000000
  TransferBufferMDL    = 81b9ade0
  UrbLink              = 00000000
[802457 ms] UsbSnoop - DispatchAny(f88fe610) : IRP_MJ_INTERNAL_DEVICE_CONTROL
[802457 ms] UsbSnoop - MyDispatchInternalIOCTL(f88ffe80) : fdo=82141030, Irp=81c8e008, IRQL=2
[802457 ms]  >>>  URB 679 going down  >>> 
-- URB_FUNCTION_BULK_OR_INTERRUPT_TRANSFER:
  PipeHandle           = 81b38414 [endpoint 0x00000081]
  TransferFlags        = 00000003 (USBD_TRANSFER_DIRECTION_IN, USBD_SHORT_TRANSFER_OK)
  TransferBufferLength = 00000100
  TransferBuffer       = 00000000
  TransferBufferMDL    = 81b9ade0
  UrbLink              = 00000000
[802479 ms] UsbSnoop - MyInternalIOCTLCompletion(f88ffdb0) : fido=81b37020, Irp=81c8e008, Context=822a1498, IRQL=2
[802479 ms]  <<<  URB 679 coming back  <<< 
-- URB_FUNCTION_BULK_OR_INTERRUPT_TRANSFER:
  PipeHandle           = 81b38414 [endpoint 0x00000081]
  TransferFlags        = 00000003 (USBD_TRANSFER_DIRECTION_IN, USBD_SHORT_TRANSFER_OK)
  TransferBufferLength = 000000ff
  TransferBuffer       = 00000000
  TransferBufferMDL    = 81b9ade0
    00000000: 00 00 00 fa 03 ff ff ff ff ff ff ff ff ff ff ff
    00000010: ff ff ff ff ff ff ff ff ff ff ff ff ff ff ff ff
    00000020: ff ff ff ff ff ff ff ff ff ff ff ff ff ff ff ff
    00000030: ff ff ff ff ff ff ff ff ff ff ff ff ff ff ff ff
    00000040: ff ff ff ff ff ff ff ff ff ff ff ff ff ff ff ff
    00000050: ff ff ff ff ff ff ff ff ff ff ff ff ff ff ff ff
    00000060: ff ff ff ff ff ff ff ff ff ff ff ff ff ff ff ff
    00000070: ff ff ff ff ff ff ff ff ff ff ff ff ff ff ff ff
    00000080: ff ff ff ff ff ff ff ff ff ff ff ff ff ff ff ff
    00000090: ff ff ff ff ff ff ff ff ff ff ff ff ff ff ff ff
    000000a0: ff ff ff ff ff ff ff ff ff ff ff ff ff ff ff ff
    000000b0: ff ff ff ff ff ff ff ff ff ff ff ff ff ff ff ff
    000000c0: ff ff ff ff ff ff ff ff ff ff ff ff ff ff ff ff
    000000d0: ff ff ff ff ff ff ff ff ff ff ff ff ff ff ff ff
    000000e0: ff ff ff ff ff ff ff ff ff ff ff ff ff ff ff ff
    000000f0: ff ff ff ff ff ff ff ff ff ff ff 00 00 00 00
  UrbLink              = 00000000
[802517 ms] UsbSnoop - DispatchAny(f88fe610) : IRP_MJ_INTERNAL_DEVICE_CONTROL
[802517 ms] UsbSnoop - MyDispatchInternalIOCTL(f88ffe80) : fdo=82141030, Irp=81c8e008, IRQL=2
[802517 ms]  >>>  URB 680 going down  >>> 
-- URB_FUNCTION_BULK_OR_INTERRUPT_TRANSFER:
  PipeHandle           = 81b38434 [endpoint 0x00000002]
  TransferFlags        = 00000000 (USBD_TRANSFER_DIRECTION_OUT, ~USBD_SHORT_TRANSFER_OK)
  TransferBufferLength = 00000007
  TransferBuffer       = 00000000
  TransferBufferMDL    = 81b9ade0
    00000000: 00 00 00 02 05 e0 00
  UrbLink              = 00000000
[802518 ms] UsbSnoop - MyInternalIOCTLCompletion(f88ffdb0) : fido=81b37020, Irp=81c8e008, Context=81b6c560, IRQL=2
[802518 ms]  <<<  URB 680 coming back  <<< 
-- URB_FUNCTION_BULK_OR_INTERRUPT_TRANSFER:
  PipeHandle           = 81b38434 [endpoint 0x00000002]
  TransferFlags        = 00000000 (USBD_TRANSFER_DIRECTION_OUT, ~USBD_SHORT_TRANSFER_OK)
  TransferBufferLength = 00000007
  TransferBuffer       = 00000000
  TransferBufferMDL    = 81b9ade0
  UrbLink              = 00000000
[802527 ms] UsbSnoop - DispatchAny(f88fe610) : IRP_MJ_INTERNAL_DEVICE_CONTROL
[802527 ms] UsbSnoop - MyDispatchInternalIOCTL(f88ffe80) : fdo=82141030, Irp=81c8e008, IRQL=2
[802527 ms]  >>>  URB 681 going down  >>> 
-- URB_FUNCTION_BULK_OR_INTERRUPT_TRANSFER:
  PipeHandle           = 81b38414 [endpoint 0x00000081]
  TransferFlags        = 00000003 (USBD_TRANSFER_DIRECTION_IN, USBD_SHORT_TRANSFER_OK)
  TransferBufferLength = 00000100
  TransferBuffer       = 00000000
  TransferBufferMDL    = 81b9ade0
  UrbLink              = 00000000
[803011 ms] UsbSnoop - MyInternalIOCTLCompletion(f88ffdb0) : fido=81b37020, Irp=81c8e008, Context=822a1498, IRQL=2
[803012 ms]  <<<  URB 681 coming back  <<< 
-- URB_FUNCTION_BULK_OR_INTERRUPT_TRANSFER:
  PipeHandle           = 81b38414 [endpoint 0x00000081]
  TransferFlags        = 00000003 (USBD_TRANSFER_DIRECTION_IN, USBD_SHORT_TRANSFER_OK)
  TransferBufferLength = 00000021
  TransferBuffer       = 00000000
  TransferBufferMDL    = 81b9ade0
    00000000: 00 00 00 1c 04 00 00 00 00 00 00 00 00 fc ff ff
    00000010: ff ff ff ff ff ff ff ff ff ff ff ff ff ff ff ff
    00000020: ff
  UrbLink              = 00000000
[803048 ms] UsbSnoop - DispatchAny(f88fe610) : IRP_MJ_INTERNAL_DEVICE_CONTROL
[803048 ms] UsbSnoop - MyDispatchInternalIOCTL(f88ffe80) : fdo=82141030, Irp=81c8e008, IRQL=2
[803048 ms]  >>>  URB 682 going down  >>> 
-- URB_FUNCTION_BULK_OR_INTERRUPT_TRANSFER:
  PipeHandle           = 81b38434 [endpoint 0x00000002]
  TransferFlags        = 00000000 (USBD_TRANSFER_DIRECTION_OUT, ~USBD_SHORT_TRANSFER_OK)
  TransferBufferLength = 00000007
  TransferBuffer       = 00000000
  TransferBufferMDL    = 81b9ade0
    00000000: 00 00 00 02 05 e0 00
  UrbLink              = 00000000
[803048 ms] UsbSnoop - MyInternalIOCTLCompletion(f88ffdb0) : fido=81b37020, Irp=81c8e008, Context=822f4330, IRQL=2
[803048 ms]  <<<  URB 682 coming back  <<< 
-- URB_FUNCTION_BULK_OR_INTERRUPT_TRANSFER:
  PipeHandle           = 81b38434 [endpoint 0x00000002]
  TransferFlags        = 00000000 (USBD_TRANSFER_DIRECTION_OUT, ~USBD_SHORT_TRANSFER_OK)
  TransferBufferLength = 00000007
  TransferBuffer       = 00000000
  TransferBufferMDL    = 81b9ade0
  UrbLink              = 00000000
[803309 ms] UsbSnoop - DispatchAny(f88fe610) : IRP_MJ_INTERNAL_DEVICE_CONTROL
[803309 ms] UsbSnoop - MyDispatchInternalIOCTL(f88ffe80) : fdo=82141030, Irp=81c8e008, IRQL=2
[803309 ms]  >>>  URB 683 going down  >>> 
-- URB_FUNCTION_BULK_OR_INTERRUPT_TRANSFER:
  PipeHandle           = 81b38434 [endpoint 0x00000002]
  TransferFlags        = 00000000 (USBD_TRANSFER_DIRECTION_OUT, ~USBD_SHORT_TRANSFER_OK)
  TransferBufferLength = 00000009
  TransferBuffer       = 00000000
  TransferBufferMDL    = 81b9ade0
    00000000: 00 00 00 04 01 00 00 04 00
  UrbLink              = 00000000
[803309 ms] UsbSnoop - MyInternalIOCTLCompletion(f88ffdb0) : fido=81b37020, Irp=81c8e008, Context=823094d0, IRQL=2
[803309 ms]  <<<  URB 683 coming back  <<< 
-- URB_FUNCTION_BULK_OR_INTERRUPT_TRANSFER:
  PipeHandle           = 81b38434 [endpoint 0x00000002]
  TransferFlags        = 00000000 (USBD_TRANSFER_DIRECTION_OUT, ~USBD_SHORT_TRANSFER_OK)
  TransferBufferLength = 00000009
  TransferBuffer       = 00000000
  TransferBufferMDL    = 81b9ade0
  UrbLink              = 00000000
[803309 ms] UsbSnoop - DispatchAny(f88fe610) : IRP_MJ_INTERNAL_DEVICE_CONTROL
[803309 ms] UsbSnoop - MyDispatchInternalIOCTL(f88ffe80) : fdo=82141030, Irp=81c8e008, IRQL=2
[803309 ms]  >>>  URB 684 going down  >>> 
-- URB_FUNCTION_BULK_OR_INTERRUPT_TRANSFER:
  PipeHandle           = 81b38414 [endpoint 0x00000081]
  TransferFlags        = 00000003 (USBD_TRANSFER_DIRECTION_IN, USBD_SHORT_TRANSFER_OK)
  TransferBufferLength = 00000100
  TransferBuffer       = 00000000
  TransferBufferMDL    = 81b9ade0
  UrbLink              = 00000000
[803321 ms] UsbSnoop - MyInternalIOCTLCompletion(f88ffdb0) : fido=81b37020, Irp=81c8e008, Context=81b33e28, IRQL=2
[803321 ms]  <<<  URB 684 coming back  <<< 
-- URB_FUNCTION_BULK_OR_INTERRUPT_TRANSFER:
  PipeHandle           = 81b38414 [endpoint 0x00000081]
  TransferFlags        = 00000003 (USBD_TRANSFER_DIRECTION_IN, USBD_SHORT_TRANSFER_OK)
  TransferBufferLength = 00000009
  TransferBuffer       = 00000000
  TransferBufferMDL    = 81b9ade0
    00000000: 00 00 00 04 02 00 00 00 fa
  UrbLink              = 00000000
[803349 ms] UsbSnoop - DispatchAny(f88fe610) : IRP_MJ_INTERNAL_DEVICE_CONTROL
[803349 ms] UsbSnoop - MyDispatchInternalIOCTL(f88ffe80) : fdo=82141030, Irp=81c8e008, IRQL=2
[803349 ms]  >>>  URB 685 going down  >>> 
-- URB_FUNCTION_BULK_OR_INTERRUPT_TRANSFER:
  PipeHandle           = 81b38434 [endpoint 0x00000002]
  TransferFlags        = 00000000 (USBD_TRANSFER_DIRECTION_OUT, ~USBD_SHORT_TRANSFER_OK)
  TransferBufferLength = 00000015
  TransferBuffer       = 00000000
  TransferBufferMDL    = 81b9ade0
    00000000: 00 00 00 10 04 00 00 00 0a 00 01 00 03 00 01 00
    00000010: 00 00 00 07 d0
  UrbLink              = 00000000
[803349 ms] UsbSnoop - MyInternalIOCTLCompletion(f88ffdb0) : fido=81b37020, Irp=81c8e008, Context=81b9b240, IRQL=2
[803349 ms]  <<<  URB 685 coming back  <<< 
-- URB_FUNCTION_BULK_OR_INTERRUPT_TRANSFER:
  PipeHandle           = 81b38434 [endpoint 0x00000002]
  TransferFlags        = 00000000 (USBD_TRANSFER_DIRECTION_OUT, ~USBD_SHORT_TRANSFER_OK)
  TransferBufferLength = 00000015
  TransferBuffer       = 00000000
  TransferBufferMDL    = 81b9ade0
  UrbLink              = 00000000
[803360 ms] UsbSnoop - DispatchAny(f88fe610) : IRP_MJ_INTERNAL_DEVICE_CONTROL
[803360 ms] UsbSnoop - MyDispatchInternalIOCTL(f88ffe80) : fdo=82141030, Irp=81c8e008, IRQL=2
[803360 ms]  >>>  URB 686 going down  >>> 
-- URB_FUNCTION_BULK_OR_INTERRUPT_TRANSFER:
  PipeHandle           = 81b38414 [endpoint 0x00000081]
  TransferFlags        = 00000003 (USBD_TRANSFER_DIRECTION_IN, USBD_SHORT_TRANSFER_OK)
  TransferBufferLength = 00000100
  TransferBuffer       = 00000000
  TransferBufferMDL    = 81b9ade0
  UrbLink              = 00000000
[803360 ms] UsbSnoop - MyInternalIOCTLCompletion(f88ffdb0) : fido=81b37020, Irp=81c8e008, Context=81b86b58, IRQL=2
[803360 ms]  <<<  URB 686 coming back  <<< 
-- URB_FUNCTION_BULK_OR_INTERRUPT_TRANSFER:
  PipeHandle           = 81b38414 [endpoint 0x00000081]
  TransferFlags        = 00000003 (USBD_TRANSFER_DIRECTION_IN, USBD_SHORT_TRANSFER_OK)
  TransferBufferLength = 00000007
  TransferBuffer       = 00000000
  TransferBufferMDL    = 81b9ade0
    00000000: 00 00 00 02 05 e0 00
  UrbLink              = 00000000
[803399 ms] UsbSnoop - DispatchAny(f88fe610) : IRP_MJ_INTERNAL_DEVICE_CONTROL
[803399 ms] UsbSnoop - MyDispatchInternalIOCTL(f88ffe80) : fdo=82141030, Irp=81c8e008, IRQL=2
[803399 ms]  >>>  URB 687 going down  >>> 
-- URB_FUNCTION_BULK_OR_INTERRUPT_TRANSFER:
  PipeHandle           = 81b38414 [endpoint 0x00000081]
  TransferFlags        = 00000003 (USBD_TRANSFER_DIRECTION_IN, USBD_SHORT_TRANSFER_OK)
  TransferBufferLength = 00000100
  TransferBuffer       = 00000000
  TransferBufferMDL    = 81b9ade0
  UrbLink              = 00000000
[803399 ms] UsbSnoop - MyInternalIOCTLCompletion(f88ffdb0) : fido=81b37020, Irp=81c8e008, Context=81b9b240, IRQL=2
[803399 ms]  <<<  URB 687 coming back  <<< 
-- URB_FUNCTION_BULK_OR_INTERRUPT_TRANSFER:
  PipeHandle           = 81b38414 [endpoint 0x00000081]
  TransferFlags        = 00000003 (USBD_TRANSFER_DIRECTION_IN, USBD_SHORT_TRANSFER_OK)
  TransferBufferLength = 0000000f
  TransferBuffer       = 00000000
  TransferBufferMDL    = 81b9ade0
    00000000: 00 00 00 0a 04 00 00 00 04 00 12 00 00 07 d0
  UrbLink              = 00000000
[803439 ms] UsbSnoop - DispatchAny(f88fe610) : IRP_MJ_INTERNAL_DEVICE_CONTROL
[803439 ms] UsbSnoop - MyDispatchInternalIOCTL(f88ffe80) : fdo=82141030, Irp=81c8e008, IRQL=2
[803439 ms]  >>>  URB 688 going down  >>> 
-- URB_FUNCTION_BULK_OR_INTERRUPT_TRANSFER:
  PipeHandle           = 81b38434 [endpoint 0x00000002]
  TransferFlags        = 00000000 (USBD_TRANSFER_DIRECTION_OUT, ~USBD_SHORT_TRANSFER_OK)
  TransferBufferLength = 00000007
  TransferBuffer       = 00000000
  TransferBufferMDL    = 81b9ade0
    00000000: 00 00 00 02 05 e0 00
  UrbLink              = 00000000
[803439 ms] UsbSnoop - MyInternalIOCTLCompletion(f88ffdb0) : fido=81b37020, Irp=81c8e008, Context=822bf0e0, IRQL=2
[803439 ms]  <<<  URB 688 coming back  <<< 
-- URB_FUNCTION_BULK_OR_INTERRUPT_TRANSFER:
  PipeHandle           = 81b38434 [endpoint 0x00000002]
  TransferFlags        = 00000000 (USBD_TRANSFER_DIRECTION_OUT, ~USBD_SHORT_TRANSFER_OK)
  TransferBufferLength = 00000007
  TransferBuffer       = 00000000
  TransferBufferMDL    = 81b9ade0
  UrbLink              = 00000000
[803449 ms] UsbSnoop - DispatchAny(f88fe610) : IRP_MJ_INTERNAL_DEVICE_CONTROL
[803449 ms] UsbSnoop - MyDispatchInternalIOCTL(f88ffe80) : fdo=82141030, Irp=81c8e008, IRQL=2
[803449 ms]  >>>  URB 689 going down  >>> 
-- URB_FUNCTION_BULK_OR_INTERRUPT_TRANSFER:
  PipeHandle           = 81b38434 [endpoint 0x00000002]
  TransferFlags        = 00000000 (USBD_TRANSFER_DIRECTION_OUT, ~USBD_SHORT_TRANSFER_OK)
  TransferBufferLength = 00000026
  TransferBuffer       = 00000000
  TransferBufferMDL    = 81b9ade0
    00000000: 00 00 00 21 04 00 00 00 1b 00 0c 00 01 42 00 01
    00000010: ff ff ff ff 00 02 00 03 00 08 00 01 00 11 00 04
    00000020: f0 07 00 00 00 00
  UrbLink              = 00000000
[803449 ms] UsbSnoop - MyInternalIOCTLCompletion(f88ffdb0) : fido=81b37020, Irp=81c8e008, Context=81b33e28, IRQL=2
[803449 ms]  <<<  URB 689 coming back  <<< 
-- URB_FUNCTION_BULK_OR_INTERRUPT_TRANSFER:
  PipeHandle           = 81b38434 [endpoint 0x00000002]
  TransferFlags        = 00000000 (USBD_TRANSFER_DIRECTION_OUT, ~USBD_SHORT_TRANSFER_OK)
  TransferBufferLength = 00000026
  TransferBuffer       = 00000000
  TransferBufferMDL    = 81b9ade0
  UrbLink              = 00000000
[803459 ms] UsbSnoop - DispatchAny(f88fe610) : IRP_MJ_INTERNAL_DEVICE_CONTROL
[803459 ms] UsbSnoop - MyDispatchInternalIOCTL(f88ffe80) : fdo=82141030, Irp=81c20008, IRQL=2
[803459 ms]  >>>  URB 690 going down  >>> 
-- URB_FUNCTION_BULK_OR_INTERRUPT_TRANSFER:
  PipeHandle           = 81b38414 [endpoint 0x00000081]
  TransferFlags        = 00000003 (USBD_TRANSFER_DIRECTION_IN, USBD_SHORT_TRANSFER_OK)
  TransferBufferLength = 00000100
  TransferBuffer       = 00000000
  TransferBufferMDL    = 81b9ade0
  UrbLink              = 00000000
[803462 ms] UsbSnoop - MyInternalIOCTLCompletion(f88ffdb0) : fido=81b37020, Irp=81c20008, Context=822ca258, IRQL=2
[803462 ms]  <<<  URB 690 coming back  <<< 
-- URB_FUNCTION_BULK_OR_INTERRUPT_TRANSFER:
  PipeHandle           = 81b38414 [endpoint 0x00000081]
  TransferFlags        = 00000003 (USBD_TRANSFER_DIRECTION_IN, USBD_SHORT_TRANSFER_OK)
  TransferBufferLength = 00000007
  TransferBuffer       = 00000000
  TransferBufferMDL    = 81b9ade0
    00000000: 00 00 00 02 05 e0 00
  UrbLink              = 00000000
[803499 ms] UsbSnoop - DispatchAny(f88fe610) : IRP_MJ_INTERNAL_DEVICE_CONTROL
[803499 ms] UsbSnoop - MyDispatchInternalIOCTL(f88ffe80) : fdo=82141030, Irp=81c20008, IRQL=2
[803499 ms]  >>>  URB 691 going down  >>> 
-- URB_FUNCTION_BULK_OR_INTERRUPT_TRANSFER:
  PipeHandle           = 81b38414 [endpoint 0x00000081]
  TransferFlags        = 00000003 (USBD_TRANSFER_DIRECTION_IN, USBD_SHORT_TRANSFER_OK)
  TransferBufferLength = 00000100
  TransferBuffer       = 00000000
  TransferBufferMDL    = 81b9ade0
  UrbLink              = 00000000
[803499 ms] UsbSnoop - MyInternalIOCTLCompletion(f88ffdb0) : fido=81b37020, Irp=81c20008, Context=822bf0e0, IRQL=2
[803499 ms]  <<<  URB 691 coming back  <<< 
-- URB_FUNCTION_BULK_OR_INTERRUPT_TRANSFER:
  PipeHandle           = 81b38414 [endpoint 0x00000081]
  TransferFlags        = 00000003 (USBD_TRANSFER_DIRECTION_IN, USBD_SHORT_TRANSFER_OK)
  TransferBufferLength = 00000020
  TransferBuffer       = 00000000
  TransferBufferMDL    = 81b9ade0
    00000000: 00 00 00 1b 04 00 00 00 15 00 0a 00 01 42 00 00
    00000010: 02 00 03 00 00 01 00 00 08 00 00 04 00 00 00 00
  UrbLink              = 00000000
[803539 ms] UsbSnoop - DispatchAny(f88fe610) : IRP_MJ_INTERNAL_DEVICE_CONTROL
[803539 ms] UsbSnoop - MyDispatchInternalIOCTL(f88ffe80) : fdo=82141030, Irp=81c20008, IRQL=2
[803539 ms]  >>>  URB 692 going down  >>> 
-- URB_FUNCTION_BULK_OR_INTERRUPT_TRANSFER:
  PipeHandle           = 81b38434 [endpoint 0x00000002]
  TransferFlags        = 00000000 (USBD_TRANSFER_DIRECTION_OUT, ~USBD_SHORT_TRANSFER_OK)
  TransferBufferLength = 00000007
  TransferBuffer       = 00000000
  TransferBufferMDL    = 822de568
    00000000: 00 00 00 02 05 e0 00
  UrbLink              = 00000000
[803539 ms] UsbSnoop - MyInternalIOCTLCompletion(f88ffdb0) : fido=81b37020, Irp=81c20008, Context=822ca258, IRQL=2
[803539 ms]  <<<  URB 692 coming back  <<< 
-- URB_FUNCTION_BULK_OR_INTERRUPT_TRANSFER:
  PipeHandle           = 81b38434 [endpoint 0x00000002]
  TransferFlags        = 00000000 (USBD_TRANSFER_DIRECTION_OUT, ~USBD_SHORT_TRANSFER_OK)
  TransferBufferLength = 00000007
  TransferBuffer       = 00000000
  TransferBufferMDL    = 822de568
  UrbLink              = 00000000
[803549 ms] UsbSnoop - DispatchAny(f88fe610) : IRP_MJ_INTERNAL_DEVICE_CONTROL
[803549 ms] UsbSnoop - MyDispatchInternalIOCTL(f88ffe80) : fdo=82141030, Irp=81c20008, IRQL=2
[803549 ms]  >>>  URB 693 going down  >>> 
-- URB_FUNCTION_BULK_OR_INTERRUPT_TRANSFER:
  PipeHandle           = 81b38414 [endpoint 0x00000081]
  TransferFlags        = 00000003 (USBD_TRANSFER_DIRECTION_IN, USBD_SHORT_TRANSFER_OK)
  TransferBufferLength = 00000100
  TransferBuffer       = 00000000
  TransferBufferMDL    = 822de568
  UrbLink              = 00000000
[803550 ms] UsbSnoop - MyInternalIOCTLCompletion(f88ffdb0) : fido=81b37020, Irp=81c20008, Context=822ca258, IRQL=2
[803550 ms]  <<<  URB 693 coming back  <<< 
-- URB_FUNCTION_BULK_OR_INTERRUPT_TRANSFER:
  PipeHandle           = 81b38414 [endpoint 0x00000081]
  TransferFlags        = 00000003 (USBD_TRANSFER_DIRECTION_IN, USBD_SHORT_TRANSFER_OK)
  TransferBufferLength = 00000014
  TransferBuffer       = 00000000
  TransferBufferMDL    = 822de568
    00000000: 00 00 00 0f 04 00 00 00 09 00 0d 00 80 20 00 00
    00000010: 00 00 00 00
  UrbLink              = 00000000
[803589 ms] UsbSnoop - DispatchAny(f88fe610) : IRP_MJ_INTERNAL_DEVICE_CONTROL
[803589 ms] UsbSnoop - MyDispatchInternalIOCTL(f88ffe80) : fdo=82141030, Irp=81c20008, IRQL=2
[803589 ms]  >>>  URB 694 going down  >>> 
-- URB_FUNCTION_BULK_OR_INTERRUPT_TRANSFER:
  PipeHandle           = 81b38434 [endpoint 0x00000002]
  TransferFlags        = 00000000 (USBD_TRANSFER_DIRECTION_OUT, ~USBD_SHORT_TRANSFER_OK)
  TransferBufferLength = 00000007
  TransferBuffer       = 00000000
  TransferBufferMDL    = 822de568
    00000000: 00 00 00 02 05 e0 00
  UrbLink              = 00000000
[803589 ms] UsbSnoop - MyInternalIOCTLCompletion(f88ffdb0) : fido=81b37020, Irp=81c20008, Context=81b86b58, IRQL=2
[803589 ms]  <<<  URB 694 coming back  <<< 
-- URB_FUNCTION_BULK_OR_INTERRUPT_TRANSFER:
  PipeHandle           = 81b38434 [endpoint 0x00000002]
  TransferFlags        = 00000000 (USBD_TRANSFER_DIRECTION_OUT, ~USBD_SHORT_TRANSFER_OK)
  TransferBufferLength = 00000007
  TransferBuffer       = 00000000
  TransferBufferMDL    = 822de568
  UrbLink              = 00000000
[804603 ms] UsbSnoop - DispatchAny(f88fe610) : IRP_MJ_INTERNAL_DEVICE_CONTROL
[804603 ms] UsbSnoop - MyDispatchInternalIOCTL(f88ffe80) : fdo=82141030, Irp=81b34008, IRQL=0
[804603 ms]  >>>  URB 695 going down  >>> 
-- URB_FUNCTION_RESET_PIPE:
  PipeHandle = 81b38414 [endpoint 0x00000081]
[804606 ms] UsbSnoop - MyInternalIOCTLCompletion(f88ffdb0) : fido=00000000, Irp=81b34008, Context=81b33e28, IRQL=0
[804606 ms]  <<<  URB 695 coming back  <<< 
-- URB_FUNCTION_RESET_PIPE:
[804606 ms] UsbSnoop - DispatchAny(f88fe610) : IRP_MJ_INTERNAL_DEVICE_CONTROL
[804606 ms] UsbSnoop - MyDispatchInternalIOCTL(f88ffe80) : fdo=82141030, Irp=81b34008, IRQL=0
[804606 ms]  >>>  URB 696 going down  >>> 
-- URB_FUNCTION_RESET_PIPE:
  PipeHandle = 81b38434 [endpoint 0x00000002]
[804615 ms] UsbSnoop - MyInternalIOCTLCompletion(f88ffdb0) : fido=00000000, Irp=81b34008, Context=822a1498, IRQL=0
[804615 ms]  <<<  URB 696 coming back  <<< 
-- URB_FUNCTION_RESET_PIPE:
[804615 ms] UsbSnoop - DispatchAny(f88fe610) : IRP_MJ_INTERNAL_DEVICE_CONTROL
[804615 ms] UsbSnoop - MyDispatchInternalIOCTL(f88ffe80) : fdo=82141030, Irp=81b34008, IRQL=0
