[656347 ms] UsbSnoop - DispatchAny(f890e610) : IRP_MJ_INTERNAL_DEVICE_CONTROL
[656347 ms] UsbSnoop - MyDispatchInternalIOCTL(f890fe80) : fdo=81b1aac0, Irp=81ae8728, IRQL=0
[656347 ms]  >>>  URB 53 going down  >>> 
-- URB_FUNCTION_RESET_PIPE:
  PipeHandle = 822e77d4 [endpoint 0x00000081]
[656350 ms] UsbSnoop - MyInternalIOCTLCompletion(f890fdb0) : fido=00000000, Irp=81ae8728, Context=81b1cbd8, IRQL=0
[656350 ms]  <<<  URB 53 coming back  <<< 
-- URB_FUNCTION_RESET_PIPE:
[656350 ms] UsbSnoop - DispatchAny(f890e610) : IRP_MJ_INTERNAL_DEVICE_CONTROL
[656350 ms] UsbSnoop - MyDispatchInternalIOCTL(f890fe80) : fdo=81b1aac0, Irp=81ae8728, IRQL=0
[656350 ms]  >>>  URB 54 going down  >>> 
-- URB_FUNCTION_RESET_PIPE:
  PipeHandle = 822e77f4 [endpoint 0x00000002]
[656351 ms] UsbSnoop - MyInternalIOCTLCompletion(f890fdb0) : fido=00000000, Irp=81ae8728, Context=822de5c8, IRQL=0
[656351 ms]  <<<  URB 54 coming back  <<< 
-- URB_FUNCTION_RESET_PIPE:
[657348 ms] UsbSnoop - DispatchAny(f890e610) : IRP_MJ_INTERNAL_DEVICE_CONTROL
[657348 ms] UsbSnoop - MyDispatchInternalIOCTL(f890fe80) : fdo=81b1aac0, Irp=822d9840, IRQL=0
[657348 ms]  >>>  URB 55 going down  >>> 
-- URB_FUNCTION_RESET_PIPE:
  PipeHandle = 822e77d4 [endpoint 0x00000081]
[657352 ms] UsbSnoop - MyInternalIOCTLCompletion(f890fdb0) : fido=00000000, Irp=822d9840, Context=822de5c8, IRQL=0
[657352 ms]  <<<  URB 55 coming back  <<< 
-- URB_FUNCTION_RESET_PIPE:
[657353 ms] UsbSnoop - DispatchAny(f890e610) : IRP_MJ_INTERNAL_DEVICE_CONTROL
[657353 ms] UsbSnoop - MyDispatchInternalIOCTL(f890fe80) : fdo=81b1aac0, Irp=822d9840, IRQL=0
[657353 ms]  >>>  URB 56 going down  >>> 
-- URB_FUNCTION_RESET_PIPE:
  PipeHandle = 822e77f4 [endpoint 0x00000002]
[657353 ms] UsbSnoop - MyInternalIOCTLCompletion(f890fdb0) : fido=00000000, Irp=822d9840, Context=822da558, IRQL=0
[657353 ms]  <<<  URB 56 coming back  <<< 
-- URB_FUNCTION_RESET_PIPE:
[657353 ms] UsbSnoop - DispatchAny(f890e610) : IRP_MJ_INTERNAL_DEVICE_CONTROL
[657353 ms] UsbSnoop - MyDispatchInternalIOCTL(f890fe80) : fdo=81b1aac0, Irp=822d9840, IRQL=0
[658350 ms] UsbSnoop - DispatchAny(f890e610) : IRP_MJ_INTERNAL_DEVICE_CONTROL
[658350 ms] UsbSnoop - MyDispatchInternalIOCTL(f890fe80) : fdo=81b1aac0, Irp=822d9840, IRQL=0
[658350 ms]  >>>  URB 57 going down  >>> 
-- URB_FUNCTION_GET_DESCRIPTOR_FROM_DEVICE:
  TransferBufferLength = 00000012
  TransferBuffer       = e2713090
  TransferBufferMDL    = 00000000
  Index                = 00000000
  DescriptorType       = 00000001 (USB_DEVICE_DESCRIPTOR_TYPE)
  LanguageId           = 00000000
[658355 ms] UsbSnoop - MyInternalIOCTLCompletion(f890fdb0) : fido=00000000, Irp=822d9840, Context=822da5c0, IRQL=2
[658355 ms]  <<<  URB 57 coming back  <<< 
-- URB_FUNCTION_CONTROL_TRANSFER:
  PipeHandle           = 81c52dc0
  TransferFlags        = 0000000b (USBD_TRANSFER_DIRECTION_IN, USBD_SHORT_TRANSFER_OK)
  TransferBufferLength = 00000012
  TransferBuffer       = e2713090
  TransferBufferMDL    = 81b9af88
    00000000: 12 01 00 02 00 00 00 40 51 04 08 e0 10 01 01 02
    00000010: 00 01
  UrbLink              = 00000000
  SetupPacket          =
    00000000: 80 06 00 01 00 00 12 00
[658355 ms] UsbSnoop - DispatchAny(f890e610) : IRP_MJ_INTERNAL_DEVICE_CONTROL
[658355 ms] UsbSnoop - MyDispatchInternalIOCTL(f890fe80) : fdo=81b1aac0, Irp=822d9840, IRQL=0
[658355 ms] UsbSnoop - DispatchAny(f890e610) : IRP_MJ_INTERNAL_DEVICE_CONTROL
[658355 ms] UsbSnoop - MyDispatchInternalIOCTL(f890fe80) : fdo=81b1aac0, Irp=822d9840, IRQL=0
[658355 ms]  >>>  URB 58 going down  >>> 
-- URB_FUNCTION_RESET_PIPE:
  PipeHandle = 822e77d4 [endpoint 0x00000081]
[658355 ms] UsbSnoop - MyInternalIOCTLCompletion(f890fdb0) : fido=00000000, Irp=822d9840, Context=822deb08, IRQL=0
[658355 ms]  <<<  URB 58 coming back  <<< 
-- URB_FUNCTION_RESET_PIPE:
[658355 ms] UsbSnoop - DispatchAny(f890e610) : IRP_MJ_INTERNAL_DEVICE_CONTROL
[658355 ms] UsbSnoop - MyDispatchInternalIOCTL(f890fe80) : fdo=81b1aac0, Irp=822d9840, IRQL=0
[658355 ms]  >>>  URB 59 going down  >>> 
-- URB_FUNCTION_RESET_PIPE:
  PipeHandle = 822e77f4 [endpoint 0x00000002]
[658356 ms] UsbSnoop - MyInternalIOCTLCompletion(f890fdb0) : fido=00000000, Irp=822d9840, Context=822de5c8, IRQL=0
[658356 ms]  <<<  URB 59 coming back  <<< 
-- URB_FUNCTION_RESET_PIPE:
[659612 ms] UsbSnoop - DispatchAny(f890e610) : IRP_MJ_INTERNAL_DEVICE_CONTROL
[659612 ms] UsbSnoop - MyDispatchInternalIOCTL(f890fe80) : fdo=81b1aac0, Irp=81ae8728, IRQL=2
[659612 ms]  >>>  URB 60 going down  >>> 
-- URB_FUNCTION_BULK_OR_INTERRUPT_TRANSFER:
  PipeHandle           = 822e77f4 [endpoint 0x00000002]
  TransferFlags        = 00000000 (USBD_TRANSFER_DIRECTION_OUT, ~USBD_SHORT_TRANSFER_OK)
  TransferBufferLength = 00000009
  TransferBuffer       = 00000000
  TransferBufferMDL    = 81b9af88
    00000000: 00 00 00 04 01 00 00 04 00
  UrbLink              = 00000000
[659612 ms] UsbSnoop - MyInternalIOCTLCompletion(f890fdb0) : fido=81b19728, Irp=81ae8728, Context=8234e4d0, IRQL=2
[659612 ms]  <<<  URB 60 coming back  <<< 
-- URB_FUNCTION_BULK_OR_INTERRUPT_TRANSFER:
  PipeHandle           = 822e77f4 [endpoint 0x00000002]
  TransferFlags        = 00000000 (USBD_TRANSFER_DIRECTION_OUT, ~USBD_SHORT_TRANSFER_OK)
  TransferBufferLength = 00000009
  TransferBuffer       = 00000000
  TransferBufferMDL    = 81b9af88
  UrbLink              = 00000000
[659612 ms] UsbSnoop - DispatchAny(f890e610) : IRP_MJ_INTERNAL_DEVICE_CONTROL
[659612 ms] UsbSnoop - MyDispatchInternalIOCTL(f890fe80) : fdo=81b1aac0, Irp=81ae8728, IRQL=2
[659612 ms]  >>>  URB 61 going down  >>> 
-- URB_FUNCTION_BULK_OR_INTERRUPT_TRANSFER:
  PipeHandle           = 822e77d4 [endpoint 0x00000081]
  TransferFlags        = 00000003 (USBD_TRANSFER_DIRECTION_IN, USBD_SHORT_TRANSFER_OK)
  TransferBufferLength = 00000100
  TransferBuffer       = 00000000
  TransferBufferMDL    = 81b9af88
  UrbLink              = 00000000
[659621 ms] UsbSnoop - MyInternalIOCTLCompletion(f890fdb0) : fido=81b19728, Irp=81ae8728, Context=822deae8, IRQL=2
[659621 ms]  <<<  URB 61 coming back  <<< 
-- URB_FUNCTION_BULK_OR_INTERRUPT_TRANSFER:
  PipeHandle           = 822e77d4 [endpoint 0x00000081]
  TransferFlags        = 00000003 (USBD_TRANSFER_DIRECTION_IN, USBD_SHORT_TRANSFER_OK)
  TransferBufferLength = 00000009
  TransferBuffer       = 00000000
  TransferBufferMDL    = 81b9af88
    00000000: 00 00 00 04 02 00 00 00 fa
  UrbLink              = 00000000
[659642 ms] UsbSnoop - DispatchAny(f890e610) : IRP_MJ_INTERNAL_DEVICE_CONTROL
[659642 ms] UsbSnoop - MyDispatchInternalIOCTL(f890fe80) : fdo=81b1aac0, Irp=81ae8728, IRQL=2
[659642 ms]  >>>  URB 62 going down  >>> 
-- URB_FUNCTION_BULK_OR_INTERRUPT_TRANSFER:
  PipeHandle           = 822e77f4 [endpoint 0x00000002]
  TransferFlags        = 00000000 (USBD_TRANSFER_DIRECTION_OUT, ~USBD_SHORT_TRANSFER_OK)
  TransferBufferLength = 00000015
  TransferBuffer       = 00000000
  TransferBufferMDL    = 81b9af88
    00000000: 00 00 00 10 04 00 00 00 0a 00 01 00 03 00 01 00
    00000010: 00 00 00 07 d0
  UrbLink              = 00000000
[659642 ms] UsbSnoop - MyInternalIOCTLCompletion(f890fdb0) : fido=81b19728, Irp=81ae8728, Context=822f29c8, IRQL=2
[659642 ms]  <<<  URB 62 coming back  <<< 
-- URB_FUNCTION_BULK_OR_INTERRUPT_TRANSFER:
  PipeHandle           = 822e77f4 [endpoint 0x00000002]
  TransferFlags        = 00000000 (USBD_TRANSFER_DIRECTION_OUT, ~USBD_SHORT_TRANSFER_OK)
  TransferBufferLength = 00000015
  TransferBuffer       = 00000000
  TransferBufferMDL    = 81b9af88
  UrbLink              = 00000000
[659652 ms] UsbSnoop - DispatchAny(f890e610) : IRP_MJ_INTERNAL_DEVICE_CONTROL
[659652 ms] UsbSnoop - MyDispatchInternalIOCTL(f890fe80) : fdo=81b1aac0, Irp=81ae8728, IRQL=2
[659652 ms]  >>>  URB 63 going down  >>> 
-- URB_FUNCTION_BULK_OR_INTERRUPT_TRANSFER:
  PipeHandle           = 822e77d4 [endpoint 0x00000081]
  TransferFlags        = 00000003 (USBD_TRANSFER_DIRECTION_IN, USBD_SHORT_TRANSFER_OK)
  TransferBufferLength = 00000100
  TransferBuffer       = 00000000
  TransferBufferMDL    = 81b9af88
  UrbLink              = 00000000
[659652 ms] UsbSnoop - MyInternalIOCTLCompletion(f890fdb0) : fido=81b19728, Irp=81ae8728, Context=822deae8, IRQL=2
[659652 ms]  <<<  URB 63 coming back  <<< 
-- URB_FUNCTION_BULK_OR_INTERRUPT_TRANSFER:
  PipeHandle           = 822e77d4 [endpoint 0x00000081]
  TransferFlags        = 00000003 (USBD_TRANSFER_DIRECTION_IN, USBD_SHORT_TRANSFER_OK)
  TransferBufferLength = 00000007
  TransferBuffer       = 00000000
  TransferBufferMDL    = 81b9af88
    00000000: 00 00 00 02 05 e0 00
  UrbLink              = 00000000
[659692 ms] UsbSnoop - DispatchAny(f890e610) : IRP_MJ_INTERNAL_DEVICE_CONTROL
[659692 ms] UsbSnoop - MyDispatchInternalIOCTL(f890fe80) : fdo=81b1aac0, Irp=81ae8728, IRQL=2
[659692 ms]  >>>  URB 64 going down  >>> 
-- URB_FUNCTION_BULK_OR_INTERRUPT_TRANSFER:
  PipeHandle           = 822e77d4 [endpoint 0x00000081]
  TransferFlags        = 00000003 (USBD_TRANSFER_DIRECTION_IN, USBD_SHORT_TRANSFER_OK)
  TransferBufferLength = 00000100
  TransferBuffer       = 00000000
  TransferBufferMDL    = 81b9af88
  UrbLink              = 00000000
[659692 ms] UsbSnoop - MyInternalIOCTLCompletion(f890fdb0) : fido=81b19728, Irp=81ae8728, Context=822ca280, IRQL=2
[659692 ms]  <<<  URB 64 coming back  <<< 
-- URB_FUNCTION_BULK_OR_INTERRUPT_TRANSFER:
  PipeHandle           = 822e77d4 [endpoint 0x00000081]
  TransferFlags        = 00000003 (USBD_TRANSFER_DIRECTION_IN, USBD_SHORT_TRANSFER_OK)
  TransferBufferLength = 0000000f
  TransferBuffer       = 00000000
  TransferBufferMDL    = 81b9af88
    00000000: 00 00 00 0a 04 00 00 00 04 00 12 00 00 07 d0
  UrbLink              = 00000000
[659732 ms] UsbSnoop - DispatchAny(f890e610) : IRP_MJ_INTERNAL_DEVICE_CONTROL
[659732 ms] UsbSnoop - MyDispatchInternalIOCTL(f890fe80) : fdo=81b1aac0, Irp=81ae8728, IRQL=2
[659732 ms]  >>>  URB 65 going down  >>> 
-- URB_FUNCTION_BULK_OR_INTERRUPT_TRANSFER:
  PipeHandle           = 822e77f4 [endpoint 0x00000002]
  TransferFlags        = 00000000 (USBD_TRANSFER_DIRECTION_OUT, ~USBD_SHORT_TRANSFER_OK)
  TransferBufferLength = 00000007
  TransferBuffer       = 00000000
  TransferBufferMDL    = 81b9af88
    00000000: 00 00 00 02 05 e0 00
  UrbLink              = 00000000
[659732 ms] UsbSnoop - MyInternalIOCTLCompletion(f890fdb0) : fido=81b19728, Irp=81ae8728, Context=822deae8, IRQL=2
[659732 ms]  <<<  URB 65 coming back  <<< 
-- URB_FUNCTION_BULK_OR_INTERRUPT_TRANSFER:
  PipeHandle           = 822e77f4 [endpoint 0x00000002]
  TransferFlags        = 00000000 (USBD_TRANSFER_DIRECTION_OUT, ~USBD_SHORT_TRANSFER_OK)
  TransferBufferLength = 00000007
  TransferBuffer       = 00000000
  TransferBufferMDL    = 81b9af88
  UrbLink              = 00000000
[659742 ms] UsbSnoop - DispatchAny(f890e610) : IRP_MJ_INTERNAL_DEVICE_CONTROL
[659742 ms] UsbSnoop - MyDispatchInternalIOCTL(f890fe80) : fdo=81b1aac0, Irp=81ae8728, IRQL=2
[659742 ms]  >>>  URB 66 going down  >>> 
-- URB_FUNCTION_BULK_OR_INTERRUPT_TRANSFER:
  PipeHandle           = 822e77f4 [endpoint 0x00000002]
  TransferFlags        = 00000000 (USBD_TRANSFER_DIRECTION_OUT, ~USBD_SHORT_TRANSFER_OK)
  TransferBufferLength = 00000029
  TransferBuffer       = 00000000
  TransferBufferMDL    = 81b9af88
    00000000: 00 00 00 24 04 00 00 00 1e 00 07 00 0e 00 0b 00
    00000010: 04 00 06 00 07 00 01 00 02 00 0a 00 37 00 0d 00
    00000020: 38 00 09 00 0e 00 2d 00 03
  UrbLink              = 00000000
[659742 ms] UsbSnoop - MyInternalIOCTLCompletion(f890fdb0) : fido=81b19728, Irp=81ae8728, Context=81b0ca58, IRQL=2
[659742 ms]  <<<  URB 66 coming back  <<< 
-- URB_FUNCTION_BULK_OR_INTERRUPT_TRANSFER:
  PipeHandle           = 822e77f4 [endpoint 0x00000002]
  TransferFlags        = 00000000 (USBD_TRANSFER_DIRECTION_OUT, ~USBD_SHORT_TRANSFER_OK)
  TransferBufferLength = 00000029
  TransferBuffer       = 00000000
  TransferBufferMDL    = 81b9af88
  UrbLink              = 00000000
[659752 ms] UsbSnoop - DispatchAny(f890e610) : IRP_MJ_INTERNAL_DEVICE_CONTROL
[659752 ms] UsbSnoop - MyDispatchInternalIOCTL(f890fe80) : fdo=81b1aac0, Irp=81ae8728, IRQL=2
[659752 ms]  >>>  URB 67 going down  >>> 
-- URB_FUNCTION_BULK_OR_INTERRUPT_TRANSFER:
  PipeHandle           = 822e77d4 [endpoint 0x00000081]
  TransferFlags        = 00000003 (USBD_TRANSFER_DIRECTION_IN, USBD_SHORT_TRANSFER_OK)
  TransferBufferLength = 00000100
  TransferBuffer       = 00000000
  TransferBufferMDL    = 81b9af88
  UrbLink              = 00000000
[659753 ms] UsbSnoop - MyInternalIOCTLCompletion(f890fdb0) : fido=81b19728, Irp=81ae8728, Context=822ed328, IRQL=2
[659753 ms]  <<<  URB 67 coming back  <<< 
-- URB_FUNCTION_BULK_OR_INTERRUPT_TRANSFER:
  PipeHandle           = 822e77d4 [endpoint 0x00000081]
  TransferFlags        = 00000003 (USBD_TRANSFER_DIRECTION_IN, USBD_SHORT_TRANSFER_OK)
  TransferBufferLength = 00000007
  TransferBuffer       = 00000000
  TransferBufferMDL    = 81b9af88
    00000000: 00 00 00 02 05 e0 00
  UrbLink              = 00000000
[659792 ms] UsbSnoop - DispatchAny(f890e610) : IRP_MJ_INTERNAL_DEVICE_CONTROL
[659792 ms] UsbSnoop - MyDispatchInternalIOCTL(f890fe80) : fdo=81b1aac0, Irp=81ae8728, IRQL=2
[659792 ms]  >>>  URB 68 going down  >>> 
-- URB_FUNCTION_BULK_OR_INTERRUPT_TRANSFER:
  PipeHandle           = 822e77d4 [endpoint 0x00000081]
  TransferFlags        = 00000003 (USBD_TRANSFER_DIRECTION_IN, USBD_SHORT_TRANSFER_OK)
  TransferBufferLength = 00000100
  TransferBuffer       = 00000000
  TransferBufferMDL    = 81b9af88
  UrbLink              = 00000000
[659792 ms] UsbSnoop - MyInternalIOCTLCompletion(f890fdb0) : fido=81b19728, Irp=81ae8728, Context=822deae8, IRQL=2
[659792 ms]  <<<  URB 68 coming back  <<< 
-- URB_FUNCTION_BULK_OR_INTERRUPT_TRANSFER:
  PipeHandle           = 822e77d4 [endpoint 0x00000081]
  TransferFlags        = 00000003 (USBD_TRANSFER_DIRECTION_IN, USBD_SHORT_TRANSFER_OK)
  TransferBufferLength = 0000000f
  TransferBuffer       = 00000000
  TransferBufferMDL    = 81b9af88
    00000000: 00 00 00 0a 04 00 00 00 04 bb 00 00 01 d4 c0
  UrbLink              = 00000000
[659833 ms] UsbSnoop - DispatchAny(f890e610) : IRP_MJ_INTERNAL_DEVICE_CONTROL
[659833 ms] UsbSnoop - MyDispatchInternalIOCTL(f890fe80) : fdo=81b1aac0, Irp=81ae8728, IRQL=2
[659833 ms]  >>>  URB 69 going down  >>> 
-- URB_FUNCTION_BULK_OR_INTERRUPT_TRANSFER:
  PipeHandle           = 822e77f4 [endpoint 0x00000002]
  TransferFlags        = 00000000 (USBD_TRANSFER_DIRECTION_OUT, ~USBD_SHORT_TRANSFER_OK)
  TransferBufferLength = 00000007
  TransferBuffer       = 00000000
  TransferBufferMDL    = 81b9af88
    00000000: 00 00 00 02 05 e0 00
  UrbLink              = 00000000
[659833 ms] UsbSnoop - MyInternalIOCTLCompletion(f890fdb0) : fido=81b19728, Irp=81ae8728, Context=822ed328, IRQL=2
[659833 ms]  <<<  URB 69 coming back  <<< 
-- URB_FUNCTION_BULK_OR_INTERRUPT_TRANSFER:
  PipeHandle           = 822e77f4 [endpoint 0x00000002]
  TransferFlags        = 00000000 (USBD_TRANSFER_DIRECTION_OUT, ~USBD_SHORT_TRANSFER_OK)
  TransferBufferLength = 00000007
  TransferBuffer       = 00000000
  TransferBufferMDL    = 81b9af88
  UrbLink              = 00000000
[659842 ms] UsbSnoop - DispatchAny(f890e610) : IRP_MJ_INTERNAL_DEVICE_CONTROL
[659842 ms] UsbSnoop - MyDispatchInternalIOCTL(f890fe80) : fdo=81b1aac0, Irp=81ae8728, IRQL=2
[659842 ms]  >>>  URB 70 going down  >>> 
-- URB_FUNCTION_BULK_OR_INTERRUPT_TRANSFER:
  PipeHandle           = 822e77d4 [endpoint 0x00000081]
  TransferFlags        = 00000003 (USBD_TRANSFER_DIRECTION_IN, USBD_SHORT_TRANSFER_OK)
  TransferBufferLength = 00000100
  TransferBuffer       = 00000000
  TransferBufferMDL    = 81b9af88
  UrbLink              = 00000000
[659903 ms] UsbSnoop - MyInternalIOCTLCompletion(f890fdb0) : fido=81b19728, Irp=81ae8728, Context=822e2150, IRQL=2
[659903 ms]  <<<  URB 70 coming back  <<< 
-- URB_FUNCTION_BULK_OR_INTERRUPT_TRANSFER:
  PipeHandle           = 822e77d4 [endpoint 0x00000081]
  TransferFlags        = 00000003 (USBD_TRANSFER_DIRECTION_IN, USBD_SHORT_TRANSFER_OK)
  TransferBufferLength = 00000095
  TransferBuffer       = 00000000
  TransferBufferMDL    = 81b9af88
    00000000: 00 00 00 90 04 00 00 00 8a 00 08 00 0e 00 0b 00
    00000010: 00 04 00 02 28 00 00 04 00 00 02 00 03 00 06 00
    00000020: 00 01 09 00 07 00 00 01 01 00 01 00 00 04 00 00
    00000030: 00 0a 00 02 00 00 19 54 49 2d 38 34 20 50 6c 75
    00000040: 73 20 53 69 6c 76 65 72 20 45 64 69 74 69 6f 6e
    00000050: 00 0a 00 00 01 01 00 37 00 00 01 01 00 0d 00 00
    00000060: 08 00 00 00 00 00 00 5e fd 00 38 00 00 01 00 00
    00000070: 09 00 00 04 00 01 00 00 00 0e 00 00 08 00 00 00
    00000080: 00 00 00 5e d0 00 2d 00 00 01 01 00 03 00 00 05
    00000090: 0a 32 cc e3 01
  UrbLink              = 00000000
[659953 ms] UsbSnoop - DispatchAny(f890e610) : IRP_MJ_INTERNAL_DEVICE_CONTROL
[659953 ms] UsbSnoop - MyDispatchInternalIOCTL(f890fe80) : fdo=81b1aac0, Irp=81ae8728, IRQL=2
[659953 ms]  >>>  URB 71 going down  >>> 
-- URB_FUNCTION_BULK_OR_INTERRUPT_TRANSFER:
  PipeHandle           = 822e77f4 [endpoint 0x00000002]
  TransferFlags        = 00000000 (USBD_TRANSFER_DIRECTION_OUT, ~USBD_SHORT_TRANSFER_OK)
  TransferBufferLength = 00000007
  TransferBuffer       = 00000000
  TransferBufferMDL    = 81b9af88
    00000000: 00 00 00 02 05 e0 00
  UrbLink              = 00000000
[659954 ms] UsbSnoop - MyInternalIOCTLCompletion(f890fdb0) : fido=81b19728, Irp=81ae8728, Context=822deae8, IRQL=2
[659954 ms]  <<<  URB 71 coming back  <<< 
-- URB_FUNCTION_BULK_OR_INTERRUPT_TRANSFER:
  PipeHandle           = 822e77f4 [endpoint 0x00000002]
  TransferFlags        = 00000000 (USBD_TRANSFER_DIRECTION_OUT, ~USBD_SHORT_TRANSFER_OK)
  TransferBufferLength = 00000007
  TransferBuffer       = 00000000
  TransferBufferMDL    = 81b9af88
  UrbLink              = 00000000
[660213 ms] UsbSnoop - DispatchAny(f890e610) : IRP_MJ_INTERNAL_DEVICE_CONTROL
[660213 ms] UsbSnoop - MyDispatchInternalIOCTL(f890fe80) : fdo=81b1aac0, Irp=81ae8728, IRQL=2
[660213 ms]  >>>  URB 72 going down  >>> 
-- URB_FUNCTION_BULK_OR_INTERRUPT_TRANSFER:
  PipeHandle           = 822e77f4 [endpoint 0x00000002]
  TransferFlags        = 00000000 (USBD_TRANSFER_DIRECTION_OUT, ~USBD_SHORT_TRANSFER_OK)
  TransferBufferLength = 00000009
  TransferBuffer       = 00000000
  TransferBufferMDL    = 81b9af88
    00000000: 00 00 00 04 01 00 00 04 00
  UrbLink              = 00000000
[660213 ms] UsbSnoop - MyInternalIOCTLCompletion(f890fdb0) : fido=81b19728, Irp=81ae8728, Context=822f29c8, IRQL=2
[660213 ms]  <<<  URB 72 coming back  <<< 
-- URB_FUNCTION_BULK_OR_INTERRUPT_TRANSFER:
  PipeHandle           = 822e77f4 [endpoint 0x00000002]
  TransferFlags        = 00000000 (USBD_TRANSFER_DIRECTION_OUT, ~USBD_SHORT_TRANSFER_OK)
  TransferBufferLength = 00000009
  TransferBuffer       = 00000000
  TransferBufferMDL    = 81b9af88
  UrbLink              = 00000000
[660213 ms] UsbSnoop - DispatchAny(f890e610) : IRP_MJ_INTERNAL_DEVICE_CONTROL
[660213 ms] UsbSnoop - MyDispatchInternalIOCTL(f890fe80) : fdo=81b1aac0, Irp=81ae8728, IRQL=2
[660213 ms]  >>>  URB 73 going down  >>> 
-- URB_FUNCTION_BULK_OR_INTERRUPT_TRANSFER:
  PipeHandle           = 822e77d4 [endpoint 0x00000081]
  TransferFlags        = 00000003 (USBD_TRANSFER_DIRECTION_IN, USBD_SHORT_TRANSFER_OK)
  TransferBufferLength = 00000100
  TransferBuffer       = 00000000
  TransferBufferMDL    = 81b9af88
  UrbLink              = 00000000
[660225 ms] UsbSnoop - MyInternalIOCTLCompletion(f890fdb0) : fido=81b19728, Irp=81ae8728, Context=822e2150, IRQL=2
[660225 ms]  <<<  URB 73 coming back  <<< 
-- URB_FUNCTION_BULK_OR_INTERRUPT_TRANSFER:
  PipeHandle           = 822e77d4 [endpoint 0x00000081]
  TransferFlags        = 00000003 (USBD_TRANSFER_DIRECTION_IN, USBD_SHORT_TRANSFER_OK)
  TransferBufferLength = 00000009
  TransferBuffer       = 00000000
  TransferBufferMDL    = 81b9af88
    00000000: 00 00 00 04 02 00 00 00 fa
  UrbLink              = 00000000
[660253 ms] UsbSnoop - DispatchAny(f890e610) : IRP_MJ_INTERNAL_DEVICE_CONTROL
[660253 ms] UsbSnoop - MyDispatchInternalIOCTL(f890fe80) : fdo=81b1aac0, Irp=81ae8728, IRQL=2
[660253 ms]  >>>  URB 74 going down  >>> 
-- URB_FUNCTION_BULK_OR_INTERRUPT_TRANSFER:
  PipeHandle           = 822e77f4 [endpoint 0x00000002]
  TransferFlags        = 00000000 (USBD_TRANSFER_DIRECTION_OUT, ~USBD_SHORT_TRANSFER_OK)
  TransferBufferLength = 00000015
  TransferBuffer       = 00000000
  TransferBufferMDL    = 81b9af88
    00000000: 00 00 00 10 04 00 00 00 0a 00 01 00 03 00 01 00
    00000010: 00 00 00 07 d0
  UrbLink              = 00000000
[660253 ms] UsbSnoop - MyInternalIOCTLCompletion(f890fdb0) : fido=81b19728, Irp=81ae8728, Context=822deae8, IRQL=2
[660253 ms]  <<<  URB 74 coming back  <<< 
-- URB_FUNCTION_BULK_OR_INTERRUPT_TRANSFER:
  PipeHandle           = 822e77f4 [endpoint 0x00000002]
  TransferFlags        = 00000000 (USBD_TRANSFER_DIRECTION_OUT, ~USBD_SHORT_TRANSFER_OK)
  TransferBufferLength = 00000015
  TransferBuffer       = 00000000
  TransferBufferMDL    = 81b9af88
  UrbLink              = 00000000
[660263 ms] UsbSnoop - DispatchAny(f890e610) : IRP_MJ_INTERNAL_DEVICE_CONTROL
[660263 ms] UsbSnoop - MyDispatchInternalIOCTL(f890fe80) : fdo=81b1aac0, Irp=81ae8728, IRQL=2
[660263 ms]  >>>  URB 75 going down  >>> 
-- URB_FUNCTION_BULK_OR_INTERRUPT_TRANSFER:
  PipeHandle           = 822e77d4 [endpoint 0x00000081]
  TransferFlags        = 00000003 (USBD_TRANSFER_DIRECTION_IN, USBD_SHORT_TRANSFER_OK)
  TransferBufferLength = 00000100
  TransferBuffer       = 00000000
  TransferBufferMDL    = 81b9af88
  UrbLink              = 00000000
[660263 ms] UsbSnoop - MyInternalIOCTLCompletion(f890fdb0) : fido=81b19728, Irp=81ae8728, Context=822e2150, IRQL=2
[660263 ms]  <<<  URB 75 coming back  <<< 
-- URB_FUNCTION_BULK_OR_INTERRUPT_TRANSFER:
  PipeHandle           = 822e77d4 [endpoint 0x00000081]
  TransferFlags        = 00000003 (USBD_TRANSFER_DIRECTION_IN, USBD_SHORT_TRANSFER_OK)
  TransferBufferLength = 00000007
  TransferBuffer       = 00000000
  TransferBufferMDL    = 81b9af88
    00000000: 00 00 00 02 05 e0 00
  UrbLink              = 00000000
[660303 ms] UsbSnoop - DispatchAny(f890e610) : IRP_MJ_INTERNAL_DEVICE_CONTROL
[660303 ms] UsbSnoop - MyDispatchInternalIOCTL(f890fe80) : fdo=81b1aac0, Irp=81ae8728, IRQL=2
[660303 ms]  >>>  URB 76 going down  >>> 
-- URB_FUNCTION_BULK_OR_INTERRUPT_TRANSFER:
  PipeHandle           = 822e77d4 [endpoint 0x00000081]
  TransferFlags        = 00000003 (USBD_TRANSFER_DIRECTION_IN, USBD_SHORT_TRANSFER_OK)
  TransferBufferLength = 00000100
  TransferBuffer       = 00000000
  TransferBufferMDL    = 81b9af88
  UrbLink              = 00000000
[660303 ms] UsbSnoop - MyInternalIOCTLCompletion(f890fdb0) : fido=81b19728, Irp=81ae8728, Context=81b0ca58, IRQL=2
[660303 ms]  <<<  URB 76 coming back  <<< 
-- URB_FUNCTION_BULK_OR_INTERRUPT_TRANSFER:
  PipeHandle           = 822e77d4 [endpoint 0x00000081]
  TransferFlags        = 00000003 (USBD_TRANSFER_DIRECTION_IN, USBD_SHORT_TRANSFER_OK)
  TransferBufferLength = 0000000f
  TransferBuffer       = 00000000
  TransferBufferMDL    = 81b9af88
    00000000: 00 00 00 0a 04 00 00 00 04 00 12 00 00 07 d0
  UrbLink              = 00000000
[660343 ms] UsbSnoop - DispatchAny(f890e610) : IRP_MJ_INTERNAL_DEVICE_CONTROL
[660343 ms] UsbSnoop - MyDispatchInternalIOCTL(f890fe80) : fdo=81b1aac0, Irp=81ae8728, IRQL=2
[660343 ms]  >>>  URB 77 going down  >>> 
-- URB_FUNCTION_BULK_OR_INTERRUPT_TRANSFER:
  PipeHandle           = 822e77f4 [endpoint 0x00000002]
  TransferFlags        = 00000000 (USBD_TRANSFER_DIRECTION_OUT, ~USBD_SHORT_TRANSFER_OK)
  TransferBufferLength = 00000007
  TransferBuffer       = 00000000
  TransferBufferMDL    = 81b9af88
    00000000: 00 00 00 02 05 e0 00
  UrbLink              = 00000000
[660343 ms] UsbSnoop - MyInternalIOCTLCompletion(f890fdb0) : fido=81b19728, Irp=81ae8728, Context=822f29c8, IRQL=2
[660343 ms]  <<<  URB 77 coming back  <<< 
-- URB_FUNCTION_BULK_OR_INTERRUPT_TRANSFER:
  PipeHandle           = 822e77f4 [endpoint 0x00000002]
  TransferFlags        = 00000000 (USBD_TRANSFER_DIRECTION_OUT, ~USBD_SHORT_TRANSFER_OK)
  TransferBufferLength = 00000007
  TransferBuffer       = 00000000
  TransferBufferMDL    = 81b9af88
  UrbLink              = 00000000
[660353 ms] UsbSnoop - DispatchAny(f890e610) : IRP_MJ_INTERNAL_DEVICE_CONTROL
[660353 ms] UsbSnoop - MyDispatchInternalIOCTL(f890fe80) : fdo=81b1aac0, Irp=81ae8728, IRQL=2
[660353 ms]  >>>  URB 78 going down  >>> 
-- URB_FUNCTION_BULK_OR_INTERRUPT_TRANSFER:
  PipeHandle           = 822e77f4 [endpoint 0x00000002]
  TransferFlags        = 00000000 (USBD_TRANSFER_DIRECTION_OUT, ~USBD_SHORT_TRANSFER_OK)
  TransferBufferLength = 0000000f
  TransferBuffer       = 00000000
  TransferBufferMDL    = 81b9af88
    00000000: 00 00 00 0a 04 00 00 00 04 00 07 00 01 00 31
  UrbLink              = 00000000
[660353 ms] UsbSnoop - MyInternalIOCTLCompletion(f890fdb0) : fido=81b19728, Irp=81ae8728, Context=822e2150, IRQL=2
[660353 ms]  <<<  URB 78 coming back  <<< 
-- URB_FUNCTION_BULK_OR_INTERRUPT_TRANSFER:
  PipeHandle           = 822e77f4 [endpoint 0x00000002]
  TransferFlags        = 00000000 (USBD_TRANSFER_DIRECTION_OUT, ~USBD_SHORT_TRANSFER_OK)
  TransferBufferLength = 0000000f
  TransferBuffer       = 00000000
  TransferBufferMDL    = 81b9af88
  UrbLink              = 00000000
[660363 ms] UsbSnoop - DispatchAny(f890e610) : IRP_MJ_INTERNAL_DEVICE_CONTROL
[660363 ms] UsbSnoop - MyDispatchInternalIOCTL(f890fe80) : fdo=81b1aac0, Irp=81ae8728, IRQL=2
[660363 ms]  >>>  URB 79 going down  >>> 
-- URB_FUNCTION_BULK_OR_INTERRUPT_TRANSFER:
  PipeHandle           = 822e77d4 [endpoint 0x00000081]
  TransferFlags        = 00000003 (USBD_TRANSFER_DIRECTION_IN, USBD_SHORT_TRANSFER_OK)
  TransferBufferLength = 00000100
  TransferBuffer       = 00000000
  TransferBufferMDL    = 81b9af88
  UrbLink              = 00000000
[660364 ms] UsbSnoop - MyInternalIOCTLCompletion(f890fdb0) : fido=81b19728, Irp=81ae8728, Context=81b0ca58, IRQL=2
[660364 ms]  <<<  URB 79 coming back  <<< 
-- URB_FUNCTION_BULK_OR_INTERRUPT_TRANSFER:
  PipeHandle           = 822e77d4 [endpoint 0x00000081]
  TransferFlags        = 00000003 (USBD_TRANSFER_DIRECTION_IN, USBD_SHORT_TRANSFER_OK)
  TransferBufferLength = 00000007
  TransferBuffer       = 00000000
  TransferBufferMDL    = 81b9af88
    00000000: 00 00 00 02 05 e0 00
  UrbLink              = 00000000
[660403 ms] UsbSnoop - DispatchAny(f890e610) : IRP_MJ_INTERNAL_DEVICE_CONTROL
[660403 ms] UsbSnoop - MyDispatchInternalIOCTL(f890fe80) : fdo=81b1aac0, Irp=81ae8728, IRQL=2
[660403 ms]  >>>  URB 80 going down  >>> 
-- URB_FUNCTION_BULK_OR_INTERRUPT_TRANSFER:
  PipeHandle           = 822e77d4 [endpoint 0x00000081]
  TransferFlags        = 00000003 (USBD_TRANSFER_DIRECTION_IN, USBD_SHORT_TRANSFER_OK)
  TransferBufferLength = 00000100
  TransferBuffer       = 00000000
  TransferBufferMDL    = 81b9af88
  UrbLink              = 00000000
[660403 ms] UsbSnoop - MyInternalIOCTLCompletion(f890fdb0) : fido=81b19728, Irp=81ae8728, Context=822ca280, IRQL=2
[660403 ms]  <<<  URB 80 coming back  <<< 
-- URB_FUNCTION_BULK_OR_INTERRUPT_TRANSFER:
  PipeHandle           = 822e77d4 [endpoint 0x00000081]
  TransferFlags        = 00000003 (USBD_TRANSFER_DIRECTION_IN, USBD_SHORT_TRANSFER_OK)
  TransferBufferLength = 0000000f
  TransferBuffer       = 00000000
  TransferBufferMDL    = 81b9af88
    00000000: 00 00 00 0a 04 00 00 00 04 bb 00 00 01 d4 c0
  UrbLink              = 00000000
[660443 ms] UsbSnoop - DispatchAny(f890e610) : IRP_MJ_INTERNAL_DEVICE_CONTROL
[660443 ms] UsbSnoop - MyDispatchInternalIOCTL(f890fe80) : fdo=81b1aac0, Irp=81ae8728, IRQL=2
[660443 ms]  >>>  URB 81 going down  >>> 
-- URB_FUNCTION_BULK_OR_INTERRUPT_TRANSFER:
  PipeHandle           = 822e77f4 [endpoint 0x00000002]
  TransferFlags        = 00000000 (USBD_TRANSFER_DIRECTION_OUT, ~USBD_SHORT_TRANSFER_OK)
  TransferBufferLength = 00000007
  TransferBuffer       = 00000000
  TransferBufferMDL    = 81b9af88
    00000000: 00 00 00 02 05 e0 00
  UrbLink              = 00000000
[660443 ms] UsbSnoop - MyInternalIOCTLCompletion(f890fdb0) : fido=81b19728, Irp=81ae8728, Context=81b0ca58, IRQL=2
[660443 ms]  <<<  URB 81 coming back  <<< 
-- URB_FUNCTION_BULK_OR_INTERRUPT_TRANSFER:
  PipeHandle           = 822e77f4 [endpoint 0x00000002]
  TransferFlags        = 00000000 (USBD_TRANSFER_DIRECTION_OUT, ~USBD_SHORT_TRANSFER_OK)
  TransferBufferLength = 00000007
  TransferBuffer       = 00000000
  TransferBufferMDL    = 81b9af88
  UrbLink              = 00000000
[660453 ms] UsbSnoop - DispatchAny(f890e610) : IRP_MJ_INTERNAL_DEVICE_CONTROL
[660453 ms] UsbSnoop - MyDispatchInternalIOCTL(f890fe80) : fdo=81b1aac0, Irp=81ae8728, IRQL=2
[660453 ms]  >>>  URB 82 going down  >>> 
-- URB_FUNCTION_BULK_OR_INTERRUPT_TRANSFER:
  PipeHandle           = 822e77d4 [endpoint 0x00000081]
  TransferFlags        = 00000003 (USBD_TRANSFER_DIRECTION_IN, USBD_SHORT_TRANSFER_OK)
  TransferBufferLength = 00000100
  TransferBuffer       = 00000000
  TransferBufferMDL    = 81b9af88
  UrbLink              = 00000000
[669006 ms] UsbSnoop - MyInternalIOCTLCompletion(f890fdb0) : fido=81b19728, Irp=81ae8728, Context=822deae8, IRQL=2
[669006 ms]  <<<  URB 82 coming back  <<< 
-- URB_FUNCTION_BULK_OR_INTERRUPT_TRANSFER:
  PipeHandle           = 822e77d4 [endpoint 0x00000081]
  TransferFlags        = 00000003 (USBD_TRANSFER_DIRECTION_IN, USBD_SHORT_TRANSFER_OK)
  TransferBufferLength = 000000ff
  TransferBuffer       = 00000000
  TransferBufferMDL    = 81b9af88
    00000000: 00 00 00 fa 03 00 00 04 6e 00 08 00 01 00 31 00
    00000010: 04 67 0a 15 0a 32 cc e3 01 0a 2d 40 00 00 00 00
    00000020: 00 00 00 00 00 00 00 00 00 00 00 00 00 00 00 00
    00000030: 00 00 00 00 00 00 00 00 00 00 00 00 00 00 00 00
    00000040: 00 00 00 00 00 00 00 00 00 00 00 00 00 00 00 00
    00000050: 00 00 00 00 00 00 00 00 00 00 00 00 04 12 21 18
    00000060: 03 26 09 04 0b d4 31 b0 02 0d 40 a4 f7 87 78 b9
    00000070: da 56 1a 21 97 57 2e 90 de 87 7a 0b 6c 5f 63 2c
    00000080: 01 8a 32 17 9b 65 73 af b1 a1 1b 2f 0c 0b 67 b8
    00000090: f7 84 22 44 04 bd 33 76 f8 06 2e 82 57 ff 63 a1
    000000a0: c9 27 8e f4 46 8e b1 ea 96 c3 9a 80 0f 00 00 00
    000000b0: 00 80 11 0a 80 21 02 80 31 28 80 a1 03 80 81 12
    000000c0: 80 7f 00 00 00 00 80 0f 00 00 6c 24 80 12 01 04
    000000d0: 80 21 01 80 31 01 80 48 43 42 4c 45 78 70 6d 74
    000000e0: 80 81 02 80 90 03 26 09 04 05 39 d3 85 02 0d 40
    000000f0: 2b 80 80 bf f0 a4 96 2e 7b 40 eb cf 73 9d a7
  UrbLink              = 00000000
[669049 ms] UsbSnoop - DispatchAny(f890e610) : IRP_MJ_INTERNAL_DEVICE_CONTROL
[669049 ms] UsbSnoop - MyDispatchInternalIOCTL(f890fe80) : fdo=81b1aac0, Irp=81ae8728, IRQL=2
[669049 ms]  >>>  URB 83 going down  >>> 
-- URB_FUNCTION_BULK_OR_INTERRUPT_TRANSFER:
  PipeHandle           = 822e77f4 [endpoint 0x00000002]
  TransferFlags        = 00000000 (USBD_TRANSFER_DIRECTION_OUT, ~USBD_SHORT_TRANSFER_OK)
  TransferBufferLength = 00000007
  TransferBuffer       = 00000000
  TransferBufferMDL    = 81b9af88
    00000000: 00 00 00 02 05 e0 00
  UrbLink              = 00000000
[669049 ms] UsbSnoop - MyInternalIOCTLCompletion(f890fdb0) : fido=81b19728, Irp=81ae8728, Context=81b05970, IRQL=2
[669049 ms]  <<<  URB 83 coming back  <<< 
-- URB_FUNCTION_BULK_OR_INTERRUPT_TRANSFER:
  PipeHandle           = 822e77f4 [endpoint 0x00000002]
  TransferFlags        = 00000000 (USBD_TRANSFER_DIRECTION_OUT, ~USBD_SHORT_TRANSFER_OK)
  TransferBufferLength = 00000007
  TransferBuffer       = 00000000
  TransferBufferMDL    = 81b9af88
  UrbLink              = 00000000
[669057 ms] UsbSnoop - DispatchAny(f890e610) : IRP_MJ_INTERNAL_DEVICE_CONTROL
[669057 ms] UsbSnoop - MyDispatchInternalIOCTL(f890fe80) : fdo=81b1aac0, Irp=81ae8728, IRQL=2
[669057 ms]  >>>  URB 84 going down  >>> 
-- URB_FUNCTION_BULK_OR_INTERRUPT_TRANSFER:
  PipeHandle           = 822e77d4 [endpoint 0x00000081]
  TransferFlags        = 00000003 (USBD_TRANSFER_DIRECTION_IN, USBD_SHORT_TRANSFER_OK)
  TransferBufferLength = 00000100
  TransferBuffer       = 00000000
  TransferBufferMDL    = 81b9af88
  UrbLink              = 00000000
[669080 ms] UsbSnoop - MyInternalIOCTLCompletion(f890fdb0) : fido=81b19728, Irp=81ae8728, Context=822deae8, IRQL=2
[669080 ms]  <<<  URB 84 coming back  <<< 
-- URB_FUNCTION_BULK_OR_INTERRUPT_TRANSFER:
  PipeHandle           = 822e77d4 [endpoint 0x00000081]
  TransferFlags        = 00000003 (USBD_TRANSFER_DIRECTION_IN, USBD_SHORT_TRANSFER_OK)
  TransferBufferLength = 000000ff
  TransferBuffer       = 00000000
  TransferBufferMDL    = 81b9af88
    00000000: 00 00 00 fa 03 9e ed 50 e1 60 26 bb f9 0f a4 20
    00000010: 2c 65 f3 0c 4c bc 85 be b9 9a af 73 54 bb bd 67
    00000020: f6 f9 9e 4a bd 5b 2f 3a 75 c2 50 cd 7a c7 07 30
    00000030: b5 aa 40 f0 1e 90 80 7f 00 00 00 00 02 0d 40 ad
    00000040: 9b d6 89 35 66 67 aa d3 23 39 d1 3d 55 0f 30 68
    00000050: 58 a7 ae e9 89 bd c2 2d a6 48 a4 0b ba 55 a1 d7
    00000060: 8b ac 39 fe 5c 8a 16 a1 38 f9 e8 55 62 a0 95 c5
    00000070: 95 ef d2 a2 58 ae 08 22 89 79 62 75 eb fc 13 ff
    00000080: ff ff ff ff ff ff ff ff ff ff ff ff ff ff ff ff
    00000090: ff ff ff ff ff ff ff ff ff ff ff ff ff ff ff ff
    000000a0: ff ff ff ff ff ff ff ff ff ff ff ff ff ff ff ff
    000000b0: ff ff ff ff ff ff ff ff ff ff ff ff ff ff ff ff
    000000c0: ff ff ff ff ff ff ff ff ff ff ff ff ff ff ff ff
    000000d0: ff ff ff ff ff ff ff ff ff ff ff ff ff ff ff ff
    000000e0: ff ff ff ff ff ff ff ff ff ff ff ff ff ff ff ff
    000000f0: ff ff ff ff ff ff ff ff ff ff ff ff ff ff ff
  UrbLink              = 00000000
[669117 ms] UsbSnoop - DispatchAny(f890e610) : IRP_MJ_INTERNAL_DEVICE_CONTROL
[669117 ms] UsbSnoop - MyDispatchInternalIOCTL(f890fe80) : fdo=81b1aac0, Irp=81ae8728, IRQL=2
[669117 ms]  >>>  URB 85 going down  >>> 
-- URB_FUNCTION_BULK_OR_INTERRUPT_TRANSFER:
  PipeHandle           = 822e77f4 [endpoint 0x00000002]
  TransferFlags        = 00000000 (USBD_TRANSFER_DIRECTION_OUT, ~USBD_SHORT_TRANSFER_OK)
  TransferBufferLength = 00000007
  TransferBuffer       = 00000000
  TransferBufferMDL    = 81b9af88
    00000000: 00 00 00 02 05 e0 00
  UrbLink              = 00000000
[669117 ms] UsbSnoop - MyInternalIOCTLCompletion(f890fdb0) : fido=81b19728, Irp=81ae8728, Context=81cd51b0, IRQL=2
[669117 ms]  <<<  URB 85 coming back  <<< 
-- URB_FUNCTION_BULK_OR_INTERRUPT_TRANSFER:
  PipeHandle           = 822e77f4 [endpoint 0x00000002]
  TransferFlags        = 00000000 (USBD_TRANSFER_DIRECTION_OUT, ~USBD_SHORT_TRANSFER_OK)
  TransferBufferLength = 00000007
  TransferBuffer       = 00000000
  TransferBufferMDL    = 81b9af88
  UrbLink              = 00000000
[669127 ms] UsbSnoop - DispatchAny(f890e610) : IRP_MJ_INTERNAL_DEVICE_CONTROL
[669127 ms] UsbSnoop - MyDispatchInternalIOCTL(f890fe80) : fdo=81b1aac0, Irp=81ae8728, IRQL=2
[669127 ms]  >>>  URB 86 going down  >>> 
-- URB_FUNCTION_BULK_OR_INTERRUPT_TRANSFER:
  PipeHandle           = 822e77d4 [endpoint 0x00000081]
  TransferFlags        = 00000003 (USBD_TRANSFER_DIRECTION_IN, USBD_SHORT_TRANSFER_OK)
  TransferBufferLength = 00000100
  TransferBuffer       = 00000000
  TransferBufferMDL    = 81b9af88
  UrbLink              = 00000000
[669148 ms] UsbSnoop - MyInternalIOCTLCompletion(f890fdb0) : fido=81b19728, Irp=81ae8728, Context=822deae8, IRQL=2
[669148 ms]  <<<  URB 86 coming back  <<< 
-- URB_FUNCTION_BULK_OR_INTERRUPT_TRANSFER:
  PipeHandle           = 822e77d4 [endpoint 0x00000081]
  TransferFlags        = 00000003 (USBD_TRANSFER_DIRECTION_IN, USBD_SHORT_TRANSFER_OK)
  TransferBufferLength = 000000ff
  TransferBuffer       = 00000000
  TransferBufferMDL    = 81b9af88
    00000000: 00 00 00 fa 03 ff ff ff ff ff ff ff ff ff ff ff
    00000010: ff ff ff ff ff ff ff ff ff ff ff ff ff ff ff ff
    00000020: ff ff ff ff ff ff ff ff ff ff ff ff ff ff ff ff
    00000030: ff ff ff ff ff ff ff ff ff ff ff ff ff ff ff ff
    00000040: ff ff ff ff ff ff ff ff ff ff ff ff ff ff ff ff
    00000050: ff ff ff ff ff ff ff ff ff ff ff ff ff ff ff ff
    00000060: ff ff ff ff ff ff ff ff ff ff ff ff ff ff ff ff
    00000070: ff ff ff ff ff ff ff ff ff ff ff ff ff ff ff ff
    00000080: ff ff ff ff ff ff ff ff ff ff ff ff ff ff ff ff
    00000090: ff ff ff ff ff ff ff ff ff ff ff ff ff ff ff ff
    000000a0: ff ff ff ff ff ff ff ff ff ff ff ff ff ff ff ff
    000000b0: ff ff ff ff ff ff ff ff ff ff ff ff ff ff ff ff
    000000c0: ff ff ff ff ff ff ff ff ff ff ff ff ff ff ff ff
    000000d0: ff ff ff ff ff 80 00 ff ff ff ff ff ff ff ff ff
    000000e0: ff ff ff ff ff ff ff ff ff ff ff ff ff ff ff ff
    000000f0: ff ff ff ff ff ff ff ff ff ff ff ff ff ff ff
  UrbLink              = 00000000
[669187 ms] UsbSnoop - DispatchAny(f890e610) : IRP_MJ_INTERNAL_DEVICE_CONTROL
[669187 ms] UsbSnoop - MyDispatchInternalIOCTL(f890fe80) : fdo=81b1aac0, Irp=81ae8728, IRQL=2
[669187 ms]  >>>  URB 87 going down  >>> 
-- URB_FUNCTION_BULK_OR_INTERRUPT_TRANSFER:
  PipeHandle           = 822e77f4 [endpoint 0x00000002]
  TransferFlags        = 00000000 (USBD_TRANSFER_DIRECTION_OUT, ~USBD_SHORT_TRANSFER_OK)
  TransferBufferLength = 00000007
  TransferBuffer       = 00000000
  TransferBufferMDL    = 81b9af88
    00000000: 00 00 00 02 05 e0 00
  UrbLink              = 00000000
[669187 ms] UsbSnoop - MyInternalIOCTLCompletion(f890fdb0) : fido=81b19728, Irp=81ae8728, Context=81b0cd78, IRQL=2
[669187 ms]  <<<  URB 87 coming back  <<< 
-- URB_FUNCTION_BULK_OR_INTERRUPT_TRANSFER:
  PipeHandle           = 822e77f4 [endpoint 0x00000002]
  TransferFlags        = 00000000 (USBD_TRANSFER_DIRECTION_OUT, ~USBD_SHORT_TRANSFER_OK)
  TransferBufferLength = 00000007
  TransferBuffer       = 00000000
  TransferBufferMDL    = 81b9af88
  UrbLink              = 00000000
[669197 ms] UsbSnoop - DispatchAny(f890e610) : IRP_MJ_INTERNAL_DEVICE_CONTROL
[669197 ms] UsbSnoop - MyDispatchInternalIOCTL(f890fe80) : fdo=81b1aac0, Irp=81ae8728, IRQL=2
[669197 ms]  >>>  URB 88 going down  >>> 
-- URB_FUNCTION_BULK_OR_INTERRUPT_TRANSFER:
  PipeHandle           = 822e77d4 [endpoint 0x00000081]
  TransferFlags        = 00000003 (USBD_TRANSFER_DIRECTION_IN, USBD_SHORT_TRANSFER_OK)
  TransferBufferLength = 00000100
  TransferBuffer       = 00000000
  TransferBufferMDL    = 81b9af88
  UrbLink              = 00000000
[669218 ms] UsbSnoop - MyInternalIOCTLCompletion(f890fdb0) : fido=81b19728, Irp=81ae8728, Context=822deb30, IRQL=2
[669218 ms]  <<<  URB 88 coming back  <<< 
-- URB_FUNCTION_BULK_OR_INTERRUPT_TRANSFER:
  PipeHandle           = 822e77d4 [endpoint 0x00000081]
  TransferFlags        = 00000003 (USBD_TRANSFER_DIRECTION_IN, USBD_SHORT_TRANSFER_OK)
  TransferBufferLength = 000000ff
  TransferBuffer       = 00000000
  TransferBufferMDL    = 81b9af88
    00000000: 00 00 00 fa 03 ff ff ff ff ff ff ff ff ff ff ff
    00000010: ff ff ff ff ff ff ff ff ff ff ff ff ff ff ff ff
    00000020: ff ff ff ff ff ff ff ff ff ff ff ff ff ff ff ff
    00000030: ff ff ff ff ff ff ff ff ff ff ff ff ff ff ff ff
    00000040: ff ff ff ff ff ff ff ff ff ff ff ff ff ff ff ff
    00000050: ff ff ff ff ff ff ff ff ff ff ff ff ff ff ff ff
    00000060: ff ff ff ff ff ff ff ff ff ff ff ff ff ff ff ff
    00000070: ff ff ff ff ff ff ff ff ff ff ff ff ff ff ff ff
    00000080: ff ff ff ff ff ff ff ff ff ff ff ff ff ff ff ff
    00000090: ff ff ff ff ff ff ff ff ff ff ff ff ff ff ff ff
    000000a0: ff ff ff ff ff ff ff ff ff ff ff ff ff ff ff ff
    000000b0: ff ff ff ff ff ff ff ff ff ff ff ff ff ff ff ff
    000000c0: ff ff ff ff ff ff ff ff ff ff ff ff ff ff ff ff
    000000d0: ff ff ff ff ff ff ff ff ff ff ff ff ff ff ff ff
    000000e0: ff ff ff ff ff ff ff ff ff ff ff ff ff ff ff ff
    000000f0: ff ff ff ff ff ff ff ff ff ff ff ff ff ff ff
  UrbLink              = 00000000
[669257 ms] UsbSnoop - DispatchAny(f890e610) : IRP_MJ_INTERNAL_DEVICE_CONTROL
[669257 ms] UsbSnoop - MyDispatchInternalIOCTL(f890fe80) : fdo=81b1aac0, Irp=822d9840, IRQL=2
[669257 ms]  >>>  URB 89 going down  >>> 
-- URB_FUNCTION_BULK_OR_INTERRUPT_TRANSFER:
  PipeHandle           = 822e77f4 [endpoint 0x00000002]
  TransferFlags        = 00000000 (USBD_TRANSFER_DIRECTION_OUT, ~USBD_SHORT_TRANSFER_OK)
  TransferBufferLength = 00000007
  TransferBuffer       = 00000000
  TransferBufferMDL    = 81b9af88
    00000000: 00 00 00 02 05 e0 00
  UrbLink              = 00000000
[669257 ms] UsbSnoop - MyInternalIOCTLCompletion(f890fdb0) : fido=81b19728, Irp=822d9840, Context=822deae8, IRQL=2
[669257 ms]  <<<  URB 89 coming back  <<< 
-- URB_FUNCTION_BULK_OR_INTERRUPT_TRANSFER:
  PipeHandle           = 822e77f4 [endpoint 0x00000002]
  TransferFlags        = 00000000 (USBD_TRANSFER_DIRECTION_OUT, ~USBD_SHORT_TRANSFER_OK)
  TransferBufferLength = 00000007
  TransferBuffer       = 00000000
  TransferBufferMDL    = 81b9af88
  UrbLink              = 00000000
[669267 ms] UsbSnoop - DispatchAny(f890e610) : IRP_MJ_INTERNAL_DEVICE_CONTROL
[669267 ms] UsbSnoop - MyDispatchInternalIOCTL(f890fe80) : fdo=81b1aac0, Irp=822d9840, IRQL=2
[669267 ms]  >>>  URB 90 going down  >>> 
-- URB_FUNCTION_BULK_OR_INTERRUPT_TRANSFER:
  PipeHandle           = 822e77d4 [endpoint 0x00000081]
  TransferFlags        = 00000003 (USBD_TRANSFER_DIRECTION_IN, USBD_SHORT_TRANSFER_OK)
  TransferBufferLength = 00000100
  TransferBuffer       = 00000000
  TransferBufferMDL    = 81b9af88
  UrbLink              = 00000000
[669816 ms] UsbSnoop - MyInternalIOCTLCompletion(f890fdb0) : fido=81b19728, Irp=822d9840, Context=822deb30, IRQL=2
[669816 ms]  <<<  URB 90 coming back  <<< 
-- URB_FUNCTION_BULK_OR_INTERRUPT_TRANSFER:
  PipeHandle           = 822e77d4 [endpoint 0x00000081]
  TransferFlags        = 00000003 (USBD_TRANSFER_DIRECTION_IN, USBD_SHORT_TRANSFER_OK)
  TransferBufferLength = 00000091
  TransferBuffer       = 00000000
  TransferBufferMDL    = 81b9af88
    00000000: 00 00 00 8c 04 ff ff ff ff ff ff ff ff ff ff ff
    00000010: ff ff ff ff ff ff ff ff ff ff ff ff ff ff ff ff
    00000020: ff ff ff ff ff ff ff ff ff ff ff ff ff ff ff ff
    00000030: ff ff ff ff ff ff ff ff ff ff ff ff ff ff ff ff
    00000040: ff ff ff ff ff ff ff ff ff ff ff ff ff ff ff ff
    00000050: ff ff ff ff ff ff ff ff ff ff ff ff ff ff ff ff
    00000060: ff ff ff ff ff ff ff ff ff ff ff ff ff ff ff ff
    00000070: ff 00 00 00 00 00 00 00 00 00 00 00 00 fc ff ff
    00000080: ff ff ff ff ff ff ff ff ff ff ff ff ff ff ff ff
    00000090: ff
  UrbLink              = 00000000
[669848 ms] UsbSnoop - DispatchAny(f890e610) : IRP_MJ_INTERNAL_DEVICE_CONTROL
[669848 ms] UsbSnoop - MyDispatchInternalIOCTL(f890fe80) : fdo=81b1aac0, Irp=822d9840, IRQL=2
[669848 ms]  >>>  URB 91 going down  >>> 
-- URB_FUNCTION_BULK_OR_INTERRUPT_TRANSFER:
  PipeHandle           = 822e77f4 [endpoint 0x00000002]
  TransferFlags        = 00000000 (USBD_TRANSFER_DIRECTION_OUT, ~USBD_SHORT_TRANSFER_OK)
  TransferBufferLength = 00000007
  TransferBuffer       = 00000000
  TransferBufferMDL    = 81b9af88
    00000000: 00 00 00 02 05 e0 00
  UrbLink              = 00000000
[669848 ms] UsbSnoop - MyInternalIOCTLCompletion(f890fdb0) : fido=81b19728, Irp=822d9840, Context=81cd51b0, IRQL=2
[669848 ms]  <<<  URB 91 coming back  <<< 
-- URB_FUNCTION_BULK_OR_INTERRUPT_TRANSFER:
  PipeHandle           = 822e77f4 [endpoint 0x00000002]
  TransferFlags        = 00000000 (USBD_TRANSFER_DIRECTION_OUT, ~USBD_SHORT_TRANSFER_OK)
  TransferBufferLength = 00000007
  TransferBuffer       = 00000000
  TransferBufferMDL    = 81b9af88
  UrbLink              = 00000000
[670108 ms] UsbSnoop - DispatchAny(f890e610) : IRP_MJ_INTERNAL_DEVICE_CONTROL
[670108 ms] UsbSnoop - MyDispatchInternalIOCTL(f890fe80) : fdo=81b1aac0, Irp=822d9840, IRQL=2
[670108 ms]  >>>  URB 92 going down  >>> 
-- URB_FUNCTION_BULK_OR_INTERRUPT_TRANSFER:
  PipeHandle           = 822e77f4 [endpoint 0x00000002]
  TransferFlags        = 00000000 (USBD_TRANSFER_DIRECTION_OUT, ~USBD_SHORT_TRANSFER_OK)
  TransferBufferLength = 00000009
  TransferBuffer       = 00000000
  TransferBufferMDL    = 81b9af88
    00000000: 00 00 00 04 01 00 00 04 00
  UrbLink              = 00000000
[670109 ms] UsbSnoop - MyInternalIOCTLCompletion(f890fdb0) : fido=81b19728, Irp=822d9840, Context=81cd51b0, IRQL=2
[670109 ms]  <<<  URB 92 coming back  <<< 
-- URB_FUNCTION_BULK_OR_INTERRUPT_TRANSFER:
  PipeHandle           = 822e77f4 [endpoint 0x00000002]
  TransferFlags        = 00000000 (USBD_TRANSFER_DIRECTION_OUT, ~USBD_SHORT_TRANSFER_OK)
  TransferBufferLength = 00000009
  TransferBuffer       = 00000000
  TransferBufferMDL    = 81b9af88
  UrbLink              = 00000000
[670112 ms] UsbSnoop - DispatchAny(f890e610) : IRP_MJ_INTERNAL_DEVICE_CONTROL
[670112 ms] UsbSnoop - MyDispatchInternalIOCTL(f890fe80) : fdo=81b1aac0, Irp=822d9840, IRQL=2
[670112 ms]  >>>  URB 93 going down  >>> 
-- URB_FUNCTION_BULK_OR_INTERRUPT_TRANSFER:
  PipeHandle           = 822e77d4 [endpoint 0x00000081]
  TransferFlags        = 00000003 (USBD_TRANSFER_DIRECTION_IN, USBD_SHORT_TRANSFER_OK)
  TransferBufferLength = 00000100
  TransferBuffer       = 00000000
  TransferBufferMDL    = 81b9af88
  UrbLink              = 00000000
[670116 ms] UsbSnoop - MyInternalIOCTLCompletion(f890fdb0) : fido=81b19728, Irp=822d9840, Context=81cd51b0, IRQL=2
[670116 ms]  <<<  URB 93 coming back  <<< 
-- URB_FUNCTION_BULK_OR_INTERRUPT_TRANSFER:
  PipeHandle           = 822e77d4 [endpoint 0x00000081]
  TransferFlags        = 00000003 (USBD_TRANSFER_DIRECTION_IN, USBD_SHORT_TRANSFER_OK)
  TransferBufferLength = 00000009
  TransferBuffer       = 00000000
  TransferBufferMDL    = 81b9af88
    00000000: 00 00 00 04 02 00 00 00 fa
  UrbLink              = 00000000
[670141 ms] UsbSnoop - DispatchAny(f890e610) : IRP_MJ_INTERNAL_DEVICE_CONTROL
[670141 ms] UsbSnoop - MyDispatchInternalIOCTL(f890fe80) : fdo=81b1aac0, Irp=822d9840, IRQL=2
[670141 ms]  >>>  URB 94 going down  >>> 
-- URB_FUNCTION_BULK_OR_INTERRUPT_TRANSFER:
  PipeHandle           = 822e77f4 [endpoint 0x00000002]
  TransferFlags        = 00000000 (USBD_TRANSFER_DIRECTION_OUT, ~USBD_SHORT_TRANSFER_OK)
  TransferBufferLength = 00000015
  TransferBuffer       = 00000000
  TransferBufferMDL    = 81b9af88
    00000000: 00 00 00 10 04 00 00 00 0a 00 01 00 03 00 01 00
    00000010: 00 00 00 07 d0
  UrbLink              = 00000000
[670141 ms] UsbSnoop - MyInternalIOCTLCompletion(f890fdb0) : fido=81b19728, Irp=822d9840, Context=822db980, IRQL=2
[670141 ms]  <<<  URB 94 coming back  <<< 
-- URB_FUNCTION_BULK_OR_INTERRUPT_TRANSFER:
  PipeHandle           = 822e77f4 [endpoint 0x00000002]
  TransferFlags        = 00000000 (USBD_TRANSFER_DIRECTION_OUT, ~USBD_SHORT_TRANSFER_OK)
  TransferBufferLength = 00000015
  TransferBuffer       = 00000000
  TransferBufferMDL    = 81b9af88
  UrbLink              = 00000000
[670148 ms] UsbSnoop - DispatchAny(f890e610) : IRP_MJ_INTERNAL_DEVICE_CONTROL
[670148 ms] UsbSnoop - MyDispatchInternalIOCTL(f890fe80) : fdo=81b1aac0, Irp=822d9840, IRQL=2
[670148 ms]  >>>  URB 95 going down  >>> 
-- URB_FUNCTION_BULK_OR_INTERRUPT_TRANSFER:
  PipeHandle           = 822e77d4 [endpoint 0x00000081]
  TransferFlags        = 00000003 (USBD_TRANSFER_DIRECTION_IN, USBD_SHORT_TRANSFER_OK)
  TransferBufferLength = 00000100
  TransferBuffer       = 00000000
  TransferBufferMDL    = 81b9af88
  UrbLink              = 00000000
[670149 ms] UsbSnoop - MyInternalIOCTLCompletion(f890fdb0) : fido=81b19728, Irp=822d9840, Context=81cd51b0, IRQL=2
[670149 ms]  <<<  URB 95 coming back  <<< 
-- URB_FUNCTION_BULK_OR_INTERRUPT_TRANSFER:
  PipeHandle           = 822e77d4 [endpoint 0x00000081]
  TransferFlags        = 00000003 (USBD_TRANSFER_DIRECTION_IN, USBD_SHORT_TRANSFER_OK)
  TransferBufferLength = 00000007
  TransferBuffer       = 00000000
  TransferBufferMDL    = 81b9af88
    00000000: 00 00 00 02 05 e0 00
  UrbLink              = 00000000
[670188 ms] UsbSnoop - DispatchAny(f890e610) : IRP_MJ_INTERNAL_DEVICE_CONTROL
[670188 ms] UsbSnoop - MyDispatchInternalIOCTL(f890fe80) : fdo=81b1aac0, Irp=822d9840, IRQL=2
[670188 ms]  >>>  URB 96 going down  >>> 
-- URB_FUNCTION_BULK_OR_INTERRUPT_TRANSFER:
  PipeHandle           = 822e77d4 [endpoint 0x00000081]
  TransferFlags        = 00000003 (USBD_TRANSFER_DIRECTION_IN, USBD_SHORT_TRANSFER_OK)
  TransferBufferLength = 00000100
  TransferBuffer       = 00000000
  TransferBufferMDL    = 81b9af88
  UrbLink              = 00000000
[670189 ms] UsbSnoop - MyInternalIOCTLCompletion(f890fdb0) : fido=81b19728, Irp=822d9840, Context=822f29c8, IRQL=2
[670189 ms]  <<<  URB 96 coming back  <<< 
-- URB_FUNCTION_BULK_OR_INTERRUPT_TRANSFER:
  PipeHandle           = 822e77d4 [endpoint 0x00000081]
  TransferFlags        = 00000003 (USBD_TRANSFER_DIRECTION_IN, USBD_SHORT_TRANSFER_OK)
  TransferBufferLength = 0000000f
  TransferBuffer       = 00000000
  TransferBufferMDL    = 81b9af88
    00000000: 00 00 00 0a 04 00 00 00 04 00 12 00 00 07 d0
  UrbLink              = 00000000
[670229 ms] UsbSnoop - DispatchAny(f890e610) : IRP_MJ_INTERNAL_DEVICE_CONTROL
[670229 ms] UsbSnoop - MyDispatchInternalIOCTL(f890fe80) : fdo=81b1aac0, Irp=822d9840, IRQL=2
[670229 ms]  >>>  URB 97 going down  >>> 
-- URB_FUNCTION_BULK_OR_INTERRUPT_TRANSFER:
  PipeHandle           = 822e77f4 [endpoint 0x00000002]
  TransferFlags        = 00000000 (USBD_TRANSFER_DIRECTION_OUT, ~USBD_SHORT_TRANSFER_OK)
  TransferBufferLength = 00000007
  TransferBuffer       = 00000000
  TransferBufferMDL    = 81b9af88
    00000000: 00 00 00 02 05 e0 00
  UrbLink              = 00000000
[670229 ms] UsbSnoop - MyInternalIOCTLCompletion(f890fdb0) : fido=81b19728, Irp=822d9840, Context=822f29c8, IRQL=2
[670229 ms]  <<<  URB 97 coming back  <<< 
-- URB_FUNCTION_BULK_OR_INTERRUPT_TRANSFER:
  PipeHandle           = 822e77f4 [endpoint 0x00000002]
  TransferFlags        = 00000000 (USBD_TRANSFER_DIRECTION_OUT, ~USBD_SHORT_TRANSFER_OK)
  TransferBufferLength = 00000007
  TransferBuffer       = 00000000
  TransferBufferMDL    = 81b9af88
  UrbLink              = 00000000
[670239 ms] UsbSnoop - DispatchAny(f890e610) : IRP_MJ_INTERNAL_DEVICE_CONTROL
[670239 ms] UsbSnoop - MyDispatchInternalIOCTL(f890fe80) : fdo=81b1aac0, Irp=822d9840, IRQL=2
[670239 ms]  >>>  URB 98 going down  >>> 
-- URB_FUNCTION_BULK_OR_INTERRUPT_TRANSFER:
  PipeHandle           = 822e77f4 [endpoint 0x00000002]
  TransferFlags        = 00000000 (USBD_TRANSFER_DIRECTION_OUT, ~USBD_SHORT_TRANSFER_OK)
  TransferBufferLength = 00000029
  TransferBuffer       = 00000000
  TransferBufferMDL    = 81b9af88
    00000000: 00 00 00 24 04 00 00 00 1e 00 07 00 0e 00 0b 00
    00000010: 04 00 06 00 07 00 01 00 02 00 0a 00 37 00 0d 00
    00000020: 38 00 09 00 0e 00 2d 00 03
  UrbLink              = 00000000
[670239 ms] UsbSnoop - MyInternalIOCTLCompletion(f890fdb0) : fido=81b19728, Irp=822d9840, Context=822deb30, IRQL=2
[670239 ms]  <<<  URB 98 coming back  <<< 
-- URB_FUNCTION_BULK_OR_INTERRUPT_TRANSFER:
  PipeHandle           = 822e77f4 [endpoint 0x00000002]
  TransferFlags        = 00000000 (USBD_TRANSFER_DIRECTION_OUT, ~USBD_SHORT_TRANSFER_OK)
  TransferBufferLength = 00000029
  TransferBuffer       = 00000000
  TransferBufferMDL    = 81b9af88
  UrbLink              = 00000000
[670249 ms] UsbSnoop - DispatchAny(f890e610) : IRP_MJ_INTERNAL_DEVICE_CONTROL
[670249 ms] UsbSnoop - MyDispatchInternalIOCTL(f890fe80) : fdo=81b1aac0, Irp=822d9840, IRQL=2
[670249 ms]  >>>  URB 99 going down  >>> 
-- URB_FUNCTION_BULK_OR_INTERRUPT_TRANSFER:
  PipeHandle           = 822e77d4 [endpoint 0x00000081]
  TransferFlags        = 00000003 (USBD_TRANSFER_DIRECTION_IN, USBD_SHORT_TRANSFER_OK)
  TransferBufferLength = 00000100
  TransferBuffer       = 00000000
  TransferBufferMDL    = 81b9af88
  UrbLink              = 00000000
[670249 ms] UsbSnoop - MyInternalIOCTLCompletion(f890fdb0) : fido=81b19728, Irp=822d9840, Context=822e2150, IRQL=2
[670249 ms]  <<<  URB 99 coming back  <<< 
-- URB_FUNCTION_BULK_OR_INTERRUPT_TRANSFER:
  PipeHandle           = 822e77d4 [endpoint 0x00000081]
  TransferFlags        = 00000003 (USBD_TRANSFER_DIRECTION_IN, USBD_SHORT_TRANSFER_OK)
  TransferBufferLength = 00000007
  TransferBuffer       = 00000000
  TransferBufferMDL    = 81b9af88
    00000000: 00 00 00 02 05 e0 00
  UrbLink              = 00000000
[670289 ms] UsbSnoop - DispatchAny(f890e610) : IRP_MJ_INTERNAL_DEVICE_CONTROL
[670289 ms] UsbSnoop - MyDispatchInternalIOCTL(f890fe80) : fdo=81b1aac0, Irp=822d9840, IRQL=2
[670289 ms]  >>>  URB 100 going down  >>> 
-- URB_FUNCTION_BULK_OR_INTERRUPT_TRANSFER:
  PipeHandle           = 822e77d4 [endpoint 0x00000081]
  TransferFlags        = 00000003 (USBD_TRANSFER_DIRECTION_IN, USBD_SHORT_TRANSFER_OK)
  TransferBufferLength = 00000100
  TransferBuffer       = 00000000
  TransferBufferMDL    = 81b9af88
  UrbLink              = 00000000
[670290 ms] UsbSnoop - MyInternalIOCTLCompletion(f890fdb0) : fido=81b19728, Irp=822d9840, Context=822db980, IRQL=2
[670290 ms]  <<<  URB 100 coming back  <<< 
-- URB_FUNCTION_BULK_OR_INTERRUPT_TRANSFER:
  PipeHandle           = 822e77d4 [endpoint 0x00000081]
  TransferFlags        = 00000003 (USBD_TRANSFER_DIRECTION_IN, USBD_SHORT_TRANSFER_OK)
  TransferBufferLength = 0000000f
  TransferBuffer       = 00000000
  TransferBufferMDL    = 81b9af88
    00000000: 00 00 00 0a 04 00 00 00 04 bb 00 00 01 d4 c0
  UrbLink              = 00000000
[670329 ms] UsbSnoop - DispatchAny(f890e610) : IRP_MJ_INTERNAL_DEVICE_CONTROL
[670329 ms] UsbSnoop - MyDispatchInternalIOCTL(f890fe80) : fdo=81b1aac0, Irp=822d9840, IRQL=2
[670329 ms]  >>>  URB 101 going down  >>> 
-- URB_FUNCTION_BULK_OR_INTERRUPT_TRANSFER:
  PipeHandle           = 822e77f4 [endpoint 0x00000002]
  TransferFlags        = 00000000 (USBD_TRANSFER_DIRECTION_OUT, ~USBD_SHORT_TRANSFER_OK)
  TransferBufferLength = 00000007
  TransferBuffer       = 00000000
  TransferBufferMDL    = 81b9af88
    00000000: 00 00 00 02 05 e0 00
  UrbLink              = 00000000
[670329 ms] UsbSnoop - MyInternalIOCTLCompletion(f890fdb0) : fido=81b19728, Irp=822d9840, Context=81cd51b0, IRQL=2
[670329 ms]  <<<  URB 101 coming back  <<< 
-- URB_FUNCTION_BULK_OR_INTERRUPT_TRANSFER:
  PipeHandle           = 822e77f4 [endpoint 0x00000002]
  TransferFlags        = 00000000 (USBD_TRANSFER_DIRECTION_OUT, ~USBD_SHORT_TRANSFER_OK)
  TransferBufferLength = 00000007
  TransferBuffer       = 00000000
  TransferBufferMDL    = 81b9af88
  UrbLink              = 00000000
[670339 ms] UsbSnoop - DispatchAny(f890e610) : IRP_MJ_INTERNAL_DEVICE_CONTROL
[670339 ms] UsbSnoop - MyDispatchInternalIOCTL(f890fe80) : fdo=81b1aac0, Irp=822d9840, IRQL=2
[670339 ms]  >>>  URB 102 going down  >>> 
-- URB_FUNCTION_BULK_OR_INTERRUPT_TRANSFER:
  PipeHandle           = 822e77d4 [endpoint 0x00000081]
  TransferFlags        = 00000003 (USBD_TRANSFER_DIRECTION_IN, USBD_SHORT_TRANSFER_OK)
  TransferBufferLength = 00000100
  TransferBuffer       = 00000000
  TransferBufferMDL    = 81b9af88
  UrbLink              = 00000000
[670398 ms] UsbSnoop - MyInternalIOCTLCompletion(f890fdb0) : fido=81b19728, Irp=822d9840, Context=822e2150, IRQL=2
[670399 ms]  <<<  URB 102 coming back  <<< 
-- URB_FUNCTION_BULK_OR_INTERRUPT_TRANSFER:
  PipeHandle           = 822e77d4 [endpoint 0x00000081]
  TransferFlags        = 00000003 (USBD_TRANSFER_DIRECTION_IN, USBD_SHORT_TRANSFER_OK)
  TransferBufferLength = 00000095
  TransferBuffer       = 00000000
  TransferBufferMDL    = 81b9af88
    00000000: 00 00 00 90 04 00 00 00 8a 00 08 00 0e 00 0b 00
    00000010: 00 04 00 02 28 00 00 04 00 00 02 00 03 00 06 00
    00000020: 00 01 09 00 07 00 00 01 01 00 01 00 00 04 00 00
    00000030: 00 0a 00 02 00 00 19 54 49 2d 38 34 20 50 6c 75
    00000040: 73 20 53 69 6c 76 65 72 20 45 64 69 74 69 6f 6e
    00000050: 00 0a 00 00 01 01 00 37 00 00 01 01 00 0d 00 00
    00000060: 08 00 00 00 00 00 00 5e fd 00 38 00 00 01 00 00
    00000070: 09 00 00 04 00 01 00 00 00 0e 00 00 08 00 00 00
    00000080: 00 00 00 5e d0 00 2d 00 00 01 01 00 03 00 00 05
    00000090: 0a 32 cc e3 01
  UrbLink              = 00000000
[670440 ms] UsbSnoop - DispatchAny(f890e610) : IRP_MJ_INTERNAL_DEVICE_CONTROL
[670440 ms] UsbSnoop - MyDispatchInternalIOCTL(f890fe80) : fdo=81b1aac0, Irp=822d9840, IRQL=2
[670440 ms]  >>>  URB 103 going down  >>> 
-- URB_FUNCTION_BULK_OR_INTERRUPT_TRANSFER:
  PipeHandle           = 822e77f4 [endpoint 0x00000002]
  TransferFlags        = 00000000 (USBD_TRANSFER_DIRECTION_OUT, ~USBD_SHORT_TRANSFER_OK)
  TransferBufferLength = 00000007
  TransferBuffer       = 00000000
  TransferBufferMDL    = 81b9af88
    00000000: 00 00 00 02 05 e0 00
  UrbLink              = 00000000
[670440 ms] UsbSnoop - MyInternalIOCTLCompletion(f890fdb0) : fido=81b19728, Irp=822d9840, Context=822f29c8, IRQL=2
[670440 ms]  <<<  URB 103 coming back  <<< 
-- URB_FUNCTION_BULK_OR_INTERRUPT_TRANSFER:
  PipeHandle           = 822e77f4 [endpoint 0x00000002]
  TransferFlags        = 00000000 (USBD_TRANSFER_DIRECTION_OUT, ~USBD_SHORT_TRANSFER_OK)
  TransferBufferLength = 00000007
  TransferBuffer       = 00000000
  TransferBufferMDL    = 81b9af88
  UrbLink              = 00000000
[670700 ms] UsbSnoop - DispatchAny(f890e610) : IRP_MJ_INTERNAL_DEVICE_CONTROL
[670700 ms] UsbSnoop - MyDispatchInternalIOCTL(f890fe80) : fdo=81b1aac0, Irp=822d9840, IRQL=2
[670700 ms]  >>>  URB 104 going down  >>> 
-- URB_FUNCTION_BULK_OR_INTERRUPT_TRANSFER:
  PipeHandle           = 822e77f4 [endpoint 0x00000002]
  TransferFlags        = 00000000 (USBD_TRANSFER_DIRECTION_OUT, ~USBD_SHORT_TRANSFER_OK)
  TransferBufferLength = 00000009
  TransferBuffer       = 00000000
  TransferBufferMDL    = 81b9af88
    00000000: 00 00 00 04 01 00 00 04 00
  UrbLink              = 00000000
[670700 ms] UsbSnoop - MyInternalIOCTLCompletion(f890fdb0) : fido=81b19728, Irp=822d9840, Context=822e2150, IRQL=2
[670700 ms]  <<<  URB 104 coming back  <<< 
-- URB_FUNCTION_BULK_OR_INTERRUPT_TRANSFER:
  PipeHandle           = 822e77f4 [endpoint 0x00000002]
  TransferFlags        = 00000000 (USBD_TRANSFER_DIRECTION_OUT, ~USBD_SHORT_TRANSFER_OK)
  TransferBufferLength = 00000009
  TransferBuffer       = 00000000
  TransferBufferMDL    = 81b9af88
  UrbLink              = 00000000
[670700 ms] UsbSnoop - DispatchAny(f890e610) : IRP_MJ_INTERNAL_DEVICE_CONTROL
[670700 ms] UsbSnoop - MyDispatchInternalIOCTL(f890fe80) : fdo=81b1aac0, Irp=822d9840, IRQL=2
[670700 ms]  >>>  URB 105 going down  >>> 
-- URB_FUNCTION_BULK_OR_INTERRUPT_TRANSFER:
  PipeHandle           = 822e77d4 [endpoint 0x00000081]
  TransferFlags        = 00000003 (USBD_TRANSFER_DIRECTION_IN, USBD_SHORT_TRANSFER_OK)
  TransferBufferLength = 00000100
  TransferBuffer       = 00000000
  TransferBufferMDL    = 81b9af88
  UrbLink              = 00000000
[670710 ms] UsbSnoop - MyInternalIOCTLCompletion(f890fdb0) : fido=81b19728, Irp=822d9840, Context=822e2150, IRQL=2
[670710 ms]  <<<  URB 105 coming back  <<< 
-- URB_FUNCTION_BULK_OR_INTERRUPT_TRANSFER:
  PipeHandle           = 822e77d4 [endpoint 0x00000081]
  TransferFlags        = 00000003 (USBD_TRANSFER_DIRECTION_IN, USBD_SHORT_TRANSFER_OK)
  TransferBufferLength = 00000009
  TransferBuffer       = 00000000
  TransferBufferMDL    = 81b9af88
    00000000: 00 00 00 04 02 00 00 00 fa
  UrbLink              = 00000000
[670740 ms] UsbSnoop - DispatchAny(f890e610) : IRP_MJ_INTERNAL_DEVICE_CONTROL
[670740 ms] UsbSnoop - MyDispatchInternalIOCTL(f890fe80) : fdo=81b1aac0, Irp=822d9840, IRQL=2
[670740 ms]  >>>  URB 106 going down  >>> 
-- URB_FUNCTION_BULK_OR_INTERRUPT_TRANSFER:
  PipeHandle           = 822e77f4 [endpoint 0x00000002]
  TransferFlags        = 00000000 (USBD_TRANSFER_DIRECTION_OUT, ~USBD_SHORT_TRANSFER_OK)
  TransferBufferLength = 00000015
  TransferBuffer       = 00000000
  TransferBufferMDL    = 81b099e8
    00000000: 00 00 00 10 04 00 00 00 0a 00 01 00 03 00 01 00
    00000010: 00 00 00 07 d0
  UrbLink              = 00000000
[670740 ms] UsbSnoop - MyInternalIOCTLCompletion(f890fdb0) : fido=81b19728, Irp=822d9840, Context=81cd51b0, IRQL=2
[670740 ms]  <<<  URB 106 coming back  <<< 
-- URB_FUNCTION_BULK_OR_INTERRUPT_TRANSFER:
  PipeHandle           = 822e77f4 [endpoint 0x00000002]
  TransferFlags        = 00000000 (USBD_TRANSFER_DIRECTION_OUT, ~USBD_SHORT_TRANSFER_OK)
  TransferBufferLength = 00000015
  TransferBuffer       = 00000000
  TransferBufferMDL    = 81b099e8
  UrbLink              = 00000000
[670749 ms] UsbSnoop - DispatchAny(f890e610) : IRP_MJ_INTERNAL_DEVICE_CONTROL
[670749 ms] UsbSnoop - MyDispatchInternalIOCTL(f890fe80) : fdo=81b1aac0, Irp=822d9840, IRQL=2
[670749 ms]  >>>  URB 107 going down  >>> 
-- URB_FUNCTION_BULK_OR_INTERRUPT_TRANSFER:
  PipeHandle           = 822e77d4 [endpoint 0x00000081]
  TransferFlags        = 00000003 (USBD_TRANSFER_DIRECTION_IN, USBD_SHORT_TRANSFER_OK)
  TransferBufferLength = 00000100
  TransferBuffer       = 00000000
  TransferBufferMDL    = 81b9af88
  UrbLink              = 00000000
[670750 ms] UsbSnoop - MyInternalIOCTLCompletion(f890fdb0) : fido=81b19728, Irp=822d9840, Context=822e2150, IRQL=2
[670750 ms]  <<<  URB 107 coming back  <<< 
-- URB_FUNCTION_BULK_OR_INTERRUPT_TRANSFER:
  PipeHandle           = 822e77d4 [endpoint 0x00000081]
  TransferFlags        = 00000003 (USBD_TRANSFER_DIRECTION_IN, USBD_SHORT_TRANSFER_OK)
  TransferBufferLength = 00000007
  TransferBuffer       = 00000000
  TransferBufferMDL    = 81b9af88
    00000000: 00 00 00 02 05 e0 00
  UrbLink              = 00000000
[670789 ms] UsbSnoop - DispatchAny(f890e610) : IRP_MJ_INTERNAL_DEVICE_CONTROL
[670789 ms] UsbSnoop - MyDispatchInternalIOCTL(f890fe80) : fdo=81b1aac0, Irp=822d9840, IRQL=2
[670789 ms]  >>>  URB 108 going down  >>> 
-- URB_FUNCTION_BULK_OR_INTERRUPT_TRANSFER:
  PipeHandle           = 822e77d4 [endpoint 0x00000081]
  TransferFlags        = 00000003 (USBD_TRANSFER_DIRECTION_IN, USBD_SHORT_TRANSFER_OK)
  TransferBufferLength = 00000100
  TransferBuffer       = 00000000
  TransferBufferMDL    = 81b9af88
  UrbLink              = 00000000
[670790 ms] UsbSnoop - MyInternalIOCTLCompletion(f890fdb0) : fido=81b19728, Irp=822d9840, Context=822f29c8, IRQL=2
[670790 ms]  <<<  URB 108 coming back  <<< 
-- URB_FUNCTION_BULK_OR_INTERRUPT_TRANSFER:
  PipeHandle           = 822e77d4 [endpoint 0x00000081]
  TransferFlags        = 00000003 (USBD_TRANSFER_DIRECTION_IN, USBD_SHORT_TRANSFER_OK)
  TransferBufferLength = 0000000f
  TransferBuffer       = 00000000
  TransferBufferMDL    = 81b9af88
    00000000: 00 00 00 0a 04 00 00 00 04 00 12 00 00 07 d0
  UrbLink              = 00000000
[670829 ms] UsbSnoop - DispatchAny(f890e610) : IRP_MJ_INTERNAL_DEVICE_CONTROL
[670829 ms] UsbSnoop - MyDispatchInternalIOCTL(f890fe80) : fdo=81b1aac0, Irp=822d9840, IRQL=2
[670830 ms]  >>>  URB 109 going down  >>> 
-- URB_FUNCTION_BULK_OR_INTERRUPT_TRANSFER:
  PipeHandle           = 822e77f4 [endpoint 0x00000002]
  TransferFlags        = 00000000 (USBD_TRANSFER_DIRECTION_OUT, ~USBD_SHORT_TRANSFER_OK)
  TransferBufferLength = 00000007
  TransferBuffer       = 00000000
  TransferBufferMDL    = 81b9af88
    00000000: 00 00 00 02 05 e0 00
  UrbLink              = 00000000
[670830 ms] UsbSnoop - MyInternalIOCTLCompletion(f890fdb0) : fido=81b19728, Irp=822d9840, Context=81cd51b0, IRQL=2
[670830 ms]  <<<  URB 109 coming back  <<< 
-- URB_FUNCTION_BULK_OR_INTERRUPT_TRANSFER:
  PipeHandle           = 822e77f4 [endpoint 0x00000002]
  TransferFlags        = 00000000 (USBD_TRANSFER_DIRECTION_OUT, ~USBD_SHORT_TRANSFER_OK)
  TransferBufferLength = 00000007
  TransferBuffer       = 00000000
  TransferBufferMDL    = 81b9af88
  UrbLink              = 00000000
[670840 ms] UsbSnoop - DispatchAny(f890e610) : IRP_MJ_INTERNAL_DEVICE_CONTROL
[670840 ms] UsbSnoop - MyDispatchInternalIOCTL(f890fe80) : fdo=81b1aac0, Irp=822d9840, IRQL=2
[670840 ms]  >>>  URB 110 going down  >>> 
-- URB_FUNCTION_BULK_OR_INTERRUPT_TRANSFER:
  PipeHandle           = 822e77f4 [endpoint 0x00000002]
  TransferFlags        = 00000000 (USBD_TRANSFER_DIRECTION_OUT, ~USBD_SHORT_TRANSFER_OK)
  TransferBufferLength = 0000000f
  TransferBuffer       = 00000000
  TransferBufferMDL    = 81b9af88
    00000000: 00 00 00 0a 04 00 00 00 04 00 07 00 01 00 31
  UrbLink              = 00000000
[670840 ms] UsbSnoop - MyInternalIOCTLCompletion(f890fdb0) : fido=81b19728, Irp=822d9840, Context=822db980, IRQL=2
[670840 ms]  <<<  URB 110 coming back  <<< 
-- URB_FUNCTION_BULK_OR_INTERRUPT_TRANSFER:
  PipeHandle           = 822e77f4 [endpoint 0x00000002]
  TransferFlags        = 00000000 (USBD_TRANSFER_DIRECTION_OUT, ~USBD_SHORT_TRANSFER_OK)
  TransferBufferLength = 0000000f
  TransferBuffer       = 00000000
  TransferBufferMDL    = 81b9af88
  UrbLink              = 00000000
[670849 ms] UsbSnoop - DispatchAny(f890e610) : IRP_MJ_INTERNAL_DEVICE_CONTROL
[670849 ms] UsbSnoop - MyDispatchInternalIOCTL(f890fe80) : fdo=81b1aac0, Irp=822d9840, IRQL=2
[670849 ms]  >>>  URB 111 going down  >>> 
-- URB_FUNCTION_BULK_OR_INTERRUPT_TRANSFER:
  PipeHandle           = 822e77d4 [endpoint 0x00000081]
  TransferFlags        = 00000003 (USBD_TRANSFER_DIRECTION_IN, USBD_SHORT_TRANSFER_OK)
  TransferBufferLength = 00000100
  TransferBuffer       = 00000000
  TransferBufferMDL    = 81b9af88
  UrbLink              = 00000000
[670850 ms] UsbSnoop - MyInternalIOCTLCompletion(f890fdb0) : fido=81b19728, Irp=822d9840, Context=822f29c8, IRQL=2
[670850 ms]  <<<  URB 111 coming back  <<< 
-- URB_FUNCTION_BULK_OR_INTERRUPT_TRANSFER:
  PipeHandle           = 822e77d4 [endpoint 0x00000081]
  TransferFlags        = 00000003 (USBD_TRANSFER_DIRECTION_IN, USBD_SHORT_TRANSFER_OK)
  TransferBufferLength = 00000007
  TransferBuffer       = 00000000
  TransferBufferMDL    = 81b9af88
    00000000: 00 00 00 02 05 e0 00
  UrbLink              = 00000000
[670890 ms] UsbSnoop - DispatchAny(f890e610) : IRP_MJ_INTERNAL_DEVICE_CONTROL
[670890 ms] UsbSnoop - MyDispatchInternalIOCTL(f890fe80) : fdo=81b1aac0, Irp=822d9840, IRQL=2
[670890 ms]  >>>  URB 112 going down  >>> 
-- URB_FUNCTION_BULK_OR_INTERRUPT_TRANSFER:
  PipeHandle           = 822e77d4 [endpoint 0x00000081]
  TransferFlags        = 00000003 (USBD_TRANSFER_DIRECTION_IN, USBD_SHORT_TRANSFER_OK)
  TransferBufferLength = 00000100
  TransferBuffer       = 00000000
  TransferBufferMDL    = 81b9af88
  UrbLink              = 00000000
[670890 ms] UsbSnoop - MyInternalIOCTLCompletion(f890fdb0) : fido=81b19728, Irp=822d9840, Context=822db980, IRQL=2
[670890 ms]  <<<  URB 112 coming back  <<< 
-- URB_FUNCTION_BULK_OR_INTERRUPT_TRANSFER:
  PipeHandle           = 822e77d4 [endpoint 0x00000081]
  TransferFlags        = 00000003 (USBD_TRANSFER_DIRECTION_IN, USBD_SHORT_TRANSFER_OK)
  TransferBufferLength = 0000000f
  TransferBuffer       = 00000000
  TransferBufferMDL    = 81b9af88
    00000000: 00 00 00 0a 04 00 00 00 04 bb 00 00 01 d4 c0
  UrbLink              = 00000000
[670930 ms] UsbSnoop - DispatchAny(f890e610) : IRP_MJ_INTERNAL_DEVICE_CONTROL
[670930 ms] UsbSnoop - MyDispatchInternalIOCTL(f890fe80) : fdo=81b1aac0, Irp=822d9840, IRQL=2
[670930 ms]  >>>  URB 113 going down  >>> 
-- URB_FUNCTION_BULK_OR_INTERRUPT_TRANSFER:
  PipeHandle           = 822e77f4 [endpoint 0x00000002]
  TransferFlags        = 00000000 (USBD_TRANSFER_DIRECTION_OUT, ~USBD_SHORT_TRANSFER_OK)
  TransferBufferLength = 00000007
  TransferBuffer       = 00000000
  TransferBufferMDL    = 81b9af88
    00000000: 00 00 00 02 05 e0 00
  UrbLink              = 00000000
[670930 ms] UsbSnoop - MyInternalIOCTLCompletion(f890fdb0) : fido=81b19728, Irp=822d9840, Context=81b05970, IRQL=2
[670930 ms]  <<<  URB 113 coming back  <<< 
-- URB_FUNCTION_BULK_OR_INTERRUPT_TRANSFER:
  PipeHandle           = 822e77f4 [endpoint 0x00000002]
  TransferFlags        = 00000000 (USBD_TRANSFER_DIRECTION_OUT, ~USBD_SHORT_TRANSFER_OK)
  TransferBufferLength = 00000007
  TransferBuffer       = 00000000
  TransferBufferMDL    = 81b9af88
  UrbLink              = 00000000
[670940 ms] UsbSnoop - DispatchAny(f890e610) : IRP_MJ_INTERNAL_DEVICE_CONTROL
[670940 ms] UsbSnoop - MyDispatchInternalIOCTL(f890fe80) : fdo=81b1aac0, Irp=822d9840, IRQL=2
[670940 ms]  >>>  URB 114 going down  >>> 
-- URB_FUNCTION_BULK_OR_INTERRUPT_TRANSFER:
  PipeHandle           = 822e77d4 [endpoint 0x00000081]
  TransferFlags        = 00000003 (USBD_TRANSFER_DIRECTION_IN, USBD_SHORT_TRANSFER_OK)
  TransferBufferLength = 00000100
  TransferBuffer       = 00000000
  TransferBufferMDL    = 81b9af88
  UrbLink              = 00000000
[679432 ms] UsbSnoop - MyInternalIOCTLCompletion(f890fdb0) : fido=81b19728, Irp=822d9840, Context=822f29c8, IRQL=2
[679432 ms]  <<<  URB 114 coming back  <<< 
-- URB_FUNCTION_BULK_OR_INTERRUPT_TRANSFER:
  PipeHandle           = 822e77d4 [endpoint 0x00000081]
  TransferFlags        = 00000003 (USBD_TRANSFER_DIRECTION_IN, USBD_SHORT_TRANSFER_OK)
  TransferBufferLength = 000000ff
  TransferBuffer       = 00000000
  TransferBufferMDL    = 81b9af88
    00000000: 00 00 00 fa 03 00 00 04 6e 00 08 00 01 00 31 00
    00000010: 04 67 0a 15 0a 32 cc e3 01 0a 2d 40 00 00 00 00
    00000020: 00 00 00 00 00 00 00 00 00 00 00 00 00 00 00 00
    00000030: 00 00 00 00 00 00 00 00 00 00 00 00 00 00 00 00
    00000040: 00 00 00 00 00 00 00 00 00 00 00 00 00 00 00 00
    00000050: 00 00 00 00 00 00 00 00 00 00 00 00 04 12 21 18
    00000060: 03 26 09 04 0b d4 31 b0 02 0d 40 a4 f7 87 78 b9
    00000070: da 56 1a 21 97 57 2e 90 de 87 7a 0b 6c 5f 63 2c
    00000080: 01 8a 32 17 9b 65 73 af b1 a1 1b 2f 0c 0b 67 b8
    00000090: f7 84 22 44 04 bd 33 76 f8 06 2e 82 57 ff 63 a1
    000000a0: c9 27 8e f4 46 8e b1 ea 96 c3 9a 80 0f 00 00 00
    000000b0: 00 80 11 0a 80 21 02 80 31 28 80 a1 03 80 81 12
    000000c0: 80 7f 00 00 00 00 80 0f 00 00 6c 24 80 12 01 04
    000000d0: 80 21 01 80 31 01 80 48 43 42 4c 45 78 70 6d 74
    000000e0: 80 81 02 80 90 03 26 09 04 05 39 d3 85 02 0d 40
    000000f0: 2b 80 80 bf f0 a4 96 2e 7b 40 eb cf 73 9d a7
  UrbLink              = 00000000
[679476 ms] UsbSnoop - DispatchAny(f890e610) : IRP_MJ_INTERNAL_DEVICE_CONTROL
[679476 ms] UsbSnoop - MyDispatchInternalIOCTL(f890fe80) : fdo=81b1aac0, Irp=81b52e48, IRQL=2
[679476 ms]  >>>  URB 115 going down  >>> 
-- URB_FUNCTION_BULK_OR_INTERRUPT_TRANSFER:
  PipeHandle           = 822e77f4 [endpoint 0x00000002]
  TransferFlags        = 00000000 (USBD_TRANSFER_DIRECTION_OUT, ~USBD_SHORT_TRANSFER_OK)
  TransferBufferLength = 00000007
  TransferBuffer       = 00000000
  TransferBufferMDL    = 81b9af88
    00000000: 00 00 00 02 05 e0 00
  UrbLink              = 00000000
[679476 ms] UsbSnoop - MyInternalIOCTLCompletion(f890fdb0) : fido=81b19728, Irp=81b52e48, Context=81cd51b0, IRQL=2
[679476 ms]  <<<  URB 115 coming back  <<< 
-- URB_FUNCTION_BULK_OR_INTERRUPT_TRANSFER:
  PipeHandle           = 822e77f4 [endpoint 0x00000002]
  TransferFlags        = 00000000 (USBD_TRANSFER_DIRECTION_OUT, ~USBD_SHORT_TRANSFER_OK)
  TransferBufferLength = 00000007
  TransferBuffer       = 00000000
  TransferBufferMDL    = 81b9af88
  UrbLink              = 00000000
[679483 ms] UsbSnoop - DispatchAny(f890e610) : IRP_MJ_INTERNAL_DEVICE_CONTROL
[679483 ms] UsbSnoop - MyDispatchInternalIOCTL(f890fe80) : fdo=81b1aac0, Irp=81b52e48, IRQL=2
[679483 ms]  >>>  URB 116 going down  >>> 
-- URB_FUNCTION_BULK_OR_INTERRUPT_TRANSFER:
  PipeHandle           = 822e77d4 [endpoint 0x00000081]
  TransferFlags        = 00000003 (USBD_TRANSFER_DIRECTION_IN, USBD_SHORT_TRANSFER_OK)
  TransferBufferLength = 00000100
  TransferBuffer       = 00000000
  TransferBufferMDL    = 81b9af88
  UrbLink              = 00000000
[679507 ms] UsbSnoop - MyInternalIOCTLCompletion(f890fdb0) : fido=81b19728, Irp=81b52e48, Context=81cd51b0, IRQL=2
[679507 ms]  <<<  URB 116 coming back  <<< 
-- URB_FUNCTION_BULK_OR_INTERRUPT_TRANSFER:
  PipeHandle           = 822e77d4 [endpoint 0x00000081]
  TransferFlags        = 00000003 (USBD_TRANSFER_DIRECTION_IN, USBD_SHORT_TRANSFER_OK)
  TransferBufferLength = 000000ff
  TransferBuffer       = 00000000
  TransferBufferMDL    = 81b9af88
    00000000: 00 00 00 fa 03 9e ed 50 e1 60 26 bb f9 0f a4 20
    00000010: 2c 65 f3 0c 4c bc 85 be b9 9a af 73 54 bb bd 67
    00000020: f6 f9 9e 4a bd 5b 2f 3a 75 c2 50 cd 7a c7 07 30
    00000030: b5 aa 40 f0 1e 90 80 7f 00 00 00 00 02 0d 40 ad
    00000040: 9b d6 89 35 66 67 aa d3 23 39 d1 3d 55 0f 30 68
    00000050: 58 a7 ae e9 89 bd c2 2d a6 48 a4 0b ba 55 a1 d7
    00000060: 8b ac 39 fe 5c 8a 16 a1 38 f9 e8 55 62 a0 95 c5
    00000070: 95 ef d2 a2 58 ae 08 22 89 79 62 75 eb fc 13 ff
    00000080: ff ff ff ff ff ff ff ff ff ff ff ff ff ff ff ff
    00000090: ff ff ff ff ff ff ff ff ff ff ff ff ff ff ff ff
    000000a0: ff ff ff ff ff ff ff ff ff ff ff ff ff ff ff ff
    000000b0: ff ff ff ff ff ff ff ff ff ff ff ff ff ff ff ff
    000000c0: ff ff ff ff ff ff ff ff ff ff ff ff ff ff ff ff
    000000d0: ff ff ff ff ff ff ff ff ff ff ff ff ff ff ff ff
    000000e0: ff ff ff ff ff ff ff ff ff ff ff ff ff ff ff ff
    000000f0: ff ff ff ff ff ff ff ff ff ff ff ff ff ff ff
  UrbLink              = 00000000
[679543 ms] UsbSnoop - DispatchAny(f890e610) : IRP_MJ_INTERNAL_DEVICE_CONTROL
[679543 ms] UsbSnoop - MyDispatchInternalIOCTL(f890fe80) : fdo=81b1aac0, Irp=81b52e48, IRQL=2
[679543 ms]  >>>  URB 117 going down  >>> 
-- URB_FUNCTION_BULK_OR_INTERRUPT_TRANSFER:
  PipeHandle           = 822e77f4 [endpoint 0x00000002]
  TransferFlags        = 00000000 (USBD_TRANSFER_DIRECTION_OUT, ~USBD_SHORT_TRANSFER_OK)
  TransferBufferLength = 00000007
  TransferBuffer       = 00000000
  TransferBufferMDL    = 81b9af88
    00000000: 00 00 00 02 05 e0 00
  UrbLink              = 00000000
[679544 ms] UsbSnoop - MyInternalIOCTLCompletion(f890fdb0) : fido=81b19728, Irp=81b52e48, Context=81b05970, IRQL=2
[679544 ms]  <<<  URB 117 coming back  <<< 
-- URB_FUNCTION_BULK_OR_INTERRUPT_TRANSFER:
  PipeHandle           = 822e77f4 [endpoint 0x00000002]
  TransferFlags        = 00000000 (USBD_TRANSFER_DIRECTION_OUT, ~USBD_SHORT_TRANSFER_OK)
  TransferBufferLength = 00000007
  TransferBuffer       = 00000000
  TransferBufferMDL    = 81b9af88
  UrbLink              = 00000000
[679554 ms] UsbSnoop - DispatchAny(f890e610) : IRP_MJ_INTERNAL_DEVICE_CONTROL
[679554 ms] UsbSnoop - MyDispatchInternalIOCTL(f890fe80) : fdo=81b1aac0, Irp=81b52e48, IRQL=2
[679554 ms]  >>>  URB 118 going down  >>> 
-- URB_FUNCTION_BULK_OR_INTERRUPT_TRANSFER:
  PipeHandle           = 822e77d4 [endpoint 0x00000081]
  TransferFlags        = 00000003 (USBD_TRANSFER_DIRECTION_IN, USBD_SHORT_TRANSFER_OK)
  TransferBufferLength = 00000100
  TransferBuffer       = 00000000
  TransferBufferMDL    = 81b9af88
  UrbLink              = 00000000
[679575 ms] UsbSnoop - MyInternalIOCTLCompletion(f890fdb0) : fido=81b19728, Irp=81b52e48, Context=822e2150, IRQL=2
[679575 ms]  <<<  URB 118 coming back  <<< 
-- URB_FUNCTION_BULK_OR_INTERRUPT_TRANSFER:
  PipeHandle           = 822e77d4 [endpoint 0x00000081]
  TransferFlags        = 00000003 (USBD_TRANSFER_DIRECTION_IN, USBD_SHORT_TRANSFER_OK)
  TransferBufferLength = 000000ff
  TransferBuffer       = 00000000
  TransferBufferMDL    = 81b9af88
    00000000: 00 00 00 fa 03 ff ff ff ff ff ff ff ff ff ff ff
    00000010: ff ff ff ff ff ff ff ff ff ff ff ff ff ff ff ff
    00000020: ff ff ff ff ff ff ff ff ff ff ff ff ff ff ff ff
    00000030: ff ff ff ff ff ff ff ff ff ff ff ff ff ff ff ff
    00000040: ff ff ff ff ff ff ff ff ff ff ff ff ff ff ff ff
    00000050: ff ff ff ff ff ff ff ff ff ff ff ff ff ff ff ff
    00000060: ff ff ff ff ff ff ff ff ff ff ff ff ff ff ff ff
    00000070: ff ff ff ff ff ff ff ff ff ff ff ff ff ff ff ff
    00000080: ff ff ff ff ff ff ff ff ff ff ff ff ff ff ff ff
    00000090: ff ff ff ff ff ff ff ff ff ff ff ff ff ff ff ff
    000000a0: ff ff ff ff ff ff ff ff ff ff ff ff ff ff ff ff
    000000b0: ff ff ff ff ff ff ff ff ff ff ff ff ff ff ff ff
    000000c0: ff ff ff ff ff ff ff ff ff ff ff ff ff ff ff ff
    000000d0: ff ff ff ff ff 80 00 ff ff ff ff ff ff ff ff ff
    000000e0: ff ff ff ff ff ff ff ff ff ff ff ff ff ff ff ff
    000000f0: ff ff ff ff ff ff ff ff ff ff ff ff ff ff ff
  UrbLink              = 00000000
[679613 ms] UsbSnoop - DispatchAny(f890e610) : IRP_MJ_INTERNAL_DEVICE_CONTROL
[679613 ms] UsbSnoop - MyDispatchInternalIOCTL(f890fe80) : fdo=81b1aac0, Irp=81b52e48, IRQL=2
[679613 ms]  >>>  URB 119 going down  >>> 
-- URB_FUNCTION_BULK_OR_INTERRUPT_TRANSFER:
  PipeHandle           = 822e77f4 [endpoint 0x00000002]
  TransferFlags        = 00000000 (USBD_TRANSFER_DIRECTION_OUT, ~USBD_SHORT_TRANSFER_OK)
  TransferBufferLength = 00000007
  TransferBuffer       = 00000000
  TransferBufferMDL    = 81b9af88
    00000000: 00 00 00 02 05 e0 00
  UrbLink              = 00000000
[679614 ms] UsbSnoop - MyInternalIOCTLCompletion(f890fdb0) : fido=81b19728, Irp=81b52e48, Context=81cd51b0, IRQL=2
[679614 ms]  <<<  URB 119 coming back  <<< 
-- URB_FUNCTION_BULK_OR_INTERRUPT_TRANSFER:
  PipeHandle           = 822e77f4 [endpoint 0x00000002]
  TransferFlags        = 00000000 (USBD_TRANSFER_DIRECTION_OUT, ~USBD_SHORT_TRANSFER_OK)
  TransferBufferLength = 00000007
  TransferBuffer       = 00000000
  TransferBufferMDL    = 81b9af88
  UrbLink              = 00000000
[679623 ms] UsbSnoop - DispatchAny(f890e610) : IRP_MJ_INTERNAL_DEVICE_CONTROL
[679623 ms] UsbSnoop - MyDispatchInternalIOCTL(f890fe80) : fdo=81b1aac0, Irp=81bb0348, IRQL=2
[679623 ms]  >>>  URB 120 going down  >>> 
-- URB_FUNCTION_BULK_OR_INTERRUPT_TRANSFER:
  PipeHandle           = 822e77d4 [endpoint 0x00000081]
  TransferFlags        = 00000003 (USBD_TRANSFER_DIRECTION_IN, USBD_SHORT_TRANSFER_OK)
  TransferBufferLength = 00000100
  TransferBuffer       = 00000000
  TransferBufferMDL    = 81b9af88
  UrbLink              = 00000000
[679645 ms] UsbSnoop - MyInternalIOCTLCompletion(f890fdb0) : fido=81b19728, Irp=81bb0348, Context=822e2150, IRQL=2
[679645 ms]  <<<  URB 120 coming back  <<< 
-- URB_FUNCTION_BULK_OR_INTERRUPT_TRANSFER:
  PipeHandle           = 822e77d4 [endpoint 0x00000081]
  TransferFlags        = 00000003 (USBD_TRANSFER_DIRECTION_IN, USBD_SHORT_TRANSFER_OK)
  TransferBufferLength = 000000ff
  TransferBuffer       = 00000000
  TransferBufferMDL    = 81b9af88
    00000000: 00 00 00 fa 03 ff ff ff ff ff ff ff ff ff ff ff
    00000010: ff ff ff ff ff ff ff ff ff ff ff ff ff ff ff ff
    00000020: ff ff ff ff ff ff ff ff ff ff ff ff ff ff ff ff
    00000030: ff ff ff ff ff ff ff ff ff ff ff ff ff ff ff ff
    00000040: ff ff ff ff ff ff ff ff ff ff ff ff ff ff ff ff
    00000050: ff ff ff ff ff ff ff ff ff ff ff ff ff ff ff ff
    00000060: ff ff ff ff ff ff ff ff ff ff ff ff ff ff ff ff
    00000070: ff ff ff ff ff ff ff ff ff ff ff ff ff ff ff ff
    00000080: ff ff ff ff ff ff ff ff ff ff ff ff ff ff ff ff
    00000090: ff ff ff ff ff ff ff ff ff ff ff ff ff ff ff ff
    000000a0: ff ff ff ff ff ff ff ff ff ff ff ff ff ff ff ff
    000000b0: ff ff ff ff ff ff ff ff ff ff ff ff ff ff ff ff
    000000c0: ff ff ff ff ff ff ff ff ff ff ff ff ff ff ff ff
    000000d0: ff ff ff ff ff ff ff ff ff ff ff ff ff ff ff ff
    000000e0: ff ff ff ff ff ff ff ff ff ff ff ff ff ff ff ff
    000000f0: ff ff ff ff ff ff ff ff ff ff ff ff ff ff ff
  UrbLink              = 00000000
[679684 ms] UsbSnoop - DispatchAny(f890e610) : IRP_MJ_INTERNAL_DEVICE_CONTROL
[679684 ms] UsbSnoop - MyDispatchInternalIOCTL(f890fe80) : fdo=81b1aac0, Irp=81bb0348, IRQL=2
[679684 ms]  >>>  URB 121 going down  >>> 
-- URB_FUNCTION_BULK_OR_INTERRUPT_TRANSFER:
  PipeHandle           = 822e77f4 [endpoint 0x00000002]
  TransferFlags        = 00000000 (USBD_TRANSFER_DIRECTION_OUT, ~USBD_SHORT_TRANSFER_OK)
  TransferBufferLength = 00000007
  TransferBuffer       = 00000000
  TransferBufferMDL    = 81b9af88
    00000000: 00 00 00 02 05 e0 00
  UrbLink              = 00000000
[679684 ms] UsbSnoop - MyInternalIOCTLCompletion(f890fdb0) : fido=81b19728, Irp=81bb0348, Context=822db980, IRQL=2
[679684 ms]  <<<  URB 121 coming back  <<< 
-- URB_FUNCTION_BULK_OR_INTERRUPT_TRANSFER:
  PipeHandle           = 822e77f4 [endpoint 0x00000002]
  TransferFlags        = 00000000 (USBD_TRANSFER_DIRECTION_OUT, ~USBD_SHORT_TRANSFER_OK)
  TransferBufferLength = 00000007
  TransferBuffer       = 00000000
  TransferBufferMDL    = 81b9af88
  UrbLink              = 00000000
[679694 ms] UsbSnoop - DispatchAny(f890e610) : IRP_MJ_INTERNAL_DEVICE_CONTROL
[679694 ms] UsbSnoop - MyDispatchInternalIOCTL(f890fe80) : fdo=81b1aac0, Irp=81bb0348, IRQL=2
[679694 ms]  >>>  URB 122 going down  >>> 
-- URB_FUNCTION_BULK_OR_INTERRUPT_TRANSFER:
  PipeHandle           = 822e77d4 [endpoint 0x00000081]
  TransferFlags        = 00000003 (USBD_TRANSFER_DIRECTION_IN, USBD_SHORT_TRANSFER_OK)
  TransferBufferLength = 00000100
  TransferBuffer       = 00000000
  TransferBufferMDL    = 81b9af88
  UrbLink              = 00000000
[680211 ms] UsbSnoop - MyInternalIOCTLCompletion(f890fdb0) : fido=81b19728, Irp=81bb0348, Context=822e2150, IRQL=2
[680212 ms]  <<<  URB 122 coming back  <<< 
-- URB_FUNCTION_BULK_OR_INTERRUPT_TRANSFER:
  PipeHandle           = 822e77d4 [endpoint 0x00000081]
  TransferFlags        = 00000003 (USBD_TRANSFER_DIRECTION_IN, USBD_SHORT_TRANSFER_OK)
  TransferBufferLength = 00000091
  TransferBuffer       = 00000000
  TransferBufferMDL    = 81b9af88
    00000000: 00 00 00 8c 04 ff ff ff ff ff ff ff ff ff ff ff
    00000010: ff ff ff ff ff ff ff ff ff ff ff ff ff ff ff ff
    00000020: ff ff ff ff ff ff ff ff ff ff ff ff ff ff ff ff
    00000030: ff ff ff ff ff ff ff ff ff ff ff ff ff ff ff ff
    00000040: ff ff ff ff ff ff ff ff ff ff ff ff ff ff ff ff
    00000050: ff ff ff ff ff ff ff ff ff ff ff ff ff ff ff ff
    00000060: ff ff ff ff ff ff ff ff ff ff ff ff ff ff ff ff
    00000070: ff 00 00 00 00 00 00 00 00 00 00 00 00 fc ff ff
    00000080: ff ff ff ff ff ff ff ff ff ff ff ff ff ff ff ff
    00000090: ff
  UrbLink              = 00000000
[680244 ms] UsbSnoop - DispatchAny(f890e610) : IRP_MJ_INTERNAL_DEVICE_CONTROL
[680244 ms] UsbSnoop - MyDispatchInternalIOCTL(f890fe80) : fdo=81b1aac0, Irp=81bb0348, IRQL=2
[680244 ms]  >>>  URB 123 going down  >>> 
-- URB_FUNCTION_BULK_OR_INTERRUPT_TRANSFER:
  PipeHandle           = 822e77f4 [endpoint 0x00000002]
  TransferFlags        = 00000000 (USBD_TRANSFER_DIRECTION_OUT, ~USBD_SHORT_TRANSFER_OK)
  TransferBufferLength = 00000007
  TransferBuffer       = 00000000
  TransferBufferMDL    = 81b9af88
    00000000: 00 00 00 02 05 e0 00
  UrbLink              = 00000000
[680245 ms] UsbSnoop - MyInternalIOCTLCompletion(f890fdb0) : fido=81b19728, Irp=81bb0348, Context=81cd51b0, IRQL=2
[680245 ms]  <<<  URB 123 coming back  <<< 
-- URB_FUNCTION_BULK_OR_INTERRUPT_TRANSFER:
  PipeHandle           = 822e77f4 [endpoint 0x00000002]
  TransferFlags        = 00000000 (USBD_TRANSFER_DIRECTION_OUT, ~USBD_SHORT_TRANSFER_OK)
  TransferBufferLength = 00000007
  TransferBuffer       = 00000000
  TransferBufferMDL    = 81b9af88
  UrbLink              = 00000000
[680505 ms] UsbSnoop - DispatchAny(f890e610) : IRP_MJ_INTERNAL_DEVICE_CONTROL
[680505 ms] UsbSnoop - MyDispatchInternalIOCTL(f890fe80) : fdo=81b1aac0, Irp=81bb0348, IRQL=2
[680505 ms]  >>>  URB 124 going down  >>> 
-- URB_FUNCTION_BULK_OR_INTERRUPT_TRANSFER:
  PipeHandle           = 822e77f4 [endpoint 0x00000002]
  TransferFlags        = 00000000 (USBD_TRANSFER_DIRECTION_OUT, ~USBD_SHORT_TRANSFER_OK)
  TransferBufferLength = 00000009
  TransferBuffer       = 00000000
  TransferBufferMDL    = 822d87a0
    00000000: 00 00 00 04 01 00 00 04 00
  UrbLink              = 00000000
[680505 ms] UsbSnoop - MyInternalIOCTLCompletion(f890fdb0) : fido=81b19728, Irp=81bb0348, Context=82307cb8, IRQL=2
[680505 ms]  <<<  URB 124 coming back  <<< 
-- URB_FUNCTION_BULK_OR_INTERRUPT_TRANSFER:
  PipeHandle           = 822e77f4 [endpoint 0x00000002]
  TransferFlags        = 00000000 (USBD_TRANSFER_DIRECTION_OUT, ~USBD_SHORT_TRANSFER_OK)
  TransferBufferLength = 00000009
  TransferBuffer       = 00000000
  TransferBufferMDL    = 822d87a0
  UrbLink              = 00000000
[680505 ms] UsbSnoop - DispatchAny(f890e610) : IRP_MJ_INTERNAL_DEVICE_CONTROL
[680505 ms] UsbSnoop - MyDispatchInternalIOCTL(f890fe80) : fdo=81b1aac0, Irp=81bb0348, IRQL=2
[680505 ms]  >>>  URB 125 going down  >>> 
-- URB_FUNCTION_BULK_OR_INTERRUPT_TRANSFER:
  PipeHandle           = 822e77d4 [endpoint 0x00000081]
  TransferFlags        = 00000003 (USBD_TRANSFER_DIRECTION_IN, USBD_SHORT_TRANSFER_OK)
  TransferBufferLength = 00000100
  TransferBuffer       = 00000000
  TransferBufferMDL    = 822d87a0
  UrbLink              = 00000000
[680518 ms] UsbSnoop - MyInternalIOCTLCompletion(f890fdb0) : fido=81b19728, Irp=81bb0348, Context=81cd51b0, IRQL=2
[680518 ms]  <<<  URB 125 coming back  <<< 
-- URB_FUNCTION_BULK_OR_INTERRUPT_TRANSFER:
  PipeHandle           = 822e77d4 [endpoint 0x00000081]
  TransferFlags        = 00000003 (USBD_TRANSFER_DIRECTION_IN, USBD_SHORT_TRANSFER_OK)
  TransferBufferLength = 00000009
  TransferBuffer       = 00000000
  TransferBufferMDL    = 822d87a0
    00000000: 00 00 00 04 02 00 00 00 fa
  UrbLink              = 00000000
[680545 ms] UsbSnoop - DispatchAny(f890e610) : IRP_MJ_INTERNAL_DEVICE_CONTROL
[680545 ms] UsbSnoop - MyDispatchInternalIOCTL(f890fe80) : fdo=81b1aac0, Irp=81bb0348, IRQL=2
[680545 ms]  >>>  URB 126 going down  >>> 
-- URB_FUNCTION_BULK_OR_INTERRUPT_TRANSFER:
  PipeHandle           = 822e77f4 [endpoint 0x00000002]
  TransferFlags        = 00000000 (USBD_TRANSFER_DIRECTION_OUT, ~USBD_SHORT_TRANSFER_OK)
  TransferBufferLength = 00000015
  TransferBuffer       = 00000000
  TransferBufferMDL    = 822d87a0
    00000000: 00 00 00 10 04 00 00 00 0a 00 01 00 03 00 01 00
    00000010: 00 00 00 07 d0
  UrbLink              = 00000000
[680545 ms] UsbSnoop - MyInternalIOCTLCompletion(f890fdb0) : fido=81b19728, Irp=81bb0348, Context=822db980, IRQL=2
[680545 ms]  <<<  URB 126 coming back  <<< 
-- URB_FUNCTION_BULK_OR_INTERRUPT_TRANSFER:
  PipeHandle           = 822e77f4 [endpoint 0x00000002]
  TransferFlags        = 00000000 (USBD_TRANSFER_DIRECTION_OUT, ~USBD_SHORT_TRANSFER_OK)
  TransferBufferLength = 00000015
  TransferBuffer       = 00000000
  TransferBufferMDL    = 822d87a0
  UrbLink              = 00000000
[680555 ms] UsbSnoop - DispatchAny(f890e610) : IRP_MJ_INTERNAL_DEVICE_CONTROL
[680555 ms] UsbSnoop - MyDispatchInternalIOCTL(f890fe80) : fdo=81b1aac0, Irp=81bb0348, IRQL=2
[680555 ms]  >>>  URB 127 going down  >>> 
-- URB_FUNCTION_BULK_OR_INTERRUPT_TRANSFER:
  PipeHandle           = 822e77d4 [endpoint 0x00000081]
  TransferFlags        = 00000003 (USBD_TRANSFER_DIRECTION_IN, USBD_SHORT_TRANSFER_OK)
  TransferBufferLength = 00000100
  TransferBuffer       = 00000000
  TransferBufferMDL    = 822d87a0
  UrbLink              = 00000000
[680555 ms] UsbSnoop - MyInternalIOCTLCompletion(f890fdb0) : fido=81b19728, Irp=81bb0348, Context=822f29c8, IRQL=2
[680555 ms]  <<<  URB 127 coming back  <<< 
-- URB_FUNCTION_BULK_OR_INTERRUPT_TRANSFER:
  PipeHandle           = 822e77d4 [endpoint 0x00000081]
  TransferFlags        = 00000003 (USBD_TRANSFER_DIRECTION_IN, USBD_SHORT_TRANSFER_OK)
  TransferBufferLength = 00000007
  TransferBuffer       = 00000000
  TransferBufferMDL    = 822d87a0
    00000000: 00 00 00 02 05 e0 00
  UrbLink              = 00000000
[680595 ms] UsbSnoop - DispatchAny(f890e610) : IRP_MJ_INTERNAL_DEVICE_CONTROL
[680595 ms] UsbSnoop - MyDispatchInternalIOCTL(f890fe80) : fdo=81b1aac0, Irp=81bb0348, IRQL=2
[680595 ms]  >>>  URB 128 going down  >>> 
-- URB_FUNCTION_BULK_OR_INTERRUPT_TRANSFER:
  PipeHandle           = 822e77d4 [endpoint 0x00000081]
  TransferFlags        = 00000003 (USBD_TRANSFER_DIRECTION_IN, USBD_SHORT_TRANSFER_OK)
  TransferBufferLength = 00000100
  TransferBuffer       = 00000000
  TransferBufferMDL    = 822d87a0
  UrbLink              = 00000000
[680595 ms] UsbSnoop - MyInternalIOCTLCompletion(f890fdb0) : fido=81b19728, Irp=81bb0348, Context=822db980, IRQL=2
[680595 ms]  <<<  URB 128 coming back  <<< 
-- URB_FUNCTION_BULK_OR_INTERRUPT_TRANSFER:
  PipeHandle           = 822e77d4 [endpoint 0x00000081]
  TransferFlags        = 00000003 (USBD_TRANSFER_DIRECTION_IN, USBD_SHORT_TRANSFER_OK)
  TransferBufferLength = 0000000f
  TransferBuffer       = 00000000
  TransferBufferMDL    = 822d87a0
    00000000: 00 00 00 0a 04 00 00 00 04 00 12 00 00 07 d0
  UrbLink              = 00000000
[680635 ms] UsbSnoop - DispatchAny(f890e610) : IRP_MJ_INTERNAL_DEVICE_CONTROL
[680635 ms] UsbSnoop - MyDispatchInternalIOCTL(f890fe80) : fdo=81b1aac0, Irp=81bb0348, IRQL=2
[680635 ms]  >>>  URB 129 going down  >>> 
-- URB_FUNCTION_BULK_OR_INTERRUPT_TRANSFER:
  PipeHandle           = 822e77f4 [endpoint 0x00000002]
  TransferFlags        = 00000000 (USBD_TRANSFER_DIRECTION_OUT, ~USBD_SHORT_TRANSFER_OK)
  TransferBufferLength = 00000007
  TransferBuffer       = 00000000
  TransferBufferMDL    = 822d87a0
    00000000: 00 00 00 02 05 e0 00
  UrbLink              = 00000000
[680635 ms] UsbSnoop - MyInternalIOCTLCompletion(f890fdb0) : fido=81b19728, Irp=81bb0348, Context=822e2150, IRQL=2
[680635 ms]  <<<  URB 129 coming back  <<< 
-- URB_FUNCTION_BULK_OR_INTERRUPT_TRANSFER:
  PipeHandle           = 822e77f4 [endpoint 0x00000002]
  TransferFlags        = 00000000 (USBD_TRANSFER_DIRECTION_OUT, ~USBD_SHORT_TRANSFER_OK)
  TransferBufferLength = 00000007
  TransferBuffer       = 00000000
  TransferBufferMDL    = 822d87a0
  UrbLink              = 00000000
[680645 ms] UsbSnoop - DispatchAny(f890e610) : IRP_MJ_INTERNAL_DEVICE_CONTROL
[680645 ms] UsbSnoop - MyDispatchInternalIOCTL(f890fe80) : fdo=81b1aac0, Irp=81bb0348, IRQL=2
[680645 ms]  >>>  URB 130 going down  >>> 
-- URB_FUNCTION_BULK_OR_INTERRUPT_TRANSFER:
  PipeHandle           = 822e77f4 [endpoint 0x00000002]
  TransferFlags        = 00000000 (USBD_TRANSFER_DIRECTION_OUT, ~USBD_SHORT_TRANSFER_OK)
  TransferBufferLength = 00000022
  TransferBuffer       = 00000000
  TransferBufferMDL    = 822d87a0
    00000000: 00 00 00 1d 04 00 00 00 17 00 09 00 00 00 06 00
    00000010: 02 00 03 00 05 00 01 00 41 00 42 00 01 00 01 00
    00000020: 01 01
  UrbLink              = 00000000
[680645 ms] UsbSnoop - MyInternalIOCTLCompletion(f890fdb0) : fido=81b19728, Irp=81bb0348, Context=81cd51b0, IRQL=2
[680645 ms]  <<<  URB 130 coming back  <<< 
-- URB_FUNCTION_BULK_OR_INTERRUPT_TRANSFER:
  PipeHandle           = 822e77f4 [endpoint 0x00000002]
  TransferFlags        = 00000000 (USBD_TRANSFER_DIRECTION_OUT, ~USBD_SHORT_TRANSFER_OK)
  TransferBufferLength = 00000022
  TransferBuffer       = 00000000
  TransferBufferMDL    = 822d87a0
  UrbLink              = 00000000
[680655 ms] UsbSnoop - DispatchAny(f890e610) : IRP_MJ_INTERNAL_DEVICE_CONTROL
[680655 ms] UsbSnoop - MyDispatchInternalIOCTL(f890fe80) : fdo=81b1aac0, Irp=81bb0348, IRQL=2
[680655 ms]  >>>  URB 131 going down  >>> 
-- URB_FUNCTION_BULK_OR_INTERRUPT_TRANSFER:
  PipeHandle           = 822e77d4 [endpoint 0x00000081]
  TransferFlags        = 00000003 (USBD_TRANSFER_DIRECTION_IN, USBD_SHORT_TRANSFER_OK)
  TransferBufferLength = 00000100
  TransferBuffer       = 00000000
  TransferBufferMDL    = 822d87a0
  UrbLink              = 00000000
[680659 ms] UsbSnoop - MyInternalIOCTLCompletion(f890fdb0) : fido=81b19728, Irp=81bb0348, Context=82307cb8, IRQL=2
[680659 ms]  <<<  URB 131 coming back  <<< 
-- URB_FUNCTION_BULK_OR_INTERRUPT_TRANSFER:
  PipeHandle           = 822e77d4 [endpoint 0x00000081]
  TransferFlags        = 00000003 (USBD_TRANSFER_DIRECTION_IN, USBD_SHORT_TRANSFER_OK)
  TransferBufferLength = 00000007
  TransferBuffer       = 00000000
  TransferBufferMDL    = 822d87a0
    00000000: 00 00 00 02 05 e0 00
  UrbLink              = 00000000
[680695 ms] UsbSnoop - DispatchAny(f890e610) : IRP_MJ_INTERNAL_DEVICE_CONTROL
[680695 ms] UsbSnoop - MyDispatchInternalIOCTL(f890fe80) : fdo=81b1aac0, Irp=81bb0348, IRQL=2
[680695 ms]  >>>  URB 132 going down  >>> 
-- URB_FUNCTION_BULK_OR_INTERRUPT_TRANSFER:
  PipeHandle           = 822e77d4 [endpoint 0x00000081]
  TransferFlags        = 00000003 (USBD_TRANSFER_DIRECTION_IN, USBD_SHORT_TRANSFER_OK)
  TransferBufferLength = 00000100
  TransferBuffer       = 00000000
  TransferBufferMDL    = 822d87a0
  UrbLink              = 00000000
[680695 ms] UsbSnoop - MyInternalIOCTLCompletion(f890fdb0) : fido=81b19728, Irp=81bb0348, Context=822e2150, IRQL=2
[680695 ms]  <<<  URB 132 coming back  <<< 
-- URB_FUNCTION_BULK_OR_INTERRUPT_TRANSFER:
  PipeHandle           = 822e77d4 [endpoint 0x00000081]
  TransferFlags        = 00000003 (USBD_TRANSFER_DIRECTION_IN, USBD_SHORT_TRANSFER_OK)
  TransferBufferLength = 00000032
  TransferBuffer       = 00000000
  TransferBufferMDL    = 822d87a0
    00000000: 00 00 00 2d 04 00 00 00 27 00 0a 00 01 43 00 00
    00000010: 06 00 02 00 00 04 f0 07 00 00 00 03 00 00 01 01
    00000020: 00 05 01 00 01 00 00 04 00 00 00 09 00 41 01 00
    00000030: 42 01
  UrbLink              = 00000000
[680735 ms] UsbSnoop - DispatchAny(f890e610) : IRP_MJ_INTERNAL_DEVICE_CONTROL
[680735 ms] UsbSnoop - MyDispatchInternalIOCTL(f890fe80) : fdo=81b1aac0, Irp=81bb0348, IRQL=2
[680735 ms]  >>>  URB 133 going down  >>> 
-- URB_FUNCTION_BULK_OR_INTERRUPT_TRANSFER:
  PipeHandle           = 822e77f4 [endpoint 0x00000002]
  TransferFlags        = 00000000 (USBD_TRANSFER_DIRECTION_OUT, ~USBD_SHORT_TRANSFER_OK)
  TransferBufferLength = 00000007
  TransferBuffer       = 00000000
  TransferBufferMDL    = 822d87a0
    00000000: 00 00 00 02 05 e0 00
  UrbLink              = 00000000
[680736 ms] UsbSnoop - MyInternalIOCTLCompletion(f890fdb0) : fido=81b19728, Irp=81bb0348, Context=82307cb8, IRQL=2
[680736 ms]  <<<  URB 133 coming back  <<< 
-- URB_FUNCTION_BULK_OR_INTERRUPT_TRANSFER:
  PipeHandle           = 822e77f4 [endpoint 0x00000002]
  TransferFlags        = 00000000 (USBD_TRANSFER_DIRECTION_OUT, ~USBD_SHORT_TRANSFER_OK)
  TransferBufferLength = 00000007
  TransferBuffer       = 00000000
  TransferBufferMDL    = 822d87a0
  UrbLink              = 00000000
[680745 ms] UsbSnoop - DispatchAny(f890e610) : IRP_MJ_INTERNAL_DEVICE_CONTROL
[680745 ms] UsbSnoop - MyDispatchInternalIOCTL(f890fe80) : fdo=81b1aac0, Irp=81bb0348, IRQL=2
[680745 ms]  >>>  URB 134 going down  >>> 
-- URB_FUNCTION_BULK_OR_INTERRUPT_TRANSFER:
  PipeHandle           = 822e77d4 [endpoint 0x00000081]
  TransferFlags        = 00000003 (USBD_TRANSFER_DIRECTION_IN, USBD_SHORT_TRANSFER_OK)
  TransferBufferLength = 00000100
  TransferBuffer       = 00000000
  TransferBufferMDL    = 822d87a0
  UrbLink              = 00000000
[680772 ms] UsbSnoop - MyInternalIOCTLCompletion(f890fdb0) : fido=81b19728, Irp=81bb0348, Context=81b05970, IRQL=2
[680772 ms]  <<<  URB 134 coming back  <<< 
-- URB_FUNCTION_BULK_OR_INTERRUPT_TRANSFER:
  PipeHandle           = 822e77d4 [endpoint 0x00000081]
  TransferFlags        = 00000003 (USBD_TRANSFER_DIRECTION_IN, USBD_SHORT_TRANSFER_OK)
  TransferBufferLength = 00000032
  TransferBuffer       = 00000000
  TransferBufferMDL    = 822d87a0
    00000000: 00 00 00 2d 04 00 00 00 27 00 0a 00 01 41 00 00
    00000010: 06 00 02 00 00 04 f0 07 00 00 00 03 00 00 01 00
    00000020: 00 05 01 00 01 00 00 04 00 00 00 09 00 41 01 00
    00000030: 42 01
  UrbLink              = 00000000
[680805 ms] UsbSnoop - DispatchAny(f890e610) : IRP_MJ_INTERNAL_DEVICE_CONTROL
[680805 ms] UsbSnoop - MyDispatchInternalIOCTL(f890fe80) : fdo=81b1aac0, Irp=81bb0348, IRQL=2
[680805 ms]  >>>  URB 135 going down  >>> 
-- URB_FUNCTION_BULK_OR_INTERRUPT_TRANSFER:
  PipeHandle           = 822e77f4 [endpoint 0x00000002]
  TransferFlags        = 00000000 (USBD_TRANSFER_DIRECTION_OUT, ~USBD_SHORT_TRANSFER_OK)
  TransferBufferLength = 00000007
  TransferBuffer       = 00000000
  TransferBufferMDL    = 822d87a0
    00000000: 00 00 00 02 05 e0 00
  UrbLink              = 00000000
[680805 ms] UsbSnoop - MyInternalIOCTLCompletion(f890fdb0) : fido=81b19728, Irp=81bb0348, Context=822e2150, IRQL=2
[680806 ms]  <<<  URB 135 coming back  <<< 
-- URB_FUNCTION_BULK_OR_INTERRUPT_TRANSFER:
  PipeHandle           = 822e77f4 [endpoint 0x00000002]
  TransferFlags        = 00000000 (USBD_TRANSFER_DIRECTION_OUT, ~USBD_SHORT_TRANSFER_OK)
  TransferBufferLength = 00000007
  TransferBuffer       = 00000000
  TransferBufferMDL    = 822d87a0
  UrbLink              = 00000000
[680815 ms] UsbSnoop - DispatchAny(f890e610) : IRP_MJ_INTERNAL_DEVICE_CONTROL
[680815 ms] UsbSnoop - MyDispatchInternalIOCTL(f890fe80) : fdo=81b1aac0, Irp=81bb0348, IRQL=2
[680815 ms]  >>>  URB 136 going down  >>> 
-- URB_FUNCTION_BULK_OR_INTERRUPT_TRANSFER:
  PipeHandle           = 822e77d4 [endpoint 0x00000081]
  TransferFlags        = 00000003 (USBD_TRANSFER_DIRECTION_IN, USBD_SHORT_TRANSFER_OK)
  TransferBufferLength = 00000100
  TransferBuffer       = 00000000
  TransferBufferMDL    = 822d87a0
  UrbLink              = 00000000
[680815 ms] UsbSnoop - MyInternalIOCTLCompletion(f890fdb0) : fido=81b19728, Irp=81bb0348, Context=822f29c8, IRQL=2
[680816 ms]  <<<  URB 136 coming back  <<< 
-- URB_FUNCTION_BULK_OR_INTERRUPT_TRANSFER:
  PipeHandle           = 822e77d4 [endpoint 0x00000081]
  TransferFlags        = 00000003 (USBD_TRANSFER_DIRECTION_IN, USBD_SHORT_TRANSFER_OK)
  TransferBufferLength = 00000032
  TransferBuffer       = 00000000
  TransferBufferMDL    = 822d87a0
    00000000: 00 00 00 2d 04 00 00 00 27 00 0a 00 01 42 00 00
    00000010: 06 00 02 00 00 04 f0 07 00 00 00 03 00 00 01 00
    00000020: 00 05 01 00 01 00 00 04 00 00 00 09 00 41 01 00
    00000030: 42 01
  UrbLink              = 00000000
[680855 ms] UsbSnoop - DispatchAny(f890e610) : IRP_MJ_INTERNAL_DEVICE_CONTROL
[680855 ms] UsbSnoop - MyDispatchInternalIOCTL(f890fe80) : fdo=81b1aac0, Irp=81b52e48, IRQL=2
[680855 ms]  >>>  URB 137 going down  >>> 
-- URB_FUNCTION_BULK_OR_INTERRUPT_TRANSFER:
  PipeHandle           = 822e77f4 [endpoint 0x00000002]
  TransferFlags        = 00000000 (USBD_TRANSFER_DIRECTION_OUT, ~USBD_SHORT_TRANSFER_OK)
  TransferBufferLength = 00000007
  TransferBuffer       = 00000000
  TransferBufferMDL    = 822d87a0
    00000000: 00 00 00 02 05 e0 00
  UrbLink              = 00000000
[680856 ms] UsbSnoop - MyInternalIOCTLCompletion(f890fdb0) : fido=81b19728, Irp=81b52e48, Context=822e2150, IRQL=2
[680856 ms]  <<<  URB 137 coming back  <<< 
-- URB_FUNCTION_BULK_OR_INTERRUPT_TRANSFER:
  PipeHandle           = 822e77f4 [endpoint 0x00000002]
  TransferFlags        = 00000000 (USBD_TRANSFER_DIRECTION_OUT, ~USBD_SHORT_TRANSFER_OK)
  TransferBufferLength = 00000007
  TransferBuffer       = 00000000
  TransferBufferMDL    = 822d87a0
  UrbLink              = 00000000
[680865 ms] UsbSnoop - DispatchAny(f890e610) : IRP_MJ_INTERNAL_DEVICE_CONTROL
[680865 ms] UsbSnoop - MyDispatchInternalIOCTL(f890fe80) : fdo=81b1aac0, Irp=81b52e48, IRQL=2
[680865 ms]  >>>  URB 138 going down  >>> 
-- URB_FUNCTION_BULK_OR_INTERRUPT_TRANSFER:
  PipeHandle           = 822e77d4 [endpoint 0x00000081]
  TransferFlags        = 00000003 (USBD_TRANSFER_DIRECTION_IN, USBD_SHORT_TRANSFER_OK)
  TransferBufferLength = 00000100
  TransferBuffer       = 00000000
  TransferBufferMDL    = 822d87a0
  UrbLink              = 00000000
[680866 ms] UsbSnoop - MyInternalIOCTLCompletion(f890fdb0) : fido=81b19728, Irp=81b52e48, Context=81cd51b0, IRQL=2
[680866 ms]  <<<  URB 138 coming back  <<< 
-- URB_FUNCTION_BULK_OR_INTERRUPT_TRANSFER:
  PipeHandle           = 822e77d4 [endpoint 0x00000081]
  TransferFlags        = 00000003 (USBD_TRANSFER_DIRECTION_IN, USBD_SHORT_TRANSFER_OK)
  TransferBufferLength = 00000035
  TransferBuffer       = 00000000
  TransferBufferMDL    = 822d87a0
    00000000: 00 00 00 30 04 00 00 00 2a 00 0a 00 04 4c e2 82
    00000010: 81 00 00 06 00 02 00 00 04 f0 07 00 01 00 03 00
    00000020: 00 01 00 00 05 01 00 01 00 00 04 00 00 00 02 00
    00000030: 41 01 00 42 01
  UrbLink              = 00000000
[680906 ms] UsbSnoop - DispatchAny(f890e610) : IRP_MJ_INTERNAL_DEVICE_CONTROL
[680906 ms] UsbSnoop - MyDispatchInternalIOCTL(f890fe80) : fdo=81b1aac0, Irp=81b52e48, IRQL=2
[680906 ms]  >>>  URB 139 going down  >>> 
-- URB_FUNCTION_BULK_OR_INTERRUPT_TRANSFER:
  PipeHandle           = 822e77f4 [endpoint 0x00000002]
  TransferFlags        = 00000000 (USBD_TRANSFER_DIRECTION_OUT, ~USBD_SHORT_TRANSFER_OK)
  TransferBufferLength = 00000007
  TransferBuffer       = 00000000
  TransferBufferMDL    = 822d87a0
    00000000: 00 00 00 02 05 e0 00
  UrbLink              = 00000000
[680906 ms] UsbSnoop - MyInternalIOCTLCompletion(f890fdb0) : fido=81b19728, Irp=81b52e48, Context=81b05970, IRQL=2
[680906 ms]  <<<  URB 139 coming back  <<< 
-- URB_FUNCTION_BULK_OR_INTERRUPT_TRANSFER:
  PipeHandle           = 822e77f4 [endpoint 0x00000002]
  TransferFlags        = 00000000 (USBD_TRANSFER_DIRECTION_OUT, ~USBD_SHORT_TRANSFER_OK)
  TransferBufferLength = 00000007
  TransferBuffer       = 00000000
  TransferBufferMDL    = 822d87a0
  UrbLink              = 00000000
[680916 ms] UsbSnoop - DispatchAny(f890e610) : IRP_MJ_INTERNAL_DEVICE_CONTROL
[680916 ms] UsbSnoop - MyDispatchInternalIOCTL(f890fe80) : fdo=81b1aac0, Irp=81b52e48, IRQL=2
[680916 ms]  >>>  URB 140 going down  >>> 
-- URB_FUNCTION_BULK_OR_INTERRUPT_TRANSFER:
  PipeHandle           = 822e77d4 [endpoint 0x00000081]
  TransferFlags        = 00000003 (USBD_TRANSFER_DIRECTION_IN, USBD_SHORT_TRANSFER_OK)
  TransferBufferLength = 00000100
  TransferBuffer       = 00000000
  TransferBufferMDL    = 822d87a0
  UrbLink              = 00000000
[680916 ms] UsbSnoop - MyInternalIOCTLCompletion(f890fdb0) : fido=81b19728, Irp=81b52e48, Context=822f29c8, IRQL=2
[680916 ms]  <<<  URB 140 coming back  <<< 
-- URB_FUNCTION_BULK_OR_INTERRUPT_TRANSFER:
  PipeHandle           = 822e77d4 [endpoint 0x00000081]
  TransferFlags        = 00000003 (USBD_TRANSFER_DIRECTION_IN, USBD_SHORT_TRANSFER_OK)
  TransferBufferLength = 00000035
  TransferBuffer       = 00000000
  TransferBufferMDL    = 822d87a0
    00000000: 00 00 00 30 04 00 00 00 2a 00 0a 00 04 4c e2 82
    00000010: 82 00 00 06 00 02 00 00 04 f0 07 00 01 00 03 00
    00000020: 00 01 00 00 05 01 00 01 00 00 04 00 00 00 02 00
    00000030: 41 01 00 42 01
  UrbLink              = 00000000
[680956 ms] UsbSnoop - DispatchAny(f890e610) : IRP_MJ_INTERNAL_DEVICE_CONTROL
[680956 ms] UsbSnoop - MyDispatchInternalIOCTL(f890fe80) : fdo=81b1aac0, Irp=81b52e48, IRQL=2
[680956 ms]  >>>  URB 141 going down  >>> 
-- URB_FUNCTION_BULK_OR_INTERRUPT_TRANSFER:
  PipeHandle           = 822e77f4 [endpoint 0x00000002]
  TransferFlags        = 00000000 (USBD_TRANSFER_DIRECTION_OUT, ~USBD_SHORT_TRANSFER_OK)
  TransferBufferLength = 00000007
  TransferBuffer       = 00000000
  TransferBufferMDL    = 822d87a0
    00000000: 00 00 00 02 05 e0 00
  UrbLink              = 00000000
[680956 ms] UsbSnoop - MyInternalIOCTLCompletion(f890fdb0) : fido=81b19728, Irp=81b52e48, Context=81b05970, IRQL=2
[680956 ms]  <<<  URB 141 coming back  <<< 
-- URB_FUNCTION_BULK_OR_INTERRUPT_TRANSFER:
  PipeHandle           = 822e77f4 [endpoint 0x00000002]
  TransferFlags        = 00000000 (USBD_TRANSFER_DIRECTION_OUT, ~USBD_SHORT_TRANSFER_OK)
  TransferBufferLength = 00000007
  TransferBuffer       = 00000000
  TransferBufferMDL    = 822d87a0
  UrbLink              = 00000000
[680966 ms] UsbSnoop - DispatchAny(f890e610) : IRP_MJ_INTERNAL_DEVICE_CONTROL
[680966 ms] UsbSnoop - MyDispatchInternalIOCTL(f890fe80) : fdo=81b1aac0, Irp=81b52e48, IRQL=2
[680966 ms]  >>>  URB 142 going down  >>> 
-- URB_FUNCTION_BULK_OR_INTERRUPT_TRANSFER:
  PipeHandle           = 822e77d4 [endpoint 0x00000081]
  TransferFlags        = 00000003 (USBD_TRANSFER_DIRECTION_IN, USBD_SHORT_TRANSFER_OK)
  TransferBufferLength = 00000100
  TransferBuffer       = 00000000
  TransferBufferMDL    = 822d87a0
  UrbLink              = 00000000
[680966 ms] UsbSnoop - MyInternalIOCTLCompletion(f890fdb0) : fido=81b19728, Irp=81b52e48, Context=81cd51b0, IRQL=2
[680966 ms]  <<<  URB 142 coming back  <<< 
-- URB_FUNCTION_BULK_OR_INTERRUPT_TRANSFER:
  PipeHandle           = 822e77d4 [endpoint 0x00000081]
  TransferFlags        = 00000003 (USBD_TRANSFER_DIRECTION_IN, USBD_SHORT_TRANSFER_OK)
  TransferBufferLength = 00000035
  TransferBuffer       = 00000000
  TransferBufferMDL    = 822d87a0
    00000000: 00 00 00 30 04 00 00 00 2a 00 0a 00 04 4c e2 82
    00000010: 83 00 00 06 00 02 00 00 04 f0 07 00 01 00 03 00
    00000020: 00 01 00 00 05 01 00 01 00 00 04 00 00 00 02 00
    00000030: 41 01 00 42 01
  UrbLink              = 00000000
[681006 ms] UsbSnoop - DispatchAny(f890e610) : IRP_MJ_INTERNAL_DEVICE_CONTROL
[681006 ms] UsbSnoop - MyDispatchInternalIOCTL(f890fe80) : fdo=81b1aac0, Irp=81b52e48, IRQL=2
[681006 ms]  >>>  URB 143 going down  >>> 
-- URB_FUNCTION_BULK_OR_INTERRUPT_TRANSFER:
  PipeHandle           = 822e77f4 [endpoint 0x00000002]
  TransferFlags        = 00000000 (USBD_TRANSFER_DIRECTION_OUT, ~USBD_SHORT_TRANSFER_OK)
  TransferBufferLength = 00000007
  TransferBuffer       = 00000000
  TransferBufferMDL    = 822d87a0
    00000000: 00 00 00 02 05 e0 00
  UrbLink              = 00000000
[681006 ms] UsbSnoop - MyInternalIOCTLCompletion(f890fdb0) : fido=81b19728, Irp=81b52e48, Context=81b05970, IRQL=2
[681006 ms]  <<<  URB 143 coming back  <<< 
-- URB_FUNCTION_BULK_OR_INTERRUPT_TRANSFER:
  PipeHandle           = 822e77f4 [endpoint 0x00000002]
  TransferFlags        = 00000000 (USBD_TRANSFER_DIRECTION_OUT, ~USBD_SHORT_TRANSFER_OK)
  TransferBufferLength = 00000007
  TransferBuffer       = 00000000
  TransferBufferMDL    = 822d87a0
  UrbLink              = 00000000
[681016 ms] UsbSnoop - DispatchAny(f890e610) : IRP_MJ_INTERNAL_DEVICE_CONTROL
[681016 ms] UsbSnoop - MyDispatchInternalIOCTL(f890fe80) : fdo=81b1aac0, Irp=81b52e48, IRQL=2
[681016 ms]  >>>  URB 144 going down  >>> 
-- URB_FUNCTION_BULK_OR_INTERRUPT_TRANSFER:
  PipeHandle           = 822e77d4 [endpoint 0x00000081]
  TransferFlags        = 00000003 (USBD_TRANSFER_DIRECTION_IN, USBD_SHORT_TRANSFER_OK)
  TransferBufferLength = 00000100
  TransferBuffer       = 00000000
  TransferBufferMDL    = 822d87a0
  UrbLink              = 00000000
[681016 ms] UsbSnoop - MyInternalIOCTLCompletion(f890fdb0) : fido=81b19728, Irp=81b52e48, Context=822db980, IRQL=2
[681016 ms]  <<<  URB 144 coming back  <<< 
-- URB_FUNCTION_BULK_OR_INTERRUPT_TRANSFER:
  PipeHandle           = 822e77d4 [endpoint 0x00000081]
  TransferFlags        = 00000003 (USBD_TRANSFER_DIRECTION_IN, USBD_SHORT_TRANSFER_OK)
  TransferBufferLength = 00000035
  TransferBuffer       = 00000000
  TransferBufferMDL    = 822d87a0
    00000000: 00 00 00 30 04 00 00 00 2a 00 0a 00 04 4c e2 82
    00000010: 84 00 00 06 00 02 00 00 04 f0 07 00 01 00 03 00
    00000020: 00 01 00 00 05 01 00 01 00 00 04 00 00 00 02 00
    00000030: 41 01 00 42 01
  UrbLink              = 00000000
[681056 ms] UsbSnoop - DispatchAny(f890e610) : IRP_MJ_INTERNAL_DEVICE_CONTROL
[681056 ms] UsbSnoop - MyDispatchInternalIOCTL(f890fe80) : fdo=81b1aac0, Irp=81b52e48, IRQL=2
[681056 ms]  >>>  URB 145 going down  >>> 
-- URB_FUNCTION_BULK_OR_INTERRUPT_TRANSFER:
  PipeHandle           = 822e77f4 [endpoint 0x00000002]
  TransferFlags        = 00000000 (USBD_TRANSFER_DIRECTION_OUT, ~USBD_SHORT_TRANSFER_OK)
  TransferBufferLength = 00000007
  TransferBuffer       = 00000000
  TransferBufferMDL    = 822d87a0
    00000000: 00 00 00 02 05 e0 00
  UrbLink              = 00000000
[681056 ms] UsbSnoop - MyInternalIOCTLCompletion(f890fdb0) : fido=81b19728, Irp=81b52e48, Context=82307cb8, IRQL=2
[681056 ms]  <<<  URB 145 coming back  <<< 
-- URB_FUNCTION_BULK_OR_INTERRUPT_TRANSFER:
  PipeHandle           = 822e77f4 [endpoint 0x00000002]
  TransferFlags        = 00000000 (USBD_TRANSFER_DIRECTION_OUT, ~USBD_SHORT_TRANSFER_OK)
  TransferBufferLength = 00000007
  TransferBuffer       = 00000000
  TransferBufferMDL    = 822d87a0
  UrbLink              = 00000000
[681066 ms] UsbSnoop - DispatchAny(f890e610) : IRP_MJ_INTERNAL_DEVICE_CONTROL
[681066 ms] UsbSnoop - MyDispatchInternalIOCTL(f890fe80) : fdo=81b1aac0, Irp=81b52e48, IRQL=2
[681066 ms]  >>>  URB 146 going down  >>> 
-- URB_FUNCTION_BULK_OR_INTERRUPT_TRANSFER:
  PipeHandle           = 822e77d4 [endpoint 0x00000081]
  TransferFlags        = 00000003 (USBD_TRANSFER_DIRECTION_IN, USBD_SHORT_TRANSFER_OK)
  TransferBufferLength = 00000100
  TransferBuffer       = 00000000
  TransferBufferMDL    = 822d87a0
  UrbLink              = 00000000
[681066 ms] UsbSnoop - MyInternalIOCTLCompletion(f890fdb0) : fido=81b19728, Irp=81b52e48, Context=82307cb8, IRQL=2
[681066 ms]  <<<  URB 146 coming back  <<< 
-- URB_FUNCTION_BULK_OR_INTERRUPT_TRANSFER:
  PipeHandle           = 822e77d4 [endpoint 0x00000081]
  TransferFlags        = 00000003 (USBD_TRANSFER_DIRECTION_IN, USBD_SHORT_TRANSFER_OK)
  TransferBufferLength = 00000035
  TransferBuffer       = 00000000
  TransferBufferMDL    = 822d87a0
    00000000: 00 00 00 30 04 00 00 00 2a 00 0a 00 04 4c e2 82
    00000010: 85 00 00 06 00 02 00 00 04 f0 07 00 01 00 03 00
    00000020: 00 01 00 00 05 01 00 01 00 00 04 00 00 00 02 00
    00000030: 41 01 00 42 01
  UrbLink              = 00000000
[681106 ms] UsbSnoop - DispatchAny(f890e610) : IRP_MJ_INTERNAL_DEVICE_CONTROL
[681106 ms] UsbSnoop - MyDispatchInternalIOCTL(f890fe80) : fdo=81b1aac0, Irp=81b52e48, IRQL=2
[681106 ms]  >>>  URB 147 going down  >>> 
-- URB_FUNCTION_BULK_OR_INTERRUPT_TRANSFER:
  PipeHandle           = 822e77f4 [endpoint 0x00000002]
  TransferFlags        = 00000000 (USBD_TRANSFER_DIRECTION_OUT, ~USBD_SHORT_TRANSFER_OK)
  TransferBufferLength = 00000007
  TransferBuffer       = 00000000
  TransferBufferMDL    = 822d87a0
    00000000: 00 00 00 02 05 e0 00
  UrbLink              = 00000000
[681106 ms] UsbSnoop - MyInternalIOCTLCompletion(f890fdb0) : fido=81b19728, Irp=81b52e48, Context=81cd51b0, IRQL=2
[681106 ms]  <<<  URB 147 coming back  <<< 
-- URB_FUNCTION_BULK_OR_INTERRUPT_TRANSFER:
  PipeHandle           = 822e77f4 [endpoint 0x00000002]
  TransferFlags        = 00000000 (USBD_TRANSFER_DIRECTION_OUT, ~USBD_SHORT_TRANSFER_OK)
  TransferBufferLength = 00000007
  TransferBuffer       = 00000000
  TransferBufferMDL    = 822d87a0
  UrbLink              = 00000000
[681116 ms] UsbSnoop - DispatchAny(f890e610) : IRP_MJ_INTERNAL_DEVICE_CONTROL
[681116 ms] UsbSnoop - MyDispatchInternalIOCTL(f890fe80) : fdo=81b1aac0, Irp=81b52e48, IRQL=2
[681116 ms]  >>>  URB 148 going down  >>> 
-- URB_FUNCTION_BULK_OR_INTERRUPT_TRANSFER:
  PipeHandle           = 822e77d4 [endpoint 0x00000081]
  TransferFlags        = 00000003 (USBD_TRANSFER_DIRECTION_IN, USBD_SHORT_TRANSFER_OK)
  TransferBufferLength = 00000100
  TransferBuffer       = 00000000
  TransferBufferMDL    = 822d87a0
  UrbLink              = 00000000
[681116 ms] UsbSnoop - MyInternalIOCTLCompletion(f890fdb0) : fido=81b19728, Irp=81b52e48, Context=822e2150, IRQL=2
[681116 ms]  <<<  URB 148 coming back  <<< 
-- URB_FUNCTION_BULK_OR_INTERRUPT_TRANSFER:
  PipeHandle           = 822e77d4 [endpoint 0x00000081]
  TransferFlags        = 00000003 (USBD_TRANSFER_DIRECTION_IN, USBD_SHORT_TRANSFER_OK)
  TransferBufferLength = 00000035
  TransferBuffer       = 00000000
  TransferBufferMDL    = 822d87a0
    00000000: 00 00 00 30 04 00 00 00 2a 00 0a 00 04 4c e2 82
    00000010: 86 00 00 06 00 02 00 00 04 f0 07 00 01 00 03 00
    00000020: 00 01 00 00 05 01 00 01 00 00 04 00 00 00 02 00
    00000030: 41 01 00 42 01
  UrbLink              = 00000000
[681156 ms] UsbSnoop - DispatchAny(f890e610) : IRP_MJ_INTERNAL_DEVICE_CONTROL
[681156 ms] UsbSnoop - MyDispatchInternalIOCTL(f890fe80) : fdo=81b1aac0, Irp=81aef220, IRQL=2
[681156 ms]  >>>  URB 149 going down  >>> 
-- URB_FUNCTION_BULK_OR_INTERRUPT_TRANSFER:
  PipeHandle           = 822e77f4 [endpoint 0x00000002]
  TransferFlags        = 00000000 (USBD_TRANSFER_DIRECTION_OUT, ~USBD_SHORT_TRANSFER_OK)
  TransferBufferLength = 00000007
  TransferBuffer       = 00000000
  TransferBufferMDL    = 822d87a0
    00000000: 00 00 00 02 05 e0 00
  UrbLink              = 00000000
[681156 ms] UsbSnoop - MyInternalIOCTLCompletion(f890fdb0) : fido=81b19728, Irp=81aef220, Context=81b05970, IRQL=2
[681156 ms]  <<<  URB 149 coming back  <<< 
-- URB_FUNCTION_BULK_OR_INTERRUPT_TRANSFER:
  PipeHandle           = 822e77f4 [endpoint 0x00000002]
  TransferFlags        = 00000000 (USBD_TRANSFER_DIRECTION_OUT, ~USBD_SHORT_TRANSFER_OK)
  TransferBufferLength = 00000007
  TransferBuffer       = 00000000
  TransferBufferMDL    = 822d87a0
  UrbLink              = 00000000
[681166 ms] UsbSnoop - DispatchAny(f890e610) : IRP_MJ_INTERNAL_DEVICE_CONTROL
[681166 ms] UsbSnoop - MyDispatchInternalIOCTL(f890fe80) : fdo=81b1aac0, Irp=81aef220, IRQL=2
[681166 ms]  >>>  URB 150 going down  >>> 
-- URB_FUNCTION_BULK_OR_INTERRUPT_TRANSFER:
  PipeHandle           = 822e77d4 [endpoint 0x00000081]
  TransferFlags        = 00000003 (USBD_TRANSFER_DIRECTION_IN, USBD_SHORT_TRANSFER_OK)
  TransferBufferLength = 00000100
  TransferBuffer       = 00000000
  TransferBufferMDL    = 822d87a0
  UrbLink              = 00000000
[681192 ms] UsbSnoop - MyInternalIOCTLCompletion(f890fdb0) : fido=81b19728, Irp=81aef220, Context=822db980, IRQL=2
[681192 ms]  <<<  URB 150 coming back  <<< 
-- URB_FUNCTION_BULK_OR_INTERRUPT_TRANSFER:
  PipeHandle           = 822e77d4 [endpoint 0x00000081]
  TransferFlags        = 00000003 (USBD_TRANSFER_DIRECTION_IN, USBD_SHORT_TRANSFER_OK)
  TransferBufferLength = 00000039
  TransferBuffer       = 00000000
  TransferBufferMDL    = 822d87a0
    00000000: 00 00 00 34 04 00 00 00 2e 00 0a 00 08 43 42 4c
    00000010: 45 78 70 6d 74 00 00 06 00 02 00 00 04 f0 07 00
    00000020: 24 00 03 00 00 01 01 00 05 01 00 01 00 00 04 00
    00000030: 00 6c 6f 00 41 01 00 42 01
  UrbLink              = 00000000
[681226 ms] UsbSnoop - DispatchAny(f890e610) : IRP_MJ_INTERNAL_DEVICE_CONTROL
[681226 ms] UsbSnoop - MyDispatchInternalIOCTL(f890fe80) : fdo=81b1aac0, Irp=81aef220, IRQL=2
[681226 ms]  >>>  URB 151 going down  >>> 
-- URB_FUNCTION_BULK_OR_INTERRUPT_TRANSFER:
  PipeHandle           = 822e77f4 [endpoint 0x00000002]
  TransferFlags        = 00000000 (USBD_TRANSFER_DIRECTION_OUT, ~USBD_SHORT_TRANSFER_OK)
  TransferBufferLength = 00000007
  TransferBuffer       = 00000000
  TransferBufferMDL    = 822d87a0
    00000000: 00 00 00 02 05 e0 00
  UrbLink              = 00000000
[681226 ms] UsbSnoop - MyInternalIOCTLCompletion(f890fdb0) : fido=81b19728, Irp=81aef220, Context=822e2150, IRQL=2
[681226 ms]  <<<  URB 151 coming back  <<< 
-- URB_FUNCTION_BULK_OR_INTERRUPT_TRANSFER:
  PipeHandle           = 822e77f4 [endpoint 0x00000002]
  TransferFlags        = 00000000 (USBD_TRANSFER_DIRECTION_OUT, ~USBD_SHORT_TRANSFER_OK)
  TransferBufferLength = 00000007
  TransferBuffer       = 00000000
  TransferBufferMDL    = 822d87a0
  UrbLink              = 00000000
[681236 ms] UsbSnoop - DispatchAny(f890e610) : IRP_MJ_INTERNAL_DEVICE_CONTROL
[681236 ms] UsbSnoop - MyDispatchInternalIOCTL(f890fe80) : fdo=81b1aac0, Irp=81aef220, IRQL=2
[681236 ms]  >>>  URB 152 going down  >>> 
-- URB_FUNCTION_BULK_OR_INTERRUPT_TRANSFER:
  PipeHandle           = 822e77d4 [endpoint 0x00000081]
  TransferFlags        = 00000003 (USBD_TRANSFER_DIRECTION_IN, USBD_SHORT_TRANSFER_OK)
  TransferBufferLength = 00000100
  TransferBuffer       = 00000000
  TransferBufferMDL    = 822d87a0
  UrbLink              = 00000000
[681236 ms] UsbSnoop - MyInternalIOCTLCompletion(f890fdb0) : fido=81b19728, Irp=81aef220, Context=822e2150, IRQL=2
[681236 ms]  <<<  URB 152 coming back  <<< 
-- URB_FUNCTION_BULK_OR_INTERRUPT_TRANSFER:
  PipeHandle           = 822e77d4 [endpoint 0x00000081]
  TransferFlags        = 00000003 (USBD_TRANSFER_DIRECTION_IN, USBD_SHORT_TRANSFER_OK)
  TransferBufferLength = 0000000b
  TransferBuffer       = 00000000
  TransferBufferMDL    = 822d87a0
    00000000: 00 00 00 06 04 00 00 00 00 dd 00
  UrbLink              = 00000000
[681278 ms] UsbSnoop - DispatchAny(f890e610) : IRP_MJ_INTERNAL_DEVICE_CONTROL
[681278 ms] UsbSnoop - MyDispatchInternalIOCTL(f890fe80) : fdo=81b1aac0, Irp=81aef220, IRQL=2
[681278 ms]  >>>  URB 153 going down  >>> 
-- URB_FUNCTION_BULK_OR_INTERRUPT_TRANSFER:
  PipeHandle           = 822e77f4 [endpoint 0x00000002]
  TransferFlags        = 00000000 (USBD_TRANSFER_DIRECTION_OUT, ~USBD_SHORT_TRANSFER_OK)
  TransferBufferLength = 00000007
  TransferBuffer       = 00000000
  TransferBufferMDL    = 81b9af88
    00000000: 00 00 00 02 05 e0 00
  UrbLink              = 00000000
[681278 ms] UsbSnoop - MyInternalIOCTLCompletion(f890fdb0) : fido=81b19728, Irp=81aef220, Context=822f29c8, IRQL=2
[681278 ms]  <<<  URB 153 coming back  <<< 
-- URB_FUNCTION_BULK_OR_INTERRUPT_TRANSFER:
  PipeHandle           = 822e77f4 [endpoint 0x00000002]
  TransferFlags        = 00000000 (USBD_TRANSFER_DIRECTION_OUT, ~USBD_SHORT_TRANSFER_OK)
  TransferBufferLength = 00000007
  TransferBuffer       = 00000000
  TransferBufferMDL    = 81b9af88
  UrbLink              = 00000000
[681537 ms] UsbSnoop - DispatchAny(f890e610) : IRP_MJ_INTERNAL_DEVICE_CONTROL
[681537 ms] UsbSnoop - MyDispatchInternalIOCTL(f890fe80) : fdo=81b1aac0, Irp=81aef220, IRQL=2
[681537 ms]  >>>  URB 154 going down  >>> 
-- URB_FUNCTION_BULK_OR_INTERRUPT_TRANSFER:
  PipeHandle           = 822e77f4 [endpoint 0x00000002]
  TransferFlags        = 00000000 (USBD_TRANSFER_DIRECTION_OUT, ~USBD_SHORT_TRANSFER_OK)
  TransferBufferLength = 00000009
  TransferBuffer       = 00000000
  TransferBufferMDL    = 81b9af88
    00000000: 00 00 00 04 01 00 00 04 00
  UrbLink              = 00000000
[681537 ms] UsbSnoop - MyInternalIOCTLCompletion(f890fdb0) : fido=81b19728, Irp=81aef220, Context=81cd51b0, IRQL=2
[681537 ms]  <<<  URB 154 coming back  <<< 
-- URB_FUNCTION_BULK_OR_INTERRUPT_TRANSFER:
  PipeHandle           = 822e77f4 [endpoint 0x00000002]
  TransferFlags        = 00000000 (USBD_TRANSFER_DIRECTION_OUT, ~USBD_SHORT_TRANSFER_OK)
  TransferBufferLength = 00000009
  TransferBuffer       = 00000000
  TransferBufferMDL    = 81b9af88
  UrbLink              = 00000000
[681537 ms] UsbSnoop - DispatchAny(f890e610) : IRP_MJ_INTERNAL_DEVICE_CONTROL
[681537 ms] UsbSnoop - MyDispatchInternalIOCTL(f890fe80) : fdo=81b1aac0, Irp=81aef220, IRQL=2
[681537 ms]  >>>  URB 155 going down  >>> 
-- URB_FUNCTION_BULK_OR_INTERRUPT_TRANSFER:
  PipeHandle           = 822e77d4 [endpoint 0x00000081]
  TransferFlags        = 00000003 (USBD_TRANSFER_DIRECTION_IN, USBD_SHORT_TRANSFER_OK)
  TransferBufferLength = 00000100
  TransferBuffer       = 00000000
  TransferBufferMDL    = 81b9af88
  UrbLink              = 00000000
[681548 ms] UsbSnoop - MyInternalIOCTLCompletion(f890fdb0) : fido=81b19728, Irp=81aef220, Context=82307cb8, IRQL=2
[681548 ms]  <<<  URB 155 coming back  <<< 
-- URB_FUNCTION_BULK_OR_INTERRUPT_TRANSFER:
  PipeHandle           = 822e77d4 [endpoint 0x00000081]
  TransferFlags        = 00000003 (USBD_TRANSFER_DIRECTION_IN, USBD_SHORT_TRANSFER_OK)
  TransferBufferLength = 00000009
  TransferBuffer       = 00000000
  TransferBufferMDL    = 81b9af88
    00000000: 00 00 00 04 02 00 00 00 fa
  UrbLink              = 00000000
[681577 ms] UsbSnoop - DispatchAny(f890e610) : IRP_MJ_INTERNAL_DEVICE_CONTROL
[681577 ms] UsbSnoop - MyDispatchInternalIOCTL(f890fe80) : fdo=81b1aac0, Irp=81aef220, IRQL=2
[681577 ms]  >>>  URB 156 going down  >>> 
-- URB_FUNCTION_BULK_OR_INTERRUPT_TRANSFER:
  PipeHandle           = 822e77f4 [endpoint 0x00000002]
  TransferFlags        = 00000000 (USBD_TRANSFER_DIRECTION_OUT, ~USBD_SHORT_TRANSFER_OK)
  TransferBufferLength = 00000015
  TransferBuffer       = 00000000
  TransferBufferMDL    = 81b9af88
    00000000: 00 00 00 10 04 00 00 00 0a 00 01 00 03 00 01 00
    00000010: 00 00 00 07 d0
  UrbLink              = 00000000
[681577 ms] UsbSnoop - MyInternalIOCTLCompletion(f890fdb0) : fido=81b19728, Irp=81aef220, Context=822f29c8, IRQL=2
[681577 ms]  <<<  URB 156 coming back  <<< 
-- URB_FUNCTION_BULK_OR_INTERRUPT_TRANSFER:
  PipeHandle           = 822e77f4 [endpoint 0x00000002]
  TransferFlags        = 00000000 (USBD_TRANSFER_DIRECTION_OUT, ~USBD_SHORT_TRANSFER_OK)
  TransferBufferLength = 00000015
  TransferBuffer       = 00000000
  TransferBufferMDL    = 81b9af88
  UrbLink              = 00000000
[681587 ms] UsbSnoop - DispatchAny(f890e610) : IRP_MJ_INTERNAL_DEVICE_CONTROL
[681587 ms] UsbSnoop - MyDispatchInternalIOCTL(f890fe80) : fdo=81b1aac0, Irp=81aef220, IRQL=2
[681587 ms]  >>>  URB 157 going down  >>> 
-- URB_FUNCTION_BULK_OR_INTERRUPT_TRANSFER:
  PipeHandle           = 822e77d4 [endpoint 0x00000081]
  TransferFlags        = 00000003 (USBD_TRANSFER_DIRECTION_IN, USBD_SHORT_TRANSFER_OK)
  TransferBufferLength = 00000100
  TransferBuffer       = 00000000
  TransferBufferMDL    = 81b9af88
  UrbLink              = 00000000
[681587 ms] UsbSnoop - MyInternalIOCTLCompletion(f890fdb0) : fido=81b19728, Irp=81aef220, Context=81b05970, IRQL=2
[681587 ms]  <<<  URB 157 coming back  <<< 
-- URB_FUNCTION_BULK_OR_INTERRUPT_TRANSFER:
  PipeHandle           = 822e77d4 [endpoint 0x00000081]
  TransferFlags        = 00000003 (USBD_TRANSFER_DIRECTION_IN, USBD_SHORT_TRANSFER_OK)
  TransferBufferLength = 00000007
  TransferBuffer       = 00000000
  TransferBufferMDL    = 81b9af88
    00000000: 00 00 00 02 05 e0 00
  UrbLink              = 00000000
[681627 ms] UsbSnoop - DispatchAny(f890e610) : IRP_MJ_INTERNAL_DEVICE_CONTROL
[681627 ms] UsbSnoop - MyDispatchInternalIOCTL(f890fe80) : fdo=81b1aac0, Irp=81aef220, IRQL=2
[681627 ms]  >>>  URB 158 going down  >>> 
-- URB_FUNCTION_BULK_OR_INTERRUPT_TRANSFER:
  PipeHandle           = 822e77d4 [endpoint 0x00000081]
  TransferFlags        = 00000003 (USBD_TRANSFER_DIRECTION_IN, USBD_SHORT_TRANSFER_OK)
  TransferBufferLength = 00000100
  TransferBuffer       = 00000000
  TransferBufferMDL    = 81b9af88
  UrbLink              = 00000000
[681628 ms] UsbSnoop - MyInternalIOCTLCompletion(f890fdb0) : fido=81b19728, Irp=81aef220, Context=82307cb8, IRQL=2
[681628 ms]  <<<  URB 158 coming back  <<< 
-- URB_FUNCTION_BULK_OR_INTERRUPT_TRANSFER:
  PipeHandle           = 822e77d4 [endpoint 0x00000081]
  TransferFlags        = 00000003 (USBD_TRANSFER_DIRECTION_IN, USBD_SHORT_TRANSFER_OK)
  TransferBufferLength = 0000000f
  TransferBuffer       = 00000000
  TransferBufferMDL    = 81b9af88
    00000000: 00 00 00 0a 04 00 00 00 04 00 12 00 00 07 d0
  UrbLink              = 00000000
[681667 ms] UsbSnoop - DispatchAny(f890e610) : IRP_MJ_INTERNAL_DEVICE_CONTROL
[681667 ms] UsbSnoop - MyDispatchInternalIOCTL(f890fe80) : fdo=81b1aac0, Irp=81aef220, IRQL=2
[681667 ms]  >>>  URB 159 going down  >>> 
-- URB_FUNCTION_BULK_OR_INTERRUPT_TRANSFER:
  PipeHandle           = 822e77f4 [endpoint 0x00000002]
  TransferFlags        = 00000000 (USBD_TRANSFER_DIRECTION_OUT, ~USBD_SHORT_TRANSFER_OK)
  TransferBufferLength = 00000007
  TransferBuffer       = 00000000
  TransferBufferMDL    = 81b9af88
    00000000: 00 00 00 02 05 e0 00
  UrbLink              = 00000000
[681667 ms] UsbSnoop - MyInternalIOCTLCompletion(f890fdb0) : fido=81b19728, Irp=81aef220, Context=81b05970, IRQL=2
[681667 ms]  <<<  URB 159 coming back  <<< 
-- URB_FUNCTION_BULK_OR_INTERRUPT_TRANSFER:
  PipeHandle           = 822e77f4 [endpoint 0x00000002]
  TransferFlags        = 00000000 (USBD_TRANSFER_DIRECTION_OUT, ~USBD_SHORT_TRANSFER_OK)
  TransferBufferLength = 00000007
  TransferBuffer       = 00000000
  TransferBufferMDL    = 81b9af88
  UrbLink              = 00000000
[681678 ms] UsbSnoop - DispatchAny(f890e610) : IRP_MJ_INTERNAL_DEVICE_CONTROL
[681678 ms] UsbSnoop - MyDispatchInternalIOCTL(f890fe80) : fdo=81b1aac0, Irp=81aef220, IRQL=2
[681678 ms]  >>>  URB 160 going down  >>> 
-- URB_FUNCTION_BULK_OR_INTERRUPT_TRANSFER:
  PipeHandle           = 822e77f4 [endpoint 0x00000002]
  TransferFlags        = 00000000 (USBD_TRANSFER_DIRECTION_OUT, ~USBD_SHORT_TRANSFER_OK)
  TransferBufferLength = 0000000f
  TransferBuffer       = 00000000
  TransferBufferMDL    = 81b9af88
    00000000: 00 00 00 0a 04 00 00 00 04 00 07 00 01 00 0e
  UrbLink              = 00000000
[681678 ms] UsbSnoop - MyInternalIOCTLCompletion(f890fdb0) : fido=81b19728, Irp=81aef220, Context=822db980, IRQL=2
[681678 ms]  <<<  URB 160 coming back  <<< 
-- URB_FUNCTION_BULK_OR_INTERRUPT_TRANSFER:
  PipeHandle           = 822e77f4 [endpoint 0x00000002]
  TransferFlags        = 00000000 (USBD_TRANSFER_DIRECTION_OUT, ~USBD_SHORT_TRANSFER_OK)
  TransferBufferLength = 0000000f
  TransferBuffer       = 00000000
  TransferBufferMDL    = 81b9af88
  UrbLink              = 00000000
[681687 ms] UsbSnoop - DispatchAny(f890e610) : IRP_MJ_INTERNAL_DEVICE_CONTROL
[681687 ms] UsbSnoop - MyDispatchInternalIOCTL(f890fe80) : fdo=81b1aac0, Irp=822d9840, IRQL=2
[681687 ms]  >>>  URB 161 going down  >>> 
-- URB_FUNCTION_BULK_OR_INTERRUPT_TRANSFER:
  PipeHandle           = 822e77d4 [endpoint 0x00000081]
  TransferFlags        = 00000003 (USBD_TRANSFER_DIRECTION_IN, USBD_SHORT_TRANSFER_OK)
  TransferBufferLength = 00000100
  TransferBuffer       = 00000000
  TransferBufferMDL    = 81b9af88
  UrbLink              = 00000000
[681688 ms] UsbSnoop - MyInternalIOCTLCompletion(f890fdb0) : fido=81b19728, Irp=822d9840, Context=822f29c8, IRQL=2
[681688 ms]  <<<  URB 161 coming back  <<< 
-- URB_FUNCTION_BULK_OR_INTERRUPT_TRANSFER:
  PipeHandle           = 822e77d4 [endpoint 0x00000081]
  TransferFlags        = 00000003 (USBD_TRANSFER_DIRECTION_IN, USBD_SHORT_TRANSFER_OK)
  TransferBufferLength = 00000007
  TransferBuffer       = 00000000
  TransferBufferMDL    = 81b9af88
    00000000: 00 00 00 02 05 e0 00
  UrbLink              = 00000000
[681727 ms] UsbSnoop - DispatchAny(f890e610) : IRP_MJ_INTERNAL_DEVICE_CONTROL
[681727 ms] UsbSnoop - MyDispatchInternalIOCTL(f890fe80) : fdo=81b1aac0, Irp=822d9840, IRQL=2
[681727 ms]  >>>  URB 162 going down  >>> 
-- URB_FUNCTION_BULK_OR_INTERRUPT_TRANSFER:
  PipeHandle           = 822e77d4 [endpoint 0x00000081]
  TransferFlags        = 00000003 (USBD_TRANSFER_DIRECTION_IN, USBD_SHORT_TRANSFER_OK)
  TransferBufferLength = 00000100
  TransferBuffer       = 00000000
  TransferBufferMDL    = 81b9af88
  UrbLink              = 00000000
[681727 ms] UsbSnoop - MyInternalIOCTLCompletion(f890fdb0) : fido=81b19728, Irp=822d9840, Context=81b05970, IRQL=2
[681727 ms]  <<<  URB 162 coming back  <<< 
-- URB_FUNCTION_BULK_OR_INTERRUPT_TRANSFER:
  PipeHandle           = 822e77d4 [endpoint 0x00000081]
  TransferFlags        = 00000003 (USBD_TRANSFER_DIRECTION_IN, USBD_SHORT_TRANSFER_OK)
  TransferBufferLength = 0000000f
  TransferBuffer       = 00000000
  TransferBufferMDL    = 81b9af88
    00000000: 00 00 00 0a 04 00 00 00 04 bb 00 00 01 d4 c0
  UrbLink              = 00000000
[681767 ms] UsbSnoop - DispatchAny(f890e610) : IRP_MJ_INTERNAL_DEVICE_CONTROL
[681767 ms] UsbSnoop - MyDispatchInternalIOCTL(f890fe80) : fdo=81b1aac0, Irp=822d9840, IRQL=2
[681767 ms]  >>>  URB 163 going down  >>> 
-- URB_FUNCTION_BULK_OR_INTERRUPT_TRANSFER:
  PipeHandle           = 822e77f4 [endpoint 0x00000002]
  TransferFlags        = 00000000 (USBD_TRANSFER_DIRECTION_OUT, ~USBD_SHORT_TRANSFER_OK)
  TransferBufferLength = 00000007
  TransferBuffer       = 00000000
  TransferBufferMDL    = 81b9af88
    00000000: 00 00 00 02 05 e0 00
  UrbLink              = 00000000
[681767 ms] UsbSnoop - MyInternalIOCTLCompletion(f890fdb0) : fido=81b19728, Irp=822d9840, Context=822f29c8, IRQL=2
[681767 ms]  <<<  URB 163 coming back  <<< 
-- URB_FUNCTION_BULK_OR_INTERRUPT_TRANSFER:
  PipeHandle           = 822e77f4 [endpoint 0x00000002]
  TransferFlags        = 00000000 (USBD_TRANSFER_DIRECTION_OUT, ~USBD_SHORT_TRANSFER_OK)
  TransferBufferLength = 00000007
  TransferBuffer       = 00000000
  TransferBufferMDL    = 81b9af88
  UrbLink              = 00000000
[681777 ms] UsbSnoop - DispatchAny(f890e610) : IRP_MJ_INTERNAL_DEVICE_CONTROL
[681777 ms] UsbSnoop - MyDispatchInternalIOCTL(f890fe80) : fdo=81b1aac0, Irp=822d9840, IRQL=2
[681777 ms]  >>>  URB 164 going down  >>> 
-- URB_FUNCTION_BULK_OR_INTERRUPT_TRANSFER:
  PipeHandle           = 822e77d4 [endpoint 0x00000081]
  TransferFlags        = 00000003 (USBD_TRANSFER_DIRECTION_IN, USBD_SHORT_TRANSFER_OK)
  TransferBufferLength = 00000100
  TransferBuffer       = 00000000
  TransferBufferMDL    = 81b9af88
  UrbLink              = 00000000
[681777 ms] UsbSnoop - MyInternalIOCTLCompletion(f890fdb0) : fido=81b19728, Irp=822d9840, Context=822e2150, IRQL=2
[681777 ms]  <<<  URB 164 coming back  <<< 
-- URB_FUNCTION_BULK_OR_INTERRUPT_TRANSFER:
  PipeHandle           = 822e77d4 [endpoint 0x00000081]
  TransferFlags        = 00000003 (USBD_TRANSFER_DIRECTION_IN, USBD_SHORT_TRANSFER_OK)
  TransferBufferLength = 0000001a
  TransferBuffer       = 00000000
  TransferBufferMDL    = 81b9af88
    00000000: 00 00 00 15 04 00 00 00 0f 00 08 00 01 00 0e 00
    00000010: 00 08 00 00 00 00 00 00 5e d0
  UrbLink              = 00000000
[681817 ms] UsbSnoop - DispatchAny(f890e610) : IRP_MJ_INTERNAL_DEVICE_CONTROL
[681817 ms] UsbSnoop - MyDispatchInternalIOCTL(f890fe80) : fdo=81b1aac0, Irp=822d9840, IRQL=2
[681817 ms]  >>>  URB 165 going down  >>> 
-- URB_FUNCTION_BULK_OR_INTERRUPT_TRANSFER:
  PipeHandle           = 822e77f4 [endpoint 0x00000002]
  TransferFlags        = 00000000 (USBD_TRANSFER_DIRECTION_OUT, ~USBD_SHORT_TRANSFER_OK)
  TransferBufferLength = 00000007
  TransferBuffer       = 00000000
  TransferBufferMDL    = 81b9af88
    00000000: 00 00 00 02 05 e0 00
  UrbLink              = 00000000
[681817 ms] UsbSnoop - MyInternalIOCTLCompletion(f890fdb0) : fido=81b19728, Irp=822d9840, Context=81cd51b0, IRQL=2
[681817 ms]  <<<  URB 165 coming back  <<< 
-- URB_FUNCTION_BULK_OR_INTERRUPT_TRANSFER:
  PipeHandle           = 822e77f4 [endpoint 0x00000002]
  TransferFlags        = 00000000 (USBD_TRANSFER_DIRECTION_OUT, ~USBD_SHORT_TRANSFER_OK)
  TransferBufferLength = 00000007
  TransferBuffer       = 00000000
  TransferBufferMDL    = 81b9af88
  UrbLink              = 00000000
[682079 ms] UsbSnoop - DispatchAny(f890e610) : IRP_MJ_INTERNAL_DEVICE_CONTROL
[682079 ms] UsbSnoop - MyDispatchInternalIOCTL(f890fe80) : fdo=81b1aac0, Irp=822d9840, IRQL=2
[682079 ms]  >>>  URB 166 going down  >>> 
-- URB_FUNCTION_BULK_OR_INTERRUPT_TRANSFER:
  PipeHandle           = 822e77f4 [endpoint 0x00000002]
  TransferFlags        = 00000000 (USBD_TRANSFER_DIRECTION_OUT, ~USBD_SHORT_TRANSFER_OK)
  TransferBufferLength = 00000009
  TransferBuffer       = 00000000
  TransferBufferMDL    = 81b9af88
    00000000: 00 00 00 04 01 00 00 04 00
  UrbLink              = 00000000
[682079 ms] UsbSnoop - MyInternalIOCTLCompletion(f890fdb0) : fido=81b19728, Irp=822d9840, Context=822db980, IRQL=2
[682079 ms]  <<<  URB 166 coming back  <<< 
-- URB_FUNCTION_BULK_OR_INTERRUPT_TRANSFER:
  PipeHandle           = 822e77f4 [endpoint 0x00000002]
  TransferFlags        = 00000000 (USBD_TRANSFER_DIRECTION_OUT, ~USBD_SHORT_TRANSFER_OK)
  TransferBufferLength = 00000009
  TransferBuffer       = 00000000
  TransferBufferMDL    = 81b9af88
  UrbLink              = 00000000
[682079 ms] UsbSnoop - DispatchAny(f890e610) : IRP_MJ_INTERNAL_DEVICE_CONTROL
[682079 ms] UsbSnoop - MyDispatchInternalIOCTL(f890fe80) : fdo=81b1aac0, Irp=822d9840, IRQL=2
[682079 ms]  >>>  URB 167 going down  >>> 
-- URB_FUNCTION_BULK_OR_INTERRUPT_TRANSFER:
  PipeHandle           = 822e77d4 [endpoint 0x00000081]
  TransferFlags        = 00000003 (USBD_TRANSFER_DIRECTION_IN, USBD_SHORT_TRANSFER_OK)
  TransferBufferLength = 00000100
  TransferBuffer       = 00000000
  TransferBufferMDL    = 81b9af88
  UrbLink              = 00000000
[682086 ms] UsbSnoop - MyInternalIOCTLCompletion(f890fdb0) : fido=81b19728, Irp=822d9840, Context=81b05970, IRQL=2
[682086 ms]  <<<  URB 167 coming back  <<< 
-- URB_FUNCTION_BULK_OR_INTERRUPT_TRANSFER:
  PipeHandle           = 822e77d4 [endpoint 0x00000081]
  TransferFlags        = 00000003 (USBD_TRANSFER_DIRECTION_IN, USBD_SHORT_TRANSFER_OK)
  TransferBufferLength = 00000009
  TransferBuffer       = 00000000
  TransferBufferMDL    = 81b9af88
    00000000: 00 00 00 04 02 00 00 00 fa
  UrbLink              = 00000000
[682107 ms] UsbSnoop - DispatchAny(f890e610) : IRP_MJ_INTERNAL_DEVICE_CONTROL
[682107 ms] UsbSnoop - MyDispatchInternalIOCTL(f890fe80) : fdo=81b1aac0, Irp=822d9840, IRQL=2
[682107 ms]  >>>  URB 168 going down  >>> 
-- URB_FUNCTION_BULK_OR_INTERRUPT_TRANSFER:
  PipeHandle           = 822e77f4 [endpoint 0x00000002]
  TransferFlags        = 00000000 (USBD_TRANSFER_DIRECTION_OUT, ~USBD_SHORT_TRANSFER_OK)
  TransferBufferLength = 00000015
  TransferBuffer       = 00000000
  TransferBufferMDL    = 81b9af88
    00000000: 00 00 00 10 04 00 00 00 0a 00 01 00 03 00 01 00
    00000010: 00 00 00 07 d0
  UrbLink              = 00000000
[682108 ms] UsbSnoop - MyInternalIOCTLCompletion(f890fdb0) : fido=81b19728, Irp=822d9840, Context=81cd51b0, IRQL=2
[682108 ms]  <<<  URB 168 coming back  <<< 
-- URB_FUNCTION_BULK_OR_INTERRUPT_TRANSFER:
  PipeHandle           = 822e77f4 [endpoint 0x00000002]
  TransferFlags        = 00000000 (USBD_TRANSFER_DIRECTION_OUT, ~USBD_SHORT_TRANSFER_OK)
  TransferBufferLength = 00000015
  TransferBuffer       = 00000000
  TransferBufferMDL    = 81b9af88
  UrbLink              = 00000000
[682117 ms] UsbSnoop - DispatchAny(f890e610) : IRP_MJ_INTERNAL_DEVICE_CONTROL
[682117 ms] UsbSnoop - MyDispatchInternalIOCTL(f890fe80) : fdo=81b1aac0, Irp=822d9840, IRQL=2
[682117 ms]  >>>  URB 169 going down  >>> 
-- URB_FUNCTION_BULK_OR_INTERRUPT_TRANSFER:
  PipeHandle           = 822e77d4 [endpoint 0x00000081]
  TransferFlags        = 00000003 (USBD_TRANSFER_DIRECTION_IN, USBD_SHORT_TRANSFER_OK)
  TransferBufferLength = 00000100
  TransferBuffer       = 00000000
  TransferBufferMDL    = 81b9af88
  UrbLink              = 00000000
[682118 ms] UsbSnoop - MyInternalIOCTLCompletion(f890fdb0) : fido=81b19728, Irp=822d9840, Context=822f29c8, IRQL=2
[682118 ms]  <<<  URB 169 coming back  <<< 
-- URB_FUNCTION_BULK_OR_INTERRUPT_TRANSFER:
  PipeHandle           = 822e77d4 [endpoint 0x00000081]
  TransferFlags        = 00000003 (USBD_TRANSFER_DIRECTION_IN, USBD_SHORT_TRANSFER_OK)
  TransferBufferLength = 00000007
  TransferBuffer       = 00000000
  TransferBufferMDL    = 81b9af88
    00000000: 00 00 00 02 05 e0 00
  UrbLink              = 00000000
[682158 ms] UsbSnoop - DispatchAny(f890e610) : IRP_MJ_INTERNAL_DEVICE_CONTROL
[682158 ms] UsbSnoop - MyDispatchInternalIOCTL(f890fe80) : fdo=81b1aac0, Irp=822d9840, IRQL=2
[682158 ms]  >>>  URB 170 going down  >>> 
-- URB_FUNCTION_BULK_OR_INTERRUPT_TRANSFER:
  PipeHandle           = 822e77d4 [endpoint 0x00000081]
  TransferFlags        = 00000003 (USBD_TRANSFER_DIRECTION_IN, USBD_SHORT_TRANSFER_OK)
  TransferBufferLength = 00000100
  TransferBuffer       = 00000000
  TransferBufferMDL    = 81b9af88
  UrbLink              = 00000000
[682158 ms] UsbSnoop - MyInternalIOCTLCompletion(f890fdb0) : fido=81b19728, Irp=822d9840, Context=81cd51b0, IRQL=2
[682158 ms]  <<<  URB 170 coming back  <<< 
-- URB_FUNCTION_BULK_OR_INTERRUPT_TRANSFER:
  PipeHandle           = 822e77d4 [endpoint 0x00000081]
  TransferFlags        = 00000003 (USBD_TRANSFER_DIRECTION_IN, USBD_SHORT_TRANSFER_OK)
  TransferBufferLength = 0000000f
  TransferBuffer       = 00000000
  TransferBufferMDL    = 81b9af88
    00000000: 00 00 00 0a 04 00 00 00 04 00 12 00 00 07 d0
  UrbLink              = 00000000
[682198 ms] UsbSnoop - DispatchAny(f890e610) : IRP_MJ_INTERNAL_DEVICE_CONTROL
[682198 ms] UsbSnoop - MyDispatchInternalIOCTL(f890fe80) : fdo=81b1aac0, Irp=822d9840, IRQL=2
[682198 ms]  >>>  URB 171 going down  >>> 
-- URB_FUNCTION_BULK_OR_INTERRUPT_TRANSFER:
  PipeHandle           = 822e77f4 [endpoint 0x00000002]
  TransferFlags        = 00000000 (USBD_TRANSFER_DIRECTION_OUT, ~USBD_SHORT_TRANSFER_OK)
  TransferBufferLength = 00000007
  TransferBuffer       = 00000000
  TransferBufferMDL    = 81b9af88
    00000000: 00 00 00 02 05 e0 00
  UrbLink              = 00000000
[682198 ms] UsbSnoop - MyInternalIOCTLCompletion(f890fdb0) : fido=81b19728, Irp=822d9840, Context=822db980, IRQL=2
[682198 ms]  <<<  URB 171 coming back  <<< 
-- URB_FUNCTION_BULK_OR_INTERRUPT_TRANSFER:
  PipeHandle           = 822e77f4 [endpoint 0x00000002]
  TransferFlags        = 00000000 (USBD_TRANSFER_DIRECTION_OUT, ~USBD_SHORT_TRANSFER_OK)
  TransferBufferLength = 00000007
  TransferBuffer       = 00000000
  TransferBufferMDL    = 81b9af88
  UrbLink              = 00000000
[682208 ms] UsbSnoop - DispatchAny(f890e610) : IRP_MJ_INTERNAL_DEVICE_CONTROL
[682208 ms] UsbSnoop - MyDispatchInternalIOCTL(f890fe80) : fdo=81b1aac0, Irp=822d9840, IRQL=2
[682208 ms]  >>>  URB 172 going down  >>> 
-- URB_FUNCTION_BULK_OR_INTERRUPT_TRANSFER:
  PipeHandle           = 822e77f4 [endpoint 0x00000002]
  TransferFlags        = 00000000 (USBD_TRANSFER_DIRECTION_OUT, ~USBD_SHORT_TRANSFER_OK)
  TransferBufferLength = 0000002d
  TransferBuffer       = 00000000
  TransferBufferMDL    = 81b9af88
    00000000: 00 00 00 28 04 00 00 00 22 00 0c 00 08 43 42 4c
    00000010: 45 78 70 6d 74 00 01 ff ff ff ff 00 02 00 03 00
    00000020: 08 00 01 00 11 00 04 f0 07 00 24 00 00
  UrbLink              = 00000000
[682208 ms] UsbSnoop - MyInternalIOCTLCompletion(f890fdb0) : fido=81b19728, Irp=822d9840, Context=81cd51b0, IRQL=2
[682208 ms]  <<<  URB 172 coming back  <<< 
-- URB_FUNCTION_BULK_OR_INTERRUPT_TRANSFER:
  PipeHandle           = 822e77f4 [endpoint 0x00000002]
  TransferFlags        = 00000000 (USBD_TRANSFER_DIRECTION_OUT, ~USBD_SHORT_TRANSFER_OK)
  TransferBufferLength = 0000002d
  TransferBuffer       = 00000000
  TransferBufferMDL    = 81b9af88
  UrbLink              = 00000000
[682218 ms] UsbSnoop - DispatchAny(f890e610) : IRP_MJ_INTERNAL_DEVICE_CONTROL
[682218 ms] UsbSnoop - MyDispatchInternalIOCTL(f890fe80) : fdo=81b1aac0, Irp=822d9840, IRQL=2
[682218 ms]  >>>  URB 173 going down  >>> 
-- URB_FUNCTION_BULK_OR_INTERRUPT_TRANSFER:
  PipeHandle           = 822e77d4 [endpoint 0x00000081]
  TransferFlags        = 00000003 (USBD_TRANSFER_DIRECTION_IN, USBD_SHORT_TRANSFER_OK)
  TransferBufferLength = 00000100
  TransferBuffer       = 00000000
  TransferBufferMDL    = 81b9af88
  UrbLink              = 00000000
[682219 ms] UsbSnoop - MyInternalIOCTLCompletion(f890fdb0) : fido=81b19728, Irp=822d9840, Context=822f29c8, IRQL=2
[682219 ms]  <<<  URB 173 coming back  <<< 
-- URB_FUNCTION_BULK_OR_INTERRUPT_TRANSFER:
  PipeHandle           = 822e77d4 [endpoint 0x00000081]
  TransferFlags        = 00000003 (USBD_TRANSFER_DIRECTION_IN, USBD_SHORT_TRANSFER_OK)
  TransferBufferLength = 00000007
  TransferBuffer       = 00000000
  TransferBufferMDL    = 81b9af88
    00000000: 00 00 00 02 05 e0 00
  UrbLink              = 00000000
[682258 ms] UsbSnoop - DispatchAny(f890e610) : IRP_MJ_INTERNAL_DEVICE_CONTROL
[682258 ms] UsbSnoop - MyDispatchInternalIOCTL(f890fe80) : fdo=81b1aac0, Irp=822d9840, IRQL=2
[682258 ms]  >>>  URB 174 going down  >>> 
-- URB_FUNCTION_BULK_OR_INTERRUPT_TRANSFER:
  PipeHandle           = 822e77d4 [endpoint 0x00000081]
  TransferFlags        = 00000003 (USBD_TRANSFER_DIRECTION_IN, USBD_SHORT_TRANSFER_OK)
  TransferBufferLength = 00000100
  TransferBuffer       = 00000000
  TransferBufferMDL    = 81b9af88
  UrbLink              = 00000000
[682258 ms] UsbSnoop - MyInternalIOCTLCompletion(f890fdb0) : fido=81b19728, Irp=822d9840, Context=82307cb8, IRQL=2
[682258 ms]  <<<  URB 174 coming back  <<< 
-- URB_FUNCTION_BULK_OR_INTERRUPT_TRANSFER:
  PipeHandle           = 822e77d4 [endpoint 0x00000081]
  TransferFlags        = 00000003 (USBD_TRANSFER_DIRECTION_IN, USBD_SHORT_TRANSFER_OK)
  TransferBufferLength = 00000027
  TransferBuffer       = 00000000
  TransferBufferMDL    = 81b9af88
    00000000: 00 00 00 22 04 00 00 00 1c 00 0a 00 08 43 42 4c
    00000010: 45 78 70 6d 74 00 00 02 00 03 00 00 01 01 00 08
    00000020: 00 00 04 00 00 00 00
  UrbLink              = 00000000
[682298 ms] UsbSnoop - DispatchAny(f890e610) : IRP_MJ_INTERNAL_DEVICE_CONTROL
[682298 ms] UsbSnoop - MyDispatchInternalIOCTL(f890fe80) : fdo=81b1aac0, Irp=822d9840, IRQL=2
[682298 ms]  >>>  URB 175 going down  >>> 
-- URB_FUNCTION_BULK_OR_INTERRUPT_TRANSFER:
  PipeHandle           = 822e77f4 [endpoint 0x00000002]
  TransferFlags        = 00000000 (USBD_TRANSFER_DIRECTION_OUT, ~USBD_SHORT_TRANSFER_OK)
  TransferBufferLength = 00000007
  TransferBuffer       = 00000000
  TransferBufferMDL    = 81b9af88
    00000000: 00 00 00 02 05 e0 00
  UrbLink              = 00000000
[682298 ms] UsbSnoop - MyInternalIOCTLCompletion(f890fdb0) : fido=81b19728, Irp=822d9840, Context=822f29c8, IRQL=2
[682298 ms]  <<<  URB 175 coming back  <<< 
-- URB_FUNCTION_BULK_OR_INTERRUPT_TRANSFER:
  PipeHandle           = 822e77f4 [endpoint 0x00000002]
  TransferFlags        = 00000000 (USBD_TRANSFER_DIRECTION_OUT, ~USBD_SHORT_TRANSFER_OK)
  TransferBufferLength = 00000007
  TransferBuffer       = 00000000
  TransferBufferMDL    = 81b9af88
  UrbLink              = 00000000
[682308 ms] UsbSnoop - DispatchAny(f890e610) : IRP_MJ_INTERNAL_DEVICE_CONTROL
[682308 ms] UsbSnoop - MyDispatchInternalIOCTL(f890fe80) : fdo=81b1aac0, Irp=822d9840, IRQL=2
[682308 ms]  >>>  URB 176 going down  >>> 
-- URB_FUNCTION_BULK_OR_INTERRUPT_TRANSFER:
  PipeHandle           = 822e77d4 [endpoint 0x00000081]
  TransferFlags        = 00000003 (USBD_TRANSFER_DIRECTION_IN, USBD_SHORT_TRANSFER_OK)
  TransferBufferLength = 00000100
  TransferBuffer       = 00000000
  TransferBufferMDL    = 81b9af88
  UrbLink              = 00000000
[682331 ms] UsbSnoop - MyInternalIOCTLCompletion(f890fdb0) : fido=81b19728, Irp=822d9840, Context=822e2150, IRQL=2
[682331 ms]  <<<  URB 176 coming back  <<< 
-- URB_FUNCTION_BULK_OR_INTERRUPT_TRANSFER:
  PipeHandle           = 822e77d4 [endpoint 0x00000081]
  TransferFlags        = 00000003 (USBD_TRANSFER_DIRECTION_IN, USBD_SHORT_TRANSFER_OK)
  TransferBufferLength = 000000ff
  TransferBuffer       = 00000000
  TransferBufferMDL    = 81b9af88
    00000000: 00 00 00 fa 03 00 00 6c 6f 00 0d 80 0f 00 00 6c
    00000010: 24 80 12 01 04 80 21 01 80 31 01 80 48 43 42 4c
    00000020: 45 78 70 6d 74 80 81 02 80 90 03 26 09 04 05 39
    00000030: d3 85 02 0d 40 2b 80 80 bf f0 a4 96 2e 7b 40 eb
    00000040: cf 73 9d a7 9e ed 50 e1 60 26 bb f9 0f a4 20 2c
    00000050: 65 f3 0c 4c bc 85 be b9 9a af 73 54 bb bd 67 f6
    00000060: f9 9e 4a bd 5b 2f 3a 75 c2 50 cd 7a c7 07 30 b5
    00000070: aa 40 f0 1e 90 80 7f 00 00 00 00 00 00 00 00 00
    00000080: 00 00 00 c3 93 40 00 00 00 00 40 01 00 00 00 04
    00000090: 40 01 5f 4e 00 08 40 01 66 4e 00 0f 40 01 cd c4
    000000a0: 46 cd 4a 4e cd 38 4e cd 5a 4e cd 38 4e cd 20 4e
    000000b0: 21 e1 4d ef 4b 40 cd fe 47 fd cb 09 a6 af 32 45
    000000c0: 84 32 b7 80 af 32 0c 80 cd 60 46 cd 69 46 01 00
    000000d0: 00 ed 43 00 80 ed 43 02 80 3e 01 32 04 80 cd 0d
    000000e0: 45 c3 d1 4d 43 48 4f 4f 53 45 20 50 52 4f 47 52
    000000f0: 41 4d 3a 00 1b 00 21 41 32 41 43 41 54 41 65
  UrbLink              = 00000000
[682379 ms] UsbSnoop - DispatchAny(f890e610) : IRP_MJ_INTERNAL_DEVICE_CONTROL
[682379 ms] UsbSnoop - MyDispatchInternalIOCTL(f890fe80) : fdo=81b1aac0, Irp=822d9840, IRQL=2
[682379 ms]  >>>  URB 177 going down  >>> 
-- URB_FUNCTION_BULK_OR_INTERRUPT_TRANSFER:
  PipeHandle           = 822e77f4 [endpoint 0x00000002]
  TransferFlags        = 00000000 (USBD_TRANSFER_DIRECTION_OUT, ~USBD_SHORT_TRANSFER_OK)
  TransferBufferLength = 00000007
  TransferBuffer       = 00000000
  TransferBufferMDL    = 81b9af88
    00000000: 00 00 00 02 05 e0 00
  UrbLink              = 00000000
[682379 ms] UsbSnoop - MyInternalIOCTLCompletion(f890fdb0) : fido=81b19728, Irp=822d9840, Context=81b05970, IRQL=2
[682379 ms]  <<<  URB 177 coming back  <<< 
-- URB_FUNCTION_BULK_OR_INTERRUPT_TRANSFER:
  PipeHandle           = 822e77f4 [endpoint 0x00000002]
  TransferFlags        = 00000000 (USBD_TRANSFER_DIRECTION_OUT, ~USBD_SHORT_TRANSFER_OK)
  TransferBufferLength = 00000007
  TransferBuffer       = 00000000
  TransferBufferMDL    = 81b9af88
  UrbLink              = 00000000
[682388 ms] UsbSnoop - DispatchAny(f890e610) : IRP_MJ_INTERNAL_DEVICE_CONTROL
[682388 ms] UsbSnoop - MyDispatchInternalIOCTL(f890fe80) : fdo=81b1aac0, Irp=822d9840, IRQL=2
[682388 ms]  >>>  URB 178 going down  >>> 
-- URB_FUNCTION_BULK_OR_INTERRUPT_TRANSFER:
  PipeHandle           = 822e77d4 [endpoint 0x00000081]
  TransferFlags        = 00000003 (USBD_TRANSFER_DIRECTION_IN, USBD_SHORT_TRANSFER_OK)
  TransferBufferLength = 00000100
  TransferBuffer       = 00000000
  TransferBufferMDL    = 81b9af88
  UrbLink              = 00000000
[682410 ms] UsbSnoop - MyInternalIOCTLCompletion(f890fdb0) : fido=81b19728, Irp=822d9840, Context=822e2150, IRQL=2
[682410 ms]  <<<  URB 178 coming back  <<< 
-- URB_FUNCTION_BULK_OR_INTERRUPT_TRANSFER:
  PipeHandle           = 822e77d4 [endpoint 0x00000081]
  TransferFlags        = 00000003 (USBD_TRANSFER_DIRECTION_IN, USBD_SHORT_TRANSFER_OK)
  TransferBufferLength = 000000ff
  TransferBuffer       = 00000000
  TransferBufferMDL    = 81b9af88
    00000000: 00 00 00 fa 03 41 76 41 87 41 98 41 a9 41 ba 41
    00000010: cb 41 dc 41 ed 41 fe 41 0f 42 20 42 31 42 42 42
    00000020: 53 42 64 42 75 42 86 42 97 42 a8 42 b9 42 ca 42
    00000030: db 42 42 41 4c 4c 44 52 4f 50 20 20 20 20 20 20
    00000040: 20 20 00 42 45 41 54 53 20 20 20 20 20 20 20 20
    00000050: 20 20 20 00 42 4f 55 4e 43 45 20 20 20 20 20 20
    00000060: 20 20 20 20 00 43 41 4c 49 42 52 41 54 20 20 20
    00000070: 20 20 20 20 20 00 43 4c 41 55 53 49 55 53 20 20
    00000080: 20 20 20 20 20 20 00 43 4f 4c 4f 52 20 20 20 20
    00000090: 20 20 20 20 20 20 20 00 43 4f 4f 4c 54 45 4d 50
    000000a0: 20 20 20 20 20 20 20 20 00 44 45 46 41 55 4c 54
    000000b0: 53 20 20 20 20 20 20 20 20 00 44 54 4d 41 54 43
    000000c0: 48 20 20 20 20 20 20 20 20 20 00 46 4f 52 43 45
    000000d0: 52 54 20 20 20 20 20 20 20 20 20 00 47 41 54 45
    000000e0: 20 20 20 20 20 20 20 20 20 20 20 20 00 47 45 54
    000000f0: 4c 49 47 48 54 20 20 20 20 20 20 20 20 00 48
  UrbLink              = 00000000
[682448 ms] UsbSnoop - DispatchAny(f890e610) : IRP_MJ_INTERNAL_DEVICE_CONTROL
[682448 ms] UsbSnoop - MyDispatchInternalIOCTL(f890fe80) : fdo=81b1aac0, Irp=822d9840, IRQL=2
[682448 ms]  >>>  URB 179 going down  >>> 
-- URB_FUNCTION_BULK_OR_INTERRUPT_TRANSFER:
  PipeHandle           = 822e77f4 [endpoint 0x00000002]
  TransferFlags        = 00000000 (USBD_TRANSFER_DIRECTION_OUT, ~USBD_SHORT_TRANSFER_OK)
  TransferBufferLength = 00000007
  TransferBuffer       = 00000000
  TransferBufferMDL    = 81b9af88
    00000000: 00 00 00 02 05 e0 00
  UrbLink              = 00000000
[682448 ms] UsbSnoop - MyInternalIOCTLCompletion(f890fdb0) : fido=81b19728, Irp=822d9840, Context=822f29c8, IRQL=2
[682448 ms]  <<<  URB 179 coming back  <<< 
-- URB_FUNCTION_BULK_OR_INTERRUPT_TRANSFER:
  PipeHandle           = 822e77f4 [endpoint 0x00000002]
  TransferFlags        = 00000000 (USBD_TRANSFER_DIRECTION_OUT, ~USBD_SHORT_TRANSFER_OK)
  TransferBufferLength = 00000007
  TransferBuffer       = 00000000
  TransferBufferMDL    = 81b9af88
  UrbLink              = 00000000
[682458 ms] UsbSnoop - DispatchAny(f890e610) : IRP_MJ_INTERNAL_DEVICE_CONTROL
[682458 ms] UsbSnoop - MyDispatchInternalIOCTL(f890fe80) : fdo=81b1aac0, Irp=822d9840, IRQL=2
[682458 ms]  >>>  URB 180 going down  >>> 
-- URB_FUNCTION_BULK_OR_INTERRUPT_TRANSFER:
  PipeHandle           = 822e77d4 [endpoint 0x00000081]
  TransferFlags        = 00000003 (USBD_TRANSFER_DIRECTION_IN, USBD_SHORT_TRANSFER_OK)
  TransferBufferLength = 00000100
  TransferBuffer       = 00000000
  TransferBufferMDL    = 81b9af88
  UrbLink              = 00000000
[682479 ms] UsbSnoop - MyInternalIOCTLCompletion(f890fdb0) : fido=81b19728, Irp=822d9840, Context=822e2150, IRQL=2
[682479 ms]  <<<  URB 180 coming back  <<< 
-- URB_FUNCTION_BULK_OR_INTERRUPT_TRANSFER:
  PipeHandle           = 822e77d4 [endpoint 0x00000081]
  TransferFlags        = 00000003 (USBD_TRANSFER_DIRECTION_IN, USBD_SHORT_TRANSFER_OK)
  TransferBufferLength = 000000ff
  TransferBuffer       = 00000000
  TransferBufferMDL    = 81b9af88
    00000000: 00 00 00 fa 03 45 41 54 20 20 20 20 20 20 20 20
    00000010: 20 20 20 20 00 48 49 4b 45 52 20 20 20 20 20 20
    00000020: 20 20 20 20 20 00 48 4f 4f 4b 20 20 20 20 20 20
    00000030: 20 20 20 20 20 20 00 4c 49 47 48 54 20 20 20 20
    00000040: 20 20 20 20 20 20 20 00 4c 49 47 48 54 44 49 53
    00000050: 20 20 20 20 20 20 20 20 00 50 48 20 20 20 20 20
    00000060: 20 20 20 20 20 20 20 20 20 00 50 48 52 54 20 20
    00000070: 20 20 20 20 20 20 20 20 20 20 00 50 4c 4f 54 53
    00000080: 20 20 20 20 20 20 20 20 20 20 20 00 53 45 43 4f
    00000090: 4e 44 20 20 20 20 20 20 20 20 20 20 00 53 45 4c
    000000a0: 45 43 54 20 20 20 20 20 20 20 20 20 20 00 53 4f
    000000b0: 55 4e 44 20 20 20 20 20 20 20 20 20 20 20 00 53
    000000c0: 54 41 54 55 53 20 20 20 20 20 20 20 20 20 20 00
    000000d0: 54 45 4d 50 20 20 20 20 20 20 20 20 20 20 20 20
    000000e0: 00 54 55 4e 45 20 20 20 20 20 20 20 20 20 20 20
    000000f0: 20 00 51 55 49 54 20 20 20 20 20 20 20 20 20
  UrbLink              = 00000000
[682508 ms] UsbSnoop - DispatchAny(f890e610) : IRP_MJ_INTERNAL_DEVICE_CONTROL
[682508 ms] UsbSnoop - MyDispatchInternalIOCTL(f890fe80) : fdo=81b1aac0, Irp=822d9840, IRQL=2
[682508 ms]  >>>  URB 181 going down  >>> 
-- URB_FUNCTION_BULK_OR_INTERRUPT_TRANSFER:
  PipeHandle           = 822e77f4 [endpoint 0x00000002]
  TransferFlags        = 00000000 (USBD_TRANSFER_DIRECTION_OUT, ~USBD_SHORT_TRANSFER_OK)
  TransferBufferLength = 00000007
  TransferBuffer       = 00000000
  TransferBufferMDL    = 81b9af88
    00000000: 00 00 00 02 05 e0 00
  UrbLink              = 00000000
[682508 ms] UsbSnoop - MyInternalIOCTLCompletion(f890fdb0) : fido=81b19728, Irp=822d9840, Context=82307cb8, IRQL=2
[682508 ms]  <<<  URB 181 coming back  <<< 
-- URB_FUNCTION_BULK_OR_INTERRUPT_TRANSFER:
  PipeHandle           = 822e77f4 [endpoint 0x00000002]
  TransferFlags        = 00000000 (USBD_TRANSFER_DIRECTION_OUT, ~USBD_SHORT_TRANSFER_OK)
  TransferBufferLength = 00000007
  TransferBuffer       = 00000000
  TransferBufferMDL    = 81b9af88
  UrbLink              = 00000000
[682518 ms] UsbSnoop - DispatchAny(f890e610) : IRP_MJ_INTERNAL_DEVICE_CONTROL
[682518 ms] UsbSnoop - MyDispatchInternalIOCTL(f890fe80) : fdo=81b1aac0, Irp=822d9840, IRQL=2
[682518 ms]  >>>  URB 182 going down  >>> 
-- URB_FUNCTION_BULK_OR_INTERRUPT_TRANSFER:
  PipeHandle           = 822e77d4 [endpoint 0x00000081]
  TransferFlags        = 00000003 (USBD_TRANSFER_DIRECTION_IN, USBD_SHORT_TRANSFER_OK)
  TransferBufferLength = 00000100
  TransferBuffer       = 00000000
  TransferBufferMDL    = 81b9af88
  UrbLink              = 00000000
[682539 ms] UsbSnoop - MyInternalIOCTLCompletion(f890fdb0) : fido=81b19728, Irp=822d9840, Context=822e2150, IRQL=2
[682539 ms]  <<<  URB 182 coming back  <<< 
-- URB_FUNCTION_BULK_OR_INTERRUPT_TRANSFER:
  PipeHandle           = 822e77d4 [endpoint 0x00000081]
  TransferFlags        = 00000003 (USBD_TRANSFER_DIRECTION_IN, USBD_SHORT_TRANSFER_OK)
  TransferBufferLength = 000000ff
  TransferBuffer       = 00000000
  TransferBufferMDL    = 81b9af88
    00000000: 00 00 00 fa 03 20 20 20 00 20 20 20 20 20 20 20
    00000010: 20 20 20 20 20 20 20 20 20 00 33 47 3b 47 43 47
    00000020: 4b 47 53 47 5b 47 63 47 6b 47 73 47 7b 47 83 47
    00000030: 8b 47 93 47 9b 47 a3 47 ab 47 b3 47 bb 47 c3 47
    00000040: 2b 47 cb 47 d6 47 de 47 e6 47 ee 47 f6 47 00 00
    00000050: f5 e5 21 09 00 b7 ed 42 20 04 3e 30 18 1a fa 49
    00000060: 43 3e 31 81 18 12 21 23 00 b7 ed 42 fa 59 43 79
    00000070: d6 0a c6 41 18 02 3e 20 ef 04 45 e1 f1 c9 f5 e5
    00000080: 3a 4b 84 fe 01 28 08 fe 07 28 14 3e 3a 18 1f 21
    00000090: 00 00 b7 ed 42 20 04 3e 3a 18 13 3e 1e 18 0f 2a
    000000a0: e9 40 2b b7 ed 42 20 04 3e 3a 18 02 3e 1f ef 04
    000000b0: 45 e1 f1 c9 e5 dd 6e 00 dd 23 dd 66 00 dd 2b cd
    000000c0: ab 46 e1 c9 f5 e5 3e 00 32 4c 84 2a 02 80 b7 ed
    000000d0: 42 20 04 fd cb 05 de cd 33 43 cd 61 43 fd cb 05
    000000e0: 9e cd 97 43 e1 f1 c9 f5 e5 3e 00 32 4c 84 21 ec
    000000f0: 42 cd ab 46 e1 f1 c9 f5 c5 e5 dd e5 fd cb 0d
  UrbLink              = 00000000
[682578 ms] UsbSnoop - DispatchAny(f890e610) : IRP_MJ_INTERNAL_DEVICE_CONTROL
[682578 ms] UsbSnoop - MyDispatchInternalIOCTL(f890fe80) : fdo=81b1aac0, Irp=822d9840, IRQL=2
[682578 ms]  >>>  URB 183 going down  >>> 
-- URB_FUNCTION_BULK_OR_INTERRUPT_TRANSFER:
  PipeHandle           = 822e77f4 [endpoint 0x00000002]
  TransferFlags        = 00000000 (USBD_TRANSFER_DIRECTION_OUT, ~USBD_SHORT_TRANSFER_OK)
  TransferBufferLength = 00000007
  TransferBuffer       = 00000000
  TransferBufferMDL    = 81b9af88
    00000000: 00 00 00 02 05 e0 00
  UrbLink              = 00000000
[682578 ms] UsbSnoop - MyInternalIOCTLCompletion(f890fdb0) : fido=81b19728, Irp=822d9840, Context=822db980, IRQL=2
[682578 ms]  <<<  URB 183 coming back  <<< 
-- URB_FUNCTION_BULK_OR_INTERRUPT_TRANSFER:
  PipeHandle           = 822e77f4 [endpoint 0x00000002]
  TransferFlags        = 00000000 (USBD_TRANSFER_DIRECTION_OUT, ~USBD_SHORT_TRANSFER_OK)
  TransferBufferLength = 00000007
  TransferBuffer       = 00000000
  TransferBufferMDL    = 81b9af88
  UrbLink              = 00000000
[682588 ms] UsbSnoop - DispatchAny(f890e610) : IRP_MJ_INTERNAL_DEVICE_CONTROL
[682588 ms] UsbSnoop - MyDispatchInternalIOCTL(f890fe80) : fdo=81b1aac0, Irp=822d9840, IRQL=2
[682588 ms]  >>>  URB 184 going down  >>> 
-- URB_FUNCTION_BULK_OR_INTERRUPT_TRANSFER:
  PipeHandle           = 822e77d4 [endpoint 0x00000081]
  TransferFlags        = 00000003 (USBD_TRANSFER_DIRECTION_IN, USBD_SHORT_TRANSFER_OK)
  TransferBufferLength = 00000100
  TransferBuffer       = 00000000
  TransferBufferMDL    = 81b9af88
  UrbLink              = 00000000
[682609 ms] UsbSnoop - MyInternalIOCTLCompletion(f890fdb0) : fido=81b19728, Irp=822d9840, Context=822e2150, IRQL=2
[682609 ms]  <<<  URB 184 coming back  <<< 
-- URB_FUNCTION_BULK_OR_INTERRUPT_TRANSFER:
  PipeHandle           = 822e77d4 [endpoint 0x00000081]
  TransferFlags        = 00000003 (USBD_TRANSFER_DIRECTION_IN, USBD_SHORT_TRANSFER_OK)
  TransferBufferLength = 000000ff
  TransferBuffer       = 00000000
  TransferBufferMDL    = 81b9af88
    00000000: 00 00 00 fa 03 8e 2a 4b 84 22 88 85 21 00 00 22
    00000010: 4b 84 21 d9 40 fd cb 05 de cd ab 46 fd cb 05 9e
    00000020: 3e 20 ef 04 45 3e 01 32 4b 84 ed 4b 00 80 dd 21
    00000030: eb 40 dd 09 dd 09 2a e9 40 b7 ed 42 28 18 3a 4b
    00000040: 84 32 08 80 cd a7 43 3c 32 4b 84 fe 08 28 07 dd
    00000050: 23 dd 23 03 18 e0 fe 08 28 09 cd ca 43 3c 32 4b
    00000060: 84 18 f3 2a 88 85 22 4b 84 fd cb 0d ce dd e1 e1
    00000070: c1 f1 c9 f5 c5 ed 4b 02 80 03 ed 43 02 80 3a 04
    00000080: 80 3c 32 04 80 c1 f1 c9 f5 c5 ed 4b 02 80 0b ed
    00000090: 43 02 80 3a 04 80 3d 32 04 80 c1 f1 c9 c5 ed 4b
    000000a0: 02 80 03 ed 43 02 80 ed 4b 00 80 03 ed 43 00 80
    000000b0: c1 c9 c5 ed 4b 02 80 0b ed 43 02 80 ed 4b 00 80
    000000c0: 0b ed 43 00 80 c1 c9 c5 e5 ed 4b 00 80 03 03 03
    000000d0: 03 03 03 2a e9 40 2b b7 ed 42 fa be 44 28 02 18
    000000e0: 0f 2a e9 40 2b 22 02 80 2a 08 80 22 04 80 18 0d
    000000f0: ed 43 00 80 ed 43 02 80 3e 01 32 04 80 e1 c1
  UrbLink              = 00000000
[682648 ms] UsbSnoop - DispatchAny(f890e610) : IRP_MJ_INTERNAL_DEVICE_CONTROL
[682648 ms] UsbSnoop - MyDispatchInternalIOCTL(f890fe80) : fdo=81b1aac0, Irp=822d9840, IRQL=2
[682648 ms]  >>>  URB 185 going down  >>> 
-- URB_FUNCTION_BULK_OR_INTERRUPT_TRANSFER:
  PipeHandle           = 822e77f4 [endpoint 0x00000002]
  TransferFlags        = 00000000 (USBD_TRANSFER_DIRECTION_OUT, ~USBD_SHORT_TRANSFER_OK)
  TransferBufferLength = 00000007
  TransferBuffer       = 00000000
  TransferBufferMDL    = 81b9af88
    00000000: 00 00 00 02 05 e0 00
  UrbLink              = 00000000
[682649 ms] UsbSnoop - MyInternalIOCTLCompletion(f890fdb0) : fido=81b19728, Irp=822d9840, Context=822f29c8, IRQL=2
[682649 ms]  <<<  URB 185 coming back  <<< 
-- URB_FUNCTION_BULK_OR_INTERRUPT_TRANSFER:
  PipeHandle           = 822e77f4 [endpoint 0x00000002]
  TransferFlags        = 00000000 (USBD_TRANSFER_DIRECTION_OUT, ~USBD_SHORT_TRANSFER_OK)
  TransferBufferLength = 00000007
  TransferBuffer       = 00000000
  TransferBufferMDL    = 81b9af88
  UrbLink              = 00000000
[682658 ms] UsbSnoop - DispatchAny(f890e610) : IRP_MJ_INTERNAL_DEVICE_CONTROL
[682658 ms] UsbSnoop - MyDispatchInternalIOCTL(f890fe80) : fdo=81b1aac0, Irp=822d9840, IRQL=2
[682658 ms]  >>>  URB 186 going down  >>> 
-- URB_FUNCTION_BULK_OR_INTERRUPT_TRANSFER:
  PipeHandle           = 822e77d4 [endpoint 0x00000081]
  TransferFlags        = 00000003 (USBD_TRANSFER_DIRECTION_IN, USBD_SHORT_TRANSFER_OK)
  TransferBufferLength = 00000100
  TransferBuffer       = 00000000
  TransferBufferMDL    = 81b9af88
  UrbLink              = 00000000
[682680 ms] UsbSnoop - MyInternalIOCTLCompletion(f890fdb0) : fido=81b19728, Irp=822d9840, Context=822e2150, IRQL=2
[682680 ms]  <<<  URB 186 coming back  <<< 
-- URB_FUNCTION_BULK_OR_INTERRUPT_TRANSFER:
  PipeHandle           = 822e77d4 [endpoint 0x00000081]
  TransferFlags        = 00000003 (USBD_TRANSFER_DIRECTION_IN, USBD_SHORT_TRANSFER_OK)
  TransferBufferLength = 000000ff
  TransferBuffer       = 00000000
  TransferBufferMDL    = 81b9af88
    00000000: 00 00 00 fa 03 c9 c5 e5 ed 4b 00 80 0b 0b 0b 0b
    00000010: 0b 0b 21 00 00 b7 ed 4a f2 fd 44 21 00 00 22 00
    00000020: 80 22 02 80 18 08 ed 43 00 80 ed 43 02 80 3e 01
    00000030: 32 04 80 e1 c1 c9 dd e5 dd 21 00 00 dd 22 0a 80
    00000040: dd e1 cd da 43 3e ff 32 de 85 ef 72 49 fd cb 09
    00000050: a6 f5 af 32 de 85 f1 fe 40 ca d1 4d fe 03 28 2d
    00000060: fe 04 28 48 fe 07 28 78 fe 08 28 6e fe 05 28 76
    00000070: fe 8e fa 1c 45 fe 97 ca fd 45 fa fd 45 fe 9a fa
    00000080: 1c 45 fe b3 ca 0c 46 f2 1c 45 c3 0c 46 3a 04 80
    00000090: fe 01 28 06 cd 65 44 c3 0d 45 2a 00 80 01 00 00
    000000a0: b7 ed 42 ca 1c 45 cd 8f 44 c3 0d 45 3a 04 80 fe
    000000b0: 07 28 0d 21 08 80 96 ca 1c 45 cd 50 44 c3 0d 45
    000000c0: 2a 00 80 23 23 23 23 23 23 ed 4b e9 40 0b b7 ed
    000000d0: 42 ca 1c 45 cd 7a 44 c3 0d 45 cd a4 44 c3 0d 45
    000000e0: cd dd 44 c3 0d 45 ed 4b 02 80 21 1a 00 b7 ed 42
    000000f0: ca d1 4d f5 c5 d5 e5 dd e5 dd e1 e1 d1 c1 f1
  UrbLink              = 00000000
[682708 ms] UsbSnoop - DispatchAny(f890e610) : IRP_MJ_INTERNAL_DEVICE_CONTROL
[682708 ms] UsbSnoop - MyDispatchInternalIOCTL(f890fe80) : fdo=81b1aac0, Irp=822d9840, IRQL=2
[682708 ms]  >>>  URB 187 going down  >>> 
-- URB_FUNCTION_BULK_OR_INTERRUPT_TRANSFER:
  PipeHandle           = 822e77f4 [endpoint 0x00000002]
  TransferFlags        = 00000000 (USBD_TRANSFER_DIRECTION_OUT, ~USBD_SHORT_TRANSFER_OK)
  TransferBufferLength = 00000007
  TransferBuffer       = 00000000
  TransferBufferMDL    = 81b9af88
    00000000: 00 00 00 02 05 e0 00
  UrbLink              = 00000000
[682709 ms] UsbSnoop - MyInternalIOCTLCompletion(f890fdb0) : fido=81b19728, Irp=822d9840, Context=81b05970, IRQL=2
[682709 ms]  <<<  URB 187 coming back  <<< 
-- URB_FUNCTION_BULK_OR_INTERRUPT_TRANSFER:
  PipeHandle           = 822e77f4 [endpoint 0x00000002]
  TransferFlags        = 00000000 (USBD_TRANSFER_DIRECTION_OUT, ~USBD_SHORT_TRANSFER_OK)
  TransferBufferLength = 00000007
  TransferBuffer       = 00000000
  TransferBufferMDL    = 81b9af88
  UrbLink              = 00000000
[682718 ms] UsbSnoop - DispatchAny(f890e610) : IRP_MJ_INTERNAL_DEVICE_CONTROL
[682718 ms] UsbSnoop - MyDispatchInternalIOCTL(f890fe80) : fdo=81b1aac0, Irp=822d9840, IRQL=2
[682718 ms]  >>>  URB 188 going down  >>> 
-- URB_FUNCTION_BULK_OR_INTERRUPT_TRANSFER:
  PipeHandle           = 822e77d4 [endpoint 0x00000081]
  TransferFlags        = 00000003 (USBD_TRANSFER_DIRECTION_IN, USBD_SHORT_TRANSFER_OK)
  TransferBufferLength = 00000100
  TransferBuffer       = 00000000
  TransferBufferMDL    = 81b9af88
  UrbLink              = 00000000
[682740 ms] UsbSnoop - MyInternalIOCTLCompletion(f890fdb0) : fido=81b19728, Irp=822d9840, Context=82307cb8, IRQL=2
[682740 ms]  <<<  URB 188 coming back  <<< 
-- URB_FUNCTION_BULK_OR_INTERRUPT_TRANSFER:
  PipeHandle           = 822e77d4 [endpoint 0x00000081]
  TransferFlags        = 00000003 (USBD_TRANSFER_DIRECTION_IN, USBD_SHORT_TRANSFER_OK)
  TransferBufferLength = 000000ff
  TransferBuffer       = 00000000
  TransferBufferMDL    = 81b9af88
    00000000: 00 00 00 fa 03 e5 dd 21 fd 42 dd 09 dd 09 dd 6e
    00000010: 00 dd 23 dd 66 00 e5 dd e1 e1 cd 60 46 cd 69 46
    00000020: cd 52 4c da d1 4d cd f4 4b c3 0d 45 d6 8e fe 00
    00000030: 20 04 3e 0a 18 07 fe 0a fa 0e 46 d6 8f 06 00 4f
    00000040: b7 2a e9 40 ed 42 fa 1c 45 0b 79 32 02 80 32 00
    00000050: 80 3e 01 32 04 80 18 98 18 92 c5 d5 e5 5e 23 56
    00000060: 2b eb dd e5 c1 71 23 70 23 eb 73 23 72 e1 d1 c1
    00000070: c9 e5 21 10 80 cd 2b 46 e1 c9 e5 21 3a 80 cd 2b
    00000080: 46 e1 c9 d5 e5 23 23 eb e1 73 23 72 2b d1 c9 e5
    00000090: 21 10 80 cd 54 46 e1 c9 e5 21 3a 80 cd 54 46 e1
    000000a0: c9 e5 c5 4e 23 46 23 b7 e5 ed 42 e1 28 16 e5 c5
    000000b0: 4e 23 46 dd e5 e1 b7 ed 42 c1 e1 28 04 23 23 18
    000000c0: e6 37 18 01 b7 c1 e1 c9 e5 21 10 80 cd 72 46 e1
    000000d0: c9 e5 21 3a 80 cd 72 46 e1 c9 c5 f5 3a a6 97 47
    000000e0: 7e 23 b7 37 28 09 ef 04 45 3a 4b 84 b8 38 f1 c1
    000000f0: 78 c1 c9 fd cb 14 8e fd cb 14 86 ef fc 49 ef
  UrbLink              = 00000000
[682779 ms] UsbSnoop - DispatchAny(f890e610) : IRP_MJ_INTERNAL_DEVICE_CONTROL
[682779 ms] UsbSnoop - MyDispatchInternalIOCTL(f890fe80) : fdo=81b1aac0, Irp=822d9840, IRQL=2
[682779 ms]  >>>  URB 189 going down  >>> 
-- URB_FUNCTION_BULK_OR_INTERRUPT_TRANSFER:
  PipeHandle           = 822e77f4 [endpoint 0x00000002]
  TransferFlags        = 00000000 (USBD_TRANSFER_DIRECTION_OUT, ~USBD_SHORT_TRANSFER_OK)
  TransferBufferLength = 00000007
  TransferBuffer       = 00000000
  TransferBufferMDL    = 81b9af88
    00000000: 00 00 00 02 05 e0 00
  UrbLink              = 00000000
[682779 ms] UsbSnoop - MyInternalIOCTLCompletion(f890fdb0) : fido=81b19728, Irp=822d9840, Context=822e2150, IRQL=2
[682779 ms]  <<<  URB 189 coming back  <<< 
-- URB_FUNCTION_BULK_OR_INTERRUPT_TRANSFER:
  PipeHandle           = 822e77f4 [endpoint 0x00000002]
  TransferFlags        = 00000000 (USBD_TRANSFER_DIRECTION_OUT, ~USBD_SHORT_TRANSFER_OK)
  TransferBufferLength = 00000007
  TransferBuffer       = 00000000
  TransferBufferMDL    = 81b9af88
  UrbLink              = 00000000
[682788 ms] UsbSnoop - DispatchAny(f890e610) : IRP_MJ_INTERNAL_DEVICE_CONTROL
[682788 ms] UsbSnoop - MyDispatchInternalIOCTL(f890fe80) : fdo=81b1aac0, Irp=822d9840, IRQL=2
[682788 ms]  >>>  URB 190 going down  >>> 
-- URB_FUNCTION_BULK_OR_INTERRUPT_TRANSFER:
  PipeHandle           = 822e77d4 [endpoint 0x00000081]
  TransferFlags        = 00000003 (USBD_TRANSFER_DIRECTION_IN, USBD_SHORT_TRANSFER_OK)
  TransferBufferLength = 00000100
  TransferBuffer       = 00000000
  TransferBufferMDL    = 81b9af88
  UrbLink              = 00000000
[682810 ms] UsbSnoop - MyInternalIOCTLCompletion(f890fdb0) : fido=81b19728, Irp=822d9840, Context=82307cb8, IRQL=2
[682810 ms]  <<<  URB 190 coming back  <<< 
-- URB_FUNCTION_BULK_OR_INTERRUPT_TRANSFER:
  PipeHandle           = 822e77d4 [endpoint 0x00000081]
  TransferFlags        = 00000003 (USBD_TRANSFER_DIRECTION_IN, USBD_SHORT_TRANSFER_OK)
  TransferBufferLength = 000000ff
  TransferBuffer       = 00000000
  TransferBufferMDL    = 81b9af88
    00000000: 00 00 00 fa 03 00 4c af 32 a5 97 fd cb 13 f6 c9
    00000010: fe 01 c2 e6 46 ef 9b 4a c3 ee 46 fe 02 c2 ee 46
    00000020: ef 7e 00 c9 fe 01 c2 fa 46 ef e3 44 c3 02 47 fe
    00000030: 02 c2 02 47 ef 84 00 c9 fe 01 c2 0e 47 cd 5f 4e
    00000040: c3 16 47 fe 02 c2 16 47 ef 8a 00 c9 fe 01 c2 22
    00000050: 47 cd 66 4e c3 2a 47 fe 02 c2 2a 47 ef 90 00 c9
    00000060: 00 00 69 4e 01 00 00 00 00 00 8e 50 01 00 00 00
    00000070: 00 00 cc 53 01 00 00 00 00 00 90 57 01 00 00 00
    00000080: 00 00 e2 5a 01 00 00 00 00 00 29 60 01 00 00 00
    00000090: 00 00 c2 63 01 00 00 00 00 00 51 67 01 00 00 00
    000000a0: 00 00 d7 6a 01 00 00 00 00 00 e4 6b 01 00 00 00
    000000b0: 00 00 be 6f 01 00 00 00 00 00 54 73 01 00 00 00
    000000c0: 00 00 29 77 01 00 00 00 00 00 12 40 02 00 00 00
    000000d0: 00 00 9d 43 02 00 00 00 00 00 16 47 02 00 00 00
    000000e0: 00 00 42 4a 02 00 00 00 00 00 5a 4e 02 00 00 00
    000000f0: 00 00 97 51 02 00 00 00 00 00 9b 55 02 00 00
  UrbLink              = 00000000
[682849 ms] UsbSnoop - DispatchAny(f890e610) : IRP_MJ_INTERNAL_DEVICE_CONTROL
[682849 ms] UsbSnoop - MyDispatchInternalIOCTL(f890fe80) : fdo=81b1aac0, Irp=822d9840, IRQL=2
[682849 ms]  >>>  URB 191 going down  >>> 
-- URB_FUNCTION_BULK_OR_INTERRUPT_TRANSFER:
  PipeHandle           = 822e77f4 [endpoint 0x00000002]
  TransferFlags        = 00000000 (USBD_TRANSFER_DIRECTION_OUT, ~USBD_SHORT_TRANSFER_OK)
  TransferBufferLength = 00000007
  TransferBuffer       = 00000000
  TransferBufferMDL    = 81b9af88
    00000000: 00 00 00 02 05 e0 00
  UrbLink              = 00000000
[682849 ms] UsbSnoop - MyInternalIOCTLCompletion(f890fdb0) : fido=81b19728, Irp=822d9840, Context=822db980, IRQL=2
[682849 ms]  <<<  URB 191 coming back  <<< 
-- URB_FUNCTION_BULK_OR_INTERRUPT_TRANSFER:
  PipeHandle           = 822e77f4 [endpoint 0x00000002]
  TransferFlags        = 00000000 (USBD_TRANSFER_DIRECTION_OUT, ~USBD_SHORT_TRANSFER_OK)
  TransferBufferLength = 00000007
  TransferBuffer       = 00000000
  TransferBufferMDL    = 81b9af88
  UrbLink              = 00000000
[682859 ms] UsbSnoop - DispatchAny(f890e610) : IRP_MJ_INTERNAL_DEVICE_CONTROL
[682859 ms] UsbSnoop - MyDispatchInternalIOCTL(f890fe80) : fdo=81b1aac0, Irp=822d9840, IRQL=2
[682859 ms]  >>>  URB 192 going down  >>> 
-- URB_FUNCTION_BULK_OR_INTERRUPT_TRANSFER:
  PipeHandle           = 822e77d4 [endpoint 0x00000081]
  TransferFlags        = 00000003 (USBD_TRANSFER_DIRECTION_IN, USBD_SHORT_TRANSFER_OK)
  TransferBufferLength = 00000100
  TransferBuffer       = 00000000
  TransferBufferMDL    = 81b9af88
  UrbLink              = 00000000
[682880 ms] UsbSnoop - MyInternalIOCTLCompletion(f890fdb0) : fido=81b19728, Irp=822d9840, Context=82307cb8, IRQL=2
[682880 ms]  <<<  URB 192 coming back  <<< 
-- URB_FUNCTION_BULK_OR_INTERRUPT_TRANSFER:
  PipeHandle           = 822e77d4 [endpoint 0x00000081]
  TransferFlags        = 00000003 (USBD_TRANSFER_DIRECTION_IN, USBD_SHORT_TRANSFER_OK)
  TransferBufferLength = 000000ff
  TransferBuffer       = 00000000
  TransferBufferMDL    = 81b9af88
    00000000: 00 00 00 fa 03 00 d3 47 8c 59 02 00 00 00 01 2b
    00000010: 47 00 00 1f 5d 02 00 00 00 00 00 1c 5f 02 00 00
    00000020: 00 00 00 99 62 02 00 00 00 00 00 9d 65 02 00 00
    00000030: 00 00 00 23 69 02 00 00 00 ef 40 45 fd cb 02 ce
    00000040: 0e 40 21 a3 48 0d 7e fe fe 28 29 fe ff 28 21 47
    00000050: 23 7e fe ff 28 1a e6 f0 ef d4 41 e5 f5 c5 ef 39
    00000060: 4c c1 04 f1 3d 20 f5 e1 7e e6 0f 28 03 80 18 df
    00000070: 23 79 18 d1 01 10 01 21 a4 48 cd 90 48 01 1e 08
    00000080: 21 b7 48 cd 90 48 01 0a 0f 21 c3 48 cd 90 48 01
    00000090: 29 16 21 d8 48 cd 90 48 01 00 16 21 de 48 cd 90
    000000a0: 48 01 13 32 21 e0 48 cd 90 48 01 1c 39 21 f5 48
    000000b0: cd 90 48 ef 72 49 fd cb 09 a6 fe 40 ca d1 4d fe
    000000c0: 05 20 f0 ef 40 45 fd cb 02 8e c9 ed 43 d7 86 11
    000000d0: 78 84 01 14 00 ed b0 21 78 84 ef 61 45 c9 fe 54
    000000e0: 45 58 41 53 20 20 49 4e 53 54 52 55 4d 45 4e 54
    000000f0: 53 00 43 42 4c 20 20 53 59 53 54 45 4d 00 45
  UrbLink              = 00000000
[682909 ms] UsbSnoop - DispatchAny(f890e610) : IRP_MJ_INTERNAL_DEVICE_CONTROL
[682909 ms] UsbSnoop - MyDispatchInternalIOCTL(f890fe80) : fdo=81b1aac0, Irp=822d9840, IRQL=2
[682909 ms]  >>>  URB 193 going down  >>> 
-- URB_FUNCTION_BULK_OR_INTERRUPT_TRANSFER:
  PipeHandle           = 822e77f4 [endpoint 0x00000002]
  TransferFlags        = 00000000 (USBD_TRANSFER_DIRECTION_OUT, ~USBD_SHORT_TRANSFER_OK)
  TransferBufferLength = 00000007
  TransferBuffer       = 00000000
  TransferBufferMDL    = 81b9af88
    00000000: 00 00 00 02 05 e0 00
  UrbLink              = 00000000
[682909 ms] UsbSnoop - MyInternalIOCTLCompletion(f890fdb0) : fido=81b19728, Irp=822d9840, Context=822e2150, IRQL=2
[682909 ms]  <<<  URB 193 coming back  <<< 
-- URB_FUNCTION_BULK_OR_INTERRUPT_TRANSFER:
  PipeHandle           = 822e77f4 [endpoint 0x00000002]
  TransferFlags        = 00000000 (USBD_TRANSFER_DIRECTION_OUT, ~USBD_SHORT_TRANSFER_OK)
  TransferBufferLength = 00000007
  TransferBuffer       = 00000000
  TransferBufferMDL    = 81b9af88
  UrbLink              = 00000000
[682919 ms] UsbSnoop - DispatchAny(f890e610) : IRP_MJ_INTERNAL_DEVICE_CONTROL
[682919 ms] UsbSnoop - MyDispatchInternalIOCTL(f890fe80) : fdo=81b1aac0, Irp=822d9840, IRQL=2
[682919 ms]  >>>  URB 194 going down  >>> 
-- URB_FUNCTION_BULK_OR_INTERRUPT_TRANSFER:
  PipeHandle           = 822e77d4 [endpoint 0x00000081]
  TransferFlags        = 00000003 (USBD_TRANSFER_DIRECTION_IN, USBD_SHORT_TRANSFER_OK)
  TransferBufferLength = 00000100
  TransferBuffer       = 00000000
  TransferBufferMDL    = 81b9af88
  UrbLink              = 00000000
[682940 ms] UsbSnoop - MyInternalIOCTLCompletion(f890fdb0) : fido=81b19728, Irp=822d9840, Context=82307cb8, IRQL=2
[682940 ms]  <<<  URB 194 coming back  <<< 
-- URB_FUNCTION_BULK_OR_INTERRUPT_TRANSFER:
  PipeHandle           = 822e77d4 [endpoint 0x00000081]
  TransferFlags        = 00000003 (USBD_TRANSFER_DIRECTION_IN, USBD_SHORT_TRANSFER_OK)
  TransferBufferLength = 000000ff
  TransferBuffer       = 00000000
  TransferBufferMDL    = 81b9af88
    00000000: 00 00 00 fa 03 58 50 45 52 49 4d 45 4e 54 20 20
    00000010: 57 4f 52 4b 42 4f 4f 4b 00 56 31 2e 30 30 00 20
    00000020: 00 50 52 45 53 53 20 20 20 c1 45 4e 54 45 52 5d
    00000030: 20 20 20 4f 4e 00 54 49 2d 38 33 20 20 20 50 4c
    00000040: 55 53 00 01 00 00 ed 43 4b 84 c5 cd ab 46 c1 0c
    00000050: 06 00 ed 43 4b 84 79 fe 08 20 ef c9 45 52 52 4f
    00000060: 52 3a 00 50 52 4f 47 52 41 4d 20 4e 41 4d 45 44
    00000070: 00 00 41 4c 52 45 41 44 59 20 45 58 49 53 54 53
    00000080: 00 41 4e 44 20 49 53 20 00 41 52 43 48 49 56 45
    00000090: 44 2e 00 50 52 45 53 53 20 41 4e 59 20 4b 45 59
    000000a0: 00 54 4f 20 45 58 49 54 2e 00 45 52 52 4f 52 3a
    000000b0: 00 50 52 4f 47 52 41 4d 20 4e 41 4d 45 44 00 00
    000000c0: 41 4c 52 45 41 44 59 20 45 58 49 53 54 53 00 41
    000000d0: 4e 44 20 49 53 20 00 50 52 4f 54 45 43 54 45 44
    000000e0: 2e 00 50 52 45 53 53 20 41 4e 59 20 4b 45 59 00
    000000f0: 54 4f 20 45 58 49 54 2e 00 50 52 4f 47 52 41
  UrbLink              = 00000000
[682979 ms] UsbSnoop - DispatchAny(f890e610) : IRP_MJ_INTERNAL_DEVICE_CONTROL
[682979 ms] UsbSnoop - MyDispatchInternalIOCTL(f890fe80) : fdo=81b1aac0, Irp=822d9840, IRQL=2
[682979 ms]  >>>  URB 195 going down  >>> 
-- URB_FUNCTION_BULK_OR_INTERRUPT_TRANSFER:
  PipeHandle           = 822e77f4 [endpoint 0x00000002]
  TransferFlags        = 00000000 (USBD_TRANSFER_DIRECTION_OUT, ~USBD_SHORT_TRANSFER_OK)
  TransferBufferLength = 00000007
  TransferBuffer       = 00000000
  TransferBufferMDL    = 81b9af88
    00000000: 00 00 00 02 05 e0 00
  UrbLink              = 00000000
[682979 ms] UsbSnoop - MyInternalIOCTLCompletion(f890fdb0) : fido=81b19728, Irp=822d9840, Context=81cd51b0, IRQL=2
[682979 ms]  <<<  URB 195 coming back  <<< 
-- URB_FUNCTION_BULK_OR_INTERRUPT_TRANSFER:
  PipeHandle           = 822e77f4 [endpoint 0x00000002]
  TransferFlags        = 00000000 (USBD_TRANSFER_DIRECTION_OUT, ~USBD_SHORT_TRANSFER_OK)
  TransferBufferLength = 00000007
  TransferBuffer       = 00000000
  TransferBufferMDL    = 81b9af88
  UrbLink              = 00000000
[682989 ms] UsbSnoop - DispatchAny(f890e610) : IRP_MJ_INTERNAL_DEVICE_CONTROL
[682989 ms] UsbSnoop - MyDispatchInternalIOCTL(f890fe80) : fdo=81b1aac0, Irp=822d9840, IRQL=2
[682989 ms]  >>>  URB 196 going down  >>> 
-- URB_FUNCTION_BULK_OR_INTERRUPT_TRANSFER:
  PipeHandle           = 822e77d4 [endpoint 0x00000081]
  TransferFlags        = 00000003 (USBD_TRANSFER_DIRECTION_IN, USBD_SHORT_TRANSFER_OK)
  TransferBufferLength = 00000100
  TransferBuffer       = 00000000
  TransferBufferMDL    = 81b9af88
  UrbLink              = 00000000
[683010 ms] UsbSnoop - MyInternalIOCTLCompletion(f890fdb0) : fido=81b19728, Irp=822d9840, Context=82307cb8, IRQL=2
[683010 ms]  <<<  URB 196 coming back  <<< 
-- URB_FUNCTION_BULK_OR_INTERRUPT_TRANSFER:
  PipeHandle           = 822e77d4 [endpoint 0x00000081]
  TransferFlags        = 00000003 (USBD_TRANSFER_DIRECTION_IN, USBD_SHORT_TRANSFER_OK)
  TransferBufferLength = 000000ff
  TransferBuffer       = 00000000
  TransferBufferMDL    = 81b9af88
    00000000: 00 00 00 fa 03 4d 20 4e 41 4d 45 44 00 00 41 4c
    00000010: 52 45 41 44 59 20 45 58 49 53 54 53 00 00 31 3a
    00000020: 55 53 45 20 49 54 00 32 3a 52 45 50 4c 41 43 45
    00000030: 20 49 54 00 33 3a 52 45 50 4c 41 43 45 20 41 4c
    00000040: 4c 00 34 3a 45 58 49 54 20 54 48 49 53 20 41 50
    00000050: 50 00 dd 6e 00 dd 23 dd 66 00 dd 23 c9 cd 0b 4a
    00000060: c9 cd 16 4a cd 0b 4a dd 7e 00 dd 23 c9 cd 1a 4a
    00000070: cd 0b 4a c9 cd 26 4a dd e5 e1 c9 c5 e5 01 00 00
    00000080: b7 ed 42 e1 c1 c9 c5 e5 dd e5 47 cd 2d 4a 7e e6
    00000090: 80 78 dd e1 e1 c1 c9 c5 e5 dd e5 47 cd 2d 4a 7e
    000000a0: e6 20 78 dd e1 e1 c1 c9 d5 cd 1a 4a f5 11 79 84
    000000b0: cd ef 46 23 f1 d1 c9 dd e5 cd 61 4a ef 2f 41 ef
    000000c0: ee 42 dd e1 c9 c5 d5 e5 dd e5 fd cb 0d 8e ef 40
    000000d0: 45 21 b8 49 cd 02 49 01 01 00 ed 43 4b 84 21 84
    000000e0: 84 cd ab 46 fd cb 0d ce ef 72 49 fd cb 09 a6 fe
    000000f0: 8f 28 1c fe 90 28 15 fe 91 20 07 3e ff 32 0c
  UrbLink              = 00000000
[683049 ms] UsbSnoop - DispatchAny(f890e610) : IRP_MJ_INTERNAL_DEVICE_CONTROL
[683049 ms] UsbSnoop - MyDispatchInternalIOCTL(f890fe80) : fdo=81b1aac0, Irp=822d9840, IRQL=2
[683049 ms]  >>>  URB 197 going down  >>> 
-- URB_FUNCTION_BULK_OR_INTERRUPT_TRANSFER:
  PipeHandle           = 822e77f4 [endpoint 0x00000002]
  TransferFlags        = 00000000 (USBD_TRANSFER_DIRECTION_OUT, ~USBD_SHORT_TRANSFER_OK)
  TransferBufferLength = 00000007
  TransferBuffer       = 00000000
  TransferBufferMDL    = 81b9af88
    00000000: 00 00 00 02 05 e0 00
  UrbLink              = 00000000
[683049 ms] UsbSnoop - MyInternalIOCTLCompletion(f890fdb0) : fido=81b19728, Irp=822d9840, Context=822db980, IRQL=2
[683049 ms]  <<<  URB 197 coming back  <<< 
-- URB_FUNCTION_BULK_OR_INTERRUPT_TRANSFER:
  PipeHandle           = 822e77f4 [endpoint 0x00000002]
  TransferFlags        = 00000000 (USBD_TRANSFER_DIRECTION_OUT, ~USBD_SHORT_TRANSFER_OK)
  TransferBufferLength = 00000007
  TransferBuffer       = 00000000
  TransferBufferMDL    = 81b9af88
  UrbLink              = 00000000
[683059 ms] UsbSnoop - DispatchAny(f890e610) : IRP_MJ_INTERNAL_DEVICE_CONTROL
[683059 ms] UsbSnoop - MyDispatchInternalIOCTL(f890fe80) : fdo=81b1aac0, Irp=822d9840, IRQL=2
[683059 ms]  >>>  URB 198 going down  >>> 
-- URB_FUNCTION_BULK_OR_INTERRUPT_TRANSFER:
  PipeHandle           = 822e77d4 [endpoint 0x00000081]
  TransferFlags        = 00000003 (USBD_TRANSFER_DIRECTION_IN, USBD_SHORT_TRANSFER_OK)
  TransferBufferLength = 00000100
  TransferBuffer       = 00000000
  TransferBufferMDL    = 81b9af88
  UrbLink              = 00000000
[683080 ms] UsbSnoop - MyInternalIOCTLCompletion(f890fdb0) : fido=81b19728, Irp=822d9840, Context=82307cb8, IRQL=2
[683080 ms]  <<<  URB 198 coming back  <<< 
-- URB_FUNCTION_BULK_OR_INTERRUPT_TRANSFER:
  PipeHandle           = 822e77d4 [endpoint 0x00000081]
  TransferFlags        = 00000003 (USBD_TRANSFER_DIRECTION_IN, USBD_SHORT_TRANSFER_OK)
  TransferBufferLength = 000000ff
  TransferBuffer       = 00000000
  TransferBufferMDL    = 81b9af88
    00000000: 00 00 00 fa 03 80 18 0a fe 92 20 e2 ef 79 45 c3
    00000010: d1 4d b7 18 01 37 dd e1 e1 d1 c1 c9 f5 c5 d5 e5
    00000020: dd e5 21 bf 4d cd 59 00 cd 61 4a f5 e5 cd 03 47
    00000030: e5 ef 39 43 dd 2a 0a 80 cd 50 4a 20 03 3e 16 77
    00000040: c1 e1 03 03 f1 cd 17 47 cd 5c 00 dd e1 e1 d1 c1
    00000050: f1 c9 e5 c5 ed 4b 3a 80 21 3c 80 b7 e5 ed 42 e1
    00000060: 28 1b e5 c5 4e 23 46 c5 dd e1 cd 70 4a 38 08 7e
    00000070: fe 16 20 03 3e 05 77 c1 e1 23 23 18 de c1 e1 c9
    00000080: f5 e5 fd cb 34 66 28 11 3e ff 32 b7 80 2a 8c 9b
    00000090: 22 b4 80 3a 8e 9b 32 b6 80 e1 f1 c9 f5 e5 3a b7
    000000a0: 80 b7 28 09 3a b6 80 2a b4 80 ef ab 4f af 32 b7
    000000b0: 80 e1 f1 c9 f5 c5 d5 e5 af 32 45 84 cd 33 4b db
    000000c0: 06 21 c6 4b ef ab 4f fd cb 08 ce fd cb 0c f6 fd
    000000d0: cb 0d ce fd cb 0d d6 fd cb 12 c6 3e 05 32 78 84
    000000e0: cd 61 4a 21 3c 4d cd 59 00 cd db 46 cd 5c 00 fd
    000000f0: cb 34 a6 cd 4f 4b fd cb 08 8e fd cb 0c b6 fd
  UrbLink              = 00000000
[683119 ms] UsbSnoop - DispatchAny(f890e610) : IRP_MJ_INTERNAL_DEVICE_CONTROL
[683119 ms] UsbSnoop - MyDispatchInternalIOCTL(f890fe80) : fdo=81b1aac0, Irp=822d9840, IRQL=2
[683119 ms]  >>>  URB 199 going down  >>> 
-- URB_FUNCTION_BULK_OR_INTERRUPT_TRANSFER:
  PipeHandle           = 822e77f4 [endpoint 0x00000002]
  TransferFlags        = 00000000 (USBD_TRANSFER_DIRECTION_OUT, ~USBD_SHORT_TRANSFER_OK)
  TransferBufferLength = 00000007
  TransferBuffer       = 00000000
  TransferBufferMDL    = 81b9af88
    00000000: 00 00 00 02 05 e0 00
  UrbLink              = 00000000
[683119 ms] UsbSnoop - MyInternalIOCTLCompletion(f890fdb0) : fido=81b19728, Irp=822d9840, Context=81cd51b0, IRQL=2
[683119 ms]  <<<  URB 199 coming back  <<< 
-- URB_FUNCTION_BULK_OR_INTERRUPT_TRANSFER:
  PipeHandle           = 822e77f4 [endpoint 0x00000002]
  TransferFlags        = 00000000 (USBD_TRANSFER_DIRECTION_OUT, ~USBD_SHORT_TRANSFER_OK)
  TransferBufferLength = 00000007
  TransferBuffer       = 00000000
  TransferBufferMDL    = 81b9af88
  UrbLink              = 00000000
[683129 ms] UsbSnoop - DispatchAny(f890e610) : IRP_MJ_INTERNAL_DEVICE_CONTROL
[683129 ms] UsbSnoop - MyDispatchInternalIOCTL(f890fe80) : fdo=81b1aac0, Irp=822d9840, IRQL=2
[683129 ms]  >>>  URB 200 going down  >>> 
-- URB_FUNCTION_BULK_OR_INTERRUPT_TRANSFER:
  PipeHandle           = 822e77d4 [endpoint 0x00000081]
  TransferFlags        = 00000003 (USBD_TRANSFER_DIRECTION_IN, USBD_SHORT_TRANSFER_OK)
  TransferBufferLength = 00000100
  TransferBuffer       = 00000000
  TransferBufferMDL    = 81b9af88
  UrbLink              = 00000000
[683150 ms] UsbSnoop - MyInternalIOCTLCompletion(f890fdb0) : fido=81b19728, Irp=822d9840, Context=82307cb8, IRQL=2
[683150 ms]  <<<  URB 200 coming back  <<< 
-- URB_FUNCTION_BULK_OR_INTERRUPT_TRANSFER:
  PipeHandle           = 822e77d4 [endpoint 0x00000081]
  TransferFlags        = 00000003 (USBD_TRANSFER_DIRECTION_IN, USBD_SHORT_TRANSFER_OK)
  TransferBufferLength = 000000ff
  TransferBuffer       = 00000000
  TransferBufferMDL    = 81b9af88
    00000000: 00 00 00 fa 03 cb 0d 8e fd cb 0d 96 fd cb 12 86
    00000010: fd cb 12 8e e1 d1 c1 f1 c9 83 fe 03 c0 fd cb 29
    00000020: 4e fd cb 29 8e 20 0f fd cb 34 a6 cd 4f 4b cd c4
    00000030: 46 cd 20 4e 18 10 ef 36 4c 21 e1 4d ef 4b 40 f6
    00000040: 01 3e 58 32 9a 85 c9 dd 22 0a 80 cd 69 46 cd 18
    00000050: 4c cd 67 4b ef 41 50 dd 2a 0a 80 cd 3f 4a 28 0a
    00000060: fd cb 02 56 c2 d9 4d c3 d1 4d c9 c5 dd e5 cd 16
    00000070: 4a cd 34 4a 28 20 e5 dd e1 dd 46 00 dd 23 04 05
    00000080: 28 14 cd 0b 4a dd e5 e5 dd e1 cd a2 46 38 03 cd
    00000090: 18 4c dd e1 18 e9 dd e1 cd 99 46 38 06 cd 4b 46
    000000a0: cd cf 4a c1 c9 c5 dd e5 cd 26 4a cd 34 4a 28 2b
    000000b0: e5 dd e1 dd 46 00 dd 23 04 05 28 1f cd 0b 4a dd
    000000c0: e5 e5 dd e1 cd 99 46 38 0a cd a2 46 38 05 cd 52
    000000d0: 4c 18 01 b7 dd e1 30 e1 c3 30 4d dd e1 dd e5 cd
    000000e0: 16 4a cd 34 4a 28 2a e5 dd e1 dd 46 00 dd 23 04
    000000f0: 05 28 1e cd 0b 4a dd e5 e5 dd e1 cd 99 46 38
  UrbLink              = 00000000
[683189 ms] UsbSnoop - DispatchAny(f890e610) : IRP_MJ_INTERNAL_DEVICE_CONTROL
[683189 ms] UsbSnoop - MyDispatchInternalIOCTL(f890fe80) : fdo=81b1aac0, Irp=822d9840, IRQL=2
[683189 ms]  >>>  URB 201 going down  >>> 
-- URB_FUNCTION_BULK_OR_INTERRUPT_TRANSFER:
  PipeHandle           = 822e77f4 [endpoint 0x00000002]
  TransferFlags        = 00000000 (USBD_TRANSFER_DIRECTION_OUT, ~USBD_SHORT_TRANSFER_OK)
  TransferBufferLength = 00000007
  TransferBuffer       = 00000000
  TransferBufferMDL    = 81b9af88
    00000000: 00 00 00 02 05 e0 00
  UrbLink              = 00000000
[683189 ms] UsbSnoop - MyInternalIOCTLCompletion(f890fdb0) : fido=81b19728, Irp=822d9840, Context=822db980, IRQL=2
[683189 ms]  <<<  URB 201 coming back  <<< 
-- URB_FUNCTION_BULK_OR_INTERRUPT_TRANSFER:
  PipeHandle           = 822e77f4 [endpoint 0x00000002]
  TransferFlags        = 00000000 (USBD_TRANSFER_DIRECTION_OUT, ~USBD_SHORT_TRANSFER_OK)
  TransferBufferLength = 00000007
  TransferBuffer       = 00000000
  TransferBufferMDL    = 81b9af88
  UrbLink              = 00000000
[683199 ms] UsbSnoop - DispatchAny(f890e610) : IRP_MJ_INTERNAL_DEVICE_CONTROL
[683199 ms] UsbSnoop - MyDispatchInternalIOCTL(f890fe80) : fdo=81b1aac0, Irp=822d9840, IRQL=2
[683199 ms]  >>>  URB 202 going down  >>> 
-- URB_FUNCTION_BULK_OR_INTERRUPT_TRANSFER:
  PipeHandle           = 822e77d4 [endpoint 0x00000081]
  TransferFlags        = 00000003 (USBD_TRANSFER_DIRECTION_IN, USBD_SHORT_TRANSFER_OK)
  TransferBufferLength = 00000100
  TransferBuffer       = 00000000
  TransferBufferMDL    = 81b9af88
  UrbLink              = 00000000
[683220 ms] UsbSnoop - MyInternalIOCTLCompletion(f890fdb0) : fido=81b19728, Irp=822d9840, Context=822db980, IRQL=2
[683220 ms]  <<<  URB 202 coming back  <<< 
-- URB_FUNCTION_BULK_OR_INTERRUPT_TRANSFER:
  PipeHandle           = 822e77d4 [endpoint 0x00000081]
  TransferFlags        = 00000003 (USBD_TRANSFER_DIRECTION_IN, USBD_SHORT_TRANSFER_OK)
  TransferBufferLength = 000000ff
  TransferBuffer       = 00000000
  TransferBufferMDL    = 81b9af88
    00000000: 00 00 00 fa 03 0a cd a2 46 38 05 cd 52 4c 18 01
    00000010: b7 dd e1 30 e1 18 72 dd e1 dd e5 cd 70 4a 30 05
    00000020: cd 4b 46 18 6b af b8 28 1b ef 40 45 21 1b 49 cd
    00000030: 02 49 01 02 00 ed 43 4b 84 21 84 84 cd ab 46 ef
    00000040: 72 49 18 45 ef ff 40 fe 06 20 1b ef 40 45 21 69
    00000050: 49 cd 02 49 01 02 00 ed 43 4b 84 21 84 84 cd ab
    00000060: 46 ef 72 49 18 23 3a 0c 80 b7 c2 22 4d dd e1 dd
    00000070: e5 cd 7e 4a 30 05 cd 42 46 18 15 cd 4b 46 ef 56
    00000080: 41 ef ee 42 ef 51 43 18 07 fd cb 09 a6 37 18 01
    00000090: b7 dd e1 c1 c9 fd cb 34 a6 cd 4f 4b fd cb 08 8e
    000000a0: fd cb 0c b6 fd cb 0d 8e fe 86 28 06 fe 9f 28 02
    000000b0: 18 07 cb bf 32 dd 86 18 47 cb bf 32 dd 86 3a 52
    000000c0: 96 fe 03 28 0d fe 05 28 07 3e 05 32 52 96 18 25
    000000d0: 18 26 3a 53 96 fe 24 20 27 21 52 96 ef 7a 41 ef
    000000e0: f4 42 38 1c eb 23 23 7e fe 16 28 06 fe 05 28 02
    000000f0: 18 0e 3e 05 77 cd 05 4b 3a dd 86 cb ff 32 dd
  UrbLink              = 00000000
[683259 ms] UsbSnoop - DispatchAny(f890e610) : IRP_MJ_INTERNAL_DEVICE_CONTROL
[683259 ms] UsbSnoop - MyDispatchInternalIOCTL(f890fe80) : fdo=81b1aac0, Irp=822d9840, IRQL=2
[683259 ms]  >>>  URB 203 going down  >>> 
-- URB_FUNCTION_BULK_OR_INTERRUPT_TRANSFER:
  PipeHandle           = 822e77f4 [endpoint 0x00000002]
  TransferFlags        = 00000000 (USBD_TRANSFER_DIRECTION_OUT, ~USBD_SHORT_TRANSFER_OK)
  TransferBufferLength = 00000007
  TransferBuffer       = 00000000
  TransferBufferMDL    = 81b9af88
    00000000: 00 00 00 02 05 e0 00
  UrbLink              = 00000000
[683260 ms] UsbSnoop - MyInternalIOCTLCompletion(f890fdb0) : fido=81b19728, Irp=822d9840, Context=81b05970, IRQL=2
[683260 ms]  <<<  URB 203 coming back  <<< 
-- URB_FUNCTION_BULK_OR_INTERRUPT_TRANSFER:
  PipeHandle           = 822e77f4 [endpoint 0x00000002]
  TransferFlags        = 00000000 (USBD_TRANSFER_DIRECTION_OUT, ~USBD_SHORT_TRANSFER_OK)
  TransferBufferLength = 00000007
  TransferBuffer       = 00000000
  TransferBufferMDL    = 81b9af88
  UrbLink              = 00000000
[683269 ms] UsbSnoop - DispatchAny(f890e610) : IRP_MJ_INTERNAL_DEVICE_CONTROL
[683269 ms] UsbSnoop - MyDispatchInternalIOCTL(f890fe80) : fdo=81b1aac0, Irp=822d9840, IRQL=2
[683269 ms]  >>>  URB 204 going down  >>> 
-- URB_FUNCTION_BULK_OR_INTERRUPT_TRANSFER:
  PipeHandle           = 822e77d4 [endpoint 0x00000081]
  TransferFlags        = 00000003 (USBD_TRANSFER_DIRECTION_IN, USBD_SHORT_TRANSFER_OK)
  TransferBufferLength = 00000100
  TransferBuffer       = 00000000
  TransferBufferMDL    = 81b9af88
  UrbLink              = 00000000
[683291 ms] UsbSnoop - MyInternalIOCTLCompletion(f890fdb0) : fido=81b19728, Irp=822d9840, Context=822f29c8, IRQL=2
[683291 ms]  <<<  URB 204 coming back  <<< 
-- URB_FUNCTION_BULK_OR_INTERRUPT_TRANSFER:
  PipeHandle           = 822e77d4 [endpoint 0x00000081]
  TransferFlags        = 00000003 (USBD_TRANSFER_DIRECTION_IN, USBD_SHORT_TRANSFER_OK)
  TransferBufferLength = 000000ff
  TransferBuffer       = 00000000
  TransferBufferMDL    = 81b9af88
    00000000: 00 00 00 fa 03 86 cd c4 46 cd 20 4e ef 99 4c ef
    00000010: 36 4c fd 36 05 00 3a dd 86 cd 50 00 d7 44 cb bf
    00000020: cd 50 00 d7 44 cd 20 4e ef 36 4c fd 36 05 00 c9
    00000030: cd c6 4d cd 50 00 27 40 cd c6 4d cd 50 00 02 50
    00000040: ee 4d f3 4d f7 4d ef 4d ee 4d ee 4d 02 c9 ef 79
    00000050: 45 c9 ef 76 45 c9 3a fa 89 32 fb 89 af 32 2a 8e
    00000060: fd cb 29 46 20 11 fd cb 34 a6 cd 4f 4b cd c4 46
    00000070: cd 20 4e af 32 de 85 ef 36 4c cd 50 00 3c 40 fd
    00000080: cb 0d ce ef 58 45 ef 49 45 fd cb 0d 8e 21 00 00
    00000090: 22 f2 96 ef 73 45 c9 ef ee 42 38 03 ef 51 43 21
    000000a0: 00 00 22 f2 96 ef 39 43 c9 21 23 00 3e 05 32 78
    000000b0: 84 22 79 84 af 32 7b 84 c9 21 21 00 18 ee f5 7e
    000000c0: 23 66 6f f1 c9 ed b0 c9 50 4c 4f 54 53 00 1d 02
    000000d0: 08 36 2b 30 09 04 5d 00 3e e7 5d 00 11 3f 31 04
    000000e0: 63 0a 3e 32 04 63 0b 3e 31 04 63 0c 3e 32 04 63
    000000f0: 0d 3f 7e 0b 3f 7e 09 3f 7e 0d 3f ea 3f 97 3f
  UrbLink              = 00000000
[683329 ms] UsbSnoop - DispatchAny(f890e610) : IRP_MJ_INTERNAL_DEVICE_CONTROL
[683329 ms] UsbSnoop - MyDispatchInternalIOCTL(f890fe80) : fdo=81b1aac0, Irp=822d9840, IRQL=2
[683329 ms]  >>>  URB 205 going down  >>> 
-- URB_FUNCTION_BULK_OR_INTERRUPT_TRANSFER:
  PipeHandle           = 822e77f4 [endpoint 0x00000002]
  TransferFlags        = 00000000 (USBD_TRANSFER_DIRECTION_OUT, ~USBD_SHORT_TRANSFER_OK)
  TransferBufferLength = 00000007
  TransferBuffer       = 00000000
  TransferBufferMDL    = 81b9af88
    00000000: 00 00 00 02 05 e0 00
  UrbLink              = 00000000
[683330 ms] UsbSnoop - MyInternalIOCTLCompletion(f890fdb0) : fido=81b19728, Irp=822d9840, Context=822db980, IRQL=2
[683330 ms]  <<<  URB 205 coming back  <<< 
-- URB_FUNCTION_BULK_OR_INTERRUPT_TRANSFER:
  PipeHandle           = 822e77f4 [endpoint 0x00000002]
  TransferFlags        = 00000000 (USBD_TRANSFER_DIRECTION_OUT, ~USBD_SHORT_TRANSFER_OK)
  TransferBufferLength = 00000007
  TransferBuffer       = 00000000
  TransferBufferMDL    = 81b9af88
  UrbLink              = 00000000
[683339 ms] UsbSnoop - DispatchAny(f890e610) : IRP_MJ_INTERNAL_DEVICE_CONTROL
[683339 ms] UsbSnoop - MyDispatchInternalIOCTL(f890fe80) : fdo=81b1aac0, Irp=822d9840, IRQL=2
[683339 ms]  >>>  URB 206 going down  >>> 
-- URB_FUNCTION_BULK_OR_INTERRUPT_TRANSFER:
  PipeHandle           = 822e77d4 [endpoint 0x00000081]
  TransferFlags        = 00000003 (USBD_TRANSFER_DIRECTION_IN, USBD_SHORT_TRANSFER_OK)
  TransferBufferLength = 00000100
  TransferBuffer       = 00000000
  TransferBufferMDL    = 81b9af88
  UrbLink              = 00000000
[683361 ms] UsbSnoop - MyInternalIOCTLCompletion(f890fdb0) : fido=81b19728, Irp=822d9840, Context=822f29c8, IRQL=2
[683361 ms]  <<<  URB 206 coming back  <<< 
-- URB_FUNCTION_BULK_OR_INTERRUPT_TRANSFER:
  PipeHandle           = 822e77d4 [endpoint 0x00000081]
  TransferFlags        = 00000003 (USBD_TRANSFER_DIRECTION_IN, USBD_SHORT_TRANSFER_OK)
  TransferBufferLength = 000000ff
  TransferBuffer       = 00000000
  TransferBufferMDL    = 81b9af88
    00000000: 00 00 00 fa 03 85 3f 93 31 2b 31 36 2b 2a 54 45
    00000010: 58 41 53 29 29 49 4e 53 54 52 55 4d 45 4e 54 53
    00000020: 2a 11 3f 93 38 2b 33 30 2b 2a 43 42 4c 29 29 29
    00000030: 53 59 53 54 45 4d 2a 11 3f 93 31 35 2b 31 30 2b
    00000040: 2a 45 58 50 45 52 49 4d 45 4e 54 29 29 29 57 4f
    00000050: 52 4b 42 4f 4f 4b 2a 11 3f 93 32 39 2b 33 32 2b
    00000060: 2a 50 4c 4f 54 53 29 29 29 56 32 3a 30 2a 11 3f
    00000070: 93 33 36 2b 31 38 2b 2a 10 45 58 50 45 52 49 4d
    00000080: 45 4e 54 29 29 29 50 34 11 2a 11 3f 93 35 30 2b
    00000090: 31 39 2b 2a 50 52 45 53 53 29 29 29 06 45 4e 54
    000000a0: 45 52 07 29 29 29 4f 4e 2a 3f 93 35 37 2b 32 38
    000000b0: 2b 2a 54 49 71 38 33 29 29 29 50 4c 55 53 2a 3f
    000000c0: d8 3f 7e 08 3f e1 3f d6 5a 3f e6 2a 82 82 50 4c
    000000d0: 4f 54 29 4f 50 54 49 4f 4e 53 82 82 2a 2b 2a 56
    000000e0: 45 4c 4f 43 49 54 59 71 54 49 4d 45 2a 2b 31 2b
    000000f0: 2a 46 4f 52 43 45 71 54 49 4d 45 2a 2b 32 2b
  UrbLink              = 00000000
[683399 ms] UsbSnoop - DispatchAny(f890e610) : IRP_MJ_INTERNAL_DEVICE_CONTROL
[683399 ms] UsbSnoop - MyDispatchInternalIOCTL(f890fe80) : fdo=81b1aac0, Irp=822d9840, IRQL=2
[683399 ms]  >>>  URB 207 going down  >>> 
-- URB_FUNCTION_BULK_OR_INTERRUPT_TRANSFER:
  PipeHandle           = 822e77f4 [endpoint 0x00000002]
  TransferFlags        = 00000000 (USBD_TRANSFER_DIRECTION_OUT, ~USBD_SHORT_TRANSFER_OK)
  TransferBufferLength = 00000007
  TransferBuffer       = 00000000
  TransferBufferMDL    = 81b9af88
    00000000: 00 00 00 02 05 e0 00
  UrbLink              = 00000000
[683400 ms] UsbSnoop - MyInternalIOCTLCompletion(f890fdb0) : fido=81b19728, Irp=822d9840, Context=81cd51b0, IRQL=2
[683400 ms]  <<<  URB 207 coming back  <<< 
-- URB_FUNCTION_BULK_OR_INTERRUPT_TRANSFER:
  PipeHandle           = 822e77f4 [endpoint 0x00000002]
  TransferFlags        = 00000000 (USBD_TRANSFER_DIRECTION_OUT, ~USBD_SHORT_TRANSFER_OK)
  TransferBufferLength = 00000007
  TransferBuffer       = 00000000
  TransferBufferMDL    = 81b9af88
  UrbLink              = 00000000
[683409 ms] UsbSnoop - DispatchAny(f890e610) : IRP_MJ_INTERNAL_DEVICE_CONTROL
[683409 ms] UsbSnoop - MyDispatchInternalIOCTL(f890fe80) : fdo=81b1aac0, Irp=822d9840, IRQL=2
[683409 ms]  >>>  URB 208 going down  >>> 
-- URB_FUNCTION_BULK_OR_INTERRUPT_TRANSFER:
  PipeHandle           = 822e77d4 [endpoint 0x00000081]
  TransferFlags        = 00000003 (USBD_TRANSFER_DIRECTION_IN, USBD_SHORT_TRANSFER_OK)
  TransferBufferLength = 00000100
  TransferBuffer       = 00000000
  TransferBufferMDL    = 81b9af88
  UrbLink              = 00000000
[683431 ms] UsbSnoop - MyInternalIOCTLCompletion(f890fdb0) : fido=81b19728, Irp=822d9840, Context=82307cb8, IRQL=2
[683431 ms]  <<<  URB 208 coming back  <<< 
-- URB_FUNCTION_BULK_OR_INTERRUPT_TRANSFER:
  PipeHandle           = 822e77d4 [endpoint 0x00000081]
  TransferFlags        = 00000003 (USBD_TRANSFER_DIRECTION_IN, USBD_SHORT_TRANSFER_OK)
  TransferBufferLength = 000000ff
  TransferBuffer       = 00000000
  TransferBufferMDL    = 81b9af88
    00000000: 00 00 00 fa 03 2a 51 55 49 54 2a 2b 33 11 3f d6
    00000010: 31 3f ea 3f 85 3f 30 04 63 0a 3f 19 5d 01 11 04
    00000020: 63 0b 3f 3a 35 04 63 02 3f 10 19 5d 04 11 71 1a
    00000030: 5d 04 11 11 82 3a 32 04 42 3f 19 5d 04 11 70 42
    00000040: 04 63 0d 3f 1a 5d 04 11 71 42 04 63 0c 3f ed fd
    00000050: 2b 5d 01 2b 5d 04 2b 81 11 3f df 3f 93 36 2b 31
    00000060: 2b 2a 56 45 4c 10 4d 83 53 11 2a 11 3e 93 35 31
    00000070: 2b 38 31 2b 2a 54 10 53 11 2a 11 3f 84 3f d7 5a
    00000080: 3f d6 32 3f ea 3f 85 3f 30 04 63 0a 3f 19 5d 01
    00000090: 11 04 63 0b 3f 3a 35 04 63 02 3f 10 19 5d 03 11
    000000a0: 71 1a 5d 03 11 11 82 3a 32 35 04 42 3f 19 5d 03
    000000b0: 11 70 42 04 63 0d 3f 1a 5d 03 11 71 42 04 63 0c
    000000c0: 3f ee fd 2b 5d 01 2b 5d 03 2b 81 11 3f df 3f 93
    000000d0: 36 2b 31 2b 2a 46 4f 52 43 45 10 4e 11 2a 11 3e
    000000e0: 93 35 31 2b 38 31 2b 2a 54 10 53 11 2a 11 3f 84
    000000f0: 3f d7 5a 3f d6 33 3f d5 3f 42 41 4c 4c 44 52
  UrbLink              = 00000000
[683470 ms] UsbSnoop - DispatchAny(f890e610) : IRP_MJ_INTERNAL_DEVICE_CONTROL
[683470 ms] UsbSnoop - MyDispatchInternalIOCTL(f890fe80) : fdo=81b1aac0, Irp=822d9840, IRQL=2
[683470 ms]  >>>  URB 209 going down  >>> 
-- URB_FUNCTION_BULK_OR_INTERRUPT_TRANSFER:
  PipeHandle           = 822e77f4 [endpoint 0x00000002]
  TransferFlags        = 00000000 (USBD_TRANSFER_DIRECTION_OUT, ~USBD_SHORT_TRANSFER_OK)
  TransferBufferLength = 00000007
  TransferBuffer       = 00000000
  TransferBufferMDL    = 81b9af88
    00000000: 00 00 00 02 05 e0 00
  UrbLink              = 00000000
[683470 ms] UsbSnoop - MyInternalIOCTLCompletion(f890fdb0) : fido=81b19728, Irp=822d9840, Context=822f29c8, IRQL=2
[683470 ms]  <<<  URB 209 coming back  <<< 
-- URB_FUNCTION_BULK_OR_INTERRUPT_TRANSFER:
  PipeHandle           = 822e77f4 [endpoint 0x00000002]
  TransferFlags        = 00000000 (USBD_TRANSFER_DIRECTION_OUT, ~USBD_SHORT_TRANSFER_OK)
  TransferBufferLength = 00000007
  TransferBuffer       = 00000000
  TransferBufferMDL    = 81b9af88
  UrbLink              = 00000000
[683481 ms] UsbSnoop - DispatchAny(f890e610) : IRP_MJ_INTERNAL_DEVICE_CONTROL
[683481 ms] UsbSnoop - MyDispatchInternalIOCTL(f890fe80) : fdo=81b1aac0, Irp=822d9840, IRQL=2
[683481 ms]  >>>  URB 210 going down  >>> 
-- URB_FUNCTION_BULK_OR_INTERRUPT_TRANSFER:
  PipeHandle           = 822e77d4 [endpoint 0x00000081]
  TransferFlags        = 00000003 (USBD_TRANSFER_DIRECTION_IN, USBD_SHORT_TRANSFER_OK)
  TransferBufferLength = 00000100
  TransferBuffer       = 00000000
  TransferBufferMDL    = 81b9af88
  UrbLink              = 00000000
[683501 ms] UsbSnoop - MyInternalIOCTLCompletion(f890fdb0) : fido=81b19728, Irp=822d9840, Context=82307cb8, IRQL=2
[683501 ms]  <<<  URB 210 coming back  <<< 
-- URB_FUNCTION_BULK_OR_INTERRUPT_TRANSFER:
  PipeHandle           = 822e77d4 [endpoint 0x00000081]
  TransferFlags        = 00000003 (USBD_TRANSFER_DIRECTION_IN, USBD_SHORT_TRANSFER_OK)
  TransferBufferLength = 000000ff
  TransferBuffer       = 00000000
  TransferBufferMDL    = 81b9af88
    00000000: 00 00 00 fa 03 4f 50 00 33 03 08 36 2b 30 09 04
    00000010: 5d 00 3e e7 5d 00 11 3f 31 04 63 0c 3e 32 04 63
    00000020: 0d 3e 31 04 63 0a 3e 32 04 63 0b 3f 7e 0b 3f 7e
    00000030: 09 3f 7e 0d 3f ea 3f 97 3f 85 3f 93 31 2b 31 36
    00000040: 2b 2a 54 45 58 41 53 29 29 49 4e 53 54 52 55 4d
    00000050: 45 4e 54 53 2a 11 3f 93 38 2b 33 30 2b 2a 43 42
    00000060: 4c 29 29 29 53 59 53 54 45 4d 2a 11 3f 93 31 35
    00000070: 2b 31 30 2b 2a 45 58 50 45 52 49 4d 45 4e 54 29
    00000080: 29 29 57 4f 52 4b 42 4f 4f 4b 2a 11 3f 93 32 39
    00000090: 2b 32 34 2b 2a 42 41 4c 4c 44 52 4f 50 29 29 29
    000000a0: 56 32 3a 30 2a 11 3f 93 33 36 2b 31 38 2b 2a 10
    000000b0: 45 58 50 45 52 49 4d 45 4e 54 29 29 29 4d 32 11
    000000c0: 2a 11 3f 93 35 30 2b 31 39 2b 2a 50 52 45 53 53
    000000d0: 29 29 29 06 45 4e 54 45 52 07 29 29 29 4f 4e 2a
    000000e0: 3f 93 35 37 2b 32 38 2b 2a 54 49 71 38 33 29 29
    000000f0: 29 50 4c 55 53 2a 3f d8 3f e1 3f de 2a 54 55
  UrbLink              = 00000000
[683540 ms] UsbSnoop - DispatchAny(f890e610) : IRP_MJ_INTERNAL_DEVICE_CONTROL
[683540 ms] UsbSnoop - MyDispatchInternalIOCTL(f890fe80) : fdo=81b1aac0, Irp=822d9840, IRQL=2
[683540 ms]  >>>  URB 211 going down  >>> 
-- URB_FUNCTION_BULK_OR_INTERRUPT_TRANSFER:
  PipeHandle           = 822e77f4 [endpoint 0x00000002]
  TransferFlags        = 00000000 (USBD_TRANSFER_DIRECTION_OUT, ~USBD_SHORT_TRANSFER_OK)
  TransferBufferLength = 00000007
  TransferBuffer       = 00000000
  TransferBufferMDL    = 81b9af88
    00000000: 00 00 00 02 05 e0 00
  UrbLink              = 00000000
[683540 ms] UsbSnoop - MyInternalIOCTLCompletion(f890fdb0) : fido=81b19728, Irp=822d9840, Context=822db980, IRQL=2
[683540 ms]  <<<  URB 211 coming back  <<< 
-- URB_FUNCTION_BULK_OR_INTERRUPT_TRANSFER:
  PipeHandle           = 822e77f4 [endpoint 0x00000002]
  TransferFlags        = 00000000 (USBD_TRANSFER_DIRECTION_OUT, ~USBD_SHORT_TRANSFER_OK)
  TransferBufferLength = 00000007
  TransferBuffer       = 00000000
  TransferBufferMDL    = 81b9af88
  UrbLink              = 00000000
[683550 ms] UsbSnoop - DispatchAny(f890e610) : IRP_MJ_INTERNAL_DEVICE_CONTROL
[683550 ms] UsbSnoop - MyDispatchInternalIOCTL(f890fe80) : fdo=81b1aac0, Irp=822d9840, IRQL=2
[683550 ms]  >>>  URB 212 going down  >>> 
-- URB_FUNCTION_BULK_OR_INTERRUPT_TRANSFER:
  PipeHandle           = 822e77d4 [endpoint 0x00000081]
  TransferFlags        = 00000003 (USBD_TRANSFER_DIRECTION_IN, USBD_SHORT_TRANSFER_OK)
  TransferBufferLength = 00000100
  TransferBuffer       = 00000000
  TransferBufferMDL    = 81b9af88
  UrbLink              = 00000000
[683571 ms] UsbSnoop - MyInternalIOCTLCompletion(f890fdb0) : fido=81b19728, Irp=822d9840, Context=82307cb8, IRQL=2
[683571 ms]  <<<  URB 212 coming back  <<< 
-- URB_FUNCTION_BULK_OR_INTERRUPT_TRANSFER:
  PipeHandle           = 822e77d4 [endpoint 0x00000081]
  TransferFlags        = 00000003 (USBD_TRANSFER_DIRECTION_IN, USBD_SHORT_TRANSFER_OK)
  TransferBufferLength = 000000ff
  TransferBuffer       = 00000000
  TransferBufferMDL    = 81b9af88
    00000000: 00 00 00 fa 03 52 4e 29 4f 4e 29 54 48 45 29 43
    00000010: 42 4c 3a 2a 3f e0 34 2b 31 30 2b 2a 06 45 4e 54
    00000020: 45 52 07 2a 11 3f d8 3f 75 3f e1 3f de 2a 4e 4f
    00000030: 57 29 43 48 45 43 4b 49 4e 47 29 54 48 45 2a 3f
    00000040: de 2a 43 41 4c 43 55 4c 41 54 4f 52 71 43 42 4c
    00000050: 2a 3f de 2a 4c 49 4e 4b 29 43 4f 4e 4e 45 43 54
    00000060: 49 4f 4e 3a 2a 3f de 2a 50 4c 45 41 53 45 29 57
    00000070: 41 49 54 3a 3a 3a 3a 2a 3f 08 31 2b 30 09 04 5d
    00000080: 00 3f e7 5d 00 11 3f 08 30 09 04 5d 01 3f d6 4d
    00000090: 3f 08 37 09 04 5d 00 3f e7 5d 00 11 3f e8 5d 01
    000000a0: 11 3f ce b5 5d 01 11 6a 31 40 5d 01 10 31 11 6a
    000000b0: 30 3f cf 3f e1 3f de 2a 82 82 82 4c 49 4e 4b 29
    000000c0: 45 52 52 4f 52 82 82 82 2a 3f de 2a 50 55 53 48
    000000d0: 29 49 4e 29 54 48 45 29 4c 49 4e 4b 2a 3f de 2a
    000000e0: 43 4f 52 44 29 43 4f 4e 4e 45 43 54 4f 52 53 2a
    000000f0: 3f de 2a 46 49 52 4d 4c 59 29 54 48 45 4e 29
  UrbLink              = 00000000
[683610 ms] UsbSnoop - DispatchAny(f890e610) : IRP_MJ_INTERNAL_DEVICE_CONTROL
[683610 ms] UsbSnoop - MyDispatchInternalIOCTL(f890fe80) : fdo=81b1aac0, Irp=822d9840, IRQL=2
[683610 ms]  >>>  URB 213 going down  >>> 
-- URB_FUNCTION_BULK_OR_INTERRUPT_TRANSFER:
  PipeHandle           = 822e77f4 [endpoint 0x00000002]
  TransferFlags        = 00000000 (USBD_TRANSFER_DIRECTION_OUT, ~USBD_SHORT_TRANSFER_OK)
  TransferBufferLength = 00000007
  TransferBuffer       = 00000000
  TransferBufferMDL    = 81b9af88
    00000000: 00 00 00 02 05 e0 00
  UrbLink              = 00000000
[683610 ms] UsbSnoop - MyInternalIOCTLCompletion(f890fdb0) : fido=81b19728, Irp=822d9840, Context=822f29c8, IRQL=2
[683610 ms]  <<<  URB 213 coming back  <<< 
-- URB_FUNCTION_BULK_OR_INTERRUPT_TRANSFER:
  PipeHandle           = 822e77f4 [endpoint 0x00000002]
  TransferFlags        = 00000000 (USBD_TRANSFER_DIRECTION_OUT, ~USBD_SHORT_TRANSFER_OK)
  TransferBufferLength = 00000007
  TransferBuffer       = 00000000
  TransferBufferMDL    = 81b9af88
  UrbLink              = 00000000
[683620 ms] UsbSnoop - DispatchAny(f890e610) : IRP_MJ_INTERNAL_DEVICE_CONTROL
[683620 ms] UsbSnoop - MyDispatchInternalIOCTL(f890fe80) : fdo=81b1aac0, Irp=822d9840, IRQL=2
[683620 ms]  >>>  URB 214 going down  >>> 
-- URB_FUNCTION_BULK_OR_INTERRUPT_TRANSFER:
  PipeHandle           = 822e77d4 [endpoint 0x00000081]
  TransferFlags        = 00000003 (USBD_TRANSFER_DIRECTION_IN, USBD_SHORT_TRANSFER_OK)
  TransferBufferLength = 00000100
  TransferBuffer       = 00000000
  TransferBufferMDL    = 81b9af88
  UrbLink              = 00000000
[683641 ms] UsbSnoop - MyInternalIOCTLCompletion(f890fdb0) : fido=81b19728, Irp=822d9840, Context=81b05970, IRQL=2
[683641 ms]  <<<  URB 214 coming back  <<< 
-- URB_FUNCTION_BULK_OR_INTERRUPT_TRANSFER:
  PipeHandle           = 822e77d4 [endpoint 0x00000081]
  TransferFlags        = 00000003 (USBD_TRANSFER_DIRECTION_IN, USBD_SHORT_TRANSFER_OK)
  TransferBufferLength = 000000ff
  TransferBuffer       = 00000000
  TransferBufferMDL    = 81b9af88
    00000000: 00 00 00 fa 03 48 49 54 2a 3f de 2a 06 45 4e 54
    00000010: 45 52 07 3a 2a 3f d8 3f d7 4d 3f d4 3f de 2a 2a
    00000020: 3f e0 36 2b 31 2b 2a 29 29 53 54 41 54 55 53 3e
    00000030: 29 4f 3a 4b 3a 2a 3f e0 38 2b 31 30 2b 2a 06 45
    00000040: 4e 54 45 52 07 2a 11 3f d8 3f 76 3f e1 3f 85 3f
    00000050: 93 34 33 2b 36 2b 2a 50 52 45 53 53 29 29 29 06
    00000060: 45 4e 54 45 52 07 29 29 29 4f 4e 2a 3f 93 35 30
    00000070: 2b 36 2b 2a 54 49 71 38 33 29 29 29 50 4c 55 53
    00000080: 2b 2a 3f 93 35 37 2b 36 2b 2a 54 48 45 4e 29 29
    00000090: 29 06 54 52 49 47 47 45 52 07 29 29 29 4f 4e 29
    000000a0: 29 29 43 42 4c 2a 3f d8 3f 7e 08 3f 08 36 2b 30
    000000b0: 09 04 5d 00 3f e7 5d 00 11 3f 08 31 2b 30 09 04
    000000c0: 5d 00 3f e7 5d 00 11 3f 08 31 2b 31 31 2b 33 09
    000000d0: 04 5d 00 3f e7 5d 00 11 3f 08 33 2b 3a 30 32 2b
    000000e0: 38 30 2b 31 2b 30 2b 30 2b 30 2b 30 2b 31 09 04
    000000f0: 5d 00 3f e7 5d 00 11 3f fa 5d 00 2b 5d 01 3f
  UrbLink              = 00000000
[683681 ms] UsbSnoop - DispatchAny(f890e610) : IRP_MJ_INTERNAL_DEVICE_CONTROL
[683681 ms] UsbSnoop - MyDispatchInternalIOCTL(f890fe80) : fdo=81b1aac0, Irp=822d9840, IRQL=2
[683681 ms]  >>>  URB 215 going down  >>> 
-- URB_FUNCTION_BULK_OR_INTERRUPT_TRANSFER:
  PipeHandle           = 822e77f4 [endpoint 0x00000002]
  TransferFlags        = 00000000 (USBD_TRANSFER_DIRECTION_OUT, ~USBD_SHORT_TRANSFER_OK)
  TransferBufferLength = 00000007
  TransferBuffer       = 00000000
  TransferBufferMDL    = 81b9af88
    00000000: 00 00 00 02 05 e0 00
  UrbLink              = 00000000
[683681 ms] UsbSnoop - MyInternalIOCTLCompletion(f890fdb0) : fido=81b19728, Irp=822d9840, Context=82307cb8, IRQL=2
[683681 ms]  <<<  URB 215 coming back  <<< 
-- URB_FUNCTION_BULK_OR_INTERRUPT_TRANSFER:
  PipeHandle           = 822e77f4 [endpoint 0x00000002]
  TransferFlags        = 00000000 (USBD_TRANSFER_DIRECTION_OUT, ~USBD_SHORT_TRANSFER_OK)
  TransferBufferLength = 00000007
  TransferBuffer       = 00000000
  TransferBufferMDL    = 81b9af88
  UrbLink              = 00000000
[683690 ms] UsbSnoop - DispatchAny(f890e610) : IRP_MJ_INTERNAL_DEVICE_CONTROL
[683690 ms] UsbSnoop - MyDispatchInternalIOCTL(f890fe80) : fdo=81b1aac0, Irp=822d9840, IRQL=2
[683690 ms]  >>>  URB 216 going down  >>> 
-- URB_FUNCTION_BULK_OR_INTERRUPT_TRANSFER:
  PipeHandle           = 822e77d4 [endpoint 0x00000081]
  TransferFlags        = 00000003 (USBD_TRANSFER_DIRECTION_IN, USBD_SHORT_TRANSFER_OK)
  TransferBufferLength = 00000100
  TransferBuffer       = 00000000
  TransferBufferMDL    = 81b9af88
  UrbLink              = 00000000
[683712 ms] UsbSnoop - MyInternalIOCTLCompletion(f890fdb0) : fido=81b19728, Irp=822d9840, Context=81b05970, IRQL=2
[683712 ms]  <<<  URB 216 coming back  <<< 
-- URB_FUNCTION_BULK_OR_INTERRUPT_TRANSFER:
  PipeHandle           = 822e77d4 [endpoint 0x00000081]
  TransferFlags        = 00000003 (USBD_TRANSFER_DIRECTION_IN, USBD_SHORT_TRANSFER_OK)
  TransferBufferLength = 000000ff
  TransferBuffer       = 00000000
  TransferBufferMDL    = 81b9af88
    00000000: 00 00 00 fa 03 e8 5d 01 11 3f e8 5d 00 11 3f ec
    00000010: fe 2b 5d 00 2b 5d 01 2b 81 11 3f 31 04 63 02 3f
    00000020: 31 04 63 03 3f 8f 3f 93 36 2b 31 30 2b 2a 48 45
    00000030: 49 47 48 54 10 46 54 11 2a 11 3f 93 35 31 2b 36
    00000040: 38 2b 2a 54 49 4d 45 10 53 11 2a 11 3f 84 3f 42
    00000050: 45 41 54 53 00 bc 03 08 36 2b 30 09 04 5d 00 3e
    00000060: e7 5d 00 11 3f 31 04 63 0c 3e 32 04 63 0d 3e 31
    00000070: 04 63 0a 3e 32 04 63 0b 3f 7e 0b 3f 7e 09 3f 7e
    00000080: 0d 3f ea 3f 97 3f 85 3f 93 31 2b 31 36 2b 2a 54
    00000090: 45 58 41 53 29 29 49 4e 53 54 52 55 4d 45 4e 54
    000000a0: 53 2a 11 3f 93 38 2b 33 30 2b 2a 43 42 4c 29 29
    000000b0: 29 53 59 53 54 45 4d 2a 11 3f 93 31 35 2b 31 30
    000000c0: 2b 2a 45 58 50 45 52 49 4d 45 4e 54 29 29 29 57
    000000d0: 4f 52 4b 42 4f 4f 4b 2a 11 3f 93 32 39 2b 33 31
    000000e0: 2b 2a 42 45 41 54 53 29 29 29 56 32 3a 30 2a 11
    000000f0: 3f 93 33 36 2b 31 38 2b 2a 10 45 58 50 45 52
  UrbLink              = 00000000
[683750 ms] UsbSnoop - DispatchAny(f890e610) : IRP_MJ_INTERNAL_DEVICE_CONTROL
[683750 ms] UsbSnoop - MyDispatchInternalIOCTL(f890fe80) : fdo=81b1aac0, Irp=822d9840, IRQL=2
[683750 ms]  >>>  URB 217 going down  >>> 
-- URB_FUNCTION_BULK_OR_INTERRUPT_TRANSFER:
  PipeHandle           = 822e77f4 [endpoint 0x00000002]
  TransferFlags        = 00000000 (USBD_TRANSFER_DIRECTION_OUT, ~USBD_SHORT_TRANSFER_OK)
  TransferBufferLength = 00000007
  TransferBuffer       = 00000000
  TransferBufferMDL    = 81b9af88
    00000000: 00 00 00 02 05 e0 00
  UrbLink              = 00000000
[683750 ms] UsbSnoop - MyInternalIOCTLCompletion(f890fdb0) : fido=81b19728, Irp=822d9840, Context=822db980, IRQL=2
[683750 ms]  <<<  URB 217 coming back  <<< 
-- URB_FUNCTION_BULK_OR_INTERRUPT_TRANSFER:
  PipeHandle           = 822e77f4 [endpoint 0x00000002]
  TransferFlags        = 00000000 (USBD_TRANSFER_DIRECTION_OUT, ~USBD_SHORT_TRANSFER_OK)
  TransferBufferLength = 00000007
  TransferBuffer       = 00000000
  TransferBufferMDL    = 81b9af88
  UrbLink              = 00000000
[683760 ms] UsbSnoop - DispatchAny(f890e610) : IRP_MJ_INTERNAL_DEVICE_CONTROL
[683760 ms] UsbSnoop - MyDispatchInternalIOCTL(f890fe80) : fdo=81b1aac0, Irp=822d9840, IRQL=2
[683760 ms]  >>>  URB 218 going down  >>> 
-- URB_FUNCTION_BULK_OR_INTERRUPT_TRANSFER:
  PipeHandle           = 822e77d4 [endpoint 0x00000081]
  TransferFlags        = 00000003 (USBD_TRANSFER_DIRECTION_IN, USBD_SHORT_TRANSFER_OK)
  TransferBufferLength = 00000100
  TransferBuffer       = 00000000
  TransferBufferMDL    = 81b9af88
  UrbLink              = 00000000
[683781 ms] UsbSnoop - MyInternalIOCTLCompletion(f890fdb0) : fido=81b19728, Irp=822d9840, Context=81cd51b0, IRQL=2
[683781 ms]  <<<  URB 218 coming back  <<< 
-- URB_FUNCTION_BULK_OR_INTERRUPT_TRANSFER:
  PipeHandle           = 822e77d4 [endpoint 0x00000081]
  TransferFlags        = 00000003 (USBD_TRANSFER_DIRECTION_IN, USBD_SHORT_TRANSFER_OK)
  TransferBufferLength = 000000ff
  TransferBuffer       = 00000000
  TransferBufferMDL    = 81b9af88
    00000000: 00 00 00 fa 03 49 4d 45 4e 54 29 29 29 50 35 11
    00000010: 2a 11 3f 93 35 30 2b 31 39 2b 2a 50 52 45 53 53
    00000020: 29 29 29 06 45 4e 54 45 52 07 29 29 29 4f 4e 2a
    00000030: 3f 93 35 37 2b 32 38 2b 2a 54 49 71 38 33 29 29
    00000040: 29 50 4c 55 53 2a 3f d8 3f e1 3f de 2a 54 55 52
    00000050: 4e 29 4f 4e 29 54 48 45 29 43 42 4c 3a 2a 3f e0
    00000060: 34 2b 31 30 2b 2a 06 45 4e 54 45 52 07 2a 11 3f
    00000070: d8 3f 75 3f e1 3f de 2a 4e 4f 57 29 43 48 45 43
    00000080: 4b 49 4e 47 29 54 48 45 2a 3f de 2a 43 41 4c 43
    00000090: 55 4c 41 54 4f 52 71 43 42 4c 2a 3f de 2a 4c 49
    000000a0: 4e 4b 29 43 4f 4e 4e 45 43 54 49 4f 4e 3a 2a 3f
    000000b0: de 2a 50 4c 45 41 53 45 29 57 41 49 54 3a 3a 3a
    000000c0: 3a 2a 3f 08 31 2b 30 09 04 5d 00 3f e7 5d 00 11
    000000d0: 3f 08 30 09 04 5d 01 3f d6 4d 3f 08 37 09 04 5d
    000000e0: 00 3f e7 5d 00 11 3f e8 5d 01 11 3f ce b5 5d 01
    000000f0: 11 6a 31 40 5d 01 10 31 11 6a 30 3f cf 3f e1
  UrbLink              = 00000000
[683820 ms] UsbSnoop - DispatchAny(f890e610) : IRP_MJ_INTERNAL_DEVICE_CONTROL
[683820 ms] UsbSnoop - MyDispatchInternalIOCTL(f890fe80) : fdo=81b1aac0, Irp=822d9840, IRQL=2
[683820 ms]  >>>  URB 219 going down  >>> 
-- URB_FUNCTION_BULK_OR_INTERRUPT_TRANSFER:
  PipeHandle           = 822e77f4 [endpoint 0x00000002]
  TransferFlags        = 00000000 (USBD_TRANSFER_DIRECTION_OUT, ~USBD_SHORT_TRANSFER_OK)
  TransferBufferLength = 00000007
  TransferBuffer       = 00000000
  TransferBufferMDL    = 81b9af88
    00000000: 00 00 00 02 05 e0 00
  UrbLink              = 00000000
[683820 ms] UsbSnoop - MyInternalIOCTLCompletion(f890fdb0) : fido=81b19728, Irp=822d9840, Context=81b05970, IRQL=2
[683820 ms]  <<<  URB 219 coming back  <<< 
-- URB_FUNCTION_BULK_OR_INTERRUPT_TRANSFER:
  PipeHandle           = 822e77f4 [endpoint 0x00000002]
  TransferFlags        = 00000000 (USBD_TRANSFER_DIRECTION_OUT, ~USBD_SHORT_TRANSFER_OK)
  TransferBufferLength = 00000007
  TransferBuffer       = 00000000
  TransferBufferMDL    = 81b9af88
  UrbLink              = 00000000
[683830 ms] UsbSnoop - DispatchAny(f890e610) : IRP_MJ_INTERNAL_DEVICE_CONTROL
[683830 ms] UsbSnoop - MyDispatchInternalIOCTL(f890fe80) : fdo=81b1aac0, Irp=822d9840, IRQL=2
[683830 ms]  >>>  URB 220 going down  >>> 
-- URB_FUNCTION_BULK_OR_INTERRUPT_TRANSFER:
  PipeHandle           = 822e77d4 [endpoint 0x00000081]
  TransferFlags        = 00000003 (USBD_TRANSFER_DIRECTION_IN, USBD_SHORT_TRANSFER_OK)
  TransferBufferLength = 00000100
  TransferBuffer       = 00000000
  TransferBufferMDL    = 81b9af88
  UrbLink              = 00000000
[683851 ms] UsbSnoop - MyInternalIOCTLCompletion(f890fdb0) : fido=81b19728, Irp=822d9840, Context=81cd51b0, IRQL=2
[683851 ms]  <<<  URB 220 coming back  <<< 
-- URB_FUNCTION_BULK_OR_INTERRUPT_TRANSFER:
  PipeHandle           = 822e77d4 [endpoint 0x00000081]
  TransferFlags        = 00000003 (USBD_TRANSFER_DIRECTION_IN, USBD_SHORT_TRANSFER_OK)
  TransferBufferLength = 000000ff
  TransferBuffer       = 00000000
  TransferBufferMDL    = 81b9af88
    00000000: 00 00 00 fa 03 3f de 2a 82 82 82 4c 49 4e 4b 29
    00000010: 45 52 52 4f 52 82 82 82 2a 3f de 2a 50 55 53 48
    00000020: 29 49 4e 29 54 48 45 29 4c 49 4e 4b 2a 3f de 2a
    00000030: 43 4f 52 44 29 43 4f 4e 4e 45 43 54 4f 52 53 2a
    00000040: 3f de 2a 46 49 52 4d 4c 59 29 54 48 45 4e 29 48
    00000050: 49 54 2a 3f de 2a 06 45 4e 54 45 52 07 3a 2a 3f
    00000060: d8 3f d7 4d 3f d4 3f de 2a 2a 3f e0 36 2b 31 2b
    00000070: 2a 29 29 53 54 41 54 55 53 3e 29 4f 3a 4b 3a 2a
    00000080: 3f e0 38 2b 31 30 2b 2a 06 45 4e 54 45 52 07 2a
    00000090: 11 3f d8 3f 76 3f e1 3f 85 3f 7e 08 3f fa 5d 01
    000000a0: 2b 5d 04 3f e1 3f 08 36 2b 30 09 04 5d 00 3f e7
    000000b0: 5d 00 11 3f 08 31 2b 30 09 04 5d 00 3f e7 5d 00
    000000c0: 11 3f 08 31 2b 31 2b 31 09 04 5d 00 3f e7 5d 00
    000000d0: 11 3f e1 3f de 2a 45 4e 54 45 52 29 54 55 4e 49
    000000e0: 4e 47 29 2a 3f de 2a 46 4f 52 4b 29 46 52 45 51
    000000f0: 55 45 4e 43 49 45 53 2a 3f de 2a 2a 3f dc 2a
  UrbLink              = 00000000
[683890 ms] UsbSnoop - DispatchAny(f890e610) : IRP_MJ_INTERNAL_DEVICE_CONTROL
[683890 ms] UsbSnoop - MyDispatchInternalIOCTL(f890fe80) : fdo=81b1aac0, Irp=822d9840, IRQL=2
[683890 ms]  >>>  URB 221 going down  >>> 
-- URB_FUNCTION_BULK_OR_INTERRUPT_TRANSFER:
  PipeHandle           = 822e77f4 [endpoint 0x00000002]
  TransferFlags        = 00000000 (USBD_TRANSFER_DIRECTION_OUT, ~USBD_SHORT_TRANSFER_OK)
  TransferBufferLength = 00000007
  TransferBuffer       = 00000000
  TransferBufferMDL    = 81b9af88
    00000000: 00 00 00 02 05 e0 00
  UrbLink              = 00000000
[683890 ms] UsbSnoop - MyInternalIOCTLCompletion(f890fdb0) : fido=81b19728, Irp=822d9840, Context=82307cb8, IRQL=2
[683891 ms]  <<<  URB 221 coming back  <<< 
-- URB_FUNCTION_BULK_OR_INTERRUPT_TRANSFER:
  PipeHandle           = 822e77f4 [endpoint 0x00000002]
  TransferFlags        = 00000000 (USBD_TRANSFER_DIRECTION_OUT, ~USBD_SHORT_TRANSFER_OK)
  TransferBufferLength = 00000007
  TransferBuffer       = 00000000
  TransferBufferMDL    = 81b9af88
  UrbLink              = 00000000
[683900 ms] UsbSnoop - DispatchAny(f890e610) : IRP_MJ_INTERNAL_DEVICE_CONTROL
[683900 ms] UsbSnoop - MyDispatchInternalIOCTL(f890fe80) : fdo=81b1aac0, Irp=822d9840, IRQL=2
[683900 ms]  >>>  URB 222 going down  >>> 
-- URB_FUNCTION_BULK_OR_INTERRUPT_TRANSFER:
  PipeHandle           = 822e77d4 [endpoint 0x00000081]
  TransferFlags        = 00000003 (USBD_TRANSFER_DIRECTION_IN, USBD_SHORT_TRANSFER_OK)
  TransferBufferLength = 00000100
  TransferBuffer       = 00000000
  TransferBufferMDL    = 81b9af88
  UrbLink              = 00000000
[683922 ms] UsbSnoop - MyInternalIOCTLCompletion(f890fdb0) : fido=81b19728, Irp=822d9840, Context=81cd51b0, IRQL=2
[683922 ms]  <<<  URB 222 coming back  <<< 
-- URB_FUNCTION_BULK_OR_INTERRUPT_TRANSFER:
  PipeHandle           = 822e77d4 [endpoint 0x00000081]
  TransferFlags        = 00000003 (USBD_TRANSFER_DIRECTION_IN, USBD_SHORT_TRANSFER_OK)
  TransferBufferLength = 000000ff
  TransferBuffer       = 00000000
  TransferBufferMDL    = 81b9af88
    00000000: 00 00 00 fa 03 46 31 af 29 2a 2b 45 3f dc 2a 46
    00000010: 32 af 29 2a 2b 46 3f 3a 30 33 83 b2 10 46 71 45
    00000020: 11 04 52 3f e1 3f de 2a 50 52 45 53 53 29 45 4e
    00000030: 54 45 52 29 54 4f 2a 3f de 2a 53 54 41 52 54 29
    00000040: 43 4f 4c 4c 45 43 54 49 4e 47 2a 3f de 2a 44 41
    00000050: 54 41 3a 2a 3f d8 3f 08 33 2b 52 2b 39 39 2b 30
    00000060: 2b 30 2b 30 2b 30 2b 30 2b 31 09 04 5d 00 3f e7
    00000070: 5d 00 11 3f 85 3f e8 5d 04 11 3f e8 5d 01 11 3f
    00000080: 3a 30 31 04 63 02 3f 1a 5d 01 11 04 63 0a 3f 19
    00000090: 5d 01 11 04 63 0b 3f 3a 32 35 82 10 19 5d 04 11
    000000a0: 71 1a 5d 04 11 11 04 41 3f 3a 31 04 63 03 3f 1a
    000000b0: 5d 04 11 71 41 04 63 0c 3f 19 5d 04 11 70 41 04
    000000c0: 63 0d 3f 10 63 0d 71 63 0c 11 83 32 70 63 0c 04
    000000d0: 51 3f 5d 04 71 51 04 5d 04 3f 51 71 63 0c 04 51
    000000e0: 3f b0 51 04 63 0c 3f 51 04 63 0d 3f 52 82 32 30
    000000f0: 04 63 02 3f ec fd 2b 5d 01 2b 5d 04 2b 81 11
  UrbLink              = 00000000
[683960 ms] UsbSnoop - DispatchAny(f890e610) : IRP_MJ_INTERNAL_DEVICE_CONTROL
[683960 ms] UsbSnoop - MyDispatchInternalIOCTL(f890fe80) : fdo=81b1aac0, Irp=822d9840, IRQL=2
[683960 ms]  >>>  URB 223 going down  >>> 
-- URB_FUNCTION_BULK_OR_INTERRUPT_TRANSFER:
  PipeHandle           = 822e77f4 [endpoint 0x00000002]
  TransferFlags        = 00000000 (USBD_TRANSFER_DIRECTION_OUT, ~USBD_SHORT_TRANSFER_OK)
  TransferBufferLength = 00000007
  TransferBuffer       = 00000000
  TransferBufferMDL    = 81b9af88
    00000000: 00 00 00 02 05 e0 00
  UrbLink              = 00000000
[683961 ms] UsbSnoop - MyInternalIOCTLCompletion(f890fdb0) : fido=81b19728, Irp=822d9840, Context=81b05970, IRQL=2
[683961 ms]  <<<  URB 223 coming back  <<< 
-- URB_FUNCTION_BULK_OR_INTERRUPT_TRANSFER:
  PipeHandle           = 822e77f4 [endpoint 0x00000002]
  TransferFlags        = 00000000 (USBD_TRANSFER_DIRECTION_OUT, ~USBD_SHORT_TRANSFER_OK)
  TransferBufferLength = 00000007
  TransferBuffer       = 00000000
  TransferBufferMDL    = 81b9af88
  UrbLink              = 00000000
[683970 ms] UsbSnoop - DispatchAny(f890e610) : IRP_MJ_INTERNAL_DEVICE_CONTROL
[683970 ms] UsbSnoop - MyDispatchInternalIOCTL(f890fe80) : fdo=81b1aac0, Irp=822d9840, IRQL=2
[683970 ms]  >>>  URB 224 going down  >>> 
-- URB_FUNCTION_BULK_OR_INTERRUPT_TRANSFER:
  PipeHandle           = 822e77d4 [endpoint 0x00000081]
  TransferFlags        = 00000003 (USBD_TRANSFER_DIRECTION_IN, USBD_SHORT_TRANSFER_OK)
  TransferBufferLength = 00000100
  TransferBuffer       = 00000000
  TransferBufferMDL    = 81b9af88
  UrbLink              = 00000000
[683992 ms] UsbSnoop - MyInternalIOCTLCompletion(f890fdb0) : fido=81b19728, Irp=822d9840, Context=822f29c8, IRQL=2
[683992 ms]  <<<  URB 224 coming back  <<< 
-- URB_FUNCTION_BULK_OR_INTERRUPT_TRANSFER:
  PipeHandle           = 822e77d4 [endpoint 0x00000081]
  TransferFlags        = 00000003 (USBD_TRANSFER_DIRECTION_IN, USBD_SHORT_TRANSFER_OK)
  TransferBufferLength = 000000ff
  TransferBuffer       = 00000000
  TransferBufferMDL    = 81b9af88
    00000000: 00 00 00 fa 03 3f 93 36 2b 31 2b 2a 50 52 45 53
    00000010: 53 55 52 45 2a 11 3e 93 35 31 2b 36 39 2b 2a 54
    00000020: 49 4d 45 10 53 11 2a 11 3f 84 3f 42 4f 55 4e 43
    00000030: 45 00 49 03 08 36 2b 30 09 04 5d 00 3e e7 5d 00
    00000040: 11 3f 31 04 63 0c 3e 32 04 63 0d 3e 31 04 63 0a
    00000050: 3e 32 04 63 0b 3f 7e 0b 3f 7e 09 3f 7e 0d 3f ea
    00000060: 3f 97 3f 85 3f 93 31 2b 31 36 2b 2a 54 45 58 41
    00000070: 53 29 29 49 4e 53 54 52 55 4d 45 4e 54 53 2a 11
    00000080: 3f 93 38 2b 33 30 2b 2a 43 42 4c 29 29 29 53 59
    00000090: 53 54 45 4d 2a 11 3f 93 31 35 2b 31 30 2b 2a 45
    000000a0: 58 50 45 52 49 4d 45 4e 54 29 29 29 57 4f 52 4b
    000000b0: 42 4f 4f 4b 2a 11 3f 93 32 39 2b 32 38 2b 2a 42
    000000c0: 4f 55 4e 43 45 29 29 29 56 32 3a 30 2a 11 3f 93
    000000d0: 33 36 2b 31 38 2b 2a 10 45 58 50 45 52 49 4d 45
    000000e0: 4e 54 29 29 29 50 32 11 2a 11 3f 93 35 30 2b 31
    000000f0: 39 2b 2a 50 52 45 53 53 29 29 29 06 45 4e 54
  UrbLink              = 00000000
[684030 ms] UsbSnoop - DispatchAny(f890e610) : IRP_MJ_INTERNAL_DEVICE_CONTROL
[684030 ms] UsbSnoop - MyDispatchInternalIOCTL(f890fe80) : fdo=81b1aac0, Irp=822d9840, IRQL=2
[684030 ms]  >>>  URB 225 going down  >>> 
-- URB_FUNCTION_BULK_OR_INTERRUPT_TRANSFER:
  PipeHandle           = 822e77f4 [endpoint 0x00000002]
  TransferFlags        = 00000000 (USBD_TRANSFER_DIRECTION_OUT, ~USBD_SHORT_TRANSFER_OK)
  TransferBufferLength = 00000007
  TransferBuffer       = 00000000
  TransferBufferMDL    = 81b9af88
    00000000: 00 00 00 02 05 e0 00
  UrbLink              = 00000000
[684031 ms] UsbSnoop - MyInternalIOCTLCompletion(f890fdb0) : fido=81b19728, Irp=822d9840, Context=81cd51b0, IRQL=2
[684031 ms]  <<<  URB 225 coming back  <<< 
-- URB_FUNCTION_BULK_OR_INTERRUPT_TRANSFER:
  PipeHandle           = 822e77f4 [endpoint 0x00000002]
  TransferFlags        = 00000000 (USBD_TRANSFER_DIRECTION_OUT, ~USBD_SHORT_TRANSFER_OK)
  TransferBufferLength = 00000007
  TransferBuffer       = 00000000
  TransferBufferMDL    = 81b9af88
  UrbLink              = 00000000
[684040 ms] UsbSnoop - DispatchAny(f890e610) : IRP_MJ_INTERNAL_DEVICE_CONTROL
[684040 ms] UsbSnoop - MyDispatchInternalIOCTL(f890fe80) : fdo=81b1aac0, Irp=822d9840, IRQL=2
[684040 ms]  >>>  URB 226 going down  >>> 
-- URB_FUNCTION_BULK_OR_INTERRUPT_TRANSFER:
  PipeHandle           = 822e77d4 [endpoint 0x00000081]
  TransferFlags        = 00000003 (USBD_TRANSFER_DIRECTION_IN, USBD_SHORT_TRANSFER_OK)
  TransferBufferLength = 00000100
  TransferBuffer       = 00000000
  TransferBufferMDL    = 81b9af88
  UrbLink              = 00000000
[684062 ms] UsbSnoop - MyInternalIOCTLCompletion(f890fdb0) : fido=81b19728, Irp=822d9840, Context=822f29c8, IRQL=2
[684062 ms]  <<<  URB 226 coming back  <<< 
-- URB_FUNCTION_BULK_OR_INTERRUPT_TRANSFER:
  PipeHandle           = 822e77d4 [endpoint 0x00000081]
  TransferFlags        = 00000003 (USBD_TRANSFER_DIRECTION_IN, USBD_SHORT_TRANSFER_OK)
  TransferBufferLength = 000000ff
  TransferBuffer       = 00000000
  TransferBufferMDL    = 81b9af88
    00000000: 00 00 00 fa 03 45 52 07 29 29 29 4f 4e 2a 3f 93
    00000010: 35 37 2b 32 38 2b 2a 54 49 71 38 33 29 29 29 50
    00000020: 4c 55 53 2a 3f d8 3f e1 3f de 2a 54 55 52 4e 29
    00000030: 4f 4e 29 54 48 45 29 43 42 4c 3a 2a 3f e0 34 2b
    00000040: 31 30 2b 2a 06 45 4e 54 45 52 07 2a 11 3f d8 3f
    00000050: 75 3f e1 3f de 2a 4e 4f 57 29 43 48 45 43 4b 49
    00000060: 4e 47 29 54 48 45 2a 3f de 2a 43 41 4c 43 55 4c
    00000070: 41 54 4f 52 71 43 42 4c 2a 3f de 2a 4c 49 4e 4b
    00000080: 29 43 4f 4e 4e 45 43 54 49 4f 4e 3a 2a 3f de 2a
    00000090: 50 4c 45 41 53 45 29 57 41 49 54 3a 3a 3a 3a 2a
    000000a0: 3f 08 31 2b 30 09 04 5d 00 3f e7 5d 00 11 3f 08
    000000b0: 30 09 04 5d 01 3f d6 4d 3f 08 37 09 04 5d 00 3f
    000000c0: e7 5d 00 11 3f e8 5d 01 11 3f ce b5 5d 01 11 6a
    000000d0: 31 40 5d 01 10 31 11 6a 30 3f cf 3f e1 3f de 2a
    000000e0: 82 82 82 4c 49 4e 4b 29 45 52 52 4f 52 82 82 82
    000000f0: 2a 3f de 2a 50 55 53 48 29 49 4e 29 54 48 45
  UrbLink              = 00000000
[684101 ms] UsbSnoop - DispatchAny(f890e610) : IRP_MJ_INTERNAL_DEVICE_CONTROL
[684101 ms] UsbSnoop - MyDispatchInternalIOCTL(f890fe80) : fdo=81b1aac0, Irp=822d9840, IRQL=2
[684101 ms]  >>>  URB 227 going down  >>> 
-- URB_FUNCTION_BULK_OR_INTERRUPT_TRANSFER:
  PipeHandle           = 822e77f4 [endpoint 0x00000002]
  TransferFlags        = 00000000 (USBD_TRANSFER_DIRECTION_OUT, ~USBD_SHORT_TRANSFER_OK)
  TransferBufferLength = 00000007
  TransferBuffer       = 00000000
  TransferBufferMDL    = 81b9af88
    00000000: 00 00 00 02 05 e0 00
  UrbLink              = 00000000
[684101 ms] UsbSnoop - MyInternalIOCTLCompletion(f890fdb0) : fido=81b19728, Irp=822d9840, Context=82307cb8, IRQL=2
[684101 ms]  <<<  URB 227 coming back  <<< 
-- URB_FUNCTION_BULK_OR_INTERRUPT_TRANSFER:
  PipeHandle           = 822e77f4 [endpoint 0x00000002]
  TransferFlags        = 00000000 (USBD_TRANSFER_DIRECTION_OUT, ~USBD_SHORT_TRANSFER_OK)
  TransferBufferLength = 00000007
  TransferBuffer       = 00000000
  TransferBufferMDL    = 81b9af88
  UrbLink              = 00000000
[684111 ms] UsbSnoop - DispatchAny(f890e610) : IRP_MJ_INTERNAL_DEVICE_CONTROL
[684111 ms] UsbSnoop - MyDispatchInternalIOCTL(f890fe80) : fdo=81b1aac0, Irp=822d9840, IRQL=2
[684111 ms]  >>>  URB 228 going down  >>> 
-- URB_FUNCTION_BULK_OR_INTERRUPT_TRANSFER:
  PipeHandle           = 822e77d4 [endpoint 0x00000081]
  TransferFlags        = 00000003 (USBD_TRANSFER_DIRECTION_IN, USBD_SHORT_TRANSFER_OK)
  TransferBufferLength = 00000100
  TransferBuffer       = 00000000
  TransferBufferMDL    = 81b9af88
  UrbLink              = 00000000
[684132 ms] UsbSnoop - MyInternalIOCTLCompletion(f890fdb0) : fido=81b19728, Irp=822d9840, Context=822f29c8, IRQL=2
[684132 ms]  <<<  URB 228 coming back  <<< 
-- URB_FUNCTION_BULK_OR_INTERRUPT_TRANSFER:
  PipeHandle           = 822e77d4 [endpoint 0x00000081]
  TransferFlags        = 00000003 (USBD_TRANSFER_DIRECTION_IN, USBD_SHORT_TRANSFER_OK)
  TransferBufferLength = 000000ff
  TransferBuffer       = 00000000
  TransferBufferMDL    = 81b9af88
    00000000: 00 00 00 fa 03 29 4c 49 4e 4b 2a 3f de 2a 43 4f
    00000010: 52 44 29 43 4f 4e 4e 45 43 54 4f 52 53 2a 3f de
    00000020: 2a 46 49 52 4d 4c 59 29 54 48 45 4e 29 48 49 54
    00000030: 2a 3f de 2a 06 45 4e 54 45 52 07 3a 2a 3f d8 3f
    00000040: d7 4d 3f d4 3f de 2a 2a 3f e0 36 2b 31 2b 2a 29
    00000050: 29 53 54 41 54 55 53 3e 29 4f 3a 4b 3a 2a 3f e0
    00000060: 38 2b 31 30 2b 2a 06 45 4e 54 45 52 07 2a 11 3f
    00000070: d8 3f 76 3f e1 3f 85 3f 7e 08 3f fa 5d 01 2b 5d
    00000080: 04 3f e1 3f fa 5d 01 2b 5d 03 3f 08 36 2b 30 09
    00000090: 04 5d 00 3f e7 5d 00 11 3f 08 31 2b 30 09 04 5d
    000000a0: 00 3f e7 5d 00 11 3f 08 31 2b 31 31 2b 32 09 04
    000000b0: 5d 00 3f e7 5d 00 11 3f 32 35 04 42 3f e1 3f de
    000000c0: 2a 50 52 45 53 53 29 45 4e 54 45 52 29 54 4f 2a
    000000d0: 3f de 2a 53 54 41 52 54 29 43 4f 4c 4c 45 43 54
    000000e0: 49 4e 47 2a 3f de 2a 44 41 54 41 3a 2a 3f d8 3f
    000000f0: 08 33 2b 42 0c 2b 39 39 2b 30 2b 30 2b 30 2b
  UrbLink              = 00000000
[684171 ms] UsbSnoop - DispatchAny(f890e610) : IRP_MJ_INTERNAL_DEVICE_CONTROL
[684171 ms] UsbSnoop - MyDispatchInternalIOCTL(f890fe80) : fdo=81b1aac0, Irp=822d9840, IRQL=2
[684171 ms]  >>>  URB 229 going down  >>> 
-- URB_FUNCTION_BULK_OR_INTERRUPT_TRANSFER:
  PipeHandle           = 822e77f4 [endpoint 0x00000002]
  TransferFlags        = 00000000 (USBD_TRANSFER_DIRECTION_OUT, ~USBD_SHORT_TRANSFER_OK)
  TransferBufferLength = 00000007
  TransferBuffer       = 00000000
  TransferBufferMDL    = 81b9af88
    00000000: 00 00 00 02 05 e0 00
  UrbLink              = 00000000
[684171 ms] UsbSnoop - MyInternalIOCTLCompletion(f890fdb0) : fido=81b19728, Irp=822d9840, Context=81cd51b0, IRQL=2
[684171 ms]  <<<  URB 229 coming back  <<< 
-- URB_FUNCTION_BULK_OR_INTERRUPT_TRANSFER:
  PipeHandle           = 822e77f4 [endpoint 0x00000002]
  TransferFlags        = 00000000 (USBD_TRANSFER_DIRECTION_OUT, ~USBD_SHORT_TRANSFER_OK)
  TransferBufferLength = 00000007
  TransferBuffer       = 00000000
  TransferBufferMDL    = 81b9af88
  UrbLink              = 00000000
[684181 ms] UsbSnoop - DispatchAny(f890e610) : IRP_MJ_INTERNAL_DEVICE_CONTROL
[684181 ms] UsbSnoop - MyDispatchInternalIOCTL(f890fe80) : fdo=81b1aac0, Irp=822d9840, IRQL=2
[684181 ms]  >>>  URB 230 going down  >>> 
-- URB_FUNCTION_BULK_OR_INTERRUPT_TRANSFER:
  PipeHandle           = 822e77d4 [endpoint 0x00000081]
  TransferFlags        = 00000003 (USBD_TRANSFER_DIRECTION_IN, USBD_SHORT_TRANSFER_OK)
  TransferBufferLength = 00000100
  TransferBuffer       = 00000000
  TransferBufferMDL    = 81b9af88
  UrbLink              = 00000000
[684202 ms] UsbSnoop - MyInternalIOCTLCompletion(f890fdb0) : fido=81b19728, Irp=822d9840, Context=822f29c8, IRQL=2
[684202 ms]  <<<  URB 230 coming back  <<< 
-- URB_FUNCTION_BULK_OR_INTERRUPT_TRANSFER:
  PipeHandle           = 822e77d4 [endpoint 0x00000081]
  TransferFlags        = 00000003 (USBD_TRANSFER_DIRECTION_IN, USBD_SHORT_TRANSFER_OK)
  TransferBufferLength = 000000ff
  TransferBuffer       = 00000000
  TransferBufferMDL    = 81b9af88
    00000000: 00 00 00 fa 03 30 2b 30 2b 31 09 04 5d 00 3f e7
    00000010: 5d 00 11 3f 85 3f e8 5d 03 11 3f e8 5d 01 11 3f
    00000020: 19 5d 03 11 71 5d 03 04 5d 03 3f 30 04 63 0a 3f
    00000030: 19 5d 01 11 04 63 0b 3f 3a 35 04 63 02 3f 19 5d
    00000040: 03 11 82 31 3a 34 04 63 0d 3f 1a 30 2b 1a 5d 03
    00000050: 11 82 31 3a 34 11 04 63 0c 3f 3a 35 04 63 03 3f
    00000060: ec fd 2b 5d 01 2b 5d 03 2b 81 11 3f df 3f 93 36
    00000070: 2b 32 2b 2a 44 49 53 54 10 4d 11 2a 11 3e 93 35
    00000080: 31 2b 38 31 2b 2a 54 10 53 11 2a 11 3f 84 3f 43
    00000090: 41 4c 49 42 52 41 54 00 3c 05 08 36 2b 30 09 04
    000000a0: 5d 00 3e e7 5d 00 11 3f 31 04 63 0c 3e 32 04 63
    000000b0: 0d 3e 31 04 63 0a 3e 32 04 63 0b 3f 7e 0b 3f 7e
    000000c0: 09 3f 7e 0d 3f ea 3f 97 3f 85 3f 93 31 2b 31 36
    000000d0: 2b 2a 54 45 58 41 53 29 29 49 4e 53 54 52 55 4d
    000000e0: 45 4e 54 53 2a 11 3f 93 31 35 2b 32 34 2b 2a 43
    000000f0: 41 4c 49 42 52 41 54 29 29 29 56 32 3a 30 2a
  UrbLink              = 00000000
[684241 ms] UsbSnoop - DispatchAny(f890e610) : IRP_MJ_INTERNAL_DEVICE_CONTROL
[684241 ms] UsbSnoop - MyDispatchInternalIOCTL(f890fe80) : fdo=81b1aac0, Irp=822d9840, IRQL=2
[684241 ms]  >>>  URB 231 going down  >>> 
-- URB_FUNCTION_BULK_OR_INTERRUPT_TRANSFER:
  PipeHandle           = 822e77f4 [endpoint 0x00000002]
  TransferFlags        = 00000000 (USBD_TRANSFER_DIRECTION_OUT, ~USBD_SHORT_TRANSFER_OK)
  TransferBufferLength = 00000007
  TransferBuffer       = 00000000
  TransferBufferMDL    = 81b9af88
    00000000: 00 00 00 02 05 e0 00
  UrbLink              = 00000000
[684241 ms] UsbSnoop - MyInternalIOCTLCompletion(f890fdb0) : fido=81b19728, Irp=822d9840, Context=82307cb8, IRQL=2
[684241 ms]  <<<  URB 231 coming back  <<< 
-- URB_FUNCTION_BULK_OR_INTERRUPT_TRANSFER:
  PipeHandle           = 822e77f4 [endpoint 0x00000002]
  TransferFlags        = 00000000 (USBD_TRANSFER_DIRECTION_OUT, ~USBD_SHORT_TRANSFER_OK)
  TransferBufferLength = 00000007
  TransferBuffer       = 00000000
  TransferBufferMDL    = 81b9af88
  UrbLink              = 00000000
[684251 ms] UsbSnoop - DispatchAny(f890e610) : IRP_MJ_INTERNAL_DEVICE_CONTROL
[684251 ms] UsbSnoop - MyDispatchInternalIOCTL(f890fe80) : fdo=81b1aac0, Irp=822d9840, IRQL=2
[684251 ms]  >>>  URB 232 going down  >>> 
-- URB_FUNCTION_BULK_OR_INTERRUPT_TRANSFER:
  PipeHandle           = 822e77d4 [endpoint 0x00000081]
  TransferFlags        = 00000003 (USBD_TRANSFER_DIRECTION_IN, USBD_SHORT_TRANSFER_OK)
  TransferBufferLength = 00000100
  TransferBuffer       = 00000000
  TransferBufferMDL    = 81b9af88
  UrbLink              = 00000000
[684272 ms] UsbSnoop - MyInternalIOCTLCompletion(f890fdb0) : fido=81b19728, Irp=822d9840, Context=822f29c8, IRQL=2
[684272 ms]  <<<  URB 232 coming back  <<< 
-- URB_FUNCTION_BULK_OR_INTERRUPT_TRANSFER:
  PipeHandle           = 822e77d4 [endpoint 0x00000081]
  TransferFlags        = 00000003 (USBD_TRANSFER_DIRECTION_IN, USBD_SHORT_TRANSFER_OK)
  TransferBufferLength = 000000ff
  TransferBuffer       = 00000000
  TransferBufferMDL    = 81b9af88
    00000000: 00 00 00 fa 03 11 3f 93 32 39 2b 31 38 2b 2a 43
    00000010: 41 52 45 46 55 4c 4c 59 29 29 46 4f 4c 4c 4f 57
    00000020: 2a 11 3f 93 33 36 2b 31 30 2b 2a 50 52 4f 43 45
    00000030: 44 55 52 45 53 29 29 4f 4e 29 29 50 3a 35 29 29
    00000040: 54 4f 2a 11 3f 93 34 33 2b 32 2b 2a 41 56 4f 49
    00000050: 44 29 29 55 4e 45 58 50 45 43 54 45 44 29 29 52
    00000060: 45 53 55 4c 54 53 2a 11 3f 93 35 30 2b 31 39 2b
    00000070: 2a 50 52 45 53 53 29 29 29 06 45 4e 54 45 52 07
    00000080: 29 29 29 4f 4e 2a 3f 93 35 37 2b 32 38 2b 2a 54
    00000090: 49 71 38 33 29 29 29 50 4c 55 53 2a 3f d8 3f 85
    000000a0: 3f 93 31 2b 31 2b 2a 54 4f 29 29 53 41 56 45 29
    000000b0: 29 43 4f 4e 53 54 41 4e 54 53 3e 2a 11 3f 93 38
    000000c0: 2b 31 30 2b 2a 53 55 42 53 54 49 54 55 54 45 29
    000000d0: 29 49 4e 54 4f 2a 11 3f 93 31 35 2b 31 30 2b 2a
    000000e0: 43 4f 4d 4d 41 4e 44 29 29 34 29 29 4f 46 29 29
    000000f0: 50 52 4f 47 52 41 4d 53 2a 11 3f 93 32 32 2b
  UrbLink              = 00000000
[684311 ms] UsbSnoop - DispatchAny(f890e610) : IRP_MJ_INTERNAL_DEVICE_CONTROL
[684311 ms] UsbSnoop - MyDispatchInternalIOCTL(f890fe80) : fdo=81b1aac0, Irp=822d9840, IRQL=2
[684311 ms]  >>>  URB 233 going down  >>> 
-- URB_FUNCTION_BULK_OR_INTERRUPT_TRANSFER:
  PipeHandle           = 822e77f4 [endpoint 0x00000002]
  TransferFlags        = 00000000 (USBD_TRANSFER_DIRECTION_OUT, ~USBD_SHORT_TRANSFER_OK)
  TransferBufferLength = 00000007
  TransferBuffer       = 00000000
  TransferBufferMDL    = 822d87a0
    00000000: 00 00 00 02 05 e0 00
  UrbLink              = 00000000
[684311 ms] UsbSnoop - MyInternalIOCTLCompletion(f890fdb0) : fido=81b19728, Irp=822d9840, Context=81cd51b0, IRQL=2
[684311 ms]  <<<  URB 233 coming back  <<< 
-- URB_FUNCTION_BULK_OR_INTERRUPT_TRANSFER:
  PipeHandle           = 822e77f4 [endpoint 0x00000002]
  TransferFlags        = 00000000 (USBD_TRANSFER_DIRECTION_OUT, ~USBD_SHORT_TRANSFER_OK)
  TransferBufferLength = 00000007
  TransferBuffer       = 00000000
  TransferBufferMDL    = 822d87a0
  UrbLink              = 00000000
[684321 ms] UsbSnoop - DispatchAny(f890e610) : IRP_MJ_INTERNAL_DEVICE_CONTROL
[684321 ms] UsbSnoop - MyDispatchInternalIOCTL(f890fe80) : fdo=81b1aac0, Irp=822d9840, IRQL=2
[684321 ms]  >>>  URB 234 going down  >>> 
-- URB_FUNCTION_BULK_OR_INTERRUPT_TRANSFER:
  PipeHandle           = 822e77d4 [endpoint 0x00000081]
  TransferFlags        = 00000003 (USBD_TRANSFER_DIRECTION_IN, USBD_SHORT_TRANSFER_OK)
  TransferBufferLength = 00000100
  TransferBuffer       = 00000000
  TransferBufferMDL    = 822d87a0
  UrbLink              = 00000000
[684342 ms] UsbSnoop - MyInternalIOCTLCompletion(f890fdb0) : fido=81b19728, Irp=822d9840, Context=822f29c8, IRQL=2
[684342 ms]  <<<  URB 234 coming back  <<< 
-- URB_FUNCTION_BULK_OR_INTERRUPT_TRANSFER:
  PipeHandle           = 822e77d4 [endpoint 0x00000081]
  TransferFlags        = 00000003 (USBD_TRANSFER_DIRECTION_IN, USBD_SHORT_TRANSFER_OK)
  TransferBufferLength = 000000ff
  TransferBuffer       = 00000000
  TransferBufferMDL    = 822d87a0
    00000000: 00 00 00 fa 03 31 30 2b 2a 55 53 49 4e 47 29 29
    00000010: 54 48 45 53 45 29 29 50 52 4f 42 45 53 2a 11 3f
    00000020: 93 33 36 2b 31 2b 2a 54 4f 29 29 55 53 45 29 29
    00000030: 57 49 54 48 4f 55 54 29 29 53 41 56 49 4e 47 3e
    00000040: 2a 11 3f 93 34 33 2b 31 30 2b 2a 44 45 4c 45 54
    00000050: 45 29 29 43 4f 4d 4d 41 4e 44 29 29 34 29 29 41
    00000060: 4e 44 2a 11 3f 93 35 30 2b 31 30 2b 2a 54 48 45
    00000070: 29 29 53 45 4e 44 29 29 43 4f 4d 4d 41 4e 44 2a
    00000080: 11 3f 93 35 37 2b 31 30 2b 2a 49 4d 4d 45 44 49
    00000090: 41 54 45 4c 59 29 29 41 46 54 45 52 29 29 49 54
    000000a0: 2a 11 3f d8 3f e1 3f de 2a 54 55 52 4e 29 4f 4e
    000000b0: 29 54 48 45 29 43 42 4c 3a 2a 3f e0 34 2b 31 30
    000000c0: 2b 2a 06 45 4e 54 45 52 07 2a 11 3f d8 3f 75 3f
    000000d0: e1 3f de 2a 4e 4f 57 29 43 48 45 43 4b 49 4e 47
    000000e0: 29 54 48 45 2a 3f de 2a 43 41 4c 43 55 4c 41 54
    000000f0: 4f 52 71 43 42 4c 2a 3f de 2a 4c 49 4e 4b 29
  UrbLink              = 00000000
[684381 ms] UsbSnoop - DispatchAny(f890e610) : IRP_MJ_INTERNAL_DEVICE_CONTROL
[684381 ms] UsbSnoop - MyDispatchInternalIOCTL(f890fe80) : fdo=81b1aac0, Irp=822d9840, IRQL=2
[684381 ms]  >>>  URB 235 going down  >>> 
-- URB_FUNCTION_BULK_OR_INTERRUPT_TRANSFER:
  PipeHandle           = 822e77f4 [endpoint 0x00000002]
  TransferFlags        = 00000000 (USBD_TRANSFER_DIRECTION_OUT, ~USBD_SHORT_TRANSFER_OK)
  TransferBufferLength = 00000007
  TransferBuffer       = 00000000
  TransferBufferMDL    = 822d87a0
    00000000: 00 00 00 02 05 e0 00
  UrbLink              = 00000000
[684381 ms] UsbSnoop - MyInternalIOCTLCompletion(f890fdb0) : fido=81b19728, Irp=822d9840, Context=82307cb8, IRQL=2
[684381 ms]  <<<  URB 235 coming back  <<< 
-- URB_FUNCTION_BULK_OR_INTERRUPT_TRANSFER:
  PipeHandle           = 822e77f4 [endpoint 0x00000002]
  TransferFlags        = 00000000 (USBD_TRANSFER_DIRECTION_OUT, ~USBD_SHORT_TRANSFER_OK)
  TransferBufferLength = 00000007
  TransferBuffer       = 00000000
  TransferBufferMDL    = 822d87a0
  UrbLink              = 00000000
[684391 ms] UsbSnoop - DispatchAny(f890e610) : IRP_MJ_INTERNAL_DEVICE_CONTROL
[684391 ms] UsbSnoop - MyDispatchInternalIOCTL(f890fe80) : fdo=81b1aac0, Irp=81aef220, IRQL=2
[684391 ms]  >>>  URB 236 going down  >>> 
-- URB_FUNCTION_BULK_OR_INTERRUPT_TRANSFER:
  PipeHandle           = 822e77d4 [endpoint 0x00000081]
  TransferFlags        = 00000003 (USBD_TRANSFER_DIRECTION_IN, USBD_SHORT_TRANSFER_OK)
  TransferBufferLength = 00000100
  TransferBuffer       = 00000000
  TransferBufferMDL    = 822d87a0
  UrbLink              = 00000000
[684412 ms] UsbSnoop - MyInternalIOCTLCompletion(f890fdb0) : fido=81b19728, Irp=81aef220, Context=822f29c8, IRQL=2
[684412 ms]  <<<  URB 236 coming back  <<< 
-- URB_FUNCTION_BULK_OR_INTERRUPT_TRANSFER:
  PipeHandle           = 822e77d4 [endpoint 0x00000081]
  TransferFlags        = 00000003 (USBD_TRANSFER_DIRECTION_IN, USBD_SHORT_TRANSFER_OK)
  TransferBufferLength = 000000ff
  TransferBuffer       = 00000000
  TransferBufferMDL    = 822d87a0
    00000000: 00 00 00 fa 03 43 4f 4e 4e 45 43 54 49 4f 4e 3a
    00000010: 2a 3f de 2a 50 4c 45 41 53 45 29 57 41 49 54 3a
    00000020: 3a 3a 3a 2a 3f 08 31 2b 30 09 04 5d 00 3f e7 5d
    00000030: 00 11 3f 08 30 09 04 5d 01 3f d6 4d 3f 08 37 09
    00000040: 04 5d 00 3f e7 5d 00 11 3f e8 5d 01 11 3f ce b5
    00000050: 5d 01 11 6a 31 40 5d 01 10 31 11 6a 30 3f cf 3f
    00000060: e1 3f de 2a 82 82 82 4c 49 4e 4b 29 45 52 52 4f
    00000070: 52 82 82 82 2a 3f de 2a 50 55 53 48 29 49 4e 29
    00000080: 54 48 45 29 4c 49 4e 4b 2a 3f de 2a 43 4f 52 44
    00000090: 29 43 4f 4e 4e 45 43 54 4f 52 53 2a 3f de 2a 46
    000000a0: 49 52 4d 4c 59 29 54 48 45 4e 29 48 49 54 2a 3f
    000000b0: de 2a 06 45 4e 54 45 52 07 3a 2a 3f d8 3f d7 4d
    000000c0: 3f d4 3f de 2a 2a 3f e0 36 2b 31 2b 2a 29 29 53
    000000d0: 54 41 54 55 53 3e 29 4f 3a 4b 3a 2a 3f e0 38 2b
    000000e0: 31 30 2b 2a 06 45 4e 54 45 52 07 2a 11 3f d8 3f
    000000f0: 76 3f e1 3f 85 3f 7e 08 3f fa 5d 01 2b 5d 04
  UrbLink              = 00000000
[684451 ms] UsbSnoop - DispatchAny(f890e610) : IRP_MJ_INTERNAL_DEVICE_CONTROL
[684451 ms] UsbSnoop - MyDispatchInternalIOCTL(f890fe80) : fdo=81b1aac0, Irp=81aef220, IRQL=2
[684451 ms]  >>>  URB 237 going down  >>> 
-- URB_FUNCTION_BULK_OR_INTERRUPT_TRANSFER:
  PipeHandle           = 822e77f4 [endpoint 0x00000002]
  TransferFlags        = 00000000 (USBD_TRANSFER_DIRECTION_OUT, ~USBD_SHORT_TRANSFER_OK)
  TransferBufferLength = 00000007
  TransferBuffer       = 00000000
  TransferBufferMDL    = 822d87a0
    00000000: 00 00 00 02 05 e0 00
  UrbLink              = 00000000
[684451 ms] UsbSnoop - MyInternalIOCTLCompletion(f890fdb0) : fido=81b19728, Irp=81aef220, Context=81cd51b0, IRQL=2
[684451 ms]  <<<  URB 237 coming back  <<< 
-- URB_FUNCTION_BULK_OR_INTERRUPT_TRANSFER:
  PipeHandle           = 822e77f4 [endpoint 0x00000002]
  TransferFlags        = 00000000 (USBD_TRANSFER_DIRECTION_OUT, ~USBD_SHORT_TRANSFER_OK)
  TransferBufferLength = 00000007
  TransferBuffer       = 00000000
  TransferBufferMDL    = 822d87a0
  UrbLink              = 00000000
[684461 ms] UsbSnoop - DispatchAny(f890e610) : IRP_MJ_INTERNAL_DEVICE_CONTROL
[684461 ms] UsbSnoop - MyDispatchInternalIOCTL(f890fe80) : fdo=81b1aac0, Irp=81aef220, IRQL=2
[684461 ms]  >>>  URB 238 going down  >>> 
-- URB_FUNCTION_BULK_OR_INTERRUPT_TRANSFER:
  PipeHandle           = 822e77d4 [endpoint 0x00000081]
  TransferFlags        = 00000003 (USBD_TRANSFER_DIRECTION_IN, USBD_SHORT_TRANSFER_OK)
  TransferBufferLength = 00000100
  TransferBuffer       = 00000000
  TransferBufferMDL    = 822d87a0
  UrbLink              = 00000000
[684482 ms] UsbSnoop - MyInternalIOCTLCompletion(f890fdb0) : fido=81b19728, Irp=81aef220, Context=81b05970, IRQL=2
[684483 ms]  <<<  URB 238 coming back  <<< 
-- URB_FUNCTION_BULK_OR_INTERRUPT_TRANSFER:
  PipeHandle           = 822e77d4 [endpoint 0x00000081]
  TransferFlags        = 00000003 (USBD_TRANSFER_DIRECTION_IN, USBD_SHORT_TRANSFER_OK)
  TransferBufferLength = 000000ff
  TransferBuffer       = 00000000
  TransferBufferMDL    = 822d87a0
    00000000: 00 00 00 fa 03 3f e1 3f ea 3f fa 5d 03 3f 08 31
    00000010: 2b 30 09 04 5d 00 3f e7 5d 00 11 3f 08 36 2b 30
    00000020: 09 04 5d 00 3f e7 5d 00 11 3f d6 59 3f e1 3f de
    00000030: 2a 45 4e 54 45 52 29 43 48 41 4e 4e 45 4c 2a 3f
    00000040: de 2a 31 2b 32 29 4f 52 29 33 2a 3f dc 43 3f ce
    00000050: 43 6f 31 40 43 6f 32 40 43 6f 33 3f d7 59 3f 08
    00000060: 31 2b 43 2b 31 09 04 5d 00 3f e7 5d 00 11 3f d6
    00000070: 57 3f e1 3f de 2a 48 4f 57 29 4d 41 4e 59 29 50
    00000080: 4f 49 4e 54 53 af 2a 3f dc 4a 3f ce 4a 6b 32 3c
    00000090: 4a 6f b1 4a 11 3f d7 57 3f 08 33 2b 3a 32 35 2b
    000000a0: 31 2b 31 09 04 5d 00 3f e7 5d 00 11 3f e1 3f de
    000000b0: 2a 49 46 29 55 53 49 4e 47 29 54 48 45 29 50 48
    000000c0: 2a 3f de 2a 50 52 4f 42 45 29 50 4c 45 41 53 45
    000000d0: 2a 3f de 2a 41 4c 4c 4f 57 29 54 48 45 29 53 59
    000000e0: 53 54 45 4d 2a 3f de 2a 33 30 29 53 45 43 4f 4e
    000000f0: 44 53 29 54 4f 2a 3f de 2a 57 41 52 4d 29 55
  UrbLink              = 00000000
[684511 ms] UsbSnoop - DispatchAny(f890e610) : IRP_MJ_INTERNAL_DEVICE_CONTROL
[684511 ms] UsbSnoop - MyDispatchInternalIOCTL(f890fe80) : fdo=81b1aac0, Irp=81aef220, IRQL=2
[684511 ms]  >>>  URB 239 going down  >>> 
-- URB_FUNCTION_BULK_OR_INTERRUPT_TRANSFER:
  PipeHandle           = 822e77f4 [endpoint 0x00000002]
  TransferFlags        = 00000000 (USBD_TRANSFER_DIRECTION_OUT, ~USBD_SHORT_TRANSFER_OK)
  TransferBufferLength = 00000007
  TransferBuffer       = 00000000
  TransferBufferMDL    = 822d87a0
    00000000: 00 00 00 02 05 e0 00
  UrbLink              = 00000000
[684511 ms] UsbSnoop - MyInternalIOCTLCompletion(f890fdb0) : fido=81b19728, Irp=81aef220, Context=822f29c8, IRQL=2
[684511 ms]  <<<  URB 239 coming back  <<< 
-- URB_FUNCTION_BULK_OR_INTERRUPT_TRANSFER:
  PipeHandle           = 822e77f4 [endpoint 0x00000002]
  TransferFlags        = 00000000 (USBD_TRANSFER_DIRECTION_OUT, ~USBD_SHORT_TRANSFER_OK)
  TransferBufferLength = 00000007
  TransferBuffer       = 00000000
  TransferBufferMDL    = 822d87a0
  UrbLink              = 00000000
[684521 ms] UsbSnoop - DispatchAny(f890e610) : IRP_MJ_INTERNAL_DEVICE_CONTROL
[684521 ms] UsbSnoop - MyDispatchInternalIOCTL(f890fe80) : fdo=81b1aac0, Irp=81aef220, IRQL=2
[684521 ms]  >>>  URB 240 going down  >>> 
-- URB_FUNCTION_BULK_OR_INTERRUPT_TRANSFER:
  PipeHandle           = 822e77d4 [endpoint 0x00000081]
  TransferFlags        = 00000003 (USBD_TRANSFER_DIRECTION_IN, USBD_SHORT_TRANSFER_OK)
  TransferBufferLength = 00000100
  TransferBuffer       = 00000000
  TransferBufferMDL    = 822d87a0
  UrbLink              = 00000000
[684543 ms] UsbSnoop - MyInternalIOCTLCompletion(f890fdb0) : fido=81b19728, Irp=81aef220, Context=81cd51b0, IRQL=2
[684543 ms]  <<<  URB 240 coming back  <<< 
-- URB_FUNCTION_BULK_OR_INTERRUPT_TRANSFER:
  PipeHandle           = 822e77d4 [endpoint 0x00000081]
  TransferFlags        = 00000003 (USBD_TRANSFER_DIRECTION_IN, USBD_SHORT_TRANSFER_OK)
  TransferBufferLength = 000000ff
  TransferBuffer       = 00000000
  TransferBufferMDL    = 822d87a0
    00000000: 00 00 00 fa 03 50 3a 2a 3f e0 37 2b 31 30 2b 2a
    00000010: 06 45 4e 54 45 52 07 2a 11 3f 4a 04 b5 5d 01 11
    00000020: 3f 4a 04 b5 5d 02 11 3f d8 3f e1 3f 85 3f d3 49
    00000030: 2b 31 2b 4a 2b 31 11 3f e1 3f de 2a 57 48 45 4e
    00000040: 29 52 45 41 44 49 4e 47 2a 3f de 2a 53 54 45 41
    00000050: 44 59 2b 29 50 52 45 53 53 2a 3f de 2a 54 52 49
    00000060: 47 47 45 52 29 4f 4e 29 43 42 4c 3a 2a 3f 08 33
    00000070: 2b 3a 32 35 2b 31 2b 31 09 04 5d 00 3f e7 5d 00
    00000080: 11 3f e8 5d 02 10 49 11 11 3f de 2a 45 4e 54 45
    00000090: 52 29 52 45 41 44 49 4e 47 3e 2a 3f dc 52 3f 52
    000000a0: 04 5d 01 10 49 11 3f d4 3f ff 5d 02 2b 5d 01 3f
    000000b0: 08 34 2b 43 2b 31 2b 31 2b 62 17 2b 62 16 09 04
    000000c0: 5d 00 3f e7 5d 00 11 3f de 2a 43 41 4c 49 42 52
    000000d0: 41 54 49 4f 4e 29 44 4f 4e 45 2a 3f de 2a 4b 30
    000000e0: 3e 29 2a 2b 62 17 3f de 2a 4b 31 3e 29 2a 2b 62
    000000f0: 16 3f d8 3f 43 4c 41 55 53 49 55 53 00 8e 03
  UrbLink              = 00000000
[684582 ms] UsbSnoop - DispatchAny(f890e610) : IRP_MJ_INTERNAL_DEVICE_CONTROL
[684582 ms] UsbSnoop - MyDispatchInternalIOCTL(f890fe80) : fdo=81b1aac0, Irp=81aef220, IRQL=2
[684582 ms]  >>>  URB 241 going down  >>> 
-- URB_FUNCTION_BULK_OR_INTERRUPT_TRANSFER:
  PipeHandle           = 822e77f4 [endpoint 0x00000002]
  TransferFlags        = 00000000 (USBD_TRANSFER_DIRECTION_OUT, ~USBD_SHORT_TRANSFER_OK)
  TransferBufferLength = 00000007
  TransferBuffer       = 00000000
  TransferBufferMDL    = 822d87a0
    00000000: 00 00 00 02 05 e0 00
  UrbLink              = 00000000
[684582 ms] UsbSnoop - MyInternalIOCTLCompletion(f890fdb0) : fido=81b19728, Irp=81aef220, Context=81b05970, IRQL=2
[684582 ms]  <<<  URB 241 coming back  <<< 
-- URB_FUNCTION_BULK_OR_INTERRUPT_TRANSFER:
  PipeHandle           = 822e77f4 [endpoint 0x00000002]
  TransferFlags        = 00000000 (USBD_TRANSFER_DIRECTION_OUT, ~USBD_SHORT_TRANSFER_OK)
  TransferBufferLength = 00000007
  TransferBuffer       = 00000000
  TransferBufferMDL    = 822d87a0
  UrbLink              = 00000000
[684591 ms] UsbSnoop - DispatchAny(f890e610) : IRP_MJ_INTERNAL_DEVICE_CONTROL
[684591 ms] UsbSnoop - MyDispatchInternalIOCTL(f890fe80) : fdo=81b1aac0, Irp=81aef220, IRQL=2
[684591 ms]  >>>  URB 242 going down  >>> 
-- URB_FUNCTION_BULK_OR_INTERRUPT_TRANSFER:
  PipeHandle           = 822e77d4 [endpoint 0x00000081]
  TransferFlags        = 00000003 (USBD_TRANSFER_DIRECTION_IN, USBD_SHORT_TRANSFER_OK)
  TransferBufferLength = 00000100
  TransferBuffer       = 00000000
  TransferBufferMDL    = 822d87a0
  UrbLink              = 00000000
[684613 ms] UsbSnoop - MyInternalIOCTLCompletion(f890fdb0) : fido=81b19728, Irp=81aef220, Context=81cd51b0, IRQL=2
[684613 ms]  <<<  URB 242 coming back  <<< 
-- URB_FUNCTION_BULK_OR_INTERRUPT_TRANSFER:
  PipeHandle           = 822e77d4 [endpoint 0x00000081]
  TransferFlags        = 00000003 (USBD_TRANSFER_DIRECTION_IN, USBD_SHORT_TRANSFER_OK)
  TransferBufferLength = 000000ff
  TransferBuffer       = 00000000
  TransferBufferMDL    = 822d87a0
    00000000: 00 00 00 fa 03 08 36 2b 30 09 04 5d 00 3e e7 5d
    00000010: 00 11 3f 31 04 63 0c 3e 32 04 63 0d 3e 31 04 63
    00000020: 0a 3e 32 04 63 0b 3f 7e 0b 3f 7e 09 3f 7e 0d 3f
    00000030: ea 3f 97 3f 85 3f 93 31 2b 31 36 2b 2a 54 45 58
    00000040: 41 53 29 29 49 4e 53 54 52 55 4d 45 4e 54 53 2a
    00000050: 11 3f 93 38 2b 33 30 2b 2a 43 42 4c 29 29 29 53
    00000060: 59 53 54 45 4d 2a 11 3f 93 31 35 2b 31 30 2b 2a
    00000070: 45 58 50 45 52 49 4d 45 4e 54 29 29 29 57 4f 52
    00000080: 4b 42 4f 4f 4b 2a 11 3f 93 32 39 2b 32 36 2b 2a
    00000090: 43 4c 41 55 53 49 55 53 29 29 29 56 32 3a 30 2a
    000000a0: 11 3f 93 33 36 2b 32 30 2b 2a 10 45 58 50 45 52
    000000b0: 49 4d 45 4e 54 29 29 29 43 36 11 2a 11 3f 93 35
    000000c0: 30 2b 31 39 2b 2a 50 52 45 53 53 29 29 29 06 45
    000000d0: 4e 54 45 52 07 29 29 29 4f 4e 2a 3f 93 35 37 2b
    000000e0: 32 38 2b 2a 54 49 71 38 33 29 29 29 50 4c 55 53
    000000f0: 2a 3f d8 3f e1 3f de 2a 54 55 52 4e 29 4f 4e
  UrbLink              = 00000000
[684651 ms] UsbSnoop - DispatchAny(f890e610) : IRP_MJ_INTERNAL_DEVICE_CONTROL
[684651 ms] UsbSnoop - MyDispatchInternalIOCTL(f890fe80) : fdo=81b1aac0, Irp=81aef220, IRQL=2
[684651 ms]  >>>  URB 243 going down  >>> 
-- URB_FUNCTION_BULK_OR_INTERRUPT_TRANSFER:
  PipeHandle           = 822e77f4 [endpoint 0x00000002]
  TransferFlags        = 00000000 (USBD_TRANSFER_DIRECTION_OUT, ~USBD_SHORT_TRANSFER_OK)
  TransferBufferLength = 00000007
  TransferBuffer       = 00000000
  TransferBufferMDL    = 822d87a0
    00000000: 00 00 00 02 05 e0 00
  UrbLink              = 00000000
[684652 ms] UsbSnoop - MyInternalIOCTLCompletion(f890fdb0) : fido=81b19728, Irp=81aef220, Context=82307cb8, IRQL=2
[684652 ms]  <<<  URB 243 coming back  <<< 
-- URB_FUNCTION_BULK_OR_INTERRUPT_TRANSFER:
  PipeHandle           = 822e77f4 [endpoint 0x00000002]
  TransferFlags        = 00000000 (USBD_TRANSFER_DIRECTION_OUT, ~USBD_SHORT_TRANSFER_OK)
  TransferBufferLength = 00000007
  TransferBuffer       = 00000000
  TransferBufferMDL    = 822d87a0
  UrbLink              = 00000000
[684661 ms] UsbSnoop - DispatchAny(f890e610) : IRP_MJ_INTERNAL_DEVICE_CONTROL
[684661 ms] UsbSnoop - MyDispatchInternalIOCTL(f890fe80) : fdo=81b1aac0, Irp=81aef220, IRQL=2
[684661 ms]  >>>  URB 244 going down  >>> 
-- URB_FUNCTION_BULK_OR_INTERRUPT_TRANSFER:
  PipeHandle           = 822e77d4 [endpoint 0x00000081]
  TransferFlags        = 00000003 (USBD_TRANSFER_DIRECTION_IN, USBD_SHORT_TRANSFER_OK)
  TransferBufferLength = 00000100
  TransferBuffer       = 00000000
  TransferBufferMDL    = 822d87a0
  UrbLink              = 00000000
[684683 ms] UsbSnoop - MyInternalIOCTLCompletion(f890fdb0) : fido=81b19728, Irp=81aef220, Context=822db980, IRQL=2
[684683 ms]  <<<  URB 244 coming back  <<< 
-- URB_FUNCTION_BULK_OR_INTERRUPT_TRANSFER:
  PipeHandle           = 822e77d4 [endpoint 0x00000081]
  TransferFlags        = 00000003 (USBD_TRANSFER_DIRECTION_IN, USBD_SHORT_TRANSFER_OK)
  TransferBufferLength = 000000ff
  TransferBuffer       = 00000000
  TransferBufferMDL    = 822d87a0
    00000000: 00 00 00 fa 03 29 54 48 45 29 43 42 4c 3a 2a 3f
    00000010: e0 34 2b 31 30 2b 2a 06 45 4e 54 45 52 07 2a 11
    00000020: 3f d8 3f 75 3f e1 3f de 2a 4e 4f 57 29 43 48 45
    00000030: 43 4b 49 4e 47 29 54 48 45 2a 3f de 2a 43 41 4c
    00000040: 43 55 4c 41 54 4f 52 71 43 42 4c 2a 3f de 2a 4c
    00000050: 49 4e 4b 29 43 4f 4e 4e 45 43 54 49 4f 4e 3a 2a
    00000060: 3f de 2a 50 4c 45 41 53 45 29 57 41 49 54 3a 3a
    00000070: 3a 3a 2a 3f 08 31 2b 30 09 04 5d 00 3f e7 5d 00
    00000080: 11 3f 08 30 09 04 5d 01 3f d6 4d 3f 08 37 09 04
    00000090: 5d 00 3f e7 5d 00 11 3f e8 5d 01 11 3f ce b5 5d
    000000a0: 01 11 6a 31 40 5d 01 10 31 11 6a 30 3f cf 3f e1
    000000b0: 3f de 2a 82 82 82 4c 49 4e 4b 29 45 52 52 4f 52
    000000c0: 82 82 82 2a 3f de 2a 50 55 53 48 29 49 4e 29 54
    000000d0: 48 45 29 4c 49 4e 4b 2a 3f de 2a 43 4f 52 44 29
    000000e0: 43 4f 4e 4e 45 43 54 4f 52 53 2a 3f de 2a 46 49
    000000f0: 52 4d 4c 59 29 54 48 45 4e 29 48 49 54 2a 3f
  UrbLink              = 00000000
[684712 ms] UsbSnoop - DispatchAny(f890e610) : IRP_MJ_INTERNAL_DEVICE_CONTROL
[684712 ms] UsbSnoop - MyDispatchInternalIOCTL(f890fe80) : fdo=81b1aac0, Irp=81aef220, IRQL=2
[684712 ms]  >>>  URB 245 going down  >>> 
-- URB_FUNCTION_BULK_OR_INTERRUPT_TRANSFER:
  PipeHandle           = 822e77f4 [endpoint 0x00000002]
  TransferFlags        = 00000000 (USBD_TRANSFER_DIRECTION_OUT, ~USBD_SHORT_TRANSFER_OK)
  TransferBufferLength = 00000007
  TransferBuffer       = 00000000
  TransferBufferMDL    = 822d87a0
    00000000: 00 00 00 02 05 e0 00
  UrbLink              = 00000000
[684712 ms] UsbSnoop - MyInternalIOCTLCompletion(f890fdb0) : fido=81b19728, Irp=81aef220, Context=81cd51b0, IRQL=2
[684712 ms]  <<<  URB 245 coming back  <<< 
-- URB_FUNCTION_BULK_OR_INTERRUPT_TRANSFER:
  PipeHandle           = 822e77f4 [endpoint 0x00000002]
  TransferFlags        = 00000000 (USBD_TRANSFER_DIRECTION_OUT, ~USBD_SHORT_TRANSFER_OK)
  TransferBufferLength = 00000007
  TransferBuffer       = 00000000
  TransferBufferMDL    = 822d87a0
  UrbLink              = 00000000
[684722 ms] UsbSnoop - DispatchAny(f890e610) : IRP_MJ_INTERNAL_DEVICE_CONTROL
[684722 ms] UsbSnoop - MyDispatchInternalIOCTL(f890fe80) : fdo=81b1aac0, Irp=81aef220, IRQL=2
[684722 ms]  >>>  URB 246 going down  >>> 
-- URB_FUNCTION_BULK_OR_INTERRUPT_TRANSFER:
  PipeHandle           = 822e77d4 [endpoint 0x00000081]
  TransferFlags        = 00000003 (USBD_TRANSFER_DIRECTION_IN, USBD_SHORT_TRANSFER_OK)
  TransferBufferLength = 00000100
  TransferBuffer       = 00000000
  TransferBufferMDL    = 822d87a0
  UrbLink              = 00000000
[684743 ms] UsbSnoop - MyInternalIOCTLCompletion(f890fdb0) : fido=81b19728, Irp=81aef220, Context=822db980, IRQL=2
[684743 ms]  <<<  URB 246 coming back  <<< 
-- URB_FUNCTION_BULK_OR_INTERRUPT_TRANSFER:
  PipeHandle           = 822e77d4 [endpoint 0x00000081]
  TransferFlags        = 00000003 (USBD_TRANSFER_DIRECTION_IN, USBD_SHORT_TRANSFER_OK)
  TransferBufferLength = 000000ff
  TransferBuffer       = 00000000
  TransferBufferMDL    = 822d87a0
    00000000: 00 00 00 fa 03 de 2a 06 45 4e 54 45 52 07 3a 2a
    00000010: 3f d8 3f d7 4d 3f d4 3f de 2a 2a 3f e0 36 2b 31
    00000020: 2b 2a 29 29 53 54 41 54 55 53 3e 29 4f 3a 4b 3a
    00000030: 2a 3f e0 38 2b 31 30 2b 2a 06 45 4e 54 45 52 07
    00000040: 2a 11 3f d8 3f 76 3f e1 3f 85 3f 7e 08 3f fa 5d
    00000050: 01 2b 5d 04 3f 30 04 63 0a 3f 31 30 04 63 0b 3f
    00000060: 31 04 63 02 3f 30 04 63 0c 3f 39 30 04 63 0d 3f
    00000070: 31 30 04 63 03 3f fa 5d 03 2b 5d 04 3f e1 3f 08
    00000080: 36 2b 30 09 04 5d 00 3f e7 5d 00 11 3f 08 31 2b
    00000090: 30 09 04 5d 00 3f e7 5d 00 11 3f 08 31 2b 31 2b
    000000a0: 31 09 04 5d 00 3f e7 5d 00 11 3f d6 57 3f 85 3f
    000000b0: e1 3f de 2a 45 4e 54 45 52 29 4e 55 4d 42 45 52
    000000c0: 2a 3f de 2a 4f 46 29 53 41 4d 50 4c 45 53 2a 3f
    000000d0: dc 43 3f ce 43 6b 32 3c 43 6f b1 43 11 3f d7 57
    000000e0: 3f 43 04 b5 5d 03 11 3f 43 04 b5 5d 04 11 3f e1
    000000f0: 3f 08 33 2b 30 2b b0 31 2b 36 09 04 5d 00 3f
  UrbLink              = 00000000
[684782 ms] UsbSnoop - DispatchAny(f890e610) : IRP_MJ_INTERNAL_DEVICE_CONTROL
[684782 ms] UsbSnoop - MyDispatchInternalIOCTL(f890fe80) : fdo=81b1aac0, Irp=81aef220, IRQL=2
[684782 ms]  >>>  URB 247 going down  >>> 
-- URB_FUNCTION_BULK_OR_INTERRUPT_TRANSFER:
  PipeHandle           = 822e77f4 [endpoint 0x00000002]
  TransferFlags        = 00000000 (USBD_TRANSFER_DIRECTION_OUT, ~USBD_SHORT_TRANSFER_OK)
  TransferBufferLength = 00000007
  TransferBuffer       = 00000000
  TransferBufferMDL    = 822d87a0
    00000000: 00 00 00 02 05 e0 00
  UrbLink              = 00000000
[684782 ms] UsbSnoop - MyInternalIOCTLCompletion(f890fdb0) : fido=81b19728, Irp=81aef220, Context=81b05970, IRQL=2
[684782 ms]  <<<  URB 247 coming back  <<< 
-- URB_FUNCTION_BULK_OR_INTERRUPT_TRANSFER:
  PipeHandle           = 822e77f4 [endpoint 0x00000002]
  TransferFlags        = 00000000 (USBD_TRANSFER_DIRECTION_OUT, ~USBD_SHORT_TRANSFER_OK)
  TransferBufferLength = 00000007
  TransferBuffer       = 00000000
  TransferBufferMDL    = 822d87a0
  UrbLink              = 00000000
[684792 ms] UsbSnoop - DispatchAny(f890e610) : IRP_MJ_INTERNAL_DEVICE_CONTROL
[684792 ms] UsbSnoop - MyDispatchInternalIOCTL(f890fe80) : fdo=81b1aac0, Irp=81aef220, IRQL=2
[684792 ms]  >>>  URB 248 going down  >>> 
-- URB_FUNCTION_BULK_OR_INTERRUPT_TRANSFER:
  PipeHandle           = 822e77d4 [endpoint 0x00000081]
  TransferFlags        = 00000003 (USBD_TRANSFER_DIRECTION_IN, USBD_SHORT_TRANSFER_OK)
  TransferBufferLength = 00000100
  TransferBuffer       = 00000000
  TransferBufferMDL    = 822d87a0
  UrbLink              = 00000000
[684813 ms] UsbSnoop - MyInternalIOCTLCompletion(f890fdb0) : fido=81b19728, Irp=81aef220, Context=822db980, IRQL=2
[684813 ms]  <<<  URB 248 coming back  <<< 
-- URB_FUNCTION_BULK_OR_INTERRUPT_TRANSFER:
  PipeHandle           = 822e77d4 [endpoint 0x00000081]
  TransferFlags        = 00000003 (USBD_TRANSFER_DIRECTION_IN, USBD_SHORT_TRANSFER_OK)
  TransferBufferLength = 000000ff
  TransferBuffer       = 00000000
  TransferBufferMDL    = 822d87a0
    00000000: 00 00 00 fa 03 e7 5d 00 11 3f de 2a 50 52 45 53
    00000010: 53 29 54 52 49 47 47 45 52 2a 3f de 2a 54 4f 29
    00000020: 43 4f 4c 4c 45 43 54 2a 3f de 2a 54 45 4d 50 45
    00000030: 52 41 54 55 52 45 29 44 41 54 41 2a 3f d3 49 2b
    00000040: 31 2b 43 2b 31 11 3f e8 5d 03 10 49 11 11 3f de
    00000050: 2a 4d 4c af 2a 3f dc 44 3f 44 04 5d 04 10 49 11
    00000060: 3f 9e 5d 04 10 49 11 2b 5d 03 10 49 11 11 3f d4
    00000070: 3f ec fd 2b 5d 04 2b 5d 03 2b 81 11 3f 93 36 2b
    00000080: 31 30 2b 2a 54 45 4d 50 10 43 11 2a 11 3f 93 35
    00000090: 31 2b 35 36 2b 2a 56 4f 4c 55 4d 45 10 4d 4c 11
    000000a0: 2a 11 3f 84 3f 43 4f 4c 4f 52 00 87 03 08 36 2b
    000000b0: 30 09 04 5d 00 3e e7 5d 00 11 3f 31 04 63 0c 3e
    000000c0: 32 04 63 0d 3e 31 04 63 0a 3e 32 04 63 0b 3f 7e
    000000d0: 0b 3f 7e 09 3f 7e 0d 3f ea 3f 97 3f 85 3f 93 31
    000000e0: 2b 31 36 2b 2a 54 45 58 41 53 29 29 49 4e 53 54
    000000f0: 52 55 4d 45 4e 54 53 2a 11 3f 93 38 2b 33 30
  UrbLink              = 00000000
[684852 ms] UsbSnoop - DispatchAny(f890e610) : IRP_MJ_INTERNAL_DEVICE_CONTROL
[684852 ms] UsbSnoop - MyDispatchInternalIOCTL(f890fe80) : fdo=81b1aac0, Irp=81aef220, IRQL=2
[684852 ms]  >>>  URB 249 going down  >>> 
-- URB_FUNCTION_BULK_OR_INTERRUPT_TRANSFER:
  PipeHandle           = 822e77f4 [endpoint 0x00000002]
  TransferFlags        = 00000000 (USBD_TRANSFER_DIRECTION_OUT, ~USBD_SHORT_TRANSFER_OK)
  TransferBufferLength = 00000007
  TransferBuffer       = 00000000
  TransferBufferMDL    = 822d87a0
    00000000: 00 00 00 02 05 e0 00
  UrbLink              = 00000000
[684852 ms] UsbSnoop - MyInternalIOCTLCompletion(f890fdb0) : fido=81b19728, Irp=81aef220, Context=81cd51b0, IRQL=2
[684852 ms]  <<<  URB 249 coming back  <<< 
-- URB_FUNCTION_BULK_OR_INTERRUPT_TRANSFER:
  PipeHandle           = 822e77f4 [endpoint 0x00000002]
  TransferFlags        = 00000000 (USBD_TRANSFER_DIRECTION_OUT, ~USBD_SHORT_TRANSFER_OK)
  TransferBufferLength = 00000007
  TransferBuffer       = 00000000
  TransferBufferMDL    = 822d87a0
  UrbLink              = 00000000
[684862 ms] UsbSnoop - DispatchAny(f890e610) : IRP_MJ_INTERNAL_DEVICE_CONTROL
[684862 ms] UsbSnoop - MyDispatchInternalIOCTL(f890fe80) : fdo=81b1aac0, Irp=81aef220, IRQL=2
[684862 ms]  >>>  URB 250 going down  >>> 
-- URB_FUNCTION_BULK_OR_INTERRUPT_TRANSFER:
  PipeHandle           = 822e77d4 [endpoint 0x00000081]
  TransferFlags        = 00000003 (USBD_TRANSFER_DIRECTION_IN, USBD_SHORT_TRANSFER_OK)
  TransferBufferLength = 00000100
  TransferBuffer       = 00000000
  TransferBufferMDL    = 822d87a0
  UrbLink              = 00000000
[684883 ms] UsbSnoop - MyInternalIOCTLCompletion(f890fdb0) : fido=81b19728, Irp=81aef220, Context=822db980, IRQL=2
[684883 ms]  <<<  URB 250 coming back  <<< 
-- URB_FUNCTION_BULK_OR_INTERRUPT_TRANSFER:
  PipeHandle           = 822e77d4 [endpoint 0x00000081]
  TransferFlags        = 00000003 (USBD_TRANSFER_DIRECTION_IN, USBD_SHORT_TRANSFER_OK)
  TransferBufferLength = 000000ff
  TransferBuffer       = 00000000
  TransferBufferMDL    = 822d87a0
    00000000: 00 00 00 fa 03 2b 2a 43 42 4c 29 29 29 53 59 53
    00000010: 54 45 4d 2a 11 3f 93 31 35 2b 31 30 2b 2a 45 58
    00000020: 50 45 52 49 4d 45 4e 54 29 29 29 57 4f 52 4b 42
    00000030: 4f 4f 4b 2a 11 3f 93 32 39 2b 33 30 2b 2a 43 4f
    00000040: 4c 4f 52 29 29 29 56 32 3a 30 2a 11 3f 93 33 36
    00000050: 2b 32 30 2b 2a 10 45 58 50 45 52 49 4d 45 4e 54
    00000060: 29 29 29 43 33 11 2a 11 3f 93 35 30 2b 38 2b 2a
    00000070: 43 41 4c 49 42 52 41 54 29 29 4d 55 53 54 29 29
    00000080: 42 45 29 29 52 55 4e 2a 3f 93 35 37 2b 38 2b 2a
    00000090: 42 45 46 4f 52 45 29 29 52 55 4e 4e 49 4e 47 29
    000000a0: 29 43 4f 4c 4f 52 2a 3f d8 3f e1 3f de 2a 54 55
    000000b0: 52 4e 29 4f 4e 29 54 48 45 29 43 42 4c 3a 2a 3f
    000000c0: e0 34 2b 31 30 2b 2a 06 45 4e 54 45 52 07 2a 11
    000000d0: 3f d8 3f 75 3f e1 3f de 2a 4e 4f 57 29 43 48 45
    000000e0: 43 4b 49 4e 47 29 54 48 45 2a 3f de 2a 43 41 4c
    000000f0: 43 55 4c 41 54 4f 52 71 43 42 4c 2a 3f de 2a
  UrbLink              = 00000000
[684912 ms] UsbSnoop - DispatchAny(f890e610) : IRP_MJ_INTERNAL_DEVICE_CONTROL
[684912 ms] UsbSnoop - MyDispatchInternalIOCTL(f890fe80) : fdo=81b1aac0, Irp=81aef220, IRQL=2
[684912 ms]  >>>  URB 251 going down  >>> 
-- URB_FUNCTION_BULK_OR_INTERRUPT_TRANSFER:
  PipeHandle           = 822e77f4 [endpoint 0x00000002]
  TransferFlags        = 00000000 (USBD_TRANSFER_DIRECTION_OUT, ~USBD_SHORT_TRANSFER_OK)
  TransferBufferLength = 00000007
  TransferBuffer       = 00000000
  TransferBufferMDL    = 822d87a0
    00000000: 00 00 00 02 05 e0 00
  UrbLink              = 00000000
[684912 ms] UsbSnoop - MyInternalIOCTLCompletion(f890fdb0) : fido=81b19728, Irp=81aef220, Context=81b05970, IRQL=2
[684912 ms]  <<<  URB 251 coming back  <<< 
-- URB_FUNCTION_BULK_OR_INTERRUPT_TRANSFER:
  PipeHandle           = 822e77f4 [endpoint 0x00000002]
  TransferFlags        = 00000000 (USBD_TRANSFER_DIRECTION_OUT, ~USBD_SHORT_TRANSFER_OK)
  TransferBufferLength = 00000007
  TransferBuffer       = 00000000
  TransferBufferMDL    = 822d87a0
  UrbLink              = 00000000
[684922 ms] UsbSnoop - DispatchAny(f890e610) : IRP_MJ_INTERNAL_DEVICE_CONTROL
[684922 ms] UsbSnoop - MyDispatchInternalIOCTL(f890fe80) : fdo=81b1aac0, Irp=81aef220, IRQL=2
[684922 ms]  >>>  URB 252 going down  >>> 
-- URB_FUNCTION_BULK_OR_INTERRUPT_TRANSFER:
  PipeHandle           = 822e77d4 [endpoint 0x00000081]
  TransferFlags        = 00000003 (USBD_TRANSFER_DIRECTION_IN, USBD_SHORT_TRANSFER_OK)
  TransferBufferLength = 00000100
  TransferBuffer       = 00000000
  TransferBufferMDL    = 822d87a0
  UrbLink              = 00000000
[684943 ms] UsbSnoop - MyInternalIOCTLCompletion(f890fdb0) : fido=81b19728, Irp=81aef220, Context=81b05970, IRQL=2
[684943 ms]  <<<  URB 252 coming back  <<< 
-- URB_FUNCTION_BULK_OR_INTERRUPT_TRANSFER:
  PipeHandle           = 822e77d4 [endpoint 0x00000081]
  TransferFlags        = 00000003 (USBD_TRANSFER_DIRECTION_IN, USBD_SHORT_TRANSFER_OK)
  TransferBufferLength = 000000ff
  TransferBuffer       = 00000000
  TransferBufferMDL    = 822d87a0
    00000000: 00 00 00 fa 03 4c 49 4e 4b 29 43 4f 4e 4e 45 43
    00000010: 54 49 4f 4e 3a 2a 3f de 2a 50 4c 45 41 53 45 29
    00000020: 57 41 49 54 3a 3a 3a 3a 2a 3f 08 31 2b 30 09 04
    00000030: 5d 00 3f e7 5d 00 11 3f 08 30 09 04 5d 01 3f d6
    00000040: 4d 3f 08 37 09 04 5d 00 3f e7 5d 00 11 3f e8 5d
    00000050: 01 11 3f ce b5 5d 01 11 6a 31 40 5d 01 10 31 11
    00000060: 6a 30 3f cf 3f e1 3f de 2a 82 82 82 4c 49 4e 4b
    00000070: 29 45 52 52 4f 52 82 82 82 2a 3f de 2a 50 55 53
    00000080: 48 29 49 4e 29 54 48 45 29 4c 49 4e 4b 2a 3f de
    00000090: 2a 43 4f 52 44 29 43 4f 4e 4e 45 43 54 4f 52 53
    000000a0: 2a 3f de 2a 46 49 52 4d 4c 59 29 54 48 45 4e 29
    000000b0: 48 49 54 2a 3f de 2a 06 45 4e 54 45 52 07 3a 2a
    000000c0: 3f d8 3f d7 4d 3f d4 3f de 2a 2a 3f e0 36 2b 31
    000000d0: 2b 2a 29 29 53 54 41 54 55 53 3e 29 4f 3a 4b 3a
    000000e0: 2a 3f e0 38 2b 31 30 2b 2a 06 45 4e 54 45 52 07
    000000f0: 2a 11 3f d8 3f 76 3f e1 3f 85 3f 7e 08 3f 30
  UrbLink              = 00000000
[684982 ms] UsbSnoop - DispatchAny(f890e610) : IRP_MJ_INTERNAL_DEVICE_CONTROL
[684982 ms] UsbSnoop - MyDispatchInternalIOCTL(f890fe80) : fdo=81b1aac0, Irp=81aef220, IRQL=2
[684982 ms]  >>>  URB 253 going down  >>> 
-- URB_FUNCTION_BULK_OR_INTERRUPT_TRANSFER:
  PipeHandle           = 822e77f4 [endpoint 0x00000002]
  TransferFlags        = 00000000 (USBD_TRANSFER_DIRECTION_OUT, ~USBD_SHORT_TRANSFER_OK)
  TransferBufferLength = 00000007
  TransferBuffer       = 00000000
  TransferBufferMDL    = 822d87a0
    00000000: 00 00 00 02 05 e0 00
  UrbLink              = 00000000
[684982 ms] UsbSnoop - MyInternalIOCTLCompletion(f890fdb0) : fido=81b19728, Irp=81aef220, Context=82307cb8, IRQL=2
[684982 ms]  <<<  URB 253 coming back  <<< 
-- URB_FUNCTION_BULK_OR_INTERRUPT_TRANSFER:
  PipeHandle           = 822e77f4 [endpoint 0x00000002]
  TransferFlags        = 00000000 (USBD_TRANSFER_DIRECTION_OUT, ~USBD_SHORT_TRANSFER_OK)
  TransferBufferLength = 00000007
  TransferBuffer       = 00000000
  TransferBufferMDL    = 822d87a0
  UrbLink              = 00000000
[684992 ms] UsbSnoop - DispatchAny(f890e610) : IRP_MJ_INTERNAL_DEVICE_CONTROL
[684992 ms] UsbSnoop - MyDispatchInternalIOCTL(f890fe80) : fdo=81b1aac0, Irp=822d9840, IRQL=2
[684992 ms]  >>>  URB 254 going down  >>> 
-- URB_FUNCTION_BULK_OR_INTERRUPT_TRANSFER:
  PipeHandle           = 822e77d4 [endpoint 0x00000081]
  TransferFlags        = 00000003 (USBD_TRANSFER_DIRECTION_IN, USBD_SHORT_TRANSFER_OK)
  TransferBufferLength = 00000100
  TransferBuffer       = 00000000
  TransferBufferMDL    = 822d87a0
  UrbLink              = 00000000
[685013 ms] UsbSnoop - MyInternalIOCTLCompletion(f890fdb0) : fido=81b19728, Irp=822d9840, Context=81b05970, IRQL=2
[685013 ms]  <<<  URB 254 coming back  <<< 
-- URB_FUNCTION_BULK_OR_INTERRUPT_TRANSFER:
  PipeHandle           = 822e77d4 [endpoint 0x00000081]
  TransferFlags        = 00000003 (USBD_TRANSFER_DIRECTION_IN, USBD_SHORT_TRANSFER_OK)
  TransferBufferLength = 000000ff
  TransferBuffer       = 00000000
  TransferBufferMDL    = 822d87a0
    00000000: 00 00 00 fa 03 04 63 0a 3f 37 04 63 0b 3f 31 04
    00000010: 63 02 3f 30 04 63 0c 3f 31 30 30 04 63 0d 3f 31
    00000020: 30 04 63 03 3f fa 5d 03 2b 5d 04 3f e1 3f 08 36
    00000030: 2b 30 09 04 5d 00 3f e7 5d 00 11 3f 08 31 2b 30
    00000040: 09 04 5d 00 3f e7 5d 00 11 3f 08 34 2b 31 2b 31
    00000050: 2b 31 2b 42 2b 41 09 04 5d 00 3f e7 5d 00 11 3f
    00000060: 08 31 2b 31 2b 31 2b 30 2b 30 2b 31 09 04 5d 00
    00000070: 3f e7 5d 00 11 3f 36 04 b5 5d 03 11 3f 85 3f e1
    00000080: 3f 08 33 2b 30 2b b0 31 2b 36 09 04 5d 00 3f e7
    00000090: 5d 00 11 3f de 2a 50 52 45 53 53 29 54 52 49 47
    000000a0: 47 45 52 2a 3f de 2a 54 4f 29 43 4f 4c 4c 45 43
    000000b0: 54 2a 3f de 2a 54 52 41 4e 53 4d 49 54 54 41 4e
    000000c0: 43 45 2a 3f de 2a 52 45 41 44 49 4e 47 53 2a 3f
    000000d0: d3 49 2b 31 2b 36 2b 31 11 3f e8 5d 03 10 49 11
    000000e0: 11 3f de 2a 53 41 4d 50 4c 45 29 4e 55 4d 42 45
    000000f0: 52 af 2a 3f dc 44 3f 44 04 5d 04 10 49 11 3f
  UrbLink              = 00000000
[685052 ms] UsbSnoop - DispatchAny(f890e610) : IRP_MJ_INTERNAL_DEVICE_CONTROL
[685052 ms] UsbSnoop - MyDispatchInternalIOCTL(f890fe80) : fdo=81b1aac0, Irp=822d9840, IRQL=2
[685052 ms]  >>>  URB 255 going down  >>> 
-- URB_FUNCTION_BULK_OR_INTERRUPT_TRANSFER:
  PipeHandle           = 822e77f4 [endpoint 0x00000002]
  TransferFlags        = 00000000 (USBD_TRANSFER_DIRECTION_OUT, ~USBD_SHORT_TRANSFER_OK)
  TransferBufferLength = 00000007
  TransferBuffer       = 00000000
  TransferBufferMDL    = 822d87a0
    00000000: 00 00 00 02 05 e0 00
  UrbLink              = 00000000
[685052 ms] UsbSnoop - MyInternalIOCTLCompletion(f890fdb0) : fido=81b19728, Irp=822d9840, Context=81cd51b0, IRQL=2
[685052 ms]  <<<  URB 255 coming back  <<< 
-- URB_FUNCTION_BULK_OR_INTERRUPT_TRANSFER:
  PipeHandle           = 822e77f4 [endpoint 0x00000002]
  TransferFlags        = 00000000 (USBD_TRANSFER_DIRECTION_OUT, ~USBD_SHORT_TRANSFER_OK)
  TransferBufferLength = 00000007
  TransferBuffer       = 00000000
  TransferBufferMDL    = 822d87a0
  UrbLink              = 00000000
[685062 ms] UsbSnoop - DispatchAny(f890e610) : IRP_MJ_INTERNAL_DEVICE_CONTROL
[685062 ms] UsbSnoop - MyDispatchInternalIOCTL(f890fe80) : fdo=81b1aac0, Irp=822d9840, IRQL=2
[685062 ms]  >>>  URB 256 going down  >>> 
-- URB_FUNCTION_BULK_OR_INTERRUPT_TRANSFER:
  PipeHandle           = 822e77d4 [endpoint 0x00000081]
  TransferFlags        = 00000003 (USBD_TRANSFER_DIRECTION_IN, USBD_SHORT_TRANSFER_OK)
  TransferBufferLength = 00000100
  TransferBuffer       = 00000000
  TransferBufferMDL    = 822d87a0
  UrbLink              = 00000000
[685083 ms] UsbSnoop - MyInternalIOCTLCompletion(f890fdb0) : fido=81b19728, Irp=822d9840, Context=81b05970, IRQL=2
[685083 ms]  <<<  URB 256 coming back  <<< 
-- URB_FUNCTION_BULK_OR_INTERRUPT_TRANSFER:
  PipeHandle           = 822e77d4 [endpoint 0x00000081]
  TransferFlags        = 00000003 (USBD_TRANSFER_DIRECTION_IN, USBD_SHORT_TRANSFER_OK)
  TransferBufferLength = 000000ff
  TransferBuffer       = 00000000
  TransferBufferMDL    = 822d87a0
    00000000: 00 00 00 fa 03 9e 5d 04 10 49 11 2b 5d 03 10 49
    00000010: 11 11 3f d4 3f ec fd 2b 5d 04 2b 5d 03 2b 81 11
    00000020: 3f 8f 3f 93 36 2b 34 2b 2a 50 45 52 43 29 54 52
    00000030: 41 4e 53 2a 11 3f 93 35 31 2b 36 32 2b 2a 53 41
    00000040: 4d 50 4c 45 29 4e 4f 2a 11 3f 84 3f 43 4f 4f 4c
    00000050: 54 45 4d 50 00 7b 03 08 36 2b 30 09 04 5d 00 3e
    00000060: e7 5d 00 11 3f 31 04 63 0c 3e 32 04 63 0d 3e 31
    00000070: 04 63 0a 3e 32 04 63 0b 3f 7e 0b 3f 7e 09 3f 7e
    00000080: 0d 3f ea 3f 97 3f 85 3f 93 31 2b 31 36 2b 2a 54
    00000090: 45 58 41 53 29 29 49 4e 53 54 52 55 4d 45 4e 54
    000000a0: 53 2a 11 3f 93 38 2b 33 30 2b 2a 43 42 4c 29 29
    000000b0: 29 53 59 53 54 45 4d 2a 11 3f 93 31 35 2b 31 30
    000000c0: 2b 2a 45 58 50 45 52 49 4d 45 4e 54 29 29 29 57
    000000d0: 4f 52 4b 42 4f 4f 4b 2a 11 3f 93 32 39 2b 32 34
    000000e0: 2b 2a 43 4f 4f 4c 54 45 4d 50 29 29 29 56 32 3a
    000000f0: 30 2a 11 3f 93 33 36 2b 31 38 2b 2a 10 45 58
  UrbLink              = 00000000
[685112 ms] UsbSnoop - DispatchAny(f890e610) : IRP_MJ_INTERNAL_DEVICE_CONTROL
[685112 ms] UsbSnoop - MyDispatchInternalIOCTL(f890fe80) : fdo=81b1aac0, Irp=822d9840, IRQL=2
[685112 ms]  >>>  URB 257 going down  >>> 
-- URB_FUNCTION_BULK_OR_INTERRUPT_TRANSFER:
  PipeHandle           = 822e77f4 [endpoint 0x00000002]
  TransferFlags        = 00000000 (USBD_TRANSFER_DIRECTION_OUT, ~USBD_SHORT_TRANSFER_OK)
  TransferBufferLength = 00000007
  TransferBuffer       = 00000000
  TransferBufferMDL    = 822d87a0
    00000000: 00 00 00 02 05 e0 00
  UrbLink              = 00000000
[685112 ms] UsbSnoop - MyInternalIOCTLCompletion(f890fdb0) : fido=81b19728, Irp=822d9840, Context=82307cb8, IRQL=2
[685112 ms]  <<<  URB 257 coming back  <<< 
-- URB_FUNCTION_BULK_OR_INTERRUPT_TRANSFER:
  PipeHandle           = 822e77f4 [endpoint 0x00000002]
  TransferFlags        = 00000000 (USBD_TRANSFER_DIRECTION_OUT, ~USBD_SHORT_TRANSFER_OK)
  TransferBufferLength = 00000007
  TransferBuffer       = 00000000
  TransferBufferMDL    = 822d87a0
  UrbLink              = 00000000
[685122 ms] UsbSnoop - DispatchAny(f890e610) : IRP_MJ_INTERNAL_DEVICE_CONTROL
[685122 ms] UsbSnoop - MyDispatchInternalIOCTL(f890fe80) : fdo=81b1aac0, Irp=822d9840, IRQL=2
[685122 ms]  >>>  URB 258 going down  >>> 
-- URB_FUNCTION_BULK_OR_INTERRUPT_TRANSFER:
  PipeHandle           = 822e77d4 [endpoint 0x00000081]
  TransferFlags        = 00000003 (USBD_TRANSFER_DIRECTION_IN, USBD_SHORT_TRANSFER_OK)
  TransferBufferLength = 00000100
  TransferBuffer       = 00000000
  TransferBufferMDL    = 822d87a0
  UrbLink              = 00000000
[685143 ms] UsbSnoop - MyInternalIOCTLCompletion(f890fdb0) : fido=81b19728, Irp=822d9840, Context=82307cb8, IRQL=2
[685143 ms]  <<<  URB 258 coming back  <<< 
-- URB_FUNCTION_BULK_OR_INTERRUPT_TRANSFER:
  PipeHandle           = 822e77d4 [endpoint 0x00000081]
  TransferFlags        = 00000003 (USBD_TRANSFER_DIRECTION_IN, USBD_SHORT_TRANSFER_OK)
  TransferBufferLength = 000000ff
  TransferBuffer       = 00000000
  TransferBufferMDL    = 822d87a0
    00000000: 00 00 00 fa 03 50 45 52 49 4d 45 4e 54 29 29 29
    00000010: 50 33 11 2a 11 3f 93 35 30 2b 31 39 2b 2a 50 52
    00000020: 45 53 53 29 29 29 06 45 4e 54 45 52 07 29 29 29
    00000030: 4f 4e 2a 3f 93 35 37 2b 32 38 2b 2a 54 49 71 38
    00000040: 33 29 29 29 50 4c 55 53 2a 3f d8 3f e1 3f de 2a
    00000050: 54 55 52 4e 29 4f 4e 29 54 48 45 29 43 42 4c 3a
    00000060: 2a 3f e0 34 2b 31 30 2b 2a 06 45 4e 54 45 52 07
    00000070: 2a 11 3f d8 3f 75 3f e1 3f de 2a 4e 4f 57 29 43
    00000080: 48 45 43 4b 49 4e 47 29 54 48 45 2a 3f de 2a 43
    00000090: 41 4c 43 55 4c 41 54 4f 52 71 43 42 4c 2a 3f de
    000000a0: 2a 4c 49 4e 4b 29 43 4f 4e 4e 45 43 54 49 4f 4e
    000000b0: 3a 2a 3f de 2a 50 4c 45 41 53 45 29 57 41 49 54
    000000c0: 3a 3a 3a 3a 2a 3f 08 31 2b 30 09 04 5d 00 3f e7
    000000d0: 5d 00 11 3f 08 30 09 04 5d 01 3f d6 4d 3f 08 37
    000000e0: 09 04 5d 00 3f e7 5d 00 11 3f e8 5d 01 11 3f ce
    000000f0: b5 5d 01 11 6a 31 40 5d 01 10 31 11 6a 30 3f
  UrbLink              = 00000000
[685182 ms] UsbSnoop - DispatchAny(f890e610) : IRP_MJ_INTERNAL_DEVICE_CONTROL
[685182 ms] UsbSnoop - MyDispatchInternalIOCTL(f890fe80) : fdo=81b1aac0, Irp=822d9840, IRQL=2
[685182 ms]  >>>  URB 259 going down  >>> 
-- URB_FUNCTION_BULK_OR_INTERRUPT_TRANSFER:
  PipeHandle           = 822e77f4 [endpoint 0x00000002]
  TransferFlags        = 00000000 (USBD_TRANSFER_DIRECTION_OUT, ~USBD_SHORT_TRANSFER_OK)
  TransferBufferLength = 00000007
  TransferBuffer       = 00000000
  TransferBufferMDL    = 822d87a0
    00000000: 00 00 00 02 05 e0 00
  UrbLink              = 00000000
[685183 ms] UsbSnoop - MyInternalIOCTLCompletion(f890fdb0) : fido=81b19728, Irp=822d9840, Context=822f29c8, IRQL=2
[685183 ms]  <<<  URB 259 coming back  <<< 
-- URB_FUNCTION_BULK_OR_INTERRUPT_TRANSFER:
  PipeHandle           = 822e77f4 [endpoint 0x00000002]
  TransferFlags        = 00000000 (USBD_TRANSFER_DIRECTION_OUT, ~USBD_SHORT_TRANSFER_OK)
  TransferBufferLength = 00000007
  TransferBuffer       = 00000000
  TransferBufferMDL    = 822d87a0
  UrbLink              = 00000000
[685192 ms] UsbSnoop - DispatchAny(f890e610) : IRP_MJ_INTERNAL_DEVICE_CONTROL
[685192 ms] UsbSnoop - MyDispatchInternalIOCTL(f890fe80) : fdo=81b1aac0, Irp=822d9840, IRQL=2
[685192 ms]  >>>  URB 260 going down  >>> 
-- URB_FUNCTION_BULK_OR_INTERRUPT_TRANSFER:
  PipeHandle           = 822e77d4 [endpoint 0x00000081]
  TransferFlags        = 00000003 (USBD_TRANSFER_DIRECTION_IN, USBD_SHORT_TRANSFER_OK)
  TransferBufferLength = 00000100
  TransferBuffer       = 00000000
  TransferBufferMDL    = 822d87a0
  UrbLink              = 00000000
[685214 ms] UsbSnoop - MyInternalIOCTLCompletion(f890fdb0) : fido=81b19728, Irp=822d9840, Context=82307cb8, IRQL=2
[685214 ms]  <<<  URB 260 coming back  <<< 
-- URB_FUNCTION_BULK_OR_INTERRUPT_TRANSFER:
  PipeHandle           = 822e77d4 [endpoint 0x00000081]
  TransferFlags        = 00000003 (USBD_TRANSFER_DIRECTION_IN, USBD_SHORT_TRANSFER_OK)
  TransferBufferLength = 000000ff
  TransferBuffer       = 00000000
  TransferBufferMDL    = 822d87a0
    00000000: 00 00 00 fa 03 cf 3f e1 3f de 2a 82 82 82 4c 49
    00000010: 4e 4b 29 45 52 52 4f 52 82 82 82 2a 3f de 2a 50
    00000020: 55 53 48 29 49 4e 29 54 48 45 29 4c 49 4e 4b 2a
    00000030: 3f de 2a 43 4f 52 44 29 43 4f 4e 4e 45 43 54 4f
    00000040: 52 53 2a 3f de 2a 46 49 52 4d 4c 59 29 54 48 45
    00000050: 4e 29 48 49 54 2a 3f de 2a 06 45 4e 54 45 52 07
    00000060: 3a 2a 3f d8 3f d7 4d 3f d4 3f de 2a 2a 3f e0 36
    00000070: 2b 31 2b 2a 29 29 53 54 41 54 55 53 3e 29 4f 3a
    00000080: 4b 3a 2a 3f e0 38 2b 31 30 2b 2a 06 45 4e 54 45
    00000090: 52 07 2a 11 3f d8 3f 76 3f e1 3f 85 3f 7e 08 3f
    000000a0: 30 04 63 0a 3f 39 39 04 63 0b 3f 31 30 04 63 02
    000000b0: 3f b0 32 30 04 63 0c 3f 31 30 30 04 63 0d 3f 31
    000000c0: 30 04 63 03 3f fa 5d 01 2b 5d 03 3f e1 3f 08 36
    000000d0: 2b 30 09 04 5d 00 3f e7 5d 00 11 3f 08 31 2b 30
    000000e0: 09 04 5d 00 3f e7 5d 00 11 3f 08 31 2b 32 2b 31
    000000f0: 09 04 5d 00 3f e7 5d 00 11 3f 39 39 04 b5 5d
  UrbLink              = 00000000
[685252 ms] UsbSnoop - DispatchAny(f890e610) : IRP_MJ_INTERNAL_DEVICE_CONTROL
[685252 ms] UsbSnoop - MyDispatchInternalIOCTL(f890fe80) : fdo=81b1aac0, Irp=822d9840, IRQL=2
[685252 ms]  >>>  URB 261 going down  >>> 
-- URB_FUNCTION_BULK_OR_INTERRUPT_TRANSFER:
  PipeHandle           = 822e77f4 [endpoint 0x00000002]
  TransferFlags        = 00000000 (USBD_TRANSFER_DIRECTION_OUT, ~USBD_SHORT_TRANSFER_OK)
  TransferBufferLength = 00000007
  TransferBuffer       = 00000000
  TransferBufferMDL    = 822d87a0
    00000000: 00 00 00 02 05 e0 00
  UrbLink              = 00000000
[685253 ms] UsbSnoop - MyInternalIOCTLCompletion(f890fdb0) : fido=81b19728, Irp=822d9840, Context=82307cb8, IRQL=2
[685253 ms]  <<<  URB 261 coming back  <<< 
-- URB_FUNCTION_BULK_OR_INTERRUPT_TRANSFER:
  PipeHandle           = 822e77f4 [endpoint 0x00000002]
  TransferFlags        = 00000000 (USBD_TRANSFER_DIRECTION_OUT, ~USBD_SHORT_TRANSFER_OK)
  TransferBufferLength = 00000007
  TransferBuffer       = 00000000
  TransferBufferMDL    = 822d87a0
  UrbLink              = 00000000
[685262 ms] UsbSnoop - DispatchAny(f890e610) : IRP_MJ_INTERNAL_DEVICE_CONTROL
[685262 ms] UsbSnoop - MyDispatchInternalIOCTL(f890fe80) : fdo=81b1aac0, Irp=822d9840, IRQL=2
[685262 ms]  >>>  URB 262 going down  >>> 
-- URB_FUNCTION_BULK_OR_INTERRUPT_TRANSFER:
  PipeHandle           = 822e77d4 [endpoint 0x00000081]
  TransferFlags        = 00000003 (USBD_TRANSFER_DIRECTION_IN, USBD_SHORT_TRANSFER_OK)
  TransferBufferLength = 00000100
  TransferBuffer       = 00000000
  TransferBufferMDL    = 822d87a0
  UrbLink              = 00000000
[685284 ms] UsbSnoop - MyInternalIOCTLCompletion(f890fdb0) : fido=81b19728, Irp=822d9840, Context=822e2150, IRQL=2
[685284 ms]  <<<  URB 262 coming back  <<< 
-- URB_FUNCTION_BULK_OR_INTERRUPT_TRANSFER:
  PipeHandle           = 822e77d4 [endpoint 0x00000081]
  TransferFlags        = 00000003 (USBD_TRANSFER_DIRECTION_IN, USBD_SHORT_TRANSFER_OK)
  TransferBufferLength = 000000ff
  TransferBuffer       = 00000000
  TransferBufferMDL    = 822d87a0
    00000000: 00 00 00 fa 03 03 3f e1 3f de 2a 50 52 45 53 53
    00000010: 29 45 4e 54 45 52 29 54 4f 2a 3f de 2a 53 54 41
    00000020: 52 54 29 47 52 41 50 48 49 4e 47 2a 3f de 2a 54
    00000030: 45 4d 50 45 52 41 54 55 52 45 3a 2a 3f d8 3f 85
    00000040: 3f 93 36 2b 32 2b 2a 54 45 4d 50 10 43 11 2a 11
    00000050: 3e 93 34 34 2b 38 31 2b 2a 54 10 53 11 2a 11 3f
    00000060: 08 33 2b 31 2b b0 31 2b 30 09 04 5d 00 3f e7 5d
    00000070: 00 11 3f d3 49 2b 31 2b 39 39 2b 31 11 3f e8 5d
    00000080: 03 10 49 11 11 3f 9e 49 2b 5d 03 10 49 11 11 3f
    00000090: d4 3f 23 4e 2b 4e 2b 30 2b 39 38 2b 31 11 04 5d
    000000a0: 01 3f 30 04 63 0a 3f 19 5d 01 11 04 63 0b 3f 31
    000000b0: 30 04 63 02 3f ec fe 2b 5d 01 2b 5d 03 2b 81 11
    000000c0: 3f df 3f 93 36 2b 32 2b 2a 54 45 4d 50 10 43 11
    000000d0: 2a 11 3e 93 34 34 2b 38 31 2b 2a 54 10 53 11 2a
    000000e0: 11 3f 84 3f 44 45 46 41 55 4c 54 53 00 02 01 31
    000000f0: 04 63 0c 3e 32 04 63 0d 3e 31 04 63 0a 3e 32
  UrbLink              = 00000000
[685313 ms] UsbSnoop - DispatchAny(f890e610) : IRP_MJ_INTERNAL_DEVICE_CONTROL
[685313 ms] UsbSnoop - MyDispatchInternalIOCTL(f890fe80) : fdo=81b1aac0, Irp=822d9840, IRQL=2
[685313 ms]  >>>  URB 263 going down  >>> 
-- URB_FUNCTION_BULK_OR_INTERRUPT_TRANSFER:
  PipeHandle           = 822e77f4 [endpoint 0x00000002]
  TransferFlags        = 00000000 (USBD_TRANSFER_DIRECTION_OUT, ~USBD_SHORT_TRANSFER_OK)
  TransferBufferLength = 00000007
  TransferBuffer       = 00000000
  TransferBufferMDL    = 822d87a0
    00000000: 00 00 00 02 05 e0 00
  UrbLink              = 00000000
[685313 ms] UsbSnoop - MyInternalIOCTLCompletion(f890fdb0) : fido=81b19728, Irp=822d9840, Context=81b05970, IRQL=2
[685313 ms]  <<<  URB 263 coming back  <<< 
-- URB_FUNCTION_BULK_OR_INTERRUPT_TRANSFER:
  PipeHandle           = 822e77f4 [endpoint 0x00000002]
  TransferFlags        = 00000000 (USBD_TRANSFER_DIRECTION_OUT, ~USBD_SHORT_TRANSFER_OK)
  TransferBufferLength = 00000007
  TransferBuffer       = 00000000
  TransferBufferMDL    = 822d87a0
  UrbLink              = 00000000
[685323 ms] UsbSnoop - DispatchAny(f890e610) : IRP_MJ_INTERNAL_DEVICE_CONTROL
[685323 ms] UsbSnoop - MyDispatchInternalIOCTL(f890fe80) : fdo=81b1aac0, Irp=822d9840, IRQL=2
[685323 ms]  >>>  URB 264 going down  >>> 
-- URB_FUNCTION_BULK_OR_INTERRUPT_TRANSFER:
  PipeHandle           = 822e77d4 [endpoint 0x00000081]
  TransferFlags        = 00000003 (USBD_TRANSFER_DIRECTION_IN, USBD_SHORT_TRANSFER_OK)
  TransferBufferLength = 00000100
  TransferBuffer       = 00000000
  TransferBufferMDL    = 822d87a0
  UrbLink              = 00000000
[685344 ms] UsbSnoop - MyInternalIOCTLCompletion(f890fdb0) : fido=81b19728, Irp=822d9840, Context=822e2150, IRQL=2
[685344 ms]  <<<  URB 264 coming back  <<< 
-- URB_FUNCTION_BULK_OR_INTERRUPT_TRANSFER:
  PipeHandle           = 822e77d4 [endpoint 0x00000081]
  TransferFlags        = 00000003 (USBD_TRANSFER_DIRECTION_IN, USBD_SHORT_TRANSFER_OK)
  TransferBufferLength = 000000ff
  TransferBuffer       = 00000000
  TransferBufferMDL    = 822d87a0
    00000000: 00 00 00 fa 03 04 63 0b 3f 7e 0b 3f 7e 09 3f 7e
    00000010: 0d 3f ea 3f 97 3f 85 3f 93 31 2b 31 36 2b 2a 54
    00000020: 45 58 41 53 29 29 49 4e 53 54 52 55 4d 45 4e 54
    00000030: 53 2a 11 3f 93 38 2b 33 30 2b 2a 43 42 4c 29 29
    00000040: 29 53 59 53 54 45 4d 2a 11 3f 93 31 35 2b 31 30
    00000050: 2b 2a 45 58 50 45 52 49 4d 45 4e 54 29 29 29 57
    00000060: 4f 52 4b 42 4f 4f 4b 2a 11 3f 93 32 39 2b 32 38
    00000070: 2b 2a 44 45 46 41 55 4c 54 53 29 29 29 56 32 3a
    00000080: 30 2a 11 3f 93 35 30 2b 31 39 2b 2a 50 52 45 53
    00000090: 53 29 29 29 06 45 4e 54 45 52 07 29 29 29 4f 4e
    000000a0: 2a 3f 93 35 37 2b 32 38 2b 2a 54 49 71 38 33 29
    000000b0: 29 29 50 4c 55 53 2a 3f d8 3f e1 3f 66 3f 69 3f
    000000c0: 64 3f 76 3f 7e 06 3f 7e 00 3f 75 3f 7e 03 3f 7e
    000000d0: 04 3f 7e 0b 3f 7e 08 3f 7e 0d 3f ea 3f 97 3f 86
    000000e0: 3f 85 3f e1 3f de 2a 44 45 46 41 55 4c 54 53 29
    000000f0: 53 45 54 2a 3f d8 3f 44 54 4d 41 54 43 48 00
  UrbLink              = 00000000
[685383 ms] UsbSnoop - DispatchAny(f890e610) : IRP_MJ_INTERNAL_DEVICE_CONTROL
[685383 ms] UsbSnoop - MyDispatchInternalIOCTL(f890fe80) : fdo=81b1aac0, Irp=822d9840, IRQL=2
[685383 ms]  >>>  URB 265 going down  >>> 
-- URB_FUNCTION_BULK_OR_INTERRUPT_TRANSFER:
  PipeHandle           = 822e77f4 [endpoint 0x00000002]
  TransferFlags        = 00000000 (USBD_TRANSFER_DIRECTION_OUT, ~USBD_SHORT_TRANSFER_OK)
  TransferBufferLength = 00000007
  TransferBuffer       = 00000000
  TransferBufferMDL    = 822d87a0
    00000000: 00 00 00 02 05 e0 00
  UrbLink              = 00000000
[685383 ms] UsbSnoop - MyInternalIOCTLCompletion(f890fdb0) : fido=81b19728, Irp=822d9840, Context=822db980, IRQL=2
[685383 ms]  <<<  URB 265 coming back  <<< 
-- URB_FUNCTION_BULK_OR_INTERRUPT_TRANSFER:
  PipeHandle           = 822e77f4 [endpoint 0x00000002]
  TransferFlags        = 00000000 (USBD_TRANSFER_DIRECTION_OUT, ~USBD_SHORT_TRANSFER_OK)
  TransferBufferLength = 00000007
  TransferBuffer       = 00000000
  TransferBufferMDL    = 822d87a0
  UrbLink              = 00000000
[685393 ms] UsbSnoop - DispatchAny(f890e610) : IRP_MJ_INTERNAL_DEVICE_CONTROL
[685393 ms] UsbSnoop - MyDispatchInternalIOCTL(f890fe80) : fdo=81b1aac0, Irp=822d9840, IRQL=2
[685393 ms]  >>>  URB 266 going down  >>> 
-- URB_FUNCTION_BULK_OR_INTERRUPT_TRANSFER:
  PipeHandle           = 822e77d4 [endpoint 0x00000081]
  TransferFlags        = 00000003 (USBD_TRANSFER_DIRECTION_IN, USBD_SHORT_TRANSFER_OK)
  TransferBufferLength = 00000100
  TransferBuffer       = 00000000
  TransferBufferMDL    = 822d87a0
  UrbLink              = 00000000
[685414 ms] UsbSnoop - MyInternalIOCTLCompletion(f890fdb0) : fido=81b19728, Irp=822d9840, Context=822e2150, IRQL=2
[685414 ms]  <<<  URB 266 coming back  <<< 
-- URB_FUNCTION_BULK_OR_INTERRUPT_TRANSFER:
  PipeHandle           = 822e77d4 [endpoint 0x00000081]
  TransferFlags        = 00000003 (USBD_TRANSFER_DIRECTION_IN, USBD_SHORT_TRANSFER_OK)
  TransferBufferLength = 000000ff
  TransferBuffer       = 00000000
  TransferBufferMDL    = 822d87a0
    00000000: 00 00 00 fa 03 d0 03 08 36 2b 30 09 04 5d 00 3e
    00000010: e7 5d 00 11 3f 31 04 63 0c 3e 32 04 63 0d 3e 31
    00000020: 04 63 0a 3e 32 04 63 0b 3f 7e 0b 3f 7e 09 3f 7e
    00000030: 0d 3f ea 3f 97 3f 85 3f 93 31 2b 31 36 2b 2a 54
    00000040: 45 58 41 53 29 29 49 4e 53 54 52 55 4d 45 4e 54
    00000050: 53 2a 11 3f 93 38 2b 33 30 2b 2a 43 42 4c 29 29
    00000060: 29 53 59 53 54 45 4d 2a 11 3f 93 31 35 2b 31 30
    00000070: 2b 2a 45 58 50 45 52 49 4d 45 4e 54 29 29 29 57
    00000080: 4f 52 4b 42 4f 4f 4b 2a 11 3f 93 32 39 2b 32 37
    00000090: 2b 2a 44 54 4d 41 54 43 48 29 29 29 56 32 3a 30
    000000a0: 2a 11 3f 93 33 36 2b 32 30 2b 2a 10 45 58 50 45
    000000b0: 52 49 4d 45 4e 54 29 29 29 4d 37 11 2a 11 3f 93
    000000c0: 35 30 2b 31 39 2b 2a 50 52 45 53 53 29 29 29 06
    000000d0: 45 4e 54 45 52 07 29 29 29 4f 4e 2a 3f 93 35 37
    000000e0: 2b 32 38 2b 2a 54 49 71 38 33 29 29 29 50 4c 55
    000000f0: 53 2a 3f d8 3f e1 3f de 2a 54 55 52 4e 29 4f
  UrbLink              = 00000000
[685453 ms] UsbSnoop - DispatchAny(f890e610) : IRP_MJ_INTERNAL_DEVICE_CONTROL
[685453 ms] UsbSnoop - MyDispatchInternalIOCTL(f890fe80) : fdo=81b1aac0, Irp=822d9840, IRQL=2
[685453 ms]  >>>  URB 267 going down  >>> 
-- URB_FUNCTION_BULK_OR_INTERRUPT_TRANSFER:
  PipeHandle           = 822e77f4 [endpoint 0x00000002]
  TransferFlags        = 00000000 (USBD_TRANSFER_DIRECTION_OUT, ~USBD_SHORT_TRANSFER_OK)
  TransferBufferLength = 00000007
  TransferBuffer       = 00000000
  TransferBufferMDL    = 822d87a0
    00000000: 00 00 00 02 05 e0 00
  UrbLink              = 00000000
[685453 ms] UsbSnoop - MyInternalIOCTLCompletion(f890fdb0) : fido=81b19728, Irp=822d9840, Context=81b05970, IRQL=2
[685453 ms]  <<<  URB 267 coming back  <<< 
-- URB_FUNCTION_BULK_OR_INTERRUPT_TRANSFER:
  PipeHandle           = 822e77f4 [endpoint 0x00000002]
  TransferFlags        = 00000000 (USBD_TRANSFER_DIRECTION_OUT, ~USBD_SHORT_TRANSFER_OK)
  TransferBufferLength = 00000007
  TransferBuffer       = 00000000
  TransferBufferMDL    = 822d87a0
  UrbLink              = 00000000
[685463 ms] UsbSnoop - DispatchAny(f890e610) : IRP_MJ_INTERNAL_DEVICE_CONTROL
[685463 ms] UsbSnoop - MyDispatchInternalIOCTL(f890fe80) : fdo=81b1aac0, Irp=822d9840, IRQL=2
[685463 ms]  >>>  URB 268 going down  >>> 
-- URB_FUNCTION_BULK_OR_INTERRUPT_TRANSFER:
  PipeHandle           = 822e77d4 [endpoint 0x00000081]
  TransferFlags        = 00000003 (USBD_TRANSFER_DIRECTION_IN, USBD_SHORT_TRANSFER_OK)
  TransferBufferLength = 00000100
  TransferBuffer       = 00000000
  TransferBufferMDL    = 822d87a0
  UrbLink              = 00000000
[685484 ms] UsbSnoop - MyInternalIOCTLCompletion(f890fdb0) : fido=81b19728, Irp=822d9840, Context=822e2150, IRQL=2
[685484 ms]  <<<  URB 268 coming back  <<< 
-- URB_FUNCTION_BULK_OR_INTERRUPT_TRANSFER:
  PipeHandle           = 822e77d4 [endpoint 0x00000081]
  TransferFlags        = 00000003 (USBD_TRANSFER_DIRECTION_IN, USBD_SHORT_TRANSFER_OK)
  TransferBufferLength = 000000ff
  TransferBuffer       = 00000000
  TransferBufferMDL    = 822d87a0
    00000000: 00 00 00 fa 03 4e 29 54 48 45 29 43 42 4c 3a 2a
    00000010: 3f e0 34 2b 31 30 2b 2a 06 45 4e 54 45 52 07 2a
    00000020: 11 3f d8 3f 75 3f e1 3f de 2a 4e 4f 57 29 43 48
    00000030: 45 43 4b 49 4e 47 29 54 48 45 2a 3f de 2a 43 41
    00000040: 4c 43 55 4c 41 54 4f 52 71 43 42 4c 2a 3f de 2a
    00000050: 4c 49 4e 4b 29 43 4f 4e 4e 45 43 54 49 4f 4e 3a
    00000060: 2a 3f de 2a 50 4c 45 41 53 45 29 57 41 49 54 3a
    00000070: 3a 3a 3a 2a 3f 08 31 2b 30 09 04 5d 00 3f e7 5d
    00000080: 00 11 3f 08 30 09 04 5d 01 3f d6 4d 3f 08 37 09
    00000090: 04 5d 00 3f e7 5d 00 11 3f e8 5d 01 11 3f ce b5
    000000a0: 5d 01 11 6a 31 40 5d 01 10 31 11 6a 30 3f cf 3f
    000000b0: e1 3f de 2a 82 82 82 4c 49 4e 4b 29 45 52 52 4f
    000000c0: 52 82 82 82 2a 3f de 2a 50 55 53 48 29 49 4e 29
    000000d0: 54 48 45 29 4c 49 4e 4b 2a 3f de 2a 43 4f 52 44
    000000e0: 29 43 4f 4e 4e 45 43 54 4f 52 53 2a 3f de 2a 46
    000000f0: 49 52 4d 4c 59 29 54 48 45 4e 29 48 49 54 2a
  UrbLink              = 00000000
[685513 ms] UsbSnoop - DispatchAny(f890e610) : IRP_MJ_INTERNAL_DEVICE_CONTROL
[685513 ms] UsbSnoop - MyDispatchInternalIOCTL(f890fe80) : fdo=81b1aac0, Irp=822d9840, IRQL=2
[685513 ms]  >>>  URB 269 going down  >>> 
-- URB_FUNCTION_BULK_OR_INTERRUPT_TRANSFER:
  PipeHandle           = 822e77f4 [endpoint 0x00000002]
  TransferFlags        = 00000000 (USBD_TRANSFER_DIRECTION_OUT, ~USBD_SHORT_TRANSFER_OK)
  TransferBufferLength = 00000007
  TransferBuffer       = 00000000
  TransferBufferMDL    = 822d87a0
    00000000: 00 00 00 02 05 e0 00
  UrbLink              = 00000000
[685513 ms] UsbSnoop - MyInternalIOCTLCompletion(f890fdb0) : fido=81b19728, Irp=822d9840, Context=822db980, IRQL=2
[685513 ms]  <<<  URB 269 coming back  <<< 
-- URB_FUNCTION_BULK_OR_INTERRUPT_TRANSFER:
  PipeHandle           = 822e77f4 [endpoint 0x00000002]
  TransferFlags        = 00000000 (USBD_TRANSFER_DIRECTION_OUT, ~USBD_SHORT_TRANSFER_OK)
  TransferBufferLength = 00000007
  TransferBuffer       = 00000000
  TransferBufferMDL    = 822d87a0
  UrbLink              = 00000000
[685523 ms] UsbSnoop - DispatchAny(f890e610) : IRP_MJ_INTERNAL_DEVICE_CONTROL
[685523 ms] UsbSnoop - MyDispatchInternalIOCTL(f890fe80) : fdo=81b1aac0, Irp=822d9840, IRQL=2
[685523 ms]  >>>  URB 270 going down  >>> 
-- URB_FUNCTION_BULK_OR_INTERRUPT_TRANSFER:
  PipeHandle           = 822e77d4 [endpoint 0x00000081]
  TransferFlags        = 00000003 (USBD_TRANSFER_DIRECTION_IN, USBD_SHORT_TRANSFER_OK)
  TransferBufferLength = 00000100
  TransferBuffer       = 00000000
  TransferBufferMDL    = 822d87a0
  UrbLink              = 00000000
[685544 ms] UsbSnoop - MyInternalIOCTLCompletion(f890fdb0) : fido=81b19728, Irp=822d9840, Context=822e2150, IRQL=2
[685544 ms]  <<<  URB 270 coming back  <<< 
-- URB_FUNCTION_BULK_OR_INTERRUPT_TRANSFER:
  PipeHandle           = 822e77d4 [endpoint 0x00000081]
  TransferFlags        = 00000003 (USBD_TRANSFER_DIRECTION_IN, USBD_SHORT_TRANSFER_OK)
  TransferBufferLength = 000000ff
  TransferBuffer       = 00000000
  TransferBufferMDL    = 822d87a0
    00000000: 00 00 00 fa 03 3f de 2a 06 45 4e 54 45 52 07 3a
    00000010: 2a 3f d8 3f d7 4d 3f d4 3f de 2a 2a 3f e0 36 2b
    00000020: 31 2b 2a 29 29 53 54 41 54 55 53 3e 29 4f 3a 4b
    00000030: 3a 2a 3f e0 38 2b 31 30 2b 2a 06 45 4e 54 45 52
    00000040: 07 2a 11 3f d8 3f 76 3f e1 3f 85 3f 7e 08 3f fa
    00000050: 5d 01 2b 5d 03 3f 7e 08 3f 30 04 63 0a 3f 39 39
    00000060: 04 63 0b 3f 30 04 63 0c 3f 32 3a 35 04 63 0d 3f
    00000070: 31 30 04 63 02 3f 3a 35 04 63 03 3f 08 36 2b 30
    00000080: 09 04 5d 00 3f e7 5d 00 11 3f 08 31 2b 30 09 04
    00000090: 5d 00 3f e7 5d 00 11 3f 08 31 2b 31 31 2b 32 09
    000000a0: 04 5d 00 3f e7 5d 00 11 3f e1 3f d6 34 3f 10 ab
    000000b0: 82 31 3a 38 70 3a 35 11 04 50 3f 10 ab 82 31 3a
    000000c0: 38 70 3a 36 11 04 51 3f 10 ab 82 32 70 3a 35 11
    000000d0: 04 52 3f d6 30 3f 85 3f 93 36 2b 32 2b 2a 44 49
    000000e0: 53 54 10 4d 11 2a 11 3f 93 35 31 2b 38 31 2b 2a
    000000f0: 54 10 53 11 2a 11 3f 9c 30 2b 50 2b 33 35 2b
  UrbLink              = 00000000
[685583 ms] UsbSnoop - DispatchAny(f890e610) : IRP_MJ_INTERNAL_DEVICE_CONTROL
[685583 ms] UsbSnoop - MyDispatchInternalIOCTL(f890fe80) : fdo=81b1aac0, Irp=822d9840, IRQL=2
[685583 ms]  >>>  URB 271 going down  >>> 
-- URB_FUNCTION_BULK_OR_INTERRUPT_TRANSFER:
  PipeHandle           = 822e77f4 [endpoint 0x00000002]
  TransferFlags        = 00000000 (USBD_TRANSFER_DIRECTION_OUT, ~USBD_SHORT_TRANSFER_OK)
  TransferBufferLength = 00000007
  TransferBuffer       = 00000000
  TransferBufferMDL    = 822d87a0
    00000000: 00 00 00 02 05 e0 00
  UrbLink              = 00000000
[685583 ms] UsbSnoop - MyInternalIOCTLCompletion(f890fdb0) : fido=81b19728, Irp=822d9840, Context=81b05970, IRQL=2
[685583 ms]  <<<  URB 271 coming back  <<< 
-- URB_FUNCTION_BULK_OR_INTERRUPT_TRANSFER:
  PipeHandle           = 822e77f4 [endpoint 0x00000002]
  TransferFlags        = 00000000 (USBD_TRANSFER_DIRECTION_OUT, ~USBD_SHORT_TRANSFER_OK)
  TransferBufferLength = 00000007
  TransferBuffer       = 00000000
  TransferBufferMDL    = 822d87a0
  UrbLink              = 00000000
[685593 ms] UsbSnoop - DispatchAny(f890e610) : IRP_MJ_INTERNAL_DEVICE_CONTROL
[685593 ms] UsbSnoop - MyDispatchInternalIOCTL(f890fe80) : fdo=81b1aac0, Irp=822d9840, IRQL=2
[685593 ms]  >>>  URB 272 going down  >>> 
-- URB_FUNCTION_BULK_OR_INTERRUPT_TRANSFER:
  PipeHandle           = 822e77d4 [endpoint 0x00000081]
  TransferFlags        = 00000003 (USBD_TRANSFER_DIRECTION_IN, USBD_SHORT_TRANSFER_OK)
  TransferBufferLength = 00000100
  TransferBuffer       = 00000000
  TransferBufferMDL    = 822d87a0
  UrbLink              = 00000000
[685614 ms] UsbSnoop - MyInternalIOCTLCompletion(f890fdb0) : fido=81b19728, Irp=822d9840, Context=822e2150, IRQL=2
[685614 ms]  <<<  URB 272 coming back  <<< 
-- URB_FUNCTION_BULK_OR_INTERRUPT_TRANSFER:
  PipeHandle           = 822e77d4 [endpoint 0x00000081]
  TransferFlags        = 00000003 (USBD_TRANSFER_DIRECTION_IN, USBD_SHORT_TRANSFER_OK)
  TransferBufferLength = 000000ff
  TransferBuffer       = 00000000
  TransferBufferMDL    = 822d87a0
    00000000: 00 00 00 fa 03 51 11 3f 9c 33 35 2b 51 2b 36 30
    00000010: 2b 51 11 3f 9c 36 30 2b 51 2b 39 39 2b 52 11 3f
    00000020: d8 3f 08 33 2b 3a 31 2b b0 31 2b 30 09 04 5d 00
    00000030: 3f e7 5d 00 11 3f 39 39 04 b5 5d 03 11 3f d3 49
    00000040: 2b 31 2b 39 39 2b 31 11 3f e8 5d 03 10 49 11 11
    00000050: 3f 9e 49 2b 5d 03 10 49 11 11 3f d4 3f 08 36 2b
    00000060: 30 09 04 5d 00 3f e7 5d 00 11 3f d8 3f e6 2a 82
    00000070: 82 82 29 4f 50 54 49 4f 4e 53 29 82 82 82 2a 2b
    00000080: 2a 53 41 4d 45 29 4d 41 54 43 48 2a 2b 31 2b 2a
    00000090: 4e 45 57 29 4d 41 54 43 48 2a 2b 32 2b 2a 51 55
    000000a0: 49 54 2a 2b 33 11 3f d6 31 3f d7 30 3f d6 32 3f
    000000b0: d7 34 3f d6 33 3f 23 3a 31 82 4e 2b 4e 2b 30 2b
    000000c0: 39 38 2b 31 11 04 5d 01 3f ec fd 2b 5d 01 2b 5d
    000000d0: 03 2b 81 11 3f 30 04 63 0a 3f 31 30 04 63 0b 3f
    000000e0: 31 04 63 02 3f df 3f 84 3f 46 4f 52 43 45 52 54
    000000f0: 00 8c 03 08 36 2b 30 09 04 5d 00 3e e7 5d 00
  UrbLink              = 00000000
[685653 ms] UsbSnoop - DispatchAny(f890e610) : IRP_MJ_INTERNAL_DEVICE_CONTROL
[685653 ms] UsbSnoop - MyDispatchInternalIOCTL(f890fe80) : fdo=81b1aac0, Irp=822d9840, IRQL=2
[685653 ms]  >>>  URB 273 going down  >>> 
-- URB_FUNCTION_BULK_OR_INTERRUPT_TRANSFER:
  PipeHandle           = 822e77f4 [endpoint 0x00000002]
  TransferFlags        = 00000000 (USBD_TRANSFER_DIRECTION_OUT, ~USBD_SHORT_TRANSFER_OK)
  TransferBufferLength = 00000007
  TransferBuffer       = 00000000
  TransferBufferMDL    = 822d87a0
    00000000: 00 00 00 02 05 e0 00
  UrbLink              = 00000000
[685653 ms] UsbSnoop - MyInternalIOCTLCompletion(f890fdb0) : fido=81b19728, Irp=822d9840, Context=822db980, IRQL=2
[685653 ms]  <<<  URB 273 coming back  <<< 
-- URB_FUNCTION_BULK_OR_INTERRUPT_TRANSFER:
  PipeHandle           = 822e77f4 [endpoint 0x00000002]
  TransferFlags        = 00000000 (USBD_TRANSFER_DIRECTION_OUT, ~USBD_SHORT_TRANSFER_OK)
  TransferBufferLength = 00000007
  TransferBuffer       = 00000000
  TransferBufferMDL    = 822d87a0
  UrbLink              = 00000000
[685663 ms] UsbSnoop - DispatchAny(f890e610) : IRP_MJ_INTERNAL_DEVICE_CONTROL
[685663 ms] UsbSnoop - MyDispatchInternalIOCTL(f890fe80) : fdo=81b1aac0, Irp=822d9840, IRQL=2
[685663 ms]  >>>  URB 274 going down  >>> 
-- URB_FUNCTION_BULK_OR_INTERRUPT_TRANSFER:
  PipeHandle           = 822e77d4 [endpoint 0x00000081]
  TransferFlags        = 00000003 (USBD_TRANSFER_DIRECTION_IN, USBD_SHORT_TRANSFER_OK)
  TransferBufferLength = 00000100
  TransferBuffer       = 00000000
  TransferBufferMDL    = 822d87a0
  UrbLink              = 00000000
[685684 ms] UsbSnoop - MyInternalIOCTLCompletion(f890fdb0) : fido=81b19728, Irp=822d9840, Context=822db980, IRQL=2
[685685 ms]  <<<  URB 274 coming back  <<< 
-- URB_FUNCTION_BULK_OR_INTERRUPT_TRANSFER:
  PipeHandle           = 822e77d4 [endpoint 0x00000081]
  TransferFlags        = 00000003 (USBD_TRANSFER_DIRECTION_IN, USBD_SHORT_TRANSFER_OK)
  TransferBufferLength = 000000ff
  TransferBuffer       = 00000000
  TransferBufferMDL    = 822d87a0
    00000000: 00 00 00 fa 03 11 3f 31 04 63 0c 3e 32 04 63 0d
    00000010: 3e 31 04 63 0a 3e 32 04 63 0b 3f 7e 0b 3f 7e 09
    00000020: 3f 7e 0d 3f ea 3f 97 3f 85 3f 93 31 2b 31 36 2b
    00000030: 2a 54 45 58 41 53 29 29 49 4e 53 54 52 55 4d 45
    00000040: 4e 54 53 2a 11 3f 93 38 2b 33 30 2b 2a 43 42 4c
    00000050: 29 29 29 53 59 53 54 45 4d 2a 11 3f 93 31 35 2b
    00000060: 31 30 2b 2a 45 58 50 45 52 49 4d 45 4e 54 29 29
    00000070: 29 57 4f 52 4b 42 4f 4f 4b 2a 11 3f 93 32 39 2b
    00000080: 32 38 2b 2a 46 4f 52 43 45 52 54 29 29 29 56 32
    00000090: 3a 30 2a 11 3f 93 33 36 2b 31 38 2b 2a 10 45 58
    000000a0: 50 45 52 49 4d 45 4e 54 29 29 29 50 31 11 2a 11
    000000b0: 3f 93 35 30 2b 31 39 2b 2a 50 52 45 53 53 29 29
    000000c0: 29 06 45 4e 54 45 52 07 29 29 29 4f 4e 2a 3f 93
    000000d0: 35 37 2b 32 38 2b 2a 54 49 71 38 33 29 29 29 50
    000000e0: 4c 55 53 2a 3f d8 3f e1 3f de 2a 54 55 52 4e 29
    000000f0: 4f 4e 29 54 48 45 29 43 42 4c 3a 2a 3f e0 34
  UrbLink              = 00000000
[685723 ms] UsbSnoop - DispatchAny(f890e610) : IRP_MJ_INTERNAL_DEVICE_CONTROL
[685723 ms] UsbSnoop - MyDispatchInternalIOCTL(f890fe80) : fdo=81b1aac0, Irp=822d9840, IRQL=2
[685723 ms]  >>>  URB 275 going down  >>> 
-- URB_FUNCTION_BULK_OR_INTERRUPT_TRANSFER:
  PipeHandle           = 822e77f4 [endpoint 0x00000002]
  TransferFlags        = 00000000 (USBD_TRANSFER_DIRECTION_OUT, ~USBD_SHORT_TRANSFER_OK)
  TransferBufferLength = 00000007
  TransferBuffer       = 00000000
  TransferBufferMDL    = 822d87a0
    00000000: 00 00 00 02 05 e0 00
  UrbLink              = 00000000
[685723 ms] UsbSnoop - MyInternalIOCTLCompletion(f890fdb0) : fido=81b19728, Irp=822d9840, Context=82307cb8, IRQL=2
[685723 ms]  <<<  URB 275 coming back  <<< 
-- URB_FUNCTION_BULK_OR_INTERRUPT_TRANSFER:
  PipeHandle           = 822e77f4 [endpoint 0x00000002]
  TransferFlags        = 00000000 (USBD_TRANSFER_DIRECTION_OUT, ~USBD_SHORT_TRANSFER_OK)
  TransferBufferLength = 00000007
  TransferBuffer       = 00000000
  TransferBufferMDL    = 822d87a0
  UrbLink              = 00000000
[685733 ms] UsbSnoop - DispatchAny(f890e610) : IRP_MJ_INTERNAL_DEVICE_CONTROL
[685733 ms] UsbSnoop - MyDispatchInternalIOCTL(f890fe80) : fdo=81b1aac0, Irp=822d9840, IRQL=2
[685733 ms]  >>>  URB 276 going down  >>> 
-- URB_FUNCTION_BULK_OR_INTERRUPT_TRANSFER:
  PipeHandle           = 822e77d4 [endpoint 0x00000081]
  TransferFlags        = 00000003 (USBD_TRANSFER_DIRECTION_IN, USBD_SHORT_TRANSFER_OK)
  TransferBufferLength = 00000100
  TransferBuffer       = 00000000
  TransferBufferMDL    = 822d87a0
  UrbLink              = 00000000
[685754 ms] UsbSnoop - MyInternalIOCTLCompletion(f890fdb0) : fido=81b19728, Irp=822d9840, Context=822db980, IRQL=2
[685754 ms]  <<<  URB 276 coming back  <<< 
-- URB_FUNCTION_BULK_OR_INTERRUPT_TRANSFER:
  PipeHandle           = 822e77d4 [endpoint 0x00000081]
  TransferFlags        = 00000003 (USBD_TRANSFER_DIRECTION_IN, USBD_SHORT_TRANSFER_OK)
  TransferBufferLength = 000000ff
  TransferBuffer       = 00000000
  TransferBufferMDL    = 822d87a0
    00000000: 00 00 00 fa 03 2b 31 30 2b 2a 06 45 4e 54 45 52
    00000010: 07 2a 11 3f d8 3f 75 3f e1 3f de 2a 4e 4f 57 29
    00000020: 43 48 45 43 4b 49 4e 47 29 54 48 45 2a 3f de 2a
    00000030: 43 41 4c 43 55 4c 41 54 4f 52 71 43 42 4c 2a 3f
    00000040: de 2a 4c 49 4e 4b 29 43 4f 4e 4e 45 43 54 49 4f
    00000050: 4e 3a 2a 3f de 2a 50 4c 45 41 53 45 29 57 41 49
    00000060: 54 3a 3a 3a 3a 2a 3f 08 31 2b 30 09 04 5d 00 3f
    00000070: e7 5d 00 11 3f 08 30 09 04 5d 01 3f d6 4d 3f 08
    00000080: 37 09 04 5d 00 3f e7 5d 00 11 3f e8 5d 01 11 3f
    00000090: ce b5 5d 01 11 6a 31 40 5d 01 10 31 11 6a 30 3f
    000000a0: cf 3f e1 3f de 2a 82 82 82 4c 49 4e 4b 29 45 52
    000000b0: 52 4f 52 82 82 82 2a 3f de 2a 50 55 53 48 29 49
    000000c0: 4e 29 54 48 45 29 4c 49 4e 4b 2a 3f de 2a 43 4f
    000000d0: 52 44 29 43 4f 4e 4e 45 43 54 4f 52 53 2a 3f de
    000000e0: 2a 46 49 52 4d 4c 59 29 54 48 45 4e 29 48 49 54
    000000f0: 2a 3f de 2a 06 45 4e 54 45 52 07 3a 2a 3f d8
  UrbLink              = 00000000
[685793 ms] UsbSnoop - DispatchAny(f890e610) : IRP_MJ_INTERNAL_DEVICE_CONTROL
[685793 ms] UsbSnoop - MyDispatchInternalIOCTL(f890fe80) : fdo=81b1aac0, Irp=822d9840, IRQL=2
[685793 ms]  >>>  URB 277 going down  >>> 
-- URB_FUNCTION_BULK_OR_INTERRUPT_TRANSFER:
  PipeHandle           = 822e77f4 [endpoint 0x00000002]
  TransferFlags        = 00000000 (USBD_TRANSFER_DIRECTION_OUT, ~USBD_SHORT_TRANSFER_OK)
  TransferBufferLength = 00000007
  TransferBuffer       = 00000000
  TransferBufferMDL    = 822d87a0
    00000000: 00 00 00 02 05 e0 00
  UrbLink              = 00000000
[685794 ms] UsbSnoop - MyInternalIOCTLCompletion(f890fdb0) : fido=81b19728, Irp=822d9840, Context=81b05970, IRQL=2
[685794 ms]  <<<  URB 277 coming back  <<< 
-- URB_FUNCTION_BULK_OR_INTERRUPT_TRANSFER:
  PipeHandle           = 822e77f4 [endpoint 0x00000002]
  TransferFlags        = 00000000 (USBD_TRANSFER_DIRECTION_OUT, ~USBD_SHORT_TRANSFER_OK)
  TransferBufferLength = 00000007
  TransferBuffer       = 00000000
  TransferBufferMDL    = 822d87a0
  UrbLink              = 00000000
[685803 ms] UsbSnoop - DispatchAny(f890e610) : IRP_MJ_INTERNAL_DEVICE_CONTROL
[685803 ms] UsbSnoop - MyDispatchInternalIOCTL(f890fe80) : fdo=81b1aac0, Irp=822d9840, IRQL=2
[685803 ms]  >>>  URB 278 going down  >>> 
-- URB_FUNCTION_BULK_OR_INTERRUPT_TRANSFER:
  PipeHandle           = 822e77d4 [endpoint 0x00000081]
  TransferFlags        = 00000003 (USBD_TRANSFER_DIRECTION_IN, USBD_SHORT_TRANSFER_OK)
  TransferBufferLength = 00000100
  TransferBuffer       = 00000000
  TransferBufferMDL    = 822d87a0
  UrbLink              = 00000000
[685825 ms] UsbSnoop - MyInternalIOCTLCompletion(f890fdb0) : fido=81b19728, Irp=822d9840, Context=822db980, IRQL=2
[685825 ms]  <<<  URB 278 coming back  <<< 
-- URB_FUNCTION_BULK_OR_INTERRUPT_TRANSFER:
  PipeHandle           = 822e77d4 [endpoint 0x00000081]
  TransferFlags        = 00000003 (USBD_TRANSFER_DIRECTION_IN, USBD_SHORT_TRANSFER_OK)
  TransferBufferLength = 000000ff
  TransferBuffer       = 00000000
  TransferBufferMDL    = 822d87a0
    00000000: 00 00 00 fa 03 3f d7 4d 3f d4 3f de 2a 2a 3f e0
    00000010: 36 2b 31 2b 2a 29 29 53 54 41 54 55 53 3e 29 4f
    00000020: 3a 4b 3a 2a 3f e0 38 2b 31 30 2b 2a 06 45 4e 54
    00000030: 45 52 07 2a 11 3f d8 3f 76 3f e1 3f 85 3f 7e 08
    00000040: 3f 30 04 63 0a 3f 39 39 04 63 0b 3f b0 35 04 63
    00000050: 0c 3f 31 30 04 63 0d 3f 31 30 04 63 02 3f 32 04
    00000060: 63 03 3f fa 5d 01 2b 5d 03 3f 08 36 2b 30 09 04
    00000070: 5d 00 3f e7 5d 00 11 3f 08 31 2b 30 09 04 5d 00
    00000080: 3f e7 5d 00 11 3f e1 3f 08 34 2b 31 2b 31 2b 31
    00000090: 2b 39 3a 38 2b b0 39 3a 38 09 04 5d 00 3f e7 5d
    000000a0: 00 11 3f 08 31 2b 31 2b 31 2b 30 2b 30 2b 31 09
    000000b0: 04 5d 00 3f e7 5d 00 11 3f de 2a 50 52 45 53 53
    000000c0: 29 45 4e 54 45 52 29 54 4f 2a 3f de 2a 53 54 41
    000000d0: 52 54 29 46 4f 52 43 45 2a 3f de 2a 47 52 41 50
    000000e0: 48 3a 2a 3f d8 3f 08 33 2b 3a 31 2b b0 31 2b 30
    000000f0: 09 04 5d 00 3f e7 5d 00 11 3f 39 39 04 b5 5d
  UrbLink              = 00000000
[685863 ms] UsbSnoop - DispatchAny(f890e610) : IRP_MJ_INTERNAL_DEVICE_CONTROL
[685863 ms] UsbSnoop - MyDispatchInternalIOCTL(f890fe80) : fdo=81b1aac0, Irp=822d9840, IRQL=2
[685863 ms]  >>>  URB 279 going down  >>> 
-- URB_FUNCTION_BULK_OR_INTERRUPT_TRANSFER:
  PipeHandle           = 822e77f4 [endpoint 0x00000002]
  TransferFlags        = 00000000 (USBD_TRANSFER_DIRECTION_OUT, ~USBD_SHORT_TRANSFER_OK)
  TransferBufferLength = 00000007
  TransferBuffer       = 00000000
  TransferBufferMDL    = 822d87a0
    00000000: 00 00 00 02 05 e0 00
  UrbLink              = 00000000
[685864 ms] UsbSnoop - MyInternalIOCTLCompletion(f890fdb0) : fido=81b19728, Irp=822d9840, Context=82307cb8, IRQL=2
[685864 ms]  <<<  URB 279 coming back  <<< 
-- URB_FUNCTION_BULK_OR_INTERRUPT_TRANSFER:
  PipeHandle           = 822e77f4 [endpoint 0x00000002]
  TransferFlags        = 00000000 (USBD_TRANSFER_DIRECTION_OUT, ~USBD_SHORT_TRANSFER_OK)
  TransferBufferLength = 00000007
  TransferBuffer       = 00000000
  TransferBufferMDL    = 822d87a0
  UrbLink              = 00000000
[685873 ms] UsbSnoop - DispatchAny(f890e610) : IRP_MJ_INTERNAL_DEVICE_CONTROL
[685873 ms] UsbSnoop - MyDispatchInternalIOCTL(f890fe80) : fdo=81b1aac0, Irp=822d9840, IRQL=2
[685873 ms]  >>>  URB 280 going down  >>> 
-- URB_FUNCTION_BULK_OR_INTERRUPT_TRANSFER:
  PipeHandle           = 822e77d4 [endpoint 0x00000081]
  TransferFlags        = 00000003 (USBD_TRANSFER_DIRECTION_IN, USBD_SHORT_TRANSFER_OK)
  TransferBufferLength = 00000100
  TransferBuffer       = 00000000
  TransferBufferMDL    = 822d87a0
  UrbLink              = 00000000
[685895 ms] UsbSnoop - MyInternalIOCTLCompletion(f890fdb0) : fido=81b19728, Irp=822d9840, Context=821aa3a8, IRQL=2
[685895 ms]  <<<  URB 280 coming back  <<< 
-- URB_FUNCTION_BULK_OR_INTERRUPT_TRANSFER:
  PipeHandle           = 822e77d4 [endpoint 0x00000081]
  TransferFlags        = 00000003 (USBD_TRANSFER_DIRECTION_IN, USBD_SHORT_TRANSFER_OK)
  TransferBufferLength = 000000ff
  TransferBuffer       = 00000000
  TransferBufferMDL    = 822d87a0
    00000000: 00 00 00 fa 03 03 11 3f 85 3f 93 36 2b 31 2b 2a
    00000010: 46 4f 52 43 45 10 4e 11 2a 11 3f 93 35 31 2b 38
    00000020: 31 2b 2a 54 10 53 11 2a 11 3f d3 49 2b 31 2b 39
    00000030: 39 2b 31 11 3f e8 5d 03 10 49 11 11 3f 9e 49 2b
    00000040: 5d 03 10 49 11 11 3f d4 3f 23 4e 2b 4e 2b 30 2b
    00000050: 39 3a 38 2b 3a 31 11 04 5d 01 3f 39 3a 38 04 63
    00000060: 0b 3f 31 04 63 02 3f ec fe 2b 5d 01 2b 5d 03 2b
    00000070: 81 11 3f df 3f 93 36 2b 31 2b 2a 46 4f 52 43 45
    00000080: 10 4e 11 2a 11 3f 93 35 31 2b 38 31 2b 2a 54 10
    00000090: 53 11 2a 11 3f 84 3f 47 41 54 45 00 ce 03 d6 30
    000000a0: 3f 08 36 2b 30 09 04 5d 00 3e e7 5d 00 11 3f 31
    000000b0: 04 63 0c 3e 32 04 63 0d 3e 31 04 63 0a 3e 32 04
    000000c0: 63 0b 3f 7e 0b 3f 7e 09 3f 7e 0d 3f ea 3f 97 3f
    000000d0: 85 3f 93 31 2b 31 36 2b 2a 54 45 58 41 53 29 29
    000000e0: 49 4e 53 54 52 55 4d 45 4e 54 53 2a 11 3f 93 38
    000000f0: 2b 33 30 2b 2a 43 42 4c 29 29 29 53 59 53 54
  UrbLink              = 00000000
[685933 ms] UsbSnoop - DispatchAny(f890e610) : IRP_MJ_INTERNAL_DEVICE_CONTROL
[685934 ms] UsbSnoop - MyDispatchInternalIOCTL(f890fe80) : fdo=81b1aac0, Irp=822d9840, IRQL=2
[685934 ms]  >>>  URB 281 going down  >>> 
-- URB_FUNCTION_BULK_OR_INTERRUPT_TRANSFER:
  PipeHandle           = 822e77f4 [endpoint 0x00000002]
  TransferFlags        = 00000000 (USBD_TRANSFER_DIRECTION_OUT, ~USBD_SHORT_TRANSFER_OK)
  TransferBufferLength = 00000007
  TransferBuffer       = 00000000
  TransferBufferMDL    = 822d87a0
    00000000: 00 00 00 02 05 e0 00
  UrbLink              = 00000000
[685934 ms] UsbSnoop - MyInternalIOCTLCompletion(f890fdb0) : fido=81b19728, Irp=822d9840, Context=822db980, IRQL=2
[685934 ms]  <<<  URB 281 coming back  <<< 
-- URB_FUNCTION_BULK_OR_INTERRUPT_TRANSFER:
  PipeHandle           = 822e77f4 [endpoint 0x00000002]
  TransferFlags        = 00000000 (USBD_TRANSFER_DIRECTION_OUT, ~USBD_SHORT_TRANSFER_OK)
  TransferBufferLength = 00000007
  TransferBuffer       = 00000000
  TransferBufferMDL    = 822d87a0
  UrbLink              = 00000000
[685943 ms] UsbSnoop - DispatchAny(f890e610) : IRP_MJ_INTERNAL_DEVICE_CONTROL
[685943 ms] UsbSnoop - MyDispatchInternalIOCTL(f890fe80) : fdo=81b1aac0, Irp=822d9840, IRQL=2
[685943 ms]  >>>  URB 282 going down  >>> 
-- URB_FUNCTION_BULK_OR_INTERRUPT_TRANSFER:
  PipeHandle           = 822e77d4 [endpoint 0x00000081]
  TransferFlags        = 00000003 (USBD_TRANSFER_DIRECTION_IN, USBD_SHORT_TRANSFER_OK)
  TransferBufferLength = 00000100
  TransferBuffer       = 00000000
  TransferBufferMDL    = 822d87a0
  UrbLink              = 00000000
[685965 ms] UsbSnoop - MyInternalIOCTLCompletion(f890fdb0) : fido=81b19728, Irp=822d9840, Context=822db980, IRQL=2
[685965 ms]  <<<  URB 282 coming back  <<< 
-- URB_FUNCTION_BULK_OR_INTERRUPT_TRANSFER:
  PipeHandle           = 822e77d4 [endpoint 0x00000081]
  TransferFlags        = 00000003 (USBD_TRANSFER_DIRECTION_IN, USBD_SHORT_TRANSFER_OK)
  TransferBufferLength = 000000ff
  TransferBuffer       = 00000000
  TransferBufferMDL    = 822d87a0
    00000000: 00 00 00 fa 03 45 4d 2a 11 3f 93 31 35 2b 31 30
    00000010: 2b 2a 45 58 50 45 52 49 4d 45 4e 54 29 29 29 57
    00000020: 4f 52 4b 42 4f 4f 4b 2a 11 3f 93 32 39 2b 33 32
    00000030: 2b 2a 47 41 54 45 29 29 29 56 32 3a 30 2a 11 3f
    00000040: 93 33 36 2b 31 38 2b 2a 10 45 58 50 45 52 49 4d
    00000050: 45 4e 54 29 29 29 50 37 11 2a 11 3f 93 35 30 2b
    00000060: 31 39 2b 2a 50 52 45 53 53 29 29 29 06 45 4e 54
    00000070: 45 52 07 29 29 29 4f 4e 2a 3f 93 35 37 2b 32 38
    00000080: 2b 2a 54 49 71 38 33 29 29 29 50 4c 55 53 2a 3f
    00000090: d8 3f e1 3f de 2a 54 55 52 4e 29 4f 4e 29 54 48
    000000a0: 45 29 43 42 4c 3a 2a 3f e0 34 2b 31 30 2b 2a 06
    000000b0: 45 4e 54 45 52 07 2a 11 3f d8 3f 75 3f e1 3f de
    000000c0: 2a 4e 4f 57 29 43 48 45 43 4b 49 4e 47 29 54 48
    000000d0: 45 2a 3f de 2a 43 41 4c 43 55 4c 41 54 4f 52 71
    000000e0: 43 42 4c 2a 3f de 2a 4c 49 4e 4b 29 43 4f 4e 4e
    000000f0: 45 43 54 49 4f 4e 3a 2a 3f de 2a 50 4c 45 41
  UrbLink              = 00000000
[686004 ms] UsbSnoop - DispatchAny(f890e610) : IRP_MJ_INTERNAL_DEVICE_CONTROL
[686004 ms] UsbSnoop - MyDispatchInternalIOCTL(f890fe80) : fdo=81b1aac0, Irp=822d9840, IRQL=2
[686004 ms]  >>>  URB 283 going down  >>> 
-- URB_FUNCTION_BULK_OR_INTERRUPT_TRANSFER:
  PipeHandle           = 822e77f4 [endpoint 0x00000002]
  TransferFlags        = 00000000 (USBD_TRANSFER_DIRECTION_OUT, ~USBD_SHORT_TRANSFER_OK)
  TransferBufferLength = 00000007
  TransferBuffer       = 00000000
  TransferBufferMDL    = 822d87a0
    00000000: 00 00 00 02 05 e0 00
  UrbLink              = 00000000
[686004 ms] UsbSnoop - MyInternalIOCTLCompletion(f890fdb0) : fido=81b19728, Irp=822d9840, Context=82307cb8, IRQL=2
[686004 ms]  <<<  URB 283 coming back  <<< 
-- URB_FUNCTION_BULK_OR_INTERRUPT_TRANSFER:
  PipeHandle           = 822e77f4 [endpoint 0x00000002]
  TransferFlags        = 00000000 (USBD_TRANSFER_DIRECTION_OUT, ~USBD_SHORT_TRANSFER_OK)
  TransferBufferLength = 00000007
  TransferBuffer       = 00000000
  TransferBufferMDL    = 822d87a0
  UrbLink              = 00000000
[686014 ms] UsbSnoop - DispatchAny(f890e610) : IRP_MJ_INTERNAL_DEVICE_CONTROL
[686014 ms] UsbSnoop - MyDispatchInternalIOCTL(f890fe80) : fdo=81b1aac0, Irp=822d9840, IRQL=2
[686014 ms]  >>>  URB 284 going down  >>> 
-- URB_FUNCTION_BULK_OR_INTERRUPT_TRANSFER:
  PipeHandle           = 822e77d4 [endpoint 0x00000081]
  TransferFlags        = 00000003 (USBD_TRANSFER_DIRECTION_IN, USBD_SHORT_TRANSFER_OK)
  TransferBufferLength = 00000100
  TransferBuffer       = 00000000
  TransferBufferMDL    = 822d87a0
  UrbLink              = 00000000
[686035 ms] UsbSnoop - MyInternalIOCTLCompletion(f890fdb0) : fido=81b19728, Irp=822d9840, Context=81cd51b0, IRQL=2
[686035 ms]  <<<  URB 284 coming back  <<< 
-- URB_FUNCTION_BULK_OR_INTERRUPT_TRANSFER:
  PipeHandle           = 822e77d4 [endpoint 0x00000081]
  TransferFlags        = 00000003 (USBD_TRANSFER_DIRECTION_IN, USBD_SHORT_TRANSFER_OK)
  TransferBufferLength = 000000ff
  TransferBuffer       = 00000000
  TransferBufferMDL    = 822d87a0
    00000000: 00 00 00 fa 03 53 45 29 57 41 49 54 3a 3a 3a 3a
    00000010: 2a 3f 08 31 2b 30 09 04 5d 00 3f e7 5d 00 11 3f
    00000020: 08 30 09 04 5d 01 3f d6 4d 3f 08 37 09 04 5d 00
    00000030: 3f e7 5d 00 11 3f e8 5d 01 11 3f ce b5 5d 01 11
    00000040: 6a 31 40 5d 01 10 31 11 6a 30 3f cf 3f e1 3f de
    00000050: 2a 82 82 82 4c 49 4e 4b 29 45 52 52 4f 52 82 82
    00000060: 82 2a 3f de 2a 50 55 53 48 29 49 4e 29 54 48 45
    00000070: 29 4c 49 4e 4b 2a 3f de 2a 43 4f 52 44 29 43 4f
    00000080: 4e 4e 45 43 54 4f 52 53 2a 3f de 2a 46 49 52 4d
    00000090: 4c 59 29 54 48 45 4e 29 48 49 54 2a 3f de 2a 06
    000000a0: 45 4e 54 45 52 07 3a 2a 3f d8 3f d7 4d 3f d4 3f
    000000b0: de 2a 2a 3f e0 36 2b 31 2b 2a 29 29 53 54 41 54
    000000c0: 55 53 3e 29 4f 3a 4b 3a 2a 3f e0 38 2b 31 30 2b
    000000d0: 2a 06 45 4e 54 45 52 07 2a 11 3f d8 3f 76 3f e1
    000000e0: 3f 85 3f 7e 08 3f fa 5d 01 2b 5d 02 2b 5d 03 3f
    000000f0: 08 36 2b 30 09 04 5d 00 3f e7 5d 00 11 3f 08
  UrbLink              = 00000000
[686074 ms] UsbSnoop - DispatchAny(f890e610) : IRP_MJ_INTERNAL_DEVICE_CONTROL
[686074 ms] UsbSnoop - MyDispatchInternalIOCTL(f890fe80) : fdo=81b1aac0, Irp=822d9840, IRQL=2
[686074 ms]  >>>  URB 285 going down  >>> 
-- URB_FUNCTION_BULK_OR_INTERRUPT_TRANSFER:
  PipeHandle           = 822e77f4 [endpoint 0x00000002]
  TransferFlags        = 00000000 (USBD_TRANSFER_DIRECTION_OUT, ~USBD_SHORT_TRANSFER_OK)
  TransferBufferLength = 00000007
  TransferBuffer       = 00000000
  TransferBufferMDL    = 822d87a0
    00000000: 00 00 00 02 05 e0 00
  UrbLink              = 00000000
[686074 ms] UsbSnoop - MyInternalIOCTLCompletion(f890fdb0) : fido=81b19728, Irp=822d9840, Context=822db980, IRQL=2
[686074 ms]  <<<  URB 285 coming back  <<< 
-- URB_FUNCTION_BULK_OR_INTERRUPT_TRANSFER:
  PipeHandle           = 822e77f4 [endpoint 0x00000002]
  TransferFlags        = 00000000 (USBD_TRANSFER_DIRECTION_OUT, ~USBD_SHORT_TRANSFER_OK)
  TransferBufferLength = 00000007
  TransferBuffer       = 00000000
  TransferBufferMDL    = 822d87a0
  UrbLink              = 00000000
[686085 ms] UsbSnoop - DispatchAny(f890e610) : IRP_MJ_INTERNAL_DEVICE_CONTROL
[686085 ms] UsbSnoop - MyDispatchInternalIOCTL(f890fe80) : fdo=81b1aac0, Irp=822d9840, IRQL=2
[686085 ms]  >>>  URB 286 going down  >>> 
-- URB_FUNCTION_BULK_OR_INTERRUPT_TRANSFER:
  PipeHandle           = 822e77d4 [endpoint 0x00000081]
  TransferFlags        = 00000003 (USBD_TRANSFER_DIRECTION_IN, USBD_SHORT_TRANSFER_OK)
  TransferBufferLength = 00000100
  TransferBuffer       = 00000000
  TransferBufferMDL    = 822d87a0
  UrbLink              = 00000000
[686105 ms] UsbSnoop - MyInternalIOCTLCompletion(f890fdb0) : fido=81b19728, Irp=822d9840, Context=81cd51b0, IRQL=2
[686105 ms]  <<<  URB 286 coming back  <<< 
-- URB_FUNCTION_BULK_OR_INTERRUPT_TRANSFER:
  PipeHandle           = 822e77d4 [endpoint 0x00000081]
  TransferFlags        = 00000003 (USBD_TRANSFER_DIRECTION_IN, USBD_SHORT_TRANSFER_OK)
  TransferBufferLength = 000000ff
  TransferBuffer       = 00000000
  TransferBufferMDL    = 822d87a0
    00000000: 00 00 00 fa 03 31 2b 30 09 04 5d 00 3f e7 5d 00
    00000010: 11 3f 08 31 2b 31 2b 31 34 09 04 5d 00 3f e7 5d
    00000020: 00 11 3f e1 3f de 2a 50 52 45 53 53 29 45 4e 54
    00000030: 45 52 29 54 4f 2a 3f de 2a 41 52 4d 29 47 41 54
    00000040: 45 3a 2a 3f d8 3f e1 3f de 2a 52 45 41 44 59 3a
    00000050: 3a 3a 3a 2a 3f 08 33 2b 3a 30 30 31 2b 39 39 2b
    00000060: 33 2b 31 2b 31 2b 31 30 2b 30 2b 31 09 04 5d 00
    00000070: 3f e7 5d 00 11 3f e8 5d 03 11 3f e8 5d 01 11 3f
    00000080: 31 04 43 3f e1 3f de 2a 41 4e 41 4c 59 5a 49 4e
    00000090: 47 3a 3a 3a 3a 2a 3f d3 4e 2b 31 2b 39 38 2b 31
    000000a0: 11 3f ce 5d 03 10 4e 70 31 11 6b 3a 37 35 40 5d
    000000b0: 03 10 4e 11 6c 3a 37 35 3c 5d 03 10 4e 70 31 11
    000000c0: 6c 3a 37 35 40 5d 03 10 4e 11 6b 3a 37 35 3f cf
    000000d0: 3f 5d 01 10 4e 11 04 5d 02 10 43 11 3f 43 70 31
    000000e0: 04 43 3f d4 3f d4 3f ce b5 5d 02 11 6b 32 3f cf
    000000f0: 3f e1 3f de 2a 54 49 4d 45 29 49 4e 54 45 52
  UrbLink              = 00000000
[686144 ms] UsbSnoop - DispatchAny(f890e610) : IRP_MJ_INTERNAL_DEVICE_CONTROL
[686144 ms] UsbSnoop - MyDispatchInternalIOCTL(f890fe80) : fdo=81b1aac0, Irp=822d9840, IRQL=2
[686144 ms]  >>>  URB 287 going down  >>> 
-- URB_FUNCTION_BULK_OR_INTERRUPT_TRANSFER:
  PipeHandle           = 822e77f4 [endpoint 0x00000002]
  TransferFlags        = 00000000 (USBD_TRANSFER_DIRECTION_OUT, ~USBD_SHORT_TRANSFER_OK)
  TransferBufferLength = 00000007
  TransferBuffer       = 00000000
  TransferBufferMDL    = 822d87a0
    00000000: 00 00 00 02 05 e0 00
  UrbLink              = 00000000
[686144 ms] UsbSnoop - MyInternalIOCTLCompletion(f890fdb0) : fido=81b19728, Irp=822d9840, Context=81b05970, IRQL=2
[686144 ms]  <<<  URB 287 coming back  <<< 
-- URB_FUNCTION_BULK_OR_INTERRUPT_TRANSFER:
  PipeHandle           = 822e77f4 [endpoint 0x00000002]
  TransferFlags        = 00000000 (USBD_TRANSFER_DIRECTION_OUT, ~USBD_SHORT_TRANSFER_OK)
  TransferBufferLength = 00000007
  TransferBuffer       = 00000000
  TransferBufferMDL    = 822d87a0
  UrbLink              = 00000000
[686154 ms] UsbSnoop - DispatchAny(f890e610) : IRP_MJ_INTERNAL_DEVICE_CONTROL
[686154 ms] UsbSnoop - MyDispatchInternalIOCTL(f890fe80) : fdo=81b1aac0, Irp=822d9840, IRQL=2
[686154 ms]  >>>  URB 288 going down  >>> 
-- URB_FUNCTION_BULK_OR_INTERRUPT_TRANSFER:
  PipeHandle           = 822e77d4 [endpoint 0x00000081]
  TransferFlags        = 00000003 (USBD_TRANSFER_DIRECTION_IN, USBD_SHORT_TRANSFER_OK)
  TransferBufferLength = 00000100
  TransferBuffer       = 00000000
  TransferBufferMDL    = 822d87a0
  UrbLink              = 00000000
[686175 ms] UsbSnoop - MyInternalIOCTLCompletion(f890fdb0) : fido=81b19728, Irp=822d9840, Context=81cd51b0, IRQL=2
[686175 ms]  <<<  URB 288 coming back  <<< 
-- URB_FUNCTION_BULK_OR_INTERRUPT_TRANSFER:
  PipeHandle           = 822e77d4 [endpoint 0x00000081]
  TransferFlags        = 00000003 (USBD_TRANSFER_DIRECTION_IN, USBD_SHORT_TRANSFER_OK)
  TransferBufferLength = 000000ff
  TransferBuffer       = 00000000
  TransferBufferMDL    = 822d87a0
    00000000: 00 00 00 fa 03 56 41 4c 29 49 53 2a 3f de 2a 54
    00000010: 4f 4f 29 42 49 47 3a 2a 3f d8 3f d7 30 3f d4 3f
    00000020: ec fd 2b 5d 01 2b 5d 03 2b 81 11 3f b0 31 04 63
    00000030: 0c 3e 33 04 63 0d 3e 31 04 63 03 3f 30 04 63 0a
    00000040: 3e 19 5d 01 11 04 63 0b 3e 3a 31 04 63 02 3f df
    00000050: 3f 5d 02 10 32 11 71 5d 02 10 31 11 04 54 3f 93
    00000060: 37 2b 32 34 2b 2a 63 26 2a 11 3f 93 37 2b 33 30
    00000070: 2b 2a 54 6a 29 2a 2b 54 2b 2a 29 29 53 45 43 2a
    00000080: 11 3f 84 3f 47 45 54 4c 49 47 48 54 00 9a 01 31
    00000090: 04 63 0c 3e 32 04 63 0d 3e 31 04 63 0a 3e 32 04
    000000a0: 63 0b 3f 7e 0b 3f 7e 09 3f 7e 0d 3f ea 3f 97 3f
    000000b0: 85 3f 93 31 2b 31 36 2b 2a 54 45 58 41 53 29 29
    000000c0: 49 4e 53 54 52 55 4d 45 4e 54 53 2a 11 3f 93 38
    000000d0: 2b 33 30 2b 2a 43 42 4c 29 29 29 53 59 53 54 45
    000000e0: 4d 2a 11 3f 93 31 35 2b 31 30 2b 2a 45 58 50 45
    000000f0: 52 49 4d 45 4e 54 29 29 29 57 4f 52 4b 42 4f
  UrbLink              = 00000000
[686214 ms] UsbSnoop - DispatchAny(f890e610) : IRP_MJ_INTERNAL_DEVICE_CONTROL
[686214 ms] UsbSnoop - MyDispatchInternalIOCTL(f890fe80) : fdo=81b1aac0, Irp=822d9840, IRQL=2
[686214 ms]  >>>  URB 289 going down  >>> 
-- URB_FUNCTION_BULK_OR_INTERRUPT_TRANSFER:
  PipeHandle           = 822e77f4 [endpoint 0x00000002]
  TransferFlags        = 00000000 (USBD_TRANSFER_DIRECTION_OUT, ~USBD_SHORT_TRANSFER_OK)
  TransferBufferLength = 00000007
  TransferBuffer       = 00000000
  TransferBufferMDL    = 822d87a0
    00000000: 00 00 00 02 05 e0 00
  UrbLink              = 00000000
[686214 ms] UsbSnoop - MyInternalIOCTLCompletion(f890fdb0) : fido=81b19728, Irp=822d9840, Context=822db980, IRQL=2
[686214 ms]  <<<  URB 289 coming back  <<< 
-- URB_FUNCTION_BULK_OR_INTERRUPT_TRANSFER:
  PipeHandle           = 822e77f4 [endpoint 0x00000002]
  TransferFlags        = 00000000 (USBD_TRANSFER_DIRECTION_OUT, ~USBD_SHORT_TRANSFER_OK)
  TransferBufferLength = 00000007
  TransferBuffer       = 00000000
  TransferBufferMDL    = 822d87a0
  UrbLink              = 00000000
[686224 ms] UsbSnoop - DispatchAny(f890e610) : IRP_MJ_INTERNAL_DEVICE_CONTROL
[686224 ms] UsbSnoop - MyDispatchInternalIOCTL(f890fe80) : fdo=81b1aac0, Irp=822d9840, IRQL=2
[686224 ms]  >>>  URB 290 going down  >>> 
-- URB_FUNCTION_BULK_OR_INTERRUPT_TRANSFER:
  PipeHandle           = 822e77d4 [endpoint 0x00000081]
  TransferFlags        = 00000003 (USBD_TRANSFER_DIRECTION_IN, USBD_SHORT_TRANSFER_OK)
  TransferBufferLength = 00000100
  TransferBuffer       = 00000000
  TransferBufferMDL    = 822d87a0
  UrbLink              = 00000000
[686245 ms] UsbSnoop - MyInternalIOCTLCompletion(f890fdb0) : fido=81b19728, Irp=822d9840, Context=81cd51b0, IRQL=2
[686245 ms]  <<<  URB 290 coming back  <<< 
-- URB_FUNCTION_BULK_OR_INTERRUPT_TRANSFER:
  PipeHandle           = 822e77d4 [endpoint 0x00000081]
  TransferFlags        = 00000003 (USBD_TRANSFER_DIRECTION_IN, USBD_SHORT_TRANSFER_OK)
  TransferBufferLength = 000000ff
  TransferBuffer       = 00000000
  TransferBufferMDL    = 822d87a0
    00000000: 00 00 00 fa 03 4f 4b 2a 11 3f 93 32 39 2b 32 36
    00000010: 2b 2a 47 45 54 4c 49 47 48 54 29 29 29 56 32 3a
    00000020: 30 2a 11 3f 93 33 36 2b 32 30 2b 2a 10 45 58 50
    00000030: 45 52 49 4d 45 4e 54 29 29 29 4d 36 11 2a 11 3f
    00000040: 93 34 33 2b 31 39 2b 2a 50 52 45 53 53 29 29 29
    00000050: 06 45 4e 54 45 52 07 29 29 29 4f 4e 2a 3f 93 35
    00000060: 30 2b 32 38 2b 2a 54 49 71 38 33 29 29 29 50 4c
    00000070: 55 53 2a 3f 93 35 37 2b 31 2b 2a 54 49 4d 45 3e
    00000080: 29 4c 32 29 29 29 29 29 29 29 29 29 29 29 29 29
    00000090: 29 29 29 29 29 29 29 29 29 29 29 29 29 29 29 29
    000000a0: 29 29 29 29 29 29 29 4c 49 47 48 54 3e 29 4c 33
    000000b0: 2a 3f d8 3f fa 5d 01 2b 5d 02 2b 5d 03 3f 08 36
    000000c0: 2b 30 09 04 5d 00 3f e7 5d 00 11 3f e8 5d 02 11
    000000d0: 3f e8 5d 03 11 3f e8 5d 01 11 3f 85 3f 93 31 2b
    000000e0: 31 31 2b 2a 44 41 54 41 29 52 45 43 45 49 56 45
    000000f0: 44 3a 2a 11 3f 93 34 33 2b 31 39 2b 2a 50 52
  UrbLink              = 00000000
[686285 ms] UsbSnoop - DispatchAny(f890e610) : IRP_MJ_INTERNAL_DEVICE_CONTROL
[686285 ms] UsbSnoop - MyDispatchInternalIOCTL(f890fe80) : fdo=81b1aac0, Irp=822d9840, IRQL=2
[686285 ms]  >>>  URB 291 going down  >>> 
-- URB_FUNCTION_BULK_OR_INTERRUPT_TRANSFER:
  PipeHandle           = 822e77f4 [endpoint 0x00000002]
  TransferFlags        = 00000000 (USBD_TRANSFER_DIRECTION_OUT, ~USBD_SHORT_TRANSFER_OK)
  TransferBufferLength = 00000007
  TransferBuffer       = 00000000
  TransferBufferMDL    = 822d87a0
    00000000: 00 00 00 02 05 e0 00
  UrbLink              = 00000000
[686286 ms] UsbSnoop - MyInternalIOCTLCompletion(f890fdb0) : fido=81b19728, Irp=822d9840, Context=81b05970, IRQL=2
[686286 ms]  <<<  URB 291 coming back  <<< 
-- URB_FUNCTION_BULK_OR_INTERRUPT_TRANSFER:
  PipeHandle           = 822e77f4 [endpoint 0x00000002]
  TransferFlags        = 00000000 (USBD_TRANSFER_DIRECTION_OUT, ~USBD_SHORT_TRANSFER_OK)
  TransferBufferLength = 00000007
  TransferBuffer       = 00000000
  TransferBufferMDL    = 822d87a0
  UrbLink              = 00000000
[686294 ms] UsbSnoop - DispatchAny(f890e610) : IRP_MJ_INTERNAL_DEVICE_CONTROL
[686294 ms] UsbSnoop - MyDispatchInternalIOCTL(f890fe80) : fdo=81b1aac0, Irp=822d9840, IRQL=2
[686294 ms]  >>>  URB 292 going down  >>> 
-- URB_FUNCTION_BULK_OR_INTERRUPT_TRANSFER:
  PipeHandle           = 822e77d4 [endpoint 0x00000081]
  TransferFlags        = 00000003 (USBD_TRANSFER_DIRECTION_IN, USBD_SHORT_TRANSFER_OK)
  TransferBufferLength = 00000100
  TransferBuffer       = 00000000
  TransferBufferMDL    = 822d87a0
  UrbLink              = 00000000
[686317 ms] UsbSnoop - MyInternalIOCTLCompletion(f890fdb0) : fido=81b19728, Irp=822d9840, Context=81cd51b0, IRQL=2
[686317 ms]  <<<  URB 292 coming back  <<< 
-- URB_FUNCTION_BULK_OR_INTERRUPT_TRANSFER:
  PipeHandle           = 822e77d4 [endpoint 0x00000081]
  TransferFlags        = 00000003 (USBD_TRANSFER_DIRECTION_IN, USBD_SHORT_TRANSFER_OK)
  TransferBufferLength = 000000ff
  TransferBuffer       = 00000000
  TransferBufferMDL    = 822d87a0
    00000000: 00 00 00 fa 03 45 53 53 29 29 29 06 45 4e 54 45
    00000010: 52 07 29 29 29 4f 4e 2a 3f 93 35 30 2b 32 38 2b
    00000020: 2a 54 49 71 38 33 29 29 29 50 4c 55 53 2a 3f d8
    00000030: 3f 85 3f e1 3f ff ff ff ff ff ff ff ff ff ff ff
    00000040: ff ff ff ff ff ff ff ff ff ff ff ff ff ff ff ff
    00000050: ff ff ff ff ff ff ff ff ff ff ff ff ff ff ff ff
    00000060: ff ff ff ff ff ff ff ff ff ff ff ff ff ff ff ff
    00000070: ff ff ff ff ff ff ff ff ff ff ff ff ff ff ff ff
    00000080: ff ff ff ff ff ff ff ff ff ff ff ff ff ff ff ff
    00000090: ff ff ff ff ff ff ff ff ff ff ff ff ff ff ff ff
    000000a0: ff ff ff ff ff ff ff ff ff ff ff ff ff ff ff ff
    000000b0: ff ff ff ff ff ff ff ff ff ff ff ff ff ff ff ff
    000000c0: ff ff ff ff ff ff ff ff ff ff ff ff ff ff ff ff
    000000d0: ff ff ff ff ff ff ff ff ff ff ff ff ff ff ff ff
    000000e0: ff ff ff ff ff ff ff ff ff ff ff ff ff ff ff ff
    000000f0: ff ff ff ff ff ff ff ff ff ff ff ff ff ff ff
  UrbLink              = 00000000
[686354 ms] UsbSnoop - DispatchAny(f890e610) : IRP_MJ_INTERNAL_DEVICE_CONTROL
[686354 ms] UsbSnoop - MyDispatchInternalIOCTL(f890fe80) : fdo=81b1aac0, Irp=822d9840, IRQL=2
[686354 ms]  >>>  URB 293 going down  >>> 
-- URB_FUNCTION_BULK_OR_INTERRUPT_TRANSFER:
  PipeHandle           = 822e77f4 [endpoint 0x00000002]
  TransferFlags        = 00000000 (USBD_TRANSFER_DIRECTION_OUT, ~USBD_SHORT_TRANSFER_OK)
  TransferBufferLength = 00000007
  TransferBuffer       = 00000000
  TransferBufferMDL    = 822d87a0
    00000000: 00 00 00 02 05 e0 00
  UrbLink              = 00000000
[686354 ms] UsbSnoop - MyInternalIOCTLCompletion(f890fdb0) : fido=81b19728, Irp=822d9840, Context=822db980, IRQL=2
[686354 ms]  <<<  URB 293 coming back  <<< 
-- URB_FUNCTION_BULK_OR_INTERRUPT_TRANSFER:
  PipeHandle           = 822e77f4 [endpoint 0x00000002]
  TransferFlags        = 00000000 (USBD_TRANSFER_DIRECTION_OUT, ~USBD_SHORT_TRANSFER_OK)
  TransferBufferLength = 00000007
  TransferBuffer       = 00000000
  TransferBufferMDL    = 822d87a0
  UrbLink              = 00000000
[686364 ms] UsbSnoop - DispatchAny(f890e610) : IRP_MJ_INTERNAL_DEVICE_CONTROL
[686364 ms] UsbSnoop - MyDispatchInternalIOCTL(f890fe80) : fdo=81b1aac0, Irp=822d9840, IRQL=2
[686364 ms]  >>>  URB 294 going down  >>> 
-- URB_FUNCTION_BULK_OR_INTERRUPT_TRANSFER:
  PipeHandle           = 822e77d4 [endpoint 0x00000081]
  TransferFlags        = 00000003 (USBD_TRANSFER_DIRECTION_IN, USBD_SHORT_TRANSFER_OK)
  TransferBufferLength = 00000100
  TransferBuffer       = 00000000
  TransferBufferMDL    = 822d87a0
  UrbLink              = 00000000
[686386 ms] UsbSnoop - MyInternalIOCTLCompletion(f890fdb0) : fido=81b19728, Irp=822d9840, Context=81cd51b0, IRQL=2
[686386 ms]  <<<  URB 294 coming back  <<< 
-- URB_FUNCTION_BULK_OR_INTERRUPT_TRANSFER:
  PipeHandle           = 822e77d4 [endpoint 0x00000081]
  TransferFlags        = 00000003 (USBD_TRANSFER_DIRECTION_IN, USBD_SHORT_TRANSFER_OK)
  TransferBufferLength = 000000ff
  TransferBuffer       = 00000000
  TransferBufferMDL    = 822d87a0
    00000000: 00 00 00 fa 03 ff ff ff ff ff ff ff ff ff ff ff
    00000010: ff ff ff ff ff ff ff ff ff ff ff ff ff ff ff ff
    00000020: ff ff ff ff ff ff ff ff ff ff ff ff ff ff ff ff
    00000030: ff ff ff ff ff ff ff ff ff ff ff ff ff ff ff ff
    00000040: ff ff ff ff ff ff ff ff ff ff ff ff ff ff ff ff
    00000050: ff ff ff ff ff ff ff ff ff ff ff ff ff ff ff ff
    00000060: ff ff ff ff ff ff ff ff ff ff ff ff ff ff ff ff
    00000070: ff ff ff ff ff ff ff ff ff ff ff ff ff ff ff ff
    00000080: ff ff ff ff ff ff ff ff ff ff ff ff ff ff ff ff
    00000090: ff ff ff ff ff ff ff ff ff ff ff ff ff ff ff ff
    000000a0: ff ff ff ff ff ff ff ff ff ff ff ff ff ff ff ff
    000000b0: ff ff ff ff ff ff ff ff ff ff ff ff ff ff ff ff
    000000c0: ff ff ff ff ff ff ff ff ff ff ff ff ff ff ff ff
    000000d0: ff ff ff ff ff ff ff ff ff ff ff ff ff ff ff ff
    000000e0: ff ff ff ff ff ff ff ff ff ff ff ff ff ff ff ff
    000000f0: ff ff ff ff ff ff ff ff ff ff ff ff ff ff ff
  UrbLink              = 00000000
[686424 ms] UsbSnoop - DispatchAny(f890e610) : IRP_MJ_INTERNAL_DEVICE_CONTROL
[686424 ms] UsbSnoop - MyDispatchInternalIOCTL(f890fe80) : fdo=81b1aac0, Irp=822d9840, IRQL=2
[686424 ms]  >>>  URB 295 going down  >>> 
-- URB_FUNCTION_BULK_OR_INTERRUPT_TRANSFER:
  PipeHandle           = 822e77f4 [endpoint 0x00000002]
  TransferFlags        = 00000000 (USBD_TRANSFER_DIRECTION_OUT, ~USBD_SHORT_TRANSFER_OK)
  TransferBufferLength = 00000007
  TransferBuffer       = 00000000
  TransferBufferMDL    = 822d87a0
    00000000: 00 00 00 02 05 e0 00
  UrbLink              = 00000000
[686425 ms] UsbSnoop - MyInternalIOCTLCompletion(f890fdb0) : fido=81b19728, Irp=822d9840, Context=81b05970, IRQL=2
[686425 ms]  <<<  URB 295 coming back  <<< 
-- URB_FUNCTION_BULK_OR_INTERRUPT_TRANSFER:
  PipeHandle           = 822e77f4 [endpoint 0x00000002]
  TransferFlags        = 00000000 (USBD_TRANSFER_DIRECTION_OUT, ~USBD_SHORT_TRANSFER_OK)
  TransferBufferLength = 00000007
  TransferBuffer       = 00000000
  TransferBufferMDL    = 822d87a0
  UrbLink              = 00000000
[686434 ms] UsbSnoop - DispatchAny(f890e610) : IRP_MJ_INTERNAL_DEVICE_CONTROL
[686434 ms] UsbSnoop - MyDispatchInternalIOCTL(f890fe80) : fdo=81b1aac0, Irp=822d9840, IRQL=2
[686434 ms]  >>>  URB 296 going down  >>> 
-- URB_FUNCTION_BULK_OR_INTERRUPT_TRANSFER:
  PipeHandle           = 822e77d4 [endpoint 0x00000081]
  TransferFlags        = 00000003 (USBD_TRANSFER_DIRECTION_IN, USBD_SHORT_TRANSFER_OK)
  TransferBufferLength = 00000100
  TransferBuffer       = 00000000
  TransferBufferMDL    = 822d87a0
  UrbLink              = 00000000
[686456 ms] UsbSnoop - MyInternalIOCTLCompletion(f890fdb0) : fido=81b19728, Irp=822d9840, Context=81cd51b0, IRQL=2
[686456 ms]  <<<  URB 296 coming back  <<< 
-- URB_FUNCTION_BULK_OR_INTERRUPT_TRANSFER:
  PipeHandle           = 822e77d4 [endpoint 0x00000081]
  TransferFlags        = 00000003 (USBD_TRANSFER_DIRECTION_IN, USBD_SHORT_TRANSFER_OK)
  TransferBufferLength = 000000ff
  TransferBuffer       = 00000000
  TransferBufferMDL    = 822d87a0
    00000000: 00 00 00 fa 03 ff ff ff ff ff ff ff ff ff ff ff
    00000010: ff ff ff ff ff ff ff ff ff ff ff ff ff ff ff ff
    00000020: ff ff ff ff ff ff ff ff ff ff ff ff ff ff ff ff
    00000030: ff ff ff ff ff ff ff ff ff ff ff ff ff ff ff ff
    00000040: ff ff ff ff ff ff ff ff ff ff ff ff ff ff ff ff
    00000050: ff ff ff ff ff ff ff ff ff ff ff ff ff ff ff ff
    00000060: ff ff ff ff ff ff ff ff ff ff ff ff ff ff ff ff
    00000070: ff ff ff ff ff ff ff ff ff ff ff ff ff ff ff ff
    00000080: ff ff ff ff ff ff ff ff ff ff ff ff ff ff ff ff
    00000090: ff ff ff ff ff ff ff ff ff ff ff ff ff ff ff ff
    000000a0: ff ff ff ff ff ff ff ff ff ff ff ff ff ff ff ff
    000000b0: ff ff ff ff ff ff ff ff ff ff ff ff ff ff ff ff
    000000c0: ff ff ff ff ff ff ff ff ff ff ff ff ff ff ff ff
    000000d0: ff ff ff ff ff ff ff ff ff ff ff ff ff ff ff ff
    000000e0: ff ff ff ff ff ff ff ff ff ff ff ff ff ff ff ff
    000000f0: ff ff ff ff ff ff ff ff ff ff ff ff ff ff ff
  UrbLink              = 00000000
[686494 ms] UsbSnoop - DispatchAny(f890e610) : IRP_MJ_INTERNAL_DEVICE_CONTROL
[686494 ms] UsbSnoop - MyDispatchInternalIOCTL(f890fe80) : fdo=81b1aac0, Irp=822d9840, IRQL=2
[686494 ms]  >>>  URB 297 going down  >>> 
-- URB_FUNCTION_BULK_OR_INTERRUPT_TRANSFER:
  PipeHandle           = 822e77f4 [endpoint 0x00000002]
  TransferFlags        = 00000000 (USBD_TRANSFER_DIRECTION_OUT, ~USBD_SHORT_TRANSFER_OK)
  TransferBufferLength = 00000007
  TransferBuffer       = 00000000
  TransferBufferMDL    = 822d87a0
    00000000: 00 00 00 02 05 e0 00
  UrbLink              = 00000000
[686495 ms] UsbSnoop - MyInternalIOCTLCompletion(f890fdb0) : fido=81b19728, Irp=822d9840, Context=822db980, IRQL=2
[686495 ms]  <<<  URB 297 coming back  <<< 
-- URB_FUNCTION_BULK_OR_INTERRUPT_TRANSFER:
  PipeHandle           = 822e77f4 [endpoint 0x00000002]
  TransferFlags        = 00000000 (USBD_TRANSFER_DIRECTION_OUT, ~USBD_SHORT_TRANSFER_OK)
  TransferBufferLength = 00000007
  TransferBuffer       = 00000000
  TransferBufferMDL    = 822d87a0
  UrbLink              = 00000000
[686504 ms] UsbSnoop - DispatchAny(f890e610) : IRP_MJ_INTERNAL_DEVICE_CONTROL
[686504 ms] UsbSnoop - MyDispatchInternalIOCTL(f890fe80) : fdo=81b1aac0, Irp=822d9840, IRQL=2
[686504 ms]  >>>  URB 298 going down  >>> 
-- URB_FUNCTION_BULK_OR_INTERRUPT_TRANSFER:
  PipeHandle           = 822e77d4 [endpoint 0x00000081]
  TransferFlags        = 00000003 (USBD_TRANSFER_DIRECTION_IN, USBD_SHORT_TRANSFER_OK)
  TransferBufferLength = 00000100
  TransferBuffer       = 00000000
  TransferBufferMDL    = 822d87a0
  UrbLink              = 00000000
[686526 ms] UsbSnoop - MyInternalIOCTLCompletion(f890fdb0) : fido=81b19728, Irp=822d9840, Context=82307cb8, IRQL=2
[686526 ms]  <<<  URB 298 coming back  <<< 
-- URB_FUNCTION_BULK_OR_INTERRUPT_TRANSFER:
  PipeHandle           = 822e77d4 [endpoint 0x00000081]
  TransferFlags        = 00000003 (USBD_TRANSFER_DIRECTION_IN, USBD_SHORT_TRANSFER_OK)
  TransferBufferLength = 000000ff
  TransferBuffer       = 00000000
  TransferBufferMDL    = 822d87a0
    00000000: 00 00 00 fa 03 ff ff ff ff ff ff ff ff ff ff ff
    00000010: ff ff ff ff ff ff ff ff ff ff ff ff ff ff ff ff
    00000020: ff ff ff ff ff ff ff ff ff ff ff ff ff ff ff ff
    00000030: ff ff ff ff ff ff ff ff ff ff ff ff ff ff ff ff
    00000040: ff ff ff ff ff ff ff ff ff ff ff ff ff ff ff ff
    00000050: ff ff ff ff ff ff ff ff ff ff ff ff ff ff ff ff
    00000060: ff ff ff ff ff ff ff ff ff ff ff ff ff ff ff ff
    00000070: ff ff ff ff ff ff ff ff ff ff ff ff ff ff ff ff
    00000080: ff ff ff ff ff ff ff ff ff ff ff ff ff ff ff ff
    00000090: ff ff ff ff ff ff ff ff ff ff ff ff ff ff ff ff
    000000a0: ff ff ff ff ff ff ff ff ff ff ff ff ff ff ff ff
    000000b0: ff ff ff ff ff ff ff ff ff ff ff ff ff ff ff ff
    000000c0: ff ff ff ff ff ff ff ff ff ff ff ff ff ff ff ff
    000000d0: ff ff ff ff ff ff ff ff ff ff ff ff ff ff ff ff
    000000e0: ff ff ff ff ff ff ff ff ff ff ff ff ff ff ff ff
    000000f0: ff ff ff ff ff ff ff ff ff ff ff ff ff ff ff
  UrbLink              = 00000000
[686565 ms] UsbSnoop - DispatchAny(f890e610) : IRP_MJ_INTERNAL_DEVICE_CONTROL
[686565 ms] UsbSnoop - MyDispatchInternalIOCTL(f890fe80) : fdo=81b1aac0, Irp=822d9840, IRQL=2
[686565 ms]  >>>  URB 299 going down  >>> 
-- URB_FUNCTION_BULK_OR_INTERRUPT_TRANSFER:
  PipeHandle           = 822e77f4 [endpoint 0x00000002]
  TransferFlags        = 00000000 (USBD_TRANSFER_DIRECTION_OUT, ~USBD_SHORT_TRANSFER_OK)
  TransferBufferLength = 00000007
  TransferBuffer       = 00000000
  TransferBufferMDL    = 822d87a0
    00000000: 00 00 00 02 05 e0 00
  UrbLink              = 00000000
[686565 ms] UsbSnoop - MyInternalIOCTLCompletion(f890fdb0) : fido=81b19728, Irp=822d9840, Context=81cd51b0, IRQL=2
[686565 ms]  <<<  URB 299 coming back  <<< 
-- URB_FUNCTION_BULK_OR_INTERRUPT_TRANSFER:
  PipeHandle           = 822e77f4 [endpoint 0x00000002]
  TransferFlags        = 00000000 (USBD_TRANSFER_DIRECTION_OUT, ~USBD_SHORT_TRANSFER_OK)
  TransferBufferLength = 00000007
  TransferBuffer       = 00000000
  TransferBufferMDL    = 822d87a0
  UrbLink              = 00000000
[686575 ms] UsbSnoop - DispatchAny(f890e610) : IRP_MJ_INTERNAL_DEVICE_CONTROL
[686575 ms] UsbSnoop - MyDispatchInternalIOCTL(f890fe80) : fdo=81b1aac0, Irp=822d9840, IRQL=2
[686575 ms]  >>>  URB 300 going down  >>> 
-- URB_FUNCTION_BULK_OR_INTERRUPT_TRANSFER:
  PipeHandle           = 822e77d4 [endpoint 0x00000081]
  TransferFlags        = 00000003 (USBD_TRANSFER_DIRECTION_IN, USBD_SHORT_TRANSFER_OK)
  TransferBufferLength = 00000100
  TransferBuffer       = 00000000
  TransferBufferMDL    = 822d87a0
  UrbLink              = 00000000
[686596 ms] UsbSnoop - MyInternalIOCTLCompletion(f890fdb0) : fido=81b19728, Irp=822d9840, Context=82307cb8, IRQL=2
[686596 ms]  <<<  URB 300 coming back  <<< 
-- URB_FUNCTION_BULK_OR_INTERRUPT_TRANSFER:
  PipeHandle           = 822e77d4 [endpoint 0x00000081]
  TransferFlags        = 00000003 (USBD_TRANSFER_DIRECTION_IN, USBD_SHORT_TRANSFER_OK)
  TransferBufferLength = 000000ff
  TransferBuffer       = 00000000
  TransferBufferMDL    = 822d87a0
    00000000: 00 00 00 fa 03 ff ff ff ff ff ff ff ff ff ff ff
    00000010: ff ff ff ff ff ff ff ff ff ff ff ff ff ff ff ff
    00000020: ff ff ff ff ff ff ff ff ff ff ff ff ff ff ff ff
    00000030: ff ff ff ff ff ff ff ff ff ff ff ff ff ff ff ff
    00000040: ff ff ff ff ff ff ff ff ff ff ff ff ff ff ff ff
    00000050: ff ff ff ff ff ff ff ff ff ff ff ff ff ff ff ff
    00000060: ff ff ff ff ff ff ff ff ff ff ff ff ff ff ff ff
    00000070: ff ff ff ff ff ff ff ff ff ff ff ff ff ff ff ff
    00000080: ff ff ff ff ff ff ff ff ff ff ff ff ff ff ff ff
    00000090: ff ff ff ff ff ff ff ff ff ff ff ff ff ff ff ff
    000000a0: ff ff ff ff ff ff ff ff ff ff ff ff ff ff ff ff
    000000b0: ff ff ff ff ff ff ff ff ff ff ff ff ff ff ff ff
    000000c0: ff ff ff ff ff ff ff ff ff ff ff ff ff ff ff ff
    000000d0: ff ff ff ff ff ff ff ff ff ff ff ff ff ff ff ff
    000000e0: ff ff ff ff ff ff ff ff ff ff ff ff ff ff ff ff
    000000f0: ff ff ff ff ff ff ff ff ff ff ff ff ff ff ff
  UrbLink              = 00000000
[686635 ms] UsbSnoop - DispatchAny(f890e610) : IRP_MJ_INTERNAL_DEVICE_CONTROL
[686635 ms] UsbSnoop - MyDispatchInternalIOCTL(f890fe80) : fdo=81b1aac0, Irp=822d9840, IRQL=2
[686635 ms]  >>>  URB 301 going down  >>> 
-- URB_FUNCTION_BULK_OR_INTERRUPT_TRANSFER:
  PipeHandle           = 822e77f4 [endpoint 0x00000002]
  TransferFlags        = 00000000 (USBD_TRANSFER_DIRECTION_OUT, ~USBD_SHORT_TRANSFER_OK)
  TransferBufferLength = 00000007
  TransferBuffer       = 00000000
  TransferBufferMDL    = 822d87a0
    00000000: 00 00 00 02 05 e0 00
  UrbLink              = 00000000
[686635 ms] UsbSnoop - MyInternalIOCTLCompletion(f890fdb0) : fido=81b19728, Irp=822d9840, Context=81b05970, IRQL=2
[686635 ms]  <<<  URB 301 coming back  <<< 
-- URB_FUNCTION_BULK_OR_INTERRUPT_TRANSFER:
  PipeHandle           = 822e77f4 [endpoint 0x00000002]
  TransferFlags        = 00000000 (USBD_TRANSFER_DIRECTION_OUT, ~USBD_SHORT_TRANSFER_OK)
  TransferBufferLength = 00000007
  TransferBuffer       = 00000000
  TransferBufferMDL    = 822d87a0
  UrbLink              = 00000000
[686645 ms] UsbSnoop - DispatchAny(f890e610) : IRP_MJ_INTERNAL_DEVICE_CONTROL
[686645 ms] UsbSnoop - MyDispatchInternalIOCTL(f890fe80) : fdo=81b1aac0, Irp=822d9840, IRQL=2
[686645 ms]  >>>  URB 302 going down  >>> 
-- URB_FUNCTION_BULK_OR_INTERRUPT_TRANSFER:
  PipeHandle           = 822e77d4 [endpoint 0x00000081]
  TransferFlags        = 00000003 (USBD_TRANSFER_DIRECTION_IN, USBD_SHORT_TRANSFER_OK)
  TransferBufferLength = 00000100
  TransferBuffer       = 00000000
  TransferBufferMDL    = 822d87a0
  UrbLink              = 00000000
[686666 ms] UsbSnoop - MyInternalIOCTLCompletion(f890fdb0) : fido=81b19728, Irp=822d9840, Context=82307cb8, IRQL=2
[686666 ms]  <<<  URB 302 coming back  <<< 
-- URB_FUNCTION_BULK_OR_INTERRUPT_TRANSFER:
  PipeHandle           = 822e77d4 [endpoint 0x00000081]
  TransferFlags        = 00000003 (USBD_TRANSFER_DIRECTION_IN, USBD_SHORT_TRANSFER_OK)
  TransferBufferLength = 000000ff
  TransferBuffer       = 00000000
  TransferBufferMDL    = 822d87a0
    00000000: 00 00 00 fa 03 ff ff ff ff ff ff ff ff ff ff ff
    00000010: ff ff ff ff ff ff ff ff ff ff ff ff ff ff ff ff
    00000020: ff ff ff ff ff ff ff ff ff ff ff ff ff ff ff ff
    00000030: ff ff ff ff ff ff ff ff ff ff ff ff ff ff ff ff
    00000040: ff ff ff ff ff ff ff ff ff ff ff ff ff ff ff ff
    00000050: ff ff ff ff ff ff ff ff ff ff ff ff ff ff ff ff
    00000060: ff ff ff ff ff ff ff ff ff ff ff ff ff ff ff ff
    00000070: ff ff ff ff ff ff ff ff ff ff ff ff ff ff ff ff
    00000080: ff ff ff ff ff ff ff ff ff ff ff ff ff ff ff ff
    00000090: ff ff ff ff ff ff ff ff ff ff ff ff ff ff ff ff
    000000a0: ff ff ff ff ff ff ff ff ff ff ff ff ff ff ff ff
    000000b0: ff ff ff ff ff ff ff ff ff ff ff ff ff ff ff ff
    000000c0: ff ff ff ff ff ff ff ff ff ff ff ff ff ff ff ff
    000000d0: ff ff ff ff ff ff ff ff ff ff ff ff ff ff ff ff
    000000e0: ff ff ff ff ff ff ff ff ff ff ff ff ff ff ff ff
    000000f0: ff ff ff ff ff ff ff ff ff ff ff ff ff ff ff
  UrbLink              = 00000000
[686705 ms] UsbSnoop - DispatchAny(f890e610) : IRP_MJ_INTERNAL_DEVICE_CONTROL
[686705 ms] UsbSnoop - MyDispatchInternalIOCTL(f890fe80) : fdo=81b1aac0, Irp=822d9840, IRQL=2
[686705 ms]  >>>  URB 303 going down  >>> 
-- URB_FUNCTION_BULK_OR_INTERRUPT_TRANSFER:
  PipeHandle           = 822e77f4 [endpoint 0x00000002]
  TransferFlags        = 00000000 (USBD_TRANSFER_DIRECTION_OUT, ~USBD_SHORT_TRANSFER_OK)
  TransferBufferLength = 00000007
  TransferBuffer       = 00000000
  TransferBufferMDL    = 822d87a0
    00000000: 00 00 00 02 05 e0 00
  UrbLink              = 00000000
[686705 ms] UsbSnoop - MyInternalIOCTLCompletion(f890fdb0) : fido=81b19728, Irp=822d9840, Context=81cd51b0, IRQL=2
[686705 ms]  <<<  URB 303 coming back  <<< 
-- URB_FUNCTION_BULK_OR_INTERRUPT_TRANSFER:
  PipeHandle           = 822e77f4 [endpoint 0x00000002]
  TransferFlags        = 00000000 (USBD_TRANSFER_DIRECTION_OUT, ~USBD_SHORT_TRANSFER_OK)
  TransferBufferLength = 00000007
  TransferBuffer       = 00000000
  TransferBufferMDL    = 822d87a0
  UrbLink              = 00000000
[686715 ms] UsbSnoop - DispatchAny(f890e610) : IRP_MJ_INTERNAL_DEVICE_CONTROL
[686715 ms] UsbSnoop - MyDispatchInternalIOCTL(f890fe80) : fdo=81b1aac0, Irp=822d9840, IRQL=2
[686715 ms]  >>>  URB 304 going down  >>> 
-- URB_FUNCTION_BULK_OR_INTERRUPT_TRANSFER:
  PipeHandle           = 822e77d4 [endpoint 0x00000081]
  TransferFlags        = 00000003 (USBD_TRANSFER_DIRECTION_IN, USBD_SHORT_TRANSFER_OK)
  TransferBufferLength = 00000100
  TransferBuffer       = 00000000
  TransferBufferMDL    = 822d87a0
  UrbLink              = 00000000
[686736 ms] UsbSnoop - MyInternalIOCTLCompletion(f890fdb0) : fido=81b19728, Irp=822d9840, Context=822e2150, IRQL=2
[686736 ms]  <<<  URB 304 coming back  <<< 
-- URB_FUNCTION_BULK_OR_INTERRUPT_TRANSFER:
  PipeHandle           = 822e77d4 [endpoint 0x00000081]
  TransferFlags        = 00000003 (USBD_TRANSFER_DIRECTION_IN, USBD_SHORT_TRANSFER_OK)
  TransferBufferLength = 000000ff
  TransferBuffer       = 00000000
  TransferBufferMDL    = 822d87a0
    00000000: 00 00 00 fa 03 ff ff ff ff ff ff ff ff ff ff ff
    00000010: ff ff ff ff ff ff ff ff ff ff ff ff ff ff ff ff
    00000020: ff ff ff ff ff ff ff ff ff ff ff ff ff ff ff ff
    00000030: ff ff ff ff ff ff ff ff ff ff ff ff ff ff ff ff
    00000040: ff ff ff ff ff ff ff ff ff ff ff ff ff ff ff ff
    00000050: ff ff ff ff ff ff ff ff ff ff ff ff ff ff ff ff
    00000060: ff ff ff ff ff ff ff ff ff ff ff ff ff ff ff ff
    00000070: ff ff ff ff ff ff ff ff ff ff ff ff ff ff ff ff
    00000080: ff ff ff ff ff ff ff ff ff ff ff ff ff ff ff ff
    00000090: ff ff ff ff ff ff ff ff ff ff ff ff ff ff ff ff
    000000a0: ff ff ff ff ff ff ff ff ff ff ff ff ff ff ff ff
    000000b0: ff ff ff ff ff ff ff ff ff ff ff ff ff ff ff ff
    000000c0: ff ff ff ff ff ff ff ff ff ff ff ff ff ff ff ff
    000000d0: ff ff ff ff ff ff ff ff ff ff ff ff ff ff ff ff
    000000e0: ff ff ff ff ff ff ff ff ff ff ff ff ff ff ff ff
    000000f0: ff ff ff ff ff ff ff ff ff ff ff ff ff ff ff
  UrbLink              = 00000000
[686776 ms] UsbSnoop - DispatchAny(f890e610) : IRP_MJ_INTERNAL_DEVICE_CONTROL
[686776 ms] UsbSnoop - MyDispatchInternalIOCTL(f890fe80) : fdo=81b1aac0, Irp=822d9840, IRQL=2
[686776 ms]  >>>  URB 305 going down  >>> 
-- URB_FUNCTION_BULK_OR_INTERRUPT_TRANSFER:
  PipeHandle           = 822e77f4 [endpoint 0x00000002]
  TransferFlags        = 00000000 (USBD_TRANSFER_DIRECTION_OUT, ~USBD_SHORT_TRANSFER_OK)
  TransferBufferLength = 00000007
  TransferBuffer       = 00000000
  TransferBufferMDL    = 822d87a0
    00000000: 00 00 00 02 05 e0 00
  UrbLink              = 00000000
[686776 ms] UsbSnoop - MyInternalIOCTLCompletion(f890fdb0) : fido=81b19728, Irp=822d9840, Context=82307cb8, IRQL=2
[686776 ms]  <<<  URB 305 coming back  <<< 
-- URB_FUNCTION_BULK_OR_INTERRUPT_TRANSFER:
  PipeHandle           = 822e77f4 [endpoint 0x00000002]
  TransferFlags        = 00000000 (USBD_TRANSFER_DIRECTION_OUT, ~USBD_SHORT_TRANSFER_OK)
  TransferBufferLength = 00000007
  TransferBuffer       = 00000000
  TransferBufferMDL    = 822d87a0
  UrbLink              = 00000000
[686785 ms] UsbSnoop - DispatchAny(f890e610) : IRP_MJ_INTERNAL_DEVICE_CONTROL
[686785 ms] UsbSnoop - MyDispatchInternalIOCTL(f890fe80) : fdo=81b1aac0, Irp=822d9840, IRQL=2
[686785 ms]  >>>  URB 306 going down  >>> 
-- URB_FUNCTION_BULK_OR_INTERRUPT_TRANSFER:
  PipeHandle           = 822e77d4 [endpoint 0x00000081]
  TransferFlags        = 00000003 (USBD_TRANSFER_DIRECTION_IN, USBD_SHORT_TRANSFER_OK)
  TransferBufferLength = 00000100
  TransferBuffer       = 00000000
  TransferBufferMDL    = 822d87a0
  UrbLink              = 00000000
[686807 ms] UsbSnoop - MyInternalIOCTLCompletion(f890fdb0) : fido=81b19728, Irp=822d9840, Context=822e2150, IRQL=2
[686807 ms]  <<<  URB 306 coming back  <<< 
-- URB_FUNCTION_BULK_OR_INTERRUPT_TRANSFER:
  PipeHandle           = 822e77d4 [endpoint 0x00000081]
  TransferFlags        = 00000003 (USBD_TRANSFER_DIRECTION_IN, USBD_SHORT_TRANSFER_OK)
  TransferBufferLength = 000000ff
  TransferBuffer       = 00000000
  TransferBufferMDL    = 822d87a0
    00000000: 00 00 00 fa 03 ff ff ff ff ff ff ff ff ff ff ff
    00000010: ff ff ff ff ff ff ff ff ff ff ff ff ff ff ff ff
    00000020: ff ff ff ff ff ff ff ff ff ff ff ff ff ff ff ff
    00000030: ff ff ff ff ff ff ff ff ff ff ff ff ff ff ff ff
    00000040: ff ff ff ff ff ff ff ff ff ff ff ff ff ff ff ff
    00000050: ff ff ff ff ff ff ff ff ff ff ff ff ff ff ff ff
    00000060: ff ff ff ff ff ff ff ff ff ff ff ff ff ff ff ff
    00000070: ff ff ff ff ff ff ff ff ff ff ff ff ff ff ff ff
    00000080: ff ff ff ff ff ff ff ff ff ff ff ff ff ff ff ff
    00000090: ff ef 9b 4a c9 ef e3 44 c9 f5 7e 23 66 6f f1 c9
    000000a0: ed b0 c9 48 45 41 54 00 84 03 08 36 2b 30 09 04
    000000b0: 5d 00 3e e7 5d 00 11 3f 31 04 63 0a 3e 32 04 63
    000000c0: 0b 3e 31 04 63 0c 3e 32 04 63 0d 3f 7e 0b 3f 7e
    000000d0: 09 3f 7e 0d 3f ea 3f 97 3f 85 3f 93 31 2b 31 36
    000000e0: 2b 2a 54 45 58 41 53 29 29 49 4e 53 54 52 55 4d
    000000f0: 45 4e 54 53 2a 11 3f 93 38 2b 33 30 2b 2a 43
  UrbLink              = 00000000
[686845 ms] UsbSnoop - DispatchAny(f890e610) : IRP_MJ_INTERNAL_DEVICE_CONTROL
[686845 ms] UsbSnoop - MyDispatchInternalIOCTL(f890fe80) : fdo=81b1aac0, Irp=822d9840, IRQL=2
[686845 ms]  >>>  URB 307 going down  >>> 
-- URB_FUNCTION_BULK_OR_INTERRUPT_TRANSFER:
  PipeHandle           = 822e77f4 [endpoint 0x00000002]
  TransferFlags        = 00000000 (USBD_TRANSFER_DIRECTION_OUT, ~USBD_SHORT_TRANSFER_OK)
  TransferBufferLength = 00000007
  TransferBuffer       = 00000000
  TransferBufferMDL    = 822d87a0
    00000000: 00 00 00 02 05 e0 00
  UrbLink              = 00000000
[686845 ms] UsbSnoop - MyInternalIOCTLCompletion(f890fdb0) : fido=81b19728, Irp=822d9840, Context=81b05970, IRQL=2
[686845 ms]  <<<  URB 307 coming back  <<< 
-- URB_FUNCTION_BULK_OR_INTERRUPT_TRANSFER:
  PipeHandle           = 822e77f4 [endpoint 0x00000002]
  TransferFlags        = 00000000 (USBD_TRANSFER_DIRECTION_OUT, ~USBD_SHORT_TRANSFER_OK)
  TransferBufferLength = 00000007
  TransferBuffer       = 00000000
  TransferBufferMDL    = 822d87a0
  UrbLink              = 00000000
[686855 ms] UsbSnoop - DispatchAny(f890e610) : IRP_MJ_INTERNAL_DEVICE_CONTROL
[686855 ms] UsbSnoop - MyDispatchInternalIOCTL(f890fe80) : fdo=81b1aac0, Irp=822d9840, IRQL=2
[686855 ms]  >>>  URB 308 going down  >>> 
-- URB_FUNCTION_BULK_OR_INTERRUPT_TRANSFER:
  PipeHandle           = 822e77d4 [endpoint 0x00000081]
  TransferFlags        = 00000003 (USBD_TRANSFER_DIRECTION_IN, USBD_SHORT_TRANSFER_OK)
  TransferBufferLength = 00000100
  TransferBuffer       = 00000000
  TransferBufferMDL    = 822d87a0
  UrbLink              = 00000000
[686876 ms] UsbSnoop - MyInternalIOCTLCompletion(f890fdb0) : fido=81b19728, Irp=822d9840, Context=822e2150, IRQL=2
[686876 ms]  <<<  URB 308 coming back  <<< 
-- URB_FUNCTION_BULK_OR_INTERRUPT_TRANSFER:
  PipeHandle           = 822e77d4 [endpoint 0x00000081]
  TransferFlags        = 00000003 (USBD_TRANSFER_DIRECTION_IN, USBD_SHORT_TRANSFER_OK)
  TransferBufferLength = 000000ff
  TransferBuffer       = 00000000
  TransferBufferMDL    = 822d87a0
    00000000: 00 00 00 fa 03 42 4c 29 29 29 53 59 53 54 45 4d
    00000010: 2a 11 3f 93 31 35 2b 31 30 2b 2a 45 58 50 45 52
    00000020: 49 4d 45 4e 54 29 29 29 57 4f 52 4b 42 4f 4f 4b
    00000030: 2a 11 3f 93 32 39 2b 33 32 2b 2a 48 45 41 54 29
    00000040: 29 29 56 32 3a 30 2a 11 3f 93 33 36 2b 31 38 2b
    00000050: 2a 10 45 58 50 45 52 49 4d 45 4e 54 29 29 29 4d
    00000060: 35 11 2a 11 3f 93 35 30 2b 31 39 2b 2a 50 52 45
    00000070: 53 53 29 29 29 06 45 4e 54 45 52 07 29 29 29 4f
    00000080: 4e 2a 3f 93 35 37 2b 32 38 2b 2a 54 49 71 38 33
    00000090: 29 29 29 50 4c 55 53 2a 3f d8 3f e1 3f de 2a 54
    000000a0: 55 52 4e 29 4f 4e 29 54 48 45 29 43 42 4c 3a 2a
    000000b0: 3f e0 34 2b 31 30 2b 2a 06 45 4e 54 45 52 07 2a
    000000c0: 11 3f d8 3f 75 3f e1 3f de 2a 4e 4f 57 29 43 48
    000000d0: 45 43 4b 49 4e 47 29 54 48 45 2a 3f de 2a 43 41
    000000e0: 4c 43 55 4c 41 54 4f 52 71 43 42 4c 2a 3f de 2a
    000000f0: 4c 49 4e 4b 29 43 4f 4e 4e 45 43 54 49 4f 4e
  UrbLink              = 00000000
[686915 ms] UsbSnoop - DispatchAny(f890e610) : IRP_MJ_INTERNAL_DEVICE_CONTROL
[686915 ms] UsbSnoop - MyDispatchInternalIOCTL(f890fe80) : fdo=81b1aac0, Irp=822d9840, IRQL=2
[686915 ms]  >>>  URB 309 going down  >>> 
-- URB_FUNCTION_BULK_OR_INTERRUPT_TRANSFER:
  PipeHandle           = 822e77f4 [endpoint 0x00000002]
  TransferFlags        = 00000000 (USBD_TRANSFER_DIRECTION_OUT, ~USBD_SHORT_TRANSFER_OK)
  TransferBufferLength = 00000007
  TransferBuffer       = 00000000
  TransferBufferMDL    = 822d87a0
    00000000: 00 00 00 02 05 e0 00
  UrbLink              = 00000000
[686915 ms] UsbSnoop - MyInternalIOCTLCompletion(f890fdb0) : fido=81b19728, Irp=822d9840, Context=82307cb8, IRQL=2
[686915 ms]  <<<  URB 309 coming back  <<< 
-- URB_FUNCTION_BULK_OR_INTERRUPT_TRANSFER:
  PipeHandle           = 822e77f4 [endpoint 0x00000002]
  TransferFlags        = 00000000 (USBD_TRANSFER_DIRECTION_OUT, ~USBD_SHORT_TRANSFER_OK)
  TransferBufferLength = 00000007
  TransferBuffer       = 00000000
  TransferBufferMDL    = 822d87a0
  UrbLink              = 00000000
[686925 ms] UsbSnoop - DispatchAny(f890e610) : IRP_MJ_INTERNAL_DEVICE_CONTROL
[686925 ms] UsbSnoop - MyDispatchInternalIOCTL(f890fe80) : fdo=81b1aac0, Irp=822d9840, IRQL=2
[686925 ms]  >>>  URB 310 going down  >>> 
-- URB_FUNCTION_BULK_OR_INTERRUPT_TRANSFER:
  PipeHandle           = 822e77d4 [endpoint 0x00000081]
  TransferFlags        = 00000003 (USBD_TRANSFER_DIRECTION_IN, USBD_SHORT_TRANSFER_OK)
  TransferBufferLength = 00000100
  TransferBuffer       = 00000000
  TransferBufferMDL    = 822d87a0
  UrbLink              = 00000000
[686946 ms] UsbSnoop - MyInternalIOCTLCompletion(f890fdb0) : fido=81b19728, Irp=822d9840, Context=821aa3a8, IRQL=2
[686947 ms]  <<<  URB 310 coming back  <<< 
-- URB_FUNCTION_BULK_OR_INTERRUPT_TRANSFER:
  PipeHandle           = 822e77d4 [endpoint 0x00000081]
  TransferFlags        = 00000003 (USBD_TRANSFER_DIRECTION_IN, USBD_SHORT_TRANSFER_OK)
  TransferBufferLength = 000000ff
  TransferBuffer       = 00000000
  TransferBufferMDL    = 822d87a0
    00000000: 00 00 00 fa 03 3a 2a 3f de 2a 50 4c 45 41 53 45
    00000010: 29 57 41 49 54 3a 3a 3a 3a 2a 3f 08 31 2b 30 09
    00000020: 04 5d 00 3f e7 5d 00 11 3f 08 30 09 04 5d 01 3f
    00000030: d6 4d 3f 08 37 09 04 5d 00 3f e7 5d 00 11 3f e8
    00000040: 5d 01 11 3f ce b5 5d 01 11 6a 31 40 5d 01 10 31
    00000050: 11 6a 30 3f cf 3f e1 3f de 2a 82 82 82 4c 49 4e
    00000060: 4b 29 45 52 52 4f 52 82 82 82 2a 3f de 2a 50 55
    00000070: 53 48 29 49 4e 29 54 48 45 29 4c 49 4e 4b 2a 3f
    00000080: de 2a 43 4f 52 44 29 43 4f 4e 4e 45 43 54 4f 52
    00000090: 53 2a 3f de 2a 46 49 52 4d 4c 59 29 54 48 45 4e
    000000a0: 29 48 49 54 2a 3f de 2a 06 45 4e 54 45 52 07 3a
    000000b0: 2a 3f d8 3f d7 4d 3f d4 3f de 2a 2a 3f e0 36 2b
    000000c0: 31 2b 2a 29 29 53 54 41 54 55 53 3e 29 4f 3a 4b
    000000d0: 3a 2a 3f e0 38 2b 31 30 2b 2a 06 45 4e 54 45 52
    000000e0: 07 2a 11 3f d8 3f 76 3f e1 3f 85 3f 7e 08 3f 85
    000000f0: 3f fa 5d 02 2b 5d 03 3f b0 31 30 04 63 0c 3f
  UrbLink              = 00000000
[686985 ms] UsbSnoop - DispatchAny(f890e610) : IRP_MJ_INTERNAL_DEVICE_CONTROL
[686985 ms] UsbSnoop - MyDispatchInternalIOCTL(f890fe80) : fdo=81b1aac0, Irp=822d9840, IRQL=2
[686985 ms]  >>>  URB 311 going down  >>> 
-- URB_FUNCTION_BULK_OR_INTERRUPT_TRANSFER:
  PipeHandle           = 822e77f4 [endpoint 0x00000002]
  TransferFlags        = 00000000 (USBD_TRANSFER_DIRECTION_OUT, ~USBD_SHORT_TRANSFER_OK)
  TransferBufferLength = 00000007
  TransferBuffer       = 00000000
  TransferBufferMDL    = 822d87a0
    00000000: 00 00 00 02 05 e0 00
  UrbLink              = 00000000
[686985 ms] UsbSnoop - MyInternalIOCTLCompletion(f890fdb0) : fido=81b19728, Irp=822d9840, Context=822e2150, IRQL=2
[686985 ms]  <<<  URB 311 coming back  <<< 
-- URB_FUNCTION_BULK_OR_INTERRUPT_TRANSFER:
  PipeHandle           = 822e77f4 [endpoint 0x00000002]
  TransferFlags        = 00000000 (USBD_TRANSFER_DIRECTION_OUT, ~USBD_SHORT_TRANSFER_OK)
  TransferBufferLength = 00000007
  TransferBuffer       = 00000000
  TransferBufferMDL    = 822d87a0
  UrbLink              = 00000000
[686995 ms] UsbSnoop - DispatchAny(f890e610) : IRP_MJ_INTERNAL_DEVICE_CONTROL
[686995 ms] UsbSnoop - MyDispatchInternalIOCTL(f890fe80) : fdo=81b1aac0, Irp=822d9840, IRQL=2
[686995 ms]  >>>  URB 312 going down  >>> 
-- URB_FUNCTION_BULK_OR_INTERRUPT_TRANSFER:
  PipeHandle           = 822e77d4 [endpoint 0x00000081]
  TransferFlags        = 00000003 (USBD_TRANSFER_DIRECTION_IN, USBD_SHORT_TRANSFER_OK)
  TransferBufferLength = 00000100
  TransferBuffer       = 00000000
  TransferBufferMDL    = 822d87a0
  UrbLink              = 00000000
[687016 ms] UsbSnoop - MyInternalIOCTLCompletion(f890fdb0) : fido=81b19728, Irp=822d9840, Context=821aa3a8, IRQL=2
[687016 ms]  <<<  URB 312 coming back  <<< 
-- URB_FUNCTION_BULK_OR_INTERRUPT_TRANSFER:
  PipeHandle           = 822e77d4 [endpoint 0x00000081]
  TransferFlags        = 00000003 (USBD_TRANSFER_DIRECTION_IN, USBD_SHORT_TRANSFER_OK)
  TransferBufferLength = 000000ff
  TransferBuffer       = 00000000
  TransferBufferMDL    = 822d87a0
    00000000: 00 00 00 fa 03 39 30 04 63 0d 3f 31 30 04 63 03
    00000010: 3f 08 36 2b 30 09 04 5d 00 3f e7 5d 00 11 3f 08
    00000020: 31 2b 30 09 04 5d 00 3f e7 5d 00 11 3f 08 31 2b
    00000030: 31 2b 31 09 04 5d 00 3f e7 5d 00 11 3f 33 36 04
    00000040: b5 5d 02 3f 33 36 04 b5 5d 03 3f d6 4c 3f e1 3f
    00000050: de 2a 48 4f 57 29 4d 55 43 48 29 54 49 4d 45 2a
    00000060: 3f de 2a 42 45 54 57 45 45 4e 29 50 4f 49 4e 54
    00000070: 53 2a 3f de 2a 49 4e 29 53 45 43 4f 4e 44 53 af
    00000080: 2a 3f dc 54 3f ce 54 6d 30 3e d7 4c 3f b0 32 82
    00000090: 54 04 63 0a 3f 33 36 82 54 04 63 0b 3f 54 04 63
    000000a0: 02 3f 23 49 2b 49 2b 54 2b 33 36 82 54 2b 54 11
    000000b0: 04 5d 02 3f e1 3f de 2a 50 52 45 53 53 29 45 4e
    000000c0: 54 45 52 2a 3f de 2a 54 4f 29 53 54 41 52 54 2a
    000000d0: 3f d8 3f e1 3f 08 33 2b 54 2b b0 31 2b 30 09 04
    000000e0: 5d 00 3f e7 5d 00 11 3f d3 49 2b 31 2b 33 36 2b
    000000f0: 31 11 3f e8 5d 03 10 49 11 11 3f 9e 5d 02 10
  UrbLink              = 00000000
[687055 ms] UsbSnoop - DispatchAny(f890e610) : IRP_MJ_INTERNAL_DEVICE_CONTROL
[687055 ms] UsbSnoop - MyDispatchInternalIOCTL(f890fe80) : fdo=81b1aac0, Irp=822d9840, IRQL=2
[687055 ms]  >>>  URB 313 going down  >>> 
-- URB_FUNCTION_BULK_OR_INTERRUPT_TRANSFER:
  PipeHandle           = 822e77f4 [endpoint 0x00000002]
  TransferFlags        = 00000000 (USBD_TRANSFER_DIRECTION_OUT, ~USBD_SHORT_TRANSFER_OK)
  TransferBufferLength = 00000007
  TransferBuffer       = 00000000
  TransferBufferMDL    = 822d87a0
    00000000: 00 00 00 02 05 e0 00
  UrbLink              = 00000000
[687055 ms] UsbSnoop - MyInternalIOCTLCompletion(f890fdb0) : fido=81b19728, Irp=822d9840, Context=81b05970, IRQL=2
[687056 ms]  <<<  URB 313 coming back  <<< 
-- URB_FUNCTION_BULK_OR_INTERRUPT_TRANSFER:
  PipeHandle           = 822e77f4 [endpoint 0x00000002]
  TransferFlags        = 00000000 (USBD_TRANSFER_DIRECTION_OUT, ~USBD_SHORT_TRANSFER_OK)
  TransferBufferLength = 00000007
  TransferBuffer       = 00000000
  TransferBufferMDL    = 822d87a0
  UrbLink              = 00000000
[687065 ms] UsbSnoop - DispatchAny(f890e610) : IRP_MJ_INTERNAL_DEVICE_CONTROL
[687065 ms] UsbSnoop - MyDispatchInternalIOCTL(f890fe80) : fdo=81b1aac0, Irp=822d9840, IRQL=2
[687065 ms]  >>>  URB 314 going down  >>> 
-- URB_FUNCTION_BULK_OR_INTERRUPT_TRANSFER:
  PipeHandle           = 822e77d4 [endpoint 0x00000081]
  TransferFlags        = 00000003 (USBD_TRANSFER_DIRECTION_IN, USBD_SHORT_TRANSFER_OK)
  TransferBufferLength = 00000100
  TransferBuffer       = 00000000
  TransferBufferMDL    = 822d87a0
  UrbLink              = 00000000
[687087 ms] UsbSnoop - MyInternalIOCTLCompletion(f890fdb0) : fido=81b19728, Irp=822d9840, Context=821aa3a8, IRQL=2
[687087 ms]  <<<  URB 314 coming back  <<< 
-- URB_FUNCTION_BULK_OR_INTERRUPT_TRANSFER:
  PipeHandle           = 822e77d4 [endpoint 0x00000081]
  TransferFlags        = 00000003 (USBD_TRANSFER_DIRECTION_IN, USBD_SHORT_TRANSFER_OK)
  TransferBufferLength = 000000ff
  TransferBuffer       = 00000000
  TransferBufferMDL    = 822d87a0
    00000000: 00 00 00 fa 03 49 11 2b 5d 03 10 49 11 11 3f d4
    00000010: 3f e1 3f ec fe 2b 5d 02 2b 5d 03 2b 81 11 3f df
    00000020: 3f 93 36 2b 31 30 2b 2a 54 45 4d 50 10 43 11 2a
    00000030: 11 3f 93 35 31 2b 36 38 2b 2a 54 49 4d 45 10 53
    00000040: 11 2a 11 3f 84 3f 48 49 4b 45 52 00 71 03 08 36
    00000050: 2b 30 09 04 5d 00 3e e7 5d 00 11 3f 31 04 63 0a
    00000060: 3e 32 04 63 0b 3e 31 04 63 0c 3e 32 04 63 0d 3f
    00000070: 7e 0b 3f 7e 09 3f 7e 0d 3f ea 3f 97 3f 85 3f 93
    00000080: 31 2b 31 36 2b 2a 54 45 58 41 53 29 29 49 4e 53
    00000090: 54 52 55 4d 45 4e 54 53 2a 11 3f 93 38 2b 33 30
    000000a0: 2b 2a 43 42 4c 29 29 29 53 59 53 54 45 4d 2a 11
    000000b0: 3f 93 31 35 2b 31 30 2b 2a 45 58 50 45 52 49 4d
    000000c0: 45 4e 54 29 29 29 57 4f 52 4b 42 4f 4f 4b 2a 11
    000000d0: 3f 93 32 39 2b 33 30 2b 2a 48 49 4b 45 52 29 29
    000000e0: 29 56 32 3a 30 2a 11 3f 93 33 36 2b 31 38 2b 2a
    000000f0: 10 45 58 50 45 52 49 4d 45 4e 54 29 29 29 4d
  UrbLink              = 00000000
[687115 ms] UsbSnoop - DispatchAny(f890e610) : IRP_MJ_INTERNAL_DEVICE_CONTROL
[687115 ms] UsbSnoop - MyDispatchInternalIOCTL(f890fe80) : fdo=81b1aac0, Irp=822d9840, IRQL=2
[687115 ms]  >>>  URB 315 going down  >>> 
-- URB_FUNCTION_BULK_OR_INTERRUPT_TRANSFER:
  PipeHandle           = 822e77f4 [endpoint 0x00000002]
  TransferFlags        = 00000000 (USBD_TRANSFER_DIRECTION_OUT, ~USBD_SHORT_TRANSFER_OK)
  TransferBufferLength = 00000007
  TransferBuffer       = 00000000
  TransferBufferMDL    = 822d87a0
    00000000: 00 00 00 02 05 e0 00
  UrbLink              = 00000000
[687116 ms] UsbSnoop - MyInternalIOCTLCompletion(f890fdb0) : fido=81b19728, Irp=822d9840, Context=822e2150, IRQL=2
[687116 ms]  <<<  URB 315 coming back  <<< 
-- URB_FUNCTION_BULK_OR_INTERRUPT_TRANSFER:
  PipeHandle           = 822e77f4 [endpoint 0x00000002]
  TransferFlags        = 00000000 (USBD_TRANSFER_DIRECTION_OUT, ~USBD_SHORT_TRANSFER_OK)
  TransferBufferLength = 00000007
  TransferBuffer       = 00000000
  TransferBufferMDL    = 822d87a0
  UrbLink              = 00000000
[687125 ms] UsbSnoop - DispatchAny(f890e610) : IRP_MJ_INTERNAL_DEVICE_CONTROL
[687125 ms] UsbSnoop - MyDispatchInternalIOCTL(f890fe80) : fdo=81b1aac0, Irp=822d9840, IRQL=2
[687125 ms]  >>>  URB 316 going down  >>> 
-- URB_FUNCTION_BULK_OR_INTERRUPT_TRANSFER:
  PipeHandle           = 822e77d4 [endpoint 0x00000081]
  TransferFlags        = 00000003 (USBD_TRANSFER_DIRECTION_IN, USBD_SHORT_TRANSFER_OK)
  TransferBufferLength = 00000100
  TransferBuffer       = 00000000
  TransferBufferMDL    = 822d87a0
  UrbLink              = 00000000
[687147 ms] UsbSnoop - MyInternalIOCTLCompletion(f890fdb0) : fido=81b19728, Irp=822d9840, Context=821aa3a8, IRQL=2
[687147 ms]  <<<  URB 316 coming back  <<< 
-- URB_FUNCTION_BULK_OR_INTERRUPT_TRANSFER:
  PipeHandle           = 822e77d4 [endpoint 0x00000081]
  TransferFlags        = 00000003 (USBD_TRANSFER_DIRECTION_IN, USBD_SHORT_TRANSFER_OK)
  TransferBufferLength = 000000ff
  TransferBuffer       = 00000000
  TransferBufferMDL    = 822d87a0
    00000000: 00 00 00 fa 03 31 11 2a 11 3f 93 35 30 2b 31 39
    00000010: 2b 2a 50 52 45 53 53 29 29 29 06 45 4e 54 45 52
    00000020: 07 29 29 29 4f 4e 2a 3f 93 35 37 2b 32 38 2b 2a
    00000030: 54 49 71 38 33 29 29 29 50 4c 55 53 2a 3f d8 3f
    00000040: e1 3f de 2a 54 55 52 4e 29 4f 4e 29 54 48 45 29
    00000050: 43 42 4c 3a 2a 3f e0 34 2b 31 30 2b 2a 06 45 4e
    00000060: 54 45 52 07 2a 11 3f d8 3f 75 3f e1 3f de 2a 4e
    00000070: 4f 57 29 43 48 45 43 4b 49 4e 47 29 54 48 45 2a
    00000080: 3f de 2a 43 41 4c 43 55 4c 41 54 4f 52 71 43 42
    00000090: 4c 2a 3f de 2a 4c 49 4e 4b 29 43 4f 4e 4e 45 43
    000000a0: 54 49 4f 4e 3a 2a 3f de 2a 50 4c 45 41 53 45 29
    000000b0: 57 41 49 54 3a 3a 3a 3a 2a 3f 08 31 2b 30 09 04
    000000c0: 5d 00 3f e7 5d 00 11 3f 08 30 09 04 5d 01 3f d6
    000000d0: 4d 3f 08 37 09 04 5d 00 3f e7 5d 00 11 3f e8 5d
    000000e0: 01 11 3f ce b5 5d 01 11 6a 31 40 5d 01 10 31 11
    000000f0: 6a 30 3f cf 3f e1 3f de 2a 82 82 82 4c 49 4e
  UrbLink              = 00000000
[687186 ms] UsbSnoop - DispatchAny(f890e610) : IRP_MJ_INTERNAL_DEVICE_CONTROL
[687186 ms] UsbSnoop - MyDispatchInternalIOCTL(f890fe80) : fdo=81b1aac0, Irp=822d9840, IRQL=2
[687186 ms]  >>>  URB 317 going down  >>> 
-- URB_FUNCTION_BULK_OR_INTERRUPT_TRANSFER:
  PipeHandle           = 822e77f4 [endpoint 0x00000002]
  TransferFlags        = 00000000 (USBD_TRANSFER_DIRECTION_OUT, ~USBD_SHORT_TRANSFER_OK)
  TransferBufferLength = 00000007
  TransferBuffer       = 00000000
  TransferBufferMDL    = 822d87a0
    00000000: 00 00 00 02 05 e0 00
  UrbLink              = 00000000
[687186 ms] UsbSnoop - MyInternalIOCTLCompletion(f890fdb0) : fido=81b19728, Irp=822d9840, Context=81b05970, IRQL=2
[687186 ms]  <<<  URB 317 coming back  <<< 
-- URB_FUNCTION_BULK_OR_INTERRUPT_TRANSFER:
  PipeHandle           = 822e77f4 [endpoint 0x00000002]
  TransferFlags        = 00000000 (USBD_TRANSFER_DIRECTION_OUT, ~USBD_SHORT_TRANSFER_OK)
  TransferBufferLength = 00000007
  TransferBuffer       = 00000000
  TransferBufferMDL    = 822d87a0
  UrbLink              = 00000000
[687195 ms] UsbSnoop - DispatchAny(f890e610) : IRP_MJ_INTERNAL_DEVICE_CONTROL
[687195 ms] UsbSnoop - MyDispatchInternalIOCTL(f890fe80) : fdo=81b1aac0, Irp=822d9840, IRQL=2
[687195 ms]  >>>  URB 318 going down  >>> 
-- URB_FUNCTION_BULK_OR_INTERRUPT_TRANSFER:
  PipeHandle           = 822e77d4 [endpoint 0x00000081]
  TransferFlags        = 00000003 (USBD_TRANSFER_DIRECTION_IN, USBD_SHORT_TRANSFER_OK)
  TransferBufferLength = 00000100
  TransferBuffer       = 00000000
  TransferBufferMDL    = 822d87a0
  UrbLink              = 00000000
[687217 ms] UsbSnoop - MyInternalIOCTLCompletion(f890fdb0) : fido=81b19728, Irp=822d9840, Context=821aa3a8, IRQL=2
[687217 ms]  <<<  URB 318 coming back  <<< 
-- URB_FUNCTION_BULK_OR_INTERRUPT_TRANSFER:
  PipeHandle           = 822e77d4 [endpoint 0x00000081]
  TransferFlags        = 00000003 (USBD_TRANSFER_DIRECTION_IN, USBD_SHORT_TRANSFER_OK)
  TransferBufferLength = 000000ff
  TransferBuffer       = 00000000
  TransferBufferMDL    = 822d87a0
    00000000: 00 00 00 fa 03 4b 29 45 52 52 4f 52 82 82 82 2a
    00000010: 3f de 2a 50 55 53 48 29 49 4e 29 54 48 45 29 4c
    00000020: 49 4e 4b 2a 3f de 2a 43 4f 52 44 29 43 4f 4e 4e
    00000030: 45 43 54 4f 52 53 2a 3f de 2a 46 49 52 4d 4c 59
    00000040: 29 54 48 45 4e 29 48 49 54 2a 3f de 2a 06 45 4e
    00000050: 54 45 52 07 3a 2a 3f d8 3f d7 4d 3f d4 3f de 2a
    00000060: 2a 3f e0 36 2b 31 2b 2a 29 29 53 54 41 54 55 53
    00000070: 3e 29 4f 3a 4b 3a 2a 3f e0 38 2b 31 30 2b 2a 06
    00000080: 45 4e 54 45 52 07 2a 11 3f d8 3f 76 3f e1 3f 85
    00000090: 3f 7e 08 3f fa 5d 01 2b 5d 02 3f 30 04 63 0a 3f
    000000a0: 36 04 63 0b 3f 3a 31 04 63 02 3f 30 04 63 0c 3f
    000000b0: 32 30 04 63 0d 3f 31 04 63 03 3f 36 30 04 b5 5d
    000000c0: 01 3f 36 30 04 b5 5d 02 3f 23 49 2b 49 2b 3a 31
    000000d0: 2b 36 2b 3a 31 11 04 5d 01 3f 08 36 2b 30 09 04
    000000e0: 5d 00 3f e7 5d 00 11 3f 08 31 2b 30 09 5d 00 3f
    000000f0: 3e e7 5d 00 11 3f 08 31 2b 31 31 2b 33 09 04
  UrbLink              = 00000000
[687256 ms] UsbSnoop - DispatchAny(f890e610) : IRP_MJ_INTERNAL_DEVICE_CONTROL
[687256 ms] UsbSnoop - MyDispatchInternalIOCTL(f890fe80) : fdo=81b1aac0, Irp=81d09e48, IRQL=2
[687256 ms]  >>>  URB 319 going down  >>> 
-- URB_FUNCTION_BULK_OR_INTERRUPT_TRANSFER:
  PipeHandle           = 822e77f4 [endpoint 0x00000002]
  TransferFlags        = 00000000 (USBD_TRANSFER_DIRECTION_OUT, ~USBD_SHORT_TRANSFER_OK)
  TransferBufferLength = 00000007
  TransferBuffer       = 00000000
  TransferBufferMDL    = 822d87a0
    00000000: 00 00 00 02 05 e0 00
  UrbLink              = 00000000
[687256 ms] UsbSnoop - MyInternalIOCTLCompletion(f890fdb0) : fido=81b19728, Irp=81d09e48, Context=822e2150, IRQL=2
[687256 ms]  <<<  URB 319 coming back  <<< 
-- URB_FUNCTION_BULK_OR_INTERRUPT_TRANSFER:
  PipeHandle           = 822e77f4 [endpoint 0x00000002]
  TransferFlags        = 00000000 (USBD_TRANSFER_DIRECTION_OUT, ~USBD_SHORT_TRANSFER_OK)
  TransferBufferLength = 00000007
  TransferBuffer       = 00000000
  TransferBufferMDL    = 822d87a0
  UrbLink              = 00000000
[687266 ms] UsbSnoop - DispatchAny(f890e610) : IRP_MJ_INTERNAL_DEVICE_CONTROL
[687266 ms] UsbSnoop - MyDispatchInternalIOCTL(f890fe80) : fdo=81b1aac0, Irp=81d09e48, IRQL=2
[687266 ms]  >>>  URB 320 going down  >>> 
-- URB_FUNCTION_BULK_OR_INTERRUPT_TRANSFER:
  PipeHandle           = 822e77d4 [endpoint 0x00000081]
  TransferFlags        = 00000003 (USBD_TRANSFER_DIRECTION_IN, USBD_SHORT_TRANSFER_OK)
  TransferBufferLength = 00000100
  TransferBuffer       = 00000000
  TransferBufferMDL    = 822d87a0
  UrbLink              = 00000000
[687287 ms] UsbSnoop - MyInternalIOCTLCompletion(f890fdb0) : fido=81b19728, Irp=81d09e48, Context=821aa3a8, IRQL=2
[687287 ms]  <<<  URB 320 coming back  <<< 
-- URB_FUNCTION_BULK_OR_INTERRUPT_TRANSFER:
  PipeHandle           = 822e77d4 [endpoint 0x00000081]
  TransferFlags        = 00000003 (USBD_TRANSFER_DIRECTION_IN, USBD_SHORT_TRANSFER_OK)
  TransferBufferLength = 000000ff
  TransferBuffer       = 00000000
  TransferBufferMDL    = 822d87a0
    00000000: 00 00 00 fa 03 5d 00 3f e7 5d 00 11 3f e1 3f de
    00000010: 2a 50 52 45 53 53 29 45 4e 54 45 52 2a 3f de 2a
    00000020: 54 4f 29 53 54 41 52 54 2a 3f de 2a 47 52 41 50
    00000030: 48 2a 3f d8 3f 85 3f 93 36 2b 31 2b 2a 44 49 53
    00000040: 54 10 46 54 11 2a 11 3f 93 35 31 2b 37 38 2b 2a
    00000050: 54 49 4d 45 10 53 11 2a 11 3f 08 33 2b 3a 31 2b
    00000060: b0 31 2b 30 09 04 5d 00 3f e7 5d 00 11 3f d3 49
    00000070: 2b 31 2b 36 30 2b 31 11 3f e8 5d 02 10 49 11 11
    00000080: 3f 9e 5d 01 10 49 11 2b 5d 02 10 49 11 11 3f d4
    00000090: 3f 08 36 2b 30 09 04 5d 00 3f 3e e7 5d 00 11 3f
    000000a0: ec fe 2b 5d 01 2b 5d 02 2b 81 11 3f 93 36 2b 31
    000000b0: 2b 2a 44 49 53 54 10 46 54 11 2a 11 3f 93 35 31
    000000c0: 2b 37 38 2b 2a 54 49 4d 45 10 53 11 2a 11 3f 84
    000000d0: 3f 48 4f 4f 4b 00 25 03 08 36 2b 30 09 04 5d 00
    000000e0: 3e e7 5d 00 11 3f 31 04 63 0a 3e 32 04 63 0b 3e
    000000f0: 31 04 63 0c 3e 32 04 63 0d 3f 7e 0b 3f 7e 09
  UrbLink              = 00000000
[687316 ms] UsbSnoop - DispatchAny(f890e610) : IRP_MJ_INTERNAL_DEVICE_CONTROL
[687316 ms] UsbSnoop - MyDispatchInternalIOCTL(f890fe80) : fdo=81b1aac0, Irp=81ae82f0, IRQL=2
[687316 ms]  >>>  URB 321 going down  >>> 
-- URB_FUNCTION_BULK_OR_INTERRUPT_TRANSFER:
  PipeHandle           = 822e77f4 [endpoint 0x00000002]
  TransferFlags        = 00000000 (USBD_TRANSFER_DIRECTION_OUT, ~USBD_SHORT_TRANSFER_OK)
  TransferBufferLength = 00000007
  TransferBuffer       = 00000000
  TransferBufferMDL    = 822d87a0
    00000000: 00 00 00 02 05 e0 00
  UrbLink              = 00000000
[687316 ms] UsbSnoop - MyInternalIOCTLCompletion(f890fdb0) : fido=81b19728, Irp=81ae82f0, Context=81b05970, IRQL=2
[687316 ms]  <<<  URB 321 coming back  <<< 
-- URB_FUNCTION_BULK_OR_INTERRUPT_TRANSFER:
  PipeHandle           = 822e77f4 [endpoint 0x00000002]
  TransferFlags        = 00000000 (USBD_TRANSFER_DIRECTION_OUT, ~USBD_SHORT_TRANSFER_OK)
  TransferBufferLength = 00000007
  TransferBuffer       = 00000000
  TransferBufferMDL    = 822d87a0
  UrbLink              = 00000000
[687326 ms] UsbSnoop - DispatchAny(f890e610) : IRP_MJ_INTERNAL_DEVICE_CONTROL
[687326 ms] UsbSnoop - MyDispatchInternalIOCTL(f890fe80) : fdo=81b1aac0, Irp=81ae82f0, IRQL=2
[687326 ms]  >>>  URB 322 going down  >>> 
-- URB_FUNCTION_BULK_OR_INTERRUPT_TRANSFER:
  PipeHandle           = 822e77d4 [endpoint 0x00000081]
  TransferFlags        = 00000003 (USBD_TRANSFER_DIRECTION_IN, USBD_SHORT_TRANSFER_OK)
  TransferBufferLength = 00000100
  TransferBuffer       = 00000000
  TransferBufferMDL    = 822d87a0
  UrbLink              = 00000000
[687347 ms] UsbSnoop - MyInternalIOCTLCompletion(f890fdb0) : fido=81b19728, Irp=81ae82f0, Context=822db980, IRQL=2
[687347 ms]  <<<  URB 322 coming back  <<< 
-- URB_FUNCTION_BULK_OR_INTERRUPT_TRANSFER:
  PipeHandle           = 822e77d4 [endpoint 0x00000081]
  TransferFlags        = 00000003 (USBD_TRANSFER_DIRECTION_IN, USBD_SHORT_TRANSFER_OK)
  TransferBufferLength = 000000ff
  TransferBuffer       = 00000000
  TransferBufferMDL    = 822d87a0
    00000000: 00 00 00 fa 03 3f 7e 0d 3f ea 3f 97 3f 85 3f 93
    00000010: 31 2b 31 36 2b 2a 54 45 58 41 53 29 29 49 4e 53
    00000020: 54 52 55 4d 45 4e 54 53 2a 11 3f 93 38 2b 33 30
    00000030: 2b 2a 43 42 4c 29 29 29 53 59 53 54 45 4d 2a 11
    00000040: 3f 93 31 35 2b 31 30 2b 2a 45 58 50 45 52 49 4d
    00000050: 45 4e 54 29 29 29 57 4f 52 4b 42 4f 4f 4b 2a 11
    00000060: 3f 93 32 39 2b 33 32 2b 2a 48 4f 4f 4b 29 29 29
    00000070: 56 32 3a 30 2a 11 3f 93 33 36 2b 31 38 2b 2a 10
    00000080: 45 58 50 45 52 49 4d 45 4e 54 29 29 29 4d 33 11
    00000090: 2a 11 3f 93 35 30 2b 31 39 2b 2a 50 52 45 53 53
    000000a0: 29 29 29 06 45 4e 54 45 52 07 29 29 29 4f 4e 2a
    000000b0: 3f 93 35 37 2b 32 38 2b 2a 54 49 71 38 33 29 29
    000000c0: 29 50 4c 55 53 2a 3f d8 3f e1 3f de 2a 54 55 52
    000000d0: 4e 29 4f 4e 29 54 48 45 29 43 42 4c 3a 2a 3f e0
    000000e0: 34 2b 31 30 2b 2a 06 45 4e 54 45 52 07 2a 11 3f
    000000f0: d8 3f 75 3f e1 3f de 2a 4e 4f 57 29 43 48 45
  UrbLink              = 00000000
[687386 ms] UsbSnoop - DispatchAny(f890e610) : IRP_MJ_INTERNAL_DEVICE_CONTROL
[687386 ms] UsbSnoop - MyDispatchInternalIOCTL(f890fe80) : fdo=81b1aac0, Irp=81ae82f0, IRQL=2
[687386 ms]  >>>  URB 323 going down  >>> 
-- URB_FUNCTION_BULK_OR_INTERRUPT_TRANSFER:
  PipeHandle           = 822e77f4 [endpoint 0x00000002]
  TransferFlags        = 00000000 (USBD_TRANSFER_DIRECTION_OUT, ~USBD_SHORT_TRANSFER_OK)
  TransferBufferLength = 00000007
  TransferBuffer       = 00000000
  TransferBufferMDL    = 822d87a0
    00000000: 00 00 00 02 05 e0 00
  UrbLink              = 00000000
[687386 ms] UsbSnoop - MyInternalIOCTLCompletion(f890fdb0) : fido=81b19728, Irp=81ae82f0, Context=821aa3a8, IRQL=2
[687386 ms]  <<<  URB 323 coming back  <<< 
-- URB_FUNCTION_BULK_OR_INTERRUPT_TRANSFER:
  PipeHandle           = 822e77f4 [endpoint 0x00000002]
  TransferFlags        = 00000000 (USBD_TRANSFER_DIRECTION_OUT, ~USBD_SHORT_TRANSFER_OK)
  TransferBufferLength = 00000007
  TransferBuffer       = 00000000
  TransferBufferMDL    = 822d87a0
  UrbLink              = 00000000
[687396 ms] UsbSnoop - DispatchAny(f890e610) : IRP_MJ_INTERNAL_DEVICE_CONTROL
[687396 ms] UsbSnoop - MyDispatchInternalIOCTL(f890fe80) : fdo=81b1aac0, Irp=81ae82f0, IRQL=2
[687396 ms]  >>>  URB 324 going down  >>> 
-- URB_FUNCTION_BULK_OR_INTERRUPT_TRANSFER:
  PipeHandle           = 822e77d4 [endpoint 0x00000081]
  TransferFlags        = 00000003 (USBD_TRANSFER_DIRECTION_IN, USBD_SHORT_TRANSFER_OK)
  TransferBufferLength = 00000100
  TransferBuffer       = 00000000
  TransferBufferMDL    = 822d87a0
  UrbLink              = 00000000
[687417 ms] UsbSnoop - MyInternalIOCTLCompletion(f890fdb0) : fido=81b19728, Irp=81ae82f0, Context=822db980, IRQL=2
[687417 ms]  <<<  URB 324 coming back  <<< 
-- URB_FUNCTION_BULK_OR_INTERRUPT_TRANSFER:
  PipeHandle           = 822e77d4 [endpoint 0x00000081]
  TransferFlags        = 00000003 (USBD_TRANSFER_DIRECTION_IN, USBD_SHORT_TRANSFER_OK)
  TransferBufferLength = 000000ff
  TransferBuffer       = 00000000
  TransferBufferMDL    = 822d87a0
    00000000: 00 00 00 fa 03 43 4b 49 4e 47 29 54 48 45 2a 3f
    00000010: de 2a 43 41 4c 43 55 4c 41 54 4f 52 71 43 42 4c
    00000020: 2a 3f de 2a 4c 49 4e 4b 29 43 4f 4e 4e 45 43 54
    00000030: 49 4f 4e 3a 2a 3f de 2a 50 4c 45 41 53 45 29 57
    00000040: 41 49 54 3a 3a 3a 3a 2a 3f 08 31 2b 30 09 04 5d
    00000050: 00 3f e7 5d 00 11 3f 08 30 09 04 5d 01 3f d6 4d
    00000060: 3f 08 37 09 04 5d 00 3f e7 5d 00 11 3f e8 5d 01
    00000070: 11 3f ce b5 5d 01 11 6a 31 40 5d 01 10 31 11 6a
    00000080: 30 3f cf 3f e1 3f de 2a 82 82 82 4c 49 4e 4b 29
    00000090: 45 52 52 4f 52 82 82 82 2a 3f de 2a 50 55 53 48
    000000a0: 29 49 4e 29 54 48 45 29 4c 49 4e 4b 2a 3f de 2a
    000000b0: 43 4f 52 44 29 43 4f 4e 4e 45 43 54 4f 52 53 2a
    000000c0: 3f de 2a 46 49 52 4d 4c 59 29 54 48 45 4e 29 48
    000000d0: 49 54 2a 3f de 2a 06 45 4e 54 45 52 07 3a 2a 3f
    000000e0: d8 3f d7 4d 3f d4 3f de 2a 2a 3f e0 36 2b 31 2b
    000000f0: 2a 29 29 53 54 41 54 55 53 3e 29 4f 3a 4b 3a
  UrbLink              = 00000000
[687456 ms] UsbSnoop - DispatchAny(f890e610) : IRP_MJ_INTERNAL_DEVICE_CONTROL
[687456 ms] UsbSnoop - MyDispatchInternalIOCTL(f890fe80) : fdo=81b1aac0, Irp=81ae82f0, IRQL=2
[687456 ms]  >>>  URB 325 going down  >>> 
-- URB_FUNCTION_BULK_OR_INTERRUPT_TRANSFER:
  PipeHandle           = 822e77f4 [endpoint 0x00000002]
  TransferFlags        = 00000000 (USBD_TRANSFER_DIRECTION_OUT, ~USBD_SHORT_TRANSFER_OK)
  TransferBufferLength = 00000007
  TransferBuffer       = 00000000
  TransferBufferMDL    = 822d87a0
    00000000: 00 00 00 02 05 e0 00
  UrbLink              = 00000000
[687456 ms] UsbSnoop - MyInternalIOCTLCompletion(f890fdb0) : fido=81b19728, Irp=81ae82f0, Context=822e2150, IRQL=2
[687456 ms]  <<<  URB 325 coming back  <<< 
-- URB_FUNCTION_BULK_OR_INTERRUPT_TRANSFER:
  PipeHandle           = 822e77f4 [endpoint 0x00000002]
  TransferFlags        = 00000000 (USBD_TRANSFER_DIRECTION_OUT, ~USBD_SHORT_TRANSFER_OK)
  TransferBufferLength = 00000007
  TransferBuffer       = 00000000
  TransferBufferMDL    = 822d87a0
  UrbLink              = 00000000
[687466 ms] UsbSnoop - DispatchAny(f890e610) : IRP_MJ_INTERNAL_DEVICE_CONTROL
[687466 ms] UsbSnoop - MyDispatchInternalIOCTL(f890fe80) : fdo=81b1aac0, Irp=81ae82f0, IRQL=2
[687466 ms]  >>>  URB 326 going down  >>> 
-- URB_FUNCTION_BULK_OR_INTERRUPT_TRANSFER:
  PipeHandle           = 822e77d4 [endpoint 0x00000081]
  TransferFlags        = 00000003 (USBD_TRANSFER_DIRECTION_IN, USBD_SHORT_TRANSFER_OK)
  TransferBufferLength = 00000100
  TransferBuffer       = 00000000
  TransferBufferMDL    = 822d87a0
  UrbLink              = 00000000
[687487 ms] UsbSnoop - MyInternalIOCTLCompletion(f890fdb0) : fido=81b19728, Irp=81ae82f0, Context=822db980, IRQL=2
[687487 ms]  <<<  URB 326 coming back  <<< 
-- URB_FUNCTION_BULK_OR_INTERRUPT_TRANSFER:
  PipeHandle           = 822e77d4 [endpoint 0x00000081]
  TransferFlags        = 00000003 (USBD_TRANSFER_DIRECTION_IN, USBD_SHORT_TRANSFER_OK)
  TransferBufferLength = 000000ff
  TransferBuffer       = 00000000
  TransferBufferMDL    = 822d87a0
    00000000: 00 00 00 fa 03 2a 3f e0 38 2b 31 30 2b 2a 06 45
    00000010: 4e 54 45 52 07 2a 11 3f d8 3f 76 3f e1 3f 85 3f
    00000020: 93 34 33 2b 36 2b 2a 50 52 45 53 53 29 29 29 06
    00000030: 45 4e 54 45 52 07 29 29 29 4f 4e 2a 3f 93 35 30
    00000040: 2b 36 2b 2a 54 49 71 38 33 29 29 29 50 4c 55 53
    00000050: 2b 2a 3f 93 35 37 2b 36 2b 2a 54 48 45 4e 29 29
    00000060: 29 06 54 52 49 47 47 45 52 07 29 29 29 4f 4e 29
    00000070: 29 29 43 42 4c 2a 3f d8 3f 7e 08 3f 08 36 2b 30
    00000080: 09 04 5d 00 3f e7 5d 00 11 3f 08 31 2b 30 09 04
    00000090: 5d 00 3f e7 5d 00 11 3f 08 31 2b 31 31 2b 33 09
    000000a0: 04 5d 00 3f e7 5d 00 11 3f 08 33 2b 3a 30 32 2b
    000000b0: 39 39 2b 31 2b 30 2b 30 2b 30 2b 30 2b 31 09 04
    000000c0: 5d 00 3f e7 5d 00 11 3f fa 5d 00 2b 5d 01 3f e8
    000000d0: 5d 01 11 3f e8 5d 00 11 3f ec fe 2b 5d 00 2b 5d
    000000e0: 01 2b 81 11 3f 8f 3f 93 36 2b 31 30 2b 2a 48 45
    000000f0: 49 47 48 54 10 46 54 11 2a 11 3f 93 35 31 2b
  UrbLink              = 00000000
[687516 ms] UsbSnoop - DispatchAny(f890e610) : IRP_MJ_INTERNAL_DEVICE_CONTROL
[687516 ms] UsbSnoop - MyDispatchInternalIOCTL(f890fe80) : fdo=81b1aac0, Irp=81ae82f0, IRQL=2
[687516 ms]  >>>  URB 327 going down  >>> 
-- URB_FUNCTION_BULK_OR_INTERRUPT_TRANSFER:
  PipeHandle           = 822e77f4 [endpoint 0x00000002]
  TransferFlags        = 00000000 (USBD_TRANSFER_DIRECTION_OUT, ~USBD_SHORT_TRANSFER_OK)
  TransferBufferLength = 00000007
  TransferBuffer       = 00000000
  TransferBufferMDL    = 822d87a0
    00000000: 00 00 00 02 05 e0 00
  UrbLink              = 00000000
[687516 ms] UsbSnoop - MyInternalIOCTLCompletion(f890fdb0) : fido=81b19728, Irp=81ae82f0, Context=821aa3a8, IRQL=2
[687516 ms]  <<<  URB 327 coming back  <<< 
-- URB_FUNCTION_BULK_OR_INTERRUPT_TRANSFER:
  PipeHandle           = 822e77f4 [endpoint 0x00000002]
  TransferFlags        = 00000000 (USBD_TRANSFER_DIRECTION_OUT, ~USBD_SHORT_TRANSFER_OK)
  TransferBufferLength = 00000007
  TransferBuffer       = 00000000
  TransferBufferMDL    = 822d87a0
  UrbLink              = 00000000
[687526 ms] UsbSnoop - DispatchAny(f890e610) : IRP_MJ_INTERNAL_DEVICE_CONTROL
[687526 ms] UsbSnoop - MyDispatchInternalIOCTL(f890fe80) : fdo=81b1aac0, Irp=81ae82f0, IRQL=2
[687526 ms]  >>>  URB 328 going down  >>> 
-- URB_FUNCTION_BULK_OR_INTERRUPT_TRANSFER:
  PipeHandle           = 822e77d4 [endpoint 0x00000081]
  TransferFlags        = 00000003 (USBD_TRANSFER_DIRECTION_IN, USBD_SHORT_TRANSFER_OK)
  TransferBufferLength = 00000100
  TransferBuffer       = 00000000
  TransferBufferMDL    = 822d87a0
  UrbLink              = 00000000
[687547 ms] UsbSnoop - MyInternalIOCTLCompletion(f890fdb0) : fido=81b19728, Irp=81ae82f0, Context=81cd51b0, IRQL=2
[687547 ms]  <<<  URB 328 coming back  <<< 
-- URB_FUNCTION_BULK_OR_INTERRUPT_TRANSFER:
  PipeHandle           = 822e77d4 [endpoint 0x00000081]
  TransferFlags        = 00000003 (USBD_TRANSFER_DIRECTION_IN, USBD_SHORT_TRANSFER_OK)
  TransferBufferLength = 000000ff
  TransferBuffer       = 00000000
  TransferBufferMDL    = 822d87a0
    00000000: 00 00 00 fa 03 36 38 2b 2a 54 49 4d 45 10 53 11
    00000010: 2a 11 3f 84 3f 4c 49 47 48 54 00 10 04 08 36 2b
    00000020: 30 09 04 5d 00 3e e7 5d 00 11 3f 31 04 63 0a 3e
    00000030: 32 04 63 0b 3e 31 04 63 0c 3e 32 04 63 0d 3f 7e
    00000040: 0b 3f 7e 09 3f 7e 0d 3f ea 3f 97 3f 85 3f 93 31
    00000050: 2b 31 36 2b 2a 54 45 58 41 53 29 29 49 4e 53 54
    00000060: 52 55 4d 45 4e 54 53 2a 11 3f 93 38 2b 33 30 2b
    00000070: 2a 43 42 4c 29 29 29 53 59 53 54 45 4d 2a 11 3f
    00000080: 93 31 35 2b 31 30 2b 2a 45 58 50 45 52 49 4d 45
    00000090: 4e 54 29 29 29 57 4f 52 4b 42 4f 4f 4b 2a 11 3f
    000000a0: 93 32 39 2b 33 30 2b 2a 4c 49 47 48 54 29 29 29
    000000b0: 56 32 3a 30 2a 11 3f 93 33 36 2b 31 38 2b 2a 10
    000000c0: 45 58 50 45 52 49 4d 45 4e 54 29 29 29 50 36 11
    000000d0: 2a 11 3f 93 35 30 2b 31 39 2b 2a 50 52 45 53 53
    000000e0: 29 29 29 06 45 4e 54 45 52 07 29 29 29 4f 4e 2a
    000000f0: 3f 93 35 37 2b 32 38 2b 2a 54 49 71 38 33 29
  UrbLink              = 00000000
[687586 ms] UsbSnoop - DispatchAny(f890e610) : IRP_MJ_INTERNAL_DEVICE_CONTROL
[687586 ms] UsbSnoop - MyDispatchInternalIOCTL(f890fe80) : fdo=81b1aac0, Irp=81ae82f0, IRQL=2
[687586 ms]  >>>  URB 329 going down  >>> 
-- URB_FUNCTION_BULK_OR_INTERRUPT_TRANSFER:
  PipeHandle           = 822e77f4 [endpoint 0x00000002]
  TransferFlags        = 00000000 (USBD_TRANSFER_DIRECTION_OUT, ~USBD_SHORT_TRANSFER_OK)
  TransferBufferLength = 00000007
  TransferBuffer       = 00000000
  TransferBufferMDL    = 822d87a0
    00000000: 00 00 00 02 05 e0 00
  UrbLink              = 00000000
[687586 ms] UsbSnoop - MyInternalIOCTLCompletion(f890fdb0) : fido=81b19728, Irp=81ae82f0, Context=822db980, IRQL=2
[687586 ms]  <<<  URB 329 coming back  <<< 
-- URB_FUNCTION_BULK_OR_INTERRUPT_TRANSFER:
  PipeHandle           = 822e77f4 [endpoint 0x00000002]
  TransferFlags        = 00000000 (USBD_TRANSFER_DIRECTION_OUT, ~USBD_SHORT_TRANSFER_OK)
  TransferBufferLength = 00000007
  TransferBuffer       = 00000000
  TransferBufferMDL    = 822d87a0
  UrbLink              = 00000000
[687596 ms] UsbSnoop - DispatchAny(f890e610) : IRP_MJ_INTERNAL_DEVICE_CONTROL
[687596 ms] UsbSnoop - MyDispatchInternalIOCTL(f890fe80) : fdo=81b1aac0, Irp=81ae82f0, IRQL=2
[687596 ms]  >>>  URB 330 going down  >>> 
-- URB_FUNCTION_BULK_OR_INTERRUPT_TRANSFER:
  PipeHandle           = 822e77d4 [endpoint 0x00000081]
  TransferFlags        = 00000003 (USBD_TRANSFER_DIRECTION_IN, USBD_SHORT_TRANSFER_OK)
  TransferBufferLength = 00000100
  TransferBuffer       = 00000000
  TransferBufferMDL    = 822d87a0
  UrbLink              = 00000000
[687617 ms] UsbSnoop - MyInternalIOCTLCompletion(f890fdb0) : fido=81b19728, Irp=81ae82f0, Context=81cd51b0, IRQL=2
[687617 ms]  <<<  URB 330 coming back  <<< 
-- URB_FUNCTION_BULK_OR_INTERRUPT_TRANSFER:
  PipeHandle           = 822e77d4 [endpoint 0x00000081]
  TransferFlags        = 00000003 (USBD_TRANSFER_DIRECTION_IN, USBD_SHORT_TRANSFER_OK)
  TransferBufferLength = 000000ff
  TransferBuffer       = 00000000
  TransferBufferMDL    = 822d87a0
    00000000: 00 00 00 fa 03 29 29 50 4c 55 53 2a 3f d8 3f e1
    00000010: 3f de 2a 54 55 52 4e 29 4f 4e 29 54 48 45 29 43
    00000020: 42 4c 3a 2a 3f e0 34 2b 31 30 2b 2a 06 45 4e 54
    00000030: 45 52 07 2a 11 3f d8 3f 75 3f e1 3f de 2a 4e 4f
    00000040: 57 29 43 48 45 43 4b 49 4e 47 29 54 48 45 2a 3f
    00000050: de 2a 43 41 4c 43 55 4c 41 54 4f 52 71 43 42 4c
    00000060: 2a 3f de 2a 4c 49 4e 4b 29 43 4f 4e 4e 45 43 54
    00000070: 49 4f 4e 3a 2a 3f de 2a 50 4c 45 41 53 45 29 57
    00000080: 41 49 54 3a 3a 3a 3a 2a 3f 08 31 2b 30 09 04 5d
    00000090: 00 3f e7 5d 00 11 3f 08 30 09 04 5d 01 3f d6 4d
    000000a0: 3f 08 37 09 04 5d 00 3f e7 5d 00 11 3f e8 5d 01
    000000b0: 11 3f ce b5 5d 01 11 6a 31 40 5d 01 10 31 11 6a
    000000c0: 30 3f cf 3f e1 3f de 2a 82 82 82 4c 49 4e 4b 29
    000000d0: 45 52 52 4f 52 82 82 82 2a 3f de 2a 50 55 53 48
    000000e0: 29 49 4e 29 54 48 45 29 4c 49 4e 4b 2a 3f de 2a
    000000f0: 43 4f 52 44 29 43 4f 4e 4e 45 43 54 4f 52 53
  UrbLink              = 00000000
[687656 ms] UsbSnoop - DispatchAny(f890e610) : IRP_MJ_INTERNAL_DEVICE_CONTROL
[687656 ms] UsbSnoop - MyDispatchInternalIOCTL(f890fe80) : fdo=81b1aac0, Irp=81ae82f0, IRQL=2
[687656 ms]  >>>  URB 331 going down  >>> 
-- URB_FUNCTION_BULK_OR_INTERRUPT_TRANSFER:
  PipeHandle           = 822e77f4 [endpoint 0x00000002]
  TransferFlags        = 00000000 (USBD_TRANSFER_DIRECTION_OUT, ~USBD_SHORT_TRANSFER_OK)
  TransferBufferLength = 00000007
  TransferBuffer       = 00000000
  TransferBufferMDL    = 822d87a0
    00000000: 00 00 00 02 05 e0 00
  UrbLink              = 00000000
[687656 ms] UsbSnoop - MyInternalIOCTLCompletion(f890fdb0) : fido=81b19728, Irp=81ae82f0, Context=822e2150, IRQL=2
[687656 ms]  <<<  URB 331 coming back  <<< 
-- URB_FUNCTION_BULK_OR_INTERRUPT_TRANSFER:
  PipeHandle           = 822e77f4 [endpoint 0x00000002]
  TransferFlags        = 00000000 (USBD_TRANSFER_DIRECTION_OUT, ~USBD_SHORT_TRANSFER_OK)
  TransferBufferLength = 00000007
  TransferBuffer       = 00000000
  TransferBufferMDL    = 822d87a0
  UrbLink              = 00000000
[687666 ms] UsbSnoop - DispatchAny(f890e610) : IRP_MJ_INTERNAL_DEVICE_CONTROL
[687666 ms] UsbSnoop - MyDispatchInternalIOCTL(f890fe80) : fdo=81b1aac0, Irp=81ae82f0, IRQL=2
[687666 ms]  >>>  URB 332 going down  >>> 
-- URB_FUNCTION_BULK_OR_INTERRUPT_TRANSFER:
  PipeHandle           = 822e77d4 [endpoint 0x00000081]
  TransferFlags        = 00000003 (USBD_TRANSFER_DIRECTION_IN, USBD_SHORT_TRANSFER_OK)
  TransferBufferLength = 00000100
  TransferBuffer       = 00000000
  TransferBufferMDL    = 822d87a0
  UrbLink              = 00000000
[687688 ms] UsbSnoop - MyInternalIOCTLCompletion(f890fdb0) : fido=81b19728, Irp=81ae82f0, Context=81cd51b0, IRQL=2
[687688 ms]  <<<  URB 332 coming back  <<< 
-- URB_FUNCTION_BULK_OR_INTERRUPT_TRANSFER:
  PipeHandle           = 822e77d4 [endpoint 0x00000081]
  TransferFlags        = 00000003 (USBD_TRANSFER_DIRECTION_IN, USBD_SHORT_TRANSFER_OK)
  TransferBufferLength = 000000ff
  TransferBuffer       = 00000000
  TransferBufferMDL    = 822d87a0
    00000000: 00 00 00 fa 03 2a 3f de 2a 46 49 52 4d 4c 59 29
    00000010: 54 48 45 4e 29 48 49 54 2a 3f de 2a 06 45 4e 54
    00000020: 45 52 07 3a 2a 3f d8 3f d7 4d 3f d4 3f de 2a 2a
    00000030: 3f e0 36 2b 31 2b 2a 29 29 53 54 41 54 55 53 3e
    00000040: 29 4f 3a 4b 3a 2a 3f e0 38 2b 31 30 2b 2a 06 45
    00000050: 4e 54 45 52 07 2a 11 3f d8 3f 76 3f e1 3f 85 3f
    00000060: 7e 08 3f 08 36 2b 30 09 04 5d 00 3f e7 5d 00 11
    00000070: 3f 08 31 2b 30 09 04 5d 00 3f e7 5d 00 11 3f e1
    00000080: 3f 08 31 2b 31 2b 31 09 04 5d 00 3f e7 5d 00 11
    00000090: 3f e1 3f fa 5d 01 2b 5d 03 3f de 2a 50 52 45 53
    000000a0: 53 29 45 4e 54 45 52 29 54 4f 29 2a 3f de 2a 5a
    000000b0: 45 52 4f 3a 2a 3f d8 3f 08 33 2b 3a 30 31 2b 35
    000000c0: 2b 30 09 04 5d 00 3f e7 5d 00 11 3f 35 04 b5 5d
    000000d0: 05 3f e8 5d 05 11 3f 10 b6 5d 05 11 71 19 5d 05
    000000e0: 11 71 1a 5d 05 11 11 83 33 04 51 3f d6 4c 3f e1
    000000f0: 3f de 2a 48 4f 57 29 4d 41 4e 59 29 44 41 54
  UrbLink              = 00000000
[687716 ms] UsbSnoop - DispatchAny(f890e610) : IRP_MJ_INTERNAL_DEVICE_CONTROL
[687716 ms] UsbSnoop - MyDispatchInternalIOCTL(f890fe80) : fdo=81b1aac0, Irp=81ae82f0, IRQL=2
[687716 ms]  >>>  URB 333 going down  >>> 
-- URB_FUNCTION_BULK_OR_INTERRUPT_TRANSFER:
  PipeHandle           = 822e77f4 [endpoint 0x00000002]
  TransferFlags        = 00000000 (USBD_TRANSFER_DIRECTION_OUT, ~USBD_SHORT_TRANSFER_OK)
  TransferBufferLength = 00000007
  TransferBuffer       = 00000000
  TransferBufferMDL    = 822d87a0
    00000000: 00 00 00 02 05 e0 00
  UrbLink              = 00000000
[687717 ms] UsbSnoop - MyInternalIOCTLCompletion(f890fdb0) : fido=81b19728, Irp=81ae82f0, Context=822db980, IRQL=2
[687717 ms]  <<<  URB 333 coming back  <<< 
-- URB_FUNCTION_BULK_OR_INTERRUPT_TRANSFER:
  PipeHandle           = 822e77f4 [endpoint 0x00000002]
  TransferFlags        = 00000000 (USBD_TRANSFER_DIRECTION_OUT, ~USBD_SHORT_TRANSFER_OK)
  TransferBufferLength = 00000007
  TransferBuffer       = 00000000
  TransferBufferMDL    = 822d87a0
  UrbLink              = 00000000
[687726 ms] UsbSnoop - DispatchAny(f890e610) : IRP_MJ_INTERNAL_DEVICE_CONTROL
[687726 ms] UsbSnoop - MyDispatchInternalIOCTL(f890fe80) : fdo=81b1aac0, Irp=81ae82f0, IRQL=2
[687726 ms]  >>>  URB 334 going down  >>> 
-- URB_FUNCTION_BULK_OR_INTERRUPT_TRANSFER:
  PipeHandle           = 822e77d4 [endpoint 0x00000081]
  TransferFlags        = 00000003 (USBD_TRANSFER_DIRECTION_IN, USBD_SHORT_TRANSFER_OK)
  TransferBufferLength = 00000100
  TransferBuffer       = 00000000
  TransferBufferMDL    = 822d87a0
  UrbLink              = 00000000
[687748 ms] UsbSnoop - MyInternalIOCTLCompletion(f890fdb0) : fido=81b19728, Irp=81ae82f0, Context=81cd51b0, IRQL=2
[687748 ms]  <<<  URB 334 coming back  <<< 
-- URB_FUNCTION_BULK_OR_INTERRUPT_TRANSFER:
  PipeHandle           = 822e77d4 [endpoint 0x00000081]
  TransferFlags        = 00000003 (USBD_TRANSFER_DIRECTION_IN, USBD_SHORT_TRANSFER_OK)
  TransferBufferLength = 000000ff
  TransferBuffer       = 00000000
  TransferBufferMDL    = 822d87a0
    00000000: 00 00 00 fa 03 41 2a 3f dc 2a 50 4f 49 4e 54 53
    00000010: af 29 2a 2b 4e 3f ce 4e 6b 31 3c 4e 6f b1 4e 11
    00000020: 3e d7 4c 3f d3 58 2b 31 2b 4e 2b 31 11 3f e1 3f
    00000030: de 58 3f de 2a 53 45 50 41 52 41 54 49 4f 4e 10
    00000040: 43 4d 11 af 2a 3f dc 44 3f 44 04 5d 01 10 58 11
    00000050: 3f de 2a 50 52 45 53 53 29 45 4e 54 45 52 29 54
    00000060: 4f 2a 3f de 2a 52 45 41 44 29 49 4e 54 45 4e 53
    00000070: 49 54 59 3a 2a 3f d8 3f 08 33 2b 3a 30 31 2b 35
    00000080: 2b 30 09 04 5d 00 3f e7 5d 00 11 3f 35 04 b5 5d
    00000090: 05 11 3f e8 5d 05 11 3f 10 b6 5d 05 11 71 19 5d
    000000a0: 05 11 71 1a 5d 05 11 11 83 33 04 5d 03 10 58 11
    000000b0: 3f d4 3f 5d 03 71 51 04 5d 03 3f ec fe 2b 5d 01
    000000c0: 2b 5d 03 2b 7f 11 3f 31 30 04 63 02 3e 32 04 63
    000000d0: 03 3f 19 5d 01 11 71 1a 5d 01 11 04 41 3f 1a 5d
    000000e0: 01 11 71 3a 32 41 04 63 0a 3f 19 5d 01 11 70 3a
    000000f0: 32 41 04 63 0b 3f 19 5d 03 11 71 1a 5d 03 11
  UrbLink              = 00000000
[687786 ms] UsbSnoop - DispatchAny(f890e610) : IRP_MJ_INTERNAL_DEVICE_CONTROL
[687786 ms] UsbSnoop - MyDispatchInternalIOCTL(f890fe80) : fdo=81b1aac0, Irp=81ae82f0, IRQL=2
[687786 ms]  >>>  URB 335 going down  >>> 
-- URB_FUNCTION_BULK_OR_INTERRUPT_TRANSFER:
  PipeHandle           = 822e77f4 [endpoint 0x00000002]
  TransferFlags        = 00000000 (USBD_TRANSFER_DIRECTION_OUT, ~USBD_SHORT_TRANSFER_OK)
  TransferBufferLength = 00000007
  TransferBuffer       = 00000000
  TransferBufferMDL    = 822d87a0
    00000000: 00 00 00 02 05 e0 00
  UrbLink              = 00000000
[687787 ms] UsbSnoop - MyInternalIOCTLCompletion(f890fdb0) : fido=81b19728, Irp=81ae82f0, Context=822e2150, IRQL=2
[687787 ms]  <<<  URB 335 coming back  <<< 
-- URB_FUNCTION_BULK_OR_INTERRUPT_TRANSFER:
  PipeHandle           = 822e77f4 [endpoint 0x00000002]
  TransferFlags        = 00000000 (USBD_TRANSFER_DIRECTION_OUT, ~USBD_SHORT_TRANSFER_OK)
  TransferBufferLength = 00000007
  TransferBuffer       = 00000000
  TransferBufferMDL    = 822d87a0
  UrbLink              = 00000000
[687796 ms] UsbSnoop - DispatchAny(f890e610) : IRP_MJ_INTERNAL_DEVICE_CONTROL
[687796 ms] UsbSnoop - MyDispatchInternalIOCTL(f890fe80) : fdo=81b1aac0, Irp=81ae82f0, IRQL=2
[687796 ms]  >>>  URB 336 going down  >>> 
-- URB_FUNCTION_BULK_OR_INTERRUPT_TRANSFER:
  PipeHandle           = 822e77d4 [endpoint 0x00000081]
  TransferFlags        = 00000003 (USBD_TRANSFER_DIRECTION_IN, USBD_SHORT_TRANSFER_OK)
  TransferBufferLength = 00000100
  TransferBuffer       = 00000000
  TransferBufferMDL    = 822d87a0
  UrbLink              = 00000000
[687818 ms] UsbSnoop - MyInternalIOCTLCompletion(f890fdb0) : fido=81b19728, Irp=81ae82f0, Context=81cd51b0, IRQL=2
[687818 ms]  <<<  URB 336 coming back  <<< 
-- URB_FUNCTION_BULK_OR_INTERRUPT_TRANSFER:
  PipeHandle           = 822e77d4 [endpoint 0x00000081]
  TransferFlags        = 00000003 (USBD_TRANSFER_DIRECTION_IN, USBD_SHORT_TRANSFER_OK)
  TransferBufferLength = 000000ff
  TransferBuffer       = 00000000
  TransferBufferMDL    = 822d87a0
    00000000: 00 00 00 fa 03 04 42 3f 1a 5d 03 11 71 3a 33 42
    00000010: 04 63 0c 3f 19 5d 03 11 70 3a 33 42 04 63 0d 3f
    00000020: 93 36 2b 31 2b 2a 49 4e 54 10 4d 57 83 43 4d 0d
    00000030: 11 2a 11 3f 93 35 31 2b 37 39 2b 2a 44 49 53 54
    00000040: 2a 11 3f 84 3f 4c 49 47 48 54 44 49 53 00 32 03
    00000050: 08 36 2b 30 09 04 5d 00 3e e7 5d 00 11 3f 31 04
    00000060: 63 0a 3e 32 04 63 0b 3e 31 04 63 0c 3e 32 04 63
    00000070: 0d 3f 7e 0b 3f 7e 09 3f 7e 0d 3f ea 3f 97 3f 85
    00000080: 3f 93 31 2b 31 36 2b 2a 54 45 58 41 53 29 29 49
    00000090: 4e 53 54 52 55 4d 45 4e 54 53 2a 11 3f 93 38 2b
    000000a0: 33 30 2b 2a 43 42 4c 29 29 29 53 59 53 54 45 4d
    000000b0: 2a 11 3f 93 31 35 2b 31 30 2b 2a 45 58 50 45 52
    000000c0: 49 4d 45 4e 54 29 29 29 57 4f 52 4b 42 4f 4f 4b
    000000d0: 2a 11 3f 93 32 39 2b 32 35 2b 2a 4c 49 47 48 54
    000000e0: 44 49 53 29 29 29 56 32 3a 30 2a 11 3f 93 33 36
    000000f0: 2b 32 30 2b 2a 10 45 58 50 45 52 49 4d 45 4e
  UrbLink              = 00000000
[687857 ms] UsbSnoop - DispatchAny(f890e610) : IRP_MJ_INTERNAL_DEVICE_CONTROL
[687857 ms] UsbSnoop - MyDispatchInternalIOCTL(f890fe80) : fdo=81b1aac0, Irp=81ae82f0, IRQL=2
[687857 ms]  >>>  URB 337 going down  >>> 
-- URB_FUNCTION_BULK_OR_INTERRUPT_TRANSFER:
  PipeHandle           = 822e77f4 [endpoint 0x00000002]
  TransferFlags        = 00000000 (USBD_TRANSFER_DIRECTION_OUT, ~USBD_SHORT_TRANSFER_OK)
  TransferBufferLength = 00000007
  TransferBuffer       = 00000000
  TransferBufferMDL    = 822d87a0
    00000000: 00 00 00 02 05 e0 00
  UrbLink              = 00000000
[687857 ms] UsbSnoop - MyInternalIOCTLCompletion(f890fdb0) : fido=81b19728, Irp=81ae82f0, Context=822db980, IRQL=2
[687857 ms]  <<<  URB 337 coming back  <<< 
-- URB_FUNCTION_BULK_OR_INTERRUPT_TRANSFER:
  PipeHandle           = 822e77f4 [endpoint 0x00000002]
  TransferFlags        = 00000000 (USBD_TRANSFER_DIRECTION_OUT, ~USBD_SHORT_TRANSFER_OK)
  TransferBufferLength = 00000007
  TransferBuffer       = 00000000
  TransferBufferMDL    = 822d87a0
  UrbLink              = 00000000
[687867 ms] UsbSnoop - DispatchAny(f890e610) : IRP_MJ_INTERNAL_DEVICE_CONTROL
[687867 ms] UsbSnoop - MyDispatchInternalIOCTL(f890fe80) : fdo=81b1aac0, Irp=81ae82f0, IRQL=2
[687867 ms]  >>>  URB 338 going down  >>> 
-- URB_FUNCTION_BULK_OR_INTERRUPT_TRANSFER:
  PipeHandle           = 822e77d4 [endpoint 0x00000081]
  TransferFlags        = 00000003 (USBD_TRANSFER_DIRECTION_IN, USBD_SHORT_TRANSFER_OK)
  TransferBufferLength = 00000100
  TransferBuffer       = 00000000
  TransferBufferMDL    = 822d87a0
  UrbLink              = 00000000
[687888 ms] UsbSnoop - MyInternalIOCTLCompletion(f890fdb0) : fido=81b19728, Irp=81ae82f0, Context=81cd51b0, IRQL=2
[687888 ms]  <<<  URB 338 coming back  <<< 
-- URB_FUNCTION_BULK_OR_INTERRUPT_TRANSFER:
  PipeHandle           = 822e77d4 [endpoint 0x00000081]
  TransferFlags        = 00000003 (USBD_TRANSFER_DIRECTION_IN, USBD_SHORT_TRANSFER_OK)
  TransferBufferLength = 000000ff
  TransferBuffer       = 00000000
  TransferBufferMDL    = 822d87a0
    00000000: 00 00 00 fa 03 54 29 29 29 4d 36 11 2a 11 3f 93
    00000010: 35 30 2b 31 39 2b 2a 50 52 45 53 53 29 29 29 06
    00000020: 45 4e 54 45 52 07 29 29 29 4f 4e 2a 3f 93 35 37
    00000030: 2b 32 38 2b 2a 54 49 71 38 33 29 29 29 50 4c 55
    00000040: 53 2a 3f d8 3f e1 3f de 2a 54 55 52 4e 29 4f 4e
    00000050: 29 54 48 45 29 43 42 4c 3a 2a 3f e0 34 2b 31 30
    00000060: 2b 2a 06 45 4e 54 45 52 07 2a 11 3f d8 3f 75 3f
    00000070: e1 3f de 2a 4e 4f 57 29 43 48 45 43 4b 49 4e 47
    00000080: 29 54 48 45 2a 3f de 2a 43 41 4c 43 55 4c 41 54
    00000090: 4f 52 71 43 42 4c 2a 3f de 2a 4c 49 4e 4b 29 43
    000000a0: 4f 4e 4e 45 43 54 49 4f 4e 3a 2a 3f de 2a 50 4c
    000000b0: 45 41 53 45 29 57 41 49 54 3a 3a 3a 3a 2a 3f 08
    000000c0: 31 2b 30 09 04 5d 00 3f e7 5d 00 11 3f 08 30 09
    000000d0: 04 5d 01 3f d6 4d 3f 08 37 09 04 5d 00 3f e7 5d
    000000e0: 00 11 3f e8 5d 01 11 3f ce b5 5d 01 11 6a 31 40
    000000f0: 5d 01 10 31 11 6a 30 3f cf 3f e1 3f de 2a 82
  UrbLink              = 00000000
[687917 ms] UsbSnoop - DispatchAny(f890e610) : IRP_MJ_INTERNAL_DEVICE_CONTROL
[687917 ms] UsbSnoop - MyDispatchInternalIOCTL(f890fe80) : fdo=81b1aac0, Irp=81ae82f0, IRQL=2
[687917 ms]  >>>  URB 339 going down  >>> 
-- URB_FUNCTION_BULK_OR_INTERRUPT_TRANSFER:
  PipeHandle           = 822e77f4 [endpoint 0x00000002]
  TransferFlags        = 00000000 (USBD_TRANSFER_DIRECTION_OUT, ~USBD_SHORT_TRANSFER_OK)
  TransferBufferLength = 00000007
  TransferBuffer       = 00000000
  TransferBufferMDL    = 822d87a0
    00000000: 00 00 00 02 05 e0 00
  UrbLink              = 00000000
[687917 ms] UsbSnoop - MyInternalIOCTLCompletion(f890fdb0) : fido=81b19728, Irp=81ae82f0, Context=822e2150, IRQL=2
[687917 ms]  <<<  URB 339 coming back  <<< 
-- URB_FUNCTION_BULK_OR_INTERRUPT_TRANSFER:
  PipeHandle           = 822e77f4 [endpoint 0x00000002]
  TransferFlags        = 00000000 (USBD_TRANSFER_DIRECTION_OUT, ~USBD_SHORT_TRANSFER_OK)
  TransferBufferLength = 00000007
  TransferBuffer       = 00000000
  TransferBufferMDL    = 822d87a0
  UrbLink              = 00000000
[687927 ms] UsbSnoop - DispatchAny(f890e610) : IRP_MJ_INTERNAL_DEVICE_CONTROL
[687927 ms] UsbSnoop - MyDispatchInternalIOCTL(f890fe80) : fdo=81b1aac0, Irp=81ae82f0, IRQL=2
[687927 ms]  >>>  URB 340 going down  >>> 
-- URB_FUNCTION_BULK_OR_INTERRUPT_TRANSFER:
  PipeHandle           = 822e77d4 [endpoint 0x00000081]
  TransferFlags        = 00000003 (USBD_TRANSFER_DIRECTION_IN, USBD_SHORT_TRANSFER_OK)
  TransferBufferLength = 00000100
  TransferBuffer       = 00000000
  TransferBufferMDL    = 822d87a0
  UrbLink              = 00000000
[687948 ms] UsbSnoop - MyInternalIOCTLCompletion(f890fdb0) : fido=81b19728, Irp=81ae82f0, Context=82307cb8, IRQL=2
[687948 ms]  <<<  URB 340 coming back  <<< 
-- URB_FUNCTION_BULK_OR_INTERRUPT_TRANSFER:
  PipeHandle           = 822e77d4 [endpoint 0x00000081]
  TransferFlags        = 00000003 (USBD_TRANSFER_DIRECTION_IN, USBD_SHORT_TRANSFER_OK)
  TransferBufferLength = 000000ff
  TransferBuffer       = 00000000
  TransferBufferMDL    = 822d87a0
    00000000: 00 00 00 fa 03 82 82 4c 49 4e 4b 29 45 52 52 4f
    00000010: 52 82 82 82 2a 3f de 2a 50 55 53 48 29 49 4e 29
    00000020: 54 48 45 29 4c 49 4e 4b 2a 3f de 2a 43 4f 52 44
    00000030: 29 43 4f 4e 4e 45 43 54 4f 52 53 2a 3f de 2a 46
    00000040: 49 52 4d 4c 59 29 54 48 45 4e 29 48 49 54 2a 3f
    00000050: de 2a 06 45 4e 54 45 52 07 3a 2a 3f d8 3f d7 4d
    00000060: 3f d4 3f de 2a 2a 3f e0 36 2b 31 2b 2a 29 29 53
    00000070: 54 41 54 55 53 3e 29 4f 3a 4b 3a 2a 3f e0 38 2b
    00000080: 31 30 2b 2a 06 45 4e 54 45 52 07 2a 11 3f d8 3f
    00000090: 76 3f e1 3f 85 3f 7e 08 3f 08 36 2b 30 09 04 5d
    000000a0: 00 3f e7 5d 00 11 3f 08 31 2b 30 09 04 5d 00 3f
    000000b0: e7 5d 00 11 3f 08 31 2b 31 31 2b 33 09 04 5d 00
    000000c0: 3f e7 5d 00 11 3f 08 31 2b 31 2b 31 09 04 5d 00
    000000d0: 3f e7 5d 00 11 3f 08 33 2b 3a 31 2b 34 30 2b 31
    000000e0: 2b 30 2b 30 2b 30 2b 30 2b 31 09 04 5d 00 3f e7
    000000f0: 5d 00 11 3f de 2a 50 52 45 53 53 29 54 52 49
  UrbLink              = 00000000
[687987 ms] UsbSnoop - DispatchAny(f890e610) : IRP_MJ_INTERNAL_DEVICE_CONTROL
[687987 ms] UsbSnoop - MyDispatchInternalIOCTL(f890fe80) : fdo=81b1aac0, Irp=81ae82f0, IRQL=2
[687987 ms]  >>>  URB 341 going down  >>> 
-- URB_FUNCTION_BULK_OR_INTERRUPT_TRANSFER:
  PipeHandle           = 822e77f4 [endpoint 0x00000002]
  TransferFlags        = 00000000 (USBD_TRANSFER_DIRECTION_OUT, ~USBD_SHORT_TRANSFER_OK)
  TransferBufferLength = 00000007
  TransferBuffer       = 00000000
  TransferBufferMDL    = 822d87a0
    00000000: 00 00 00 02 05 e0 00
  UrbLink              = 00000000
[687987 ms] UsbSnoop - MyInternalIOCTLCompletion(f890fdb0) : fido=81b19728, Irp=81ae82f0, Context=81cd51b0, IRQL=2
[687987 ms]  <<<  URB 341 coming back  <<< 
-- URB_FUNCTION_BULK_OR_INTERRUPT_TRANSFER:
  PipeHandle           = 822e77f4 [endpoint 0x00000002]
  TransferFlags        = 00000000 (USBD_TRANSFER_DIRECTION_OUT, ~USBD_SHORT_TRANSFER_OK)
  TransferBufferLength = 00000007
  TransferBuffer       = 00000000
  TransferBufferMDL    = 822d87a0
  UrbLink              = 00000000
[687997 ms] UsbSnoop - DispatchAny(f890e610) : IRP_MJ_INTERNAL_DEVICE_CONTROL
[687997 ms] UsbSnoop - MyDispatchInternalIOCTL(f890fe80) : fdo=81b1aac0, Irp=81ae82f0, IRQL=2
[687997 ms]  >>>  URB 342 going down  >>> 
-- URB_FUNCTION_BULK_OR_INTERRUPT_TRANSFER:
  PipeHandle           = 822e77d4 [endpoint 0x00000081]
  TransferFlags        = 00000003 (USBD_TRANSFER_DIRECTION_IN, USBD_SHORT_TRANSFER_OK)
  TransferBufferLength = 00000100
  TransferBuffer       = 00000000
  TransferBufferMDL    = 822d87a0
  UrbLink              = 00000000
[688018 ms] UsbSnoop - MyInternalIOCTLCompletion(f890fdb0) : fido=81b19728, Irp=81ae82f0, Context=82307cb8, IRQL=2
[688018 ms]  <<<  URB 342 coming back  <<< 
-- URB_FUNCTION_BULK_OR_INTERRUPT_TRANSFER:
  PipeHandle           = 822e77d4 [endpoint 0x00000081]
  TransferFlags        = 00000003 (USBD_TRANSFER_DIRECTION_IN, USBD_SHORT_TRANSFER_OK)
  TransferBufferLength = 000000ff
  TransferBuffer       = 00000000
  TransferBufferMDL    = 822d87a0
    00000000: 00 00 00 fa 03 47 47 45 52 29 4f 4e 2a 3f 3e de
    00000010: 2a 43 42 4c 29 54 4f 29 53 54 41 52 54 3a 2a 3f
    00000020: 3e de 2a 57 48 45 4e 29 53 41 4d 50 4c 49 4e 47
    00000030: 2a 3f 3e de 2a 43 4f 4d 50 4c 45 54 45 2b 29 50
    00000040: 52 45 53 53 2a 3f 3e de 2a 45 4e 54 45 52 29 4f
    00000050: 4e 2a 3f 3e de 2a 54 49 71 38 33 29 29 29 50 4c
    00000060: 55 53 3a 2a 3f 3e d8 3f 3e e1 3f 3e de 2a 52 55
    00000070: 4e 29 47 45 54 4c 49 47 48 54 29 54 4f 2a 3f 3e
    00000080: de 2a 52 45 54 52 49 45 56 45 29 44 41 54 41 3a
    00000090: 2a 3f d8 3f 50 48 00 ff 03 08 36 2b 30 09 04 5d
    000000a0: 00 3e e7 5d 00 11 3f 31 04 63 0a 3e 32 04 63 0b
    000000b0: 3e 31 04 63 0c 3e 32 04 63 0d 3f 7e 0b 3f 7e 09
    000000c0: 3f 7e 0d 3f ea 3f 97 3f 85 3f 93 31 2b 31 36 2b
    000000d0: 2a 54 45 58 41 53 29 29 49 4e 53 54 52 55 4d 45
    000000e0: 4e 54 53 2a 11 3f 93 38 2b 33 30 2b 2a 43 42 4c
    000000f0: 29 29 29 53 59 53 54 45 4d 2a 11 3f 93 31 35
  UrbLink              = 00000000
[688057 ms] UsbSnoop - DispatchAny(f890e610) : IRP_MJ_INTERNAL_DEVICE_CONTROL
[688057 ms] UsbSnoop - MyDispatchInternalIOCTL(f890fe80) : fdo=81b1aac0, Irp=81ae82f0, IRQL=2
[688057 ms]  >>>  URB 343 going down  >>> 
-- URB_FUNCTION_BULK_OR_INTERRUPT_TRANSFER:
  PipeHandle           = 822e77f4 [endpoint 0x00000002]
  TransferFlags        = 00000000 (USBD_TRANSFER_DIRECTION_OUT, ~USBD_SHORT_TRANSFER_OK)
  TransferBufferLength = 00000007
  TransferBuffer       = 00000000
  TransferBufferMDL    = 822d87a0
    00000000: 00 00 00 02 05 e0 00
  UrbLink              = 00000000
[688057 ms] UsbSnoop - MyInternalIOCTLCompletion(f890fdb0) : fido=81b19728, Irp=81ae82f0, Context=822db980, IRQL=2
[688057 ms]  <<<  URB 343 coming back  <<< 
-- URB_FUNCTION_BULK_OR_INTERRUPT_TRANSFER:
  PipeHandle           = 822e77f4 [endpoint 0x00000002]
  TransferFlags        = 00000000 (USBD_TRANSFER_DIRECTION_OUT, ~USBD_SHORT_TRANSFER_OK)
  TransferBufferLength = 00000007
  TransferBuffer       = 00000000
  TransferBufferMDL    = 822d87a0
  UrbLink              = 00000000
[688067 ms] UsbSnoop - DispatchAny(f890e610) : IRP_MJ_INTERNAL_DEVICE_CONTROL
[688067 ms] UsbSnoop - MyDispatchInternalIOCTL(f890fe80) : fdo=81b1aac0, Irp=81ae82f0, IRQL=2
[688067 ms]  >>>  URB 344 going down  >>> 
-- URB_FUNCTION_BULK_OR_INTERRUPT_TRANSFER:
  PipeHandle           = 822e77d4 [endpoint 0x00000081]
  TransferFlags        = 00000003 (USBD_TRANSFER_DIRECTION_IN, USBD_SHORT_TRANSFER_OK)
  TransferBufferLength = 00000100
  TransferBuffer       = 00000000
  TransferBufferMDL    = 822d87a0
  UrbLink              = 00000000
[688088 ms] UsbSnoop - MyInternalIOCTLCompletion(f890fdb0) : fido=81b19728, Irp=81ae82f0, Context=82307cb8, IRQL=2
[688088 ms]  <<<  URB 344 coming back  <<< 
-- URB_FUNCTION_BULK_OR_INTERRUPT_TRANSFER:
  PipeHandle           = 822e77d4 [endpoint 0x00000081]
  TransferFlags        = 00000003 (USBD_TRANSFER_DIRECTION_IN, USBD_SHORT_TRANSFER_OK)
  TransferBufferLength = 000000ff
  TransferBuffer       = 00000000
  TransferBufferMDL    = 822d87a0
    00000000: 00 00 00 fa 03 2b 31 30 2b 2a 45 58 50 45 52 49
    00000010: 4d 45 4e 54 29 29 29 57 4f 52 4b 42 4f 4f 4b 2a
    00000020: 11 3f 93 32 39 2b 33 36 2b 2a 50 48 29 29 29 56
    00000030: 32 3a 30 2a 11 3f 93 33 36 2b 33 2b 2a 10 45 58
    00000040: 50 45 52 49 4d 45 4e 54 29 29 29 43 31 2b 43 32
    00000050: 2b 43 34 2b 43 35 11 2a 11 3f 93 35 30 2b 31 39
    00000060: 2b 2a 50 52 45 53 53 29 29 29 06 45 4e 54 45 52
    00000070: 07 29 29 29 4f 4e 2a 3f 93 35 37 2b 32 38 2b 2a
    00000080: 54 49 71 38 33 29 29 29 50 4c 55 53 2a 3f d8 3f
    00000090: e1 3f de 2a 54 55 52 4e 29 4f 4e 29 54 48 45 29
    000000a0: 43 42 4c 3a 2a 3f e0 34 2b 31 30 2b 2a 06 45 4e
    000000b0: 54 45 52 07 2a 11 3f d8 3f 75 3f e1 3f de 2a 4e
    000000c0: 4f 57 29 43 48 45 43 4b 49 4e 47 29 54 48 45 2a
    000000d0: 3f de 2a 43 41 4c 43 55 4c 41 54 4f 52 71 43 42
    000000e0: 4c 2a 3f de 2a 4c 49 4e 4b 29 43 4f 4e 4e 45 43
    000000f0: 54 49 4f 4e 3a 2a 3f de 2a 50 4c 45 41 53 45
  UrbLink              = 00000000
[688117 ms] UsbSnoop - DispatchAny(f890e610) : IRP_MJ_INTERNAL_DEVICE_CONTROL
[688117 ms] UsbSnoop - MyDispatchInternalIOCTL(f890fe80) : fdo=81b1aac0, Irp=81ae82f0, IRQL=2
[688117 ms]  >>>  URB 345 going down  >>> 
-- URB_FUNCTION_BULK_OR_INTERRUPT_TRANSFER:
  PipeHandle           = 822e77f4 [endpoint 0x00000002]
  TransferFlags        = 00000000 (USBD_TRANSFER_DIRECTION_OUT, ~USBD_SHORT_TRANSFER_OK)
  TransferBufferLength = 00000007
  TransferBuffer       = 00000000
  TransferBufferMDL    = 822d87a0
    00000000: 00 00 00 02 05 e0 00
  UrbLink              = 00000000
[688117 ms] UsbSnoop - MyInternalIOCTLCompletion(f890fdb0) : fido=81b19728, Irp=81ae82f0, Context=81cd51b0, IRQL=2
[688117 ms]  <<<  URB 345 coming back  <<< 
-- URB_FUNCTION_BULK_OR_INTERRUPT_TRANSFER:
  PipeHandle           = 822e77f4 [endpoint 0x00000002]
  TransferFlags        = 00000000 (USBD_TRANSFER_DIRECTION_OUT, ~USBD_SHORT_TRANSFER_OK)
  TransferBufferLength = 00000007
  TransferBuffer       = 00000000
  TransferBufferMDL    = 822d87a0
  UrbLink              = 00000000
[688127 ms] UsbSnoop - DispatchAny(f890e610) : IRP_MJ_INTERNAL_DEVICE_CONTROL
[688127 ms] UsbSnoop - MyDispatchInternalIOCTL(f890fe80) : fdo=81b1aac0, Irp=81ae82f0, IRQL=2
[688127 ms]  >>>  URB 346 going down  >>> 
-- URB_FUNCTION_BULK_OR_INTERRUPT_TRANSFER:
  PipeHandle           = 822e77d4 [endpoint 0x00000081]
  TransferFlags        = 00000003 (USBD_TRANSFER_DIRECTION_IN, USBD_SHORT_TRANSFER_OK)
  TransferBufferLength = 00000100
  TransferBuffer       = 00000000
  TransferBufferMDL    = 822d87a0
  UrbLink              = 00000000
[688148 ms] UsbSnoop - MyInternalIOCTLCompletion(f890fdb0) : fido=81b19728, Irp=81ae82f0, Context=81b05970, IRQL=2
[688148 ms]  <<<  URB 346 coming back  <<< 
-- URB_FUNCTION_BULK_OR_INTERRUPT_TRANSFER:
  PipeHandle           = 822e77d4 [endpoint 0x00000081]
  TransferFlags        = 00000003 (USBD_TRANSFER_DIRECTION_IN, USBD_SHORT_TRANSFER_OK)
  TransferBufferLength = 000000ff
  TransferBuffer       = 00000000
  TransferBufferMDL    = 822d87a0
    00000000: 00 00 00 fa 03 29 57 41 49 54 3a 3a 3a 3a 2a 3f
    00000010: 08 31 2b 30 09 04 5d 00 3f e7 5d 00 11 3f 08 30
    00000020: 09 04 5d 01 3f d6 4d 3f 08 37 09 04 5d 00 3f e7
    00000030: 5d 00 11 3f e8 5d 01 11 3f ce b5 5d 01 11 6a 31
    00000040: 40 5d 01 10 31 11 6a 30 3f cf 3f e1 3f de 2a 82
    00000050: 82 82 4c 49 4e 4b 29 45 52 52 4f 52 82 82 82 2a
    00000060: 3f de 2a 50 55 53 48 29 49 4e 29 54 48 45 29 4c
    00000070: 49 4e 4b 2a 3f de 2a 43 4f 52 44 29 43 4f 4e 4e
    00000080: 45 43 54 4f 52 53 2a 3f de 2a 46 49 52 4d 4c 59
    00000090: 29 54 48 45 4e 29 48 49 54 2a 3f de 2a 06 45 4e
    000000a0: 54 45 52 07 3a 2a 3f d8 3f d7 4d 3f d4 3f de 2a
    000000b0: 2a 3f e0 36 2b 31 2b 2a 29 29 53 54 41 54 55 53
    000000c0: 3e 29 4f 3a 4b 3a 2a 3f e0 38 2b 31 30 2b 2a 06
    000000d0: 45 4e 54 45 52 07 2a 11 3f d8 3f 76 3f e1 3f 85
    000000e0: 3f 7e 08 3f b0 35 04 63 0a 3f 35 30 04 63 0b 3f
    000000f0: 35 04 63 02 3f b0 32 04 63 0c 3f 31 34 04 63
  UrbLink              = 00000000
[688187 ms] UsbSnoop - DispatchAny(f890e610) : IRP_MJ_INTERNAL_DEVICE_CONTROL
[688187 ms] UsbSnoop - MyDispatchInternalIOCTL(f890fe80) : fdo=81b1aac0, Irp=81ae82f0, IRQL=2
[688187 ms]  >>>  URB 347 going down  >>> 
-- URB_FUNCTION_BULK_OR_INTERRUPT_TRANSFER:
  PipeHandle           = 822e77f4 [endpoint 0x00000002]
  TransferFlags        = 00000000 (USBD_TRANSFER_DIRECTION_OUT, ~USBD_SHORT_TRANSFER_OK)
  TransferBufferLength = 00000007
  TransferBuffer       = 00000000
  TransferBufferMDL    = 822d87a0
    00000000: 00 00 00 02 05 e0 00
  UrbLink              = 00000000
[688187 ms] UsbSnoop - MyInternalIOCTLCompletion(f890fdb0) : fido=81b19728, Irp=81ae82f0, Context=82307cb8, IRQL=2
[688187 ms]  <<<  URB 347 coming back  <<< 
-- URB_FUNCTION_BULK_OR_INTERRUPT_TRANSFER:
  PipeHandle           = 822e77f4 [endpoint 0x00000002]
  TransferFlags        = 00000000 (USBD_TRANSFER_DIRECTION_OUT, ~USBD_SHORT_TRANSFER_OK)
  TransferBufferLength = 00000007
  TransferBuffer       = 00000000
  TransferBufferMDL    = 822d87a0
  UrbLink              = 00000000
[688197 ms] UsbSnoop - DispatchAny(f890e610) : IRP_MJ_INTERNAL_DEVICE_CONTROL
[688197 ms] UsbSnoop - MyDispatchInternalIOCTL(f890fe80) : fdo=81b1aac0, Irp=81ae82f0, IRQL=2
[688197 ms]  >>>  URB 348 going down  >>> 
-- URB_FUNCTION_BULK_OR_INTERRUPT_TRANSFER:
  PipeHandle           = 822e77d4 [endpoint 0x00000081]
  TransferFlags        = 00000003 (USBD_TRANSFER_DIRECTION_IN, USBD_SHORT_TRANSFER_OK)
  TransferBufferLength = 00000100
  TransferBuffer       = 00000000
  TransferBufferMDL    = 822d87a0
  UrbLink              = 00000000
[688218 ms] UsbSnoop - MyInternalIOCTLCompletion(f890fdb0) : fido=81b19728, Irp=81ae82f0, Context=81b05970, IRQL=2
[688218 ms]  <<<  URB 348 coming back  <<< 
-- URB_FUNCTION_BULK_OR_INTERRUPT_TRANSFER:
  PipeHandle           = 822e77d4 [endpoint 0x00000081]
  TransferFlags        = 00000003 (USBD_TRANSFER_DIRECTION_IN, USBD_SHORT_TRANSFER_OK)
  TransferBufferLength = 000000ff
  TransferBuffer       = 00000000
  TransferBufferMDL    = 822d87a0
    00000000: 00 00 00 fa 03 0d 3f 31 04 63 03 3f fa 5d 03 2b
    00000010: 5d 04 3f e1 3f 08 36 2b 30 09 04 5d 00 3f e7 5d
    00000020: 00 11 3f 08 31 2b 30 09 04 5d 00 3f e7 5d 00 11
    00000030: 3f 08 34 2b 31 2b 31 2b 31 2b 31 33 3a 36 36 32
    00000040: 2b b0 33 3a 38 30 37 09 04 5d 00 3f e7 5d 00 11
    00000050: 3f 08 31 2b 31 2b 31 2b 30 2b 30 2b 31 09 04 5d
    00000060: 00 3f e7 5d 00 11 3f 85 3f d6 4c 3f e1 3f de 2a
    00000070: 45 4e 54 45 52 29 4e 55 4d 42 45 52 2a 3f de 2a
    00000080: 4f 46 29 53 41 4d 50 4c 45 53 2a 3f dc 43 3f ce
    00000090: 43 6b 31 3c 43 6f b1 43 11 3e d7 4c 3f 43 04 b5
    000000a0: 5d 03 3f e1 3f 08 33 2b 30 2b b0 31 2b 36 09 04
    000000b0: 5d 00 3f e7 5d 00 11 3f de 2a 50 4c 45 41 53 45
    000000c0: 29 41 4c 4c 4f 57 2a 3f de 2a 53 59 53 54 45 4d
    000000d0: 29 33 30 2a 3f de 2a 53 45 43 4f 4e 44 53 29 54
    000000e0: 4f 29 2a 3f de 2a 57 41 52 4d 29 55 50 2a 3f e0
    000000f0: 36 2b 31 30 2b 2a 06 45 4e 54 45 52 07 2a 11
  UrbLink              = 00000000
[688257 ms] UsbSnoop - DispatchAny(f890e610) : IRP_MJ_INTERNAL_DEVICE_CONTROL
[688257 ms] UsbSnoop - MyDispatchInternalIOCTL(f890fe80) : fdo=81b1aac0, Irp=81ae82f0, IRQL=2
[688257 ms]  >>>  URB 349 going down  >>> 
-- URB_FUNCTION_BULK_OR_INTERRUPT_TRANSFER:
  PipeHandle           = 822e77f4 [endpoint 0x00000002]
  TransferFlags        = 00000000 (USBD_TRANSFER_DIRECTION_OUT, ~USBD_SHORT_TRANSFER_OK)
  TransferBufferLength = 00000007
  TransferBuffer       = 00000000
  TransferBufferMDL    = 822d87a0
    00000000: 00 00 00 02 05 e0 00
  UrbLink              = 00000000
[688257 ms] UsbSnoop - MyInternalIOCTLCompletion(f890fdb0) : fido=81b19728, Irp=81ae82f0, Context=822db980, IRQL=2
[688257 ms]  <<<  URB 349 coming back  <<< 
-- URB_FUNCTION_BULK_OR_INTERRUPT_TRANSFER:
  PipeHandle           = 822e77f4 [endpoint 0x00000002]
  TransferFlags        = 00000000 (USBD_TRANSFER_DIRECTION_OUT, ~USBD_SHORT_TRANSFER_OK)
  TransferBufferLength = 00000007
  TransferBuffer       = 00000000
  TransferBufferMDL    = 822d87a0
  UrbLink              = 00000000
[688267 ms] UsbSnoop - DispatchAny(f890e610) : IRP_MJ_INTERNAL_DEVICE_CONTROL
[688267 ms] UsbSnoop - MyDispatchInternalIOCTL(f890fe80) : fdo=81b1aac0, Irp=81ae82f0, IRQL=2
[688267 ms]  >>>  URB 350 going down  >>> 
-- URB_FUNCTION_BULK_OR_INTERRUPT_TRANSFER:
  PipeHandle           = 822e77d4 [endpoint 0x00000081]
  TransferFlags        = 00000003 (USBD_TRANSFER_DIRECTION_IN, USBD_SHORT_TRANSFER_OK)
  TransferBufferLength = 00000100
  TransferBuffer       = 00000000
  TransferBufferMDL    = 822d87a0
  UrbLink              = 00000000
[688289 ms] UsbSnoop - MyInternalIOCTLCompletion(f890fdb0) : fido=81b19728, Irp=81ae82f0, Context=81b05970, IRQL=2
[688289 ms]  <<<  URB 350 coming back  <<< 
-- URB_FUNCTION_BULK_OR_INTERRUPT_TRANSFER:
  PipeHandle           = 822e77d4 [endpoint 0x00000081]
  TransferFlags        = 00000003 (USBD_TRANSFER_DIRECTION_IN, USBD_SHORT_TRANSFER_OK)
  TransferBufferLength = 000000ff
  TransferBuffer       = 00000000
  TransferBufferMDL    = 822d87a0
    00000000: 00 00 00 fa 03 3f d8 3f e1 3f de 2a 50 52 45 53
    00000010: 53 29 54 52 49 47 47 45 52 2a 3f de 2a 54 4f 29
    00000020: 43 4f 4c 4c 45 43 54 2a 3f de 2a 50 48 29 52 45
    00000030: 41 44 49 4e 47 53 2a 3f d3 49 2b 31 2b 43 2b 31
    00000040: 11 3f e8 5d 03 10 49 11 11 3f de 2a 4d 4c af 2a
    00000050: 3f dc 44 3f 44 04 5d 04 10 49 11 3f 9e 5d 04 10
    00000060: 49 11 2b 5d 03 10 49 11 11 3f d4 3f 19 5d 04 11
    00000070: 04 63 0b 3f 10 b0 3a 31 11 82 63 0b 04 63 0a 3f
    00000080: ec fd 2b 5d 04 2b 5d 03 2b 81 11 3f 93 37 2b 31
    00000090: 2b 2a 50 2a 11 3f 93 31 34 2b 31 2b 2a 48 2a 11
    000000a0: 3f 93 35 31 2b 37 38 2b 2a 4d 4c 2a 11 3f 84 3f
    000000b0: 50 48 52 54 00 ea 03 08 36 2b 30 09 04 5d 00 3e
    000000c0: e7 5d 00 11 3f 31 04 63 0a 3e 32 04 63 0b 3e 31
    000000d0: 04 63 0c 3e 32 04 63 0d 3f 7e 0b 3f 7e 09 3f 7e
    000000e0: 0d 3f ea 3f 97 3f 85 3f 93 31 2b 31 36 2b 2a 54
    000000f0: 45 58 41 53 29 29 49 4e 53 54 52 55 4d 45 4e
  UrbLink              = 00000000
[688317 ms] UsbSnoop - DispatchAny(f890e610) : IRP_MJ_INTERNAL_DEVICE_CONTROL
[688317 ms] UsbSnoop - MyDispatchInternalIOCTL(f890fe80) : fdo=81b1aac0, Irp=81ae82f0, IRQL=2
[688317 ms]  >>>  URB 351 going down  >>> 
-- URB_FUNCTION_BULK_OR_INTERRUPT_TRANSFER:
  PipeHandle           = 822e77f4 [endpoint 0x00000002]
  TransferFlags        = 00000000 (USBD_TRANSFER_DIRECTION_OUT, ~USBD_SHORT_TRANSFER_OK)
  TransferBufferLength = 00000007
  TransferBuffer       = 00000000
  TransferBufferMDL    = 822d87a0
    00000000: 00 00 00 02 05 e0 00
  UrbLink              = 00000000
[688317 ms] UsbSnoop - MyInternalIOCTLCompletion(f890fdb0) : fido=81b19728, Irp=81ae82f0, Context=82307cb8, IRQL=2
[688318 ms]  <<<  URB 351 coming back  <<< 
-- URB_FUNCTION_BULK_OR_INTERRUPT_TRANSFER:
  PipeHandle           = 822e77f4 [endpoint 0x00000002]
  TransferFlags        = 00000000 (USBD_TRANSFER_DIRECTION_OUT, ~USBD_SHORT_TRANSFER_OK)
  TransferBufferLength = 00000007
  TransferBuffer       = 00000000
  TransferBufferMDL    = 822d87a0
  UrbLink              = 00000000
[688328 ms] UsbSnoop - DispatchAny(f890e610) : IRP_MJ_INTERNAL_DEVICE_CONTROL
[688328 ms] UsbSnoop - MyDispatchInternalIOCTL(f890fe80) : fdo=81b1aac0, Irp=81ae82f0, IRQL=2
[688328 ms]  >>>  URB 352 going down  >>> 
-- URB_FUNCTION_BULK_OR_INTERRUPT_TRANSFER:
  PipeHandle           = 822e77d4 [endpoint 0x00000081]
  TransferFlags        = 00000003 (USBD_TRANSFER_DIRECTION_IN, USBD_SHORT_TRANSFER_OK)
  TransferBufferLength = 00000100
  TransferBuffer       = 00000000
  TransferBufferMDL    = 822d87a0
  UrbLink              = 00000000
[688349 ms] UsbSnoop - MyInternalIOCTLCompletion(f890fdb0) : fido=81b19728, Irp=81ae82f0, Context=821aa3a8, IRQL=2
[688349 ms]  <<<  URB 352 coming back  <<< 
-- URB_FUNCTION_BULK_OR_INTERRUPT_TRANSFER:
  PipeHandle           = 822e77d4 [endpoint 0x00000081]
  TransferFlags        = 00000003 (USBD_TRANSFER_DIRECTION_IN, USBD_SHORT_TRANSFER_OK)
  TransferBufferLength = 000000ff
  TransferBuffer       = 00000000
  TransferBufferMDL    = 822d87a0
    00000000: 00 00 00 fa 03 54 53 2a 11 3f 93 38 2b 33 30 2b
    00000010: 2a 43 42 4c 29 29 29 53 59 53 54 45 4d 2a 11 3f
    00000020: 93 31 35 2b 31 30 2b 2a 45 58 50 45 52 49 4d 45
    00000030: 4e 54 29 29 29 57 4f 52 4b 42 4f 4f 4b 2a 11 3f
    00000040: 93 32 39 2b 33 32 2b 2a 50 48 52 54 29 29 29 56
    00000050: 32 3a 30 2a 11 3f 93 33 36 2b 31 38 2b 2a 10 45
    00000060: 58 50 45 52 49 4d 45 4e 54 29 29 29 43 31 11 2a
    00000070: 11 3f 93 35 30 2b 31 39 2b 2a 50 52 45 53 53 29
    00000080: 29 29 06 45 4e 54 45 52 07 29 29 29 4f 4e 2a 3f
    00000090: 93 35 37 2b 32 38 2b 2a 54 49 71 38 33 29 29 29
    000000a0: 50 4c 55 53 2a 3f d8 3f e1 3f de 2a 54 55 52 4e
    000000b0: 29 4f 4e 29 54 48 45 29 43 42 4c 3a 2a 3f e0 34
    000000c0: 2b 31 30 2b 2a 06 45 4e 54 45 52 07 2a 11 3f d8
    000000d0: 3f 75 3f e1 3f de 2a 4e 4f 57 29 43 48 45 43 4b
    000000e0: 49 4e 47 29 54 48 45 2a 3f de 2a 43 41 4c 43 55
    000000f0: 4c 41 54 4f 52 71 43 42 4c 2a 3f de 2a 4c 49
  UrbLink              = 00000000
[688387 ms] UsbSnoop - DispatchAny(f890e610) : IRP_MJ_INTERNAL_DEVICE_CONTROL
[688387 ms] UsbSnoop - MyDispatchInternalIOCTL(f890fe80) : fdo=81b1aac0, Irp=81ae82f0, IRQL=2
[688387 ms]  >>>  URB 353 going down  >>> 
-- URB_FUNCTION_BULK_OR_INTERRUPT_TRANSFER:
  PipeHandle           = 822e77f4 [endpoint 0x00000002]
  TransferFlags        = 00000000 (USBD_TRANSFER_DIRECTION_OUT, ~USBD_SHORT_TRANSFER_OK)
  TransferBufferLength = 00000007
  TransferBuffer       = 00000000
  TransferBufferMDL    = 822d87a0
    00000000: 00 00 00 02 05 e0 00
  UrbLink              = 00000000
[688388 ms] UsbSnoop - MyInternalIOCTLCompletion(f890fdb0) : fido=81b19728, Irp=81ae82f0, Context=81b05970, IRQL=2
[688388 ms]  <<<  URB 353 coming back  <<< 
-- URB_FUNCTION_BULK_OR_INTERRUPT_TRANSFER:
  PipeHandle           = 822e77f4 [endpoint 0x00000002]
  TransferFlags        = 00000000 (USBD_TRANSFER_DIRECTION_OUT, ~USBD_SHORT_TRANSFER_OK)
  TransferBufferLength = 00000007
  TransferBuffer       = 00000000
  TransferBufferMDL    = 822d87a0
  UrbLink              = 00000000
[688397 ms] UsbSnoop - DispatchAny(f890e610) : IRP_MJ_INTERNAL_DEVICE_CONTROL
[688397 ms] UsbSnoop - MyDispatchInternalIOCTL(f890fe80) : fdo=81b1aac0, Irp=81ae82f0, IRQL=2
[688397 ms]  >>>  URB 354 going down  >>> 
-- URB_FUNCTION_BULK_OR_INTERRUPT_TRANSFER:
  PipeHandle           = 822e77d4 [endpoint 0x00000081]
  TransferFlags        = 00000003 (USBD_TRANSFER_DIRECTION_IN, USBD_SHORT_TRANSFER_OK)
  TransferBufferLength = 00000100
  TransferBuffer       = 00000000
  TransferBufferMDL    = 822d87a0
  UrbLink              = 00000000
[688419 ms] UsbSnoop - MyInternalIOCTLCompletion(f890fdb0) : fido=81b19728, Irp=81ae82f0, Context=821aa3a8, IRQL=2
[688419 ms]  <<<  URB 354 coming back  <<< 
-- URB_FUNCTION_BULK_OR_INTERRUPT_TRANSFER:
  PipeHandle           = 822e77d4 [endpoint 0x00000081]
  TransferFlags        = 00000003 (USBD_TRANSFER_DIRECTION_IN, USBD_SHORT_TRANSFER_OK)
  TransferBufferLength = 000000ff
  TransferBuffer       = 00000000
  TransferBufferMDL    = 822d87a0
    00000000: 00 00 00 fa 03 4e 4b 29 43 4f 4e 4e 45 43 54 49
    00000010: 4f 4e 3a 2a 3f de 2a 50 4c 45 41 53 45 29 57 41
    00000020: 49 54 3a 3a 3a 3a 2a 3f 08 31 2b 30 09 04 5d 00
    00000030: 3f e7 5d 00 11 3f 08 30 09 04 5d 01 3f d6 4d 3f
    00000040: 08 37 09 04 5d 00 3f e7 5d 00 11 3f e8 5d 01 11
    00000050: 3f ce b5 5d 01 11 6a 31 40 5d 01 10 31 11 6a 30
    00000060: 3f cf 3f e1 3f de 2a 82 82 82 4c 49 4e 4b 29 45
    00000070: 52 52 4f 52 82 82 82 2a 3f de 2a 50 55 53 48 29
    00000080: 49 4e 29 54 48 45 29 4c 49 4e 4b 2a 3f de 2a 43
    00000090: 4f 52 44 29 43 4f 4e 4e 45 43 54 4f 52 53 2a 3f
    000000a0: de 2a 46 49 52 4d 4c 59 29 54 48 45 4e 29 48 49
    000000b0: 54 2a 3f de 2a 06 45 4e 54 45 52 07 3a 2a 3f d8
    000000c0: 3f d7 4d 3f d4 3f de 2a 2a 3f e0 36 2b 31 2b 2a
    000000d0: 29 29 53 54 41 54 55 53 3e 29 4f 3a 4b 3a 2a 3f
    000000e0: e0 38 2b 31 30 2b 2a 06 45 4e 54 45 52 07 2a 11
    000000f0: 3f d8 3f 76 3f e1 3f 85 3f 7e 08 3f b0 35 04
  UrbLink              = 00000000
[688458 ms] UsbSnoop - DispatchAny(f890e610) : IRP_MJ_INTERNAL_DEVICE_CONTROL
[688458 ms] UsbSnoop - MyDispatchInternalIOCTL(f890fe80) : fdo=81b1aac0, Irp=81ae82f0, IRQL=2
[688458 ms]  >>>  URB 355 going down  >>> 
-- URB_FUNCTION_BULK_OR_INTERRUPT_TRANSFER:
  PipeHandle           = 822e77f4 [endpoint 0x00000002]
  TransferFlags        = 00000000 (USBD_TRANSFER_DIRECTION_OUT, ~USBD_SHORT_TRANSFER_OK)
  TransferBufferLength = 00000007
  TransferBuffer       = 00000000
  TransferBufferMDL    = 822d87a0
    00000000: 00 00 00 02 05 e0 00
  UrbLink              = 00000000
[688458 ms] UsbSnoop - MyInternalIOCTLCompletion(f890fdb0) : fido=81b19728, Irp=81ae82f0, Context=822db980, IRQL=2
[688458 ms]  <<<  URB 355 coming back  <<< 
-- URB_FUNCTION_BULK_OR_INTERRUPT_TRANSFER:
  PipeHandle           = 822e77f4 [endpoint 0x00000002]
  TransferFlags        = 00000000 (USBD_TRANSFER_DIRECTION_OUT, ~USBD_SHORT_TRANSFER_OK)
  TransferBufferLength = 00000007
  TransferBuffer       = 00000000
  TransferBufferMDL    = 822d87a0
  UrbLink              = 00000000
[688468 ms] UsbSnoop - DispatchAny(f890e610) : IRP_MJ_INTERNAL_DEVICE_CONTROL
[688468 ms] UsbSnoop - MyDispatchInternalIOCTL(f890fe80) : fdo=81b1aac0, Irp=81ae82f0, IRQL=2
[688468 ms]  >>>  URB 356 going down  >>> 
-- URB_FUNCTION_BULK_OR_INTERRUPT_TRANSFER:
  PipeHandle           = 822e77d4 [endpoint 0x00000081]
  TransferFlags        = 00000003 (USBD_TRANSFER_DIRECTION_IN, USBD_SHORT_TRANSFER_OK)
  TransferBufferLength = 00000100
  TransferBuffer       = 00000000
  TransferBufferMDL    = 822d87a0
  UrbLink              = 00000000
[688489 ms] UsbSnoop - MyInternalIOCTLCompletion(f890fdb0) : fido=81b19728, Irp=81ae82f0, Context=821aa3a8, IRQL=2
[688489 ms]  <<<  URB 356 coming back  <<< 
-- URB_FUNCTION_BULK_OR_INTERRUPT_TRANSFER:
  PipeHandle           = 822e77d4 [endpoint 0x00000081]
  TransferFlags        = 00000003 (USBD_TRANSFER_DIRECTION_IN, USBD_SHORT_TRANSFER_OK)
  TransferBufferLength = 000000ff
  TransferBuffer       = 00000000
  TransferBufferMDL    = 822d87a0
    00000000: 00 00 00 fa 03 63 0a 3f 31 37 38 30 04 63 0b 3f
    00000010: 36 30 04 63 02 3f b0 32 04 63 0c 3f 31 34 04 63
    00000020: 0d 3f 31 04 63 03 3f fa 5d 03 2b 5d 04 3f e1 3f
    00000030: 08 36 2b 30 09 04 5d 00 3f e7 5d 00 11 3f 08 31
    00000040: 2b 30 09 04 5d 00 3f e7 5d 00 11 3f 08 34 2b 31
    00000050: 2b 31 2b 31 2b 31 33 3a 36 36 32 2b b0 33 3a 38
    00000060: 30 37 09 04 5d 00 3f e7 5d 00 11 3f 08 31 2b 31
    00000070: 2b 31 2b 30 2b 30 2b 31 09 04 5d 00 3f e7 5d 00
    00000080: 11 3f 39 30 04 b5 5d 03 3f 08 33 2b 3a 32 35 2b
    00000090: 31 2b 31 09 04 4c 31 3f e7 4c 31 11 3f de 2a 50
    000000a0: 4c 45 41 53 45 29 41 4c 4c 4f 57 2a 3f de 2a 53
    000000b0: 59 53 54 45 4d 29 33 30 2a 3f de 2a 53 45 43 4f
    000000c0: 4e 44 53 29 54 4f 2a 3f de 2a 57 41 52 4d 29 55
    000000d0: 50 2a 3f e0 36 2b 31 30 2b 2a 06 45 4e 54 45 52
    000000e0: 07 2a 11 3f d8 3f e1 3f de 2a 50 52 45 53 53 29
    000000f0: 45 4e 54 45 52 29 54 4f 2a 3f de 2a 53 54 41
  UrbLink              = 00000000
[688518 ms] UsbSnoop - DispatchAny(f890e610) : IRP_MJ_INTERNAL_DEVICE_CONTROL
[688518 ms] UsbSnoop - MyDispatchInternalIOCTL(f890fe80) : fdo=81b1aac0, Irp=81ae82f0, IRQL=2
[688518 ms]  >>>  URB 357 going down  >>> 
-- URB_FUNCTION_BULK_OR_INTERRUPT_TRANSFER:
  PipeHandle           = 822e77f4 [endpoint 0x00000002]
  TransferFlags        = 00000000 (USBD_TRANSFER_DIRECTION_OUT, ~USBD_SHORT_TRANSFER_OK)
  TransferBufferLength = 00000007
  TransferBuffer       = 00000000
  TransferBufferMDL    = 822d87a0
    00000000: 00 00 00 02 05 e0 00
  UrbLink              = 00000000
[688518 ms] UsbSnoop - MyInternalIOCTLCompletion(f890fdb0) : fido=81b19728, Irp=81ae82f0, Context=81b05970, IRQL=2
[688518 ms]  <<<  URB 357 coming back  <<< 
-- URB_FUNCTION_BULK_OR_INTERRUPT_TRANSFER:
  PipeHandle           = 822e77f4 [endpoint 0x00000002]
  TransferFlags        = 00000000 (USBD_TRANSFER_DIRECTION_OUT, ~USBD_SHORT_TRANSFER_OK)
  TransferBufferLength = 00000007
  TransferBuffer       = 00000000
  TransferBufferMDL    = 822d87a0
  UrbLink              = 00000000
[688528 ms] UsbSnoop - DispatchAny(f890e610) : IRP_MJ_INTERNAL_DEVICE_CONTROL
[688528 ms] UsbSnoop - MyDispatchInternalIOCTL(f890fe80) : fdo=81b1aac0, Irp=81ae82f0, IRQL=2
[688528 ms]  >>>  URB 358 going down  >>> 
-- URB_FUNCTION_BULK_OR_INTERRUPT_TRANSFER:
  PipeHandle           = 822e77d4 [endpoint 0x00000081]
  TransferFlags        = 00000003 (USBD_TRANSFER_DIRECTION_IN, USBD_SHORT_TRANSFER_OK)
  TransferBufferLength = 00000100
  TransferBuffer       = 00000000
  TransferBufferMDL    = 822d87a0
  UrbLink              = 00000000
[688549 ms] UsbSnoop - MyInternalIOCTLCompletion(f890fdb0) : fido=81b19728, Irp=81ae82f0, Context=822e2150, IRQL=2
[688549 ms]  <<<  URB 358 coming back  <<< 
-- URB_FUNCTION_BULK_OR_INTERRUPT_TRANSFER:
  PipeHandle           = 822e77d4 [endpoint 0x00000081]
  TransferFlags        = 00000003 (USBD_TRANSFER_DIRECTION_IN, USBD_SHORT_TRANSFER_OK)
  TransferBufferLength = 000000ff
  TransferBuffer       = 00000000
  TransferBufferMDL    = 822d87a0
    00000000: 00 00 00 fa 03 52 54 29 47 52 41 50 48 2a 3f d8
    00000010: 3f 93 37 2b 31 2b 2a 50 2a 11 3f 93 31 34 2b 31
    00000020: 2b 2a 48 2a 11 3f 93 34 37 2b 37 38 2b 2a 54 49
    00000030: 4d 45 10 53 11 2a 11 3f 08 33 2b 32 30 2b b0 31
    00000040: 2b 30 09 04 5d 00 3f e7 5d 00 11 3f 85 3f 23 49
    00000050: 2b 49 2b 30 2b 31 37 38 30 2b 32 30 11 04 5d 04
    00000060: 3f d3 49 2b 31 2b 39 30 2b 31 11 3f e8 5d 03 10
    00000070: 49 11 11 3f 9e 5d 04 10 49 11 2b 5d 03 10 49 11
    00000080: 11 3f d4 3f ec fd 2b 5d 04 2b 5d 03 2b 81 11 3f
    00000090: 93 37 2b 31 2b 2a 50 2a 11 3f 93 31 34 2b 31 2b
    000000a0: 2a 48 2a 11 3f 93 34 37 2b 37 38 2b 2a 54 49 4d
    000000b0: 45 10 53 11 2a 11 3f 84 3f 53 45 43 4f 4e 44 00
    000000c0: 8a 03 08 36 2b 30 09 04 5d 00 3e e7 5d 00 11 3f
    000000d0: 31 04 63 0a 3e 32 04 63 0b 3e 31 04 63 0c 3e 32
    000000e0: 04 63 0d 3f 7e 0b 3f 7e 09 3f 7e 0d 3f ea 3f 97
    000000f0: 3f 85 3f 93 31 2b 31 36 2b 2a 54 45 58 41 53
  UrbLink              = 00000000
[688588 ms] UsbSnoop - DispatchAny(f890e610) : IRP_MJ_INTERNAL_DEVICE_CONTROL
[688588 ms] UsbSnoop - MyDispatchInternalIOCTL(f890fe80) : fdo=81b1aac0, Irp=81ae82f0, IRQL=2
[688588 ms]  >>>  URB 359 going down  >>> 
-- URB_FUNCTION_BULK_OR_INTERRUPT_TRANSFER:
  PipeHandle           = 822e77f4 [endpoint 0x00000002]
  TransferFlags        = 00000000 (USBD_TRANSFER_DIRECTION_OUT, ~USBD_SHORT_TRANSFER_OK)
  TransferBufferLength = 00000007
  TransferBuffer       = 00000000
  TransferBufferMDL    = 822d87a0
    00000000: 00 00 00 02 05 e0 00
  UrbLink              = 00000000
[688588 ms] UsbSnoop - MyInternalIOCTLCompletion(f890fdb0) : fido=81b19728, Irp=81ae82f0, Context=821aa3a8, IRQL=2
[688588 ms]  <<<  URB 359 coming back  <<< 
-- URB_FUNCTION_BULK_OR_INTERRUPT_TRANSFER:
  PipeHandle           = 822e77f4 [endpoint 0x00000002]
  TransferFlags        = 00000000 (USBD_TRANSFER_DIRECTION_OUT, ~USBD_SHORT_TRANSFER_OK)
  TransferBufferLength = 00000007
  TransferBuffer       = 00000000
  TransferBufferMDL    = 822d87a0
  UrbLink              = 00000000
[688598 ms] UsbSnoop - DispatchAny(f890e610) : IRP_MJ_INTERNAL_DEVICE_CONTROL
[688598 ms] UsbSnoop - MyDispatchInternalIOCTL(f890fe80) : fdo=81b1aac0, Irp=81ae82f0, IRQL=2
[688598 ms]  >>>  URB 360 going down  >>> 
-- URB_FUNCTION_BULK_OR_INTERRUPT_TRANSFER:
  PipeHandle           = 822e77d4 [endpoint 0x00000081]
  TransferFlags        = 00000003 (USBD_TRANSFER_DIRECTION_IN, USBD_SHORT_TRANSFER_OK)
  TransferBufferLength = 00000100
  TransferBuffer       = 00000000
  TransferBufferMDL    = 822d87a0
  UrbLink              = 00000000
[688619 ms] UsbSnoop - MyInternalIOCTLCompletion(f890fdb0) : fido=81b19728, Irp=81ae82f0, Context=822e2150, IRQL=2
[688619 ms]  <<<  URB 360 coming back  <<< 
-- URB_FUNCTION_BULK_OR_INTERRUPT_TRANSFER:
  PipeHandle           = 822e77d4 [endpoint 0x00000081]
  TransferFlags        = 00000003 (USBD_TRANSFER_DIRECTION_IN, USBD_SHORT_TRANSFER_OK)
  TransferBufferLength = 000000ff
  TransferBuffer       = 00000000
  TransferBufferMDL    = 822d87a0
    00000000: 00 00 00 fa 03 29 29 49 4e 53 54 52 55 4d 45 4e
    00000010: 54 53 2a 11 3f 93 38 2b 33 30 2b 2a 43 42 4c 29
    00000020: 29 29 53 59 53 54 45 4d 2a 11 3f 93 31 35 2b 31
    00000030: 30 2b 2a 45 58 50 45 52 49 4d 45 4e 54 29 29 29
    00000040: 57 4f 52 4b 42 4f 4f 4b 2a 11 3f 93 32 39 2b 32
    00000050: 38 2b 2a 53 45 43 4f 4e 44 29 29 29 56 32 3a 30
    00000060: 2a 11 3f 93 33 36 2b 31 38 2b 2a 10 45 58 50 45
    00000070: 52 49 4d 45 4e 54 29 29 29 50 34 11 2a 11 3f 93
    00000080: 35 30 2b 31 39 2b 2a 50 52 45 53 53 29 29 29 06
    00000090: 45 4e 54 45 52 07 29 29 29 4f 4e 2a 3f 93 35 37
    000000a0: 2b 32 38 2b 2a 54 49 71 38 33 29 29 29 50 4c 55
    000000b0: 53 2a 3f d8 3f e1 3f de 2a 54 55 52 4e 29 4f 4e
    000000c0: 29 54 48 45 29 43 42 4c 3a 2a 3f e0 34 2b 31 30
    000000d0: 2b 2a 06 45 4e 54 45 52 07 2a 11 3f d8 3f 75 3f
    000000e0: e1 3f de 2a 4e 4f 57 29 43 48 45 43 4b 49 4e 47
    000000f0: 29 54 48 45 2a 3f de 2a 43 41 4c 43 55 4c 41
  UrbLink              = 00000000
[688658 ms] UsbSnoop - DispatchAny(f890e610) : IRP_MJ_INTERNAL_DEVICE_CONTROL
[688658 ms] UsbSnoop - MyDispatchInternalIOCTL(f890fe80) : fdo=81b1aac0, Irp=81ae82f0, IRQL=2
[688658 ms]  >>>  URB 361 going down  >>> 
-- URB_FUNCTION_BULK_OR_INTERRUPT_TRANSFER:
  PipeHandle           = 822e77f4 [endpoint 0x00000002]
  TransferFlags        = 00000000 (USBD_TRANSFER_DIRECTION_OUT, ~USBD_SHORT_TRANSFER_OK)
  TransferBufferLength = 00000007
  TransferBuffer       = 00000000
  TransferBufferMDL    = 822d87a0
    00000000: 00 00 00 02 05 e0 00
  UrbLink              = 00000000
[688658 ms] UsbSnoop - MyInternalIOCTLCompletion(f890fdb0) : fido=81b19728, Irp=81ae82f0, Context=822db980, IRQL=2
[688658 ms]  <<<  URB 361 coming back  <<< 
-- URB_FUNCTION_BULK_OR_INTERRUPT_TRANSFER:
  PipeHandle           = 822e77f4 [endpoint 0x00000002]
  TransferFlags        = 00000000 (USBD_TRANSFER_DIRECTION_OUT, ~USBD_SHORT_TRANSFER_OK)
  TransferBufferLength = 00000007
  TransferBuffer       = 00000000
  TransferBufferMDL    = 822d87a0
  UrbLink              = 00000000
[688668 ms] UsbSnoop - DispatchAny(f890e610) : IRP_MJ_INTERNAL_DEVICE_CONTROL
[688668 ms] UsbSnoop - MyDispatchInternalIOCTL(f890fe80) : fdo=81b1aac0, Irp=81ae82f0, IRQL=2
[688668 ms]  >>>  URB 362 going down  >>> 
-- URB_FUNCTION_BULK_OR_INTERRUPT_TRANSFER:
  PipeHandle           = 822e77d4 [endpoint 0x00000081]
  TransferFlags        = 00000003 (USBD_TRANSFER_DIRECTION_IN, USBD_SHORT_TRANSFER_OK)
  TransferBufferLength = 00000100
  TransferBuffer       = 00000000
  TransferBufferMDL    = 822d87a0
  UrbLink              = 00000000
[688689 ms] UsbSnoop - MyInternalIOCTLCompletion(f890fdb0) : fido=81b19728, Irp=81ae82f0, Context=822e2150, IRQL=2
[688689 ms]  <<<  URB 362 coming back  <<< 
-- URB_FUNCTION_BULK_OR_INTERRUPT_TRANSFER:
  PipeHandle           = 822e77d4 [endpoint 0x00000081]
  TransferFlags        = 00000003 (USBD_TRANSFER_DIRECTION_IN, USBD_SHORT_TRANSFER_OK)
  TransferBufferLength = 000000ff
  TransferBuffer       = 00000000
  TransferBufferMDL    = 822d87a0
    00000000: 00 00 00 fa 03 54 4f 52 71 43 42 4c 2a 3f de 2a
    00000010: 4c 49 4e 4b 29 43 4f 4e 4e 45 43 54 49 4f 4e 3a
    00000020: 2a 3f de 2a 50 4c 45 41 53 45 29 57 41 49 54 3a
    00000030: 3a 3a 3a 2a 3f 08 31 2b 30 09 04 5d 00 3f e7 5d
    00000040: 00 11 3f 08 30 09 04 5d 01 3f d6 4d 3f 08 37 09
    00000050: 04 5d 00 3f e7 5d 00 11 3f e8 5d 01 11 3f ce b5
    00000060: 5d 01 11 6a 31 40 5d 01 10 31 11 6a 30 3f cf 3f
    00000070: e1 3f de 2a 82 82 82 4c 49 4e 4b 29 45 52 52 4f
    00000080: 52 82 82 82 2a 3f de 2a 50 55 53 48 29 49 4e 29
    00000090: 54 48 45 29 4c 49 4e 4b 2a 3f de 2a 43 4f 52 44
    000000a0: 29 43 4f 4e 4e 45 43 54 4f 52 53 2a 3f de 2a 46
    000000b0: 49 52 4d 4c 59 29 54 48 45 4e 29 48 49 54 2a 3f
    000000c0: de 2a 06 45 4e 54 45 52 07 3a 2a 3f d8 3f d7 4d
    000000d0: 3f d4 3f de 2a 2a 3f e0 36 2b 31 2b 2a 29 29 53
    000000e0: 54 41 54 55 53 3e 29 4f 3a 4b 3a 2a 3f e0 38 2b
    000000f0: 31 30 2b 2a 06 45 4e 54 45 52 07 2a 11 3f d8
  UrbLink              = 00000000
[688728 ms] UsbSnoop - DispatchAny(f890e610) : IRP_MJ_INTERNAL_DEVICE_CONTROL
[688728 ms] UsbSnoop - MyDispatchInternalIOCTL(f890fe80) : fdo=81b1aac0, Irp=81ae82f0, IRQL=2
[688728 ms]  >>>  URB 363 going down  >>> 
-- URB_FUNCTION_BULK_OR_INTERRUPT_TRANSFER:
  PipeHandle           = 822e77f4 [endpoint 0x00000002]
  TransferFlags        = 00000000 (USBD_TRANSFER_DIRECTION_OUT, ~USBD_SHORT_TRANSFER_OK)
  TransferBufferLength = 00000007
  TransferBuffer       = 00000000
  TransferBufferMDL    = 822d87a0
    00000000: 00 00 00 02 05 e0 00
  UrbLink              = 00000000
[688728 ms] UsbSnoop - MyInternalIOCTLCompletion(f890fdb0) : fido=81b19728, Irp=81ae82f0, Context=821aa3a8, IRQL=2
[688728 ms]  <<<  URB 363 coming back  <<< 
-- URB_FUNCTION_BULK_OR_INTERRUPT_TRANSFER:
  PipeHandle           = 822e77f4 [endpoint 0x00000002]
  TransferFlags        = 00000000 (USBD_TRANSFER_DIRECTION_OUT, ~USBD_SHORT_TRANSFER_OK)
  TransferBufferLength = 00000007
  TransferBuffer       = 00000000
  TransferBufferMDL    = 822d87a0
  UrbLink              = 00000000
[688738 ms] UsbSnoop - DispatchAny(f890e610) : IRP_MJ_INTERNAL_DEVICE_CONTROL
[688738 ms] UsbSnoop - MyDispatchInternalIOCTL(f890fe80) : fdo=81b1aac0, Irp=81ae82f0, IRQL=2
[688738 ms]  >>>  URB 364 going down  >>> 
-- URB_FUNCTION_BULK_OR_INTERRUPT_TRANSFER:
  PipeHandle           = 822e77d4 [endpoint 0x00000081]
  TransferFlags        = 00000003 (USBD_TRANSFER_DIRECTION_IN, USBD_SHORT_TRANSFER_OK)
  TransferBufferLength = 00000100
  TransferBuffer       = 00000000
  TransferBufferMDL    = 822d87a0
  UrbLink              = 00000000
[688759 ms] UsbSnoop - MyInternalIOCTLCompletion(f890fdb0) : fido=81b19728, Irp=81ae82f0, Context=822e2150, IRQL=2
[688759 ms]  <<<  URB 364 coming back  <<< 
-- URB_FUNCTION_BULK_OR_INTERRUPT_TRANSFER:
  PipeHandle           = 822e77d4 [endpoint 0x00000081]
  TransferFlags        = 00000003 (USBD_TRANSFER_DIRECTION_IN, USBD_SHORT_TRANSFER_OK)
  TransferBufferLength = 000000ff
  TransferBuffer       = 00000000
  TransferBufferMDL    = 822d87a0
    00000000: 00 00 00 fa 03 3f 76 3f e1 3f 85 3f 7e 08 3f fa
    00000010: 5d 01 2b 5d 02 2b 5d 03 2b 5d 04 3f e1 3f 08 36
    00000020: 2b 30 09 04 5d 00 3f e7 5d 00 11 3f 08 31 2b 30
    00000030: 09 04 5d 00 3f e7 5d 00 11 3f 08 31 2b 31 31 2b
    00000040: 32 2b 31 09 04 5d 00 3f e7 5d 00 11 3f 08 31 2b
    00000050: 31 2b 31 2b 30 2b 30 2b 31 09 04 5d 00 3f e7 5d
    00000060: 00 11 3f 08 34 2b 31 2b 31 2b 31 2b 39 3a 38 2b
    00000070: b0 39 3a 38 09 04 5d 00 3f e7 5d 00 11 3f e1 3f
    00000080: de 2a 45 4e 54 45 52 29 46 52 49 43 54 49 4f 4e
    00000090: 2a 3f de 2a 42 41 4c 41 4e 43 45 29 4d 41 53 53
    000000a0: 29 49 4e 2a 3f de 2a 47 52 41 4d 53 3a 2a 3f dc
    000000b0: 4d 3f e1 3f de 2a 59 4f 55 29 57 49 4c 4c 29 48
    000000c0: 41 56 45 2a 3f de 2a 41 29 46 45 57 29 53 45 43
    000000d0: 4f 4e 44 53 29 54 4f 2a 3f de 2a 43 4f 4c 4c 45
    000000e0: 43 54 29 44 41 54 41 3a 2a 3f de 2a 2a 3f de 2a
    000000f0: 50 52 45 53 53 29 45 4e 54 45 52 29 54 4f 29
  UrbLink              = 00000000
[688798 ms] UsbSnoop - DispatchAny(f890e610) : IRP_MJ_INTERNAL_DEVICE_CONTROL
[688798 ms] UsbSnoop - MyDispatchInternalIOCTL(f890fe80) : fdo=81b1aac0, Irp=81ae82f0, IRQL=2
[688798 ms]  >>>  URB 365 going down  >>> 
-- URB_FUNCTION_BULK_OR_INTERRUPT_TRANSFER:
  PipeHandle           = 822e77f4 [endpoint 0x00000002]
  TransferFlags        = 00000000 (USBD_TRANSFER_DIRECTION_OUT, ~USBD_SHORT_TRANSFER_OK)
  TransferBufferLength = 00000007
  TransferBuffer       = 00000000
  TransferBufferMDL    = 822d87a0
    00000000: 00 00 00 02 05 e0 00
  UrbLink              = 00000000
[688798 ms] UsbSnoop - MyInternalIOCTLCompletion(f890fdb0) : fido=81b19728, Irp=81ae82f0, Context=822db980, IRQL=2
[688798 ms]  <<<  URB 365 coming back  <<< 
-- URB_FUNCTION_BULK_OR_INTERRUPT_TRANSFER:
  PipeHandle           = 822e77f4 [endpoint 0x00000002]
  TransferFlags        = 00000000 (USBD_TRANSFER_DIRECTION_OUT, ~USBD_SHORT_TRANSFER_OK)
  TransferBufferLength = 00000007
  TransferBuffer       = 00000000
  TransferBufferMDL    = 822d87a0
  UrbLink              = 00000000
[688808 ms] UsbSnoop - DispatchAny(f890e610) : IRP_MJ_INTERNAL_DEVICE_CONTROL
[688808 ms] UsbSnoop - MyDispatchInternalIOCTL(f890fe80) : fdo=81b1aac0, Irp=81ae82f0, IRQL=2
[688808 ms]  >>>  URB 366 going down  >>> 
-- URB_FUNCTION_BULK_OR_INTERRUPT_TRANSFER:
  PipeHandle           = 822e77d4 [endpoint 0x00000081]
  TransferFlags        = 00000003 (USBD_TRANSFER_DIRECTION_IN, USBD_SHORT_TRANSFER_OK)
  TransferBufferLength = 00000100
  TransferBuffer       = 00000000
  TransferBufferMDL    = 822d87a0
  UrbLink              = 00000000
[688829 ms] UsbSnoop - MyInternalIOCTLCompletion(f890fdb0) : fido=81b19728, Irp=81ae82f0, Context=822e2150, IRQL=2
[688829 ms]  <<<  URB 366 coming back  <<< 
-- URB_FUNCTION_BULK_OR_INTERRUPT_TRANSFER:
  PipeHandle           = 822e77d4 [endpoint 0x00000081]
  TransferFlags        = 00000003 (USBD_TRANSFER_DIRECTION_IN, USBD_SHORT_TRANSFER_OK)
  TransferBufferLength = 000000ff
  TransferBuffer       = 00000000
  TransferBufferMDL    = 822d87a0
    00000000: 00 00 00 fa 03 2a 3f de 2a 53 54 41 52 54 3a 2a
    00000010: 3f 32 30 04 42 3f d8 3f 08 33 2b 42 0c 2b 39 39
    00000020: 2b 30 2b 30 2b 30 2b 30 2b 30 2b 31 2b 31 09 04
    00000030: 5d 00 3f e7 5d 00 11 3f e1 3f 85 3f e8 5d 03 11
    00000040: 3f e8 5d 02 11 3f e8 5d 04 11 3f e8 5d 01 11 3f
    00000050: 5d 03 71 3a 30 30 39 38 4d 04 5d 03 3f 5f 50 4c
    00000060: 4f 54 53 3f 53 45 4c 45 43 54 00 f4 01 08 36 2b
    00000070: 30 09 04 5d 05 3e e7 5d 05 11 3f 31 04 63 0c 3e
    00000080: 32 04 63 0d 3e 31 04 63 0a 3e 32 04 63 0b 3f 7e
    00000090: 0b 3f 7e 09 3f 7e 0d 3f ea 3f 97 3f 85 3f 93 31
    000000a0: 2b 31 36 2b 2a 54 45 58 41 53 29 29 49 4e 53 54
    000000b0: 52 55 4d 45 4e 54 53 2a 11 3f 93 38 2b 33 30 2b
    000000c0: 2a 43 42 4c 29 29 29 53 59 53 54 45 4d 2a 11 3f
    000000d0: 93 31 35 2b 31 30 2b 2a 45 58 50 45 52 49 4d 45
    000000e0: 4e 54 29 29 29 57 4f 52 4b 42 4f 4f 4b 2a 11 3f
    000000f0: 93 32 39 2b 32 38 2b 2a 53 45 4c 45 43 54 29
  UrbLink              = 00000000
[688869 ms] UsbSnoop - DispatchAny(f890e610) : IRP_MJ_INTERNAL_DEVICE_CONTROL
[688869 ms] UsbSnoop - MyDispatchInternalIOCTL(f890fe80) : fdo=81b1aac0, Irp=81ae82f0, IRQL=2
[688869 ms]  >>>  URB 367 going down  >>> 
-- URB_FUNCTION_BULK_OR_INTERRUPT_TRANSFER:
  PipeHandle           = 822e77f4 [endpoint 0x00000002]
  TransferFlags        = 00000000 (USBD_TRANSFER_DIRECTION_OUT, ~USBD_SHORT_TRANSFER_OK)
  TransferBufferLength = 00000007
  TransferBuffer       = 00000000
  TransferBufferMDL    = 822d87a0
    00000000: 00 00 00 02 05 e0 00
  UrbLink              = 00000000
[688869 ms] UsbSnoop - MyInternalIOCTLCompletion(f890fdb0) : fido=81b19728, Irp=81ae82f0, Context=821aa3a8, IRQL=2
[688869 ms]  <<<  URB 367 coming back  <<< 
-- URB_FUNCTION_BULK_OR_INTERRUPT_TRANSFER:
  PipeHandle           = 822e77f4 [endpoint 0x00000002]
  TransferFlags        = 00000000 (USBD_TRANSFER_DIRECTION_OUT, ~USBD_SHORT_TRANSFER_OK)
  TransferBufferLength = 00000007
  TransferBuffer       = 00000000
  TransferBufferMDL    = 822d87a0
  UrbLink              = 00000000
[688878 ms] UsbSnoop - DispatchAny(f890e610) : IRP_MJ_INTERNAL_DEVICE_CONTROL
[688878 ms] UsbSnoop - MyDispatchInternalIOCTL(f890fe80) : fdo=81b1aac0, Irp=81ae82f0, IRQL=2
[688878 ms]  >>>  URB 368 going down  >>> 
-- URB_FUNCTION_BULK_OR_INTERRUPT_TRANSFER:
  PipeHandle           = 822e77d4 [endpoint 0x00000081]
  TransferFlags        = 00000003 (USBD_TRANSFER_DIRECTION_IN, USBD_SHORT_TRANSFER_OK)
  TransferBufferLength = 00000100
  TransferBuffer       = 00000000
  TransferBufferMDL    = 822d87a0
  UrbLink              = 00000000
[688900 ms] UsbSnoop - MyInternalIOCTLCompletion(f890fdb0) : fido=81b19728, Irp=81ae82f0, Context=822e2150, IRQL=2
[688900 ms]  <<<  URB 368 coming back  <<< 
-- URB_FUNCTION_BULK_OR_INTERRUPT_TRANSFER:
  PipeHandle           = 822e77d4 [endpoint 0x00000081]
  TransferFlags        = 00000003 (USBD_TRANSFER_DIRECTION_IN, USBD_SHORT_TRANSFER_OK)
  TransferBufferLength = 000000ff
  TransferBuffer       = 00000000
  TransferBufferMDL    = 822d87a0
    00000000: 00 00 00 fa 03 29 29 56 32 3a 30 2a 11 3f 93 35
    00000010: 30 2b 31 39 2b 2a 50 52 45 53 53 29 29 29 06 45
    00000020: 4e 54 45 52 07 29 29 29 4f 4e 2a 3f 93 35 37 2b
    00000030: 32 38 2b 2a 54 49 71 38 33 29 29 29 50 4c 55 53
    00000040: 2a 3f d8 3f e1 3f 85 3f 7e 08 3f ec fe 2b 5d 00
    00000050: 2b 5d 01 2b 81 11 3f 8f 3f 93 36 2b 31 30 2b 2a
    00000060: 48 45 49 47 48 54 10 46 54 11 2a 11 3f 93 35 31
    00000070: 2b 36 38 2b 2a 54 49 4d 45 10 53 11 2a 11 3f 93
    00000080: 30 2b 32 2b 2a 4c 4f 57 45 52 29 42 4f 55 4e 44
    00000090: af 29 2a 11 3f dc 3f 58 04 41 3f 9d 41 3f 93 30
    000000a0: 2b 32 2b 2a 55 50 50 45 52 29 42 4f 55 4e 44 af
    000000b0: 29 2a 11 3f dc 3f 58 04 42 3f 9d 42 3f b5 5d 00
    000000c0: 04 4e 3f 31 04 43 3f fa 5d 02 2b 5d 03 3f 93 30
    000000d0: 2b 32 2b 2a 41 4e 41 4c 59 5a 49 4e 47 3a 3a 3a
    000000e0: 29 29 29 2a 11 3f d3 49 2b 31 2b 4e 2b 31 11 3f
    000000f0: ce 5d 00 10 49 11 6e 41 40 5d 00 10 49 11 6d
  UrbLink              = 00000000
[688938 ms] UsbSnoop - DispatchAny(f890e610) : IRP_MJ_INTERNAL_DEVICE_CONTROL
[688938 ms] UsbSnoop - MyDispatchInternalIOCTL(f890fe80) : fdo=81b1aac0, Irp=81ae82f0, IRQL=2
[688938 ms]  >>>  URB 369 going down  >>> 
-- URB_FUNCTION_BULK_OR_INTERRUPT_TRANSFER:
  PipeHandle           = 822e77f4 [endpoint 0x00000002]
  TransferFlags        = 00000000 (USBD_TRANSFER_DIRECTION_OUT, ~USBD_SHORT_TRANSFER_OK)
  TransferBufferLength = 00000007
  TransferBuffer       = 00000000
  TransferBufferMDL    = 822d87a0
    00000000: 00 00 00 02 05 e0 00
  UrbLink              = 00000000
[688938 ms] UsbSnoop - MyInternalIOCTLCompletion(f890fdb0) : fido=81b19728, Irp=81ae82f0, Context=81b05970, IRQL=2
[688938 ms]  <<<  URB 369 coming back  <<< 
-- URB_FUNCTION_BULK_OR_INTERRUPT_TRANSFER:
  PipeHandle           = 822e77f4 [endpoint 0x00000002]
  TransferFlags        = 00000000 (USBD_TRANSFER_DIRECTION_OUT, ~USBD_SHORT_TRANSFER_OK)
  TransferBufferLength = 00000007
  TransferBuffer       = 00000000
  TransferBufferMDL    = 822d87a0
  UrbLink              = 00000000
[688948 ms] UsbSnoop - DispatchAny(f890e610) : IRP_MJ_INTERNAL_DEVICE_CONTROL
[688948 ms] UsbSnoop - MyDispatchInternalIOCTL(f890fe80) : fdo=81b1aac0, Irp=81ae82f0, IRQL=2
[688948 ms]  >>>  URB 370 going down  >>> 
-- URB_FUNCTION_BULK_OR_INTERRUPT_TRANSFER:
  PipeHandle           = 822e77d4 [endpoint 0x00000081]
  TransferFlags        = 00000003 (USBD_TRANSFER_DIRECTION_IN, USBD_SHORT_TRANSFER_OK)
  TransferBufferLength = 00000100
  TransferBuffer       = 00000000
  TransferBufferMDL    = 822d87a0
  UrbLink              = 00000000
[688970 ms] UsbSnoop - MyInternalIOCTLCompletion(f890fdb0) : fido=81b19728, Irp=81ae82f0, Context=822e2150, IRQL=2
[688970 ms]  <<<  URB 370 coming back  <<< 
-- URB_FUNCTION_BULK_OR_INTERRUPT_TRANSFER:
  PipeHandle           = 822e77d4 [endpoint 0x00000081]
  TransferFlags        = 00000003 (USBD_TRANSFER_DIRECTION_IN, USBD_SHORT_TRANSFER_OK)
  TransferBufferLength = 000000ff
  TransferBuffer       = 00000000
  TransferBufferMDL    = 822d87a0
    00000000: 00 00 00 fa 03 42 3f cf 3f 5d 00 10 49 11 04 5d
    00000010: 02 10 43 11 3f 5d 01 10 49 11 04 5d 03 10 43 11
    00000020: 3f 43 70 31 04 43 3f d4 3f d4 3f 5d 02 71 5d 02
    00000030: 10 31 11 04 5d 02 3f ec fe 2b 5d 02 2b 5d 03 2b
    00000040: 7f 11 3f 8f 3f 93 36 2b 31 30 2b 2a 48 45 49 47
    00000050: 48 54 10 46 54 11 2a 11 3f 93 35 31 2b 36 38 2b
    00000060: 2a 54 49 4d 45 10 53 11 2a 11 3f 84 3f 53 4f 55
    00000070: 4e 44 00 75 03 08 36 2b 30 09 04 5d 00 3e e7 5d
    00000080: 00 11 3f 31 04 63 0a 3e 32 04 63 0b 3e 31 04 63
    00000090: 0c 3e 32 04 63 0d 3f 7e 0b 3f 7e 09 3f 7e 0d 3f
    000000a0: ea 3f 97 3f 85 3f 93 31 2b 31 36 2b 2a 54 45 58
    000000b0: 41 53 29 29 49 4e 53 54 52 55 4d 45 4e 54 53 2a
    000000c0: 11 3f 93 38 2b 33 30 2b 2a 43 42 4c 29 29 29 53
    000000d0: 59 53 54 45 4d 2a 11 3f 93 31 35 2b 31 30 2b 2a
    000000e0: 45 58 50 45 52 49 4d 45 4e 54 29 29 29 57 4f 52
    000000f0: 4b 42 4f 4f 4b 2a 11 3f 93 32 39 2b 33 30 2b
  UrbLink              = 00000000
[689008 ms] UsbSnoop - DispatchAny(f890e610) : IRP_MJ_INTERNAL_DEVICE_CONTROL
[689008 ms] UsbSnoop - MyDispatchInternalIOCTL(f890fe80) : fdo=81b1aac0, Irp=81ae82f0, IRQL=2
[689008 ms]  >>>  URB 371 going down  >>> 
-- URB_FUNCTION_BULK_OR_INTERRUPT_TRANSFER:
  PipeHandle           = 822e77f4 [endpoint 0x00000002]
  TransferFlags        = 00000000 (USBD_TRANSFER_DIRECTION_OUT, ~USBD_SHORT_TRANSFER_OK)
  TransferBufferLength = 00000007
  TransferBuffer       = 00000000
  TransferBufferMDL    = 822d87a0
    00000000: 00 00 00 02 05 e0 00
  UrbLink              = 00000000
[689009 ms] UsbSnoop - MyInternalIOCTLCompletion(f890fdb0) : fido=81b19728, Irp=81ae82f0, Context=822db980, IRQL=2
[689009 ms]  <<<  URB 371 coming back  <<< 
-- URB_FUNCTION_BULK_OR_INTERRUPT_TRANSFER:
  PipeHandle           = 822e77f4 [endpoint 0x00000002]
  TransferFlags        = 00000000 (USBD_TRANSFER_DIRECTION_OUT, ~USBD_SHORT_TRANSFER_OK)
  TransferBufferLength = 00000007
  TransferBuffer       = 00000000
  TransferBufferMDL    = 822d87a0
  UrbLink              = 00000000
[689018 ms] UsbSnoop - DispatchAny(f890e610) : IRP_MJ_INTERNAL_DEVICE_CONTROL
[689018 ms] UsbSnoop - MyDispatchInternalIOCTL(f890fe80) : fdo=81b1aac0, Irp=81ae82f0, IRQL=2
[689018 ms]  >>>  URB 372 going down  >>> 
-- URB_FUNCTION_BULK_OR_INTERRUPT_TRANSFER:
  PipeHandle           = 822e77d4 [endpoint 0x00000081]
  TransferFlags        = 00000003 (USBD_TRANSFER_DIRECTION_IN, USBD_SHORT_TRANSFER_OK)
  TransferBufferLength = 00000100
  TransferBuffer       = 00000000
  TransferBufferMDL    = 822d87a0
  UrbLink              = 00000000
[689040 ms] UsbSnoop - MyInternalIOCTLCompletion(f890fdb0) : fido=81b19728, Irp=81ae82f0, Context=822e2150, IRQL=2
[689040 ms]  <<<  URB 372 coming back  <<< 
-- URB_FUNCTION_BULK_OR_INTERRUPT_TRANSFER:
  PipeHandle           = 822e77d4 [endpoint 0x00000081]
  TransferFlags        = 00000003 (USBD_TRANSFER_DIRECTION_IN, USBD_SHORT_TRANSFER_OK)
  TransferBufferLength = 000000ff
  TransferBuffer       = 00000000
  TransferBufferMDL    = 822d87a0
    00000000: 00 00 00 fa 03 2a 53 4f 55 4e 44 29 29 29 56 32
    00000010: 3a 30 2a 11 3f 93 33 36 2b 31 38 2b 2a 10 45 58
    00000020: 50 45 52 49 4d 45 4e 54 29 29 29 50 35 11 2a 11
    00000030: 3f 93 35 30 2b 31 39 2b 2a 50 52 45 53 53 29 29
    00000040: 29 06 45 4e 54 45 52 07 29 29 29 4f 4e 2a 3f 93
    00000050: 35 37 2b 32 38 2b 2a 54 49 71 38 33 29 29 29 50
    00000060: 4c 55 53 2a 3f d8 3f e1 3f de 2a 54 55 52 4e 29
    00000070: 4f 4e 29 54 48 45 29 43 42 4c 3a 2a 3f e0 34 2b
    00000080: 31 30 2b 2a 06 45 4e 54 45 52 07 2a 11 3f d8 3f
    00000090: 75 3f e1 3f de 2a 4e 4f 57 29 43 48 45 43 4b 49
    000000a0: 4e 47 29 54 48 45 2a 3f de 2a 43 41 4c 43 55 4c
    000000b0: 41 54 4f 52 71 43 42 4c 2a 3f de 2a 4c 49 4e 4b
    000000c0: 29 43 4f 4e 4e 45 43 54 49 4f 4e 3a 2a 3f de 2a
    000000d0: 50 4c 45 41 53 45 29 57 41 49 54 3a 3a 3a 3a 2a
    000000e0: 3f 08 31 2b 30 09 04 5d 00 3f e7 5d 00 11 3f 08
    000000f0: 30 09 04 5d 01 3f d6 4d 3f 08 37 09 04 5d 00
  UrbLink              = 00000000
[689078 ms] UsbSnoop - DispatchAny(f890e610) : IRP_MJ_INTERNAL_DEVICE_CONTROL
[689078 ms] UsbSnoop - MyDispatchInternalIOCTL(f890fe80) : fdo=81b1aac0, Irp=81ae82f0, IRQL=2
[689079 ms]  >>>  URB 373 going down  >>> 
-- URB_FUNCTION_BULK_OR_INTERRUPT_TRANSFER:
  PipeHandle           = 822e77f4 [endpoint 0x00000002]
  TransferFlags        = 00000000 (USBD_TRANSFER_DIRECTION_OUT, ~USBD_SHORT_TRANSFER_OK)
  TransferBufferLength = 00000007
  TransferBuffer       = 00000000
  TransferBufferMDL    = 822d87a0
    00000000: 00 00 00 02 05 e0 00
  UrbLink              = 00000000
[689079 ms] UsbSnoop - MyInternalIOCTLCompletion(f890fdb0) : fido=81b19728, Irp=81ae82f0, Context=81b05970, IRQL=2
[689079 ms]  <<<  URB 373 coming back  <<< 
-- URB_FUNCTION_BULK_OR_INTERRUPT_TRANSFER:
  PipeHandle           = 822e77f4 [endpoint 0x00000002]
  TransferFlags        = 00000000 (USBD_TRANSFER_DIRECTION_OUT, ~USBD_SHORT_TRANSFER_OK)
  TransferBufferLength = 00000007
  TransferBuffer       = 00000000
  TransferBufferMDL    = 822d87a0
  UrbLink              = 00000000
[689090 ms] UsbSnoop - DispatchAny(f890e610) : IRP_MJ_INTERNAL_DEVICE_CONTROL
[689090 ms] UsbSnoop - MyDispatchInternalIOCTL(f890fe80) : fdo=81b1aac0, Irp=81ae82f0, IRQL=2
[689090 ms]  >>>  URB 374 going down  >>> 
-- URB_FUNCTION_BULK_OR_INTERRUPT_TRANSFER:
  PipeHandle           = 822e77d4 [endpoint 0x00000081]
  TransferFlags        = 00000003 (USBD_TRANSFER_DIRECTION_IN, USBD_SHORT_TRANSFER_OK)
  TransferBufferLength = 00000100
  TransferBuffer       = 00000000
  TransferBufferMDL    = 822d87a0
  UrbLink              = 00000000
[689110 ms] UsbSnoop - MyInternalIOCTLCompletion(f890fdb0) : fido=81b19728, Irp=81ae82f0, Context=822e2150, IRQL=2
[689110 ms]  <<<  URB 374 coming back  <<< 
-- URB_FUNCTION_BULK_OR_INTERRUPT_TRANSFER:
  PipeHandle           = 822e77d4 [endpoint 0x00000081]
  TransferFlags        = 00000003 (USBD_TRANSFER_DIRECTION_IN, USBD_SHORT_TRANSFER_OK)
  TransferBufferLength = 000000ff
  TransferBuffer       = 00000000
  TransferBufferMDL    = 822d87a0
    00000000: 00 00 00 fa 03 3f e7 5d 00 11 3f e8 5d 01 11 3f
    00000010: ce b5 5d 01 11 6a 31 40 5d 01 10 31 11 6a 30 3f
    00000020: cf 3f e1 3f de 2a 82 82 82 4c 49 4e 4b 29 45 52
    00000030: 52 4f 52 82 82 82 2a 3f de 2a 50 55 53 48 29 49
    00000040: 4e 29 54 48 45 29 4c 49 4e 4b 2a 3f de 2a 43 4f
    00000050: 52 44 29 43 4f 4e 4e 45 43 54 4f 52 53 2a 3f de
    00000060: 2a 46 49 52 4d 4c 59 29 54 48 45 4e 29 48 49 54
    00000070: 2a 3f de 2a 06 45 4e 54 45 52 07 3a 2a 3f d8 3f
    00000080: d7 4d 3f d4 3f de 2a 2a 3f e0 36 2b 31 2b 2a 29
    00000090: 29 53 54 41 54 55 53 3e 29 4f 3a 4b 3a 2a 3f e0
    000000a0: 38 2b 31 30 2b 2a 06 45 4e 54 45 52 07 2a 11 3f
    000000b0: d8 3f 76 3f e1 3f 85 3f 7e 08 3f fa 5d 01 2b 5d
    000000c0: 04 3f e1 3f 08 36 2b 30 09 04 5d 00 3f e7 5d 00
    000000d0: 11 3f 08 31 2b 30 09 04 5d 00 3f e7 5d 00 11 3f
    000000e0: 08 31 2b 31 2b 31 09 04 5d 00 3f e7 5d 00 11 3f
    000000f0: e1 3f de 2a 50 52 45 53 53 29 45 4e 54 45 52
  UrbLink              = 00000000
[689149 ms] UsbSnoop - DispatchAny(f890e610) : IRP_MJ_INTERNAL_DEVICE_CONTROL
[689149 ms] UsbSnoop - MyDispatchInternalIOCTL(f890fe80) : fdo=81b1aac0, Irp=81ae82f0, IRQL=2
[689149 ms]  >>>  URB 375 going down  >>> 
-- URB_FUNCTION_BULK_OR_INTERRUPT_TRANSFER:
  PipeHandle           = 822e77f4 [endpoint 0x00000002]
  TransferFlags        = 00000000 (USBD_TRANSFER_DIRECTION_OUT, ~USBD_SHORT_TRANSFER_OK)
  TransferBufferLength = 00000007
  TransferBuffer       = 00000000
  TransferBufferMDL    = 822d87a0
    00000000: 00 00 00 02 05 e0 00
  UrbLink              = 00000000
[689149 ms] UsbSnoop - MyInternalIOCTLCompletion(f890fdb0) : fido=81b19728, Irp=81ae82f0, Context=822db980, IRQL=2
[689149 ms]  <<<  URB 375 coming back  <<< 
-- URB_FUNCTION_BULK_OR_INTERRUPT_TRANSFER:
  PipeHandle           = 822e77f4 [endpoint 0x00000002]
  TransferFlags        = 00000000 (USBD_TRANSFER_DIRECTION_OUT, ~USBD_SHORT_TRANSFER_OK)
  TransferBufferLength = 00000007
  TransferBuffer       = 00000000
  TransferBufferMDL    = 822d87a0
  UrbLink              = 00000000
[689159 ms] UsbSnoop - DispatchAny(f890e610) : IRP_MJ_INTERNAL_DEVICE_CONTROL
[689159 ms] UsbSnoop - MyDispatchInternalIOCTL(f890fe80) : fdo=81b1aac0, Irp=81ae82f0, IRQL=2
[689159 ms]  >>>  URB 376 going down  >>> 
-- URB_FUNCTION_BULK_OR_INTERRUPT_TRANSFER:
  PipeHandle           = 822e77d4 [endpoint 0x00000081]
  TransferFlags        = 00000003 (USBD_TRANSFER_DIRECTION_IN, USBD_SHORT_TRANSFER_OK)
  TransferBufferLength = 00000100
  TransferBuffer       = 00000000
  TransferBufferMDL    = 822d87a0
  UrbLink              = 00000000
[689180 ms] UsbSnoop - MyInternalIOCTLCompletion(f890fdb0) : fido=81b19728, Irp=81ae82f0, Context=822e2150, IRQL=2
[689180 ms]  <<<  URB 376 coming back  <<< 
-- URB_FUNCTION_BULK_OR_INTERRUPT_TRANSFER:
  PipeHandle           = 822e77d4 [endpoint 0x00000081]
  TransferFlags        = 00000003 (USBD_TRANSFER_DIRECTION_IN, USBD_SHORT_TRANSFER_OK)
  TransferBufferLength = 000000ff
  TransferBuffer       = 00000000
  TransferBufferMDL    = 822d87a0
    00000000: 00 00 00 fa 03 29 54 4f 2a 3f de 2a 53 54 41 52
    00000010: 54 29 43 4f 4c 4c 45 43 54 49 4e 47 2a 3f de 2a
    00000020: 44 41 54 41 3a 2a 3f d8 3f 08 33 2b 3a 30 30 30
    00000030: 32 35 2b 39 39 2b 30 2b 30 2b 30 2b 30 2b 30 2b
    00000040: 31 09 04 5d 00 3f e7 5d 00 11 3f 85 3f e8 5d 04
    00000050: 11 3f e8 5d 01 11 3f 3a 30 31 04 63 02 3f 1a 5d
    00000060: 01 11 04 63 0a 3f 19 5d 01 11 04 63 0b 3f 3a 32
    00000070: 35 82 10 19 5d 04 11 71 1a 5d 04 11 11 04 41 3f
    00000080: 3a 31 04 63 03 3f 1a 5d 04 11 71 41 04 63 0c 3f
    00000090: 19 5d 04 11 70 41 04 63 0d 3f 10 63 0d 71 63 0c
    000000a0: 11 83 32 70 63 0c 04 51 3f 5d 04 71 51 04 5d 04
    000000b0: 3f 51 71 63 0c 04 51 3f b0 51 04 63 0c 3f 51 04
    000000c0: 63 0d 3f 3a 30 30 31 04 63 02 3f ec fd 2b 5d 01
    000000d0: 2b 5d 04 2b 81 11 3f 93 36 2b 31 2b 2a 50 52 45
    000000e0: 53 53 55 52 45 2a 11 3e 93 35 31 2b 36 39 2b 2a
    000000f0: 54 49 4d 45 10 53 11 2a 11 3f 84 3f 53 54 41
  UrbLink              = 00000000
[689219 ms] UsbSnoop - DispatchAny(f890e610) : IRP_MJ_INTERNAL_DEVICE_CONTROL
[689219 ms] UsbSnoop - MyDispatchInternalIOCTL(f890fe80) : fdo=81b1aac0, Irp=81ae82f0, IRQL=2
[689219 ms]  >>>  URB 377 going down  >>> 
-- URB_FUNCTION_BULK_OR_INTERRUPT_TRANSFER:
  PipeHandle           = 822e77f4 [endpoint 0x00000002]
  TransferFlags        = 00000000 (USBD_TRANSFER_DIRECTION_OUT, ~USBD_SHORT_TRANSFER_OK)
  TransferBufferLength = 00000007
  TransferBuffer       = 00000000
  TransferBufferMDL    = 822d87a0
    00000000: 00 00 00 02 05 e0 00
  UrbLink              = 00000000
[689219 ms] UsbSnoop - MyInternalIOCTLCompletion(f890fdb0) : fido=81b19728, Irp=81ae82f0, Context=81b05970, IRQL=2
[689219 ms]  <<<  URB 377 coming back  <<< 
-- URB_FUNCTION_BULK_OR_INTERRUPT_TRANSFER:
  PipeHandle           = 822e77f4 [endpoint 0x00000002]
  TransferFlags        = 00000000 (USBD_TRANSFER_DIRECTION_OUT, ~USBD_SHORT_TRANSFER_OK)
  TransferBufferLength = 00000007
  TransferBuffer       = 00000000
  TransferBufferMDL    = 822d87a0
  UrbLink              = 00000000
[689229 ms] UsbSnoop - DispatchAny(f890e610) : IRP_MJ_INTERNAL_DEVICE_CONTROL
[689229 ms] UsbSnoop - MyDispatchInternalIOCTL(f890fe80) : fdo=81b1aac0, Irp=81ae82f0, IRQL=2
[689229 ms]  >>>  URB 378 going down  >>> 
-- URB_FUNCTION_BULK_OR_INTERRUPT_TRANSFER:
  PipeHandle           = 822e77d4 [endpoint 0x00000081]
  TransferFlags        = 00000003 (USBD_TRANSFER_DIRECTION_IN, USBD_SHORT_TRANSFER_OK)
  TransferBufferLength = 00000100
  TransferBuffer       = 00000000
  TransferBufferMDL    = 822d87a0
  UrbLink              = 00000000
[689250 ms] UsbSnoop - MyInternalIOCTLCompletion(f890fdb0) : fido=81b19728, Irp=81ae82f0, Context=822e2150, IRQL=2
[689250 ms]  <<<  URB 378 coming back  <<< 
-- URB_FUNCTION_BULK_OR_INTERRUPT_TRANSFER:
  PipeHandle           = 822e77d4 [endpoint 0x00000081]
  TransferFlags        = 00000003 (USBD_TRANSFER_DIRECTION_IN, USBD_SHORT_TRANSFER_OK)
  TransferBufferLength = 000000ff
  TransferBuffer       = 00000000
  TransferBufferMDL    = 822d87a0
    00000000: 00 00 00 fa 03 54 55 53 00 fb 02 08 36 2b 30 09
    00000010: 04 5d 00 3e e7 5d 00 11 3f 31 04 63 0a 3e 32 04
    00000020: 63 0b 3e 31 04 63 0c 3e 32 04 63 0d 3f 7e 0b 3f
    00000030: 7e 09 3f 7e 0d 3f ea 3f 97 3f 85 3f 93 31 2b 31
    00000040: 36 2b 2a 54 45 58 41 53 29 29 49 4e 53 54 52 55
    00000050: 4d 45 4e 54 53 2a 11 3f 93 38 2b 33 30 2b 2a 43
    00000060: 42 4c 29 29 29 53 59 53 54 45 4d 2a 11 3f 93 31
    00000070: 35 2b 31 30 2b 2a 45 58 50 45 52 49 4d 45 4e 54
    00000080: 29 29 29 57 4f 52 4b 42 4f 4f 4b 2a 11 3f 93 32
    00000090: 39 2b 32 38 2b 2a 53 54 41 54 55 53 29 29 29 56
    000000a0: 32 3a 30 2a 11 3f 93 33 36 2b 31 38 2b 2a 10 45
    000000b0: 58 50 45 52 49 4d 45 4e 54 29 29 29 50 37 11 2a
    000000c0: 11 3f 93 35 30 2b 31 39 2b 2a 50 52 45 53 53 29
    000000d0: 29 29 06 45 4e 54 45 52 07 29 29 29 4f 4e 2a 3f
    000000e0: 93 35 37 2b 32 38 2b 2a 54 49 71 38 33 29 29 29
    000000f0: 50 4c 55 53 2a 3f d8 3f e1 3f de 2a 54 55 52
  UrbLink              = 00000000
[689291 ms] UsbSnoop - DispatchAny(f890e610) : IRP_MJ_INTERNAL_DEVICE_CONTROL
[689291 ms] UsbSnoop - MyDispatchInternalIOCTL(f890fe80) : fdo=81b1aac0, Irp=81ae82f0, IRQL=2
[689291 ms]  >>>  URB 379 going down  >>> 
-- URB_FUNCTION_BULK_OR_INTERRUPT_TRANSFER:
  PipeHandle           = 822e77f4 [endpoint 0x00000002]
  TransferFlags        = 00000000 (USBD_TRANSFER_DIRECTION_OUT, ~USBD_SHORT_TRANSFER_OK)
  TransferBufferLength = 00000007
  TransferBuffer       = 00000000
  TransferBufferMDL    = 822d87a0
    00000000: 00 00 00 02 05 e0 00
  UrbLink              = 00000000
[689291 ms] UsbSnoop - MyInternalIOCTLCompletion(f890fdb0) : fido=81b19728, Irp=81ae82f0, Context=822db980, IRQL=2
[689291 ms]  <<<  URB 379 coming back  <<< 
-- URB_FUNCTION_BULK_OR_INTERRUPT_TRANSFER:
  PipeHandle           = 822e77f4 [endpoint 0x00000002]
  TransferFlags        = 00000000 (USBD_TRANSFER_DIRECTION_OUT, ~USBD_SHORT_TRANSFER_OK)
  TransferBufferLength = 00000007
  TransferBuffer       = 00000000
  TransferBufferMDL    = 822d87a0
  UrbLink              = 00000000
[689299 ms] UsbSnoop - DispatchAny(f890e610) : IRP_MJ_INTERNAL_DEVICE_CONTROL
[689299 ms] UsbSnoop - MyDispatchInternalIOCTL(f890fe80) : fdo=81b1aac0, Irp=81ae82f0, IRQL=2
[689299 ms]  >>>  URB 380 going down  >>> 
-- URB_FUNCTION_BULK_OR_INTERRUPT_TRANSFER:
  PipeHandle           = 822e77d4 [endpoint 0x00000081]
  TransferFlags        = 00000003 (USBD_TRANSFER_DIRECTION_IN, USBD_SHORT_TRANSFER_OK)
  TransferBufferLength = 00000100
  TransferBuffer       = 00000000
  TransferBufferMDL    = 822d87a0
  UrbLink              = 00000000
[689322 ms] UsbSnoop - MyInternalIOCTLCompletion(f890fdb0) : fido=81b19728, Irp=81ae82f0, Context=822e2150, IRQL=2
[689322 ms]  <<<  URB 380 coming back  <<< 
-- URB_FUNCTION_BULK_OR_INTERRUPT_TRANSFER:
  PipeHandle           = 822e77d4 [endpoint 0x00000081]
  TransferFlags        = 00000003 (USBD_TRANSFER_DIRECTION_IN, USBD_SHORT_TRANSFER_OK)
  TransferBufferLength = 000000ff
  TransferBuffer       = 00000000
  TransferBufferMDL    = 822d87a0
    00000000: 00 00 00 fa 03 4e 29 4f 4e 29 54 48 45 29 43 42
    00000010: 4c 3a 2a 3f e0 34 2b 31 30 2b 2a 06 45 4e 54 45
    00000020: 52 07 2a 11 3f d8 3f 75 3f e1 3f de 2a 4e 4f 57
    00000030: 29 43 48 45 43 4b 49 4e 47 29 54 48 45 2a 3f de
    00000040: 2a 43 41 4c 43 55 4c 41 54 4f 52 71 43 42 4c 2a
    00000050: 3f de 2a 4c 49 4e 4b 29 43 4f 4e 4e 45 43 54 49
    00000060: 4f 4e 3a 2a 3f de 2a 50 4c 45 41 53 45 29 57 41
    00000070: 49 54 3a 3a 3a 3a 2a 3f 08 31 2b 30 09 04 5d 00
    00000080: 3f e7 5d 00 11 3f 08 30 09 04 5d 01 3f d6 4d 3f
    00000090: 08 37 09 04 5d 00 3f e7 5d 00 11 3f e8 5d 01 11
    000000a0: 3f ce b5 5d 01 11 6a 31 40 5d 01 10 31 11 6a 30
    000000b0: 3f cf 3f e1 3f de 2a 82 82 82 4c 49 4e 4b 29 45
    000000c0: 52 52 4f 52 82 82 82 2a 3f de 2a 50 55 53 48 29
    000000d0: 49 4e 29 54 48 45 29 4c 49 4e 4b 2a 3f de 2a 43
    000000e0: 4f 52 44 29 43 4f 4e 4e 45 43 54 4f 52 53 2a 3f
    000000f0: de 2a 46 49 52 4d 4c 59 29 54 48 45 4e 29 48
  UrbLink              = 00000000
[689359 ms] UsbSnoop - DispatchAny(f890e610) : IRP_MJ_INTERNAL_DEVICE_CONTROL
[689359 ms] UsbSnoop - MyDispatchInternalIOCTL(f890fe80) : fdo=81b1aac0, Irp=81ae82f0, IRQL=2
[689359 ms]  >>>  URB 381 going down  >>> 
-- URB_FUNCTION_BULK_OR_INTERRUPT_TRANSFER:
  PipeHandle           = 822e77f4 [endpoint 0x00000002]
  TransferFlags        = 00000000 (USBD_TRANSFER_DIRECTION_OUT, ~USBD_SHORT_TRANSFER_OK)
  TransferBufferLength = 00000007
  TransferBuffer       = 00000000
  TransferBufferMDL    = 822d87a0
    00000000: 00 00 00 02 05 e0 00
  UrbLink              = 00000000
[689359 ms] UsbSnoop - MyInternalIOCTLCompletion(f890fdb0) : fido=81b19728, Irp=81ae82f0, Context=81b05970, IRQL=2
[689359 ms]  <<<  URB 381 coming back  <<< 
-- URB_FUNCTION_BULK_OR_INTERRUPT_TRANSFER:
  PipeHandle           = 822e77f4 [endpoint 0x00000002]
  TransferFlags        = 00000000 (USBD_TRANSFER_DIRECTION_OUT, ~USBD_SHORT_TRANSFER_OK)
  TransferBufferLength = 00000007
  TransferBuffer       = 00000000
  TransferBufferMDL    = 822d87a0
  UrbLink              = 00000000
[689369 ms] UsbSnoop - DispatchAny(f890e610) : IRP_MJ_INTERNAL_DEVICE_CONTROL
[689369 ms] UsbSnoop - MyDispatchInternalIOCTL(f890fe80) : fdo=81b1aac0, Irp=81ae82f0, IRQL=2
[689369 ms]  >>>  URB 382 going down  >>> 
-- URB_FUNCTION_BULK_OR_INTERRUPT_TRANSFER:
  PipeHandle           = 822e77d4 [endpoint 0x00000081]
  TransferFlags        = 00000003 (USBD_TRANSFER_DIRECTION_IN, USBD_SHORT_TRANSFER_OK)
  TransferBufferLength = 00000100
  TransferBuffer       = 00000000
  TransferBufferMDL    = 822d87a0
  UrbLink              = 00000000
[689390 ms] UsbSnoop - MyInternalIOCTLCompletion(f890fdb0) : fido=81b19728, Irp=81ae82f0, Context=81cd51b0, IRQL=2
[689390 ms]  <<<  URB 382 coming back  <<< 
-- URB_FUNCTION_BULK_OR_INTERRUPT_TRANSFER:
  PipeHandle           = 822e77d4 [endpoint 0x00000081]
  TransferFlags        = 00000003 (USBD_TRANSFER_DIRECTION_IN, USBD_SHORT_TRANSFER_OK)
  TransferBufferLength = 000000ff
  TransferBuffer       = 00000000
  TransferBufferMDL    = 822d87a0
    00000000: 00 00 00 fa 03 49 54 2a 3f de 2a 06 45 4e 54 45
    00000010: 52 07 3a 2a 3f d8 3f d7 4d 3f d4 3f de 2a 2a 3f
    00000020: e0 36 2b 31 2b 2a 29 29 53 54 41 54 55 53 3e 29
    00000030: 4f 3a 4b 3a 2a 3f e0 38 2b 31 30 2b 2a 06 45 4e
    00000040: 54 45 52 07 2a 11 3f d8 3f 76 3f e1 3f 85 3f 7e
    00000050: 08 3f 08 36 2b 30 09 04 5d 00 3f e7 5d 00 11 3f
    00000060: 08 31 2b 30 09 04 5d 00 3f e7 5d 00 11 3f 08 31
    00000070: 2b 31 2b 31 34 09 04 5d 00 3f e7 5d 00 11 3f e1
    00000080: 3f de 2a 50 52 45 53 53 29 45 4e 54 45 52 29 54
    00000090: 4f 2a 3f de 2a 43 48 45 43 4b 29 53 54 41 54 55
    000000a0: 53 3a 2a 3f de 2a 2a 3f de 2a 50 52 45 53 53 29
    000000b0: 4f 4e 29 54 4f 2a 3f de 2a 51 55 49 54 3a 2a 3f
    000000c0: d8 3f 30 04 49 3f d6 30 3f 08 33 2b 3a 30 31 2b
    000000d0: 31 2b 30 09 04 5d 00 3f e7 5d 00 11 3f e8 41 11
    000000e0: 3f e1 3f ce 41 6d 31 3a 31 3f de 2a 42 4c 4f 43
    000000f0: 4b 45 44 2a 3f ce 41 6c 31 3a 31 3f de 2a 55
  UrbLink              = 00000000
[689430 ms] UsbSnoop - DispatchAny(f890e610) : IRP_MJ_INTERNAL_DEVICE_CONTROL
[689430 ms] UsbSnoop - MyDispatchInternalIOCTL(f890fe80) : fdo=81b1aac0, Irp=81ae82f0, IRQL=2
[689430 ms]  >>>  URB 383 going down  >>> 
-- URB_FUNCTION_BULK_OR_INTERRUPT_TRANSFER:
  PipeHandle           = 822e77f4 [endpoint 0x00000002]
  TransferFlags        = 00000000 (USBD_TRANSFER_DIRECTION_OUT, ~USBD_SHORT_TRANSFER_OK)
  TransferBufferLength = 00000007
  TransferBuffer       = 00000000
  TransferBufferMDL    = 822d87a0
    00000000: 00 00 00 02 05 e0 00
  UrbLink              = 00000000
[689430 ms] UsbSnoop - MyInternalIOCTLCompletion(f890fdb0) : fido=81b19728, Irp=81ae82f0, Context=822e2150, IRQL=2
[689430 ms]  <<<  URB 383 coming back  <<< 
-- URB_FUNCTION_BULK_OR_INTERRUPT_TRANSFER:
  PipeHandle           = 822e77f4 [endpoint 0x00000002]
  TransferFlags        = 00000000 (USBD_TRANSFER_DIRECTION_OUT, ~USBD_SHORT_TRANSFER_OK)
  TransferBufferLength = 00000007
  TransferBuffer       = 00000000
  TransferBufferMDL    = 822d87a0
  UrbLink              = 00000000
[689439 ms] UsbSnoop - DispatchAny(f890e610) : IRP_MJ_INTERNAL_DEVICE_CONTROL
[689439 ms] UsbSnoop - MyDispatchInternalIOCTL(f890fe80) : fdo=81b1aac0, Irp=81ae82f0, IRQL=2
[689439 ms]  >>>  URB 384 going down  >>> 
-- URB_FUNCTION_BULK_OR_INTERRUPT_TRANSFER:
  PipeHandle           = 822e77d4 [endpoint 0x00000081]
  TransferFlags        = 00000003 (USBD_TRANSFER_DIRECTION_IN, USBD_SHORT_TRANSFER_OK)
  TransferBufferLength = 00000100
  TransferBuffer       = 00000000
  TransferBufferMDL    = 822d87a0
  UrbLink              = 00000000
[689461 ms] UsbSnoop - MyInternalIOCTLCompletion(f890fdb0) : fido=81b19728, Irp=81ae82f0, Context=81cd51b0, IRQL=2
[689461 ms]  <<<  URB 384 coming back  <<< 
-- URB_FUNCTION_BULK_OR_INTERRUPT_TRANSFER:
  PipeHandle           = 822e77d4 [endpoint 0x00000081]
  TransferFlags        = 00000003 (USBD_TRANSFER_DIRECTION_IN, USBD_SHORT_TRANSFER_OK)
  TransferBufferLength = 000000ff
  TransferBuffer       = 00000000
  TransferBufferMDL    = 822d87a0
    00000000: 00 00 00 fa 03 4e 42 4c 4f 43 4b 45 44 2a 3f 49
    00000010: 70 31 04 49 3f d7 30 3f 54 45 4d 50 00 7f 03 08
    00000020: 36 2b 30 09 04 5d 00 3e e7 5d 00 11 3f 31 04 63
    00000030: 0a 3e 32 04 63 0b 3e 31 04 63 0c 3e 32 04 63 0d
    00000040: 3f 7e 0b 3f 7e 09 3f 7e 0d 3f ea 3f 97 3f 85 3f
    00000050: 93 31 2b 31 36 2b 2a 54 45 58 41 53 29 29 49 4e
    00000060: 53 54 52 55 4d 45 4e 54 53 2a 11 3f 93 38 2b 33
    00000070: 30 2b 2a 43 42 4c 29 29 29 53 59 53 54 45 4d 2a
    00000080: 11 3f 93 31 35 2b 31 30 2b 2a 45 58 50 45 52 49
    00000090: 4d 45 4e 54 29 29 29 57 4f 52 4b 42 4f 4f 4b 2a
    000000a0: 11 3f 93 32 39 2b 33 32 2b 2a 54 45 4d 50 29 29
    000000b0: 29 56 32 3a 30 2a 11 3f 93 33 36 2b 31 38 2b 2a
    000000c0: 10 45 58 50 45 52 49 4d 45 4e 54 29 29 29 43 37
    000000d0: 11 2a 11 3f 93 35 30 2b 31 39 2b 2a 50 52 45 53
    000000e0: 53 29 29 29 06 45 4e 54 45 52 07 29 29 29 4f 4e
    000000f0: 2a 3f 93 35 37 2b 32 38 2b 2a 54 49 71 38 33
  UrbLink              = 00000000
[689499 ms] UsbSnoop - DispatchAny(f890e610) : IRP_MJ_INTERNAL_DEVICE_CONTROL
[689499 ms] UsbSnoop - MyDispatchInternalIOCTL(f890fe80) : fdo=81b1aac0, Irp=81ae82f0, IRQL=2
[689499 ms]  >>>  URB 385 going down  >>> 
-- URB_FUNCTION_BULK_OR_INTERRUPT_TRANSFER:
  PipeHandle           = 822e77f4 [endpoint 0x00000002]
  TransferFlags        = 00000000 (USBD_TRANSFER_DIRECTION_OUT, ~USBD_SHORT_TRANSFER_OK)
  TransferBufferLength = 00000007
  TransferBuffer       = 00000000
  TransferBufferMDL    = 822d87a0
    00000000: 00 00 00 02 05 e0 00
  UrbLink              = 00000000
[689499 ms] UsbSnoop - MyInternalIOCTLCompletion(f890fdb0) : fido=81b19728, Irp=81ae82f0, Context=822db980, IRQL=2
[689499 ms]  <<<  URB 385 coming back  <<< 
-- URB_FUNCTION_BULK_OR_INTERRUPT_TRANSFER:
  PipeHandle           = 822e77f4 [endpoint 0x00000002]
  TransferFlags        = 00000000 (USBD_TRANSFER_DIRECTION_OUT, ~USBD_SHORT_TRANSFER_OK)
  TransferBufferLength = 00000007
  TransferBuffer       = 00000000
  TransferBufferMDL    = 822d87a0
  UrbLink              = 00000000
[689509 ms] UsbSnoop - DispatchAny(f890e610) : IRP_MJ_INTERNAL_DEVICE_CONTROL
[689509 ms] UsbSnoop - MyDispatchInternalIOCTL(f890fe80) : fdo=81b1aac0, Irp=81ae82f0, IRQL=2
[689509 ms]  >>>  URB 386 going down  >>> 
-- URB_FUNCTION_BULK_OR_INTERRUPT_TRANSFER:
  PipeHandle           = 822e77d4 [endpoint 0x00000081]
  TransferFlags        = 00000003 (USBD_TRANSFER_DIRECTION_IN, USBD_SHORT_TRANSFER_OK)
  TransferBufferLength = 00000100
  TransferBuffer       = 00000000
  TransferBufferMDL    = 822d87a0
  UrbLink              = 00000000
[689531 ms] UsbSnoop - MyInternalIOCTLCompletion(f890fdb0) : fido=81b19728, Irp=81ae82f0, Context=81cd51b0, IRQL=2
[689531 ms]  <<<  URB 386 coming back  <<< 
-- URB_FUNCTION_BULK_OR_INTERRUPT_TRANSFER:
  PipeHandle           = 822e77d4 [endpoint 0x00000081]
  TransferFlags        = 00000003 (USBD_TRANSFER_DIRECTION_IN, USBD_SHORT_TRANSFER_OK)
  TransferBufferLength = 000000ff
  TransferBuffer       = 00000000
  TransferBufferMDL    = 822d87a0
    00000000: 00 00 00 fa 03 29 29 29 50 4c 55 53 2a 3f d8 3f
    00000010: e1 3f de 2a 54 55 52 4e 29 4f 4e 29 54 48 45 29
    00000020: 43 42 4c 3a 2a 3f e0 34 2b 31 30 2b 2a 06 45 4e
    00000030: 54 45 52 07 2a 11 3f d8 3f 75 3f e1 3f de 2a 4e
    00000040: 4f 57 29 43 48 45 43 4b 49 4e 47 29 54 48 45 2a
    00000050: 3f de 2a 43 41 4c 43 55 4c 41 54 4f 52 71 43 42
    00000060: 4c 2a 3f de 2a 4c 49 4e 4b 29 43 4f 4e 4e 45 43
    00000070: 54 49 4f 4e 3a 2a 3f de 2a 50 4c 45 41 53 45 29
    00000080: 57 41 49 54 3a 3a 3a 3a 2a 3f 08 31 2b 30 09 04
    00000090: 5d 00 3f e7 5d 00 11 3f 08 30 09 04 5d 01 3f d6
    000000a0: 4d 3f 08 37 09 04 5d 00 3f e7 5d 00 11 3f e8 5d
    000000b0: 01 11 3f ce b5 5d 01 11 6a 31 40 5d 01 10 31 11
    000000c0: 6a 30 3f cf 3f e1 3f de 2a 82 82 82 4c 49 4e 4b
    000000d0: 29 45 52 52 4f 52 82 82 82 2a 3f de 2a 50 55 53
    000000e0: 48 29 49 4e 29 54 48 45 29 4c 49 4e 4b 2a 3f de
    000000f0: 2a 43 4f 52 44 29 43 4f 4e 4e 45 43 54 4f 52
  UrbLink              = 00000000
[689569 ms] UsbSnoop - DispatchAny(f890e610) : IRP_MJ_INTERNAL_DEVICE_CONTROL
[689569 ms] UsbSnoop - MyDispatchInternalIOCTL(f890fe80) : fdo=81b1aac0, Irp=81ae82f0, IRQL=2
[689569 ms]  >>>  URB 387 going down  >>> 
-- URB_FUNCTION_BULK_OR_INTERRUPT_TRANSFER:
  PipeHandle           = 822e77f4 [endpoint 0x00000002]
  TransferFlags        = 00000000 (USBD_TRANSFER_DIRECTION_OUT, ~USBD_SHORT_TRANSFER_OK)
  TransferBufferLength = 00000007
  TransferBuffer       = 00000000
  TransferBufferMDL    = 822d87a0
    00000000: 00 00 00 02 05 e0 00
  UrbLink              = 00000000
[689570 ms] UsbSnoop - MyInternalIOCTLCompletion(f890fdb0) : fido=81b19728, Irp=81ae82f0, Context=822e2150, IRQL=2
[689570 ms]  <<<  URB 387 coming back  <<< 
-- URB_FUNCTION_BULK_OR_INTERRUPT_TRANSFER:
  PipeHandle           = 822e77f4 [endpoint 0x00000002]
  TransferFlags        = 00000000 (USBD_TRANSFER_DIRECTION_OUT, ~USBD_SHORT_TRANSFER_OK)
  TransferBufferLength = 00000007
  TransferBuffer       = 00000000
  TransferBufferMDL    = 822d87a0
  UrbLink              = 00000000
[689579 ms] UsbSnoop - DispatchAny(f890e610) : IRP_MJ_INTERNAL_DEVICE_CONTROL
[689579 ms] UsbSnoop - MyDispatchInternalIOCTL(f890fe80) : fdo=81b1aac0, Irp=81ae82f0, IRQL=2
[689579 ms]  >>>  URB 388 going down  >>> 
-- URB_FUNCTION_BULK_OR_INTERRUPT_TRANSFER:
  PipeHandle           = 822e77d4 [endpoint 0x00000081]
  TransferFlags        = 00000003 (USBD_TRANSFER_DIRECTION_IN, USBD_SHORT_TRANSFER_OK)
  TransferBufferLength = 00000100
  TransferBuffer       = 00000000
  TransferBufferMDL    = 822d87a0
  UrbLink              = 00000000
[689601 ms] UsbSnoop - MyInternalIOCTLCompletion(f890fdb0) : fido=81b19728, Irp=81ae82f0, Context=81cd51b0, IRQL=2
[689601 ms]  <<<  URB 388 coming back  <<< 
-- URB_FUNCTION_BULK_OR_INTERRUPT_TRANSFER:
  PipeHandle           = 822e77d4 [endpoint 0x00000081]
  TransferFlags        = 00000003 (USBD_TRANSFER_DIRECTION_IN, USBD_SHORT_TRANSFER_OK)
  TransferBufferLength = 000000ff
  TransferBuffer       = 00000000
  TransferBufferMDL    = 822d87a0
    00000000: 00 00 00 fa 03 53 2a 3f de 2a 46 49 52 4d 4c 59
    00000010: 29 54 48 45 4e 29 48 49 54 2a 3f de 2a 06 45 4e
    00000020: 54 45 52 07 3a 2a 3f d8 3f d7 4d 3f d4 3f de 2a
    00000030: 2a 3f e0 36 2b 31 2b 2a 29 29 53 54 41 54 55 53
    00000040: 3e 29 4f 3a 4b 3a 2a 3f e0 38 2b 31 30 2b 2a 06
    00000050: 45 4e 54 45 52 07 2a 11 3f d8 3f 76 3f e1 3f 85
    00000060: 3f 7e 08 3f 30 04 63 0a 3f 39 39 04 63 0b 3f 31
    00000070: 30 04 63 02 3f 30 04 63 0c 3f 39 30 04 63 0d 3f
    00000080: 31 30 04 63 03 3f fa 5d 03 2b 5d 04 3f e1 3f 08
    00000090: 36 2b 30 09 04 5d 00 3f e7 5d 00 11 3f 08 31 2b
    000000a0: 30 09 04 5d 00 3f e7 5d 00 11 3f 08 31 2b 31 2b
    000000b0: 31 09 04 5d 00 3f e7 5d 00 11 3f d6 4c 3f e1 3f
    000000c0: de 2a 45 4e 54 45 52 29 4e 55 4d 42 45 52 2a 3f
    000000d0: de 2a 4f 46 29 53 41 4d 50 4c 45 53 2a 3f dc 43
    000000e0: 3f ce 43 6b 31 3c 43 6f b1 43 11 3e d7 4c 3f 43
    000000f0: 04 b5 5d 03 3f e1 3f de 2a 50 52 45 53 53 29
  UrbLink              = 00000000
[689639 ms] UsbSnoop - DispatchAny(f890e610) : IRP_MJ_INTERNAL_DEVICE_CONTROL
[689639 ms] UsbSnoop - MyDispatchInternalIOCTL(f890fe80) : fdo=81b1aac0, Irp=81ae82f0, IRQL=2
[689639 ms]  >>>  URB 389 going down  >>> 
-- URB_FUNCTION_BULK_OR_INTERRUPT_TRANSFER:
  PipeHandle           = 822e77f4 [endpoint 0x00000002]
  TransferFlags        = 00000000 (USBD_TRANSFER_DIRECTION_OUT, ~USBD_SHORT_TRANSFER_OK)
  TransferBufferLength = 00000007
  TransferBuffer       = 00000000
  TransferBufferMDL    = 822d87a0
    00000000: 00 00 00 02 05 e0 00
  UrbLink              = 00000000
[689640 ms] UsbSnoop - MyInternalIOCTLCompletion(f890fdb0) : fido=81b19728, Irp=81ae82f0, Context=822db980, IRQL=2
[689640 ms]  <<<  URB 389 coming back  <<< 
-- URB_FUNCTION_BULK_OR_INTERRUPT_TRANSFER:
  PipeHandle           = 822e77f4 [endpoint 0x00000002]
  TransferFlags        = 00000000 (USBD_TRANSFER_DIRECTION_OUT, ~USBD_SHORT_TRANSFER_OK)
  TransferBufferLength = 00000007
  TransferBuffer       = 00000000
  TransferBufferMDL    = 822d87a0
  UrbLink              = 00000000
[689649 ms] UsbSnoop - DispatchAny(f890e610) : IRP_MJ_INTERNAL_DEVICE_CONTROL
[689649 ms] UsbSnoop - MyDispatchInternalIOCTL(f890fe80) : fdo=81b1aac0, Irp=81ae82f0, IRQL=2
[689649 ms]  >>>  URB 390 going down  >>> 
-- URB_FUNCTION_BULK_OR_INTERRUPT_TRANSFER:
  PipeHandle           = 822e77d4 [endpoint 0x00000081]
  TransferFlags        = 00000003 (USBD_TRANSFER_DIRECTION_IN, USBD_SHORT_TRANSFER_OK)
  TransferBufferLength = 00000100
  TransferBuffer       = 00000000
  TransferBufferMDL    = 822d87a0
  UrbLink              = 00000000
[689671 ms] UsbSnoop - MyInternalIOCTLCompletion(f890fdb0) : fido=81b19728, Irp=81ae82f0, Context=81cd51b0, IRQL=2
[689671 ms]  <<<  URB 390 coming back  <<< 
-- URB_FUNCTION_BULK_OR_INTERRUPT_TRANSFER:
  PipeHandle           = 822e77d4 [endpoint 0x00000081]
  TransferFlags        = 00000003 (USBD_TRANSFER_DIRECTION_IN, USBD_SHORT_TRANSFER_OK)
  TransferBufferLength = 000000ff
  TransferBuffer       = 00000000
  TransferBufferMDL    = 822d87a0
    00000000: 00 00 00 fa 03 45 4e 54 45 52 29 54 4f 2a 3f de
    00000010: 2a 53 54 41 52 54 2a 3f de 2a 54 45 4d 50 45 52
    00000020: 41 54 55 52 45 2a 3f de 2a 47 52 41 50 48 2a 3f
    00000030: d8 3f 85 3f 08 33 2b 34 2b b0 31 2b 30 09 04 5d
    00000040: 00 3f e7 5d 00 11 3f d3 49 2b 31 2b 43 2b 31 11
    00000050: 3f e8 5d 03 10 49 11 11 3f 9e 49 2b 5d 03 10 49
    00000060: 11 11 3f d4 3f 43 04 b5 5d 04 3f 23 49 2b 49 2b
    00000070: 30 2b 43 82 34 71 31 2b 34 11 04 5d 04 3f ec fd
    00000080: 2b 5d 04 2b 5d 03 2b 81 11 3f 8f 3f 93 36 2b 34
    00000090: 2b 2a 54 45 4d 50 10 43 11 2a 11 3f 93 35 31 2b
    000000a0: 36 38 2b 2a 54 49 4d 45 10 53 11 2a 11 3f 84 3f
    000000b0: 54 55 4e 45 00 00 03 08 36 2b 30 09 04 5d 00 3e
    000000c0: e7 5d 00 11 3f 31 04 63 0a 3e 32 04 63 0b 3e 31
    000000d0: 04 63 0c 3e 32 04 63 0d 3f 7e 0b 3f 7e 09 3f 7e
    000000e0: 0d 3f ea 3f 97 3f 85 3f 93 31 2b 31 36 2b 2a 54
    000000f0: 45 58 41 53 29 29 49 4e 53 54 52 55 4d 45 4e
  UrbLink              = 00000000
[689710 ms] UsbSnoop - DispatchAny(f890e610) : IRP_MJ_INTERNAL_DEVICE_CONTROL
[689710 ms] UsbSnoop - MyDispatchInternalIOCTL(f890fe80) : fdo=81b1aac0, Irp=81ae82f0, IRQL=2
[689710 ms]  >>>  URB 391 going down  >>> 
-- URB_FUNCTION_BULK_OR_INTERRUPT_TRANSFER:
  PipeHandle           = 822e77f4 [endpoint 0x00000002]
  TransferFlags        = 00000000 (USBD_TRANSFER_DIRECTION_OUT, ~USBD_SHORT_TRANSFER_OK)
  TransferBufferLength = 00000007
  TransferBuffer       = 00000000
  TransferBufferMDL    = 822d87a0
    00000000: 00 00 00 02 05 e0 00
  UrbLink              = 00000000
[689710 ms] UsbSnoop - MyInternalIOCTLCompletion(f890fdb0) : fido=81b19728, Irp=81ae82f0, Context=822e2150, IRQL=2
[689710 ms]  <<<  URB 391 coming back  <<< 
-- URB_FUNCTION_BULK_OR_INTERRUPT_TRANSFER:
  PipeHandle           = 822e77f4 [endpoint 0x00000002]
  TransferFlags        = 00000000 (USBD_TRANSFER_DIRECTION_OUT, ~USBD_SHORT_TRANSFER_OK)
  TransferBufferLength = 00000007
  TransferBuffer       = 00000000
  TransferBufferMDL    = 822d87a0
  UrbLink              = 00000000
[689719 ms] UsbSnoop - DispatchAny(f890e610) : IRP_MJ_INTERNAL_DEVICE_CONTROL
[689719 ms] UsbSnoop - MyDispatchInternalIOCTL(f890fe80) : fdo=81b1aac0, Irp=81ae82f0, IRQL=2
[689719 ms]  >>>  URB 392 going down  >>> 
-- URB_FUNCTION_BULK_OR_INTERRUPT_TRANSFER:
  PipeHandle           = 822e77d4 [endpoint 0x00000081]
  TransferFlags        = 00000003 (USBD_TRANSFER_DIRECTION_IN, USBD_SHORT_TRANSFER_OK)
  TransferBufferLength = 00000100
  TransferBuffer       = 00000000
  TransferBufferMDL    = 822d87a0
  UrbLink              = 00000000
[689741 ms] UsbSnoop - MyInternalIOCTLCompletion(f890fdb0) : fido=81b19728, Irp=81ae82f0, Context=81cd51b0, IRQL=2
[689741 ms]  <<<  URB 392 coming back  <<< 
-- URB_FUNCTION_BULK_OR_INTERRUPT_TRANSFER:
  PipeHandle           = 822e77d4 [endpoint 0x00000081]
  TransferFlags        = 00000003 (USBD_TRANSFER_DIRECTION_IN, USBD_SHORT_TRANSFER_OK)
  TransferBufferLength = 000000ff
  TransferBuffer       = 00000000
  TransferBufferMDL    = 822d87a0
    00000000: 00 00 00 fa 03 54 53 2a 11 3f 93 38 2b 33 30 2b
    00000010: 2a 43 42 4c 29 29 29 53 59 53 54 45 4d 2a 11 3f
    00000020: 93 31 35 2b 31 30 2b 2a 45 58 50 45 52 49 4d 45
    00000030: 4e 54 29 29 29 57 4f 52 4b 42 4f 4f 4b 2a 11 3f
    00000040: 93 32 39 2b 33 32 2b 2a 54 55 4e 45 29 29 29 56
    00000050: 32 3a 30 2a 11 3f 93 33 36 2b 31 38 2b 2a 10 45
    00000060: 58 50 45 52 49 4d 45 4e 54 29 29 29 4d 34 11 2a
    00000070: 11 3f 93 35 30 2b 31 39 2b 2a 50 52 45 53 53 29
    00000080: 29 29 06 45 4e 54 45 52 07 29 29 29 4f 4e 2a 3f
    00000090: 93 35 37 2b 32 38 2b 2a 54 49 71 38 33 29 29 29
    000000a0: 50 4c 55 53 2a 3f d8 3f e1 3f de 2a 54 55 52 4e
    000000b0: 29 4f 4e 29 54 48 45 29 43 42 4c 3a 2a 3f e0 34
    000000c0: 2b 31 30 2b 2a 06 45 4e 54 45 52 07 2a 11 3f d8
    000000d0: 3f 75 3f e1 3f de 2a 4e 4f 57 29 43 48 45 43 4b
    000000e0: 49 4e 47 29 54 48 45 2a 3f de 2a 43 41 4c 43 55
    000000f0: 4c 41 54 4f 52 71 43 42 4c 2a 3f de 2a 4c 49
  UrbLink              = 00000000
[689780 ms] UsbSnoop - DispatchAny(f890e610) : IRP_MJ_INTERNAL_DEVICE_CONTROL
[689780 ms] UsbSnoop - MyDispatchInternalIOCTL(f890fe80) : fdo=81b1aac0, Irp=81ae82f0, IRQL=2
[689780 ms]  >>>  URB 393 going down  >>> 
-- URB_FUNCTION_BULK_OR_INTERRUPT_TRANSFER:
  PipeHandle           = 822e77f4 [endpoint 0x00000002]
  TransferFlags        = 00000000 (USBD_TRANSFER_DIRECTION_OUT, ~USBD_SHORT_TRANSFER_OK)
  TransferBufferLength = 00000007
  TransferBuffer       = 00000000
  TransferBufferMDL    = 822d87a0
    00000000: 00 00 00 02 05 e0 00
  UrbLink              = 00000000
[689780 ms] UsbSnoop - MyInternalIOCTLCompletion(f890fdb0) : fido=81b19728, Irp=81ae82f0, Context=822db980, IRQL=2
[689780 ms]  <<<  URB 393 coming back  <<< 
-- URB_FUNCTION_BULK_OR_INTERRUPT_TRANSFER:
  PipeHandle           = 822e77f4 [endpoint 0x00000002]
  TransferFlags        = 00000000 (USBD_TRANSFER_DIRECTION_OUT, ~USBD_SHORT_TRANSFER_OK)
  TransferBufferLength = 00000007
  TransferBuffer       = 00000000
  TransferBufferMDL    = 822d87a0
  UrbLink              = 00000000
[689790 ms] UsbSnoop - DispatchAny(f890e610) : IRP_MJ_INTERNAL_DEVICE_CONTROL
[689790 ms] UsbSnoop - MyDispatchInternalIOCTL(f890fe80) : fdo=81b1aac0, Irp=81ae82f0, IRQL=2
[689790 ms]  >>>  URB 394 going down  >>> 
-- URB_FUNCTION_BULK_OR_INTERRUPT_TRANSFER:
  PipeHandle           = 822e77d4 [endpoint 0x00000081]
  TransferFlags        = 00000003 (USBD_TRANSFER_DIRECTION_IN, USBD_SHORT_TRANSFER_OK)
  TransferBufferLength = 00000100
  TransferBuffer       = 00000000
  TransferBufferMDL    = 822d87a0
  UrbLink              = 00000000
[689811 ms] UsbSnoop - MyInternalIOCTLCompletion(f890fdb0) : fido=81b19728, Irp=81ae82f0, Context=81cd51b0, IRQL=2
[689811 ms]  <<<  URB 394 coming back  <<< 
-- URB_FUNCTION_BULK_OR_INTERRUPT_TRANSFER:
  PipeHandle           = 822e77d4 [endpoint 0x00000081]
  TransferFlags        = 00000003 (USBD_TRANSFER_DIRECTION_IN, USBD_SHORT_TRANSFER_OK)
  TransferBufferLength = 000000ff
  TransferBuffer       = 00000000
  TransferBufferMDL    = 822d87a0
    00000000: 00 00 00 fa 03 4e 4b 29 43 4f 4e 4e 45 43 54 49
    00000010: 4f 4e 3a 2a 3f de 2a 50 4c 45 41 53 45 29 57 41
    00000020: 49 54 3a 3a 3a 3a 2a 3f 08 31 2b 30 09 04 5d 00
    00000030: 3f e7 5d 00 11 3f 08 30 09 04 5d 01 3f d6 4d 3f
    00000040: 08 37 09 04 5d 00 3f e7 5d 00 11 3f e8 5d 01 11
    00000050: 3f ce b5 5d 01 11 6a 31 40 5d 01 10 31 11 6a 30
    00000060: 3f cf 3f e1 3f de 2a 82 82 82 4c 49 4e 4b 29 45
    00000070: 52 52 4f 52 82 82 82 2a 3f de 2a 50 55 53 48 29
    00000080: 49 4e 29 54 48 45 29 4c 49 4e 4b 2a 3f de 2a 43
    00000090: 4f 52 44 29 43 4f 4e 4e 45 43 54 4f 52 53 2a 3f
    000000a0: de 2a 46 49 52 4d 4c 59 29 54 48 45 4e 29 48 49
    000000b0: 54 2a 3f de 2a 06 45 4e 54 45 52 07 3a 2a 3f d8
    000000c0: 3f d7 4d 3f d4 3f de 2a 2a 3f e0 36 2b 31 2b 2a
    000000d0: 29 29 53 54 41 54 55 53 3e 29 4f 3a 4b 3a 2a 3f
    000000e0: e0 38 2b 31 30 2b 2a 06 45 4e 54 45 52 07 2a 11
    000000f0: 3f d8 3f 76 3f e1 3f 85 3f 7e 08 3f fa 5d 01
  UrbLink              = 00000000
[689850 ms] UsbSnoop - DispatchAny(f890e610) : IRP_MJ_INTERNAL_DEVICE_CONTROL
[689850 ms] UsbSnoop - MyDispatchInternalIOCTL(f890fe80) : fdo=81b1aac0, Irp=81ae82f0, IRQL=2
[689850 ms]  >>>  URB 395 going down  >>> 
-- URB_FUNCTION_BULK_OR_INTERRUPT_TRANSFER:
  PipeHandle           = 822e77f4 [endpoint 0x00000002]
  TransferFlags        = 00000000 (USBD_TRANSFER_DIRECTION_OUT, ~USBD_SHORT_TRANSFER_OK)
  TransferBufferLength = 00000007
  TransferBuffer       = 00000000
  TransferBufferMDL    = 822d87a0
    00000000: 00 00 00 02 05 e0 00
  UrbLink              = 00000000
[689850 ms] UsbSnoop - MyInternalIOCTLCompletion(f890fdb0) : fido=81b19728, Irp=81ae82f0, Context=822e2150, IRQL=2
[689850 ms]  <<<  URB 395 coming back  <<< 
-- URB_FUNCTION_BULK_OR_INTERRUPT_TRANSFER:
  PipeHandle           = 822e77f4 [endpoint 0x00000002]
  TransferFlags        = 00000000 (USBD_TRANSFER_DIRECTION_OUT, ~USBD_SHORT_TRANSFER_OK)
  TransferBufferLength = 00000007
  TransferBuffer       = 00000000
  TransferBufferMDL    = 822d87a0
  UrbLink              = 00000000
[689860 ms] UsbSnoop - DispatchAny(f890e610) : IRP_MJ_INTERNAL_DEVICE_CONTROL
[689860 ms] UsbSnoop - MyDispatchInternalIOCTL(f890fe80) : fdo=81b1aac0, Irp=81ae82f0, IRQL=2
[689860 ms]  >>>  URB 396 going down  >>> 
-- URB_FUNCTION_BULK_OR_INTERRUPT_TRANSFER:
  PipeHandle           = 822e77d4 [endpoint 0x00000081]
  TransferFlags        = 00000003 (USBD_TRANSFER_DIRECTION_IN, USBD_SHORT_TRANSFER_OK)
  TransferBufferLength = 00000100
  TransferBuffer       = 00000000
  TransferBufferMDL    = 822d87a0
  UrbLink              = 00000000
[689881 ms] UsbSnoop - MyInternalIOCTLCompletion(f890fdb0) : fido=81b19728, Irp=81ae82f0, Context=81cd51b0, IRQL=2
[689881 ms]  <<<  URB 396 coming back  <<< 
-- URB_FUNCTION_BULK_OR_INTERRUPT_TRANSFER:
  PipeHandle           = 822e77d4 [endpoint 0x00000081]
  TransferFlags        = 00000003 (USBD_TRANSFER_DIRECTION_IN, USBD_SHORT_TRANSFER_OK)
  TransferBufferLength = 000000ff
  TransferBuffer       = 00000000
  TransferBufferMDL    = 822d87a0
    00000000: 00 00 00 fa 03 2b 5d 04 3f 08 36 2b 30 09 04 5d
    00000010: 00 3f e7 5d 00 11 3f 08 31 2b 30 09 04 5d 00 3f
    00000020: e7 5d 00 11 3f 08 31 2b 31 2b 31 09 04 5d 00 3f
    00000030: e7 5d 00 11 3f e1 3f de 2a 50 52 45 53 53 29 45
    00000040: 4e 54 45 52 29 54 4f 2a 3f de 2a 53 54 41 52 54
    00000050: 29 43 4f 4c 4c 45 43 54 49 4e 47 2a 3f de 2a 44
    00000060: 41 54 41 2a 3f d8 3f 08 33 2b 3a 30 30 30 32 35
    00000070: 2b 39 39 2b 30 2b 30 2b 30 2b 30 2b 30 2b 31 09
    00000080: 04 5d 00 3f e7 5d 00 11 3f 85 3f e8 5d 04 11 3f
    00000090: e8 5d 01 11 3f ec fe 2b 5d 01 2b 5d 04 2b 81 11
    000000a0: 3f 8f 3f 93 36 2b 31 30 2b 2a 50 52 45 53 53 55
    000000b0: 52 45 2a 11 3f 93 35 31 2b 36 38 2b 2a 54 49 4d
    000000c0: 45 10 53 11 2a 11 3f 84 3f 02 2d 40 a1 68 9e 05
    000000d0: a7 70 55 4b 5f 20 3e 0b 53 20 c3 e4 a2 6c be 15
    000000e0: 50 ad 25 49 85 f1 0e 31 0f 8e 0f a0 0e cb 13 dc
    000000f0: d6 3c 14 c3 d4 1f 6c b9 e0 e3 98 35 88 4b cc
  UrbLink              = 00000000
[689920 ms] UsbSnoop - DispatchAny(f890e610) : IRP_MJ_INTERNAL_DEVICE_CONTROL
[689920 ms] UsbSnoop - MyDispatchInternalIOCTL(f890fe80) : fdo=81b1aac0, Irp=81ae82f0, IRQL=2
[689920 ms]  >>>  URB 397 going down  >>> 
-- URB_FUNCTION_BULK_OR_INTERRUPT_TRANSFER:
  PipeHandle           = 822e77f4 [endpoint 0x00000002]
  TransferFlags        = 00000000 (USBD_TRANSFER_DIRECTION_OUT, ~USBD_SHORT_TRANSFER_OK)
  TransferBufferLength = 00000007
  TransferBuffer       = 00000000
  TransferBufferMDL    = 822d87a0
    00000000: 00 00 00 02 05 e0 00
  UrbLink              = 00000000
[689920 ms] UsbSnoop - MyInternalIOCTLCompletion(f890fdb0) : fido=81b19728, Irp=81ae82f0, Context=822f29c8, IRQL=2
[689920 ms]  <<<  URB 397 coming back  <<< 
-- URB_FUNCTION_BULK_OR_INTERRUPT_TRANSFER:
  PipeHandle           = 822e77f4 [endpoint 0x00000002]
  TransferFlags        = 00000000 (USBD_TRANSFER_DIRECTION_OUT, ~USBD_SHORT_TRANSFER_OK)
  TransferBufferLength = 00000007
  TransferBuffer       = 00000000
  TransferBufferMDL    = 822d87a0
  UrbLink              = 00000000
[689930 ms] UsbSnoop - DispatchAny(f890e610) : IRP_MJ_INTERNAL_DEVICE_CONTROL
[689930 ms] UsbSnoop - MyDispatchInternalIOCTL(f890fe80) : fdo=81b1aac0, Irp=81ae82f0, IRQL=2
[689930 ms]  >>>  URB 398 going down  >>> 
-- URB_FUNCTION_BULK_OR_INTERRUPT_TRANSFER:
  PipeHandle           = 822e77d4 [endpoint 0x00000081]
  TransferFlags        = 00000003 (USBD_TRANSFER_DIRECTION_IN, USBD_SHORT_TRANSFER_OK)
  TransferBufferLength = 00000100
  TransferBuffer       = 00000000
  TransferBufferMDL    = 822d87a0
  UrbLink              = 00000000
[689930 ms] UsbSnoop - MyInternalIOCTLCompletion(f890fdb0) : fido=81b19728, Irp=81ae82f0, Context=82307cb8, IRQL=2
[689930 ms]  <<<  URB 398 coming back  <<< 
-- URB_FUNCTION_BULK_OR_INTERRUPT_TRANSFER:
  PipeHandle           = 822e77d4 [endpoint 0x00000081]
  TransferFlags        = 00000003 (USBD_TRANSFER_DIRECTION_IN, USBD_SHORT_TRANSFER_OK)
  TransferBufferLength = 00000014
  TransferBuffer       = 00000000
  TransferBufferMDL    = 822d87a0
    00000000: 00 00 00 0f 04 14 78 0f 90 2c 9c 93 18 31 0d b9
    00000010: e7 74 00 ff
  UrbLink              = 00000000
[689970 ms] UsbSnoop - DispatchAny(f890e610) : IRP_MJ_INTERNAL_DEVICE_CONTROL
[689970 ms] UsbSnoop - MyDispatchInternalIOCTL(f890fe80) : fdo=81b1aac0, Irp=81ae82f0, IRQL=2
[689970 ms]  >>>  URB 399 going down  >>> 
-- URB_FUNCTION_BULK_OR_INTERRUPT_TRANSFER:
  PipeHandle           = 822e77f4 [endpoint 0x00000002]
  TransferFlags        = 00000000 (USBD_TRANSFER_DIRECTION_OUT, ~USBD_SHORT_TRANSFER_OK)
  TransferBufferLength = 00000007
  TransferBuffer       = 00000000
  TransferBufferMDL    = 822d87a0
    00000000: 00 00 00 02 05 e0 00
  UrbLink              = 00000000
[689970 ms] UsbSnoop - MyInternalIOCTLCompletion(f890fdb0) : fido=81b19728, Irp=81ae82f0, Context=822f29c8, IRQL=2
[689970 ms]  <<<  URB 399 coming back  <<< 
-- URB_FUNCTION_BULK_OR_INTERRUPT_TRANSFER:
  PipeHandle           = 822e77f4 [endpoint 0x00000002]
  TransferFlags        = 00000000 (USBD_TRANSFER_DIRECTION_OUT, ~USBD_SHORT_TRANSFER_OK)
  TransferBufferLength = 00000007
  TransferBuffer       = 00000000
  TransferBufferMDL    = 822d87a0
  UrbLink              = 00000000
[690984 ms] UsbSnoop - DispatchAny(f890e610) : IRP_MJ_INTERNAL_DEVICE_CONTROL
[690984 ms] UsbSnoop - MyDispatchInternalIOCTL(f890fe80) : fdo=81b1aac0, Irp=81b03008, IRQL=0
[690984 ms]  >>>  URB 400 going down  >>> 
-- URB_FUNCTION_RESET_PIPE:
  PipeHandle = 822e77d4 [endpoint 0x00000081]
[690990 ms] UsbSnoop - MyInternalIOCTLCompletion(f890fdb0) : fido=00000000, Irp=81b03008, Context=822f29c8, IRQL=0
[690990 ms]  <<<  URB 400 coming back  <<< 
-- URB_FUNCTION_RESET_PIPE:
[690990 ms] UsbSnoop - DispatchAny(f890e610) : IRP_MJ_INTERNAL_DEVICE_CONTROL
[690990 ms] UsbSnoop - MyDispatchInternalIOCTL(f890fe80) : fdo=81b1aac0, Irp=81b03008, IRQL=0
[690990 ms]  >>>  URB 401 going down  >>> 
-- URB_FUNCTION_RESET_PIPE:
  PipeHandle = 822e77f4 [endpoint 0x00000002]
[690999 ms] UsbSnoop - MyInternalIOCTLCompletion(f890fdb0) : fido=00000000, Irp=81b03008, Context=822db980, IRQL=0
[690999 ms]  <<<  URB 401 coming back  <<< 
-- URB_FUNCTION_RESET_PIPE:
[690999 ms] UsbSnoop - DispatchAny(f890e610) : IRP_MJ_INTERNAL_DEVICE_CONTROL
[690999 ms] UsbSnoop - MyDispatchInternalIOCTL(f890fe80) : fdo=81b1aac0, Irp=81b03008, IRQL=0
