[206902 ms] UsbSnoop - DispatchAny(f9e0a610) : IRP_MJ_INTERNAL_DEVICE_CONTROL
[206902 ms] UsbSnoop - MyDispatchInternalIOCTL(f9e0be80) : fdo=815e4d28, Irp=81101228, IRQL=0
[206902 ms]  >>>  URB 50 going down  >>> 
-- URB_FUNCTION_RESET_PIPE:
  PipeHandle = 813bfa14 [endpoint 0x00000081]
[206903 ms] UsbSnoop - MyInternalIOCTLCompletion(f9e0bdb0) : fido=00000000, Irp=81101228, Context=81102a68, IRQL=0
[206903 ms]  <<<  URB 50 coming back  <<< 
-- URB_FUNCTION_RESET_PIPE:
[206903 ms] UsbSnoop - DispatchAny(f9e0a610) : IRP_MJ_INTERNAL_DEVICE_CONTROL
[206903 ms] UsbSnoop - MyDispatchInternalIOCTL(f9e0be80) : fdo=815e4d28, Irp=81101228, IRQL=0
[206903 ms]  >>>  URB 51 going down  >>> 
-- URB_FUNCTION_RESET_PIPE:
  PipeHandle = 813bfa34 [endpoint 0x00000002]
[206912 ms] UsbSnoop - MyInternalIOCTLCompletion(f9e0bdb0) : fido=00000000, Irp=81101228, Context=814319f0, IRQL=0
[206912 ms]  <<<  URB 51 coming back  <<< 
-- URB_FUNCTION_RESET_PIPE:
[208254 ms] UsbSnoop - DispatchAny(f9e0a610) : IRP_MJ_INTERNAL_DEVICE_CONTROL
[208254 ms] UsbSnoop - MyDispatchInternalIOCTL(f9e0be80) : fdo=815e4d28, Irp=81693728, IRQL=2
[208254 ms]  >>>  URB 52 going down  >>> 
-- URB_FUNCTION_BULK_OR_INTERRUPT_TRANSFER:
  PipeHandle           = 813bfa34 [endpoint 0x00000002]
  TransferFlags        = 00000000 (USBD_TRANSFER_DIRECTION_OUT, ~USBD_SHORT_TRANSFER_OK)
  TransferBufferLength = 00000009
  TransferBuffer       = 00000000
  TransferBufferMDL    = 81702960
    00000000: 00 00 00 04 01 00 00 04 00
  UrbLink              = 00000000
[208255 ms] UsbSnoop - MyInternalIOCTLCompletion(f9e0bdb0) : fido=81103020, Irp=81693728, Context=81422700, IRQL=2
[208255 ms]  <<<  URB 52 coming back  <<< 
-- URB_FUNCTION_BULK_OR_INTERRUPT_TRANSFER:
  PipeHandle           = 813bfa34 [endpoint 0x00000002]
  TransferFlags        = 00000000 (USBD_TRANSFER_DIRECTION_OUT, ~USBD_SHORT_TRANSFER_OK)
  TransferBufferLength = 00000009
  TransferBuffer       = 00000000
  TransferBufferMDL    = 81702960
  UrbLink              = 00000000
[208255 ms] UsbSnoop - DispatchAny(f9e0a610) : IRP_MJ_INTERNAL_DEVICE_CONTROL
[208255 ms] UsbSnoop - MyDispatchInternalIOCTL(f9e0be80) : fdo=815e4d28, Irp=81693728, IRQL=2
[208255 ms]  >>>  URB 53 going down  >>> 
-- URB_FUNCTION_BULK_OR_INTERRUPT_TRANSFER:
  PipeHandle           = 813bfa14 [endpoint 0x00000081]
  TransferFlags        = 00000003 (USBD_TRANSFER_DIRECTION_IN, USBD_SHORT_TRANSFER_OK)
  TransferBufferLength = 00000100
  TransferBuffer       = 00000000
  TransferBufferMDL    = 81702960
  UrbLink              = 00000000
[208262 ms] UsbSnoop - MyInternalIOCTLCompletion(f9e0bdb0) : fido=81103020, Irp=81693728, Context=81108498, IRQL=2
[208262 ms]  <<<  URB 53 coming back  <<< 
-- URB_FUNCTION_BULK_OR_INTERRUPT_TRANSFER:
  PipeHandle           = 813bfa14 [endpoint 0x00000081]
  TransferFlags        = 00000003 (USBD_TRANSFER_DIRECTION_IN, USBD_SHORT_TRANSFER_OK)
  TransferBufferLength = 00000009
  TransferBuffer       = 00000000
  TransferBufferMDL    = 81702960
    00000000: 00 00 00 04 02 00 00 00 fa
  UrbLink              = 00000000
[208285 ms] UsbSnoop - DispatchAny(f9e0a610) : IRP_MJ_INTERNAL_DEVICE_CONTROL
[208285 ms] UsbSnoop - MyDispatchInternalIOCTL(f9e0be80) : fdo=815e4d28, Irp=81693728, IRQL=2
[208285 ms]  >>>  URB 54 going down  >>> 
-- URB_FUNCTION_BULK_OR_INTERRUPT_TRANSFER:
  PipeHandle           = 813bfa34 [endpoint 0x00000002]
  TransferFlags        = 00000000 (USBD_TRANSFER_DIRECTION_OUT, ~USBD_SHORT_TRANSFER_OK)
  TransferBufferLength = 00000015
  TransferBuffer       = 00000000
  TransferBufferMDL    = 81702960
    00000000: 00 00 00 10 04 00 00 00 0a 00 01 00 03 00 01 00
    00000010: 00 00 00 07 d0
  UrbLink              = 00000000
[208285 ms] UsbSnoop - MyInternalIOCTLCompletion(f9e0bdb0) : fido=81103020, Irp=81693728, Context=813d60d0, IRQL=2
[208285 ms]  <<<  URB 54 coming back  <<< 
-- URB_FUNCTION_BULK_OR_INTERRUPT_TRANSFER:
  PipeHandle           = 813bfa34 [endpoint 0x00000002]
  TransferFlags        = 00000000 (USBD_TRANSFER_DIRECTION_OUT, ~USBD_SHORT_TRANSFER_OK)
  TransferBufferLength = 00000015
  TransferBuffer       = 00000000
  TransferBufferMDL    = 81702960
  UrbLink              = 00000000
[208294 ms] UsbSnoop - DispatchAny(f9e0a610) : IRP_MJ_INTERNAL_DEVICE_CONTROL
[208294 ms] UsbSnoop - MyDispatchInternalIOCTL(f9e0be80) : fdo=815e4d28, Irp=81693728, IRQL=2
[208294 ms]  >>>  URB 55 going down  >>> 
-- URB_FUNCTION_BULK_OR_INTERRUPT_TRANSFER:
  PipeHandle           = 813bfa14 [endpoint 0x00000081]
  TransferFlags        = 00000003 (USBD_TRANSFER_DIRECTION_IN, USBD_SHORT_TRANSFER_OK)
  TransferBufferLength = 00000100
  TransferBuffer       = 00000000
  TransferBufferMDL    = 81702960
  UrbLink              = 00000000
[208295 ms] UsbSnoop - MyInternalIOCTLCompletion(f9e0bdb0) : fido=81103020, Irp=81693728, Context=81108498, IRQL=2
[208295 ms]  <<<  URB 55 coming back  <<< 
-- URB_FUNCTION_BULK_OR_INTERRUPT_TRANSFER:
  PipeHandle           = 813bfa14 [endpoint 0x00000081]
  TransferFlags        = 00000003 (USBD_TRANSFER_DIRECTION_IN, USBD_SHORT_TRANSFER_OK)
  TransferBufferLength = 00000007
  TransferBuffer       = 00000000
  TransferBufferMDL    = 81702960
    00000000: 00 00 00 02 05 e0 00
  UrbLink              = 00000000
[208334 ms] UsbSnoop - DispatchAny(f9e0a610) : IRP_MJ_INTERNAL_DEVICE_CONTROL
[208334 ms] UsbSnoop - MyDispatchInternalIOCTL(f9e0be80) : fdo=815e4d28, Irp=81693728, IRQL=2
[208334 ms]  >>>  URB 56 going down  >>> 
-- URB_FUNCTION_BULK_OR_INTERRUPT_TRANSFER:
  PipeHandle           = 813bfa14 [endpoint 0x00000081]
  TransferFlags        = 00000003 (USBD_TRANSFER_DIRECTION_IN, USBD_SHORT_TRANSFER_OK)
  TransferBufferLength = 00000100
  TransferBuffer       = 00000000
  TransferBufferMDL    = 81702960
  UrbLink              = 00000000
[208335 ms] UsbSnoop - MyInternalIOCTLCompletion(f9e0bdb0) : fido=81103020, Irp=81693728, Context=816a9250, IRQL=2
[208335 ms]  <<<  URB 56 coming back  <<< 
-- URB_FUNCTION_BULK_OR_INTERRUPT_TRANSFER:
  PipeHandle           = 813bfa14 [endpoint 0x00000081]
  TransferFlags        = 00000003 (USBD_TRANSFER_DIRECTION_IN, USBD_SHORT_TRANSFER_OK)
  TransferBufferLength = 0000000f
  TransferBuffer       = 00000000
  TransferBufferMDL    = 81702960
    00000000: 00 00 00 0a 04 00 00 00 04 00 12 00 00 07 d0
  UrbLink              = 00000000
[208374 ms] UsbSnoop - DispatchAny(f9e0a610) : IRP_MJ_INTERNAL_DEVICE_CONTROL
[208374 ms] UsbSnoop - MyDispatchInternalIOCTL(f9e0be80) : fdo=815e4d28, Irp=81693728, IRQL=2
[208374 ms]  >>>  URB 57 going down  >>> 
-- URB_FUNCTION_BULK_OR_INTERRUPT_TRANSFER:
  PipeHandle           = 813bfa34 [endpoint 0x00000002]
  TransferFlags        = 00000000 (USBD_TRANSFER_DIRECTION_OUT, ~USBD_SHORT_TRANSFER_OK)
  TransferBufferLength = 00000007
  TransferBuffer       = 00000000
  TransferBufferMDL    = 81702960
    00000000: 00 00 00 02 05 e0 00
  UrbLink              = 00000000
[208375 ms] UsbSnoop - MyInternalIOCTLCompletion(f9e0bdb0) : fido=81103020, Irp=81693728, Context=8168ab20, IRQL=2
[208375 ms]  <<<  URB 57 coming back  <<< 
-- URB_FUNCTION_BULK_OR_INTERRUPT_TRANSFER:
  PipeHandle           = 813bfa34 [endpoint 0x00000002]
  TransferFlags        = 00000000 (USBD_TRANSFER_DIRECTION_OUT, ~USBD_SHORT_TRANSFER_OK)
  TransferBufferLength = 00000007
  TransferBuffer       = 00000000
  TransferBufferMDL    = 81702960
  UrbLink              = 00000000
[208384 ms] UsbSnoop - DispatchAny(f9e0a610) : IRP_MJ_INTERNAL_DEVICE_CONTROL
[208384 ms] UsbSnoop - MyDispatchInternalIOCTL(f9e0be80) : fdo=815e4d28, Irp=81693728, IRQL=2
[208384 ms]  >>>  URB 58 going down  >>> 
-- URB_FUNCTION_BULK_OR_INTERRUPT_TRANSFER:
  PipeHandle           = 813bfa34 [endpoint 0x00000002]
  TransferFlags        = 00000000 (USBD_TRANSFER_DIRECTION_OUT, ~USBD_SHORT_TRANSFER_OK)
  TransferBufferLength = 0000000f
  TransferBuffer       = 00000000
  TransferBufferMDL    = 81702960
    00000000: 00 00 00 0a 04 00 00 00 04 00 07 00 01 00 22
  UrbLink              = 00000000
[208385 ms] UsbSnoop - MyInternalIOCTLCompletion(f9e0bdb0) : fido=81103020, Irp=81693728, Context=816a9250, IRQL=2
[208385 ms]  <<<  URB 58 coming back  <<< 
-- URB_FUNCTION_BULK_OR_INTERRUPT_TRANSFER:
  PipeHandle           = 813bfa34 [endpoint 0x00000002]
  TransferFlags        = 00000000 (USBD_TRANSFER_DIRECTION_OUT, ~USBD_SHORT_TRANSFER_OK)
  TransferBufferLength = 0000000f
  TransferBuffer       = 00000000
  TransferBufferMDL    = 81702960
  UrbLink              = 00000000
[208394 ms] UsbSnoop - DispatchAny(f9e0a610) : IRP_MJ_INTERNAL_DEVICE_CONTROL
[208394 ms] UsbSnoop - MyDispatchInternalIOCTL(f9e0be80) : fdo=815e4d28, Irp=81693728, IRQL=2
[208394 ms]  >>>  URB 59 going down  >>> 
-- URB_FUNCTION_BULK_OR_INTERRUPT_TRANSFER:
  PipeHandle           = 813bfa14 [endpoint 0x00000081]
  TransferFlags        = 00000003 (USBD_TRANSFER_DIRECTION_IN, USBD_SHORT_TRANSFER_OK)
  TransferBufferLength = 00000100
  TransferBuffer       = 00000000
  TransferBufferMDL    = 81702960
  UrbLink              = 00000000
[208411 ms] UsbSnoop - MyInternalIOCTLCompletion(f9e0bdb0) : fido=81103020, Irp=81693728, Context=81422700, IRQL=2
[208411 ms]  <<<  URB 59 coming back  <<< 
-- URB_FUNCTION_BULK_OR_INTERRUPT_TRANSFER:
  PipeHandle           = 813bfa14 [endpoint 0x00000081]
  TransferFlags        = 00000003 (USBD_TRANSFER_DIRECTION_IN, USBD_SHORT_TRANSFER_OK)
  TransferBufferLength = 00000007
  TransferBuffer       = 00000000
  TransferBufferMDL    = 81702960
    00000000: 00 00 00 02 05 e0 00
  UrbLink              = 00000000
[208444 ms] UsbSnoop - DispatchAny(f9e0a610) : IRP_MJ_INTERNAL_DEVICE_CONTROL
[208444 ms] UsbSnoop - MyDispatchInternalIOCTL(f9e0be80) : fdo=815e4d28, Irp=81693728, IRQL=2
[208444 ms]  >>>  URB 60 going down  >>> 
-- URB_FUNCTION_BULK_OR_INTERRUPT_TRANSFER:
  PipeHandle           = 813bfa14 [endpoint 0x00000081]
  TransferFlags        = 00000003 (USBD_TRANSFER_DIRECTION_IN, USBD_SHORT_TRANSFER_OK)
  TransferBufferLength = 00000100
  TransferBuffer       = 00000000
  TransferBufferMDL    = 81702960
  UrbLink              = 00000000
[208445 ms] UsbSnoop - MyInternalIOCTLCompletion(f9e0bdb0) : fido=81103020, Irp=81693728, Context=8168ab20, IRQL=2
[208445 ms]  <<<  URB 60 coming back  <<< 
-- URB_FUNCTION_BULK_OR_INTERRUPT_TRANSFER:
  PipeHandle           = 813bfa14 [endpoint 0x00000081]
  TransferFlags        = 00000003 (USBD_TRANSFER_DIRECTION_IN, USBD_SHORT_TRANSFER_OK)
  TransferBufferLength = 0000000f
  TransferBuffer       = 00000000
  TransferBufferMDL    = 81702960
    00000000: 00 00 00 0a 04 00 00 00 04 bb 00 00 01 d4 c0
  UrbLink              = 00000000
[208484 ms] UsbSnoop - DispatchAny(f9e0a610) : IRP_MJ_INTERNAL_DEVICE_CONTROL
[208484 ms] UsbSnoop - MyDispatchInternalIOCTL(f9e0be80) : fdo=815e4d28, Irp=81693728, IRQL=2
[208484 ms]  >>>  URB 61 going down  >>> 
-- URB_FUNCTION_BULK_OR_INTERRUPT_TRANSFER:
  PipeHandle           = 813bfa34 [endpoint 0x00000002]
  TransferFlags        = 00000000 (USBD_TRANSFER_DIRECTION_OUT, ~USBD_SHORT_TRANSFER_OK)
  TransferBufferLength = 00000007
  TransferBuffer       = 00000000
  TransferBufferMDL    = 81702960
    00000000: 00 00 00 02 05 e0 00
  UrbLink              = 00000000
[208485 ms] UsbSnoop - MyInternalIOCTLCompletion(f9e0bdb0) : fido=81103020, Irp=81693728, Context=81108498, IRQL=2
[208485 ms]  <<<  URB 61 coming back  <<< 
-- URB_FUNCTION_BULK_OR_INTERRUPT_TRANSFER:
  PipeHandle           = 813bfa34 [endpoint 0x00000002]
  TransferFlags        = 00000000 (USBD_TRANSFER_DIRECTION_OUT, ~USBD_SHORT_TRANSFER_OK)
  TransferBufferLength = 00000007
  TransferBuffer       = 00000000
  TransferBufferMDL    = 81702960
  UrbLink              = 00000000
[208494 ms] UsbSnoop - DispatchAny(f9e0a610) : IRP_MJ_INTERNAL_DEVICE_CONTROL
[208494 ms] UsbSnoop - MyDispatchInternalIOCTL(f9e0be80) : fdo=815e4d28, Irp=81693728, IRQL=2
[208494 ms]  >>>  URB 62 going down  >>> 
-- URB_FUNCTION_BULK_OR_INTERRUPT_TRANSFER:
  PipeHandle           = 813bfa14 [endpoint 0x00000081]
  TransferFlags        = 00000003 (USBD_TRANSFER_DIRECTION_IN, USBD_SHORT_TRANSFER_OK)
  TransferBufferLength = 00000100
  TransferBuffer       = 00000000
  TransferBufferMDL    = 81702960
  UrbLink              = 00000000
[208559 ms] UsbSnoop - MyInternalIOCTLCompletion(f9e0bdb0) : fido=81103020, Irp=81693728, Context=81422700, IRQL=2
[208559 ms]  <<<  URB 62 coming back  <<< 
-- URB_FUNCTION_BULK_OR_INTERRUPT_TRANSFER:
  PipeHandle           = 813bfa14 [endpoint 0x00000081]
  TransferFlags        = 00000003 (USBD_TRANSFER_DIRECTION_IN, USBD_SHORT_TRANSFER_OK)
  TransferBufferLength = 000000ff
  TransferBuffer       = 00000000
  TransferBufferMDL    = 81702960
    00000000: 00 00 00 fa 03 00 00 03 07 00 08 00 01 00 22 00
    00000010: 03 00 f8 00 00 00 00 00 00 00 00 00 00 00 f8 00
    00000020: 00 00 00 00 00 00 00 00 00 00 f8 00 00 00 00 00
    00000030: 00 00 00 00 00 00 f8 00 00 00 00 00 00 00 00 00
    00000040: 00 00 f8 00 00 00 00 00 00 00 00 00 00 00 f8 00
    00000050: 00 00 00 00 00 00 00 00 00 00 f8 00 00 00 00 00
    00000060: 00 00 00 00 00 00 00 00 00 00 00 00 00 00 00 00
    00000070: 00 00 00 00 00 00 00 00 00 00 00 00 00 00 00 00
    00000080: 00 00 00 00 00 00 00 00 00 00 00 00 00 00 00 00
    00000090: 00 00 00 00 00 00 00 00 00 00 00 00 00 00 00 00
    000000a0: 00 00 00 00 00 00 00 00 00 00 00 00 00 00 00 00
    000000b0: 00 00 00 00 00 00 00 00 00 00 00 00 00 00 00 00
    000000c0: 00 00 00 00 00 00 00 00 00 00 00 00 00 00 00 00
    000000d0: 00 00 00 00 00 00 00 00 00 00 00 00 00 00 00 00
    000000e0: 00 00 00 00 00 00 00 00 00 00 00 00 00 00 00 00
    000000f0: 00 00 00 00 00 00 00 00 00 00 00 00 00 00 00
  UrbLink              = 00000000
[209950 ms] UsbSnoop - DispatchAny(f9e0a610) : IRP_MJ_INTERNAL_DEVICE_CONTROL
[209950 ms] UsbSnoop - MyDispatchInternalIOCTL(f9e0be80) : fdo=815e4d28, Irp=81101228, IRQL=2
[209950 ms]  >>>  URB 63 going down  >>> 
-- URB_FUNCTION_BULK_OR_INTERRUPT_TRANSFER:
  PipeHandle           = 813bfa34 [endpoint 0x00000002]
  TransferFlags        = 00000000 (USBD_TRANSFER_DIRECTION_OUT, ~USBD_SHORT_TRANSFER_OK)
  TransferBufferLength = 00000007
  TransferBuffer       = 00000000
  TransferBufferMDL    = 81702960
    00000000: 00 00 00 02 05 e0 00
  UrbLink              = 00000000
[209951 ms] UsbSnoop - MyInternalIOCTLCompletion(f9e0bdb0) : fido=81103020, Irp=81101228, Context=816a9338, IRQL=2
[209951 ms]  <<<  URB 63 coming back  <<< 
-- URB_FUNCTION_BULK_OR_INTERRUPT_TRANSFER:
  PipeHandle           = 813bfa34 [endpoint 0x00000002]
  TransferFlags        = 00000000 (USBD_TRANSFER_DIRECTION_OUT, ~USBD_SHORT_TRANSFER_OK)
  TransferBufferLength = 00000007
  TransferBuffer       = 00000000
  TransferBufferMDL    = 81702960
  UrbLink              = 00000000
[209957 ms] UsbSnoop - DispatchAny(f9e0a610) : IRP_MJ_INTERNAL_DEVICE_CONTROL
[209957 ms] UsbSnoop - MyDispatchInternalIOCTL(f9e0be80) : fdo=815e4d28, Irp=81101228, IRQL=2
[209957 ms]  >>>  URB 64 going down  >>> 
-- URB_FUNCTION_BULK_OR_INTERRUPT_TRANSFER:
  PipeHandle           = 813bfa14 [endpoint 0x00000081]
  TransferFlags        = 00000003 (USBD_TRANSFER_DIRECTION_IN, USBD_SHORT_TRANSFER_OK)
  TransferBufferLength = 00000100
  TransferBuffer       = 00000000
  TransferBufferMDL    = 81702960
  UrbLink              = 00000000
[209968 ms] UsbSnoop - MyInternalIOCTLCompletion(f9e0bdb0) : fido=81103020, Irp=81101228, Context=8168ab20, IRQL=2
[209968 ms]  <<<  URB 64 coming back  <<< 
-- URB_FUNCTION_BULK_OR_INTERRUPT_TRANSFER:
  PipeHandle           = 813bfa14 [endpoint 0x00000081]
  TransferFlags        = 00000003 (USBD_TRANSFER_DIRECTION_IN, USBD_SHORT_TRANSFER_OK)
  TransferBufferLength = 000000ff
  TransferBuffer       = 00000000
  TransferBufferMDL    = 81702960
    00000000: 00 00 00 fa 03 00 00 00 00 00 00 00 00 00 00 00
    00000010: 00 00 00 00 00 00 00 00 00 00 00 00 00 00 00 00
    00000020: 00 00 00 00 00 00 00 00 00 00 00 00 00 00 00 00
    00000030: 00 00 00 00 00 00 00 00 00 00 00 00 00 00 00 00
    00000040: 00 00 00 00 00 00 00 00 00 00 00 00 00 00 00 00
    00000050: 00 00 00 00 00 00 00 00 00 00 00 00 00 00 00 00
    00000060: 00 00 00 00 00 00 00 00 00 00 00 00 00 00 00 00
    00000070: 00 00 00 00 00 00 00 00 00 00 00 00 00 00 00 00
    00000080: 00 00 00 00 00 00 00 00 00 00 00 00 00 00 00 00
    00000090: 00 00 00 00 00 00 00 00 00 00 00 00 00 00 00 00
    000000a0: 00 00 00 00 00 00 00 00 00 00 00 00 00 00 00 00
    000000b0: 00 00 00 00 00 00 00 00 00 00 00 00 00 00 00 00
    000000c0: 00 00 00 00 00 00 00 00 00 00 00 00 00 00 00 00
    000000d0: 00 00 00 00 00 00 00 00 00 00 00 00 00 00 00 00
    000000e0: 00 00 00 00 00 00 00 00 00 00 00 00 00 00 00 00
    000000f0: 00 00 00 00 00 00 00 00 00 00 00 00 00 00 00
  UrbLink              = 00000000
[210007 ms] UsbSnoop - DispatchAny(f9e0a610) : IRP_MJ_INTERNAL_DEVICE_CONTROL
[210007 ms] UsbSnoop - MyDispatchInternalIOCTL(f9e0be80) : fdo=815e4d28, Irp=81101228, IRQL=2
[210007 ms]  >>>  URB 65 going down  >>> 
-- URB_FUNCTION_BULK_OR_INTERRUPT_TRANSFER:
  PipeHandle           = 813bfa34 [endpoint 0x00000002]
  TransferFlags        = 00000000 (USBD_TRANSFER_DIRECTION_OUT, ~USBD_SHORT_TRANSFER_OK)
  TransferBufferLength = 00000007
  TransferBuffer       = 00000000
  TransferBufferMDL    = 81702960
    00000000: 00 00 00 02 05 e0 00
  UrbLink              = 00000000
[210008 ms] UsbSnoop - MyInternalIOCTLCompletion(f9e0bdb0) : fido=81103020, Irp=81101228, Context=813d60d0, IRQL=2
[210008 ms]  <<<  URB 65 coming back  <<< 
-- URB_FUNCTION_BULK_OR_INTERRUPT_TRANSFER:
  PipeHandle           = 813bfa34 [endpoint 0x00000002]
  TransferFlags        = 00000000 (USBD_TRANSFER_DIRECTION_OUT, ~USBD_SHORT_TRANSFER_OK)
  TransferBufferLength = 00000007
  TransferBuffer       = 00000000
  TransferBufferMDL    = 81702960
  UrbLink              = 00000000
[210017 ms] UsbSnoop - DispatchAny(f9e0a610) : IRP_MJ_INTERNAL_DEVICE_CONTROL
[210017 ms] UsbSnoop - MyDispatchInternalIOCTL(f9e0be80) : fdo=815e4d28, Irp=81101228, IRQL=2
[210017 ms]  >>>  URB 66 going down  >>> 
-- URB_FUNCTION_BULK_OR_INTERRUPT_TRANSFER:
  PipeHandle           = 813bfa14 [endpoint 0x00000081]
  TransferFlags        = 00000003 (USBD_TRANSFER_DIRECTION_IN, USBD_SHORT_TRANSFER_OK)
  TransferBufferLength = 00000100
  TransferBuffer       = 00000000
  TransferBufferMDL    = 81702960
  UrbLink              = 00000000
[210025 ms] UsbSnoop - MyInternalIOCTLCompletion(f9e0bdb0) : fido=81103020, Irp=81101228, Context=8168ab20, IRQL=2
[210025 ms]  <<<  URB 66 coming back  <<< 
-- URB_FUNCTION_BULK_OR_INTERRUPT_TRANSFER:
  PipeHandle           = 813bfa14 [endpoint 0x00000081]
  TransferFlags        = 00000003 (USBD_TRANSFER_DIRECTION_IN, USBD_SHORT_TRANSFER_OK)
  TransferBufferLength = 000000ff
  TransferBuffer       = 00000000
  TransferBufferMDL    = 81702960
    00000000: 00 00 00 fa 03 00 00 00 00 00 00 00 00 00 00 00
    00000010: 00 00 00 00 00 00 00 00 00 00 00 00 00 00 00 00
    00000020: 00 00 00 00 00 00 00 00 00 00 00 00 00 00 00 00
    00000030: 00 00 00 00 00 00 00 00 00 00 00 00 00 00 00 00
    00000040: 00 00 00 00 00 00 00 00 00 00 00 00 00 00 00 00
    00000050: 00 00 00 00 00 00 00 00 00 00 00 00 00 00 00 00
    00000060: 00 00 00 00 00 00 00 00 00 00 00 00 00 00 00 00
    00000070: 00 00 00 00 00 00 00 00 00 00 00 00 00 00 00 00
    00000080: 00 00 00 00 00 00 00 00 00 00 00 00 00 00 00 00
    00000090: 00 00 00 00 00 00 00 00 00 00 00 00 00 00 00 00
    000000a0: 00 00 00 00 00 00 00 00 00 00 00 00 00 00 00 00
    000000b0: 00 00 00 00 00 00 00 00 00 00 00 00 00 00 00 00
    000000c0: 00 00 00 00 00 00 00 00 00 00 00 00 00 00 00 00
    000000d0: 00 00 00 00 00 00 00 00 00 00 00 00 00 00 00 00
    000000e0: 00 00 00 00 00 00 00 00 00 00 00 00 00 00 00 00
    000000f0: 00 00 00 00 00 00 00 00 00 00 00 00 00 00 00
  UrbLink              = 00000000
[210057 ms] UsbSnoop - DispatchAny(f9e0a610) : IRP_MJ_INTERNAL_DEVICE_CONTROL
[210057 ms] UsbSnoop - MyDispatchInternalIOCTL(f9e0be80) : fdo=815e4d28, Irp=81101228, IRQL=2
[210057 ms]  >>>  URB 67 going down  >>> 
-- URB_FUNCTION_BULK_OR_INTERRUPT_TRANSFER:
  PipeHandle           = 813bfa34 [endpoint 0x00000002]
  TransferFlags        = 00000000 (USBD_TRANSFER_DIRECTION_OUT, ~USBD_SHORT_TRANSFER_OK)
  TransferBufferLength = 00000007
  TransferBuffer       = 00000000
  TransferBufferMDL    = 81702960
    00000000: 00 00 00 02 05 e0 00
  UrbLink              = 00000000
[210058 ms] UsbSnoop - MyInternalIOCTLCompletion(f9e0bdb0) : fido=81103020, Irp=81101228, Context=816763c0, IRQL=2
[210058 ms]  <<<  URB 67 coming back  <<< 
-- URB_FUNCTION_BULK_OR_INTERRUPT_TRANSFER:
  PipeHandle           = 813bfa34 [endpoint 0x00000002]
  TransferFlags        = 00000000 (USBD_TRANSFER_DIRECTION_OUT, ~USBD_SHORT_TRANSFER_OK)
  TransferBufferLength = 00000007
  TransferBuffer       = 00000000
  TransferBufferMDL    = 81702960
  UrbLink              = 00000000
[210067 ms] UsbSnoop - DispatchAny(f9e0a610) : IRP_MJ_INTERNAL_DEVICE_CONTROL
[210067 ms] UsbSnoop - MyDispatchInternalIOCTL(f9e0be80) : fdo=815e4d28, Irp=81101228, IRQL=2
[210067 ms]  >>>  URB 68 going down  >>> 
-- URB_FUNCTION_BULK_OR_INTERRUPT_TRANSFER:
  PipeHandle           = 813bfa14 [endpoint 0x00000081]
  TransferFlags        = 00000003 (USBD_TRANSFER_DIRECTION_IN, USBD_SHORT_TRANSFER_OK)
  TransferBufferLength = 00000100
  TransferBuffer       = 00000000
  TransferBufferMDL    = 81702960
  UrbLink              = 00000000
[210068 ms] UsbSnoop - MyInternalIOCTLCompletion(f9e0bdb0) : fido=81103020, Irp=81101228, Context=8168ab20, IRQL=2
[210068 ms]  <<<  URB 68 coming back  <<< 
-- URB_FUNCTION_BULK_OR_INTERRUPT_TRANSFER:
  PipeHandle           = 813bfa14 [endpoint 0x00000081]
  TransferFlags        = 00000003 (USBD_TRANSFER_DIRECTION_IN, USBD_SHORT_TRANSFER_OK)
  TransferBufferLength = 00000024
  TransferBuffer       = 00000000
  TransferBufferMDL    = 81702960
    00000000: 00 00 00 1f 04 00 00 00 00 00 00 00 00 00 00 00
    00000010: 00 00 00 00 00 00 00 00 00 00 00 00 00 00 00 00
    00000020: 00 00 00 00
  UrbLink              = 00000000
[210107 ms] UsbSnoop - DispatchAny(f9e0a610) : IRP_MJ_INTERNAL_DEVICE_CONTROL
[210107 ms] UsbSnoop - MyDispatchInternalIOCTL(f9e0be80) : fdo=815e4d28, Irp=81101228, IRQL=2
[210107 ms]  >>>  URB 69 going down  >>> 
-- URB_FUNCTION_BULK_OR_INTERRUPT_TRANSFER:
  PipeHandle           = 813bfa34 [endpoint 0x00000002]
  TransferFlags        = 00000000 (USBD_TRANSFER_DIRECTION_OUT, ~USBD_SHORT_TRANSFER_OK)
  TransferBufferLength = 00000007
  TransferBuffer       = 00000000
  TransferBufferMDL    = 81702960
    00000000: 00 00 00 02 05 e0 00
  UrbLink              = 00000000
[210108 ms] UsbSnoop - MyInternalIOCTLCompletion(f9e0bdb0) : fido=81103020, Irp=81101228, Context=813d60d0, IRQL=2
[210108 ms]  <<<  URB 69 coming back  <<< 
-- URB_FUNCTION_BULK_OR_INTERRUPT_TRANSFER:
  PipeHandle           = 813bfa34 [endpoint 0x00000002]
  TransferFlags        = 00000000 (USBD_TRANSFER_DIRECTION_OUT, ~USBD_SHORT_TRANSFER_OK)
  TransferBufferLength = 00000007
  TransferBuffer       = 00000000
  TransferBufferMDL    = 81702960
  UrbLink              = 00000000
[210214 ms] UsbSnoop - DispatchAny(f9e0a610) : IRP_MJ_INTERNAL_DEVICE_CONTROL
[210214 ms] UsbSnoop - MyDispatchInternalIOCTL(f9e0be80) : fdo=815e4d28, Irp=813c8760, IRQL=0
[210214 ms]  >>>  URB 70 going down  >>> 
-- URB_FUNCTION_RESET_PIPE:
  PipeHandle = 813bfa14 [endpoint 0x00000081]
[210216 ms] UsbSnoop - MyInternalIOCTLCompletion(f9e0bdb0) : fido=00000000, Irp=813c8760, Context=8168ab20, IRQL=0
[210216 ms]  <<<  URB 70 coming back  <<< 
-- URB_FUNCTION_RESET_PIPE:
[210216 ms] UsbSnoop - DispatchAny(f9e0a610) : IRP_MJ_INTERNAL_DEVICE_CONTROL
[210216 ms] UsbSnoop - MyDispatchInternalIOCTL(f9e0be80) : fdo=815e4d28, Irp=813c8760, IRQL=0
[210216 ms]  >>>  URB 71 going down  >>> 
-- URB_FUNCTION_RESET_PIPE:
  PipeHandle = 813bfa34 [endpoint 0x00000002]
[210225 ms] UsbSnoop - MyInternalIOCTLCompletion(f9e0bdb0) : fido=00000000, Irp=813c8760, Context=813d60d0, IRQL=0
[210225 ms]  <<<  URB 71 coming back  <<< 
-- URB_FUNCTION_RESET_PIPE:
[210225 ms] UsbSnoop - DispatchAny(f9e0a610) : IRP_MJ_INTERNAL_DEVICE_CONTROL
[210225 ms] UsbSnoop - MyDispatchInternalIOCTL(f9e0be80) : fdo=815e4d28, Irp=8143e848, IRQL=0
