[821578 ms] UsbSnoop - DispatchAny(f88fe610) : IRP_MJ_INTERNAL_DEVICE_CONTROL
[821578 ms] UsbSnoop - MyDispatchInternalIOCTL(f88ffe80) : fdo=82141030, Irp=81b34008, IRQL=0
[821578 ms]  >>>  URB 697 going down  >>> 
-- URB_FUNCTION_RESET_PIPE:
  PipeHandle = 81b38414 [endpoint 0x00000081]
[821578 ms] UsbSnoop - MyInternalIOCTLCompletion(f88ffdb0) : fido=00000000, Irp=81b34008, Context=81b6c560, IRQL=0
[821578 ms]  <<<  URB 697 coming back  <<< 
-- URB_FUNCTION_RESET_PIPE:
[821578 ms] UsbSnoop - DispatchAny(f88fe610) : IRP_MJ_INTERNAL_DEVICE_CONTROL
[821578 ms] UsbSnoop - MyDispatchInternalIOCTL(f88ffe80) : fdo=82141030, Irp=81b34008, IRQL=0
[821578 ms]  >>>  URB 698 going down  >>> 
-- URB_FUNCTION_RESET_PIPE:
  PipeHandle = 81b38434 [endpoint 0x00000002]
[821587 ms] UsbSnoop - MyInternalIOCTLCompletion(f88ffdb0) : fido=00000000, Irp=81b34008, Context=81bb3370, IRQL=0
[821587 ms]  <<<  URB 698 coming back  <<< 
-- URB_FUNCTION_RESET_PIPE:
[822579 ms] UsbSnoop - DispatchAny(f88fe610) : IRP_MJ_INTERNAL_DEVICE_CONTROL
[822579 ms] UsbSnoop - MyDispatchInternalIOCTL(f88ffe80) : fdo=82141030, Irp=81b34008, IRQL=0
[822579 ms]  >>>  URB 699 going down  >>> 
-- URB_FUNCTION_RESET_PIPE:
  PipeHandle = 81b38414 [endpoint 0x00000081]
[822580 ms] UsbSnoop - MyInternalIOCTLCompletion(f88ffdb0) : fido=00000000, Irp=81b34008, Context=81bb3370, IRQL=0
[822580 ms]  <<<  URB 699 coming back  <<< 
-- URB_FUNCTION_RESET_PIPE:
[822580 ms] UsbSnoop - DispatchAny(f88fe610) : IRP_MJ_INTERNAL_DEVICE_CONTROL
[822580 ms] UsbSnoop - MyDispatchInternalIOCTL(f88ffe80) : fdo=82141030, Irp=81b34008, IRQL=0
[822580 ms]  >>>  URB 700 going down  >>> 
-- URB_FUNCTION_RESET_PIPE:
  PipeHandle = 81b38434 [endpoint 0x00000002]
[822580 ms] UsbSnoop - MyInternalIOCTLCompletion(f88ffdb0) : fido=00000000, Irp=81b34008, Context=81b21168, IRQL=0
[822580 ms]  <<<  URB 700 coming back  <<< 
-- URB_FUNCTION_RESET_PIPE:
[822580 ms] UsbSnoop - DispatchAny(f88fe610) : IRP_MJ_INTERNAL_DEVICE_CONTROL
[822580 ms] UsbSnoop - MyDispatchInternalIOCTL(f88ffe80) : fdo=82141030, Irp=81b34008, IRQL=0
[823581 ms] UsbSnoop - DispatchAny(f88fe610) : IRP_MJ_INTERNAL_DEVICE_CONTROL
[823581 ms] UsbSnoop - MyDispatchInternalIOCTL(f88ffe80) : fdo=82141030, Irp=81b34008, IRQL=0
[823581 ms]  >>>  URB 701 going down  >>> 
-- URB_FUNCTION_GET_DESCRIPTOR_FROM_DEVICE:
  TransferBufferLength = 00000012
  TransferBuffer       = e26cc898
  TransferBufferMDL    = 00000000
  Index                = 00000000
  DescriptorType       = 00000001 (USB_DEVICE_DESCRIPTOR_TYPE)
  LanguageId           = 00000000
[823582 ms] UsbSnoop - MyInternalIOCTLCompletion(f88ffdb0) : fido=00000000, Irp=81b34008, Context=81b99358, IRQL=2
[823582 ms]  <<<  URB 701 coming back  <<< 
-- URB_FUNCTION_CONTROL_TRANSFER:
  PipeHandle           = 82184a90
  TransferFlags        = 81b3400b (USBD_TRANSFER_DIRECTION_IN, USBD_SHORT_TRANSFER_OK)
  TransferBufferLength = 00000012
  TransferBuffer       = e26cc898
  TransferBufferMDL    = 822f8658
    00000000: 12 01 00 02 00 00 00 40 51 04 08 e0 10 01 01 02
    00000010: 00 01
  UrbLink              = 00000000
  SetupPacket          =
    00000000: 80 06 00 01 00 00 12 00
[823582 ms] UsbSnoop - DispatchAny(f88fe610) : IRP_MJ_INTERNAL_DEVICE_CONTROL
[823582 ms] UsbSnoop - MyDispatchInternalIOCTL(f88ffe80) : fdo=82141030, Irp=81b34008, IRQL=0
[823582 ms] UsbSnoop - DispatchAny(f88fe610) : IRP_MJ_INTERNAL_DEVICE_CONTROL
[823582 ms] UsbSnoop - MyDispatchInternalIOCTL(f88ffe80) : fdo=82141030, Irp=81b34008, IRQL=0
[823582 ms]  >>>  URB 702 going down  >>> 
-- URB_FUNCTION_RESET_PIPE:
  PipeHandle = 81b38414 [endpoint 0x00000081]
[823583 ms] UsbSnoop - MyInternalIOCTLCompletion(f88ffdb0) : fido=00000000, Irp=81b34008, Context=81c35588, IRQL=0
[823583 ms]  <<<  URB 702 coming back  <<< 
-- URB_FUNCTION_RESET_PIPE:
[823583 ms] UsbSnoop - DispatchAny(f88fe610) : IRP_MJ_INTERNAL_DEVICE_CONTROL
[823583 ms] UsbSnoop - MyDispatchInternalIOCTL(f88ffe80) : fdo=82141030, Irp=81b34008, IRQL=0
[823583 ms]  >>>  URB 703 going down  >>> 
-- URB_FUNCTION_RESET_PIPE:
  PipeHandle = 81b38434 [endpoint 0x00000002]
[823591 ms] UsbSnoop - MyInternalIOCTLCompletion(f88ffdb0) : fido=00000000, Irp=81b34008, Context=81bb3370, IRQL=0
[823591 ms]  <<<  URB 703 coming back  <<< 
-- URB_FUNCTION_RESET_PIPE:
[824863 ms] UsbSnoop - DispatchAny(f88fe610) : IRP_MJ_INTERNAL_DEVICE_CONTROL
[824863 ms] UsbSnoop - MyDispatchInternalIOCTL(f88ffe80) : fdo=82141030, Irp=81b53008, IRQL=2
[824863 ms]  >>>  URB 704 going down  >>> 
-- URB_FUNCTION_BULK_OR_INTERRUPT_TRANSFER:
  PipeHandle           = 81b38434 [endpoint 0x00000002]
  TransferFlags        = 00000000 (USBD_TRANSFER_DIRECTION_OUT, ~USBD_SHORT_TRANSFER_OK)
  TransferBufferLength = 00000009
  TransferBuffer       = 00000000
  TransferBufferMDL    = 822f8658
    00000000: 00 00 00 04 01 00 00 04 00
  UrbLink              = 00000000
[824863 ms] UsbSnoop - MyInternalIOCTLCompletion(f88ffdb0) : fido=81b37020, Irp=81b53008, Context=81bbb438, IRQL=2
[824863 ms]  <<<  URB 704 coming back  <<< 
-- URB_FUNCTION_BULK_OR_INTERRUPT_TRANSFER:
  PipeHandle           = 81b38434 [endpoint 0x00000002]
  TransferFlags        = 00000000 (USBD_TRANSFER_DIRECTION_OUT, ~USBD_SHORT_TRANSFER_OK)
  TransferBufferLength = 00000009
  TransferBuffer       = 00000000
  TransferBufferMDL    = 822f8658
  UrbLink              = 00000000
[824863 ms] UsbSnoop - DispatchAny(f88fe610) : IRP_MJ_INTERNAL_DEVICE_CONTROL
[824863 ms] UsbSnoop - MyDispatchInternalIOCTL(f88ffe80) : fdo=82141030, Irp=81b53008, IRQL=2
[824863 ms]  >>>  URB 705 going down  >>> 
-- URB_FUNCTION_BULK_OR_INTERRUPT_TRANSFER:
  PipeHandle           = 81b38414 [endpoint 0x00000081]
  TransferFlags        = 00000003 (USBD_TRANSFER_DIRECTION_IN, USBD_SHORT_TRANSFER_OK)
  TransferBufferLength = 00000100
  TransferBuffer       = 00000000
  TransferBufferMDL    = 822f8658
  UrbLink              = 00000000
[824876 ms] UsbSnoop - MyInternalIOCTLCompletion(f88ffdb0) : fido=81b37020, Irp=81b53008, Context=822f4330, IRQL=2
[824876 ms]  <<<  URB 705 coming back  <<< 
-- URB_FUNCTION_BULK_OR_INTERRUPT_TRANSFER:
  PipeHandle           = 81b38414 [endpoint 0x00000081]
  TransferFlags        = 00000003 (USBD_TRANSFER_DIRECTION_IN, USBD_SHORT_TRANSFER_OK)
  TransferBufferLength = 00000009
  TransferBuffer       = 00000000
  TransferBufferMDL    = 822f8658
    00000000: 00 00 00 04 02 00 00 00 fa
  UrbLink              = 00000000
[824904 ms] UsbSnoop - DispatchAny(f88fe610) : IRP_MJ_INTERNAL_DEVICE_CONTROL
[824904 ms] UsbSnoop - MyDispatchInternalIOCTL(f88ffe80) : fdo=82141030, Irp=81b53008, IRQL=2
[824904 ms]  >>>  URB 706 going down  >>> 
-- URB_FUNCTION_BULK_OR_INTERRUPT_TRANSFER:
  PipeHandle           = 81b38434 [endpoint 0x00000002]
  TransferFlags        = 00000000 (USBD_TRANSFER_DIRECTION_OUT, ~USBD_SHORT_TRANSFER_OK)
  TransferBufferLength = 00000015
  TransferBuffer       = 00000000
  TransferBufferMDL    = 822f8658
    00000000: 00 00 00 10 04 00 00 00 0a 00 01 00 03 00 01 00
    00000010: 00 00 00 07 d0
  UrbLink              = 00000000
[824904 ms] UsbSnoop - MyInternalIOCTLCompletion(f88ffdb0) : fido=81b37020, Irp=81b53008, Context=81b21168, IRQL=2
[824904 ms]  <<<  URB 706 coming back  <<< 
-- URB_FUNCTION_BULK_OR_INTERRUPT_TRANSFER:
  PipeHandle           = 81b38434 [endpoint 0x00000002]
  TransferFlags        = 00000000 (USBD_TRANSFER_DIRECTION_OUT, ~USBD_SHORT_TRANSFER_OK)
  TransferBufferLength = 00000015
  TransferBuffer       = 00000000
  TransferBufferMDL    = 822f8658
  UrbLink              = 00000000
[824913 ms] UsbSnoop - DispatchAny(f88fe610) : IRP_MJ_INTERNAL_DEVICE_CONTROL
[824913 ms] UsbSnoop - MyDispatchInternalIOCTL(f88ffe80) : fdo=82141030, Irp=81b53008, IRQL=2
[824913 ms]  >>>  URB 707 going down  >>> 
-- URB_FUNCTION_BULK_OR_INTERRUPT_TRANSFER:
  PipeHandle           = 81b38414 [endpoint 0x00000081]
  TransferFlags        = 00000003 (USBD_TRANSFER_DIRECTION_IN, USBD_SHORT_TRANSFER_OK)
  TransferBufferLength = 00000100
  TransferBuffer       = 00000000
  TransferBufferMDL    = 822f8658
  UrbLink              = 00000000
[824913 ms] UsbSnoop - MyInternalIOCTLCompletion(f88ffdb0) : fido=81b37020, Irp=81b53008, Context=822f4330, IRQL=2
[824913 ms]  <<<  URB 707 coming back  <<< 
-- URB_FUNCTION_BULK_OR_INTERRUPT_TRANSFER:
  PipeHandle           = 81b38414 [endpoint 0x00000081]
  TransferFlags        = 00000003 (USBD_TRANSFER_DIRECTION_IN, USBD_SHORT_TRANSFER_OK)
  TransferBufferLength = 00000007
  TransferBuffer       = 00000000
  TransferBufferMDL    = 822f8658
    00000000: 00 00 00 02 05 e0 00
  UrbLink              = 00000000
[824953 ms] UsbSnoop - DispatchAny(f88fe610) : IRP_MJ_INTERNAL_DEVICE_CONTROL
[824953 ms] UsbSnoop - MyDispatchInternalIOCTL(f88ffe80) : fdo=82141030, Irp=81b53008, IRQL=2
[824953 ms]  >>>  URB 708 going down  >>> 
-- URB_FUNCTION_BULK_OR_INTERRUPT_TRANSFER:
  PipeHandle           = 81b38414 [endpoint 0x00000081]
  TransferFlags        = 00000003 (USBD_TRANSFER_DIRECTION_IN, USBD_SHORT_TRANSFER_OK)
  TransferBufferLength = 00000100
  TransferBuffer       = 00000000
  TransferBufferMDL    = 822f8658
  UrbLink              = 00000000
[824953 ms] UsbSnoop - MyInternalIOCTLCompletion(f88ffdb0) : fido=81b37020, Irp=81b53008, Context=81b22ea8, IRQL=2
[824953 ms]  <<<  URB 708 coming back  <<< 
-- URB_FUNCTION_BULK_OR_INTERRUPT_TRANSFER:
  PipeHandle           = 81b38414 [endpoint 0x00000081]
  TransferFlags        = 00000003 (USBD_TRANSFER_DIRECTION_IN, USBD_SHORT_TRANSFER_OK)
  TransferBufferLength = 0000000f
  TransferBuffer       = 00000000
  TransferBufferMDL    = 822f8658
    00000000: 00 00 00 0a 04 00 00 00 04 00 12 00 00 07 d0
  UrbLink              = 00000000
[824993 ms] UsbSnoop - DispatchAny(f88fe610) : IRP_MJ_INTERNAL_DEVICE_CONTROL
[824993 ms] UsbSnoop - MyDispatchInternalIOCTL(f88ffe80) : fdo=82141030, Irp=81b53008, IRQL=2
[824993 ms]  >>>  URB 709 going down  >>> 
-- URB_FUNCTION_BULK_OR_INTERRUPT_TRANSFER:
  PipeHandle           = 81b38434 [endpoint 0x00000002]
  TransferFlags        = 00000000 (USBD_TRANSFER_DIRECTION_OUT, ~USBD_SHORT_TRANSFER_OK)
  TransferBufferLength = 00000007
  TransferBuffer       = 00000000
  TransferBufferMDL    = 822f8658
    00000000: 00 00 00 02 05 e0 00
  UrbLink              = 00000000
[824993 ms] UsbSnoop - MyInternalIOCTLCompletion(f88ffdb0) : fido=81b37020, Irp=81b53008, Context=81ba5340, IRQL=2
[824993 ms]  <<<  URB 709 coming back  <<< 
-- URB_FUNCTION_BULK_OR_INTERRUPT_TRANSFER:
  PipeHandle           = 81b38434 [endpoint 0x00000002]
  TransferFlags        = 00000000 (USBD_TRANSFER_DIRECTION_OUT, ~USBD_SHORT_TRANSFER_OK)
  TransferBufferLength = 00000007
  TransferBuffer       = 00000000
  TransferBufferMDL    = 822f8658
  UrbLink              = 00000000
[825003 ms] UsbSnoop - DispatchAny(f88fe610) : IRP_MJ_INTERNAL_DEVICE_CONTROL
[825003 ms] UsbSnoop - MyDispatchInternalIOCTL(f88ffe80) : fdo=82141030, Irp=81b53008, IRQL=2
[825003 ms]  >>>  URB 710 going down  >>> 
-- URB_FUNCTION_BULK_OR_INTERRUPT_TRANSFER:
  PipeHandle           = 81b38434 [endpoint 0x00000002]
  TransferFlags        = 00000000 (USBD_TRANSFER_DIRECTION_OUT, ~USBD_SHORT_TRANSFER_OK)
  TransferBufferLength = 00000022
  TransferBuffer       = 00000000
  TransferBufferMDL    = 822f8658
    00000000: 00 00 00 1d 04 00 00 00 17 00 09 00 00 00 06 00
    00000010: 02 00 03 00 05 00 01 00 41 00 42 00 01 00 01 00
    00000020: 01 01
  UrbLink              = 00000000
[825003 ms] UsbSnoop - MyInternalIOCTLCompletion(f88ffdb0) : fido=81b37020, Irp=81b53008, Context=823094d0, IRQL=2
[825003 ms]  <<<  URB 710 coming back  <<< 
-- URB_FUNCTION_BULK_OR_INTERRUPT_TRANSFER:
  PipeHandle           = 81b38434 [endpoint 0x00000002]
  TransferFlags        = 00000000 (USBD_TRANSFER_DIRECTION_OUT, ~USBD_SHORT_TRANSFER_OK)
  TransferBufferLength = 00000022
  TransferBuffer       = 00000000
  TransferBufferMDL    = 822f8658
  UrbLink              = 00000000
[825013 ms] UsbSnoop - DispatchAny(f88fe610) : IRP_MJ_INTERNAL_DEVICE_CONTROL
[825013 ms] UsbSnoop - MyDispatchInternalIOCTL(f88ffe80) : fdo=82141030, Irp=81b53008, IRQL=2
[825013 ms]  >>>  URB 711 going down  >>> 
-- URB_FUNCTION_BULK_OR_INTERRUPT_TRANSFER:
  PipeHandle           = 81b38414 [endpoint 0x00000081]
  TransferFlags        = 00000003 (USBD_TRANSFER_DIRECTION_IN, USBD_SHORT_TRANSFER_OK)
  TransferBufferLength = 00000100
  TransferBuffer       = 00000000
  TransferBufferMDL    = 822f8658
  UrbLink              = 00000000
[825017 ms] UsbSnoop - MyInternalIOCTLCompletion(f88ffdb0) : fido=81b37020, Irp=81b53008, Context=81b21168, IRQL=2
[825017 ms]  <<<  URB 711 coming back  <<< 
-- URB_FUNCTION_BULK_OR_INTERRUPT_TRANSFER:
  PipeHandle           = 81b38414 [endpoint 0x00000081]
  TransferFlags        = 00000003 (USBD_TRANSFER_DIRECTION_IN, USBD_SHORT_TRANSFER_OK)
  TransferBufferLength = 00000007
  TransferBuffer       = 00000000
  TransferBufferMDL    = 822f8658
    00000000: 00 00 00 02 05 e0 00
  UrbLink              = 00000000
[825053 ms] UsbSnoop - DispatchAny(f88fe610) : IRP_MJ_INTERNAL_DEVICE_CONTROL
[825053 ms] UsbSnoop - MyDispatchInternalIOCTL(f88ffe80) : fdo=82141030, Irp=81b53008, IRQL=2
[825053 ms]  >>>  URB 712 going down  >>> 
-- URB_FUNCTION_BULK_OR_INTERRUPT_TRANSFER:
  PipeHandle           = 81b38414 [endpoint 0x00000081]
  TransferFlags        = 00000003 (USBD_TRANSFER_DIRECTION_IN, USBD_SHORT_TRANSFER_OK)
  TransferBufferLength = 00000100
  TransferBuffer       = 00000000
  TransferBufferMDL    = 822f8658
  UrbLink              = 00000000
[825057 ms] UsbSnoop - MyInternalIOCTLCompletion(f88ffdb0) : fido=81b37020, Irp=81b53008, Context=81ba5340, IRQL=2
[825057 ms]  <<<  URB 712 coming back  <<< 
-- URB_FUNCTION_BULK_OR_INTERRUPT_TRANSFER:
  PipeHandle           = 81b38414 [endpoint 0x00000081]
  TransferFlags        = 00000003 (USBD_TRANSFER_DIRECTION_IN, USBD_SHORT_TRANSFER_OK)
  TransferBufferLength = 00000032
  TransferBuffer       = 00000000
  TransferBufferMDL    = 822f8658
    00000000: 00 00 00 2d 04 00 00 00 27 00 0a 00 01 42 00 00
    00000010: 06 00 02 00 00 04 f0 07 00 00 00 03 00 00 01 00
    00000020: 00 05 01 00 01 00 00 04 00 00 00 09 00 41 01 00
    00000030: 42 01
  UrbLink              = 00000000
[825093 ms] UsbSnoop - DispatchAny(f88fe610) : IRP_MJ_INTERNAL_DEVICE_CONTROL
[825093 ms] UsbSnoop - MyDispatchInternalIOCTL(f88ffe80) : fdo=82141030, Irp=81b53008, IRQL=2
[825093 ms]  >>>  URB 713 going down  >>> 
-- URB_FUNCTION_BULK_OR_INTERRUPT_TRANSFER:
  PipeHandle           = 81b38434 [endpoint 0x00000002]
  TransferFlags        = 00000000 (USBD_TRANSFER_DIRECTION_OUT, ~USBD_SHORT_TRANSFER_OK)
  TransferBufferLength = 00000007
  TransferBuffer       = 00000000
  TransferBufferMDL    = 822f8658
    00000000: 00 00 00 02 05 e0 00
  UrbLink              = 00000000
[825093 ms] UsbSnoop - MyInternalIOCTLCompletion(f88ffdb0) : fido=81b37020, Irp=81b53008, Context=822f4330, IRQL=2
[825093 ms]  <<<  URB 713 coming back  <<< 
-- URB_FUNCTION_BULK_OR_INTERRUPT_TRANSFER:
  PipeHandle           = 81b38434 [endpoint 0x00000002]
  TransferFlags        = 00000000 (USBD_TRANSFER_DIRECTION_OUT, ~USBD_SHORT_TRANSFER_OK)
  TransferBufferLength = 00000007
  TransferBuffer       = 00000000
  TransferBufferMDL    = 822f8658
  UrbLink              = 00000000
[825103 ms] UsbSnoop - DispatchAny(f88fe610) : IRP_MJ_INTERNAL_DEVICE_CONTROL
[825103 ms] UsbSnoop - MyDispatchInternalIOCTL(f88ffe80) : fdo=82141030, Irp=81b53008, IRQL=2
[825103 ms]  >>>  URB 714 going down  >>> 
-- URB_FUNCTION_BULK_OR_INTERRUPT_TRANSFER:
  PipeHandle           = 81b38414 [endpoint 0x00000081]
  TransferFlags        = 00000003 (USBD_TRANSFER_DIRECTION_IN, USBD_SHORT_TRANSFER_OK)
  TransferBufferLength = 00000100
  TransferBuffer       = 00000000
  TransferBufferMDL    = 822f8658
  UrbLink              = 00000000
[825103 ms] UsbSnoop - MyInternalIOCTLCompletion(f88ffdb0) : fido=81b37020, Irp=81b53008, Context=81ba5340, IRQL=2
[825104 ms]  <<<  URB 714 coming back  <<< 
-- URB_FUNCTION_BULK_OR_INTERRUPT_TRANSFER:
  PipeHandle           = 81b38414 [endpoint 0x00000081]
  TransferFlags        = 00000003 (USBD_TRANSFER_DIRECTION_IN, USBD_SHORT_TRANSFER_OK)
  TransferBufferLength = 00000032
  TransferBuffer       = 00000000
  TransferBufferMDL    = 822f8658
    00000000: 00 00 00 2d 04 00 00 00 27 00 0a 00 01 41 00 00
    00000010: 06 00 02 00 00 04 f0 07 00 00 00 03 00 00 01 00
    00000020: 00 05 01 00 01 00 00 04 00 00 00 09 00 41 01 00
    00000030: 42 01
  UrbLink              = 00000000
[825143 ms] UsbSnoop - DispatchAny(f88fe610) : IRP_MJ_INTERNAL_DEVICE_CONTROL
[825143 ms] UsbSnoop - MyDispatchInternalIOCTL(f88ffe80) : fdo=82141030, Irp=81b53008, IRQL=2
[825143 ms]  >>>  URB 715 going down  >>> 
-- URB_FUNCTION_BULK_OR_INTERRUPT_TRANSFER:
  PipeHandle           = 81b38434 [endpoint 0x00000002]
  TransferFlags        = 00000000 (USBD_TRANSFER_DIRECTION_OUT, ~USBD_SHORT_TRANSFER_OK)
  TransferBufferLength = 00000007
  TransferBuffer       = 00000000
  TransferBufferMDL    = 822f8658
    00000000: 00 00 00 02 05 e0 00
  UrbLink              = 00000000
[825143 ms] UsbSnoop - MyInternalIOCTLCompletion(f88ffdb0) : fido=81b37020, Irp=81b53008, Context=81b22ea8, IRQL=2
[825143 ms]  <<<  URB 715 coming back  <<< 
-- URB_FUNCTION_BULK_OR_INTERRUPT_TRANSFER:
  PipeHandle           = 81b38434 [endpoint 0x00000002]
  TransferFlags        = 00000000 (USBD_TRANSFER_DIRECTION_OUT, ~USBD_SHORT_TRANSFER_OK)
  TransferBufferLength = 00000007
  TransferBuffer       = 00000000
  TransferBufferMDL    = 822f8658
  UrbLink              = 00000000
[825153 ms] UsbSnoop - DispatchAny(f88fe610) : IRP_MJ_INTERNAL_DEVICE_CONTROL
[825153 ms] UsbSnoop - MyDispatchInternalIOCTL(f88ffe80) : fdo=82141030, Irp=81b53008, IRQL=2
[825153 ms]  >>>  URB 716 going down  >>> 
-- URB_FUNCTION_BULK_OR_INTERRUPT_TRANSFER:
  PipeHandle           = 81b38414 [endpoint 0x00000081]
  TransferFlags        = 00000003 (USBD_TRANSFER_DIRECTION_IN, USBD_SHORT_TRANSFER_OK)
  TransferBufferLength = 00000100
  TransferBuffer       = 00000000
  TransferBufferMDL    = 822f8658
  UrbLink              = 00000000
[825154 ms] UsbSnoop - MyInternalIOCTLCompletion(f88ffdb0) : fido=81b37020, Irp=81b53008, Context=81b21168, IRQL=2
[825154 ms]  <<<  URB 716 coming back  <<< 
-- URB_FUNCTION_BULK_OR_INTERRUPT_TRANSFER:
  PipeHandle           = 81b38414 [endpoint 0x00000081]
  TransferFlags        = 00000003 (USBD_TRANSFER_DIRECTION_IN, USBD_SHORT_TRANSFER_OK)
  TransferBufferLength = 00000035
  TransferBuffer       = 00000000
  TransferBufferMDL    = 822f8658
    00000000: 00 00 00 30 04 00 00 00 2a 00 0a 00 04 4c e2 82
    00000010: 81 00 00 06 00 02 00 00 04 f0 07 00 01 00 03 00
    00000020: 00 01 00 00 05 01 00 01 00 00 04 00 00 00 02 00
    00000030: 41 01 00 42 01
  UrbLink              = 00000000
[825193 ms] UsbSnoop - DispatchAny(f88fe610) : IRP_MJ_INTERNAL_DEVICE_CONTROL
[825193 ms] UsbSnoop - MyDispatchInternalIOCTL(f88ffe80) : fdo=82141030, Irp=81b53008, IRQL=2
[825193 ms]  >>>  URB 717 going down  >>> 
-- URB_FUNCTION_BULK_OR_INTERRUPT_TRANSFER:
  PipeHandle           = 81b38434 [endpoint 0x00000002]
  TransferFlags        = 00000000 (USBD_TRANSFER_DIRECTION_OUT, ~USBD_SHORT_TRANSFER_OK)
  TransferBufferLength = 00000007
  TransferBuffer       = 00000000
  TransferBufferMDL    = 822f8658
    00000000: 00 00 00 02 05 e0 00
  UrbLink              = 00000000
[825194 ms] UsbSnoop - MyInternalIOCTLCompletion(f88ffdb0) : fido=81b37020, Irp=81b53008, Context=823094d0, IRQL=2
[825194 ms]  <<<  URB 717 coming back  <<< 
-- URB_FUNCTION_BULK_OR_INTERRUPT_TRANSFER:
  PipeHandle           = 81b38434 [endpoint 0x00000002]
  TransferFlags        = 00000000 (USBD_TRANSFER_DIRECTION_OUT, ~USBD_SHORT_TRANSFER_OK)
  TransferBufferLength = 00000007
  TransferBuffer       = 00000000
  TransferBufferMDL    = 822f8658
  UrbLink              = 00000000
[825203 ms] UsbSnoop - DispatchAny(f88fe610) : IRP_MJ_INTERNAL_DEVICE_CONTROL
[825203 ms] UsbSnoop - MyDispatchInternalIOCTL(f88ffe80) : fdo=82141030, Irp=81b53008, IRQL=2
[825203 ms]  >>>  URB 718 going down  >>> 
-- URB_FUNCTION_BULK_OR_INTERRUPT_TRANSFER:
  PipeHandle           = 81b38414 [endpoint 0x00000081]
  TransferFlags        = 00000003 (USBD_TRANSFER_DIRECTION_IN, USBD_SHORT_TRANSFER_OK)
  TransferBufferLength = 00000100
  TransferBuffer       = 00000000
  TransferBufferMDL    = 822f8658
  UrbLink              = 00000000
[825204 ms] UsbSnoop - MyInternalIOCTLCompletion(f88ffdb0) : fido=81b37020, Irp=81b53008, Context=822f4330, IRQL=2
[825204 ms]  <<<  URB 718 coming back  <<< 
-- URB_FUNCTION_BULK_OR_INTERRUPT_TRANSFER:
  PipeHandle           = 81b38414 [endpoint 0x00000081]
  TransferFlags        = 00000003 (USBD_TRANSFER_DIRECTION_IN, USBD_SHORT_TRANSFER_OK)
  TransferBufferLength = 00000035
  TransferBuffer       = 00000000
  TransferBufferMDL    = 822f8658
    00000000: 00 00 00 30 04 00 00 00 2a 00 0a 00 04 4c e2 82
    00000010: 82 00 00 06 00 02 00 00 04 f0 07 00 01 00 03 00
    00000020: 00 01 00 00 05 01 00 01 00 00 04 00 00 00 02 00
    00000030: 41 01 00 42 01
  UrbLink              = 00000000
[825243 ms] UsbSnoop - DispatchAny(f88fe610) : IRP_MJ_INTERNAL_DEVICE_CONTROL
[825243 ms] UsbSnoop - MyDispatchInternalIOCTL(f88ffe80) : fdo=82141030, Irp=81b53008, IRQL=2
[825243 ms]  >>>  URB 719 going down  >>> 
-- URB_FUNCTION_BULK_OR_INTERRUPT_TRANSFER:
  PipeHandle           = 81b38434 [endpoint 0x00000002]
  TransferFlags        = 00000000 (USBD_TRANSFER_DIRECTION_OUT, ~USBD_SHORT_TRANSFER_OK)
  TransferBufferLength = 00000007
  TransferBuffer       = 00000000
  TransferBufferMDL    = 822f8658
    00000000: 00 00 00 02 05 e0 00
  UrbLink              = 00000000
[825244 ms] UsbSnoop - MyInternalIOCTLCompletion(f88ffdb0) : fido=81b37020, Irp=81b53008, Context=81ba5340, IRQL=2
[825244 ms]  <<<  URB 719 coming back  <<< 
-- URB_FUNCTION_BULK_OR_INTERRUPT_TRANSFER:
  PipeHandle           = 81b38434 [endpoint 0x00000002]
  TransferFlags        = 00000000 (USBD_TRANSFER_DIRECTION_OUT, ~USBD_SHORT_TRANSFER_OK)
  TransferBufferLength = 00000007
  TransferBuffer       = 00000000
  TransferBufferMDL    = 822f8658
  UrbLink              = 00000000
[825253 ms] UsbSnoop - DispatchAny(f88fe610) : IRP_MJ_INTERNAL_DEVICE_CONTROL
[825253 ms] UsbSnoop - MyDispatchInternalIOCTL(f88ffe80) : fdo=82141030, Irp=81b53008, IRQL=2
[825253 ms]  >>>  URB 720 going down  >>> 
-- URB_FUNCTION_BULK_OR_INTERRUPT_TRANSFER:
  PipeHandle           = 81b38414 [endpoint 0x00000081]
  TransferFlags        = 00000003 (USBD_TRANSFER_DIRECTION_IN, USBD_SHORT_TRANSFER_OK)
  TransferBufferLength = 00000100
  TransferBuffer       = 00000000
  TransferBufferMDL    = 822f8658
  UrbLink              = 00000000
[825254 ms] UsbSnoop - MyInternalIOCTLCompletion(f88ffdb0) : fido=81b37020, Irp=81b53008, Context=81b22ea8, IRQL=2
[825254 ms]  <<<  URB 720 coming back  <<< 
-- URB_FUNCTION_BULK_OR_INTERRUPT_TRANSFER:
  PipeHandle           = 81b38414 [endpoint 0x00000081]
  TransferFlags        = 00000003 (USBD_TRANSFER_DIRECTION_IN, USBD_SHORT_TRANSFER_OK)
  TransferBufferLength = 00000035
  TransferBuffer       = 00000000
  TransferBufferMDL    = 822f8658
    00000000: 00 00 00 30 04 00 00 00 2a 00 0a 00 04 4c e2 82
    00000010: 83 00 00 06 00 02 00 00 04 f0 07 00 01 00 03 00
    00000020: 00 01 00 00 05 01 00 01 00 00 04 00 00 00 02 00
    00000030: 41 01 00 42 01
  UrbLink              = 00000000
[825294 ms] UsbSnoop - DispatchAny(f88fe610) : IRP_MJ_INTERNAL_DEVICE_CONTROL
[825294 ms] UsbSnoop - MyDispatchInternalIOCTL(f88ffe80) : fdo=82141030, Irp=81b53008, IRQL=2
[825294 ms]  >>>  URB 721 going down  >>> 
-- URB_FUNCTION_BULK_OR_INTERRUPT_TRANSFER:
  PipeHandle           = 81b38434 [endpoint 0x00000002]
  TransferFlags        = 00000000 (USBD_TRANSFER_DIRECTION_OUT, ~USBD_SHORT_TRANSFER_OK)
  TransferBufferLength = 00000007
  TransferBuffer       = 00000000
  TransferBufferMDL    = 822f8658
    00000000: 00 00 00 02 05 e0 00
  UrbLink              = 00000000
[825294 ms] UsbSnoop - MyInternalIOCTLCompletion(f88ffdb0) : fido=81b37020, Irp=81b53008, Context=81b21168, IRQL=2
[825294 ms]  <<<  URB 721 coming back  <<< 
-- URB_FUNCTION_BULK_OR_INTERRUPT_TRANSFER:
  PipeHandle           = 81b38434 [endpoint 0x00000002]
  TransferFlags        = 00000000 (USBD_TRANSFER_DIRECTION_OUT, ~USBD_SHORT_TRANSFER_OK)
  TransferBufferLength = 00000007
  TransferBuffer       = 00000000
  TransferBufferMDL    = 822f8658
  UrbLink              = 00000000
[825304 ms] UsbSnoop - DispatchAny(f88fe610) : IRP_MJ_INTERNAL_DEVICE_CONTROL
[825304 ms] UsbSnoop - MyDispatchInternalIOCTL(f88ffe80) : fdo=82141030, Irp=81b53008, IRQL=2
[825304 ms]  >>>  URB 722 going down  >>> 
-- URB_FUNCTION_BULK_OR_INTERRUPT_TRANSFER:
  PipeHandle           = 81b38414 [endpoint 0x00000081]
  TransferFlags        = 00000003 (USBD_TRANSFER_DIRECTION_IN, USBD_SHORT_TRANSFER_OK)
  TransferBufferLength = 00000100
  TransferBuffer       = 00000000
  TransferBufferMDL    = 822f8658
  UrbLink              = 00000000
[825304 ms] UsbSnoop - MyInternalIOCTLCompletion(f88ffdb0) : fido=81b37020, Irp=81b53008, Context=823094d0, IRQL=2
[825304 ms]  <<<  URB 722 coming back  <<< 
-- URB_FUNCTION_BULK_OR_INTERRUPT_TRANSFER:
  PipeHandle           = 81b38414 [endpoint 0x00000081]
  TransferFlags        = 00000003 (USBD_TRANSFER_DIRECTION_IN, USBD_SHORT_TRANSFER_OK)
  TransferBufferLength = 00000035
  TransferBuffer       = 00000000
  TransferBufferMDL    = 822f8658
    00000000: 00 00 00 30 04 00 00 00 2a 00 0a 00 04 4c e2 82
    00000010: 84 00 00 06 00 02 00 00 04 f0 07 00 01 00 03 00
    00000020: 00 01 00 00 05 01 00 01 00 00 04 00 00 00 02 00
    00000030: 41 01 00 42 01
  UrbLink              = 00000000
[825344 ms] UsbSnoop - DispatchAny(f88fe610) : IRP_MJ_INTERNAL_DEVICE_CONTROL
[825344 ms] UsbSnoop - MyDispatchInternalIOCTL(f88ffe80) : fdo=82141030, Irp=81b53008, IRQL=2
[825344 ms]  >>>  URB 723 going down  >>> 
-- URB_FUNCTION_BULK_OR_INTERRUPT_TRANSFER:
  PipeHandle           = 81b38434 [endpoint 0x00000002]
  TransferFlags        = 00000000 (USBD_TRANSFER_DIRECTION_OUT, ~USBD_SHORT_TRANSFER_OK)
  TransferBufferLength = 00000007
  TransferBuffer       = 00000000
  TransferBufferMDL    = 822f8658
    00000000: 00 00 00 02 05 e0 00
  UrbLink              = 00000000
[825344 ms] UsbSnoop - MyInternalIOCTLCompletion(f88ffdb0) : fido=81b37020, Irp=81b53008, Context=822f4330, IRQL=2
[825344 ms]  <<<  URB 723 coming back  <<< 
-- URB_FUNCTION_BULK_OR_INTERRUPT_TRANSFER:
  PipeHandle           = 81b38434 [endpoint 0x00000002]
  TransferFlags        = 00000000 (USBD_TRANSFER_DIRECTION_OUT, ~USBD_SHORT_TRANSFER_OK)
  TransferBufferLength = 00000007
  TransferBuffer       = 00000000
  TransferBufferMDL    = 822f8658
  UrbLink              = 00000000
[825354 ms] UsbSnoop - DispatchAny(f88fe610) : IRP_MJ_INTERNAL_DEVICE_CONTROL
[825354 ms] UsbSnoop - MyDispatchInternalIOCTL(f88ffe80) : fdo=82141030, Irp=81b53008, IRQL=2
[825354 ms]  >>>  URB 724 going down  >>> 
-- URB_FUNCTION_BULK_OR_INTERRUPT_TRANSFER:
  PipeHandle           = 81b38414 [endpoint 0x00000081]
  TransferFlags        = 00000003 (USBD_TRANSFER_DIRECTION_IN, USBD_SHORT_TRANSFER_OK)
  TransferBufferLength = 00000100
  TransferBuffer       = 00000000
  TransferBufferMDL    = 822f8658
  UrbLink              = 00000000
[825354 ms] UsbSnoop - MyInternalIOCTLCompletion(f88ffdb0) : fido=81b37020, Irp=81b53008, Context=81ba5340, IRQL=2
[825354 ms]  <<<  URB 724 coming back  <<< 
-- URB_FUNCTION_BULK_OR_INTERRUPT_TRANSFER:
  PipeHandle           = 81b38414 [endpoint 0x00000081]
  TransferFlags        = 00000003 (USBD_TRANSFER_DIRECTION_IN, USBD_SHORT_TRANSFER_OK)
  TransferBufferLength = 00000035
  TransferBuffer       = 00000000
  TransferBufferMDL    = 822f8658
    00000000: 00 00 00 30 04 00 00 00 2a 00 0a 00 04 4c e2 82
    00000010: 85 00 00 06 00 02 00 00 04 f0 07 00 01 00 03 00
    00000020: 00 01 00 00 05 01 00 01 00 00 04 00 00 00 02 00
    00000030: 41 01 00 42 01
  UrbLink              = 00000000
[825394 ms] UsbSnoop - DispatchAny(f88fe610) : IRP_MJ_INTERNAL_DEVICE_CONTROL
[825394 ms] UsbSnoop - MyDispatchInternalIOCTL(f88ffe80) : fdo=82141030, Irp=81b53008, IRQL=2
[825394 ms]  >>>  URB 725 going down  >>> 
-- URB_FUNCTION_BULK_OR_INTERRUPT_TRANSFER:
  PipeHandle           = 81b38434 [endpoint 0x00000002]
  TransferFlags        = 00000000 (USBD_TRANSFER_DIRECTION_OUT, ~USBD_SHORT_TRANSFER_OK)
  TransferBufferLength = 00000007
  TransferBuffer       = 00000000
  TransferBufferMDL    = 822f8658
    00000000: 00 00 00 02 05 e0 00
  UrbLink              = 00000000
[825394 ms] UsbSnoop - MyInternalIOCTLCompletion(f88ffdb0) : fido=81b37020, Irp=81b53008, Context=81b22ea8, IRQL=2
[825394 ms]  <<<  URB 725 coming back  <<< 
-- URB_FUNCTION_BULK_OR_INTERRUPT_TRANSFER:
  PipeHandle           = 81b38434 [endpoint 0x00000002]
  TransferFlags        = 00000000 (USBD_TRANSFER_DIRECTION_OUT, ~USBD_SHORT_TRANSFER_OK)
  TransferBufferLength = 00000007
  TransferBuffer       = 00000000
  TransferBufferMDL    = 822f8658
  UrbLink              = 00000000
[825404 ms] UsbSnoop - DispatchAny(f88fe610) : IRP_MJ_INTERNAL_DEVICE_CONTROL
[825404 ms] UsbSnoop - MyDispatchInternalIOCTL(f88ffe80) : fdo=82141030, Irp=81b53008, IRQL=2
[825404 ms]  >>>  URB 726 going down  >>> 
-- URB_FUNCTION_BULK_OR_INTERRUPT_TRANSFER:
  PipeHandle           = 81b38414 [endpoint 0x00000081]
  TransferFlags        = 00000003 (USBD_TRANSFER_DIRECTION_IN, USBD_SHORT_TRANSFER_OK)
  TransferBufferLength = 00000100
  TransferBuffer       = 00000000
  TransferBufferMDL    = 822f8658
  UrbLink              = 00000000
[825404 ms] UsbSnoop - MyInternalIOCTLCompletion(f88ffdb0) : fido=81b37020, Irp=81b53008, Context=81b21168, IRQL=2
[825404 ms]  <<<  URB 726 coming back  <<< 
-- URB_FUNCTION_BULK_OR_INTERRUPT_TRANSFER:
  PipeHandle           = 81b38414 [endpoint 0x00000081]
  TransferFlags        = 00000003 (USBD_TRANSFER_DIRECTION_IN, USBD_SHORT_TRANSFER_OK)
  TransferBufferLength = 00000035
  TransferBuffer       = 00000000
  TransferBufferMDL    = 822f8658
    00000000: 00 00 00 30 04 00 00 00 2a 00 0a 00 04 4c e2 82
    00000010: 86 00 00 06 00 02 00 00 04 f0 07 00 01 00 03 00
    00000020: 00 01 00 00 05 01 00 01 00 00 04 00 00 00 02 00
    00000030: 41 01 00 42 01
  UrbLink              = 00000000
[825444 ms] UsbSnoop - DispatchAny(f88fe610) : IRP_MJ_INTERNAL_DEVICE_CONTROL
[825444 ms] UsbSnoop - MyDispatchInternalIOCTL(f88ffe80) : fdo=82141030, Irp=81b53008, IRQL=2
[825444 ms]  >>>  URB 727 going down  >>> 
-- URB_FUNCTION_BULK_OR_INTERRUPT_TRANSFER:
  PipeHandle           = 81b38434 [endpoint 0x00000002]
  TransferFlags        = 00000000 (USBD_TRANSFER_DIRECTION_OUT, ~USBD_SHORT_TRANSFER_OK)
  TransferBufferLength = 00000007
  TransferBuffer       = 00000000
  TransferBufferMDL    = 822f8658
    00000000: 00 00 00 02 05 e0 00
  UrbLink              = 00000000
[825444 ms] UsbSnoop - MyInternalIOCTLCompletion(f88ffdb0) : fido=81b37020, Irp=81b53008, Context=823094d0, IRQL=2
[825444 ms]  <<<  URB 727 coming back  <<< 
-- URB_FUNCTION_BULK_OR_INTERRUPT_TRANSFER:
  PipeHandle           = 81b38434 [endpoint 0x00000002]
  TransferFlags        = 00000000 (USBD_TRANSFER_DIRECTION_OUT, ~USBD_SHORT_TRANSFER_OK)
  TransferBufferLength = 00000007
  TransferBuffer       = 00000000
  TransferBufferMDL    = 822f8658
  UrbLink              = 00000000
[825454 ms] UsbSnoop - DispatchAny(f88fe610) : IRP_MJ_INTERNAL_DEVICE_CONTROL
[825454 ms] UsbSnoop - MyDispatchInternalIOCTL(f88ffe80) : fdo=82141030, Irp=81b53008, IRQL=2
[825454 ms]  >>>  URB 728 going down  >>> 
-- URB_FUNCTION_BULK_OR_INTERRUPT_TRANSFER:
  PipeHandle           = 81b38414 [endpoint 0x00000081]
  TransferFlags        = 00000003 (USBD_TRANSFER_DIRECTION_IN, USBD_SHORT_TRANSFER_OK)
  TransferBufferLength = 00000100
  TransferBuffer       = 00000000
  TransferBufferMDL    = 822f8658
  UrbLink              = 00000000
[825454 ms] UsbSnoop - MyInternalIOCTLCompletion(f88ffdb0) : fido=81b37020, Irp=81b53008, Context=822f4330, IRQL=2
[825454 ms]  <<<  URB 728 coming back  <<< 
-- URB_FUNCTION_BULK_OR_INTERRUPT_TRANSFER:
  PipeHandle           = 81b38414 [endpoint 0x00000081]
  TransferFlags        = 00000003 (USBD_TRANSFER_DIRECTION_IN, USBD_SHORT_TRANSFER_OK)
  TransferBufferLength = 00000032
  TransferBuffer       = 00000000
  TransferBufferMDL    = 822f8658
    00000000: 00 00 00 2d 04 00 00 00 27 00 0a 00 01 42 00 00
    00000010: 06 00 02 00 00 04 f0 07 00 01 00 03 00 00 01 00
    00000020: 00 05 01 00 01 00 00 04 00 00 00 02 00 41 01 00
    00000030: 42 01
  UrbLink              = 00000000
[825494 ms] UsbSnoop - DispatchAny(f88fe610) : IRP_MJ_INTERNAL_DEVICE_CONTROL
[825494 ms] UsbSnoop - MyDispatchInternalIOCTL(f88ffe80) : fdo=82141030, Irp=81b53008, IRQL=2
[825494 ms]  >>>  URB 729 going down  >>> 
-- URB_FUNCTION_BULK_OR_INTERRUPT_TRANSFER:
  PipeHandle           = 81b38434 [endpoint 0x00000002]
  TransferFlags        = 00000000 (USBD_TRANSFER_DIRECTION_OUT, ~USBD_SHORT_TRANSFER_OK)
  TransferBufferLength = 00000007
  TransferBuffer       = 00000000
  TransferBufferMDL    = 822f8658
    00000000: 00 00 00 02 05 e0 00
  UrbLink              = 00000000
[825494 ms] UsbSnoop - MyInternalIOCTLCompletion(f88ffdb0) : fido=81b37020, Irp=81b53008, Context=81ba5340, IRQL=2
[825494 ms]  <<<  URB 729 coming back  <<< 
-- URB_FUNCTION_BULK_OR_INTERRUPT_TRANSFER:
  PipeHandle           = 81b38434 [endpoint 0x00000002]
  TransferFlags        = 00000000 (USBD_TRANSFER_DIRECTION_OUT, ~USBD_SHORT_TRANSFER_OK)
  TransferBufferLength = 00000007
  TransferBuffer       = 00000000
  TransferBufferMDL    = 822f8658
  UrbLink              = 00000000
[825504 ms] UsbSnoop - DispatchAny(f88fe610) : IRP_MJ_INTERNAL_DEVICE_CONTROL
[825504 ms] UsbSnoop - MyDispatchInternalIOCTL(f88ffe80) : fdo=82141030, Irp=81b53008, IRQL=2
[825504 ms]  >>>  URB 730 going down  >>> 
-- URB_FUNCTION_BULK_OR_INTERRUPT_TRANSFER:
  PipeHandle           = 81b38414 [endpoint 0x00000081]
  TransferFlags        = 00000003 (USBD_TRANSFER_DIRECTION_IN, USBD_SHORT_TRANSFER_OK)
  TransferBufferLength = 00000100
  TransferBuffer       = 00000000
  TransferBufferMDL    = 822f8658
  UrbLink              = 00000000
[825504 ms] UsbSnoop - MyInternalIOCTLCompletion(f88ffdb0) : fido=81b37020, Irp=81b53008, Context=81b22ea8, IRQL=2
[825504 ms]  <<<  URB 730 coming back  <<< 
-- URB_FUNCTION_BULK_OR_INTERRUPT_TRANSFER:
  PipeHandle           = 81b38414 [endpoint 0x00000081]
  TransferFlags        = 00000003 (USBD_TRANSFER_DIRECTION_IN, USBD_SHORT_TRANSFER_OK)
  TransferBufferLength = 0000000b
  TransferBuffer       = 00000000
  TransferBufferMDL    = 822f8658
    00000000: 00 00 00 06 04 00 00 00 00 dd 00
  UrbLink              = 00000000
[825544 ms] UsbSnoop - DispatchAny(f88fe610) : IRP_MJ_INTERNAL_DEVICE_CONTROL
[825544 ms] UsbSnoop - MyDispatchInternalIOCTL(f88ffe80) : fdo=82141030, Irp=822fa008, IRQL=2
[825544 ms]  >>>  URB 731 going down  >>> 
-- URB_FUNCTION_BULK_OR_INTERRUPT_TRANSFER:
  PipeHandle           = 81b38434 [endpoint 0x00000002]
  TransferFlags        = 00000000 (USBD_TRANSFER_DIRECTION_OUT, ~USBD_SHORT_TRANSFER_OK)
  TransferBufferLength = 00000007
  TransferBuffer       = 00000000
  TransferBufferMDL    = 822f8658
    00000000: 00 00 00 02 05 e0 00
  UrbLink              = 00000000
[825544 ms] UsbSnoop - MyInternalIOCTLCompletion(f88ffdb0) : fido=81b37020, Irp=822fa008, Context=81b21168, IRQL=2
[825544 ms]  <<<  URB 731 coming back  <<< 
-- URB_FUNCTION_BULK_OR_INTERRUPT_TRANSFER:
  PipeHandle           = 81b38434 [endpoint 0x00000002]
  TransferFlags        = 00000000 (USBD_TRANSFER_DIRECTION_OUT, ~USBD_SHORT_TRANSFER_OK)
  TransferBufferLength = 00000007
  TransferBuffer       = 00000000
  TransferBufferMDL    = 822f8658
  UrbLink              = 00000000
[825804 ms] UsbSnoop - DispatchAny(f88fe610) : IRP_MJ_INTERNAL_DEVICE_CONTROL
[825804 ms] UsbSnoop - MyDispatchInternalIOCTL(f88ffe80) : fdo=82141030, Irp=81b34008, IRQL=2
[825804 ms]  >>>  URB 732 going down  >>> 
-- URB_FUNCTION_BULK_OR_INTERRUPT_TRANSFER:
  PipeHandle           = 81b38434 [endpoint 0x00000002]
  TransferFlags        = 00000000 (USBD_TRANSFER_DIRECTION_OUT, ~USBD_SHORT_TRANSFER_OK)
  TransferBufferLength = 00000009
  TransferBuffer       = 00000000
  TransferBufferMDL    = 822f8658
    00000000: 00 00 00 04 01 00 00 04 00
  UrbLink              = 00000000
[825805 ms] UsbSnoop - MyInternalIOCTLCompletion(f88ffdb0) : fido=81b37020, Irp=81b34008, Context=823094d0, IRQL=2
[825805 ms]  <<<  URB 732 coming back  <<< 
-- URB_FUNCTION_BULK_OR_INTERRUPT_TRANSFER:
  PipeHandle           = 81b38434 [endpoint 0x00000002]
  TransferFlags        = 00000000 (USBD_TRANSFER_DIRECTION_OUT, ~USBD_SHORT_TRANSFER_OK)
  TransferBufferLength = 00000009
  TransferBuffer       = 00000000
  TransferBufferMDL    = 822f8658
  UrbLink              = 00000000
[825807 ms] UsbSnoop - DispatchAny(f88fe610) : IRP_MJ_INTERNAL_DEVICE_CONTROL
[825807 ms] UsbSnoop - MyDispatchInternalIOCTL(f88ffe80) : fdo=82141030, Irp=81b34008, IRQL=2
[825807 ms]  >>>  URB 733 going down  >>> 
-- URB_FUNCTION_BULK_OR_INTERRUPT_TRANSFER:
  PipeHandle           = 81b38414 [endpoint 0x00000081]
  TransferFlags        = 00000003 (USBD_TRANSFER_DIRECTION_IN, USBD_SHORT_TRANSFER_OK)
  TransferBufferLength = 00000100
  TransferBuffer       = 00000000
  TransferBufferMDL    = 822de568
  UrbLink              = 00000000
[825814 ms] UsbSnoop - MyInternalIOCTLCompletion(f88ffdb0) : fido=81b37020, Irp=81b34008, Context=81ba43c8, IRQL=2
[825814 ms]  <<<  URB 733 coming back  <<< 
-- URB_FUNCTION_BULK_OR_INTERRUPT_TRANSFER:
  PipeHandle           = 81b38414 [endpoint 0x00000081]
  TransferFlags        = 00000003 (USBD_TRANSFER_DIRECTION_IN, USBD_SHORT_TRANSFER_OK)
  TransferBufferLength = 00000009
  TransferBuffer       = 00000000
  TransferBufferMDL    = 822de568
    00000000: 00 00 00 04 02 00 00 00 fa
  UrbLink              = 00000000
[825834 ms] UsbSnoop - DispatchAny(f88fe610) : IRP_MJ_INTERNAL_DEVICE_CONTROL
[825834 ms] UsbSnoop - MyDispatchInternalIOCTL(f88ffe80) : fdo=82141030, Irp=81b34008, IRQL=2
[825834 ms]  >>>  URB 734 going down  >>> 
-- URB_FUNCTION_BULK_OR_INTERRUPT_TRANSFER:
  PipeHandle           = 81b38434 [endpoint 0x00000002]
  TransferFlags        = 00000000 (USBD_TRANSFER_DIRECTION_OUT, ~USBD_SHORT_TRANSFER_OK)
  TransferBufferLength = 00000015
  TransferBuffer       = 00000000
  TransferBufferMDL    = 822de568
    00000000: 00 00 00 10 04 00 00 00 0a 00 01 00 03 00 01 00
    00000010: 00 00 00 07 d0
  UrbLink              = 00000000
[825835 ms] UsbSnoop - MyInternalIOCTLCompletion(f88ffdb0) : fido=81b37020, Irp=81b34008, Context=822f4330, IRQL=2
[825835 ms]  <<<  URB 734 coming back  <<< 
-- URB_FUNCTION_BULK_OR_INTERRUPT_TRANSFER:
  PipeHandle           = 81b38434 [endpoint 0x00000002]
  TransferFlags        = 00000000 (USBD_TRANSFER_DIRECTION_OUT, ~USBD_SHORT_TRANSFER_OK)
  TransferBufferLength = 00000015
  TransferBuffer       = 00000000
  TransferBufferMDL    = 822de568
  UrbLink              = 00000000
[825844 ms] UsbSnoop - DispatchAny(f88fe610) : IRP_MJ_INTERNAL_DEVICE_CONTROL
[825844 ms] UsbSnoop - MyDispatchInternalIOCTL(f88ffe80) : fdo=82141030, Irp=81b34008, IRQL=2
[825844 ms]  >>>  URB 735 going down  >>> 
-- URB_FUNCTION_BULK_OR_INTERRUPT_TRANSFER:
  PipeHandle           = 81b38414 [endpoint 0x00000081]
  TransferFlags        = 00000003 (USBD_TRANSFER_DIRECTION_IN, USBD_SHORT_TRANSFER_OK)
  TransferBufferLength = 00000100
  TransferBuffer       = 00000000
  TransferBufferMDL    = 822de568
  UrbLink              = 00000000
[825844 ms] UsbSnoop - MyInternalIOCTLCompletion(f88ffdb0) : fido=81b37020, Irp=81b34008, Context=81ba43c8, IRQL=2
[825844 ms]  <<<  URB 735 coming back  <<< 
-- URB_FUNCTION_BULK_OR_INTERRUPT_TRANSFER:
  PipeHandle           = 81b38414 [endpoint 0x00000081]
  TransferFlags        = 00000003 (USBD_TRANSFER_DIRECTION_IN, USBD_SHORT_TRANSFER_OK)
  TransferBufferLength = 00000007
  TransferBuffer       = 00000000
  TransferBufferMDL    = 822de568
    00000000: 00 00 00 02 05 e0 00
  UrbLink              = 00000000
[825884 ms] UsbSnoop - DispatchAny(f88fe610) : IRP_MJ_INTERNAL_DEVICE_CONTROL
[825884 ms] UsbSnoop - MyDispatchInternalIOCTL(f88ffe80) : fdo=82141030, Irp=81b34008, IRQL=2
[825884 ms]  >>>  URB 736 going down  >>> 
-- URB_FUNCTION_BULK_OR_INTERRUPT_TRANSFER:
  PipeHandle           = 81b38414 [endpoint 0x00000081]
  TransferFlags        = 00000003 (USBD_TRANSFER_DIRECTION_IN, USBD_SHORT_TRANSFER_OK)
  TransferBufferLength = 00000100
  TransferBuffer       = 00000000
  TransferBufferMDL    = 822de568
  UrbLink              = 00000000
[825885 ms] UsbSnoop - MyInternalIOCTLCompletion(f88ffdb0) : fido=81b37020, Irp=81b34008, Context=81bbb438, IRQL=2
[825885 ms]  <<<  URB 736 coming back  <<< 
-- URB_FUNCTION_BULK_OR_INTERRUPT_TRANSFER:
  PipeHandle           = 81b38414 [endpoint 0x00000081]
  TransferFlags        = 00000003 (USBD_TRANSFER_DIRECTION_IN, USBD_SHORT_TRANSFER_OK)
  TransferBufferLength = 0000000f
  TransferBuffer       = 00000000
  TransferBufferMDL    = 822de568
    00000000: 00 00 00 0a 04 00 00 00 04 00 12 00 00 07 d0
  UrbLink              = 00000000
[825925 ms] UsbSnoop - DispatchAny(f88fe610) : IRP_MJ_INTERNAL_DEVICE_CONTROL
[825925 ms] UsbSnoop - MyDispatchInternalIOCTL(f88ffe80) : fdo=82141030, Irp=81b34008, IRQL=2
[825925 ms]  >>>  URB 737 going down  >>> 
-- URB_FUNCTION_BULK_OR_INTERRUPT_TRANSFER:
  PipeHandle           = 81b38434 [endpoint 0x00000002]
  TransferFlags        = 00000000 (USBD_TRANSFER_DIRECTION_OUT, ~USBD_SHORT_TRANSFER_OK)
  TransferBufferLength = 00000007
  TransferBuffer       = 00000000
  TransferBufferMDL    = 822de568
    00000000: 00 00 00 02 05 e0 00
  UrbLink              = 00000000
[825925 ms] UsbSnoop - MyInternalIOCTLCompletion(f88ffdb0) : fido=81b37020, Irp=81b34008, Context=81ba43c8, IRQL=2
[825925 ms]  <<<  URB 737 coming back  <<< 
-- URB_FUNCTION_BULK_OR_INTERRUPT_TRANSFER:
  PipeHandle           = 81b38434 [endpoint 0x00000002]
  TransferFlags        = 00000000 (USBD_TRANSFER_DIRECTION_OUT, ~USBD_SHORT_TRANSFER_OK)
  TransferBufferLength = 00000007
  TransferBuffer       = 00000000
  TransferBufferMDL    = 822de568
  UrbLink              = 00000000
[825935 ms] UsbSnoop - DispatchAny(f88fe610) : IRP_MJ_INTERNAL_DEVICE_CONTROL
[825935 ms] UsbSnoop - MyDispatchInternalIOCTL(f88ffe80) : fdo=82141030, Irp=81b34008, IRQL=2
[825935 ms]  >>>  URB 738 going down  >>> 
-- URB_FUNCTION_BULK_OR_INTERRUPT_TRANSFER:
  PipeHandle           = 81b38434 [endpoint 0x00000002]
  TransferFlags        = 00000000 (USBD_TRANSFER_DIRECTION_OUT, ~USBD_SHORT_TRANSFER_OK)
  TransferBufferLength = 0000000f
  TransferBuffer       = 00000000
  TransferBufferMDL    = 822de568
    00000000: 00 00 00 0a 04 00 00 00 04 00 07 00 01 00 0e
  UrbLink              = 00000000
[825935 ms] UsbSnoop - MyInternalIOCTLCompletion(f88ffdb0) : fido=81b37020, Irp=81b34008, Context=822e6ce8, IRQL=2
[825935 ms]  <<<  URB 738 coming back  <<< 
-- URB_FUNCTION_BULK_OR_INTERRUPT_TRANSFER:
  PipeHandle           = 81b38434 [endpoint 0x00000002]
  TransferFlags        = 00000000 (USBD_TRANSFER_DIRECTION_OUT, ~USBD_SHORT_TRANSFER_OK)
  TransferBufferLength = 0000000f
  TransferBuffer       = 00000000
  TransferBufferMDL    = 822de568
  UrbLink              = 00000000
[825945 ms] UsbSnoop - DispatchAny(f88fe610) : IRP_MJ_INTERNAL_DEVICE_CONTROL
[825945 ms] UsbSnoop - MyDispatchInternalIOCTL(f88ffe80) : fdo=82141030, Irp=81b34008, IRQL=2
[825945 ms]  >>>  URB 739 going down  >>> 
-- URB_FUNCTION_BULK_OR_INTERRUPT_TRANSFER:
  PipeHandle           = 81b38414 [endpoint 0x00000081]
  TransferFlags        = 00000003 (USBD_TRANSFER_DIRECTION_IN, USBD_SHORT_TRANSFER_OK)
  TransferBufferLength = 00000100
  TransferBuffer       = 00000000
  TransferBufferMDL    = 822de568
  UrbLink              = 00000000
[825945 ms] UsbSnoop - MyInternalIOCTLCompletion(f88ffdb0) : fido=81b37020, Irp=81b34008, Context=81b21168, IRQL=2
[825945 ms]  <<<  URB 739 coming back  <<< 
-- URB_FUNCTION_BULK_OR_INTERRUPT_TRANSFER:
  PipeHandle           = 81b38414 [endpoint 0x00000081]
  TransferFlags        = 00000003 (USBD_TRANSFER_DIRECTION_IN, USBD_SHORT_TRANSFER_OK)
  TransferBufferLength = 00000007
  TransferBuffer       = 00000000
  TransferBufferMDL    = 822de568
    00000000: 00 00 00 02 05 e0 00
  UrbLink              = 00000000
[825985 ms] UsbSnoop - DispatchAny(f88fe610) : IRP_MJ_INTERNAL_DEVICE_CONTROL
[825985 ms] UsbSnoop - MyDispatchInternalIOCTL(f88ffe80) : fdo=82141030, Irp=81b34008, IRQL=2
[825985 ms]  >>>  URB 740 going down  >>> 
-- URB_FUNCTION_BULK_OR_INTERRUPT_TRANSFER:
  PipeHandle           = 81b38414 [endpoint 0x00000081]
  TransferFlags        = 00000003 (USBD_TRANSFER_DIRECTION_IN, USBD_SHORT_TRANSFER_OK)
  TransferBufferLength = 00000100
  TransferBuffer       = 00000000
  TransferBufferMDL    = 822de568
  UrbLink              = 00000000
[825985 ms] UsbSnoop - MyInternalIOCTLCompletion(f88ffdb0) : fido=81b37020, Irp=81b34008, Context=822f4330, IRQL=2
[825985 ms]  <<<  URB 740 coming back  <<< 
-- URB_FUNCTION_BULK_OR_INTERRUPT_TRANSFER:
  PipeHandle           = 81b38414 [endpoint 0x00000081]
  TransferFlags        = 00000003 (USBD_TRANSFER_DIRECTION_IN, USBD_SHORT_TRANSFER_OK)
  TransferBufferLength = 0000000f
  TransferBuffer       = 00000000
  TransferBufferMDL    = 822de568
    00000000: 00 00 00 0a 04 00 00 00 04 bb 00 00 01 d4 c0
  UrbLink              = 00000000
[826025 ms] UsbSnoop - DispatchAny(f88fe610) : IRP_MJ_INTERNAL_DEVICE_CONTROL
[826025 ms] UsbSnoop - MyDispatchInternalIOCTL(f88ffe80) : fdo=82141030, Irp=81b34008, IRQL=2
[826025 ms]  >>>  URB 741 going down  >>> 
-- URB_FUNCTION_BULK_OR_INTERRUPT_TRANSFER:
  PipeHandle           = 81b38434 [endpoint 0x00000002]
  TransferFlags        = 00000000 (USBD_TRANSFER_DIRECTION_OUT, ~USBD_SHORT_TRANSFER_OK)
  TransferBufferLength = 00000007
  TransferBuffer       = 00000000
  TransferBufferMDL    = 822de568
    00000000: 00 00 00 02 05 e0 00
  UrbLink              = 00000000
[826025 ms] UsbSnoop - MyInternalIOCTLCompletion(f88ffdb0) : fido=81b37020, Irp=81b34008, Context=822e6ce8, IRQL=2
[826025 ms]  <<<  URB 741 coming back  <<< 
-- URB_FUNCTION_BULK_OR_INTERRUPT_TRANSFER:
  PipeHandle           = 81b38434 [endpoint 0x00000002]
  TransferFlags        = 00000000 (USBD_TRANSFER_DIRECTION_OUT, ~USBD_SHORT_TRANSFER_OK)
  TransferBufferLength = 00000007
  TransferBuffer       = 00000000
  TransferBufferMDL    = 822de568
  UrbLink              = 00000000
[826035 ms] UsbSnoop - DispatchAny(f88fe610) : IRP_MJ_INTERNAL_DEVICE_CONTROL
[826035 ms] UsbSnoop - MyDispatchInternalIOCTL(f88ffe80) : fdo=82141030, Irp=81b34008, IRQL=2
[826035 ms]  >>>  URB 742 going down  >>> 
-- URB_FUNCTION_BULK_OR_INTERRUPT_TRANSFER:
  PipeHandle           = 81b38414 [endpoint 0x00000081]
  TransferFlags        = 00000003 (USBD_TRANSFER_DIRECTION_IN, USBD_SHORT_TRANSFER_OK)
  TransferBufferLength = 00000100
  TransferBuffer       = 00000000
  TransferBufferMDL    = 822de568
  UrbLink              = 00000000
[826035 ms] UsbSnoop - MyInternalIOCTLCompletion(f88ffdb0) : fido=81b37020, Irp=81b34008, Context=822f4330, IRQL=2
[826035 ms]  <<<  URB 742 coming back  <<< 
-- URB_FUNCTION_BULK_OR_INTERRUPT_TRANSFER:
  PipeHandle           = 81b38414 [endpoint 0x00000081]
  TransferFlags        = 00000003 (USBD_TRANSFER_DIRECTION_IN, USBD_SHORT_TRANSFER_OK)
  TransferBufferLength = 0000001a
  TransferBuffer       = 00000000
  TransferBufferMDL    = 822de568
    00000000: 00 00 00 15 04 00 00 00 0f 00 08 00 01 00 0e 00
    00000010: 00 08 00 00 00 00 00 00 5e a7
  UrbLink              = 00000000
[826075 ms] UsbSnoop - DispatchAny(f88fe610) : IRP_MJ_INTERNAL_DEVICE_CONTROL
[826075 ms] UsbSnoop - MyDispatchInternalIOCTL(f88ffe80) : fdo=82141030, Irp=81b34008, IRQL=2
[826075 ms]  >>>  URB 743 going down  >>> 
-- URB_FUNCTION_BULK_OR_INTERRUPT_TRANSFER:
  PipeHandle           = 81b38434 [endpoint 0x00000002]
  TransferFlags        = 00000000 (USBD_TRANSFER_DIRECTION_OUT, ~USBD_SHORT_TRANSFER_OK)
  TransferBufferLength = 00000007
  TransferBuffer       = 00000000
  TransferBufferMDL    = 822de568
    00000000: 00 00 00 02 05 e0 00
  UrbLink              = 00000000
[826075 ms] UsbSnoop - MyInternalIOCTLCompletion(f88ffdb0) : fido=81b37020, Irp=81b34008, Context=823094d0, IRQL=2
[826075 ms]  <<<  URB 743 coming back  <<< 
-- URB_FUNCTION_BULK_OR_INTERRUPT_TRANSFER:
  PipeHandle           = 81b38434 [endpoint 0x00000002]
  TransferFlags        = 00000000 (USBD_TRANSFER_DIRECTION_OUT, ~USBD_SHORT_TRANSFER_OK)
  TransferBufferLength = 00000007
  TransferBuffer       = 00000000
  TransferBufferMDL    = 822de568
  UrbLink              = 00000000
[826090 ms] UsbSnoop - DispatchAny(f88fe610) : IRP_MJ_INTERNAL_DEVICE_CONTROL
[826090 ms] UsbSnoop - MyDispatchInternalIOCTL(f88ffe80) : fdo=82141030, Irp=822fa008, IRQL=0
[826090 ms]  >>>  URB 744 going down  >>> 
-- URB_FUNCTION_RESET_PIPE:
  PipeHandle = 81b38414 [endpoint 0x00000081]
[826144 ms] UsbSnoop - MyInternalIOCTLCompletion(f88ffdb0) : fido=00000000, Irp=822fa008, Context=81bbb438, IRQL=0
[826144 ms]  <<<  URB 744 coming back  <<< 
-- URB_FUNCTION_RESET_PIPE:
[826144 ms] UsbSnoop - DispatchAny(f88fe610) : IRP_MJ_INTERNAL_DEVICE_CONTROL
[826144 ms] UsbSnoop - MyDispatchInternalIOCTL(f88ffe80) : fdo=82141030, Irp=822fa008, IRQL=0
[826144 ms]  >>>  URB 745 going down  >>> 
-- URB_FUNCTION_RESET_PIPE:
  PipeHandle = 81b38434 [endpoint 0x00000002]
[826145 ms] UsbSnoop - MyInternalIOCTLCompletion(f88ffdb0) : fido=00000000, Irp=822fa008, Context=823094d0, IRQL=0
[826145 ms]  <<<  URB 745 coming back  <<< 
-- URB_FUNCTION_RESET_PIPE:
[826145 ms] UsbSnoop - DispatchAny(f88fe610) : IRP_MJ_INTERNAL_DEVICE_CONTROL
[826145 ms] UsbSnoop - MyDispatchInternalIOCTL(f88ffe80) : fdo=82141030, Irp=822fa008, IRQL=0
[891589 ms] UsbSnoop - DispatchAny(f88fe610) : IRP_MJ_INTERNAL_DEVICE_CONTROL
[891589 ms] UsbSnoop - MyDispatchInternalIOCTL(f88ffe80) : fdo=82141030, Irp=81cfa008, IRQL=0
[891589 ms]  >>>  URB 746 going down  >>> 
-- URB_FUNCTION_RESET_PIPE:
  PipeHandle = 81b38414 [endpoint 0x00000081]
[891590 ms] UsbSnoop - MyInternalIOCTLCompletion(f88ffdb0) : fido=00000000, Irp=81cfa008, Context=822fe170, IRQL=0
[891590 ms]  <<<  URB 746 coming back  <<< 
-- URB_FUNCTION_RESET_PIPE:
[891590 ms] UsbSnoop - DispatchAny(f88fe610) : IRP_MJ_INTERNAL_DEVICE_CONTROL
[891590 ms] UsbSnoop - MyDispatchInternalIOCTL(f88ffe80) : fdo=82141030, Irp=81cfa008, IRQL=0
[891590 ms]  >>>  URB 747 going down  >>> 
-- URB_FUNCTION_RESET_PIPE:
  PipeHandle = 81b38434 [endpoint 0x00000002]
[891590 ms] UsbSnoop - MyInternalIOCTLCompletion(f88ffdb0) : fido=00000000, Irp=81cfa008, Context=822bfbb0, IRQL=0
[891590 ms]  <<<  URB 747 coming back  <<< 
-- URB_FUNCTION_RESET_PIPE:
[892871 ms] UsbSnoop - DispatchAny(f88fe610) : IRP_MJ_INTERNAL_DEVICE_CONTROL
[892871 ms] UsbSnoop - MyDispatchInternalIOCTL(f88ffe80) : fdo=82141030, Irp=822e2c48, IRQL=2
[892871 ms]  >>>  URB 748 going down  >>> 
-- URB_FUNCTION_BULK_OR_INTERRUPT_TRANSFER:
  PipeHandle           = 81b38434 [endpoint 0x00000002]
  TransferFlags        = 00000000 (USBD_TRANSFER_DIRECTION_OUT, ~USBD_SHORT_TRANSFER_OK)
  TransferBufferLength = 00000009
  TransferBuffer       = 00000000
  TransferBufferMDL    = 81b3b838
    00000000: 00 00 00 04 01 00 00 04 00
  UrbLink              = 00000000
[892871 ms] UsbSnoop - MyInternalIOCTLCompletion(f88ffdb0) : fido=81b37020, Irp=822e2c48, Context=81b6c268, IRQL=2
[892871 ms]  <<<  URB 748 coming back  <<< 
-- URB_FUNCTION_BULK_OR_INTERRUPT_TRANSFER:
  PipeHandle           = 81b38434 [endpoint 0x00000002]
  TransferFlags        = 00000000 (USBD_TRANSFER_DIRECTION_OUT, ~USBD_SHORT_TRANSFER_OK)
  TransferBufferLength = 00000009
  TransferBuffer       = 00000000
  TransferBufferMDL    = 81b3b838
  UrbLink              = 00000000
[892872 ms] UsbSnoop - DispatchAny(f88fe610) : IRP_MJ_INTERNAL_DEVICE_CONTROL
[892872 ms] UsbSnoop - MyDispatchInternalIOCTL(f88ffe80) : fdo=82141030, Irp=822e2c48, IRQL=2
[892872 ms]  >>>  URB 749 going down  >>> 
-- URB_FUNCTION_BULK_OR_INTERRUPT_TRANSFER:
  PipeHandle           = 81b38414 [endpoint 0x00000081]
  TransferFlags        = 00000003 (USBD_TRANSFER_DIRECTION_IN, USBD_SHORT_TRANSFER_OK)
  TransferBufferLength = 00000100
  TransferBuffer       = 00000000
  TransferBufferMDL    = 81b3b838
  UrbLink              = 00000000
[892884 ms] UsbSnoop - MyInternalIOCTLCompletion(f88ffdb0) : fido=81b37020, Irp=822e2c48, Context=81b6c268, IRQL=2
[892884 ms]  <<<  URB 749 coming back  <<< 
-- URB_FUNCTION_BULK_OR_INTERRUPT_TRANSFER:
  PipeHandle           = 81b38414 [endpoint 0x00000081]
  TransferFlags        = 00000003 (USBD_TRANSFER_DIRECTION_IN, USBD_SHORT_TRANSFER_OK)
  TransferBufferLength = 00000009
  TransferBuffer       = 00000000
  TransferBufferMDL    = 81b3b838
    00000000: 00 00 00 04 02 00 00 00 fa
  UrbLink              = 00000000
[892913 ms] UsbSnoop - DispatchAny(f88fe610) : IRP_MJ_INTERNAL_DEVICE_CONTROL
[892913 ms] UsbSnoop - MyDispatchInternalIOCTL(f88ffe80) : fdo=82141030, Irp=822e2c48, IRQL=2
[892913 ms]  >>>  URB 750 going down  >>> 
-- URB_FUNCTION_BULK_OR_INTERRUPT_TRANSFER:
  PipeHandle           = 81b38434 [endpoint 0x00000002]
  TransferFlags        = 00000000 (USBD_TRANSFER_DIRECTION_OUT, ~USBD_SHORT_TRANSFER_OK)
  TransferBufferLength = 00000015
  TransferBuffer       = 00000000
  TransferBufferMDL    = 81b212a8
    00000000: 00 00 00 10 04 00 00 00 0a 00 01 00 03 00 01 00
    00000010: 00 00 00 07 d0
  UrbLink              = 00000000
[892913 ms] UsbSnoop - MyInternalIOCTLCompletion(f88ffdb0) : fido=81b37020, Irp=822e2c48, Context=81c046e8, IRQL=2
[892913 ms]  <<<  URB 750 coming back  <<< 
-- URB_FUNCTION_BULK_OR_INTERRUPT_TRANSFER:
  PipeHandle           = 81b38434 [endpoint 0x00000002]
  TransferFlags        = 00000000 (USBD_TRANSFER_DIRECTION_OUT, ~USBD_SHORT_TRANSFER_OK)
  TransferBufferLength = 00000015
  TransferBuffer       = 00000000
  TransferBufferMDL    = 81b212a8
  UrbLink              = 00000000
[892921 ms] UsbSnoop - DispatchAny(f88fe610) : IRP_MJ_INTERNAL_DEVICE_CONTROL
[892921 ms] UsbSnoop - MyDispatchInternalIOCTL(f88ffe80) : fdo=82141030, Irp=822e2c48, IRQL=2
[892921 ms]  >>>  URB 751 going down  >>> 
-- URB_FUNCTION_BULK_OR_INTERRUPT_TRANSFER:
  PipeHandle           = 81b38414 [endpoint 0x00000081]
  TransferFlags        = 00000003 (USBD_TRANSFER_DIRECTION_IN, USBD_SHORT_TRANSFER_OK)
  TransferBufferLength = 00000100
  TransferBuffer       = 00000000
  TransferBufferMDL    = 81b3b838
  UrbLink              = 00000000
[892921 ms] UsbSnoop - MyInternalIOCTLCompletion(f88ffdb0) : fido=81b37020, Irp=822e2c48, Context=81c046e8, IRQL=2
[892921 ms]  <<<  URB 751 coming back  <<< 
-- URB_FUNCTION_BULK_OR_INTERRUPT_TRANSFER:
  PipeHandle           = 81b38414 [endpoint 0x00000081]
  TransferFlags        = 00000003 (USBD_TRANSFER_DIRECTION_IN, USBD_SHORT_TRANSFER_OK)
  TransferBufferLength = 00000007
  TransferBuffer       = 00000000
  TransferBufferMDL    = 81b3b838
    00000000: 00 00 00 02 05 e0 00
  UrbLink              = 00000000
[892961 ms] UsbSnoop - DispatchAny(f88fe610) : IRP_MJ_INTERNAL_DEVICE_CONTROL
[892961 ms] UsbSnoop - MyDispatchInternalIOCTL(f88ffe80) : fdo=82141030, Irp=822e2c48, IRQL=2
[892961 ms]  >>>  URB 752 going down  >>> 
-- URB_FUNCTION_BULK_OR_INTERRUPT_TRANSFER:
  PipeHandle           = 81b38414 [endpoint 0x00000081]
  TransferFlags        = 00000003 (USBD_TRANSFER_DIRECTION_IN, USBD_SHORT_TRANSFER_OK)
  TransferBufferLength = 00000100
  TransferBuffer       = 00000000
  TransferBufferMDL    = 81b3b838
  UrbLink              = 00000000
[892961 ms] UsbSnoop - MyInternalIOCTLCompletion(f88ffdb0) : fido=81b37020, Irp=822e2c48, Context=81c046e8, IRQL=2
[892961 ms]  <<<  URB 752 coming back  <<< 
-- URB_FUNCTION_BULK_OR_INTERRUPT_TRANSFER:
  PipeHandle           = 81b38414 [endpoint 0x00000081]
  TransferFlags        = 00000003 (USBD_TRANSFER_DIRECTION_IN, USBD_SHORT_TRANSFER_OK)
  TransferBufferLength = 0000000f
  TransferBuffer       = 00000000
  TransferBufferMDL    = 81b3b838
    00000000: 00 00 00 0a 04 00 00 00 04 00 12 00 00 07 d0
  UrbLink              = 00000000
[893001 ms] UsbSnoop - DispatchAny(f88fe610) : IRP_MJ_INTERNAL_DEVICE_CONTROL
[893001 ms] UsbSnoop - MyDispatchInternalIOCTL(f88ffe80) : fdo=82141030, Irp=822e2c48, IRQL=2
[893001 ms]  >>>  URB 753 going down  >>> 
-- URB_FUNCTION_BULK_OR_INTERRUPT_TRANSFER:
  PipeHandle           = 81b38434 [endpoint 0x00000002]
  TransferFlags        = 00000000 (USBD_TRANSFER_DIRECTION_OUT, ~USBD_SHORT_TRANSFER_OK)
  TransferBufferLength = 00000007
  TransferBuffer       = 00000000
  TransferBufferMDL    = 81b3b838
    00000000: 00 00 00 02 05 e0 00
  UrbLink              = 00000000
[893001 ms] UsbSnoop - MyInternalIOCTLCompletion(f88ffdb0) : fido=81b37020, Irp=822e2c48, Context=81c046e8, IRQL=2
[893001 ms]  <<<  URB 753 coming back  <<< 
-- URB_FUNCTION_BULK_OR_INTERRUPT_TRANSFER:
  PipeHandle           = 81b38434 [endpoint 0x00000002]
  TransferFlags        = 00000000 (USBD_TRANSFER_DIRECTION_OUT, ~USBD_SHORT_TRANSFER_OK)
  TransferBufferLength = 00000007
  TransferBuffer       = 00000000
  TransferBufferMDL    = 81b3b838
  UrbLink              = 00000000
[893011 ms] UsbSnoop - DispatchAny(f88fe610) : IRP_MJ_INTERNAL_DEVICE_CONTROL
[893011 ms] UsbSnoop - MyDispatchInternalIOCTL(f88ffe80) : fdo=82141030, Irp=822e2c48, IRQL=2
[893011 ms]  >>>  URB 754 going down  >>> 
-- URB_FUNCTION_BULK_OR_INTERRUPT_TRANSFER:
  PipeHandle           = 81b38434 [endpoint 0x00000002]
  TransferFlags        = 00000000 (USBD_TRANSFER_DIRECTION_OUT, ~USBD_SHORT_TRANSFER_OK)
  TransferBufferLength = 0000000f
  TransferBuffer       = 00000000
  TransferBufferMDL    = 81b3b838
    00000000: 00 00 00 0a 04 00 00 00 04 00 07 00 01 00 22
  UrbLink              = 00000000
[893011 ms] UsbSnoop - MyInternalIOCTLCompletion(f88ffdb0) : fido=81b37020, Irp=822e2c48, Context=81c046e8, IRQL=2
[893011 ms]  <<<  URB 754 coming back  <<< 
-- URB_FUNCTION_BULK_OR_INTERRUPT_TRANSFER:
  PipeHandle           = 81b38434 [endpoint 0x00000002]
  TransferFlags        = 00000000 (USBD_TRANSFER_DIRECTION_OUT, ~USBD_SHORT_TRANSFER_OK)
  TransferBufferLength = 0000000f
  TransferBuffer       = 00000000
  TransferBufferMDL    = 81b3b838
  UrbLink              = 00000000
[893021 ms] UsbSnoop - DispatchAny(f88fe610) : IRP_MJ_INTERNAL_DEVICE_CONTROL
[893021 ms] UsbSnoop - MyDispatchInternalIOCTL(f88ffe80) : fdo=82141030, Irp=822e2c48, IRQL=2
[893021 ms]  >>>  URB 755 going down  >>> 
-- URB_FUNCTION_BULK_OR_INTERRUPT_TRANSFER:
  PipeHandle           = 81b38414 [endpoint 0x00000081]
  TransferFlags        = 00000003 (USBD_TRANSFER_DIRECTION_IN, USBD_SHORT_TRANSFER_OK)
  TransferBufferLength = 00000100
  TransferBuffer       = 00000000
  TransferBufferMDL    = 81b3b838
  UrbLink              = 00000000
[893023 ms] UsbSnoop - MyInternalIOCTLCompletion(f88ffdb0) : fido=81b37020, Irp=822e2c48, Context=81c046e8, IRQL=2
[893023 ms]  <<<  URB 755 coming back  <<< 
-- URB_FUNCTION_BULK_OR_INTERRUPT_TRANSFER:
  PipeHandle           = 81b38414 [endpoint 0x00000081]
  TransferFlags        = 00000003 (USBD_TRANSFER_DIRECTION_IN, USBD_SHORT_TRANSFER_OK)
  TransferBufferLength = 00000007
  TransferBuffer       = 00000000
  TransferBufferMDL    = 81b3b838
    00000000: 00 00 00 02 05 e0 00
  UrbLink              = 00000000
[893061 ms] UsbSnoop - DispatchAny(f88fe610) : IRP_MJ_INTERNAL_DEVICE_CONTROL
[893061 ms] UsbSnoop - MyDispatchInternalIOCTL(f88ffe80) : fdo=82141030, Irp=822e2c48, IRQL=2
[893061 ms]  >>>  URB 756 going down  >>> 
-- URB_FUNCTION_BULK_OR_INTERRUPT_TRANSFER:
  PipeHandle           = 81b38414 [endpoint 0x00000081]
  TransferFlags        = 00000003 (USBD_TRANSFER_DIRECTION_IN, USBD_SHORT_TRANSFER_OK)
  TransferBufferLength = 00000100
  TransferBuffer       = 00000000
  TransferBufferMDL    = 81b3b838
  UrbLink              = 00000000
[893061 ms] UsbSnoop - MyInternalIOCTLCompletion(f88ffdb0) : fido=81b37020, Irp=822e2c48, Context=81b6c268, IRQL=2
[893061 ms]  <<<  URB 756 coming back  <<< 
-- URB_FUNCTION_BULK_OR_INTERRUPT_TRANSFER:
  PipeHandle           = 81b38414 [endpoint 0x00000081]
  TransferFlags        = 00000003 (USBD_TRANSFER_DIRECTION_IN, USBD_SHORT_TRANSFER_OK)
  TransferBufferLength = 0000000f
  TransferBuffer       = 00000000
  TransferBufferMDL    = 81b3b838
    00000000: 00 00 00 0a 04 00 00 00 04 bb 00 00 01 d4 c0
  UrbLink              = 00000000
[893101 ms] UsbSnoop - DispatchAny(f88fe610) : IRP_MJ_INTERNAL_DEVICE_CONTROL
[893101 ms] UsbSnoop - MyDispatchInternalIOCTL(f88ffe80) : fdo=82141030, Irp=822e2c48, IRQL=2
[893101 ms]  >>>  URB 757 going down  >>> 
-- URB_FUNCTION_BULK_OR_INTERRUPT_TRANSFER:
  PipeHandle           = 81b38434 [endpoint 0x00000002]
  TransferFlags        = 00000000 (USBD_TRANSFER_DIRECTION_OUT, ~USBD_SHORT_TRANSFER_OK)
  TransferBufferLength = 00000007
  TransferBuffer       = 00000000
  TransferBufferMDL    = 81b3b838
    00000000: 00 00 00 02 05 e0 00
  UrbLink              = 00000000
[893102 ms] UsbSnoop - MyInternalIOCTLCompletion(f88ffdb0) : fido=81b37020, Irp=822e2c48, Context=81b6c268, IRQL=2
[893102 ms]  <<<  URB 757 coming back  <<< 
-- URB_FUNCTION_BULK_OR_INTERRUPT_TRANSFER:
  PipeHandle           = 81b38434 [endpoint 0x00000002]
  TransferFlags        = 00000000 (USBD_TRANSFER_DIRECTION_OUT, ~USBD_SHORT_TRANSFER_OK)
  TransferBufferLength = 00000007
  TransferBuffer       = 00000000
  TransferBufferMDL    = 81b3b838
  UrbLink              = 00000000
[893111 ms] UsbSnoop - DispatchAny(f88fe610) : IRP_MJ_INTERNAL_DEVICE_CONTROL
[893111 ms] UsbSnoop - MyDispatchInternalIOCTL(f88ffe80) : fdo=82141030, Irp=822e2c48, IRQL=2
[893111 ms]  >>>  URB 758 going down  >>> 
-- URB_FUNCTION_BULK_OR_INTERRUPT_TRANSFER:
  PipeHandle           = 81b38414 [endpoint 0x00000081]
  TransferFlags        = 00000003 (USBD_TRANSFER_DIRECTION_IN, USBD_SHORT_TRANSFER_OK)
  TransferBufferLength = 00000100
  TransferBuffer       = 00000000
  TransferBufferMDL    = 81b3b838
  UrbLink              = 00000000
[893184 ms] UsbSnoop - MyInternalIOCTLCompletion(f88ffdb0) : fido=81b37020, Irp=822e2c48, Context=81b6c268, IRQL=2
[893184 ms]  <<<  URB 758 coming back  <<< 
-- URB_FUNCTION_BULK_OR_INTERRUPT_TRANSFER:
  PipeHandle           = 81b38414 [endpoint 0x00000081]
  TransferFlags        = 00000003 (USBD_TRANSFER_DIRECTION_IN, USBD_SHORT_TRANSFER_OK)
  TransferBufferLength = 000000ff
  TransferBuffer       = 00000000
  TransferBufferMDL    = 81b3b838
    00000000: 00 00 00 fa 03 00 00 03 07 00 08 00 01 00 22 00
    00000010: 03 00 00 00 00 00 00 00 00 00 00 00 00 00 00 00
    00000020: 00 00 00 00 00 00 00 00 00 00 00 00 00 00 00 00
    00000030: 00 00 00 00 00 00 00 00 00 00 00 00 00 00 00 00
    00000040: 00 00 00 00 00 00 00 00 00 00 00 00 00 00 00 00
    00000050: 00 00 00 00 00 00 00 00 00 00 00 00 00 00 00 00
    00000060: 00 00 00 00 00 00 00 00 00 00 00 00 00 00 00 00
    00000070: 00 00 00 00 00 00 00 00 00 00 00 00 00 00 00 00
    00000080: 00 00 00 00 00 00 00 00 00 00 00 00 00 00 00 00
    00000090: 00 00 00 00 00 00 00 00 00 00 00 00 00 00 00 00
    000000a0: 00 00 00 00 00 00 00 00 00 00 00 00 00 00 00 00
    000000b0: 00 00 00 00 00 00 00 00 00 00 00 00 00 00 00 00
    000000c0: 00 00 00 00 00 00 00 00 00 00 00 00 00 00 00 00
    000000d0: 00 00 00 00 00 00 00 00 00 00 00 00 00 00 00 00
    000000e0: 00 00 00 00 00 00 00 00 00 00 00 00 00 00 00 00
    000000f0: 00 00 00 00 00 00 00 00 00 00 00 00 00 00 00
  UrbLink              = 00000000
[893233 ms] UsbSnoop - DispatchAny(f88fe610) : IRP_MJ_INTERNAL_DEVICE_CONTROL
[893233 ms] UsbSnoop - MyDispatchInternalIOCTL(f88ffe80) : fdo=82141030, Irp=822e2c48, IRQL=2
[893233 ms]  >>>  URB 759 going down  >>> 
-- URB_FUNCTION_BULK_OR_INTERRUPT_TRANSFER:
  PipeHandle           = 81b38434 [endpoint 0x00000002]
  TransferFlags        = 00000000 (USBD_TRANSFER_DIRECTION_OUT, ~USBD_SHORT_TRANSFER_OK)
  TransferBufferLength = 00000007
  TransferBuffer       = 00000000
  TransferBufferMDL    = 81b3b838
    00000000: 00 00 00 02 05 e0 00
  UrbLink              = 00000000
[893233 ms] UsbSnoop - MyInternalIOCTLCompletion(f88ffdb0) : fido=81b37020, Irp=822e2c48, Context=821a66e0, IRQL=2
[893233 ms]  <<<  URB 759 coming back  <<< 
-- URB_FUNCTION_BULK_OR_INTERRUPT_TRANSFER:
  PipeHandle           = 81b38434 [endpoint 0x00000002]
  TransferFlags        = 00000000 (USBD_TRANSFER_DIRECTION_OUT, ~USBD_SHORT_TRANSFER_OK)
  TransferBufferLength = 00000007
  TransferBuffer       = 00000000
  TransferBufferMDL    = 81b3b838
  UrbLink              = 00000000
[893242 ms] UsbSnoop - DispatchAny(f88fe610) : IRP_MJ_INTERNAL_DEVICE_CONTROL
[893242 ms] UsbSnoop - MyDispatchInternalIOCTL(f88ffe80) : fdo=82141030, Irp=822e2c48, IRQL=2
[893242 ms]  >>>  URB 760 going down  >>> 
-- URB_FUNCTION_BULK_OR_INTERRUPT_TRANSFER:
  PipeHandle           = 81b38414 [endpoint 0x00000081]
  TransferFlags        = 00000003 (USBD_TRANSFER_DIRECTION_IN, USBD_SHORT_TRANSFER_OK)
  TransferBufferLength = 00000100
  TransferBuffer       = 00000000
  TransferBufferMDL    = 81b3b838
  UrbLink              = 00000000
[893259 ms] UsbSnoop - MyInternalIOCTLCompletion(f88ffdb0) : fido=81b37020, Irp=822e2c48, Context=821a66e0, IRQL=2
[893259 ms]  <<<  URB 760 coming back  <<< 
-- URB_FUNCTION_BULK_OR_INTERRUPT_TRANSFER:
  PipeHandle           = 81b38414 [endpoint 0x00000081]
  TransferFlags        = 00000003 (USBD_TRANSFER_DIRECTION_IN, USBD_SHORT_TRANSFER_OK)
  TransferBufferLength = 000000ff
  TransferBuffer       = 00000000
  TransferBufferMDL    = 81b3b838
    00000000: 00 00 00 fa 03 00 00 00 00 00 00 00 00 00 00 00
    00000010: 00 00 00 00 00 00 00 00 00 00 00 00 00 00 00 00
    00000020: 00 00 00 00 00 00 00 00 00 00 00 00 00 00 00 00
    00000030: 00 00 00 00 00 00 00 00 00 00 00 00 00 00 00 00
    00000040: 00 00 00 00 00 00 00 00 00 00 00 00 00 00 00 00
    00000050: 00 00 00 00 00 00 00 00 00 00 00 00 00 00 00 00
    00000060: 00 00 00 00 00 00 00 00 00 00 00 00 00 00 00 00
    00000070: 00 00 00 00 00 00 00 00 00 00 00 00 00 00 00 00
    00000080: 00 00 00 00 00 00 00 00 00 00 00 00 00 00 00 00
    00000090: 00 00 00 00 00 00 00 00 00 00 00 00 00 00 00 00
    000000a0: 00 00 00 00 00 00 00 00 00 00 00 00 00 00 00 00
    000000b0: 00 00 00 00 00 00 00 00 00 00 00 00 00 00 00 00
    000000c0: 00 00 00 00 00 00 00 00 00 00 00 00 00 00 00 00
    000000d0: 00 00 00 00 00 00 00 00 00 00 00 00 00 00 00 00
    000000e0: 00 00 00 00 00 00 00 00 00 00 00 00 00 00 00 00
    000000f0: 00 00 00 00 00 00 00 00 00 00 00 00 00 00 00
  UrbLink              = 00000000
[893292 ms] UsbSnoop - DispatchAny(f88fe610) : IRP_MJ_INTERNAL_DEVICE_CONTROL
[893292 ms] UsbSnoop - MyDispatchInternalIOCTL(f88ffe80) : fdo=82141030, Irp=822e2c48, IRQL=2
[893292 ms]  >>>  URB 761 going down  >>> 
-- URB_FUNCTION_BULK_OR_INTERRUPT_TRANSFER:
  PipeHandle           = 81b38434 [endpoint 0x00000002]
  TransferFlags        = 00000000 (USBD_TRANSFER_DIRECTION_OUT, ~USBD_SHORT_TRANSFER_OK)
  TransferBufferLength = 00000007
  TransferBuffer       = 00000000
  TransferBufferMDL    = 81b3b838
    00000000: 00 00 00 02 05 e0 00
  UrbLink              = 00000000
[893292 ms] UsbSnoop - MyInternalIOCTLCompletion(f88ffdb0) : fido=81b37020, Irp=822e2c48, Context=81c777b0, IRQL=2
[893292 ms]  <<<  URB 761 coming back  <<< 
-- URB_FUNCTION_BULK_OR_INTERRUPT_TRANSFER:
  PipeHandle           = 81b38434 [endpoint 0x00000002]
  TransferFlags        = 00000000 (USBD_TRANSFER_DIRECTION_OUT, ~USBD_SHORT_TRANSFER_OK)
  TransferBufferLength = 00000007
  TransferBuffer       = 00000000
  TransferBufferMDL    = 81b3b838
  UrbLink              = 00000000
[893302 ms] UsbSnoop - DispatchAny(f88fe610) : IRP_MJ_INTERNAL_DEVICE_CONTROL
[893302 ms] UsbSnoop - MyDispatchInternalIOCTL(f88ffe80) : fdo=82141030, Irp=822e2c48, IRQL=2
[893302 ms]  >>>  URB 762 going down  >>> 
-- URB_FUNCTION_BULK_OR_INTERRUPT_TRANSFER:
  PipeHandle           = 81b38414 [endpoint 0x00000081]
  TransferFlags        = 00000003 (USBD_TRANSFER_DIRECTION_IN, USBD_SHORT_TRANSFER_OK)
  TransferBufferLength = 00000100
  TransferBuffer       = 00000000
  TransferBufferMDL    = 81b3b838
  UrbLink              = 00000000
[893318 ms] UsbSnoop - MyInternalIOCTLCompletion(f88ffdb0) : fido=81b37020, Irp=822e2c48, Context=81c777b0, IRQL=2
[893318 ms]  <<<  URB 762 coming back  <<< 
-- URB_FUNCTION_BULK_OR_INTERRUPT_TRANSFER:
  PipeHandle           = 81b38414 [endpoint 0x00000081]
  TransferFlags        = 00000003 (USBD_TRANSFER_DIRECTION_IN, USBD_SHORT_TRANSFER_OK)
  TransferBufferLength = 000000ff
  TransferBuffer       = 00000000
  TransferBufferMDL    = 81b3b838
    00000000: 00 00 00 fa 03 00 00 00 00 00 00 00 00 00 00 00
    00000010: 00 00 00 00 00 00 00 00 00 00 00 00 00 00 00 00
    00000020: 00 00 00 00 00 00 00 00 00 00 00 00 00 00 00 00
    00000030: 00 00 00 00 00 00 00 00 00 00 00 00 00 00 00 00
    00000040: 00 00 00 00 00 00 00 00 00 00 00 00 00 00 00 00
    00000050: 00 00 00 00 00 00 00 00 00 00 00 00 00 00 00 00
    00000060: 00 00 00 00 00 00 00 00 00 00 00 00 00 00 00 00
    00000070: 00 00 00 00 00 00 00 00 00 00 00 00 00 00 00 00
    00000080: 00 00 00 00 00 00 00 00 00 00 00 00 00 00 00 00
    00000090: 00 00 00 00 00 00 00 00 00 00 00 00 00 00 00 00
    000000a0: 00 00 00 00 00 00 00 00 00 00 00 00 00 00 00 00
    000000b0: 00 00 00 00 00 00 00 00 00 00 00 00 00 00 00 00
    000000c0: 00 00 00 00 00 00 00 00 00 00 00 00 00 00 00 00
    000000d0: 00 00 00 00 00 00 00 00 00 00 00 00 00 00 00 00
    000000e0: 00 00 00 00 00 00 00 00 00 00 00 00 00 00 00 00
    000000f0: 00 00 00 00 00 00 00 00 00 00 00 00 00 00 00
  UrbLink              = 00000000
[893352 ms] UsbSnoop - DispatchAny(f88fe610) : IRP_MJ_INTERNAL_DEVICE_CONTROL
[893352 ms] UsbSnoop - MyDispatchInternalIOCTL(f88ffe80) : fdo=82141030, Irp=822e2c48, IRQL=2
[893352 ms]  >>>  URB 763 going down  >>> 
-- URB_FUNCTION_BULK_OR_INTERRUPT_TRANSFER:
  PipeHandle           = 81b38434 [endpoint 0x00000002]
  TransferFlags        = 00000000 (USBD_TRANSFER_DIRECTION_OUT, ~USBD_SHORT_TRANSFER_OK)
  TransferBufferLength = 00000007
  TransferBuffer       = 00000000
  TransferBufferMDL    = 81b3b838
    00000000: 00 00 00 02 05 e0 00
  UrbLink              = 00000000
[893352 ms] UsbSnoop - MyInternalIOCTLCompletion(f88ffdb0) : fido=81b37020, Irp=822e2c48, Context=8218c6b8, IRQL=2
[893352 ms]  <<<  URB 763 coming back  <<< 
-- URB_FUNCTION_BULK_OR_INTERRUPT_TRANSFER:
  PipeHandle           = 81b38434 [endpoint 0x00000002]
  TransferFlags        = 00000000 (USBD_TRANSFER_DIRECTION_OUT, ~USBD_SHORT_TRANSFER_OK)
  TransferBufferLength = 00000007
  TransferBuffer       = 00000000
  TransferBufferMDL    = 81b3b838
  UrbLink              = 00000000
[893362 ms] UsbSnoop - DispatchAny(f88fe610) : IRP_MJ_INTERNAL_DEVICE_CONTROL
[893362 ms] UsbSnoop - MyDispatchInternalIOCTL(f88ffe80) : fdo=82141030, Irp=822e2c48, IRQL=2
[893362 ms]  >>>  URB 764 going down  >>> 
-- URB_FUNCTION_BULK_OR_INTERRUPT_TRANSFER:
  PipeHandle           = 81b38414 [endpoint 0x00000081]
  TransferFlags        = 00000003 (USBD_TRANSFER_DIRECTION_IN, USBD_SHORT_TRANSFER_OK)
  TransferBufferLength = 00000100
  TransferBuffer       = 00000000
  TransferBufferMDL    = 81b3b838
  UrbLink              = 00000000
[893362 ms] UsbSnoop - MyInternalIOCTLCompletion(f88ffdb0) : fido=81b37020, Irp=822e2c48, Context=8218c6b8, IRQL=2
[893362 ms]  <<<  URB 764 coming back  <<< 
-- URB_FUNCTION_BULK_OR_INTERRUPT_TRANSFER:
  PipeHandle           = 81b38414 [endpoint 0x00000081]
  TransferFlags        = 00000003 (USBD_TRANSFER_DIRECTION_IN, USBD_SHORT_TRANSFER_OK)
  TransferBufferLength = 00000024
  TransferBuffer       = 00000000
  TransferBufferMDL    = 81b3b838
    00000000: 00 00 00 1f 04 00 00 00 00 00 00 00 00 00 00 00
    00000010: 00 00 00 00 00 00 00 00 00 00 00 00 00 00 00 00
    00000020: 00 00 00 00
  UrbLink              = 00000000
[893402 ms] UsbSnoop - DispatchAny(f88fe610) : IRP_MJ_INTERNAL_DEVICE_CONTROL
[893402 ms] UsbSnoop - MyDispatchInternalIOCTL(f88ffe80) : fdo=82141030, Irp=822e2c48, IRQL=2
[893402 ms]  >>>  URB 765 going down  >>> 
-- URB_FUNCTION_BULK_OR_INTERRUPT_TRANSFER:
  PipeHandle           = 81b38434 [endpoint 0x00000002]
  TransferFlags        = 00000000 (USBD_TRANSFER_DIRECTION_OUT, ~USBD_SHORT_TRANSFER_OK)
  TransferBufferLength = 00000007
  TransferBuffer       = 00000000
  TransferBufferMDL    = 81b3b838
    00000000: 00 00 00 02 05 e0 00
  UrbLink              = 00000000
[893402 ms] UsbSnoop - MyInternalIOCTLCompletion(f88ffdb0) : fido=81b37020, Irp=822e2c48, Context=8218c6b8, IRQL=2
[893402 ms]  <<<  URB 765 coming back  <<< 
-- URB_FUNCTION_BULK_OR_INTERRUPT_TRANSFER:
  PipeHandle           = 81b38434 [endpoint 0x00000002]
  TransferFlags        = 00000000 (USBD_TRANSFER_DIRECTION_OUT, ~USBD_SHORT_TRANSFER_OK)
  TransferBufferLength = 00000007
  TransferBuffer       = 00000000
  TransferBufferMDL    = 81b3b838
  UrbLink              = 00000000
[893448 ms] UsbSnoop - DispatchAny(f88fe610) : IRP_MJ_INTERNAL_DEVICE_CONTROL
[893448 ms] UsbSnoop - MyDispatchInternalIOCTL(f88ffe80) : fdo=82141030, Irp=81cfa008, IRQL=0
[893448 ms]  >>>  URB 766 going down  >>> 
-- URB_FUNCTION_RESET_PIPE:
  PipeHandle = 81b38414 [endpoint 0x00000081]
[893454 ms] UsbSnoop - MyInternalIOCTLCompletion(f88ffdb0) : fido=00000000, Irp=81cfa008, Context=8218c6b8, IRQL=0
[893454 ms]  <<<  URB 766 coming back  <<< 
-- URB_FUNCTION_RESET_PIPE:
[893454 ms] UsbSnoop - DispatchAny(f88fe610) : IRP_MJ_INTERNAL_DEVICE_CONTROL
[893454 ms] UsbSnoop - MyDispatchInternalIOCTL(f88ffe80) : fdo=82141030, Irp=81cfa008, IRQL=0
[893454 ms]  >>>  URB 767 going down  >>> 
-- URB_FUNCTION_RESET_PIPE:
  PipeHandle = 81b38434 [endpoint 0x00000002]
[893455 ms] UsbSnoop - MyInternalIOCTLCompletion(f88ffdb0) : fido=00000000, Irp=81cfa008, Context=81c046e8, IRQL=0
[893455 ms]  <<<  URB 767 coming back  <<< 
-- URB_FUNCTION_RESET_PIPE:
[893455 ms] UsbSnoop - DispatchAny(f88fe610) : IRP_MJ_INTERNAL_DEVICE_CONTROL
[893455 ms] UsbSnoop - MyDispatchInternalIOCTL(f88ffe80) : fdo=82141030, Irp=81cfa008, IRQL=0
