[186970 ms] UsbSnoop - DispatchAny(f890e610) : IRP_MJ_INTERNAL_DEVICE_CONTROL
[186970 ms] UsbSnoop - MyDispatchInternalIOCTL(f890fe80) : fdo=81c63810, Irp=81d098c8, IRQL=0
[186970 ms]  >>>  URB 426 going down  >>> 
-- URB_FUNCTION_RESET_PIPE:
  PipeHandle = 81c9d144 [endpoint 0x00000081]
[186971 ms] UsbSnoop - MyInternalIOCTLCompletion(f890fdb0) : fido=00000000, Irp=81d098c8, Context=81b87c90, IRQL=0
[186971 ms]  <<<  URB 426 coming back  <<< 
-- URB_FUNCTION_RESET_PIPE:
[186971 ms] UsbSnoop - DispatchAny(f890e610) : IRP_MJ_INTERNAL_DEVICE_CONTROL
[186971 ms] UsbSnoop - MyDispatchInternalIOCTL(f890fe80) : fdo=81c63810, Irp=81d098c8, IRQL=0
[186971 ms]  >>>  URB 427 going down  >>> 
-- URB_FUNCTION_RESET_PIPE:
  PipeHandle = 81c9d164 [endpoint 0x00000002]
[186979 ms] UsbSnoop - MyInternalIOCTLCompletion(f890fdb0) : fido=00000000, Irp=81d098c8, Context=81ba1c70, IRQL=0
[186979 ms]  <<<  URB 427 coming back  <<< 
-- URB_FUNCTION_RESET_PIPE:
[187972 ms] UsbSnoop - DispatchAny(f890e610) : IRP_MJ_INTERNAL_DEVICE_CONTROL
[187972 ms] UsbSnoop - MyDispatchInternalIOCTL(f890fe80) : fdo=81c63810, Irp=81d098c8, IRQL=0
[187972 ms]  >>>  URB 428 going down  >>> 
-- URB_FUNCTION_RESET_PIPE:
  PipeHandle = 81c9d144 [endpoint 0x00000081]
[187972 ms] UsbSnoop - MyInternalIOCTLCompletion(f890fdb0) : fido=00000000, Irp=81d098c8, Context=81ba1c70, IRQL=0
[187972 ms]  <<<  URB 428 coming back  <<< 
-- URB_FUNCTION_RESET_PIPE:
[187972 ms] UsbSnoop - DispatchAny(f890e610) : IRP_MJ_INTERNAL_DEVICE_CONTROL
[187972 ms] UsbSnoop - MyDispatchInternalIOCTL(f890fe80) : fdo=81c63810, Irp=81d098c8, IRQL=0
[187972 ms]  >>>  URB 429 going down  >>> 
-- URB_FUNCTION_RESET_PIPE:
  PipeHandle = 81c9d164 [endpoint 0x00000002]
[187973 ms] UsbSnoop - MyInternalIOCTLCompletion(f890fdb0) : fido=00000000, Irp=81d098c8, Context=81c87580, IRQL=0
[187973 ms]  <<<  URB 429 coming back  <<< 
-- URB_FUNCTION_RESET_PIPE:
[187973 ms] UsbSnoop - DispatchAny(f890e610) : IRP_MJ_INTERNAL_DEVICE_CONTROL
[187973 ms] UsbSnoop - MyDispatchInternalIOCTL(f890fe80) : fdo=81c63810, Irp=81d098c8, IRQL=0
[188973 ms] UsbSnoop - DispatchAny(f890e610) : IRP_MJ_INTERNAL_DEVICE_CONTROL
[188973 ms] UsbSnoop - MyDispatchInternalIOCTL(f890fe80) : fdo=81c63810, Irp=81d098c8, IRQL=0
[188973 ms]  >>>  URB 430 going down  >>> 
-- URB_FUNCTION_GET_DESCRIPTOR_FROM_DEVICE:
  TransferBufferLength = 00000012
  TransferBuffer       = e1614550
  TransferBufferMDL    = 00000000
  Index                = 00000000
  DescriptorType       = 00000001 (USB_DEVICE_DESCRIPTOR_TYPE)
  LanguageId           = 00000000
[188975 ms] UsbSnoop - MyInternalIOCTLCompletion(f890fdb0) : fido=00000000, Irp=81d098c8, Context=8238c770, IRQL=2
[188975 ms]  <<<  URB 430 coming back  <<< 
-- URB_FUNCTION_CONTROL_TRANSFER:
  PipeHandle           = 81c9d880
  TransferFlags        = 81d0980b (USBD_TRANSFER_DIRECTION_IN, USBD_SHORT_TRANSFER_OK)
  TransferBufferLength = 00000012
  TransferBuffer       = e1614550
  TransferBufferMDL    = 81b61160
    00000000: 12 01 00 02 00 00 00 40 51 04 08 e0 10 01 01 02
    00000010: 00 01
  UrbLink              = 00000000
  SetupPacket          =
    00000000: 80 06 00 01 00 00 12 00
[188975 ms] UsbSnoop - DispatchAny(f890e610) : IRP_MJ_INTERNAL_DEVICE_CONTROL
[188975 ms] UsbSnoop - MyDispatchInternalIOCTL(f890fe80) : fdo=81c63810, Irp=81d098c8, IRQL=0
[188975 ms] UsbSnoop - DispatchAny(f890e610) : IRP_MJ_INTERNAL_DEVICE_CONTROL
[188975 ms] UsbSnoop - MyDispatchInternalIOCTL(f890fe80) : fdo=81c63810, Irp=81d098c8, IRQL=0
[188975 ms]  >>>  URB 431 going down  >>> 
-- URB_FUNCTION_RESET_PIPE:
  PipeHandle = 81c9d144 [endpoint 0x00000081]
[188984 ms] UsbSnoop - MyInternalIOCTLCompletion(f890fdb0) : fido=00000000, Irp=81d098c8, Context=81c87580, IRQL=0
[188984 ms]  <<<  URB 431 coming back  <<< 
-- URB_FUNCTION_RESET_PIPE:
[188984 ms] UsbSnoop - DispatchAny(f890e610) : IRP_MJ_INTERNAL_DEVICE_CONTROL
[188984 ms] UsbSnoop - MyDispatchInternalIOCTL(f890fe80) : fdo=81c63810, Irp=81d098c8, IRQL=0
[188984 ms]  >>>  URB 432 going down  >>> 
-- URB_FUNCTION_RESET_PIPE:
  PipeHandle = 81c9d164 [endpoint 0x00000002]
[188984 ms] UsbSnoop - MyInternalIOCTLCompletion(f890fdb0) : fido=00000000, Irp=81d098c8, Context=81ba1c70, IRQL=0
[188984 ms]  <<<  URB 432 coming back  <<< 
-- URB_FUNCTION_RESET_PIPE:
[190486 ms] UsbSnoop - DispatchAny(f890e610) : IRP_MJ_INTERNAL_DEVICE_CONTROL
[190486 ms] UsbSnoop - MyDispatchInternalIOCTL(f890fe80) : fdo=81c63810, Irp=81d098c8, IRQL=2
[190486 ms]  >>>  URB 433 going down  >>> 
-- URB_FUNCTION_BULK_OR_INTERRUPT_TRANSFER:
  PipeHandle           = 81c9d164 [endpoint 0x00000002]
  TransferFlags        = 00000000 (USBD_TRANSFER_DIRECTION_OUT, ~USBD_SHORT_TRANSFER_OK)
  TransferBufferLength = 00000009
  TransferBuffer       = 00000000
  TransferBufferMDL    = 81b61160
    00000000: 00 00 00 04 01 00 00 04 00
  UrbLink              = 00000000
[190486 ms] UsbSnoop - MyInternalIOCTLCompletion(f890fdb0) : fido=822da020, Irp=81d098c8, Context=822a2438, IRQL=2
[190486 ms]  <<<  URB 433 coming back  <<< 
-- URB_FUNCTION_BULK_OR_INTERRUPT_TRANSFER:
  PipeHandle           = 81c9d164 [endpoint 0x00000002]
  TransferFlags        = 00000000 (USBD_TRANSFER_DIRECTION_OUT, ~USBD_SHORT_TRANSFER_OK)
  TransferBufferLength = 00000009
  TransferBuffer       = 00000000
  TransferBufferMDL    = 81b61160
  UrbLink              = 00000000
[190486 ms] UsbSnoop - DispatchAny(f890e610) : IRP_MJ_INTERNAL_DEVICE_CONTROL
[190486 ms] UsbSnoop - MyDispatchInternalIOCTL(f890fe80) : fdo=81c63810, Irp=81d098c8, IRQL=2
[190486 ms]  >>>  URB 434 going down  >>> 
-- URB_FUNCTION_BULK_OR_INTERRUPT_TRANSFER:
  PipeHandle           = 81c9d144 [endpoint 0x00000081]
  TransferFlags        = 00000003 (USBD_TRANSFER_DIRECTION_IN, USBD_SHORT_TRANSFER_OK)
  TransferBufferLength = 00000100
  TransferBuffer       = 00000000
  TransferBufferMDL    = 81b61160
  UrbLink              = 00000000
[190492 ms] UsbSnoop - MyInternalIOCTLCompletion(f890fdb0) : fido=822da020, Irp=81d098c8, Context=822fea10, IRQL=2
[190492 ms]  <<<  URB 434 coming back  <<< 
-- URB_FUNCTION_BULK_OR_INTERRUPT_TRANSFER:
  PipeHandle           = 81c9d144 [endpoint 0x00000081]
  TransferFlags        = 00000003 (USBD_TRANSFER_DIRECTION_IN, USBD_SHORT_TRANSFER_OK)
  TransferBufferLength = 00000009
  TransferBuffer       = 00000000
  TransferBufferMDL    = 81b61160
    00000000: 00 00 00 04 02 00 00 00 fa
  UrbLink              = 00000000
[190517 ms] UsbSnoop - DispatchAny(f890e610) : IRP_MJ_INTERNAL_DEVICE_CONTROL
[190517 ms] UsbSnoop - MyDispatchInternalIOCTL(f890fe80) : fdo=81c63810, Irp=822f0e48, IRQL=2
[190517 ms]  >>>  URB 435 going down  >>> 
-- URB_FUNCTION_BULK_OR_INTERRUPT_TRANSFER:
  PipeHandle           = 81c9d164 [endpoint 0x00000002]
  TransferFlags        = 00000000 (USBD_TRANSFER_DIRECTION_OUT, ~USBD_SHORT_TRANSFER_OK)
  TransferBufferLength = 00000015
  TransferBuffer       = 00000000
  TransferBufferMDL    = 81cf5428
    00000000: 00 00 00 10 04 00 00 00 0a 00 01 00 03 00 01 00
    00000010: 00 00 00 07 d0
  UrbLink              = 00000000
[190517 ms] UsbSnoop - MyInternalIOCTLCompletion(f890fdb0) : fido=822da020, Irp=822f0e48, Context=81c024b8, IRQL=2
[190517 ms]  <<<  URB 435 coming back  <<< 
-- URB_FUNCTION_BULK_OR_INTERRUPT_TRANSFER:
  PipeHandle           = 81c9d164 [endpoint 0x00000002]
  TransferFlags        = 00000000 (USBD_TRANSFER_DIRECTION_OUT, ~USBD_SHORT_TRANSFER_OK)
  TransferBufferLength = 00000015
  TransferBuffer       = 00000000
  TransferBufferMDL    = 81cf5428
  UrbLink              = 00000000
[190526 ms] UsbSnoop - DispatchAny(f890e610) : IRP_MJ_INTERNAL_DEVICE_CONTROL
[190526 ms] UsbSnoop - MyDispatchInternalIOCTL(f890fe80) : fdo=81c63810, Irp=822f0e48, IRQL=2
[190526 ms]  >>>  URB 436 going down  >>> 
-- URB_FUNCTION_BULK_OR_INTERRUPT_TRANSFER:
  PipeHandle           = 81c9d144 [endpoint 0x00000081]
  TransferFlags        = 00000003 (USBD_TRANSFER_DIRECTION_IN, USBD_SHORT_TRANSFER_OK)
  TransferBufferLength = 00000100
  TransferBuffer       = 00000000
  TransferBufferMDL    = 81cf5428
  UrbLink              = 00000000
[190526 ms] UsbSnoop - MyInternalIOCTLCompletion(f890fdb0) : fido=822da020, Irp=822f0e48, Context=822fea10, IRQL=2
[190526 ms]  <<<  URB 436 coming back  <<< 
-- URB_FUNCTION_BULK_OR_INTERRUPT_TRANSFER:
  PipeHandle           = 81c9d144 [endpoint 0x00000081]
  TransferFlags        = 00000003 (USBD_TRANSFER_DIRECTION_IN, USBD_SHORT_TRANSFER_OK)
  TransferBufferLength = 00000007
  TransferBuffer       = 00000000
  TransferBufferMDL    = 81cf5428
    00000000: 00 00 00 02 05 e0 00
  UrbLink              = 00000000
[190566 ms] UsbSnoop - DispatchAny(f890e610) : IRP_MJ_INTERNAL_DEVICE_CONTROL
[190566 ms] UsbSnoop - MyDispatchInternalIOCTL(f890fe80) : fdo=81c63810, Irp=822f0e48, IRQL=2
[190566 ms]  >>>  URB 437 going down  >>> 
-- URB_FUNCTION_BULK_OR_INTERRUPT_TRANSFER:
  PipeHandle           = 81c9d144 [endpoint 0x00000081]
  TransferFlags        = 00000003 (USBD_TRANSFER_DIRECTION_IN, USBD_SHORT_TRANSFER_OK)
  TransferBufferLength = 00000100
  TransferBuffer       = 00000000
  TransferBufferMDL    = 81cf5428
  UrbLink              = 00000000
[190566 ms] UsbSnoop - MyInternalIOCTLCompletion(f890fdb0) : fido=822da020, Irp=822f0e48, Context=81b87c90, IRQL=2
[190566 ms]  <<<  URB 437 coming back  <<< 
-- URB_FUNCTION_BULK_OR_INTERRUPT_TRANSFER:
  PipeHandle           = 81c9d144 [endpoint 0x00000081]
  TransferFlags        = 00000003 (USBD_TRANSFER_DIRECTION_IN, USBD_SHORT_TRANSFER_OK)
  TransferBufferLength = 0000000f
  TransferBuffer       = 00000000
  TransferBufferMDL    = 81cf5428
    00000000: 00 00 00 0a 04 00 00 00 04 00 12 00 00 07 d0
  UrbLink              = 00000000
[190606 ms] UsbSnoop - DispatchAny(f890e610) : IRP_MJ_INTERNAL_DEVICE_CONTROL
[190606 ms] UsbSnoop - MyDispatchInternalIOCTL(f890fe80) : fdo=81c63810, Irp=822f0e48, IRQL=2
[190606 ms]  >>>  URB 438 going down  >>> 
-- URB_FUNCTION_BULK_OR_INTERRUPT_TRANSFER:
  PipeHandle           = 81c9d164 [endpoint 0x00000002]
  TransferFlags        = 00000000 (USBD_TRANSFER_DIRECTION_OUT, ~USBD_SHORT_TRANSFER_OK)
  TransferBufferLength = 00000007
  TransferBuffer       = 00000000
  TransferBufferMDL    = 81cf5428
    00000000: 00 00 00 02 05 e0 00
  UrbLink              = 00000000
[190606 ms] UsbSnoop - MyInternalIOCTLCompletion(f890fdb0) : fido=822da020, Irp=822f0e48, Context=822fea10, IRQL=2
[190606 ms]  <<<  URB 438 coming back  <<< 
-- URB_FUNCTION_BULK_OR_INTERRUPT_TRANSFER:
  PipeHandle           = 81c9d164 [endpoint 0x00000002]
  TransferFlags        = 00000000 (USBD_TRANSFER_DIRECTION_OUT, ~USBD_SHORT_TRANSFER_OK)
  TransferBufferLength = 00000007
  TransferBuffer       = 00000000
  TransferBufferMDL    = 81cf5428
  UrbLink              = 00000000
[190616 ms] UsbSnoop - DispatchAny(f890e610) : IRP_MJ_INTERNAL_DEVICE_CONTROL
[190616 ms] UsbSnoop - MyDispatchInternalIOCTL(f890fe80) : fdo=81c63810, Irp=822f0e48, IRQL=2
[190616 ms]  >>>  URB 439 going down  >>> 
-- URB_FUNCTION_BULK_OR_INTERRUPT_TRANSFER:
  PipeHandle           = 81c9d164 [endpoint 0x00000002]
  TransferFlags        = 00000000 (USBD_TRANSFER_DIRECTION_OUT, ~USBD_SHORT_TRANSFER_OK)
  TransferBufferLength = 00000029
  TransferBuffer       = 00000000
  TransferBufferMDL    = 81cf5428
    00000000: 00 00 00 24 04 00 00 00 1e 00 07 00 0e 00 0b 00
    00000010: 04 00 06 00 07 00 01 00 02 00 0a 00 37 00 0d 00
    00000020: 38 00 09 00 0e 00 2d 00 03
  UrbLink              = 00000000
[190616 ms] UsbSnoop - MyInternalIOCTLCompletion(f890fdb0) : fido=822da020, Irp=822f0e48, Context=81c88a38, IRQL=2
[190616 ms]  <<<  URB 439 coming back  <<< 
-- URB_FUNCTION_BULK_OR_INTERRUPT_TRANSFER:
  PipeHandle           = 81c9d164 [endpoint 0x00000002]
  TransferFlags        = 00000000 (USBD_TRANSFER_DIRECTION_OUT, ~USBD_SHORT_TRANSFER_OK)
  TransferBufferLength = 00000029
  TransferBuffer       = 00000000
  TransferBufferMDL    = 81cf5428
  UrbLink              = 00000000
[190626 ms] UsbSnoop - DispatchAny(f890e610) : IRP_MJ_INTERNAL_DEVICE_CONTROL
[190626 ms] UsbSnoop - MyDispatchInternalIOCTL(f890fe80) : fdo=81c63810, Irp=822f0e48, IRQL=2
[190626 ms]  >>>  URB 440 going down  >>> 
-- URB_FUNCTION_BULK_OR_INTERRUPT_TRANSFER:
  PipeHandle           = 81c9d144 [endpoint 0x00000081]
  TransferFlags        = 00000003 (USBD_TRANSFER_DIRECTION_IN, USBD_SHORT_TRANSFER_OK)
  TransferBufferLength = 00000100
  TransferBuffer       = 00000000
  TransferBufferMDL    = 81cf5428
  UrbLink              = 00000000
[190626 ms] UsbSnoop - MyInternalIOCTLCompletion(f890fdb0) : fido=822da020, Irp=822f0e48, Context=8218efe8, IRQL=2
[190626 ms]  <<<  URB 440 coming back  <<< 
-- URB_FUNCTION_BULK_OR_INTERRUPT_TRANSFER:
  PipeHandle           = 81c9d144 [endpoint 0x00000081]
  TransferFlags        = 00000003 (USBD_TRANSFER_DIRECTION_IN, USBD_SHORT_TRANSFER_OK)
  TransferBufferLength = 00000007
  TransferBuffer       = 00000000
  TransferBufferMDL    = 81cf5428
    00000000: 00 00 00 02 05 e0 00
  UrbLink              = 00000000
[190666 ms] UsbSnoop - DispatchAny(f890e610) : IRP_MJ_INTERNAL_DEVICE_CONTROL
[190666 ms] UsbSnoop - MyDispatchInternalIOCTL(f890fe80) : fdo=81c63810, Irp=822f0e48, IRQL=2
[190666 ms]  >>>  URB 441 going down  >>> 
-- URB_FUNCTION_BULK_OR_INTERRUPT_TRANSFER:
  PipeHandle           = 81c9d144 [endpoint 0x00000081]
  TransferFlags        = 00000003 (USBD_TRANSFER_DIRECTION_IN, USBD_SHORT_TRANSFER_OK)
  TransferBufferLength = 00000100
  TransferBuffer       = 00000000
  TransferBufferMDL    = 81cf5428
  UrbLink              = 00000000
[190666 ms] UsbSnoop - MyInternalIOCTLCompletion(f890fdb0) : fido=822da020, Irp=822f0e48, Context=81c024b8, IRQL=2
[190666 ms]  <<<  URB 441 coming back  <<< 
-- URB_FUNCTION_BULK_OR_INTERRUPT_TRANSFER:
  PipeHandle           = 81c9d144 [endpoint 0x00000081]
  TransferFlags        = 00000003 (USBD_TRANSFER_DIRECTION_IN, USBD_SHORT_TRANSFER_OK)
  TransferBufferLength = 0000000f
  TransferBuffer       = 00000000
  TransferBufferMDL    = 81cf5428
    00000000: 00 00 00 0a 04 00 00 00 04 bb 00 00 01 d4 c0
  UrbLink              = 00000000
[190706 ms] UsbSnoop - DispatchAny(f890e610) : IRP_MJ_INTERNAL_DEVICE_CONTROL
[190706 ms] UsbSnoop - MyDispatchInternalIOCTL(f890fe80) : fdo=81c63810, Irp=822f0e48, IRQL=2
[190706 ms]  >>>  URB 442 going down  >>> 
-- URB_FUNCTION_BULK_OR_INTERRUPT_TRANSFER:
  PipeHandle           = 81c9d164 [endpoint 0x00000002]
  TransferFlags        = 00000000 (USBD_TRANSFER_DIRECTION_OUT, ~USBD_SHORT_TRANSFER_OK)
  TransferBufferLength = 00000007
  TransferBuffer       = 00000000
  TransferBufferMDL    = 81cf5428
    00000000: 00 00 00 02 05 e0 00
  UrbLink              = 00000000
[190706 ms] UsbSnoop - MyInternalIOCTLCompletion(f890fdb0) : fido=822da020, Irp=822f0e48, Context=81b87c90, IRQL=2
[190706 ms]  <<<  URB 442 coming back  <<< 
-- URB_FUNCTION_BULK_OR_INTERRUPT_TRANSFER:
  PipeHandle           = 81c9d164 [endpoint 0x00000002]
  TransferFlags        = 00000000 (USBD_TRANSFER_DIRECTION_OUT, ~USBD_SHORT_TRANSFER_OK)
  TransferBufferLength = 00000007
  TransferBuffer       = 00000000
  TransferBufferMDL    = 81cf5428
  UrbLink              = 00000000
[190716 ms] UsbSnoop - DispatchAny(f890e610) : IRP_MJ_INTERNAL_DEVICE_CONTROL
[190716 ms] UsbSnoop - MyDispatchInternalIOCTL(f890fe80) : fdo=81c63810, Irp=822f0e48, IRQL=2
[190716 ms]  >>>  URB 443 going down  >>> 
-- URB_FUNCTION_BULK_OR_INTERRUPT_TRANSFER:
  PipeHandle           = 81c9d144 [endpoint 0x00000081]
  TransferFlags        = 00000003 (USBD_TRANSFER_DIRECTION_IN, USBD_SHORT_TRANSFER_OK)
  TransferBufferLength = 00000100
  TransferBuffer       = 00000000
  TransferBufferMDL    = 81cf5428
  UrbLink              = 00000000
[190776 ms] UsbSnoop - MyInternalIOCTLCompletion(f890fdb0) : fido=822da020, Irp=822f0e48, Context=822fea10, IRQL=2
[190776 ms]  <<<  URB 443 coming back  <<< 
-- URB_FUNCTION_BULK_OR_INTERRUPT_TRANSFER:
  PipeHandle           = 81c9d144 [endpoint 0x00000081]
  TransferFlags        = 00000003 (USBD_TRANSFER_DIRECTION_IN, USBD_SHORT_TRANSFER_OK)
  TransferBufferLength = 00000095
  TransferBuffer       = 00000000
  TransferBufferMDL    = 81cf5428
    00000000: 00 00 00 90 04 00 00 00 8a 00 08 00 0e 00 0b 00
    00000010: 00 04 00 02 28 00 00 04 00 00 02 00 03 00 06 00
    00000020: 00 01 09 00 07 00 00 01 01 00 01 00 00 04 00 00
    00000030: 00 0a 00 02 00 00 19 54 49 2d 38 34 20 50 6c 75
    00000040: 73 20 53 69 6c 76 65 72 20 45 64 69 74 69 6f 6e
    00000050: 00 0a 00 00 01 01 00 37 00 00 01 01 00 0d 00 00
    00000060: 08 00 00 00 00 00 00 5e fd 00 38 00 00 01 00 00
    00000070: 09 00 00 04 00 01 00 00 00 0e 00 00 08 00 00 00
    00000080: 00 00 00 5e d0 00 2d 00 00 01 01 00 03 00 00 05
    00000090: 0a 32 cc e3 01
  UrbLink              = 00000000
[190819 ms] UsbSnoop - DispatchAny(f890e610) : IRP_MJ_INTERNAL_DEVICE_CONTROL
[190819 ms] UsbSnoop - MyDispatchInternalIOCTL(f890fe80) : fdo=81c63810, Irp=822f0e48, IRQL=2
[190819 ms]  >>>  URB 444 going down  >>> 
-- URB_FUNCTION_BULK_OR_INTERRUPT_TRANSFER:
  PipeHandle           = 81c9d164 [endpoint 0x00000002]
  TransferFlags        = 00000000 (USBD_TRANSFER_DIRECTION_OUT, ~USBD_SHORT_TRANSFER_OK)
  TransferBufferLength = 00000007
  TransferBuffer       = 00000000
  TransferBufferMDL    = 81cf5428
    00000000: 00 00 00 02 05 e0 00
  UrbLink              = 00000000
[190819 ms] UsbSnoop - MyInternalIOCTLCompletion(f890fdb0) : fido=822da020, Irp=822f0e48, Context=81c024b8, IRQL=2
[190819 ms]  <<<  URB 444 coming back  <<< 
-- URB_FUNCTION_BULK_OR_INTERRUPT_TRANSFER:
  PipeHandle           = 81c9d164 [endpoint 0x00000002]
  TransferFlags        = 00000000 (USBD_TRANSFER_DIRECTION_OUT, ~USBD_SHORT_TRANSFER_OK)
  TransferBufferLength = 00000007
  TransferBuffer       = 00000000
  TransferBufferMDL    = 81cf5428
  UrbLink              = 00000000
[191077 ms] UsbSnoop - DispatchAny(f890e610) : IRP_MJ_INTERNAL_DEVICE_CONTROL
[191077 ms] UsbSnoop - MyDispatchInternalIOCTL(f890fe80) : fdo=81c63810, Irp=822f0e48, IRQL=2
[191077 ms]  >>>  URB 445 going down  >>> 
-- URB_FUNCTION_BULK_OR_INTERRUPT_TRANSFER:
  PipeHandle           = 81c9d164 [endpoint 0x00000002]
  TransferFlags        = 00000000 (USBD_TRANSFER_DIRECTION_OUT, ~USBD_SHORT_TRANSFER_OK)
  TransferBufferLength = 00000009
  TransferBuffer       = 00000000
  TransferBufferMDL    = 81cf5428
    00000000: 00 00 00 04 01 00 00 04 00
  UrbLink              = 00000000
[191077 ms] UsbSnoop - MyInternalIOCTLCompletion(f890fdb0) : fido=822da020, Irp=822f0e48, Context=822fea10, IRQL=2
[191077 ms]  <<<  URB 445 coming back  <<< 
-- URB_FUNCTION_BULK_OR_INTERRUPT_TRANSFER:
  PipeHandle           = 81c9d164 [endpoint 0x00000002]
  TransferFlags        = 00000000 (USBD_TRANSFER_DIRECTION_OUT, ~USBD_SHORT_TRANSFER_OK)
  TransferBufferLength = 00000009
  TransferBuffer       = 00000000
  TransferBufferMDL    = 81cf5428
  UrbLink              = 00000000
[191077 ms] UsbSnoop - DispatchAny(f890e610) : IRP_MJ_INTERNAL_DEVICE_CONTROL
[191077 ms] UsbSnoop - MyDispatchInternalIOCTL(f890fe80) : fdo=81c63810, Irp=822f0e48, IRQL=2
[191077 ms]  >>>  URB 446 going down  >>> 
-- URB_FUNCTION_BULK_OR_INTERRUPT_TRANSFER:
  PipeHandle           = 81c9d144 [endpoint 0x00000081]
  TransferFlags        = 00000003 (USBD_TRANSFER_DIRECTION_IN, USBD_SHORT_TRANSFER_OK)
  TransferBufferLength = 00000100
  TransferBuffer       = 00000000
  TransferBufferMDL    = 81cf5428
  UrbLink              = 00000000
[191086 ms] UsbSnoop - MyInternalIOCTLCompletion(f890fdb0) : fido=822da020, Irp=822f0e48, Context=822de5c8, IRQL=2
[191086 ms]  <<<  URB 446 coming back  <<< 
-- URB_FUNCTION_BULK_OR_INTERRUPT_TRANSFER:
  PipeHandle           = 81c9d144 [endpoint 0x00000081]
  TransferFlags        = 00000003 (USBD_TRANSFER_DIRECTION_IN, USBD_SHORT_TRANSFER_OK)
  TransferBufferLength = 00000009
  TransferBuffer       = 00000000
  TransferBufferMDL    = 81cf5428
    00000000: 00 00 00 04 02 00 00 00 fa
  UrbLink              = 00000000
[191107 ms] UsbSnoop - DispatchAny(f890e610) : IRP_MJ_INTERNAL_DEVICE_CONTROL
[191107 ms] UsbSnoop - MyDispatchInternalIOCTL(f890fe80) : fdo=81c63810, Irp=822f0e48, IRQL=2
[191107 ms]  >>>  URB 447 going down  >>> 
-- URB_FUNCTION_BULK_OR_INTERRUPT_TRANSFER:
  PipeHandle           = 81c9d164 [endpoint 0x00000002]
  TransferFlags        = 00000000 (USBD_TRANSFER_DIRECTION_OUT, ~USBD_SHORT_TRANSFER_OK)
  TransferBufferLength = 00000015
  TransferBuffer       = 00000000
  TransferBufferMDL    = 81cf5428
    00000000: 00 00 00 10 04 00 00 00 0a 00 01 00 03 00 01 00
    00000010: 00 00 00 07 d0
  UrbLink              = 00000000
[191107 ms] UsbSnoop - MyInternalIOCTLCompletion(f890fdb0) : fido=822da020, Irp=822f0e48, Context=81b87c90, IRQL=2
[191107 ms]  <<<  URB 447 coming back  <<< 
-- URB_FUNCTION_BULK_OR_INTERRUPT_TRANSFER:
  PipeHandle           = 81c9d164 [endpoint 0x00000002]
  TransferFlags        = 00000000 (USBD_TRANSFER_DIRECTION_OUT, ~USBD_SHORT_TRANSFER_OK)
  TransferBufferLength = 00000015
  TransferBuffer       = 00000000
  TransferBufferMDL    = 81cf5428
  UrbLink              = 00000000
[191117 ms] UsbSnoop - DispatchAny(f890e610) : IRP_MJ_INTERNAL_DEVICE_CONTROL
[191117 ms] UsbSnoop - MyDispatchInternalIOCTL(f890fe80) : fdo=81c63810, Irp=822f0e48, IRQL=2
[191117 ms]  >>>  URB 448 going down  >>> 
-- URB_FUNCTION_BULK_OR_INTERRUPT_TRANSFER:
  PipeHandle           = 81c9d144 [endpoint 0x00000081]
  TransferFlags        = 00000003 (USBD_TRANSFER_DIRECTION_IN, USBD_SHORT_TRANSFER_OK)
  TransferBufferLength = 00000100
  TransferBuffer       = 00000000
  TransferBufferMDL    = 81cf5428
  UrbLink              = 00000000
[191117 ms] UsbSnoop - MyInternalIOCTLCompletion(f890fdb0) : fido=822da020, Irp=822f0e48, Context=822de5c8, IRQL=2
[191117 ms]  <<<  URB 448 coming back  <<< 
-- URB_FUNCTION_BULK_OR_INTERRUPT_TRANSFER:
  PipeHandle           = 81c9d144 [endpoint 0x00000081]
  TransferFlags        = 00000003 (USBD_TRANSFER_DIRECTION_IN, USBD_SHORT_TRANSFER_OK)
  TransferBufferLength = 00000007
  TransferBuffer       = 00000000
  TransferBufferMDL    = 81cf5428
    00000000: 00 00 00 02 05 e0 00
  UrbLink              = 00000000
[191157 ms] UsbSnoop - DispatchAny(f890e610) : IRP_MJ_INTERNAL_DEVICE_CONTROL
[191157 ms] UsbSnoop - MyDispatchInternalIOCTL(f890fe80) : fdo=81c63810, Irp=822f0e48, IRQL=2
[191157 ms]  >>>  URB 449 going down  >>> 
-- URB_FUNCTION_BULK_OR_INTERRUPT_TRANSFER:
  PipeHandle           = 81c9d144 [endpoint 0x00000081]
  TransferFlags        = 00000003 (USBD_TRANSFER_DIRECTION_IN, USBD_SHORT_TRANSFER_OK)
  TransferBufferLength = 00000100
  TransferBuffer       = 00000000
  TransferBufferMDL    = 81cf5428
  UrbLink              = 00000000
[191157 ms] UsbSnoop - MyInternalIOCTLCompletion(f890fdb0) : fido=822da020, Irp=822f0e48, Context=81c024b8, IRQL=2
[191157 ms]  <<<  URB 449 coming back  <<< 
-- URB_FUNCTION_BULK_OR_INTERRUPT_TRANSFER:
  PipeHandle           = 81c9d144 [endpoint 0x00000081]
  TransferFlags        = 00000003 (USBD_TRANSFER_DIRECTION_IN, USBD_SHORT_TRANSFER_OK)
  TransferBufferLength = 0000000f
  TransferBuffer       = 00000000
  TransferBufferMDL    = 81cf5428
    00000000: 00 00 00 0a 04 00 00 00 04 00 12 00 00 07 d0
  UrbLink              = 00000000
[191197 ms] UsbSnoop - DispatchAny(f890e610) : IRP_MJ_INTERNAL_DEVICE_CONTROL
[191197 ms] UsbSnoop - MyDispatchInternalIOCTL(f890fe80) : fdo=81c63810, Irp=822e9640, IRQL=2
[191197 ms]  >>>  URB 450 going down  >>> 
-- URB_FUNCTION_BULK_OR_INTERRUPT_TRANSFER:
  PipeHandle           = 81c9d164 [endpoint 0x00000002]
  TransferFlags        = 00000000 (USBD_TRANSFER_DIRECTION_OUT, ~USBD_SHORT_TRANSFER_OK)
  TransferBufferLength = 00000007
  TransferBuffer       = 00000000
  TransferBufferMDL    = 81cf5428
    00000000: 00 00 00 02 05 e0 00
  UrbLink              = 00000000
[191197 ms] UsbSnoop - MyInternalIOCTLCompletion(f890fdb0) : fido=822da020, Irp=822e9640, Context=81bc6e50, IRQL=2
[191197 ms]  <<<  URB 450 coming back  <<< 
-- URB_FUNCTION_BULK_OR_INTERRUPT_TRANSFER:
  PipeHandle           = 81c9d164 [endpoint 0x00000002]
  TransferFlags        = 00000000 (USBD_TRANSFER_DIRECTION_OUT, ~USBD_SHORT_TRANSFER_OK)
  TransferBufferLength = 00000007
  TransferBuffer       = 00000000
  TransferBufferMDL    = 81cf5428
  UrbLink              = 00000000
[191207 ms] UsbSnoop - DispatchAny(f890e610) : IRP_MJ_INTERNAL_DEVICE_CONTROL
[191207 ms] UsbSnoop - MyDispatchInternalIOCTL(f890fe80) : fdo=81c63810, Irp=822e9640, IRQL=2
[191207 ms]  >>>  URB 451 going down  >>> 
-- URB_FUNCTION_BULK_OR_INTERRUPT_TRANSFER:
  PipeHandle           = 81c9d164 [endpoint 0x00000002]
  TransferFlags        = 00000000 (USBD_TRANSFER_DIRECTION_OUT, ~USBD_SHORT_TRANSFER_OK)
  TransferBufferLength = 0000000f
  TransferBuffer       = 00000000
  TransferBufferMDL    = 81cf5428
    00000000: 00 00 00 0a 04 00 00 00 04 00 07 00 01 00 31
  UrbLink              = 00000000
[191207 ms] UsbSnoop - MyInternalIOCTLCompletion(f890fdb0) : fido=822da020, Irp=822e9640, Context=8218efe8, IRQL=2
[191207 ms]  <<<  URB 451 coming back  <<< 
-- URB_FUNCTION_BULK_OR_INTERRUPT_TRANSFER:
  PipeHandle           = 81c9d164 [endpoint 0x00000002]
  TransferFlags        = 00000000 (USBD_TRANSFER_DIRECTION_OUT, ~USBD_SHORT_TRANSFER_OK)
  TransferBufferLength = 0000000f
  TransferBuffer       = 00000000
  TransferBufferMDL    = 81cf5428
  UrbLink              = 00000000
[191217 ms] UsbSnoop - DispatchAny(f890e610) : IRP_MJ_INTERNAL_DEVICE_CONTROL
[191217 ms] UsbSnoop - MyDispatchInternalIOCTL(f890fe80) : fdo=81c63810, Irp=822e9640, IRQL=2
[191217 ms]  >>>  URB 452 going down  >>> 
-- URB_FUNCTION_BULK_OR_INTERRUPT_TRANSFER:
  PipeHandle           = 81c9d144 [endpoint 0x00000081]
  TransferFlags        = 00000003 (USBD_TRANSFER_DIRECTION_IN, USBD_SHORT_TRANSFER_OK)
  TransferBufferLength = 00000100
  TransferBuffer       = 00000000
  TransferBufferMDL    = 81cf5428
  UrbLink              = 00000000
[191217 ms] UsbSnoop - MyInternalIOCTLCompletion(f890fdb0) : fido=822da020, Irp=822e9640, Context=81b87c90, IRQL=2
[191217 ms]  <<<  URB 452 coming back  <<< 
-- URB_FUNCTION_BULK_OR_INTERRUPT_TRANSFER:
  PipeHandle           = 81c9d144 [endpoint 0x00000081]
  TransferFlags        = 00000003 (USBD_TRANSFER_DIRECTION_IN, USBD_SHORT_TRANSFER_OK)
  TransferBufferLength = 00000007
  TransferBuffer       = 00000000
  TransferBufferMDL    = 81cf5428
    00000000: 00 00 00 02 05 e0 00
  UrbLink              = 00000000
[191257 ms] UsbSnoop - DispatchAny(f890e610) : IRP_MJ_INTERNAL_DEVICE_CONTROL
[191257 ms] UsbSnoop - MyDispatchInternalIOCTL(f890fe80) : fdo=81c63810, Irp=822e9640, IRQL=2
[191257 ms]  >>>  URB 453 going down  >>> 
-- URB_FUNCTION_BULK_OR_INTERRUPT_TRANSFER:
  PipeHandle           = 81c9d144 [endpoint 0x00000081]
  TransferFlags        = 00000003 (USBD_TRANSFER_DIRECTION_IN, USBD_SHORT_TRANSFER_OK)
  TransferBufferLength = 00000100
  TransferBuffer       = 00000000
  TransferBufferMDL    = 81cf5428
  UrbLink              = 00000000
[191257 ms] UsbSnoop - MyInternalIOCTLCompletion(f890fdb0) : fido=822da020, Irp=822e9640, Context=822de5c8, IRQL=2
[191257 ms]  <<<  URB 453 coming back  <<< 
-- URB_FUNCTION_BULK_OR_INTERRUPT_TRANSFER:
  PipeHandle           = 81c9d144 [endpoint 0x00000081]
  TransferFlags        = 00000003 (USBD_TRANSFER_DIRECTION_IN, USBD_SHORT_TRANSFER_OK)
  TransferBufferLength = 0000000f
  TransferBuffer       = 00000000
  TransferBufferMDL    = 81cf5428
    00000000: 00 00 00 0a 04 00 00 00 04 bb 00 00 01 d4 c0
  UrbLink              = 00000000
[191297 ms] UsbSnoop - DispatchAny(f890e610) : IRP_MJ_INTERNAL_DEVICE_CONTROL
[191297 ms] UsbSnoop - MyDispatchInternalIOCTL(f890fe80) : fdo=81c63810, Irp=822e9640, IRQL=2
[191297 ms]  >>>  URB 454 going down  >>> 
-- URB_FUNCTION_BULK_OR_INTERRUPT_TRANSFER:
  PipeHandle           = 81c9d164 [endpoint 0x00000002]
  TransferFlags        = 00000000 (USBD_TRANSFER_DIRECTION_OUT, ~USBD_SHORT_TRANSFER_OK)
  TransferBufferLength = 00000007
  TransferBuffer       = 00000000
  TransferBufferMDL    = 81cf5428
    00000000: 00 00 00 02 05 e0 00
  UrbLink              = 00000000
[191297 ms] UsbSnoop - MyInternalIOCTLCompletion(f890fdb0) : fido=822da020, Irp=822e9640, Context=81c024b8, IRQL=2
[191297 ms]  <<<  URB 454 coming back  <<< 
-- URB_FUNCTION_BULK_OR_INTERRUPT_TRANSFER:
  PipeHandle           = 81c9d164 [endpoint 0x00000002]
  TransferFlags        = 00000000 (USBD_TRANSFER_DIRECTION_OUT, ~USBD_SHORT_TRANSFER_OK)
  TransferBufferLength = 00000007
  TransferBuffer       = 00000000
  TransferBufferMDL    = 81cf5428
  UrbLink              = 00000000
[191307 ms] UsbSnoop - DispatchAny(f890e610) : IRP_MJ_INTERNAL_DEVICE_CONTROL
[191307 ms] UsbSnoop - MyDispatchInternalIOCTL(f890fe80) : fdo=81c63810, Irp=822e9640, IRQL=2
[191307 ms]  >>>  URB 455 going down  >>> 
-- URB_FUNCTION_BULK_OR_INTERRUPT_TRANSFER:
  PipeHandle           = 81c9d144 [endpoint 0x00000081]
  TransferFlags        = 00000003 (USBD_TRANSFER_DIRECTION_IN, USBD_SHORT_TRANSFER_OK)
  TransferBufferLength = 00000100
  TransferBuffer       = 00000000
  TransferBufferMDL    = 81cf5428
  UrbLink              = 00000000
[199116 ms] UsbSnoop - MyInternalIOCTLCompletion(f890fdb0) : fido=822da020, Irp=822e9640, Context=81bc6e50, IRQL=2
[199116 ms]  <<<  URB 455 coming back  <<< 
-- URB_FUNCTION_BULK_OR_INTERRUPT_TRANSFER:
  PipeHandle           = 81c9d144 [endpoint 0x00000081]
  TransferFlags        = 00000003 (USBD_TRANSFER_DIRECTION_IN, USBD_SHORT_TRANSFER_OK)
  TransferBufferLength = 000000ff
  TransferBuffer       = 00000000
  TransferBufferMDL    = 81cf5428
    00000000: 00 00 00 fa 03 00 00 03 fe 00 08 00 01 00 31 00
    00000010: 03 f7 0a 15 0a 32 cc e3 01 0a 2d 40 00 00 00 00
    00000020: 00 00 00 00 00 00 00 00 00 00 00 00 00 00 00 00
    00000030: 00 00 00 00 00 00 00 00 00 00 00 00 00 00 00 00
    00000040: 00 00 00 00 00 00 00 00 00 00 00 00 00 00 00 00
    00000050: 00 00 00 00 00 00 00 00 00 00 00 00 04 12 21 18
    00000060: 03 26 09 04 0b d4 31 b0 02 0d 40 a4 f7 87 78 b9
    00000070: da 56 1a 21 97 57 2e 90 de 87 7a 0b 6c 5f 63 2c
    00000080: 01 8a 32 17 9b 65 73 af b1 a1 1b 2f 0c 0b 67 b8
    00000090: f7 84 22 44 04 bd 33 76 f8 06 2e 82 57 ff 63 a1
    000000a0: c9 27 8e f4 46 8e b1 ea 96 c3 9a 80 0f 00 00 00
    000000b0: 00 80 11 0a 80 21 02 80 31 28 80 a1 03 80 81 12
    000000c0: 80 7f 00 00 00 00 02 0d 40 50 ed 7d 34 7b 37 b2
    000000d0: 6e 5f d9 b6 60 23 55 a0 8d 68 42 da 55 bd a0 50
    000000e0: 64 2e b3 12 f9 b8 a9 1d 29 9d 90 7e 15 18 66 1d
    000000f0: aa 74 03 e8 78 c4 3c e6 b3 0e d2 d9 c9 eb 6b
  UrbLink              = 00000000
[199161 ms] UsbSnoop - DispatchAny(f890e610) : IRP_MJ_INTERNAL_DEVICE_CONTROL
[199161 ms] UsbSnoop - MyDispatchInternalIOCTL(f890fe80) : fdo=81c63810, Irp=822e9640, IRQL=2
[199161 ms]  >>>  URB 456 going down  >>> 
-- URB_FUNCTION_BULK_OR_INTERRUPT_TRANSFER:
  PipeHandle           = 81c9d164 [endpoint 0x00000002]
  TransferFlags        = 00000000 (USBD_TRANSFER_DIRECTION_OUT, ~USBD_SHORT_TRANSFER_OK)
  TransferBufferLength = 00000007
  TransferBuffer       = 00000000
  TransferBufferMDL    = 81cf5428
    00000000: 00 00 00 02 05 e0 00
  UrbLink              = 00000000
[199161 ms] UsbSnoop - MyInternalIOCTLCompletion(f890fdb0) : fido=822da020, Irp=822e9640, Context=822de5c8, IRQL=2
[199161 ms]  <<<  URB 456 coming back  <<< 
-- URB_FUNCTION_BULK_OR_INTERRUPT_TRANSFER:
  PipeHandle           = 81c9d164 [endpoint 0x00000002]
  TransferFlags        = 00000000 (USBD_TRANSFER_DIRECTION_OUT, ~USBD_SHORT_TRANSFER_OK)
  TransferBufferLength = 00000007
  TransferBuffer       = 00000000
  TransferBufferMDL    = 81cf5428
  UrbLink              = 00000000
[199169 ms] UsbSnoop - DispatchAny(f890e610) : IRP_MJ_INTERNAL_DEVICE_CONTROL
[199170 ms] UsbSnoop - MyDispatchInternalIOCTL(f890fe80) : fdo=81c63810, Irp=822e9640, IRQL=2
[199170 ms]  >>>  URB 457 going down  >>> 
-- URB_FUNCTION_BULK_OR_INTERRUPT_TRANSFER:
  PipeHandle           = 81c9d144 [endpoint 0x00000081]
  TransferFlags        = 00000003 (USBD_TRANSFER_DIRECTION_IN, USBD_SHORT_TRANSFER_OK)
  TransferBufferLength = 00000100
  TransferBuffer       = 00000000
  TransferBufferMDL    = 81cf5428
  UrbLink              = 00000000
[199192 ms] UsbSnoop - MyInternalIOCTLCompletion(f890fdb0) : fido=822da020, Irp=822e9640, Context=81bc6e50, IRQL=2
[199192 ms]  <<<  URB 457 coming back  <<< 
-- URB_FUNCTION_BULK_OR_INTERRUPT_TRANSFER:
  PipeHandle           = 81c9d144 [endpoint 0x00000081]
  TransferFlags        = 00000003 (USBD_TRANSFER_DIRECTION_IN, USBD_SHORT_TRANSFER_OK)
  TransferBufferLength = 000000ff
  TransferBuffer       = 00000000
  TransferBufferMDL    = 81cf5428
    00000000: 00 00 00 fa 03 7a 96 13 d4 71 3b eb 0c 01 6c ff
    00000010: ff ff ff ff ff ff ff ff ff ff ff ff ff ff ff ff
    00000020: ff ff ff ff ff ff ff ff ff ff ff ff ff ff ff ff
    00000030: ff ff ff ff ff ff ff ff ff ff ff ff ff ff ff ff
    00000040: ff ff ff ff ff ff ff ff ff ff ff ff ff ff ff ff
    00000050: ff ff ff ff ff ff ff ff ff ff ff ff ff ff ff ff
    00000060: ff ff ff ff ff ff ff ff ff ff ff ff ff ff ff ff
    00000070: ff ff ff ff ff ff ff ff ff ff ff ff ff ff ff ff
    00000080: ff ff ff ff ff ff ff ff ff ff ff ff ff ff ff ff
    00000090: ff ff ff ff ff ff ff ff ff ff ff ff ff ff ff ff
    000000a0: ff ff ff ff ff ff ff ff ff ff ff ff ff ff ff ff
    000000b0: ff ff ff ff ff ff ff ff ff ff ff ff ff ff ff ff
    000000c0: ff ff ff ff ff ff ff ff ff ff ff ff ff ff ff ff
    000000d0: ff ff ff ff ff ff ff ff ff ff ff ff ff ff ff ff
    000000e0: ff ff ff ff ff ff ff ff ff ff ff ff ff ff ff ff
    000000f0: ff ff ff ff ff ff ff ff ff ff ff ff ff ff ff
  UrbLink              = 00000000
[199230 ms] UsbSnoop - DispatchAny(f890e610) : IRP_MJ_INTERNAL_DEVICE_CONTROL
[199230 ms] UsbSnoop - MyDispatchInternalIOCTL(f890fe80) : fdo=81c63810, Irp=822e9640, IRQL=2
[199230 ms]  >>>  URB 458 going down  >>> 
-- URB_FUNCTION_BULK_OR_INTERRUPT_TRANSFER:
  PipeHandle           = 81c9d164 [endpoint 0x00000002]
  TransferFlags        = 00000000 (USBD_TRANSFER_DIRECTION_OUT, ~USBD_SHORT_TRANSFER_OK)
  TransferBufferLength = 00000007
  TransferBuffer       = 00000000
  TransferBufferMDL    = 81cf5428
    00000000: 00 00 00 02 05 e0 00
  UrbLink              = 00000000
[199230 ms] UsbSnoop - MyInternalIOCTLCompletion(f890fdb0) : fido=822da020, Irp=822e9640, Context=8218efe8, IRQL=2
[199230 ms]  <<<  URB 458 coming back  <<< 
-- URB_FUNCTION_BULK_OR_INTERRUPT_TRANSFER:
  PipeHandle           = 81c9d164 [endpoint 0x00000002]
  TransferFlags        = 00000000 (USBD_TRANSFER_DIRECTION_OUT, ~USBD_SHORT_TRANSFER_OK)
  TransferBufferLength = 00000007
  TransferBuffer       = 00000000
  TransferBufferMDL    = 81cf5428
  UrbLink              = 00000000
[199240 ms] UsbSnoop - DispatchAny(f890e610) : IRP_MJ_INTERNAL_DEVICE_CONTROL
[199240 ms] UsbSnoop - MyDispatchInternalIOCTL(f890fe80) : fdo=81c63810, Irp=822e9640, IRQL=2
[199240 ms]  >>>  URB 459 going down  >>> 
-- URB_FUNCTION_BULK_OR_INTERRUPT_TRANSFER:
  PipeHandle           = 81c9d144 [endpoint 0x00000081]
  TransferFlags        = 00000003 (USBD_TRANSFER_DIRECTION_IN, USBD_SHORT_TRANSFER_OK)
  TransferBufferLength = 00000100
  TransferBuffer       = 00000000
  TransferBufferMDL    = 81cf5428
  UrbLink              = 00000000
[199261 ms] UsbSnoop - MyInternalIOCTLCompletion(f890fdb0) : fido=822da020, Irp=822e9640, Context=81bc6e50, IRQL=2
[199261 ms]  <<<  URB 459 coming back  <<< 
-- URB_FUNCTION_BULK_OR_INTERRUPT_TRANSFER:
  PipeHandle           = 81c9d144 [endpoint 0x00000081]
  TransferFlags        = 00000003 (USBD_TRANSFER_DIRECTION_IN, USBD_SHORT_TRANSFER_OK)
  TransferBufferLength = 000000ff
  TransferBuffer       = 00000000
  TransferBufferMDL    = 81cf5428
    00000000: 00 00 00 fa 03 ff ff ff ff ff ff ff ff ff ff ff
    00000010: ff ff ff ff ff ff ff ff ff ff ff ff ff ff ff ff
    00000020: ff ff ff ff ff ff ff ff ff ff ff ff ff ff ff ff
    00000030: ff ff ff ff ff ff ff ff ff ff ff ff ff ff ff ff
    00000040: ff ff ff ff ff ff ff ff ff ff ff ff ff ff ff ff
    00000050: ff ff ff ff ff ff ff ff ff ff ff ff ff ff ff ff
    00000060: ff ff ff ff ff ff ff ff ff ff ff ff ff ff ff ff
    00000070: ff ff ff ff ff ff ff ff ff ff ff ff ff ff ff ff
    00000080: ff ff ff ff ff ff ff ff ff ff ff ff ff ff ff ff
    00000090: ff ff ff ff ff ff ff ff ff ff ff ff ff ff ff ff
    000000a0: ff ff ff ff ff ff ff ff ff ff ff ff ff ff ff ff
    000000b0: ff ff ff ff ff ff ff ff ff ff ff ff ff ff ff ff
    000000c0: ff ff ff ff ff ff ff ff ff ff ff ff ff ff ff ff
    000000d0: ff ff ff ff ff ff ff ff ff ff ff ff ff ff ff ff
    000000e0: ff ff ff ff ff ff ff ff ff ff ff ff ff ff ff ff
    000000f0: ff ff ff ff ff ff ff ff ff ff ff ff ff ff ff
  UrbLink              = 00000000
[199300 ms] UsbSnoop - DispatchAny(f890e610) : IRP_MJ_INTERNAL_DEVICE_CONTROL
[199300 ms] UsbSnoop - MyDispatchInternalIOCTL(f890fe80) : fdo=81c63810, Irp=822e9640, IRQL=2
[199300 ms]  >>>  URB 460 going down  >>> 
-- URB_FUNCTION_BULK_OR_INTERRUPT_TRANSFER:
  PipeHandle           = 81c9d164 [endpoint 0x00000002]
  TransferFlags        = 00000000 (USBD_TRANSFER_DIRECTION_OUT, ~USBD_SHORT_TRANSFER_OK)
  TransferBufferLength = 00000007
  TransferBuffer       = 00000000
  TransferBufferMDL    = 81cf5428
    00000000: 00 00 00 02 05 e0 00
  UrbLink              = 00000000
[199300 ms] UsbSnoop - MyInternalIOCTLCompletion(f890fdb0) : fido=822da020, Irp=822e9640, Context=822de5c8, IRQL=2
[199300 ms]  <<<  URB 460 coming back  <<< 
-- URB_FUNCTION_BULK_OR_INTERRUPT_TRANSFER:
  PipeHandle           = 81c9d164 [endpoint 0x00000002]
  TransferFlags        = 00000000 (USBD_TRANSFER_DIRECTION_OUT, ~USBD_SHORT_TRANSFER_OK)
  TransferBufferLength = 00000007
  TransferBuffer       = 00000000
  TransferBufferMDL    = 81cf5428
  UrbLink              = 00000000
[199310 ms] UsbSnoop - DispatchAny(f890e610) : IRP_MJ_INTERNAL_DEVICE_CONTROL
[199310 ms] UsbSnoop - MyDispatchInternalIOCTL(f890fe80) : fdo=81c63810, Irp=822e9640, IRQL=2
[199310 ms]  >>>  URB 461 going down  >>> 
-- URB_FUNCTION_BULK_OR_INTERRUPT_TRANSFER:
  PipeHandle           = 81c9d144 [endpoint 0x00000081]
  TransferFlags        = 00000003 (USBD_TRANSFER_DIRECTION_IN, USBD_SHORT_TRANSFER_OK)
  TransferBufferLength = 00000100
  TransferBuffer       = 00000000
  TransferBufferMDL    = 81cf5428
  UrbLink              = 00000000
[199331 ms] UsbSnoop - MyInternalIOCTLCompletion(f890fdb0) : fido=822da020, Irp=822e9640, Context=81bc6e50, IRQL=2
[199331 ms]  <<<  URB 461 coming back  <<< 
-- URB_FUNCTION_BULK_OR_INTERRUPT_TRANSFER:
  PipeHandle           = 81c9d144 [endpoint 0x00000081]
  TransferFlags        = 00000003 (USBD_TRANSFER_DIRECTION_IN, USBD_SHORT_TRANSFER_OK)
  TransferBufferLength = 000000ff
  TransferBuffer       = 00000000
  TransferBufferMDL    = 81cf5428
    00000000: 00 00 00 fa 03 ff ff ff ff ff ff ff ff ff ff ff
    00000010: ff ff ff ff ff ff ff ff ff ff ff ff ff ff ff ff
    00000020: ff ff ff ff ff ff ff ff ff ff ff ff ff ff ff ff
    00000030: ff ff ff ff ff ff ff ff ff ff ff ff ff ff ff ff
    00000040: ff ff ff ff ff ff ff ff ff ff ff ff ff ff ff ff
    00000050: ff ff ff ff ff ff ff ff ff ff ff ff ff ff ff ff
    00000060: ff ff ff ff ff ff ff ff ff ff ff ff ff ff ff ff
    00000070: ff ff ff ff ff ff ff ff ff ff ff ff ff ff ff ff
    00000080: ff ff ff ff ff ff ff ff ff ff ff ff ff ff ff ff
    00000090: ff ff ff ff ff ff ff ff ff ff ff ff ff ff ff ff
    000000a0: ff ff ff ff ff ff ff ff ff ff ff ff ff ff ff ff
    000000b0: ff ff ff ff ff ff ff ff ff ff ff ff ff ff ff ff
    000000c0: ff ff ff ff ff ff ff ff ff ff ff ff ff ff ff ff
    000000d0: ff ff ff ff ff ff ff ff ff ff ff ff ff ff ff ff
    000000e0: ff ff ff ff ff ff ff ff ff ff ff ff ff ff ff ff
    000000f0: ff ff ff ff ff ff ff ff ff ff ff 00 00 00 00
  UrbLink              = 00000000
[199370 ms] UsbSnoop - DispatchAny(f890e610) : IRP_MJ_INTERNAL_DEVICE_CONTROL
[199370 ms] UsbSnoop - MyDispatchInternalIOCTL(f890fe80) : fdo=81c63810, Irp=822e9640, IRQL=2
[199370 ms]  >>>  URB 462 going down  >>> 
-- URB_FUNCTION_BULK_OR_INTERRUPT_TRANSFER:
  PipeHandle           = 81c9d164 [endpoint 0x00000002]
  TransferFlags        = 00000000 (USBD_TRANSFER_DIRECTION_OUT, ~USBD_SHORT_TRANSFER_OK)
  TransferBufferLength = 00000007
  TransferBuffer       = 00000000
  TransferBufferMDL    = 81cf5428
    00000000: 00 00 00 02 05 e0 00
  UrbLink              = 00000000
[199370 ms] UsbSnoop - MyInternalIOCTLCompletion(f890fdb0) : fido=822da020, Irp=822e9640, Context=822a2438, IRQL=2
[199370 ms]  <<<  URB 462 coming back  <<< 
-- URB_FUNCTION_BULK_OR_INTERRUPT_TRANSFER:
  PipeHandle           = 81c9d164 [endpoint 0x00000002]
  TransferFlags        = 00000000 (USBD_TRANSFER_DIRECTION_OUT, ~USBD_SHORT_TRANSFER_OK)
  TransferBufferLength = 00000007
  TransferBuffer       = 00000000
  TransferBufferMDL    = 81cf5428
  UrbLink              = 00000000
[199380 ms] UsbSnoop - DispatchAny(f890e610) : IRP_MJ_INTERNAL_DEVICE_CONTROL
[199380 ms] UsbSnoop - MyDispatchInternalIOCTL(f890fe80) : fdo=81c63810, Irp=822e9640, IRQL=2
[199380 ms]  >>>  URB 463 going down  >>> 
-- URB_FUNCTION_BULK_OR_INTERRUPT_TRANSFER:
  PipeHandle           = 81c9d144 [endpoint 0x00000081]
  TransferFlags        = 00000003 (USBD_TRANSFER_DIRECTION_IN, USBD_SHORT_TRANSFER_OK)
  TransferBufferLength = 00000100
  TransferBuffer       = 00000000
  TransferBufferMDL    = 81cf5428
  UrbLink              = 00000000
[199864 ms] UsbSnoop - MyInternalIOCTLCompletion(f890fdb0) : fido=822da020, Irp=822e9640, Context=81bc6e50, IRQL=2
[199864 ms]  <<<  URB 463 coming back  <<< 
-- URB_FUNCTION_BULK_OR_INTERRUPT_TRANSFER:
  PipeHandle           = 81c9d144 [endpoint 0x00000081]
  TransferFlags        = 00000003 (USBD_TRANSFER_DIRECTION_IN, USBD_SHORT_TRANSFER_OK)
  TransferBufferLength = 00000021
  TransferBuffer       = 00000000
  TransferBufferMDL    = 81cf5428
    00000000: 00 00 00 1c 04 00 00 00 00 00 00 00 00 fc ff ff
    00000010: ff ff ff ff ff ff ff ff ff ff ff ff ff ff ff ff
    00000020: ff
  UrbLink              = 00000000
[199901 ms] UsbSnoop - DispatchAny(f890e610) : IRP_MJ_INTERNAL_DEVICE_CONTROL
[199901 ms] UsbSnoop - MyDispatchInternalIOCTL(f890fe80) : fdo=81c63810, Irp=822e9640, IRQL=2
[199901 ms]  >>>  URB 464 going down  >>> 
-- URB_FUNCTION_BULK_OR_INTERRUPT_TRANSFER:
  PipeHandle           = 81c9d164 [endpoint 0x00000002]
  TransferFlags        = 00000000 (USBD_TRANSFER_DIRECTION_OUT, ~USBD_SHORT_TRANSFER_OK)
  TransferBufferLength = 00000007
  TransferBuffer       = 00000000
  TransferBufferMDL    = 81cf5428
    00000000: 00 00 00 02 05 e0 00
  UrbLink              = 00000000
[199901 ms] UsbSnoop - MyInternalIOCTLCompletion(f890fdb0) : fido=822da020, Irp=822e9640, Context=81b87c90, IRQL=2
[199901 ms]  <<<  URB 464 coming back  <<< 
-- URB_FUNCTION_BULK_OR_INTERRUPT_TRANSFER:
  PipeHandle           = 81c9d164 [endpoint 0x00000002]
  TransferFlags        = 00000000 (USBD_TRANSFER_DIRECTION_OUT, ~USBD_SHORT_TRANSFER_OK)
  TransferBufferLength = 00000007
  TransferBuffer       = 00000000
  TransferBufferMDL    = 81cf5428
  UrbLink              = 00000000
[200912 ms] UsbSnoop - DispatchAny(f890e610) : IRP_MJ_INTERNAL_DEVICE_CONTROL
[200912 ms] UsbSnoop - MyDispatchInternalIOCTL(f890fe80) : fdo=81c63810, Irp=81d098c8, IRQL=2
[200912 ms]  >>>  URB 465 going down  >>> 
-- URB_FUNCTION_BULK_OR_INTERRUPT_TRANSFER:
  PipeHandle           = 81c9d164 [endpoint 0x00000002]
  TransferFlags        = 00000000 (USBD_TRANSFER_DIRECTION_OUT, ~USBD_SHORT_TRANSFER_OK)
  TransferBufferLength = 00000009
  TransferBuffer       = 00000000
  TransferBufferMDL    = 81cf5428
    00000000: 00 00 00 04 01 00 00 04 00
  UrbLink              = 00000000
[200913 ms] UsbSnoop - MyInternalIOCTLCompletion(f890fdb0) : fido=822da020, Irp=81d098c8, Context=8218efe8, IRQL=2
[200913 ms]  <<<  URB 465 coming back  <<< 
-- URB_FUNCTION_BULK_OR_INTERRUPT_TRANSFER:
  PipeHandle           = 81c9d164 [endpoint 0x00000002]
  TransferFlags        = 00000000 (USBD_TRANSFER_DIRECTION_OUT, ~USBD_SHORT_TRANSFER_OK)
  TransferBufferLength = 00000009
  TransferBuffer       = 00000000
  TransferBufferMDL    = 81cf5428
  UrbLink              = 00000000
[200913 ms] UsbSnoop - DispatchAny(f890e610) : IRP_MJ_INTERNAL_DEVICE_CONTROL
[200913 ms] UsbSnoop - MyDispatchInternalIOCTL(f890fe80) : fdo=81c63810, Irp=81d098c8, IRQL=2
[200913 ms]  >>>  URB 466 going down  >>> 
-- URB_FUNCTION_BULK_OR_INTERRUPT_TRANSFER:
  PipeHandle           = 81c9d144 [endpoint 0x00000081]
  TransferFlags        = 00000003 (USBD_TRANSFER_DIRECTION_IN, USBD_SHORT_TRANSFER_OK)
  TransferBufferLength = 00000100
  TransferBuffer       = 00000000
  TransferBufferMDL    = 81cf5428
  UrbLink              = 00000000
[200922 ms] UsbSnoop - MyInternalIOCTLCompletion(f890fdb0) : fido=822da020, Irp=81d098c8, Context=81c9a480, IRQL=2
[200922 ms]  <<<  URB 466 coming back  <<< 
-- URB_FUNCTION_BULK_OR_INTERRUPT_TRANSFER:
  PipeHandle           = 81c9d144 [endpoint 0x00000081]
  TransferFlags        = 00000003 (USBD_TRANSFER_DIRECTION_IN, USBD_SHORT_TRANSFER_OK)
  TransferBufferLength = 00000009
  TransferBuffer       = 00000000
  TransferBufferMDL    = 81cf5428
    00000000: 00 00 00 04 02 00 00 00 fa
  UrbLink              = 00000000
[200942 ms] UsbSnoop - DispatchAny(f890e610) : IRP_MJ_INTERNAL_DEVICE_CONTROL
[200942 ms] UsbSnoop - MyDispatchInternalIOCTL(f890fe80) : fdo=81c63810, Irp=81d098c8, IRQL=2
[200942 ms]  >>>  URB 467 going down  >>> 
-- URB_FUNCTION_BULK_OR_INTERRUPT_TRANSFER:
  PipeHandle           = 81c9d164 [endpoint 0x00000002]
  TransferFlags        = 00000000 (USBD_TRANSFER_DIRECTION_OUT, ~USBD_SHORT_TRANSFER_OK)
  TransferBufferLength = 00000015
  TransferBuffer       = 00000000
  TransferBufferMDL    = 81cf5428
    00000000: 00 00 00 10 04 00 00 00 0a 00 01 00 03 00 01 00
    00000010: 00 00 00 07 d0
  UrbLink              = 00000000
[200943 ms] UsbSnoop - MyInternalIOCTLCompletion(f890fdb0) : fido=822da020, Irp=81d098c8, Context=81bc6e50, IRQL=2
[200943 ms]  <<<  URB 467 coming back  <<< 
-- URB_FUNCTION_BULK_OR_INTERRUPT_TRANSFER:
  PipeHandle           = 81c9d164 [endpoint 0x00000002]
  TransferFlags        = 00000000 (USBD_TRANSFER_DIRECTION_OUT, ~USBD_SHORT_TRANSFER_OK)
  TransferBufferLength = 00000015
  TransferBuffer       = 00000000
  TransferBufferMDL    = 81cf5428
  UrbLink              = 00000000
[200952 ms] UsbSnoop - DispatchAny(f890e610) : IRP_MJ_INTERNAL_DEVICE_CONTROL
[200952 ms] UsbSnoop - MyDispatchInternalIOCTL(f890fe80) : fdo=81c63810, Irp=81d098c8, IRQL=2
[200952 ms]  >>>  URB 468 going down  >>> 
-- URB_FUNCTION_BULK_OR_INTERRUPT_TRANSFER:
  PipeHandle           = 81c9d144 [endpoint 0x00000081]
  TransferFlags        = 00000003 (USBD_TRANSFER_DIRECTION_IN, USBD_SHORT_TRANSFER_OK)
  TransferBufferLength = 00000100
  TransferBuffer       = 00000000
  TransferBufferMDL    = 81cf5428
  UrbLink              = 00000000
[200952 ms] UsbSnoop - MyInternalIOCTLCompletion(f890fdb0) : fido=822da020, Irp=81d098c8, Context=8218efe8, IRQL=2
[200952 ms]  <<<  URB 468 coming back  <<< 
-- URB_FUNCTION_BULK_OR_INTERRUPT_TRANSFER:
  PipeHandle           = 81c9d144 [endpoint 0x00000081]
  TransferFlags        = 00000003 (USBD_TRANSFER_DIRECTION_IN, USBD_SHORT_TRANSFER_OK)
  TransferBufferLength = 00000007
  TransferBuffer       = 00000000
  TransferBufferMDL    = 81cf5428
    00000000: 00 00 00 02 05 e0 00
  UrbLink              = 00000000
[200992 ms] UsbSnoop - DispatchAny(f890e610) : IRP_MJ_INTERNAL_DEVICE_CONTROL
[200992 ms] UsbSnoop - MyDispatchInternalIOCTL(f890fe80) : fdo=81c63810, Irp=81d098c8, IRQL=2
[200992 ms]  >>>  URB 469 going down  >>> 
-- URB_FUNCTION_BULK_OR_INTERRUPT_TRANSFER:
  PipeHandle           = 81c9d144 [endpoint 0x00000081]
  TransferFlags        = 00000003 (USBD_TRANSFER_DIRECTION_IN, USBD_SHORT_TRANSFER_OK)
  TransferBufferLength = 00000100
  TransferBuffer       = 00000000
  TransferBufferMDL    = 81cf5428
  UrbLink              = 00000000
[200993 ms] UsbSnoop - MyInternalIOCTLCompletion(f890fdb0) : fido=822da020, Irp=81d098c8, Context=81bc6e50, IRQL=2
[200993 ms]  <<<  URB 469 coming back  <<< 
-- URB_FUNCTION_BULK_OR_INTERRUPT_TRANSFER:
  PipeHandle           = 81c9d144 [endpoint 0x00000081]
  TransferFlags        = 00000003 (USBD_TRANSFER_DIRECTION_IN, USBD_SHORT_TRANSFER_OK)
  TransferBufferLength = 0000000f
  TransferBuffer       = 00000000
  TransferBufferMDL    = 81cf5428
    00000000: 00 00 00 0a 04 00 00 00 04 00 12 00 00 07 d0
  UrbLink              = 00000000
[201032 ms] UsbSnoop - DispatchAny(f890e610) : IRP_MJ_INTERNAL_DEVICE_CONTROL
[201032 ms] UsbSnoop - MyDispatchInternalIOCTL(f890fe80) : fdo=81c63810, Irp=81d098c8, IRQL=2
[201032 ms]  >>>  URB 470 going down  >>> 
-- URB_FUNCTION_BULK_OR_INTERRUPT_TRANSFER:
  PipeHandle           = 81c9d164 [endpoint 0x00000002]
  TransferFlags        = 00000000 (USBD_TRANSFER_DIRECTION_OUT, ~USBD_SHORT_TRANSFER_OK)
  TransferBufferLength = 00000007
  TransferBuffer       = 00000000
  TransferBufferMDL    = 81cf5428
    00000000: 00 00 00 02 05 e0 00
  UrbLink              = 00000000
[201033 ms] UsbSnoop - MyInternalIOCTLCompletion(f890fdb0) : fido=822da020, Irp=81d098c8, Context=81b51c08, IRQL=2
[201033 ms]  <<<  URB 470 coming back  <<< 
-- URB_FUNCTION_BULK_OR_INTERRUPT_TRANSFER:
  PipeHandle           = 81c9d164 [endpoint 0x00000002]
  TransferFlags        = 00000000 (USBD_TRANSFER_DIRECTION_OUT, ~USBD_SHORT_TRANSFER_OK)
  TransferBufferLength = 00000007
  TransferBuffer       = 00000000
  TransferBufferMDL    = 81cf5428
  UrbLink              = 00000000
[201042 ms] UsbSnoop - DispatchAny(f890e610) : IRP_MJ_INTERNAL_DEVICE_CONTROL
[201042 ms] UsbSnoop - MyDispatchInternalIOCTL(f890fe80) : fdo=81c63810, Irp=81d098c8, IRQL=2
[201043 ms]  >>>  URB 471 going down  >>> 
-- URB_FUNCTION_BULK_OR_INTERRUPT_TRANSFER:
  PipeHandle           = 81c9d164 [endpoint 0x00000002]
  TransferFlags        = 00000000 (USBD_TRANSFER_DIRECTION_OUT, ~USBD_SHORT_TRANSFER_OK)
  TransferBufferLength = 00000022
  TransferBuffer       = 00000000
  TransferBufferMDL    = 81cf5428
    00000000: 00 00 00 1d 04 00 00 00 17 00 09 00 00 00 06 00
    00000010: 02 00 03 00 05 00 01 00 41 00 42 00 01 00 01 00
    00000020: 01 01
  UrbLink              = 00000000
[201043 ms] UsbSnoop - MyInternalIOCTLCompletion(f890fdb0) : fido=822da020, Irp=81d098c8, Context=81c9a480, IRQL=2
[201043 ms]  <<<  URB 471 coming back  <<< 
-- URB_FUNCTION_BULK_OR_INTERRUPT_TRANSFER:
  PipeHandle           = 81c9d164 [endpoint 0x00000002]
  TransferFlags        = 00000000 (USBD_TRANSFER_DIRECTION_OUT, ~USBD_SHORT_TRANSFER_OK)
  TransferBufferLength = 00000022
  TransferBuffer       = 00000000
  TransferBufferMDL    = 81cf5428
  UrbLink              = 00000000
[201052 ms] UsbSnoop - DispatchAny(f890e610) : IRP_MJ_INTERNAL_DEVICE_CONTROL
[201052 ms] UsbSnoop - MyDispatchInternalIOCTL(f890fe80) : fdo=81c63810, Irp=81d098c8, IRQL=2
[201052 ms]  >>>  URB 472 going down  >>> 
-- URB_FUNCTION_BULK_OR_INTERRUPT_TRANSFER:
  PipeHandle           = 81c9d144 [endpoint 0x00000081]
  TransferFlags        = 00000003 (USBD_TRANSFER_DIRECTION_IN, USBD_SHORT_TRANSFER_OK)
  TransferBufferLength = 00000100
  TransferBuffer       = 00000000
  TransferBufferMDL    = 81cf5428
  UrbLink              = 00000000
[201053 ms] UsbSnoop - MyInternalIOCTLCompletion(f890fdb0) : fido=822da020, Irp=81d098c8, Context=81bc6e50, IRQL=2
[201053 ms]  <<<  URB 472 coming back  <<< 
-- URB_FUNCTION_BULK_OR_INTERRUPT_TRANSFER:
  PipeHandle           = 81c9d144 [endpoint 0x00000081]
  TransferFlags        = 00000003 (USBD_TRANSFER_DIRECTION_IN, USBD_SHORT_TRANSFER_OK)
  TransferBufferLength = 00000007
  TransferBuffer       = 00000000
  TransferBufferMDL    = 81cf5428
    00000000: 00 00 00 02 05 e0 00
  UrbLink              = 00000000
[201093 ms] UsbSnoop - DispatchAny(f890e610) : IRP_MJ_INTERNAL_DEVICE_CONTROL
[201093 ms] UsbSnoop - MyDispatchInternalIOCTL(f890fe80) : fdo=81c63810, Irp=81d098c8, IRQL=2
[201093 ms]  >>>  URB 473 going down  >>> 
-- URB_FUNCTION_BULK_OR_INTERRUPT_TRANSFER:
  PipeHandle           = 81c9d144 [endpoint 0x00000081]
  TransferFlags        = 00000003 (USBD_TRANSFER_DIRECTION_IN, USBD_SHORT_TRANSFER_OK)
  TransferBufferLength = 00000100
  TransferBuffer       = 00000000
  TransferBufferMDL    = 81cf5428
  UrbLink              = 00000000
[201093 ms] UsbSnoop - MyInternalIOCTLCompletion(f890fdb0) : fido=822da020, Irp=81d098c8, Context=822de5c8, IRQL=2
[201093 ms]  <<<  URB 473 coming back  <<< 
-- URB_FUNCTION_BULK_OR_INTERRUPT_TRANSFER:
  PipeHandle           = 81c9d144 [endpoint 0x00000081]
  TransferFlags        = 00000003 (USBD_TRANSFER_DIRECTION_IN, USBD_SHORT_TRANSFER_OK)
  TransferBufferLength = 00000032
  TransferBuffer       = 00000000
  TransferBufferMDL    = 81cf5428
    00000000: 00 00 00 2d 04 00 00 00 27 00 0a 00 01 43 00 00
    00000010: 06 00 02 00 00 04 f0 07 00 00 00 03 00 00 01 01
    00000020: 00 05 01 00 01 00 00 04 00 00 00 09 00 41 01 00
    00000030: 42 01
  UrbLink              = 00000000
[201133 ms] UsbSnoop - DispatchAny(f890e610) : IRP_MJ_INTERNAL_DEVICE_CONTROL
[201133 ms] UsbSnoop - MyDispatchInternalIOCTL(f890fe80) : fdo=81c63810, Irp=81d098c8, IRQL=2
[201133 ms]  >>>  URB 474 going down  >>> 
-- URB_FUNCTION_BULK_OR_INTERRUPT_TRANSFER:
  PipeHandle           = 81c9d164 [endpoint 0x00000002]
  TransferFlags        = 00000000 (USBD_TRANSFER_DIRECTION_OUT, ~USBD_SHORT_TRANSFER_OK)
  TransferBufferLength = 00000007
  TransferBuffer       = 00000000
  TransferBufferMDL    = 81cf5428
    00000000: 00 00 00 02 05 e0 00
  UrbLink              = 00000000
[201133 ms] UsbSnoop - MyInternalIOCTLCompletion(f890fdb0) : fido=822da020, Irp=81d098c8, Context=81bc6e50, IRQL=2
[201133 ms]  <<<  URB 474 coming back  <<< 
-- URB_FUNCTION_BULK_OR_INTERRUPT_TRANSFER:
  PipeHandle           = 81c9d164 [endpoint 0x00000002]
  TransferFlags        = 00000000 (USBD_TRANSFER_DIRECTION_OUT, ~USBD_SHORT_TRANSFER_OK)
  TransferBufferLength = 00000007
  TransferBuffer       = 00000000
  TransferBufferMDL    = 81cf5428
  UrbLink              = 00000000
[201143 ms] UsbSnoop - DispatchAny(f890e610) : IRP_MJ_INTERNAL_DEVICE_CONTROL
[201143 ms] UsbSnoop - MyDispatchInternalIOCTL(f890fe80) : fdo=81c63810, Irp=81d098c8, IRQL=2
[201143 ms]  >>>  URB 475 going down  >>> 
-- URB_FUNCTION_BULK_OR_INTERRUPT_TRANSFER:
  PipeHandle           = 81c9d144 [endpoint 0x00000081]
  TransferFlags        = 00000003 (USBD_TRANSFER_DIRECTION_IN, USBD_SHORT_TRANSFER_OK)
  TransferBufferLength = 00000100
  TransferBuffer       = 00000000
  TransferBufferMDL    = 81cf5428
  UrbLink              = 00000000
[201170 ms] UsbSnoop - MyInternalIOCTLCompletion(f890fdb0) : fido=822da020, Irp=81d098c8, Context=8218efe8, IRQL=2
[201170 ms]  <<<  URB 475 coming back  <<< 
-- URB_FUNCTION_BULK_OR_INTERRUPT_TRANSFER:
  PipeHandle           = 81c9d144 [endpoint 0x00000081]
  TransferFlags        = 00000003 (USBD_TRANSFER_DIRECTION_IN, USBD_SHORT_TRANSFER_OK)
  TransferBufferLength = 00000032
  TransferBuffer       = 00000000
  TransferBufferMDL    = 81cf5428
    00000000: 00 00 00 2d 04 00 00 00 27 00 0a 00 01 41 00 00
    00000010: 06 00 02 00 00 04 f0 07 00 00 00 03 00 00 01 00
    00000020: 00 05 01 00 01 00 00 04 00 00 00 09 00 41 01 00
    00000030: 42 01
  UrbLink              = 00000000
[201204 ms] UsbSnoop - DispatchAny(f890e610) : IRP_MJ_INTERNAL_DEVICE_CONTROL
[201204 ms] UsbSnoop - MyDispatchInternalIOCTL(f890fe80) : fdo=81c63810, Irp=81ba8008, IRQL=2
[201204 ms]  >>>  URB 476 going down  >>> 
-- URB_FUNCTION_BULK_OR_INTERRUPT_TRANSFER:
  PipeHandle           = 81c9d164 [endpoint 0x00000002]
  TransferFlags        = 00000000 (USBD_TRANSFER_DIRECTION_OUT, ~USBD_SHORT_TRANSFER_OK)
  TransferBufferLength = 00000007
  TransferBuffer       = 00000000
  TransferBufferMDL    = 82315078
    00000000: 00 00 00 02 05 e0 00
  UrbLink              = 00000000
[201204 ms] UsbSnoop - MyInternalIOCTLCompletion(f890fdb0) : fido=822da020, Irp=81ba8008, Context=81b87c90, IRQL=2
[201204 ms]  <<<  URB 476 coming back  <<< 
-- URB_FUNCTION_BULK_OR_INTERRUPT_TRANSFER:
  PipeHandle           = 81c9d164 [endpoint 0x00000002]
  TransferFlags        = 00000000 (USBD_TRANSFER_DIRECTION_OUT, ~USBD_SHORT_TRANSFER_OK)
  TransferBufferLength = 00000007
  TransferBuffer       = 00000000
  TransferBufferMDL    = 82315078
  UrbLink              = 00000000
[201213 ms] UsbSnoop - DispatchAny(f890e610) : IRP_MJ_INTERNAL_DEVICE_CONTROL
[201213 ms] UsbSnoop - MyDispatchInternalIOCTL(f890fe80) : fdo=81c63810, Irp=81ba8008, IRQL=2
[201213 ms]  >>>  URB 477 going down  >>> 
-- URB_FUNCTION_BULK_OR_INTERRUPT_TRANSFER:
  PipeHandle           = 81c9d144 [endpoint 0x00000081]
  TransferFlags        = 00000003 (USBD_TRANSFER_DIRECTION_IN, USBD_SHORT_TRANSFER_OK)
  TransferBufferLength = 00000100
  TransferBuffer       = 00000000
  TransferBufferMDL    = 81cf5428
  UrbLink              = 00000000
[201214 ms] UsbSnoop - MyInternalIOCTLCompletion(f890fdb0) : fido=822da020, Irp=81ba8008, Context=822de5c8, IRQL=2
[201214 ms]  <<<  URB 477 coming back  <<< 
-- URB_FUNCTION_BULK_OR_INTERRUPT_TRANSFER:
  PipeHandle           = 81c9d144 [endpoint 0x00000081]
  TransferFlags        = 00000003 (USBD_TRANSFER_DIRECTION_IN, USBD_SHORT_TRANSFER_OK)
  TransferBufferLength = 00000032
  TransferBuffer       = 00000000
  TransferBufferMDL    = 81cf5428
    00000000: 00 00 00 2d 04 00 00 00 27 00 0a 00 01 42 00 00
    00000010: 06 00 02 00 00 04 f0 07 00 00 00 03 00 00 01 00
    00000020: 00 05 01 00 01 00 00 04 00 00 00 09 00 41 01 00
    00000030: 42 01
  UrbLink              = 00000000
[201253 ms] UsbSnoop - DispatchAny(f890e610) : IRP_MJ_INTERNAL_DEVICE_CONTROL
[201253 ms] UsbSnoop - MyDispatchInternalIOCTL(f890fe80) : fdo=81c63810, Irp=81ba8008, IRQL=2
[201253 ms]  >>>  URB 478 going down  >>> 
-- URB_FUNCTION_BULK_OR_INTERRUPT_TRANSFER:
  PipeHandle           = 81c9d164 [endpoint 0x00000002]
  TransferFlags        = 00000000 (USBD_TRANSFER_DIRECTION_OUT, ~USBD_SHORT_TRANSFER_OK)
  TransferBufferLength = 00000007
  TransferBuffer       = 00000000
  TransferBufferMDL    = 81cf5428
    00000000: 00 00 00 02 05 e0 00
  UrbLink              = 00000000
[201253 ms] UsbSnoop - MyInternalIOCTLCompletion(f890fdb0) : fido=822da020, Irp=81ba8008, Context=8218efe8, IRQL=2
[201253 ms]  <<<  URB 478 coming back  <<< 
-- URB_FUNCTION_BULK_OR_INTERRUPT_TRANSFER:
  PipeHandle           = 81c9d164 [endpoint 0x00000002]
  TransferFlags        = 00000000 (USBD_TRANSFER_DIRECTION_OUT, ~USBD_SHORT_TRANSFER_OK)
  TransferBufferLength = 00000007
  TransferBuffer       = 00000000
  TransferBufferMDL    = 81cf5428
  UrbLink              = 00000000
[201263 ms] UsbSnoop - DispatchAny(f890e610) : IRP_MJ_INTERNAL_DEVICE_CONTROL
[201263 ms] UsbSnoop - MyDispatchInternalIOCTL(f890fe80) : fdo=81c63810, Irp=81ba8008, IRQL=2
[201263 ms]  >>>  URB 479 going down  >>> 
-- URB_FUNCTION_BULK_OR_INTERRUPT_TRANSFER:
  PipeHandle           = 81c9d144 [endpoint 0x00000081]
  TransferFlags        = 00000003 (USBD_TRANSFER_DIRECTION_IN, USBD_SHORT_TRANSFER_OK)
  TransferBufferLength = 00000100
  TransferBuffer       = 00000000
  TransferBufferMDL    = 81cf5428
  UrbLink              = 00000000
[201263 ms] UsbSnoop - MyInternalIOCTLCompletion(f890fdb0) : fido=822da020, Irp=81ba8008, Context=81bc6e50, IRQL=2
[201263 ms]  <<<  URB 479 coming back  <<< 
-- URB_FUNCTION_BULK_OR_INTERRUPT_TRANSFER:
  PipeHandle           = 81c9d144 [endpoint 0x00000081]
  TransferFlags        = 00000003 (USBD_TRANSFER_DIRECTION_IN, USBD_SHORT_TRANSFER_OK)
  TransferBufferLength = 00000035
  TransferBuffer       = 00000000
  TransferBufferMDL    = 81cf5428
    00000000: 00 00 00 30 04 00 00 00 2a 00 0a 00 04 4c e2 82
    00000010: 81 00 00 06 00 02 00 00 04 f0 07 00 01 00 03 00
    00000020: 00 01 00 00 05 01 00 01 00 00 04 00 00 00 02 00
    00000030: 41 01 00 42 01
  UrbLink              = 00000000
[201303 ms] UsbSnoop - DispatchAny(f890e610) : IRP_MJ_INTERNAL_DEVICE_CONTROL
[201303 ms] UsbSnoop - MyDispatchInternalIOCTL(f890fe80) : fdo=81c63810, Irp=81d098c8, IRQL=2
[201303 ms]  >>>  URB 480 going down  >>> 
-- URB_FUNCTION_BULK_OR_INTERRUPT_TRANSFER:
  PipeHandle           = 81c9d164 [endpoint 0x00000002]
  TransferFlags        = 00000000 (USBD_TRANSFER_DIRECTION_OUT, ~USBD_SHORT_TRANSFER_OK)
  TransferBufferLength = 00000007
  TransferBuffer       = 00000000
  TransferBufferMDL    = 81cf5428
    00000000: 00 00 00 02 05 e0 00
  UrbLink              = 00000000
[201303 ms] UsbSnoop - MyInternalIOCTLCompletion(f890fdb0) : fido=822da020, Irp=81d098c8, Context=81b51c08, IRQL=2
[201303 ms]  <<<  URB 480 coming back  <<< 
-- URB_FUNCTION_BULK_OR_INTERRUPT_TRANSFER:
  PipeHandle           = 81c9d164 [endpoint 0x00000002]
  TransferFlags        = 00000000 (USBD_TRANSFER_DIRECTION_OUT, ~USBD_SHORT_TRANSFER_OK)
  TransferBufferLength = 00000007
  TransferBuffer       = 00000000
  TransferBufferMDL    = 81cf5428
  UrbLink              = 00000000
[201313 ms] UsbSnoop - DispatchAny(f890e610) : IRP_MJ_INTERNAL_DEVICE_CONTROL
[201313 ms] UsbSnoop - MyDispatchInternalIOCTL(f890fe80) : fdo=81c63810, Irp=81d098c8, IRQL=2
[201313 ms]  >>>  URB 481 going down  >>> 
-- URB_FUNCTION_BULK_OR_INTERRUPT_TRANSFER:
  PipeHandle           = 81c9d144 [endpoint 0x00000081]
  TransferFlags        = 00000003 (USBD_TRANSFER_DIRECTION_IN, USBD_SHORT_TRANSFER_OK)
  TransferBufferLength = 00000100
  TransferBuffer       = 00000000
  TransferBufferMDL    = 81cf5428
  UrbLink              = 00000000
[201313 ms] UsbSnoop - MyInternalIOCTLCompletion(f890fdb0) : fido=822da020, Irp=81d098c8, Context=81c9a480, IRQL=2
[201313 ms]  <<<  URB 481 coming back  <<< 
-- URB_FUNCTION_BULK_OR_INTERRUPT_TRANSFER:
  PipeHandle           = 81c9d144 [endpoint 0x00000081]
  TransferFlags        = 00000003 (USBD_TRANSFER_DIRECTION_IN, USBD_SHORT_TRANSFER_OK)
  TransferBufferLength = 00000035
  TransferBuffer       = 00000000
  TransferBufferMDL    = 81cf5428
    00000000: 00 00 00 30 04 00 00 00 2a 00 0a 00 04 4c e2 82
    00000010: 82 00 00 06 00 02 00 00 04 f0 07 00 01 00 03 00
    00000020: 00 01 00 00 05 01 00 01 00 00 04 00 00 00 02 00
    00000030: 41 01 00 42 01
  UrbLink              = 00000000
[201353 ms] UsbSnoop - DispatchAny(f890e610) : IRP_MJ_INTERNAL_DEVICE_CONTROL
[201353 ms] UsbSnoop - MyDispatchInternalIOCTL(f890fe80) : fdo=81c63810, Irp=81d098c8, IRQL=2
[201353 ms]  >>>  URB 482 going down  >>> 
-- URB_FUNCTION_BULK_OR_INTERRUPT_TRANSFER:
  PipeHandle           = 81c9d164 [endpoint 0x00000002]
  TransferFlags        = 00000000 (USBD_TRANSFER_DIRECTION_OUT, ~USBD_SHORT_TRANSFER_OK)
  TransferBufferLength = 00000007
  TransferBuffer       = 00000000
  TransferBufferMDL    = 81cf5428
    00000000: 00 00 00 02 05 e0 00
  UrbLink              = 00000000
[201353 ms] UsbSnoop - MyInternalIOCTLCompletion(f890fdb0) : fido=822da020, Irp=81d098c8, Context=8218efe8, IRQL=2
[201353 ms]  <<<  URB 482 coming back  <<< 
-- URB_FUNCTION_BULK_OR_INTERRUPT_TRANSFER:
  PipeHandle           = 81c9d164 [endpoint 0x00000002]
  TransferFlags        = 00000000 (USBD_TRANSFER_DIRECTION_OUT, ~USBD_SHORT_TRANSFER_OK)
  TransferBufferLength = 00000007
  TransferBuffer       = 00000000
  TransferBufferMDL    = 81cf5428
  UrbLink              = 00000000
[201363 ms] UsbSnoop - DispatchAny(f890e610) : IRP_MJ_INTERNAL_DEVICE_CONTROL
[201363 ms] UsbSnoop - MyDispatchInternalIOCTL(f890fe80) : fdo=81c63810, Irp=81d098c8, IRQL=2
[201363 ms]  >>>  URB 483 going down  >>> 
-- URB_FUNCTION_BULK_OR_INTERRUPT_TRANSFER:
  PipeHandle           = 81c9d144 [endpoint 0x00000081]
  TransferFlags        = 00000003 (USBD_TRANSFER_DIRECTION_IN, USBD_SHORT_TRANSFER_OK)
  TransferBufferLength = 00000100
  TransferBuffer       = 00000000
  TransferBufferMDL    = 81cf5428
  UrbLink              = 00000000
[201363 ms] UsbSnoop - MyInternalIOCTLCompletion(f890fdb0) : fido=822da020, Irp=81d098c8, Context=81b87c90, IRQL=2
[201363 ms]  <<<  URB 483 coming back  <<< 
-- URB_FUNCTION_BULK_OR_INTERRUPT_TRANSFER:
  PipeHandle           = 81c9d144 [endpoint 0x00000081]
  TransferFlags        = 00000003 (USBD_TRANSFER_DIRECTION_IN, USBD_SHORT_TRANSFER_OK)
  TransferBufferLength = 00000035
  TransferBuffer       = 00000000
  TransferBufferMDL    = 81cf5428
    00000000: 00 00 00 30 04 00 00 00 2a 00 0a 00 04 4c e2 82
    00000010: 83 00 00 06 00 02 00 00 04 f0 07 00 01 00 03 00
    00000020: 00 01 00 00 05 01 00 01 00 00 04 00 00 00 02 00
    00000030: 41 01 00 42 01
  UrbLink              = 00000000
[201403 ms] UsbSnoop - DispatchAny(f890e610) : IRP_MJ_INTERNAL_DEVICE_CONTROL
[201403 ms] UsbSnoop - MyDispatchInternalIOCTL(f890fe80) : fdo=81c63810, Irp=81d098c8, IRQL=2
[201403 ms]  >>>  URB 484 going down  >>> 
-- URB_FUNCTION_BULK_OR_INTERRUPT_TRANSFER:
  PipeHandle           = 81c9d164 [endpoint 0x00000002]
  TransferFlags        = 00000000 (USBD_TRANSFER_DIRECTION_OUT, ~USBD_SHORT_TRANSFER_OK)
  TransferBufferLength = 00000007
  TransferBuffer       = 00000000
  TransferBufferMDL    = 81cf5428
    00000000: 00 00 00 02 05 e0 00
  UrbLink              = 00000000
[201403 ms] UsbSnoop - MyInternalIOCTLCompletion(f890fdb0) : fido=822da020, Irp=81d098c8, Context=81c9a480, IRQL=2
[201403 ms]  <<<  URB 484 coming back  <<< 
-- URB_FUNCTION_BULK_OR_INTERRUPT_TRANSFER:
  PipeHandle           = 81c9d164 [endpoint 0x00000002]
  TransferFlags        = 00000000 (USBD_TRANSFER_DIRECTION_OUT, ~USBD_SHORT_TRANSFER_OK)
  TransferBufferLength = 00000007
  TransferBuffer       = 00000000
  TransferBufferMDL    = 81cf5428
  UrbLink              = 00000000
[201413 ms] UsbSnoop - DispatchAny(f890e610) : IRP_MJ_INTERNAL_DEVICE_CONTROL
[201413 ms] UsbSnoop - MyDispatchInternalIOCTL(f890fe80) : fdo=81c63810, Irp=81d098c8, IRQL=2
[201413 ms]  >>>  URB 485 going down  >>> 
-- URB_FUNCTION_BULK_OR_INTERRUPT_TRANSFER:
  PipeHandle           = 81c9d144 [endpoint 0x00000081]
  TransferFlags        = 00000003 (USBD_TRANSFER_DIRECTION_IN, USBD_SHORT_TRANSFER_OK)
  TransferBufferLength = 00000100
  TransferBuffer       = 00000000
  TransferBufferMDL    = 81cf5428
  UrbLink              = 00000000
[201413 ms] UsbSnoop - MyInternalIOCTLCompletion(f890fdb0) : fido=822da020, Irp=81d098c8, Context=81c024b8, IRQL=2
[201413 ms]  <<<  URB 485 coming back  <<< 
-- URB_FUNCTION_BULK_OR_INTERRUPT_TRANSFER:
  PipeHandle           = 81c9d144 [endpoint 0x00000081]
  TransferFlags        = 00000003 (USBD_TRANSFER_DIRECTION_IN, USBD_SHORT_TRANSFER_OK)
  TransferBufferLength = 00000035
  TransferBuffer       = 00000000
  TransferBufferMDL    = 81cf5428
    00000000: 00 00 00 30 04 00 00 00 2a 00 0a 00 04 4c e2 82
    00000010: 84 00 00 06 00 02 00 00 04 f0 07 00 01 00 03 00
    00000020: 00 01 00 00 05 01 00 01 00 00 04 00 00 00 02 00
    00000030: 41 01 00 42 01
  UrbLink              = 00000000
[201453 ms] UsbSnoop - DispatchAny(f890e610) : IRP_MJ_INTERNAL_DEVICE_CONTROL
[201453 ms] UsbSnoop - MyDispatchInternalIOCTL(f890fe80) : fdo=81c63810, Irp=81d098c8, IRQL=2
[201453 ms]  >>>  URB 486 going down  >>> 
-- URB_FUNCTION_BULK_OR_INTERRUPT_TRANSFER:
  PipeHandle           = 81c9d164 [endpoint 0x00000002]
  TransferFlags        = 00000000 (USBD_TRANSFER_DIRECTION_OUT, ~USBD_SHORT_TRANSFER_OK)
  TransferBufferLength = 00000007
  TransferBuffer       = 00000000
  TransferBufferMDL    = 81cf5428
    00000000: 00 00 00 02 05 e0 00
  UrbLink              = 00000000
[201453 ms] UsbSnoop - MyInternalIOCTLCompletion(f890fdb0) : fido=822da020, Irp=81d098c8, Context=81b87c90, IRQL=2
[201453 ms]  <<<  URB 486 coming back  <<< 
-- URB_FUNCTION_BULK_OR_INTERRUPT_TRANSFER:
  PipeHandle           = 81c9d164 [endpoint 0x00000002]
  TransferFlags        = 00000000 (USBD_TRANSFER_DIRECTION_OUT, ~USBD_SHORT_TRANSFER_OK)
  TransferBufferLength = 00000007
  TransferBuffer       = 00000000
  TransferBufferMDL    = 81cf5428
  UrbLink              = 00000000
[201463 ms] UsbSnoop - DispatchAny(f890e610) : IRP_MJ_INTERNAL_DEVICE_CONTROL
[201463 ms] UsbSnoop - MyDispatchInternalIOCTL(f890fe80) : fdo=81c63810, Irp=81d098c8, IRQL=2
[201463 ms]  >>>  URB 487 going down  >>> 
-- URB_FUNCTION_BULK_OR_INTERRUPT_TRANSFER:
  PipeHandle           = 81c9d144 [endpoint 0x00000081]
  TransferFlags        = 00000003 (USBD_TRANSFER_DIRECTION_IN, USBD_SHORT_TRANSFER_OK)
  TransferBufferLength = 00000100
  TransferBuffer       = 00000000
  TransferBufferMDL    = 81cf5428
  UrbLink              = 00000000
[201463 ms] UsbSnoop - MyInternalIOCTLCompletion(f890fdb0) : fido=822da020, Irp=81d098c8, Context=81c024b8, IRQL=2
[201463 ms]  <<<  URB 487 coming back  <<< 
-- URB_FUNCTION_BULK_OR_INTERRUPT_TRANSFER:
  PipeHandle           = 81c9d144 [endpoint 0x00000081]
  TransferFlags        = 00000003 (USBD_TRANSFER_DIRECTION_IN, USBD_SHORT_TRANSFER_OK)
  TransferBufferLength = 00000035
  TransferBuffer       = 00000000
  TransferBufferMDL    = 81cf5428
    00000000: 00 00 00 30 04 00 00 00 2a 00 0a 00 04 4c e2 82
    00000010: 85 00 00 06 00 02 00 00 04 f0 07 00 01 00 03 00
    00000020: 00 01 00 00 05 01 00 01 00 00 04 00 00 00 02 00
    00000030: 41 01 00 42 01
  UrbLink              = 00000000
[201503 ms] UsbSnoop - DispatchAny(f890e610) : IRP_MJ_INTERNAL_DEVICE_CONTROL
[201503 ms] UsbSnoop - MyDispatchInternalIOCTL(f890fe80) : fdo=81c63810, Irp=822f0e48, IRQL=2
[201503 ms]  >>>  URB 488 going down  >>> 
-- URB_FUNCTION_BULK_OR_INTERRUPT_TRANSFER:
  PipeHandle           = 81c9d164 [endpoint 0x00000002]
  TransferFlags        = 00000000 (USBD_TRANSFER_DIRECTION_OUT, ~USBD_SHORT_TRANSFER_OK)
  TransferBufferLength = 00000007
  TransferBuffer       = 00000000
  TransferBufferMDL    = 81cf5428
    00000000: 00 00 00 02 05 e0 00
  UrbLink              = 00000000
[201503 ms] UsbSnoop - MyInternalIOCTLCompletion(f890fdb0) : fido=822da020, Irp=822f0e48, Context=822de5c8, IRQL=2
[201503 ms]  <<<  URB 488 coming back  <<< 
-- URB_FUNCTION_BULK_OR_INTERRUPT_TRANSFER:
  PipeHandle           = 81c9d164 [endpoint 0x00000002]
  TransferFlags        = 00000000 (USBD_TRANSFER_DIRECTION_OUT, ~USBD_SHORT_TRANSFER_OK)
  TransferBufferLength = 00000007
  TransferBuffer       = 00000000
  TransferBufferMDL    = 81cf5428
  UrbLink              = 00000000
[201513 ms] UsbSnoop - DispatchAny(f890e610) : IRP_MJ_INTERNAL_DEVICE_CONTROL
[201513 ms] UsbSnoop - MyDispatchInternalIOCTL(f890fe80) : fdo=81c63810, Irp=81b59008, IRQL=2
[201513 ms]  >>>  URB 489 going down  >>> 
-- URB_FUNCTION_BULK_OR_INTERRUPT_TRANSFER:
  PipeHandle           = 81c9d144 [endpoint 0x00000081]
  TransferFlags        = 00000003 (USBD_TRANSFER_DIRECTION_IN, USBD_SHORT_TRANSFER_OK)
  TransferBufferLength = 00000100
  TransferBuffer       = 00000000
  TransferBufferMDL    = 81cf5428
  UrbLink              = 00000000
[201514 ms] UsbSnoop - MyInternalIOCTLCompletion(f890fdb0) : fido=822da020, Irp=81b59008, Context=81b51c08, IRQL=2
[201514 ms]  <<<  URB 489 coming back  <<< 
-- URB_FUNCTION_BULK_OR_INTERRUPT_TRANSFER:
  PipeHandle           = 81c9d144 [endpoint 0x00000081]
  TransferFlags        = 00000003 (USBD_TRANSFER_DIRECTION_IN, USBD_SHORT_TRANSFER_OK)
  TransferBufferLength = 00000035
  TransferBuffer       = 00000000
  TransferBufferMDL    = 81cf5428
    00000000: 00 00 00 30 04 00 00 00 2a 00 0a 00 04 4c e2 82
    00000010: 86 00 00 06 00 02 00 00 04 f0 07 00 01 00 03 00
    00000020: 00 01 00 00 05 01 00 01 00 00 04 00 00 00 02 00
    00000030: 41 01 00 42 01
  UrbLink              = 00000000
[201553 ms] UsbSnoop - DispatchAny(f890e610) : IRP_MJ_INTERNAL_DEVICE_CONTROL
[201553 ms] UsbSnoop - MyDispatchInternalIOCTL(f890fe80) : fdo=81c63810, Irp=822f0e48, IRQL=2
[201553 ms]  >>>  URB 490 going down  >>> 
-- URB_FUNCTION_BULK_OR_INTERRUPT_TRANSFER:
  PipeHandle           = 81c9d164 [endpoint 0x00000002]
  TransferFlags        = 00000000 (USBD_TRANSFER_DIRECTION_OUT, ~USBD_SHORT_TRANSFER_OK)
  TransferBufferLength = 00000007
  TransferBuffer       = 00000000
  TransferBufferMDL    = 81cf5428
    00000000: 00 00 00 02 05 e0 00
  UrbLink              = 00000000
[201554 ms] UsbSnoop - MyInternalIOCTLCompletion(f890fdb0) : fido=822da020, Irp=822f0e48, Context=81c9a480, IRQL=2
[201554 ms]  <<<  URB 490 coming back  <<< 
-- URB_FUNCTION_BULK_OR_INTERRUPT_TRANSFER:
  PipeHandle           = 81c9d164 [endpoint 0x00000002]
  TransferFlags        = 00000000 (USBD_TRANSFER_DIRECTION_OUT, ~USBD_SHORT_TRANSFER_OK)
  TransferBufferLength = 00000007
  TransferBuffer       = 00000000
  TransferBufferMDL    = 81cf5428
  UrbLink              = 00000000
[201563 ms] UsbSnoop - DispatchAny(f890e610) : IRP_MJ_INTERNAL_DEVICE_CONTROL
[201563 ms] UsbSnoop - MyDispatchInternalIOCTL(f890fe80) : fdo=81c63810, Irp=822f0e48, IRQL=2
[201563 ms]  >>>  URB 491 going down  >>> 
-- URB_FUNCTION_BULK_OR_INTERRUPT_TRANSFER:
  PipeHandle           = 81c9d144 [endpoint 0x00000081]
  TransferFlags        = 00000003 (USBD_TRANSFER_DIRECTION_IN, USBD_SHORT_TRANSFER_OK)
  TransferBufferLength = 00000100
  TransferBuffer       = 00000000
  TransferBufferMDL    = 81cf5428
  UrbLink              = 00000000
[201563 ms] UsbSnoop - MyInternalIOCTLCompletion(f890fdb0) : fido=822da020, Irp=822f0e48, Context=81b87c90, IRQL=2
[201563 ms]  <<<  URB 491 coming back  <<< 
-- URB_FUNCTION_BULK_OR_INTERRUPT_TRANSFER:
  PipeHandle           = 81c9d144 [endpoint 0x00000081]
  TransferFlags        = 00000003 (USBD_TRANSFER_DIRECTION_IN, USBD_SHORT_TRANSFER_OK)
  TransferBufferLength = 0000000b
  TransferBuffer       = 00000000
  TransferBufferMDL    = 81cf5428
    00000000: 00 00 00 06 04 00 00 00 00 dd 00
  UrbLink              = 00000000
[201603 ms] UsbSnoop - DispatchAny(f890e610) : IRP_MJ_INTERNAL_DEVICE_CONTROL
[201603 ms] UsbSnoop - MyDispatchInternalIOCTL(f890fe80) : fdo=81c63810, Irp=822f0e48, IRQL=2
[201603 ms]  >>>  URB 492 going down  >>> 
-- URB_FUNCTION_BULK_OR_INTERRUPT_TRANSFER:
  PipeHandle           = 81c9d164 [endpoint 0x00000002]
  TransferFlags        = 00000000 (USBD_TRANSFER_DIRECTION_OUT, ~USBD_SHORT_TRANSFER_OK)
  TransferBufferLength = 00000007
  TransferBuffer       = 00000000
  TransferBufferMDL    = 81cf5428
    00000000: 00 00 00 02 05 e0 00
  UrbLink              = 00000000
[201604 ms] UsbSnoop - MyInternalIOCTLCompletion(f890fdb0) : fido=822da020, Irp=822f0e48, Context=81c024b8, IRQL=2
[201604 ms]  <<<  URB 492 coming back  <<< 
-- URB_FUNCTION_BULK_OR_INTERRUPT_TRANSFER:
  PipeHandle           = 81c9d164 [endpoint 0x00000002]
  TransferFlags        = 00000000 (USBD_TRANSFER_DIRECTION_OUT, ~USBD_SHORT_TRANSFER_OK)
  TransferBufferLength = 00000007
  TransferBuffer       = 00000000
  TransferBufferMDL    = 81cf5428
  UrbLink              = 00000000
[201864 ms] UsbSnoop - DispatchAny(f890e610) : IRP_MJ_INTERNAL_DEVICE_CONTROL
[201864 ms] UsbSnoop - MyDispatchInternalIOCTL(f890fe80) : fdo=81c63810, Irp=822f0e48, IRQL=2
[201864 ms]  >>>  URB 493 going down  >>> 
-- URB_FUNCTION_BULK_OR_INTERRUPT_TRANSFER:
  PipeHandle           = 81c9d164 [endpoint 0x00000002]
  TransferFlags        = 00000000 (USBD_TRANSFER_DIRECTION_OUT, ~USBD_SHORT_TRANSFER_OK)
  TransferBufferLength = 00000009
  TransferBuffer       = 00000000
  TransferBufferMDL    = 81cf5428
    00000000: 00 00 00 04 01 00 00 04 00
  UrbLink              = 00000000
[201864 ms] UsbSnoop - MyInternalIOCTLCompletion(f890fdb0) : fido=822da020, Irp=822f0e48, Context=81c9a480, IRQL=2
[201864 ms]  <<<  URB 493 coming back  <<< 
-- URB_FUNCTION_BULK_OR_INTERRUPT_TRANSFER:
  PipeHandle           = 81c9d164 [endpoint 0x00000002]
  TransferFlags        = 00000000 (USBD_TRANSFER_DIRECTION_OUT, ~USBD_SHORT_TRANSFER_OK)
  TransferBufferLength = 00000009
  TransferBuffer       = 00000000
  TransferBufferMDL    = 81cf5428
  UrbLink              = 00000000
[201864 ms] UsbSnoop - DispatchAny(f890e610) : IRP_MJ_INTERNAL_DEVICE_CONTROL
[201864 ms] UsbSnoop - MyDispatchInternalIOCTL(f890fe80) : fdo=81c63810, Irp=822f0e48, IRQL=2
[201864 ms]  >>>  URB 494 going down  >>> 
-- URB_FUNCTION_BULK_OR_INTERRUPT_TRANSFER:
  PipeHandle           = 81c9d144 [endpoint 0x00000081]
  TransferFlags        = 00000003 (USBD_TRANSFER_DIRECTION_IN, USBD_SHORT_TRANSFER_OK)
  TransferBufferLength = 00000100
  TransferBuffer       = 00000000
  TransferBufferMDL    = 81cf5428
  UrbLink              = 00000000
[201878 ms] UsbSnoop - MyInternalIOCTLCompletion(f890fdb0) : fido=822da020, Irp=822f0e48, Context=8218efe8, IRQL=2
[201878 ms]  <<<  URB 494 coming back  <<< 
-- URB_FUNCTION_BULK_OR_INTERRUPT_TRANSFER:
  PipeHandle           = 81c9d144 [endpoint 0x00000081]
  TransferFlags        = 00000003 (USBD_TRANSFER_DIRECTION_IN, USBD_SHORT_TRANSFER_OK)
  TransferBufferLength = 00000009
  TransferBuffer       = 00000000
  TransferBufferMDL    = 81cf5428
    00000000: 00 00 00 04 02 00 00 00 fa
  UrbLink              = 00000000
[201904 ms] UsbSnoop - DispatchAny(f890e610) : IRP_MJ_INTERNAL_DEVICE_CONTROL
[201904 ms] UsbSnoop - MyDispatchInternalIOCTL(f890fe80) : fdo=81c63810, Irp=822f0e48, IRQL=2
[201904 ms]  >>>  URB 495 going down  >>> 
-- URB_FUNCTION_BULK_OR_INTERRUPT_TRANSFER:
  PipeHandle           = 81c9d164 [endpoint 0x00000002]
  TransferFlags        = 00000000 (USBD_TRANSFER_DIRECTION_OUT, ~USBD_SHORT_TRANSFER_OK)
  TransferBufferLength = 00000015
  TransferBuffer       = 00000000
  TransferBufferMDL    = 81cf5428
    00000000: 00 00 00 10 04 00 00 00 0a 00 01 00 03 00 01 00
    00000010: 00 00 00 07 d0
  UrbLink              = 00000000
[201904 ms] UsbSnoop - MyInternalIOCTLCompletion(f890fdb0) : fido=822da020, Irp=822f0e48, Context=81c024b8, IRQL=2
[201904 ms]  <<<  URB 495 coming back  <<< 
-- URB_FUNCTION_BULK_OR_INTERRUPT_TRANSFER:
  PipeHandle           = 81c9d164 [endpoint 0x00000002]
  TransferFlags        = 00000000 (USBD_TRANSFER_DIRECTION_OUT, ~USBD_SHORT_TRANSFER_OK)
  TransferBufferLength = 00000015
  TransferBuffer       = 00000000
  TransferBufferMDL    = 81cf5428
  UrbLink              = 00000000
[201914 ms] UsbSnoop - DispatchAny(f890e610) : IRP_MJ_INTERNAL_DEVICE_CONTROL
[201914 ms] UsbSnoop - MyDispatchInternalIOCTL(f890fe80) : fdo=81c63810, Irp=822f0e48, IRQL=2
[201914 ms]  >>>  URB 496 going down  >>> 
-- URB_FUNCTION_BULK_OR_INTERRUPT_TRANSFER:
  PipeHandle           = 81c9d144 [endpoint 0x00000081]
  TransferFlags        = 00000003 (USBD_TRANSFER_DIRECTION_IN, USBD_SHORT_TRANSFER_OK)
  TransferBufferLength = 00000100
  TransferBuffer       = 00000000
  TransferBufferMDL    = 81cf5428
  UrbLink              = 00000000
[201914 ms] UsbSnoop - MyInternalIOCTLCompletion(f890fdb0) : fido=822da020, Irp=822f0e48, Context=8218efe8, IRQL=2
[201914 ms]  <<<  URB 496 coming back  <<< 
-- URB_FUNCTION_BULK_OR_INTERRUPT_TRANSFER:
  PipeHandle           = 81c9d144 [endpoint 0x00000081]
  TransferFlags        = 00000003 (USBD_TRANSFER_DIRECTION_IN, USBD_SHORT_TRANSFER_OK)
  TransferBufferLength = 00000007
  TransferBuffer       = 00000000
  TransferBufferMDL    = 81cf5428
    00000000: 00 00 00 02 05 e0 00
  UrbLink              = 00000000
[201954 ms] UsbSnoop - DispatchAny(f890e610) : IRP_MJ_INTERNAL_DEVICE_CONTROL
[201954 ms] UsbSnoop - MyDispatchInternalIOCTL(f890fe80) : fdo=81c63810, Irp=822f0e48, IRQL=2
[201954 ms]  >>>  URB 497 going down  >>> 
-- URB_FUNCTION_BULK_OR_INTERRUPT_TRANSFER:
  PipeHandle           = 81c9d144 [endpoint 0x00000081]
  TransferFlags        = 00000003 (USBD_TRANSFER_DIRECTION_IN, USBD_SHORT_TRANSFER_OK)
  TransferBufferLength = 00000100
  TransferBuffer       = 00000000
  TransferBufferMDL    = 81cf5428
  UrbLink              = 00000000
[201954 ms] UsbSnoop - MyInternalIOCTLCompletion(f890fdb0) : fido=822da020, Irp=822f0e48, Context=81c9a480, IRQL=2
[201954 ms]  <<<  URB 497 coming back  <<< 
-- URB_FUNCTION_BULK_OR_INTERRUPT_TRANSFER:
  PipeHandle           = 81c9d144 [endpoint 0x00000081]
  TransferFlags        = 00000003 (USBD_TRANSFER_DIRECTION_IN, USBD_SHORT_TRANSFER_OK)
  TransferBufferLength = 0000000f
  TransferBuffer       = 00000000
  TransferBufferMDL    = 81cf5428
    00000000: 00 00 00 0a 04 00 00 00 04 00 12 00 00 07 d0
  UrbLink              = 00000000
[201994 ms] UsbSnoop - DispatchAny(f890e610) : IRP_MJ_INTERNAL_DEVICE_CONTROL
[201994 ms] UsbSnoop - MyDispatchInternalIOCTL(f890fe80) : fdo=81c63810, Irp=822f0e48, IRQL=2
[201994 ms]  >>>  URB 498 going down  >>> 
-- URB_FUNCTION_BULK_OR_INTERRUPT_TRANSFER:
  PipeHandle           = 81c9d164 [endpoint 0x00000002]
  TransferFlags        = 00000000 (USBD_TRANSFER_DIRECTION_OUT, ~USBD_SHORT_TRANSFER_OK)
  TransferBufferLength = 00000007
  TransferBuffer       = 00000000
  TransferBufferMDL    = 81cf5428
    00000000: 00 00 00 02 05 e0 00
  UrbLink              = 00000000
[201994 ms] UsbSnoop - MyInternalIOCTLCompletion(f890fdb0) : fido=822da020, Irp=822f0e48, Context=8218efe8, IRQL=2
[201994 ms]  <<<  URB 498 coming back  <<< 
-- URB_FUNCTION_BULK_OR_INTERRUPT_TRANSFER:
  PipeHandle           = 81c9d164 [endpoint 0x00000002]
  TransferFlags        = 00000000 (USBD_TRANSFER_DIRECTION_OUT, ~USBD_SHORT_TRANSFER_OK)
  TransferBufferLength = 00000007
  TransferBuffer       = 00000000
  TransferBufferMDL    = 81cf5428
  UrbLink              = 00000000
[202004 ms] UsbSnoop - DispatchAny(f890e610) : IRP_MJ_INTERNAL_DEVICE_CONTROL
[202004 ms] UsbSnoop - MyDispatchInternalIOCTL(f890fe80) : fdo=81c63810, Irp=822f0e48, IRQL=2
[202004 ms]  >>>  URB 499 going down  >>> 
-- URB_FUNCTION_BULK_OR_INTERRUPT_TRANSFER:
  PipeHandle           = 81c9d164 [endpoint 0x00000002]
  TransferFlags        = 00000000 (USBD_TRANSFER_DIRECTION_OUT, ~USBD_SHORT_TRANSFER_OK)
  TransferBufferLength = 0000000f
  TransferBuffer       = 00000000
  TransferBufferMDL    = 81cf5428
    00000000: 00 00 00 0a 04 00 00 00 04 00 07 00 01 00 0e
  UrbLink              = 00000000
[202004 ms] UsbSnoop - MyInternalIOCTLCompletion(f890fdb0) : fido=822da020, Irp=822f0e48, Context=81b87c90, IRQL=2
[202004 ms]  <<<  URB 499 coming back  <<< 
-- URB_FUNCTION_BULK_OR_INTERRUPT_TRANSFER:
  PipeHandle           = 81c9d164 [endpoint 0x00000002]
  TransferFlags        = 00000000 (USBD_TRANSFER_DIRECTION_OUT, ~USBD_SHORT_TRANSFER_OK)
  TransferBufferLength = 0000000f
  TransferBuffer       = 00000000
  TransferBufferMDL    = 81cf5428
  UrbLink              = 00000000
[202014 ms] UsbSnoop - DispatchAny(f890e610) : IRP_MJ_INTERNAL_DEVICE_CONTROL
[202014 ms] UsbSnoop - MyDispatchInternalIOCTL(f890fe80) : fdo=81c63810, Irp=822f0e48, IRQL=2
[202014 ms]  >>>  URB 500 going down  >>> 
-- URB_FUNCTION_BULK_OR_INTERRUPT_TRANSFER:
  PipeHandle           = 81c9d144 [endpoint 0x00000081]
  TransferFlags        = 00000003 (USBD_TRANSFER_DIRECTION_IN, USBD_SHORT_TRANSFER_OK)
  TransferBufferLength = 00000100
  TransferBuffer       = 00000000
  TransferBufferMDL    = 81cf5428
  UrbLink              = 00000000
[202017 ms] UsbSnoop - MyInternalIOCTLCompletion(f890fdb0) : fido=822da020, Irp=822f0e48, Context=81c9a480, IRQL=2
[202017 ms]  <<<  URB 500 coming back  <<< 
-- URB_FUNCTION_BULK_OR_INTERRUPT_TRANSFER:
  PipeHandle           = 81c9d144 [endpoint 0x00000081]
  TransferFlags        = 00000003 (USBD_TRANSFER_DIRECTION_IN, USBD_SHORT_TRANSFER_OK)
  TransferBufferLength = 00000007
  TransferBuffer       = 00000000
  TransferBufferMDL    = 81cf5428
    00000000: 00 00 00 02 05 e0 00
  UrbLink              = 00000000
[202054 ms] UsbSnoop - DispatchAny(f890e610) : IRP_MJ_INTERNAL_DEVICE_CONTROL
[202054 ms] UsbSnoop - MyDispatchInternalIOCTL(f890fe80) : fdo=81c63810, Irp=822f0e48, IRQL=2
[202054 ms]  >>>  URB 501 going down  >>> 
-- URB_FUNCTION_BULK_OR_INTERRUPT_TRANSFER:
  PipeHandle           = 81c9d144 [endpoint 0x00000081]
  TransferFlags        = 00000003 (USBD_TRANSFER_DIRECTION_IN, USBD_SHORT_TRANSFER_OK)
  TransferBufferLength = 00000100
  TransferBuffer       = 00000000
  TransferBufferMDL    = 81cf5428
  UrbLink              = 00000000
[202054 ms] UsbSnoop - MyInternalIOCTLCompletion(f890fdb0) : fido=822da020, Irp=822f0e48, Context=8218efe8, IRQL=2
[202054 ms]  <<<  URB 501 coming back  <<< 
-- URB_FUNCTION_BULK_OR_INTERRUPT_TRANSFER:
  PipeHandle           = 81c9d144 [endpoint 0x00000081]
  TransferFlags        = 00000003 (USBD_TRANSFER_DIRECTION_IN, USBD_SHORT_TRANSFER_OK)
  TransferBufferLength = 0000000f
  TransferBuffer       = 00000000
  TransferBufferMDL    = 81cf5428
    00000000: 00 00 00 0a 04 00 00 00 04 bb 00 00 01 d4 c0
  UrbLink              = 00000000
[202094 ms] UsbSnoop - DispatchAny(f890e610) : IRP_MJ_INTERNAL_DEVICE_CONTROL
[202094 ms] UsbSnoop - MyDispatchInternalIOCTL(f890fe80) : fdo=81c63810, Irp=822f0e48, IRQL=2
[202094 ms]  >>>  URB 502 going down  >>> 
-- URB_FUNCTION_BULK_OR_INTERRUPT_TRANSFER:
  PipeHandle           = 81c9d164 [endpoint 0x00000002]
  TransferFlags        = 00000000 (USBD_TRANSFER_DIRECTION_OUT, ~USBD_SHORT_TRANSFER_OK)
  TransferBufferLength = 00000007
  TransferBuffer       = 00000000
  TransferBufferMDL    = 81cf5428
    00000000: 00 00 00 02 05 e0 00
  UrbLink              = 00000000
[202094 ms] UsbSnoop - MyInternalIOCTLCompletion(f890fdb0) : fido=822da020, Irp=822f0e48, Context=81c9a480, IRQL=2
[202094 ms]  <<<  URB 502 coming back  <<< 
-- URB_FUNCTION_BULK_OR_INTERRUPT_TRANSFER:
  PipeHandle           = 81c9d164 [endpoint 0x00000002]
  TransferFlags        = 00000000 (USBD_TRANSFER_DIRECTION_OUT, ~USBD_SHORT_TRANSFER_OK)
  TransferBufferLength = 00000007
  TransferBuffer       = 00000000
  TransferBufferMDL    = 81cf5428
  UrbLink              = 00000000
[202104 ms] UsbSnoop - DispatchAny(f890e610) : IRP_MJ_INTERNAL_DEVICE_CONTROL
[202104 ms] UsbSnoop - MyDispatchInternalIOCTL(f890fe80) : fdo=81c63810, Irp=822f0e48, IRQL=2
[202104 ms]  >>>  URB 503 going down  >>> 
-- URB_FUNCTION_BULK_OR_INTERRUPT_TRANSFER:
  PipeHandle           = 81c9d144 [endpoint 0x00000081]
  TransferFlags        = 00000003 (USBD_TRANSFER_DIRECTION_IN, USBD_SHORT_TRANSFER_OK)
  TransferBufferLength = 00000100
  TransferBuffer       = 00000000
  TransferBufferMDL    = 81cf5428
  UrbLink              = 00000000
[202104 ms] UsbSnoop - MyInternalIOCTLCompletion(f890fdb0) : fido=822da020, Irp=822f0e48, Context=822de5c8, IRQL=2
[202104 ms]  <<<  URB 503 coming back  <<< 
-- URB_FUNCTION_BULK_OR_INTERRUPT_TRANSFER:
  PipeHandle           = 81c9d144 [endpoint 0x00000081]
  TransferFlags        = 00000003 (USBD_TRANSFER_DIRECTION_IN, USBD_SHORT_TRANSFER_OK)
  TransferBufferLength = 0000001a
  TransferBuffer       = 00000000
  TransferBufferMDL    = 81cf5428
    00000000: 00 00 00 15 04 00 00 00 0f 00 08 00 01 00 0e 00
    00000010: 00 08 00 00 00 00 00 00 5e d0
  UrbLink              = 00000000
[202144 ms] UsbSnoop - DispatchAny(f890e610) : IRP_MJ_INTERNAL_DEVICE_CONTROL
[202144 ms] UsbSnoop - MyDispatchInternalIOCTL(f890fe80) : fdo=81c63810, Irp=822f0e48, IRQL=2
[202144 ms]  >>>  URB 504 going down  >>> 
-- URB_FUNCTION_BULK_OR_INTERRUPT_TRANSFER:
  PipeHandle           = 81c9d164 [endpoint 0x00000002]
  TransferFlags        = 00000000 (USBD_TRANSFER_DIRECTION_OUT, ~USBD_SHORT_TRANSFER_OK)
  TransferBufferLength = 00000007
  TransferBuffer       = 00000000
  TransferBufferMDL    = 81cf5428
    00000000: 00 00 00 02 05 e0 00
  UrbLink              = 00000000
[202144 ms] UsbSnoop - MyInternalIOCTLCompletion(f890fdb0) : fido=822da020, Irp=822f0e48, Context=81b51c08, IRQL=2
[202144 ms]  <<<  URB 504 coming back  <<< 
-- URB_FUNCTION_BULK_OR_INTERRUPT_TRANSFER:
  PipeHandle           = 81c9d164 [endpoint 0x00000002]
  TransferFlags        = 00000000 (USBD_TRANSFER_DIRECTION_OUT, ~USBD_SHORT_TRANSFER_OK)
  TransferBufferLength = 00000007
  TransferBuffer       = 00000000
  TransferBufferMDL    = 81cf5428
  UrbLink              = 00000000
[202415 ms] UsbSnoop - DispatchAny(f890e610) : IRP_MJ_INTERNAL_DEVICE_CONTROL
[202415 ms] UsbSnoop - MyDispatchInternalIOCTL(f890fe80) : fdo=81c63810, Irp=822f0e48, IRQL=2
[202415 ms]  >>>  URB 505 going down  >>> 
-- URB_FUNCTION_BULK_OR_INTERRUPT_TRANSFER:
  PipeHandle           = 81c9d164 [endpoint 0x00000002]
  TransferFlags        = 00000000 (USBD_TRANSFER_DIRECTION_OUT, ~USBD_SHORT_TRANSFER_OK)
  TransferBufferLength = 00000009
  TransferBuffer       = 00000000
  TransferBufferMDL    = 81cf5428
    00000000: 00 00 00 04 01 00 00 04 00
  UrbLink              = 00000000
[202415 ms] UsbSnoop - MyInternalIOCTLCompletion(f890fdb0) : fido=822da020, Irp=822f0e48, Context=81c024b8, IRQL=2
[202415 ms]  <<<  URB 505 coming back  <<< 
-- URB_FUNCTION_BULK_OR_INTERRUPT_TRANSFER:
  PipeHandle           = 81c9d164 [endpoint 0x00000002]
  TransferFlags        = 00000000 (USBD_TRANSFER_DIRECTION_OUT, ~USBD_SHORT_TRANSFER_OK)
  TransferBufferLength = 00000009
  TransferBuffer       = 00000000
  TransferBufferMDL    = 81cf5428
  UrbLink              = 00000000
[202415 ms] UsbSnoop - DispatchAny(f890e610) : IRP_MJ_INTERNAL_DEVICE_CONTROL
[202415 ms] UsbSnoop - MyDispatchInternalIOCTL(f890fe80) : fdo=81c63810, Irp=822f0e48, IRQL=2
[202415 ms]  >>>  URB 506 going down  >>> 
-- URB_FUNCTION_BULK_OR_INTERRUPT_TRANSFER:
  PipeHandle           = 81c9d144 [endpoint 0x00000081]
  TransferFlags        = 00000003 (USBD_TRANSFER_DIRECTION_IN, USBD_SHORT_TRANSFER_OK)
  TransferBufferLength = 00000100
  TransferBuffer       = 00000000
  TransferBufferMDL    = 81cf5428
  UrbLink              = 00000000
[202425 ms] UsbSnoop - MyInternalIOCTLCompletion(f890fdb0) : fido=822da020, Irp=822f0e48, Context=81c9a480, IRQL=2
[202425 ms]  <<<  URB 506 coming back  <<< 
-- URB_FUNCTION_BULK_OR_INTERRUPT_TRANSFER:
  PipeHandle           = 81c9d144 [endpoint 0x00000081]
  TransferFlags        = 00000003 (USBD_TRANSFER_DIRECTION_IN, USBD_SHORT_TRANSFER_OK)
  TransferBufferLength = 00000009
  TransferBuffer       = 00000000
  TransferBufferMDL    = 81cf5428
    00000000: 00 00 00 04 02 00 00 00 fa
  UrbLink              = 00000000
[202455 ms] UsbSnoop - DispatchAny(f890e610) : IRP_MJ_INTERNAL_DEVICE_CONTROL
[202455 ms] UsbSnoop - MyDispatchInternalIOCTL(f890fe80) : fdo=81c63810, Irp=822f0e48, IRQL=2
[202455 ms]  >>>  URB 507 going down  >>> 
-- URB_FUNCTION_BULK_OR_INTERRUPT_TRANSFER:
  PipeHandle           = 81c9d164 [endpoint 0x00000002]
  TransferFlags        = 00000000 (USBD_TRANSFER_DIRECTION_OUT, ~USBD_SHORT_TRANSFER_OK)
  TransferBufferLength = 00000015
  TransferBuffer       = 00000000
  TransferBufferMDL    = 81cf5428
    00000000: 00 00 00 10 04 00 00 00 0a 00 01 00 03 00 01 00
    00000010: 00 00 00 07 d0
  UrbLink              = 00000000
[202455 ms] UsbSnoop - MyInternalIOCTLCompletion(f890fdb0) : fido=822da020, Irp=822f0e48, Context=81bc6e50, IRQL=2
[202455 ms]  <<<  URB 507 coming back  <<< 
-- URB_FUNCTION_BULK_OR_INTERRUPT_TRANSFER:
  PipeHandle           = 81c9d164 [endpoint 0x00000002]
  TransferFlags        = 00000000 (USBD_TRANSFER_DIRECTION_OUT, ~USBD_SHORT_TRANSFER_OK)
  TransferBufferLength = 00000015
  TransferBuffer       = 00000000
  TransferBufferMDL    = 81cf5428
  UrbLink              = 00000000
[202465 ms] UsbSnoop - DispatchAny(f890e610) : IRP_MJ_INTERNAL_DEVICE_CONTROL
[202465 ms] UsbSnoop - MyDispatchInternalIOCTL(f890fe80) : fdo=81c63810, Irp=822f0e48, IRQL=2
[202465 ms]  >>>  URB 508 going down  >>> 
-- URB_FUNCTION_BULK_OR_INTERRUPT_TRANSFER:
  PipeHandle           = 81c9d144 [endpoint 0x00000081]
  TransferFlags        = 00000003 (USBD_TRANSFER_DIRECTION_IN, USBD_SHORT_TRANSFER_OK)
  TransferBufferLength = 00000100
  TransferBuffer       = 00000000
  TransferBufferMDL    = 81cf5428
  UrbLink              = 00000000
[202465 ms] UsbSnoop - MyInternalIOCTLCompletion(f890fdb0) : fido=822da020, Irp=822f0e48, Context=822de5c8, IRQL=2
[202465 ms]  <<<  URB 508 coming back  <<< 
-- URB_FUNCTION_BULK_OR_INTERRUPT_TRANSFER:
  PipeHandle           = 81c9d144 [endpoint 0x00000081]
  TransferFlags        = 00000003 (USBD_TRANSFER_DIRECTION_IN, USBD_SHORT_TRANSFER_OK)
  TransferBufferLength = 00000007
  TransferBuffer       = 00000000
  TransferBufferMDL    = 81cf5428
    00000000: 00 00 00 02 05 e0 00
  UrbLink              = 00000000
[202505 ms] UsbSnoop - DispatchAny(f890e610) : IRP_MJ_INTERNAL_DEVICE_CONTROL
[202505 ms] UsbSnoop - MyDispatchInternalIOCTL(f890fe80) : fdo=81c63810, Irp=822f0e48, IRQL=2
[202505 ms]  >>>  URB 509 going down  >>> 
-- URB_FUNCTION_BULK_OR_INTERRUPT_TRANSFER:
  PipeHandle           = 81c9d144 [endpoint 0x00000081]
  TransferFlags        = 00000003 (USBD_TRANSFER_DIRECTION_IN, USBD_SHORT_TRANSFER_OK)
  TransferBufferLength = 00000100
  TransferBuffer       = 00000000
  TransferBufferMDL    = 81cf5428
  UrbLink              = 00000000
[202505 ms] UsbSnoop - MyInternalIOCTLCompletion(f890fdb0) : fido=822da020, Irp=822f0e48, Context=81bc6e50, IRQL=2
[202505 ms]  <<<  URB 509 coming back  <<< 
-- URB_FUNCTION_BULK_OR_INTERRUPT_TRANSFER:
  PipeHandle           = 81c9d144 [endpoint 0x00000081]
  TransferFlags        = 00000003 (USBD_TRANSFER_DIRECTION_IN, USBD_SHORT_TRANSFER_OK)
  TransferBufferLength = 0000000f
  TransferBuffer       = 00000000
  TransferBufferMDL    = 81cf5428
    00000000: 00 00 00 0a 04 00 00 00 04 00 12 00 00 07 d0
  UrbLink              = 00000000
[202545 ms] UsbSnoop - DispatchAny(f890e610) : IRP_MJ_INTERNAL_DEVICE_CONTROL
[202545 ms] UsbSnoop - MyDispatchInternalIOCTL(f890fe80) : fdo=81c63810, Irp=822f0e48, IRQL=2
[202545 ms]  >>>  URB 510 going down  >>> 
-- URB_FUNCTION_BULK_OR_INTERRUPT_TRANSFER:
  PipeHandle           = 81c9d164 [endpoint 0x00000002]
  TransferFlags        = 00000000 (USBD_TRANSFER_DIRECTION_OUT, ~USBD_SHORT_TRANSFER_OK)
  TransferBufferLength = 00000007
  TransferBuffer       = 00000000
  TransferBufferMDL    = 82315078
    00000000: 00 00 00 02 05 e0 00
  UrbLink              = 00000000
[202545 ms] UsbSnoop - MyInternalIOCTLCompletion(f890fdb0) : fido=822da020, Irp=822f0e48, Context=8218efe8, IRQL=2
[202545 ms]  <<<  URB 510 coming back  <<< 
-- URB_FUNCTION_BULK_OR_INTERRUPT_TRANSFER:
  PipeHandle           = 81c9d164 [endpoint 0x00000002]
  TransferFlags        = 00000000 (USBD_TRANSFER_DIRECTION_OUT, ~USBD_SHORT_TRANSFER_OK)
  TransferBufferLength = 00000007
  TransferBuffer       = 00000000
  TransferBufferMDL    = 82315078
  UrbLink              = 00000000
[202555 ms] UsbSnoop - DispatchAny(f890e610) : IRP_MJ_INTERNAL_DEVICE_CONTROL
[202555 ms] UsbSnoop - MyDispatchInternalIOCTL(f890fe80) : fdo=81c63810, Irp=822f0e48, IRQL=2
[202555 ms]  >>>  URB 511 going down  >>> 
-- URB_FUNCTION_BULK_OR_INTERRUPT_TRANSFER:
  PipeHandle           = 81c9d164 [endpoint 0x00000002]
  TransferFlags        = 00000000 (USBD_TRANSFER_DIRECTION_OUT, ~USBD_SHORT_TRANSFER_OK)
  TransferBufferLength = 00000029
  TransferBuffer       = 00000000
  TransferBufferMDL    = 82315078
    00000000: 00 00 00 24 04 00 00 00 1e 00 07 00 0e 00 0b 00
    00000010: 04 00 06 00 07 00 01 00 02 00 0a 00 37 00 0d 00
    00000020: 38 00 09 00 0e 00 2d 00 03
  UrbLink              = 00000000
[202555 ms] UsbSnoop - MyInternalIOCTLCompletion(f890fdb0) : fido=822da020, Irp=822f0e48, Context=81c9a480, IRQL=2
[202555 ms]  <<<  URB 511 coming back  <<< 
-- URB_FUNCTION_BULK_OR_INTERRUPT_TRANSFER:
  PipeHandle           = 81c9d164 [endpoint 0x00000002]
  TransferFlags        = 00000000 (USBD_TRANSFER_DIRECTION_OUT, ~USBD_SHORT_TRANSFER_OK)
  TransferBufferLength = 00000029
  TransferBuffer       = 00000000
  TransferBufferMDL    = 82315078
  UrbLink              = 00000000
[202566 ms] UsbSnoop - DispatchAny(f890e610) : IRP_MJ_INTERNAL_DEVICE_CONTROL
[202566 ms] UsbSnoop - MyDispatchInternalIOCTL(f890fe80) : fdo=81c63810, Irp=822f0e48, IRQL=2
[202566 ms]  >>>  URB 512 going down  >>> 
-- URB_FUNCTION_BULK_OR_INTERRUPT_TRANSFER:
  PipeHandle           = 81c9d144 [endpoint 0x00000081]
  TransferFlags        = 00000003 (USBD_TRANSFER_DIRECTION_IN, USBD_SHORT_TRANSFER_OK)
  TransferBufferLength = 00000100
  TransferBuffer       = 00000000
  TransferBufferMDL    = 82315078
  UrbLink              = 00000000
[202566 ms] UsbSnoop - MyInternalIOCTLCompletion(f890fdb0) : fido=822da020, Irp=822f0e48, Context=81bc6e50, IRQL=2
[202566 ms]  <<<  URB 512 coming back  <<< 
-- URB_FUNCTION_BULK_OR_INTERRUPT_TRANSFER:
  PipeHandle           = 81c9d144 [endpoint 0x00000081]
  TransferFlags        = 00000003 (USBD_TRANSFER_DIRECTION_IN, USBD_SHORT_TRANSFER_OK)
  TransferBufferLength = 00000007
  TransferBuffer       = 00000000
  TransferBufferMDL    = 82315078
    00000000: 00 00 00 02 05 e0 00
  UrbLink              = 00000000
[202605 ms] UsbSnoop - DispatchAny(f890e610) : IRP_MJ_INTERNAL_DEVICE_CONTROL
[202605 ms] UsbSnoop - MyDispatchInternalIOCTL(f890fe80) : fdo=81c63810, Irp=822f0e48, IRQL=2
[202605 ms]  >>>  URB 513 going down  >>> 
-- URB_FUNCTION_BULK_OR_INTERRUPT_TRANSFER:
  PipeHandle           = 81c9d144 [endpoint 0x00000081]
  TransferFlags        = 00000003 (USBD_TRANSFER_DIRECTION_IN, USBD_SHORT_TRANSFER_OK)
  TransferBufferLength = 00000100
  TransferBuffer       = 00000000
  TransferBufferMDL    = 82315078
  UrbLink              = 00000000
[202605 ms] UsbSnoop - MyInternalIOCTLCompletion(f890fdb0) : fido=822da020, Irp=822f0e48, Context=81c9a480, IRQL=2
[202605 ms]  <<<  URB 513 coming back  <<< 
-- URB_FUNCTION_BULK_OR_INTERRUPT_TRANSFER:
  PipeHandle           = 81c9d144 [endpoint 0x00000081]
  TransferFlags        = 00000003 (USBD_TRANSFER_DIRECTION_IN, USBD_SHORT_TRANSFER_OK)
  TransferBufferLength = 0000000f
  TransferBuffer       = 00000000
  TransferBufferMDL    = 82315078
    00000000: 00 00 00 0a 04 00 00 00 04 bb 00 00 01 d4 c0
  UrbLink              = 00000000
[202645 ms] UsbSnoop - DispatchAny(f890e610) : IRP_MJ_INTERNAL_DEVICE_CONTROL
[202645 ms] UsbSnoop - MyDispatchInternalIOCTL(f890fe80) : fdo=81c63810, Irp=822f0e48, IRQL=2
[202645 ms]  >>>  URB 514 going down  >>> 
-- URB_FUNCTION_BULK_OR_INTERRUPT_TRANSFER:
  PipeHandle           = 81c9d164 [endpoint 0x00000002]
  TransferFlags        = 00000000 (USBD_TRANSFER_DIRECTION_OUT, ~USBD_SHORT_TRANSFER_OK)
  TransferBufferLength = 00000007
  TransferBuffer       = 00000000
  TransferBufferMDL    = 82315078
    00000000: 00 00 00 02 05 e0 00
  UrbLink              = 00000000
[202645 ms] UsbSnoop - MyInternalIOCTLCompletion(f890fdb0) : fido=822da020, Irp=822f0e48, Context=81b51c08, IRQL=2
[202645 ms]  <<<  URB 514 coming back  <<< 
-- URB_FUNCTION_BULK_OR_INTERRUPT_TRANSFER:
  PipeHandle           = 81c9d164 [endpoint 0x00000002]
  TransferFlags        = 00000000 (USBD_TRANSFER_DIRECTION_OUT, ~USBD_SHORT_TRANSFER_OK)
  TransferBufferLength = 00000007
  TransferBuffer       = 00000000
  TransferBufferMDL    = 82315078
  UrbLink              = 00000000
[202655 ms] UsbSnoop - DispatchAny(f890e610) : IRP_MJ_INTERNAL_DEVICE_CONTROL
[202655 ms] UsbSnoop - MyDispatchInternalIOCTL(f890fe80) : fdo=81c63810, Irp=822f0e48, IRQL=2
[202655 ms]  >>>  URB 515 going down  >>> 
-- URB_FUNCTION_BULK_OR_INTERRUPT_TRANSFER:
  PipeHandle           = 81c9d144 [endpoint 0x00000081]
  TransferFlags        = 00000003 (USBD_TRANSFER_DIRECTION_IN, USBD_SHORT_TRANSFER_OK)
  TransferBufferLength = 00000100
  TransferBuffer       = 00000000
  TransferBufferMDL    = 82315078
  UrbLink              = 00000000
[202715 ms] UsbSnoop - MyInternalIOCTLCompletion(f890fdb0) : fido=822da020, Irp=822f0e48, Context=81c024b8, IRQL=2
[202715 ms]  <<<  URB 515 coming back  <<< 
-- URB_FUNCTION_BULK_OR_INTERRUPT_TRANSFER:
  PipeHandle           = 81c9d144 [endpoint 0x00000081]
  TransferFlags        = 00000003 (USBD_TRANSFER_DIRECTION_IN, USBD_SHORT_TRANSFER_OK)
  TransferBufferLength = 00000095
  TransferBuffer       = 00000000
  TransferBufferMDL    = 82315078
    00000000: 00 00 00 90 04 00 00 00 8a 00 08 00 0e 00 0b 00
    00000010: 00 04 00 02 28 00 00 04 00 00 02 00 03 00 06 00
    00000020: 00 01 09 00 07 00 00 01 01 00 01 00 00 04 00 00
    00000030: 00 0a 00 02 00 00 19 54 49 2d 38 34 20 50 6c 75
    00000040: 73 20 53 69 6c 76 65 72 20 45 64 69 74 69 6f 6e
    00000050: 00 0a 00 00 01 01 00 37 00 00 01 01 00 0d 00 00
    00000060: 08 00 00 00 00 00 00 5e fd 00 38 00 00 01 00 00
    00000070: 09 00 00 04 00 01 00 00 00 0e 00 00 08 00 00 00
    00000080: 00 00 00 5e d0 00 2d 00 00 01 01 00 03 00 00 05
    00000090: 0a 32 cc e3 01
  UrbLink              = 00000000
[202756 ms] UsbSnoop - DispatchAny(f890e610) : IRP_MJ_INTERNAL_DEVICE_CONTROL
[202756 ms] UsbSnoop - MyDispatchInternalIOCTL(f890fe80) : fdo=81c63810, Irp=822f0e48, IRQL=2
[202756 ms]  >>>  URB 516 going down  >>> 
-- URB_FUNCTION_BULK_OR_INTERRUPT_TRANSFER:
  PipeHandle           = 81c9d164 [endpoint 0x00000002]
  TransferFlags        = 00000000 (USBD_TRANSFER_DIRECTION_OUT, ~USBD_SHORT_TRANSFER_OK)
  TransferBufferLength = 00000007
  TransferBuffer       = 00000000
  TransferBufferMDL    = 82315078
    00000000: 00 00 00 02 05 e0 00
  UrbLink              = 00000000
[202757 ms] UsbSnoop - MyInternalIOCTLCompletion(f890fdb0) : fido=822da020, Irp=822f0e48, Context=81c9a480, IRQL=2
[202757 ms]  <<<  URB 516 coming back  <<< 
-- URB_FUNCTION_BULK_OR_INTERRUPT_TRANSFER:
  PipeHandle           = 81c9d164 [endpoint 0x00000002]
  TransferFlags        = 00000000 (USBD_TRANSFER_DIRECTION_OUT, ~USBD_SHORT_TRANSFER_OK)
  TransferBufferLength = 00000007
  TransferBuffer       = 00000000
  TransferBufferMDL    = 82315078
  UrbLink              = 00000000
[203016 ms] UsbSnoop - DispatchAny(f890e610) : IRP_MJ_INTERNAL_DEVICE_CONTROL
[203016 ms] UsbSnoop - MyDispatchInternalIOCTL(f890fe80) : fdo=81c63810, Irp=822f0e48, IRQL=2
[203016 ms]  >>>  URB 517 going down  >>> 
-- URB_FUNCTION_BULK_OR_INTERRUPT_TRANSFER:
  PipeHandle           = 81c9d164 [endpoint 0x00000002]
  TransferFlags        = 00000000 (USBD_TRANSFER_DIRECTION_OUT, ~USBD_SHORT_TRANSFER_OK)
  TransferBufferLength = 00000009
  TransferBuffer       = 00000000
  TransferBufferMDL    = 82315078
    00000000: 00 00 00 04 01 00 00 04 00
  UrbLink              = 00000000
[203016 ms] UsbSnoop - MyInternalIOCTLCompletion(f890fdb0) : fido=822da020, Irp=822f0e48, Context=81c024b8, IRQL=2
[203016 ms]  <<<  URB 517 coming back  <<< 
-- URB_FUNCTION_BULK_OR_INTERRUPT_TRANSFER:
  PipeHandle           = 81c9d164 [endpoint 0x00000002]
  TransferFlags        = 00000000 (USBD_TRANSFER_DIRECTION_OUT, ~USBD_SHORT_TRANSFER_OK)
  TransferBufferLength = 00000009
  TransferBuffer       = 00000000
  TransferBufferMDL    = 82315078
  UrbLink              = 00000000
[203016 ms] UsbSnoop - DispatchAny(f890e610) : IRP_MJ_INTERNAL_DEVICE_CONTROL
[203016 ms] UsbSnoop - MyDispatchInternalIOCTL(f890fe80) : fdo=81c63810, Irp=822f0e48, IRQL=2
[203016 ms]  >>>  URB 518 going down  >>> 
-- URB_FUNCTION_BULK_OR_INTERRUPT_TRANSFER:
  PipeHandle           = 81c9d144 [endpoint 0x00000081]
  TransferFlags        = 00000003 (USBD_TRANSFER_DIRECTION_IN, USBD_SHORT_TRANSFER_OK)
  TransferBufferLength = 00000100
  TransferBuffer       = 00000000
  TransferBufferMDL    = 82315078
  UrbLink              = 00000000
[203028 ms] UsbSnoop - MyInternalIOCTLCompletion(f890fdb0) : fido=822da020, Irp=822f0e48, Context=822de5c8, IRQL=2
[203028 ms]  <<<  URB 518 coming back  <<< 
-- URB_FUNCTION_BULK_OR_INTERRUPT_TRANSFER:
  PipeHandle           = 81c9d144 [endpoint 0x00000081]
  TransferFlags        = 00000003 (USBD_TRANSFER_DIRECTION_IN, USBD_SHORT_TRANSFER_OK)
  TransferBufferLength = 00000009
  TransferBuffer       = 00000000
  TransferBufferMDL    = 82315078
    00000000: 00 00 00 04 02 00 00 00 fa
  UrbLink              = 00000000
[203056 ms] UsbSnoop - DispatchAny(f890e610) : IRP_MJ_INTERNAL_DEVICE_CONTROL
[203056 ms] UsbSnoop - MyDispatchInternalIOCTL(f890fe80) : fdo=81c63810, Irp=822f0e48, IRQL=2
[203056 ms]  >>>  URB 519 going down  >>> 
-- URB_FUNCTION_BULK_OR_INTERRUPT_TRANSFER:
  PipeHandle           = 81c9d164 [endpoint 0x00000002]
  TransferFlags        = 00000000 (USBD_TRANSFER_DIRECTION_OUT, ~USBD_SHORT_TRANSFER_OK)
  TransferBufferLength = 00000015
  TransferBuffer       = 00000000
  TransferBufferMDL    = 82315078
    00000000: 00 00 00 10 04 00 00 00 0a 00 01 00 03 00 01 00
    00000010: 00 00 00 07 d0
  UrbLink              = 00000000
[203056 ms] UsbSnoop - MyInternalIOCTLCompletion(f890fdb0) : fido=822da020, Irp=822f0e48, Context=81b51c08, IRQL=2
[203056 ms]  <<<  URB 519 coming back  <<< 
-- URB_FUNCTION_BULK_OR_INTERRUPT_TRANSFER:
  PipeHandle           = 81c9d164 [endpoint 0x00000002]
  TransferFlags        = 00000000 (USBD_TRANSFER_DIRECTION_OUT, ~USBD_SHORT_TRANSFER_OK)
  TransferBufferLength = 00000015
  TransferBuffer       = 00000000
  TransferBufferMDL    = 82315078
  UrbLink              = 00000000
[203066 ms] UsbSnoop - DispatchAny(f890e610) : IRP_MJ_INTERNAL_DEVICE_CONTROL
[203066 ms] UsbSnoop - MyDispatchInternalIOCTL(f890fe80) : fdo=81c63810, Irp=822f0e48, IRQL=2
[203066 ms]  >>>  URB 520 going down  >>> 
-- URB_FUNCTION_BULK_OR_INTERRUPT_TRANSFER:
  PipeHandle           = 81c9d144 [endpoint 0x00000081]
  TransferFlags        = 00000003 (USBD_TRANSFER_DIRECTION_IN, USBD_SHORT_TRANSFER_OK)
  TransferBufferLength = 00000100
  TransferBuffer       = 00000000
  TransferBufferMDL    = 82315078
  UrbLink              = 00000000
[203066 ms] UsbSnoop - MyInternalIOCTLCompletion(f890fdb0) : fido=822da020, Irp=822f0e48, Context=822de5c8, IRQL=2
[203066 ms]  <<<  URB 520 coming back  <<< 
-- URB_FUNCTION_BULK_OR_INTERRUPT_TRANSFER:
  PipeHandle           = 81c9d144 [endpoint 0x00000081]
  TransferFlags        = 00000003 (USBD_TRANSFER_DIRECTION_IN, USBD_SHORT_TRANSFER_OK)
  TransferBufferLength = 00000007
  TransferBuffer       = 00000000
  TransferBufferMDL    = 82315078
    00000000: 00 00 00 02 05 e0 00
  UrbLink              = 00000000
[203106 ms] UsbSnoop - DispatchAny(f890e610) : IRP_MJ_INTERNAL_DEVICE_CONTROL
[203106 ms] UsbSnoop - MyDispatchInternalIOCTL(f890fe80) : fdo=81c63810, Irp=822f0e48, IRQL=2
[203106 ms]  >>>  URB 521 going down  >>> 
-- URB_FUNCTION_BULK_OR_INTERRUPT_TRANSFER:
  PipeHandle           = 81c9d144 [endpoint 0x00000081]
  TransferFlags        = 00000003 (USBD_TRANSFER_DIRECTION_IN, USBD_SHORT_TRANSFER_OK)
  TransferBufferLength = 00000100
  TransferBuffer       = 00000000
  TransferBufferMDL    = 82315078
  UrbLink              = 00000000
[203106 ms] UsbSnoop - MyInternalIOCTLCompletion(f890fdb0) : fido=822da020, Irp=822f0e48, Context=81c024b8, IRQL=2
[203106 ms]  <<<  URB 521 coming back  <<< 
-- URB_FUNCTION_BULK_OR_INTERRUPT_TRANSFER:
  PipeHandle           = 81c9d144 [endpoint 0x00000081]
  TransferFlags        = 00000003 (USBD_TRANSFER_DIRECTION_IN, USBD_SHORT_TRANSFER_OK)
  TransferBufferLength = 0000000f
  TransferBuffer       = 00000000
  TransferBufferMDL    = 82315078
    00000000: 00 00 00 0a 04 00 00 00 04 00 12 00 00 07 d0
  UrbLink              = 00000000
[203146 ms] UsbSnoop - DispatchAny(f890e610) : IRP_MJ_INTERNAL_DEVICE_CONTROL
[203146 ms] UsbSnoop - MyDispatchInternalIOCTL(f890fe80) : fdo=81c63810, Irp=822f0e48, IRQL=2
[203146 ms]  >>>  URB 522 going down  >>> 
-- URB_FUNCTION_BULK_OR_INTERRUPT_TRANSFER:
  PipeHandle           = 81c9d164 [endpoint 0x00000002]
  TransferFlags        = 00000000 (USBD_TRANSFER_DIRECTION_OUT, ~USBD_SHORT_TRANSFER_OK)
  TransferBufferLength = 00000007
  TransferBuffer       = 00000000
  TransferBufferMDL    = 82315078
    00000000: 00 00 00 02 05 e0 00
  UrbLink              = 00000000
[203146 ms] UsbSnoop - MyInternalIOCTLCompletion(f890fdb0) : fido=822da020, Irp=822f0e48, Context=822de5c8, IRQL=2
[203146 ms]  <<<  URB 522 coming back  <<< 
-- URB_FUNCTION_BULK_OR_INTERRUPT_TRANSFER:
  PipeHandle           = 81c9d164 [endpoint 0x00000002]
  TransferFlags        = 00000000 (USBD_TRANSFER_DIRECTION_OUT, ~USBD_SHORT_TRANSFER_OK)
  TransferBufferLength = 00000007
  TransferBuffer       = 00000000
  TransferBufferMDL    = 82315078
  UrbLink              = 00000000
[203156 ms] UsbSnoop - DispatchAny(f890e610) : IRP_MJ_INTERNAL_DEVICE_CONTROL
[203156 ms] UsbSnoop - MyDispatchInternalIOCTL(f890fe80) : fdo=81c63810, Irp=822f0e48, IRQL=2
[203156 ms]  >>>  URB 523 going down  >>> 
-- URB_FUNCTION_BULK_OR_INTERRUPT_TRANSFER:
  PipeHandle           = 81c9d164 [endpoint 0x00000002]
  TransferFlags        = 00000000 (USBD_TRANSFER_DIRECTION_OUT, ~USBD_SHORT_TRANSFER_OK)
  TransferBufferLength = 0000000f
  TransferBuffer       = 00000000
  TransferBufferMDL    = 82315078
    00000000: 00 00 00 0a 04 00 00 00 04 00 07 00 01 00 31
  UrbLink              = 00000000
[203156 ms] UsbSnoop - MyInternalIOCTLCompletion(f890fdb0) : fido=822da020, Irp=822f0e48, Context=81bc6e50, IRQL=2
[203156 ms]  <<<  URB 523 coming back  <<< 
-- URB_FUNCTION_BULK_OR_INTERRUPT_TRANSFER:
  PipeHandle           = 81c9d164 [endpoint 0x00000002]
  TransferFlags        = 00000000 (USBD_TRANSFER_DIRECTION_OUT, ~USBD_SHORT_TRANSFER_OK)
  TransferBufferLength = 0000000f
  TransferBuffer       = 00000000
  TransferBufferMDL    = 82315078
  UrbLink              = 00000000
[203167 ms] UsbSnoop - DispatchAny(f890e610) : IRP_MJ_INTERNAL_DEVICE_CONTROL
[203167 ms] UsbSnoop - MyDispatchInternalIOCTL(f890fe80) : fdo=81c63810, Irp=822f0e48, IRQL=2
[203167 ms]  >>>  URB 524 going down  >>> 
-- URB_FUNCTION_BULK_OR_INTERRUPT_TRANSFER:
  PipeHandle           = 81c9d144 [endpoint 0x00000081]
  TransferFlags        = 00000003 (USBD_TRANSFER_DIRECTION_IN, USBD_SHORT_TRANSFER_OK)
  TransferBufferLength = 00000100
  TransferBuffer       = 00000000
  TransferBufferMDL    = 82315078
  UrbLink              = 00000000
[203167 ms] UsbSnoop - MyInternalIOCTLCompletion(f890fdb0) : fido=822da020, Irp=822f0e48, Context=81c024b8, IRQL=2
[203167 ms]  <<<  URB 524 coming back  <<< 
-- URB_FUNCTION_BULK_OR_INTERRUPT_TRANSFER:
  PipeHandle           = 81c9d144 [endpoint 0x00000081]
  TransferFlags        = 00000003 (USBD_TRANSFER_DIRECTION_IN, USBD_SHORT_TRANSFER_OK)
  TransferBufferLength = 00000007
  TransferBuffer       = 00000000
  TransferBufferMDL    = 82315078
    00000000: 00 00 00 02 05 e0 00
  UrbLink              = 00000000
[203206 ms] UsbSnoop - DispatchAny(f890e610) : IRP_MJ_INTERNAL_DEVICE_CONTROL
[203206 ms] UsbSnoop - MyDispatchInternalIOCTL(f890fe80) : fdo=81c63810, Irp=822f0e48, IRQL=2
[203206 ms]  >>>  URB 525 going down  >>> 
-- URB_FUNCTION_BULK_OR_INTERRUPT_TRANSFER:
  PipeHandle           = 81c9d144 [endpoint 0x00000081]
  TransferFlags        = 00000003 (USBD_TRANSFER_DIRECTION_IN, USBD_SHORT_TRANSFER_OK)
  TransferBufferLength = 00000100
  TransferBuffer       = 00000000
  TransferBufferMDL    = 82315078
  UrbLink              = 00000000
[203206 ms] UsbSnoop - MyInternalIOCTLCompletion(f890fdb0) : fido=822da020, Irp=822f0e48, Context=81bc6e50, IRQL=2
[203206 ms]  <<<  URB 525 coming back  <<< 
-- URB_FUNCTION_BULK_OR_INTERRUPT_TRANSFER:
  PipeHandle           = 81c9d144 [endpoint 0x00000081]
  TransferFlags        = 00000003 (USBD_TRANSFER_DIRECTION_IN, USBD_SHORT_TRANSFER_OK)
  TransferBufferLength = 0000000f
  TransferBuffer       = 00000000
  TransferBufferMDL    = 82315078
    00000000: 00 00 00 0a 04 00 00 00 04 bb 00 00 01 d4 c0
  UrbLink              = 00000000
[203246 ms] UsbSnoop - DispatchAny(f890e610) : IRP_MJ_INTERNAL_DEVICE_CONTROL
[203246 ms] UsbSnoop - MyDispatchInternalIOCTL(f890fe80) : fdo=81c63810, Irp=822f0e48, IRQL=2
[203246 ms]  >>>  URB 526 going down  >>> 
-- URB_FUNCTION_BULK_OR_INTERRUPT_TRANSFER:
  PipeHandle           = 81c9d164 [endpoint 0x00000002]
  TransferFlags        = 00000000 (USBD_TRANSFER_DIRECTION_OUT, ~USBD_SHORT_TRANSFER_OK)
  TransferBufferLength = 00000007
  TransferBuffer       = 00000000
  TransferBufferMDL    = 82315078
    00000000: 00 00 00 02 05 e0 00
  UrbLink              = 00000000
[203246 ms] UsbSnoop - MyInternalIOCTLCompletion(f890fdb0) : fido=822da020, Irp=822f0e48, Context=81c9a480, IRQL=2
[203246 ms]  <<<  URB 526 coming back  <<< 
-- URB_FUNCTION_BULK_OR_INTERRUPT_TRANSFER:
  PipeHandle           = 81c9d164 [endpoint 0x00000002]
  TransferFlags        = 00000000 (USBD_TRANSFER_DIRECTION_OUT, ~USBD_SHORT_TRANSFER_OK)
  TransferBufferLength = 00000007
  TransferBuffer       = 00000000
  TransferBufferMDL    = 82315078
  UrbLink              = 00000000
[203256 ms] UsbSnoop - DispatchAny(f890e610) : IRP_MJ_INTERNAL_DEVICE_CONTROL
[203256 ms] UsbSnoop - MyDispatchInternalIOCTL(f890fe80) : fdo=81c63810, Irp=822f0e48, IRQL=2
[203256 ms]  >>>  URB 527 going down  >>> 
-- URB_FUNCTION_BULK_OR_INTERRUPT_TRANSFER:
  PipeHandle           = 81c9d144 [endpoint 0x00000081]
  TransferFlags        = 00000003 (USBD_TRANSFER_DIRECTION_IN, USBD_SHORT_TRANSFER_OK)
  TransferBufferLength = 00000100
  TransferBuffer       = 00000000
  TransferBufferMDL    = 82315078
  UrbLink              = 00000000
[211057 ms] UsbSnoop - MyInternalIOCTLCompletion(f890fdb0) : fido=822da020, Irp=822f0e48, Context=8218efe8, IRQL=2
[211057 ms]  <<<  URB 527 coming back  <<< 
-- URB_FUNCTION_BULK_OR_INTERRUPT_TRANSFER:
  PipeHandle           = 81c9d144 [endpoint 0x00000081]
  TransferFlags        = 00000003 (USBD_TRANSFER_DIRECTION_IN, USBD_SHORT_TRANSFER_OK)
  TransferBufferLength = 000000ff
  TransferBuffer       = 00000000
  TransferBufferMDL    = 82315078
    00000000: 00 00 00 fa 03 00 00 03 fe 00 08 00 01 00 31 00
    00000010: 03 f7 0a 15 0a 32 cc e3 01 0a 2d 40 00 00 00 00
    00000020: 00 00 00 00 00 00 00 00 00 00 00 00 00 00 00 00
    00000030: 00 00 00 00 00 00 00 00 00 00 00 00 00 00 00 00
    00000040: 00 00 00 00 00 00 00 00 00 00 00 00 00 00 00 00
    00000050: 00 00 00 00 00 00 00 00 00 00 00 00 04 12 21 18
    00000060: 03 26 09 04 0b d4 31 b0 02 0d 40 a4 f7 87 78 b9
    00000070: da 56 1a 21 97 57 2e 90 de 87 7a 0b 6c 5f 63 2c
    00000080: 01 8a 32 17 9b 65 73 af b1 a1 1b 2f 0c 0b 67 b8
    00000090: f7 84 22 44 04 bd 33 76 f8 06 2e 82 57 ff 63 a1
    000000a0: c9 27 8e f4 46 8e b1 ea 96 c3 9a 80 0f 00 00 00
    000000b0: 00 80 11 0a 80 21 02 80 31 28 80 a1 03 80 81 12
    000000c0: 80 7f 00 00 00 00 02 0d 40 50 ed 7d 34 7b 37 b2
    000000d0: 6e 5f d9 b6 60 23 55 a0 8d 68 42 da 55 bd a0 50
    000000e0: 64 2e b3 12 f9 b8 a9 1d 29 9d 90 7e 15 18 66 1d
    000000f0: aa 74 03 e8 78 c4 3c e6 b3 0e d2 d9 c9 eb 6b
  UrbLink              = 00000000
[211101 ms] UsbSnoop - DispatchAny(f890e610) : IRP_MJ_INTERNAL_DEVICE_CONTROL
[211101 ms] UsbSnoop - MyDispatchInternalIOCTL(f890fe80) : fdo=81c63810, Irp=822f0e48, IRQL=2
[211101 ms]  >>>  URB 528 going down  >>> 
-- URB_FUNCTION_BULK_OR_INTERRUPT_TRANSFER:
  PipeHandle           = 81c9d164 [endpoint 0x00000002]
  TransferFlags        = 00000000 (USBD_TRANSFER_DIRECTION_OUT, ~USBD_SHORT_TRANSFER_OK)
  TransferBufferLength = 00000007
  TransferBuffer       = 00000000
  TransferBufferMDL    = 82315078
    00000000: 00 00 00 02 05 e0 00
  UrbLink              = 00000000
[211101 ms] UsbSnoop - MyInternalIOCTLCompletion(f890fdb0) : fido=822da020, Irp=822f0e48, Context=81bc6e50, IRQL=2
[211101 ms]  <<<  URB 528 coming back  <<< 
-- URB_FUNCTION_BULK_OR_INTERRUPT_TRANSFER:
  PipeHandle           = 81c9d164 [endpoint 0x00000002]
  TransferFlags        = 00000000 (USBD_TRANSFER_DIRECTION_OUT, ~USBD_SHORT_TRANSFER_OK)
  TransferBufferLength = 00000007
  TransferBuffer       = 00000000
  TransferBufferMDL    = 82315078
  UrbLink              = 00000000
[211108 ms] UsbSnoop - DispatchAny(f890e610) : IRP_MJ_INTERNAL_DEVICE_CONTROL
[211108 ms] UsbSnoop - MyDispatchInternalIOCTL(f890fe80) : fdo=81c63810, Irp=822f0e48, IRQL=2
[211108 ms]  >>>  URB 529 going down  >>> 
-- URB_FUNCTION_BULK_OR_INTERRUPT_TRANSFER:
  PipeHandle           = 81c9d144 [endpoint 0x00000081]
  TransferFlags        = 00000003 (USBD_TRANSFER_DIRECTION_IN, USBD_SHORT_TRANSFER_OK)
  TransferBufferLength = 00000100
  TransferBuffer       = 00000000
  TransferBufferMDL    = 82315078
  UrbLink              = 00000000
[211132 ms] UsbSnoop - MyInternalIOCTLCompletion(f890fdb0) : fido=822da020, Irp=822f0e48, Context=8218efe8, IRQL=2
[211132 ms]  <<<  URB 529 coming back  <<< 
-- URB_FUNCTION_BULK_OR_INTERRUPT_TRANSFER:
  PipeHandle           = 81c9d144 [endpoint 0x00000081]
  TransferFlags        = 00000003 (USBD_TRANSFER_DIRECTION_IN, USBD_SHORT_TRANSFER_OK)
  TransferBufferLength = 000000ff
  TransferBuffer       = 00000000
  TransferBufferMDL    = 82315078
    00000000: 00 00 00 fa 03 7a 96 13 d4 71 3b eb 0c 01 6c ff
    00000010: ff ff ff ff ff ff ff ff ff ff ff ff ff ff ff ff
    00000020: ff ff ff ff ff ff ff ff ff ff ff ff ff ff ff ff
    00000030: ff ff ff ff ff ff ff ff ff ff ff ff ff ff ff ff
    00000040: ff ff ff ff ff ff ff ff ff ff ff ff ff ff ff ff
    00000050: ff ff ff ff ff ff ff ff ff ff ff ff ff ff ff ff
    00000060: ff ff ff ff ff ff ff ff ff ff ff ff ff ff ff ff
    00000070: ff ff ff ff ff ff ff ff ff ff ff ff ff ff ff ff
    00000080: ff ff ff ff ff ff ff ff ff ff ff ff ff ff ff ff
    00000090: ff ff ff ff ff ff ff ff ff ff ff ff ff ff ff ff
    000000a0: ff ff ff ff ff ff ff ff ff ff ff ff ff ff ff ff
    000000b0: ff ff ff ff ff ff ff ff ff ff ff ff ff ff ff ff
    000000c0: ff ff ff ff ff ff ff ff ff ff ff ff ff ff ff ff
    000000d0: ff ff ff ff ff ff ff ff ff ff ff ff ff ff ff ff
    000000e0: ff ff ff ff ff ff ff ff ff ff ff ff ff ff ff ff
    000000f0: ff ff ff ff ff ff ff ff ff ff ff ff ff ff ff
  UrbLink              = 00000000
[211169 ms] UsbSnoop - DispatchAny(f890e610) : IRP_MJ_INTERNAL_DEVICE_CONTROL
[211169 ms] UsbSnoop - MyDispatchInternalIOCTL(f890fe80) : fdo=81c63810, Irp=822f0e48, IRQL=2
[211169 ms]  >>>  URB 530 going down  >>> 
-- URB_FUNCTION_BULK_OR_INTERRUPT_TRANSFER:
  PipeHandle           = 81c9d164 [endpoint 0x00000002]
  TransferFlags        = 00000000 (USBD_TRANSFER_DIRECTION_OUT, ~USBD_SHORT_TRANSFER_OK)
  TransferBufferLength = 00000007
  TransferBuffer       = 00000000
  TransferBufferMDL    = 82315078
    00000000: 00 00 00 02 05 e0 00
  UrbLink              = 00000000
[211169 ms] UsbSnoop - MyInternalIOCTLCompletion(f890fdb0) : fido=822da020, Irp=822f0e48, Context=81c9a480, IRQL=2
[211169 ms]  <<<  URB 530 coming back  <<< 
-- URB_FUNCTION_BULK_OR_INTERRUPT_TRANSFER:
  PipeHandle           = 81c9d164 [endpoint 0x00000002]
  TransferFlags        = 00000000 (USBD_TRANSFER_DIRECTION_OUT, ~USBD_SHORT_TRANSFER_OK)
  TransferBufferLength = 00000007
  TransferBuffer       = 00000000
  TransferBufferMDL    = 82315078
  UrbLink              = 00000000
[211180 ms] UsbSnoop - DispatchAny(f890e610) : IRP_MJ_INTERNAL_DEVICE_CONTROL
[211180 ms] UsbSnoop - MyDispatchInternalIOCTL(f890fe80) : fdo=81c63810, Irp=822f0e48, IRQL=2
[211180 ms]  >>>  URB 531 going down  >>> 
-- URB_FUNCTION_BULK_OR_INTERRUPT_TRANSFER:
  PipeHandle           = 81c9d144 [endpoint 0x00000081]
  TransferFlags        = 00000003 (USBD_TRANSFER_DIRECTION_IN, USBD_SHORT_TRANSFER_OK)
  TransferBufferLength = 00000100
  TransferBuffer       = 00000000
  TransferBufferMDL    = 82315078
  UrbLink              = 00000000
[211200 ms] UsbSnoop - MyInternalIOCTLCompletion(f890fdb0) : fido=822da020, Irp=822f0e48, Context=8218efe8, IRQL=2
[211200 ms]  <<<  URB 531 coming back  <<< 
-- URB_FUNCTION_BULK_OR_INTERRUPT_TRANSFER:
  PipeHandle           = 81c9d144 [endpoint 0x00000081]
  TransferFlags        = 00000003 (USBD_TRANSFER_DIRECTION_IN, USBD_SHORT_TRANSFER_OK)
  TransferBufferLength = 000000ff
  TransferBuffer       = 00000000
  TransferBufferMDL    = 82315078
    00000000: 00 00 00 fa 03 ff ff ff ff ff ff ff ff ff ff ff
    00000010: ff ff ff ff ff ff ff ff ff ff ff ff ff ff ff ff
    00000020: ff ff ff ff ff ff ff ff ff ff ff ff ff ff ff ff
    00000030: ff ff ff ff ff ff ff ff ff ff ff ff ff ff ff ff
    00000040: ff ff ff ff ff ff ff ff ff ff ff ff ff ff ff ff
    00000050: ff ff ff ff ff ff ff ff ff ff ff ff ff ff ff ff
    00000060: ff ff ff ff ff ff ff ff ff ff ff ff ff ff ff ff
    00000070: ff ff ff ff ff ff ff ff ff ff ff ff ff ff ff ff
    00000080: ff ff ff ff ff ff ff ff ff ff ff ff ff ff ff ff
    00000090: ff ff ff ff ff ff ff ff ff ff ff ff ff ff ff ff
    000000a0: ff ff ff ff ff ff ff ff ff ff ff ff ff ff ff ff
    000000b0: ff ff ff ff ff ff ff ff ff ff ff ff ff ff ff ff
    000000c0: ff ff ff ff ff ff ff ff ff ff ff ff ff ff ff ff
    000000d0: ff ff ff ff ff ff ff ff ff ff ff ff ff ff ff ff
    000000e0: ff ff ff ff ff ff ff ff ff ff ff ff ff ff ff ff
    000000f0: ff ff ff ff ff ff ff ff ff ff ff ff ff ff ff
  UrbLink              = 00000000
[211239 ms] UsbSnoop - DispatchAny(f890e610) : IRP_MJ_INTERNAL_DEVICE_CONTROL
[211239 ms] UsbSnoop - MyDispatchInternalIOCTL(f890fe80) : fdo=81c63810, Irp=822f0e48, IRQL=2
[211239 ms]  >>>  URB 532 going down  >>> 
-- URB_FUNCTION_BULK_OR_INTERRUPT_TRANSFER:
  PipeHandle           = 81c9d164 [endpoint 0x00000002]
  TransferFlags        = 00000000 (USBD_TRANSFER_DIRECTION_OUT, ~USBD_SHORT_TRANSFER_OK)
  TransferBufferLength = 00000007
  TransferBuffer       = 00000000
  TransferBufferMDL    = 82315078
    00000000: 00 00 00 02 05 e0 00
  UrbLink              = 00000000
[211239 ms] UsbSnoop - MyInternalIOCTLCompletion(f890fdb0) : fido=822da020, Irp=822f0e48, Context=81bc6e50, IRQL=2
[211239 ms]  <<<  URB 532 coming back  <<< 
-- URB_FUNCTION_BULK_OR_INTERRUPT_TRANSFER:
  PipeHandle           = 81c9d164 [endpoint 0x00000002]
  TransferFlags        = 00000000 (USBD_TRANSFER_DIRECTION_OUT, ~USBD_SHORT_TRANSFER_OK)
  TransferBufferLength = 00000007
  TransferBuffer       = 00000000
  TransferBufferMDL    = 82315078
  UrbLink              = 00000000
[211249 ms] UsbSnoop - DispatchAny(f890e610) : IRP_MJ_INTERNAL_DEVICE_CONTROL
[211249 ms] UsbSnoop - MyDispatchInternalIOCTL(f890fe80) : fdo=81c63810, Irp=822f0e48, IRQL=2
[211249 ms]  >>>  URB 533 going down  >>> 
-- URB_FUNCTION_BULK_OR_INTERRUPT_TRANSFER:
  PipeHandle           = 81c9d144 [endpoint 0x00000081]
  TransferFlags        = 00000003 (USBD_TRANSFER_DIRECTION_IN, USBD_SHORT_TRANSFER_OK)
  TransferBufferLength = 00000100
  TransferBuffer       = 00000000
  TransferBufferMDL    = 82315078
  UrbLink              = 00000000
[211270 ms] UsbSnoop - MyInternalIOCTLCompletion(f890fdb0) : fido=822da020, Irp=822f0e48, Context=81c024b8, IRQL=2
[211270 ms]  <<<  URB 533 coming back  <<< 
-- URB_FUNCTION_BULK_OR_INTERRUPT_TRANSFER:
  PipeHandle           = 81c9d144 [endpoint 0x00000081]
  TransferFlags        = 00000003 (USBD_TRANSFER_DIRECTION_IN, USBD_SHORT_TRANSFER_OK)
  TransferBufferLength = 000000ff
  TransferBuffer       = 00000000
  TransferBufferMDL    = 82315078
    00000000: 00 00 00 fa 03 ff ff ff ff ff ff ff ff ff ff ff
    00000010: ff ff ff ff ff ff ff ff ff ff ff ff ff ff ff ff
    00000020: ff ff ff ff ff ff ff ff ff ff ff ff ff ff ff ff
    00000030: ff ff ff ff ff ff ff ff ff ff ff ff ff ff ff ff
    00000040: ff ff ff ff ff ff ff ff ff ff ff ff ff ff ff ff
    00000050: ff ff ff ff ff ff ff ff ff ff ff ff ff ff ff ff
    00000060: ff ff ff ff ff ff ff ff ff ff ff ff ff ff ff ff
    00000070: ff ff ff ff ff ff ff ff ff ff ff ff ff ff ff ff
    00000080: ff ff ff ff ff ff ff ff ff ff ff ff ff ff ff ff
    00000090: ff ff ff ff ff ff ff ff ff ff ff ff ff ff ff ff
    000000a0: ff ff ff ff ff ff ff ff ff ff ff ff ff ff ff ff
    000000b0: ff ff ff ff ff ff ff ff ff ff ff ff ff ff ff ff
    000000c0: ff ff ff ff ff ff ff ff ff ff ff ff ff ff ff ff
    000000d0: ff ff ff ff ff ff ff ff ff ff ff ff ff ff ff ff
    000000e0: ff ff ff ff ff ff ff ff ff ff ff ff ff ff ff ff
    000000f0: ff ff ff ff ff ff ff ff ff ff ff 00 00 00 00
  UrbLink              = 00000000
[211309 ms] UsbSnoop - DispatchAny(f890e610) : IRP_MJ_INTERNAL_DEVICE_CONTROL
[211309 ms] UsbSnoop - MyDispatchInternalIOCTL(f890fe80) : fdo=81c63810, Irp=822f0e48, IRQL=2
[211309 ms]  >>>  URB 534 going down  >>> 
-- URB_FUNCTION_BULK_OR_INTERRUPT_TRANSFER:
  PipeHandle           = 81c9d164 [endpoint 0x00000002]
  TransferFlags        = 00000000 (USBD_TRANSFER_DIRECTION_OUT, ~USBD_SHORT_TRANSFER_OK)
  TransferBufferLength = 00000007
  TransferBuffer       = 00000000
  TransferBufferMDL    = 82315078
    00000000: 00 00 00 02 05 e0 00
  UrbLink              = 00000000
[211309 ms] UsbSnoop - MyInternalIOCTLCompletion(f890fdb0) : fido=822da020, Irp=822f0e48, Context=8218efe8, IRQL=2
[211309 ms]  <<<  URB 534 coming back  <<< 
-- URB_FUNCTION_BULK_OR_INTERRUPT_TRANSFER:
  PipeHandle           = 81c9d164 [endpoint 0x00000002]
  TransferFlags        = 00000000 (USBD_TRANSFER_DIRECTION_OUT, ~USBD_SHORT_TRANSFER_OK)
  TransferBufferLength = 00000007
  TransferBuffer       = 00000000
  TransferBufferMDL    = 82315078
  UrbLink              = 00000000
[211319 ms] UsbSnoop - DispatchAny(f890e610) : IRP_MJ_INTERNAL_DEVICE_CONTROL
[211319 ms] UsbSnoop - MyDispatchInternalIOCTL(f890fe80) : fdo=81c63810, Irp=822f0e48, IRQL=2
[211319 ms]  >>>  URB 535 going down  >>> 
-- URB_FUNCTION_BULK_OR_INTERRUPT_TRANSFER:
  PipeHandle           = 81c9d144 [endpoint 0x00000081]
  TransferFlags        = 00000003 (USBD_TRANSFER_DIRECTION_IN, USBD_SHORT_TRANSFER_OK)
  TransferBufferLength = 00000100
  TransferBuffer       = 00000000
  TransferBufferMDL    = 82315078
  UrbLink              = 00000000
[211803 ms] UsbSnoop - MyInternalIOCTLCompletion(f890fdb0) : fido=822da020, Irp=822f0e48, Context=81c024b8, IRQL=2
[211803 ms]  <<<  URB 535 coming back  <<< 
-- URB_FUNCTION_BULK_OR_INTERRUPT_TRANSFER:
  PipeHandle           = 81c9d144 [endpoint 0x00000081]
  TransferFlags        = 00000003 (USBD_TRANSFER_DIRECTION_IN, USBD_SHORT_TRANSFER_OK)
  TransferBufferLength = 00000021
  TransferBuffer       = 00000000
  TransferBufferMDL    = 82315078
    00000000: 00 00 00 1c 04 00 00 00 00 00 00 00 00 fc ff ff
    00000010: ff ff ff ff ff ff ff ff ff ff ff ff ff ff ff ff
    00000020: ff
  UrbLink              = 00000000
[211840 ms] UsbSnoop - DispatchAny(f890e610) : IRP_MJ_INTERNAL_DEVICE_CONTROL
[211840 ms] UsbSnoop - MyDispatchInternalIOCTL(f890fe80) : fdo=81c63810, Irp=822f0e48, IRQL=2
[211840 ms]  >>>  URB 536 going down  >>> 
-- URB_FUNCTION_BULK_OR_INTERRUPT_TRANSFER:
  PipeHandle           = 81c9d164 [endpoint 0x00000002]
  TransferFlags        = 00000000 (USBD_TRANSFER_DIRECTION_OUT, ~USBD_SHORT_TRANSFER_OK)
  TransferBufferLength = 00000007
  TransferBuffer       = 00000000
  TransferBufferMDL    = 82315078
    00000000: 00 00 00 02 05 e0 00
  UrbLink              = 00000000
[211840 ms] UsbSnoop - MyInternalIOCTLCompletion(f890fdb0) : fido=822da020, Irp=822f0e48, Context=81c9a480, IRQL=2
[211840 ms]  <<<  URB 536 coming back  <<< 
-- URB_FUNCTION_BULK_OR_INTERRUPT_TRANSFER:
  PipeHandle           = 81c9d164 [endpoint 0x00000002]
  TransferFlags        = 00000000 (USBD_TRANSFER_DIRECTION_OUT, ~USBD_SHORT_TRANSFER_OK)
  TransferBufferLength = 00000007
  TransferBuffer       = 00000000
  TransferBufferMDL    = 82315078
  UrbLink              = 00000000
[212100 ms] UsbSnoop - DispatchAny(f890e610) : IRP_MJ_INTERNAL_DEVICE_CONTROL
[212100 ms] UsbSnoop - MyDispatchInternalIOCTL(f890fe80) : fdo=81c63810, Irp=822f0e48, IRQL=2
[212100 ms]  >>>  URB 537 going down  >>> 
-- URB_FUNCTION_BULK_OR_INTERRUPT_TRANSFER:
  PipeHandle           = 81c9d164 [endpoint 0x00000002]
  TransferFlags        = 00000000 (USBD_TRANSFER_DIRECTION_OUT, ~USBD_SHORT_TRANSFER_OK)
  TransferBufferLength = 00000009
  TransferBuffer       = 00000000
  TransferBufferMDL    = 82315078
    00000000: 00 00 00 04 01 00 00 04 00
  UrbLink              = 00000000
[212100 ms] UsbSnoop - MyInternalIOCTLCompletion(f890fdb0) : fido=822da020, Irp=822f0e48, Context=81c024b8, IRQL=2
[212100 ms]  <<<  URB 537 coming back  <<< 
-- URB_FUNCTION_BULK_OR_INTERRUPT_TRANSFER:
  PipeHandle           = 81c9d164 [endpoint 0x00000002]
  TransferFlags        = 00000000 (USBD_TRANSFER_DIRECTION_OUT, ~USBD_SHORT_TRANSFER_OK)
  TransferBufferLength = 00000009
  TransferBuffer       = 00000000
  TransferBufferMDL    = 82315078
  UrbLink              = 00000000
[212105 ms] UsbSnoop - DispatchAny(f890e610) : IRP_MJ_INTERNAL_DEVICE_CONTROL
[212105 ms] UsbSnoop - MyDispatchInternalIOCTL(f890fe80) : fdo=81c63810, Irp=822f0e48, IRQL=2
[212105 ms]  >>>  URB 538 going down  >>> 
-- URB_FUNCTION_BULK_OR_INTERRUPT_TRANSFER:
  PipeHandle           = 81c9d144 [endpoint 0x00000081]
  TransferFlags        = 00000003 (USBD_TRANSFER_DIRECTION_IN, USBD_SHORT_TRANSFER_OK)
  TransferBufferLength = 00000100
  TransferBuffer       = 00000000
  TransferBufferMDL    = 82315078
  UrbLink              = 00000000
[212112 ms] UsbSnoop - MyInternalIOCTLCompletion(f890fdb0) : fido=822da020, Irp=822f0e48, Context=81c88a38, IRQL=2
[212112 ms]  <<<  URB 538 coming back  <<< 
-- URB_FUNCTION_BULK_OR_INTERRUPT_TRANSFER:
  PipeHandle           = 81c9d144 [endpoint 0x00000081]
  TransferFlags        = 00000003 (USBD_TRANSFER_DIRECTION_IN, USBD_SHORT_TRANSFER_OK)
  TransferBufferLength = 00000009
  TransferBuffer       = 00000000
  TransferBufferMDL    = 82315078
    00000000: 00 00 00 04 02 00 00 00 fa
  UrbLink              = 00000000
[212140 ms] UsbSnoop - DispatchAny(f890e610) : IRP_MJ_INTERNAL_DEVICE_CONTROL
[212140 ms] UsbSnoop - MyDispatchInternalIOCTL(f890fe80) : fdo=81c63810, Irp=822f0e48, IRQL=2
[212140 ms]  >>>  URB 539 going down  >>> 
-- URB_FUNCTION_BULK_OR_INTERRUPT_TRANSFER:
  PipeHandle           = 81c9d164 [endpoint 0x00000002]
  TransferFlags        = 00000000 (USBD_TRANSFER_DIRECTION_OUT, ~USBD_SHORT_TRANSFER_OK)
  TransferBufferLength = 00000015
  TransferBuffer       = 00000000
  TransferBufferMDL    = 82315078
    00000000: 00 00 00 10 04 00 00 00 0a 00 01 00 03 00 01 00
    00000010: 00 00 00 07 d0
  UrbLink              = 00000000
[212140 ms] UsbSnoop - MyInternalIOCTLCompletion(f890fdb0) : fido=822da020, Irp=822f0e48, Context=81b51c08, IRQL=2
[212140 ms]  <<<  URB 539 coming back  <<< 
-- URB_FUNCTION_BULK_OR_INTERRUPT_TRANSFER:
  PipeHandle           = 81c9d164 [endpoint 0x00000002]
  TransferFlags        = 00000000 (USBD_TRANSFER_DIRECTION_OUT, ~USBD_SHORT_TRANSFER_OK)
  TransferBufferLength = 00000015
  TransferBuffer       = 00000000
  TransferBufferMDL    = 82315078
  UrbLink              = 00000000
[212150 ms] UsbSnoop - DispatchAny(f890e610) : IRP_MJ_INTERNAL_DEVICE_CONTROL
[212150 ms] UsbSnoop - MyDispatchInternalIOCTL(f890fe80) : fdo=81c63810, Irp=822f0e48, IRQL=2
[212150 ms]  >>>  URB 540 going down  >>> 
-- URB_FUNCTION_BULK_OR_INTERRUPT_TRANSFER:
  PipeHandle           = 81c9d144 [endpoint 0x00000081]
  TransferFlags        = 00000003 (USBD_TRANSFER_DIRECTION_IN, USBD_SHORT_TRANSFER_OK)
  TransferBufferLength = 00000100
  TransferBuffer       = 00000000
  TransferBufferMDL    = 82315078
  UrbLink              = 00000000
[212150 ms] UsbSnoop - MyInternalIOCTLCompletion(f890fdb0) : fido=822da020, Irp=822f0e48, Context=81c88a38, IRQL=2
[212150 ms]  <<<  URB 540 coming back  <<< 
-- URB_FUNCTION_BULK_OR_INTERRUPT_TRANSFER:
  PipeHandle           = 81c9d144 [endpoint 0x00000081]
  TransferFlags        = 00000003 (USBD_TRANSFER_DIRECTION_IN, USBD_SHORT_TRANSFER_OK)
  TransferBufferLength = 00000007
  TransferBuffer       = 00000000
  TransferBufferMDL    = 82315078
    00000000: 00 00 00 02 05 e0 00
  UrbLink              = 00000000
[212190 ms] UsbSnoop - DispatchAny(f890e610) : IRP_MJ_INTERNAL_DEVICE_CONTROL
[212190 ms] UsbSnoop - MyDispatchInternalIOCTL(f890fe80) : fdo=81c63810, Irp=822f0e48, IRQL=2
[212190 ms]  >>>  URB 541 going down  >>> 
-- URB_FUNCTION_BULK_OR_INTERRUPT_TRANSFER:
  PipeHandle           = 81c9d144 [endpoint 0x00000081]
  TransferFlags        = 00000003 (USBD_TRANSFER_DIRECTION_IN, USBD_SHORT_TRANSFER_OK)
  TransferBufferLength = 00000100
  TransferBuffer       = 00000000
  TransferBufferMDL    = 82315078
  UrbLink              = 00000000
[212191 ms] UsbSnoop - MyInternalIOCTLCompletion(f890fdb0) : fido=822da020, Irp=822f0e48, Context=81c9a480, IRQL=2
[212191 ms]  <<<  URB 541 coming back  <<< 
-- URB_FUNCTION_BULK_OR_INTERRUPT_TRANSFER:
  PipeHandle           = 81c9d144 [endpoint 0x00000081]
  TransferFlags        = 00000003 (USBD_TRANSFER_DIRECTION_IN, USBD_SHORT_TRANSFER_OK)
  TransferBufferLength = 0000000f
  TransferBuffer       = 00000000
  TransferBufferMDL    = 82315078
    00000000: 00 00 00 0a 04 00 00 00 04 00 12 00 00 07 d0
  UrbLink              = 00000000
[212230 ms] UsbSnoop - DispatchAny(f890e610) : IRP_MJ_INTERNAL_DEVICE_CONTROL
[212230 ms] UsbSnoop - MyDispatchInternalIOCTL(f890fe80) : fdo=81c63810, Irp=822f0e48, IRQL=2
[212230 ms]  >>>  URB 542 going down  >>> 
-- URB_FUNCTION_BULK_OR_INTERRUPT_TRANSFER:
  PipeHandle           = 81c9d164 [endpoint 0x00000002]
  TransferFlags        = 00000000 (USBD_TRANSFER_DIRECTION_OUT, ~USBD_SHORT_TRANSFER_OK)
  TransferBufferLength = 00000007
  TransferBuffer       = 00000000
  TransferBufferMDL    = 82315078
    00000000: 00 00 00 02 05 e0 00
  UrbLink              = 00000000
[212231 ms] UsbSnoop - MyInternalIOCTLCompletion(f890fdb0) : fido=822da020, Irp=822f0e48, Context=81c024b8, IRQL=2
[212231 ms]  <<<  URB 542 coming back  <<< 
-- URB_FUNCTION_BULK_OR_INTERRUPT_TRANSFER:
  PipeHandle           = 81c9d164 [endpoint 0x00000002]
  TransferFlags        = 00000000 (USBD_TRANSFER_DIRECTION_OUT, ~USBD_SHORT_TRANSFER_OK)
  TransferBufferLength = 00000007
  TransferBuffer       = 00000000
  TransferBufferMDL    = 82315078
  UrbLink              = 00000000
[212240 ms] UsbSnoop - DispatchAny(f890e610) : IRP_MJ_INTERNAL_DEVICE_CONTROL
[212240 ms] UsbSnoop - MyDispatchInternalIOCTL(f890fe80) : fdo=81c63810, Irp=822f0e48, IRQL=2
[212240 ms]  >>>  URB 543 going down  >>> 
-- URB_FUNCTION_BULK_OR_INTERRUPT_TRANSFER:
  PipeHandle           = 81c9d164 [endpoint 0x00000002]
  TransferFlags        = 00000000 (USBD_TRANSFER_DIRECTION_OUT, ~USBD_SHORT_TRANSFER_OK)
  TransferBufferLength = 00000029
  TransferBuffer       = 00000000
  TransferBufferMDL    = 82315078
    00000000: 00 00 00 24 04 00 00 00 1e 00 0b 00 00 00 00 00
    00000010: 00 01 00 03 00 02 00 04 f0 07 00 25 00 03 00 01
    00000020: 00 00 08 00 04 00 00 00 00
  UrbLink              = 00000000
[212240 ms] UsbSnoop - MyInternalIOCTLCompletion(f890fdb0) : fido=822da020, Irp=822f0e48, Context=81c88a38, IRQL=2
[212240 ms]  <<<  URB 543 coming back  <<< 
-- URB_FUNCTION_BULK_OR_INTERRUPT_TRANSFER:
  PipeHandle           = 81c9d164 [endpoint 0x00000002]
  TransferFlags        = 00000000 (USBD_TRANSFER_DIRECTION_OUT, ~USBD_SHORT_TRANSFER_OK)
  TransferBufferLength = 00000029
  TransferBuffer       = 00000000
  TransferBufferMDL    = 82315078
  UrbLink              = 00000000
[212250 ms] UsbSnoop - DispatchAny(f890e610) : IRP_MJ_INTERNAL_DEVICE_CONTROL
[212250 ms] UsbSnoop - MyDispatchInternalIOCTL(f890fe80) : fdo=81c63810, Irp=822f0e48, IRQL=2
[212250 ms]  >>>  URB 544 going down  >>> 
-- URB_FUNCTION_BULK_OR_INTERRUPT_TRANSFER:
  PipeHandle           = 81c9d144 [endpoint 0x00000081]
  TransferFlags        = 00000003 (USBD_TRANSFER_DIRECTION_IN, USBD_SHORT_TRANSFER_OK)
  TransferBufferLength = 00000100
  TransferBuffer       = 00000000
  TransferBufferMDL    = 82315078
  UrbLink              = 00000000
[212254 ms] UsbSnoop - MyInternalIOCTLCompletion(f890fdb0) : fido=822da020, Irp=822f0e48, Context=81c024b8, IRQL=2
[212254 ms]  <<<  URB 544 coming back  <<< 
-- URB_FUNCTION_BULK_OR_INTERRUPT_TRANSFER:
  PipeHandle           = 81c9d144 [endpoint 0x00000081]
  TransferFlags        = 00000003 (USBD_TRANSFER_DIRECTION_IN, USBD_SHORT_TRANSFER_OK)
  TransferBufferLength = 00000007
  TransferBuffer       = 00000000
  TransferBufferMDL    = 82315078
    00000000: 00 00 00 02 05 e0 00
  UrbLink              = 00000000
[212290 ms] UsbSnoop - DispatchAny(f890e610) : IRP_MJ_INTERNAL_DEVICE_CONTROL
[212290 ms] UsbSnoop - MyDispatchInternalIOCTL(f890fe80) : fdo=81c63810, Irp=822f0e48, IRQL=2
[212290 ms]  >>>  URB 545 going down  >>> 
-- URB_FUNCTION_BULK_OR_INTERRUPT_TRANSFER:
  PipeHandle           = 81c9d144 [endpoint 0x00000081]
  TransferFlags        = 00000003 (USBD_TRANSFER_DIRECTION_IN, USBD_SHORT_TRANSFER_OK)
  TransferBufferLength = 00000100
  TransferBuffer       = 00000000
  TransferBufferMDL    = 82315078
  UrbLink              = 00000000
[212291 ms] UsbSnoop - MyInternalIOCTLCompletion(f890fdb0) : fido=822da020, Irp=822f0e48, Context=81c9a480, IRQL=2
[212291 ms]  <<<  URB 545 coming back  <<< 
-- URB_FUNCTION_BULK_OR_INTERRUPT_TRANSFER:
  PipeHandle           = 81c9d144 [endpoint 0x00000081]
  TransferFlags        = 00000003 (USBD_TRANSFER_DIRECTION_IN, USBD_SHORT_TRANSFER_OK)
  TransferBufferLength = 0000000d
  TransferBuffer       = 00000000
  TransferBufferMDL    = 82315078
    00000000: 00 00 00 08 04 00 00 00 02 ee 00 00 0e
  UrbLink              = 00000000
[212330 ms] UsbSnoop - DispatchAny(f890e610) : IRP_MJ_INTERNAL_DEVICE_CONTROL
[212330 ms] UsbSnoop - MyDispatchInternalIOCTL(f890fe80) : fdo=81c63810, Irp=822f0e48, IRQL=2
[212330 ms]  >>>  URB 546 going down  >>> 
-- URB_FUNCTION_BULK_OR_INTERRUPT_TRANSFER:
  PipeHandle           = 81c9d164 [endpoint 0x00000002]
  TransferFlags        = 00000000 (USBD_TRANSFER_DIRECTION_OUT, ~USBD_SHORT_TRANSFER_OK)
  TransferBufferLength = 00000007
  TransferBuffer       = 00000000
  TransferBufferMDL    = 82315078
    00000000: 00 00 00 02 05 e0 00
  UrbLink              = 00000000
[212331 ms] UsbSnoop - MyInternalIOCTLCompletion(f890fdb0) : fido=822da020, Irp=822f0e48, Context=81c024b8, IRQL=2
[212331 ms]  <<<  URB 546 coming back  <<< 
-- URB_FUNCTION_BULK_OR_INTERRUPT_TRANSFER:
  PipeHandle           = 81c9d164 [endpoint 0x00000002]
  TransferFlags        = 00000000 (USBD_TRANSFER_DIRECTION_OUT, ~USBD_SHORT_TRANSFER_OK)
  TransferBufferLength = 00000007
  TransferBuffer       = 00000000
  TransferBufferMDL    = 82315078
  UrbLink              = 00000000
[219762 ms] UsbSnoop - DispatchAny(f890e610) : IRP_MJ_INTERNAL_DEVICE_CONTROL
[219762 ms] UsbSnoop - MyDispatchInternalIOCTL(f890fe80) : fdo=81c63810, Irp=822e9640, IRQL=0
[219762 ms]  >>>  URB 547 going down  >>> 
-- URB_FUNCTION_RESET_PIPE:
  PipeHandle = 81c9d144 [endpoint 0x00000081]
[219763 ms] UsbSnoop - MyInternalIOCTLCompletion(f890fdb0) : fido=00000000, Irp=822e9640, Context=81b3c2e0, IRQL=0
[219763 ms]  <<<  URB 547 coming back  <<< 
-- URB_FUNCTION_RESET_PIPE:
[219763 ms] UsbSnoop - DispatchAny(f890e610) : IRP_MJ_INTERNAL_DEVICE_CONTROL
[219763 ms] UsbSnoop - MyDispatchInternalIOCTL(f890fe80) : fdo=81c63810, Irp=822e9640, IRQL=0
[219763 ms]  >>>  URB 548 going down  >>> 
-- URB_FUNCTION_RESET_PIPE:
  PipeHandle = 81c9d164 [endpoint 0x00000002]
[219772 ms] UsbSnoop - MyInternalIOCTLCompletion(f890fdb0) : fido=00000000, Irp=822e9640, Context=822de5c8, IRQL=0
[219772 ms]  <<<  URB 548 coming back  <<< 
-- URB_FUNCTION_RESET_PIPE:
[219772 ms] UsbSnoop - DispatchAny(f890e610) : IRP_MJ_INTERNAL_DEVICE_CONTROL
[219772 ms] UsbSnoop - MyDispatchInternalIOCTL(f890fe80) : fdo=81c63810, Irp=822e9640, IRQL=0
[219983 ms] UsbSnoop - DispatchAny(f890e610) : IRP_MJ_INTERNAL_DEVICE_CONTROL
[219983 ms] UsbSnoop - MyDispatchInternalIOCTL(f890fe80) : fdo=81c63810, Irp=822e9640, IRQL=0
[219983 ms]  >>>  URB 549 going down  >>> 
-- URB_FUNCTION_RESET_PIPE:
  PipeHandle = 81c9d144 [endpoint 0x00000081]
[219986 ms] UsbSnoop - MyInternalIOCTLCompletion(f890fdb0) : fido=00000000, Irp=822e9640, Context=8218efe8, IRQL=0
[219986 ms]  <<<  URB 549 coming back  <<< 
-- URB_FUNCTION_RESET_PIPE:
[219986 ms] UsbSnoop - DispatchAny(f890e610) : IRP_MJ_INTERNAL_DEVICE_CONTROL
[219986 ms] UsbSnoop - MyDispatchInternalIOCTL(f890fe80) : fdo=81c63810, Irp=822e9640, IRQL=0
[219986 ms]  >>>  URB 550 going down  >>> 
-- URB_FUNCTION_RESET_PIPE:
  PipeHandle = 81c9d164 [endpoint 0x00000002]
[219986 ms] UsbSnoop - MyInternalIOCTLCompletion(f890fdb0) : fido=00000000, Irp=822e9640, Context=81bc6e50, IRQL=0
[219986 ms]  <<<  URB 550 coming back  <<< 
-- URB_FUNCTION_RESET_PIPE:
[220984 ms] UsbSnoop - DispatchAny(f890e610) : IRP_MJ_INTERNAL_DEVICE_CONTROL
[220984 ms] UsbSnoop - MyDispatchInternalIOCTL(f890fe80) : fdo=81c63810, Irp=81b59008, IRQL=0
[220984 ms]  >>>  URB 551 going down  >>> 
-- URB_FUNCTION_RESET_PIPE:
  PipeHandle = 81c9d144 [endpoint 0x00000081]
[220988 ms] UsbSnoop - MyInternalIOCTLCompletion(f890fdb0) : fido=00000000, Irp=81b59008, Context=81bc6e50, IRQL=0
[220988 ms]  <<<  URB 551 coming back  <<< 
-- URB_FUNCTION_RESET_PIPE:
[220988 ms] UsbSnoop - DispatchAny(f890e610) : IRP_MJ_INTERNAL_DEVICE_CONTROL
[220988 ms] UsbSnoop - MyDispatchInternalIOCTL(f890fe80) : fdo=81c63810, Irp=81b59008, IRQL=0
[220988 ms]  >>>  URB 552 going down  >>> 
-- URB_FUNCTION_RESET_PIPE:
  PipeHandle = 81c9d164 [endpoint 0x00000002]
[220988 ms] UsbSnoop - MyInternalIOCTLCompletion(f890fdb0) : fido=00000000, Irp=81b59008, Context=81c9a480, IRQL=0
[220988 ms]  <<<  URB 552 coming back  <<< 
-- URB_FUNCTION_RESET_PIPE:
[220988 ms] UsbSnoop - DispatchAny(f890e610) : IRP_MJ_INTERNAL_DEVICE_CONTROL
[220988 ms] UsbSnoop - MyDispatchInternalIOCTL(f890fe80) : fdo=81c63810, Irp=81b59008, IRQL=0
[221986 ms] UsbSnoop - DispatchAny(f890e610) : IRP_MJ_INTERNAL_DEVICE_CONTROL
[221986 ms] UsbSnoop - MyDispatchInternalIOCTL(f890fe80) : fdo=81c63810, Irp=81b59008, IRQL=0
[221986 ms]  >>>  URB 553 going down  >>> 
-- URB_FUNCTION_GET_DESCRIPTOR_FROM_DEVICE:
  TransferBufferLength = 00000012
  TransferBuffer       = e12c1870
  TransferBufferMDL    = 00000000
  Index                = 00000000
  DescriptorType       = 00000001 (USB_DEVICE_DESCRIPTOR_TYPE)
  LanguageId           = 00000000
[221990 ms] UsbSnoop - MyInternalIOCTLCompletion(f890fdb0) : fido=00000000, Irp=81b59008, Context=81c9a480, IRQL=2
[221990 ms]  <<<  URB 553 coming back  <<< 
-- URB_FUNCTION_CONTROL_TRANSFER:
  PipeHandle           = 81c9d880
  TransferFlags        = 0000000b (USBD_TRANSFER_DIRECTION_IN, USBD_SHORT_TRANSFER_OK)
  TransferBufferLength = 00000012
  TransferBuffer       = e12c1870
  TransferBufferMDL    = 82315078
    00000000: 12 01 00 02 00 00 00 40 51 04 08 e0 10 01 01 02
    00000010: 00 01
  UrbLink              = 00000000
  SetupPacket          =
    00000000: 80 06 00 01 00 00 12 00
[221990 ms] UsbSnoop - DispatchAny(f890e610) : IRP_MJ_INTERNAL_DEVICE_CONTROL
[221990 ms] UsbSnoop - MyDispatchInternalIOCTL(f890fe80) : fdo=81c63810, Irp=81b59008, IRQL=0
[221990 ms] UsbSnoop - DispatchAny(f890e610) : IRP_MJ_INTERNAL_DEVICE_CONTROL
[221990 ms] UsbSnoop - MyDispatchInternalIOCTL(f890fe80) : fdo=81c63810, Irp=81b59008, IRQL=0
[221990 ms]  >>>  URB 554 going down  >>> 
-- URB_FUNCTION_RESET_PIPE:
  PipeHandle = 81c9d144 [endpoint 0x00000081]
[221999 ms] UsbSnoop - MyInternalIOCTLCompletion(f890fdb0) : fido=00000000, Irp=81b59008, Context=81c024b8, IRQL=0
[221999 ms]  <<<  URB 554 coming back  <<< 
-- URB_FUNCTION_RESET_PIPE:
[221999 ms] UsbSnoop - DispatchAny(f890e610) : IRP_MJ_INTERNAL_DEVICE_CONTROL
[221999 ms] UsbSnoop - MyDispatchInternalIOCTL(f890fe80) : fdo=81c63810, Irp=81b59008, IRQL=0
[221999 ms]  >>>  URB 555 going down  >>> 
-- URB_FUNCTION_RESET_PIPE:
  PipeHandle = 81c9d164 [endpoint 0x00000002]
[222000 ms] UsbSnoop - MyInternalIOCTLCompletion(f890fdb0) : fido=00000000, Irp=81b59008, Context=81b87c90, IRQL=0
[222000 ms]  <<<  URB 555 coming back  <<< 
-- URB_FUNCTION_RESET_PIPE:
[223258 ms] UsbSnoop - DispatchAny(f890e610) : IRP_MJ_INTERNAL_DEVICE_CONTROL
[223258 ms] UsbSnoop - MyDispatchInternalIOCTL(f890fe80) : fdo=81c63810, Irp=822e9640, IRQL=2
[223258 ms]  >>>  URB 556 going down  >>> 
-- URB_FUNCTION_BULK_OR_INTERRUPT_TRANSFER:
  PipeHandle           = 81c9d164 [endpoint 0x00000002]
  TransferFlags        = 00000000 (USBD_TRANSFER_DIRECTION_OUT, ~USBD_SHORT_TRANSFER_OK)
  TransferBufferLength = 00000009
  TransferBuffer       = 00000000
  TransferBufferMDL    = 81cf5428
    00000000: 00 00 00 04 01 00 00 04 00
  UrbLink              = 00000000
[223258 ms] UsbSnoop - MyInternalIOCTLCompletion(f890fdb0) : fido=822da020, Irp=822e9640, Context=81c024b8, IRQL=2
[223258 ms]  <<<  URB 556 coming back  <<< 
-- URB_FUNCTION_BULK_OR_INTERRUPT_TRANSFER:
  PipeHandle           = 81c9d164 [endpoint 0x00000002]
  TransferFlags        = 00000000 (USBD_TRANSFER_DIRECTION_OUT, ~USBD_SHORT_TRANSFER_OK)
  TransferBufferLength = 00000009
  TransferBuffer       = 00000000
  TransferBufferMDL    = 81cf5428
  UrbLink              = 00000000
[223258 ms] UsbSnoop - DispatchAny(f890e610) : IRP_MJ_INTERNAL_DEVICE_CONTROL
[223258 ms] UsbSnoop - MyDispatchInternalIOCTL(f890fe80) : fdo=81c63810, Irp=822e9640, IRQL=2
[223258 ms]  >>>  URB 557 going down  >>> 
-- URB_FUNCTION_BULK_OR_INTERRUPT_TRANSFER:
  PipeHandle           = 81c9d144 [endpoint 0x00000081]
  TransferFlags        = 00000003 (USBD_TRANSFER_DIRECTION_IN, USBD_SHORT_TRANSFER_OK)
  TransferBufferLength = 00000100
  TransferBuffer       = 00000000
  TransferBufferMDL    = 81cf5428
  UrbLink              = 00000000
[223266 ms] UsbSnoop - MyInternalIOCTLCompletion(f890fdb0) : fido=822da020, Irp=822e9640, Context=81c024b8, IRQL=2
[223266 ms]  <<<  URB 557 coming back  <<< 
-- URB_FUNCTION_BULK_OR_INTERRUPT_TRANSFER:
  PipeHandle           = 81c9d144 [endpoint 0x00000081]
  TransferFlags        = 00000003 (USBD_TRANSFER_DIRECTION_IN, USBD_SHORT_TRANSFER_OK)
  TransferBufferLength = 00000009
  TransferBuffer       = 00000000
  TransferBufferMDL    = 81cf5428
    00000000: 00 00 00 04 02 00 00 00 fa
  UrbLink              = 00000000
[223288 ms] UsbSnoop - DispatchAny(f890e610) : IRP_MJ_INTERNAL_DEVICE_CONTROL
[223288 ms] UsbSnoop - MyDispatchInternalIOCTL(f890fe80) : fdo=81c63810, Irp=822e9640, IRQL=2
[223288 ms]  >>>  URB 558 going down  >>> 
-- URB_FUNCTION_BULK_OR_INTERRUPT_TRANSFER:
  PipeHandle           = 81c9d164 [endpoint 0x00000002]
  TransferFlags        = 00000000 (USBD_TRANSFER_DIRECTION_OUT, ~USBD_SHORT_TRANSFER_OK)
  TransferBufferLength = 00000015
  TransferBuffer       = 00000000
  TransferBufferMDL    = 81cf5428
    00000000: 00 00 00 10 04 00 00 00 0a 00 01 00 03 00 01 00
    00000010: 00 00 00 07 d0
  UrbLink              = 00000000
[223288 ms] UsbSnoop - MyInternalIOCTLCompletion(f890fdb0) : fido=822da020, Irp=822e9640, Context=81b87c90, IRQL=2
[223288 ms]  <<<  URB 558 coming back  <<< 
-- URB_FUNCTION_BULK_OR_INTERRUPT_TRANSFER:
  PipeHandle           = 81c9d164 [endpoint 0x00000002]
  TransferFlags        = 00000000 (USBD_TRANSFER_DIRECTION_OUT, ~USBD_SHORT_TRANSFER_OK)
  TransferBufferLength = 00000015
  TransferBuffer       = 00000000
  TransferBufferMDL    = 81cf5428
  UrbLink              = 00000000
[223298 ms] UsbSnoop - DispatchAny(f890e610) : IRP_MJ_INTERNAL_DEVICE_CONTROL
[223298 ms] UsbSnoop - MyDispatchInternalIOCTL(f890fe80) : fdo=81c63810, Irp=822e9640, IRQL=2
[223298 ms]  >>>  URB 559 going down  >>> 
-- URB_FUNCTION_BULK_OR_INTERRUPT_TRANSFER:
  PipeHandle           = 81c9d144 [endpoint 0x00000081]
  TransferFlags        = 00000003 (USBD_TRANSFER_DIRECTION_IN, USBD_SHORT_TRANSFER_OK)
  TransferBufferLength = 00000100
  TransferBuffer       = 00000000
  TransferBufferMDL    = 81cf5428
  UrbLink              = 00000000
[223298 ms] UsbSnoop - MyInternalIOCTLCompletion(f890fdb0) : fido=822da020, Irp=822e9640, Context=81c024b8, IRQL=2
[223298 ms]  <<<  URB 559 coming back  <<< 
-- URB_FUNCTION_BULK_OR_INTERRUPT_TRANSFER:
  PipeHandle           = 81c9d144 [endpoint 0x00000081]
  TransferFlags        = 00000003 (USBD_TRANSFER_DIRECTION_IN, USBD_SHORT_TRANSFER_OK)
  TransferBufferLength = 00000007
  TransferBuffer       = 00000000
  TransferBufferMDL    = 81cf5428
    00000000: 00 00 00 02 05 e0 00
  UrbLink              = 00000000
[223338 ms] UsbSnoop - DispatchAny(f890e610) : IRP_MJ_INTERNAL_DEVICE_CONTROL
[223338 ms] UsbSnoop - MyDispatchInternalIOCTL(f890fe80) : fdo=81c63810, Irp=822e9640, IRQL=2
[223338 ms]  >>>  URB 560 going down  >>> 
-- URB_FUNCTION_BULK_OR_INTERRUPT_TRANSFER:
  PipeHandle           = 81c9d144 [endpoint 0x00000081]
  TransferFlags        = 00000003 (USBD_TRANSFER_DIRECTION_IN, USBD_SHORT_TRANSFER_OK)
  TransferBufferLength = 00000100
  TransferBuffer       = 00000000
  TransferBufferMDL    = 81cf5428
  UrbLink              = 00000000
[223338 ms] UsbSnoop - MyInternalIOCTLCompletion(f890fdb0) : fido=822da020, Irp=822e9640, Context=8218efe8, IRQL=2
[223338 ms]  <<<  URB 560 coming back  <<< 
-- URB_FUNCTION_BULK_OR_INTERRUPT_TRANSFER:
  PipeHandle           = 81c9d144 [endpoint 0x00000081]
  TransferFlags        = 00000003 (USBD_TRANSFER_DIRECTION_IN, USBD_SHORT_TRANSFER_OK)
  TransferBufferLength = 0000000f
  TransferBuffer       = 00000000
  TransferBufferMDL    = 81cf5428
    00000000: 00 00 00 0a 04 00 00 00 04 00 12 00 00 07 d0
  UrbLink              = 00000000
[223378 ms] UsbSnoop - DispatchAny(f890e610) : IRP_MJ_INTERNAL_DEVICE_CONTROL
[223378 ms] UsbSnoop - MyDispatchInternalIOCTL(f890fe80) : fdo=81c63810, Irp=822e9640, IRQL=2
[223378 ms]  >>>  URB 561 going down  >>> 
-- URB_FUNCTION_BULK_OR_INTERRUPT_TRANSFER:
  PipeHandle           = 81c9d164 [endpoint 0x00000002]
  TransferFlags        = 00000000 (USBD_TRANSFER_DIRECTION_OUT, ~USBD_SHORT_TRANSFER_OK)
  TransferBufferLength = 00000007
  TransferBuffer       = 00000000
  TransferBufferMDL    = 81cf5428
    00000000: 00 00 00 02 05 e0 00
  UrbLink              = 00000000
[223378 ms] UsbSnoop - MyInternalIOCTLCompletion(f890fdb0) : fido=822da020, Irp=822e9640, Context=81ba5340, IRQL=2
[223378 ms]  <<<  URB 561 coming back  <<< 
-- URB_FUNCTION_BULK_OR_INTERRUPT_TRANSFER:
  PipeHandle           = 81c9d164 [endpoint 0x00000002]
  TransferFlags        = 00000000 (USBD_TRANSFER_DIRECTION_OUT, ~USBD_SHORT_TRANSFER_OK)
  TransferBufferLength = 00000007
  TransferBuffer       = 00000000
  TransferBufferMDL    = 81cf5428
  UrbLink              = 00000000
[223388 ms] UsbSnoop - DispatchAny(f890e610) : IRP_MJ_INTERNAL_DEVICE_CONTROL
[223388 ms] UsbSnoop - MyDispatchInternalIOCTL(f890fe80) : fdo=81c63810, Irp=822e9640, IRQL=2
[223388 ms]  >>>  URB 562 going down  >>> 
-- URB_FUNCTION_BULK_OR_INTERRUPT_TRANSFER:
  PipeHandle           = 81c9d164 [endpoint 0x00000002]
  TransferFlags        = 00000000 (USBD_TRANSFER_DIRECTION_OUT, ~USBD_SHORT_TRANSFER_OK)
  TransferBufferLength = 00000022
  TransferBuffer       = 00000000
  TransferBufferMDL    = 81cf5428
    00000000: 00 00 00 1d 04 00 00 00 17 00 09 00 00 00 06 00
    00000010: 02 00 03 00 05 00 01 00 41 00 42 00 01 00 01 00
    00000020: 01 01
  UrbLink              = 00000000
[223388 ms] UsbSnoop - MyInternalIOCTLCompletion(f890fdb0) : fido=822da020, Irp=822e9640, Context=81bc6e50, IRQL=2
[223388 ms]  <<<  URB 562 coming back  <<< 
-- URB_FUNCTION_BULK_OR_INTERRUPT_TRANSFER:
  PipeHandle           = 81c9d164 [endpoint 0x00000002]
  TransferFlags        = 00000000 (USBD_TRANSFER_DIRECTION_OUT, ~USBD_SHORT_TRANSFER_OK)
  TransferBufferLength = 00000022
  TransferBuffer       = 00000000
  TransferBufferMDL    = 81cf5428
  UrbLink              = 00000000
[223398 ms] UsbSnoop - DispatchAny(f890e610) : IRP_MJ_INTERNAL_DEVICE_CONTROL
[223398 ms] UsbSnoop - MyDispatchInternalIOCTL(f890fe80) : fdo=81c63810, Irp=822e9640, IRQL=2
[223398 ms]  >>>  URB 563 going down  >>> 
-- URB_FUNCTION_BULK_OR_INTERRUPT_TRANSFER:
  PipeHandle           = 81c9d144 [endpoint 0x00000081]
  TransferFlags        = 00000003 (USBD_TRANSFER_DIRECTION_IN, USBD_SHORT_TRANSFER_OK)
  TransferBufferLength = 00000100
  TransferBuffer       = 00000000
  TransferBufferMDL    = 81cf5428
  UrbLink              = 00000000
[223398 ms] UsbSnoop - MyInternalIOCTLCompletion(f890fdb0) : fido=822da020, Irp=822e9640, Context=81b87c90, IRQL=2
[223398 ms]  <<<  URB 563 coming back  <<< 
-- URB_FUNCTION_BULK_OR_INTERRUPT_TRANSFER:
  PipeHandle           = 81c9d144 [endpoint 0x00000081]
  TransferFlags        = 00000003 (USBD_TRANSFER_DIRECTION_IN, USBD_SHORT_TRANSFER_OK)
  TransferBufferLength = 00000007
  TransferBuffer       = 00000000
  TransferBufferMDL    = 81cf5428
    00000000: 00 00 00 02 05 e0 00
  UrbLink              = 00000000
[223438 ms] UsbSnoop - DispatchAny(f890e610) : IRP_MJ_INTERNAL_DEVICE_CONTROL
[223438 ms] UsbSnoop - MyDispatchInternalIOCTL(f890fe80) : fdo=81c63810, Irp=822e9640, IRQL=2
[223438 ms]  >>>  URB 564 going down  >>> 
-- URB_FUNCTION_BULK_OR_INTERRUPT_TRANSFER:
  PipeHandle           = 81c9d144 [endpoint 0x00000081]
  TransferFlags        = 00000003 (USBD_TRANSFER_DIRECTION_IN, USBD_SHORT_TRANSFER_OK)
  TransferBufferLength = 00000100
  TransferBuffer       = 00000000
  TransferBufferMDL    = 81cf5428
  UrbLink              = 00000000
[223438 ms] UsbSnoop - MyInternalIOCTLCompletion(f890fdb0) : fido=822da020, Irp=822e9640, Context=81c024b8, IRQL=2
[223438 ms]  <<<  URB 564 coming back  <<< 
-- URB_FUNCTION_BULK_OR_INTERRUPT_TRANSFER:
  PipeHandle           = 81c9d144 [endpoint 0x00000081]
  TransferFlags        = 00000003 (USBD_TRANSFER_DIRECTION_IN, USBD_SHORT_TRANSFER_OK)
  TransferBufferLength = 00000032
  TransferBuffer       = 00000000
  TransferBufferMDL    = 81cf5428
    00000000: 00 00 00 2d 04 00 00 00 27 00 0a 00 01 43 00 00
    00000010: 06 00 02 00 00 04 f0 07 00 00 00 03 00 00 01 01
    00000020: 00 05 01 00 01 00 00 04 00 00 00 09 00 41 01 00
    00000030: 42 01
  UrbLink              = 00000000
[223478 ms] UsbSnoop - DispatchAny(f890e610) : IRP_MJ_INTERNAL_DEVICE_CONTROL
[223478 ms] UsbSnoop - MyDispatchInternalIOCTL(f890fe80) : fdo=81c63810, Irp=822e9640, IRQL=2
[223478 ms]  >>>  URB 565 going down  >>> 
-- URB_FUNCTION_BULK_OR_INTERRUPT_TRANSFER:
  PipeHandle           = 81c9d164 [endpoint 0x00000002]
  TransferFlags        = 00000000 (USBD_TRANSFER_DIRECTION_OUT, ~USBD_SHORT_TRANSFER_OK)
  TransferBufferLength = 00000007
  TransferBuffer       = 00000000
  TransferBufferMDL    = 81cf5428
    00000000: 00 00 00 02 05 e0 00
  UrbLink              = 00000000
[223478 ms] UsbSnoop - MyInternalIOCTLCompletion(f890fdb0) : fido=822da020, Irp=822e9640, Context=8218efe8, IRQL=2
[223478 ms]  <<<  URB 565 coming back  <<< 
-- URB_FUNCTION_BULK_OR_INTERRUPT_TRANSFER:
  PipeHandle           = 81c9d164 [endpoint 0x00000002]
  TransferFlags        = 00000000 (USBD_TRANSFER_DIRECTION_OUT, ~USBD_SHORT_TRANSFER_OK)
  TransferBufferLength = 00000007
  TransferBuffer       = 00000000
  TransferBufferMDL    = 81cf5428
  UrbLink              = 00000000
[223488 ms] UsbSnoop - DispatchAny(f890e610) : IRP_MJ_INTERNAL_DEVICE_CONTROL
[223488 ms] UsbSnoop - MyDispatchInternalIOCTL(f890fe80) : fdo=81c63810, Irp=822e9640, IRQL=2
[223488 ms]  >>>  URB 566 going down  >>> 
-- URB_FUNCTION_BULK_OR_INTERRUPT_TRANSFER:
  PipeHandle           = 81c9d144 [endpoint 0x00000081]
  TransferFlags        = 00000003 (USBD_TRANSFER_DIRECTION_IN, USBD_SHORT_TRANSFER_OK)
  TransferBufferLength = 00000100
  TransferBuffer       = 00000000
  TransferBufferMDL    = 81cf5428
  UrbLink              = 00000000
[223515 ms] UsbSnoop - MyInternalIOCTLCompletion(f890fdb0) : fido=822da020, Irp=822e9640, Context=81ba5340, IRQL=2
[223515 ms]  <<<  URB 566 coming back  <<< 
-- URB_FUNCTION_BULK_OR_INTERRUPT_TRANSFER:
  PipeHandle           = 81c9d144 [endpoint 0x00000081]
  TransferFlags        = 00000003 (USBD_TRANSFER_DIRECTION_IN, USBD_SHORT_TRANSFER_OK)
  TransferBufferLength = 00000032
  TransferBuffer       = 00000000
  TransferBufferMDL    = 81cf5428
    00000000: 00 00 00 2d 04 00 00 00 27 00 0a 00 01 41 00 00
    00000010: 06 00 02 00 00 04 f0 07 00 00 00 03 00 00 01 00
    00000020: 00 05 01 00 01 00 00 04 00 00 00 09 00 41 01 00
    00000030: 42 01
  UrbLink              = 00000000
[223548 ms] UsbSnoop - DispatchAny(f890e610) : IRP_MJ_INTERNAL_DEVICE_CONTROL
[223548 ms] UsbSnoop - MyDispatchInternalIOCTL(f890fe80) : fdo=81c63810, Irp=81d098c8, IRQL=2
[223548 ms]  >>>  URB 567 going down  >>> 
-- URB_FUNCTION_BULK_OR_INTERRUPT_TRANSFER:
  PipeHandle           = 81c9d164 [endpoint 0x00000002]
  TransferFlags        = 00000000 (USBD_TRANSFER_DIRECTION_OUT, ~USBD_SHORT_TRANSFER_OK)
  TransferBufferLength = 00000007
  TransferBuffer       = 00000000
  TransferBufferMDL    = 81cf5428
    00000000: 00 00 00 02 05 e0 00
  UrbLink              = 00000000
[223549 ms] UsbSnoop - MyInternalIOCTLCompletion(f890fdb0) : fido=822da020, Irp=81d098c8, Context=81c024b8, IRQL=2
[223549 ms]  <<<  URB 567 coming back  <<< 
-- URB_FUNCTION_BULK_OR_INTERRUPT_TRANSFER:
  PipeHandle           = 81c9d164 [endpoint 0x00000002]
  TransferFlags        = 00000000 (USBD_TRANSFER_DIRECTION_OUT, ~USBD_SHORT_TRANSFER_OK)
  TransferBufferLength = 00000007
  TransferBuffer       = 00000000
  TransferBufferMDL    = 81cf5428
  UrbLink              = 00000000
[223558 ms] UsbSnoop - DispatchAny(f890e610) : IRP_MJ_INTERNAL_DEVICE_CONTROL
[223558 ms] UsbSnoop - MyDispatchInternalIOCTL(f890fe80) : fdo=81c63810, Irp=81d098c8, IRQL=2
[223558 ms]  >>>  URB 568 going down  >>> 
-- URB_FUNCTION_BULK_OR_INTERRUPT_TRANSFER:
  PipeHandle           = 81c9d144 [endpoint 0x00000081]
  TransferFlags        = 00000003 (USBD_TRANSFER_DIRECTION_IN, USBD_SHORT_TRANSFER_OK)
  TransferBufferLength = 00000100
  TransferBuffer       = 00000000
  TransferBufferMDL    = 81cf5428
  UrbLink              = 00000000
[223558 ms] UsbSnoop - MyInternalIOCTLCompletion(f890fdb0) : fido=822da020, Irp=81d098c8, Context=81ba5340, IRQL=2
[223558 ms]  <<<  URB 568 coming back  <<< 
-- URB_FUNCTION_BULK_OR_INTERRUPT_TRANSFER:
  PipeHandle           = 81c9d144 [endpoint 0x00000081]
  TransferFlags        = 00000003 (USBD_TRANSFER_DIRECTION_IN, USBD_SHORT_TRANSFER_OK)
  TransferBufferLength = 00000032
  TransferBuffer       = 00000000
  TransferBufferMDL    = 81cf5428
    00000000: 00 00 00 2d 04 00 00 00 27 00 0a 00 01 42 00 00
    00000010: 06 00 02 00 00 04 f0 07 00 00 00 03 00 00 01 00
    00000020: 00 05 01 00 01 00 00 04 00 00 00 09 00 41 01 00
    00000030: 42 01
  UrbLink              = 00000000
[223598 ms] UsbSnoop - DispatchAny(f890e610) : IRP_MJ_INTERNAL_DEVICE_CONTROL
[223598 ms] UsbSnoop - MyDispatchInternalIOCTL(f890fe80) : fdo=81c63810, Irp=81d098c8, IRQL=2
[223598 ms]  >>>  URB 569 going down  >>> 
-- URB_FUNCTION_BULK_OR_INTERRUPT_TRANSFER:
  PipeHandle           = 81c9d164 [endpoint 0x00000002]
  TransferFlags        = 00000000 (USBD_TRANSFER_DIRECTION_OUT, ~USBD_SHORT_TRANSFER_OK)
  TransferBufferLength = 00000007
  TransferBuffer       = 00000000
  TransferBufferMDL    = 81cf5428
    00000000: 00 00 00 02 05 e0 00
  UrbLink              = 00000000
[223599 ms] UsbSnoop - MyInternalIOCTLCompletion(f890fdb0) : fido=822da020, Irp=81d098c8, Context=8218efe8, IRQL=2
[223599 ms]  <<<  URB 569 coming back  <<< 
-- URB_FUNCTION_BULK_OR_INTERRUPT_TRANSFER:
  PipeHandle           = 81c9d164 [endpoint 0x00000002]
  TransferFlags        = 00000000 (USBD_TRANSFER_DIRECTION_OUT, ~USBD_SHORT_TRANSFER_OK)
  TransferBufferLength = 00000007
  TransferBuffer       = 00000000
  TransferBufferMDL    = 81cf5428
  UrbLink              = 00000000
[223608 ms] UsbSnoop - DispatchAny(f890e610) : IRP_MJ_INTERNAL_DEVICE_CONTROL
[223608 ms] UsbSnoop - MyDispatchInternalIOCTL(f890fe80) : fdo=81c63810, Irp=81d098c8, IRQL=2
[223608 ms]  >>>  URB 570 going down  >>> 
-- URB_FUNCTION_BULK_OR_INTERRUPT_TRANSFER:
  PipeHandle           = 81c9d144 [endpoint 0x00000081]
  TransferFlags        = 00000003 (USBD_TRANSFER_DIRECTION_IN, USBD_SHORT_TRANSFER_OK)
  TransferBufferLength = 00000100
  TransferBuffer       = 00000000
  TransferBufferMDL    = 81cf5428
  UrbLink              = 00000000
[223609 ms] UsbSnoop - MyInternalIOCTLCompletion(f890fdb0) : fido=822da020, Irp=81d098c8, Context=81ba5340, IRQL=2
[223609 ms]  <<<  URB 570 coming back  <<< 
-- URB_FUNCTION_BULK_OR_INTERRUPT_TRANSFER:
  PipeHandle           = 81c9d144 [endpoint 0x00000081]
  TransferFlags        = 00000003 (USBD_TRANSFER_DIRECTION_IN, USBD_SHORT_TRANSFER_OK)
  TransferBufferLength = 00000035
  TransferBuffer       = 00000000
  TransferBufferMDL    = 81cf5428
    00000000: 00 00 00 30 04 00 00 00 2a 00 0a 00 04 4c e2 82
    00000010: 81 00 00 06 00 02 00 00 04 f0 07 00 01 00 03 00
    00000020: 00 01 00 00 05 01 00 01 00 00 04 00 00 00 02 00
    00000030: 41 01 00 42 01
  UrbLink              = 00000000
[223649 ms] UsbSnoop - DispatchAny(f890e610) : IRP_MJ_INTERNAL_DEVICE_CONTROL
[223649 ms] UsbSnoop - MyDispatchInternalIOCTL(f890fe80) : fdo=81c63810, Irp=81d098c8, IRQL=2
[223649 ms]  >>>  URB 571 going down  >>> 
-- URB_FUNCTION_BULK_OR_INTERRUPT_TRANSFER:
  PipeHandle           = 81c9d164 [endpoint 0x00000002]
  TransferFlags        = 00000000 (USBD_TRANSFER_DIRECTION_OUT, ~USBD_SHORT_TRANSFER_OK)
  TransferBufferLength = 00000007
  TransferBuffer       = 00000000
  TransferBufferMDL    = 81cf5428
    00000000: 00 00 00 02 05 e0 00
  UrbLink              = 00000000
[223649 ms] UsbSnoop - MyInternalIOCTLCompletion(f890fdb0) : fido=822da020, Irp=81d098c8, Context=81c024b8, IRQL=2
[223649 ms]  <<<  URB 571 coming back  <<< 
-- URB_FUNCTION_BULK_OR_INTERRUPT_TRANSFER:
  PipeHandle           = 81c9d164 [endpoint 0x00000002]
  TransferFlags        = 00000000 (USBD_TRANSFER_DIRECTION_OUT, ~USBD_SHORT_TRANSFER_OK)
  TransferBufferLength = 00000007
  TransferBuffer       = 00000000
  TransferBufferMDL    = 81cf5428
  UrbLink              = 00000000
[223659 ms] UsbSnoop - DispatchAny(f890e610) : IRP_MJ_INTERNAL_DEVICE_CONTROL
[223659 ms] UsbSnoop - MyDispatchInternalIOCTL(f890fe80) : fdo=81c63810, Irp=81d098c8, IRQL=2
[223659 ms]  >>>  URB 572 going down  >>> 
-- URB_FUNCTION_BULK_OR_INTERRUPT_TRANSFER:
  PipeHandle           = 81c9d144 [endpoint 0x00000081]
  TransferFlags        = 00000003 (USBD_TRANSFER_DIRECTION_IN, USBD_SHORT_TRANSFER_OK)
  TransferBufferLength = 00000100
  TransferBuffer       = 00000000
  TransferBufferMDL    = 81cf5428
  UrbLink              = 00000000
[223659 ms] UsbSnoop - MyInternalIOCTLCompletion(f890fdb0) : fido=822da020, Irp=81d098c8, Context=81b87c90, IRQL=2
[223659 ms]  <<<  URB 572 coming back  <<< 
-- URB_FUNCTION_BULK_OR_INTERRUPT_TRANSFER:
  PipeHandle           = 81c9d144 [endpoint 0x00000081]
  TransferFlags        = 00000003 (USBD_TRANSFER_DIRECTION_IN, USBD_SHORT_TRANSFER_OK)
  TransferBufferLength = 00000035
  TransferBuffer       = 00000000
  TransferBufferMDL    = 81cf5428
    00000000: 00 00 00 30 04 00 00 00 2a 00 0a 00 04 4c e2 82
    00000010: 82 00 00 06 00 02 00 00 04 f0 07 00 01 00 03 00
    00000020: 00 01 00 00 05 01 00 01 00 00 04 00 00 00 02 00
    00000030: 41 01 00 42 01
  UrbLink              = 00000000
[223699 ms] UsbSnoop - DispatchAny(f890e610) : IRP_MJ_INTERNAL_DEVICE_CONTROL
[223699 ms] UsbSnoop - MyDispatchInternalIOCTL(f890fe80) : fdo=81c63810, Irp=81d098c8, IRQL=2
[223699 ms]  >>>  URB 573 going down  >>> 
-- URB_FUNCTION_BULK_OR_INTERRUPT_TRANSFER:
  PipeHandle           = 81c9d164 [endpoint 0x00000002]
  TransferFlags        = 00000000 (USBD_TRANSFER_DIRECTION_OUT, ~USBD_SHORT_TRANSFER_OK)
  TransferBufferLength = 00000007
  TransferBuffer       = 00000000
  TransferBufferMDL    = 81cf5428
    00000000: 00 00 00 02 05 e0 00
  UrbLink              = 00000000
[223699 ms] UsbSnoop - MyInternalIOCTLCompletion(f890fdb0) : fido=822da020, Irp=81d098c8, Context=81c9a480, IRQL=2
[223699 ms]  <<<  URB 573 coming back  <<< 
-- URB_FUNCTION_BULK_OR_INTERRUPT_TRANSFER:
  PipeHandle           = 81c9d164 [endpoint 0x00000002]
  TransferFlags        = 00000000 (USBD_TRANSFER_DIRECTION_OUT, ~USBD_SHORT_TRANSFER_OK)
  TransferBufferLength = 00000007
  TransferBuffer       = 00000000
  TransferBufferMDL    = 81cf5428
  UrbLink              = 00000000
[223709 ms] UsbSnoop - DispatchAny(f890e610) : IRP_MJ_INTERNAL_DEVICE_CONTROL
[223709 ms] UsbSnoop - MyDispatchInternalIOCTL(f890fe80) : fdo=81c63810, Irp=81d098c8, IRQL=2
[223709 ms]  >>>  URB 574 going down  >>> 
-- URB_FUNCTION_BULK_OR_INTERRUPT_TRANSFER:
  PipeHandle           = 81c9d144 [endpoint 0x00000081]
  TransferFlags        = 00000003 (USBD_TRANSFER_DIRECTION_IN, USBD_SHORT_TRANSFER_OK)
  TransferBufferLength = 00000100
  TransferBuffer       = 00000000
  TransferBufferMDL    = 81cf5428
  UrbLink              = 00000000
[223709 ms] UsbSnoop - MyInternalIOCTLCompletion(f890fdb0) : fido=822da020, Irp=81d098c8, Context=81b87c90, IRQL=2
[223709 ms]  <<<  URB 574 coming back  <<< 
-- URB_FUNCTION_BULK_OR_INTERRUPT_TRANSFER:
  PipeHandle           = 81c9d144 [endpoint 0x00000081]
  TransferFlags        = 00000003 (USBD_TRANSFER_DIRECTION_IN, USBD_SHORT_TRANSFER_OK)
  TransferBufferLength = 00000035
  TransferBuffer       = 00000000
  TransferBufferMDL    = 81cf5428
    00000000: 00 00 00 30 04 00 00 00 2a 00 0a 00 04 4c e2 82
    00000010: 83 00 00 06 00 02 00 00 04 f0 07 00 01 00 03 00
    00000020: 00 01 00 00 05 01 00 01 00 00 04 00 00 00 02 00
    00000030: 41 01 00 42 01
  UrbLink              = 00000000
[223749 ms] UsbSnoop - DispatchAny(f890e610) : IRP_MJ_INTERNAL_DEVICE_CONTROL
[223749 ms] UsbSnoop - MyDispatchInternalIOCTL(f890fe80) : fdo=81c63810, Irp=81d098c8, IRQL=2
[223749 ms]  >>>  URB 575 going down  >>> 
-- URB_FUNCTION_BULK_OR_INTERRUPT_TRANSFER:
  PipeHandle           = 81c9d164 [endpoint 0x00000002]
  TransferFlags        = 00000000 (USBD_TRANSFER_DIRECTION_OUT, ~USBD_SHORT_TRANSFER_OK)
  TransferBufferLength = 00000007
  TransferBuffer       = 00000000
  TransferBufferMDL    = 81cf5428
    00000000: 00 00 00 02 05 e0 00
  UrbLink              = 00000000
[223749 ms] UsbSnoop - MyInternalIOCTLCompletion(f890fdb0) : fido=822da020, Irp=81d098c8, Context=81b3c2e0, IRQL=2
[223749 ms]  <<<  URB 575 coming back  <<< 
-- URB_FUNCTION_BULK_OR_INTERRUPT_TRANSFER:
  PipeHandle           = 81c9d164 [endpoint 0x00000002]
  TransferFlags        = 00000000 (USBD_TRANSFER_DIRECTION_OUT, ~USBD_SHORT_TRANSFER_OK)
  TransferBufferLength = 00000007
  TransferBuffer       = 00000000
  TransferBufferMDL    = 81cf5428
  UrbLink              = 00000000
[223759 ms] UsbSnoop - DispatchAny(f890e610) : IRP_MJ_INTERNAL_DEVICE_CONTROL
[223759 ms] UsbSnoop - MyDispatchInternalIOCTL(f890fe80) : fdo=81c63810, Irp=81d098c8, IRQL=2
[223759 ms]  >>>  URB 576 going down  >>> 
-- URB_FUNCTION_BULK_OR_INTERRUPT_TRANSFER:
  PipeHandle           = 81c9d144 [endpoint 0x00000081]
  TransferFlags        = 00000003 (USBD_TRANSFER_DIRECTION_IN, USBD_SHORT_TRANSFER_OK)
  TransferBufferLength = 00000100
  TransferBuffer       = 00000000
  TransferBufferMDL    = 81cf5428
  UrbLink              = 00000000
[223759 ms] UsbSnoop - MyInternalIOCTLCompletion(f890fdb0) : fido=822da020, Irp=81d098c8, Context=81ba5340, IRQL=2
[223759 ms]  <<<  URB 576 coming back  <<< 
-- URB_FUNCTION_BULK_OR_INTERRUPT_TRANSFER:
  PipeHandle           = 81c9d144 [endpoint 0x00000081]
  TransferFlags        = 00000003 (USBD_TRANSFER_DIRECTION_IN, USBD_SHORT_TRANSFER_OK)
  TransferBufferLength = 00000035
  TransferBuffer       = 00000000
  TransferBufferMDL    = 81cf5428
    00000000: 00 00 00 30 04 00 00 00 2a 00 0a 00 04 4c e2 82
    00000010: 84 00 00 06 00 02 00 00 04 f0 07 00 01 00 03 00
    00000020: 00 01 00 00 05 01 00 01 00 00 04 00 00 00 02 00
    00000030: 41 01 00 42 01
  UrbLink              = 00000000
[223799 ms] UsbSnoop - DispatchAny(f890e610) : IRP_MJ_INTERNAL_DEVICE_CONTROL
[223799 ms] UsbSnoop - MyDispatchInternalIOCTL(f890fe80) : fdo=81c63810, Irp=81d098c8, IRQL=2
[223799 ms]  >>>  URB 577 going down  >>> 
-- URB_FUNCTION_BULK_OR_INTERRUPT_TRANSFER:
  PipeHandle           = 81c9d164 [endpoint 0x00000002]
  TransferFlags        = 00000000 (USBD_TRANSFER_DIRECTION_OUT, ~USBD_SHORT_TRANSFER_OK)
  TransferBufferLength = 00000007
  TransferBuffer       = 00000000
  TransferBufferMDL    = 81cf5428
    00000000: 00 00 00 02 05 e0 00
  UrbLink              = 00000000
[223799 ms] UsbSnoop - MyInternalIOCTLCompletion(f890fdb0) : fido=822da020, Irp=81d098c8, Context=81c024b8, IRQL=2
[223799 ms]  <<<  URB 577 coming back  <<< 
-- URB_FUNCTION_BULK_OR_INTERRUPT_TRANSFER:
  PipeHandle           = 81c9d164 [endpoint 0x00000002]
  TransferFlags        = 00000000 (USBD_TRANSFER_DIRECTION_OUT, ~USBD_SHORT_TRANSFER_OK)
  TransferBufferLength = 00000007
  TransferBuffer       = 00000000
  TransferBufferMDL    = 81cf5428
  UrbLink              = 00000000
[223809 ms] UsbSnoop - DispatchAny(f890e610) : IRP_MJ_INTERNAL_DEVICE_CONTROL
[223809 ms] UsbSnoop - MyDispatchInternalIOCTL(f890fe80) : fdo=81c63810, Irp=81d098c8, IRQL=2
[223809 ms]  >>>  URB 578 going down  >>> 
-- URB_FUNCTION_BULK_OR_INTERRUPT_TRANSFER:
  PipeHandle           = 81c9d144 [endpoint 0x00000081]
  TransferFlags        = 00000003 (USBD_TRANSFER_DIRECTION_IN, USBD_SHORT_TRANSFER_OK)
  TransferBufferLength = 00000100
  TransferBuffer       = 00000000
  TransferBufferMDL    = 81cf5428
  UrbLink              = 00000000
[223809 ms] UsbSnoop - MyInternalIOCTLCompletion(f890fdb0) : fido=822da020, Irp=81d098c8, Context=81c9a480, IRQL=2
[223809 ms]  <<<  URB 578 coming back  <<< 
-- URB_FUNCTION_BULK_OR_INTERRUPT_TRANSFER:
  PipeHandle           = 81c9d144 [endpoint 0x00000081]
  TransferFlags        = 00000003 (USBD_TRANSFER_DIRECTION_IN, USBD_SHORT_TRANSFER_OK)
  TransferBufferLength = 00000035
  TransferBuffer       = 00000000
  TransferBufferMDL    = 81cf5428
    00000000: 00 00 00 30 04 00 00 00 2a 00 0a 00 04 4c e2 82
    00000010: 85 00 00 06 00 02 00 00 04 f0 07 00 01 00 03 00
    00000020: 00 01 00 00 05 01 00 01 00 00 04 00 00 00 02 00
    00000030: 41 01 00 42 01
  UrbLink              = 00000000
[223849 ms] UsbSnoop - DispatchAny(f890e610) : IRP_MJ_INTERNAL_DEVICE_CONTROL
[223849 ms] UsbSnoop - MyDispatchInternalIOCTL(f890fe80) : fdo=81c63810, Irp=81d098c8, IRQL=2
[223849 ms]  >>>  URB 579 going down  >>> 
-- URB_FUNCTION_BULK_OR_INTERRUPT_TRANSFER:
  PipeHandle           = 81c9d164 [endpoint 0x00000002]
  TransferFlags        = 00000000 (USBD_TRANSFER_DIRECTION_OUT, ~USBD_SHORT_TRANSFER_OK)
  TransferBufferLength = 00000007
  TransferBuffer       = 00000000
  TransferBufferMDL    = 81cf5428
    00000000: 00 00 00 02 05 e0 00
  UrbLink              = 00000000
[223849 ms] UsbSnoop - MyInternalIOCTLCompletion(f890fdb0) : fido=822da020, Irp=81d098c8, Context=81ba5340, IRQL=2
[223849 ms]  <<<  URB 579 coming back  <<< 
-- URB_FUNCTION_BULK_OR_INTERRUPT_TRANSFER:
  PipeHandle           = 81c9d164 [endpoint 0x00000002]
  TransferFlags        = 00000000 (USBD_TRANSFER_DIRECTION_OUT, ~USBD_SHORT_TRANSFER_OK)
  TransferBufferLength = 00000007
  TransferBuffer       = 00000000
  TransferBufferMDL    = 81cf5428
  UrbLink              = 00000000
[223859 ms] UsbSnoop - DispatchAny(f890e610) : IRP_MJ_INTERNAL_DEVICE_CONTROL
[223859 ms] UsbSnoop - MyDispatchInternalIOCTL(f890fe80) : fdo=81c63810, Irp=81d098c8, IRQL=2
[223859 ms]  >>>  URB 580 going down  >>> 
-- URB_FUNCTION_BULK_OR_INTERRUPT_TRANSFER:
  PipeHandle           = 81c9d144 [endpoint 0x00000081]
  TransferFlags        = 00000003 (USBD_TRANSFER_DIRECTION_IN, USBD_SHORT_TRANSFER_OK)
  TransferBufferLength = 00000100
  TransferBuffer       = 00000000
  TransferBufferMDL    = 81cf5428
  UrbLink              = 00000000
[223859 ms] UsbSnoop - MyInternalIOCTLCompletion(f890fdb0) : fido=822da020, Irp=81d098c8, Context=81c9a480, IRQL=2
[223859 ms]  <<<  URB 580 coming back  <<< 
-- URB_FUNCTION_BULK_OR_INTERRUPT_TRANSFER:
  PipeHandle           = 81c9d144 [endpoint 0x00000081]
  TransferFlags        = 00000003 (USBD_TRANSFER_DIRECTION_IN, USBD_SHORT_TRANSFER_OK)
  TransferBufferLength = 00000035
  TransferBuffer       = 00000000
  TransferBufferMDL    = 81cf5428
    00000000: 00 00 00 30 04 00 00 00 2a 00 0a 00 04 4c e2 82
    00000010: 86 00 00 06 00 02 00 00 04 f0 07 00 01 00 03 00
    00000020: 00 01 00 00 05 01 00 01 00 00 04 00 00 00 02 00
    00000030: 41 01 00 42 01
  UrbLink              = 00000000
[223899 ms] UsbSnoop - DispatchAny(f890e610) : IRP_MJ_INTERNAL_DEVICE_CONTROL
[223899 ms] UsbSnoop - MyDispatchInternalIOCTL(f890fe80) : fdo=81c63810, Irp=81d098c8, IRQL=2
[223899 ms]  >>>  URB 581 going down  >>> 
-- URB_FUNCTION_BULK_OR_INTERRUPT_TRANSFER:
  PipeHandle           = 81c9d164 [endpoint 0x00000002]
  TransferFlags        = 00000000 (USBD_TRANSFER_DIRECTION_OUT, ~USBD_SHORT_TRANSFER_OK)
  TransferBufferLength = 00000007
  TransferBuffer       = 00000000
  TransferBufferMDL    = 81cf5428
    00000000: 00 00 00 02 05 e0 00
  UrbLink              = 00000000
[223899 ms] UsbSnoop - MyInternalIOCTLCompletion(f890fdb0) : fido=822da020, Irp=81d098c8, Context=81c024b8, IRQL=2
[223899 ms]  <<<  URB 581 coming back  <<< 
-- URB_FUNCTION_BULK_OR_INTERRUPT_TRANSFER:
  PipeHandle           = 81c9d164 [endpoint 0x00000002]
  TransferFlags        = 00000000 (USBD_TRANSFER_DIRECTION_OUT, ~USBD_SHORT_TRANSFER_OK)
  TransferBufferLength = 00000007
  TransferBuffer       = 00000000
  TransferBufferMDL    = 81cf5428
  UrbLink              = 00000000
[223909 ms] UsbSnoop - DispatchAny(f890e610) : IRP_MJ_INTERNAL_DEVICE_CONTROL
[223909 ms] UsbSnoop - MyDispatchInternalIOCTL(f890fe80) : fdo=81c63810, Irp=81d098c8, IRQL=2
[223909 ms]  >>>  URB 582 going down  >>> 
-- URB_FUNCTION_BULK_OR_INTERRUPT_TRANSFER:
  PipeHandle           = 81c9d144 [endpoint 0x00000081]
  TransferFlags        = 00000003 (USBD_TRANSFER_DIRECTION_IN, USBD_SHORT_TRANSFER_OK)
  TransferBufferLength = 00000100
  TransferBuffer       = 00000000
  TransferBufferMDL    = 81cf5428
  UrbLink              = 00000000
[223909 ms] UsbSnoop - MyInternalIOCTLCompletion(f890fdb0) : fido=822da020, Irp=81d098c8, Context=81c9a480, IRQL=2
[223909 ms]  <<<  URB 582 coming back  <<< 
-- URB_FUNCTION_BULK_OR_INTERRUPT_TRANSFER:
  PipeHandle           = 81c9d144 [endpoint 0x00000081]
  TransferFlags        = 00000003 (USBD_TRANSFER_DIRECTION_IN, USBD_SHORT_TRANSFER_OK)
  TransferBufferLength = 0000000b
  TransferBuffer       = 00000000
  TransferBufferMDL    = 81cf5428
    00000000: 00 00 00 06 04 00 00 00 00 dd 00
  UrbLink              = 00000000
[223949 ms] UsbSnoop - DispatchAny(f890e610) : IRP_MJ_INTERNAL_DEVICE_CONTROL
[223949 ms] UsbSnoop - MyDispatchInternalIOCTL(f890fe80) : fdo=81c63810, Irp=81d098c8, IRQL=2
[223949 ms]  >>>  URB 583 going down  >>> 
-- URB_FUNCTION_BULK_OR_INTERRUPT_TRANSFER:
  PipeHandle           = 81c9d164 [endpoint 0x00000002]
  TransferFlags        = 00000000 (USBD_TRANSFER_DIRECTION_OUT, ~USBD_SHORT_TRANSFER_OK)
  TransferBufferLength = 00000007
  TransferBuffer       = 00000000
  TransferBufferMDL    = 81cf5428
    00000000: 00 00 00 02 05 e0 00
  UrbLink              = 00000000
[223949 ms] UsbSnoop - MyInternalIOCTLCompletion(f890fdb0) : fido=822da020, Irp=81d098c8, Context=81b3c2e0, IRQL=2
[223949 ms]  <<<  URB 583 coming back  <<< 
-- URB_FUNCTION_BULK_OR_INTERRUPT_TRANSFER:
  PipeHandle           = 81c9d164 [endpoint 0x00000002]
  TransferFlags        = 00000000 (USBD_TRANSFER_DIRECTION_OUT, ~USBD_SHORT_TRANSFER_OK)
  TransferBufferLength = 00000007
  TransferBuffer       = 00000000
  TransferBufferMDL    = 81cf5428
  UrbLink              = 00000000
[224209 ms] UsbSnoop - DispatchAny(f890e610) : IRP_MJ_INTERNAL_DEVICE_CONTROL
[224209 ms] UsbSnoop - MyDispatchInternalIOCTL(f890fe80) : fdo=81c63810, Irp=81d098c8, IRQL=2
[224209 ms]  >>>  URB 584 going down  >>> 
-- URB_FUNCTION_BULK_OR_INTERRUPT_TRANSFER:
  PipeHandle           = 81c9d164 [endpoint 0x00000002]
  TransferFlags        = 00000000 (USBD_TRANSFER_DIRECTION_OUT, ~USBD_SHORT_TRANSFER_OK)
  TransferBufferLength = 00000009
  TransferBuffer       = 00000000
  TransferBufferMDL    = 81cf5428
    00000000: 00 00 00 04 01 00 00 04 00
  UrbLink              = 00000000
[224210 ms] UsbSnoop - MyInternalIOCTLCompletion(f890fdb0) : fido=822da020, Irp=81d098c8, Context=81bc6e50, IRQL=2
[224210 ms]  <<<  URB 584 coming back  <<< 
-- URB_FUNCTION_BULK_OR_INTERRUPT_TRANSFER:
  PipeHandle           = 81c9d164 [endpoint 0x00000002]
  TransferFlags        = 00000000 (USBD_TRANSFER_DIRECTION_OUT, ~USBD_SHORT_TRANSFER_OK)
  TransferBufferLength = 00000009
  TransferBuffer       = 00000000
  TransferBufferMDL    = 81cf5428
  UrbLink              = 00000000
[224210 ms] UsbSnoop - DispatchAny(f890e610) : IRP_MJ_INTERNAL_DEVICE_CONTROL
[224210 ms] UsbSnoop - MyDispatchInternalIOCTL(f890fe80) : fdo=81c63810, Irp=81d098c8, IRQL=2
[224210 ms]  >>>  URB 585 going down  >>> 
-- URB_FUNCTION_BULK_OR_INTERRUPT_TRANSFER:
  PipeHandle           = 81c9d144 [endpoint 0x00000081]
  TransferFlags        = 00000003 (USBD_TRANSFER_DIRECTION_IN, USBD_SHORT_TRANSFER_OK)
  TransferBufferLength = 00000100
  TransferBuffer       = 00000000
  TransferBufferMDL    = 81cf5428
  UrbLink              = 00000000
[224222 ms] UsbSnoop - MyInternalIOCTLCompletion(f890fdb0) : fido=822da020, Irp=81d098c8, Context=822de5c8, IRQL=2
[224222 ms]  <<<  URB 585 coming back  <<< 
-- URB_FUNCTION_BULK_OR_INTERRUPT_TRANSFER:
  PipeHandle           = 81c9d144 [endpoint 0x00000081]
  TransferFlags        = 00000003 (USBD_TRANSFER_DIRECTION_IN, USBD_SHORT_TRANSFER_OK)
  TransferBufferLength = 00000009
  TransferBuffer       = 00000000
  TransferBufferMDL    = 81cf5428
    00000000: 00 00 00 04 02 00 00 00 fa
  UrbLink              = 00000000
[224251 ms] UsbSnoop - DispatchAny(f890e610) : IRP_MJ_INTERNAL_DEVICE_CONTROL
[224251 ms] UsbSnoop - MyDispatchInternalIOCTL(f890fe80) : fdo=81c63810, Irp=81d098c8, IRQL=2
[224251 ms]  >>>  URB 586 going down  >>> 
-- URB_FUNCTION_BULK_OR_INTERRUPT_TRANSFER:
  PipeHandle           = 81c9d164 [endpoint 0x00000002]
  TransferFlags        = 00000000 (USBD_TRANSFER_DIRECTION_OUT, ~USBD_SHORT_TRANSFER_OK)
  TransferBufferLength = 00000015
  TransferBuffer       = 00000000
  TransferBufferMDL    = 81cf5428
    00000000: 00 00 00 10 04 00 00 00 0a 00 01 00 03 00 01 00
    00000010: 00 00 00 07 d0
  UrbLink              = 00000000
[224251 ms] UsbSnoop - MyInternalIOCTLCompletion(f890fdb0) : fido=822da020, Irp=81d098c8, Context=81c9a480, IRQL=2
[224251 ms]  <<<  URB 586 coming back  <<< 
-- URB_FUNCTION_BULK_OR_INTERRUPT_TRANSFER:
  PipeHandle           = 81c9d164 [endpoint 0x00000002]
  TransferFlags        = 00000000 (USBD_TRANSFER_DIRECTION_OUT, ~USBD_SHORT_TRANSFER_OK)
  TransferBufferLength = 00000015
  TransferBuffer       = 00000000
  TransferBufferMDL    = 81cf5428
  UrbLink              = 00000000
[224259 ms] UsbSnoop - DispatchAny(f890e610) : IRP_MJ_INTERNAL_DEVICE_CONTROL
[224259 ms] UsbSnoop - MyDispatchInternalIOCTL(f890fe80) : fdo=81c63810, Irp=81d098c8, IRQL=2
[224259 ms]  >>>  URB 587 going down  >>> 
-- URB_FUNCTION_BULK_OR_INTERRUPT_TRANSFER:
  PipeHandle           = 81c9d144 [endpoint 0x00000081]
  TransferFlags        = 00000003 (USBD_TRANSFER_DIRECTION_IN, USBD_SHORT_TRANSFER_OK)
  TransferBufferLength = 00000100
  TransferBuffer       = 00000000
  TransferBufferMDL    = 81cf5428
  UrbLink              = 00000000
[224260 ms] UsbSnoop - MyInternalIOCTLCompletion(f890fdb0) : fido=822da020, Irp=81d098c8, Context=822de5c8, IRQL=2
[224260 ms]  <<<  URB 587 coming back  <<< 
-- URB_FUNCTION_BULK_OR_INTERRUPT_TRANSFER:
  PipeHandle           = 81c9d144 [endpoint 0x00000081]
  TransferFlags        = 00000003 (USBD_TRANSFER_DIRECTION_IN, USBD_SHORT_TRANSFER_OK)
  TransferBufferLength = 00000007
  TransferBuffer       = 00000000
  TransferBufferMDL    = 81cf5428
    00000000: 00 00 00 02 05 e0 00
  UrbLink              = 00000000
[224300 ms] UsbSnoop - DispatchAny(f890e610) : IRP_MJ_INTERNAL_DEVICE_CONTROL
[224300 ms] UsbSnoop - MyDispatchInternalIOCTL(f890fe80) : fdo=81c63810, Irp=81d098c8, IRQL=2
[224300 ms]  >>>  URB 588 going down  >>> 
-- URB_FUNCTION_BULK_OR_INTERRUPT_TRANSFER:
  PipeHandle           = 81c9d144 [endpoint 0x00000081]
  TransferFlags        = 00000003 (USBD_TRANSFER_DIRECTION_IN, USBD_SHORT_TRANSFER_OK)
  TransferBufferLength = 00000100
  TransferBuffer       = 00000000
  TransferBufferMDL    = 81cf5428
  UrbLink              = 00000000
[224300 ms] UsbSnoop - MyInternalIOCTLCompletion(f890fdb0) : fido=822da020, Irp=81d098c8, Context=81b3c2e0, IRQL=2
[224300 ms]  <<<  URB 588 coming back  <<< 
-- URB_FUNCTION_BULK_OR_INTERRUPT_TRANSFER:
  PipeHandle           = 81c9d144 [endpoint 0x00000081]
  TransferFlags        = 00000003 (USBD_TRANSFER_DIRECTION_IN, USBD_SHORT_TRANSFER_OK)
  TransferBufferLength = 0000000f
  TransferBuffer       = 00000000
  TransferBufferMDL    = 81cf5428
    00000000: 00 00 00 0a 04 00 00 00 04 00 12 00 00 07 d0
  UrbLink              = 00000000
[224340 ms] UsbSnoop - DispatchAny(f890e610) : IRP_MJ_INTERNAL_DEVICE_CONTROL
[224340 ms] UsbSnoop - MyDispatchInternalIOCTL(f890fe80) : fdo=81c63810, Irp=81d098c8, IRQL=2
[224340 ms]  >>>  URB 589 going down  >>> 
-- URB_FUNCTION_BULK_OR_INTERRUPT_TRANSFER:
  PipeHandle           = 81c9d164 [endpoint 0x00000002]
  TransferFlags        = 00000000 (USBD_TRANSFER_DIRECTION_OUT, ~USBD_SHORT_TRANSFER_OK)
  TransferBufferLength = 00000007
  TransferBuffer       = 00000000
  TransferBufferMDL    = 81cf5428
    00000000: 00 00 00 02 05 e0 00
  UrbLink              = 00000000
[224340 ms] UsbSnoop - MyInternalIOCTLCompletion(f890fdb0) : fido=822da020, Irp=81d098c8, Context=81b51c08, IRQL=2
[224340 ms]  <<<  URB 589 coming back  <<< 
-- URB_FUNCTION_BULK_OR_INTERRUPT_TRANSFER:
  PipeHandle           = 81c9d164 [endpoint 0x00000002]
  TransferFlags        = 00000000 (USBD_TRANSFER_DIRECTION_OUT, ~USBD_SHORT_TRANSFER_OK)
  TransferBufferLength = 00000007
  TransferBuffer       = 00000000
  TransferBufferMDL    = 81cf5428
  UrbLink              = 00000000
[224350 ms] UsbSnoop - DispatchAny(f890e610) : IRP_MJ_INTERNAL_DEVICE_CONTROL
[224350 ms] UsbSnoop - MyDispatchInternalIOCTL(f890fe80) : fdo=81c63810, Irp=81d098c8, IRQL=2
[224350 ms]  >>>  URB 590 going down  >>> 
-- URB_FUNCTION_BULK_OR_INTERRUPT_TRANSFER:
  PipeHandle           = 81c9d164 [endpoint 0x00000002]
  TransferFlags        = 00000000 (USBD_TRANSFER_DIRECTION_OUT, ~USBD_SHORT_TRANSFER_OK)
  TransferBufferLength = 0000000f
  TransferBuffer       = 00000000
  TransferBufferMDL    = 81cf5428
    00000000: 00 00 00 0a 04 00 00 00 04 00 07 00 01 00 0e
  UrbLink              = 00000000
[224350 ms] UsbSnoop - MyInternalIOCTLCompletion(f890fdb0) : fido=822da020, Irp=81d098c8, Context=822de5c8, IRQL=2
[224350 ms]  <<<  URB 590 coming back  <<< 
-- URB_FUNCTION_BULK_OR_INTERRUPT_TRANSFER:
  PipeHandle           = 81c9d164 [endpoint 0x00000002]
  TransferFlags        = 00000000 (USBD_TRANSFER_DIRECTION_OUT, ~USBD_SHORT_TRANSFER_OK)
  TransferBufferLength = 0000000f
  TransferBuffer       = 00000000
  TransferBufferMDL    = 81cf5428
  UrbLink              = 00000000
[224360 ms] UsbSnoop - DispatchAny(f890e610) : IRP_MJ_INTERNAL_DEVICE_CONTROL
[224360 ms] UsbSnoop - MyDispatchInternalIOCTL(f890fe80) : fdo=81c63810, Irp=81d098c8, IRQL=2
[224360 ms]  >>>  URB 591 going down  >>> 
-- URB_FUNCTION_BULK_OR_INTERRUPT_TRANSFER:
  PipeHandle           = 81c9d144 [endpoint 0x00000081]
  TransferFlags        = 00000003 (USBD_TRANSFER_DIRECTION_IN, USBD_SHORT_TRANSFER_OK)
  TransferBufferLength = 00000100
  TransferBuffer       = 00000000
  TransferBufferMDL    = 81cf5428
  UrbLink              = 00000000
[224361 ms] UsbSnoop - MyInternalIOCTLCompletion(f890fdb0) : fido=822da020, Irp=81d098c8, Context=81c88a38, IRQL=2
[224361 ms]  <<<  URB 591 coming back  <<< 
-- URB_FUNCTION_BULK_OR_INTERRUPT_TRANSFER:
  PipeHandle           = 81c9d144 [endpoint 0x00000081]
  TransferFlags        = 00000003 (USBD_TRANSFER_DIRECTION_IN, USBD_SHORT_TRANSFER_OK)
  TransferBufferLength = 00000007
  TransferBuffer       = 00000000
  TransferBufferMDL    = 81cf5428
    00000000: 00 00 00 02 05 e0 00
  UrbLink              = 00000000
[224400 ms] UsbSnoop - DispatchAny(f890e610) : IRP_MJ_INTERNAL_DEVICE_CONTROL
[224400 ms] UsbSnoop - MyDispatchInternalIOCTL(f890fe80) : fdo=81c63810, Irp=822e9640, IRQL=2
[224400 ms]  >>>  URB 592 going down  >>> 
-- URB_FUNCTION_BULK_OR_INTERRUPT_TRANSFER:
  PipeHandle           = 81c9d144 [endpoint 0x00000081]
  TransferFlags        = 00000003 (USBD_TRANSFER_DIRECTION_IN, USBD_SHORT_TRANSFER_OK)
  TransferBufferLength = 00000100
  TransferBuffer       = 00000000
  TransferBufferMDL    = 81cf5428
  UrbLink              = 00000000
[224400 ms] UsbSnoop - MyInternalIOCTLCompletion(f890fdb0) : fido=822da020, Irp=822e9640, Context=81b51c08, IRQL=2
[224400 ms]  <<<  URB 592 coming back  <<< 
-- URB_FUNCTION_BULK_OR_INTERRUPT_TRANSFER:
  PipeHandle           = 81c9d144 [endpoint 0x00000081]
  TransferFlags        = 00000003 (USBD_TRANSFER_DIRECTION_IN, USBD_SHORT_TRANSFER_OK)
  TransferBufferLength = 0000000f
  TransferBuffer       = 00000000
  TransferBufferMDL    = 81cf5428
    00000000: 00 00 00 0a 04 00 00 00 04 bb 00 00 01 d4 c0
  UrbLink              = 00000000
[224440 ms] UsbSnoop - DispatchAny(f890e610) : IRP_MJ_INTERNAL_DEVICE_CONTROL
[224440 ms] UsbSnoop - MyDispatchInternalIOCTL(f890fe80) : fdo=81c63810, Irp=822e9640, IRQL=2
[224440 ms]  >>>  URB 593 going down  >>> 
-- URB_FUNCTION_BULK_OR_INTERRUPT_TRANSFER:
  PipeHandle           = 81c9d164 [endpoint 0x00000002]
  TransferFlags        = 00000000 (USBD_TRANSFER_DIRECTION_OUT, ~USBD_SHORT_TRANSFER_OK)
  TransferBufferLength = 00000007
  TransferBuffer       = 00000000
  TransferBufferMDL    = 81cf5428
    00000000: 00 00 00 02 05 e0 00
  UrbLink              = 00000000
[224440 ms] UsbSnoop - MyInternalIOCTLCompletion(f890fdb0) : fido=822da020, Irp=822e9640, Context=81c88a38, IRQL=2
[224440 ms]  <<<  URB 593 coming back  <<< 
-- URB_FUNCTION_BULK_OR_INTERRUPT_TRANSFER:
  PipeHandle           = 81c9d164 [endpoint 0x00000002]
  TransferFlags        = 00000000 (USBD_TRANSFER_DIRECTION_OUT, ~USBD_SHORT_TRANSFER_OK)
  TransferBufferLength = 00000007
  TransferBuffer       = 00000000
  TransferBufferMDL    = 81cf5428
  UrbLink              = 00000000
[224450 ms] UsbSnoop - DispatchAny(f890e610) : IRP_MJ_INTERNAL_DEVICE_CONTROL
[224450 ms] UsbSnoop - MyDispatchInternalIOCTL(f890fe80) : fdo=81c63810, Irp=822e9640, IRQL=2
[224450 ms]  >>>  URB 594 going down  >>> 
-- URB_FUNCTION_BULK_OR_INTERRUPT_TRANSFER:
  PipeHandle           = 81c9d144 [endpoint 0x00000081]
  TransferFlags        = 00000003 (USBD_TRANSFER_DIRECTION_IN, USBD_SHORT_TRANSFER_OK)
  TransferBufferLength = 00000100
  TransferBuffer       = 00000000
  TransferBufferMDL    = 81cf5428
  UrbLink              = 00000000
[224450 ms] UsbSnoop - MyInternalIOCTLCompletion(f890fdb0) : fido=822da020, Irp=822e9640, Context=81b87c90, IRQL=2
[224450 ms]  <<<  URB 594 coming back  <<< 
-- URB_FUNCTION_BULK_OR_INTERRUPT_TRANSFER:
  PipeHandle           = 81c9d144 [endpoint 0x00000081]
  TransferFlags        = 00000003 (USBD_TRANSFER_DIRECTION_IN, USBD_SHORT_TRANSFER_OK)
  TransferBufferLength = 0000001a
  TransferBuffer       = 00000000
  TransferBufferMDL    = 81cf5428
    00000000: 00 00 00 15 04 00 00 00 0f 00 08 00 01 00 0e 00
    00000010: 00 08 00 00 00 00 00 00 5e d0
  UrbLink              = 00000000
[224490 ms] UsbSnoop - DispatchAny(f890e610) : IRP_MJ_INTERNAL_DEVICE_CONTROL
[224490 ms] UsbSnoop - MyDispatchInternalIOCTL(f890fe80) : fdo=81c63810, Irp=822e9640, IRQL=2
[224490 ms]  >>>  URB 595 going down  >>> 
-- URB_FUNCTION_BULK_OR_INTERRUPT_TRANSFER:
  PipeHandle           = 81c9d164 [endpoint 0x00000002]
  TransferFlags        = 00000000 (USBD_TRANSFER_DIRECTION_OUT, ~USBD_SHORT_TRANSFER_OK)
  TransferBufferLength = 00000007
  TransferBuffer       = 00000000
  TransferBufferMDL    = 81cf5428
    00000000: 00 00 00 02 05 e0 00
  UrbLink              = 00000000
[224490 ms] UsbSnoop - MyInternalIOCTLCompletion(f890fdb0) : fido=822da020, Irp=822e9640, Context=81b51c08, IRQL=2
[224490 ms]  <<<  URB 595 coming back  <<< 
-- URB_FUNCTION_BULK_OR_INTERRUPT_TRANSFER:
  PipeHandle           = 81c9d164 [endpoint 0x00000002]
  TransferFlags        = 00000000 (USBD_TRANSFER_DIRECTION_OUT, ~USBD_SHORT_TRANSFER_OK)
  TransferBufferLength = 00000007
  TransferBuffer       = 00000000
  TransferBufferMDL    = 81cf5428
  UrbLink              = 00000000
[224506 ms] UsbSnoop - DispatchAny(f890e610) : IRP_MJ_INTERNAL_DEVICE_CONTROL
[224506 ms] UsbSnoop - MyDispatchInternalIOCTL(f890fe80) : fdo=81c63810, Irp=81b59008, IRQL=0
[224506 ms]  >>>  URB 596 going down  >>> 
-- URB_FUNCTION_RESET_PIPE:
  PipeHandle = 81c9d144 [endpoint 0x00000081]
[224559 ms] UsbSnoop - MyInternalIOCTLCompletion(f890fdb0) : fido=00000000, Irp=81b59008, Context=81b87c90, IRQL=0
[224559 ms]  <<<  URB 596 coming back  <<< 
-- URB_FUNCTION_RESET_PIPE:
[224559 ms] UsbSnoop - DispatchAny(f890e610) : IRP_MJ_INTERNAL_DEVICE_CONTROL
[224559 ms] UsbSnoop - MyDispatchInternalIOCTL(f890fe80) : fdo=81c63810, Irp=81b59008, IRQL=0
[224559 ms]  >>>  URB 597 going down  >>> 
-- URB_FUNCTION_RESET_PIPE:
  PipeHandle = 81c9d164 [endpoint 0x00000002]
[224560 ms] UsbSnoop - MyInternalIOCTLCompletion(f890fdb0) : fido=00000000, Irp=81b59008, Context=81b51c08, IRQL=0
[224560 ms]  <<<  URB 597 coming back  <<< 
-- URB_FUNCTION_RESET_PIPE:
[224560 ms] UsbSnoop - DispatchAny(f890e610) : IRP_MJ_INTERNAL_DEVICE_CONTROL
[224560 ms] UsbSnoop - MyDispatchInternalIOCTL(f890fe80) : fdo=81c63810, Irp=81b59008, IRQL=0
