[107804 ms] UsbSnoop - DispatchAny(f890e610) : IRP_MJ_INTERNAL_DEVICE_CONTROL
[107804 ms] UsbSnoop - MyDispatchInternalIOCTL(f890fe80) : fdo=81c63810, Irp=81b04c88, IRQL=0
[107804 ms]  >>>  URB 268 going down  >>> 
-- URB_FUNCTION_RESET_PIPE:
  PipeHandle = 81c9d144 [endpoint 0x00000081]
[107809 ms] UsbSnoop - MyInternalIOCTLCompletion(f890fdb0) : fido=00000000, Irp=81b04c88, Context=8218afe8, IRQL=0
[107809 ms]  <<<  URB 268 coming back  <<< 
-- URB_FUNCTION_RESET_PIPE:
[107809 ms] UsbSnoop - DispatchAny(f890e610) : IRP_MJ_INTERNAL_DEVICE_CONTROL
[107809 ms] UsbSnoop - MyDispatchInternalIOCTL(f890fe80) : fdo=81c63810, Irp=81b04c88, IRQL=0
[107809 ms]  >>>  URB 269 going down  >>> 
-- URB_FUNCTION_RESET_PIPE:
  PipeHandle = 81c9d164 [endpoint 0x00000002]
[107809 ms] UsbSnoop - MyInternalIOCTLCompletion(f890fdb0) : fido=00000000, Irp=81b04c88, Context=81bb6320, IRQL=0
[107809 ms]  <<<  URB 269 coming back  <<< 
-- URB_FUNCTION_RESET_PIPE:
[108806 ms] UsbSnoop - DispatchAny(f890e610) : IRP_MJ_INTERNAL_DEVICE_CONTROL
[108806 ms] UsbSnoop - MyDispatchInternalIOCTL(f890fe80) : fdo=81c63810, Irp=81b04c88, IRQL=0
[108806 ms]  >>>  URB 270 going down  >>> 
-- URB_FUNCTION_RESET_PIPE:
  PipeHandle = 81c9d144 [endpoint 0x00000081]
[108811 ms] UsbSnoop - MyInternalIOCTLCompletion(f890fdb0) : fido=00000000, Irp=81b04c88, Context=81bb6320, IRQL=0
[108811 ms]  <<<  URB 270 coming back  <<< 
-- URB_FUNCTION_RESET_PIPE:
[108811 ms] UsbSnoop - DispatchAny(f890e610) : IRP_MJ_INTERNAL_DEVICE_CONTROL
[108811 ms] UsbSnoop - MyDispatchInternalIOCTL(f890fe80) : fdo=81c63810, Irp=81b04c88, IRQL=0
[108811 ms]  >>>  URB 271 going down  >>> 
-- URB_FUNCTION_RESET_PIPE:
  PipeHandle = 81c9d164 [endpoint 0x00000002]
[108812 ms] UsbSnoop - MyInternalIOCTLCompletion(f890fdb0) : fido=00000000, Irp=81b04c88, Context=81ba5340, IRQL=0
[108812 ms]  <<<  URB 271 coming back  <<< 
-- URB_FUNCTION_RESET_PIPE:
[108812 ms] UsbSnoop - DispatchAny(f890e610) : IRP_MJ_INTERNAL_DEVICE_CONTROL
[108812 ms] UsbSnoop - MyDispatchInternalIOCTL(f890fe80) : fdo=81c63810, Irp=81b04c88, IRQL=0
[109808 ms] UsbSnoop - DispatchAny(f890e610) : IRP_MJ_INTERNAL_DEVICE_CONTROL
[109808 ms] UsbSnoop - MyDispatchInternalIOCTL(f890fe80) : fdo=81c63810, Irp=81b04c88, IRQL=0
[109808 ms]  >>>  URB 272 going down  >>> 
-- URB_FUNCTION_GET_DESCRIPTOR_FROM_DEVICE:
  TransferBufferLength = 00000012
  TransferBuffer       = e1614550
  TransferBufferMDL    = 00000000
  Index                = 00000000
  DescriptorType       = 00000001 (USB_DEVICE_DESCRIPTOR_TYPE)
  LanguageId           = 00000000
[109814 ms] UsbSnoop - MyInternalIOCTLCompletion(f890fdb0) : fido=00000000, Irp=81b04c88, Context=81b34b68, IRQL=2
[109814 ms]  <<<  URB 272 coming back  <<< 
-- URB_FUNCTION_CONTROL_TRANSFER:
  PipeHandle           = 81c9d880
  TransferFlags        = 81b04c0b (USBD_TRANSFER_DIRECTION_IN, USBD_SHORT_TRANSFER_OK)
  TransferBufferLength = 00000012
  TransferBuffer       = e1614550
  TransferBufferMDL    = 81d03558
    00000000: 12 01 00 02 00 00 00 40 51 04 08 e0 10 01 01 02
    00000010: 00 01
  UrbLink              = 00000000
  SetupPacket          =
    00000000: 80 06 00 01 00 00 12 00
[109814 ms] UsbSnoop - DispatchAny(f890e610) : IRP_MJ_INTERNAL_DEVICE_CONTROL
[109814 ms] UsbSnoop - MyDispatchInternalIOCTL(f890fe80) : fdo=81c63810, Irp=81b04c88, IRQL=0
[109814 ms] UsbSnoop - DispatchAny(f890e610) : IRP_MJ_INTERNAL_DEVICE_CONTROL
[109814 ms] UsbSnoop - MyDispatchInternalIOCTL(f890fe80) : fdo=81c63810, Irp=81b04c88, IRQL=0
[109814 ms]  >>>  URB 273 going down  >>> 
-- URB_FUNCTION_RESET_PIPE:
  PipeHandle = 81c9d144 [endpoint 0x00000081]
[109823 ms] UsbSnoop - MyInternalIOCTLCompletion(f890fdb0) : fido=00000000, Irp=81b04c88, Context=8218afe8, IRQL=0
[109823 ms]  <<<  URB 273 coming back  <<< 
-- URB_FUNCTION_RESET_PIPE:
[109823 ms] UsbSnoop - DispatchAny(f890e610) : IRP_MJ_INTERNAL_DEVICE_CONTROL
[109823 ms] UsbSnoop - MyDispatchInternalIOCTL(f890fe80) : fdo=81c63810, Irp=81b04c88, IRQL=0
[109823 ms]  >>>  URB 274 going down  >>> 
-- URB_FUNCTION_RESET_PIPE:
  PipeHandle = 81c9d164 [endpoint 0x00000002]
[109823 ms] UsbSnoop - MyInternalIOCTLCompletion(f890fdb0) : fido=00000000, Irp=81b04c88, Context=81bb6320, IRQL=0
[109823 ms]  <<<  URB 274 coming back  <<< 
-- URB_FUNCTION_RESET_PIPE:
[111079 ms] UsbSnoop - DispatchAny(f890e610) : IRP_MJ_INTERNAL_DEVICE_CONTROL
[111079 ms] UsbSnoop - MyDispatchInternalIOCTL(f890fe80) : fdo=81c63810, Irp=822f7008, IRQL=2
[111079 ms]  >>>  URB 275 going down  >>> 
-- URB_FUNCTION_BULK_OR_INTERRUPT_TRANSFER:
  PipeHandle           = 81c9d164 [endpoint 0x00000002]
  TransferFlags        = 00000000 (USBD_TRANSFER_DIRECTION_OUT, ~USBD_SHORT_TRANSFER_OK)
  TransferBufferLength = 00000009
  TransferBuffer       = 00000000
  TransferBufferMDL    = 81d03558
    00000000: 00 00 00 04 01 00 00 04 00
  UrbLink              = 00000000
[111080 ms] UsbSnoop - MyInternalIOCTLCompletion(f890fdb0) : fido=822da020, Irp=822f7008, Context=81bb6320, IRQL=2
[111080 ms]  <<<  URB 275 coming back  <<< 
-- URB_FUNCTION_BULK_OR_INTERRUPT_TRANSFER:
  PipeHandle           = 81c9d164 [endpoint 0x00000002]
  TransferFlags        = 00000000 (USBD_TRANSFER_DIRECTION_OUT, ~USBD_SHORT_TRANSFER_OK)
  TransferBufferLength = 00000009
  TransferBuffer       = 00000000
  TransferBufferMDL    = 81d03558
  UrbLink              = 00000000
[111080 ms] UsbSnoop - DispatchAny(f890e610) : IRP_MJ_INTERNAL_DEVICE_CONTROL
[111080 ms] UsbSnoop - MyDispatchInternalIOCTL(f890fe80) : fdo=81c63810, Irp=822f7008, IRQL=2
[111081 ms]  >>>  URB 276 going down  >>> 
-- URB_FUNCTION_BULK_OR_INTERRUPT_TRANSFER:
  PipeHandle           = 81c9d144 [endpoint 0x00000081]
  TransferFlags        = 00000003 (USBD_TRANSFER_DIRECTION_IN, USBD_SHORT_TRANSFER_OK)
  TransferBufferLength = 00000100
  TransferBuffer       = 00000000
  TransferBufferMDL    = 81d03558
  UrbLink              = 00000000
[111089 ms] UsbSnoop - MyInternalIOCTLCompletion(f890fdb0) : fido=822da020, Irp=822f7008, Context=8218afe8, IRQL=2
[111089 ms]  <<<  URB 276 coming back  <<< 
-- URB_FUNCTION_BULK_OR_INTERRUPT_TRANSFER:
  PipeHandle           = 81c9d144 [endpoint 0x00000081]
  TransferFlags        = 00000003 (USBD_TRANSFER_DIRECTION_IN, USBD_SHORT_TRANSFER_OK)
  TransferBufferLength = 00000009
  TransferBuffer       = 00000000
  TransferBufferMDL    = 81d03558
    00000000: 00 00 00 04 02 00 00 00 fa
  UrbLink              = 00000000
[111109 ms] UsbSnoop - DispatchAny(f890e610) : IRP_MJ_INTERNAL_DEVICE_CONTROL
[111109 ms] UsbSnoop - MyDispatchInternalIOCTL(f890fe80) : fdo=81c63810, Irp=822f7008, IRQL=2
[111109 ms]  >>>  URB 277 going down  >>> 
-- URB_FUNCTION_BULK_OR_INTERRUPT_TRANSFER:
  PipeHandle           = 81c9d164 [endpoint 0x00000002]
  TransferFlags        = 00000000 (USBD_TRANSFER_DIRECTION_OUT, ~USBD_SHORT_TRANSFER_OK)
  TransferBufferLength = 00000015
  TransferBuffer       = 00000000
  TransferBufferMDL    = 81d03558
    00000000: 00 00 00 10 04 00 00 00 0a 00 01 00 03 00 01 00
    00000010: 00 00 00 07 d0
  UrbLink              = 00000000
[111110 ms] UsbSnoop - MyInternalIOCTLCompletion(f890fdb0) : fido=822da020, Irp=822f7008, Context=81ba5340, IRQL=2
[111110 ms]  <<<  URB 277 coming back  <<< 
-- URB_FUNCTION_BULK_OR_INTERRUPT_TRANSFER:
  PipeHandle           = 81c9d164 [endpoint 0x00000002]
  TransferFlags        = 00000000 (USBD_TRANSFER_DIRECTION_OUT, ~USBD_SHORT_TRANSFER_OK)
  TransferBufferLength = 00000015
  TransferBuffer       = 00000000
  TransferBufferMDL    = 81d03558
  UrbLink              = 00000000
[111119 ms] UsbSnoop - DispatchAny(f890e610) : IRP_MJ_INTERNAL_DEVICE_CONTROL
[111119 ms] UsbSnoop - MyDispatchInternalIOCTL(f890fe80) : fdo=81c63810, Irp=822f7008, IRQL=2
[111119 ms]  >>>  URB 278 going down  >>> 
-- URB_FUNCTION_BULK_OR_INTERRUPT_TRANSFER:
  PipeHandle           = 81c9d144 [endpoint 0x00000081]
  TransferFlags        = 00000003 (USBD_TRANSFER_DIRECTION_IN, USBD_SHORT_TRANSFER_OK)
  TransferBufferLength = 00000100
  TransferBuffer       = 00000000
  TransferBufferMDL    = 81d03558
  UrbLink              = 00000000
[111120 ms] UsbSnoop - MyInternalIOCTLCompletion(f890fdb0) : fido=822da020, Irp=822f7008, Context=81c9a480, IRQL=2
[111120 ms]  <<<  URB 278 coming back  <<< 
-- URB_FUNCTION_BULK_OR_INTERRUPT_TRANSFER:
  PipeHandle           = 81c9d144 [endpoint 0x00000081]
  TransferFlags        = 00000003 (USBD_TRANSFER_DIRECTION_IN, USBD_SHORT_TRANSFER_OK)
  TransferBufferLength = 00000007
  TransferBuffer       = 00000000
  TransferBufferMDL    = 81d03558
    00000000: 00 00 00 02 05 e0 00
  UrbLink              = 00000000
[111160 ms] UsbSnoop - DispatchAny(f890e610) : IRP_MJ_INTERNAL_DEVICE_CONTROL
[111160 ms] UsbSnoop - MyDispatchInternalIOCTL(f890fe80) : fdo=81c63810, Irp=81b04c88, IRQL=2
[111160 ms]  >>>  URB 279 going down  >>> 
-- URB_FUNCTION_BULK_OR_INTERRUPT_TRANSFER:
  PipeHandle           = 81c9d144 [endpoint 0x00000081]
  TransferFlags        = 00000003 (USBD_TRANSFER_DIRECTION_IN, USBD_SHORT_TRANSFER_OK)
  TransferBufferLength = 00000100
  TransferBuffer       = 00000000
  TransferBufferMDL    = 81cf5428
  UrbLink              = 00000000
[111160 ms] UsbSnoop - MyInternalIOCTLCompletion(f890fdb0) : fido=822da020, Irp=81b04c88, Context=81b34b68, IRQL=2
[111160 ms]  <<<  URB 279 coming back  <<< 
-- URB_FUNCTION_BULK_OR_INTERRUPT_TRANSFER:
  PipeHandle           = 81c9d144 [endpoint 0x00000081]
  TransferFlags        = 00000003 (USBD_TRANSFER_DIRECTION_IN, USBD_SHORT_TRANSFER_OK)
  TransferBufferLength = 0000000f
  TransferBuffer       = 00000000
  TransferBufferMDL    = 81cf5428
    00000000: 00 00 00 0a 04 00 00 00 04 00 12 00 00 07 d0
  UrbLink              = 00000000
[111200 ms] UsbSnoop - DispatchAny(f890e610) : IRP_MJ_INTERNAL_DEVICE_CONTROL
[111200 ms] UsbSnoop - MyDispatchInternalIOCTL(f890fe80) : fdo=81c63810, Irp=822f4950, IRQL=2
[111200 ms]  >>>  URB 280 going down  >>> 
-- URB_FUNCTION_BULK_OR_INTERRUPT_TRANSFER:
  PipeHandle           = 81c9d164 [endpoint 0x00000002]
  TransferFlags        = 00000000 (USBD_TRANSFER_DIRECTION_OUT, ~USBD_SHORT_TRANSFER_OK)
  TransferBufferLength = 00000007
  TransferBuffer       = 00000000
  TransferBufferMDL    = 81d03558
    00000000: 00 00 00 02 05 e0 00
  UrbLink              = 00000000
[111200 ms] UsbSnoop - MyInternalIOCTLCompletion(f890fdb0) : fido=822da020, Irp=822f4950, Context=8218afe8, IRQL=2
[111200 ms]  <<<  URB 280 coming back  <<< 
-- URB_FUNCTION_BULK_OR_INTERRUPT_TRANSFER:
  PipeHandle           = 81c9d164 [endpoint 0x00000002]
  TransferFlags        = 00000000 (USBD_TRANSFER_DIRECTION_OUT, ~USBD_SHORT_TRANSFER_OK)
  TransferBufferLength = 00000007
  TransferBuffer       = 00000000
  TransferBufferMDL    = 81d03558
  UrbLink              = 00000000
[111210 ms] UsbSnoop - DispatchAny(f890e610) : IRP_MJ_INTERNAL_DEVICE_CONTROL
[111210 ms] UsbSnoop - MyDispatchInternalIOCTL(f890fe80) : fdo=81c63810, Irp=822f4950, IRQL=2
[111210 ms]  >>>  URB 281 going down  >>> 
-- URB_FUNCTION_BULK_OR_INTERRUPT_TRANSFER:
  PipeHandle           = 81c9d164 [endpoint 0x00000002]
  TransferFlags        = 00000000 (USBD_TRANSFER_DIRECTION_OUT, ~USBD_SHORT_TRANSFER_OK)
  TransferBufferLength = 00000022
  TransferBuffer       = 00000000
  TransferBufferMDL    = 81d03558
    00000000: 00 00 00 1d 04 00 00 00 17 00 09 00 00 00 06 00
    00000010: 02 00 03 00 05 00 01 00 41 00 42 00 01 00 01 00
    00000020: 01 01
  UrbLink              = 00000000
[111210 ms] UsbSnoop - MyInternalIOCTLCompletion(f890fdb0) : fido=822da020, Irp=822f4950, Context=81bb6320, IRQL=2
[111210 ms]  <<<  URB 281 coming back  <<< 
-- URB_FUNCTION_BULK_OR_INTERRUPT_TRANSFER:
  PipeHandle           = 81c9d164 [endpoint 0x00000002]
  TransferFlags        = 00000000 (USBD_TRANSFER_DIRECTION_OUT, ~USBD_SHORT_TRANSFER_OK)
  TransferBufferLength = 00000022
  TransferBuffer       = 00000000
  TransferBufferMDL    = 81d03558
  UrbLink              = 00000000
[111220 ms] UsbSnoop - DispatchAny(f890e610) : IRP_MJ_INTERNAL_DEVICE_CONTROL
[111220 ms] UsbSnoop - MyDispatchInternalIOCTL(f890fe80) : fdo=81c63810, Irp=822f4950, IRQL=2
[111220 ms]  >>>  URB 282 going down  >>> 
-- URB_FUNCTION_BULK_OR_INTERRUPT_TRANSFER:
  PipeHandle           = 81c9d144 [endpoint 0x00000081]
  TransferFlags        = 00000003 (USBD_TRANSFER_DIRECTION_IN, USBD_SHORT_TRANSFER_OK)
  TransferBufferLength = 00000100
  TransferBuffer       = 00000000
  TransferBufferMDL    = 81d03558
  UrbLink              = 00000000
[111221 ms] UsbSnoop - MyInternalIOCTLCompletion(f890fdb0) : fido=822da020, Irp=822f4950, Context=81bc6e50, IRQL=2
[111221 ms]  <<<  URB 282 coming back  <<< 
-- URB_FUNCTION_BULK_OR_INTERRUPT_TRANSFER:
  PipeHandle           = 81c9d144 [endpoint 0x00000081]
  TransferFlags        = 00000003 (USBD_TRANSFER_DIRECTION_IN, USBD_SHORT_TRANSFER_OK)
  TransferBufferLength = 00000007
  TransferBuffer       = 00000000
  TransferBufferMDL    = 81d03558
    00000000: 00 00 00 02 05 e0 00
  UrbLink              = 00000000
[111260 ms] UsbSnoop - DispatchAny(f890e610) : IRP_MJ_INTERNAL_DEVICE_CONTROL
[111260 ms] UsbSnoop - MyDispatchInternalIOCTL(f890fe80) : fdo=81c63810, Irp=81b04c88, IRQL=2
[111260 ms]  >>>  URB 283 going down  >>> 
-- URB_FUNCTION_BULK_OR_INTERRUPT_TRANSFER:
  PipeHandle           = 81c9d144 [endpoint 0x00000081]
  TransferFlags        = 00000003 (USBD_TRANSFER_DIRECTION_IN, USBD_SHORT_TRANSFER_OK)
  TransferBufferLength = 00000100
  TransferBuffer       = 00000000
  TransferBufferMDL    = 81d03558
  UrbLink              = 00000000
[111260 ms] UsbSnoop - MyInternalIOCTLCompletion(f890fdb0) : fido=822da020, Irp=81b04c88, Context=8218afe8, IRQL=2
[111260 ms]  <<<  URB 283 coming back  <<< 
-- URB_FUNCTION_BULK_OR_INTERRUPT_TRANSFER:
  PipeHandle           = 81c9d144 [endpoint 0x00000081]
  TransferFlags        = 00000003 (USBD_TRANSFER_DIRECTION_IN, USBD_SHORT_TRANSFER_OK)
  TransferBufferLength = 00000032
  TransferBuffer       = 00000000
  TransferBufferMDL    = 81d03558
    00000000: 00 00 00 2d 04 00 00 00 27 00 0a 00 01 43 00 00
    00000010: 06 00 02 00 00 04 f0 07 00 00 00 03 00 00 01 01
    00000020: 00 05 01 00 01 00 00 04 00 00 00 09 00 41 01 00
    00000030: 42 01
  UrbLink              = 00000000
[111300 ms] UsbSnoop - DispatchAny(f890e610) : IRP_MJ_INTERNAL_DEVICE_CONTROL
[111300 ms] UsbSnoop - MyDispatchInternalIOCTL(f890fe80) : fdo=81c63810, Irp=822f7008, IRQL=2
[111300 ms]  >>>  URB 284 going down  >>> 
-- URB_FUNCTION_BULK_OR_INTERRUPT_TRANSFER:
  PipeHandle           = 81c9d164 [endpoint 0x00000002]
  TransferFlags        = 00000000 (USBD_TRANSFER_DIRECTION_OUT, ~USBD_SHORT_TRANSFER_OK)
  TransferBufferLength = 00000007
  TransferBuffer       = 00000000
  TransferBufferMDL    = 81d03558
    00000000: 00 00 00 02 05 e0 00
  UrbLink              = 00000000
[111300 ms] UsbSnoop - MyInternalIOCTLCompletion(f890fdb0) : fido=822da020, Irp=822f7008, Context=81bc6e50, IRQL=2
[111300 ms]  <<<  URB 284 coming back  <<< 
-- URB_FUNCTION_BULK_OR_INTERRUPT_TRANSFER:
  PipeHandle           = 81c9d164 [endpoint 0x00000002]
  TransferFlags        = 00000000 (USBD_TRANSFER_DIRECTION_OUT, ~USBD_SHORT_TRANSFER_OK)
  TransferBufferLength = 00000007
  TransferBuffer       = 00000000
  TransferBufferMDL    = 81d03558
  UrbLink              = 00000000
[111310 ms] UsbSnoop - DispatchAny(f890e610) : IRP_MJ_INTERNAL_DEVICE_CONTROL
[111310 ms] UsbSnoop - MyDispatchInternalIOCTL(f890fe80) : fdo=81c63810, Irp=822f7008, IRQL=2
[111310 ms]  >>>  URB 285 going down  >>> 
-- URB_FUNCTION_BULK_OR_INTERRUPT_TRANSFER:
  PipeHandle           = 81c9d144 [endpoint 0x00000081]
  TransferFlags        = 00000003 (USBD_TRANSFER_DIRECTION_IN, USBD_SHORT_TRANSFER_OK)
  TransferBufferLength = 00000100
  TransferBuffer       = 00000000
  TransferBufferMDL    = 81d03558
  UrbLink              = 00000000
[111337 ms] UsbSnoop - MyInternalIOCTLCompletion(f890fdb0) : fido=822da020, Irp=822f7008, Context=81ba5340, IRQL=2
[111337 ms]  <<<  URB 285 coming back  <<< 
-- URB_FUNCTION_BULK_OR_INTERRUPT_TRANSFER:
  PipeHandle           = 81c9d144 [endpoint 0x00000081]
  TransferFlags        = 00000003 (USBD_TRANSFER_DIRECTION_IN, USBD_SHORT_TRANSFER_OK)
  TransferBufferLength = 00000035
  TransferBuffer       = 00000000
  TransferBufferMDL    = 81d03558
    00000000: 00 00 00 30 04 00 00 00 2a 00 0a 00 04 4c e2 82
    00000010: 81 00 00 06 00 02 00 00 04 f0 07 00 01 00 03 00
    00000020: 00 01 00 00 05 01 00 01 00 00 04 00 00 00 02 00
    00000030: 41 01 00 42 01
  UrbLink              = 00000000
[111370 ms] UsbSnoop - DispatchAny(f890e610) : IRP_MJ_INTERNAL_DEVICE_CONTROL
[111370 ms] UsbSnoop - MyDispatchInternalIOCTL(f890fe80) : fdo=81c63810, Irp=81b04c88, IRQL=2
[111370 ms]  >>>  URB 286 going down  >>> 
-- URB_FUNCTION_BULK_OR_INTERRUPT_TRANSFER:
  PipeHandle           = 81c9d164 [endpoint 0x00000002]
  TransferFlags        = 00000000 (USBD_TRANSFER_DIRECTION_OUT, ~USBD_SHORT_TRANSFER_OK)
  TransferBufferLength = 00000007
  TransferBuffer       = 00000000
  TransferBufferMDL    = 81d03558
    00000000: 00 00 00 02 05 e0 00
  UrbLink              = 00000000
[111370 ms] UsbSnoop - MyInternalIOCTLCompletion(f890fdb0) : fido=822da020, Irp=81b04c88, Context=81b34b68, IRQL=2
[111370 ms]  <<<  URB 286 coming back  <<< 
-- URB_FUNCTION_BULK_OR_INTERRUPT_TRANSFER:
  PipeHandle           = 81c9d164 [endpoint 0x00000002]
  TransferFlags        = 00000000 (USBD_TRANSFER_DIRECTION_OUT, ~USBD_SHORT_TRANSFER_OK)
  TransferBufferLength = 00000007
  TransferBuffer       = 00000000
  TransferBufferMDL    = 81d03558
  UrbLink              = 00000000
[111380 ms] UsbSnoop - DispatchAny(f890e610) : IRP_MJ_INTERNAL_DEVICE_CONTROL
[111380 ms] UsbSnoop - MyDispatchInternalIOCTL(f890fe80) : fdo=81c63810, Irp=822f7008, IRQL=2
[111380 ms]  >>>  URB 287 going down  >>> 
-- URB_FUNCTION_BULK_OR_INTERRUPT_TRANSFER:
  PipeHandle           = 81c9d144 [endpoint 0x00000081]
  TransferFlags        = 00000003 (USBD_TRANSFER_DIRECTION_IN, USBD_SHORT_TRANSFER_OK)
  TransferBufferLength = 00000100
  TransferBuffer       = 00000000
  TransferBufferMDL    = 81d03558
  UrbLink              = 00000000
[111380 ms] UsbSnoop - MyInternalIOCTLCompletion(f890fdb0) : fido=822da020, Irp=822f7008, Context=81ba5340, IRQL=2
[111380 ms]  <<<  URB 287 coming back  <<< 
-- URB_FUNCTION_BULK_OR_INTERRUPT_TRANSFER:
  PipeHandle           = 81c9d144 [endpoint 0x00000081]
  TransferFlags        = 00000003 (USBD_TRANSFER_DIRECTION_IN, USBD_SHORT_TRANSFER_OK)
  TransferBufferLength = 00000035
  TransferBuffer       = 00000000
  TransferBufferMDL    = 81d03558
    00000000: 00 00 00 30 04 00 00 00 2a 00 0a 00 04 4c e2 82
    00000010: 82 00 00 06 00 02 00 00 04 f0 07 00 01 00 03 00
    00000020: 00 01 00 00 05 01 00 01 00 00 04 00 00 00 02 00
    00000030: 41 01 00 42 01
  UrbLink              = 00000000
[111420 ms] UsbSnoop - DispatchAny(f890e610) : IRP_MJ_INTERNAL_DEVICE_CONTROL
[111420 ms] UsbSnoop - MyDispatchInternalIOCTL(f890fe80) : fdo=81c63810, Irp=822f7008, IRQL=2
[111420 ms]  >>>  URB 288 going down  >>> 
-- URB_FUNCTION_BULK_OR_INTERRUPT_TRANSFER:
  PipeHandle           = 81c9d164 [endpoint 0x00000002]
  TransferFlags        = 00000000 (USBD_TRANSFER_DIRECTION_OUT, ~USBD_SHORT_TRANSFER_OK)
  TransferBufferLength = 00000007
  TransferBuffer       = 00000000
  TransferBufferMDL    = 81d03558
    00000000: 00 00 00 02 05 e0 00
  UrbLink              = 00000000
[111420 ms] UsbSnoop - MyInternalIOCTLCompletion(f890fdb0) : fido=822da020, Irp=822f7008, Context=81c72a40, IRQL=2
[111420 ms]  <<<  URB 288 coming back  <<< 
-- URB_FUNCTION_BULK_OR_INTERRUPT_TRANSFER:
  PipeHandle           = 81c9d164 [endpoint 0x00000002]
  TransferFlags        = 00000000 (USBD_TRANSFER_DIRECTION_OUT, ~USBD_SHORT_TRANSFER_OK)
  TransferBufferLength = 00000007
  TransferBuffer       = 00000000
  TransferBufferMDL    = 81d03558
  UrbLink              = 00000000
[111430 ms] UsbSnoop - DispatchAny(f890e610) : IRP_MJ_INTERNAL_DEVICE_CONTROL
[111430 ms] UsbSnoop - MyDispatchInternalIOCTL(f890fe80) : fdo=81c63810, Irp=822f7008, IRQL=2
[111430 ms]  >>>  URB 289 going down  >>> 
-- URB_FUNCTION_BULK_OR_INTERRUPT_TRANSFER:
  PipeHandle           = 81c9d144 [endpoint 0x00000081]
  TransferFlags        = 00000003 (USBD_TRANSFER_DIRECTION_IN, USBD_SHORT_TRANSFER_OK)
  TransferBufferLength = 00000100
  TransferBuffer       = 00000000
  TransferBufferMDL    = 81d03558
  UrbLink              = 00000000
[111430 ms] UsbSnoop - MyInternalIOCTLCompletion(f890fdb0) : fido=822da020, Irp=822f7008, Context=81c9a480, IRQL=2
[111430 ms]  <<<  URB 289 coming back  <<< 
-- URB_FUNCTION_BULK_OR_INTERRUPT_TRANSFER:
  PipeHandle           = 81c9d144 [endpoint 0x00000081]
  TransferFlags        = 00000003 (USBD_TRANSFER_DIRECTION_IN, USBD_SHORT_TRANSFER_OK)
  TransferBufferLength = 00000035
  TransferBuffer       = 00000000
  TransferBufferMDL    = 81d03558
    00000000: 00 00 00 30 04 00 00 00 2a 00 0a 00 04 4c e2 82
    00000010: 83 00 00 06 00 02 00 00 04 f0 07 00 01 00 03 00
    00000020: 00 01 00 00 05 01 00 01 00 00 04 00 00 00 02 00
    00000030: 41 01 00 42 01
  UrbLink              = 00000000
[111470 ms] UsbSnoop - DispatchAny(f890e610) : IRP_MJ_INTERNAL_DEVICE_CONTROL
[111470 ms] UsbSnoop - MyDispatchInternalIOCTL(f890fe80) : fdo=81c63810, Irp=822f7008, IRQL=2
[111470 ms]  >>>  URB 290 going down  >>> 
-- URB_FUNCTION_BULK_OR_INTERRUPT_TRANSFER:
  PipeHandle           = 81c9d164 [endpoint 0x00000002]
  TransferFlags        = 00000000 (USBD_TRANSFER_DIRECTION_OUT, ~USBD_SHORT_TRANSFER_OK)
  TransferBufferLength = 00000007
  TransferBuffer       = 00000000
  TransferBufferMDL    = 81d03558
    00000000: 00 00 00 02 05 e0 00
  UrbLink              = 00000000
[111470 ms] UsbSnoop - MyInternalIOCTLCompletion(f890fdb0) : fido=822da020, Irp=822f7008, Context=81bc6e50, IRQL=2
[111470 ms]  <<<  URB 290 coming back  <<< 
-- URB_FUNCTION_BULK_OR_INTERRUPT_TRANSFER:
  PipeHandle           = 81c9d164 [endpoint 0x00000002]
  TransferFlags        = 00000000 (USBD_TRANSFER_DIRECTION_OUT, ~USBD_SHORT_TRANSFER_OK)
  TransferBufferLength = 00000007
  TransferBuffer       = 00000000
  TransferBufferMDL    = 81d03558
  UrbLink              = 00000000
[111480 ms] UsbSnoop - DispatchAny(f890e610) : IRP_MJ_INTERNAL_DEVICE_CONTROL
[111480 ms] UsbSnoop - MyDispatchInternalIOCTL(f890fe80) : fdo=81c63810, Irp=822f7008, IRQL=2
[111480 ms]  >>>  URB 291 going down  >>> 
-- URB_FUNCTION_BULK_OR_INTERRUPT_TRANSFER:
  PipeHandle           = 81c9d144 [endpoint 0x00000081]
  TransferFlags        = 00000003 (USBD_TRANSFER_DIRECTION_IN, USBD_SHORT_TRANSFER_OK)
  TransferBufferLength = 00000100
  TransferBuffer       = 00000000
  TransferBufferMDL    = 81d03558
  UrbLink              = 00000000
[111480 ms] UsbSnoop - MyInternalIOCTLCompletion(f890fdb0) : fido=822da020, Irp=822f7008, Context=81c72a40, IRQL=2
[111480 ms]  <<<  URB 291 coming back  <<< 
-- URB_FUNCTION_BULK_OR_INTERRUPT_TRANSFER:
  PipeHandle           = 81c9d144 [endpoint 0x00000081]
  TransferFlags        = 00000003 (USBD_TRANSFER_DIRECTION_IN, USBD_SHORT_TRANSFER_OK)
  TransferBufferLength = 00000035
  TransferBuffer       = 00000000
  TransferBufferMDL    = 81d03558
    00000000: 00 00 00 30 04 00 00 00 2a 00 0a 00 04 4c e2 82
    00000010: 84 00 00 06 00 02 00 00 04 f0 07 00 01 00 03 00
    00000020: 00 01 00 00 05 01 00 01 00 00 04 00 00 00 02 00
    00000030: 41 01 00 42 01
  UrbLink              = 00000000
[111520 ms] UsbSnoop - DispatchAny(f890e610) : IRP_MJ_INTERNAL_DEVICE_CONTROL
[111520 ms] UsbSnoop - MyDispatchInternalIOCTL(f890fe80) : fdo=81c63810, Irp=822f7008, IRQL=2
[111520 ms]  >>>  URB 292 going down  >>> 
-- URB_FUNCTION_BULK_OR_INTERRUPT_TRANSFER:
  PipeHandle           = 81c9d164 [endpoint 0x00000002]
  TransferFlags        = 00000000 (USBD_TRANSFER_DIRECTION_OUT, ~USBD_SHORT_TRANSFER_OK)
  TransferBufferLength = 00000007
  TransferBuffer       = 00000000
  TransferBufferMDL    = 81d03558
    00000000: 00 00 00 02 05 e0 00
  UrbLink              = 00000000
[111520 ms] UsbSnoop - MyInternalIOCTLCompletion(f890fdb0) : fido=822da020, Irp=822f7008, Context=81bc6e50, IRQL=2
[111520 ms]  <<<  URB 292 coming back  <<< 
-- URB_FUNCTION_BULK_OR_INTERRUPT_TRANSFER:
  PipeHandle           = 81c9d164 [endpoint 0x00000002]
  TransferFlags        = 00000000 (USBD_TRANSFER_DIRECTION_OUT, ~USBD_SHORT_TRANSFER_OK)
  TransferBufferLength = 00000007
  TransferBuffer       = 00000000
  TransferBufferMDL    = 81d03558
  UrbLink              = 00000000
[111530 ms] UsbSnoop - DispatchAny(f890e610) : IRP_MJ_INTERNAL_DEVICE_CONTROL
[111530 ms] UsbSnoop - MyDispatchInternalIOCTL(f890fe80) : fdo=81c63810, Irp=822f7008, IRQL=2
[111530 ms]  >>>  URB 293 going down  >>> 
-- URB_FUNCTION_BULK_OR_INTERRUPT_TRANSFER:
  PipeHandle           = 81c9d144 [endpoint 0x00000081]
  TransferFlags        = 00000003 (USBD_TRANSFER_DIRECTION_IN, USBD_SHORT_TRANSFER_OK)
  TransferBufferLength = 00000100
  TransferBuffer       = 00000000
  TransferBufferMDL    = 81d03558
  UrbLink              = 00000000
[111530 ms] UsbSnoop - MyInternalIOCTLCompletion(f890fdb0) : fido=822da020, Irp=822f7008, Context=81bb6320, IRQL=2
[111530 ms]  <<<  URB 293 coming back  <<< 
-- URB_FUNCTION_BULK_OR_INTERRUPT_TRANSFER:
  PipeHandle           = 81c9d144 [endpoint 0x00000081]
  TransferFlags        = 00000003 (USBD_TRANSFER_DIRECTION_IN, USBD_SHORT_TRANSFER_OK)
  TransferBufferLength = 00000035
  TransferBuffer       = 00000000
  TransferBufferMDL    = 81d03558
    00000000: 00 00 00 30 04 00 00 00 2a 00 0a 00 04 4c e2 82
    00000010: 85 00 00 06 00 02 00 00 04 f0 07 00 01 00 03 00
    00000020: 00 01 00 00 05 01 00 01 00 00 04 00 00 00 02 00
    00000030: 41 01 00 42 01
  UrbLink              = 00000000
[111570 ms] UsbSnoop - DispatchAny(f890e610) : IRP_MJ_INTERNAL_DEVICE_CONTROL
[111570 ms] UsbSnoop - MyDispatchInternalIOCTL(f890fe80) : fdo=81c63810, Irp=822f7008, IRQL=2
[111570 ms]  >>>  URB 294 going down  >>> 
-- URB_FUNCTION_BULK_OR_INTERRUPT_TRANSFER:
  PipeHandle           = 81c9d164 [endpoint 0x00000002]
  TransferFlags        = 00000000 (USBD_TRANSFER_DIRECTION_OUT, ~USBD_SHORT_TRANSFER_OK)
  TransferBufferLength = 00000007
  TransferBuffer       = 00000000
  TransferBufferMDL    = 81d03558
    00000000: 00 00 00 02 05 e0 00
  UrbLink              = 00000000
[111570 ms] UsbSnoop - MyInternalIOCTLCompletion(f890fdb0) : fido=822da020, Irp=822f7008, Context=81b34b68, IRQL=2
[111570 ms]  <<<  URB 294 coming back  <<< 
-- URB_FUNCTION_BULK_OR_INTERRUPT_TRANSFER:
  PipeHandle           = 81c9d164 [endpoint 0x00000002]
  TransferFlags        = 00000000 (USBD_TRANSFER_DIRECTION_OUT, ~USBD_SHORT_TRANSFER_OK)
  TransferBufferLength = 00000007
  TransferBuffer       = 00000000
  TransferBufferMDL    = 81d03558
  UrbLink              = 00000000
[111580 ms] UsbSnoop - DispatchAny(f890e610) : IRP_MJ_INTERNAL_DEVICE_CONTROL
[111580 ms] UsbSnoop - MyDispatchInternalIOCTL(f890fe80) : fdo=81c63810, Irp=822f7008, IRQL=2
[111580 ms]  >>>  URB 295 going down  >>> 
-- URB_FUNCTION_BULK_OR_INTERRUPT_TRANSFER:
  PipeHandle           = 81c9d144 [endpoint 0x00000081]
  TransferFlags        = 00000003 (USBD_TRANSFER_DIRECTION_IN, USBD_SHORT_TRANSFER_OK)
  TransferBufferLength = 00000100
  TransferBuffer       = 00000000
  TransferBufferMDL    = 81d03558
  UrbLink              = 00000000
[111580 ms] UsbSnoop - MyInternalIOCTLCompletion(f890fdb0) : fido=822da020, Irp=822f7008, Context=81bc6e50, IRQL=2
[111580 ms]  <<<  URB 295 coming back  <<< 
-- URB_FUNCTION_BULK_OR_INTERRUPT_TRANSFER:
  PipeHandle           = 81c9d144 [endpoint 0x00000081]
  TransferFlags        = 00000003 (USBD_TRANSFER_DIRECTION_IN, USBD_SHORT_TRANSFER_OK)
  TransferBufferLength = 00000035
  TransferBuffer       = 00000000
  TransferBufferMDL    = 81d03558
    00000000: 00 00 00 30 04 00 00 00 2a 00 0a 00 04 4c e2 82
    00000010: 86 00 00 06 00 02 00 00 04 f0 07 00 01 00 03 00
    00000020: 00 01 00 00 05 01 00 01 00 00 04 00 00 00 02 00
    00000030: 41 01 00 42 01
  UrbLink              = 00000000
[111620 ms] UsbSnoop - DispatchAny(f890e610) : IRP_MJ_INTERNAL_DEVICE_CONTROL
[111620 ms] UsbSnoop - MyDispatchInternalIOCTL(f890fe80) : fdo=81c63810, Irp=822f7008, IRQL=2
[111620 ms]  >>>  URB 296 going down  >>> 
-- URB_FUNCTION_BULK_OR_INTERRUPT_TRANSFER:
  PipeHandle           = 81c9d164 [endpoint 0x00000002]
  TransferFlags        = 00000000 (USBD_TRANSFER_DIRECTION_OUT, ~USBD_SHORT_TRANSFER_OK)
  TransferBufferLength = 00000007
  TransferBuffer       = 00000000
  TransferBufferMDL    = 81d03558
    00000000: 00 00 00 02 05 e0 00
  UrbLink              = 00000000
[111621 ms] UsbSnoop - MyInternalIOCTLCompletion(f890fdb0) : fido=822da020, Irp=822f7008, Context=81b34b68, IRQL=2
[111621 ms]  <<<  URB 296 coming back  <<< 
-- URB_FUNCTION_BULK_OR_INTERRUPT_TRANSFER:
  PipeHandle           = 81c9d164 [endpoint 0x00000002]
  TransferFlags        = 00000000 (USBD_TRANSFER_DIRECTION_OUT, ~USBD_SHORT_TRANSFER_OK)
  TransferBufferLength = 00000007
  TransferBuffer       = 00000000
  TransferBufferMDL    = 81d03558
  UrbLink              = 00000000
[111632 ms] UsbSnoop - DispatchAny(f890e610) : IRP_MJ_INTERNAL_DEVICE_CONTROL
[111632 ms] UsbSnoop - MyDispatchInternalIOCTL(f890fe80) : fdo=81c63810, Irp=822f7008, IRQL=2
[111632 ms]  >>>  URB 297 going down  >>> 
-- URB_FUNCTION_BULK_OR_INTERRUPT_TRANSFER:
  PipeHandle           = 81c9d144 [endpoint 0x00000081]
  TransferFlags        = 00000003 (USBD_TRANSFER_DIRECTION_IN, USBD_SHORT_TRANSFER_OK)
  TransferBufferLength = 00000100
  TransferBuffer       = 00000000
  TransferBufferMDL    = 81d097b0
  UrbLink              = 00000000
[111632 ms] UsbSnoop - MyInternalIOCTLCompletion(f890fdb0) : fido=822da020, Irp=822f7008, Context=81ba5340, IRQL=2
[111632 ms]  <<<  URB 297 coming back  <<< 
-- URB_FUNCTION_BULK_OR_INTERRUPT_TRANSFER:
  PipeHandle           = 81c9d144 [endpoint 0x00000081]
  TransferFlags        = 00000003 (USBD_TRANSFER_DIRECTION_IN, USBD_SHORT_TRANSFER_OK)
  TransferBufferLength = 0000000b
  TransferBuffer       = 00000000
  TransferBufferMDL    = 81d097b0
    00000000: 00 00 00 06 04 00 00 00 00 dd 00
  UrbLink              = 00000000
[111670 ms] UsbSnoop - DispatchAny(f890e610) : IRP_MJ_INTERNAL_DEVICE_CONTROL
[111670 ms] UsbSnoop - MyDispatchInternalIOCTL(f890fe80) : fdo=81c63810, Irp=822f7008, IRQL=2
[111670 ms]  >>>  URB 298 going down  >>> 
-- URB_FUNCTION_BULK_OR_INTERRUPT_TRANSFER:
  PipeHandle           = 81c9d164 [endpoint 0x00000002]
  TransferFlags        = 00000000 (USBD_TRANSFER_DIRECTION_OUT, ~USBD_SHORT_TRANSFER_OK)
  TransferBufferLength = 00000007
  TransferBuffer       = 00000000
  TransferBufferMDL    = 81d03558
    00000000: 00 00 00 02 05 e0 00
  UrbLink              = 00000000
[111671 ms] UsbSnoop - MyInternalIOCTLCompletion(f890fdb0) : fido=822da020, Irp=822f7008, Context=81c9a480, IRQL=2
[111671 ms]  <<<  URB 298 coming back  <<< 
-- URB_FUNCTION_BULK_OR_INTERRUPT_TRANSFER:
  PipeHandle           = 81c9d164 [endpoint 0x00000002]
  TransferFlags        = 00000000 (USBD_TRANSFER_DIRECTION_OUT, ~USBD_SHORT_TRANSFER_OK)
  TransferBufferLength = 00000007
  TransferBuffer       = 00000000
  TransferBufferMDL    = 81d03558
  UrbLink              = 00000000
[111931 ms] UsbSnoop - DispatchAny(f890e610) : IRP_MJ_INTERNAL_DEVICE_CONTROL
[111931 ms] UsbSnoop - MyDispatchInternalIOCTL(f890fe80) : fdo=81c63810, Irp=822f7008, IRQL=2
[111931 ms]  >>>  URB 299 going down  >>> 
-- URB_FUNCTION_BULK_OR_INTERRUPT_TRANSFER:
  PipeHandle           = 81c9d164 [endpoint 0x00000002]
  TransferFlags        = 00000000 (USBD_TRANSFER_DIRECTION_OUT, ~USBD_SHORT_TRANSFER_OK)
  TransferBufferLength = 00000009
  TransferBuffer       = 00000000
  TransferBufferMDL    = 81d03558
    00000000: 00 00 00 04 01 00 00 04 00
  UrbLink              = 00000000
[111931 ms] UsbSnoop - MyInternalIOCTLCompletion(f890fdb0) : fido=822da020, Irp=822f7008, Context=81bb6320, IRQL=2
[111931 ms]  <<<  URB 299 coming back  <<< 
-- URB_FUNCTION_BULK_OR_INTERRUPT_TRANSFER:
  PipeHandle           = 81c9d164 [endpoint 0x00000002]
  TransferFlags        = 00000000 (USBD_TRANSFER_DIRECTION_OUT, ~USBD_SHORT_TRANSFER_OK)
  TransferBufferLength = 00000009
  TransferBuffer       = 00000000
  TransferBufferMDL    = 81d03558
  UrbLink              = 00000000
[111932 ms] UsbSnoop - DispatchAny(f890e610) : IRP_MJ_INTERNAL_DEVICE_CONTROL
[111932 ms] UsbSnoop - MyDispatchInternalIOCTL(f890fe80) : fdo=81c63810, Irp=822f7008, IRQL=2
[111932 ms]  >>>  URB 300 going down  >>> 
-- URB_FUNCTION_BULK_OR_INTERRUPT_TRANSFER:
  PipeHandle           = 81c9d144 [endpoint 0x00000081]
  TransferFlags        = 00000003 (USBD_TRANSFER_DIRECTION_IN, USBD_SHORT_TRANSFER_OK)
  TransferBufferLength = 00000100
  TransferBuffer       = 00000000
  TransferBufferMDL    = 81d03558
  UrbLink              = 00000000
[111943 ms] UsbSnoop - MyInternalIOCTLCompletion(f890fdb0) : fido=822da020, Irp=822f7008, Context=81bc6e50, IRQL=2
[111943 ms]  <<<  URB 300 coming back  <<< 
-- URB_FUNCTION_BULK_OR_INTERRUPT_TRANSFER:
  PipeHandle           = 81c9d144 [endpoint 0x00000081]
  TransferFlags        = 00000003 (USBD_TRANSFER_DIRECTION_IN, USBD_SHORT_TRANSFER_OK)
  TransferBufferLength = 00000009
  TransferBuffer       = 00000000
  TransferBufferMDL    = 81d03558
    00000000: 00 00 00 04 02 00 00 00 fa
  UrbLink              = 00000000
[111971 ms] UsbSnoop - DispatchAny(f890e610) : IRP_MJ_INTERNAL_DEVICE_CONTROL
[111971 ms] UsbSnoop - MyDispatchInternalIOCTL(f890fe80) : fdo=81c63810, Irp=822f7008, IRQL=2
[111971 ms]  >>>  URB 301 going down  >>> 
-- URB_FUNCTION_BULK_OR_INTERRUPT_TRANSFER:
  PipeHandle           = 81c9d164 [endpoint 0x00000002]
  TransferFlags        = 00000000 (USBD_TRANSFER_DIRECTION_OUT, ~USBD_SHORT_TRANSFER_OK)
  TransferBufferLength = 00000015
  TransferBuffer       = 00000000
  TransferBufferMDL    = 81d03558
    00000000: 00 00 00 10 04 00 00 00 0a 00 01 00 03 00 01 00
    00000010: 00 00 00 07 d0
  UrbLink              = 00000000
[111971 ms] UsbSnoop - MyInternalIOCTLCompletion(f890fdb0) : fido=822da020, Irp=822f7008, Context=81c9a480, IRQL=2
[111971 ms]  <<<  URB 301 coming back  <<< 
-- URB_FUNCTION_BULK_OR_INTERRUPT_TRANSFER:
  PipeHandle           = 81c9d164 [endpoint 0x00000002]
  TransferFlags        = 00000000 (USBD_TRANSFER_DIRECTION_OUT, ~USBD_SHORT_TRANSFER_OK)
  TransferBufferLength = 00000015
  TransferBuffer       = 00000000
  TransferBufferMDL    = 81d03558
  UrbLink              = 00000000
[111981 ms] UsbSnoop - DispatchAny(f890e610) : IRP_MJ_INTERNAL_DEVICE_CONTROL
[111981 ms] UsbSnoop - MyDispatchInternalIOCTL(f890fe80) : fdo=81c63810, Irp=822f7008, IRQL=2
[111981 ms]  >>>  URB 302 going down  >>> 
-- URB_FUNCTION_BULK_OR_INTERRUPT_TRANSFER:
  PipeHandle           = 81c9d144 [endpoint 0x00000081]
  TransferFlags        = 00000003 (USBD_TRANSFER_DIRECTION_IN, USBD_SHORT_TRANSFER_OK)
  TransferBufferLength = 00000100
  TransferBuffer       = 00000000
  TransferBufferMDL    = 81d03558
  UrbLink              = 00000000
[111981 ms] UsbSnoop - MyInternalIOCTLCompletion(f890fdb0) : fido=822da020, Irp=822f7008, Context=81bc6e50, IRQL=2
[111981 ms]  <<<  URB 302 coming back  <<< 
-- URB_FUNCTION_BULK_OR_INTERRUPT_TRANSFER:
  PipeHandle           = 81c9d144 [endpoint 0x00000081]
  TransferFlags        = 00000003 (USBD_TRANSFER_DIRECTION_IN, USBD_SHORT_TRANSFER_OK)
  TransferBufferLength = 00000007
  TransferBuffer       = 00000000
  TransferBufferMDL    = 81d03558
    00000000: 00 00 00 02 05 e0 00
  UrbLink              = 00000000
[112022 ms] UsbSnoop - DispatchAny(f890e610) : IRP_MJ_INTERNAL_DEVICE_CONTROL
[112022 ms] UsbSnoop - MyDispatchInternalIOCTL(f890fe80) : fdo=81c63810, Irp=822f7008, IRQL=2
[112022 ms]  >>>  URB 303 going down  >>> 
-- URB_FUNCTION_BULK_OR_INTERRUPT_TRANSFER:
  PipeHandle           = 81c9d144 [endpoint 0x00000081]
  TransferFlags        = 00000003 (USBD_TRANSFER_DIRECTION_IN, USBD_SHORT_TRANSFER_OK)
  TransferBufferLength = 00000100
  TransferBuffer       = 00000000
  TransferBufferMDL    = 81d03558
  UrbLink              = 00000000
[112022 ms] UsbSnoop - MyInternalIOCTLCompletion(f890fdb0) : fido=822da020, Irp=822f7008, Context=81c72a40, IRQL=2
[112022 ms]  <<<  URB 303 coming back  <<< 
-- URB_FUNCTION_BULK_OR_INTERRUPT_TRANSFER:
  PipeHandle           = 81c9d144 [endpoint 0x00000081]
  TransferFlags        = 00000003 (USBD_TRANSFER_DIRECTION_IN, USBD_SHORT_TRANSFER_OK)
  TransferBufferLength = 0000000f
  TransferBuffer       = 00000000
  TransferBufferMDL    = 81d03558
    00000000: 00 00 00 0a 04 00 00 00 04 00 12 00 00 07 d0
  UrbLink              = 00000000
[112061 ms] UsbSnoop - DispatchAny(f890e610) : IRP_MJ_INTERNAL_DEVICE_CONTROL
[112061 ms] UsbSnoop - MyDispatchInternalIOCTL(f890fe80) : fdo=81c63810, Irp=822f7008, IRQL=2
[112061 ms]  >>>  URB 304 going down  >>> 
-- URB_FUNCTION_BULK_OR_INTERRUPT_TRANSFER:
  PipeHandle           = 81c9d164 [endpoint 0x00000002]
  TransferFlags        = 00000000 (USBD_TRANSFER_DIRECTION_OUT, ~USBD_SHORT_TRANSFER_OK)
  TransferBufferLength = 00000007
  TransferBuffer       = 00000000
  TransferBufferMDL    = 81d03558
    00000000: 00 00 00 02 05 e0 00
  UrbLink              = 00000000
[112061 ms] UsbSnoop - MyInternalIOCTLCompletion(f890fdb0) : fido=822da020, Irp=822f7008, Context=81c9a480, IRQL=2
[112061 ms]  <<<  URB 304 coming back  <<< 
-- URB_FUNCTION_BULK_OR_INTERRUPT_TRANSFER:
  PipeHandle           = 81c9d164 [endpoint 0x00000002]
  TransferFlags        = 00000000 (USBD_TRANSFER_DIRECTION_OUT, ~USBD_SHORT_TRANSFER_OK)
  TransferBufferLength = 00000007
  TransferBuffer       = 00000000
  TransferBufferMDL    = 81d03558
  UrbLink              = 00000000
[112071 ms] UsbSnoop - DispatchAny(f890e610) : IRP_MJ_INTERNAL_DEVICE_CONTROL
[112071 ms] UsbSnoop - MyDispatchInternalIOCTL(f890fe80) : fdo=81c63810, Irp=822f7008, IRQL=2
[112071 ms]  >>>  URB 305 going down  >>> 
-- URB_FUNCTION_BULK_OR_INTERRUPT_TRANSFER:
  PipeHandle           = 81c9d164 [endpoint 0x00000002]
  TransferFlags        = 00000000 (USBD_TRANSFER_DIRECTION_OUT, ~USBD_SHORT_TRANSFER_OK)
  TransferBufferLength = 0000000f
  TransferBuffer       = 00000000
  TransferBufferMDL    = 81d03558
    00000000: 00 00 00 0a 04 00 00 00 04 00 07 00 01 00 0e
  UrbLink              = 00000000
[112071 ms] UsbSnoop - MyInternalIOCTLCompletion(f890fdb0) : fido=822da020, Irp=822f7008, Context=81c72a40, IRQL=2
[112071 ms]  <<<  URB 305 coming back  <<< 
-- URB_FUNCTION_BULK_OR_INTERRUPT_TRANSFER:
  PipeHandle           = 81c9d164 [endpoint 0x00000002]
  TransferFlags        = 00000000 (USBD_TRANSFER_DIRECTION_OUT, ~USBD_SHORT_TRANSFER_OK)
  TransferBufferLength = 0000000f
  TransferBuffer       = 00000000
  TransferBufferMDL    = 81d03558
  UrbLink              = 00000000
[112081 ms] UsbSnoop - DispatchAny(f890e610) : IRP_MJ_INTERNAL_DEVICE_CONTROL
[112081 ms] UsbSnoop - MyDispatchInternalIOCTL(f890fe80) : fdo=81c63810, Irp=822f7008, IRQL=2
[112081 ms]  >>>  URB 306 going down  >>> 
-- URB_FUNCTION_BULK_OR_INTERRUPT_TRANSFER:
  PipeHandle           = 81c9d144 [endpoint 0x00000081]
  TransferFlags        = 00000003 (USBD_TRANSFER_DIRECTION_IN, USBD_SHORT_TRANSFER_OK)
  TransferBufferLength = 00000100
  TransferBuffer       = 00000000
  TransferBufferMDL    = 81d03558
  UrbLink              = 00000000
[112082 ms] UsbSnoop - MyInternalIOCTLCompletion(f890fdb0) : fido=822da020, Irp=822f7008, Context=81ba5340, IRQL=2
[112082 ms]  <<<  URB 306 coming back  <<< 
-- URB_FUNCTION_BULK_OR_INTERRUPT_TRANSFER:
  PipeHandle           = 81c9d144 [endpoint 0x00000081]
  TransferFlags        = 00000003 (USBD_TRANSFER_DIRECTION_IN, USBD_SHORT_TRANSFER_OK)
  TransferBufferLength = 00000007
  TransferBuffer       = 00000000
  TransferBufferMDL    = 81d03558
    00000000: 00 00 00 02 05 e0 00
  UrbLink              = 00000000
[112121 ms] UsbSnoop - DispatchAny(f890e610) : IRP_MJ_INTERNAL_DEVICE_CONTROL
[112121 ms] UsbSnoop - MyDispatchInternalIOCTL(f890fe80) : fdo=81c63810, Irp=822f7008, IRQL=2
[112121 ms]  >>>  URB 307 going down  >>> 
-- URB_FUNCTION_BULK_OR_INTERRUPT_TRANSFER:
  PipeHandle           = 81c9d144 [endpoint 0x00000081]
  TransferFlags        = 00000003 (USBD_TRANSFER_DIRECTION_IN, USBD_SHORT_TRANSFER_OK)
  TransferBufferLength = 00000100
  TransferBuffer       = 00000000
  TransferBufferMDL    = 81d03558
  UrbLink              = 00000000
[112121 ms] UsbSnoop - MyInternalIOCTLCompletion(f890fdb0) : fido=822da020, Irp=822f7008, Context=81c9a480, IRQL=2
[112121 ms]  <<<  URB 307 coming back  <<< 
-- URB_FUNCTION_BULK_OR_INTERRUPT_TRANSFER:
  PipeHandle           = 81c9d144 [endpoint 0x00000081]
  TransferFlags        = 00000003 (USBD_TRANSFER_DIRECTION_IN, USBD_SHORT_TRANSFER_OK)
  TransferBufferLength = 0000000f
  TransferBuffer       = 00000000
  TransferBufferMDL    = 81d03558
    00000000: 00 00 00 0a 04 00 00 00 04 bb 00 00 01 d4 c0
  UrbLink              = 00000000
[112161 ms] UsbSnoop - DispatchAny(f890e610) : IRP_MJ_INTERNAL_DEVICE_CONTROL
[112161 ms] UsbSnoop - MyDispatchInternalIOCTL(f890fe80) : fdo=81c63810, Irp=822f7008, IRQL=2
[112161 ms]  >>>  URB 308 going down  >>> 
-- URB_FUNCTION_BULK_OR_INTERRUPT_TRANSFER:
  PipeHandle           = 81c9d164 [endpoint 0x00000002]
  TransferFlags        = 00000000 (USBD_TRANSFER_DIRECTION_OUT, ~USBD_SHORT_TRANSFER_OK)
  TransferBufferLength = 00000007
  TransferBuffer       = 00000000
  TransferBufferMDL    = 81d03558
    00000000: 00 00 00 02 05 e0 00
  UrbLink              = 00000000
[112161 ms] UsbSnoop - MyInternalIOCTLCompletion(f890fdb0) : fido=822da020, Irp=822f7008, Context=81b34b68, IRQL=2
[112161 ms]  <<<  URB 308 coming back  <<< 
-- URB_FUNCTION_BULK_OR_INTERRUPT_TRANSFER:
  PipeHandle           = 81c9d164 [endpoint 0x00000002]
  TransferFlags        = 00000000 (USBD_TRANSFER_DIRECTION_OUT, ~USBD_SHORT_TRANSFER_OK)
  TransferBufferLength = 00000007
  TransferBuffer       = 00000000
  TransferBufferMDL    = 81d03558
  UrbLink              = 00000000
[112171 ms] UsbSnoop - DispatchAny(f890e610) : IRP_MJ_INTERNAL_DEVICE_CONTROL
[112171 ms] UsbSnoop - MyDispatchInternalIOCTL(f890fe80) : fdo=81c63810, Irp=822f7008, IRQL=2
[112171 ms]  >>>  URB 309 going down  >>> 
-- URB_FUNCTION_BULK_OR_INTERRUPT_TRANSFER:
  PipeHandle           = 81c9d144 [endpoint 0x00000081]
  TransferFlags        = 00000003 (USBD_TRANSFER_DIRECTION_IN, USBD_SHORT_TRANSFER_OK)
  TransferBufferLength = 00000100
  TransferBuffer       = 00000000
  TransferBufferMDL    = 81d03558
  UrbLink              = 00000000
[112171 ms] UsbSnoop - MyInternalIOCTLCompletion(f890fdb0) : fido=822da020, Irp=822f7008, Context=81c9a480, IRQL=2
[112171 ms]  <<<  URB 309 coming back  <<< 
-- URB_FUNCTION_BULK_OR_INTERRUPT_TRANSFER:
  PipeHandle           = 81c9d144 [endpoint 0x00000081]
  TransferFlags        = 00000003 (USBD_TRANSFER_DIRECTION_IN, USBD_SHORT_TRANSFER_OK)
  TransferBufferLength = 0000001a
  TransferBuffer       = 00000000
  TransferBufferMDL    = 81d03558
    00000000: 00 00 00 15 04 00 00 00 0f 00 08 00 01 00 0e 00
    00000010: 00 08 00 00 00 00 00 00 5e f4
  UrbLink              = 00000000
[112211 ms] UsbSnoop - DispatchAny(f890e610) : IRP_MJ_INTERNAL_DEVICE_CONTROL
[112211 ms] UsbSnoop - MyDispatchInternalIOCTL(f890fe80) : fdo=81c63810, Irp=822f7008, IRQL=2
[112211 ms]  >>>  URB 310 going down  >>> 
-- URB_FUNCTION_BULK_OR_INTERRUPT_TRANSFER:
  PipeHandle           = 81c9d164 [endpoint 0x00000002]
  TransferFlags        = 00000000 (USBD_TRANSFER_DIRECTION_OUT, ~USBD_SHORT_TRANSFER_OK)
  TransferBufferLength = 00000007
  TransferBuffer       = 00000000
  TransferBufferMDL    = 81d03558
    00000000: 00 00 00 02 05 e0 00
  UrbLink              = 00000000
[112211 ms] UsbSnoop - MyInternalIOCTLCompletion(f890fdb0) : fido=822da020, Irp=822f7008, Context=81c72a40, IRQL=2
[112211 ms]  <<<  URB 310 coming back  <<< 
-- URB_FUNCTION_BULK_OR_INTERRUPT_TRANSFER:
  PipeHandle           = 81c9d164 [endpoint 0x00000002]
  TransferFlags        = 00000000 (USBD_TRANSFER_DIRECTION_OUT, ~USBD_SHORT_TRANSFER_OK)
  TransferBufferLength = 00000007
  TransferBuffer       = 00000000
  TransferBufferMDL    = 81d03558
  UrbLink              = 00000000
[112482 ms] UsbSnoop - DispatchAny(f890e610) : IRP_MJ_INTERNAL_DEVICE_CONTROL
[112482 ms] UsbSnoop - MyDispatchInternalIOCTL(f890fe80) : fdo=81c63810, Irp=822f7008, IRQL=2
[112482 ms]  >>>  URB 311 going down  >>> 
-- URB_FUNCTION_BULK_OR_INTERRUPT_TRANSFER:
  PipeHandle           = 81c9d164 [endpoint 0x00000002]
  TransferFlags        = 00000000 (USBD_TRANSFER_DIRECTION_OUT, ~USBD_SHORT_TRANSFER_OK)
  TransferBufferLength = 00000009
  TransferBuffer       = 00000000
  TransferBufferMDL    = 81cf5428
    00000000: 00 00 00 04 01 00 00 04 00
  UrbLink              = 00000000
[112482 ms] UsbSnoop - MyInternalIOCTLCompletion(f890fdb0) : fido=822da020, Irp=822f7008, Context=81bc6e50, IRQL=2
[112482 ms]  <<<  URB 311 coming back  <<< 
-- URB_FUNCTION_BULK_OR_INTERRUPT_TRANSFER:
  PipeHandle           = 81c9d164 [endpoint 0x00000002]
  TransferFlags        = 00000000 (USBD_TRANSFER_DIRECTION_OUT, ~USBD_SHORT_TRANSFER_OK)
  TransferBufferLength = 00000009
  TransferBuffer       = 00000000
  TransferBufferMDL    = 81cf5428
  UrbLink              = 00000000
[112483 ms] UsbSnoop - DispatchAny(f890e610) : IRP_MJ_INTERNAL_DEVICE_CONTROL
[112483 ms] UsbSnoop - MyDispatchInternalIOCTL(f890fe80) : fdo=81c63810, Irp=822f7008, IRQL=2
[112483 ms]  >>>  URB 312 going down  >>> 
-- URB_FUNCTION_BULK_OR_INTERRUPT_TRANSFER:
  PipeHandle           = 81c9d144 [endpoint 0x00000081]
  TransferFlags        = 00000003 (USBD_TRANSFER_DIRECTION_IN, USBD_SHORT_TRANSFER_OK)
  TransferBufferLength = 00000100
  TransferBuffer       = 00000000
  TransferBufferMDL    = 81cf5428
  UrbLink              = 00000000
[112491 ms] UsbSnoop - MyInternalIOCTLCompletion(f890fdb0) : fido=822da020, Irp=822f7008, Context=81c9a480, IRQL=2
[112491 ms]  <<<  URB 312 coming back  <<< 
-- URB_FUNCTION_BULK_OR_INTERRUPT_TRANSFER:
  PipeHandle           = 81c9d144 [endpoint 0x00000081]
  TransferFlags        = 00000003 (USBD_TRANSFER_DIRECTION_IN, USBD_SHORT_TRANSFER_OK)
  TransferBufferLength = 00000009
  TransferBuffer       = 00000000
  TransferBufferMDL    = 81cf5428
    00000000: 00 00 00 04 02 00 00 00 fa
  UrbLink              = 00000000
[112512 ms] UsbSnoop - DispatchAny(f890e610) : IRP_MJ_INTERNAL_DEVICE_CONTROL
[112512 ms] UsbSnoop - MyDispatchInternalIOCTL(f890fe80) : fdo=81c63810, Irp=822f7008, IRQL=2
[112512 ms]  >>>  URB 313 going down  >>> 
-- URB_FUNCTION_BULK_OR_INTERRUPT_TRANSFER:
  PipeHandle           = 81c9d164 [endpoint 0x00000002]
  TransferFlags        = 00000000 (USBD_TRANSFER_DIRECTION_OUT, ~USBD_SHORT_TRANSFER_OK)
  TransferBufferLength = 00000015
  TransferBuffer       = 00000000
  TransferBufferMDL    = 81cf5428
    00000000: 00 00 00 10 04 00 00 00 0a 00 01 00 03 00 01 00
    00000010: 00 00 00 07 d0
  UrbLink              = 00000000
[112512 ms] UsbSnoop - MyInternalIOCTLCompletion(f890fdb0) : fido=822da020, Irp=822f7008, Context=8218afe8, IRQL=2
[112512 ms]  <<<  URB 313 coming back  <<< 
-- URB_FUNCTION_BULK_OR_INTERRUPT_TRANSFER:
  PipeHandle           = 81c9d164 [endpoint 0x00000002]
  TransferFlags        = 00000000 (USBD_TRANSFER_DIRECTION_OUT, ~USBD_SHORT_TRANSFER_OK)
  TransferBufferLength = 00000015
  TransferBuffer       = 00000000
  TransferBufferMDL    = 81cf5428
  UrbLink              = 00000000
[112522 ms] UsbSnoop - DispatchAny(f890e610) : IRP_MJ_INTERNAL_DEVICE_CONTROL
[112522 ms] UsbSnoop - MyDispatchInternalIOCTL(f890fe80) : fdo=81c63810, Irp=822f7008, IRQL=2
[112522 ms]  >>>  URB 314 going down  >>> 
-- URB_FUNCTION_BULK_OR_INTERRUPT_TRANSFER:
  PipeHandle           = 81c9d144 [endpoint 0x00000081]
  TransferFlags        = 00000003 (USBD_TRANSFER_DIRECTION_IN, USBD_SHORT_TRANSFER_OK)
  TransferBufferLength = 00000100
  TransferBuffer       = 00000000
  TransferBufferMDL    = 81cf5428
  UrbLink              = 00000000
[112522 ms] UsbSnoop - MyInternalIOCTLCompletion(f890fdb0) : fido=822da020, Irp=822f7008, Context=81c72a40, IRQL=2
[112522 ms]  <<<  URB 314 coming back  <<< 
-- URB_FUNCTION_BULK_OR_INTERRUPT_TRANSFER:
  PipeHandle           = 81c9d144 [endpoint 0x00000081]
  TransferFlags        = 00000003 (USBD_TRANSFER_DIRECTION_IN, USBD_SHORT_TRANSFER_OK)
  TransferBufferLength = 00000007
  TransferBuffer       = 00000000
  TransferBufferMDL    = 81cf5428
    00000000: 00 00 00 02 05 e0 00
  UrbLink              = 00000000
[112562 ms] UsbSnoop - DispatchAny(f890e610) : IRP_MJ_INTERNAL_DEVICE_CONTROL
[112562 ms] UsbSnoop - MyDispatchInternalIOCTL(f890fe80) : fdo=81c63810, Irp=822f7008, IRQL=2
[112562 ms]  >>>  URB 315 going down  >>> 
-- URB_FUNCTION_BULK_OR_INTERRUPT_TRANSFER:
  PipeHandle           = 81c9d144 [endpoint 0x00000081]
  TransferFlags        = 00000003 (USBD_TRANSFER_DIRECTION_IN, USBD_SHORT_TRANSFER_OK)
  TransferBufferLength = 00000100
  TransferBuffer       = 00000000
  TransferBufferMDL    = 81cf5428
  UrbLink              = 00000000
[112562 ms] UsbSnoop - MyInternalIOCTLCompletion(f890fdb0) : fido=822da020, Irp=822f7008, Context=81c9a480, IRQL=2
[112562 ms]  <<<  URB 315 coming back  <<< 
-- URB_FUNCTION_BULK_OR_INTERRUPT_TRANSFER:
  PipeHandle           = 81c9d144 [endpoint 0x00000081]
  TransferFlags        = 00000003 (USBD_TRANSFER_DIRECTION_IN, USBD_SHORT_TRANSFER_OK)
  TransferBufferLength = 0000000f
  TransferBuffer       = 00000000
  TransferBufferMDL    = 81cf5428
    00000000: 00 00 00 0a 04 00 00 00 04 00 12 00 00 07 d0
  UrbLink              = 00000000
[112602 ms] UsbSnoop - DispatchAny(f890e610) : IRP_MJ_INTERNAL_DEVICE_CONTROL
[112602 ms] UsbSnoop - MyDispatchInternalIOCTL(f890fe80) : fdo=81c63810, Irp=822f7008, IRQL=2
[112602 ms]  >>>  URB 316 going down  >>> 
-- URB_FUNCTION_BULK_OR_INTERRUPT_TRANSFER:
  PipeHandle           = 81c9d164 [endpoint 0x00000002]
  TransferFlags        = 00000000 (USBD_TRANSFER_DIRECTION_OUT, ~USBD_SHORT_TRANSFER_OK)
  TransferBufferLength = 00000007
  TransferBuffer       = 00000000
  TransferBufferMDL    = 81cf5428
    00000000: 00 00 00 02 05 e0 00
  UrbLink              = 00000000
[112602 ms] UsbSnoop - MyInternalIOCTLCompletion(f890fdb0) : fido=822da020, Irp=822f7008, Context=81c72a40, IRQL=2
[112602 ms]  <<<  URB 316 coming back  <<< 
-- URB_FUNCTION_BULK_OR_INTERRUPT_TRANSFER:
  PipeHandle           = 81c9d164 [endpoint 0x00000002]
  TransferFlags        = 00000000 (USBD_TRANSFER_DIRECTION_OUT, ~USBD_SHORT_TRANSFER_OK)
  TransferBufferLength = 00000007
  TransferBuffer       = 00000000
  TransferBufferMDL    = 81cf5428
  UrbLink              = 00000000
[112612 ms] UsbSnoop - DispatchAny(f890e610) : IRP_MJ_INTERNAL_DEVICE_CONTROL
[112612 ms] UsbSnoop - MyDispatchInternalIOCTL(f890fe80) : fdo=81c63810, Irp=822f7008, IRQL=2
[112612 ms]  >>>  URB 317 going down  >>> 
-- URB_FUNCTION_BULK_OR_INTERRUPT_TRANSFER:
  PipeHandle           = 81c9d164 [endpoint 0x00000002]
  TransferFlags        = 00000000 (USBD_TRANSFER_DIRECTION_OUT, ~USBD_SHORT_TRANSFER_OK)
  TransferBufferLength = 00000029
  TransferBuffer       = 00000000
  TransferBufferMDL    = 81cf5428
    00000000: 00 00 00 24 04 00 00 00 1e 00 07 00 0e 00 0b 00
    00000010: 04 00 06 00 07 00 01 00 02 00 0a 00 37 00 0d 00
    00000020: 38 00 09 00 0e 00 2d 00 03
  UrbLink              = 00000000
[112612 ms] UsbSnoop - MyInternalIOCTLCompletion(f890fdb0) : fido=822da020, Irp=822f7008, Context=81bb6320, IRQL=2
[112612 ms]  <<<  URB 317 coming back  <<< 
-- URB_FUNCTION_BULK_OR_INTERRUPT_TRANSFER:
  PipeHandle           = 81c9d164 [endpoint 0x00000002]
  TransferFlags        = 00000000 (USBD_TRANSFER_DIRECTION_OUT, ~USBD_SHORT_TRANSFER_OK)
  TransferBufferLength = 00000029
  TransferBuffer       = 00000000
  TransferBufferMDL    = 81cf5428
  UrbLink              = 00000000
[112622 ms] UsbSnoop - DispatchAny(f890e610) : IRP_MJ_INTERNAL_DEVICE_CONTROL
[112622 ms] UsbSnoop - MyDispatchInternalIOCTL(f890fe80) : fdo=81c63810, Irp=822f7008, IRQL=2
[112622 ms]  >>>  URB 318 going down  >>> 
-- URB_FUNCTION_BULK_OR_INTERRUPT_TRANSFER:
  PipeHandle           = 81c9d144 [endpoint 0x00000081]
  TransferFlags        = 00000003 (USBD_TRANSFER_DIRECTION_IN, USBD_SHORT_TRANSFER_OK)
  TransferBufferLength = 00000100
  TransferBuffer       = 00000000
  TransferBufferMDL    = 81cf5428
  UrbLink              = 00000000
[112622 ms] UsbSnoop - MyInternalIOCTLCompletion(f890fdb0) : fido=822da020, Irp=822f7008, Context=81bb6320, IRQL=2
[112622 ms]  <<<  URB 318 coming back  <<< 
-- URB_FUNCTION_BULK_OR_INTERRUPT_TRANSFER:
  PipeHandle           = 81c9d144 [endpoint 0x00000081]
  TransferFlags        = 00000003 (USBD_TRANSFER_DIRECTION_IN, USBD_SHORT_TRANSFER_OK)
  TransferBufferLength = 00000007
  TransferBuffer       = 00000000
  TransferBufferMDL    = 81cf5428
    00000000: 00 00 00 02 05 e0 00
  UrbLink              = 00000000
[112662 ms] UsbSnoop - DispatchAny(f890e610) : IRP_MJ_INTERNAL_DEVICE_CONTROL
[112662 ms] UsbSnoop - MyDispatchInternalIOCTL(f890fe80) : fdo=81c63810, Irp=822f7008, IRQL=2
[112662 ms]  >>>  URB 319 going down  >>> 
-- URB_FUNCTION_BULK_OR_INTERRUPT_TRANSFER:
  PipeHandle           = 81c9d144 [endpoint 0x00000081]
  TransferFlags        = 00000003 (USBD_TRANSFER_DIRECTION_IN, USBD_SHORT_TRANSFER_OK)
  TransferBufferLength = 00000100
  TransferBuffer       = 00000000
  TransferBufferMDL    = 81cf5428
  UrbLink              = 00000000
[112662 ms] UsbSnoop - MyInternalIOCTLCompletion(f890fdb0) : fido=822da020, Irp=822f7008, Context=81c9a480, IRQL=2
[112662 ms]  <<<  URB 319 coming back  <<< 
-- URB_FUNCTION_BULK_OR_INTERRUPT_TRANSFER:
  PipeHandle           = 81c9d144 [endpoint 0x00000081]
  TransferFlags        = 00000003 (USBD_TRANSFER_DIRECTION_IN, USBD_SHORT_TRANSFER_OK)
  TransferBufferLength = 0000000f
  TransferBuffer       = 00000000
  TransferBufferMDL    = 81cf5428
    00000000: 00 00 00 0a 04 00 00 00 04 bb 00 00 01 d4 c0
  UrbLink              = 00000000
[112702 ms] UsbSnoop - DispatchAny(f890e610) : IRP_MJ_INTERNAL_DEVICE_CONTROL
[112702 ms] UsbSnoop - MyDispatchInternalIOCTL(f890fe80) : fdo=81c63810, Irp=822f7008, IRQL=2
[112702 ms]  >>>  URB 320 going down  >>> 
-- URB_FUNCTION_BULK_OR_INTERRUPT_TRANSFER:
  PipeHandle           = 81c9d164 [endpoint 0x00000002]
  TransferFlags        = 00000000 (USBD_TRANSFER_DIRECTION_OUT, ~USBD_SHORT_TRANSFER_OK)
  TransferBufferLength = 00000007
  TransferBuffer       = 00000000
  TransferBufferMDL    = 81cf5428
    00000000: 00 00 00 02 05 e0 00
  UrbLink              = 00000000
[112702 ms] UsbSnoop - MyInternalIOCTLCompletion(f890fdb0) : fido=822da020, Irp=822f7008, Context=81bb6320, IRQL=2
[112702 ms]  <<<  URB 320 coming back  <<< 
-- URB_FUNCTION_BULK_OR_INTERRUPT_TRANSFER:
  PipeHandle           = 81c9d164 [endpoint 0x00000002]
  TransferFlags        = 00000000 (USBD_TRANSFER_DIRECTION_OUT, ~USBD_SHORT_TRANSFER_OK)
  TransferBufferLength = 00000007
  TransferBuffer       = 00000000
  TransferBufferMDL    = 81cf5428
  UrbLink              = 00000000
[112712 ms] UsbSnoop - DispatchAny(f890e610) : IRP_MJ_INTERNAL_DEVICE_CONTROL
[112712 ms] UsbSnoop - MyDispatchInternalIOCTL(f890fe80) : fdo=81c63810, Irp=822f3008, IRQL=2
[112712 ms]  >>>  URB 321 going down  >>> 
-- URB_FUNCTION_BULK_OR_INTERRUPT_TRANSFER:
  PipeHandle           = 81c9d144 [endpoint 0x00000081]
  TransferFlags        = 00000003 (USBD_TRANSFER_DIRECTION_IN, USBD_SHORT_TRANSFER_OK)
  TransferBufferLength = 00000100
  TransferBuffer       = 00000000
  TransferBufferMDL    = 81cf5428
  UrbLink              = 00000000
[112772 ms] UsbSnoop - MyInternalIOCTLCompletion(f890fdb0) : fido=822da020, Irp=822f3008, Context=8218afe8, IRQL=2
[112772 ms]  <<<  URB 321 coming back  <<< 
-- URB_FUNCTION_BULK_OR_INTERRUPT_TRANSFER:
  PipeHandle           = 81c9d144 [endpoint 0x00000081]
  TransferFlags        = 00000003 (USBD_TRANSFER_DIRECTION_IN, USBD_SHORT_TRANSFER_OK)
  TransferBufferLength = 00000095
  TransferBuffer       = 00000000
  TransferBufferMDL    = 81cf5428
    00000000: 00 00 00 90 04 00 00 00 8a 00 08 00 0e 00 0b 00
    00000010: 00 04 00 02 28 00 00 04 00 00 02 00 03 00 06 00
    00000020: 00 01 09 00 07 00 00 01 01 00 01 00 00 04 00 00
    00000030: 00 0a 00 02 00 00 19 54 49 2d 38 34 20 50 6c 75
    00000040: 73 20 53 69 6c 76 65 72 20 45 64 69 74 69 6f 6e
    00000050: 00 0a 00 00 01 01 00 37 00 00 01 01 00 0d 00 00
    00000060: 08 00 00 00 00 00 00 5e fd 00 38 00 00 01 00 00
    00000070: 09 00 00 04 00 01 00 00 00 0e 00 00 08 00 00 00
    00000080: 00 00 00 5e f4 00 2d 00 00 01 01 00 03 00 00 05
    00000090: 0a 32 cc e3 01
  UrbLink              = 00000000
[112813 ms] UsbSnoop - DispatchAny(f890e610) : IRP_MJ_INTERNAL_DEVICE_CONTROL
[112813 ms] UsbSnoop - MyDispatchInternalIOCTL(f890fe80) : fdo=81c63810, Irp=822f3008, IRQL=2
[112813 ms]  >>>  URB 322 going down  >>> 
-- URB_FUNCTION_BULK_OR_INTERRUPT_TRANSFER:
  PipeHandle           = 81c9d164 [endpoint 0x00000002]
  TransferFlags        = 00000000 (USBD_TRANSFER_DIRECTION_OUT, ~USBD_SHORT_TRANSFER_OK)
  TransferBufferLength = 00000007
  TransferBuffer       = 00000000
  TransferBufferMDL    = 81cf5428
    00000000: 00 00 00 02 05 e0 00
  UrbLink              = 00000000
[112814 ms] UsbSnoop - MyInternalIOCTLCompletion(f890fdb0) : fido=822da020, Irp=822f3008, Context=81c9a480, IRQL=2
[112814 ms]  <<<  URB 322 coming back  <<< 
-- URB_FUNCTION_BULK_OR_INTERRUPT_TRANSFER:
  PipeHandle           = 81c9d164 [endpoint 0x00000002]
  TransferFlags        = 00000000 (USBD_TRANSFER_DIRECTION_OUT, ~USBD_SHORT_TRANSFER_OK)
  TransferBufferLength = 00000007
  TransferBuffer       = 00000000
  TransferBufferMDL    = 81cf5428
  UrbLink              = 00000000
[113073 ms] UsbSnoop - DispatchAny(f890e610) : IRP_MJ_INTERNAL_DEVICE_CONTROL
[113073 ms] UsbSnoop - MyDispatchInternalIOCTL(f890fe80) : fdo=81c63810, Irp=822f3008, IRQL=2
[113073 ms]  >>>  URB 323 going down  >>> 
-- URB_FUNCTION_BULK_OR_INTERRUPT_TRANSFER:
  PipeHandle           = 81c9d164 [endpoint 0x00000002]
  TransferFlags        = 00000000 (USBD_TRANSFER_DIRECTION_OUT, ~USBD_SHORT_TRANSFER_OK)
  TransferBufferLength = 00000009
  TransferBuffer       = 00000000
  TransferBufferMDL    = 81cf5428
    00000000: 00 00 00 04 01 00 00 04 00
  UrbLink              = 00000000
[113074 ms] UsbSnoop - MyInternalIOCTLCompletion(f890fdb0) : fido=822da020, Irp=822f3008, Context=8218afe8, IRQL=2
[113074 ms]  <<<  URB 323 coming back  <<< 
-- URB_FUNCTION_BULK_OR_INTERRUPT_TRANSFER:
  PipeHandle           = 81c9d164 [endpoint 0x00000002]
  TransferFlags        = 00000000 (USBD_TRANSFER_DIRECTION_OUT, ~USBD_SHORT_TRANSFER_OK)
  TransferBufferLength = 00000009
  TransferBuffer       = 00000000
  TransferBufferMDL    = 81cf5428
  UrbLink              = 00000000
[113074 ms] UsbSnoop - DispatchAny(f890e610) : IRP_MJ_INTERNAL_DEVICE_CONTROL
[113074 ms] UsbSnoop - MyDispatchInternalIOCTL(f890fe80) : fdo=81c63810, Irp=822f3008, IRQL=2
[113074 ms]  >>>  URB 324 going down  >>> 
-- URB_FUNCTION_BULK_OR_INTERRUPT_TRANSFER:
  PipeHandle           = 81c9d144 [endpoint 0x00000081]
  TransferFlags        = 00000003 (USBD_TRANSFER_DIRECTION_IN, USBD_SHORT_TRANSFER_OK)
  TransferBufferLength = 00000100
  TransferBuffer       = 00000000
  TransferBufferMDL    = 81cf5428
  UrbLink              = 00000000
[113085 ms] UsbSnoop - MyInternalIOCTLCompletion(f890fdb0) : fido=822da020, Irp=822f3008, Context=81ba5340, IRQL=2
[113085 ms]  <<<  URB 324 coming back  <<< 
-- URB_FUNCTION_BULK_OR_INTERRUPT_TRANSFER:
  PipeHandle           = 81c9d144 [endpoint 0x00000081]
  TransferFlags        = 00000003 (USBD_TRANSFER_DIRECTION_IN, USBD_SHORT_TRANSFER_OK)
  TransferBufferLength = 00000009
  TransferBuffer       = 00000000
  TransferBufferMDL    = 81cf5428
    00000000: 00 00 00 04 02 00 00 00 fa
  UrbLink              = 00000000
[113113 ms] UsbSnoop - DispatchAny(f890e610) : IRP_MJ_INTERNAL_DEVICE_CONTROL
[113113 ms] UsbSnoop - MyDispatchInternalIOCTL(f890fe80) : fdo=81c63810, Irp=822f3008, IRQL=2
[113113 ms]  >>>  URB 325 going down  >>> 
-- URB_FUNCTION_BULK_OR_INTERRUPT_TRANSFER:
  PipeHandle           = 81c9d164 [endpoint 0x00000002]
  TransferFlags        = 00000000 (USBD_TRANSFER_DIRECTION_OUT, ~USBD_SHORT_TRANSFER_OK)
  TransferBufferLength = 00000015
  TransferBuffer       = 00000000
  TransferBufferMDL    = 81cf5428
    00000000: 00 00 00 10 04 00 00 00 0a 00 01 00 03 00 01 00
    00000010: 00 00 00 07 d0
  UrbLink              = 00000000
[113113 ms] UsbSnoop - MyInternalIOCTLCompletion(f890fdb0) : fido=822da020, Irp=822f3008, Context=81c9a480, IRQL=2
[113113 ms]  <<<  URB 325 coming back  <<< 
-- URB_FUNCTION_BULK_OR_INTERRUPT_TRANSFER:
  PipeHandle           = 81c9d164 [endpoint 0x00000002]
  TransferFlags        = 00000000 (USBD_TRANSFER_DIRECTION_OUT, ~USBD_SHORT_TRANSFER_OK)
  TransferBufferLength = 00000015
  TransferBuffer       = 00000000
  TransferBufferMDL    = 81cf5428
  UrbLink              = 00000000
[113123 ms] UsbSnoop - DispatchAny(f890e610) : IRP_MJ_INTERNAL_DEVICE_CONTROL
[113123 ms] UsbSnoop - MyDispatchInternalIOCTL(f890fe80) : fdo=81c63810, Irp=822f3008, IRQL=2
[113123 ms]  >>>  URB 326 going down  >>> 
-- URB_FUNCTION_BULK_OR_INTERRUPT_TRANSFER:
  PipeHandle           = 81c9d144 [endpoint 0x00000081]
  TransferFlags        = 00000003 (USBD_TRANSFER_DIRECTION_IN, USBD_SHORT_TRANSFER_OK)
  TransferBufferLength = 00000100
  TransferBuffer       = 00000000
  TransferBufferMDL    = 81cf5428
  UrbLink              = 00000000
[113123 ms] UsbSnoop - MyInternalIOCTLCompletion(f890fdb0) : fido=822da020, Irp=822f3008, Context=81bc6e50, IRQL=2
[113123 ms]  <<<  URB 326 coming back  <<< 
-- URB_FUNCTION_BULK_OR_INTERRUPT_TRANSFER:
  PipeHandle           = 81c9d144 [endpoint 0x00000081]
  TransferFlags        = 00000003 (USBD_TRANSFER_DIRECTION_IN, USBD_SHORT_TRANSFER_OK)
  TransferBufferLength = 00000007
  TransferBuffer       = 00000000
  TransferBufferMDL    = 81cf5428
    00000000: 00 00 00 02 05 e0 00
  UrbLink              = 00000000
[113163 ms] UsbSnoop - DispatchAny(f890e610) : IRP_MJ_INTERNAL_DEVICE_CONTROL
[113163 ms] UsbSnoop - MyDispatchInternalIOCTL(f890fe80) : fdo=81c63810, Irp=822f3008, IRQL=2
[113163 ms]  >>>  URB 327 going down  >>> 
-- URB_FUNCTION_BULK_OR_INTERRUPT_TRANSFER:
  PipeHandle           = 81c9d144 [endpoint 0x00000081]
  TransferFlags        = 00000003 (USBD_TRANSFER_DIRECTION_IN, USBD_SHORT_TRANSFER_OK)
  TransferBufferLength = 00000100
  TransferBuffer       = 00000000
  TransferBufferMDL    = 81cf5428
  UrbLink              = 00000000
[113163 ms] UsbSnoop - MyInternalIOCTLCompletion(f890fdb0) : fido=822da020, Irp=822f3008, Context=81c9a480, IRQL=2
[113163 ms]  <<<  URB 327 coming back  <<< 
-- URB_FUNCTION_BULK_OR_INTERRUPT_TRANSFER:
  PipeHandle           = 81c9d144 [endpoint 0x00000081]
  TransferFlags        = 00000003 (USBD_TRANSFER_DIRECTION_IN, USBD_SHORT_TRANSFER_OK)
  TransferBufferLength = 0000000f
  TransferBuffer       = 00000000
  TransferBufferMDL    = 81cf5428
    00000000: 00 00 00 0a 04 00 00 00 04 00 12 00 00 07 d0
  UrbLink              = 00000000
[113203 ms] UsbSnoop - DispatchAny(f890e610) : IRP_MJ_INTERNAL_DEVICE_CONTROL
[113203 ms] UsbSnoop - MyDispatchInternalIOCTL(f890fe80) : fdo=81c63810, Irp=822f3008, IRQL=2
[113203 ms]  >>>  URB 328 going down  >>> 
-- URB_FUNCTION_BULK_OR_INTERRUPT_TRANSFER:
  PipeHandle           = 81c9d164 [endpoint 0x00000002]
  TransferFlags        = 00000000 (USBD_TRANSFER_DIRECTION_OUT, ~USBD_SHORT_TRANSFER_OK)
  TransferBufferLength = 00000007
  TransferBuffer       = 00000000
  TransferBufferMDL    = 81cf5428
    00000000: 00 00 00 02 05 e0 00
  UrbLink              = 00000000
[113203 ms] UsbSnoop - MyInternalIOCTLCompletion(f890fdb0) : fido=822da020, Irp=822f3008, Context=81c72a40, IRQL=2
[113203 ms]  <<<  URB 328 coming back  <<< 
-- URB_FUNCTION_BULK_OR_INTERRUPT_TRANSFER:
  PipeHandle           = 81c9d164 [endpoint 0x00000002]
  TransferFlags        = 00000000 (USBD_TRANSFER_DIRECTION_OUT, ~USBD_SHORT_TRANSFER_OK)
  TransferBufferLength = 00000007
  TransferBuffer       = 00000000
  TransferBufferMDL    = 81cf5428
  UrbLink              = 00000000
[113213 ms] UsbSnoop - DispatchAny(f890e610) : IRP_MJ_INTERNAL_DEVICE_CONTROL
[113213 ms] UsbSnoop - MyDispatchInternalIOCTL(f890fe80) : fdo=81c63810, Irp=822f3008, IRQL=2
[113213 ms]  >>>  URB 329 going down  >>> 
-- URB_FUNCTION_BULK_OR_INTERRUPT_TRANSFER:
  PipeHandle           = 81c9d164 [endpoint 0x00000002]
  TransferFlags        = 00000000 (USBD_TRANSFER_DIRECTION_OUT, ~USBD_SHORT_TRANSFER_OK)
  TransferBufferLength = 0000000f
  TransferBuffer       = 00000000
  TransferBufferMDL    = 81cf5428
    00000000: 00 00 00 0a 04 00 00 00 04 00 07 00 01 00 31
  UrbLink              = 00000000
[113213 ms] UsbSnoop - MyInternalIOCTLCompletion(f890fdb0) : fido=822da020, Irp=822f3008, Context=81c9a480, IRQL=2
[113213 ms]  <<<  URB 329 coming back  <<< 
-- URB_FUNCTION_BULK_OR_INTERRUPT_TRANSFER:
  PipeHandle           = 81c9d164 [endpoint 0x00000002]
  TransferFlags        = 00000000 (USBD_TRANSFER_DIRECTION_OUT, ~USBD_SHORT_TRANSFER_OK)
  TransferBufferLength = 0000000f
  TransferBuffer       = 00000000
  TransferBufferMDL    = 81cf5428
  UrbLink              = 00000000
[113223 ms] UsbSnoop - DispatchAny(f890e610) : IRP_MJ_INTERNAL_DEVICE_CONTROL
[113223 ms] UsbSnoop - MyDispatchInternalIOCTL(f890fe80) : fdo=81c63810, Irp=822f3008, IRQL=2
[113223 ms]  >>>  URB 330 going down  >>> 
-- URB_FUNCTION_BULK_OR_INTERRUPT_TRANSFER:
  PipeHandle           = 81c9d144 [endpoint 0x00000081]
  TransferFlags        = 00000003 (USBD_TRANSFER_DIRECTION_IN, USBD_SHORT_TRANSFER_OK)
  TransferBufferLength = 00000100
  TransferBuffer       = 00000000
  TransferBufferMDL    = 81cf5428
  UrbLink              = 00000000
[113224 ms] UsbSnoop - MyInternalIOCTLCompletion(f890fdb0) : fido=822da020, Irp=822f3008, Context=8218afe8, IRQL=2
[113224 ms]  <<<  URB 330 coming back  <<< 
-- URB_FUNCTION_BULK_OR_INTERRUPT_TRANSFER:
  PipeHandle           = 81c9d144 [endpoint 0x00000081]
  TransferFlags        = 00000003 (USBD_TRANSFER_DIRECTION_IN, USBD_SHORT_TRANSFER_OK)
  TransferBufferLength = 00000007
  TransferBuffer       = 00000000
  TransferBufferMDL    = 81cf5428
    00000000: 00 00 00 02 05 e0 00
  UrbLink              = 00000000
[113263 ms] UsbSnoop - DispatchAny(f890e610) : IRP_MJ_INTERNAL_DEVICE_CONTROL
[113263 ms] UsbSnoop - MyDispatchInternalIOCTL(f890fe80) : fdo=81c63810, Irp=822f3008, IRQL=2
[113263 ms]  >>>  URB 331 going down  >>> 
-- URB_FUNCTION_BULK_OR_INTERRUPT_TRANSFER:
  PipeHandle           = 81c9d144 [endpoint 0x00000081]
  TransferFlags        = 00000003 (USBD_TRANSFER_DIRECTION_IN, USBD_SHORT_TRANSFER_OK)
  TransferBufferLength = 00000100
  TransferBuffer       = 00000000
  TransferBufferMDL    = 81cf5428
  UrbLink              = 00000000
[113263 ms] UsbSnoop - MyInternalIOCTLCompletion(f890fdb0) : fido=822da020, Irp=822f3008, Context=81ba5340, IRQL=2
[113263 ms]  <<<  URB 331 coming back  <<< 
-- URB_FUNCTION_BULK_OR_INTERRUPT_TRANSFER:
  PipeHandle           = 81c9d144 [endpoint 0x00000081]
  TransferFlags        = 00000003 (USBD_TRANSFER_DIRECTION_IN, USBD_SHORT_TRANSFER_OK)
  TransferBufferLength = 0000000f
  TransferBuffer       = 00000000
  TransferBufferMDL    = 81cf5428
    00000000: 00 00 00 0a 04 00 00 00 04 bb 00 00 01 d4 c0
  UrbLink              = 00000000
[113303 ms] UsbSnoop - DispatchAny(f890e610) : IRP_MJ_INTERNAL_DEVICE_CONTROL
[113303 ms] UsbSnoop - MyDispatchInternalIOCTL(f890fe80) : fdo=81c63810, Irp=822f3008, IRQL=2
[113303 ms]  >>>  URB 332 going down  >>> 
-- URB_FUNCTION_BULK_OR_INTERRUPT_TRANSFER:
  PipeHandle           = 81c9d164 [endpoint 0x00000002]
  TransferFlags        = 00000000 (USBD_TRANSFER_DIRECTION_OUT, ~USBD_SHORT_TRANSFER_OK)
  TransferBufferLength = 00000007
  TransferBuffer       = 00000000
  TransferBufferMDL    = 81cf5428
    00000000: 00 00 00 02 05 e0 00
  UrbLink              = 00000000
[113303 ms] UsbSnoop - MyInternalIOCTLCompletion(f890fdb0) : fido=822da020, Irp=822f3008, Context=81c9a480, IRQL=2
[113303 ms]  <<<  URB 332 coming back  <<< 
-- URB_FUNCTION_BULK_OR_INTERRUPT_TRANSFER:
  PipeHandle           = 81c9d164 [endpoint 0x00000002]
  TransferFlags        = 00000000 (USBD_TRANSFER_DIRECTION_OUT, ~USBD_SHORT_TRANSFER_OK)
  TransferBufferLength = 00000007
  TransferBuffer       = 00000000
  TransferBufferMDL    = 81cf5428
  UrbLink              = 00000000
[113313 ms] UsbSnoop - DispatchAny(f890e610) : IRP_MJ_INTERNAL_DEVICE_CONTROL
[113313 ms] UsbSnoop - MyDispatchInternalIOCTL(f890fe80) : fdo=81c63810, Irp=822f3008, IRQL=2
[113313 ms]  >>>  URB 333 going down  >>> 
-- URB_FUNCTION_BULK_OR_INTERRUPT_TRANSFER:
  PipeHandle           = 81c9d144 [endpoint 0x00000081]
  TransferFlags        = 00000003 (USBD_TRANSFER_DIRECTION_IN, USBD_SHORT_TRANSFER_OK)
  TransferBufferLength = 00000100
  TransferBuffer       = 00000000
  TransferBufferMDL    = 81cf5428
  UrbLink              = 00000000
[121112 ms] UsbSnoop - MyInternalIOCTLCompletion(f890fdb0) : fido=822da020, Irp=822f3008, Context=81ba5340, IRQL=2
[121112 ms]  <<<  URB 333 coming back  <<< 
-- URB_FUNCTION_BULK_OR_INTERRUPT_TRANSFER:
  PipeHandle           = 81c9d144 [endpoint 0x00000081]
  TransferFlags        = 00000003 (USBD_TRANSFER_DIRECTION_IN, USBD_SHORT_TRANSFER_OK)
  TransferBufferLength = 000000ff
  TransferBuffer       = 00000000
  TransferBufferMDL    = 81cf5428
    00000000: 00 00 00 fa 03 00 00 03 fe 00 08 00 01 00 31 00
    00000010: 03 f7 0a 15 0a 32 cc e3 01 0a 2d 40 00 00 00 00
    00000020: 00 00 00 00 00 00 00 00 00 00 00 00 00 00 00 00
    00000030: 00 00 00 00 00 00 00 00 00 00 00 00 00 00 00 00
    00000040: 00 00 00 00 00 00 00 00 00 00 00 00 00 00 00 00
    00000050: 00 00 00 00 00 00 00 00 00 00 00 00 04 12 21 18
    00000060: 03 26 09 04 0b d4 31 b0 02 0d 40 a4 f7 87 78 b9
    00000070: da 56 1a 21 97 57 2e 90 de 87 7a 0b 6c 5f 63 2c
    00000080: 01 8a 32 17 9b 65 73 af b1 a1 1b 2f 0c 0b 67 b8
    00000090: f7 84 22 44 04 bd 33 76 f8 06 2e 82 57 ff 63 a1
    000000a0: c9 27 8e f4 46 8e b1 ea 96 c3 9a 80 0f 00 00 00
    000000b0: 00 80 11 0a 80 21 02 80 31 28 80 a1 03 80 81 12
    000000c0: 80 7f 00 00 00 00 02 0d 40 50 ed 7d 34 7b 37 b2
    000000d0: 6e 5f d9 b6 60 23 55 a0 8d 68 42 da 55 bd a0 50
    000000e0: 64 2e b3 12 f9 b8 a9 1d 29 9d 90 7e 15 18 66 1d
    000000f0: aa 74 03 e8 78 c4 3c e6 b3 0e d2 d9 c9 eb 6b
  UrbLink              = 00000000
[121158 ms] UsbSnoop - DispatchAny(f890e610) : IRP_MJ_INTERNAL_DEVICE_CONTROL
[121158 ms] UsbSnoop - MyDispatchInternalIOCTL(f890fe80) : fdo=81c63810, Irp=822f3008, IRQL=2
[121158 ms]  >>>  URB 334 going down  >>> 
-- URB_FUNCTION_BULK_OR_INTERRUPT_TRANSFER:
  PipeHandle           = 81c9d164 [endpoint 0x00000002]
  TransferFlags        = 00000000 (USBD_TRANSFER_DIRECTION_OUT, ~USBD_SHORT_TRANSFER_OK)
  TransferBufferLength = 00000007
  TransferBuffer       = 00000000
  TransferBufferMDL    = 81cf5428
    00000000: 00 00 00 02 05 e0 00
  UrbLink              = 00000000
[121158 ms] UsbSnoop - MyInternalIOCTLCompletion(f890fdb0) : fido=822da020, Irp=822f3008, Context=81c72a40, IRQL=2
[121158 ms]  <<<  URB 334 coming back  <<< 
-- URB_FUNCTION_BULK_OR_INTERRUPT_TRANSFER:
  PipeHandle           = 81c9d164 [endpoint 0x00000002]
  TransferFlags        = 00000000 (USBD_TRANSFER_DIRECTION_OUT, ~USBD_SHORT_TRANSFER_OK)
  TransferBufferLength = 00000007
  TransferBuffer       = 00000000
  TransferBufferMDL    = 81cf5428
  UrbLink              = 00000000
[121165 ms] UsbSnoop - DispatchAny(f890e610) : IRP_MJ_INTERNAL_DEVICE_CONTROL
[121165 ms] UsbSnoop - MyDispatchInternalIOCTL(f890fe80) : fdo=81c63810, Irp=822f3008, IRQL=2
[121165 ms]  >>>  URB 335 going down  >>> 
-- URB_FUNCTION_BULK_OR_INTERRUPT_TRANSFER:
  PipeHandle           = 81c9d144 [endpoint 0x00000081]
  TransferFlags        = 00000003 (USBD_TRANSFER_DIRECTION_IN, USBD_SHORT_TRANSFER_OK)
  TransferBufferLength = 00000100
  TransferBuffer       = 00000000
  TransferBufferMDL    = 81cf5428
  UrbLink              = 00000000
[121189 ms] UsbSnoop - MyInternalIOCTLCompletion(f890fdb0) : fido=822da020, Irp=822f3008, Context=81c72a40, IRQL=2
[121189 ms]  <<<  URB 335 coming back  <<< 
-- URB_FUNCTION_BULK_OR_INTERRUPT_TRANSFER:
  PipeHandle           = 81c9d144 [endpoint 0x00000081]
  TransferFlags        = 00000003 (USBD_TRANSFER_DIRECTION_IN, USBD_SHORT_TRANSFER_OK)
  TransferBufferLength = 000000ff
  TransferBuffer       = 00000000
  TransferBufferMDL    = 81cf5428
    00000000: 00 00 00 fa 03 7a 96 13 d4 71 3b eb 0c 01 6c ff
    00000010: ff ff ff ff ff ff ff ff ff ff ff ff ff ff ff ff
    00000020: ff ff ff ff ff ff ff ff ff ff ff ff ff ff ff ff
    00000030: ff ff ff ff ff ff ff ff ff ff ff ff ff ff ff ff
    00000040: ff ff ff ff ff ff ff ff ff ff ff ff ff ff ff ff
    00000050: ff ff ff ff ff ff ff ff ff ff ff ff ff ff ff ff
    00000060: ff ff ff ff ff ff ff ff ff ff ff ff ff ff ff ff
    00000070: ff ff ff ff ff ff ff ff ff ff ff ff ff ff ff ff
    00000080: ff ff ff ff ff ff ff ff ff ff ff ff ff ff ff ff
    00000090: ff ff ff ff ff ff ff ff ff ff ff ff ff ff ff ff
    000000a0: ff ff ff ff ff ff ff ff ff ff ff ff ff ff ff ff
    000000b0: ff ff ff ff ff ff ff ff ff ff ff ff ff ff ff ff
    000000c0: ff ff ff ff ff ff ff ff ff ff ff ff ff ff ff ff
    000000d0: ff ff ff ff ff ff ff ff ff ff ff ff ff ff ff ff
    000000e0: ff ff ff ff ff ff ff ff ff ff ff ff ff ff ff ff
    000000f0: ff ff ff ff ff ff ff ff ff ff ff ff ff ff ff
  UrbLink              = 00000000
[121226 ms] UsbSnoop - DispatchAny(f890e610) : IRP_MJ_INTERNAL_DEVICE_CONTROL
[121226 ms] UsbSnoop - MyDispatchInternalIOCTL(f890fe80) : fdo=81c63810, Irp=822f3008, IRQL=2
[121226 ms]  >>>  URB 336 going down  >>> 
-- URB_FUNCTION_BULK_OR_INTERRUPT_TRANSFER:
  PipeHandle           = 81c9d164 [endpoint 0x00000002]
  TransferFlags        = 00000000 (USBD_TRANSFER_DIRECTION_OUT, ~USBD_SHORT_TRANSFER_OK)
  TransferBufferLength = 00000007
  TransferBuffer       = 00000000
  TransferBufferMDL    = 81cf5428
    00000000: 00 00 00 02 05 e0 00
  UrbLink              = 00000000
[121226 ms] UsbSnoop - MyInternalIOCTLCompletion(f890fdb0) : fido=822da020, Irp=822f3008, Context=81bc6e50, IRQL=2
[121226 ms]  <<<  URB 336 coming back  <<< 
-- URB_FUNCTION_BULK_OR_INTERRUPT_TRANSFER:
  PipeHandle           = 81c9d164 [endpoint 0x00000002]
  TransferFlags        = 00000000 (USBD_TRANSFER_DIRECTION_OUT, ~USBD_SHORT_TRANSFER_OK)
  TransferBufferLength = 00000007
  TransferBuffer       = 00000000
  TransferBufferMDL    = 81cf5428
  UrbLink              = 00000000
[121236 ms] UsbSnoop - DispatchAny(f890e610) : IRP_MJ_INTERNAL_DEVICE_CONTROL
[121236 ms] UsbSnoop - MyDispatchInternalIOCTL(f890fe80) : fdo=81c63810, Irp=822f3008, IRQL=2
[121236 ms]  >>>  URB 337 going down  >>> 
-- URB_FUNCTION_BULK_OR_INTERRUPT_TRANSFER:
  PipeHandle           = 81c9d144 [endpoint 0x00000081]
  TransferFlags        = 00000003 (USBD_TRANSFER_DIRECTION_IN, USBD_SHORT_TRANSFER_OK)
  TransferBufferLength = 00000100
  TransferBuffer       = 00000000
  TransferBufferMDL    = 81cf5428
  UrbLink              = 00000000
[121257 ms] UsbSnoop - MyInternalIOCTLCompletion(f890fdb0) : fido=822da020, Irp=822f3008, Context=81c72a40, IRQL=2
[121257 ms]  <<<  URB 337 coming back  <<< 
-- URB_FUNCTION_BULK_OR_INTERRUPT_TRANSFER:
  PipeHandle           = 81c9d144 [endpoint 0x00000081]
  TransferFlags        = 00000003 (USBD_TRANSFER_DIRECTION_IN, USBD_SHORT_TRANSFER_OK)
  TransferBufferLength = 000000ff
  TransferBuffer       = 00000000
  TransferBufferMDL    = 81cf5428
    00000000: 00 00 00 fa 03 ff ff ff ff ff ff ff ff ff ff ff
    00000010: ff ff ff ff ff ff ff ff ff ff ff ff ff ff ff ff
    00000020: ff ff ff ff ff ff ff ff ff ff ff ff ff ff ff ff
    00000030: ff ff ff ff ff ff ff ff ff ff ff ff ff ff ff ff
    00000040: ff ff ff ff ff ff ff ff ff ff ff ff ff ff ff ff
    00000050: ff ff ff ff ff ff ff ff ff ff ff ff ff ff ff ff
    00000060: ff ff ff ff ff ff ff ff ff ff ff ff ff ff ff ff
    00000070: ff ff ff ff ff ff ff ff ff ff ff ff ff ff ff ff
    00000080: ff ff ff ff ff ff ff ff ff ff ff ff ff ff ff ff
    00000090: ff ff ff ff ff ff ff ff ff ff ff ff ff ff ff ff
    000000a0: ff ff ff ff ff ff ff ff ff ff ff ff ff ff ff ff
    000000b0: ff ff ff ff ff ff ff ff ff ff ff ff ff ff ff ff
    000000c0: ff ff ff ff ff ff ff ff ff ff ff ff ff ff ff ff
    000000d0: ff ff ff ff ff ff ff ff ff ff ff ff ff ff ff ff
    000000e0: ff ff ff ff ff ff ff ff ff ff ff ff ff ff ff ff
    000000f0: ff ff ff ff ff ff ff ff ff ff ff ff ff ff ff
  UrbLink              = 00000000
[121296 ms] UsbSnoop - DispatchAny(f890e610) : IRP_MJ_INTERNAL_DEVICE_CONTROL
[121296 ms] UsbSnoop - MyDispatchInternalIOCTL(f890fe80) : fdo=81c63810, Irp=822f3008, IRQL=2
[121296 ms]  >>>  URB 338 going down  >>> 
-- URB_FUNCTION_BULK_OR_INTERRUPT_TRANSFER:
  PipeHandle           = 81c9d164 [endpoint 0x00000002]
  TransferFlags        = 00000000 (USBD_TRANSFER_DIRECTION_OUT, ~USBD_SHORT_TRANSFER_OK)
  TransferBufferLength = 00000007
  TransferBuffer       = 00000000
  TransferBufferMDL    = 81cf5428
    00000000: 00 00 00 02 05 e0 00
  UrbLink              = 00000000
[121296 ms] UsbSnoop - MyInternalIOCTLCompletion(f890fdb0) : fido=822da020, Irp=822f3008, Context=81c9a480, IRQL=2
[121296 ms]  <<<  URB 338 coming back  <<< 
-- URB_FUNCTION_BULK_OR_INTERRUPT_TRANSFER:
  PipeHandle           = 81c9d164 [endpoint 0x00000002]
  TransferFlags        = 00000000 (USBD_TRANSFER_DIRECTION_OUT, ~USBD_SHORT_TRANSFER_OK)
  TransferBufferLength = 00000007
  TransferBuffer       = 00000000
  TransferBufferMDL    = 81cf5428
  UrbLink              = 00000000
[121306 ms] UsbSnoop - DispatchAny(f890e610) : IRP_MJ_INTERNAL_DEVICE_CONTROL
[121306 ms] UsbSnoop - MyDispatchInternalIOCTL(f890fe80) : fdo=81c63810, Irp=822f3008, IRQL=2
[121306 ms]  >>>  URB 339 going down  >>> 
-- URB_FUNCTION_BULK_OR_INTERRUPT_TRANSFER:
  PipeHandle           = 81c9d144 [endpoint 0x00000081]
  TransferFlags        = 00000003 (USBD_TRANSFER_DIRECTION_IN, USBD_SHORT_TRANSFER_OK)
  TransferBufferLength = 00000100
  TransferBuffer       = 00000000
  TransferBufferMDL    = 81cf5428
  UrbLink              = 00000000
[121327 ms] UsbSnoop - MyInternalIOCTLCompletion(f890fdb0) : fido=822da020, Irp=822f3008, Context=81c72a40, IRQL=2
[121327 ms]  <<<  URB 339 coming back  <<< 
-- URB_FUNCTION_BULK_OR_INTERRUPT_TRANSFER:
  PipeHandle           = 81c9d144 [endpoint 0x00000081]
  TransferFlags        = 00000003 (USBD_TRANSFER_DIRECTION_IN, USBD_SHORT_TRANSFER_OK)
  TransferBufferLength = 000000ff
  TransferBuffer       = 00000000
  TransferBufferMDL    = 81cf5428
    00000000: 00 00 00 fa 03 ff ff ff ff ff ff ff ff ff ff ff
    00000010: ff ff ff ff ff ff ff ff ff ff ff ff ff ff ff ff
    00000020: ff ff ff ff ff ff ff ff ff ff ff ff ff ff ff ff
    00000030: ff ff ff ff ff ff ff ff ff ff ff ff ff ff ff ff
    00000040: ff ff ff ff ff ff ff ff ff ff ff ff ff ff ff ff
    00000050: ff ff ff ff ff ff ff ff ff ff ff ff ff ff ff ff
    00000060: ff ff ff ff ff ff ff ff ff ff ff ff ff ff ff ff
    00000070: ff ff ff ff ff ff ff ff ff ff ff ff ff ff ff ff
    00000080: ff ff ff ff ff ff ff ff ff ff ff ff ff ff ff ff
    00000090: ff ff ff ff ff ff ff ff ff ff ff ff ff ff ff ff
    000000a0: ff ff ff ff ff ff ff ff ff ff ff ff ff ff ff ff
    000000b0: ff ff ff ff ff ff ff ff ff ff ff ff ff ff ff ff
    000000c0: ff ff ff ff ff ff ff ff ff ff ff ff ff ff ff ff
    000000d0: ff ff ff ff ff ff ff ff ff ff ff ff ff ff ff ff
    000000e0: ff ff ff ff ff ff ff ff ff ff ff ff ff ff ff ff
    000000f0: ff ff ff ff ff ff ff ff ff ff ff 00 00 00 00
  UrbLink              = 00000000
[121366 ms] UsbSnoop - DispatchAny(f890e610) : IRP_MJ_INTERNAL_DEVICE_CONTROL
[121366 ms] UsbSnoop - MyDispatchInternalIOCTL(f890fe80) : fdo=81c63810, Irp=822f4950, IRQL=2
[121366 ms]  >>>  URB 340 going down  >>> 
-- URB_FUNCTION_BULK_OR_INTERRUPT_TRANSFER:
  PipeHandle           = 81c9d164 [endpoint 0x00000002]
  TransferFlags        = 00000000 (USBD_TRANSFER_DIRECTION_OUT, ~USBD_SHORT_TRANSFER_OK)
  TransferBufferLength = 00000007
  TransferBuffer       = 00000000
  TransferBufferMDL    = 81d03558
    00000000: 00 00 00 02 05 e0 00
  UrbLink              = 00000000
[121367 ms] UsbSnoop - MyInternalIOCTLCompletion(f890fdb0) : fido=822da020, Irp=822f4950, Context=81bc6e50, IRQL=2
[121367 ms]  <<<  URB 340 coming back  <<< 
-- URB_FUNCTION_BULK_OR_INTERRUPT_TRANSFER:
  PipeHandle           = 81c9d164 [endpoint 0x00000002]
  TransferFlags        = 00000000 (USBD_TRANSFER_DIRECTION_OUT, ~USBD_SHORT_TRANSFER_OK)
  TransferBufferLength = 00000007
  TransferBuffer       = 00000000
  TransferBufferMDL    = 81d03558
  UrbLink              = 00000000
[121376 ms] UsbSnoop - DispatchAny(f890e610) : IRP_MJ_INTERNAL_DEVICE_CONTROL
[121376 ms] UsbSnoop - MyDispatchInternalIOCTL(f890fe80) : fdo=81c63810, Irp=822f3008, IRQL=2
[121376 ms]  >>>  URB 341 going down  >>> 
-- URB_FUNCTION_BULK_OR_INTERRUPT_TRANSFER:
  PipeHandle           = 81c9d144 [endpoint 0x00000081]
  TransferFlags        = 00000003 (USBD_TRANSFER_DIRECTION_IN, USBD_SHORT_TRANSFER_OK)
  TransferBufferLength = 00000100
  TransferBuffer       = 00000000
  TransferBufferMDL    = 81cf5428
  UrbLink              = 00000000
[121860 ms] UsbSnoop - MyInternalIOCTLCompletion(f890fdb0) : fido=822da020, Irp=822f3008, Context=81bb6320, IRQL=2
[121860 ms]  <<<  URB 341 coming back  <<< 
-- URB_FUNCTION_BULK_OR_INTERRUPT_TRANSFER:
  PipeHandle           = 81c9d144 [endpoint 0x00000081]
  TransferFlags        = 00000003 (USBD_TRANSFER_DIRECTION_IN, USBD_SHORT_TRANSFER_OK)
  TransferBufferLength = 00000021
  TransferBuffer       = 00000000
  TransferBufferMDL    = 81cf5428
    00000000: 00 00 00 1c 04 00 00 00 00 00 00 00 00 fc ff ff
    00000010: ff ff ff ff ff ff ff ff ff ff ff ff ff ff ff ff
    00000020: ff
  UrbLink              = 00000000
[121897 ms] UsbSnoop - DispatchAny(f890e610) : IRP_MJ_INTERNAL_DEVICE_CONTROL
[121897 ms] UsbSnoop - MyDispatchInternalIOCTL(f890fe80) : fdo=81c63810, Irp=822f3008, IRQL=2
[121897 ms]  >>>  URB 342 going down  >>> 
-- URB_FUNCTION_BULK_OR_INTERRUPT_TRANSFER:
  PipeHandle           = 81c9d164 [endpoint 0x00000002]
  TransferFlags        = 00000000 (USBD_TRANSFER_DIRECTION_OUT, ~USBD_SHORT_TRANSFER_OK)
  TransferBufferLength = 00000007
  TransferBuffer       = 00000000
  TransferBufferMDL    = 81cf5428
    00000000: 00 00 00 02 05 e0 00
  UrbLink              = 00000000
[121897 ms] UsbSnoop - MyInternalIOCTLCompletion(f890fdb0) : fido=822da020, Irp=822f3008, Context=81bc6e50, IRQL=2
[121897 ms]  <<<  URB 342 coming back  <<< 
-- URB_FUNCTION_BULK_OR_INTERRUPT_TRANSFER:
  PipeHandle           = 81c9d164 [endpoint 0x00000002]
  TransferFlags        = 00000000 (USBD_TRANSFER_DIRECTION_OUT, ~USBD_SHORT_TRANSFER_OK)
  TransferBufferLength = 00000007
  TransferBuffer       = 00000000
  TransferBufferMDL    = 81cf5428
  UrbLink              = 00000000
[122157 ms] UsbSnoop - DispatchAny(f890e610) : IRP_MJ_INTERNAL_DEVICE_CONTROL
[122157 ms] UsbSnoop - MyDispatchInternalIOCTL(f890fe80) : fdo=81c63810, Irp=822f3008, IRQL=2
[122157 ms]  >>>  URB 343 going down  >>> 
-- URB_FUNCTION_BULK_OR_INTERRUPT_TRANSFER:
  PipeHandle           = 81c9d164 [endpoint 0x00000002]
  TransferFlags        = 00000000 (USBD_TRANSFER_DIRECTION_OUT, ~USBD_SHORT_TRANSFER_OK)
  TransferBufferLength = 00000009
  TransferBuffer       = 00000000
  TransferBufferMDL    = 81cf5428
    00000000: 00 00 00 04 01 00 00 04 00
  UrbLink              = 00000000
[122157 ms] UsbSnoop - MyInternalIOCTLCompletion(f890fdb0) : fido=822da020, Irp=822f3008, Context=81ba5340, IRQL=2
[122157 ms]  <<<  URB 343 coming back  <<< 
-- URB_FUNCTION_BULK_OR_INTERRUPT_TRANSFER:
  PipeHandle           = 81c9d164 [endpoint 0x00000002]
  TransferFlags        = 00000000 (USBD_TRANSFER_DIRECTION_OUT, ~USBD_SHORT_TRANSFER_OK)
  TransferBufferLength = 00000009
  TransferBuffer       = 00000000
  TransferBufferMDL    = 81cf5428
  UrbLink              = 00000000
[122158 ms] UsbSnoop - DispatchAny(f890e610) : IRP_MJ_INTERNAL_DEVICE_CONTROL
[122158 ms] UsbSnoop - MyDispatchInternalIOCTL(f890fe80) : fdo=81c63810, Irp=822f3008, IRQL=2
[122158 ms]  >>>  URB 344 going down  >>> 
-- URB_FUNCTION_BULK_OR_INTERRUPT_TRANSFER:
  PipeHandle           = 81c9d144 [endpoint 0x00000081]
  TransferFlags        = 00000003 (USBD_TRANSFER_DIRECTION_IN, USBD_SHORT_TRANSFER_OK)
  TransferBufferLength = 00000100
  TransferBuffer       = 00000000
  TransferBufferMDL    = 81cf5428
  UrbLink              = 00000000
[122169 ms] UsbSnoop - MyInternalIOCTLCompletion(f890fdb0) : fido=822da020, Irp=822f3008, Context=81ba5340, IRQL=2
[122169 ms]  <<<  URB 344 coming back  <<< 
-- URB_FUNCTION_BULK_OR_INTERRUPT_TRANSFER:
  PipeHandle           = 81c9d144 [endpoint 0x00000081]
  TransferFlags        = 00000003 (USBD_TRANSFER_DIRECTION_IN, USBD_SHORT_TRANSFER_OK)
  TransferBufferLength = 00000009
  TransferBuffer       = 00000000
  TransferBufferMDL    = 81cf5428
    00000000: 00 00 00 04 02 00 00 00 fa
  UrbLink              = 00000000
[122200 ms] UsbSnoop - DispatchAny(f890e610) : IRP_MJ_INTERNAL_DEVICE_CONTROL
[122200 ms] UsbSnoop - MyDispatchInternalIOCTL(f890fe80) : fdo=81c63810, Irp=822f3008, IRQL=2
[122200 ms]  >>>  URB 345 going down  >>> 
-- URB_FUNCTION_BULK_OR_INTERRUPT_TRANSFER:
  PipeHandle           = 81c9d164 [endpoint 0x00000002]
  TransferFlags        = 00000000 (USBD_TRANSFER_DIRECTION_OUT, ~USBD_SHORT_TRANSFER_OK)
  TransferBufferLength = 00000015
  TransferBuffer       = 00000000
  TransferBufferMDL    = 81cf5428
    00000000: 00 00 00 10 04 00 00 00 0a 00 01 00 03 00 01 00
    00000010: 00 00 00 07 d0
  UrbLink              = 00000000
[122200 ms] UsbSnoop - MyInternalIOCTLCompletion(f890fdb0) : fido=822da020, Irp=822f3008, Context=81c72a40, IRQL=2
[122200 ms]  <<<  URB 345 coming back  <<< 
-- URB_FUNCTION_BULK_OR_INTERRUPT_TRANSFER:
  PipeHandle           = 81c9d164 [endpoint 0x00000002]
  TransferFlags        = 00000000 (USBD_TRANSFER_DIRECTION_OUT, ~USBD_SHORT_TRANSFER_OK)
  TransferBufferLength = 00000015
  TransferBuffer       = 00000000
  TransferBufferMDL    = 81cf5428
  UrbLink              = 00000000
[122207 ms] UsbSnoop - DispatchAny(f890e610) : IRP_MJ_INTERNAL_DEVICE_CONTROL
[122207 ms] UsbSnoop - MyDispatchInternalIOCTL(f890fe80) : fdo=81c63810, Irp=822f3008, IRQL=2
[122207 ms]  >>>  URB 346 going down  >>> 
-- URB_FUNCTION_BULK_OR_INTERRUPT_TRANSFER:
  PipeHandle           = 81c9d144 [endpoint 0x00000081]
  TransferFlags        = 00000003 (USBD_TRANSFER_DIRECTION_IN, USBD_SHORT_TRANSFER_OK)
  TransferBufferLength = 00000100
  TransferBuffer       = 00000000
  TransferBufferMDL    = 81cf5428
  UrbLink              = 00000000
[122207 ms] UsbSnoop - MyInternalIOCTLCompletion(f890fdb0) : fido=822da020, Irp=822f3008, Context=81bc6e50, IRQL=2
[122207 ms]  <<<  URB 346 coming back  <<< 
-- URB_FUNCTION_BULK_OR_INTERRUPT_TRANSFER:
  PipeHandle           = 81c9d144 [endpoint 0x00000081]
  TransferFlags        = 00000003 (USBD_TRANSFER_DIRECTION_IN, USBD_SHORT_TRANSFER_OK)
  TransferBufferLength = 00000007
  TransferBuffer       = 00000000
  TransferBufferMDL    = 81cf5428
    00000000: 00 00 00 02 05 e0 00
  UrbLink              = 00000000
[122249 ms] UsbSnoop - DispatchAny(f890e610) : IRP_MJ_INTERNAL_DEVICE_CONTROL
[122249 ms] UsbSnoop - MyDispatchInternalIOCTL(f890fe80) : fdo=81c63810, Irp=822f3008, IRQL=2
[122249 ms]  >>>  URB 347 going down  >>> 
-- URB_FUNCTION_BULK_OR_INTERRUPT_TRANSFER:
  PipeHandle           = 81c9d144 [endpoint 0x00000081]
  TransferFlags        = 00000003 (USBD_TRANSFER_DIRECTION_IN, USBD_SHORT_TRANSFER_OK)
  TransferBufferLength = 00000100
  TransferBuffer       = 00000000
  TransferBufferMDL    = 81cf5428
  UrbLink              = 00000000
[122249 ms] UsbSnoop - MyInternalIOCTLCompletion(f890fdb0) : fido=822da020, Irp=822f3008, Context=81c72a40, IRQL=2
[122249 ms]  <<<  URB 347 coming back  <<< 
-- URB_FUNCTION_BULK_OR_INTERRUPT_TRANSFER:
  PipeHandle           = 81c9d144 [endpoint 0x00000081]
  TransferFlags        = 00000003 (USBD_TRANSFER_DIRECTION_IN, USBD_SHORT_TRANSFER_OK)
  TransferBufferLength = 0000000f
  TransferBuffer       = 00000000
  TransferBufferMDL    = 81cf5428
    00000000: 00 00 00 0a 04 00 00 00 04 00 12 00 00 07 d0
  UrbLink              = 00000000
[122287 ms] UsbSnoop - DispatchAny(f890e610) : IRP_MJ_INTERNAL_DEVICE_CONTROL
[122287 ms] UsbSnoop - MyDispatchInternalIOCTL(f890fe80) : fdo=81c63810, Irp=822f3008, IRQL=2
[122287 ms]  >>>  URB 348 going down  >>> 
-- URB_FUNCTION_BULK_OR_INTERRUPT_TRANSFER:
  PipeHandle           = 81c9d164 [endpoint 0x00000002]
  TransferFlags        = 00000000 (USBD_TRANSFER_DIRECTION_OUT, ~USBD_SHORT_TRANSFER_OK)
  TransferBufferLength = 00000007
  TransferBuffer       = 00000000
  TransferBufferMDL    = 81cf5428
    00000000: 00 00 00 02 05 e0 00
  UrbLink              = 00000000
[122288 ms] UsbSnoop - MyInternalIOCTLCompletion(f890fdb0) : fido=822da020, Irp=822f3008, Context=81c9a480, IRQL=2
[122288 ms]  <<<  URB 348 coming back  <<< 
-- URB_FUNCTION_BULK_OR_INTERRUPT_TRANSFER:
  PipeHandle           = 81c9d164 [endpoint 0x00000002]
  TransferFlags        = 00000000 (USBD_TRANSFER_DIRECTION_OUT, ~USBD_SHORT_TRANSFER_OK)
  TransferBufferLength = 00000007
  TransferBuffer       = 00000000
  TransferBufferMDL    = 81cf5428
  UrbLink              = 00000000
[122297 ms] UsbSnoop - DispatchAny(f890e610) : IRP_MJ_INTERNAL_DEVICE_CONTROL
[122297 ms] UsbSnoop - MyDispatchInternalIOCTL(f890fe80) : fdo=81c63810, Irp=822f3008, IRQL=2
[122297 ms]  >>>  URB 349 going down  >>> 
-- URB_FUNCTION_BULK_OR_INTERRUPT_TRANSFER:
  PipeHandle           = 81c9d164 [endpoint 0x00000002]
  TransferFlags        = 00000000 (USBD_TRANSFER_DIRECTION_OUT, ~USBD_SHORT_TRANSFER_OK)
  TransferBufferLength = 0000002b
  TransferBuffer       = 00000000
  TransferBufferMDL    = 81cf5428
    00000000: 00 00 00 26 04 00 00 00 20 00 0b 00 01 41 00 00
    00000010: 00 00 09 01 00 03 00 02 00 04 f0 07 00 00 00 03
    00000020: 00 01 00 00 08 00 04 00 00 00 00
  UrbLink              = 00000000
[122298 ms] UsbSnoop - MyInternalIOCTLCompletion(f890fdb0) : fido=822da020, Irp=822f3008, Context=81bc6e50, IRQL=2
[122298 ms]  <<<  URB 349 coming back  <<< 
-- URB_FUNCTION_BULK_OR_INTERRUPT_TRANSFER:
  PipeHandle           = 81c9d164 [endpoint 0x00000002]
  TransferFlags        = 00000000 (USBD_TRANSFER_DIRECTION_OUT, ~USBD_SHORT_TRANSFER_OK)
  TransferBufferLength = 0000002b
  TransferBuffer       = 00000000
  TransferBufferMDL    = 81cf5428
  UrbLink              = 00000000
[122307 ms] UsbSnoop - DispatchAny(f890e610) : IRP_MJ_INTERNAL_DEVICE_CONTROL
[122307 ms] UsbSnoop - MyDispatchInternalIOCTL(f890fe80) : fdo=81c63810, Irp=822f3008, IRQL=2
[122307 ms]  >>>  URB 350 going down  >>> 
-- URB_FUNCTION_BULK_OR_INTERRUPT_TRANSFER:
  PipeHandle           = 81c9d144 [endpoint 0x00000081]
  TransferFlags        = 00000003 (USBD_TRANSFER_DIRECTION_IN, USBD_SHORT_TRANSFER_OK)
  TransferBufferLength = 00000100
  TransferBuffer       = 00000000
  TransferBufferMDL    = 81cf5428
  UrbLink              = 00000000
[122310 ms] UsbSnoop - MyInternalIOCTLCompletion(f890fdb0) : fido=822da020, Irp=822f3008, Context=81c9a480, IRQL=2
[122310 ms]  <<<  URB 350 coming back  <<< 
-- URB_FUNCTION_BULK_OR_INTERRUPT_TRANSFER:
  PipeHandle           = 81c9d144 [endpoint 0x00000081]
  TransferFlags        = 00000003 (USBD_TRANSFER_DIRECTION_IN, USBD_SHORT_TRANSFER_OK)
  TransferBufferLength = 00000007
  TransferBuffer       = 00000000
  TransferBufferMDL    = 81cf5428
    00000000: 00 00 00 02 05 e0 00
  UrbLink              = 00000000
[122348 ms] UsbSnoop - DispatchAny(f890e610) : IRP_MJ_INTERNAL_DEVICE_CONTROL
[122348 ms] UsbSnoop - MyDispatchInternalIOCTL(f890fe80) : fdo=81c63810, Irp=822f3008, IRQL=2
[122348 ms]  >>>  URB 351 going down  >>> 
-- URB_FUNCTION_BULK_OR_INTERRUPT_TRANSFER:
  PipeHandle           = 81c9d144 [endpoint 0x00000081]
  TransferFlags        = 00000003 (USBD_TRANSFER_DIRECTION_IN, USBD_SHORT_TRANSFER_OK)
  TransferBufferLength = 00000100
  TransferBuffer       = 00000000
  TransferBufferMDL    = 81cf5428
  UrbLink              = 00000000
[122348 ms] UsbSnoop - MyInternalIOCTLCompletion(f890fdb0) : fido=822da020, Irp=822f3008, Context=81c72a40, IRQL=2
[122348 ms]  <<<  URB 351 coming back  <<< 
-- URB_FUNCTION_BULK_OR_INTERRUPT_TRANSFER:
  PipeHandle           = 81c9d144 [endpoint 0x00000081]
  TransferFlags        = 00000003 (USBD_TRANSFER_DIRECTION_IN, USBD_SHORT_TRANSFER_OK)
  TransferBufferLength = 0000000c
  TransferBuffer       = 00000000
  TransferBufferMDL    = 81cf5428
    00000000: 00 00 00 07 04 00 00 00 01 aa 00 01
  UrbLink              = 00000000
[122388 ms] UsbSnoop - DispatchAny(f890e610) : IRP_MJ_INTERNAL_DEVICE_CONTROL
[122388 ms] UsbSnoop - MyDispatchInternalIOCTL(f890fe80) : fdo=81c63810, Irp=822f4950, IRQL=2
[122388 ms]  >>>  URB 352 going down  >>> 
-- URB_FUNCTION_BULK_OR_INTERRUPT_TRANSFER:
  PipeHandle           = 81c9d164 [endpoint 0x00000002]
  TransferFlags        = 00000000 (USBD_TRANSFER_DIRECTION_OUT, ~USBD_SHORT_TRANSFER_OK)
  TransferBufferLength = 00000007
  TransferBuffer       = 00000000
  TransferBufferMDL    = 81cf5428
    00000000: 00 00 00 02 05 e0 00
  UrbLink              = 00000000
[122388 ms] UsbSnoop - MyInternalIOCTLCompletion(f890fdb0) : fido=822da020, Irp=822f4950, Context=81c9a480, IRQL=2
[122388 ms]  <<<  URB 352 coming back  <<< 
-- URB_FUNCTION_BULK_OR_INTERRUPT_TRANSFER:
  PipeHandle           = 81c9d164 [endpoint 0x00000002]
  TransferFlags        = 00000000 (USBD_TRANSFER_DIRECTION_OUT, ~USBD_SHORT_TRANSFER_OK)
  TransferBufferLength = 00000007
  TransferBuffer       = 00000000
  TransferBufferMDL    = 81cf5428
  UrbLink              = 00000000
[122397 ms] UsbSnoop - DispatchAny(f890e610) : IRP_MJ_INTERNAL_DEVICE_CONTROL
[122397 ms] UsbSnoop - MyDispatchInternalIOCTL(f890fe80) : fdo=81c63810, Irp=822f4950, IRQL=2
[122397 ms]  >>>  URB 353 going down  >>> 
-- URB_FUNCTION_BULK_OR_INTERRUPT_TRANSFER:
  PipeHandle           = 81c9d164 [endpoint 0x00000002]
  TransferFlags        = 00000000 (USBD_TRANSFER_DIRECTION_OUT, ~USBD_SHORT_TRANSFER_OK)
  TransferBufferLength = 00000014
  TransferBuffer       = 00000000
  TransferBufferMDL    = 81cf5428
    00000000: 00 00 00 0f 04 00 00 00 09 00 0d 00 80 10 00 00
    00000010: 00 00 00 00
  UrbLink              = 00000000
[122398 ms] UsbSnoop - MyInternalIOCTLCompletion(f890fdb0) : fido=822da020, Irp=822f4950, Context=81cda2e0, IRQL=2
[122398 ms]  <<<  URB 353 coming back  <<< 
-- URB_FUNCTION_BULK_OR_INTERRUPT_TRANSFER:
  PipeHandle           = 81c9d164 [endpoint 0x00000002]
  TransferFlags        = 00000000 (USBD_TRANSFER_DIRECTION_OUT, ~USBD_SHORT_TRANSFER_OK)
  TransferBufferLength = 00000014
  TransferBuffer       = 00000000
  TransferBufferMDL    = 81cf5428
  UrbLink              = 00000000
[122407 ms] UsbSnoop - DispatchAny(f890e610) : IRP_MJ_INTERNAL_DEVICE_CONTROL
[122407 ms] UsbSnoop - MyDispatchInternalIOCTL(f890fe80) : fdo=81c63810, Irp=822f4950, IRQL=2
[122407 ms]  >>>  URB 354 going down  >>> 
-- URB_FUNCTION_BULK_OR_INTERRUPT_TRANSFER:
  PipeHandle           = 81c9d144 [endpoint 0x00000081]
  TransferFlags        = 00000003 (USBD_TRANSFER_DIRECTION_IN, USBD_SHORT_TRANSFER_OK)
  TransferBufferLength = 00000100
  TransferBuffer       = 00000000
  TransferBufferMDL    = 81cf5428
  UrbLink              = 00000000
[122408 ms] UsbSnoop - MyInternalIOCTLCompletion(f890fdb0) : fido=822da020, Irp=822f4950, Context=81bb6320, IRQL=2
[122408 ms]  <<<  URB 354 coming back  <<< 
-- URB_FUNCTION_BULK_OR_INTERRUPT_TRANSFER:
  PipeHandle           = 81c9d144 [endpoint 0x00000081]
  TransferFlags        = 00000003 (USBD_TRANSFER_DIRECTION_IN, USBD_SHORT_TRANSFER_OK)
  TransferBufferLength = 00000007
  TransferBuffer       = 00000000
  TransferBufferMDL    = 81cf5428
    00000000: 00 00 00 02 05 e0 00
  UrbLink              = 00000000
[122450 ms] UsbSnoop - DispatchAny(f890e610) : IRP_MJ_INTERNAL_DEVICE_CONTROL
[122450 ms] UsbSnoop - MyDispatchInternalIOCTL(f890fe80) : fdo=81c63810, Irp=822f4950, IRQL=2
[122450 ms]  >>>  URB 355 going down  >>> 
-- URB_FUNCTION_BULK_OR_INTERRUPT_TRANSFER:
  PipeHandle           = 81c9d144 [endpoint 0x00000081]
  TransferFlags        = 00000003 (USBD_TRANSFER_DIRECTION_IN, USBD_SHORT_TRANSFER_OK)
  TransferBufferLength = 00000100
  TransferBuffer       = 00000000
  TransferBufferMDL    = 81cf5428
  UrbLink              = 00000000
[122450 ms] UsbSnoop - MyInternalIOCTLCompletion(f890fdb0) : fido=822da020, Irp=822f4950, Context=81c9a480, IRQL=2
[122450 ms]  <<<  URB 355 coming back  <<< 
-- URB_FUNCTION_BULK_OR_INTERRUPT_TRANSFER:
  PipeHandle           = 81c9d144 [endpoint 0x00000081]
  TransferFlags        = 00000003 (USBD_TRANSFER_DIRECTION_IN, USBD_SHORT_TRANSFER_OK)
  TransferBufferLength = 0000000c
  TransferBuffer       = 00000000
  TransferBufferMDL    = 81cf5428
    00000000: 00 00 00 07 04 00 00 00 01 aa 00 01
  UrbLink              = 00000000
[122488 ms] UsbSnoop - DispatchAny(f890e610) : IRP_MJ_INTERNAL_DEVICE_CONTROL
[122488 ms] UsbSnoop - MyDispatchInternalIOCTL(f890fe80) : fdo=81c63810, Irp=822f4950, IRQL=2
[122488 ms]  >>>  URB 356 going down  >>> 
-- URB_FUNCTION_BULK_OR_INTERRUPT_TRANSFER:
  PipeHandle           = 81c9d164 [endpoint 0x00000002]
  TransferFlags        = 00000000 (USBD_TRANSFER_DIRECTION_OUT, ~USBD_SHORT_TRANSFER_OK)
  TransferBufferLength = 00000007
  TransferBuffer       = 00000000
  TransferBufferMDL    = 81cf5428
    00000000: 00 00 00 02 05 e0 00
  UrbLink              = 00000000
[122488 ms] UsbSnoop - MyInternalIOCTLCompletion(f890fdb0) : fido=822da020, Irp=822f4950, Context=81bb6320, IRQL=2
[122488 ms]  <<<  URB 356 coming back  <<< 
-- URB_FUNCTION_BULK_OR_INTERRUPT_TRANSFER:
  PipeHandle           = 81c9d164 [endpoint 0x00000002]
  TransferFlags        = 00000000 (USBD_TRANSFER_DIRECTION_OUT, ~USBD_SHORT_TRANSFER_OK)
  TransferBufferLength = 00000007
  TransferBuffer       = 00000000
  TransferBufferMDL    = 81cf5428
  UrbLink              = 00000000
[122498 ms] UsbSnoop - DispatchAny(f890e610) : IRP_MJ_INTERNAL_DEVICE_CONTROL
[122498 ms] UsbSnoop - MyDispatchInternalIOCTL(f890fe80) : fdo=81c63810, Irp=822f4950, IRQL=2
[122498 ms]  >>>  URB 357 going down  >>> 
-- URB_FUNCTION_BULK_OR_INTERRUPT_TRANSFER:
  PipeHandle           = 81c9d164 [endpoint 0x00000002]
  TransferFlags        = 00000000 (USBD_TRANSFER_DIRECTION_OUT, ~USBD_SHORT_TRANSFER_OK)
  TransferBufferLength = 0000000b
  TransferBuffer       = 00000000
  TransferBufferMDL    = 81cf5428
    00000000: 00 00 00 06 04 00 00 00 00 dd 00
  UrbLink              = 00000000
[122498 ms] UsbSnoop - MyInternalIOCTLCompletion(f890fdb0) : fido=822da020, Irp=822f4950, Context=81cda2e0, IRQL=2
[122498 ms]  <<<  URB 357 coming back  <<< 
-- URB_FUNCTION_BULK_OR_INTERRUPT_TRANSFER:
  PipeHandle           = 81c9d164 [endpoint 0x00000002]
  TransferFlags        = 00000000 (USBD_TRANSFER_DIRECTION_OUT, ~USBD_SHORT_TRANSFER_OK)
  TransferBufferLength = 0000000b
  TransferBuffer       = 00000000
  TransferBufferMDL    = 81cf5428
  UrbLink              = 00000000
[122508 ms] UsbSnoop - DispatchAny(f890e610) : IRP_MJ_INTERNAL_DEVICE_CONTROL
[122508 ms] UsbSnoop - MyDispatchInternalIOCTL(f890fe80) : fdo=81c63810, Irp=822f4950, IRQL=2
[122508 ms]  >>>  URB 358 going down  >>> 
-- URB_FUNCTION_BULK_OR_INTERRUPT_TRANSFER:
  PipeHandle           = 81c9d144 [endpoint 0x00000081]
  TransferFlags        = 00000003 (USBD_TRANSFER_DIRECTION_IN, USBD_SHORT_TRANSFER_OK)
  TransferBufferLength = 00000100
  TransferBuffer       = 00000000
  TransferBufferMDL    = 81cf5428
  UrbLink              = 00000000
[122508 ms] UsbSnoop - MyInternalIOCTLCompletion(f890fdb0) : fido=822da020, Irp=822f4950, Context=81bb6320, IRQL=2
[122508 ms]  <<<  URB 358 coming back  <<< 
-- URB_FUNCTION_BULK_OR_INTERRUPT_TRANSFER:
  PipeHandle           = 81c9d144 [endpoint 0x00000081]
  TransferFlags        = 00000003 (USBD_TRANSFER_DIRECTION_IN, USBD_SHORT_TRANSFER_OK)
  TransferBufferLength = 00000007
  TransferBuffer       = 00000000
  TransferBufferMDL    = 81cf5428
    00000000: 00 00 00 02 05 e0 00
  UrbLink              = 00000000
[122798 ms] UsbSnoop - DispatchAny(f890e610) : IRP_MJ_INTERNAL_DEVICE_CONTROL
[122798 ms] UsbSnoop - MyDispatchInternalIOCTL(f890fe80) : fdo=81c63810, Irp=822f4950, IRQL=2
[122798 ms]  >>>  URB 359 going down  >>> 
-- URB_FUNCTION_BULK_OR_INTERRUPT_TRANSFER:
  PipeHandle           = 81c9d164 [endpoint 0x00000002]
  TransferFlags        = 00000000 (USBD_TRANSFER_DIRECTION_OUT, ~USBD_SHORT_TRANSFER_OK)
  TransferBufferLength = 00000009
  TransferBuffer       = 00000000
  TransferBufferMDL    = 81cf5428
    00000000: 00 00 00 04 01 00 00 04 00
  UrbLink              = 00000000
[122798 ms] UsbSnoop - MyInternalIOCTLCompletion(f890fdb0) : fido=822da020, Irp=822f4950, Context=81c72a40, IRQL=2
[122798 ms]  <<<  URB 359 coming back  <<< 
-- URB_FUNCTION_BULK_OR_INTERRUPT_TRANSFER:
  PipeHandle           = 81c9d164 [endpoint 0x00000002]
  TransferFlags        = 00000000 (USBD_TRANSFER_DIRECTION_OUT, ~USBD_SHORT_TRANSFER_OK)
  TransferBufferLength = 00000009
  TransferBuffer       = 00000000
  TransferBufferMDL    = 81cf5428
  UrbLink              = 00000000
[122799 ms] UsbSnoop - DispatchAny(f890e610) : IRP_MJ_INTERNAL_DEVICE_CONTROL
[122799 ms] UsbSnoop - MyDispatchInternalIOCTL(f890fe80) : fdo=81c63810, Irp=822f4950, IRQL=2
[122799 ms]  >>>  URB 360 going down  >>> 
-- URB_FUNCTION_BULK_OR_INTERRUPT_TRANSFER:
  PipeHandle           = 81c9d144 [endpoint 0x00000081]
  TransferFlags        = 00000003 (USBD_TRANSFER_DIRECTION_IN, USBD_SHORT_TRANSFER_OK)
  TransferBufferLength = 00000100
  TransferBuffer       = 00000000
  TransferBufferMDL    = 81cf5428
  UrbLink              = 00000000
[122809 ms] UsbSnoop - MyInternalIOCTLCompletion(f890fdb0) : fido=822da020, Irp=822f4950, Context=81ba5340, IRQL=2
[122809 ms]  <<<  URB 360 coming back  <<< 
-- URB_FUNCTION_BULK_OR_INTERRUPT_TRANSFER:
  PipeHandle           = 81c9d144 [endpoint 0x00000081]
  TransferFlags        = 00000003 (USBD_TRANSFER_DIRECTION_IN, USBD_SHORT_TRANSFER_OK)
  TransferBufferLength = 00000009
  TransferBuffer       = 00000000
  TransferBufferMDL    = 81cf5428
    00000000: 00 00 00 04 02 00 00 00 fa
  UrbLink              = 00000000
[122840 ms] UsbSnoop - DispatchAny(f890e610) : IRP_MJ_INTERNAL_DEVICE_CONTROL
[122840 ms] UsbSnoop - MyDispatchInternalIOCTL(f890fe80) : fdo=81c63810, Irp=822f4950, IRQL=2
[122840 ms]  >>>  URB 361 going down  >>> 
-- URB_FUNCTION_BULK_OR_INTERRUPT_TRANSFER:
  PipeHandle           = 81c9d164 [endpoint 0x00000002]
  TransferFlags        = 00000000 (USBD_TRANSFER_DIRECTION_OUT, ~USBD_SHORT_TRANSFER_OK)
  TransferBufferLength = 00000015
  TransferBuffer       = 00000000
  TransferBufferMDL    = 81cf5428
    00000000: 00 00 00 10 04 00 00 00 0a 00 01 00 03 00 01 00
    00000010: 00 00 00 07 d0
  UrbLink              = 00000000
[122841 ms] UsbSnoop - MyInternalIOCTLCompletion(f890fdb0) : fido=822da020, Irp=822f4950, Context=81bb6320, IRQL=2
[122841 ms]  <<<  URB 361 coming back  <<< 
-- URB_FUNCTION_BULK_OR_INTERRUPT_TRANSFER:
  PipeHandle           = 81c9d164 [endpoint 0x00000002]
  TransferFlags        = 00000000 (USBD_TRANSFER_DIRECTION_OUT, ~USBD_SHORT_TRANSFER_OK)
  TransferBufferLength = 00000015
  TransferBuffer       = 00000000
  TransferBufferMDL    = 81cf5428
  UrbLink              = 00000000
[122849 ms] UsbSnoop - DispatchAny(f890e610) : IRP_MJ_INTERNAL_DEVICE_CONTROL
[122849 ms] UsbSnoop - MyDispatchInternalIOCTL(f890fe80) : fdo=81c63810, Irp=822f4950, IRQL=2
[122849 ms]  >>>  URB 362 going down  >>> 
-- URB_FUNCTION_BULK_OR_INTERRUPT_TRANSFER:
  PipeHandle           = 81c9d144 [endpoint 0x00000081]
  TransferFlags        = 00000003 (USBD_TRANSFER_DIRECTION_IN, USBD_SHORT_TRANSFER_OK)
  TransferBufferLength = 00000100
  TransferBuffer       = 00000000
  TransferBufferMDL    = 81cf5428
  UrbLink              = 00000000
[122849 ms] UsbSnoop - MyInternalIOCTLCompletion(f890fdb0) : fido=822da020, Irp=822f4950, Context=81ba5340, IRQL=2
[122849 ms]  <<<  URB 362 coming back  <<< 
-- URB_FUNCTION_BULK_OR_INTERRUPT_TRANSFER:
  PipeHandle           = 81c9d144 [endpoint 0x00000081]
  TransferFlags        = 00000003 (USBD_TRANSFER_DIRECTION_IN, USBD_SHORT_TRANSFER_OK)
  TransferBufferLength = 00000007
  TransferBuffer       = 00000000
  TransferBufferMDL    = 81cf5428
    00000000: 00 00 00 02 05 e0 00
  UrbLink              = 00000000
[122888 ms] UsbSnoop - DispatchAny(f890e610) : IRP_MJ_INTERNAL_DEVICE_CONTROL
[122888 ms] UsbSnoop - MyDispatchInternalIOCTL(f890fe80) : fdo=81c63810, Irp=822f4950, IRQL=2
[122888 ms]  >>>  URB 363 going down  >>> 
-- URB_FUNCTION_BULK_OR_INTERRUPT_TRANSFER:
  PipeHandle           = 81c9d144 [endpoint 0x00000081]
  TransferFlags        = 00000003 (USBD_TRANSFER_DIRECTION_IN, USBD_SHORT_TRANSFER_OK)
  TransferBufferLength = 00000100
  TransferBuffer       = 00000000
  TransferBufferMDL    = 81cf5428
  UrbLink              = 00000000
[122888 ms] UsbSnoop - MyInternalIOCTLCompletion(f890fdb0) : fido=822da020, Irp=822f4950, Context=81bc6e50, IRQL=2
[122888 ms]  <<<  URB 363 coming back  <<< 
-- URB_FUNCTION_BULK_OR_INTERRUPT_TRANSFER:
  PipeHandle           = 81c9d144 [endpoint 0x00000081]
  TransferFlags        = 00000003 (USBD_TRANSFER_DIRECTION_IN, USBD_SHORT_TRANSFER_OK)
  TransferBufferLength = 0000000f
  TransferBuffer       = 00000000
  TransferBufferMDL    = 81cf5428
    00000000: 00 00 00 0a 04 00 00 00 04 00 12 00 00 07 d0
  UrbLink              = 00000000
[122928 ms] UsbSnoop - DispatchAny(f890e610) : IRP_MJ_INTERNAL_DEVICE_CONTROL
[122928 ms] UsbSnoop - MyDispatchInternalIOCTL(f890fe80) : fdo=81c63810, Irp=822f4950, IRQL=2
[122928 ms]  >>>  URB 364 going down  >>> 
-- URB_FUNCTION_BULK_OR_INTERRUPT_TRANSFER:
  PipeHandle           = 81c9d164 [endpoint 0x00000002]
  TransferFlags        = 00000000 (USBD_TRANSFER_DIRECTION_OUT, ~USBD_SHORT_TRANSFER_OK)
  TransferBufferLength = 00000007
  TransferBuffer       = 00000000
  TransferBufferMDL    = 81cf5428
    00000000: 00 00 00 02 05 e0 00
  UrbLink              = 00000000
[122928 ms] UsbSnoop - MyInternalIOCTLCompletion(f890fdb0) : fido=822da020, Irp=822f4950, Context=81bb6320, IRQL=2
[122928 ms]  <<<  URB 364 coming back  <<< 
-- URB_FUNCTION_BULK_OR_INTERRUPT_TRANSFER:
  PipeHandle           = 81c9d164 [endpoint 0x00000002]
  TransferFlags        = 00000000 (USBD_TRANSFER_DIRECTION_OUT, ~USBD_SHORT_TRANSFER_OK)
  TransferBufferLength = 00000007
  TransferBuffer       = 00000000
  TransferBufferMDL    = 81cf5428
  UrbLink              = 00000000
[122938 ms] UsbSnoop - DispatchAny(f890e610) : IRP_MJ_INTERNAL_DEVICE_CONTROL
[122938 ms] UsbSnoop - MyDispatchInternalIOCTL(f890fe80) : fdo=81c63810, Irp=822f4950, IRQL=2
[122938 ms]  >>>  URB 365 going down  >>> 
-- URB_FUNCTION_BULK_OR_INTERRUPT_TRANSFER:
  PipeHandle           = 81c9d164 [endpoint 0x00000002]
  TransferFlags        = 00000000 (USBD_TRANSFER_DIRECTION_OUT, ~USBD_SHORT_TRANSFER_OK)
  TransferBufferLength = 0000002b
  TransferBuffer       = 00000000
  TransferBufferMDL    = 81cf5428
    00000000: 00 00 00 26 04 00 00 00 20 00 0b 00 01 42 00 00
    00000010: 00 00 09 01 00 03 00 02 00 04 f0 07 00 00 00 03
    00000020: 00 01 00 00 08 00 04 00 00 00 00
  UrbLink              = 00000000
[122939 ms] UsbSnoop - MyInternalIOCTLCompletion(f890fdb0) : fido=822da020, Irp=822f4950, Context=81c9a480, IRQL=2
[122939 ms]  <<<  URB 365 coming back  <<< 
-- URB_FUNCTION_BULK_OR_INTERRUPT_TRANSFER:
  PipeHandle           = 81c9d164 [endpoint 0x00000002]
  TransferFlags        = 00000000 (USBD_TRANSFER_DIRECTION_OUT, ~USBD_SHORT_TRANSFER_OK)
  TransferBufferLength = 0000002b
  TransferBuffer       = 00000000
  TransferBufferMDL    = 81cf5428
  UrbLink              = 00000000
[122948 ms] UsbSnoop - DispatchAny(f890e610) : IRP_MJ_INTERNAL_DEVICE_CONTROL
[122948 ms] UsbSnoop - MyDispatchInternalIOCTL(f890fe80) : fdo=81c63810, Irp=822f4950, IRQL=2
[122948 ms]  >>>  URB 366 going down  >>> 
-- URB_FUNCTION_BULK_OR_INTERRUPT_TRANSFER:
  PipeHandle           = 81c9d144 [endpoint 0x00000081]
  TransferFlags        = 00000003 (USBD_TRANSFER_DIRECTION_IN, USBD_SHORT_TRANSFER_OK)
  TransferBufferLength = 00000100
  TransferBuffer       = 00000000
  TransferBufferMDL    = 81cf5428
  UrbLink              = 00000000
[122950 ms] UsbSnoop - MyInternalIOCTLCompletion(f890fdb0) : fido=822da020, Irp=822f4950, Context=81bc6e50, IRQL=2
[122950 ms]  <<<  URB 366 coming back  <<< 
-- URB_FUNCTION_BULK_OR_INTERRUPT_TRANSFER:
  PipeHandle           = 81c9d144 [endpoint 0x00000081]
  TransferFlags        = 00000003 (USBD_TRANSFER_DIRECTION_IN, USBD_SHORT_TRANSFER_OK)
  TransferBufferLength = 00000007
  TransferBuffer       = 00000000
  TransferBufferMDL    = 81cf5428
    00000000: 00 00 00 02 05 e0 00
  UrbLink              = 00000000
[122988 ms] UsbSnoop - DispatchAny(f890e610) : IRP_MJ_INTERNAL_DEVICE_CONTROL
[122988 ms] UsbSnoop - MyDispatchInternalIOCTL(f890fe80) : fdo=81c63810, Irp=822f4950, IRQL=2
[122988 ms]  >>>  URB 367 going down  >>> 
-- URB_FUNCTION_BULK_OR_INTERRUPT_TRANSFER:
  PipeHandle           = 81c9d144 [endpoint 0x00000081]
  TransferFlags        = 00000003 (USBD_TRANSFER_DIRECTION_IN, USBD_SHORT_TRANSFER_OK)
  TransferBufferLength = 00000100
  TransferBuffer       = 00000000
  TransferBufferMDL    = 81cf5428
  UrbLink              = 00000000
[122989 ms] UsbSnoop - MyInternalIOCTLCompletion(f890fdb0) : fido=822da020, Irp=822f4950, Context=81bb6320, IRQL=2
[122989 ms]  <<<  URB 367 coming back  <<< 
-- URB_FUNCTION_BULK_OR_INTERRUPT_TRANSFER:
  PipeHandle           = 81c9d144 [endpoint 0x00000081]
  TransferFlags        = 00000003 (USBD_TRANSFER_DIRECTION_IN, USBD_SHORT_TRANSFER_OK)
  TransferBufferLength = 0000000c
  TransferBuffer       = 00000000
  TransferBufferMDL    = 81cf5428
    00000000: 00 00 00 07 04 00 00 00 01 aa 00 01
  UrbLink              = 00000000
[123028 ms] UsbSnoop - DispatchAny(f890e610) : IRP_MJ_INTERNAL_DEVICE_CONTROL
[123028 ms] UsbSnoop - MyDispatchInternalIOCTL(f890fe80) : fdo=81c63810, Irp=822f4950, IRQL=2
[123028 ms]  >>>  URB 368 going down  >>> 
-- URB_FUNCTION_BULK_OR_INTERRUPT_TRANSFER:
  PipeHandle           = 81c9d164 [endpoint 0x00000002]
  TransferFlags        = 00000000 (USBD_TRANSFER_DIRECTION_OUT, ~USBD_SHORT_TRANSFER_OK)
  TransferBufferLength = 00000007
  TransferBuffer       = 00000000
  TransferBufferMDL    = 81cf5428
    00000000: 00 00 00 02 05 e0 00
  UrbLink              = 00000000
[123029 ms] UsbSnoop - MyInternalIOCTLCompletion(f890fdb0) : fido=822da020, Irp=822f4950, Context=81c9a480, IRQL=2
[123029 ms]  <<<  URB 368 coming back  <<< 
-- URB_FUNCTION_BULK_OR_INTERRUPT_TRANSFER:
  PipeHandle           = 81c9d164 [endpoint 0x00000002]
  TransferFlags        = 00000000 (USBD_TRANSFER_DIRECTION_OUT, ~USBD_SHORT_TRANSFER_OK)
  TransferBufferLength = 00000007
  TransferBuffer       = 00000000
  TransferBufferMDL    = 81cf5428
  UrbLink              = 00000000
[123038 ms] UsbSnoop - DispatchAny(f890e610) : IRP_MJ_INTERNAL_DEVICE_CONTROL
[123038 ms] UsbSnoop - MyDispatchInternalIOCTL(f890fe80) : fdo=81c63810, Irp=822f4950, IRQL=2
[123038 ms]  >>>  URB 369 going down  >>> 
-- URB_FUNCTION_BULK_OR_INTERRUPT_TRANSFER:
  PipeHandle           = 81c9d164 [endpoint 0x00000002]
  TransferFlags        = 00000000 (USBD_TRANSFER_DIRECTION_OUT, ~USBD_SHORT_TRANSFER_OK)
  TransferBufferLength = 00000014
  TransferBuffer       = 00000000
  TransferBufferMDL    = 81cf5428
    00000000: 00 00 00 0f 04 00 00 00 09 00 0d 00 80 20 00 00
    00000010: 00 00 00 00
  UrbLink              = 00000000
[123039 ms] UsbSnoop - MyInternalIOCTLCompletion(f890fdb0) : fido=822da020, Irp=822f4950, Context=81bb6320, IRQL=2
[123039 ms]  <<<  URB 369 coming back  <<< 
-- URB_FUNCTION_BULK_OR_INTERRUPT_TRANSFER:
  PipeHandle           = 81c9d164 [endpoint 0x00000002]
  TransferFlags        = 00000000 (USBD_TRANSFER_DIRECTION_OUT, ~USBD_SHORT_TRANSFER_OK)
  TransferBufferLength = 00000014
  TransferBuffer       = 00000000
  TransferBufferMDL    = 81cf5428
  UrbLink              = 00000000
[123049 ms] UsbSnoop - DispatchAny(f890e610) : IRP_MJ_INTERNAL_DEVICE_CONTROL
[123049 ms] UsbSnoop - MyDispatchInternalIOCTL(f890fe80) : fdo=81c63810, Irp=822f4950, IRQL=2
[123049 ms]  >>>  URB 370 going down  >>> 
-- URB_FUNCTION_BULK_OR_INTERRUPT_TRANSFER:
  PipeHandle           = 81c9d144 [endpoint 0x00000081]
  TransferFlags        = 00000003 (USBD_TRANSFER_DIRECTION_IN, USBD_SHORT_TRANSFER_OK)
  TransferBufferLength = 00000100
  TransferBuffer       = 00000000
  TransferBufferMDL    = 81cf5428
  UrbLink              = 00000000
[123050 ms] UsbSnoop - MyInternalIOCTLCompletion(f890fdb0) : fido=822da020, Irp=822f4950, Context=81ba5340, IRQL=2
[123050 ms]  <<<  URB 370 coming back  <<< 
-- URB_FUNCTION_BULK_OR_INTERRUPT_TRANSFER:
  PipeHandle           = 81c9d144 [endpoint 0x00000081]
  TransferFlags        = 00000003 (USBD_TRANSFER_DIRECTION_IN, USBD_SHORT_TRANSFER_OK)
  TransferBufferLength = 00000007
  TransferBuffer       = 00000000
  TransferBufferMDL    = 81cf5428
    00000000: 00 00 00 02 05 e0 00
  UrbLink              = 00000000
[123089 ms] UsbSnoop - DispatchAny(f890e610) : IRP_MJ_INTERNAL_DEVICE_CONTROL
[123089 ms] UsbSnoop - MyDispatchInternalIOCTL(f890fe80) : fdo=81c63810, Irp=822f4950, IRQL=2
[123089 ms]  >>>  URB 371 going down  >>> 
-- URB_FUNCTION_BULK_OR_INTERRUPT_TRANSFER:
  PipeHandle           = 81c9d144 [endpoint 0x00000081]
  TransferFlags        = 00000003 (USBD_TRANSFER_DIRECTION_IN, USBD_SHORT_TRANSFER_OK)
  TransferBufferLength = 00000100
  TransferBuffer       = 00000000
  TransferBufferMDL    = 81cf5428
  UrbLink              = 00000000
[123089 ms] UsbSnoop - MyInternalIOCTLCompletion(f890fdb0) : fido=822da020, Irp=822f4950, Context=81bb6320, IRQL=2
[123089 ms]  <<<  URB 371 coming back  <<< 
-- URB_FUNCTION_BULK_OR_INTERRUPT_TRANSFER:
  PipeHandle           = 81c9d144 [endpoint 0x00000081]
  TransferFlags        = 00000003 (USBD_TRANSFER_DIRECTION_IN, USBD_SHORT_TRANSFER_OK)
  TransferBufferLength = 0000000c
  TransferBuffer       = 00000000
  TransferBufferMDL    = 81cf5428
    00000000: 00 00 00 07 04 00 00 00 01 aa 00 01
  UrbLink              = 00000000
[123129 ms] UsbSnoop - DispatchAny(f890e610) : IRP_MJ_INTERNAL_DEVICE_CONTROL
[123129 ms] UsbSnoop - MyDispatchInternalIOCTL(f890fe80) : fdo=81c63810, Irp=822f4950, IRQL=2
[123129 ms]  >>>  URB 372 going down  >>> 
-- URB_FUNCTION_BULK_OR_INTERRUPT_TRANSFER:
  PipeHandle           = 81c9d164 [endpoint 0x00000002]
  TransferFlags        = 00000000 (USBD_TRANSFER_DIRECTION_OUT, ~USBD_SHORT_TRANSFER_OK)
  TransferBufferLength = 00000007
  TransferBuffer       = 00000000
  TransferBufferMDL    = 81cf5428
    00000000: 00 00 00 02 05 e0 00
  UrbLink              = 00000000
[123129 ms] UsbSnoop - MyInternalIOCTLCompletion(f890fdb0) : fido=822da020, Irp=822f4950, Context=81c9a480, IRQL=2
[123129 ms]  <<<  URB 372 coming back  <<< 
-- URB_FUNCTION_BULK_OR_INTERRUPT_TRANSFER:
  PipeHandle           = 81c9d164 [endpoint 0x00000002]
  TransferFlags        = 00000000 (USBD_TRANSFER_DIRECTION_OUT, ~USBD_SHORT_TRANSFER_OK)
  TransferBufferLength = 00000007
  TransferBuffer       = 00000000
  TransferBufferMDL    = 81cf5428
  UrbLink              = 00000000
[123139 ms] UsbSnoop - DispatchAny(f890e610) : IRP_MJ_INTERNAL_DEVICE_CONTROL
[123139 ms] UsbSnoop - MyDispatchInternalIOCTL(f890fe80) : fdo=81c63810, Irp=822f4950, IRQL=2
[123139 ms]  >>>  URB 373 going down  >>> 
-- URB_FUNCTION_BULK_OR_INTERRUPT_TRANSFER:
  PipeHandle           = 81c9d164 [endpoint 0x00000002]
  TransferFlags        = 00000000 (USBD_TRANSFER_DIRECTION_OUT, ~USBD_SHORT_TRANSFER_OK)
  TransferBufferLength = 0000000b
  TransferBuffer       = 00000000
  TransferBufferMDL    = 81cf5428
    00000000: 00 00 00 06 04 00 00 00 00 dd 00
  UrbLink              = 00000000
[123139 ms] UsbSnoop - MyInternalIOCTLCompletion(f890fdb0) : fido=822da020, Irp=822f4950, Context=81bb6320, IRQL=2
[123139 ms]  <<<  URB 373 coming back  <<< 
-- URB_FUNCTION_BULK_OR_INTERRUPT_TRANSFER:
  PipeHandle           = 81c9d164 [endpoint 0x00000002]
  TransferFlags        = 00000000 (USBD_TRANSFER_DIRECTION_OUT, ~USBD_SHORT_TRANSFER_OK)
  TransferBufferLength = 0000000b
  TransferBuffer       = 00000000
  TransferBufferMDL    = 81cf5428
  UrbLink              = 00000000
[123149 ms] UsbSnoop - DispatchAny(f890e610) : IRP_MJ_INTERNAL_DEVICE_CONTROL
[123149 ms] UsbSnoop - MyDispatchInternalIOCTL(f890fe80) : fdo=81c63810, Irp=822f4950, IRQL=2
[123149 ms]  >>>  URB 374 going down  >>> 
-- URB_FUNCTION_BULK_OR_INTERRUPT_TRANSFER:
  PipeHandle           = 81c9d144 [endpoint 0x00000081]
  TransferFlags        = 00000003 (USBD_TRANSFER_DIRECTION_IN, USBD_SHORT_TRANSFER_OK)
  TransferBufferLength = 00000100
  TransferBuffer       = 00000000
  TransferBufferMDL    = 81cf5428
  UrbLink              = 00000000
[123149 ms] UsbSnoop - MyInternalIOCTLCompletion(f890fdb0) : fido=822da020, Irp=822f4950, Context=81cda2e0, IRQL=2
[123149 ms]  <<<  URB 374 coming back  <<< 
-- URB_FUNCTION_BULK_OR_INTERRUPT_TRANSFER:
  PipeHandle           = 81c9d144 [endpoint 0x00000081]
  TransferFlags        = 00000003 (USBD_TRANSFER_DIRECTION_IN, USBD_SHORT_TRANSFER_OK)
  TransferBufferLength = 00000007
  TransferBuffer       = 00000000
  TransferBufferMDL    = 81cf5428
    00000000: 00 00 00 02 05 e0 00
  UrbLink              = 00000000
