[0 ms] UsbSnoop compiled on Jan 18 2003 22:41:32 loading
[0 ms] UsbSnoop - DriverEntry(f9e34c40) : Windows NT WDM version 1.32
[17 ms] UsbSnoop - AddDevice(f9e34f50) : DriverObject 8151e280, pdo 814f7610
[17 ms] UsbSnoop - DispatchAny(f9e32610) : IRP_MJ_PNP (0x00000018)
[17 ms] UsbSnoop - MyDispatchPNP(f9e34ee0) : IRP_MJ_PNP (0x00000018)
[17 ms] UsbSnoop - DispatchAny(f9e32610) : IRP_MJ_PNP (IRP_MN_QUERY_RESOURCE_REQUIREMENTS)
[17 ms] UsbSnoop - MyDispatchPNP(f9e34ee0) : IRP_MJ_PNP (IRP_MN_QUERY_RESOURCE_REQUIREMENTS)
[17 ms] UsbSnoop - DispatchAny(f9e32610) : IRP_MJ_PNP (IRP_MN_FILTER_RESOURCE_REQUIREMENTS)
[17 ms] UsbSnoop - MyDispatchPNP(f9e34ee0) : IRP_MJ_PNP (IRP_MN_FILTER_RESOURCE_REQUIREMENTS)
[17 ms] UsbSnoop - DispatchAny(f9e32610) : IRP_MJ_PNP (IRP_MN_START_DEVICE)
[17 ms] UsbSnoop - MyDispatchPNP(f9e34ee0) : IRP_MJ_PNP (IRP_MN_START_DEVICE)
[18 ms] UsbSnoop - DispatchAny(f9e32610) : IRP_MJ_PNP (IRP_MN_QUERY_CAPABILITIES)
[18 ms] UsbSnoop - MyDispatchPNP(f9e34ee0) : IRP_MJ_PNP (IRP_MN_QUERY_CAPABILITIES)
[18 ms] UsbSnoop - DispatchAny(f9e32610) : IRP_MJ_PNP (IRP_MN_QUERY_PNP_DEVICE_STATE)
[18 ms] UsbSnoop - MyDispatchPNP(f9e34ee0) : IRP_MJ_PNP (IRP_MN_QUERY_PNP_DEVICE_STATE)
[18 ms] UsbSnoop - DispatchAny(f9e32610) : IRP_MJ_PNP (IRP_MN_QUERY_DEVICE_RELATIONS)
[18 ms] UsbSnoop - MyDispatchPNP(f9e34ee0) : IRP_MJ_PNP (IRP_MN_QUERY_DEVICE_RELATIONS)
[18 ms] UsbSnoop - DispatchAny(f9e32610) : IRP_MJ_SYSTEM_CONTROL
[16219 ms] UsbSnoop - DispatchAny(f9e32610) : IRP_MJ_INTERNAL_DEVICE_CONTROL
[16219 ms] UsbSnoop - MyDispatchInternalIOCTL(f9e33e80) : fdo=814f7610, Irp=81133430, IRQL=0
[16219 ms]  >>>  URB 1 going down  >>> 
-- URB_FUNCTION_GET_DESCRIPTOR_FROM_DEVICE:
  TransferBufferLength = 00000009
  TransferBuffer       = f32bc38c
  TransferBufferMDL    = 00000000
  Index                = 00000001
  DescriptorType       = 00000002 (USB_CONFIGURATION_DESCRIPTOR_TYPE)
  LanguageId           = 00000000
[16220 ms] UsbSnoop - MyInternalIOCTLCompletion(f9e33db0) : fido=00000000, Irp=81133430, Context=814dd838, IRQL=2
[16220 ms]  <<<  URB 1 coming back  <<< 
-- URB_FUNCTION_CONTROL_TRANSFER:
  PipeHandle           = 81152788
  TransferFlags        = 8143c8cb (USBD_TRANSFER_DIRECTION_IN, USBD_SHORT_TRANSFER_OK)
  TransferBufferLength = 00000009
  TransferBuffer       = f32bc38c
  TransferBufferMDL    = 8145adb0
    00000000: 09 02 23 00 01 01 00 e0 00
  UrbLink              = 00000000
  SetupPacket          =
    00000000: 80 06 01 02 00 00 09 00
[16220 ms] UsbSnoop - DispatchAny(f9e32610) : IRP_MJ_INTERNAL_DEVICE_CONTROL
[16220 ms] UsbSnoop - MyDispatchInternalIOCTL(f9e33e80) : fdo=814f7610, Irp=81133430, IRQL=0
[16220 ms]  >>>  URB 2 going down  >>> 
-- URB_FUNCTION_GET_DESCRIPTOR_FROM_DEVICE:
  TransferBufferLength = 00000023
  TransferBuffer       = 81107f00
  TransferBufferMDL    = 00000000
  Index                = 00000001
  DescriptorType       = 00000002 (USB_CONFIGURATION_DESCRIPTOR_TYPE)
  LanguageId           = 00000000
[16229 ms] UsbSnoop - MyInternalIOCTLCompletion(f9e33db0) : fido=00000000, Irp=81133430, Context=8172c9b8, IRQL=2
[16229 ms]  <<<  URB 2 coming back  <<< 
-- URB_FUNCTION_CONTROL_TRANSFER:
  PipeHandle           = 81152788
  TransferFlags        = 8143c8cb (USBD_TRANSFER_DIRECTION_IN, USBD_SHORT_TRANSFER_OK)
  TransferBufferLength = 00000023
  TransferBuffer       = 81107f00
  TransferBufferMDL    = 8145adb0
    00000000: 09 02 23 00 01 01 00 e0 00 09 04 00 00 02 ff 01
    00000010: 00 00 07 05 81 02 40 00 00 07 05 02 02 40 00 00
    00000020: 03 09 03
  UrbLink              = 00000000
  SetupPacket          =
    00000000: 80 06 01 02 00 00 23 00
[16229 ms] UsbSnoop - DispatchAny(f9e32610) : IRP_MJ_INTERNAL_DEVICE_CONTROL
[16229 ms] UsbSnoop - MyDispatchInternalIOCTL(f9e33e80) : fdo=814f7610, Irp=81133430, IRQL=0
[16229 ms]  >>>  URB 3 going down  >>> 
-- URB_FUNCTION_SELECT_CONFIGURATION:
  ConfigurationDescriptor = 0x81107f00 (configure)
  ConfigurationDescriptor : bLength             = 9
  ConfigurationDescriptor : bDescriptorType     = 0x00000002
  ConfigurationDescriptor : wTotalLength        = 0x00000023
  ConfigurationDescriptor : bNumInterfaces      = 0x00000001
  ConfigurationDescriptor : bConfigurationValue = 0x00000001
  ConfigurationDescriptor : iConfiguration      = 0x00000000
  ConfigurationDescriptor : bmAttributes        = 0x000000e0
  ConfigurationDescriptor : MaxPower            = 0x00000000
  ConfigurationHandle     = 0x00000000
  Interface[0]: Length            = 56
  Interface[0]: InterfaceNumber   = 0
  Interface[0]: AlternateSetting  = 0
[16269 ms] UsbSnoop - MyInternalIOCTLCompletion(f9e33db0) : fido=00000000, Irp=81133430, Context=81581500, IRQL=0
[16269 ms]  <<<  URB 3 coming back  <<< 
-- URB_FUNCTION_SELECT_CONFIGURATION:
  ConfigurationDescriptor = 0x81107f00 (configure)
  ConfigurationDescriptor : bLength             = 9
  ConfigurationDescriptor : bDescriptorType     = 0x00000002
  ConfigurationDescriptor : wTotalLength        = 0x00000023
  ConfigurationDescriptor : bNumInterfaces      = 0x00000001
  ConfigurationDescriptor : bConfigurationValue = 0x00000001
  ConfigurationDescriptor : iConfiguration      = 0x00000000
  ConfigurationDescriptor : bmAttributes        = 0x000000e0
  ConfigurationDescriptor : MaxPower            = 0x00000000
  ConfigurationHandle     = 0x813e5258
  Interface[0]: Length            = 56
  Interface[0]: InterfaceNumber   = 0
  Interface[0]: AlternateSetting  = 0
  Interface[0]: Class             = 0x000000ff
  Interface[0]: SubClass          = 0x00000001
  Interface[0]: Protocol          = 0x00000000
  Interface[0]: InterfaceHandle   = 0x813f4148
  Interface[0]: NumberOfPipes     = 2
  Interface[0]: Pipes[0] : MaximumPacketSize = 0x00000040
  Interface[0]: Pipes[0] : EndpointAddress   = 0x00000081
  Interface[0]: Pipes[0] : Interval          = 0x00000000
  Interface[0]: Pipes[0] : PipeType          = 0x00000002 (UsbdPipeTypeBulk)
  Interface[0]: Pipes[0] : PipeHandle        = 0x813f4164
  Interface[0]: Pipes[0] : MaxTransferSize   = 0x00001000
  Interface[0]: Pipes[0] : PipeFlags         = 0x00000000
  Interface[0]: Pipes[1] : MaximumPacketSize = 0x00000040
  Interface[0]: Pipes[1] : EndpointAddress   = 0x00000002
  Interface[0]: Pipes[1] : Interval          = 0x00000000
  Interface[0]: Pipes[1] : PipeType          = 0x00000002 (UsbdPipeTypeBulk)
  Interface[0]: Pipes[1] : PipeHandle        = 0x813f4184
  Interface[0]: Pipes[1] : MaxTransferSize   = 0x00001000
  Interface[0]: Pipes[1] : PipeFlags         = 0x00000000
[16269 ms] UsbSnoop - IRP_MJ_POWER (IRP_MN_WAIT_WAKE)
[16269 ms] UsbSnoop - DispatchAny(f9e32610) : IRP_MJ_INTERNAL_DEVICE_CONTROL
[16269 ms] UsbSnoop - MyDispatchInternalIOCTL(f9e33e80) : fdo=814f7610, Irp=814ab920, IRQL=0
[16269 ms]  >>>  URB 4 going down  >>> 
-- URB_FUNCTION_RESET_PIPE:
  PipeHandle = 813f4164 [endpoint 0x00000081]
[16275 ms] UsbSnoop - MyInternalIOCTLCompletion(f9e33db0) : fido=00000000, Irp=814ab920, Context=813d5930, IRQL=0
[16275 ms]  <<<  URB 4 coming back  <<< 
-- URB_FUNCTION_RESET_PIPE:
[16275 ms] UsbSnoop - DispatchAny(f9e32610) : IRP_MJ_INTERNAL_DEVICE_CONTROL
[16275 ms] UsbSnoop - MyDispatchInternalIOCTL(f9e33e80) : fdo=814f7610, Irp=814ab920, IRQL=0
[16275 ms]  >>>  URB 5 going down  >>> 
-- URB_FUNCTION_RESET_PIPE:
  PipeHandle = 813f4184 [endpoint 0x00000002]
[16284 ms] UsbSnoop - MyInternalIOCTLCompletion(f9e33db0) : fido=00000000, Irp=814ab920, Context=813fdad8, IRQL=0
[16284 ms]  <<<  URB 5 coming back  <<< 
-- URB_FUNCTION_RESET_PIPE:
[16284 ms] UsbSnoop - DispatchAny(f9e32610) : IRP_MJ_INTERNAL_DEVICE_CONTROL
[16284 ms] UsbSnoop - MyDispatchInternalIOCTL(f9e33e80) : fdo=814f7610, Irp=81133430, IRQL=0
[17281 ms] UsbSnoop - IRP_MJ_POWER (IRP_MN_WAIT_WAKE)
[17281 ms] UsbSnoop - DispatchAny(f9e32610) : IRP_MJ_INTERNAL_DEVICE_CONTROL
[17281 ms] UsbSnoop - MyDispatchInternalIOCTL(f9e33e80) : fdo=814f7610, Irp=815ca898, IRQL=0
[17281 ms]  >>>  URB 6 going down  >>> 
-- URB_FUNCTION_GET_DESCRIPTOR_FROM_DEVICE:
  TransferBufferLength = 00000012
  TransferBuffer       = e23b8b28
  TransferBufferMDL    = 00000000
  Index                = 00000000
  DescriptorType       = 00000001 (USB_DEVICE_DESCRIPTOR_TYPE)
  LanguageId           = 00000000
[17287 ms] UsbSnoop - MyInternalIOCTLCompletion(f9e33db0) : fido=00000000, Irp=815ca898, Context=813fdad8, IRQL=2
[17287 ms]  <<<  URB 6 coming back  <<< 
-- URB_FUNCTION_CONTROL_TRANSFER:
  PipeHandle           = 81152788
  TransferFlags        = 811172eb (USBD_TRANSFER_DIRECTION_IN, USBD_SHORT_TRANSFER_OK)
  TransferBufferLength = 00000012
  TransferBuffer       = e23b8b28
  TransferBufferMDL    = 815456f0
    00000000: 12 01 00 02 00 00 00 40 51 04 08 e0 00 01 01 02
    00000010: 00 01
  UrbLink              = 00000000
  SetupPacket          =
    00000000: 80 06 00 01 00 00 12 00
[17287 ms] UsbSnoop - DispatchAny(f9e32610) : IRP_MJ_INTERNAL_DEVICE_CONTROL
[17287 ms] UsbSnoop - MyDispatchInternalIOCTL(f9e33e80) : fdo=814f7610, Irp=811172e8, IRQL=0
[17287 ms] UsbSnoop - IRP_MJ_POWER (IRP_MN_WAIT_WAKE)
[17287 ms] UsbSnoop - DispatchAny(f9e32610) : IRP_MJ_INTERNAL_DEVICE_CONTROL
[17287 ms] UsbSnoop - MyDispatchInternalIOCTL(f9e33e80) : fdo=814f7610, Irp=811172e8, IRQL=0
[17287 ms]  >>>  URB 7 going down  >>> 
-- URB_FUNCTION_RESET_PIPE:
  PipeHandle = 813f4164 [endpoint 0x00000081]
[17296 ms] UsbSnoop - MyInternalIOCTLCompletion(f9e33db0) : fido=00000000, Irp=811172e8, Context=81676dc8, IRQL=0
[17296 ms]  <<<  URB 7 coming back  <<< 
-- URB_FUNCTION_RESET_PIPE:
[17296 ms] UsbSnoop - DispatchAny(f9e32610) : IRP_MJ_INTERNAL_DEVICE_CONTROL
[17296 ms] UsbSnoop - MyDispatchInternalIOCTL(f9e33e80) : fdo=814f7610, Irp=811172e8, IRQL=0
[17296 ms]  >>>  URB 8 going down  >>> 
-- URB_FUNCTION_RESET_PIPE:
  PipeHandle = 813f4184 [endpoint 0x00000002]
[17297 ms] UsbSnoop - MyInternalIOCTLCompletion(f9e33db0) : fido=00000000, Irp=811172e8, Context=81547610, IRQL=0
[17297 ms]  <<<  URB 8 coming back  <<< 
-- URB_FUNCTION_RESET_PIPE:
[18563 ms] UsbSnoop - DispatchAny(f9e32610) : IRP_MJ_INTERNAL_DEVICE_CONTROL
[18563 ms] UsbSnoop - MyDispatchInternalIOCTL(f9e33e80) : fdo=814f7610, Irp=81162e28, IRQL=2
[18563 ms]  >>>  URB 9 going down  >>> 
-- URB_FUNCTION_BULK_OR_INTERRUPT_TRANSFER:
  PipeHandle           = 813f4184 [endpoint 0x00000002]
  TransferFlags        = 00000000 (USBD_TRANSFER_DIRECTION_OUT, ~USBD_SHORT_TRANSFER_OK)
  TransferBufferLength = 00000009
  TransferBuffer       = 00000000
  TransferBufferMDL    = 815456f0
    00000000: 00 00 00 04 01 00 00 04 00
  UrbLink              = 00000000
[18564 ms] UsbSnoop - MyInternalIOCTLCompletion(f9e33db0) : fido=81168020, Irp=81162e28, Context=81497040, IRQL=2
[18564 ms]  <<<  URB 9 coming back  <<< 
-- URB_FUNCTION_BULK_OR_INTERRUPT_TRANSFER:
  PipeHandle           = 813f4184 [endpoint 0x00000002]
  TransferFlags        = 00000000 (USBD_TRANSFER_DIRECTION_OUT, ~USBD_SHORT_TRANSFER_OK)
  TransferBufferLength = 00000009
  TransferBuffer       = 00000000
  TransferBufferMDL    = 815456f0
  UrbLink              = 00000000
[18564 ms] UsbSnoop - DispatchAny(f9e32610) : IRP_MJ_INTERNAL_DEVICE_CONTROL
[18564 ms] UsbSnoop - MyDispatchInternalIOCTL(f9e33e80) : fdo=814f7610, Irp=81162e28, IRQL=2
[18564 ms]  >>>  URB 10 going down  >>> 
-- URB_FUNCTION_BULK_OR_INTERRUPT_TRANSFER:
  PipeHandle           = 813f4164 [endpoint 0x00000081]
  TransferFlags        = 00000003 (USBD_TRANSFER_DIRECTION_IN, USBD_SHORT_TRANSFER_OK)
  TransferBufferLength = 00000100
  TransferBuffer       = 00000000
  TransferBufferMDL    = 815456f0
  UrbLink              = 00000000
[18571 ms] UsbSnoop - MyInternalIOCTLCompletion(f9e33db0) : fido=81168020, Irp=81162e28, Context=81634870, IRQL=2
[18571 ms]  <<<  URB 10 coming back  <<< 
-- URB_FUNCTION_BULK_OR_INTERRUPT_TRANSFER:
  PipeHandle           = 813f4164 [endpoint 0x00000081]
  TransferFlags        = 00000003 (USBD_TRANSFER_DIRECTION_IN, USBD_SHORT_TRANSFER_OK)
  TransferBufferLength = 00000009
  TransferBuffer       = 00000000
  TransferBufferMDL    = 815456f0
    00000000: 00 00 00 04 02 00 00 00 fa
  UrbLink              = 00000000
[18593 ms] UsbSnoop - DispatchAny(f9e32610) : IRP_MJ_INTERNAL_DEVICE_CONTROL
[18593 ms] UsbSnoop - MyDispatchInternalIOCTL(f9e33e80) : fdo=814f7610, Irp=81162e28, IRQL=2
[18593 ms]  >>>  URB 11 going down  >>> 
-- URB_FUNCTION_BULK_OR_INTERRUPT_TRANSFER:
  PipeHandle           = 813f4184 [endpoint 0x00000002]
  TransferFlags        = 00000000 (USBD_TRANSFER_DIRECTION_OUT, ~USBD_SHORT_TRANSFER_OK)
  TransferBufferLength = 00000015
  TransferBuffer       = 00000000
  TransferBufferMDL    = 815456f0
    00000000: 00 00 00 10 04 00 00 00 0a 00 01 00 03 00 01 00
    00000010: 00 00 00 07 d0
  UrbLink              = 00000000
[18594 ms] UsbSnoop - MyInternalIOCTLCompletion(f9e33db0) : fido=81168020, Irp=81162e28, Context=813d5930, IRQL=2
[18594 ms]  <<<  URB 11 coming back  <<< 
-- URB_FUNCTION_BULK_OR_INTERRUPT_TRANSFER:
  PipeHandle           = 813f4184 [endpoint 0x00000002]
  TransferFlags        = 00000000 (USBD_TRANSFER_DIRECTION_OUT, ~USBD_SHORT_TRANSFER_OK)
  TransferBufferLength = 00000015
  TransferBuffer       = 00000000
  TransferBufferMDL    = 815456f0
  UrbLink              = 00000000
[18603 ms] UsbSnoop - DispatchAny(f9e32610) : IRP_MJ_INTERNAL_DEVICE_CONTROL
[18603 ms] UsbSnoop - MyDispatchInternalIOCTL(f9e33e80) : fdo=814f7610, Irp=81162e28, IRQL=2
[18603 ms]  >>>  URB 12 going down  >>> 
-- URB_FUNCTION_BULK_OR_INTERRUPT_TRANSFER:
  PipeHandle           = 813f4164 [endpoint 0x00000081]
  TransferFlags        = 00000003 (USBD_TRANSFER_DIRECTION_IN, USBD_SHORT_TRANSFER_OK)
  TransferBufferLength = 00000100
  TransferBuffer       = 00000000
  TransferBufferMDL    = 815456f0
  UrbLink              = 00000000
[18604 ms] UsbSnoop - MyInternalIOCTLCompletion(f9e33db0) : fido=81168020, Irp=81162e28, Context=81634870, IRQL=2
[18604 ms]  <<<  URB 12 coming back  <<< 
-- URB_FUNCTION_BULK_OR_INTERRUPT_TRANSFER:
  PipeHandle           = 813f4164 [endpoint 0x00000081]
  TransferFlags        = 00000003 (USBD_TRANSFER_DIRECTION_IN, USBD_SHORT_TRANSFER_OK)
  TransferBufferLength = 00000007
  TransferBuffer       = 00000000
  TransferBufferMDL    = 815456f0
    00000000: 00 00 00 02 05 e0 00
  UrbLink              = 00000000
[18643 ms] UsbSnoop - DispatchAny(f9e32610) : IRP_MJ_INTERNAL_DEVICE_CONTROL
[18643 ms] UsbSnoop - MyDispatchInternalIOCTL(f9e33e80) : fdo=814f7610, Irp=81162e28, IRQL=2
[18643 ms]  >>>  URB 13 going down  >>> 
-- URB_FUNCTION_BULK_OR_INTERRUPT_TRANSFER:
  PipeHandle           = 813f4164 [endpoint 0x00000081]
  TransferFlags        = 00000003 (USBD_TRANSFER_DIRECTION_IN, USBD_SHORT_TRANSFER_OK)
  TransferBufferLength = 00000100
  TransferBuffer       = 00000000
  TransferBufferMDL    = 815456f0
  UrbLink              = 00000000
[18644 ms] UsbSnoop - MyInternalIOCTLCompletion(f9e33db0) : fido=81168020, Irp=81162e28, Context=8172c9b8, IRQL=2
[18644 ms]  <<<  URB 13 coming back  <<< 
-- URB_FUNCTION_BULK_OR_INTERRUPT_TRANSFER:
  PipeHandle           = 813f4164 [endpoint 0x00000081]
  TransferFlags        = 00000003 (USBD_TRANSFER_DIRECTION_IN, USBD_SHORT_TRANSFER_OK)
  TransferBufferLength = 0000000f
  TransferBuffer       = 00000000
  TransferBufferMDL    = 815456f0
    00000000: 00 00 00 0a 04 00 00 00 04 00 12 00 00 07 d0
  UrbLink              = 00000000
[18683 ms] UsbSnoop - DispatchAny(f9e32610) : IRP_MJ_INTERNAL_DEVICE_CONTROL
[18683 ms] UsbSnoop - MyDispatchInternalIOCTL(f9e33e80) : fdo=814f7610, Irp=81162e28, IRQL=2
[18683 ms]  >>>  URB 14 going down  >>> 
-- URB_FUNCTION_BULK_OR_INTERRUPT_TRANSFER:
  PipeHandle           = 813f4184 [endpoint 0x00000002]
  TransferFlags        = 00000000 (USBD_TRANSFER_DIRECTION_OUT, ~USBD_SHORT_TRANSFER_OK)
  TransferBufferLength = 00000007
  TransferBuffer       = 00000000
  TransferBufferMDL    = 815456f0
    00000000: 00 00 00 02 05 e0 00
  UrbLink              = 00000000
[18684 ms] UsbSnoop - MyInternalIOCTLCompletion(f9e33db0) : fido=81168020, Irp=81162e28, Context=814a6930, IRQL=2
[18684 ms]  <<<  URB 14 coming back  <<< 
-- URB_FUNCTION_BULK_OR_INTERRUPT_TRANSFER:
  PipeHandle           = 813f4184 [endpoint 0x00000002]
  TransferFlags        = 00000000 (USBD_TRANSFER_DIRECTION_OUT, ~USBD_SHORT_TRANSFER_OK)
  TransferBufferLength = 00000007
  TransferBuffer       = 00000000
  TransferBufferMDL    = 815456f0
  UrbLink              = 00000000
[18693 ms] UsbSnoop - DispatchAny(f9e32610) : IRP_MJ_INTERNAL_DEVICE_CONTROL
[18693 ms] UsbSnoop - MyDispatchInternalIOCTL(f9e33e80) : fdo=814f7610, Irp=81162e28, IRQL=2
[18693 ms]  >>>  URB 15 going down  >>> 
-- URB_FUNCTION_BULK_OR_INTERRUPT_TRANSFER:
  PipeHandle           = 813f4184 [endpoint 0x00000002]
  TransferFlags        = 00000000 (USBD_TRANSFER_DIRECTION_OUT, ~USBD_SHORT_TRANSFER_OK)
  TransferBufferLength = 0000002b
  TransferBuffer       = 00000000
  TransferBufferMDL    = 815456f0
    00000000: 00 00 00 26 04 00 00 00 20 00 0c 00 06 49 44 4c
    00000010: 69 73 74 00 01 ff ff ff ff 00 02 00 03 00 08 00
    00000020: 01 00 11 00 04 f0 07 00 26 00 00
  UrbLink              = 00000000
[18694 ms] UsbSnoop - MyInternalIOCTLCompletion(f9e33db0) : fido=81168020, Irp=81162e28, Context=8172c9b8, IRQL=2
[18694 ms]  <<<  URB 15 coming back  <<< 
-- URB_FUNCTION_BULK_OR_INTERRUPT_TRANSFER:
  PipeHandle           = 813f4184 [endpoint 0x00000002]
  TransferFlags        = 00000000 (USBD_TRANSFER_DIRECTION_OUT, ~USBD_SHORT_TRANSFER_OK)
  TransferBufferLength = 0000002b
  TransferBuffer       = 00000000
  TransferBufferMDL    = 815456f0
  UrbLink              = 00000000
[18703 ms] UsbSnoop - DispatchAny(f9e32610) : IRP_MJ_INTERNAL_DEVICE_CONTROL
[18703 ms] UsbSnoop - MyDispatchInternalIOCTL(f9e33e80) : fdo=814f7610, Irp=81162e28, IRQL=2
[18703 ms]  >>>  URB 16 going down  >>> 
-- URB_FUNCTION_BULK_OR_INTERRUPT_TRANSFER:
  PipeHandle           = 813f4164 [endpoint 0x00000081]
  TransferFlags        = 00000003 (USBD_TRANSFER_DIRECTION_IN, USBD_SHORT_TRANSFER_OK)
  TransferBufferLength = 00000100
  TransferBuffer       = 00000000
  TransferBufferMDL    = 815456f0
  UrbLink              = 00000000
[18722 ms] UsbSnoop - MyInternalIOCTLCompletion(f9e33db0) : fido=81168020, Irp=81162e28, Context=816186a8, IRQL=2
[18722 ms]  <<<  URB 16 coming back  <<< 
-- URB_FUNCTION_BULK_OR_INTERRUPT_TRANSFER:
  PipeHandle           = 813f4164 [endpoint 0x00000081]
  TransferFlags        = 00000003 (USBD_TRANSFER_DIRECTION_IN, USBD_SHORT_TRANSFER_OK)
  TransferBufferLength = 00000007
  TransferBuffer       = 00000000
  TransferBufferMDL    = 815456f0
    00000000: 00 00 00 02 05 e0 00
  UrbLink              = 00000000
[18753 ms] UsbSnoop - DispatchAny(f9e32610) : IRP_MJ_INTERNAL_DEVICE_CONTROL
[18753 ms] UsbSnoop - MyDispatchInternalIOCTL(f9e33e80) : fdo=814f7610, Irp=81162e28, IRQL=2
[18753 ms]  >>>  URB 17 going down  >>> 
-- URB_FUNCTION_BULK_OR_INTERRUPT_TRANSFER:
  PipeHandle           = 813f4164 [endpoint 0x00000081]
  TransferFlags        = 00000003 (USBD_TRANSFER_DIRECTION_IN, USBD_SHORT_TRANSFER_OK)
  TransferBufferLength = 00000100
  TransferBuffer       = 00000000
  TransferBufferMDL    = 815456f0
  UrbLink              = 00000000
[18754 ms] UsbSnoop - MyInternalIOCTLCompletion(f9e33db0) : fido=81168020, Irp=81162e28, Context=814a6930, IRQL=2
[18754 ms]  <<<  URB 17 coming back  <<< 
-- URB_FUNCTION_BULK_OR_INTERRUPT_TRANSFER:
  PipeHandle           = 813f4164 [endpoint 0x00000081]
  TransferFlags        = 00000003 (USBD_TRANSFER_DIRECTION_IN, USBD_SHORT_TRANSFER_OK)
  TransferBufferLength = 00000025
  TransferBuffer       = 00000000
  TransferBufferMDL    = 815456f0
    00000000: 00 00 00 20 04 00 00 00 1a 00 0a 00 06 49 44 4c
    00000010: 69 73 74 00 00 02 00 03 00 00 01 01 00 08 00 00
    00000020: 04 00 00 00 80
  UrbLink              = 00000000
[18793 ms] UsbSnoop - DispatchAny(f9e32610) : IRP_MJ_INTERNAL_DEVICE_CONTROL
[18793 ms] UsbSnoop - MyDispatchInternalIOCTL(f9e33e80) : fdo=814f7610, Irp=81162e28, IRQL=2
[18793 ms]  >>>  URB 18 going down  >>> 
-- URB_FUNCTION_BULK_OR_INTERRUPT_TRANSFER:
  PipeHandle           = 813f4184 [endpoint 0x00000002]
  TransferFlags        = 00000000 (USBD_TRANSFER_DIRECTION_OUT, ~USBD_SHORT_TRANSFER_OK)
  TransferBufferLength = 00000007
  TransferBuffer       = 00000000
  TransferBufferMDL    = 815456f0
    00000000: 00 00 00 02 05 e0 00
  UrbLink              = 00000000
[18794 ms] UsbSnoop - MyInternalIOCTLCompletion(f9e33db0) : fido=81168020, Irp=81162e28, Context=81634870, IRQL=2
[18794 ms]  <<<  URB 18 coming back  <<< 
-- URB_FUNCTION_BULK_OR_INTERRUPT_TRANSFER:
  PipeHandle           = 813f4184 [endpoint 0x00000002]
  TransferFlags        = 00000000 (USBD_TRANSFER_DIRECTION_OUT, ~USBD_SHORT_TRANSFER_OK)
  TransferBufferLength = 00000007
  TransferBuffer       = 00000000
  TransferBufferMDL    = 815456f0
  UrbLink              = 00000000
[18803 ms] UsbSnoop - DispatchAny(f9e32610) : IRP_MJ_INTERNAL_DEVICE_CONTROL
[18803 ms] UsbSnoop - MyDispatchInternalIOCTL(f9e33e80) : fdo=814f7610, Irp=81162e28, IRQL=2
[18803 ms]  >>>  URB 19 going down  >>> 
-- URB_FUNCTION_BULK_OR_INTERRUPT_TRANSFER:
  PipeHandle           = 813f4164 [endpoint 0x00000081]
  TransferFlags        = 00000003 (USBD_TRANSFER_DIRECTION_IN, USBD_SHORT_TRANSFER_OK)
  TransferBufferLength = 00000100
  TransferBuffer       = 00000000
  TransferBufferMDL    = 815456f0
  UrbLink              = 00000000
[18804 ms] UsbSnoop - MyInternalIOCTLCompletion(f9e33db0) : fido=81168020, Irp=81162e28, Context=814a6930, IRQL=2
[18804 ms]  <<<  URB 19 coming back  <<< 
-- URB_FUNCTION_BULK_OR_INTERRUPT_TRANSFER:
  PipeHandle           = 813f4164 [endpoint 0x00000081]
  TransferFlags        = 00000003 (USBD_TRANSFER_DIRECTION_IN, USBD_SHORT_TRANSFER_OK)
  TransferBufferLength = 00000016
  TransferBuffer       = 00000000
  TransferBufferMDL    = 815456f0
    00000000: 00 00 00 11 04 00 00 00 0b 00 0d 01 00 00 80 0a
    00000010: 32 cc e3 01 21 18
  UrbLink              = 00000000
[18843 ms] UsbSnoop - DispatchAny(f9e32610) : IRP_MJ_INTERNAL_DEVICE_CONTROL
[18843 ms] UsbSnoop - MyDispatchInternalIOCTL(f9e33e80) : fdo=814f7610, Irp=81162e28, IRQL=2
[18843 ms]  >>>  URB 20 going down  >>> 
-- URB_FUNCTION_BULK_OR_INTERRUPT_TRANSFER:
  PipeHandle           = 813f4184 [endpoint 0x00000002]
  TransferFlags        = 00000000 (USBD_TRANSFER_DIRECTION_OUT, ~USBD_SHORT_TRANSFER_OK)
  TransferBufferLength = 00000007
  TransferBuffer       = 00000000
  TransferBufferMDL    = 815456f0
    00000000: 00 00 00 02 05 e0 00
  UrbLink              = 00000000
[18844 ms] UsbSnoop - MyInternalIOCTLCompletion(f9e33db0) : fido=81168020, Irp=81162e28, Context=8172c9b8, IRQL=2
[18844 ms]  <<<  URB 20 coming back  <<< 
-- URB_FUNCTION_BULK_OR_INTERRUPT_TRANSFER:
  PipeHandle           = 813f4184 [endpoint 0x00000002]
  TransferFlags        = 00000000 (USBD_TRANSFER_DIRECTION_OUT, ~USBD_SHORT_TRANSFER_OK)
  TransferBufferLength = 00000007
  TransferBuffer       = 00000000
  TransferBufferMDL    = 815456f0
  UrbLink              = 00000000
[19104 ms] UsbSnoop - DispatchAny(f9e32610) : IRP_MJ_INTERNAL_DEVICE_CONTROL
[19104 ms] UsbSnoop - MyDispatchInternalIOCTL(f9e33e80) : fdo=814f7610, Irp=81162e28, IRQL=2
[19104 ms]  >>>  URB 21 going down  >>> 
-- URB_FUNCTION_BULK_OR_INTERRUPT_TRANSFER:
  PipeHandle           = 813f4184 [endpoint 0x00000002]
  TransferFlags        = 00000000 (USBD_TRANSFER_DIRECTION_OUT, ~USBD_SHORT_TRANSFER_OK)
  TransferBufferLength = 00000009
  TransferBuffer       = 00000000
  TransferBufferMDL    = 814e4748
    00000000: 00 00 00 04 01 00 00 04 00
  UrbLink              = 00000000
[19105 ms] UsbSnoop - MyInternalIOCTLCompletion(f9e33db0) : fido=81168020, Irp=81162e28, Context=814a6930, IRQL=2
[19105 ms]  <<<  URB 21 coming back  <<< 
-- URB_FUNCTION_BULK_OR_INTERRUPT_TRANSFER:
  PipeHandle           = 813f4184 [endpoint 0x00000002]
  TransferFlags        = 00000000 (USBD_TRANSFER_DIRECTION_OUT, ~USBD_SHORT_TRANSFER_OK)
  TransferBufferLength = 00000009
  TransferBuffer       = 00000000
  TransferBufferMDL    = 814e4748
  UrbLink              = 00000000
[19106 ms] UsbSnoop - DispatchAny(f9e32610) : IRP_MJ_INTERNAL_DEVICE_CONTROL
[19106 ms] UsbSnoop - MyDispatchInternalIOCTL(f9e33e80) : fdo=814f7610, Irp=81162e28, IRQL=2
[19106 ms]  >>>  URB 22 going down  >>> 
-- URB_FUNCTION_BULK_OR_INTERRUPT_TRANSFER:
  PipeHandle           = 813f4164 [endpoint 0x00000081]
  TransferFlags        = 00000003 (USBD_TRANSFER_DIRECTION_IN, USBD_SHORT_TRANSFER_OK)
  TransferBufferLength = 00000100
  TransferBuffer       = 00000000
  TransferBufferMDL    = 814e4748
  UrbLink              = 00000000
[19110 ms] UsbSnoop - MyInternalIOCTLCompletion(f9e33db0) : fido=81168020, Irp=81162e28, Context=816d77c0, IRQL=2
[19110 ms]  <<<  URB 22 coming back  <<< 
-- URB_FUNCTION_BULK_OR_INTERRUPT_TRANSFER:
  PipeHandle           = 813f4164 [endpoint 0x00000081]
  TransferFlags        = 00000003 (USBD_TRANSFER_DIRECTION_IN, USBD_SHORT_TRANSFER_OK)
  TransferBufferLength = 00000009
  TransferBuffer       = 00000000
  TransferBufferMDL    = 814e4748
    00000000: 00 00 00 04 02 00 00 00 fa
  UrbLink              = 00000000
[19134 ms] UsbSnoop - DispatchAny(f9e32610) : IRP_MJ_INTERNAL_DEVICE_CONTROL
[19134 ms] UsbSnoop - MyDispatchInternalIOCTL(f9e33e80) : fdo=814f7610, Irp=81162e28, IRQL=2
[19134 ms]  >>>  URB 23 going down  >>> 
-- URB_FUNCTION_BULK_OR_INTERRUPT_TRANSFER:
  PipeHandle           = 813f4184 [endpoint 0x00000002]
  TransferFlags        = 00000000 (USBD_TRANSFER_DIRECTION_OUT, ~USBD_SHORT_TRANSFER_OK)
  TransferBufferLength = 00000015
  TransferBuffer       = 00000000
  TransferBufferMDL    = 8145adb0
    00000000: 00 00 00 10 04 00 00 00 0a 00 01 00 03 00 01 00
    00000010: 00 00 00 07 d0
  UrbLink              = 00000000
[19135 ms] UsbSnoop - MyInternalIOCTLCompletion(f9e33db0) : fido=81168020, Irp=81162e28, Context=814d8c68, IRQL=2
[19135 ms]  <<<  URB 23 coming back  <<< 
-- URB_FUNCTION_BULK_OR_INTERRUPT_TRANSFER:
  PipeHandle           = 813f4184 [endpoint 0x00000002]
  TransferFlags        = 00000000 (USBD_TRANSFER_DIRECTION_OUT, ~USBD_SHORT_TRANSFER_OK)
  TransferBufferLength = 00000015
  TransferBuffer       = 00000000
  TransferBufferMDL    = 8145adb0
  UrbLink              = 00000000
[19144 ms] UsbSnoop - DispatchAny(f9e32610) : IRP_MJ_INTERNAL_DEVICE_CONTROL
[19144 ms] UsbSnoop - MyDispatchInternalIOCTL(f9e33e80) : fdo=814f7610, Irp=81162e28, IRQL=2
[19144 ms]  >>>  URB 24 going down  >>> 
-- URB_FUNCTION_BULK_OR_INTERRUPT_TRANSFER:
  PipeHandle           = 813f4164 [endpoint 0x00000081]
  TransferFlags        = 00000003 (USBD_TRANSFER_DIRECTION_IN, USBD_SHORT_TRANSFER_OK)
  TransferBufferLength = 00000100
  TransferBuffer       = 00000000
  TransferBufferMDL    = 8145adb0
  UrbLink              = 00000000
[19145 ms] UsbSnoop - MyInternalIOCTLCompletion(f9e33db0) : fido=81168020, Irp=81162e28, Context=81497040, IRQL=2
[19145 ms]  <<<  URB 24 coming back  <<< 
-- URB_FUNCTION_BULK_OR_INTERRUPT_TRANSFER:
  PipeHandle           = 813f4164 [endpoint 0x00000081]
  TransferFlags        = 00000003 (USBD_TRANSFER_DIRECTION_IN, USBD_SHORT_TRANSFER_OK)
  TransferBufferLength = 00000007
  TransferBuffer       = 00000000
  TransferBufferMDL    = 8145adb0
    00000000: 00 00 00 02 05 e0 00
  UrbLink              = 00000000
[19184 ms] UsbSnoop - DispatchAny(f9e32610) : IRP_MJ_INTERNAL_DEVICE_CONTROL
[19184 ms] UsbSnoop - MyDispatchInternalIOCTL(f9e33e80) : fdo=814f7610, Irp=81162e28, IRQL=2
[19184 ms]  >>>  URB 25 going down  >>> 
-- URB_FUNCTION_BULK_OR_INTERRUPT_TRANSFER:
  PipeHandle           = 813f4164 [endpoint 0x00000081]
  TransferFlags        = 00000003 (USBD_TRANSFER_DIRECTION_IN, USBD_SHORT_TRANSFER_OK)
  TransferBufferLength = 00000100
  TransferBuffer       = 00000000
  TransferBufferMDL    = 8145adb0
  UrbLink              = 00000000
[19185 ms] UsbSnoop - MyInternalIOCTLCompletion(f9e33db0) : fido=81168020, Irp=81162e28, Context=8172c9b8, IRQL=2
[19185 ms]  <<<  URB 25 coming back  <<< 
-- URB_FUNCTION_BULK_OR_INTERRUPT_TRANSFER:
  PipeHandle           = 813f4164 [endpoint 0x00000081]
  TransferFlags        = 00000003 (USBD_TRANSFER_DIRECTION_IN, USBD_SHORT_TRANSFER_OK)
  TransferBufferLength = 0000000f
  TransferBuffer       = 00000000
  TransferBufferMDL    = 8145adb0
    00000000: 00 00 00 0a 04 00 00 00 04 00 12 00 00 07 d0
  UrbLink              = 00000000
[19224 ms] UsbSnoop - DispatchAny(f9e32610) : IRP_MJ_INTERNAL_DEVICE_CONTROL
[19224 ms] UsbSnoop - MyDispatchInternalIOCTL(f9e33e80) : fdo=814f7610, Irp=81162e28, IRQL=2
[19224 ms]  >>>  URB 26 going down  >>> 
-- URB_FUNCTION_BULK_OR_INTERRUPT_TRANSFER:
  PipeHandle           = 813f4184 [endpoint 0x00000002]
  TransferFlags        = 00000000 (USBD_TRANSFER_DIRECTION_OUT, ~USBD_SHORT_TRANSFER_OK)
  TransferBufferLength = 00000007
  TransferBuffer       = 00000000
  TransferBufferMDL    = 8145adb0
    00000000: 00 00 00 02 05 e0 00
  UrbLink              = 00000000
[19225 ms] UsbSnoop - MyInternalIOCTLCompletion(f9e33db0) : fido=81168020, Irp=81162e28, Context=81634870, IRQL=2
[19225 ms]  <<<  URB 26 coming back  <<< 
-- URB_FUNCTION_BULK_OR_INTERRUPT_TRANSFER:
  PipeHandle           = 813f4184 [endpoint 0x00000002]
  TransferFlags        = 00000000 (USBD_TRANSFER_DIRECTION_OUT, ~USBD_SHORT_TRANSFER_OK)
  TransferBufferLength = 00000007
  TransferBuffer       = 00000000
  TransferBufferMDL    = 8145adb0
  UrbLink              = 00000000
[19234 ms] UsbSnoop - DispatchAny(f9e32610) : IRP_MJ_INTERNAL_DEVICE_CONTROL
[19234 ms] UsbSnoop - MyDispatchInternalIOCTL(f9e33e80) : fdo=814f7610, Irp=81162e28, IRQL=2
[19234 ms]  >>>  URB 27 going down  >>> 
-- URB_FUNCTION_BULK_OR_INTERRUPT_TRANSFER:
  PipeHandle           = 813f4184 [endpoint 0x00000002]
  TransferFlags        = 00000000 (USBD_TRANSFER_DIRECTION_OUT, ~USBD_SHORT_TRANSFER_OK)
  TransferBufferLength = 00000029
  TransferBuffer       = 00000000
  TransferBufferMDL    = 8145adb0
    00000000: 00 00 00 24 04 00 00 00 1e 00 07 00 0e 00 0b 00
    00000010: 04 00 06 00 07 00 01 00 02 00 0a 00 37 00 0d 00
    00000020: 38 00 09 00 0e 00 2d 00 03
  UrbLink              = 00000000
[19235 ms] UsbSnoop - MyInternalIOCTLCompletion(f9e33db0) : fido=81168020, Irp=81162e28, Context=8172c9b8, IRQL=2
[19235 ms]  <<<  URB 27 coming back  <<< 
-- URB_FUNCTION_BULK_OR_INTERRUPT_TRANSFER:
  PipeHandle           = 813f4184 [endpoint 0x00000002]
  TransferFlags        = 00000000 (USBD_TRANSFER_DIRECTION_OUT, ~USBD_SHORT_TRANSFER_OK)
  TransferBufferLength = 00000029
  TransferBuffer       = 00000000
  TransferBufferMDL    = 8145adb0
  UrbLink              = 00000000
[19244 ms] UsbSnoop - DispatchAny(f9e32610) : IRP_MJ_INTERNAL_DEVICE_CONTROL
[19244 ms] UsbSnoop - MyDispatchInternalIOCTL(f9e33e80) : fdo=814f7610, Irp=81162e28, IRQL=2
[19244 ms]  >>>  URB 28 going down  >>> 
-- URB_FUNCTION_BULK_OR_INTERRUPT_TRANSFER:
  PipeHandle           = 813f4164 [endpoint 0x00000081]
  TransferFlags        = 00000003 (USBD_TRANSFER_DIRECTION_IN, USBD_SHORT_TRANSFER_OK)
  TransferBufferLength = 00000100
  TransferBuffer       = 00000000
  TransferBufferMDL    = 8145adb0
  UrbLink              = 00000000
[19260 ms] UsbSnoop - MyInternalIOCTLCompletion(f9e33db0) : fido=81168020, Irp=81162e28, Context=8168e7a8, IRQL=2
[19260 ms]  <<<  URB 28 coming back  <<< 
-- URB_FUNCTION_BULK_OR_INTERRUPT_TRANSFER:
  PipeHandle           = 813f4164 [endpoint 0x00000081]
  TransferFlags        = 00000003 (USBD_TRANSFER_DIRECTION_IN, USBD_SHORT_TRANSFER_OK)
  TransferBufferLength = 00000007
  TransferBuffer       = 00000000
  TransferBufferMDL    = 8145adb0
    00000000: 00 00 00 02 05 e0 00
  UrbLink              = 00000000
[19294 ms] UsbSnoop - DispatchAny(f9e32610) : IRP_MJ_INTERNAL_DEVICE_CONTROL
[19294 ms] UsbSnoop - MyDispatchInternalIOCTL(f9e33e80) : fdo=814f7610, Irp=81162e28, IRQL=2
[19294 ms]  >>>  URB 29 going down  >>> 
-- URB_FUNCTION_BULK_OR_INTERRUPT_TRANSFER:
  PipeHandle           = 813f4164 [endpoint 0x00000081]
  TransferFlags        = 00000003 (USBD_TRANSFER_DIRECTION_IN, USBD_SHORT_TRANSFER_OK)
  TransferBufferLength = 00000100
  TransferBuffer       = 00000000
  TransferBufferMDL    = 8145adb0
  UrbLink              = 00000000
[19295 ms] UsbSnoop - MyInternalIOCTLCompletion(f9e33db0) : fido=81168020, Irp=81162e28, Context=81634870, IRQL=2
[19295 ms]  <<<  URB 29 coming back  <<< 
-- URB_FUNCTION_BULK_OR_INTERRUPT_TRANSFER:
  PipeHandle           = 813f4164 [endpoint 0x00000081]
  TransferFlags        = 00000003 (USBD_TRANSFER_DIRECTION_IN, USBD_SHORT_TRANSFER_OK)
  TransferBufferLength = 0000000f
  TransferBuffer       = 00000000
  TransferBufferMDL    = 8145adb0
    00000000: 00 00 00 0a 04 00 00 00 04 bb 00 00 01 d4 c0
  UrbLink              = 00000000
[19334 ms] UsbSnoop - DispatchAny(f9e32610) : IRP_MJ_INTERNAL_DEVICE_CONTROL
[19334 ms] UsbSnoop - MyDispatchInternalIOCTL(f9e33e80) : fdo=814f7610, Irp=81162e28, IRQL=2
[19334 ms]  >>>  URB 30 going down  >>> 
-- URB_FUNCTION_BULK_OR_INTERRUPT_TRANSFER:
  PipeHandle           = 813f4184 [endpoint 0x00000002]
  TransferFlags        = 00000000 (USBD_TRANSFER_DIRECTION_OUT, ~USBD_SHORT_TRANSFER_OK)
  TransferBufferLength = 00000007
  TransferBuffer       = 00000000
  TransferBufferMDL    = 8145adb0
    00000000: 00 00 00 02 05 e0 00
  UrbLink              = 00000000
[19335 ms] UsbSnoop - MyInternalIOCTLCompletion(f9e33db0) : fido=81168020, Irp=81162e28, Context=81497040, IRQL=2
[19335 ms]  <<<  URB 30 coming back  <<< 
-- URB_FUNCTION_BULK_OR_INTERRUPT_TRANSFER:
  PipeHandle           = 813f4184 [endpoint 0x00000002]
  TransferFlags        = 00000000 (USBD_TRANSFER_DIRECTION_OUT, ~USBD_SHORT_TRANSFER_OK)
  TransferBufferLength = 00000007
  TransferBuffer       = 00000000
  TransferBufferMDL    = 8145adb0
  UrbLink              = 00000000
[19344 ms] UsbSnoop - DispatchAny(f9e32610) : IRP_MJ_INTERNAL_DEVICE_CONTROL
[19344 ms] UsbSnoop - MyDispatchInternalIOCTL(f9e33e80) : fdo=814f7610, Irp=81162e28, IRQL=2
[19344 ms]  >>>  URB 31 going down  >>> 
-- URB_FUNCTION_BULK_OR_INTERRUPT_TRANSFER:
  PipeHandle           = 813f4164 [endpoint 0x00000081]
  TransferFlags        = 00000003 (USBD_TRANSFER_DIRECTION_IN, USBD_SHORT_TRANSFER_OK)
  TransferBufferLength = 00000100
  TransferBuffer       = 00000000
  TransferBufferMDL    = 8145adb0
  UrbLink              = 00000000
[19399 ms] UsbSnoop - MyInternalIOCTLCompletion(f9e33db0) : fido=81168020, Irp=81162e28, Context=81634870, IRQL=2
[19399 ms]  <<<  URB 31 coming back  <<< 
-- URB_FUNCTION_BULK_OR_INTERRUPT_TRANSFER:
  PipeHandle           = 813f4164 [endpoint 0x00000081]
  TransferFlags        = 00000003 (USBD_TRANSFER_DIRECTION_IN, USBD_SHORT_TRANSFER_OK)
  TransferBufferLength = 00000095
  TransferBuffer       = 00000000
  TransferBufferMDL    = 8145adb0
    00000000: 00 00 00 90 04 00 00 00 8a 00 08 00 0e 00 0b 00
    00000010: 00 04 00 02 16 00 00 04 00 00 02 00 03 00 06 00
    00000020: 00 01 09 00 07 00 00 01 01 00 01 00 00 04 00 00
    00000030: 00 0a 00 02 00 00 19 54 49 2d 38 34 20 50 6c 75
    00000040: 73 20 53 69 6c 76 65 72 20 45 64 69 74 69 6f 6e
    00000050: 00 0a 00 00 01 01 00 37 00 00 01 01 00 0d 00 00
    00000060: 08 00 00 00 00 00 00 5e fd 00 38 00 00 01 00 00
    00000070: 09 00 00 04 00 01 00 00 00 0e 00 00 08 00 00 00
    00000080: 00 00 00 5e e5 00 2d 00 00 01 01 00 03 00 00 05
    00000090: 0a 32 cc e3 01
  UrbLink              = 00000000
[19436 ms] UsbSnoop - DispatchAny(f9e32610) : IRP_MJ_INTERNAL_DEVICE_CONTROL
[19436 ms] UsbSnoop - MyDispatchInternalIOCTL(f9e33e80) : fdo=814f7610, Irp=81162e28, IRQL=2
[19436 ms]  >>>  URB 32 going down  >>> 
-- URB_FUNCTION_BULK_OR_INTERRUPT_TRANSFER:
  PipeHandle           = 813f4184 [endpoint 0x00000002]
  TransferFlags        = 00000000 (USBD_TRANSFER_DIRECTION_OUT, ~USBD_SHORT_TRANSFER_OK)
  TransferBufferLength = 00000007
  TransferBuffer       = 00000000
  TransferBufferMDL    = 8145adb0
    00000000: 00 00 00 02 05 e0 00
  UrbLink              = 00000000
[19437 ms] UsbSnoop - MyInternalIOCTLCompletion(f9e33db0) : fido=81168020, Irp=81162e28, Context=8172c9b8, IRQL=2
[19437 ms]  <<<  URB 32 coming back  <<< 
-- URB_FUNCTION_BULK_OR_INTERRUPT_TRANSFER:
  PipeHandle           = 813f4184 [endpoint 0x00000002]
  TransferFlags        = 00000000 (USBD_TRANSFER_DIRECTION_OUT, ~USBD_SHORT_TRANSFER_OK)
  TransferBufferLength = 00000007
  TransferBuffer       = 00000000
  TransferBufferMDL    = 8145adb0
  UrbLink              = 00000000
[19694 ms] UsbSnoop - DispatchAny(f9e32610) : IRP_MJ_INTERNAL_DEVICE_CONTROL
[19694 ms] UsbSnoop - MyDispatchInternalIOCTL(f9e33e80) : fdo=814f7610, Irp=81162e28, IRQL=2
[19694 ms]  >>>  URB 33 going down  >>> 
-- URB_FUNCTION_BULK_OR_INTERRUPT_TRANSFER:
  PipeHandle           = 813f4184 [endpoint 0x00000002]
  TransferFlags        = 00000000 (USBD_TRANSFER_DIRECTION_OUT, ~USBD_SHORT_TRANSFER_OK)
  TransferBufferLength = 00000009
  TransferBuffer       = 00000000
  TransferBufferMDL    = 8145adb0
    00000000: 00 00 00 04 01 00 00 04 00
  UrbLink              = 00000000
[19695 ms] UsbSnoop - MyInternalIOCTLCompletion(f9e33db0) : fido=81168020, Irp=81162e28, Context=81634870, IRQL=2
[19695 ms]  <<<  URB 33 coming back  <<< 
-- URB_FUNCTION_BULK_OR_INTERRUPT_TRANSFER:
  PipeHandle           = 813f4184 [endpoint 0x00000002]
  TransferFlags        = 00000000 (USBD_TRANSFER_DIRECTION_OUT, ~USBD_SHORT_TRANSFER_OK)
  TransferBufferLength = 00000009
  TransferBuffer       = 00000000
  TransferBufferMDL    = 8145adb0
  UrbLink              = 00000000
[19695 ms] UsbSnoop - DispatchAny(f9e32610) : IRP_MJ_INTERNAL_DEVICE_CONTROL
[19695 ms] UsbSnoop - MyDispatchInternalIOCTL(f9e33e80) : fdo=814f7610, Irp=81162e28, IRQL=2
[19695 ms]  >>>  URB 34 going down  >>> 
-- URB_FUNCTION_BULK_OR_INTERRUPT_TRANSFER:
  PipeHandle           = 813f4164 [endpoint 0x00000081]
  TransferFlags        = 00000003 (USBD_TRANSFER_DIRECTION_IN, USBD_SHORT_TRANSFER_OK)
  TransferBufferLength = 00000100
  TransferBuffer       = 00000000
  TransferBufferMDL    = 8145adb0
  UrbLink              = 00000000
[19703 ms] UsbSnoop - MyInternalIOCTLCompletion(f9e33db0) : fido=81168020, Irp=81162e28, Context=813d5930, IRQL=2
[19703 ms]  <<<  URB 34 coming back  <<< 
-- URB_FUNCTION_BULK_OR_INTERRUPT_TRANSFER:
  PipeHandle           = 813f4164 [endpoint 0x00000081]
  TransferFlags        = 00000003 (USBD_TRANSFER_DIRECTION_IN, USBD_SHORT_TRANSFER_OK)
  TransferBufferLength = 00000009
  TransferBuffer       = 00000000
  TransferBufferMDL    = 8145adb0
    00000000: 00 00 00 04 02 00 00 00 fa
  UrbLink              = 00000000
[19724 ms] UsbSnoop - DispatchAny(f9e32610) : IRP_MJ_INTERNAL_DEVICE_CONTROL
[19724 ms] UsbSnoop - MyDispatchInternalIOCTL(f9e33e80) : fdo=814f7610, Irp=81162e28, IRQL=2
[19724 ms]  >>>  URB 35 going down  >>> 
-- URB_FUNCTION_BULK_OR_INTERRUPT_TRANSFER:
  PipeHandle           = 813f4184 [endpoint 0x00000002]
  TransferFlags        = 00000000 (USBD_TRANSFER_DIRECTION_OUT, ~USBD_SHORT_TRANSFER_OK)
  TransferBufferLength = 00000015
  TransferBuffer       = 00000000
  TransferBufferMDL    = 8145adb0
    00000000: 00 00 00 10 04 00 00 00 0a 00 01 00 03 00 01 00
    00000010: 00 00 00 07 d0
  UrbLink              = 00000000
[19725 ms] UsbSnoop - MyInternalIOCTLCompletion(f9e33db0) : fido=81168020, Irp=81162e28, Context=81497040, IRQL=2
[19725 ms]  <<<  URB 35 coming back  <<< 
-- URB_FUNCTION_BULK_OR_INTERRUPT_TRANSFER:
  PipeHandle           = 813f4184 [endpoint 0x00000002]
  TransferFlags        = 00000000 (USBD_TRANSFER_DIRECTION_OUT, ~USBD_SHORT_TRANSFER_OK)
  TransferBufferLength = 00000015
  TransferBuffer       = 00000000
  TransferBufferMDL    = 8145adb0
  UrbLink              = 00000000
[19734 ms] UsbSnoop - DispatchAny(f9e32610) : IRP_MJ_INTERNAL_DEVICE_CONTROL
[19734 ms] UsbSnoop - MyDispatchInternalIOCTL(f9e33e80) : fdo=814f7610, Irp=81162e28, IRQL=2
[19734 ms]  >>>  URB 36 going down  >>> 
-- URB_FUNCTION_BULK_OR_INTERRUPT_TRANSFER:
  PipeHandle           = 813f4164 [endpoint 0x00000081]
  TransferFlags        = 00000003 (USBD_TRANSFER_DIRECTION_IN, USBD_SHORT_TRANSFER_OK)
  TransferBufferLength = 00000100
  TransferBuffer       = 00000000
  TransferBufferMDL    = 8145adb0
  UrbLink              = 00000000
[19735 ms] UsbSnoop - MyInternalIOCTLCompletion(f9e33db0) : fido=81168020, Irp=81162e28, Context=813d5930, IRQL=2
[19735 ms]  <<<  URB 36 coming back  <<< 
-- URB_FUNCTION_BULK_OR_INTERRUPT_TRANSFER:
  PipeHandle           = 813f4164 [endpoint 0x00000081]
  TransferFlags        = 00000003 (USBD_TRANSFER_DIRECTION_IN, USBD_SHORT_TRANSFER_OK)
  TransferBufferLength = 00000007
  TransferBuffer       = 00000000
  TransferBufferMDL    = 8145adb0
    00000000: 00 00 00 02 05 e0 00
  UrbLink              = 00000000
[19775 ms] UsbSnoop - DispatchAny(f9e32610) : IRP_MJ_INTERNAL_DEVICE_CONTROL
[19775 ms] UsbSnoop - MyDispatchInternalIOCTL(f9e33e80) : fdo=814f7610, Irp=81162e28, IRQL=2
[19775 ms]  >>>  URB 37 going down  >>> 
-- URB_FUNCTION_BULK_OR_INTERRUPT_TRANSFER:
  PipeHandle           = 813f4164 [endpoint 0x00000081]
  TransferFlags        = 00000003 (USBD_TRANSFER_DIRECTION_IN, USBD_SHORT_TRANSFER_OK)
  TransferBufferLength = 00000100
  TransferBuffer       = 00000000
  TransferBufferMDL    = 8145adb0
  UrbLink              = 00000000
[19775 ms] UsbSnoop - MyInternalIOCTLCompletion(f9e33db0) : fido=81168020, Irp=81162e28, Context=8168e7a8, IRQL=2
[19775 ms]  <<<  URB 37 coming back  <<< 
-- URB_FUNCTION_BULK_OR_INTERRUPT_TRANSFER:
  PipeHandle           = 813f4164 [endpoint 0x00000081]
  TransferFlags        = 00000003 (USBD_TRANSFER_DIRECTION_IN, USBD_SHORT_TRANSFER_OK)
  TransferBufferLength = 0000000f
  TransferBuffer       = 00000000
  TransferBufferMDL    = 8145adb0
    00000000: 00 00 00 0a 04 00 00 00 04 00 12 00 00 07 d0
  UrbLink              = 00000000
[19815 ms] UsbSnoop - DispatchAny(f9e32610) : IRP_MJ_INTERNAL_DEVICE_CONTROL
[19815 ms] UsbSnoop - MyDispatchInternalIOCTL(f9e33e80) : fdo=814f7610, Irp=81162e28, IRQL=2
[19815 ms]  >>>  URB 38 going down  >>> 
-- URB_FUNCTION_BULK_OR_INTERRUPT_TRANSFER:
  PipeHandle           = 813f4184 [endpoint 0x00000002]
  TransferFlags        = 00000000 (USBD_TRANSFER_DIRECTION_OUT, ~USBD_SHORT_TRANSFER_OK)
  TransferBufferLength = 00000007
  TransferBuffer       = 00000000
  TransferBufferMDL    = 8145adb0
    00000000: 00 00 00 02 05 e0 00
  UrbLink              = 00000000
[19816 ms] UsbSnoop - MyInternalIOCTLCompletion(f9e33db0) : fido=81168020, Irp=81162e28, Context=8172c9b8, IRQL=2
[19816 ms]  <<<  URB 38 coming back  <<< 
-- URB_FUNCTION_BULK_OR_INTERRUPT_TRANSFER:
  PipeHandle           = 813f4184 [endpoint 0x00000002]
  TransferFlags        = 00000000 (USBD_TRANSFER_DIRECTION_OUT, ~USBD_SHORT_TRANSFER_OK)
  TransferBufferLength = 00000007
  TransferBuffer       = 00000000
  TransferBufferMDL    = 8145adb0
  UrbLink              = 00000000
[19825 ms] UsbSnoop - DispatchAny(f9e32610) : IRP_MJ_INTERNAL_DEVICE_CONTROL
[19825 ms] UsbSnoop - MyDispatchInternalIOCTL(f9e33e80) : fdo=814f7610, Irp=81162e28, IRQL=2
[19825 ms]  >>>  URB 39 going down  >>> 
-- URB_FUNCTION_BULK_OR_INTERRUPT_TRANSFER:
  PipeHandle           = 813f4184 [endpoint 0x00000002]
  TransferFlags        = 00000000 (USBD_TRANSFER_DIRECTION_OUT, ~USBD_SHORT_TRANSFER_OK)
  TransferBufferLength = 0000000f
  TransferBuffer       = 00000000
  TransferBufferMDL    = 8145adb0
    00000000: 00 00 00 0a 04 00 00 00 04 00 07 00 01 00 31
  UrbLink              = 00000000
[19826 ms] UsbSnoop - MyInternalIOCTLCompletion(f9e33db0) : fido=81168020, Irp=81162e28, Context=8168e7a8, IRQL=2
[19826 ms]  <<<  URB 39 coming back  <<< 
-- URB_FUNCTION_BULK_OR_INTERRUPT_TRANSFER:
  PipeHandle           = 813f4184 [endpoint 0x00000002]
  TransferFlags        = 00000000 (USBD_TRANSFER_DIRECTION_OUT, ~USBD_SHORT_TRANSFER_OK)
  TransferBufferLength = 0000000f
  TransferBuffer       = 00000000
  TransferBufferMDL    = 8145adb0
  UrbLink              = 00000000
[19835 ms] UsbSnoop - DispatchAny(f9e32610) : IRP_MJ_INTERNAL_DEVICE_CONTROL
[19835 ms] UsbSnoop - MyDispatchInternalIOCTL(f9e33e80) : fdo=814f7610, Irp=81162e28, IRQL=2
[19835 ms]  >>>  URB 40 going down  >>> 
-- URB_FUNCTION_BULK_OR_INTERRUPT_TRANSFER:
  PipeHandle           = 813f4164 [endpoint 0x00000081]
  TransferFlags        = 00000003 (USBD_TRANSFER_DIRECTION_IN, USBD_SHORT_TRANSFER_OK)
  TransferBufferLength = 00000100
  TransferBuffer       = 00000000
  TransferBufferMDL    = 8145adb0
  UrbLink              = 00000000
[19853 ms] UsbSnoop - MyInternalIOCTLCompletion(f9e33db0) : fido=81168020, Irp=81162e28, Context=816186a8, IRQL=2
[19853 ms]  <<<  URB 40 coming back  <<< 
-- URB_FUNCTION_BULK_OR_INTERRUPT_TRANSFER:
  PipeHandle           = 813f4164 [endpoint 0x00000081]
  TransferFlags        = 00000003 (USBD_TRANSFER_DIRECTION_IN, USBD_SHORT_TRANSFER_OK)
  TransferBufferLength = 00000007
  TransferBuffer       = 00000000
  TransferBufferMDL    = 8145adb0
    00000000: 00 00 00 02 05 e0 00
  UrbLink              = 00000000
[19885 ms] UsbSnoop - DispatchAny(f9e32610) : IRP_MJ_INTERNAL_DEVICE_CONTROL
[19885 ms] UsbSnoop - MyDispatchInternalIOCTL(f9e33e80) : fdo=814f7610, Irp=81162e28, IRQL=2
[19885 ms]  >>>  URB 41 going down  >>> 
-- URB_FUNCTION_BULK_OR_INTERRUPT_TRANSFER:
  PipeHandle           = 813f4164 [endpoint 0x00000081]
  TransferFlags        = 00000003 (USBD_TRANSFER_DIRECTION_IN, USBD_SHORT_TRANSFER_OK)
  TransferBufferLength = 00000100
  TransferBuffer       = 00000000
  TransferBufferMDL    = 8145adb0
  UrbLink              = 00000000
[19886 ms] UsbSnoop - MyInternalIOCTLCompletion(f9e33db0) : fido=81168020, Irp=81162e28, Context=8172c9b8, IRQL=2
[19886 ms]  <<<  URB 41 coming back  <<< 
-- URB_FUNCTION_BULK_OR_INTERRUPT_TRANSFER:
  PipeHandle           = 813f4164 [endpoint 0x00000081]
  TransferFlags        = 00000003 (USBD_TRANSFER_DIRECTION_IN, USBD_SHORT_TRANSFER_OK)
  TransferBufferLength = 0000000f
  TransferBuffer       = 00000000
  TransferBufferMDL    = 8145adb0
    00000000: 00 00 00 0a 04 00 00 00 04 bb 00 00 01 d4 c0
  UrbLink              = 00000000
[19925 ms] UsbSnoop - DispatchAny(f9e32610) : IRP_MJ_INTERNAL_DEVICE_CONTROL
[19925 ms] UsbSnoop - MyDispatchInternalIOCTL(f9e33e80) : fdo=814f7610, Irp=81162e28, IRQL=2
[19925 ms]  >>>  URB 42 going down  >>> 
-- URB_FUNCTION_BULK_OR_INTERRUPT_TRANSFER:
  PipeHandle           = 813f4184 [endpoint 0x00000002]
  TransferFlags        = 00000000 (USBD_TRANSFER_DIRECTION_OUT, ~USBD_SHORT_TRANSFER_OK)
  TransferBufferLength = 00000007
  TransferBuffer       = 00000000
  TransferBufferMDL    = 8145adb0
    00000000: 00 00 00 02 05 e0 00
  UrbLink              = 00000000
[19926 ms] UsbSnoop - MyInternalIOCTLCompletion(f9e33db0) : fido=81168020, Irp=81162e28, Context=813d5930, IRQL=2
[19926 ms]  <<<  URB 42 coming back  <<< 
-- URB_FUNCTION_BULK_OR_INTERRUPT_TRANSFER:
  PipeHandle           = 813f4184 [endpoint 0x00000002]
  TransferFlags        = 00000000 (USBD_TRANSFER_DIRECTION_OUT, ~USBD_SHORT_TRANSFER_OK)
  TransferBufferLength = 00000007
  TransferBuffer       = 00000000
  TransferBufferMDL    = 8145adb0
  UrbLink              = 00000000
[19935 ms] UsbSnoop - DispatchAny(f9e32610) : IRP_MJ_INTERNAL_DEVICE_CONTROL
[19935 ms] UsbSnoop - MyDispatchInternalIOCTL(f9e33e80) : fdo=814f7610, Irp=81164858, IRQL=2
[19935 ms]  >>>  URB 43 going down  >>> 
-- URB_FUNCTION_BULK_OR_INTERRUPT_TRANSFER:
  PipeHandle           = 813f4164 [endpoint 0x00000081]
  TransferFlags        = 00000003 (USBD_TRANSFER_DIRECTION_IN, USBD_SHORT_TRANSFER_OK)
  TransferBufferLength = 00000100
  TransferBuffer       = 00000000
  TransferBufferMDL    = 815456f0
  UrbLink              = 00000000
[28028 ms] UsbSnoop - MyInternalIOCTLCompletion(f9e33db0) : fido=81168020, Irp=81164858, Context=816186a8, IRQL=2
[28028 ms]  <<<  URB 43 coming back  <<< 
-- URB_FUNCTION_BULK_OR_INTERRUPT_TRANSFER:
  PipeHandle           = 813f4164 [endpoint 0x00000081]
  TransferFlags        = 00000003 (USBD_TRANSFER_DIRECTION_IN, USBD_SHORT_TRANSFER_OK)
  TransferBufferLength = 00000000
  TransferBuffer       = 00000000
  TransferBufferMDL    = 815456f0
  UrbLink              = 00000000
[28028 ms] UsbSnoop - DispatchAny(f9e32610) : IRP_MJ_INTERNAL_DEVICE_CONTROL
[28028 ms] UsbSnoop - MyDispatchInternalIOCTL(f9e33e80) : fdo=814f7610, Irp=81162e28, IRQL=0
[28028 ms]  >>>  URB 44 going down  >>> 
-- URB_FUNCTION_RESET_PIPE:
  PipeHandle = 813f4164 [endpoint 0x00000081]
[28029 ms] UsbSnoop - MyInternalIOCTLCompletion(f9e33db0) : fido=00000000, Irp=81162e28, Context=8172c9b8, IRQL=0
[28029 ms]  <<<  URB 44 coming back  <<< 
-- URB_FUNCTION_RESET_PIPE:
[28029 ms] UsbSnoop - DispatchAny(f9e32610) : IRP_MJ_INTERNAL_DEVICE_CONTROL
[28029 ms] UsbSnoop - MyDispatchInternalIOCTL(f9e33e80) : fdo=814f7610, Irp=81162e28, IRQL=0
[28029 ms]  >>>  URB 45 going down  >>> 
-- URB_FUNCTION_RESET_PIPE:
  PipeHandle = 813f4184 [endpoint 0x00000002]
[28030 ms] UsbSnoop - MyInternalIOCTLCompletion(f9e33db0) : fido=00000000, Irp=81162e28, Context=81497040, IRQL=0
[28030 ms]  <<<  URB 45 coming back  <<< 
-- URB_FUNCTION_RESET_PIPE:
[28288 ms] UsbSnoop - DispatchAny(f9e32610) : IRP_MJ_INTERNAL_DEVICE_CONTROL
[28288 ms] UsbSnoop - MyDispatchInternalIOCTL(f9e33e80) : fdo=814f7610, Irp=81164858, IRQL=2
[28288 ms]  >>>  URB 46 going down  >>> 
-- URB_FUNCTION_BULK_OR_INTERRUPT_TRANSFER:
  PipeHandle           = 813f4184 [endpoint 0x00000002]
  TransferFlags        = 00000000 (USBD_TRANSFER_DIRECTION_OUT, ~USBD_SHORT_TRANSFER_OK)
  TransferBufferLength = 00000009
  TransferBuffer       = 00000000
  TransferBufferMDL    = 815456f0
    00000000: 00 00 00 04 01 00 00 04 00
  UrbLink              = 00000000
[28289 ms] UsbSnoop - MyInternalIOCTLCompletion(f9e33db0) : fido=81168020, Irp=81164858, Context=8168e7a8, IRQL=2
[28289 ms]  <<<  URB 46 coming back  <<< 
-- URB_FUNCTION_BULK_OR_INTERRUPT_TRANSFER:
  PipeHandle           = 813f4184 [endpoint 0x00000002]
  TransferFlags        = 00000000 (USBD_TRANSFER_DIRECTION_OUT, ~USBD_SHORT_TRANSFER_OK)
  TransferBufferLength = 00000000
  TransferBuffer       = 00000000
  TransferBufferMDL    = 815456f0
  UrbLink              = 00000000
[30291 ms] UsbSnoop - DispatchAny(f9e32610) : IRP_MJ_INTERNAL_DEVICE_CONTROL
[30291 ms] UsbSnoop - MyDispatchInternalIOCTL(f9e33e80) : fdo=814f7610, Irp=815236d8, IRQL=0
[30291 ms]  >>>  URB 47 going down  >>> 
-- URB_FUNCTION_RESET_PIPE:
  PipeHandle = 813f4164 [endpoint 0x00000081]
[30293 ms] UsbSnoop - MyInternalIOCTLCompletion(f9e33db0) : fido=00000000, Irp=815236d8, Context=81497040, IRQL=0
[30293 ms]  <<<  URB 47 coming back  <<< 
-- URB_FUNCTION_RESET_PIPE:
[30293 ms] UsbSnoop - DispatchAny(f9e32610) : IRP_MJ_INTERNAL_DEVICE_CONTROL
[30293 ms] UsbSnoop - MyDispatchInternalIOCTL(f9e33e80) : fdo=814f7610, Irp=815236d8, IRQL=0
[30293 ms]  >>>  URB 48 going down  >>> 
-- URB_FUNCTION_RESET_PIPE:
  PipeHandle = 813f4184 [endpoint 0x00000002]
[30293 ms] UsbSnoop - MyInternalIOCTLCompletion(f9e33db0) : fido=00000000, Irp=815236d8, Context=8168e7a8, IRQL=0
[30293 ms]  <<<  URB 48 coming back  <<< 
-- URB_FUNCTION_RESET_PIPE:
[30295 ms] UsbSnoop - DispatchAny(f9e32610) : IRP_MJ_INTERNAL_DEVICE_CONTROL
[30295 ms] UsbSnoop - MyDispatchInternalIOCTL(f9e33e80) : fdo=814f7610, Irp=815236d8, IRQL=0
[30295 ms]  >>>  URB 49 going down  >>> 
-- URB_FUNCTION_RESET_PIPE:
  PipeHandle = 813f4164 [endpoint 0x00000081]
[30296 ms] UsbSnoop - MyInternalIOCTLCompletion(f9e33db0) : fido=00000000, Irp=815236d8, Context=8172c9b8, IRQL=0
[30296 ms]  <<<  URB 49 coming back  <<< 
-- URB_FUNCTION_RESET_PIPE:
[30296 ms] UsbSnoop - DispatchAny(f9e32610) : IRP_MJ_INTERNAL_DEVICE_CONTROL
[30296 ms] UsbSnoop - MyDispatchInternalIOCTL(f9e33e80) : fdo=814f7610, Irp=815236d8, IRQL=0
[30296 ms]  >>>  URB 50 going down  >>> 
-- URB_FUNCTION_RESET_PIPE:
  PipeHandle = 813f4184 [endpoint 0x00000002]
[30297 ms] UsbSnoop - MyInternalIOCTLCompletion(f9e33db0) : fido=00000000, Irp=815236d8, Context=817742a8, IRQL=0
[30297 ms]  <<<  URB 50 coming back  <<< 
-- URB_FUNCTION_RESET_PIPE:
[30297 ms] UsbSnoop - DispatchAny(f9e32610) : IRP_MJ_INTERNAL_DEVICE_CONTROL
[30297 ms] UsbSnoop - MyDispatchInternalIOCTL(f9e33e80) : fdo=814f7610, Irp=81723430, IRQL=0
