[0 ms] UsbSnoop compiled on Jan 18 2003 22:41:32 loading
[0 ms] UsbSnoop - DriverEntry(f8908c40) : Windows NT WDM version 1.32
[32 ms] UsbSnoop - AddDevice(f8908f50) : DriverObject 821622a0, pdo 81c5a708
[32 ms] UsbSnoop - DispatchAny(f8906610) : IRP_MJ_PNP (0x00000018)
[32 ms] UsbSnoop - MyDispatchPNP(f8908ee0) : IRP_MJ_PNP (0x00000018)
[32 ms] UsbSnoop - DispatchAny(f8906610) : IRP_MJ_PNP (IRP_MN_QUERY_RESOURCE_REQUIREMENTS)
[32 ms] UsbSnoop - MyDispatchPNP(f8908ee0) : IRP_MJ_PNP (IRP_MN_QUERY_RESOURCE_REQUIREMENTS)
[32 ms] UsbSnoop - DispatchAny(f8906610) : IRP_MJ_PNP (IRP_MN_FILTER_RESOURCE_REQUIREMENTS)
[32 ms] UsbSnoop - MyDispatchPNP(f8908ee0) : IRP_MJ_PNP (IRP_MN_FILTER_RESOURCE_REQUIREMENTS)
[32 ms] UsbSnoop - DispatchAny(f8906610) : IRP_MJ_PNP (IRP_MN_START_DEVICE)
[32 ms] UsbSnoop - MyDispatchPNP(f8908ee0) : IRP_MJ_PNP (IRP_MN_START_DEVICE)
[33 ms] UsbSnoop - DispatchAny(f8906610) : IRP_MJ_PNP (IRP_MN_QUERY_CAPABILITIES)
[33 ms] UsbSnoop - MyDispatchPNP(f8908ee0) : IRP_MJ_PNP (IRP_MN_QUERY_CAPABILITIES)
[33 ms] UsbSnoop - DispatchAny(f8906610) : IRP_MJ_PNP (IRP_MN_QUERY_PNP_DEVICE_STATE)
[33 ms] UsbSnoop - MyDispatchPNP(f8908ee0) : IRP_MJ_PNP (IRP_MN_QUERY_PNP_DEVICE_STATE)
[33 ms] UsbSnoop - DispatchAny(f8906610) : IRP_MJ_PNP (IRP_MN_QUERY_DEVICE_RELATIONS)
[33 ms] UsbSnoop - MyDispatchPNP(f8908ee0) : IRP_MJ_PNP (IRP_MN_QUERY_DEVICE_RELATIONS)
[33 ms] UsbSnoop - DispatchAny(f8906610) : IRP_MJ_SYSTEM_CONTROL
[67640 ms] UsbSnoop - DispatchAny(f8906610) : IRP_MJ_INTERNAL_DEVICE_CONTROL
[67640 ms] UsbSnoop - MyDispatchInternalIOCTL(f8907e80) : fdo=81c5a708, Irp=81b6a770, IRQL=0
[67640 ms]  >>>  URB 1 going down  >>> 
-- URB_FUNCTION_GET_DESCRIPTOR_FROM_DEVICE:
  TransferBufferLength = 00000009
  TransferBuffer       = f6b8f910
  TransferBufferMDL    = 00000000
  Index                = 00000001
  DescriptorType       = 00000002 (USB_CONFIGURATION_DESCRIPTOR_TYPE)
  LanguageId           = 00000000
[67641 ms] UsbSnoop - MyInternalIOCTLCompletion(f8907db0) : fido=00000000, Irp=81b6a770, Context=81b077f0, IRQL=2
[67641 ms]  <<<  URB 1 coming back  <<< 
-- URB_FUNCTION_CONTROL_TRANSFER:
  PipeHandle           = 8215b408
  TransferFlags        = 81af4dab (USBD_TRANSFER_DIRECTION_IN, USBD_SHORT_TRANSFER_OK)
  TransferBufferLength = 00000009
  TransferBuffer       = f6b8f910
  TransferBufferMDL    = 81cd6558
    00000000: 09 02 23 00 01 01 00 e0 00
  UrbLink              = 00000000
  SetupPacket          =
    00000000: 80 06 01 02 00 00 09 00
[67641 ms] UsbSnoop - DispatchAny(f8906610) : IRP_MJ_INTERNAL_DEVICE_CONTROL
[67641 ms] UsbSnoop - MyDispatchInternalIOCTL(f8907e80) : fdo=81c5a708, Irp=81b6a770, IRQL=0
[67641 ms]  >>>  URB 2 going down  >>> 
-- URB_FUNCTION_GET_DESCRIPTOR_FROM_DEVICE:
  TransferBufferLength = 00000023
  TransferBuffer       = 81c5dc48
  TransferBufferMDL    = 00000000
  Index                = 00000001
  DescriptorType       = 00000002 (USB_CONFIGURATION_DESCRIPTOR_TYPE)
  LanguageId           = 00000000
[67642 ms] UsbSnoop - MyInternalIOCTLCompletion(f8907db0) : fido=00000000, Irp=81b6a770, Context=81b1cb28, IRQL=2
[67642 ms]  <<<  URB 2 coming back  <<< 
-- URB_FUNCTION_CONTROL_TRANSFER:
  PipeHandle           = 8215b408
  TransferFlags        = 81af4dab (USBD_TRANSFER_DIRECTION_IN, USBD_SHORT_TRANSFER_OK)
  TransferBufferLength = 00000023
  TransferBuffer       = 81c5dc48
  TransferBufferMDL    = 81cd6558
    00000000: 09 02 23 00 01 01 00 e0 00 09 04 00 00 02 ff 01
    00000010: 00 00 07 05 81 02 40 00 00 07 05 02 02 40 00 00
    00000020: 03 09 03
  UrbLink              = 00000000
  SetupPacket          =
    00000000: 80 06 01 02 00 00 23 00
[67642 ms] UsbSnoop - DispatchAny(f8906610) : IRP_MJ_INTERNAL_DEVICE_CONTROL
[67642 ms] UsbSnoop - MyDispatchInternalIOCTL(f8907e80) : fdo=81c5a708, Irp=81b6a770, IRQL=0
[67642 ms]  >>>  URB 3 going down  >>> 
-- URB_FUNCTION_SELECT_CONFIGURATION:
  ConfigurationDescriptor = 0x81c5dc48 (configure)
  ConfigurationDescriptor : bLength             = 9
  ConfigurationDescriptor : bDescriptorType     = 0x00000002
  ConfigurationDescriptor : wTotalLength        = 0x00000023
  ConfigurationDescriptor : bNumInterfaces      = 0x00000001
  ConfigurationDescriptor : bConfigurationValue = 0x00000001
  ConfigurationDescriptor : iConfiguration      = 0x00000000
  ConfigurationDescriptor : bmAttributes        = 0x000000e0
  ConfigurationDescriptor : MaxPower            = 0x00000000
  ConfigurationHandle     = 0x00000000
  Interface[0]: Length            = 56
  Interface[0]: InterfaceNumber   = 0
  Interface[0]: AlternateSetting  = 0
[67680 ms] UsbSnoop - MyInternalIOCTLCompletion(f8907db0) : fido=00000000, Irp=81b6a770, Context=81b1cd78, IRQL=0
[67680 ms]  <<<  URB 3 coming back  <<< 
-- URB_FUNCTION_SELECT_CONFIGURATION:
  ConfigurationDescriptor = 0x81c5dc48 (configure)
  ConfigurationDescriptor : bLength             = 9
  ConfigurationDescriptor : bDescriptorType     = 0x00000002
  ConfigurationDescriptor : wTotalLength        = 0x00000023
  ConfigurationDescriptor : bNumInterfaces      = 0x00000001
  ConfigurationDescriptor : bConfigurationValue = 0x00000001
  ConfigurationDescriptor : iConfiguration      = 0x00000000
  ConfigurationDescriptor : bmAttributes        = 0x000000e0
  ConfigurationDescriptor : MaxPower            = 0x00000000
  ConfigurationHandle     = 0x81b275a0
  Interface[0]: Length            = 56
  Interface[0]: InterfaceNumber   = 0
  Interface[0]: AlternateSetting  = 0
  Interface[0]: Class             = 0x000000ff
  Interface[0]: SubClass          = 0x00000001
  Interface[0]: Protocol          = 0x00000000
  Interface[0]: InterfaceHandle   = 0x81c45180
  Interface[0]: NumberOfPipes     = 2
  Interface[0]: Pipes[0] : MaximumPacketSize = 0x00000040
  Interface[0]: Pipes[0] : EndpointAddress   = 0x00000081
  Interface[0]: Pipes[0] : Interval          = 0x00000000
  Interface[0]: Pipes[0] : PipeType          = 0x00000002 (UsbdPipeTypeBulk)
  Interface[0]: Pipes[0] : PipeHandle        = 0x81c4519c
  Interface[0]: Pipes[0] : MaxTransferSize   = 0x00001000
  Interface[0]: Pipes[0] : PipeFlags         = 0x00000000
  Interface[0]: Pipes[1] : MaximumPacketSize = 0x00000040
  Interface[0]: Pipes[1] : EndpointAddress   = 0x00000002
  Interface[0]: Pipes[1] : Interval          = 0x00000000
  Interface[0]: Pipes[1] : PipeType          = 0x00000002 (UsbdPipeTypeBulk)
  Interface[0]: Pipes[1] : PipeHandle        = 0x81c451bc
  Interface[0]: Pipes[1] : MaxTransferSize   = 0x00001000
  Interface[0]: Pipes[1] : PipeFlags         = 0x00000000
[67681 ms] UsbSnoop - IRP_MJ_POWER (IRP_MN_WAIT_WAKE)
[68211 ms] UsbSnoop - DispatchAny(f8906610) : IRP_MJ_INTERNAL_DEVICE_CONTROL
[68211 ms] UsbSnoop - MyDispatchInternalIOCTL(f8907e80) : fdo=81c5a708, Irp=81b0a5c0, IRQL=2
[68211 ms]  >>>  URB 4 going down  >>> 
-- URB_FUNCTION_BULK_OR_INTERRUPT_TRANSFER:
  PipeHandle           = 81c451bc [endpoint 0x00000002]
  TransferFlags        = 00000000 (USBD_TRANSFER_DIRECTION_OUT, ~USBD_SHORT_TRANSFER_OK)
  TransferBufferLength = 00000009
  TransferBuffer       = 00000000
  TransferBufferMDL    = 81cb8378
    00000000: 00 00 00 04 01 00 00 04 00
  UrbLink              = 00000000
[68212 ms] UsbSnoop - MyInternalIOCTLCompletion(f8907db0) : fido=81b12d60, Irp=81b0a5c0, Context=81ac5a98, IRQL=2
[68212 ms]  <<<  URB 4 coming back  <<< 
-- URB_FUNCTION_BULK_OR_INTERRUPT_TRANSFER:
  PipeHandle           = 81c451bc [endpoint 0x00000002]
  TransferFlags        = 00000000 (USBD_TRANSFER_DIRECTION_OUT, ~USBD_SHORT_TRANSFER_OK)
  TransferBufferLength = 00000009
  TransferBuffer       = 00000000
  TransferBufferMDL    = 81cb8378
  UrbLink              = 00000000
[68212 ms] UsbSnoop - DispatchAny(f8906610) : IRP_MJ_INTERNAL_DEVICE_CONTROL
[68212 ms] UsbSnoop - MyDispatchInternalIOCTL(f8907e80) : fdo=81c5a708, Irp=81b0a5c0, IRQL=2
[68212 ms]  >>>  URB 5 going down  >>> 
-- URB_FUNCTION_BULK_OR_INTERRUPT_TRANSFER:
  PipeHandle           = 81c4519c [endpoint 0x00000081]
  TransferFlags        = 00000003 (USBD_TRANSFER_DIRECTION_IN, USBD_SHORT_TRANSFER_OK)
  TransferBufferLength = 00000100
  TransferBuffer       = 00000000
  TransferBufferMDL    = 81cb8378
  UrbLink              = 00000000
[68214 ms] UsbSnoop - MyInternalIOCTLCompletion(f8907db0) : fido=81b12d60, Irp=81b0a5c0, Context=81ac5a98, IRQL=2
[68214 ms]  <<<  URB 5 coming back  <<< 
-- URB_FUNCTION_BULK_OR_INTERRUPT_TRANSFER:
  PipeHandle           = 81c4519c [endpoint 0x00000081]
  TransferFlags        = 00000003 (USBD_TRANSFER_DIRECTION_IN, USBD_SHORT_TRANSFER_OK)
  TransferBufferLength = 00000009
  TransferBuffer       = 00000000
  TransferBufferMDL    = 81cb8378
    00000000: 00 00 00 04 02 00 00 03 ff
  UrbLink              = 00000000
[68241 ms] UsbSnoop - DispatchAny(f8906610) : IRP_MJ_INTERNAL_DEVICE_CONTROL
[68241 ms] UsbSnoop - MyDispatchInternalIOCTL(f8907e80) : fdo=81c5a708, Irp=81b0a5c0, IRQL=2
[68241 ms]  >>>  URB 6 going down  >>> 
-- URB_FUNCTION_BULK_OR_INTERRUPT_TRANSFER:
  PipeHandle           = 81c451bc [endpoint 0x00000002]
  TransferFlags        = 00000000 (USBD_TRANSFER_DIRECTION_OUT, ~USBD_SHORT_TRANSFER_OK)
  TransferBufferLength = 00000015
  TransferBuffer       = 00000000
  TransferBufferMDL    = 81cb8378
    00000000: 00 00 00 10 04 00 00 00 0a 00 01 00 03 00 01 00
    00000010: 00 00 00 07 d0
  UrbLink              = 00000000
[68241 ms] UsbSnoop - MyInternalIOCTLCompletion(f8907db0) : fido=81b12d60, Irp=81b0a5c0, Context=81ad8d78, IRQL=2
[68241 ms]  <<<  URB 6 coming back  <<< 
-- URB_FUNCTION_BULK_OR_INTERRUPT_TRANSFER:
  PipeHandle           = 81c451bc [endpoint 0x00000002]
  TransferFlags        = 00000000 (USBD_TRANSFER_DIRECTION_OUT, ~USBD_SHORT_TRANSFER_OK)
  TransferBufferLength = 00000015
  TransferBuffer       = 00000000
  TransferBufferMDL    = 81cb8378
  UrbLink              = 00000000
[68251 ms] UsbSnoop - DispatchAny(f8906610) : IRP_MJ_INTERNAL_DEVICE_CONTROL
[68251 ms] UsbSnoop - MyDispatchInternalIOCTL(f8907e80) : fdo=81c5a708, Irp=81b0a5c0, IRQL=2
[68251 ms]  >>>  URB 7 going down  >>> 
-- URB_FUNCTION_BULK_OR_INTERRUPT_TRANSFER:
  PipeHandle           = 81c4519c [endpoint 0x00000081]
  TransferFlags        = 00000003 (USBD_TRANSFER_DIRECTION_IN, USBD_SHORT_TRANSFER_OK)
  TransferBufferLength = 00000100
  TransferBuffer       = 00000000
  TransferBufferMDL    = 81cb8378
  UrbLink              = 00000000
[68251 ms] UsbSnoop - MyInternalIOCTLCompletion(f8907db0) : fido=81b12d60, Irp=81b0a5c0, Context=81ac5a98, IRQL=2
[68251 ms]  <<<  URB 7 coming back  <<< 
-- URB_FUNCTION_BULK_OR_INTERRUPT_TRANSFER:
  PipeHandle           = 81c4519c [endpoint 0x00000081]
  TransferFlags        = 00000003 (USBD_TRANSFER_DIRECTION_IN, USBD_SHORT_TRANSFER_OK)
  TransferBufferLength = 00000007
  TransferBuffer       = 00000000
  TransferBufferMDL    = 81cb8378
    00000000: 00 00 00 02 05 e0 00
  UrbLink              = 00000000
[68291 ms] UsbSnoop - DispatchAny(f8906610) : IRP_MJ_INTERNAL_DEVICE_CONTROL
[68291 ms] UsbSnoop - MyDispatchInternalIOCTL(f8907e80) : fdo=81c5a708, Irp=81b0a5c0, IRQL=2
[68291 ms]  >>>  URB 8 going down  >>> 
-- URB_FUNCTION_BULK_OR_INTERRUPT_TRANSFER:
  PipeHandle           = 81c4519c [endpoint 0x00000081]
  TransferFlags        = 00000003 (USBD_TRANSFER_DIRECTION_IN, USBD_SHORT_TRANSFER_OK)
  TransferBufferLength = 00000100
  TransferBuffer       = 00000000
  TransferBufferMDL    = 81cb8378
  UrbLink              = 00000000
[68292 ms] UsbSnoop - MyInternalIOCTLCompletion(f8907db0) : fido=81b12d60, Irp=81b0a5c0, Context=81ad8b90, IRQL=2
[68292 ms]  <<<  URB 8 coming back  <<< 
-- URB_FUNCTION_BULK_OR_INTERRUPT_TRANSFER:
  PipeHandle           = 81c4519c [endpoint 0x00000081]
  TransferFlags        = 00000003 (USBD_TRANSFER_DIRECTION_IN, USBD_SHORT_TRANSFER_OK)
  TransferBufferLength = 00000005
  TransferBuffer       = 00000000
  TransferBufferMDL    = 81cb8378
    00000000: 00 00 00 0a 04
  UrbLink              = 00000000
[68321 ms] UsbSnoop - DispatchAny(f8906610) : IRP_MJ_INTERNAL_DEVICE_CONTROL
[68321 ms] UsbSnoop - MyDispatchInternalIOCTL(f8907e80) : fdo=81c5a708, Irp=81b0a5c0, IRQL=2
[68321 ms]  >>>  URB 9 going down  >>> 
-- URB_FUNCTION_BULK_OR_INTERRUPT_TRANSFER:
  PipeHandle           = 81c4519c [endpoint 0x00000081]
  TransferFlags        = 00000003 (USBD_TRANSFER_DIRECTION_IN, USBD_SHORT_TRANSFER_OK)
  TransferBufferLength = 00000100
  TransferBuffer       = 00000000
  TransferBufferMDL    = 81cb8378
  UrbLink              = 00000000
[68322 ms] UsbSnoop - MyInternalIOCTLCompletion(f8907db0) : fido=81b12d60, Irp=81b0a5c0, Context=81ac0f70, IRQL=2
[68322 ms]  <<<  URB 9 coming back  <<< 
-- URB_FUNCTION_BULK_OR_INTERRUPT_TRANSFER:
  PipeHandle           = 81c4519c [endpoint 0x00000081]
  TransferFlags        = 00000003 (USBD_TRANSFER_DIRECTION_IN, USBD_SHORT_TRANSFER_OK)
  TransferBufferLength = 0000000a
  TransferBuffer       = 00000000
  TransferBufferMDL    = 81cb8378
    00000000: 00 00 00 04 00 12 00 00 07 d0
  UrbLink              = 00000000
[68352 ms] UsbSnoop - DispatchAny(f8906610) : IRP_MJ_INTERNAL_DEVICE_CONTROL
[68352 ms] UsbSnoop - MyDispatchInternalIOCTL(f8907e80) : fdo=81c5a708, Irp=81d58008, IRQL=2
[68352 ms]  >>>  URB 10 going down  >>> 
-- URB_FUNCTION_BULK_OR_INTERRUPT_TRANSFER:
  PipeHandle           = 81c451bc [endpoint 0x00000002]
  TransferFlags        = 00000000 (USBD_TRANSFER_DIRECTION_OUT, ~USBD_SHORT_TRANSFER_OK)
  TransferBufferLength = 00000007
  TransferBuffer       = 00000000
  TransferBufferMDL    = 81cd6558
    00000000: 00 00 00 02 05 e0 00
  UrbLink              = 00000000
[68352 ms] UsbSnoop - MyInternalIOCTLCompletion(f8907db0) : fido=81b12d60, Irp=81d58008, Context=81ac5b00, IRQL=2
[68352 ms]  <<<  URB 10 coming back  <<< 
-- URB_FUNCTION_BULK_OR_INTERRUPT_TRANSFER:
  PipeHandle           = 81c451bc [endpoint 0x00000002]
  TransferFlags        = 00000000 (USBD_TRANSFER_DIRECTION_OUT, ~USBD_SHORT_TRANSFER_OK)
  TransferBufferLength = 00000007
  TransferBuffer       = 00000000
  TransferBufferMDL    = 81cd6558
  UrbLink              = 00000000
[68362 ms] UsbSnoop - DispatchAny(f8906610) : IRP_MJ_INTERNAL_DEVICE_CONTROL
[68362 ms] UsbSnoop - MyDispatchInternalIOCTL(f8907e80) : fdo=81c5a708, Irp=81d58008, IRQL=2
[68362 ms]  >>>  URB 11 going down  >>> 
-- URB_FUNCTION_BULK_OR_INTERRUPT_TRANSFER:
  PipeHandle           = 81c451bc [endpoint 0x00000002]
  TransferFlags        = 00000000 (USBD_TRANSFER_DIRECTION_OUT, ~USBD_SHORT_TRANSFER_OK)
  TransferBufferLength = 0000000f
  TransferBuffer       = 00000000
  TransferBufferMDL    = 81cd6558
    00000000: 00 00 00 0a 04 00 00 00 04 00 07 00 01 00 22
  UrbLink              = 00000000
[68363 ms] UsbSnoop - MyInternalIOCTLCompletion(f8907db0) : fido=81b12d60, Irp=81d58008, Context=81ad8d78, IRQL=2
[68363 ms]  <<<  URB 11 coming back  <<< 
-- URB_FUNCTION_BULK_OR_INTERRUPT_TRANSFER:
  PipeHandle           = 81c451bc [endpoint 0x00000002]
  TransferFlags        = 00000000 (USBD_TRANSFER_DIRECTION_OUT, ~USBD_SHORT_TRANSFER_OK)
  TransferBufferLength = 0000000f
  TransferBuffer       = 00000000
  TransferBufferMDL    = 81cd6558
  UrbLink              = 00000000
[68372 ms] UsbSnoop - DispatchAny(f8906610) : IRP_MJ_INTERNAL_DEVICE_CONTROL
[68372 ms] UsbSnoop - MyDispatchInternalIOCTL(f8907e80) : fdo=81c5a708, Irp=81d58008, IRQL=2
[68372 ms]  >>>  URB 12 going down  >>> 
-- URB_FUNCTION_BULK_OR_INTERRUPT_TRANSFER:
  PipeHandle           = 81c4519c [endpoint 0x00000081]
  TransferFlags        = 00000003 (USBD_TRANSFER_DIRECTION_IN, USBD_SHORT_TRANSFER_OK)
  TransferBufferLength = 00000100
  TransferBuffer       = 00000000
  TransferBufferMDL    = 81cd6558
  UrbLink              = 00000000
[68372 ms] UsbSnoop - MyInternalIOCTLCompletion(f8907db0) : fido=81b12d60, Irp=81d58008, Context=81ac5a98, IRQL=2
[68372 ms]  <<<  URB 12 coming back  <<< 
-- URB_FUNCTION_BULK_OR_INTERRUPT_TRANSFER:
  PipeHandle           = 81c4519c [endpoint 0x00000081]
  TransferFlags        = 00000003 (USBD_TRANSFER_DIRECTION_IN, USBD_SHORT_TRANSFER_OK)
  TransferBufferLength = 00000009
  TransferBuffer       = 00000000
  TransferBufferMDL    = 81cd6558
    00000000: 00 00 00 04 01 00 00 03 ff
  UrbLink              = 00000000
[68412 ms] UsbSnoop - DispatchAny(f8906610) : IRP_MJ_INTERNAL_DEVICE_CONTROL
[68412 ms] UsbSnoop - MyDispatchInternalIOCTL(f8907e80) : fdo=81c5a708, Irp=81d58008, IRQL=2
[68412 ms]  >>>  URB 13 going down  >>> 
-- URB_FUNCTION_BULK_OR_INTERRUPT_TRANSFER:
  PipeHandle           = 81c451bc [endpoint 0x00000002]
  TransferFlags        = 00000000 (USBD_TRANSFER_DIRECTION_OUT, ~USBD_SHORT_TRANSFER_OK)
  TransferBufferLength = 00000009
  TransferBuffer       = 00000000
  TransferBufferMDL    = 81cd6558
    00000000: 00 00 00 04 02 00 00 03 ff
  UrbLink              = 00000000
[68412 ms] UsbSnoop - MyInternalIOCTLCompletion(f8907db0) : fido=81b12d60, Irp=81d58008, Context=81ad8b90, IRQL=2
[68412 ms]  <<<  URB 13 coming back  <<< 
-- URB_FUNCTION_BULK_OR_INTERRUPT_TRANSFER:
  PipeHandle           = 81c451bc [endpoint 0x00000002]
  TransferFlags        = 00000000 (USBD_TRANSFER_DIRECTION_OUT, ~USBD_SHORT_TRANSFER_OK)
  TransferBufferLength = 00000009
  TransferBuffer       = 00000000
  TransferBufferMDL    = 81cd6558
  UrbLink              = 00000000
[68422 ms] UsbSnoop - DispatchAny(f8906610) : IRP_MJ_INTERNAL_DEVICE_CONTROL
[68422 ms] UsbSnoop - MyDispatchInternalIOCTL(f8907e80) : fdo=81c5a708, Irp=81d58008, IRQL=2
[68422 ms]  >>>  URB 14 going down  >>> 
-- URB_FUNCTION_BULK_OR_INTERRUPT_TRANSFER:
  PipeHandle           = 81c4519c [endpoint 0x00000081]
  TransferFlags        = 00000003 (USBD_TRANSFER_DIRECTION_IN, USBD_SHORT_TRANSFER_OK)
  TransferBufferLength = 00000100
  TransferBuffer       = 00000000
  TransferBufferMDL    = 81cd6558
  UrbLink              = 00000000
[68422 ms] UsbSnoop - MyInternalIOCTLCompletion(f8907db0) : fido=81b12d60, Irp=81d58008, Context=81ac0f70, IRQL=2
[68422 ms]  <<<  URB 14 coming back  <<< 
-- URB_FUNCTION_BULK_OR_INTERRUPT_TRANSFER:
  PipeHandle           = 81c4519c [endpoint 0x00000081]
  TransferFlags        = 00000003 (USBD_TRANSFER_DIRECTION_IN, USBD_SHORT_TRANSFER_OK)
  TransferBufferLength = 00000007
  TransferBuffer       = 00000000
  TransferBufferMDL    = 81cd6558
    00000000: 00 00 00 02 05 e0 00
  UrbLink              = 00000000
[68462 ms] UsbSnoop - DispatchAny(f8906610) : IRP_MJ_INTERNAL_DEVICE_CONTROL
[68462 ms] UsbSnoop - MyDispatchInternalIOCTL(f8907e80) : fdo=81c5a708, Irp=81d58008, IRQL=2
[68462 ms]  >>>  URB 15 going down  >>> 
-- URB_FUNCTION_BULK_OR_INTERRUPT_TRANSFER:
  PipeHandle           = 81c4519c [endpoint 0x00000081]
  TransferFlags        = 00000003 (USBD_TRANSFER_DIRECTION_IN, USBD_SHORT_TRANSFER_OK)
  TransferBufferLength = 00000100
  TransferBuffer       = 00000000
  TransferBufferMDL    = 81cd6558
  UrbLink              = 00000000
[68462 ms] UsbSnoop - MyInternalIOCTLCompletion(f8907db0) : fido=81b12d60, Irp=81d58008, Context=81ac5b00, IRQL=2
[68462 ms]  <<<  URB 15 coming back  <<< 
-- URB_FUNCTION_BULK_OR_INTERRUPT_TRANSFER:
  PipeHandle           = 81c4519c [endpoint 0x00000081]
  TransferFlags        = 00000003 (USBD_TRANSFER_DIRECTION_IN, USBD_SHORT_TRANSFER_OK)
  TransferBufferLength = 00000005
  TransferBuffer       = 00000000
  TransferBufferMDL    = 81cd6558
    00000000: 00 00 03 ff 03
  UrbLink              = 00000000
[68492 ms] UsbSnoop - DispatchAny(f8906610) : IRP_MJ_INTERNAL_DEVICE_CONTROL
[68492 ms] UsbSnoop - MyDispatchInternalIOCTL(f8907e80) : fdo=81c5a708, Irp=81d58008, IRQL=2
[68492 ms]  >>>  URB 16 going down  >>> 
-- URB_FUNCTION_BULK_OR_INTERRUPT_TRANSFER:
  PipeHandle           = 81c4519c [endpoint 0x00000081]
  TransferFlags        = 00000003 (USBD_TRANSFER_DIRECTION_IN, USBD_SHORT_TRANSFER_OK)
  TransferBufferLength = 00000100
  TransferBuffer       = 00000000
  TransferBufferMDL    = 81cd6558
  UrbLink              = 00000000
[68494 ms] UsbSnoop - MyInternalIOCTLCompletion(f8907db0) : fido=81b12d60, Irp=81d58008, Context=81ad8d78, IRQL=2
[68494 ms]  <<<  URB 16 coming back  <<< 
-- URB_FUNCTION_BULK_OR_INTERRUPT_TRANSFER:
  PipeHandle           = 81c4519c [endpoint 0x00000081]
  TransferFlags        = 00000003 (USBD_TRANSFER_DIRECTION_IN, USBD_SHORT_TRANSFER_OK)
  TransferBufferLength = 00000100
  TransferBuffer       = 00000000
  TransferBufferMDL    = 81cd6558
    00000000: 00 00 0f 07 00 08 00 01 00 22 00 0f 00 1f ff e3
    00000010: ff ff ff 1f ff 8f ff fc 7f ff ff 1f ff ff fe 3f
    00000020: f8 00 00 00 00 00 00 00 00 00 00 20 00 14 00 00
    00000030: 00 a0 00 50 00 02 80 00 00 a0 00 00 01 40 04 00
    00000040: 00 00 00 00 00 00 00 00 00 43 90 08 03 b0 00 47
    00000050: 60 20 e8 01 00 ee 00 40 0e 60 00 80 02 00 00 00
    00000060: 00 00 00 00 00 00 00 82 30 08 02 08 00 44 10 20
    00000070: 8a 01 00 88 00 40 08 80 00 80 01 00 00 00 00 00
    00000080: 00 00 00 00 00 83 13 88 03 13 80 46 27 20 ce e1
    00000090: 00 cc 00 40 0c ee 00 80 01 00 00 00 00 00 00 00
    000000a0: 00 00 00 82 11 08 02 21 00 44 12 20 82 41 00 82
    000000b0: 00 40 08 a4 00 80 01 00 00 00 00 00 00 00 00 00
    000000c0: 00 82 38 08 02 38 00 44 60 20 82 01 00 8c 00 40
    000000d0: 08 e0 00 80 01 00 00 00 00 00 00 00 00 00 00 80
    000000e0: 00 08 00 00 00 40 00 20 00 01 00 00 00 40 00 00
    000000f0: 00 80 01 00 00 00 00 00 00 00 00 00 00 b8 03 09
  UrbLink              = 00000000
[68522 ms] UsbSnoop - DispatchAny(f8906610) : IRP_MJ_INTERNAL_DEVICE_CONTROL
[68522 ms] UsbSnoop - MyDispatchInternalIOCTL(f8907e80) : fdo=81c5a708, Irp=81d58008, IRQL=2
[68522 ms]  >>>  URB 17 going down  >>> 
-- URB_FUNCTION_BULK_OR_INTERRUPT_TRANSFER:
  PipeHandle           = 81c4519c [endpoint 0x00000081]
  TransferFlags        = 00000003 (USBD_TRANSFER_DIRECTION_IN, USBD_SHORT_TRANSFER_OK)
  TransferBufferLength = 00000100
  TransferBuffer       = 00000000
  TransferBufferMDL    = 81cd6558
  UrbLink              = 00000000
[68524 ms] UsbSnoop - MyInternalIOCTLCompletion(f8907db0) : fido=81b12d60, Irp=81d58008, Context=81ac0f70, IRQL=2
[68524 ms]  <<<  URB 17 coming back  <<< 
-- URB_FUNCTION_BULK_OR_INTERRUPT_TRANSFER:
  PipeHandle           = 81c4519c [endpoint 0x00000081]
  TransferFlags        = 00000003 (USBD_TRANSFER_DIRECTION_IN, USBD_SHORT_TRANSFER_OK)
  TransferBufferLength = 00000100
  TransferBuffer       = 00000000
  TransferBufferMDL    = 81cd6558
    00000000: 33 04 00 4c 18 2e 90 01 60 30 17 4d 80 00 a0 80
    00000010: 01 00 00 00 00 00 00 00 00 00 00 91 11 6a 95 26
    00000020: 53 50 c9 aa d8 95 55 56 95 50 91 b0 ac 80 01 00
    00000030: 00 00 00 00 00 00 00 00 00 92 a9 4b 93 55 65 51
    00000040: 4a 2a 95 59 66 35 55 50 aa a8 aa 80 01 00 00 00
    00000050: 00 00 00 00 00 00 00 92 a9 2a 91 65 45 51 4a 2a
    00000060: 95 91 44 15 55 50 b2 a8 ac 80 01 00 00 00 00 00
    00000070: 00 00 00 00 00 91 11 6a 96 36 43 4c c9 ae 54 d1
    00000080: 44 64 57 4c 99 a8 e8 80 01 00 00 00 00 00 00 00
    00000090: 00 00 00 80 00 08 00 00 00 40 00 20 00 01 00 00
    000000a0: 00 40 00 00 00 80 01 00 00 00 00 00 00 00 00 00
    000000b0: 00 80 00 08 00 00 00 40 00 20 00 01 00 00 00 40
    000000c0: 00 00 00 80 01 00 00 00 00 00 00 00 00 00 00 ff
    000000d0: ff ff ff ff ff ff ff ff ff ff ff ff ff ff ff ff
    000000e0: ff ff ff 00 00 00 00 00 00 00 00 00 00 00 00 00
    000000f0: 00 00 00 00 00 00 00 00 00 00 00 00 00 00 00 00
  UrbLink              = 00000000
[68552 ms] UsbSnoop - DispatchAny(f8906610) : IRP_MJ_INTERNAL_DEVICE_CONTROL
[68552 ms] UsbSnoop - MyDispatchInternalIOCTL(f8907e80) : fdo=81c5a708, Irp=81d58008, IRQL=2
[68552 ms]  >>>  URB 18 going down  >>> 
-- URB_FUNCTION_BULK_OR_INTERRUPT_TRANSFER:
  PipeHandle           = 81c4519c [endpoint 0x00000081]
  TransferFlags        = 00000003 (USBD_TRANSFER_DIRECTION_IN, USBD_SHORT_TRANSFER_OK)
  TransferBufferLength = 00000100
  TransferBuffer       = 00000000
  TransferBufferMDL    = 81cd6558
  UrbLink              = 00000000
[68554 ms] UsbSnoop - MyInternalIOCTLCompletion(f8907db0) : fido=81b12d60, Irp=81d58008, Context=81ac5a98, IRQL=2
[68554 ms]  <<<  URB 18 coming back  <<< 
-- URB_FUNCTION_BULK_OR_INTERRUPT_TRANSFER:
  PipeHandle           = 81c4519c [endpoint 0x00000081]
  TransferFlags        = 00000003 (USBD_TRANSFER_DIRECTION_IN, USBD_SHORT_TRANSFER_OK)
  TransferBufferLength = 00000100
  TransferBuffer       = 00000000
  TransferBufferMDL    = 81cd6558
    00000000: 00 00 00 00 00 00 00 00 00 00 00 00 00 00 00 00
    00000010: 00 00 00 00 00 00 00 00 00 00 00 00 00 00 00 00
    00000020: 00 00 00 00 00 00 00 00 00 00 00 00 00 00 00 00
    00000030: 00 00 00 00 00 00 00 00 00 00 00 00 00 00 00 00
    00000040: 00 00 00 00 00 00 00 00 00 00 00 00 00 00 00 00
    00000050: 00 00 00 00 00 00 00 00 00 00 00 00 00 00 00 00
    00000060: 00 00 00 00 00 00 00 00 00 00 00 00 00 00 00 00
    00000070: 00 00 00 00 00 00 00 00 00 00 00 00 00 00 00 00
    00000080: 00 00 00 00 00 00 00 00 00 00 00 00 00 00 00 00
    00000090: 00 00 00 00 00 00 00 00 00 00 00 00 00 00 00 00
    000000a0: 00 00 00 00 00 00 00 00 00 00 00 00 00 00 00 00
    000000b0: 00 00 00 00 00 00 00 00 00 00 00 00 00 00 00 00
    000000c0: 00 00 00 00 00 00 00 00 00 00 00 00 00 00 00 00
    000000d0: 00 00 00 00 00 00 00 00 00 00 00 00 00 00 00 00
    000000e0: 00 00 00 00 00 00 00 00 00 00 00 00 00 00 00 00
    000000f0: 00 00 00 00 00 00 00 00 00 00 00 00 00 00 00 00
  UrbLink              = 00000000
[68582 ms] UsbSnoop - DispatchAny(f8906610) : IRP_MJ_INTERNAL_DEVICE_CONTROL
[68582 ms] UsbSnoop - MyDispatchInternalIOCTL(f8907e80) : fdo=81c5a708, Irp=81d58008, IRQL=2
[68582 ms]  >>>  URB 19 going down  >>> 
-- URB_FUNCTION_BULK_OR_INTERRUPT_TRANSFER:
  PipeHandle           = 81c4519c [endpoint 0x00000081]
  TransferFlags        = 00000003 (USBD_TRANSFER_DIRECTION_IN, USBD_SHORT_TRANSFER_OK)
  TransferBufferLength = 00000100
  TransferBuffer       = 00000000
  TransferBufferMDL    = 81cd6558
  UrbLink              = 00000000
[68584 ms] UsbSnoop - MyInternalIOCTLCompletion(f8907db0) : fido=81b12d60, Irp=81d58008, Context=81ad8d78, IRQL=2
[68584 ms]  <<<  URB 19 coming back  <<< 
-- URB_FUNCTION_BULK_OR_INTERRUPT_TRANSFER:
  PipeHandle           = 81c4519c [endpoint 0x00000081]
  TransferFlags        = 00000003 (USBD_TRANSFER_DIRECTION_IN, USBD_SHORT_TRANSFER_OK)
  TransferBufferLength = 000000ff
  TransferBuffer       = 00000000
  TransferBufferMDL    = 81cd6558
    00000000: 00 00 00 00 00 00 00 00 00 00 00 00 00 00 00 00
    00000010: 00 00 00 00 00 00 00 00 00 00 00 00 00 00 00 00
    00000020: 00 00 00 00 00 00 00 00 00 00 00 00 00 00 00 00
    00000030: 00 00 00 00 00 00 00 00 00 00 00 00 00 00 00 00
    00000040: 00 00 00 00 00 00 00 00 00 00 00 00 00 00 00 00
    00000050: 00 00 00 00 00 00 00 00 00 00 00 00 00 00 00 00
    00000060: 00 00 00 00 00 00 00 00 00 00 00 00 00 00 00 00
    00000070: 00 00 00 00 00 00 00 00 00 00 00 00 00 00 00 00
    00000080: 00 00 00 00 00 00 00 00 00 00 00 00 00 00 00 00
    00000090: 00 00 00 00 00 00 00 00 00 00 00 00 00 00 00 00
    000000a0: 00 00 00 00 00 00 00 00 00 00 00 00 00 00 00 00
    000000b0: 00 00 00 00 00 00 00 00 00 00 00 00 00 00 00 00
    000000c0: 00 00 00 00 00 00 00 00 00 00 00 00 00 00 00 00
    000000d0: 00 00 00 00 00 00 00 00 00 00 00 00 00 00 00 00
    000000e0: 00 00 00 00 00 00 00 00 00 00 00 00 00 00 00 00
    000000f0: 00 00 00 00 00 00 00 00 00 00 00 00 00 00 00
  UrbLink              = 00000000
[68615 ms] UsbSnoop - DispatchAny(f8906610) : IRP_MJ_INTERNAL_DEVICE_CONTROL
[68615 ms] UsbSnoop - MyDispatchInternalIOCTL(f8907e80) : fdo=81c5a708, Irp=81d58008, IRQL=2
[68615 ms]  >>>  URB 20 going down  >>> 
-- URB_FUNCTION_BULK_OR_INTERRUPT_TRANSFER:
  PipeHandle           = 81c451bc [endpoint 0x00000002]
  TransferFlags        = 00000000 (USBD_TRANSFER_DIRECTION_OUT, ~USBD_SHORT_TRANSFER_OK)
  TransferBufferLength = 00000007
  TransferBuffer       = 00000000
  TransferBufferMDL    = 81cd6558
    00000000: 00 00 00 02 05 e0 00
  UrbLink              = 00000000
[68615 ms] UsbSnoop - MyInternalIOCTLCompletion(f8907db0) : fido=81b12d60, Irp=81d58008, Context=81ac0f70, IRQL=2
[68615 ms]  <<<  URB 20 coming back  <<< 
-- URB_FUNCTION_BULK_OR_INTERRUPT_TRANSFER:
  PipeHandle           = 81c451bc [endpoint 0x00000002]
  TransferFlags        = 00000000 (USBD_TRANSFER_DIRECTION_OUT, ~USBD_SHORT_TRANSFER_OK)
  TransferBufferLength = 00000007
  TransferBuffer       = 00000000
  TransferBufferMDL    = 81cd6558
  UrbLink              = 00000000
[68622 ms] UsbSnoop - DispatchAny(f8906610) : IRP_MJ_INTERNAL_DEVICE_CONTROL
[68622 ms] UsbSnoop - MyDispatchInternalIOCTL(f8907e80) : fdo=81c5a708, Irp=81d58008, IRQL=2
[68622 ms]  >>>  URB 21 going down  >>> 
-- URB_FUNCTION_BULK_OR_INTERRUPT_TRANSFER:
  PipeHandle           = 81c4519c [endpoint 0x00000081]
  TransferFlags        = 00000003 (USBD_TRANSFER_DIRECTION_IN, USBD_SHORT_TRANSFER_OK)
  TransferBufferLength = 00000100
  TransferBuffer       = 00000000
  TransferBufferMDL    = 81cd6558
  UrbLink              = 00000000
[68622 ms] UsbSnoop - MyInternalIOCTLCompletion(f8907db0) : fido=81b12d60, Irp=81d58008, Context=81ad8d78, IRQL=2
[68622 ms]  <<<  URB 21 coming back  <<< 
-- URB_FUNCTION_BULK_OR_INTERRUPT_TRANSFER:
  PipeHandle           = 81c4519c [endpoint 0x00000081]
  TransferFlags        = 00000003 (USBD_TRANSFER_DIRECTION_IN, USBD_SHORT_TRANSFER_OK)
  TransferBufferLength = 00000005
  TransferBuffer       = 00000000
  TransferBufferMDL    = 81cd6558
    00000000: 00 00 03 ff 03
  UrbLink              = 00000000
[68652 ms] UsbSnoop - DispatchAny(f8906610) : IRP_MJ_INTERNAL_DEVICE_CONTROL
[68652 ms] UsbSnoop - MyDispatchInternalIOCTL(f8907e80) : fdo=81c5a708, Irp=81d58008, IRQL=2
[68652 ms]  >>>  URB 22 going down  >>> 
-- URB_FUNCTION_BULK_OR_INTERRUPT_TRANSFER:
  PipeHandle           = 81c4519c [endpoint 0x00000081]
  TransferFlags        = 00000003 (USBD_TRANSFER_DIRECTION_IN, USBD_SHORT_TRANSFER_OK)
  TransferBufferLength = 00000100
  TransferBuffer       = 00000000
  TransferBufferMDL    = 81cd6558
  UrbLink              = 00000000
[68654 ms] UsbSnoop - MyInternalIOCTLCompletion(f8907db0) : fido=81b12d60, Irp=81d58008, Context=81ad8b90, IRQL=2
[68654 ms]  <<<  URB 22 coming back  <<< 
-- URB_FUNCTION_BULK_OR_INTERRUPT_TRANSFER:
  PipeHandle           = 81c4519c [endpoint 0x00000081]
  TransferFlags        = 00000003 (USBD_TRANSFER_DIRECTION_IN, USBD_SHORT_TRANSFER_OK)
  TransferBufferLength = 00000100
  TransferBuffer       = 00000000
  TransferBufferMDL    = 81cd6558
    00000000: 00 00 00 00 00 00 00 00 00 00 00 00 00 00 00 00
    00000010: 00 00 00 00 00 00 00 00 00 00 00 00 00 00 00 00
    00000020: 00 00 00 00 00 00 00 00 00 00 00 00 00 00 00 00
    00000030: 00 00 00 00 00 00 00 00 00 00 00 00 00 00 00 00
    00000040: 00 00 00 00 00 00 00 00 00 00 00 00 00 00 00 00
    00000050: 00 00 00 00 00 00 00 00 00 00 00 00 00 00 00 00
    00000060: 00 00 00 00 00 00 00 00 00 00 00 00 00 00 00 00
    00000070: 00 00 00 00 00 00 00 00 00 00 00 00 00 00 00 00
    00000080: 00 00 00 00 00 00 00 00 00 00 00 00 00 00 00 00
    00000090: 00 00 00 00 00 00 00 00 00 00 00 00 00 00 00 00
    000000a0: 00 00 00 00 00 00 00 00 00 00 00 00 00 00 00 00
    000000b0: 00 00 00 00 00 00 00 00 00 00 00 00 00 00 00 00
    000000c0: 00 00 00 00 00 00 00 00 00 00 00 00 00 00 00 00
    000000d0: 00 00 00 00 00 00 00 00 00 00 00 00 00 00 00 00
    000000e0: 00 00 00 00 00 00 00 00 00 00 00 00 00 00 00 00
    000000f0: 00 00 00 00 00 00 00 00 00 00 00 00 00 00 00 00
  UrbLink              = 00000000
[68682 ms] UsbSnoop - DispatchAny(f8906610) : IRP_MJ_INTERNAL_DEVICE_CONTROL
[68682 ms] UsbSnoop - MyDispatchInternalIOCTL(f8907e80) : fdo=81c5a708, Irp=81d58008, IRQL=2
[68682 ms]  >>>  URB 23 going down  >>> 
-- URB_FUNCTION_BULK_OR_INTERRUPT_TRANSFER:
  PipeHandle           = 81c4519c [endpoint 0x00000081]
  TransferFlags        = 00000003 (USBD_TRANSFER_DIRECTION_IN, USBD_SHORT_TRANSFER_OK)
  TransferBufferLength = 00000100
  TransferBuffer       = 00000000
  TransferBufferMDL    = 81cd6558
  UrbLink              = 00000000
[68684 ms] UsbSnoop - MyInternalIOCTLCompletion(f8907db0) : fido=81b12d60, Irp=81d58008, Context=81ac0f70, IRQL=2
[68684 ms]  <<<  URB 23 coming back  <<< 
-- URB_FUNCTION_BULK_OR_INTERRUPT_TRANSFER:
  PipeHandle           = 81c4519c [endpoint 0x00000081]
  TransferFlags        = 00000003 (USBD_TRANSFER_DIRECTION_IN, USBD_SHORT_TRANSFER_OK)
  TransferBufferLength = 00000100
  TransferBuffer       = 00000000
  TransferBufferMDL    = 81cd6558
    00000000: 00 00 00 00 00 00 00 00 00 00 00 00 00 00 00 00
    00000010: 00 00 00 00 00 00 00 00 00 00 00 00 00 00 00 00
    00000020: 00 00 00 00 00 00 00 00 00 00 00 00 00 00 00 00
    00000030: 00 00 00 00 00 00 00 00 00 00 00 00 00 00 00 00
    00000040: 00 00 00 00 00 00 00 00 00 00 00 00 00 00 00 00
    00000050: 00 00 00 00 00 00 00 00 00 00 00 00 00 00 00 00
    00000060: 00 00 00 00 00 00 00 00 00 00 00 00 00 00 00 00
    00000070: 00 00 00 00 00 00 00 00 00 00 00 00 00 00 00 00
    00000080: 00 00 00 00 00 00 00 00 00 00 00 00 00 00 00 00
    00000090: 00 00 00 00 00 00 00 00 00 00 00 00 00 00 00 00
    000000a0: 00 00 00 00 00 00 00 00 00 00 00 00 00 00 00 00
    000000b0: 00 00 00 00 00 00 00 00 00 00 00 00 00 00 00 00
    000000c0: 00 00 00 00 00 00 00 00 00 00 00 00 00 00 00 00
    000000d0: 00 00 00 00 00 00 00 00 00 00 00 00 00 00 00 00
    000000e0: 00 00 00 00 00 00 00 00 00 00 00 00 00 00 00 00
    000000f0: 00 00 00 00 00 00 00 00 00 00 00 00 00 00 00 00
  UrbLink              = 00000000
[68712 ms] UsbSnoop - DispatchAny(f8906610) : IRP_MJ_INTERNAL_DEVICE_CONTROL
[68712 ms] UsbSnoop - MyDispatchInternalIOCTL(f8907e80) : fdo=81c5a708, Irp=81d58008, IRQL=2
[68712 ms]  >>>  URB 24 going down  >>> 
-- URB_FUNCTION_BULK_OR_INTERRUPT_TRANSFER:
  PipeHandle           = 81c4519c [endpoint 0x00000081]
  TransferFlags        = 00000003 (USBD_TRANSFER_DIRECTION_IN, USBD_SHORT_TRANSFER_OK)
  TransferBufferLength = 00000100
  TransferBuffer       = 00000000
  TransferBufferMDL    = 81cd6558
  UrbLink              = 00000000
[68714 ms] UsbSnoop - MyInternalIOCTLCompletion(f8907db0) : fido=81b12d60, Irp=81d58008, Context=81ac5a98, IRQL=2
[68714 ms]  <<<  URB 24 coming back  <<< 
-- URB_FUNCTION_BULK_OR_INTERRUPT_TRANSFER:
  PipeHandle           = 81c4519c [endpoint 0x00000081]
  TransferFlags        = 00000003 (USBD_TRANSFER_DIRECTION_IN, USBD_SHORT_TRANSFER_OK)
  TransferBufferLength = 00000100
  TransferBuffer       = 00000000
  TransferBufferMDL    = 81cd6558
    00000000: 00 00 00 00 00 00 00 00 00 00 00 00 00 00 00 00
    00000010: 00 00 00 00 00 00 00 00 00 00 00 00 00 00 00 00
    00000020: 00 00 00 00 00 00 00 00 00 00 00 00 00 00 00 00
    00000030: 00 00 00 00 00 00 00 00 00 00 00 00 00 00 00 00
    00000040: 00 00 00 00 00 00 00 00 00 00 00 00 00 00 00 00
    00000050: 00 00 00 00 00 00 00 00 00 00 00 00 00 00 00 00
    00000060: 00 00 00 00 00 00 00 00 00 00 00 00 00 00 00 00
    00000070: 00 00 00 00 00 00 00 00 00 00 00 00 00 00 00 00
    00000080: 00 00 00 00 00 00 00 00 00 00 00 00 00 00 00 00
    00000090: 00 00 00 00 00 00 00 00 00 00 00 00 00 00 00 00
    000000a0: 00 00 00 00 00 00 00 00 00 00 00 00 00 00 00 00
    000000b0: 00 00 00 00 00 00 00 00 00 00 00 00 00 00 00 00
    000000c0: 00 00 00 00 00 00 00 00 00 00 00 00 00 00 00 00
    000000d0: 00 00 00 00 00 00 00 00 00 00 00 00 00 00 00 00
    000000e0: 00 00 00 00 00 00 00 00 00 00 00 00 00 00 00 00
    000000f0: 00 00 00 00 00 00 00 00 00 00 00 00 00 00 00 00
  UrbLink              = 00000000
[68742 ms] UsbSnoop - DispatchAny(f8906610) : IRP_MJ_INTERNAL_DEVICE_CONTROL
[68742 ms] UsbSnoop - MyDispatchInternalIOCTL(f8907e80) : fdo=81c5a708, Irp=81d58008, IRQL=2
[68742 ms]  >>>  URB 25 going down  >>> 
-- URB_FUNCTION_BULK_OR_INTERRUPT_TRANSFER:
  PipeHandle           = 81c4519c [endpoint 0x00000081]
  TransferFlags        = 00000003 (USBD_TRANSFER_DIRECTION_IN, USBD_SHORT_TRANSFER_OK)
  TransferBufferLength = 00000100
  TransferBuffer       = 00000000
  TransferBufferMDL    = 81cd6558
  UrbLink              = 00000000
[68744 ms] UsbSnoop - MyInternalIOCTLCompletion(f8907db0) : fido=81b12d60, Irp=81d58008, Context=81ad8b90, IRQL=2
[68744 ms]  <<<  URB 25 coming back  <<< 
-- URB_FUNCTION_BULK_OR_INTERRUPT_TRANSFER:
  PipeHandle           = 81c4519c [endpoint 0x00000081]
  TransferFlags        = 00000003 (USBD_TRANSFER_DIRECTION_IN, USBD_SHORT_TRANSFER_OK)
  TransferBufferLength = 000000ff
  TransferBuffer       = 00000000
  TransferBufferMDL    = 81cd6558
    00000000: 00 00 00 00 00 00 00 00 00 00 00 00 00 00 00 00
    00000010: 00 00 00 00 00 00 00 00 00 00 00 00 00 00 00 00
    00000020: 00 00 00 00 00 00 00 00 00 00 00 00 00 00 00 00
    00000030: 00 00 00 00 00 00 00 00 00 00 00 00 00 00 00 00
    00000040: 00 00 00 00 00 00 00 00 00 00 00 00 00 00 00 00
    00000050: 00 00 00 00 00 00 00 00 00 00 00 00 00 00 00 00
    00000060: 00 00 00 00 00 00 00 00 00 00 00 00 00 00 00 00
    00000070: 00 00 00 00 00 00 00 00 00 00 00 00 00 00 00 00
    00000080: 00 00 00 00 00 00 00 00 00 00 00 00 00 00 00 00
    00000090: 00 00 00 00 00 00 00 00 00 00 00 00 00 00 00 00
    000000a0: 00 00 00 00 00 00 00 00 00 00 00 00 00 00 00 00
    000000b0: 00 00 00 00 00 00 00 00 00 00 00 00 00 00 00 00
    000000c0: 00 00 00 00 00 00 00 00 00 00 00 00 00 00 00 00
    000000d0: 00 00 00 00 00 00 00 00 00 00 00 00 00 00 00 00
    000000e0: 00 00 00 00 00 00 00 00 00 00 00 00 00 00 00 00
    000000f0: 00 00 00 00 00 00 00 00 00 00 00 00 00 00 00
  UrbLink              = 00000000
[68772 ms] UsbSnoop - DispatchAny(f8906610) : IRP_MJ_INTERNAL_DEVICE_CONTROL
[68772 ms] UsbSnoop - MyDispatchInternalIOCTL(f8907e80) : fdo=81c5a708, Irp=81d58008, IRQL=2
[68772 ms]  >>>  URB 26 going down  >>> 
-- URB_FUNCTION_BULK_OR_INTERRUPT_TRANSFER:
  PipeHandle           = 81c451bc [endpoint 0x00000002]
  TransferFlags        = 00000000 (USBD_TRANSFER_DIRECTION_OUT, ~USBD_SHORT_TRANSFER_OK)
  TransferBufferLength = 00000007
  TransferBuffer       = 00000000
  TransferBufferMDL    = 81cd6558
    00000000: 00 00 00 02 05 e0 00
  UrbLink              = 00000000
[68772 ms] UsbSnoop - MyInternalIOCTLCompletion(f8907db0) : fido=81b12d60, Irp=81d58008, Context=81ac0f70, IRQL=2
[68772 ms]  <<<  URB 26 coming back  <<< 
-- URB_FUNCTION_BULK_OR_INTERRUPT_TRANSFER:
  PipeHandle           = 81c451bc [endpoint 0x00000002]
  TransferFlags        = 00000000 (USBD_TRANSFER_DIRECTION_OUT, ~USBD_SHORT_TRANSFER_OK)
  TransferBufferLength = 00000007
  TransferBuffer       = 00000000
  TransferBufferMDL    = 81cd6558
  UrbLink              = 00000000
[68782 ms] UsbSnoop - DispatchAny(f8906610) : IRP_MJ_INTERNAL_DEVICE_CONTROL
[68782 ms] UsbSnoop - MyDispatchInternalIOCTL(f8907e80) : fdo=81c5a708, Irp=81d58008, IRQL=2
[68782 ms]  >>>  URB 27 going down  >>> 
-- URB_FUNCTION_BULK_OR_INTERRUPT_TRANSFER:
  PipeHandle           = 81c4519c [endpoint 0x00000081]
  TransferFlags        = 00000003 (USBD_TRANSFER_DIRECTION_IN, USBD_SHORT_TRANSFER_OK)
  TransferBufferLength = 00000100
  TransferBuffer       = 00000000
  TransferBufferMDL    = 81cd6558
  UrbLink              = 00000000
[68782 ms] UsbSnoop - MyInternalIOCTLCompletion(f8907db0) : fido=81b12d60, Irp=81d58008, Context=81ad8b90, IRQL=2
[68782 ms]  <<<  URB 27 coming back  <<< 
-- URB_FUNCTION_BULK_OR_INTERRUPT_TRANSFER:
  PipeHandle           = 81c4519c [endpoint 0x00000081]
  TransferFlags        = 00000003 (USBD_TRANSFER_DIRECTION_IN, USBD_SHORT_TRANSFER_OK)
  TransferBufferLength = 00000005
  TransferBuffer       = 00000000
  TransferBufferMDL    = 81cd6558
    00000000: 00 00 03 ff 03
  UrbLink              = 00000000
[68812 ms] UsbSnoop - DispatchAny(f8906610) : IRP_MJ_INTERNAL_DEVICE_CONTROL
[68812 ms] UsbSnoop - MyDispatchInternalIOCTL(f8907e80) : fdo=81c5a708, Irp=81d58008, IRQL=2
[68812 ms]  >>>  URB 28 going down  >>> 
-- URB_FUNCTION_BULK_OR_INTERRUPT_TRANSFER:
  PipeHandle           = 81c4519c [endpoint 0x00000081]
  TransferFlags        = 00000003 (USBD_TRANSFER_DIRECTION_IN, USBD_SHORT_TRANSFER_OK)
  TransferBufferLength = 00000100
  TransferBuffer       = 00000000
  TransferBufferMDL    = 81cd6558
  UrbLink              = 00000000
[68814 ms] UsbSnoop - MyInternalIOCTLCompletion(f8907db0) : fido=81b12d60, Irp=81d58008, Context=81ad8d78, IRQL=2
[68814 ms]  <<<  URB 28 coming back  <<< 
-- URB_FUNCTION_BULK_OR_INTERRUPT_TRANSFER:
  PipeHandle           = 81c4519c [endpoint 0x00000081]
  TransferFlags        = 00000003 (USBD_TRANSFER_DIRECTION_IN, USBD_SHORT_TRANSFER_OK)
  TransferBufferLength = 00000100
  TransferBuffer       = 00000000
  TransferBufferMDL    = 81cd6558
    00000000: 00 00 00 00 00 00 00 00 00 00 00 00 00 00 00 00
    00000010: 00 00 00 00 00 00 00 00 00 00 00 00 00 00 00 00
    00000020: 00 00 00 00 00 00 00 00 00 00 00 00 00 00 00 00
    00000030: 00 00 00 00 00 00 00 00 00 00 00 00 00 00 00 00
    00000040: 00 00 00 00 00 00 00 00 00 00 00 00 00 00 00 00
    00000050: 00 00 00 00 00 00 00 00 00 00 00 00 00 00 00 00
    00000060: 00 00 00 00 00 00 00 00 00 00 00 00 00 00 00 00
    00000070: 00 00 00 00 00 00 00 00 00 00 00 00 00 00 00 00
    00000080: 00 00 00 00 00 00 00 00 00 00 00 00 00 00 00 00
    00000090: 00 00 00 00 00 00 00 00 00 00 00 00 00 00 00 00
    000000a0: 00 00 00 00 00 00 00 00 00 00 00 00 00 00 00 00
    000000b0: 00 00 00 00 00 00 00 00 00 00 00 00 00 00 00 00
    000000c0: 00 00 00 00 00 00 00 00 00 00 00 00 00 00 00 00
    000000d0: 00 00 00 00 00 00 00 00 00 00 00 00 00 00 00 00
    000000e0: 00 00 00 00 00 00 00 00 00 00 00 00 00 00 00 00
    000000f0: 00 00 00 00 00 00 00 00 00 00 00 00 00 00 00 00
  UrbLink              = 00000000
[68842 ms] UsbSnoop - DispatchAny(f8906610) : IRP_MJ_INTERNAL_DEVICE_CONTROL
[68842 ms] UsbSnoop - MyDispatchInternalIOCTL(f8907e80) : fdo=81c5a708, Irp=81be0008, IRQL=2
[68842 ms]  >>>  URB 29 going down  >>> 
-- URB_FUNCTION_BULK_OR_INTERRUPT_TRANSFER:
  PipeHandle           = 81c4519c [endpoint 0x00000081]
  TransferFlags        = 00000003 (USBD_TRANSFER_DIRECTION_IN, USBD_SHORT_TRANSFER_OK)
  TransferBufferLength = 00000100
  TransferBuffer       = 00000000
  TransferBufferMDL    = 81cd6558
  UrbLink              = 00000000
[68844 ms] UsbSnoop - MyInternalIOCTLCompletion(f8907db0) : fido=81b12d60, Irp=81be0008, Context=81ad8b90, IRQL=2
[68844 ms]  <<<  URB 29 coming back  <<< 
-- URB_FUNCTION_BULK_OR_INTERRUPT_TRANSFER:
  PipeHandle           = 81c4519c [endpoint 0x00000081]
  TransferFlags        = 00000003 (USBD_TRANSFER_DIRECTION_IN, USBD_SHORT_TRANSFER_OK)
  TransferBufferLength = 00000100
  TransferBuffer       = 00000000
  TransferBufferMDL    = 81cd6558
    00000000: 00 00 00 00 00 00 00 00 00 00 00 00 00 00 00 00
    00000010: 00 00 00 00 00 00 00 00 00 00 00 00 00 00 00 00
    00000020: 00 00 00 00 00 00 00 00 00 00 00 00 00 00 00 00
    00000030: 00 00 00 00 00 00 00 00 00 00 00 00 00 00 00 00
    00000040: 00 00 00 00 00 00 00 00 00 00 00 00 00 00 00 00
    00000050: 00 00 00 00 00 00 00 00 00 00 00 00 00 00 00 00
    00000060: 00 00 00 00 00 00 00 00 00 00 00 00 00 00 00 00
    00000070: 00 00 00 00 00 00 00 00 00 00 00 00 00 00 00 00
    00000080: 00 00 00 00 00 00 00 00 00 00 00 00 00 00 00 00
    00000090: 00 00 00 00 00 00 00 00 00 00 00 00 00 00 00 00
    000000a0: 00 00 00 00 00 00 00 00 00 00 00 00 00 00 00 00
    000000b0: 00 00 00 00 00 00 00 00 00 00 00 00 00 00 00 00
    000000c0: 00 00 00 00 00 00 00 00 00 ff ff ff ff ff ff ff
    000000d0: ff ff ff ff ff ff ff ff ff ff ff ff ff 00 00 00
    000000e0: 00 00 00 00 00 00 00 00 00 00 00 00 00 00 00 00
    000000f0: 00 00 00 00 00 00 00 00 00 00 00 00 00 00 00 00
  UrbLink              = 00000000
[68872 ms] UsbSnoop - DispatchAny(f8906610) : IRP_MJ_INTERNAL_DEVICE_CONTROL
[68872 ms] UsbSnoop - MyDispatchInternalIOCTL(f8907e80) : fdo=81c5a708, Irp=81be0008, IRQL=2
[68872 ms]  >>>  URB 30 going down  >>> 
-- URB_FUNCTION_BULK_OR_INTERRUPT_TRANSFER:
  PipeHandle           = 81c4519c [endpoint 0x00000081]
  TransferFlags        = 00000003 (USBD_TRANSFER_DIRECTION_IN, USBD_SHORT_TRANSFER_OK)
  TransferBufferLength = 00000100
  TransferBuffer       = 00000000
  TransferBufferMDL    = 81cd6558
  UrbLink              = 00000000
[68874 ms] UsbSnoop - MyInternalIOCTLCompletion(f8907db0) : fido=81b12d60, Irp=81be0008, Context=81ac57a0, IRQL=2
[68874 ms]  <<<  URB 30 coming back  <<< 
-- URB_FUNCTION_BULK_OR_INTERRUPT_TRANSFER:
  PipeHandle           = 81c4519c [endpoint 0x00000081]
  TransferFlags        = 00000003 (USBD_TRANSFER_DIRECTION_IN, USBD_SHORT_TRANSFER_OK)
  TransferBufferLength = 00000100
  TransferBuffer       = 00000000
  TransferBufferMDL    = 81cd6558
    00000000: 00 00 00 00 00 c0 00 00 00 00 00 00 00 00 00 00
    00000010: 00 00 00 00 00 00 00 00 00 00 00 00 00 00 00 00
    00000020: 00 00 00 c0 00 00 00 00 00 00 00 00 00 00 00 00
    00000030: 00 00 00 00 00 00 00 00 00 00 00 00 00 00 00 00
    00000040: 00 c0 00 00 00 00 00 00 00 00 00 00 00 00 00 00
    00000050: 00 00 00 00 00 00 00 00 00 00 00 00 00 00 00 c0
    00000060: 00 00 00 00 00 00 00 00 00 00 00 00 00 00 00 00
    00000070: 00 00 00 00 00 00 00 00 00 00 00 00 00 c0 00 00
    00000080: 00 00 00 00 00 00 00 00 00 00 00 00 00 00 00 00
    00000090: 00 00 00 00 00 00 00 00 00 00 00 c0 00 00 00 00
    000000a0: 00 00 00 00 00 00 00 00 00 00 00 00 00 00 00 00
    000000b0: 00 00 00 00 00 00 00 00 00 c0 00 00 00 00 00 00
    000000c0: 00 00 00 00 00 00 00 00 00 00 00 00 00 00 00 00
    000000d0: 00 00 00 00 00 00 00 c0 00 00 00 00 00 00 00 00
    000000e0: 00 00 00 00 00 00 00 00 00 00 00 00 00 00 00 00
    000000f0: 00 00 00 00 00 ff ff ff ff ff ff ff ff ff ff ff
  UrbLink              = 00000000
[68902 ms] UsbSnoop - DispatchAny(f8906610) : IRP_MJ_INTERNAL_DEVICE_CONTROL
[68902 ms] UsbSnoop - MyDispatchInternalIOCTL(f8907e80) : fdo=81c5a708, Irp=81be0008, IRQL=2
[68902 ms]  >>>  URB 31 going down  >>> 
-- URB_FUNCTION_BULK_OR_INTERRUPT_TRANSFER:
  PipeHandle           = 81c4519c [endpoint 0x00000081]
  TransferFlags        = 00000003 (USBD_TRANSFER_DIRECTION_IN, USBD_SHORT_TRANSFER_OK)
  TransferBufferLength = 00000100
  TransferBuffer       = 00000000
  TransferBufferMDL    = 81cd6558
  UrbLink              = 00000000
[68904 ms] UsbSnoop - MyInternalIOCTLCompletion(f8907db0) : fido=81b12d60, Irp=81be0008, Context=81ad8d78, IRQL=2
[68904 ms]  <<<  URB 31 coming back  <<< 
-- URB_FUNCTION_BULK_OR_INTERRUPT_TRANSFER:
  PipeHandle           = 81c4519c [endpoint 0x00000081]
  TransferFlags        = 00000003 (USBD_TRANSFER_DIRECTION_IN, USBD_SHORT_TRANSFER_OK)
  TransferBufferLength = 000000ff
  TransferBuffer       = 00000000
  TransferBufferMDL    = 81cd6558
    00000000: ff ff ff ff ff ff ff ff ff 00 00 00 00 00 00 00
    00000010: 00 00 00 00 00 00 00 00 00 00 00 00 00 00 00 00
    00000020: 00 00 ff ff 80 00 00 00 00 00 00 00 00 00 00 00
    00000030: 00 44 94 80 00 00 00 0c 4c 12 bb 80 00 01 d5 26
    00000040: ce c4 01 0b 10 00 00 00 00 00 00 00 00 00 00 6d
    00000050: 56 80 00 00 00 0a aa 2a 92 80 00 01 15 a8 d5 6e
    00000060: 82 88 a8 00 00 00 00 00 00 00 00 00 00 55 d7 80
    00000070: 00 00 00 0c ea 3a 92 80 00 01 95 e8 cc 6e 82 91
    00000080: 28 00 00 00 00 00 00 00 00 00 00 45 55 80 00 00
    00000090: 00 0a aa 2a 92 80 00 01 15 68 d5 6e 82 a0 a8 00
    000000a0: 00 00 00 00 00 00 00 00 00 45 54 80 00 00 00 0a
    000000b0: ac 2b 93 80 00 01 1d 26 cd 6e 81 23 10 00 00 00
    000000c0: 00 00 00 00 00 00 00 00 00 00 00 00 00 00 00 00
    000000d0: 00 00 00 00 00 00 00 00 00 00 00 00 00 00 00 00
    000000e0: 00 00 00 00 00 00 00 00 00 00 00 00 00 00 00 00
    000000f0: 00 00 00 00 00 00 00 00 00 00 00 00 00 00 00
  UrbLink              = 00000000
[68932 ms] UsbSnoop - DispatchAny(f8906610) : IRP_MJ_INTERNAL_DEVICE_CONTROL
[68932 ms] UsbSnoop - MyDispatchInternalIOCTL(f8907e80) : fdo=81c5a708, Irp=81be0008, IRQL=2
[68932 ms]  >>>  URB 32 going down  >>> 
-- URB_FUNCTION_BULK_OR_INTERRUPT_TRANSFER:
  PipeHandle           = 81c451bc [endpoint 0x00000002]
  TransferFlags        = 00000000 (USBD_TRANSFER_DIRECTION_OUT, ~USBD_SHORT_TRANSFER_OK)
  TransferBufferLength = 00000007
  TransferBuffer       = 00000000
  TransferBufferMDL    = 81cd6558
    00000000: 00 00 00 02 05 e0 00
  UrbLink              = 00000000
[68933 ms] UsbSnoop - MyInternalIOCTLCompletion(f8907db0) : fido=81b12d60, Irp=81be0008, Context=81ac5b00, IRQL=2
[68933 ms]  <<<  URB 32 coming back  <<< 
-- URB_FUNCTION_BULK_OR_INTERRUPT_TRANSFER:
  PipeHandle           = 81c451bc [endpoint 0x00000002]
  TransferFlags        = 00000000 (USBD_TRANSFER_DIRECTION_OUT, ~USBD_SHORT_TRANSFER_OK)
  TransferBufferLength = 00000007
  TransferBuffer       = 00000000
  TransferBufferMDL    = 81cd6558
  UrbLink              = 00000000
[68942 ms] UsbSnoop - DispatchAny(f8906610) : IRP_MJ_INTERNAL_DEVICE_CONTROL
[68942 ms] UsbSnoop - MyDispatchInternalIOCTL(f8907e80) : fdo=81c5a708, Irp=81be0008, IRQL=2
[68942 ms]  >>>  URB 33 going down  >>> 
-- URB_FUNCTION_BULK_OR_INTERRUPT_TRANSFER:
  PipeHandle           = 81c4519c [endpoint 0x00000081]
  TransferFlags        = 00000003 (USBD_TRANSFER_DIRECTION_IN, USBD_SHORT_TRANSFER_OK)
  TransferBufferLength = 00000100
  TransferBuffer       = 00000000
  TransferBufferMDL    = 81cd6558
  UrbLink              = 00000000
[68943 ms] UsbSnoop - MyInternalIOCTLCompletion(f8907db0) : fido=81b12d60, Irp=81be0008, Context=81ad8d78, IRQL=2
[68943 ms]  <<<  URB 33 coming back  <<< 
-- URB_FUNCTION_BULK_OR_INTERRUPT_TRANSFER:
  PipeHandle           = 81c4519c [endpoint 0x00000081]
  TransferFlags        = 00000003 (USBD_TRANSFER_DIRECTION_IN, USBD_SHORT_TRANSFER_OK)
  TransferBufferLength = 00000005
  TransferBuffer       = 00000000
  TransferBufferMDL    = 81cd6558
    00000000: 00 00 03 10 04
  UrbLink              = 00000000
[68973 ms] UsbSnoop - DispatchAny(f8906610) : IRP_MJ_INTERNAL_DEVICE_CONTROL
[68973 ms] UsbSnoop - MyDispatchInternalIOCTL(f8907e80) : fdo=81c5a708, Irp=81be0008, IRQL=2
[68973 ms]  >>>  URB 34 going down  >>> 
-- URB_FUNCTION_BULK_OR_INTERRUPT_TRANSFER:
  PipeHandle           = 81c4519c [endpoint 0x00000081]
  TransferFlags        = 00000003 (USBD_TRANSFER_DIRECTION_IN, USBD_SHORT_TRANSFER_OK)
  TransferBufferLength = 00000100
  TransferBuffer       = 00000000
  TransferBufferMDL    = 81cd6558
  UrbLink              = 00000000
[68974 ms] UsbSnoop - MyInternalIOCTLCompletion(f8907db0) : fido=81b12d60, Irp=81be0008, Context=81ac0f70, IRQL=2
[68974 ms]  <<<  URB 34 coming back  <<< 
-- URB_FUNCTION_BULK_OR_INTERRUPT_TRANSFER:
  PipeHandle           = 81c4519c [endpoint 0x00000081]
  TransferFlags        = 00000003 (USBD_TRANSFER_DIRECTION_IN, USBD_SHORT_TRANSFER_OK)
  TransferBufferLength = 00000100
  TransferBuffer       = 00000000
  TransferBufferMDL    = 81cd6558
    00000000: 00 00 00 00 00 00 00 00 00 00 00 00 00 00 00 00
    00000010: 00 00 00 00 00 00 00 00 00 00 00 00 00 00 00 00
    00000020: 00 00 00 00 00 00 00 00 00 00 00 00 00 00 00 00
    00000030: 00 00 00 00 00 00 00 00 00 00 00 00 00 00 00 00
    00000040: 00 00 00 00 00 00 00 00 00 00 00 00 00 00 00 00
    00000050: 00 00 00 00 00 00 00 00 00 00 00 00 00 00 00 00
    00000060: 00 00 00 00 00 00 00 00 00 00 00 00 00 00 00 00
    00000070: 00 00 00 00 00 00 00 00 00 00 00 00 00 00 00 00
    00000080: 00 00 00 00 00 00 00 00 00 00 00 00 00 00 00 00
    00000090: 00 00 00 00 00 00 00 00 00 00 00 00 00 00 00 00
    000000a0: 00 00 00 00 00 00 00 00 00 00 00 00 00 00 00 00
    000000b0: 00 00 00 00 00 00 00 00 00 00 00 00 00 00 00 00
    000000c0: 00 00 00 00 00 00 00 00 00 00 00 00 00 00 00 00
    000000d0: 00 00 00 00 00 00 00 00 00 00 00 00 00 00 00 00
    000000e0: 00 00 00 00 00 00 00 00 00 00 00 00 00 00 00 00
    000000f0: 00 00 00 00 00 00 00 00 00 00 00 00 00 00 00 00
  UrbLink              = 00000000
[69003 ms] UsbSnoop - DispatchAny(f8906610) : IRP_MJ_INTERNAL_DEVICE_CONTROL
[69003 ms] UsbSnoop - MyDispatchInternalIOCTL(f8907e80) : fdo=81c5a708, Irp=81be0008, IRQL=2
[69003 ms]  >>>  URB 35 going down  >>> 
-- URB_FUNCTION_BULK_OR_INTERRUPT_TRANSFER:
  PipeHandle           = 81c4519c [endpoint 0x00000081]
  TransferFlags        = 00000003 (USBD_TRANSFER_DIRECTION_IN, USBD_SHORT_TRANSFER_OK)
  TransferBufferLength = 00000100
  TransferBuffer       = 00000000
  TransferBufferMDL    = 81cd6558
  UrbLink              = 00000000
[69004 ms] UsbSnoop - MyInternalIOCTLCompletion(f8907db0) : fido=81b12d60, Irp=81be0008, Context=81ac5b00, IRQL=2
[69005 ms]  <<<  URB 35 coming back  <<< 
-- URB_FUNCTION_BULK_OR_INTERRUPT_TRANSFER:
  PipeHandle           = 81c4519c [endpoint 0x00000081]
  TransferFlags        = 00000003 (USBD_TRANSFER_DIRECTION_IN, USBD_SHORT_TRANSFER_OK)
  TransferBufferLength = 00000100
  TransferBuffer       = 00000000
  TransferBufferMDL    = 81cd6558
    00000000: 00 00 00 00 00 00 00 00 00 00 00 00 00 00 00 00
    00000010: 00 00 00 00 00 00 00 00 00 00 00 00 00 00 00 00
    00000020: 00 00 00 00 00 00 00 00 00 00 00 00 00 00 00 00
    00000030: 00 00 00 00 00 00 00 00 00 00 00 00 00 00 00 00
    00000040: 00 00 00 00 00 00 00 00 00 00 00 00 00 00 00 00
    00000050: 00 00 00 00 00 00 00 00 00 00 00 00 00 00 00 00
    00000060: 00 00 00 00 00 00 00 00 00 00 00 00 00 00 00 00
    00000070: 00 00 00 00 00 00 00 00 00 00 00 00 00 00 00 00
    00000080: 00 00 00 00 00 00 00 00 00 00 00 00 00 00 00 00
    00000090: 00 00 00 00 00 00 00 00 00 00 00 00 00 00 00 00
    000000a0: 00 00 00 00 00 00 00 00 00 00 00 00 00 00 00 00
    000000b0: 00 00 00 00 00 00 00 00 00 00 00 00 00 00 00 00
    000000c0: 00 00 00 00 00 00 00 00 00 00 00 00 00 00 00 00
    000000d0: 00 00 00 00 00 00 00 00 00 00 00 00 00 00 00 00
    000000e0: 00 00 00 00 00 00 00 00 00 00 00 00 00 00 00 00
    000000f0: 00 00 00 00 00 00 00 00 00 00 00 00 00 00 00 00
  UrbLink              = 00000000
[69033 ms] UsbSnoop - DispatchAny(f8906610) : IRP_MJ_INTERNAL_DEVICE_CONTROL
[69033 ms] UsbSnoop - MyDispatchInternalIOCTL(f8907e80) : fdo=81c5a708, Irp=81be0008, IRQL=2
[69033 ms]  >>>  URB 36 going down  >>> 
-- URB_FUNCTION_BULK_OR_INTERRUPT_TRANSFER:
  PipeHandle           = 81c4519c [endpoint 0x00000081]
  TransferFlags        = 00000003 (USBD_TRANSFER_DIRECTION_IN, USBD_SHORT_TRANSFER_OK)
  TransferBufferLength = 00000100
  TransferBuffer       = 00000000
  TransferBufferMDL    = 81cd6558
  UrbLink              = 00000000
[69035 ms] UsbSnoop - MyInternalIOCTLCompletion(f8907db0) : fido=81b12d60, Irp=81be0008, Context=81ac57a0, IRQL=2
[69035 ms]  <<<  URB 36 coming back  <<< 
-- URB_FUNCTION_BULK_OR_INTERRUPT_TRANSFER:
  PipeHandle           = 81c4519c [endpoint 0x00000081]
  TransferFlags        = 00000003 (USBD_TRANSFER_DIRECTION_IN, USBD_SHORT_TRANSFER_OK)
  TransferBufferLength = 00000100
  TransferBuffer       = 00000000
  TransferBufferMDL    = 81cd6558
    00000000: 00 00 00 00 00 00 00 00 00 00 00 00 00 00 00 00
    00000010: 00 00 00 00 00 00 00 00 00 00 00 00 00 00 00 00
    00000020: 00 00 00 00 00 00 00 00 00 00 00 00 00 00 00 00
    00000030: 00 00 00 00 00 00 00 00 00 00 00 00 00 00 00 00
    00000040: 00 00 00 00 00 00 00 00 00 00 00 00 00 00 00 00
    00000050: 00 00 00 00 00 00 00 00 00 00 00 00 00 00 00 00
    00000060: 00 00 00 00 00 00 00 00 00 00 00 00 00 00 00 00
    00000070: 00 00 00 00 00 00 00 00 00 00 00 00 00 00 00 00
    00000080: 00 00 00 00 00 00 00 00 00 00 00 00 00 00 00 00
    00000090: 00 00 00 00 00 00 00 00 00 00 00 00 00 00 00 00
    000000a0: 00 00 00 00 00 00 00 00 00 00 00 00 00 00 00 00
    000000b0: 00 00 00 00 00 00 00 00 00 00 00 00 00 00 00 00
    000000c0: 00 00 00 00 00 00 00 00 00 00 00 00 00 00 00 00
    000000d0: 00 00 00 00 00 00 00 00 00 00 00 00 00 00 00 00
    000000e0: 00 00 00 00 00 00 00 00 00 00 00 00 00 00 00 00
    000000f0: 00 00 00 00 00 00 00 00 00 00 00 00 00 00 00 00
  UrbLink              = 00000000
[69063 ms] UsbSnoop - DispatchAny(f8906610) : IRP_MJ_INTERNAL_DEVICE_CONTROL
[69063 ms] UsbSnoop - MyDispatchInternalIOCTL(f8907e80) : fdo=81c5a708, Irp=81be0008, IRQL=2
[69063 ms]  >>>  URB 37 going down  >>> 
-- URB_FUNCTION_BULK_OR_INTERRUPT_TRANSFER:
  PipeHandle           = 81c4519c [endpoint 0x00000081]
  TransferFlags        = 00000003 (USBD_TRANSFER_DIRECTION_IN, USBD_SHORT_TRANSFER_OK)
  TransferBufferLength = 00000100
  TransferBuffer       = 00000000
  TransferBufferMDL    = 81cd6558
  UrbLink              = 00000000
[69063 ms] UsbSnoop - MyInternalIOCTLCompletion(f8907db0) : fido=81b12d60, Irp=81be0008, Context=81ac0f70, IRQL=2
[69063 ms]  <<<  URB 37 coming back  <<< 
-- URB_FUNCTION_BULK_OR_INTERRUPT_TRANSFER:
  PipeHandle           = 81c4519c [endpoint 0x00000081]
  TransferFlags        = 00000003 (USBD_TRANSFER_DIRECTION_IN, USBD_SHORT_TRANSFER_OK)
  TransferBufferLength = 00000010
  TransferBuffer       = 00000000
  TransferBufferMDL    = 81cd6558
    00000000: 00 00 00 00 00 00 00 00 00 00 00 00 00 00 00 00
  UrbLink              = 00000000
[69093 ms] UsbSnoop - DispatchAny(f8906610) : IRP_MJ_INTERNAL_DEVICE_CONTROL
[69093 ms] UsbSnoop - MyDispatchInternalIOCTL(f8907e80) : fdo=81c5a708, Irp=81be0008, IRQL=2
[69093 ms]  >>>  URB 38 going down  >>> 
-- URB_FUNCTION_BULK_OR_INTERRUPT_TRANSFER:
  PipeHandle           = 81c451bc [endpoint 0x00000002]
  TransferFlags        = 00000000 (USBD_TRANSFER_DIRECTION_OUT, ~USBD_SHORT_TRANSFER_OK)
  TransferBufferLength = 00000007
  TransferBuffer       = 00000000
  TransferBufferMDL    = 81cd6558
    00000000: 00 00 00 02 05 e0 00
  UrbLink              = 00000000
[69093 ms] UsbSnoop - MyInternalIOCTLCompletion(f8907db0) : fido=81b12d60, Irp=81be0008, Context=81ac57a0, IRQL=2
[69093 ms]  <<<  URB 38 coming back  <<< 
-- URB_FUNCTION_BULK_OR_INTERRUPT_TRANSFER:
  PipeHandle           = 81c451bc [endpoint 0x00000002]
  TransferFlags        = 00000000 (USBD_TRANSFER_DIRECTION_OUT, ~USBD_SHORT_TRANSFER_OK)
  TransferBufferLength = 00000007
  TransferBuffer       = 00000000
  TransferBufferMDL    = 81cd6558
  UrbLink              = 00000000
[69135 ms] UsbSnoop - DispatchAny(f8906610) : IRP_MJ_INTERNAL_DEVICE_CONTROL
[69135 ms] UsbSnoop - MyDispatchInternalIOCTL(f8907e80) : fdo=81c5a708, Irp=81b0a5c0, IRQL=0
[69135 ms]  >>>  URB 39 going down  >>> 
-- URB_FUNCTION_RESET_PIPE:
  PipeHandle = 81c4519c [endpoint 0x00000081]
[69135 ms] UsbSnoop - MyInternalIOCTLCompletion(f8907db0) : fido=00000000, Irp=81b0a5c0, Context=81ac5b00, IRQL=0
[69135 ms]  <<<  URB 39 coming back  <<< 
-- URB_FUNCTION_RESET_PIPE:
[69135 ms] UsbSnoop - DispatchAny(f8906610) : IRP_MJ_INTERNAL_DEVICE_CONTROL
[69135 ms] UsbSnoop - MyDispatchInternalIOCTL(f8907e80) : fdo=81c5a708, Irp=81b0a5c0, IRQL=0
[69135 ms]  >>>  URB 40 going down  >>> 
-- URB_FUNCTION_RESET_PIPE:
  PipeHandle = 81c451bc [endpoint 0x00000002]
[69136 ms] UsbSnoop - MyInternalIOCTLCompletion(f8907db0) : fido=00000000, Irp=81b0a5c0, Context=81ad8d78, IRQL=0
[69136 ms]  <<<  URB 40 coming back  <<< 
-- URB_FUNCTION_RESET_PIPE:
[69136 ms] UsbSnoop - DispatchAny(f8906610) : IRP_MJ_INTERNAL_DEVICE_CONTROL
[69136 ms] UsbSnoop - MyDispatchInternalIOCTL(f8907e80) : fdo=81c5a708, Irp=81b6a770, IRQL=0
[69136 ms] UsbSnoop - IRP_MJ_POWER (IRP_MN_WAIT_WAKE)
