[0 ms] UsbSnoop compiled on Jan 18 2003 22:41:32 loading
[0 ms] UsbSnoop - DriverEntry(f88a0c40) : Windows NT WDM version 1.32
[31 ms] UsbSnoop - AddDevice(f88a0f50) : DriverObject 8218a180, pdo 81d62e08
[31 ms] UsbSnoop - DispatchAny(f889e610) : IRP_MJ_PNP (0x00000018)
[31 ms] UsbSnoop - MyDispatchPNP(f88a0ee0) : IRP_MJ_PNP (0x00000018)
[31 ms] UsbSnoop - DispatchAny(f889e610) : IRP_MJ_PNP (IRP_MN_QUERY_RESOURCE_REQUIREMENTS)
[31 ms] UsbSnoop - MyDispatchPNP(f88a0ee0) : IRP_MJ_PNP (IRP_MN_QUERY_RESOURCE_REQUIREMENTS)
[31 ms] UsbSnoop - DispatchAny(f889e610) : IRP_MJ_PNP (IRP_MN_FILTER_RESOURCE_REQUIREMENTS)
[31 ms] UsbSnoop - MyDispatchPNP(f88a0ee0) : IRP_MJ_PNP (IRP_MN_FILTER_RESOURCE_REQUIREMENTS)
[31 ms] UsbSnoop - DispatchAny(f889e610) : IRP_MJ_PNP (IRP_MN_START_DEVICE)
[31 ms] UsbSnoop - MyDispatchPNP(f88a0ee0) : IRP_MJ_PNP (IRP_MN_START_DEVICE)
[32 ms] UsbSnoop - DispatchAny(f889e610) : IRP_MJ_PNP (IRP_MN_QUERY_CAPABILITIES)
[32 ms] UsbSnoop - MyDispatchPNP(f88a0ee0) : IRP_MJ_PNP (IRP_MN_QUERY_CAPABILITIES)
[32 ms] UsbSnoop - DispatchAny(f889e610) : IRP_MJ_PNP (IRP_MN_QUERY_PNP_DEVICE_STATE)
[32 ms] UsbSnoop - MyDispatchPNP(f88a0ee0) : IRP_MJ_PNP (IRP_MN_QUERY_PNP_DEVICE_STATE)
[32 ms] UsbSnoop - DispatchAny(f889e610) : IRP_MJ_PNP (IRP_MN_QUERY_DEVICE_RELATIONS)
[32 ms] UsbSnoop - MyDispatchPNP(f88a0ee0) : IRP_MJ_PNP (IRP_MN_QUERY_DEVICE_RELATIONS)
[33 ms] UsbSnoop - DispatchAny(f889e610) : IRP_MJ_SYSTEM_CONTROL
[96035 ms] UsbSnoop - DispatchAny(f889e610) : IRP_MJ_INTERNAL_DEVICE_CONTROL
[96035 ms] UsbSnoop - MyDispatchInternalIOCTL(f889fe80) : fdo=81d62e08, Irp=821a52a0, IRQL=0
[96035 ms]  >>>  URB 1 going down  >>> 
-- URB_FUNCTION_GET_DESCRIPTOR_FROM_DEVICE:
  TransferBufferLength = 00000009
  TransferBuffer       = b9585910
  TransferBufferMDL    = 00000000
  Index                = 00000001
  DescriptorType       = 00000002 (USB_CONFIGURATION_DESCRIPTOR_TYPE)
  LanguageId           = 00000000
[96040 ms] UsbSnoop - MyInternalIOCTLCompletion(f889fdb0) : fido=00000000, Irp=821a52a0, Context=81ceae28, IRQL=2
[96040 ms]  <<<  URB 1 coming back  <<< 
-- URB_FUNCTION_CONTROL_TRANSFER:
  PipeHandle           = 822b9020
  TransferFlags        = 81b8d33b (USBD_TRANSFER_DIRECTION_IN, USBD_SHORT_TRANSFER_OK)
  TransferBufferLength = 00000009
  TransferBuffer       = b9585910
  TransferBufferMDL    = 81c55620
    00000000: 09 02 23 00 01 01 00 c0 00
  UrbLink              = 00000000
  SetupPacket          =
    00000000: 80 06 01 02 00 00 09 00
[96040 ms] UsbSnoop - DispatchAny(f889e610) : IRP_MJ_INTERNAL_DEVICE_CONTROL
[96040 ms] UsbSnoop - MyDispatchInternalIOCTL(f889fe80) : fdo=81d62e08, Irp=821a52a0, IRQL=0
[96040 ms]  >>>  URB 2 going down  >>> 
-- URB_FUNCTION_GET_DESCRIPTOR_FROM_DEVICE:
  TransferBufferLength = 00000023
  TransferBuffer       = 82300038
  TransferBufferMDL    = 00000000
  Index                = 00000001
  DescriptorType       = 00000002 (USB_CONFIGURATION_DESCRIPTOR_TYPE)
  LanguageId           = 00000000
[96049 ms] UsbSnoop - MyInternalIOCTLCompletion(f889fdb0) : fido=00000000, Irp=821a52a0, Context=81cea480, IRQL=2
[96049 ms]  <<<  URB 2 coming back  <<< 
-- URB_FUNCTION_CONTROL_TRANSFER:
  PipeHandle           = 822b9020
  TransferFlags        = 81b8d33b (USBD_TRANSFER_DIRECTION_IN, USBD_SHORT_TRANSFER_OK)
  TransferBufferLength = 00000023
  TransferBuffer       = 82300038
  TransferBufferMDL    = 81c55620
    00000000: 09 02 23 00 01 01 00 c0 00 09 04 00 00 02 ff 01
    00000010: 00 00 07 05 81 02 40 00 00 07 05 02 02 40 00 00
    00000020: 03 09 03
  UrbLink              = 00000000
  SetupPacket          =
    00000000: 80 06 01 02 00 00 23 00
[96049 ms] UsbSnoop - DispatchAny(f889e610) : IRP_MJ_INTERNAL_DEVICE_CONTROL
[96049 ms] UsbSnoop - MyDispatchInternalIOCTL(f889fe80) : fdo=81d62e08, Irp=821a52a0, IRQL=0
[96049 ms]  >>>  URB 3 going down  >>> 
-- URB_FUNCTION_SELECT_CONFIGURATION:
  ConfigurationDescriptor = 0x82300038 (configure)
  ConfigurationDescriptor : bLength             = 9
  ConfigurationDescriptor : bDescriptorType     = 0x00000002
  ConfigurationDescriptor : wTotalLength        = 0x00000023
  ConfigurationDescriptor : bNumInterfaces      = 0x00000001
  ConfigurationDescriptor : bConfigurationValue = 0x00000001
  ConfigurationDescriptor : iConfiguration      = 0x00000000
  ConfigurationDescriptor : bmAttributes        = 0x000000c0
  ConfigurationDescriptor : MaxPower            = 0x00000000
  ConfigurationHandle     = 0x00000000
  Interface[0]: Length            = 56
  Interface[0]: InterfaceNumber   = 0
  Interface[0]: AlternateSetting  = 0
[96085 ms] UsbSnoop - MyInternalIOCTLCompletion(f889fdb0) : fido=00000000, Irp=821a52a0, Context=821d1c98, IRQL=0
[96085 ms]  <<<  URB 3 coming back  <<< 
-- URB_FUNCTION_SELECT_CONFIGURATION:
  ConfigurationDescriptor = 0x82300038 (configure)
  ConfigurationDescriptor : bLength             = 9
  ConfigurationDescriptor : bDescriptorType     = 0x00000002
  ConfigurationDescriptor : wTotalLength        = 0x00000023
  ConfigurationDescriptor : bNumInterfaces      = 0x00000001
  ConfigurationDescriptor : bConfigurationValue = 0x00000001
  ConfigurationDescriptor : iConfiguration      = 0x00000000
  ConfigurationDescriptor : bmAttributes        = 0x000000c0
  ConfigurationDescriptor : MaxPower            = 0x00000000
  ConfigurationHandle     = 0x81b34258
  Interface[0]: Length            = 56
  Interface[0]: InterfaceNumber   = 0
  Interface[0]: AlternateSetting  = 0
  Interface[0]: Class             = 0x000000ff
  Interface[0]: SubClass          = 0x00000001
  Interface[0]: Protocol          = 0x00000000
  Interface[0]: InterfaceHandle   = 0x81b69c18
  Interface[0]: NumberOfPipes     = 2
  Interface[0]: Pipes[0] : MaximumPacketSize = 0x00000040
  Interface[0]: Pipes[0] : EndpointAddress   = 0x00000081
  Interface[0]: Pipes[0] : Interval          = 0x00000000
  Interface[0]: Pipes[0] : PipeType          = 0x00000002 (UsbdPipeTypeBulk)
  Interface[0]: Pipes[0] : PipeHandle        = 0x81b69c34
  Interface[0]: Pipes[0] : MaxTransferSize   = 0x00001000
  Interface[0]: Pipes[0] : PipeFlags         = 0x00000000
  Interface[0]: Pipes[1] : MaximumPacketSize = 0x00000040
  Interface[0]: Pipes[1] : EndpointAddress   = 0x00000002
  Interface[0]: Pipes[1] : Interval          = 0x00000000
  Interface[0]: Pipes[1] : PipeType          = 0x00000002 (UsbdPipeTypeBulk)
  Interface[0]: Pipes[1] : PipeHandle        = 0x81b69c54
  Interface[0]: Pipes[1] : MaxTransferSize   = 0x00001000
  Interface[0]: Pipes[1] : PipeFlags         = 0x00000000
[97237 ms] UsbSnoop - DispatchAny(f889e610) : IRP_MJ_INTERNAL_DEVICE_CONTROL
[97237 ms] UsbSnoop - MyDispatchInternalIOCTL(f889fe80) : fdo=81d62e08, Irp=8216d228, IRQL=2
[97237 ms]  >>>  URB 4 going down  >>> 
-- URB_FUNCTION_BULK_OR_INTERRUPT_TRANSFER:
  PipeHandle           = 81b69c54 [endpoint 0x00000002]
  TransferFlags        = 00000000 (USBD_TRANSFER_DIRECTION_OUT, ~USBD_SHORT_TRANSFER_OK)
  TransferBufferLength = 00000009
  TransferBuffer       = 00000000
  TransferBufferMDL    = 82155cd8
    00000000: 00 00 00 04 01 00 00 04 00
  UrbLink              = 00000000
[97237 ms] UsbSnoop - MyInternalIOCTLCompletion(f889fdb0) : fido=822cc828, Irp=8216d228, Context=81cded38, IRQL=2
[97237 ms]  <<<  URB 4 coming back  <<< 
-- URB_FUNCTION_BULK_OR_INTERRUPT_TRANSFER:
  PipeHandle           = 81b69c54 [endpoint 0x00000002]
  TransferFlags        = 00000000 (USBD_TRANSFER_DIRECTION_OUT, ~USBD_SHORT_TRANSFER_OK)
  TransferBufferLength = 00000009
  TransferBuffer       = 00000000
  TransferBufferMDL    = 82155cd8
  UrbLink              = 00000000
[97238 ms] UsbSnoop - DispatchAny(f889e610) : IRP_MJ_INTERNAL_DEVICE_CONTROL
[97238 ms] UsbSnoop - MyDispatchInternalIOCTL(f889fe80) : fdo=81d62e08, Irp=8216d228, IRQL=2
[97238 ms]  >>>  URB 5 going down  >>> 
-- URB_FUNCTION_BULK_OR_INTERRUPT_TRANSFER:
  PipeHandle           = 81b69c34 [endpoint 0x00000081]
  TransferFlags        = 00000003 (USBD_TRANSFER_DIRECTION_IN, USBD_SHORT_TRANSFER_OK)
  TransferBufferLength = 00000100
  TransferBuffer       = 00000000
  TransferBufferMDL    = 82155cd8
  UrbLink              = 00000000
[97251 ms] UsbSnoop - MyInternalIOCTLCompletion(f889fdb0) : fido=822cc828, Irp=8216d228, Context=81c6eb68, IRQL=2
[97251 ms]  <<<  URB 5 coming back  <<< 
-- URB_FUNCTION_BULK_OR_INTERRUPT_TRANSFER:
  PipeHandle           = 81b69c34 [endpoint 0x00000081]
  TransferFlags        = 00000003 (USBD_TRANSFER_DIRECTION_IN, USBD_SHORT_TRANSFER_OK)
  TransferBufferLength = 00000009
  TransferBuffer       = 00000000
  TransferBufferMDL    = 82155cd8
    00000000: 00 00 00 04 02 00 00 00 fa
  UrbLink              = 00000000
[97278 ms] UsbSnoop - DispatchAny(f889e610) : IRP_MJ_INTERNAL_DEVICE_CONTROL
[97278 ms] UsbSnoop - MyDispatchInternalIOCTL(f889fe80) : fdo=81d62e08, Irp=8216d228, IRQL=2
[97278 ms]  >>>  URB 6 going down  >>> 
-- URB_FUNCTION_BULK_OR_INTERRUPT_TRANSFER:
  PipeHandle           = 81b69c54 [endpoint 0x00000002]
  TransferFlags        = 00000000 (USBD_TRANSFER_DIRECTION_OUT, ~USBD_SHORT_TRANSFER_OK)
  TransferBufferLength = 00000015
  TransferBuffer       = 00000000
  TransferBufferMDL    = 82155cd8
    00000000: 00 00 00 10 04 00 00 00 0a 00 01 00 03 00 01 00
    00000010: 00 00 00 07 d0
  UrbLink              = 00000000
[97278 ms] UsbSnoop - MyInternalIOCTLCompletion(f889fdb0) : fido=822cc828, Irp=8216d228, Context=81bb8ed8, IRQL=2
[97278 ms]  <<<  URB 6 coming back  <<< 
-- URB_FUNCTION_BULK_OR_INTERRUPT_TRANSFER:
  PipeHandle           = 81b69c54 [endpoint 0x00000002]
  TransferFlags        = 00000000 (USBD_TRANSFER_DIRECTION_OUT, ~USBD_SHORT_TRANSFER_OK)
  TransferBufferLength = 00000015
  TransferBuffer       = 00000000
  TransferBufferMDL    = 82155cd8
  UrbLink              = 00000000
[97287 ms] UsbSnoop - DispatchAny(f889e610) : IRP_MJ_INTERNAL_DEVICE_CONTROL
[97287 ms] UsbSnoop - MyDispatchInternalIOCTL(f889fe80) : fdo=81d62e08, Irp=8216d228, IRQL=2
[97287 ms]  >>>  URB 7 going down  >>> 
-- URB_FUNCTION_BULK_OR_INTERRUPT_TRANSFER:
  PipeHandle           = 81b69c34 [endpoint 0x00000081]
  TransferFlags        = 00000003 (USBD_TRANSFER_DIRECTION_IN, USBD_SHORT_TRANSFER_OK)
  TransferBufferLength = 00000100
  TransferBuffer       = 00000000
  TransferBufferMDL    = 82155cd8
  UrbLink              = 00000000
[97287 ms] UsbSnoop - MyInternalIOCTLCompletion(f889fdb0) : fido=822cc828, Irp=8216d228, Context=81c6eb68, IRQL=2
[97287 ms]  <<<  URB 7 coming back  <<< 
-- URB_FUNCTION_BULK_OR_INTERRUPT_TRANSFER:
  PipeHandle           = 81b69c34 [endpoint 0x00000081]
  TransferFlags        = 00000003 (USBD_TRANSFER_DIRECTION_IN, USBD_SHORT_TRANSFER_OK)
  TransferBufferLength = 00000007
  TransferBuffer       = 00000000
  TransferBufferMDL    = 82155cd8
    00000000: 00 00 00 02 05 e0 00
  UrbLink              = 00000000
[97327 ms] UsbSnoop - DispatchAny(f889e610) : IRP_MJ_INTERNAL_DEVICE_CONTROL
[97327 ms] UsbSnoop - MyDispatchInternalIOCTL(f889fe80) : fdo=81d62e08, Irp=8216d228, IRQL=2
[97327 ms]  >>>  URB 8 going down  >>> 
-- URB_FUNCTION_BULK_OR_INTERRUPT_TRANSFER:
  PipeHandle           = 81b69c34 [endpoint 0x00000081]
  TransferFlags        = 00000003 (USBD_TRANSFER_DIRECTION_IN, USBD_SHORT_TRANSFER_OK)
  TransferBufferLength = 00000100
  TransferBuffer       = 00000000
  TransferBufferMDL    = 82155cd8
  UrbLink              = 00000000
[97327 ms] UsbSnoop - MyInternalIOCTLCompletion(f889fdb0) : fido=822cc828, Irp=8216d228, Context=81b7a858, IRQL=2
[97327 ms]  <<<  URB 8 coming back  <<< 
-- URB_FUNCTION_BULK_OR_INTERRUPT_TRANSFER:
  PipeHandle           = 81b69c34 [endpoint 0x00000081]
  TransferFlags        = 00000003 (USBD_TRANSFER_DIRECTION_IN, USBD_SHORT_TRANSFER_OK)
  TransferBufferLength = 0000000f
  TransferBuffer       = 00000000
  TransferBufferMDL    = 82155cd8
    00000000: 00 00 00 0a 04 00 00 00 04 00 12 00 00 07 d0
  UrbLink              = 00000000
[97367 ms] UsbSnoop - DispatchAny(f889e610) : IRP_MJ_INTERNAL_DEVICE_CONTROL
[97367 ms] UsbSnoop - MyDispatchInternalIOCTL(f889fe80) : fdo=81d62e08, Irp=8216d228, IRQL=2
[97367 ms]  >>>  URB 9 going down  >>> 
-- URB_FUNCTION_BULK_OR_INTERRUPT_TRANSFER:
  PipeHandle           = 81b69c54 [endpoint 0x00000002]
  TransferFlags        = 00000000 (USBD_TRANSFER_DIRECTION_OUT, ~USBD_SHORT_TRANSFER_OK)
  TransferBufferLength = 00000007
  TransferBuffer       = 00000000
  TransferBufferMDL    = 82155cd8
    00000000: 00 00 00 02 05 e0 00
  UrbLink              = 00000000
[97367 ms] UsbSnoop - MyInternalIOCTLCompletion(f889fdb0) : fido=822cc828, Irp=8216d228, Context=81bb7298, IRQL=2
[97367 ms]  <<<  URB 9 coming back  <<< 
-- URB_FUNCTION_BULK_OR_INTERRUPT_TRANSFER:
  PipeHandle           = 81b69c54 [endpoint 0x00000002]
  TransferFlags        = 00000000 (USBD_TRANSFER_DIRECTION_OUT, ~USBD_SHORT_TRANSFER_OK)
  TransferBufferLength = 00000007
  TransferBuffer       = 00000000
  TransferBufferMDL    = 82155cd8
  UrbLink              = 00000000
[97377 ms] UsbSnoop - DispatchAny(f889e610) : IRP_MJ_INTERNAL_DEVICE_CONTROL
[97377 ms] UsbSnoop - MyDispatchInternalIOCTL(f889fe80) : fdo=81d62e08, Irp=8216d228, IRQL=2
[97377 ms]  >>>  URB 10 going down  >>> 
-- URB_FUNCTION_BULK_OR_INTERRUPT_TRANSFER:
  PipeHandle           = 81b69c54 [endpoint 0x00000002]
  TransferFlags        = 00000000 (USBD_TRANSFER_DIRECTION_OUT, ~USBD_SHORT_TRANSFER_OK)
  TransferBufferLength = 0000000f
  TransferBuffer       = 00000000
  TransferBufferMDL    = 82155cd8
    00000000: 00 00 00 0a 04 00 00 00 04 00 07 00 01 00 22
  UrbLink              = 00000000
[97377 ms] UsbSnoop - MyInternalIOCTLCompletion(f889fdb0) : fido=822cc828, Irp=8216d228, Context=81c9b148, IRQL=2
[97377 ms]  <<<  URB 10 coming back  <<< 
-- URB_FUNCTION_BULK_OR_INTERRUPT_TRANSFER:
  PipeHandle           = 81b69c54 [endpoint 0x00000002]
  TransferFlags        = 00000000 (USBD_TRANSFER_DIRECTION_OUT, ~USBD_SHORT_TRANSFER_OK)
  TransferBufferLength = 0000000f
  TransferBuffer       = 00000000
  TransferBufferMDL    = 82155cd8
  UrbLink              = 00000000
[97387 ms] UsbSnoop - DispatchAny(f889e610) : IRP_MJ_INTERNAL_DEVICE_CONTROL
[97387 ms] UsbSnoop - MyDispatchInternalIOCTL(f889fe80) : fdo=81d62e08, Irp=8216d228, IRQL=2
[97387 ms]  >>>  URB 11 going down  >>> 
-- URB_FUNCTION_BULK_OR_INTERRUPT_TRANSFER:
  PipeHandle           = 81b69c34 [endpoint 0x00000081]
  TransferFlags        = 00000003 (USBD_TRANSFER_DIRECTION_IN, USBD_SHORT_TRANSFER_OK)
  TransferBufferLength = 00000100
  TransferBuffer       = 00000000
  TransferBufferMDL    = 82155cd8
  UrbLink              = 00000000
[97390 ms] UsbSnoop - MyInternalIOCTLCompletion(f889fdb0) : fido=822cc828, Irp=8216d228, Context=81bb8ed8, IRQL=2
[97390 ms]  <<<  URB 11 coming back  <<< 
-- URB_FUNCTION_BULK_OR_INTERRUPT_TRANSFER:
  PipeHandle           = 81b69c34 [endpoint 0x00000081]
  TransferFlags        = 00000003 (USBD_TRANSFER_DIRECTION_IN, USBD_SHORT_TRANSFER_OK)
  TransferBufferLength = 00000007
  TransferBuffer       = 00000000
  TransferBufferMDL    = 82155cd8
    00000000: 00 00 00 02 05 e0 00
  UrbLink              = 00000000
[97427 ms] UsbSnoop - DispatchAny(f889e610) : IRP_MJ_INTERNAL_DEVICE_CONTROL
[97427 ms] UsbSnoop - MyDispatchInternalIOCTL(f889fe80) : fdo=81d62e08, Irp=8216d228, IRQL=2
[97427 ms]  >>>  URB 12 going down  >>> 
-- URB_FUNCTION_BULK_OR_INTERRUPT_TRANSFER:
  PipeHandle           = 81b69c34 [endpoint 0x00000081]
  TransferFlags        = 00000003 (USBD_TRANSFER_DIRECTION_IN, USBD_SHORT_TRANSFER_OK)
  TransferBufferLength = 00000100
  TransferBuffer       = 00000000
  TransferBufferMDL    = 82155cd8
  UrbLink              = 00000000
[97428 ms] UsbSnoop - MyInternalIOCTLCompletion(f889fdb0) : fido=822cc828, Irp=8216d228, Context=81bb7298, IRQL=2
[97428 ms]  <<<  URB 12 coming back  <<< 
-- URB_FUNCTION_BULK_OR_INTERRUPT_TRANSFER:
  PipeHandle           = 81b69c34 [endpoint 0x00000081]
  TransferFlags        = 00000003 (USBD_TRANSFER_DIRECTION_IN, USBD_SHORT_TRANSFER_OK)
  TransferBufferLength = 0000000f
  TransferBuffer       = 00000000
  TransferBufferMDL    = 82155cd8
    00000000: 00 00 00 0a 04 00 00 00 04 bb 00 00 01 d4 c0
  UrbLink              = 00000000
[97467 ms] UsbSnoop - DispatchAny(f889e610) : IRP_MJ_INTERNAL_DEVICE_CONTROL
[97467 ms] UsbSnoop - MyDispatchInternalIOCTL(f889fe80) : fdo=81d62e08, Irp=8216d228, IRQL=2
[97467 ms]  >>>  URB 13 going down  >>> 
-- URB_FUNCTION_BULK_OR_INTERRUPT_TRANSFER:
  PipeHandle           = 81b69c54 [endpoint 0x00000002]
  TransferFlags        = 00000000 (USBD_TRANSFER_DIRECTION_OUT, ~USBD_SHORT_TRANSFER_OK)
  TransferBufferLength = 00000007
  TransferBuffer       = 00000000
  TransferBufferMDL    = 82155cd8
    00000000: 00 00 00 02 05 e0 00
  UrbLink              = 00000000
[97468 ms] UsbSnoop - MyInternalIOCTLCompletion(f889fdb0) : fido=822cc828, Irp=8216d228, Context=81c6eb68, IRQL=2
[97468 ms]  <<<  URB 13 coming back  <<< 
-- URB_FUNCTION_BULK_OR_INTERRUPT_TRANSFER:
  PipeHandle           = 81b69c54 [endpoint 0x00000002]
  TransferFlags        = 00000000 (USBD_TRANSFER_DIRECTION_OUT, ~USBD_SHORT_TRANSFER_OK)
  TransferBufferLength = 00000007
  TransferBuffer       = 00000000
  TransferBufferMDL    = 82155cd8
  UrbLink              = 00000000
[97478 ms] UsbSnoop - DispatchAny(f889e610) : IRP_MJ_INTERNAL_DEVICE_CONTROL
[97478 ms] UsbSnoop - MyDispatchInternalIOCTL(f889fe80) : fdo=81d62e08, Irp=8216d228, IRQL=2
[97478 ms]  >>>  URB 14 going down  >>> 
-- URB_FUNCTION_BULK_OR_INTERRUPT_TRANSFER:
  PipeHandle           = 81b69c34 [endpoint 0x00000081]
  TransferFlags        = 00000003 (USBD_TRANSFER_DIRECTION_IN, USBD_SHORT_TRANSFER_OK)
  TransferBufferLength = 00000100
  TransferBuffer       = 00000000
  TransferBufferMDL    = 82155cd8
  UrbLink              = 00000000
[97550 ms] UsbSnoop - MyInternalIOCTLCompletion(f889fdb0) : fido=822cc828, Irp=8216d228, Context=81ceb038, IRQL=2
[97550 ms]  <<<  URB 14 coming back  <<< 
-- URB_FUNCTION_BULK_OR_INTERRUPT_TRANSFER:
  PipeHandle           = 81b69c34 [endpoint 0x00000081]
  TransferFlags        = 00000003 (USBD_TRANSFER_DIRECTION_IN, USBD_SHORT_TRANSFER_OK)
  TransferBufferLength = 000000ff
  TransferBuffer       = 00000000
  TransferBufferMDL    = 82155cd8
    00000000: 00 00 00 fa 03 00 00 03 07 00 08 00 01 00 22 00
    00000010: 03 00 f8 00 00 00 00 00 00 00 00 00 00 00 f8 00
    00000020: 00 00 00 00 00 00 00 00 00 00 f8 00 00 00 00 00
    00000030: 00 00 00 00 00 00 f8 00 00 00 00 00 00 00 00 00
    00000040: 00 00 f8 00 00 00 00 00 00 00 00 00 00 00 f8 00
    00000050: 00 00 00 00 00 00 00 00 00 00 f8 00 00 00 00 00
    00000060: 00 00 00 00 00 00 00 00 00 00 00 00 00 00 00 00
    00000070: 00 00 00 00 00 00 00 00 00 00 00 00 00 00 00 00
    00000080: 00 00 00 00 00 00 00 00 00 00 00 00 00 00 00 00
    00000090: 00 00 00 00 00 00 00 00 00 00 00 00 00 00 00 00
    000000a0: 00 00 00 00 00 00 00 00 00 00 00 00 00 00 00 00
    000000b0: 00 00 00 00 00 00 00 00 00 00 00 00 00 00 00 00
    000000c0: 00 00 00 00 00 00 00 00 00 00 00 00 00 00 00 00
    000000d0: 00 00 00 00 00 00 00 00 00 00 00 00 00 00 00 00
    000000e0: 00 00 00 00 00 00 00 00 00 00 00 00 00 00 00 00
    000000f0: 00 00 00 00 00 00 00 00 00 00 00 00 00 00 00
  UrbLink              = 00000000
[99400 ms] UsbSnoop - DispatchAny(f889e610) : IRP_MJ_INTERNAL_DEVICE_CONTROL
[99400 ms] UsbSnoop - MyDispatchInternalIOCTL(f889fe80) : fdo=81d62e08, Irp=821a52a0, IRQL=2
[99400 ms]  >>>  URB 15 going down  >>> 
-- URB_FUNCTION_BULK_OR_INTERRUPT_TRANSFER:
  PipeHandle           = 81b69c54 [endpoint 0x00000002]
  TransferFlags        = 00000000 (USBD_TRANSFER_DIRECTION_OUT, ~USBD_SHORT_TRANSFER_OK)
  TransferBufferLength = 00000007
  TransferBuffer       = 00000000
  TransferBufferMDL    = 81c55620
    00000000: 00 00 00 02 05 e0 00
  UrbLink              = 00000000
[99400 ms] UsbSnoop - MyInternalIOCTLCompletion(f889fdb0) : fido=822cc828, Irp=821a52a0, Context=81ceb038, IRQL=2
[99400 ms]  <<<  URB 15 coming back  <<< 
-- URB_FUNCTION_BULK_OR_INTERRUPT_TRANSFER:
  PipeHandle           = 81b69c54 [endpoint 0x00000002]
  TransferFlags        = 00000000 (USBD_TRANSFER_DIRECTION_OUT, ~USBD_SHORT_TRANSFER_OK)
  TransferBufferLength = 00000007
  TransferBuffer       = 00000000
  TransferBufferMDL    = 81c55620
  UrbLink              = 00000000
[99401 ms] UsbSnoop - DispatchAny(f889e610) : IRP_MJ_INTERNAL_DEVICE_CONTROL
[99401 ms] UsbSnoop - MyDispatchInternalIOCTL(f889fe80) : fdo=81d62e08, Irp=821a52a0, IRQL=2
[99401 ms]  >>>  URB 16 going down  >>> 
-- URB_FUNCTION_BULK_OR_INTERRUPT_TRANSFER:
  PipeHandle           = 81b69c34 [endpoint 0x00000081]
  TransferFlags        = 00000003 (USBD_TRANSFER_DIRECTION_IN, USBD_SHORT_TRANSFER_OK)
  TransferBufferLength = 00000100
  TransferBuffer       = 00000000
  TransferBufferMDL    = 81c55620
  UrbLink              = 00000000
[99426 ms] UsbSnoop - MyInternalIOCTLCompletion(f889fdb0) : fido=822cc828, Irp=821a52a0, Context=81cded38, IRQL=2
[99426 ms]  <<<  URB 16 coming back  <<< 
-- URB_FUNCTION_BULK_OR_INTERRUPT_TRANSFER:
  PipeHandle           = 81b69c34 [endpoint 0x00000081]
  TransferFlags        = 00000003 (USBD_TRANSFER_DIRECTION_IN, USBD_SHORT_TRANSFER_OK)
  TransferBufferLength = 000000ff
  TransferBuffer       = 00000000
  TransferBufferMDL    = 81c55620
    00000000: 00 00 00 fa 03 00 00 00 00 00 00 00 00 00 00 00
    00000010: 00 00 00 00 00 00 00 00 00 00 00 00 00 00 00 00
    00000020: 00 00 00 00 00 00 00 00 00 00 00 00 00 00 00 00
    00000030: 00 00 00 00 00 00 00 00 00 00 00 00 00 00 00 00
    00000040: 00 00 00 00 00 00 00 00 00 00 00 00 00 00 00 00
    00000050: 00 00 00 00 00 00 00 00 00 00 00 00 00 00 00 00
    00000060: 00 00 00 00 00 00 00 00 00 00 00 00 00 00 00 00
    00000070: 00 00 00 00 00 00 00 00 00 00 00 00 00 00 00 00
    00000080: 00 00 00 00 00 00 00 00 00 00 00 00 00 00 00 00
    00000090: 00 00 00 00 00 00 00 00 00 00 00 00 00 00 00 00
    000000a0: 00 00 00 00 00 00 00 00 00 00 00 00 00 00 00 00
    000000b0: 00 00 00 00 00 00 00 00 00 00 00 00 00 00 00 00
    000000c0: 00 00 00 00 00 00 00 00 00 00 00 00 00 00 00 00
    000000d0: 00 00 00 00 00 00 00 00 00 00 00 00 00 00 00 00
    000000e0: 00 00 00 00 00 00 00 00 00 00 00 00 00 00 00 00
    000000f0: 00 00 00 00 00 00 00 00 00 00 00 00 00 00 00
  UrbLink              = 00000000
[99461 ms] UsbSnoop - DispatchAny(f889e610) : IRP_MJ_INTERNAL_DEVICE_CONTROL
[99461 ms] UsbSnoop - MyDispatchInternalIOCTL(f889fe80) : fdo=81d62e08, Irp=821a52a0, IRQL=2
[99461 ms]  >>>  URB 17 going down  >>> 
-- URB_FUNCTION_BULK_OR_INTERRUPT_TRANSFER:
  PipeHandle           = 81b69c54 [endpoint 0x00000002]
  TransferFlags        = 00000000 (USBD_TRANSFER_DIRECTION_OUT, ~USBD_SHORT_TRANSFER_OK)
  TransferBufferLength = 00000007
  TransferBuffer       = 00000000
  TransferBufferMDL    = 81c55620
    00000000: 00 00 00 02 05 e0 00
  UrbLink              = 00000000
[99461 ms] UsbSnoop - MyInternalIOCTLCompletion(f889fdb0) : fido=822cc828, Irp=821a52a0, Context=81b7a858, IRQL=2
[99461 ms]  <<<  URB 17 coming back  <<< 
-- URB_FUNCTION_BULK_OR_INTERRUPT_TRANSFER:
  PipeHandle           = 81b69c54 [endpoint 0x00000002]
  TransferFlags        = 00000000 (USBD_TRANSFER_DIRECTION_OUT, ~USBD_SHORT_TRANSFER_OK)
  TransferBufferLength = 00000007
  TransferBuffer       = 00000000
  TransferBufferMDL    = 81c55620
  UrbLink              = 00000000
[99471 ms] UsbSnoop - DispatchAny(f889e610) : IRP_MJ_INTERNAL_DEVICE_CONTROL
[99471 ms] UsbSnoop - MyDispatchInternalIOCTL(f889fe80) : fdo=81d62e08, Irp=821a52a0, IRQL=2
[99471 ms]  >>>  URB 18 going down  >>> 
-- URB_FUNCTION_BULK_OR_INTERRUPT_TRANSFER:
  PipeHandle           = 81b69c34 [endpoint 0x00000081]
  TransferFlags        = 00000003 (USBD_TRANSFER_DIRECTION_IN, USBD_SHORT_TRANSFER_OK)
  TransferBufferLength = 00000100
  TransferBuffer       = 00000000
  TransferBufferMDL    = 81c55620
  UrbLink              = 00000000
[99487 ms] UsbSnoop - MyInternalIOCTLCompletion(f889fdb0) : fido=822cc828, Irp=821a52a0, Context=81cded38, IRQL=2
[99487 ms]  <<<  URB 18 coming back  <<< 
-- URB_FUNCTION_BULK_OR_INTERRUPT_TRANSFER:
  PipeHandle           = 81b69c34 [endpoint 0x00000081]
  TransferFlags        = 00000003 (USBD_TRANSFER_DIRECTION_IN, USBD_SHORT_TRANSFER_OK)
  TransferBufferLength = 000000ff
  TransferBuffer       = 00000000
  TransferBufferMDL    = 81c55620
    00000000: 00 00 00 fa 03 00 00 00 00 00 00 00 00 00 00 00
    00000010: 00 00 00 00 00 00 00 00 00 00 00 00 00 00 00 00
    00000020: 00 00 00 00 00 00 00 00 00 00 00 00 00 00 00 00
    00000030: 00 00 00 00 00 00 00 00 00 00 00 00 00 00 00 00
    00000040: 00 00 00 00 00 00 00 00 00 00 00 00 00 00 00 00
    00000050: 00 00 00 00 00 00 00 00 00 00 00 00 00 00 00 00
    00000060: 00 00 00 00 00 00 00 00 00 00 00 00 00 00 00 00
    00000070: 00 00 00 00 00 00 00 00 00 00 00 00 00 00 00 00
    00000080: 00 00 00 00 00 00 00 00 00 00 00 00 00 00 00 00
    00000090: 00 00 00 00 00 00 00 00 00 00 00 00 00 00 00 00
    000000a0: 00 00 00 00 00 00 00 00 00 00 00 00 00 00 00 00
    000000b0: 00 00 00 00 00 00 00 00 00 00 00 00 00 00 00 00
    000000c0: 00 00 00 00 00 00 00 00 00 00 00 00 00 00 00 00
    000000d0: 00 00 00 00 00 00 00 00 00 00 00 00 00 00 00 00
    000000e0: 00 00 00 00 00 00 00 00 00 00 00 00 00 00 00 00
    000000f0: 00 00 00 00 00 00 00 00 00 00 00 00 00 00 00
  UrbLink              = 00000000
[99521 ms] UsbSnoop - DispatchAny(f889e610) : IRP_MJ_INTERNAL_DEVICE_CONTROL
[99521 ms] UsbSnoop - MyDispatchInternalIOCTL(f889fe80) : fdo=81d62e08, Irp=821a52a0, IRQL=2
[99521 ms]  >>>  URB 19 going down  >>> 
-- URB_FUNCTION_BULK_OR_INTERRUPT_TRANSFER:
  PipeHandle           = 81b69c54 [endpoint 0x00000002]
  TransferFlags        = 00000000 (USBD_TRANSFER_DIRECTION_OUT, ~USBD_SHORT_TRANSFER_OK)
  TransferBufferLength = 00000007
  TransferBuffer       = 00000000
  TransferBufferMDL    = 81c55620
    00000000: 00 00 00 02 05 e0 00
  UrbLink              = 00000000
[99521 ms] UsbSnoop - MyInternalIOCTLCompletion(f889fdb0) : fido=822cc828, Irp=821a52a0, Context=81c9b148, IRQL=2
[99521 ms]  <<<  URB 19 coming back  <<< 
-- URB_FUNCTION_BULK_OR_INTERRUPT_TRANSFER:
  PipeHandle           = 81b69c54 [endpoint 0x00000002]
  TransferFlags        = 00000000 (USBD_TRANSFER_DIRECTION_OUT, ~USBD_SHORT_TRANSFER_OK)
  TransferBufferLength = 00000007
  TransferBuffer       = 00000000
  TransferBufferMDL    = 81c55620
  UrbLink              = 00000000
[99531 ms] UsbSnoop - DispatchAny(f889e610) : IRP_MJ_INTERNAL_DEVICE_CONTROL
[99531 ms] UsbSnoop - MyDispatchInternalIOCTL(f889fe80) : fdo=81d62e08, Irp=821a52a0, IRQL=2
[99531 ms]  >>>  URB 20 going down  >>> 
-- URB_FUNCTION_BULK_OR_INTERRUPT_TRANSFER:
  PipeHandle           = 81b69c34 [endpoint 0x00000081]
  TransferFlags        = 00000003 (USBD_TRANSFER_DIRECTION_IN, USBD_SHORT_TRANSFER_OK)
  TransferBufferLength = 00000100
  TransferBuffer       = 00000000
  TransferBufferMDL    = 81c55620
  UrbLink              = 00000000
[99531 ms] UsbSnoop - MyInternalIOCTLCompletion(f889fdb0) : fido=822cc828, Irp=821a52a0, Context=81cded38, IRQL=2
[99531 ms]  <<<  URB 20 coming back  <<< 
-- URB_FUNCTION_BULK_OR_INTERRUPT_TRANSFER:
  PipeHandle           = 81b69c34 [endpoint 0x00000081]
  TransferFlags        = 00000003 (USBD_TRANSFER_DIRECTION_IN, USBD_SHORT_TRANSFER_OK)
  TransferBufferLength = 00000024
  TransferBuffer       = 00000000
  TransferBufferMDL    = 81c55620
    00000000: 00 00 00 1f 04 00 00 00 00 00 00 00 00 00 00 00
    00000010: 00 00 00 00 00 00 00 00 00 00 00 00 00 00 00 00
    00000020: 00 00 00 00
  UrbLink              = 00000000
[99571 ms] UsbSnoop - DispatchAny(f889e610) : IRP_MJ_INTERNAL_DEVICE_CONTROL
[99571 ms] UsbSnoop - MyDispatchInternalIOCTL(f889fe80) : fdo=81d62e08, Irp=821a52a0, IRQL=2
[99571 ms]  >>>  URB 21 going down  >>> 
-- URB_FUNCTION_BULK_OR_INTERRUPT_TRANSFER:
  PipeHandle           = 81b69c54 [endpoint 0x00000002]
  TransferFlags        = 00000000 (USBD_TRANSFER_DIRECTION_OUT, ~USBD_SHORT_TRANSFER_OK)
  TransferBufferLength = 00000007
  TransferBuffer       = 00000000
  TransferBufferMDL    = 81c55620
    00000000: 00 00 00 02 05 e0 00
  UrbLink              = 00000000
[99571 ms] UsbSnoop - MyInternalIOCTLCompletion(f889fdb0) : fido=822cc828, Irp=821a52a0, Context=81ceb038, IRQL=2
[99571 ms]  <<<  URB 21 coming back  <<< 
-- URB_FUNCTION_BULK_OR_INTERRUPT_TRANSFER:
  PipeHandle           = 81b69c54 [endpoint 0x00000002]
  TransferFlags        = 00000000 (USBD_TRANSFER_DIRECTION_OUT, ~USBD_SHORT_TRANSFER_OK)
  TransferBufferLength = 00000007
  TransferBuffer       = 00000000
  TransferBufferMDL    = 81c55620
  UrbLink              = 00000000
[99620 ms] UsbSnoop - DispatchAny(f889e610) : IRP_MJ_INTERNAL_DEVICE_CONTROL
[99620 ms] UsbSnoop - MyDispatchInternalIOCTL(f889fe80) : fdo=81d62e08, Irp=81b81328, IRQL=0
[99620 ms]  >>>  URB 22 going down  >>> 
-- URB_FUNCTION_RESET_PIPE:
  PipeHandle = 81b69c34 [endpoint 0x00000081]
[99621 ms] UsbSnoop - MyInternalIOCTLCompletion(f889fdb0) : fido=00000000, Irp=81b81328, Context=81bb8ed8, IRQL=0
[99621 ms]  <<<  URB 22 coming back  <<< 
-- URB_FUNCTION_RESET_PIPE:
[99621 ms] UsbSnoop - DispatchAny(f889e610) : IRP_MJ_INTERNAL_DEVICE_CONTROL
[99621 ms] UsbSnoop - MyDispatchInternalIOCTL(f889fe80) : fdo=81d62e08, Irp=81b81328, IRQL=0
[99622 ms]  >>>  URB 23 going down  >>> 
-- URB_FUNCTION_RESET_PIPE:
  PipeHandle = 81b69c54 [endpoint 0x00000002]
[99631 ms] UsbSnoop - MyInternalIOCTLCompletion(f889fdb0) : fido=00000000, Irp=81b81328, Context=81c9b148, IRQL=0
[99631 ms]  <<<  URB 23 coming back  <<< 
-- URB_FUNCTION_RESET_PIPE:
[99631 ms] UsbSnoop - DispatchAny(f889e610) : IRP_MJ_INTERNAL_DEVICE_CONTROL
[99631 ms] UsbSnoop - MyDispatchInternalIOCTL(f889fe80) : fdo=81d62e08, Irp=81b81328, IRQL=0
