
T:  Bus=02 Lev=00 Prnt=00 Port=00 Cnt=00 Dev#=  1 Spd=12  MxCh= 3
B:  Alloc=  0/900 us ( 0%), #Int=  1, #Iso=  0
D:  Ver= 1.10 Cls=09(hub  ) Sub=00 Prot=00 MxPS= 8 #Cfgs=  1
P:  Vendor=0000 ProdID=0000 Rev= 2.06
S:  Manufacturer=Linux 2.6.7 ohci_hcd
S:  Product=Silicon Integrated Systems [SiS] USB 1.0 Controller (#2)
S:  SerialNumber=0000:00:02.3
C:* #Ifs= 1 Cfg#= 1 Atr=e0 MxPwr=  0mA
I:  If#= 0 Alt= 0 #EPs= 1 Cls=09(hub  ) Sub=00 Prot=00 Driver=hub
E:  Ad=81(I) Atr=03(Int.) MxPS=   2 Ivl=255ms

T:  Bus=02 Lev=01 Prnt=01 Port=00 Cnt=01 Dev#=  2 Spd=12  MxCh= 4
D:  Ver= 2.00 Cls=09(hub  ) Sub=00 Prot=00 MxPS=64 #Cfgs=  1
P:  Vendor=05e3 ProdID=0660 Rev= 5.07
S:  Product=USB2.0 Hub
C:* #Ifs= 1 Cfg#= 1 Atr=e0 MxPwr=100mA
I:  If#= 0 Alt= 0 #EPs= 1 Cls=09(hub  ) Sub=00 Prot=00 Driver=hub
E:  Ad=81(I) Atr=03(Int.) MxPS=   1 Ivl=255ms

T:  Bus=02 Lev=02 Prnt=02 Port=00 Cnt=01 Dev#= 12 Spd=12  MxCh= 0
D:  Ver= 2.00 Cls=00(>ifc ) Sub=00 Prot=00 MxPS=64 #Cfgs=  1
P:  Vendor=0451 ProdID=e004 Rev= 3.00
S:  Manufacturer=Texas Instruments Incorporated
S:  Product=TI-89 Titanium
C:* #Ifs= 1 Cfg#= 1 Atr=e0 MxPwr=  0mA
I:  If#= 0 Alt= 0 #EPs= 2 Cls=ff(vend.) Sub=01 Prot=00 Driver=(none)
E:  Ad=81(I) Atr=02(Bulk) MxPS=  64 Ivl=0ms
E:  Ad=02(O) Atr=02(Bulk) MxPS=  64 Ivl=0ms

T:  Bus=02 Lev=02 Prnt=02 Port=02 Cnt=02 Dev#= 11 Spd=12  MxCh= 0
D:  Ver= 2.00 Cls=00(>ifc ) Sub=00 Prot=00 MxPS=64 #Cfgs=  1
P:  Vendor=0451 ProdID=e008 Rev= 1.00
S:  Manufacturer=Texas Instruments Incorporated
S:  Product=TI-84 Plus Silver Edition
C:* #Ifs= 1 Cfg#= 1 Atr=e0 MxPwr=  0mA
I:  If#= 0 Alt= 0 #EPs= 2 Cls=ff(vend.) Sub=01 Prot=00 Driver=(none)
E:  Ad=81(I) Atr=02(Bulk) MxPS=  64 Ivl=0ms
E:  Ad=02(O) Atr=02(Bulk) MxPS=  64 Ivl=0ms

T:  Bus=02 Lev=02 Prnt=02 Port=03 Cnt=03 Dev#=  9 Spd=12  MxCh= 0
D:  Ver= 1.10 Cls=00(>ifc ) Sub=00 Prot=00 MxPS= 8 #Cfgs=  1
P:  Vendor=0451 ProdID=e001 Rev= 1.03
S:  Manufacturer=Texas Instruments Incorporated
S:  Product=TI-GRAPH LINK USB
C:* #Ifs= 1 Cfg#= 1 Atr=a0 MxPwr=100mA
I:  If#= 0 Alt= 0 #EPs= 2 Cls=ff(vend.) Sub=00 Prot=00 Driver=(none)
E:  Ad=81(I) Atr=02(Bulk) MxPS=  32 Ivl=0ms
E:  Ad=02(O) Atr=02(Bulk) MxPS=  32 Ivl=0ms

T:  Bus=01 Lev=00 Prnt=00 Port=00 Cnt=00 Dev#=  1 Spd=12  MxCh= 3
B:  Alloc=  0/900 us ( 0%), #Int=  0, #Iso=  0
D:  Ver= 1.10 Cls=09(hub  ) Sub=00 Prot=00 MxPS= 8 #Cfgs=  1
P:  Vendor=0000 ProdID=0000 Rev= 2.06
S:  Manufacturer=Linux 2.6.7 ohci_hcd
S:  Product=Silicon Integrated Systems [SiS] USB 1.0 Controller
S:  SerialNumber=0000:00:02.2
C:* #Ifs= 1 Cfg#= 1 Atr=e0 MxPwr=  0mA
I:  If#= 0 Alt= 0 #EPs= 1 Cls=09(hub  ) Sub=00 Prot=00 Driver=hub
E:  Ad=81(I) Atr=03(Int.) MxPS=   2 Ivl=255ms
